-- @Description Tests that delete with sub transactions
-- 

BEGIN;
BEGIN
SAVEPOINT my_savepoint;
SAVEPOINT
DELETE FROM foo WHERE a < 4;
DELETE 3
SELECT COUNT(*) FROM foo;
 count 
-------
    97
(1 row)

ROLLBACK TO SAVEPOINT my_savepoint;
ROLLBACK
SELECT COUNT(*) FROM foo;
 count 
-------
   100
(1 row)

COMMIT;
COMMIT
BEGIN;
BEGIN
SELECT COUNT(*) FROM foo;
 count 
-------
   100
(1 row)

DELETE FROM foo WHERE a < 10;
DELETE 9
SAVEPOINT my_savepoint2;
SAVEPOINT
SELECT COUNT(*) FROM foo;
 count 
-------
    91
(1 row)

ROLLBACK TO SAVEPOINT my_savepoint2;
ROLLBACK
SELECT COUNT(*) FROM foo;
 count 
-------
    91
(1 row)

COMMIT;
COMMIT
BEGIN;
BEGIN
SELECT COUNT(*) FROM foo;
 count 
-------
    91
(1 row)

SAVEPOINT my_savepoint3;
SAVEPOINT
DELETE FROM foo WHERE a < 20;
DELETE 10
SAVEPOINT my_savepoint4;
SAVEPOINT
SELECT COUNT(*) FROM foo;
 count 
-------
    81
(1 row)

ROLLBACK TO SAVEPOINT my_savepoint3;
ROLLBACK
SELECT COUNT(*) FROM foo;
 count 
-------
    91
(1 row)

COMMIT;
COMMIT

