-- start_ignore
create schema sql_partition_301_350;
set search_path to sql_partition_301_350;
-- end_ignore
-- @author prabhd 
-- @created 2014-04-01 12:00:00
-- @modified 2012-04-01 12:00:00
-- @tags dml MPP-21090 ORCA
-- @optimizer_mode on	
-- @description Tests for MPP-21090
\echo --start_ignore
--start_ignore
\echo --end_ignore
--end_ignore
DROP TABLE IF EXISTS mpp21090_dropcol_addcol_splitpt_dml_decimal;
NOTICE:  table "mpp21090_dropcol_addcol_splitpt_dml_decimal" does not exist, skipping
CREATE TABLE mpp21090_dropcol_addcol_splitpt_dml_decimal
(
    col1 decimal,
    col2 decimal,
    col3 char,
    col4 decimal
) 
DISTRIBUTED by (col1)
PARTITION BY RANGE(col2)(partition partone start(1.00) end(10.00)  WITH (APPENDONLY=true, COMPRESSLEVEL=5, ORIENTATION=column),partition parttwo start(10.00) end(20.00) WITH (APPENDONLY=true, COMPRESSLEVEL=5, ORIENTATION=row),partition partthree start(20.00) end(30.00));
NOTICE:  CREATE TABLE will create partition "mpp21090_dropcol_addcol_splitpt_dml_decimal_1_prt_partone" for table "mpp21090_dropcol_addcol_splitpt_dml_decimal"
NOTICE:  CREATE TABLE will create partition "mpp21090_dropcol_addcol_splitpt_dml_decimal_1_prt_parttwo" for table "mpp21090_dropcol_addcol_splitpt_dml_decimal"
NOTICE:  CREATE TABLE will create partition "mpp21090_dropcol_addcol_splitpt_dml_decimal_1_prt_partthree" for table "mpp21090_dropcol_addcol_splitpt_dml_decimal"
INSERT INTO mpp21090_dropcol_addcol_splitpt_dml_decimal VALUES(2.00,2.00,'a',2.00);
SELECT * FROM mpp21090_dropcol_addcol_splitpt_dml_decimal ORDER BY 1,2,3,4;
 col1 | col2 | col3 | col4 
------+------+------+------
 2.00 | 2.00 | a    | 2.00
(1 row)

ALTER TABLE mpp21090_dropcol_addcol_splitpt_dml_decimal ADD COLUMN col5 int DEFAULT 10;
INSERT INTO mpp21090_dropcol_addcol_splitpt_dml_decimal VALUES(2.00,2.00,'b',2.00,0);
SELECT * FROM mpp21090_dropcol_addcol_splitpt_dml_decimal ORDER BY 1,2,3,4;
 col1 | col2 | col3 | col4 | col5 
------+------+------+------+------
 2.00 | 2.00 | a    | 2.00 |   10
 2.00 | 2.00 | b    | 2.00 |    0
(2 rows)

ALTER TABLE mpp21090_dropcol_addcol_splitpt_dml_decimal DROP COLUMN col4;
INSERT INTO mpp21090_dropcol_addcol_splitpt_dml_decimal VALUES(2.00,2.00,'c',1);
SELECT * FROM mpp21090_dropcol_addcol_splitpt_dml_decimal ORDER BY 1,2,3,4;
 col1 | col2 | col3 | col5 
------+------+------+------
 2.00 | 2.00 | a    |   10
 2.00 | 2.00 | b    |    0
 2.00 | 2.00 | c    |    1
(3 rows)

ALTER TABLE mpp21090_dropcol_addcol_splitpt_dml_decimal SPLIT PARTITION partone at (5.00) into (partition partsplitone,partition partsplitwo);
NOTICE:  exchanged partition "partone" of relation "mpp21090_dropcol_addcol_splitpt_dml_decimal" with relation "pg_temp_633302"
NOTICE:  dropped partition "partone" for relation "mpp21090_dropcol_addcol_splitpt_dml_decimal"
NOTICE:  CREATE TABLE will create partition "mpp21090_dropcol_addcol_splitpt_dml_decimal_1_prt_partsplitone" for table "mpp21090_dropcol_addcol_splitpt_dml_decimal"
NOTICE:  CREATE TABLE will create partition "mpp21090_dropcol_addcol_splitpt_dml_decimal_1_prt_partsplitwo" for table "mpp21090_dropcol_addcol_splitpt_dml_decimal"
INSERT INTO mpp21090_dropcol_addcol_splitpt_dml_decimal SELECT 1.00, 1.00,'d', 1;
SELECT * FROM mpp21090_dropcol_addcol_splitpt_dml_decimal ORDER BY 1,2,3;
 col1 | col2 | col3 | col5 
------+------+------+------
 1.00 | 1.00 | d    |    1
 2.00 | 2.00 | a    |   10
 2.00 | 2.00 | b    |    0
 2.00 | 2.00 | c    |    1
(4 rows)

-- Update distribution key
UPDATE mpp21090_dropcol_addcol_splitpt_dml_decimal SET col1 = 35.00 WHERE col2 = 1.00 AND col1 = 1.00;
SELECT * FROM mpp21090_dropcol_addcol_splitpt_dml_decimal ORDER BY 1,2,3;
 col1  | col2 | col3 | col5 
-------+------+------+------
  2.00 | 2.00 | a    |   10
  2.00 | 2.00 | b    |    0
  2.00 | 2.00 | c    |    1
 35.00 | 1.00 | d    |    1
(4 rows)

-- Update partition key
UPDATE mpp21090_dropcol_addcol_splitpt_dml_decimal SET col2 =2.00  WHERE col2 = 1.00 AND col1 = 35.00;
SELECT * FROM mpp21090_dropcol_addcol_splitpt_dml_decimal ORDER BY 1,2,3;
 col1  | col2 | col3 | col5 
-------+------+------+------
  2.00 | 2.00 | a    |   10
  2.00 | 2.00 | b    |    0
  2.00 | 2.00 | c    |    1
 35.00 | 2.00 | d    |    1
(4 rows)

DELETE FROM mpp21090_dropcol_addcol_splitpt_dml_decimal WHERE col3='b';
SELECT * FROM mpp21090_dropcol_addcol_splitpt_dml_decimal ORDER BY 1,2,3;
 col1  | col2 | col3 | col5 
-------+------+------+------
  2.00 | 2.00 | a    |   10
  2.00 | 2.00 | c    |    1
 35.00 | 2.00 | d    |    1
(3 rows)

-- @author prabhd 
-- @created 2014-04-01 12:00:00
-- @modified 2012-04-01 12:00:00
-- @tags dml MPP-21090 ORCA
-- @optimizer_mode on	
-- @description Tests for MPP-21090
\echo --start_ignore
--start_ignore
\echo --end_ignore
--end_ignore
DROP TABLE IF EXISTS mpp21090_dropcol_addcol_splitpt_dml_float;
NOTICE:  table "mpp21090_dropcol_addcol_splitpt_dml_float" does not exist, skipping
CREATE TABLE mpp21090_dropcol_addcol_splitpt_dml_float
(
    col1 float,
    col2 float,
    col3 char,
    col4 float
) 
DISTRIBUTED by (col1)
PARTITION BY RANGE(col2)(partition partone start(1.00) end(10.00)  WITH (APPENDONLY=true, COMPRESSLEVEL=5, ORIENTATION=column),partition parttwo start(10.00) end(20.00) WITH (APPENDONLY=true, COMPRESSLEVEL=5, ORIENTATION=row),partition partthree start(20.00) end(30.00));
NOTICE:  CREATE TABLE will create partition "mpp21090_dropcol_addcol_splitpt_dml_float_1_prt_partone" for table "mpp21090_dropcol_addcol_splitpt_dml_float"
NOTICE:  CREATE TABLE will create partition "mpp21090_dropcol_addcol_splitpt_dml_float_1_prt_parttwo" for table "mpp21090_dropcol_addcol_splitpt_dml_float"
NOTICE:  CREATE TABLE will create partition "mpp21090_dropcol_addcol_splitpt_dml_float_1_prt_partthree" for table "mpp21090_dropcol_addcol_splitpt_dml_float"
INSERT INTO mpp21090_dropcol_addcol_splitpt_dml_float VALUES(2.00,2.00,'a',2.00);
SELECT * FROM mpp21090_dropcol_addcol_splitpt_dml_float ORDER BY 1,2,3,4;
 col1 | col2 | col3 | col4 
------+------+------+------
    2 |    2 | a    |    2
(1 row)

ALTER TABLE mpp21090_dropcol_addcol_splitpt_dml_float ADD COLUMN col5 int DEFAULT 10;
INSERT INTO mpp21090_dropcol_addcol_splitpt_dml_float VALUES(2.00,2.00,'b',2.00,0);
SELECT * FROM mpp21090_dropcol_addcol_splitpt_dml_float ORDER BY 1,2,3,4;
 col1 | col2 | col3 | col4 | col5 
------+------+------+------+------
    2 |    2 | a    |    2 |   10
    2 |    2 | b    |    2 |    0
(2 rows)

ALTER TABLE mpp21090_dropcol_addcol_splitpt_dml_float DROP COLUMN col4;
INSERT INTO mpp21090_dropcol_addcol_splitpt_dml_float VALUES(2.00,2.00,'c',1);
SELECT * FROM mpp21090_dropcol_addcol_splitpt_dml_float ORDER BY 1,2,3,4;
 col1 | col2 | col3 | col5 
------+------+------+------
    2 |    2 | a    |   10
    2 |    2 | b    |    0
    2 |    2 | c    |    1
(3 rows)

ALTER TABLE mpp21090_dropcol_addcol_splitpt_dml_float SPLIT PARTITION partone at (5.00) into (partition partsplitone,partition partsplitwo);
NOTICE:  exchanged partition "partone" of relation "mpp21090_dropcol_addcol_splitpt_dml_float" with relation "pg_temp_633793"
NOTICE:  dropped partition "partone" for relation "mpp21090_dropcol_addcol_splitpt_dml_float"
NOTICE:  CREATE TABLE will create partition "mpp21090_dropcol_addcol_splitpt_dml_float_1_prt_partsplitone" for table "mpp21090_dropcol_addcol_splitpt_dml_float"
NOTICE:  CREATE TABLE will create partition "mpp21090_dropcol_addcol_splitpt_dml_float_1_prt_partsplitwo" for table "mpp21090_dropcol_addcol_splitpt_dml_float"
INSERT INTO mpp21090_dropcol_addcol_splitpt_dml_float SELECT 1.00, 1.00,'d', 1;
SELECT * FROM mpp21090_dropcol_addcol_splitpt_dml_float ORDER BY 1,2,3;
 col1 | col2 | col3 | col5 
------+------+------+------
    1 |    1 | d    |    1
    2 |    2 | a    |   10
    2 |    2 | b    |    0
    2 |    2 | c    |    1
(4 rows)

-- Update distribution key
UPDATE mpp21090_dropcol_addcol_splitpt_dml_float SET col1 = 35.00 WHERE col2 = 1.00 AND col1 = 1.00;
SELECT * FROM mpp21090_dropcol_addcol_splitpt_dml_float ORDER BY 1,2,3;
 col1 | col2 | col3 | col5 
------+------+------+------
    2 |    2 | a    |   10
    2 |    2 | b    |    0
    2 |    2 | c    |    1
   35 |    1 | d    |    1
(4 rows)

-- Update partition key
UPDATE mpp21090_dropcol_addcol_splitpt_dml_float SET col2 =2.00  WHERE col2 = 1.00 AND col1 = 35.00;
SELECT * FROM mpp21090_dropcol_addcol_splitpt_dml_float ORDER BY 1,2,3;
 col1 | col2 | col3 | col5 
------+------+------+------
    2 |    2 | a    |   10
    2 |    2 | b    |    0
    2 |    2 | c    |    1
   35 |    2 | d    |    1
(4 rows)

DELETE FROM mpp21090_dropcol_addcol_splitpt_dml_float WHERE col3='b';
SELECT * FROM mpp21090_dropcol_addcol_splitpt_dml_float ORDER BY 1,2,3;
 col1 | col2 | col3 | col5 
------+------+------+------
    2 |    2 | a    |   10
    2 |    2 | c    |    1
   35 |    2 | d    |    1
(3 rows)

-- @author prabhd 
-- @created 2014-04-01 12:00:00
-- @modified 2012-04-01 12:00:00
-- @tags dml MPP-21090 ORCA
-- @optimizer_mode on	
-- @description Tests for MPP-21090
\echo --start_ignore
--start_ignore
\echo --end_ignore
--end_ignore
DROP TABLE IF EXISTS mpp21090_dropcol_addcol_splitpt_dml_int;
NOTICE:  table "mpp21090_dropcol_addcol_splitpt_dml_int" does not exist, skipping
CREATE TABLE mpp21090_dropcol_addcol_splitpt_dml_int
(
    col1 int,
    col2 int,
    col3 char,
    col4 int
) 
DISTRIBUTED by (col1)
PARTITION BY RANGE(col2)(partition partone start(1) end(10001) WITH (APPENDONLY=true, COMPRESSLEVEL=5, ORIENTATION=column),partition parttwo start(10001) end(20001) WITH (APPENDONLY=true, COMPRESSLEVEL=5, ORIENTATION=row),partition partthree start(20001) end(30001));
NOTICE:  CREATE TABLE will create partition "mpp21090_dropcol_addcol_splitpt_dml_int_1_prt_partone" for table "mpp21090_dropcol_addcol_splitpt_dml_int"
NOTICE:  CREATE TABLE will create partition "mpp21090_dropcol_addcol_splitpt_dml_int_1_prt_parttwo" for table "mpp21090_dropcol_addcol_splitpt_dml_int"
NOTICE:  CREATE TABLE will create partition "mpp21090_dropcol_addcol_splitpt_dml_int_1_prt_partthree" for table "mpp21090_dropcol_addcol_splitpt_dml_int"
INSERT INTO mpp21090_dropcol_addcol_splitpt_dml_int VALUES(20000,20000,'a',20000);
SELECT * FROM mpp21090_dropcol_addcol_splitpt_dml_int ORDER BY 1,2,3,4;
 col1  | col2  | col3 | col4  
-------+-------+------+-------
 20000 | 20000 | a    | 20000
(1 row)

ALTER TABLE mpp21090_dropcol_addcol_splitpt_dml_int ADD COLUMN col5 int DEFAULT 10;
INSERT INTO mpp21090_dropcol_addcol_splitpt_dml_int VALUES(20000,20000,'b',20000,0);
SELECT * FROM mpp21090_dropcol_addcol_splitpt_dml_int ORDER BY 1,2,3,4;
 col1  | col2  | col3 | col4  | col5 
-------+-------+------+-------+------
 20000 | 20000 | a    | 20000 |   10
 20000 | 20000 | b    | 20000 |    0
(2 rows)

ALTER TABLE mpp21090_dropcol_addcol_splitpt_dml_int DROP COLUMN col4;
INSERT INTO mpp21090_dropcol_addcol_splitpt_dml_int VALUES(20000,20000,'c',1);
SELECT * FROM mpp21090_dropcol_addcol_splitpt_dml_int ORDER BY 1,2,3,4;
 col1  | col2  | col3 | col5 
-------+-------+------+------
 20000 | 20000 | a    |   10
 20000 | 20000 | b    |    0
 20000 | 20000 | c    |    1
(3 rows)

ALTER TABLE mpp21090_dropcol_addcol_splitpt_dml_int SPLIT PARTITION partone at (5000) into (partition partsplitone,partition partsplitwo);
NOTICE:  exchanged partition "partone" of relation "mpp21090_dropcol_addcol_splitpt_dml_int" with relation "pg_temp_634264"
NOTICE:  dropped partition "partone" for relation "mpp21090_dropcol_addcol_splitpt_dml_int"
NOTICE:  CREATE TABLE will create partition "mpp21090_dropcol_addcol_splitpt_dml_int_1_prt_partsplitone" for table "mpp21090_dropcol_addcol_splitpt_dml_int"
NOTICE:  CREATE TABLE will create partition "mpp21090_dropcol_addcol_splitpt_dml_int_1_prt_partsplitwo" for table "mpp21090_dropcol_addcol_splitpt_dml_int"
INSERT INTO mpp21090_dropcol_addcol_splitpt_dml_int SELECT 1000, 1000,'d', 1;
SELECT * FROM mpp21090_dropcol_addcol_splitpt_dml_int ORDER BY 1,2,3;
 col1  | col2  | col3 | col5 
-------+-------+------+------
  1000 |  1000 | d    |    1
 20000 | 20000 | a    |   10
 20000 | 20000 | b    |    0
 20000 | 20000 | c    |    1
(4 rows)

-- Update distribution key
UPDATE mpp21090_dropcol_addcol_splitpt_dml_int SET col1 = 35000 WHERE col2 = 1000 AND col1 = 1000;
SELECT * FROM mpp21090_dropcol_addcol_splitpt_dml_int ORDER BY 1,2,3;
 col1  | col2  | col3 | col5 
-------+-------+------+------
 20000 | 20000 | a    |   10
 20000 | 20000 | b    |    0
 20000 | 20000 | c    |    1
 35000 |  1000 | d    |    1
(4 rows)

-- Update partition key
UPDATE mpp21090_dropcol_addcol_splitpt_dml_int SET col2 =20000  WHERE col2 = 1000 AND col1 = 35000;
SELECT * FROM mpp21090_dropcol_addcol_splitpt_dml_int ORDER BY 1,2,3;
 col1  | col2  | col3 | col5 
-------+-------+------+------
 20000 | 20000 | a    |   10
 20000 | 20000 | b    |    0
 20000 | 20000 | c    |    1
 35000 | 20000 | d    |    1
(4 rows)

DELETE FROM mpp21090_dropcol_addcol_splitpt_dml_int WHERE col3='b';
SELECT * FROM mpp21090_dropcol_addcol_splitpt_dml_int ORDER BY 1,2,3;
 col1  | col2  | col3 | col5 
-------+-------+------+------
 20000 | 20000 | a    |   10
 20000 | 20000 | c    |    1
 35000 | 20000 | d    |    1
(3 rows)

-- @author prabhd 
-- @created 2014-04-01 12:00:00
-- @modified 2012-04-01 12:00:00
-- @tags dml MPP-21090 ORCA
-- @optimizer_mode on	
-- @description Tests for MPP-21090
\echo --start_ignore
--start_ignore
\echo --end_ignore
--end_ignore
DROP TABLE IF EXISTS mpp21090_dropcol_addcol_splitpt_dml_int4;
NOTICE:  table "mpp21090_dropcol_addcol_splitpt_dml_int4" does not exist, skipping
CREATE TABLE mpp21090_dropcol_addcol_splitpt_dml_int4
(
    col1 int4,
    col2 int4,
    col3 char,
    col4 int4
) 
DISTRIBUTED by (col1)
PARTITION BY RANGE(col2)(partition partone start(1) end(100000001)  WITH (APPENDONLY=true, COMPRESSLEVEL=5, ORIENTATION=column),partition parttwo start(100000001) end(200000001) WITH (APPENDONLY=true, COMPRESSLEVEL=5, ORIENTATION=row),partition partthree start(200000001) end(300000001));
NOTICE:  CREATE TABLE will create partition "mpp21090_dropcol_addcol_splitpt_dml_int4_1_prt_partone" for table "mpp21090_dropcol_addcol_splitpt_dml_int4"
NOTICE:  CREATE TABLE will create partition "mpp21090_dropcol_addcol_splitpt_dml_int4_1_prt_parttwo" for table "mpp21090_dropcol_addcol_splitpt_dml_int4"
NOTICE:  CREATE TABLE will create partition "mpp21090_dropcol_addcol_splitpt_dml_int4_1_prt_partthree" for table "mpp21090_dropcol_addcol_splitpt_dml_int4"
INSERT INTO mpp21090_dropcol_addcol_splitpt_dml_int4 VALUES(20000000,20000000,'a',20000000);
SELECT * FROM mpp21090_dropcol_addcol_splitpt_dml_int4 ORDER BY 1,2,3,4;
   col1   |   col2   | col3 |   col4   
----------+----------+------+----------
 20000000 | 20000000 | a    | 20000000
(1 row)

ALTER TABLE mpp21090_dropcol_addcol_splitpt_dml_int4 ADD COLUMN col5 int DEFAULT 10;
INSERT INTO mpp21090_dropcol_addcol_splitpt_dml_int4 VALUES(20000000,20000000,'b',20000000,0);
SELECT * FROM mpp21090_dropcol_addcol_splitpt_dml_int4 ORDER BY 1,2,3,4;
   col1   |   col2   | col3 |   col4   | col5 
----------+----------+------+----------+------
 20000000 | 20000000 | a    | 20000000 |   10
 20000000 | 20000000 | b    | 20000000 |    0
(2 rows)

ALTER TABLE mpp21090_dropcol_addcol_splitpt_dml_int4 DROP COLUMN col4;
INSERT INTO mpp21090_dropcol_addcol_splitpt_dml_int4 VALUES(20000000,20000000,'c',1);
SELECT * FROM mpp21090_dropcol_addcol_splitpt_dml_int4 ORDER BY 1,2,3,4;
   col1   |   col2   | col3 | col5 
----------+----------+------+------
 20000000 | 20000000 | a    |   10
 20000000 | 20000000 | b    |    0
 20000000 | 20000000 | c    |    1
(3 rows)

ALTER TABLE mpp21090_dropcol_addcol_splitpt_dml_int4 SPLIT PARTITION partone at (50000000) into (partition partsplitone,partition partsplitwo);
NOTICE:  exchanged partition "partone" of relation "mpp21090_dropcol_addcol_splitpt_dml_int4" with relation "pg_temp_634735"
NOTICE:  dropped partition "partone" for relation "mpp21090_dropcol_addcol_splitpt_dml_int4"
NOTICE:  CREATE TABLE will create partition "mpp21090_dropcol_addcol_splitpt_dml_int4_1_prt_partsplitone" for table "mpp21090_dropcol_addcol_splitpt_dml_int4"
NOTICE:  CREATE TABLE will create partition "mpp21090_dropcol_addcol_splitpt_dml_int4_1_prt_partsplitwo" for table "mpp21090_dropcol_addcol_splitpt_dml_int4"
INSERT INTO mpp21090_dropcol_addcol_splitpt_dml_int4 SELECT 10000000, 10000000,'d', 1;
SELECT * FROM mpp21090_dropcol_addcol_splitpt_dml_int4 ORDER BY 1,2,3;
   col1   |   col2   | col3 | col5 
----------+----------+------+------
 10000000 | 10000000 | d    |    1
 20000000 | 20000000 | a    |   10
 20000000 | 20000000 | b    |    0
 20000000 | 20000000 | c    |    1
(4 rows)

-- Update distribution key
UPDATE mpp21090_dropcol_addcol_splitpt_dml_int4 SET col1 = 35000000 WHERE col2 = 10000000 AND col1 = 10000000;
SELECT * FROM mpp21090_dropcol_addcol_splitpt_dml_int4 ORDER BY 1,2,3;
   col1   |   col2   | col3 | col5 
----------+----------+------+------
 20000000 | 20000000 | a    |   10
 20000000 | 20000000 | b    |    0
 20000000 | 20000000 | c    |    1
 35000000 | 10000000 | d    |    1
(4 rows)

-- Update partition key
UPDATE mpp21090_dropcol_addcol_splitpt_dml_int4 SET col2 =20000000  WHERE col2 = 10000000 AND col1 = 35000000;
SELECT * FROM mpp21090_dropcol_addcol_splitpt_dml_int4 ORDER BY 1,2,3;
   col1   |   col2   | col3 | col5 
----------+----------+------+------
 20000000 | 20000000 | a    |   10
 20000000 | 20000000 | b    |    0
 20000000 | 20000000 | c    |    1
 35000000 | 20000000 | d    |    1
(4 rows)

DELETE FROM mpp21090_dropcol_addcol_splitpt_dml_int4 WHERE col3='b';
SELECT * FROM mpp21090_dropcol_addcol_splitpt_dml_int4 ORDER BY 1,2,3;
   col1   |   col2   | col3 | col5 
----------+----------+------+------
 20000000 | 20000000 | a    |   10
 20000000 | 20000000 | c    |    1
 35000000 | 20000000 | d    |    1
(3 rows)

-- @author prabhd 
-- @created 2014-04-01 12:00:00
-- @modified 2012-04-01 12:00:00
-- @tags dml MPP-21090 ORCA
-- @optimizer_mode on	
-- @description Tests for MPP-21090
\echo --start_ignore
--start_ignore
\echo --end_ignore
--end_ignore
DROP TABLE IF EXISTS mpp21090_dropcol_addcol_splitpt_dml_int8;
NOTICE:  table "mpp21090_dropcol_addcol_splitpt_dml_int8" does not exist, skipping
CREATE TABLE mpp21090_dropcol_addcol_splitpt_dml_int8
(
    col1 int8,
    col2 int8,
    col3 char,
    col4 int8
) 
DISTRIBUTED by (col1)
PARTITION BY RANGE(col2)(partition partone start(1) end(1000000000000000001)  WITH (APPENDONLY=true, COMPRESSLEVEL=5, ORIENTATION=column),partition parttwo start(1000000000000000001) end(2000000000000000001) WITH (APPENDONLY=true, COMPRESSLEVEL=5, ORIENTATION=row),partition partthree start(2000000000000000001) end(3000000000000000001));
NOTICE:  CREATE TABLE will create partition "mpp21090_dropcol_addcol_splitpt_dml_int8_1_prt_partone" for table "mpp21090_dropcol_addcol_splitpt_dml_int8"
NOTICE:  CREATE TABLE will create partition "mpp21090_dropcol_addcol_splitpt_dml_int8_1_prt_parttwo" for table "mpp21090_dropcol_addcol_splitpt_dml_int8"
NOTICE:  CREATE TABLE will create partition "mpp21090_dropcol_addcol_splitpt_dml_int8_1_prt_partthree" for table "mpp21090_dropcol_addcol_splitpt_dml_int8"
INSERT INTO mpp21090_dropcol_addcol_splitpt_dml_int8 VALUES(2000000000000000000,2000000000000000000,'a',2000000000000000000);
SELECT * FROM mpp21090_dropcol_addcol_splitpt_dml_int8 ORDER BY 1,2,3,4;
        col1         |        col2         | col3 |        col4         
---------------------+---------------------+------+---------------------
 2000000000000000000 | 2000000000000000000 | a    | 2000000000000000000
(1 row)

ALTER TABLE mpp21090_dropcol_addcol_splitpt_dml_int8 ADD COLUMN col5 int DEFAULT 10;
INSERT INTO mpp21090_dropcol_addcol_splitpt_dml_int8 VALUES(2000000000000000000,2000000000000000000,'b',2000000000000000000,0);
SELECT * FROM mpp21090_dropcol_addcol_splitpt_dml_int8 ORDER BY 1,2,3,4;
        col1         |        col2         | col3 |        col4         | col5 
---------------------+---------------------+------+---------------------+------
 2000000000000000000 | 2000000000000000000 | a    | 2000000000000000000 |   10
 2000000000000000000 | 2000000000000000000 | b    | 2000000000000000000 |    0
(2 rows)

ALTER TABLE mpp21090_dropcol_addcol_splitpt_dml_int8 DROP COLUMN col4;
INSERT INTO mpp21090_dropcol_addcol_splitpt_dml_int8 VALUES(2000000000000000000,2000000000000000000,'c',1);
SELECT * FROM mpp21090_dropcol_addcol_splitpt_dml_int8 ORDER BY 1,2,3,4;
        col1         |        col2         | col3 | col5 
---------------------+---------------------+------+------
 2000000000000000000 | 2000000000000000000 | a    |   10
 2000000000000000000 | 2000000000000000000 | b    |    0
 2000000000000000000 | 2000000000000000000 | c    |    1
(3 rows)

ALTER TABLE mpp21090_dropcol_addcol_splitpt_dml_int8 SPLIT PARTITION partone at (500000000000000000) into (partition partsplitone,partition partsplitwo);
NOTICE:  exchanged partition "partone" of relation "mpp21090_dropcol_addcol_splitpt_dml_int8" with relation "pg_temp_635206"
NOTICE:  dropped partition "partone" for relation "mpp21090_dropcol_addcol_splitpt_dml_int8"
NOTICE:  CREATE TABLE will create partition "mpp21090_dropcol_addcol_splitpt_dml_int8_1_prt_partsplitone" for table "mpp21090_dropcol_addcol_splitpt_dml_int8"
NOTICE:  CREATE TABLE will create partition "mpp21090_dropcol_addcol_splitpt_dml_int8_1_prt_partsplitwo" for table "mpp21090_dropcol_addcol_splitpt_dml_int8"
INSERT INTO mpp21090_dropcol_addcol_splitpt_dml_int8 SELECT 100000000000000000, 100000000000000000,'d', 1;
SELECT * FROM mpp21090_dropcol_addcol_splitpt_dml_int8 ORDER BY 1,2,3;
        col1         |        col2         | col3 | col5 
---------------------+---------------------+------+------
  100000000000000000 |  100000000000000000 | d    |    1
 2000000000000000000 | 2000000000000000000 | a    |   10
 2000000000000000000 | 2000000000000000000 | b    |    0
 2000000000000000000 | 2000000000000000000 | c    |    1
(4 rows)

-- Update distribution key
UPDATE mpp21090_dropcol_addcol_splitpt_dml_int8 SET col1 = 3500000000000000000 WHERE col2 = 100000000000000000 AND col1 = 100000000000000000;
SELECT * FROM mpp21090_dropcol_addcol_splitpt_dml_int8 ORDER BY 1,2,3;
        col1         |        col2         | col3 | col5 
---------------------+---------------------+------+------
 2000000000000000000 | 2000000000000000000 | a    |   10
 2000000000000000000 | 2000000000000000000 | b    |    0
 2000000000000000000 | 2000000000000000000 | c    |    1
 3500000000000000000 |  100000000000000000 | d    |    1
(4 rows)

-- Update partition key
UPDATE mpp21090_dropcol_addcol_splitpt_dml_int8 SET col2 =2000000000000000000  WHERE col2 = 100000000000000000 AND col1 = 3500000000000000000;
SELECT * FROM mpp21090_dropcol_addcol_splitpt_dml_int8 ORDER BY 1,2,3;
        col1         |        col2         | col3 | col5 
---------------------+---------------------+------+------
 2000000000000000000 | 2000000000000000000 | a    |   10
 2000000000000000000 | 2000000000000000000 | b    |    0
 2000000000000000000 | 2000000000000000000 | c    |    1
 3500000000000000000 | 2000000000000000000 | d    |    1
(4 rows)

DELETE FROM mpp21090_dropcol_addcol_splitpt_dml_int8 WHERE col3='b';
SELECT * FROM mpp21090_dropcol_addcol_splitpt_dml_int8 ORDER BY 1,2,3;
        col1         |        col2         | col3 | col5 
---------------------+---------------------+------+------
 2000000000000000000 | 2000000000000000000 | a    |   10
 2000000000000000000 | 2000000000000000000 | c    |    1
 3500000000000000000 | 2000000000000000000 | d    |    1
(3 rows)

-- @author prabhd 
-- @created 2014-04-01 12:00:00
-- @modified 2012-04-01 12:00:00
-- @tags dml MPP-21090 ORCA
-- @optimizer_mode on	
-- @description Tests for MPP-21090
\echo --start_ignore
--start_ignore
\echo --end_ignore
--end_ignore
DROP TABLE IF EXISTS mpp21090_dropcol_addcol_splitpt_dml_interval;
NOTICE:  table "mpp21090_dropcol_addcol_splitpt_dml_interval" does not exist, skipping
CREATE TABLE mpp21090_dropcol_addcol_splitpt_dml_interval
(
    col1 interval,
    col2 interval,
    col3 char,
    col4 interval
) 
DISTRIBUTED by (col1)
PARTITION BY RANGE(col2)(partition partone start('1 sec') end('1 min')  WITH (APPENDONLY=true, COMPRESSLEVEL=5, ORIENTATION=column),partition parttwo start('1 min') end('1 hour') WITH (APPENDONLY=true, COMPRESSLEVEL=5, ORIENTATION=row),partition partthree start('1 hour') end('12 hours'));
NOTICE:  CREATE TABLE will create partition "mpp21090_dropcol_addcol_splitpt_dml_interval_1_prt_partone" for table "mpp21090_dropcol_addcol_splitpt_dml_interval"
NOTICE:  CREATE TABLE will create partition "mpp21090_dropcol_addcol_splitpt_dml_interval_1_prt_parttwo" for table "mpp21090_dropcol_addcol_splitpt_dml_interval"
NOTICE:  CREATE TABLE will create partition "mpp21090_dropcol_addcol_splitpt_dml_interval_1_prt_partthree" for table "mpp21090_dropcol_addcol_splitpt_dml_interval"
INSERT INTO mpp21090_dropcol_addcol_splitpt_dml_interval VALUES('1 hour','1 hour','a','1 hour');
SELECT * FROM mpp21090_dropcol_addcol_splitpt_dml_interval ORDER BY 1,2,3,4;
   col1   |   col2   | col3 |   col4   
----------+----------+------+----------
 @ 1 hour | @ 1 hour | a    | @ 1 hour
(1 row)

ALTER TABLE mpp21090_dropcol_addcol_splitpt_dml_interval ADD COLUMN col5 int DEFAULT 10;
INSERT INTO mpp21090_dropcol_addcol_splitpt_dml_interval VALUES('1 hour','1 hour','b','1 hour',0);
SELECT * FROM mpp21090_dropcol_addcol_splitpt_dml_interval ORDER BY 1,2,3,4;
   col1   |   col2   | col3 |   col4   | col5 
----------+----------+------+----------+------
 @ 1 hour | @ 1 hour | a    | @ 1 hour |   10
 @ 1 hour | @ 1 hour | b    | @ 1 hour |    0
(2 rows)

ALTER TABLE mpp21090_dropcol_addcol_splitpt_dml_interval DROP COLUMN col4;
INSERT INTO mpp21090_dropcol_addcol_splitpt_dml_interval VALUES('1 hour','1 hour','c',1);
SELECT * FROM mpp21090_dropcol_addcol_splitpt_dml_interval ORDER BY 1,2,3,4;
   col1   |   col2   | col3 | col5 
----------+----------+------+------
 @ 1 hour | @ 1 hour | a    |   10
 @ 1 hour | @ 1 hour | b    |    0
 @ 1 hour | @ 1 hour | c    |    1
(3 rows)

ALTER TABLE mpp21090_dropcol_addcol_splitpt_dml_interval SPLIT PARTITION partone at ('30 secs') into (partition partsplitone,partition partsplitwo);
NOTICE:  exchanged partition "partone" of relation "mpp21090_dropcol_addcol_splitpt_dml_interval" with relation "pg_temp_635677"
NOTICE:  dropped partition "partone" for relation "mpp21090_dropcol_addcol_splitpt_dml_interval"
NOTICE:  CREATE TABLE will create partition "mpp21090_dropcol_addcol_splitpt_dml_interval_1_prt_partsplitone" for table "mpp21090_dropcol_addcol_splitpt_dml_interval"
NOTICE:  CREATE TABLE will create partition "mpp21090_dropcol_addcol_splitpt_dml_interval_1_prt_partsplitwo" for table "mpp21090_dropcol_addcol_splitpt_dml_interval"
INSERT INTO mpp21090_dropcol_addcol_splitpt_dml_interval SELECT '1 sec', '1 sec','d', 1;
SELECT * FROM mpp21090_dropcol_addcol_splitpt_dml_interval ORDER BY 1,2,3;
   col1   |   col2   | col3 | col5 
----------+----------+------+------
 @ 1 sec  | @ 1 sec  | d    |    1
 @ 1 hour | @ 1 hour | a    |   10
 @ 1 hour | @ 1 hour | b    |    0
 @ 1 hour | @ 1 hour | c    |    1
(4 rows)

-- Update distribution key
UPDATE mpp21090_dropcol_addcol_splitpt_dml_interval SET col1 = '14 hours' WHERE col2 = '1 sec' AND col1 = '1 sec';
SELECT * FROM mpp21090_dropcol_addcol_splitpt_dml_interval ORDER BY 1,2,3;
    col1    |   col2   | col3 | col5 
------------+----------+------+------
 @ 1 hour   | @ 1 hour | a    |   10
 @ 1 hour   | @ 1 hour | b    |    0
 @ 1 hour   | @ 1 hour | c    |    1
 @ 14 hours | @ 1 sec  | d    |    1
(4 rows)

-- Update partition key
UPDATE mpp21090_dropcol_addcol_splitpt_dml_interval SET col2 ='1 hour'  WHERE col2 = '1 sec' AND col1 = '14 hours';
SELECT * FROM mpp21090_dropcol_addcol_splitpt_dml_interval ORDER BY 1,2,3;
    col1    |   col2   | col3 | col5 
------------+----------+------+------
 @ 1 hour   | @ 1 hour | a    |   10
 @ 1 hour   | @ 1 hour | b    |    0
 @ 1 hour   | @ 1 hour | c    |    1
 @ 14 hours | @ 1 hour | d    |    1
(4 rows)

DELETE FROM mpp21090_dropcol_addcol_splitpt_dml_interval WHERE col3='b';
SELECT * FROM mpp21090_dropcol_addcol_splitpt_dml_interval ORDER BY 1,2,3;
    col1    |   col2   | col3 | col5 
------------+----------+------+------
 @ 1 hour   | @ 1 hour | a    |   10
 @ 1 hour   | @ 1 hour | c    |    1
 @ 14 hours | @ 1 hour | d    |    1
(3 rows)

-- @author prabhd 
-- @created 2014-04-01 12:00:00
-- @modified 2012-04-01 12:00:00
-- @tags dml MPP-21090 ORCA
-- @optimizer_mode on	
-- @description Tests for MPP-21090
\echo --start_ignore
--start_ignore
\echo --end_ignore
--end_ignore
DROP TABLE IF EXISTS mpp21090_dropcol_addcol_splitpt_dml_numeric;
NOTICE:  table "mpp21090_dropcol_addcol_splitpt_dml_numeric" does not exist, skipping
CREATE TABLE mpp21090_dropcol_addcol_splitpt_dml_numeric
(
    col1 numeric,
    col2 numeric,
    col3 char,
    col4 numeric
) 
DISTRIBUTED by (col1)
PARTITION BY RANGE(col2)(partition partone start(1.000000) end(10.000000)  WITH (APPENDONLY=true, COMPRESSLEVEL=5, ORIENTATION=column),partition parttwo start(10.000000) end(20.000000) WITH (APPENDONLY=true, COMPRESSLEVEL=5, ORIENTATION=row),partition partthree start(20.000000) end(30.000000));
NOTICE:  CREATE TABLE will create partition "mpp21090_dropcol_addcol_splitpt_dml_numeric_1_prt_partone" for table "mpp21090_dropcol_addcol_splitpt_dml_numeric"
NOTICE:  CREATE TABLE will create partition "mpp21090_dropcol_addcol_splitpt_dml_numeric_1_prt_parttwo" for table "mpp21090_dropcol_addcol_splitpt_dml_numeric"
NOTICE:  CREATE TABLE will create partition "mpp21090_dropcol_addcol_splitpt_dml_numeric_1_prt_partthree" for table "mpp21090_dropcol_addcol_splitpt_dml_numeric"
INSERT INTO mpp21090_dropcol_addcol_splitpt_dml_numeric VALUES(2.000000,2.000000,'a',2.000000);
SELECT * FROM mpp21090_dropcol_addcol_splitpt_dml_numeric ORDER BY 1,2,3,4;
   col1   |   col2   | col3 |   col4   
----------+----------+------+----------
 2.000000 | 2.000000 | a    | 2.000000
(1 row)

ALTER TABLE mpp21090_dropcol_addcol_splitpt_dml_numeric ADD COLUMN col5 int DEFAULT 10;
INSERT INTO mpp21090_dropcol_addcol_splitpt_dml_numeric VALUES(2.000000,2.000000,'b',2.000000,0);
SELECT * FROM mpp21090_dropcol_addcol_splitpt_dml_numeric ORDER BY 1,2,3,4;
   col1   |   col2   | col3 |   col4   | col5 
----------+----------+------+----------+------
 2.000000 | 2.000000 | a    | 2.000000 |   10
 2.000000 | 2.000000 | b    | 2.000000 |    0
(2 rows)

ALTER TABLE mpp21090_dropcol_addcol_splitpt_dml_numeric DROP COLUMN col4;
INSERT INTO mpp21090_dropcol_addcol_splitpt_dml_numeric VALUES(2.000000,2.000000,'c',1);
SELECT * FROM mpp21090_dropcol_addcol_splitpt_dml_numeric ORDER BY 1,2,3,4;
   col1   |   col2   | col3 | col5 
----------+----------+------+------
 2.000000 | 2.000000 | a    |   10
 2.000000 | 2.000000 | b    |    0
 2.000000 | 2.000000 | c    |    1
(3 rows)

ALTER TABLE mpp21090_dropcol_addcol_splitpt_dml_numeric SPLIT PARTITION partone at (5.000000) into (partition partsplitone,partition partsplitwo);
NOTICE:  exchanged partition "partone" of relation "mpp21090_dropcol_addcol_splitpt_dml_numeric" with relation "pg_temp_636148"
NOTICE:  dropped partition "partone" for relation "mpp21090_dropcol_addcol_splitpt_dml_numeric"
NOTICE:  CREATE TABLE will create partition "mpp21090_dropcol_addcol_splitpt_dml_numeric_1_prt_partsplitone" for table "mpp21090_dropcol_addcol_splitpt_dml_numeric"
NOTICE:  CREATE TABLE will create partition "mpp21090_dropcol_addcol_splitpt_dml_numeric_1_prt_partsplitwo" for table "mpp21090_dropcol_addcol_splitpt_dml_numeric"
INSERT INTO mpp21090_dropcol_addcol_splitpt_dml_numeric SELECT 1.000000, 1.000000,'d', 1;
SELECT * FROM mpp21090_dropcol_addcol_splitpt_dml_numeric ORDER BY 1,2,3;
   col1   |   col2   | col3 | col5 
----------+----------+------+------
 1.000000 | 1.000000 | d    |    1
 2.000000 | 2.000000 | a    |   10
 2.000000 | 2.000000 | b    |    0
 2.000000 | 2.000000 | c    |    1
(4 rows)

-- Update distribution key
UPDATE mpp21090_dropcol_addcol_splitpt_dml_numeric SET col1 = 35.000000 WHERE col2 = 1.000000 AND col1 = 1.000000;
SELECT * FROM mpp21090_dropcol_addcol_splitpt_dml_numeric ORDER BY 1,2,3;
   col1    |   col2   | col3 | col5 
-----------+----------+------+------
  2.000000 | 2.000000 | a    |   10
  2.000000 | 2.000000 | b    |    0
  2.000000 | 2.000000 | c    |    1
 35.000000 | 1.000000 | d    |    1
(4 rows)

-- Update partition key
UPDATE mpp21090_dropcol_addcol_splitpt_dml_numeric SET col2 =2.000000  WHERE col2 = 1.000000 AND col1 = 35.000000;
SELECT * FROM mpp21090_dropcol_addcol_splitpt_dml_numeric ORDER BY 1,2,3;
   col1    |   col2   | col3 | col5 
-----------+----------+------+------
  2.000000 | 2.000000 | a    |   10
  2.000000 | 2.000000 | b    |    0
  2.000000 | 2.000000 | c    |    1
 35.000000 | 2.000000 | d    |    1
(4 rows)

DELETE FROM mpp21090_dropcol_addcol_splitpt_dml_numeric WHERE col3='b';
SELECT * FROM mpp21090_dropcol_addcol_splitpt_dml_numeric ORDER BY 1,2,3;
   col1    |   col2   | col3 | col5 
-----------+----------+------+------
  2.000000 | 2.000000 | a    |   10
  2.000000 | 2.000000 | c    |    1
 35.000000 | 2.000000 | d    |    1
(3 rows)

-- @author prabhd 
-- @created 2014-04-01 12:00:00
-- @modified 2012-04-01 12:00:00
-- @tags dml MPP-21090 ORCA
-- @optimizer_mode on	
-- @description Tests for MPP-21090
\echo --start_ignore
--start_ignore
\echo --end_ignore
--end_ignore
DROP TABLE IF EXISTS mpp21090_dropcol_addcol_splitpt_dml_time;
NOTICE:  table "mpp21090_dropcol_addcol_splitpt_dml_time" does not exist, skipping
CREATE TABLE mpp21090_dropcol_addcol_splitpt_dml_time
(
    col1 time,
    col2 time,
    col3 char,
    col4 time
) 
DISTRIBUTED by (col1)
PARTITION BY RANGE(col2)(partition partone start('12:00:00') end('18:00:00')  WITH (APPENDONLY=true, COMPRESSLEVEL=5, ORIENTATION=column),partition parttwo start('18:00:00') end('24:00:00') WITH (APPENDONLY=true, COMPRESSLEVEL=5, ORIENTATION=row),partition partthree start('0:00:00') end('11:00:00'));
NOTICE:  CREATE TABLE will create partition "mpp21090_dropcol_addcol_splitpt_dml_time_1_prt_partthree" for table "mpp21090_dropcol_addcol_splitpt_dml_time"
NOTICE:  CREATE TABLE will create partition "mpp21090_dropcol_addcol_splitpt_dml_time_1_prt_partone" for table "mpp21090_dropcol_addcol_splitpt_dml_time"
NOTICE:  CREATE TABLE will create partition "mpp21090_dropcol_addcol_splitpt_dml_time_1_prt_parttwo" for table "mpp21090_dropcol_addcol_splitpt_dml_time"
INSERT INTO mpp21090_dropcol_addcol_splitpt_dml_time VALUES('12:00:00','12:00:00','a','12:00:00');
SELECT * FROM mpp21090_dropcol_addcol_splitpt_dml_time ORDER BY 1,2,3,4;
   col1   |   col2   | col3 |   col4   
----------+----------+------+----------
 12:00:00 | 12:00:00 | a    | 12:00:00
(1 row)

ALTER TABLE mpp21090_dropcol_addcol_splitpt_dml_time ADD COLUMN col5 int DEFAULT 10;
INSERT INTO mpp21090_dropcol_addcol_splitpt_dml_time VALUES('12:00:00','12:00:00','b','12:00:00',0);
SELECT * FROM mpp21090_dropcol_addcol_splitpt_dml_time ORDER BY 1,2,3,4;
   col1   |   col2   | col3 |   col4   | col5 
----------+----------+------+----------+------
 12:00:00 | 12:00:00 | a    | 12:00:00 |   10
 12:00:00 | 12:00:00 | b    | 12:00:00 |    0
(2 rows)

ALTER TABLE mpp21090_dropcol_addcol_splitpt_dml_time DROP COLUMN col4;
INSERT INTO mpp21090_dropcol_addcol_splitpt_dml_time VALUES('12:00:00','12:00:00','c',1);
SELECT * FROM mpp21090_dropcol_addcol_splitpt_dml_time ORDER BY 1,2,3,4;
   col1   |   col2   | col3 | col5 
----------+----------+------+------
 12:00:00 | 12:00:00 | a    |   10
 12:00:00 | 12:00:00 | b    |    0
 12:00:00 | 12:00:00 | c    |    1
(3 rows)

ALTER TABLE mpp21090_dropcol_addcol_splitpt_dml_time SPLIT PARTITION partone at ('15:00:00') into (partition partsplitone,partition partsplitwo);
NOTICE:  exchanged partition "partone" of relation "mpp21090_dropcol_addcol_splitpt_dml_time" with relation "pg_temp_636639"
NOTICE:  dropped partition "partone" for relation "mpp21090_dropcol_addcol_splitpt_dml_time"
NOTICE:  CREATE TABLE will create partition "mpp21090_dropcol_addcol_splitpt_dml_time_1_prt_partsplitone" for table "mpp21090_dropcol_addcol_splitpt_dml_time"
NOTICE:  CREATE TABLE will create partition "mpp21090_dropcol_addcol_splitpt_dml_time_1_prt_partsplitwo" for table "mpp21090_dropcol_addcol_splitpt_dml_time"
INSERT INTO mpp21090_dropcol_addcol_splitpt_dml_time SELECT '12:00:00', '12:00:00','d', 1;
SELECT * FROM mpp21090_dropcol_addcol_splitpt_dml_time ORDER BY 1,2,3;
   col1   |   col2   | col3 | col5 
----------+----------+------+------
 12:00:00 | 12:00:00 | a    |   10
 12:00:00 | 12:00:00 | b    |    0
 12:00:00 | 12:00:00 | c    |    1
 12:00:00 | 12:00:00 | d    |    1
(4 rows)

-- Update distribution key
UPDATE mpp21090_dropcol_addcol_splitpt_dml_time SET col1 = '11:30:00' WHERE col2 = '12:00:00' AND col1 = '12:00:00';
SELECT * FROM mpp21090_dropcol_addcol_splitpt_dml_time ORDER BY 1,2,3;
   col1   |   col2   | col3 | col5 
----------+----------+------+------
 11:30:00 | 12:00:00 | a    |   10
 11:30:00 | 12:00:00 | b    |    0
 11:30:00 | 12:00:00 | c    |    1
 11:30:00 | 12:00:00 | d    |    1
(4 rows)

-- Update partition key
UPDATE mpp21090_dropcol_addcol_splitpt_dml_time SET col2 ='12:00:00'  WHERE col2 = '12:00:00' AND col1 = '11:30:00';
SELECT * FROM mpp21090_dropcol_addcol_splitpt_dml_time ORDER BY 1,2,3;
   col1   |   col2   | col3 | col5 
----------+----------+------+------
 11:30:00 | 12:00:00 | a    |   10
 11:30:00 | 12:00:00 | b    |    0
 11:30:00 | 12:00:00 | c    |    1
 11:30:00 | 12:00:00 | d    |    1
(4 rows)

DELETE FROM mpp21090_dropcol_addcol_splitpt_dml_time WHERE col3='b';
SELECT * FROM mpp21090_dropcol_addcol_splitpt_dml_time ORDER BY 1,2,3;
   col1   |   col2   | col3 | col5 
----------+----------+------+------
 11:30:00 | 12:00:00 | a    |   10
 11:30:00 | 12:00:00 | c    |    1
 11:30:00 | 12:00:00 | d    |    1
(3 rows)

-- @author prabhd 
-- @created 2014-04-01 12:00:00
-- @modified 2012-04-01 12:00:00
-- @tags dml MPP-21090 ORCA
-- @optimizer_mode on	
-- @description Tests for MPP-21090
\echo --start_ignore
--start_ignore
\echo --end_ignore
--end_ignore
DROP TABLE IF EXISTS mpp21090_dropcol_addcol_splitpt_dml_timestamp;
NOTICE:  table "mpp21090_dropcol_addcol_splitpt_dml_timestamp" does not exist, skipping
CREATE TABLE mpp21090_dropcol_addcol_splitpt_dml_timestamp
(
    col1 timestamp,
    col2 timestamp,
    col3 char,
    col4 timestamp
) 
DISTRIBUTED by (col1)
PARTITION BY RANGE(col2)(partition partone start('2013-12-01 12:00:00') end('2013-12-31 12:00:00') WITH(APPENDONLY=true, COMPRESSLEVEL=5, ORIENTATION=column),partition parttwo start('2013-12-31 12:00:00') end('2014-01-01 12:00:00') inclusive WITH (APPENDONLY=true, COMPRESSLEVEL=5, ORIENTATION=row),partition partthree start('2014-01-02 12:00:00') end('2014-02-01 12:00:00'));
NOTICE:  CREATE TABLE will create partition "mpp21090_dropcol_addcol_splitpt_dml_timestamp_1_prt_partone" for table "mpp21090_dropcol_addcol_splitpt_dml_timestamp"
NOTICE:  CREATE TABLE will create partition "mpp21090_dropcol_addcol_splitpt_dml_timestamp_1_prt_parttwo" for table "mpp21090_dropcol_addcol_splitpt_dml_timestamp"
NOTICE:  CREATE TABLE will create partition "mpp21090_dropcol_addcol_splitpt_dml_timestamp_1_prt_partthree" for table "mpp21090_dropcol_addcol_splitpt_dml_timestamp"
INSERT INTO mpp21090_dropcol_addcol_splitpt_dml_timestamp VALUES('2013-12-31 12:00:00','2013-12-31 12:00:00','a','2013-12-31 12:00:00');
SELECT * FROM mpp21090_dropcol_addcol_splitpt_dml_timestamp ORDER BY 1,2,3,4;
           col1           |           col2           | col3 |           col4           
--------------------------+--------------------------+------+--------------------------
 Tue Dec 31 12:00:00 2013 | Tue Dec 31 12:00:00 2013 | a    | Tue Dec 31 12:00:00 2013
(1 row)

ALTER TABLE mpp21090_dropcol_addcol_splitpt_dml_timestamp ADD COLUMN col5 int DEFAULT 10;
INSERT INTO mpp21090_dropcol_addcol_splitpt_dml_timestamp VALUES('2013-12-31 12:00:00','2013-12-31 12:00:00','b','2013-12-31 12:00:00',0);
SELECT * FROM mpp21090_dropcol_addcol_splitpt_dml_timestamp ORDER BY 1,2,3,4;
           col1           |           col2           | col3 |           col4           | col5 
--------------------------+--------------------------+------+--------------------------+------
 Tue Dec 31 12:00:00 2013 | Tue Dec 31 12:00:00 2013 | a    | Tue Dec 31 12:00:00 2013 |   10
 Tue Dec 31 12:00:00 2013 | Tue Dec 31 12:00:00 2013 | b    | Tue Dec 31 12:00:00 2013 |    0
(2 rows)

ALTER TABLE mpp21090_dropcol_addcol_splitpt_dml_timestamp DROP COLUMN col4;
INSERT INTO mpp21090_dropcol_addcol_splitpt_dml_timestamp VALUES('2013-12-31 12:00:00','2013-12-31 12:00:00','c',1);
SELECT * FROM mpp21090_dropcol_addcol_splitpt_dml_timestamp ORDER BY 1,2,3,4;
           col1           |           col2           | col3 | col5 
--------------------------+--------------------------+------+------
 Tue Dec 31 12:00:00 2013 | Tue Dec 31 12:00:00 2013 | a    |   10
 Tue Dec 31 12:00:00 2013 | Tue Dec 31 12:00:00 2013 | b    |    0
 Tue Dec 31 12:00:00 2013 | Tue Dec 31 12:00:00 2013 | c    |    1
(3 rows)

ALTER TABLE mpp21090_dropcol_addcol_splitpt_dml_timestamp SPLIT PARTITION partone at ('2013-12-15 12:00:00') into (partition partsplitone,partition partsplitwo);
NOTICE:  exchanged partition "partone" of relation "mpp21090_dropcol_addcol_splitpt_dml_timestamp" with relation "pg_temp_637110"
NOTICE:  dropped partition "partone" for relation "mpp21090_dropcol_addcol_splitpt_dml_timestamp"
NOTICE:  CREATE TABLE will create partition "mpp21090_dropcol_addcol_splitpt_dml_timestam_1_prt_partsplitone" for table "mpp21090_dropcol_addcol_splitpt_dml_timestamp"
NOTICE:  CREATE TABLE will create partition "mpp21090_dropcol_addcol_splitpt_dml_timestamp_1_prt_partsplitwo" for table "mpp21090_dropcol_addcol_splitpt_dml_timestamp"
INSERT INTO mpp21090_dropcol_addcol_splitpt_dml_timestamp SELECT '2013-12-01 12:00:00', '2013-12-01 12:00:00','d', 1;
SELECT * FROM mpp21090_dropcol_addcol_splitpt_dml_timestamp ORDER BY 1,2,3;
           col1           |           col2           | col3 | col5 
--------------------------+--------------------------+------+------
 Sun Dec 01 12:00:00 2013 | Sun Dec 01 12:00:00 2013 | d    |    1
 Tue Dec 31 12:00:00 2013 | Tue Dec 31 12:00:00 2013 | a    |   10
 Tue Dec 31 12:00:00 2013 | Tue Dec 31 12:00:00 2013 | b    |    0
 Tue Dec 31 12:00:00 2013 | Tue Dec 31 12:00:00 2013 | c    |    1
(4 rows)

-- Update distribution key
UPDATE mpp21090_dropcol_addcol_splitpt_dml_timestamp SET col1 = '2014-02-10 12:00:00' WHERE col2 = '2013-12-01 12:00:00' AND col1 = '2013-12-01 12:00:00';
SELECT * FROM mpp21090_dropcol_addcol_splitpt_dml_timestamp ORDER BY 1,2,3;
           col1           |           col2           | col3 | col5 
--------------------------+--------------------------+------+------
 Tue Dec 31 12:00:00 2013 | Tue Dec 31 12:00:00 2013 | a    |   10
 Tue Dec 31 12:00:00 2013 | Tue Dec 31 12:00:00 2013 | b    |    0
 Tue Dec 31 12:00:00 2013 | Tue Dec 31 12:00:00 2013 | c    |    1
 Mon Feb 10 12:00:00 2014 | Sun Dec 01 12:00:00 2013 | d    |    1
(4 rows)

-- Update partition key
UPDATE mpp21090_dropcol_addcol_splitpt_dml_timestamp SET col2 ='2013-12-31 12:00:00'  WHERE col2 = '2013-12-01 12:00:00' AND col1 = '2014-02-10 12:00:00';
SELECT * FROM mpp21090_dropcol_addcol_splitpt_dml_timestamp ORDER BY 1,2,3;
           col1           |           col2           | col3 | col5 
--------------------------+--------------------------+------+------
 Tue Dec 31 12:00:00 2013 | Tue Dec 31 12:00:00 2013 | a    |   10
 Tue Dec 31 12:00:00 2013 | Tue Dec 31 12:00:00 2013 | b    |    0
 Tue Dec 31 12:00:00 2013 | Tue Dec 31 12:00:00 2013 | c    |    1
 Mon Feb 10 12:00:00 2014 | Tue Dec 31 12:00:00 2013 | d    |    1
(4 rows)

DELETE FROM mpp21090_dropcol_addcol_splitpt_dml_timestamp WHERE col3='b';
SELECT * FROM mpp21090_dropcol_addcol_splitpt_dml_timestamp ORDER BY 1,2,3;
           col1           |           col2           | col3 | col5 
--------------------------+--------------------------+------+------
 Tue Dec 31 12:00:00 2013 | Tue Dec 31 12:00:00 2013 | a    |   10
 Tue Dec 31 12:00:00 2013 | Tue Dec 31 12:00:00 2013 | c    |    1
 Mon Feb 10 12:00:00 2014 | Tue Dec 31 12:00:00 2013 | d    |    1
(3 rows)

-- @author prabhd 
-- @created 2014-04-01 12:00:00
-- @modified 2012-04-01 12:00:00
-- @tags dml MPP-21090 ORCA
-- @optimizer_mode on	
-- @description Tests for MPP-21090
\echo --start_ignore
--start_ignore
\echo --end_ignore
--end_ignore
DROP TABLE IF EXISTS mpp21090_dropcol_addcol_splitpt_dml_timestamptz;
NOTICE:  table "mpp21090_dropcol_addcol_splitpt_dml_timestamptz" does not exist, skipping
CREATE TABLE mpp21090_dropcol_addcol_splitpt_dml_timestamptz
(
    col1 timestamptz,
    col2 timestamptz,
    col3 char,
    col4 timestamptz
) 
DISTRIBUTED by (col1)
PARTITION BY RANGE(col2)(partition partone start('2013-12-01 12:00:00 PST') end('2013-12-31 12:00:00 PST') WITH(APPENDONLY=true, COMPRESSLEVEL=5, ORIENTATION=column),partition parttwo start('2013-12-31 12:00:00 PST') end('2014-01-01 12:00:00 PST') WITH (APPENDONLY=true, COMPRESSLEVEL=5, ORIENTATION=row),partition partthree start('2014-01-01 12:00:00 PST') end('2014-02-01 12:00:00 PST'));
NOTICE:  CREATE TABLE will create partition "mpp21090_dropcol_addcol_splitpt_dml_timestamptz_1_prt_partone" for table "mpp21090_dropcol_addcol_splitpt_dml_timestamptz"
NOTICE:  CREATE TABLE will create partition "mpp21090_dropcol_addcol_splitpt_dml_timestamptz_1_prt_parttwo" for table "mpp21090_dropcol_addcol_splitpt_dml_timestamptz"
NOTICE:  CREATE TABLE will create partition "mpp21090_dropcol_addcol_splitpt_dml_timestamptz_1_prt_partthree" for table "mpp21090_dropcol_addcol_splitpt_dml_timestamptz"
INSERT INTO mpp21090_dropcol_addcol_splitpt_dml_timestamptz VALUES('2013-12-31 12:00:00 PST','2013-12-31 12:00:00 PST','a','2013-12-31 12:00:00 PST');
SELECT * FROM mpp21090_dropcol_addcol_splitpt_dml_timestamptz ORDER BY 1,2,3,4;
             col1             |             col2             | col3 |             col4             
------------------------------+------------------------------+------+------------------------------
 Tue Dec 31 12:00:00 2013 PST | Tue Dec 31 12:00:00 2013 PST | a    | Tue Dec 31 12:00:00 2013 PST
(1 row)

ALTER TABLE mpp21090_dropcol_addcol_splitpt_dml_timestamptz ADD COLUMN col5 int DEFAULT 10;
INSERT INTO mpp21090_dropcol_addcol_splitpt_dml_timestamptz VALUES('2013-12-31 12:00:00 PST','2013-12-31 12:00:00 PST','b','2013-12-31 12:00:00 PST',0);
SELECT * FROM mpp21090_dropcol_addcol_splitpt_dml_timestamptz ORDER BY 1,2,3,4;
             col1             |             col2             | col3 |             col4             | col5 
------------------------------+------------------------------+------+------------------------------+------
 Tue Dec 31 12:00:00 2013 PST | Tue Dec 31 12:00:00 2013 PST | a    | Tue Dec 31 12:00:00 2013 PST |   10
 Tue Dec 31 12:00:00 2013 PST | Tue Dec 31 12:00:00 2013 PST | b    | Tue Dec 31 12:00:00 2013 PST |    0
(2 rows)

ALTER TABLE mpp21090_dropcol_addcol_splitpt_dml_timestamptz DROP COLUMN col4;
INSERT INTO mpp21090_dropcol_addcol_splitpt_dml_timestamptz VALUES('2013-12-31 12:00:00 PST','2013-12-31 12:00:00 PST','c',1);
SELECT * FROM mpp21090_dropcol_addcol_splitpt_dml_timestamptz ORDER BY 1,2,3,4;
             col1             |             col2             | col3 | col5 
------------------------------+------------------------------+------+------
 Tue Dec 31 12:00:00 2013 PST | Tue Dec 31 12:00:00 2013 PST | a    |   10
 Tue Dec 31 12:00:00 2013 PST | Tue Dec 31 12:00:00 2013 PST | b    |    0
 Tue Dec 31 12:00:00 2013 PST | Tue Dec 31 12:00:00 2013 PST | c    |    1
(3 rows)

ALTER TABLE mpp21090_dropcol_addcol_splitpt_dml_timestamptz SPLIT PARTITION partone at ('2013-12-15 12:00:00 PST') into (partition partsplitone,partition partsplitwo);
NOTICE:  exchanged partition "partone" of relation "mpp21090_dropcol_addcol_splitpt_dml_timestamptz" with relation "pg_temp_637581"
NOTICE:  dropped partition "partone" for relation "mpp21090_dropcol_addcol_splitpt_dml_timestamptz"
NOTICE:  CREATE TABLE will create partition "mpp21090_dropcol_addcol_splitpt_dml_timesta_1_prt_partsplitone1" for table "mpp21090_dropcol_addcol_splitpt_dml_timestamptz"
NOTICE:  CREATE TABLE will create partition "mpp21090_dropcol_addcol_splitpt_dml_timestam_1_prt_partsplitwo1" for table "mpp21090_dropcol_addcol_splitpt_dml_timestamptz"
INSERT INTO mpp21090_dropcol_addcol_splitpt_dml_timestamptz SELECT '2013-12-01 12:00:00 PST', '2013-12-01 12:00:00 PST','d', 1;
SELECT * FROM mpp21090_dropcol_addcol_splitpt_dml_timestamptz ORDER BY 1,2,3;
             col1             |             col2             | col3 | col5 
------------------------------+------------------------------+------+------
 Sun Dec 01 12:00:00 2013 PST | Sun Dec 01 12:00:00 2013 PST | d    |    1
 Tue Dec 31 12:00:00 2013 PST | Tue Dec 31 12:00:00 2013 PST | a    |   10
 Tue Dec 31 12:00:00 2013 PST | Tue Dec 31 12:00:00 2013 PST | b    |    0
 Tue Dec 31 12:00:00 2013 PST | Tue Dec 31 12:00:00 2013 PST | c    |    1
(4 rows)

-- Update distribution key
UPDATE mpp21090_dropcol_addcol_splitpt_dml_timestamptz SET col1 = '2014-02-10 12:00:00 PST' WHERE col2 = '2013-12-01 12:00:00 PST' AND col1 = '2013-12-01 12:00:00 PST';
SELECT * FROM mpp21090_dropcol_addcol_splitpt_dml_timestamptz ORDER BY 1,2,3;
             col1             |             col2             | col3 | col5 
------------------------------+------------------------------+------+------
 Tue Dec 31 12:00:00 2013 PST | Tue Dec 31 12:00:00 2013 PST | a    |   10
 Tue Dec 31 12:00:00 2013 PST | Tue Dec 31 12:00:00 2013 PST | b    |    0
 Tue Dec 31 12:00:00 2013 PST | Tue Dec 31 12:00:00 2013 PST | c    |    1
 Mon Feb 10 12:00:00 2014 PST | Sun Dec 01 12:00:00 2013 PST | d    |    1
(4 rows)

-- Update partition key
UPDATE mpp21090_dropcol_addcol_splitpt_dml_timestamptz SET col2 ='2013-12-31 12:00:00 PST'  WHERE col2 = '2013-12-01 12:00:00 PST' AND col1 = '2014-02-10 12:00:00 PST';
SELECT * FROM mpp21090_dropcol_addcol_splitpt_dml_timestamptz ORDER BY 1,2,3;
             col1             |             col2             | col3 | col5 
------------------------------+------------------------------+------+------
 Tue Dec 31 12:00:00 2013 PST | Tue Dec 31 12:00:00 2013 PST | a    |   10
 Tue Dec 31 12:00:00 2013 PST | Tue Dec 31 12:00:00 2013 PST | b    |    0
 Tue Dec 31 12:00:00 2013 PST | Tue Dec 31 12:00:00 2013 PST | c    |    1
 Mon Feb 10 12:00:00 2014 PST | Tue Dec 31 12:00:00 2013 PST | d    |    1
(4 rows)

DELETE FROM mpp21090_dropcol_addcol_splitpt_dml_timestamptz WHERE col3='b';
SELECT * FROM mpp21090_dropcol_addcol_splitpt_dml_timestamptz ORDER BY 1,2,3;
             col1             |             col2             | col3 | col5 
------------------------------+------------------------------+------+------
 Tue Dec 31 12:00:00 2013 PST | Tue Dec 31 12:00:00 2013 PST | a    |   10
 Tue Dec 31 12:00:00 2013 PST | Tue Dec 31 12:00:00 2013 PST | c    |    1
 Mon Feb 10 12:00:00 2014 PST | Tue Dec 31 12:00:00 2013 PST | d    |    1
(3 rows)

-- @author prabhd 
-- @created 2014-04-01 12:00:00
-- @modified 2012-04-01 12:00:00
-- @tags dml MPP-21090 ORCA
-- @optimizer_mode on	
-- @description Tests for MPP-21090
\echo --start_ignore
--start_ignore
\echo --end_ignore
--end_ignore
DROP TABLE IF EXISTS mpp21090_dropcol_splitdefpt_addcol_dml_char;
NOTICE:  table "mpp21090_dropcol_splitdefpt_addcol_dml_char" does not exist, skipping
CREATE TABLE mpp21090_dropcol_splitdefpt_addcol_dml_char
(
    col1 char,
    col2 char,
    col3 char,
    col4 char
) 
DISTRIBUTED by (col1)
PARTITION BY LIST(col2)
(
default partition def
);
NOTICE:  CREATE TABLE will create partition "mpp21090_dropcol_splitdefpt_addcol_dml_char_1_prt_def" for table "mpp21090_dropcol_splitdefpt_addcol_dml_char"
INSERT INTO mpp21090_dropcol_splitdefpt_addcol_dml_char VALUES('x','x','a','x');
SELECT * FROM mpp21090_dropcol_splitdefpt_addcol_dml_char ORDER BY 1,2,3,4;
 col1 | col2 | col3 | col4 
------+------+------+------
 x    | x    | a    | x
(1 row)

ALTER TABLE mpp21090_dropcol_splitdefpt_addcol_dml_char DROP COLUMN col4;
INSERT INTO mpp21090_dropcol_splitdefpt_addcol_dml_char VALUES('x','x','b');
SELECT * FROM mpp21090_dropcol_splitdefpt_addcol_dml_char ORDER BY 1,2,3;
 col1 | col2 | col3 
------+------+------
 x    | x    | a
 x    | x    | b
(2 rows)

ALTER TABLE mpp21090_dropcol_splitdefpt_addcol_dml_char SPLIT DEFAULT PARTITION at ('d') into (partition partsplitone,partition def);
NOTICE:  exchanged partition "def" of relation "mpp21090_dropcol_splitdefpt_addcol_dml_char" with relation "pg_temp_638052"
NOTICE:  dropped partition "def" for relation "mpp21090_dropcol_splitdefpt_addcol_dml_char"
NOTICE:  CREATE TABLE will create partition "mpp21090_dropcol_splitdefpt_addcol_dml_char_1_prt_partsplitone" for table "mpp21090_dropcol_splitdefpt_addcol_dml_char"
NOTICE:  CREATE TABLE will create partition "mpp21090_dropcol_splitdefpt_addcol_dml_char_1_prt_def" for table "mpp21090_dropcol_splitdefpt_addcol_dml_char"
INSERT INTO mpp21090_dropcol_splitdefpt_addcol_dml_char SELECT 'a', 'a','e';
SELECT * FROM mpp21090_dropcol_splitdefpt_addcol_dml_char ORDER BY 1,2,3;
 col1 | col2 | col3 
------+------+------
 a    | a    | e
 x    | x    | a
 x    | x    | b
(3 rows)

ALTER TABLE mpp21090_dropcol_splitdefpt_addcol_dml_char ADD COLUMN col5 char DEFAULT 'x';
INSERT INTO mpp21090_dropcol_splitdefpt_addcol_dml_char VALUES('x','x','c','x');
SELECT * FROM mpp21090_dropcol_splitdefpt_addcol_dml_char ORDER BY 1,2,3,4;
 col1 | col2 | col3 | col5 
------+------+------+------
 a    | a    | e    | x
 x    | x    | a    | x
 x    | x    | b    | x
 x    | x    | c    | x
(4 rows)

-- Update distribution key
UPDATE mpp21090_dropcol_splitdefpt_addcol_dml_char SET col1 = 'z' WHERE col2 = 'a' AND col1 = 'a';
SELECT * FROM mpp21090_dropcol_splitdefpt_addcol_dml_char ORDER BY 1,2,3;
 col1 | col2 | col3 | col5 
------+------+------+------
 x    | x    | a    | x
 x    | x    | b    | x
 x    | x    | c    | x
 z    | a    | e    | x
(4 rows)

-- Update partition key
UPDATE mpp21090_dropcol_splitdefpt_addcol_dml_char SET col2 = 'z' WHERE col2 = 'a' AND col1 = 'z';
SELECT * FROM mpp21090_dropcol_splitdefpt_addcol_dml_char ORDER BY 1,2,3;
 col1 | col2 | col3 | col5 
------+------+------+------
 x    | x    | a    | x
 x    | x    | b    | x
 x    | x    | c    | x
 z    | z    | e    | x
(4 rows)

DELETE FROM mpp21090_dropcol_splitdefpt_addcol_dml_char WHERE col3='b';
SELECT * FROM mpp21090_dropcol_splitdefpt_addcol_dml_char ORDER BY 1,2,3;
 col1 | col2 | col3 | col5 
------+------+------+------
 x    | x    | a    | x
 x    | x    | c    | x
 z    | z    | e    | x
(3 rows)

-- @author prabhd 
-- @created 2014-04-01 12:00:00
-- @modified 2012-04-01 12:00:00
-- @tags dml MPP-21090 ORCA
-- @optimizer_mode on	
-- @description Tests for MPP-21090
\echo --start_ignore
--start_ignore
\echo --end_ignore
--end_ignore
DROP TABLE IF EXISTS mpp21090_dropcol_splitdefpt_addcol_dml_date;
NOTICE:  table "mpp21090_dropcol_splitdefpt_addcol_dml_date" does not exist, skipping
CREATE TABLE mpp21090_dropcol_splitdefpt_addcol_dml_date
(
    col1 date,
    col2 date,
    col3 char,
    col4 date
) 
DISTRIBUTED by (col1)
PARTITION BY LIST(col2)
(
default partition def
);
NOTICE:  CREATE TABLE will create partition "mpp21090_dropcol_splitdefpt_addcol_dml_date_1_prt_def" for table "mpp21090_dropcol_splitdefpt_addcol_dml_date"
INSERT INTO mpp21090_dropcol_splitdefpt_addcol_dml_date VALUES('2013-12-31','2013-12-31','a','2013-12-31');
SELECT * FROM mpp21090_dropcol_splitdefpt_addcol_dml_date ORDER BY 1,2,3,4;
    col1    |    col2    | col3 |    col4    
------------+------------+------+------------
 12-31-2013 | 12-31-2013 | a    | 12-31-2013
(1 row)

ALTER TABLE mpp21090_dropcol_splitdefpt_addcol_dml_date DROP COLUMN col4;
INSERT INTO mpp21090_dropcol_splitdefpt_addcol_dml_date VALUES('2013-12-31','2013-12-31','b');
SELECT * FROM mpp21090_dropcol_splitdefpt_addcol_dml_date ORDER BY 1,2,3;
    col1    |    col2    | col3 
------------+------------+------
 12-31-2013 | 12-31-2013 | a
 12-31-2013 | 12-31-2013 | b
(2 rows)

ALTER TABLE mpp21090_dropcol_splitdefpt_addcol_dml_date SPLIT DEFAULT PARTITION at ('2013-12-15') into (partition partsplitone,partition def);
NOTICE:  exchanged partition "def" of relation "mpp21090_dropcol_splitdefpt_addcol_dml_date" with relation "pg_temp_638405"
NOTICE:  dropped partition "def" for relation "mpp21090_dropcol_splitdefpt_addcol_dml_date"
NOTICE:  CREATE TABLE will create partition "mpp21090_dropcol_splitdefpt_addcol_dml_date_1_prt_partsplitone" for table "mpp21090_dropcol_splitdefpt_addcol_dml_date"
NOTICE:  CREATE TABLE will create partition "mpp21090_dropcol_splitdefpt_addcol_dml_date_1_prt_def" for table "mpp21090_dropcol_splitdefpt_addcol_dml_date"
INSERT INTO mpp21090_dropcol_splitdefpt_addcol_dml_date SELECT '2013-12-01', '2013-12-01','e';
SELECT * FROM mpp21090_dropcol_splitdefpt_addcol_dml_date ORDER BY 1,2,3;
    col1    |    col2    | col3 
------------+------------+------
 12-01-2013 | 12-01-2013 | e
 12-31-2013 | 12-31-2013 | a
 12-31-2013 | 12-31-2013 | b
(3 rows)

ALTER TABLE mpp21090_dropcol_splitdefpt_addcol_dml_date ADD COLUMN col5 date DEFAULT '2013-12-31';
INSERT INTO mpp21090_dropcol_splitdefpt_addcol_dml_date VALUES('2013-12-31','2013-12-31','c','2013-12-31');
SELECT * FROM mpp21090_dropcol_splitdefpt_addcol_dml_date ORDER BY 1,2,3,4;
    col1    |    col2    | col3 |    col5    
------------+------------+------+------------
 12-01-2013 | 12-01-2013 | e    | 12-31-2013
 12-31-2013 | 12-31-2013 | a    | 12-31-2013
 12-31-2013 | 12-31-2013 | b    | 12-31-2013
 12-31-2013 | 12-31-2013 | c    | 12-31-2013
(4 rows)

-- Update distribution key
UPDATE mpp21090_dropcol_splitdefpt_addcol_dml_date SET col1 = '2014-02-10' WHERE col2 = '2013-12-01' AND col1 = '2013-12-01';
SELECT * FROM mpp21090_dropcol_splitdefpt_addcol_dml_date ORDER BY 1,2,3;
    col1    |    col2    | col3 |    col5    
------------+------------+------+------------
 12-31-2013 | 12-31-2013 | a    | 12-31-2013
 12-31-2013 | 12-31-2013 | b    | 12-31-2013
 12-31-2013 | 12-31-2013 | c    | 12-31-2013
 02-10-2014 | 12-01-2013 | e    | 12-31-2013
(4 rows)

-- Update partition key
UPDATE mpp21090_dropcol_splitdefpt_addcol_dml_date SET col2 = '2014-02-10' WHERE col2 = '2013-12-01' AND col1 = '2014-02-10';
SELECT * FROM mpp21090_dropcol_splitdefpt_addcol_dml_date ORDER BY 1,2,3;
    col1    |    col2    | col3 |    col5    
------------+------------+------+------------
 12-31-2013 | 12-31-2013 | a    | 12-31-2013
 12-31-2013 | 12-31-2013 | b    | 12-31-2013
 12-31-2013 | 12-31-2013 | c    | 12-31-2013
 02-10-2014 | 02-10-2014 | e    | 12-31-2013
(4 rows)

DELETE FROM mpp21090_dropcol_splitdefpt_addcol_dml_date WHERE col3='b';
SELECT * FROM mpp21090_dropcol_splitdefpt_addcol_dml_date ORDER BY 1,2,3;
    col1    |    col2    | col3 |    col5    
------------+------------+------+------------
 12-31-2013 | 12-31-2013 | a    | 12-31-2013
 12-31-2013 | 12-31-2013 | c    | 12-31-2013
 02-10-2014 | 02-10-2014 | e    | 12-31-2013
(3 rows)

-- @author prabhd 
-- @created 2014-04-01 12:00:00
-- @modified 2012-04-01 12:00:00
-- @tags dml MPP-21090 ORCA
-- @optimizer_mode on	
-- @description Tests for MPP-21090
\echo --start_ignore
--start_ignore
\echo --end_ignore
--end_ignore
DROP TABLE IF EXISTS mpp21090_dropcol_splitdefpt_addcol_dml_decimal;
NOTICE:  table "mpp21090_dropcol_splitdefpt_addcol_dml_decimal" does not exist, skipping
CREATE TABLE mpp21090_dropcol_splitdefpt_addcol_dml_decimal
(
    col1 decimal,
    col2 decimal,
    col3 char,
    col4 decimal
) 
DISTRIBUTED by (col1)
PARTITION BY LIST(col2)
(
default partition def
);
NOTICE:  CREATE TABLE will create partition "mpp21090_dropcol_splitdefpt_addcol_dml_decimal_1_prt_def" for table "mpp21090_dropcol_splitdefpt_addcol_dml_decimal"
INSERT INTO mpp21090_dropcol_splitdefpt_addcol_dml_decimal VALUES(2.00,2.00,'a',2.00);
SELECT * FROM mpp21090_dropcol_splitdefpt_addcol_dml_decimal ORDER BY 1,2,3,4;
 col1 | col2 | col3 | col4 
------+------+------+------
 2.00 | 2.00 | a    | 2.00
(1 row)

ALTER TABLE mpp21090_dropcol_splitdefpt_addcol_dml_decimal DROP COLUMN col4;
INSERT INTO mpp21090_dropcol_splitdefpt_addcol_dml_decimal VALUES(2.00,2.00,'b');
SELECT * FROM mpp21090_dropcol_splitdefpt_addcol_dml_decimal ORDER BY 1,2,3;
 col1 | col2 | col3 
------+------+------
 2.00 | 2.00 | a
 2.00 | 2.00 | b
(2 rows)

ALTER TABLE mpp21090_dropcol_splitdefpt_addcol_dml_decimal SPLIT DEFAULT PARTITION at (5.00) into (partition partsplitone,partition def);
NOTICE:  exchanged partition "def" of relation "mpp21090_dropcol_splitdefpt_addcol_dml_decimal" with relation "pg_temp_638758"
NOTICE:  dropped partition "def" for relation "mpp21090_dropcol_splitdefpt_addcol_dml_decimal"
NOTICE:  CREATE TABLE will create partition "mpp21090_dropcol_splitdefpt_addcol_dml_decim_1_prt_partsplitone" for table "mpp21090_dropcol_splitdefpt_addcol_dml_decimal"
NOTICE:  CREATE TABLE will create partition "mpp21090_dropcol_splitdefpt_addcol_dml_decimal_1_prt_def" for table "mpp21090_dropcol_splitdefpt_addcol_dml_decimal"
INSERT INTO mpp21090_dropcol_splitdefpt_addcol_dml_decimal SELECT 1.00, 1.00,'e';
SELECT * FROM mpp21090_dropcol_splitdefpt_addcol_dml_decimal ORDER BY 1,2,3;
 col1 | col2 | col3 
------+------+------
 1.00 | 1.00 | e
 2.00 | 2.00 | a
 2.00 | 2.00 | b
(3 rows)

ALTER TABLE mpp21090_dropcol_splitdefpt_addcol_dml_decimal ADD COLUMN col5 decimal DEFAULT 2.00;
INSERT INTO mpp21090_dropcol_splitdefpt_addcol_dml_decimal VALUES(2.00,2.00,'c',2.00);
SELECT * FROM mpp21090_dropcol_splitdefpt_addcol_dml_decimal ORDER BY 1,2,3,4;
 col1 | col2 | col3 | col5 
------+------+------+------
 1.00 | 1.00 | e    | 2.00
 2.00 | 2.00 | a    | 2.00
 2.00 | 2.00 | b    | 2.00
 2.00 | 2.00 | c    | 2.00
(4 rows)

-- Update distribution key
UPDATE mpp21090_dropcol_splitdefpt_addcol_dml_decimal SET col1 = 35.00 WHERE col2 = 1.00 AND col1 = 1.00;
SELECT * FROM mpp21090_dropcol_splitdefpt_addcol_dml_decimal ORDER BY 1,2,3;
 col1  | col2 | col3 | col5 
-------+------+------+------
  2.00 | 2.00 | a    | 2.00
  2.00 | 2.00 | b    | 2.00
  2.00 | 2.00 | c    | 2.00
 35.00 | 1.00 | e    | 2.00
(4 rows)

-- Update partition key
UPDATE mpp21090_dropcol_splitdefpt_addcol_dml_decimal SET col2 = 35.00 WHERE col2 = 1.00 AND col1 = 35.00;
SELECT * FROM mpp21090_dropcol_splitdefpt_addcol_dml_decimal ORDER BY 1,2,3;
 col1  | col2  | col3 | col5 
-------+-------+------+------
  2.00 |  2.00 | a    | 2.00
  2.00 |  2.00 | b    | 2.00
  2.00 |  2.00 | c    | 2.00
 35.00 | 35.00 | e    | 2.00
(4 rows)

DELETE FROM mpp21090_dropcol_splitdefpt_addcol_dml_decimal WHERE col3='b';
SELECT * FROM mpp21090_dropcol_splitdefpt_addcol_dml_decimal ORDER BY 1,2,3;
 col1  | col2  | col3 | col5 
-------+-------+------+------
  2.00 |  2.00 | a    | 2.00
  2.00 |  2.00 | c    | 2.00
 35.00 | 35.00 | e    | 2.00
(3 rows)

-- @author prabhd 
-- @created 2014-04-01 12:00:00
-- @modified 2012-04-01 12:00:00
-- @tags dml MPP-21090 ORCA
-- @optimizer_mode on	
-- @description Tests for MPP-21090
\echo --start_ignore
--start_ignore
\echo --end_ignore
--end_ignore
DROP TABLE IF EXISTS mpp21090_dropcol_splitdefpt_addcol_dml_float;
NOTICE:  table "mpp21090_dropcol_splitdefpt_addcol_dml_float" does not exist, skipping
CREATE TABLE mpp21090_dropcol_splitdefpt_addcol_dml_float
(
    col1 float,
    col2 float,
    col3 char,
    col4 float
) 
DISTRIBUTED by (col1)
PARTITION BY LIST(col2)
(
default partition def
);
NOTICE:  CREATE TABLE will create partition "mpp21090_dropcol_splitdefpt_addcol_dml_float_1_prt_def" for table "mpp21090_dropcol_splitdefpt_addcol_dml_float"
INSERT INTO mpp21090_dropcol_splitdefpt_addcol_dml_float VALUES(2.00,2.00,'a',2.00);
SELECT * FROM mpp21090_dropcol_splitdefpt_addcol_dml_float ORDER BY 1,2,3,4;
 col1 | col2 | col3 | col4 
------+------+------+------
    2 |    2 | a    |    2
(1 row)

ALTER TABLE mpp21090_dropcol_splitdefpt_addcol_dml_float DROP COLUMN col4;
INSERT INTO mpp21090_dropcol_splitdefpt_addcol_dml_float VALUES(2.00,2.00,'b');
SELECT * FROM mpp21090_dropcol_splitdefpt_addcol_dml_float ORDER BY 1,2,3;
 col1 | col2 | col3 
------+------+------
    2 |    2 | a
    2 |    2 | b
(2 rows)

ALTER TABLE mpp21090_dropcol_splitdefpt_addcol_dml_float SPLIT DEFAULT PARTITION at (5.00) into (partition partsplitone,partition def);
NOTICE:  exchanged partition "def" of relation "mpp21090_dropcol_splitdefpt_addcol_dml_float" with relation "pg_temp_639127"
NOTICE:  dropped partition "def" for relation "mpp21090_dropcol_splitdefpt_addcol_dml_float"
NOTICE:  CREATE TABLE will create partition "mpp21090_dropcol_splitdefpt_addcol_dml_float_1_prt_partsplitone" for table "mpp21090_dropcol_splitdefpt_addcol_dml_float"
NOTICE:  CREATE TABLE will create partition "mpp21090_dropcol_splitdefpt_addcol_dml_float_1_prt_def" for table "mpp21090_dropcol_splitdefpt_addcol_dml_float"
INSERT INTO mpp21090_dropcol_splitdefpt_addcol_dml_float SELECT 1.00, 1.00,'e';
SELECT * FROM mpp21090_dropcol_splitdefpt_addcol_dml_float ORDER BY 1,2,3;
 col1 | col2 | col3 
------+------+------
    1 |    1 | e
    2 |    2 | a
    2 |    2 | b
(3 rows)

ALTER TABLE mpp21090_dropcol_splitdefpt_addcol_dml_float ADD COLUMN col5 float DEFAULT 2.00;
INSERT INTO mpp21090_dropcol_splitdefpt_addcol_dml_float VALUES(2.00,2.00,'c',2.00);
SELECT * FROM mpp21090_dropcol_splitdefpt_addcol_dml_float ORDER BY 1,2,3,4;
 col1 | col2 | col3 | col5 
------+------+------+------
    1 |    1 | e    |    2
    2 |    2 | a    |    2
    2 |    2 | b    |    2
    2 |    2 | c    |    2
(4 rows)

-- Update distribution key
UPDATE mpp21090_dropcol_splitdefpt_addcol_dml_float SET col1 = 35.00 WHERE col2 = 1.00 AND col1 = 1.00;
SELECT * FROM mpp21090_dropcol_splitdefpt_addcol_dml_float ORDER BY 1,2,3;
 col1 | col2 | col3 | col5 
------+------+------+------
    2 |    2 | a    |    2
    2 |    2 | b    |    2
    2 |    2 | c    |    2
   35 |    1 | e    |    2
(4 rows)

-- Update partition key
UPDATE mpp21090_dropcol_splitdefpt_addcol_dml_float SET col2 = 35.00 WHERE col2 = 1.00 AND col1 = 35.00;
SELECT * FROM mpp21090_dropcol_splitdefpt_addcol_dml_float ORDER BY 1,2,3;
 col1 | col2 | col3 | col5 
------+------+------+------
    2 |    2 | a    |    2
    2 |    2 | b    |    2
    2 |    2 | c    |    2
   35 |   35 | e    |    2
(4 rows)

DELETE FROM mpp21090_dropcol_splitdefpt_addcol_dml_float WHERE col3='b';
SELECT * FROM mpp21090_dropcol_splitdefpt_addcol_dml_float ORDER BY 1,2,3;
 col1 | col2 | col3 | col5 
------+------+------+------
    2 |    2 | a    |    2
    2 |    2 | c    |    2
   35 |   35 | e    |    2
(3 rows)

-- @author prabhd 
-- @created 2014-04-01 12:00:00
-- @modified 2012-04-01 12:00:00
-- @tags dml MPP-21090 ORCA
-- @optimizer_mode on	
-- @description Tests for MPP-21090
\echo --start_ignore
--start_ignore
\echo --end_ignore
--end_ignore
DROP TABLE IF EXISTS mpp21090_dropcol_splitdefpt_addcol_dml_int;
NOTICE:  table "mpp21090_dropcol_splitdefpt_addcol_dml_int" does not exist, skipping
CREATE TABLE mpp21090_dropcol_splitdefpt_addcol_dml_int
(
    col1 int,
    col2 int,
    col3 char,
    col4 int
) 
DISTRIBUTED by (col1)
PARTITION BY LIST(col2)
(
default partition def
);
NOTICE:  CREATE TABLE will create partition "mpp21090_dropcol_splitdefpt_addcol_dml_int_1_prt_def" for table "mpp21090_dropcol_splitdefpt_addcol_dml_int"
INSERT INTO mpp21090_dropcol_splitdefpt_addcol_dml_int VALUES(20000,20000,'a',20000);
SELECT * FROM mpp21090_dropcol_splitdefpt_addcol_dml_int ORDER BY 1,2,3,4;
 col1  | col2  | col3 | col4  
-------+-------+------+-------
 20000 | 20000 | a    | 20000
(1 row)

ALTER TABLE mpp21090_dropcol_splitdefpt_addcol_dml_int DROP COLUMN col4;
INSERT INTO mpp21090_dropcol_splitdefpt_addcol_dml_int VALUES(20000,20000,'b');
SELECT * FROM mpp21090_dropcol_splitdefpt_addcol_dml_int ORDER BY 1,2,3;
 col1  | col2  | col3 
-------+-------+------
 20000 | 20000 | a
 20000 | 20000 | b
(2 rows)

ALTER TABLE mpp21090_dropcol_splitdefpt_addcol_dml_int SPLIT DEFAULT PARTITION at (5000) into (partition partsplitone,partition def);
NOTICE:  exchanged partition "def" of relation "mpp21090_dropcol_splitdefpt_addcol_dml_int" with relation "pg_temp_639480"
NOTICE:  dropped partition "def" for relation "mpp21090_dropcol_splitdefpt_addcol_dml_int"
NOTICE:  CREATE TABLE will create partition "mpp21090_dropcol_splitdefpt_addcol_dml_int_1_prt_partsplitone" for table "mpp21090_dropcol_splitdefpt_addcol_dml_int"
NOTICE:  CREATE TABLE will create partition "mpp21090_dropcol_splitdefpt_addcol_dml_int_1_prt_def" for table "mpp21090_dropcol_splitdefpt_addcol_dml_int"
INSERT INTO mpp21090_dropcol_splitdefpt_addcol_dml_int SELECT 1000, 1000,'e';
SELECT * FROM mpp21090_dropcol_splitdefpt_addcol_dml_int ORDER BY 1,2,3;
 col1  | col2  | col3 
-------+-------+------
  1000 |  1000 | e
 20000 | 20000 | a
 20000 | 20000 | b
(3 rows)

ALTER TABLE mpp21090_dropcol_splitdefpt_addcol_dml_int ADD COLUMN col5 int DEFAULT 20000;
INSERT INTO mpp21090_dropcol_splitdefpt_addcol_dml_int VALUES(20000,20000,'c',20000);
SELECT * FROM mpp21090_dropcol_splitdefpt_addcol_dml_int ORDER BY 1,2,3,4;
 col1  | col2  | col3 | col5  
-------+-------+------+-------
  1000 |  1000 | e    | 20000
 20000 | 20000 | a    | 20000
 20000 | 20000 | b    | 20000
 20000 | 20000 | c    | 20000
(4 rows)

-- Update distribution key
UPDATE mpp21090_dropcol_splitdefpt_addcol_dml_int SET col1 = 35000 WHERE col2 = 1000 AND col1 = 1000;
SELECT * FROM mpp21090_dropcol_splitdefpt_addcol_dml_int ORDER BY 1,2,3;
 col1  | col2  | col3 | col5  
-------+-------+------+-------
 20000 | 20000 | a    | 20000
 20000 | 20000 | b    | 20000
 20000 | 20000 | c    | 20000
 35000 |  1000 | e    | 20000
(4 rows)

-- Update partition key
UPDATE mpp21090_dropcol_splitdefpt_addcol_dml_int SET col2 = 35000 WHERE col2 = 1000 AND col1 = 35000;
SELECT * FROM mpp21090_dropcol_splitdefpt_addcol_dml_int ORDER BY 1,2,3;
 col1  | col2  | col3 | col5  
-------+-------+------+-------
 20000 | 20000 | a    | 20000
 20000 | 20000 | b    | 20000
 20000 | 20000 | c    | 20000
 35000 | 35000 | e    | 20000
(4 rows)

DELETE FROM mpp21090_dropcol_splitdefpt_addcol_dml_int WHERE col3='b';
SELECT * FROM mpp21090_dropcol_splitdefpt_addcol_dml_int ORDER BY 1,2,3;
 col1  | col2  | col3 | col5  
-------+-------+------+-------
 20000 | 20000 | a    | 20000
 20000 | 20000 | c    | 20000
 35000 | 35000 | e    | 20000
(3 rows)

-- @author prabhd 
-- @created 2014-04-01 12:00:00
-- @modified 2012-04-01 12:00:00
-- @tags dml MPP-21090 ORCA
-- @optimizer_mode on	
-- @description Tests for MPP-21090
\echo --start_ignore
--start_ignore
\echo --end_ignore
--end_ignore
DROP TABLE IF EXISTS mpp21090_dropcol_splitdefpt_addcol_dml_int4;
NOTICE:  table "mpp21090_dropcol_splitdefpt_addcol_dml_int4" does not exist, skipping
CREATE TABLE mpp21090_dropcol_splitdefpt_addcol_dml_int4
(
    col1 int4,
    col2 int4,
    col3 char,
    col4 int4
) 
DISTRIBUTED by (col1)
PARTITION BY LIST(col2)
(
default partition def
);
NOTICE:  CREATE TABLE will create partition "mpp21090_dropcol_splitdefpt_addcol_dml_int4_1_prt_def" for table "mpp21090_dropcol_splitdefpt_addcol_dml_int4"
INSERT INTO mpp21090_dropcol_splitdefpt_addcol_dml_int4 VALUES(20000000,20000000,'a',20000000);
SELECT * FROM mpp21090_dropcol_splitdefpt_addcol_dml_int4 ORDER BY 1,2,3,4;
   col1   |   col2   | col3 |   col4   
----------+----------+------+----------
 20000000 | 20000000 | a    | 20000000
(1 row)

ALTER TABLE mpp21090_dropcol_splitdefpt_addcol_dml_int4 DROP COLUMN col4;
INSERT INTO mpp21090_dropcol_splitdefpt_addcol_dml_int4 VALUES(20000000,20000000,'b');
SELECT * FROM mpp21090_dropcol_splitdefpt_addcol_dml_int4 ORDER BY 1,2,3;
   col1   |   col2   | col3 
----------+----------+------
 20000000 | 20000000 | a
 20000000 | 20000000 | b
(2 rows)

ALTER TABLE mpp21090_dropcol_splitdefpt_addcol_dml_int4 SPLIT DEFAULT PARTITION at (50000000) into (partition partsplitone,partition def);
NOTICE:  exchanged partition "def" of relation "mpp21090_dropcol_splitdefpt_addcol_dml_int4" with relation "pg_temp_639833"
NOTICE:  dropped partition "def" for relation "mpp21090_dropcol_splitdefpt_addcol_dml_int4"
NOTICE:  CREATE TABLE will create partition "mpp21090_dropcol_splitdefpt_addcol_dml_int4_1_prt_partsplitone" for table "mpp21090_dropcol_splitdefpt_addcol_dml_int4"
NOTICE:  CREATE TABLE will create partition "mpp21090_dropcol_splitdefpt_addcol_dml_int4_1_prt_def" for table "mpp21090_dropcol_splitdefpt_addcol_dml_int4"
INSERT INTO mpp21090_dropcol_splitdefpt_addcol_dml_int4 SELECT 10000000, 10000000,'e';
SELECT * FROM mpp21090_dropcol_splitdefpt_addcol_dml_int4 ORDER BY 1,2,3;
   col1   |   col2   | col3 
----------+----------+------
 10000000 | 10000000 | e
 20000000 | 20000000 | a
 20000000 | 20000000 | b
(3 rows)

ALTER TABLE mpp21090_dropcol_splitdefpt_addcol_dml_int4 ADD COLUMN col5 int4 DEFAULT 20000000;
INSERT INTO mpp21090_dropcol_splitdefpt_addcol_dml_int4 VALUES(20000000,20000000,'c',20000000);
SELECT * FROM mpp21090_dropcol_splitdefpt_addcol_dml_int4 ORDER BY 1,2,3,4;
   col1   |   col2   | col3 |   col5   
----------+----------+------+----------
 10000000 | 10000000 | e    | 20000000
 20000000 | 20000000 | a    | 20000000
 20000000 | 20000000 | b    | 20000000
 20000000 | 20000000 | c    | 20000000
(4 rows)

-- Update distribution key
UPDATE mpp21090_dropcol_splitdefpt_addcol_dml_int4 SET col1 = 35000000 WHERE col2 = 10000000 AND col1 = 10000000;
SELECT * FROM mpp21090_dropcol_splitdefpt_addcol_dml_int4 ORDER BY 1,2,3;
   col1   |   col2   | col3 |   col5   
----------+----------+------+----------
 20000000 | 20000000 | a    | 20000000
 20000000 | 20000000 | b    | 20000000
 20000000 | 20000000 | c    | 20000000
 35000000 | 10000000 | e    | 20000000
(4 rows)

-- Update partition key
UPDATE mpp21090_dropcol_splitdefpt_addcol_dml_int4 SET col2 = 35000000 WHERE col2 = 10000000 AND col1 = 35000000;
SELECT * FROM mpp21090_dropcol_splitdefpt_addcol_dml_int4 ORDER BY 1,2,3;
   col1   |   col2   | col3 |   col5   
----------+----------+------+----------
 20000000 | 20000000 | a    | 20000000
 20000000 | 20000000 | b    | 20000000
 20000000 | 20000000 | c    | 20000000
 35000000 | 35000000 | e    | 20000000
(4 rows)

DELETE FROM mpp21090_dropcol_splitdefpt_addcol_dml_int4 WHERE col3='b';
SELECT * FROM mpp21090_dropcol_splitdefpt_addcol_dml_int4 ORDER BY 1,2,3;
   col1   |   col2   | col3 |   col5   
----------+----------+------+----------
 20000000 | 20000000 | a    | 20000000
 20000000 | 20000000 | c    | 20000000
 35000000 | 35000000 | e    | 20000000
(3 rows)

-- @author prabhd 
-- @created 2014-04-01 12:00:00
-- @modified 2012-04-01 12:00:00
-- @tags dml MPP-21090 ORCA
-- @optimizer_mode on	
-- @description Tests for MPP-21090
\echo --start_ignore
--start_ignore
\echo --end_ignore
--end_ignore
DROP TABLE IF EXISTS mpp21090_dropcol_splitdefpt_addcol_dml_int8;
NOTICE:  table "mpp21090_dropcol_splitdefpt_addcol_dml_int8" does not exist, skipping
CREATE TABLE mpp21090_dropcol_splitdefpt_addcol_dml_int8
(
    col1 int8,
    col2 int8,
    col3 char,
    col4 int8
) 
DISTRIBUTED by (col1)
PARTITION BY LIST(col2)
(
default partition def
);
NOTICE:  CREATE TABLE will create partition "mpp21090_dropcol_splitdefpt_addcol_dml_int8_1_prt_def" for table "mpp21090_dropcol_splitdefpt_addcol_dml_int8"
INSERT INTO mpp21090_dropcol_splitdefpt_addcol_dml_int8 VALUES(2000000000000000000,2000000000000000000,'a',2000000000000000000);
SELECT * FROM mpp21090_dropcol_splitdefpt_addcol_dml_int8 ORDER BY 1,2,3,4;
        col1         |        col2         | col3 |        col4         
---------------------+---------------------+------+---------------------
 2000000000000000000 | 2000000000000000000 | a    | 2000000000000000000
(1 row)

ALTER TABLE mpp21090_dropcol_splitdefpt_addcol_dml_int8 DROP COLUMN col4;
INSERT INTO mpp21090_dropcol_splitdefpt_addcol_dml_int8 VALUES(2000000000000000000,2000000000000000000,'b');
SELECT * FROM mpp21090_dropcol_splitdefpt_addcol_dml_int8 ORDER BY 1,2,3;
        col1         |        col2         | col3 
---------------------+---------------------+------
 2000000000000000000 | 2000000000000000000 | a
 2000000000000000000 | 2000000000000000000 | b
(2 rows)

ALTER TABLE mpp21090_dropcol_splitdefpt_addcol_dml_int8 SPLIT DEFAULT PARTITION at (500000000000000000) into (partition partsplitone,partition def);
NOTICE:  exchanged partition "def" of relation "mpp21090_dropcol_splitdefpt_addcol_dml_int8" with relation "pg_temp_640186"
NOTICE:  dropped partition "def" for relation "mpp21090_dropcol_splitdefpt_addcol_dml_int8"
NOTICE:  CREATE TABLE will create partition "mpp21090_dropcol_splitdefpt_addcol_dml_int8_1_prt_partsplitone" for table "mpp21090_dropcol_splitdefpt_addcol_dml_int8"
NOTICE:  CREATE TABLE will create partition "mpp21090_dropcol_splitdefpt_addcol_dml_int8_1_prt_def" for table "mpp21090_dropcol_splitdefpt_addcol_dml_int8"
INSERT INTO mpp21090_dropcol_splitdefpt_addcol_dml_int8 SELECT 100000000000000000, 100000000000000000,'e';
SELECT * FROM mpp21090_dropcol_splitdefpt_addcol_dml_int8 ORDER BY 1,2,3;
        col1         |        col2         | col3 
---------------------+---------------------+------
  100000000000000000 |  100000000000000000 | e
 2000000000000000000 | 2000000000000000000 | a
 2000000000000000000 | 2000000000000000000 | b
(3 rows)

ALTER TABLE mpp21090_dropcol_splitdefpt_addcol_dml_int8 ADD COLUMN col5 int8 DEFAULT 2000000000000000000;
INSERT INTO mpp21090_dropcol_splitdefpt_addcol_dml_int8 VALUES(2000000000000000000,2000000000000000000,'c',2000000000000000000);
SELECT * FROM mpp21090_dropcol_splitdefpt_addcol_dml_int8 ORDER BY 1,2,3,4;
        col1         |        col2         | col3 |        col5         
---------------------+---------------------+------+---------------------
  100000000000000000 |  100000000000000000 | e    | 2000000000000000000
 2000000000000000000 | 2000000000000000000 | a    | 2000000000000000000
 2000000000000000000 | 2000000000000000000 | b    | 2000000000000000000
 2000000000000000000 | 2000000000000000000 | c    | 2000000000000000000
(4 rows)

-- Update distribution key
UPDATE mpp21090_dropcol_splitdefpt_addcol_dml_int8 SET col1 = 3500000000000000000 WHERE col2 = 100000000000000000 AND col1 = 100000000000000000;
SELECT * FROM mpp21090_dropcol_splitdefpt_addcol_dml_int8 ORDER BY 1,2,3;
        col1         |        col2         | col3 |        col5         
---------------------+---------------------+------+---------------------
 2000000000000000000 | 2000000000000000000 | a    | 2000000000000000000
 2000000000000000000 | 2000000000000000000 | b    | 2000000000000000000
 2000000000000000000 | 2000000000000000000 | c    | 2000000000000000000
 3500000000000000000 |  100000000000000000 | e    | 2000000000000000000
(4 rows)

-- Update partition key
UPDATE mpp21090_dropcol_splitdefpt_addcol_dml_int8 SET col2 = 3500000000000000000 WHERE col2 = 100000000000000000 AND col1 = 3500000000000000000;
SELECT * FROM mpp21090_dropcol_splitdefpt_addcol_dml_int8 ORDER BY 1,2,3;
        col1         |        col2         | col3 |        col5         
---------------------+---------------------+------+---------------------
 2000000000000000000 | 2000000000000000000 | a    | 2000000000000000000
 2000000000000000000 | 2000000000000000000 | b    | 2000000000000000000
 2000000000000000000 | 2000000000000000000 | c    | 2000000000000000000
 3500000000000000000 | 3500000000000000000 | e    | 2000000000000000000
(4 rows)

DELETE FROM mpp21090_dropcol_splitdefpt_addcol_dml_int8 WHERE col3='b';
SELECT * FROM mpp21090_dropcol_splitdefpt_addcol_dml_int8 ORDER BY 1,2,3;
        col1         |        col2         | col3 |        col5         
---------------------+---------------------+------+---------------------
 2000000000000000000 | 2000000000000000000 | a    | 2000000000000000000
 2000000000000000000 | 2000000000000000000 | c    | 2000000000000000000
 3500000000000000000 | 3500000000000000000 | e    | 2000000000000000000
(3 rows)

-- @author prabhd 
-- @created 2014-04-01 12:00:00
-- @modified 2012-04-01 12:00:00
-- @tags dml MPP-21090 ORCA
-- @optimizer_mode on	
-- @description Tests for MPP-21090
\echo --start_ignore
--start_ignore
\echo --end_ignore
--end_ignore
DROP TABLE IF EXISTS mpp21090_dropcol_splitdefpt_addcol_dml_interval;
NOTICE:  table "mpp21090_dropcol_splitdefpt_addcol_dml_interval" does not exist, skipping
CREATE TABLE mpp21090_dropcol_splitdefpt_addcol_dml_interval
(
    col1 interval,
    col2 interval,
    col3 char,
    col4 interval
) 
DISTRIBUTED by (col1)
PARTITION BY LIST(col2)
(
default partition def
);
NOTICE:  CREATE TABLE will create partition "mpp21090_dropcol_splitdefpt_addcol_dml_interval_1_prt_def" for table "mpp21090_dropcol_splitdefpt_addcol_dml_interval"
INSERT INTO mpp21090_dropcol_splitdefpt_addcol_dml_interval VALUES('1 hour','1 hour','a','1 hour');
SELECT * FROM mpp21090_dropcol_splitdefpt_addcol_dml_interval ORDER BY 1,2,3,4;
   col1   |   col2   | col3 |   col4   
----------+----------+------+----------
 @ 1 hour | @ 1 hour | a    | @ 1 hour
(1 row)

ALTER TABLE mpp21090_dropcol_splitdefpt_addcol_dml_interval DROP COLUMN col4;
INSERT INTO mpp21090_dropcol_splitdefpt_addcol_dml_interval VALUES('1 hour','1 hour','b');
SELECT * FROM mpp21090_dropcol_splitdefpt_addcol_dml_interval ORDER BY 1,2,3;
   col1   |   col2   | col3 
----------+----------+------
 @ 1 hour | @ 1 hour | a
 @ 1 hour | @ 1 hour | b
(2 rows)

ALTER TABLE mpp21090_dropcol_splitdefpt_addcol_dml_interval SPLIT DEFAULT PARTITION at ('30 secs') into (partition partsplitone,partition def);
NOTICE:  exchanged partition "def" of relation "mpp21090_dropcol_splitdefpt_addcol_dml_interval" with relation "pg_temp_640539"
NOTICE:  dropped partition "def" for relation "mpp21090_dropcol_splitdefpt_addcol_dml_interval"
NOTICE:  CREATE TABLE will create partition "mpp21090_dropcol_splitdefpt_addcol_dml_inter_1_prt_partsplitone" for table "mpp21090_dropcol_splitdefpt_addcol_dml_interval"
NOTICE:  CREATE TABLE will create partition "mpp21090_dropcol_splitdefpt_addcol_dml_interval_1_prt_def" for table "mpp21090_dropcol_splitdefpt_addcol_dml_interval"
INSERT INTO mpp21090_dropcol_splitdefpt_addcol_dml_interval SELECT '1 sec', '1 sec','e';
SELECT * FROM mpp21090_dropcol_splitdefpt_addcol_dml_interval ORDER BY 1,2,3;
   col1   |   col2   | col3 
----------+----------+------
 @ 1 sec  | @ 1 sec  | e
 @ 1 hour | @ 1 hour | a
 @ 1 hour | @ 1 hour | b
(3 rows)

ALTER TABLE mpp21090_dropcol_splitdefpt_addcol_dml_interval ADD COLUMN col5 interval DEFAULT '1 hour';
INSERT INTO mpp21090_dropcol_splitdefpt_addcol_dml_interval VALUES('1 hour','1 hour','c','1 hour');
SELECT * FROM mpp21090_dropcol_splitdefpt_addcol_dml_interval ORDER BY 1,2,3,4;
   col1   |   col2   | col3 |   col5   
----------+----------+------+----------
 @ 1 sec  | @ 1 sec  | e    | @ 1 hour
 @ 1 hour | @ 1 hour | a    | @ 1 hour
 @ 1 hour | @ 1 hour | b    | @ 1 hour
 @ 1 hour | @ 1 hour | c    | @ 1 hour
(4 rows)

-- Update distribution key
UPDATE mpp21090_dropcol_splitdefpt_addcol_dml_interval SET col1 = '14 hours' WHERE col2 = '1 sec' AND col1 = '1 sec';
SELECT * FROM mpp21090_dropcol_splitdefpt_addcol_dml_interval ORDER BY 1,2,3;
    col1    |   col2   | col3 |   col5   
------------+----------+------+----------
 @ 1 hour   | @ 1 hour | a    | @ 1 hour
 @ 1 hour   | @ 1 hour | b    | @ 1 hour
 @ 1 hour   | @ 1 hour | c    | @ 1 hour
 @ 14 hours | @ 1 sec  | e    | @ 1 hour
(4 rows)

-- Update partition key
UPDATE mpp21090_dropcol_splitdefpt_addcol_dml_interval SET col2 = '14 hours' WHERE col2 = '1 sec' AND col1 = '14 hours';
SELECT * FROM mpp21090_dropcol_splitdefpt_addcol_dml_interval ORDER BY 1,2,3;
    col1    |    col2    | col3 |   col5   
------------+------------+------+----------
 @ 1 hour   | @ 1 hour   | a    | @ 1 hour
 @ 1 hour   | @ 1 hour   | b    | @ 1 hour
 @ 1 hour   | @ 1 hour   | c    | @ 1 hour
 @ 14 hours | @ 14 hours | e    | @ 1 hour
(4 rows)

DELETE FROM mpp21090_dropcol_splitdefpt_addcol_dml_interval WHERE col3='b';
SELECT * FROM mpp21090_dropcol_splitdefpt_addcol_dml_interval ORDER BY 1,2,3;
    col1    |    col2    | col3 |   col5   
------------+------------+------+----------
 @ 1 hour   | @ 1 hour   | a    | @ 1 hour
 @ 1 hour   | @ 1 hour   | c    | @ 1 hour
 @ 14 hours | @ 14 hours | e    | @ 1 hour
(3 rows)

-- @author prabhd 
-- @created 2014-04-01 12:00:00
-- @modified 2012-04-01 12:00:00
-- @tags dml MPP-21090 ORCA
-- @optimizer_mode on	
-- @description Tests for MPP-21090
\echo --start_ignore
--start_ignore
\echo --end_ignore
--end_ignore
DROP TABLE IF EXISTS mpp21090_dropcol_splitdefpt_addcol_dml_numeric;
NOTICE:  table "mpp21090_dropcol_splitdefpt_addcol_dml_numeric" does not exist, skipping
CREATE TABLE mpp21090_dropcol_splitdefpt_addcol_dml_numeric
(
    col1 numeric,
    col2 numeric,
    col3 char,
    col4 numeric
) 
DISTRIBUTED by (col1)
PARTITION BY LIST(col2)
(
default partition def
);
NOTICE:  CREATE TABLE will create partition "mpp21090_dropcol_splitdefpt_addcol_dml_numeric_1_prt_def" for table "mpp21090_dropcol_splitdefpt_addcol_dml_numeric"
INSERT INTO mpp21090_dropcol_splitdefpt_addcol_dml_numeric VALUES(2.000000,2.000000,'a',2.000000);
SELECT * FROM mpp21090_dropcol_splitdefpt_addcol_dml_numeric ORDER BY 1,2,3,4;
   col1   |   col2   | col3 |   col4   
----------+----------+------+----------
 2.000000 | 2.000000 | a    | 2.000000
(1 row)

ALTER TABLE mpp21090_dropcol_splitdefpt_addcol_dml_numeric DROP COLUMN col4;
INSERT INTO mpp21090_dropcol_splitdefpt_addcol_dml_numeric VALUES(2.000000,2.000000,'b');
SELECT * FROM mpp21090_dropcol_splitdefpt_addcol_dml_numeric ORDER BY 1,2,3;
   col1   |   col2   | col3 
----------+----------+------
 2.000000 | 2.000000 | a
 2.000000 | 2.000000 | b
(2 rows)

ALTER TABLE mpp21090_dropcol_splitdefpt_addcol_dml_numeric SPLIT DEFAULT PARTITION at (5.000000) into (partition partsplitone,partition def);
NOTICE:  exchanged partition "def" of relation "mpp21090_dropcol_splitdefpt_addcol_dml_numeric" with relation "pg_temp_640892"
NOTICE:  dropped partition "def" for relation "mpp21090_dropcol_splitdefpt_addcol_dml_numeric"
NOTICE:  CREATE TABLE will create partition "mpp21090_dropcol_splitdefpt_addcol_dml_numer_1_prt_partsplitone" for table "mpp21090_dropcol_splitdefpt_addcol_dml_numeric"
NOTICE:  CREATE TABLE will create partition "mpp21090_dropcol_splitdefpt_addcol_dml_numeric_1_prt_def" for table "mpp21090_dropcol_splitdefpt_addcol_dml_numeric"
INSERT INTO mpp21090_dropcol_splitdefpt_addcol_dml_numeric SELECT 1.000000, 1.000000,'e';
SELECT * FROM mpp21090_dropcol_splitdefpt_addcol_dml_numeric ORDER BY 1,2,3;
   col1   |   col2   | col3 
----------+----------+------
 1.000000 | 1.000000 | e
 2.000000 | 2.000000 | a
 2.000000 | 2.000000 | b
(3 rows)

ALTER TABLE mpp21090_dropcol_splitdefpt_addcol_dml_numeric ADD COLUMN col5 numeric DEFAULT 2.000000;
INSERT INTO mpp21090_dropcol_splitdefpt_addcol_dml_numeric VALUES(2.000000,2.000000,'c',2.000000);
SELECT * FROM mpp21090_dropcol_splitdefpt_addcol_dml_numeric ORDER BY 1,2,3,4;
   col1   |   col2   | col3 |   col5   
----------+----------+------+----------
 1.000000 | 1.000000 | e    | 2.000000
 2.000000 | 2.000000 | a    | 2.000000
 2.000000 | 2.000000 | b    | 2.000000
 2.000000 | 2.000000 | c    | 2.000000
(4 rows)

-- Update distribution key
UPDATE mpp21090_dropcol_splitdefpt_addcol_dml_numeric SET col1 = 35.000000 WHERE col2 = 1.000000 AND col1 = 1.000000;
SELECT * FROM mpp21090_dropcol_splitdefpt_addcol_dml_numeric ORDER BY 1,2,3;
   col1    |   col2   | col3 |   col5   
-----------+----------+------+----------
  2.000000 | 2.000000 | a    | 2.000000
  2.000000 | 2.000000 | b    | 2.000000
  2.000000 | 2.000000 | c    | 2.000000
 35.000000 | 1.000000 | e    | 2.000000
(4 rows)

-- Update partition key
UPDATE mpp21090_dropcol_splitdefpt_addcol_dml_numeric SET col2 = 35.000000 WHERE col2 = 1.000000 AND col1 = 35.000000;
SELECT * FROM mpp21090_dropcol_splitdefpt_addcol_dml_numeric ORDER BY 1,2,3;
   col1    |   col2    | col3 |   col5   
-----------+-----------+------+----------
  2.000000 |  2.000000 | a    | 2.000000
  2.000000 |  2.000000 | b    | 2.000000
  2.000000 |  2.000000 | c    | 2.000000
 35.000000 | 35.000000 | e    | 2.000000
(4 rows)

DELETE FROM mpp21090_dropcol_splitdefpt_addcol_dml_numeric WHERE col3='b';
SELECT * FROM mpp21090_dropcol_splitdefpt_addcol_dml_numeric ORDER BY 1,2,3;
   col1    |   col2    | col3 |   col5   
-----------+-----------+------+----------
  2.000000 |  2.000000 | a    | 2.000000
  2.000000 |  2.000000 | c    | 2.000000
 35.000000 | 35.000000 | e    | 2.000000
(3 rows)

-- @author prabhd 
-- @created 2014-04-01 12:00:00
-- @modified 2012-04-01 12:00:00
-- @tags dml MPP-21090 ORCA
-- @optimizer_mode on	
-- @description Tests for MPP-21090
\echo --start_ignore
--start_ignore
\echo --end_ignore
--end_ignore
DROP TABLE IF EXISTS mpp21090_dropcol_splitdefpt_addcol_dml_time;
NOTICE:  table "mpp21090_dropcol_splitdefpt_addcol_dml_time" does not exist, skipping
CREATE TABLE mpp21090_dropcol_splitdefpt_addcol_dml_time
(
    col1 time,
    col2 time,
    col3 char,
    col4 time
) 
DISTRIBUTED by (col1)
PARTITION BY LIST(col2)
(
default partition def
);
NOTICE:  CREATE TABLE will create partition "mpp21090_dropcol_splitdefpt_addcol_dml_time_1_prt_def" for table "mpp21090_dropcol_splitdefpt_addcol_dml_time"
INSERT INTO mpp21090_dropcol_splitdefpt_addcol_dml_time VALUES('12:00:00','12:00:00','a','12:00:00');
SELECT * FROM mpp21090_dropcol_splitdefpt_addcol_dml_time ORDER BY 1,2,3,4;
   col1   |   col2   | col3 |   col4   
----------+----------+------+----------
 12:00:00 | 12:00:00 | a    | 12:00:00
(1 row)

ALTER TABLE mpp21090_dropcol_splitdefpt_addcol_dml_time DROP COLUMN col4;
INSERT INTO mpp21090_dropcol_splitdefpt_addcol_dml_time VALUES('12:00:00','12:00:00','b');
SELECT * FROM mpp21090_dropcol_splitdefpt_addcol_dml_time ORDER BY 1,2,3;
   col1   |   col2   | col3 
----------+----------+------
 12:00:00 | 12:00:00 | a
 12:00:00 | 12:00:00 | b
(2 rows)

ALTER TABLE mpp21090_dropcol_splitdefpt_addcol_dml_time SPLIT DEFAULT PARTITION at ('15:00:00') into (partition partsplitone,partition def);
NOTICE:  exchanged partition "def" of relation "mpp21090_dropcol_splitdefpt_addcol_dml_time" with relation "pg_temp_641261"
NOTICE:  dropped partition "def" for relation "mpp21090_dropcol_splitdefpt_addcol_dml_time"
NOTICE:  CREATE TABLE will create partition "mpp21090_dropcol_splitdefpt_addcol_dml_time_1_prt_partsplitone" for table "mpp21090_dropcol_splitdefpt_addcol_dml_time"
NOTICE:  CREATE TABLE will create partition "mpp21090_dropcol_splitdefpt_addcol_dml_time_1_prt_def" for table "mpp21090_dropcol_splitdefpt_addcol_dml_time"
INSERT INTO mpp21090_dropcol_splitdefpt_addcol_dml_time SELECT '12:00:00', '12:00:00','e';
SELECT * FROM mpp21090_dropcol_splitdefpt_addcol_dml_time ORDER BY 1,2,3;
   col1   |   col2   | col3 
----------+----------+------
 12:00:00 | 12:00:00 | a
 12:00:00 | 12:00:00 | b
 12:00:00 | 12:00:00 | e
(3 rows)

ALTER TABLE mpp21090_dropcol_splitdefpt_addcol_dml_time ADD COLUMN col5 time DEFAULT '12:00:00';
INSERT INTO mpp21090_dropcol_splitdefpt_addcol_dml_time VALUES('12:00:00','12:00:00','c','12:00:00');
SELECT * FROM mpp21090_dropcol_splitdefpt_addcol_dml_time ORDER BY 1,2,3,4;
   col1   |   col2   | col3 |   col5   
----------+----------+------+----------
 12:00:00 | 12:00:00 | a    | 12:00:00
 12:00:00 | 12:00:00 | b    | 12:00:00
 12:00:00 | 12:00:00 | c    | 12:00:00
 12:00:00 | 12:00:00 | e    | 12:00:00
(4 rows)

-- Update distribution key
UPDATE mpp21090_dropcol_splitdefpt_addcol_dml_time SET col1 = '11:30:00' WHERE col2 = '12:00:00' AND col1 = '12:00:00';
SELECT * FROM mpp21090_dropcol_splitdefpt_addcol_dml_time ORDER BY 1,2,3;
   col1   |   col2   | col3 |   col5   
----------+----------+------+----------
 11:30:00 | 12:00:00 | a    | 12:00:00
 11:30:00 | 12:00:00 | b    | 12:00:00
 11:30:00 | 12:00:00 | c    | 12:00:00
 11:30:00 | 12:00:00 | e    | 12:00:00
(4 rows)

-- Update partition key
UPDATE mpp21090_dropcol_splitdefpt_addcol_dml_time SET col2 = '11:30:00' WHERE col2 = '12:00:00' AND col1 = '11:30:00';
SELECT * FROM mpp21090_dropcol_splitdefpt_addcol_dml_time ORDER BY 1,2,3;
   col1   |   col2   | col3 |   col5   
----------+----------+------+----------
 11:30:00 | 11:30:00 | a    | 12:00:00
 11:30:00 | 11:30:00 | b    | 12:00:00
 11:30:00 | 11:30:00 | c    | 12:00:00
 11:30:00 | 11:30:00 | e    | 12:00:00
(4 rows)

DELETE FROM mpp21090_dropcol_splitdefpt_addcol_dml_time WHERE col3='b';
SELECT * FROM mpp21090_dropcol_splitdefpt_addcol_dml_time ORDER BY 1,2,3;
   col1   |   col2   | col3 |   col5   
----------+----------+------+----------
 11:30:00 | 11:30:00 | a    | 12:00:00
 11:30:00 | 11:30:00 | c    | 12:00:00
 11:30:00 | 11:30:00 | e    | 12:00:00
(3 rows)

-- @author prabhd 
-- @created 2014-04-01 12:00:00
-- @modified 2012-04-01 12:00:00
-- @tags dml MPP-21090 ORCA
-- @optimizer_mode on	
-- @description Tests for MPP-21090
\echo --start_ignore
--start_ignore
\echo --end_ignore
--end_ignore
DROP TABLE IF EXISTS mpp21090_dropcol_splitdefpt_addcol_dml_timestamp;
NOTICE:  table "mpp21090_dropcol_splitdefpt_addcol_dml_timestamp" does not exist, skipping
CREATE TABLE mpp21090_dropcol_splitdefpt_addcol_dml_timestamp
(
    col1 timestamp,
    col2 timestamp,
    col3 char,
    col4 timestamp
) 
DISTRIBUTED by (col1)
PARTITION BY LIST(col2)
(
default partition def
);
NOTICE:  CREATE TABLE will create partition "mpp21090_dropcol_splitdefpt_addcol_dml_timestamp_1_prt_def" for table "mpp21090_dropcol_splitdefpt_addcol_dml_timestamp"
INSERT INTO mpp21090_dropcol_splitdefpt_addcol_dml_timestamp VALUES('2013-12-31 12:00:00','2013-12-31 12:00:00','a','2013-12-31 12:00:00');
SELECT * FROM mpp21090_dropcol_splitdefpt_addcol_dml_timestamp ORDER BY 1,2,3,4;
           col1           |           col2           | col3 |           col4           
--------------------------+--------------------------+------+--------------------------
 Tue Dec 31 12:00:00 2013 | Tue Dec 31 12:00:00 2013 | a    | Tue Dec 31 12:00:00 2013
(1 row)

ALTER TABLE mpp21090_dropcol_splitdefpt_addcol_dml_timestamp DROP COLUMN col4;
INSERT INTO mpp21090_dropcol_splitdefpt_addcol_dml_timestamp VALUES('2013-12-31 12:00:00','2013-12-31 12:00:00','b');
SELECT * FROM mpp21090_dropcol_splitdefpt_addcol_dml_timestamp ORDER BY 1,2,3;
           col1           |           col2           | col3 
--------------------------+--------------------------+------
 Tue Dec 31 12:00:00 2013 | Tue Dec 31 12:00:00 2013 | a
 Tue Dec 31 12:00:00 2013 | Tue Dec 31 12:00:00 2013 | b
(2 rows)

ALTER TABLE mpp21090_dropcol_splitdefpt_addcol_dml_timestamp SPLIT DEFAULT PARTITION at ('2013-12-15 12:00:00') into (partition partsplitone,partition def);
NOTICE:  exchanged partition "def" of relation "mpp21090_dropcol_splitdefpt_addcol_dml_timestamp" with relation "pg_temp_641614"
NOTICE:  dropped partition "def" for relation "mpp21090_dropcol_splitdefpt_addcol_dml_timestamp"
NOTICE:  CREATE TABLE will create partition "mpp21090_dropcol_splitdefpt_addcol_dml_times_1_prt_partsplitone" for table "mpp21090_dropcol_splitdefpt_addcol_dml_timestamp"
NOTICE:  CREATE TABLE will create partition "mpp21090_dropcol_splitdefpt_addcol_dml_timestamp_1_prt_def" for table "mpp21090_dropcol_splitdefpt_addcol_dml_timestamp"
INSERT INTO mpp21090_dropcol_splitdefpt_addcol_dml_timestamp SELECT '2013-12-01 12:00:00', '2013-12-01 12:00:00','e';
SELECT * FROM mpp21090_dropcol_splitdefpt_addcol_dml_timestamp ORDER BY 1,2,3;
           col1           |           col2           | col3 
--------------------------+--------------------------+------
 Sun Dec 01 12:00:00 2013 | Sun Dec 01 12:00:00 2013 | e
 Tue Dec 31 12:00:00 2013 | Tue Dec 31 12:00:00 2013 | a
 Tue Dec 31 12:00:00 2013 | Tue Dec 31 12:00:00 2013 | b
(3 rows)

ALTER TABLE mpp21090_dropcol_splitdefpt_addcol_dml_timestamp ADD COLUMN col5 timestamp DEFAULT '2013-12-31 12:00:00';
INSERT INTO mpp21090_dropcol_splitdefpt_addcol_dml_timestamp VALUES('2013-12-31 12:00:00','2013-12-31 12:00:00','c','2013-12-31 12:00:00');
SELECT * FROM mpp21090_dropcol_splitdefpt_addcol_dml_timestamp ORDER BY 1,2,3,4;
           col1           |           col2           | col3 |           col5           
--------------------------+--------------------------+------+--------------------------
 Sun Dec 01 12:00:00 2013 | Sun Dec 01 12:00:00 2013 | e    | Tue Dec 31 12:00:00 2013
 Tue Dec 31 12:00:00 2013 | Tue Dec 31 12:00:00 2013 | a    | Tue Dec 31 12:00:00 2013
 Tue Dec 31 12:00:00 2013 | Tue Dec 31 12:00:00 2013 | b    | Tue Dec 31 12:00:00 2013
 Tue Dec 31 12:00:00 2013 | Tue Dec 31 12:00:00 2013 | c    | Tue Dec 31 12:00:00 2013
(4 rows)

-- Update distribution key
UPDATE mpp21090_dropcol_splitdefpt_addcol_dml_timestamp SET col1 = '2014-02-10 12:00:00' WHERE col2 = '2013-12-01 12:00:00' AND col1 = '2013-12-01 12:00:00';
SELECT * FROM mpp21090_dropcol_splitdefpt_addcol_dml_timestamp ORDER BY 1,2,3;
           col1           |           col2           | col3 |           col5           
--------------------------+--------------------------+------+--------------------------
 Tue Dec 31 12:00:00 2013 | Tue Dec 31 12:00:00 2013 | a    | Tue Dec 31 12:00:00 2013
 Tue Dec 31 12:00:00 2013 | Tue Dec 31 12:00:00 2013 | b    | Tue Dec 31 12:00:00 2013
 Tue Dec 31 12:00:00 2013 | Tue Dec 31 12:00:00 2013 | c    | Tue Dec 31 12:00:00 2013
 Mon Feb 10 12:00:00 2014 | Sun Dec 01 12:00:00 2013 | e    | Tue Dec 31 12:00:00 2013
(4 rows)

-- Update partition key
UPDATE mpp21090_dropcol_splitdefpt_addcol_dml_timestamp SET col2 = '2014-02-10 12:00:00' WHERE col2 = '2013-12-01 12:00:00' AND col1 = '2014-02-10 12:00:00';
SELECT * FROM mpp21090_dropcol_splitdefpt_addcol_dml_timestamp ORDER BY 1,2,3;
           col1           |           col2           | col3 |           col5           
--------------------------+--------------------------+------+--------------------------
 Tue Dec 31 12:00:00 2013 | Tue Dec 31 12:00:00 2013 | a    | Tue Dec 31 12:00:00 2013
 Tue Dec 31 12:00:00 2013 | Tue Dec 31 12:00:00 2013 | b    | Tue Dec 31 12:00:00 2013
 Tue Dec 31 12:00:00 2013 | Tue Dec 31 12:00:00 2013 | c    | Tue Dec 31 12:00:00 2013
 Mon Feb 10 12:00:00 2014 | Mon Feb 10 12:00:00 2014 | e    | Tue Dec 31 12:00:00 2013
(4 rows)

DELETE FROM mpp21090_dropcol_splitdefpt_addcol_dml_timestamp WHERE col3='b';
SELECT * FROM mpp21090_dropcol_splitdefpt_addcol_dml_timestamp ORDER BY 1,2,3;
           col1           |           col2           | col3 |           col5           
--------------------------+--------------------------+------+--------------------------
 Tue Dec 31 12:00:00 2013 | Tue Dec 31 12:00:00 2013 | a    | Tue Dec 31 12:00:00 2013
 Tue Dec 31 12:00:00 2013 | Tue Dec 31 12:00:00 2013 | c    | Tue Dec 31 12:00:00 2013
 Mon Feb 10 12:00:00 2014 | Mon Feb 10 12:00:00 2014 | e    | Tue Dec 31 12:00:00 2013
(3 rows)

-- @author prabhd 
-- @created 2014-04-01 12:00:00
-- @modified 2012-04-01 12:00:00
-- @tags dml MPP-21090 ORCA
-- @optimizer_mode on	
-- @description Tests for MPP-21090
\echo --start_ignore
--start_ignore
\echo --end_ignore
--end_ignore
DROP TABLE IF EXISTS mpp21090_dropcol_splitdefpt_addcol_dml_timestamptz;
NOTICE:  table "mpp21090_dropcol_splitdefpt_addcol_dml_timestamptz" does not exist, skipping
CREATE TABLE mpp21090_dropcol_splitdefpt_addcol_dml_timestamptz
(
    col1 timestamptz,
    col2 timestamptz,
    col3 char,
    col4 timestamptz
) 
DISTRIBUTED by (col1)
PARTITION BY LIST(col2)
(
default partition def
);
NOTICE:  CREATE TABLE will create partition "mpp21090_dropcol_splitdefpt_addcol_dml_timestamptz_1_prt_def" for table "mpp21090_dropcol_splitdefpt_addcol_dml_timestamptz"
INSERT INTO mpp21090_dropcol_splitdefpt_addcol_dml_timestamptz VALUES('2013-12-31 12:00:00 PST','2013-12-31 12:00:00 PST','a','2013-12-31 12:00:00 PST');
SELECT * FROM mpp21090_dropcol_splitdefpt_addcol_dml_timestamptz ORDER BY 1,2,3,4;
             col1             |             col2             | col3 |             col4             
------------------------------+------------------------------+------+------------------------------
 Tue Dec 31 12:00:00 2013 PST | Tue Dec 31 12:00:00 2013 PST | a    | Tue Dec 31 12:00:00 2013 PST
(1 row)

ALTER TABLE mpp21090_dropcol_splitdefpt_addcol_dml_timestamptz DROP COLUMN col4;
INSERT INTO mpp21090_dropcol_splitdefpt_addcol_dml_timestamptz VALUES('2013-12-31 12:00:00 PST','2013-12-31 12:00:00 PST','b');
SELECT * FROM mpp21090_dropcol_splitdefpt_addcol_dml_timestamptz ORDER BY 1,2,3;
             col1             |             col2             | col3 
------------------------------+------------------------------+------
 Tue Dec 31 12:00:00 2013 PST | Tue Dec 31 12:00:00 2013 PST | a
 Tue Dec 31 12:00:00 2013 PST | Tue Dec 31 12:00:00 2013 PST | b
(2 rows)

ALTER TABLE mpp21090_dropcol_splitdefpt_addcol_dml_timestamptz SPLIT DEFAULT PARTITION at ('2013-12-15 12:00:00 PST') into (partition partsplitone,partition def);
NOTICE:  exchanged partition "def" of relation "mpp21090_dropcol_splitdefpt_addcol_dml_timestamptz" with relation "pg_temp_641967"
NOTICE:  dropped partition "def" for relation "mpp21090_dropcol_splitdefpt_addcol_dml_timestamptz"
NOTICE:  CREATE TABLE will create partition "mpp21090_dropcol_splitdefpt_addcol_dml_time_1_prt_partsplitone1" for table "mpp21090_dropcol_splitdefpt_addcol_dml_timestamptz"
NOTICE:  CREATE TABLE will create partition "mpp21090_dropcol_splitdefpt_addcol_dml_timestamptz_1_prt_def" for table "mpp21090_dropcol_splitdefpt_addcol_dml_timestamptz"
INSERT INTO mpp21090_dropcol_splitdefpt_addcol_dml_timestamptz SELECT '2013-12-01 12:00:00 PST', '2013-12-01 12:00:00 PST','e';
SELECT * FROM mpp21090_dropcol_splitdefpt_addcol_dml_timestamptz ORDER BY 1,2,3;
             col1             |             col2             | col3 
------------------------------+------------------------------+------
 Sun Dec 01 12:00:00 2013 PST | Sun Dec 01 12:00:00 2013 PST | e
 Tue Dec 31 12:00:00 2013 PST | Tue Dec 31 12:00:00 2013 PST | a
 Tue Dec 31 12:00:00 2013 PST | Tue Dec 31 12:00:00 2013 PST | b
(3 rows)

ALTER TABLE mpp21090_dropcol_splitdefpt_addcol_dml_timestamptz ADD COLUMN col5 timestamptz DEFAULT '2013-12-31 12:00:00 PST';
INSERT INTO mpp21090_dropcol_splitdefpt_addcol_dml_timestamptz VALUES('2013-12-31 12:00:00 PST','2013-12-31 12:00:00 PST','c','2013-12-31 12:00:00 PST');
SELECT * FROM mpp21090_dropcol_splitdefpt_addcol_dml_timestamptz ORDER BY 1,2,3,4;
             col1             |             col2             | col3 |             col5             
------------------------------+------------------------------+------+------------------------------
 Sun Dec 01 12:00:00 2013 PST | Sun Dec 01 12:00:00 2013 PST | e    | Tue Dec 31 12:00:00 2013 PST
 Tue Dec 31 12:00:00 2013 PST | Tue Dec 31 12:00:00 2013 PST | a    | Tue Dec 31 12:00:00 2013 PST
 Tue Dec 31 12:00:00 2013 PST | Tue Dec 31 12:00:00 2013 PST | b    | Tue Dec 31 12:00:00 2013 PST
 Tue Dec 31 12:00:00 2013 PST | Tue Dec 31 12:00:00 2013 PST | c    | Tue Dec 31 12:00:00 2013 PST
(4 rows)

-- Update distribution key
UPDATE mpp21090_dropcol_splitdefpt_addcol_dml_timestamptz SET col1 = '2014-02-10 12:00:00 PST' WHERE col2 = '2013-12-01 12:00:00 PST' AND col1 = '2013-12-01 12:00:00 PST';
SELECT * FROM mpp21090_dropcol_splitdefpt_addcol_dml_timestamptz ORDER BY 1,2,3;
             col1             |             col2             | col3 |             col5             
------------------------------+------------------------------+------+------------------------------
 Tue Dec 31 12:00:00 2013 PST | Tue Dec 31 12:00:00 2013 PST | a    | Tue Dec 31 12:00:00 2013 PST
 Tue Dec 31 12:00:00 2013 PST | Tue Dec 31 12:00:00 2013 PST | b    | Tue Dec 31 12:00:00 2013 PST
 Tue Dec 31 12:00:00 2013 PST | Tue Dec 31 12:00:00 2013 PST | c    | Tue Dec 31 12:00:00 2013 PST
 Mon Feb 10 12:00:00 2014 PST | Sun Dec 01 12:00:00 2013 PST | e    | Tue Dec 31 12:00:00 2013 PST
(4 rows)

-- Update partition key
UPDATE mpp21090_dropcol_splitdefpt_addcol_dml_timestamptz SET col2 = '2014-02-10 12:00:00 PST' WHERE col2 = '2013-12-01 12:00:00 PST' AND col1 = '2014-02-10 12:00:00 PST';
SELECT * FROM mpp21090_dropcol_splitdefpt_addcol_dml_timestamptz ORDER BY 1,2,3;
             col1             |             col2             | col3 |             col5             
------------------------------+------------------------------+------+------------------------------
 Tue Dec 31 12:00:00 2013 PST | Tue Dec 31 12:00:00 2013 PST | a    | Tue Dec 31 12:00:00 2013 PST
 Tue Dec 31 12:00:00 2013 PST | Tue Dec 31 12:00:00 2013 PST | b    | Tue Dec 31 12:00:00 2013 PST
 Tue Dec 31 12:00:00 2013 PST | Tue Dec 31 12:00:00 2013 PST | c    | Tue Dec 31 12:00:00 2013 PST
 Mon Feb 10 12:00:00 2014 PST | Mon Feb 10 12:00:00 2014 PST | e    | Tue Dec 31 12:00:00 2013 PST
(4 rows)

DELETE FROM mpp21090_dropcol_splitdefpt_addcol_dml_timestamptz WHERE col3='b';
SELECT * FROM mpp21090_dropcol_splitdefpt_addcol_dml_timestamptz ORDER BY 1,2,3;
             col1             |             col2             | col3 |             col5             
------------------------------+------------------------------+------+------------------------------
 Tue Dec 31 12:00:00 2013 PST | Tue Dec 31 12:00:00 2013 PST | a    | Tue Dec 31 12:00:00 2013 PST
 Tue Dec 31 12:00:00 2013 PST | Tue Dec 31 12:00:00 2013 PST | c    | Tue Dec 31 12:00:00 2013 PST
 Mon Feb 10 12:00:00 2014 PST | Mon Feb 10 12:00:00 2014 PST | e    | Tue Dec 31 12:00:00 2013 PST
(3 rows)

-- @author prabhd 
-- @created 2014-04-01 12:00:00
-- @modified 2012-04-01 12:00:00
-- @tags dml MPP-21090 ORCA
-- @optimizer_mode on	
-- @description Tests for MPP-21090
\echo --start_ignore
--start_ignore
\echo --end_ignore
--end_ignore
DROP TABLE IF EXISTS mpp21090_dropcol_splitdfpt_dml_char;
NOTICE:  table "mpp21090_dropcol_splitdfpt_dml_char" does not exist, skipping
CREATE TABLE mpp21090_dropcol_splitdfpt_dml_char
(
    col1 char,
    col2 char,
    col3 char,
    col4 char,
    col5 int
) 
DISTRIBUTED by (col1)
PARTITION BY LIST(col2)
(
default partition def
);
NOTICE:  CREATE TABLE will create partition "mpp21090_dropcol_splitdfpt_dml_char_1_prt_def" for table "mpp21090_dropcol_splitdfpt_dml_char"
INSERT INTO mpp21090_dropcol_splitdfpt_dml_char VALUES('x','x','a','x',0);
SELECT * FROM mpp21090_dropcol_splitdfpt_dml_char ORDER BY 1,2,3,4;
 col1 | col2 | col3 | col4 | col5 
------+------+------+------+------
 x    | x    | a    | x    |    0
(1 row)

ALTER TABLE mpp21090_dropcol_splitdfpt_dml_char DROP COLUMN col4;
ALTER TABLE mpp21090_dropcol_splitdfpt_dml_char SPLIT DEFAULT PARTITION at ('d') into (partition partsplitone,partition def);
NOTICE:  exchanged partition "def" of relation "mpp21090_dropcol_splitdfpt_dml_char" with relation "pg_temp_642320"
NOTICE:  dropped partition "def" for relation "mpp21090_dropcol_splitdfpt_dml_char"
NOTICE:  CREATE TABLE will create partition "mpp21090_dropcol_splitdfpt_dml_char_1_prt_partsplitone" for table "mpp21090_dropcol_splitdfpt_dml_char"
NOTICE:  CREATE TABLE will create partition "mpp21090_dropcol_splitdfpt_dml_char_1_prt_def" for table "mpp21090_dropcol_splitdfpt_dml_char"
INSERT INTO mpp21090_dropcol_splitdfpt_dml_char SELECT 'a', 'a','b', 1;
SELECT * FROM mpp21090_dropcol_splitdfpt_dml_char ORDER BY 1,2,3;
 col1 | col2 | col3 | col5 
------+------+------+------
 a    | a    | b    |    1
 x    | x    | a    |    0
(2 rows)

-- Update distribution key
UPDATE mpp21090_dropcol_splitdfpt_dml_char SET col1 = 'z' WHERE col2 = 'a' AND col1 = 'a';
SELECT * FROM mpp21090_dropcol_splitdfpt_dml_char ORDER BY 1,2,3;
 col1 | col2 | col3 | col5 
------+------+------+------
 x    | x    | a    |    0
 z    | a    | b    |    1
(2 rows)

-- Update partition key
UPDATE mpp21090_dropcol_splitdfpt_dml_char SET col2 = 'z' WHERE col2 = 'a' AND col1 = 'z';
SELECT * FROM mpp21090_dropcol_splitdfpt_dml_char ORDER BY 1,2,3;
 col1 | col2 | col3 | col5 
------+------+------+------
 x    | x    | a    |    0
 z    | z    | b    |    1
(2 rows)

DELETE FROM mpp21090_dropcol_splitdfpt_dml_char WHERE col3='b';
SELECT * FROM mpp21090_dropcol_splitdfpt_dml_char ORDER BY 1,2,3;
 col1 | col2 | col3 | col5 
------+------+------+------
 x    | x    | a    |    0
(1 row)

-- @author prabhd 
-- @created 2014-04-01 12:00:00
-- @modified 2012-04-01 12:00:00
-- @tags dml MPP-21090 ORCA
-- @optimizer_mode on	
-- @description Tests for MPP-21090
\echo --start_ignore
--start_ignore
\echo --end_ignore
--end_ignore
DROP TABLE IF EXISTS mpp21090_dropcol_splitdfpt_dml_date;
NOTICE:  table "mpp21090_dropcol_splitdfpt_dml_date" does not exist, skipping
CREATE TABLE mpp21090_dropcol_splitdfpt_dml_date
(
    col1 date,
    col2 date,
    col3 char,
    col4 date,
    col5 int
) 
DISTRIBUTED by (col1)
PARTITION BY LIST(col2)
(
default partition def
);
NOTICE:  CREATE TABLE will create partition "mpp21090_dropcol_splitdfpt_dml_date_1_prt_def" for table "mpp21090_dropcol_splitdfpt_dml_date"
INSERT INTO mpp21090_dropcol_splitdfpt_dml_date VALUES('2013-12-31','2013-12-31','a','2013-12-31',0);
SELECT * FROM mpp21090_dropcol_splitdfpt_dml_date ORDER BY 1,2,3,4;
    col1    |    col2    | col3 |    col4    | col5 
------------+------------+------+------------+------
 12-31-2013 | 12-31-2013 | a    | 12-31-2013 |    0
(1 row)

ALTER TABLE mpp21090_dropcol_splitdfpt_dml_date DROP COLUMN col4;
ALTER TABLE mpp21090_dropcol_splitdfpt_dml_date SPLIT DEFAULT PARTITION at ('2013-12-15') into (partition partsplitone,partition def);
NOTICE:  exchanged partition "def" of relation "mpp21090_dropcol_splitdfpt_dml_date" with relation "pg_temp_642559"
NOTICE:  dropped partition "def" for relation "mpp21090_dropcol_splitdfpt_dml_date"
NOTICE:  CREATE TABLE will create partition "mpp21090_dropcol_splitdfpt_dml_date_1_prt_partsplitone" for table "mpp21090_dropcol_splitdfpt_dml_date"
NOTICE:  CREATE TABLE will create partition "mpp21090_dropcol_splitdfpt_dml_date_1_prt_def" for table "mpp21090_dropcol_splitdfpt_dml_date"
INSERT INTO mpp21090_dropcol_splitdfpt_dml_date SELECT '2013-12-01', '2013-12-01','b', 1;
SELECT * FROM mpp21090_dropcol_splitdfpt_dml_date ORDER BY 1,2,3;
    col1    |    col2    | col3 | col5 
------------+------------+------+------
 12-01-2013 | 12-01-2013 | b    |    1
 12-31-2013 | 12-31-2013 | a    |    0
(2 rows)

-- Update distribution key
UPDATE mpp21090_dropcol_splitdfpt_dml_date SET col1 = '2014-02-10' WHERE col2 = '2013-12-01' AND col1 = '2013-12-01';
SELECT * FROM mpp21090_dropcol_splitdfpt_dml_date ORDER BY 1,2,3;
    col1    |    col2    | col3 | col5 
------------+------------+------+------
 12-31-2013 | 12-31-2013 | a    |    0
 02-10-2014 | 12-01-2013 | b    |    1
(2 rows)

-- Update partition key
UPDATE mpp21090_dropcol_splitdfpt_dml_date SET col2 = '2014-02-10' WHERE col2 = '2013-12-01' AND col1 = '2014-02-10';
SELECT * FROM mpp21090_dropcol_splitdfpt_dml_date ORDER BY 1,2,3;
    col1    |    col2    | col3 | col5 
------------+------------+------+------
 12-31-2013 | 12-31-2013 | a    |    0
 02-10-2014 | 02-10-2014 | b    |    1
(2 rows)

DELETE FROM mpp21090_dropcol_splitdfpt_dml_date WHERE col3='b';
SELECT * FROM mpp21090_dropcol_splitdfpt_dml_date ORDER BY 1,2,3;
    col1    |    col2    | col3 | col5 
------------+------------+------+------
 12-31-2013 | 12-31-2013 | a    |    0
(1 row)

-- @author prabhd 
-- @created 2014-04-01 12:00:00
-- @modified 2012-04-01 12:00:00
-- @tags dml MPP-21090 ORCA
-- @optimizer_mode on	
-- @description Tests for MPP-21090
\echo --start_ignore
--start_ignore
\echo --end_ignore
--end_ignore
DROP TABLE IF EXISTS mpp21090_dropcol_splitdfpt_dml_decimal;
NOTICE:  table "mpp21090_dropcol_splitdfpt_dml_decimal" does not exist, skipping
CREATE TABLE mpp21090_dropcol_splitdfpt_dml_decimal
(
    col1 decimal,
    col2 decimal,
    col3 char,
    col4 decimal,
    col5 int
) 
DISTRIBUTED by (col1)
PARTITION BY LIST(col2)
(
default partition def
);
NOTICE:  CREATE TABLE will create partition "mpp21090_dropcol_splitdfpt_dml_decimal_1_prt_def" for table "mpp21090_dropcol_splitdfpt_dml_decimal"
INSERT INTO mpp21090_dropcol_splitdfpt_dml_decimal VALUES(2.00,2.00,'a',2.00,0);
SELECT * FROM mpp21090_dropcol_splitdfpt_dml_decimal ORDER BY 1,2,3,4;
 col1 | col2 | col3 | col4 | col5 
------+------+------+------+------
 2.00 | 2.00 | a    | 2.00 |    0
(1 row)

ALTER TABLE mpp21090_dropcol_splitdfpt_dml_decimal DROP COLUMN col4;
ALTER TABLE mpp21090_dropcol_splitdfpt_dml_decimal SPLIT DEFAULT PARTITION at (5.00) into (partition partsplitone,partition def);
NOTICE:  exchanged partition "def" of relation "mpp21090_dropcol_splitdfpt_dml_decimal" with relation "pg_temp_642798"
NOTICE:  dropped partition "def" for relation "mpp21090_dropcol_splitdfpt_dml_decimal"
NOTICE:  CREATE TABLE will create partition "mpp21090_dropcol_splitdfpt_dml_decimal_1_prt_partsplitone" for table "mpp21090_dropcol_splitdfpt_dml_decimal"
NOTICE:  CREATE TABLE will create partition "mpp21090_dropcol_splitdfpt_dml_decimal_1_prt_def" for table "mpp21090_dropcol_splitdfpt_dml_decimal"
INSERT INTO mpp21090_dropcol_splitdfpt_dml_decimal SELECT 1.00, 1.00,'b', 1;
SELECT * FROM mpp21090_dropcol_splitdfpt_dml_decimal ORDER BY 1,2,3;
 col1 | col2 | col3 | col5 
------+------+------+------
 1.00 | 1.00 | b    |    1
 2.00 | 2.00 | a    |    0
(2 rows)

-- Update distribution key
UPDATE mpp21090_dropcol_splitdfpt_dml_decimal SET col1 = 35.00 WHERE col2 = 1.00 AND col1 = 1.00;
SELECT * FROM mpp21090_dropcol_splitdfpt_dml_decimal ORDER BY 1,2,3;
 col1  | col2 | col3 | col5 
-------+------+------+------
  2.00 | 2.00 | a    |    0
 35.00 | 1.00 | b    |    1
(2 rows)

-- Update partition key
UPDATE mpp21090_dropcol_splitdfpt_dml_decimal SET col2 = 35.00 WHERE col2 = 1.00 AND col1 = 35.00;
SELECT * FROM mpp21090_dropcol_splitdfpt_dml_decimal ORDER BY 1,2,3;
 col1  | col2  | col3 | col5 
-------+-------+------+------
  2.00 |  2.00 | a    |    0
 35.00 | 35.00 | b    |    1
(2 rows)

DELETE FROM mpp21090_dropcol_splitdfpt_dml_decimal WHERE col3='b';
SELECT * FROM mpp21090_dropcol_splitdfpt_dml_decimal ORDER BY 1,2,3;
 col1 | col2 | col3 | col5 
------+------+------+------
 2.00 | 2.00 | a    |    0
(1 row)

-- @author prabhd 
-- @created 2014-04-01 12:00:00
-- @modified 2012-04-01 12:00:00
-- @tags dml MPP-21090 ORCA
-- @optimizer_mode on	
-- @description Tests for MPP-21090
\echo --start_ignore
--start_ignore
\echo --end_ignore
--end_ignore
DROP TABLE IF EXISTS mpp21090_dropcol_splitdfpt_dml_float;
NOTICE:  table "mpp21090_dropcol_splitdfpt_dml_float" does not exist, skipping
CREATE TABLE mpp21090_dropcol_splitdfpt_dml_float
(
    col1 float,
    col2 float,
    col3 char,
    col4 float,
    col5 int
) 
DISTRIBUTED by (col1)
PARTITION BY LIST(col2)
(
default partition def
);
NOTICE:  CREATE TABLE will create partition "mpp21090_dropcol_splitdfpt_dml_float_1_prt_def" for table "mpp21090_dropcol_splitdfpt_dml_float"
INSERT INTO mpp21090_dropcol_splitdfpt_dml_float VALUES(2.00,2.00,'a',2.00,0);
SELECT * FROM mpp21090_dropcol_splitdfpt_dml_float ORDER BY 1,2,3,4;
 col1 | col2 | col3 | col4 | col5 
------+------+------+------+------
    2 |    2 | a    |    2 |    0
(1 row)

ALTER TABLE mpp21090_dropcol_splitdfpt_dml_float DROP COLUMN col4;
ALTER TABLE mpp21090_dropcol_splitdfpt_dml_float SPLIT DEFAULT PARTITION at (5.00) into (partition partsplitone,partition def);
NOTICE:  exchanged partition "def" of relation "mpp21090_dropcol_splitdfpt_dml_float" with relation "pg_temp_643047"
NOTICE:  dropped partition "def" for relation "mpp21090_dropcol_splitdfpt_dml_float"
NOTICE:  CREATE TABLE will create partition "mpp21090_dropcol_splitdfpt_dml_float_1_prt_partsplitone" for table "mpp21090_dropcol_splitdfpt_dml_float"
NOTICE:  CREATE TABLE will create partition "mpp21090_dropcol_splitdfpt_dml_float_1_prt_def" for table "mpp21090_dropcol_splitdfpt_dml_float"
INSERT INTO mpp21090_dropcol_splitdfpt_dml_float SELECT 1.00, 1.00,'b', 1;
SELECT * FROM mpp21090_dropcol_splitdfpt_dml_float ORDER BY 1,2,3;
 col1 | col2 | col3 | col5 
------+------+------+------
    1 |    1 | b    |    1
    2 |    2 | a    |    0
(2 rows)

-- Update distribution key
UPDATE mpp21090_dropcol_splitdfpt_dml_float SET col1 = 35.00 WHERE col2 = 1.00 AND col1 = 1.00;
SELECT * FROM mpp21090_dropcol_splitdfpt_dml_float ORDER BY 1,2,3;
 col1 | col2 | col3 | col5 
------+------+------+------
    2 |    2 | a    |    0
   35 |    1 | b    |    1
(2 rows)

-- Update partition key
UPDATE mpp21090_dropcol_splitdfpt_dml_float SET col2 = 35.00 WHERE col2 = 1.00 AND col1 = 35.00;
SELECT * FROM mpp21090_dropcol_splitdfpt_dml_float ORDER BY 1,2,3;
 col1 | col2 | col3 | col5 
------+------+------+------
    2 |    2 | a    |    0
   35 |   35 | b    |    1
(2 rows)

DELETE FROM mpp21090_dropcol_splitdfpt_dml_float WHERE col3='b';
SELECT * FROM mpp21090_dropcol_splitdfpt_dml_float ORDER BY 1,2,3;
 col1 | col2 | col3 | col5 
------+------+------+------
    2 |    2 | a    |    0
(1 row)

-- @author prabhd 
-- @created 2014-04-01 12:00:00
-- @modified 2012-04-01 12:00:00
-- @tags dml MPP-21090 ORCA
-- @optimizer_mode on	
-- @description Tests for MPP-21090
\echo --start_ignore
--start_ignore
\echo --end_ignore
--end_ignore
DROP TABLE IF EXISTS mpp21090_dropcol_splitdfpt_dml_int;
NOTICE:  table "mpp21090_dropcol_splitdfpt_dml_int" does not exist, skipping
CREATE TABLE mpp21090_dropcol_splitdfpt_dml_int
(
    col1 int,
    col2 int,
    col3 char,
    col4 int,
    col5 int
) 
DISTRIBUTED by (col1)
PARTITION BY LIST(col2)
(
default partition def
);
NOTICE:  CREATE TABLE will create partition "mpp21090_dropcol_splitdfpt_dml_int_1_prt_def" for table "mpp21090_dropcol_splitdfpt_dml_int"
INSERT INTO mpp21090_dropcol_splitdfpt_dml_int VALUES(20000,20000,'a',20000,0);
SELECT * FROM mpp21090_dropcol_splitdfpt_dml_int ORDER BY 1,2,3,4;
 col1  | col2  | col3 | col4  | col5 
-------+-------+------+-------+------
 20000 | 20000 | a    | 20000 |    0
(1 row)

ALTER TABLE mpp21090_dropcol_splitdfpt_dml_int DROP COLUMN col4;
ALTER TABLE mpp21090_dropcol_splitdfpt_dml_int SPLIT DEFAULT PARTITION at (5000) into (partition partsplitone,partition def);
NOTICE:  exchanged partition "def" of relation "mpp21090_dropcol_splitdfpt_dml_int" with relation "pg_temp_643286"
NOTICE:  dropped partition "def" for relation "mpp21090_dropcol_splitdfpt_dml_int"
NOTICE:  CREATE TABLE will create partition "mpp21090_dropcol_splitdfpt_dml_int_1_prt_partsplitone" for table "mpp21090_dropcol_splitdfpt_dml_int"
NOTICE:  CREATE TABLE will create partition "mpp21090_dropcol_splitdfpt_dml_int_1_prt_def" for table "mpp21090_dropcol_splitdfpt_dml_int"
INSERT INTO mpp21090_dropcol_splitdfpt_dml_int SELECT 1000, 1000,'b', 1;
SELECT * FROM mpp21090_dropcol_splitdfpt_dml_int ORDER BY 1,2,3;
 col1  | col2  | col3 | col5 
-------+-------+------+------
  1000 |  1000 | b    |    1
 20000 | 20000 | a    |    0
(2 rows)

-- Update distribution key
UPDATE mpp21090_dropcol_splitdfpt_dml_int SET col1 = 35000 WHERE col2 = 1000 AND col1 = 1000;
SELECT * FROM mpp21090_dropcol_splitdfpt_dml_int ORDER BY 1,2,3;
 col1  | col2  | col3 | col5 
-------+-------+------+------
 20000 | 20000 | a    |    0
 35000 |  1000 | b    |    1
(2 rows)

-- Update partition key
UPDATE mpp21090_dropcol_splitdfpt_dml_int SET col2 = 35000 WHERE col2 = 1000 AND col1 = 35000;
SELECT * FROM mpp21090_dropcol_splitdfpt_dml_int ORDER BY 1,2,3;
 col1  | col2  | col3 | col5 
-------+-------+------+------
 20000 | 20000 | a    |    0
 35000 | 35000 | b    |    1
(2 rows)

DELETE FROM mpp21090_dropcol_splitdfpt_dml_int WHERE col3='b';
SELECT * FROM mpp21090_dropcol_splitdfpt_dml_int ORDER BY 1,2,3;
 col1  | col2  | col3 | col5 
-------+-------+------+------
 20000 | 20000 | a    |    0
(1 row)

-- @author prabhd 
-- @created 2014-04-01 12:00:00
-- @modified 2012-04-01 12:00:00
-- @tags dml MPP-21090 ORCA
-- @optimizer_mode on	
-- @description Tests for MPP-21090
\echo --start_ignore
--start_ignore
\echo --end_ignore
--end_ignore
DROP TABLE IF EXISTS mpp21090_dropcol_splitdfpt_dml_int4;
NOTICE:  table "mpp21090_dropcol_splitdfpt_dml_int4" does not exist, skipping
CREATE TABLE mpp21090_dropcol_splitdfpt_dml_int4
(
    col1 int4,
    col2 int4,
    col3 char,
    col4 int4,
    col5 int
) 
DISTRIBUTED by (col1)
PARTITION BY LIST(col2)
(
default partition def
);
NOTICE:  CREATE TABLE will create partition "mpp21090_dropcol_splitdfpt_dml_int4_1_prt_def" for table "mpp21090_dropcol_splitdfpt_dml_int4"
INSERT INTO mpp21090_dropcol_splitdfpt_dml_int4 VALUES(20000000,20000000,'a',20000000,0);
SELECT * FROM mpp21090_dropcol_splitdfpt_dml_int4 ORDER BY 1,2,3,4;
   col1   |   col2   | col3 |   col4   | col5 
----------+----------+------+----------+------
 20000000 | 20000000 | a    | 20000000 |    0
(1 row)

ALTER TABLE mpp21090_dropcol_splitdfpt_dml_int4 DROP COLUMN col4;
ALTER TABLE mpp21090_dropcol_splitdfpt_dml_int4 SPLIT DEFAULT PARTITION at (50000000) into (partition partsplitone,partition def);
NOTICE:  exchanged partition "def" of relation "mpp21090_dropcol_splitdfpt_dml_int4" with relation "pg_temp_643525"
NOTICE:  dropped partition "def" for relation "mpp21090_dropcol_splitdfpt_dml_int4"
NOTICE:  CREATE TABLE will create partition "mpp21090_dropcol_splitdfpt_dml_int4_1_prt_partsplitone" for table "mpp21090_dropcol_splitdfpt_dml_int4"
NOTICE:  CREATE TABLE will create partition "mpp21090_dropcol_splitdfpt_dml_int4_1_prt_def" for table "mpp21090_dropcol_splitdfpt_dml_int4"
INSERT INTO mpp21090_dropcol_splitdfpt_dml_int4 SELECT 10000000, 10000000,'b', 1;
SELECT * FROM mpp21090_dropcol_splitdfpt_dml_int4 ORDER BY 1,2,3;
   col1   |   col2   | col3 | col5 
----------+----------+------+------
 10000000 | 10000000 | b    |    1
 20000000 | 20000000 | a    |    0
(2 rows)

-- Update distribution key
UPDATE mpp21090_dropcol_splitdfpt_dml_int4 SET col1 = 35000000 WHERE col2 = 10000000 AND col1 = 10000000;
SELECT * FROM mpp21090_dropcol_splitdfpt_dml_int4 ORDER BY 1,2,3;
   col1   |   col2   | col3 | col5 
----------+----------+------+------
 20000000 | 20000000 | a    |    0
 35000000 | 10000000 | b    |    1
(2 rows)

-- Update partition key
UPDATE mpp21090_dropcol_splitdfpt_dml_int4 SET col2 = 35000000 WHERE col2 = 10000000 AND col1 = 35000000;
SELECT * FROM mpp21090_dropcol_splitdfpt_dml_int4 ORDER BY 1,2,3;
   col1   |   col2   | col3 | col5 
----------+----------+------+------
 20000000 | 20000000 | a    |    0
 35000000 | 35000000 | b    |    1
(2 rows)

DELETE FROM mpp21090_dropcol_splitdfpt_dml_int4 WHERE col3='b';
SELECT * FROM mpp21090_dropcol_splitdfpt_dml_int4 ORDER BY 1,2,3;
   col1   |   col2   | col3 | col5 
----------+----------+------+------
 20000000 | 20000000 | a    |    0
(1 row)

-- @author prabhd 
-- @created 2014-04-01 12:00:00
-- @modified 2012-04-01 12:00:00
-- @tags dml MPP-21090 ORCA
-- @optimizer_mode on	
-- @description Tests for MPP-21090
\echo --start_ignore
--start_ignore
\echo --end_ignore
--end_ignore
DROP TABLE IF EXISTS mpp21090_dropcol_splitdfpt_dml_int8;
NOTICE:  table "mpp21090_dropcol_splitdfpt_dml_int8" does not exist, skipping
CREATE TABLE mpp21090_dropcol_splitdfpt_dml_int8
(
    col1 int8,
    col2 int8,
    col3 char,
    col4 int8,
    col5 int
) 
DISTRIBUTED by (col1)
PARTITION BY LIST(col2)
(
default partition def
);
NOTICE:  CREATE TABLE will create partition "mpp21090_dropcol_splitdfpt_dml_int8_1_prt_def" for table "mpp21090_dropcol_splitdfpt_dml_int8"
INSERT INTO mpp21090_dropcol_splitdfpt_dml_int8 VALUES(2000000000000000000,2000000000000000000,'a',2000000000000000000,0);
SELECT * FROM mpp21090_dropcol_splitdfpt_dml_int8 ORDER BY 1,2,3,4;
        col1         |        col2         | col3 |        col4         | col5 
---------------------+---------------------+------+---------------------+------
 2000000000000000000 | 2000000000000000000 | a    | 2000000000000000000 |    0
(1 row)

ALTER TABLE mpp21090_dropcol_splitdfpt_dml_int8 DROP COLUMN col4;
ALTER TABLE mpp21090_dropcol_splitdfpt_dml_int8 SPLIT DEFAULT PARTITION at (500000000000000000) into (partition partsplitone,partition def);
NOTICE:  exchanged partition "def" of relation "mpp21090_dropcol_splitdfpt_dml_int8" with relation "pg_temp_643764"
NOTICE:  dropped partition "def" for relation "mpp21090_dropcol_splitdfpt_dml_int8"
NOTICE:  CREATE TABLE will create partition "mpp21090_dropcol_splitdfpt_dml_int8_1_prt_partsplitone" for table "mpp21090_dropcol_splitdfpt_dml_int8"
NOTICE:  CREATE TABLE will create partition "mpp21090_dropcol_splitdfpt_dml_int8_1_prt_def" for table "mpp21090_dropcol_splitdfpt_dml_int8"
INSERT INTO mpp21090_dropcol_splitdfpt_dml_int8 SELECT 100000000000000000, 100000000000000000,'b', 1;
SELECT * FROM mpp21090_dropcol_splitdfpt_dml_int8 ORDER BY 1,2,3;
        col1         |        col2         | col3 | col5 
---------------------+---------------------+------+------
  100000000000000000 |  100000000000000000 | b    |    1
 2000000000000000000 | 2000000000000000000 | a    |    0
(2 rows)

-- Update distribution key
UPDATE mpp21090_dropcol_splitdfpt_dml_int8 SET col1 = 3500000000000000000 WHERE col2 = 100000000000000000 AND col1 = 100000000000000000;
SELECT * FROM mpp21090_dropcol_splitdfpt_dml_int8 ORDER BY 1,2,3;
        col1         |        col2         | col3 | col5 
---------------------+---------------------+------+------
 2000000000000000000 | 2000000000000000000 | a    |    0
 3500000000000000000 |  100000000000000000 | b    |    1
(2 rows)

-- Update partition key
UPDATE mpp21090_dropcol_splitdfpt_dml_int8 SET col2 = 3500000000000000000 WHERE col2 = 100000000000000000 AND col1 = 3500000000000000000;
SELECT * FROM mpp21090_dropcol_splitdfpt_dml_int8 ORDER BY 1,2,3;
        col1         |        col2         | col3 | col5 
---------------------+---------------------+------+------
 2000000000000000000 | 2000000000000000000 | a    |    0
 3500000000000000000 | 3500000000000000000 | b    |    1
(2 rows)

DELETE FROM mpp21090_dropcol_splitdfpt_dml_int8 WHERE col3='b';
SELECT * FROM mpp21090_dropcol_splitdfpt_dml_int8 ORDER BY 1,2,3;
        col1         |        col2         | col3 | col5 
---------------------+---------------------+------+------
 2000000000000000000 | 2000000000000000000 | a    |    0
(1 row)

-- @author prabhd 
-- @created 2014-04-01 12:00:00
-- @modified 2012-04-01 12:00:00
-- @tags dml MPP-21090 ORCA
-- @optimizer_mode on	
-- @description Tests for MPP-21090
\echo --start_ignore
--start_ignore
\echo --end_ignore
--end_ignore
DROP TABLE IF EXISTS mpp21090_dropcol_splitdfpt_dml_interval;
NOTICE:  table "mpp21090_dropcol_splitdfpt_dml_interval" does not exist, skipping
CREATE TABLE mpp21090_dropcol_splitdfpt_dml_interval
(
    col1 interval,
    col2 interval,
    col3 char,
    col4 interval,
    col5 int
) 
DISTRIBUTED by (col1)
PARTITION BY LIST(col2)
(
default partition def
);
NOTICE:  CREATE TABLE will create partition "mpp21090_dropcol_splitdfpt_dml_interval_1_prt_def" for table "mpp21090_dropcol_splitdfpt_dml_interval"
INSERT INTO mpp21090_dropcol_splitdfpt_dml_interval VALUES('1 hour','1 hour','a','1 hour',0);
SELECT * FROM mpp21090_dropcol_splitdfpt_dml_interval ORDER BY 1,2,3,4;
   col1   |   col2   | col3 |   col4   | col5 
----------+----------+------+----------+------
 @ 1 hour | @ 1 hour | a    | @ 1 hour |    0
(1 row)

ALTER TABLE mpp21090_dropcol_splitdfpt_dml_interval DROP COLUMN col4;
ALTER TABLE mpp21090_dropcol_splitdfpt_dml_interval SPLIT DEFAULT PARTITION at ('30 secs') into (partition partsplitone,partition def);
NOTICE:  exchanged partition "def" of relation "mpp21090_dropcol_splitdfpt_dml_interval" with relation "pg_temp_644003"
NOTICE:  dropped partition "def" for relation "mpp21090_dropcol_splitdfpt_dml_interval"
NOTICE:  CREATE TABLE will create partition "mpp21090_dropcol_splitdfpt_dml_interval_1_prt_partsplitone" for table "mpp21090_dropcol_splitdfpt_dml_interval"
NOTICE:  CREATE TABLE will create partition "mpp21090_dropcol_splitdfpt_dml_interval_1_prt_def" for table "mpp21090_dropcol_splitdfpt_dml_interval"
INSERT INTO mpp21090_dropcol_splitdfpt_dml_interval SELECT '1 sec', '1 sec','b', 1;
SELECT * FROM mpp21090_dropcol_splitdfpt_dml_interval ORDER BY 1,2,3;
   col1   |   col2   | col3 | col5 
----------+----------+------+------
 @ 1 sec  | @ 1 sec  | b    |    1
 @ 1 hour | @ 1 hour | a    |    0
(2 rows)

-- Update distribution key
UPDATE mpp21090_dropcol_splitdfpt_dml_interval SET col1 = '14 hours' WHERE col2 = '1 sec' AND col1 = '1 sec';
SELECT * FROM mpp21090_dropcol_splitdfpt_dml_interval ORDER BY 1,2,3;
    col1    |   col2   | col3 | col5 
------------+----------+------+------
 @ 1 hour   | @ 1 hour | a    |    0
 @ 14 hours | @ 1 sec  | b    |    1
(2 rows)

-- Update partition key
UPDATE mpp21090_dropcol_splitdfpt_dml_interval SET col2 = '14 hours' WHERE col2 = '1 sec' AND col1 = '14 hours';
SELECT * FROM mpp21090_dropcol_splitdfpt_dml_interval ORDER BY 1,2,3;
    col1    |    col2    | col3 | col5 
------------+------------+------+------
 @ 1 hour   | @ 1 hour   | a    |    0
 @ 14 hours | @ 14 hours | b    |    1
(2 rows)

DELETE FROM mpp21090_dropcol_splitdfpt_dml_interval WHERE col3='b';
SELECT * FROM mpp21090_dropcol_splitdfpt_dml_interval ORDER BY 1,2,3;
   col1   |   col2   | col3 | col5 
----------+----------+------+------
 @ 1 hour | @ 1 hour | a    |    0
(1 row)

-- @author prabhd 
-- @created 2014-04-01 12:00:00
-- @modified 2012-04-01 12:00:00
-- @tags dml MPP-21090 ORCA
-- @optimizer_mode on	
-- @description Tests for MPP-21090
\echo --start_ignore
--start_ignore
\echo --end_ignore
--end_ignore
DROP TABLE IF EXISTS mpp21090_dropcol_splitdfpt_dml_numeric;
NOTICE:  table "mpp21090_dropcol_splitdfpt_dml_numeric" does not exist, skipping
CREATE TABLE mpp21090_dropcol_splitdfpt_dml_numeric
(
    col1 numeric,
    col2 numeric,
    col3 char,
    col4 numeric,
    col5 int
) 
DISTRIBUTED by (col1)
PARTITION BY LIST(col2)
(
default partition def
);
NOTICE:  CREATE TABLE will create partition "mpp21090_dropcol_splitdfpt_dml_numeric_1_prt_def" for table "mpp21090_dropcol_splitdfpt_dml_numeric"
INSERT INTO mpp21090_dropcol_splitdfpt_dml_numeric VALUES(2.000000,2.000000,'a',2.000000,0);
SELECT * FROM mpp21090_dropcol_splitdfpt_dml_numeric ORDER BY 1,2,3,4;
   col1   |   col2   | col3 |   col4   | col5 
----------+----------+------+----------+------
 2.000000 | 2.000000 | a    | 2.000000 |    0
(1 row)

ALTER TABLE mpp21090_dropcol_splitdfpt_dml_numeric DROP COLUMN col4;
ALTER TABLE mpp21090_dropcol_splitdfpt_dml_numeric SPLIT DEFAULT PARTITION at (5.000000) into (partition partsplitone,partition def);
NOTICE:  exchanged partition "def" of relation "mpp21090_dropcol_splitdfpt_dml_numeric" with relation "pg_temp_644242"
NOTICE:  dropped partition "def" for relation "mpp21090_dropcol_splitdfpt_dml_numeric"
NOTICE:  CREATE TABLE will create partition "mpp21090_dropcol_splitdfpt_dml_numeric_1_prt_partsplitone" for table "mpp21090_dropcol_splitdfpt_dml_numeric"
NOTICE:  CREATE TABLE will create partition "mpp21090_dropcol_splitdfpt_dml_numeric_1_prt_def" for table "mpp21090_dropcol_splitdfpt_dml_numeric"
INSERT INTO mpp21090_dropcol_splitdfpt_dml_numeric SELECT 1.000000, 1.000000,'b', 1;
SELECT * FROM mpp21090_dropcol_splitdfpt_dml_numeric ORDER BY 1,2,3;
   col1   |   col2   | col3 | col5 
----------+----------+------+------
 1.000000 | 1.000000 | b    |    1
 2.000000 | 2.000000 | a    |    0
(2 rows)

-- Update distribution key
UPDATE mpp21090_dropcol_splitdfpt_dml_numeric SET col1 = 35.000000 WHERE col2 = 1.000000 AND col1 = 1.000000;
SELECT * FROM mpp21090_dropcol_splitdfpt_dml_numeric ORDER BY 1,2,3;
   col1    |   col2   | col3 | col5 
-----------+----------+------+------
  2.000000 | 2.000000 | a    |    0
 35.000000 | 1.000000 | b    |    1
(2 rows)

-- Update partition key
UPDATE mpp21090_dropcol_splitdfpt_dml_numeric SET col2 = 35.000000 WHERE col2 = 1.000000 AND col1 = 35.000000;
SELECT * FROM mpp21090_dropcol_splitdfpt_dml_numeric ORDER BY 1,2,3;
   col1    |   col2    | col3 | col5 
-----------+-----------+------+------
  2.000000 |  2.000000 | a    |    0
 35.000000 | 35.000000 | b    |    1
(2 rows)

DELETE FROM mpp21090_dropcol_splitdfpt_dml_numeric WHERE col3='b';
SELECT * FROM mpp21090_dropcol_splitdfpt_dml_numeric ORDER BY 1,2,3;
   col1   |   col2   | col3 | col5 
----------+----------+------+------
 2.000000 | 2.000000 | a    |    0
(1 row)

-- @author prabhd 
-- @created 2014-04-01 12:00:00
-- @modified 2012-04-01 12:00:00
-- @tags dml MPP-21090 ORCA
-- @optimizer_mode on	
-- @description Tests for MPP-21090
\echo --start_ignore
--start_ignore
\echo --end_ignore
--end_ignore
DROP TABLE IF EXISTS mpp21090_dropcol_splitdfpt_dml_time;
NOTICE:  table "mpp21090_dropcol_splitdfpt_dml_time" does not exist, skipping
CREATE TABLE mpp21090_dropcol_splitdfpt_dml_time
(
    col1 time,
    col2 time,
    col3 char,
    col4 time,
    col5 int
) 
DISTRIBUTED by (col1)
PARTITION BY LIST(col2)
(
default partition def
);
NOTICE:  CREATE TABLE will create partition "mpp21090_dropcol_splitdfpt_dml_time_1_prt_def" for table "mpp21090_dropcol_splitdfpt_dml_time"
INSERT INTO mpp21090_dropcol_splitdfpt_dml_time VALUES('12:00:00','12:00:00','a','12:00:00',0);
SELECT * FROM mpp21090_dropcol_splitdfpt_dml_time ORDER BY 1,2,3,4;
   col1   |   col2   | col3 |   col4   | col5 
----------+----------+------+----------+------
 12:00:00 | 12:00:00 | a    | 12:00:00 |    0
(1 row)

ALTER TABLE mpp21090_dropcol_splitdfpt_dml_time DROP COLUMN col4;
ALTER TABLE mpp21090_dropcol_splitdfpt_dml_time SPLIT DEFAULT PARTITION at ('15:00:00') into (partition partsplitone,partition def);
NOTICE:  exchanged partition "def" of relation "mpp21090_dropcol_splitdfpt_dml_time" with relation "pg_temp_644491"
NOTICE:  dropped partition "def" for relation "mpp21090_dropcol_splitdfpt_dml_time"
NOTICE:  CREATE TABLE will create partition "mpp21090_dropcol_splitdfpt_dml_time_1_prt_partsplitone" for table "mpp21090_dropcol_splitdfpt_dml_time"
NOTICE:  CREATE TABLE will create partition "mpp21090_dropcol_splitdfpt_dml_time_1_prt_def" for table "mpp21090_dropcol_splitdfpt_dml_time"
INSERT INTO mpp21090_dropcol_splitdfpt_dml_time SELECT '12:00:00', '12:00:00','b', 1;
SELECT * FROM mpp21090_dropcol_splitdfpt_dml_time ORDER BY 1,2,3;
   col1   |   col2   | col3 | col5 
----------+----------+------+------
 12:00:00 | 12:00:00 | a    |    0
 12:00:00 | 12:00:00 | b    |    1
(2 rows)

-- Update distribution key
UPDATE mpp21090_dropcol_splitdfpt_dml_time SET col1 = '11:30:00' WHERE col2 = '12:00:00' AND col1 = '12:00:00';
SELECT * FROM mpp21090_dropcol_splitdfpt_dml_time ORDER BY 1,2,3;
   col1   |   col2   | col3 | col5 
----------+----------+------+------
 11:30:00 | 12:00:00 | a    |    0
 11:30:00 | 12:00:00 | b    |    1
(2 rows)

-- Update partition key
UPDATE mpp21090_dropcol_splitdfpt_dml_time SET col2 = '11:30:00' WHERE col2 = '12:00:00' AND col1 = '11:30:00';
SELECT * FROM mpp21090_dropcol_splitdfpt_dml_time ORDER BY 1,2,3;
   col1   |   col2   | col3 | col5 
----------+----------+------+------
 11:30:00 | 11:30:00 | a    |    0
 11:30:00 | 11:30:00 | b    |    1
(2 rows)

DELETE FROM mpp21090_dropcol_splitdfpt_dml_time WHERE col3='b';
SELECT * FROM mpp21090_dropcol_splitdfpt_dml_time ORDER BY 1,2,3;
   col1   |   col2   | col3 | col5 
----------+----------+------+------
 11:30:00 | 11:30:00 | a    |    0
(1 row)

-- @author prabhd 
-- @created 2014-04-01 12:00:00
-- @modified 2012-04-01 12:00:00
-- @tags dml MPP-21090 ORCA
-- @optimizer_mode on	
-- @description Tests for MPP-21090
\echo --start_ignore
--start_ignore
\echo --end_ignore
--end_ignore
DROP TABLE IF EXISTS mpp21090_dropcol_splitdfpt_dml_timestamp;
NOTICE:  table "mpp21090_dropcol_splitdfpt_dml_timestamp" does not exist, skipping
CREATE TABLE mpp21090_dropcol_splitdfpt_dml_timestamp
(
    col1 timestamp,
    col2 timestamp,
    col3 char,
    col4 timestamp,
    col5 int
) 
DISTRIBUTED by (col1)
PARTITION BY LIST(col2)
(
default partition def
);
NOTICE:  CREATE TABLE will create partition "mpp21090_dropcol_splitdfpt_dml_timestamp_1_prt_def" for table "mpp21090_dropcol_splitdfpt_dml_timestamp"
INSERT INTO mpp21090_dropcol_splitdfpt_dml_timestamp VALUES('2013-12-31 12:00:00','2013-12-31 12:00:00','a','2013-12-31 12:00:00',0);
SELECT * FROM mpp21090_dropcol_splitdfpt_dml_timestamp ORDER BY 1,2,3,4;
           col1           |           col2           | col3 |           col4           | col5 
--------------------------+--------------------------+------+--------------------------+------
 Tue Dec 31 12:00:00 2013 | Tue Dec 31 12:00:00 2013 | a    | Tue Dec 31 12:00:00 2013 |    0
(1 row)

ALTER TABLE mpp21090_dropcol_splitdfpt_dml_timestamp DROP COLUMN col4;
ALTER TABLE mpp21090_dropcol_splitdfpt_dml_timestamp SPLIT DEFAULT PARTITION at ('2013-12-15 12:00:00') into (partition partsplitone,partition def);
NOTICE:  exchanged partition "def" of relation "mpp21090_dropcol_splitdfpt_dml_timestamp" with relation "pg_temp_644730"
NOTICE:  dropped partition "def" for relation "mpp21090_dropcol_splitdfpt_dml_timestamp"
NOTICE:  CREATE TABLE will create partition "mpp21090_dropcol_splitdfpt_dml_timestamp_1_prt_partsplitone" for table "mpp21090_dropcol_splitdfpt_dml_timestamp"
NOTICE:  CREATE TABLE will create partition "mpp21090_dropcol_splitdfpt_dml_timestamp_1_prt_def" for table "mpp21090_dropcol_splitdfpt_dml_timestamp"
INSERT INTO mpp21090_dropcol_splitdfpt_dml_timestamp SELECT '2013-12-01 12:00:00', '2013-12-01 12:00:00','b', 1;
SELECT * FROM mpp21090_dropcol_splitdfpt_dml_timestamp ORDER BY 1,2,3;
           col1           |           col2           | col3 | col5 
--------------------------+--------------------------+------+------
 Sun Dec 01 12:00:00 2013 | Sun Dec 01 12:00:00 2013 | b    |    1
 Tue Dec 31 12:00:00 2013 | Tue Dec 31 12:00:00 2013 | a    |    0
(2 rows)

-- Update distribution key
UPDATE mpp21090_dropcol_splitdfpt_dml_timestamp SET col1 = '2014-02-10 12:00:00' WHERE col2 = '2013-12-01 12:00:00' AND col1 = '2013-12-01 12:00:00';
SELECT * FROM mpp21090_dropcol_splitdfpt_dml_timestamp ORDER BY 1,2,3;
           col1           |           col2           | col3 | col5 
--------------------------+--------------------------+------+------
 Tue Dec 31 12:00:00 2013 | Tue Dec 31 12:00:00 2013 | a    |    0
 Mon Feb 10 12:00:00 2014 | Sun Dec 01 12:00:00 2013 | b    |    1
(2 rows)

-- Update partition key
UPDATE mpp21090_dropcol_splitdfpt_dml_timestamp SET col2 = '2014-02-10 12:00:00' WHERE col2 = '2013-12-01 12:00:00' AND col1 = '2014-02-10 12:00:00';
SELECT * FROM mpp21090_dropcol_splitdfpt_dml_timestamp ORDER BY 1,2,3;
           col1           |           col2           | col3 | col5 
--------------------------+--------------------------+------+------
 Tue Dec 31 12:00:00 2013 | Tue Dec 31 12:00:00 2013 | a    |    0
 Mon Feb 10 12:00:00 2014 | Mon Feb 10 12:00:00 2014 | b    |    1
(2 rows)

DELETE FROM mpp21090_dropcol_splitdfpt_dml_timestamp WHERE col3='b';
SELECT * FROM mpp21090_dropcol_splitdfpt_dml_timestamp ORDER BY 1,2,3;
           col1           |           col2           | col3 | col5 
--------------------------+--------------------------+------+------
 Tue Dec 31 12:00:00 2013 | Tue Dec 31 12:00:00 2013 | a    |    0
(1 row)

-- @author prabhd 
-- @created 2014-04-01 12:00:00
-- @modified 2012-04-01 12:00:00
-- @tags dml MPP-21090 ORCA
-- @optimizer_mode on	
-- @description Tests for MPP-21090
\echo --start_ignore
--start_ignore
\echo --end_ignore
--end_ignore
DROP TABLE IF EXISTS mpp21090_dropcol_splitdfpt_dml_timestamptz;
NOTICE:  table "mpp21090_dropcol_splitdfpt_dml_timestamptz" does not exist, skipping
CREATE TABLE mpp21090_dropcol_splitdfpt_dml_timestamptz
(
    col1 timestamptz,
    col2 timestamptz,
    col3 char,
    col4 timestamptz,
    col5 int
) 
DISTRIBUTED by (col1)
PARTITION BY LIST(col2)
(
default partition def
);
NOTICE:  CREATE TABLE will create partition "mpp21090_dropcol_splitdfpt_dml_timestamptz_1_prt_def" for table "mpp21090_dropcol_splitdfpt_dml_timestamptz"
INSERT INTO mpp21090_dropcol_splitdfpt_dml_timestamptz VALUES('2013-12-31 12:00:00 PST','2013-12-31 12:00:00 PST','a','2013-12-31 12:00:00 PST',0);
SELECT * FROM mpp21090_dropcol_splitdfpt_dml_timestamptz ORDER BY 1,2,3,4;
             col1             |             col2             | col3 |             col4             | col5 
------------------------------+------------------------------+------+------------------------------+------
 Tue Dec 31 12:00:00 2013 PST | Tue Dec 31 12:00:00 2013 PST | a    | Tue Dec 31 12:00:00 2013 PST |    0
(1 row)

ALTER TABLE mpp21090_dropcol_splitdfpt_dml_timestamptz DROP COLUMN col4;
ALTER TABLE mpp21090_dropcol_splitdfpt_dml_timestamptz SPLIT DEFAULT PARTITION at ('2013-12-15 12:00:00 PST') into (partition partsplitone,partition def);
NOTICE:  exchanged partition "def" of relation "mpp21090_dropcol_splitdfpt_dml_timestamptz" with relation "pg_temp_644969"
NOTICE:  dropped partition "def" for relation "mpp21090_dropcol_splitdfpt_dml_timestamptz"
NOTICE:  CREATE TABLE will create partition "mpp21090_dropcol_splitdfpt_dml_timestamptz_1_prt_partsplitone" for table "mpp21090_dropcol_splitdfpt_dml_timestamptz"
NOTICE:  CREATE TABLE will create partition "mpp21090_dropcol_splitdfpt_dml_timestamptz_1_prt_def" for table "mpp21090_dropcol_splitdfpt_dml_timestamptz"
INSERT INTO mpp21090_dropcol_splitdfpt_dml_timestamptz SELECT '2013-12-01 12:00:00 PST', '2013-12-01 12:00:00 PST','b', 1;
SELECT * FROM mpp21090_dropcol_splitdfpt_dml_timestamptz ORDER BY 1,2,3;
             col1             |             col2             | col3 | col5 
------------------------------+------------------------------+------+------
 Sun Dec 01 12:00:00 2013 PST | Sun Dec 01 12:00:00 2013 PST | b    |    1
 Tue Dec 31 12:00:00 2013 PST | Tue Dec 31 12:00:00 2013 PST | a    |    0
(2 rows)

-- Update distribution key
UPDATE mpp21090_dropcol_splitdfpt_dml_timestamptz SET col1 = '2014-02-10 12:00:00 PST' WHERE col2 = '2013-12-01 12:00:00 PST' AND col1 = '2013-12-01 12:00:00 PST';
SELECT * FROM mpp21090_dropcol_splitdfpt_dml_timestamptz ORDER BY 1,2,3;
             col1             |             col2             | col3 | col5 
------------------------------+------------------------------+------+------
 Tue Dec 31 12:00:00 2013 PST | Tue Dec 31 12:00:00 2013 PST | a    |    0
 Mon Feb 10 12:00:00 2014 PST | Sun Dec 01 12:00:00 2013 PST | b    |    1
(2 rows)

-- Update partition key
UPDATE mpp21090_dropcol_splitdfpt_dml_timestamptz SET col2 = '2014-02-10 12:00:00 PST' WHERE col2 = '2013-12-01 12:00:00 PST' AND col1 = '2014-02-10 12:00:00 PST';
SELECT * FROM mpp21090_dropcol_splitdfpt_dml_timestamptz ORDER BY 1,2,3;
             col1             |             col2             | col3 | col5 
------------------------------+------------------------------+------+------
 Tue Dec 31 12:00:00 2013 PST | Tue Dec 31 12:00:00 2013 PST | a    |    0
 Mon Feb 10 12:00:00 2014 PST | Mon Feb 10 12:00:00 2014 PST | b    |    1
(2 rows)

DELETE FROM mpp21090_dropcol_splitdfpt_dml_timestamptz WHERE col3='b';
SELECT * FROM mpp21090_dropcol_splitdfpt_dml_timestamptz ORDER BY 1,2,3;
             col1             |             col2             | col3 | col5 
------------------------------+------------------------------+------+------
 Tue Dec 31 12:00:00 2013 PST | Tue Dec 31 12:00:00 2013 PST | a    |    0
(1 row)

-- @author prabhd 
-- @created 2014-04-01 12:00:00
-- @modified 2012-04-01 12:00:00
-- @tags dml MPP-21090 ORCA
-- @optimizer_mode on	
-- @description Tests for MPP-21090
\echo --start_ignore
--start_ignore
\echo --end_ignore
--end_ignore
DROP TABLE IF EXISTS mpp21090_dropcol_splitpt_dml_char;
NOTICE:  table "mpp21090_dropcol_splitpt_dml_char" does not exist, skipping
CREATE TABLE mpp21090_dropcol_splitpt_dml_char
(
    col1 char,
    col2 char,
    col3 char,
    col4 char,
    col5 int
) 
DISTRIBUTED by (col1)
PARTITION BY LIST(col2)(partition partone VALUES('a','b','c','d','e','f','g','h') WITH (APPENDONLY=true, COMPRESSLEVEL=5, ORIENTATION=column),partition parttwo VALUES('i','j','k','l','m','n','o','p') WITH (APPENDONLY=true, COMPRESSLEVEL=5, ORIENTATION=row),partition partthree VALUES('q','r','s','t','u','v','w','x'));
NOTICE:  CREATE TABLE will create partition "mpp21090_dropcol_splitpt_dml_char_1_prt_partone" for table "mpp21090_dropcol_splitpt_dml_char"
NOTICE:  CREATE TABLE will create partition "mpp21090_dropcol_splitpt_dml_char_1_prt_parttwo" for table "mpp21090_dropcol_splitpt_dml_char"
NOTICE:  CREATE TABLE will create partition "mpp21090_dropcol_splitpt_dml_char_1_prt_partthree" for table "mpp21090_dropcol_splitpt_dml_char"
INSERT INTO mpp21090_dropcol_splitpt_dml_char VALUES('x','x','a','x',0);
SELECT * FROM mpp21090_dropcol_splitpt_dml_char ORDER BY 1,2,3,4;
 col1 | col2 | col3 | col4 | col5 
------+------+------+------+------
 x    | x    | a    | x    |    0
(1 row)

ALTER TABLE mpp21090_dropcol_splitpt_dml_char DROP COLUMN col4;
ALTER TABLE mpp21090_dropcol_splitpt_dml_char SPLIT PARTITION partone at ('d') into (partition partsplitone,partition partsplitwo);
NOTICE:  exchanged partition "partone" of relation "mpp21090_dropcol_splitpt_dml_char" with relation "pg_temp_645208"
NOTICE:  dropped partition "partone" for relation "mpp21090_dropcol_splitpt_dml_char"
NOTICE:  CREATE TABLE will create partition "mpp21090_dropcol_splitpt_dml_char_1_prt_partsplitone" for table "mpp21090_dropcol_splitpt_dml_char"
NOTICE:  CREATE TABLE will create partition "mpp21090_dropcol_splitpt_dml_char_1_prt_partsplitwo" for table "mpp21090_dropcol_splitpt_dml_char"
INSERT INTO mpp21090_dropcol_splitpt_dml_char SELECT 'a', 'a','b', 1;
SELECT * FROM mpp21090_dropcol_splitpt_dml_char ORDER BY 1,2,3;
 col1 | col2 | col3 | col5 
------+------+------+------
 a    | a    | b    |    1
 x    | x    | a    |    0
(2 rows)

-- Update distribution key
UPDATE mpp21090_dropcol_splitpt_dml_char SET col1 = 'z' WHERE col2 = 'a' AND col1 = 'a';
SELECT * FROM mpp21090_dropcol_splitpt_dml_char ORDER BY 1,2,3;
 col1 | col2 | col3 | col5 
------+------+------+------
 x    | x    | a    |    0
 z    | a    | b    |    1
(2 rows)

-- Update partition key
UPDATE mpp21090_dropcol_splitpt_dml_char SET col2 ='x'  WHERE col2 = 'a' AND col1 = 'z';
SELECT * FROM mpp21090_dropcol_splitpt_dml_char ORDER BY 1,2,3;
 col1 | col2 | col3 | col5 
------+------+------+------
 x    | x    | a    |    0
 z    | x    | b    |    1
(2 rows)

DELETE FROM mpp21090_dropcol_splitpt_dml_char WHERE col3='b';
SELECT * FROM mpp21090_dropcol_splitpt_dml_char ORDER BY 1,2,3;
 col1 | col2 | col3 | col5 
------+------+------+------
 x    | x    | a    |    0
(1 row)

-- @author prabhd 
-- @created 2014-04-01 12:00:00
-- @modified 2012-04-01 12:00:00
-- @tags dml MPP-21090 ORCA
-- @optimizer_mode on	
-- @description Tests for MPP-21090
\echo --start_ignore
--start_ignore
\echo --end_ignore
--end_ignore
DROP TABLE IF EXISTS mpp21090_dropcol_splitpt_dml_date;
NOTICE:  table "mpp21090_dropcol_splitpt_dml_date" does not exist, skipping
CREATE TABLE mpp21090_dropcol_splitpt_dml_date
(
    col1 date,
    col2 date,
    col3 char,
    col4 date,
    col5 int
) 
DISTRIBUTED by (col1)
PARTITION BY RANGE(col2)(partition partone start('2013-12-01') end('2013-12-31') WITH(APPENDONLY=true, COMPRESSLEVEL=5, ORIENTATION=column),partition parttwo start('2013-12-31') end('2014-01-01') WITH (APPENDONLY=true, COMPRESSLEVEL=5, ORIENTATION=row),partition partthree start('2014-01-01') end('2014-02-01'));
NOTICE:  CREATE TABLE will create partition "mpp21090_dropcol_splitpt_dml_date_1_prt_partone" for table "mpp21090_dropcol_splitpt_dml_date"
NOTICE:  CREATE TABLE will create partition "mpp21090_dropcol_splitpt_dml_date_1_prt_parttwo" for table "mpp21090_dropcol_splitpt_dml_date"
NOTICE:  CREATE TABLE will create partition "mpp21090_dropcol_splitpt_dml_date_1_prt_partthree" for table "mpp21090_dropcol_splitpt_dml_date"
INSERT INTO mpp21090_dropcol_splitpt_dml_date VALUES('2013-12-31','2013-12-31','a','2013-12-31',0);
SELECT * FROM mpp21090_dropcol_splitpt_dml_date ORDER BY 1,2,3,4;
    col1    |    col2    | col3 |    col4    | col5 
------------+------------+------+------------+------
 12-31-2013 | 12-31-2013 | a    | 12-31-2013 |    0
(1 row)

ALTER TABLE mpp21090_dropcol_splitpt_dml_date DROP COLUMN col4;
ALTER TABLE mpp21090_dropcol_splitpt_dml_date SPLIT PARTITION partone at ('2013-12-15') into (partition partsplitone,partition partsplitwo);
NOTICE:  exchanged partition "partone" of relation "mpp21090_dropcol_splitpt_dml_date" with relation "pg_temp_645546"
NOTICE:  dropped partition "partone" for relation "mpp21090_dropcol_splitpt_dml_date"
NOTICE:  CREATE TABLE will create partition "mpp21090_dropcol_splitpt_dml_date_1_prt_partsplitone" for table "mpp21090_dropcol_splitpt_dml_date"
NOTICE:  CREATE TABLE will create partition "mpp21090_dropcol_splitpt_dml_date_1_prt_partsplitwo" for table "mpp21090_dropcol_splitpt_dml_date"
INSERT INTO mpp21090_dropcol_splitpt_dml_date SELECT '2013-12-01', '2013-12-01','b', 1;
SELECT * FROM mpp21090_dropcol_splitpt_dml_date ORDER BY 1,2,3;
    col1    |    col2    | col3 | col5 
------------+------------+------+------
 12-01-2013 | 12-01-2013 | b    |    1
 12-31-2013 | 12-31-2013 | a    |    0
(2 rows)

-- Update distribution key
UPDATE mpp21090_dropcol_splitpt_dml_date SET col1 = '2014-02-10' WHERE col2 = '2013-12-01' AND col1 = '2013-12-01';
SELECT * FROM mpp21090_dropcol_splitpt_dml_date ORDER BY 1,2,3;
    col1    |    col2    | col3 | col5 
------------+------------+------+------
 12-31-2013 | 12-31-2013 | a    |    0
 02-10-2014 | 12-01-2013 | b    |    1
(2 rows)

-- Update partition key
UPDATE mpp21090_dropcol_splitpt_dml_date SET col2 ='2013-12-31'  WHERE col2 = '2013-12-01' AND col1 = '2014-02-10';
SELECT * FROM mpp21090_dropcol_splitpt_dml_date ORDER BY 1,2,3;
    col1    |    col2    | col3 | col5 
------------+------------+------+------
 12-31-2013 | 12-31-2013 | a    |    0
 02-10-2014 | 12-31-2013 | b    |    1
(2 rows)

DELETE FROM mpp21090_dropcol_splitpt_dml_date WHERE col3='b';
SELECT * FROM mpp21090_dropcol_splitpt_dml_date ORDER BY 1,2,3;
    col1    |    col2    | col3 | col5 
------------+------------+------+------
 12-31-2013 | 12-31-2013 | a    |    0
(1 row)

-- @author prabhd 
-- @created 2014-04-01 12:00:00
-- @modified 2012-04-01 12:00:00
-- @tags dml MPP-21090 ORCA
-- @optimizer_mode on	
-- @description Tests for MPP-21090
\echo --start_ignore
--start_ignore
\echo --end_ignore
--end_ignore
DROP TABLE IF EXISTS mpp21090_dropcol_splitpt_dml_decimal;
NOTICE:  table "mpp21090_dropcol_splitpt_dml_decimal" does not exist, skipping
CREATE TABLE mpp21090_dropcol_splitpt_dml_decimal
(
    col1 decimal,
    col2 decimal,
    col3 char,
    col4 decimal,
    col5 int
) 
DISTRIBUTED by (col1)
PARTITION BY RANGE(col2)(partition partone start(1.00) end(10.00)  WITH (APPENDONLY=true, COMPRESSLEVEL=5, ORIENTATION=column),partition parttwo start(10.00) end(20.00) WITH (APPENDONLY=true, COMPRESSLEVEL=5, ORIENTATION=row),partition partthree start(20.00) end(30.00));
NOTICE:  CREATE TABLE will create partition "mpp21090_dropcol_splitpt_dml_decimal_1_prt_partone" for table "mpp21090_dropcol_splitpt_dml_decimal"
NOTICE:  CREATE TABLE will create partition "mpp21090_dropcol_splitpt_dml_decimal_1_prt_parttwo" for table "mpp21090_dropcol_splitpt_dml_decimal"
NOTICE:  CREATE TABLE will create partition "mpp21090_dropcol_splitpt_dml_decimal_1_prt_partthree" for table "mpp21090_dropcol_splitpt_dml_decimal"
INSERT INTO mpp21090_dropcol_splitpt_dml_decimal VALUES(2.00,2.00,'a',2.00,0);
SELECT * FROM mpp21090_dropcol_splitpt_dml_decimal ORDER BY 1,2,3,4;
 col1 | col2 | col3 | col4 | col5 
------+------+------+------+------
 2.00 | 2.00 | a    | 2.00 |    0
(1 row)

ALTER TABLE mpp21090_dropcol_splitpt_dml_decimal DROP COLUMN col4;
ALTER TABLE mpp21090_dropcol_splitpt_dml_decimal SPLIT PARTITION partone at (5.00) into (partition partsplitone,partition partsplitwo);
NOTICE:  exchanged partition "partone" of relation "mpp21090_dropcol_splitpt_dml_decimal" with relation "pg_temp_645884"
NOTICE:  dropped partition "partone" for relation "mpp21090_dropcol_splitpt_dml_decimal"
NOTICE:  CREATE TABLE will create partition "mpp21090_dropcol_splitpt_dml_decimal_1_prt_partsplitone" for table "mpp21090_dropcol_splitpt_dml_decimal"
NOTICE:  CREATE TABLE will create partition "mpp21090_dropcol_splitpt_dml_decimal_1_prt_partsplitwo" for table "mpp21090_dropcol_splitpt_dml_decimal"
INSERT INTO mpp21090_dropcol_splitpt_dml_decimal SELECT 1.00, 1.00,'b', 1;
SELECT * FROM mpp21090_dropcol_splitpt_dml_decimal ORDER BY 1,2,3;
 col1 | col2 | col3 | col5 
------+------+------+------
 1.00 | 1.00 | b    |    1
 2.00 | 2.00 | a    |    0
(2 rows)

-- Update distribution key
UPDATE mpp21090_dropcol_splitpt_dml_decimal SET col1 = 35.00 WHERE col2 = 1.00 AND col1 = 1.00;
SELECT * FROM mpp21090_dropcol_splitpt_dml_decimal ORDER BY 1,2,3;
 col1  | col2 | col3 | col5 
-------+------+------+------
  2.00 | 2.00 | a    |    0
 35.00 | 1.00 | b    |    1
(2 rows)

-- Update partition key
UPDATE mpp21090_dropcol_splitpt_dml_decimal SET col2 =2.00  WHERE col2 = 1.00 AND col1 = 35.00;
SELECT * FROM mpp21090_dropcol_splitpt_dml_decimal ORDER BY 1,2,3;
 col1  | col2 | col3 | col5 
-------+------+------+------
  2.00 | 2.00 | a    |    0
 35.00 | 2.00 | b    |    1
(2 rows)

DELETE FROM mpp21090_dropcol_splitpt_dml_decimal WHERE col3='b';
SELECT * FROM mpp21090_dropcol_splitpt_dml_decimal ORDER BY 1,2,3;
 col1 | col2 | col3 | col5 
------+------+------+------
 2.00 | 2.00 | a    |    0
(1 row)

-- @author prabhd 
-- @created 2014-04-01 12:00:00
-- @modified 2012-04-01 12:00:00
-- @tags dml MPP-21090 ORCA
-- @optimizer_mode on	
-- @description Tests for MPP-21090
\echo --start_ignore
--start_ignore
\echo --end_ignore
--end_ignore
DROP TABLE IF EXISTS mpp21090_dropcol_splitpt_dml_float;
NOTICE:  table "mpp21090_dropcol_splitpt_dml_float" does not exist, skipping
CREATE TABLE mpp21090_dropcol_splitpt_dml_float
(
    col1 float,
    col2 float,
    col3 char,
    col4 float,
    col5 int
) 
DISTRIBUTED by (col1)
PARTITION BY RANGE(col2)(partition partone start(1.00) end(10.00)  WITH (APPENDONLY=true, COMPRESSLEVEL=5, ORIENTATION=column),partition parttwo start(10.00) end(20.00) WITH (APPENDONLY=true, COMPRESSLEVEL=5, ORIENTATION=row),partition partthree start(20.00) end(30.00));
NOTICE:  CREATE TABLE will create partition "mpp21090_dropcol_splitpt_dml_float_1_prt_partone" for table "mpp21090_dropcol_splitpt_dml_float"
NOTICE:  CREATE TABLE will create partition "mpp21090_dropcol_splitpt_dml_float_1_prt_parttwo" for table "mpp21090_dropcol_splitpt_dml_float"
NOTICE:  CREATE TABLE will create partition "mpp21090_dropcol_splitpt_dml_float_1_prt_partthree" for table "mpp21090_dropcol_splitpt_dml_float"
INSERT INTO mpp21090_dropcol_splitpt_dml_float VALUES(2.00,2.00,'a',2.00,0);
SELECT * FROM mpp21090_dropcol_splitpt_dml_float ORDER BY 1,2,3,4;
 col1 | col2 | col3 | col4 | col5 
------+------+------+------+------
    2 |    2 | a    |    2 |    0
(1 row)

ALTER TABLE mpp21090_dropcol_splitpt_dml_float DROP COLUMN col4;
ALTER TABLE mpp21090_dropcol_splitpt_dml_float SPLIT PARTITION partone at (5.00) into (partition partsplitone,partition partsplitwo);
NOTICE:  exchanged partition "partone" of relation "mpp21090_dropcol_splitpt_dml_float" with relation "pg_temp_646236"
NOTICE:  dropped partition "partone" for relation "mpp21090_dropcol_splitpt_dml_float"
NOTICE:  CREATE TABLE will create partition "mpp21090_dropcol_splitpt_dml_float_1_prt_partsplitone" for table "mpp21090_dropcol_splitpt_dml_float"
NOTICE:  CREATE TABLE will create partition "mpp21090_dropcol_splitpt_dml_float_1_prt_partsplitwo" for table "mpp21090_dropcol_splitpt_dml_float"
INSERT INTO mpp21090_dropcol_splitpt_dml_float SELECT 1.00, 1.00,'b', 1;
SELECT * FROM mpp21090_dropcol_splitpt_dml_float ORDER BY 1,2,3;
 col1 | col2 | col3 | col5 
------+------+------+------
    1 |    1 | b    |    1
    2 |    2 | a    |    0
(2 rows)

-- Update distribution key
UPDATE mpp21090_dropcol_splitpt_dml_float SET col1 = 35.00 WHERE col2 = 1.00 AND col1 = 1.00;
SELECT * FROM mpp21090_dropcol_splitpt_dml_float ORDER BY 1,2,3;
 col1 | col2 | col3 | col5 
------+------+------+------
    2 |    2 | a    |    0
   35 |    1 | b    |    1
(2 rows)

-- Update partition key
UPDATE mpp21090_dropcol_splitpt_dml_float SET col2 =2.00  WHERE col2 = 1.00 AND col1 = 35.00;
SELECT * FROM mpp21090_dropcol_splitpt_dml_float ORDER BY 1,2,3;
 col1 | col2 | col3 | col5 
------+------+------+------
    2 |    2 | a    |    0
   35 |    2 | b    |    1
(2 rows)

DELETE FROM mpp21090_dropcol_splitpt_dml_float WHERE col3='b';
SELECT * FROM mpp21090_dropcol_splitpt_dml_float ORDER BY 1,2,3;
 col1 | col2 | col3 | col5 
------+------+------+------
    2 |    2 | a    |    0
(1 row)

-- @author prabhd 
-- @created 2014-04-01 12:00:00
-- @modified 2012-04-01 12:00:00
-- @tags dml MPP-21090 ORCA
-- @optimizer_mode on	
-- @description Tests for MPP-21090
\echo --start_ignore
--start_ignore
\echo --end_ignore
--end_ignore
DROP TABLE IF EXISTS mpp21090_dropcol_splitpt_dml_int;
NOTICE:  table "mpp21090_dropcol_splitpt_dml_int" does not exist, skipping
CREATE TABLE mpp21090_dropcol_splitpt_dml_int
(
    col1 int,
    col2 int,
    col3 char,
    col4 int,
    col5 int
) 
DISTRIBUTED by (col1)
PARTITION BY RANGE(col2)(partition partone start(1) end(10001) WITH (APPENDONLY=true, COMPRESSLEVEL=5, ORIENTATION=column),partition parttwo start(10001) end(20001) WITH (APPENDONLY=true, COMPRESSLEVEL=5, ORIENTATION=row),partition partthree start(20001) end(30001));
NOTICE:  CREATE TABLE will create partition "mpp21090_dropcol_splitpt_dml_int_1_prt_partone" for table "mpp21090_dropcol_splitpt_dml_int"
NOTICE:  CREATE TABLE will create partition "mpp21090_dropcol_splitpt_dml_int_1_prt_parttwo" for table "mpp21090_dropcol_splitpt_dml_int"
NOTICE:  CREATE TABLE will create partition "mpp21090_dropcol_splitpt_dml_int_1_prt_partthree" for table "mpp21090_dropcol_splitpt_dml_int"
INSERT INTO mpp21090_dropcol_splitpt_dml_int VALUES(20000,20000,'a',20000,0);
SELECT * FROM mpp21090_dropcol_splitpt_dml_int ORDER BY 1,2,3,4;
 col1  | col2  | col3 | col4  | col5 
-------+-------+------+-------+------
 20000 | 20000 | a    | 20000 |    0
(1 row)

ALTER TABLE mpp21090_dropcol_splitpt_dml_int DROP COLUMN col4;
ALTER TABLE mpp21090_dropcol_splitpt_dml_int SPLIT PARTITION partone at (5000) into (partition partsplitone,partition partsplitwo);
NOTICE:  exchanged partition "partone" of relation "mpp21090_dropcol_splitpt_dml_int" with relation "pg_temp_646574"
NOTICE:  dropped partition "partone" for relation "mpp21090_dropcol_splitpt_dml_int"
NOTICE:  CREATE TABLE will create partition "mpp21090_dropcol_splitpt_dml_int_1_prt_partsplitone" for table "mpp21090_dropcol_splitpt_dml_int"
NOTICE:  CREATE TABLE will create partition "mpp21090_dropcol_splitpt_dml_int_1_prt_partsplitwo" for table "mpp21090_dropcol_splitpt_dml_int"
INSERT INTO mpp21090_dropcol_splitpt_dml_int SELECT 1000, 1000,'b', 1;
SELECT * FROM mpp21090_dropcol_splitpt_dml_int ORDER BY 1,2,3;
 col1  | col2  | col3 | col5 
-------+-------+------+------
  1000 |  1000 | b    |    1
 20000 | 20000 | a    |    0
(2 rows)

-- Update distribution key
UPDATE mpp21090_dropcol_splitpt_dml_int SET col1 = 35000 WHERE col2 = 1000 AND col1 = 1000;
SELECT * FROM mpp21090_dropcol_splitpt_dml_int ORDER BY 1,2,3;
 col1  | col2  | col3 | col5 
-------+-------+------+------
 20000 | 20000 | a    |    0
 35000 |  1000 | b    |    1
(2 rows)

-- Update partition key
UPDATE mpp21090_dropcol_splitpt_dml_int SET col2 =20000  WHERE col2 = 1000 AND col1 = 35000;
SELECT * FROM mpp21090_dropcol_splitpt_dml_int ORDER BY 1,2,3;
 col1  | col2  | col3 | col5 
-------+-------+------+------
 20000 | 20000 | a    |    0
 35000 | 20000 | b    |    1
(2 rows)

DELETE FROM mpp21090_dropcol_splitpt_dml_int WHERE col3='b';
SELECT * FROM mpp21090_dropcol_splitpt_dml_int ORDER BY 1,2,3;
 col1  | col2  | col3 | col5 
-------+-------+------+------
 20000 | 20000 | a    |    0
(1 row)

-- @author prabhd 
-- @created 2014-04-01 12:00:00
-- @modified 2012-04-01 12:00:00
-- @tags dml MPP-21090 ORCA
-- @optimizer_mode on	
-- @description Tests for MPP-21090
\echo --start_ignore
--start_ignore
\echo --end_ignore
--end_ignore
DROP TABLE IF EXISTS mpp21090_dropcol_splitpt_dml_int4;
NOTICE:  table "mpp21090_dropcol_splitpt_dml_int4" does not exist, skipping
CREATE TABLE mpp21090_dropcol_splitpt_dml_int4
(
    col1 int4,
    col2 int4,
    col3 char,
    col4 int4,
    col5 int
) 
DISTRIBUTED by (col1)
PARTITION BY RANGE(col2)(partition partone start(1) end(100000001)  WITH (APPENDONLY=true, COMPRESSLEVEL=5, ORIENTATION=column),partition parttwo start(100000001) end(200000001) WITH (APPENDONLY=true, COMPRESSLEVEL=5, ORIENTATION=row),partition partthree start(200000001) end(300000001));
NOTICE:  CREATE TABLE will create partition "mpp21090_dropcol_splitpt_dml_int4_1_prt_partone" for table "mpp21090_dropcol_splitpt_dml_int4"
NOTICE:  CREATE TABLE will create partition "mpp21090_dropcol_splitpt_dml_int4_1_prt_parttwo" for table "mpp21090_dropcol_splitpt_dml_int4"
NOTICE:  CREATE TABLE will create partition "mpp21090_dropcol_splitpt_dml_int4_1_prt_partthree" for table "mpp21090_dropcol_splitpt_dml_int4"
INSERT INTO mpp21090_dropcol_splitpt_dml_int4 VALUES(20000000,20000000,'a',20000000,0);
SELECT * FROM mpp21090_dropcol_splitpt_dml_int4 ORDER BY 1,2,3,4;
   col1   |   col2   | col3 |   col4   | col5 
----------+----------+------+----------+------
 20000000 | 20000000 | a    | 20000000 |    0
(1 row)

ALTER TABLE mpp21090_dropcol_splitpt_dml_int4 DROP COLUMN col4;
ALTER TABLE mpp21090_dropcol_splitpt_dml_int4 SPLIT PARTITION partone at (50000000) into (partition partsplitone,partition partsplitwo);
NOTICE:  exchanged partition "partone" of relation "mpp21090_dropcol_splitpt_dml_int4" with relation "pg_temp_646912"
NOTICE:  dropped partition "partone" for relation "mpp21090_dropcol_splitpt_dml_int4"
NOTICE:  CREATE TABLE will create partition "mpp21090_dropcol_splitpt_dml_int4_1_prt_partsplitone" for table "mpp21090_dropcol_splitpt_dml_int4"
NOTICE:  CREATE TABLE will create partition "mpp21090_dropcol_splitpt_dml_int4_1_prt_partsplitwo" for table "mpp21090_dropcol_splitpt_dml_int4"
INSERT INTO mpp21090_dropcol_splitpt_dml_int4 SELECT 10000000, 10000000,'b', 1;
SELECT * FROM mpp21090_dropcol_splitpt_dml_int4 ORDER BY 1,2,3;
   col1   |   col2   | col3 | col5 
----------+----------+------+------
 10000000 | 10000000 | b    |    1
 20000000 | 20000000 | a    |    0
(2 rows)

-- Update distribution key
UPDATE mpp21090_dropcol_splitpt_dml_int4 SET col1 = 35000000 WHERE col2 = 10000000 AND col1 = 10000000;
SELECT * FROM mpp21090_dropcol_splitpt_dml_int4 ORDER BY 1,2,3;
   col1   |   col2   | col3 | col5 
----------+----------+------+------
 20000000 | 20000000 | a    |    0
 35000000 | 10000000 | b    |    1
(2 rows)

-- Update partition key
UPDATE mpp21090_dropcol_splitpt_dml_int4 SET col2 =20000000  WHERE col2 = 10000000 AND col1 = 35000000;
SELECT * FROM mpp21090_dropcol_splitpt_dml_int4 ORDER BY 1,2,3;
   col1   |   col2   | col3 | col5 
----------+----------+------+------
 20000000 | 20000000 | a    |    0
 35000000 | 20000000 | b    |    1
(2 rows)

DELETE FROM mpp21090_dropcol_splitpt_dml_int4 WHERE col3='b';
SELECT * FROM mpp21090_dropcol_splitpt_dml_int4 ORDER BY 1,2,3;
   col1   |   col2   | col3 | col5 
----------+----------+------+------
 20000000 | 20000000 | a    |    0
(1 row)

-- @author prabhd 
-- @created 2014-04-01 12:00:00
-- @modified 2012-04-01 12:00:00
-- @tags dml MPP-21090 ORCA
-- @optimizer_mode on	
-- @description Tests for MPP-21090
\echo --start_ignore
--start_ignore
\echo --end_ignore
--end_ignore
DROP TABLE IF EXISTS mpp21090_dropcol_splitpt_dml_int8;
NOTICE:  table "mpp21090_dropcol_splitpt_dml_int8" does not exist, skipping
CREATE TABLE mpp21090_dropcol_splitpt_dml_int8
(
    col1 int8,
    col2 int8,
    col3 char,
    col4 int8,
    col5 int
) 
DISTRIBUTED by (col1)
PARTITION BY RANGE(col2)(partition partone start(1) end(1000000000000000001)  WITH (APPENDONLY=true, COMPRESSLEVEL=5, ORIENTATION=column),partition parttwo start(1000000000000000001) end(2000000000000000001) WITH (APPENDONLY=true, COMPRESSLEVEL=5, ORIENTATION=row),partition partthree start(2000000000000000001) end(3000000000000000001));
NOTICE:  CREATE TABLE will create partition "mpp21090_dropcol_splitpt_dml_int8_1_prt_partone" for table "mpp21090_dropcol_splitpt_dml_int8"
NOTICE:  CREATE TABLE will create partition "mpp21090_dropcol_splitpt_dml_int8_1_prt_parttwo" for table "mpp21090_dropcol_splitpt_dml_int8"
NOTICE:  CREATE TABLE will create partition "mpp21090_dropcol_splitpt_dml_int8_1_prt_partthree" for table "mpp21090_dropcol_splitpt_dml_int8"
INSERT INTO mpp21090_dropcol_splitpt_dml_int8 VALUES(2000000000000000000,2000000000000000000,'a',2000000000000000000,0);
SELECT * FROM mpp21090_dropcol_splitpt_dml_int8 ORDER BY 1,2,3,4;
        col1         |        col2         | col3 |        col4         | col5 
---------------------+---------------------+------+---------------------+------
 2000000000000000000 | 2000000000000000000 | a    | 2000000000000000000 |    0
(1 row)

ALTER TABLE mpp21090_dropcol_splitpt_dml_int8 DROP COLUMN col4;
ALTER TABLE mpp21090_dropcol_splitpt_dml_int8 SPLIT PARTITION partone at (500000000000000000) into (partition partsplitone,partition partsplitwo);
NOTICE:  exchanged partition "partone" of relation "mpp21090_dropcol_splitpt_dml_int8" with relation "pg_temp_647250"
NOTICE:  dropped partition "partone" for relation "mpp21090_dropcol_splitpt_dml_int8"
NOTICE:  CREATE TABLE will create partition "mpp21090_dropcol_splitpt_dml_int8_1_prt_partsplitone" for table "mpp21090_dropcol_splitpt_dml_int8"
NOTICE:  CREATE TABLE will create partition "mpp21090_dropcol_splitpt_dml_int8_1_prt_partsplitwo" for table "mpp21090_dropcol_splitpt_dml_int8"
INSERT INTO mpp21090_dropcol_splitpt_dml_int8 SELECT 100000000000000000, 100000000000000000,'b', 1;
SELECT * FROM mpp21090_dropcol_splitpt_dml_int8 ORDER BY 1,2,3;
        col1         |        col2         | col3 | col5 
---------------------+---------------------+------+------
  100000000000000000 |  100000000000000000 | b    |    1
 2000000000000000000 | 2000000000000000000 | a    |    0
(2 rows)

-- Update distribution key
UPDATE mpp21090_dropcol_splitpt_dml_int8 SET col1 = 3500000000000000000 WHERE col2 = 100000000000000000 AND col1 = 100000000000000000;
SELECT * FROM mpp21090_dropcol_splitpt_dml_int8 ORDER BY 1,2,3;
        col1         |        col2         | col3 | col5 
---------------------+---------------------+------+------
 2000000000000000000 | 2000000000000000000 | a    |    0
 3500000000000000000 |  100000000000000000 | b    |    1
(2 rows)

-- Update partition key
UPDATE mpp21090_dropcol_splitpt_dml_int8 SET col2 =2000000000000000000  WHERE col2 = 100000000000000000 AND col1 = 3500000000000000000;
SELECT * FROM mpp21090_dropcol_splitpt_dml_int8 ORDER BY 1,2,3;
        col1         |        col2         | col3 | col5 
---------------------+---------------------+------+------
 2000000000000000000 | 2000000000000000000 | a    |    0
 3500000000000000000 | 2000000000000000000 | b    |    1
(2 rows)

DELETE FROM mpp21090_dropcol_splitpt_dml_int8 WHERE col3='b';
SELECT * FROM mpp21090_dropcol_splitpt_dml_int8 ORDER BY 1,2,3;
        col1         |        col2         | col3 | col5 
---------------------+---------------------+------+------
 2000000000000000000 | 2000000000000000000 | a    |    0
(1 row)

-- @author prabhd 
-- @created 2014-04-01 12:00:00
-- @modified 2012-04-01 12:00:00
-- @tags dml MPP-21090 ORCA
-- @optimizer_mode on	
-- @description Tests for MPP-21090
\echo --start_ignore
--start_ignore
\echo --end_ignore
--end_ignore
DROP TABLE IF EXISTS mpp21090_dropcol_splitpt_dml_interval;
NOTICE:  table "mpp21090_dropcol_splitpt_dml_interval" does not exist, skipping
CREATE TABLE mpp21090_dropcol_splitpt_dml_interval
(
    col1 interval,
    col2 interval,
    col3 char,
    col4 interval,
    col5 int
) 
DISTRIBUTED by (col1)
PARTITION BY RANGE(col2)(partition partone start('1 sec') end('1 min')  WITH (APPENDONLY=true, COMPRESSLEVEL=5, ORIENTATION=column),partition parttwo start('1 min') end('1 hour') WITH (APPENDONLY=true, COMPRESSLEVEL=5, ORIENTATION=row),partition partthree start('1 hour') end('12 hours'));
NOTICE:  CREATE TABLE will create partition "mpp21090_dropcol_splitpt_dml_interval_1_prt_partone" for table "mpp21090_dropcol_splitpt_dml_interval"
NOTICE:  CREATE TABLE will create partition "mpp21090_dropcol_splitpt_dml_interval_1_prt_parttwo" for table "mpp21090_dropcol_splitpt_dml_interval"
NOTICE:  CREATE TABLE will create partition "mpp21090_dropcol_splitpt_dml_interval_1_prt_partthree" for table "mpp21090_dropcol_splitpt_dml_interval"
INSERT INTO mpp21090_dropcol_splitpt_dml_interval VALUES('1 hour','1 hour','a','1 hour',0);
SELECT * FROM mpp21090_dropcol_splitpt_dml_interval ORDER BY 1,2,3,4;
   col1   |   col2   | col3 |   col4   | col5 
----------+----------+------+----------+------
 @ 1 hour | @ 1 hour | a    | @ 1 hour |    0
(1 row)

ALTER TABLE mpp21090_dropcol_splitpt_dml_interval DROP COLUMN col4;
ALTER TABLE mpp21090_dropcol_splitpt_dml_interval SPLIT PARTITION partone at ('30 secs') into (partition partsplitone,partition partsplitwo);
NOTICE:  exchanged partition "partone" of relation "mpp21090_dropcol_splitpt_dml_interval" with relation "pg_temp_647588"
NOTICE:  dropped partition "partone" for relation "mpp21090_dropcol_splitpt_dml_interval"
NOTICE:  CREATE TABLE will create partition "mpp21090_dropcol_splitpt_dml_interval_1_prt_partsplitone" for table "mpp21090_dropcol_splitpt_dml_interval"
NOTICE:  CREATE TABLE will create partition "mpp21090_dropcol_splitpt_dml_interval_1_prt_partsplitwo" for table "mpp21090_dropcol_splitpt_dml_interval"
INSERT INTO mpp21090_dropcol_splitpt_dml_interval SELECT '1 sec', '1 sec','b', 1;
SELECT * FROM mpp21090_dropcol_splitpt_dml_interval ORDER BY 1,2,3;
   col1   |   col2   | col3 | col5 
----------+----------+------+------
 @ 1 sec  | @ 1 sec  | b    |    1
 @ 1 hour | @ 1 hour | a    |    0
(2 rows)

-- Update distribution key
UPDATE mpp21090_dropcol_splitpt_dml_interval SET col1 = '14 hours' WHERE col2 = '1 sec' AND col1 = '1 sec';
SELECT * FROM mpp21090_dropcol_splitpt_dml_interval ORDER BY 1,2,3;
    col1    |   col2   | col3 | col5 
------------+----------+------+------
 @ 1 hour   | @ 1 hour | a    |    0
 @ 14 hours | @ 1 sec  | b    |    1
(2 rows)

-- Update partition key
UPDATE mpp21090_dropcol_splitpt_dml_interval SET col2 ='1 hour'  WHERE col2 = '1 sec' AND col1 = '14 hours';
SELECT * FROM mpp21090_dropcol_splitpt_dml_interval ORDER BY 1,2,3;
    col1    |   col2   | col3 | col5 
------------+----------+------+------
 @ 1 hour   | @ 1 hour | a    |    0
 @ 14 hours | @ 1 hour | b    |    1
(2 rows)

DELETE FROM mpp21090_dropcol_splitpt_dml_interval WHERE col3='b';
SELECT * FROM mpp21090_dropcol_splitpt_dml_interval ORDER BY 1,2,3;
   col1   |   col2   | col3 | col5 
----------+----------+------+------
 @ 1 hour | @ 1 hour | a    |    0
(1 row)

-- @author prabhd 
-- @created 2014-04-01 12:00:00
-- @modified 2012-04-01 12:00:00
-- @tags dml MPP-21090 ORCA
-- @optimizer_mode on	
-- @description Tests for MPP-21090
\echo --start_ignore
--start_ignore
\echo --end_ignore
--end_ignore
DROP TABLE IF EXISTS mpp21090_dropcol_splitpt_dml_numeric;
NOTICE:  table "mpp21090_dropcol_splitpt_dml_numeric" does not exist, skipping
CREATE TABLE mpp21090_dropcol_splitpt_dml_numeric
(
    col1 numeric,
    col2 numeric,
    col3 char,
    col4 numeric,
    col5 int
) 
DISTRIBUTED by (col1)
PARTITION BY RANGE(col2)(partition partone start(1.000000) end(10.000000)  WITH (APPENDONLY=true, COMPRESSLEVEL=5, ORIENTATION=column),partition parttwo start(10.000000) end(20.000000) WITH (APPENDONLY=true, COMPRESSLEVEL=5, ORIENTATION=row),partition partthree start(20.000000) end(30.000000));
NOTICE:  CREATE TABLE will create partition "mpp21090_dropcol_splitpt_dml_numeric_1_prt_partone" for table "mpp21090_dropcol_splitpt_dml_numeric"
NOTICE:  CREATE TABLE will create partition "mpp21090_dropcol_splitpt_dml_numeric_1_prt_parttwo" for table "mpp21090_dropcol_splitpt_dml_numeric"
NOTICE:  CREATE TABLE will create partition "mpp21090_dropcol_splitpt_dml_numeric_1_prt_partthree" for table "mpp21090_dropcol_splitpt_dml_numeric"
INSERT INTO mpp21090_dropcol_splitpt_dml_numeric VALUES(2.000000,2.000000,'a',2.000000,0);
SELECT * FROM mpp21090_dropcol_splitpt_dml_numeric ORDER BY 1,2,3,4;
   col1   |   col2   | col3 |   col4   | col5 
----------+----------+------+----------+------
 2.000000 | 2.000000 | a    | 2.000000 |    0
(1 row)

ALTER TABLE mpp21090_dropcol_splitpt_dml_numeric DROP COLUMN col4;
ALTER TABLE mpp21090_dropcol_splitpt_dml_numeric SPLIT PARTITION partone at (5.000000) into (partition partsplitone,partition partsplitwo);
NOTICE:  exchanged partition "partone" of relation "mpp21090_dropcol_splitpt_dml_numeric" with relation "pg_temp_647926"
NOTICE:  dropped partition "partone" for relation "mpp21090_dropcol_splitpt_dml_numeric"
NOTICE:  CREATE TABLE will create partition "mpp21090_dropcol_splitpt_dml_numeric_1_prt_partsplitone" for table "mpp21090_dropcol_splitpt_dml_numeric"
NOTICE:  CREATE TABLE will create partition "mpp21090_dropcol_splitpt_dml_numeric_1_prt_partsplitwo" for table "mpp21090_dropcol_splitpt_dml_numeric"
INSERT INTO mpp21090_dropcol_splitpt_dml_numeric SELECT 1.000000, 1.000000,'b', 1;
SELECT * FROM mpp21090_dropcol_splitpt_dml_numeric ORDER BY 1,2,3;
   col1   |   col2   | col3 | col5 
----------+----------+------+------
 1.000000 | 1.000000 | b    |    1
 2.000000 | 2.000000 | a    |    0
(2 rows)

-- Update distribution key
UPDATE mpp21090_dropcol_splitpt_dml_numeric SET col1 = 35.000000 WHERE col2 = 1.000000 AND col1 = 1.000000;
SELECT * FROM mpp21090_dropcol_splitpt_dml_numeric ORDER BY 1,2,3;
   col1    |   col2   | col3 | col5 
-----------+----------+------+------
  2.000000 | 2.000000 | a    |    0
 35.000000 | 1.000000 | b    |    1
(2 rows)

-- Update partition key
UPDATE mpp21090_dropcol_splitpt_dml_numeric SET col2 =2.000000  WHERE col2 = 1.000000 AND col1 = 35.000000;
SELECT * FROM mpp21090_dropcol_splitpt_dml_numeric ORDER BY 1,2,3;
   col1    |   col2   | col3 | col5 
-----------+----------+------+------
  2.000000 | 2.000000 | a    |    0
 35.000000 | 2.000000 | b    |    1
(2 rows)

DELETE FROM mpp21090_dropcol_splitpt_dml_numeric WHERE col3='b';
SELECT * FROM mpp21090_dropcol_splitpt_dml_numeric ORDER BY 1,2,3;
   col1   |   col2   | col3 | col5 
----------+----------+------+------
 2.000000 | 2.000000 | a    |    0
(1 row)

-- @author prabhd 
-- @created 2014-04-01 12:00:00
-- @modified 2012-04-01 12:00:00
-- @tags dml MPP-21090 ORCA
-- @optimizer_mode on	
-- @description Tests for MPP-21090
\echo --start_ignore
--start_ignore
\echo --end_ignore
--end_ignore
DROP TABLE IF EXISTS mpp21090_dropcol_splitpt_dml_time;
NOTICE:  table "mpp21090_dropcol_splitpt_dml_time" does not exist, skipping
CREATE TABLE mpp21090_dropcol_splitpt_dml_time
(
    col1 time,
    col2 time,
    col3 char,
    col4 time,
    col5 int
) 
DISTRIBUTED by (col1)
PARTITION BY RANGE(col2)(partition partone start('12:00:00') end('18:00:00')  WITH (APPENDONLY=true, COMPRESSLEVEL=5, ORIENTATION=column),partition parttwo start('18:00:00') end('24:00:00') WITH (APPENDONLY=true, COMPRESSLEVEL=5, ORIENTATION=row),partition partthree start('0:00:00') end('11:00:00'));
NOTICE:  CREATE TABLE will create partition "mpp21090_dropcol_splitpt_dml_time_1_prt_partthree" for table "mpp21090_dropcol_splitpt_dml_time"
NOTICE:  CREATE TABLE will create partition "mpp21090_dropcol_splitpt_dml_time_1_prt_partone" for table "mpp21090_dropcol_splitpt_dml_time"
NOTICE:  CREATE TABLE will create partition "mpp21090_dropcol_splitpt_dml_time_1_prt_parttwo" for table "mpp21090_dropcol_splitpt_dml_time"
INSERT INTO mpp21090_dropcol_splitpt_dml_time VALUES('12:00:00','12:00:00','a','12:00:00',0);
SELECT * FROM mpp21090_dropcol_splitpt_dml_time ORDER BY 1,2,3,4;
   col1   |   col2   | col3 |   col4   | col5 
----------+----------+------+----------+------
 12:00:00 | 12:00:00 | a    | 12:00:00 |    0
(1 row)

ALTER TABLE mpp21090_dropcol_splitpt_dml_time DROP COLUMN col4;
ALTER TABLE mpp21090_dropcol_splitpt_dml_time SPLIT PARTITION partone at ('15:00:00') into (partition partsplitone,partition partsplitwo);
NOTICE:  exchanged partition "partone" of relation "mpp21090_dropcol_splitpt_dml_time" with relation "pg_temp_648278"
NOTICE:  dropped partition "partone" for relation "mpp21090_dropcol_splitpt_dml_time"
NOTICE:  CREATE TABLE will create partition "mpp21090_dropcol_splitpt_dml_time_1_prt_partsplitone" for table "mpp21090_dropcol_splitpt_dml_time"
NOTICE:  CREATE TABLE will create partition "mpp21090_dropcol_splitpt_dml_time_1_prt_partsplitwo" for table "mpp21090_dropcol_splitpt_dml_time"
INSERT INTO mpp21090_dropcol_splitpt_dml_time SELECT '12:00:00', '12:00:00','b', 1;
SELECT * FROM mpp21090_dropcol_splitpt_dml_time ORDER BY 1,2,3;
   col1   |   col2   | col3 | col5 
----------+----------+------+------
 12:00:00 | 12:00:00 | a    |    0
 12:00:00 | 12:00:00 | b    |    1
(2 rows)

-- Update distribution key
UPDATE mpp21090_dropcol_splitpt_dml_time SET col1 = '11:30:00' WHERE col2 = '12:00:00' AND col1 = '12:00:00';
SELECT * FROM mpp21090_dropcol_splitpt_dml_time ORDER BY 1,2,3;
   col1   |   col2   | col3 | col5 
----------+----------+------+------
 11:30:00 | 12:00:00 | a    |    0
 11:30:00 | 12:00:00 | b    |    1
(2 rows)

-- Update partition key
UPDATE mpp21090_dropcol_splitpt_dml_time SET col2 ='12:00:00'  WHERE col2 = '12:00:00' AND col1 = '11:30:00';
SELECT * FROM mpp21090_dropcol_splitpt_dml_time ORDER BY 1,2,3;
   col1   |   col2   | col3 | col5 
----------+----------+------+------
 11:30:00 | 12:00:00 | a    |    0
 11:30:00 | 12:00:00 | b    |    1
(2 rows)

DELETE FROM mpp21090_dropcol_splitpt_dml_time WHERE col3='b';
SELECT * FROM mpp21090_dropcol_splitpt_dml_time ORDER BY 1,2,3;
   col1   |   col2   | col3 | col5 
----------+----------+------+------
 11:30:00 | 12:00:00 | a    |    0
(1 row)

-- @author prabhd 
-- @created 2014-04-01 12:00:00
-- @modified 2012-04-01 12:00:00
-- @tags dml MPP-21090 ORCA
-- @optimizer_mode on	
-- @description Tests for MPP-21090
\echo --start_ignore
--start_ignore
\echo --end_ignore
--end_ignore
DROP TABLE IF EXISTS mpp21090_dropcol_splitpt_dml_timestamp;
NOTICE:  table "mpp21090_dropcol_splitpt_dml_timestamp" does not exist, skipping
CREATE TABLE mpp21090_dropcol_splitpt_dml_timestamp
(
    col1 timestamp,
    col2 timestamp,
    col3 char,
    col4 timestamp,
    col5 int
) 
DISTRIBUTED by (col1)
PARTITION BY RANGE(col2)(partition partone start('2013-12-01 12:00:00') end('2013-12-31 12:00:00') WITH(APPENDONLY=true, COMPRESSLEVEL=5, ORIENTATION=column),partition parttwo start('2013-12-31 12:00:00') end('2014-01-01 12:00:00') inclusive WITH (APPENDONLY=true, COMPRESSLEVEL=5, ORIENTATION=row),partition partthree start('2014-01-02 12:00:00') end('2014-02-01 12:00:00'));
NOTICE:  CREATE TABLE will create partition "mpp21090_dropcol_splitpt_dml_timestamp_1_prt_partone" for table "mpp21090_dropcol_splitpt_dml_timestamp"
NOTICE:  CREATE TABLE will create partition "mpp21090_dropcol_splitpt_dml_timestamp_1_prt_parttwo" for table "mpp21090_dropcol_splitpt_dml_timestamp"
NOTICE:  CREATE TABLE will create partition "mpp21090_dropcol_splitpt_dml_timestamp_1_prt_partthree" for table "mpp21090_dropcol_splitpt_dml_timestamp"
INSERT INTO mpp21090_dropcol_splitpt_dml_timestamp VALUES('2013-12-31 12:00:00','2013-12-31 12:00:00','a','2013-12-31 12:00:00',0);
SELECT * FROM mpp21090_dropcol_splitpt_dml_timestamp ORDER BY 1,2,3,4;
           col1           |           col2           | col3 |           col4           | col5 
--------------------------+--------------------------+------+--------------------------+------
 Tue Dec 31 12:00:00 2013 | Tue Dec 31 12:00:00 2013 | a    | Tue Dec 31 12:00:00 2013 |    0
(1 row)

ALTER TABLE mpp21090_dropcol_splitpt_dml_timestamp DROP COLUMN col4;
ALTER TABLE mpp21090_dropcol_splitpt_dml_timestamp SPLIT PARTITION partone at ('2013-12-15 12:00:00') into (partition partsplitone,partition partsplitwo);
NOTICE:  exchanged partition "partone" of relation "mpp21090_dropcol_splitpt_dml_timestamp" with relation "pg_temp_648616"
NOTICE:  dropped partition "partone" for relation "mpp21090_dropcol_splitpt_dml_timestamp"
NOTICE:  CREATE TABLE will create partition "mpp21090_dropcol_splitpt_dml_timestamp_1_prt_partsplitone" for table "mpp21090_dropcol_splitpt_dml_timestamp"
NOTICE:  CREATE TABLE will create partition "mpp21090_dropcol_splitpt_dml_timestamp_1_prt_partsplitwo" for table "mpp21090_dropcol_splitpt_dml_timestamp"
INSERT INTO mpp21090_dropcol_splitpt_dml_timestamp SELECT '2013-12-01 12:00:00', '2013-12-01 12:00:00','b', 1;
SELECT * FROM mpp21090_dropcol_splitpt_dml_timestamp ORDER BY 1,2,3;
           col1           |           col2           | col3 | col5 
--------------------------+--------------------------+------+------
 Sun Dec 01 12:00:00 2013 | Sun Dec 01 12:00:00 2013 | b    |    1
 Tue Dec 31 12:00:00 2013 | Tue Dec 31 12:00:00 2013 | a    |    0
(2 rows)

-- Update distribution key
UPDATE mpp21090_dropcol_splitpt_dml_timestamp SET col1 = '2014-02-10 12:00:00' WHERE col2 = '2013-12-01 12:00:00' AND col1 = '2013-12-01 12:00:00';
SELECT * FROM mpp21090_dropcol_splitpt_dml_timestamp ORDER BY 1,2,3;
           col1           |           col2           | col3 | col5 
--------------------------+--------------------------+------+------
 Tue Dec 31 12:00:00 2013 | Tue Dec 31 12:00:00 2013 | a    |    0
 Mon Feb 10 12:00:00 2014 | Sun Dec 01 12:00:00 2013 | b    |    1
(2 rows)

-- Update partition key
UPDATE mpp21090_dropcol_splitpt_dml_timestamp SET col2 ='2013-12-31 12:00:00'  WHERE col2 = '2013-12-01 12:00:00' AND col1 = '2014-02-10 12:00:00';
SELECT * FROM mpp21090_dropcol_splitpt_dml_timestamp ORDER BY 1,2,3;
           col1           |           col2           | col3 | col5 
--------------------------+--------------------------+------+------
 Tue Dec 31 12:00:00 2013 | Tue Dec 31 12:00:00 2013 | a    |    0
 Mon Feb 10 12:00:00 2014 | Tue Dec 31 12:00:00 2013 | b    |    1
(2 rows)

DELETE FROM mpp21090_dropcol_splitpt_dml_timestamp WHERE col3='b';
SELECT * FROM mpp21090_dropcol_splitpt_dml_timestamp ORDER BY 1,2,3;
           col1           |           col2           | col3 | col5 
--------------------------+--------------------------+------+------
 Tue Dec 31 12:00:00 2013 | Tue Dec 31 12:00:00 2013 | a    |    0
(1 row)

-- @author prabhd 
-- @created 2014-04-01 12:00:00
-- @modified 2012-04-01 12:00:00
-- @tags dml MPP-21090 ORCA
-- @optimizer_mode on	
-- @description Tests for MPP-21090
\echo --start_ignore
--start_ignore
\echo --end_ignore
--end_ignore
DROP TABLE IF EXISTS mpp21090_dropcol_splitpt_dml_timestamptz;
NOTICE:  table "mpp21090_dropcol_splitpt_dml_timestamptz" does not exist, skipping
CREATE TABLE mpp21090_dropcol_splitpt_dml_timestamptz
(
    col1 timestamptz,
    col2 timestamptz,
    col3 char,
    col4 timestamptz,
    col5 int
) 
DISTRIBUTED by (col1)
PARTITION BY RANGE(col2)(partition partone start('2013-12-01 12:00:00 PST') end('2013-12-31 12:00:00 PST') WITH(APPENDONLY=true, COMPRESSLEVEL=5, ORIENTATION=column),partition parttwo start('2013-12-31 12:00:00 PST') end('2014-01-01 12:00:00 PST') WITH (APPENDONLY=true, COMPRESSLEVEL=5, ORIENTATION=row),partition partthree start('2014-01-01 12:00:00 PST') end('2014-02-01 12:00:00 PST'));
NOTICE:  CREATE TABLE will create partition "mpp21090_dropcol_splitpt_dml_timestamptz_1_prt_partone" for table "mpp21090_dropcol_splitpt_dml_timestamptz"
NOTICE:  CREATE TABLE will create partition "mpp21090_dropcol_splitpt_dml_timestamptz_1_prt_parttwo" for table "mpp21090_dropcol_splitpt_dml_timestamptz"
NOTICE:  CREATE TABLE will create partition "mpp21090_dropcol_splitpt_dml_timestamptz_1_prt_partthree" for table "mpp21090_dropcol_splitpt_dml_timestamptz"
INSERT INTO mpp21090_dropcol_splitpt_dml_timestamptz VALUES('2013-12-31 12:00:00 PST','2013-12-31 12:00:00 PST','a','2013-12-31 12:00:00 PST',0);
SELECT * FROM mpp21090_dropcol_splitpt_dml_timestamptz ORDER BY 1,2,3,4;
             col1             |             col2             | col3 |             col4             | col5 
------------------------------+------------------------------+------+------------------------------+------
 Tue Dec 31 12:00:00 2013 PST | Tue Dec 31 12:00:00 2013 PST | a    | Tue Dec 31 12:00:00 2013 PST |    0
(1 row)

ALTER TABLE mpp21090_dropcol_splitpt_dml_timestamptz DROP COLUMN col4;
ALTER TABLE mpp21090_dropcol_splitpt_dml_timestamptz SPLIT PARTITION partone at ('2013-12-15 12:00:00 PST') into (partition partsplitone,partition partsplitwo);
NOTICE:  exchanged partition "partone" of relation "mpp21090_dropcol_splitpt_dml_timestamptz" with relation "pg_temp_648954"
NOTICE:  dropped partition "partone" for relation "mpp21090_dropcol_splitpt_dml_timestamptz"
NOTICE:  CREATE TABLE will create partition "mpp21090_dropcol_splitpt_dml_timestamptz_1_prt_partsplitone" for table "mpp21090_dropcol_splitpt_dml_timestamptz"
NOTICE:  CREATE TABLE will create partition "mpp21090_dropcol_splitpt_dml_timestamptz_1_prt_partsplitwo" for table "mpp21090_dropcol_splitpt_dml_timestamptz"
INSERT INTO mpp21090_dropcol_splitpt_dml_timestamptz SELECT '2013-12-01 12:00:00 PST', '2013-12-01 12:00:00 PST','b', 1;
SELECT * FROM mpp21090_dropcol_splitpt_dml_timestamptz ORDER BY 1,2,3;
             col1             |             col2             | col3 | col5 
------------------------------+------------------------------+------+------
 Sun Dec 01 12:00:00 2013 PST | Sun Dec 01 12:00:00 2013 PST | b    |    1
 Tue Dec 31 12:00:00 2013 PST | Tue Dec 31 12:00:00 2013 PST | a    |    0
(2 rows)

-- Update distribution key
UPDATE mpp21090_dropcol_splitpt_dml_timestamptz SET col1 = '2014-02-10 12:00:00 PST' WHERE col2 = '2013-12-01 12:00:00 PST' AND col1 = '2013-12-01 12:00:00 PST';
SELECT * FROM mpp21090_dropcol_splitpt_dml_timestamptz ORDER BY 1,2,3;
             col1             |             col2             | col3 | col5 
------------------------------+------------------------------+------+------
 Tue Dec 31 12:00:00 2013 PST | Tue Dec 31 12:00:00 2013 PST | a    |    0
 Mon Feb 10 12:00:00 2014 PST | Sun Dec 01 12:00:00 2013 PST | b    |    1
(2 rows)

-- Update partition key
UPDATE mpp21090_dropcol_splitpt_dml_timestamptz SET col2 ='2013-12-31 12:00:00 PST'  WHERE col2 = '2013-12-01 12:00:00 PST' AND col1 = '2014-02-10 12:00:00 PST';
SELECT * FROM mpp21090_dropcol_splitpt_dml_timestamptz ORDER BY 1,2,3;
             col1             |             col2             | col3 | col5 
------------------------------+------------------------------+------+------
 Tue Dec 31 12:00:00 2013 PST | Tue Dec 31 12:00:00 2013 PST | a    |    0
 Mon Feb 10 12:00:00 2014 PST | Tue Dec 31 12:00:00 2013 PST | b    |    1
(2 rows)

DELETE FROM mpp21090_dropcol_splitpt_dml_timestamptz WHERE col3='b';
SELECT * FROM mpp21090_dropcol_splitpt_dml_timestamptz ORDER BY 1,2,3;
             col1             |             col2             | col3 | col5 
------------------------------+------------------------------+------+------
 Tue Dec 31 12:00:00 2013 PST | Tue Dec 31 12:00:00 2013 PST | a    |    0
(1 row)

-- @author prabhd 
-- @created 2014-04-01 12:00:00
-- @modified 2012-04-01 12:00:00
-- @tags dml MPP-21090 ORCA
-- @optimizer_mode on	
-- @description Tests for MPP-21090
\echo --start_ignore
--start_ignore
\echo --end_ignore
--end_ignore
DROP TABLE IF EXISTS mpp21090_dropcol_splitpt_idx_dml_char;
NOTICE:  table "mpp21090_dropcol_splitpt_idx_dml_char" does not exist, skipping
CREATE TABLE mpp21090_dropcol_splitpt_idx_dml_char
(
    col1 char,
    col2 char,
    col3 char,
    col4 char,
    col5 int
) 
DISTRIBUTED by (col1)
PARTITION BY LIST(col2)(partition partone VALUES('a','b','c','d','e','f','g','h') WITH (APPENDONLY=true, COMPRESSLEVEL=5, ORIENTATION=column),partition parttwo VALUES('i','j','k','l','m','n','o','p') WITH (APPENDONLY=true, COMPRESSLEVEL=5, ORIENTATION=row),partition partthree VALUES('q','r','s','t','u','v','w','x'));
NOTICE:  CREATE TABLE will create partition "mpp21090_dropcol_splitpt_idx_dml_char_1_prt_partone" for table "mpp21090_dropcol_splitpt_idx_dml_char"
NOTICE:  CREATE TABLE will create partition "mpp21090_dropcol_splitpt_idx_dml_char_1_prt_parttwo" for table "mpp21090_dropcol_splitpt_idx_dml_char"
NOTICE:  CREATE TABLE will create partition "mpp21090_dropcol_splitpt_idx_dml_char_1_prt_partthree" for table "mpp21090_dropcol_splitpt_idx_dml_char"
DROP INDEX IF EXISTS mpp21090_dropcol_splitpt_idx_dml_idx_char;
NOTICE:  index "mpp21090_dropcol_splitpt_idx_dml_idx_char" does not exist, skipping
CREATE INDEX mpp21090_dropcol_splitpt_idx_dml_idx_char on mpp21090_dropcol_splitpt_idx_dml_char(col2);
NOTICE:  building index for child partition "mpp21090_dropcol_splitpt_idx_dml_char_1_prt_partone"
NOTICE:  building index for child partition "mpp21090_dropcol_splitpt_idx_dml_char_1_prt_parttwo"
NOTICE:  building index for child partition "mpp21090_dropcol_splitpt_idx_dml_char_1_prt_partthree"
INSERT INTO mpp21090_dropcol_splitpt_idx_dml_char VALUES('g','g','a','g',0);
SELECT * FROM mpp21090_dropcol_splitpt_idx_dml_char ORDER BY 1,2,3,4;
 col1 | col2 | col3 | col4 | col5 
------+------+------+------+------
 g    | g    | a    | g    |    0
(1 row)

ALTER TABLE mpp21090_dropcol_splitpt_idx_dml_char DROP COLUMN col4;
ALTER TABLE mpp21090_dropcol_splitpt_idx_dml_char SPLIT PARTITION partone at ('d') into (partition partsplitone,partition partsplitwo);
NOTICE:  exchanged partition "partone" of relation "mpp21090_dropcol_splitpt_idx_dml_char" with relation "pg_temp_649292"
NOTICE:  dropped partition "partone" for relation "mpp21090_dropcol_splitpt_idx_dml_char"
NOTICE:  CREATE TABLE will create partition "mpp21090_dropcol_splitpt_idx_dml_char_1_prt_partsplitone" for table "mpp21090_dropcol_splitpt_idx_dml_char"
NOTICE:  CREATE TABLE will create partition "mpp21090_dropcol_splitpt_idx_dml_char_1_prt_partsplitwo" for table "mpp21090_dropcol_splitpt_idx_dml_char"
INSERT INTO mpp21090_dropcol_splitpt_idx_dml_char SELECT 'a', 'a','b', 1;
SELECT * FROM mpp21090_dropcol_splitpt_idx_dml_char ORDER BY 1,2,3;
 col1 | col2 | col3 | col5 
------+------+------+------
 a    | a    | b    |    1
 g    | g    | a    |    0
(2 rows)

-- Update distribution key
UPDATE mpp21090_dropcol_splitpt_idx_dml_char SET col1 = 'z' WHERE col2 = 'a' AND col1 = 'a';
SELECT * FROM mpp21090_dropcol_splitpt_idx_dml_char ORDER BY 1,2,3;
 col1 | col2 | col3 | col5 
------+------+------+------
 g    | g    | a    |    0
 z    | a    | b    |    1
(2 rows)

-- Update partition key
UPDATE mpp21090_dropcol_splitpt_idx_dml_char SET col2 ='g'  WHERE col2 = 'a' AND col1 = 'z';
SELECT * FROM mpp21090_dropcol_splitpt_idx_dml_char ORDER BY 1,2,3;
 col1 | col2 | col3 | col5 
------+------+------+------
 g    | g    | a    |    0
 z    | g    | b    |    1
(2 rows)

DELETE FROM mpp21090_dropcol_splitpt_idx_dml_char WHERE col3='b';
SELECT * FROM mpp21090_dropcol_splitpt_idx_dml_char ORDER BY 1,2,3;
 col1 | col2 | col3 | col5 
------+------+------+------
 g    | g    | a    |    0
(1 row)

-- @author prabhd 
-- @created 2014-04-01 12:00:00
-- @modified 2012-04-01 12:00:00
-- @tags dml MPP-21090 ORCA
-- @optimizer_mode on	
-- @description Tests for MPP-21090
\echo --start_ignore
--start_ignore
\echo --end_ignore
--end_ignore
DROP TABLE IF EXISTS mpp21090_dropcol_splitpt_idx_dml_date;
NOTICE:  table "mpp21090_dropcol_splitpt_idx_dml_date" does not exist, skipping
CREATE TABLE mpp21090_dropcol_splitpt_idx_dml_date
(
    col1 date,
    col2 date,
    col3 char,
    col4 date,
    col5 int
) 
DISTRIBUTED by (col1)
PARTITION BY RANGE(col2)(partition partone start('2013-12-01') end('2013-12-31') WITH(APPENDONLY=true, COMPRESSLEVEL=5, ORIENTATION=column),partition parttwo start('2013-12-31') end('2014-01-01') WITH (APPENDONLY=true, COMPRESSLEVEL=5, ORIENTATION=row),partition partthree start('2014-01-01') end('2014-02-01'));
NOTICE:  CREATE TABLE will create partition "mpp21090_dropcol_splitpt_idx_dml_date_1_prt_partone" for table "mpp21090_dropcol_splitpt_idx_dml_date"
NOTICE:  CREATE TABLE will create partition "mpp21090_dropcol_splitpt_idx_dml_date_1_prt_parttwo" for table "mpp21090_dropcol_splitpt_idx_dml_date"
NOTICE:  CREATE TABLE will create partition "mpp21090_dropcol_splitpt_idx_dml_date_1_prt_partthree" for table "mpp21090_dropcol_splitpt_idx_dml_date"
DROP INDEX IF EXISTS mpp21090_dropcol_splitpt_idx_dml_idx_date;
NOTICE:  index "mpp21090_dropcol_splitpt_idx_dml_idx_date" does not exist, skipping
CREATE INDEX mpp21090_dropcol_splitpt_idx_dml_idx_date on mpp21090_dropcol_splitpt_idx_dml_date(col2);
NOTICE:  building index for child partition "mpp21090_dropcol_splitpt_idx_dml_date_1_prt_partone"
NOTICE:  building index for child partition "mpp21090_dropcol_splitpt_idx_dml_date_1_prt_parttwo"
NOTICE:  building index for child partition "mpp21090_dropcol_splitpt_idx_dml_date_1_prt_partthree"
INSERT INTO mpp21090_dropcol_splitpt_idx_dml_date VALUES('2013-12-30','2013-12-30','a','2013-12-30',0);
SELECT * FROM mpp21090_dropcol_splitpt_idx_dml_date ORDER BY 1,2,3,4;
    col1    |    col2    | col3 |    col4    | col5 
------------+------------+------+------------+------
 12-30-2013 | 12-30-2013 | a    | 12-30-2013 |    0
(1 row)

ALTER TABLE mpp21090_dropcol_splitpt_idx_dml_date DROP COLUMN col4;
ALTER TABLE mpp21090_dropcol_splitpt_idx_dml_date SPLIT PARTITION partone at ('2013-12-15') into (partition partsplitone,partition partsplitwo);
NOTICE:  exchanged partition "partone" of relation "mpp21090_dropcol_splitpt_idx_dml_date" with relation "pg_temp_649752"
NOTICE:  dropped partition "partone" for relation "mpp21090_dropcol_splitpt_idx_dml_date"
NOTICE:  CREATE TABLE will create partition "mpp21090_dropcol_splitpt_idx_dml_date_1_prt_partsplitone" for table "mpp21090_dropcol_splitpt_idx_dml_date"
NOTICE:  CREATE TABLE will create partition "mpp21090_dropcol_splitpt_idx_dml_date_1_prt_partsplitwo" for table "mpp21090_dropcol_splitpt_idx_dml_date"
INSERT INTO mpp21090_dropcol_splitpt_idx_dml_date SELECT '2013-12-01', '2013-12-01','b', 1;
SELECT * FROM mpp21090_dropcol_splitpt_idx_dml_date ORDER BY 1,2,3;
    col1    |    col2    | col3 | col5 
------------+------------+------+------
 12-01-2013 | 12-01-2013 | b    |    1
 12-30-2013 | 12-30-2013 | a    |    0
(2 rows)

-- Update distribution key
UPDATE mpp21090_dropcol_splitpt_idx_dml_date SET col1 = '2014-02-10' WHERE col2 = '2013-12-01' AND col1 = '2013-12-01';
SELECT * FROM mpp21090_dropcol_splitpt_idx_dml_date ORDER BY 1,2,3;
    col1    |    col2    | col3 | col5 
------------+------------+------+------
 12-30-2013 | 12-30-2013 | a    |    0
 02-10-2014 | 12-01-2013 | b    |    1
(2 rows)

-- Update partition key
UPDATE mpp21090_dropcol_splitpt_idx_dml_date SET col2 ='2013-12-30'  WHERE col2 = '2013-12-01' AND col1 = '2014-02-10';
SELECT * FROM mpp21090_dropcol_splitpt_idx_dml_date ORDER BY 1,2,3;
    col1    |    col2    | col3 | col5 
------------+------------+------+------
 12-30-2013 | 12-30-2013 | a    |    0
 02-10-2014 | 12-30-2013 | b    |    1
(2 rows)

DELETE FROM mpp21090_dropcol_splitpt_idx_dml_date WHERE col3='b';
SELECT * FROM mpp21090_dropcol_splitpt_idx_dml_date ORDER BY 1,2,3;
    col1    |    col2    | col3 | col5 
------------+------------+------+------
 12-30-2013 | 12-30-2013 | a    |    0
(1 row)

-- @author prabhd 
-- @created 2014-04-01 12:00:00
-- @modified 2012-04-01 12:00:00
-- @tags dml MPP-21090 ORCA
-- @optimizer_mode on	
-- @description Tests for MPP-21090
\echo --start_ignore
--start_ignore
\echo --end_ignore
--end_ignore
DROP TABLE IF EXISTS mpp21090_dropcol_splitpt_idx_dml_decimal;
NOTICE:  table "mpp21090_dropcol_splitpt_idx_dml_decimal" does not exist, skipping
CREATE TABLE mpp21090_dropcol_splitpt_idx_dml_decimal
(
    col1 decimal,
    col2 decimal,
    col3 char,
    col4 decimal,
    col5 int
) 
DISTRIBUTED by (col1)
PARTITION BY RANGE(col2)(partition partone start(1.00) end(10.00)  WITH (APPENDONLY=true, COMPRESSLEVEL=5, ORIENTATION=column),partition parttwo start(10.00) end(20.00) WITH (APPENDONLY=true, COMPRESSLEVEL=5, ORIENTATION=row),partition partthree start(20.00) end(30.00));
NOTICE:  CREATE TABLE will create partition "mpp21090_dropcol_splitpt_idx_dml_decimal_1_prt_partone" for table "mpp21090_dropcol_splitpt_idx_dml_decimal"
NOTICE:  CREATE TABLE will create partition "mpp21090_dropcol_splitpt_idx_dml_decimal_1_prt_parttwo" for table "mpp21090_dropcol_splitpt_idx_dml_decimal"
NOTICE:  CREATE TABLE will create partition "mpp21090_dropcol_splitpt_idx_dml_decimal_1_prt_partthree" for table "mpp21090_dropcol_splitpt_idx_dml_decimal"
DROP INDEX IF EXISTS mpp21090_dropcol_splitpt_idx_dml_idx_decimal;
NOTICE:  index "mpp21090_dropcol_splitpt_idx_dml_idx_decimal" does not exist, skipping
CREATE INDEX mpp21090_dropcol_splitpt_idx_dml_idx_decimal on mpp21090_dropcol_splitpt_idx_dml_decimal(col2);
NOTICE:  building index for child partition "mpp21090_dropcol_splitpt_idx_dml_decimal_1_prt_partone"
NOTICE:  building index for child partition "mpp21090_dropcol_splitpt_idx_dml_decimal_1_prt_parttwo"
NOTICE:  building index for child partition "mpp21090_dropcol_splitpt_idx_dml_decimal_1_prt_partthree"
INSERT INTO mpp21090_dropcol_splitpt_idx_dml_decimal VALUES(2.00,2.00,'a',2.00,0);
SELECT * FROM mpp21090_dropcol_splitpt_idx_dml_decimal ORDER BY 1,2,3,4;
 col1 | col2 | col3 | col4 | col5 
------+------+------+------+------
 2.00 | 2.00 | a    | 2.00 |    0
(1 row)

ALTER TABLE mpp21090_dropcol_splitpt_idx_dml_decimal DROP COLUMN col4;
ALTER TABLE mpp21090_dropcol_splitpt_idx_dml_decimal SPLIT PARTITION partone at (5.00) into (partition partsplitone,partition partsplitwo);
NOTICE:  exchanged partition "partone" of relation "mpp21090_dropcol_splitpt_idx_dml_decimal" with relation "pg_temp_650212"
NOTICE:  dropped partition "partone" for relation "mpp21090_dropcol_splitpt_idx_dml_decimal"
NOTICE:  CREATE TABLE will create partition "mpp21090_dropcol_splitpt_idx_dml_decimal_1_prt_partsplitone" for table "mpp21090_dropcol_splitpt_idx_dml_decimal"
NOTICE:  CREATE TABLE will create partition "mpp21090_dropcol_splitpt_idx_dml_decimal_1_prt_partsplitwo" for table "mpp21090_dropcol_splitpt_idx_dml_decimal"
INSERT INTO mpp21090_dropcol_splitpt_idx_dml_decimal SELECT 1.00, 1.00,'b', 1;
SELECT * FROM mpp21090_dropcol_splitpt_idx_dml_decimal ORDER BY 1,2,3;
 col1 | col2 | col3 | col5 
------+------+------+------
 1.00 | 1.00 | b    |    1
 2.00 | 2.00 | a    |    0
(2 rows)

-- Update distribution key
UPDATE mpp21090_dropcol_splitpt_idx_dml_decimal SET col1 = 35.00 WHERE col2 = 1.00 AND col1 = 1.00;
SELECT * FROM mpp21090_dropcol_splitpt_idx_dml_decimal ORDER BY 1,2,3;
 col1  | col2 | col3 | col5 
-------+------+------+------
  2.00 | 2.00 | a    |    0
 35.00 | 1.00 | b    |    1
(2 rows)

-- Update partition key
UPDATE mpp21090_dropcol_splitpt_idx_dml_decimal SET col2 =2.00  WHERE col2 = 1.00 AND col1 = 35.00;
SELECT * FROM mpp21090_dropcol_splitpt_idx_dml_decimal ORDER BY 1,2,3;
 col1  | col2 | col3 | col5 
-------+------+------+------
  2.00 | 2.00 | a    |    0
 35.00 | 2.00 | b    |    1
(2 rows)

DELETE FROM mpp21090_dropcol_splitpt_idx_dml_decimal WHERE col3='b';
SELECT * FROM mpp21090_dropcol_splitpt_idx_dml_decimal ORDER BY 1,2,3;
 col1 | col2 | col3 | col5 
------+------+------+------
 2.00 | 2.00 | a    |    0
(1 row)

-- @author prabhd 
-- @created 2014-04-01 12:00:00
-- @modified 2012-04-01 12:00:00
-- @tags dml MPP-21090 ORCA
-- @optimizer_mode on	
-- @description Tests for MPP-21090
\echo --start_ignore
--start_ignore
\echo --end_ignore
--end_ignore
DROP TABLE IF EXISTS mpp21090_dropcol_splitpt_idx_dml_float;
NOTICE:  table "mpp21090_dropcol_splitpt_idx_dml_float" does not exist, skipping
CREATE TABLE mpp21090_dropcol_splitpt_idx_dml_float
(
    col1 float,
    col2 float,
    col3 char,
    col4 float,
    col5 int
) 
DISTRIBUTED by (col1)
PARTITION BY RANGE(col2)(partition partone start(1.00) end(10.00)  WITH (APPENDONLY=true, COMPRESSLEVEL=5, ORIENTATION=column),partition parttwo start(10.00) end(20.00) WITH (APPENDONLY=true, COMPRESSLEVEL=5, ORIENTATION=row),partition partthree start(20.00) end(30.00));
NOTICE:  CREATE TABLE will create partition "mpp21090_dropcol_splitpt_idx_dml_float_1_prt_partone" for table "mpp21090_dropcol_splitpt_idx_dml_float"
NOTICE:  CREATE TABLE will create partition "mpp21090_dropcol_splitpt_idx_dml_float_1_prt_parttwo" for table "mpp21090_dropcol_splitpt_idx_dml_float"
NOTICE:  CREATE TABLE will create partition "mpp21090_dropcol_splitpt_idx_dml_float_1_prt_partthree" for table "mpp21090_dropcol_splitpt_idx_dml_float"
DROP INDEX IF EXISTS mpp21090_dropcol_splitpt_idx_dml_idx_float;
NOTICE:  index "mpp21090_dropcol_splitpt_idx_dml_idx_float" does not exist, skipping
CREATE INDEX mpp21090_dropcol_splitpt_idx_dml_idx_float on mpp21090_dropcol_splitpt_idx_dml_float(col2);
NOTICE:  building index for child partition "mpp21090_dropcol_splitpt_idx_dml_float_1_prt_partone"
NOTICE:  building index for child partition "mpp21090_dropcol_splitpt_idx_dml_float_1_prt_parttwo"
NOTICE:  building index for child partition "mpp21090_dropcol_splitpt_idx_dml_float_1_prt_partthree"
INSERT INTO mpp21090_dropcol_splitpt_idx_dml_float VALUES(2.00,2.00,'a',2.00,0);
SELECT * FROM mpp21090_dropcol_splitpt_idx_dml_float ORDER BY 1,2,3,4;
 col1 | col2 | col3 | col4 | col5 
------+------+------+------+------
    2 |    2 | a    |    2 |    0
(1 row)

ALTER TABLE mpp21090_dropcol_splitpt_idx_dml_float DROP COLUMN col4;
ALTER TABLE mpp21090_dropcol_splitpt_idx_dml_float SPLIT PARTITION partone at (5.00) into (partition partsplitone,partition partsplitwo);
NOTICE:  exchanged partition "partone" of relation "mpp21090_dropcol_splitpt_idx_dml_float" with relation "pg_temp_650686"
NOTICE:  dropped partition "partone" for relation "mpp21090_dropcol_splitpt_idx_dml_float"
NOTICE:  CREATE TABLE will create partition "mpp21090_dropcol_splitpt_idx_dml_float_1_prt_partsplitone" for table "mpp21090_dropcol_splitpt_idx_dml_float"
NOTICE:  CREATE TABLE will create partition "mpp21090_dropcol_splitpt_idx_dml_float_1_prt_partsplitwo" for table "mpp21090_dropcol_splitpt_idx_dml_float"
INSERT INTO mpp21090_dropcol_splitpt_idx_dml_float SELECT 1.00, 1.00,'b', 1;
SELECT * FROM mpp21090_dropcol_splitpt_idx_dml_float ORDER BY 1,2,3;
 col1 | col2 | col3 | col5 
------+------+------+------
    1 |    1 | b    |    1
    2 |    2 | a    |    0
(2 rows)

-- Update distribution key
UPDATE mpp21090_dropcol_splitpt_idx_dml_float SET col1 = 35.00 WHERE col2 = 1.00 AND col1 = 1.00;
SELECT * FROM mpp21090_dropcol_splitpt_idx_dml_float ORDER BY 1,2,3;
 col1 | col2 | col3 | col5 
------+------+------+------
    2 |    2 | a    |    0
   35 |    1 | b    |    1
(2 rows)

-- Update partition key
UPDATE mpp21090_dropcol_splitpt_idx_dml_float SET col2 =2.00  WHERE col2 = 1.00 AND col1 = 35.00;
SELECT * FROM mpp21090_dropcol_splitpt_idx_dml_float ORDER BY 1,2,3;
 col1 | col2 | col3 | col5 
------+------+------+------
    2 |    2 | a    |    0
   35 |    2 | b    |    1
(2 rows)

DELETE FROM mpp21090_dropcol_splitpt_idx_dml_float WHERE col3='b';
SELECT * FROM mpp21090_dropcol_splitpt_idx_dml_float ORDER BY 1,2,3;
 col1 | col2 | col3 | col5 
------+------+------+------
    2 |    2 | a    |    0
(1 row)

-- start_ignore
drop schema sql_partition_301_350 cascade;
NOTICE:  drop cascades to append only columnar table mpp21090_dropcol_splitpt_idx_dml_float_1_prt_partsplitwo
NOTICE:  drop cascades to constraint mpp21090_dropcol_splitpt_idx_dml_float_1_prt_partsplitwo_check on append only columnar table mpp21090_dropcol_splitpt_idx_dml_float_1_prt_partsplitwo
NOTICE:  drop cascades to append only columnar table mpp21090_dropcol_splitpt_idx_dml_float_1_prt_partsplitone
NOTICE:  drop cascades to constraint mpp21090_dropcol_splitpt_idx_dml_float_1_prt_partsplitone_check on append only columnar table mpp21090_dropcol_splitpt_idx_dml_float_1_prt_partsplitone
NOTICE:  drop cascades to table mpp21090_dropcol_splitpt_idx_dml_float_1_prt_partthree
NOTICE:  drop cascades to constraint mpp21090_dropcol_splitpt_idx_dml_float_1_prt_partthree_check on table mpp21090_dropcol_splitpt_idx_dml_float_1_prt_partthree
NOTICE:  drop cascades to append only table mpp21090_dropcol_splitpt_idx_dml_float_1_prt_parttwo
NOTICE:  drop cascades to constraint mpp21090_dropcol_splitpt_idx_dml_float_1_prt_parttwo_check on append only table mpp21090_dropcol_splitpt_idx_dml_float_1_prt_parttwo
NOTICE:  drop cascades to table mpp21090_dropcol_splitpt_idx_dml_float
NOTICE:  drop cascades to append only columnar table mpp21090_dropcol_splitpt_idx_dml_decimal_1_prt_partsplitwo
NOTICE:  drop cascades to constraint mpp21090_dropcol_splitpt_idx_dml_decimal_1_prt_partsplitwo_chec on append only columnar table mpp21090_dropcol_splitpt_idx_dml_decimal_1_prt_partsplitwo
NOTICE:  drop cascades to append only columnar table mpp21090_dropcol_splitpt_idx_dml_decimal_1_prt_partsplitone
NOTICE:  drop cascades to constraint mpp21090_dropcol_splitpt_idx_dml_decimal_1_prt_partsplitone_che on append only columnar table mpp21090_dropcol_splitpt_idx_dml_decimal_1_prt_partsplitone
NOTICE:  drop cascades to table mpp21090_dropcol_splitpt_idx_dml_decimal_1_prt_partthree
NOTICE:  drop cascades to constraint mpp21090_dropcol_splitpt_idx_dml_decimal_1_prt_partthree_check on table mpp21090_dropcol_splitpt_idx_dml_decimal_1_prt_partthree
NOTICE:  drop cascades to append only table mpp21090_dropcol_splitpt_idx_dml_decimal_1_prt_parttwo
NOTICE:  drop cascades to constraint mpp21090_dropcol_splitpt_idx_dml_decimal_1_prt_parttwo_check on append only table mpp21090_dropcol_splitpt_idx_dml_decimal_1_prt_parttwo
NOTICE:  drop cascades to table mpp21090_dropcol_splitpt_idx_dml_decimal
NOTICE:  drop cascades to append only columnar table mpp21090_dropcol_splitpt_idx_dml_date_1_prt_partsplitwo
NOTICE:  drop cascades to constraint mpp21090_dropcol_splitpt_idx_dml_date_1_prt_partsplitwo_check on append only columnar table mpp21090_dropcol_splitpt_idx_dml_date_1_prt_partsplitwo
NOTICE:  drop cascades to append only columnar table mpp21090_dropcol_splitpt_idx_dml_date_1_prt_partsplitone
NOTICE:  drop cascades to constraint mpp21090_dropcol_splitpt_idx_dml_date_1_prt_partsplitone_check on append only columnar table mpp21090_dropcol_splitpt_idx_dml_date_1_prt_partsplitone
NOTICE:  drop cascades to table mpp21090_dropcol_splitpt_idx_dml_date_1_prt_partthree
NOTICE:  drop cascades to constraint mpp21090_dropcol_splitpt_idx_dml_date_1_prt_partthree_check on table mpp21090_dropcol_splitpt_idx_dml_date_1_prt_partthree
NOTICE:  drop cascades to append only table mpp21090_dropcol_splitpt_idx_dml_date_1_prt_parttwo
NOTICE:  drop cascades to constraint mpp21090_dropcol_splitpt_idx_dml_date_1_prt_parttwo_check on append only table mpp21090_dropcol_splitpt_idx_dml_date_1_prt_parttwo
NOTICE:  drop cascades to table mpp21090_dropcol_splitpt_idx_dml_date
NOTICE:  drop cascades to append only columnar table mpp21090_dropcol_splitpt_idx_dml_char_1_prt_partsplitwo
NOTICE:  drop cascades to constraint mpp21090_dropcol_splitpt_idx_dml_char_1_prt_partsplitwo_check on append only columnar table mpp21090_dropcol_splitpt_idx_dml_char_1_prt_partsplitwo
NOTICE:  drop cascades to append only columnar table mpp21090_dropcol_splitpt_idx_dml_char_1_prt_partsplitone
NOTICE:  drop cascades to constraint mpp21090_dropcol_splitpt_idx_dml_char_1_prt_partsplitone_check on append only columnar table mpp21090_dropcol_splitpt_idx_dml_char_1_prt_partsplitone
NOTICE:  drop cascades to table mpp21090_dropcol_splitpt_idx_dml_char_1_prt_partthree
NOTICE:  drop cascades to constraint mpp21090_dropcol_splitpt_idx_dml_char_1_prt_partthree_check on table mpp21090_dropcol_splitpt_idx_dml_char_1_prt_partthree
NOTICE:  drop cascades to append only table mpp21090_dropcol_splitpt_idx_dml_char_1_prt_parttwo
NOTICE:  drop cascades to constraint mpp21090_dropcol_splitpt_idx_dml_char_1_prt_parttwo_check on append only table mpp21090_dropcol_splitpt_idx_dml_char_1_prt_parttwo
NOTICE:  drop cascades to table mpp21090_dropcol_splitpt_idx_dml_char
NOTICE:  drop cascades to append only columnar table mpp21090_dropcol_splitpt_dml_timestamptz_1_prt_partsplitwo
NOTICE:  drop cascades to constraint mpp21090_dropcol_splitpt_dml_timestamptz_1_prt_partsplitwo_chec on append only columnar table mpp21090_dropcol_splitpt_dml_timestamptz_1_prt_partsplitwo
NOTICE:  drop cascades to append only columnar table mpp21090_dropcol_splitpt_dml_timestamptz_1_prt_partsplitone
NOTICE:  drop cascades to constraint mpp21090_dropcol_splitpt_dml_timestamptz_1_prt_partsplitone_che on append only columnar table mpp21090_dropcol_splitpt_dml_timestamptz_1_prt_partsplitone
NOTICE:  drop cascades to table mpp21090_dropcol_splitpt_dml_timestamptz_1_prt_partthree
NOTICE:  drop cascades to constraint mpp21090_dropcol_splitpt_dml_timestamptz_1_prt_partthree_check on table mpp21090_dropcol_splitpt_dml_timestamptz_1_prt_partthree
NOTICE:  drop cascades to append only table mpp21090_dropcol_splitpt_dml_timestamptz_1_prt_parttwo
NOTICE:  drop cascades to constraint mpp21090_dropcol_splitpt_dml_timestamptz_1_prt_parttwo_check on append only table mpp21090_dropcol_splitpt_dml_timestamptz_1_prt_parttwo
NOTICE:  drop cascades to table mpp21090_dropcol_splitpt_dml_timestamptz
NOTICE:  drop cascades to append only columnar table mpp21090_dropcol_splitpt_dml_timestamp_1_prt_partsplitwo
NOTICE:  drop cascades to constraint mpp21090_dropcol_splitpt_dml_timestamp_1_prt_partsplitwo_check on append only columnar table mpp21090_dropcol_splitpt_dml_timestamp_1_prt_partsplitwo
NOTICE:  drop cascades to append only columnar table mpp21090_dropcol_splitpt_dml_timestamp_1_prt_partsplitone
NOTICE:  drop cascades to constraint mpp21090_dropcol_splitpt_dml_timestamp_1_prt_partsplitone_check on append only columnar table mpp21090_dropcol_splitpt_dml_timestamp_1_prt_partsplitone
NOTICE:  drop cascades to table mpp21090_dropcol_splitpt_dml_timestamp_1_prt_partthree
NOTICE:  drop cascades to constraint mpp21090_dropcol_splitpt_dml_timestamp_1_prt_partthree_check on table mpp21090_dropcol_splitpt_dml_timestamp_1_prt_partthree
NOTICE:  drop cascades to append only table mpp21090_dropcol_splitpt_dml_timestamp_1_prt_parttwo
NOTICE:  drop cascades to constraint mpp21090_dropcol_splitpt_dml_timestamp_1_prt_parttwo_check on append only table mpp21090_dropcol_splitpt_dml_timestamp_1_prt_parttwo
NOTICE:  drop cascades to table mpp21090_dropcol_splitpt_dml_timestamp
NOTICE:  drop cascades to append only columnar table mpp21090_dropcol_splitpt_dml_time_1_prt_partsplitwo
NOTICE:  drop cascades to constraint mpp21090_dropcol_splitpt_dml_time_1_prt_partsplitwo_check on append only columnar table mpp21090_dropcol_splitpt_dml_time_1_prt_partsplitwo
NOTICE:  drop cascades to append only columnar table mpp21090_dropcol_splitpt_dml_time_1_prt_partsplitone
NOTICE:  drop cascades to constraint mpp21090_dropcol_splitpt_dml_time_1_prt_partsplitone_check on append only columnar table mpp21090_dropcol_splitpt_dml_time_1_prt_partsplitone
NOTICE:  drop cascades to append only table mpp21090_dropcol_splitpt_dml_time_1_prt_parttwo
NOTICE:  drop cascades to constraint mpp21090_dropcol_splitpt_dml_time_1_prt_parttwo_check on append only table mpp21090_dropcol_splitpt_dml_time_1_prt_parttwo
NOTICE:  drop cascades to table mpp21090_dropcol_splitpt_dml_time_1_prt_partthree
NOTICE:  drop cascades to constraint mpp21090_dropcol_splitpt_dml_time_1_prt_partthree_check on table mpp21090_dropcol_splitpt_dml_time_1_prt_partthree
NOTICE:  drop cascades to table mpp21090_dropcol_splitpt_dml_time
NOTICE:  drop cascades to append only columnar table mpp21090_dropcol_splitpt_dml_numeric_1_prt_partsplitwo
NOTICE:  drop cascades to constraint mpp21090_dropcol_splitpt_dml_numeric_1_prt_partsplitwo_check on append only columnar table mpp21090_dropcol_splitpt_dml_numeric_1_prt_partsplitwo
NOTICE:  drop cascades to append only columnar table mpp21090_dropcol_splitpt_dml_numeric_1_prt_partsplitone
NOTICE:  drop cascades to constraint mpp21090_dropcol_splitpt_dml_numeric_1_prt_partsplitone_check on append only columnar table mpp21090_dropcol_splitpt_dml_numeric_1_prt_partsplitone
NOTICE:  drop cascades to table mpp21090_dropcol_splitpt_dml_numeric_1_prt_partthree
NOTICE:  drop cascades to constraint mpp21090_dropcol_splitpt_dml_numeric_1_prt_partthree_check on table mpp21090_dropcol_splitpt_dml_numeric_1_prt_partthree
NOTICE:  drop cascades to append only table mpp21090_dropcol_splitpt_dml_numeric_1_prt_parttwo
NOTICE:  drop cascades to constraint mpp21090_dropcol_splitpt_dml_numeric_1_prt_parttwo_check on append only table mpp21090_dropcol_splitpt_dml_numeric_1_prt_parttwo
NOTICE:  drop cascades to table mpp21090_dropcol_splitpt_dml_numeric
NOTICE:  drop cascades to append only columnar table mpp21090_dropcol_splitpt_dml_interval_1_prt_partsplitwo
NOTICE:  drop cascades to constraint mpp21090_dropcol_splitpt_dml_interval_1_prt_partsplitwo_check on append only columnar table mpp21090_dropcol_splitpt_dml_interval_1_prt_partsplitwo
NOTICE:  drop cascades to append only columnar table mpp21090_dropcol_splitpt_dml_interval_1_prt_partsplitone
NOTICE:  drop cascades to constraint mpp21090_dropcol_splitpt_dml_interval_1_prt_partsplitone_check on append only columnar table mpp21090_dropcol_splitpt_dml_interval_1_prt_partsplitone
NOTICE:  drop cascades to table mpp21090_dropcol_splitpt_dml_interval_1_prt_partthree
NOTICE:  drop cascades to constraint mpp21090_dropcol_splitpt_dml_interval_1_prt_partthree_check on table mpp21090_dropcol_splitpt_dml_interval_1_prt_partthree
NOTICE:  drop cascades to append only table mpp21090_dropcol_splitpt_dml_interval_1_prt_parttwo
NOTICE:  drop cascades to constraint mpp21090_dropcol_splitpt_dml_interval_1_prt_parttwo_check on append only table mpp21090_dropcol_splitpt_dml_interval_1_prt_parttwo
NOTICE:  drop cascades to table mpp21090_dropcol_splitpt_dml_interval
NOTICE:  drop cascades to append only columnar table mpp21090_dropcol_splitpt_dml_int8_1_prt_partsplitwo
NOTICE:  drop cascades to constraint mpp21090_dropcol_splitpt_dml_int8_1_prt_partsplitwo_check on append only columnar table mpp21090_dropcol_splitpt_dml_int8_1_prt_partsplitwo
NOTICE:  drop cascades to append only columnar table mpp21090_dropcol_splitpt_dml_int8_1_prt_partsplitone
NOTICE:  drop cascades to constraint mpp21090_dropcol_splitpt_dml_int8_1_prt_partsplitone_check on append only columnar table mpp21090_dropcol_splitpt_dml_int8_1_prt_partsplitone
NOTICE:  drop cascades to table mpp21090_dropcol_splitpt_dml_int8_1_prt_partthree
NOTICE:  drop cascades to constraint mpp21090_dropcol_splitpt_dml_int8_1_prt_partthree_check on table mpp21090_dropcol_splitpt_dml_int8_1_prt_partthree
NOTICE:  drop cascades to append only table mpp21090_dropcol_splitpt_dml_int8_1_prt_parttwo
NOTICE:  drop cascades to constraint mpp21090_dropcol_splitpt_dml_int8_1_prt_parttwo_check on append only table mpp21090_dropcol_splitpt_dml_int8_1_prt_parttwo
NOTICE:  drop cascades to table mpp21090_dropcol_splitpt_dml_int8
NOTICE:  drop cascades to append only columnar table mpp21090_dropcol_splitpt_dml_int4_1_prt_partsplitwo
NOTICE:  drop cascades to constraint mpp21090_dropcol_splitpt_dml_int4_1_prt_partsplitwo_check on append only columnar table mpp21090_dropcol_splitpt_dml_int4_1_prt_partsplitwo
NOTICE:  drop cascades to append only columnar table mpp21090_dropcol_splitpt_dml_int4_1_prt_partsplitone
NOTICE:  drop cascades to constraint mpp21090_dropcol_splitpt_dml_int4_1_prt_partsplitone_check on append only columnar table mpp21090_dropcol_splitpt_dml_int4_1_prt_partsplitone
NOTICE:  drop cascades to table mpp21090_dropcol_splitpt_dml_int4_1_prt_partthree
NOTICE:  drop cascades to constraint mpp21090_dropcol_splitpt_dml_int4_1_prt_partthree_check on table mpp21090_dropcol_splitpt_dml_int4_1_prt_partthree
NOTICE:  drop cascades to append only table mpp21090_dropcol_splitpt_dml_int4_1_prt_parttwo
NOTICE:  drop cascades to constraint mpp21090_dropcol_splitpt_dml_int4_1_prt_parttwo_check on append only table mpp21090_dropcol_splitpt_dml_int4_1_prt_parttwo
NOTICE:  drop cascades to table mpp21090_dropcol_splitpt_dml_int4
NOTICE:  drop cascades to append only columnar table mpp21090_dropcol_splitpt_dml_int_1_prt_partsplitwo
NOTICE:  drop cascades to constraint mpp21090_dropcol_splitpt_dml_int_1_prt_partsplitwo_check on append only columnar table mpp21090_dropcol_splitpt_dml_int_1_prt_partsplitwo
NOTICE:  drop cascades to append only columnar table mpp21090_dropcol_splitpt_dml_int_1_prt_partsplitone
NOTICE:  drop cascades to constraint mpp21090_dropcol_splitpt_dml_int_1_prt_partsplitone_check on append only columnar table mpp21090_dropcol_splitpt_dml_int_1_prt_partsplitone
NOTICE:  drop cascades to table mpp21090_dropcol_splitpt_dml_int_1_prt_partthree
NOTICE:  drop cascades to constraint mpp21090_dropcol_splitpt_dml_int_1_prt_partthree_check on table mpp21090_dropcol_splitpt_dml_int_1_prt_partthree
NOTICE:  drop cascades to append only table mpp21090_dropcol_splitpt_dml_int_1_prt_parttwo
NOTICE:  drop cascades to constraint mpp21090_dropcol_splitpt_dml_int_1_prt_parttwo_check on append only table mpp21090_dropcol_splitpt_dml_int_1_prt_parttwo
NOTICE:  drop cascades to table mpp21090_dropcol_splitpt_dml_int
NOTICE:  drop cascades to append only columnar table mpp21090_dropcol_splitpt_dml_float_1_prt_partsplitwo
NOTICE:  drop cascades to constraint mpp21090_dropcol_splitpt_dml_float_1_prt_partsplitwo_check on append only columnar table mpp21090_dropcol_splitpt_dml_float_1_prt_partsplitwo
NOTICE:  drop cascades to append only columnar table mpp21090_dropcol_splitpt_dml_float_1_prt_partsplitone
NOTICE:  drop cascades to constraint mpp21090_dropcol_splitpt_dml_float_1_prt_partsplitone_check on append only columnar table mpp21090_dropcol_splitpt_dml_float_1_prt_partsplitone
NOTICE:  drop cascades to table mpp21090_dropcol_splitpt_dml_float_1_prt_partthree
NOTICE:  drop cascades to constraint mpp21090_dropcol_splitpt_dml_float_1_prt_partthree_check on table mpp21090_dropcol_splitpt_dml_float_1_prt_partthree
NOTICE:  drop cascades to append only table mpp21090_dropcol_splitpt_dml_float_1_prt_parttwo
NOTICE:  drop cascades to constraint mpp21090_dropcol_splitpt_dml_float_1_prt_parttwo_check on append only table mpp21090_dropcol_splitpt_dml_float_1_prt_parttwo
NOTICE:  drop cascades to table mpp21090_dropcol_splitpt_dml_float
NOTICE:  drop cascades to append only columnar table mpp21090_dropcol_splitpt_dml_decimal_1_prt_partsplitwo
NOTICE:  drop cascades to constraint mpp21090_dropcol_splitpt_dml_decimal_1_prt_partsplitwo_check on append only columnar table mpp21090_dropcol_splitpt_dml_decimal_1_prt_partsplitwo
NOTICE:  drop cascades to append only columnar table mpp21090_dropcol_splitpt_dml_decimal_1_prt_partsplitone
NOTICE:  drop cascades to constraint mpp21090_dropcol_splitpt_dml_decimal_1_prt_partsplitone_check on append only columnar table mpp21090_dropcol_splitpt_dml_decimal_1_prt_partsplitone
NOTICE:  drop cascades to table mpp21090_dropcol_splitpt_dml_decimal_1_prt_partthree
NOTICE:  drop cascades to constraint mpp21090_dropcol_splitpt_dml_decimal_1_prt_partthree_check on table mpp21090_dropcol_splitpt_dml_decimal_1_prt_partthree
NOTICE:  drop cascades to append only table mpp21090_dropcol_splitpt_dml_decimal_1_prt_parttwo
NOTICE:  drop cascades to constraint mpp21090_dropcol_splitpt_dml_decimal_1_prt_parttwo_check on append only table mpp21090_dropcol_splitpt_dml_decimal_1_prt_parttwo
NOTICE:  drop cascades to table mpp21090_dropcol_splitpt_dml_decimal
NOTICE:  drop cascades to append only columnar table mpp21090_dropcol_splitpt_dml_date_1_prt_partsplitwo
NOTICE:  drop cascades to constraint mpp21090_dropcol_splitpt_dml_date_1_prt_partsplitwo_check on append only columnar table mpp21090_dropcol_splitpt_dml_date_1_prt_partsplitwo
NOTICE:  drop cascades to append only columnar table mpp21090_dropcol_splitpt_dml_date_1_prt_partsplitone
NOTICE:  drop cascades to constraint mpp21090_dropcol_splitpt_dml_date_1_prt_partsplitone_check on append only columnar table mpp21090_dropcol_splitpt_dml_date_1_prt_partsplitone
NOTICE:  drop cascades to table mpp21090_dropcol_splitpt_dml_date_1_prt_partthree
NOTICE:  drop cascades to constraint mpp21090_dropcol_splitpt_dml_date_1_prt_partthree_check on table mpp21090_dropcol_splitpt_dml_date_1_prt_partthree
NOTICE:  drop cascades to append only table mpp21090_dropcol_splitpt_dml_date_1_prt_parttwo
NOTICE:  drop cascades to constraint mpp21090_dropcol_splitpt_dml_date_1_prt_parttwo_check on append only table mpp21090_dropcol_splitpt_dml_date_1_prt_parttwo
NOTICE:  drop cascades to table mpp21090_dropcol_splitpt_dml_date
NOTICE:  drop cascades to append only columnar table mpp21090_dropcol_splitpt_dml_char_1_prt_partsplitwo
NOTICE:  drop cascades to constraint mpp21090_dropcol_splitpt_dml_char_1_prt_partsplitwo_check on append only columnar table mpp21090_dropcol_splitpt_dml_char_1_prt_partsplitwo
NOTICE:  drop cascades to append only columnar table mpp21090_dropcol_splitpt_dml_char_1_prt_partsplitone
NOTICE:  drop cascades to constraint mpp21090_dropcol_splitpt_dml_char_1_prt_partsplitone_check on append only columnar table mpp21090_dropcol_splitpt_dml_char_1_prt_partsplitone
NOTICE:  drop cascades to table mpp21090_dropcol_splitpt_dml_char_1_prt_partthree
NOTICE:  drop cascades to constraint mpp21090_dropcol_splitpt_dml_char_1_prt_partthree_check on table mpp21090_dropcol_splitpt_dml_char_1_prt_partthree
NOTICE:  drop cascades to append only table mpp21090_dropcol_splitpt_dml_char_1_prt_parttwo
NOTICE:  drop cascades to constraint mpp21090_dropcol_splitpt_dml_char_1_prt_parttwo_check on append only table mpp21090_dropcol_splitpt_dml_char_1_prt_parttwo
NOTICE:  drop cascades to table mpp21090_dropcol_splitpt_dml_char
NOTICE:  drop cascades to table mpp21090_dropcol_splitdfpt_dml_timestamptz_1_prt_def
NOTICE:  drop cascades to table mpp21090_dropcol_splitdfpt_dml_timestamptz_1_prt_partsplitone
NOTICE:  drop cascades to constraint mpp21090_dropcol_splitdfpt_dml_timestamptz_1_prt_partsplitone_c on table mpp21090_dropcol_splitdfpt_dml_timestamptz_1_prt_partsplitone
NOTICE:  drop cascades to table mpp21090_dropcol_splitdfpt_dml_timestamptz
NOTICE:  drop cascades to table mpp21090_dropcol_splitdfpt_dml_timestamp_1_prt_def
NOTICE:  drop cascades to table mpp21090_dropcol_splitdfpt_dml_timestamp_1_prt_partsplitone
NOTICE:  drop cascades to constraint mpp21090_dropcol_splitdfpt_dml_timestamp_1_prt_partsplitone_che on table mpp21090_dropcol_splitdfpt_dml_timestamp_1_prt_partsplitone
NOTICE:  drop cascades to table mpp21090_dropcol_splitdfpt_dml_timestamp
NOTICE:  drop cascades to table mpp21090_dropcol_splitdfpt_dml_time_1_prt_def
NOTICE:  drop cascades to table mpp21090_dropcol_splitdfpt_dml_time_1_prt_partsplitone
NOTICE:  drop cascades to constraint mpp21090_dropcol_splitdfpt_dml_time_1_prt_partsplitone_check on table mpp21090_dropcol_splitdfpt_dml_time_1_prt_partsplitone
NOTICE:  drop cascades to table mpp21090_dropcol_splitdfpt_dml_time
NOTICE:  drop cascades to table mpp21090_dropcol_splitdfpt_dml_numeric_1_prt_def
NOTICE:  drop cascades to table mpp21090_dropcol_splitdfpt_dml_numeric_1_prt_partsplitone
NOTICE:  drop cascades to constraint mpp21090_dropcol_splitdfpt_dml_numeric_1_prt_partsplitone_check on table mpp21090_dropcol_splitdfpt_dml_numeric_1_prt_partsplitone
NOTICE:  drop cascades to table mpp21090_dropcol_splitdfpt_dml_numeric
NOTICE:  drop cascades to table mpp21090_dropcol_splitdfpt_dml_interval_1_prt_def
NOTICE:  drop cascades to table mpp21090_dropcol_splitdfpt_dml_interval_1_prt_partsplitone
NOTICE:  drop cascades to constraint mpp21090_dropcol_splitdfpt_dml_interval_1_prt_partsplitone_chec on table mpp21090_dropcol_splitdfpt_dml_interval_1_prt_partsplitone
NOTICE:  drop cascades to table mpp21090_dropcol_splitdfpt_dml_interval
NOTICE:  drop cascades to table mpp21090_dropcol_splitdfpt_dml_int8_1_prt_def
NOTICE:  drop cascades to table mpp21090_dropcol_splitdfpt_dml_int8_1_prt_partsplitone
NOTICE:  drop cascades to constraint mpp21090_dropcol_splitdfpt_dml_int8_1_prt_partsplitone_check on table mpp21090_dropcol_splitdfpt_dml_int8_1_prt_partsplitone
NOTICE:  drop cascades to table mpp21090_dropcol_splitdfpt_dml_int8
NOTICE:  drop cascades to table mpp21090_dropcol_splitdfpt_dml_int4_1_prt_def
NOTICE:  drop cascades to table mpp21090_dropcol_splitdfpt_dml_int4_1_prt_partsplitone
NOTICE:  drop cascades to constraint mpp21090_dropcol_splitdfpt_dml_int4_1_prt_partsplitone_check on table mpp21090_dropcol_splitdfpt_dml_int4_1_prt_partsplitone
NOTICE:  drop cascades to table mpp21090_dropcol_splitdfpt_dml_int4
NOTICE:  drop cascades to table mpp21090_dropcol_splitdfpt_dml_int_1_prt_def
NOTICE:  drop cascades to table mpp21090_dropcol_splitdfpt_dml_int_1_prt_partsplitone
NOTICE:  drop cascades to constraint mpp21090_dropcol_splitdfpt_dml_int_1_prt_partsplitone_check on table mpp21090_dropcol_splitdfpt_dml_int_1_prt_partsplitone
NOTICE:  drop cascades to table mpp21090_dropcol_splitdfpt_dml_int
NOTICE:  drop cascades to table mpp21090_dropcol_splitdfpt_dml_float_1_prt_def
NOTICE:  drop cascades to table mpp21090_dropcol_splitdfpt_dml_float_1_prt_partsplitone
NOTICE:  drop cascades to constraint mpp21090_dropcol_splitdfpt_dml_float_1_prt_partsplitone_check on table mpp21090_dropcol_splitdfpt_dml_float_1_prt_partsplitone
NOTICE:  drop cascades to table mpp21090_dropcol_splitdfpt_dml_float
NOTICE:  drop cascades to table mpp21090_dropcol_splitdfpt_dml_decimal_1_prt_def
NOTICE:  drop cascades to table mpp21090_dropcol_splitdfpt_dml_decimal_1_prt_partsplitone
NOTICE:  drop cascades to constraint mpp21090_dropcol_splitdfpt_dml_decimal_1_prt_partsplitone_check on table mpp21090_dropcol_splitdfpt_dml_decimal_1_prt_partsplitone
NOTICE:  drop cascades to table mpp21090_dropcol_splitdfpt_dml_decimal
NOTICE:  drop cascades to table mpp21090_dropcol_splitdfpt_dml_date_1_prt_def
NOTICE:  drop cascades to table mpp21090_dropcol_splitdfpt_dml_date_1_prt_partsplitone
NOTICE:  drop cascades to constraint mpp21090_dropcol_splitdfpt_dml_date_1_prt_partsplitone_check on table mpp21090_dropcol_splitdfpt_dml_date_1_prt_partsplitone
NOTICE:  drop cascades to table mpp21090_dropcol_splitdfpt_dml_date
NOTICE:  drop cascades to table mpp21090_dropcol_splitdfpt_dml_char_1_prt_def
NOTICE:  drop cascades to table mpp21090_dropcol_splitdfpt_dml_char_1_prt_partsplitone
NOTICE:  drop cascades to constraint mpp21090_dropcol_splitdfpt_dml_char_1_prt_partsplitone_check on table mpp21090_dropcol_splitdfpt_dml_char_1_prt_partsplitone
NOTICE:  drop cascades to table mpp21090_dropcol_splitdfpt_dml_char
NOTICE:  drop cascades to table mpp21090_dropcol_splitdefpt_addcol_dml_timestamptz_1_prt_def
NOTICE:  drop cascades to table mpp21090_dropcol_splitdefpt_addcol_dml_time_1_prt_partsplitone1
NOTICE:  drop cascades to constraint mpp21090_dropcol_splitdefpt_addcol_dml_time_1_prt_partsplitone1 on table mpp21090_dropcol_splitdefpt_addcol_dml_time_1_prt_partsplitone1
NOTICE:  drop cascades to table mpp21090_dropcol_splitdefpt_addcol_dml_timestamptz
NOTICE:  drop cascades to table mpp21090_dropcol_splitdefpt_addcol_dml_timestamp_1_prt_def
NOTICE:  drop cascades to table mpp21090_dropcol_splitdefpt_addcol_dml_times_1_prt_partsplitone
NOTICE:  drop cascades to constraint mpp21090_dropcol_splitdefpt_addcol_dml_times_1_prt_partsplitone on table mpp21090_dropcol_splitdefpt_addcol_dml_times_1_prt_partsplitone
NOTICE:  drop cascades to table mpp21090_dropcol_splitdefpt_addcol_dml_timestamp
NOTICE:  drop cascades to table mpp21090_dropcol_splitdefpt_addcol_dml_time_1_prt_def
NOTICE:  drop cascades to table mpp21090_dropcol_splitdefpt_addcol_dml_time_1_prt_partsplitone
NOTICE:  drop cascades to constraint mpp21090_dropcol_splitdefpt_addcol_dml_time_1_prt_partsplitone_ on table mpp21090_dropcol_splitdefpt_addcol_dml_time_1_prt_partsplitone
NOTICE:  drop cascades to table mpp21090_dropcol_splitdefpt_addcol_dml_time
NOTICE:  drop cascades to table mpp21090_dropcol_splitdefpt_addcol_dml_numeric_1_prt_def
NOTICE:  drop cascades to table mpp21090_dropcol_splitdefpt_addcol_dml_numer_1_prt_partsplitone
NOTICE:  drop cascades to constraint mpp21090_dropcol_splitdefpt_addcol_dml_numer_1_prt_partsplitone on table mpp21090_dropcol_splitdefpt_addcol_dml_numer_1_prt_partsplitone
NOTICE:  drop cascades to table mpp21090_dropcol_splitdefpt_addcol_dml_numeric
NOTICE:  drop cascades to table mpp21090_dropcol_splitdefpt_addcol_dml_interval_1_prt_def
NOTICE:  drop cascades to table mpp21090_dropcol_splitdefpt_addcol_dml_inter_1_prt_partsplitone
NOTICE:  drop cascades to constraint mpp21090_dropcol_splitdefpt_addcol_dml_inter_1_prt_partsplitone on table mpp21090_dropcol_splitdefpt_addcol_dml_inter_1_prt_partsplitone
NOTICE:  drop cascades to table mpp21090_dropcol_splitdefpt_addcol_dml_interval
NOTICE:  drop cascades to table mpp21090_dropcol_splitdefpt_addcol_dml_int8_1_prt_def
NOTICE:  drop cascades to table mpp21090_dropcol_splitdefpt_addcol_dml_int8_1_prt_partsplitone
NOTICE:  drop cascades to constraint mpp21090_dropcol_splitdefpt_addcol_dml_int8_1_prt_partsplitone_ on table mpp21090_dropcol_splitdefpt_addcol_dml_int8_1_prt_partsplitone
NOTICE:  drop cascades to table mpp21090_dropcol_splitdefpt_addcol_dml_int8
NOTICE:  drop cascades to table mpp21090_dropcol_splitdefpt_addcol_dml_int4_1_prt_def
NOTICE:  drop cascades to table mpp21090_dropcol_splitdefpt_addcol_dml_int4_1_prt_partsplitone
NOTICE:  drop cascades to constraint mpp21090_dropcol_splitdefpt_addcol_dml_int4_1_prt_partsplitone_ on table mpp21090_dropcol_splitdefpt_addcol_dml_int4_1_prt_partsplitone
NOTICE:  drop cascades to table mpp21090_dropcol_splitdefpt_addcol_dml_int4
NOTICE:  drop cascades to table mpp21090_dropcol_splitdefpt_addcol_dml_int_1_prt_def
NOTICE:  drop cascades to table mpp21090_dropcol_splitdefpt_addcol_dml_int_1_prt_partsplitone
NOTICE:  drop cascades to constraint mpp21090_dropcol_splitdefpt_addcol_dml_int_1_prt_partsplitone_c on table mpp21090_dropcol_splitdefpt_addcol_dml_int_1_prt_partsplitone
NOTICE:  drop cascades to table mpp21090_dropcol_splitdefpt_addcol_dml_int
NOTICE:  drop cascades to table mpp21090_dropcol_splitdefpt_addcol_dml_float_1_prt_def
NOTICE:  drop cascades to table mpp21090_dropcol_splitdefpt_addcol_dml_float_1_prt_partsplitone
NOTICE:  drop cascades to constraint mpp21090_dropcol_splitdefpt_addcol_dml_float_1_prt_partsplitone on table mpp21090_dropcol_splitdefpt_addcol_dml_float_1_prt_partsplitone
NOTICE:  drop cascades to table mpp21090_dropcol_splitdefpt_addcol_dml_float
NOTICE:  drop cascades to table mpp21090_dropcol_splitdefpt_addcol_dml_decimal_1_prt_def
NOTICE:  drop cascades to table mpp21090_dropcol_splitdefpt_addcol_dml_decim_1_prt_partsplitone
NOTICE:  drop cascades to constraint mpp21090_dropcol_splitdefpt_addcol_dml_decim_1_prt_partsplitone on table mpp21090_dropcol_splitdefpt_addcol_dml_decim_1_prt_partsplitone
NOTICE:  drop cascades to table mpp21090_dropcol_splitdefpt_addcol_dml_decimal
NOTICE:  drop cascades to table mpp21090_dropcol_splitdefpt_addcol_dml_date_1_prt_def
NOTICE:  drop cascades to table mpp21090_dropcol_splitdefpt_addcol_dml_date_1_prt_partsplitone
NOTICE:  drop cascades to constraint mpp21090_dropcol_splitdefpt_addcol_dml_date_1_prt_partsplitone_ on table mpp21090_dropcol_splitdefpt_addcol_dml_date_1_prt_partsplitone
NOTICE:  drop cascades to table mpp21090_dropcol_splitdefpt_addcol_dml_date
NOTICE:  drop cascades to table mpp21090_dropcol_splitdefpt_addcol_dml_char_1_prt_def
NOTICE:  drop cascades to table mpp21090_dropcol_splitdefpt_addcol_dml_char_1_prt_partsplitone
NOTICE:  drop cascades to constraint mpp21090_dropcol_splitdefpt_addcol_dml_char_1_prt_partsplitone_ on table mpp21090_dropcol_splitdefpt_addcol_dml_char_1_prt_partsplitone
NOTICE:  drop cascades to table mpp21090_dropcol_splitdefpt_addcol_dml_char
NOTICE:  drop cascades to append only columnar table mpp21090_dropcol_addcol_splitpt_dml_timestam_1_prt_partsplitwo1
NOTICE:  drop cascades to constraint mpp21090_dropcol_addcol_splitpt_dml_timestam_1_prt_partsplitwo1 on append only columnar table mpp21090_dropcol_addcol_splitpt_dml_timestam_1_prt_partsplitwo1
NOTICE:  drop cascades to append only columnar table mpp21090_dropcol_addcol_splitpt_dml_timesta_1_prt_partsplitone1
NOTICE:  drop cascades to constraint mpp21090_dropcol_addcol_splitpt_dml_timesta_1_prt_partsplitone1 on append only columnar table mpp21090_dropcol_addcol_splitpt_dml_timesta_1_prt_partsplitone1
NOTICE:  drop cascades to table mpp21090_dropcol_addcol_splitpt_dml_timestamptz_1_prt_partthree
NOTICE:  drop cascades to constraint mpp21090_dropcol_addcol_splitpt_dml_timestamptz_1_prt_partthree on table mpp21090_dropcol_addcol_splitpt_dml_timestamptz_1_prt_partthree
NOTICE:  drop cascades to append only table mpp21090_dropcol_addcol_splitpt_dml_timestamptz_1_prt_parttwo
NOTICE:  drop cascades to constraint mpp21090_dropcol_addcol_splitpt_dml_timestamptz_1_prt_parttwo_c on append only table mpp21090_dropcol_addcol_splitpt_dml_timestamptz_1_prt_parttwo
NOTICE:  drop cascades to table mpp21090_dropcol_addcol_splitpt_dml_timestamptz
NOTICE:  drop cascades to append only columnar table mpp21090_dropcol_addcol_splitpt_dml_timestamp_1_prt_partsplitwo
NOTICE:  drop cascades to constraint mpp21090_dropcol_addcol_splitpt_dml_timestamp_1_prt_partsplitwo on append only columnar table mpp21090_dropcol_addcol_splitpt_dml_timestamp_1_prt_partsplitwo
NOTICE:  drop cascades to append only columnar table mpp21090_dropcol_addcol_splitpt_dml_timestam_1_prt_partsplitone
NOTICE:  drop cascades to constraint mpp21090_dropcol_addcol_splitpt_dml_timestam_1_prt_partsplitone on append only columnar table mpp21090_dropcol_addcol_splitpt_dml_timestam_1_prt_partsplitone
NOTICE:  drop cascades to table mpp21090_dropcol_addcol_splitpt_dml_timestamp_1_prt_partthree
NOTICE:  drop cascades to constraint mpp21090_dropcol_addcol_splitpt_dml_timestamp_1_prt_partthree_c on table mpp21090_dropcol_addcol_splitpt_dml_timestamp_1_prt_partthree
NOTICE:  drop cascades to append only table mpp21090_dropcol_addcol_splitpt_dml_timestamp_1_prt_parttwo
NOTICE:  drop cascades to constraint mpp21090_dropcol_addcol_splitpt_dml_timestamp_1_prt_parttwo_che on append only table mpp21090_dropcol_addcol_splitpt_dml_timestamp_1_prt_parttwo
NOTICE:  drop cascades to table mpp21090_dropcol_addcol_splitpt_dml_timestamp
NOTICE:  drop cascades to append only columnar table mpp21090_dropcol_addcol_splitpt_dml_time_1_prt_partsplitwo
NOTICE:  drop cascades to constraint mpp21090_dropcol_addcol_splitpt_dml_time_1_prt_partsplitwo_chec on append only columnar table mpp21090_dropcol_addcol_splitpt_dml_time_1_prt_partsplitwo
NOTICE:  drop cascades to append only columnar table mpp21090_dropcol_addcol_splitpt_dml_time_1_prt_partsplitone
NOTICE:  drop cascades to constraint mpp21090_dropcol_addcol_splitpt_dml_time_1_prt_partsplitone_che on append only columnar table mpp21090_dropcol_addcol_splitpt_dml_time_1_prt_partsplitone
NOTICE:  drop cascades to append only table mpp21090_dropcol_addcol_splitpt_dml_time_1_prt_parttwo
NOTICE:  drop cascades to constraint mpp21090_dropcol_addcol_splitpt_dml_time_1_prt_parttwo_check on append only table mpp21090_dropcol_addcol_splitpt_dml_time_1_prt_parttwo
NOTICE:  drop cascades to table mpp21090_dropcol_addcol_splitpt_dml_time_1_prt_partthree
NOTICE:  drop cascades to constraint mpp21090_dropcol_addcol_splitpt_dml_time_1_prt_partthree_check on table mpp21090_dropcol_addcol_splitpt_dml_time_1_prt_partthree
NOTICE:  drop cascades to table mpp21090_dropcol_addcol_splitpt_dml_time
NOTICE:  drop cascades to append only columnar table mpp21090_dropcol_addcol_splitpt_dml_numeric_1_prt_partsplitwo
NOTICE:  drop cascades to constraint mpp21090_dropcol_addcol_splitpt_dml_numeric_1_prt_partsplitwo_c on append only columnar table mpp21090_dropcol_addcol_splitpt_dml_numeric_1_prt_partsplitwo
NOTICE:  drop cascades to append only columnar table mpp21090_dropcol_addcol_splitpt_dml_numeric_1_prt_partsplitone
NOTICE:  drop cascades to constraint mpp21090_dropcol_addcol_splitpt_dml_numeric_1_prt_partsplitone_ on append only columnar table mpp21090_dropcol_addcol_splitpt_dml_numeric_1_prt_partsplitone
NOTICE:  drop cascades to table mpp21090_dropcol_addcol_splitpt_dml_numeric_1_prt_partthree
NOTICE:  drop cascades to constraint mpp21090_dropcol_addcol_splitpt_dml_numeric_1_prt_partthree_che on table mpp21090_dropcol_addcol_splitpt_dml_numeric_1_prt_partthree
NOTICE:  drop cascades to append only table mpp21090_dropcol_addcol_splitpt_dml_numeric_1_prt_parttwo
NOTICE:  drop cascades to constraint mpp21090_dropcol_addcol_splitpt_dml_numeric_1_prt_parttwo_check on append only table mpp21090_dropcol_addcol_splitpt_dml_numeric_1_prt_parttwo
NOTICE:  drop cascades to table mpp21090_dropcol_addcol_splitpt_dml_numeric
NOTICE:  drop cascades to append only columnar table mpp21090_dropcol_addcol_splitpt_dml_interval_1_prt_partsplitwo
NOTICE:  drop cascades to constraint mpp21090_dropcol_addcol_splitpt_dml_interval_1_prt_partsplitwo_ on append only columnar table mpp21090_dropcol_addcol_splitpt_dml_interval_1_prt_partsplitwo
NOTICE:  drop cascades to append only columnar table mpp21090_dropcol_addcol_splitpt_dml_interval_1_prt_partsplitone
NOTICE:  drop cascades to constraint mpp21090_dropcol_addcol_splitpt_dml_interval_1_prt_partsplitone on append only columnar table mpp21090_dropcol_addcol_splitpt_dml_interval_1_prt_partsplitone
NOTICE:  drop cascades to table mpp21090_dropcol_addcol_splitpt_dml_interval_1_prt_partthree
NOTICE:  drop cascades to constraint mpp21090_dropcol_addcol_splitpt_dml_interval_1_prt_partthree_ch on table mpp21090_dropcol_addcol_splitpt_dml_interval_1_prt_partthree
NOTICE:  drop cascades to append only table mpp21090_dropcol_addcol_splitpt_dml_interval_1_prt_parttwo
NOTICE:  drop cascades to constraint mpp21090_dropcol_addcol_splitpt_dml_interval_1_prt_parttwo_chec on append only table mpp21090_dropcol_addcol_splitpt_dml_interval_1_prt_parttwo
NOTICE:  drop cascades to table mpp21090_dropcol_addcol_splitpt_dml_interval
NOTICE:  drop cascades to append only columnar table mpp21090_dropcol_addcol_splitpt_dml_int8_1_prt_partsplitwo
NOTICE:  drop cascades to constraint mpp21090_dropcol_addcol_splitpt_dml_int8_1_prt_partsplitwo_chec on append only columnar table mpp21090_dropcol_addcol_splitpt_dml_int8_1_prt_partsplitwo
NOTICE:  drop cascades to append only columnar table mpp21090_dropcol_addcol_splitpt_dml_int8_1_prt_partsplitone
NOTICE:  drop cascades to constraint mpp21090_dropcol_addcol_splitpt_dml_int8_1_prt_partsplitone_che on append only columnar table mpp21090_dropcol_addcol_splitpt_dml_int8_1_prt_partsplitone
NOTICE:  drop cascades to table mpp21090_dropcol_addcol_splitpt_dml_int8_1_prt_partthree
NOTICE:  drop cascades to constraint mpp21090_dropcol_addcol_splitpt_dml_int8_1_prt_partthree_check on table mpp21090_dropcol_addcol_splitpt_dml_int8_1_prt_partthree
NOTICE:  drop cascades to append only table mpp21090_dropcol_addcol_splitpt_dml_int8_1_prt_parttwo
NOTICE:  drop cascades to constraint mpp21090_dropcol_addcol_splitpt_dml_int8_1_prt_parttwo_check on append only table mpp21090_dropcol_addcol_splitpt_dml_int8_1_prt_parttwo
NOTICE:  drop cascades to table mpp21090_dropcol_addcol_splitpt_dml_int8
NOTICE:  drop cascades to append only columnar table mpp21090_dropcol_addcol_splitpt_dml_int4_1_prt_partsplitwo
NOTICE:  drop cascades to constraint mpp21090_dropcol_addcol_splitpt_dml_int4_1_prt_partsplitwo_chec on append only columnar table mpp21090_dropcol_addcol_splitpt_dml_int4_1_prt_partsplitwo
NOTICE:  drop cascades to append only columnar table mpp21090_dropcol_addcol_splitpt_dml_int4_1_prt_partsplitone
NOTICE:  drop cascades to constraint mpp21090_dropcol_addcol_splitpt_dml_int4_1_prt_partsplitone_che on append only columnar table mpp21090_dropcol_addcol_splitpt_dml_int4_1_prt_partsplitone
NOTICE:  drop cascades to table mpp21090_dropcol_addcol_splitpt_dml_int4_1_prt_partthree
NOTICE:  drop cascades to constraint mpp21090_dropcol_addcol_splitpt_dml_int4_1_prt_partthree_check on table mpp21090_dropcol_addcol_splitpt_dml_int4_1_prt_partthree
NOTICE:  drop cascades to append only table mpp21090_dropcol_addcol_splitpt_dml_int4_1_prt_parttwo
NOTICE:  drop cascades to constraint mpp21090_dropcol_addcol_splitpt_dml_int4_1_prt_parttwo_check on append only table mpp21090_dropcol_addcol_splitpt_dml_int4_1_prt_parttwo
NOTICE:  drop cascades to table mpp21090_dropcol_addcol_splitpt_dml_int4
NOTICE:  drop cascades to append only columnar table mpp21090_dropcol_addcol_splitpt_dml_int_1_prt_partsplitwo
NOTICE:  drop cascades to constraint mpp21090_dropcol_addcol_splitpt_dml_int_1_prt_partsplitwo_check on append only columnar table mpp21090_dropcol_addcol_splitpt_dml_int_1_prt_partsplitwo
NOTICE:  drop cascades to append only columnar table mpp21090_dropcol_addcol_splitpt_dml_int_1_prt_partsplitone
NOTICE:  drop cascades to constraint mpp21090_dropcol_addcol_splitpt_dml_int_1_prt_partsplitone_chec on append only columnar table mpp21090_dropcol_addcol_splitpt_dml_int_1_prt_partsplitone
NOTICE:  drop cascades to table mpp21090_dropcol_addcol_splitpt_dml_int_1_prt_partthree
NOTICE:  drop cascades to constraint mpp21090_dropcol_addcol_splitpt_dml_int_1_prt_partthree_check on table mpp21090_dropcol_addcol_splitpt_dml_int_1_prt_partthree
NOTICE:  drop cascades to append only table mpp21090_dropcol_addcol_splitpt_dml_int_1_prt_parttwo
NOTICE:  drop cascades to constraint mpp21090_dropcol_addcol_splitpt_dml_int_1_prt_parttwo_check on append only table mpp21090_dropcol_addcol_splitpt_dml_int_1_prt_parttwo
NOTICE:  drop cascades to table mpp21090_dropcol_addcol_splitpt_dml_int
NOTICE:  drop cascades to append only columnar table mpp21090_dropcol_addcol_splitpt_dml_float_1_prt_partsplitwo
NOTICE:  drop cascades to constraint mpp21090_dropcol_addcol_splitpt_dml_float_1_prt_partsplitwo_che on append only columnar table mpp21090_dropcol_addcol_splitpt_dml_float_1_prt_partsplitwo
NOTICE:  drop cascades to append only columnar table mpp21090_dropcol_addcol_splitpt_dml_float_1_prt_partsplitone
NOTICE:  drop cascades to constraint mpp21090_dropcol_addcol_splitpt_dml_float_1_prt_partsplitone_ch on append only columnar table mpp21090_dropcol_addcol_splitpt_dml_float_1_prt_partsplitone
NOTICE:  drop cascades to table mpp21090_dropcol_addcol_splitpt_dml_float_1_prt_partthree
NOTICE:  drop cascades to constraint mpp21090_dropcol_addcol_splitpt_dml_float_1_prt_partthree_check on table mpp21090_dropcol_addcol_splitpt_dml_float_1_prt_partthree
NOTICE:  drop cascades to append only table mpp21090_dropcol_addcol_splitpt_dml_float_1_prt_parttwo
NOTICE:  drop cascades to constraint mpp21090_dropcol_addcol_splitpt_dml_float_1_prt_parttwo_check on append only table mpp21090_dropcol_addcol_splitpt_dml_float_1_prt_parttwo
NOTICE:  drop cascades to table mpp21090_dropcol_addcol_splitpt_dml_float
NOTICE:  drop cascades to append only columnar table mpp21090_dropcol_addcol_splitpt_dml_decimal_1_prt_partsplitwo
NOTICE:  drop cascades to constraint mpp21090_dropcol_addcol_splitpt_dml_decimal_1_prt_partsplitwo_c on append only columnar table mpp21090_dropcol_addcol_splitpt_dml_decimal_1_prt_partsplitwo
NOTICE:  drop cascades to append only columnar table mpp21090_dropcol_addcol_splitpt_dml_decimal_1_prt_partsplitone
NOTICE:  drop cascades to constraint mpp21090_dropcol_addcol_splitpt_dml_decimal_1_prt_partsplitone_ on append only columnar table mpp21090_dropcol_addcol_splitpt_dml_decimal_1_prt_partsplitone
NOTICE:  drop cascades to table mpp21090_dropcol_addcol_splitpt_dml_decimal_1_prt_partthree
NOTICE:  drop cascades to constraint mpp21090_dropcol_addcol_splitpt_dml_decimal_1_prt_partthree_che on table mpp21090_dropcol_addcol_splitpt_dml_decimal_1_prt_partthree
NOTICE:  drop cascades to append only table mpp21090_dropcol_addcol_splitpt_dml_decimal_1_prt_parttwo
NOTICE:  drop cascades to constraint mpp21090_dropcol_addcol_splitpt_dml_decimal_1_prt_parttwo_check on append only table mpp21090_dropcol_addcol_splitpt_dml_decimal_1_prt_parttwo
NOTICE:  drop cascades to table mpp21090_dropcol_addcol_splitpt_dml_decimal
-- end_ignore
