-- start_ignore
create schema sql_partition_501_521;
set search_path to sql_partition_501_521;
-- end_ignore
-- @author prabhd 
-- @created 2014-04-01 12:00:00
-- @modified 2012-04-01 12:00:00
-- @tags dml MPP-21090 ORCA
-- @optimizer_mode on	
-- @description Tests for MPP-21090
\echo --start_ignore
--start_ignore
\echo --end_ignore
--end_ignore
DROP TABLE IF EXISTS mpp21090_xchange_pttab_dropcol_dml_float;
NOTICE:  table "mpp21090_xchange_pttab_dropcol_dml_float" does not exist, skipping
CREATE TABLE mpp21090_xchange_pttab_dropcol_dml_float
(
    col1 float,
    col2 float,
    col3 char,
    col4 int,
    col5 float
) 
DISTRIBUTED by (col1)
PARTITION BY RANGE(col2)(partition partone start(1.00) end(10.00)  WITH (APPENDONLY=true, COMPRESSLEVEL=5, ORIENTATION=column),partition parttwo start(10.00) end(20.00) WITH (APPENDONLY=true, COMPRESSLEVEL=5, ORIENTATION=row),partition partthree start(20.00) end(30.00));
NOTICE:  CREATE TABLE will create partition "mpp21090_xchange_pttab_dropcol_dml_float_1_prt_partone" for table "mpp21090_xchange_pttab_dropcol_dml_float"
NOTICE:  CREATE TABLE will create partition "mpp21090_xchange_pttab_dropcol_dml_float_1_prt_parttwo" for table "mpp21090_xchange_pttab_dropcol_dml_float"
NOTICE:  CREATE TABLE will create partition "mpp21090_xchange_pttab_dropcol_dml_float_1_prt_partthree" for table "mpp21090_xchange_pttab_dropcol_dml_float"
INSERT INTO mpp21090_xchange_pttab_dropcol_dml_float VALUES(2.00,2.00,'a',0, 2.00);
SELECT * FROM mpp21090_xchange_pttab_dropcol_dml_float ORDER BY 1,2,3,4;
 col1 | col2 | col3 | col4 | col5 
------+------+------+------+------
    2 |    2 | a    |    0 |    2
(1 row)

ALTER TABLE mpp21090_xchange_pttab_dropcol_dml_float DROP COLUMN col1;
NOTICE:  Dropping a column that is part of the distribution policy forces a NULL distribution policy
NOTICE:  Dropping a column that is part of the distribution policy forces a NULL distribution policy
NOTICE:  Dropping a column that is part of the distribution policy forces a NULL distribution policy
NOTICE:  Dropping a column that is part of the distribution policy forces a NULL distribution policy
-- Create Candidate table for Exchange
DROP TABLE IF EXISTS mpp21090_xchange_pttab_dropcol_dml_float_candidate;
NOTICE:  table "mpp21090_xchange_pttab_dropcol_dml_float_candidate" does not exist, skipping
CREATE TABLE mpp21090_xchange_pttab_dropcol_dml_float_candidate( like mpp21090_xchange_pttab_dropcol_dml_float) distributed randomly;
INSERT INTO mpp21090_xchange_pttab_dropcol_dml_float_candidate VALUES(2.00,'z',1,2.00);
-- Exchange 
ALTER TABLE mpp21090_xchange_pttab_dropcol_dml_float EXCHANGE PARTITION FOR(5.00) WITH TABLE mpp21090_xchange_pttab_dropcol_dml_float_candidate;
NOTICE:  exchanged partition "partone" of relation "mpp21090_xchange_pttab_dropcol_dml_float" with relation "mpp21090_xchange_pttab_dropcol_dml_float_candidate"
SELECT * FROM mpp21090_xchange_pttab_dropcol_dml_float ORDER BY 1,2,3;
 col2 | col3 | col4 | col5 
------+------+------+------
    2 | z    |    1 |    2
(1 row)

SELECT * FROM mpp21090_xchange_pttab_dropcol_dml_float_candidate ORDER BY 1,2,3;
 col2 | col3 | col4 | col5 
------+------+------+------
    2 | a    |    0 |    2
(1 row)

-- DML on partition table
INSERT INTO mpp21090_xchange_pttab_dropcol_dml_float SELECT  1.00,'b', 1, 1.00;
SELECT * FROM mpp21090_xchange_pttab_dropcol_dml_float ORDER BY 1,2,3;
 col2 | col3 | col4 | col5 
------+------+------+------
    1 | b    |    1 |    1
    2 | z    |    1 |    2
(2 rows)

UPDATE mpp21090_xchange_pttab_dropcol_dml_float SET col5 = 35.00 WHERE col2 = 1.00 AND col5 = 1.00;
SELECT * FROM mpp21090_xchange_pttab_dropcol_dml_float ORDER BY 1,2,3;
 col2 | col3 | col4 | col5 
------+------+------+------
    1 | b    |    1 |   35
    2 | z    |    1 |    2
(2 rows)

UPDATE mpp21090_xchange_pttab_dropcol_dml_float SET col2 =2.00 WHERE col3='b';
SELECT * FROM mpp21090_xchange_pttab_dropcol_dml_float ORDER BY 1,2,3;
 col2 | col3 | col4 | col5 
------+------+------+------
    2 | b    |    1 |   35
    2 | z    |    1 |    2
(2 rows)

DELETE FROM mpp21090_xchange_pttab_dropcol_dml_float WHERE col3='b';
SELECT * FROM mpp21090_xchange_pttab_dropcol_dml_float ORDER BY 1,2,3;
 col2 | col3 | col4 | col5 
------+------+------+------
    2 | z    |    1 |    2
(1 row)

-- DML on candidate table
INSERT INTO mpp21090_xchange_pttab_dropcol_dml_float_candidate SELECT 1.00,'b', 1, 1.00;
SELECT * FROM mpp21090_xchange_pttab_dropcol_dml_float_candidate ORDER BY 1,2,3;
 col2 | col3 | col4 | col5 
------+------+------+------
    1 | b    |    1 |    1
    2 | a    |    0 |    2
(2 rows)

UPDATE mpp21090_xchange_pttab_dropcol_dml_float_candidate SET col2=2.00 WHERE col3='a';
SELECT * FROM mpp21090_xchange_pttab_dropcol_dml_float_candidate ORDER BY 1,2,3;
 col2 | col3 | col4 | col5 
------+------+------+------
    1 | b    |    1 |    1
    2 | a    |    0 |    2
(2 rows)

DELETE FROM mpp21090_xchange_pttab_dropcol_dml_float_candidate WHERE col3='a';
SELECT * FROM mpp21090_xchange_pttab_dropcol_dml_float_candidate ORDER BY 1,2,3;
 col2 | col3 | col4 | col5 
------+------+------+------
    1 | b    |    1 |    1
(1 row)

-- @author prabhd 
-- @created 2014-04-01 12:00:00
-- @modified 2012-04-01 12:00:00
-- @tags dml MPP-21090 ORCA
-- @optimizer_mode on	
-- @description Tests for MPP-21090
\echo --start_ignore
--start_ignore
\echo --end_ignore
--end_ignore
DROP TABLE IF EXISTS mpp21090_xchange_pttab_dropcol_dml_int;
NOTICE:  table "mpp21090_xchange_pttab_dropcol_dml_int" does not exist, skipping
CREATE TABLE mpp21090_xchange_pttab_dropcol_dml_int
(
    col1 int,
    col2 int,
    col3 char,
    col4 int,
    col5 int
) 
DISTRIBUTED by (col1)
PARTITION BY RANGE(col2)(partition partone start(1) end(10001) WITH (APPENDONLY=true, COMPRESSLEVEL=5, ORIENTATION=column),partition parttwo start(10001) end(20001) WITH (APPENDONLY=true, COMPRESSLEVEL=5, ORIENTATION=row),partition partthree start(20001) end(30001));
NOTICE:  CREATE TABLE will create partition "mpp21090_xchange_pttab_dropcol_dml_int_1_prt_partone" for table "mpp21090_xchange_pttab_dropcol_dml_int"
NOTICE:  CREATE TABLE will create partition "mpp21090_xchange_pttab_dropcol_dml_int_1_prt_parttwo" for table "mpp21090_xchange_pttab_dropcol_dml_int"
NOTICE:  CREATE TABLE will create partition "mpp21090_xchange_pttab_dropcol_dml_int_1_prt_partthree" for table "mpp21090_xchange_pttab_dropcol_dml_int"
INSERT INTO mpp21090_xchange_pttab_dropcol_dml_int VALUES(20000,20000,'a',0, 20000);
SELECT * FROM mpp21090_xchange_pttab_dropcol_dml_int ORDER BY 1,2,3,4;
 col1  | col2  | col3 | col4 | col5  
-------+-------+------+------+-------
 20000 | 20000 | a    |    0 | 20000
(1 row)

ALTER TABLE mpp21090_xchange_pttab_dropcol_dml_int DROP COLUMN col1;
NOTICE:  Dropping a column that is part of the distribution policy forces a NULL distribution policy
NOTICE:  Dropping a column that is part of the distribution policy forces a NULL distribution policy
NOTICE:  Dropping a column that is part of the distribution policy forces a NULL distribution policy
NOTICE:  Dropping a column that is part of the distribution policy forces a NULL distribution policy
-- Create Candidate table for Exchange
DROP TABLE IF EXISTS mpp21090_xchange_pttab_dropcol_dml_int_candidate;
NOTICE:  table "mpp21090_xchange_pttab_dropcol_dml_int_candidate" does not exist, skipping
CREATE TABLE mpp21090_xchange_pttab_dropcol_dml_int_candidate( like mpp21090_xchange_pttab_dropcol_dml_int) distributed randomly;
INSERT INTO mpp21090_xchange_pttab_dropcol_dml_int_candidate VALUES(5000,'z',1,5000);
-- Exchange 
ALTER TABLE mpp21090_xchange_pttab_dropcol_dml_int EXCHANGE PARTITION FOR(5000) WITH TABLE mpp21090_xchange_pttab_dropcol_dml_int_candidate;
NOTICE:  exchanged partition "partone" of relation "mpp21090_xchange_pttab_dropcol_dml_int" with relation "mpp21090_xchange_pttab_dropcol_dml_int_candidate"
SELECT * FROM mpp21090_xchange_pttab_dropcol_dml_int ORDER BY 1,2,3;
 col2  | col3 | col4 | col5  
-------+------+------+-------
  5000 | z    |    1 |  5000
 20000 | a    |    0 | 20000
(2 rows)

SELECT * FROM mpp21090_xchange_pttab_dropcol_dml_int_candidate ORDER BY 1,2,3;
 col2 | col3 | col4 | col5 
------+------+------+------
(0 rows)

-- DML on partition table
INSERT INTO mpp21090_xchange_pttab_dropcol_dml_int SELECT  1000,'b', 1, 1000;
SELECT * FROM mpp21090_xchange_pttab_dropcol_dml_int ORDER BY 1,2,3;
 col2  | col3 | col4 | col5  
-------+------+------+-------
  1000 | b    |    1 |  1000
  5000 | z    |    1 |  5000
 20000 | a    |    0 | 20000
(3 rows)

UPDATE mpp21090_xchange_pttab_dropcol_dml_int SET col5 = 35000 WHERE col2 = 1000 AND col5 = 1000;
SELECT * FROM mpp21090_xchange_pttab_dropcol_dml_int ORDER BY 1,2,3;
 col2  | col3 | col4 | col5  
-------+------+------+-------
  1000 | b    |    1 | 35000
  5000 | z    |    1 |  5000
 20000 | a    |    0 | 20000
(3 rows)

UPDATE mpp21090_xchange_pttab_dropcol_dml_int SET col2 =20000 WHERE col3='b';
SELECT * FROM mpp21090_xchange_pttab_dropcol_dml_int ORDER BY 1,2,3;
 col2  | col3 | col4 | col5  
-------+------+------+-------
  5000 | z    |    1 |  5000
 20000 | a    |    0 | 20000
 20000 | b    |    1 | 35000
(3 rows)

DELETE FROM mpp21090_xchange_pttab_dropcol_dml_int WHERE col3='b';
SELECT * FROM mpp21090_xchange_pttab_dropcol_dml_int ORDER BY 1,2,3;
 col2  | col3 | col4 | col5  
-------+------+------+-------
  5000 | z    |    1 |  5000
 20000 | a    |    0 | 20000
(2 rows)

-- DML on candidate table
INSERT INTO mpp21090_xchange_pttab_dropcol_dml_int_candidate SELECT 1000,'b', 1, 1000;
SELECT * FROM mpp21090_xchange_pttab_dropcol_dml_int_candidate ORDER BY 1,2,3;
 col2 | col3 | col4 | col5 
------+------+------+------
 1000 | b    |    1 | 1000
(1 row)

UPDATE mpp21090_xchange_pttab_dropcol_dml_int_candidate SET col2=2000 WHERE col3='b';
SELECT * FROM mpp21090_xchange_pttab_dropcol_dml_int_candidate ORDER BY 1,2,3;
 col2 | col3 | col4 | col5 
------+------+------+------
 2000 | b    |    1 | 1000
(1 row)

DELETE FROM mpp21090_xchange_pttab_dropcol_dml_int_candidate WHERE col3='b';
SELECT * FROM mpp21090_xchange_pttab_dropcol_dml_int_candidate ORDER BY 1,2,3;
 col2 | col3 | col4 | col5 
------+------+------+------
(0 rows)

-- @author prabhd 
-- @created 2014-04-01 12:00:00
-- @modified 2012-04-01 12:00:00
-- @tags dml MPP-21090 ORCA
-- @optimizer_mode on	
-- @description Tests for MPP-21090
\echo --start_ignore
--start_ignore
\echo --end_ignore
--end_ignore
DROP TABLE IF EXISTS mpp21090_xchange_pttab_dropcol_dml_int4;
NOTICE:  table "mpp21090_xchange_pttab_dropcol_dml_int4" does not exist, skipping
CREATE TABLE mpp21090_xchange_pttab_dropcol_dml_int4
(
    col1 int4,
    col2 int4,
    col3 char,
    col4 int,
    col5 int4
) 
DISTRIBUTED by (col1)
PARTITION BY RANGE(col2)(partition partone start(1) end(100000001)  WITH (APPENDONLY=true, COMPRESSLEVEL=5, ORIENTATION=column),partition parttwo start(100000001) end(200000001) WITH (APPENDONLY=true, COMPRESSLEVEL=5, ORIENTATION=row),partition partthree start(200000001) end(300000001));
NOTICE:  CREATE TABLE will create partition "mpp21090_xchange_pttab_dropcol_dml_int4_1_prt_partone" for table "mpp21090_xchange_pttab_dropcol_dml_int4"
NOTICE:  CREATE TABLE will create partition "mpp21090_xchange_pttab_dropcol_dml_int4_1_prt_parttwo" for table "mpp21090_xchange_pttab_dropcol_dml_int4"
NOTICE:  CREATE TABLE will create partition "mpp21090_xchange_pttab_dropcol_dml_int4_1_prt_partthree" for table "mpp21090_xchange_pttab_dropcol_dml_int4"
INSERT INTO mpp21090_xchange_pttab_dropcol_dml_int4 VALUES(20000000,20000000,'a',0, 20000000);
SELECT * FROM mpp21090_xchange_pttab_dropcol_dml_int4 ORDER BY 1,2,3,4;
   col1   |   col2   | col3 | col4 |   col5   
----------+----------+------+------+----------
 20000000 | 20000000 | a    |    0 | 20000000
(1 row)

ALTER TABLE mpp21090_xchange_pttab_dropcol_dml_int4 DROP COLUMN col1;
NOTICE:  Dropping a column that is part of the distribution policy forces a NULL distribution policy
NOTICE:  Dropping a column that is part of the distribution policy forces a NULL distribution policy
NOTICE:  Dropping a column that is part of the distribution policy forces a NULL distribution policy
NOTICE:  Dropping a column that is part of the distribution policy forces a NULL distribution policy
-- Create Candidate table for Exchange
DROP TABLE IF EXISTS mpp21090_xchange_pttab_dropcol_dml_int4_candidate;
NOTICE:  table "mpp21090_xchange_pttab_dropcol_dml_int4_candidate" does not exist, skipping
CREATE TABLE mpp21090_xchange_pttab_dropcol_dml_int4_candidate( like mpp21090_xchange_pttab_dropcol_dml_int4) distributed randomly;
INSERT INTO mpp21090_xchange_pttab_dropcol_dml_int4_candidate VALUES(20000000,'z',1,20000000);
-- Exchange 
ALTER TABLE mpp21090_xchange_pttab_dropcol_dml_int4 EXCHANGE PARTITION FOR(50000000) WITH TABLE mpp21090_xchange_pttab_dropcol_dml_int4_candidate;
NOTICE:  exchanged partition "partone" of relation "mpp21090_xchange_pttab_dropcol_dml_int4" with relation "mpp21090_xchange_pttab_dropcol_dml_int4_candidate"
SELECT * FROM mpp21090_xchange_pttab_dropcol_dml_int4 ORDER BY 1,2,3;
   col2   | col3 | col4 |   col5   
----------+------+------+----------
 20000000 | z    |    1 | 20000000
(1 row)

SELECT * FROM mpp21090_xchange_pttab_dropcol_dml_int4_candidate ORDER BY 1,2,3;
   col2   | col3 | col4 |   col5   
----------+------+------+----------
 20000000 | a    |    0 | 20000000
(1 row)

-- DML on partition table
INSERT INTO mpp21090_xchange_pttab_dropcol_dml_int4 SELECT  10000000,'b', 1, 10000000;
SELECT * FROM mpp21090_xchange_pttab_dropcol_dml_int4 ORDER BY 1,2,3;
   col2   | col3 | col4 |   col5   
----------+------+------+----------
 10000000 | b    |    1 | 10000000
 20000000 | z    |    1 | 20000000
(2 rows)

UPDATE mpp21090_xchange_pttab_dropcol_dml_int4 SET col5 = 350000000 WHERE col2 = 10000000 AND col5 = 10000000;
SELECT * FROM mpp21090_xchange_pttab_dropcol_dml_int4 ORDER BY 1,2,3;
   col2   | col3 | col4 |   col5    
----------+------+------+-----------
 10000000 | b    |    1 | 350000000
 20000000 | z    |    1 |  20000000
(2 rows)

UPDATE mpp21090_xchange_pttab_dropcol_dml_int4 SET col2 =20000000 WHERE col3='b';
SELECT * FROM mpp21090_xchange_pttab_dropcol_dml_int4 ORDER BY 1,2,3;
   col2   | col3 | col4 |   col5    
----------+------+------+-----------
 20000000 | b    |    1 | 350000000
 20000000 | z    |    1 |  20000000
(2 rows)

DELETE FROM mpp21090_xchange_pttab_dropcol_dml_int4 WHERE col3='b';
SELECT * FROM mpp21090_xchange_pttab_dropcol_dml_int4 ORDER BY 1,2,3;
   col2   | col3 | col4 |   col5   
----------+------+------+----------
 20000000 | z    |    1 | 20000000
(1 row)

-- DML on candidate table
INSERT INTO mpp21090_xchange_pttab_dropcol_dml_int4_candidate SELECT 10000000,'b', 1, 10000000;
SELECT * FROM mpp21090_xchange_pttab_dropcol_dml_int4_candidate ORDER BY 1,2,3;
   col2   | col3 | col4 |   col5   
----------+------+------+----------
 10000000 | b    |    1 | 10000000
 20000000 | a    |    0 | 20000000
(2 rows)

UPDATE mpp21090_xchange_pttab_dropcol_dml_int4_candidate SET col2=20000000 WHERE col3='a';
SELECT * FROM mpp21090_xchange_pttab_dropcol_dml_int4_candidate ORDER BY 1,2,3;
   col2   | col3 | col4 |   col5   
----------+------+------+----------
 10000000 | b    |    1 | 10000000
 20000000 | a    |    0 | 20000000
(2 rows)

DELETE FROM mpp21090_xchange_pttab_dropcol_dml_int4_candidate WHERE col3='a';
SELECT * FROM mpp21090_xchange_pttab_dropcol_dml_int4_candidate ORDER BY 1,2,3;
   col2   | col3 | col4 |   col5   
----------+------+------+----------
 10000000 | b    |    1 | 10000000
(1 row)

-- @author prabhd 
-- @created 2014-04-01 12:00:00
-- @modified 2012-04-01 12:00:00
-- @tags dml MPP-21090 ORCA
-- @optimizer_mode on	
-- @description Tests for MPP-21090
\echo --start_ignore
--start_ignore
\echo --end_ignore
--end_ignore
DROP TABLE IF EXISTS mpp21090_xchange_pttab_dropcol_dml_int8;
NOTICE:  table "mpp21090_xchange_pttab_dropcol_dml_int8" does not exist, skipping
CREATE TABLE mpp21090_xchange_pttab_dropcol_dml_int8
(
    col1 int8,
    col2 int8,
    col3 char,
    col4 int,
    col5 int8
) 
DISTRIBUTED by (col1)
PARTITION BY RANGE(col2)(partition partone start(1) end(1000000000000000001)  WITH (APPENDONLY=true, COMPRESSLEVEL=5, ORIENTATION=column),partition parttwo start(1000000000000000001) end(2000000000000000001) WITH (APPENDONLY=true, COMPRESSLEVEL=5, ORIENTATION=row),partition partthree start(2000000000000000001) end(3000000000000000001));
NOTICE:  CREATE TABLE will create partition "mpp21090_xchange_pttab_dropcol_dml_int8_1_prt_partone" for table "mpp21090_xchange_pttab_dropcol_dml_int8"
NOTICE:  CREATE TABLE will create partition "mpp21090_xchange_pttab_dropcol_dml_int8_1_prt_parttwo" for table "mpp21090_xchange_pttab_dropcol_dml_int8"
NOTICE:  CREATE TABLE will create partition "mpp21090_xchange_pttab_dropcol_dml_int8_1_prt_partthree" for table "mpp21090_xchange_pttab_dropcol_dml_int8"
INSERT INTO mpp21090_xchange_pttab_dropcol_dml_int8 VALUES(200000000000000000,200000000000000000,'a',0, 200000000000000000);
SELECT * FROM mpp21090_xchange_pttab_dropcol_dml_int8 ORDER BY 1,2,3,4;
        col1        |        col2        | col3 | col4 |        col5        
--------------------+--------------------+------+------+--------------------
 200000000000000000 | 200000000000000000 | a    |    0 | 200000000000000000
(1 row)

ALTER TABLE mpp21090_xchange_pttab_dropcol_dml_int8 DROP COLUMN col1;
NOTICE:  Dropping a column that is part of the distribution policy forces a NULL distribution policy
NOTICE:  Dropping a column that is part of the distribution policy forces a NULL distribution policy
NOTICE:  Dropping a column that is part of the distribution policy forces a NULL distribution policy
NOTICE:  Dropping a column that is part of the distribution policy forces a NULL distribution policy
-- Create Candidate table for Exchange
DROP TABLE IF EXISTS mpp21090_xchange_pttab_dropcol_dml_int8_candidate;
NOTICE:  table "mpp21090_xchange_pttab_dropcol_dml_int8_candidate" does not exist, skipping
CREATE TABLE mpp21090_xchange_pttab_dropcol_dml_int8_candidate( like mpp21090_xchange_pttab_dropcol_dml_int8) distributed randomly;
INSERT INTO mpp21090_xchange_pttab_dropcol_dml_int8_candidate VALUES(200000000000000000,'z',1,200000000000000000);
-- Exchange 
ALTER TABLE mpp21090_xchange_pttab_dropcol_dml_int8 EXCHANGE PARTITION FOR(500000000000000000) WITH TABLE mpp21090_xchange_pttab_dropcol_dml_int8_candidate;
NOTICE:  exchanged partition "partone" of relation "mpp21090_xchange_pttab_dropcol_dml_int8" with relation "mpp21090_xchange_pttab_dropcol_dml_int8_candidate"
SELECT * FROM mpp21090_xchange_pttab_dropcol_dml_int8 ORDER BY 1,2,3;
        col2        | col3 | col4 |        col5        
--------------------+------+------+--------------------
 200000000000000000 | z    |    1 | 200000000000000000
(1 row)

SELECT * FROM mpp21090_xchange_pttab_dropcol_dml_int8_candidate ORDER BY 1,2,3;
        col2        | col3 | col4 |        col5        
--------------------+------+------+--------------------
 200000000000000000 | a    |    0 | 200000000000000000
(1 row)

-- DML on partition table
INSERT INTO mpp21090_xchange_pttab_dropcol_dml_int8 SELECT  100000000000000000,'b', 1, 100000000000000000;
SELECT * FROM mpp21090_xchange_pttab_dropcol_dml_int8 ORDER BY 1,2,3;
        col2        | col3 | col4 |        col5        
--------------------+------+------+--------------------
 100000000000000000 | b    |    1 | 100000000000000000
 200000000000000000 | z    |    1 | 200000000000000000
(2 rows)

UPDATE mpp21090_xchange_pttab_dropcol_dml_int8 SET col5 = 3500000000000000000 WHERE col2 = 100000000000000000 AND col5 = 100000000000000000;
SELECT * FROM mpp21090_xchange_pttab_dropcol_dml_int8 ORDER BY 1,2,3;
        col2        | col3 | col4 |        col5         
--------------------+------+------+---------------------
 100000000000000000 | b    |    1 | 3500000000000000000
 200000000000000000 | z    |    1 |  200000000000000000
(2 rows)

UPDATE mpp21090_xchange_pttab_dropcol_dml_int8 SET col2 =200000000000000000 WHERE col3='b';
SELECT * FROM mpp21090_xchange_pttab_dropcol_dml_int8 ORDER BY 1,2,3;
        col2        | col3 | col4 |        col5         
--------------------+------+------+---------------------
 200000000000000000 | b    |    1 | 3500000000000000000
 200000000000000000 | z    |    1 |  200000000000000000
(2 rows)

DELETE FROM mpp21090_xchange_pttab_dropcol_dml_int8 WHERE col3='b';
SELECT * FROM mpp21090_xchange_pttab_dropcol_dml_int8 ORDER BY 1,2,3;
        col2        | col3 | col4 |        col5        
--------------------+------+------+--------------------
 200000000000000000 | z    |    1 | 200000000000000000
(1 row)

-- DML on candidate table
INSERT INTO mpp21090_xchange_pttab_dropcol_dml_int8_candidate SELECT 100000000000000000,'b', 1, 100000000000000000;
SELECT * FROM mpp21090_xchange_pttab_dropcol_dml_int8_candidate ORDER BY 1,2,3;
        col2        | col3 | col4 |        col5        
--------------------+------+------+--------------------
 100000000000000000 | b    |    1 | 100000000000000000
 200000000000000000 | a    |    0 | 200000000000000000
(2 rows)

UPDATE mpp21090_xchange_pttab_dropcol_dml_int8_candidate SET col2=200000000000000000 WHERE col3='a';
SELECT * FROM mpp21090_xchange_pttab_dropcol_dml_int8_candidate ORDER BY 1,2,3;
        col2        | col3 | col4 |        col5        
--------------------+------+------+--------------------
 100000000000000000 | b    |    1 | 100000000000000000
 200000000000000000 | a    |    0 | 200000000000000000
(2 rows)

DELETE FROM mpp21090_xchange_pttab_dropcol_dml_int8_candidate WHERE col3='a';
SELECT * FROM mpp21090_xchange_pttab_dropcol_dml_int8_candidate ORDER BY 1,2,3;
        col2        | col3 | col4 |        col5        
--------------------+------+------+--------------------
 100000000000000000 | b    |    1 | 100000000000000000
(1 row)

-- @author prabhd 
-- @created 2014-04-01 12:00:00
-- @modified 2012-04-01 12:00:00
-- @tags dml MPP-21090 ORCA
-- @optimizer_mode on	
-- @description Tests for MPP-21090
\echo --start_ignore
--start_ignore
\echo --end_ignore
--end_ignore
DROP TABLE IF EXISTS mpp21090_xchange_pttab_dropcol_dml_interval;
NOTICE:  table "mpp21090_xchange_pttab_dropcol_dml_interval" does not exist, skipping
CREATE TABLE mpp21090_xchange_pttab_dropcol_dml_interval
(
    col1 interval,
    col2 interval,
    col3 char,
    col4 int,
    col5 interval
) 
DISTRIBUTED by (col1)
PARTITION BY RANGE(col2)(partition partone start('1 sec') end('1 min')  WITH (APPENDONLY=true, COMPRESSLEVEL=5, ORIENTATION=column),partition parttwo start('1 min') end('1 hour') WITH (APPENDONLY=true, COMPRESSLEVEL=5, ORIENTATION=row),partition partthree start('1 hour') end('12 hours'));
NOTICE:  CREATE TABLE will create partition "mpp21090_xchange_pttab_dropcol_dml_interval_1_prt_partone" for table "mpp21090_xchange_pttab_dropcol_dml_interval"
NOTICE:  CREATE TABLE will create partition "mpp21090_xchange_pttab_dropcol_dml_interval_1_prt_parttwo" for table "mpp21090_xchange_pttab_dropcol_dml_interval"
NOTICE:  CREATE TABLE will create partition "mpp21090_xchange_pttab_dropcol_dml_interval_1_prt_partthree" for table "mpp21090_xchange_pttab_dropcol_dml_interval"
INSERT INTO mpp21090_xchange_pttab_dropcol_dml_interval VALUES('10 secs','10 secs','a',0, '10 secs');
SELECT * FROM mpp21090_xchange_pttab_dropcol_dml_interval ORDER BY 1,2,3,4;
   col1    |   col2    | col3 | col4 |   col5    
-----------+-----------+------+------+-----------
 @ 10 secs | @ 10 secs | a    |    0 | @ 10 secs
(1 row)

ALTER TABLE mpp21090_xchange_pttab_dropcol_dml_interval DROP COLUMN col1;
NOTICE:  Dropping a column that is part of the distribution policy forces a NULL distribution policy
NOTICE:  Dropping a column that is part of the distribution policy forces a NULL distribution policy
NOTICE:  Dropping a column that is part of the distribution policy forces a NULL distribution policy
NOTICE:  Dropping a column that is part of the distribution policy forces a NULL distribution policy
-- Create Candidate table for Exchange
DROP TABLE IF EXISTS mpp21090_xchange_pttab_dropcol_dml_interval_candidate;
NOTICE:  table "mpp21090_xchange_pttab_dropcol_dml_interval_candidate" does not exist, skipping
CREATE TABLE mpp21090_xchange_pttab_dropcol_dml_interval_candidate( like mpp21090_xchange_pttab_dropcol_dml_interval) distributed randomly;
INSERT INTO mpp21090_xchange_pttab_dropcol_dml_interval_candidate VALUES('10 secs','z',1,'10 secs');
-- Exchange 
ALTER TABLE mpp21090_xchange_pttab_dropcol_dml_interval EXCHANGE PARTITION FOR('30 secs') WITH TABLE mpp21090_xchange_pttab_dropcol_dml_interval_candidate;
NOTICE:  exchanged partition "partone" of relation "mpp21090_xchange_pttab_dropcol_dml_interval" with relation "mpp21090_xchange_pttab_dropcol_dml_interval_candidate"
SELECT * FROM mpp21090_xchange_pttab_dropcol_dml_interval ORDER BY 1,2,3;
   col2    | col3 | col4 |   col5    
-----------+------+------+-----------
 @ 10 secs | z    |    1 | @ 10 secs
(1 row)

SELECT * FROM mpp21090_xchange_pttab_dropcol_dml_interval_candidate ORDER BY 1,2,3;
   col2    | col3 | col4 |   col5    
-----------+------+------+-----------
 @ 10 secs | a    |    0 | @ 10 secs
(1 row)

-- DML on partition table
INSERT INTO mpp21090_xchange_pttab_dropcol_dml_interval SELECT  '1 sec','b', 1, '1 sec';
SELECT * FROM mpp21090_xchange_pttab_dropcol_dml_interval ORDER BY 1,2,3;
   col2    | col3 | col4 |   col5    
-----------+------+------+-----------
 @ 1 sec   | b    |    1 | @ 1 sec
 @ 10 secs | z    |    1 | @ 10 secs
(2 rows)

UPDATE mpp21090_xchange_pttab_dropcol_dml_interval SET col5 = '14 hours' WHERE col2 = '1 sec' AND col5 = '1 sec';
SELECT * FROM mpp21090_xchange_pttab_dropcol_dml_interval ORDER BY 1,2,3;
   col2    | col3 | col4 |    col5    
-----------+------+------+------------
 @ 1 sec   | b    |    1 | @ 14 hours
 @ 10 secs | z    |    1 | @ 10 secs
(2 rows)

UPDATE mpp21090_xchange_pttab_dropcol_dml_interval SET col2 ='10 secs' WHERE col3='b';
SELECT * FROM mpp21090_xchange_pttab_dropcol_dml_interval ORDER BY 1,2,3;
   col2    | col3 | col4 |    col5    
-----------+------+------+------------
 @ 10 secs | b    |    1 | @ 14 hours
 @ 10 secs | z    |    1 | @ 10 secs
(2 rows)

DELETE FROM mpp21090_xchange_pttab_dropcol_dml_interval WHERE col3='b';
SELECT * FROM mpp21090_xchange_pttab_dropcol_dml_interval ORDER BY 1,2,3;
   col2    | col3 | col4 |   col5    
-----------+------+------+-----------
 @ 10 secs | z    |    1 | @ 10 secs
(1 row)

-- DML on candidate table
INSERT INTO mpp21090_xchange_pttab_dropcol_dml_interval_candidate SELECT '1 sec','b', 1, '1 sec';
SELECT * FROM mpp21090_xchange_pttab_dropcol_dml_interval_candidate ORDER BY 1,2,3;
   col2    | col3 | col4 |   col5    
-----------+------+------+-----------
 @ 1 sec   | b    |    1 | @ 1 sec
 @ 10 secs | a    |    0 | @ 10 secs
(2 rows)

UPDATE mpp21090_xchange_pttab_dropcol_dml_interval_candidate SET col2='10 secs' WHERE col3='a';
SELECT * FROM mpp21090_xchange_pttab_dropcol_dml_interval_candidate ORDER BY 1,2,3;
   col2    | col3 | col4 |   col5    
-----------+------+------+-----------
 @ 1 sec   | b    |    1 | @ 1 sec
 @ 10 secs | a    |    0 | @ 10 secs
(2 rows)

DELETE FROM mpp21090_xchange_pttab_dropcol_dml_interval_candidate WHERE col3='a';
SELECT * FROM mpp21090_xchange_pttab_dropcol_dml_interval_candidate ORDER BY 1,2,3;
  col2   | col3 | col4 |  col5   
---------+------+------+---------
 @ 1 sec | b    |    1 | @ 1 sec
(1 row)

-- @author prabhd 
-- @created 2014-04-01 12:00:00
-- @modified 2012-04-01 12:00:00
-- @tags dml MPP-21090 ORCA
-- @optimizer_mode on	
-- @description Tests for MPP-21090
\echo --start_ignore
--start_ignore
\echo --end_ignore
--end_ignore
DROP TABLE IF EXISTS mpp21090_xchange_pttab_dropcol_dml_numeric;
NOTICE:  table "mpp21090_xchange_pttab_dropcol_dml_numeric" does not exist, skipping
CREATE TABLE mpp21090_xchange_pttab_dropcol_dml_numeric
(
    col1 numeric,
    col2 numeric,
    col3 char,
    col4 int,
    col5 numeric
) 
DISTRIBUTED by (col1)
PARTITION BY RANGE(col2)(partition partone start(1.000000) end(10.000000)  WITH (APPENDONLY=true, COMPRESSLEVEL=5, ORIENTATION=column),partition parttwo start(10.000000) end(20.000000) WITH (APPENDONLY=true, COMPRESSLEVEL=5, ORIENTATION=row),partition partthree start(20.000000) end(30.000000));
NOTICE:  CREATE TABLE will create partition "mpp21090_xchange_pttab_dropcol_dml_numeric_1_prt_partone" for table "mpp21090_xchange_pttab_dropcol_dml_numeric"
NOTICE:  CREATE TABLE will create partition "mpp21090_xchange_pttab_dropcol_dml_numeric_1_prt_parttwo" for table "mpp21090_xchange_pttab_dropcol_dml_numeric"
NOTICE:  CREATE TABLE will create partition "mpp21090_xchange_pttab_dropcol_dml_numeric_1_prt_partthree" for table "mpp21090_xchange_pttab_dropcol_dml_numeric"
INSERT INTO mpp21090_xchange_pttab_dropcol_dml_numeric VALUES(2.000000,2.000000,'a',0, 2.000000);
SELECT * FROM mpp21090_xchange_pttab_dropcol_dml_numeric ORDER BY 1,2,3,4;
   col1   |   col2   | col3 | col4 |   col5   
----------+----------+------+------+----------
 2.000000 | 2.000000 | a    |    0 | 2.000000
(1 row)

ALTER TABLE mpp21090_xchange_pttab_dropcol_dml_numeric DROP COLUMN col1;
NOTICE:  Dropping a column that is part of the distribution policy forces a NULL distribution policy
NOTICE:  Dropping a column that is part of the distribution policy forces a NULL distribution policy
NOTICE:  Dropping a column that is part of the distribution policy forces a NULL distribution policy
NOTICE:  Dropping a column that is part of the distribution policy forces a NULL distribution policy
-- Create Candidate table for Exchange
DROP TABLE IF EXISTS mpp21090_xchange_pttab_dropcol_dml_numeric_candidate;
NOTICE:  table "mpp21090_xchange_pttab_dropcol_dml_numeric_candidate" does not exist, skipping
CREATE TABLE mpp21090_xchange_pttab_dropcol_dml_numeric_candidate( like mpp21090_xchange_pttab_dropcol_dml_numeric) distributed randomly;
INSERT INTO mpp21090_xchange_pttab_dropcol_dml_numeric_candidate VALUES(2.000000,'z',1,2.000000);
-- Exchange 
ALTER TABLE mpp21090_xchange_pttab_dropcol_dml_numeric EXCHANGE PARTITION FOR(5.000000) WITH TABLE mpp21090_xchange_pttab_dropcol_dml_numeric_candidate;
NOTICE:  exchanged partition "partone" of relation "mpp21090_xchange_pttab_dropcol_dml_numeric" with relation "mpp21090_xchange_pttab_dropcol_dml_numeric_candidate"
SELECT * FROM mpp21090_xchange_pttab_dropcol_dml_numeric ORDER BY 1,2,3;
   col2   | col3 | col4 |   col5   
----------+------+------+----------
 2.000000 | z    |    1 | 2.000000
(1 row)

SELECT * FROM mpp21090_xchange_pttab_dropcol_dml_numeric_candidate ORDER BY 1,2,3;
   col2   | col3 | col4 |   col5   
----------+------+------+----------
 2.000000 | a    |    0 | 2.000000
(1 row)

-- DML on partition table
INSERT INTO mpp21090_xchange_pttab_dropcol_dml_numeric SELECT  1.000000,'b', 1, 1.000000;
SELECT * FROM mpp21090_xchange_pttab_dropcol_dml_numeric ORDER BY 1,2,3;
   col2   | col3 | col4 |   col5   
----------+------+------+----------
 1.000000 | b    |    1 | 1.000000
 2.000000 | z    |    1 | 2.000000
(2 rows)

UPDATE mpp21090_xchange_pttab_dropcol_dml_numeric SET col5 = 35.000000 WHERE col2 = 1.000000 AND col5 = 1.000000;
SELECT * FROM mpp21090_xchange_pttab_dropcol_dml_numeric ORDER BY 1,2,3;
   col2   | col3 | col4 |   col5    
----------+------+------+-----------
 1.000000 | b    |    1 | 35.000000
 2.000000 | z    |    1 |  2.000000
(2 rows)

UPDATE mpp21090_xchange_pttab_dropcol_dml_numeric SET col2 =2.000000 WHERE col3='b';
SELECT * FROM mpp21090_xchange_pttab_dropcol_dml_numeric ORDER BY 1,2,3;
   col2   | col3 | col4 |   col5    
----------+------+------+-----------
 2.000000 | b    |    1 | 35.000000
 2.000000 | z    |    1 |  2.000000
(2 rows)

DELETE FROM mpp21090_xchange_pttab_dropcol_dml_numeric WHERE col3='b';
SELECT * FROM mpp21090_xchange_pttab_dropcol_dml_numeric ORDER BY 1,2,3;
   col2   | col3 | col4 |   col5   
----------+------+------+----------
 2.000000 | z    |    1 | 2.000000
(1 row)

-- DML on candidate table
INSERT INTO mpp21090_xchange_pttab_dropcol_dml_numeric_candidate SELECT 1.000000,'b', 1, 1.000000;
SELECT * FROM mpp21090_xchange_pttab_dropcol_dml_numeric_candidate ORDER BY 1,2,3;
   col2   | col3 | col4 |   col5   
----------+------+------+----------
 1.000000 | b    |    1 | 1.000000
 2.000000 | a    |    0 | 2.000000
(2 rows)

UPDATE mpp21090_xchange_pttab_dropcol_dml_numeric_candidate SET col2=2.000000 WHERE col3='a';
SELECT * FROM mpp21090_xchange_pttab_dropcol_dml_numeric_candidate ORDER BY 1,2,3;
   col2   | col3 | col4 |   col5   
----------+------+------+----------
 1.000000 | b    |    1 | 1.000000
 2.000000 | a    |    0 | 2.000000
(2 rows)

DELETE FROM mpp21090_xchange_pttab_dropcol_dml_numeric_candidate WHERE col3='a';
SELECT * FROM mpp21090_xchange_pttab_dropcol_dml_numeric_candidate ORDER BY 1,2,3;
   col2   | col3 | col4 |   col5   
----------+------+------+----------
 1.000000 | b    |    1 | 1.000000
(1 row)

-- @author prabhd 
-- @created 2014-04-01 12:00:00
-- @modified 2012-04-01 12:00:00
-- @tags dml MPP-21090 ORCA
-- @optimizer_mode on	
-- @description Tests for MPP-21090
\echo --start_ignore
--start_ignore
\echo --end_ignore
--end_ignore
DROP TABLE IF EXISTS mpp21090_xchange_pttab_dropcol_dml_time;
NOTICE:  table "mpp21090_xchange_pttab_dropcol_dml_time" does not exist, skipping
CREATE TABLE mpp21090_xchange_pttab_dropcol_dml_time
(
    col1 time,
    col2 time,
    col3 char,
    col4 int,
    col5 time
) 
DISTRIBUTED by (col1)
PARTITION BY RANGE(col2)(partition partone start('12:00:00') end('18:00:00')  WITH (APPENDONLY=true, COMPRESSLEVEL=5, ORIENTATION=column),partition parttwo start('18:00:00') end('24:00:00') WITH (APPENDONLY=true, COMPRESSLEVEL=5, ORIENTATION=row),partition partthree start('0:00:00') end('11:00:00'));
NOTICE:  CREATE TABLE will create partition "mpp21090_xchange_pttab_dropcol_dml_time_1_prt_partthree" for table "mpp21090_xchange_pttab_dropcol_dml_time"
NOTICE:  CREATE TABLE will create partition "mpp21090_xchange_pttab_dropcol_dml_time_1_prt_partone" for table "mpp21090_xchange_pttab_dropcol_dml_time"
NOTICE:  CREATE TABLE will create partition "mpp21090_xchange_pttab_dropcol_dml_time_1_prt_parttwo" for table "mpp21090_xchange_pttab_dropcol_dml_time"
INSERT INTO mpp21090_xchange_pttab_dropcol_dml_time VALUES('12:00:00','12:00:00','a',0, '12:00:00');
SELECT * FROM mpp21090_xchange_pttab_dropcol_dml_time ORDER BY 1,2,3,4;
   col1   |   col2   | col3 | col4 |   col5   
----------+----------+------+------+----------
 12:00:00 | 12:00:00 | a    |    0 | 12:00:00
(1 row)

ALTER TABLE mpp21090_xchange_pttab_dropcol_dml_time DROP COLUMN col1;
NOTICE:  Dropping a column that is part of the distribution policy forces a NULL distribution policy
NOTICE:  Dropping a column that is part of the distribution policy forces a NULL distribution policy
NOTICE:  Dropping a column that is part of the distribution policy forces a NULL distribution policy
NOTICE:  Dropping a column that is part of the distribution policy forces a NULL distribution policy
-- Create Candidate table for Exchange
DROP TABLE IF EXISTS mpp21090_xchange_pttab_dropcol_dml_time_candidate;
NOTICE:  table "mpp21090_xchange_pttab_dropcol_dml_time_candidate" does not exist, skipping
CREATE TABLE mpp21090_xchange_pttab_dropcol_dml_time_candidate( like mpp21090_xchange_pttab_dropcol_dml_time) distributed randomly;
INSERT INTO mpp21090_xchange_pttab_dropcol_dml_time_candidate VALUES('12:00:00','z',1,'12:00:00');
-- Exchange 
ALTER TABLE mpp21090_xchange_pttab_dropcol_dml_time EXCHANGE PARTITION FOR('15:00:00') WITH TABLE mpp21090_xchange_pttab_dropcol_dml_time_candidate;
NOTICE:  exchanged partition "partone" of relation "mpp21090_xchange_pttab_dropcol_dml_time" with relation "mpp21090_xchange_pttab_dropcol_dml_time_candidate"
SELECT * FROM mpp21090_xchange_pttab_dropcol_dml_time ORDER BY 1,2,3;
   col2   | col3 | col4 |   col5   
----------+------+------+----------
 12:00:00 | z    |    1 | 12:00:00
(1 row)

SELECT * FROM mpp21090_xchange_pttab_dropcol_dml_time_candidate ORDER BY 1,2,3;
   col2   | col3 | col4 |   col5   
----------+------+------+----------
 12:00:00 | a    |    0 | 12:00:00
(1 row)

-- DML on partition table
INSERT INTO mpp21090_xchange_pttab_dropcol_dml_time SELECT  '12:00:00','b', 1, '12:00:00';
SELECT * FROM mpp21090_xchange_pttab_dropcol_dml_time ORDER BY 1,2,3;
   col2   | col3 | col4 |   col5   
----------+------+------+----------
 12:00:00 | b    |    1 | 12:00:00
 12:00:00 | z    |    1 | 12:00:00
(2 rows)

UPDATE mpp21090_xchange_pttab_dropcol_dml_time SET col5 = '11:30:00' WHERE col2 = '12:00:00' AND col5 = '12:00:00';
SELECT * FROM mpp21090_xchange_pttab_dropcol_dml_time ORDER BY 1,2,3;
   col2   | col3 | col4 |   col5   
----------+------+------+----------
 12:00:00 | b    |    1 | 11:30:00
 12:00:00 | z    |    1 | 11:30:00
(2 rows)

UPDATE mpp21090_xchange_pttab_dropcol_dml_time SET col2 ='12:00:00' WHERE col3='b';
SELECT * FROM mpp21090_xchange_pttab_dropcol_dml_time ORDER BY 1,2,3;
   col2   | col3 | col4 |   col5   
----------+------+------+----------
 12:00:00 | b    |    1 | 11:30:00
 12:00:00 | z    |    1 | 11:30:00
(2 rows)

DELETE FROM mpp21090_xchange_pttab_dropcol_dml_time WHERE col3='b';
SELECT * FROM mpp21090_xchange_pttab_dropcol_dml_time ORDER BY 1,2,3;
   col2   | col3 | col4 |   col5   
----------+------+------+----------
 12:00:00 | z    |    1 | 11:30:00
(1 row)

-- DML on candidate table
INSERT INTO mpp21090_xchange_pttab_dropcol_dml_time_candidate SELECT '12:00:00','b', 1, '12:00:00';
SELECT * FROM mpp21090_xchange_pttab_dropcol_dml_time_candidate ORDER BY 1,2,3;
   col2   | col3 | col4 |   col5   
----------+------+------+----------
 12:00:00 | a    |    0 | 12:00:00
 12:00:00 | b    |    1 | 12:00:00
(2 rows)

UPDATE mpp21090_xchange_pttab_dropcol_dml_time_candidate SET col2='12:00:00' WHERE col3='a';
SELECT * FROM mpp21090_xchange_pttab_dropcol_dml_time_candidate ORDER BY 1,2,3;
   col2   | col3 | col4 |   col5   
----------+------+------+----------
 12:00:00 | a    |    0 | 12:00:00
 12:00:00 | b    |    1 | 12:00:00
(2 rows)

DELETE FROM mpp21090_xchange_pttab_dropcol_dml_time_candidate WHERE col3='a';
SELECT * FROM mpp21090_xchange_pttab_dropcol_dml_time_candidate ORDER BY 1,2,3;
   col2   | col3 | col4 |   col5   
----------+------+------+----------
 12:00:00 | b    |    1 | 12:00:00
(1 row)

-- @author prabhd 
-- @created 2014-04-01 12:00:00
-- @modified 2012-04-01 12:00:00
-- @tags dml MPP-21090 ORCA
-- @optimizer_mode on	
-- @description Tests for MPP-21090
\echo --start_ignore
--start_ignore
\echo --end_ignore
--end_ignore
DROP TABLE IF EXISTS mpp21090_xchange_pttab_dropcol_dml_timestamp;
NOTICE:  table "mpp21090_xchange_pttab_dropcol_dml_timestamp" does not exist, skipping
CREATE TABLE mpp21090_xchange_pttab_dropcol_dml_timestamp
(
    col1 timestamp,
    col2 timestamp,
    col3 char,
    col4 int,
    col5 timestamp
) 
DISTRIBUTED by (col1)
PARTITION BY RANGE(col2)(partition partone start('2013-12-01 12:00:00') end('2013-12-31 12:00:00') WITH(APPENDONLY=true, COMPRESSLEVEL=5, ORIENTATION=column),partition parttwo start('2013-12-31 12:00:00') end('2014-01-01 12:00:00') inclusive WITH (APPENDONLY=true, COMPRESSLEVEL=5, ORIENTATION=row),partition partthree start('2014-01-02 12:00:00') end('2014-02-01 12:00:00'));
NOTICE:  CREATE TABLE will create partition "mpp21090_xchange_pttab_dropcol_dml_timestamp_1_prt_partone" for table "mpp21090_xchange_pttab_dropcol_dml_timestamp"
NOTICE:  CREATE TABLE will create partition "mpp21090_xchange_pttab_dropcol_dml_timestamp_1_prt_parttwo" for table "mpp21090_xchange_pttab_dropcol_dml_timestamp"
NOTICE:  CREATE TABLE will create partition "mpp21090_xchange_pttab_dropcol_dml_timestamp_1_prt_partthree" for table "mpp21090_xchange_pttab_dropcol_dml_timestamp"
INSERT INTO mpp21090_xchange_pttab_dropcol_dml_timestamp VALUES('2013-12-30 12:00:00','2013-12-30 12:00:00','a',0, '2013-12-30 12:00:00');
SELECT * FROM mpp21090_xchange_pttab_dropcol_dml_timestamp ORDER BY 1,2,3,4;
           col1           |           col2           | col3 | col4 |           col5           
--------------------------+--------------------------+------+------+--------------------------
 Mon Dec 30 12:00:00 2013 | Mon Dec 30 12:00:00 2013 | a    |    0 | Mon Dec 30 12:00:00 2013
(1 row)

ALTER TABLE mpp21090_xchange_pttab_dropcol_dml_timestamp DROP COLUMN col1;
NOTICE:  Dropping a column that is part of the distribution policy forces a NULL distribution policy
NOTICE:  Dropping a column that is part of the distribution policy forces a NULL distribution policy
NOTICE:  Dropping a column that is part of the distribution policy forces a NULL distribution policy
NOTICE:  Dropping a column that is part of the distribution policy forces a NULL distribution policy
-- Create Candidate table for Exchange
DROP TABLE IF EXISTS mpp21090_xchange_pttab_dropcol_dml_timestamp_candidate;
NOTICE:  table "mpp21090_xchange_pttab_dropcol_dml_timestamp_candidate" does not exist, skipping
CREATE TABLE mpp21090_xchange_pttab_dropcol_dml_timestamp_candidate( like mpp21090_xchange_pttab_dropcol_dml_timestamp) distributed randomly;
INSERT INTO mpp21090_xchange_pttab_dropcol_dml_timestamp_candidate VALUES('2013-12-30 12:00:00','z',1,'2013-12-30 12:00:00');
-- Exchange 
ALTER TABLE mpp21090_xchange_pttab_dropcol_dml_timestamp EXCHANGE PARTITION FOR('2013-12-15 12:00:00') WITH TABLE mpp21090_xchange_pttab_dropcol_dml_timestamp_candidate;
NOTICE:  exchanged partition "partone" of relation "mpp21090_xchange_pttab_dropcol_dml_timestamp" with relation "mpp21090_xchange_pttab_dropcol_dml_timestamp_candidate"
SELECT * FROM mpp21090_xchange_pttab_dropcol_dml_timestamp ORDER BY 1,2,3;
           col2           | col3 | col4 |           col5           
--------------------------+------+------+--------------------------
 Mon Dec 30 12:00:00 2013 | z    |    1 | Mon Dec 30 12:00:00 2013
(1 row)

SELECT * FROM mpp21090_xchange_pttab_dropcol_dml_timestamp_candidate ORDER BY 1,2,3;
           col2           | col3 | col4 |           col5           
--------------------------+------+------+--------------------------
 Mon Dec 30 12:00:00 2013 | a    |    0 | Mon Dec 30 12:00:00 2013
(1 row)

-- DML on partition table
INSERT INTO mpp21090_xchange_pttab_dropcol_dml_timestamp SELECT  '2013-12-01 12:00:00','b', 1, '2013-12-01 12:00:00';
SELECT * FROM mpp21090_xchange_pttab_dropcol_dml_timestamp ORDER BY 1,2,3;
           col2           | col3 | col4 |           col5           
--------------------------+------+------+--------------------------
 Sun Dec 01 12:00:00 2013 | b    |    1 | Sun Dec 01 12:00:00 2013
 Mon Dec 30 12:00:00 2013 | z    |    1 | Mon Dec 30 12:00:00 2013
(2 rows)

UPDATE mpp21090_xchange_pttab_dropcol_dml_timestamp SET col5 = '2014-02-10 12:00:00' WHERE col2 = '2013-12-01 12:00:00' AND col5 = '2013-12-01 12:00:00';
SELECT * FROM mpp21090_xchange_pttab_dropcol_dml_timestamp ORDER BY 1,2,3;
           col2           | col3 | col4 |           col5           
--------------------------+------+------+--------------------------
 Sun Dec 01 12:00:00 2013 | b    |    1 | Mon Feb 10 12:00:00 2014
 Mon Dec 30 12:00:00 2013 | z    |    1 | Mon Dec 30 12:00:00 2013
(2 rows)

UPDATE mpp21090_xchange_pttab_dropcol_dml_timestamp SET col2 ='2013-12-30 12:00:00' WHERE col3='b';
SELECT * FROM mpp21090_xchange_pttab_dropcol_dml_timestamp ORDER BY 1,2,3;
           col2           | col3 | col4 |           col5           
--------------------------+------+------+--------------------------
 Mon Dec 30 12:00:00 2013 | b    |    1 | Mon Feb 10 12:00:00 2014
 Mon Dec 30 12:00:00 2013 | z    |    1 | Mon Dec 30 12:00:00 2013
(2 rows)

DELETE FROM mpp21090_xchange_pttab_dropcol_dml_timestamp WHERE col3='b';
SELECT * FROM mpp21090_xchange_pttab_dropcol_dml_timestamp ORDER BY 1,2,3;
           col2           | col3 | col4 |           col5           
--------------------------+------+------+--------------------------
 Mon Dec 30 12:00:00 2013 | z    |    1 | Mon Dec 30 12:00:00 2013
(1 row)

-- DML on candidate table
INSERT INTO mpp21090_xchange_pttab_dropcol_dml_timestamp_candidate SELECT '2013-12-01 12:00:00','b', 1, '2013-12-01 12:00:00';
SELECT * FROM mpp21090_xchange_pttab_dropcol_dml_timestamp_candidate ORDER BY 1,2,3;
           col2           | col3 | col4 |           col5           
--------------------------+------+------+--------------------------
 Sun Dec 01 12:00:00 2013 | b    |    1 | Sun Dec 01 12:00:00 2013
 Mon Dec 30 12:00:00 2013 | a    |    0 | Mon Dec 30 12:00:00 2013
(2 rows)

UPDATE mpp21090_xchange_pttab_dropcol_dml_timestamp_candidate SET col2='2013-12-30 12:00:00' WHERE col3='a';
SELECT * FROM mpp21090_xchange_pttab_dropcol_dml_timestamp_candidate ORDER BY 1,2,3;
           col2           | col3 | col4 |           col5           
--------------------------+------+------+--------------------------
 Sun Dec 01 12:00:00 2013 | b    |    1 | Sun Dec 01 12:00:00 2013
 Mon Dec 30 12:00:00 2013 | a    |    0 | Mon Dec 30 12:00:00 2013
(2 rows)

DELETE FROM mpp21090_xchange_pttab_dropcol_dml_timestamp_candidate WHERE col3='a';
SELECT * FROM mpp21090_xchange_pttab_dropcol_dml_timestamp_candidate ORDER BY 1,2,3;
           col2           | col3 | col4 |           col5           
--------------------------+------+------+--------------------------
 Sun Dec 01 12:00:00 2013 | b    |    1 | Sun Dec 01 12:00:00 2013
(1 row)

-- @author prabhd 
-- @created 2014-04-01 12:00:00
-- @modified 2012-04-01 12:00:00
-- @tags dml MPP-21090 ORCA
-- @optimizer_mode on	
-- @description Tests for MPP-21090
\echo --start_ignore
--start_ignore
\echo --end_ignore
--end_ignore
DROP TABLE IF EXISTS mpp21090_xchange_pttab_dropcol_dml_timestamptz;
NOTICE:  table "mpp21090_xchange_pttab_dropcol_dml_timestamptz" does not exist, skipping
CREATE TABLE mpp21090_xchange_pttab_dropcol_dml_timestamptz
(
    col1 timestamptz,
    col2 timestamptz,
    col3 char,
    col4 int,
    col5 timestamptz
) 
DISTRIBUTED by (col1)
PARTITION BY RANGE(col2)(partition partone start('2013-12-01 12:00:00 PST') end('2013-12-31 12:00:00 PST') WITH(APPENDONLY=true, COMPRESSLEVEL=5, ORIENTATION=column),partition parttwo start('2013-12-31 12:00:00 PST') end('2014-01-01 12:00:00 PST') WITH (APPENDONLY=true, COMPRESSLEVEL=5, ORIENTATION=row),partition partthree start('2014-01-01 12:00:00 PST') end('2014-02-01 12:00:00 PST'));
NOTICE:  CREATE TABLE will create partition "mpp21090_xchange_pttab_dropcol_dml_timestamptz_1_prt_partone" for table "mpp21090_xchange_pttab_dropcol_dml_timestamptz"
NOTICE:  CREATE TABLE will create partition "mpp21090_xchange_pttab_dropcol_dml_timestamptz_1_prt_parttwo" for table "mpp21090_xchange_pttab_dropcol_dml_timestamptz"
NOTICE:  CREATE TABLE will create partition "mpp21090_xchange_pttab_dropcol_dml_timestamptz_1_prt_partthree" for table "mpp21090_xchange_pttab_dropcol_dml_timestamptz"
INSERT INTO mpp21090_xchange_pttab_dropcol_dml_timestamptz VALUES('2013-12-30 12:00:00 PST','2013-12-30 12:00:00 PST','a',0, '2013-12-30 12:00:00 PST');
SELECT * FROM mpp21090_xchange_pttab_dropcol_dml_timestamptz ORDER BY 1,2,3,4;
             col1             |             col2             | col3 | col4 |             col5             
------------------------------+------------------------------+------+------+------------------------------
 Mon Dec 30 12:00:00 2013 PST | Mon Dec 30 12:00:00 2013 PST | a    |    0 | Mon Dec 30 12:00:00 2013 PST
(1 row)

ALTER TABLE mpp21090_xchange_pttab_dropcol_dml_timestamptz DROP COLUMN col1;
NOTICE:  Dropping a column that is part of the distribution policy forces a NULL distribution policy
NOTICE:  Dropping a column that is part of the distribution policy forces a NULL distribution policy
NOTICE:  Dropping a column that is part of the distribution policy forces a NULL distribution policy
NOTICE:  Dropping a column that is part of the distribution policy forces a NULL distribution policy
-- Create Candidate table for Exchange
DROP TABLE IF EXISTS mpp21090_xchange_pttab_dropcol_dml_timestamptz_candidate;
NOTICE:  table "mpp21090_xchange_pttab_dropcol_dml_timestamptz_candidate" does not exist, skipping
CREATE TABLE mpp21090_xchange_pttab_dropcol_dml_timestamptz_candidate( like mpp21090_xchange_pttab_dropcol_dml_timestamptz) distributed randomly;
INSERT INTO mpp21090_xchange_pttab_dropcol_dml_timestamptz_candidate VALUES('2013-12-30 12:00:00 PST','z',1,'2013-12-30 12:00:00 PST');
-- Exchange 
ALTER TABLE mpp21090_xchange_pttab_dropcol_dml_timestamptz EXCHANGE PARTITION FOR('2013-12-15 12:00:00 PST') WITH TABLE mpp21090_xchange_pttab_dropcol_dml_timestamptz_candidate;
NOTICE:  exchanged partition "partone" of relation "mpp21090_xchange_pttab_dropcol_dml_timestamptz" with relation "mpp21090_xchange_pttab_dropcol_dml_timestamptz_candidate"
SELECT * FROM mpp21090_xchange_pttab_dropcol_dml_timestamptz ORDER BY 1,2,3;
             col2             | col3 | col4 |             col5             
------------------------------+------+------+------------------------------
 Mon Dec 30 12:00:00 2013 PST | z    |    1 | Mon Dec 30 12:00:00 2013 PST
(1 row)

SELECT * FROM mpp21090_xchange_pttab_dropcol_dml_timestamptz_candidate ORDER BY 1,2,3;
             col2             | col3 | col4 |             col5             
------------------------------+------+------+------------------------------
 Mon Dec 30 12:00:00 2013 PST | a    |    0 | Mon Dec 30 12:00:00 2013 PST
(1 row)

-- DML on partition table
INSERT INTO mpp21090_xchange_pttab_dropcol_dml_timestamptz SELECT  '2013-12-01 12:00:00 PST','b', 1, '2013-12-01 12:00:00 PST';
SELECT * FROM mpp21090_xchange_pttab_dropcol_dml_timestamptz ORDER BY 1,2,3;
             col2             | col3 | col4 |             col5             
------------------------------+------+------+------------------------------
 Sun Dec 01 12:00:00 2013 PST | b    |    1 | Sun Dec 01 12:00:00 2013 PST
 Mon Dec 30 12:00:00 2013 PST | z    |    1 | Mon Dec 30 12:00:00 2013 PST
(2 rows)

UPDATE mpp21090_xchange_pttab_dropcol_dml_timestamptz SET col5 = '2014-02-10 12:00:00 PST' WHERE col2 = '2013-12-01 12:00:00 PST' AND col5 = '2013-12-01 12:00:00 PST';
SELECT * FROM mpp21090_xchange_pttab_dropcol_dml_timestamptz ORDER BY 1,2,3;
             col2             | col3 | col4 |             col5             
------------------------------+------+------+------------------------------
 Sun Dec 01 12:00:00 2013 PST | b    |    1 | Mon Feb 10 12:00:00 2014 PST
 Mon Dec 30 12:00:00 2013 PST | z    |    1 | Mon Dec 30 12:00:00 2013 PST
(2 rows)

UPDATE mpp21090_xchange_pttab_dropcol_dml_timestamptz SET col2 ='2013-12-30 12:00:00 PST' WHERE col3='b';
SELECT * FROM mpp21090_xchange_pttab_dropcol_dml_timestamptz ORDER BY 1,2,3;
             col2             | col3 | col4 |             col5             
------------------------------+------+------+------------------------------
 Mon Dec 30 12:00:00 2013 PST | b    |    1 | Mon Feb 10 12:00:00 2014 PST
 Mon Dec 30 12:00:00 2013 PST | z    |    1 | Mon Dec 30 12:00:00 2013 PST
(2 rows)

DELETE FROM mpp21090_xchange_pttab_dropcol_dml_timestamptz WHERE col3='b';
SELECT * FROM mpp21090_xchange_pttab_dropcol_dml_timestamptz ORDER BY 1,2,3;
             col2             | col3 | col4 |             col5             
------------------------------+------+------+------------------------------
 Mon Dec 30 12:00:00 2013 PST | z    |    1 | Mon Dec 30 12:00:00 2013 PST
(1 row)

-- DML on candidate table
INSERT INTO mpp21090_xchange_pttab_dropcol_dml_timestamptz_candidate SELECT '2013-12-01 12:00:00 PST','b', 1, '2013-12-01 12:00:00 PST';
SELECT * FROM mpp21090_xchange_pttab_dropcol_dml_timestamptz_candidate ORDER BY 1,2,3;
             col2             | col3 | col4 |             col5             
------------------------------+------+------+------------------------------
 Sun Dec 01 12:00:00 2013 PST | b    |    1 | Sun Dec 01 12:00:00 2013 PST
 Mon Dec 30 12:00:00 2013 PST | a    |    0 | Mon Dec 30 12:00:00 2013 PST
(2 rows)

UPDATE mpp21090_xchange_pttab_dropcol_dml_timestamptz_candidate SET col2='2013-12-30 12:00:00 PST' WHERE col3='a';
SELECT * FROM mpp21090_xchange_pttab_dropcol_dml_timestamptz_candidate ORDER BY 1,2,3;
             col2             | col3 | col4 |             col5             
------------------------------+------+------+------------------------------
 Sun Dec 01 12:00:00 2013 PST | b    |    1 | Sun Dec 01 12:00:00 2013 PST
 Mon Dec 30 12:00:00 2013 PST | a    |    0 | Mon Dec 30 12:00:00 2013 PST
(2 rows)

DELETE FROM mpp21090_xchange_pttab_dropcol_dml_timestamptz_candidate WHERE col3='a';
SELECT * FROM mpp21090_xchange_pttab_dropcol_dml_timestamptz_candidate ORDER BY 1,2,3;
             col2             | col3 | col4 |             col5             
------------------------------+------+------+------------------------------
 Sun Dec 01 12:00:00 2013 PST | b    |    1 | Sun Dec 01 12:00:00 2013 PST
(1 row)

-- @author prabhd 
-- @created 2014-04-01 12:00:00
-- @modified 2012-04-01 12:00:00
-- @tags dml MPP-21090 ORCA
-- @optimizer_mode on	
-- @description Tests for MPP-21090
\echo --start_ignore
--start_ignore
\echo --end_ignore
--end_ignore
DROP TABLE IF EXISTS mpp21090_xchange_pttab_dropcol_idx_dml_char;
NOTICE:  table "mpp21090_xchange_pttab_dropcol_idx_dml_char" does not exist, skipping
CREATE TABLE mpp21090_xchange_pttab_dropcol_idx_dml_char
(
    col1 char,
    col2 char,
    col3 char,
    col4 int,
    col5 char
) 
DISTRIBUTED by (col1)
PARTITION BY LIST(col2)(partition partone VALUES('a','b','c','d','e','f','g','h') WITH (APPENDONLY=true, COMPRESSLEVEL=5, ORIENTATION=column),partition parttwo VALUES('i','j','k','l','m','n','o','p') WITH (APPENDONLY=true, COMPRESSLEVEL=5, ORIENTATION=row),partition partthree VALUES('q','r','s','t','u','v','w','x'));
NOTICE:  CREATE TABLE will create partition "mpp21090_xchange_pttab_dropcol_idx_dml_char_1_prt_partone" for table "mpp21090_xchange_pttab_dropcol_idx_dml_char"
NOTICE:  CREATE TABLE will create partition "mpp21090_xchange_pttab_dropcol_idx_dml_char_1_prt_parttwo" for table "mpp21090_xchange_pttab_dropcol_idx_dml_char"
NOTICE:  CREATE TABLE will create partition "mpp21090_xchange_pttab_dropcol_idx_dml_char_1_prt_partthree" for table "mpp21090_xchange_pttab_dropcol_idx_dml_char"
INSERT INTO mpp21090_xchange_pttab_dropcol_idx_dml_char VALUES('g','g','a',0, 'g');
SELECT * FROM mpp21090_xchange_pttab_dropcol_idx_dml_char ORDER BY 1,2,3,4;
 col1 | col2 | col3 | col4 | col5 
------+------+------+------+------
 g    | g    | a    |    0 | g
(1 row)

DROP INDEX IF EXISTS mpp21090_xchange_pttab_dropcol_idx_dml_idx_char;
NOTICE:  index "mpp21090_xchange_pttab_dropcol_idx_dml_idx_char" does not exist, skipping
CREATE INDEX mpp21090_xchange_pttab_dropcol_idx_dml_idx_char on mpp21090_xchange_pttab_dropcol_idx_dml_char(col2);
NOTICE:  building index for child partition "mpp21090_xchange_pttab_dropcol_idx_dml_char_1_prt_partone"
NOTICE:  building index for child partition "mpp21090_xchange_pttab_dropcol_idx_dml_char_1_prt_parttwo"
NOTICE:  building index for child partition "mpp21090_xchange_pttab_dropcol_idx_dml_char_1_prt_partthree"
ALTER TABLE mpp21090_xchange_pttab_dropcol_idx_dml_char DROP COLUMN col1;
NOTICE:  Dropping a column that is part of the distribution policy forces a NULL distribution policy
NOTICE:  Dropping a column that is part of the distribution policy forces a NULL distribution policy
NOTICE:  Dropping a column that is part of the distribution policy forces a NULL distribution policy
NOTICE:  Dropping a column that is part of the distribution policy forces a NULL distribution policy
-- Create Candidate table for Exchange
DROP TABLE IF EXISTS mpp21090_xchange_pttab_dropcol_idx_dml_char_candidate;
NOTICE:  table "mpp21090_xchange_pttab_dropcol_idx_dml_char_candidate" does not exist, skipping
CREATE TABLE mpp21090_xchange_pttab_dropcol_idx_dml_char_candidate( like mpp21090_xchange_pttab_dropcol_idx_dml_char) distributed randomly;
INSERT INTO mpp21090_xchange_pttab_dropcol_idx_dml_char_candidate VALUES('g','z',1,'g');
-- Exchange 
ALTER TABLE mpp21090_xchange_pttab_dropcol_idx_dml_char EXCHANGE PARTITION FOR('d') WITH TABLE mpp21090_xchange_pttab_dropcol_idx_dml_char_candidate;
NOTICE:  exchanged partition "partone" of relation "mpp21090_xchange_pttab_dropcol_idx_dml_char" with relation "mpp21090_xchange_pttab_dropcol_idx_dml_char_candidate"
SELECT * FROM mpp21090_xchange_pttab_dropcol_idx_dml_char ORDER BY 1,2,3;
 col2 | col3 | col4 | col5 
------+------+------+------
 g    | z    |    1 | g
(1 row)

SELECT * FROM mpp21090_xchange_pttab_dropcol_idx_dml_char_candidate ORDER BY 1,2,3;
 col2 | col3 | col4 | col5 
------+------+------+------
 g    | a    |    0 | g
(1 row)

-- DML on partition table
INSERT INTO mpp21090_xchange_pttab_dropcol_idx_dml_char SELECT  'a','b', 1, 'a';
SELECT * FROM mpp21090_xchange_pttab_dropcol_idx_dml_char ORDER BY 1,2,3;
 col2 | col3 | col4 | col5 
------+------+------+------
 a    | b    |    1 | a
 g    | z    |    1 | g
(2 rows)

UPDATE mpp21090_xchange_pttab_dropcol_idx_dml_char SET col5 = 'z' WHERE col2 = 'a' AND col5 = 'a';
SELECT * FROM mpp21090_xchange_pttab_dropcol_idx_dml_char ORDER BY 1,2,3;
 col2 | col3 | col4 | col5 
------+------+------+------
 a    | b    |    1 | z
 g    | z    |    1 | g
(2 rows)

UPDATE mpp21090_xchange_pttab_dropcol_idx_dml_char SET col2 ='g' WHERE col3='b';
SELECT * FROM mpp21090_xchange_pttab_dropcol_idx_dml_char ORDER BY 1,2,3;
 col2 | col3 | col4 | col5 
------+------+------+------
 g    | b    |    1 | z
 g    | z    |    1 | g
(2 rows)

DELETE FROM mpp21090_xchange_pttab_dropcol_idx_dml_char WHERE col3='b';
SELECT * FROM mpp21090_xchange_pttab_dropcol_idx_dml_char ORDER BY 1,2,3;
 col2 | col3 | col4 | col5 
------+------+------+------
 g    | z    |    1 | g
(1 row)

-- DML on candidate table
INSERT INTO mpp21090_xchange_pttab_dropcol_idx_dml_char_candidate SELECT 'a','b', 1, 'a';
SELECT * FROM mpp21090_xchange_pttab_dropcol_idx_dml_char_candidate ORDER BY 1,2,3;
 col2 | col3 | col4 | col5 
------+------+------+------
 a    | b    |    1 | a
 g    | a    |    0 | g
(2 rows)

UPDATE mpp21090_xchange_pttab_dropcol_idx_dml_char_candidate SET col2='g' WHERE col3='a';
SELECT * FROM mpp21090_xchange_pttab_dropcol_idx_dml_char_candidate ORDER BY 1,2,3;
 col2 | col3 | col4 | col5 
------+------+------+------
 a    | b    |    1 | a
 g    | a    |    0 | g
(2 rows)

DELETE FROM mpp21090_xchange_pttab_dropcol_idx_dml_char_candidate WHERE col3='a';
SELECT * FROM mpp21090_xchange_pttab_dropcol_idx_dml_char_candidate ORDER BY 1,2,3;
 col2 | col3 | col4 | col5 
------+------+------+------
 a    | b    |    1 | a
(1 row)

-- @author prabhd 
-- @created 2014-04-01 12:00:00
-- @modified 2012-04-01 12:00:00
-- @tags dml MPP-21090 ORCA
-- @optimizer_mode on	
-- @description Tests for MPP-21090
\echo --start_ignore
--start_ignore
\echo --end_ignore
--end_ignore
DROP TABLE IF EXISTS mpp21090_xchange_pttab_dropcol_idx_dml_date;
NOTICE:  table "mpp21090_xchange_pttab_dropcol_idx_dml_date" does not exist, skipping
CREATE TABLE mpp21090_xchange_pttab_dropcol_idx_dml_date
(
    col1 date,
    col2 date,
    col3 char,
    col4 int,
    col5 date
) 
DISTRIBUTED by (col1)
PARTITION BY RANGE(col2)(partition partone start('2013-12-01') end('2013-12-31') WITH(APPENDONLY=true, COMPRESSLEVEL=5, ORIENTATION=column),partition parttwo start('2013-12-31') end('2014-01-01') WITH (APPENDONLY=true, COMPRESSLEVEL=5, ORIENTATION=row),partition partthree start('2014-01-01') end('2014-02-01'));
NOTICE:  CREATE TABLE will create partition "mpp21090_xchange_pttab_dropcol_idx_dml_date_1_prt_partone" for table "mpp21090_xchange_pttab_dropcol_idx_dml_date"
NOTICE:  CREATE TABLE will create partition "mpp21090_xchange_pttab_dropcol_idx_dml_date_1_prt_parttwo" for table "mpp21090_xchange_pttab_dropcol_idx_dml_date"
NOTICE:  CREATE TABLE will create partition "mpp21090_xchange_pttab_dropcol_idx_dml_date_1_prt_partthree" for table "mpp21090_xchange_pttab_dropcol_idx_dml_date"
INSERT INTO mpp21090_xchange_pttab_dropcol_idx_dml_date VALUES('2013-12-30','2013-12-30','a',0, '2013-12-30');
SELECT * FROM mpp21090_xchange_pttab_dropcol_idx_dml_date ORDER BY 1,2,3,4;
    col1    |    col2    | col3 | col4 |    col5    
------------+------------+------+------+------------
 12-30-2013 | 12-30-2013 | a    |    0 | 12-30-2013
(1 row)

DROP INDEX IF EXISTS mpp21090_xchange_pttab_dropcol_idx_dml_idx_date;
NOTICE:  index "mpp21090_xchange_pttab_dropcol_idx_dml_idx_date" does not exist, skipping
CREATE INDEX mpp21090_xchange_pttab_dropcol_idx_dml_idx_date on mpp21090_xchange_pttab_dropcol_idx_dml_date(col2);
NOTICE:  building index for child partition "mpp21090_xchange_pttab_dropcol_idx_dml_date_1_prt_partone"
NOTICE:  building index for child partition "mpp21090_xchange_pttab_dropcol_idx_dml_date_1_prt_parttwo"
NOTICE:  building index for child partition "mpp21090_xchange_pttab_dropcol_idx_dml_date_1_prt_partthree"
ALTER TABLE mpp21090_xchange_pttab_dropcol_idx_dml_date DROP COLUMN col1;
NOTICE:  Dropping a column that is part of the distribution policy forces a NULL distribution policy
NOTICE:  Dropping a column that is part of the distribution policy forces a NULL distribution policy
NOTICE:  Dropping a column that is part of the distribution policy forces a NULL distribution policy
NOTICE:  Dropping a column that is part of the distribution policy forces a NULL distribution policy
-- Create Candidate table for Exchange
DROP TABLE IF EXISTS mpp21090_xchange_pttab_dropcol_idx_dml_date_candidate;
NOTICE:  table "mpp21090_xchange_pttab_dropcol_idx_dml_date_candidate" does not exist, skipping
CREATE TABLE mpp21090_xchange_pttab_dropcol_idx_dml_date_candidate( like mpp21090_xchange_pttab_dropcol_idx_dml_date) distributed randomly;
INSERT INTO mpp21090_xchange_pttab_dropcol_idx_dml_date_candidate VALUES('2013-12-30','z',1,'2013-12-30');
-- Exchange 
ALTER TABLE mpp21090_xchange_pttab_dropcol_idx_dml_date EXCHANGE PARTITION FOR('2013-12-15') WITH TABLE mpp21090_xchange_pttab_dropcol_idx_dml_date_candidate;
NOTICE:  exchanged partition "partone" of relation "mpp21090_xchange_pttab_dropcol_idx_dml_date" with relation "mpp21090_xchange_pttab_dropcol_idx_dml_date_candidate"
SELECT * FROM mpp21090_xchange_pttab_dropcol_idx_dml_date ORDER BY 1,2,3;
    col2    | col3 | col4 |    col5    
------------+------+------+------------
 12-30-2013 | z    |    1 | 12-30-2013
(1 row)

SELECT * FROM mpp21090_xchange_pttab_dropcol_idx_dml_date_candidate ORDER BY 1,2,3;
    col2    | col3 | col4 |    col5    
------------+------+------+------------
 12-30-2013 | a    |    0 | 12-30-2013
(1 row)

-- DML on partition table
INSERT INTO mpp21090_xchange_pttab_dropcol_idx_dml_date SELECT  '2013-12-01','b', 1, '2013-12-01';
SELECT * FROM mpp21090_xchange_pttab_dropcol_idx_dml_date ORDER BY 1,2,3;
    col2    | col3 | col4 |    col5    
------------+------+------+------------
 12-01-2013 | b    |    1 | 12-01-2013
 12-30-2013 | z    |    1 | 12-30-2013
(2 rows)

UPDATE mpp21090_xchange_pttab_dropcol_idx_dml_date SET col5 = '2014-02-10' WHERE col2 = '2013-12-01' AND col5 = '2013-12-01';
SELECT * FROM mpp21090_xchange_pttab_dropcol_idx_dml_date ORDER BY 1,2,3;
    col2    | col3 | col4 |    col5    
------------+------+------+------------
 12-01-2013 | b    |    1 | 02-10-2014
 12-30-2013 | z    |    1 | 12-30-2013
(2 rows)

UPDATE mpp21090_xchange_pttab_dropcol_idx_dml_date SET col2 ='2013-12-30' WHERE col3='b';
SELECT * FROM mpp21090_xchange_pttab_dropcol_idx_dml_date ORDER BY 1,2,3;
    col2    | col3 | col4 |    col5    
------------+------+------+------------
 12-30-2013 | b    |    1 | 02-10-2014
 12-30-2013 | z    |    1 | 12-30-2013
(2 rows)

DELETE FROM mpp21090_xchange_pttab_dropcol_idx_dml_date WHERE col3='b';
SELECT * FROM mpp21090_xchange_pttab_dropcol_idx_dml_date ORDER BY 1,2,3;
    col2    | col3 | col4 |    col5    
------------+------+------+------------
 12-30-2013 | z    |    1 | 12-30-2013
(1 row)

-- DML on candidate table
INSERT INTO mpp21090_xchange_pttab_dropcol_idx_dml_date_candidate SELECT '2013-12-01','b', 1, '2013-12-01';
SELECT * FROM mpp21090_xchange_pttab_dropcol_idx_dml_date_candidate ORDER BY 1,2,3;
    col2    | col3 | col4 |    col5    
------------+------+------+------------
 12-01-2013 | b    |    1 | 12-01-2013
 12-30-2013 | a    |    0 | 12-30-2013
(2 rows)

UPDATE mpp21090_xchange_pttab_dropcol_idx_dml_date_candidate SET col2='2013-12-30' WHERE col3='a';
SELECT * FROM mpp21090_xchange_pttab_dropcol_idx_dml_date_candidate ORDER BY 1,2,3;
    col2    | col3 | col4 |    col5    
------------+------+------+------------
 12-01-2013 | b    |    1 | 12-01-2013
 12-30-2013 | a    |    0 | 12-30-2013
(2 rows)

DELETE FROM mpp21090_xchange_pttab_dropcol_idx_dml_date_candidate WHERE col3='a';
SELECT * FROM mpp21090_xchange_pttab_dropcol_idx_dml_date_candidate ORDER BY 1,2,3;
    col2    | col3 | col4 |    col5    
------------+------+------+------------
 12-01-2013 | b    |    1 | 12-01-2013
(1 row)

-- @author prabhd 
-- @created 2014-04-01 12:00:00
-- @modified 2012-04-01 12:00:00
-- @tags dml MPP-21090 ORCA
-- @optimizer_mode on	
-- @description Tests for MPP-21090
\echo --start_ignore
--start_ignore
\echo --end_ignore
--end_ignore
DROP TABLE IF EXISTS mpp21090_xchange_pttab_dropcol_idx_dml_decimal;
NOTICE:  table "mpp21090_xchange_pttab_dropcol_idx_dml_decimal" does not exist, skipping
CREATE TABLE mpp21090_xchange_pttab_dropcol_idx_dml_decimal
(
    col1 decimal,
    col2 decimal,
    col3 char,
    col4 int,
    col5 decimal
) 
DISTRIBUTED by (col1)
PARTITION BY RANGE(col2)(partition partone start(1.00) end(10.00)  WITH (APPENDONLY=true, COMPRESSLEVEL=5, ORIENTATION=column),partition parttwo start(10.00) end(20.00) WITH (APPENDONLY=true, COMPRESSLEVEL=5, ORIENTATION=row),partition partthree start(20.00) end(30.00));
NOTICE:  CREATE TABLE will create partition "mpp21090_xchange_pttab_dropcol_idx_dml_decimal_1_prt_partone" for table "mpp21090_xchange_pttab_dropcol_idx_dml_decimal"
NOTICE:  CREATE TABLE will create partition "mpp21090_xchange_pttab_dropcol_idx_dml_decimal_1_prt_parttwo" for table "mpp21090_xchange_pttab_dropcol_idx_dml_decimal"
NOTICE:  CREATE TABLE will create partition "mpp21090_xchange_pttab_dropcol_idx_dml_decimal_1_prt_partthree" for table "mpp21090_xchange_pttab_dropcol_idx_dml_decimal"
INSERT INTO mpp21090_xchange_pttab_dropcol_idx_dml_decimal VALUES(2.00,2.00,'a',0, 2.00);
SELECT * FROM mpp21090_xchange_pttab_dropcol_idx_dml_decimal ORDER BY 1,2,3,4;
 col1 | col2 | col3 | col4 | col5 
------+------+------+------+------
 2.00 | 2.00 | a    |    0 | 2.00
(1 row)

DROP INDEX IF EXISTS mpp21090_xchange_pttab_dropcol_idx_dml_idx_decimal;
NOTICE:  index "mpp21090_xchange_pttab_dropcol_idx_dml_idx_decimal" does not exist, skipping
CREATE INDEX mpp21090_xchange_pttab_dropcol_idx_dml_idx_decimal on mpp21090_xchange_pttab_dropcol_idx_dml_decimal(col2);
NOTICE:  building index for child partition "mpp21090_xchange_pttab_dropcol_idx_dml_decimal_1_prt_partone"
NOTICE:  building index for child partition "mpp21090_xchange_pttab_dropcol_idx_dml_decimal_1_prt_parttwo"
NOTICE:  building index for child partition "mpp21090_xchange_pttab_dropcol_idx_dml_decimal_1_prt_partthree"
ALTER TABLE mpp21090_xchange_pttab_dropcol_idx_dml_decimal DROP COLUMN col1;
NOTICE:  Dropping a column that is part of the distribution policy forces a NULL distribution policy
NOTICE:  Dropping a column that is part of the distribution policy forces a NULL distribution policy
NOTICE:  Dropping a column that is part of the distribution policy forces a NULL distribution policy
NOTICE:  Dropping a column that is part of the distribution policy forces a NULL distribution policy
-- Create Candidate table for Exchange
DROP TABLE IF EXISTS mpp21090_xchange_pttab_dropcol_idx_dml_decimal_candidate;
NOTICE:  table "mpp21090_xchange_pttab_dropcol_idx_dml_decimal_candidate" does not exist, skipping
CREATE TABLE mpp21090_xchange_pttab_dropcol_idx_dml_decimal_candidate( like mpp21090_xchange_pttab_dropcol_idx_dml_decimal) distributed randomly;
INSERT INTO mpp21090_xchange_pttab_dropcol_idx_dml_decimal_candidate VALUES(2.00,'z',1,2.00);
-- Exchange 
ALTER TABLE mpp21090_xchange_pttab_dropcol_idx_dml_decimal EXCHANGE PARTITION FOR(5.00) WITH TABLE mpp21090_xchange_pttab_dropcol_idx_dml_decimal_candidate;
NOTICE:  exchanged partition "partone" of relation "mpp21090_xchange_pttab_dropcol_idx_dml_decimal" with relation "mpp21090_xchange_pttab_dropcol_idx_dml_decimal_candidate"
SELECT * FROM mpp21090_xchange_pttab_dropcol_idx_dml_decimal ORDER BY 1,2,3;
 col2 | col3 | col4 | col5 
------+------+------+------
 2.00 | z    |    1 | 2.00
(1 row)

SELECT * FROM mpp21090_xchange_pttab_dropcol_idx_dml_decimal_candidate ORDER BY 1,2,3;
 col2 | col3 | col4 | col5 
------+------+------+------
 2.00 | a    |    0 | 2.00
(1 row)

-- DML on partition table
INSERT INTO mpp21090_xchange_pttab_dropcol_idx_dml_decimal SELECT  1.00,'b', 1, 1.00;
SELECT * FROM mpp21090_xchange_pttab_dropcol_idx_dml_decimal ORDER BY 1,2,3;
 col2 | col3 | col4 | col5 
------+------+------+------
 1.00 | b    |    1 | 1.00
 2.00 | z    |    1 | 2.00
(2 rows)

UPDATE mpp21090_xchange_pttab_dropcol_idx_dml_decimal SET col5 = 35.00 WHERE col2 = 1.00 AND col5 = 1.00;
SELECT * FROM mpp21090_xchange_pttab_dropcol_idx_dml_decimal ORDER BY 1,2,3;
 col2 | col3 | col4 | col5  
------+------+------+-------
 1.00 | b    |    1 | 35.00
 2.00 | z    |    1 |  2.00
(2 rows)

UPDATE mpp21090_xchange_pttab_dropcol_idx_dml_decimal SET col2 =2.00 WHERE col3='b';
SELECT * FROM mpp21090_xchange_pttab_dropcol_idx_dml_decimal ORDER BY 1,2,3;
 col2 | col3 | col4 | col5  
------+------+------+-------
 2.00 | b    |    1 | 35.00
 2.00 | z    |    1 |  2.00
(2 rows)

DELETE FROM mpp21090_xchange_pttab_dropcol_idx_dml_decimal WHERE col3='b';
SELECT * FROM mpp21090_xchange_pttab_dropcol_idx_dml_decimal ORDER BY 1,2,3;
 col2 | col3 | col4 | col5 
------+------+------+------
 2.00 | z    |    1 | 2.00
(1 row)

-- DML on candidate table
INSERT INTO mpp21090_xchange_pttab_dropcol_idx_dml_decimal_candidate SELECT 1.00,'b', 1, 1.00;
SELECT * FROM mpp21090_xchange_pttab_dropcol_idx_dml_decimal_candidate ORDER BY 1,2,3;
 col2 | col3 | col4 | col5 
------+------+------+------
 1.00 | b    |    1 | 1.00
 2.00 | a    |    0 | 2.00
(2 rows)

UPDATE mpp21090_xchange_pttab_dropcol_idx_dml_decimal_candidate SET col2=2.00 WHERE col3='a';
SELECT * FROM mpp21090_xchange_pttab_dropcol_idx_dml_decimal_candidate ORDER BY 1,2,3;
 col2 | col3 | col4 | col5 
------+------+------+------
 1.00 | b    |    1 | 1.00
 2.00 | a    |    0 | 2.00
(2 rows)

DELETE FROM mpp21090_xchange_pttab_dropcol_idx_dml_decimal_candidate WHERE col3='a';
SELECT * FROM mpp21090_xchange_pttab_dropcol_idx_dml_decimal_candidate ORDER BY 1,2,3;
 col2 | col3 | col4 | col5 
------+------+------+------
 1.00 | b    |    1 | 1.00
(1 row)

-- @author prabhd 
-- @created 2014-04-01 12:00:00
-- @modified 2012-04-01 12:00:00
-- @tags dml MPP-21090 ORCA
-- @optimizer_mode on	
-- @description Tests for MPP-21090
\echo --start_ignore
--start_ignore
\echo --end_ignore
--end_ignore
DROP TABLE IF EXISTS mpp21090_xchange_pttab_dropcol_idx_dml_float;
NOTICE:  table "mpp21090_xchange_pttab_dropcol_idx_dml_float" does not exist, skipping
CREATE TABLE mpp21090_xchange_pttab_dropcol_idx_dml_float
(
    col1 float,
    col2 float,
    col3 char,
    col4 int,
    col5 float
) 
DISTRIBUTED by (col1)
PARTITION BY RANGE(col2)(partition partone start(1.00) end(10.00)  WITH (APPENDONLY=true, COMPRESSLEVEL=5, ORIENTATION=column),partition parttwo start(10.00) end(20.00) WITH (APPENDONLY=true, COMPRESSLEVEL=5, ORIENTATION=row),partition partthree start(20.00) end(30.00));
NOTICE:  CREATE TABLE will create partition "mpp21090_xchange_pttab_dropcol_idx_dml_float_1_prt_partone" for table "mpp21090_xchange_pttab_dropcol_idx_dml_float"
NOTICE:  CREATE TABLE will create partition "mpp21090_xchange_pttab_dropcol_idx_dml_float_1_prt_parttwo" for table "mpp21090_xchange_pttab_dropcol_idx_dml_float"
NOTICE:  CREATE TABLE will create partition "mpp21090_xchange_pttab_dropcol_idx_dml_float_1_prt_partthree" for table "mpp21090_xchange_pttab_dropcol_idx_dml_float"
INSERT INTO mpp21090_xchange_pttab_dropcol_idx_dml_float VALUES(2.00,2.00,'a',0, 2.00);
SELECT * FROM mpp21090_xchange_pttab_dropcol_idx_dml_float ORDER BY 1,2,3,4;
 col1 | col2 | col3 | col4 | col5 
------+------+------+------+------
    2 |    2 | a    |    0 |    2
(1 row)

DROP INDEX IF EXISTS mpp21090_xchange_pttab_dropcol_idx_dml_idx_float;
NOTICE:  index "mpp21090_xchange_pttab_dropcol_idx_dml_idx_float" does not exist, skipping
CREATE INDEX mpp21090_xchange_pttab_dropcol_idx_dml_idx_float on mpp21090_xchange_pttab_dropcol_idx_dml_float(col2);
NOTICE:  building index for child partition "mpp21090_xchange_pttab_dropcol_idx_dml_float_1_prt_partone"
NOTICE:  building index for child partition "mpp21090_xchange_pttab_dropcol_idx_dml_float_1_prt_parttwo"
NOTICE:  building index for child partition "mpp21090_xchange_pttab_dropcol_idx_dml_float_1_prt_partthree"
ALTER TABLE mpp21090_xchange_pttab_dropcol_idx_dml_float DROP COLUMN col1;
NOTICE:  Dropping a column that is part of the distribution policy forces a NULL distribution policy
NOTICE:  Dropping a column that is part of the distribution policy forces a NULL distribution policy
NOTICE:  Dropping a column that is part of the distribution policy forces a NULL distribution policy
NOTICE:  Dropping a column that is part of the distribution policy forces a NULL distribution policy
-- Create Candidate table for Exchange
DROP TABLE IF EXISTS mpp21090_xchange_pttab_dropcol_idx_dml_float_candidate;
NOTICE:  table "mpp21090_xchange_pttab_dropcol_idx_dml_float_candidate" does not exist, skipping
CREATE TABLE mpp21090_xchange_pttab_dropcol_idx_dml_float_candidate( like mpp21090_xchange_pttab_dropcol_idx_dml_float) distributed randomly;
INSERT INTO mpp21090_xchange_pttab_dropcol_idx_dml_float_candidate VALUES(2.00,'z',1,2.00);
-- Exchange 
ALTER TABLE mpp21090_xchange_pttab_dropcol_idx_dml_float EXCHANGE PARTITION FOR(5.00) WITH TABLE mpp21090_xchange_pttab_dropcol_idx_dml_float_candidate;
NOTICE:  exchanged partition "partone" of relation "mpp21090_xchange_pttab_dropcol_idx_dml_float" with relation "mpp21090_xchange_pttab_dropcol_idx_dml_float_candidate"
SELECT * FROM mpp21090_xchange_pttab_dropcol_idx_dml_float ORDER BY 1,2,3;
 col2 | col3 | col4 | col5 
------+------+------+------
    2 | z    |    1 |    2
(1 row)

SELECT * FROM mpp21090_xchange_pttab_dropcol_idx_dml_float_candidate ORDER BY 1,2,3;
 col2 | col3 | col4 | col5 
------+------+------+------
    2 | a    |    0 |    2
(1 row)

-- DML on partition table
INSERT INTO mpp21090_xchange_pttab_dropcol_idx_dml_float SELECT  1.00,'b', 1, 1.00;
SELECT * FROM mpp21090_xchange_pttab_dropcol_idx_dml_float ORDER BY 1,2,3;
 col2 | col3 | col4 | col5 
------+------+------+------
    1 | b    |    1 |    1
    2 | z    |    1 |    2
(2 rows)

UPDATE mpp21090_xchange_pttab_dropcol_idx_dml_float SET col5 = 35.00 WHERE col2 = 1.00 AND col5 = 1.00;
SELECT * FROM mpp21090_xchange_pttab_dropcol_idx_dml_float ORDER BY 1,2,3;
 col2 | col3 | col4 | col5 
------+------+------+------
    1 | b    |    1 |   35
    2 | z    |    1 |    2
(2 rows)

UPDATE mpp21090_xchange_pttab_dropcol_idx_dml_float SET col2 =2.00 WHERE col3='b';
SELECT * FROM mpp21090_xchange_pttab_dropcol_idx_dml_float ORDER BY 1,2,3;
 col2 | col3 | col4 | col5 
------+------+------+------
    2 | b    |    1 |   35
    2 | z    |    1 |    2
(2 rows)

DELETE FROM mpp21090_xchange_pttab_dropcol_idx_dml_float WHERE col3='b';
SELECT * FROM mpp21090_xchange_pttab_dropcol_idx_dml_float ORDER BY 1,2,3;
 col2 | col3 | col4 | col5 
------+------+------+------
    2 | z    |    1 |    2
(1 row)

-- DML on candidate table
INSERT INTO mpp21090_xchange_pttab_dropcol_idx_dml_float_candidate SELECT 1.00,'b', 1, 1.00;
SELECT * FROM mpp21090_xchange_pttab_dropcol_idx_dml_float_candidate ORDER BY 1,2,3;
 col2 | col3 | col4 | col5 
------+------+------+------
    1 | b    |    1 |    1
    2 | a    |    0 |    2
(2 rows)

UPDATE mpp21090_xchange_pttab_dropcol_idx_dml_float_candidate SET col2=2.00 WHERE col3='a';
SELECT * FROM mpp21090_xchange_pttab_dropcol_idx_dml_float_candidate ORDER BY 1,2,3;
 col2 | col3 | col4 | col5 
------+------+------+------
    1 | b    |    1 |    1
    2 | a    |    0 |    2
(2 rows)

DELETE FROM mpp21090_xchange_pttab_dropcol_idx_dml_float_candidate WHERE col3='a';
SELECT * FROM mpp21090_xchange_pttab_dropcol_idx_dml_float_candidate ORDER BY 1,2,3;
 col2 | col3 | col4 | col5 
------+------+------+------
    1 | b    |    1 |    1
(1 row)

-- @author prabhd 
-- @created 2014-04-01 12:00:00
-- @modified 2012-04-01 12:00:00
-- @tags dml MPP-21090 ORCA
-- @optimizer_mode on	
-- @description Tests for MPP-21090
\echo --start_ignore
--start_ignore
\echo --end_ignore
--end_ignore
DROP TABLE IF EXISTS mpp21090_xchange_pttab_dropcol_idx_dml_int;
NOTICE:  table "mpp21090_xchange_pttab_dropcol_idx_dml_int" does not exist, skipping
CREATE TABLE mpp21090_xchange_pttab_dropcol_idx_dml_int
(
    col1 int,
    col2 int,
    col3 char,
    col4 int,
    col5 int
) 
DISTRIBUTED by (col1)
PARTITION BY RANGE(col2)(partition partone start(1) end(10001) WITH (APPENDONLY=true, COMPRESSLEVEL=5, ORIENTATION=column),partition parttwo start(10001) end(20001) WITH (APPENDONLY=true, COMPRESSLEVEL=5, ORIENTATION=row),partition partthree start(20001) end(30001));
NOTICE:  CREATE TABLE will create partition "mpp21090_xchange_pttab_dropcol_idx_dml_int_1_prt_partone" for table "mpp21090_xchange_pttab_dropcol_idx_dml_int"
NOTICE:  CREATE TABLE will create partition "mpp21090_xchange_pttab_dropcol_idx_dml_int_1_prt_parttwo" for table "mpp21090_xchange_pttab_dropcol_idx_dml_int"
NOTICE:  CREATE TABLE will create partition "mpp21090_xchange_pttab_dropcol_idx_dml_int_1_prt_partthree" for table "mpp21090_xchange_pttab_dropcol_idx_dml_int"
INSERT INTO mpp21090_xchange_pttab_dropcol_idx_dml_int VALUES(10000,10000,'a',0, 10000);
SELECT * FROM mpp21090_xchange_pttab_dropcol_idx_dml_int ORDER BY 1,2,3,4;
 col1  | col2  | col3 | col4 | col5  
-------+-------+------+------+-------
 10000 | 10000 | a    |    0 | 10000
(1 row)

DROP INDEX IF EXISTS mpp21090_xchange_pttab_dropcol_idx_dml_idx_int;
NOTICE:  index "mpp21090_xchange_pttab_dropcol_idx_dml_idx_int" does not exist, skipping
CREATE INDEX mpp21090_xchange_pttab_dropcol_idx_dml_idx_int on mpp21090_xchange_pttab_dropcol_idx_dml_int(col2);
NOTICE:  building index for child partition "mpp21090_xchange_pttab_dropcol_idx_dml_int_1_prt_partone"
NOTICE:  building index for child partition "mpp21090_xchange_pttab_dropcol_idx_dml_int_1_prt_parttwo"
NOTICE:  building index for child partition "mpp21090_xchange_pttab_dropcol_idx_dml_int_1_prt_partthree"
ALTER TABLE mpp21090_xchange_pttab_dropcol_idx_dml_int DROP COLUMN col1;
NOTICE:  Dropping a column that is part of the distribution policy forces a NULL distribution policy
NOTICE:  Dropping a column that is part of the distribution policy forces a NULL distribution policy
NOTICE:  Dropping a column that is part of the distribution policy forces a NULL distribution policy
NOTICE:  Dropping a column that is part of the distribution policy forces a NULL distribution policy
-- Create Candidate table for Exchange
DROP TABLE IF EXISTS mpp21090_xchange_pttab_dropcol_idx_dml_int_candidate;
NOTICE:  table "mpp21090_xchange_pttab_dropcol_idx_dml_int_candidate" does not exist, skipping
CREATE TABLE mpp21090_xchange_pttab_dropcol_idx_dml_int_candidate( like mpp21090_xchange_pttab_dropcol_idx_dml_int) distributed randomly;
INSERT INTO mpp21090_xchange_pttab_dropcol_idx_dml_int_candidate VALUES(10000,'z',1,10000);
-- Exchange 
ALTER TABLE mpp21090_xchange_pttab_dropcol_idx_dml_int EXCHANGE PARTITION FOR(5000) WITH TABLE mpp21090_xchange_pttab_dropcol_idx_dml_int_candidate;
NOTICE:  exchanged partition "partone" of relation "mpp21090_xchange_pttab_dropcol_idx_dml_int" with relation "mpp21090_xchange_pttab_dropcol_idx_dml_int_candidate"
SELECT * FROM mpp21090_xchange_pttab_dropcol_idx_dml_int ORDER BY 1,2,3;
 col2  | col3 | col4 | col5  
-------+------+------+-------
 10000 | z    |    1 | 10000
(1 row)

SELECT * FROM mpp21090_xchange_pttab_dropcol_idx_dml_int_candidate ORDER BY 1,2,3;
 col2  | col3 | col4 | col5  
-------+------+------+-------
 10000 | a    |    0 | 10000
(1 row)

-- DML on partition table
INSERT INTO mpp21090_xchange_pttab_dropcol_idx_dml_int SELECT  1000,'b', 1, 1000;
SELECT * FROM mpp21090_xchange_pttab_dropcol_idx_dml_int ORDER BY 1,2,3;
 col2  | col3 | col4 | col5  
-------+------+------+-------
  1000 | b    |    1 |  1000
 10000 | z    |    1 | 10000
(2 rows)

UPDATE mpp21090_xchange_pttab_dropcol_idx_dml_int SET col5 = 35000 WHERE col2 = 1000 AND col5 = 1000;
SELECT * FROM mpp21090_xchange_pttab_dropcol_idx_dml_int ORDER BY 1,2,3;
 col2  | col3 | col4 | col5  
-------+------+------+-------
  1000 | b    |    1 | 35000
 10000 | z    |    1 | 10000
(2 rows)

UPDATE mpp21090_xchange_pttab_dropcol_idx_dml_int SET col2 =10000 WHERE col3='b';
SELECT * FROM mpp21090_xchange_pttab_dropcol_idx_dml_int ORDER BY 1,2,3;
 col2  | col3 | col4 | col5  
-------+------+------+-------
 10000 | b    |    1 | 35000
 10000 | z    |    1 | 10000
(2 rows)

DELETE FROM mpp21090_xchange_pttab_dropcol_idx_dml_int WHERE col3='b';
SELECT * FROM mpp21090_xchange_pttab_dropcol_idx_dml_int ORDER BY 1,2,3;
 col2  | col3 | col4 | col5  
-------+------+------+-------
 10000 | z    |    1 | 10000
(1 row)

-- DML on candidate table
INSERT INTO mpp21090_xchange_pttab_dropcol_idx_dml_int_candidate SELECT 1000,'b', 1, 1000;
SELECT * FROM mpp21090_xchange_pttab_dropcol_idx_dml_int_candidate ORDER BY 1,2,3;
 col2  | col3 | col4 | col5  
-------+------+------+-------
  1000 | b    |    1 |  1000
 10000 | a    |    0 | 10000
(2 rows)

UPDATE mpp21090_xchange_pttab_dropcol_idx_dml_int_candidate SET col2=10000 WHERE col3='a';
SELECT * FROM mpp21090_xchange_pttab_dropcol_idx_dml_int_candidate ORDER BY 1,2,3;
 col2  | col3 | col4 | col5  
-------+------+------+-------
  1000 | b    |    1 |  1000
 10000 | a    |    0 | 10000
(2 rows)

DELETE FROM mpp21090_xchange_pttab_dropcol_idx_dml_int_candidate WHERE col3='a';
SELECT * FROM mpp21090_xchange_pttab_dropcol_idx_dml_int_candidate ORDER BY 1,2,3;
 col2 | col3 | col4 | col5 
------+------+------+------
 1000 | b    |    1 | 1000
(1 row)

-- @author prabhd 
-- @created 2014-04-01 12:00:00
-- @modified 2012-04-01 12:00:00
-- @tags dml MPP-21090 ORCA
-- @optimizer_mode on	
-- @description Tests for MPP-21090
\echo --start_ignore
--start_ignore
\echo --end_ignore
--end_ignore
DROP TABLE IF EXISTS mpp21090_xchange_pttab_dropcol_idx_dml_int4;
NOTICE:  table "mpp21090_xchange_pttab_dropcol_idx_dml_int4" does not exist, skipping
CREATE TABLE mpp21090_xchange_pttab_dropcol_idx_dml_int4
(
    col1 int4,
    col2 int4,
    col3 char,
    col4 int,
    col5 int4
) 
DISTRIBUTED by (col1)
PARTITION BY RANGE(col2)(partition partone start(1) end(100000001)  WITH (APPENDONLY=true, COMPRESSLEVEL=5, ORIENTATION=column),partition parttwo start(100000001) end(200000001) WITH (APPENDONLY=true, COMPRESSLEVEL=5, ORIENTATION=row),partition partthree start(200000001) end(300000001));
NOTICE:  CREATE TABLE will create partition "mpp21090_xchange_pttab_dropcol_idx_dml_int4_1_prt_partone" for table "mpp21090_xchange_pttab_dropcol_idx_dml_int4"
NOTICE:  CREATE TABLE will create partition "mpp21090_xchange_pttab_dropcol_idx_dml_int4_1_prt_parttwo" for table "mpp21090_xchange_pttab_dropcol_idx_dml_int4"
NOTICE:  CREATE TABLE will create partition "mpp21090_xchange_pttab_dropcol_idx_dml_int4_1_prt_partthree" for table "mpp21090_xchange_pttab_dropcol_idx_dml_int4"
INSERT INTO mpp21090_xchange_pttab_dropcol_idx_dml_int4 VALUES(20000000,20000000,'a',0, 20000000);
SELECT * FROM mpp21090_xchange_pttab_dropcol_idx_dml_int4 ORDER BY 1,2,3,4;
   col1   |   col2   | col3 | col4 |   col5   
----------+----------+------+------+----------
 20000000 | 20000000 | a    |    0 | 20000000
(1 row)

DROP INDEX IF EXISTS mpp21090_xchange_pttab_dropcol_idx_dml_idx_int4;
NOTICE:  index "mpp21090_xchange_pttab_dropcol_idx_dml_idx_int4" does not exist, skipping
CREATE INDEX mpp21090_xchange_pttab_dropcol_idx_dml_idx_int4 on mpp21090_xchange_pttab_dropcol_idx_dml_int4(col2);
NOTICE:  building index for child partition "mpp21090_xchange_pttab_dropcol_idx_dml_int4_1_prt_partone"
NOTICE:  building index for child partition "mpp21090_xchange_pttab_dropcol_idx_dml_int4_1_prt_parttwo"
NOTICE:  building index for child partition "mpp21090_xchange_pttab_dropcol_idx_dml_int4_1_prt_partthree"
ALTER TABLE mpp21090_xchange_pttab_dropcol_idx_dml_int4 DROP COLUMN col1;
NOTICE:  Dropping a column that is part of the distribution policy forces a NULL distribution policy
NOTICE:  Dropping a column that is part of the distribution policy forces a NULL distribution policy
NOTICE:  Dropping a column that is part of the distribution policy forces a NULL distribution policy
NOTICE:  Dropping a column that is part of the distribution policy forces a NULL distribution policy
-- Create Candidate table for Exchange
DROP TABLE IF EXISTS mpp21090_xchange_pttab_dropcol_idx_dml_int4_candidate;
NOTICE:  table "mpp21090_xchange_pttab_dropcol_idx_dml_int4_candidate" does not exist, skipping
CREATE TABLE mpp21090_xchange_pttab_dropcol_idx_dml_int4_candidate( like mpp21090_xchange_pttab_dropcol_idx_dml_int4) distributed randomly;
INSERT INTO mpp21090_xchange_pttab_dropcol_idx_dml_int4_candidate VALUES(20000000,'z',1,20000000);
-- Exchange 
ALTER TABLE mpp21090_xchange_pttab_dropcol_idx_dml_int4 EXCHANGE PARTITION FOR(50000000) WITH TABLE mpp21090_xchange_pttab_dropcol_idx_dml_int4_candidate;
NOTICE:  exchanged partition "partone" of relation "mpp21090_xchange_pttab_dropcol_idx_dml_int4" with relation "mpp21090_xchange_pttab_dropcol_idx_dml_int4_candidate"
SELECT * FROM mpp21090_xchange_pttab_dropcol_idx_dml_int4 ORDER BY 1,2,3;
   col2   | col3 | col4 |   col5   
----------+------+------+----------
 20000000 | z    |    1 | 20000000
(1 row)

SELECT * FROM mpp21090_xchange_pttab_dropcol_idx_dml_int4_candidate ORDER BY 1,2,3;
   col2   | col3 | col4 |   col5   
----------+------+------+----------
 20000000 | a    |    0 | 20000000
(1 row)

-- DML on partition table
INSERT INTO mpp21090_xchange_pttab_dropcol_idx_dml_int4 SELECT  10000000,'b', 1, 10000000;
SELECT * FROM mpp21090_xchange_pttab_dropcol_idx_dml_int4 ORDER BY 1,2,3;
   col2   | col3 | col4 |   col5   
----------+------+------+----------
 10000000 | b    |    1 | 10000000
 20000000 | z    |    1 | 20000000
(2 rows)

UPDATE mpp21090_xchange_pttab_dropcol_idx_dml_int4 SET col5 = 350000000 WHERE col2 = 10000000 AND col5 = 10000000;
SELECT * FROM mpp21090_xchange_pttab_dropcol_idx_dml_int4 ORDER BY 1,2,3;
   col2   | col3 | col4 |   col5    
----------+------+------+-----------
 10000000 | b    |    1 | 350000000
 20000000 | z    |    1 |  20000000
(2 rows)

UPDATE mpp21090_xchange_pttab_dropcol_idx_dml_int4 SET col2 =20000000 WHERE col3='b';
SELECT * FROM mpp21090_xchange_pttab_dropcol_idx_dml_int4 ORDER BY 1,2,3;
   col2   | col3 | col4 |   col5    
----------+------+------+-----------
 20000000 | b    |    1 | 350000000
 20000000 | z    |    1 |  20000000
(2 rows)

DELETE FROM mpp21090_xchange_pttab_dropcol_idx_dml_int4 WHERE col3='b';
SELECT * FROM mpp21090_xchange_pttab_dropcol_idx_dml_int4 ORDER BY 1,2,3;
   col2   | col3 | col4 |   col5   
----------+------+------+----------
 20000000 | z    |    1 | 20000000
(1 row)

-- DML on candidate table
INSERT INTO mpp21090_xchange_pttab_dropcol_idx_dml_int4_candidate SELECT 10000000,'b', 1, 10000000;
SELECT * FROM mpp21090_xchange_pttab_dropcol_idx_dml_int4_candidate ORDER BY 1,2,3;
   col2   | col3 | col4 |   col5   
----------+------+------+----------
 10000000 | b    |    1 | 10000000
 20000000 | a    |    0 | 20000000
(2 rows)

UPDATE mpp21090_xchange_pttab_dropcol_idx_dml_int4_candidate SET col2=20000000 WHERE col3='a';
SELECT * FROM mpp21090_xchange_pttab_dropcol_idx_dml_int4_candidate ORDER BY 1,2,3;
   col2   | col3 | col4 |   col5   
----------+------+------+----------
 10000000 | b    |    1 | 10000000
 20000000 | a    |    0 | 20000000
(2 rows)

DELETE FROM mpp21090_xchange_pttab_dropcol_idx_dml_int4_candidate WHERE col3='a';
SELECT * FROM mpp21090_xchange_pttab_dropcol_idx_dml_int4_candidate ORDER BY 1,2,3;
   col2   | col3 | col4 |   col5   
----------+------+------+----------
 10000000 | b    |    1 | 10000000
(1 row)

-- @author prabhd 
-- @created 2014-04-01 12:00:00
-- @modified 2012-04-01 12:00:00
-- @tags dml MPP-21090 ORCA
-- @optimizer_mode on	
-- @description Tests for MPP-21090
\echo --start_ignore
--start_ignore
\echo --end_ignore
--end_ignore
DROP TABLE IF EXISTS mpp21090_xchange_pttab_dropcol_idx_dml_int8;
NOTICE:  table "mpp21090_xchange_pttab_dropcol_idx_dml_int8" does not exist, skipping
CREATE TABLE mpp21090_xchange_pttab_dropcol_idx_dml_int8
(
    col1 int8,
    col2 int8,
    col3 char,
    col4 int,
    col5 int8
) 
DISTRIBUTED by (col1)
PARTITION BY RANGE(col2)(partition partone start(1) end(1000000000000000001)  WITH (APPENDONLY=true, COMPRESSLEVEL=5, ORIENTATION=column),partition parttwo start(1000000000000000001) end(2000000000000000001) WITH (APPENDONLY=true, COMPRESSLEVEL=5, ORIENTATION=row),partition partthree start(2000000000000000001) end(3000000000000000001));
NOTICE:  CREATE TABLE will create partition "mpp21090_xchange_pttab_dropcol_idx_dml_int8_1_prt_partone" for table "mpp21090_xchange_pttab_dropcol_idx_dml_int8"
NOTICE:  CREATE TABLE will create partition "mpp21090_xchange_pttab_dropcol_idx_dml_int8_1_prt_parttwo" for table "mpp21090_xchange_pttab_dropcol_idx_dml_int8"
NOTICE:  CREATE TABLE will create partition "mpp21090_xchange_pttab_dropcol_idx_dml_int8_1_prt_partthree" for table "mpp21090_xchange_pttab_dropcol_idx_dml_int8"
INSERT INTO mpp21090_xchange_pttab_dropcol_idx_dml_int8 VALUES(200000000000000000,200000000000000000,'a',0, 200000000000000000);
SELECT * FROM mpp21090_xchange_pttab_dropcol_idx_dml_int8 ORDER BY 1,2,3,4;
        col1        |        col2        | col3 | col4 |        col5        
--------------------+--------------------+------+------+--------------------
 200000000000000000 | 200000000000000000 | a    |    0 | 200000000000000000
(1 row)

DROP INDEX IF EXISTS mpp21090_xchange_pttab_dropcol_idx_dml_idx_int8;
NOTICE:  index "mpp21090_xchange_pttab_dropcol_idx_dml_idx_int8" does not exist, skipping
CREATE INDEX mpp21090_xchange_pttab_dropcol_idx_dml_idx_int8 on mpp21090_xchange_pttab_dropcol_idx_dml_int8(col2);
NOTICE:  building index for child partition "mpp21090_xchange_pttab_dropcol_idx_dml_int8_1_prt_partone"
NOTICE:  building index for child partition "mpp21090_xchange_pttab_dropcol_idx_dml_int8_1_prt_parttwo"
NOTICE:  building index for child partition "mpp21090_xchange_pttab_dropcol_idx_dml_int8_1_prt_partthree"
ALTER TABLE mpp21090_xchange_pttab_dropcol_idx_dml_int8 DROP COLUMN col1;
NOTICE:  Dropping a column that is part of the distribution policy forces a NULL distribution policy
NOTICE:  Dropping a column that is part of the distribution policy forces a NULL distribution policy
NOTICE:  Dropping a column that is part of the distribution policy forces a NULL distribution policy
NOTICE:  Dropping a column that is part of the distribution policy forces a NULL distribution policy
-- Create Candidate table for Exchange
DROP TABLE IF EXISTS mpp21090_xchange_pttab_dropcol_idx_dml_int8_candidate;
NOTICE:  table "mpp21090_xchange_pttab_dropcol_idx_dml_int8_candidate" does not exist, skipping
CREATE TABLE mpp21090_xchange_pttab_dropcol_idx_dml_int8_candidate( like mpp21090_xchange_pttab_dropcol_idx_dml_int8) distributed randomly;
INSERT INTO mpp21090_xchange_pttab_dropcol_idx_dml_int8_candidate VALUES(200000000000000000,'z',1,200000000000000000);
-- Exchange 
ALTER TABLE mpp21090_xchange_pttab_dropcol_idx_dml_int8 EXCHANGE PARTITION FOR(500000000000000000) WITH TABLE mpp21090_xchange_pttab_dropcol_idx_dml_int8_candidate;
NOTICE:  exchanged partition "partone" of relation "mpp21090_xchange_pttab_dropcol_idx_dml_int8" with relation "mpp21090_xchange_pttab_dropcol_idx_dml_int8_candidate"
SELECT * FROM mpp21090_xchange_pttab_dropcol_idx_dml_int8 ORDER BY 1,2,3;
        col2        | col3 | col4 |        col5        
--------------------+------+------+--------------------
 200000000000000000 | z    |    1 | 200000000000000000
(1 row)

SELECT * FROM mpp21090_xchange_pttab_dropcol_idx_dml_int8_candidate ORDER BY 1,2,3;
        col2        | col3 | col4 |        col5        
--------------------+------+------+--------------------
 200000000000000000 | a    |    0 | 200000000000000000
(1 row)

-- DML on partition table
INSERT INTO mpp21090_xchange_pttab_dropcol_idx_dml_int8 SELECT  100000000000000000,'b', 1, 100000000000000000;
SELECT * FROM mpp21090_xchange_pttab_dropcol_idx_dml_int8 ORDER BY 1,2,3;
        col2        | col3 | col4 |        col5        
--------------------+------+------+--------------------
 100000000000000000 | b    |    1 | 100000000000000000
 200000000000000000 | z    |    1 | 200000000000000000
(2 rows)

UPDATE mpp21090_xchange_pttab_dropcol_idx_dml_int8 SET col5 = 3500000000000000000 WHERE col2 = 100000000000000000 AND col5 = 100000000000000000;
SELECT * FROM mpp21090_xchange_pttab_dropcol_idx_dml_int8 ORDER BY 1,2,3;
        col2        | col3 | col4 |        col5         
--------------------+------+------+---------------------
 100000000000000000 | b    |    1 | 3500000000000000000
 200000000000000000 | z    |    1 |  200000000000000000
(2 rows)

UPDATE mpp21090_xchange_pttab_dropcol_idx_dml_int8 SET col2 =200000000000000000 WHERE col3='b';
SELECT * FROM mpp21090_xchange_pttab_dropcol_idx_dml_int8 ORDER BY 1,2,3;
        col2        | col3 | col4 |        col5         
--------------------+------+------+---------------------
 200000000000000000 | b    |    1 | 3500000000000000000
 200000000000000000 | z    |    1 |  200000000000000000
(2 rows)

DELETE FROM mpp21090_xchange_pttab_dropcol_idx_dml_int8 WHERE col3='b';
SELECT * FROM mpp21090_xchange_pttab_dropcol_idx_dml_int8 ORDER BY 1,2,3;
        col2        | col3 | col4 |        col5        
--------------------+------+------+--------------------
 200000000000000000 | z    |    1 | 200000000000000000
(1 row)

-- DML on candidate table
INSERT INTO mpp21090_xchange_pttab_dropcol_idx_dml_int8_candidate SELECT 100000000000000000,'b', 1, 100000000000000000;
SELECT * FROM mpp21090_xchange_pttab_dropcol_idx_dml_int8_candidate ORDER BY 1,2,3;
        col2        | col3 | col4 |        col5        
--------------------+------+------+--------------------
 100000000000000000 | b    |    1 | 100000000000000000
 200000000000000000 | a    |    0 | 200000000000000000
(2 rows)

UPDATE mpp21090_xchange_pttab_dropcol_idx_dml_int8_candidate SET col2=200000000000000000 WHERE col3='a';
SELECT * FROM mpp21090_xchange_pttab_dropcol_idx_dml_int8_candidate ORDER BY 1,2,3;
        col2        | col3 | col4 |        col5        
--------------------+------+------+--------------------
 100000000000000000 | b    |    1 | 100000000000000000
 200000000000000000 | a    |    0 | 200000000000000000
(2 rows)

DELETE FROM mpp21090_xchange_pttab_dropcol_idx_dml_int8_candidate WHERE col3='a';
SELECT * FROM mpp21090_xchange_pttab_dropcol_idx_dml_int8_candidate ORDER BY 1,2,3;
        col2        | col3 | col4 |        col5        
--------------------+------+------+--------------------
 100000000000000000 | b    |    1 | 100000000000000000
(1 row)

-- @author prabhd 
-- @created 2014-04-01 12:00:00
-- @modified 2012-04-01 12:00:00
-- @tags dml MPP-21090 ORCA
-- @optimizer_mode on	
-- @description Tests for MPP-21090
\echo --start_ignore
--start_ignore
\echo --end_ignore
--end_ignore
DROP TABLE IF EXISTS mpp21090_xchange_pttab_dropcol_idx_dml_interval;
NOTICE:  table "mpp21090_xchange_pttab_dropcol_idx_dml_interval" does not exist, skipping
CREATE TABLE mpp21090_xchange_pttab_dropcol_idx_dml_interval
(
    col1 interval,
    col2 interval,
    col3 char,
    col4 int,
    col5 interval
) 
DISTRIBUTED by (col1)
PARTITION BY RANGE(col2)(partition partone start('1 sec') end('1 min')  WITH (APPENDONLY=true, COMPRESSLEVEL=5, ORIENTATION=column),partition parttwo start('1 min') end('1 hour') WITH (APPENDONLY=true, COMPRESSLEVEL=5, ORIENTATION=row),partition partthree start('1 hour') end('12 hours'));
NOTICE:  CREATE TABLE will create partition "mpp21090_xchange_pttab_dropcol_idx_dml_interval_1_prt_partone" for table "mpp21090_xchange_pttab_dropcol_idx_dml_interval"
NOTICE:  CREATE TABLE will create partition "mpp21090_xchange_pttab_dropcol_idx_dml_interval_1_prt_parttwo" for table "mpp21090_xchange_pttab_dropcol_idx_dml_interval"
NOTICE:  CREATE TABLE will create partition "mpp21090_xchange_pttab_dropcol_idx_dml_interval_1_prt_partthree" for table "mpp21090_xchange_pttab_dropcol_idx_dml_interval"
INSERT INTO mpp21090_xchange_pttab_dropcol_idx_dml_interval VALUES('10 secs','10 secs','a',0, '10 secs');
SELECT * FROM mpp21090_xchange_pttab_dropcol_idx_dml_interval ORDER BY 1,2,3,4;
   col1    |   col2    | col3 | col4 |   col5    
-----------+-----------+------+------+-----------
 @ 10 secs | @ 10 secs | a    |    0 | @ 10 secs
(1 row)

DROP INDEX IF EXISTS mpp21090_xchange_pttab_dropcol_idx_dml_idx_interval;
NOTICE:  index "mpp21090_xchange_pttab_dropcol_idx_dml_idx_interval" does not exist, skipping
CREATE INDEX mpp21090_xchange_pttab_dropcol_idx_dml_idx_interval on mpp21090_xchange_pttab_dropcol_idx_dml_interval(col2);
NOTICE:  building index for child partition "mpp21090_xchange_pttab_dropcol_idx_dml_interval_1_prt_partone"
NOTICE:  building index for child partition "mpp21090_xchange_pttab_dropcol_idx_dml_interval_1_prt_parttwo"
NOTICE:  building index for child partition "mpp21090_xchange_pttab_dropcol_idx_dml_interval_1_prt_partthree"
ALTER TABLE mpp21090_xchange_pttab_dropcol_idx_dml_interval DROP COLUMN col1;
NOTICE:  Dropping a column that is part of the distribution policy forces a NULL distribution policy
NOTICE:  Dropping a column that is part of the distribution policy forces a NULL distribution policy
NOTICE:  Dropping a column that is part of the distribution policy forces a NULL distribution policy
NOTICE:  Dropping a column that is part of the distribution policy forces a NULL distribution policy
-- Create Candidate table for Exchange
DROP TABLE IF EXISTS mpp21090_xchange_pttab_dropcol_idx_dml_interval_candidate;
NOTICE:  table "mpp21090_xchange_pttab_dropcol_idx_dml_interval_candidate" does not exist, skipping
CREATE TABLE mpp21090_xchange_pttab_dropcol_idx_dml_interval_candidate( like mpp21090_xchange_pttab_dropcol_idx_dml_interval) distributed randomly;
INSERT INTO mpp21090_xchange_pttab_dropcol_idx_dml_interval_candidate VALUES('10 secs','z',1,'10 secs');
-- Exchange 
ALTER TABLE mpp21090_xchange_pttab_dropcol_idx_dml_interval EXCHANGE PARTITION FOR('30 secs') WITH TABLE mpp21090_xchange_pttab_dropcol_idx_dml_interval_candidate;
NOTICE:  exchanged partition "partone" of relation "mpp21090_xchange_pttab_dropcol_idx_dml_interval" with relation "mpp21090_xchange_pttab_dropcol_idx_dml_interval_candidate"
SELECT * FROM mpp21090_xchange_pttab_dropcol_idx_dml_interval ORDER BY 1,2,3;
   col2    | col3 | col4 |   col5    
-----------+------+------+-----------
 @ 10 secs | z    |    1 | @ 10 secs
(1 row)

SELECT * FROM mpp21090_xchange_pttab_dropcol_idx_dml_interval_candidate ORDER BY 1,2,3;
   col2    | col3 | col4 |   col5    
-----------+------+------+-----------
 @ 10 secs | a    |    0 | @ 10 secs
(1 row)

-- DML on partition table
INSERT INTO mpp21090_xchange_pttab_dropcol_idx_dml_interval SELECT  '1 sec','b', 1, '1 sec';
SELECT * FROM mpp21090_xchange_pttab_dropcol_idx_dml_interval ORDER BY 1,2,3;
   col2    | col3 | col4 |   col5    
-----------+------+------+-----------
 @ 1 sec   | b    |    1 | @ 1 sec
 @ 10 secs | z    |    1 | @ 10 secs
(2 rows)

UPDATE mpp21090_xchange_pttab_dropcol_idx_dml_interval SET col5 = '14 hours' WHERE col2 = '1 sec' AND col5 = '1 sec';
SELECT * FROM mpp21090_xchange_pttab_dropcol_idx_dml_interval ORDER BY 1,2,3;
   col2    | col3 | col4 |    col5    
-----------+------+------+------------
 @ 1 sec   | b    |    1 | @ 14 hours
 @ 10 secs | z    |    1 | @ 10 secs
(2 rows)

UPDATE mpp21090_xchange_pttab_dropcol_idx_dml_interval SET col2 ='10 secs' WHERE col3='b';
SELECT * FROM mpp21090_xchange_pttab_dropcol_idx_dml_interval ORDER BY 1,2,3;
   col2    | col3 | col4 |    col5    
-----------+------+------+------------
 @ 10 secs | b    |    1 | @ 14 hours
 @ 10 secs | z    |    1 | @ 10 secs
(2 rows)

DELETE FROM mpp21090_xchange_pttab_dropcol_idx_dml_interval WHERE col3='b';
SELECT * FROM mpp21090_xchange_pttab_dropcol_idx_dml_interval ORDER BY 1,2,3;
   col2    | col3 | col4 |   col5    
-----------+------+------+-----------
 @ 10 secs | z    |    1 | @ 10 secs
(1 row)

-- DML on candidate table
INSERT INTO mpp21090_xchange_pttab_dropcol_idx_dml_interval_candidate SELECT '1 sec','b', 1, '1 sec';
SELECT * FROM mpp21090_xchange_pttab_dropcol_idx_dml_interval_candidate ORDER BY 1,2,3;
   col2    | col3 | col4 |   col5    
-----------+------+------+-----------
 @ 1 sec   | b    |    1 | @ 1 sec
 @ 10 secs | a    |    0 | @ 10 secs
(2 rows)

UPDATE mpp21090_xchange_pttab_dropcol_idx_dml_interval_candidate SET col2='10 secs' WHERE col3='a';
SELECT * FROM mpp21090_xchange_pttab_dropcol_idx_dml_interval_candidate ORDER BY 1,2,3;
   col2    | col3 | col4 |   col5    
-----------+------+------+-----------
 @ 1 sec   | b    |    1 | @ 1 sec
 @ 10 secs | a    |    0 | @ 10 secs
(2 rows)

DELETE FROM mpp21090_xchange_pttab_dropcol_idx_dml_interval_candidate WHERE col3='a';
SELECT * FROM mpp21090_xchange_pttab_dropcol_idx_dml_interval_candidate ORDER BY 1,2,3;
  col2   | col3 | col4 |  col5   
---------+------+------+---------
 @ 1 sec | b    |    1 | @ 1 sec
(1 row)

-- @author prabhd 
-- @created 2014-04-01 12:00:00
-- @modified 2012-04-01 12:00:00
-- @tags dml MPP-21090 ORCA
-- @optimizer_mode on	
-- @description Tests for MPP-21090
\echo --start_ignore
--start_ignore
\echo --end_ignore
--end_ignore
DROP TABLE IF EXISTS mpp21090_xchange_pttab_dropcol_idx_dml_numeric;
NOTICE:  table "mpp21090_xchange_pttab_dropcol_idx_dml_numeric" does not exist, skipping
CREATE TABLE mpp21090_xchange_pttab_dropcol_idx_dml_numeric
(
    col1 numeric,
    col2 numeric,
    col3 char,
    col4 int,
    col5 numeric
) 
DISTRIBUTED by (col1)
PARTITION BY RANGE(col2)(partition partone start(1.000000) end(10.000000)  WITH (APPENDONLY=true, COMPRESSLEVEL=5, ORIENTATION=column),partition parttwo start(10.000000) end(20.000000) WITH (APPENDONLY=true, COMPRESSLEVEL=5, ORIENTATION=row),partition partthree start(20.000000) end(30.000000));
NOTICE:  CREATE TABLE will create partition "mpp21090_xchange_pttab_dropcol_idx_dml_numeric_1_prt_partone" for table "mpp21090_xchange_pttab_dropcol_idx_dml_numeric"
NOTICE:  CREATE TABLE will create partition "mpp21090_xchange_pttab_dropcol_idx_dml_numeric_1_prt_parttwo" for table "mpp21090_xchange_pttab_dropcol_idx_dml_numeric"
NOTICE:  CREATE TABLE will create partition "mpp21090_xchange_pttab_dropcol_idx_dml_numeric_1_prt_partthree" for table "mpp21090_xchange_pttab_dropcol_idx_dml_numeric"
INSERT INTO mpp21090_xchange_pttab_dropcol_idx_dml_numeric VALUES(2.000000,2.000000,'a',0, 2.000000);
SELECT * FROM mpp21090_xchange_pttab_dropcol_idx_dml_numeric ORDER BY 1,2,3,4;
   col1   |   col2   | col3 | col4 |   col5   
----------+----------+------+------+----------
 2.000000 | 2.000000 | a    |    0 | 2.000000
(1 row)

DROP INDEX IF EXISTS mpp21090_xchange_pttab_dropcol_idx_dml_idx_numeric;
NOTICE:  index "mpp21090_xchange_pttab_dropcol_idx_dml_idx_numeric" does not exist, skipping
CREATE INDEX mpp21090_xchange_pttab_dropcol_idx_dml_idx_numeric on mpp21090_xchange_pttab_dropcol_idx_dml_numeric(col2);
NOTICE:  building index for child partition "mpp21090_xchange_pttab_dropcol_idx_dml_numeric_1_prt_partone"
NOTICE:  building index for child partition "mpp21090_xchange_pttab_dropcol_idx_dml_numeric_1_prt_parttwo"
NOTICE:  building index for child partition "mpp21090_xchange_pttab_dropcol_idx_dml_numeric_1_prt_partthree"
ALTER TABLE mpp21090_xchange_pttab_dropcol_idx_dml_numeric DROP COLUMN col1;
NOTICE:  Dropping a column that is part of the distribution policy forces a NULL distribution policy
NOTICE:  Dropping a column that is part of the distribution policy forces a NULL distribution policy
NOTICE:  Dropping a column that is part of the distribution policy forces a NULL distribution policy
NOTICE:  Dropping a column that is part of the distribution policy forces a NULL distribution policy
-- Create Candidate table for Exchange
DROP TABLE IF EXISTS mpp21090_xchange_pttab_dropcol_idx_dml_numeric_candidate;
NOTICE:  table "mpp21090_xchange_pttab_dropcol_idx_dml_numeric_candidate" does not exist, skipping
CREATE TABLE mpp21090_xchange_pttab_dropcol_idx_dml_numeric_candidate( like mpp21090_xchange_pttab_dropcol_idx_dml_numeric) distributed randomly;
INSERT INTO mpp21090_xchange_pttab_dropcol_idx_dml_numeric_candidate VALUES(2.000000,'z',1,2.000000);
-- Exchange 
ALTER TABLE mpp21090_xchange_pttab_dropcol_idx_dml_numeric EXCHANGE PARTITION FOR(5.000000) WITH TABLE mpp21090_xchange_pttab_dropcol_idx_dml_numeric_candidate;
NOTICE:  exchanged partition "partone" of relation "mpp21090_xchange_pttab_dropcol_idx_dml_numeric" with relation "mpp21090_xchange_pttab_dropcol_idx_dml_numeric_candidate"
SELECT * FROM mpp21090_xchange_pttab_dropcol_idx_dml_numeric ORDER BY 1,2,3;
   col2   | col3 | col4 |   col5   
----------+------+------+----------
 2.000000 | z    |    1 | 2.000000
(1 row)

SELECT * FROM mpp21090_xchange_pttab_dropcol_idx_dml_numeric_candidate ORDER BY 1,2,3;
   col2   | col3 | col4 |   col5   
----------+------+------+----------
 2.000000 | a    |    0 | 2.000000
(1 row)

-- DML on partition table
INSERT INTO mpp21090_xchange_pttab_dropcol_idx_dml_numeric SELECT  1.000000,'b', 1, 1.000000;
SELECT * FROM mpp21090_xchange_pttab_dropcol_idx_dml_numeric ORDER BY 1,2,3;
   col2   | col3 | col4 |   col5   
----------+------+------+----------
 1.000000 | b    |    1 | 1.000000
 2.000000 | z    |    1 | 2.000000
(2 rows)

UPDATE mpp21090_xchange_pttab_dropcol_idx_dml_numeric SET col5 = 35.000000 WHERE col2 = 1.000000 AND col5 = 1.000000;
SELECT * FROM mpp21090_xchange_pttab_dropcol_idx_dml_numeric ORDER BY 1,2,3;
   col2   | col3 | col4 |   col5    
----------+------+------+-----------
 1.000000 | b    |    1 | 35.000000
 2.000000 | z    |    1 |  2.000000
(2 rows)

UPDATE mpp21090_xchange_pttab_dropcol_idx_dml_numeric SET col2 =2.000000 WHERE col3='b';
SELECT * FROM mpp21090_xchange_pttab_dropcol_idx_dml_numeric ORDER BY 1,2,3;
   col2   | col3 | col4 |   col5    
----------+------+------+-----------
 2.000000 | b    |    1 | 35.000000
 2.000000 | z    |    1 |  2.000000
(2 rows)

DELETE FROM mpp21090_xchange_pttab_dropcol_idx_dml_numeric WHERE col3='b';
SELECT * FROM mpp21090_xchange_pttab_dropcol_idx_dml_numeric ORDER BY 1,2,3;
   col2   | col3 | col4 |   col5   
----------+------+------+----------
 2.000000 | z    |    1 | 2.000000
(1 row)

-- DML on candidate table
INSERT INTO mpp21090_xchange_pttab_dropcol_idx_dml_numeric_candidate SELECT 1.000000,'b', 1, 1.000000;
SELECT * FROM mpp21090_xchange_pttab_dropcol_idx_dml_numeric_candidate ORDER BY 1,2,3;
   col2   | col3 | col4 |   col5   
----------+------+------+----------
 1.000000 | b    |    1 | 1.000000
 2.000000 | a    |    0 | 2.000000
(2 rows)

UPDATE mpp21090_xchange_pttab_dropcol_idx_dml_numeric_candidate SET col2=2.000000 WHERE col3='a';
SELECT * FROM mpp21090_xchange_pttab_dropcol_idx_dml_numeric_candidate ORDER BY 1,2,3;
   col2   | col3 | col4 |   col5   
----------+------+------+----------
 1.000000 | b    |    1 | 1.000000
 2.000000 | a    |    0 | 2.000000
(2 rows)

DELETE FROM mpp21090_xchange_pttab_dropcol_idx_dml_numeric_candidate WHERE col3='a';
SELECT * FROM mpp21090_xchange_pttab_dropcol_idx_dml_numeric_candidate ORDER BY 1,2,3;
   col2   | col3 | col4 |   col5   
----------+------+------+----------
 1.000000 | b    |    1 | 1.000000
(1 row)

-- @author prabhd 
-- @created 2014-04-01 12:00:00
-- @modified 2012-04-01 12:00:00
-- @tags dml MPP-21090 ORCA
-- @optimizer_mode on	
-- @description Tests for MPP-21090
\echo --start_ignore
--start_ignore
\echo --end_ignore
--end_ignore
DROP TABLE IF EXISTS mpp21090_xchange_pttab_dropcol_idx_dml_time;
NOTICE:  table "mpp21090_xchange_pttab_dropcol_idx_dml_time" does not exist, skipping
CREATE TABLE mpp21090_xchange_pttab_dropcol_idx_dml_time
(
    col1 time,
    col2 time,
    col3 char,
    col4 int,
    col5 time
) 
DISTRIBUTED by (col1)
PARTITION BY RANGE(col2)(partition partone start('12:00:00') end('18:00:00')  WITH (APPENDONLY=true, COMPRESSLEVEL=5, ORIENTATION=column),partition parttwo start('18:00:00') end('24:00:00') WITH (APPENDONLY=true, COMPRESSLEVEL=5, ORIENTATION=row),partition partthree start('0:00:00') end('11:00:00'));
NOTICE:  CREATE TABLE will create partition "mpp21090_xchange_pttab_dropcol_idx_dml_time_1_prt_partthree" for table "mpp21090_xchange_pttab_dropcol_idx_dml_time"
NOTICE:  CREATE TABLE will create partition "mpp21090_xchange_pttab_dropcol_idx_dml_time_1_prt_partone" for table "mpp21090_xchange_pttab_dropcol_idx_dml_time"
NOTICE:  CREATE TABLE will create partition "mpp21090_xchange_pttab_dropcol_idx_dml_time_1_prt_parttwo" for table "mpp21090_xchange_pttab_dropcol_idx_dml_time"
INSERT INTO mpp21090_xchange_pttab_dropcol_idx_dml_time VALUES('12:00:00','12:00:00','a',0, '12:00:00');
SELECT * FROM mpp21090_xchange_pttab_dropcol_idx_dml_time ORDER BY 1,2,3,4;
   col1   |   col2   | col3 | col4 |   col5   
----------+----------+------+------+----------
 12:00:00 | 12:00:00 | a    |    0 | 12:00:00
(1 row)

DROP INDEX IF EXISTS mpp21090_xchange_pttab_dropcol_idx_dml_idx_time;
NOTICE:  index "mpp21090_xchange_pttab_dropcol_idx_dml_idx_time" does not exist, skipping
CREATE INDEX mpp21090_xchange_pttab_dropcol_idx_dml_idx_time on mpp21090_xchange_pttab_dropcol_idx_dml_time(col2);
NOTICE:  building index for child partition "mpp21090_xchange_pttab_dropcol_idx_dml_time_1_prt_partthree"
NOTICE:  building index for child partition "mpp21090_xchange_pttab_dropcol_idx_dml_time_1_prt_partone"
NOTICE:  building index for child partition "mpp21090_xchange_pttab_dropcol_idx_dml_time_1_prt_parttwo"
ALTER TABLE mpp21090_xchange_pttab_dropcol_idx_dml_time DROP COLUMN col1;
NOTICE:  Dropping a column that is part of the distribution policy forces a NULL distribution policy
NOTICE:  Dropping a column that is part of the distribution policy forces a NULL distribution policy
NOTICE:  Dropping a column that is part of the distribution policy forces a NULL distribution policy
NOTICE:  Dropping a column that is part of the distribution policy forces a NULL distribution policy
-- Create Candidate table for Exchange
DROP TABLE IF EXISTS mpp21090_xchange_pttab_dropcol_idx_dml_time_candidate;
NOTICE:  table "mpp21090_xchange_pttab_dropcol_idx_dml_time_candidate" does not exist, skipping
CREATE TABLE mpp21090_xchange_pttab_dropcol_idx_dml_time_candidate( like mpp21090_xchange_pttab_dropcol_idx_dml_time) distributed randomly;
INSERT INTO mpp21090_xchange_pttab_dropcol_idx_dml_time_candidate VALUES('12:00:00','z',1,'12:00:00');
-- Exchange 
ALTER TABLE mpp21090_xchange_pttab_dropcol_idx_dml_time EXCHANGE PARTITION FOR('15:00:00') WITH TABLE mpp21090_xchange_pttab_dropcol_idx_dml_time_candidate;
NOTICE:  exchanged partition "partone" of relation "mpp21090_xchange_pttab_dropcol_idx_dml_time" with relation "mpp21090_xchange_pttab_dropcol_idx_dml_time_candidate"
SELECT * FROM mpp21090_xchange_pttab_dropcol_idx_dml_time ORDER BY 1,2,3;
   col2   | col3 | col4 |   col5   
----------+------+------+----------
 12:00:00 | z    |    1 | 12:00:00
(1 row)

SELECT * FROM mpp21090_xchange_pttab_dropcol_idx_dml_time_candidate ORDER BY 1,2,3;
   col2   | col3 | col4 |   col5   
----------+------+------+----------
 12:00:00 | a    |    0 | 12:00:00
(1 row)

-- DML on partition table
INSERT INTO mpp21090_xchange_pttab_dropcol_idx_dml_time SELECT  '12:00:00','b', 1, '12:00:00';
SELECT * FROM mpp21090_xchange_pttab_dropcol_idx_dml_time ORDER BY 1,2,3;
   col2   | col3 | col4 |   col5   
----------+------+------+----------
 12:00:00 | b    |    1 | 12:00:00
 12:00:00 | z    |    1 | 12:00:00
(2 rows)

UPDATE mpp21090_xchange_pttab_dropcol_idx_dml_time SET col5 = '11:30:00' WHERE col2 = '12:00:00' AND col5 = '12:00:00';
SELECT * FROM mpp21090_xchange_pttab_dropcol_idx_dml_time ORDER BY 1,2,3;
   col2   | col3 | col4 |   col5   
----------+------+------+----------
 12:00:00 | b    |    1 | 11:30:00
 12:00:00 | z    |    1 | 11:30:00
(2 rows)

UPDATE mpp21090_xchange_pttab_dropcol_idx_dml_time SET col2 ='12:00:00' WHERE col3='b';
SELECT * FROM mpp21090_xchange_pttab_dropcol_idx_dml_time ORDER BY 1,2,3;
   col2   | col3 | col4 |   col5   
----------+------+------+----------
 12:00:00 | b    |    1 | 11:30:00
 12:00:00 | z    |    1 | 11:30:00
(2 rows)

DELETE FROM mpp21090_xchange_pttab_dropcol_idx_dml_time WHERE col3='b';
SELECT * FROM mpp21090_xchange_pttab_dropcol_idx_dml_time ORDER BY 1,2,3;
   col2   | col3 | col4 |   col5   
----------+------+------+----------
 12:00:00 | z    |    1 | 11:30:00
(1 row)

-- DML on candidate table
INSERT INTO mpp21090_xchange_pttab_dropcol_idx_dml_time_candidate SELECT '12:00:00','b', 1, '12:00:00';
SELECT * FROM mpp21090_xchange_pttab_dropcol_idx_dml_time_candidate ORDER BY 1,2,3;
   col2   | col3 | col4 |   col5   
----------+------+------+----------
 12:00:00 | a    |    0 | 12:00:00
 12:00:00 | b    |    1 | 12:00:00
(2 rows)

UPDATE mpp21090_xchange_pttab_dropcol_idx_dml_time_candidate SET col2='12:00:00' WHERE col3='a';
SELECT * FROM mpp21090_xchange_pttab_dropcol_idx_dml_time_candidate ORDER BY 1,2,3;
   col2   | col3 | col4 |   col5   
----------+------+------+----------
 12:00:00 | a    |    0 | 12:00:00
 12:00:00 | b    |    1 | 12:00:00
(2 rows)

DELETE FROM mpp21090_xchange_pttab_dropcol_idx_dml_time_candidate WHERE col3='a';
SELECT * FROM mpp21090_xchange_pttab_dropcol_idx_dml_time_candidate ORDER BY 1,2,3;
   col2   | col3 | col4 |   col5   
----------+------+------+----------
 12:00:00 | b    |    1 | 12:00:00
(1 row)

-- @author prabhd 
-- @created 2014-04-01 12:00:00
-- @modified 2012-04-01 12:00:00
-- @tags dml MPP-21090 ORCA
-- @optimizer_mode on	
-- @description Tests for MPP-21090
\echo --start_ignore
--start_ignore
\echo --end_ignore
--end_ignore
DROP TABLE IF EXISTS mpp21090_xchange_pttab_dropcol_idx_dml_timestamp;
NOTICE:  table "mpp21090_xchange_pttab_dropcol_idx_dml_timestamp" does not exist, skipping
CREATE TABLE mpp21090_xchange_pttab_dropcol_idx_dml_timestamp
(
    col1 timestamp,
    col2 timestamp,
    col3 char,
    col4 int,
    col5 timestamp
) 
DISTRIBUTED by (col1)
PARTITION BY RANGE(col2)(partition partone start('2013-12-01 12:00:00') end('2013-12-31 12:00:00') WITH(APPENDONLY=true, COMPRESSLEVEL=5, ORIENTATION=column),partition parttwo start('2013-12-31 12:00:00') end('2014-01-01 12:00:00') inclusive WITH (APPENDONLY=true, COMPRESSLEVEL=5, ORIENTATION=row),partition partthree start('2014-01-02 12:00:00') end('2014-02-01 12:00:00'));
NOTICE:  CREATE TABLE will create partition "mpp21090_xchange_pttab_dropcol_idx_dml_timestamp_1_prt_partone" for table "mpp21090_xchange_pttab_dropcol_idx_dml_timestamp"
NOTICE:  CREATE TABLE will create partition "mpp21090_xchange_pttab_dropcol_idx_dml_timestamp_1_prt_parttwo" for table "mpp21090_xchange_pttab_dropcol_idx_dml_timestamp"
NOTICE:  CREATE TABLE will create partition "mpp21090_xchange_pttab_dropcol_idx_dml_timestam_1_prt_partthree" for table "mpp21090_xchange_pttab_dropcol_idx_dml_timestamp"
INSERT INTO mpp21090_xchange_pttab_dropcol_idx_dml_timestamp VALUES('2013-12-30 12:00:00','2013-12-30 12:00:00','a',0, '2013-12-30 12:00:00');
SELECT * FROM mpp21090_xchange_pttab_dropcol_idx_dml_timestamp ORDER BY 1,2,3,4;
           col1           |           col2           | col3 | col4 |           col5           
--------------------------+--------------------------+------+------+--------------------------
 Mon Dec 30 12:00:00 2013 | Mon Dec 30 12:00:00 2013 | a    |    0 | Mon Dec 30 12:00:00 2013
(1 row)

DROP INDEX IF EXISTS mpp21090_xchange_pttab_dropcol_idx_dml_idx_timestamp;
NOTICE:  index "mpp21090_xchange_pttab_dropcol_idx_dml_idx_timestamp" does not exist, skipping
CREATE INDEX mpp21090_xchange_pttab_dropcol_idx_dml_idx_timestamp on mpp21090_xchange_pttab_dropcol_idx_dml_timestamp(col2);
NOTICE:  building index for child partition "mpp21090_xchange_pttab_dropcol_idx_dml_timestamp_1_prt_partone"
NOTICE:  building index for child partition "mpp21090_xchange_pttab_dropcol_idx_dml_timestamp_1_prt_parttwo"
NOTICE:  building index for child partition "mpp21090_xchange_pttab_dropcol_idx_dml_timestam_1_prt_partthree"
ALTER TABLE mpp21090_xchange_pttab_dropcol_idx_dml_timestamp DROP COLUMN col1;
NOTICE:  Dropping a column that is part of the distribution policy forces a NULL distribution policy
NOTICE:  Dropping a column that is part of the distribution policy forces a NULL distribution policy
NOTICE:  Dropping a column that is part of the distribution policy forces a NULL distribution policy
NOTICE:  Dropping a column that is part of the distribution policy forces a NULL distribution policy
-- Create Candidate table for Exchange
DROP TABLE IF EXISTS mpp21090_xchange_pttab_dropcol_idx_dml_timestamp_candidate;
NOTICE:  table "mpp21090_xchange_pttab_dropcol_idx_dml_timestamp_candidate" does not exist, skipping
CREATE TABLE mpp21090_xchange_pttab_dropcol_idx_dml_timestamp_candidate( like mpp21090_xchange_pttab_dropcol_idx_dml_timestamp) distributed randomly;
INSERT INTO mpp21090_xchange_pttab_dropcol_idx_dml_timestamp_candidate VALUES('2013-12-30 12:00:00','z',1,'2013-12-30 12:00:00');
-- Exchange 
ALTER TABLE mpp21090_xchange_pttab_dropcol_idx_dml_timestamp EXCHANGE PARTITION FOR('2013-12-15 12:00:00') WITH TABLE mpp21090_xchange_pttab_dropcol_idx_dml_timestamp_candidate;
NOTICE:  exchanged partition "partone" of relation "mpp21090_xchange_pttab_dropcol_idx_dml_timestamp" with relation "mpp21090_xchange_pttab_dropcol_idx_dml_timestamp_candidate"
SELECT * FROM mpp21090_xchange_pttab_dropcol_idx_dml_timestamp ORDER BY 1,2,3;
           col2           | col3 | col4 |           col5           
--------------------------+------+------+--------------------------
 Mon Dec 30 12:00:00 2013 | z    |    1 | Mon Dec 30 12:00:00 2013
(1 row)

SELECT * FROM mpp21090_xchange_pttab_dropcol_idx_dml_timestamp_candidate ORDER BY 1,2,3;
           col2           | col3 | col4 |           col5           
--------------------------+------+------+--------------------------
 Mon Dec 30 12:00:00 2013 | a    |    0 | Mon Dec 30 12:00:00 2013
(1 row)

-- DML on partition table
INSERT INTO mpp21090_xchange_pttab_dropcol_idx_dml_timestamp SELECT  '2013-12-01 12:00:00','b', 1, '2013-12-01 12:00:00';
SELECT * FROM mpp21090_xchange_pttab_dropcol_idx_dml_timestamp ORDER BY 1,2,3;
           col2           | col3 | col4 |           col5           
--------------------------+------+------+--------------------------
 Sun Dec 01 12:00:00 2013 | b    |    1 | Sun Dec 01 12:00:00 2013
 Mon Dec 30 12:00:00 2013 | z    |    1 | Mon Dec 30 12:00:00 2013
(2 rows)

UPDATE mpp21090_xchange_pttab_dropcol_idx_dml_timestamp SET col5 = '2014-02-10 12:00:00' WHERE col2 = '2013-12-01 12:00:00' AND col5 = '2013-12-01 12:00:00';
SELECT * FROM mpp21090_xchange_pttab_dropcol_idx_dml_timestamp ORDER BY 1,2,3;
           col2           | col3 | col4 |           col5           
--------------------------+------+------+--------------------------
 Sun Dec 01 12:00:00 2013 | b    |    1 | Mon Feb 10 12:00:00 2014
 Mon Dec 30 12:00:00 2013 | z    |    1 | Mon Dec 30 12:00:00 2013
(2 rows)

UPDATE mpp21090_xchange_pttab_dropcol_idx_dml_timestamp SET col2 ='2013-12-30 12:00:00' WHERE col3='b';
SELECT * FROM mpp21090_xchange_pttab_dropcol_idx_dml_timestamp ORDER BY 1,2,3;
           col2           | col3 | col4 |           col5           
--------------------------+------+------+--------------------------
 Mon Dec 30 12:00:00 2013 | b    |    1 | Mon Feb 10 12:00:00 2014
 Mon Dec 30 12:00:00 2013 | z    |    1 | Mon Dec 30 12:00:00 2013
(2 rows)

DELETE FROM mpp21090_xchange_pttab_dropcol_idx_dml_timestamp WHERE col3='b';
SELECT * FROM mpp21090_xchange_pttab_dropcol_idx_dml_timestamp ORDER BY 1,2,3;
           col2           | col3 | col4 |           col5           
--------------------------+------+------+--------------------------
 Mon Dec 30 12:00:00 2013 | z    |    1 | Mon Dec 30 12:00:00 2013
(1 row)

-- DML on candidate table
INSERT INTO mpp21090_xchange_pttab_dropcol_idx_dml_timestamp_candidate SELECT '2013-12-01 12:00:00','b', 1, '2013-12-01 12:00:00';
SELECT * FROM mpp21090_xchange_pttab_dropcol_idx_dml_timestamp_candidate ORDER BY 1,2,3;
           col2           | col3 | col4 |           col5           
--------------------------+------+------+--------------------------
 Sun Dec 01 12:00:00 2013 | b    |    1 | Sun Dec 01 12:00:00 2013
 Mon Dec 30 12:00:00 2013 | a    |    0 | Mon Dec 30 12:00:00 2013
(2 rows)

UPDATE mpp21090_xchange_pttab_dropcol_idx_dml_timestamp_candidate SET col2='2013-12-30 12:00:00' WHERE col3='a';
SELECT * FROM mpp21090_xchange_pttab_dropcol_idx_dml_timestamp_candidate ORDER BY 1,2,3;
           col2           | col3 | col4 |           col5           
--------------------------+------+------+--------------------------
 Sun Dec 01 12:00:00 2013 | b    |    1 | Sun Dec 01 12:00:00 2013
 Mon Dec 30 12:00:00 2013 | a    |    0 | Mon Dec 30 12:00:00 2013
(2 rows)

DELETE FROM mpp21090_xchange_pttab_dropcol_idx_dml_timestamp_candidate WHERE col3='a';
SELECT * FROM mpp21090_xchange_pttab_dropcol_idx_dml_timestamp_candidate ORDER BY 1,2,3;
           col2           | col3 | col4 |           col5           
--------------------------+------+------+--------------------------
 Sun Dec 01 12:00:00 2013 | b    |    1 | Sun Dec 01 12:00:00 2013
(1 row)

-- @author prabhd 
-- @created 2014-04-01 12:00:00
-- @modified 2012-04-01 12:00:00
-- @tags dml MPP-21090 ORCA
-- @optimizer_mode on	
-- @description Tests for MPP-21090
\echo --start_ignore
--start_ignore
\echo --end_ignore
--end_ignore
DROP TABLE IF EXISTS mpp21090_xchange_pttab_dropcol_idx_dml_timestamptz;
NOTICE:  table "mpp21090_xchange_pttab_dropcol_idx_dml_timestamptz" does not exist, skipping
CREATE TABLE mpp21090_xchange_pttab_dropcol_idx_dml_timestamptz
(
    col1 timestamptz,
    col2 timestamptz,
    col3 char,
    col4 int,
    col5 timestamptz
) 
DISTRIBUTED by (col1)
PARTITION BY RANGE(col2)(partition partone start('2013-12-01 12:00:00 PST') end('2013-12-31 12:00:00 PST') WITH(APPENDONLY=true, COMPRESSLEVEL=5, ORIENTATION=column),partition parttwo start('2013-12-31 12:00:00 PST') end('2014-01-01 12:00:00 PST') WITH (APPENDONLY=true, COMPRESSLEVEL=5, ORIENTATION=row),partition partthree start('2014-01-01 12:00:00 PST') end('2014-02-01 12:00:00 PST'));
NOTICE:  CREATE TABLE will create partition "mpp21090_xchange_pttab_dropcol_idx_dml_timestampt_1_prt_partone" for table "mpp21090_xchange_pttab_dropcol_idx_dml_timestamptz"
NOTICE:  CREATE TABLE will create partition "mpp21090_xchange_pttab_dropcol_idx_dml_timestampt_1_prt_parttwo" for table "mpp21090_xchange_pttab_dropcol_idx_dml_timestamptz"
NOTICE:  CREATE TABLE will create partition "mpp21090_xchange_pttab_dropcol_idx_dml_timesta_1_prt_partthree1" for table "mpp21090_xchange_pttab_dropcol_idx_dml_timestamptz"
INSERT INTO mpp21090_xchange_pttab_dropcol_idx_dml_timestamptz VALUES('2013-12-30 12:00:00 PST','2013-12-30 12:00:00 PST','a',0, '2013-12-30 12:00:00 PST');
SELECT * FROM mpp21090_xchange_pttab_dropcol_idx_dml_timestamptz ORDER BY 1,2,3,4;
             col1             |             col2             | col3 | col4 |             col5             
------------------------------+------------------------------+------+------+------------------------------
 Mon Dec 30 12:00:00 2013 PST | Mon Dec 30 12:00:00 2013 PST | a    |    0 | Mon Dec 30 12:00:00 2013 PST
(1 row)

DROP INDEX IF EXISTS mpp21090_xchange_pttab_dropcol_idx_dml_idx_timestamptz;
NOTICE:  index "mpp21090_xchange_pttab_dropcol_idx_dml_idx_timestamptz" does not exist, skipping
CREATE INDEX mpp21090_xchange_pttab_dropcol_idx_dml_idx_timestamptz on mpp21090_xchange_pttab_dropcol_idx_dml_timestamptz(col2);
NOTICE:  building index for child partition "mpp21090_xchange_pttab_dropcol_idx_dml_timestampt_1_prt_partone"
NOTICE:  building index for child partition "mpp21090_xchange_pttab_dropcol_idx_dml_timestampt_1_prt_parttwo"
NOTICE:  building index for child partition "mpp21090_xchange_pttab_dropcol_idx_dml_timesta_1_prt_partthree1"
ALTER TABLE mpp21090_xchange_pttab_dropcol_idx_dml_timestamptz DROP COLUMN col1;
NOTICE:  Dropping a column that is part of the distribution policy forces a NULL distribution policy
NOTICE:  Dropping a column that is part of the distribution policy forces a NULL distribution policy
NOTICE:  Dropping a column that is part of the distribution policy forces a NULL distribution policy
NOTICE:  Dropping a column that is part of the distribution policy forces a NULL distribution policy
-- Create Candidate table for Exchange
DROP TABLE IF EXISTS mpp21090_xchange_pttab_dropcol_idx_dml_timestamptz_candidate;
NOTICE:  table "mpp21090_xchange_pttab_dropcol_idx_dml_timestamptz_candidate" does not exist, skipping
CREATE TABLE mpp21090_xchange_pttab_dropcol_idx_dml_timestamptz_candidate( like mpp21090_xchange_pttab_dropcol_idx_dml_timestamptz) distributed randomly;
INSERT INTO mpp21090_xchange_pttab_dropcol_idx_dml_timestamptz_candidate VALUES('2013-12-30 12:00:00 PST','z',1,'2013-12-30 12:00:00 PST');
-- Exchange 
ALTER TABLE mpp21090_xchange_pttab_dropcol_idx_dml_timestamptz EXCHANGE PARTITION FOR('2013-12-15 12:00:00 PST') WITH TABLE mpp21090_xchange_pttab_dropcol_idx_dml_timestamptz_candidate;
NOTICE:  exchanged partition "partone" of relation "mpp21090_xchange_pttab_dropcol_idx_dml_timestamptz" with relation "mpp21090_xchange_pttab_dropcol_idx_dml_timestamptz_candidate"
SELECT * FROM mpp21090_xchange_pttab_dropcol_idx_dml_timestamptz ORDER BY 1,2,3;
             col2             | col3 | col4 |             col5             
------------------------------+------+------+------------------------------
 Mon Dec 30 12:00:00 2013 PST | z    |    1 | Mon Dec 30 12:00:00 2013 PST
(1 row)

SELECT * FROM mpp21090_xchange_pttab_dropcol_idx_dml_timestamptz_candidate ORDER BY 1,2,3;
             col2             | col3 | col4 |             col5             
------------------------------+------+------+------------------------------
 Mon Dec 30 12:00:00 2013 PST | a    |    0 | Mon Dec 30 12:00:00 2013 PST
(1 row)

-- DML on partition table
INSERT INTO mpp21090_xchange_pttab_dropcol_idx_dml_timestamptz SELECT  '2013-12-01 12:00:00 PST','b', 1, '2013-12-01 12:00:00 PST';
SELECT * FROM mpp21090_xchange_pttab_dropcol_idx_dml_timestamptz ORDER BY 1,2,3;
             col2             | col3 | col4 |             col5             
------------------------------+------+------+------------------------------
 Sun Dec 01 12:00:00 2013 PST | b    |    1 | Sun Dec 01 12:00:00 2013 PST
 Mon Dec 30 12:00:00 2013 PST | z    |    1 | Mon Dec 30 12:00:00 2013 PST
(2 rows)

UPDATE mpp21090_xchange_pttab_dropcol_idx_dml_timestamptz SET col5 = '2014-02-10 12:00:00 PST' WHERE col2 = '2013-12-01 12:00:00 PST' AND col5 = '2013-12-01 12:00:00 PST';
SELECT * FROM mpp21090_xchange_pttab_dropcol_idx_dml_timestamptz ORDER BY 1,2,3;
             col2             | col3 | col4 |             col5             
------------------------------+------+------+------------------------------
 Sun Dec 01 12:00:00 2013 PST | b    |    1 | Mon Feb 10 12:00:00 2014 PST
 Mon Dec 30 12:00:00 2013 PST | z    |    1 | Mon Dec 30 12:00:00 2013 PST
(2 rows)

UPDATE mpp21090_xchange_pttab_dropcol_idx_dml_timestamptz SET col2 ='2013-12-30 12:00:00 PST' WHERE col3='b';
SELECT * FROM mpp21090_xchange_pttab_dropcol_idx_dml_timestamptz ORDER BY 1,2,3;
             col2             | col3 | col4 |             col5             
------------------------------+------+------+------------------------------
 Mon Dec 30 12:00:00 2013 PST | b    |    1 | Mon Feb 10 12:00:00 2014 PST
 Mon Dec 30 12:00:00 2013 PST | z    |    1 | Mon Dec 30 12:00:00 2013 PST
(2 rows)

DELETE FROM mpp21090_xchange_pttab_dropcol_idx_dml_timestamptz WHERE col3='b';
SELECT * FROM mpp21090_xchange_pttab_dropcol_idx_dml_timestamptz ORDER BY 1,2,3;
             col2             | col3 | col4 |             col5             
------------------------------+------+------+------------------------------
 Mon Dec 30 12:00:00 2013 PST | z    |    1 | Mon Dec 30 12:00:00 2013 PST
(1 row)

-- DML on candidate table
INSERT INTO mpp21090_xchange_pttab_dropcol_idx_dml_timestamptz_candidate SELECT '2013-12-01 12:00:00 PST','b', 1, '2013-12-01 12:00:00 PST';
SELECT * FROM mpp21090_xchange_pttab_dropcol_idx_dml_timestamptz_candidate ORDER BY 1,2,3;
             col2             | col3 | col4 |             col5             
------------------------------+------+------+------------------------------
 Sun Dec 01 12:00:00 2013 PST | b    |    1 | Sun Dec 01 12:00:00 2013 PST
 Mon Dec 30 12:00:00 2013 PST | a    |    0 | Mon Dec 30 12:00:00 2013 PST
(2 rows)

UPDATE mpp21090_xchange_pttab_dropcol_idx_dml_timestamptz_candidate SET col2='2013-12-30 12:00:00 PST' WHERE col3='a';
SELECT * FROM mpp21090_xchange_pttab_dropcol_idx_dml_timestamptz_candidate ORDER BY 1,2,3;
             col2             | col3 | col4 |             col5             
------------------------------+------+------+------------------------------
 Sun Dec 01 12:00:00 2013 PST | b    |    1 | Sun Dec 01 12:00:00 2013 PST
 Mon Dec 30 12:00:00 2013 PST | a    |    0 | Mon Dec 30 12:00:00 2013 PST
(2 rows)

DELETE FROM mpp21090_xchange_pttab_dropcol_idx_dml_timestamptz_candidate WHERE col3='a';
SELECT * FROM mpp21090_xchange_pttab_dropcol_idx_dml_timestamptz_candidate ORDER BY 1,2,3;
             col2             | col3 | col4 |             col5             
------------------------------+------+------+------------------------------
 Sun Dec 01 12:00:00 2013 PST | b    |    1 | Sun Dec 01 12:00:00 2013 PST
(1 row)

-- start_ignore
drop schema sql_partition_501_521 cascade;
NOTICE:  drop cascades to table mpp21090_xchange_pttab_dropcol_idx_dml_timestampt_1_prt_partone
NOTICE:  drop cascades to constraint mpp21090_xchange_pttab_dropcol_idx_dml_timestampt_1_prt_partone on table mpp21090_xchange_pttab_dropcol_idx_dml_timestampt_1_prt_partone
NOTICE:  drop cascades to table mpp21090_xchange_pttab_dropcol_idx_dml_timesta_1_prt_partthree1
NOTICE:  drop cascades to constraint mpp21090_xchange_pttab_dropcol_idx_dml_timesta_1_prt_partthree1 on table mpp21090_xchange_pttab_dropcol_idx_dml_timesta_1_prt_partthree1
NOTICE:  drop cascades to append only table mpp21090_xchange_pttab_dropcol_idx_dml_timestampt_1_prt_parttwo
NOTICE:  drop cascades to constraint mpp21090_xchange_pttab_dropcol_idx_dml_timestampt_1_prt_parttwo on append only table mpp21090_xchange_pttab_dropcol_idx_dml_timestampt_1_prt_parttwo
NOTICE:  drop cascades to append only columnar table mpp21090_xchange_pttab_dropcol_idx_dml_timestamptz_candidate
NOTICE:  drop cascades to constraint mpp21090_xchange_pttab_dropcol_idx_dml_timestampt_1_prt_partone on append only columnar table mpp21090_xchange_pttab_dropcol_idx_dml_timestamptz_candidate
NOTICE:  drop cascades to table mpp21090_xchange_pttab_dropcol_idx_dml_timestamptz
NOTICE:  drop cascades to table mpp21090_xchange_pttab_dropcol_idx_dml_timestamp_1_prt_partone
NOTICE:  drop cascades to constraint mpp21090_xchange_pttab_dropcol_idx_dml_timestamp_1_prt_partone_ on table mpp21090_xchange_pttab_dropcol_idx_dml_timestamp_1_prt_partone
NOTICE:  drop cascades to table mpp21090_xchange_pttab_dropcol_idx_dml_timestam_1_prt_partthree
NOTICE:  drop cascades to constraint mpp21090_xchange_pttab_dropcol_idx_dml_timestam_1_prt_partthree on table mpp21090_xchange_pttab_dropcol_idx_dml_timestam_1_prt_partthree
NOTICE:  drop cascades to append only table mpp21090_xchange_pttab_dropcol_idx_dml_timestamp_1_prt_parttwo
NOTICE:  drop cascades to constraint mpp21090_xchange_pttab_dropcol_idx_dml_timestamp_1_prt_parttwo_ on append only table mpp21090_xchange_pttab_dropcol_idx_dml_timestamp_1_prt_parttwo
NOTICE:  drop cascades to append only columnar table mpp21090_xchange_pttab_dropcol_idx_dml_timestamp_candidate
NOTICE:  drop cascades to constraint mpp21090_xchange_pttab_dropcol_idx_dml_timestamp_1_prt_partone_ on append only columnar table mpp21090_xchange_pttab_dropcol_idx_dml_timestamp_candidate
NOTICE:  drop cascades to table mpp21090_xchange_pttab_dropcol_idx_dml_timestamp
NOTICE:  drop cascades to table mpp21090_xchange_pttab_dropcol_idx_dml_time_1_prt_partone
NOTICE:  drop cascades to constraint mpp21090_xchange_pttab_dropcol_idx_dml_time_1_prt_partone_check on table mpp21090_xchange_pttab_dropcol_idx_dml_time_1_prt_partone
NOTICE:  drop cascades to append only table mpp21090_xchange_pttab_dropcol_idx_dml_time_1_prt_parttwo
NOTICE:  drop cascades to constraint mpp21090_xchange_pttab_dropcol_idx_dml_time_1_prt_parttwo_check on append only table mpp21090_xchange_pttab_dropcol_idx_dml_time_1_prt_parttwo
NOTICE:  drop cascades to append only columnar table mpp21090_xchange_pttab_dropcol_idx_dml_time_candidate
NOTICE:  drop cascades to constraint mpp21090_xchange_pttab_dropcol_idx_dml_time_1_prt_partone_check on append only columnar table mpp21090_xchange_pttab_dropcol_idx_dml_time_candidate
NOTICE:  drop cascades to table mpp21090_xchange_pttab_dropcol_idx_dml_time_1_prt_partthree
NOTICE:  drop cascades to constraint mpp21090_xchange_pttab_dropcol_idx_dml_time_1_prt_partthree_che on table mpp21090_xchange_pttab_dropcol_idx_dml_time_1_prt_partthree
NOTICE:  drop cascades to table mpp21090_xchange_pttab_dropcol_idx_dml_time
NOTICE:  drop cascades to table mpp21090_xchange_pttab_dropcol_idx_dml_numeric_1_prt_partone
NOTICE:  drop cascades to constraint mpp21090_xchange_pttab_dropcol_idx_dml_numeric_1_prt_partone_ch on table mpp21090_xchange_pttab_dropcol_idx_dml_numeric_1_prt_partone
NOTICE:  drop cascades to table mpp21090_xchange_pttab_dropcol_idx_dml_numeric_1_prt_partthree
NOTICE:  drop cascades to constraint mpp21090_xchange_pttab_dropcol_idx_dml_numeric_1_prt_partthree_ on table mpp21090_xchange_pttab_dropcol_idx_dml_numeric_1_prt_partthree
NOTICE:  drop cascades to append only table mpp21090_xchange_pttab_dropcol_idx_dml_numeric_1_prt_parttwo
NOTICE:  drop cascades to constraint mpp21090_xchange_pttab_dropcol_idx_dml_numeric_1_prt_parttwo_ch on append only table mpp21090_xchange_pttab_dropcol_idx_dml_numeric_1_prt_parttwo
NOTICE:  drop cascades to append only columnar table mpp21090_xchange_pttab_dropcol_idx_dml_numeric_candidate
NOTICE:  drop cascades to constraint mpp21090_xchange_pttab_dropcol_idx_dml_numeric_1_prt_partone_ch on append only columnar table mpp21090_xchange_pttab_dropcol_idx_dml_numeric_candidate
NOTICE:  drop cascades to table mpp21090_xchange_pttab_dropcol_idx_dml_numeric
NOTICE:  drop cascades to table mpp21090_xchange_pttab_dropcol_idx_dml_interval_1_prt_partone
NOTICE:  drop cascades to constraint mpp21090_xchange_pttab_dropcol_idx_dml_interval_1_prt_partone_c on table mpp21090_xchange_pttab_dropcol_idx_dml_interval_1_prt_partone
NOTICE:  drop cascades to table mpp21090_xchange_pttab_dropcol_idx_dml_interval_1_prt_partthree
NOTICE:  drop cascades to constraint mpp21090_xchange_pttab_dropcol_idx_dml_interval_1_prt_partthree on table mpp21090_xchange_pttab_dropcol_idx_dml_interval_1_prt_partthree
NOTICE:  drop cascades to append only table mpp21090_xchange_pttab_dropcol_idx_dml_interval_1_prt_parttwo
NOTICE:  drop cascades to constraint mpp21090_xchange_pttab_dropcol_idx_dml_interval_1_prt_parttwo_c on append only table mpp21090_xchange_pttab_dropcol_idx_dml_interval_1_prt_parttwo
NOTICE:  drop cascades to append only columnar table mpp21090_xchange_pttab_dropcol_idx_dml_interval_candidate
NOTICE:  drop cascades to constraint mpp21090_xchange_pttab_dropcol_idx_dml_interval_1_prt_partone_c on append only columnar table mpp21090_xchange_pttab_dropcol_idx_dml_interval_candidate
NOTICE:  drop cascades to table mpp21090_xchange_pttab_dropcol_idx_dml_interval
NOTICE:  drop cascades to table mpp21090_xchange_pttab_dropcol_idx_dml_int8_1_prt_partone
NOTICE:  drop cascades to constraint mpp21090_xchange_pttab_dropcol_idx_dml_int8_1_prt_partone_check on table mpp21090_xchange_pttab_dropcol_idx_dml_int8_1_prt_partone
NOTICE:  drop cascades to table mpp21090_xchange_pttab_dropcol_idx_dml_int8_1_prt_partthree
NOTICE:  drop cascades to constraint mpp21090_xchange_pttab_dropcol_idx_dml_int8_1_prt_partthree_che on table mpp21090_xchange_pttab_dropcol_idx_dml_int8_1_prt_partthree
NOTICE:  drop cascades to append only table mpp21090_xchange_pttab_dropcol_idx_dml_int8_1_prt_parttwo
NOTICE:  drop cascades to constraint mpp21090_xchange_pttab_dropcol_idx_dml_int8_1_prt_parttwo_check on append only table mpp21090_xchange_pttab_dropcol_idx_dml_int8_1_prt_parttwo
NOTICE:  drop cascades to append only columnar table mpp21090_xchange_pttab_dropcol_idx_dml_int8_candidate
NOTICE:  drop cascades to constraint mpp21090_xchange_pttab_dropcol_idx_dml_int8_1_prt_partone_check on append only columnar table mpp21090_xchange_pttab_dropcol_idx_dml_int8_candidate
NOTICE:  drop cascades to table mpp21090_xchange_pttab_dropcol_idx_dml_int8
NOTICE:  drop cascades to table mpp21090_xchange_pttab_dropcol_idx_dml_int4_1_prt_partone
NOTICE:  drop cascades to constraint mpp21090_xchange_pttab_dropcol_idx_dml_int4_1_prt_partone_check on table mpp21090_xchange_pttab_dropcol_idx_dml_int4_1_prt_partone
NOTICE:  drop cascades to table mpp21090_xchange_pttab_dropcol_idx_dml_int4_1_prt_partthree
NOTICE:  drop cascades to constraint mpp21090_xchange_pttab_dropcol_idx_dml_int4_1_prt_partthree_che on table mpp21090_xchange_pttab_dropcol_idx_dml_int4_1_prt_partthree
NOTICE:  drop cascades to append only table mpp21090_xchange_pttab_dropcol_idx_dml_int4_1_prt_parttwo
NOTICE:  drop cascades to constraint mpp21090_xchange_pttab_dropcol_idx_dml_int4_1_prt_parttwo_check on append only table mpp21090_xchange_pttab_dropcol_idx_dml_int4_1_prt_parttwo
NOTICE:  drop cascades to append only columnar table mpp21090_xchange_pttab_dropcol_idx_dml_int4_candidate
NOTICE:  drop cascades to constraint mpp21090_xchange_pttab_dropcol_idx_dml_int4_1_prt_partone_check on append only columnar table mpp21090_xchange_pttab_dropcol_idx_dml_int4_candidate
NOTICE:  drop cascades to table mpp21090_xchange_pttab_dropcol_idx_dml_int4
NOTICE:  drop cascades to table mpp21090_xchange_pttab_dropcol_idx_dml_int_1_prt_partone
NOTICE:  drop cascades to constraint mpp21090_xchange_pttab_dropcol_idx_dml_int_1_prt_partone_check on table mpp21090_xchange_pttab_dropcol_idx_dml_int_1_prt_partone
NOTICE:  drop cascades to table mpp21090_xchange_pttab_dropcol_idx_dml_int_1_prt_partthree
NOTICE:  drop cascades to constraint mpp21090_xchange_pttab_dropcol_idx_dml_int_1_prt_partthree_chec on table mpp21090_xchange_pttab_dropcol_idx_dml_int_1_prt_partthree
NOTICE:  drop cascades to append only table mpp21090_xchange_pttab_dropcol_idx_dml_int_1_prt_parttwo
NOTICE:  drop cascades to constraint mpp21090_xchange_pttab_dropcol_idx_dml_int_1_prt_parttwo_check on append only table mpp21090_xchange_pttab_dropcol_idx_dml_int_1_prt_parttwo
NOTICE:  drop cascades to append only columnar table mpp21090_xchange_pttab_dropcol_idx_dml_int_candidate
NOTICE:  drop cascades to constraint mpp21090_xchange_pttab_dropcol_idx_dml_int_1_prt_partone_check on append only columnar table mpp21090_xchange_pttab_dropcol_idx_dml_int_candidate
NOTICE:  drop cascades to table mpp21090_xchange_pttab_dropcol_idx_dml_int
NOTICE:  drop cascades to table mpp21090_xchange_pttab_dropcol_idx_dml_float_1_prt_partone
NOTICE:  drop cascades to constraint mpp21090_xchange_pttab_dropcol_idx_dml_float_1_prt_partone_chec on table mpp21090_xchange_pttab_dropcol_idx_dml_float_1_prt_partone
NOTICE:  drop cascades to table mpp21090_xchange_pttab_dropcol_idx_dml_float_1_prt_partthree
NOTICE:  drop cascades to constraint mpp21090_xchange_pttab_dropcol_idx_dml_float_1_prt_partthree_ch on table mpp21090_xchange_pttab_dropcol_idx_dml_float_1_prt_partthree
NOTICE:  drop cascades to append only table mpp21090_xchange_pttab_dropcol_idx_dml_float_1_prt_parttwo
NOTICE:  drop cascades to constraint mpp21090_xchange_pttab_dropcol_idx_dml_float_1_prt_parttwo_chec on append only table mpp21090_xchange_pttab_dropcol_idx_dml_float_1_prt_parttwo
NOTICE:  drop cascades to append only columnar table mpp21090_xchange_pttab_dropcol_idx_dml_float_candidate
NOTICE:  drop cascades to constraint mpp21090_xchange_pttab_dropcol_idx_dml_float_1_prt_partone_chec on append only columnar table mpp21090_xchange_pttab_dropcol_idx_dml_float_candidate
NOTICE:  drop cascades to table mpp21090_xchange_pttab_dropcol_idx_dml_float
NOTICE:  drop cascades to table mpp21090_xchange_pttab_dropcol_idx_dml_decimal_1_prt_partone
NOTICE:  drop cascades to constraint mpp21090_xchange_pttab_dropcol_idx_dml_decimal_1_prt_partone_ch on table mpp21090_xchange_pttab_dropcol_idx_dml_decimal_1_prt_partone
NOTICE:  drop cascades to table mpp21090_xchange_pttab_dropcol_idx_dml_decimal_1_prt_partthree
NOTICE:  drop cascades to constraint mpp21090_xchange_pttab_dropcol_idx_dml_decimal_1_prt_partthree_ on table mpp21090_xchange_pttab_dropcol_idx_dml_decimal_1_prt_partthree
NOTICE:  drop cascades to append only table mpp21090_xchange_pttab_dropcol_idx_dml_decimal_1_prt_parttwo
NOTICE:  drop cascades to constraint mpp21090_xchange_pttab_dropcol_idx_dml_decimal_1_prt_parttwo_ch on append only table mpp21090_xchange_pttab_dropcol_idx_dml_decimal_1_prt_parttwo
NOTICE:  drop cascades to append only columnar table mpp21090_xchange_pttab_dropcol_idx_dml_decimal_candidate
NOTICE:  drop cascades to constraint mpp21090_xchange_pttab_dropcol_idx_dml_decimal_1_prt_partone_ch on append only columnar table mpp21090_xchange_pttab_dropcol_idx_dml_decimal_candidate
NOTICE:  drop cascades to table mpp21090_xchange_pttab_dropcol_idx_dml_decimal
NOTICE:  drop cascades to table mpp21090_xchange_pttab_dropcol_idx_dml_date_1_prt_partone
NOTICE:  drop cascades to constraint mpp21090_xchange_pttab_dropcol_idx_dml_date_1_prt_partone_check on table mpp21090_xchange_pttab_dropcol_idx_dml_date_1_prt_partone
NOTICE:  drop cascades to table mpp21090_xchange_pttab_dropcol_idx_dml_date_1_prt_partthree
NOTICE:  drop cascades to constraint mpp21090_xchange_pttab_dropcol_idx_dml_date_1_prt_partthree_che on table mpp21090_xchange_pttab_dropcol_idx_dml_date_1_prt_partthree
NOTICE:  drop cascades to append only table mpp21090_xchange_pttab_dropcol_idx_dml_date_1_prt_parttwo
NOTICE:  drop cascades to constraint mpp21090_xchange_pttab_dropcol_idx_dml_date_1_prt_parttwo_check on append only table mpp21090_xchange_pttab_dropcol_idx_dml_date_1_prt_parttwo
NOTICE:  drop cascades to append only columnar table mpp21090_xchange_pttab_dropcol_idx_dml_date_candidate
NOTICE:  drop cascades to constraint mpp21090_xchange_pttab_dropcol_idx_dml_date_1_prt_partone_check on append only columnar table mpp21090_xchange_pttab_dropcol_idx_dml_date_candidate
NOTICE:  drop cascades to table mpp21090_xchange_pttab_dropcol_idx_dml_date
NOTICE:  drop cascades to table mpp21090_xchange_pttab_dropcol_idx_dml_char_1_prt_partone
NOTICE:  drop cascades to constraint mpp21090_xchange_pttab_dropcol_idx_dml_char_1_prt_partone_check on table mpp21090_xchange_pttab_dropcol_idx_dml_char_1_prt_partone
NOTICE:  drop cascades to table mpp21090_xchange_pttab_dropcol_idx_dml_char_1_prt_partthree
NOTICE:  drop cascades to constraint mpp21090_xchange_pttab_dropcol_idx_dml_char_1_prt_partthree_che on table mpp21090_xchange_pttab_dropcol_idx_dml_char_1_prt_partthree
NOTICE:  drop cascades to append only table mpp21090_xchange_pttab_dropcol_idx_dml_char_1_prt_parttwo
NOTICE:  drop cascades to constraint mpp21090_xchange_pttab_dropcol_idx_dml_char_1_prt_parttwo_check on append only table mpp21090_xchange_pttab_dropcol_idx_dml_char_1_prt_parttwo
NOTICE:  drop cascades to append only columnar table mpp21090_xchange_pttab_dropcol_idx_dml_char_candidate
NOTICE:  drop cascades to constraint mpp21090_xchange_pttab_dropcol_idx_dml_char_1_prt_partone_check on append only columnar table mpp21090_xchange_pttab_dropcol_idx_dml_char_candidate
NOTICE:  drop cascades to table mpp21090_xchange_pttab_dropcol_idx_dml_char
NOTICE:  drop cascades to table mpp21090_xchange_pttab_dropcol_dml_timestamptz_1_prt_partone
NOTICE:  drop cascades to constraint mpp21090_xchange_pttab_dropcol_dml_timestamptz_1_prt_partone_ch on table mpp21090_xchange_pttab_dropcol_dml_timestamptz_1_prt_partone
NOTICE:  drop cascades to table mpp21090_xchange_pttab_dropcol_dml_timestamptz_1_prt_partthree
NOTICE:  drop cascades to constraint mpp21090_xchange_pttab_dropcol_dml_timestamptz_1_prt_partthree_ on table mpp21090_xchange_pttab_dropcol_dml_timestamptz_1_prt_partthree
NOTICE:  drop cascades to append only table mpp21090_xchange_pttab_dropcol_dml_timestamptz_1_prt_parttwo
NOTICE:  drop cascades to constraint mpp21090_xchange_pttab_dropcol_dml_timestamptz_1_prt_parttwo_ch on append only table mpp21090_xchange_pttab_dropcol_dml_timestamptz_1_prt_parttwo
NOTICE:  drop cascades to append only columnar table mpp21090_xchange_pttab_dropcol_dml_timestamptz_candidate
NOTICE:  drop cascades to constraint mpp21090_xchange_pttab_dropcol_dml_timestamptz_1_prt_partone_ch on append only columnar table mpp21090_xchange_pttab_dropcol_dml_timestamptz_candidate
NOTICE:  drop cascades to table mpp21090_xchange_pttab_dropcol_dml_timestamptz
NOTICE:  drop cascades to table mpp21090_xchange_pttab_dropcol_dml_timestamp_1_prt_partone
NOTICE:  drop cascades to constraint mpp21090_xchange_pttab_dropcol_dml_timestamp_1_prt_partone_chec on table mpp21090_xchange_pttab_dropcol_dml_timestamp_1_prt_partone
NOTICE:  drop cascades to table mpp21090_xchange_pttab_dropcol_dml_timestamp_1_prt_partthree
NOTICE:  drop cascades to constraint mpp21090_xchange_pttab_dropcol_dml_timestamp_1_prt_partthree_ch on table mpp21090_xchange_pttab_dropcol_dml_timestamp_1_prt_partthree
NOTICE:  drop cascades to append only table mpp21090_xchange_pttab_dropcol_dml_timestamp_1_prt_parttwo
NOTICE:  drop cascades to constraint mpp21090_xchange_pttab_dropcol_dml_timestamp_1_prt_parttwo_chec on append only table mpp21090_xchange_pttab_dropcol_dml_timestamp_1_prt_parttwo
NOTICE:  drop cascades to append only columnar table mpp21090_xchange_pttab_dropcol_dml_timestamp_candidate
NOTICE:  drop cascades to constraint mpp21090_xchange_pttab_dropcol_dml_timestamp_1_prt_partone_chec on append only columnar table mpp21090_xchange_pttab_dropcol_dml_timestamp_candidate
NOTICE:  drop cascades to table mpp21090_xchange_pttab_dropcol_dml_timestamp
NOTICE:  drop cascades to table mpp21090_xchange_pttab_dropcol_dml_time_1_prt_partone
NOTICE:  drop cascades to constraint mpp21090_xchange_pttab_dropcol_dml_time_1_prt_partone_check on table mpp21090_xchange_pttab_dropcol_dml_time_1_prt_partone
NOTICE:  drop cascades to append only table mpp21090_xchange_pttab_dropcol_dml_time_1_prt_parttwo
NOTICE:  drop cascades to constraint mpp21090_xchange_pttab_dropcol_dml_time_1_prt_parttwo_check on append only table mpp21090_xchange_pttab_dropcol_dml_time_1_prt_parttwo
NOTICE:  drop cascades to append only columnar table mpp21090_xchange_pttab_dropcol_dml_time_candidate
NOTICE:  drop cascades to constraint mpp21090_xchange_pttab_dropcol_dml_time_1_prt_partone_check on append only columnar table mpp21090_xchange_pttab_dropcol_dml_time_candidate
NOTICE:  drop cascades to table mpp21090_xchange_pttab_dropcol_dml_time_1_prt_partthree
NOTICE:  drop cascades to constraint mpp21090_xchange_pttab_dropcol_dml_time_1_prt_partthree_check on table mpp21090_xchange_pttab_dropcol_dml_time_1_prt_partthree
NOTICE:  drop cascades to table mpp21090_xchange_pttab_dropcol_dml_time
NOTICE:  drop cascades to table mpp21090_xchange_pttab_dropcol_dml_numeric_1_prt_partone
NOTICE:  drop cascades to constraint mpp21090_xchange_pttab_dropcol_dml_numeric_1_prt_partone_check on table mpp21090_xchange_pttab_dropcol_dml_numeric_1_prt_partone
NOTICE:  drop cascades to table mpp21090_xchange_pttab_dropcol_dml_numeric_1_prt_partthree
NOTICE:  drop cascades to constraint mpp21090_xchange_pttab_dropcol_dml_numeric_1_prt_partthree_chec on table mpp21090_xchange_pttab_dropcol_dml_numeric_1_prt_partthree
NOTICE:  drop cascades to append only table mpp21090_xchange_pttab_dropcol_dml_numeric_1_prt_parttwo
NOTICE:  drop cascades to constraint mpp21090_xchange_pttab_dropcol_dml_numeric_1_prt_parttwo_check on append only table mpp21090_xchange_pttab_dropcol_dml_numeric_1_prt_parttwo
NOTICE:  drop cascades to append only columnar table mpp21090_xchange_pttab_dropcol_dml_numeric_candidate
NOTICE:  drop cascades to constraint mpp21090_xchange_pttab_dropcol_dml_numeric_1_prt_partone_check on append only columnar table mpp21090_xchange_pttab_dropcol_dml_numeric_candidate
NOTICE:  drop cascades to table mpp21090_xchange_pttab_dropcol_dml_numeric
NOTICE:  drop cascades to table mpp21090_xchange_pttab_dropcol_dml_interval_1_prt_partone
NOTICE:  drop cascades to constraint mpp21090_xchange_pttab_dropcol_dml_interval_1_prt_partone_check on table mpp21090_xchange_pttab_dropcol_dml_interval_1_prt_partone
NOTICE:  drop cascades to table mpp21090_xchange_pttab_dropcol_dml_interval_1_prt_partthree
NOTICE:  drop cascades to constraint mpp21090_xchange_pttab_dropcol_dml_interval_1_prt_partthree_che on table mpp21090_xchange_pttab_dropcol_dml_interval_1_prt_partthree
NOTICE:  drop cascades to append only table mpp21090_xchange_pttab_dropcol_dml_interval_1_prt_parttwo
NOTICE:  drop cascades to constraint mpp21090_xchange_pttab_dropcol_dml_interval_1_prt_parttwo_check on append only table mpp21090_xchange_pttab_dropcol_dml_interval_1_prt_parttwo
NOTICE:  drop cascades to append only columnar table mpp21090_xchange_pttab_dropcol_dml_interval_candidate
NOTICE:  drop cascades to constraint mpp21090_xchange_pttab_dropcol_dml_interval_1_prt_partone_check on append only columnar table mpp21090_xchange_pttab_dropcol_dml_interval_candidate
NOTICE:  drop cascades to table mpp21090_xchange_pttab_dropcol_dml_interval
NOTICE:  drop cascades to table mpp21090_xchange_pttab_dropcol_dml_int8_1_prt_partone
NOTICE:  drop cascades to constraint mpp21090_xchange_pttab_dropcol_dml_int8_1_prt_partone_check on table mpp21090_xchange_pttab_dropcol_dml_int8_1_prt_partone
NOTICE:  drop cascades to table mpp21090_xchange_pttab_dropcol_dml_int8_1_prt_partthree
NOTICE:  drop cascades to constraint mpp21090_xchange_pttab_dropcol_dml_int8_1_prt_partthree_check on table mpp21090_xchange_pttab_dropcol_dml_int8_1_prt_partthree
NOTICE:  drop cascades to append only table mpp21090_xchange_pttab_dropcol_dml_int8_1_prt_parttwo
NOTICE:  drop cascades to constraint mpp21090_xchange_pttab_dropcol_dml_int8_1_prt_parttwo_check on append only table mpp21090_xchange_pttab_dropcol_dml_int8_1_prt_parttwo
NOTICE:  drop cascades to append only columnar table mpp21090_xchange_pttab_dropcol_dml_int8_candidate
NOTICE:  drop cascades to constraint mpp21090_xchange_pttab_dropcol_dml_int8_1_prt_partone_check on append only columnar table mpp21090_xchange_pttab_dropcol_dml_int8_candidate
NOTICE:  drop cascades to table mpp21090_xchange_pttab_dropcol_dml_int8
NOTICE:  drop cascades to table mpp21090_xchange_pttab_dropcol_dml_int4_1_prt_partone
NOTICE:  drop cascades to constraint mpp21090_xchange_pttab_dropcol_dml_int4_1_prt_partone_check on table mpp21090_xchange_pttab_dropcol_dml_int4_1_prt_partone
NOTICE:  drop cascades to table mpp21090_xchange_pttab_dropcol_dml_int4_1_prt_partthree
NOTICE:  drop cascades to constraint mpp21090_xchange_pttab_dropcol_dml_int4_1_prt_partthree_check on table mpp21090_xchange_pttab_dropcol_dml_int4_1_prt_partthree
NOTICE:  drop cascades to append only table mpp21090_xchange_pttab_dropcol_dml_int4_1_prt_parttwo
NOTICE:  drop cascades to constraint mpp21090_xchange_pttab_dropcol_dml_int4_1_prt_parttwo_check on append only table mpp21090_xchange_pttab_dropcol_dml_int4_1_prt_parttwo
NOTICE:  drop cascades to append only columnar table mpp21090_xchange_pttab_dropcol_dml_int4_candidate
NOTICE:  drop cascades to constraint mpp21090_xchange_pttab_dropcol_dml_int4_1_prt_partone_check on append only columnar table mpp21090_xchange_pttab_dropcol_dml_int4_candidate
NOTICE:  drop cascades to table mpp21090_xchange_pttab_dropcol_dml_int4
NOTICE:  drop cascades to table mpp21090_xchange_pttab_dropcol_dml_int_1_prt_partone
NOTICE:  drop cascades to constraint mpp21090_xchange_pttab_dropcol_dml_int_1_prt_partone_check on table mpp21090_xchange_pttab_dropcol_dml_int_1_prt_partone
NOTICE:  drop cascades to table mpp21090_xchange_pttab_dropcol_dml_int_1_prt_partthree
NOTICE:  drop cascades to constraint mpp21090_xchange_pttab_dropcol_dml_int_1_prt_partthree_check on table mpp21090_xchange_pttab_dropcol_dml_int_1_prt_partthree
NOTICE:  drop cascades to append only table mpp21090_xchange_pttab_dropcol_dml_int_1_prt_parttwo
NOTICE:  drop cascades to constraint mpp21090_xchange_pttab_dropcol_dml_int_1_prt_parttwo_check on append only table mpp21090_xchange_pttab_dropcol_dml_int_1_prt_parttwo
NOTICE:  drop cascades to append only columnar table mpp21090_xchange_pttab_dropcol_dml_int_candidate
NOTICE:  drop cascades to constraint mpp21090_xchange_pttab_dropcol_dml_int_1_prt_partone_check on append only columnar table mpp21090_xchange_pttab_dropcol_dml_int_candidate
NOTICE:  drop cascades to table mpp21090_xchange_pttab_dropcol_dml_int
NOTICE:  drop cascades to table mpp21090_xchange_pttab_dropcol_dml_float_1_prt_partone
NOTICE:  drop cascades to constraint mpp21090_xchange_pttab_dropcol_dml_float_1_prt_partone_check on table mpp21090_xchange_pttab_dropcol_dml_float_1_prt_partone
NOTICE:  drop cascades to table mpp21090_xchange_pttab_dropcol_dml_float_1_prt_partthree
NOTICE:  drop cascades to constraint mpp21090_xchange_pttab_dropcol_dml_float_1_prt_partthree_check on table mpp21090_xchange_pttab_dropcol_dml_float_1_prt_partthree
NOTICE:  drop cascades to append only table mpp21090_xchange_pttab_dropcol_dml_float_1_prt_parttwo
NOTICE:  drop cascades to constraint mpp21090_xchange_pttab_dropcol_dml_float_1_prt_parttwo_check on append only table mpp21090_xchange_pttab_dropcol_dml_float_1_prt_parttwo
NOTICE:  drop cascades to append only columnar table mpp21090_xchange_pttab_dropcol_dml_float_candidate
NOTICE:  drop cascades to constraint mpp21090_xchange_pttab_dropcol_dml_float_1_prt_partone_check on append only columnar table mpp21090_xchange_pttab_dropcol_dml_float_candidate
NOTICE:  drop cascades to table mpp21090_xchange_pttab_dropcol_dml_float
-- end_ignore
