-- start_ignore
create schema sql_partition_51_100;
set search_path to sql_partition_51_100;
-- end_ignore
-- @author prabhd 
-- @created 2014-04-01 12:00:00
-- @modified 2012-04-01 12:00:00
-- @tags dml MPP-21090 ORCA
-- @optimizer_mode on	
-- @description Tests for MPP-21090
\echo --start_ignore
--start_ignore
\echo --end_ignore
--end_ignore
DROP TABLE IF EXISTS mpp21090_drop_distcol_dml_decimal;
NOTICE:  table "mpp21090_drop_distcol_dml_decimal" does not exist, skipping
CREATE TABLE mpp21090_drop_distcol_dml_decimal(
col1 decimal,
col2 decimal,
col3 char,
col4 date,
col5 int
)  with (appendonly= true, orientation= column) distributed by (col1);
INSERT INTO mpp21090_drop_distcol_dml_decimal VALUES(2.00,0.00,'a','2014-01-01',0);
SELECT * FROM mpp21090_drop_distcol_dml_decimal ORDER BY 1,2,3,4;
 col1 | col2 | col3 |    col4    | col5 
------+------+------+------------+------
 2.00 | 0.00 | a    | 01-01-2014 |    0
(1 row)

ALTER TABLE mpp21090_drop_distcol_dml_decimal DROP COLUMN col1;
NOTICE:  Dropping a column that is part of the distribution policy forces a NULL distribution policy
INSERT INTO mpp21090_drop_distcol_dml_decimal SELECT 1.00,'b','2014-01-02',1;
SELECT * FROM mpp21090_drop_distcol_dml_decimal ORDER BY 1,2,3;
 col2 | col3 |    col4    | col5 
------+------+------------+------
 0.00 | a    | 01-01-2014 |    0
 1.00 | b    | 01-02-2014 |    1
(2 rows)

UPDATE mpp21090_drop_distcol_dml_decimal SET col3='c' WHERE col3 = 'b' AND col5 = 1;
SELECT * FROM mpp21090_drop_distcol_dml_decimal ORDER BY 1,2,3;
 col2 | col3 |    col4    | col5 
------+------+------------+------
 0.00 | a    | 01-01-2014 |    0
 1.00 | c    | 01-02-2014 |    1
(2 rows)

DELETE FROM mpp21090_drop_distcol_dml_decimal WHERE col3='c';
SELECT * FROM mpp21090_drop_distcol_dml_decimal ORDER BY 1,2,3,4;
 col2 | col3 |    col4    | col5 
------+------+------------+------
 0.00 | a    | 01-01-2014 |    0
(1 row)

-- @author prabhd 
-- @created 2014-04-01 12:00:00
-- @modified 2012-04-01 12:00:00
-- @tags dml MPP-21090 ORCA
-- @optimizer_mode on	
-- @description Tests for MPP-21090
\echo --start_ignore
--start_ignore
\echo --end_ignore
--end_ignore
DROP TABLE IF EXISTS mpp21090_drop_distcol_dml_decimal;
CREATE TABLE mpp21090_drop_distcol_dml_decimal(
col1 decimal,
col2 decimal,
col3 char,
col4 date,
col5 int
) distributed by (col1);
INSERT INTO mpp21090_drop_distcol_dml_decimal VALUES(2.00,0.00,'a','2014-01-01',0);
SELECT * FROM mpp21090_drop_distcol_dml_decimal ORDER BY 1,2,3,4;
 col1 | col2 | col3 |    col4    | col5 
------+------+------+------------+------
 2.00 | 0.00 | a    | 01-01-2014 |    0
(1 row)

ALTER TABLE mpp21090_drop_distcol_dml_decimal DROP COLUMN col1;
NOTICE:  Dropping a column that is part of the distribution policy forces a NULL distribution policy
INSERT INTO mpp21090_drop_distcol_dml_decimal SELECT 1.00,'b','2014-01-02',1;
SELECT * FROM mpp21090_drop_distcol_dml_decimal ORDER BY 1,2,3;
 col2 | col3 |    col4    | col5 
------+------+------------+------
 0.00 | a    | 01-01-2014 |    0
 1.00 | b    | 01-02-2014 |    1
(2 rows)

UPDATE mpp21090_drop_distcol_dml_decimal SET col3='c' WHERE col3 = 'b' AND col5 = 1;
SELECT * FROM mpp21090_drop_distcol_dml_decimal ORDER BY 1,2,3;
 col2 | col3 |    col4    | col5 
------+------+------------+------
 0.00 | a    | 01-01-2014 |    0
 1.00 | c    | 01-02-2014 |    1
(2 rows)

DELETE FROM mpp21090_drop_distcol_dml_decimal WHERE col3='c';
SELECT * FROM mpp21090_drop_distcol_dml_decimal ORDER BY 1,2,3,4;
 col2 | col3 |    col4    | col5 
------+------+------------+------
 0.00 | a    | 01-01-2014 |    0
(1 row)

-- @author prabhd 
-- @created 2014-04-01 12:00:00
-- @modified 2012-04-01 12:00:00
-- @tags dml MPP-21090 ORCA
-- @optimizer_mode on	
-- @description Tests for MPP-21090
\echo --start_ignore
--start_ignore
\echo --end_ignore
--end_ignore
DROP TABLE IF EXISTS mpp21090_drop_distcol_dml_float;
NOTICE:  table "mpp21090_drop_distcol_dml_float" does not exist, skipping
CREATE TABLE mpp21090_drop_distcol_dml_float(
col1 float,
col2 decimal,
col3 char,
col4 date,
col5 int
)  with (appendonly= true) distributed by (col1);
INSERT INTO mpp21090_drop_distcol_dml_float VALUES(2.00,0.00,'a','2014-01-01',0);
SELECT * FROM mpp21090_drop_distcol_dml_float ORDER BY 1,2,3,4;
 col1 | col2 | col3 |    col4    | col5 
------+------+------+------------+------
    2 | 0.00 | a    | 01-01-2014 |    0
(1 row)

ALTER TABLE mpp21090_drop_distcol_dml_float DROP COLUMN col1;
NOTICE:  Dropping a column that is part of the distribution policy forces a NULL distribution policy
INSERT INTO mpp21090_drop_distcol_dml_float SELECT 1.00,'b','2014-01-02',1;
SELECT * FROM mpp21090_drop_distcol_dml_float ORDER BY 1,2,3;
 col2 | col3 |    col4    | col5 
------+------+------------+------
 0.00 | a    | 01-01-2014 |    0
 1.00 | b    | 01-02-2014 |    1
(2 rows)

UPDATE mpp21090_drop_distcol_dml_float SET col3='c' WHERE col3 = 'b' AND col5 = 1;
SELECT * FROM mpp21090_drop_distcol_dml_float ORDER BY 1,2,3;
 col2 | col3 |    col4    | col5 
------+------+------------+------
 0.00 | a    | 01-01-2014 |    0
 1.00 | c    | 01-02-2014 |    1
(2 rows)

DELETE FROM mpp21090_drop_distcol_dml_float WHERE col3='c';
SELECT * FROM mpp21090_drop_distcol_dml_float ORDER BY 1,2,3,4;
 col2 | col3 |    col4    | col5 
------+------+------------+------
 0.00 | a    | 01-01-2014 |    0
(1 row)

-- @author prabhd 
-- @created 2014-04-01 12:00:00
-- @modified 2012-04-01 12:00:00
-- @tags dml MPP-21090 ORCA
-- @optimizer_mode on	
-- @description Tests for MPP-21090
\echo --start_ignore
--start_ignore
\echo --end_ignore
--end_ignore
DROP TABLE IF EXISTS mpp21090_drop_distcol_dml_float;
CREATE TABLE mpp21090_drop_distcol_dml_float(
col1 float,
col2 decimal,
col3 char,
col4 date,
col5 int
)  with (appendonly= true, orientation= column) distributed by (col1);
INSERT INTO mpp21090_drop_distcol_dml_float VALUES(2.00,0.00,'a','2014-01-01',0);
SELECT * FROM mpp21090_drop_distcol_dml_float ORDER BY 1,2,3,4;
 col1 | col2 | col3 |    col4    | col5 
------+------+------+------------+------
    2 | 0.00 | a    | 01-01-2014 |    0
(1 row)

ALTER TABLE mpp21090_drop_distcol_dml_float DROP COLUMN col1;
NOTICE:  Dropping a column that is part of the distribution policy forces a NULL distribution policy
INSERT INTO mpp21090_drop_distcol_dml_float SELECT 1.00,'b','2014-01-02',1;
SELECT * FROM mpp21090_drop_distcol_dml_float ORDER BY 1,2,3;
 col2 | col3 |    col4    | col5 
------+------+------------+------
 0.00 | a    | 01-01-2014 |    0
 1.00 | b    | 01-02-2014 |    1
(2 rows)

UPDATE mpp21090_drop_distcol_dml_float SET col3='c' WHERE col3 = 'b' AND col5 = 1;
SELECT * FROM mpp21090_drop_distcol_dml_float ORDER BY 1,2,3;
 col2 | col3 |    col4    | col5 
------+------+------------+------
 0.00 | a    | 01-01-2014 |    0
 1.00 | c    | 01-02-2014 |    1
(2 rows)

DELETE FROM mpp21090_drop_distcol_dml_float WHERE col3='c';
SELECT * FROM mpp21090_drop_distcol_dml_float ORDER BY 1,2,3,4;
 col2 | col3 |    col4    | col5 
------+------+------------+------
 0.00 | a    | 01-01-2014 |    0
(1 row)

-- @author prabhd 
-- @created 2014-04-01 12:00:00
-- @modified 2012-04-01 12:00:00
-- @tags dml MPP-21090 ORCA
-- @optimizer_mode on	
-- @description Tests for MPP-21090
\echo --start_ignore
--start_ignore
\echo --end_ignore
--end_ignore
DROP TABLE IF EXISTS mpp21090_drop_distcol_dml_float;
CREATE TABLE mpp21090_drop_distcol_dml_float(
col1 float,
col2 decimal,
col3 char,
col4 date,
col5 int
) distributed by (col1);
INSERT INTO mpp21090_drop_distcol_dml_float VALUES(2.00,0.00,'a','2014-01-01',0);
SELECT * FROM mpp21090_drop_distcol_dml_float ORDER BY 1,2,3,4;
 col1 | col2 | col3 |    col4    | col5 
------+------+------+------------+------
    2 | 0.00 | a    | 01-01-2014 |    0
(1 row)

ALTER TABLE mpp21090_drop_distcol_dml_float DROP COLUMN col1;
NOTICE:  Dropping a column that is part of the distribution policy forces a NULL distribution policy
INSERT INTO mpp21090_drop_distcol_dml_float SELECT 1.00,'b','2014-01-02',1;
SELECT * FROM mpp21090_drop_distcol_dml_float ORDER BY 1,2,3;
 col2 | col3 |    col4    | col5 
------+------+------------+------
 0.00 | a    | 01-01-2014 |    0
 1.00 | b    | 01-02-2014 |    1
(2 rows)

UPDATE mpp21090_drop_distcol_dml_float SET col3='c' WHERE col3 = 'b' AND col5 = 1;
SELECT * FROM mpp21090_drop_distcol_dml_float ORDER BY 1,2,3;
 col2 | col3 |    col4    | col5 
------+------+------------+------
 0.00 | a    | 01-01-2014 |    0
 1.00 | c    | 01-02-2014 |    1
(2 rows)

DELETE FROM mpp21090_drop_distcol_dml_float WHERE col3='c';
SELECT * FROM mpp21090_drop_distcol_dml_float ORDER BY 1,2,3,4;
 col2 | col3 |    col4    | col5 
------+------+------------+------
 0.00 | a    | 01-01-2014 |    0
(1 row)

-- @author prabhd 
-- @created 2014-04-01 12:00:00
-- @modified 2012-04-01 12:00:00
-- @tags dml MPP-21090 ORCA
-- @optimizer_mode on	
-- @description Tests for MPP-21090
\echo --start_ignore
--start_ignore
\echo --end_ignore
--end_ignore
DROP TABLE IF EXISTS mpp21090_drop_distcol_dml_int4;
NOTICE:  table "mpp21090_drop_distcol_dml_int4" does not exist, skipping
CREATE TABLE mpp21090_drop_distcol_dml_int4(
col1 int4,
col2 decimal,
col3 char,
col4 date,
col5 int
)  with (appendonly= true) distributed by (col1);
INSERT INTO mpp21090_drop_distcol_dml_int4 VALUES(2000000000,0.00,'a','2014-01-01',0);
SELECT * FROM mpp21090_drop_distcol_dml_int4 ORDER BY 1,2,3,4;
    col1    | col2 | col3 |    col4    | col5 
------------+------+------+------------+------
 2000000000 | 0.00 | a    | 01-01-2014 |    0
(1 row)

ALTER TABLE mpp21090_drop_distcol_dml_int4 DROP COLUMN col1;
NOTICE:  Dropping a column that is part of the distribution policy forces a NULL distribution policy
INSERT INTO mpp21090_drop_distcol_dml_int4 SELECT 1.00,'b','2014-01-02',1;
SELECT * FROM mpp21090_drop_distcol_dml_int4 ORDER BY 1,2,3;
 col2 | col3 |    col4    | col5 
------+------+------------+------
 0.00 | a    | 01-01-2014 |    0
 1.00 | b    | 01-02-2014 |    1
(2 rows)

UPDATE mpp21090_drop_distcol_dml_int4 SET col3='c' WHERE col3 = 'b' AND col5 = 1;
SELECT * FROM mpp21090_drop_distcol_dml_int4 ORDER BY 1,2,3;
 col2 | col3 |    col4    | col5 
------+------+------------+------
 0.00 | a    | 01-01-2014 |    0
 1.00 | c    | 01-02-2014 |    1
(2 rows)

DELETE FROM mpp21090_drop_distcol_dml_int4 WHERE col3='c';
SELECT * FROM mpp21090_drop_distcol_dml_int4 ORDER BY 1,2,3,4;
 col2 | col3 |    col4    | col5 
------+------+------------+------
 0.00 | a    | 01-01-2014 |    0
(1 row)

-- @author prabhd 
-- @created 2014-04-01 12:00:00
-- @modified 2012-04-01 12:00:00
-- @tags dml MPP-21090 ORCA
-- @optimizer_mode on	
-- @description Tests for MPP-21090
\echo --start_ignore
--start_ignore
\echo --end_ignore
--end_ignore
DROP TABLE IF EXISTS mpp21090_drop_distcol_dml_int4;
CREATE TABLE mpp21090_drop_distcol_dml_int4(
col1 int4,
col2 decimal,
col3 char,
col4 date,
col5 int
)  with (appendonly= true, orientation= column) distributed by (col1);
INSERT INTO mpp21090_drop_distcol_dml_int4 VALUES(2000000000,0.00,'a','2014-01-01',0);
SELECT * FROM mpp21090_drop_distcol_dml_int4 ORDER BY 1,2,3,4;
    col1    | col2 | col3 |    col4    | col5 
------------+------+------+------------+------
 2000000000 | 0.00 | a    | 01-01-2014 |    0
(1 row)

ALTER TABLE mpp21090_drop_distcol_dml_int4 DROP COLUMN col1;
NOTICE:  Dropping a column that is part of the distribution policy forces a NULL distribution policy
INSERT INTO mpp21090_drop_distcol_dml_int4 SELECT 1.00,'b','2014-01-02',1;
SELECT * FROM mpp21090_drop_distcol_dml_int4 ORDER BY 1,2,3;
 col2 | col3 |    col4    | col5 
------+------+------------+------
 0.00 | a    | 01-01-2014 |    0
 1.00 | b    | 01-02-2014 |    1
(2 rows)

UPDATE mpp21090_drop_distcol_dml_int4 SET col3='c' WHERE col3 = 'b' AND col5 = 1;
SELECT * FROM mpp21090_drop_distcol_dml_int4 ORDER BY 1,2,3;
 col2 | col3 |    col4    | col5 
------+------+------------+------
 0.00 | a    | 01-01-2014 |    0
 1.00 | c    | 01-02-2014 |    1
(2 rows)

DELETE FROM mpp21090_drop_distcol_dml_int4 WHERE col3='c';
SELECT * FROM mpp21090_drop_distcol_dml_int4 ORDER BY 1,2,3,4;
 col2 | col3 |    col4    | col5 
------+------+------------+------
 0.00 | a    | 01-01-2014 |    0
(1 row)

-- @author prabhd 
-- @created 2014-04-01 12:00:00
-- @modified 2012-04-01 12:00:00
-- @tags dml MPP-21090 ORCA
-- @optimizer_mode on	
-- @description Tests for MPP-21090
\echo --start_ignore
--start_ignore
\echo --end_ignore
--end_ignore
DROP TABLE IF EXISTS mpp21090_drop_distcol_dml_int4;
CREATE TABLE mpp21090_drop_distcol_dml_int4(
col1 int4,
col2 decimal,
col3 char,
col4 date,
col5 int
) distributed by (col1);
INSERT INTO mpp21090_drop_distcol_dml_int4 VALUES(2000000000,0.00,'a','2014-01-01',0);
SELECT * FROM mpp21090_drop_distcol_dml_int4 ORDER BY 1,2,3,4;
    col1    | col2 | col3 |    col4    | col5 
------------+------+------+------------+------
 2000000000 | 0.00 | a    | 01-01-2014 |    0
(1 row)

ALTER TABLE mpp21090_drop_distcol_dml_int4 DROP COLUMN col1;
NOTICE:  Dropping a column that is part of the distribution policy forces a NULL distribution policy
INSERT INTO mpp21090_drop_distcol_dml_int4 SELECT 1.00,'b','2014-01-02',1;
SELECT * FROM mpp21090_drop_distcol_dml_int4 ORDER BY 1,2,3;
 col2 | col3 |    col4    | col5 
------+------+------------+------
 0.00 | a    | 01-01-2014 |    0
 1.00 | b    | 01-02-2014 |    1
(2 rows)

UPDATE mpp21090_drop_distcol_dml_int4 SET col3='c' WHERE col3 = 'b' AND col5 = 1;
SELECT * FROM mpp21090_drop_distcol_dml_int4 ORDER BY 1,2,3;
 col2 | col3 |    col4    | col5 
------+------+------------+------
 0.00 | a    | 01-01-2014 |    0
 1.00 | c    | 01-02-2014 |    1
(2 rows)

DELETE FROM mpp21090_drop_distcol_dml_int4 WHERE col3='c';
SELECT * FROM mpp21090_drop_distcol_dml_int4 ORDER BY 1,2,3,4;
 col2 | col3 |    col4    | col5 
------+------+------------+------
 0.00 | a    | 01-01-2014 |    0
(1 row)

-- @author prabhd 
-- @created 2014-04-01 12:00:00
-- @modified 2012-04-01 12:00:00
-- @tags dml MPP-21090 ORCA
-- @optimizer_mode on	
-- @description Tests for MPP-21090
\echo --start_ignore
--start_ignore
\echo --end_ignore
--end_ignore
DROP TABLE IF EXISTS mpp21090_drop_distcol_dml_int8;
NOTICE:  table "mpp21090_drop_distcol_dml_int8" does not exist, skipping
CREATE TABLE mpp21090_drop_distcol_dml_int8(
col1 int8,
col2 decimal,
col3 char,
col4 date,
col5 int
)  with (appendonly= true) distributed by (col1);
INSERT INTO mpp21090_drop_distcol_dml_int8 VALUES(2000000000000000000,0.00,'a','2014-01-01',0);
SELECT * FROM mpp21090_drop_distcol_dml_int8 ORDER BY 1,2,3,4;
        col1         | col2 | col3 |    col4    | col5 
---------------------+------+------+------------+------
 2000000000000000000 | 0.00 | a    | 01-01-2014 |    0
(1 row)

ALTER TABLE mpp21090_drop_distcol_dml_int8 DROP COLUMN col1;
NOTICE:  Dropping a column that is part of the distribution policy forces a NULL distribution policy
INSERT INTO mpp21090_drop_distcol_dml_int8 SELECT 1.00,'b','2014-01-02',1;
SELECT * FROM mpp21090_drop_distcol_dml_int8 ORDER BY 1,2,3;
 col2 | col3 |    col4    | col5 
------+------+------------+------
 0.00 | a    | 01-01-2014 |    0
 1.00 | b    | 01-02-2014 |    1
(2 rows)

UPDATE mpp21090_drop_distcol_dml_int8 SET col3='c' WHERE col3 = 'b' AND col5 = 1;
SELECT * FROM mpp21090_drop_distcol_dml_int8 ORDER BY 1,2,3;
 col2 | col3 |    col4    | col5 
------+------+------------+------
 0.00 | a    | 01-01-2014 |    0
 1.00 | c    | 01-02-2014 |    1
(2 rows)

DELETE FROM mpp21090_drop_distcol_dml_int8 WHERE col3='c';
SELECT * FROM mpp21090_drop_distcol_dml_int8 ORDER BY 1,2,3,4;
 col2 | col3 |    col4    | col5 
------+------+------------+------
 0.00 | a    | 01-01-2014 |    0
(1 row)

-- @author prabhd 
-- @created 2014-04-01 12:00:00
-- @modified 2012-04-01 12:00:00
-- @tags dml MPP-21090 ORCA
-- @optimizer_mode on	
-- @description Tests for MPP-21090
\echo --start_ignore
--start_ignore
\echo --end_ignore
--end_ignore
DROP TABLE IF EXISTS mpp21090_drop_distcol_dml_int8;
CREATE TABLE mpp21090_drop_distcol_dml_int8(
col1 int8,
col2 decimal,
col3 char,
col4 date,
col5 int
)  with (appendonly= true, orientation= column) distributed by (col1);
INSERT INTO mpp21090_drop_distcol_dml_int8 VALUES(2000000000000000000,0.00,'a','2014-01-01',0);
SELECT * FROM mpp21090_drop_distcol_dml_int8 ORDER BY 1,2,3,4;
        col1         | col2 | col3 |    col4    | col5 
---------------------+------+------+------------+------
 2000000000000000000 | 0.00 | a    | 01-01-2014 |    0
(1 row)

ALTER TABLE mpp21090_drop_distcol_dml_int8 DROP COLUMN col1;
NOTICE:  Dropping a column that is part of the distribution policy forces a NULL distribution policy
INSERT INTO mpp21090_drop_distcol_dml_int8 SELECT 1.00,'b','2014-01-02',1;
SELECT * FROM mpp21090_drop_distcol_dml_int8 ORDER BY 1,2,3;
 col2 | col3 |    col4    | col5 
------+------+------------+------
 0.00 | a    | 01-01-2014 |    0
 1.00 | b    | 01-02-2014 |    1
(2 rows)

UPDATE mpp21090_drop_distcol_dml_int8 SET col3='c' WHERE col3 = 'b' AND col5 = 1;
SELECT * FROM mpp21090_drop_distcol_dml_int8 ORDER BY 1,2,3;
 col2 | col3 |    col4    | col5 
------+------+------------+------
 0.00 | a    | 01-01-2014 |    0
 1.00 | c    | 01-02-2014 |    1
(2 rows)

DELETE FROM mpp21090_drop_distcol_dml_int8 WHERE col3='c';
SELECT * FROM mpp21090_drop_distcol_dml_int8 ORDER BY 1,2,3,4;
 col2 | col3 |    col4    | col5 
------+------+------------+------
 0.00 | a    | 01-01-2014 |    0
(1 row)

-- @author prabhd 
-- @created 2014-04-01 12:00:00
-- @modified 2012-04-01 12:00:00
-- @tags dml MPP-21090 ORCA
-- @optimizer_mode on	
-- @description Tests for MPP-21090
\echo --start_ignore
--start_ignore
\echo --end_ignore
--end_ignore
DROP TABLE IF EXISTS mpp21090_drop_distcol_dml_int8;
CREATE TABLE mpp21090_drop_distcol_dml_int8(
col1 int8,
col2 decimal,
col3 char,
col4 date,
col5 int
) distributed by (col1);
INSERT INTO mpp21090_drop_distcol_dml_int8 VALUES(2000000000000000000,0.00,'a','2014-01-01',0);
SELECT * FROM mpp21090_drop_distcol_dml_int8 ORDER BY 1,2,3,4;
        col1         | col2 | col3 |    col4    | col5 
---------------------+------+------+------------+------
 2000000000000000000 | 0.00 | a    | 01-01-2014 |    0
(1 row)

ALTER TABLE mpp21090_drop_distcol_dml_int8 DROP COLUMN col1;
NOTICE:  Dropping a column that is part of the distribution policy forces a NULL distribution policy
INSERT INTO mpp21090_drop_distcol_dml_int8 SELECT 1.00,'b','2014-01-02',1;
SELECT * FROM mpp21090_drop_distcol_dml_int8 ORDER BY 1,2,3;
 col2 | col3 |    col4    | col5 
------+------+------------+------
 0.00 | a    | 01-01-2014 |    0
 1.00 | b    | 01-02-2014 |    1
(2 rows)

UPDATE mpp21090_drop_distcol_dml_int8 SET col3='c' WHERE col3 = 'b' AND col5 = 1;
SELECT * FROM mpp21090_drop_distcol_dml_int8 ORDER BY 1,2,3;
 col2 | col3 |    col4    | col5 
------+------+------------+------
 0.00 | a    | 01-01-2014 |    0
 1.00 | c    | 01-02-2014 |    1
(2 rows)

DELETE FROM mpp21090_drop_distcol_dml_int8 WHERE col3='c';
SELECT * FROM mpp21090_drop_distcol_dml_int8 ORDER BY 1,2,3,4;
 col2 | col3 |    col4    | col5 
------+------+------------+------
 0.00 | a    | 01-01-2014 |    0
(1 row)

-- @author prabhd 
-- @created 2014-04-01 12:00:00
-- @modified 2012-04-01 12:00:00
-- @tags dml MPP-21090 ORCA
-- @optimizer_mode on	
-- @description Tests for MPP-21090
\echo --start_ignore
--start_ignore
\echo --end_ignore
--end_ignore
DROP TABLE IF EXISTS mpp21090_drop_distcol_dml_int;
NOTICE:  table "mpp21090_drop_distcol_dml_int" does not exist, skipping
CREATE TABLE mpp21090_drop_distcol_dml_int(
col1 int,
col2 decimal,
col3 char,
col4 date,
col5 int
)  with (appendonly= true) distributed by (col1);
INSERT INTO mpp21090_drop_distcol_dml_int VALUES(20000,0.00,'a','2014-01-01',0);
SELECT * FROM mpp21090_drop_distcol_dml_int ORDER BY 1,2,3,4;
 col1  | col2 | col3 |    col4    | col5 
-------+------+------+------------+------
 20000 | 0.00 | a    | 01-01-2014 |    0
(1 row)

ALTER TABLE mpp21090_drop_distcol_dml_int DROP COLUMN col1;
NOTICE:  Dropping a column that is part of the distribution policy forces a NULL distribution policy
INSERT INTO mpp21090_drop_distcol_dml_int SELECT 1.00,'b','2014-01-02',1;
SELECT * FROM mpp21090_drop_distcol_dml_int ORDER BY 1,2,3;
 col2 | col3 |    col4    | col5 
------+------+------------+------
 0.00 | a    | 01-01-2014 |    0
 1.00 | b    | 01-02-2014 |    1
(2 rows)

UPDATE mpp21090_drop_distcol_dml_int SET col3='c' WHERE col3 = 'b' AND col5 = 1;
SELECT * FROM mpp21090_drop_distcol_dml_int ORDER BY 1,2,3;
 col2 | col3 |    col4    | col5 
------+------+------------+------
 0.00 | a    | 01-01-2014 |    0
 1.00 | c    | 01-02-2014 |    1
(2 rows)

DELETE FROM mpp21090_drop_distcol_dml_int WHERE col3='c';
SELECT * FROM mpp21090_drop_distcol_dml_int ORDER BY 1,2,3,4;
 col2 | col3 |    col4    | col5 
------+------+------------+------
 0.00 | a    | 01-01-2014 |    0
(1 row)

-- @author prabhd 
-- @created 2014-04-01 12:00:00
-- @modified 2012-04-01 12:00:00
-- @tags dml MPP-21090 ORCA
-- @optimizer_mode on	
-- @description Tests for MPP-21090
\echo --start_ignore
--start_ignore
\echo --end_ignore
--end_ignore
DROP TABLE IF EXISTS mpp21090_drop_distcol_dml_int;
CREATE TABLE mpp21090_drop_distcol_dml_int(
col1 int,
col2 decimal,
col3 char,
col4 date,
col5 int
)  with (appendonly= true, orientation= column) distributed by (col1);
INSERT INTO mpp21090_drop_distcol_dml_int VALUES(20000,0.00,'a','2014-01-01',0);
SELECT * FROM mpp21090_drop_distcol_dml_int ORDER BY 1,2,3,4;
 col1  | col2 | col3 |    col4    | col5 
-------+------+------+------------+------
 20000 | 0.00 | a    | 01-01-2014 |    0
(1 row)

ALTER TABLE mpp21090_drop_distcol_dml_int DROP COLUMN col1;
NOTICE:  Dropping a column that is part of the distribution policy forces a NULL distribution policy
INSERT INTO mpp21090_drop_distcol_dml_int SELECT 1.00,'b','2014-01-02',1;
SELECT * FROM mpp21090_drop_distcol_dml_int ORDER BY 1,2,3;
 col2 | col3 |    col4    | col5 
------+------+------------+------
 0.00 | a    | 01-01-2014 |    0
 1.00 | b    | 01-02-2014 |    1
(2 rows)

UPDATE mpp21090_drop_distcol_dml_int SET col3='c' WHERE col3 = 'b' AND col5 = 1;
SELECT * FROM mpp21090_drop_distcol_dml_int ORDER BY 1,2,3;
 col2 | col3 |    col4    | col5 
------+------+------------+------
 0.00 | a    | 01-01-2014 |    0
 1.00 | c    | 01-02-2014 |    1
(2 rows)

DELETE FROM mpp21090_drop_distcol_dml_int WHERE col3='c';
SELECT * FROM mpp21090_drop_distcol_dml_int ORDER BY 1,2,3,4;
 col2 | col3 |    col4    | col5 
------+------+------------+------
 0.00 | a    | 01-01-2014 |    0
(1 row)

-- @author prabhd 
-- @created 2014-04-01 12:00:00
-- @modified 2012-04-01 12:00:00
-- @tags dml MPP-21090 ORCA
-- @optimizer_mode on	
-- @description Tests for MPP-21090
\echo --start_ignore
--start_ignore
\echo --end_ignore
--end_ignore
DROP TABLE IF EXISTS mpp21090_drop_distcol_dml_int;
CREATE TABLE mpp21090_drop_distcol_dml_int(
col1 int,
col2 decimal,
col3 char,
col4 date,
col5 int
) distributed by (col1);
INSERT INTO mpp21090_drop_distcol_dml_int VALUES(20000,0.00,'a','2014-01-01',0);
SELECT * FROM mpp21090_drop_distcol_dml_int ORDER BY 1,2,3,4;
 col1  | col2 | col3 |    col4    | col5 
-------+------+------+------------+------
 20000 | 0.00 | a    | 01-01-2014 |    0
(1 row)

ALTER TABLE mpp21090_drop_distcol_dml_int DROP COLUMN col1;
NOTICE:  Dropping a column that is part of the distribution policy forces a NULL distribution policy
INSERT INTO mpp21090_drop_distcol_dml_int SELECT 1.00,'b','2014-01-02',1;
SELECT * FROM mpp21090_drop_distcol_dml_int ORDER BY 1,2,3;
 col2 | col3 |    col4    | col5 
------+------+------------+------
 0.00 | a    | 01-01-2014 |    0
 1.00 | b    | 01-02-2014 |    1
(2 rows)

UPDATE mpp21090_drop_distcol_dml_int SET col3='c' WHERE col3 = 'b' AND col5 = 1;
SELECT * FROM mpp21090_drop_distcol_dml_int ORDER BY 1,2,3;
 col2 | col3 |    col4    | col5 
------+------+------------+------
 0.00 | a    | 01-01-2014 |    0
 1.00 | c    | 01-02-2014 |    1
(2 rows)

DELETE FROM mpp21090_drop_distcol_dml_int WHERE col3='c';
SELECT * FROM mpp21090_drop_distcol_dml_int ORDER BY 1,2,3,4;
 col2 | col3 |    col4    | col5 
------+------+------------+------
 0.00 | a    | 01-01-2014 |    0
(1 row)

-- @author prabhd 
-- @created 2014-04-01 12:00:00
-- @modified 2012-04-01 12:00:00
-- @tags dml MPP-21090 ORCA
-- @optimizer_mode on	
-- @description Tests for MPP-21090
\echo --start_ignore
--start_ignore
\echo --end_ignore
--end_ignore
DROP TABLE IF EXISTS mpp21090_drop_distcol_dml_interval;
NOTICE:  table "mpp21090_drop_distcol_dml_interval" does not exist, skipping
CREATE TABLE mpp21090_drop_distcol_dml_interval(
col1 interval,
col2 decimal,
col3 char,
col4 date,
col5 int
)  with (appendonly= true) distributed by (col1);
INSERT INTO mpp21090_drop_distcol_dml_interval VALUES('1 day',0.00,'a','2014-01-01',0);
SELECT * FROM mpp21090_drop_distcol_dml_interval ORDER BY 1,2,3,4;
  col1   | col2 | col3 |    col4    | col5 
---------+------+------+------------+------
 @ 1 day | 0.00 | a    | 01-01-2014 |    0
(1 row)

ALTER TABLE mpp21090_drop_distcol_dml_interval DROP COLUMN col1;
NOTICE:  Dropping a column that is part of the distribution policy forces a NULL distribution policy
INSERT INTO mpp21090_drop_distcol_dml_interval SELECT 1.00,'b','2014-01-02',1;
SELECT * FROM mpp21090_drop_distcol_dml_interval ORDER BY 1,2,3;
 col2 | col3 |    col4    | col5 
------+------+------------+------
 0.00 | a    | 01-01-2014 |    0
 1.00 | b    | 01-02-2014 |    1
(2 rows)

UPDATE mpp21090_drop_distcol_dml_interval SET col3='c' WHERE col3 = 'b' AND col5 = 1;
SELECT * FROM mpp21090_drop_distcol_dml_interval ORDER BY 1,2,3;
 col2 | col3 |    col4    | col5 
------+------+------------+------
 0.00 | a    | 01-01-2014 |    0
 1.00 | c    | 01-02-2014 |    1
(2 rows)

DELETE FROM mpp21090_drop_distcol_dml_interval WHERE col3='c';
SELECT * FROM mpp21090_drop_distcol_dml_interval ORDER BY 1,2,3,4;
 col2 | col3 |    col4    | col5 
------+------+------------+------
 0.00 | a    | 01-01-2014 |    0
(1 row)

-- @author prabhd 
-- @created 2014-04-01 12:00:00
-- @modified 2012-04-01 12:00:00
-- @tags dml MPP-21090 ORCA
-- @optimizer_mode on	
-- @description Tests for MPP-21090
\echo --start_ignore
--start_ignore
\echo --end_ignore
--end_ignore
DROP TABLE IF EXISTS mpp21090_drop_distcol_dml_interval;
CREATE TABLE mpp21090_drop_distcol_dml_interval(
col1 interval,
col2 decimal,
col3 char,
col4 date,
col5 int
)  with (appendonly= true, orientation= column) distributed by (col1);
INSERT INTO mpp21090_drop_distcol_dml_interval VALUES('1 day',0.00,'a','2014-01-01',0);
SELECT * FROM mpp21090_drop_distcol_dml_interval ORDER BY 1,2,3,4;
  col1   | col2 | col3 |    col4    | col5 
---------+------+------+------------+------
 @ 1 day | 0.00 | a    | 01-01-2014 |    0
(1 row)

ALTER TABLE mpp21090_drop_distcol_dml_interval DROP COLUMN col1;
NOTICE:  Dropping a column that is part of the distribution policy forces a NULL distribution policy
INSERT INTO mpp21090_drop_distcol_dml_interval SELECT 1.00,'b','2014-01-02',1;
SELECT * FROM mpp21090_drop_distcol_dml_interval ORDER BY 1,2,3;
 col2 | col3 |    col4    | col5 
------+------+------------+------
 0.00 | a    | 01-01-2014 |    0
 1.00 | b    | 01-02-2014 |    1
(2 rows)

UPDATE mpp21090_drop_distcol_dml_interval SET col3='c' WHERE col3 = 'b' AND col5 = 1;
SELECT * FROM mpp21090_drop_distcol_dml_interval ORDER BY 1,2,3;
 col2 | col3 |    col4    | col5 
------+------+------------+------
 0.00 | a    | 01-01-2014 |    0
 1.00 | c    | 01-02-2014 |    1
(2 rows)

DELETE FROM mpp21090_drop_distcol_dml_interval WHERE col3='c';
SELECT * FROM mpp21090_drop_distcol_dml_interval ORDER BY 1,2,3,4;
 col2 | col3 |    col4    | col5 
------+------+------------+------
 0.00 | a    | 01-01-2014 |    0
(1 row)

-- @author prabhd 
-- @created 2014-04-01 12:00:00
-- @modified 2012-04-01 12:00:00
-- @tags dml MPP-21090 ORCA
-- @optimizer_mode on	
-- @description Tests for MPP-21090
\echo --start_ignore
--start_ignore
\echo --end_ignore
--end_ignore
DROP TABLE IF EXISTS mpp21090_drop_distcol_dml_interval;
CREATE TABLE mpp21090_drop_distcol_dml_interval(
col1 interval,
col2 decimal,
col3 char,
col4 date,
col5 int
) distributed by (col1);
INSERT INTO mpp21090_drop_distcol_dml_interval VALUES('1 day',0.00,'a','2014-01-01',0);
SELECT * FROM mpp21090_drop_distcol_dml_interval ORDER BY 1,2,3,4;
  col1   | col2 | col3 |    col4    | col5 
---------+------+------+------------+------
 @ 1 day | 0.00 | a    | 01-01-2014 |    0
(1 row)

ALTER TABLE mpp21090_drop_distcol_dml_interval DROP COLUMN col1;
NOTICE:  Dropping a column that is part of the distribution policy forces a NULL distribution policy
INSERT INTO mpp21090_drop_distcol_dml_interval SELECT 1.00,'b','2014-01-02',1;
SELECT * FROM mpp21090_drop_distcol_dml_interval ORDER BY 1,2,3;
 col2 | col3 |    col4    | col5 
------+------+------------+------
 0.00 | a    | 01-01-2014 |    0
 1.00 | b    | 01-02-2014 |    1
(2 rows)

UPDATE mpp21090_drop_distcol_dml_interval SET col3='c' WHERE col3 = 'b' AND col5 = 1;
SELECT * FROM mpp21090_drop_distcol_dml_interval ORDER BY 1,2,3;
 col2 | col3 |    col4    | col5 
------+------+------------+------
 0.00 | a    | 01-01-2014 |    0
 1.00 | c    | 01-02-2014 |    1
(2 rows)

DELETE FROM mpp21090_drop_distcol_dml_interval WHERE col3='c';
SELECT * FROM mpp21090_drop_distcol_dml_interval ORDER BY 1,2,3,4;
 col2 | col3 |    col4    | col5 
------+------+------------+------
 0.00 | a    | 01-01-2014 |    0
(1 row)

-- @author prabhd 
-- @created 2014-04-01 12:00:00
-- @modified 2012-04-01 12:00:00
-- @tags dml MPP-21090 ORCA
-- @optimizer_mode on	
-- @description Tests for MPP-21090
\echo --start_ignore
--start_ignore
\echo --end_ignore
--end_ignore
DROP TABLE IF EXISTS mpp21090_drop_distcol_dml_numeric;
NOTICE:  table "mpp21090_drop_distcol_dml_numeric" does not exist, skipping
CREATE TABLE mpp21090_drop_distcol_dml_numeric(
col1 numeric,
col2 decimal,
col3 char,
col4 date,
col5 int
)  with (appendonly= true) distributed by (col1);
INSERT INTO mpp21090_drop_distcol_dml_numeric VALUES(2.000000,0.00,'a','2014-01-01',0);
SELECT * FROM mpp21090_drop_distcol_dml_numeric ORDER BY 1,2,3,4;
   col1   | col2 | col3 |    col4    | col5 
----------+------+------+------------+------
 2.000000 | 0.00 | a    | 01-01-2014 |    0
(1 row)

ALTER TABLE mpp21090_drop_distcol_dml_numeric DROP COLUMN col1;
NOTICE:  Dropping a column that is part of the distribution policy forces a NULL distribution policy
INSERT INTO mpp21090_drop_distcol_dml_numeric SELECT 1.00,'b','2014-01-02',1;
SELECT * FROM mpp21090_drop_distcol_dml_numeric ORDER BY 1,2,3;
 col2 | col3 |    col4    | col5 
------+------+------------+------
 0.00 | a    | 01-01-2014 |    0
 1.00 | b    | 01-02-2014 |    1
(2 rows)

UPDATE mpp21090_drop_distcol_dml_numeric SET col3='c' WHERE col3 = 'b' AND col5 = 1;
SELECT * FROM mpp21090_drop_distcol_dml_numeric ORDER BY 1,2,3;
 col2 | col3 |    col4    | col5 
------+------+------------+------
 0.00 | a    | 01-01-2014 |    0
 1.00 | c    | 01-02-2014 |    1
(2 rows)

DELETE FROM mpp21090_drop_distcol_dml_numeric WHERE col3='c';
SELECT * FROM mpp21090_drop_distcol_dml_numeric ORDER BY 1,2,3,4;
 col2 | col3 |    col4    | col5 
------+------+------------+------
 0.00 | a    | 01-01-2014 |    0
(1 row)

-- @author prabhd 
-- @created 2014-04-01 12:00:00
-- @modified 2012-04-01 12:00:00
-- @tags dml MPP-21090 ORCA
-- @optimizer_mode on	
-- @description Tests for MPP-21090
\echo --start_ignore
--start_ignore
\echo --end_ignore
--end_ignore
DROP TABLE IF EXISTS mpp21090_drop_distcol_dml_numeric;
CREATE TABLE mpp21090_drop_distcol_dml_numeric(
col1 numeric,
col2 decimal,
col3 char,
col4 date,
col5 int
)  with (appendonly= true, orientation= column) distributed by (col1);
INSERT INTO mpp21090_drop_distcol_dml_numeric VALUES(2.000000,0.00,'a','2014-01-01',0);
SELECT * FROM mpp21090_drop_distcol_dml_numeric ORDER BY 1,2,3,4;
   col1   | col2 | col3 |    col4    | col5 
----------+------+------+------------+------
 2.000000 | 0.00 | a    | 01-01-2014 |    0
(1 row)

ALTER TABLE mpp21090_drop_distcol_dml_numeric DROP COLUMN col1;
NOTICE:  Dropping a column that is part of the distribution policy forces a NULL distribution policy
INSERT INTO mpp21090_drop_distcol_dml_numeric SELECT 1.00,'b','2014-01-02',1;
SELECT * FROM mpp21090_drop_distcol_dml_numeric ORDER BY 1,2,3;
 col2 | col3 |    col4    | col5 
------+------+------------+------
 0.00 | a    | 01-01-2014 |    0
 1.00 | b    | 01-02-2014 |    1
(2 rows)

UPDATE mpp21090_drop_distcol_dml_numeric SET col3='c' WHERE col3 = 'b' AND col5 = 1;
SELECT * FROM mpp21090_drop_distcol_dml_numeric ORDER BY 1,2,3;
 col2 | col3 |    col4    | col5 
------+------+------------+------
 0.00 | a    | 01-01-2014 |    0
 1.00 | c    | 01-02-2014 |    1
(2 rows)

DELETE FROM mpp21090_drop_distcol_dml_numeric WHERE col3='c';
SELECT * FROM mpp21090_drop_distcol_dml_numeric ORDER BY 1,2,3,4;
 col2 | col3 |    col4    | col5 
------+------+------------+------
 0.00 | a    | 01-01-2014 |    0
(1 row)

-- @author prabhd 
-- @created 2014-04-01 12:00:00
-- @modified 2012-04-01 12:00:00
-- @tags dml MPP-21090 ORCA
-- @optimizer_mode on	
-- @description Tests for MPP-21090
\echo --start_ignore
--start_ignore
\echo --end_ignore
--end_ignore
DROP TABLE IF EXISTS mpp21090_drop_distcol_dml_numeric;
CREATE TABLE mpp21090_drop_distcol_dml_numeric(
col1 numeric,
col2 decimal,
col3 char,
col4 date,
col5 int
) distributed by (col1);
INSERT INTO mpp21090_drop_distcol_dml_numeric VALUES(2.000000,0.00,'a','2014-01-01',0);
SELECT * FROM mpp21090_drop_distcol_dml_numeric ORDER BY 1,2,3,4;
   col1   | col2 | col3 |    col4    | col5 
----------+------+------+------------+------
 2.000000 | 0.00 | a    | 01-01-2014 |    0
(1 row)

ALTER TABLE mpp21090_drop_distcol_dml_numeric DROP COLUMN col1;
NOTICE:  Dropping a column that is part of the distribution policy forces a NULL distribution policy
INSERT INTO mpp21090_drop_distcol_dml_numeric SELECT 1.00,'b','2014-01-02',1;
SELECT * FROM mpp21090_drop_distcol_dml_numeric ORDER BY 1,2,3;
 col2 | col3 |    col4    | col5 
------+------+------------+------
 0.00 | a    | 01-01-2014 |    0
 1.00 | b    | 01-02-2014 |    1
(2 rows)

UPDATE mpp21090_drop_distcol_dml_numeric SET col3='c' WHERE col3 = 'b' AND col5 = 1;
SELECT * FROM mpp21090_drop_distcol_dml_numeric ORDER BY 1,2,3;
 col2 | col3 |    col4    | col5 
------+------+------------+------
 0.00 | a    | 01-01-2014 |    0
 1.00 | c    | 01-02-2014 |    1
(2 rows)

DELETE FROM mpp21090_drop_distcol_dml_numeric WHERE col3='c';
SELECT * FROM mpp21090_drop_distcol_dml_numeric ORDER BY 1,2,3,4;
 col2 | col3 |    col4    | col5 
------+------+------------+------
 0.00 | a    | 01-01-2014 |    0
(1 row)

-- @author prabhd 
-- @created 2014-04-01 12:00:00
-- @modified 2012-04-01 12:00:00
-- @tags dml MPP-21090 ORCA
-- @optimizer_mode on	
-- @description Tests for MPP-21090
\echo --start_ignore
--start_ignore
\echo --end_ignore
--end_ignore
DROP TABLE IF EXISTS mpp21090_drop_distcol_dml_text;
NOTICE:  table "mpp21090_drop_distcol_dml_text" does not exist, skipping
CREATE TABLE mpp21090_drop_distcol_dml_text(
col1 text,
col2 decimal,
col3 char,
col4 date,
col5 int
)  with (appendonly= true) distributed by (col1);
INSERT INTO mpp21090_drop_distcol_dml_text VALUES('abcdefghijklmnop',0.00,'a','2014-01-01',0);
SELECT * FROM mpp21090_drop_distcol_dml_text ORDER BY 1,2,3,4;
       col1       | col2 | col3 |    col4    | col5 
------------------+------+------+------------+------
 abcdefghijklmnop | 0.00 | a    | 01-01-2014 |    0
(1 row)

ALTER TABLE mpp21090_drop_distcol_dml_text DROP COLUMN col1;
NOTICE:  Dropping a column that is part of the distribution policy forces a NULL distribution policy
INSERT INTO mpp21090_drop_distcol_dml_text SELECT 1.00,'b','2014-01-02',1;
SELECT * FROM mpp21090_drop_distcol_dml_text ORDER BY 1,2,3;
 col2 | col3 |    col4    | col5 
------+------+------------+------
 0.00 | a    | 01-01-2014 |    0
 1.00 | b    | 01-02-2014 |    1
(2 rows)

UPDATE mpp21090_drop_distcol_dml_text SET col3='c' WHERE col3 = 'b' AND col5 = 1;
SELECT * FROM mpp21090_drop_distcol_dml_text ORDER BY 1,2,3;
 col2 | col3 |    col4    | col5 
------+------+------------+------
 0.00 | a    | 01-01-2014 |    0
 1.00 | c    | 01-02-2014 |    1
(2 rows)

DELETE FROM mpp21090_drop_distcol_dml_text WHERE col3='c';
SELECT * FROM mpp21090_drop_distcol_dml_text ORDER BY 1,2,3,4;
 col2 | col3 |    col4    | col5 
------+------+------------+------
 0.00 | a    | 01-01-2014 |    0
(1 row)

-- @author prabhd 
-- @created 2014-04-01 12:00:00
-- @modified 2012-04-01 12:00:00
-- @tags dml MPP-21090 ORCA
-- @optimizer_mode on	
-- @description Tests for MPP-21090
\echo --start_ignore
--start_ignore
\echo --end_ignore
--end_ignore
DROP TABLE IF EXISTS mpp21090_drop_distcol_dml_text;
CREATE TABLE mpp21090_drop_distcol_dml_text(
col1 text,
col2 decimal,
col3 char,
col4 date,
col5 int
)  with (appendonly= true, orientation= column) distributed by (col1);
INSERT INTO mpp21090_drop_distcol_dml_text VALUES('abcdefghijklmnop',0.00,'a','2014-01-01',0);
SELECT * FROM mpp21090_drop_distcol_dml_text ORDER BY 1,2,3,4;
       col1       | col2 | col3 |    col4    | col5 
------------------+------+------+------------+------
 abcdefghijklmnop | 0.00 | a    | 01-01-2014 |    0
(1 row)

ALTER TABLE mpp21090_drop_distcol_dml_text DROP COLUMN col1;
NOTICE:  Dropping a column that is part of the distribution policy forces a NULL distribution policy
INSERT INTO mpp21090_drop_distcol_dml_text SELECT 1.00,'b','2014-01-02',1;
SELECT * FROM mpp21090_drop_distcol_dml_text ORDER BY 1,2,3;
 col2 | col3 |    col4    | col5 
------+------+------------+------
 0.00 | a    | 01-01-2014 |    0
 1.00 | b    | 01-02-2014 |    1
(2 rows)

UPDATE mpp21090_drop_distcol_dml_text SET col3='c' WHERE col3 = 'b' AND col5 = 1;
SELECT * FROM mpp21090_drop_distcol_dml_text ORDER BY 1,2,3;
 col2 | col3 |    col4    | col5 
------+------+------------+------
 0.00 | a    | 01-01-2014 |    0
 1.00 | c    | 01-02-2014 |    1
(2 rows)

DELETE FROM mpp21090_drop_distcol_dml_text WHERE col3='c';
SELECT * FROM mpp21090_drop_distcol_dml_text ORDER BY 1,2,3,4;
 col2 | col3 |    col4    | col5 
------+------+------------+------
 0.00 | a    | 01-01-2014 |    0
(1 row)

-- @author prabhd 
-- @created 2014-04-01 12:00:00
-- @modified 2012-04-01 12:00:00
-- @tags dml MPP-21090 ORCA
-- @optimizer_mode on	
-- @description Tests for MPP-21090
\echo --start_ignore
--start_ignore
\echo --end_ignore
--end_ignore
DROP TABLE IF EXISTS mpp21090_drop_distcol_dml_text;
CREATE TABLE mpp21090_drop_distcol_dml_text(
col1 text,
col2 decimal,
col3 char,
col4 date,
col5 int
) distributed by (col1);
INSERT INTO mpp21090_drop_distcol_dml_text VALUES('abcdefghijklmnop',0.00,'a','2014-01-01',0);
SELECT * FROM mpp21090_drop_distcol_dml_text ORDER BY 1,2,3,4;
       col1       | col2 | col3 |    col4    | col5 
------------------+------+------+------------+------
 abcdefghijklmnop | 0.00 | a    | 01-01-2014 |    0
(1 row)

ALTER TABLE mpp21090_drop_distcol_dml_text DROP COLUMN col1;
NOTICE:  Dropping a column that is part of the distribution policy forces a NULL distribution policy
INSERT INTO mpp21090_drop_distcol_dml_text SELECT 1.00,'b','2014-01-02',1;
SELECT * FROM mpp21090_drop_distcol_dml_text ORDER BY 1,2,3;
 col2 | col3 |    col4    | col5 
------+------+------------+------
 0.00 | a    | 01-01-2014 |    0
 1.00 | b    | 01-02-2014 |    1
(2 rows)

UPDATE mpp21090_drop_distcol_dml_text SET col3='c' WHERE col3 = 'b' AND col5 = 1;
SELECT * FROM mpp21090_drop_distcol_dml_text ORDER BY 1,2,3;
 col2 | col3 |    col4    | col5 
------+------+------------+------
 0.00 | a    | 01-01-2014 |    0
 1.00 | c    | 01-02-2014 |    1
(2 rows)

DELETE FROM mpp21090_drop_distcol_dml_text WHERE col3='c';
SELECT * FROM mpp21090_drop_distcol_dml_text ORDER BY 1,2,3,4;
 col2 | col3 |    col4    | col5 
------+------+------------+------
 0.00 | a    | 01-01-2014 |    0
(1 row)

-- @author prabhd 
-- @created 2014-04-01 12:00:00
-- @modified 2012-04-01 12:00:00
-- @tags dml MPP-21090 ORCA
-- @optimizer_mode on	
-- @description Tests for MPP-21090
\echo --start_ignore
--start_ignore
\echo --end_ignore
--end_ignore
DROP TABLE IF EXISTS mpp21090_drop_distcol_dml_time;
NOTICE:  table "mpp21090_drop_distcol_dml_time" does not exist, skipping
CREATE TABLE mpp21090_drop_distcol_dml_time(
col1 time,
col2 decimal,
col3 char,
col4 date,
col5 int
)  with (appendonly= true) distributed by (col1);
INSERT INTO mpp21090_drop_distcol_dml_time VALUES('12:00:00',0.00,'a','2014-01-01',0);
SELECT * FROM mpp21090_drop_distcol_dml_time ORDER BY 1,2,3,4;
   col1   | col2 | col3 |    col4    | col5 
----------+------+------+------------+------
 12:00:00 | 0.00 | a    | 01-01-2014 |    0
(1 row)

ALTER TABLE mpp21090_drop_distcol_dml_time DROP COLUMN col1;
NOTICE:  Dropping a column that is part of the distribution policy forces a NULL distribution policy
INSERT INTO mpp21090_drop_distcol_dml_time SELECT 1.00,'b','2014-01-02',1;
SELECT * FROM mpp21090_drop_distcol_dml_time ORDER BY 1,2,3;
 col2 | col3 |    col4    | col5 
------+------+------------+------
 0.00 | a    | 01-01-2014 |    0
 1.00 | b    | 01-02-2014 |    1
(2 rows)

UPDATE mpp21090_drop_distcol_dml_time SET col3='c' WHERE col3 = 'b' AND col5 = 1;
SELECT * FROM mpp21090_drop_distcol_dml_time ORDER BY 1,2,3;
 col2 | col3 |    col4    | col5 
------+------+------------+------
 0.00 | a    | 01-01-2014 |    0
 1.00 | c    | 01-02-2014 |    1
(2 rows)

DELETE FROM mpp21090_drop_distcol_dml_time WHERE col3='c';
SELECT * FROM mpp21090_drop_distcol_dml_time ORDER BY 1,2,3,4;
 col2 | col3 |    col4    | col5 
------+------+------------+------
 0.00 | a    | 01-01-2014 |    0
(1 row)

-- @author prabhd 
-- @created 2014-04-01 12:00:00
-- @modified 2012-04-01 12:00:00
-- @tags dml MPP-21090 ORCA
-- @optimizer_mode on	
-- @description Tests for MPP-21090
\echo --start_ignore
--start_ignore
\echo --end_ignore
--end_ignore
DROP TABLE IF EXISTS mpp21090_drop_distcol_dml_time;
CREATE TABLE mpp21090_drop_distcol_dml_time(
col1 time,
col2 decimal,
col3 char,
col4 date,
col5 int
)  with (appendonly= true, orientation= column) distributed by (col1);
INSERT INTO mpp21090_drop_distcol_dml_time VALUES('12:00:00',0.00,'a','2014-01-01',0);
SELECT * FROM mpp21090_drop_distcol_dml_time ORDER BY 1,2,3,4;
   col1   | col2 | col3 |    col4    | col5 
----------+------+------+------------+------
 12:00:00 | 0.00 | a    | 01-01-2014 |    0
(1 row)

ALTER TABLE mpp21090_drop_distcol_dml_time DROP COLUMN col1;
NOTICE:  Dropping a column that is part of the distribution policy forces a NULL distribution policy
INSERT INTO mpp21090_drop_distcol_dml_time SELECT 1.00,'b','2014-01-02',1;
SELECT * FROM mpp21090_drop_distcol_dml_time ORDER BY 1,2,3;
 col2 | col3 |    col4    | col5 
------+------+------------+------
 0.00 | a    | 01-01-2014 |    0
 1.00 | b    | 01-02-2014 |    1
(2 rows)

UPDATE mpp21090_drop_distcol_dml_time SET col3='c' WHERE col3 = 'b' AND col5 = 1;
SELECT * FROM mpp21090_drop_distcol_dml_time ORDER BY 1,2,3;
 col2 | col3 |    col4    | col5 
------+------+------------+------
 0.00 | a    | 01-01-2014 |    0
 1.00 | c    | 01-02-2014 |    1
(2 rows)

DELETE FROM mpp21090_drop_distcol_dml_time WHERE col3='c';
SELECT * FROM mpp21090_drop_distcol_dml_time ORDER BY 1,2,3,4;
 col2 | col3 |    col4    | col5 
------+------+------------+------
 0.00 | a    | 01-01-2014 |    0
(1 row)

-- @author prabhd 
-- @created 2014-04-01 12:00:00
-- @modified 2012-04-01 12:00:00
-- @tags dml MPP-21090 ORCA
-- @optimizer_mode on	
-- @description Tests for MPP-21090
\echo --start_ignore
--start_ignore
\echo --end_ignore
--end_ignore
DROP TABLE IF EXISTS mpp21090_drop_distcol_dml_time;
CREATE TABLE mpp21090_drop_distcol_dml_time(
col1 time,
col2 decimal,
col3 char,
col4 date,
col5 int
) distributed by (col1);
INSERT INTO mpp21090_drop_distcol_dml_time VALUES('12:00:00',0.00,'a','2014-01-01',0);
SELECT * FROM mpp21090_drop_distcol_dml_time ORDER BY 1,2,3,4;
   col1   | col2 | col3 |    col4    | col5 
----------+------+------+------------+------
 12:00:00 | 0.00 | a    | 01-01-2014 |    0
(1 row)

ALTER TABLE mpp21090_drop_distcol_dml_time DROP COLUMN col1;
NOTICE:  Dropping a column that is part of the distribution policy forces a NULL distribution policy
INSERT INTO mpp21090_drop_distcol_dml_time SELECT 1.00,'b','2014-01-02',1;
SELECT * FROM mpp21090_drop_distcol_dml_time ORDER BY 1,2,3;
 col2 | col3 |    col4    | col5 
------+------+------------+------
 0.00 | a    | 01-01-2014 |    0
 1.00 | b    | 01-02-2014 |    1
(2 rows)

UPDATE mpp21090_drop_distcol_dml_time SET col3='c' WHERE col3 = 'b' AND col5 = 1;
SELECT * FROM mpp21090_drop_distcol_dml_time ORDER BY 1,2,3;
 col2 | col3 |    col4    | col5 
------+------+------------+------
 0.00 | a    | 01-01-2014 |    0
 1.00 | c    | 01-02-2014 |    1
(2 rows)

DELETE FROM mpp21090_drop_distcol_dml_time WHERE col3='c';
SELECT * FROM mpp21090_drop_distcol_dml_time ORDER BY 1,2,3,4;
 col2 | col3 |    col4    | col5 
------+------+------------+------
 0.00 | a    | 01-01-2014 |    0
(1 row)

-- @author prabhd 
-- @created 2014-04-01 12:00:00
-- @modified 2012-04-01 12:00:00
-- @tags dml MPP-21090 ORCA
-- @optimizer_mode on	
-- @description Tests for MPP-21090
\echo --start_ignore
--start_ignore
\echo --end_ignore
--end_ignore
DROP TABLE IF EXISTS mpp21090_drop_distcol_dml_timestamp;
NOTICE:  table "mpp21090_drop_distcol_dml_timestamp" does not exist, skipping
CREATE TABLE mpp21090_drop_distcol_dml_timestamp(
col1 timestamp,
col2 decimal,
col3 char,
col4 date,
col5 int
)  with (appendonly= true) distributed by (col1);
INSERT INTO mpp21090_drop_distcol_dml_timestamp VALUES('2013-12-31 12:00:00',0.00,'a','2014-01-01',0);
SELECT * FROM mpp21090_drop_distcol_dml_timestamp ORDER BY 1,2,3,4;
           col1           | col2 | col3 |    col4    | col5 
--------------------------+------+------+------------+------
 Tue Dec 31 12:00:00 2013 | 0.00 | a    | 01-01-2014 |    0
(1 row)

ALTER TABLE mpp21090_drop_distcol_dml_timestamp DROP COLUMN col1;
NOTICE:  Dropping a column that is part of the distribution policy forces a NULL distribution policy
INSERT INTO mpp21090_drop_distcol_dml_timestamp SELECT 1.00,'b','2014-01-02',1;
SELECT * FROM mpp21090_drop_distcol_dml_timestamp ORDER BY 1,2,3;
 col2 | col3 |    col4    | col5 
------+------+------------+------
 0.00 | a    | 01-01-2014 |    0
 1.00 | b    | 01-02-2014 |    1
(2 rows)

UPDATE mpp21090_drop_distcol_dml_timestamp SET col3='c' WHERE col3 = 'b' AND col5 = 1;
SELECT * FROM mpp21090_drop_distcol_dml_timestamp ORDER BY 1,2,3;
 col2 | col3 |    col4    | col5 
------+------+------------+------
 0.00 | a    | 01-01-2014 |    0
 1.00 | c    | 01-02-2014 |    1
(2 rows)

DELETE FROM mpp21090_drop_distcol_dml_timestamp WHERE col3='c';
SELECT * FROM mpp21090_drop_distcol_dml_timestamp ORDER BY 1,2,3,4;
 col2 | col3 |    col4    | col5 
------+------+------------+------
 0.00 | a    | 01-01-2014 |    0
(1 row)

-- @author prabhd 
-- @created 2014-04-01 12:00:00
-- @modified 2012-04-01 12:00:00
-- @tags dml MPP-21090 ORCA
-- @optimizer_mode on	
-- @description Tests for MPP-21090
\echo --start_ignore
--start_ignore
\echo --end_ignore
--end_ignore
DROP TABLE IF EXISTS mpp21090_drop_distcol_dml_timestamp;
CREATE TABLE mpp21090_drop_distcol_dml_timestamp(
col1 timestamp,
col2 decimal,
col3 char,
col4 date,
col5 int
)  with (appendonly= true, orientation= column) distributed by (col1);
INSERT INTO mpp21090_drop_distcol_dml_timestamp VALUES('2013-12-31 12:00:00',0.00,'a','2014-01-01',0);
SELECT * FROM mpp21090_drop_distcol_dml_timestamp ORDER BY 1,2,3,4;
           col1           | col2 | col3 |    col4    | col5 
--------------------------+------+------+------------+------
 Tue Dec 31 12:00:00 2013 | 0.00 | a    | 01-01-2014 |    0
(1 row)

ALTER TABLE mpp21090_drop_distcol_dml_timestamp DROP COLUMN col1;
NOTICE:  Dropping a column that is part of the distribution policy forces a NULL distribution policy
INSERT INTO mpp21090_drop_distcol_dml_timestamp SELECT 1.00,'b','2014-01-02',1;
SELECT * FROM mpp21090_drop_distcol_dml_timestamp ORDER BY 1,2,3;
 col2 | col3 |    col4    | col5 
------+------+------------+------
 0.00 | a    | 01-01-2014 |    0
 1.00 | b    | 01-02-2014 |    1
(2 rows)

UPDATE mpp21090_drop_distcol_dml_timestamp SET col3='c' WHERE col3 = 'b' AND col5 = 1;
SELECT * FROM mpp21090_drop_distcol_dml_timestamp ORDER BY 1,2,3;
 col2 | col3 |    col4    | col5 
------+------+------------+------
 0.00 | a    | 01-01-2014 |    0
 1.00 | c    | 01-02-2014 |    1
(2 rows)

DELETE FROM mpp21090_drop_distcol_dml_timestamp WHERE col3='c';
SELECT * FROM mpp21090_drop_distcol_dml_timestamp ORDER BY 1,2,3,4;
 col2 | col3 |    col4    | col5 
------+------+------------+------
 0.00 | a    | 01-01-2014 |    0
(1 row)

-- @author prabhd 
-- @created 2014-04-01 12:00:00
-- @modified 2012-04-01 12:00:00
-- @tags dml MPP-21090 ORCA
-- @optimizer_mode on	
-- @description Tests for MPP-21090
\echo --start_ignore
--start_ignore
\echo --end_ignore
--end_ignore
DROP TABLE IF EXISTS mpp21090_drop_distcol_dml_timestamp;
CREATE TABLE mpp21090_drop_distcol_dml_timestamp(
col1 timestamp,
col2 decimal,
col3 char,
col4 date,
col5 int
) distributed by (col1);
INSERT INTO mpp21090_drop_distcol_dml_timestamp VALUES('2013-12-31 12:00:00',0.00,'a','2014-01-01',0);
SELECT * FROM mpp21090_drop_distcol_dml_timestamp ORDER BY 1,2,3,4;
           col1           | col2 | col3 |    col4    | col5 
--------------------------+------+------+------------+------
 Tue Dec 31 12:00:00 2013 | 0.00 | a    | 01-01-2014 |    0
(1 row)

ALTER TABLE mpp21090_drop_distcol_dml_timestamp DROP COLUMN col1;
NOTICE:  Dropping a column that is part of the distribution policy forces a NULL distribution policy
INSERT INTO mpp21090_drop_distcol_dml_timestamp SELECT 1.00,'b','2014-01-02',1;
SELECT * FROM mpp21090_drop_distcol_dml_timestamp ORDER BY 1,2,3;
 col2 | col3 |    col4    | col5 
------+------+------------+------
 0.00 | a    | 01-01-2014 |    0
 1.00 | b    | 01-02-2014 |    1
(2 rows)

UPDATE mpp21090_drop_distcol_dml_timestamp SET col3='c' WHERE col3 = 'b' AND col5 = 1;
SELECT * FROM mpp21090_drop_distcol_dml_timestamp ORDER BY 1,2,3;
 col2 | col3 |    col4    | col5 
------+------+------------+------
 0.00 | a    | 01-01-2014 |    0
 1.00 | c    | 01-02-2014 |    1
(2 rows)

DELETE FROM mpp21090_drop_distcol_dml_timestamp WHERE col3='c';
SELECT * FROM mpp21090_drop_distcol_dml_timestamp ORDER BY 1,2,3,4;
 col2 | col3 |    col4    | col5 
------+------+------------+------
 0.00 | a    | 01-01-2014 |    0
(1 row)

-- @author prabhd 
-- @created 2014-04-01 12:00:00
-- @modified 2012-04-01 12:00:00
-- @tags dml MPP-21090 ORCA
-- @optimizer_mode on	
-- @description Tests for MPP-21090
\echo --start_ignore
--start_ignore
\echo --end_ignore
--end_ignore
DROP TABLE IF EXISTS mpp21090_drop_distcol_dml_timestamptz;
NOTICE:  table "mpp21090_drop_distcol_dml_timestamptz" does not exist, skipping
CREATE TABLE mpp21090_drop_distcol_dml_timestamptz(
col1 timestamptz,
col2 decimal,
col3 char,
col4 date,
col5 int
)  with (appendonly= true) distributed by (col1);
INSERT INTO mpp21090_drop_distcol_dml_timestamptz VALUES('2013-12-31 12:00:00 PST',0.00,'a','2014-01-01',0);
SELECT * FROM mpp21090_drop_distcol_dml_timestamptz ORDER BY 1,2,3,4;
             col1             | col2 | col3 |    col4    | col5 
------------------------------+------+------+------------+------
 Tue Dec 31 12:00:00 2013 PST | 0.00 | a    | 01-01-2014 |    0
(1 row)

ALTER TABLE mpp21090_drop_distcol_dml_timestamptz DROP COLUMN col1;
NOTICE:  Dropping a column that is part of the distribution policy forces a NULL distribution policy
INSERT INTO mpp21090_drop_distcol_dml_timestamptz SELECT 1.00,'b','2014-01-02',1;
SELECT * FROM mpp21090_drop_distcol_dml_timestamptz ORDER BY 1,2,3;
 col2 | col3 |    col4    | col5 
------+------+------------+------
 0.00 | a    | 01-01-2014 |    0
 1.00 | b    | 01-02-2014 |    1
(2 rows)

UPDATE mpp21090_drop_distcol_dml_timestamptz SET col3='c' WHERE col3 = 'b' AND col5 = 1;
SELECT * FROM mpp21090_drop_distcol_dml_timestamptz ORDER BY 1,2,3;
 col2 | col3 |    col4    | col5 
------+------+------------+------
 0.00 | a    | 01-01-2014 |    0
 1.00 | c    | 01-02-2014 |    1
(2 rows)

DELETE FROM mpp21090_drop_distcol_dml_timestamptz WHERE col3='c';
SELECT * FROM mpp21090_drop_distcol_dml_timestamptz ORDER BY 1,2,3,4;
 col2 | col3 |    col4    | col5 
------+------+------------+------
 0.00 | a    | 01-01-2014 |    0
(1 row)

-- @author prabhd 
-- @created 2014-04-01 12:00:00
-- @modified 2012-04-01 12:00:00
-- @tags dml MPP-21090 ORCA
-- @optimizer_mode on	
-- @description Tests for MPP-21090
\echo --start_ignore
--start_ignore
\echo --end_ignore
--end_ignore
DROP TABLE IF EXISTS mpp21090_drop_distcol_dml_timestamptz;
CREATE TABLE mpp21090_drop_distcol_dml_timestamptz(
col1 timestamptz,
col2 decimal,
col3 char,
col4 date,
col5 int
)  with (appendonly= true, orientation= column) distributed by (col1);
INSERT INTO mpp21090_drop_distcol_dml_timestamptz VALUES('2013-12-31 12:00:00 PST',0.00,'a','2014-01-01',0);
SELECT * FROM mpp21090_drop_distcol_dml_timestamptz ORDER BY 1,2,3,4;
             col1             | col2 | col3 |    col4    | col5 
------------------------------+------+------+------------+------
 Tue Dec 31 12:00:00 2013 PST | 0.00 | a    | 01-01-2014 |    0
(1 row)

ALTER TABLE mpp21090_drop_distcol_dml_timestamptz DROP COLUMN col1;
NOTICE:  Dropping a column that is part of the distribution policy forces a NULL distribution policy
INSERT INTO mpp21090_drop_distcol_dml_timestamptz SELECT 1.00,'b','2014-01-02',1;
SELECT * FROM mpp21090_drop_distcol_dml_timestamptz ORDER BY 1,2,3;
 col2 | col3 |    col4    | col5 
------+------+------------+------
 0.00 | a    | 01-01-2014 |    0
 1.00 | b    | 01-02-2014 |    1
(2 rows)

UPDATE mpp21090_drop_distcol_dml_timestamptz SET col3='c' WHERE col3 = 'b' AND col5 = 1;
SELECT * FROM mpp21090_drop_distcol_dml_timestamptz ORDER BY 1,2,3;
 col2 | col3 |    col4    | col5 
------+------+------------+------
 0.00 | a    | 01-01-2014 |    0
 1.00 | c    | 01-02-2014 |    1
(2 rows)

DELETE FROM mpp21090_drop_distcol_dml_timestamptz WHERE col3='c';
SELECT * FROM mpp21090_drop_distcol_dml_timestamptz ORDER BY 1,2,3,4;
 col2 | col3 |    col4    | col5 
------+------+------------+------
 0.00 | a    | 01-01-2014 |    0
(1 row)

-- @author prabhd 
-- @created 2014-04-01 12:00:00
-- @modified 2012-04-01 12:00:00
-- @tags dml MPP-21090 ORCA
-- @optimizer_mode on	
-- @description Tests for MPP-21090
\echo --start_ignore
--start_ignore
\echo --end_ignore
--end_ignore
DROP TABLE IF EXISTS mpp21090_drop_distcol_dml_timestamptz;
CREATE TABLE mpp21090_drop_distcol_dml_timestamptz(
col1 timestamptz,
col2 decimal,
col3 char,
col4 date,
col5 int
) distributed by (col1);
INSERT INTO mpp21090_drop_distcol_dml_timestamptz VALUES('2013-12-31 12:00:00 PST',0.00,'a','2014-01-01',0);
SELECT * FROM mpp21090_drop_distcol_dml_timestamptz ORDER BY 1,2,3,4;
             col1             | col2 | col3 |    col4    | col5 
------------------------------+------+------+------------+------
 Tue Dec 31 12:00:00 2013 PST | 0.00 | a    | 01-01-2014 |    0
(1 row)

ALTER TABLE mpp21090_drop_distcol_dml_timestamptz DROP COLUMN col1;
NOTICE:  Dropping a column that is part of the distribution policy forces a NULL distribution policy
INSERT INTO mpp21090_drop_distcol_dml_timestamptz SELECT 1.00,'b','2014-01-02',1;
SELECT * FROM mpp21090_drop_distcol_dml_timestamptz ORDER BY 1,2,3;
 col2 | col3 |    col4    | col5 
------+------+------------+------
 0.00 | a    | 01-01-2014 |    0
 1.00 | b    | 01-02-2014 |    1
(2 rows)

UPDATE mpp21090_drop_distcol_dml_timestamptz SET col3='c' WHERE col3 = 'b' AND col5 = 1;
SELECT * FROM mpp21090_drop_distcol_dml_timestamptz ORDER BY 1,2,3;
 col2 | col3 |    col4    | col5 
------+------+------------+------
 0.00 | a    | 01-01-2014 |    0
 1.00 | c    | 01-02-2014 |    1
(2 rows)

DELETE FROM mpp21090_drop_distcol_dml_timestamptz WHERE col3='c';
SELECT * FROM mpp21090_drop_distcol_dml_timestamptz ORDER BY 1,2,3,4;
 col2 | col3 |    col4    | col5 
------+------+------------+------
 0.00 | a    | 01-01-2014 |    0
(1 row)

-- @author prabhd 
-- @created 2014-04-01 12:00:00
-- @modified 2012-04-01 12:00:00
-- @tags dml MPP-21090 ORCA
-- @optimizer_mode on	
-- @description Tests for MPP-21090
\echo --start_ignore
--start_ignore
\echo --end_ignore
--end_ignore
DROP TABLE IF EXISTS mpp21090_drop_firstcol_dml_boolean;
NOTICE:  table "mpp21090_drop_firstcol_dml_boolean" does not exist, skipping
CREATE TABLE mpp21090_drop_firstcol_dml_boolean(
col1 boolean,
col2 decimal,
col3 char,
col4 date,
col5 int
)  with (appendonly= true)  DISTRIBUTED by(col3);
INSERT INTO mpp21090_drop_firstcol_dml_boolean VALUES(True,0.00,'a','2014-01-01',0);
SELECT * FROM mpp21090_drop_firstcol_dml_boolean ORDER BY 1,2,3,4;
 col1 | col2 | col3 |    col4    | col5 
------+------+------+------------+------
 t    | 0.00 | a    | 01-01-2014 |    0
(1 row)

ALTER TABLE mpp21090_drop_firstcol_dml_boolean DROP COLUMN col1;
INSERT INTO mpp21090_drop_firstcol_dml_boolean SELECT 1.00,'b','2014-01-02',1;
SELECT * FROM mpp21090_drop_firstcol_dml_boolean ORDER BY 1,2,3,4;
 col2 | col3 |    col4    | col5 
------+------+------------+------
 0.00 | a    | 01-01-2014 |    0
 1.00 | b    | 01-02-2014 |    1
(2 rows)

UPDATE mpp21090_drop_firstcol_dml_boolean SET col3='c' WHERE col3 = 'b' AND col5 = 1;
SELECT * FROM mpp21090_drop_firstcol_dml_boolean ORDER BY 1,2,3,4;
 col2 | col3 |    col4    | col5 
------+------+------------+------
 0.00 | a    | 01-01-2014 |    0
 1.00 | c    | 01-02-2014 |    1
(2 rows)

DELETE FROM mpp21090_drop_firstcol_dml_boolean WHERE col3='c';
SELECT * FROM mpp21090_drop_firstcol_dml_boolean ORDER BY 1,2,3,4;
 col2 | col3 |    col4    | col5 
------+------+------------+------
 0.00 | a    | 01-01-2014 |    0
(1 row)

-- @author prabhd 
-- @created 2014-04-01 12:00:00
-- @modified 2012-04-01 12:00:00
-- @tags dml MPP-21090 ORCA
-- @optimizer_mode on	
-- @description Tests for MPP-21090
\echo --start_ignore
--start_ignore
\echo --end_ignore
--end_ignore
DROP TABLE IF EXISTS mpp21090_drop_firstcol_dml_boolean;
CREATE TABLE mpp21090_drop_firstcol_dml_boolean(
col1 boolean,
col2 decimal,
col3 char,
col4 date,
col5 int
)  with (appendonly= true, orientation= column)  DISTRIBUTED by(col3);
INSERT INTO mpp21090_drop_firstcol_dml_boolean VALUES(True,0.00,'a','2014-01-01',0);
SELECT * FROM mpp21090_drop_firstcol_dml_boolean ORDER BY 1,2,3,4;
 col1 | col2 | col3 |    col4    | col5 
------+------+------+------------+------
 t    | 0.00 | a    | 01-01-2014 |    0
(1 row)

ALTER TABLE mpp21090_drop_firstcol_dml_boolean DROP COLUMN col1;
INSERT INTO mpp21090_drop_firstcol_dml_boolean SELECT 1.00,'b','2014-01-02',1;
SELECT * FROM mpp21090_drop_firstcol_dml_boolean ORDER BY 1,2,3,4;
 col2 | col3 |    col4    | col5 
------+------+------------+------
 0.00 | a    | 01-01-2014 |    0
 1.00 | b    | 01-02-2014 |    1
(2 rows)

UPDATE mpp21090_drop_firstcol_dml_boolean SET col3='c' WHERE col3 = 'b' AND col5 = 1;
SELECT * FROM mpp21090_drop_firstcol_dml_boolean ORDER BY 1,2,3,4;
 col2 | col3 |    col4    | col5 
------+------+------------+------
 0.00 | a    | 01-01-2014 |    0
 1.00 | c    | 01-02-2014 |    1
(2 rows)

DELETE FROM mpp21090_drop_firstcol_dml_boolean WHERE col3='c';
SELECT * FROM mpp21090_drop_firstcol_dml_boolean ORDER BY 1,2,3,4;
 col2 | col3 |    col4    | col5 
------+------+------------+------
 0.00 | a    | 01-01-2014 |    0
(1 row)

-- @author prabhd 
-- @created 2014-04-01 12:00:00
-- @modified 2012-04-01 12:00:00
-- @tags dml MPP-21090 ORCA
-- @optimizer_mode on	
-- @description Tests for MPP-21090
\echo --start_ignore
--start_ignore
\echo --end_ignore
--end_ignore
DROP TABLE IF EXISTS mpp21090_drop_firstcol_dml_boolean;
CREATE TABLE mpp21090_drop_firstcol_dml_boolean(
col1 boolean,
col2 decimal,
col3 char,
col4 date,
col5 int
)  DISTRIBUTED by(col3);
INSERT INTO mpp21090_drop_firstcol_dml_boolean VALUES(True,0.00,'a','2014-01-01',0);
SELECT * FROM mpp21090_drop_firstcol_dml_boolean ORDER BY 1,2,3,4;
 col1 | col2 | col3 |    col4    | col5 
------+------+------+------------+------
 t    | 0.00 | a    | 01-01-2014 |    0
(1 row)

ALTER TABLE mpp21090_drop_firstcol_dml_boolean DROP COLUMN col1;
INSERT INTO mpp21090_drop_firstcol_dml_boolean SELECT 1.00,'b','2014-01-02',1;
SELECT * FROM mpp21090_drop_firstcol_dml_boolean ORDER BY 1,2,3,4;
 col2 | col3 |    col4    | col5 
------+------+------------+------
 0.00 | a    | 01-01-2014 |    0
 1.00 | b    | 01-02-2014 |    1
(2 rows)

UPDATE mpp21090_drop_firstcol_dml_boolean SET col3='c' WHERE col3 = 'b' AND col5 = 1;
SELECT * FROM mpp21090_drop_firstcol_dml_boolean ORDER BY 1,2,3,4;
 col2 | col3 |    col4    | col5 
------+------+------------+------
 0.00 | a    | 01-01-2014 |    0
 1.00 | c    | 01-02-2014 |    1
(2 rows)

DELETE FROM mpp21090_drop_firstcol_dml_boolean WHERE col3='c';
SELECT * FROM mpp21090_drop_firstcol_dml_boolean ORDER BY 1,2,3,4;
 col2 | col3 |    col4    | col5 
------+------+------------+------
 0.00 | a    | 01-01-2014 |    0
(1 row)

-- @author prabhd 
-- @created 2014-04-01 12:00:00
-- @modified 2012-04-01 12:00:00
-- @tags dml MPP-21090 ORCA
-- @optimizer_mode on	
-- @description Tests for MPP-21090
\echo --start_ignore
--start_ignore
\echo --end_ignore
--end_ignore
DROP TABLE IF EXISTS mpp21090_drop_firstcol_dml_char;
NOTICE:  table "mpp21090_drop_firstcol_dml_char" does not exist, skipping
CREATE TABLE mpp21090_drop_firstcol_dml_char(
col1 char,
col2 decimal,
col3 char,
col4 date,
col5 int
)  with (appendonly= true)  DISTRIBUTED by(col3);
INSERT INTO mpp21090_drop_firstcol_dml_char VALUES('z',0.00,'a','2014-01-01',0);
SELECT * FROM mpp21090_drop_firstcol_dml_char ORDER BY 1,2,3,4;
 col1 | col2 | col3 |    col4    | col5 
------+------+------+------------+------
 z    | 0.00 | a    | 01-01-2014 |    0
(1 row)

ALTER TABLE mpp21090_drop_firstcol_dml_char DROP COLUMN col1;
INSERT INTO mpp21090_drop_firstcol_dml_char SELECT 1.00,'b','2014-01-02',1;
SELECT * FROM mpp21090_drop_firstcol_dml_char ORDER BY 1,2,3,4;
 col2 | col3 |    col4    | col5 
------+------+------------+------
 0.00 | a    | 01-01-2014 |    0
 1.00 | b    | 01-02-2014 |    1
(2 rows)

UPDATE mpp21090_drop_firstcol_dml_char SET col3='c' WHERE col3 = 'b' AND col5 = 1;
SELECT * FROM mpp21090_drop_firstcol_dml_char ORDER BY 1,2,3,4;
 col2 | col3 |    col4    | col5 
------+------+------------+------
 0.00 | a    | 01-01-2014 |    0
 1.00 | c    | 01-02-2014 |    1
(2 rows)

DELETE FROM mpp21090_drop_firstcol_dml_char WHERE col3='c';
SELECT * FROM mpp21090_drop_firstcol_dml_char ORDER BY 1,2,3,4;
 col2 | col3 |    col4    | col5 
------+------+------------+------
 0.00 | a    | 01-01-2014 |    0
(1 row)

-- @author prabhd 
-- @created 2014-04-01 12:00:00
-- @modified 2012-04-01 12:00:00
-- @tags dml MPP-21090 ORCA
-- @optimizer_mode on	
-- @description Tests for MPP-21090
\echo --start_ignore
--start_ignore
\echo --end_ignore
--end_ignore
DROP TABLE IF EXISTS mpp21090_drop_firstcol_dml_char;
CREATE TABLE mpp21090_drop_firstcol_dml_char(
col1 char,
col2 decimal,
col3 char,
col4 date,
col5 int
)  with (appendonly= true, orientation= column)  DISTRIBUTED by(col3);
INSERT INTO mpp21090_drop_firstcol_dml_char VALUES('z',0.00,'a','2014-01-01',0);
SELECT * FROM mpp21090_drop_firstcol_dml_char ORDER BY 1,2,3,4;
 col1 | col2 | col3 |    col4    | col5 
------+------+------+------------+------
 z    | 0.00 | a    | 01-01-2014 |    0
(1 row)

ALTER TABLE mpp21090_drop_firstcol_dml_char DROP COLUMN col1;
INSERT INTO mpp21090_drop_firstcol_dml_char SELECT 1.00,'b','2014-01-02',1;
SELECT * FROM mpp21090_drop_firstcol_dml_char ORDER BY 1,2,3,4;
 col2 | col3 |    col4    | col5 
------+------+------------+------
 0.00 | a    | 01-01-2014 |    0
 1.00 | b    | 01-02-2014 |    1
(2 rows)

UPDATE mpp21090_drop_firstcol_dml_char SET col3='c' WHERE col3 = 'b' AND col5 = 1;
SELECT * FROM mpp21090_drop_firstcol_dml_char ORDER BY 1,2,3,4;
 col2 | col3 |    col4    | col5 
------+------+------------+------
 0.00 | a    | 01-01-2014 |    0
 1.00 | c    | 01-02-2014 |    1
(2 rows)

DELETE FROM mpp21090_drop_firstcol_dml_char WHERE col3='c';
SELECT * FROM mpp21090_drop_firstcol_dml_char ORDER BY 1,2,3,4;
 col2 | col3 |    col4    | col5 
------+------+------------+------
 0.00 | a    | 01-01-2014 |    0
(1 row)

-- @author prabhd 
-- @created 2014-04-01 12:00:00
-- @modified 2012-04-01 12:00:00
-- @tags dml MPP-21090 ORCA
-- @optimizer_mode on	
-- @description Tests for MPP-21090
\echo --start_ignore
--start_ignore
\echo --end_ignore
--end_ignore
DROP TABLE IF EXISTS mpp21090_drop_firstcol_dml_char;
CREATE TABLE mpp21090_drop_firstcol_dml_char(
col1 char,
col2 decimal,
col3 char,
col4 date,
col5 int
)  DISTRIBUTED by(col3);
INSERT INTO mpp21090_drop_firstcol_dml_char VALUES('z',0.00,'a','2014-01-01',0);
SELECT * FROM mpp21090_drop_firstcol_dml_char ORDER BY 1,2,3,4;
 col1 | col2 | col3 |    col4    | col5 
------+------+------+------------+------
 z    | 0.00 | a    | 01-01-2014 |    0
(1 row)

ALTER TABLE mpp21090_drop_firstcol_dml_char DROP COLUMN col1;
INSERT INTO mpp21090_drop_firstcol_dml_char SELECT 1.00,'b','2014-01-02',1;
SELECT * FROM mpp21090_drop_firstcol_dml_char ORDER BY 1,2,3,4;
 col2 | col3 |    col4    | col5 
------+------+------------+------
 0.00 | a    | 01-01-2014 |    0
 1.00 | b    | 01-02-2014 |    1
(2 rows)

UPDATE mpp21090_drop_firstcol_dml_char SET col3='c' WHERE col3 = 'b' AND col5 = 1;
SELECT * FROM mpp21090_drop_firstcol_dml_char ORDER BY 1,2,3,4;
 col2 | col3 |    col4    | col5 
------+------+------------+------
 0.00 | a    | 01-01-2014 |    0
 1.00 | c    | 01-02-2014 |    1
(2 rows)

DELETE FROM mpp21090_drop_firstcol_dml_char WHERE col3='c';
SELECT * FROM mpp21090_drop_firstcol_dml_char ORDER BY 1,2,3,4;
 col2 | col3 |    col4    | col5 
------+------+------------+------
 0.00 | a    | 01-01-2014 |    0
(1 row)

-- @author prabhd 
-- @created 2014-04-01 12:00:00
-- @modified 2012-04-01 12:00:00
-- @tags dml MPP-21090 ORCA
-- @optimizer_mode on	
-- @description Tests for MPP-21090
\echo --start_ignore
--start_ignore
\echo --end_ignore
--end_ignore
DROP TABLE IF EXISTS mpp21090_drop_firstcol_dml_date;
NOTICE:  table "mpp21090_drop_firstcol_dml_date" does not exist, skipping
CREATE TABLE mpp21090_drop_firstcol_dml_date(
col1 date,
col2 decimal,
col3 char,
col4 date,
col5 int
)  with (appendonly= true)  DISTRIBUTED by(col3);
INSERT INTO mpp21090_drop_firstcol_dml_date VALUES('2013-12-31',0.00,'a','2014-01-01',0);
SELECT * FROM mpp21090_drop_firstcol_dml_date ORDER BY 1,2,3,4;
    col1    | col2 | col3 |    col4    | col5 
------------+------+------+------------+------
 12-31-2013 | 0.00 | a    | 01-01-2014 |    0
(1 row)

ALTER TABLE mpp21090_drop_firstcol_dml_date DROP COLUMN col1;
INSERT INTO mpp21090_drop_firstcol_dml_date SELECT 1.00,'b','2014-01-02',1;
SELECT * FROM mpp21090_drop_firstcol_dml_date ORDER BY 1,2,3,4;
 col2 | col3 |    col4    | col5 
------+------+------------+------
 0.00 | a    | 01-01-2014 |    0
 1.00 | b    | 01-02-2014 |    1
(2 rows)

UPDATE mpp21090_drop_firstcol_dml_date SET col3='c' WHERE col3 = 'b' AND col5 = 1;
SELECT * FROM mpp21090_drop_firstcol_dml_date ORDER BY 1,2,3,4;
 col2 | col3 |    col4    | col5 
------+------+------------+------
 0.00 | a    | 01-01-2014 |    0
 1.00 | c    | 01-02-2014 |    1
(2 rows)

DELETE FROM mpp21090_drop_firstcol_dml_date WHERE col3='c';
SELECT * FROM mpp21090_drop_firstcol_dml_date ORDER BY 1,2,3,4;
 col2 | col3 |    col4    | col5 
------+------+------------+------
 0.00 | a    | 01-01-2014 |    0
(1 row)

-- @author prabhd 
-- @created 2014-04-01 12:00:00
-- @modified 2012-04-01 12:00:00
-- @tags dml MPP-21090 ORCA
-- @optimizer_mode on	
-- @description Tests for MPP-21090
\echo --start_ignore
--start_ignore
\echo --end_ignore
--end_ignore
DROP TABLE IF EXISTS mpp21090_drop_firstcol_dml_date;
CREATE TABLE mpp21090_drop_firstcol_dml_date(
col1 date,
col2 decimal,
col3 char,
col4 date,
col5 int
)  with (appendonly= true, orientation= column)  DISTRIBUTED by(col3);
INSERT INTO mpp21090_drop_firstcol_dml_date VALUES('2013-12-31',0.00,'a','2014-01-01',0);
SELECT * FROM mpp21090_drop_firstcol_dml_date ORDER BY 1,2,3,4;
    col1    | col2 | col3 |    col4    | col5 
------------+------+------+------------+------
 12-31-2013 | 0.00 | a    | 01-01-2014 |    0
(1 row)

ALTER TABLE mpp21090_drop_firstcol_dml_date DROP COLUMN col1;
INSERT INTO mpp21090_drop_firstcol_dml_date SELECT 1.00,'b','2014-01-02',1;
SELECT * FROM mpp21090_drop_firstcol_dml_date ORDER BY 1,2,3,4;
 col2 | col3 |    col4    | col5 
------+------+------------+------
 0.00 | a    | 01-01-2014 |    0
 1.00 | b    | 01-02-2014 |    1
(2 rows)

UPDATE mpp21090_drop_firstcol_dml_date SET col3='c' WHERE col3 = 'b' AND col5 = 1;
SELECT * FROM mpp21090_drop_firstcol_dml_date ORDER BY 1,2,3,4;
 col2 | col3 |    col4    | col5 
------+------+------------+------
 0.00 | a    | 01-01-2014 |    0
 1.00 | c    | 01-02-2014 |    1
(2 rows)

DELETE FROM mpp21090_drop_firstcol_dml_date WHERE col3='c';
SELECT * FROM mpp21090_drop_firstcol_dml_date ORDER BY 1,2,3,4;
 col2 | col3 |    col4    | col5 
------+------+------------+------
 0.00 | a    | 01-01-2014 |    0
(1 row)

-- @author prabhd 
-- @created 2014-04-01 12:00:00
-- @modified 2012-04-01 12:00:00
-- @tags dml MPP-21090 ORCA
-- @optimizer_mode on	
-- @description Tests for MPP-21090
\echo --start_ignore
--start_ignore
\echo --end_ignore
--end_ignore
DROP TABLE IF EXISTS mpp21090_drop_firstcol_dml_date;
CREATE TABLE mpp21090_drop_firstcol_dml_date(
col1 date,
col2 decimal,
col3 char,
col4 date,
col5 int
)  DISTRIBUTED by(col3);
INSERT INTO mpp21090_drop_firstcol_dml_date VALUES('2013-12-31',0.00,'a','2014-01-01',0);
SELECT * FROM mpp21090_drop_firstcol_dml_date ORDER BY 1,2,3,4;
    col1    | col2 | col3 |    col4    | col5 
------------+------+------+------------+------
 12-31-2013 | 0.00 | a    | 01-01-2014 |    0
(1 row)

ALTER TABLE mpp21090_drop_firstcol_dml_date DROP COLUMN col1;
INSERT INTO mpp21090_drop_firstcol_dml_date SELECT 1.00,'b','2014-01-02',1;
SELECT * FROM mpp21090_drop_firstcol_dml_date ORDER BY 1,2,3,4;
 col2 | col3 |    col4    | col5 
------+------+------------+------
 0.00 | a    | 01-01-2014 |    0
 1.00 | b    | 01-02-2014 |    1
(2 rows)

UPDATE mpp21090_drop_firstcol_dml_date SET col3='c' WHERE col3 = 'b' AND col5 = 1;
SELECT * FROM mpp21090_drop_firstcol_dml_date ORDER BY 1,2,3,4;
 col2 | col3 |    col4    | col5 
------+------+------------+------
 0.00 | a    | 01-01-2014 |    0
 1.00 | c    | 01-02-2014 |    1
(2 rows)

DELETE FROM mpp21090_drop_firstcol_dml_date WHERE col3='c';
SELECT * FROM mpp21090_drop_firstcol_dml_date ORDER BY 1,2,3,4;
 col2 | col3 |    col4    | col5 
------+------+------------+------
 0.00 | a    | 01-01-2014 |    0
(1 row)

-- @author prabhd 
-- @created 2014-04-01 12:00:00
-- @modified 2012-04-01 12:00:00
-- @tags dml MPP-21090 ORCA
-- @optimizer_mode on	
-- @description Tests for MPP-21090
\echo --start_ignore
--start_ignore
\echo --end_ignore
--end_ignore
DROP TABLE IF EXISTS mpp21090_drop_firstcol_dml_decimal;
NOTICE:  table "mpp21090_drop_firstcol_dml_decimal" does not exist, skipping
CREATE TABLE mpp21090_drop_firstcol_dml_decimal(
col1 decimal,
col2 decimal,
col3 char,
col4 date,
col5 int
)  with (appendonly= true)  DISTRIBUTED by(col3);
INSERT INTO mpp21090_drop_firstcol_dml_decimal VALUES(2.00,0.00,'a','2014-01-01',0);
SELECT * FROM mpp21090_drop_firstcol_dml_decimal ORDER BY 1,2,3,4;
 col1 | col2 | col3 |    col4    | col5 
------+------+------+------------+------
 2.00 | 0.00 | a    | 01-01-2014 |    0
(1 row)

ALTER TABLE mpp21090_drop_firstcol_dml_decimal DROP COLUMN col1;
INSERT INTO mpp21090_drop_firstcol_dml_decimal SELECT 1.00,'b','2014-01-02',1;
SELECT * FROM mpp21090_drop_firstcol_dml_decimal ORDER BY 1,2,3,4;
 col2 | col3 |    col4    | col5 
------+------+------------+------
 0.00 | a    | 01-01-2014 |    0
 1.00 | b    | 01-02-2014 |    1
(2 rows)

UPDATE mpp21090_drop_firstcol_dml_decimal SET col3='c' WHERE col3 = 'b' AND col5 = 1;
SELECT * FROM mpp21090_drop_firstcol_dml_decimal ORDER BY 1,2,3,4;
 col2 | col3 |    col4    | col5 
------+------+------------+------
 0.00 | a    | 01-01-2014 |    0
 1.00 | c    | 01-02-2014 |    1
(2 rows)

DELETE FROM mpp21090_drop_firstcol_dml_decimal WHERE col3='c';
SELECT * FROM mpp21090_drop_firstcol_dml_decimal ORDER BY 1,2,3,4;
 col2 | col3 |    col4    | col5 
------+------+------------+------
 0.00 | a    | 01-01-2014 |    0
(1 row)

-- @author prabhd 
-- @created 2014-04-01 12:00:00
-- @modified 2012-04-01 12:00:00
-- @tags dml MPP-21090 ORCA
-- @optimizer_mode on	
-- @description Tests for MPP-21090
\echo --start_ignore
--start_ignore
\echo --end_ignore
--end_ignore
DROP TABLE IF EXISTS mpp21090_drop_firstcol_dml_decimal;
CREATE TABLE mpp21090_drop_firstcol_dml_decimal(
col1 decimal,
col2 decimal,
col3 char,
col4 date,
col5 int
)  with (appendonly= true, orientation= column)  DISTRIBUTED by(col3);
INSERT INTO mpp21090_drop_firstcol_dml_decimal VALUES(2.00,0.00,'a','2014-01-01',0);
SELECT * FROM mpp21090_drop_firstcol_dml_decimal ORDER BY 1,2,3,4;
 col1 | col2 | col3 |    col4    | col5 
------+------+------+------------+------
 2.00 | 0.00 | a    | 01-01-2014 |    0
(1 row)

ALTER TABLE mpp21090_drop_firstcol_dml_decimal DROP COLUMN col1;
INSERT INTO mpp21090_drop_firstcol_dml_decimal SELECT 1.00,'b','2014-01-02',1;
SELECT * FROM mpp21090_drop_firstcol_dml_decimal ORDER BY 1,2,3,4;
 col2 | col3 |    col4    | col5 
------+------+------------+------
 0.00 | a    | 01-01-2014 |    0
 1.00 | b    | 01-02-2014 |    1
(2 rows)

UPDATE mpp21090_drop_firstcol_dml_decimal SET col3='c' WHERE col3 = 'b' AND col5 = 1;
SELECT * FROM mpp21090_drop_firstcol_dml_decimal ORDER BY 1,2,3,4;
 col2 | col3 |    col4    | col5 
------+------+------------+------
 0.00 | a    | 01-01-2014 |    0
 1.00 | c    | 01-02-2014 |    1
(2 rows)

DELETE FROM mpp21090_drop_firstcol_dml_decimal WHERE col3='c';
SELECT * FROM mpp21090_drop_firstcol_dml_decimal ORDER BY 1,2,3,4;
 col2 | col3 |    col4    | col5 
------+------+------------+------
 0.00 | a    | 01-01-2014 |    0
(1 row)

-- @author prabhd 
-- @created 2014-04-01 12:00:00
-- @modified 2012-04-01 12:00:00
-- @tags dml MPP-21090 ORCA
-- @optimizer_mode on	
-- @description Tests for MPP-21090
\echo --start_ignore
--start_ignore
\echo --end_ignore
--end_ignore
DROP TABLE IF EXISTS mpp21090_drop_firstcol_dml_decimal;
CREATE TABLE mpp21090_drop_firstcol_dml_decimal(
col1 decimal,
col2 decimal,
col3 char,
col4 date,
col5 int
)  DISTRIBUTED by(col3);
INSERT INTO mpp21090_drop_firstcol_dml_decimal VALUES(2.00,0.00,'a','2014-01-01',0);
SELECT * FROM mpp21090_drop_firstcol_dml_decimal ORDER BY 1,2,3,4;
 col1 | col2 | col3 |    col4    | col5 
------+------+------+------------+------
 2.00 | 0.00 | a    | 01-01-2014 |    0
(1 row)

ALTER TABLE mpp21090_drop_firstcol_dml_decimal DROP COLUMN col1;
INSERT INTO mpp21090_drop_firstcol_dml_decimal SELECT 1.00,'b','2014-01-02',1;
SELECT * FROM mpp21090_drop_firstcol_dml_decimal ORDER BY 1,2,3,4;
 col2 | col3 |    col4    | col5 
------+------+------------+------
 0.00 | a    | 01-01-2014 |    0
 1.00 | b    | 01-02-2014 |    1
(2 rows)

UPDATE mpp21090_drop_firstcol_dml_decimal SET col3='c' WHERE col3 = 'b' AND col5 = 1;
SELECT * FROM mpp21090_drop_firstcol_dml_decimal ORDER BY 1,2,3,4;
 col2 | col3 |    col4    | col5 
------+------+------------+------
 0.00 | a    | 01-01-2014 |    0
 1.00 | c    | 01-02-2014 |    1
(2 rows)

DELETE FROM mpp21090_drop_firstcol_dml_decimal WHERE col3='c';
SELECT * FROM mpp21090_drop_firstcol_dml_decimal ORDER BY 1,2,3,4;
 col2 | col3 |    col4    | col5 
------+------+------------+------
 0.00 | a    | 01-01-2014 |    0
(1 row)

-- @author prabhd 
-- @created 2014-04-01 12:00:00
-- @modified 2012-04-01 12:00:00
-- @tags dml MPP-21090 ORCA
-- @optimizer_mode on	
-- @description Tests for MPP-21090
\echo --start_ignore
--start_ignore
\echo --end_ignore
--end_ignore
DROP TABLE IF EXISTS mpp21090_drop_firstcol_dml_float;
NOTICE:  table "mpp21090_drop_firstcol_dml_float" does not exist, skipping
CREATE TABLE mpp21090_drop_firstcol_dml_float(
col1 float,
col2 decimal,
col3 char,
col4 date,
col5 int
)  with (appendonly= true)  DISTRIBUTED by(col3);
INSERT INTO mpp21090_drop_firstcol_dml_float VALUES(2.00,0.00,'a','2014-01-01',0);
SELECT * FROM mpp21090_drop_firstcol_dml_float ORDER BY 1,2,3,4;
 col1 | col2 | col3 |    col4    | col5 
------+------+------+------------+------
    2 | 0.00 | a    | 01-01-2014 |    0
(1 row)

ALTER TABLE mpp21090_drop_firstcol_dml_float DROP COLUMN col1;
INSERT INTO mpp21090_drop_firstcol_dml_float SELECT 1.00,'b','2014-01-02',1;
SELECT * FROM mpp21090_drop_firstcol_dml_float ORDER BY 1,2,3,4;
 col2 | col3 |    col4    | col5 
------+------+------------+------
 0.00 | a    | 01-01-2014 |    0
 1.00 | b    | 01-02-2014 |    1
(2 rows)

UPDATE mpp21090_drop_firstcol_dml_float SET col3='c' WHERE col3 = 'b' AND col5 = 1;
SELECT * FROM mpp21090_drop_firstcol_dml_float ORDER BY 1,2,3,4;
 col2 | col3 |    col4    | col5 
------+------+------------+------
 0.00 | a    | 01-01-2014 |    0
 1.00 | c    | 01-02-2014 |    1
(2 rows)

DELETE FROM mpp21090_drop_firstcol_dml_float WHERE col3='c';
SELECT * FROM mpp21090_drop_firstcol_dml_float ORDER BY 1,2,3,4;
 col2 | col3 |    col4    | col5 
------+------+------------+------
 0.00 | a    | 01-01-2014 |    0
(1 row)

-- @author prabhd 
-- @created 2014-04-01 12:00:00
-- @modified 2012-04-01 12:00:00
-- @tags dml MPP-21090 ORCA
-- @optimizer_mode on	
-- @description Tests for MPP-21090
\echo --start_ignore
--start_ignore
\echo --end_ignore
--end_ignore
DROP TABLE IF EXISTS mpp21090_drop_firstcol_dml_float;
CREATE TABLE mpp21090_drop_firstcol_dml_float(
col1 float,
col2 decimal,
col3 char,
col4 date,
col5 int
)  with (appendonly= true, orientation= column)  DISTRIBUTED by(col3);
INSERT INTO mpp21090_drop_firstcol_dml_float VALUES(2.00,0.00,'a','2014-01-01',0);
SELECT * FROM mpp21090_drop_firstcol_dml_float ORDER BY 1,2,3,4;
 col1 | col2 | col3 |    col4    | col5 
------+------+------+------------+------
    2 | 0.00 | a    | 01-01-2014 |    0
(1 row)

ALTER TABLE mpp21090_drop_firstcol_dml_float DROP COLUMN col1;
INSERT INTO mpp21090_drop_firstcol_dml_float SELECT 1.00,'b','2014-01-02',1;
SELECT * FROM mpp21090_drop_firstcol_dml_float ORDER BY 1,2,3,4;
 col2 | col3 |    col4    | col5 
------+------+------------+------
 0.00 | a    | 01-01-2014 |    0
 1.00 | b    | 01-02-2014 |    1
(2 rows)

UPDATE mpp21090_drop_firstcol_dml_float SET col3='c' WHERE col3 = 'b' AND col5 = 1;
SELECT * FROM mpp21090_drop_firstcol_dml_float ORDER BY 1,2,3,4;
 col2 | col3 |    col4    | col5 
------+------+------------+------
 0.00 | a    | 01-01-2014 |    0
 1.00 | c    | 01-02-2014 |    1
(2 rows)

DELETE FROM mpp21090_drop_firstcol_dml_float WHERE col3='c';
SELECT * FROM mpp21090_drop_firstcol_dml_float ORDER BY 1,2,3,4;
 col2 | col3 |    col4    | col5 
------+------+------------+------
 0.00 | a    | 01-01-2014 |    0
(1 row)

-- @author prabhd 
-- @created 2014-04-01 12:00:00
-- @modified 2012-04-01 12:00:00
-- @tags dml MPP-21090 ORCA
-- @optimizer_mode on	
-- @description Tests for MPP-21090
\echo --start_ignore
--start_ignore
\echo --end_ignore
--end_ignore
DROP TABLE IF EXISTS mpp21090_drop_firstcol_dml_float;
CREATE TABLE mpp21090_drop_firstcol_dml_float(
col1 float,
col2 decimal,
col3 char,
col4 date,
col5 int
)  DISTRIBUTED by(col3);
INSERT INTO mpp21090_drop_firstcol_dml_float VALUES(2.00,0.00,'a','2014-01-01',0);
SELECT * FROM mpp21090_drop_firstcol_dml_float ORDER BY 1,2,3,4;
 col1 | col2 | col3 |    col4    | col5 
------+------+------+------------+------
    2 | 0.00 | a    | 01-01-2014 |    0
(1 row)

ALTER TABLE mpp21090_drop_firstcol_dml_float DROP COLUMN col1;
INSERT INTO mpp21090_drop_firstcol_dml_float SELECT 1.00,'b','2014-01-02',1;
SELECT * FROM mpp21090_drop_firstcol_dml_float ORDER BY 1,2,3,4;
 col2 | col3 |    col4    | col5 
------+------+------------+------
 0.00 | a    | 01-01-2014 |    0
 1.00 | b    | 01-02-2014 |    1
(2 rows)

UPDATE mpp21090_drop_firstcol_dml_float SET col3='c' WHERE col3 = 'b' AND col5 = 1;
SELECT * FROM mpp21090_drop_firstcol_dml_float ORDER BY 1,2,3,4;
 col2 | col3 |    col4    | col5 
------+------+------------+------
 0.00 | a    | 01-01-2014 |    0
 1.00 | c    | 01-02-2014 |    1
(2 rows)

DELETE FROM mpp21090_drop_firstcol_dml_float WHERE col3='c';
SELECT * FROM mpp21090_drop_firstcol_dml_float ORDER BY 1,2,3,4;
 col2 | col3 |    col4    | col5 
------+------+------------+------
 0.00 | a    | 01-01-2014 |    0
(1 row)

-- @author prabhd 
-- @created 2014-04-01 12:00:00
-- @modified 2012-04-01 12:00:00
-- @tags dml MPP-21090 ORCA
-- @optimizer_mode on	
-- @description Tests for MPP-21090
\echo --start_ignore
--start_ignore
\echo --end_ignore
--end_ignore
DROP TABLE IF EXISTS mpp21090_drop_firstcol_dml_int4;
NOTICE:  table "mpp21090_drop_firstcol_dml_int4" does not exist, skipping
CREATE TABLE mpp21090_drop_firstcol_dml_int4(
col1 int4,
col2 decimal,
col3 char,
col4 date,
col5 int
)  with (appendonly= true)  DISTRIBUTED by(col3);
INSERT INTO mpp21090_drop_firstcol_dml_int4 VALUES(2000000000,0.00,'a','2014-01-01',0);
SELECT * FROM mpp21090_drop_firstcol_dml_int4 ORDER BY 1,2,3,4;
    col1    | col2 | col3 |    col4    | col5 
------------+------+------+------------+------
 2000000000 | 0.00 | a    | 01-01-2014 |    0
(1 row)

ALTER TABLE mpp21090_drop_firstcol_dml_int4 DROP COLUMN col1;
INSERT INTO mpp21090_drop_firstcol_dml_int4 SELECT 1.00,'b','2014-01-02',1;
SELECT * FROM mpp21090_drop_firstcol_dml_int4 ORDER BY 1,2,3,4;
 col2 | col3 |    col4    | col5 
------+------+------------+------
 0.00 | a    | 01-01-2014 |    0
 1.00 | b    | 01-02-2014 |    1
(2 rows)

UPDATE mpp21090_drop_firstcol_dml_int4 SET col3='c' WHERE col3 = 'b' AND col5 = 1;
SELECT * FROM mpp21090_drop_firstcol_dml_int4 ORDER BY 1,2,3,4;
 col2 | col3 |    col4    | col5 
------+------+------------+------
 0.00 | a    | 01-01-2014 |    0
 1.00 | c    | 01-02-2014 |    1
(2 rows)

DELETE FROM mpp21090_drop_firstcol_dml_int4 WHERE col3='c';
SELECT * FROM mpp21090_drop_firstcol_dml_int4 ORDER BY 1,2,3,4;
 col2 | col3 |    col4    | col5 
------+------+------------+------
 0.00 | a    | 01-01-2014 |    0
(1 row)

-- @author prabhd 
-- @created 2014-04-01 12:00:00
-- @modified 2012-04-01 12:00:00
-- @tags dml MPP-21090 ORCA
-- @optimizer_mode on	
-- @description Tests for MPP-21090
\echo --start_ignore
--start_ignore
\echo --end_ignore
--end_ignore
DROP TABLE IF EXISTS mpp21090_drop_firstcol_dml_int4;
CREATE TABLE mpp21090_drop_firstcol_dml_int4(
col1 int4,
col2 decimal,
col3 char,
col4 date,
col5 int
)  with (appendonly= true, orientation= column)  DISTRIBUTED by(col3);
INSERT INTO mpp21090_drop_firstcol_dml_int4 VALUES(2000000000,0.00,'a','2014-01-01',0);
SELECT * FROM mpp21090_drop_firstcol_dml_int4 ORDER BY 1,2,3,4;
    col1    | col2 | col3 |    col4    | col5 
------------+------+------+------------+------
 2000000000 | 0.00 | a    | 01-01-2014 |    0
(1 row)

ALTER TABLE mpp21090_drop_firstcol_dml_int4 DROP COLUMN col1;
INSERT INTO mpp21090_drop_firstcol_dml_int4 SELECT 1.00,'b','2014-01-02',1;
SELECT * FROM mpp21090_drop_firstcol_dml_int4 ORDER BY 1,2,3,4;
 col2 | col3 |    col4    | col5 
------+------+------------+------
 0.00 | a    | 01-01-2014 |    0
 1.00 | b    | 01-02-2014 |    1
(2 rows)

UPDATE mpp21090_drop_firstcol_dml_int4 SET col3='c' WHERE col3 = 'b' AND col5 = 1;
SELECT * FROM mpp21090_drop_firstcol_dml_int4 ORDER BY 1,2,3,4;
 col2 | col3 |    col4    | col5 
------+------+------------+------
 0.00 | a    | 01-01-2014 |    0
 1.00 | c    | 01-02-2014 |    1
(2 rows)

DELETE FROM mpp21090_drop_firstcol_dml_int4 WHERE col3='c';
SELECT * FROM mpp21090_drop_firstcol_dml_int4 ORDER BY 1,2,3,4;
 col2 | col3 |    col4    | col5 
------+------+------------+------
 0.00 | a    | 01-01-2014 |    0
(1 row)

-- @author prabhd 
-- @created 2014-04-01 12:00:00
-- @modified 2012-04-01 12:00:00
-- @tags dml MPP-21090 ORCA
-- @optimizer_mode on	
-- @description Tests for MPP-21090
\echo --start_ignore
--start_ignore
\echo --end_ignore
--end_ignore
DROP TABLE IF EXISTS mpp21090_drop_firstcol_dml_int4;
CREATE TABLE mpp21090_drop_firstcol_dml_int4(
col1 int4,
col2 decimal,
col3 char,
col4 date,
col5 int
)  DISTRIBUTED by(col3);
INSERT INTO mpp21090_drop_firstcol_dml_int4 VALUES(2000000000,0.00,'a','2014-01-01',0);
SELECT * FROM mpp21090_drop_firstcol_dml_int4 ORDER BY 1,2,3,4;
    col1    | col2 | col3 |    col4    | col5 
------------+------+------+------------+------
 2000000000 | 0.00 | a    | 01-01-2014 |    0
(1 row)

ALTER TABLE mpp21090_drop_firstcol_dml_int4 DROP COLUMN col1;
INSERT INTO mpp21090_drop_firstcol_dml_int4 SELECT 1.00,'b','2014-01-02',1;
SELECT * FROM mpp21090_drop_firstcol_dml_int4 ORDER BY 1,2,3,4;
 col2 | col3 |    col4    | col5 
------+------+------------+------
 0.00 | a    | 01-01-2014 |    0
 1.00 | b    | 01-02-2014 |    1
(2 rows)

UPDATE mpp21090_drop_firstcol_dml_int4 SET col3='c' WHERE col3 = 'b' AND col5 = 1;
SELECT * FROM mpp21090_drop_firstcol_dml_int4 ORDER BY 1,2,3,4;
 col2 | col3 |    col4    | col5 
------+------+------------+------
 0.00 | a    | 01-01-2014 |    0
 1.00 | c    | 01-02-2014 |    1
(2 rows)

DELETE FROM mpp21090_drop_firstcol_dml_int4 WHERE col3='c';
SELECT * FROM mpp21090_drop_firstcol_dml_int4 ORDER BY 1,2,3,4;
 col2 | col3 |    col4    | col5 
------+------+------------+------
 0.00 | a    | 01-01-2014 |    0
(1 row)

-- start_ignore
drop schema sql_partition_51_100 cascade;
NOTICE:  drop cascades to table mpp21090_drop_firstcol_dml_int4
NOTICE:  drop cascades to table mpp21090_drop_firstcol_dml_float
NOTICE:  drop cascades to table mpp21090_drop_firstcol_dml_decimal
NOTICE:  drop cascades to table mpp21090_drop_firstcol_dml_date
NOTICE:  drop cascades to table mpp21090_drop_firstcol_dml_char
NOTICE:  drop cascades to table mpp21090_drop_firstcol_dml_boolean
NOTICE:  drop cascades to table mpp21090_drop_distcol_dml_timestamptz
NOTICE:  drop cascades to table mpp21090_drop_distcol_dml_timestamp
NOTICE:  drop cascades to table mpp21090_drop_distcol_dml_time
NOTICE:  drop cascades to table mpp21090_drop_distcol_dml_text
NOTICE:  drop cascades to table mpp21090_drop_distcol_dml_numeric
NOTICE:  drop cascades to table mpp21090_drop_distcol_dml_interval
NOTICE:  drop cascades to table mpp21090_drop_distcol_dml_int
NOTICE:  drop cascades to table mpp21090_drop_distcol_dml_int8
NOTICE:  drop cascades to table mpp21090_drop_distcol_dml_int4
NOTICE:  drop cascades to table mpp21090_drop_distcol_dml_float
NOTICE:  drop cascades to table mpp21090_drop_distcol_dml_decimal
-- end_ignore
