-- @Description UAOCS MVCC readcommit and 2 updates on same row then rollback
--  Transaction 2 of 2
-- 
select pg_sleep(2);
 pg_sleep 
----------
 
(1 row)

insert into sto_uaocs_mvcc_status (workload, script) values('readcommit_concurrentupdate_savepoint', 't2_update_one_tuple_rollback');
INSERT 0 1
begin;
BEGIN
set transaction isolation level READ COMMITTED;
SET
update sto_uaocs_emp_formvcc set sal = 22223 where sal = 30000;
UPDATE 0
update sto_uaocs_emp_formvcc set sal = 22223 where sal = 27000;
UPDATE 1
select empno,ename from sto_uaocs_emp_formvcc where sal=22223;
 empno | ename  
-------+--------
     4 | HOOVER
(1 row)

commit;
COMMIT
update sto_uaocs_mvcc_status set endtime = CURRENT_TIMESTAMP 
where workload='readcommit_concurrentupdate_savepoint' 
AND script='t2_update_one_tuple_rollback';
UPDATE 1
select empno,ename from sto_uaocs_emp_formvcc where sal=22223;
 empno | ename  
-------+--------
     4 | HOOVER
(1 row)

