-- @author prabhd 
-- @created 2012-02-01 12:00:00 
-- @modified 2013-02-01 12:00:00 
-- @tags cte
-- @product_version gpdb: [4.3-],hawq: [1.1-]
-- @db_name world_db
-- @description cte tests from cdbfast 

-- sanity tests with queries using CTEs in insert,update,delete and create
-- query 1 CTAS using CTE
create table bad_headofstates as 
(
with bad_headofstates as 
(
 select country.code,country.name,country.headofstate,countrylanguage.language
 from
 country,countrylanguage
 where country.code = countrylanguage.countrycode and countrylanguage.isofficial=true
 and (country.gnp < country.gnpold or country.gnp < 3000)
)
select OUTERMOST_FOO.*,bad_headofstates.headofstate from (
select avg(population),region from
(
select FOO.*,bad_headofstates.headofstate,city.name
from
(select bad_headofstates.code,country.capital,country.region,country.population from
bad_headofstates,country where bad_headofstates.code = country.code) FOO, bad_headofstates,city
where FOO.code = bad_headofstates.code and FOO.capital = city.id) OUTER_FOO
group by region ) OUTERMOST_FOO,bad_headofstates,country 
where country.code = bad_headofstates.code and country.region = OUTERMOST_FOO.region
order by OUTERMOST_FOO.region,bad_headofstates.headofstate LIMIT 40
);
SELECT 40
select * from bad_headofstates order by region,headofstate,avg;
       avg        |          region           |           headofstate            
------------------+---------------------------+----------------------------------
          4550620 | Australia and New Zealand | Elisabeth II
          4550620 | Australia and New Zealand | Elisabeth II
          4550620 | Australia and New Zealand | Elisabeth II
          4550620 | Australia and New Zealand | Elisabeth II
          4550620 | Australia and New Zealand | Elisabeth II
 744388.888888889 | Caribbean                 | Beatrix
 744388.888888889 | Caribbean                 | Beatrix
 744388.888888889 | Caribbean                 | Beatrix
 744388.888888889 | Caribbean                 | Elisabeth II
 744388.888888889 | Caribbean                 | Elisabeth II
 744388.888888889 | Caribbean                 | Elisabeth II
 744388.888888889 | Caribbean                 | Elisabeth II
 744388.888888889 | Caribbean                 | Elisabeth II
 744388.888888889 | Caribbean                 | Elisabeth II
 744388.888888889 | Caribbean                 | Elisabeth II
 744388.888888889 | Caribbean                 | Elisabeth II
 744388.888888889 | Caribbean                 | Elisabeth II
 744388.888888889 | Caribbean                 | Elisabeth II
 744388.888888889 | Caribbean                 | Fidel Castro Ruz
 744388.888888889 | Caribbean                 | George W. Bush
 744388.888888889 | Caribbean                 | Jacques Chirac
          7651000 | Central Africa            | Idriss Deby
          2657500 | Central America           | Arnoldo Aleman Lacayo
          2657500 | Central America           | Elisabeth II
 5982809.52380952 | Eastern Africa            | Abdiqassim Salad Hassan
 5982809.52380952 | Eastern Africa            | Abdiqassim Salad Hassan
 5982809.52380952 | Eastern Africa            | Bakili Muluzi
 5982809.52380952 | Eastern Africa            | France-Albert Rene
 5982809.52380952 | Eastern Africa            | France-Albert Rene
 5982809.52380952 | Eastern Africa            | Isayas Afewerki [Isaias Afwerki]
 5982809.52380952 | Eastern Africa            | Ismail Omar Guelleh
 5982809.52380952 | Eastern Africa            | Jacques Chirac
 5982809.52380952 | Eastern Africa            | Paul Kagame
 5982809.52380952 | Eastern Africa            | Paul Kagame
 5982809.52380952 | Eastern Africa            | Pierre Buyoya
 5982809.52380952 | Eastern Africa            | Pierre Buyoya
 5982809.52380952 | Eastern Africa            | Robert G. Mugabe
         34288500 | Eastern Asia              | Akihito
         34288500 | Eastern Asia              | Chen Shui-bian
         34288500 | Eastern Asia              | Jiang Zemin
(40 rows)

--query 2 insert using CTE
insert into bad_headofstates
(
with bad_headofstates as 
(
 select country.code,country.name,country.headofstate,countrylanguage.language
 from
 country,countrylanguage
 where country.code = countrylanguage.countrycode and countrylanguage.isofficial=true
 and (country.gnp < country.gnpold or country.gnp < 3000)
)
select OUTERMOST_FOO.*,bad_headofstates.headofstate from (
select avg(population),region from
(
select FOO.*,bad_headofstates.headofstate,city.name
from
(select bad_headofstates.code,country.capital,country.region,country.population from
bad_headofstates,country where bad_headofstates.code = country.code) FOO, bad_headofstates,city
where FOO.code = bad_headofstates.code and FOO.capital = city.id) OUTER_FOO
group by region ) OUTERMOST_FOO,bad_headofstates,country 
where country.code = bad_headofstates.code and country.region = OUTERMOST_FOO.region
order by OUTERMOST_FOO.region,bad_headofstates.headofstate LIMIT 40
);
INSERT 0 40
select * from bad_headofstates order by region,headofstate,avg;
       avg        |          region           |           headofstate            
------------------+---------------------------+----------------------------------
          4550620 | Australia and New Zealand | Elisabeth II
          4550620 | Australia and New Zealand | Elisabeth II
          4550620 | Australia and New Zealand | Elisabeth II
          4550620 | Australia and New Zealand | Elisabeth II
          4550620 | Australia and New Zealand | Elisabeth II
          4550620 | Australia and New Zealand | Elisabeth II
          4550620 | Australia and New Zealand | Elisabeth II
          4550620 | Australia and New Zealand | Elisabeth II
          4550620 | Australia and New Zealand | Elisabeth II
          4550620 | Australia and New Zealand | Elisabeth II
 744388.888888889 | Caribbean                 | Beatrix
 744388.888888889 | Caribbean                 | Beatrix
 744388.888888889 | Caribbean                 | Beatrix
 744388.888888889 | Caribbean                 | Beatrix
 744388.888888889 | Caribbean                 | Beatrix
 744388.888888889 | Caribbean                 | Beatrix
 744388.888888889 | Caribbean                 | Elisabeth II
 744388.888888889 | Caribbean                 | Elisabeth II
 744388.888888889 | Caribbean                 | Elisabeth II
 744388.888888889 | Caribbean                 | Elisabeth II
 744388.888888889 | Caribbean                 | Elisabeth II
 744388.888888889 | Caribbean                 | Elisabeth II
 744388.888888889 | Caribbean                 | Elisabeth II
 744388.888888889 | Caribbean                 | Elisabeth II
 744388.888888889 | Caribbean                 | Elisabeth II
 744388.888888889 | Caribbean                 | Elisabeth II
 744388.888888889 | Caribbean                 | Elisabeth II
 744388.888888889 | Caribbean                 | Elisabeth II
 744388.888888889 | Caribbean                 | Elisabeth II
 744388.888888889 | Caribbean                 | Elisabeth II
 744388.888888889 | Caribbean                 | Elisabeth II
 744388.888888889 | Caribbean                 | Elisabeth II
 744388.888888889 | Caribbean                 | Elisabeth II
 744388.888888889 | Caribbean                 | Elisabeth II
 744388.888888889 | Caribbean                 | Elisabeth II
 744388.888888889 | Caribbean                 | Elisabeth II
 744388.888888889 | Caribbean                 | Fidel Castro Ruz
 744388.888888889 | Caribbean                 | Fidel Castro Ruz
 744388.888888889 | Caribbean                 | George W. Bush
 744388.888888889 | Caribbean                 | George W. Bush
 744388.888888889 | Caribbean                 | Jacques Chirac
 744388.888888889 | Caribbean                 | Jacques Chirac
          7651000 | Central Africa            | Idriss Deby
          7651000 | Central Africa            | Idriss Deby
          2657500 | Central America           | Arnoldo Aleman Lacayo
          2657500 | Central America           | Arnoldo Aleman Lacayo
          2657500 | Central America           | Elisabeth II
          2657500 | Central America           | Elisabeth II
 5982809.52380952 | Eastern Africa            | Abdiqassim Salad Hassan
 5982809.52380952 | Eastern Africa            | Abdiqassim Salad Hassan
 5982809.52380952 | Eastern Africa            | Abdiqassim Salad Hassan
 5982809.52380952 | Eastern Africa            | Abdiqassim Salad Hassan
 5982809.52380952 | Eastern Africa            | Bakili Muluzi
 5982809.52380952 | Eastern Africa            | Bakili Muluzi
 5982809.52380952 | Eastern Africa            | France-Albert Rene
 5982809.52380952 | Eastern Africa            | France-Albert Rene
 5982809.52380952 | Eastern Africa            | France-Albert Rene
 5982809.52380952 | Eastern Africa            | France-Albert Rene
 5982809.52380952 | Eastern Africa            | Isayas Afewerki [Isaias Afwerki]
 5982809.52380952 | Eastern Africa            | Isayas Afewerki [Isaias Afwerki]
 5982809.52380952 | Eastern Africa            | Ismail Omar Guelleh
 5982809.52380952 | Eastern Africa            | Ismail Omar Guelleh
 5982809.52380952 | Eastern Africa            | Jacques Chirac
 5982809.52380952 | Eastern Africa            | Jacques Chirac
 5982809.52380952 | Eastern Africa            | Paul Kagame
 5982809.52380952 | Eastern Africa            | Paul Kagame
 5982809.52380952 | Eastern Africa            | Paul Kagame
 5982809.52380952 | Eastern Africa            | Paul Kagame
 5982809.52380952 | Eastern Africa            | Pierre Buyoya
 5982809.52380952 | Eastern Africa            | Pierre Buyoya
 5982809.52380952 | Eastern Africa            | Pierre Buyoya
 5982809.52380952 | Eastern Africa            | Pierre Buyoya
 5982809.52380952 | Eastern Africa            | Robert G. Mugabe
 5982809.52380952 | Eastern Africa            | Robert G. Mugabe
         34288500 | Eastern Asia              | Akihito
         34288500 | Eastern Asia              | Akihito
         34288500 | Eastern Asia              | Chen Shui-bian
         34288500 | Eastern Asia              | Chen Shui-bian
         34288500 | Eastern Asia              | Jiang Zemin
         34288500 | Eastern Asia              | Jiang Zemin
(80 rows)

--query3 update using CTE
update bad_headofstates set region = cm.region FROM
(
with bad_headofstates as
(
 select country.code,country.name,country.headofstate,countrylanguage.language
 from
 country,countrylanguage
 where country.code = countrylanguage.countrycode and countrylanguage.isofficial=true
 and (country.gnp < country.gnpold or country.gnp < 3000)
)
select avg(OUTERMOST_FOO.AVG),OUTERMOST_FOO.region from (
select avg(population) AVG,region from
(
select FOO.*,bad_headofstates.headofstate,city.name
from
(select bad_headofstates.code,country.capital,country.region,country.population from
bad_headofstates,country where bad_headofstates.code = country.code) FOO, bad_headofstates,city
where FOO.code = bad_headofstates.code and FOO.capital = city.id) OUTER_FOO
group by region ) OUTERMOST_FOO,bad_headofstates,country
where country.code = bad_headofstates.code and country.region = OUTERMOST_FOO.region
and OUTERMOST_FOO.region = 'Central America'
group by OUTERMOST_FOO.region
order by OUTERMOST_FOO.region
) cm
where bad_headofstates.region = 'Caribbean';
UPDATE 32
 
select * from bad_headofstates order by region,headofstate,avg;
       avg        |          region           |           headofstate            
------------------+---------------------------+----------------------------------
          4550620 | Australia and New Zealand | Elisabeth II
          4550620 | Australia and New Zealand | Elisabeth II
          4550620 | Australia and New Zealand | Elisabeth II
          4550620 | Australia and New Zealand | Elisabeth II
          4550620 | Australia and New Zealand | Elisabeth II
          4550620 | Australia and New Zealand | Elisabeth II
          4550620 | Australia and New Zealand | Elisabeth II
          4550620 | Australia and New Zealand | Elisabeth II
          4550620 | Australia and New Zealand | Elisabeth II
          4550620 | Australia and New Zealand | Elisabeth II
          7651000 | Central Africa            | Idriss Deby
          7651000 | Central Africa            | Idriss Deby
          2657500 | Central America           | Arnoldo Aleman Lacayo
          2657500 | Central America           | Arnoldo Aleman Lacayo
 744388.888888889 | Central America           | Beatrix
 744388.888888889 | Central America           | Beatrix
 744388.888888889 | Central America           | Beatrix
 744388.888888889 | Central America           | Beatrix
 744388.888888889 | Central America           | Beatrix
 744388.888888889 | Central America           | Beatrix
 744388.888888889 | Central America           | Elisabeth II
 744388.888888889 | Central America           | Elisabeth II
 744388.888888889 | Central America           | Elisabeth II
 744388.888888889 | Central America           | Elisabeth II
 744388.888888889 | Central America           | Elisabeth II
 744388.888888889 | Central America           | Elisabeth II
 744388.888888889 | Central America           | Elisabeth II
 744388.888888889 | Central America           | Elisabeth II
 744388.888888889 | Central America           | Elisabeth II
 744388.888888889 | Central America           | Elisabeth II
 744388.888888889 | Central America           | Elisabeth II
 744388.888888889 | Central America           | Elisabeth II
 744388.888888889 | Central America           | Elisabeth II
 744388.888888889 | Central America           | Elisabeth II
 744388.888888889 | Central America           | Elisabeth II
 744388.888888889 | Central America           | Elisabeth II
 744388.888888889 | Central America           | Elisabeth II
 744388.888888889 | Central America           | Elisabeth II
 744388.888888889 | Central America           | Elisabeth II
 744388.888888889 | Central America           | Elisabeth II
          2657500 | Central America           | Elisabeth II
          2657500 | Central America           | Elisabeth II
 744388.888888889 | Central America           | Fidel Castro Ruz
 744388.888888889 | Central America           | Fidel Castro Ruz
 744388.888888889 | Central America           | George W. Bush
 744388.888888889 | Central America           | George W. Bush
 744388.888888889 | Central America           | Jacques Chirac
 744388.888888889 | Central America           | Jacques Chirac
 5982809.52380952 | Eastern Africa            | Abdiqassim Salad Hassan
 5982809.52380952 | Eastern Africa            | Abdiqassim Salad Hassan
 5982809.52380952 | Eastern Africa            | Abdiqassim Salad Hassan
 5982809.52380952 | Eastern Africa            | Abdiqassim Salad Hassan
 5982809.52380952 | Eastern Africa            | Bakili Muluzi
 5982809.52380952 | Eastern Africa            | Bakili Muluzi
 5982809.52380952 | Eastern Africa            | France-Albert Rene
 5982809.52380952 | Eastern Africa            | France-Albert Rene
 5982809.52380952 | Eastern Africa            | France-Albert Rene
 5982809.52380952 | Eastern Africa            | France-Albert Rene
 5982809.52380952 | Eastern Africa            | Isayas Afewerki [Isaias Afwerki]
 5982809.52380952 | Eastern Africa            | Isayas Afewerki [Isaias Afwerki]
 5982809.52380952 | Eastern Africa            | Ismail Omar Guelleh
 5982809.52380952 | Eastern Africa            | Ismail Omar Guelleh
 5982809.52380952 | Eastern Africa            | Jacques Chirac
 5982809.52380952 | Eastern Africa            | Jacques Chirac
 5982809.52380952 | Eastern Africa            | Paul Kagame
 5982809.52380952 | Eastern Africa            | Paul Kagame
 5982809.52380952 | Eastern Africa            | Paul Kagame
 5982809.52380952 | Eastern Africa            | Paul Kagame
 5982809.52380952 | Eastern Africa            | Pierre Buyoya
 5982809.52380952 | Eastern Africa            | Pierre Buyoya
 5982809.52380952 | Eastern Africa            | Pierre Buyoya
 5982809.52380952 | Eastern Africa            | Pierre Buyoya
 5982809.52380952 | Eastern Africa            | Robert G. Mugabe
 5982809.52380952 | Eastern Africa            | Robert G. Mugabe
         34288500 | Eastern Asia              | Akihito
         34288500 | Eastern Asia              | Akihito
         34288500 | Eastern Asia              | Chen Shui-bian
         34288500 | Eastern Asia              | Chen Shui-bian
         34288500 | Eastern Asia              | Jiang Zemin
         34288500 | Eastern Asia              | Jiang Zemin
(80 rows)

--query4 delete using CTE
delete from bad_headofstates USING
(
with bad_headofstates as
(
 select country.code,country.name,country.headofstate,countrylanguage.language
 from
 country,countrylanguage
 where country.code = countrylanguage.countrycode and countrylanguage.isofficial=true
 and (country.gnp < country.gnpold or country.gnp < 3000)
)
select avg(OUTERMOST_FOO.AVG),OUTERMOST_FOO.region from (
select avg(population) AVG,region from
(
select FOO.*,bad_headofstates.headofstate,city.name
from
(select bad_headofstates.code,country.capital,country.region,country.population from
bad_headofstates,country where bad_headofstates.code = country.code) FOO, bad_headofstates,city
where FOO.code = bad_headofstates.code and FOO.capital = city.id) OUTER_FOO
group by region ) OUTERMOST_FOO,bad_headofstates,country
where country.code = bad_headofstates.code and country.region = OUTERMOST_FOO.region
and OUTERMOST_FOO.region = 'Central America'
group by OUTERMOST_FOO.region
order by OUTERMOST_FOO.region
) as  cm
where bad_headofstates.region = cm.region;
DELETE 36
select * from bad_headofstates order by region,headofstate,avg;
       avg        |          region           |           headofstate            
------------------+---------------------------+----------------------------------
          4550620 | Australia and New Zealand | Elisabeth II
          4550620 | Australia and New Zealand | Elisabeth II
          4550620 | Australia and New Zealand | Elisabeth II
          4550620 | Australia and New Zealand | Elisabeth II
          4550620 | Australia and New Zealand | Elisabeth II
          4550620 | Australia and New Zealand | Elisabeth II
          4550620 | Australia and New Zealand | Elisabeth II
          4550620 | Australia and New Zealand | Elisabeth II
          4550620 | Australia and New Zealand | Elisabeth II
          4550620 | Australia and New Zealand | Elisabeth II
          7651000 | Central Africa            | Idriss Deby
          7651000 | Central Africa            | Idriss Deby
 5982809.52380952 | Eastern Africa            | Abdiqassim Salad Hassan
 5982809.52380952 | Eastern Africa            | Abdiqassim Salad Hassan
 5982809.52380952 | Eastern Africa            | Abdiqassim Salad Hassan
 5982809.52380952 | Eastern Africa            | Abdiqassim Salad Hassan
 5982809.52380952 | Eastern Africa            | Bakili Muluzi
 5982809.52380952 | Eastern Africa            | Bakili Muluzi
 5982809.52380952 | Eastern Africa            | France-Albert Rene
 5982809.52380952 | Eastern Africa            | France-Albert Rene
 5982809.52380952 | Eastern Africa            | France-Albert Rene
 5982809.52380952 | Eastern Africa            | France-Albert Rene
 5982809.52380952 | Eastern Africa            | Isayas Afewerki [Isaias Afwerki]
 5982809.52380952 | Eastern Africa            | Isayas Afewerki [Isaias Afwerki]
 5982809.52380952 | Eastern Africa            | Ismail Omar Guelleh
 5982809.52380952 | Eastern Africa            | Ismail Omar Guelleh
 5982809.52380952 | Eastern Africa            | Jacques Chirac
 5982809.52380952 | Eastern Africa            | Jacques Chirac
 5982809.52380952 | Eastern Africa            | Paul Kagame
 5982809.52380952 | Eastern Africa            | Paul Kagame
 5982809.52380952 | Eastern Africa            | Paul Kagame
 5982809.52380952 | Eastern Africa            | Paul Kagame
 5982809.52380952 | Eastern Africa            | Pierre Buyoya
 5982809.52380952 | Eastern Africa            | Pierre Buyoya
 5982809.52380952 | Eastern Africa            | Pierre Buyoya
 5982809.52380952 | Eastern Africa            | Pierre Buyoya
 5982809.52380952 | Eastern Africa            | Robert G. Mugabe
 5982809.52380952 | Eastern Africa            | Robert G. Mugabe
         34288500 | Eastern Asia              | Akihito
         34288500 | Eastern Asia              | Akihito
         34288500 | Eastern Asia              | Chen Shui-bian
         34288500 | Eastern Asia              | Chen Shui-bian
         34288500 | Eastern Asia              | Jiang Zemin
         34288500 | Eastern Asia              | Jiang Zemin
(44 rows)

-- delete using CTE in its subplan
delete from bad_headofstates where bad_headofstates.avg NOT IN
(
with bad_headofstates as
(
 select country.code,country.name,country.headofstate,countrylanguage.language
 from
 country,countrylanguage
 where country.code = countrylanguage.countrycode and countrylanguage.isofficial=true
 and (country.gnp < country.gnpold or country.gnp < 3000)
)
select OUTERMOST_FOO.AVG from (
select avg(population) AVG,region from
(
select FOO.*,bad_headofstates.headofstate,city.name
from
(select bad_headofstates.code,country.capital,country.region,country.population from
bad_headofstates,country where bad_headofstates.code = country.code) FOO, bad_headofstates,city
where FOO.code = bad_headofstates.code and FOO.capital = city.id) OUTER_FOO
group by region ) OUTERMOST_FOO,bad_headofstates,country
where country.code = bad_headofstates.code and country.region = OUTERMOST_FOO.region
and OUTERMOST_FOO.region = 'Australia and New Zealand' or OUTERMOST_FOO.region = 'Eastern Asia'
order by OUTERMOST_FOO.region
);
DELETE 28
select * from bad_headofstates order by region,headofstate,avg;
   avg    |          region           |  headofstate   
----------+---------------------------+----------------
  4550620 | Australia and New Zealand | Elisabeth II
  4550620 | Australia and New Zealand | Elisabeth II
  4550620 | Australia and New Zealand | Elisabeth II
  4550620 | Australia and New Zealand | Elisabeth II
  4550620 | Australia and New Zealand | Elisabeth II
  4550620 | Australia and New Zealand | Elisabeth II
  4550620 | Australia and New Zealand | Elisabeth II
  4550620 | Australia and New Zealand | Elisabeth II
  4550620 | Australia and New Zealand | Elisabeth II
  4550620 | Australia and New Zealand | Elisabeth II
 34288500 | Eastern Asia              | Akihito
 34288500 | Eastern Asia              | Akihito
 34288500 | Eastern Asia              | Chen Shui-bian
 34288500 | Eastern Asia              | Chen Shui-bian
 34288500 | Eastern Asia              | Jiang Zemin
 34288500 | Eastern Asia              | Jiang Zemin
(16 rows)

drop table bad_headofstates;
DROP TABLE
