-- @Description Tests the udf on basic updates and deletes.
-- 

2U: SELECT * FROM gp_aovisimap_name('foo');
tid|segno|row_num
---+-----+-------
(0 rows)
2U: SELECT sego, first_row_num, hiddentupcount FROM gp_aovisimap_entry_name('foo');
sego|first_row_num|hiddentupcount
----+-------------+--------------
(0 rows)
2U: SELECT * FROM gp_aovisimap_hidden_info_name('foo');
segno|hidden_tupcount|total_tupcount
-----+---------------+--------------
1    |0              |15            
(1 row)
DELETE FROM foo WHERE a IN (1, 2, 3, 5, 8, 13, 21);
DELETE 7
2U: SELECT * FROM gp_aovisimap_name('foo');
tid             |segno|row_num
----------------+-----+-------
(33554432,32769)|1    |1      
(33554432,32770)|1    |2      
(33554432,32771)|1    |3      
(33554432,32775)|1    |7
(33554432,32779)|1    |11
(5 rows)
2U: SELECT sego, first_row_num, hiddentupcount FROM gp_aovisimap_entry_name('foo');
sego|first_row_num|hiddentupcount
----+-------------+--------------
1   |0            |5             
(1 row)
2U: SELECT * FROM gp_aovisimap_hidden_info_name('foo');
segno|hidden_tupcount|total_tupcount
-----+---------------+--------------
1    |5              |15            
(1 row)
UPDATE FOO SET b=0 WHERE a > 21;
UPDATE 9
2U: SELECT * FROM gp_aovisimap_name('foo');
tid             |segno|row_num
----------------+-----+-------
(33554432,32769)|1    |1      
(33554432,32770)|1    |2      
(33554432,32771)|1    |3   
(33554432,32775)|1|7
(33554432,32779)|1|11
(33554432,32780)|1|12
(33554432,32781)|1    |13 
(33554432,32782)|1|14
(33554432,32783)|1|15
(9 rows)
2U: SELECT sego, first_row_num, hiddentupcount FROM gp_aovisimap_entry_name('foo');
sego|first_row_num|hiddentupcount
----+-------------+--------------
1   |0            |9             
(1 row)
2U: SELECT * FROM gp_aovisimap_hidden_info_name('foo');
segno|hidden_tupcount|total_tupcount
-----+---------------+--------------
1    |9             |19            
(1 row)
