-- @description : Alter  UAO tables and execute DML statements on the tables
-- 
-- Create AO tables
DROP TABLE if exists sto_alt_uao1_default;
DROP TABLE
CREATE TABLE sto_alt_uao1_default(
          bigint_col bigint,
          char_vary_col character varying(30),
          numeric_col numeric,
          int_col int4 NOT NULL,
          float_col float4,
          int_array_col int[],
          before_rename_col int4,
          change_datatype_col numeric,
          a_ts_without timestamp without time zone,
          b_ts_with timestamp with time zone,
          date_column date,
          col_set_default numeric,
          text_col text default 'i am default'
) with(appendonly=true, orientation=column) DISTRIBUTED RANDOMLY;
CREATE TABLE
insert into sto_alt_uao1_default values ( 0, '0_zero', 0, 0, 0, '{0}', 0, 0, '2004-10-19 10:23:54', '2004-10-19 10:23:54+02', '1-1-2000',0,'0_zero');
INSERT 0 1
insert into sto_alt_uao1_default values (1, '1_zero', 1, 1, 1, '{1}', 1, 1, '2005-10-19 10:23:54', '2005-10-19 10:23:54+02', '1-1-2001',1,'1_zero');
INSERT 0 1
insert into sto_alt_uao1_default values ( 2, '2_zero', 2, 2, 2, '{2}', 2, 2, '2006-10-19 10:23:54', '2006-10-19 10:23:54+02', '1-1-2002',2);
INSERT 0 1
select * from sto_alt_uao1_default order by bigint_col;
 bigint_col | char_vary_col | numeric_col | int_col | float_col | int_array_col | before_rename_col | change_datatype_col |    a_ts_without     |       b_ts_with        | date_column | col_set_default |   text_col   
------------+---------------+-------------+---------+-----------+---------------+-------------------+---------------------+---------------------+------------------------+-------------+-----------------+--------------
          0 | 0_zero        |           0 |       0 |         0 | {0}           |                 0 |                   0 | 2004-10-19 10:23:54 | 2004-10-19 01:23:54-07 | 2000-01-01  |               0 | 0_zero
          1 | 1_zero        |           1 |       1 |         1 | {1}           |                 1 |                   1 | 2005-10-19 10:23:54 | 2005-10-19 01:23:54-07 | 2001-01-01  |               1 | 1_zero
          2 | 2_zero        |           2 |       2 |         2 | {2}           |                 2 |                   2 | 2006-10-19 10:23:54 | 2006-10-19 01:23:54-07 | 2002-01-01  |               2 | i am default
(3 rows)

SELECT 1 AS VisimapPresent  FROM pg_appendonly WHERE visimapidxid is not NULL AND visimapidxid is not NULL AND relid=(SELECT relfilenode FROM pg_class WHERE relname='sto_alt_uao1_default');
 visimappresent 
----------------
              1
(1 row)

select count(*) AS only_visi_tups from sto_alt_uao1_default;
 only_visi_tups 
----------------
              3
(1 row)

set gp_select_invisible = true;
SET
select count(*)  AS invisi_and_visi_tups from sto_alt_uao1_default;
 invisi_and_visi_tups 
----------------------
                    3
(1 row)

set gp_select_invisible = false;
SET
-- Alter column Drop default
Alter table sto_alt_uao1_default  alter column text_col drop default;
ALTER TABLE
insert into sto_alt_uao1_default values ( 3, '3_zero', 3, 3, 3, '{3}', 3, 3, '2006-10-19 10:23:54', '2006-10-19 10:23:54+02', '1-1-2002',3);
INSERT 0 1
select * from sto_alt_uao1_default order by bigint_col;
 bigint_col | char_vary_col | numeric_col | int_col | float_col | int_array_col | before_rename_col | change_datatype_col |    a_ts_without     |       b_ts_with        | date_column | col_set_default |   text_col   
------------+---------------+-------------+---------+-----------+---------------+-------------------+---------------------+---------------------+------------------------+-------------+-----------------+--------------
          0 | 0_zero        |           0 |       0 |         0 | {0}           |                 0 |                   0 | 2004-10-19 10:23:54 | 2004-10-19 01:23:54-07 | 2000-01-01  |               0 | 0_zero
          1 | 1_zero        |           1 |       1 |         1 | {1}           |                 1 |                   1 | 2005-10-19 10:23:54 | 2005-10-19 01:23:54-07 | 2001-01-01  |               1 | 1_zero
          2 | 2_zero        |           2 |       2 |         2 | {2}           |                 2 |                   2 | 2006-10-19 10:23:54 | 2006-10-19 01:23:54-07 | 2002-01-01  |               2 | i am default
          3 | 3_zero        |           3 |       3 |         3 | {3}           |                 3 |                   3 | 2006-10-19 10:23:54 | 2006-10-19 01:23:54-07 | 2002-01-01  |               3 | 
(4 rows)

select count(*) AS only_visi_tups from sto_alt_uao1_default;
 only_visi_tups 
----------------
              4
(1 row)

set gp_select_invisible = true;
SET
select count(*)  AS invisi_and_visi_tups from sto_alt_uao1_default;
 invisi_and_visi_tups 
----------------------
                    4
(1 row)

set gp_select_invisible = false;
SET
insert into sto_alt_uao1_default values ( 4, '4_zero', 4, 4, 4, '{4}', 4, 4, '2006-10-19 10:23:54', '2006-10-19 10:23:54+02', '1-1-2002',4,'4_zero');
INSERT 0 1
select * from sto_alt_uao1_default order by bigint_col;
 bigint_col | char_vary_col | numeric_col | int_col | float_col | int_array_col | before_rename_col | change_datatype_col |    a_ts_without     |       b_ts_with        | date_column | col_set_default |   text_col   
------------+---------------+-------------+---------+-----------+---------------+-------------------+---------------------+---------------------+------------------------+-------------+-----------------+--------------
          0 | 0_zero        |           0 |       0 |         0 | {0}           |                 0 |                   0 | 2004-10-19 10:23:54 | 2004-10-19 01:23:54-07 | 2000-01-01  |               0 | 0_zero
          1 | 1_zero        |           1 |       1 |         1 | {1}           |                 1 |                   1 | 2005-10-19 10:23:54 | 2005-10-19 01:23:54-07 | 2001-01-01  |               1 | 1_zero
          2 | 2_zero        |           2 |       2 |         2 | {2}           |                 2 |                   2 | 2006-10-19 10:23:54 | 2006-10-19 01:23:54-07 | 2002-01-01  |               2 | i am default
          3 | 3_zero        |           3 |       3 |         3 | {3}           |                 3 |                   3 | 2006-10-19 10:23:54 | 2006-10-19 01:23:54-07 | 2002-01-01  |               3 | 
          4 | 4_zero        |           4 |       4 |         4 | {4}           |                 4 |                   4 | 2006-10-19 10:23:54 | 2006-10-19 01:23:54-07 | 2002-01-01  |               4 | 4_zero
(5 rows)

select count(*) AS only_visi_tups from sto_alt_uao1_default;
 only_visi_tups 
----------------
              5
(1 row)

set gp_select_invisible = true;
SET
select count(*)  AS invisi_and_visi_tups from sto_alt_uao1_default;
 invisi_and_visi_tups 
----------------------
                    5
(1 row)

set gp_select_invisible = false;
SET
update sto_alt_uao1_default set text_col = 'my new val' where col_set_default = 3;
UPDATE 1
select * from sto_alt_uao1_default order by bigint_col;
 bigint_col | char_vary_col | numeric_col | int_col | float_col | int_array_col | before_rename_col | change_datatype_col |    a_ts_without     |       b_ts_with        | date_column | col_set_default |   text_col   
------------+---------------+-------------+---------+-----------+---------------+-------------------+---------------------+---------------------+------------------------+-------------+-----------------+--------------
          0 | 0_zero        |           0 |       0 |         0 | {0}           |                 0 |                   0 | 2004-10-19 10:23:54 | 2004-10-19 01:23:54-07 | 2000-01-01  |               0 | 0_zero
          1 | 1_zero        |           1 |       1 |         1 | {1}           |                 1 |                   1 | 2005-10-19 10:23:54 | 2005-10-19 01:23:54-07 | 2001-01-01  |               1 | 1_zero
          2 | 2_zero        |           2 |       2 |         2 | {2}           |                 2 |                   2 | 2006-10-19 10:23:54 | 2006-10-19 01:23:54-07 | 2002-01-01  |               2 | i am default
          3 | 3_zero        |           3 |       3 |         3 | {3}           |                 3 |                   3 | 2006-10-19 10:23:54 | 2006-10-19 01:23:54-07 | 2002-01-01  |               3 | my new val
          4 | 4_zero        |           4 |       4 |         4 | {4}           |                 4 |                   4 | 2006-10-19 10:23:54 | 2006-10-19 01:23:54-07 | 2002-01-01  |               4 | 4_zero
(5 rows)

select count(*) AS only_visi_tups from sto_alt_uao1_default;
 only_visi_tups 
----------------
              5
(1 row)

set gp_select_invisible = true;
SET
select count(*)  AS invisi_and_visi_tups from sto_alt_uao1_default;
 invisi_and_visi_tups 
----------------------
                    6
(1 row)

set gp_select_invisible = false;
SET
-- Alter column set NOT NULL
Alter Table sto_alt_uao1_default ALTER COLUMN text_col SET  NOT NULL;
ALTER TABLE
insert into sto_alt_uao1_default values ( 5, '5_zero', 5, 5, 5, '{5}', 5, 5, '2006-10-19 10:23:54', '2006-10-19 10:23:54+02', '1-1-2002',5);
psql:/path/sql_file:1: ERROR:  NULL value in column "text_col" violates not-null constraint  (seg0 rh55-qa03.sanmateo.greenplum.com:40000 pid=23587)
select * from sto_alt_uao1_default order by bigint_col;
 bigint_col | char_vary_col | numeric_col | int_col | float_col | int_array_col | before_rename_col | change_datatype_col |    a_ts_without     |       b_ts_with        | date_column | col_set_default |   text_col   
------------+---------------+-------------+---------+-----------+---------------+-------------------+---------------------+---------------------+------------------------+-------------+-----------------+--------------
          0 | 0_zero        |           0 |       0 |         0 | {0}           |                 0 |                   0 | 2004-10-19 10:23:54 | 2004-10-19 01:23:54-07 | 2000-01-01  |               0 | 0_zero
          1 | 1_zero        |           1 |       1 |         1 | {1}           |                 1 |                   1 | 2005-10-19 10:23:54 | 2005-10-19 01:23:54-07 | 2001-01-01  |               1 | 1_zero
          2 | 2_zero        |           2 |       2 |         2 | {2}           |                 2 |                   2 | 2006-10-19 10:23:54 | 2006-10-19 01:23:54-07 | 2002-01-01  |               2 | i am default
          3 | 3_zero        |           3 |       3 |         3 | {3}           |                 3 |                   3 | 2006-10-19 10:23:54 | 2006-10-19 01:23:54-07 | 2002-01-01  |               3 | my new val
          4 | 4_zero        |           4 |       4 |         4 | {4}           |                 4 |                   4 | 2006-10-19 10:23:54 | 2006-10-19 01:23:54-07 | 2002-01-01  |               4 | 4_zero
(5 rows)

select count(*) AS only_visi_tups from sto_alt_uao1_default;
 only_visi_tups 
----------------
              5
(1 row)

set gp_select_invisible = true;
SET
select count(*)  AS invisi_and_visi_tups from sto_alt_uao1_default;
 invisi_and_visi_tups 
----------------------
                    6
(1 row)

set gp_select_invisible = false;
SET
-- Alter column drop NOT NULL
Alter Table sto_alt_uao1_default ALTER COLUMN int_col DROP NOT NULL;
ALTER TABLE
insert into sto_alt_uao1_default values ( 6, '6_zero', 6, 6, 6, '{6}', 6, 6, '2006-10-19 10:23:54', '2006-10-19 10:23:54+02', '1-1-2002',6);
psql:/path/sql_file:1: ERROR:  NULL value in column "text_col" violates not-null constraint  (seg1 rh55-qa03.sanmateo.greenplum.com:40001 pid=23589)
select * from sto_alt_uao1_default order by bigint_col;
 bigint_col | char_vary_col | numeric_col | int_col | float_col | int_array_col | before_rename_col | change_datatype_col |    a_ts_without     |       b_ts_with        | date_column | col_set_default |   text_col   
------------+---------------+-------------+---------+-----------+---------------+-------------------+---------------------+---------------------+------------------------+-------------+-----------------+--------------
          0 | 0_zero        |           0 |       0 |         0 | {0}           |                 0 |                   0 | 2004-10-19 10:23:54 | 2004-10-19 01:23:54-07 | 2000-01-01  |               0 | 0_zero
          1 | 1_zero        |           1 |       1 |         1 | {1}           |                 1 |                   1 | 2005-10-19 10:23:54 | 2005-10-19 01:23:54-07 | 2001-01-01  |               1 | 1_zero
          2 | 2_zero        |           2 |       2 |         2 | {2}           |                 2 |                   2 | 2006-10-19 10:23:54 | 2006-10-19 01:23:54-07 | 2002-01-01  |               2 | i am default
          3 | 3_zero        |           3 |       3 |         3 | {3}           |                 3 |                   3 | 2006-10-19 10:23:54 | 2006-10-19 01:23:54-07 | 2002-01-01  |               3 | my new val
          4 | 4_zero        |           4 |       4 |         4 | {4}           |                 4 |                   4 | 2006-10-19 10:23:54 | 2006-10-19 01:23:54-07 | 2002-01-01  |               4 | 4_zero
(5 rows)

select count(*) AS only_visi_tups from sto_alt_uao1_default;
 only_visi_tups 
----------------
              5
(1 row)

set gp_select_invisible = true;
SET
select count(*)  AS invisi_and_visi_tups from sto_alt_uao1_default;
 invisi_and_visi_tups 
----------------------
                    6
(1 row)

set gp_select_invisible = false;
SET
update sto_alt_uao1_default set date_column = '2013-08-15' where text_col = '1_zero';
UPDATE 1
select * from sto_alt_uao1_default order by bigint_col;
 bigint_col | char_vary_col | numeric_col | int_col | float_col | int_array_col | before_rename_col | change_datatype_col |    a_ts_without     |       b_ts_with        | date_column | col_set_default |   text_col   
------------+---------------+-------------+---------+-----------+---------------+-------------------+---------------------+---------------------+------------------------+-------------+-----------------+--------------
          0 | 0_zero        |           0 |       0 |         0 | {0}           |                 0 |                   0 | 2004-10-19 10:23:54 | 2004-10-19 01:23:54-07 | 2000-01-01  |               0 | 0_zero
          1 | 1_zero        |           1 |       1 |         1 | {1}           |                 1 |                   1 | 2005-10-19 10:23:54 | 2005-10-19 01:23:54-07 | 2013-08-15  |               1 | 1_zero
          2 | 2_zero        |           2 |       2 |         2 | {2}           |                 2 |                   2 | 2006-10-19 10:23:54 | 2006-10-19 01:23:54-07 | 2002-01-01  |               2 | i am default
          3 | 3_zero        |           3 |       3 |         3 | {3}           |                 3 |                   3 | 2006-10-19 10:23:54 | 2006-10-19 01:23:54-07 | 2002-01-01  |               3 | my new val
          4 | 4_zero        |           4 |       4 |         4 | {4}           |                 4 |                   4 | 2006-10-19 10:23:54 | 2006-10-19 01:23:54-07 | 2002-01-01  |               4 | 4_zero
(5 rows)

select count(*) AS only_visi_tups from sto_alt_uao1_default;
 only_visi_tups 
----------------
              5
(1 row)

set gp_select_invisible = true;
SET
select count(*)  AS invisi_and_visi_tups from sto_alt_uao1_default;
 invisi_and_visi_tups 
----------------------
                    7
(1 row)

set gp_select_invisible = false;
SET
