-- @description : Alter  UAO tables and execute DML statements on the tables
-- 
-- Create AO tables
DROP TABLE if exists sto_alt_uao1_renamecol;
DROP TABLE
CREATE TABLE sto_alt_uao1_renamecol(
          text_col text default 'remove it',
          bigint_col bigint,
          char_vary_col character varying(30),
          numeric_col numeric,
          int_col int4 NOT NULL,
          float_col float4,
          int_array_col int[],
          before_rename_col int4,
          change_datatype_col numeric,
          a_ts_without timestamp without time zone,
          b_ts_with timestamp with time zone,
          date_column date,
          col_set_default numeric) with(appendonly=true, orientation=column) DISTRIBUTED RANDOMLY;
CREATE TABLE
insert into sto_alt_uao1_renamecol values ('0_zero', 0, '0_zero', 0, 0, 0, '{0}', 0, 0, '2004-10-19 10:23:54', '2004-10-19 10:23:54+02', '1-1-2000',0);
INSERT 0 1
insert into sto_alt_uao1_renamecol values ('1_zero', 1, '1_zero', 1, 1, 1, '{1}', 1, 1, '2005-10-19 10:23:54', '2005-10-19 10:23:54+02', '1-1-2001',1);
INSERT 0 1
insert into sto_alt_uao1_renamecol values ('2_zero', 2, '2_zero', 2, 2, 2, '{2}', 2, 2, '2006-10-19 10:23:54', '2006-10-19 10:23:54+02', '1-1-2002',2);
INSERT 0 1
select * from sto_alt_uao1_renamecol order by bigint_col;
 text_col | bigint_col | char_vary_col | numeric_col | int_col | float_col | int_array_col | before_rename_col | change_datatype_col |    a_ts_without     |       b_ts_with        | date_column | col_set_default 
----------+------------+---------------+-------------+---------+-----------+---------------+-------------------+---------------------+---------------------+------------------------+-------------+-----------------
 0_zero   |          0 | 0_zero        |           0 |       0 |         0 | {0}           |                 0 |                   0 | 2004-10-19 10:23:54 | 2004-10-19 01:23:54-07 | 2000-01-01  |               0
 1_zero   |          1 | 1_zero        |           1 |       1 |         1 | {1}           |                 1 |                   1 | 2005-10-19 10:23:54 | 2005-10-19 01:23:54-07 | 2001-01-01  |               1
 2_zero   |          2 | 2_zero        |           2 |       2 |         2 | {2}           |                 2 |                   2 | 2006-10-19 10:23:54 | 2006-10-19 01:23:54-07 | 2002-01-01  |               2
(3 rows)

SELECT 1 AS VisimapPresent  FROM pg_appendonly WHERE visimapidxid is not NULL AND visimapidxid is not NULL AND relid=(SELECT relfilenode FROM pg_class WHERE relname='sto_alt_uao1_renamecol');
 visimappresent 
----------------
              1
(1 row)

select count(*) AS only_visi_tups from sto_alt_uao1_renamecol;
 only_visi_tups 
----------------
              3
(1 row)

set gp_select_invisible = true;
SET
select count(*)  AS invisi_and_visi_tups from sto_alt_uao1_renamecol;
 invisi_and_visi_tups 
----------------------
                    3
(1 row)

set gp_select_invisible = false;
SET
-- Alter table rename column
Alter Table sto_alt_uao1_renamecol RENAME COLUMN before_rename_col TO after_rename_col;
ALTER TABLE
select * from sto_alt_uao1_renamecol order by bigint_col;
 text_col | bigint_col | char_vary_col | numeric_col | int_col | float_col | int_array_col | after_rename_col | change_datatype_col |    a_ts_without     |       b_ts_with        | date_column | col_set_default 
----------+------------+---------------+-------------+---------+-----------+---------------+------------------+---------------------+---------------------+------------------------+-------------+-----------------
 0_zero   |          0 | 0_zero        |           0 |       0 |         0 | {0}           |                0 |                   0 | 2004-10-19 10:23:54 | 2004-10-19 01:23:54-07 | 2000-01-01  |               0
 1_zero   |          1 | 1_zero        |           1 |       1 |         1 | {1}           |                1 |                   1 | 2005-10-19 10:23:54 | 2005-10-19 01:23:54-07 | 2001-01-01  |               1
 2_zero   |          2 | 2_zero        |           2 |       2 |         2 | {2}           |                2 |                   2 | 2006-10-19 10:23:54 | 2006-10-19 01:23:54-07 | 2002-01-01  |               2
(3 rows)

update sto_alt_uao1_renamecol set before_rename_col= 10 where text_col = '1_zero';
psql:/path/sql_file:1: ERROR:  column "before_rename_col" of relation "sto_alt_uao1_renamecol" does not exist
LINE 1: update sto_alt_uao1_renamecol set before_rename_col= 10 wher...
                                          ^
select count(*) AS only_visi_tups from sto_alt_uao1_renamecol;
 only_visi_tups 
----------------
              3
(1 row)

set gp_select_invisible = true;
SET
select count(*)  AS invisi_and_visi_tups from sto_alt_uao1_renamecol;
 invisi_and_visi_tups 
----------------------
                    3
(1 row)

set gp_select_invisible = false;
SET
update sto_alt_uao1_renamecol set after_rename_col= 10 where text_col = '1_zero';
UPDATE 1
select * from sto_alt_uao1_renamecol order by bigint_col;
 text_col | bigint_col | char_vary_col | numeric_col | int_col | float_col | int_array_col | after_rename_col | change_datatype_col |    a_ts_without     |       b_ts_with        | date_column | col_set_default 
----------+------------+---------------+-------------+---------+-----------+---------------+------------------+---------------------+---------------------+------------------------+-------------+-----------------
 0_zero   |          0 | 0_zero        |           0 |       0 |         0 | {0}           |                0 |                   0 | 2004-10-19 10:23:54 | 2004-10-19 01:23:54-07 | 2000-01-01  |               0
 1_zero   |          1 | 1_zero        |           1 |       1 |         1 | {1}           |               10 |                   1 | 2005-10-19 10:23:54 | 2005-10-19 01:23:54-07 | 2001-01-01  |               1
 2_zero   |          2 | 2_zero        |           2 |       2 |         2 | {2}           |                2 |                   2 | 2006-10-19 10:23:54 | 2006-10-19 01:23:54-07 | 2002-01-01  |               2
(3 rows)

select count(*) AS only_visi_tups from sto_alt_uao1_renamecol;
 only_visi_tups 
----------------
              3
(1 row)

set gp_select_invisible = true;
SET
select count(*)  AS invisi_and_visi_tups from sto_alt_uao1_renamecol;
 invisi_and_visi_tups 
----------------------
                    4
(1 row)

set gp_select_invisible = false;
SET
