--- Exchange AO part with AO table
--start_ignore
Drop table if exists sto_co_heap;
psql:/path/sql_file:1: NOTICE:  table "sto_co_heap" does not exist, skipping
DROP TABLE
--end_ignore
Create table sto_co_heap
 (
 col1 bigint, col2 date, col3 text, col4 int) with(appendonly=true, orientation=column)
 distributed randomly  partition by range(col2)
 subpartition by list (col3)
 subpartition template ( default subpartition subothers, subpartition sub1 values ('one'), subpartition sub2 values ('two'))
 (default partition others, start(date '2008-01-01') end(date '2008-04-30') every(interval '1 month'));
psql:/path/sql_file:1: NOTICE:  CREATE TABLE will create partition "sto_co_heap_1_prt_others" for table "sto_co_heap"
psql:/path/sql_file:1: NOTICE:  CREATE TABLE will create partition "sto_co_heap_1_prt_2" for table "sto_co_heap"
psql:/path/sql_file:1: NOTICE:  CREATE TABLE will create partition "sto_co_heap_1_prt_3" for table "sto_co_heap"
psql:/path/sql_file:1: NOTICE:  CREATE TABLE will create partition "sto_co_heap_1_prt_4" for table "sto_co_heap"
psql:/path/sql_file:1: NOTICE:  CREATE TABLE will create partition "sto_co_heap_1_prt_5" for table "sto_co_heap"
psql:/path/sql_file:1: NOTICE:  CREATE TABLE will create partition "sto_co_heap_1_prt_others_2_prt_subothers" for table "sto_co_heap_1_prt_others"
psql:/path/sql_file:1: NOTICE:  CREATE TABLE will create partition "sto_co_heap_1_prt_others_2_prt_sub1" for table "sto_co_heap_1_prt_others"
psql:/path/sql_file:1: NOTICE:  CREATE TABLE will create partition "sto_co_heap_1_prt_others_2_prt_sub2" for table "sto_co_heap_1_prt_others"
psql:/path/sql_file:1: NOTICE:  CREATE TABLE will create partition "sto_co_heap_1_prt_2_2_prt_subothers" for table "sto_co_heap_1_prt_2"
psql:/path/sql_file:1: NOTICE:  CREATE TABLE will create partition "sto_co_heap_1_prt_2_2_prt_sub1" for table "sto_co_heap_1_prt_2"
psql:/path/sql_file:1: NOTICE:  CREATE TABLE will create partition "sto_co_heap_1_prt_2_2_prt_sub2" for table "sto_co_heap_1_prt_2"
psql:/path/sql_file:1: NOTICE:  CREATE TABLE will create partition "sto_co_heap_1_prt_3_2_prt_subothers" for table "sto_co_heap_1_prt_3"
psql:/path/sql_file:1: NOTICE:  CREATE TABLE will create partition "sto_co_heap_1_prt_3_2_prt_sub1" for table "sto_co_heap_1_prt_3"
psql:/path/sql_file:1: NOTICE:  CREATE TABLE will create partition "sto_co_heap_1_prt_3_2_prt_sub2" for table "sto_co_heap_1_prt_3"
psql:/path/sql_file:1: NOTICE:  CREATE TABLE will create partition "sto_co_heap_1_prt_4_2_prt_subothers" for table "sto_co_heap_1_prt_4"
psql:/path/sql_file:1: NOTICE:  CREATE TABLE will create partition "sto_co_heap_1_prt_4_2_prt_sub1" for table "sto_co_heap_1_prt_4"
psql:/path/sql_file:1: NOTICE:  CREATE TABLE will create partition "sto_co_heap_1_prt_4_2_prt_sub2" for table "sto_co_heap_1_prt_4"
psql:/path/sql_file:1: NOTICE:  CREATE TABLE will create partition "sto_co_heap_1_prt_5_2_prt_subothers" for table "sto_co_heap_1_prt_5"
psql:/path/sql_file:1: NOTICE:  CREATE TABLE will create partition "sto_co_heap_1_prt_5_2_prt_sub1" for table "sto_co_heap_1_prt_5"
psql:/path/sql_file:1: NOTICE:  CREATE TABLE will create partition "sto_co_heap_1_prt_5_2_prt_sub2" for table "sto_co_heap_1_prt_5"
CREATE TABLE
insert into sto_co_heap(col1, col2, col3) values (1, '2008-01-02', 'one');
INSERT 0 1
insert into sto_co_heap(col1, col2, col3) values (1, '2008-02-03', 'two');
INSERT 0 1
insert into sto_co_heap(col1, col2, col3)  values(1, '2008-03-04', 'three');
INSERT 0 1
insert into sto_co_heap(col1, col2, col3) values (1, '2008-04-05', 'one');
INSERT 0 1
insert into sto_co_heap(col1, col2, col3) values (1, '2008-05-06', 'two');
INSERT 0 1
select count(*) FROM pg_appendonly WHERE visimapidxid is not NULL AND visimapidxid is not NULL AND relid in (SELECT oid FROM pg_class WHERE relname like 'sto_co_heap%');
 count 
-------
    21
(1 row)

SELECT 1 AS VisimapPresent  FROM pg_appendonly WHERE visimapidxid is not NULL AND visimapidxid is not NULL AND relid=(SELECT oid FROM pg_class WHERE relname='sto_co_heap');
 visimappresent 
----------------
              1
(1 row)

select oid::regclass, relkind, relstorage from pg_class where relname like 'sto_co_heap_1_prt_4_2_prt_subothers%' order by oid;
                 oid                 | relkind | relstorage 
-------------------------------------+---------+------------
 sto_co_heap_1_prt_4_2_prt_subothers | r       | c
(1 row)

--start_ignore
Drop table if exists exh_co_heap;
psql:/path/sql_file:1: NOTICE:  table "exh_co_heap" does not exist, skipping
DROP TABLE
--end_ignore
create table exh_co_heap (like sto_co_heap);
psql:/path/sql_file:1: NOTICE:  Table doesn't have 'distributed by' clause, defaulting to distribution columns from LIKE table
CREATE TABLE
insert into exh_co_heap values (1, '2008-03-20', 'two'),  (2, '2008-03-21', 'two');
INSERT 0 2
Alter table sto_co_heap alter partition for (rank(3)) exchange partition for ('two') with table exh_co_heap;
psql:/path/sql_file:1: NOTICE:  exchanged partition "sub2" of partition for rank 3 of relation "sto_co_heap" with relation "exh_co_heap"
ALTER TABLE
select oid::regclass, relkind, relstorage from pg_class where relname like 'sto_co_heap_1_prt_4_2_prt_sub2%' order by oid;
                 oid            | relkind | relstorage 
--------------------------------+---------+------------
 sto_co_heap_1_prt_4_2_prt_sub2 | r       | h
(1 row)

select * from sto_co_heap order by col2;
 col1 |    col2    | col3  | col4 
------+------------+-------+------
    1 | 2008-01-02 | one   |     
    1 | 2008-02-03 | two   |     
    1 | 2008-03-04 | three |
    1 | 2008-03-20 | two   |     
    2 | 2008-03-21 | two   |     
    1 | 2008-04-05 | one   |     
    1 | 2008-05-06 | two   |     
(7 rows)

Update sto_co_heap set col4=2 where col2='2008-03-20';
UPDATE 1
set gp_select_invisible = true;
SET
select * from sto_co_heap order by col2,col4;
 col1 |    col2    | col3  | col4 
------+------------+-------+------
    1 | 2008-01-02 | one   |     
    1 | 2008-02-03 | two   |     
    1 | 2008-03-04 | three |
    1 | 2008-03-20 | two   |    2
    1 | 2008-03-20 | two   |     
    2 | 2008-03-21 | two   |     
    1 | 2008-04-05 | one   |     
    1 | 2008-05-06 | two   |     
(8 rows)

set gp_select_invisible = false;
SET
select * from sto_co_heap order by col2,col4;
 col1 |    col2    | col3  | col4 
------+------------+-------+------
    1 | 2008-01-02 | one   |     
    1 | 2008-02-03 | two   |     
    1 | 2008-03-04 | three |
    1 | 2008-03-20 | two   |    2
    2 | 2008-03-21 | two   |     
    1 | 2008-04-05 | one   |     
    1 | 2008-05-06 | two   |     
(7 rows)

Delete from sto_co_heap where col2='2008-03-21';
DELETE 1
set gp_select_invisible = true;
SET
select * from sto_co_heap order by col2,col4;
 col1 |    col2    | col3  | col4 
------+------------+-------+------
    1 | 2008-01-02 | one   |     
    1 | 2008-02-03 | two   |     
    1 | 2008-03-04 | three |
    1 | 2008-03-20 | two   |    2
    1 | 2008-03-20 | two   |     
    2 | 2008-03-21 | two   |     
    1 | 2008-04-05 | one   |     
    1 | 2008-05-06 | two   |     
(8 rows)

set gp_select_invisible = false;
SET
select * from sto_co_heap order by col2,col4;
 col1 |    col2    | col3  | col4 
------+------------+-------+------
    1 | 2008-01-02 | one   |     
    1 | 2008-02-03 | two   |     
    1 | 2008-03-04 | three |
    1 | 2008-03-20 | two   |    2
    1 | 2008-04-05 | one   |     
    1 | 2008-05-06 | two   |     
(6 rows)

VACUUM sto_co_heap;
VACUUM
select count(*) AS only_visi_tups_vacuum  from sto_co_heap;
 only_visi_tups_vacuum 
-----------------------
                     6
(1 row)

set gp_select_invisible = true;
SET
select count(*) AS invisi_and_visi_tups_vacuum  from sto_co_heap;
 invisi_and_visi_tups_vacuum 
-----------------------------
                           6
(1 row)

set gp_select_invisible = false;
SET
