--Zlib
--start_ignore
Drop table if exists sto_co_en_zlib;
psql:/path/sql_file:1: NOTICE:  table "sto_co_en_zlib" does not exist, skipping
DROP TABLE
--end_ignore
Create table sto_co_en_zlib (id SERIAL,
     a1 int ENCODING (compresstype=zlib,compresslevel=1,blocksize=65536),a2 char(5) ENCODING (compresstype=zlib,compresslevel=3,blocksize=32768),a3 text ENCODING (compresstype=zlib,compresslevel=7,blocksize=8192)) WITH (appendonly=true, orientation=column) distributed randomly;
psql:/path/sql_file:1: NOTICE:  CREATE TABLE will create implicit sequence "sto_co_en_zlib_id_seq" for serial column "sto_co_en_zlib.id"
CREATE TABLE
SELECT 1 AS VisimapPresent  FROM pg_appendonly WHERE visimapidxid is not NULL AND visimapidxid is not NULL AND relid=(SELECT oid FROM pg_class WHERE relname='sto_co_en_zlib');
 visimappresent 
----------------
              1
(1 row)

Create index sto_en_zlb_idx1 on sto_co_en_zlib(a1);
CREATE INDEX
Create index sto_en_zlb_idx2 on sto_co_en_zlib using bitmap(a3);
CREATE INDEX
Insert into sto_co_en_zlib(a1,a2,a3) values(generate_series(1,10),'val1','Johnson & Johnsons McNeil Consumer Healthcare announced the voluntary dosage reduction today. Labels will carry new dosing instructions this fall');
INSERT 0 10
Insert into sto_co_en_zlib(a1,a2,a3) values(generate_series(11,20),'val2','We are pleased to share the September schedule for onsite legal consultations with Duane Morris, our legal counsel for all Pivotal immigration matters.  Representatives will be onsite for one-on-one consultations regarding your individual case');
INSERT 0 10
\d+ sto_co_en_zlib
                                                        Append-Only Columnar Table "public.sto_co_en_zlib"
 Column |     Type     |                          Modifiers                          | Storage  | Compression Type | Compression Level | Block Size | Description 
--------+--------------+-------------------------------------------------------------+----------+------------------+-------------------+------------+-------------
 id     | integer      | not null default nextval('sto_co_en_zlib_id_seq'::regclass) | plain    | none             | 0                 | 32768      | 
 a1     | integer      |                                                             | plain    | zlib             | 1                 | 65536      | 
 a2     | character(5) |                                                             | extended | zlib             | 3                 | 32768      | 
 a3     | text         |                                                             | extended | zlib             | 7                 | 8192       | 
Checksum: f
Indexes:
    "sto_en_zlb_idx1" btree (a1)
    "sto_en_zlb_idx2" bitmap (a3)
Has OIDs: no
Options: appendonly=true, orientation=column
Distributed randomly

select count(*) from sto_co_en_zlib;
 count 
-------
    20
(1 row)

Update sto_co_en_zlib set a3='Parents and other family members are always welcome at Stratford. After the first two weeks ofschool, we encourage you to stop b#%J,mbj756HNM&%.jlyyttlnvisiting, please b
erespectful of the classroom environment and do not disturb the students or teachers. Prior toeach visit, we require all visits to sign in at the school offbduysfifdsna v worn while visiting.As a saf
ety precaution, the Stratford playgrounds are closed for outside visitation during normal school hours. We thank you for your cooperation.' where id=3;
UPDATE 1
 
select count(*) AS only_visi_tups  from sto_co_en_zlib;
 only_visi_tups 
----------------
             20
(1 row)

set gp_select_invisible = true;
SET
select count(*) AS invisi_and_visi_tups  from sto_co_en_zlib ;
 invisi_and_visi_tups 
----------------------
                   21
(1 row)

set gp_select_invisible = false;
SET
Delete from sto_co_en_zlib where a1>8 and a1<13;
DELETE 4
select count(*) AS only_visi_tups  from sto_co_en_zlib;
 only_visi_tups 
----------------
             16
(1 row)

set gp_select_invisible = true;
SET
select count(*) AS invisi_and_visi_tups  from sto_co_en_zlib ;
 invisi_and_visi_tups 
----------------------
                   21
(1 row)

set gp_select_invisible = false;
SET
VACUUM sto_co_en_zlib;
VACUUM
select count(*) AS only_visi_tups_vacuum  from sto_co_en_zlib;
 only_visi_tups_vacuum 
-----------------------
                    16
(1 row)

set gp_select_invisible = true;
SET
select count(*) AS invisi_and_visi_tups_vacuum  from sto_co_en_zlib;
 invisi_and_visi_tups_vacuum 
-----------------------------
                          16
(1 row)

set gp_select_invisible = false;
SET
--Rle_type
--start_ignore
Drop table if exists sto_co_en_rlt;
psql:/path/sql_file:1: NOTICE:  table "sto_co_en_rlt" does not exist, skipping
DROP TABLE
--end_ignore
Create table sto_co_en_rlt (id SERIAL,
     a1 int ENCODING (compresstype=rle_type,compresslevel=1,blocksize=65536),a2 char(5) ENCODING (compresstype= rle_type,compresslevel=1,blocksize=32768),a3 text ENCODING (compresstype= rle_type,compresslevel=1,blocksize=8192)) WITH (appendonly=true, orientation=column) distributed randomly;
psql:/path/sql_file:1: NOTICE:  CREATE TABLE will create implicit sequence "sto_co_en_rlt_id_seq" for serial column "sto_co_en_rlt.id"
CREATE TABLE
SELECT 1 AS VisimapPresent  FROM pg_appendonly WHERE visimapidxid is not NULL AND visimapidxid is not NULL AND relid=(SELECT oid FROM pg_class WHERE relname='sto_co_en_rlt');
 visimappresent 
----------------
              1
(1 row)

Create index sto_en_rlt_idx1 on sto_co_en_rlt(a1);
CREATE INDEX
Create index sto_en_rlt_idx2 on sto_co_en_rlt using bitmap(a3);
CREATE INDEX
Insert into sto_co_en_rlt(a1,a2,a3) values(generate_series(1,10),'val1','Johnson & Johnsons McNeil Consumer Healthcare announced the voluntary dosage reduction today. Labels will carry new dosing instructions this fall');
INSERT 0 10
Insert into sto_co_en_rlt(a1,a2,a3) values(generate_series(11,20),'val2','We are pleased to share the September schedule for onsite legal consultations with Duane Morris, our legal counsel for all Pivotal immigration matters.  Representatives will be onsite for one-on-one consultations regarding your individual case');
INSERT 0 10
\d+ sto_co_en_rlt
                                                        Append-Only Columnar Table "public.sto_co_en_rlt"
 Column |     Type     |                         Modifiers                          | Storage  | Compression Type | Compression Level | Block Size | Description 
--------+--------------+------------------------------------------------------------+----------+------------------+-------------------+------------+-------------
 id     | integer      | not null default nextval('sto_co_en_rlt_id_seq'::regclass) | plain    | none             | 0                 | 32768      | 
 a1     | integer      |                                                            | plain    | rle_type         | 1                 | 65536      | 
 a2     | character(5) |                                                            | extended | rle_type         | 1                 | 32768      | 
 a3     | text         |                                                            | extended | rle_type         | 1                 | 8192       | 
Checksum: f
Indexes:
    "sto_en_rlt_idx1" btree (a1)
    "sto_en_rlt_idx2" bitmap (a3)
Has OIDs: no
Options: appendonly=true, orientation=column
Distributed randomly

select count(*) from sto_co_en_rlt;
 count 
-------
    20
(1 row)

Update sto_co_en_rlt set a3='Parents and other family members are always welcome at Stratford. After the first two weeks ofschool, we encourage you to stop b#%J,mbj756HNM&%.jlyyttlnvisiting, please be respectful of the classroom environment and do not disturb the students or teachers. Prior toeach visit, we require all visits to sign in at the school offbduysfifdsna v worn while visiting.As a safety precaution, the Stratford playgrounds are closed for outside visitation during normal school hours. We thank you for your cooperation.' where id=3;
UPDATE 1
 
select count(*) AS only_visi_tups  from sto_co_en_rlt;
 only_visi_tups 
----------------
             20
(1 row)

set gp_select_invisible = true;
SET
select count(*) AS invisi_and_visi_tups  from sto_co_en_rlt ;
 invisi_and_visi_tups 
----------------------
                   21
(1 row)

set gp_select_invisible = false;
SET
Delete from sto_co_en_rlt where a1>8 and a1<13;
DELETE 4
select count(*) AS only_visi_tups  from sto_co_en_rlt;
 only_visi_tups 
----------------
             16
(1 row)

set gp_select_invisible = true;
SET
select count(*) AS invisi_and_visi_tups  from sto_co_en_rlt ;
 invisi_and_visi_tups 
----------------------
                   21
(1 row)

set gp_select_invisible = false;
SET
VACUUM sto_co_en_rlt;
VACUUM
select count(*) AS only_visi_tups_vacuum  from sto_co_en_rlt;
 only_visi_tups_vacuum 
-----------------------
                    16
(1 row)

set gp_select_invisible = true;
SET
select count(*) AS invisi_and_visi_tups_vacuum  from sto_co_en_rlt;
 invisi_and_visi_tups_vacuum 
-----------------------------
                          16
(1 row)

set gp_select_invisible = false;
SET
