-- @description : delete from UAO tables , with various compression type
-- 
-- create select uao table with compress=None 
Drop table if exists uao_tab_compress_none_del cascade;
DROP TABLE
CREATE TABLE uao_tab_compress_none_del (      
          col_int int,
          col_text text,
          col_numeric numeric)
 with (appendonly=true, orientation=column , COMPRESSTYPE=NONE ) ; 
psql:/path/sql_file:1: NOTICE:  Table doesn't have 'DISTRIBUTED BY' clause -- Using column named 'col_int' as the Greenplum Database data distribution key for this table.
HINT:  The 'DISTRIBUTED BY' clause determines the distribution of data. Make sure column(s) chosen are the optimal data distribution key to minimize skew.
CREATE TABLE
\d+ uao_tab_compress_none_del
                         Append-Only Columnar Table "public.uao_tab_compress_none_del"
   Column    |  Type   | Modifiers | Storage  | Compression Type | Compression Level | Block Size | Description 
-------------+---------+-----------+----------+------------------+-------------------+------------+-------------
 col_int     | integer |           | plain    | none             | 0                 | 32768      | 
 col_text    | text    |           | extended | none             | 0                 | 32768      | 
 col_numeric | numeric |           | main     | none             | 0                 | 32768      | 
Checksum: f
Has OIDs: no
Options: appendonly=true, orientation=column, compresstype=none
Distributed by: (col_int)

select count(*) from uao_tab_compress_none_del;
 count 
-------
     0
(1 row)

SELECT 1 AS VisimapPresent  FROM pg_appendonly WHERE visimapidxid is not NULL AND visimapidxid is not NULL AND relid=(SELECT oid FROM pg_class WHERE relname='uao_tab_compress_none_del');
 visimappresent 
----------------
              1
(1 row)

insert into uao_tab_compress_none_del values(1,'val1',100);
INSERT 0 1
insert into uao_tab_compress_none_del values(2,'val2',200);
INSERT 0 1
insert into uao_tab_compress_none_del values(3,'val3',300);
INSERT 0 1
select *  from uao_tab_compress_none_del order by col_int;
 col_int | col_text | col_numeric 
---------+----------+-------------
       1 | val1     |         100
       2 | val2     |         200
       3 | val3     |         300
(3 rows)

delete from uao_tab_compress_none_del  where col_int = 1;
DELETE 1
select *  from uao_tab_compress_none_del order by col_int;
 col_int | col_text | col_numeric 
---------+----------+-------------
       2 | val2     |         200
       3 | val3     |         300
(2 rows)

select count(*) AS only_visi_tups  from uao_tab_compress_none_del ;
 only_visi_tups 
----------------
              2
(1 row)

set gp_select_invisible = true;
SET
select count(*) AS invisi_and_visi_tups  from uao_tab_compress_none_del ;
 invisi_and_visi_tups 
----------------------
                    3
(1 row)

select *  from uao_tab_compress_none_del order by col_int;
 col_int | col_text | col_numeric 
---------+----------+-------------
       1 | val1     |         100
       2 | val2     |         200
       3 | val3     |         300
(3 rows)

set gp_select_invisible = false;
SET
-- create select uao table with compress=zlib COMPRESSLEVEL=1 
Drop table if exists uao_tab_compress_zlib1_del cascade;
DROP TABLE
CREATE TABLE uao_tab_compress_zlib1_del (
          col_int int,
          col_text text,
          col_numeric numeric)
 with (appendonly=true, orientation=column , COMPRESSTYPE=zlib, COMPRESSLEVEL=1  ); 
psql:/path/sql_file:1: NOTICE:  Table doesn't have 'DISTRIBUTED BY' clause -- Using column named 'col_int' as the Greenplum Database data distribution key for this table.
HINT:  The 'DISTRIBUTED BY' clause determines the distribution of data. Make sure column(s) chosen are the optimal data distribution key to minimize skew.
CREATE TABLE
\d+ uao_tab_compress_zlib1_del
                         Append-Only Columnar Table "public.uao_tab_compress_zlib1_del"
   Column    |  Type   | Modifiers | Storage  | Compression Type | Compression Level | Block Size | Description 
-------------+---------+-----------+----------+------------------+-------------------+------------+-------------
 col_int     | integer |           | plain    | zlib             | 1                 | 32768      | 
 col_text    | text    |           | extended | zlib             | 1                 | 32768      | 
 col_numeric | numeric |           | main     | zlib             | 1                 | 32768      | 
Checksum: f
Has OIDs: no
Options: appendonly=true, orientation=column, compresstype=zlib, compresslevel=1
Distributed by: (col_int)

select count(*) from uao_tab_compress_zlib1_del;
 count 
-------
     0
(1 row)

SELECT 1 AS VisimapPresent  FROM pg_appendonly WHERE visimapidxid is not NULL AND visimapidxid is not NULL AND relid=(SELECT oid FROM pg_class WHERE relname='uao_tab_compress_zlib1_del');
 visimappresent 
----------------
              1
(1 row)

SELECT 1 AS compression_present from pg_appendonly WHERE compresstype='zlib' AND compresslevel=1 AND relid=(SELECT oid  FROM pg_class WHERE relname='uao_tab_compress_zlib1_del');
 compression_present 
---------------------
                   1
(1 row)

insert into uao_tab_compress_zlib1_del values(1,'val1',100);
INSERT 0 1
insert into uao_tab_compress_zlib1_del values(2,'val2',200);
INSERT 0 1
insert into uao_tab_compress_zlib1_del values(3,'val3',300);
INSERT 0 1
select *  from uao_tab_compress_zlib1_del order by col_int;
 col_int | col_text | col_numeric 
---------+----------+-------------
       1 | val1     |         100
       2 | val2     |         200
       3 | val3     |         300
(3 rows)

delete from uao_tab_compress_zlib1_del  where col_int = 1;
DELETE 1
select *  from uao_tab_compress_zlib1_del order by col_int;
 col_int | col_text | col_numeric 
---------+----------+-------------
       2 | val2     |         200
       3 | val3     |         300
(2 rows)

select count(*) AS only_visi_tups  from uao_tab_compress_zlib1_del ;
 only_visi_tups 
----------------
              2
(1 row)

set gp_select_invisible = true;
SET
select count(*) AS invisi_and_visi_tups  from uao_tab_compress_zlib1_del ;
 invisi_and_visi_tups 
----------------------
                    3
(1 row)

select *  from uao_tab_compress_zlib1_del order by col_int;
 col_int | col_text | col_numeric 
---------+----------+-------------
       1 | val1     |         100
       2 | val2     |         200
       3 | val3     |         300
(3 rows)

set gp_select_invisible = false;
SET
-- create select uao table with compress=zlib COMPRESSLEVEL=9 
Drop table if exists uao_tab_compress_zlib9_del cascade;
DROP TABLE
CREATE TABLE uao_tab_compress_zlib9_del (
          col_int int,
          col_text text,
          col_numeric numeric)
 with (appendonly=true, orientation=column , COMPRESSTYPE=zlib, COMPRESSLEVEL=9  );   
psql:/path/sql_file:1: NOTICE:  Table doesn't have 'DISTRIBUTED BY' clause -- Using column named 'col_int' as the Greenplum Database data distribution key for this table.
HINT:  The 'DISTRIBUTED BY' clause determines the distribution of data. Make sure column(s) chosen are the optimal data distribution key to minimize skew.
CREATE TABLE
\d+ uao_tab_compress_zlib9_del
                         Append-Only Columnar Table "public.uao_tab_compress_zlib9_del"
   Column    |  Type   | Modifiers | Storage  | Compression Type | Compression Level | Block Size | Description 
-------------+---------+-----------+----------+------------------+-------------------+------------+-------------
 col_int     | integer |           | plain    | zlib             | 9                 | 32768      | 
 col_text    | text    |           | extended | zlib             | 9                 | 32768      | 
 col_numeric | numeric |           | main     | zlib             | 9                 | 32768      | 
Checksum: f
Has OIDs: no
Options: appendonly=true, orientation=column, compresstype=zlib, compresslevel=9
Distributed by: (col_int)

select count(*) from uao_tab_compress_zlib9_del;
 count 
-------
     0
(1 row)

SELECT 1 AS VisimapPresent  FROM pg_appendonly WHERE visimapidxid is not NULL AND visimapidxid is not NULL AND relid=(SELECT oid FROM pg_class WHERE relname='uao_tab_compress_zlib9_del');
 visimappresent 
----------------
              1
(1 row)

SELECT 1 AS compression_present from pg_appendonly WHERE compresstype='zlib' AND compresslevel=9 AND relid=(SELECT oid  FROM pg_class WHERE relname='uao_tab_compress_zlib9_del');
 compression_present 
---------------------
                   1
(1 row)

insert into uao_tab_compress_zlib9_del values(1,'val1',100);
INSERT 0 1
insert into uao_tab_compress_zlib9_del values(2,'val2',200);
INSERT 0 1
insert into uao_tab_compress_zlib9_del values(3,'val3',300);
INSERT 0 1
select *  from uao_tab_compress_zlib9_del order by col_int;
 col_int | col_text | col_numeric 
---------+----------+-------------
       1 | val1     |         100
       2 | val2     |         200
       3 | val3     |         300
(3 rows)

delete from uao_tab_compress_zlib9_del  where col_int = 1;
DELETE 1
select *  from uao_tab_compress_zlib9_del order by col_int;
 col_int | col_text | col_numeric 
---------+----------+-------------
       2 | val2     |         200
       3 | val3     |         300
(2 rows)

select count(*) AS only_visi_tups  from uao_tab_compress_zlib9_del ;
 only_visi_tups 
----------------
              2
(1 row)

set gp_select_invisible = true;
SET
select count(*) AS invisi_and_visi_tups  from uao_tab_compress_zlib9_del ;
 invisi_and_visi_tups 
----------------------
                    3
(1 row)

select *  from uao_tab_compress_zlib9_del order by col_int;
 col_int | col_text | col_numeric 
---------+----------+-------------
       1 | val1     |         100
       2 | val2     |         200
       3 | val3     |         300
(3 rows)

set gp_select_invisible = false;
SET
