-- @description : delete from UAO tables , with different distributions
-- 
-- create select uao table with  No distribution (hence hash distribution)
DROP TABLE IF EXISTS  uao_tab_distrib_none_del cascade;
DROP TABLE
CREATE TABLE uao_tab_distrib_none_del  with (appendonly=true, orientation=column )  AS (
SELECT GENERATE_SERIES::numeric sno
     , (random() * 10000000)::numeric + 10000000 val1
     , timeofday()::varchar(50) val2
     , (random() * 5000)::bigint + 10000000 val3
     , (random() * 10000000)::numeric + 10000000 val4
     , (random() * 10000000)::numeric + 10000000 val5	
  FROM GENERATE_SERIES(10000, 19999)
) ;
psql:/path/sql_file:1: NOTICE:  Table doesn't have 'DISTRIBUTED BY' clause -- Using column(s) named 'sno' as the Greenplum Database data distribution key for this table.
HINT:  The 'DISTRIBUTED BY' clause determines the distribution of data. Make sure column(s) chosen are the optimal data distribution key to minimize skew.
SELECT 10000
CREATE index val3_bmp_idx_uao_tab_distrib_none_del on uao_tab_distrib_none_del using bitmap (val3);
CREATE INDEX
SELECT count(*) AS cnt_row_distrib_none from uao_tab_distrib_none_del;
 cnt_row_distrib_none 
----------------------
                10000
(1 row)

SELECT 1 AS VisimapPresent  FROM pg_appendonly WHERE visimapidxid is not NULL AND visimapidxid is not NULL AND relid=(SELECT oid FROM pg_class WHERE relname='uao_tab_distrib_none_del');
 visimappresent 
----------------
              1
(1 row)

delete from  uao_tab_distrib_none_del where sno = 10000;
DELETE 1
select count(*) AS only_visi_tups  from uao_tab_distrib_none_del;
 only_visi_tups 
----------------
           9999
(1 row)

set gp_select_invisible = true;
SET
select count(*) AS invisi_and_visi_tups  from uao_tab_distrib_none_del;
 invisi_and_visi_tups 
----------------------
                10000
(1 row)

set gp_select_invisible = false;
SET
-- create select uao table with  distributed by sno
DROP TABLE IF EXISTS uao_tab_distrib_key_del cascade;
DROP TABLE
CREATE TABLE uao_tab_distrib_key_del  with (appendonly=true, orientation=column )  AS (
SELECT GENERATE_SERIES::numeric sno
     , (random() * 10000000)::numeric + 10000000 val1
     , timeofday()::varchar(50) val2
     , (random() * 5000)::bigint + 10000000 val3
     , (random() * 10000000)::numeric + 10000000 val4
     , (random() * 10000000)::numeric + 10000000 val5	
  FROM GENERATE_SERIES(10000, 19999)
) DISTRIBUTED BY (sno) ;
SELECT 10000
CREATE index val3_bmp_idx_uao_tab_distrib_key_del on uao_tab_distrib_key_del using bitmap (val3);
CREATE INDEX
SELECT count(*) AS cnt_row_distrib_key from uao_tab_distrib_key_del;
 cnt_row_distrib_key 
---------------------
               10000
(1 row)

SELECT 1 AS VisimapPresent  FROM pg_appendonly WHERE visimapidxid is not NULL AND visimapidxid is not NULL AND relid=(SELECT oid FROM pg_class WHERE relname='uao_tab_distrib_key_del');
 visimappresent 
----------------
              1
(1 row)

delete from  uao_tab_distrib_key_del  where sno = 10000;
DELETE 1
select count(*) AS only_visi_tups  from uao_tab_distrib_key_del;
 only_visi_tups 
----------------
           9999
(1 row)

set gp_select_invisible = true;
SET
select count(*) AS invisi_and_visi_tups  from uao_tab_distrib_key_del;
 invisi_and_visi_tups 
----------------------
                10000
(1 row)

set gp_select_invisible = false;
SET
-- create select uao table with  distributed randomly
DROP TABLE IF EXISTS  uao_tab_distrib_randomly_del cascade;
DROP TABLE
CREATE TABLE uao_tab_distrib_randomly_del  with (appendonly=true, orientation=column )  AS (
SELECT GENERATE_SERIES::numeric sno
     , (random() * 10000000)::numeric + 10000000 val1
     , timeofday()::varchar(50) val2
     , (random() * 5000)::bigint + 10000000 val3
     , (random() * 10000000)::numeric + 10000000 val4
     , (random() * 10000000)::numeric + 10000000 val5	
  FROM GENERATE_SERIES(10000, 19999)
) DISTRIBUTED randomly ;
SELECT 10000
CREATE index val3_bmp_idx_uao_tab_distrib_randomly_del on uao_tab_distrib_randomly_del using bitmap (val3);
CREATE INDEX
SELECT count(*) AS cnt_row_distrib_random from uao_tab_distrib_randomly_del;
 cnt_row_distrib_random 
------------------------
                  10000
(1 row)

SELECT 1 AS VisimapPresent  FROM pg_appendonly WHERE visimapidxid is not NULL AND visimapidxid is not NULL AND relid=(SELECT oid FROM pg_class WHERE relname='uao_tab_distrib_randomly_del');
 visimappresent 
----------------
              1
(1 row)

delete from  uao_tab_distrib_randomly_del where sno = 10000;
DELETE 1
select count(*) AS only_visi_tups  from uao_tab_distrib_randomly_del;
 only_visi_tups 
----------------
           9999
(1 row)

set gp_select_invisible = true;
SET
select count(*) AS invisi_and_visi_tups  from uao_tab_distrib_randomly_del;
 invisi_and_visi_tups 
----------------------
                10000
(1 row)

set gp_select_invisible = false;
SET
