-- @description : : Update Partitioned Updatable AO tables 
-- 
-- Create AO part tables
DROP TABLE if exists sto_uao_p1_upd;
DROP TABLE
CREATE TABLE  sto_uao_p1_upd
 (
 col1 bigint, col2 date, col3 text, col4 int) with(appendonly=true, orientation=column)
 distributed randomly  partition by range(col2)
 subpartition by list (col3)
 subpartition template ( default subpartition subothers, subpartition sub1 values ('one'), subpartition sub2 values ('two')) 
 (default partition others, start(date '2008-01-01') end(date '2008-04-30') every(interval '1 month'));
psql:/path/sql_file:1: NOTICE:  CREATE TABLE will create partition "sto_uao_p1_upd_1_prt_others" for table "sto_uao_p1_upd"
psql:/path/sql_file:1: NOTICE:  CREATE TABLE will create partition "sto_uao_p1_upd_1_prt_2" for table "sto_uao_p1_upd"
psql:/path/sql_file:1: NOTICE:  CREATE TABLE will create partition "sto_uao_p1_upd_1_prt_3" for table "sto_uao_p1_upd"
psql:/path/sql_file:1: NOTICE:  CREATE TABLE will create partition "sto_uao_p1_upd_1_prt_4" for table "sto_uao_p1_upd"
psql:/path/sql_file:1: NOTICE:  CREATE TABLE will create partition "sto_uao_p1_upd_1_prt_5" for table "sto_uao_p1_upd"
psql:/path/sql_file:1: NOTICE:  CREATE TABLE will create partition "sto_uao_p1_upd_1_prt_others_2_prt_subothers" for table "sto_uao_p1_upd_1_prt_others"
psql:/path/sql_file:1: NOTICE:  CREATE TABLE will create partition "sto_uao_p1_upd_1_prt_others_2_prt_sub1" for table "sto_uao_p1_upd_1_prt_others"
psql:/path/sql_file:1: NOTICE:  CREATE TABLE will create partition "sto_uao_p1_upd_1_prt_others_2_prt_sub2" for table "sto_uao_p1_upd_1_prt_others"
psql:/path/sql_file:1: NOTICE:  CREATE TABLE will create partition "sto_uao_p1_upd_1_prt_2_2_prt_subothers" for table "sto_uao_p1_upd_1_prt_2"
psql:/path/sql_file:1: NOTICE:  CREATE TABLE will create partition "sto_uao_p1_upd_1_prt_2_2_prt_sub1" for table "sto_uao_p1_upd_1_prt_2"
psql:/path/sql_file:1: NOTICE:  CREATE TABLE will create partition "sto_uao_p1_upd_1_prt_2_2_prt_sub2" for table "sto_uao_p1_upd_1_prt_2"
psql:/path/sql_file:1: NOTICE:  CREATE TABLE will create partition "sto_uao_p1_upd_1_prt_3_2_prt_subothers" for table "sto_uao_p1_upd_1_prt_3"
psql:/path/sql_file:1: NOTICE:  CREATE TABLE will create partition "sto_uao_p1_upd_1_prt_3_2_prt_sub1" for table "sto_uao_p1_upd_1_prt_3"
psql:/path/sql_file:1: NOTICE:  CREATE TABLE will create partition "sto_uao_p1_upd_1_prt_3_2_prt_sub2" for table "sto_uao_p1_upd_1_prt_3"
psql:/path/sql_file:1: NOTICE:  CREATE TABLE will create partition "sto_uao_p1_upd_1_prt_4_2_prt_subothers" for table "sto_uao_p1_upd_1_prt_4"
psql:/path/sql_file:1: NOTICE:  CREATE TABLE will create partition "sto_uao_p1_upd_1_prt_4_2_prt_sub1" for table "sto_uao_p1_upd_1_prt_4"
psql:/path/sql_file:1: NOTICE:  CREATE TABLE will create partition "sto_uao_p1_upd_1_prt_4_2_prt_sub2" for table "sto_uao_p1_upd_1_prt_4"
psql:/path/sql_file:1: NOTICE:  CREATE TABLE will create partition "sto_uao_p1_upd_1_prt_5_2_prt_subothers" for table "sto_uao_p1_upd_1_prt_5"
psql:/path/sql_file:1: NOTICE:  CREATE TABLE will create partition "sto_uao_p1_upd_1_prt_5_2_prt_sub1" for table "sto_uao_p1_upd_1_prt_5"
psql:/path/sql_file:1: NOTICE:  CREATE TABLE will create partition "sto_uao_p1_upd_1_prt_5_2_prt_sub2" for table "sto_uao_p1_upd_1_prt_5"
CREATE TABLE
SELECT 1  AS VisimapPresent FROM pg_appendonly WHERE visimapidxid is not NULL AND visimapidxid is not NULL AND relid=(SELECT oid  FROM pg_class WHERE relname='sto_uao_p1_upd');
 visimappresent 
----------------
              1
(1 row)

\d+ sto_uao_p1_upd;
                            Append-Only Columnar Table "public.sto_uao_p1_upd"
 Column |  Type   | Modifiers | Storage  | Compression Type | Compression Level | Block Size | Description 
--------+---------+-----------+----------+------------------+-------------------+------------+-------------
 col1   | bigint  |           | plain    | none             | 0                 | 32768      | 
 col2   | date    |           | plain    | none             | 0                 | 32768      | 
 col3   | text    |           | extended | none             | 0                 | 32768      | 
 col4   | integer |           | plain    | none             | 0                 | 32768      | 
Checksum: f
Child tables: sto_uao_p1_upd_1_prt_2,
              sto_uao_p1_upd_1_prt_3,
              sto_uao_p1_upd_1_prt_4,
              sto_uao_p1_upd_1_prt_5,
              sto_uao_p1_upd_1_prt_others
Has OIDs: no
Options: appendonly=true, orientation=column
Distributed randomly

insert into sto_uao_p1_upd(col1, col2, col3) values (1, '2008-01-02', 'one'), (2, '2008-01-02', 'two'), (3, '2008-01-02', 'three');
INSERT 0 3
insert into sto_uao_p1_upd(col1, col2, col3) values (2, '2008-02-03', 'two'), (2, '2008-02-03', 'one'), (3, '2008-02-03', 'three');
INSERT 0 3
insert into sto_uao_p1_upd(col1, col2, col3)  values(3, '2008-03-04', 'three'),(1, '2008-04-04', 'one'), (2, '2008-03-04', 'two') ;
INSERT 0 3
insert into sto_uao_p1_upd(col1, col2, col3) values (4, '2008-04-05', 'one'), (2, '2008-04-05', 'two'), (3, '2008-04-05', 'three');
INSERT 0 3
insert into sto_uao_p1_upd(col1, col2, col3) values (5, '2008-05-06', 'one'), (2, '2008-05-06', 'two'), (3, '2008-05-06', 'three');
INSERT 0 3
select count(*) from sto_uao_p1_upd ;
 count 
-------
    15
(1 row)

update sto_uao_p1_upd set col4=22 where col3='two' and col1=2;
UPDATE 5
select count(*) AS only_visi_tups  from sto_uao_p1_upd;
 only_visi_tups 
----------------
             15
(1 row)

set gp_select_invisible = true;
SET
select count(*) AS invisi_and_visi_tups  from sto_uao_p1_upd;
 invisi_and_visi_tups 
----------------------
                   20
(1 row)

set gp_select_invisible = false;
SET
-- AO Mixed part tables
-- Mixed part tables
Drop table if exists sto_uao_mx_p1_upd;
DROP TABLE
create table sto_uao_mx_p1_upd
(
col1 bigint, col2 date, col3 text, col4 int) with(appendonly=true, orientation=column)
distributed randomly  partition by range(col2)
subpartition by list (col3)
subpartition template (
default subpartition subothers,
subpartition sub1 values ('one'),
subpartition sub2 values ('two') with(appendonly = false),
subpartition sub3 values ('three') with(appendonly=true, orientation=column))
(default partition others, start(date '2008-01-01') end(date '2008-04-30') every(interval '1 month'));
psql:/path/sql_file:1: NOTICE:  CREATE TABLE will create partition "sto_uao_mx_p1_upd_1_prt_others" for table "sto_uao_mx_p1_upd"
psql:/path/sql_file:1: NOTICE:  CREATE TABLE will create partition "sto_uao_mx_p1_upd_1_prt_2" for table "sto_uao_mx_p1_upd"
psql:/path/sql_file:1: NOTICE:  CREATE TABLE will create partition "sto_uao_mx_p1_upd_1_prt_3" for table "sto_uao_mx_p1_upd"
psql:/path/sql_file:1: NOTICE:  CREATE TABLE will create partition "sto_uao_mx_p1_upd_1_prt_4" for table "sto_uao_mx_p1_upd"
psql:/path/sql_file:1: NOTICE:  CREATE TABLE will create partition "sto_uao_mx_p1_upd_1_prt_5" for table "sto_uao_mx_p1_upd"
psql:/path/sql_file:1: NOTICE:  CREATE TABLE will create partition "sto_uao_mx_p1_upd_1_prt_others_2_prt_subothers" for table "sto_uao_mx_p1_upd_1_prt_others"
psql:/path/sql_file:1: NOTICE:  CREATE TABLE will create partition "sto_uao_mx_p1_upd_1_prt_others_2_prt_sub1" for table "sto_uao_mx_p1_upd_1_prt_others"
psql:/path/sql_file:1: NOTICE:  CREATE TABLE will create partition "sto_uao_mx_p1_upd_1_prt_others_2_prt_sub2" for table "sto_uao_mx_p1_upd_1_prt_others"
psql:/path/sql_file:1: NOTICE:  CREATE TABLE will create partition "sto_uao_mx_p1_upd_1_prt_others_2_prt_sub3" for table "sto_uao_mx_p1_upd_1_prt_others"
psql:/path/sql_file:1: NOTICE:  CREATE TABLE will create partition "sto_uao_mx_p1_upd_1_prt_2_2_prt_subothers" for table "sto_uao_mx_p1_upd_1_prt_2"
psql:/path/sql_file:1: NOTICE:  CREATE TABLE will create partition "sto_uao_mx_p1_upd_1_prt_2_2_prt_sub1" for table "sto_uao_mx_p1_upd_1_prt_2"
psql:/path/sql_file:1: NOTICE:  CREATE TABLE will create partition "sto_uao_mx_p1_upd_1_prt_2_2_prt_sub2" for table "sto_uao_mx_p1_upd_1_prt_2"
psql:/path/sql_file:1: NOTICE:  CREATE TABLE will create partition "sto_uao_mx_p1_upd_1_prt_2_2_prt_sub3" for table "sto_uao_mx_p1_upd_1_prt_2"
psql:/path/sql_file:1: NOTICE:  CREATE TABLE will create partition "sto_uao_mx_p1_upd_1_prt_3_2_prt_subothers" for table "sto_uao_mx_p1_upd_1_prt_3"
psql:/path/sql_file:1: NOTICE:  CREATE TABLE will create partition "sto_uao_mx_p1_upd_1_prt_3_2_prt_sub1" for table "sto_uao_mx_p1_upd_1_prt_3"
psql:/path/sql_file:1: NOTICE:  CREATE TABLE will create partition "sto_uao_mx_p1_upd_1_prt_3_2_prt_sub2" for table "sto_uao_mx_p1_upd_1_prt_3"
psql:/path/sql_file:1: NOTICE:  CREATE TABLE will create partition "sto_uao_mx_p1_upd_1_prt_3_2_prt_sub3" for table "sto_uao_mx_p1_upd_1_prt_3"
psql:/path/sql_file:1: NOTICE:  CREATE TABLE will create partition "sto_uao_mx_p1_upd_1_prt_4_2_prt_subothers" for table "sto_uao_mx_p1_upd_1_prt_4"
psql:/path/sql_file:1: NOTICE:  CREATE TABLE will create partition "sto_uao_mx_p1_upd_1_prt_4_2_prt_sub1" for table "sto_uao_mx_p1_upd_1_prt_4"
psql:/path/sql_file:1: NOTICE:  CREATE TABLE will create partition "sto_uao_mx_p1_upd_1_prt_4_2_prt_sub2" for table "sto_uao_mx_p1_upd_1_prt_4"
psql:/path/sql_file:1: NOTICE:  CREATE TABLE will create partition "sto_uao_mx_p1_upd_1_prt_4_2_prt_sub3" for table "sto_uao_mx_p1_upd_1_prt_4"
psql:/path/sql_file:1: NOTICE:  CREATE TABLE will create partition "sto_uao_mx_p1_upd_1_prt_5_2_prt_subothers" for table "sto_uao_mx_p1_upd_1_prt_5"
psql:/path/sql_file:1: NOTICE:  CREATE TABLE will create partition "sto_uao_mx_p1_upd_1_prt_5_2_prt_sub1" for table "sto_uao_mx_p1_upd_1_prt_5"
psql:/path/sql_file:1: NOTICE:  CREATE TABLE will create partition "sto_uao_mx_p1_upd_1_prt_5_2_prt_sub2" for table "sto_uao_mx_p1_upd_1_prt_5"
psql:/path/sql_file:1: NOTICE:  CREATE TABLE will create partition "sto_uao_mx_p1_upd_1_prt_5_2_prt_sub3" for table "sto_uao_mx_p1_upd_1_prt_5"
CREATE TABLE
SELECT 1  AS VisimapPresent FROM pg_appendonly WHERE visimapidxid is not NULL AND visimapidxid is not NULL AND relid=(SELECT oid  FROM pg_class WHERE relname='sto_uao_mx_p1_upd');
 visimappresent 
----------------
              1
(1 row)

insert into sto_uao_mx_p1_upd(col1, col2, col3) values (1, '2008-01-02', 'one'), (2, '2008-01-02', 'two'), (3, '2008-01-02', 'three'), (4, '2008-01-02' ,'four');
INSERT 0 4
insert into sto_uao_mx_p1_upd(col1, col2, col3) values (1, '2008-02-03', 'two'), (2, '2008-02-03', 'one'), (3, '2008-02-03', 'three'), (4, '2008-02-03' ,'four');
INSERT 0 4
insert into sto_uao_mx_p1_upd(col1, col2, col3)  values(1, '2008-03-04', 'three'),(1, '2008-04-04', 'one'), (2, '2008-03-04', 'two'), (4, '2008-03-04' ,'four') ;
INSERT 0 4
insert into sto_uao_mx_p1_upd(col1, col2, col3) values (1, '2008-04-05', 'one'), (2, '2008-04-05', 'two'), (3, '2008-04-05', 'three'), (4, '2008-04-05', 'four');
INSERT 0 4
insert into sto_uao_mx_p1_upd(col1, col2, col3) values (1, '2008-05-06', 'one'), (2, '2008-05-06', 'two'), (3, '2008-05-06', 'three'), (4, '2008-05-06', 'four');
INSERT 0 4
select count(*) from sto_uao_mx_p1_upd;
 count 
-------
    20
(1 row)

update sto_uao_mx_p1_upd set col4=22 where col3='two' and col1=2;
UPDATE 4
select count(*) AS only_visi_tups  from sto_uao_mx_p1_upd;
 only_visi_tups 
----------------
             20
(1 row)

set gp_select_invisible = true;
SET
select count(*) AS invisi_and_visi_tups  from sto_uao_mx_p1_upd;
 invisi_and_visi_tups 
----------------------
                   24
(1 row)

set gp_select_invisible = false;
SET
