drop database if exists gptest_gprestore;
NOTICE:  database "gptest_gprestore" does not exist, skipping
drop database if exists gptest_pgrestore;
NOTICE:  database "gptest_pgrestore" does not exist, skipping
drop database if exists testdb1;
NOTICE:  database "testdb1" does not exist, skipping
\echo -- start_ignore
-- start_ignore
-------------DISPLAYS ALL DATABASE OBJECTS WITH COMMENTS-
\dd
         Object descriptions
 Schema | Name | Object | Description 
--------+------+--------+-------------
(0 rows)

-----------Display all database available with comments
\l+
                                                List of databases
          Name           | Owner  | Encoding | Access privileges | Size  | Tablespace |        Description        
-------------------------+--------+----------+-------------------+-------+------------+---------------------------
 checkcatdb              | jaltar | UTF8     |                   | 40 MB | pg_default | 
 checkcatdb_alter_rename | jaltar | UTF8     |                   | 40 MB | pg_default | 
 gptest                  | jaltar | UTF8     |                   | 54 MB | pg_default | 
 mpp14393                | jaltar | UTF8     |                   | 40 MB | pg_default | 
 mpp16567                | jaltar | UTF8     |                   | 38 MB | pg_default | 
 postgres                | jaltar | UTF8     |                   | 38 MB | pg_default | 
 regression              | jaltar | UTF8     |                   | 36 MB | pg_default | 
 template0               | jaltar | UTF8     | =c/jaltar         | 36 MB | pg_default | 
                                             : jaltar=CTc/jaltar                        
 template1               | jaltar | UTF8     | =c/jaltar         | 38 MB | pg_default | Default template database
                                             : jaltar=CTc/jaltar                        
(9 rows)

--------------------------Display all tables in the connected database-------
\dt+
                  List of relations
 Schema | Name | Type | Owner | Storage | Description 
--------+------+------+-------+---------+-------------
(0 rows)

-----------Display all sequence in the connected database----------
\ds+
                  List of relations
 Schema | Name | Type | Owner | Storage | Description 
--------+------+------+-------+---------+-------------
(0 rows)

--------------Display all view
\dv+
                  List of relations
 Schema | Name | Type | Owner | Storage | Description 
--------+------+------+-------+---------+-------------
(0 rows)

--------Display all operator in connected database
\do+
                             List of operators
 Schema | Name | Left arg type | Right arg type | Result type | Description 
--------+------+---------------+----------------+-------------+-------------
(0 rows)

-------------------------------------------------------------------------
----Display all datatype in connected database
-----------------------------------------------------
\dt+
                  List of relations
 Schema | Name | Type | Owner | Storage | Description 
--------+------+------+-------+---------+-------------
(0 rows)

--------------------------------------------------------
-----------Display all function in connected database
\df+
                                                             List of functions
 Schema | Name | Result data type | Argument data types | Type | Prodataaccess | Volatility | Owner | Language | Source code | Description 
--------+------+------------------+---------------------+------+---------------+------------+-------+----------+-------------+-------------
(0 rows)

---------------------------------------------------------------------
--- Querying a system table : pg_language ---
SELECT lanname, lanispl, lanpltrusted, lanacl FROM pg_language;
 lanname  | lanispl | lanpltrusted | lanacl 
----------+---------+--------------+--------
 internal | f       | f            | 
 c        | f       | f            | 
 sql      | f       | t            | 
 plpgsql  | t       | t            | 
(4 rows)

 
\dx
           List of relations
 Schema | Name | Type | Owner | Storage 
--------+------+------+-------+---------
(0 rows)

\da
                     List of aggregate functions
 Schema | Name | Result data type | Argument data types | Description 
--------+------+------------------+---------------------+-------------
(0 rows)

\dC
                                         List of casts
         Source type         |         Target type         |      Function      |   Implicit?   
-----------------------------+-----------------------------+--------------------+---------------
 "char"                      | character                   | bpchar             | in assignment
 "char"                      | character varying           | text               | in assignment
 "char"                      | integer                     | int4               | no
 "char"                      | text                        | text               | yes
 abstime                     | date                        | date               | in assignment
 abstime                     | integer                     | (binary coercible) | no
 abstime                     | time without time zone      | time               | in assignment
 abstime                     | timestamp with time zone    | timestamptz        | yes
 abstime                     | timestamp without time zone | timestamp          | yes
 bigint                      | bit                         | bit                | no
 bigint                      | character                   | text               | in assignment
 bigint                      | character varying           | text               | in assignment
 bigint                      | complex                     | int82complex       | yes
 bigint                      | double precision            | float8             | yes
 bigint                      | integer                     | int4               | in assignment
 bigint                      | numeric                     | numeric            | yes
 bigint                      | oid                         | oid                | yes
 bigint                      | real                        | float4             | yes
 bigint                      | regclass                    | oid                | yes
 bigint                      | regoper                     | oid                | yes
 bigint                      | regoperator                 | oid                | yes
 bigint                      | regproc                     | oid                | yes
 bigint                      | regprocedure                | oid                | yes
 bigint                      | regtype                     | oid                | yes
 bigint                      | smallint                    | int2               | in assignment
 bigint                      | text                        | text               | yes
 bit                         | bigint                      | int8               | no
 bit                         | bit                         | bit                | yes
 bit                         | bit varying                 | (binary coercible) | yes
 bit                         | integer                     | int4               | no
 bit varying                 | bit                         | (binary coercible) | yes
 bit varying                 | bit varying                 | varbit             | yes
 boolean                     | character varying           | text               | in assignment
 boolean                     | integer                     | int4               | no
 boolean                     | text                        | text               | yes
 box                         | circle                      | circle             | no
 box                         | lseg                        | lseg               | no
 box                         | point                       | point              | no
 box                         | polygon                     | polygon            | in assignment
 character                   | "char"                      | char               | in assignment
 character                   | bigint                      | int8               | no
 character                   | character                   | bpchar             | yes
 character                   | character varying           | text               | yes
 character                   | date                        | date               | no
 character                   | double precision            | float8             | no
 character                   | integer                     | int4               | no
 character                   | interval                    | interval           | no
 character                   | macaddr                     | macaddr            | no
 character                   | name                        | name               | yes
 character                   | numeric                     | numeric            | no
 character                   | oid                         | oid                | no
 character                   | real                        | float4             | no
 character                   | smallint                    | int2               | no
 character                   | text                        | text               | yes
 character                   | time with time zone         | timetz             | no
 character                   | time without time zone      | time               | no
 character                   | timestamp with time zone    | timestamptz        | no
 character                   | timestamp without time zone | timestamp          | no
 character varying           | "char"                      | char               | in assignment
 character varying           | bigint                      | int8               | no
 character varying           | boolean                     | bool               | no
 character varying           | character                   | (binary coercible) | yes
 character varying           | character varying           | varchar            | yes
 character varying           | cidr                        | cidr               | no
 character varying           | date                        | date               | no
 character varying           | double precision            | float8             | no
 character varying           | inet                        | inet               | no
 character varying           | integer                     | int4               | no
 character varying           | interval                    | interval           | no
 character varying           | macaddr                     | macaddr            | no
 character varying           | name                        | name               | yes
 character varying           | numeric                     | numeric            | no
 character varying           | oid                         | oid                | no
 character varying           | real                        | float4             | no
 character varying           | regclass                    | regclass           | yes
 character varying           | smallint                    | int2               | no
 character varying           | text                        | (binary coercible) | yes
 character varying           | time with time zone         | timetz             | no
 character varying           | time without time zone      | time               | no
 character varying           | timestamp with time zone    | timestamptz        | no
 character varying           | timestamp without time zone | timestamp          | no
 character varying           | uuid                        | text_uuid          | in assignment
 cidr                        | character                   | text               | no
 cidr                        | character varying           | text               | no
 cidr                        | inet                        | (binary coercible) | yes
 cidr                        | text                        | text               | no
 circle                      | box                         | box                | no
 circle                      | point                       | point              | no
 circle                      | polygon                     | polygon            | no
 complex                     | point                       | (binary coercible) | yes
 date                        | character                   | text               | in assignment
 date                        | character varying           | text               | in assignment
 date                        | text                        | text               | yes
 date                        | timestamp with time zone    | timestamptz        | yes
 date                        | timestamp without time zone | timestamp          | yes
 double precision            | bigint                      | int8               | in assignment
 double precision            | character                   | text               | in assignment
 double precision            | character varying           | text               | in assignment
 double precision            | complex                     | float82complex     | yes
 double precision            | integer                     | int4               | in assignment
 double precision            | numeric                     | numeric            | in assignment
 double precision            | real                        | float4             | in assignment
 double precision            | smallint                    | int2               | in assignment
 double precision            | text                        | text               | yes
 gpaotid                     | tid                         | (binary coercible) | no
 inet                        | character                   | text               | no
 inet                        | character varying           | text               | no
 inet                        | cidr                        | cidr               | in assignment
 inet                        | text                        | text               | no
 integer                     | "char"                      | char               | no
 integer                     | abstime                     | (binary coercible) | no
 integer                     | bigint                      | int8               | yes
 integer                     | bit                         | bit                | no
 integer                     | boolean                     | bool               | no
 integer                     | character                   | text               | in assignment
 integer                     | character varying           | text               | in assignment
 integer                     | complex                     | int42complex       | yes
 integer                     | double precision            | float8             | yes
 integer                     | numeric                     | numeric            | yes
 integer                     | oid                         | (binary coercible) | yes
 integer                     | real                        | float4             | yes
 integer                     | regclass                    | (binary coercible) | yes
 integer                     | regoper                     | (binary coercible) | yes
 integer                     | regoperator                 | (binary coercible) | yes
 integer                     | regproc                     | (binary coercible) | yes
 integer                     | regprocedure                | (binary coercible) | yes
 integer                     | regtype                     | (binary coercible) | yes
 integer                     | reltime                     | (binary coercible) | no
 integer                     | smallint                    | int2               | in assignment
 integer                     | text                        | text               | yes
 interval                    | character                   | text               | in assignment
 interval                    | character varying           | text               | in assignment
 interval                    | interval                    | interval           | yes
 interval                    | reltime                     | reltime            | in assignment
 interval                    | text                        | text               | yes
 interval                    | time without time zone      | time               | in assignment
 lseg                        | point                       | point              | no
 macaddr                     | character                   | text               | no
 macaddr                     | character varying           | text               | no
 macaddr                     | text                        | text               | no
 name                        | character                   | bpchar             | in assignment
 name                        | character varying           | varchar            | in assignment
 name                        | text                        | text               | yes
 numeric                     | bigint                      | int8               | in assignment
 numeric                     | character                   | text               | in assignment
 numeric                     | character varying           | text               | in assignment
 numeric                     | complex                     | numeric2point      | yes
 numeric                     | double precision            | float8             | yes
 numeric                     | integer                     | int4               | in assignment
 numeric                     | numeric                     | numeric            | yes
 numeric                     | real                        | float4             | yes
 numeric                     | smallint                    | int2               | in assignment
 numeric                     | text                        | text               | yes
 oid                         | bigint                      | int8               | in assignment
 oid                         | character                   | text               | in assignment
 oid                         | character varying           | text               | in assignment
 oid                         | integer                     | (binary coercible) | in assignment
 oid                         | regclass                    | (binary coercible) | yes
 oid                         | regoper                     | (binary coercible) | yes
 oid                         | regoperator                 | (binary coercible) | yes
 oid                         | regproc                     | (binary coercible) | yes
 oid                         | regprocedure                | (binary coercible) | yes
 oid                         | regtype                     | (binary coercible) | yes
 oid                         | text                        | text               | yes
 path                        | point                       | point              | no
 path                        | polygon                     | polygon            | in assignment
 point                       | complex                     | (binary coercible) | yes
 polygon                     | box                         | box                | no
 polygon                     | circle                      | circle             | no
 polygon                     | path                        | path               | in assignment
 polygon                     | point                       | point              | no
 real                        | bigint                      | int8               | in assignment
 real                        | character                   | text               | in assignment
 real                        | character varying           | text               | in assignment
 real                        | complex                     | float42complex     | yes
 real                        | double precision            | float8             | yes
 real                        | integer                     | int4               | in assignment
 real                        | numeric                     | numeric            | in assignment
 real                        | smallint                    | int2               | in assignment
 real                        | text                        | text               | yes
 regclass                    | bigint                      | int8               | in assignment
 regclass                    | integer                     | (binary coercible) | in assignment
 regclass                    | oid                         | (binary coercible) | yes
 regoper                     | bigint                      | int8               | in assignment
 regoper                     | integer                     | (binary coercible) | in assignment
 regoper                     | oid                         | (binary coercible) | yes
 regoper                     | regoperator                 | (binary coercible) | yes
 regoperator                 | bigint                      | int8               | in assignment
 regoperator                 | integer                     | (binary coercible) | in assignment
 regoperator                 | oid                         | (binary coercible) | yes
 regoperator                 | regoper                     | (binary coercible) | yes
 regproc                     | bigint                      | int8               | in assignment
 regproc                     | integer                     | (binary coercible) | in assignment
 regproc                     | oid                         | (binary coercible) | yes
 regproc                     | regprocedure                | (binary coercible) | yes
 regprocedure                | bigint                      | int8               | in assignment
 regprocedure                | integer                     | (binary coercible) | in assignment
 regprocedure                | oid                         | (binary coercible) | yes
 regprocedure                | regproc                     | (binary coercible) | yes
 regtype                     | bigint                      | int8               | in assignment
 regtype                     | integer                     | (binary coercible) | in assignment
 regtype                     | oid                         | (binary coercible) | yes
 reltime                     | integer                     | (binary coercible) | no
 reltime                     | interval                    | interval           | yes
 smallint                    | bigint                      | int8               | yes
 smallint                    | character                   | text               | in assignment
 smallint                    | character varying           | text               | in assignment
 smallint                    | complex                     | int22complex       | yes
 smallint                    | double precision            | float8             | yes
 smallint                    | integer                     | int4               | yes
 smallint                    | numeric                     | numeric            | yes
 smallint                    | oid                         | int4               | yes
 smallint                    | real                        | float4             | yes
 smallint                    | regclass                    | int4               | yes
 smallint                    | regoper                     | int4               | yes
 smallint                    | regoperator                 | int4               | yes
 smallint                    | regproc                     | int4               | yes
 smallint                    | regprocedure                | int4               | yes
 smallint                    | regtype                     | int4               | yes
 smallint                    | text                        | text               | yes
 text                        | "char"                      | char               | in assignment
 text                        | bigint                      | int8               | no
 text                        | boolean                     | bool               | no
 text                        | character                   | (binary coercible) | yes
 text                        | character varying           | (binary coercible) | yes
 text                        | cidr                        | cidr               | no
 text                        | date                        | date               | no
 text                        | double precision            | float8             | no
 text                        | inet                        | inet               | no
 text                        | integer                     | int4               | no
 text                        | interval                    | interval           | no
 text                        | macaddr                     | macaddr            | no
 text                        | name                        | name               | yes
 text                        | numeric                     | numeric            | no
 text                        | oid                         | oid                | no
 text                        | real                        | float4             | no
 text                        | regclass                    | regclass           | yes
 text                        | smallint                    | int2               | no
 text                        | time with time zone         | timetz             | no
 text                        | time without time zone      | time               | no
 text                        | timestamp with time zone    | timestamptz        | no
 text                        | timestamp without time zone | timestamp          | no
 text                        | uuid                        | text_uuid          | in assignment
 tid                         | bigint                      | int8               | no
 tid                         | gpaotid                     | (binary coercible) | no
 time with time zone         | character                   | text               | in assignment
 time with time zone         | character varying           | text               | in assignment
 time with time zone         | text                        | text               | yes
 time with time zone         | time with time zone         | timetz             | yes
 time with time zone         | time without time zone      | time               | in assignment
 time without time zone      | character                   | text               | in assignment
 time without time zone      | character varying           | text               | in assignment
 time without time zone      | interval                    | interval           | yes
 time without time zone      | text                        | text               | yes
 time without time zone      | time with time zone         | timetz             | yes
 time without time zone      | time without time zone      | time               | yes
 timestamp with time zone    | abstime                     | abstime            | in assignment
 timestamp with time zone    | character                   | text               | in assignment
 timestamp with time zone    | character varying           | text               | in assignment
 timestamp with time zone    | date                        | date               | in assignment
 timestamp with time zone    | text                        | text               | yes
 timestamp with time zone    | time with time zone         | timetz             | in assignment
 timestamp with time zone    | time without time zone      | time               | in assignment
 timestamp with time zone    | timestamp with time zone    | timestamptz        | yes
 timestamp with time zone    | timestamp without time zone | timestamp          | in assignment
 timestamp without time zone | abstime                     | abstime            | in assignment
 timestamp without time zone | character                   | text               | in assignment
 timestamp without time zone | character varying           | text               | in assignment
 timestamp without time zone | date                        | date               | in assignment
 timestamp without time zone | text                        | text               | yes
 timestamp without time zone | time without time zone      | time               | in assignment
 timestamp without time zone | timestamp with time zone    | timestamptz        | yes
 timestamp without time zone | timestamp without time zone | timestamp          | yes
 uuid                        | character varying           | uuid_text          | in assignment
 uuid                        | text                        | uuid_text          | in assignment
(275 rows)

------------------------------------------------------
\dc
               List of conversions
 Schema | Name | Source | Destination | Default? 
--------+------+--------+-------------+----------
(0 rows)

--------Display tablespace
\db
         List of tablespaces
    Name    | Owner  | Filespae Name 
------------+--------+---------------
 pg_default | jaltar | pg_system
 pg_global  | jaltar | pg_system
(2 rows)

---------------List Domain
\dD
             List of domains
 Schema | Name | Type | Modifier | Check 
--------+------+------+----------+-------
(0 rows)

drop table if exists bar_mpp2825;
NOTICE:  table "bar_mpp2825" does not exist, skipping
create table bar_mpp2825 (a int, b int default 5);
NOTICE:  Table doesn't have 'DISTRIBUTED BY' clause -- Using column named 'a' as the Greenplum Database data distribution key for this table.
HINT:  The 'DISTRIBUTED BY' clause determines the distribution of data. Make sure column(s) chosen are the optimal data distribution key to minimize skew.
\d
                List of relations
 Schema |    Name     | Type  | Owner  | Storage 
--------+-------------+-------+--------+---------
 public | bar_mpp2825 | table | jaltar | heap
(1 row)

\d bar_mpp2825
  Table "public.bar_mpp2825"
 Column |  Type   | Modifiers 
--------+---------+-----------
 a      | integer | 
 b      | integer | default 5
Distributed by: (a)

drop table if exists bar_mpp2825;
\! createdb mpp8755 -l en_US.utf8
createdb: invalid option -- l
Try "createdb --help" for more information.
\! createdb mpp8755 -l utf8
createdb: invalid option -- l
Try "createdb --help" for more information.
show track_activities; -- ON
 track_activities 
------------------
 on
(1 row)

show track_counts; -- OFF
 track_counts 
--------------
 off
(1 row)

select datname,application_name,xact_start from pg_stat_activity where application_name='mpp11646';
 datname | application_name | xact_start 
---------+------------------+------------
(0 rows)

\! PGAPPNAME='mpp11646' psql gptest -c 'select pg_sleep(3)' > /dev/null 2>&1 &
\! PGAPPNAME='mpp11646' psql template1 -c 'select pg_sleep(3)' > /dev/null 2>&1 &
select pg_sleep(1);
 pg_sleep 
----------
 
(1 row)

select datname,application_name,xact_start from pg_stat_activity where application_name='mpp11646' order by datname;
  datname  | application_name |             xact_start              
-----------+------------------+-------------------------------------
 gptest    | mpp11646         | Wed Aug 22 14:18:36.111713 2012 PDT
 template1 | mpp11646         | Wed Aug 22 14:18:36.114611 2012 PDT
(2 rows)

\! PGAPPNAME="1234567890123456789012345678901234567890123456789012345678901234567890" psql template1
NOTICE:  identifier "1234567890123456789012345678901234567890123456789012345678901234567890" will be truncated to "123456789012345678901234567890123456789012345678901234567890123"
-- If no guc on, this should fail
\echo '-- Expected failure'
-- Expected failure
update gp_segment_configuration set role='t' where role='p' and content<>-1;
ERROR:  permission denied: "gp_segment_configuration" is a system catalog
\echo '-- System catalog is updated using GUC'
-- System catalog is updated using GUC
update gp_segment_configuration set role='t' where role='p' and content=0;
ERROR:  permission denied: "gp_segment_configuration" is a system catalog
select count(*) from gp_segment_configuration where role='t' limit 1;
 count 
-------
     0
(1 row)

update gp_segment_configuration set role='p' where role='t' and content=0;
ERROR:  permission denied: "gp_segment_configuration" is a system catalog
select * from gp_segment_configuration where role='t';
 dbid | content | role | preferred_role | mode | status | port | hostname | address | replication_port | san_mounts 
------+---------+------+----------------+------+--------+------+----------+---------+------------------+------------
(0 rows)

\echo '-- System catalog is updated per session level'
-- System catalog is updated per session level
show allow_system_table_mods;
 allow_system_table_mods 
-------------------------
 NONE
(1 row)

set allow_system_table_mods=dml;
update gp_segment_configuration set role='t' where role='p' and content=0;
select count(*) from gp_segment_configuration where role='t' limit 1;
 count 
-------
     1
(1 row)

update gp_segment_configuration set role='p' where role='t' and content=0;
select * from gp_segment_configuration where role='t';
 dbid | content | role | preferred_role | mode | status | port | hostname | address | replication_port | san_mounts 
------+---------+------+----------------+------+--------+------+----------+---------+------------------+------------
(0 rows)

\! gpconfig -c allow_system_table_mods -v dml 
Invalid line in .pgpass file.  Line number 6
Invalid line in .pgpass file.  Line number 12
Invalid line in .pgpass file.  Line number 18
Invalid line in .pgpass file.  Line number 19
Invalid line in .pgpass file.  Line number 20
Invalid line in .pgpass file.  Line number 21
Invalid line in .pgpass file.  Line number 22
Invalid line in .pgpass file.  Line number 23
20120822:14:18:37:043252 gpconfig:usenjaltarmbp:jaltar-[CRITICAL]:-not a valid GUC: allow_system_table_mods
\echo 'Default value'
Default value
show allow_system_table_mods;
 allow_system_table_mods 
-------------------------
 DML
(1 row)

\echo 'Allowed value'
Allowed value
set allow_system_table_mods=dml;
show allow_system_table_mods;
 allow_system_table_mods 
-------------------------
 DML
(1 row)

set allow_system_table_mods=DML;
show allow_system_table_mods;
 allow_system_table_mods 
-------------------------
 DML
(1 row)

set allow_system_table_mods=none;
show allow_system_table_mods;
 allow_system_table_mods 
-------------------------
 NONE
(1 row)

\echo 'Incorrect value, expected to fail'
Incorrect value, expected to fail
set allow_system_table_mods=dml2;
ERROR:  Unknown system table modification policy. (Current policy: 'NONE') (guc.c:11889)
set allow_system_table_mods=123;
ERROR:  Unknown system table modification policy. (Current policy: 'NONE') (guc.c:11889)
set allow_system_table_mods=abc;
ERROR:  Unknown system table modification policy. (Current policy: 'NONE') (guc.c:11889)
set allow_system_table_mods=true;
ERROR:  Unknown system table modification policy. (Current policy: 'NONE') (guc.c:11889)
set allow_system_table_mods=false;
ERROR:  Unknown system table modification policy. (Current policy: 'NONE') (guc.c:11889)
\echo 'Cannot Set in session, expected to fail'
Cannot Set in session, expected to fail
set allow_system_table_mods="ddl";
ERROR:  Unknown system table modification policy. (Current policy: 'NONE') (guc.c:11889)
set allow_system_table_mods="DDL";
ERROR:  Unknown system table modification policy. (Current policy: 'NONE') (guc.c:11889)
set allow_system_table_mods="all";
ERROR:  Unknown system table modification policy. (Current policy: 'NONE') (guc.c:11889)
set allow_system_table_mods="ALL";
ERROR:  Unknown system table modification policy. (Current policy: 'NONE') (guc.c:11889)
\echo -- end_ignore
-- end_ignore
