create schema alter_ao_table_oid_row;
set search_path="$user",alter_ao_table_oid_row,public;
SET gp_default_storage_options='orientation=row';
-- Alter UAO tables with OIDs and execute DML statements on the tables
create table sto_alt_uao2_oid (i int, j char(10)) with
(appendonly=true, oids=true) DISTRIBUTED RANDOMLY;
NOTICE:  OIDS=TRUE is not recommended for user-created tables
HINT:  Use OIDS=FALSE to prevent wrap-around of the OID counter.
\d+ sto_alt_uao2_oid
        Append-Only Table "alter_ao_table_oid_row.sto_alt_uao2_oid"
 Column |     Type      | Modifiers | Storage  | Stats target | Description 
--------+---------------+-----------+----------+--------------+-------------
 i      | integer       |           | plain    |              | 
 j      | character(10) |           | extended |              | 
Compression Type: None
Compression Level: 0
Block Size: 32768
Checksum: t
Has OIDs: yes
Distributed randomly
Options: appendonly=true

insert into sto_alt_uao2_oid select i , 'aa' from generate_series(1,5) as i;
select count(oid) = 5 as passed from sto_alt_uao2_oid;
 passed 
--------
 t
(1 row)

select * from sto_alt_uao2_oid;
 i |     j      
---+------------
 2 | aa        
 3 | aa        
 5 | aa        
 1 | aa        
 4 | aa        
(5 rows)

delete from sto_alt_uao2_oid where i = 3;
insert into sto_alt_uao2_oid values (6, 'new tuple');
select * from sto_alt_uao2_oid;
 i |     j      
---+------------
 1 | aa        
 4 | aa        
 2 | aa        
 5 | aa        
 6 | new tuple 
(5 rows)

set gp_select_invisible=true;
select count(*) from sto_alt_uao2_oid;
 count 
-------
     6
(1 row)

set gp_select_invisible=false;
--Alter table SET without OIDs
Alter table sto_alt_uao2_oid SET without oids;
SELECT 1 AS VisimapPresent FROM pg_appendonly WHERE visimaprelid is
 not NULL AND visimapidxid is not NULL AND relid='sto_alt_uao2_oid'::regclass;
 visimappresent 
----------------
              1
(1 row)

\d+ sto_alt_uao2_oid
        Append-Only Table "alter_ao_table_oid_row.sto_alt_uao2_oid"
 Column |     Type      | Modifiers | Storage  | Stats target | Description 
--------+---------------+-----------+----------+--------------+-------------
 i      | integer       |           | plain    |              | 
 j      | character(10) |           | extended |              | 
Compression Type: None
Compression Level: 0
Block Size: 32768
Checksum: t
Distributed randomly
Options: appendonly=true

select * from sto_alt_uao2_oid order by 1;
 i |     j      
---+------------
 1 | aa        
 2 | aa        
 4 | aa        
 5 | aa        
 6 | new tuple 
(5 rows)

update sto_alt_uao2_oid set j= 'new val' where i=4;
select * from sto_alt_uao2_oid order by 1;
 i |     j      
---+------------
 1 | aa        
 2 | aa        
 4 | new val   
 5 | aa        
 6 | new tuple 
(5 rows)

set gp_select_invisible = true;
select count(*)  AS invisi_and_visi_tups from sto_alt_uao2_oid;
 invisi_and_visi_tups 
----------------------
                    6
(1 row)

set gp_select_invisible = false;
