-- @product_version gpdb: [4.3.0.0-4.3.99.99]
begin;
BEGIN
CREATE INDEX abort_create_needed_cr_uao_bitmap_idx ON abort_create_needed_cr_uao_table_bitmap_index USING bitmap (numeric_col);
CREATE INDEX
insert into abort_create_needed_cr_uao_table_bitmap_index values ('0_zero', 0, '0_zero', 0, 0, 0, '{0}', 0, 0, 0, '2004-10-19 10:23:54', '2004-10-19 10:23:54+02', '1-1-2000');
INSERT 0 1
insert into abort_create_needed_cr_uao_table_bitmap_index values ('1_zero', 1, '1_zero', 1, 1, 1, '{1}', 1, 1, 1, '2005-10-19 10:23:54', '2005-10-19 10:23:54+02', '1-1-2001');
INSERT 0 1
insert into abort_create_needed_cr_uao_table_bitmap_index values ('2_zero', 2, '2_zero', 2, 2, 2, '{2}', 2, 2, 2, '2006-10-19 10:23:54', '2006-10-19 10:23:54+02', '1-1-2002');
INSERT 0 1
insert into abort_create_needed_cr_uao_table_bitmap_index select i||'_'||repeat('text',100),i,i||'_'||repeat('text',3),i,i,i,'{3}',i,i,i,'2006-10-19 10:23:54', '2006-10-19 10:23:54+02', '1-1-2002' from generate_series(3,100)i;
INSERT 0 98
commit;
COMMIT
select count(*) AS only_visi_tups_ins  from abort_create_needed_cr_uao_table_bitmap_index;
 only_visi_tups_ins 
--------------------
                202
(1 row)

set gp_select_invisible = true;
SET
select count(*) AS invisi_and_visi_tups_ins  from abort_create_needed_cr_uao_table_bitmap_index;
 invisi_and_visi_tups_ins 
--------------------------
                      202
(1 row)

set gp_select_invisible = false;
SET
update abort_create_needed_cr_uao_table_bitmap_index set char_vary_col = char_vary_col || '_new' where bigint_col = 100;
UPDATE 2
select count(*) AS only_visi_tups_upd  from abort_create_needed_cr_uao_table_bitmap_index;
 only_visi_tups_upd 
--------------------
                202
(1 row)

set gp_select_invisible = true;
SET
select count(*) AS invisi_and_visi_tups  from abort_create_needed_cr_uao_table_bitmap_index;
 invisi_and_visi_tups 
----------------------
                  204
(1 row)

set gp_select_invisible = false;
SET
delete from abort_create_needed_cr_uao_table_bitmap_index  where bigint_col >=  50;
DELETE 102
select count(*) AS only_visi_tups  from abort_create_needed_cr_uao_table_bitmap_index;
 only_visi_tups 
----------------
            100
(1 row)

set gp_select_invisible = true;
SET
select count(*) AS invisi_and_visi_tups  from abort_create_needed_cr_uao_table_bitmap_index;
 invisi_and_visi_tups 
----------------------
                  204
(1 row)

set gp_select_invisible = false;
SET
vacuum abort_create_needed_cr_uao_table_bitmap_index;
VACUUM
select count(*) AS only_visi_tups_vacuum  from abort_create_needed_cr_uao_table_bitmap_index;
 only_visi_tups_vacuum 
-----------------------
                   100
(1 row)

set gp_select_invisible = true;
SET
select count(*) AS invisi_and_visi_tups_vacuum  from abort_create_needed_cr_uao_table_bitmap_index;
 invisi_and_visi_tups_vacuum 
-----------------------------
                         100
(1 row)

set gp_select_invisible = false;
SET
drop index abort_create_needed_cr_uao_bitmap_idx;
DROP INDEX
drop table abort_create_needed_cr_uao_table_bitmap_index;
DROP TABLE
