-- @Description UAOCS MVCC readcommit and 2 updates on same row
--  Transaction 2 of 2
-- 
select pg_sleep(2);
 pg_sleep 
----------
 
(1 row)

insert into sto_uaocs_mvcc_status (workload, script) values('readcommit_concurrentupdate_delete_rollback', 't2_update_delete_rollback_one_tuple');
INSERT 0 1
begin;
BEGIN
set transaction isolation level READ COMMITTED;
SET
update sto_uaocs_dept_formvcc set dname = dname || '_dept';
UPDATE 5
select * from sto_uaocs_dept_formvcc order by dname;
 deptno |      dname      |   loc    
--------+-----------------+----------
      1 | ACCOUNTING_dept | ST LOUIS
      5 | LOGISTICS_dept  | BOSTON
      4 | OPERATIONS_dept | SEATTLE
      2 | RESEARCH_dept   | NEW YORK
      3 | SALES_dept      | ATLANTA
(5 rows)

commit;
COMMIT
update sto_uaocs_mvcc_status set endtime = CURRENT_TIMESTAMP 
where workload='readcommit_concurrentupdate_delete_rollback' 
AND script='t2_update_delete_rollback_one_tuple';
UPDATE 1
select * from sto_uaocs_dept_formvcc order by dname;
 deptno |      dname      |   loc    
--------+-----------------+----------
      1 | ACCOUNTING_dept | ST LOUIS
      5 | LOGISTICS_dept  | BOSTON
      4 | OPERATIONS_dept | SEATTLE
      2 | RESEARCH_dept   | NEW YORK
      3 | SALES_dept      | ATLANTA
(5 rows)

