-- start_ignore
-- end_ignore
-- @Description Terminating a Runaway Query in a subtransaction with cursor, aborting transaction cleanly 
-- @author George Caragea
-- @vlimMB 1000 
-- @slimMB 0
-- @redzone 80
-- one level deep subtransaction
BEGIN;
BEGIN
insert into rqt_it_iq values (1001, 1); 
INSERT 0 1
DECLARE cursor_rqt_hold CURSOR WITH HOLD FOR
select * from rqt_it_iq
where c1 > 1000
ORDER BY c1, c2;
DECLARE CURSOR
DECLARE cursor_rqt_share CURSOR FOR SELECT * FROM rqt_it_iq WHERE c1 > 3 FOR SHARE;
DECLARE CURSOR
-- start_ignore
FETCH 1 FROM cursor_rqt_share;
 c1 | c2 
----+----
  5 |  6
(1 row)

-- end_ignore
UPDATE rqt_it_iq SET c2 = -9 WHERE CURRENT OF cursor_rqt_share;
UPDATE 1
SAVEPOINT sp_1;
SAVEPOINT
insert into rqt_it_iq values (1002, 1); 
INSERT 0 1
-- start_ignore
FETCH 1 FROM cursor_rqt_share;
 c1 | c2 
----+----
  7 |  8
(1 row)

-- end_ignore
UPDATE rqt_it_iq SET c2 = -10 WHERE CURRENT OF cursor_rqt_share;
UPDATE 1
FETCH FROM cursor_rqt_hold; 
  c1  | c2 
------+----
 1001 |  1
(1 row)

-- will hit red zone and get terminated
-- content/segment = 0; size = 850MB; sleep = 5 sec; crit_section = false
select gp_allocate_palloc_test_all_segs(0, 850*1024*1024, 5, false);
psql:/Users/gcaragea/dev/tincrepo/private/gcaragea/resource_management/runaway_query/runaway_query_limits/output/rqt_in_subtransaction_cursor.sql:41: ERROR:  Canceling query because of high VMEM usage. Used: 851MB, available 149MB, red zone: 800MB (runaway_cleaner.c:98)  (seg0 slice1 gcaragea-mbp.local:40090 pid=30439) (cdbdisp.c:1526)
CONTEXT:  SQL function "gp_allocate_palloc_test_all_segs" statement 1
insert into rqt_it_iq values (1003, 1); 
psql:/Users/gcaragea/dev/tincrepo/private/gcaragea/resource_management/runaway_query/runaway_query_limits/output/rqt_in_subtransaction_cursor.sql:43: ERROR:  current transaction is aborted, commands ignored until end of transaction block
RELEASE SAVEPOINT sp_1;
psql:/Users/gcaragea/dev/tincrepo/private/gcaragea/resource_management/runaway_query/runaway_query_limits/output/rqt_in_subtransaction_cursor.sql:45: ERROR:  current transaction is aborted, commands ignored until end of transaction block
insert into rqt_it_iq values (1004, 1); 
psql:/Users/gcaragea/dev/tincrepo/private/gcaragea/resource_management/runaway_query/runaway_query_limits/output/rqt_in_subtransaction_cursor.sql:47: ERROR:  current transaction is aborted, commands ignored until end of transaction block
COMMIT;
ROLLBACK
select * from rqt_it_iq where c1 > 1000 or c2 < 0 order by c1, c2; 
 c1 | c2 
----+----
(0 rows)

-- two level deep nested subtransaction
BEGIN;
BEGIN
insert into rqt_it_iq values (2001, 1); 
INSERT 0 1
DECLARE cursor_rqt_hold CURSOR WITH HOLD FOR
select * from rqt_it_iq
where c1 > 1000
ORDER BY c1, c2;
DECLARE CURSOR
DECLARE cursor_rqt_share CURSOR FOR SELECT * FROM rqt_it_iq WHERE c1 > 3 FOR SHARE;
DECLARE CURSOR
-- start_ignore
FETCH 1 FROM cursor_rqt_share;
 c1 | c2 
----+----
  4 |  5
(1 row)

-- end_ignore
UPDATE rqt_it_iq SET c2 = -9 WHERE CURRENT OF cursor_rqt_share;
UPDATE 1
SAVEPOINT sp_1;
SAVEPOINT
insert into rqt_it_iq values (2002, 1); 
INSERT 0 1
SAVEPOINT sp_2;
SAVEPOINT
insert into rqt_it_iq values (2003, 1); 
INSERT 0 1
-- start_ignore
FETCH 1 FROM cursor_rqt_share;
 c1 | c2 
----+----
  6 |  7
(1 row)

-- end_ignore
UPDATE rqt_it_iq SET c2 = -10 WHERE CURRENT OF cursor_rqt_share;
UPDATE 1
FETCH FROM cursor_rqt_hold; 
  c1  | c2 
------+----
 2001 |  1
(1 row)

-- will hit red zone and get terminated
-- content/segment = 0; size = 850MB; sleep = 5 sec; crit_section = false
select gp_allocate_palloc_test_all_segs(0, 850*1024*1024, 5, false);
psql:/Users/gcaragea/dev/tincrepo/private/gcaragea/resource_management/runaway_query/runaway_query_limits/output/rqt_in_subtransaction_cursor.sql:87: ERROR:  Canceling query because of high VMEM usage. Used: 851MB, available 149MB, red zone: 800MB (runaway_cleaner.c:98)  (seg0 slice1 gcaragea-mbp.local:40090 pid=30439) (cdbdisp.c:1526)
CONTEXT:  SQL function "gp_allocate_palloc_test_all_segs" statement 1
insert into rqt_it_iq values (2004, 1); 
psql:/Users/gcaragea/dev/tincrepo/private/gcaragea/resource_management/runaway_query/runaway_query_limits/output/rqt_in_subtransaction_cursor.sql:89: ERROR:  current transaction is aborted, commands ignored until end of transaction block
RELEASE SAVEPOINT sp_2;
psql:/Users/gcaragea/dev/tincrepo/private/gcaragea/resource_management/runaway_query/runaway_query_limits/output/rqt_in_subtransaction_cursor.sql:91: ERROR:  current transaction is aborted, commands ignored until end of transaction block
insert into rqt_it_iq values (2005, 1); 
psql:/Users/gcaragea/dev/tincrepo/private/gcaragea/resource_management/runaway_query/runaway_query_limits/output/rqt_in_subtransaction_cursor.sql:93: ERROR:  current transaction is aborted, commands ignored until end of transaction block
RELEASE SAVEPOINT sp_1; 
psql:/Users/gcaragea/dev/tincrepo/private/gcaragea/resource_management/runaway_query/runaway_query_limits/output/rqt_in_subtransaction_cursor.sql:95: ERROR:  current transaction is aborted, commands ignored until end of transaction block
insert into rqt_it_iq values (2006, 1); 
psql:/Users/gcaragea/dev/tincrepo/private/gcaragea/resource_management/runaway_query/runaway_query_limits/output/rqt_in_subtransaction_cursor.sql:97: ERROR:  current transaction is aborted, commands ignored until end of transaction block
COMMIT;
ROLLBACK
select * from rqt_it_iq where c1 > 2000 or c2 < 0 order by c1, c2; 
 c1 | c2 
----+----
(0 rows)

