-- start_ignore
-- end_ignore
--
-- @product_version gpdb: 4.3.4.1
--
-- MPP-18673: Split partition should not result in relcache reference
-- corruption.
SET gp_test_system_cache_flush_force = plain;
SET
DROP TABLE IF EXISTS splitpart;
psql:/path/sql_file:1: NOTICE:  table "splitpart" does not exist, skipping
DROP TABLE
CREATE TABLE splitpart (id int, date date, amt decimal(10,2))
    WITH (appendonly=true)
    DISTRIBUTED BY (id)
    PARTITION BY RANGE (date) (
        PARTITION sales_Jul13 START (date '2013-07-01') INCLUSIVE,
        PARTITION sales_Aug13 START (date '2013-08-01') INCLUSIVE,
        PARTITION sales_Sep13 START (date '2013-09-01') INCLUSIVE
        END (date '2014-01-01') EXCLUSIVE);
psql:/path/sql_file:1: NOTICE:  CREATE TABLE will create partition "splitpart_1_prt_sales_jul13" for table "splitpart"
psql:/path/sql_file:1: NOTICE:  CREATE TABLE will create partition "splitpart_1_prt_sales_aug13" for table "splitpart"
psql:/path/sql_file:1: NOTICE:  CREATE TABLE will create partition "splitpart_1_prt_sales_sep13" for table "splitpart"
CREATE TABLE
\d+ splitpart
            Append-Only Table "public.splitpart"
 Column |     Type      | Modifiers | Storage | Description 
--------+---------------+-----------+---------+-------------
 id     | integer       |           | plain   | 
 date   | date          |           | plain   | 
 amt    | numeric(10,2) |           | main    | 
Compression Type: None
Compression Level: 0
Block Size: 32768
Checksum: t
Child tables: splitpart_1_prt_sales_aug13,
              splitpart_1_prt_sales_jul13,
              splitpart_1_prt_sales_sep13
Has OIDs: no
Options: appendonly=true
Distributed by: (id)

INSERT INTO splitpart VALUES(1,'2013-07-05',19.20);
INSERT 0 1
INSERT INTO splitpart VALUES(2,'2013-08-15',10.20);
INSERT 0 1
INSERT INTO splitpart VALUES(3,'2013-09-09',14.20);
INSERT 0 1
SELECT count(*) FROM splitpart;
 count 
-------
     3
(1 row)

-- Add default partition
ALTER TABLE splitpart ADD DEFAULT PARTITION part_others
    WITH (appendonly=true);
psql:/path/sql_file:1: NOTICE:  CREATE TABLE will create partition "splitpart_1_prt_part_others" for table "splitpart"
ALTER TABLE
\d+ splitpart
            Append-Only Table "public.splitpart"
 Column |     Type      | Modifiers | Storage | Description 
--------+---------------+-----------+---------+-------------
 id     | integer       |           | plain   | 
 date   | date          |           | plain   | 
 amt    | numeric(10,2) |           | main    | 
Compression Type: None
Compression Level: 0
Block Size: 32768
Checksum: t
Child tables: splitpart_1_prt_part_others,
              splitpart_1_prt_sales_aug13,
              splitpart_1_prt_sales_jul13,
              splitpart_1_prt_sales_sep13
Has OIDs: no
Options: appendonly=true
Distributed by: (id)

INSERT INTO splitpart VALUES(10,'2013-04-22',12.52);
INSERT 0 1
INSERT INTO splitpart VALUES(11,'2013-02-22',13.53);
INSERT 0 1
INSERT INTO splitpart VALUES(12,'2013-01-22',14.54);
INSERT 0 1
SELECT * FROM splitpart ORDER BY date;
 id |    date    |  amt  
----+------------+-------
 12 | 2013-01-22 | 14.54
 11 | 2013-02-22 | 13.53
 10 | 2013-04-22 | 12.52
  1 | 2013-07-05 | 19.20
  2 | 2013-08-15 | 10.20
  3 | 2013-09-09 | 14.20
(6 rows)

-- Split default partition
ALTER TABLE splitpart SPLIT DEFAULT PARTITION
    START(date '2013-01-01') END(date '2013-03-01')
    INTO (PARTITION p1, PARTITION part_others);
psql:/path/sql_file:1: NOTICE:  exchanged partition "part_others" of relation "splitpart" with relation "pg_temp_2556688"
psql:/path/sql_file:1: NOTICE:  dropped partition "part_others" for relation "splitpart"
psql:/path/sql_file:1: NOTICE:  CREATE TABLE will create partition "splitpart_1_prt_p1" for table "splitpart"
psql:/path/sql_file:1: NOTICE:  CREATE TABLE will create partition "splitpart_1_prt_part_others" for table "splitpart"
ALTER TABLE
\d+ splitpart
            Append-Only Table "public.splitpart"
 Column |     Type      | Modifiers | Storage | Description 
--------+---------------+-----------+---------+-------------
 id     | integer       |           | plain   | 
 date   | date          |           | plain   | 
 amt    | numeric(10,2) |           | main    | 
Compression Type: None
Compression Level: 0
Block Size: 32768
Checksum: t
Child tables: splitpart_1_prt_p1,
              splitpart_1_prt_part_others,
              splitpart_1_prt_sales_aug13,
              splitpart_1_prt_sales_jul13,
              splitpart_1_prt_sales_sep13
Has OIDs: no
Options: appendonly=true
Distributed by: (id)

SELECT * FROM splitpart ORDER BY date;
 id |    date    |  amt  
----+------------+-------
 12 | 2013-01-22 | 14.54
 11 | 2013-02-22 | 13.53
 10 | 2013-04-22 | 12.52
  1 | 2013-07-05 | 19.20
  2 | 2013-08-15 | 10.20
  3 | 2013-09-09 | 14.20
(6 rows)

-- Try basic operations on newly created paritions
UPDATE splitpart SET amt=20.5 WHERE date='2013-02-22';
UPDATE 1
SELECT * FROM splitpart ORDER BY date;
 id |    date    |  amt  
----+------------+-------
 12 | 2013-01-22 | 14.54
 11 | 2013-02-22 | 20.50
 10 | 2013-04-22 | 12.52
  1 | 2013-07-05 | 19.20
  2 | 2013-08-15 | 10.20
  3 | 2013-09-09 | 14.20
(6 rows)

DELETE FROM splitpart WHERE date='2013-01-22';
DELETE 1
SELECT * FROM splitpart ORDER BY date;
 id |    date    |  amt  
----+------------+-------
 11 | 2013-02-22 | 20.50
 10 | 2013-04-22 | 12.52
  1 | 2013-07-05 | 19.20
  2 | 2013-08-15 | 10.20
  3 | 2013-09-09 | 14.20
(5 rows)

