--start_ignore
drop table if exists subt_mpp16886_t2;
DROP TABLE
--end_ignore
Create table subt_mpp16886_t2(b1 int,b2 text) distributed randomly;
CREATE TABLE
Insert into subt_mpp16886_t2 values(generate_series(1,150),'OLD VALUE');
INSERT 0 150
begin;
BEGIN
Savepoint sp1;
SAVEPOINT
Update subt_mpp16886_t2 set b2 ='NEW VALUE' where b1 =1;
UPDATE 1
Select count(*) from subt_mpp16886_t2;
 count 
-------
   150
(1 row)

Release Savepoint sp1;
RELEASE
Savepoint Sp2;
SAVEPOINT
Delete from subt_mpp16886_t2 where b1 > 0;
DELETE 150
Rollback to sp2;
ROLLBACK
Savepoint sp3;
SAVEPOINT
Update subt_mpp16886_t2 set b2 ='NEW VALUE' where b1 =3;
UPDATE 1
Select count(*) from subt_mpp16886_t2;
 count 
-------
   150
(1 row)

Release Savepoint sp3;
RELEASE
Savepoint Sp4;
SAVEPOINT
Delete from subt_mpp16886_t2 where b1 > 0;
DELETE 150
Rollback to sp4;
ROLLBACK
Savepoint sp5;
SAVEPOINT
Update subt_mpp16886_t2 set b2 ='NEW VALUE' where b1 =5;
UPDATE 1
Select count(*) from subt_mpp16886_t2;
 count 
-------
   150
(1 row)

Release Savepoint sp5;
RELEASE
Savepoint Sp6;
SAVEPOINT
Delete from subt_mpp16886_t2 where b1 > 0;
DELETE 150
Rollback to sp6;
ROLLBACK
Savepoint sp7;
SAVEPOINT
Update subt_mpp16886_t2 set b2 ='NEW VALUE' where b1 =7;
UPDATE 1
Select count(*) from subt_mpp16886_t2;
 count 
-------
   150
(1 row)

Release Savepoint sp7;
RELEASE
Savepoint Sp8;
SAVEPOINT
Delete from subt_mpp16886_t2 where b1 > 0;
DELETE 150
Rollback to sp8;
ROLLBACK
Savepoint sp9;
SAVEPOINT
Update subt_mpp16886_t2 set b2 ='NEW VALUE' where b1 =9;
UPDATE 1
Select count(*) from subt_mpp16886_t2;
 count 
-------
   150
(1 row)

Release Savepoint sp9;
RELEASE
Savepoint Sp10;
SAVEPOINT
Delete from subt_mpp16886_t2 where b1 > 0;
DELETE 150
Rollback to sp10;
ROLLBACK
Savepoint sp11;
SAVEPOINT
Update subt_mpp16886_t2 set b2 ='NEW VALUE' where b1 =11;
UPDATE 1
Select count(*) from subt_mpp16886_t2;
 count 
-------
   150
(1 row)

Release Savepoint sp11;
RELEASE
Savepoint Sp12;
SAVEPOINT
Delete from subt_mpp16886_t2 where b1 > 0;
DELETE 150
Rollback to sp12;
ROLLBACK
Savepoint sp13;
SAVEPOINT
Update subt_mpp16886_t2 set b2 ='NEW VALUE' where b1 =13;
UPDATE 1
Select count(*) from subt_mpp16886_t2;
 count 
-------
   150
(1 row)

Release Savepoint sp13;
RELEASE
Savepoint Sp14;
SAVEPOINT
Delete from subt_mpp16886_t2 where b1 > 0;
DELETE 150
Rollback to sp14;
ROLLBACK
Savepoint sp15;
SAVEPOINT
Update subt_mpp16886_t2 set b2 ='NEW VALUE' where b1 =15;
UPDATE 1
Select count(*) from subt_mpp16886_t2;
 count 
-------
   150
(1 row)

Release Savepoint sp15;
RELEASE
Savepoint Sp16;
SAVEPOINT
Delete from subt_mpp16886_t2 where b1 > 0;
DELETE 150
Rollback to sp16;
ROLLBACK
Savepoint sp17;
SAVEPOINT
Update subt_mpp16886_t2 set b2 ='NEW VALUE' where b1 =17;
UPDATE 1
Select count(*) from subt_mpp16886_t2;
 count 
-------
   150
(1 row)

Release Savepoint sp17;
RELEASE
Savepoint Sp18;
SAVEPOINT
Delete from subt_mpp16886_t2 where b1 > 0;
DELETE 150
Rollback to sp18;
ROLLBACK
Savepoint sp19;
SAVEPOINT
Update subt_mpp16886_t2 set b2 ='NEW VALUE' where b1 =19;
UPDATE 1
Select count(*) from subt_mpp16886_t2;
 count 
-------
   150
(1 row)

Release Savepoint sp19;
RELEASE
Savepoint Sp20;
SAVEPOINT
Delete from subt_mpp16886_t2 where b1 > 0;
DELETE 150
Rollback to sp20;
ROLLBACK
Savepoint sp21;
SAVEPOINT
Update subt_mpp16886_t2 set b2 ='NEW VALUE' where b1 =21;
UPDATE 1
Select count(*) from subt_mpp16886_t2;
 count 
-------
   150
(1 row)

Release Savepoint sp21;
RELEASE
Savepoint Sp22;
SAVEPOINT
Delete from subt_mpp16886_t2 where b1 > 0;
DELETE 150
Rollback to sp22;
ROLLBACK
Savepoint sp23;
SAVEPOINT
Update subt_mpp16886_t2 set b2 ='NEW VALUE' where b1 =23;
UPDATE 1
Select count(*) from subt_mpp16886_t2;
 count 
-------
   150
(1 row)

Release Savepoint sp23;
RELEASE
Savepoint Sp24;
SAVEPOINT
Delete from subt_mpp16886_t2 where b1 > 0;
DELETE 150
Rollback to sp24;
ROLLBACK
Savepoint sp25;
SAVEPOINT
Update subt_mpp16886_t2 set b2 ='NEW VALUE' where b1 =25;
UPDATE 1
Select count(*) from subt_mpp16886_t2;
 count 
-------
   150
(1 row)

Release Savepoint sp25;
RELEASE
Savepoint Sp26;
SAVEPOINT
Delete from subt_mpp16886_t2 where b1 > 0;
DELETE 150
Rollback to sp26;
ROLLBACK
Savepoint sp27;
SAVEPOINT
Update subt_mpp16886_t2 set b2 ='NEW VALUE' where b1 =27;
UPDATE 1
Select count(*) from subt_mpp16886_t2;
 count 
-------
   150
(1 row)

Release Savepoint sp27;
RELEASE
Savepoint Sp28;
SAVEPOINT
Delete from subt_mpp16886_t2 where b1 > 0;
DELETE 150
Rollback to sp28;
ROLLBACK
Savepoint sp29;
SAVEPOINT
Update subt_mpp16886_t2 set b2 ='NEW VALUE' where b1 =29;
UPDATE 1
Select count(*) from subt_mpp16886_t2;
 count 
-------
   150
(1 row)

Release Savepoint sp29;
RELEASE
Savepoint Sp30;
SAVEPOINT
Delete from subt_mpp16886_t2 where b1 > 0;
DELETE 150
Rollback to sp30;
ROLLBACK
Savepoint sp31;
SAVEPOINT
Update subt_mpp16886_t2 set b2 ='NEW VALUE' where b1 =31;
UPDATE 1
Select count(*) from subt_mpp16886_t2;
 count 
-------
   150
(1 row)

Release Savepoint sp31;
RELEASE
Savepoint Sp32;
SAVEPOINT
Delete from subt_mpp16886_t2 where b1 > 0;
DELETE 150
Rollback to sp32;
ROLLBACK
Savepoint sp33;
SAVEPOINT
Update subt_mpp16886_t2 set b2 ='NEW VALUE' where b1 =33;
UPDATE 1
Select count(*) from subt_mpp16886_t2;
 count 
-------
   150
(1 row)

Release Savepoint sp33;
RELEASE
Savepoint Sp34;
SAVEPOINT
Delete from subt_mpp16886_t2 where b1 > 0;
DELETE 150
Rollback to sp34;
ROLLBACK
Savepoint sp35;
SAVEPOINT
Update subt_mpp16886_t2 set b2 ='NEW VALUE' where b1 =35;
UPDATE 1
Select count(*) from subt_mpp16886_t2;
 count 
-------
   150
(1 row)

Release Savepoint sp35;
RELEASE
Savepoint Sp36;
SAVEPOINT
Delete from subt_mpp16886_t2 where b1 > 0;
DELETE 150
Rollback to sp36;
ROLLBACK
Savepoint sp37;
SAVEPOINT
Update subt_mpp16886_t2 set b2 ='NEW VALUE' where b1 =37;
UPDATE 1
Select count(*) from subt_mpp16886_t2;
 count 
-------
   150
(1 row)

Release Savepoint sp37;
RELEASE
Savepoint Sp38;
SAVEPOINT
Delete from subt_mpp16886_t2 where b1 > 0;
DELETE 150
Rollback to sp38;
ROLLBACK
Savepoint sp39;
SAVEPOINT
Update subt_mpp16886_t2 set b2 ='NEW VALUE' where b1 =39;
UPDATE 1
Select count(*) from subt_mpp16886_t2;
 count 
-------
   150
(1 row)

Release Savepoint sp39;
RELEASE
Savepoint Sp40;
SAVEPOINT
Delete from subt_mpp16886_t2 where b1 > 0;
DELETE 150
Rollback to sp40;
ROLLBACK
Savepoint sp41;
SAVEPOINT
Update subt_mpp16886_t2 set b2 ='NEW VALUE' where b1 =41;
UPDATE 1
Select count(*) from subt_mpp16886_t2;
 count 
-------
   150
(1 row)

Release Savepoint sp41;
RELEASE
Savepoint Sp42;
SAVEPOINT
Delete from subt_mpp16886_t2 where b1 > 0;
DELETE 150
Rollback to sp42;
ROLLBACK
Savepoint sp43;
SAVEPOINT
Update subt_mpp16886_t2 set b2 ='NEW VALUE' where b1 =43;
UPDATE 1
Select count(*) from subt_mpp16886_t2;
 count 
-------
   150
(1 row)

Release Savepoint sp43;
RELEASE
Savepoint Sp44;
SAVEPOINT
Delete from subt_mpp16886_t2 where b1 > 0;
DELETE 150
Rollback to sp44;
ROLLBACK
Savepoint sp45;
SAVEPOINT
Update subt_mpp16886_t2 set b2 ='NEW VALUE' where b1 =45;
UPDATE 1
Select count(*) from subt_mpp16886_t2;
 count 
-------
   150
(1 row)

Release Savepoint sp45;
RELEASE
Savepoint Sp46;
SAVEPOINT
Delete from subt_mpp16886_t2 where b1 > 0;
DELETE 150
Rollback to sp46;
ROLLBACK
Savepoint sp47;
SAVEPOINT
Update subt_mpp16886_t2 set b2 ='NEW VALUE' where b1 =47;
UPDATE 1
Select count(*) from subt_mpp16886_t2;
 count 
-------
   150
(1 row)

Release Savepoint sp47;
RELEASE
Savepoint Sp48;
SAVEPOINT
Delete from subt_mpp16886_t2 where b1 > 0;
DELETE 150
Rollback to sp48;
ROLLBACK
Savepoint sp49;
SAVEPOINT
Update subt_mpp16886_t2 set b2 ='NEW VALUE' where b1 =49;
UPDATE 1
Select count(*) from subt_mpp16886_t2;
 count 
-------
   150
(1 row)

Release Savepoint sp49;
RELEASE
Savepoint Sp50;
SAVEPOINT
Delete from subt_mpp16886_t2 where b1 > 0;
DELETE 150
Rollback to sp50;
ROLLBACK
Savepoint sp51;
SAVEPOINT
Update subt_mpp16886_t2 set b2 ='NEW VALUE' where b1 =51;
UPDATE 1
Select count(*) from subt_mpp16886_t2;
 count 
-------
   150
(1 row)

Release Savepoint sp51;
RELEASE
Savepoint Sp52;
SAVEPOINT
Delete from subt_mpp16886_t2 where b1 > 0;
DELETE 150
Rollback to sp52;
ROLLBACK
Savepoint sp53;
SAVEPOINT
Update subt_mpp16886_t2 set b2 ='NEW VALUE' where b1 =53;
UPDATE 1
Select count(*) from subt_mpp16886_t2;
 count 
-------
   150
(1 row)

Release Savepoint sp53;
RELEASE
Savepoint Sp54;
SAVEPOINT
Delete from subt_mpp16886_t2 where b1 > 0;
DELETE 150
Rollback to sp54;
ROLLBACK
Savepoint sp55;
SAVEPOINT
Update subt_mpp16886_t2 set b2 ='NEW VALUE' where b1 =55;
UPDATE 1
Select count(*) from subt_mpp16886_t2;
 count 
-------
   150
(1 row)

Release Savepoint sp55;
RELEASE
Savepoint Sp56;
SAVEPOINT
Delete from subt_mpp16886_t2 where b1 > 0;
DELETE 150
Rollback to sp56;
ROLLBACK
Savepoint sp57;
SAVEPOINT
Update subt_mpp16886_t2 set b2 ='NEW VALUE' where b1 =57;
UPDATE 1
Select count(*) from subt_mpp16886_t2;
 count 
-------
   150
(1 row)

Release Savepoint sp57;
RELEASE
Savepoint Sp58;
SAVEPOINT
Delete from subt_mpp16886_t2 where b1 > 0;
DELETE 150
Rollback to sp58;
ROLLBACK
Savepoint sp59;
SAVEPOINT
Update subt_mpp16886_t2 set b2 ='NEW VALUE' where b1 =59;
UPDATE 1
Select count(*) from subt_mpp16886_t2;
 count 
-------
   150
(1 row)

Release Savepoint sp59;
RELEASE
Savepoint Sp60;
SAVEPOINT
Delete from subt_mpp16886_t2 where b1 > 0;
DELETE 150
Rollback to sp60;
ROLLBACK
Savepoint sp61;
SAVEPOINT
Update subt_mpp16886_t2 set b2 ='NEW VALUE' where b1 =61;
UPDATE 1
Select count(*) from subt_mpp16886_t2;
 count 
-------
   150
(1 row)

Release Savepoint sp61;
RELEASE
Savepoint Sp62;
SAVEPOINT
Delete from subt_mpp16886_t2 where b1 > 0;
DELETE 150
Rollback to sp62;
ROLLBACK
Savepoint sp63;
SAVEPOINT
Update subt_mpp16886_t2 set b2 ='NEW VALUE' where b1 =63;
UPDATE 1
Select count(*) from subt_mpp16886_t2;
 count 
-------
   150
(1 row)

Release Savepoint sp63;
RELEASE
Savepoint Sp64;
SAVEPOINT
Delete from subt_mpp16886_t2 where b1 > 0;
DELETE 150
Rollback to sp64;
ROLLBACK
Savepoint sp65;
SAVEPOINT
Update subt_mpp16886_t2 set b2 ='NEW VALUE' where b1 =65;
UPDATE 1
Select count(*) from subt_mpp16886_t2;
 count 
-------
   150
(1 row)

Release Savepoint sp65;
RELEASE
Savepoint sp66;
SAVEPOINT
Update subt_mpp16886_t2 set b2 ='NEW VALUE' where b1 =66;
UPDATE 1
Select count(*) from subt_mpp16886_t2;
 count 
-------
   150
(1 row)

Release Savepoint sp66;
RELEASE
Savepoint Sp67;
SAVEPOINT
Delete from subt_mpp16886_t2 where b1 > 0;
DELETE 150
Rollback to sp67;
ROLLBACK
Savepoint sp68;
SAVEPOINT
Update subt_mpp16886_t2 set b2 ='NEW VALUE' where b1 =68;
UPDATE 1
Select count(*) from subt_mpp16886_t2;
 count 
-------
   150
(1 row)

Release Savepoint sp68;
RELEASE
Savepoint Sp69;
SAVEPOINT
Delete from subt_mpp16886_t2 where b1 > 0;
DELETE 150
Rollback to sp69;
ROLLBACK
Savepoint sp70;
SAVEPOINT
Update subt_mpp16886_t2 set b2 ='NEW VALUE' where b1 =70;
UPDATE 1
Select count(*) from subt_mpp16886_t2;
 count 
-------
   150
(1 row)

Release Savepoint sp70;
RELEASE
Savepoint Sp71;
SAVEPOINT
Delete from subt_mpp16886_t2 where b1 > 0;
DELETE 150
Rollback to sp71;
ROLLBACK
Savepoint sp72;
SAVEPOINT
Update subt_mpp16886_t2 set b2 ='NEW VALUE' where b1 =72;
UPDATE 1
Select count(*) from subt_mpp16886_t2;
 count 
-------
   150
(1 row)

Release Savepoint sp72;
RELEASE
Savepoint Sp73;
SAVEPOINT
Delete from subt_mpp16886_t2 where b1 > 0;
DELETE 150
Rollback to sp73;
ROLLBACK
Savepoint sp74;
SAVEPOINT
Update subt_mpp16886_t2 set b2 ='NEW VALUE' where b1 =74;
UPDATE 1
Select count(*) from subt_mpp16886_t2;
 count 
-------
   150
(1 row)

Release Savepoint sp74;
RELEASE
Savepoint Sp75;
SAVEPOINT
Delete from subt_mpp16886_t2 where b1 > 0;
DELETE 150
Rollback to sp75;
ROLLBACK
Savepoint sp76;
SAVEPOINT
Update subt_mpp16886_t2 set b2 ='NEW VALUE' where b1 =76;
UPDATE 1
Select count(*) from subt_mpp16886_t2;
 count 
-------
   150
(1 row)

Release Savepoint sp76;
RELEASE
Savepoint Sp77;
SAVEPOINT
Delete from subt_mpp16886_t2 where b1 > 0;
DELETE 150
Rollback to sp77;
ROLLBACK
Savepoint sp78;
SAVEPOINT
Update subt_mpp16886_t2 set b2 ='NEW VALUE' where b1 =78;
UPDATE 1
Select count(*) from subt_mpp16886_t2;
 count 
-------
   150
(1 row)

Release Savepoint sp78;
RELEASE
Savepoint Sp79;
SAVEPOINT
Delete from subt_mpp16886_t2 where b1 > 0;
DELETE 150
Rollback to sp79;
ROLLBACK
Savepoint sp80;
SAVEPOINT
Update subt_mpp16886_t2 set b2 ='NEW VALUE' where b1 =80;
UPDATE 1
Select count(*) from subt_mpp16886_t2;
 count 
-------
   150
(1 row)

Release Savepoint sp80;
RELEASE
Savepoint Sp81;
SAVEPOINT
Delete from subt_mpp16886_t2 where b1 > 0;
DELETE 150
Rollback to sp81;
ROLLBACK
Savepoint sp82;
SAVEPOINT
Update subt_mpp16886_t2 set b2 ='NEW VALUE' where b1 =82;
UPDATE 1
Select count(*) from subt_mpp16886_t2;
 count 
-------
   150
(1 row)

Release Savepoint sp82;
RELEASE
Savepoint Sp83;
SAVEPOINT
Delete from subt_mpp16886_t2 where b1 > 0;
DELETE 150
Rollback to sp83;
ROLLBACK
Savepoint sp84;
SAVEPOINT
Update subt_mpp16886_t2 set b2 ='NEW VALUE' where b1 =84;
UPDATE 1
Select count(*) from subt_mpp16886_t2;
 count 
-------
   150
(1 row)

Release Savepoint sp84;
RELEASE
Savepoint Sp85;
SAVEPOINT
Delete from subt_mpp16886_t2 where b1 > 0;
DELETE 150
Rollback to sp85;
ROLLBACK
Savepoint sp86;
SAVEPOINT
Update subt_mpp16886_t2 set b2 ='NEW VALUE' where b1 =86;
UPDATE 1
Select count(*) from subt_mpp16886_t2;
 count 
-------
   150
(1 row)

Release Savepoint sp86;
RELEASE
Savepoint Sp87;
SAVEPOINT
Delete from subt_mpp16886_t2 where b1 > 0;
DELETE 150
Rollback to sp87;
ROLLBACK
Savepoint sp88;
SAVEPOINT
Update subt_mpp16886_t2 set b2 ='NEW VALUE' where b1 =88;
UPDATE 1
Select count(*) from subt_mpp16886_t2;
 count 
-------
   150
(1 row)

Release Savepoint sp88;
RELEASE
Savepoint Sp89;
SAVEPOINT
Delete from subt_mpp16886_t2 where b1 > 0;
DELETE 150
Rollback to sp89;
ROLLBACK
Savepoint sp90;
SAVEPOINT
Update subt_mpp16886_t2 set b2 ='NEW VALUE' where b1 =90;
UPDATE 1
Select count(*) from subt_mpp16886_t2;
 count 
-------
   150
(1 row)

Release Savepoint sp90;
RELEASE
Savepoint Sp91;
SAVEPOINT
Delete from subt_mpp16886_t2 where b1 > 0;
DELETE 150
Rollback to sp91;
ROLLBACK
Savepoint sp92;
SAVEPOINT
Update subt_mpp16886_t2 set b2 ='NEW VALUE' where b1 =92;
UPDATE 1
Select count(*) from subt_mpp16886_t2;
 count 
-------
   150
(1 row)

Release Savepoint sp92;
RELEASE
Savepoint Sp93;
SAVEPOINT
Delete from subt_mpp16886_t2 where b1 > 0;
DELETE 150
Rollback to sp93;
ROLLBACK
Savepoint sp94;
SAVEPOINT
Update subt_mpp16886_t2 set b2 ='NEW VALUE' where b1 =94;
UPDATE 1
Select count(*) from subt_mpp16886_t2;
 count 
-------
   150
(1 row)

Release Savepoint sp94;
RELEASE
Savepoint Sp95;
SAVEPOINT
Delete from subt_mpp16886_t2 where b1 > 0;
DELETE 150
Rollback to sp95;
ROLLBACK
Savepoint sp96;
SAVEPOINT
Update subt_mpp16886_t2 set b2 ='NEW VALUE' where b1 =96;
UPDATE 1
Select count(*) from subt_mpp16886_t2;
 count 
-------
   150
(1 row)

Release Savepoint sp96;
RELEASE
Savepoint Sp97;
SAVEPOINT
Delete from subt_mpp16886_t2 where b1 > 0;
DELETE 150
Rollback to sp97;
ROLLBACK
Savepoint sp98;
SAVEPOINT
Update subt_mpp16886_t2 set b2 ='NEW VALUE' where b1 =98;
UPDATE 1
Select count(*) from subt_mpp16886_t2;
 count 
-------
   150
(1 row)

Release Savepoint sp98;
RELEASE
Savepoint Sp99;
SAVEPOINT
Delete from subt_mpp16886_t2 where b1 > 0;
DELETE 150
Rollback to sp99;
ROLLBACK
Savepoint sp100;
SAVEPOINT
Update subt_mpp16886_t2 set b2 ='NEW VALUE' where b1 =100;
UPDATE 1
Select count(*) from subt_mpp16886_t2;
 count 
-------
   150
(1 row)

Release Savepoint sp100;
RELEASE
Savepoint Sp101;
SAVEPOINT
Delete from subt_mpp16886_t2 where b1 > 0;
DELETE 150
Rollback to sp101;
ROLLBACK
Savepoint sp102;
SAVEPOINT
Update subt_mpp16886_t2 set b2 ='NEW VALUE' where b1 =102;
UPDATE 1
Select count(*) from subt_mpp16886_t2;
 count 
-------
   150
(1 row)

Release Savepoint sp102;
RELEASE
end;
COMMIT
