Drop table if exists nested_subtx_t1;
NOTICE:  table "nested_subtx_t1" does not exist, skipping
DROP TABLE
Create table nested_subtx_t1(a1 int,a2 text,a3 char,a4 varchar, a5 date, a6 numeric, a7 timestamp without time zone, a8 time with time zone) distributed randomly;
CREATE TABLE
Drop table if exists nested_subtx_t2;
NOTICE:  table "nested_subtx_t2" does not exist, skipping
DROP TABLE
Create table nested_subtx_t2(b1 int,b2 text,b3 char,b4 varchar, b5 date, b6 numeric, b7 timestamp without time zone, b8 time with time zone) distributed randomly;
CREATE TABLE
Insert into nested_subtx_t2 values(100,'sub- and nested transactions','a','variable string','2-2-2012',5,'2012-10-10 10:23:54', '2011-10-19 10:23:54+02');
INSERT 0 1
BEGIN;
BEGIN
Savepoint sp1;
SAVEPOINT
Insert into nested_subtx_t1 values(1, 'sub- and nested transactions','a','variable string','2-2-2012',5,'2012-10-10 10:23:54', '2011-10-19 10:23:54+02');
INSERT 0 1
Savepoint sp1n1;
SAVEPOINT
Insert into nested_subtx_t1 values(1, 'sub- and nested transactions','a','variable string','2-2-2012',5,'2012-10-10 10:23:54', '2011-10-19 10:23:54+02');
INSERT 0 1
Savepoint sp1n2;
SAVEPOINT
Insert into nested_subtx_t1 values(2, 'sub- and nested transactions','a','variable string','2-2-2012',5,'2012-10-10 10:23:54', '2011-10-19 10:23:54+02');
INSERT 0 1
Savepoint sp1n3;
SAVEPOINT
Insert into nested_subtx_t1 values(3, 'sub- and nested transactions','a','variable string','2-2-2012',5,'2012-10-10 10:23:54', '2011-10-19 10:23:54+02');
INSERT 0 1
Savepoint sp1n4;
SAVEPOINT
Insert into nested_subtx_t1 values(4, 'sub- and nested transactions','a','variable string','2-2-2012',5,'2012-10-10 10:23:54', '2011-10-19 10:23:54+02');
INSERT 0 1
Update nested_subtx_t1 set a2 = 'New Value' where a1 =4;
UPDATE 1
Release Savepoint sp1n4;
RELEASE
Select a2 from nested_subtx_t1 where a1 = 4;
    a2     
-----------
 New Value
(1 row)

Delete from nested_subtx_t2 where b1>0 ;
DELETE 1
Rollback to sp1n3;
ROLLBACK
Update nested_subtx_t1 set a2 = 'New Value' where a1 =2;
UPDATE 1
Release Savepoint sp1n2;
RELEASE
Select count(*) from nested_subtx_t1;
 count 
-------
     3
(1 row)

Select count(*) from nested_subtx_t2;
 count 
-------
     1
(1 row)

Release Savepoint sp1;
RELEASE
Savepoint sp2;
SAVEPOINT
Savepoint sp2n1;
SAVEPOINT
Insert into nested_subtx_t1 values(1, 'sub- and nested transactions','a','variable string','2-2-2012',5,'2012-10-10 10:23:54', '2011-10-19 10:23:54+02');
INSERT 0 1
Savepoint sp2n2;
SAVEPOINT
Insert into nested_subtx_t1 values(2, 'sub- and nested transactions','a','variable string','2-2-2012',5,'2012-10-10 10:23:54', '2011-10-19 10:23:54+02');
INSERT 0 1
Savepoint sp2n3;
SAVEPOINT
Insert into nested_subtx_t1 values(3, 'sub- and nested transactions','a','variable string','2-2-2012',5,'2012-10-10 10:23:54', '2011-10-19 10:23:54+02');
INSERT 0 1
Savepoint sp2n4;
SAVEPOINT
Insert into nested_subtx_t1 values(4, 'sub- and nested transactions','a','variable string','2-2-2012',5,'2012-10-10 10:23:54', '2011-10-19 10:23:54+02');
INSERT 0 1
Update nested_subtx_t1 set a2 = 'New Value' where a1 =4;
UPDATE 1
Release Savepoint sp2n4;
RELEASE
Select a2 from nested_subtx_t1 where a1 = 4;
    a2     
-----------
 New Value
(1 row)

Delete from nested_subtx_t2 where b1>0 ;
DELETE 1
Rollback to sp2n3;
ROLLBACK
Update nested_subtx_t1 set a2 = 'New Value' where a1 =2;
UPDATE 2
Release Savepoint sp2n2;
RELEASE
Select count(*) from nested_subtx_t1;
 count 
-------
     5
(1 row)

Select count(*) from nested_subtx_t2;
 count 
-------
     1
(1 row)

Rollback to sp2;
ROLLBACK
Savepoint sp3;
SAVEPOINT
Insert into nested_subtx_t1 values(3, 'sub- and nested transactions','a','variable string','2-2-2012',5,'2012-10-10 10:23:54', '2011-10-19 10:23:54+02');
INSERT 0 1
Savepoint sp3n1;
SAVEPOINT
Insert into nested_subtx_t1 values(1, 'sub- and nested transactions','a','variable string','2-2-2012',5,'2012-10-10 10:23:54', '2011-10-19 10:23:54+02');
INSERT 0 1
Savepoint sp3n2;
SAVEPOINT
Insert into nested_subtx_t1 values(2, 'sub- and nested transactions','a','variable string','2-2-2012',5,'2012-10-10 10:23:54', '2011-10-19 10:23:54+02');
INSERT 0 1
Savepoint sp3n3;
SAVEPOINT
Insert into nested_subtx_t1 values(3, 'sub- and nested transactions','a','variable string','2-2-2012',5,'2012-10-10 10:23:54', '2011-10-19 10:23:54+02');
INSERT 0 1
Savepoint sp3n4;
SAVEPOINT
Insert into nested_subtx_t1 values(4, 'sub- and nested transactions','a','variable string','2-2-2012',5,'2012-10-10 10:23:54', '2011-10-19 10:23:54+02');
INSERT 0 1
Update nested_subtx_t1 set a2 = 'New Value' where a1 =4;
UPDATE 1
Release Savepoint sp3n4;
RELEASE
Select a2 from nested_subtx_t1 where a1 = 4;
    a2     
-----------
 New Value
(1 row)

Delete from nested_subtx_t2 where b1>0 ;
DELETE 1
Rollback to sp3n3;
ROLLBACK
Update nested_subtx_t1 set a2 = 'New Value' where a1 =2;
UPDATE 2
Release Savepoint sp3n2;
RELEASE
Select count(*) from nested_subtx_t1;
 count 
-------
     6
(1 row)

Select count(*) from nested_subtx_t2;
 count 
-------
     1
(1 row)

Release Savepoint sp3;
RELEASE
Savepoint sp4;
SAVEPOINT
Savepoint sp4n1;
SAVEPOINT
Insert into nested_subtx_t1 values(1, 'sub- and nested transactions','a','variable string','2-2-2012',5,'2012-10-10 10:23:54', '2011-10-19 10:23:54+02');
INSERT 0 1
Savepoint sp4n2;
SAVEPOINT
Insert into nested_subtx_t1 values(2, 'sub- and nested transactions','a','variable string','2-2-2012',5,'2012-10-10 10:23:54', '2011-10-19 10:23:54+02');
INSERT 0 1
Savepoint sp4n3;
SAVEPOINT
Insert into nested_subtx_t1 values(3, 'sub- and nested transactions','a','variable string','2-2-2012',5,'2012-10-10 10:23:54', '2011-10-19 10:23:54+02');
INSERT 0 1
Savepoint sp4n4;
SAVEPOINT
Insert into nested_subtx_t1 values(4, 'sub- and nested transactions','a','variable string','2-2-2012',5,'2012-10-10 10:23:54', '2011-10-19 10:23:54+02');
INSERT 0 1
Update nested_subtx_t1 set a2 = 'New Value' where a1 =4;
UPDATE 1
Release Savepoint sp4n4;
RELEASE
Select a2 from nested_subtx_t1 where a1 = 4;
    a2     
-----------
 New Value
(1 row)

Delete from nested_subtx_t2 where b1>0 ;
DELETE 1
Rollback to sp4n3;
ROLLBACK
Update nested_subtx_t1 set a2 = 'New Value' where a1 =2;
UPDATE 3
Release Savepoint sp4n2;
RELEASE
Select count(*) from nested_subtx_t1;
 count 
-------
     8
(1 row)

Select count(*) from nested_subtx_t2;
 count 
-------
     1
(1 row)

Rollback to sp4;
ROLLBACK
Savepoint sp5;
SAVEPOINT
Insert into nested_subtx_t1 values(5, 'sub- and nested transactions','a','variable string','2-2-2012',5,'2012-10-10 10:23:54', '2011-10-19 10:23:54+02');
INSERT 0 1
Savepoint sp5n1;
SAVEPOINT
Insert into nested_subtx_t1 values(1, 'sub- and nested transactions','a','variable string','2-2-2012',5,'2012-10-10 10:23:54', '2011-10-19 10:23:54+02');
INSERT 0 1
Savepoint sp5n2;
SAVEPOINT
Insert into nested_subtx_t1 values(2, 'sub- and nested transactions','a','variable string','2-2-2012',5,'2012-10-10 10:23:54', '2011-10-19 10:23:54+02');
INSERT 0 1
Savepoint sp5n3;
SAVEPOINT
Insert into nested_subtx_t1 values(3, 'sub- and nested transactions','a','variable string','2-2-2012',5,'2012-10-10 10:23:54', '2011-10-19 10:23:54+02');
INSERT 0 1
Savepoint sp5n4;
SAVEPOINT
Insert into nested_subtx_t1 values(4, 'sub- and nested transactions','a','variable string','2-2-2012',5,'2012-10-10 10:23:54', '2011-10-19 10:23:54+02');
INSERT 0 1
Update nested_subtx_t1 set a2 = 'New Value' where a1 =4;
UPDATE 1
Release Savepoint sp5n4;
RELEASE
Select a2 from nested_subtx_t1 where a1 = 4;
    a2     
-----------
 New Value
(1 row)

Delete from nested_subtx_t2 where b1>0 ;
DELETE 1
Rollback to sp5n3;
ROLLBACK
Update nested_subtx_t1 set a2 = 'New Value' where a1 =2;
UPDATE 3
Release Savepoint sp5n2;
RELEASE
Select count(*) from nested_subtx_t1;
 count 
-------
     9
(1 row)

Select count(*) from nested_subtx_t2;
 count 
-------
     1
(1 row)

Release Savepoint sp5;
RELEASE
Savepoint sp6;
SAVEPOINT
Savepoint sp6n1;
SAVEPOINT
Insert into nested_subtx_t1 values(1, 'sub- and nested transactions','a','variable string','2-2-2012',5,'2012-10-10 10:23:54', '2011-10-19 10:23:54+02');
INSERT 0 1
Savepoint sp6n2;
SAVEPOINT
Insert into nested_subtx_t1 values(2, 'sub- and nested transactions','a','variable string','2-2-2012',5,'2012-10-10 10:23:54', '2011-10-19 10:23:54+02');
INSERT 0 1
Savepoint sp6n3;
SAVEPOINT
Insert into nested_subtx_t1 values(3, 'sub- and nested transactions','a','variable string','2-2-2012',5,'2012-10-10 10:23:54', '2011-10-19 10:23:54+02');
INSERT 0 1
Savepoint sp6n4;
SAVEPOINT
Insert into nested_subtx_t1 values(4, 'sub- and nested transactions','a','variable string','2-2-2012',5,'2012-10-10 10:23:54', '2011-10-19 10:23:54+02');
INSERT 0 1
Update nested_subtx_t1 set a2 = 'New Value' where a1 =4;
UPDATE 1
Release Savepoint sp6n4;
RELEASE
Select a2 from nested_subtx_t1 where a1 = 4;
    a2     
-----------
 New Value
(1 row)

Delete from nested_subtx_t2 where b1>0 ;
DELETE 1
Rollback to sp6n3;
ROLLBACK
Update nested_subtx_t1 set a2 = 'New Value' where a1 =2;
UPDATE 4
Release Savepoint sp6n2;
RELEASE
Select count(*) from nested_subtx_t1;
 count 
-------
    11
(1 row)

Select count(*) from nested_subtx_t2;
 count 
-------
     1
(1 row)

Rollback to sp6;
ROLLBACK
Savepoint sp7;
SAVEPOINT
Insert into nested_subtx_t1 values(7, 'sub- and nested transactions','a','variable string','2-2-2012',5,'2012-10-10 10:23:54', '2011-10-19 10:23:54+02');
INSERT 0 1
Savepoint sp7n1;
SAVEPOINT
Insert into nested_subtx_t1 values(1, 'sub- and nested transactions','a','variable string','2-2-2012',5,'2012-10-10 10:23:54', '2011-10-19 10:23:54+02');
INSERT 0 1
Savepoint sp7n2;
SAVEPOINT
Insert into nested_subtx_t1 values(2, 'sub- and nested transactions','a','variable string','2-2-2012',5,'2012-10-10 10:23:54', '2011-10-19 10:23:54+02');
INSERT 0 1
Savepoint sp7n3;
SAVEPOINT
Insert into nested_subtx_t1 values(3, 'sub- and nested transactions','a','variable string','2-2-2012',5,'2012-10-10 10:23:54', '2011-10-19 10:23:54+02');
INSERT 0 1
Savepoint sp7n4;
SAVEPOINT
Insert into nested_subtx_t1 values(4, 'sub- and nested transactions','a','variable string','2-2-2012',5,'2012-10-10 10:23:54', '2011-10-19 10:23:54+02');
INSERT 0 1
Update nested_subtx_t1 set a2 = 'New Value' where a1 =4;
UPDATE 1
Release Savepoint sp7n4;
RELEASE
Select a2 from nested_subtx_t1 where a1 = 4;
    a2     
-----------
 New Value
(1 row)

Delete from nested_subtx_t2 where b1>0 ;
DELETE 1
Rollback to sp7n3;
ROLLBACK
Update nested_subtx_t1 set a2 = 'New Value' where a1 =2;
UPDATE 4
Release Savepoint sp7n2;
RELEASE
Select count(*) from nested_subtx_t1;
 count 
-------
    12
(1 row)

Select count(*) from nested_subtx_t2;
 count 
-------
     1
(1 row)

Release Savepoint sp7;
RELEASE
Savepoint sp8;
SAVEPOINT
Savepoint sp8n1;
SAVEPOINT
Insert into nested_subtx_t1 values(1, 'sub- and nested transactions','a','variable string','2-2-2012',5,'2012-10-10 10:23:54', '2011-10-19 10:23:54+02');
INSERT 0 1
Savepoint sp8n2;
SAVEPOINT
Insert into nested_subtx_t1 values(2, 'sub- and nested transactions','a','variable string','2-2-2012',5,'2012-10-10 10:23:54', '2011-10-19 10:23:54+02');
INSERT 0 1
Savepoint sp8n3;
SAVEPOINT
Insert into nested_subtx_t1 values(3, 'sub- and nested transactions','a','variable string','2-2-2012',5,'2012-10-10 10:23:54', '2011-10-19 10:23:54+02');
INSERT 0 1
Savepoint sp8n4;
SAVEPOINT
Insert into nested_subtx_t1 values(4, 'sub- and nested transactions','a','variable string','2-2-2012',5,'2012-10-10 10:23:54', '2011-10-19 10:23:54+02');
INSERT 0 1
Update nested_subtx_t1 set a2 = 'New Value' where a1 =4;
UPDATE 1
Release Savepoint sp8n4;
RELEASE
Select a2 from nested_subtx_t1 where a1 = 4;
    a2     
-----------
 New Value
(1 row)

Delete from nested_subtx_t2 where b1>0 ;
DELETE 1
Rollback to sp8n3;
ROLLBACK
Update nested_subtx_t1 set a2 = 'New Value' where a1 =2;
UPDATE 5
Release Savepoint sp8n2;
RELEASE
Select count(*) from nested_subtx_t1;
 count 
-------
    14
(1 row)

Select count(*) from nested_subtx_t2;
 count 
-------
     1
(1 row)

Rollback to sp8;
ROLLBACK
Savepoint sp9;
SAVEPOINT
Insert into nested_subtx_t1 values(9, 'sub- and nested transactions','a','variable string','2-2-2012',5,'2012-10-10 10:23:54', '2011-10-19 10:23:54+02');
INSERT 0 1
Savepoint sp9n1;
SAVEPOINT
Insert into nested_subtx_t1 values(1, 'sub- and nested transactions','a','variable string','2-2-2012',5,'2012-10-10 10:23:54', '2011-10-19 10:23:54+02');
INSERT 0 1
Savepoint sp9n2;
SAVEPOINT
Insert into nested_subtx_t1 values(2, 'sub- and nested transactions','a','variable string','2-2-2012',5,'2012-10-10 10:23:54', '2011-10-19 10:23:54+02');
INSERT 0 1
Savepoint sp9n3;
SAVEPOINT
Insert into nested_subtx_t1 values(3, 'sub- and nested transactions','a','variable string','2-2-2012',5,'2012-10-10 10:23:54', '2011-10-19 10:23:54+02');
INSERT 0 1
Savepoint sp9n4;
SAVEPOINT
Insert into nested_subtx_t1 values(4, 'sub- and nested transactions','a','variable string','2-2-2012',5,'2012-10-10 10:23:54', '2011-10-19 10:23:54+02');
INSERT 0 1
Update nested_subtx_t1 set a2 = 'New Value' where a1 =4;
UPDATE 1
Release Savepoint sp9n4;
RELEASE
Select a2 from nested_subtx_t1 where a1 = 4;
    a2     
-----------
 New Value
(1 row)

Delete from nested_subtx_t2 where b1>0 ;
DELETE 1
Rollback to sp9n3;
ROLLBACK
Update nested_subtx_t1 set a2 = 'New Value' where a1 =2;
UPDATE 5
Release Savepoint sp9n2;
RELEASE
Select count(*) from nested_subtx_t1;
 count 
-------
    15
(1 row)

Select count(*) from nested_subtx_t2;
 count 
-------
     1
(1 row)

Release Savepoint sp9;
RELEASE
Savepoint sp10;
SAVEPOINT
Savepoint sp10n1;
SAVEPOINT
Insert into nested_subtx_t1 values(1, 'sub- and nested transactions','a','variable string','2-2-2012',5,'2012-10-10 10:23:54', '2011-10-19 10:23:54+02');
INSERT 0 1
Savepoint sp10n2;
SAVEPOINT
Insert into nested_subtx_t1 values(2, 'sub- and nested transactions','a','variable string','2-2-2012',5,'2012-10-10 10:23:54', '2011-10-19 10:23:54+02');
INSERT 0 1
Savepoint sp10n3;
SAVEPOINT
Insert into nested_subtx_t1 values(3, 'sub- and nested transactions','a','variable string','2-2-2012',5,'2012-10-10 10:23:54', '2011-10-19 10:23:54+02');
INSERT 0 1
Savepoint sp10n4;
SAVEPOINT
Insert into nested_subtx_t1 values(4, 'sub- and nested transactions','a','variable string','2-2-2012',5,'2012-10-10 10:23:54', '2011-10-19 10:23:54+02');
INSERT 0 1
Update nested_subtx_t1 set a2 = 'New Value' where a1 =4;
UPDATE 1
Release Savepoint sp10n4;
RELEASE
Select a2 from nested_subtx_t1 where a1 = 4;
    a2     
-----------
 New Value
(1 row)

Delete from nested_subtx_t2 where b1>0 ;
DELETE 1
Rollback to sp10n3;
ROLLBACK
Update nested_subtx_t1 set a2 = 'New Value' where a1 =2;
UPDATE 6
Release Savepoint sp10n2;
RELEASE
Select count(*) from nested_subtx_t1;
 count 
-------
    17
(1 row)

Select count(*) from nested_subtx_t2;
 count 
-------
     1
(1 row)

Rollback to sp10;
ROLLBACK
Savepoint sp11;
SAVEPOINT
Insert into nested_subtx_t1 values(11, 'sub- and nested transactions','a','variable string','2-2-2012',5,'2012-10-10 10:23:54', '2011-10-19 10:23:54+02');
INSERT 0 1
Savepoint sp11n1;
SAVEPOINT
Insert into nested_subtx_t1 values(1, 'sub- and nested transactions','a','variable string','2-2-2012',5,'2012-10-10 10:23:54', '2011-10-19 10:23:54+02');
INSERT 0 1
Savepoint sp11n2;
SAVEPOINT
Insert into nested_subtx_t1 values(2, 'sub- and nested transactions','a','variable string','2-2-2012',5,'2012-10-10 10:23:54', '2011-10-19 10:23:54+02');
INSERT 0 1
Savepoint sp11n3;
SAVEPOINT
Insert into nested_subtx_t1 values(3, 'sub- and nested transactions','a','variable string','2-2-2012',5,'2012-10-10 10:23:54', '2011-10-19 10:23:54+02');
INSERT 0 1
Savepoint sp11n4;
SAVEPOINT
Insert into nested_subtx_t1 values(4, 'sub- and nested transactions','a','variable string','2-2-2012',5,'2012-10-10 10:23:54', '2011-10-19 10:23:54+02');
INSERT 0 1
Update nested_subtx_t1 set a2 = 'New Value' where a1 =4;
UPDATE 1
Release Savepoint sp11n4;
RELEASE
Select a2 from nested_subtx_t1 where a1 = 4;
    a2     
-----------
 New Value
(1 row)

Delete from nested_subtx_t2 where b1>0 ;
DELETE 1
Rollback to sp11n3;
ROLLBACK
Update nested_subtx_t1 set a2 = 'New Value' where a1 =2;
UPDATE 6
Release Savepoint sp11n2;
RELEASE
Select count(*) from nested_subtx_t1;
 count 
-------
    18
(1 row)

Select count(*) from nested_subtx_t2;
 count 
-------
     1
(1 row)

Release Savepoint sp11;
RELEASE
Savepoint sp12;
SAVEPOINT
Savepoint sp12n1;
SAVEPOINT
Insert into nested_subtx_t1 values(1, 'sub- and nested transactions','a','variable string','2-2-2012',5,'2012-10-10 10:23:54', '2011-10-19 10:23:54+02');
INSERT 0 1
Savepoint sp12n2;
SAVEPOINT
Insert into nested_subtx_t1 values(2, 'sub- and nested transactions','a','variable string','2-2-2012',5,'2012-10-10 10:23:54', '2011-10-19 10:23:54+02');
INSERT 0 1
Savepoint sp12n3;
SAVEPOINT
Insert into nested_subtx_t1 values(3, 'sub- and nested transactions','a','variable string','2-2-2012',5,'2012-10-10 10:23:54', '2011-10-19 10:23:54+02');
INSERT 0 1
Savepoint sp12n4;
SAVEPOINT
Insert into nested_subtx_t1 values(4, 'sub- and nested transactions','a','variable string','2-2-2012',5,'2012-10-10 10:23:54', '2011-10-19 10:23:54+02');
INSERT 0 1
Update nested_subtx_t1 set a2 = 'New Value' where a1 =4;
UPDATE 1
Release Savepoint sp12n4;
RELEASE
Select a2 from nested_subtx_t1 where a1 = 4;
    a2     
-----------
 New Value
(1 row)

Delete from nested_subtx_t2 where b1>0 ;
DELETE 1
Rollback to sp12n3;
ROLLBACK
Update nested_subtx_t1 set a2 = 'New Value' where a1 =2;
UPDATE 7
Release Savepoint sp12n2;
RELEASE
Select count(*) from nested_subtx_t1;
 count 
-------
    20
(1 row)

Select count(*) from nested_subtx_t2;
 count 
-------
     1
(1 row)

Rollback to sp12;
ROLLBACK
Savepoint sp13;
SAVEPOINT
Insert into nested_subtx_t1 values(13, 'sub- and nested transactions','a','variable string','2-2-2012',5,'2012-10-10 10:23:54', '2011-10-19 10:23:54+02');
INSERT 0 1
Savepoint sp13n1;
SAVEPOINT
Insert into nested_subtx_t1 values(1, 'sub- and nested transactions','a','variable string','2-2-2012',5,'2012-10-10 10:23:54', '2011-10-19 10:23:54+02');
INSERT 0 1
Savepoint sp13n2;
SAVEPOINT
Insert into nested_subtx_t1 values(2, 'sub- and nested transactions','a','variable string','2-2-2012',5,'2012-10-10 10:23:54', '2011-10-19 10:23:54+02');
INSERT 0 1
Savepoint sp13n3;
SAVEPOINT
Insert into nested_subtx_t1 values(3, 'sub- and nested transactions','a','variable string','2-2-2012',5,'2012-10-10 10:23:54', '2011-10-19 10:23:54+02');
INSERT 0 1
Savepoint sp13n4;
SAVEPOINT
Insert into nested_subtx_t1 values(4, 'sub- and nested transactions','a','variable string','2-2-2012',5,'2012-10-10 10:23:54', '2011-10-19 10:23:54+02');
INSERT 0 1
Update nested_subtx_t1 set a2 = 'New Value' where a1 =4;
UPDATE 1
Release Savepoint sp13n4;
RELEASE
Select a2 from nested_subtx_t1 where a1 = 4;
    a2     
-----------
 New Value
(1 row)

Delete from nested_subtx_t2 where b1>0 ;
DELETE 1
Rollback to sp13n3;
ROLLBACK
Update nested_subtx_t1 set a2 = 'New Value' where a1 =2;
UPDATE 7
Release Savepoint sp13n2;
RELEASE
Select count(*) from nested_subtx_t1;
 count 
-------
    21
(1 row)

Select count(*) from nested_subtx_t2;
 count 
-------
     1
(1 row)

Release Savepoint sp13;
RELEASE
Savepoint sp14;
SAVEPOINT
Savepoint sp14n1;
SAVEPOINT
Insert into nested_subtx_t1 values(1, 'sub- and nested transactions','a','variable string','2-2-2012',5,'2012-10-10 10:23:54', '2011-10-19 10:23:54+02');
INSERT 0 1
Savepoint sp14n2;
SAVEPOINT
Insert into nested_subtx_t1 values(2, 'sub- and nested transactions','a','variable string','2-2-2012',5,'2012-10-10 10:23:54', '2011-10-19 10:23:54+02');
INSERT 0 1
Savepoint sp14n3;
SAVEPOINT
Insert into nested_subtx_t1 values(3, 'sub- and nested transactions','a','variable string','2-2-2012',5,'2012-10-10 10:23:54', '2011-10-19 10:23:54+02');
INSERT 0 1
Savepoint sp14n4;
SAVEPOINT
Insert into nested_subtx_t1 values(4, 'sub- and nested transactions','a','variable string','2-2-2012',5,'2012-10-10 10:23:54', '2011-10-19 10:23:54+02');
INSERT 0 1
Update nested_subtx_t1 set a2 = 'New Value' where a1 =4;
UPDATE 1
Release Savepoint sp14n4;
RELEASE
Select a2 from nested_subtx_t1 where a1 = 4;
    a2     
-----------
 New Value
(1 row)

Delete from nested_subtx_t2 where b1>0 ;
DELETE 1
Rollback to sp14n3;
ROLLBACK
Update nested_subtx_t1 set a2 = 'New Value' where a1 =2;
UPDATE 8
Release Savepoint sp14n2;
RELEASE
Select count(*) from nested_subtx_t1;
 count 
-------
    23
(1 row)

Select count(*) from nested_subtx_t2;
 count 
-------
     1
(1 row)

Rollback to sp14;
ROLLBACK
Savepoint sp15;
SAVEPOINT
Insert into nested_subtx_t1 values(15, 'sub- and nested transactions','a','variable string','2-2-2012',5,'2012-10-10 10:23:54', '2011-10-19 10:23:54+02');
INSERT 0 1
Savepoint sp15n1;
SAVEPOINT
Insert into nested_subtx_t1 values(1, 'sub- and nested transactions','a','variable string','2-2-2012',5,'2012-10-10 10:23:54', '2011-10-19 10:23:54+02');
INSERT 0 1
Savepoint sp15n2;
SAVEPOINT
Insert into nested_subtx_t1 values(2, 'sub- and nested transactions','a','variable string','2-2-2012',5,'2012-10-10 10:23:54', '2011-10-19 10:23:54+02');
INSERT 0 1
Savepoint sp15n3;
SAVEPOINT
Insert into nested_subtx_t1 values(3, 'sub- and nested transactions','a','variable string','2-2-2012',5,'2012-10-10 10:23:54', '2011-10-19 10:23:54+02');
INSERT 0 1
Savepoint sp15n4;
SAVEPOINT
Insert into nested_subtx_t1 values(4, 'sub- and nested transactions','a','variable string','2-2-2012',5,'2012-10-10 10:23:54', '2011-10-19 10:23:54+02');
INSERT 0 1
Update nested_subtx_t1 set a2 = 'New Value' where a1 =4;
UPDATE 1
Release Savepoint sp15n4;
RELEASE
Select a2 from nested_subtx_t1 where a1 = 4;
    a2     
-----------
 New Value
(1 row)

Delete from nested_subtx_t2 where b1>0 ;
DELETE 1
Rollback to sp15n3;
ROLLBACK
Update nested_subtx_t1 set a2 = 'New Value' where a1 =2;
UPDATE 8
Release Savepoint sp15n2;
RELEASE
Select count(*) from nested_subtx_t1;
 count 
-------
    24
(1 row)

Select count(*) from nested_subtx_t2;
 count 
-------
     1
(1 row)

Release Savepoint sp15;
RELEASE
Savepoint sp16;
SAVEPOINT
Savepoint sp16n1;
SAVEPOINT
Insert into nested_subtx_t1 values(1, 'sub- and nested transactions','a','variable string','2-2-2012',5,'2012-10-10 10:23:54', '2011-10-19 10:23:54+02');
INSERT 0 1
Savepoint sp16n2;
SAVEPOINT
Insert into nested_subtx_t1 values(2, 'sub- and nested transactions','a','variable string','2-2-2012',5,'2012-10-10 10:23:54', '2011-10-19 10:23:54+02');
INSERT 0 1
Savepoint sp16n3;
SAVEPOINT
Insert into nested_subtx_t1 values(3, 'sub- and nested transactions','a','variable string','2-2-2012',5,'2012-10-10 10:23:54', '2011-10-19 10:23:54+02');
INSERT 0 1
Savepoint sp16n4;
SAVEPOINT
Insert into nested_subtx_t1 values(4, 'sub- and nested transactions','a','variable string','2-2-2012',5,'2012-10-10 10:23:54', '2011-10-19 10:23:54+02');
INSERT 0 1
Update nested_subtx_t1 set a2 = 'New Value' where a1 =4;
UPDATE 1
Release Savepoint sp16n4;
RELEASE
Select a2 from nested_subtx_t1 where a1 = 4;
    a2     
-----------
 New Value
(1 row)

Delete from nested_subtx_t2 where b1>0 ;
DELETE 1
Rollback to sp16n3;
ROLLBACK
Update nested_subtx_t1 set a2 = 'New Value' where a1 =2;
UPDATE 9
Release Savepoint sp16n2;
RELEASE
Select count(*) from nested_subtx_t1;
 count 
-------
    26
(1 row)

Select count(*) from nested_subtx_t2;
 count 
-------
     1
(1 row)

Rollback to sp16;
ROLLBACK
Savepoint sp17;
SAVEPOINT
Insert into nested_subtx_t1 values(17, 'sub- and nested transactions','a','variable string','2-2-2012',5,'2012-10-10 10:23:54', '2011-10-19 10:23:54+02');
INSERT 0 1
Savepoint sp17n1;
SAVEPOINT
Insert into nested_subtx_t1 values(1, 'sub- and nested transactions','a','variable string','2-2-2012',5,'2012-10-10 10:23:54', '2011-10-19 10:23:54+02');
INSERT 0 1
Savepoint sp17n2;
SAVEPOINT
Insert into nested_subtx_t1 values(2, 'sub- and nested transactions','a','variable string','2-2-2012',5,'2012-10-10 10:23:54', '2011-10-19 10:23:54+02');
INSERT 0 1
Savepoint sp17n3;
SAVEPOINT
Insert into nested_subtx_t1 values(3, 'sub- and nested transactions','a','variable string','2-2-2012',5,'2012-10-10 10:23:54', '2011-10-19 10:23:54+02');
INSERT 0 1
Savepoint sp17n4;
SAVEPOINT
Insert into nested_subtx_t1 values(4, 'sub- and nested transactions','a','variable string','2-2-2012',5,'2012-10-10 10:23:54', '2011-10-19 10:23:54+02');
INSERT 0 1
Update nested_subtx_t1 set a2 = 'New Value' where a1 =4;
UPDATE 1
Release Savepoint sp17n4;
RELEASE
Select a2 from nested_subtx_t1 where a1 = 4;
    a2     
-----------
 New Value
(1 row)

Delete from nested_subtx_t2 where b1>0 ;
DELETE 1
Rollback to sp17n3;
ROLLBACK
Update nested_subtx_t1 set a2 = 'New Value' where a1 =2;
UPDATE 9
Release Savepoint sp17n2;
RELEASE
Select count(*) from nested_subtx_t1;
 count 
-------
    27
(1 row)

Select count(*) from nested_subtx_t2;
 count 
-------
     1
(1 row)

Release Savepoint sp17;
RELEASE
Savepoint sp18;
SAVEPOINT
Savepoint sp18n1;
SAVEPOINT
Insert into nested_subtx_t1 values(1, 'sub- and nested transactions','a','variable string','2-2-2012',5,'2012-10-10 10:23:54', '2011-10-19 10:23:54+02');
INSERT 0 1
Savepoint sp18n2;
SAVEPOINT
Insert into nested_subtx_t1 values(2, 'sub- and nested transactions','a','variable string','2-2-2012',5,'2012-10-10 10:23:54', '2011-10-19 10:23:54+02');
INSERT 0 1
Savepoint sp18n3;
SAVEPOINT
Insert into nested_subtx_t1 values(3, 'sub- and nested transactions','a','variable string','2-2-2012',5,'2012-10-10 10:23:54', '2011-10-19 10:23:54+02');
INSERT 0 1
Savepoint sp18n4;
SAVEPOINT
Insert into nested_subtx_t1 values(4, 'sub- and nested transactions','a','variable string','2-2-2012',5,'2012-10-10 10:23:54', '2011-10-19 10:23:54+02');
INSERT 0 1
Update nested_subtx_t1 set a2 = 'New Value' where a1 =4;
UPDATE 1
Release Savepoint sp18n4;
RELEASE
Select a2 from nested_subtx_t1 where a1 = 4;
    a2     
-----------
 New Value
(1 row)

Delete from nested_subtx_t2 where b1>0 ;
DELETE 1
Rollback to sp18n3;
ROLLBACK
Update nested_subtx_t1 set a2 = 'New Value' where a1 =2;
UPDATE 10
Release Savepoint sp18n2;
RELEASE
Select count(*) from nested_subtx_t1;
 count 
-------
    29
(1 row)

Select count(*) from nested_subtx_t2;
 count 
-------
     1
(1 row)

Rollback to sp18;
ROLLBACK
Savepoint sp19;
SAVEPOINT
Insert into nested_subtx_t1 values(19, 'sub- and nested transactions','a','variable string','2-2-2012',5,'2012-10-10 10:23:54', '2011-10-19 10:23:54+02');
INSERT 0 1
Savepoint sp19n1;
SAVEPOINT
Insert into nested_subtx_t1 values(1, 'sub- and nested transactions','a','variable string','2-2-2012',5,'2012-10-10 10:23:54', '2011-10-19 10:23:54+02');
INSERT 0 1
Savepoint sp19n2;
SAVEPOINT
Insert into nested_subtx_t1 values(2, 'sub- and nested transactions','a','variable string','2-2-2012',5,'2012-10-10 10:23:54', '2011-10-19 10:23:54+02');
INSERT 0 1
Savepoint sp19n3;
SAVEPOINT
Insert into nested_subtx_t1 values(3, 'sub- and nested transactions','a','variable string','2-2-2012',5,'2012-10-10 10:23:54', '2011-10-19 10:23:54+02');
INSERT 0 1
Savepoint sp19n4;
SAVEPOINT
Insert into nested_subtx_t1 values(4, 'sub- and nested transactions','a','variable string','2-2-2012',5,'2012-10-10 10:23:54', '2011-10-19 10:23:54+02');
INSERT 0 1
Update nested_subtx_t1 set a2 = 'New Value' where a1 =4;
UPDATE 1
Release Savepoint sp19n4;
RELEASE
Select a2 from nested_subtx_t1 where a1 = 4;
    a2     
-----------
 New Value
(1 row)

Delete from nested_subtx_t2 where b1>0 ;
DELETE 1
Rollback to sp19n3;
ROLLBACK
Update nested_subtx_t1 set a2 = 'New Value' where a1 =2;
UPDATE 10
Release Savepoint sp19n2;
RELEASE
Select count(*) from nested_subtx_t1;
 count 
-------
    30
(1 row)

Select count(*) from nested_subtx_t2;
 count 
-------
     1
(1 row)

Release Savepoint sp19;
RELEASE
Savepoint sp20;
SAVEPOINT
Savepoint sp20n1;
SAVEPOINT
Insert into nested_subtx_t1 values(1, 'sub- and nested transactions','a','variable string','2-2-2012',5,'2012-10-10 10:23:54', '2011-10-19 10:23:54+02');
INSERT 0 1
Savepoint sp20n2;
SAVEPOINT
Insert into nested_subtx_t1 values(2, 'sub- and nested transactions','a','variable string','2-2-2012',5,'2012-10-10 10:23:54', '2011-10-19 10:23:54+02');
INSERT 0 1
Savepoint sp20n3;
SAVEPOINT
Insert into nested_subtx_t1 values(3, 'sub- and nested transactions','a','variable string','2-2-2012',5,'2012-10-10 10:23:54', '2011-10-19 10:23:54+02');
INSERT 0 1
Savepoint sp20n4;
SAVEPOINT
Insert into nested_subtx_t1 values(4, 'sub- and nested transactions','a','variable string','2-2-2012',5,'2012-10-10 10:23:54', '2011-10-19 10:23:54+02');
INSERT 0 1
Update nested_subtx_t1 set a2 = 'New Value' where a1 =4;
UPDATE 1
Release Savepoint sp20n4;
RELEASE
Select a2 from nested_subtx_t1 where a1 = 4;
    a2     
-----------
 New Value
(1 row)

Delete from nested_subtx_t2 where b1>0 ;
DELETE 1
Rollback to sp20n3;
ROLLBACK
Update nested_subtx_t1 set a2 = 'New Value' where a1 =2;
UPDATE 11
Release Savepoint sp20n2;
RELEASE
Select count(*) from nested_subtx_t1;
 count 
-------
    32
(1 row)

Select count(*) from nested_subtx_t2;
 count 
-------
     1
(1 row)

Rollback to sp20;
ROLLBACK
Savepoint sp21;
SAVEPOINT
Insert into nested_subtx_t1 values(21, 'sub- and nested transactions','a','variable string','2-2-2012',5,'2012-10-10 10:23:54', '2011-10-19 10:23:54+02');
INSERT 0 1
Savepoint sp21n1;
SAVEPOINT
Insert into nested_subtx_t1 values(1, 'sub- and nested transactions','a','variable string','2-2-2012',5,'2012-10-10 10:23:54', '2011-10-19 10:23:54+02');
INSERT 0 1
Savepoint sp21n2;
SAVEPOINT
Insert into nested_subtx_t1 values(2, 'sub- and nested transactions','a','variable string','2-2-2012',5,'2012-10-10 10:23:54', '2011-10-19 10:23:54+02');
INSERT 0 1
Savepoint sp21n3;
SAVEPOINT
Insert into nested_subtx_t1 values(3, 'sub- and nested transactions','a','variable string','2-2-2012',5,'2012-10-10 10:23:54', '2011-10-19 10:23:54+02');
INSERT 0 1
Savepoint sp21n4;
SAVEPOINT
Insert into nested_subtx_t1 values(4, 'sub- and nested transactions','a','variable string','2-2-2012',5,'2012-10-10 10:23:54', '2011-10-19 10:23:54+02');
INSERT 0 1
Update nested_subtx_t1 set a2 = 'New Value' where a1 =4;
UPDATE 1
Release Savepoint sp21n4;
RELEASE
Select a2 from nested_subtx_t1 where a1 = 4;
    a2     
-----------
 New Value
(1 row)

Delete from nested_subtx_t2 where b1>0 ;
DELETE 1
Rollback to sp21n3;
ROLLBACK
Update nested_subtx_t1 set a2 = 'New Value' where a1 =2;
UPDATE 11
Release Savepoint sp21n2;
RELEASE
Select count(*) from nested_subtx_t1;
 count 
-------
    33
(1 row)

Select count(*) from nested_subtx_t2;
 count 
-------
     1
(1 row)

Release Savepoint sp21;
RELEASE
Savepoint sp22;
SAVEPOINT
Savepoint sp22n1;
SAVEPOINT
Insert into nested_subtx_t1 values(1, 'sub- and nested transactions','a','variable string','2-2-2012',5,'2012-10-10 10:23:54', '2011-10-19 10:23:54+02');
INSERT 0 1
Savepoint sp22n2;
SAVEPOINT
Insert into nested_subtx_t1 values(2, 'sub- and nested transactions','a','variable string','2-2-2012',5,'2012-10-10 10:23:54', '2011-10-19 10:23:54+02');
INSERT 0 1
Savepoint sp22n3;
SAVEPOINT
Insert into nested_subtx_t1 values(3, 'sub- and nested transactions','a','variable string','2-2-2012',5,'2012-10-10 10:23:54', '2011-10-19 10:23:54+02');
INSERT 0 1
Savepoint sp22n4;
SAVEPOINT
Insert into nested_subtx_t1 values(4, 'sub- and nested transactions','a','variable string','2-2-2012',5,'2012-10-10 10:23:54', '2011-10-19 10:23:54+02');
INSERT 0 1
Update nested_subtx_t1 set a2 = 'New Value' where a1 =4;
UPDATE 1
Release Savepoint sp22n4;
RELEASE
Select a2 from nested_subtx_t1 where a1 = 4;
    a2     
-----------
 New Value
(1 row)

Delete from nested_subtx_t2 where b1>0 ;
DELETE 1
Rollback to sp22n3;
ROLLBACK
Update nested_subtx_t1 set a2 = 'New Value' where a1 =2;
UPDATE 12
Release Savepoint sp22n2;
RELEASE
Select count(*) from nested_subtx_t1;
 count 
-------
    35
(1 row)

Select count(*) from nested_subtx_t2;
 count 
-------
     1
(1 row)

Rollback to sp22;
ROLLBACK
Savepoint sp23;
SAVEPOINT
Insert into nested_subtx_t1 values(23, 'sub- and nested transactions','a','variable string','2-2-2012',5,'2012-10-10 10:23:54', '2011-10-19 10:23:54+02');
INSERT 0 1
Savepoint sp23n1;
SAVEPOINT
Insert into nested_subtx_t1 values(1, 'sub- and nested transactions','a','variable string','2-2-2012',5,'2012-10-10 10:23:54', '2011-10-19 10:23:54+02');
INSERT 0 1
Savepoint sp23n2;
SAVEPOINT
Insert into nested_subtx_t1 values(2, 'sub- and nested transactions','a','variable string','2-2-2012',5,'2012-10-10 10:23:54', '2011-10-19 10:23:54+02');
INSERT 0 1
Savepoint sp23n3;
SAVEPOINT
Insert into nested_subtx_t1 values(3, 'sub- and nested transactions','a','variable string','2-2-2012',5,'2012-10-10 10:23:54', '2011-10-19 10:23:54+02');
INSERT 0 1
Savepoint sp23n4;
SAVEPOINT
Insert into nested_subtx_t1 values(4, 'sub- and nested transactions','a','variable string','2-2-2012',5,'2012-10-10 10:23:54', '2011-10-19 10:23:54+02');
INSERT 0 1
Update nested_subtx_t1 set a2 = 'New Value' where a1 =4;
UPDATE 1
Release Savepoint sp23n4;
RELEASE
Select a2 from nested_subtx_t1 where a1 = 4;
    a2     
-----------
 New Value
(1 row)

Delete from nested_subtx_t2 where b1>0 ;
DELETE 1
Rollback to sp23n3;
ROLLBACK
Update nested_subtx_t1 set a2 = 'New Value' where a1 =2;
UPDATE 12
Release Savepoint sp23n2;
RELEASE
Select count(*) from nested_subtx_t1;
 count 
-------
    36
(1 row)

Select count(*) from nested_subtx_t2;
 count 
-------
     1
(1 row)

Release Savepoint sp23;
RELEASE
Savepoint sp24;
SAVEPOINT
Savepoint sp24n1;
SAVEPOINT
Insert into nested_subtx_t1 values(1, 'sub- and nested transactions','a','variable string','2-2-2012',5,'2012-10-10 10:23:54', '2011-10-19 10:23:54+02');
INSERT 0 1
Savepoint sp24n2;
SAVEPOINT
Insert into nested_subtx_t1 values(2, 'sub- and nested transactions','a','variable string','2-2-2012',5,'2012-10-10 10:23:54', '2011-10-19 10:23:54+02');
INSERT 0 1
Savepoint sp24n3;
SAVEPOINT
Insert into nested_subtx_t1 values(3, 'sub- and nested transactions','a','variable string','2-2-2012',5,'2012-10-10 10:23:54', '2011-10-19 10:23:54+02');
INSERT 0 1
Savepoint sp24n4;
SAVEPOINT
Insert into nested_subtx_t1 values(4, 'sub- and nested transactions','a','variable string','2-2-2012',5,'2012-10-10 10:23:54', '2011-10-19 10:23:54+02');
INSERT 0 1
Update nested_subtx_t1 set a2 = 'New Value' where a1 =4;
UPDATE 1
Release Savepoint sp24n4;
RELEASE
Select a2 from nested_subtx_t1 where a1 = 4;
    a2     
-----------
 New Value
(1 row)

Delete from nested_subtx_t2 where b1>0 ;
DELETE 1
Rollback to sp24n3;
ROLLBACK
Update nested_subtx_t1 set a2 = 'New Value' where a1 =2;
UPDATE 13
Release Savepoint sp24n2;
RELEASE
Select count(*) from nested_subtx_t1;
 count 
-------
    38
(1 row)

Select count(*) from nested_subtx_t2;
 count 
-------
     1
(1 row)

Rollback to sp24;
ROLLBACK
Savepoint sp25;
SAVEPOINT
Insert into nested_subtx_t1 values(25, 'sub- and nested transactions','a','variable string','2-2-2012',5,'2012-10-10 10:23:54', '2011-10-19 10:23:54+02');
INSERT 0 1
Savepoint sp25n1;
SAVEPOINT
Insert into nested_subtx_t1 values(1, 'sub- and nested transactions','a','variable string','2-2-2012',5,'2012-10-10 10:23:54', '2011-10-19 10:23:54+02');
INSERT 0 1
Savepoint sp25n2;
SAVEPOINT
Insert into nested_subtx_t1 values(2, 'sub- and nested transactions','a','variable string','2-2-2012',5,'2012-10-10 10:23:54', '2011-10-19 10:23:54+02');
INSERT 0 1
Savepoint sp25n3;
SAVEPOINT
Insert into nested_subtx_t1 values(3, 'sub- and nested transactions','a','variable string','2-2-2012',5,'2012-10-10 10:23:54', '2011-10-19 10:23:54+02');
INSERT 0 1
Savepoint sp25n4;
SAVEPOINT
Insert into nested_subtx_t1 values(4, 'sub- and nested transactions','a','variable string','2-2-2012',5,'2012-10-10 10:23:54', '2011-10-19 10:23:54+02');
INSERT 0 1
Update nested_subtx_t1 set a2 = 'New Value' where a1 =4;
UPDATE 1
Release Savepoint sp25n4;
RELEASE
Select a2 from nested_subtx_t1 where a1 = 4;
    a2     
-----------
 New Value
(1 row)

Delete from nested_subtx_t2 where b1>0 ;
DELETE 1
Rollback to sp25n3;
ROLLBACK
Update nested_subtx_t1 set a2 = 'New Value' where a1 =2;
UPDATE 13
Release Savepoint sp25n2;
RELEASE
Select count(*) from nested_subtx_t1;
 count 
-------
    39
(1 row)

Select count(*) from nested_subtx_t2;
 count 
-------
     1
(1 row)

Release Savepoint sp25;
RELEASE
Savepoint sp26;
SAVEPOINT
Savepoint sp26n1;
SAVEPOINT
Insert into nested_subtx_t1 values(1, 'sub- and nested transactions','a','variable string','2-2-2012',5,'2012-10-10 10:23:54', '2011-10-19 10:23:54+02');
INSERT 0 1
Savepoint sp26n2;
SAVEPOINT
Insert into nested_subtx_t1 values(2, 'sub- and nested transactions','a','variable string','2-2-2012',5,'2012-10-10 10:23:54', '2011-10-19 10:23:54+02');
INSERT 0 1
Savepoint sp26n3;
SAVEPOINT
Insert into nested_subtx_t1 values(3, 'sub- and nested transactions','a','variable string','2-2-2012',5,'2012-10-10 10:23:54', '2011-10-19 10:23:54+02');
INSERT 0 1
Savepoint sp26n4;
SAVEPOINT
Insert into nested_subtx_t1 values(4, 'sub- and nested transactions','a','variable string','2-2-2012',5,'2012-10-10 10:23:54', '2011-10-19 10:23:54+02');
INSERT 0 1
Update nested_subtx_t1 set a2 = 'New Value' where a1 =4;
UPDATE 1
Release Savepoint sp26n4;
RELEASE
Select a2 from nested_subtx_t1 where a1 = 4;
    a2     
-----------
 New Value
(1 row)

Delete from nested_subtx_t2 where b1>0 ;
DELETE 1
Rollback to sp26n3;
ROLLBACK
Update nested_subtx_t1 set a2 = 'New Value' where a1 =2;
UPDATE 14
Release Savepoint sp26n2;
RELEASE
Select count(*) from nested_subtx_t1;
 count 
-------
    41
(1 row)

Select count(*) from nested_subtx_t2;
 count 
-------
     1
(1 row)

Rollback to sp26;
ROLLBACK
Savepoint sp27;
SAVEPOINT
Insert into nested_subtx_t1 values(27, 'sub- and nested transactions','a','variable string','2-2-2012',5,'2012-10-10 10:23:54', '2011-10-19 10:23:54+02');
INSERT 0 1
Savepoint sp27n1;
SAVEPOINT
Insert into nested_subtx_t1 values(1, 'sub- and nested transactions','a','variable string','2-2-2012',5,'2012-10-10 10:23:54', '2011-10-19 10:23:54+02');
INSERT 0 1
Savepoint sp27n2;
SAVEPOINT
Insert into nested_subtx_t1 values(2, 'sub- and nested transactions','a','variable string','2-2-2012',5,'2012-10-10 10:23:54', '2011-10-19 10:23:54+02');
INSERT 0 1
Savepoint sp27n3;
SAVEPOINT
Insert into nested_subtx_t1 values(3, 'sub- and nested transactions','a','variable string','2-2-2012',5,'2012-10-10 10:23:54', '2011-10-19 10:23:54+02');
INSERT 0 1
Savepoint sp27n4;
SAVEPOINT
Insert into nested_subtx_t1 values(4, 'sub- and nested transactions','a','variable string','2-2-2012',5,'2012-10-10 10:23:54', '2011-10-19 10:23:54+02');
INSERT 0 1
Update nested_subtx_t1 set a2 = 'New Value' where a1 =4;
UPDATE 1
Release Savepoint sp27n4;
RELEASE
Select a2 from nested_subtx_t1 where a1 = 4;
    a2     
-----------
 New Value
(1 row)

Delete from nested_subtx_t2 where b1>0 ;
DELETE 1
Rollback to sp27n3;
ROLLBACK
Update nested_subtx_t1 set a2 = 'New Value' where a1 =2;
UPDATE 14
Release Savepoint sp27n2;
RELEASE
Select count(*) from nested_subtx_t1;
 count 
-------
    42
(1 row)

Select count(*) from nested_subtx_t2;
 count 
-------
     1
(1 row)

Release Savepoint sp27;
RELEASE
Savepoint sp28;
SAVEPOINT
Savepoint sp28n1;
SAVEPOINT
Insert into nested_subtx_t1 values(1, 'sub- and nested transactions','a','variable string','2-2-2012',5,'2012-10-10 10:23:54', '2011-10-19 10:23:54+02');
INSERT 0 1
Savepoint sp28n2;
SAVEPOINT
Insert into nested_subtx_t1 values(2, 'sub- and nested transactions','a','variable string','2-2-2012',5,'2012-10-10 10:23:54', '2011-10-19 10:23:54+02');
INSERT 0 1
Savepoint sp28n3;
SAVEPOINT
Insert into nested_subtx_t1 values(3, 'sub- and nested transactions','a','variable string','2-2-2012',5,'2012-10-10 10:23:54', '2011-10-19 10:23:54+02');
INSERT 0 1
Savepoint sp28n4;
SAVEPOINT
Insert into nested_subtx_t1 values(4, 'sub- and nested transactions','a','variable string','2-2-2012',5,'2012-10-10 10:23:54', '2011-10-19 10:23:54+02');
INSERT 0 1
Update nested_subtx_t1 set a2 = 'New Value' where a1 =4;
UPDATE 1
Release Savepoint sp28n4;
RELEASE
Select a2 from nested_subtx_t1 where a1 = 4;
    a2     
-----------
 New Value
(1 row)

Delete from nested_subtx_t2 where b1>0 ;
DELETE 1
Rollback to sp28n3;
ROLLBACK
Update nested_subtx_t1 set a2 = 'New Value' where a1 =2;
UPDATE 15
Release Savepoint sp28n2;
RELEASE
Select count(*) from nested_subtx_t1;
 count 
-------
    44
(1 row)

Select count(*) from nested_subtx_t2;
 count 
-------
     1
(1 row)

Rollback to sp28;
ROLLBACK
Savepoint sp29;
SAVEPOINT
Insert into nested_subtx_t1 values(29, 'sub- and nested transactions','a','variable string','2-2-2012',5,'2012-10-10 10:23:54', '2011-10-19 10:23:54+02');
INSERT 0 1
Savepoint sp29n1;
SAVEPOINT
Insert into nested_subtx_t1 values(1, 'sub- and nested transactions','a','variable string','2-2-2012',5,'2012-10-10 10:23:54', '2011-10-19 10:23:54+02');
INSERT 0 1
Savepoint sp29n2;
SAVEPOINT
Insert into nested_subtx_t1 values(2, 'sub- and nested transactions','a','variable string','2-2-2012',5,'2012-10-10 10:23:54', '2011-10-19 10:23:54+02');
INSERT 0 1
Savepoint sp29n3;
SAVEPOINT
Insert into nested_subtx_t1 values(3, 'sub- and nested transactions','a','variable string','2-2-2012',5,'2012-10-10 10:23:54', '2011-10-19 10:23:54+02');
INSERT 0 1
Savepoint sp29n4;
SAVEPOINT
Insert into nested_subtx_t1 values(4, 'sub- and nested transactions','a','variable string','2-2-2012',5,'2012-10-10 10:23:54', '2011-10-19 10:23:54+02');
INSERT 0 1
Update nested_subtx_t1 set a2 = 'New Value' where a1 =4;
UPDATE 1
Release Savepoint sp29n4;
RELEASE
Select a2 from nested_subtx_t1 where a1 = 4;
    a2     
-----------
 New Value
(1 row)

Delete from nested_subtx_t2 where b1>0 ;
DELETE 1
Rollback to sp29n3;
ROLLBACK
Update nested_subtx_t1 set a2 = 'New Value' where a1 =2;
UPDATE 15
Release Savepoint sp29n2;
RELEASE
Select count(*) from nested_subtx_t1;
 count 
-------
    45
(1 row)

Select count(*) from nested_subtx_t2;
 count 
-------
     1
(1 row)

Release Savepoint sp29;
RELEASE
Savepoint sp30;
SAVEPOINT
Savepoint sp30n1;
SAVEPOINT
Insert into nested_subtx_t1 values(1, 'sub- and nested transactions','a','variable string','2-2-2012',5,'2012-10-10 10:23:54', '2011-10-19 10:23:54+02');
INSERT 0 1
Savepoint sp30n2;
SAVEPOINT
Insert into nested_subtx_t1 values(2, 'sub- and nested transactions','a','variable string','2-2-2012',5,'2012-10-10 10:23:54', '2011-10-19 10:23:54+02');
INSERT 0 1
Savepoint sp30n3;
SAVEPOINT
Insert into nested_subtx_t1 values(3, 'sub- and nested transactions','a','variable string','2-2-2012',5,'2012-10-10 10:23:54', '2011-10-19 10:23:54+02');
INSERT 0 1
Savepoint sp30n4;
SAVEPOINT
Insert into nested_subtx_t1 values(4, 'sub- and nested transactions','a','variable string','2-2-2012',5,'2012-10-10 10:23:54', '2011-10-19 10:23:54+02');
INSERT 0 1
Update nested_subtx_t1 set a2 = 'New Value' where a1 =4;
UPDATE 1
Release Savepoint sp30n4;
RELEASE
Select a2 from nested_subtx_t1 where a1 = 4;
    a2     
-----------
 New Value
(1 row)

Delete from nested_subtx_t2 where b1>0 ;
DELETE 1
Rollback to sp30n3;
ROLLBACK
Update nested_subtx_t1 set a2 = 'New Value' where a1 =2;
UPDATE 16
Release Savepoint sp30n2;
RELEASE
Select count(*) from nested_subtx_t1;
 count 
-------
    47
(1 row)

Select count(*) from nested_subtx_t2;
 count 
-------
     1
(1 row)

Rollback to sp30;
ROLLBACK
Savepoint sp31;
SAVEPOINT
Insert into nested_subtx_t1 values(31, 'sub- and nested transactions','a','variable string','2-2-2012',5,'2012-10-10 10:23:54', '2011-10-19 10:23:54+02');
INSERT 0 1
Savepoint sp31n1;
SAVEPOINT
Insert into nested_subtx_t1 values(1, 'sub- and nested transactions','a','variable string','2-2-2012',5,'2012-10-10 10:23:54', '2011-10-19 10:23:54+02');
INSERT 0 1
Savepoint sp31n2;
SAVEPOINT
Insert into nested_subtx_t1 values(2, 'sub- and nested transactions','a','variable string','2-2-2012',5,'2012-10-10 10:23:54', '2011-10-19 10:23:54+02');
INSERT 0 1
Savepoint sp31n3;
SAVEPOINT
Insert into nested_subtx_t1 values(3, 'sub- and nested transactions','a','variable string','2-2-2012',5,'2012-10-10 10:23:54', '2011-10-19 10:23:54+02');
INSERT 0 1
Savepoint sp31n4;
SAVEPOINT
Insert into nested_subtx_t1 values(4, 'sub- and nested transactions','a','variable string','2-2-2012',5,'2012-10-10 10:23:54', '2011-10-19 10:23:54+02');
INSERT 0 1
Update nested_subtx_t1 set a2 = 'New Value' where a1 =4;
UPDATE 1
Release Savepoint sp31n4;
RELEASE
Select a2 from nested_subtx_t1 where a1 = 4;
    a2     
-----------
 New Value
(1 row)

Delete from nested_subtx_t2 where b1>0 ;
DELETE 1
Rollback to sp31n3;
ROLLBACK
Update nested_subtx_t1 set a2 = 'New Value' where a1 =2;
UPDATE 16
Release Savepoint sp31n2;
RELEASE
Select count(*) from nested_subtx_t1;
 count 
-------
    48
(1 row)

Select count(*) from nested_subtx_t2;
 count 
-------
     1
(1 row)

Release Savepoint sp31;
RELEASE
Savepoint sp32;
SAVEPOINT
Savepoint sp32n1;
SAVEPOINT
Insert into nested_subtx_t1 values(1, 'sub- and nested transactions','a','variable string','2-2-2012',5,'2012-10-10 10:23:54', '2011-10-19 10:23:54+02');
INSERT 0 1
Savepoint sp32n2;
SAVEPOINT
Insert into nested_subtx_t1 values(2, 'sub- and nested transactions','a','variable string','2-2-2012',5,'2012-10-10 10:23:54', '2011-10-19 10:23:54+02');
INSERT 0 1
Savepoint sp32n3;
SAVEPOINT
Insert into nested_subtx_t1 values(3, 'sub- and nested transactions','a','variable string','2-2-2012',5,'2012-10-10 10:23:54', '2011-10-19 10:23:54+02');
INSERT 0 1
Savepoint sp32n4;
SAVEPOINT
Insert into nested_subtx_t1 values(4, 'sub- and nested transactions','a','variable string','2-2-2012',5,'2012-10-10 10:23:54', '2011-10-19 10:23:54+02');
INSERT 0 1
Update nested_subtx_t1 set a2 = 'New Value' where a1 =4;
UPDATE 1
Release Savepoint sp32n4;
RELEASE
Select a2 from nested_subtx_t1 where a1 = 4;
    a2     
-----------
 New Value
(1 row)

Delete from nested_subtx_t2 where b1>0 ;
DELETE 1
Rollback to sp32n3;
ROLLBACK
Update nested_subtx_t1 set a2 = 'New Value' where a1 =2;
UPDATE 17
Release Savepoint sp32n2;
RELEASE
Select count(*) from nested_subtx_t1;
 count 
-------
    50
(1 row)

Select count(*) from nested_subtx_t2;
 count 
-------
     1
(1 row)

Rollback to sp32;
ROLLBACK
Savepoint sp33;
SAVEPOINT
Insert into nested_subtx_t1 values(33, 'sub- and nested transactions','a','variable string','2-2-2012',5,'2012-10-10 10:23:54', '2011-10-19 10:23:54+02');
INSERT 0 1
Savepoint sp33n1;
SAVEPOINT
Insert into nested_subtx_t1 values(1, 'sub- and nested transactions','a','variable string','2-2-2012',5,'2012-10-10 10:23:54', '2011-10-19 10:23:54+02');
INSERT 0 1
Savepoint sp33n2;
SAVEPOINT
Insert into nested_subtx_t1 values(2, 'sub- and nested transactions','a','variable string','2-2-2012',5,'2012-10-10 10:23:54', '2011-10-19 10:23:54+02');
INSERT 0 1
Savepoint sp33n3;
SAVEPOINT
Insert into nested_subtx_t1 values(3, 'sub- and nested transactions','a','variable string','2-2-2012',5,'2012-10-10 10:23:54', '2011-10-19 10:23:54+02');
INSERT 0 1
Savepoint sp33n4;
SAVEPOINT
Insert into nested_subtx_t1 values(4, 'sub- and nested transactions','a','variable string','2-2-2012',5,'2012-10-10 10:23:54', '2011-10-19 10:23:54+02');
INSERT 0 1
Update nested_subtx_t1 set a2 = 'New Value' where a1 =4;
UPDATE 1
Release Savepoint sp33n4;
RELEASE
Select a2 from nested_subtx_t1 where a1 = 4;
    a2     
-----------
 New Value
(1 row)

Delete from nested_subtx_t2 where b1>0 ;
DELETE 1
Rollback to sp33n3;
ROLLBACK
Update nested_subtx_t1 set a2 = 'New Value' where a1 =2;
UPDATE 17
Release Savepoint sp33n2;
RELEASE
Select count(*) from nested_subtx_t1;
 count 
-------
    51
(1 row)

Select count(*) from nested_subtx_t2;
 count 
-------
     1
(1 row)

Release Savepoint sp33;
RELEASE
Savepoint sp34;
SAVEPOINT
Savepoint sp34n1;
SAVEPOINT
Insert into nested_subtx_t1 values(1, 'sub- and nested transactions','a','variable string','2-2-2012',5,'2012-10-10 10:23:54', '2011-10-19 10:23:54+02');
INSERT 0 1
Savepoint sp34n2;
SAVEPOINT
Insert into nested_subtx_t1 values(2, 'sub- and nested transactions','a','variable string','2-2-2012',5,'2012-10-10 10:23:54', '2011-10-19 10:23:54+02');
INSERT 0 1
Savepoint sp34n3;
SAVEPOINT
Insert into nested_subtx_t1 values(3, 'sub- and nested transactions','a','variable string','2-2-2012',5,'2012-10-10 10:23:54', '2011-10-19 10:23:54+02');
INSERT 0 1
Savepoint sp34n4;
SAVEPOINT
Insert into nested_subtx_t1 values(4, 'sub- and nested transactions','a','variable string','2-2-2012',5,'2012-10-10 10:23:54', '2011-10-19 10:23:54+02');
INSERT 0 1
Update nested_subtx_t1 set a2 = 'New Value' where a1 =4;
UPDATE 1
Release Savepoint sp34n4;
RELEASE
Select a2 from nested_subtx_t1 where a1 = 4;
    a2     
-----------
 New Value
(1 row)

Delete from nested_subtx_t2 where b1>0 ;
DELETE 1
Rollback to sp34n3;
ROLLBACK
Update nested_subtx_t1 set a2 = 'New Value' where a1 =2;
UPDATE 18
Release Savepoint sp34n2;
RELEASE
Select count(*) from nested_subtx_t1;
 count 
-------
    53
(1 row)

Select count(*) from nested_subtx_t2;
 count 
-------
     1
(1 row)

Rollback to sp34;
ROLLBACK
Savepoint sp35;
SAVEPOINT
Insert into nested_subtx_t1 values(35, 'sub- and nested transactions','a','variable string','2-2-2012',5,'2012-10-10 10:23:54', '2011-10-19 10:23:54+02');
INSERT 0 1
Savepoint sp35n1;
SAVEPOINT
Insert into nested_subtx_t1 values(1, 'sub- and nested transactions','a','variable string','2-2-2012',5,'2012-10-10 10:23:54', '2011-10-19 10:23:54+02');
INSERT 0 1
Savepoint sp35n2;
SAVEPOINT
Insert into nested_subtx_t1 values(2, 'sub- and nested transactions','a','variable string','2-2-2012',5,'2012-10-10 10:23:54', '2011-10-19 10:23:54+02');
INSERT 0 1
Savepoint sp35n3;
SAVEPOINT
Insert into nested_subtx_t1 values(3, 'sub- and nested transactions','a','variable string','2-2-2012',5,'2012-10-10 10:23:54', '2011-10-19 10:23:54+02');
INSERT 0 1
Savepoint sp35n4;
SAVEPOINT
Insert into nested_subtx_t1 values(4, 'sub- and nested transactions','a','variable string','2-2-2012',5,'2012-10-10 10:23:54', '2011-10-19 10:23:54+02');
INSERT 0 1
Update nested_subtx_t1 set a2 = 'New Value' where a1 =4;
UPDATE 1
Release Savepoint sp35n4;
RELEASE
Select a2 from nested_subtx_t1 where a1 = 4;
    a2     
-----------
 New Value
(1 row)

Delete from nested_subtx_t2 where b1>0 ;
DELETE 1
Rollback to sp35n3;
ROLLBACK
Update nested_subtx_t1 set a2 = 'New Value' where a1 =2;
UPDATE 18
Release Savepoint sp35n2;
RELEASE
Select count(*) from nested_subtx_t1;
 count 
-------
    54
(1 row)

Select count(*) from nested_subtx_t2;
 count 
-------
     1
(1 row)

Release Savepoint sp35;
RELEASE
Savepoint sp36;
SAVEPOINT
Savepoint sp36n1;
SAVEPOINT
Insert into nested_subtx_t1 values(1, 'sub- and nested transactions','a','variable string','2-2-2012',5,'2012-10-10 10:23:54', '2011-10-19 10:23:54+02');
INSERT 0 1
Savepoint sp36n2;
SAVEPOINT
Insert into nested_subtx_t1 values(2, 'sub- and nested transactions','a','variable string','2-2-2012',5,'2012-10-10 10:23:54', '2011-10-19 10:23:54+02');
INSERT 0 1
Savepoint sp36n3;
SAVEPOINT
Insert into nested_subtx_t1 values(3, 'sub- and nested transactions','a','variable string','2-2-2012',5,'2012-10-10 10:23:54', '2011-10-19 10:23:54+02');
INSERT 0 1
Savepoint sp36n4;
SAVEPOINT
Insert into nested_subtx_t1 values(4, 'sub- and nested transactions','a','variable string','2-2-2012',5,'2012-10-10 10:23:54', '2011-10-19 10:23:54+02');
INSERT 0 1
Update nested_subtx_t1 set a2 = 'New Value' where a1 =4;
UPDATE 1
Release Savepoint sp36n4;
RELEASE
Select a2 from nested_subtx_t1 where a1 = 4;
    a2     
-----------
 New Value
(1 row)

Delete from nested_subtx_t2 where b1>0 ;
DELETE 1
Rollback to sp36n3;
ROLLBACK
Update nested_subtx_t1 set a2 = 'New Value' where a1 =2;
UPDATE 19
Release Savepoint sp36n2;
RELEASE
Select count(*) from nested_subtx_t1;
 count 
-------
    56
(1 row)

Select count(*) from nested_subtx_t2;
 count 
-------
     1
(1 row)

Rollback to sp36;
ROLLBACK
Savepoint sp37;
SAVEPOINT
Insert into nested_subtx_t1 values(37, 'sub- and nested transactions','a','variable string','2-2-2012',5,'2012-10-10 10:23:54', '2011-10-19 10:23:54+02');
INSERT 0 1
Savepoint sp37n1;
SAVEPOINT
Insert into nested_subtx_t1 values(1, 'sub- and nested transactions','a','variable string','2-2-2012',5,'2012-10-10 10:23:54', '2011-10-19 10:23:54+02');
INSERT 0 1
Savepoint sp37n2;
SAVEPOINT
Insert into nested_subtx_t1 values(2, 'sub- and nested transactions','a','variable string','2-2-2012',5,'2012-10-10 10:23:54', '2011-10-19 10:23:54+02');
INSERT 0 1
Savepoint sp37n3;
SAVEPOINT
Insert into nested_subtx_t1 values(3, 'sub- and nested transactions','a','variable string','2-2-2012',5,'2012-10-10 10:23:54', '2011-10-19 10:23:54+02');
INSERT 0 1
Savepoint sp37n4;
SAVEPOINT
Insert into nested_subtx_t1 values(4, 'sub- and nested transactions','a','variable string','2-2-2012',5,'2012-10-10 10:23:54', '2011-10-19 10:23:54+02');
INSERT 0 1
Update nested_subtx_t1 set a2 = 'New Value' where a1 =4;
UPDATE 1
Release Savepoint sp37n4;
RELEASE
Select a2 from nested_subtx_t1 where a1 = 4;
    a2     
-----------
 New Value
(1 row)

Delete from nested_subtx_t2 where b1>0 ;
DELETE 1
Rollback to sp37n3;
ROLLBACK
Update nested_subtx_t1 set a2 = 'New Value' where a1 =2;
UPDATE 19
Release Savepoint sp37n2;
RELEASE
Select count(*) from nested_subtx_t1;
 count 
-------
    57
(1 row)

Select count(*) from nested_subtx_t2;
 count 
-------
     1
(1 row)

Release Savepoint sp37;
RELEASE
Savepoint sp38;
SAVEPOINT
Savepoint sp38n1;
SAVEPOINT
Insert into nested_subtx_t1 values(1, 'sub- and nested transactions','a','variable string','2-2-2012',5,'2012-10-10 10:23:54', '2011-10-19 10:23:54+02');
INSERT 0 1
Savepoint sp38n2;
SAVEPOINT
Insert into nested_subtx_t1 values(2, 'sub- and nested transactions','a','variable string','2-2-2012',5,'2012-10-10 10:23:54', '2011-10-19 10:23:54+02');
INSERT 0 1
Savepoint sp38n3;
SAVEPOINT
Insert into nested_subtx_t1 values(3, 'sub- and nested transactions','a','variable string','2-2-2012',5,'2012-10-10 10:23:54', '2011-10-19 10:23:54+02');
INSERT 0 1
Savepoint sp38n4;
SAVEPOINT
Insert into nested_subtx_t1 values(4, 'sub- and nested transactions','a','variable string','2-2-2012',5,'2012-10-10 10:23:54', '2011-10-19 10:23:54+02');
INSERT 0 1
Update nested_subtx_t1 set a2 = 'New Value' where a1 =4;
UPDATE 1
Release Savepoint sp38n4;
RELEASE
Select a2 from nested_subtx_t1 where a1 = 4;
    a2     
-----------
 New Value
(1 row)

Delete from nested_subtx_t2 where b1>0 ;
DELETE 1
Rollback to sp38n3;
ROLLBACK
Update nested_subtx_t1 set a2 = 'New Value' where a1 =2;
UPDATE 20
Release Savepoint sp38n2;
RELEASE
Select count(*) from nested_subtx_t1;
 count 
-------
    59
(1 row)

Select count(*) from nested_subtx_t2;
 count 
-------
     1
(1 row)

Rollback to sp38;
ROLLBACK
Savepoint sp39;
SAVEPOINT
Insert into nested_subtx_t1 values(39, 'sub- and nested transactions','a','variable string','2-2-2012',5,'2012-10-10 10:23:54', '2011-10-19 10:23:54+02');
INSERT 0 1
Savepoint sp39n1;
SAVEPOINT
Insert into nested_subtx_t1 values(1, 'sub- and nested transactions','a','variable string','2-2-2012',5,'2012-10-10 10:23:54', '2011-10-19 10:23:54+02');
INSERT 0 1
Savepoint sp39n2;
SAVEPOINT
Insert into nested_subtx_t1 values(2, 'sub- and nested transactions','a','variable string','2-2-2012',5,'2012-10-10 10:23:54', '2011-10-19 10:23:54+02');
INSERT 0 1
Savepoint sp39n3;
SAVEPOINT
Insert into nested_subtx_t1 values(3, 'sub- and nested transactions','a','variable string','2-2-2012',5,'2012-10-10 10:23:54', '2011-10-19 10:23:54+02');
INSERT 0 1
Savepoint sp39n4;
SAVEPOINT
Insert into nested_subtx_t1 values(4, 'sub- and nested transactions','a','variable string','2-2-2012',5,'2012-10-10 10:23:54', '2011-10-19 10:23:54+02');
INSERT 0 1
Update nested_subtx_t1 set a2 = 'New Value' where a1 =4;
UPDATE 1
Release Savepoint sp39n4;
RELEASE
Select a2 from nested_subtx_t1 where a1 = 4;
    a2     
-----------
 New Value
(1 row)

Delete from nested_subtx_t2 where b1>0 ;
DELETE 1
Rollback to sp39n3;
ROLLBACK
Update nested_subtx_t1 set a2 = 'New Value' where a1 =2;
UPDATE 20
Release Savepoint sp39n2;
RELEASE
Select count(*) from nested_subtx_t1;
 count 
-------
    60
(1 row)

Select count(*) from nested_subtx_t2;
 count 
-------
     1
(1 row)

Release Savepoint sp39;
RELEASE
Savepoint sp40;
SAVEPOINT
Savepoint sp40n1;
SAVEPOINT
Insert into nested_subtx_t1 values(1, 'sub- and nested transactions','a','variable string','2-2-2012',5,'2012-10-10 10:23:54', '2011-10-19 10:23:54+02');
INSERT 0 1
Savepoint sp40n2;
SAVEPOINT
Insert into nested_subtx_t1 values(2, 'sub- and nested transactions','a','variable string','2-2-2012',5,'2012-10-10 10:23:54', '2011-10-19 10:23:54+02');
INSERT 0 1
Savepoint sp40n3;
SAVEPOINT
Insert into nested_subtx_t1 values(3, 'sub- and nested transactions','a','variable string','2-2-2012',5,'2012-10-10 10:23:54', '2011-10-19 10:23:54+02');
INSERT 0 1
Savepoint sp40n4;
SAVEPOINT
Insert into nested_subtx_t1 values(4, 'sub- and nested transactions','a','variable string','2-2-2012',5,'2012-10-10 10:23:54', '2011-10-19 10:23:54+02');
INSERT 0 1
Update nested_subtx_t1 set a2 = 'New Value' where a1 =4;
UPDATE 1
Release Savepoint sp40n4;
RELEASE
Select a2 from nested_subtx_t1 where a1 = 4;
    a2     
-----------
 New Value
(1 row)

Delete from nested_subtx_t2 where b1>0 ;
DELETE 1
Rollback to sp40n3;
ROLLBACK
Update nested_subtx_t1 set a2 = 'New Value' where a1 =2;
UPDATE 21
Release Savepoint sp40n2;
RELEASE
Select count(*) from nested_subtx_t1;
 count 
-------
    62
(1 row)

Select count(*) from nested_subtx_t2;
 count 
-------
     1
(1 row)

Rollback to sp40;
ROLLBACK
Savepoint sp41;
SAVEPOINT
Insert into nested_subtx_t1 values(41, 'sub- and nested transactions','a','variable string','2-2-2012',5,'2012-10-10 10:23:54', '2011-10-19 10:23:54+02');
INSERT 0 1
Savepoint sp41n1;
SAVEPOINT
Insert into nested_subtx_t1 values(1, 'sub- and nested transactions','a','variable string','2-2-2012',5,'2012-10-10 10:23:54', '2011-10-19 10:23:54+02');
INSERT 0 1
Savepoint sp41n2;
SAVEPOINT
Insert into nested_subtx_t1 values(2, 'sub- and nested transactions','a','variable string','2-2-2012',5,'2012-10-10 10:23:54', '2011-10-19 10:23:54+02');
INSERT 0 1
Savepoint sp41n3;
SAVEPOINT
Insert into nested_subtx_t1 values(3, 'sub- and nested transactions','a','variable string','2-2-2012',5,'2012-10-10 10:23:54', '2011-10-19 10:23:54+02');
INSERT 0 1
Savepoint sp41n4;
SAVEPOINT
Insert into nested_subtx_t1 values(4, 'sub- and nested transactions','a','variable string','2-2-2012',5,'2012-10-10 10:23:54', '2011-10-19 10:23:54+02');
INSERT 0 1
Update nested_subtx_t1 set a2 = 'New Value' where a1 =4;
UPDATE 1
Release Savepoint sp41n4;
RELEASE
Select a2 from nested_subtx_t1 where a1 = 4;
    a2     
-----------
 New Value
(1 row)

Delete from nested_subtx_t2 where b1>0 ;
DELETE 1
Rollback to sp41n3;
ROLLBACK
Update nested_subtx_t1 set a2 = 'New Value' where a1 =2;
UPDATE 21
Release Savepoint sp41n2;
RELEASE
Select count(*) from nested_subtx_t1;
 count 
-------
    63
(1 row)

Select count(*) from nested_subtx_t2;
 count 
-------
     1
(1 row)

Release Savepoint sp41;
RELEASE
Savepoint sp42;
SAVEPOINT
Savepoint sp42n1;
SAVEPOINT
Insert into nested_subtx_t1 values(1, 'sub- and nested transactions','a','variable string','2-2-2012',5,'2012-10-10 10:23:54', '2011-10-19 10:23:54+02');
INSERT 0 1
Savepoint sp42n2;
SAVEPOINT
Insert into nested_subtx_t1 values(2, 'sub- and nested transactions','a','variable string','2-2-2012',5,'2012-10-10 10:23:54', '2011-10-19 10:23:54+02');
INSERT 0 1
Savepoint sp42n3;
SAVEPOINT
Insert into nested_subtx_t1 values(3, 'sub- and nested transactions','a','variable string','2-2-2012',5,'2012-10-10 10:23:54', '2011-10-19 10:23:54+02');
INSERT 0 1
Savepoint sp42n4;
SAVEPOINT
Insert into nested_subtx_t1 values(4, 'sub- and nested transactions','a','variable string','2-2-2012',5,'2012-10-10 10:23:54', '2011-10-19 10:23:54+02');
INSERT 0 1
Update nested_subtx_t1 set a2 = 'New Value' where a1 =4;
UPDATE 1
Release Savepoint sp42n4;
RELEASE
Select a2 from nested_subtx_t1 where a1 = 4;
    a2     
-----------
 New Value
(1 row)

Delete from nested_subtx_t2 where b1>0 ;
DELETE 1
Rollback to sp42n3;
ROLLBACK
Update nested_subtx_t1 set a2 = 'New Value' where a1 =2;
UPDATE 22
Release Savepoint sp42n2;
RELEASE
Select count(*) from nested_subtx_t1;
 count 
-------
    65
(1 row)

Select count(*) from nested_subtx_t2;
 count 
-------
     1
(1 row)

Rollback to sp42;
ROLLBACK
Savepoint sp43;
SAVEPOINT
Insert into nested_subtx_t1 values(43, 'sub- and nested transactions','a','variable string','2-2-2012',5,'2012-10-10 10:23:54', '2011-10-19 10:23:54+02');
INSERT 0 1
Savepoint sp43n1;
SAVEPOINT
Insert into nested_subtx_t1 values(1, 'sub- and nested transactions','a','variable string','2-2-2012',5,'2012-10-10 10:23:54', '2011-10-19 10:23:54+02');
INSERT 0 1
Savepoint sp43n2;
SAVEPOINT
Insert into nested_subtx_t1 values(2, 'sub- and nested transactions','a','variable string','2-2-2012',5,'2012-10-10 10:23:54', '2011-10-19 10:23:54+02');
INSERT 0 1
Savepoint sp43n3;
SAVEPOINT
Insert into nested_subtx_t1 values(3, 'sub- and nested transactions','a','variable string','2-2-2012',5,'2012-10-10 10:23:54', '2011-10-19 10:23:54+02');
INSERT 0 1
Savepoint sp43n4;
SAVEPOINT
Insert into nested_subtx_t1 values(4, 'sub- and nested transactions','a','variable string','2-2-2012',5,'2012-10-10 10:23:54', '2011-10-19 10:23:54+02');
INSERT 0 1
Update nested_subtx_t1 set a2 = 'New Value' where a1 =4;
UPDATE 1
Release Savepoint sp43n4;
RELEASE
Select a2 from nested_subtx_t1 where a1 = 4;
    a2     
-----------
 New Value
(1 row)

Delete from nested_subtx_t2 where b1>0 ;
DELETE 1
Rollback to sp43n3;
ROLLBACK
Update nested_subtx_t1 set a2 = 'New Value' where a1 =2;
UPDATE 22
Release Savepoint sp43n2;
RELEASE
Select count(*) from nested_subtx_t1;
 count 
-------
    66
(1 row)

Select count(*) from nested_subtx_t2;
 count 
-------
     1
(1 row)

Release Savepoint sp43;
RELEASE
Savepoint sp44;
SAVEPOINT
Savepoint sp44n1;
SAVEPOINT
Insert into nested_subtx_t1 values(1, 'sub- and nested transactions','a','variable string','2-2-2012',5,'2012-10-10 10:23:54', '2011-10-19 10:23:54+02');
INSERT 0 1
Savepoint sp44n2;
SAVEPOINT
Insert into nested_subtx_t1 values(2, 'sub- and nested transactions','a','variable string','2-2-2012',5,'2012-10-10 10:23:54', '2011-10-19 10:23:54+02');
INSERT 0 1
Savepoint sp44n3;
SAVEPOINT
Insert into nested_subtx_t1 values(3, 'sub- and nested transactions','a','variable string','2-2-2012',5,'2012-10-10 10:23:54', '2011-10-19 10:23:54+02');
INSERT 0 1
Savepoint sp44n4;
SAVEPOINT
Insert into nested_subtx_t1 values(4, 'sub- and nested transactions','a','variable string','2-2-2012',5,'2012-10-10 10:23:54', '2011-10-19 10:23:54+02');
INSERT 0 1
Update nested_subtx_t1 set a2 = 'New Value' where a1 =4;
UPDATE 1
Release Savepoint sp44n4;
RELEASE
Select a2 from nested_subtx_t1 where a1 = 4;
    a2     
-----------
 New Value
(1 row)

Delete from nested_subtx_t2 where b1>0 ;
DELETE 1
Rollback to sp44n3;
ROLLBACK
Update nested_subtx_t1 set a2 = 'New Value' where a1 =2;
UPDATE 23
Release Savepoint sp44n2;
RELEASE
Select count(*) from nested_subtx_t1;
 count 
-------
    68
(1 row)

Select count(*) from nested_subtx_t2;
 count 
-------
     1
(1 row)

Rollback to sp44;
ROLLBACK
Savepoint sp45;
SAVEPOINT
Insert into nested_subtx_t1 values(45, 'sub- and nested transactions','a','variable string','2-2-2012',5,'2012-10-10 10:23:54', '2011-10-19 10:23:54+02');
INSERT 0 1
Savepoint sp45n1;
SAVEPOINT
Insert into nested_subtx_t1 values(1, 'sub- and nested transactions','a','variable string','2-2-2012',5,'2012-10-10 10:23:54', '2011-10-19 10:23:54+02');
INSERT 0 1
Savepoint sp45n2;
SAVEPOINT
Insert into nested_subtx_t1 values(2, 'sub- and nested transactions','a','variable string','2-2-2012',5,'2012-10-10 10:23:54', '2011-10-19 10:23:54+02');
INSERT 0 1
Savepoint sp45n3;
SAVEPOINT
Insert into nested_subtx_t1 values(3, 'sub- and nested transactions','a','variable string','2-2-2012',5,'2012-10-10 10:23:54', '2011-10-19 10:23:54+02');
INSERT 0 1
Savepoint sp45n4;
SAVEPOINT
Insert into nested_subtx_t1 values(4, 'sub- and nested transactions','a','variable string','2-2-2012',5,'2012-10-10 10:23:54', '2011-10-19 10:23:54+02');
INSERT 0 1
Update nested_subtx_t1 set a2 = 'New Value' where a1 =4;
UPDATE 1
Release Savepoint sp45n4;
RELEASE
Select a2 from nested_subtx_t1 where a1 = 4;
    a2     
-----------
 New Value
(1 row)

Delete from nested_subtx_t2 where b1>0 ;
DELETE 1
Rollback to sp45n3;
ROLLBACK
Update nested_subtx_t1 set a2 = 'New Value' where a1 =2;
UPDATE 23
Release Savepoint sp45n2;
RELEASE
Select count(*) from nested_subtx_t1;
 count 
-------
    69
(1 row)

Select count(*) from nested_subtx_t2;
 count 
-------
     1
(1 row)

Release Savepoint sp45;
RELEASE
Savepoint sp46;
SAVEPOINT
Savepoint sp46n1;
SAVEPOINT
Insert into nested_subtx_t1 values(1, 'sub- and nested transactions','a','variable string','2-2-2012',5,'2012-10-10 10:23:54', '2011-10-19 10:23:54+02');
INSERT 0 1
Savepoint sp46n2;
SAVEPOINT
Insert into nested_subtx_t1 values(2, 'sub- and nested transactions','a','variable string','2-2-2012',5,'2012-10-10 10:23:54', '2011-10-19 10:23:54+02');
INSERT 0 1
Savepoint sp46n3;
SAVEPOINT
Insert into nested_subtx_t1 values(3, 'sub- and nested transactions','a','variable string','2-2-2012',5,'2012-10-10 10:23:54', '2011-10-19 10:23:54+02');
INSERT 0 1
Savepoint sp46n4;
SAVEPOINT
Insert into nested_subtx_t1 values(4, 'sub- and nested transactions','a','variable string','2-2-2012',5,'2012-10-10 10:23:54', '2011-10-19 10:23:54+02');
INSERT 0 1
Update nested_subtx_t1 set a2 = 'New Value' where a1 =4;
UPDATE 1
Release Savepoint sp46n4;
RELEASE
Select a2 from nested_subtx_t1 where a1 = 4;
    a2     
-----------
 New Value
(1 row)

Delete from nested_subtx_t2 where b1>0 ;
DELETE 1
Rollback to sp46n3;
ROLLBACK
Update nested_subtx_t1 set a2 = 'New Value' where a1 =2;
UPDATE 24
Release Savepoint sp46n2;
RELEASE
Select count(*) from nested_subtx_t1;
 count 
-------
    71
(1 row)

Select count(*) from nested_subtx_t2;
 count 
-------
     1
(1 row)

Rollback to sp46;
ROLLBACK
Savepoint sp47;
SAVEPOINT
Insert into nested_subtx_t1 values(47, 'sub- and nested transactions','a','variable string','2-2-2012',5,'2012-10-10 10:23:54', '2011-10-19 10:23:54+02');
INSERT 0 1
Savepoint sp47n1;
SAVEPOINT
Insert into nested_subtx_t1 values(1, 'sub- and nested transactions','a','variable string','2-2-2012',5,'2012-10-10 10:23:54', '2011-10-19 10:23:54+02');
INSERT 0 1
Savepoint sp47n2;
SAVEPOINT
Insert into nested_subtx_t1 values(2, 'sub- and nested transactions','a','variable string','2-2-2012',5,'2012-10-10 10:23:54', '2011-10-19 10:23:54+02');
INSERT 0 1
Savepoint sp47n3;
SAVEPOINT
Insert into nested_subtx_t1 values(3, 'sub- and nested transactions','a','variable string','2-2-2012',5,'2012-10-10 10:23:54', '2011-10-19 10:23:54+02');
INSERT 0 1
Savepoint sp47n4;
SAVEPOINT
Insert into nested_subtx_t1 values(4, 'sub- and nested transactions','a','variable string','2-2-2012',5,'2012-10-10 10:23:54', '2011-10-19 10:23:54+02');
INSERT 0 1
Update nested_subtx_t1 set a2 = 'New Value' where a1 =4;
UPDATE 1
Release Savepoint sp47n4;
RELEASE
Select a2 from nested_subtx_t1 where a1 = 4;
    a2     
-----------
 New Value
(1 row)

Delete from nested_subtx_t2 where b1>0 ;
DELETE 1
Rollback to sp47n3;
ROLLBACK
Update nested_subtx_t1 set a2 = 'New Value' where a1 =2;
UPDATE 24
Release Savepoint sp47n2;
RELEASE
Select count(*) from nested_subtx_t1;
 count 
-------
    72
(1 row)

Select count(*) from nested_subtx_t2;
 count 
-------
     1
(1 row)

Release Savepoint sp47;
RELEASE
Savepoint sp48;
SAVEPOINT
Savepoint sp48n1;
SAVEPOINT
Insert into nested_subtx_t1 values(1, 'sub- and nested transactions','a','variable string','2-2-2012',5,'2012-10-10 10:23:54', '2011-10-19 10:23:54+02');
INSERT 0 1
Savepoint sp48n2;
SAVEPOINT
Insert into nested_subtx_t1 values(2, 'sub- and nested transactions','a','variable string','2-2-2012',5,'2012-10-10 10:23:54', '2011-10-19 10:23:54+02');
INSERT 0 1
Savepoint sp48n3;
SAVEPOINT
Insert into nested_subtx_t1 values(3, 'sub- and nested transactions','a','variable string','2-2-2012',5,'2012-10-10 10:23:54', '2011-10-19 10:23:54+02');
INSERT 0 1
Savepoint sp48n4;
SAVEPOINT
Insert into nested_subtx_t1 values(4, 'sub- and nested transactions','a','variable string','2-2-2012',5,'2012-10-10 10:23:54', '2011-10-19 10:23:54+02');
INSERT 0 1
Update nested_subtx_t1 set a2 = 'New Value' where a1 =4;
UPDATE 1
Release Savepoint sp48n4;
RELEASE
Select a2 from nested_subtx_t1 where a1 = 4;
    a2     
-----------
 New Value
(1 row)

Delete from nested_subtx_t2 where b1>0 ;
DELETE 1
Rollback to sp48n3;
ROLLBACK
Update nested_subtx_t1 set a2 = 'New Value' where a1 =2;
UPDATE 25
Release Savepoint sp48n2;
RELEASE
Select count(*) from nested_subtx_t1;
 count 
-------
    74
(1 row)

Select count(*) from nested_subtx_t2;
 count 
-------
     1
(1 row)

Rollback to sp48;
ROLLBACK
Savepoint sp49;
SAVEPOINT
Insert into nested_subtx_t1 values(49, 'sub- and nested transactions','a','variable string','2-2-2012',5,'2012-10-10 10:23:54', '2011-10-19 10:23:54+02');
INSERT 0 1
Savepoint sp49n1;
SAVEPOINT
Insert into nested_subtx_t1 values(1, 'sub- and nested transactions','a','variable string','2-2-2012',5,'2012-10-10 10:23:54', '2011-10-19 10:23:54+02');
INSERT 0 1
Savepoint sp49n2;
SAVEPOINT
Insert into nested_subtx_t1 values(2, 'sub- and nested transactions','a','variable string','2-2-2012',5,'2012-10-10 10:23:54', '2011-10-19 10:23:54+02');
INSERT 0 1
Savepoint sp49n3;
SAVEPOINT
Insert into nested_subtx_t1 values(3, 'sub- and nested transactions','a','variable string','2-2-2012',5,'2012-10-10 10:23:54', '2011-10-19 10:23:54+02');
INSERT 0 1
Savepoint sp49n4;
SAVEPOINT
Insert into nested_subtx_t1 values(4, 'sub- and nested transactions','a','variable string','2-2-2012',5,'2012-10-10 10:23:54', '2011-10-19 10:23:54+02');
INSERT 0 1
Update nested_subtx_t1 set a2 = 'New Value' where a1 =4;
UPDATE 1
Release Savepoint sp49n4;
RELEASE
Select a2 from nested_subtx_t1 where a1 = 4;
    a2     
-----------
 New Value
(1 row)

Delete from nested_subtx_t2 where b1>0 ;
DELETE 1
Rollback to sp49n3;
ROLLBACK
Update nested_subtx_t1 set a2 = 'New Value' where a1 =2;
UPDATE 25
Release Savepoint sp49n2;
RELEASE
Select count(*) from nested_subtx_t1;
 count 
-------
    75
(1 row)

Select count(*) from nested_subtx_t2;
 count 
-------
     1
(1 row)

Release Savepoint sp49;
RELEASE
Savepoint sp50;
SAVEPOINT
Savepoint sp50n1;
SAVEPOINT
Insert into nested_subtx_t1 values(1, 'sub- and nested transactions','a','variable string','2-2-2012',5,'2012-10-10 10:23:54', '2011-10-19 10:23:54+02');
INSERT 0 1
Savepoint sp50n2;
SAVEPOINT
Insert into nested_subtx_t1 values(2, 'sub- and nested transactions','a','variable string','2-2-2012',5,'2012-10-10 10:23:54', '2011-10-19 10:23:54+02');
INSERT 0 1
Savepoint sp50n3;
SAVEPOINT
Insert into nested_subtx_t1 values(3, 'sub- and nested transactions','a','variable string','2-2-2012',5,'2012-10-10 10:23:54', '2011-10-19 10:23:54+02');
INSERT 0 1
Savepoint sp50n4;
SAVEPOINT
Insert into nested_subtx_t1 values(4, 'sub- and nested transactions','a','variable string','2-2-2012',5,'2012-10-10 10:23:54', '2011-10-19 10:23:54+02');
INSERT 0 1
Update nested_subtx_t1 set a2 = 'New Value' where a1 =4;
UPDATE 1
Release Savepoint sp50n4;
RELEASE
Select a2 from nested_subtx_t1 where a1 = 4;
    a2     
-----------
 New Value
(1 row)

Delete from nested_subtx_t2 where b1>0 ;
DELETE 1
Rollback to sp50n3;
ROLLBACK
Update nested_subtx_t1 set a2 = 'New Value' where a1 =2;
UPDATE 26
Release Savepoint sp50n2;
RELEASE
Select count(*) from nested_subtx_t1;
 count 
-------
    77
(1 row)

Select count(*) from nested_subtx_t2;
 count 
-------
     1
(1 row)

Rollback to sp50;
ROLLBACK
Savepoint sp51;
SAVEPOINT
Insert into nested_subtx_t1 values(51, 'sub- and nested transactions','a','variable string','2-2-2012',5,'2012-10-10 10:23:54', '2011-10-19 10:23:54+02');
INSERT 0 1
Savepoint sp51n1;
SAVEPOINT
Insert into nested_subtx_t1 values(1, 'sub- and nested transactions','a','variable string','2-2-2012',5,'2012-10-10 10:23:54', '2011-10-19 10:23:54+02');
INSERT 0 1
Savepoint sp51n2;
SAVEPOINT
Insert into nested_subtx_t1 values(2, 'sub- and nested transactions','a','variable string','2-2-2012',5,'2012-10-10 10:23:54', '2011-10-19 10:23:54+02');
INSERT 0 1
Savepoint sp51n3;
SAVEPOINT
Insert into nested_subtx_t1 values(3, 'sub- and nested transactions','a','variable string','2-2-2012',5,'2012-10-10 10:23:54', '2011-10-19 10:23:54+02');
INSERT 0 1
Savepoint sp51n4;
SAVEPOINT
Insert into nested_subtx_t1 values(4, 'sub- and nested transactions','a','variable string','2-2-2012',5,'2012-10-10 10:23:54', '2011-10-19 10:23:54+02');
INSERT 0 1
Update nested_subtx_t1 set a2 = 'New Value' where a1 =4;
UPDATE 1
Release Savepoint sp51n4;
RELEASE
Select a2 from nested_subtx_t1 where a1 = 4;
    a2     
-----------
 New Value
(1 row)

Delete from nested_subtx_t2 where b1>0 ;
DELETE 1
Rollback to sp51n3;
ROLLBACK
Update nested_subtx_t1 set a2 = 'New Value' where a1 =2;
UPDATE 26
Release Savepoint sp51n2;
RELEASE
Select count(*) from nested_subtx_t1;
 count 
-------
    78
(1 row)

Select count(*) from nested_subtx_t2;
 count 
-------
     1
(1 row)

Release Savepoint sp51;
RELEASE
Savepoint sp52;
SAVEPOINT
Savepoint sp52n1;
SAVEPOINT
Insert into nested_subtx_t1 values(1, 'sub- and nested transactions','a','variable string','2-2-2012',5,'2012-10-10 10:23:54', '2011-10-19 10:23:54+02');
INSERT 0 1
Savepoint sp52n2;
SAVEPOINT
Insert into nested_subtx_t1 values(2, 'sub- and nested transactions','a','variable string','2-2-2012',5,'2012-10-10 10:23:54', '2011-10-19 10:23:54+02');
INSERT 0 1
Savepoint sp52n3;
SAVEPOINT
Insert into nested_subtx_t1 values(3, 'sub- and nested transactions','a','variable string','2-2-2012',5,'2012-10-10 10:23:54', '2011-10-19 10:23:54+02');
INSERT 0 1
Savepoint sp52n4;
SAVEPOINT
Insert into nested_subtx_t1 values(4, 'sub- and nested transactions','a','variable string','2-2-2012',5,'2012-10-10 10:23:54', '2011-10-19 10:23:54+02');
INSERT 0 1
Update nested_subtx_t1 set a2 = 'New Value' where a1 =4;
UPDATE 1
Release Savepoint sp52n4;
RELEASE
Select a2 from nested_subtx_t1 where a1 = 4;
    a2     
-----------
 New Value
(1 row)

Delete from nested_subtx_t2 where b1>0 ;
DELETE 1
Rollback to sp52n3;
ROLLBACK
Update nested_subtx_t1 set a2 = 'New Value' where a1 =2;
UPDATE 27
Release Savepoint sp52n2;
RELEASE
Select count(*) from nested_subtx_t1;
 count 
-------
    80
(1 row)

Select count(*) from nested_subtx_t2;
 count 
-------
     1
(1 row)

Rollback to sp52;
ROLLBACK
Savepoint sp53;
SAVEPOINT
Insert into nested_subtx_t1 values(53, 'sub- and nested transactions','a','variable string','2-2-2012',5,'2012-10-10 10:23:54', '2011-10-19 10:23:54+02');
INSERT 0 1
Savepoint sp53n1;
SAVEPOINT
Insert into nested_subtx_t1 values(1, 'sub- and nested transactions','a','variable string','2-2-2012',5,'2012-10-10 10:23:54', '2011-10-19 10:23:54+02');
INSERT 0 1
Savepoint sp53n2;
SAVEPOINT
Insert into nested_subtx_t1 values(2, 'sub- and nested transactions','a','variable string','2-2-2012',5,'2012-10-10 10:23:54', '2011-10-19 10:23:54+02');
INSERT 0 1
Savepoint sp53n3;
SAVEPOINT
Insert into nested_subtx_t1 values(3, 'sub- and nested transactions','a','variable string','2-2-2012',5,'2012-10-10 10:23:54', '2011-10-19 10:23:54+02');
INSERT 0 1
Savepoint sp53n4;
SAVEPOINT
Insert into nested_subtx_t1 values(4, 'sub- and nested transactions','a','variable string','2-2-2012',5,'2012-10-10 10:23:54', '2011-10-19 10:23:54+02');
INSERT 0 1
Update nested_subtx_t1 set a2 = 'New Value' where a1 =4;
UPDATE 1
Release Savepoint sp53n4;
RELEASE
Select a2 from nested_subtx_t1 where a1 = 4;
    a2     
-----------
 New Value
(1 row)

Delete from nested_subtx_t2 where b1>0 ;
DELETE 1
Rollback to sp53n3;
ROLLBACK
Update nested_subtx_t1 set a2 = 'New Value' where a1 =2;
UPDATE 27
Release Savepoint sp53n2;
RELEASE
Select count(*) from nested_subtx_t1;
 count 
-------
    81
(1 row)

Select count(*) from nested_subtx_t2;
 count 
-------
     1
(1 row)

Release Savepoint sp53;
RELEASE
Savepoint sp54;
SAVEPOINT
Savepoint sp54n1;
SAVEPOINT
Insert into nested_subtx_t1 values(1, 'sub- and nested transactions','a','variable string','2-2-2012',5,'2012-10-10 10:23:54', '2011-10-19 10:23:54+02');
INSERT 0 1
Savepoint sp54n2;
SAVEPOINT
Insert into nested_subtx_t1 values(2, 'sub- and nested transactions','a','variable string','2-2-2012',5,'2012-10-10 10:23:54', '2011-10-19 10:23:54+02');
INSERT 0 1
Savepoint sp54n3;
SAVEPOINT
Insert into nested_subtx_t1 values(3, 'sub- and nested transactions','a','variable string','2-2-2012',5,'2012-10-10 10:23:54', '2011-10-19 10:23:54+02');
INSERT 0 1
Savepoint sp54n4;
SAVEPOINT
Insert into nested_subtx_t1 values(4, 'sub- and nested transactions','a','variable string','2-2-2012',5,'2012-10-10 10:23:54', '2011-10-19 10:23:54+02');
INSERT 0 1
Update nested_subtx_t1 set a2 = 'New Value' where a1 =4;
UPDATE 1
Release Savepoint sp54n4;
RELEASE
Select a2 from nested_subtx_t1 where a1 = 4;
    a2     
-----------
 New Value
(1 row)

Delete from nested_subtx_t2 where b1>0 ;
DELETE 1
Rollback to sp54n3;
ROLLBACK
Update nested_subtx_t1 set a2 = 'New Value' where a1 =2;
UPDATE 28
Release Savepoint sp54n2;
RELEASE
Select count(*) from nested_subtx_t1;
 count 
-------
    83
(1 row)

Select count(*) from nested_subtx_t2;
 count 
-------
     1
(1 row)

Rollback to sp54;
ROLLBACK
Savepoint sp55;
SAVEPOINT
Insert into nested_subtx_t1 values(55, 'sub- and nested transactions','a','variable string','2-2-2012',5,'2012-10-10 10:23:54', '2011-10-19 10:23:54+02');
INSERT 0 1
Savepoint sp55n1;
SAVEPOINT
Insert into nested_subtx_t1 values(1, 'sub- and nested transactions','a','variable string','2-2-2012',5,'2012-10-10 10:23:54', '2011-10-19 10:23:54+02');
INSERT 0 1
Savepoint sp55n2;
SAVEPOINT
Insert into nested_subtx_t1 values(2, 'sub- and nested transactions','a','variable string','2-2-2012',5,'2012-10-10 10:23:54', '2011-10-19 10:23:54+02');
INSERT 0 1
Savepoint sp55n3;
SAVEPOINT
Insert into nested_subtx_t1 values(3, 'sub- and nested transactions','a','variable string','2-2-2012',5,'2012-10-10 10:23:54', '2011-10-19 10:23:54+02');
INSERT 0 1
Savepoint sp55n4;
SAVEPOINT
Insert into nested_subtx_t1 values(4, 'sub- and nested transactions','a','variable string','2-2-2012',5,'2012-10-10 10:23:54', '2011-10-19 10:23:54+02');
INSERT 0 1
Update nested_subtx_t1 set a2 = 'New Value' where a1 =4;
UPDATE 1
Release Savepoint sp55n4;
RELEASE
Select a2 from nested_subtx_t1 where a1 = 4;
    a2     
-----------
 New Value
(1 row)

Delete from nested_subtx_t2 where b1>0 ;
DELETE 1
Rollback to sp55n3;
ROLLBACK
Update nested_subtx_t1 set a2 = 'New Value' where a1 =2;
UPDATE 28
Release Savepoint sp55n2;
RELEASE
Select count(*) from nested_subtx_t1;
 count 
-------
    84
(1 row)

Select count(*) from nested_subtx_t2;
 count 
-------
     1
(1 row)

Release Savepoint sp55;
RELEASE
Savepoint sp56;
SAVEPOINT
Savepoint sp56n1;
SAVEPOINT
Insert into nested_subtx_t1 values(1, 'sub- and nested transactions','a','variable string','2-2-2012',5,'2012-10-10 10:23:54', '2011-10-19 10:23:54+02');
INSERT 0 1
Savepoint sp56n2;
SAVEPOINT
Insert into nested_subtx_t1 values(2, 'sub- and nested transactions','a','variable string','2-2-2012',5,'2012-10-10 10:23:54', '2011-10-19 10:23:54+02');
INSERT 0 1
Savepoint sp56n3;
SAVEPOINT
Insert into nested_subtx_t1 values(3, 'sub- and nested transactions','a','variable string','2-2-2012',5,'2012-10-10 10:23:54', '2011-10-19 10:23:54+02');
INSERT 0 1
Savepoint sp56n4;
SAVEPOINT
Insert into nested_subtx_t1 values(4, 'sub- and nested transactions','a','variable string','2-2-2012',5,'2012-10-10 10:23:54', '2011-10-19 10:23:54+02');
INSERT 0 1
Update nested_subtx_t1 set a2 = 'New Value' where a1 =4;
UPDATE 1
Release Savepoint sp56n4;
RELEASE
Select a2 from nested_subtx_t1 where a1 = 4;
    a2     
-----------
 New Value
(1 row)

Delete from nested_subtx_t2 where b1>0 ;
DELETE 1
Rollback to sp56n3;
ROLLBACK
Update nested_subtx_t1 set a2 = 'New Value' where a1 =2;
UPDATE 29
Release Savepoint sp56n2;
RELEASE
Select count(*) from nested_subtx_t1;
 count 
-------
    86
(1 row)

Select count(*) from nested_subtx_t2;
 count 
-------
     1
(1 row)

Rollback to sp56;
ROLLBACK
Savepoint sp57;
SAVEPOINT
Insert into nested_subtx_t1 values(57, 'sub- and nested transactions','a','variable string','2-2-2012',5,'2012-10-10 10:23:54', '2011-10-19 10:23:54+02');
INSERT 0 1
Savepoint sp57n1;
SAVEPOINT
Insert into nested_subtx_t1 values(1, 'sub- and nested transactions','a','variable string','2-2-2012',5,'2012-10-10 10:23:54', '2011-10-19 10:23:54+02');
INSERT 0 1
Savepoint sp57n2;
SAVEPOINT
Insert into nested_subtx_t1 values(2, 'sub- and nested transactions','a','variable string','2-2-2012',5,'2012-10-10 10:23:54', '2011-10-19 10:23:54+02');
INSERT 0 1
Savepoint sp57n3;
SAVEPOINT
Insert into nested_subtx_t1 values(3, 'sub- and nested transactions','a','variable string','2-2-2012',5,'2012-10-10 10:23:54', '2011-10-19 10:23:54+02');
INSERT 0 1
Savepoint sp57n4;
SAVEPOINT
Insert into nested_subtx_t1 values(4, 'sub- and nested transactions','a','variable string','2-2-2012',5,'2012-10-10 10:23:54', '2011-10-19 10:23:54+02');
INSERT 0 1
Update nested_subtx_t1 set a2 = 'New Value' where a1 =4;
UPDATE 1
Release Savepoint sp57n4;
RELEASE
Select a2 from nested_subtx_t1 where a1 = 4;
    a2     
-----------
 New Value
(1 row)

Delete from nested_subtx_t2 where b1>0 ;
DELETE 1
Rollback to sp57n3;
ROLLBACK
Update nested_subtx_t1 set a2 = 'New Value' where a1 =2;
UPDATE 29
Release Savepoint sp57n2;
RELEASE
Select count(*) from nested_subtx_t1;
 count 
-------
    87
(1 row)

Select count(*) from nested_subtx_t2;
 count 
-------
     1
(1 row)

Release Savepoint sp57;
RELEASE
Savepoint sp58;
SAVEPOINT
Savepoint sp58n1;
SAVEPOINT
Insert into nested_subtx_t1 values(1, 'sub- and nested transactions','a','variable string','2-2-2012',5,'2012-10-10 10:23:54', '2011-10-19 10:23:54+02');
INSERT 0 1
Savepoint sp58n2;
SAVEPOINT
Insert into nested_subtx_t1 values(2, 'sub- and nested transactions','a','variable string','2-2-2012',5,'2012-10-10 10:23:54', '2011-10-19 10:23:54+02');
INSERT 0 1
Savepoint sp58n3;
SAVEPOINT
Insert into nested_subtx_t1 values(3, 'sub- and nested transactions','a','variable string','2-2-2012',5,'2012-10-10 10:23:54', '2011-10-19 10:23:54+02');
INSERT 0 1
Savepoint sp58n4;
SAVEPOINT
Insert into nested_subtx_t1 values(4, 'sub- and nested transactions','a','variable string','2-2-2012',5,'2012-10-10 10:23:54', '2011-10-19 10:23:54+02');
INSERT 0 1
Update nested_subtx_t1 set a2 = 'New Value' where a1 =4;
UPDATE 1
Release Savepoint sp58n4;
RELEASE
Select a2 from nested_subtx_t1 where a1 = 4;
    a2     
-----------
 New Value
(1 row)

Delete from nested_subtx_t2 where b1>0 ;
DELETE 1
Rollback to sp58n3;
ROLLBACK
Update nested_subtx_t1 set a2 = 'New Value' where a1 =2;
UPDATE 30
Release Savepoint sp58n2;
RELEASE
Select count(*) from nested_subtx_t1;
 count 
-------
    89
(1 row)

Select count(*) from nested_subtx_t2;
 count 
-------
     1
(1 row)

Rollback to sp58;
ROLLBACK
Savepoint sp59;
SAVEPOINT
Insert into nested_subtx_t1 values(59, 'sub- and nested transactions','a','variable string','2-2-2012',5,'2012-10-10 10:23:54', '2011-10-19 10:23:54+02');
INSERT 0 1
Savepoint sp59n1;
SAVEPOINT
Insert into nested_subtx_t1 values(1, 'sub- and nested transactions','a','variable string','2-2-2012',5,'2012-10-10 10:23:54', '2011-10-19 10:23:54+02');
INSERT 0 1
Savepoint sp59n2;
SAVEPOINT
Insert into nested_subtx_t1 values(2, 'sub- and nested transactions','a','variable string','2-2-2012',5,'2012-10-10 10:23:54', '2011-10-19 10:23:54+02');
INSERT 0 1
Savepoint sp59n3;
SAVEPOINT
Insert into nested_subtx_t1 values(3, 'sub- and nested transactions','a','variable string','2-2-2012',5,'2012-10-10 10:23:54', '2011-10-19 10:23:54+02');
INSERT 0 1
Savepoint sp59n4;
SAVEPOINT
Insert into nested_subtx_t1 values(4, 'sub- and nested transactions','a','variable string','2-2-2012',5,'2012-10-10 10:23:54', '2011-10-19 10:23:54+02');
INSERT 0 1
Update nested_subtx_t1 set a2 = 'New Value' where a1 =4;
UPDATE 1
Release Savepoint sp59n4;
RELEASE
Select a2 from nested_subtx_t1 where a1 = 4;
    a2     
-----------
 New Value
(1 row)

Delete from nested_subtx_t2 where b1>0 ;
DELETE 1
Rollback to sp59n3;
ROLLBACK
Update nested_subtx_t1 set a2 = 'New Value' where a1 =2;
UPDATE 30
Release Savepoint sp59n2;
RELEASE
Select count(*) from nested_subtx_t1;
 count 
-------
    90
(1 row)

Select count(*) from nested_subtx_t2;
 count 
-------
     1
(1 row)

Release Savepoint sp59;
RELEASE
Savepoint sp60;
SAVEPOINT
Savepoint sp60n1;
SAVEPOINT
Insert into nested_subtx_t1 values(1, 'sub- and nested transactions','a','variable string','2-2-2012',5,'2012-10-10 10:23:54', '2011-10-19 10:23:54+02');
INSERT 0 1
Savepoint sp60n2;
SAVEPOINT
Insert into nested_subtx_t1 values(2, 'sub- and nested transactions','a','variable string','2-2-2012',5,'2012-10-10 10:23:54', '2011-10-19 10:23:54+02');
INSERT 0 1
Savepoint sp60n3;
SAVEPOINT
Insert into nested_subtx_t1 values(3, 'sub- and nested transactions','a','variable string','2-2-2012',5,'2012-10-10 10:23:54', '2011-10-19 10:23:54+02');
INSERT 0 1
Savepoint sp60n4;
SAVEPOINT
Insert into nested_subtx_t1 values(4, 'sub- and nested transactions','a','variable string','2-2-2012',5,'2012-10-10 10:23:54', '2011-10-19 10:23:54+02');
INSERT 0 1
Update nested_subtx_t1 set a2 = 'New Value' where a1 =4;
UPDATE 1
Release Savepoint sp60n4;
RELEASE
Select a2 from nested_subtx_t1 where a1 = 4;
    a2     
-----------
 New Value
(1 row)

Delete from nested_subtx_t2 where b1>0 ;
DELETE 1
Rollback to sp60n3;
ROLLBACK
Update nested_subtx_t1 set a2 = 'New Value' where a1 =2;
UPDATE 31
Release Savepoint sp60n2;
RELEASE
Select count(*) from nested_subtx_t1;
 count 
-------
    92
(1 row)

Select count(*) from nested_subtx_t2;
 count 
-------
     1
(1 row)

Rollback to sp60;
ROLLBACK
Savepoint sp61;
SAVEPOINT
Insert into nested_subtx_t1 values(61, 'sub- and nested transactions','a','variable string','2-2-2012',5,'2012-10-10 10:23:54', '2011-10-19 10:23:54+02');
INSERT 0 1
Savepoint sp61n1;
SAVEPOINT
Insert into nested_subtx_t1 values(1, 'sub- and nested transactions','a','variable string','2-2-2012',5,'2012-10-10 10:23:54', '2011-10-19 10:23:54+02');
INSERT 0 1
Savepoint sp61n2;
SAVEPOINT
Insert into nested_subtx_t1 values(2, 'sub- and nested transactions','a','variable string','2-2-2012',5,'2012-10-10 10:23:54', '2011-10-19 10:23:54+02');
INSERT 0 1
Savepoint sp61n3;
SAVEPOINT
Insert into nested_subtx_t1 values(3, 'sub- and nested transactions','a','variable string','2-2-2012',5,'2012-10-10 10:23:54', '2011-10-19 10:23:54+02');
INSERT 0 1
Savepoint sp61n4;
SAVEPOINT
Insert into nested_subtx_t1 values(4, 'sub- and nested transactions','a','variable string','2-2-2012',5,'2012-10-10 10:23:54', '2011-10-19 10:23:54+02');
INSERT 0 1
Update nested_subtx_t1 set a2 = 'New Value' where a1 =4;
UPDATE 1
Release Savepoint sp61n4;
RELEASE
Select a2 from nested_subtx_t1 where a1 = 4;
    a2     
-----------
 New Value
(1 row)

Delete from nested_subtx_t2 where b1>0 ;
DELETE 1
Rollback to sp61n3;
ROLLBACK
Update nested_subtx_t1 set a2 = 'New Value' where a1 =2;
UPDATE 31
Release Savepoint sp61n2;
RELEASE
Select count(*) from nested_subtx_t1;
 count 
-------
    93
(1 row)

Select count(*) from nested_subtx_t2;
 count 
-------
     1
(1 row)

Release Savepoint sp61;
RELEASE
Savepoint sp62;
SAVEPOINT
Savepoint sp62n1;
SAVEPOINT
Insert into nested_subtx_t1 values(1, 'sub- and nested transactions','a','variable string','2-2-2012',5,'2012-10-10 10:23:54', '2011-10-19 10:23:54+02');
INSERT 0 1
Savepoint sp62n2;
SAVEPOINT
Insert into nested_subtx_t1 values(2, 'sub- and nested transactions','a','variable string','2-2-2012',5,'2012-10-10 10:23:54', '2011-10-19 10:23:54+02');
INSERT 0 1
Savepoint sp62n3;
SAVEPOINT
Insert into nested_subtx_t1 values(3, 'sub- and nested transactions','a','variable string','2-2-2012',5,'2012-10-10 10:23:54', '2011-10-19 10:23:54+02');
INSERT 0 1
Savepoint sp62n4;
SAVEPOINT
Insert into nested_subtx_t1 values(4, 'sub- and nested transactions','a','variable string','2-2-2012',5,'2012-10-10 10:23:54', '2011-10-19 10:23:54+02');
INSERT 0 1
Update nested_subtx_t1 set a2 = 'New Value' where a1 =4;
UPDATE 1
Release Savepoint sp62n4;
RELEASE
Select a2 from nested_subtx_t1 where a1 = 4;
    a2     
-----------
 New Value
(1 row)

Delete from nested_subtx_t2 where b1>0 ;
DELETE 1
Rollback to sp62n3;
ROLLBACK
Update nested_subtx_t1 set a2 = 'New Value' where a1 =2;
UPDATE 32
Release Savepoint sp62n2;
RELEASE
Select count(*) from nested_subtx_t1;
 count 
-------
    95
(1 row)

Select count(*) from nested_subtx_t2;
 count 
-------
     1
(1 row)

Rollback to sp62;
ROLLBACK
Savepoint sp63;
SAVEPOINT
Insert into nested_subtx_t1 values(63, 'sub- and nested transactions','a','variable string','2-2-2012',5,'2012-10-10 10:23:54', '2011-10-19 10:23:54+02');
INSERT 0 1
Savepoint sp63n1;
SAVEPOINT
Insert into nested_subtx_t1 values(1, 'sub- and nested transactions','a','variable string','2-2-2012',5,'2012-10-10 10:23:54', '2011-10-19 10:23:54+02');
INSERT 0 1
Savepoint sp63n2;
SAVEPOINT
Insert into nested_subtx_t1 values(2, 'sub- and nested transactions','a','variable string','2-2-2012',5,'2012-10-10 10:23:54', '2011-10-19 10:23:54+02');
INSERT 0 1
Savepoint sp63n3;
SAVEPOINT
Insert into nested_subtx_t1 values(3, 'sub- and nested transactions','a','variable string','2-2-2012',5,'2012-10-10 10:23:54', '2011-10-19 10:23:54+02');
INSERT 0 1
Savepoint sp63n4;
SAVEPOINT
Insert into nested_subtx_t1 values(4, 'sub- and nested transactions','a','variable string','2-2-2012',5,'2012-10-10 10:23:54', '2011-10-19 10:23:54+02');
INSERT 0 1
Update nested_subtx_t1 set a2 = 'New Value' where a1 =4;
UPDATE 1
Release Savepoint sp63n4;
RELEASE
Select a2 from nested_subtx_t1 where a1 = 4;
    a2     
-----------
 New Value
(1 row)

Delete from nested_subtx_t2 where b1>0 ;
DELETE 1
Rollback to sp63n3;
ROLLBACK
Update nested_subtx_t1 set a2 = 'New Value' where a1 =2;
UPDATE 32
Release Savepoint sp63n2;
RELEASE
Select count(*) from nested_subtx_t1;
 count 
-------
    96
(1 row)

Select count(*) from nested_subtx_t2;
 count 
-------
     1
(1 row)

Release Savepoint sp63;
RELEASE
Savepoint sp64;
SAVEPOINT
Savepoint sp64n1;
SAVEPOINT
Insert into nested_subtx_t1 values(1, 'sub- and nested transactions','a','variable string','2-2-2012',5,'2012-10-10 10:23:54', '2011-10-19 10:23:54+02');
INSERT 0 1
Savepoint sp64n2;
SAVEPOINT
Insert into nested_subtx_t1 values(2, 'sub- and nested transactions','a','variable string','2-2-2012',5,'2012-10-10 10:23:54', '2011-10-19 10:23:54+02');
INSERT 0 1
Savepoint sp64n3;
SAVEPOINT
Insert into nested_subtx_t1 values(3, 'sub- and nested transactions','a','variable string','2-2-2012',5,'2012-10-10 10:23:54', '2011-10-19 10:23:54+02');
INSERT 0 1
Savepoint sp64n4;
SAVEPOINT
Insert into nested_subtx_t1 values(4, 'sub- and nested transactions','a','variable string','2-2-2012',5,'2012-10-10 10:23:54', '2011-10-19 10:23:54+02');
INSERT 0 1
Update nested_subtx_t1 set a2 = 'New Value' where a1 =4;
UPDATE 1
Release Savepoint sp64n4;
RELEASE
Select a2 from nested_subtx_t1 where a1 = 4;
    a2     
-----------
 New Value
(1 row)

Delete from nested_subtx_t2 where b1>0 ;
DELETE 1
Rollback to sp64n3;
ROLLBACK
Update nested_subtx_t1 set a2 = 'New Value' where a1 =2;
UPDATE 33
Release Savepoint sp64n2;
RELEASE
Select count(*) from nested_subtx_t1;
 count 
-------
    98
(1 row)

Select count(*) from nested_subtx_t2;
 count 
-------
     1
(1 row)

Rollback to sp64;
ROLLBACK
Savepoint sp65;
SAVEPOINT
Insert into nested_subtx_t1 values(65, 'sub- and nested transactions','a','variable string','2-2-2012',5,'2012-10-10 10:23:54', '2011-10-19 10:23:54+02');
INSERT 0 1
Savepoint sp65n1;
SAVEPOINT
Insert into nested_subtx_t1 values(1, 'sub- and nested transactions','a','variable string','2-2-2012',5,'2012-10-10 10:23:54', '2011-10-19 10:23:54+02');
INSERT 0 1
Savepoint sp65n2;
SAVEPOINT
Insert into nested_subtx_t1 values(2, 'sub- and nested transactions','a','variable string','2-2-2012',5,'2012-10-10 10:23:54', '2011-10-19 10:23:54+02');
INSERT 0 1
Savepoint sp65n3;
SAVEPOINT
Insert into nested_subtx_t1 values(3, 'sub- and nested transactions','a','variable string','2-2-2012',5,'2012-10-10 10:23:54', '2011-10-19 10:23:54+02');
INSERT 0 1
Savepoint sp65n4;
SAVEPOINT
Insert into nested_subtx_t1 values(4, 'sub- and nested transactions','a','variable string','2-2-2012',5,'2012-10-10 10:23:54', '2011-10-19 10:23:54+02');
INSERT 0 1
Update nested_subtx_t1 set a2 = 'New Value' where a1 =4;
UPDATE 1
Release Savepoint sp65n4;
RELEASE
Select a2 from nested_subtx_t1 where a1 = 4;
    a2     
-----------
 New Value
(1 row)

Delete from nested_subtx_t2 where b1>0 ;
DELETE 1
Rollback to sp65n3;
ROLLBACK
Update nested_subtx_t1 set a2 = 'New Value' where a1 =2;
UPDATE 33
Release Savepoint sp65n2;
RELEASE
Select count(*) from nested_subtx_t1;
 count 
-------
    99
(1 row)

Select count(*) from nested_subtx_t2;
 count 
-------
     1
(1 row)

Release Savepoint sp65;
RELEASE
Savepoint sp66;
SAVEPOINT
Savepoint sp66n1;
SAVEPOINT
Insert into nested_subtx_t1 values(1, 'sub- and nested transactions','a','variable string','2-2-2012',5,'2012-10-10 10:23:54', '2011-10-19 10:23:54+02');
INSERT 0 1
Savepoint sp66n2;
SAVEPOINT
Insert into nested_subtx_t1 values(2, 'sub- and nested transactions','a','variable string','2-2-2012',5,'2012-10-10 10:23:54', '2011-10-19 10:23:54+02');
INSERT 0 1
Savepoint sp66n3;
SAVEPOINT
Insert into nested_subtx_t1 values(3, 'sub- and nested transactions','a','variable string','2-2-2012',5,'2012-10-10 10:23:54', '2011-10-19 10:23:54+02');
INSERT 0 1
Savepoint sp66n4;
SAVEPOINT
Insert into nested_subtx_t1 values(4, 'sub- and nested transactions','a','variable string','2-2-2012',5,'2012-10-10 10:23:54', '2011-10-19 10:23:54+02');
INSERT 0 1
Update nested_subtx_t1 set a2 = 'New Value' where a1 =4;
UPDATE 1
Release Savepoint sp66n4;
RELEASE
Select a2 from nested_subtx_t1 where a1 = 4;
    a2     
-----------
 New Value
(1 row)

Delete from nested_subtx_t2 where b1>0 ;
DELETE 1
Rollback to sp66n3;
ROLLBACK
Update nested_subtx_t1 set a2 = 'New Value' where a1 =2;
UPDATE 34
Release Savepoint sp66n2;
RELEASE
Select count(*) from nested_subtx_t1;
 count 
-------
   101
(1 row)

Select count(*) from nested_subtx_t2;
 count 
-------
     1
(1 row)

Rollback to sp66;
ROLLBACK
Savepoint sp67;
SAVEPOINT
Insert into nested_subtx_t1 values(67, 'sub- and nested transactions','a','variable string','2-2-2012',5,'2012-10-10 10:23:54', '2011-10-19 10:23:54+02');
INSERT 0 1
Savepoint sp67n1;
SAVEPOINT
Insert into nested_subtx_t1 values(1, 'sub- and nested transactions','a','variable string','2-2-2012',5,'2012-10-10 10:23:54', '2011-10-19 10:23:54+02');
INSERT 0 1
Savepoint sp67n2;
SAVEPOINT
Insert into nested_subtx_t1 values(2, 'sub- and nested transactions','a','variable string','2-2-2012',5,'2012-10-10 10:23:54', '2011-10-19 10:23:54+02');
INSERT 0 1
Savepoint sp67n3;
SAVEPOINT
Insert into nested_subtx_t1 values(3, 'sub- and nested transactions','a','variable string','2-2-2012',5,'2012-10-10 10:23:54', '2011-10-19 10:23:54+02');
INSERT 0 1
Savepoint sp67n4;
SAVEPOINT
Insert into nested_subtx_t1 values(4, 'sub- and nested transactions','a','variable string','2-2-2012',5,'2012-10-10 10:23:54', '2011-10-19 10:23:54+02');
INSERT 0 1
Update nested_subtx_t1 set a2 = 'New Value' where a1 =4;
UPDATE 1
Release Savepoint sp67n4;
RELEASE
Select a2 from nested_subtx_t1 where a1 = 4;
    a2     
-----------
 New Value
(1 row)

Delete from nested_subtx_t2 where b1>0 ;
DELETE 1
Rollback to sp67n3;
ROLLBACK
Update nested_subtx_t1 set a2 = 'New Value' where a1 =2;
UPDATE 34
Release Savepoint sp67n2;
RELEASE
Select count(*) from nested_subtx_t1;
 count 
-------
   102
(1 row)

Select count(*) from nested_subtx_t2;
 count 
-------
     1
(1 row)

Release Savepoint sp67;
RELEASE
Savepoint sp68;
SAVEPOINT
Savepoint sp68n1;
SAVEPOINT
Insert into nested_subtx_t1 values(1, 'sub- and nested transactions','a','variable string','2-2-2012',5,'2012-10-10 10:23:54', '2011-10-19 10:23:54+02');
INSERT 0 1
Savepoint sp68n2;
SAVEPOINT
Insert into nested_subtx_t1 values(2, 'sub- and nested transactions','a','variable string','2-2-2012',5,'2012-10-10 10:23:54', '2011-10-19 10:23:54+02');
INSERT 0 1
Savepoint sp68n3;
SAVEPOINT
Insert into nested_subtx_t1 values(3, 'sub- and nested transactions','a','variable string','2-2-2012',5,'2012-10-10 10:23:54', '2011-10-19 10:23:54+02');
INSERT 0 1
Savepoint sp68n4;
SAVEPOINT
Insert into nested_subtx_t1 values(4, 'sub- and nested transactions','a','variable string','2-2-2012',5,'2012-10-10 10:23:54', '2011-10-19 10:23:54+02');
INSERT 0 1
Update nested_subtx_t1 set a2 = 'New Value' where a1 =4;
UPDATE 1
Release Savepoint sp68n4;
RELEASE
Select a2 from nested_subtx_t1 where a1 = 4;
    a2     
-----------
 New Value
(1 row)

Delete from nested_subtx_t2 where b1>0 ;
DELETE 1
Rollback to sp68n3;
ROLLBACK
Update nested_subtx_t1 set a2 = 'New Value' where a1 =2;
UPDATE 35
Release Savepoint sp68n2;
RELEASE
Select count(*) from nested_subtx_t1;
 count 
-------
   104
(1 row)

Select count(*) from nested_subtx_t2;
 count 
-------
     1
(1 row)

Rollback to sp68;
ROLLBACK
Savepoint sp69;
SAVEPOINT
Insert into nested_subtx_t1 values(69, 'sub- and nested transactions','a','variable string','2-2-2012',5,'2012-10-10 10:23:54', '2011-10-19 10:23:54+02');
INSERT 0 1
Savepoint sp69n1;
SAVEPOINT
Insert into nested_subtx_t1 values(1, 'sub- and nested transactions','a','variable string','2-2-2012',5,'2012-10-10 10:23:54', '2011-10-19 10:23:54+02');
INSERT 0 1
Savepoint sp69n2;
SAVEPOINT
Insert into nested_subtx_t1 values(2, 'sub- and nested transactions','a','variable string','2-2-2012',5,'2012-10-10 10:23:54', '2011-10-19 10:23:54+02');
INSERT 0 1
Savepoint sp69n3;
SAVEPOINT
Insert into nested_subtx_t1 values(3, 'sub- and nested transactions','a','variable string','2-2-2012',5,'2012-10-10 10:23:54', '2011-10-19 10:23:54+02');
INSERT 0 1
Savepoint sp69n4;
SAVEPOINT
Insert into nested_subtx_t1 values(4, 'sub- and nested transactions','a','variable string','2-2-2012',5,'2012-10-10 10:23:54', '2011-10-19 10:23:54+02');
INSERT 0 1
Update nested_subtx_t1 set a2 = 'New Value' where a1 =4;
UPDATE 1
Release Savepoint sp69n4;
RELEASE
Select a2 from nested_subtx_t1 where a1 = 4;
    a2     
-----------
 New Value
(1 row)

Delete from nested_subtx_t2 where b1>0 ;
DELETE 1
Rollback to sp69n3;
ROLLBACK
Update nested_subtx_t1 set a2 = 'New Value' where a1 =2;
UPDATE 35
Release Savepoint sp69n2;
RELEASE
Select count(*) from nested_subtx_t1;
 count 
-------
   105
(1 row)

Select count(*) from nested_subtx_t2;
 count 
-------
     1
(1 row)

Release Savepoint sp69;
RELEASE
Savepoint sp70;
SAVEPOINT
Savepoint sp70n1;
SAVEPOINT
Insert into nested_subtx_t1 values(1, 'sub- and nested transactions','a','variable string','2-2-2012',5,'2012-10-10 10:23:54', '2011-10-19 10:23:54+02');
INSERT 0 1
Savepoint sp70n2;
SAVEPOINT
Insert into nested_subtx_t1 values(2, 'sub- and nested transactions','a','variable string','2-2-2012',5,'2012-10-10 10:23:54', '2011-10-19 10:23:54+02');
INSERT 0 1
Savepoint sp70n3;
SAVEPOINT
Insert into nested_subtx_t1 values(3, 'sub- and nested transactions','a','variable string','2-2-2012',5,'2012-10-10 10:23:54', '2011-10-19 10:23:54+02');
INSERT 0 1
Savepoint sp70n4;
SAVEPOINT
Insert into nested_subtx_t1 values(4, 'sub- and nested transactions','a','variable string','2-2-2012',5,'2012-10-10 10:23:54', '2011-10-19 10:23:54+02');
INSERT 0 1
Update nested_subtx_t1 set a2 = 'New Value' where a1 =4;
UPDATE 1
Release Savepoint sp70n4;
RELEASE
Select a2 from nested_subtx_t1 where a1 = 4;
    a2     
-----------
 New Value
(1 row)

Delete from nested_subtx_t2 where b1>0 ;
DELETE 1
Rollback to sp70n3;
ROLLBACK
Update nested_subtx_t1 set a2 = 'New Value' where a1 =2;
UPDATE 36
Release Savepoint sp70n2;
RELEASE
Select count(*) from nested_subtx_t1;
 count 
-------
   107
(1 row)

Select count(*) from nested_subtx_t2;
 count 
-------
     1
(1 row)

Rollback to sp70;
ROLLBACK
Savepoint sp71;
SAVEPOINT
Insert into nested_subtx_t1 values(71, 'sub- and nested transactions','a','variable string','2-2-2012',5,'2012-10-10 10:23:54', '2011-10-19 10:23:54+02');
INSERT 0 1
Savepoint sp71n1;
SAVEPOINT
Insert into nested_subtx_t1 values(1, 'sub- and nested transactions','a','variable string','2-2-2012',5,'2012-10-10 10:23:54', '2011-10-19 10:23:54+02');
INSERT 0 1
Savepoint sp71n2;
SAVEPOINT
Insert into nested_subtx_t1 values(2, 'sub- and nested transactions','a','variable string','2-2-2012',5,'2012-10-10 10:23:54', '2011-10-19 10:23:54+02');
INSERT 0 1
Savepoint sp71n3;
SAVEPOINT
Insert into nested_subtx_t1 values(3, 'sub- and nested transactions','a','variable string','2-2-2012',5,'2012-10-10 10:23:54', '2011-10-19 10:23:54+02');
INSERT 0 1
Savepoint sp71n4;
SAVEPOINT
Insert into nested_subtx_t1 values(4, 'sub- and nested transactions','a','variable string','2-2-2012',5,'2012-10-10 10:23:54', '2011-10-19 10:23:54+02');
INSERT 0 1
Update nested_subtx_t1 set a2 = 'New Value' where a1 =4;
UPDATE 1
Release Savepoint sp71n4;
RELEASE
Select a2 from nested_subtx_t1 where a1 = 4;
    a2     
-----------
 New Value
(1 row)

Delete from nested_subtx_t2 where b1>0 ;
DELETE 1
Rollback to sp71n3;
ROLLBACK
Update nested_subtx_t1 set a2 = 'New Value' where a1 =2;
UPDATE 36
Release Savepoint sp71n2;
RELEASE
Select count(*) from nested_subtx_t1;
 count 
-------
   108
(1 row)

Select count(*) from nested_subtx_t2;
 count 
-------
     1
(1 row)

Release Savepoint sp71;
RELEASE
Savepoint sp72;
SAVEPOINT
Savepoint sp72n1;
SAVEPOINT
Insert into nested_subtx_t1 values(1, 'sub- and nested transactions','a','variable string','2-2-2012',5,'2012-10-10 10:23:54', '2011-10-19 10:23:54+02');
INSERT 0 1
Savepoint sp72n2;
SAVEPOINT
Insert into nested_subtx_t1 values(2, 'sub- and nested transactions','a','variable string','2-2-2012',5,'2012-10-10 10:23:54', '2011-10-19 10:23:54+02');
INSERT 0 1
Savepoint sp72n3;
SAVEPOINT
Insert into nested_subtx_t1 values(3, 'sub- and nested transactions','a','variable string','2-2-2012',5,'2012-10-10 10:23:54', '2011-10-19 10:23:54+02');
INSERT 0 1
Savepoint sp72n4;
SAVEPOINT
Insert into nested_subtx_t1 values(4, 'sub- and nested transactions','a','variable string','2-2-2012',5,'2012-10-10 10:23:54', '2011-10-19 10:23:54+02');
INSERT 0 1
Update nested_subtx_t1 set a2 = 'New Value' where a1 =4;
UPDATE 1
Release Savepoint sp72n4;
RELEASE
Select a2 from nested_subtx_t1 where a1 = 4;
    a2     
-----------
 New Value
(1 row)

Delete from nested_subtx_t2 where b1>0 ;
DELETE 1
Rollback to sp72n3;
ROLLBACK
Update nested_subtx_t1 set a2 = 'New Value' where a1 =2;
UPDATE 37
Release Savepoint sp72n2;
RELEASE
Select count(*) from nested_subtx_t1;
 count 
-------
   110
(1 row)

Select count(*) from nested_subtx_t2;
 count 
-------
     1
(1 row)

Rollback to sp72;
ROLLBACK
Savepoint sp73;
SAVEPOINT
Insert into nested_subtx_t1 values(73, 'sub- and nested transactions','a','variable string','2-2-2012',5,'2012-10-10 10:23:54', '2011-10-19 10:23:54+02');
INSERT 0 1
Savepoint sp73n1;
SAVEPOINT
Insert into nested_subtx_t1 values(1, 'sub- and nested transactions','a','variable string','2-2-2012',5,'2012-10-10 10:23:54', '2011-10-19 10:23:54+02');
INSERT 0 1
Savepoint sp73n2;
SAVEPOINT
Insert into nested_subtx_t1 values(2, 'sub- and nested transactions','a','variable string','2-2-2012',5,'2012-10-10 10:23:54', '2011-10-19 10:23:54+02');
INSERT 0 1
Savepoint sp73n3;
SAVEPOINT
Insert into nested_subtx_t1 values(3, 'sub- and nested transactions','a','variable string','2-2-2012',5,'2012-10-10 10:23:54', '2011-10-19 10:23:54+02');
INSERT 0 1
Savepoint sp73n4;
SAVEPOINT
Insert into nested_subtx_t1 values(4, 'sub- and nested transactions','a','variable string','2-2-2012',5,'2012-10-10 10:23:54', '2011-10-19 10:23:54+02');
INSERT 0 1
Update nested_subtx_t1 set a2 = 'New Value' where a1 =4;
UPDATE 1
Release Savepoint sp73n4;
RELEASE
Select a2 from nested_subtx_t1 where a1 = 4;
    a2     
-----------
 New Value
(1 row)

Delete from nested_subtx_t2 where b1>0 ;
DELETE 1
Rollback to sp73n3;
ROLLBACK
Update nested_subtx_t1 set a2 = 'New Value' where a1 =2;
UPDATE 37
Release Savepoint sp73n2;
RELEASE
Select count(*) from nested_subtx_t1;
 count 
-------
   111
(1 row)

Select count(*) from nested_subtx_t2;
 count 
-------
     1
(1 row)

Release Savepoint sp73;
RELEASE
Savepoint sp74;
SAVEPOINT
Savepoint sp74n1;
SAVEPOINT
Insert into nested_subtx_t1 values(1, 'sub- and nested transactions','a','variable string','2-2-2012',5,'2012-10-10 10:23:54', '2011-10-19 10:23:54+02');
INSERT 0 1
Savepoint sp74n2;
SAVEPOINT
Insert into nested_subtx_t1 values(2, 'sub- and nested transactions','a','variable string','2-2-2012',5,'2012-10-10 10:23:54', '2011-10-19 10:23:54+02');
INSERT 0 1
Savepoint sp74n3;
SAVEPOINT
Insert into nested_subtx_t1 values(3, 'sub- and nested transactions','a','variable string','2-2-2012',5,'2012-10-10 10:23:54', '2011-10-19 10:23:54+02');
INSERT 0 1
Savepoint sp74n4;
SAVEPOINT
Insert into nested_subtx_t1 values(4, 'sub- and nested transactions','a','variable string','2-2-2012',5,'2012-10-10 10:23:54', '2011-10-19 10:23:54+02');
INSERT 0 1
Update nested_subtx_t1 set a2 = 'New Value' where a1 =4;
UPDATE 1
Release Savepoint sp74n4;
RELEASE
Select a2 from nested_subtx_t1 where a1 = 4;
    a2     
-----------
 New Value
(1 row)

Delete from nested_subtx_t2 where b1>0 ;
DELETE 1
Rollback to sp74n3;
ROLLBACK
Update nested_subtx_t1 set a2 = 'New Value' where a1 =2;
UPDATE 38
Release Savepoint sp74n2;
RELEASE
Select count(*) from nested_subtx_t1;
 count 
-------
   113
(1 row)

Select count(*) from nested_subtx_t2;
 count 
-------
     1
(1 row)

Rollback to sp74;
ROLLBACK
Savepoint sp75;
SAVEPOINT
Insert into nested_subtx_t1 values(75, 'sub- and nested transactions','a','variable string','2-2-2012',5,'2012-10-10 10:23:54', '2011-10-19 10:23:54+02');
INSERT 0 1
Savepoint sp75n1;
SAVEPOINT
Insert into nested_subtx_t1 values(1, 'sub- and nested transactions','a','variable string','2-2-2012',5,'2012-10-10 10:23:54', '2011-10-19 10:23:54+02');
INSERT 0 1
Savepoint sp75n2;
SAVEPOINT
Insert into nested_subtx_t1 values(2, 'sub- and nested transactions','a','variable string','2-2-2012',5,'2012-10-10 10:23:54', '2011-10-19 10:23:54+02');
INSERT 0 1
Savepoint sp75n3;
SAVEPOINT
Insert into nested_subtx_t1 values(3, 'sub- and nested transactions','a','variable string','2-2-2012',5,'2012-10-10 10:23:54', '2011-10-19 10:23:54+02');
INSERT 0 1
Savepoint sp75n4;
SAVEPOINT
Insert into nested_subtx_t1 values(4, 'sub- and nested transactions','a','variable string','2-2-2012',5,'2012-10-10 10:23:54', '2011-10-19 10:23:54+02');
INSERT 0 1
Update nested_subtx_t1 set a2 = 'New Value' where a1 =4;
UPDATE 1
Release Savepoint sp75n4;
RELEASE
Select a2 from nested_subtx_t1 where a1 = 4;
    a2     
-----------
 New Value
(1 row)

Delete from nested_subtx_t2 where b1>0 ;
DELETE 1
Rollback to sp75n3;
ROLLBACK
Update nested_subtx_t1 set a2 = 'New Value' where a1 =2;
UPDATE 38
Release Savepoint sp75n2;
RELEASE
Select count(*) from nested_subtx_t1;
 count 
-------
   114
(1 row)

Select count(*) from nested_subtx_t2;
 count 
-------
     1
(1 row)

Release Savepoint sp75;
RELEASE
Savepoint sp76;
SAVEPOINT
Savepoint sp76n1;
SAVEPOINT
Insert into nested_subtx_t1 values(1, 'sub- and nested transactions','a','variable string','2-2-2012',5,'2012-10-10 10:23:54', '2011-10-19 10:23:54+02');
INSERT 0 1
Savepoint sp76n2;
SAVEPOINT
Insert into nested_subtx_t1 values(2, 'sub- and nested transactions','a','variable string','2-2-2012',5,'2012-10-10 10:23:54', '2011-10-19 10:23:54+02');
INSERT 0 1
Savepoint sp76n3;
SAVEPOINT
Insert into nested_subtx_t1 values(3, 'sub- and nested transactions','a','variable string','2-2-2012',5,'2012-10-10 10:23:54', '2011-10-19 10:23:54+02');
INSERT 0 1
Savepoint sp76n4;
SAVEPOINT
Insert into nested_subtx_t1 values(4, 'sub- and nested transactions','a','variable string','2-2-2012',5,'2012-10-10 10:23:54', '2011-10-19 10:23:54+02');
INSERT 0 1
Update nested_subtx_t1 set a2 = 'New Value' where a1 =4;
UPDATE 1
Release Savepoint sp76n4;
RELEASE
Select a2 from nested_subtx_t1 where a1 = 4;
    a2     
-----------
 New Value
(1 row)

Delete from nested_subtx_t2 where b1>0 ;
DELETE 1
Rollback to sp76n3;
ROLLBACK
Update nested_subtx_t1 set a2 = 'New Value' where a1 =2;
UPDATE 39
Release Savepoint sp76n2;
RELEASE
Select count(*) from nested_subtx_t1;
 count 
-------
   116
(1 row)

Select count(*) from nested_subtx_t2;
 count 
-------
     1
(1 row)

Rollback to sp76;
ROLLBACK
Savepoint sp77;
SAVEPOINT
Insert into nested_subtx_t1 values(77, 'sub- and nested transactions','a','variable string','2-2-2012',5,'2012-10-10 10:23:54', '2011-10-19 10:23:54+02');
INSERT 0 1
Savepoint sp77n1;
SAVEPOINT
Insert into nested_subtx_t1 values(1, 'sub- and nested transactions','a','variable string','2-2-2012',5,'2012-10-10 10:23:54', '2011-10-19 10:23:54+02');
INSERT 0 1
Savepoint sp77n2;
SAVEPOINT
Insert into nested_subtx_t1 values(2, 'sub- and nested transactions','a','variable string','2-2-2012',5,'2012-10-10 10:23:54', '2011-10-19 10:23:54+02');
INSERT 0 1
Savepoint sp77n3;
SAVEPOINT
Insert into nested_subtx_t1 values(3, 'sub- and nested transactions','a','variable string','2-2-2012',5,'2012-10-10 10:23:54', '2011-10-19 10:23:54+02');
INSERT 0 1
Savepoint sp77n4;
SAVEPOINT
Insert into nested_subtx_t1 values(4, 'sub- and nested transactions','a','variable string','2-2-2012',5,'2012-10-10 10:23:54', '2011-10-19 10:23:54+02');
INSERT 0 1
Update nested_subtx_t1 set a2 = 'New Value' where a1 =4;
UPDATE 1
Release Savepoint sp77n4;
RELEASE
Select a2 from nested_subtx_t1 where a1 = 4;
    a2     
-----------
 New Value
(1 row)

Delete from nested_subtx_t2 where b1>0 ;
DELETE 1
Rollback to sp77n3;
ROLLBACK
Update nested_subtx_t1 set a2 = 'New Value' where a1 =2;
UPDATE 39
Release Savepoint sp77n2;
RELEASE
Select count(*) from nested_subtx_t1;
 count 
-------
   117
(1 row)

Select count(*) from nested_subtx_t2;
 count 
-------
     1
(1 row)

Release Savepoint sp77;
RELEASE
Savepoint sp78;
SAVEPOINT
Savepoint sp78n1;
SAVEPOINT
Insert into nested_subtx_t1 values(1, 'sub- and nested transactions','a','variable string','2-2-2012',5,'2012-10-10 10:23:54', '2011-10-19 10:23:54+02');
INSERT 0 1
Savepoint sp78n2;
SAVEPOINT
Insert into nested_subtx_t1 values(2, 'sub- and nested transactions','a','variable string','2-2-2012',5,'2012-10-10 10:23:54', '2011-10-19 10:23:54+02');
INSERT 0 1
Savepoint sp78n3;
SAVEPOINT
Insert into nested_subtx_t1 values(3, 'sub- and nested transactions','a','variable string','2-2-2012',5,'2012-10-10 10:23:54', '2011-10-19 10:23:54+02');
INSERT 0 1
Savepoint sp78n4;
SAVEPOINT
Insert into nested_subtx_t1 values(4, 'sub- and nested transactions','a','variable string','2-2-2012',5,'2012-10-10 10:23:54', '2011-10-19 10:23:54+02');
INSERT 0 1
Update nested_subtx_t1 set a2 = 'New Value' where a1 =4;
UPDATE 1
Release Savepoint sp78n4;
RELEASE
Select a2 from nested_subtx_t1 where a1 = 4;
    a2     
-----------
 New Value
(1 row)

Delete from nested_subtx_t2 where b1>0 ;
DELETE 1
Rollback to sp78n3;
ROLLBACK
Update nested_subtx_t1 set a2 = 'New Value' where a1 =2;
UPDATE 40
Release Savepoint sp78n2;
RELEASE
Select count(*) from nested_subtx_t1;
 count 
-------
   119
(1 row)

Select count(*) from nested_subtx_t2;
 count 
-------
     1
(1 row)

Rollback to sp78;
ROLLBACK
Savepoint sp79;
SAVEPOINT
Insert into nested_subtx_t1 values(79, 'sub- and nested transactions','a','variable string','2-2-2012',5,'2012-10-10 10:23:54', '2011-10-19 10:23:54+02');
INSERT 0 1
Savepoint sp79n1;
SAVEPOINT
Insert into nested_subtx_t1 values(1, 'sub- and nested transactions','a','variable string','2-2-2012',5,'2012-10-10 10:23:54', '2011-10-19 10:23:54+02');
INSERT 0 1
Savepoint sp79n2;
SAVEPOINT
Insert into nested_subtx_t1 values(2, 'sub- and nested transactions','a','variable string','2-2-2012',5,'2012-10-10 10:23:54', '2011-10-19 10:23:54+02');
INSERT 0 1
Savepoint sp79n3;
SAVEPOINT
Insert into nested_subtx_t1 values(3, 'sub- and nested transactions','a','variable string','2-2-2012',5,'2012-10-10 10:23:54', '2011-10-19 10:23:54+02');
INSERT 0 1
Savepoint sp79n4;
SAVEPOINT
Insert into nested_subtx_t1 values(4, 'sub- and nested transactions','a','variable string','2-2-2012',5,'2012-10-10 10:23:54', '2011-10-19 10:23:54+02');
INSERT 0 1
Update nested_subtx_t1 set a2 = 'New Value' where a1 =4;
UPDATE 1
Release Savepoint sp79n4;
RELEASE
Select a2 from nested_subtx_t1 where a1 = 4;
    a2     
-----------
 New Value
(1 row)

Delete from nested_subtx_t2 where b1>0 ;
DELETE 1
Rollback to sp79n3;
ROLLBACK
Update nested_subtx_t1 set a2 = 'New Value' where a1 =2;
UPDATE 40
Release Savepoint sp79n2;
RELEASE
Select count(*) from nested_subtx_t1;
 count 
-------
   120
(1 row)

Select count(*) from nested_subtx_t2;
 count 
-------
     1
(1 row)

Release Savepoint sp79;
RELEASE
Savepoint sp80;
SAVEPOINT
Savepoint sp80n1;
SAVEPOINT
Insert into nested_subtx_t1 values(1, 'sub- and nested transactions','a','variable string','2-2-2012',5,'2012-10-10 10:23:54', '2011-10-19 10:23:54+02');
INSERT 0 1
Savepoint sp80n2;
SAVEPOINT
Insert into nested_subtx_t1 values(2, 'sub- and nested transactions','a','variable string','2-2-2012',5,'2012-10-10 10:23:54', '2011-10-19 10:23:54+02');
INSERT 0 1
Savepoint sp80n3;
SAVEPOINT
Insert into nested_subtx_t1 values(3, 'sub- and nested transactions','a','variable string','2-2-2012',5,'2012-10-10 10:23:54', '2011-10-19 10:23:54+02');
INSERT 0 1
Savepoint sp80n4;
SAVEPOINT
Insert into nested_subtx_t1 values(4, 'sub- and nested transactions','a','variable string','2-2-2012',5,'2012-10-10 10:23:54', '2011-10-19 10:23:54+02');
INSERT 0 1
Update nested_subtx_t1 set a2 = 'New Value' where a1 =4;
UPDATE 1
Release Savepoint sp80n4;
RELEASE
Select a2 from nested_subtx_t1 where a1 = 4;
    a2     
-----------
 New Value
(1 row)

Delete from nested_subtx_t2 where b1>0 ;
DELETE 1
Rollback to sp80n3;
ROLLBACK
Update nested_subtx_t1 set a2 = 'New Value' where a1 =2;
UPDATE 41
Release Savepoint sp80n2;
RELEASE
Select count(*) from nested_subtx_t1;
 count 
-------
   122
(1 row)

Select count(*) from nested_subtx_t2;
 count 
-------
     1
(1 row)

Rollback to sp80;
ROLLBACK
Savepoint sp81;
SAVEPOINT
Insert into nested_subtx_t1 values(81, 'sub- and nested transactions','a','variable string','2-2-2012',5,'2012-10-10 10:23:54', '2011-10-19 10:23:54+02');
INSERT 0 1
Savepoint sp81n1;
SAVEPOINT
Insert into nested_subtx_t1 values(1, 'sub- and nested transactions','a','variable string','2-2-2012',5,'2012-10-10 10:23:54', '2011-10-19 10:23:54+02');
INSERT 0 1
Savepoint sp81n2;
SAVEPOINT
Insert into nested_subtx_t1 values(2, 'sub- and nested transactions','a','variable string','2-2-2012',5,'2012-10-10 10:23:54', '2011-10-19 10:23:54+02');
INSERT 0 1
Savepoint sp81n3;
SAVEPOINT
Insert into nested_subtx_t1 values(3, 'sub- and nested transactions','a','variable string','2-2-2012',5,'2012-10-10 10:23:54', '2011-10-19 10:23:54+02');
INSERT 0 1
Savepoint sp81n4;
SAVEPOINT
Insert into nested_subtx_t1 values(4, 'sub- and nested transactions','a','variable string','2-2-2012',5,'2012-10-10 10:23:54', '2011-10-19 10:23:54+02');
INSERT 0 1
Update nested_subtx_t1 set a2 = 'New Value' where a1 =4;
UPDATE 1
Release Savepoint sp81n4;
RELEASE
Select a2 from nested_subtx_t1 where a1 = 4;
    a2     
-----------
 New Value
(1 row)

Delete from nested_subtx_t2 where b1>0 ;
DELETE 1
Rollback to sp81n3;
ROLLBACK
Update nested_subtx_t1 set a2 = 'New Value' where a1 =2;
UPDATE 41
Release Savepoint sp81n2;
RELEASE
Select count(*) from nested_subtx_t1;
 count 
-------
   123
(1 row)

Select count(*) from nested_subtx_t2;
 count 
-------
     1
(1 row)

Release Savepoint sp81;
RELEASE
Savepoint sp82;
SAVEPOINT
Savepoint sp82n1;
SAVEPOINT
Insert into nested_subtx_t1 values(1, 'sub- and nested transactions','a','variable string','2-2-2012',5,'2012-10-10 10:23:54', '2011-10-19 10:23:54+02');
INSERT 0 1
Savepoint sp82n2;
SAVEPOINT
Insert into nested_subtx_t1 values(2, 'sub- and nested transactions','a','variable string','2-2-2012',5,'2012-10-10 10:23:54', '2011-10-19 10:23:54+02');
INSERT 0 1
Savepoint sp82n3;
SAVEPOINT
Insert into nested_subtx_t1 values(3, 'sub- and nested transactions','a','variable string','2-2-2012',5,'2012-10-10 10:23:54', '2011-10-19 10:23:54+02');
INSERT 0 1
Savepoint sp82n4;
SAVEPOINT
Insert into nested_subtx_t1 values(4, 'sub- and nested transactions','a','variable string','2-2-2012',5,'2012-10-10 10:23:54', '2011-10-19 10:23:54+02');
INSERT 0 1
Update nested_subtx_t1 set a2 = 'New Value' where a1 =4;
UPDATE 1
Release Savepoint sp82n4;
RELEASE
Select a2 from nested_subtx_t1 where a1 = 4;
    a2     
-----------
 New Value
(1 row)

Delete from nested_subtx_t2 where b1>0 ;
DELETE 1
Rollback to sp82n3;
ROLLBACK
Update nested_subtx_t1 set a2 = 'New Value' where a1 =2;
UPDATE 42
Release Savepoint sp82n2;
RELEASE
Select count(*) from nested_subtx_t1;
 count 
-------
   125
(1 row)

Select count(*) from nested_subtx_t2;
 count 
-------
     1
(1 row)

Rollback to sp82;
ROLLBACK
Savepoint sp83;
SAVEPOINT
Insert into nested_subtx_t1 values(83, 'sub- and nested transactions','a','variable string','2-2-2012',5,'2012-10-10 10:23:54', '2011-10-19 10:23:54+02');
INSERT 0 1
Savepoint sp83n1;
SAVEPOINT
Insert into nested_subtx_t1 values(1, 'sub- and nested transactions','a','variable string','2-2-2012',5,'2012-10-10 10:23:54', '2011-10-19 10:23:54+02');
INSERT 0 1
Savepoint sp83n2;
SAVEPOINT
Insert into nested_subtx_t1 values(2, 'sub- and nested transactions','a','variable string','2-2-2012',5,'2012-10-10 10:23:54', '2011-10-19 10:23:54+02');
INSERT 0 1
Savepoint sp83n3;
SAVEPOINT
Insert into nested_subtx_t1 values(3, 'sub- and nested transactions','a','variable string','2-2-2012',5,'2012-10-10 10:23:54', '2011-10-19 10:23:54+02');
INSERT 0 1
Savepoint sp83n4;
SAVEPOINT
Insert into nested_subtx_t1 values(4, 'sub- and nested transactions','a','variable string','2-2-2012',5,'2012-10-10 10:23:54', '2011-10-19 10:23:54+02');
INSERT 0 1
Update nested_subtx_t1 set a2 = 'New Value' where a1 =4;
UPDATE 1
Release Savepoint sp83n4;
RELEASE
Select a2 from nested_subtx_t1 where a1 = 4;
    a2     
-----------
 New Value
(1 row)

Delete from nested_subtx_t2 where b1>0 ;
DELETE 1
Rollback to sp83n3;
ROLLBACK
Update nested_subtx_t1 set a2 = 'New Value' where a1 =2;
UPDATE 42
Release Savepoint sp83n2;
RELEASE
Select count(*) from nested_subtx_t1;
 count 
-------
   126
(1 row)

Select count(*) from nested_subtx_t2;
 count 
-------
     1
(1 row)

Release Savepoint sp83;
RELEASE
Savepoint sp84;
SAVEPOINT
Savepoint sp84n1;
SAVEPOINT
Insert into nested_subtx_t1 values(1, 'sub- and nested transactions','a','variable string','2-2-2012',5,'2012-10-10 10:23:54', '2011-10-19 10:23:54+02');
INSERT 0 1
Savepoint sp84n2;
SAVEPOINT
Insert into nested_subtx_t1 values(2, 'sub- and nested transactions','a','variable string','2-2-2012',5,'2012-10-10 10:23:54', '2011-10-19 10:23:54+02');
INSERT 0 1
Savepoint sp84n3;
SAVEPOINT
Insert into nested_subtx_t1 values(3, 'sub- and nested transactions','a','variable string','2-2-2012',5,'2012-10-10 10:23:54', '2011-10-19 10:23:54+02');
INSERT 0 1
Savepoint sp84n4;
SAVEPOINT
Insert into nested_subtx_t1 values(4, 'sub- and nested transactions','a','variable string','2-2-2012',5,'2012-10-10 10:23:54', '2011-10-19 10:23:54+02');
INSERT 0 1
Update nested_subtx_t1 set a2 = 'New Value' where a1 =4;
UPDATE 1
Release Savepoint sp84n4;
RELEASE
Select a2 from nested_subtx_t1 where a1 = 4;
    a2     
-----------
 New Value
(1 row)

Delete from nested_subtx_t2 where b1>0 ;
DELETE 1
Rollback to sp84n3;
ROLLBACK
Update nested_subtx_t1 set a2 = 'New Value' where a1 =2;
UPDATE 43
Release Savepoint sp84n2;
RELEASE
Select count(*) from nested_subtx_t1;
 count 
-------
   128
(1 row)

Select count(*) from nested_subtx_t2;
 count 
-------
     1
(1 row)

Rollback to sp84;
ROLLBACK
Savepoint sp85;
SAVEPOINT
Insert into nested_subtx_t1 values(85, 'sub- and nested transactions','a','variable string','2-2-2012',5,'2012-10-10 10:23:54', '2011-10-19 10:23:54+02');
INSERT 0 1
Savepoint sp85n1;
SAVEPOINT
Insert into nested_subtx_t1 values(1, 'sub- and nested transactions','a','variable string','2-2-2012',5,'2012-10-10 10:23:54', '2011-10-19 10:23:54+02');
INSERT 0 1
Savepoint sp85n2;
SAVEPOINT
Insert into nested_subtx_t1 values(2, 'sub- and nested transactions','a','variable string','2-2-2012',5,'2012-10-10 10:23:54', '2011-10-19 10:23:54+02');
INSERT 0 1
Savepoint sp85n3;
SAVEPOINT
Insert into nested_subtx_t1 values(3, 'sub- and nested transactions','a','variable string','2-2-2012',5,'2012-10-10 10:23:54', '2011-10-19 10:23:54+02');
INSERT 0 1
Savepoint sp85n4;
SAVEPOINT
Insert into nested_subtx_t1 values(4, 'sub- and nested transactions','a','variable string','2-2-2012',5,'2012-10-10 10:23:54', '2011-10-19 10:23:54+02');
INSERT 0 1
Update nested_subtx_t1 set a2 = 'New Value' where a1 =4;
UPDATE 1
Release Savepoint sp85n4;
RELEASE
Select a2 from nested_subtx_t1 where a1 = 4;
    a2     
-----------
 New Value
(1 row)

Delete from nested_subtx_t2 where b1>0 ;
DELETE 1
Rollback to sp85n3;
ROLLBACK
Update nested_subtx_t1 set a2 = 'New Value' where a1 =2;
UPDATE 43
Release Savepoint sp85n2;
RELEASE
Select count(*) from nested_subtx_t1;
 count 
-------
   129
(1 row)

Select count(*) from nested_subtx_t2;
 count 
-------
     1
(1 row)

Release Savepoint sp85;
RELEASE
Savepoint sp86;
SAVEPOINT
Savepoint sp86n1;
SAVEPOINT
Insert into nested_subtx_t1 values(1, 'sub- and nested transactions','a','variable string','2-2-2012',5,'2012-10-10 10:23:54', '2011-10-19 10:23:54+02');
INSERT 0 1
Savepoint sp86n2;
SAVEPOINT
Insert into nested_subtx_t1 values(2, 'sub- and nested transactions','a','variable string','2-2-2012',5,'2012-10-10 10:23:54', '2011-10-19 10:23:54+02');
INSERT 0 1
Savepoint sp86n3;
SAVEPOINT
Insert into nested_subtx_t1 values(3, 'sub- and nested transactions','a','variable string','2-2-2012',5,'2012-10-10 10:23:54', '2011-10-19 10:23:54+02');
INSERT 0 1
Savepoint sp86n4;
SAVEPOINT
Insert into nested_subtx_t1 values(4, 'sub- and nested transactions','a','variable string','2-2-2012',5,'2012-10-10 10:23:54', '2011-10-19 10:23:54+02');
INSERT 0 1
Update nested_subtx_t1 set a2 = 'New Value' where a1 =4;
UPDATE 1
Release Savepoint sp86n4;
RELEASE
Select a2 from nested_subtx_t1 where a1 = 4;
    a2     
-----------
 New Value
(1 row)

Delete from nested_subtx_t2 where b1>0 ;
DELETE 1
Rollback to sp86n3;
ROLLBACK
Update nested_subtx_t1 set a2 = 'New Value' where a1 =2;
UPDATE 44
Release Savepoint sp86n2;
RELEASE
Select count(*) from nested_subtx_t1;
 count 
-------
   131
(1 row)

Select count(*) from nested_subtx_t2;
 count 
-------
     1
(1 row)

Rollback to sp86;
ROLLBACK
Savepoint sp87;
SAVEPOINT
Insert into nested_subtx_t1 values(87, 'sub- and nested transactions','a','variable string','2-2-2012',5,'2012-10-10 10:23:54', '2011-10-19 10:23:54+02');
INSERT 0 1
Savepoint sp87n1;
SAVEPOINT
Insert into nested_subtx_t1 values(1, 'sub- and nested transactions','a','variable string','2-2-2012',5,'2012-10-10 10:23:54', '2011-10-19 10:23:54+02');
INSERT 0 1
Savepoint sp87n2;
SAVEPOINT
Insert into nested_subtx_t1 values(2, 'sub- and nested transactions','a','variable string','2-2-2012',5,'2012-10-10 10:23:54', '2011-10-19 10:23:54+02');
INSERT 0 1
Savepoint sp87n3;
SAVEPOINT
Insert into nested_subtx_t1 values(3, 'sub- and nested transactions','a','variable string','2-2-2012',5,'2012-10-10 10:23:54', '2011-10-19 10:23:54+02');
INSERT 0 1
Savepoint sp87n4;
SAVEPOINT
Insert into nested_subtx_t1 values(4, 'sub- and nested transactions','a','variable string','2-2-2012',5,'2012-10-10 10:23:54', '2011-10-19 10:23:54+02');
INSERT 0 1
Update nested_subtx_t1 set a2 = 'New Value' where a1 =4;
UPDATE 1
Release Savepoint sp87n4;
RELEASE
Select a2 from nested_subtx_t1 where a1 = 4;
    a2     
-----------
 New Value
(1 row)

Delete from nested_subtx_t2 where b1>0 ;
DELETE 1
Rollback to sp87n3;
ROLLBACK
Update nested_subtx_t1 set a2 = 'New Value' where a1 =2;
UPDATE 44
Release Savepoint sp87n2;
RELEASE
Select count(*) from nested_subtx_t1;
 count 
-------
   132
(1 row)

Select count(*) from nested_subtx_t2;
 count 
-------
     1
(1 row)

Release Savepoint sp87;
RELEASE
Savepoint sp88;
SAVEPOINT
Savepoint sp88n1;
SAVEPOINT
Insert into nested_subtx_t1 values(1, 'sub- and nested transactions','a','variable string','2-2-2012',5,'2012-10-10 10:23:54', '2011-10-19 10:23:54+02');
INSERT 0 1
Savepoint sp88n2;
SAVEPOINT
Insert into nested_subtx_t1 values(2, 'sub- and nested transactions','a','variable string','2-2-2012',5,'2012-10-10 10:23:54', '2011-10-19 10:23:54+02');
INSERT 0 1
Savepoint sp88n3;
SAVEPOINT
Insert into nested_subtx_t1 values(3, 'sub- and nested transactions','a','variable string','2-2-2012',5,'2012-10-10 10:23:54', '2011-10-19 10:23:54+02');
INSERT 0 1
Savepoint sp88n4;
SAVEPOINT
Insert into nested_subtx_t1 values(4, 'sub- and nested transactions','a','variable string','2-2-2012',5,'2012-10-10 10:23:54', '2011-10-19 10:23:54+02');
INSERT 0 1
Update nested_subtx_t1 set a2 = 'New Value' where a1 =4;
UPDATE 1
Release Savepoint sp88n4;
RELEASE
Select a2 from nested_subtx_t1 where a1 = 4;
    a2     
-----------
 New Value
(1 row)

Delete from nested_subtx_t2 where b1>0 ;
DELETE 1
Rollback to sp88n3;
ROLLBACK
Update nested_subtx_t1 set a2 = 'New Value' where a1 =2;
UPDATE 45
Release Savepoint sp88n2;
RELEASE
Select count(*) from nested_subtx_t1;
 count 
-------
   134
(1 row)

Select count(*) from nested_subtx_t2;
 count 
-------
     1
(1 row)

Rollback to sp88;
ROLLBACK
Savepoint sp89;
SAVEPOINT
Insert into nested_subtx_t1 values(89, 'sub- and nested transactions','a','variable string','2-2-2012',5,'2012-10-10 10:23:54', '2011-10-19 10:23:54+02');
INSERT 0 1
Savepoint sp89n1;
SAVEPOINT
Insert into nested_subtx_t1 values(1, 'sub- and nested transactions','a','variable string','2-2-2012',5,'2012-10-10 10:23:54', '2011-10-19 10:23:54+02');
INSERT 0 1
Savepoint sp89n2;
SAVEPOINT
Insert into nested_subtx_t1 values(2, 'sub- and nested transactions','a','variable string','2-2-2012',5,'2012-10-10 10:23:54', '2011-10-19 10:23:54+02');
INSERT 0 1
Savepoint sp89n3;
SAVEPOINT
Insert into nested_subtx_t1 values(3, 'sub- and nested transactions','a','variable string','2-2-2012',5,'2012-10-10 10:23:54', '2011-10-19 10:23:54+02');
INSERT 0 1
Savepoint sp89n4;
SAVEPOINT
Insert into nested_subtx_t1 values(4, 'sub- and nested transactions','a','variable string','2-2-2012',5,'2012-10-10 10:23:54', '2011-10-19 10:23:54+02');
INSERT 0 1
Update nested_subtx_t1 set a2 = 'New Value' where a1 =4;
UPDATE 1
Release Savepoint sp89n4;
RELEASE
Select a2 from nested_subtx_t1 where a1 = 4;
    a2     
-----------
 New Value
(1 row)

Delete from nested_subtx_t2 where b1>0 ;
DELETE 1
Rollback to sp89n3;
ROLLBACK
Update nested_subtx_t1 set a2 = 'New Value' where a1 =2;
UPDATE 45
Release Savepoint sp89n2;
RELEASE
Select count(*) from nested_subtx_t1;
 count 
-------
   135
(1 row)

Select count(*) from nested_subtx_t2;
 count 
-------
     1
(1 row)

Release Savepoint sp89;
RELEASE
Savepoint sp90;
SAVEPOINT
Savepoint sp90n1;
SAVEPOINT
Insert into nested_subtx_t1 values(1, 'sub- and nested transactions','a','variable string','2-2-2012',5,'2012-10-10 10:23:54', '2011-10-19 10:23:54+02');
INSERT 0 1
Savepoint sp90n2;
SAVEPOINT
Insert into nested_subtx_t1 values(2, 'sub- and nested transactions','a','variable string','2-2-2012',5,'2012-10-10 10:23:54', '2011-10-19 10:23:54+02');
INSERT 0 1
Savepoint sp90n3;
SAVEPOINT
Insert into nested_subtx_t1 values(3, 'sub- and nested transactions','a','variable string','2-2-2012',5,'2012-10-10 10:23:54', '2011-10-19 10:23:54+02');
INSERT 0 1
Savepoint sp90n4;
SAVEPOINT
Insert into nested_subtx_t1 values(4, 'sub- and nested transactions','a','variable string','2-2-2012',5,'2012-10-10 10:23:54', '2011-10-19 10:23:54+02');
INSERT 0 1
Update nested_subtx_t1 set a2 = 'New Value' where a1 =4;
UPDATE 1
Release Savepoint sp90n4;
RELEASE
Select a2 from nested_subtx_t1 where a1 = 4;
    a2     
-----------
 New Value
(1 row)

Delete from nested_subtx_t2 where b1>0 ;
DELETE 1
Rollback to sp90n3;
ROLLBACK
Update nested_subtx_t1 set a2 = 'New Value' where a1 =2;
UPDATE 46
Release Savepoint sp90n2;
RELEASE
Select count(*) from nested_subtx_t1;
 count 
-------
   137
(1 row)

Select count(*) from nested_subtx_t2;
 count 
-------
     1
(1 row)

Rollback to sp90;
ROLLBACK
Savepoint sp91;
SAVEPOINT
Insert into nested_subtx_t1 values(91, 'sub- and nested transactions','a','variable string','2-2-2012',5,'2012-10-10 10:23:54', '2011-10-19 10:23:54+02');
INSERT 0 1
Savepoint sp91n1;
SAVEPOINT
Insert into nested_subtx_t1 values(1, 'sub- and nested transactions','a','variable string','2-2-2012',5,'2012-10-10 10:23:54', '2011-10-19 10:23:54+02');
INSERT 0 1
Savepoint sp91n2;
SAVEPOINT
Insert into nested_subtx_t1 values(2, 'sub- and nested transactions','a','variable string','2-2-2012',5,'2012-10-10 10:23:54', '2011-10-19 10:23:54+02');
INSERT 0 1
Savepoint sp91n3;
SAVEPOINT
Insert into nested_subtx_t1 values(3, 'sub- and nested transactions','a','variable string','2-2-2012',5,'2012-10-10 10:23:54', '2011-10-19 10:23:54+02');
INSERT 0 1
Savepoint sp91n4;
SAVEPOINT
Insert into nested_subtx_t1 values(4, 'sub- and nested transactions','a','variable string','2-2-2012',5,'2012-10-10 10:23:54', '2011-10-19 10:23:54+02');
INSERT 0 1
Update nested_subtx_t1 set a2 = 'New Value' where a1 =4;
UPDATE 1
Release Savepoint sp91n4;
RELEASE
Select a2 from nested_subtx_t1 where a1 = 4;
    a2     
-----------
 New Value
(1 row)

Delete from nested_subtx_t2 where b1>0 ;
DELETE 1
Rollback to sp91n3;
ROLLBACK
Update nested_subtx_t1 set a2 = 'New Value' where a1 =2;
UPDATE 46
Release Savepoint sp91n2;
RELEASE
Select count(*) from nested_subtx_t1;
 count 
-------
   138
(1 row)

Select count(*) from nested_subtx_t2;
 count 
-------
     1
(1 row)

Release Savepoint sp91;
RELEASE
Savepoint sp92;
SAVEPOINT
Savepoint sp92n1;
SAVEPOINT
Insert into nested_subtx_t1 values(1, 'sub- and nested transactions','a','variable string','2-2-2012',5,'2012-10-10 10:23:54', '2011-10-19 10:23:54+02');
INSERT 0 1
Savepoint sp92n2;
SAVEPOINT
Insert into nested_subtx_t1 values(2, 'sub- and nested transactions','a','variable string','2-2-2012',5,'2012-10-10 10:23:54', '2011-10-19 10:23:54+02');
INSERT 0 1
Savepoint sp92n3;
SAVEPOINT
Insert into nested_subtx_t1 values(3, 'sub- and nested transactions','a','variable string','2-2-2012',5,'2012-10-10 10:23:54', '2011-10-19 10:23:54+02');
INSERT 0 1
Savepoint sp92n4;
SAVEPOINT
Insert into nested_subtx_t1 values(4, 'sub- and nested transactions','a','variable string','2-2-2012',5,'2012-10-10 10:23:54', '2011-10-19 10:23:54+02');
INSERT 0 1
Update nested_subtx_t1 set a2 = 'New Value' where a1 =4;
UPDATE 1
Release Savepoint sp92n4;
RELEASE
Select a2 from nested_subtx_t1 where a1 = 4;
    a2     
-----------
 New Value
(1 row)

Delete from nested_subtx_t2 where b1>0 ;
DELETE 1
Rollback to sp92n3;
ROLLBACK
Update nested_subtx_t1 set a2 = 'New Value' where a1 =2;
UPDATE 47
Release Savepoint sp92n2;
RELEASE
Select count(*) from nested_subtx_t1;
 count 
-------
   140
(1 row)

Select count(*) from nested_subtx_t2;
 count 
-------
     1
(1 row)

Rollback to sp92;
ROLLBACK
Savepoint sp93;
SAVEPOINT
Insert into nested_subtx_t1 values(93, 'sub- and nested transactions','a','variable string','2-2-2012',5,'2012-10-10 10:23:54', '2011-10-19 10:23:54+02');
INSERT 0 1
Savepoint sp93n1;
SAVEPOINT
Insert into nested_subtx_t1 values(1, 'sub- and nested transactions','a','variable string','2-2-2012',5,'2012-10-10 10:23:54', '2011-10-19 10:23:54+02');
INSERT 0 1
Savepoint sp93n2;
SAVEPOINT
Insert into nested_subtx_t1 values(2, 'sub- and nested transactions','a','variable string','2-2-2012',5,'2012-10-10 10:23:54', '2011-10-19 10:23:54+02');
INSERT 0 1
Savepoint sp93n3;
SAVEPOINT
Insert into nested_subtx_t1 values(3, 'sub- and nested transactions','a','variable string','2-2-2012',5,'2012-10-10 10:23:54', '2011-10-19 10:23:54+02');
INSERT 0 1
Savepoint sp93n4;
SAVEPOINT
Insert into nested_subtx_t1 values(4, 'sub- and nested transactions','a','variable string','2-2-2012',5,'2012-10-10 10:23:54', '2011-10-19 10:23:54+02');
INSERT 0 1
Update nested_subtx_t1 set a2 = 'New Value' where a1 =4;
UPDATE 1
Release Savepoint sp93n4;
RELEASE
Select a2 from nested_subtx_t1 where a1 = 4;
    a2     
-----------
 New Value
(1 row)

Delete from nested_subtx_t2 where b1>0 ;
DELETE 1
Rollback to sp93n3;
ROLLBACK
Update nested_subtx_t1 set a2 = 'New Value' where a1 =2;
UPDATE 47
Release Savepoint sp93n2;
RELEASE
Select count(*) from nested_subtx_t1;
 count 
-------
   141
(1 row)

Select count(*) from nested_subtx_t2;
 count 
-------
     1
(1 row)

Release Savepoint sp93;
RELEASE
Savepoint sp94;
SAVEPOINT
Savepoint sp94n1;
SAVEPOINT
Insert into nested_subtx_t1 values(1, 'sub- and nested transactions','a','variable string','2-2-2012',5,'2012-10-10 10:23:54', '2011-10-19 10:23:54+02');
INSERT 0 1
Savepoint sp94n2;
SAVEPOINT
Insert into nested_subtx_t1 values(2, 'sub- and nested transactions','a','variable string','2-2-2012',5,'2012-10-10 10:23:54', '2011-10-19 10:23:54+02');
INSERT 0 1
Savepoint sp94n3;
SAVEPOINT
Insert into nested_subtx_t1 values(3, 'sub- and nested transactions','a','variable string','2-2-2012',5,'2012-10-10 10:23:54', '2011-10-19 10:23:54+02');
INSERT 0 1
Savepoint sp94n4;
SAVEPOINT
Insert into nested_subtx_t1 values(4, 'sub- and nested transactions','a','variable string','2-2-2012',5,'2012-10-10 10:23:54', '2011-10-19 10:23:54+02');
INSERT 0 1
Update nested_subtx_t1 set a2 = 'New Value' where a1 =4;
UPDATE 1
Release Savepoint sp94n4;
RELEASE
Select a2 from nested_subtx_t1 where a1 = 4;
    a2     
-----------
 New Value
(1 row)

Delete from nested_subtx_t2 where b1>0 ;
DELETE 1
Rollback to sp94n3;
ROLLBACK
Update nested_subtx_t1 set a2 = 'New Value' where a1 =2;
UPDATE 48
Release Savepoint sp94n2;
RELEASE
Select count(*) from nested_subtx_t1;
 count 
-------
   143
(1 row)

Select count(*) from nested_subtx_t2;
 count 
-------
     1
(1 row)

Rollback to sp94;
ROLLBACK
Savepoint sp95;
SAVEPOINT
Insert into nested_subtx_t1 values(95, 'sub- and nested transactions','a','variable string','2-2-2012',5,'2012-10-10 10:23:54', '2011-10-19 10:23:54+02');
INSERT 0 1
Savepoint sp95n1;
SAVEPOINT
Insert into nested_subtx_t1 values(1, 'sub- and nested transactions','a','variable string','2-2-2012',5,'2012-10-10 10:23:54', '2011-10-19 10:23:54+02');
INSERT 0 1
Savepoint sp95n2;
SAVEPOINT
Insert into nested_subtx_t1 values(2, 'sub- and nested transactions','a','variable string','2-2-2012',5,'2012-10-10 10:23:54', '2011-10-19 10:23:54+02');
INSERT 0 1
Savepoint sp95n3;
SAVEPOINT
Insert into nested_subtx_t1 values(3, 'sub- and nested transactions','a','variable string','2-2-2012',5,'2012-10-10 10:23:54', '2011-10-19 10:23:54+02');
INSERT 0 1
Savepoint sp95n4;
SAVEPOINT
Insert into nested_subtx_t1 values(4, 'sub- and nested transactions','a','variable string','2-2-2012',5,'2012-10-10 10:23:54', '2011-10-19 10:23:54+02');
INSERT 0 1
Update nested_subtx_t1 set a2 = 'New Value' where a1 =4;
UPDATE 1
Release Savepoint sp95n4;
RELEASE
Select a2 from nested_subtx_t1 where a1 = 4;
    a2     
-----------
 New Value
(1 row)

Delete from nested_subtx_t2 where b1>0 ;
DELETE 1
Rollback to sp95n3;
ROLLBACK
Update nested_subtx_t1 set a2 = 'New Value' where a1 =2;
UPDATE 48
Release Savepoint sp95n2;
RELEASE
Select count(*) from nested_subtx_t1;
 count 
-------
   144
(1 row)

Select count(*) from nested_subtx_t2;
 count 
-------
     1
(1 row)

Release Savepoint sp95;
RELEASE
Savepoint sp96;
SAVEPOINT
Savepoint sp96n1;
SAVEPOINT
Insert into nested_subtx_t1 values(1, 'sub- and nested transactions','a','variable string','2-2-2012',5,'2012-10-10 10:23:54', '2011-10-19 10:23:54+02');
INSERT 0 1
Savepoint sp96n2;
SAVEPOINT
Insert into nested_subtx_t1 values(2, 'sub- and nested transactions','a','variable string','2-2-2012',5,'2012-10-10 10:23:54', '2011-10-19 10:23:54+02');
INSERT 0 1
Savepoint sp96n3;
SAVEPOINT
Insert into nested_subtx_t1 values(3, 'sub- and nested transactions','a','variable string','2-2-2012',5,'2012-10-10 10:23:54', '2011-10-19 10:23:54+02');
INSERT 0 1
Savepoint sp96n4;
SAVEPOINT
Insert into nested_subtx_t1 values(4, 'sub- and nested transactions','a','variable string','2-2-2012',5,'2012-10-10 10:23:54', '2011-10-19 10:23:54+02');
INSERT 0 1
Update nested_subtx_t1 set a2 = 'New Value' where a1 =4;
UPDATE 1
Release Savepoint sp96n4;
RELEASE
Select a2 from nested_subtx_t1 where a1 = 4;
    a2     
-----------
 New Value
(1 row)

Delete from nested_subtx_t2 where b1>0 ;
DELETE 1
Rollback to sp96n3;
ROLLBACK
Update nested_subtx_t1 set a2 = 'New Value' where a1 =2;
UPDATE 49
Release Savepoint sp96n2;
RELEASE
Select count(*) from nested_subtx_t1;
 count 
-------
   146
(1 row)

Select count(*) from nested_subtx_t2;
 count 
-------
     1
(1 row)

Rollback to sp96;
ROLLBACK
Savepoint sp97;
SAVEPOINT
Insert into nested_subtx_t1 values(97, 'sub- and nested transactions','a','variable string','2-2-2012',5,'2012-10-10 10:23:54', '2011-10-19 10:23:54+02');
INSERT 0 1
Savepoint sp97n1;
SAVEPOINT
Insert into nested_subtx_t1 values(1, 'sub- and nested transactions','a','variable string','2-2-2012',5,'2012-10-10 10:23:54', '2011-10-19 10:23:54+02');
INSERT 0 1
Savepoint sp97n2;
SAVEPOINT
Insert into nested_subtx_t1 values(2, 'sub- and nested transactions','a','variable string','2-2-2012',5,'2012-10-10 10:23:54', '2011-10-19 10:23:54+02');
INSERT 0 1
Savepoint sp97n3;
SAVEPOINT
Insert into nested_subtx_t1 values(3, 'sub- and nested transactions','a','variable string','2-2-2012',5,'2012-10-10 10:23:54', '2011-10-19 10:23:54+02');
INSERT 0 1
Savepoint sp97n4;
SAVEPOINT
Insert into nested_subtx_t1 values(4, 'sub- and nested transactions','a','variable string','2-2-2012',5,'2012-10-10 10:23:54', '2011-10-19 10:23:54+02');
INSERT 0 1
Update nested_subtx_t1 set a2 = 'New Value' where a1 =4;
UPDATE 1
Release Savepoint sp97n4;
RELEASE
Select a2 from nested_subtx_t1 where a1 = 4;
    a2     
-----------
 New Value
(1 row)

Delete from nested_subtx_t2 where b1>0 ;
DELETE 1
Rollback to sp97n3;
ROLLBACK
Update nested_subtx_t1 set a2 = 'New Value' where a1 =2;
UPDATE 49
Release Savepoint sp97n2;
RELEASE
Select count(*) from nested_subtx_t1;
 count 
-------
   147
(1 row)

Select count(*) from nested_subtx_t2;
 count 
-------
     1
(1 row)

Release Savepoint sp97;
RELEASE
Savepoint sp98;
SAVEPOINT
Savepoint sp98n1;
SAVEPOINT
Insert into nested_subtx_t1 values(1, 'sub- and nested transactions','a','variable string','2-2-2012',5,'2012-10-10 10:23:54', '2011-10-19 10:23:54+02');
INSERT 0 1
Savepoint sp98n2;
SAVEPOINT
Insert into nested_subtx_t1 values(2, 'sub- and nested transactions','a','variable string','2-2-2012',5,'2012-10-10 10:23:54', '2011-10-19 10:23:54+02');
INSERT 0 1
Savepoint sp98n3;
SAVEPOINT
Insert into nested_subtx_t1 values(3, 'sub- and nested transactions','a','variable string','2-2-2012',5,'2012-10-10 10:23:54', '2011-10-19 10:23:54+02');
INSERT 0 1
Savepoint sp98n4;
SAVEPOINT
Insert into nested_subtx_t1 values(4, 'sub- and nested transactions','a','variable string','2-2-2012',5,'2012-10-10 10:23:54', '2011-10-19 10:23:54+02');
INSERT 0 1
Update nested_subtx_t1 set a2 = 'New Value' where a1 =4;
UPDATE 1
Release Savepoint sp98n4;
RELEASE
Select a2 from nested_subtx_t1 where a1 = 4;
    a2     
-----------
 New Value
(1 row)

Delete from nested_subtx_t2 where b1>0 ;
DELETE 1
Rollback to sp98n3;
ROLLBACK
Update nested_subtx_t1 set a2 = 'New Value' where a1 =2;
UPDATE 50
Release Savepoint sp98n2;
RELEASE
Select count(*) from nested_subtx_t1;
 count 
-------
   149
(1 row)

Select count(*) from nested_subtx_t2;
 count 
-------
     1
(1 row)

Rollback to sp98;
ROLLBACK
Savepoint sp99;
SAVEPOINT
Insert into nested_subtx_t1 values(99, 'sub- and nested transactions','a','variable string','2-2-2012',5,'2012-10-10 10:23:54', '2011-10-19 10:23:54+02');
INSERT 0 1
Savepoint sp99n1;
SAVEPOINT
Insert into nested_subtx_t1 values(1, 'sub- and nested transactions','a','variable string','2-2-2012',5,'2012-10-10 10:23:54', '2011-10-19 10:23:54+02');
INSERT 0 1
Savepoint sp99n2;
SAVEPOINT
Insert into nested_subtx_t1 values(2, 'sub- and nested transactions','a','variable string','2-2-2012',5,'2012-10-10 10:23:54', '2011-10-19 10:23:54+02');
INSERT 0 1
Savepoint sp99n3;
SAVEPOINT
Insert into nested_subtx_t1 values(3, 'sub- and nested transactions','a','variable string','2-2-2012',5,'2012-10-10 10:23:54', '2011-10-19 10:23:54+02');
INSERT 0 1
Savepoint sp99n4;
SAVEPOINT
Insert into nested_subtx_t1 values(4, 'sub- and nested transactions','a','variable string','2-2-2012',5,'2012-10-10 10:23:54', '2011-10-19 10:23:54+02');
INSERT 0 1
Update nested_subtx_t1 set a2 = 'New Value' where a1 =4;
UPDATE 1
Release Savepoint sp99n4;
RELEASE
Select a2 from nested_subtx_t1 where a1 = 4;
    a2     
-----------
 New Value
(1 row)

Delete from nested_subtx_t2 where b1>0 ;
DELETE 1
Rollback to sp99n3;
ROLLBACK
Update nested_subtx_t1 set a2 = 'New Value' where a1 =2;
UPDATE 50
Release Savepoint sp99n2;
RELEASE
Select count(*) from nested_subtx_t1;
 count 
-------
   150
(1 row)

Select count(*) from nested_subtx_t2;
 count 
-------
     1
(1 row)

Release Savepoint sp99;
RELEASE
Savepoint sp100;
SAVEPOINT
Savepoint sp100n1;
SAVEPOINT
Insert into nested_subtx_t1 values(1, 'sub- and nested transactions','a','variable string','2-2-2012',5,'2012-10-10 10:23:54', '2011-10-19 10:23:54+02');
INSERT 0 1
Savepoint sp100n2;
SAVEPOINT
Insert into nested_subtx_t1 values(2, 'sub- and nested transactions','a','variable string','2-2-2012',5,'2012-10-10 10:23:54', '2011-10-19 10:23:54+02');
INSERT 0 1
Savepoint sp100n3;
SAVEPOINT
Insert into nested_subtx_t1 values(3, 'sub- and nested transactions','a','variable string','2-2-2012',5,'2012-10-10 10:23:54', '2011-10-19 10:23:54+02');
INSERT 0 1
Savepoint sp100n4;
SAVEPOINT
Insert into nested_subtx_t1 values(4, 'sub- and nested transactions','a','variable string','2-2-2012',5,'2012-10-10 10:23:54', '2011-10-19 10:23:54+02');
INSERT 0 1
Update nested_subtx_t1 set a2 = 'New Value' where a1 =4;
UPDATE 1
Release Savepoint sp100n4;
RELEASE
Select a2 from nested_subtx_t1 where a1 = 4;
    a2     
-----------
 New Value
(1 row)

Delete from nested_subtx_t2 where b1>0 ;
DELETE 1
Rollback to sp100n3;
ROLLBACK
Update nested_subtx_t1 set a2 = 'New Value' where a1 =2;
UPDATE 51
Release Savepoint sp100n2;
RELEASE
Select count(*) from nested_subtx_t1;
 count 
-------
   152
(1 row)

Select count(*) from nested_subtx_t2;
 count 
-------
     1
(1 row)

Rollback to sp100;
ROLLBACK
Commit;
COMMIT
