DROP TABLE IF EXISTS mpp21090_xchange_pttab_dropcol_addcol_dml_time;
psql:/data/prabhd/test/tincrepo/main/dml/functional/output/mpp21090_xchange_pttab_dropcol_addcol_dml_time_opt.sql:14: NOTICE:  table "mpp21090_xchange_pttab_dropcol_addcol_dml_time" does not exist, skipping
DROP TABLE
CREATE TABLE mpp21090_xchange_pttab_dropcol_addcol_dml_time
(
    col1 time,
    col2 time,
    col3 char,
    col4 int,
    col5 time
) 
DISTRIBUTED by (col1)
PARTITION BY RANGE(col2)(partition partone start('12:00:00') end('18:00:00')  WITH (APPENDONLY=true, COMPRESSLEVEL=5, ORIENTATION=column),partition parttwo start('18:00:00') end('24:00:00') WITH (APPENDONLY=true, COMPRESSLEVEL=5, ORIENTATION=row),partition partthree start('0:00:00') end('11:00:00'));
psql:/data/prabhd/test/tincrepo/main/dml/functional/output/mpp21090_xchange_pttab_dropcol_addcol_dml_time_opt.sql:24: NOTICE:  CREATE TABLE will create partition "mpp21090_xchange_pttab_dropcol_addcol_dml_time_1_prt_partthree" for table "mpp21090_xchange_pttab_dropcol_addcol_dml_time"
psql:/data/prabhd/test/tincrepo/main/dml/functional/output/mpp21090_xchange_pttab_dropcol_addcol_dml_time_opt.sql:24: NOTICE:  CREATE TABLE will create partition "mpp21090_xchange_pttab_dropcol_addcol_dml_time_1_prt_partone" for table "mpp21090_xchange_pttab_dropcol_addcol_dml_time"
psql:/data/prabhd/test/tincrepo/main/dml/functional/output/mpp21090_xchange_pttab_dropcol_addcol_dml_time_opt.sql:24: NOTICE:  CREATE TABLE will create partition "mpp21090_xchange_pttab_dropcol_addcol_dml_time_1_prt_parttwo" for table "mpp21090_xchange_pttab_dropcol_addcol_dml_time"
CREATE TABLE
INSERT INTO mpp21090_xchange_pttab_dropcol_addcol_dml_time VALUES('12:00:00','12:00:00','a',0, '12:00:00');
INSERT 0 1
SELECT * FROM mpp21090_xchange_pttab_dropcol_addcol_dml_time ORDER BY 1,2,3,4;
   col1   |   col2   | col3 | col4 |   col5   
----------+----------+------+------+----------
 12:00:00 | 12:00:00 | a    |    0 | 12:00:00
(1 row)

ALTER TABLE mpp21090_xchange_pttab_dropcol_addcol_dml_time DROP COLUMN col1;
psql:/data/prabhd/test/tincrepo/main/dml/functional/output/mpp21090_xchange_pttab_dropcol_addcol_dml_time_opt.sql:29: NOTICE:  Dropping a column that is part of the distribution policy forces a NULL distribution policy
psql:/data/prabhd/test/tincrepo/main/dml/functional/output/mpp21090_xchange_pttab_dropcol_addcol_dml_time_opt.sql:29: NOTICE:  Dropping a column that is part of the distribution policy forces a NULL distribution policy
psql:/data/prabhd/test/tincrepo/main/dml/functional/output/mpp21090_xchange_pttab_dropcol_addcol_dml_time_opt.sql:29: NOTICE:  Dropping a column that is part of the distribution policy forces a NULL distribution policy
psql:/data/prabhd/test/tincrepo/main/dml/functional/output/mpp21090_xchange_pttab_dropcol_addcol_dml_time_opt.sql:29: NOTICE:  Dropping a column that is part of the distribution policy forces a NULL distribution policy
ALTER TABLE
ALTER TABLE mpp21090_xchange_pttab_dropcol_addcol_dml_time ADD COLUMN col1 time DEFAULT '12:00:00';
ALTER TABLE
-- Create Candidate table for Exchange
DROP TABLE IF EXISTS mpp21090_xchange_pttab_dropcol_addcol_dml_time_candidate;
psql:/data/prabhd/test/tincrepo/main/dml/functional/output/mpp21090_xchange_pttab_dropcol_addcol_dml_time_opt.sql:33: NOTICE:  table "mpp21090_xchange_pttab_dropcol_addcol_dml_time_candidate" does not exist, skipping
DROP TABLE
CREATE TABLE mpp21090_xchange_pttab_dropcol_addcol_dml_time_candidate( like mpp21090_xchange_pttab_dropcol_addcol_dml_time) distributed randomly;
CREATE TABLE
INSERT INTO mpp21090_xchange_pttab_dropcol_addcol_dml_time_candidate VALUES('12:00:00','z',1,'12:00:00','12:00:00');
INSERT 0 1
-- Exchange 
ALTER TABLE mpp21090_xchange_pttab_dropcol_addcol_dml_time EXCHANGE PARTITION FOR('15:00:00') WITH TABLE mpp21090_xchange_pttab_dropcol_addcol_dml_time_candidate;
psql:/data/prabhd/test/tincrepo/main/dml/functional/output/mpp21090_xchange_pttab_dropcol_addcol_dml_time_opt.sql:38: NOTICE:  exchanged partition "partone" of relation "mpp21090_xchange_pttab_dropcol_addcol_dml_time" with relation "mpp21090_xchange_pttab_dropcol_addcol_dml_time_candidate"
ALTER TABLE
SELECT * FROM mpp21090_xchange_pttab_dropcol_addcol_dml_time ORDER BY 1,2,3;
   col2   | col3 | col4 |   col5   |   col1   
----------+------+------+----------+----------
 12:00:00 | z    |    1 | 12:00:00 | 12:00:00
(1 row)

SELECT * FROM mpp21090_xchange_pttab_dropcol_addcol_dml_time_candidate ORDER BY 1,2,3;
   col2   | col3 | col4 |   col5   |   col1   
----------+------+------+----------+----------
 12:00:00 | a    |    0 | 12:00:00 | 12:00:00
(1 row)

-- DML on partition table
INSERT INTO mpp21090_xchange_pttab_dropcol_addcol_dml_time SELECT  '12:00:00','b', 1, '12:00:00', '12:00:00';
INSERT 0 1
SELECT * FROM mpp21090_xchange_pttab_dropcol_addcol_dml_time ORDER BY 1,2,3;
   col2   | col3 | col4 |   col5   |   col1   
----------+------+------+----------+----------
 12:00:00 | b    |    1 | 12:00:00 | 12:00:00
 12:00:00 | z    |    1 | 12:00:00 | 12:00:00
(2 rows)

UPDATE mpp21090_xchange_pttab_dropcol_addcol_dml_time SET col5 = '11:30:00' WHERE col2 = '12:00:00' AND col5 = '12:00:00';
UPDATE 2
SELECT * FROM mpp21090_xchange_pttab_dropcol_addcol_dml_time ORDER BY 1,2,3;
   col2   | col3 | col4 |   col5   |   col1   
----------+------+------+----------+----------
 12:00:00 | b    |    1 | 11:30:00 | 12:00:00
 12:00:00 | z    |    1 | 11:30:00 | 12:00:00
(2 rows)

UPDATE mpp21090_xchange_pttab_dropcol_addcol_dml_time SET col2 ='12:00:00' WHERE col3='b';
UPDATE 1
SELECT * FROM mpp21090_xchange_pttab_dropcol_addcol_dml_time ORDER BY 1,2,3;
   col2   | col3 | col4 |   col5   |   col1   
----------+------+------+----------+----------
 12:00:00 | b    |    1 | 11:30:00 | 12:00:00
 12:00:00 | z    |    1 | 11:30:00 | 12:00:00
(2 rows)

DELETE FROM mpp21090_xchange_pttab_dropcol_addcol_dml_time WHERE col3='b';
DELETE 1
SELECT * FROM mpp21090_xchange_pttab_dropcol_addcol_dml_time ORDER BY 1,2,3;
   col2   | col3 | col4 |   col5   |   col1   
----------+------+------+----------+----------
 12:00:00 | z    |    1 | 11:30:00 | 12:00:00
(1 row)

-- DML on candidate table
INSERT INTO mpp21090_xchange_pttab_dropcol_addcol_dml_time_candidate SELECT '12:00:00','b', 1, '12:00:00', '12:00:00';
INSERT 0 1
SELECT * FROM mpp21090_xchange_pttab_dropcol_addcol_dml_time_candidate ORDER BY 1,2,3;
   col2   | col3 | col4 |   col5   |   col1   
----------+------+------+----------+----------
 12:00:00 | a    |    0 | 12:00:00 | 12:00:00
 12:00:00 | b    |    1 | 12:00:00 | 12:00:00
(2 rows)

UPDATE mpp21090_xchange_pttab_dropcol_addcol_dml_time_candidate SET col2='12:00:00' WHERE col3='a';
UPDATE 1
SELECT * FROM mpp21090_xchange_pttab_dropcol_addcol_dml_time_candidate ORDER BY 1,2,3;
   col2   | col3 | col4 |   col5   |   col1   
----------+------+------+----------+----------
 12:00:00 | a    |    0 | 12:00:00 | 12:00:00
 12:00:00 | b    |    1 | 12:00:00 | 12:00:00
(2 rows)

DELETE FROM mpp21090_xchange_pttab_dropcol_addcol_dml_time_candidate WHERE col3='a';
DELETE 1
SELECT * FROM mpp21090_xchange_pttab_dropcol_addcol_dml_time_candidate ORDER BY 1,2,3;
   col2   | col3 | col4 |   col5   |   col1   
----------+------+------+----------+----------
 12:00:00 | b    |    1 | 12:00:00 | 12:00:00
(1 row)

