DROP TABLE IF EXISTS mpp21090_pttab_dropfirstcol_addpt_index_interval;
psql:/data/prabhd/test/tincrepo/main/dml/functional/output/mpp21090_pttab_dropfirstcol_addpt_index_interval_opt.sql:14: NOTICE:  table "mpp21090_pttab_dropfirstcol_addpt_index_interval" does not exist, skipping
DROP TABLE
CREATE TABLE mpp21090_pttab_dropfirstcol_addpt_index_interval
(
    col1 interval,
    col2 interval,
    col3 char,
    col4 interval,
    col5 int
) 
DISTRIBUTED by (col1)
PARTITION BY RANGE(col2)(partition partone start('1 sec') end('1 min')  WITH (APPENDONLY=true, COMPRESSLEVEL=5, ORIENTATION=column),partition parttwo start('1 min') end('1 hour') WITH (APPENDONLY=true, COMPRESSLEVEL=5, ORIENTATION=row),partition partthree start('1 hour') end('12 hours'));
psql:/data/prabhd/test/tincrepo/main/dml/functional/output/mpp21090_pttab_dropfirstcol_addpt_index_interval_opt.sql:24: NOTICE:  CREATE TABLE will create partition "mpp21090_pttab_dropfirstcol_addpt_index_interval_1_prt_partone" for table "mpp21090_pttab_dropfirstcol_addpt_index_interval"
psql:/data/prabhd/test/tincrepo/main/dml/functional/output/mpp21090_pttab_dropfirstcol_addpt_index_interval_opt.sql:24: NOTICE:  CREATE TABLE will create partition "mpp21090_pttab_dropfirstcol_addpt_index_interval_1_prt_parttwo" for table "mpp21090_pttab_dropfirstcol_addpt_index_interval"
psql:/data/prabhd/test/tincrepo/main/dml/functional/output/mpp21090_pttab_dropfirstcol_addpt_index_interval_opt.sql:24: NOTICE:  CREATE TABLE will create partition "mpp21090_pttab_dropfirstcol_addpt_index_interva_1_prt_partthree" for table "mpp21090_pttab_dropfirstcol_addpt_index_interval"
CREATE TABLE
INSERT INTO mpp21090_pttab_dropfirstcol_addpt_index_interval VALUES('10 secs','10 secs','a','10 secs',0);
INSERT 0 1
DROP INDEX IF EXISTS mpp21090_pttab_dropfirstcol_addpt_index_idx_interval;
psql:/data/prabhd/test/tincrepo/main/dml/functional/output/mpp21090_pttab_dropfirstcol_addpt_index_interval_opt.sql:28: NOTICE:  index "mpp21090_pttab_dropfirstcol_addpt_index_idx_interval" does not exist, skipping
DROP INDEX
CREATE INDEX mpp21090_pttab_dropfirstcol_addpt_index_idx_interval on mpp21090_pttab_dropfirstcol_addpt_index_interval(col2);
psql:/data/prabhd/test/tincrepo/main/dml/functional/output/mpp21090_pttab_dropfirstcol_addpt_index_interval_opt.sql:29: NOTICE:  building index for child partition "mpp21090_pttab_dropfirstcol_addpt_index_interval_1_prt_partone"
psql:/data/prabhd/test/tincrepo/main/dml/functional/output/mpp21090_pttab_dropfirstcol_addpt_index_interval_opt.sql:29: NOTICE:  building index for child partition "mpp21090_pttab_dropfirstcol_addpt_index_interval_1_prt_parttwo"
psql:/data/prabhd/test/tincrepo/main/dml/functional/output/mpp21090_pttab_dropfirstcol_addpt_index_interval_opt.sql:29: NOTICE:  building index for child partition "mpp21090_pttab_dropfirstcol_addpt_index_interva_1_prt_partthree"
CREATE INDEX
ALTER TABLE mpp21090_pttab_dropfirstcol_addpt_index_interval DROP COLUMN col1;
psql:/data/prabhd/test/tincrepo/main/dml/functional/output/mpp21090_pttab_dropfirstcol_addpt_index_interval_opt.sql:31: NOTICE:  Dropping a column that is part of the distribution policy forces a NULL distribution policy
psql:/data/prabhd/test/tincrepo/main/dml/functional/output/mpp21090_pttab_dropfirstcol_addpt_index_interval_opt.sql:31: NOTICE:  Dropping a column that is part of the distribution policy forces a NULL distribution policy
psql:/data/prabhd/test/tincrepo/main/dml/functional/output/mpp21090_pttab_dropfirstcol_addpt_index_interval_opt.sql:31: NOTICE:  Dropping a column that is part of the distribution policy forces a NULL distribution policy
psql:/data/prabhd/test/tincrepo/main/dml/functional/output/mpp21090_pttab_dropfirstcol_addpt_index_interval_opt.sql:31: NOTICE:  Dropping a column that is part of the distribution policy forces a NULL distribution policy
ALTER TABLE
ALTER TABLE mpp21090_pttab_dropfirstcol_addpt_index_interval ADD PARTITION partfour start('12 hours') end('1 day') inclusive;
psql:/data/prabhd/test/tincrepo/main/dml/functional/output/mpp21090_pttab_dropfirstcol_addpt_index_interval_opt.sql:32: NOTICE:  CREATE TABLE will create partition "mpp21090_pttab_dropfirstcol_addpt_index_interval_1_prt_partfour" for table "mpp21090_pttab_dropfirstcol_addpt_index_interval"
ALTER TABLE
INSERT INTO mpp21090_pttab_dropfirstcol_addpt_index_interval SELECT '14 hours','b','14 hours', 1;
INSERT 0 1
SELECT * FROM mpp21090_pttab_dropfirstcol_addpt_index_interval ORDER BY 1,2,3;
   col2   | col3 |   col4   | col5 
----------+------+----------+------
 00:00:10 | a    | 00:00:10 |    0
 14:00:00 | b    | 14:00:00 |    1
(2 rows)

UPDATE mpp21090_pttab_dropfirstcol_addpt_index_interval SET col4 = '11 hours' WHERE col2 = '14 hours' AND col4 = '14 hours';
UPDATE 1
SELECT * FROM mpp21090_pttab_dropfirstcol_addpt_index_interval ORDER BY 1,2,3;
   col2   | col3 |   col4   | col5 
----------+------+----------+------
 00:00:10 | a    | 00:00:10 |    0
 14:00:00 | b    | 11:00:00 |    1
(2 rows)

-- Update partition key
UPDATE mpp21090_pttab_dropfirstcol_addpt_index_interval SET col2 = '11 hours' WHERE col2 = '14 hours' AND col4 = '11 hours';
UPDATE 1
SELECT * FROM mpp21090_pttab_dropfirstcol_addpt_index_interval ORDER BY 1,2,3;
   col2   | col3 |   col4   | col5 
----------+------+----------+------
 00:00:10 | a    | 00:00:10 |    0
 11:00:00 | b    | 11:00:00 |    1
(2 rows)

DELETE FROM mpp21090_pttab_dropfirstcol_addpt_index_interval WHERE col2 = '11 hours';
DELETE 1
SELECT * FROM mpp21090_pttab_dropfirstcol_addpt_index_interval ORDER BY 1,2,3;
   col2   | col3 |   col4   | col5 
----------+------+----------+------
 00:00:10 | a    | 00:00:10 |    0
(1 row)

