DROP TABLE IF EXISTS mpp21090_dropcol_addcol_splitpt_dml_interval;
psql:/data/prabhd/test/tincrepo/main/dml/functional/output/mpp21090_dropcol_addcol_splitpt_dml_interval_opt.sql:14: NOTICE:  table "mpp21090_dropcol_addcol_splitpt_dml_interval" does not exist, skipping
DROP TABLE
CREATE TABLE mpp21090_dropcol_addcol_splitpt_dml_interval
(
    col1 interval,
    col2 interval,
    col3 char,
    col4 interval
) 
DISTRIBUTED by (col1)
PARTITION BY RANGE(col2)(partition partone start('1 sec') end('1 min')  WITH (APPENDONLY=true, COMPRESSLEVEL=5, ORIENTATION=column),partition parttwo start('1 min') end('1 hour') WITH (APPENDONLY=true, COMPRESSLEVEL=5, ORIENTATION=row),partition partthree start('1 hour') end('12 hours'));
psql:/data/prabhd/test/tincrepo/main/dml/functional/output/mpp21090_dropcol_addcol_splitpt_dml_interval_opt.sql:23: NOTICE:  CREATE TABLE will create partition "mpp21090_dropcol_addcol_splitpt_dml_interval_1_prt_partone" for table "mpp21090_dropcol_addcol_splitpt_dml_interval"
psql:/data/prabhd/test/tincrepo/main/dml/functional/output/mpp21090_dropcol_addcol_splitpt_dml_interval_opt.sql:23: NOTICE:  CREATE TABLE will create partition "mpp21090_dropcol_addcol_splitpt_dml_interval_1_prt_parttwo" for table "mpp21090_dropcol_addcol_splitpt_dml_interval"
psql:/data/prabhd/test/tincrepo/main/dml/functional/output/mpp21090_dropcol_addcol_splitpt_dml_interval_opt.sql:23: NOTICE:  CREATE TABLE will create partition "mpp21090_dropcol_addcol_splitpt_dml_interval_1_prt_partthree" for table "mpp21090_dropcol_addcol_splitpt_dml_interval"
CREATE TABLE
INSERT INTO mpp21090_dropcol_addcol_splitpt_dml_interval VALUES('1 hour','1 hour','a','1 hour');
INSERT 0 1
SELECT * FROM mpp21090_dropcol_addcol_splitpt_dml_interval ORDER BY 1,2,3,4;
   col1   |   col2   | col3 |   col4   
----------+----------+------+----------
 01:00:00 | 01:00:00 | a    | 01:00:00
(1 row)

ALTER TABLE mpp21090_dropcol_addcol_splitpt_dml_interval ADD COLUMN col5 int DEFAULT 10;
ALTER TABLE
INSERT INTO mpp21090_dropcol_addcol_splitpt_dml_interval VALUES('1 hour','1 hour','b','1 hour',0);
INSERT 0 1
SELECT * FROM mpp21090_dropcol_addcol_splitpt_dml_interval ORDER BY 1,2,3,4;
   col1   |   col2   | col3 |   col4   | col5 
----------+----------+------+----------+------
 01:00:00 | 01:00:00 | a    | 01:00:00 |   10
 01:00:00 | 01:00:00 | b    | 01:00:00 |    0
(2 rows)

ALTER TABLE mpp21090_dropcol_addcol_splitpt_dml_interval DROP COLUMN col4;
ALTER TABLE
INSERT INTO mpp21090_dropcol_addcol_splitpt_dml_interval VALUES('1 hour','1 hour','c',1);
INSERT 0 1
SELECT * FROM mpp21090_dropcol_addcol_splitpt_dml_interval ORDER BY 1,2,3,4;
   col1   |   col2   | col3 | col5 
----------+----------+------+------
 01:00:00 | 01:00:00 | a    |   10
 01:00:00 | 01:00:00 | b    |    0
 01:00:00 | 01:00:00 | c    |    1
(3 rows)

ALTER TABLE mpp21090_dropcol_addcol_splitpt_dml_interval SPLIT PARTITION partone at ('30 secs') into (partition partsplitone,partition partsplitwo);
psql:/data/prabhd/test/tincrepo/main/dml/functional/output/mpp21090_dropcol_addcol_splitpt_dml_interval_opt.sql:38: NOTICE:  exchanged partition "partone" of relation "mpp21090_dropcol_addcol_splitpt_dml_interval" with relation "pg_temp_54166"
psql:/data/prabhd/test/tincrepo/main/dml/functional/output/mpp21090_dropcol_addcol_splitpt_dml_interval_opt.sql:38: NOTICE:  dropped partition "partone" for relation "mpp21090_dropcol_addcol_splitpt_dml_interval"
psql:/data/prabhd/test/tincrepo/main/dml/functional/output/mpp21090_dropcol_addcol_splitpt_dml_interval_opt.sql:38: NOTICE:  CREATE TABLE will create partition "mpp21090_dropcol_addcol_splitpt_dml_interval_1_prt_partsplitone" for table "mpp21090_dropcol_addcol_splitpt_dml_interval"
psql:/data/prabhd/test/tincrepo/main/dml/functional/output/mpp21090_dropcol_addcol_splitpt_dml_interval_opt.sql:38: NOTICE:  CREATE TABLE will create partition "mpp21090_dropcol_addcol_splitpt_dml_interval_1_prt_partsplitwo" for table "mpp21090_dropcol_addcol_splitpt_dml_interval"
ALTER TABLE
INSERT INTO mpp21090_dropcol_addcol_splitpt_dml_interval SELECT '1 sec', '1 sec','d', 1;
INSERT 0 1
SELECT * FROM mpp21090_dropcol_addcol_splitpt_dml_interval ORDER BY 1,2,3;
   col1   |   col2   | col3 | col5 
----------+----------+------+------
 00:00:01 | 00:00:01 | d    |    1
 01:00:00 | 01:00:00 | a    |   10
 01:00:00 | 01:00:00 | b    |    0
 01:00:00 | 01:00:00 | c    |    1
(4 rows)

-- Update distribution key
UPDATE mpp21090_dropcol_addcol_splitpt_dml_interval SET col1 = '14 hours' WHERE col2 = '1 sec' AND col1 = '1 sec';
UPDATE 1
SELECT * FROM mpp21090_dropcol_addcol_splitpt_dml_interval ORDER BY 1,2,3;
   col1   |   col2   | col3 | col5 
----------+----------+------+------
 01:00:00 | 01:00:00 | a    |   10
 01:00:00 | 01:00:00 | b    |    0
 01:00:00 | 01:00:00 | c    |    1
 14:00:00 | 00:00:01 | d    |    1
(4 rows)

-- Update partition key
UPDATE mpp21090_dropcol_addcol_splitpt_dml_interval SET col2 ='1 hour'  WHERE col2 = '1 sec' AND col1 = '14 hours';
UPDATE 1
SELECT * FROM mpp21090_dropcol_addcol_splitpt_dml_interval ORDER BY 1,2,3;
   col1   |   col2   | col3 | col5 
----------+----------+------+------
 01:00:00 | 01:00:00 | a    |   10
 01:00:00 | 01:00:00 | b    |    0
 01:00:00 | 01:00:00 | c    |    1
 14:00:00 | 01:00:00 | d    |    1
(4 rows)

DELETE FROM mpp21090_dropcol_addcol_splitpt_dml_interval WHERE col3='b';
DELETE 1
SELECT * FROM mpp21090_dropcol_addcol_splitpt_dml_interval ORDER BY 1,2,3;
   col1   |   col2   | col3 | col5 
----------+----------+------+------
 01:00:00 | 01:00:00 | a    |   10
 01:00:00 | 01:00:00 | c    |    1
 14:00:00 | 01:00:00 | d    |    1
(3 rows)

