DROP TABLE IF EXISTS mpp21090_reordered_col_dml_char;
psql:/data/prabhd/test/tincrepo/main/dml/functional/output/mpp21090_reordered_col_dml_char_opt.sql:14: NOTICE:  table "mpp21090_reordered_col_dml_char" does not exist, skipping
DROP TABLE
CREATE TABLE mpp21090_reordered_col_dml_char
(
    col1 char DEFAULT 'a',
    col2 char,
    col3 char,
    col4 char,
    col5 int
) 
DISTRIBUTED by (col1)
PARTITION BY LIST(col2)(partition partone VALUES('a','b','c','d','e','f','g','h') WITH (APPENDONLY=true, COMPRESSLEVEL=5, ORIENTATION=column),partition parttwo VALUES('i','j','k','l','m','n','o','p') WITH (APPENDONLY=true, COMPRESSLEVEL=5, ORIENTATION=row),partition partthree VALUES('q','r','s','t','u','v','w','x'));
psql:/data/prabhd/test/tincrepo/main/dml/functional/output/mpp21090_reordered_col_dml_char_opt.sql:24: NOTICE:  CREATE TABLE will create partition "mpp21090_reordered_col_dml_char_1_prt_partone" for table "mpp21090_reordered_col_dml_char"
psql:/data/prabhd/test/tincrepo/main/dml/functional/output/mpp21090_reordered_col_dml_char_opt.sql:24: NOTICE:  CREATE TABLE will create partition "mpp21090_reordered_col_dml_char_1_prt_parttwo" for table "mpp21090_reordered_col_dml_char"
psql:/data/prabhd/test/tincrepo/main/dml/functional/output/mpp21090_reordered_col_dml_char_opt.sql:24: NOTICE:  CREATE TABLE will create partition "mpp21090_reordered_col_dml_char_1_prt_partthree" for table "mpp21090_reordered_col_dml_char"
CREATE TABLE
INSERT INTO mpp21090_reordered_col_dml_char(col2,col1,col3,col5,col4) SELECT 'g', 'g','a', 1,'g';
INSERT 0 1
INSERT INTO mpp21090_reordered_col_dml_char(col2,col3,col5,col4) SELECT 'g','b', 2, 'g'; 
INSERT 0 1
SELECT * FROM mpp21090_reordered_col_dml_char ORDER BY 1,2,3,4;
 col1 | col2 | col3 | col4 | col5 
------+------+------+------+------
 a    | g    | b    | g    |    2
 g    | g    | a    | g    |    1
(2 rows)

ALTER TABLE mpp21090_reordered_col_dml_char DROP COLUMN col4;
ALTER TABLE
ALTER TABLE mpp21090_reordered_col_dml_char ADD COLUMN col4 int DEFAULT 10;
ALTER TABLE
INSERT INTO mpp21090_reordered_col_dml_char(col2,col3,col5,col4) SELECT 'g','c', 2, 10; 
INSERT 0 1
SELECT * FROM mpp21090_reordered_col_dml_char ORDER BY 1,2,3,4;
 col1 | col2 | col3 | col5 | col4 
------+------+------+------+------
 a    | g    | b    |    2 |   10
 a    | g    | c    |    2 |   10
 g    | g    | a    |    1 |   10
(3 rows)

UPDATE mpp21090_reordered_col_dml_char SET col4 = 20;
UPDATE 3
SELECT * FROM mpp21090_reordered_col_dml_char ORDER BY 1,2,3,4;
 col1 | col2 | col3 | col5 | col4 
------+------+------+------+------
 a    | g    | b    |    2 |   20
 a    | g    | c    |    2 |   20
 g    | g    | a    |    1 |   20
(3 rows)

DELETE FROM mpp21090_reordered_col_dml_char WHERE col4=20;
DELETE 3
SELECT * FROM mpp21090_reordered_col_dml_char ORDER BY 1,2,3,4;
 col1 | col2 | col3 | col5 | col4 
------+------+------+------+------
(0 rows)

