DROP TABLE IF EXISTS mpp21090_xchange_pttab_dropcol_addcol_dml_int;
psql:/data/prabhd/test/tincrepo/main/dml/functional/output/mpp21090_xchange_pttab_dropcol_addcol_dml_int_opt.sql:14: NOTICE:  table "mpp21090_xchange_pttab_dropcol_addcol_dml_int" does not exist, skipping
DROP TABLE
CREATE TABLE mpp21090_xchange_pttab_dropcol_addcol_dml_int
(
    col1 int,
    col2 int,
    col3 char,
    col4 int,
    col5 int
) 
DISTRIBUTED by (col1)
PARTITION BY RANGE(col2)(partition partone start(1) end(10001) WITH (APPENDONLY=true, COMPRESSLEVEL=5, ORIENTATION=column),partition parttwo start(10001) end(20001) WITH (APPENDONLY=true, COMPRESSLEVEL=5, ORIENTATION=row),partition partthree start(20001) end(30001));
psql:/data/prabhd/test/tincrepo/main/dml/functional/output/mpp21090_xchange_pttab_dropcol_addcol_dml_int_opt.sql:24: NOTICE:  CREATE TABLE will create partition "mpp21090_xchange_pttab_dropcol_addcol_dml_int_1_prt_partone" for table "mpp21090_xchange_pttab_dropcol_addcol_dml_int"
psql:/data/prabhd/test/tincrepo/main/dml/functional/output/mpp21090_xchange_pttab_dropcol_addcol_dml_int_opt.sql:24: NOTICE:  CREATE TABLE will create partition "mpp21090_xchange_pttab_dropcol_addcol_dml_int_1_prt_parttwo" for table "mpp21090_xchange_pttab_dropcol_addcol_dml_int"
psql:/data/prabhd/test/tincrepo/main/dml/functional/output/mpp21090_xchange_pttab_dropcol_addcol_dml_int_opt.sql:24: NOTICE:  CREATE TABLE will create partition "mpp21090_xchange_pttab_dropcol_addcol_dml_int_1_prt_partthree" for table "mpp21090_xchange_pttab_dropcol_addcol_dml_int"
CREATE TABLE
INSERT INTO mpp21090_xchange_pttab_dropcol_addcol_dml_int VALUES(10000,10000,'a',0, 10000);
INSERT 0 1
SELECT * FROM mpp21090_xchange_pttab_dropcol_addcol_dml_int ORDER BY 1,2,3,4;
 col1  | col2  | col3 | col4 | col5  
-------+-------+------+------+-------
 10000 | 10000 | a    |    0 | 10000
(1 row)

ALTER TABLE mpp21090_xchange_pttab_dropcol_addcol_dml_int DROP COLUMN col1;
psql:/data/prabhd/test/tincrepo/main/dml/functional/output/mpp21090_xchange_pttab_dropcol_addcol_dml_int_opt.sql:29: NOTICE:  Dropping a column that is part of the distribution policy forces a NULL distribution policy
psql:/data/prabhd/test/tincrepo/main/dml/functional/output/mpp21090_xchange_pttab_dropcol_addcol_dml_int_opt.sql:29: NOTICE:  Dropping a column that is part of the distribution policy forces a NULL distribution policy
psql:/data/prabhd/test/tincrepo/main/dml/functional/output/mpp21090_xchange_pttab_dropcol_addcol_dml_int_opt.sql:29: NOTICE:  Dropping a column that is part of the distribution policy forces a NULL distribution policy
psql:/data/prabhd/test/tincrepo/main/dml/functional/output/mpp21090_xchange_pttab_dropcol_addcol_dml_int_opt.sql:29: NOTICE:  Dropping a column that is part of the distribution policy forces a NULL distribution policy
ALTER TABLE
ALTER TABLE mpp21090_xchange_pttab_dropcol_addcol_dml_int ADD COLUMN col1 int DEFAULT 10000;
ALTER TABLE
-- Create Candidate table for Exchange
DROP TABLE IF EXISTS mpp21090_xchange_pttab_dropcol_addcol_dml_int_candidate;
psql:/data/prabhd/test/tincrepo/main/dml/functional/output/mpp21090_xchange_pttab_dropcol_addcol_dml_int_opt.sql:33: NOTICE:  table "mpp21090_xchange_pttab_dropcol_addcol_dml_int_candidate" does not exist, skipping
DROP TABLE
CREATE TABLE mpp21090_xchange_pttab_dropcol_addcol_dml_int_candidate( like mpp21090_xchange_pttab_dropcol_addcol_dml_int) distributed randomly;
CREATE TABLE
INSERT INTO mpp21090_xchange_pttab_dropcol_addcol_dml_int_candidate VALUES(10000,'z',1,10000,10000);
INSERT 0 1
-- Exchange 
ALTER TABLE mpp21090_xchange_pttab_dropcol_addcol_dml_int EXCHANGE PARTITION FOR(5000) WITH TABLE mpp21090_xchange_pttab_dropcol_addcol_dml_int_candidate;
psql:/data/prabhd/test/tincrepo/main/dml/functional/output/mpp21090_xchange_pttab_dropcol_addcol_dml_int_opt.sql:38: NOTICE:  exchanged partition "partone" of relation "mpp21090_xchange_pttab_dropcol_addcol_dml_int" with relation "mpp21090_xchange_pttab_dropcol_addcol_dml_int_candidate"
ALTER TABLE
SELECT * FROM mpp21090_xchange_pttab_dropcol_addcol_dml_int ORDER BY 1,2,3;
 col2  | col3 | col4 | col5  | col1  
-------+------+------+-------+-------
 10000 | z    |    1 | 10000 | 10000
(1 row)

SELECT * FROM mpp21090_xchange_pttab_dropcol_addcol_dml_int_candidate ORDER BY 1,2,3;
 col2  | col3 | col4 | col5  | col1  
-------+------+------+-------+-------
 10000 | a    |    0 | 10000 | 10000
(1 row)

-- DML on partition table
INSERT INTO mpp21090_xchange_pttab_dropcol_addcol_dml_int SELECT  1000,'b', 1, 1000, 1000;
INSERT 0 1
SELECT * FROM mpp21090_xchange_pttab_dropcol_addcol_dml_int ORDER BY 1,2,3;
 col2  | col3 | col4 | col5  | col1  
-------+------+------+-------+-------
  1000 | b    |    1 |  1000 |  1000
 10000 | z    |    1 | 10000 | 10000
(2 rows)

UPDATE mpp21090_xchange_pttab_dropcol_addcol_dml_int SET col5 = 35000 WHERE col2 = 1000 AND col5 = 1000;
UPDATE 1
SELECT * FROM mpp21090_xchange_pttab_dropcol_addcol_dml_int ORDER BY 1,2,3;
 col2  | col3 | col4 | col5  | col1  
-------+------+------+-------+-------
  1000 | b    |    1 | 35000 |  1000
 10000 | z    |    1 | 10000 | 10000
(2 rows)

UPDATE mpp21090_xchange_pttab_dropcol_addcol_dml_int SET col2 =10000 WHERE col3='b';
UPDATE 1
SELECT * FROM mpp21090_xchange_pttab_dropcol_addcol_dml_int ORDER BY 1,2,3;
 col2  | col3 | col4 | col5  | col1  
-------+------+------+-------+-------
 10000 | b    |    1 | 35000 |  1000
 10000 | z    |    1 | 10000 | 10000
(2 rows)

DELETE FROM mpp21090_xchange_pttab_dropcol_addcol_dml_int WHERE col3='b';
DELETE 1
SELECT * FROM mpp21090_xchange_pttab_dropcol_addcol_dml_int ORDER BY 1,2,3;
 col2  | col3 | col4 | col5  | col1  
-------+------+------+-------+-------
 10000 | z    |    1 | 10000 | 10000
(1 row)

-- DML on candidate table
INSERT INTO mpp21090_xchange_pttab_dropcol_addcol_dml_int_candidate SELECT 1000,'b', 1, 1000, 1000;
INSERT 0 1
SELECT * FROM mpp21090_xchange_pttab_dropcol_addcol_dml_int_candidate ORDER BY 1,2,3;
 col2  | col3 | col4 | col5  | col1  
-------+------+------+-------+-------
  1000 | b    |    1 |  1000 |  1000
 10000 | a    |    0 | 10000 | 10000
(2 rows)

UPDATE mpp21090_xchange_pttab_dropcol_addcol_dml_int_candidate SET col2=10000 WHERE col3='a';
UPDATE 1
SELECT * FROM mpp21090_xchange_pttab_dropcol_addcol_dml_int_candidate ORDER BY 1,2,3;
 col2  | col3 | col4 | col5  | col1  
-------+------+------+-------+-------
  1000 | b    |    1 |  1000 |  1000
 10000 | a    |    0 | 10000 | 10000
(2 rows)

DELETE FROM mpp21090_xchange_pttab_dropcol_addcol_dml_int_candidate WHERE col3='a';
DELETE 1
SELECT * FROM mpp21090_xchange_pttab_dropcol_addcol_dml_int_candidate ORDER BY 1,2,3;
 col2 | col3 | col4 | col5 | col1 
------+------+------+------+------
 1000 | b    |    1 | 1000 | 1000
(1 row)

