DROP TABLE IF EXISTS mpp21090_pttab_addpt_dropcol_dml_int;
psql:/data/prabhd/test/tincrepo/main/dml/functional/output/mpp21090_pttab_addpt_dropcol_dml_int_opt.sql:14: NOTICE:  table "mpp21090_pttab_addpt_dropcol_dml_int" does not exist, skipping
DROP TABLE
CREATE TABLE mpp21090_pttab_addpt_dropcol_dml_int
(
    col1 int,
    col2 int,
    col3 char,
    col4 int
) 
DISTRIBUTED by (col1)
PARTITION BY RANGE(col2)(partition partone start(1) end(10001) WITH (APPENDONLY=true, COMPRESSLEVEL=5, ORIENTATION=column),partition parttwo start(10001) end(20001) WITH (APPENDONLY=true, COMPRESSLEVEL=5, ORIENTATION=row),partition partthree start(20001) end(30001));
psql:/data/prabhd/test/tincrepo/main/dml/functional/output/mpp21090_pttab_addpt_dropcol_dml_int_opt.sql:23: NOTICE:  CREATE TABLE will create partition "mpp21090_pttab_addpt_dropcol_dml_int_1_prt_partone" for table "mpp21090_pttab_addpt_dropcol_dml_int"
psql:/data/prabhd/test/tincrepo/main/dml/functional/output/mpp21090_pttab_addpt_dropcol_dml_int_opt.sql:23: NOTICE:  CREATE TABLE will create partition "mpp21090_pttab_addpt_dropcol_dml_int_1_prt_parttwo" for table "mpp21090_pttab_addpt_dropcol_dml_int"
psql:/data/prabhd/test/tincrepo/main/dml/functional/output/mpp21090_pttab_addpt_dropcol_dml_int_opt.sql:23: NOTICE:  CREATE TABLE will create partition "mpp21090_pttab_addpt_dropcol_dml_int_1_prt_partthree" for table "mpp21090_pttab_addpt_dropcol_dml_int"
CREATE TABLE
INSERT INTO mpp21090_pttab_addpt_dropcol_dml_int VALUES(20000,20000,'a',0);
INSERT 0 1
ALTER TABLE mpp21090_pttab_addpt_dropcol_dml_int ADD PARTITION partfour start(30001) end(40001);
psql:/data/prabhd/test/tincrepo/main/dml/functional/output/mpp21090_pttab_addpt_dropcol_dml_int_opt.sql:27: NOTICE:  CREATE TABLE will create partition "mpp21090_pttab_addpt_dropcol_dml_int_1_prt_partfour" for table "mpp21090_pttab_addpt_dropcol_dml_int"
ALTER TABLE
INSERT INTO mpp21090_pttab_addpt_dropcol_dml_int SELECT 35000,35000,'b',1;
INSERT 0 1
SELECT * FROM mpp21090_pttab_addpt_dropcol_dml_int ORDER BY 1,2,3;
 col1  | col2  | col3 | col4 
-------+-------+------+------
 20000 | 20000 | a    |    0
 35000 | 35000 | b    |    1
(2 rows)

ALTER TABLE mpp21090_pttab_addpt_dropcol_dml_int DROP COLUMN col1;
psql:/data/prabhd/test/tincrepo/main/dml/functional/output/mpp21090_pttab_addpt_dropcol_dml_int_opt.sql:32: NOTICE:  Dropping a column that is part of the distribution policy forces a NULL distribution policy
psql:/data/prabhd/test/tincrepo/main/dml/functional/output/mpp21090_pttab_addpt_dropcol_dml_int_opt.sql:32: NOTICE:  Dropping a column that is part of the distribution policy forces a NULL distribution policy
psql:/data/prabhd/test/tincrepo/main/dml/functional/output/mpp21090_pttab_addpt_dropcol_dml_int_opt.sql:32: NOTICE:  Dropping a column that is part of the distribution policy forces a NULL distribution policy
psql:/data/prabhd/test/tincrepo/main/dml/functional/output/mpp21090_pttab_addpt_dropcol_dml_int_opt.sql:32: NOTICE:  Dropping a column that is part of the distribution policy forces a NULL distribution policy
psql:/data/prabhd/test/tincrepo/main/dml/functional/output/mpp21090_pttab_addpt_dropcol_dml_int_opt.sql:32: NOTICE:  Dropping a column that is part of the distribution policy forces a NULL distribution policy
ALTER TABLE
INSERT INTO mpp21090_pttab_addpt_dropcol_dml_int SELECT 35000,'b',1;
INSERT 0 1
SELECT * FROM mpp21090_pttab_addpt_dropcol_dml_int ORDER BY 1,2,3;
 col2  | col3 | col4 
-------+------+------
 20000 | a    |    0
 35000 | b    |    1
 35000 | b    |    1
(3 rows)

UPDATE mpp21090_pttab_addpt_dropcol_dml_int SET col4 = 10 WHERE col2 = 35000;
UPDATE 2
SELECT * FROM mpp21090_pttab_addpt_dropcol_dml_int ORDER BY 1,2,3;
 col2  | col3 | col4 
-------+------+------
 20000 | a    |    0
 35000 | b    |   10
 35000 | b    |   10
(3 rows)

-- Update partition key
UPDATE mpp21090_pttab_addpt_dropcol_dml_int SET col2 = 10000 WHERE col2 = 35000;
UPDATE 2
SELECT * FROM mpp21090_pttab_addpt_dropcol_dml_int ORDER BY 1,2,3;
 col2  | col3 | col4 
-------+------+------
 10000 | b    |   10
 10000 | b    |   10
 20000 | a    |    0
(3 rows)

DELETE FROM mpp21090_pttab_addpt_dropcol_dml_int WHERE col2 = 10000;
DELETE 2
SELECT * FROM mpp21090_pttab_addpt_dropcol_dml_int ORDER BY 1,2,3;
 col2  | col3 | col4 
-------+------+------
 20000 | a    |    0
(1 row)

