DROP TABLE IF EXISTS mpp21090_reordered_col_dml_int;
psql:/data/prabhd/test/tincrepo/main/dml/functional/output/mpp21090_reordered_col_dml_int_opt.sql:14: NOTICE:  table "mpp21090_reordered_col_dml_int" does not exist, skipping
DROP TABLE
CREATE TABLE mpp21090_reordered_col_dml_int
(
    col1 int DEFAULT 20000,
    col2 int,
    col3 char,
    col4 int,
    col5 int
) 
DISTRIBUTED by (col1)
PARTITION BY RANGE(col2)(partition partone start(1) end(10001) WITH (APPENDONLY=true, COMPRESSLEVEL=5, ORIENTATION=column),partition parttwo start(10001) end(20001) WITH (APPENDONLY=true, COMPRESSLEVEL=5, ORIENTATION=row),partition partthree start(20001) end(30001));
psql:/data/prabhd/test/tincrepo/main/dml/functional/output/mpp21090_reordered_col_dml_int_opt.sql:24: NOTICE:  CREATE TABLE will create partition "mpp21090_reordered_col_dml_int_1_prt_partone" for table "mpp21090_reordered_col_dml_int"
psql:/data/prabhd/test/tincrepo/main/dml/functional/output/mpp21090_reordered_col_dml_int_opt.sql:24: NOTICE:  CREATE TABLE will create partition "mpp21090_reordered_col_dml_int_1_prt_parttwo" for table "mpp21090_reordered_col_dml_int"
psql:/data/prabhd/test/tincrepo/main/dml/functional/output/mpp21090_reordered_col_dml_int_opt.sql:24: NOTICE:  CREATE TABLE will create partition "mpp21090_reordered_col_dml_int_1_prt_partthree" for table "mpp21090_reordered_col_dml_int"
CREATE TABLE
INSERT INTO mpp21090_reordered_col_dml_int(col2,col1,col3,col5,col4) SELECT 10000, 10000,'a', 1,10000;
INSERT 0 1
INSERT INTO mpp21090_reordered_col_dml_int(col2,col3,col5,col4) SELECT 10000,'b', 2, 10000; 
INSERT 0 1
SELECT * FROM mpp21090_reordered_col_dml_int ORDER BY 1,2,3,4;
 col1  | col2  | col3 | col4  | col5 
-------+-------+------+-------+------
 10000 | 10000 | a    | 10000 |    1
 20000 | 10000 | b    | 10000 |    2
(2 rows)

ALTER TABLE mpp21090_reordered_col_dml_int DROP COLUMN col4;
ALTER TABLE
ALTER TABLE mpp21090_reordered_col_dml_int ADD COLUMN col4 int DEFAULT 10;
ALTER TABLE
INSERT INTO mpp21090_reordered_col_dml_int(col2,col3,col5,col4) SELECT 10000,'c', 2, 10; 
INSERT 0 1
SELECT * FROM mpp21090_reordered_col_dml_int ORDER BY 1,2,3,4;
 col1  | col2  | col3 | col5 | col4 
-------+-------+------+------+------
 10000 | 10000 | a    |    1 |   10
 20000 | 10000 | b    |    2 |   10
 20000 | 10000 | c    |    2 |   10
(3 rows)

UPDATE mpp21090_reordered_col_dml_int SET col4 = 20;
UPDATE 3
SELECT * FROM mpp21090_reordered_col_dml_int ORDER BY 1,2,3,4;
 col1  | col2  | col3 | col5 | col4 
-------+-------+------+------+------
 10000 | 10000 | a    |    1 |   20
 20000 | 10000 | b    |    2 |   20
 20000 | 10000 | c    |    2 |   20
(3 rows)

DELETE FROM mpp21090_reordered_col_dml_int WHERE col4=20;
DELETE 3
SELECT * FROM mpp21090_reordered_col_dml_int ORDER BY 1,2,3,4;
 col1 | col2 | col3 | col5 | col4 
------+------+------+------+------
(0 rows)

