DROP TABLE IF EXISTS mpp21090_defpt_dropcol_addcol_dml_char;
psql:/data/prabhd/test/tincrepo/main/dml/functional/output/mpp21090_defpt_dropcol_addcol_dml_char_opt.sql:14: NOTICE:  table "mpp21090_defpt_dropcol_addcol_dml_char" does not exist, skipping
DROP TABLE
CREATE TABLE mpp21090_defpt_dropcol_addcol_dml_char
(
    col1 char,
    col2 char,
    col3 char,
    col4 int
) 
DISTRIBUTED by (col1)
PARTITION BY LIST(col2)
(
default partition def
);
psql:/data/prabhd/test/tincrepo/main/dml/functional/output/mpp21090_defpt_dropcol_addcol_dml_char_opt.sql:26: NOTICE:  CREATE TABLE will create partition "mpp21090_defpt_dropcol_addcol_dml_char_1_prt_def" for table "mpp21090_defpt_dropcol_addcol_dml_char"
CREATE TABLE
INSERT INTO mpp21090_defpt_dropcol_addcol_dml_char VALUES('x','x','a',0);
INSERT 0 1
ALTER TABLE mpp21090_defpt_dropcol_addcol_dml_char DROP COLUMN col4;
ALTER TABLE
INSERT INTO mpp21090_defpt_dropcol_addcol_dml_char SELECT 'z','z','b';
INSERT 0 1
SELECT * FROM mpp21090_defpt_dropcol_addcol_dml_char ORDER BY 1,2,3;
 col1 | col2 | col3 
------+------+------
 x    | x    | a
 z    | z    | b
(2 rows)

ALTER TABLE mpp21090_defpt_dropcol_addcol_dml_char ADD COLUMN col5 char;
ALTER TABLE
INSERT INTO mpp21090_defpt_dropcol_addcol_dml_char SELECT 'x','x','c','x';
INSERT 0 1
SELECT * FROM mpp21090_defpt_dropcol_addcol_dml_char ORDER BY 1,2,3;
 col1 | col2 | col3 | col5 
------+------+------+------
 x    | x    | a    | 
 x    | x    | c    | x
 z    | z    | b    | 
(3 rows)

UPDATE mpp21090_defpt_dropcol_addcol_dml_char SET col1 = '-' WHERE col2 = 'z' AND col1 = 'z';
UPDATE 1
SELECT * FROM mpp21090_defpt_dropcol_addcol_dml_char ORDER BY 1,2,3;
 col1 | col2 | col3 | col5 
------+------+------+------
 -    | z    | b    | 
 x    | x    | a    | 
 x    | x    | c    | x
(3 rows)

-- Update partition key
UPDATE mpp21090_defpt_dropcol_addcol_dml_char SET col2 = '-' WHERE col2 = 'z' AND col1 = '-';
UPDATE 1
SELECT * FROM mpp21090_defpt_dropcol_addcol_dml_char ORDER BY 1,2,3;
 col1 | col2 | col3 | col5 
------+------+------+------
 -    | -    | b    | 
 x    | x    | a    | 
 x    | x    | c    | x
(3 rows)

DELETE FROM mpp21090_defpt_dropcol_addcol_dml_char WHERE col2 = '-';
DELETE 1
SELECT * FROM mpp21090_defpt_dropcol_addcol_dml_char ORDER BY 1,2,3;
 col1 | col2 | col3 | col5 
------+------+------+------
 x    | x    | a    | 
 x    | x    | c    | x
(2 rows)

