DROP TABLE IF EXISTS mpp21090_reordered_col_dml_time;
psql:/data/prabhd/test/tincrepo/main/dml/functional/output/mpp21090_reordered_col_dml_time_opt.sql:14: NOTICE:  table "mpp21090_reordered_col_dml_time" does not exist, skipping
DROP TABLE
CREATE TABLE mpp21090_reordered_col_dml_time
(
    col1 time DEFAULT '1:00:00',
    col2 time,
    col3 char,
    col4 time,
    col5 int
) 
DISTRIBUTED by (col1)
PARTITION BY RANGE(col2)(partition partone start('12:00:00') end('18:00:00')  WITH (APPENDONLY=true, COMPRESSLEVEL=5, ORIENTATION=column),partition parttwo start('18:00:00') end('24:00:00') WITH (APPENDONLY=true, COMPRESSLEVEL=5, ORIENTATION=row),partition partthree start('0:00:00') end('11:00:00'));
psql:/data/prabhd/test/tincrepo/main/dml/functional/output/mpp21090_reordered_col_dml_time_opt.sql:24: NOTICE:  CREATE TABLE will create partition "mpp21090_reordered_col_dml_time_1_prt_partthree" for table "mpp21090_reordered_col_dml_time"
psql:/data/prabhd/test/tincrepo/main/dml/functional/output/mpp21090_reordered_col_dml_time_opt.sql:24: NOTICE:  CREATE TABLE will create partition "mpp21090_reordered_col_dml_time_1_prt_partone" for table "mpp21090_reordered_col_dml_time"
psql:/data/prabhd/test/tincrepo/main/dml/functional/output/mpp21090_reordered_col_dml_time_opt.sql:24: NOTICE:  CREATE TABLE will create partition "mpp21090_reordered_col_dml_time_1_prt_parttwo" for table "mpp21090_reordered_col_dml_time"
CREATE TABLE
INSERT INTO mpp21090_reordered_col_dml_time(col2,col1,col3,col5,col4) SELECT '12:00:00', '12:00:00','a', 1,'12:00:00';
INSERT 0 1
INSERT INTO mpp21090_reordered_col_dml_time(col2,col3,col5,col4) SELECT '12:00:00','b', 2, '12:00:00'; 
INSERT 0 1
SELECT * FROM mpp21090_reordered_col_dml_time ORDER BY 1,2,3,4;
   col1   |   col2   | col3 |   col4   | col5 
----------+----------+------+----------+------
 01:00:00 | 12:00:00 | b    | 12:00:00 |    2
 12:00:00 | 12:00:00 | a    | 12:00:00 |    1
(2 rows)

ALTER TABLE mpp21090_reordered_col_dml_time DROP COLUMN col4;
ALTER TABLE
ALTER TABLE mpp21090_reordered_col_dml_time ADD COLUMN col4 int DEFAULT 10;
ALTER TABLE
INSERT INTO mpp21090_reordered_col_dml_time(col2,col3,col5,col4) SELECT '12:00:00','c', 2, 10; 
INSERT 0 1
SELECT * FROM mpp21090_reordered_col_dml_time ORDER BY 1,2,3,4;
   col1   |   col2   | col3 | col5 | col4 
----------+----------+------+------+------
 01:00:00 | 12:00:00 | b    |    2 |   10
 01:00:00 | 12:00:00 | c    |    2 |   10
 12:00:00 | 12:00:00 | a    |    1 |   10
(3 rows)

UPDATE mpp21090_reordered_col_dml_time SET col4 = 20;
UPDATE 3
SELECT * FROM mpp21090_reordered_col_dml_time ORDER BY 1,2,3,4;
   col1   |   col2   | col3 | col5 | col4 
----------+----------+------+------+------
 01:00:00 | 12:00:00 | b    |    2 |   20
 01:00:00 | 12:00:00 | c    |    2 |   20
 12:00:00 | 12:00:00 | a    |    1 |   20
(3 rows)

DELETE FROM mpp21090_reordered_col_dml_time WHERE col4=20;
DELETE 3
SELECT * FROM mpp21090_reordered_col_dml_time ORDER BY 1,2,3,4;
 col1 | col2 | col3 | col5 | col4 
------+------+------+------+------
(0 rows)

