DROP TABLE IF EXISTS mpp21090_reordered_col_dml_numeric;
psql:/data/prabhd/test/tincrepo/main/dml/functional/output/mpp21090_reordered_col_dml_numeric_opt.sql:14: NOTICE:  table "mpp21090_reordered_col_dml_numeric" does not exist, skipping
DROP TABLE
CREATE TABLE mpp21090_reordered_col_dml_numeric
(
    col1 numeric DEFAULT 1.000000,
    col2 numeric,
    col3 char,
    col4 numeric,
    col5 int
) 
DISTRIBUTED by (col1)
PARTITION BY RANGE(col2)(partition partone start(1.000000) end(10.000000)  WITH (APPENDONLY=true, COMPRESSLEVEL=5, ORIENTATION=column),partition parttwo start(10.000000) end(20.000000) WITH (APPENDONLY=true, COMPRESSLEVEL=5, ORIENTATION=row),partition partthree start(20.000000) end(30.000000));
psql:/data/prabhd/test/tincrepo/main/dml/functional/output/mpp21090_reordered_col_dml_numeric_opt.sql:24: NOTICE:  CREATE TABLE will create partition "mpp21090_reordered_col_dml_numeric_1_prt_partone" for table "mpp21090_reordered_col_dml_numeric"
psql:/data/prabhd/test/tincrepo/main/dml/functional/output/mpp21090_reordered_col_dml_numeric_opt.sql:24: NOTICE:  CREATE TABLE will create partition "mpp21090_reordered_col_dml_numeric_1_prt_parttwo" for table "mpp21090_reordered_col_dml_numeric"
psql:/data/prabhd/test/tincrepo/main/dml/functional/output/mpp21090_reordered_col_dml_numeric_opt.sql:24: NOTICE:  CREATE TABLE will create partition "mpp21090_reordered_col_dml_numeric_1_prt_partthree" for table "mpp21090_reordered_col_dml_numeric"
CREATE TABLE
INSERT INTO mpp21090_reordered_col_dml_numeric(col2,col1,col3,col5,col4) SELECT 2.000000, 2.000000,'a', 1,2.000000;
INSERT 0 1
INSERT INTO mpp21090_reordered_col_dml_numeric(col2,col3,col5,col4) SELECT 2.000000,'b', 2, 2.000000; 
INSERT 0 1
SELECT * FROM mpp21090_reordered_col_dml_numeric ORDER BY 1,2,3,4;
   col1   |   col2   | col3 |   col4   | col5 
----------+----------+------+----------+------
 1.000000 | 2.000000 | b    | 2.000000 |    2
 2.000000 | 2.000000 | a    | 2.000000 |    1
(2 rows)

ALTER TABLE mpp21090_reordered_col_dml_numeric DROP COLUMN col4;
ALTER TABLE
ALTER TABLE mpp21090_reordered_col_dml_numeric ADD COLUMN col4 int DEFAULT 10;
ALTER TABLE
INSERT INTO mpp21090_reordered_col_dml_numeric(col2,col3,col5,col4) SELECT 2.000000,'c', 2, 10; 
INSERT 0 1
SELECT * FROM mpp21090_reordered_col_dml_numeric ORDER BY 1,2,3,4;
   col1   |   col2   | col3 | col5 | col4 
----------+----------+------+------+------
 1.000000 | 2.000000 | b    |    2 |   10
 1.000000 | 2.000000 | c    |    2 |   10
 2.000000 | 2.000000 | a    |    1 |   10
(3 rows)

UPDATE mpp21090_reordered_col_dml_numeric SET col4 = 20;
UPDATE 3
SELECT * FROM mpp21090_reordered_col_dml_numeric ORDER BY 1,2,3,4;
   col1   |   col2   | col3 | col5 | col4 
----------+----------+------+------+------
 1.000000 | 2.000000 | b    |    2 |   20
 1.000000 | 2.000000 | c    |    2 |   20
 2.000000 | 2.000000 | a    |    1 |   20
(3 rows)

DELETE FROM mpp21090_reordered_col_dml_numeric WHERE col4=20;
DELETE 3
SELECT * FROM mpp21090_reordered_col_dml_numeric ORDER BY 1,2,3,4;
 col1 | col2 | col3 | col5 | col4 
------+------+------+------+------
(0 rows)

