DROP TABLE IF EXISTS mpp21090_pttab_dropfirstcol_addpt_index_char;
psql:/data/prabhd/test/tincrepo/main/dml/functional/output/mpp21090_pttab_dropfirstcol_addpt_index_char_opt.sql:14: NOTICE:  table "mpp21090_pttab_dropfirstcol_addpt_index_char" does not exist, skipping
DROP TABLE
CREATE TABLE mpp21090_pttab_dropfirstcol_addpt_index_char
(
    col1 char,
    col2 char,
    col3 char,
    col4 char,
    col5 int
) 
DISTRIBUTED by (col1)
PARTITION BY LIST(col2)(partition partone VALUES('a','b','c','d','e','f','g','h') WITH (APPENDONLY=true, COMPRESSLEVEL=5, ORIENTATION=column),partition parttwo VALUES('i','j','k','l','m','n','o','p') WITH (APPENDONLY=true, COMPRESSLEVEL=5, ORIENTATION=row),partition partthree VALUES('q','r','s','t','u','v','w','x'));
psql:/data/prabhd/test/tincrepo/main/dml/functional/output/mpp21090_pttab_dropfirstcol_addpt_index_char_opt.sql:24: NOTICE:  CREATE TABLE will create partition "mpp21090_pttab_dropfirstcol_addpt_index_char_1_prt_partone" for table "mpp21090_pttab_dropfirstcol_addpt_index_char"
psql:/data/prabhd/test/tincrepo/main/dml/functional/output/mpp21090_pttab_dropfirstcol_addpt_index_char_opt.sql:24: NOTICE:  CREATE TABLE will create partition "mpp21090_pttab_dropfirstcol_addpt_index_char_1_prt_parttwo" for table "mpp21090_pttab_dropfirstcol_addpt_index_char"
psql:/data/prabhd/test/tincrepo/main/dml/functional/output/mpp21090_pttab_dropfirstcol_addpt_index_char_opt.sql:24: NOTICE:  CREATE TABLE will create partition "mpp21090_pttab_dropfirstcol_addpt_index_char_1_prt_partthree" for table "mpp21090_pttab_dropfirstcol_addpt_index_char"
CREATE TABLE
INSERT INTO mpp21090_pttab_dropfirstcol_addpt_index_char VALUES('g','g','a','g',0);
INSERT 0 1
DROP INDEX IF EXISTS mpp21090_pttab_dropfirstcol_addpt_index_idx_char;
psql:/data/prabhd/test/tincrepo/main/dml/functional/output/mpp21090_pttab_dropfirstcol_addpt_index_char_opt.sql:28: NOTICE:  index "mpp21090_pttab_dropfirstcol_addpt_index_idx_char" does not exist, skipping
DROP INDEX
CREATE INDEX mpp21090_pttab_dropfirstcol_addpt_index_idx_char on mpp21090_pttab_dropfirstcol_addpt_index_char(col2);
psql:/data/prabhd/test/tincrepo/main/dml/functional/output/mpp21090_pttab_dropfirstcol_addpt_index_char_opt.sql:29: NOTICE:  building index for child partition "mpp21090_pttab_dropfirstcol_addpt_index_char_1_prt_partone"
psql:/data/prabhd/test/tincrepo/main/dml/functional/output/mpp21090_pttab_dropfirstcol_addpt_index_char_opt.sql:29: NOTICE:  building index for child partition "mpp21090_pttab_dropfirstcol_addpt_index_char_1_prt_parttwo"
psql:/data/prabhd/test/tincrepo/main/dml/functional/output/mpp21090_pttab_dropfirstcol_addpt_index_char_opt.sql:29: NOTICE:  building index for child partition "mpp21090_pttab_dropfirstcol_addpt_index_char_1_prt_partthree"
CREATE INDEX
ALTER TABLE mpp21090_pttab_dropfirstcol_addpt_index_char DROP COLUMN col1;
psql:/data/prabhd/test/tincrepo/main/dml/functional/output/mpp21090_pttab_dropfirstcol_addpt_index_char_opt.sql:31: NOTICE:  Dropping a column that is part of the distribution policy forces a NULL distribution policy
psql:/data/prabhd/test/tincrepo/main/dml/functional/output/mpp21090_pttab_dropfirstcol_addpt_index_char_opt.sql:31: NOTICE:  Dropping a column that is part of the distribution policy forces a NULL distribution policy
psql:/data/prabhd/test/tincrepo/main/dml/functional/output/mpp21090_pttab_dropfirstcol_addpt_index_char_opt.sql:31: NOTICE:  Dropping a column that is part of the distribution policy forces a NULL distribution policy
psql:/data/prabhd/test/tincrepo/main/dml/functional/output/mpp21090_pttab_dropfirstcol_addpt_index_char_opt.sql:31: NOTICE:  Dropping a column that is part of the distribution policy forces a NULL distribution policy
ALTER TABLE
ALTER TABLE mpp21090_pttab_dropfirstcol_addpt_index_char ADD PARTITION partfour VALUES('y','z','-');
psql:/data/prabhd/test/tincrepo/main/dml/functional/output/mpp21090_pttab_dropfirstcol_addpt_index_char_opt.sql:32: NOTICE:  CREATE TABLE will create partition "mpp21090_pttab_dropfirstcol_addpt_index_char_1_prt_partfour" for table "mpp21090_pttab_dropfirstcol_addpt_index_char"
ALTER TABLE
INSERT INTO mpp21090_pttab_dropfirstcol_addpt_index_char SELECT 'z','b','z', 1;
INSERT 0 1
SELECT * FROM mpp21090_pttab_dropfirstcol_addpt_index_char ORDER BY 1,2,3;
 col2 | col3 | col4 | col5 
------+------+------+------
 g    | a    | g    |    0
 z    | b    | z    |    1
(2 rows)

UPDATE mpp21090_pttab_dropfirstcol_addpt_index_char SET col4 = 'a' WHERE col2 = 'z' AND col4 = 'z';
UPDATE 1
SELECT * FROM mpp21090_pttab_dropfirstcol_addpt_index_char ORDER BY 1,2,3;
 col2 | col3 | col4 | col5 
------+------+------+------
 g    | a    | g    |    0
 z    | b    | a    |    1
(2 rows)

-- Update partition key
UPDATE mpp21090_pttab_dropfirstcol_addpt_index_char SET col2 = 'a' WHERE col2 = 'z' AND col4 = 'a';
UPDATE 1
SELECT * FROM mpp21090_pttab_dropfirstcol_addpt_index_char ORDER BY 1,2,3;
 col2 | col3 | col4 | col5 
------+------+------+------
 a    | b    | a    |    1
 g    | a    | g    |    0
(2 rows)

DELETE FROM mpp21090_pttab_dropfirstcol_addpt_index_char WHERE col2 = 'a';
DELETE 1
SELECT * FROM mpp21090_pttab_dropfirstcol_addpt_index_char ORDER BY 1,2,3;
 col2 | col3 | col4 | col5 
------+------+------+------
 g    | a    | g    |    0
(1 row)

