DROP TABLE IF EXISTS mpp21090_pttab_addpt_dropcol_dml_interval;
psql:/data/prabhd/test/tincrepo/main/dml/functional/output/mpp21090_pttab_addpt_dropcol_dml_interval_opt.sql:14: NOTICE:  table "mpp21090_pttab_addpt_dropcol_dml_interval" does not exist, skipping
DROP TABLE
CREATE TABLE mpp21090_pttab_addpt_dropcol_dml_interval
(
    col1 interval,
    col2 interval,
    col3 char,
    col4 int
) 
DISTRIBUTED by (col1)
PARTITION BY RANGE(col2)(partition partone start('1 sec') end('1 min')  WITH (APPENDONLY=true, COMPRESSLEVEL=5, ORIENTATION=column),partition parttwo start('1 min') end('1 hour') WITH (APPENDONLY=true, COMPRESSLEVEL=5, ORIENTATION=row),partition partthree start('1 hour') end('12 hours'));
psql:/data/prabhd/test/tincrepo/main/dml/functional/output/mpp21090_pttab_addpt_dropcol_dml_interval_opt.sql:23: NOTICE:  CREATE TABLE will create partition "mpp21090_pttab_addpt_dropcol_dml_interval_1_prt_partone" for table "mpp21090_pttab_addpt_dropcol_dml_interval"
psql:/data/prabhd/test/tincrepo/main/dml/functional/output/mpp21090_pttab_addpt_dropcol_dml_interval_opt.sql:23: NOTICE:  CREATE TABLE will create partition "mpp21090_pttab_addpt_dropcol_dml_interval_1_prt_parttwo" for table "mpp21090_pttab_addpt_dropcol_dml_interval"
psql:/data/prabhd/test/tincrepo/main/dml/functional/output/mpp21090_pttab_addpt_dropcol_dml_interval_opt.sql:23: NOTICE:  CREATE TABLE will create partition "mpp21090_pttab_addpt_dropcol_dml_interval_1_prt_partthree" for table "mpp21090_pttab_addpt_dropcol_dml_interval"
CREATE TABLE
INSERT INTO mpp21090_pttab_addpt_dropcol_dml_interval VALUES('1 hour','1 hour','a',0);
INSERT 0 1
ALTER TABLE mpp21090_pttab_addpt_dropcol_dml_interval ADD PARTITION partfour start('12 hours') end('1 day') inclusive;
psql:/data/prabhd/test/tincrepo/main/dml/functional/output/mpp21090_pttab_addpt_dropcol_dml_interval_opt.sql:27: NOTICE:  CREATE TABLE will create partition "mpp21090_pttab_addpt_dropcol_dml_interval_1_prt_partfour" for table "mpp21090_pttab_addpt_dropcol_dml_interval"
ALTER TABLE
INSERT INTO mpp21090_pttab_addpt_dropcol_dml_interval SELECT '14 hours','14 hours','b',1;
INSERT 0 1
SELECT * FROM mpp21090_pttab_addpt_dropcol_dml_interval ORDER BY 1,2,3;
   col1   |   col2   | col3 | col4 
----------+----------+------+------
 01:00:00 | 01:00:00 | a    |    0
 14:00:00 | 14:00:00 | b    |    1
(2 rows)

ALTER TABLE mpp21090_pttab_addpt_dropcol_dml_interval DROP COLUMN col1;
psql:/data/prabhd/test/tincrepo/main/dml/functional/output/mpp21090_pttab_addpt_dropcol_dml_interval_opt.sql:32: NOTICE:  Dropping a column that is part of the distribution policy forces a NULL distribution policy
psql:/data/prabhd/test/tincrepo/main/dml/functional/output/mpp21090_pttab_addpt_dropcol_dml_interval_opt.sql:32: NOTICE:  Dropping a column that is part of the distribution policy forces a NULL distribution policy
psql:/data/prabhd/test/tincrepo/main/dml/functional/output/mpp21090_pttab_addpt_dropcol_dml_interval_opt.sql:32: NOTICE:  Dropping a column that is part of the distribution policy forces a NULL distribution policy
psql:/data/prabhd/test/tincrepo/main/dml/functional/output/mpp21090_pttab_addpt_dropcol_dml_interval_opt.sql:32: NOTICE:  Dropping a column that is part of the distribution policy forces a NULL distribution policy
psql:/data/prabhd/test/tincrepo/main/dml/functional/output/mpp21090_pttab_addpt_dropcol_dml_interval_opt.sql:32: NOTICE:  Dropping a column that is part of the distribution policy forces a NULL distribution policy
ALTER TABLE
INSERT INTO mpp21090_pttab_addpt_dropcol_dml_interval SELECT '14 hours','b',1;
INSERT 0 1
SELECT * FROM mpp21090_pttab_addpt_dropcol_dml_interval ORDER BY 1,2,3;
   col2   | col3 | col4 
----------+------+------
 01:00:00 | a    |    0
 14:00:00 | b    |    1
 14:00:00 | b    |    1
(3 rows)

UPDATE mpp21090_pttab_addpt_dropcol_dml_interval SET col4 = 10 WHERE col2 = '14 hours';
UPDATE 2
SELECT * FROM mpp21090_pttab_addpt_dropcol_dml_interval ORDER BY 1,2,3;
   col2   | col3 | col4 
----------+------+------
 01:00:00 | a    |    0
 14:00:00 | b    |   10
 14:00:00 | b    |   10
(3 rows)

-- Update partition key
UPDATE mpp21090_pttab_addpt_dropcol_dml_interval SET col2 = '12 hours' WHERE col2 = '14 hours';
UPDATE 2
SELECT * FROM mpp21090_pttab_addpt_dropcol_dml_interval ORDER BY 1,2,3;
   col2   | col3 | col4 
----------+------+------
 01:00:00 | a    |    0
 12:00:00 | b    |   10
 12:00:00 | b    |   10
(3 rows)

DELETE FROM mpp21090_pttab_addpt_dropcol_dml_interval WHERE col2 = '12 hours';
DELETE 2
SELECT * FROM mpp21090_pttab_addpt_dropcol_dml_interval ORDER BY 1,2,3;
   col2   | col3 | col4 
----------+------+------
 01:00:00 | a    |    0
(1 row)

