DROP TABLE IF EXISTS mpp21090_drop_lastcol_index_dml_char;
psql:/data/prabhd/test/tincrepo/main/dml/functional/output/mpp21090_drop_lastcol_index_dml_char_ao_opt.sql:14: NOTICE:  table "mpp21090_drop_lastcol_index_dml_char" does not exist, skipping
DROP TABLE
CREATE TABLE mpp21090_drop_lastcol_index_dml_char(
col1 int,
col2 decimal,
col3 char,
col4 date,
col5 char
) with (appendonly= true)  DISTRIBUTED by(col3);
CREATE TABLE
DROP INDEX IF EXISTS mpp21090_drop_lastcol_index_dml_idx_char;
psql:/data/prabhd/test/tincrepo/main/dml/functional/output/mpp21090_drop_lastcol_index_dml_char_ao_opt.sql:23: NOTICE:  index "mpp21090_drop_lastcol_index_dml_idx_char" does not exist, skipping
DROP INDEX
CREATE INDEX mpp21090_drop_lastcol_index_dml_idx_char on mpp21090_drop_lastcol_index_dml_char(col3);
CREATE INDEX
INSERT INTO mpp21090_drop_lastcol_index_dml_char VALUES(0,0.00,'a','2014-01-01','g');
INSERT 0 1
SELECT * FROM mpp21090_drop_lastcol_index_dml_char ORDER BY 1,2,3,4;
 col1 | col2 | col3 |    col4    | col5 
------+------+------+------------+------
    0 | 0.00 | a    | 2014-01-01 | g
(1 row)

ALTER TABLE mpp21090_drop_lastcol_index_dml_char DROP COLUMN col5;
ALTER TABLE
INSERT INTO mpp21090_drop_lastcol_index_dml_char SELECT 1,1.00,'b','2014-01-02';
INSERT 0 1
SELECT * FROM mpp21090_drop_lastcol_index_dml_char ORDER BY 1,2,3,4;
 col1 | col2 | col3 |    col4    
------+------+------+------------
    0 | 0.00 | a    | 2014-01-01
    1 | 1.00 | b    | 2014-01-02
(2 rows)

UPDATE mpp21090_drop_lastcol_index_dml_char SET col3='c' WHERE col3 = 'b' AND col1 = 1;
UPDATE 1
SELECT * FROM mpp21090_drop_lastcol_index_dml_char ORDER BY 1,2,3,4;
 col1 | col2 | col3 |    col4    
------+------+------+------------
    0 | 0.00 | a    | 2014-01-01
    1 | 1.00 | c    | 2014-01-02
(2 rows)

DELETE FROM mpp21090_drop_lastcol_index_dml_char WHERE col3='c';
DELETE 1
SELECT * FROM mpp21090_drop_lastcol_index_dml_char ORDER BY 1,2,3,4;
 col1 | col2 | col3 |    col4    
------+------+------+------------
    0 | 0.00 | a    | 2014-01-01
(1 row)

