DROP TABLE IF EXISTS mpp21090_xchange_pttab_dropcol_idx_dml_int8;
psql:/data/prabhd/test/tincrepo/main/dml/functional/output/mpp21090_xchange_pttab_dropcol_idx_dml_int8_opt.sql:14: NOTICE:  table "mpp21090_xchange_pttab_dropcol_idx_dml_int8" does not exist, skipping
DROP TABLE
CREATE TABLE mpp21090_xchange_pttab_dropcol_idx_dml_int8
(
    col1 int8,
    col2 int8,
    col3 char,
    col4 int,
    col5 int8
) 
DISTRIBUTED by (col1)
PARTITION BY RANGE(col2)(partition partone start(1) end(1000000000000000001)  WITH (APPENDONLY=true, COMPRESSLEVEL=5, ORIENTATION=column),partition parttwo start(1000000000000000001) end(2000000000000000001) WITH (APPENDONLY=true, COMPRESSLEVEL=5, ORIENTATION=row),partition partthree start(2000000000000000001) end(3000000000000000001));
psql:/data/prabhd/test/tincrepo/main/dml/functional/output/mpp21090_xchange_pttab_dropcol_idx_dml_int8_opt.sql:24: NOTICE:  CREATE TABLE will create partition "mpp21090_xchange_pttab_dropcol_idx_dml_int8_1_prt_partone" for table "mpp21090_xchange_pttab_dropcol_idx_dml_int8"
psql:/data/prabhd/test/tincrepo/main/dml/functional/output/mpp21090_xchange_pttab_dropcol_idx_dml_int8_opt.sql:24: NOTICE:  CREATE TABLE will create partition "mpp21090_xchange_pttab_dropcol_idx_dml_int8_1_prt_parttwo" for table "mpp21090_xchange_pttab_dropcol_idx_dml_int8"
psql:/data/prabhd/test/tincrepo/main/dml/functional/output/mpp21090_xchange_pttab_dropcol_idx_dml_int8_opt.sql:24: NOTICE:  CREATE TABLE will create partition "mpp21090_xchange_pttab_dropcol_idx_dml_int8_1_prt_partthree" for table "mpp21090_xchange_pttab_dropcol_idx_dml_int8"
CREATE TABLE
INSERT INTO mpp21090_xchange_pttab_dropcol_idx_dml_int8 VALUES(200000000000000000,200000000000000000,'a',0, 200000000000000000);
INSERT 0 1
SELECT * FROM mpp21090_xchange_pttab_dropcol_idx_dml_int8 ORDER BY 1,2,3,4;
        col1        |        col2        | col3 | col4 |        col5        
--------------------+--------------------+------+------+--------------------
 200000000000000000 | 200000000000000000 | a    |    0 | 200000000000000000
(1 row)

DROP INDEX IF EXISTS mpp21090_xchange_pttab_dropcol_idx_dml_idx_int8;
psql:/data/prabhd/test/tincrepo/main/dml/functional/output/mpp21090_xchange_pttab_dropcol_idx_dml_int8_opt.sql:29: NOTICE:  index "mpp21090_xchange_pttab_dropcol_idx_dml_idx_int8" does not exist, skipping
DROP INDEX
CREATE INDEX mpp21090_xchange_pttab_dropcol_idx_dml_idx_int8 on mpp21090_xchange_pttab_dropcol_idx_dml_int8(col2);
psql:/data/prabhd/test/tincrepo/main/dml/functional/output/mpp21090_xchange_pttab_dropcol_idx_dml_int8_opt.sql:30: NOTICE:  building index for child partition "mpp21090_xchange_pttab_dropcol_idx_dml_int8_1_prt_partone"
psql:/data/prabhd/test/tincrepo/main/dml/functional/output/mpp21090_xchange_pttab_dropcol_idx_dml_int8_opt.sql:30: NOTICE:  building index for child partition "mpp21090_xchange_pttab_dropcol_idx_dml_int8_1_prt_parttwo"
psql:/data/prabhd/test/tincrepo/main/dml/functional/output/mpp21090_xchange_pttab_dropcol_idx_dml_int8_opt.sql:30: NOTICE:  building index for child partition "mpp21090_xchange_pttab_dropcol_idx_dml_int8_1_prt_partthree"
CREATE INDEX
ALTER TABLE mpp21090_xchange_pttab_dropcol_idx_dml_int8 DROP COLUMN col1;
psql:/data/prabhd/test/tincrepo/main/dml/functional/output/mpp21090_xchange_pttab_dropcol_idx_dml_int8_opt.sql:32: NOTICE:  Dropping a column that is part of the distribution policy forces a NULL distribution policy
psql:/data/prabhd/test/tincrepo/main/dml/functional/output/mpp21090_xchange_pttab_dropcol_idx_dml_int8_opt.sql:32: NOTICE:  Dropping a column that is part of the distribution policy forces a NULL distribution policy
psql:/data/prabhd/test/tincrepo/main/dml/functional/output/mpp21090_xchange_pttab_dropcol_idx_dml_int8_opt.sql:32: NOTICE:  Dropping a column that is part of the distribution policy forces a NULL distribution policy
psql:/data/prabhd/test/tincrepo/main/dml/functional/output/mpp21090_xchange_pttab_dropcol_idx_dml_int8_opt.sql:32: NOTICE:  Dropping a column that is part of the distribution policy forces a NULL distribution policy
ALTER TABLE
-- Create Candidate table for Exchange
DROP TABLE IF EXISTS mpp21090_xchange_pttab_dropcol_idx_dml_int8_candidate;
psql:/data/prabhd/test/tincrepo/main/dml/functional/output/mpp21090_xchange_pttab_dropcol_idx_dml_int8_opt.sql:35: NOTICE:  table "mpp21090_xchange_pttab_dropcol_idx_dml_int8_candidate" does not exist, skipping
DROP TABLE
CREATE TABLE mpp21090_xchange_pttab_dropcol_idx_dml_int8_candidate( like mpp21090_xchange_pttab_dropcol_idx_dml_int8) distributed randomly;
CREATE TABLE
INSERT INTO mpp21090_xchange_pttab_dropcol_idx_dml_int8_candidate VALUES(200000000000000000,'z',1,200000000000000000);
INSERT 0 1
-- Exchange 
ALTER TABLE mpp21090_xchange_pttab_dropcol_idx_dml_int8 EXCHANGE PARTITION FOR(500000000000000000) WITH TABLE mpp21090_xchange_pttab_dropcol_idx_dml_int8_candidate;
psql:/data/prabhd/test/tincrepo/main/dml/functional/output/mpp21090_xchange_pttab_dropcol_idx_dml_int8_opt.sql:40: NOTICE:  exchanged partition "partone" of relation "mpp21090_xchange_pttab_dropcol_idx_dml_int8" with relation "mpp21090_xchange_pttab_dropcol_idx_dml_int8_candidate"
ALTER TABLE
SELECT * FROM mpp21090_xchange_pttab_dropcol_idx_dml_int8 ORDER BY 1,2,3;
        col2        | col3 | col4 |        col5        
--------------------+------+------+--------------------
 200000000000000000 | z    |    1 | 200000000000000000
(1 row)

SELECT * FROM mpp21090_xchange_pttab_dropcol_idx_dml_int8_candidate ORDER BY 1,2,3;
        col2        | col3 | col4 |        col5        
--------------------+------+------+--------------------
 200000000000000000 | a    |    0 | 200000000000000000
(1 row)

-- DML on partition table
INSERT INTO mpp21090_xchange_pttab_dropcol_idx_dml_int8 SELECT  100000000000000000,'b', 1, 100000000000000000;
INSERT 0 1
SELECT * FROM mpp21090_xchange_pttab_dropcol_idx_dml_int8 ORDER BY 1,2,3;
        col2        | col3 | col4 |        col5        
--------------------+------+------+--------------------
 100000000000000000 | b    |    1 | 100000000000000000
 200000000000000000 | z    |    1 | 200000000000000000
(2 rows)

UPDATE mpp21090_xchange_pttab_dropcol_idx_dml_int8 SET col5 = 3500000000000000000 WHERE col2 = 100000000000000000 AND col5 = 100000000000000000;
UPDATE 1
SELECT * FROM mpp21090_xchange_pttab_dropcol_idx_dml_int8 ORDER BY 1,2,3;
        col2        | col3 | col4 |        col5         
--------------------+------+------+---------------------
 100000000000000000 | b    |    1 | 3500000000000000000
 200000000000000000 | z    |    1 |  200000000000000000
(2 rows)

UPDATE mpp21090_xchange_pttab_dropcol_idx_dml_int8 SET col2 =200000000000000000 WHERE col3='b';
UPDATE 1
SELECT * FROM mpp21090_xchange_pttab_dropcol_idx_dml_int8 ORDER BY 1,2,3;
        col2        | col3 | col4 |        col5         
--------------------+------+------+---------------------
 200000000000000000 | b    |    1 | 3500000000000000000
 200000000000000000 | z    |    1 |  200000000000000000
(2 rows)

DELETE FROM mpp21090_xchange_pttab_dropcol_idx_dml_int8 WHERE col3='b';
DELETE 1
SELECT * FROM mpp21090_xchange_pttab_dropcol_idx_dml_int8 ORDER BY 1,2,3;
        col2        | col3 | col4 |        col5        
--------------------+------+------+--------------------
 200000000000000000 | z    |    1 | 200000000000000000
(1 row)

-- DML on candidate table
INSERT INTO mpp21090_xchange_pttab_dropcol_idx_dml_int8_candidate SELECT 100000000000000000,'b', 1, 100000000000000000;
INSERT 0 1
SELECT * FROM mpp21090_xchange_pttab_dropcol_idx_dml_int8_candidate ORDER BY 1,2,3;
        col2        | col3 | col4 |        col5        
--------------------+------+------+--------------------
 100000000000000000 | b    |    1 | 100000000000000000
 200000000000000000 | a    |    0 | 200000000000000000
(2 rows)

UPDATE mpp21090_xchange_pttab_dropcol_idx_dml_int8_candidate SET col2=200000000000000000 WHERE col3='a';
UPDATE 1
SELECT * FROM mpp21090_xchange_pttab_dropcol_idx_dml_int8_candidate ORDER BY 1,2,3;
        col2        | col3 | col4 |        col5        
--------------------+------+------+--------------------
 100000000000000000 | b    |    1 | 100000000000000000
 200000000000000000 | a    |    0 | 200000000000000000
(2 rows)

DELETE FROM mpp21090_xchange_pttab_dropcol_idx_dml_int8_candidate WHERE col3='a';
DELETE 1
SELECT * FROM mpp21090_xchange_pttab_dropcol_idx_dml_int8_candidate ORDER BY 1,2,3;
        col2        | col3 | col4 |        col5        
--------------------+------+------+--------------------
 100000000000000000 | b    |    1 | 100000000000000000
(1 row)

