DROP TABLE IF EXISTS mpp21090_defpt_dropcol_addcol_dml_timestamptz;
psql:/data/prabhd/test/tincrepo/main/dml/functional/output/mpp21090_defpt_dropcol_addcol_dml_timestamptz_opt.sql:14: NOTICE:  table "mpp21090_defpt_dropcol_addcol_dml_timestamptz" does not exist, skipping
DROP TABLE
CREATE TABLE mpp21090_defpt_dropcol_addcol_dml_timestamptz
(
    col1 timestamptz,
    col2 timestamptz,
    col3 char,
    col4 int
) 
DISTRIBUTED by (col1)
PARTITION BY LIST(col2)
(
default partition def
);
psql:/data/prabhd/test/tincrepo/main/dml/functional/output/mpp21090_defpt_dropcol_addcol_dml_timestamptz_opt.sql:26: NOTICE:  CREATE TABLE will create partition "mpp21090_defpt_dropcol_addcol_dml_timestamptz_1_prt_def" for table "mpp21090_defpt_dropcol_addcol_dml_timestamptz"
CREATE TABLE
INSERT INTO mpp21090_defpt_dropcol_addcol_dml_timestamptz VALUES('2013-12-31 12:00:00 PST','2013-12-31 12:00:00 PST','a',0);
INSERT 0 1
ALTER TABLE mpp21090_defpt_dropcol_addcol_dml_timestamptz DROP COLUMN col4;
ALTER TABLE
INSERT INTO mpp21090_defpt_dropcol_addcol_dml_timestamptz SELECT '2014-02-10 12:00:00 PST','2014-02-10 12:00:00 PST','b';
INSERT 0 1
SELECT * FROM mpp21090_defpt_dropcol_addcol_dml_timestamptz ORDER BY 1,2,3;
          col1          |          col2          | col3 
------------------------+------------------------+------
 2013-12-31 12:00:00-08 | 2013-12-31 12:00:00-08 | a
 2014-02-10 12:00:00-08 | 2014-02-10 12:00:00-08 | b
(2 rows)

ALTER TABLE mpp21090_defpt_dropcol_addcol_dml_timestamptz ADD COLUMN col5 timestamptz;
ALTER TABLE
INSERT INTO mpp21090_defpt_dropcol_addcol_dml_timestamptz SELECT '2013-12-31 12:00:00 PST','2013-12-31 12:00:00 PST','c','2013-12-31 12:00:00 PST';
INSERT 0 1
SELECT * FROM mpp21090_defpt_dropcol_addcol_dml_timestamptz ORDER BY 1,2,3;
          col1          |          col2          | col3 |          col5          
------------------------+------------------------+------+------------------------
 2013-12-31 12:00:00-08 | 2013-12-31 12:00:00-08 | a    | 
 2013-12-31 12:00:00-08 | 2013-12-31 12:00:00-08 | c    | 2013-12-31 12:00:00-08
 2014-02-10 12:00:00-08 | 2014-02-10 12:00:00-08 | b    | 
(3 rows)

UPDATE mpp21090_defpt_dropcol_addcol_dml_timestamptz SET col1 = '2014-01-01 12:00:00 PST' WHERE col2 = '2014-02-10 12:00:00 PST' AND col1 = '2014-02-10 12:00:00 PST';
UPDATE 1
SELECT * FROM mpp21090_defpt_dropcol_addcol_dml_timestamptz ORDER BY 1,2,3;
          col1          |          col2          | col3 |          col5          
------------------------+------------------------+------+------------------------
 2013-12-31 12:00:00-08 | 2013-12-31 12:00:00-08 | a    | 
 2013-12-31 12:00:00-08 | 2013-12-31 12:00:00-08 | c    | 2013-12-31 12:00:00-08
 2014-01-01 12:00:00-08 | 2014-02-10 12:00:00-08 | b    | 
(3 rows)

-- Update partition key
UPDATE mpp21090_defpt_dropcol_addcol_dml_timestamptz SET col2 = '2014-01-01 12:00:00 PST' WHERE col2 = '2014-02-10 12:00:00 PST' AND col1 = '2014-01-01 12:00:00 PST';
UPDATE 1
SELECT * FROM mpp21090_defpt_dropcol_addcol_dml_timestamptz ORDER BY 1,2,3;
          col1          |          col2          | col3 |          col5          
------------------------+------------------------+------+------------------------
 2013-12-31 12:00:00-08 | 2013-12-31 12:00:00-08 | a    | 
 2013-12-31 12:00:00-08 | 2013-12-31 12:00:00-08 | c    | 2013-12-31 12:00:00-08
 2014-01-01 12:00:00-08 | 2014-01-01 12:00:00-08 | b    | 
(3 rows)

DELETE FROM mpp21090_defpt_dropcol_addcol_dml_timestamptz WHERE col2 = '2014-01-01 12:00:00 PST';
DELETE 1
SELECT * FROM mpp21090_defpt_dropcol_addcol_dml_timestamptz ORDER BY 1,2,3;
          col1          |          col2          | col3 |          col5          
------------------------+------------------------+------+------------------------
 2013-12-31 12:00:00-08 | 2013-12-31 12:00:00-08 | a    | 
 2013-12-31 12:00:00-08 | 2013-12-31 12:00:00-08 | c    | 2013-12-31 12:00:00-08
(2 rows)

