DROP TABLE IF EXISTS mpp21090_defpt_dropcol_addcol_dml_time;
psql:/data/prabhd/test/tincrepo/main/dml/functional/output/mpp21090_defpt_dropcol_addcol_dml_time_opt.sql:14: NOTICE:  table "mpp21090_defpt_dropcol_addcol_dml_time" does not exist, skipping
DROP TABLE
CREATE TABLE mpp21090_defpt_dropcol_addcol_dml_time
(
    col1 time,
    col2 time,
    col3 char,
    col4 int
) 
DISTRIBUTED by (col1)
PARTITION BY LIST(col2)
(
default partition def
);
psql:/data/prabhd/test/tincrepo/main/dml/functional/output/mpp21090_defpt_dropcol_addcol_dml_time_opt.sql:26: NOTICE:  CREATE TABLE will create partition "mpp21090_defpt_dropcol_addcol_dml_time_1_prt_def" for table "mpp21090_defpt_dropcol_addcol_dml_time"
CREATE TABLE
INSERT INTO mpp21090_defpt_dropcol_addcol_dml_time VALUES('12:00:00','12:00:00','a',0);
INSERT 0 1
ALTER TABLE mpp21090_defpt_dropcol_addcol_dml_time DROP COLUMN col4;
ALTER TABLE
INSERT INTO mpp21090_defpt_dropcol_addcol_dml_time SELECT '11:30:00','11:30:00','b';
INSERT 0 1
SELECT * FROM mpp21090_defpt_dropcol_addcol_dml_time ORDER BY 1,2,3;
   col1   |   col2   | col3 
----------+----------+------
 11:30:00 | 11:30:00 | b
 12:00:00 | 12:00:00 | a
(2 rows)

ALTER TABLE mpp21090_defpt_dropcol_addcol_dml_time ADD COLUMN col5 time;
ALTER TABLE
INSERT INTO mpp21090_defpt_dropcol_addcol_dml_time SELECT '12:00:00','12:00:00','c','12:00:00';
INSERT 0 1
SELECT * FROM mpp21090_defpt_dropcol_addcol_dml_time ORDER BY 1,2,3;
   col1   |   col2   | col3 |   col5   
----------+----------+------+----------
 11:30:00 | 11:30:00 | b    | 
 12:00:00 | 12:00:00 | a    | 
 12:00:00 | 12:00:00 | c    | 12:00:00
(3 rows)

UPDATE mpp21090_defpt_dropcol_addcol_dml_time SET col1 = '1:00:00' WHERE col2 = '11:30:00' AND col1 = '11:30:00';
UPDATE 1
SELECT * FROM mpp21090_defpt_dropcol_addcol_dml_time ORDER BY 1,2,3;
   col1   |   col2   | col3 |   col5   
----------+----------+------+----------
 01:00:00 | 11:30:00 | b    | 
 12:00:00 | 12:00:00 | a    | 
 12:00:00 | 12:00:00 | c    | 12:00:00
(3 rows)

-- Update partition key
UPDATE mpp21090_defpt_dropcol_addcol_dml_time SET col2 = '1:00:00' WHERE col2 = '11:30:00' AND col1 = '1:00:00';
UPDATE 1
SELECT * FROM mpp21090_defpt_dropcol_addcol_dml_time ORDER BY 1,2,3;
   col1   |   col2   | col3 |   col5   
----------+----------+------+----------
 01:00:00 | 01:00:00 | b    | 
 12:00:00 | 12:00:00 | a    | 
 12:00:00 | 12:00:00 | c    | 12:00:00
(3 rows)

DELETE FROM mpp21090_defpt_dropcol_addcol_dml_time WHERE col2 = '1:00:00';
DELETE 1
SELECT * FROM mpp21090_defpt_dropcol_addcol_dml_time ORDER BY 1,2,3;
   col1   |   col2   | col3 |   col5   
----------+----------+------+----------
 12:00:00 | 12:00:00 | a    | 
 12:00:00 | 12:00:00 | c    | 12:00:00
(2 rows)

