DROP TABLE IF EXISTS mpp21090_dropcol_splitdfpt_dml_interval;
psql:/data/prabhd/test/tincrepo/main/dml/functional/output/mpp21090_dropcol_splitdfpt_dml_interval_opt.sql:14: NOTICE:  table "mpp21090_dropcol_splitdfpt_dml_interval" does not exist, skipping
DROP TABLE
CREATE TABLE mpp21090_dropcol_splitdfpt_dml_interval
(
    col1 interval,
    col2 interval,
    col3 char,
    col4 interval,
    col5 int
) 
DISTRIBUTED by (col1)
PARTITION BY LIST(col2)
(
default partition def
);
psql:/data/prabhd/test/tincrepo/main/dml/functional/output/mpp21090_dropcol_splitdfpt_dml_interval_opt.sql:27: NOTICE:  CREATE TABLE will create partition "mpp21090_dropcol_splitdfpt_dml_interval_1_prt_def" for table "mpp21090_dropcol_splitdfpt_dml_interval"
CREATE TABLE
INSERT INTO mpp21090_dropcol_splitdfpt_dml_interval VALUES('1 hour','1 hour','a','1 hour',0);
INSERT 0 1
SELECT * FROM mpp21090_dropcol_splitdfpt_dml_interval ORDER BY 1,2,3,4;
   col1   |   col2   | col3 |   col4   | col5 
----------+----------+------+----------+------
 01:00:00 | 01:00:00 | a    | 01:00:00 |    0
(1 row)

ALTER TABLE mpp21090_dropcol_splitdfpt_dml_interval DROP COLUMN col4;
ALTER TABLE
ALTER TABLE mpp21090_dropcol_splitdfpt_dml_interval SPLIT DEFAULT PARTITION at ('30 secs') into (partition partsplitone,partition def);
psql:/data/prabhd/test/tincrepo/main/dml/functional/output/mpp21090_dropcol_splitdfpt_dml_interval_opt.sql:34: NOTICE:  exchanged partition "def" of relation "mpp21090_dropcol_splitdfpt_dml_interval" with relation "pg_temp_66548"
psql:/data/prabhd/test/tincrepo/main/dml/functional/output/mpp21090_dropcol_splitdfpt_dml_interval_opt.sql:34: NOTICE:  dropped partition "def" for relation "mpp21090_dropcol_splitdfpt_dml_interval"
psql:/data/prabhd/test/tincrepo/main/dml/functional/output/mpp21090_dropcol_splitdfpt_dml_interval_opt.sql:34: NOTICE:  CREATE TABLE will create partition "mpp21090_dropcol_splitdfpt_dml_interval_1_prt_partsplitone" for table "mpp21090_dropcol_splitdfpt_dml_interval"
psql:/data/prabhd/test/tincrepo/main/dml/functional/output/mpp21090_dropcol_splitdfpt_dml_interval_opt.sql:34: NOTICE:  CREATE TABLE will create partition "mpp21090_dropcol_splitdfpt_dml_interval_1_prt_def" for table "mpp21090_dropcol_splitdfpt_dml_interval"
ALTER TABLE
INSERT INTO mpp21090_dropcol_splitdfpt_dml_interval SELECT '1 sec', '1 sec','b', 1;
INSERT 0 1
SELECT * FROM mpp21090_dropcol_splitdfpt_dml_interval ORDER BY 1,2,3;
   col1   |   col2   | col3 | col5 
----------+----------+------+------
 00:00:01 | 00:00:01 | b    |    1
 01:00:00 | 01:00:00 | a    |    0
(2 rows)

-- Update distribution key
UPDATE mpp21090_dropcol_splitdfpt_dml_interval SET col1 = '14 hours' WHERE col2 = '1 sec' AND col1 = '1 sec';
UPDATE 1
SELECT * FROM mpp21090_dropcol_splitdfpt_dml_interval ORDER BY 1,2,3;
   col1   |   col2   | col3 | col5 
----------+----------+------+------
 01:00:00 | 01:00:00 | a    |    0
 14:00:00 | 00:00:01 | b    |    1
(2 rows)

-- Update partition key
UPDATE mpp21090_dropcol_splitdfpt_dml_interval SET col2 = '14 hours' WHERE col2 = '1 sec' AND col1 = '14 hours';
UPDATE 1
SELECT * FROM mpp21090_dropcol_splitdfpt_dml_interval ORDER BY 1,2,3;
   col1   |   col2   | col3 | col5 
----------+----------+------+------
 01:00:00 | 01:00:00 | a    |    0
 14:00:00 | 14:00:00 | b    |    1
(2 rows)

DELETE FROM mpp21090_dropcol_splitdfpt_dml_interval WHERE col3='b';
DELETE 1
SELECT * FROM mpp21090_dropcol_splitdfpt_dml_interval ORDER BY 1,2,3;
   col1   |   col2   | col3 | col5 
----------+----------+------+------
 01:00:00 | 01:00:00 | a    |    0
(1 row)

