DROP TABLE IF EXISTS mpp21090_changedistpolicy_dml_pttab_int4;
psql:/data/prabhd/test/tincrepo/main/dml/functional/output/mpp21090_changedistpolicy_dml_pttab_int4_opt.sql:14: NOTICE:  table "mpp21090_changedistpolicy_dml_pttab_int4" does not exist, skipping
DROP TABLE
CREATE TABLE mpp21090_changedistpolicy_dml_pttab_int4
(
    col1 int4,
    col2 int4,
    col3 char,
    col4 int4,
    col5 int
) DISTRIBUTED BY (col1) PARTITION BY RANGE(col2)(partition partone start(1) end(100000001)  WITH (APPENDONLY=true, COMPRESSLEVEL=5, ORIENTATION=column),partition parttwo start(100000001) end(200000001) WITH (APPENDONLY=true, COMPRESSLEVEL=5, ORIENTATION=row),partition partthree start(200000001) end(300000001));
psql:/data/prabhd/test/tincrepo/main/dml/functional/output/mpp21090_changedistpolicy_dml_pttab_int4_opt.sql:22: NOTICE:  Table doesn't have 'DISTRIBUTED BY' clause -- Using column named 'col1' as the Greenplum Database data distribution key for this table.
HINT:  The 'DISTRIBUTED BY' clause determines the distribution of data. Make sure column(s) chosen are the optimal data distribution key to minimize skew.
psql:/data/prabhd/test/tincrepo/main/dml/functional/output/mpp21090_changedistpolicy_dml_pttab_int4_opt.sql:22: NOTICE:  CREATE TABLE will create partition "mpp21090_changedistpolicy_dml_pttab_int4_1_prt_partone" for table "mpp21090_changedistpolicy_dml_pttab_int4"
psql:/data/prabhd/test/tincrepo/main/dml/functional/output/mpp21090_changedistpolicy_dml_pttab_int4_opt.sql:22: NOTICE:  CREATE TABLE will create partition "mpp21090_changedistpolicy_dml_pttab_int4_1_prt_parttwo" for table "mpp21090_changedistpolicy_dml_pttab_int4"
psql:/data/prabhd/test/tincrepo/main/dml/functional/output/mpp21090_changedistpolicy_dml_pttab_int4_opt.sql:22: NOTICE:  CREATE TABLE will create partition "mpp21090_changedistpolicy_dml_pttab_int4_1_prt_partthree" for table "mpp21090_changedistpolicy_dml_pttab_int4"
CREATE TABLE
INSERT INTO mpp21090_changedistpolicy_dml_pttab_int4 VALUES(20000000,20000000,'a',20000000,0);
INSERT 0 1
SELECT * FROM mpp21090_changedistpolicy_dml_pttab_int4 ORDER BY 1,2,3,4;
   col1   |   col2   | col3 |   col4   | col5 
----------+----------+------+----------+------
 20000000 | 20000000 | a    | 20000000 |    0
(1 row)

ALTER TABLE mpp21090_changedistpolicy_dml_pttab_int4 DROP COLUMN col4;
ALTER TABLE
INSERT INTO mpp21090_changedistpolicy_dml_pttab_int4 VALUES(20000000,20000000,'b',1);
INSERT 0 1
SELECT * FROM mpp21090_changedistpolicy_dml_pttab_int4 ORDER BY 1,2,3,4;
   col1   |   col2   | col3 | col5 
----------+----------+------+------
 20000000 | 20000000 | a    |    0
 20000000 | 20000000 | b    |    1
(2 rows)

ALTER TABLE mpp21090_changedistpolicy_dml_pttab_int4 SET DISTRIBUTED BY (col3);
ALTER TABLE
INSERT INTO mpp21090_changedistpolicy_dml_pttab_int4 SELECT 10000000, 10000000,'c', 2;
INSERT 0 1
SELECT * FROM mpp21090_changedistpolicy_dml_pttab_int4 ORDER BY 1,2,3;
   col1   |   col2   | col3 | col5 
----------+----------+------+------
 10000000 | 10000000 | c    |    2
 20000000 | 20000000 | a    |    0
 20000000 | 20000000 | b    |    1
(3 rows)

UPDATE mpp21090_changedistpolicy_dml_pttab_int4 SET col3 ='c' WHERE col3 ='b';
UPDATE 1
SELECT * FROM mpp21090_changedistpolicy_dml_pttab_int4 ORDER BY 1,2,3;
   col1   |   col2   | col3 | col5 
----------+----------+------+------
 10000000 | 10000000 | c    |    2
 20000000 | 20000000 | a    |    0
 20000000 | 20000000 | c    |    1
(3 rows)

DELETE FROM mpp21090_changedistpolicy_dml_pttab_int4 WHERE col3 ='c';
DELETE 2
SELECT * FROM mpp21090_changedistpolicy_dml_pttab_int4 ORDER BY 1,2,3;
   col1   |   col2   | col3 | col5 
----------+----------+------+------
 20000000 | 20000000 | a    |    0
(1 row)

