DROP TABLE IF EXISTS mpp21090_pttab_dropcol_addcol_addpt_dml_decimal;
psql:/data/prabhd/test/tincrepo/main/dml/functional/output/mpp21090_pttab_dropcol_addcol_addpt_dml_decimal_opt.sql:14: NOTICE:  table "mpp21090_pttab_dropcol_addcol_addpt_dml_decimal" does not exist, skipping
DROP TABLE
CREATE TABLE mpp21090_pttab_dropcol_addcol_addpt_dml_decimal
(
    col1 decimal,
    col2 decimal,
    col3 char,
    col4 int
) 
DISTRIBUTED by (col1)
PARTITION BY RANGE(col2)(partition partone start(1.00) end(10.00)  WITH (APPENDONLY=true, COMPRESSLEVEL=5, ORIENTATION=column),partition parttwo start(10.00) end(20.00) WITH (APPENDONLY=true, COMPRESSLEVEL=5, ORIENTATION=row),partition partthree start(20.00) end(30.00));
psql:/data/prabhd/test/tincrepo/main/dml/functional/output/mpp21090_pttab_dropcol_addcol_addpt_dml_decimal_opt.sql:23: NOTICE:  CREATE TABLE will create partition "mpp21090_pttab_dropcol_addcol_addpt_dml_decimal_1_prt_partone" for table "mpp21090_pttab_dropcol_addcol_addpt_dml_decimal"
psql:/data/prabhd/test/tincrepo/main/dml/functional/output/mpp21090_pttab_dropcol_addcol_addpt_dml_decimal_opt.sql:23: NOTICE:  CREATE TABLE will create partition "mpp21090_pttab_dropcol_addcol_addpt_dml_decimal_1_prt_parttwo" for table "mpp21090_pttab_dropcol_addcol_addpt_dml_decimal"
psql:/data/prabhd/test/tincrepo/main/dml/functional/output/mpp21090_pttab_dropcol_addcol_addpt_dml_decimal_opt.sql:23: NOTICE:  CREATE TABLE will create partition "mpp21090_pttab_dropcol_addcol_addpt_dml_decimal_1_prt_partthree" for table "mpp21090_pttab_dropcol_addcol_addpt_dml_decimal"
CREATE TABLE
INSERT INTO mpp21090_pttab_dropcol_addcol_addpt_dml_decimal VALUES(2.00,2.00,'a',0);
INSERT 0 1
ALTER TABLE mpp21090_pttab_dropcol_addcol_addpt_dml_decimal DROP COLUMN col4;
ALTER TABLE
INSERT INTO mpp21090_pttab_dropcol_addcol_addpt_dml_decimal VALUES(2.00,2.00,'b');
INSERT 0 1
ALTER TABLE mpp21090_pttab_dropcol_addcol_addpt_dml_decimal ADD COLUMN col5 decimal DEFAULT 2.00;
ALTER TABLE
INSERT INTO mpp21090_pttab_dropcol_addcol_addpt_dml_decimal SELECT 2.00,2.00,'c',2.00;
INSERT 0 1
SELECT * FROM mpp21090_pttab_dropcol_addcol_addpt_dml_decimal ORDER BY 1,2,3;
 col1 | col2 | col3 | col5 
------+------+------+------
 2.00 | 2.00 | a    | 2.00
 2.00 | 2.00 | b    | 2.00
 2.00 | 2.00 | c    | 2.00
(3 rows)

UPDATE mpp21090_pttab_dropcol_addcol_addpt_dml_decimal SET col5 = 1.00 WHERE col2 = 2.00 AND col1 = 2.00;
UPDATE 3
SELECT * FROM mpp21090_pttab_dropcol_addcol_addpt_dml_decimal ORDER BY 1,2,3;
 col1 | col2 | col3 | col5 
------+------+------+------
 2.00 | 2.00 | a    | 1.00
 2.00 | 2.00 | b    | 1.00
 2.00 | 2.00 | c    | 1.00
(3 rows)

DELETE FROM mpp21090_pttab_dropcol_addcol_addpt_dml_decimal WHERE col5 = 1.00;
DELETE 3
SELECT * FROM mpp21090_pttab_dropcol_addcol_addpt_dml_decimal ORDER BY 1,2,3;
 col1 | col2 | col3 | col5 
------+------+------+------
(0 rows)

ALTER TABLE mpp21090_pttab_dropcol_addcol_addpt_dml_decimal ADD PARTITION partfour start(30.00) end(40.00) inclusive;
psql:/data/prabhd/test/tincrepo/main/dml/functional/output/mpp21090_pttab_dropcol_addcol_addpt_dml_decimal_opt.sql:41: NOTICE:  CREATE TABLE will create partition "mpp21090_pttab_dropcol_addcol_addpt_dml_decimal_1_prt_partfour" for table "mpp21090_pttab_dropcol_addcol_addpt_dml_decimal"
ALTER TABLE
ALTER TABLE mpp21090_pttab_dropcol_addcol_addpt_dml_decimal ADD DEFAULT partition def;
psql:/data/prabhd/test/tincrepo/main/dml/functional/output/mpp21090_pttab_dropcol_addcol_addpt_dml_decimal_opt.sql:42: NOTICE:  CREATE TABLE will create partition "mpp21090_pttab_dropcol_addcol_addpt_dml_decimal_1_prt_def" for table "mpp21090_pttab_dropcol_addcol_addpt_dml_decimal"
ALTER TABLE
INSERT INTO mpp21090_pttab_dropcol_addcol_addpt_dml_decimal SELECT 35.00,35.00,'d',35.00;
INSERT 0 1
SELECT * FROM mpp21090_pttab_dropcol_addcol_addpt_dml_decimal ORDER BY 1,2,3;
 col1  | col2  | col3 | col5  
-------+-------+------+-------
 35.00 | 35.00 | d    | 35.00
(1 row)

UPDATE mpp21090_pttab_dropcol_addcol_addpt_dml_decimal SET col5 = 1.00 WHERE col2 = 35.00 AND col3 ='d';
UPDATE 1
SELECT * FROM mpp21090_pttab_dropcol_addcol_addpt_dml_decimal ORDER BY 1,2,3;
 col1  | col2  | col3 | col5 
-------+-------+------+------
 35.00 | 35.00 | d    | 1.00
(1 row)

-- Update partition key
UPDATE mpp21090_pttab_dropcol_addcol_addpt_dml_decimal SET col2 = 1.00 WHERE col2 = 35.00 AND col3 ='d';
UPDATE 1
SELECT * FROM mpp21090_pttab_dropcol_addcol_addpt_dml_decimal ORDER BY 1,2,3;
 col1  | col2 | col3 | col5 
-------+------+------+------
 35.00 | 1.00 | d    | 1.00
(1 row)

DELETE FROM mpp21090_pttab_dropcol_addcol_addpt_dml_decimal WHERE col5 = 1.00;
DELETE 1
SELECT * FROM mpp21090_pttab_dropcol_addcol_addpt_dml_decimal ORDER BY 1,2,3;
 col1 | col2 | col3 | col5 
------+------+------+------
(0 rows)

