DROP TABLE IF EXISTS mpp21090_reordered_col_dml_interval;
psql:/data/prabhd/test/tincrepo/main/dml/functional/output/mpp21090_reordered_col_dml_interval_opt.sql:14: NOTICE:  table "mpp21090_reordered_col_dml_interval" does not exist, skipping
DROP TABLE
CREATE TABLE mpp21090_reordered_col_dml_interval
(
    col1 interval DEFAULT '11 hours',
    col2 interval,
    col3 char,
    col4 interval,
    col5 int
) 
DISTRIBUTED by (col1)
PARTITION BY RANGE(col2)(partition partone start('1 sec') end('1 min')  WITH (APPENDONLY=true, COMPRESSLEVEL=5, ORIENTATION=column),partition parttwo start('1 min') end('1 hour') WITH (APPENDONLY=true, COMPRESSLEVEL=5, ORIENTATION=row),partition partthree start('1 hour') end('12 hours'));
psql:/data/prabhd/test/tincrepo/main/dml/functional/output/mpp21090_reordered_col_dml_interval_opt.sql:24: NOTICE:  CREATE TABLE will create partition "mpp21090_reordered_col_dml_interval_1_prt_partone" for table "mpp21090_reordered_col_dml_interval"
psql:/data/prabhd/test/tincrepo/main/dml/functional/output/mpp21090_reordered_col_dml_interval_opt.sql:24: NOTICE:  CREATE TABLE will create partition "mpp21090_reordered_col_dml_interval_1_prt_parttwo" for table "mpp21090_reordered_col_dml_interval"
psql:/data/prabhd/test/tincrepo/main/dml/functional/output/mpp21090_reordered_col_dml_interval_opt.sql:24: NOTICE:  CREATE TABLE will create partition "mpp21090_reordered_col_dml_interval_1_prt_partthree" for table "mpp21090_reordered_col_dml_interval"
CREATE TABLE
INSERT INTO mpp21090_reordered_col_dml_interval(col2,col1,col3,col5,col4) SELECT '10 secs', '10 secs','a', 1,'10 secs';
INSERT 0 1
INSERT INTO mpp21090_reordered_col_dml_interval(col2,col3,col5,col4) SELECT '10 secs','b', 2, '10 secs'; 
INSERT 0 1
SELECT * FROM mpp21090_reordered_col_dml_interval ORDER BY 1,2,3,4;
   col1   |   col2   | col3 |   col4   | col5 
----------+----------+------+----------+------
 00:00:10 | 00:00:10 | a    | 00:00:10 |    1
 11:00:00 | 00:00:10 | b    | 00:00:10 |    2
(2 rows)

ALTER TABLE mpp21090_reordered_col_dml_interval DROP COLUMN col4;
ALTER TABLE
ALTER TABLE mpp21090_reordered_col_dml_interval ADD COLUMN col4 int DEFAULT 10;
ALTER TABLE
INSERT INTO mpp21090_reordered_col_dml_interval(col2,col3,col5,col4) SELECT '10 secs','c', 2, 10; 
INSERT 0 1
SELECT * FROM mpp21090_reordered_col_dml_interval ORDER BY 1,2,3,4;
   col1   |   col2   | col3 | col5 | col4 
----------+----------+------+------+------
 00:00:10 | 00:00:10 | a    |    1 |   10
 11:00:00 | 00:00:10 | b    |    2 |   10
 11:00:00 | 00:00:10 | c    |    2 |   10
(3 rows)

UPDATE mpp21090_reordered_col_dml_interval SET col4 = 20;
UPDATE 3
SELECT * FROM mpp21090_reordered_col_dml_interval ORDER BY 1,2,3,4;
   col1   |   col2   | col3 | col5 | col4 
----------+----------+------+------+------
 00:00:10 | 00:00:10 | a    |    1 |   20
 11:00:00 | 00:00:10 | b    |    2 |   20
 11:00:00 | 00:00:10 | c    |    2 |   20
(3 rows)

DELETE FROM mpp21090_reordered_col_dml_interval WHERE col4=20;
DELETE 3
SELECT * FROM mpp21090_reordered_col_dml_interval ORDER BY 1,2,3,4;
 col1 | col2 | col3 | col5 | col4 
------+------+------+------+------
(0 rows)

