DROP TABLE IF EXISTS mpp21090_pttab_addcol_addpt_dropcol_time;
psql:/data/prabhd/test/tincrepo/main/dml/functional/output/mpp21090_pttab_addcol_addpt_dropcol_time_opt.sql:14: NOTICE:  table "mpp21090_pttab_addcol_addpt_dropcol_time" does not exist, skipping
DROP TABLE
CREATE TABLE mpp21090_pttab_addcol_addpt_dropcol_time
(
    col1 time,
    col2 time,
    col3 char,
    col4 int
) 
DISTRIBUTED by (col1)
PARTITION BY RANGE(col2)(partition partone start('12:00:00') end('18:00:00')  WITH (APPENDONLY=true, COMPRESSLEVEL=5, ORIENTATION=column),partition parttwo start('18:00:00') end('24:00:00') WITH (APPENDONLY=true, COMPRESSLEVEL=5, ORIENTATION=row),partition partthree start('0:00:00') end('11:00:00'));
psql:/data/prabhd/test/tincrepo/main/dml/functional/output/mpp21090_pttab_addcol_addpt_dropcol_time_opt.sql:23: NOTICE:  CREATE TABLE will create partition "mpp21090_pttab_addcol_addpt_dropcol_time_1_prt_partthree" for table "mpp21090_pttab_addcol_addpt_dropcol_time"
psql:/data/prabhd/test/tincrepo/main/dml/functional/output/mpp21090_pttab_addcol_addpt_dropcol_time_opt.sql:23: NOTICE:  CREATE TABLE will create partition "mpp21090_pttab_addcol_addpt_dropcol_time_1_prt_partone" for table "mpp21090_pttab_addcol_addpt_dropcol_time"
psql:/data/prabhd/test/tincrepo/main/dml/functional/output/mpp21090_pttab_addcol_addpt_dropcol_time_opt.sql:23: NOTICE:  CREATE TABLE will create partition "mpp21090_pttab_addcol_addpt_dropcol_time_1_prt_parttwo" for table "mpp21090_pttab_addcol_addpt_dropcol_time"
CREATE TABLE
INSERT INTO mpp21090_pttab_addcol_addpt_dropcol_time VALUES('12:00:00','12:00:00','a',0);
INSERT 0 1
ALTER TABLE mpp21090_pttab_addcol_addpt_dropcol_time ADD COLUMN col5 time DEFAULT '12:00:00';
ALTER TABLE
ALTER TABLE mpp21090_pttab_addcol_addpt_dropcol_time ADD PARTITION partfour start('11:00:00') end('12:00:00');
psql:/data/prabhd/test/tincrepo/main/dml/functional/output/mpp21090_pttab_addcol_addpt_dropcol_time_opt.sql:28: NOTICE:  CREATE TABLE will create partition "mpp21090_pttab_addcol_addpt_dropcol_time_1_prt_partfour" for table "mpp21090_pttab_addcol_addpt_dropcol_time"
ALTER TABLE
INSERT INTO mpp21090_pttab_addcol_addpt_dropcol_time SELECT '11:30:00','11:30:00','b',1, '11:30:00';
INSERT 0 1
SELECT * FROM mpp21090_pttab_addcol_addpt_dropcol_time ORDER BY 1,2,3;
   col1   |   col2   | col3 | col4 |   col5   
----------+----------+------+------+----------
 11:30:00 | 11:30:00 | b    |    1 | 11:30:00
 12:00:00 | 12:00:00 | a    |    0 | 12:00:00
(2 rows)

ALTER TABLE mpp21090_pttab_addcol_addpt_dropcol_time DROP COLUMN col1;
psql:/data/prabhd/test/tincrepo/main/dml/functional/output/mpp21090_pttab_addcol_addpt_dropcol_time_opt.sql:33: NOTICE:  Dropping a column that is part of the distribution policy forces a NULL distribution policy
psql:/data/prabhd/test/tincrepo/main/dml/functional/output/mpp21090_pttab_addcol_addpt_dropcol_time_opt.sql:33: NOTICE:  Dropping a column that is part of the distribution policy forces a NULL distribution policy
psql:/data/prabhd/test/tincrepo/main/dml/functional/output/mpp21090_pttab_addcol_addpt_dropcol_time_opt.sql:33: NOTICE:  Dropping a column that is part of the distribution policy forces a NULL distribution policy
psql:/data/prabhd/test/tincrepo/main/dml/functional/output/mpp21090_pttab_addcol_addpt_dropcol_time_opt.sql:33: NOTICE:  Dropping a column that is part of the distribution policy forces a NULL distribution policy
psql:/data/prabhd/test/tincrepo/main/dml/functional/output/mpp21090_pttab_addcol_addpt_dropcol_time_opt.sql:33: NOTICE:  Dropping a column that is part of the distribution policy forces a NULL distribution policy
ALTER TABLE
INSERT INTO mpp21090_pttab_addcol_addpt_dropcol_time SELECT '11:30:00','c',1, '11:30:00';
INSERT 0 1
SELECT * FROM mpp21090_pttab_addcol_addpt_dropcol_time ORDER BY 1,2,3;
   col2   | col3 | col4 |   col5   
----------+------+------+----------
 11:30:00 | b    |    1 | 11:30:00
 11:30:00 | c    |    1 | 11:30:00
 12:00:00 | a    |    0 | 12:00:00
(3 rows)

UPDATE mpp21090_pttab_addcol_addpt_dropcol_time SET col5 = '1:00:00' WHERE col2 = '11:30:00' and col3='c';
UPDATE 1
SELECT * FROM mpp21090_pttab_addcol_addpt_dropcol_time ORDER BY 1,2,3;
   col2   | col3 | col4 |   col5   
----------+------+------+----------
 11:30:00 | b    |    1 | 11:30:00
 11:30:00 | c    |    1 | 01:00:00
 12:00:00 | a    |    0 | 12:00:00
(3 rows)

-- Update partition key
UPDATE mpp21090_pttab_addcol_addpt_dropcol_time SET col2 = '1:00:00' WHERE col2 = '11:30:00' and col3='c';
UPDATE 1
SELECT * FROM mpp21090_pttab_addcol_addpt_dropcol_time ORDER BY 1,2,3;
   col2   | col3 | col4 |   col5   
----------+------+------+----------
 01:00:00 | c    |    1 | 01:00:00
 11:30:00 | b    |    1 | 11:30:00
 12:00:00 | a    |    0 | 12:00:00
(3 rows)

DELETE FROM mpp21090_pttab_addcol_addpt_dropcol_time WHERE col2 = '1:00:00';
DELETE 1
SELECT * FROM mpp21090_pttab_addcol_addpt_dropcol_time ORDER BY 1,2,3;
   col2   | col3 | col4 |   col5   
----------+------+------+----------
 11:30:00 | b    |    1 | 11:30:00
 12:00:00 | a    |    0 | 12:00:00
(2 rows)

