DROP TABLE IF EXISTS mpp21090_changedistpolicy_dml_pttab_interval;
psql:/data/prabhd/test/tincrepo/main/dml/functional/output/mpp21090_changedistpolicy_dml_pttab_interval_opt.sql:14: NOTICE:  table "mpp21090_changedistpolicy_dml_pttab_interval" does not exist, skipping
DROP TABLE
CREATE TABLE mpp21090_changedistpolicy_dml_pttab_interval
(
    col1 interval,
    col2 interval,
    col3 char,
    col4 interval,
    col5 int
) DISTRIBUTED BY (col1) PARTITION BY RANGE(col2)(partition partone start('1 sec') end('1 min')  WITH (APPENDONLY=true, COMPRESSLEVEL=5, ORIENTATION=column),partition parttwo start('1 min') end('1 hour') WITH (APPENDONLY=true, COMPRESSLEVEL=5, ORIENTATION=row),partition partthree start('1 hour') end('12 hours'));
psql:/data/prabhd/test/tincrepo/main/dml/functional/output/mpp21090_changedistpolicy_dml_pttab_interval_opt.sql:22: NOTICE:  Table doesn't have 'DISTRIBUTED BY' clause -- Using column named 'col1' as the Greenplum Database data distribution key for this table.
HINT:  The 'DISTRIBUTED BY' clause determines the distribution of data. Make sure column(s) chosen are the optimal data distribution key to minimize skew.
psql:/data/prabhd/test/tincrepo/main/dml/functional/output/mpp21090_changedistpolicy_dml_pttab_interval_opt.sql:22: NOTICE:  CREATE TABLE will create partition "mpp21090_changedistpolicy_dml_pttab_interval_1_prt_partone" for table "mpp21090_changedistpolicy_dml_pttab_interval"
psql:/data/prabhd/test/tincrepo/main/dml/functional/output/mpp21090_changedistpolicy_dml_pttab_interval_opt.sql:22: NOTICE:  CREATE TABLE will create partition "mpp21090_changedistpolicy_dml_pttab_interval_1_prt_parttwo" for table "mpp21090_changedistpolicy_dml_pttab_interval"
psql:/data/prabhd/test/tincrepo/main/dml/functional/output/mpp21090_changedistpolicy_dml_pttab_interval_opt.sql:22: NOTICE:  CREATE TABLE will create partition "mpp21090_changedistpolicy_dml_pttab_interval_1_prt_partthree" for table "mpp21090_changedistpolicy_dml_pttab_interval"
CREATE TABLE
INSERT INTO mpp21090_changedistpolicy_dml_pttab_interval VALUES('10 secs','10 secs','a','10 secs',0);
INSERT 0 1
SELECT * FROM mpp21090_changedistpolicy_dml_pttab_interval ORDER BY 1,2,3,4;
   col1   |   col2   | col3 |   col4   | col5 
----------+----------+------+----------+------
 00:00:10 | 00:00:10 | a    | 00:00:10 |    0
(1 row)

ALTER TABLE mpp21090_changedistpolicy_dml_pttab_interval DROP COLUMN col4;
ALTER TABLE
INSERT INTO mpp21090_changedistpolicy_dml_pttab_interval VALUES('10 secs','10 secs','b',1);
INSERT 0 1
SELECT * FROM mpp21090_changedistpolicy_dml_pttab_interval ORDER BY 1,2,3,4;
   col1   |   col2   | col3 | col5 
----------+----------+------+------
 00:00:10 | 00:00:10 | a    |    0
 00:00:10 | 00:00:10 | b    |    1
(2 rows)

ALTER TABLE mpp21090_changedistpolicy_dml_pttab_interval SET DISTRIBUTED BY (col3);
ALTER TABLE
INSERT INTO mpp21090_changedistpolicy_dml_pttab_interval SELECT '11 hours', '11 hours','c', 2;
INSERT 0 1
SELECT * FROM mpp21090_changedistpolicy_dml_pttab_interval ORDER BY 1,2,3;
   col1   |   col2   | col3 | col5 
----------+----------+------+------
 00:00:10 | 00:00:10 | a    |    0
 00:00:10 | 00:00:10 | b    |    1
 11:00:00 | 11:00:00 | c    |    2
(3 rows)

UPDATE mpp21090_changedistpolicy_dml_pttab_interval SET col3 ='c' WHERE col3 ='b';
UPDATE 1
SELECT * FROM mpp21090_changedistpolicy_dml_pttab_interval ORDER BY 1,2,3;
   col1   |   col2   | col3 | col5 
----------+----------+------+------
 00:00:10 | 00:00:10 | a    |    0
 00:00:10 | 00:00:10 | c    |    1
 11:00:00 | 11:00:00 | c    |    2
(3 rows)

DELETE FROM mpp21090_changedistpolicy_dml_pttab_interval WHERE col3 ='c';
DELETE 2
SELECT * FROM mpp21090_changedistpolicy_dml_pttab_interval ORDER BY 1,2,3;
   col1   |   col2   | col3 | col5 
----------+----------+------+------
 00:00:10 | 00:00:10 | a    |    0
(1 row)

