DROP TABLE IF EXISTS mpp21090_pttab_dropcol_addcol_addpt_dml_char;
psql:/data/prabhd/test/tincrepo/main/dml/functional/output/mpp21090_pttab_dropcol_addcol_addpt_dml_char_opt.sql:14: NOTICE:  table "mpp21090_pttab_dropcol_addcol_addpt_dml_char" does not exist, skipping
DROP TABLE
CREATE TABLE mpp21090_pttab_dropcol_addcol_addpt_dml_char
(
    col1 char,
    col2 char,
    col3 char,
    col4 int
) 
DISTRIBUTED by (col1)
PARTITION BY LIST(col2)(partition partone VALUES('a','b','c','d','e','f','g','h') WITH (APPENDONLY=true, COMPRESSLEVEL=5, ORIENTATION=column),partition parttwo VALUES('i','j','k','l','m','n','o','p') WITH (APPENDONLY=true, COMPRESSLEVEL=5, ORIENTATION=row),partition partthree VALUES('q','r','s','t','u','v','w','x'));
psql:/data/prabhd/test/tincrepo/main/dml/functional/output/mpp21090_pttab_dropcol_addcol_addpt_dml_char_opt.sql:23: NOTICE:  CREATE TABLE will create partition "mpp21090_pttab_dropcol_addcol_addpt_dml_char_1_prt_partone" for table "mpp21090_pttab_dropcol_addcol_addpt_dml_char"
psql:/data/prabhd/test/tincrepo/main/dml/functional/output/mpp21090_pttab_dropcol_addcol_addpt_dml_char_opt.sql:23: NOTICE:  CREATE TABLE will create partition "mpp21090_pttab_dropcol_addcol_addpt_dml_char_1_prt_parttwo" for table "mpp21090_pttab_dropcol_addcol_addpt_dml_char"
psql:/data/prabhd/test/tincrepo/main/dml/functional/output/mpp21090_pttab_dropcol_addcol_addpt_dml_char_opt.sql:23: NOTICE:  CREATE TABLE will create partition "mpp21090_pttab_dropcol_addcol_addpt_dml_char_1_prt_partthree" for table "mpp21090_pttab_dropcol_addcol_addpt_dml_char"
CREATE TABLE
INSERT INTO mpp21090_pttab_dropcol_addcol_addpt_dml_char VALUES('x','x','a',0);
INSERT 0 1
ALTER TABLE mpp21090_pttab_dropcol_addcol_addpt_dml_char DROP COLUMN col4;
ALTER TABLE
INSERT INTO mpp21090_pttab_dropcol_addcol_addpt_dml_char VALUES('x','x','b');
INSERT 0 1
ALTER TABLE mpp21090_pttab_dropcol_addcol_addpt_dml_char ADD COLUMN col5 char DEFAULT 'x';
ALTER TABLE
INSERT INTO mpp21090_pttab_dropcol_addcol_addpt_dml_char SELECT 'x','x','c','x';
INSERT 0 1
SELECT * FROM mpp21090_pttab_dropcol_addcol_addpt_dml_char ORDER BY 1,2,3;
 col1 | col2 | col3 | col5 
------+------+------+------
 x    | x    | a    | x
 x    | x    | b    | x
 x    | x    | c    | x
(3 rows)

UPDATE mpp21090_pttab_dropcol_addcol_addpt_dml_char SET col5 = '-' WHERE col2 = 'x' AND col1 = 'x';
UPDATE 3
SELECT * FROM mpp21090_pttab_dropcol_addcol_addpt_dml_char ORDER BY 1,2,3;
 col1 | col2 | col3 | col5 
------+------+------+------
 x    | x    | a    | -
 x    | x    | b    | -
 x    | x    | c    | -
(3 rows)

DELETE FROM mpp21090_pttab_dropcol_addcol_addpt_dml_char WHERE col5 = '-';
DELETE 3
SELECT * FROM mpp21090_pttab_dropcol_addcol_addpt_dml_char ORDER BY 1,2,3;
 col1 | col2 | col3 | col5 
------+------+------+------
(0 rows)

ALTER TABLE mpp21090_pttab_dropcol_addcol_addpt_dml_char ADD PARTITION partfour VALUES('y','z','-');
psql:/data/prabhd/test/tincrepo/main/dml/functional/output/mpp21090_pttab_dropcol_addcol_addpt_dml_char_opt.sql:41: NOTICE:  CREATE TABLE will create partition "mpp21090_pttab_dropcol_addcol_addpt_dml_char_1_prt_partfour" for table "mpp21090_pttab_dropcol_addcol_addpt_dml_char"
ALTER TABLE
ALTER TABLE mpp21090_pttab_dropcol_addcol_addpt_dml_char ADD DEFAULT partition def;
psql:/data/prabhd/test/tincrepo/main/dml/functional/output/mpp21090_pttab_dropcol_addcol_addpt_dml_char_opt.sql:42: NOTICE:  CREATE TABLE will create partition "mpp21090_pttab_dropcol_addcol_addpt_dml_char_1_prt_def" for table "mpp21090_pttab_dropcol_addcol_addpt_dml_char"
ALTER TABLE
INSERT INTO mpp21090_pttab_dropcol_addcol_addpt_dml_char SELECT 'z','z','d','z';
INSERT 0 1
SELECT * FROM mpp21090_pttab_dropcol_addcol_addpt_dml_char ORDER BY 1,2,3;
 col1 | col2 | col3 | col5 
------+------+------+------
 z    | z    | d    | z
(1 row)

UPDATE mpp21090_pttab_dropcol_addcol_addpt_dml_char SET col5 = '-' WHERE col2 = 'z' AND col3 ='d';
UPDATE 1
SELECT * FROM mpp21090_pttab_dropcol_addcol_addpt_dml_char ORDER BY 1,2,3;
 col1 | col2 | col3 | col5 
------+------+------+------
 z    | z    | d    | -
(1 row)

-- Update partition key
UPDATE mpp21090_pttab_dropcol_addcol_addpt_dml_char SET col2 = '-' WHERE col2 = 'z' AND col3 ='d';
UPDATE 1
SELECT * FROM mpp21090_pttab_dropcol_addcol_addpt_dml_char ORDER BY 1,2,3;
 col1 | col2 | col3 | col5 
------+------+------+------
 z    | -    | d    | -
(1 row)

DELETE FROM mpp21090_pttab_dropcol_addcol_addpt_dml_char WHERE col5 = '-';
DELETE 1
SELECT * FROM mpp21090_pttab_dropcol_addcol_addpt_dml_char ORDER BY 1,2,3;
 col1 | col2 | col3 | col5 
------+------+------+------
(0 rows)

