DROP TABLE IF EXISTS mpp21090_dropcol_splitdfpt_dml_float;
psql:/data/prabhd/test/tincrepo/main/dml/functional/output/mpp21090_dropcol_splitdfpt_dml_float_opt.sql:14: NOTICE:  table "mpp21090_dropcol_splitdfpt_dml_float" does not exist, skipping
DROP TABLE
CREATE TABLE mpp21090_dropcol_splitdfpt_dml_float
(
    col1 float,
    col2 float,
    col3 char,
    col4 float,
    col5 int
) 
DISTRIBUTED by (col1)
PARTITION BY LIST(col2)
(
default partition def
);
psql:/data/prabhd/test/tincrepo/main/dml/functional/output/mpp21090_dropcol_splitdfpt_dml_float_opt.sql:27: NOTICE:  CREATE TABLE will create partition "mpp21090_dropcol_splitdfpt_dml_float_1_prt_def" for table "mpp21090_dropcol_splitdfpt_dml_float"
CREATE TABLE
INSERT INTO mpp21090_dropcol_splitdfpt_dml_float VALUES(2.00,2.00,'a',2.00,0);
INSERT 0 1
SELECT * FROM mpp21090_dropcol_splitdfpt_dml_float ORDER BY 1,2,3,4;
 col1 | col2 | col3 | col4 | col5 
------+------+------+------+------
    2 |    2 | a    |    2 |    0
(1 row)

ALTER TABLE mpp21090_dropcol_splitdfpt_dml_float DROP COLUMN col4;
ALTER TABLE
ALTER TABLE mpp21090_dropcol_splitdfpt_dml_float SPLIT DEFAULT PARTITION at (5.00) into (partition partsplitone,partition def);
psql:/data/prabhd/test/tincrepo/main/dml/functional/output/mpp21090_dropcol_splitdfpt_dml_float_opt.sql:34: NOTICE:  exchanged partition "def" of relation "mpp21090_dropcol_splitdfpt_dml_float" with relation "pg_temp_65705"
psql:/data/prabhd/test/tincrepo/main/dml/functional/output/mpp21090_dropcol_splitdfpt_dml_float_opt.sql:34: NOTICE:  dropped partition "def" for relation "mpp21090_dropcol_splitdfpt_dml_float"
psql:/data/prabhd/test/tincrepo/main/dml/functional/output/mpp21090_dropcol_splitdfpt_dml_float_opt.sql:34: NOTICE:  CREATE TABLE will create partition "mpp21090_dropcol_splitdfpt_dml_float_1_prt_partsplitone" for table "mpp21090_dropcol_splitdfpt_dml_float"
psql:/data/prabhd/test/tincrepo/main/dml/functional/output/mpp21090_dropcol_splitdfpt_dml_float_opt.sql:34: NOTICE:  CREATE TABLE will create partition "mpp21090_dropcol_splitdfpt_dml_float_1_prt_def" for table "mpp21090_dropcol_splitdfpt_dml_float"
ALTER TABLE
INSERT INTO mpp21090_dropcol_splitdfpt_dml_float SELECT 1.00, 1.00,'b', 1;
INSERT 0 1
SELECT * FROM mpp21090_dropcol_splitdfpt_dml_float ORDER BY 1,2,3;
 col1 | col2 | col3 | col5 
------+------+------+------
    1 |    1 | b    |    1
    2 |    2 | a    |    0
(2 rows)

-- Update distribution key
UPDATE mpp21090_dropcol_splitdfpt_dml_float SET col1 = 35.00 WHERE col2 = 1.00 AND col1 = 1.00;
UPDATE 1
SELECT * FROM mpp21090_dropcol_splitdfpt_dml_float ORDER BY 1,2,3;
 col1 | col2 | col3 | col5 
------+------+------+------
    2 |    2 | a    |    0
   35 |    1 | b    |    1
(2 rows)

-- Update partition key
UPDATE mpp21090_dropcol_splitdfpt_dml_float SET col2 = 35.00 WHERE col2 = 1.00 AND col1 = 35.00;
UPDATE 1
SELECT * FROM mpp21090_dropcol_splitdfpt_dml_float ORDER BY 1,2,3;
 col1 | col2 | col3 | col5 
------+------+------+------
    2 |    2 | a    |    0
   35 |   35 | b    |    1
(2 rows)

DELETE FROM mpp21090_dropcol_splitdfpt_dml_float WHERE col3='b';
DELETE 1
SELECT * FROM mpp21090_dropcol_splitdfpt_dml_float ORDER BY 1,2,3;
 col1 | col2 | col3 | col5 
------+------+------+------
    2 |    2 | a    |    0
(1 row)

