DROP TABLE IF EXISTS mpp21090_dropcol_addcol_splitpt_dml_int;
psql:/data/prabhd/test/tincrepo/main/dml/functional/output/mpp21090_dropcol_addcol_splitpt_dml_int_opt.sql:14: NOTICE:  table "mpp21090_dropcol_addcol_splitpt_dml_int" does not exist, skipping
DROP TABLE
CREATE TABLE mpp21090_dropcol_addcol_splitpt_dml_int
(
    col1 int,
    col2 int,
    col3 char,
    col4 int
) 
DISTRIBUTED by (col1)
PARTITION BY RANGE(col2)(partition partone start(1) end(10001) WITH (APPENDONLY=true, COMPRESSLEVEL=5, ORIENTATION=column),partition parttwo start(10001) end(20001) WITH (APPENDONLY=true, COMPRESSLEVEL=5, ORIENTATION=row),partition partthree start(20001) end(30001));
psql:/data/prabhd/test/tincrepo/main/dml/functional/output/mpp21090_dropcol_addcol_splitpt_dml_int_opt.sql:23: NOTICE:  CREATE TABLE will create partition "mpp21090_dropcol_addcol_splitpt_dml_int_1_prt_partone" for table "mpp21090_dropcol_addcol_splitpt_dml_int"
psql:/data/prabhd/test/tincrepo/main/dml/functional/output/mpp21090_dropcol_addcol_splitpt_dml_int_opt.sql:23: NOTICE:  CREATE TABLE will create partition "mpp21090_dropcol_addcol_splitpt_dml_int_1_prt_parttwo" for table "mpp21090_dropcol_addcol_splitpt_dml_int"
psql:/data/prabhd/test/tincrepo/main/dml/functional/output/mpp21090_dropcol_addcol_splitpt_dml_int_opt.sql:23: NOTICE:  CREATE TABLE will create partition "mpp21090_dropcol_addcol_splitpt_dml_int_1_prt_partthree" for table "mpp21090_dropcol_addcol_splitpt_dml_int"
CREATE TABLE
INSERT INTO mpp21090_dropcol_addcol_splitpt_dml_int VALUES(20000,20000,'a',20000);
INSERT 0 1
SELECT * FROM mpp21090_dropcol_addcol_splitpt_dml_int ORDER BY 1,2,3,4;
 col1  | col2  | col3 | col4  
-------+-------+------+-------
 20000 | 20000 | a    | 20000
(1 row)

ALTER TABLE mpp21090_dropcol_addcol_splitpt_dml_int ADD COLUMN col5 int DEFAULT 10;
ALTER TABLE
INSERT INTO mpp21090_dropcol_addcol_splitpt_dml_int VALUES(20000,20000,'b',20000,0);
INSERT 0 1
SELECT * FROM mpp21090_dropcol_addcol_splitpt_dml_int ORDER BY 1,2,3,4;
 col1  | col2  | col3 | col4  | col5 
-------+-------+------+-------+------
 20000 | 20000 | a    | 20000 |   10
 20000 | 20000 | b    | 20000 |    0
(2 rows)

ALTER TABLE mpp21090_dropcol_addcol_splitpt_dml_int DROP COLUMN col4;
ALTER TABLE
INSERT INTO mpp21090_dropcol_addcol_splitpt_dml_int VALUES(20000,20000,'c',1);
INSERT 0 1
SELECT * FROM mpp21090_dropcol_addcol_splitpt_dml_int ORDER BY 1,2,3,4;
 col1  | col2  | col3 | col5 
-------+-------+------+------
 20000 | 20000 | a    |   10
 20000 | 20000 | b    |    0
 20000 | 20000 | c    |    1
(3 rows)

ALTER TABLE mpp21090_dropcol_addcol_splitpt_dml_int SPLIT PARTITION partone at (5000) into (partition partsplitone,partition partsplitwo);
psql:/data/prabhd/test/tincrepo/main/dml/functional/output/mpp21090_dropcol_addcol_splitpt_dml_int_opt.sql:38: NOTICE:  exchanged partition "partone" of relation "mpp21090_dropcol_addcol_splitpt_dml_int" with relation "pg_temp_54766"
psql:/data/prabhd/test/tincrepo/main/dml/functional/output/mpp21090_dropcol_addcol_splitpt_dml_int_opt.sql:38: NOTICE:  dropped partition "partone" for relation "mpp21090_dropcol_addcol_splitpt_dml_int"
psql:/data/prabhd/test/tincrepo/main/dml/functional/output/mpp21090_dropcol_addcol_splitpt_dml_int_opt.sql:38: NOTICE:  CREATE TABLE will create partition "mpp21090_dropcol_addcol_splitpt_dml_int_1_prt_partsplitone" for table "mpp21090_dropcol_addcol_splitpt_dml_int"
psql:/data/prabhd/test/tincrepo/main/dml/functional/output/mpp21090_dropcol_addcol_splitpt_dml_int_opt.sql:38: NOTICE:  CREATE TABLE will create partition "mpp21090_dropcol_addcol_splitpt_dml_int_1_prt_partsplitwo" for table "mpp21090_dropcol_addcol_splitpt_dml_int"
ALTER TABLE
INSERT INTO mpp21090_dropcol_addcol_splitpt_dml_int SELECT 1000, 1000,'d', 1;
INSERT 0 1
SELECT * FROM mpp21090_dropcol_addcol_splitpt_dml_int ORDER BY 1,2,3;
 col1  | col2  | col3 | col5 
-------+-------+------+------
  1000 |  1000 | d    |    1
 20000 | 20000 | a    |   10
 20000 | 20000 | b    |    0
 20000 | 20000 | c    |    1
(4 rows)

-- Update distribution key
UPDATE mpp21090_dropcol_addcol_splitpt_dml_int SET col1 = 35000 WHERE col2 = 1000 AND col1 = 1000;
UPDATE 1
SELECT * FROM mpp21090_dropcol_addcol_splitpt_dml_int ORDER BY 1,2,3;
 col1  | col2  | col3 | col5 
-------+-------+------+------
 20000 | 20000 | a    |   10
 20000 | 20000 | b    |    0
 20000 | 20000 | c    |    1
 35000 |  1000 | d    |    1
(4 rows)

-- Update partition key
UPDATE mpp21090_dropcol_addcol_splitpt_dml_int SET col2 =20000  WHERE col2 = 1000 AND col1 = 35000;
UPDATE 1
SELECT * FROM mpp21090_dropcol_addcol_splitpt_dml_int ORDER BY 1,2,3;
 col1  | col2  | col3 | col5 
-------+-------+------+------
 20000 | 20000 | a    |   10
 20000 | 20000 | b    |    0
 20000 | 20000 | c    |    1
 35000 | 20000 | d    |    1
(4 rows)

DELETE FROM mpp21090_dropcol_addcol_splitpt_dml_int WHERE col3='b';
DELETE 1
SELECT * FROM mpp21090_dropcol_addcol_splitpt_dml_int ORDER BY 1,2,3;
 col1  | col2  | col3 | col5 
-------+-------+------+------
 20000 | 20000 | a    |   10
 20000 | 20000 | c    |    1
 35000 | 20000 | d    |    1
(3 rows)

