DROP TABLE IF EXISTS mpp21090_drop_firstcol_dml_timestamptz;
DROP TABLE
CREATE TABLE mpp21090_drop_firstcol_dml_timestamptz(
col1 timestamptz,
col2 decimal,
col3 char,
col4 date,
col5 int
)  with (appendonly= true, orientation= column)  DISTRIBUTED by(col3);
CREATE TABLE
INSERT INTO mpp21090_drop_firstcol_dml_timestamptz VALUES('2013-12-31 12:00:00 PST',0.00,'a','2014-01-01',0);
INSERT 0 1
SELECT * FROM mpp21090_drop_firstcol_dml_timestamptz ORDER BY 1,2,3,4;
          col1          | col2 | col3 |    col4    | col5 
------------------------+------+------+------------+------
 2013-12-31 12:00:00-08 | 0.00 | a    | 2014-01-01 |    0
(1 row)

ALTER TABLE mpp21090_drop_firstcol_dml_timestamptz DROP COLUMN col1;
ALTER TABLE
INSERT INTO mpp21090_drop_firstcol_dml_timestamptz SELECT 1.00,'b','2014-01-02',1;
INSERT 0 1
SELECT * FROM mpp21090_drop_firstcol_dml_timestamptz ORDER BY 1,2,3,4;
 col2 | col3 |    col4    | col5 
------+------+------------+------
 0.00 | a    | 2014-01-01 |    0
 1.00 | b    | 2014-01-02 |    1
(2 rows)

UPDATE mpp21090_drop_firstcol_dml_timestamptz SET col3='c' WHERE col3 = 'b' AND col5 = 1;
UPDATE 1
SELECT * FROM mpp21090_drop_firstcol_dml_timestamptz ORDER BY 1,2,3,4;
 col2 | col3 |    col4    | col5 
------+------+------------+------
 0.00 | a    | 2014-01-01 |    0
 1.00 | c    | 2014-01-02 |    1
(2 rows)

DELETE FROM mpp21090_drop_firstcol_dml_timestamptz WHERE col3='c';
DELETE 1
SELECT * FROM mpp21090_drop_firstcol_dml_timestamptz ORDER BY 1,2,3,4;
 col2 | col3 |    col4    | col5 
------+------+------------+------
 0.00 | a    | 2014-01-01 |    0
(1 row)

