DROP TABLE IF EXISTS mpp21090_pttab_dropcol_addcol_addpt_idx_dml_float;
psql:/data/prabhd/test/tincrepo/main/dml/functional/output/mpp21090_pttab_dropcol_addcol_addpt_idx_dml_float_opt.sql:14: NOTICE:  table "mpp21090_pttab_dropcol_addcol_addpt_idx_dml_float" does not exist, skipping
DROP TABLE
CREATE TABLE mpp21090_pttab_dropcol_addcol_addpt_idx_dml_float
(
    col1 float,
    col2 float,
    col3 char,
    col4 int
) 
DISTRIBUTED by (col1)
PARTITION BY RANGE(col2)(partition partone start(1.00) end(10.00)  WITH (APPENDONLY=true, COMPRESSLEVEL=5, ORIENTATION=column),partition parttwo start(10.00) end(20.00) WITH (APPENDONLY=true, COMPRESSLEVEL=5, ORIENTATION=row),partition partthree start(20.00) end(30.00));
psql:/data/prabhd/test/tincrepo/main/dml/functional/output/mpp21090_pttab_dropcol_addcol_addpt_idx_dml_float_opt.sql:23: NOTICE:  CREATE TABLE will create partition "mpp21090_pttab_dropcol_addcol_addpt_idx_dml_float_1_prt_partone" for table "mpp21090_pttab_dropcol_addcol_addpt_idx_dml_float"
psql:/data/prabhd/test/tincrepo/main/dml/functional/output/mpp21090_pttab_dropcol_addcol_addpt_idx_dml_float_opt.sql:23: NOTICE:  CREATE TABLE will create partition "mpp21090_pttab_dropcol_addcol_addpt_idx_dml_float_1_prt_parttwo" for table "mpp21090_pttab_dropcol_addcol_addpt_idx_dml_float"
psql:/data/prabhd/test/tincrepo/main/dml/functional/output/mpp21090_pttab_dropcol_addcol_addpt_idx_dml_float_opt.sql:23: NOTICE:  CREATE TABLE will create partition "mpp21090_pttab_dropcol_addcol_addpt_idx_dml_flo_1_prt_partthree" for table "mpp21090_pttab_dropcol_addcol_addpt_idx_dml_float"
CREATE TABLE
INSERT INTO mpp21090_pttab_dropcol_addcol_addpt_idx_dml_float VALUES(2.00,2.00,'a',0);
INSERT 0 1
ALTER TABLE mpp21090_pttab_dropcol_addcol_addpt_idx_dml_float DROP COLUMN col4;
ALTER TABLE
INSERT INTO mpp21090_pttab_dropcol_addcol_addpt_idx_dml_float VALUES(2.00,2.00,'b');
INSERT 0 1
ALTER TABLE mpp21090_pttab_dropcol_addcol_addpt_idx_dml_float ADD COLUMN col5 float DEFAULT 2.00;
ALTER TABLE
DROP INDEX IF EXISTS mpp21090_pttab_dropcol_addcol_addpt_idx_dml_idx_float;
psql:/data/prabhd/test/tincrepo/main/dml/functional/output/mpp21090_pttab_dropcol_addcol_addpt_idx_dml_float_opt.sql:32: NOTICE:  index "mpp21090_pttab_dropcol_addcol_addpt_idx_dml_idx_float" does not exist, skipping
DROP INDEX
CREATE INDEX mpp21090_pttab_dropcol_addcol_addpt_idx_dml_idx_float on mpp21090_pttab_dropcol_addcol_addpt_idx_dml_float(col5);
psql:/data/prabhd/test/tincrepo/main/dml/functional/output/mpp21090_pttab_dropcol_addcol_addpt_idx_dml_float_opt.sql:33: NOTICE:  building index for child partition "mpp21090_pttab_dropcol_addcol_addpt_idx_dml_float_1_prt_partone"
psql:/data/prabhd/test/tincrepo/main/dml/functional/output/mpp21090_pttab_dropcol_addcol_addpt_idx_dml_float_opt.sql:33: NOTICE:  building index for child partition "mpp21090_pttab_dropcol_addcol_addpt_idx_dml_float_1_prt_parttwo"
psql:/data/prabhd/test/tincrepo/main/dml/functional/output/mpp21090_pttab_dropcol_addcol_addpt_idx_dml_float_opt.sql:33: NOTICE:  building index for child partition "mpp21090_pttab_dropcol_addcol_addpt_idx_dml_flo_1_prt_partthree"
CREATE INDEX
INSERT INTO mpp21090_pttab_dropcol_addcol_addpt_idx_dml_float SELECT 2.00,2.00,'c',2.00;
INSERT 0 1
SELECT * FROM mpp21090_pttab_dropcol_addcol_addpt_idx_dml_float ORDER BY 1,2,3;
 col1 | col2 | col3 | col5 
------+------+------+------
    2 |    2 | a    |    2
    2 |    2 | b    |    2
    2 |    2 | c    |    2
(3 rows)

UPDATE mpp21090_pttab_dropcol_addcol_addpt_idx_dml_float SET col5 = 1.00 WHERE col2 = 2.00 AND col1 = 2.00;
UPDATE 3
SELECT * FROM mpp21090_pttab_dropcol_addcol_addpt_idx_dml_float ORDER BY 1,2,3;
 col1 | col2 | col3 | col5 
------+------+------+------
    2 |    2 | a    |    1
    2 |    2 | b    |    1
    2 |    2 | c    |    1
(3 rows)

DELETE FROM mpp21090_pttab_dropcol_addcol_addpt_idx_dml_float WHERE col5 = 1.00;
DELETE 3
SELECT * FROM mpp21090_pttab_dropcol_addcol_addpt_idx_dml_float ORDER BY 1,2,3;
 col1 | col2 | col3 | col5 
------+------+------+------
(0 rows)

ALTER TABLE mpp21090_pttab_dropcol_addcol_addpt_idx_dml_float ADD PARTITION partfour start(30.00) end(40.00);
psql:/data/prabhd/test/tincrepo/main/dml/functional/output/mpp21090_pttab_dropcol_addcol_addpt_idx_dml_float_opt.sql:44: NOTICE:  CREATE TABLE will create partition "mpp21090_pttab_dropcol_addcol_addpt_idx_dml_floa_1_prt_partfour" for table "mpp21090_pttab_dropcol_addcol_addpt_idx_dml_float"
ALTER TABLE
ALTER TABLE mpp21090_pttab_dropcol_addcol_addpt_idx_dml_float ADD DEFAULT partition def;
psql:/data/prabhd/test/tincrepo/main/dml/functional/output/mpp21090_pttab_dropcol_addcol_addpt_idx_dml_float_opt.sql:45: NOTICE:  CREATE TABLE will create partition "mpp21090_pttab_dropcol_addcol_addpt_idx_dml_float_1_prt_def" for table "mpp21090_pttab_dropcol_addcol_addpt_idx_dml_float"
ALTER TABLE
INSERT INTO mpp21090_pttab_dropcol_addcol_addpt_idx_dml_float SELECT 35.00,35.00,'d',35.00;
INSERT 0 1
SELECT * FROM mpp21090_pttab_dropcol_addcol_addpt_idx_dml_float ORDER BY 1,2,3;
 col1 | col2 | col3 | col5 
------+------+------+------
   35 |   35 | d    |   35
(1 row)

UPDATE mpp21090_pttab_dropcol_addcol_addpt_idx_dml_float SET col5 = 1.00 WHERE col2 = 35.00 AND col3 ='d';
UPDATE 1
SELECT * FROM mpp21090_pttab_dropcol_addcol_addpt_idx_dml_float ORDER BY 1,2,3;
 col1 | col2 | col3 | col5 
------+------+------+------
   35 |   35 | d    |    1
(1 row)

-- Update partition key
UPDATE mpp21090_pttab_dropcol_addcol_addpt_idx_dml_float SET col2 = 1.00 WHERE col2 = 35.00 AND col3 ='d';
UPDATE 1
SELECT * FROM mpp21090_pttab_dropcol_addcol_addpt_idx_dml_float ORDER BY 1,2,3;
 col1 | col2 | col3 | col5 
------+------+------+------
   35 |    1 | d    |    1
(1 row)

DELETE FROM mpp21090_pttab_dropcol_addcol_addpt_idx_dml_float WHERE col5 = 1.00;
DELETE 1
SELECT * FROM mpp21090_pttab_dropcol_addcol_addpt_idx_dml_float ORDER BY 1,2,3;
 col1 | col2 | col3 | col5 
------+------+------+------
(0 rows)

