DROP TABLE IF EXISTS mpp21090_pttab_dropcol_addcol_addpt_dml_int8;
psql:/data/prabhd/test/tincrepo/main/dml/functional/output/mpp21090_pttab_dropcol_addcol_addpt_dml_int8_opt.sql:14: NOTICE:  table "mpp21090_pttab_dropcol_addcol_addpt_dml_int8" does not exist, skipping
DROP TABLE
CREATE TABLE mpp21090_pttab_dropcol_addcol_addpt_dml_int8
(
    col1 int8,
    col2 int8,
    col3 char,
    col4 int
) 
DISTRIBUTED by (col1)
PARTITION BY RANGE(col2)(partition partone start(1) end(1000000000000000001)  WITH (APPENDONLY=true, COMPRESSLEVEL=5, ORIENTATION=column),partition parttwo start(1000000000000000001) end(2000000000000000001) WITH (APPENDONLY=true, COMPRESSLEVEL=5, ORIENTATION=row),partition partthree start(2000000000000000001) end(3000000000000000001));
psql:/data/prabhd/test/tincrepo/main/dml/functional/output/mpp21090_pttab_dropcol_addcol_addpt_dml_int8_opt.sql:23: NOTICE:  CREATE TABLE will create partition "mpp21090_pttab_dropcol_addcol_addpt_dml_int8_1_prt_partone" for table "mpp21090_pttab_dropcol_addcol_addpt_dml_int8"
psql:/data/prabhd/test/tincrepo/main/dml/functional/output/mpp21090_pttab_dropcol_addcol_addpt_dml_int8_opt.sql:23: NOTICE:  CREATE TABLE will create partition "mpp21090_pttab_dropcol_addcol_addpt_dml_int8_1_prt_parttwo" for table "mpp21090_pttab_dropcol_addcol_addpt_dml_int8"
psql:/data/prabhd/test/tincrepo/main/dml/functional/output/mpp21090_pttab_dropcol_addcol_addpt_dml_int8_opt.sql:23: NOTICE:  CREATE TABLE will create partition "mpp21090_pttab_dropcol_addcol_addpt_dml_int8_1_prt_partthree" for table "mpp21090_pttab_dropcol_addcol_addpt_dml_int8"
CREATE TABLE
INSERT INTO mpp21090_pttab_dropcol_addcol_addpt_dml_int8 VALUES(2000000000000000000,2000000000000000000,'a',0);
INSERT 0 1
ALTER TABLE mpp21090_pttab_dropcol_addcol_addpt_dml_int8 DROP COLUMN col4;
ALTER TABLE
INSERT INTO mpp21090_pttab_dropcol_addcol_addpt_dml_int8 VALUES(2000000000000000000,2000000000000000000,'b');
INSERT 0 1
ALTER TABLE mpp21090_pttab_dropcol_addcol_addpt_dml_int8 ADD COLUMN col5 int8 DEFAULT 2000000000000000000;
ALTER TABLE
INSERT INTO mpp21090_pttab_dropcol_addcol_addpt_dml_int8 SELECT 2000000000000000000,2000000000000000000,'c',2000000000000000000;
INSERT 0 1
SELECT * FROM mpp21090_pttab_dropcol_addcol_addpt_dml_int8 ORDER BY 1,2,3;
        col1         |        col2         | col3 |        col5         
---------------------+---------------------+------+---------------------
 2000000000000000000 | 2000000000000000000 | a    | 2000000000000000000
 2000000000000000000 | 2000000000000000000 | b    | 2000000000000000000
 2000000000000000000 | 2000000000000000000 | c    | 2000000000000000000
(3 rows)

UPDATE mpp21090_pttab_dropcol_addcol_addpt_dml_int8 SET col5 = 1000000000000000000 WHERE col2 = 2000000000000000000 AND col1 = 2000000000000000000;
UPDATE 3
SELECT * FROM mpp21090_pttab_dropcol_addcol_addpt_dml_int8 ORDER BY 1,2,3;
        col1         |        col2         | col3 |        col5         
---------------------+---------------------+------+---------------------
 2000000000000000000 | 2000000000000000000 | a    | 1000000000000000000
 2000000000000000000 | 2000000000000000000 | b    | 1000000000000000000
 2000000000000000000 | 2000000000000000000 | c    | 1000000000000000000
(3 rows)

DELETE FROM mpp21090_pttab_dropcol_addcol_addpt_dml_int8 WHERE col5 = 1000000000000000000;
DELETE 3
SELECT * FROM mpp21090_pttab_dropcol_addcol_addpt_dml_int8 ORDER BY 1,2,3;
 col1 | col2 | col3 | col5 
------+------+------+------
(0 rows)

ALTER TABLE mpp21090_pttab_dropcol_addcol_addpt_dml_int8 ADD PARTITION partfour start(3000000000000000001) end(4000000000000000001);
psql:/data/prabhd/test/tincrepo/main/dml/functional/output/mpp21090_pttab_dropcol_addcol_addpt_dml_int8_opt.sql:41: NOTICE:  CREATE TABLE will create partition "mpp21090_pttab_dropcol_addcol_addpt_dml_int8_1_prt_partfour" for table "mpp21090_pttab_dropcol_addcol_addpt_dml_int8"
ALTER TABLE
ALTER TABLE mpp21090_pttab_dropcol_addcol_addpt_dml_int8 ADD DEFAULT partition def;
psql:/data/prabhd/test/tincrepo/main/dml/functional/output/mpp21090_pttab_dropcol_addcol_addpt_dml_int8_opt.sql:42: NOTICE:  CREATE TABLE will create partition "mpp21090_pttab_dropcol_addcol_addpt_dml_int8_1_prt_def" for table "mpp21090_pttab_dropcol_addcol_addpt_dml_int8"
ALTER TABLE
INSERT INTO mpp21090_pttab_dropcol_addcol_addpt_dml_int8 SELECT 3500000000000000000,3500000000000000000,'d',3500000000000000000;
INSERT 0 1
SELECT * FROM mpp21090_pttab_dropcol_addcol_addpt_dml_int8 ORDER BY 1,2,3;
        col1         |        col2         | col3 |        col5         
---------------------+---------------------+------+---------------------
 3500000000000000000 | 3500000000000000000 | d    | 3500000000000000000
(1 row)

UPDATE mpp21090_pttab_dropcol_addcol_addpt_dml_int8 SET col5 = 1000000000000000000 WHERE col2 = 3500000000000000000 AND col3 ='d';
UPDATE 1
SELECT * FROM mpp21090_pttab_dropcol_addcol_addpt_dml_int8 ORDER BY 1,2,3;
        col1         |        col2         | col3 |        col5         
---------------------+---------------------+------+---------------------
 3500000000000000000 | 3500000000000000000 | d    | 1000000000000000000
(1 row)

-- Update partition key
UPDATE mpp21090_pttab_dropcol_addcol_addpt_dml_int8 SET col2 = 1000000000000000000 WHERE col2 = 3500000000000000000 AND col3 ='d';
UPDATE 1
SELECT * FROM mpp21090_pttab_dropcol_addcol_addpt_dml_int8 ORDER BY 1,2,3;
        col1         |        col2         | col3 |        col5         
---------------------+---------------------+------+---------------------
 3500000000000000000 | 1000000000000000000 | d    | 1000000000000000000
(1 row)

DELETE FROM mpp21090_pttab_dropcol_addcol_addpt_dml_int8 WHERE col5 = 1000000000000000000;
DELETE 1
SELECT * FROM mpp21090_pttab_dropcol_addcol_addpt_dml_int8 ORDER BY 1,2,3;
 col1 | col2 | col3 | col5 
------+------+------+------
(0 rows)

