DROP TABLE IF EXISTS mpp21090_pttab_dropfirstcol_addpt_date;
psql:/data/prabhd/test/tincrepo/main/dml/functional/output/mpp21090_pttab_dropfirstcol_addpt_date_opt.sql:14: NOTICE:  table "mpp21090_pttab_dropfirstcol_addpt_date" does not exist, skipping
DROP TABLE
CREATE TABLE mpp21090_pttab_dropfirstcol_addpt_date
(
    col1 date,
    col2 date,
    col3 char,
    col4 date,
    col5 int
) 
DISTRIBUTED by (col1)
PARTITION BY RANGE(col2)(partition partone start('2013-12-01') end('2013-12-31') WITH(APPENDONLY=true, COMPRESSLEVEL=5, ORIENTATION=column),partition parttwo start('2013-12-31') end('2014-01-01') WITH (APPENDONLY=true, COMPRESSLEVEL=5, ORIENTATION=row),partition partthree start('2014-01-01') end('2014-02-01'));
psql:/data/prabhd/test/tincrepo/main/dml/functional/output/mpp21090_pttab_dropfirstcol_addpt_date_opt.sql:24: NOTICE:  CREATE TABLE will create partition "mpp21090_pttab_dropfirstcol_addpt_date_1_prt_partone" for table "mpp21090_pttab_dropfirstcol_addpt_date"
psql:/data/prabhd/test/tincrepo/main/dml/functional/output/mpp21090_pttab_dropfirstcol_addpt_date_opt.sql:24: NOTICE:  CREATE TABLE will create partition "mpp21090_pttab_dropfirstcol_addpt_date_1_prt_parttwo" for table "mpp21090_pttab_dropfirstcol_addpt_date"
psql:/data/prabhd/test/tincrepo/main/dml/functional/output/mpp21090_pttab_dropfirstcol_addpt_date_opt.sql:24: NOTICE:  CREATE TABLE will create partition "mpp21090_pttab_dropfirstcol_addpt_date_1_prt_partthree" for table "mpp21090_pttab_dropfirstcol_addpt_date"
CREATE TABLE
INSERT INTO mpp21090_pttab_dropfirstcol_addpt_date VALUES('2013-12-31','2013-12-31','a','2013-12-31',0);
INSERT 0 1
ALTER TABLE mpp21090_pttab_dropfirstcol_addpt_date DROP COLUMN col1;
psql:/data/prabhd/test/tincrepo/main/dml/functional/output/mpp21090_pttab_dropfirstcol_addpt_date_opt.sql:28: NOTICE:  Dropping a column that is part of the distribution policy forces a NULL distribution policy
psql:/data/prabhd/test/tincrepo/main/dml/functional/output/mpp21090_pttab_dropfirstcol_addpt_date_opt.sql:28: NOTICE:  Dropping a column that is part of the distribution policy forces a NULL distribution policy
psql:/data/prabhd/test/tincrepo/main/dml/functional/output/mpp21090_pttab_dropfirstcol_addpt_date_opt.sql:28: NOTICE:  Dropping a column that is part of the distribution policy forces a NULL distribution policy
psql:/data/prabhd/test/tincrepo/main/dml/functional/output/mpp21090_pttab_dropfirstcol_addpt_date_opt.sql:28: NOTICE:  Dropping a column that is part of the distribution policy forces a NULL distribution policy
ALTER TABLE
ALTER TABLE mpp21090_pttab_dropfirstcol_addpt_date ADD PARTITION partfour start('2014-02-01') end('2014-03-01') inclusive;
psql:/data/prabhd/test/tincrepo/main/dml/functional/output/mpp21090_pttab_dropfirstcol_addpt_date_opt.sql:29: NOTICE:  CREATE TABLE will create partition "mpp21090_pttab_dropfirstcol_addpt_date_1_prt_partfour" for table "mpp21090_pttab_dropfirstcol_addpt_date"
ALTER TABLE
INSERT INTO mpp21090_pttab_dropfirstcol_addpt_date SELECT '2014-02-10','b','2014-02-10', 1;
INSERT 0 1
SELECT * FROM mpp21090_pttab_dropfirstcol_addpt_date ORDER BY 1,2,3;
    col2    | col3 |    col4    | col5 
------------+------+------------+------
 2013-12-31 | a    | 2013-12-31 |    0
 2014-02-10 | b    | 2014-02-10 |    1
(2 rows)

UPDATE mpp21090_pttab_dropfirstcol_addpt_date SET col4 = '2014-01-01' WHERE col2 = '2014-02-10' AND col4 = '2014-02-10';
UPDATE 1
SELECT * FROM mpp21090_pttab_dropfirstcol_addpt_date ORDER BY 1,2,3;
    col2    | col3 |    col4    | col5 
------------+------+------------+------
 2013-12-31 | a    | 2013-12-31 |    0
 2014-02-10 | b    | 2014-01-01 |    1
(2 rows)

-- Update partition key
UPDATE mpp21090_pttab_dropfirstcol_addpt_date SET col2 = '2014-01-01' WHERE col2 = '2014-02-10' AND col4 = '2014-01-01';
UPDATE 1
SELECT * FROM mpp21090_pttab_dropfirstcol_addpt_date ORDER BY 1,2,3;
    col2    | col3 |    col4    | col5 
------------+------+------------+------
 2013-12-31 | a    | 2013-12-31 |    0
 2014-01-01 | b    | 2014-01-01 |    1
(2 rows)

DELETE FROM mpp21090_pttab_dropfirstcol_addpt_date WHERE col2 = '2014-01-01';
DELETE 1
SELECT * FROM mpp21090_pttab_dropfirstcol_addpt_date ORDER BY 1,2,3;
    col2    | col3 |    col4    | col5 
------------+------+------------+------
 2013-12-31 | a    | 2013-12-31 |    0
(1 row)

