DROP TABLE IF EXISTS mpp21090_pttab_addcol_addpt_dropcol_decimal;
psql:/data/prabhd/test/tincrepo/main/dml/functional/output/mpp21090_pttab_addcol_addpt_dropcol_decimal_opt.sql:14: NOTICE:  table "mpp21090_pttab_addcol_addpt_dropcol_decimal" does not exist, skipping
DROP TABLE
CREATE TABLE mpp21090_pttab_addcol_addpt_dropcol_decimal
(
    col1 decimal,
    col2 decimal,
    col3 char,
    col4 int
) 
DISTRIBUTED by (col1)
PARTITION BY RANGE(col2)(partition partone start(1.00) end(10.00)  WITH (APPENDONLY=true, COMPRESSLEVEL=5, ORIENTATION=column),partition parttwo start(10.00) end(20.00) WITH (APPENDONLY=true, COMPRESSLEVEL=5, ORIENTATION=row),partition partthree start(20.00) end(30.00));
psql:/data/prabhd/test/tincrepo/main/dml/functional/output/mpp21090_pttab_addcol_addpt_dropcol_decimal_opt.sql:23: NOTICE:  CREATE TABLE will create partition "mpp21090_pttab_addcol_addpt_dropcol_decimal_1_prt_partone" for table "mpp21090_pttab_addcol_addpt_dropcol_decimal"
psql:/data/prabhd/test/tincrepo/main/dml/functional/output/mpp21090_pttab_addcol_addpt_dropcol_decimal_opt.sql:23: NOTICE:  CREATE TABLE will create partition "mpp21090_pttab_addcol_addpt_dropcol_decimal_1_prt_parttwo" for table "mpp21090_pttab_addcol_addpt_dropcol_decimal"
psql:/data/prabhd/test/tincrepo/main/dml/functional/output/mpp21090_pttab_addcol_addpt_dropcol_decimal_opt.sql:23: NOTICE:  CREATE TABLE will create partition "mpp21090_pttab_addcol_addpt_dropcol_decimal_1_prt_partthree" for table "mpp21090_pttab_addcol_addpt_dropcol_decimal"
CREATE TABLE
INSERT INTO mpp21090_pttab_addcol_addpt_dropcol_decimal VALUES(2.00,2.00,'a',0);
INSERT 0 1
ALTER TABLE mpp21090_pttab_addcol_addpt_dropcol_decimal ADD COLUMN col5 decimal DEFAULT 2.00;
ALTER TABLE
ALTER TABLE mpp21090_pttab_addcol_addpt_dropcol_decimal ADD PARTITION partfour start(30.00) end(40.00) inclusive;
psql:/data/prabhd/test/tincrepo/main/dml/functional/output/mpp21090_pttab_addcol_addpt_dropcol_decimal_opt.sql:28: NOTICE:  CREATE TABLE will create partition "mpp21090_pttab_addcol_addpt_dropcol_decimal_1_prt_partfour" for table "mpp21090_pttab_addcol_addpt_dropcol_decimal"
ALTER TABLE
INSERT INTO mpp21090_pttab_addcol_addpt_dropcol_decimal SELECT 35.00,35.00,'b',1, 35.00;
INSERT 0 1
SELECT * FROM mpp21090_pttab_addcol_addpt_dropcol_decimal ORDER BY 1,2,3;
 col1  | col2  | col3 | col4 | col5  
-------+-------+------+------+-------
  2.00 |  2.00 | a    |    0 |  2.00
 35.00 | 35.00 | b    |    1 | 35.00
(2 rows)

ALTER TABLE mpp21090_pttab_addcol_addpt_dropcol_decimal DROP COLUMN col1;
psql:/data/prabhd/test/tincrepo/main/dml/functional/output/mpp21090_pttab_addcol_addpt_dropcol_decimal_opt.sql:33: NOTICE:  Dropping a column that is part of the distribution policy forces a NULL distribution policy
psql:/data/prabhd/test/tincrepo/main/dml/functional/output/mpp21090_pttab_addcol_addpt_dropcol_decimal_opt.sql:33: NOTICE:  Dropping a column that is part of the distribution policy forces a NULL distribution policy
psql:/data/prabhd/test/tincrepo/main/dml/functional/output/mpp21090_pttab_addcol_addpt_dropcol_decimal_opt.sql:33: NOTICE:  Dropping a column that is part of the distribution policy forces a NULL distribution policy
psql:/data/prabhd/test/tincrepo/main/dml/functional/output/mpp21090_pttab_addcol_addpt_dropcol_decimal_opt.sql:33: NOTICE:  Dropping a column that is part of the distribution policy forces a NULL distribution policy
psql:/data/prabhd/test/tincrepo/main/dml/functional/output/mpp21090_pttab_addcol_addpt_dropcol_decimal_opt.sql:33: NOTICE:  Dropping a column that is part of the distribution policy forces a NULL distribution policy
ALTER TABLE
INSERT INTO mpp21090_pttab_addcol_addpt_dropcol_decimal SELECT 35.00,'c',1, 35.00;
INSERT 0 1
SELECT * FROM mpp21090_pttab_addcol_addpt_dropcol_decimal ORDER BY 1,2,3;
 col2  | col3 | col4 | col5  
-------+------+------+-------
  2.00 | a    |    0 |  2.00
 35.00 | b    |    1 | 35.00
 35.00 | c    |    1 | 35.00
(3 rows)

UPDATE mpp21090_pttab_addcol_addpt_dropcol_decimal SET col5 = 1.00 WHERE col2 = 35.00 and col3='c';
UPDATE 1
SELECT * FROM mpp21090_pttab_addcol_addpt_dropcol_decimal ORDER BY 1,2,3;
 col2  | col3 | col4 | col5  
-------+------+------+-------
  2.00 | a    |    0 |  2.00
 35.00 | b    |    1 | 35.00
 35.00 | c    |    1 |  1.00
(3 rows)

-- Update partition key
UPDATE mpp21090_pttab_addcol_addpt_dropcol_decimal SET col2 = 1.00 WHERE col2 = 35.00 and col3='c';
UPDATE 1
SELECT * FROM mpp21090_pttab_addcol_addpt_dropcol_decimal ORDER BY 1,2,3;
 col2  | col3 | col4 | col5  
-------+------+------+-------
  1.00 | c    |    1 |  1.00
  2.00 | a    |    0 |  2.00
 35.00 | b    |    1 | 35.00
(3 rows)

DELETE FROM mpp21090_pttab_addcol_addpt_dropcol_decimal WHERE col2 = 1.00;
DELETE 1
SELECT * FROM mpp21090_pttab_addcol_addpt_dropcol_decimal ORDER BY 1,2,3;
 col2  | col3 | col4 | col5  
-------+------+------+-------
  2.00 | a    |    0 |  2.00
 35.00 | b    |    1 | 35.00
(2 rows)

