DROP TABLE IF EXISTS mpp21090_dropcol_splitdfpt_dml_numeric;
psql:/data/prabhd/test/tincrepo/main/dml/functional/output/mpp21090_dropcol_splitdfpt_dml_numeric_opt.sql:14: NOTICE:  table "mpp21090_dropcol_splitdfpt_dml_numeric" does not exist, skipping
DROP TABLE
CREATE TABLE mpp21090_dropcol_splitdfpt_dml_numeric
(
    col1 numeric,
    col2 numeric,
    col3 char,
    col4 numeric,
    col5 int
) 
DISTRIBUTED by (col1)
PARTITION BY LIST(col2)
(
default partition def
);
psql:/data/prabhd/test/tincrepo/main/dml/functional/output/mpp21090_dropcol_splitdfpt_dml_numeric_opt.sql:27: NOTICE:  CREATE TABLE will create partition "mpp21090_dropcol_splitdfpt_dml_numeric_1_prt_def" for table "mpp21090_dropcol_splitdfpt_dml_numeric"
CREATE TABLE
INSERT INTO mpp21090_dropcol_splitdfpt_dml_numeric VALUES(2.000000,2.000000,'a',2.000000,0);
INSERT 0 1
SELECT * FROM mpp21090_dropcol_splitdfpt_dml_numeric ORDER BY 1,2,3,4;
   col1   |   col2   | col3 |   col4   | col5 
----------+----------+------+----------+------
 2.000000 | 2.000000 | a    | 2.000000 |    0
(1 row)

ALTER TABLE mpp21090_dropcol_splitdfpt_dml_numeric DROP COLUMN col4;
ALTER TABLE
ALTER TABLE mpp21090_dropcol_splitdfpt_dml_numeric SPLIT DEFAULT PARTITION at (5.000000) into (partition partsplitone,partition def);
psql:/data/prabhd/test/tincrepo/main/dml/functional/output/mpp21090_dropcol_splitdfpt_dml_numeric_opt.sql:34: NOTICE:  exchanged partition "def" of relation "mpp21090_dropcol_splitdfpt_dml_numeric" with relation "pg_temp_67110"
psql:/data/prabhd/test/tincrepo/main/dml/functional/output/mpp21090_dropcol_splitdfpt_dml_numeric_opt.sql:34: NOTICE:  dropped partition "def" for relation "mpp21090_dropcol_splitdfpt_dml_numeric"
psql:/data/prabhd/test/tincrepo/main/dml/functional/output/mpp21090_dropcol_splitdfpt_dml_numeric_opt.sql:34: NOTICE:  CREATE TABLE will create partition "mpp21090_dropcol_splitdfpt_dml_numeric_1_prt_partsplitone" for table "mpp21090_dropcol_splitdfpt_dml_numeric"
psql:/data/prabhd/test/tincrepo/main/dml/functional/output/mpp21090_dropcol_splitdfpt_dml_numeric_opt.sql:34: NOTICE:  CREATE TABLE will create partition "mpp21090_dropcol_splitdfpt_dml_numeric_1_prt_def" for table "mpp21090_dropcol_splitdfpt_dml_numeric"
ALTER TABLE
INSERT INTO mpp21090_dropcol_splitdfpt_dml_numeric SELECT 1.000000, 1.000000,'b', 1;
INSERT 0 1
SELECT * FROM mpp21090_dropcol_splitdfpt_dml_numeric ORDER BY 1,2,3;
   col1   |   col2   | col3 | col5 
----------+----------+------+------
 1.000000 | 1.000000 | b    |    1
 2.000000 | 2.000000 | a    |    0
(2 rows)

-- Update distribution key
UPDATE mpp21090_dropcol_splitdfpt_dml_numeric SET col1 = 35.000000 WHERE col2 = 1.000000 AND col1 = 1.000000;
UPDATE 1
SELECT * FROM mpp21090_dropcol_splitdfpt_dml_numeric ORDER BY 1,2,3;
   col1    |   col2   | col3 | col5 
-----------+----------+------+------
  2.000000 | 2.000000 | a    |    0
 35.000000 | 1.000000 | b    |    1
(2 rows)

-- Update partition key
UPDATE mpp21090_dropcol_splitdfpt_dml_numeric SET col2 = 35.000000 WHERE col2 = 1.000000 AND col1 = 35.000000;
UPDATE 1
SELECT * FROM mpp21090_dropcol_splitdfpt_dml_numeric ORDER BY 1,2,3;
   col1    |   col2    | col3 | col5 
-----------+-----------+------+------
  2.000000 |  2.000000 | a    |    0
 35.000000 | 35.000000 | b    |    1
(2 rows)

DELETE FROM mpp21090_dropcol_splitdfpt_dml_numeric WHERE col3='b';
DELETE 1
SELECT * FROM mpp21090_dropcol_splitdfpt_dml_numeric ORDER BY 1,2,3;
   col1   |   col2   | col3 | col5 
----------+----------+------+------
 2.000000 | 2.000000 | a    |    0
(1 row)

