DROP TABLE IF EXISTS mpp21090_pttab_dropcol_addcol_addpt_idx_dml_timestamp;
psql:/data/prabhd/test/tincrepo/main/dml/functional/output/mpp21090_pttab_dropcol_addcol_addpt_idx_dml_timestamp_opt.sql:14: NOTICE:  table "mpp21090_pttab_dropcol_addcol_addpt_idx_dml_timestamp" does not exist, skipping
DROP TABLE
CREATE TABLE mpp21090_pttab_dropcol_addcol_addpt_idx_dml_timestamp
(
    col1 timestamp,
    col2 timestamp,
    col3 char,
    col4 int
) 
DISTRIBUTED by (col1)
PARTITION BY RANGE(col2)(partition partone start('2013-12-01 12:00:00') end('2013-12-31 12:00:00') WITH(APPENDONLY=true, COMPRESSLEVEL=5, ORIENTATION=column),partition parttwo start('2013-12-31 12:00:00') end('2014-01-01 12:00:00') inclusive WITH (APPENDONLY=true, COMPRESSLEVEL=5, ORIENTATION=row),partition partthree start('2014-01-02 12:00:00') end('2014-02-01 12:00:00'));
psql:/data/prabhd/test/tincrepo/main/dml/functional/output/mpp21090_pttab_dropcol_addcol_addpt_idx_dml_timestamp_opt.sql:23: NOTICE:  CREATE TABLE will create partition "mpp21090_pttab_dropcol_addcol_addpt_idx_dml_times_1_prt_partone" for table "mpp21090_pttab_dropcol_addcol_addpt_idx_dml_timestamp"
psql:/data/prabhd/test/tincrepo/main/dml/functional/output/mpp21090_pttab_dropcol_addcol_addpt_idx_dml_timestamp_opt.sql:23: NOTICE:  CREATE TABLE will create partition "mpp21090_pttab_dropcol_addcol_addpt_idx_dml_times_1_prt_parttwo" for table "mpp21090_pttab_dropcol_addcol_addpt_idx_dml_timestamp"
psql:/data/prabhd/test/tincrepo/main/dml/functional/output/mpp21090_pttab_dropcol_addcol_addpt_idx_dml_timestamp_opt.sql:23: NOTICE:  CREATE TABLE will create partition "mpp21090_pttab_dropcol_addcol_addpt_idx_dml_ti_1_prt_partthree1" for table "mpp21090_pttab_dropcol_addcol_addpt_idx_dml_timestamp"
CREATE TABLE
INSERT INTO mpp21090_pttab_dropcol_addcol_addpt_idx_dml_timestamp VALUES('2013-12-30 12:00:00','2013-12-30 12:00:00','a',0);
INSERT 0 1
ALTER TABLE mpp21090_pttab_dropcol_addcol_addpt_idx_dml_timestamp DROP COLUMN col4;
ALTER TABLE
INSERT INTO mpp21090_pttab_dropcol_addcol_addpt_idx_dml_timestamp VALUES('2013-12-30 12:00:00','2013-12-30 12:00:00','b');
INSERT 0 1
ALTER TABLE mpp21090_pttab_dropcol_addcol_addpt_idx_dml_timestamp ADD COLUMN col5 timestamp DEFAULT '2013-12-30 12:00:00';
ALTER TABLE
DROP INDEX IF EXISTS mpp21090_pttab_dropcol_addcol_addpt_idx_dml_idx_timestamp;
psql:/data/prabhd/test/tincrepo/main/dml/functional/output/mpp21090_pttab_dropcol_addcol_addpt_idx_dml_timestamp_opt.sql:32: NOTICE:  index "mpp21090_pttab_dropcol_addcol_addpt_idx_dml_idx_timestamp" does not exist, skipping
DROP INDEX
CREATE INDEX mpp21090_pttab_dropcol_addcol_addpt_idx_dml_idx_timestamp on mpp21090_pttab_dropcol_addcol_addpt_idx_dml_timestamp(col5);
psql:/data/prabhd/test/tincrepo/main/dml/functional/output/mpp21090_pttab_dropcol_addcol_addpt_idx_dml_timestamp_opt.sql:33: NOTICE:  building index for child partition "mpp21090_pttab_dropcol_addcol_addpt_idx_dml_times_1_prt_partone"
psql:/data/prabhd/test/tincrepo/main/dml/functional/output/mpp21090_pttab_dropcol_addcol_addpt_idx_dml_timestamp_opt.sql:33: NOTICE:  building index for child partition "mpp21090_pttab_dropcol_addcol_addpt_idx_dml_times_1_prt_parttwo"
psql:/data/prabhd/test/tincrepo/main/dml/functional/output/mpp21090_pttab_dropcol_addcol_addpt_idx_dml_timestamp_opt.sql:33: NOTICE:  building index for child partition "mpp21090_pttab_dropcol_addcol_addpt_idx_dml_ti_1_prt_partthree1"
CREATE INDEX
INSERT INTO mpp21090_pttab_dropcol_addcol_addpt_idx_dml_timestamp SELECT '2013-12-30 12:00:00','2013-12-30 12:00:00','c','2013-12-30 12:00:00';
INSERT 0 1
SELECT * FROM mpp21090_pttab_dropcol_addcol_addpt_idx_dml_timestamp ORDER BY 1,2,3;
        col1         |        col2         | col3 |        col5         
---------------------+---------------------+------+---------------------
 2013-12-30 12:00:00 | 2013-12-30 12:00:00 | a    | 2013-12-30 12:00:00
 2013-12-30 12:00:00 | 2013-12-30 12:00:00 | b    | 2013-12-30 12:00:00
 2013-12-30 12:00:00 | 2013-12-30 12:00:00 | c    | 2013-12-30 12:00:00
(3 rows)

UPDATE mpp21090_pttab_dropcol_addcol_addpt_idx_dml_timestamp SET col5 = '2014-01-01 12:00:00' WHERE col2 = '2013-12-30 12:00:00' AND col1 = '2013-12-30 12:00:00';
UPDATE 3
SELECT * FROM mpp21090_pttab_dropcol_addcol_addpt_idx_dml_timestamp ORDER BY 1,2,3;
        col1         |        col2         | col3 |        col5         
---------------------+---------------------+------+---------------------
 2013-12-30 12:00:00 | 2013-12-30 12:00:00 | a    | 2014-01-01 12:00:00
 2013-12-30 12:00:00 | 2013-12-30 12:00:00 | b    | 2014-01-01 12:00:00
 2013-12-30 12:00:00 | 2013-12-30 12:00:00 | c    | 2014-01-01 12:00:00
(3 rows)

DELETE FROM mpp21090_pttab_dropcol_addcol_addpt_idx_dml_timestamp WHERE col5 = '2014-01-01 12:00:00';
DELETE 3
SELECT * FROM mpp21090_pttab_dropcol_addcol_addpt_idx_dml_timestamp ORDER BY 1,2,3;
 col1 | col2 | col3 | col5 
------+------+------+------
(0 rows)

ALTER TABLE mpp21090_pttab_dropcol_addcol_addpt_idx_dml_timestamp ADD PARTITION partfour start('2014-02-01 12:00:00') end('2014-03-01 12:00:00') inclusive;
psql:/data/prabhd/test/tincrepo/main/dml/functional/output/mpp21090_pttab_dropcol_addcol_addpt_idx_dml_timestamp_opt.sql:44: NOTICE:  CREATE TABLE will create partition "mpp21090_pttab_dropcol_addcol_addpt_idx_dml_tim_1_prt_partfour1" for table "mpp21090_pttab_dropcol_addcol_addpt_idx_dml_timestamp"
ALTER TABLE
ALTER TABLE mpp21090_pttab_dropcol_addcol_addpt_idx_dml_timestamp ADD DEFAULT partition def;
psql:/data/prabhd/test/tincrepo/main/dml/functional/output/mpp21090_pttab_dropcol_addcol_addpt_idx_dml_timestamp_opt.sql:45: NOTICE:  CREATE TABLE will create partition "mpp21090_pttab_dropcol_addcol_addpt_idx_dml_timestamp_1_prt_def" for table "mpp21090_pttab_dropcol_addcol_addpt_idx_dml_timestamp"
ALTER TABLE
INSERT INTO mpp21090_pttab_dropcol_addcol_addpt_idx_dml_timestamp SELECT '2014-02-10 12:00:00','2014-02-10 12:00:00','d','2014-02-10 12:00:00';
INSERT 0 1
SELECT * FROM mpp21090_pttab_dropcol_addcol_addpt_idx_dml_timestamp ORDER BY 1,2,3;
        col1         |        col2         | col3 |        col5         
---------------------+---------------------+------+---------------------
 2014-02-10 12:00:00 | 2014-02-10 12:00:00 | d    | 2014-02-10 12:00:00
(1 row)

UPDATE mpp21090_pttab_dropcol_addcol_addpt_idx_dml_timestamp SET col5 = '2014-01-01 12:00:00' WHERE col2 = '2014-02-10 12:00:00' AND col3 ='d';
UPDATE 1
SELECT * FROM mpp21090_pttab_dropcol_addcol_addpt_idx_dml_timestamp ORDER BY 1,2,3;
        col1         |        col2         | col3 |        col5         
---------------------+---------------------+------+---------------------
 2014-02-10 12:00:00 | 2014-02-10 12:00:00 | d    | 2014-01-01 12:00:00
(1 row)

-- Update partition key
UPDATE mpp21090_pttab_dropcol_addcol_addpt_idx_dml_timestamp SET col2 = '2014-01-01 12:00:00' WHERE col2 = '2014-02-10 12:00:00' AND col3 ='d';
UPDATE 1
SELECT * FROM mpp21090_pttab_dropcol_addcol_addpt_idx_dml_timestamp ORDER BY 1,2,3;
        col1         |        col2         | col3 |        col5         
---------------------+---------------------+------+---------------------
 2014-02-10 12:00:00 | 2014-01-01 12:00:00 | d    | 2014-01-01 12:00:00
(1 row)

DELETE FROM mpp21090_pttab_dropcol_addcol_addpt_idx_dml_timestamp WHERE col5 = '2014-01-01 12:00:00';
DELETE 1
SELECT * FROM mpp21090_pttab_dropcol_addcol_addpt_idx_dml_timestamp ORDER BY 1,2,3;
 col1 | col2 | col3 | col5 
------+------+------+------
(0 rows)

