DROP TABLE IF EXISTS mpp21090_drop_distcol_dml_int4;
DROP TABLE
CREATE TABLE mpp21090_drop_distcol_dml_int4(
col1 int4,
col2 decimal,
col3 char,
col4 date,
col5 int
) distributed by (col1);
psql:/data/prabhd/test/tincrepo/main/dml/functional/output/mpp21090_drop_distcol_dml_int4_heap_opt.sql:21: NOTICE:  Table doesn't have 'DISTRIBUTED BY' clause -- Using column named 'col1' as the Greenplum Database data distribution key for this table.
HINT:  The 'DISTRIBUTED BY' clause determines the distribution of data. Make sure column(s) chosen are the optimal data distribution key to minimize skew.
CREATE TABLE
INSERT INTO mpp21090_drop_distcol_dml_int4 VALUES(2000000000,0.00,'a','2014-01-01',0);
INSERT 0 1
SELECT * FROM mpp21090_drop_distcol_dml_int4 ORDER BY 1,2,3,4;
    col1    | col2 | col3 |    col4    | col5 
------------+------+------+------------+------
 2000000000 | 0.00 | a    | 2014-01-01 |    0
(1 row)

ALTER TABLE mpp21090_drop_distcol_dml_int4 DROP COLUMN col1;
psql:/data/prabhd/test/tincrepo/main/dml/functional/output/mpp21090_drop_distcol_dml_int4_heap_opt.sql:24: NOTICE:  Dropping a column that is part of the distribution policy forces a NULL distribution policy
ALTER TABLE
INSERT INTO mpp21090_drop_distcol_dml_int4 SELECT 1.00,'b','2014-01-02',1;
INSERT 0 1
SELECT * FROM mpp21090_drop_distcol_dml_int4 ORDER BY 1,2,3;
 col2 | col3 |    col4    | col5 
------+------+------------+------
 0.00 | a    | 2014-01-01 |    0
 1.00 | b    | 2014-01-02 |    1
(2 rows)

UPDATE mpp21090_drop_distcol_dml_int4 SET col3='c' WHERE col3 = 'b' AND col5 = 1;
UPDATE 1
SELECT * FROM mpp21090_drop_distcol_dml_int4 ORDER BY 1,2,3;
 col2 | col3 |    col4    | col5 
------+------+------------+------
 0.00 | a    | 2014-01-01 |    0
 1.00 | c    | 2014-01-02 |    1
(2 rows)

DELETE FROM mpp21090_drop_distcol_dml_int4 WHERE col3='c';
DELETE 1
SELECT * FROM mpp21090_drop_distcol_dml_int4 ORDER BY 1,2,3,4;
 col2 | col3 |    col4    | col5 
------+------+------------+------
 0.00 | a    | 2014-01-01 |    0
(1 row)

