DROP TABLE IF EXISTS mpp21090_defpt_dropcol_addcol_dml_numeric;
psql:/data/prabhd/test/tincrepo/main/dml/functional/output/mpp21090_defpt_dropcol_addcol_dml_numeric_opt.sql:14: NOTICE:  table "mpp21090_defpt_dropcol_addcol_dml_numeric" does not exist, skipping
DROP TABLE
CREATE TABLE mpp21090_defpt_dropcol_addcol_dml_numeric
(
    col1 numeric,
    col2 numeric,
    col3 char,
    col4 int
) 
DISTRIBUTED by (col1)
PARTITION BY LIST(col2)
(
default partition def
);
psql:/data/prabhd/test/tincrepo/main/dml/functional/output/mpp21090_defpt_dropcol_addcol_dml_numeric_opt.sql:26: NOTICE:  CREATE TABLE will create partition "mpp21090_defpt_dropcol_addcol_dml_numeric_1_prt_def" for table "mpp21090_defpt_dropcol_addcol_dml_numeric"
CREATE TABLE
INSERT INTO mpp21090_defpt_dropcol_addcol_dml_numeric VALUES(2.000000,2.000000,'a',0);
INSERT 0 1
ALTER TABLE mpp21090_defpt_dropcol_addcol_dml_numeric DROP COLUMN col4;
ALTER TABLE
INSERT INTO mpp21090_defpt_dropcol_addcol_dml_numeric SELECT 35.000000,35.000000,'b';
INSERT 0 1
SELECT * FROM mpp21090_defpt_dropcol_addcol_dml_numeric ORDER BY 1,2,3;
   col1    |   col2    | col3 
-----------+-----------+------
  2.000000 |  2.000000 | a
 35.000000 | 35.000000 | b
(2 rows)

ALTER TABLE mpp21090_defpt_dropcol_addcol_dml_numeric ADD COLUMN col5 numeric;
ALTER TABLE
INSERT INTO mpp21090_defpt_dropcol_addcol_dml_numeric SELECT 2.000000,2.000000,'c',2.000000;
INSERT 0 1
SELECT * FROM mpp21090_defpt_dropcol_addcol_dml_numeric ORDER BY 1,2,3;
   col1    |   col2    | col3 |   col5   
-----------+-----------+------+----------
  2.000000 |  2.000000 | a    |         
  2.000000 |  2.000000 | c    | 2.000000
 35.000000 | 35.000000 | b    |         
(3 rows)

UPDATE mpp21090_defpt_dropcol_addcol_dml_numeric SET col1 = 1.000000 WHERE col2 = 35.000000 AND col1 = 35.000000;
UPDATE 1
SELECT * FROM mpp21090_defpt_dropcol_addcol_dml_numeric ORDER BY 1,2,3;
   col1   |   col2    | col3 |   col5   
----------+-----------+------+----------
 1.000000 | 35.000000 | b    |         
 2.000000 |  2.000000 | a    |         
 2.000000 |  2.000000 | c    | 2.000000
(3 rows)

-- Update partition key
UPDATE mpp21090_defpt_dropcol_addcol_dml_numeric SET col2 = 1.000000 WHERE col2 = 35.000000 AND col1 = 1.000000;
UPDATE 1
SELECT * FROM mpp21090_defpt_dropcol_addcol_dml_numeric ORDER BY 1,2,3;
   col1   |   col2   | col3 |   col5   
----------+----------+------+----------
 1.000000 | 1.000000 | b    |         
 2.000000 | 2.000000 | a    |         
 2.000000 | 2.000000 | c    | 2.000000
(3 rows)

DELETE FROM mpp21090_defpt_dropcol_addcol_dml_numeric WHERE col2 = 1.000000;
DELETE 1
SELECT * FROM mpp21090_defpt_dropcol_addcol_dml_numeric ORDER BY 1,2,3;
   col1   |   col2   | col3 |   col5   
----------+----------+------+----------
 2.000000 | 2.000000 | a    |         
 2.000000 | 2.000000 | c    | 2.000000
(2 rows)

