DROP TABLE IF EXISTS mpp21090_dropcol_addcol_splitdefpt_dml_int4;
psql:/data/prabhd/test/tincrepo/main/dml/functional/output/mpp21090_dropcol_addcol_splitdefpt_dml_int4_opt.sql:14: NOTICE:  table "mpp21090_dropcol_addcol_splitdefpt_dml_int4" does not exist, skipping
DROP TABLE
CREATE TABLE mpp21090_dropcol_addcol_splitdefpt_dml_int4
(
    col1 int4,
    col2 int4,
    col3 char,
    col4 int4
) 
DISTRIBUTED by (col1)
PARTITION BY LIST(col2)
(
default partition def
);
psql:/data/prabhd/test/tincrepo/main/dml/functional/output/mpp21090_dropcol_addcol_splitdefpt_dml_int4_opt.sql:26: NOTICE:  CREATE TABLE will create partition "mpp21090_dropcol_addcol_splitdefpt_dml_int4_1_prt_def" for table "mpp21090_dropcol_addcol_splitdefpt_dml_int4"
CREATE TABLE
INSERT INTO mpp21090_dropcol_addcol_splitdefpt_dml_int4 VALUES(20000000,20000000,'a',20000000);
INSERT 0 1
SELECT * FROM mpp21090_dropcol_addcol_splitdefpt_dml_int4 ORDER BY 1,2,3,4;
   col1   |   col2   | col3 |   col4   
----------+----------+------+----------
 20000000 | 20000000 | a    | 20000000
(1 row)

ALTER TABLE mpp21090_dropcol_addcol_splitdefpt_dml_int4 DROP COLUMN col4;
ALTER TABLE
INSERT INTO mpp21090_dropcol_addcol_splitdefpt_dml_int4 VALUES(20000000,20000000,'b');
INSERT 0 1
SELECT * FROM mpp21090_dropcol_addcol_splitdefpt_dml_int4 ORDER BY 1,2,3;
   col1   |   col2   | col3 
----------+----------+------
 20000000 | 20000000 | a
 20000000 | 20000000 | b
(2 rows)

ALTER TABLE mpp21090_dropcol_addcol_splitdefpt_dml_int4 ADD COLUMN col5 int DEFAULT 10;
ALTER TABLE
INSERT INTO mpp21090_dropcol_addcol_splitdefpt_dml_int4 VALUES(20000000,20000000,'c',1);
INSERT 0 1
SELECT * FROM mpp21090_dropcol_addcol_splitdefpt_dml_int4 ORDER BY 1,2,3,4;
   col1   |   col2   | col3 | col5 
----------+----------+------+------
 20000000 | 20000000 | a    |   10
 20000000 | 20000000 | b    |   10
 20000000 | 20000000 | c    |    1
(3 rows)

ALTER TABLE mpp21090_dropcol_addcol_splitdefpt_dml_int4 SPLIT DEFAULT PARTITION at (50000000) into (partition partsplitone,partition def);
psql:/data/prabhd/test/tincrepo/main/dml/functional/output/mpp21090_dropcol_addcol_splitdefpt_dml_int4_opt.sql:41: NOTICE:  exchanged partition "def" of relation "mpp21090_dropcol_addcol_splitdefpt_dml_int4" with relation "pg_temp_47370"
psql:/data/prabhd/test/tincrepo/main/dml/functional/output/mpp21090_dropcol_addcol_splitdefpt_dml_int4_opt.sql:41: NOTICE:  dropped partition "def" for relation "mpp21090_dropcol_addcol_splitdefpt_dml_int4"
psql:/data/prabhd/test/tincrepo/main/dml/functional/output/mpp21090_dropcol_addcol_splitdefpt_dml_int4_opt.sql:41: NOTICE:  CREATE TABLE will create partition "mpp21090_dropcol_addcol_splitdefpt_dml_int4_1_prt_partsplitone" for table "mpp21090_dropcol_addcol_splitdefpt_dml_int4"
psql:/data/prabhd/test/tincrepo/main/dml/functional/output/mpp21090_dropcol_addcol_splitdefpt_dml_int4_opt.sql:41: NOTICE:  CREATE TABLE will create partition "mpp21090_dropcol_addcol_splitdefpt_dml_int4_1_prt_def" for table "mpp21090_dropcol_addcol_splitdefpt_dml_int4"
ALTER TABLE
INSERT INTO mpp21090_dropcol_addcol_splitdefpt_dml_int4 SELECT 10000000, 10000000,'e', 1;
INSERT 0 1
SELECT * FROM mpp21090_dropcol_addcol_splitdefpt_dml_int4 ORDER BY 1,2,3;
   col1   |   col2   | col3 | col5 
----------+----------+------+------
 10000000 | 10000000 | e    |    1
 20000000 | 20000000 | a    |   10
 20000000 | 20000000 | b    |   10
 20000000 | 20000000 | c    |    1
(4 rows)

-- Update distribution key
UPDATE mpp21090_dropcol_addcol_splitdefpt_dml_int4 SET col1 = 35000000 WHERE col2 = 10000000 AND col1 = 10000000;
UPDATE 1
SELECT * FROM mpp21090_dropcol_addcol_splitdefpt_dml_int4 ORDER BY 1,2,3;
   col1   |   col2   | col3 | col5 
----------+----------+------+------
 20000000 | 20000000 | a    |   10
 20000000 | 20000000 | b    |   10
 20000000 | 20000000 | c    |    1
 35000000 | 10000000 | e    |    1
(4 rows)

-- Update partition key
UPDATE mpp21090_dropcol_addcol_splitdefpt_dml_int4 SET col2 = 35000000 WHERE col2 = 10000000 AND col1 = 35000000;
UPDATE 1
SELECT * FROM mpp21090_dropcol_addcol_splitdefpt_dml_int4 ORDER BY 1,2,3;
   col1   |   col2   | col3 | col5 
----------+----------+------+------
 20000000 | 20000000 | a    |   10
 20000000 | 20000000 | b    |   10
 20000000 | 20000000 | c    |    1
 35000000 | 35000000 | e    |    1
(4 rows)

DELETE FROM mpp21090_dropcol_addcol_splitdefpt_dml_int4 WHERE col3='b';
DELETE 1
SELECT * FROM mpp21090_dropcol_addcol_splitdefpt_dml_int4 ORDER BY 1,2,3;
   col1   |   col2   | col3 | col5 
----------+----------+------+------
 20000000 | 20000000 | a    |   10
 20000000 | 20000000 | c    |    1
 35000000 | 35000000 | e    |    1
(3 rows)

