DROP TABLE IF EXISTS mpp21090_pttab_dropmidcol_addpt_decimal;
psql:/data/prabhd/test/tincrepo/main/dml/functional/output/mpp21090_pttab_dropmidcol_addpt_decimal_opt.sql:14: NOTICE:  table "mpp21090_pttab_dropmidcol_addpt_decimal" does not exist, skipping
DROP TABLE
CREATE TABLE mpp21090_pttab_dropmidcol_addpt_decimal
(
    col1 decimal,
    col2 decimal,
    col3 char,
    col4 decimal,
    col5 int
) 
DISTRIBUTED by (col1) 
PARTITION BY RANGE(col2)(partition partone start(1.00) end(10.00)  WITH (APPENDONLY=true, COMPRESSLEVEL=5, ORIENTATION=column),partition parttwo start(10.00) end(20.00) WITH (APPENDONLY=true, COMPRESSLEVEL=5, ORIENTATION=row),partition partthree start(20.00) end(30.00));
psql:/data/prabhd/test/tincrepo/main/dml/functional/output/mpp21090_pttab_dropmidcol_addpt_decimal_opt.sql:24: NOTICE:  CREATE TABLE will create partition "mpp21090_pttab_dropmidcol_addpt_decimal_1_prt_partone" for table "mpp21090_pttab_dropmidcol_addpt_decimal"
psql:/data/prabhd/test/tincrepo/main/dml/functional/output/mpp21090_pttab_dropmidcol_addpt_decimal_opt.sql:24: NOTICE:  CREATE TABLE will create partition "mpp21090_pttab_dropmidcol_addpt_decimal_1_prt_parttwo" for table "mpp21090_pttab_dropmidcol_addpt_decimal"
psql:/data/prabhd/test/tincrepo/main/dml/functional/output/mpp21090_pttab_dropmidcol_addpt_decimal_opt.sql:24: NOTICE:  CREATE TABLE will create partition "mpp21090_pttab_dropmidcol_addpt_decimal_1_prt_partthree" for table "mpp21090_pttab_dropmidcol_addpt_decimal"
CREATE TABLE
INSERT INTO mpp21090_pttab_dropmidcol_addpt_decimal VALUES(2.00,2.00,'a',2.00,0);
INSERT 0 1
ALTER TABLE mpp21090_pttab_dropmidcol_addpt_decimal DROP COLUMN col4;
ALTER TABLE
ALTER TABLE mpp21090_pttab_dropmidcol_addpt_decimal ADD PARTITION partfour start(30.00) end(40.00) inclusive;
psql:/data/prabhd/test/tincrepo/main/dml/functional/output/mpp21090_pttab_dropmidcol_addpt_decimal_opt.sql:29: NOTICE:  CREATE TABLE will create partition "mpp21090_pttab_dropmidcol_addpt_decimal_1_prt_partfour" for table "mpp21090_pttab_dropmidcol_addpt_decimal"
ALTER TABLE
INSERT INTO mpp21090_pttab_dropmidcol_addpt_decimal SELECT 35.00, 35.00,'b', 1;
INSERT 0 1
SELECT * FROM mpp21090_pttab_dropmidcol_addpt_decimal ORDER BY 1,2,3;
 col1  | col2  | col3 | col5 
-------+-------+------+------
  2.00 |  2.00 | a    |    0
 35.00 | 35.00 | b    |    1
(2 rows)

-- Update distribution key
UPDATE mpp21090_pttab_dropmidcol_addpt_decimal SET col1 = 1.00 WHERE col2 = 35.00 AND col1 = 35.00;
UPDATE 1
SELECT * FROM mpp21090_pttab_dropmidcol_addpt_decimal ORDER BY 1,2,3;
 col1 | col2  | col3 | col5 
------+-------+------+------
 1.00 | 35.00 | b    |    1
 2.00 |  2.00 | a    |    0
(2 rows)

-- Update partition key
UPDATE mpp21090_pttab_dropmidcol_addpt_decimal SET col2 = 1.00 WHERE col2 = 35.00 AND col1 = 1.00;
UPDATE 1
SELECT * FROM mpp21090_pttab_dropmidcol_addpt_decimal ORDER BY 1,2,3;
 col1 | col2 | col3 | col5 
------+------+------+------
 1.00 | 1.00 | b    |    1
 2.00 | 2.00 | a    |    0
(2 rows)

DELETE FROM mpp21090_pttab_dropmidcol_addpt_decimal WHERE col2 = 1.00;
DELETE 1
SELECT * FROM mpp21090_pttab_dropmidcol_addpt_decimal ORDER BY 1,2,3;
 col1 | col2 | col3 | col5 
------+------+------+------
 2.00 | 2.00 | a    |    0
(1 row)

