DROP TABLE IF EXISTS mpp21090_pttab_dropfirstcol_addpt_index_numeric;
psql:/data/prabhd/test/tincrepo/main/dml/functional/output/mpp21090_pttab_dropfirstcol_addpt_index_numeric_opt.sql:14: NOTICE:  table "mpp21090_pttab_dropfirstcol_addpt_index_numeric" does not exist, skipping
DROP TABLE
CREATE TABLE mpp21090_pttab_dropfirstcol_addpt_index_numeric
(
    col1 numeric,
    col2 numeric,
    col3 char,
    col4 numeric,
    col5 int
) 
DISTRIBUTED by (col1)
PARTITION BY RANGE(col2)(partition partone start(1.000000) end(10.000000)  WITH (APPENDONLY=true, COMPRESSLEVEL=5, ORIENTATION=column),partition parttwo start(10.000000) end(20.000000) WITH (APPENDONLY=true, COMPRESSLEVEL=5, ORIENTATION=row),partition partthree start(20.000000) end(30.000000));
psql:/data/prabhd/test/tincrepo/main/dml/functional/output/mpp21090_pttab_dropfirstcol_addpt_index_numeric_opt.sql:24: NOTICE:  CREATE TABLE will create partition "mpp21090_pttab_dropfirstcol_addpt_index_numeric_1_prt_partone" for table "mpp21090_pttab_dropfirstcol_addpt_index_numeric"
psql:/data/prabhd/test/tincrepo/main/dml/functional/output/mpp21090_pttab_dropfirstcol_addpt_index_numeric_opt.sql:24: NOTICE:  CREATE TABLE will create partition "mpp21090_pttab_dropfirstcol_addpt_index_numeric_1_prt_parttwo" for table "mpp21090_pttab_dropfirstcol_addpt_index_numeric"
psql:/data/prabhd/test/tincrepo/main/dml/functional/output/mpp21090_pttab_dropfirstcol_addpt_index_numeric_opt.sql:24: NOTICE:  CREATE TABLE will create partition "mpp21090_pttab_dropfirstcol_addpt_index_numeric_1_prt_partthree" for table "mpp21090_pttab_dropfirstcol_addpt_index_numeric"
CREATE TABLE
INSERT INTO mpp21090_pttab_dropfirstcol_addpt_index_numeric VALUES(2.000000,2.000000,'a',2.000000,0);
INSERT 0 1
DROP INDEX IF EXISTS mpp21090_pttab_dropfirstcol_addpt_index_idx_numeric;
psql:/data/prabhd/test/tincrepo/main/dml/functional/output/mpp21090_pttab_dropfirstcol_addpt_index_numeric_opt.sql:28: NOTICE:  index "mpp21090_pttab_dropfirstcol_addpt_index_idx_numeric" does not exist, skipping
DROP INDEX
CREATE INDEX mpp21090_pttab_dropfirstcol_addpt_index_idx_numeric on mpp21090_pttab_dropfirstcol_addpt_index_numeric(col2);
psql:/data/prabhd/test/tincrepo/main/dml/functional/output/mpp21090_pttab_dropfirstcol_addpt_index_numeric_opt.sql:29: NOTICE:  building index for child partition "mpp21090_pttab_dropfirstcol_addpt_index_numeric_1_prt_partone"
psql:/data/prabhd/test/tincrepo/main/dml/functional/output/mpp21090_pttab_dropfirstcol_addpt_index_numeric_opt.sql:29: NOTICE:  building index for child partition "mpp21090_pttab_dropfirstcol_addpt_index_numeric_1_prt_parttwo"
psql:/data/prabhd/test/tincrepo/main/dml/functional/output/mpp21090_pttab_dropfirstcol_addpt_index_numeric_opt.sql:29: NOTICE:  building index for child partition "mpp21090_pttab_dropfirstcol_addpt_index_numeric_1_prt_partthree"
CREATE INDEX
ALTER TABLE mpp21090_pttab_dropfirstcol_addpt_index_numeric DROP COLUMN col1;
psql:/data/prabhd/test/tincrepo/main/dml/functional/output/mpp21090_pttab_dropfirstcol_addpt_index_numeric_opt.sql:31: NOTICE:  Dropping a column that is part of the distribution policy forces a NULL distribution policy
psql:/data/prabhd/test/tincrepo/main/dml/functional/output/mpp21090_pttab_dropfirstcol_addpt_index_numeric_opt.sql:31: NOTICE:  Dropping a column that is part of the distribution policy forces a NULL distribution policy
psql:/data/prabhd/test/tincrepo/main/dml/functional/output/mpp21090_pttab_dropfirstcol_addpt_index_numeric_opt.sql:31: NOTICE:  Dropping a column that is part of the distribution policy forces a NULL distribution policy
psql:/data/prabhd/test/tincrepo/main/dml/functional/output/mpp21090_pttab_dropfirstcol_addpt_index_numeric_opt.sql:31: NOTICE:  Dropping a column that is part of the distribution policy forces a NULL distribution policy
ALTER TABLE
ALTER TABLE mpp21090_pttab_dropfirstcol_addpt_index_numeric ADD PARTITION partfour start(30.000000) end(40.000000) inclusive;
psql:/data/prabhd/test/tincrepo/main/dml/functional/output/mpp21090_pttab_dropfirstcol_addpt_index_numeric_opt.sql:32: NOTICE:  CREATE TABLE will create partition "mpp21090_pttab_dropfirstcol_addpt_index_numeric_1_prt_partfour" for table "mpp21090_pttab_dropfirstcol_addpt_index_numeric"
ALTER TABLE
INSERT INTO mpp21090_pttab_dropfirstcol_addpt_index_numeric SELECT 35.000000,'b',35.000000, 1;
INSERT 0 1
SELECT * FROM mpp21090_pttab_dropfirstcol_addpt_index_numeric ORDER BY 1,2,3;
   col2    | col3 |   col4    | col5 
-----------+------+-----------+------
  2.000000 | a    |  2.000000 |    0
 35.000000 | b    | 35.000000 |    1
(2 rows)

UPDATE mpp21090_pttab_dropfirstcol_addpt_index_numeric SET col4 = 1.000000 WHERE col2 = 35.000000 AND col4 = 35.000000;
UPDATE 1
SELECT * FROM mpp21090_pttab_dropfirstcol_addpt_index_numeric ORDER BY 1,2,3;
   col2    | col3 |   col4   | col5 
-----------+------+----------+------
  2.000000 | a    | 2.000000 |    0
 35.000000 | b    | 1.000000 |    1
(2 rows)

-- Update partition key
UPDATE mpp21090_pttab_dropfirstcol_addpt_index_numeric SET col2 = 1.000000 WHERE col2 = 35.000000 AND col4 = 1.000000;
UPDATE 1
SELECT * FROM mpp21090_pttab_dropfirstcol_addpt_index_numeric ORDER BY 1,2,3;
   col2   | col3 |   col4   | col5 
----------+------+----------+------
 1.000000 | b    | 1.000000 |    1
 2.000000 | a    | 2.000000 |    0
(2 rows)

DELETE FROM mpp21090_pttab_dropfirstcol_addpt_index_numeric WHERE col2 = 1.000000;
DELETE 1
SELECT * FROM mpp21090_pttab_dropfirstcol_addpt_index_numeric ORDER BY 1,2,3;
   col2   | col3 |   col4   | col5 
----------+------+----------+------
 2.000000 | a    | 2.000000 |    0
(1 row)

