DROP TABLE IF EXISTS mpp21090_drop_lastcol_dml_boolean;
DROP TABLE
CREATE TABLE mpp21090_drop_lastcol_dml_boolean(
col1 int,
col2 decimal,
col3 char,
col4 date,
col5 boolean
) with (appendonly= true, orientation= column)  DISTRIBUTED by(col3);
CREATE TABLE
INSERT INTO mpp21090_drop_lastcol_dml_boolean VALUES(0,0.00,'a','2014-01-01',True);
INSERT 0 1
SELECT * FROM mpp21090_drop_lastcol_dml_boolean ORDER BY 1,2,3,4;
 col1 | col2 | col3 |    col4    | col5 
------+------+------+------------+------
    0 | 0.00 | a    | 2014-01-01 | t
(1 row)

ALTER TABLE mpp21090_drop_lastcol_dml_boolean DROP COLUMN col5;
ALTER TABLE
INSERT INTO mpp21090_drop_lastcol_dml_boolean SELECT 1,1.00,'b','2014-01-02';
INSERT 0 1
SELECT * FROM mpp21090_drop_lastcol_dml_boolean ORDER BY 1,2,3,4;
 col1 | col2 | col3 |    col4    
------+------+------+------------
    0 | 0.00 | a    | 2014-01-01
    1 | 1.00 | b    | 2014-01-02
(2 rows)

UPDATE mpp21090_drop_lastcol_dml_boolean SET col3='c' WHERE col3 = 'b' AND col1 = 1;
UPDATE 1
SELECT * FROM mpp21090_drop_lastcol_dml_boolean ORDER BY 1,2,3,4;
 col1 | col2 | col3 |    col4    
------+------+------+------------
    0 | 0.00 | a    | 2014-01-01
    1 | 1.00 | c    | 2014-01-02
(2 rows)

DELETE FROM mpp21090_drop_lastcol_dml_boolean WHERE col3='c';
DELETE 1
SELECT * FROM mpp21090_drop_lastcol_dml_boolean ORDER BY 1,2,3,4;
 col1 | col2 | col3 |    col4    
------+------+------+------------
    0 | 0.00 | a    | 2014-01-01
(1 row)

