DROP TABLE IF EXISTS mpp21090_pttab_addcol_addpt_dropcol_numeric;
psql:/data/prabhd/test/tincrepo/main/dml/functional/output/mpp21090_pttab_addcol_addpt_dropcol_numeric_opt.sql:14: NOTICE:  table "mpp21090_pttab_addcol_addpt_dropcol_numeric" does not exist, skipping
DROP TABLE
CREATE TABLE mpp21090_pttab_addcol_addpt_dropcol_numeric
(
    col1 numeric,
    col2 numeric,
    col3 char,
    col4 int
) 
DISTRIBUTED by (col1)
PARTITION BY RANGE(col2)(partition partone start(1.000000) end(10.000000)  WITH (APPENDONLY=true, COMPRESSLEVEL=5, ORIENTATION=column),partition parttwo start(10.000000) end(20.000000) WITH (APPENDONLY=true, COMPRESSLEVEL=5, ORIENTATION=row),partition partthree start(20.000000) end(30.000000));
psql:/data/prabhd/test/tincrepo/main/dml/functional/output/mpp21090_pttab_addcol_addpt_dropcol_numeric_opt.sql:23: NOTICE:  CREATE TABLE will create partition "mpp21090_pttab_addcol_addpt_dropcol_numeric_1_prt_partone" for table "mpp21090_pttab_addcol_addpt_dropcol_numeric"
psql:/data/prabhd/test/tincrepo/main/dml/functional/output/mpp21090_pttab_addcol_addpt_dropcol_numeric_opt.sql:23: NOTICE:  CREATE TABLE will create partition "mpp21090_pttab_addcol_addpt_dropcol_numeric_1_prt_parttwo" for table "mpp21090_pttab_addcol_addpt_dropcol_numeric"
psql:/data/prabhd/test/tincrepo/main/dml/functional/output/mpp21090_pttab_addcol_addpt_dropcol_numeric_opt.sql:23: NOTICE:  CREATE TABLE will create partition "mpp21090_pttab_addcol_addpt_dropcol_numeric_1_prt_partthree" for table "mpp21090_pttab_addcol_addpt_dropcol_numeric"
CREATE TABLE
INSERT INTO mpp21090_pttab_addcol_addpt_dropcol_numeric VALUES(2.000000,2.000000,'a',0);
INSERT 0 1
ALTER TABLE mpp21090_pttab_addcol_addpt_dropcol_numeric ADD COLUMN col5 numeric DEFAULT 2.000000;
ALTER TABLE
ALTER TABLE mpp21090_pttab_addcol_addpt_dropcol_numeric ADD PARTITION partfour start(30.000000) end(40.000000) inclusive;
psql:/data/prabhd/test/tincrepo/main/dml/functional/output/mpp21090_pttab_addcol_addpt_dropcol_numeric_opt.sql:28: NOTICE:  CREATE TABLE will create partition "mpp21090_pttab_addcol_addpt_dropcol_numeric_1_prt_partfour" for table "mpp21090_pttab_addcol_addpt_dropcol_numeric"
ALTER TABLE
INSERT INTO mpp21090_pttab_addcol_addpt_dropcol_numeric SELECT 35.000000,35.000000,'b',1, 35.000000;
INSERT 0 1
SELECT * FROM mpp21090_pttab_addcol_addpt_dropcol_numeric ORDER BY 1,2,3;
   col1    |   col2    | col3 | col4 |   col5    
-----------+-----------+------+------+-----------
  2.000000 |  2.000000 | a    |    0 |  2.000000
 35.000000 | 35.000000 | b    |    1 | 35.000000
(2 rows)

ALTER TABLE mpp21090_pttab_addcol_addpt_dropcol_numeric DROP COLUMN col1;
psql:/data/prabhd/test/tincrepo/main/dml/functional/output/mpp21090_pttab_addcol_addpt_dropcol_numeric_opt.sql:33: NOTICE:  Dropping a column that is part of the distribution policy forces a NULL distribution policy
psql:/data/prabhd/test/tincrepo/main/dml/functional/output/mpp21090_pttab_addcol_addpt_dropcol_numeric_opt.sql:33: NOTICE:  Dropping a column that is part of the distribution policy forces a NULL distribution policy
psql:/data/prabhd/test/tincrepo/main/dml/functional/output/mpp21090_pttab_addcol_addpt_dropcol_numeric_opt.sql:33: NOTICE:  Dropping a column that is part of the distribution policy forces a NULL distribution policy
psql:/data/prabhd/test/tincrepo/main/dml/functional/output/mpp21090_pttab_addcol_addpt_dropcol_numeric_opt.sql:33: NOTICE:  Dropping a column that is part of the distribution policy forces a NULL distribution policy
psql:/data/prabhd/test/tincrepo/main/dml/functional/output/mpp21090_pttab_addcol_addpt_dropcol_numeric_opt.sql:33: NOTICE:  Dropping a column that is part of the distribution policy forces a NULL distribution policy
ALTER TABLE
INSERT INTO mpp21090_pttab_addcol_addpt_dropcol_numeric SELECT 35.000000,'c',1, 35.000000;
INSERT 0 1
SELECT * FROM mpp21090_pttab_addcol_addpt_dropcol_numeric ORDER BY 1,2,3;
   col2    | col3 | col4 |   col5    
-----------+------+------+-----------
  2.000000 | a    |    0 |  2.000000
 35.000000 | b    |    1 | 35.000000
 35.000000 | c    |    1 | 35.000000
(3 rows)

UPDATE mpp21090_pttab_addcol_addpt_dropcol_numeric SET col5 = 1.000000 WHERE col2 = 35.000000 and col3='c';
UPDATE 1
SELECT * FROM mpp21090_pttab_addcol_addpt_dropcol_numeric ORDER BY 1,2,3;
   col2    | col3 | col4 |   col5    
-----------+------+------+-----------
  2.000000 | a    |    0 |  2.000000
 35.000000 | b    |    1 | 35.000000
 35.000000 | c    |    1 |  1.000000
(3 rows)

-- Update partition key
UPDATE mpp21090_pttab_addcol_addpt_dropcol_numeric SET col2 = 1.000000 WHERE col2 = 35.000000 and col3='c';
UPDATE 1
SELECT * FROM mpp21090_pttab_addcol_addpt_dropcol_numeric ORDER BY 1,2,3;
   col2    | col3 | col4 |   col5    
-----------+------+------+-----------
  1.000000 | c    |    1 |  1.000000
  2.000000 | a    |    0 |  2.000000
 35.000000 | b    |    1 | 35.000000
(3 rows)

DELETE FROM mpp21090_pttab_addcol_addpt_dropcol_numeric WHERE col2 = 1.000000;
DELETE 1
SELECT * FROM mpp21090_pttab_addcol_addpt_dropcol_numeric ORDER BY 1,2,3;
   col2    | col3 | col4 |   col5    
-----------+------+------+-----------
  2.000000 | a    |    0 |  2.000000
 35.000000 | b    |    1 | 35.000000
(2 rows)

