DROP TABLE IF EXISTS mpp21090_dropcol_addcol_splitpt_dml_int4;
psql:/data/prabhd/test/tincrepo/main/dml/functional/output/mpp21090_dropcol_addcol_splitpt_dml_int4_opt.sql:14: NOTICE:  table "mpp21090_dropcol_addcol_splitpt_dml_int4" does not exist, skipping
DROP TABLE
CREATE TABLE mpp21090_dropcol_addcol_splitpt_dml_int4
(
    col1 int4,
    col2 int4,
    col3 char,
    col4 int4
) 
DISTRIBUTED by (col1)
PARTITION BY RANGE(col2)(partition partone start(1) end(100000001)  WITH (APPENDONLY=true, COMPRESSLEVEL=5, ORIENTATION=column),partition parttwo start(100000001) end(200000001) WITH (APPENDONLY=true, COMPRESSLEVEL=5, ORIENTATION=row),partition partthree start(200000001) end(300000001));
psql:/data/prabhd/test/tincrepo/main/dml/functional/output/mpp21090_dropcol_addcol_splitpt_dml_int4_opt.sql:23: NOTICE:  CREATE TABLE will create partition "mpp21090_dropcol_addcol_splitpt_dml_int4_1_prt_partone" for table "mpp21090_dropcol_addcol_splitpt_dml_int4"
psql:/data/prabhd/test/tincrepo/main/dml/functional/output/mpp21090_dropcol_addcol_splitpt_dml_int4_opt.sql:23: NOTICE:  CREATE TABLE will create partition "mpp21090_dropcol_addcol_splitpt_dml_int4_1_prt_parttwo" for table "mpp21090_dropcol_addcol_splitpt_dml_int4"
psql:/data/prabhd/test/tincrepo/main/dml/functional/output/mpp21090_dropcol_addcol_splitpt_dml_int4_opt.sql:23: NOTICE:  CREATE TABLE will create partition "mpp21090_dropcol_addcol_splitpt_dml_int4_1_prt_partthree" for table "mpp21090_dropcol_addcol_splitpt_dml_int4"
CREATE TABLE
INSERT INTO mpp21090_dropcol_addcol_splitpt_dml_int4 VALUES(20000000,20000000,'a',20000000);
INSERT 0 1
SELECT * FROM mpp21090_dropcol_addcol_splitpt_dml_int4 ORDER BY 1,2,3,4;
   col1   |   col2   | col3 |   col4   
----------+----------+------+----------
 20000000 | 20000000 | a    | 20000000
(1 row)

ALTER TABLE mpp21090_dropcol_addcol_splitpt_dml_int4 ADD COLUMN col5 int DEFAULT 10;
ALTER TABLE
INSERT INTO mpp21090_dropcol_addcol_splitpt_dml_int4 VALUES(20000000,20000000,'b',20000000,0);
INSERT 0 1
SELECT * FROM mpp21090_dropcol_addcol_splitpt_dml_int4 ORDER BY 1,2,3,4;
   col1   |   col2   | col3 |   col4   | col5 
----------+----------+------+----------+------
 20000000 | 20000000 | a    | 20000000 |   10
 20000000 | 20000000 | b    | 20000000 |    0
(2 rows)

ALTER TABLE mpp21090_dropcol_addcol_splitpt_dml_int4 DROP COLUMN col4;
ALTER TABLE
INSERT INTO mpp21090_dropcol_addcol_splitpt_dml_int4 VALUES(20000000,20000000,'c',1);
INSERT 0 1
SELECT * FROM mpp21090_dropcol_addcol_splitpt_dml_int4 ORDER BY 1,2,3,4;
   col1   |   col2   | col3 | col5 
----------+----------+------+------
 20000000 | 20000000 | a    |   10
 20000000 | 20000000 | b    |    0
 20000000 | 20000000 | c    |    1
(3 rows)

ALTER TABLE mpp21090_dropcol_addcol_splitpt_dml_int4 SPLIT PARTITION partone at (50000000) into (partition partsplitone,partition partsplitwo);
psql:/data/prabhd/test/tincrepo/main/dml/functional/output/mpp21090_dropcol_addcol_splitpt_dml_int4_opt.sql:38: NOTICE:  exchanged partition "partone" of relation "mpp21090_dropcol_addcol_splitpt_dml_int4" with relation "pg_temp_52966"
psql:/data/prabhd/test/tincrepo/main/dml/functional/output/mpp21090_dropcol_addcol_splitpt_dml_int4_opt.sql:38: NOTICE:  dropped partition "partone" for relation "mpp21090_dropcol_addcol_splitpt_dml_int4"
psql:/data/prabhd/test/tincrepo/main/dml/functional/output/mpp21090_dropcol_addcol_splitpt_dml_int4_opt.sql:38: NOTICE:  CREATE TABLE will create partition "mpp21090_dropcol_addcol_splitpt_dml_int4_1_prt_partsplitone" for table "mpp21090_dropcol_addcol_splitpt_dml_int4"
psql:/data/prabhd/test/tincrepo/main/dml/functional/output/mpp21090_dropcol_addcol_splitpt_dml_int4_opt.sql:38: NOTICE:  CREATE TABLE will create partition "mpp21090_dropcol_addcol_splitpt_dml_int4_1_prt_partsplitwo" for table "mpp21090_dropcol_addcol_splitpt_dml_int4"
ALTER TABLE
INSERT INTO mpp21090_dropcol_addcol_splitpt_dml_int4 SELECT 10000000, 10000000,'d', 1;
INSERT 0 1
SELECT * FROM mpp21090_dropcol_addcol_splitpt_dml_int4 ORDER BY 1,2,3;
   col1   |   col2   | col3 | col5 
----------+----------+------+------
 10000000 | 10000000 | d    |    1
 20000000 | 20000000 | a    |   10
 20000000 | 20000000 | b    |    0
 20000000 | 20000000 | c    |    1
(4 rows)

-- Update distribution key
UPDATE mpp21090_dropcol_addcol_splitpt_dml_int4 SET col1 = 35000000 WHERE col2 = 10000000 AND col1 = 10000000;
UPDATE 1
SELECT * FROM mpp21090_dropcol_addcol_splitpt_dml_int4 ORDER BY 1,2,3;
   col1   |   col2   | col3 | col5 
----------+----------+------+------
 20000000 | 20000000 | a    |   10
 20000000 | 20000000 | b    |    0
 20000000 | 20000000 | c    |    1
 35000000 | 10000000 | d    |    1
(4 rows)

-- Update partition key
UPDATE mpp21090_dropcol_addcol_splitpt_dml_int4 SET col2 =20000000  WHERE col2 = 10000000 AND col1 = 35000000;
UPDATE 1
SELECT * FROM mpp21090_dropcol_addcol_splitpt_dml_int4 ORDER BY 1,2,3;
   col1   |   col2   | col3 | col5 
----------+----------+------+------
 20000000 | 20000000 | a    |   10
 20000000 | 20000000 | b    |    0
 20000000 | 20000000 | c    |    1
 35000000 | 20000000 | d    |    1
(4 rows)

DELETE FROM mpp21090_dropcol_addcol_splitpt_dml_int4 WHERE col3='b';
DELETE 1
SELECT * FROM mpp21090_dropcol_addcol_splitpt_dml_int4 ORDER BY 1,2,3;
   col1   |   col2   | col3 | col5 
----------+----------+------+------
 20000000 | 20000000 | a    |   10
 20000000 | 20000000 | c    |    1
 35000000 | 20000000 | d    |    1
(3 rows)

