DROP TABLE IF EXISTS mpp21090_xchange_pttab_dropcol_dml_decimal;
psql:/data/prabhd/test/tincrepo/main/dml/functional/output/mpp21090_xchange_pttab_dropcol_dml_decimal_opt.sql:14: NOTICE:  table "mpp21090_xchange_pttab_dropcol_dml_decimal" does not exist, skipping
DROP TABLE
CREATE TABLE mpp21090_xchange_pttab_dropcol_dml_decimal
(
    col1 decimal,
    col2 decimal,
    col3 char,
    col4 int,
    col5 decimal
) 
DISTRIBUTED by (col1)
PARTITION BY RANGE(col2)(partition partone start(1.00) end(10.00)  WITH (APPENDONLY=true, COMPRESSLEVEL=5, ORIENTATION=column),partition parttwo start(10.00) end(20.00) WITH (APPENDONLY=true, COMPRESSLEVEL=5, ORIENTATION=row),partition partthree start(20.00) end(30.00));
psql:/data/prabhd/test/tincrepo/main/dml/functional/output/mpp21090_xchange_pttab_dropcol_dml_decimal_opt.sql:24: NOTICE:  CREATE TABLE will create partition "mpp21090_xchange_pttab_dropcol_dml_decimal_1_prt_partone" for table "mpp21090_xchange_pttab_dropcol_dml_decimal"
psql:/data/prabhd/test/tincrepo/main/dml/functional/output/mpp21090_xchange_pttab_dropcol_dml_decimal_opt.sql:24: NOTICE:  CREATE TABLE will create partition "mpp21090_xchange_pttab_dropcol_dml_decimal_1_prt_parttwo" for table "mpp21090_xchange_pttab_dropcol_dml_decimal"
psql:/data/prabhd/test/tincrepo/main/dml/functional/output/mpp21090_xchange_pttab_dropcol_dml_decimal_opt.sql:24: NOTICE:  CREATE TABLE will create partition "mpp21090_xchange_pttab_dropcol_dml_decimal_1_prt_partthree" for table "mpp21090_xchange_pttab_dropcol_dml_decimal"
CREATE TABLE
INSERT INTO mpp21090_xchange_pttab_dropcol_dml_decimal VALUES(2.00,2.00,'a',0, 2.00);
INSERT 0 1
SELECT * FROM mpp21090_xchange_pttab_dropcol_dml_decimal ORDER BY 1,2,3,4;
 col1 | col2 | col3 | col4 | col5 
------+------+------+------+------
 2.00 | 2.00 | a    |    0 | 2.00
(1 row)

ALTER TABLE mpp21090_xchange_pttab_dropcol_dml_decimal DROP COLUMN col1;
psql:/data/prabhd/test/tincrepo/main/dml/functional/output/mpp21090_xchange_pttab_dropcol_dml_decimal_opt.sql:29: NOTICE:  Dropping a column that is part of the distribution policy forces a NULL distribution policy
psql:/data/prabhd/test/tincrepo/main/dml/functional/output/mpp21090_xchange_pttab_dropcol_dml_decimal_opt.sql:29: NOTICE:  Dropping a column that is part of the distribution policy forces a NULL distribution policy
psql:/data/prabhd/test/tincrepo/main/dml/functional/output/mpp21090_xchange_pttab_dropcol_dml_decimal_opt.sql:29: NOTICE:  Dropping a column that is part of the distribution policy forces a NULL distribution policy
psql:/data/prabhd/test/tincrepo/main/dml/functional/output/mpp21090_xchange_pttab_dropcol_dml_decimal_opt.sql:29: NOTICE:  Dropping a column that is part of the distribution policy forces a NULL distribution policy
ALTER TABLE
-- Create Candidate table for Exchange
DROP TABLE IF EXISTS mpp21090_xchange_pttab_dropcol_dml_decimal_candidate;
psql:/data/prabhd/test/tincrepo/main/dml/functional/output/mpp21090_xchange_pttab_dropcol_dml_decimal_opt.sql:32: NOTICE:  table "mpp21090_xchange_pttab_dropcol_dml_decimal_candidate" does not exist, skipping
DROP TABLE
CREATE TABLE mpp21090_xchange_pttab_dropcol_dml_decimal_candidate( like mpp21090_xchange_pttab_dropcol_dml_decimal) distributed randomly;
CREATE TABLE
INSERT INTO mpp21090_xchange_pttab_dropcol_dml_decimal_candidate VALUES(2.00,'z',1,2.00);
INSERT 0 1
-- Exchange 
ALTER TABLE mpp21090_xchange_pttab_dropcol_dml_decimal EXCHANGE PARTITION FOR(5.00) WITH TABLE mpp21090_xchange_pttab_dropcol_dml_decimal_candidate;
psql:/data/prabhd/test/tincrepo/main/dml/functional/output/mpp21090_xchange_pttab_dropcol_dml_decimal_opt.sql:37: NOTICE:  exchanged partition "partone" of relation "mpp21090_xchange_pttab_dropcol_dml_decimal" with relation "mpp21090_xchange_pttab_dropcol_dml_decimal_candidate"
ALTER TABLE
SELECT * FROM mpp21090_xchange_pttab_dropcol_dml_decimal ORDER BY 1,2,3;
 col2 | col3 | col4 | col5 
------+------+------+------
 2.00 | z    |    1 | 2.00
(1 row)

SELECT * FROM mpp21090_xchange_pttab_dropcol_dml_decimal_candidate ORDER BY 1,2,3;
 col2 | col3 | col4 | col5 
------+------+------+------
 2.00 | a    |    0 | 2.00
(1 row)

-- DML on partition table
INSERT INTO mpp21090_xchange_pttab_dropcol_dml_decimal SELECT  1.00,'b', 1, 1.00;
INSERT 0 1
SELECT * FROM mpp21090_xchange_pttab_dropcol_dml_decimal ORDER BY 1,2,3;
 col2 | col3 | col4 | col5 
------+------+------+------
 1.00 | b    |    1 | 1.00
 2.00 | z    |    1 | 2.00
(2 rows)

UPDATE mpp21090_xchange_pttab_dropcol_dml_decimal SET col5 = 35.00 WHERE col2 = 1.00 AND col5 = 1.00;
UPDATE 1
SELECT * FROM mpp21090_xchange_pttab_dropcol_dml_decimal ORDER BY 1,2,3;
 col2 | col3 | col4 | col5  
------+------+------+-------
 1.00 | b    |    1 | 35.00
 2.00 | z    |    1 |  2.00
(2 rows)

UPDATE mpp21090_xchange_pttab_dropcol_dml_decimal SET col2 =2.00 WHERE col3='b';
UPDATE 1
SELECT * FROM mpp21090_xchange_pttab_dropcol_dml_decimal ORDER BY 1,2,3;
 col2 | col3 | col4 | col5  
------+------+------+-------
 2.00 | b    |    1 | 35.00
 2.00 | z    |    1 |  2.00
(2 rows)

DELETE FROM mpp21090_xchange_pttab_dropcol_dml_decimal WHERE col3='b';
DELETE 1
SELECT * FROM mpp21090_xchange_pttab_dropcol_dml_decimal ORDER BY 1,2,3;
 col2 | col3 | col4 | col5 
------+------+------+------
 2.00 | z    |    1 | 2.00
(1 row)

-- DML on candidate table
INSERT INTO mpp21090_xchange_pttab_dropcol_dml_decimal_candidate SELECT 1.00,'b', 1, 1.00;
INSERT 0 1
SELECT * FROM mpp21090_xchange_pttab_dropcol_dml_decimal_candidate ORDER BY 1,2,3;
 col2 | col3 | col4 | col5 
------+------+------+------
 1.00 | b    |    1 | 1.00
 2.00 | a    |    0 | 2.00
(2 rows)

UPDATE mpp21090_xchange_pttab_dropcol_dml_decimal_candidate SET col2=2.00 WHERE col3='a';
UPDATE 1
SELECT * FROM mpp21090_xchange_pttab_dropcol_dml_decimal_candidate ORDER BY 1,2,3;
 col2 | col3 | col4 | col5 
------+------+------+------
 1.00 | b    |    1 | 1.00
 2.00 | a    |    0 | 2.00
(2 rows)

DELETE FROM mpp21090_xchange_pttab_dropcol_dml_decimal_candidate WHERE col3='a';
DELETE 1
SELECT * FROM mpp21090_xchange_pttab_dropcol_dml_decimal_candidate ORDER BY 1,2,3;
 col2 | col3 | col4 | col5 
------+------+------+------
 1.00 | b    |    1 | 1.00
(1 row)

