DROP TABLE IF EXISTS mpp21090_changedistpolicy_dml_pttab_date;
psql:/data/prabhd/test/tincrepo/main/dml/functional/output/mpp21090_changedistpolicy_dml_pttab_date_opt.sql:14: NOTICE:  table "mpp21090_changedistpolicy_dml_pttab_date" does not exist, skipping
DROP TABLE
CREATE TABLE mpp21090_changedistpolicy_dml_pttab_date
(
    col1 date,
    col2 date,
    col3 char,
    col4 date,
    col5 int
) DISTRIBUTED BY (col1) PARTITION BY RANGE(col2)(partition partone start('2013-12-01') end('2013-12-31') WITH(APPENDONLY=true, COMPRESSLEVEL=5, ORIENTATION=column),partition parttwo start('2013-12-31') end('2014-01-01') WITH (APPENDONLY=true, COMPRESSLEVEL=5, ORIENTATION=row),partition partthree start('2014-01-01') end('2014-02-01'));
psql:/data/prabhd/test/tincrepo/main/dml/functional/output/mpp21090_changedistpolicy_dml_pttab_date_opt.sql:22: NOTICE:  Table doesn't have 'DISTRIBUTED BY' clause -- Using column named 'col1' as the Greenplum Database data distribution key for this table.
HINT:  The 'DISTRIBUTED BY' clause determines the distribution of data. Make sure column(s) chosen are the optimal data distribution key to minimize skew.
psql:/data/prabhd/test/tincrepo/main/dml/functional/output/mpp21090_changedistpolicy_dml_pttab_date_opt.sql:22: NOTICE:  CREATE TABLE will create partition "mpp21090_changedistpolicy_dml_pttab_date_1_prt_partone" for table "mpp21090_changedistpolicy_dml_pttab_date"
psql:/data/prabhd/test/tincrepo/main/dml/functional/output/mpp21090_changedistpolicy_dml_pttab_date_opt.sql:22: NOTICE:  CREATE TABLE will create partition "mpp21090_changedistpolicy_dml_pttab_date_1_prt_parttwo" for table "mpp21090_changedistpolicy_dml_pttab_date"
psql:/data/prabhd/test/tincrepo/main/dml/functional/output/mpp21090_changedistpolicy_dml_pttab_date_opt.sql:22: NOTICE:  CREATE TABLE will create partition "mpp21090_changedistpolicy_dml_pttab_date_1_prt_partthree" for table "mpp21090_changedistpolicy_dml_pttab_date"
CREATE TABLE
INSERT INTO mpp21090_changedistpolicy_dml_pttab_date VALUES('2013-12-30','2013-12-30','a','2013-12-30',0);
INSERT 0 1
SELECT * FROM mpp21090_changedistpolicy_dml_pttab_date ORDER BY 1,2,3,4;
    col1    |    col2    | col3 |    col4    | col5 
------------+------------+------+------------+------
 2013-12-30 | 2013-12-30 | a    | 2013-12-30 |    0
(1 row)

ALTER TABLE mpp21090_changedistpolicy_dml_pttab_date DROP COLUMN col4;
ALTER TABLE
INSERT INTO mpp21090_changedistpolicy_dml_pttab_date VALUES('2013-12-30','2013-12-30','b',1);
INSERT 0 1
SELECT * FROM mpp21090_changedistpolicy_dml_pttab_date ORDER BY 1,2,3,4;
    col1    |    col2    | col3 | col5 
------------+------------+------+------
 2013-12-30 | 2013-12-30 | a    |    0
 2013-12-30 | 2013-12-30 | b    |    1
(2 rows)

ALTER TABLE mpp21090_changedistpolicy_dml_pttab_date SET DISTRIBUTED BY (col3);
ALTER TABLE
INSERT INTO mpp21090_changedistpolicy_dml_pttab_date SELECT '2014-01-01', '2014-01-01','c', 2;
INSERT 0 1
SELECT * FROM mpp21090_changedistpolicy_dml_pttab_date ORDER BY 1,2,3;
    col1    |    col2    | col3 | col5 
------------+------------+------+------
 2013-12-30 | 2013-12-30 | a    |    0
 2013-12-30 | 2013-12-30 | b    |    1
 2014-01-01 | 2014-01-01 | c    |    2
(3 rows)

UPDATE mpp21090_changedistpolicy_dml_pttab_date SET col3 ='c' WHERE col3 ='b';
UPDATE 1
SELECT * FROM mpp21090_changedistpolicy_dml_pttab_date ORDER BY 1,2,3;
    col1    |    col2    | col3 | col5 
------------+------------+------+------
 2013-12-30 | 2013-12-30 | a    |    0
 2013-12-30 | 2013-12-30 | c    |    1
 2014-01-01 | 2014-01-01 | c    |    2
(3 rows)

DELETE FROM mpp21090_changedistpolicy_dml_pttab_date WHERE col3 ='c';
DELETE 2
SELECT * FROM mpp21090_changedistpolicy_dml_pttab_date ORDER BY 1,2,3;
    col1    |    col2    | col3 | col5 
------------+------------+------+------
 2013-12-30 | 2013-12-30 | a    |    0
(1 row)

