DROP TABLE IF EXISTS mpp21090_changedistpolicy_dml_pttab_int8;
psql:/data/prabhd/test/tincrepo/main/dml/functional/output/mpp21090_changedistpolicy_dml_pttab_int8_opt.sql:14: NOTICE:  table "mpp21090_changedistpolicy_dml_pttab_int8" does not exist, skipping
DROP TABLE
CREATE TABLE mpp21090_changedistpolicy_dml_pttab_int8
(
    col1 int8,
    col2 int8,
    col3 char,
    col4 int8,
    col5 int
) DISTRIBUTED BY (col1) PARTITION BY RANGE(col2)(partition partone start(1) end(1000000000000000001)  WITH (APPENDONLY=true, COMPRESSLEVEL=5, ORIENTATION=column),partition parttwo start(1000000000000000001) end(2000000000000000001) WITH (APPENDONLY=true, COMPRESSLEVEL=5, ORIENTATION=row),partition partthree start(2000000000000000001) end(3000000000000000001));
psql:/data/prabhd/test/tincrepo/main/dml/functional/output/mpp21090_changedistpolicy_dml_pttab_int8_opt.sql:22: NOTICE:  CREATE TABLE will create partition "mpp21090_changedistpolicy_dml_pttab_int8_1_prt_partone" for table "mpp21090_changedistpolicy_dml_pttab_int8"
psql:/data/prabhd/test/tincrepo/main/dml/functional/output/mpp21090_changedistpolicy_dml_pttab_int8_opt.sql:22: NOTICE:  CREATE TABLE will create partition "mpp21090_changedistpolicy_dml_pttab_int8_1_prt_parttwo" for table "mpp21090_changedistpolicy_dml_pttab_int8"
psql:/data/prabhd/test/tincrepo/main/dml/functional/output/mpp21090_changedistpolicy_dml_pttab_int8_opt.sql:22: NOTICE:  CREATE TABLE will create partition "mpp21090_changedistpolicy_dml_pttab_int8_1_prt_partthree" for table "mpp21090_changedistpolicy_dml_pttab_int8"
CREATE TABLE
INSERT INTO mpp21090_changedistpolicy_dml_pttab_int8 VALUES(200000000000000000,200000000000000000,'a',200000000000000000,0);
INSERT 0 1
SELECT * FROM mpp21090_changedistpolicy_dml_pttab_int8 ORDER BY 1,2,3,4;
        col1        |        col2        | col3 |        col4        | col5 
--------------------+--------------------+------+--------------------+------
 200000000000000000 | 200000000000000000 | a    | 200000000000000000 |    0
(1 row)

ALTER TABLE mpp21090_changedistpolicy_dml_pttab_int8 DROP COLUMN col4;
ALTER TABLE
INSERT INTO mpp21090_changedistpolicy_dml_pttab_int8 VALUES(200000000000000000,200000000000000000,'b',1);
INSERT 0 1
SELECT * FROM mpp21090_changedistpolicy_dml_pttab_int8 ORDER BY 1,2,3,4;
        col1        |        col2        | col3 | col5 
--------------------+--------------------+------+------
 200000000000000000 | 200000000000000000 | a    |    0
 200000000000000000 | 200000000000000000 | b    |    1
(2 rows)

ALTER TABLE mpp21090_changedistpolicy_dml_pttab_int8 SET DISTRIBUTED BY (col3);
ALTER TABLE
INSERT INTO mpp21090_changedistpolicy_dml_pttab_int8 SELECT 1000000000000000000, 1000000000000000000,'c', 2;
INSERT 0 1
SELECT * FROM mpp21090_changedistpolicy_dml_pttab_int8 ORDER BY 1,2,3;
        col1         |        col2         | col3 | col5 
---------------------+---------------------+------+------
  200000000000000000 |  200000000000000000 | a    |    0
  200000000000000000 |  200000000000000000 | b    |    1
 1000000000000000000 | 1000000000000000000 | c    |    2
(3 rows)

UPDATE mpp21090_changedistpolicy_dml_pttab_int8 SET col3 ='c' WHERE col3 ='b';
UPDATE 1
SELECT * FROM mpp21090_changedistpolicy_dml_pttab_int8 ORDER BY 1,2,3;
        col1         |        col2         | col3 | col5 
---------------------+---------------------+------+------
  200000000000000000 |  200000000000000000 | a    |    0
  200000000000000000 |  200000000000000000 | c    |    1
 1000000000000000000 | 1000000000000000000 | c    |    2
(3 rows)

DELETE FROM mpp21090_changedistpolicy_dml_pttab_int8 WHERE col3 ='c';
DELETE 2
SELECT * FROM mpp21090_changedistpolicy_dml_pttab_int8 ORDER BY 1,2,3;
        col1        |        col2        | col3 | col5 
--------------------+--------------------+------+------
 200000000000000000 | 200000000000000000 | a    |    0
(1 row)

