DROP TABLE IF EXISTS mpp21090_pttab_dropfirstcol_addpt_interval;
psql:/data/prabhd/test/tincrepo/main/dml/functional/output/mpp21090_pttab_dropfirstcol_addpt_interval_opt.sql:14: NOTICE:  table "mpp21090_pttab_dropfirstcol_addpt_interval" does not exist, skipping
DROP TABLE
CREATE TABLE mpp21090_pttab_dropfirstcol_addpt_interval
(
    col1 interval,
    col2 interval,
    col3 char,
    col4 interval,
    col5 int
) 
DISTRIBUTED by (col1)
PARTITION BY RANGE(col2)(partition partone start('1 sec') end('1 min')  WITH (APPENDONLY=true, COMPRESSLEVEL=5, ORIENTATION=column),partition parttwo start('1 min') end('1 hour') WITH (APPENDONLY=true, COMPRESSLEVEL=5, ORIENTATION=row),partition partthree start('1 hour') end('12 hours'));
psql:/data/prabhd/test/tincrepo/main/dml/functional/output/mpp21090_pttab_dropfirstcol_addpt_interval_opt.sql:24: NOTICE:  CREATE TABLE will create partition "mpp21090_pttab_dropfirstcol_addpt_interval_1_prt_partone" for table "mpp21090_pttab_dropfirstcol_addpt_interval"
psql:/data/prabhd/test/tincrepo/main/dml/functional/output/mpp21090_pttab_dropfirstcol_addpt_interval_opt.sql:24: NOTICE:  CREATE TABLE will create partition "mpp21090_pttab_dropfirstcol_addpt_interval_1_prt_parttwo" for table "mpp21090_pttab_dropfirstcol_addpt_interval"
psql:/data/prabhd/test/tincrepo/main/dml/functional/output/mpp21090_pttab_dropfirstcol_addpt_interval_opt.sql:24: NOTICE:  CREATE TABLE will create partition "mpp21090_pttab_dropfirstcol_addpt_interval_1_prt_partthree" for table "mpp21090_pttab_dropfirstcol_addpt_interval"
CREATE TABLE
INSERT INTO mpp21090_pttab_dropfirstcol_addpt_interval VALUES('1 hour','1 hour','a','1 hour',0);
INSERT 0 1
ALTER TABLE mpp21090_pttab_dropfirstcol_addpt_interval DROP COLUMN col1;
psql:/data/prabhd/test/tincrepo/main/dml/functional/output/mpp21090_pttab_dropfirstcol_addpt_interval_opt.sql:28: NOTICE:  Dropping a column that is part of the distribution policy forces a NULL distribution policy
psql:/data/prabhd/test/tincrepo/main/dml/functional/output/mpp21090_pttab_dropfirstcol_addpt_interval_opt.sql:28: NOTICE:  Dropping a column that is part of the distribution policy forces a NULL distribution policy
psql:/data/prabhd/test/tincrepo/main/dml/functional/output/mpp21090_pttab_dropfirstcol_addpt_interval_opt.sql:28: NOTICE:  Dropping a column that is part of the distribution policy forces a NULL distribution policy
psql:/data/prabhd/test/tincrepo/main/dml/functional/output/mpp21090_pttab_dropfirstcol_addpt_interval_opt.sql:28: NOTICE:  Dropping a column that is part of the distribution policy forces a NULL distribution policy
ALTER TABLE
ALTER TABLE mpp21090_pttab_dropfirstcol_addpt_interval ADD PARTITION partfour start('12 hours') end('1 day') inclusive;
psql:/data/prabhd/test/tincrepo/main/dml/functional/output/mpp21090_pttab_dropfirstcol_addpt_interval_opt.sql:29: NOTICE:  CREATE TABLE will create partition "mpp21090_pttab_dropfirstcol_addpt_interval_1_prt_partfour" for table "mpp21090_pttab_dropfirstcol_addpt_interval"
ALTER TABLE
INSERT INTO mpp21090_pttab_dropfirstcol_addpt_interval SELECT '14 hours','b','14 hours', 1;
INSERT 0 1
SELECT * FROM mpp21090_pttab_dropfirstcol_addpt_interval ORDER BY 1,2,3;
   col2   | col3 |   col4   | col5 
----------+------+----------+------
 01:00:00 | a    | 01:00:00 |    0
 14:00:00 | b    | 14:00:00 |    1
(2 rows)

UPDATE mpp21090_pttab_dropfirstcol_addpt_interval SET col4 = '12 hours' WHERE col2 = '14 hours' AND col4 = '14 hours';
UPDATE 1
SELECT * FROM mpp21090_pttab_dropfirstcol_addpt_interval ORDER BY 1,2,3;
   col2   | col3 |   col4   | col5 
----------+------+----------+------
 01:00:00 | a    | 01:00:00 |    0
 14:00:00 | b    | 12:00:00 |    1
(2 rows)

-- Update partition key
UPDATE mpp21090_pttab_dropfirstcol_addpt_interval SET col2 = '12 hours' WHERE col2 = '14 hours' AND col4 = '12 hours';
UPDATE 1
SELECT * FROM mpp21090_pttab_dropfirstcol_addpt_interval ORDER BY 1,2,3;
   col2   | col3 |   col4   | col5 
----------+------+----------+------
 01:00:00 | a    | 01:00:00 |    0
 12:00:00 | b    | 12:00:00 |    1
(2 rows)

DELETE FROM mpp21090_pttab_dropfirstcol_addpt_interval WHERE col2 = '12 hours';
DELETE 1
SELECT * FROM mpp21090_pttab_dropfirstcol_addpt_interval ORDER BY 1,2,3;
   col2   | col3 |   col4   | col5 
----------+------+----------+------
 01:00:00 | a    | 01:00:00 |    0
(1 row)

