DROP TABLE IF EXISTS mpp21090_pttab_addpt_dropcol_addcol_dml_text;
psql:/data/prabhd/test/tincrepo/main/dml/functional/output/mpp21090_pttab_addpt_dropcol_addcol_dml_text_opt.sql:14: NOTICE:  table "mpp21090_pttab_addpt_dropcol_addcol_dml_text" does not exist, skipping
DROP TABLE
CREATE TABLE mpp21090_pttab_addpt_dropcol_addcol_dml_text
(
    col1 text,
    col2 text,
    col3 char,
    col4 int
) 
DISTRIBUTED by (col1)
PARTITION BY LIST(col2)(partition partone VALUES('abcdefghijklmnop') WITH (APPENDONLY=true, COMPRESSLEVEL=5, ORIENTATION=column),partition parttwo VALUES('qrstuvwxyz') WITH (APPENDONLY=true, COMPRESSLEVEL=5, ORIENTATION=row),partition partthree VALUES('ghi'));
psql:/data/prabhd/test/tincrepo/main/dml/functional/output/mpp21090_pttab_addpt_dropcol_addcol_dml_text_opt.sql:23: NOTICE:  CREATE TABLE will create partition "mpp21090_pttab_addpt_dropcol_addcol_dml_text_1_prt_partone" for table "mpp21090_pttab_addpt_dropcol_addcol_dml_text"
psql:/data/prabhd/test/tincrepo/main/dml/functional/output/mpp21090_pttab_addpt_dropcol_addcol_dml_text_opt.sql:23: NOTICE:  CREATE TABLE will create partition "mpp21090_pttab_addpt_dropcol_addcol_dml_text_1_prt_parttwo" for table "mpp21090_pttab_addpt_dropcol_addcol_dml_text"
psql:/data/prabhd/test/tincrepo/main/dml/functional/output/mpp21090_pttab_addpt_dropcol_addcol_dml_text_opt.sql:23: NOTICE:  CREATE TABLE will create partition "mpp21090_pttab_addpt_dropcol_addcol_dml_text_1_prt_partthree" for table "mpp21090_pttab_addpt_dropcol_addcol_dml_text"
CREATE TABLE
INSERT INTO mpp21090_pttab_addpt_dropcol_addcol_dml_text VALUES('abcdefghijklmnop','abcdefghijklmnop','a',0);
INSERT 0 1
ALTER TABLE mpp21090_pttab_addpt_dropcol_addcol_dml_text ADD PARTITION partfour VALUES('xyz');
psql:/data/prabhd/test/tincrepo/main/dml/functional/output/mpp21090_pttab_addpt_dropcol_addcol_dml_text_opt.sql:27: NOTICE:  CREATE TABLE will create partition "mpp21090_pttab_addpt_dropcol_addcol_dml_text_1_prt_partfour" for table "mpp21090_pttab_addpt_dropcol_addcol_dml_text"
ALTER TABLE
INSERT INTO mpp21090_pttab_addpt_dropcol_addcol_dml_text SELECT 'xyz','xyz','b',1;
INSERT 0 1
SELECT * FROM mpp21090_pttab_addpt_dropcol_addcol_dml_text ORDER BY 1,2,3;
       col1       |       col2       | col3 | col4 
------------------+------------------+------+------
 abcdefghijklmnop | abcdefghijklmnop | a    |    0
 xyz              | xyz              | b    |    1
(2 rows)

ALTER TABLE mpp21090_pttab_addpt_dropcol_addcol_dml_text DROP COLUMN col1;
psql:/data/prabhd/test/tincrepo/main/dml/functional/output/mpp21090_pttab_addpt_dropcol_addcol_dml_text_opt.sql:32: NOTICE:  Dropping a column that is part of the distribution policy forces a NULL distribution policy
psql:/data/prabhd/test/tincrepo/main/dml/functional/output/mpp21090_pttab_addpt_dropcol_addcol_dml_text_opt.sql:32: NOTICE:  Dropping a column that is part of the distribution policy forces a NULL distribution policy
psql:/data/prabhd/test/tincrepo/main/dml/functional/output/mpp21090_pttab_addpt_dropcol_addcol_dml_text_opt.sql:32: NOTICE:  Dropping a column that is part of the distribution policy forces a NULL distribution policy
psql:/data/prabhd/test/tincrepo/main/dml/functional/output/mpp21090_pttab_addpt_dropcol_addcol_dml_text_opt.sql:32: NOTICE:  Dropping a column that is part of the distribution policy forces a NULL distribution policy
psql:/data/prabhd/test/tincrepo/main/dml/functional/output/mpp21090_pttab_addpt_dropcol_addcol_dml_text_opt.sql:32: NOTICE:  Dropping a column that is part of the distribution policy forces a NULL distribution policy
ALTER TABLE
INSERT INTO mpp21090_pttab_addpt_dropcol_addcol_dml_text SELECT 'xyz','c',1;
INSERT 0 1
SELECT * FROM mpp21090_pttab_addpt_dropcol_addcol_dml_text ORDER BY 1,2,3;
       col2       | col3 | col4 
------------------+------+------
 abcdefghijklmnop | a    |    0
 xyz              | b    |    1
 xyz              | c    |    1
(3 rows)

ALTER TABLE mpp21090_pttab_addpt_dropcol_addcol_dml_text ADD COLUMN col5 text DEFAULT 'abcdefghijklmnop';
ALTER TABLE
INSERT INTO mpp21090_pttab_addpt_dropcol_addcol_dml_text SELECT 'xyz','d',1,'xyz';
INSERT 0 1
SELECT * FROM mpp21090_pttab_addpt_dropcol_addcol_dml_text ORDER BY 1,2,3;
       col2       | col3 | col4 |       col5       
------------------+------+------+------------------
 abcdefghijklmnop | a    |    0 | abcdefghijklmnop
 xyz              | b    |    1 | abcdefghijklmnop
 xyz              | c    |    1 | abcdefghijklmnop
 xyz              | d    |    1 | xyz
(4 rows)

UPDATE mpp21090_pttab_addpt_dropcol_addcol_dml_text SET col4 = 10 WHERE col2 = 'xyz';
UPDATE 3
SELECT * FROM mpp21090_pttab_addpt_dropcol_addcol_dml_text ORDER BY 1,2,3;
       col2       | col3 | col4 |       col5       
------------------+------+------+------------------
 abcdefghijklmnop | a    |    0 | abcdefghijklmnop
 xyz              | b    |   10 | abcdefghijklmnop
 xyz              | c    |   10 | abcdefghijklmnop
 xyz              | d    |   10 | xyz
(4 rows)

-- Update partition key
UPDATE mpp21090_pttab_addpt_dropcol_addcol_dml_text SET col2 = 'qrstuvwxyz' WHERE col2 = 'xyz';
UPDATE 3
SELECT * FROM mpp21090_pttab_addpt_dropcol_addcol_dml_text ORDER BY 1,2,3;
       col2       | col3 | col4 |       col5       
------------------+------+------+------------------
 abcdefghijklmnop | a    |    0 | abcdefghijklmnop
 qrstuvwxyz       | b    |   10 | abcdefghijklmnop
 qrstuvwxyz       | c    |   10 | abcdefghijklmnop
 qrstuvwxyz       | d    |   10 | xyz
(4 rows)

DELETE FROM mpp21090_pttab_addpt_dropcol_addcol_dml_text WHERE col2 = 'qrstuvwxyz';
DELETE 3
SELECT * FROM mpp21090_pttab_addpt_dropcol_addcol_dml_text ORDER BY 1,2,3;
       col2       | col3 | col4 |       col5       
------------------+------+------+------------------
 abcdefghijklmnop | a    |    0 | abcdefghijklmnop
(1 row)

