DROP TABLE IF EXISTS mpp21090_dropcol_splitdefpt_addcol_dml_interval;
psql:/data/prabhd/test/tincrepo/main/dml/functional/output/mpp21090_dropcol_splitdefpt_addcol_dml_interval_opt.sql:14: NOTICE:  table "mpp21090_dropcol_splitdefpt_addcol_dml_interval" does not exist, skipping
DROP TABLE
CREATE TABLE mpp21090_dropcol_splitdefpt_addcol_dml_interval
(
    col1 interval,
    col2 interval,
    col3 char,
    col4 interval
) 
DISTRIBUTED by (col1)
PARTITION BY LIST(col2)
(
default partition def
);
psql:/data/prabhd/test/tincrepo/main/dml/functional/output/mpp21090_dropcol_splitdefpt_addcol_dml_interval_opt.sql:26: NOTICE:  CREATE TABLE will create partition "mpp21090_dropcol_splitdefpt_addcol_dml_interval_1_prt_def" for table "mpp21090_dropcol_splitdefpt_addcol_dml_interval"
CREATE TABLE
INSERT INTO mpp21090_dropcol_splitdefpt_addcol_dml_interval VALUES('1 hour','1 hour','a','1 hour');
INSERT 0 1
SELECT * FROM mpp21090_dropcol_splitdefpt_addcol_dml_interval ORDER BY 1,2,3,4;
   col1   |   col2   | col3 |   col4   
----------+----------+------+----------
 01:00:00 | 01:00:00 | a    | 01:00:00
(1 row)

ALTER TABLE mpp21090_dropcol_splitdefpt_addcol_dml_interval DROP COLUMN col4;
ALTER TABLE
INSERT INTO mpp21090_dropcol_splitdefpt_addcol_dml_interval VALUES('1 hour','1 hour','b');
INSERT 0 1
SELECT * FROM mpp21090_dropcol_splitdefpt_addcol_dml_interval ORDER BY 1,2,3;
   col1   |   col2   | col3 
----------+----------+------
 01:00:00 | 01:00:00 | a
 01:00:00 | 01:00:00 | b
(2 rows)

ALTER TABLE mpp21090_dropcol_splitdefpt_addcol_dml_interval SPLIT DEFAULT PARTITION at ('30 secs') into (partition partsplitone,partition def);
psql:/data/prabhd/test/tincrepo/main/dml/functional/output/mpp21090_dropcol_splitdefpt_addcol_dml_interval_opt.sql:36: NOTICE:  exchanged partition "def" of relation "mpp21090_dropcol_splitdefpt_addcol_dml_interval" with relation "pg_temp_62250"
psql:/data/prabhd/test/tincrepo/main/dml/functional/output/mpp21090_dropcol_splitdefpt_addcol_dml_interval_opt.sql:36: NOTICE:  dropped partition "def" for relation "mpp21090_dropcol_splitdefpt_addcol_dml_interval"
psql:/data/prabhd/test/tincrepo/main/dml/functional/output/mpp21090_dropcol_splitdefpt_addcol_dml_interval_opt.sql:36: NOTICE:  CREATE TABLE will create partition "mpp21090_dropcol_splitdefpt_addcol_dml_inter_1_prt_partsplitone" for table "mpp21090_dropcol_splitdefpt_addcol_dml_interval"
psql:/data/prabhd/test/tincrepo/main/dml/functional/output/mpp21090_dropcol_splitdefpt_addcol_dml_interval_opt.sql:36: NOTICE:  CREATE TABLE will create partition "mpp21090_dropcol_splitdefpt_addcol_dml_interval_1_prt_def" for table "mpp21090_dropcol_splitdefpt_addcol_dml_interval"
ALTER TABLE
INSERT INTO mpp21090_dropcol_splitdefpt_addcol_dml_interval SELECT '1 sec', '1 sec','e';
INSERT 0 1
SELECT * FROM mpp21090_dropcol_splitdefpt_addcol_dml_interval ORDER BY 1,2,3;
   col1   |   col2   | col3 
----------+----------+------
 00:00:01 | 00:00:01 | e
 01:00:00 | 01:00:00 | a
 01:00:00 | 01:00:00 | b
(3 rows)

ALTER TABLE mpp21090_dropcol_splitdefpt_addcol_dml_interval ADD COLUMN col5 interval DEFAULT '1 hour';
ALTER TABLE
INSERT INTO mpp21090_dropcol_splitdefpt_addcol_dml_interval VALUES('1 hour','1 hour','c','1 hour');
INSERT 0 1
SELECT * FROM mpp21090_dropcol_splitdefpt_addcol_dml_interval ORDER BY 1,2,3,4;
   col1   |   col2   | col3 |   col5   
----------+----------+------+----------
 00:00:01 | 00:00:01 | e    | 01:00:00
 01:00:00 | 01:00:00 | a    | 01:00:00
 01:00:00 | 01:00:00 | b    | 01:00:00
 01:00:00 | 01:00:00 | c    | 01:00:00
(4 rows)

-- Update distribution key
UPDATE mpp21090_dropcol_splitdefpt_addcol_dml_interval SET col1 = '14 hours' WHERE col2 = '1 sec' AND col1 = '1 sec';
UPDATE 1
SELECT * FROM mpp21090_dropcol_splitdefpt_addcol_dml_interval ORDER BY 1,2,3;
   col1   |   col2   | col3 |   col5   
----------+----------+------+----------
 01:00:00 | 01:00:00 | a    | 01:00:00
 01:00:00 | 01:00:00 | b    | 01:00:00
 01:00:00 | 01:00:00 | c    | 01:00:00
 14:00:00 | 00:00:01 | e    | 01:00:00
(4 rows)

-- Update partition key
UPDATE mpp21090_dropcol_splitdefpt_addcol_dml_interval SET col2 = '14 hours' WHERE col2 = '1 sec' AND col1 = '14 hours';
UPDATE 1
SELECT * FROM mpp21090_dropcol_splitdefpt_addcol_dml_interval ORDER BY 1,2,3;
   col1   |   col2   | col3 |   col5   
----------+----------+------+----------
 01:00:00 | 01:00:00 | a    | 01:00:00
 01:00:00 | 01:00:00 | b    | 01:00:00
 01:00:00 | 01:00:00 | c    | 01:00:00
 14:00:00 | 14:00:00 | e    | 01:00:00
(4 rows)

DELETE FROM mpp21090_dropcol_splitdefpt_addcol_dml_interval WHERE col3='b';
DELETE 1
SELECT * FROM mpp21090_dropcol_splitdefpt_addcol_dml_interval ORDER BY 1,2,3;
   col1   |   col2   | col3 |   col5   
----------+----------+------+----------
 01:00:00 | 01:00:00 | a    | 01:00:00
 01:00:00 | 01:00:00 | c    | 01:00:00
 14:00:00 | 14:00:00 | e    | 01:00:00
(3 rows)

