DROP TABLE IF EXISTS mpp21090_pttab_dropcol_addcol_addpt_dml_text;
psql:/data/prabhd/test/tincrepo/main/dml/functional/output/mpp21090_pttab_dropcol_addcol_addpt_dml_text_opt.sql:14: NOTICE:  table "mpp21090_pttab_dropcol_addcol_addpt_dml_text" does not exist, skipping
DROP TABLE
CREATE TABLE mpp21090_pttab_dropcol_addcol_addpt_dml_text
(
    col1 text,
    col2 text,
    col3 char,
    col4 int
) 
DISTRIBUTED by (col1)
PARTITION BY LIST(col2)(partition partone VALUES('abcdefghijklmnop') WITH (APPENDONLY=true, COMPRESSLEVEL=5, ORIENTATION=column),partition parttwo VALUES('qrstuvwxyz') WITH (APPENDONLY=true, COMPRESSLEVEL=5, ORIENTATION=row),partition partthree VALUES('ghi'));
psql:/data/prabhd/test/tincrepo/main/dml/functional/output/mpp21090_pttab_dropcol_addcol_addpt_dml_text_opt.sql:23: NOTICE:  CREATE TABLE will create partition "mpp21090_pttab_dropcol_addcol_addpt_dml_text_1_prt_partone" for table "mpp21090_pttab_dropcol_addcol_addpt_dml_text"
psql:/data/prabhd/test/tincrepo/main/dml/functional/output/mpp21090_pttab_dropcol_addcol_addpt_dml_text_opt.sql:23: NOTICE:  CREATE TABLE will create partition "mpp21090_pttab_dropcol_addcol_addpt_dml_text_1_prt_parttwo" for table "mpp21090_pttab_dropcol_addcol_addpt_dml_text"
psql:/data/prabhd/test/tincrepo/main/dml/functional/output/mpp21090_pttab_dropcol_addcol_addpt_dml_text_opt.sql:23: NOTICE:  CREATE TABLE will create partition "mpp21090_pttab_dropcol_addcol_addpt_dml_text_1_prt_partthree" for table "mpp21090_pttab_dropcol_addcol_addpt_dml_text"
CREATE TABLE
INSERT INTO mpp21090_pttab_dropcol_addcol_addpt_dml_text VALUES('abcdefghijklmnop','abcdefghijklmnop','a',0);
INSERT 0 1
ALTER TABLE mpp21090_pttab_dropcol_addcol_addpt_dml_text DROP COLUMN col4;
ALTER TABLE
INSERT INTO mpp21090_pttab_dropcol_addcol_addpt_dml_text VALUES('abcdefghijklmnop','abcdefghijklmnop','b');
INSERT 0 1
ALTER TABLE mpp21090_pttab_dropcol_addcol_addpt_dml_text ADD COLUMN col5 text DEFAULT 'abcdefghijklmnop';
ALTER TABLE
INSERT INTO mpp21090_pttab_dropcol_addcol_addpt_dml_text SELECT 'abcdefghijklmnop','abcdefghijklmnop','c','abcdefghijklmnop';
INSERT 0 1
SELECT * FROM mpp21090_pttab_dropcol_addcol_addpt_dml_text ORDER BY 1,2,3;
       col1       |       col2       | col3 |       col5       
------------------+------------------+------+------------------
 abcdefghijklmnop | abcdefghijklmnop | a    | abcdefghijklmnop
 abcdefghijklmnop | abcdefghijklmnop | b    | abcdefghijklmnop
 abcdefghijklmnop | abcdefghijklmnop | c    | abcdefghijklmnop
(3 rows)

UPDATE mpp21090_pttab_dropcol_addcol_addpt_dml_text SET col5 = 'qrstuvwxyz' WHERE col2 = 'abcdefghijklmnop' AND col1 = 'abcdefghijklmnop';
UPDATE 3
SELECT * FROM mpp21090_pttab_dropcol_addcol_addpt_dml_text ORDER BY 1,2,3;
       col1       |       col2       | col3 |    col5    
------------------+------------------+------+------------
 abcdefghijklmnop | abcdefghijklmnop | a    | qrstuvwxyz
 abcdefghijklmnop | abcdefghijklmnop | b    | qrstuvwxyz
 abcdefghijklmnop | abcdefghijklmnop | c    | qrstuvwxyz
(3 rows)

DELETE FROM mpp21090_pttab_dropcol_addcol_addpt_dml_text WHERE col5 = 'qrstuvwxyz';
DELETE 3
SELECT * FROM mpp21090_pttab_dropcol_addcol_addpt_dml_text ORDER BY 1,2,3;
 col1 | col2 | col3 | col5 
------+------+------+------
(0 rows)

ALTER TABLE mpp21090_pttab_dropcol_addcol_addpt_dml_text ADD PARTITION partfour VALUES('xyz');
psql:/data/prabhd/test/tincrepo/main/dml/functional/output/mpp21090_pttab_dropcol_addcol_addpt_dml_text_opt.sql:41: NOTICE:  CREATE TABLE will create partition "mpp21090_pttab_dropcol_addcol_addpt_dml_text_1_prt_partfour" for table "mpp21090_pttab_dropcol_addcol_addpt_dml_text"
ALTER TABLE
ALTER TABLE mpp21090_pttab_dropcol_addcol_addpt_dml_text ADD DEFAULT partition def;
psql:/data/prabhd/test/tincrepo/main/dml/functional/output/mpp21090_pttab_dropcol_addcol_addpt_dml_text_opt.sql:42: NOTICE:  CREATE TABLE will create partition "mpp21090_pttab_dropcol_addcol_addpt_dml_text_1_prt_def" for table "mpp21090_pttab_dropcol_addcol_addpt_dml_text"
ALTER TABLE
INSERT INTO mpp21090_pttab_dropcol_addcol_addpt_dml_text SELECT 'xyz','xyz','d','xyz';
INSERT 0 1
SELECT * FROM mpp21090_pttab_dropcol_addcol_addpt_dml_text ORDER BY 1,2,3;
 col1 | col2 | col3 | col5 
------+------+------+------
 xyz  | xyz  | d    | xyz
(1 row)

UPDATE mpp21090_pttab_dropcol_addcol_addpt_dml_text SET col5 = 'qrstuvwxyz' WHERE col2 = 'xyz' AND col3 ='d';
UPDATE 1
SELECT * FROM mpp21090_pttab_dropcol_addcol_addpt_dml_text ORDER BY 1,2,3;
 col1 | col2 | col3 |    col5    
------+------+------+------------
 xyz  | xyz  | d    | qrstuvwxyz
(1 row)

-- Update partition key
UPDATE mpp21090_pttab_dropcol_addcol_addpt_dml_text SET col2 = 'qrstuvwxyz' WHERE col2 = 'xyz' AND col3 ='d';
UPDATE 1
SELECT * FROM mpp21090_pttab_dropcol_addcol_addpt_dml_text ORDER BY 1,2,3;
 col1 |    col2    | col3 |    col5    
------+------------+------+------------
 xyz  | qrstuvwxyz | d    | qrstuvwxyz
(1 row)

DELETE FROM mpp21090_pttab_dropcol_addcol_addpt_dml_text WHERE col5 = 'qrstuvwxyz';
DELETE 1
SELECT * FROM mpp21090_pttab_dropcol_addcol_addpt_dml_text ORDER BY 1,2,3;
 col1 | col2 | col3 | col5 
------+------+------+------
(0 rows)

