DROP TABLE IF EXISTS mpp21090_drop_multicol_dml_decimal;
DROP TABLE
CREATE TABLE mpp21090_drop_multicol_dml_decimal(
col1 decimal,
col2 decimal,
col3 char,
col4 date,
col5 int
)  DISTRIBUTED by (col3);
CREATE TABLE
INSERT INTO mpp21090_drop_multicol_dml_decimal VALUES(2.00,0.00,'a','2014-01-01',0);
INSERT 0 1
SELECT * FROM mpp21090_drop_multicol_dml_decimal ORDER BY 1,2,3,4;
 col1 | col2 | col3 |    col4    | col5 
------+------+------+------------+------
 2.00 | 0.00 | a    | 2014-01-01 |    0
(1 row)

ALTER TABLE mpp21090_drop_multicol_dml_decimal DROP COLUMN col1;
ALTER TABLE
ALTER TABLE mpp21090_drop_multicol_dml_decimal DROP COLUMN col4;
ALTER TABLE
INSERT INTO mpp21090_drop_multicol_dml_decimal SELECT 1.00,'b',1;
INSERT 0 1
SELECT * FROM mpp21090_drop_multicol_dml_decimal ORDER BY 1,2,3;
 col2 | col3 | col5 
------+------+------
 0.00 | a    |    0
 1.00 | b    |    1
(2 rows)

UPDATE mpp21090_drop_multicol_dml_decimal SET col3='c' WHERE col3 = 'b' AND col5 = 1;
UPDATE 1
SELECT * FROM mpp21090_drop_multicol_dml_decimal ORDER BY 1,2,3;
 col2 | col3 | col5 
------+------+------
 0.00 | a    |    0
 1.00 | c    |    1
(2 rows)

DELETE FROM mpp21090_drop_multicol_dml_decimal WHERE col3='c';
DELETE 1
SELECT * FROM mpp21090_drop_multicol_dml_decimal ORDER BY 1,2,3;
 col2 | col3 | col5 
------+------+------
 0.00 | a    |    0
(1 row)

