DROP TABLE IF EXISTS mpp21090_xchange_pttab_dropcol_idx_dml_timestamp;
psql:/data/prabhd/test/tincrepo/main/dml/functional/output/mpp21090_xchange_pttab_dropcol_idx_dml_timestamp_opt.sql:14: NOTICE:  table "mpp21090_xchange_pttab_dropcol_idx_dml_timestamp" does not exist, skipping
DROP TABLE
CREATE TABLE mpp21090_xchange_pttab_dropcol_idx_dml_timestamp
(
    col1 timestamp,
    col2 timestamp,
    col3 char,
    col4 int,
    col5 timestamp
) 
DISTRIBUTED by (col1)
PARTITION BY RANGE(col2)(partition partone start('2013-12-01 12:00:00') end('2013-12-31 12:00:00') WITH(APPENDONLY=true, COMPRESSLEVEL=5, ORIENTATION=column),partition parttwo start('2013-12-31 12:00:00') end('2014-01-01 12:00:00') inclusive WITH (APPENDONLY=true, COMPRESSLEVEL=5, ORIENTATION=row),partition partthree start('2014-01-02 12:00:00') end('2014-02-01 12:00:00'));
psql:/data/prabhd/test/tincrepo/main/dml/functional/output/mpp21090_xchange_pttab_dropcol_idx_dml_timestamp_opt.sql:24: NOTICE:  CREATE TABLE will create partition "mpp21090_xchange_pttab_dropcol_idx_dml_timestamp_1_prt_partone" for table "mpp21090_xchange_pttab_dropcol_idx_dml_timestamp"
psql:/data/prabhd/test/tincrepo/main/dml/functional/output/mpp21090_xchange_pttab_dropcol_idx_dml_timestamp_opt.sql:24: NOTICE:  CREATE TABLE will create partition "mpp21090_xchange_pttab_dropcol_idx_dml_timestamp_1_prt_parttwo" for table "mpp21090_xchange_pttab_dropcol_idx_dml_timestamp"
psql:/data/prabhd/test/tincrepo/main/dml/functional/output/mpp21090_xchange_pttab_dropcol_idx_dml_timestamp_opt.sql:24: NOTICE:  CREATE TABLE will create partition "mpp21090_xchange_pttab_dropcol_idx_dml_timestam_1_prt_partthree" for table "mpp21090_xchange_pttab_dropcol_idx_dml_timestamp"
CREATE TABLE
INSERT INTO mpp21090_xchange_pttab_dropcol_idx_dml_timestamp VALUES('2013-12-30 12:00:00','2013-12-30 12:00:00','a',0, '2013-12-30 12:00:00');
INSERT 0 1
SELECT * FROM mpp21090_xchange_pttab_dropcol_idx_dml_timestamp ORDER BY 1,2,3,4;
        col1         |        col2         | col3 | col4 |        col5         
---------------------+---------------------+------+------+---------------------
 2013-12-30 12:00:00 | 2013-12-30 12:00:00 | a    |    0 | 2013-12-30 12:00:00
(1 row)

DROP INDEX IF EXISTS mpp21090_xchange_pttab_dropcol_idx_dml_idx_timestamp;
psql:/data/prabhd/test/tincrepo/main/dml/functional/output/mpp21090_xchange_pttab_dropcol_idx_dml_timestamp_opt.sql:29: NOTICE:  index "mpp21090_xchange_pttab_dropcol_idx_dml_idx_timestamp" does not exist, skipping
DROP INDEX
CREATE INDEX mpp21090_xchange_pttab_dropcol_idx_dml_idx_timestamp on mpp21090_xchange_pttab_dropcol_idx_dml_timestamp(col2);
psql:/data/prabhd/test/tincrepo/main/dml/functional/output/mpp21090_xchange_pttab_dropcol_idx_dml_timestamp_opt.sql:30: NOTICE:  building index for child partition "mpp21090_xchange_pttab_dropcol_idx_dml_timestamp_1_prt_partone"
psql:/data/prabhd/test/tincrepo/main/dml/functional/output/mpp21090_xchange_pttab_dropcol_idx_dml_timestamp_opt.sql:30: NOTICE:  building index for child partition "mpp21090_xchange_pttab_dropcol_idx_dml_timestamp_1_prt_parttwo"
psql:/data/prabhd/test/tincrepo/main/dml/functional/output/mpp21090_xchange_pttab_dropcol_idx_dml_timestamp_opt.sql:30: NOTICE:  building index for child partition "mpp21090_xchange_pttab_dropcol_idx_dml_timestam_1_prt_partthree"
CREATE INDEX
ALTER TABLE mpp21090_xchange_pttab_dropcol_idx_dml_timestamp DROP COLUMN col1;
psql:/data/prabhd/test/tincrepo/main/dml/functional/output/mpp21090_xchange_pttab_dropcol_idx_dml_timestamp_opt.sql:32: NOTICE:  Dropping a column that is part of the distribution policy forces a NULL distribution policy
psql:/data/prabhd/test/tincrepo/main/dml/functional/output/mpp21090_xchange_pttab_dropcol_idx_dml_timestamp_opt.sql:32: NOTICE:  Dropping a column that is part of the distribution policy forces a NULL distribution policy
psql:/data/prabhd/test/tincrepo/main/dml/functional/output/mpp21090_xchange_pttab_dropcol_idx_dml_timestamp_opt.sql:32: NOTICE:  Dropping a column that is part of the distribution policy forces a NULL distribution policy
psql:/data/prabhd/test/tincrepo/main/dml/functional/output/mpp21090_xchange_pttab_dropcol_idx_dml_timestamp_opt.sql:32: NOTICE:  Dropping a column that is part of the distribution policy forces a NULL distribution policy
ALTER TABLE
-- Create Candidate table for Exchange
DROP TABLE IF EXISTS mpp21090_xchange_pttab_dropcol_idx_dml_timestamp_candidate;
psql:/data/prabhd/test/tincrepo/main/dml/functional/output/mpp21090_xchange_pttab_dropcol_idx_dml_timestamp_opt.sql:35: NOTICE:  table "mpp21090_xchange_pttab_dropcol_idx_dml_timestamp_candidate" does not exist, skipping
DROP TABLE
CREATE TABLE mpp21090_xchange_pttab_dropcol_idx_dml_timestamp_candidate( like mpp21090_xchange_pttab_dropcol_idx_dml_timestamp) distributed randomly;
CREATE TABLE
INSERT INTO mpp21090_xchange_pttab_dropcol_idx_dml_timestamp_candidate VALUES('2013-12-30 12:00:00','z',1,'2013-12-30 12:00:00');
INSERT 0 1
-- Exchange 
ALTER TABLE mpp21090_xchange_pttab_dropcol_idx_dml_timestamp EXCHANGE PARTITION FOR('2013-12-15 12:00:00') WITH TABLE mpp21090_xchange_pttab_dropcol_idx_dml_timestamp_candidate;
psql:/data/prabhd/test/tincrepo/main/dml/functional/output/mpp21090_xchange_pttab_dropcol_idx_dml_timestamp_opt.sql:40: NOTICE:  exchanged partition "partone" of relation "mpp21090_xchange_pttab_dropcol_idx_dml_timestamp" with relation "mpp21090_xchange_pttab_dropcol_idx_dml_timestamp_candidate"
ALTER TABLE
SELECT * FROM mpp21090_xchange_pttab_dropcol_idx_dml_timestamp ORDER BY 1,2,3;
        col2         | col3 | col4 |        col5         
---------------------+------+------+---------------------
 2013-12-30 12:00:00 | z    |    1 | 2013-12-30 12:00:00
(1 row)

SELECT * FROM mpp21090_xchange_pttab_dropcol_idx_dml_timestamp_candidate ORDER BY 1,2,3;
        col2         | col3 | col4 |        col5         
---------------------+------+------+---------------------
 2013-12-30 12:00:00 | a    |    0 | 2013-12-30 12:00:00
(1 row)

-- DML on partition table
INSERT INTO mpp21090_xchange_pttab_dropcol_idx_dml_timestamp SELECT  '2013-12-01 12:00:00','b', 1, '2013-12-01 12:00:00';
INSERT 0 1
SELECT * FROM mpp21090_xchange_pttab_dropcol_idx_dml_timestamp ORDER BY 1,2,3;
        col2         | col3 | col4 |        col5         
---------------------+------+------+---------------------
 2013-12-01 12:00:00 | b    |    1 | 2013-12-01 12:00:00
 2013-12-30 12:00:00 | z    |    1 | 2013-12-30 12:00:00
(2 rows)

UPDATE mpp21090_xchange_pttab_dropcol_idx_dml_timestamp SET col5 = '2014-02-10 12:00:00' WHERE col2 = '2013-12-01 12:00:00' AND col5 = '2013-12-01 12:00:00';
UPDATE 1
SELECT * FROM mpp21090_xchange_pttab_dropcol_idx_dml_timestamp ORDER BY 1,2,3;
        col2         | col3 | col4 |        col5         
---------------------+------+------+---------------------
 2013-12-01 12:00:00 | b    |    1 | 2014-02-10 12:00:00
 2013-12-30 12:00:00 | z    |    1 | 2013-12-30 12:00:00
(2 rows)

UPDATE mpp21090_xchange_pttab_dropcol_idx_dml_timestamp SET col2 ='2013-12-30 12:00:00' WHERE col3='b';
UPDATE 1
SELECT * FROM mpp21090_xchange_pttab_dropcol_idx_dml_timestamp ORDER BY 1,2,3;
        col2         | col3 | col4 |        col5         
---------------------+------+------+---------------------
 2013-12-30 12:00:00 | b    |    1 | 2014-02-10 12:00:00
 2013-12-30 12:00:00 | z    |    1 | 2013-12-30 12:00:00
(2 rows)

DELETE FROM mpp21090_xchange_pttab_dropcol_idx_dml_timestamp WHERE col3='b';
DELETE 1
SELECT * FROM mpp21090_xchange_pttab_dropcol_idx_dml_timestamp ORDER BY 1,2,3;
        col2         | col3 | col4 |        col5         
---------------------+------+------+---------------------
 2013-12-30 12:00:00 | z    |    1 | 2013-12-30 12:00:00
(1 row)

-- DML on candidate table
INSERT INTO mpp21090_xchange_pttab_dropcol_idx_dml_timestamp_candidate SELECT '2013-12-01 12:00:00','b', 1, '2013-12-01 12:00:00';
INSERT 0 1
SELECT * FROM mpp21090_xchange_pttab_dropcol_idx_dml_timestamp_candidate ORDER BY 1,2,3;
        col2         | col3 | col4 |        col5         
---------------------+------+------+---------------------
 2013-12-01 12:00:00 | b    |    1 | 2013-12-01 12:00:00
 2013-12-30 12:00:00 | a    |    0 | 2013-12-30 12:00:00
(2 rows)

UPDATE mpp21090_xchange_pttab_dropcol_idx_dml_timestamp_candidate SET col2='2013-12-30 12:00:00' WHERE col3='a';
UPDATE 1
SELECT * FROM mpp21090_xchange_pttab_dropcol_idx_dml_timestamp_candidate ORDER BY 1,2,3;
        col2         | col3 | col4 |        col5         
---------------------+------+------+---------------------
 2013-12-01 12:00:00 | b    |    1 | 2013-12-01 12:00:00
 2013-12-30 12:00:00 | a    |    0 | 2013-12-30 12:00:00
(2 rows)

DELETE FROM mpp21090_xchange_pttab_dropcol_idx_dml_timestamp_candidate WHERE col3='a';
DELETE 1
SELECT * FROM mpp21090_xchange_pttab_dropcol_idx_dml_timestamp_candidate ORDER BY 1,2,3;
        col2         | col3 | col4 |        col5         
---------------------+------+------+---------------------
 2013-12-01 12:00:00 | b    |    1 | 2013-12-01 12:00:00
(1 row)

