DROP TABLE IF EXISTS mpp21090_dropcol_addcol_splitpt_dml_time;
psql:/data/prabhd/test/tincrepo/main/dml/functional/output/mpp21090_dropcol_addcol_splitpt_dml_time_opt.sql:14: NOTICE:  table "mpp21090_dropcol_addcol_splitpt_dml_time" does not exist, skipping
DROP TABLE
CREATE TABLE mpp21090_dropcol_addcol_splitpt_dml_time
(
    col1 time,
    col2 time,
    col3 char,
    col4 time
) 
DISTRIBUTED by (col1)
PARTITION BY RANGE(col2)(partition partone start('12:00:00') end('18:00:00')  WITH (APPENDONLY=true, COMPRESSLEVEL=5, ORIENTATION=column),partition parttwo start('18:00:00') end('24:00:00') WITH (APPENDONLY=true, COMPRESSLEVEL=5, ORIENTATION=row),partition partthree start('0:00:00') end('11:00:00'));
psql:/data/prabhd/test/tincrepo/main/dml/functional/output/mpp21090_dropcol_addcol_splitpt_dml_time_opt.sql:23: NOTICE:  CREATE TABLE will create partition "mpp21090_dropcol_addcol_splitpt_dml_time_1_prt_partthree" for table "mpp21090_dropcol_addcol_splitpt_dml_time"
psql:/data/prabhd/test/tincrepo/main/dml/functional/output/mpp21090_dropcol_addcol_splitpt_dml_time_opt.sql:23: NOTICE:  CREATE TABLE will create partition "mpp21090_dropcol_addcol_splitpt_dml_time_1_prt_partone" for table "mpp21090_dropcol_addcol_splitpt_dml_time"
psql:/data/prabhd/test/tincrepo/main/dml/functional/output/mpp21090_dropcol_addcol_splitpt_dml_time_opt.sql:23: NOTICE:  CREATE TABLE will create partition "mpp21090_dropcol_addcol_splitpt_dml_time_1_prt_parttwo" for table "mpp21090_dropcol_addcol_splitpt_dml_time"
CREATE TABLE
INSERT INTO mpp21090_dropcol_addcol_splitpt_dml_time VALUES('12:00:00','12:00:00','a','12:00:00');
INSERT 0 1
SELECT * FROM mpp21090_dropcol_addcol_splitpt_dml_time ORDER BY 1,2,3,4;
   col1   |   col2   | col3 |   col4   
----------+----------+------+----------
 12:00:00 | 12:00:00 | a    | 12:00:00
(1 row)

ALTER TABLE mpp21090_dropcol_addcol_splitpt_dml_time ADD COLUMN col5 int DEFAULT 10;
ALTER TABLE
INSERT INTO mpp21090_dropcol_addcol_splitpt_dml_time VALUES('12:00:00','12:00:00','b','12:00:00',0);
INSERT 0 1
SELECT * FROM mpp21090_dropcol_addcol_splitpt_dml_time ORDER BY 1,2,3,4;
   col1   |   col2   | col3 |   col4   | col5 
----------+----------+------+----------+------
 12:00:00 | 12:00:00 | a    | 12:00:00 |   10
 12:00:00 | 12:00:00 | b    | 12:00:00 |    0
(2 rows)

ALTER TABLE mpp21090_dropcol_addcol_splitpt_dml_time DROP COLUMN col4;
ALTER TABLE
INSERT INTO mpp21090_dropcol_addcol_splitpt_dml_time VALUES('12:00:00','12:00:00','c',1);
INSERT 0 1
SELECT * FROM mpp21090_dropcol_addcol_splitpt_dml_time ORDER BY 1,2,3,4;
   col1   |   col2   | col3 | col5 
----------+----------+------+------
 12:00:00 | 12:00:00 | a    |   10
 12:00:00 | 12:00:00 | b    |    0
 12:00:00 | 12:00:00 | c    |    1
(3 rows)

ALTER TABLE mpp21090_dropcol_addcol_splitpt_dml_time SPLIT PARTITION partone at ('15:00:00') into (partition partsplitone,partition partsplitwo);
psql:/data/prabhd/test/tincrepo/main/dml/functional/output/mpp21090_dropcol_addcol_splitpt_dml_time_opt.sql:38: NOTICE:  exchanged partition "partone" of relation "mpp21090_dropcol_addcol_splitpt_dml_time" with relation "pg_temp_55988"
psql:/data/prabhd/test/tincrepo/main/dml/functional/output/mpp21090_dropcol_addcol_splitpt_dml_time_opt.sql:38: NOTICE:  dropped partition "partone" for relation "mpp21090_dropcol_addcol_splitpt_dml_time"
psql:/data/prabhd/test/tincrepo/main/dml/functional/output/mpp21090_dropcol_addcol_splitpt_dml_time_opt.sql:38: NOTICE:  CREATE TABLE will create partition "mpp21090_dropcol_addcol_splitpt_dml_time_1_prt_partsplitone" for table "mpp21090_dropcol_addcol_splitpt_dml_time"
psql:/data/prabhd/test/tincrepo/main/dml/functional/output/mpp21090_dropcol_addcol_splitpt_dml_time_opt.sql:38: NOTICE:  CREATE TABLE will create partition "mpp21090_dropcol_addcol_splitpt_dml_time_1_prt_partsplitwo" for table "mpp21090_dropcol_addcol_splitpt_dml_time"
ALTER TABLE
INSERT INTO mpp21090_dropcol_addcol_splitpt_dml_time SELECT '12:00:00', '12:00:00','d', 1;
INSERT 0 1
SELECT * FROM mpp21090_dropcol_addcol_splitpt_dml_time ORDER BY 1,2,3;
   col1   |   col2   | col3 | col5 
----------+----------+------+------
 12:00:00 | 12:00:00 | a    |   10
 12:00:00 | 12:00:00 | b    |    0
 12:00:00 | 12:00:00 | c    |    1
 12:00:00 | 12:00:00 | d    |    1
(4 rows)

-- Update distribution key
UPDATE mpp21090_dropcol_addcol_splitpt_dml_time SET col1 = '11:30:00' WHERE col2 = '12:00:00' AND col1 = '12:00:00';
UPDATE 4
SELECT * FROM mpp21090_dropcol_addcol_splitpt_dml_time ORDER BY 1,2,3;
   col1   |   col2   | col3 | col5 
----------+----------+------+------
 11:30:00 | 12:00:00 | a    |   10
 11:30:00 | 12:00:00 | b    |    0
 11:30:00 | 12:00:00 | c    |    1
 11:30:00 | 12:00:00 | d    |    1
(4 rows)

-- Update partition key
UPDATE mpp21090_dropcol_addcol_splitpt_dml_time SET col2 ='12:00:00'  WHERE col2 = '12:00:00' AND col1 = '11:30:00';
UPDATE 4
SELECT * FROM mpp21090_dropcol_addcol_splitpt_dml_time ORDER BY 1,2,3;
   col1   |   col2   | col3 | col5 
----------+----------+------+------
 11:30:00 | 12:00:00 | a    |   10
 11:30:00 | 12:00:00 | b    |    0
 11:30:00 | 12:00:00 | c    |    1
 11:30:00 | 12:00:00 | d    |    1
(4 rows)

DELETE FROM mpp21090_dropcol_addcol_splitpt_dml_time WHERE col3='b';
DELETE 1
SELECT * FROM mpp21090_dropcol_addcol_splitpt_dml_time ORDER BY 1,2,3;
   col1   |   col2   | col3 | col5 
----------+----------+------+------
 11:30:00 | 12:00:00 | a    |   10
 11:30:00 | 12:00:00 | c    |    1
 11:30:00 | 12:00:00 | d    |    1
(3 rows)

