DROP TABLE IF EXISTS mpp21090_drop_firstcol_dml_text;
DROP TABLE
CREATE TABLE mpp21090_drop_firstcol_dml_text(
col1 text,
col2 decimal,
col3 char,
col4 date,
col5 int
)  DISTRIBUTED by(col3);
CREATE TABLE
INSERT INTO mpp21090_drop_firstcol_dml_text VALUES('abcdefghijklmnop',0.00,'a','2014-01-01',0);
INSERT 0 1
SELECT * FROM mpp21090_drop_firstcol_dml_text ORDER BY 1,2,3,4;
       col1       | col2 | col3 |    col4    | col5 
------------------+------+------+------------+------
 abcdefghijklmnop | 0.00 | a    | 2014-01-01 |    0
(1 row)

ALTER TABLE mpp21090_drop_firstcol_dml_text DROP COLUMN col1;
ALTER TABLE
INSERT INTO mpp21090_drop_firstcol_dml_text SELECT 1.00,'b','2014-01-02',1;
INSERT 0 1
SELECT * FROM mpp21090_drop_firstcol_dml_text ORDER BY 1,2,3,4;
 col2 | col3 |    col4    | col5 
------+------+------------+------
 0.00 | a    | 2014-01-01 |    0
 1.00 | b    | 2014-01-02 |    1
(2 rows)

UPDATE mpp21090_drop_firstcol_dml_text SET col3='c' WHERE col3 = 'b' AND col5 = 1;
UPDATE 1
SELECT * FROM mpp21090_drop_firstcol_dml_text ORDER BY 1,2,3,4;
 col2 | col3 |    col4    | col5 
------+------+------------+------
 0.00 | a    | 2014-01-01 |    0
 1.00 | c    | 2014-01-02 |    1
(2 rows)

DELETE FROM mpp21090_drop_firstcol_dml_text WHERE col3='c';
DELETE 1
SELECT * FROM mpp21090_drop_firstcol_dml_text ORDER BY 1,2,3,4;
 col2 | col3 |    col4    | col5 
------+------+------------+------
 0.00 | a    | 2014-01-01 |    0
(1 row)

