DROP TABLE IF EXISTS mpp21090_reordered_col_dml_timestamptz;
psql:/data/prabhd/test/tincrepo/main/dml/functional/output/mpp21090_reordered_col_dml_timestamptz_opt.sql:14: NOTICE:  table "mpp21090_reordered_col_dml_timestamptz" does not exist, skipping
DROP TABLE
CREATE TABLE mpp21090_reordered_col_dml_timestamptz
(
    col1 timestamptz DEFAULT '2014-01-01 12:00:00 PST',
    col2 timestamptz,
    col3 char,
    col4 timestamptz,
    col5 int
) 
DISTRIBUTED by (col1)
PARTITION BY RANGE(col2)(partition partone start('2013-12-01 12:00:00 PST') end('2013-12-31 12:00:00 PST') WITH(APPENDONLY=true, COMPRESSLEVEL=5, ORIENTATION=column),partition parttwo start('2013-12-31 12:00:00 PST') end('2014-01-01 12:00:00 PST') WITH (APPENDONLY=true, COMPRESSLEVEL=5, ORIENTATION=row),partition partthree start('2014-01-01 12:00:00 PST') end('2014-02-01 12:00:00 PST'));
psql:/data/prabhd/test/tincrepo/main/dml/functional/output/mpp21090_reordered_col_dml_timestamptz_opt.sql:24: NOTICE:  CREATE TABLE will create partition "mpp21090_reordered_col_dml_timestamptz_1_prt_partone" for table "mpp21090_reordered_col_dml_timestamptz"
psql:/data/prabhd/test/tincrepo/main/dml/functional/output/mpp21090_reordered_col_dml_timestamptz_opt.sql:24: NOTICE:  CREATE TABLE will create partition "mpp21090_reordered_col_dml_timestamptz_1_prt_parttwo" for table "mpp21090_reordered_col_dml_timestamptz"
psql:/data/prabhd/test/tincrepo/main/dml/functional/output/mpp21090_reordered_col_dml_timestamptz_opt.sql:24: NOTICE:  CREATE TABLE will create partition "mpp21090_reordered_col_dml_timestamptz_1_prt_partthree" for table "mpp21090_reordered_col_dml_timestamptz"
CREATE TABLE
INSERT INTO mpp21090_reordered_col_dml_timestamptz(col2,col1,col3,col5,col4) SELECT '2013-12-30 12:00:00 PST', '2013-12-30 12:00:00 PST','a', 1,'2013-12-30 12:00:00 PST';
INSERT 0 1
INSERT INTO mpp21090_reordered_col_dml_timestamptz(col2,col3,col5,col4) SELECT '2013-12-30 12:00:00 PST','b', 2, '2013-12-30 12:00:00 PST'; 
INSERT 0 1
SELECT * FROM mpp21090_reordered_col_dml_timestamptz ORDER BY 1,2,3,4;
          col1          |          col2          | col3 |          col4          | col5 
------------------------+------------------------+------+------------------------+------
 2013-12-30 12:00:00-08 | 2013-12-30 12:00:00-08 | a    | 2013-12-30 12:00:00-08 |    1
 2014-01-01 12:00:00-08 | 2013-12-30 12:00:00-08 | b    | 2013-12-30 12:00:00-08 |    2
(2 rows)

ALTER TABLE mpp21090_reordered_col_dml_timestamptz DROP COLUMN col4;
ALTER TABLE
ALTER TABLE mpp21090_reordered_col_dml_timestamptz ADD COLUMN col4 int DEFAULT 10;
ALTER TABLE
INSERT INTO mpp21090_reordered_col_dml_timestamptz(col2,col3,col5,col4) SELECT '2013-12-30 12:00:00 PST','c', 2, 10; 
INSERT 0 1
SELECT * FROM mpp21090_reordered_col_dml_timestamptz ORDER BY 1,2,3,4;
          col1          |          col2          | col3 | col5 | col4 
------------------------+------------------------+------+------+------
 2013-12-30 12:00:00-08 | 2013-12-30 12:00:00-08 | a    |    1 |   10
 2014-01-01 12:00:00-08 | 2013-12-30 12:00:00-08 | b    |    2 |   10
 2014-01-01 12:00:00-08 | 2013-12-30 12:00:00-08 | c    |    2 |   10
(3 rows)

UPDATE mpp21090_reordered_col_dml_timestamptz SET col4 = 20;
UPDATE 3
SELECT * FROM mpp21090_reordered_col_dml_timestamptz ORDER BY 1,2,3,4;
          col1          |          col2          | col3 | col5 | col4 
------------------------+------------------------+------+------+------
 2013-12-30 12:00:00-08 | 2013-12-30 12:00:00-08 | a    |    1 |   20
 2014-01-01 12:00:00-08 | 2013-12-30 12:00:00-08 | b    |    2 |   20
 2014-01-01 12:00:00-08 | 2013-12-30 12:00:00-08 | c    |    2 |   20
(3 rows)

DELETE FROM mpp21090_reordered_col_dml_timestamptz WHERE col4=20;
DELETE 3
SELECT * FROM mpp21090_reordered_col_dml_timestamptz ORDER BY 1,2,3,4;
 col1 | col2 | col3 | col5 | col4 
------+------+------+------+------
(0 rows)

