DROP TABLE IF EXISTS mpp21090_pttab_dropcol_addcol_addpt_idx_dml_interval;
psql:/data/prabhd/test/tincrepo/main/dml/functional/output/mpp21090_pttab_dropcol_addcol_addpt_idx_dml_interval_opt.sql:14: NOTICE:  table "mpp21090_pttab_dropcol_addcol_addpt_idx_dml_interval" does not exist, skipping
DROP TABLE
CREATE TABLE mpp21090_pttab_dropcol_addcol_addpt_idx_dml_interval
(
    col1 interval,
    col2 interval,
    col3 char,
    col4 int
) 
DISTRIBUTED by (col1)
PARTITION BY RANGE(col2)(partition partone start('1 sec') end('1 min')  WITH (APPENDONLY=true, COMPRESSLEVEL=5, ORIENTATION=column),partition parttwo start('1 min') end('1 hour') WITH (APPENDONLY=true, COMPRESSLEVEL=5, ORIENTATION=row),partition partthree start('1 hour') end('12 hours'));
psql:/data/prabhd/test/tincrepo/main/dml/functional/output/mpp21090_pttab_dropcol_addcol_addpt_idx_dml_interval_opt.sql:23: NOTICE:  CREATE TABLE will create partition "mpp21090_pttab_dropcol_addcol_addpt_idx_dml_inter_1_prt_partone" for table "mpp21090_pttab_dropcol_addcol_addpt_idx_dml_interval"
psql:/data/prabhd/test/tincrepo/main/dml/functional/output/mpp21090_pttab_dropcol_addcol_addpt_idx_dml_interval_opt.sql:23: NOTICE:  CREATE TABLE will create partition "mpp21090_pttab_dropcol_addcol_addpt_idx_dml_inter_1_prt_parttwo" for table "mpp21090_pttab_dropcol_addcol_addpt_idx_dml_interval"
psql:/data/prabhd/test/tincrepo/main/dml/functional/output/mpp21090_pttab_dropcol_addcol_addpt_idx_dml_interval_opt.sql:23: NOTICE:  CREATE TABLE will create partition "mpp21090_pttab_dropcol_addcol_addpt_idx_dml_in_1_prt_partthree2" for table "mpp21090_pttab_dropcol_addcol_addpt_idx_dml_interval"
CREATE TABLE
INSERT INTO mpp21090_pttab_dropcol_addcol_addpt_idx_dml_interval VALUES('10 secs','10 secs','a',0);
INSERT 0 1
ALTER TABLE mpp21090_pttab_dropcol_addcol_addpt_idx_dml_interval DROP COLUMN col4;
ALTER TABLE
INSERT INTO mpp21090_pttab_dropcol_addcol_addpt_idx_dml_interval VALUES('10 secs','10 secs','b');
INSERT 0 1
ALTER TABLE mpp21090_pttab_dropcol_addcol_addpt_idx_dml_interval ADD COLUMN col5 interval DEFAULT '10 secs';
ALTER TABLE
DROP INDEX IF EXISTS mpp21090_pttab_dropcol_addcol_addpt_idx_dml_idx_interval;
psql:/data/prabhd/test/tincrepo/main/dml/functional/output/mpp21090_pttab_dropcol_addcol_addpt_idx_dml_interval_opt.sql:32: NOTICE:  index "mpp21090_pttab_dropcol_addcol_addpt_idx_dml_idx_interval" does not exist, skipping
DROP INDEX
CREATE INDEX mpp21090_pttab_dropcol_addcol_addpt_idx_dml_idx_interval on mpp21090_pttab_dropcol_addcol_addpt_idx_dml_interval(col5);
psql:/data/prabhd/test/tincrepo/main/dml/functional/output/mpp21090_pttab_dropcol_addcol_addpt_idx_dml_interval_opt.sql:33: NOTICE:  building index for child partition "mpp21090_pttab_dropcol_addcol_addpt_idx_dml_inter_1_prt_partone"
psql:/data/prabhd/test/tincrepo/main/dml/functional/output/mpp21090_pttab_dropcol_addcol_addpt_idx_dml_interval_opt.sql:33: NOTICE:  building index for child partition "mpp21090_pttab_dropcol_addcol_addpt_idx_dml_inter_1_prt_parttwo"
psql:/data/prabhd/test/tincrepo/main/dml/functional/output/mpp21090_pttab_dropcol_addcol_addpt_idx_dml_interval_opt.sql:33: NOTICE:  building index for child partition "mpp21090_pttab_dropcol_addcol_addpt_idx_dml_in_1_prt_partthree2"
CREATE INDEX
INSERT INTO mpp21090_pttab_dropcol_addcol_addpt_idx_dml_interval SELECT '10 secs','10 secs','c','10 secs';
INSERT 0 1
SELECT * FROM mpp21090_pttab_dropcol_addcol_addpt_idx_dml_interval ORDER BY 1,2,3;
   col1   |   col2   | col3 |   col5   
----------+----------+------+----------
 00:00:10 | 00:00:10 | a    | 00:00:10
 00:00:10 | 00:00:10 | b    | 00:00:10
 00:00:10 | 00:00:10 | c    | 00:00:10
(3 rows)

UPDATE mpp21090_pttab_dropcol_addcol_addpt_idx_dml_interval SET col5 = '11 hours' WHERE col2 = '10 secs' AND col1 = '10 secs';
UPDATE 3
SELECT * FROM mpp21090_pttab_dropcol_addcol_addpt_idx_dml_interval ORDER BY 1,2,3;
   col1   |   col2   | col3 |   col5   
----------+----------+------+----------
 00:00:10 | 00:00:10 | a    | 11:00:00
 00:00:10 | 00:00:10 | b    | 11:00:00
 00:00:10 | 00:00:10 | c    | 11:00:00
(3 rows)

DELETE FROM mpp21090_pttab_dropcol_addcol_addpt_idx_dml_interval WHERE col5 = '11 hours';
DELETE 3
SELECT * FROM mpp21090_pttab_dropcol_addcol_addpt_idx_dml_interval ORDER BY 1,2,3;
 col1 | col2 | col3 | col5 
------+------+------+------
(0 rows)

ALTER TABLE mpp21090_pttab_dropcol_addcol_addpt_idx_dml_interval ADD PARTITION partfour start('12 hours') end('1 day') inclusive;
psql:/data/prabhd/test/tincrepo/main/dml/functional/output/mpp21090_pttab_dropcol_addcol_addpt_idx_dml_interval_opt.sql:44: NOTICE:  CREATE TABLE will create partition "mpp21090_pttab_dropcol_addcol_addpt_idx_dml_inte_1_prt_partfour" for table "mpp21090_pttab_dropcol_addcol_addpt_idx_dml_interval"
ALTER TABLE
ALTER TABLE mpp21090_pttab_dropcol_addcol_addpt_idx_dml_interval ADD DEFAULT partition def;
psql:/data/prabhd/test/tincrepo/main/dml/functional/output/mpp21090_pttab_dropcol_addcol_addpt_idx_dml_interval_opt.sql:45: NOTICE:  CREATE TABLE will create partition "mpp21090_pttab_dropcol_addcol_addpt_idx_dml_interval_1_prt_def" for table "mpp21090_pttab_dropcol_addcol_addpt_idx_dml_interval"
ALTER TABLE
INSERT INTO mpp21090_pttab_dropcol_addcol_addpt_idx_dml_interval SELECT '14 hours','14 hours','d','14 hours';
INSERT 0 1
SELECT * FROM mpp21090_pttab_dropcol_addcol_addpt_idx_dml_interval ORDER BY 1,2,3;
   col1   |   col2   | col3 |   col5   
----------+----------+------+----------
 14:00:00 | 14:00:00 | d    | 14:00:00
(1 row)

UPDATE mpp21090_pttab_dropcol_addcol_addpt_idx_dml_interval SET col5 = '11 hours' WHERE col2 = '14 hours' AND col3 ='d';
UPDATE 1
SELECT * FROM mpp21090_pttab_dropcol_addcol_addpt_idx_dml_interval ORDER BY 1,2,3;
   col1   |   col2   | col3 |   col5   
----------+----------+------+----------
 14:00:00 | 14:00:00 | d    | 11:00:00
(1 row)

-- Update partition key
UPDATE mpp21090_pttab_dropcol_addcol_addpt_idx_dml_interval SET col2 = '11 hours' WHERE col2 = '14 hours' AND col3 ='d';
UPDATE 1
SELECT * FROM mpp21090_pttab_dropcol_addcol_addpt_idx_dml_interval ORDER BY 1,2,3;
   col1   |   col2   | col3 |   col5   
----------+----------+------+----------
 14:00:00 | 11:00:00 | d    | 11:00:00
(1 row)

DELETE FROM mpp21090_pttab_dropcol_addcol_addpt_idx_dml_interval WHERE col5 = '11 hours';
DELETE 1
SELECT * FROM mpp21090_pttab_dropcol_addcol_addpt_idx_dml_interval ORDER BY 1,2,3;
 col1 | col2 | col3 | col5 
------+------+------+------
(0 rows)

