DROP TABLE IF EXISTS mpp21090_drop_distcol_dml_decimal;
psql:/data/prabhd/test/tincrepo/main/dml/functional/output/mpp21090_drop_distcol_dml_decimal_ao_opt.sql:14: NOTICE:  table "mpp21090_drop_distcol_dml_decimal" does not exist, skipping
DROP TABLE
CREATE TABLE mpp21090_drop_distcol_dml_decimal(
col1 decimal,
col2 decimal,
col3 char,
col4 date,
col5 int
)  with (appendonly= true) distributed by (col1);
psql:/data/prabhd/test/tincrepo/main/dml/functional/output/mpp21090_drop_distcol_dml_decimal_ao_opt.sql:21: NOTICE:  Table doesn't have 'DISTRIBUTED BY' clause -- Using column named 'col1' as the Greenplum Database data distribution key for this table.
HINT:  The 'DISTRIBUTED BY' clause determines the distribution of data. Make sure column(s) chosen are the optimal data distribution key to minimize skew.
CREATE TABLE
INSERT INTO mpp21090_drop_distcol_dml_decimal VALUES(2.00,0.00,'a','2014-01-01',0);
INSERT 0 1
SELECT * FROM mpp21090_drop_distcol_dml_decimal ORDER BY 1,2,3,4;
 col1 | col2 | col3 |    col4    | col5 
------+------+------+------------+------
 2.00 | 0.00 | a    | 2014-01-01 |    0
(1 row)

ALTER TABLE mpp21090_drop_distcol_dml_decimal DROP COLUMN col1;
psql:/data/prabhd/test/tincrepo/main/dml/functional/output/mpp21090_drop_distcol_dml_decimal_ao_opt.sql:24: NOTICE:  Dropping a column that is part of the distribution policy forces a NULL distribution policy
ALTER TABLE
INSERT INTO mpp21090_drop_distcol_dml_decimal SELECT 1.00,'b','2014-01-02',1;
INSERT 0 1
SELECT * FROM mpp21090_drop_distcol_dml_decimal ORDER BY 1,2,3;
 col2 | col3 |    col4    | col5 
------+------+------------+------
 0.00 | a    | 2014-01-01 |    0
 1.00 | b    | 2014-01-02 |    1
(2 rows)

UPDATE mpp21090_drop_distcol_dml_decimal SET col3='c' WHERE col3 = 'b' AND col5 = 1;
UPDATE 1
SELECT * FROM mpp21090_drop_distcol_dml_decimal ORDER BY 1,2,3;
 col2 | col3 |    col4    | col5 
------+------+------------+------
 0.00 | a    | 2014-01-01 |    0
 1.00 | c    | 2014-01-02 |    1
(2 rows)

DELETE FROM mpp21090_drop_distcol_dml_decimal WHERE col3='c';
DELETE 1
SELECT * FROM mpp21090_drop_distcol_dml_decimal ORDER BY 1,2,3,4;
 col2 | col3 |    col4    | col5 
------+------+------------+------
 0.00 | a    | 2014-01-01 |    0
(1 row)

