DROP TABLE IF EXISTS mpp21090_dropcol_splitpt_dml_decimal;
psql:/data/prabhd/test/tincrepo/main/dml/functional/output/mpp21090_dropcol_splitpt_dml_decimal_opt.sql:14: NOTICE:  table "mpp21090_dropcol_splitpt_dml_decimal" does not exist, skipping
DROP TABLE
CREATE TABLE mpp21090_dropcol_splitpt_dml_decimal
(
    col1 decimal,
    col2 decimal,
    col3 char,
    col4 decimal,
    col5 int
) 
DISTRIBUTED by (col1)
PARTITION BY RANGE(col2)(partition partone start(1.00) end(10.00)  WITH (APPENDONLY=true, COMPRESSLEVEL=5, ORIENTATION=column),partition parttwo start(10.00) end(20.00) WITH (APPENDONLY=true, COMPRESSLEVEL=5, ORIENTATION=row),partition partthree start(20.00) end(30.00));
psql:/data/prabhd/test/tincrepo/main/dml/functional/output/mpp21090_dropcol_splitpt_dml_decimal_opt.sql:24: NOTICE:  CREATE TABLE will create partition "mpp21090_dropcol_splitpt_dml_decimal_1_prt_partone" for table "mpp21090_dropcol_splitpt_dml_decimal"
psql:/data/prabhd/test/tincrepo/main/dml/functional/output/mpp21090_dropcol_splitpt_dml_decimal_opt.sql:24: NOTICE:  CREATE TABLE will create partition "mpp21090_dropcol_splitpt_dml_decimal_1_prt_parttwo" for table "mpp21090_dropcol_splitpt_dml_decimal"
psql:/data/prabhd/test/tincrepo/main/dml/functional/output/mpp21090_dropcol_splitpt_dml_decimal_opt.sql:24: NOTICE:  CREATE TABLE will create partition "mpp21090_dropcol_splitpt_dml_decimal_1_prt_partthree" for table "mpp21090_dropcol_splitpt_dml_decimal"
CREATE TABLE
INSERT INTO mpp21090_dropcol_splitpt_dml_decimal VALUES(2.00,2.00,'a',2.00,0);
INSERT 0 1
SELECT * FROM mpp21090_dropcol_splitpt_dml_decimal ORDER BY 1,2,3,4;
 col1 | col2 | col3 | col4 | col5 
------+------+------+------+------
 2.00 | 2.00 | a    | 2.00 |    0
(1 row)

ALTER TABLE mpp21090_dropcol_splitpt_dml_decimal DROP COLUMN col4;
ALTER TABLE
ALTER TABLE mpp21090_dropcol_splitpt_dml_decimal SPLIT PARTITION partone at (5.00) into (partition partsplitone,partition partsplitwo);
psql:/data/prabhd/test/tincrepo/main/dml/functional/output/mpp21090_dropcol_splitpt_dml_decimal_opt.sql:31: NOTICE:  exchanged partition "partone" of relation "mpp21090_dropcol_splitpt_dml_decimal" with relation "pg_temp_69000"
psql:/data/prabhd/test/tincrepo/main/dml/functional/output/mpp21090_dropcol_splitpt_dml_decimal_opt.sql:31: NOTICE:  dropped partition "partone" for relation "mpp21090_dropcol_splitpt_dml_decimal"
psql:/data/prabhd/test/tincrepo/main/dml/functional/output/mpp21090_dropcol_splitpt_dml_decimal_opt.sql:31: NOTICE:  CREATE TABLE will create partition "mpp21090_dropcol_splitpt_dml_decimal_1_prt_partsplitone" for table "mpp21090_dropcol_splitpt_dml_decimal"
psql:/data/prabhd/test/tincrepo/main/dml/functional/output/mpp21090_dropcol_splitpt_dml_decimal_opt.sql:31: NOTICE:  CREATE TABLE will create partition "mpp21090_dropcol_splitpt_dml_decimal_1_prt_partsplitwo" for table "mpp21090_dropcol_splitpt_dml_decimal"
ALTER TABLE
INSERT INTO mpp21090_dropcol_splitpt_dml_decimal SELECT 1.00, 1.00,'b', 1;
INSERT 0 1
SELECT * FROM mpp21090_dropcol_splitpt_dml_decimal ORDER BY 1,2,3;
 col1 | col2 | col3 | col5 
------+------+------+------
 1.00 | 1.00 | b    |    1
 2.00 | 2.00 | a    |    0
(2 rows)

-- Update distribution key
UPDATE mpp21090_dropcol_splitpt_dml_decimal SET col1 = 35.00 WHERE col2 = 1.00 AND col1 = 1.00;
UPDATE 1
SELECT * FROM mpp21090_dropcol_splitpt_dml_decimal ORDER BY 1,2,3;
 col1  | col2 | col3 | col5 
-------+------+------+------
  2.00 | 2.00 | a    |    0
 35.00 | 1.00 | b    |    1
(2 rows)

-- Update partition key
UPDATE mpp21090_dropcol_splitpt_dml_decimal SET col2 =2.00  WHERE col2 = 1.00 AND col1 = 35.00;
UPDATE 1
SELECT * FROM mpp21090_dropcol_splitpt_dml_decimal ORDER BY 1,2,3;
 col1  | col2 | col3 | col5 
-------+------+------+------
  2.00 | 2.00 | a    |    0
 35.00 | 2.00 | b    |    1
(2 rows)

DELETE FROM mpp21090_dropcol_splitpt_dml_decimal WHERE col3='b';
DELETE 1
SELECT * FROM mpp21090_dropcol_splitpt_dml_decimal ORDER BY 1,2,3;
 col1 | col2 | col3 | col5 
------+------+------+------
 2.00 | 2.00 | a    |    0
(1 row)

