DROP TABLE IF EXISTS mpp21090_dropcol_splitdfpt_dml_int8;
psql:/data/prabhd/test/tincrepo/main/dml/functional/output/mpp21090_dropcol_splitdfpt_dml_int8_opt.sql:14: NOTICE:  table "mpp21090_dropcol_splitdfpt_dml_int8" does not exist, skipping
DROP TABLE
CREATE TABLE mpp21090_dropcol_splitdfpt_dml_int8
(
    col1 int8,
    col2 int8,
    col3 char,
    col4 int8,
    col5 int
) 
DISTRIBUTED by (col1)
PARTITION BY LIST(col2)
(
default partition def
);
psql:/data/prabhd/test/tincrepo/main/dml/functional/output/mpp21090_dropcol_splitdfpt_dml_int8_opt.sql:27: NOTICE:  CREATE TABLE will create partition "mpp21090_dropcol_splitdfpt_dml_int8_1_prt_def" for table "mpp21090_dropcol_splitdfpt_dml_int8"
CREATE TABLE
INSERT INTO mpp21090_dropcol_splitdfpt_dml_int8 VALUES(2000000000000000000,2000000000000000000,'a',2000000000000000000,0);
INSERT 0 1
SELECT * FROM mpp21090_dropcol_splitdfpt_dml_int8 ORDER BY 1,2,3,4;
        col1         |        col2         | col3 |        col4         | col5 
---------------------+---------------------+------+---------------------+------
 2000000000000000000 | 2000000000000000000 | a    | 2000000000000000000 |    0
(1 row)

ALTER TABLE mpp21090_dropcol_splitdfpt_dml_int8 DROP COLUMN col4;
ALTER TABLE
ALTER TABLE mpp21090_dropcol_splitdfpt_dml_int8 SPLIT DEFAULT PARTITION at (500000000000000000) into (partition partsplitone,partition def);
psql:/data/prabhd/test/tincrepo/main/dml/functional/output/mpp21090_dropcol_splitdfpt_dml_int8_opt.sql:34: NOTICE:  exchanged partition "def" of relation "mpp21090_dropcol_splitdfpt_dml_int8" with relation "pg_temp_66267"
psql:/data/prabhd/test/tincrepo/main/dml/functional/output/mpp21090_dropcol_splitdfpt_dml_int8_opt.sql:34: NOTICE:  dropped partition "def" for relation "mpp21090_dropcol_splitdfpt_dml_int8"
psql:/data/prabhd/test/tincrepo/main/dml/functional/output/mpp21090_dropcol_splitdfpt_dml_int8_opt.sql:34: NOTICE:  CREATE TABLE will create partition "mpp21090_dropcol_splitdfpt_dml_int8_1_prt_partsplitone" for table "mpp21090_dropcol_splitdfpt_dml_int8"
psql:/data/prabhd/test/tincrepo/main/dml/functional/output/mpp21090_dropcol_splitdfpt_dml_int8_opt.sql:34: NOTICE:  CREATE TABLE will create partition "mpp21090_dropcol_splitdfpt_dml_int8_1_prt_def" for table "mpp21090_dropcol_splitdfpt_dml_int8"
ALTER TABLE
INSERT INTO mpp21090_dropcol_splitdfpt_dml_int8 SELECT 100000000000000000, 100000000000000000,'b', 1;
INSERT 0 1
SELECT * FROM mpp21090_dropcol_splitdfpt_dml_int8 ORDER BY 1,2,3;
        col1         |        col2         | col3 | col5 
---------------------+---------------------+------+------
  100000000000000000 |  100000000000000000 | b    |    1
 2000000000000000000 | 2000000000000000000 | a    |    0
(2 rows)

-- Update distribution key
UPDATE mpp21090_dropcol_splitdfpt_dml_int8 SET col1 = 3500000000000000000 WHERE col2 = 100000000000000000 AND col1 = 100000000000000000;
UPDATE 1
SELECT * FROM mpp21090_dropcol_splitdfpt_dml_int8 ORDER BY 1,2,3;
        col1         |        col2         | col3 | col5 
---------------------+---------------------+------+------
 2000000000000000000 | 2000000000000000000 | a    |    0
 3500000000000000000 |  100000000000000000 | b    |    1
(2 rows)

-- Update partition key
UPDATE mpp21090_dropcol_splitdfpt_dml_int8 SET col2 = 3500000000000000000 WHERE col2 = 100000000000000000 AND col1 = 3500000000000000000;
UPDATE 1
SELECT * FROM mpp21090_dropcol_splitdfpt_dml_int8 ORDER BY 1,2,3;
        col1         |        col2         | col3 | col5 
---------------------+---------------------+------+------
 2000000000000000000 | 2000000000000000000 | a    |    0
 3500000000000000000 | 3500000000000000000 | b    |    1
(2 rows)

DELETE FROM mpp21090_dropcol_splitdfpt_dml_int8 WHERE col3='b';
DELETE 1
SELECT * FROM mpp21090_dropcol_splitdfpt_dml_int8 ORDER BY 1,2,3;
        col1         |        col2         | col3 | col5 
---------------------+---------------------+------+------
 2000000000000000000 | 2000000000000000000 | a    |    0
(1 row)

