DROP TABLE IF EXISTS mpp21090_pttab_addcol_addpt_dropcol_char;
psql:/data/prabhd/test/tincrepo/main/dml/functional/output/mpp21090_pttab_addcol_addpt_dropcol_char_opt.sql:14: NOTICE:  table "mpp21090_pttab_addcol_addpt_dropcol_char" does not exist, skipping
DROP TABLE
CREATE TABLE mpp21090_pttab_addcol_addpt_dropcol_char
(
    col1 char,
    col2 char,
    col3 char,
    col4 int
) 
DISTRIBUTED by (col1)
PARTITION BY LIST(col2)(partition partone VALUES('a','b','c','d','e','f','g','h') WITH (APPENDONLY=true, COMPRESSLEVEL=5, ORIENTATION=column),partition parttwo VALUES('i','j','k','l','m','n','o','p') WITH (APPENDONLY=true, COMPRESSLEVEL=5, ORIENTATION=row),partition partthree VALUES('q','r','s','t','u','v','w','x'));
psql:/data/prabhd/test/tincrepo/main/dml/functional/output/mpp21090_pttab_addcol_addpt_dropcol_char_opt.sql:23: NOTICE:  CREATE TABLE will create partition "mpp21090_pttab_addcol_addpt_dropcol_char_1_prt_partone" for table "mpp21090_pttab_addcol_addpt_dropcol_char"
psql:/data/prabhd/test/tincrepo/main/dml/functional/output/mpp21090_pttab_addcol_addpt_dropcol_char_opt.sql:23: NOTICE:  CREATE TABLE will create partition "mpp21090_pttab_addcol_addpt_dropcol_char_1_prt_parttwo" for table "mpp21090_pttab_addcol_addpt_dropcol_char"
psql:/data/prabhd/test/tincrepo/main/dml/functional/output/mpp21090_pttab_addcol_addpt_dropcol_char_opt.sql:23: NOTICE:  CREATE TABLE will create partition "mpp21090_pttab_addcol_addpt_dropcol_char_1_prt_partthree" for table "mpp21090_pttab_addcol_addpt_dropcol_char"
CREATE TABLE
INSERT INTO mpp21090_pttab_addcol_addpt_dropcol_char VALUES('x','x','a',0);
INSERT 0 1
ALTER TABLE mpp21090_pttab_addcol_addpt_dropcol_char ADD COLUMN col5 char DEFAULT 'x';
ALTER TABLE
ALTER TABLE mpp21090_pttab_addcol_addpt_dropcol_char ADD PARTITION partfour VALUES('y','z','-');
psql:/data/prabhd/test/tincrepo/main/dml/functional/output/mpp21090_pttab_addcol_addpt_dropcol_char_opt.sql:28: NOTICE:  CREATE TABLE will create partition "mpp21090_pttab_addcol_addpt_dropcol_char_1_prt_partfour" for table "mpp21090_pttab_addcol_addpt_dropcol_char"
ALTER TABLE
INSERT INTO mpp21090_pttab_addcol_addpt_dropcol_char SELECT 'z','z','b',1, 'z';
INSERT 0 1
SELECT * FROM mpp21090_pttab_addcol_addpt_dropcol_char ORDER BY 1,2,3;
 col1 | col2 | col3 | col4 | col5 
------+------+------+------+------
 x    | x    | a    |    0 | x
 z    | z    | b    |    1 | z
(2 rows)

ALTER TABLE mpp21090_pttab_addcol_addpt_dropcol_char DROP COLUMN col1;
psql:/data/prabhd/test/tincrepo/main/dml/functional/output/mpp21090_pttab_addcol_addpt_dropcol_char_opt.sql:33: NOTICE:  Dropping a column that is part of the distribution policy forces a NULL distribution policy
psql:/data/prabhd/test/tincrepo/main/dml/functional/output/mpp21090_pttab_addcol_addpt_dropcol_char_opt.sql:33: NOTICE:  Dropping a column that is part of the distribution policy forces a NULL distribution policy
psql:/data/prabhd/test/tincrepo/main/dml/functional/output/mpp21090_pttab_addcol_addpt_dropcol_char_opt.sql:33: NOTICE:  Dropping a column that is part of the distribution policy forces a NULL distribution policy
psql:/data/prabhd/test/tincrepo/main/dml/functional/output/mpp21090_pttab_addcol_addpt_dropcol_char_opt.sql:33: NOTICE:  Dropping a column that is part of the distribution policy forces a NULL distribution policy
psql:/data/prabhd/test/tincrepo/main/dml/functional/output/mpp21090_pttab_addcol_addpt_dropcol_char_opt.sql:33: NOTICE:  Dropping a column that is part of the distribution policy forces a NULL distribution policy
ALTER TABLE
INSERT INTO mpp21090_pttab_addcol_addpt_dropcol_char SELECT 'z','c',1, 'z';
INSERT 0 1
SELECT * FROM mpp21090_pttab_addcol_addpt_dropcol_char ORDER BY 1,2,3;
 col2 | col3 | col4 | col5 
------+------+------+------
 x    | a    |    0 | x
 z    | b    |    1 | z
 z    | c    |    1 | z
(3 rows)

UPDATE mpp21090_pttab_addcol_addpt_dropcol_char SET col5 = '-' WHERE col2 = 'z' and col3='c';
UPDATE 1
SELECT * FROM mpp21090_pttab_addcol_addpt_dropcol_char ORDER BY 1,2,3;
 col2 | col3 | col4 | col5 
------+------+------+------
 x    | a    |    0 | x
 z    | b    |    1 | z
 z    | c    |    1 | -
(3 rows)

-- Update partition key
UPDATE mpp21090_pttab_addcol_addpt_dropcol_char SET col2 = '-' WHERE col2 = 'z' and col3='c';
UPDATE 1
SELECT * FROM mpp21090_pttab_addcol_addpt_dropcol_char ORDER BY 1,2,3;
 col2 | col3 | col4 | col5 
------+------+------+------
 -    | c    |    1 | -
 x    | a    |    0 | x
 z    | b    |    1 | z
(3 rows)

DELETE FROM mpp21090_pttab_addcol_addpt_dropcol_char WHERE col2 = '-';
DELETE 1
SELECT * FROM mpp21090_pttab_addcol_addpt_dropcol_char ORDER BY 1,2,3;
 col2 | col3 | col4 | col5 
------+------+------+------
 x    | a    |    0 | x
 z    | b    |    1 | z
(2 rows)

