DROP TABLE IF EXISTS mpp21090_xchange_pttab_dropcol_dml_interval;
psql:/data/prabhd/test/tincrepo/main/dml/functional/output/mpp21090_xchange_pttab_dropcol_dml_interval_opt.sql:14: NOTICE:  table "mpp21090_xchange_pttab_dropcol_dml_interval" does not exist, skipping
DROP TABLE
CREATE TABLE mpp21090_xchange_pttab_dropcol_dml_interval
(
    col1 interval,
    col2 interval,
    col3 char,
    col4 int,
    col5 interval
) 
DISTRIBUTED by (col1)
PARTITION BY RANGE(col2)(partition partone start('1 sec') end('1 min')  WITH (APPENDONLY=true, COMPRESSLEVEL=5, ORIENTATION=column),partition parttwo start('1 min') end('1 hour') WITH (APPENDONLY=true, COMPRESSLEVEL=5, ORIENTATION=row),partition partthree start('1 hour') end('12 hours'));
psql:/data/prabhd/test/tincrepo/main/dml/functional/output/mpp21090_xchange_pttab_dropcol_dml_interval_opt.sql:24: NOTICE:  CREATE TABLE will create partition "mpp21090_xchange_pttab_dropcol_dml_interval_1_prt_partone" for table "mpp21090_xchange_pttab_dropcol_dml_interval"
psql:/data/prabhd/test/tincrepo/main/dml/functional/output/mpp21090_xchange_pttab_dropcol_dml_interval_opt.sql:24: NOTICE:  CREATE TABLE will create partition "mpp21090_xchange_pttab_dropcol_dml_interval_1_prt_parttwo" for table "mpp21090_xchange_pttab_dropcol_dml_interval"
psql:/data/prabhd/test/tincrepo/main/dml/functional/output/mpp21090_xchange_pttab_dropcol_dml_interval_opt.sql:24: NOTICE:  CREATE TABLE will create partition "mpp21090_xchange_pttab_dropcol_dml_interval_1_prt_partthree" for table "mpp21090_xchange_pttab_dropcol_dml_interval"
CREATE TABLE
INSERT INTO mpp21090_xchange_pttab_dropcol_dml_interval VALUES('10 secs','10 secs','a',0, '10 secs');
INSERT 0 1
SELECT * FROM mpp21090_xchange_pttab_dropcol_dml_interval ORDER BY 1,2,3,4;
   col1   |   col2   | col3 | col4 |   col5   
----------+----------+------+------+----------
 00:00:10 | 00:00:10 | a    |    0 | 00:00:10
(1 row)

ALTER TABLE mpp21090_xchange_pttab_dropcol_dml_interval DROP COLUMN col1;
psql:/data/prabhd/test/tincrepo/main/dml/functional/output/mpp21090_xchange_pttab_dropcol_dml_interval_opt.sql:29: NOTICE:  Dropping a column that is part of the distribution policy forces a NULL distribution policy
psql:/data/prabhd/test/tincrepo/main/dml/functional/output/mpp21090_xchange_pttab_dropcol_dml_interval_opt.sql:29: NOTICE:  Dropping a column that is part of the distribution policy forces a NULL distribution policy
psql:/data/prabhd/test/tincrepo/main/dml/functional/output/mpp21090_xchange_pttab_dropcol_dml_interval_opt.sql:29: NOTICE:  Dropping a column that is part of the distribution policy forces a NULL distribution policy
psql:/data/prabhd/test/tincrepo/main/dml/functional/output/mpp21090_xchange_pttab_dropcol_dml_interval_opt.sql:29: NOTICE:  Dropping a column that is part of the distribution policy forces a NULL distribution policy
ALTER TABLE
-- Create Candidate table for Exchange
DROP TABLE IF EXISTS mpp21090_xchange_pttab_dropcol_dml_interval_candidate;
psql:/data/prabhd/test/tincrepo/main/dml/functional/output/mpp21090_xchange_pttab_dropcol_dml_interval_opt.sql:32: NOTICE:  table "mpp21090_xchange_pttab_dropcol_dml_interval_candidate" does not exist, skipping
DROP TABLE
CREATE TABLE mpp21090_xchange_pttab_dropcol_dml_interval_candidate( like mpp21090_xchange_pttab_dropcol_dml_interval) distributed randomly;
CREATE TABLE
INSERT INTO mpp21090_xchange_pttab_dropcol_dml_interval_candidate VALUES('10 secs','z',1,'10 secs');
INSERT 0 1
-- Exchange 
ALTER TABLE mpp21090_xchange_pttab_dropcol_dml_interval EXCHANGE PARTITION FOR('30 secs') WITH TABLE mpp21090_xchange_pttab_dropcol_dml_interval_candidate;
psql:/data/prabhd/test/tincrepo/main/dml/functional/output/mpp21090_xchange_pttab_dropcol_dml_interval_opt.sql:37: NOTICE:  exchanged partition "partone" of relation "mpp21090_xchange_pttab_dropcol_dml_interval" with relation "mpp21090_xchange_pttab_dropcol_dml_interval_candidate"
ALTER TABLE
SELECT * FROM mpp21090_xchange_pttab_dropcol_dml_interval ORDER BY 1,2,3;
   col2   | col3 | col4 |   col5   
----------+------+------+----------
 00:00:10 | z    |    1 | 00:00:10
(1 row)

SELECT * FROM mpp21090_xchange_pttab_dropcol_dml_interval_candidate ORDER BY 1,2,3;
   col2   | col3 | col4 |   col5   
----------+------+------+----------
 00:00:10 | a    |    0 | 00:00:10
(1 row)

-- DML on partition table
INSERT INTO mpp21090_xchange_pttab_dropcol_dml_interval SELECT  '1 sec','b', 1, '1 sec';
INSERT 0 1
SELECT * FROM mpp21090_xchange_pttab_dropcol_dml_interval ORDER BY 1,2,3;
   col2   | col3 | col4 |   col5   
----------+------+------+----------
 00:00:01 | b    |    1 | 00:00:01
 00:00:10 | z    |    1 | 00:00:10
(2 rows)

UPDATE mpp21090_xchange_pttab_dropcol_dml_interval SET col5 = '14 hours' WHERE col2 = '1 sec' AND col5 = '1 sec';
UPDATE 1
SELECT * FROM mpp21090_xchange_pttab_dropcol_dml_interval ORDER BY 1,2,3;
   col2   | col3 | col4 |   col5   
----------+------+------+----------
 00:00:01 | b    |    1 | 14:00:00
 00:00:10 | z    |    1 | 00:00:10
(2 rows)

UPDATE mpp21090_xchange_pttab_dropcol_dml_interval SET col2 ='10 secs' WHERE col3='b';
UPDATE 1
SELECT * FROM mpp21090_xchange_pttab_dropcol_dml_interval ORDER BY 1,2,3;
   col2   | col3 | col4 |   col5   
----------+------+------+----------
 00:00:10 | b    |    1 | 14:00:00
 00:00:10 | z    |    1 | 00:00:10
(2 rows)

DELETE FROM mpp21090_xchange_pttab_dropcol_dml_interval WHERE col3='b';
DELETE 1
SELECT * FROM mpp21090_xchange_pttab_dropcol_dml_interval ORDER BY 1,2,3;
   col2   | col3 | col4 |   col5   
----------+------+------+----------
 00:00:10 | z    |    1 | 00:00:10
(1 row)

-- DML on candidate table
INSERT INTO mpp21090_xchange_pttab_dropcol_dml_interval_candidate SELECT '1 sec','b', 1, '1 sec';
INSERT 0 1
SELECT * FROM mpp21090_xchange_pttab_dropcol_dml_interval_candidate ORDER BY 1,2,3;
   col2   | col3 | col4 |   col5   
----------+------+------+----------
 00:00:01 | b    |    1 | 00:00:01
 00:00:10 | a    |    0 | 00:00:10
(2 rows)

UPDATE mpp21090_xchange_pttab_dropcol_dml_interval_candidate SET col2='10 secs' WHERE col3='a';
UPDATE 1
SELECT * FROM mpp21090_xchange_pttab_dropcol_dml_interval_candidate ORDER BY 1,2,3;
   col2   | col3 | col4 |   col5   
----------+------+------+----------
 00:00:01 | b    |    1 | 00:00:01
 00:00:10 | a    |    0 | 00:00:10
(2 rows)

DELETE FROM mpp21090_xchange_pttab_dropcol_dml_interval_candidate WHERE col3='a';
DELETE 1
SELECT * FROM mpp21090_xchange_pttab_dropcol_dml_interval_candidate ORDER BY 1,2,3;
   col2   | col3 | col4 |   col5   
----------+------+------+----------
 00:00:01 | b    |    1 | 00:00:01
(1 row)

