DROP TABLE IF EXISTS mpp21090_defpt_dropcol_addcol_dml_float;
psql:/data/prabhd/test/tincrepo/main/dml/functional/output/mpp21090_defpt_dropcol_addcol_dml_float_opt.sql:14: NOTICE:  table "mpp21090_defpt_dropcol_addcol_dml_float" does not exist, skipping
DROP TABLE
CREATE TABLE mpp21090_defpt_dropcol_addcol_dml_float
(
    col1 float,
    col2 float,
    col3 char,
    col4 int
) 
DISTRIBUTED by (col1)
PARTITION BY LIST(col2)
(
default partition def
);
psql:/data/prabhd/test/tincrepo/main/dml/functional/output/mpp21090_defpt_dropcol_addcol_dml_float_opt.sql:26: NOTICE:  CREATE TABLE will create partition "mpp21090_defpt_dropcol_addcol_dml_float_1_prt_def" for table "mpp21090_defpt_dropcol_addcol_dml_float"
CREATE TABLE
INSERT INTO mpp21090_defpt_dropcol_addcol_dml_float VALUES(2.00,2.00,'a',0);
INSERT 0 1
ALTER TABLE mpp21090_defpt_dropcol_addcol_dml_float DROP COLUMN col4;
ALTER TABLE
INSERT INTO mpp21090_defpt_dropcol_addcol_dml_float SELECT 35.00,35.00,'b';
INSERT 0 1
SELECT * FROM mpp21090_defpt_dropcol_addcol_dml_float ORDER BY 1,2,3;
 col1 | col2 | col3 
------+------+------
    2 |    2 | a
   35 |   35 | b
(2 rows)

ALTER TABLE mpp21090_defpt_dropcol_addcol_dml_float ADD COLUMN col5 float;
ALTER TABLE
INSERT INTO mpp21090_defpt_dropcol_addcol_dml_float SELECT 2.00,2.00,'c',2.00;
INSERT 0 1
SELECT * FROM mpp21090_defpt_dropcol_addcol_dml_float ORDER BY 1,2,3;
 col1 | col2 | col3 | col5 
------+------+------+------
    2 |    2 | a    |     
    2 |    2 | c    |    2
   35 |   35 | b    |     
(3 rows)

UPDATE mpp21090_defpt_dropcol_addcol_dml_float SET col1 = 1.00 WHERE col2 = 35.00 AND col1 = 35.00;
UPDATE 1
SELECT * FROM mpp21090_defpt_dropcol_addcol_dml_float ORDER BY 1,2,3;
 col1 | col2 | col3 | col5 
------+------+------+------
    1 |   35 | b    |     
    2 |    2 | a    |     
    2 |    2 | c    |    2
(3 rows)

-- Update partition key
UPDATE mpp21090_defpt_dropcol_addcol_dml_float SET col2 = 1.00 WHERE col2 = 35.00 AND col1 = 1.00;
UPDATE 1
SELECT * FROM mpp21090_defpt_dropcol_addcol_dml_float ORDER BY 1,2,3;
 col1 | col2 | col3 | col5 
------+------+------+------
    1 |    1 | b    |     
    2 |    2 | a    |     
    2 |    2 | c    |    2
(3 rows)

DELETE FROM mpp21090_defpt_dropcol_addcol_dml_float WHERE col2 = 1.00;
DELETE 1
SELECT * FROM mpp21090_defpt_dropcol_addcol_dml_float ORDER BY 1,2,3;
 col1 | col2 | col3 | col5 
------+------+------+------
    2 |    2 | a    |     
    2 |    2 | c    |    2
(2 rows)

