DROP TABLE IF EXISTS mpp21090_dropcol_splitdfpt_dml_int;
psql:/data/prabhd/test/tincrepo/main/dml/functional/output/mpp21090_dropcol_splitdfpt_dml_int_opt.sql:14: NOTICE:  table "mpp21090_dropcol_splitdfpt_dml_int" does not exist, skipping
DROP TABLE
CREATE TABLE mpp21090_dropcol_splitdfpt_dml_int
(
    col1 int,
    col2 int,
    col3 char,
    col4 int,
    col5 int
) 
DISTRIBUTED by (col1)
PARTITION BY LIST(col2)
(
default partition def
);
psql:/data/prabhd/test/tincrepo/main/dml/functional/output/mpp21090_dropcol_splitdfpt_dml_int_opt.sql:27: NOTICE:  CREATE TABLE will create partition "mpp21090_dropcol_splitdfpt_dml_int_1_prt_def" for table "mpp21090_dropcol_splitdfpt_dml_int"
CREATE TABLE
INSERT INTO mpp21090_dropcol_splitdfpt_dml_int VALUES(20000,20000,'a',20000,0);
INSERT 0 1
SELECT * FROM mpp21090_dropcol_splitdfpt_dml_int ORDER BY 1,2,3,4;
 col1  | col2  | col3 | col4  | col5 
-------+-------+------+-------+------
 20000 | 20000 | a    | 20000 |    0
(1 row)

ALTER TABLE mpp21090_dropcol_splitdfpt_dml_int DROP COLUMN col4;
ALTER TABLE
ALTER TABLE mpp21090_dropcol_splitdfpt_dml_int SPLIT DEFAULT PARTITION at (5000) into (partition partsplitone,partition def);
psql:/data/prabhd/test/tincrepo/main/dml/functional/output/mpp21090_dropcol_splitdfpt_dml_int_opt.sql:34: NOTICE:  exchanged partition "def" of relation "mpp21090_dropcol_splitdfpt_dml_int" with relation "pg_temp_66829"
psql:/data/prabhd/test/tincrepo/main/dml/functional/output/mpp21090_dropcol_splitdfpt_dml_int_opt.sql:34: NOTICE:  dropped partition "def" for relation "mpp21090_dropcol_splitdfpt_dml_int"
psql:/data/prabhd/test/tincrepo/main/dml/functional/output/mpp21090_dropcol_splitdfpt_dml_int_opt.sql:34: NOTICE:  CREATE TABLE will create partition "mpp21090_dropcol_splitdfpt_dml_int_1_prt_partsplitone" for table "mpp21090_dropcol_splitdfpt_dml_int"
psql:/data/prabhd/test/tincrepo/main/dml/functional/output/mpp21090_dropcol_splitdfpt_dml_int_opt.sql:34: NOTICE:  CREATE TABLE will create partition "mpp21090_dropcol_splitdfpt_dml_int_1_prt_def" for table "mpp21090_dropcol_splitdfpt_dml_int"
ALTER TABLE
INSERT INTO mpp21090_dropcol_splitdfpt_dml_int SELECT 1000, 1000,'b', 1;
INSERT 0 1
SELECT * FROM mpp21090_dropcol_splitdfpt_dml_int ORDER BY 1,2,3;
 col1  | col2  | col3 | col5 
-------+-------+------+------
  1000 |  1000 | b    |    1
 20000 | 20000 | a    |    0
(2 rows)

-- Update distribution key
UPDATE mpp21090_dropcol_splitdfpt_dml_int SET col1 = 35000 WHERE col2 = 1000 AND col1 = 1000;
UPDATE 1
SELECT * FROM mpp21090_dropcol_splitdfpt_dml_int ORDER BY 1,2,3;
 col1  | col2  | col3 | col5 
-------+-------+------+------
 20000 | 20000 | a    |    0
 35000 |  1000 | b    |    1
(2 rows)

-- Update partition key
UPDATE mpp21090_dropcol_splitdfpt_dml_int SET col2 = 35000 WHERE col2 = 1000 AND col1 = 35000;
UPDATE 1
SELECT * FROM mpp21090_dropcol_splitdfpt_dml_int ORDER BY 1,2,3;
 col1  | col2  | col3 | col5 
-------+-------+------+------
 20000 | 20000 | a    |    0
 35000 | 35000 | b    |    1
(2 rows)

DELETE FROM mpp21090_dropcol_splitdfpt_dml_int WHERE col3='b';
DELETE 1
SELECT * FROM mpp21090_dropcol_splitdfpt_dml_int ORDER BY 1,2,3;
 col1  | col2  | col3 | col5 
-------+-------+------+------
 20000 | 20000 | a    |    0
(1 row)

