DROP TABLE IF EXISTS mpp21090_defpt_dropcol_addcol_dml_int;
psql:/data/prabhd/test/tincrepo/main/dml/functional/output/mpp21090_defpt_dropcol_addcol_dml_int_opt.sql:14: NOTICE:  table "mpp21090_defpt_dropcol_addcol_dml_int" does not exist, skipping
DROP TABLE
CREATE TABLE mpp21090_defpt_dropcol_addcol_dml_int
(
    col1 int,
    col2 int,
    col3 char,
    col4 int
) 
DISTRIBUTED by (col1)
PARTITION BY LIST(col2)
(
default partition def
);
psql:/data/prabhd/test/tincrepo/main/dml/functional/output/mpp21090_defpt_dropcol_addcol_dml_int_opt.sql:26: NOTICE:  CREATE TABLE will create partition "mpp21090_defpt_dropcol_addcol_dml_int_1_prt_def" for table "mpp21090_defpt_dropcol_addcol_dml_int"
CREATE TABLE
INSERT INTO mpp21090_defpt_dropcol_addcol_dml_int VALUES(20000,20000,'a',0);
INSERT 0 1
ALTER TABLE mpp21090_defpt_dropcol_addcol_dml_int DROP COLUMN col4;
ALTER TABLE
INSERT INTO mpp21090_defpt_dropcol_addcol_dml_int SELECT 35000,35000,'b';
INSERT 0 1
SELECT * FROM mpp21090_defpt_dropcol_addcol_dml_int ORDER BY 1,2,3;
 col1  | col2  | col3 
-------+-------+------
 20000 | 20000 | a
 35000 | 35000 | b
(2 rows)

ALTER TABLE mpp21090_defpt_dropcol_addcol_dml_int ADD COLUMN col5 int;
ALTER TABLE
INSERT INTO mpp21090_defpt_dropcol_addcol_dml_int SELECT 20000,20000,'c',20000;
INSERT 0 1
SELECT * FROM mpp21090_defpt_dropcol_addcol_dml_int ORDER BY 1,2,3;
 col1  | col2  | col3 | col5  
-------+-------+------+-------
 20000 | 20000 | a    |      
 20000 | 20000 | c    | 20000
 35000 | 35000 | b    |      
(3 rows)

UPDATE mpp21090_defpt_dropcol_addcol_dml_int SET col1 = 10000 WHERE col2 = 35000 AND col1 = 35000;
UPDATE 1
SELECT * FROM mpp21090_defpt_dropcol_addcol_dml_int ORDER BY 1,2,3;
 col1  | col2  | col3 | col5  
-------+-------+------+-------
 10000 | 35000 | b    |      
 20000 | 20000 | a    |      
 20000 | 20000 | c    | 20000
(3 rows)

-- Update partition key
UPDATE mpp21090_defpt_dropcol_addcol_dml_int SET col2 = 10000 WHERE col2 = 35000 AND col1 = 10000;
UPDATE 1
SELECT * FROM mpp21090_defpt_dropcol_addcol_dml_int ORDER BY 1,2,3;
 col1  | col2  | col3 | col5  
-------+-------+------+-------
 10000 | 10000 | b    |      
 20000 | 20000 | a    |      
 20000 | 20000 | c    | 20000
(3 rows)

DELETE FROM mpp21090_defpt_dropcol_addcol_dml_int WHERE col2 = 10000;
DELETE 1
SELECT * FROM mpp21090_defpt_dropcol_addcol_dml_int ORDER BY 1,2,3;
 col1  | col2  | col3 | col5  
-------+-------+------+-------
 20000 | 20000 | a    |      
 20000 | 20000 | c    | 20000
(2 rows)

