DROP TABLE IF EXISTS mpp21090_drop_distcol_dml_char;
psql:/data/prabhd/test/tincrepo/main/dml/functional/output/mpp21090_drop_distcol_dml_char_ao_opt.sql:14: NOTICE:  table "mpp21090_drop_distcol_dml_char" does not exist, skipping
DROP TABLE
CREATE TABLE mpp21090_drop_distcol_dml_char(
col1 char,
col2 decimal,
col3 char,
col4 date,
col5 int
)  with (appendonly= true) distributed by (col1);
CREATE TABLE
INSERT INTO mpp21090_drop_distcol_dml_char VALUES('z',0.00,'a','2014-01-01',0);
INSERT 0 1
SELECT * FROM mpp21090_drop_distcol_dml_char ORDER BY 1,2,3,4;
 col1 | col2 | col3 |    col4    | col5 
------+------+------+------------+------
 z    | 0.00 | a    | 2014-01-01 |    0
(1 row)

ALTER TABLE mpp21090_drop_distcol_dml_char DROP COLUMN col1;
psql:/data/prabhd/test/tincrepo/main/dml/functional/output/mpp21090_drop_distcol_dml_char_ao_opt.sql:24: NOTICE:  Dropping a column that is part of the distribution policy forces a NULL distribution policy
ALTER TABLE
INSERT INTO mpp21090_drop_distcol_dml_char SELECT 1.00,'b','2014-01-02',1;
INSERT 0 1
SELECT * FROM mpp21090_drop_distcol_dml_char ORDER BY 1,2,3;
 col2 | col3 |    col4    | col5 
------+------+------------+------
 0.00 | a    | 2014-01-01 |    0
 1.00 | b    | 2014-01-02 |    1
(2 rows)

UPDATE mpp21090_drop_distcol_dml_char SET col3='c' WHERE col3 = 'b' AND col5 = 1;
UPDATE 1
SELECT * FROM mpp21090_drop_distcol_dml_char ORDER BY 1,2,3;
 col2 | col3 |    col4    | col5 
------+------+------------+------
 0.00 | a    | 2014-01-01 |    0
 1.00 | c    | 2014-01-02 |    1
(2 rows)

DELETE FROM mpp21090_drop_distcol_dml_char WHERE col3='c';
DELETE 1
SELECT * FROM mpp21090_drop_distcol_dml_char ORDER BY 1,2,3,4;
 col2 | col3 |    col4    | col5 
------+------+------------+------
 0.00 | a    | 2014-01-01 |    0
(1 row)

