DROP TABLE IF EXISTS mpp21090_dropcol_splitpt_idx_dml_char;
psql:/data/prabhd/test/tincrepo/main/dml/functional/output/mpp21090_dropcol_splitpt_idx_dml_char_opt.sql:14: NOTICE:  table "mpp21090_dropcol_splitpt_idx_dml_char" does not exist, skipping
DROP TABLE
CREATE TABLE mpp21090_dropcol_splitpt_idx_dml_char
(
    col1 char,
    col2 char,
    col3 char,
    col4 char,
    col5 int
) 
DISTRIBUTED by (col1)
PARTITION BY LIST(col2)(partition partone VALUES('a','b','c','d','e','f','g','h') WITH (APPENDONLY=true, COMPRESSLEVEL=5, ORIENTATION=column),partition parttwo VALUES('i','j','k','l','m','n','o','p') WITH (APPENDONLY=true, COMPRESSLEVEL=5, ORIENTATION=row),partition partthree VALUES('q','r','s','t','u','v','w','x'));
psql:/data/prabhd/test/tincrepo/main/dml/functional/output/mpp21090_dropcol_splitpt_idx_dml_char_opt.sql:24: NOTICE:  CREATE TABLE will create partition "mpp21090_dropcol_splitpt_idx_dml_char_1_prt_partone" for table "mpp21090_dropcol_splitpt_idx_dml_char"
psql:/data/prabhd/test/tincrepo/main/dml/functional/output/mpp21090_dropcol_splitpt_idx_dml_char_opt.sql:24: NOTICE:  CREATE TABLE will create partition "mpp21090_dropcol_splitpt_idx_dml_char_1_prt_parttwo" for table "mpp21090_dropcol_splitpt_idx_dml_char"
psql:/data/prabhd/test/tincrepo/main/dml/functional/output/mpp21090_dropcol_splitpt_idx_dml_char_opt.sql:24: NOTICE:  CREATE TABLE will create partition "mpp21090_dropcol_splitpt_idx_dml_char_1_prt_partthree" for table "mpp21090_dropcol_splitpt_idx_dml_char"
CREATE TABLE
DROP INDEX IF EXISTS mpp21090_dropcol_splitpt_idx_dml_idx_char;
psql:/data/prabhd/test/tincrepo/main/dml/functional/output/mpp21090_dropcol_splitpt_idx_dml_char_opt.sql:26: NOTICE:  index "mpp21090_dropcol_splitpt_idx_dml_idx_char" does not exist, skipping
DROP INDEX
CREATE INDEX mpp21090_dropcol_splitpt_idx_dml_idx_char on mpp21090_dropcol_splitpt_idx_dml_char(col2);
psql:/data/prabhd/test/tincrepo/main/dml/functional/output/mpp21090_dropcol_splitpt_idx_dml_char_opt.sql:27: NOTICE:  building index for child partition "mpp21090_dropcol_splitpt_idx_dml_char_1_prt_partone"
psql:/data/prabhd/test/tincrepo/main/dml/functional/output/mpp21090_dropcol_splitpt_idx_dml_char_opt.sql:27: NOTICE:  building index for child partition "mpp21090_dropcol_splitpt_idx_dml_char_1_prt_parttwo"
psql:/data/prabhd/test/tincrepo/main/dml/functional/output/mpp21090_dropcol_splitpt_idx_dml_char_opt.sql:27: NOTICE:  building index for child partition "mpp21090_dropcol_splitpt_idx_dml_char_1_prt_partthree"
CREATE INDEX
INSERT INTO mpp21090_dropcol_splitpt_idx_dml_char VALUES('g','g','a','g',0);
INSERT 0 1
SELECT * FROM mpp21090_dropcol_splitpt_idx_dml_char ORDER BY 1,2,3,4;
 col1 | col2 | col3 | col4 | col5 
------+------+------+------+------
 g    | g    | a    | g    |    0
(1 row)

ALTER TABLE mpp21090_dropcol_splitpt_idx_dml_char DROP COLUMN col4;
ALTER TABLE
ALTER TABLE mpp21090_dropcol_splitpt_idx_dml_char SPLIT PARTITION partone at ('d') into (partition partsplitone,partition partsplitwo);
psql:/data/prabhd/test/tincrepo/main/dml/functional/output/mpp21090_dropcol_splitpt_idx_dml_char_opt.sql:34: NOTICE:  exchanged partition "partone" of relation "mpp21090_dropcol_splitpt_idx_dml_char" with relation "pg_temp_72808"
psql:/data/prabhd/test/tincrepo/main/dml/functional/output/mpp21090_dropcol_splitpt_idx_dml_char_opt.sql:34: NOTICE:  dropped partition "partone" for relation "mpp21090_dropcol_splitpt_idx_dml_char"
psql:/data/prabhd/test/tincrepo/main/dml/functional/output/mpp21090_dropcol_splitpt_idx_dml_char_opt.sql:34: NOTICE:  CREATE TABLE will create partition "mpp21090_dropcol_splitpt_idx_dml_char_1_prt_partsplitone" for table "mpp21090_dropcol_splitpt_idx_dml_char"
psql:/data/prabhd/test/tincrepo/main/dml/functional/output/mpp21090_dropcol_splitpt_idx_dml_char_opt.sql:34: NOTICE:  CREATE TABLE will create partition "mpp21090_dropcol_splitpt_idx_dml_char_1_prt_partsplitwo" for table "mpp21090_dropcol_splitpt_idx_dml_char"
ALTER TABLE
INSERT INTO mpp21090_dropcol_splitpt_idx_dml_char SELECT 'a', 'a','b', 1;
INSERT 0 1
SELECT * FROM mpp21090_dropcol_splitpt_idx_dml_char ORDER BY 1,2,3;
 col1 | col2 | col3 | col5 
------+------+------+------
 a    | a    | b    |    1
 g    | g    | a    |    0
(2 rows)

-- Update distribution key
UPDATE mpp21090_dropcol_splitpt_idx_dml_char SET col1 = 'z' WHERE col2 = 'a' AND col1 = 'a';
UPDATE 1
SELECT * FROM mpp21090_dropcol_splitpt_idx_dml_char ORDER BY 1,2,3;
 col1 | col2 | col3 | col5 
------+------+------+------
 g    | g    | a    |    0
 z    | a    | b    |    1
(2 rows)

-- Update partition key
UPDATE mpp21090_dropcol_splitpt_idx_dml_char SET col2 ='g'  WHERE col2 = 'a' AND col1 = 'z';
UPDATE 1
SELECT * FROM mpp21090_dropcol_splitpt_idx_dml_char ORDER BY 1,2,3;
 col1 | col2 | col3 | col5 
------+------+------+------
 g    | g    | a    |    0
 z    | g    | b    |    1
(2 rows)

DELETE FROM mpp21090_dropcol_splitpt_idx_dml_char WHERE col3='b';
DELETE 1
SELECT * FROM mpp21090_dropcol_splitpt_idx_dml_char ORDER BY 1,2,3;
 col1 | col2 | col3 | col5 
------+------+------+------
 g    | g    | a    |    0
(1 row)

