-- @author prabhd 
-- @created 2014-04-01 12:00:00
-- @modified 2012-04-01 12:00:00
-- @tags dml MPP-21090 ORCA
-- @product_version gpdb: [4.3-]
-- @optimizer_mode on	
-- @description Tests for MPP-21090
DROP TABLE IF EXISTS mpp21090_xchange_pttab_dropcol_dml_int;
DROP TABLE
CREATE TABLE mpp21090_xchange_pttab_dropcol_dml_int
(
    col1 int,
    col2 int,
    col3 char,
    col4 int,
    col5 int
) 
DISTRIBUTED by (col1)
PARTITION BY RANGE(col2)(partition partone start(1) end(10001) WITH (APPENDONLY=true, COMPRESSLEVEL=5, ORIENTATION=column),partition parttwo start(10001) end(20001) WITH (APPENDONLY=true, COMPRESSLEVEL=5, ORIENTATION=row),partition partthree start(20001) end(30001));
psql:mpp21090_xchange_pttab_dropcol_dml_int.sql:18: NOTICE:  CREATE TABLE will create partition "mpp21090_xchange_pttab_dropcol_dml_int_1_prt_partone" for table "mpp21090_xchange_pttab_dropcol_dml_int"
psql:mpp21090_xchange_pttab_dropcol_dml_int.sql:18: NOTICE:  CREATE TABLE will create partition "mpp21090_xchange_pttab_dropcol_dml_int_1_prt_parttwo" for table "mpp21090_xchange_pttab_dropcol_dml_int"
psql:mpp21090_xchange_pttab_dropcol_dml_int.sql:18: NOTICE:  CREATE TABLE will create partition "mpp21090_xchange_pttab_dropcol_dml_int_1_prt_partthree" for table "mpp21090_xchange_pttab_dropcol_dml_int"
CREATE TABLE
INSERT INTO mpp21090_xchange_pttab_dropcol_dml_int VALUES(20000,20000,'a',0, 20000);
INSERT 0 1
SELECT * FROM mpp21090_xchange_pttab_dropcol_dml_int ORDER BY 1,2,3,4;
 col1  | col2  | col3 | col4 | col5  
-------+-------+------+------+-------
 20000 | 20000 | a    |    0 | 20000
(1 row)

ALTER TABLE mpp21090_xchange_pttab_dropcol_dml_int DROP COLUMN col1;
psql:mpp21090_xchange_pttab_dropcol_dml_int.sql:23: NOTICE:  Dropping a column that is part of the distribution policy forces a NULL distribution policy
psql:mpp21090_xchange_pttab_dropcol_dml_int.sql:23: NOTICE:  Dropping a column that is part of the distribution policy forces a NULL distribution policy
psql:mpp21090_xchange_pttab_dropcol_dml_int.sql:23: NOTICE:  Dropping a column that is part of the distribution policy forces a NULL distribution policy
psql:mpp21090_xchange_pttab_dropcol_dml_int.sql:23: NOTICE:  Dropping a column that is part of the distribution policy forces a NULL distribution policy
ALTER TABLE
-- Create Candidate table for Exchange
DROP TABLE IF EXISTS mpp21090_xchange_pttab_dropcol_dml_int_candidate;
DROP TABLE
CREATE TABLE mpp21090_xchange_pttab_dropcol_dml_int_candidate( like mpp21090_xchange_pttab_dropcol_dml_int) distributed randomly;
CREATE TABLE
INSERT INTO mpp21090_xchange_pttab_dropcol_dml_int_candidate VALUES(5000,'z',1,5000);
INSERT 0 1
-- Exchange 
ALTER TABLE mpp21090_xchange_pttab_dropcol_dml_int EXCHANGE PARTITION FOR(5000) WITH TABLE mpp21090_xchange_pttab_dropcol_dml_int_candidate;
psql:mpp21090_xchange_pttab_dropcol_dml_int.sql:31: NOTICE:  exchanged partition "partone" of relation "mpp21090_xchange_pttab_dropcol_dml_int" with relation "mpp21090_xchange_pttab_dropcol_dml_int_candidate"
ALTER TABLE
SELECT * FROM mpp21090_xchange_pttab_dropcol_dml_int ORDER BY 1,2,3;
 col2  | col3 | col4 | col5  
-------+------+------+-------
  5000 | z    |    1 |  5000
 20000 | a    |    0 | 20000
(2 rows)

SELECT * FROM mpp21090_xchange_pttab_dropcol_dml_int_candidate ORDER BY 1,2,3;
 col2 | col3 | col4 | col5 
------+------+------+------
(0 rows)

-- DML on partition table
INSERT INTO mpp21090_xchange_pttab_dropcol_dml_int SELECT  1000,'b', 1, 1000;
INSERT 0 1
SELECT * FROM mpp21090_xchange_pttab_dropcol_dml_int ORDER BY 1,2,3;
 col2  | col3 | col4 | col5  
-------+------+------+-------
  1000 | b    |    1 |  1000
  5000 | z    |    1 |  5000
 20000 | a    |    0 | 20000
(3 rows)

UPDATE mpp21090_xchange_pttab_dropcol_dml_int SET col5 = 35000 WHERE col2 = 1000 AND col5 = 1000;
UPDATE 1
SELECT * FROM mpp21090_xchange_pttab_dropcol_dml_int ORDER BY 1,2,3;
 col2  | col3 | col4 | col5  
-------+------+------+-------
  1000 | b    |    1 | 35000
  5000 | z    |    1 |  5000
 20000 | a    |    0 | 20000
(3 rows)

UPDATE mpp21090_xchange_pttab_dropcol_dml_int SET col2 =20000 WHERE col3='b';
UPDATE 1
SELECT * FROM mpp21090_xchange_pttab_dropcol_dml_int ORDER BY 1,2,3;
 col2  | col3 | col4 | col5  
-------+------+------+-------
  5000 | z    |    1 |  5000
 20000 | a    |    0 | 20000
 20000 | b    |    1 | 35000
(3 rows)

DELETE FROM mpp21090_xchange_pttab_dropcol_dml_int WHERE col3='b';
DELETE 1
SELECT * FROM mpp21090_xchange_pttab_dropcol_dml_int ORDER BY 1,2,3;
 col2  | col3 | col4 | col5  
-------+------+------+-------
  5000 | z    |    1 |  5000
 20000 | a    |    0 | 20000
(2 rows)

-- DML on candidate table
INSERT INTO mpp21090_xchange_pttab_dropcol_dml_int_candidate SELECT 1000,'b', 1, 1000;
INSERT 0 1
SELECT * FROM mpp21090_xchange_pttab_dropcol_dml_int_candidate ORDER BY 1,2,3;
 col2 | col3 | col4 | col5 
------+------+------+------
 1000 | b    |    1 | 1000
(1 row)

UPDATE mpp21090_xchange_pttab_dropcol_dml_int_candidate SET col2=2000 WHERE col3='b';
UPDATE 1
SELECT * FROM mpp21090_xchange_pttab_dropcol_dml_int_candidate ORDER BY 1,2,3;
 col2 | col3 | col4 | col5 
------+------+------+------
 2000 | b    |    1 | 1000
(1 row)

DELETE FROM mpp21090_xchange_pttab_dropcol_dml_int_candidate WHERE col3='b';
DELETE 1
SELECT * FROM mpp21090_xchange_pttab_dropcol_dml_int_candidate ORDER BY 1,2,3;
 col2 | col3 | col4 | col5 
------+------+------+------
(0 rows)

