DROP TABLE IF EXISTS mpp21090_pttab_addpt_dropcol_addcol_dml_int4;
psql:/data/prabhd/test/tincrepo/main/dml/functional/output/mpp21090_pttab_addpt_dropcol_addcol_dml_int4_opt.sql:14: NOTICE:  table "mpp21090_pttab_addpt_dropcol_addcol_dml_int4" does not exist, skipping
DROP TABLE
CREATE TABLE mpp21090_pttab_addpt_dropcol_addcol_dml_int4
(
    col1 int4,
    col2 int4,
    col3 char,
    col4 int
) 
DISTRIBUTED by (col1)
PARTITION BY RANGE(col2)(partition partone start(1) end(100000001)  WITH (APPENDONLY=true, COMPRESSLEVEL=5, ORIENTATION=column),partition parttwo start(100000001) end(200000001) WITH (APPENDONLY=true, COMPRESSLEVEL=5, ORIENTATION=row),partition partthree start(200000001) end(300000001));
psql:/data/prabhd/test/tincrepo/main/dml/functional/output/mpp21090_pttab_addpt_dropcol_addcol_dml_int4_opt.sql:23: NOTICE:  CREATE TABLE will create partition "mpp21090_pttab_addpt_dropcol_addcol_dml_int4_1_prt_partone" for table "mpp21090_pttab_addpt_dropcol_addcol_dml_int4"
psql:/data/prabhd/test/tincrepo/main/dml/functional/output/mpp21090_pttab_addpt_dropcol_addcol_dml_int4_opt.sql:23: NOTICE:  CREATE TABLE will create partition "mpp21090_pttab_addpt_dropcol_addcol_dml_int4_1_prt_parttwo" for table "mpp21090_pttab_addpt_dropcol_addcol_dml_int4"
psql:/data/prabhd/test/tincrepo/main/dml/functional/output/mpp21090_pttab_addpt_dropcol_addcol_dml_int4_opt.sql:23: NOTICE:  CREATE TABLE will create partition "mpp21090_pttab_addpt_dropcol_addcol_dml_int4_1_prt_partthree" for table "mpp21090_pttab_addpt_dropcol_addcol_dml_int4"
CREATE TABLE
INSERT INTO mpp21090_pttab_addpt_dropcol_addcol_dml_int4 VALUES(20000000,20000000,'a',0);
INSERT 0 1
ALTER TABLE mpp21090_pttab_addpt_dropcol_addcol_dml_int4 ADD PARTITION partfour start(300000001) end(400000001);
psql:/data/prabhd/test/tincrepo/main/dml/functional/output/mpp21090_pttab_addpt_dropcol_addcol_dml_int4_opt.sql:27: NOTICE:  CREATE TABLE will create partition "mpp21090_pttab_addpt_dropcol_addcol_dml_int4_1_prt_partfour" for table "mpp21090_pttab_addpt_dropcol_addcol_dml_int4"
ALTER TABLE
INSERT INTO mpp21090_pttab_addpt_dropcol_addcol_dml_int4 SELECT 35000000,35000000,'b',1;
INSERT 0 1
SELECT * FROM mpp21090_pttab_addpt_dropcol_addcol_dml_int4 ORDER BY 1,2,3;
   col1   |   col2   | col3 | col4 
----------+----------+------+------
 20000000 | 20000000 | a    |    0
 35000000 | 35000000 | b    |    1
(2 rows)

ALTER TABLE mpp21090_pttab_addpt_dropcol_addcol_dml_int4 DROP COLUMN col1;
psql:/data/prabhd/test/tincrepo/main/dml/functional/output/mpp21090_pttab_addpt_dropcol_addcol_dml_int4_opt.sql:32: NOTICE:  Dropping a column that is part of the distribution policy forces a NULL distribution policy
psql:/data/prabhd/test/tincrepo/main/dml/functional/output/mpp21090_pttab_addpt_dropcol_addcol_dml_int4_opt.sql:32: NOTICE:  Dropping a column that is part of the distribution policy forces a NULL distribution policy
psql:/data/prabhd/test/tincrepo/main/dml/functional/output/mpp21090_pttab_addpt_dropcol_addcol_dml_int4_opt.sql:32: NOTICE:  Dropping a column that is part of the distribution policy forces a NULL distribution policy
psql:/data/prabhd/test/tincrepo/main/dml/functional/output/mpp21090_pttab_addpt_dropcol_addcol_dml_int4_opt.sql:32: NOTICE:  Dropping a column that is part of the distribution policy forces a NULL distribution policy
psql:/data/prabhd/test/tincrepo/main/dml/functional/output/mpp21090_pttab_addpt_dropcol_addcol_dml_int4_opt.sql:32: NOTICE:  Dropping a column that is part of the distribution policy forces a NULL distribution policy
ALTER TABLE
INSERT INTO mpp21090_pttab_addpt_dropcol_addcol_dml_int4 SELECT 35000000,'c',1;
INSERT 0 1
SELECT * FROM mpp21090_pttab_addpt_dropcol_addcol_dml_int4 ORDER BY 1,2,3;
   col2   | col3 | col4 
----------+------+------
 20000000 | a    |    0
 35000000 | b    |    1
 35000000 | c    |    1
(3 rows)

ALTER TABLE mpp21090_pttab_addpt_dropcol_addcol_dml_int4 ADD COLUMN col5 int4 DEFAULT 20000000;
ALTER TABLE
INSERT INTO mpp21090_pttab_addpt_dropcol_addcol_dml_int4 SELECT 35000000,'d',1,35000000;
INSERT 0 1
SELECT * FROM mpp21090_pttab_addpt_dropcol_addcol_dml_int4 ORDER BY 1,2,3;
   col2   | col3 | col4 |   col5   
----------+------+------+----------
 20000000 | a    |    0 | 20000000
 35000000 | b    |    1 | 20000000
 35000000 | c    |    1 | 20000000
 35000000 | d    |    1 | 35000000
(4 rows)

UPDATE mpp21090_pttab_addpt_dropcol_addcol_dml_int4 SET col4 = 10 WHERE col2 = 35000000;
UPDATE 3
SELECT * FROM mpp21090_pttab_addpt_dropcol_addcol_dml_int4 ORDER BY 1,2,3;
   col2   | col3 | col4 |   col5   
----------+------+------+----------
 20000000 | a    |    0 | 20000000
 35000000 | b    |   10 | 20000000
 35000000 | c    |   10 | 20000000
 35000000 | d    |   10 | 35000000
(4 rows)

-- Update partition key
UPDATE mpp21090_pttab_addpt_dropcol_addcol_dml_int4 SET col2 = 10000000 WHERE col2 = 35000000;
UPDATE 3
SELECT * FROM mpp21090_pttab_addpt_dropcol_addcol_dml_int4 ORDER BY 1,2,3;
   col2   | col3 | col4 |   col5   
----------+------+------+----------
 10000000 | b    |   10 | 20000000
 10000000 | c    |   10 | 20000000
 10000000 | d    |   10 | 35000000
 20000000 | a    |    0 | 20000000
(4 rows)

DELETE FROM mpp21090_pttab_addpt_dropcol_addcol_dml_int4 WHERE col2 = 10000000;
DELETE 3
SELECT * FROM mpp21090_pttab_addpt_dropcol_addcol_dml_int4 ORDER BY 1,2,3;
   col2   | col3 | col4 |   col5   
----------+------+------+----------
 20000000 | a    |    0 | 20000000
(1 row)

