DROP TABLE IF EXISTS mpp21090_dropcol_splitdfpt_dml_time;
psql:/data/prabhd/test/tincrepo/main/dml/functional/output/mpp21090_dropcol_splitdfpt_dml_time_opt.sql:14: NOTICE:  table "mpp21090_dropcol_splitdfpt_dml_time" does not exist, skipping
DROP TABLE
CREATE TABLE mpp21090_dropcol_splitdfpt_dml_time
(
    col1 time,
    col2 time,
    col3 char,
    col4 time,
    col5 int
) 
DISTRIBUTED by (col1)
PARTITION BY LIST(col2)
(
default partition def
);
psql:/data/prabhd/test/tincrepo/main/dml/functional/output/mpp21090_dropcol_splitdfpt_dml_time_opt.sql:27: NOTICE:  CREATE TABLE will create partition "mpp21090_dropcol_splitdfpt_dml_time_1_prt_def" for table "mpp21090_dropcol_splitdfpt_dml_time"
CREATE TABLE
INSERT INTO mpp21090_dropcol_splitdfpt_dml_time VALUES('12:00:00','12:00:00','a','12:00:00',0);
INSERT 0 1
SELECT * FROM mpp21090_dropcol_splitdfpt_dml_time ORDER BY 1,2,3,4;
   col1   |   col2   | col3 |   col4   | col5 
----------+----------+------+----------+------
 12:00:00 | 12:00:00 | a    | 12:00:00 |    0
(1 row)

ALTER TABLE mpp21090_dropcol_splitdfpt_dml_time DROP COLUMN col4;
ALTER TABLE
ALTER TABLE mpp21090_dropcol_splitdfpt_dml_time SPLIT DEFAULT PARTITION at ('15:00:00') into (partition partsplitone,partition def);
psql:/data/prabhd/test/tincrepo/main/dml/functional/output/mpp21090_dropcol_splitdfpt_dml_time_opt.sql:34: NOTICE:  exchanged partition "def" of relation "mpp21090_dropcol_splitdfpt_dml_time" with relation "pg_temp_67401"
psql:/data/prabhd/test/tincrepo/main/dml/functional/output/mpp21090_dropcol_splitdfpt_dml_time_opt.sql:34: NOTICE:  dropped partition "def" for relation "mpp21090_dropcol_splitdfpt_dml_time"
psql:/data/prabhd/test/tincrepo/main/dml/functional/output/mpp21090_dropcol_splitdfpt_dml_time_opt.sql:34: NOTICE:  CREATE TABLE will create partition "mpp21090_dropcol_splitdfpt_dml_time_1_prt_partsplitone" for table "mpp21090_dropcol_splitdfpt_dml_time"
psql:/data/prabhd/test/tincrepo/main/dml/functional/output/mpp21090_dropcol_splitdfpt_dml_time_opt.sql:34: NOTICE:  CREATE TABLE will create partition "mpp21090_dropcol_splitdfpt_dml_time_1_prt_def" for table "mpp21090_dropcol_splitdfpt_dml_time"
ALTER TABLE
INSERT INTO mpp21090_dropcol_splitdfpt_dml_time SELECT '12:00:00', '12:00:00','b', 1;
INSERT 0 1
SELECT * FROM mpp21090_dropcol_splitdfpt_dml_time ORDER BY 1,2,3;
   col1   |   col2   | col3 | col5 
----------+----------+------+------
 12:00:00 | 12:00:00 | a    |    0
 12:00:00 | 12:00:00 | b    |    1
(2 rows)

-- Update distribution key
UPDATE mpp21090_dropcol_splitdfpt_dml_time SET col1 = '11:30:00' WHERE col2 = '12:00:00' AND col1 = '12:00:00';
UPDATE 2
SELECT * FROM mpp21090_dropcol_splitdfpt_dml_time ORDER BY 1,2,3;
   col1   |   col2   | col3 | col5 
----------+----------+------+------
 11:30:00 | 12:00:00 | a    |    0
 11:30:00 | 12:00:00 | b    |    1
(2 rows)

-- Update partition key
UPDATE mpp21090_dropcol_splitdfpt_dml_time SET col2 = '11:30:00' WHERE col2 = '12:00:00' AND col1 = '11:30:00';
UPDATE 2
SELECT * FROM mpp21090_dropcol_splitdfpt_dml_time ORDER BY 1,2,3;
   col1   |   col2   | col3 | col5 
----------+----------+------+------
 11:30:00 | 11:30:00 | a    |    0
 11:30:00 | 11:30:00 | b    |    1
(2 rows)

DELETE FROM mpp21090_dropcol_splitdfpt_dml_time WHERE col3='b';
DELETE 1
SELECT * FROM mpp21090_dropcol_splitdfpt_dml_time ORDER BY 1,2,3;
   col1   |   col2   | col3 | col5 
----------+----------+------+------
 11:30:00 | 11:30:00 | a    |    0
(1 row)

