DROP TABLE IF EXISTS mpp21090_dropcol_splitdefpt_addcol_dml_date;
psql:/data/prabhd/test/tincrepo/main/dml/functional/output/mpp21090_dropcol_splitdefpt_addcol_dml_date_opt.sql:14: NOTICE:  table "mpp21090_dropcol_splitdefpt_addcol_dml_date" does not exist, skipping
DROP TABLE
CREATE TABLE mpp21090_dropcol_splitdefpt_addcol_dml_date
(
    col1 date,
    col2 date,
    col3 char,
    col4 date
) 
DISTRIBUTED by (col1)
PARTITION BY LIST(col2)
(
default partition def
);
psql:/data/prabhd/test/tincrepo/main/dml/functional/output/mpp21090_dropcol_splitdefpt_addcol_dml_date_opt.sql:26: NOTICE:  CREATE TABLE will create partition "mpp21090_dropcol_splitdefpt_addcol_dml_date_1_prt_def" for table "mpp21090_dropcol_splitdefpt_addcol_dml_date"
CREATE TABLE
INSERT INTO mpp21090_dropcol_splitdefpt_addcol_dml_date VALUES('2013-12-31','2013-12-31','a','2013-12-31');
INSERT 0 1
SELECT * FROM mpp21090_dropcol_splitdefpt_addcol_dml_date ORDER BY 1,2,3,4;
    col1    |    col2    | col3 |    col4    
------------+------------+------+------------
 2013-12-31 | 2013-12-31 | a    | 2013-12-31
(1 row)

ALTER TABLE mpp21090_dropcol_splitdefpt_addcol_dml_date DROP COLUMN col4;
ALTER TABLE
INSERT INTO mpp21090_dropcol_splitdefpt_addcol_dml_date VALUES('2013-12-31','2013-12-31','b');
INSERT 0 1
SELECT * FROM mpp21090_dropcol_splitdefpt_addcol_dml_date ORDER BY 1,2,3;
    col1    |    col2    | col3 
------------+------------+------
 2013-12-31 | 2013-12-31 | a
 2013-12-31 | 2013-12-31 | b
(2 rows)

ALTER TABLE mpp21090_dropcol_splitdefpt_addcol_dml_date SPLIT DEFAULT PARTITION at ('2013-12-15') into (partition partsplitone,partition def);
psql:/data/prabhd/test/tincrepo/main/dml/functional/output/mpp21090_dropcol_splitdefpt_addcol_dml_date_opt.sql:36: NOTICE:  exchanged partition "def" of relation "mpp21090_dropcol_splitdefpt_addcol_dml_date" with relation "pg_temp_60079"
psql:/data/prabhd/test/tincrepo/main/dml/functional/output/mpp21090_dropcol_splitdefpt_addcol_dml_date_opt.sql:36: NOTICE:  dropped partition "def" for relation "mpp21090_dropcol_splitdefpt_addcol_dml_date"
psql:/data/prabhd/test/tincrepo/main/dml/functional/output/mpp21090_dropcol_splitdefpt_addcol_dml_date_opt.sql:36: NOTICE:  CREATE TABLE will create partition "mpp21090_dropcol_splitdefpt_addcol_dml_date_1_prt_partsplitone" for table "mpp21090_dropcol_splitdefpt_addcol_dml_date"
psql:/data/prabhd/test/tincrepo/main/dml/functional/output/mpp21090_dropcol_splitdefpt_addcol_dml_date_opt.sql:36: NOTICE:  CREATE TABLE will create partition "mpp21090_dropcol_splitdefpt_addcol_dml_date_1_prt_def" for table "mpp21090_dropcol_splitdefpt_addcol_dml_date"
ALTER TABLE
INSERT INTO mpp21090_dropcol_splitdefpt_addcol_dml_date SELECT '2013-12-01', '2013-12-01','e';
INSERT 0 1
SELECT * FROM mpp21090_dropcol_splitdefpt_addcol_dml_date ORDER BY 1,2,3;
    col1    |    col2    | col3 
------------+------------+------
 2013-12-01 | 2013-12-01 | e
 2013-12-31 | 2013-12-31 | a
 2013-12-31 | 2013-12-31 | b
(3 rows)

ALTER TABLE mpp21090_dropcol_splitdefpt_addcol_dml_date ADD COLUMN col5 date DEFAULT '2013-12-31';
ALTER TABLE
INSERT INTO mpp21090_dropcol_splitdefpt_addcol_dml_date VALUES('2013-12-31','2013-12-31','c','2013-12-31');
INSERT 0 1
SELECT * FROM mpp21090_dropcol_splitdefpt_addcol_dml_date ORDER BY 1,2,3,4;
    col1    |    col2    | col3 |    col5    
------------+------------+------+------------
 2013-12-01 | 2013-12-01 | e    | 2013-12-31
 2013-12-31 | 2013-12-31 | a    | 2013-12-31
 2013-12-31 | 2013-12-31 | b    | 2013-12-31
 2013-12-31 | 2013-12-31 | c    | 2013-12-31
(4 rows)

-- Update distribution key
UPDATE mpp21090_dropcol_splitdefpt_addcol_dml_date SET col1 = '2014-02-10' WHERE col2 = '2013-12-01' AND col1 = '2013-12-01';
UPDATE 1
SELECT * FROM mpp21090_dropcol_splitdefpt_addcol_dml_date ORDER BY 1,2,3;
    col1    |    col2    | col3 |    col5    
------------+------------+------+------------
 2013-12-31 | 2013-12-31 | a    | 2013-12-31
 2013-12-31 | 2013-12-31 | b    | 2013-12-31
 2013-12-31 | 2013-12-31 | c    | 2013-12-31
 2014-02-10 | 2013-12-01 | e    | 2013-12-31
(4 rows)

-- Update partition key
UPDATE mpp21090_dropcol_splitdefpt_addcol_dml_date SET col2 = '2014-02-10' WHERE col2 = '2013-12-01' AND col1 = '2014-02-10';
UPDATE 1
SELECT * FROM mpp21090_dropcol_splitdefpt_addcol_dml_date ORDER BY 1,2,3;
    col1    |    col2    | col3 |    col5    
------------+------------+------+------------
 2013-12-31 | 2013-12-31 | a    | 2013-12-31
 2013-12-31 | 2013-12-31 | b    | 2013-12-31
 2013-12-31 | 2013-12-31 | c    | 2013-12-31
 2014-02-10 | 2014-02-10 | e    | 2013-12-31
(4 rows)

DELETE FROM mpp21090_dropcol_splitdefpt_addcol_dml_date WHERE col3='b';
DELETE 1
SELECT * FROM mpp21090_dropcol_splitdefpt_addcol_dml_date ORDER BY 1,2,3;
    col1    |    col2    | col3 |    col5    
------------+------------+------+------------
 2013-12-31 | 2013-12-31 | a    | 2013-12-31
 2013-12-31 | 2013-12-31 | c    | 2013-12-31
 2014-02-10 | 2014-02-10 | e    | 2013-12-31
(3 rows)

