DROP TABLE IF EXISTS mpp21090_drop_lastcol_dml_int8;
DROP TABLE
CREATE TABLE mpp21090_drop_lastcol_dml_int8(
col1 int,
col2 decimal,
col3 char,
col4 date,
col5 int8
) DISTRIBUTED by(col3);
CREATE TABLE
INSERT INTO mpp21090_drop_lastcol_dml_int8 VALUES(0,0.00,'a','2014-01-01',2000000000000000000);
INSERT 0 1
SELECT * FROM mpp21090_drop_lastcol_dml_int8 ORDER BY 1,2,3,4;
 col1 | col2 | col3 |    col4    |        col5         
------+------+------+------------+---------------------
    0 | 0.00 | a    | 2014-01-01 | 2000000000000000000
(1 row)

ALTER TABLE mpp21090_drop_lastcol_dml_int8 DROP COLUMN col5;
ALTER TABLE
INSERT INTO mpp21090_drop_lastcol_dml_int8 SELECT 1,1.00,'b','2014-01-02';
INSERT 0 1
SELECT * FROM mpp21090_drop_lastcol_dml_int8 ORDER BY 1,2,3,4;
 col1 | col2 | col3 |    col4    
------+------+------+------------
    0 | 0.00 | a    | 2014-01-01
    1 | 1.00 | b    | 2014-01-02
(2 rows)

UPDATE mpp21090_drop_lastcol_dml_int8 SET col3='c' WHERE col3 = 'b' AND col1 = 1;
UPDATE 1
SELECT * FROM mpp21090_drop_lastcol_dml_int8 ORDER BY 1,2,3,4;
 col1 | col2 | col3 |    col4    
------+------+------+------------
    0 | 0.00 | a    | 2014-01-01
    1 | 1.00 | c    | 2014-01-02
(2 rows)

DELETE FROM mpp21090_drop_lastcol_dml_int8 WHERE col3='c';
DELETE 1
SELECT * FROM mpp21090_drop_lastcol_dml_int8 ORDER BY 1,2,3,4;
 col1 | col2 | col3 |    col4    
------+------+------+------------
    0 | 0.00 | a    | 2014-01-01
(1 row)

