DROP TABLE IF EXISTS mpp21090_xchange_pttab_dropcol_idx_dml_char;
psql:/data/prabhd/test/tincrepo/main/dml/functional/output/mpp21090_xchange_pttab_dropcol_idx_dml_char_opt.sql:14: NOTICE:  table "mpp21090_xchange_pttab_dropcol_idx_dml_char" does not exist, skipping
DROP TABLE
CREATE TABLE mpp21090_xchange_pttab_dropcol_idx_dml_char
(
    col1 char,
    col2 char,
    col3 char,
    col4 int,
    col5 char
) 
DISTRIBUTED by (col1)
PARTITION BY LIST(col2)(partition partone VALUES('a','b','c','d','e','f','g','h') WITH (APPENDONLY=true, COMPRESSLEVEL=5, ORIENTATION=column),partition parttwo VALUES('i','j','k','l','m','n','o','p') WITH (APPENDONLY=true, COMPRESSLEVEL=5, ORIENTATION=row),partition partthree VALUES('q','r','s','t','u','v','w','x'));
psql:/data/prabhd/test/tincrepo/main/dml/functional/output/mpp21090_xchange_pttab_dropcol_idx_dml_char_opt.sql:24: NOTICE:  CREATE TABLE will create partition "mpp21090_xchange_pttab_dropcol_idx_dml_char_1_prt_partone" for table "mpp21090_xchange_pttab_dropcol_idx_dml_char"
psql:/data/prabhd/test/tincrepo/main/dml/functional/output/mpp21090_xchange_pttab_dropcol_idx_dml_char_opt.sql:24: NOTICE:  CREATE TABLE will create partition "mpp21090_xchange_pttab_dropcol_idx_dml_char_1_prt_parttwo" for table "mpp21090_xchange_pttab_dropcol_idx_dml_char"
psql:/data/prabhd/test/tincrepo/main/dml/functional/output/mpp21090_xchange_pttab_dropcol_idx_dml_char_opt.sql:24: NOTICE:  CREATE TABLE will create partition "mpp21090_xchange_pttab_dropcol_idx_dml_char_1_prt_partthree" for table "mpp21090_xchange_pttab_dropcol_idx_dml_char"
CREATE TABLE
INSERT INTO mpp21090_xchange_pttab_dropcol_idx_dml_char VALUES('g','g','a',0, 'g');
INSERT 0 1
SELECT * FROM mpp21090_xchange_pttab_dropcol_idx_dml_char ORDER BY 1,2,3,4;
 col1 | col2 | col3 | col4 | col5 
------+------+------+------+------
 g    | g    | a    |    0 | g
(1 row)

DROP INDEX IF EXISTS mpp21090_xchange_pttab_dropcol_idx_dml_idx_char;
psql:/data/prabhd/test/tincrepo/main/dml/functional/output/mpp21090_xchange_pttab_dropcol_idx_dml_char_opt.sql:29: NOTICE:  index "mpp21090_xchange_pttab_dropcol_idx_dml_idx_char" does not exist, skipping
DROP INDEX
CREATE INDEX mpp21090_xchange_pttab_dropcol_idx_dml_idx_char on mpp21090_xchange_pttab_dropcol_idx_dml_char(col2);
psql:/data/prabhd/test/tincrepo/main/dml/functional/output/mpp21090_xchange_pttab_dropcol_idx_dml_char_opt.sql:30: NOTICE:  building index for child partition "mpp21090_xchange_pttab_dropcol_idx_dml_char_1_prt_partone"
psql:/data/prabhd/test/tincrepo/main/dml/functional/output/mpp21090_xchange_pttab_dropcol_idx_dml_char_opt.sql:30: NOTICE:  building index for child partition "mpp21090_xchange_pttab_dropcol_idx_dml_char_1_prt_parttwo"
psql:/data/prabhd/test/tincrepo/main/dml/functional/output/mpp21090_xchange_pttab_dropcol_idx_dml_char_opt.sql:30: NOTICE:  building index for child partition "mpp21090_xchange_pttab_dropcol_idx_dml_char_1_prt_partthree"
CREATE INDEX
ALTER TABLE mpp21090_xchange_pttab_dropcol_idx_dml_char DROP COLUMN col1;
psql:/data/prabhd/test/tincrepo/main/dml/functional/output/mpp21090_xchange_pttab_dropcol_idx_dml_char_opt.sql:32: NOTICE:  Dropping a column that is part of the distribution policy forces a NULL distribution policy
psql:/data/prabhd/test/tincrepo/main/dml/functional/output/mpp21090_xchange_pttab_dropcol_idx_dml_char_opt.sql:32: NOTICE:  Dropping a column that is part of the distribution policy forces a NULL distribution policy
psql:/data/prabhd/test/tincrepo/main/dml/functional/output/mpp21090_xchange_pttab_dropcol_idx_dml_char_opt.sql:32: NOTICE:  Dropping a column that is part of the distribution policy forces a NULL distribution policy
psql:/data/prabhd/test/tincrepo/main/dml/functional/output/mpp21090_xchange_pttab_dropcol_idx_dml_char_opt.sql:32: NOTICE:  Dropping a column that is part of the distribution policy forces a NULL distribution policy
ALTER TABLE
-- Create Candidate table for Exchange
DROP TABLE IF EXISTS mpp21090_xchange_pttab_dropcol_idx_dml_char_candidate;
psql:/data/prabhd/test/tincrepo/main/dml/functional/output/mpp21090_xchange_pttab_dropcol_idx_dml_char_opt.sql:35: NOTICE:  table "mpp21090_xchange_pttab_dropcol_idx_dml_char_candidate" does not exist, skipping
DROP TABLE
CREATE TABLE mpp21090_xchange_pttab_dropcol_idx_dml_char_candidate( like mpp21090_xchange_pttab_dropcol_idx_dml_char) distributed randomly;
CREATE TABLE
INSERT INTO mpp21090_xchange_pttab_dropcol_idx_dml_char_candidate VALUES('g','z',1,'g');
INSERT 0 1
-- Exchange 
ALTER TABLE mpp21090_xchange_pttab_dropcol_idx_dml_char EXCHANGE PARTITION FOR('d') WITH TABLE mpp21090_xchange_pttab_dropcol_idx_dml_char_candidate;
psql:/data/prabhd/test/tincrepo/main/dml/functional/output/mpp21090_xchange_pttab_dropcol_idx_dml_char_opt.sql:40: NOTICE:  exchanged partition "partone" of relation "mpp21090_xchange_pttab_dropcol_idx_dml_char" with relation "mpp21090_xchange_pttab_dropcol_idx_dml_char_candidate"
ALTER TABLE
SELECT * FROM mpp21090_xchange_pttab_dropcol_idx_dml_char ORDER BY 1,2,3;
 col2 | col3 | col4 | col5 
------+------+------+------
 g    | z    |    1 | g
(1 row)

SELECT * FROM mpp21090_xchange_pttab_dropcol_idx_dml_char_candidate ORDER BY 1,2,3;
 col2 | col3 | col4 | col5 
------+------+------+------
 g    | a    |    0 | g
(1 row)

-- DML on partition table
INSERT INTO mpp21090_xchange_pttab_dropcol_idx_dml_char SELECT  'a','b', 1, 'a';
INSERT 0 1
SELECT * FROM mpp21090_xchange_pttab_dropcol_idx_dml_char ORDER BY 1,2,3;
 col2 | col3 | col4 | col5 
------+------+------+------
 a    | b    |    1 | a
 g    | z    |    1 | g
(2 rows)

UPDATE mpp21090_xchange_pttab_dropcol_idx_dml_char SET col5 = 'z' WHERE col2 = 'a' AND col5 = 'a';
UPDATE 1
SELECT * FROM mpp21090_xchange_pttab_dropcol_idx_dml_char ORDER BY 1,2,3;
 col2 | col3 | col4 | col5 
------+------+------+------
 a    | b    |    1 | z
 g    | z    |    1 | g
(2 rows)

UPDATE mpp21090_xchange_pttab_dropcol_idx_dml_char SET col2 ='g' WHERE col3='b';
UPDATE 1
SELECT * FROM mpp21090_xchange_pttab_dropcol_idx_dml_char ORDER BY 1,2,3;
 col2 | col3 | col4 | col5 
------+------+------+------
 g    | b    |    1 | z
 g    | z    |    1 | g
(2 rows)

DELETE FROM mpp21090_xchange_pttab_dropcol_idx_dml_char WHERE col3='b';
DELETE 1
SELECT * FROM mpp21090_xchange_pttab_dropcol_idx_dml_char ORDER BY 1,2,3;
 col2 | col3 | col4 | col5 
------+------+------+------
 g    | z    |    1 | g
(1 row)

-- DML on candidate table
INSERT INTO mpp21090_xchange_pttab_dropcol_idx_dml_char_candidate SELECT 'a','b', 1, 'a';
INSERT 0 1
SELECT * FROM mpp21090_xchange_pttab_dropcol_idx_dml_char_candidate ORDER BY 1,2,3;
 col2 | col3 | col4 | col5 
------+------+------+------
 a    | b    |    1 | a
 g    | a    |    0 | g
(2 rows)

UPDATE mpp21090_xchange_pttab_dropcol_idx_dml_char_candidate SET col2='g' WHERE col3='a';
UPDATE 1
SELECT * FROM mpp21090_xchange_pttab_dropcol_idx_dml_char_candidate ORDER BY 1,2,3;
 col2 | col3 | col4 | col5 
------+------+------+------
 a    | b    |    1 | a
 g    | a    |    0 | g
(2 rows)

DELETE FROM mpp21090_xchange_pttab_dropcol_idx_dml_char_candidate WHERE col3='a';
DELETE 1
SELECT * FROM mpp21090_xchange_pttab_dropcol_idx_dml_char_candidate ORDER BY 1,2,3;
 col2 | col3 | col4 | col5 
------+------+------+------
 a    | b    |    1 | a
(1 row)

