DROP TABLE IF EXISTS mpp21090_pttab_dropfirstcol_addpt_text;
psql:/data/prabhd/test/tincrepo/main/dml/functional/output/mpp21090_pttab_dropfirstcol_addpt_text_opt.sql:14: NOTICE:  table "mpp21090_pttab_dropfirstcol_addpt_text" does not exist, skipping
DROP TABLE
CREATE TABLE mpp21090_pttab_dropfirstcol_addpt_text
(
    col1 text,
    col2 text,
    col3 char,
    col4 text,
    col5 int
) 
DISTRIBUTED by (col1)
PARTITION BY LIST(col2)(partition partone VALUES('abcdefghijklmnop') WITH (APPENDONLY=true, COMPRESSLEVEL=5, ORIENTATION=column),partition parttwo VALUES('qrstuvwxyz') WITH (APPENDONLY=true, COMPRESSLEVEL=5, ORIENTATION=row),partition partthree VALUES('ghi'));
psql:/data/prabhd/test/tincrepo/main/dml/functional/output/mpp21090_pttab_dropfirstcol_addpt_text_opt.sql:24: NOTICE:  CREATE TABLE will create partition "mpp21090_pttab_dropfirstcol_addpt_text_1_prt_partone" for table "mpp21090_pttab_dropfirstcol_addpt_text"
psql:/data/prabhd/test/tincrepo/main/dml/functional/output/mpp21090_pttab_dropfirstcol_addpt_text_opt.sql:24: NOTICE:  CREATE TABLE will create partition "mpp21090_pttab_dropfirstcol_addpt_text_1_prt_parttwo" for table "mpp21090_pttab_dropfirstcol_addpt_text"
psql:/data/prabhd/test/tincrepo/main/dml/functional/output/mpp21090_pttab_dropfirstcol_addpt_text_opt.sql:24: NOTICE:  CREATE TABLE will create partition "mpp21090_pttab_dropfirstcol_addpt_text_1_prt_partthree" for table "mpp21090_pttab_dropfirstcol_addpt_text"
CREATE TABLE
INSERT INTO mpp21090_pttab_dropfirstcol_addpt_text VALUES('abcdefghijklmnop','abcdefghijklmnop','a','abcdefghijklmnop',0);
INSERT 0 1
ALTER TABLE mpp21090_pttab_dropfirstcol_addpt_text DROP COLUMN col1;
psql:/data/prabhd/test/tincrepo/main/dml/functional/output/mpp21090_pttab_dropfirstcol_addpt_text_opt.sql:28: NOTICE:  Dropping a column that is part of the distribution policy forces a NULL distribution policy
psql:/data/prabhd/test/tincrepo/main/dml/functional/output/mpp21090_pttab_dropfirstcol_addpt_text_opt.sql:28: NOTICE:  Dropping a column that is part of the distribution policy forces a NULL distribution policy
psql:/data/prabhd/test/tincrepo/main/dml/functional/output/mpp21090_pttab_dropfirstcol_addpt_text_opt.sql:28: NOTICE:  Dropping a column that is part of the distribution policy forces a NULL distribution policy
psql:/data/prabhd/test/tincrepo/main/dml/functional/output/mpp21090_pttab_dropfirstcol_addpt_text_opt.sql:28: NOTICE:  Dropping a column that is part of the distribution policy forces a NULL distribution policy
ALTER TABLE
ALTER TABLE mpp21090_pttab_dropfirstcol_addpt_text ADD PARTITION partfour VALUES('xyz');
psql:/data/prabhd/test/tincrepo/main/dml/functional/output/mpp21090_pttab_dropfirstcol_addpt_text_opt.sql:29: NOTICE:  CREATE TABLE will create partition "mpp21090_pttab_dropfirstcol_addpt_text_1_prt_partfour" for table "mpp21090_pttab_dropfirstcol_addpt_text"
ALTER TABLE
INSERT INTO mpp21090_pttab_dropfirstcol_addpt_text SELECT 'xyz','b','xyz', 1;
INSERT 0 1
SELECT * FROM mpp21090_pttab_dropfirstcol_addpt_text ORDER BY 1,2,3;
       col2       | col3 |       col4       | col5 
------------------+------+------------------+------
 abcdefghijklmnop | a    | abcdefghijklmnop |    0
 xyz              | b    | xyz              |    1
(2 rows)

UPDATE mpp21090_pttab_dropfirstcol_addpt_text SET col4 = 'qrstuvwxyz' WHERE col2 = 'xyz' AND col4 = 'xyz';
UPDATE 1
SELECT * FROM mpp21090_pttab_dropfirstcol_addpt_text ORDER BY 1,2,3;
       col2       | col3 |       col4       | col5 
------------------+------+------------------+------
 abcdefghijklmnop | a    | abcdefghijklmnop |    0
 xyz              | b    | qrstuvwxyz       |    1
(2 rows)

-- Update partition key
UPDATE mpp21090_pttab_dropfirstcol_addpt_text SET col2 = 'qrstuvwxyz' WHERE col2 = 'xyz' AND col4 = 'qrstuvwxyz';
UPDATE 1
SELECT * FROM mpp21090_pttab_dropfirstcol_addpt_text ORDER BY 1,2,3;
       col2       | col3 |       col4       | col5 
------------------+------+------------------+------
 abcdefghijklmnop | a    | abcdefghijklmnop |    0
 qrstuvwxyz       | b    | qrstuvwxyz       |    1
(2 rows)

DELETE FROM mpp21090_pttab_dropfirstcol_addpt_text WHERE col2 = 'qrstuvwxyz';
DELETE 1
SELECT * FROM mpp21090_pttab_dropfirstcol_addpt_text ORDER BY 1,2,3;
       col2       | col3 |       col4       | col5 
------------------+------+------------------+------
 abcdefghijklmnop | a    | abcdefghijklmnop |    0
(1 row)

