DROP TABLE IF EXISTS mpp21090_pttab_dropcol_addcol_addpt_dml_interval;
psql:/data/prabhd/test/tincrepo/main/dml/functional/output/mpp21090_pttab_dropcol_addcol_addpt_dml_interval_opt.sql:14: NOTICE:  table "mpp21090_pttab_dropcol_addcol_addpt_dml_interval" does not exist, skipping
DROP TABLE
CREATE TABLE mpp21090_pttab_dropcol_addcol_addpt_dml_interval
(
    col1 interval,
    col2 interval,
    col3 char,
    col4 int
) 
DISTRIBUTED by (col1)
PARTITION BY RANGE(col2)(partition partone start('1 sec') end('1 min')  WITH (APPENDONLY=true, COMPRESSLEVEL=5, ORIENTATION=column),partition parttwo start('1 min') end('1 hour') WITH (APPENDONLY=true, COMPRESSLEVEL=5, ORIENTATION=row),partition partthree start('1 hour') end('12 hours'));
psql:/data/prabhd/test/tincrepo/main/dml/functional/output/mpp21090_pttab_dropcol_addcol_addpt_dml_interval_opt.sql:23: NOTICE:  CREATE TABLE will create partition "mpp21090_pttab_dropcol_addcol_addpt_dml_interval_1_prt_partone" for table "mpp21090_pttab_dropcol_addcol_addpt_dml_interval"
psql:/data/prabhd/test/tincrepo/main/dml/functional/output/mpp21090_pttab_dropcol_addcol_addpt_dml_interval_opt.sql:23: NOTICE:  CREATE TABLE will create partition "mpp21090_pttab_dropcol_addcol_addpt_dml_interval_1_prt_parttwo" for table "mpp21090_pttab_dropcol_addcol_addpt_dml_interval"
psql:/data/prabhd/test/tincrepo/main/dml/functional/output/mpp21090_pttab_dropcol_addcol_addpt_dml_interval_opt.sql:23: NOTICE:  CREATE TABLE will create partition "mpp21090_pttab_dropcol_addcol_addpt_dml_interva_1_prt_partthree" for table "mpp21090_pttab_dropcol_addcol_addpt_dml_interval"
CREATE TABLE
INSERT INTO mpp21090_pttab_dropcol_addcol_addpt_dml_interval VALUES('1 hour','1 hour','a',0);
INSERT 0 1
ALTER TABLE mpp21090_pttab_dropcol_addcol_addpt_dml_interval DROP COLUMN col4;
ALTER TABLE
INSERT INTO mpp21090_pttab_dropcol_addcol_addpt_dml_interval VALUES('1 hour','1 hour','b');
INSERT 0 1
ALTER TABLE mpp21090_pttab_dropcol_addcol_addpt_dml_interval ADD COLUMN col5 interval DEFAULT '1 hour';
ALTER TABLE
INSERT INTO mpp21090_pttab_dropcol_addcol_addpt_dml_interval SELECT '1 hour','1 hour','c','1 hour';
INSERT 0 1
SELECT * FROM mpp21090_pttab_dropcol_addcol_addpt_dml_interval ORDER BY 1,2,3;
   col1   |   col2   | col3 |   col5   
----------+----------+------+----------
 01:00:00 | 01:00:00 | a    | 01:00:00
 01:00:00 | 01:00:00 | b    | 01:00:00
 01:00:00 | 01:00:00 | c    | 01:00:00
(3 rows)

UPDATE mpp21090_pttab_dropcol_addcol_addpt_dml_interval SET col5 = '12 hours' WHERE col2 = '1 hour' AND col1 = '1 hour';
UPDATE 3
SELECT * FROM mpp21090_pttab_dropcol_addcol_addpt_dml_interval ORDER BY 1,2,3;
   col1   |   col2   | col3 |   col5   
----------+----------+------+----------
 01:00:00 | 01:00:00 | a    | 12:00:00
 01:00:00 | 01:00:00 | b    | 12:00:00
 01:00:00 | 01:00:00 | c    | 12:00:00
(3 rows)

DELETE FROM mpp21090_pttab_dropcol_addcol_addpt_dml_interval WHERE col5 = '12 hours';
DELETE 3
SELECT * FROM mpp21090_pttab_dropcol_addcol_addpt_dml_interval ORDER BY 1,2,3;
 col1 | col2 | col3 | col5 
------+------+------+------
(0 rows)

ALTER TABLE mpp21090_pttab_dropcol_addcol_addpt_dml_interval ADD PARTITION partfour start('12 hours') end('1 day') inclusive;
psql:/data/prabhd/test/tincrepo/main/dml/functional/output/mpp21090_pttab_dropcol_addcol_addpt_dml_interval_opt.sql:41: NOTICE:  CREATE TABLE will create partition "mpp21090_pttab_dropcol_addcol_addpt_dml_interval_1_prt_partfour" for table "mpp21090_pttab_dropcol_addcol_addpt_dml_interval"
ALTER TABLE
ALTER TABLE mpp21090_pttab_dropcol_addcol_addpt_dml_interval ADD DEFAULT partition def;
psql:/data/prabhd/test/tincrepo/main/dml/functional/output/mpp21090_pttab_dropcol_addcol_addpt_dml_interval_opt.sql:42: NOTICE:  CREATE TABLE will create partition "mpp21090_pttab_dropcol_addcol_addpt_dml_interval_1_prt_def" for table "mpp21090_pttab_dropcol_addcol_addpt_dml_interval"
ALTER TABLE
INSERT INTO mpp21090_pttab_dropcol_addcol_addpt_dml_interval SELECT '14 hours','14 hours','d','14 hours';
INSERT 0 1
SELECT * FROM mpp21090_pttab_dropcol_addcol_addpt_dml_interval ORDER BY 1,2,3;
   col1   |   col2   | col3 |   col5   
----------+----------+------+----------
 14:00:00 | 14:00:00 | d    | 14:00:00
(1 row)

UPDATE mpp21090_pttab_dropcol_addcol_addpt_dml_interval SET col5 = '12 hours' WHERE col2 = '14 hours' AND col3 ='d';
UPDATE 1
SELECT * FROM mpp21090_pttab_dropcol_addcol_addpt_dml_interval ORDER BY 1,2,3;
   col1   |   col2   | col3 |   col5   
----------+----------+------+----------
 14:00:00 | 14:00:00 | d    | 12:00:00
(1 row)

-- Update partition key
UPDATE mpp21090_pttab_dropcol_addcol_addpt_dml_interval SET col2 = '12 hours' WHERE col2 = '14 hours' AND col3 ='d';
UPDATE 1
SELECT * FROM mpp21090_pttab_dropcol_addcol_addpt_dml_interval ORDER BY 1,2,3;
   col1   |   col2   | col3 |   col5   
----------+----------+------+----------
 14:00:00 | 12:00:00 | d    | 12:00:00
(1 row)

DELETE FROM mpp21090_pttab_dropcol_addcol_addpt_dml_interval WHERE col5 = '12 hours';
DELETE 1
SELECT * FROM mpp21090_pttab_dropcol_addcol_addpt_dml_interval ORDER BY 1,2,3;
 col1 | col2 | col3 | col5 
------+------+------+------
(0 rows)

