DROP TABLE IF EXISTS mpp21090_dropcol_addcol_splitpt_dml_timestamp;
psql:/data/prabhd/test/tincrepo/main/dml/functional/output/mpp21090_dropcol_addcol_splitpt_dml_timestamp_opt.sql:14: NOTICE:  table "mpp21090_dropcol_addcol_splitpt_dml_timestamp" does not exist, skipping
DROP TABLE
CREATE TABLE mpp21090_dropcol_addcol_splitpt_dml_timestamp
(
    col1 timestamp,
    col2 timestamp,
    col3 char,
    col4 timestamp
) 
DISTRIBUTED by (col1)
PARTITION BY RANGE(col2)(partition partone start('2013-12-01 12:00:00') end('2013-12-31 12:00:00') WITH(APPENDONLY=true, COMPRESSLEVEL=5, ORIENTATION=column),partition parttwo start('2013-12-31 12:00:00') end('2014-01-01 12:00:00') inclusive WITH (APPENDONLY=true, COMPRESSLEVEL=5, ORIENTATION=row),partition partthree start('2014-01-02 12:00:00') end('2014-02-01 12:00:00'));
psql:/data/prabhd/test/tincrepo/main/dml/functional/output/mpp21090_dropcol_addcol_splitpt_dml_timestamp_opt.sql:23: NOTICE:  CREATE TABLE will create partition "mpp21090_dropcol_addcol_splitpt_dml_timestamp_1_prt_partone" for table "mpp21090_dropcol_addcol_splitpt_dml_timestamp"
psql:/data/prabhd/test/tincrepo/main/dml/functional/output/mpp21090_dropcol_addcol_splitpt_dml_timestamp_opt.sql:23: NOTICE:  CREATE TABLE will create partition "mpp21090_dropcol_addcol_splitpt_dml_timestamp_1_prt_parttwo" for table "mpp21090_dropcol_addcol_splitpt_dml_timestamp"
psql:/data/prabhd/test/tincrepo/main/dml/functional/output/mpp21090_dropcol_addcol_splitpt_dml_timestamp_opt.sql:23: NOTICE:  CREATE TABLE will create partition "mpp21090_dropcol_addcol_splitpt_dml_timestamp_1_prt_partthree" for table "mpp21090_dropcol_addcol_splitpt_dml_timestamp"
CREATE TABLE
INSERT INTO mpp21090_dropcol_addcol_splitpt_dml_timestamp VALUES('2013-12-31 12:00:00','2013-12-31 12:00:00','a','2013-12-31 12:00:00');
INSERT 0 1
SELECT * FROM mpp21090_dropcol_addcol_splitpt_dml_timestamp ORDER BY 1,2,3,4;
        col1         |        col2         | col3 |        col4         
---------------------+---------------------+------+---------------------
 2013-12-31 12:00:00 | 2013-12-31 12:00:00 | a    | 2013-12-31 12:00:00
(1 row)

ALTER TABLE mpp21090_dropcol_addcol_splitpt_dml_timestamp ADD COLUMN col5 int DEFAULT 10;
ALTER TABLE
INSERT INTO mpp21090_dropcol_addcol_splitpt_dml_timestamp VALUES('2013-12-31 12:00:00','2013-12-31 12:00:00','b','2013-12-31 12:00:00',0);
INSERT 0 1
SELECT * FROM mpp21090_dropcol_addcol_splitpt_dml_timestamp ORDER BY 1,2,3,4;
        col1         |        col2         | col3 |        col4         | col5 
---------------------+---------------------+------+---------------------+------
 2013-12-31 12:00:00 | 2013-12-31 12:00:00 | a    | 2013-12-31 12:00:00 |   10
 2013-12-31 12:00:00 | 2013-12-31 12:00:00 | b    | 2013-12-31 12:00:00 |    0
(2 rows)

ALTER TABLE mpp21090_dropcol_addcol_splitpt_dml_timestamp DROP COLUMN col4;
ALTER TABLE
INSERT INTO mpp21090_dropcol_addcol_splitpt_dml_timestamp VALUES('2013-12-31 12:00:00','2013-12-31 12:00:00','c',1);
INSERT 0 1
SELECT * FROM mpp21090_dropcol_addcol_splitpt_dml_timestamp ORDER BY 1,2,3,4;
        col1         |        col2         | col3 | col5 
---------------------+---------------------+------+------
 2013-12-31 12:00:00 | 2013-12-31 12:00:00 | a    |   10
 2013-12-31 12:00:00 | 2013-12-31 12:00:00 | b    |    0
 2013-12-31 12:00:00 | 2013-12-31 12:00:00 | c    |    1
(3 rows)

ALTER TABLE mpp21090_dropcol_addcol_splitpt_dml_timestamp SPLIT PARTITION partone at ('2013-12-15 12:00:00') into (partition partsplitone,partition partsplitwo);
psql:/data/prabhd/test/tincrepo/main/dml/functional/output/mpp21090_dropcol_addcol_splitpt_dml_timestamp_opt.sql:38: NOTICE:  exchanged partition "partone" of relation "mpp21090_dropcol_addcol_splitpt_dml_timestamp" with relation "pg_temp_56588"
psql:/data/prabhd/test/tincrepo/main/dml/functional/output/mpp21090_dropcol_addcol_splitpt_dml_timestamp_opt.sql:38: NOTICE:  dropped partition "partone" for relation "mpp21090_dropcol_addcol_splitpt_dml_timestamp"
psql:/data/prabhd/test/tincrepo/main/dml/functional/output/mpp21090_dropcol_addcol_splitpt_dml_timestamp_opt.sql:38: NOTICE:  CREATE TABLE will create partition "mpp21090_dropcol_addcol_splitpt_dml_timestam_1_prt_partsplitone" for table "mpp21090_dropcol_addcol_splitpt_dml_timestamp"
psql:/data/prabhd/test/tincrepo/main/dml/functional/output/mpp21090_dropcol_addcol_splitpt_dml_timestamp_opt.sql:38: NOTICE:  CREATE TABLE will create partition "mpp21090_dropcol_addcol_splitpt_dml_timestamp_1_prt_partsplitwo" for table "mpp21090_dropcol_addcol_splitpt_dml_timestamp"
ALTER TABLE
INSERT INTO mpp21090_dropcol_addcol_splitpt_dml_timestamp SELECT '2013-12-01 12:00:00', '2013-12-01 12:00:00','d', 1;
INSERT 0 1
SELECT * FROM mpp21090_dropcol_addcol_splitpt_dml_timestamp ORDER BY 1,2,3;
        col1         |        col2         | col3 | col5 
---------------------+---------------------+------+------
 2013-12-01 12:00:00 | 2013-12-01 12:00:00 | d    |    1
 2013-12-31 12:00:00 | 2013-12-31 12:00:00 | a    |   10
 2013-12-31 12:00:00 | 2013-12-31 12:00:00 | b    |    0
 2013-12-31 12:00:00 | 2013-12-31 12:00:00 | c    |    1
(4 rows)

-- Update distribution key
UPDATE mpp21090_dropcol_addcol_splitpt_dml_timestamp SET col1 = '2014-02-10 12:00:00' WHERE col2 = '2013-12-01 12:00:00' AND col1 = '2013-12-01 12:00:00';
UPDATE 1
SELECT * FROM mpp21090_dropcol_addcol_splitpt_dml_timestamp ORDER BY 1,2,3;
        col1         |        col2         | col3 | col5 
---------------------+---------------------+------+------
 2013-12-31 12:00:00 | 2013-12-31 12:00:00 | a    |   10
 2013-12-31 12:00:00 | 2013-12-31 12:00:00 | b    |    0
 2013-12-31 12:00:00 | 2013-12-31 12:00:00 | c    |    1
 2014-02-10 12:00:00 | 2013-12-01 12:00:00 | d    |    1
(4 rows)

-- Update partition key
UPDATE mpp21090_dropcol_addcol_splitpt_dml_timestamp SET col2 ='2013-12-31 12:00:00'  WHERE col2 = '2013-12-01 12:00:00' AND col1 = '2014-02-10 12:00:00';
UPDATE 1
SELECT * FROM mpp21090_dropcol_addcol_splitpt_dml_timestamp ORDER BY 1,2,3;
        col1         |        col2         | col3 | col5 
---------------------+---------------------+------+------
 2013-12-31 12:00:00 | 2013-12-31 12:00:00 | a    |   10
 2013-12-31 12:00:00 | 2013-12-31 12:00:00 | b    |    0
 2013-12-31 12:00:00 | 2013-12-31 12:00:00 | c    |    1
 2014-02-10 12:00:00 | 2013-12-31 12:00:00 | d    |    1
(4 rows)

DELETE FROM mpp21090_dropcol_addcol_splitpt_dml_timestamp WHERE col3='b';
DELETE 1
SELECT * FROM mpp21090_dropcol_addcol_splitpt_dml_timestamp ORDER BY 1,2,3;
        col1         |        col2         | col3 | col5 
---------------------+---------------------+------+------
 2013-12-31 12:00:00 | 2013-12-31 12:00:00 | a    |   10
 2013-12-31 12:00:00 | 2013-12-31 12:00:00 | c    |    1
 2014-02-10 12:00:00 | 2013-12-31 12:00:00 | d    |    1
(3 rows)

