DROP TABLE IF EXISTS mpp21090_defpt_dropcol_addcol_dml_text;
psql:/data/prabhd/test/tincrepo/main/dml/functional/output/mpp21090_defpt_dropcol_addcol_dml_text_opt.sql:14: NOTICE:  table "mpp21090_defpt_dropcol_addcol_dml_text" does not exist, skipping
DROP TABLE
CREATE TABLE mpp21090_defpt_dropcol_addcol_dml_text
(
    col1 text,
    col2 text,
    col3 char,
    col4 int
) 
DISTRIBUTED by (col1)
PARTITION BY LIST(col2)
(
default partition def
);
psql:/data/prabhd/test/tincrepo/main/dml/functional/output/mpp21090_defpt_dropcol_addcol_dml_text_opt.sql:26: NOTICE:  CREATE TABLE will create partition "mpp21090_defpt_dropcol_addcol_dml_text_1_prt_def" for table "mpp21090_defpt_dropcol_addcol_dml_text"
CREATE TABLE
INSERT INTO mpp21090_defpt_dropcol_addcol_dml_text VALUES('abcdefghijklmnop','abcdefghijklmnop','a',0);
INSERT 0 1
ALTER TABLE mpp21090_defpt_dropcol_addcol_dml_text DROP COLUMN col4;
ALTER TABLE
INSERT INTO mpp21090_defpt_dropcol_addcol_dml_text SELECT 'xyz','xyz','b';
INSERT 0 1
SELECT * FROM mpp21090_defpt_dropcol_addcol_dml_text ORDER BY 1,2,3;
       col1       |       col2       | col3 
------------------+------------------+------
 abcdefghijklmnop | abcdefghijklmnop | a
 xyz              | xyz              | b
(2 rows)

ALTER TABLE mpp21090_defpt_dropcol_addcol_dml_text ADD COLUMN col5 text;
ALTER TABLE
INSERT INTO mpp21090_defpt_dropcol_addcol_dml_text SELECT 'abcdefghijklmnop','abcdefghijklmnop','c','abcdefghijklmnop';
INSERT 0 1
SELECT * FROM mpp21090_defpt_dropcol_addcol_dml_text ORDER BY 1,2,3;
       col1       |       col2       | col3 |       col5       
------------------+------------------+------+------------------
 abcdefghijklmnop | abcdefghijklmnop | a    | 
 abcdefghijklmnop | abcdefghijklmnop | c    | abcdefghijklmnop
 xyz              | xyz              | b    | 
(3 rows)

UPDATE mpp21090_defpt_dropcol_addcol_dml_text SET col1 = 'qrstuvwxyz' WHERE col2 = 'xyz' AND col1 = 'xyz';
UPDATE 1
SELECT * FROM mpp21090_defpt_dropcol_addcol_dml_text ORDER BY 1,2,3;
       col1       |       col2       | col3 |       col5       
------------------+------------------+------+------------------
 abcdefghijklmnop | abcdefghijklmnop | a    | 
 abcdefghijklmnop | abcdefghijklmnop | c    | abcdefghijklmnop
 qrstuvwxyz       | xyz              | b    | 
(3 rows)

-- Update partition key
UPDATE mpp21090_defpt_dropcol_addcol_dml_text SET col2 = 'qrstuvwxyz' WHERE col2 = 'xyz' AND col1 = 'qrstuvwxyz';
UPDATE 1
SELECT * FROM mpp21090_defpt_dropcol_addcol_dml_text ORDER BY 1,2,3;
       col1       |       col2       | col3 |       col5       
------------------+------------------+------+------------------
 abcdefghijklmnop | abcdefghijklmnop | a    | 
 abcdefghijklmnop | abcdefghijklmnop | c    | abcdefghijklmnop
 qrstuvwxyz       | qrstuvwxyz       | b    | 
(3 rows)

DELETE FROM mpp21090_defpt_dropcol_addcol_dml_text WHERE col2 = 'qrstuvwxyz';
DELETE 1
SELECT * FROM mpp21090_defpt_dropcol_addcol_dml_text ORDER BY 1,2,3;
       col1       |       col2       | col3 |       col5       
------------------+------------------+------+------------------
 abcdefghijklmnop | abcdefghijklmnop | a    | 
 abcdefghijklmnop | abcdefghijklmnop | c    | abcdefghijklmnop
(2 rows)

