DROP TABLE IF EXISTS mpp21090_defpt_dropcol_addcol_dml_int8;
psql:/data/prabhd/test/tincrepo/main/dml/functional/output/mpp21090_defpt_dropcol_addcol_dml_int8_opt.sql:14: NOTICE:  table "mpp21090_defpt_dropcol_addcol_dml_int8" does not exist, skipping
DROP TABLE
CREATE TABLE mpp21090_defpt_dropcol_addcol_dml_int8
(
    col1 int8,
    col2 int8,
    col3 char,
    col4 int
) 
DISTRIBUTED by (col1)
PARTITION BY LIST(col2)
(
default partition def
);
psql:/data/prabhd/test/tincrepo/main/dml/functional/output/mpp21090_defpt_dropcol_addcol_dml_int8_opt.sql:26: NOTICE:  CREATE TABLE will create partition "mpp21090_defpt_dropcol_addcol_dml_int8_1_prt_def" for table "mpp21090_defpt_dropcol_addcol_dml_int8"
CREATE TABLE
INSERT INTO mpp21090_defpt_dropcol_addcol_dml_int8 VALUES(2000000000000000000,2000000000000000000,'a',0);
INSERT 0 1
ALTER TABLE mpp21090_defpt_dropcol_addcol_dml_int8 DROP COLUMN col4;
ALTER TABLE
INSERT INTO mpp21090_defpt_dropcol_addcol_dml_int8 SELECT 3500000000000000000,3500000000000000000,'b';
INSERT 0 1
SELECT * FROM mpp21090_defpt_dropcol_addcol_dml_int8 ORDER BY 1,2,3;
        col1         |        col2         | col3 
---------------------+---------------------+------
 2000000000000000000 | 2000000000000000000 | a
 3500000000000000000 | 3500000000000000000 | b
(2 rows)

ALTER TABLE mpp21090_defpt_dropcol_addcol_dml_int8 ADD COLUMN col5 int8;
ALTER TABLE
INSERT INTO mpp21090_defpt_dropcol_addcol_dml_int8 SELECT 2000000000000000000,2000000000000000000,'c',2000000000000000000;
INSERT 0 1
SELECT * FROM mpp21090_defpt_dropcol_addcol_dml_int8 ORDER BY 1,2,3;
        col1         |        col2         | col3 |        col5         
---------------------+---------------------+------+---------------------
 2000000000000000000 | 2000000000000000000 | a    |                    
 2000000000000000000 | 2000000000000000000 | c    | 2000000000000000000
 3500000000000000000 | 3500000000000000000 | b    |                    
(3 rows)

UPDATE mpp21090_defpt_dropcol_addcol_dml_int8 SET col1 = 1000000000000000000 WHERE col2 = 3500000000000000000 AND col1 = 3500000000000000000;
UPDATE 1
SELECT * FROM mpp21090_defpt_dropcol_addcol_dml_int8 ORDER BY 1,2,3;
        col1         |        col2         | col3 |        col5         
---------------------+---------------------+------+---------------------
 1000000000000000000 | 3500000000000000000 | b    |                    
 2000000000000000000 | 2000000000000000000 | a    |                    
 2000000000000000000 | 2000000000000000000 | c    | 2000000000000000000
(3 rows)

-- Update partition key
UPDATE mpp21090_defpt_dropcol_addcol_dml_int8 SET col2 = 1000000000000000000 WHERE col2 = 3500000000000000000 AND col1 = 1000000000000000000;
UPDATE 1
SELECT * FROM mpp21090_defpt_dropcol_addcol_dml_int8 ORDER BY 1,2,3;
        col1         |        col2         | col3 |        col5         
---------------------+---------------------+------+---------------------
 1000000000000000000 | 1000000000000000000 | b    |                    
 2000000000000000000 | 2000000000000000000 | a    |                    
 2000000000000000000 | 2000000000000000000 | c    | 2000000000000000000
(3 rows)

DELETE FROM mpp21090_defpt_dropcol_addcol_dml_int8 WHERE col2 = 1000000000000000000;
DELETE 1
SELECT * FROM mpp21090_defpt_dropcol_addcol_dml_int8 ORDER BY 1,2,3;
        col1         |        col2         | col3 |        col5         
---------------------+---------------------+------+---------------------
 2000000000000000000 | 2000000000000000000 | a    |                    
 2000000000000000000 | 2000000000000000000 | c    | 2000000000000000000
(2 rows)

