DROP TABLE IF EXISTS mpp21090_changedistpolicy_dml_pttab_float;
psql:/data/prabhd/test/tincrepo/main/dml/functional/output/mpp21090_changedistpolicy_dml_pttab_float_opt.sql:14: NOTICE:  table "mpp21090_changedistpolicy_dml_pttab_float" does not exist, skipping
DROP TABLE
CREATE TABLE mpp21090_changedistpolicy_dml_pttab_float
(
    col1 float,
    col2 float,
    col3 char,
    col4 float,
    col5 int
) DISTRIBUTED BY (col1) PARTITION BY RANGE(col2)(partition partone start(1.00) end(10.00)  WITH (APPENDONLY=true, COMPRESSLEVEL=5, ORIENTATION=column),partition parttwo start(10.00) end(20.00) WITH (APPENDONLY=true, COMPRESSLEVEL=5, ORIENTATION=row),partition partthree start(20.00) end(30.00));
psql:/data/prabhd/test/tincrepo/main/dml/functional/output/mpp21090_changedistpolicy_dml_pttab_float_opt.sql:22: NOTICE:  CREATE TABLE will create partition "mpp21090_changedistpolicy_dml_pttab_float_1_prt_partone" for table "mpp21090_changedistpolicy_dml_pttab_float"
psql:/data/prabhd/test/tincrepo/main/dml/functional/output/mpp21090_changedistpolicy_dml_pttab_float_opt.sql:22: NOTICE:  CREATE TABLE will create partition "mpp21090_changedistpolicy_dml_pttab_float_1_prt_parttwo" for table "mpp21090_changedistpolicy_dml_pttab_float"
psql:/data/prabhd/test/tincrepo/main/dml/functional/output/mpp21090_changedistpolicy_dml_pttab_float_opt.sql:22: NOTICE:  CREATE TABLE will create partition "mpp21090_changedistpolicy_dml_pttab_float_1_prt_partthree" for table "mpp21090_changedistpolicy_dml_pttab_float"
CREATE TABLE
INSERT INTO mpp21090_changedistpolicy_dml_pttab_float VALUES(2.00,2.00,'a',2.00,0);
INSERT 0 1
SELECT * FROM mpp21090_changedistpolicy_dml_pttab_float ORDER BY 1,2,3,4;
 col1 | col2 | col3 | col4 | col5 
------+------+------+------+------
    2 |    2 | a    |    2 |    0
(1 row)

ALTER TABLE mpp21090_changedistpolicy_dml_pttab_float DROP COLUMN col4;
ALTER TABLE
INSERT INTO mpp21090_changedistpolicy_dml_pttab_float VALUES(2.00,2.00,'b',1);
INSERT 0 1
SELECT * FROM mpp21090_changedistpolicy_dml_pttab_float ORDER BY 1,2,3,4;
 col1 | col2 | col3 | col5 
------+------+------+------
    2 |    2 | a    |    0
    2 |    2 | b    |    1
(2 rows)

ALTER TABLE mpp21090_changedistpolicy_dml_pttab_float SET DISTRIBUTED BY (col3);
ALTER TABLE
INSERT INTO mpp21090_changedistpolicy_dml_pttab_float SELECT 1.00, 1.00,'c', 2;
INSERT 0 1
SELECT * FROM mpp21090_changedistpolicy_dml_pttab_float ORDER BY 1,2,3;
 col1 | col2 | col3 | col5 
------+------+------+------
    1 |    1 | c    |    2
    2 |    2 | a    |    0
    2 |    2 | b    |    1
(3 rows)

UPDATE mpp21090_changedistpolicy_dml_pttab_float SET col3 ='c' WHERE col3 ='b';
UPDATE 1
SELECT * FROM mpp21090_changedistpolicy_dml_pttab_float ORDER BY 1,2,3;
 col1 | col2 | col3 | col5 
------+------+------+------
    1 |    1 | c    |    2
    2 |    2 | a    |    0
    2 |    2 | c    |    1
(3 rows)

DELETE FROM mpp21090_changedistpolicy_dml_pttab_float WHERE col3 ='c';
DELETE 2
SELECT * FROM mpp21090_changedistpolicy_dml_pttab_float ORDER BY 1,2,3;
 col1 | col2 | col3 | col5 
------+------+------+------
    2 |    2 | a    |    0
(1 row)

