DROP TABLE IF EXISTS mpp21090_pttab_dropcol_addcol_addpt_idx_dml_date;
psql:/data/prabhd/test/tincrepo/main/dml/functional/output/mpp21090_pttab_dropcol_addcol_addpt_idx_dml_date_opt.sql:14: NOTICE:  table "mpp21090_pttab_dropcol_addcol_addpt_idx_dml_date" does not exist, skipping
DROP TABLE
CREATE TABLE mpp21090_pttab_dropcol_addcol_addpt_idx_dml_date
(
    col1 date,
    col2 date,
    col3 char,
    col4 int
) 
DISTRIBUTED by (col1)
PARTITION BY RANGE(col2)(partition partone start('2013-12-01') end('2013-12-31') WITH(APPENDONLY=true, COMPRESSLEVEL=5, ORIENTATION=column),partition parttwo start('2013-12-31') end('2014-01-01') WITH (APPENDONLY=true, COMPRESSLEVEL=5, ORIENTATION=row),partition partthree start('2014-01-01') end('2014-02-01'));
psql:/data/prabhd/test/tincrepo/main/dml/functional/output/mpp21090_pttab_dropcol_addcol_addpt_idx_dml_date_opt.sql:23: NOTICE:  CREATE TABLE will create partition "mpp21090_pttab_dropcol_addcol_addpt_idx_dml_date_1_prt_partone" for table "mpp21090_pttab_dropcol_addcol_addpt_idx_dml_date"
psql:/data/prabhd/test/tincrepo/main/dml/functional/output/mpp21090_pttab_dropcol_addcol_addpt_idx_dml_date_opt.sql:23: NOTICE:  CREATE TABLE will create partition "mpp21090_pttab_dropcol_addcol_addpt_idx_dml_date_1_prt_parttwo" for table "mpp21090_pttab_dropcol_addcol_addpt_idx_dml_date"
psql:/data/prabhd/test/tincrepo/main/dml/functional/output/mpp21090_pttab_dropcol_addcol_addpt_idx_dml_date_opt.sql:23: NOTICE:  CREATE TABLE will create partition "mpp21090_pttab_dropcol_addcol_addpt_idx_dml_dat_1_prt_partthree" for table "mpp21090_pttab_dropcol_addcol_addpt_idx_dml_date"
CREATE TABLE
INSERT INTO mpp21090_pttab_dropcol_addcol_addpt_idx_dml_date VALUES('2013-12-30','2013-12-30','a',0);
INSERT 0 1
ALTER TABLE mpp21090_pttab_dropcol_addcol_addpt_idx_dml_date DROP COLUMN col4;
ALTER TABLE
INSERT INTO mpp21090_pttab_dropcol_addcol_addpt_idx_dml_date VALUES('2013-12-30','2013-12-30','b');
INSERT 0 1
ALTER TABLE mpp21090_pttab_dropcol_addcol_addpt_idx_dml_date ADD COLUMN col5 date DEFAULT '2013-12-30';
ALTER TABLE
DROP INDEX IF EXISTS mpp21090_pttab_dropcol_addcol_addpt_idx_dml_idx_date;
psql:/data/prabhd/test/tincrepo/main/dml/functional/output/mpp21090_pttab_dropcol_addcol_addpt_idx_dml_date_opt.sql:32: NOTICE:  index "mpp21090_pttab_dropcol_addcol_addpt_idx_dml_idx_date" does not exist, skipping
DROP INDEX
CREATE INDEX mpp21090_pttab_dropcol_addcol_addpt_idx_dml_idx_date on mpp21090_pttab_dropcol_addcol_addpt_idx_dml_date(col5);
psql:/data/prabhd/test/tincrepo/main/dml/functional/output/mpp21090_pttab_dropcol_addcol_addpt_idx_dml_date_opt.sql:33: NOTICE:  building index for child partition "mpp21090_pttab_dropcol_addcol_addpt_idx_dml_date_1_prt_partone"
psql:/data/prabhd/test/tincrepo/main/dml/functional/output/mpp21090_pttab_dropcol_addcol_addpt_idx_dml_date_opt.sql:33: NOTICE:  building index for child partition "mpp21090_pttab_dropcol_addcol_addpt_idx_dml_date_1_prt_parttwo"
psql:/data/prabhd/test/tincrepo/main/dml/functional/output/mpp21090_pttab_dropcol_addcol_addpt_idx_dml_date_opt.sql:33: NOTICE:  building index for child partition "mpp21090_pttab_dropcol_addcol_addpt_idx_dml_dat_1_prt_partthree"
CREATE INDEX
INSERT INTO mpp21090_pttab_dropcol_addcol_addpt_idx_dml_date SELECT '2013-12-30','2013-12-30','c','2013-12-30';
INSERT 0 1
SELECT * FROM mpp21090_pttab_dropcol_addcol_addpt_idx_dml_date ORDER BY 1,2,3;
    col1    |    col2    | col3 |    col5    
------------+------------+------+------------
 2013-12-30 | 2013-12-30 | a    | 2013-12-30
 2013-12-30 | 2013-12-30 | b    | 2013-12-30
 2013-12-30 | 2013-12-30 | c    | 2013-12-30
(3 rows)

UPDATE mpp21090_pttab_dropcol_addcol_addpt_idx_dml_date SET col5 = '2014-01-01' WHERE col2 = '2013-12-30' AND col1 = '2013-12-30';
UPDATE 3
SELECT * FROM mpp21090_pttab_dropcol_addcol_addpt_idx_dml_date ORDER BY 1,2,3;
    col1    |    col2    | col3 |    col5    
------------+------------+------+------------
 2013-12-30 | 2013-12-30 | a    | 2014-01-01
 2013-12-30 | 2013-12-30 | b    | 2014-01-01
 2013-12-30 | 2013-12-30 | c    | 2014-01-01
(3 rows)

DELETE FROM mpp21090_pttab_dropcol_addcol_addpt_idx_dml_date WHERE col5 = '2014-01-01';
DELETE 3
SELECT * FROM mpp21090_pttab_dropcol_addcol_addpt_idx_dml_date ORDER BY 1,2,3;
 col1 | col2 | col3 | col5 
------+------+------+------
(0 rows)

ALTER TABLE mpp21090_pttab_dropcol_addcol_addpt_idx_dml_date ADD PARTITION partfour start('2014-02-01') end('2014-03-01') inclusive;
psql:/data/prabhd/test/tincrepo/main/dml/functional/output/mpp21090_pttab_dropcol_addcol_addpt_idx_dml_date_opt.sql:44: NOTICE:  CREATE TABLE will create partition "mpp21090_pttab_dropcol_addcol_addpt_idx_dml_date_1_prt_partfour" for table "mpp21090_pttab_dropcol_addcol_addpt_idx_dml_date"
ALTER TABLE
ALTER TABLE mpp21090_pttab_dropcol_addcol_addpt_idx_dml_date ADD DEFAULT partition def;
psql:/data/prabhd/test/tincrepo/main/dml/functional/output/mpp21090_pttab_dropcol_addcol_addpt_idx_dml_date_opt.sql:45: NOTICE:  CREATE TABLE will create partition "mpp21090_pttab_dropcol_addcol_addpt_idx_dml_date_1_prt_def" for table "mpp21090_pttab_dropcol_addcol_addpt_idx_dml_date"
ALTER TABLE
INSERT INTO mpp21090_pttab_dropcol_addcol_addpt_idx_dml_date SELECT '2014-02-10','2014-02-10','d','2014-02-10';
INSERT 0 1
SELECT * FROM mpp21090_pttab_dropcol_addcol_addpt_idx_dml_date ORDER BY 1,2,3;
    col1    |    col2    | col3 |    col5    
------------+------------+------+------------
 2014-02-10 | 2014-02-10 | d    | 2014-02-10
(1 row)

UPDATE mpp21090_pttab_dropcol_addcol_addpt_idx_dml_date SET col5 = '2014-01-01' WHERE col2 = '2014-02-10' AND col3 ='d';
UPDATE 1
SELECT * FROM mpp21090_pttab_dropcol_addcol_addpt_idx_dml_date ORDER BY 1,2,3;
    col1    |    col2    | col3 |    col5    
------------+------------+------+------------
 2014-02-10 | 2014-02-10 | d    | 2014-01-01
(1 row)

-- Update partition key
UPDATE mpp21090_pttab_dropcol_addcol_addpt_idx_dml_date SET col2 = '2014-01-01' WHERE col2 = '2014-02-10' AND col3 ='d';
UPDATE 1
SELECT * FROM mpp21090_pttab_dropcol_addcol_addpt_idx_dml_date ORDER BY 1,2,3;
    col1    |    col2    | col3 |    col5    
------------+------------+------+------------
 2014-02-10 | 2014-01-01 | d    | 2014-01-01
(1 row)

DELETE FROM mpp21090_pttab_dropcol_addcol_addpt_idx_dml_date WHERE col5 = '2014-01-01';
DELETE 1
SELECT * FROM mpp21090_pttab_dropcol_addcol_addpt_idx_dml_date ORDER BY 1,2,3;
 col1 | col2 | col3 | col5 
------+------+------+------
(0 rows)

