DROP TABLE IF EXISTS mpp21090_pttab_dropmidcol_addpt_float;
psql:/data/prabhd/test/tincrepo/main/dml/functional/output/mpp21090_pttab_dropmidcol_addpt_float_opt.sql:14: NOTICE:  table "mpp21090_pttab_dropmidcol_addpt_float" does not exist, skipping
DROP TABLE
CREATE TABLE mpp21090_pttab_dropmidcol_addpt_float
(
    col1 float,
    col2 float,
    col3 char,
    col4 float,
    col5 int
) 
DISTRIBUTED by (col1) 
PARTITION BY RANGE(col2)(partition partone start(1.00) end(10.00)  WITH (APPENDONLY=true, COMPRESSLEVEL=5, ORIENTATION=column),partition parttwo start(10.00) end(20.00) WITH (APPENDONLY=true, COMPRESSLEVEL=5, ORIENTATION=row),partition partthree start(20.00) end(30.00));
psql:/data/prabhd/test/tincrepo/main/dml/functional/output/mpp21090_pttab_dropmidcol_addpt_float_opt.sql:24: NOTICE:  CREATE TABLE will create partition "mpp21090_pttab_dropmidcol_addpt_float_1_prt_partone" for table "mpp21090_pttab_dropmidcol_addpt_float"
psql:/data/prabhd/test/tincrepo/main/dml/functional/output/mpp21090_pttab_dropmidcol_addpt_float_opt.sql:24: NOTICE:  CREATE TABLE will create partition "mpp21090_pttab_dropmidcol_addpt_float_1_prt_parttwo" for table "mpp21090_pttab_dropmidcol_addpt_float"
psql:/data/prabhd/test/tincrepo/main/dml/functional/output/mpp21090_pttab_dropmidcol_addpt_float_opt.sql:24: NOTICE:  CREATE TABLE will create partition "mpp21090_pttab_dropmidcol_addpt_float_1_prt_partthree" for table "mpp21090_pttab_dropmidcol_addpt_float"
CREATE TABLE
INSERT INTO mpp21090_pttab_dropmidcol_addpt_float VALUES(2.00,2.00,'a',2.00,0);
INSERT 0 1
ALTER TABLE mpp21090_pttab_dropmidcol_addpt_float DROP COLUMN col4;
ALTER TABLE
ALTER TABLE mpp21090_pttab_dropmidcol_addpt_float ADD PARTITION partfour start(30.00) end(40.00);
psql:/data/prabhd/test/tincrepo/main/dml/functional/output/mpp21090_pttab_dropmidcol_addpt_float_opt.sql:29: NOTICE:  CREATE TABLE will create partition "mpp21090_pttab_dropmidcol_addpt_float_1_prt_partfour" for table "mpp21090_pttab_dropmidcol_addpt_float"
ALTER TABLE
INSERT INTO mpp21090_pttab_dropmidcol_addpt_float SELECT 35.00, 35.00,'b', 1;
INSERT 0 1
SELECT * FROM mpp21090_pttab_dropmidcol_addpt_float ORDER BY 1,2,3;
 col1 | col2 | col3 | col5 
------+------+------+------
    2 |    2 | a    |    0
   35 |   35 | b    |    1
(2 rows)

-- Update distribution key
UPDATE mpp21090_pttab_dropmidcol_addpt_float SET col1 = 1.00 WHERE col2 = 35.00 AND col1 = 35.00;
UPDATE 1
SELECT * FROM mpp21090_pttab_dropmidcol_addpt_float ORDER BY 1,2,3;
 col1 | col2 | col3 | col5 
------+------+------+------
    1 |   35 | b    |    1
    2 |    2 | a    |    0
(2 rows)

-- Update partition key
UPDATE mpp21090_pttab_dropmidcol_addpt_float SET col2 = 1.00 WHERE col2 = 35.00 AND col1 = 1.00;
UPDATE 1
SELECT * FROM mpp21090_pttab_dropmidcol_addpt_float ORDER BY 1,2,3;
 col1 | col2 | col3 | col5 
------+------+------+------
    1 |    1 | b    |    1
    2 |    2 | a    |    0
(2 rows)

DELETE FROM mpp21090_pttab_dropmidcol_addpt_float WHERE col2 = 1.00;
DELETE 1
SELECT * FROM mpp21090_pttab_dropmidcol_addpt_float ORDER BY 1,2,3;
 col1 | col2 | col3 | col5 
------+------+------+------
    2 |    2 | a    |    0
(1 row)

