DROP TABLE IF EXISTS mpp21090_defpt_dropcol_addcol_dml_decimal;
psql:/data/prabhd/test/tincrepo/main/dml/functional/output/mpp21090_defpt_dropcol_addcol_dml_decimal_opt.sql:14: NOTICE:  table "mpp21090_defpt_dropcol_addcol_dml_decimal" does not exist, skipping
DROP TABLE
CREATE TABLE mpp21090_defpt_dropcol_addcol_dml_decimal
(
    col1 decimal,
    col2 decimal,
    col3 char,
    col4 int
) 
DISTRIBUTED by (col1)
PARTITION BY LIST(col2)
(
default partition def
);
psql:/data/prabhd/test/tincrepo/main/dml/functional/output/mpp21090_defpt_dropcol_addcol_dml_decimal_opt.sql:26: NOTICE:  CREATE TABLE will create partition "mpp21090_defpt_dropcol_addcol_dml_decimal_1_prt_def" for table "mpp21090_defpt_dropcol_addcol_dml_decimal"
CREATE TABLE
INSERT INTO mpp21090_defpt_dropcol_addcol_dml_decimal VALUES(2.00,2.00,'a',0);
INSERT 0 1
ALTER TABLE mpp21090_defpt_dropcol_addcol_dml_decimal DROP COLUMN col4;
ALTER TABLE
INSERT INTO mpp21090_defpt_dropcol_addcol_dml_decimal SELECT 35.00,35.00,'b';
INSERT 0 1
SELECT * FROM mpp21090_defpt_dropcol_addcol_dml_decimal ORDER BY 1,2,3;
 col1  | col2  | col3 
-------+-------+------
  2.00 |  2.00 | a
 35.00 | 35.00 | b
(2 rows)

ALTER TABLE mpp21090_defpt_dropcol_addcol_dml_decimal ADD COLUMN col5 decimal;
ALTER TABLE
INSERT INTO mpp21090_defpt_dropcol_addcol_dml_decimal SELECT 2.00,2.00,'c',2.00;
INSERT 0 1
SELECT * FROM mpp21090_defpt_dropcol_addcol_dml_decimal ORDER BY 1,2,3;
 col1  | col2  | col3 | col5 
-------+-------+------+------
  2.00 |  2.00 | a    |     
  2.00 |  2.00 | c    | 2.00
 35.00 | 35.00 | b    |     
(3 rows)

UPDATE mpp21090_defpt_dropcol_addcol_dml_decimal SET col1 = 1.00 WHERE col2 = 35.00 AND col1 = 35.00;
UPDATE 1
SELECT * FROM mpp21090_defpt_dropcol_addcol_dml_decimal ORDER BY 1,2,3;
 col1 | col2  | col3 | col5 
------+-------+------+------
 1.00 | 35.00 | b    |     
 2.00 |  2.00 | a    |     
 2.00 |  2.00 | c    | 2.00
(3 rows)

-- Update partition key
UPDATE mpp21090_defpt_dropcol_addcol_dml_decimal SET col2 = 1.00 WHERE col2 = 35.00 AND col1 = 1.00;
UPDATE 1
SELECT * FROM mpp21090_defpt_dropcol_addcol_dml_decimal ORDER BY 1,2,3;
 col1 | col2 | col3 | col5 
------+------+------+------
 1.00 | 1.00 | b    |     
 2.00 | 2.00 | a    |     
 2.00 | 2.00 | c    | 2.00
(3 rows)

DELETE FROM mpp21090_defpt_dropcol_addcol_dml_decimal WHERE col2 = 1.00;
DELETE 1
SELECT * FROM mpp21090_defpt_dropcol_addcol_dml_decimal ORDER BY 1,2,3;
 col1 | col2 | col3 | col5 
------+------+------+------
 2.00 | 2.00 | a    |     
 2.00 | 2.00 | c    | 2.00
(2 rows)

