DROP TABLE IF EXISTS mpp21090_xchange_pttab_dropcol_addcol_dml_float;
psql:/data/prabhd/test/tincrepo/main/dml/functional/output/mpp21090_xchange_pttab_dropcol_addcol_dml_float_opt.sql:14: NOTICE:  table "mpp21090_xchange_pttab_dropcol_addcol_dml_float" does not exist, skipping
DROP TABLE
CREATE TABLE mpp21090_xchange_pttab_dropcol_addcol_dml_float
(
    col1 float,
    col2 float,
    col3 char,
    col4 int,
    col5 float
) 
DISTRIBUTED by (col1)
PARTITION BY RANGE(col2)(partition partone start(1.00) end(10.00)  WITH (APPENDONLY=true, COMPRESSLEVEL=5, ORIENTATION=column),partition parttwo start(10.00) end(20.00) WITH (APPENDONLY=true, COMPRESSLEVEL=5, ORIENTATION=row),partition partthree start(20.00) end(30.00));
psql:/data/prabhd/test/tincrepo/main/dml/functional/output/mpp21090_xchange_pttab_dropcol_addcol_dml_float_opt.sql:24: NOTICE:  CREATE TABLE will create partition "mpp21090_xchange_pttab_dropcol_addcol_dml_float_1_prt_partone" for table "mpp21090_xchange_pttab_dropcol_addcol_dml_float"
psql:/data/prabhd/test/tincrepo/main/dml/functional/output/mpp21090_xchange_pttab_dropcol_addcol_dml_float_opt.sql:24: NOTICE:  CREATE TABLE will create partition "mpp21090_xchange_pttab_dropcol_addcol_dml_float_1_prt_parttwo" for table "mpp21090_xchange_pttab_dropcol_addcol_dml_float"
psql:/data/prabhd/test/tincrepo/main/dml/functional/output/mpp21090_xchange_pttab_dropcol_addcol_dml_float_opt.sql:24: NOTICE:  CREATE TABLE will create partition "mpp21090_xchange_pttab_dropcol_addcol_dml_float_1_prt_partthree" for table "mpp21090_xchange_pttab_dropcol_addcol_dml_float"
CREATE TABLE
INSERT INTO mpp21090_xchange_pttab_dropcol_addcol_dml_float VALUES(2.00,2.00,'a',0, 2.00);
INSERT 0 1
SELECT * FROM mpp21090_xchange_pttab_dropcol_addcol_dml_float ORDER BY 1,2,3,4;
 col1 | col2 | col3 | col4 | col5 
------+------+------+------+------
    2 |    2 | a    |    0 |    2
(1 row)

ALTER TABLE mpp21090_xchange_pttab_dropcol_addcol_dml_float DROP COLUMN col1;
psql:/data/prabhd/test/tincrepo/main/dml/functional/output/mpp21090_xchange_pttab_dropcol_addcol_dml_float_opt.sql:29: NOTICE:  Dropping a column that is part of the distribution policy forces a NULL distribution policy
psql:/data/prabhd/test/tincrepo/main/dml/functional/output/mpp21090_xchange_pttab_dropcol_addcol_dml_float_opt.sql:29: NOTICE:  Dropping a column that is part of the distribution policy forces a NULL distribution policy
psql:/data/prabhd/test/tincrepo/main/dml/functional/output/mpp21090_xchange_pttab_dropcol_addcol_dml_float_opt.sql:29: NOTICE:  Dropping a column that is part of the distribution policy forces a NULL distribution policy
psql:/data/prabhd/test/tincrepo/main/dml/functional/output/mpp21090_xchange_pttab_dropcol_addcol_dml_float_opt.sql:29: NOTICE:  Dropping a column that is part of the distribution policy forces a NULL distribution policy
ALTER TABLE
ALTER TABLE mpp21090_xchange_pttab_dropcol_addcol_dml_float ADD COLUMN col1 float DEFAULT 2.00;
ALTER TABLE
-- Create Candidate table for Exchange
DROP TABLE IF EXISTS mpp21090_xchange_pttab_dropcol_addcol_dml_float_candidate;
psql:/data/prabhd/test/tincrepo/main/dml/functional/output/mpp21090_xchange_pttab_dropcol_addcol_dml_float_opt.sql:33: NOTICE:  table "mpp21090_xchange_pttab_dropcol_addcol_dml_float_candidate" does not exist, skipping
DROP TABLE
CREATE TABLE mpp21090_xchange_pttab_dropcol_addcol_dml_float_candidate( like mpp21090_xchange_pttab_dropcol_addcol_dml_float) distributed randomly;
CREATE TABLE
INSERT INTO mpp21090_xchange_pttab_dropcol_addcol_dml_float_candidate VALUES(2.00,'z',1,2.00,2.00);
INSERT 0 1
-- Exchange 
ALTER TABLE mpp21090_xchange_pttab_dropcol_addcol_dml_float EXCHANGE PARTITION FOR(5.00) WITH TABLE mpp21090_xchange_pttab_dropcol_addcol_dml_float_candidate;
psql:/data/prabhd/test/tincrepo/main/dml/functional/output/mpp21090_xchange_pttab_dropcol_addcol_dml_float_opt.sql:38: NOTICE:  exchanged partition "partone" of relation "mpp21090_xchange_pttab_dropcol_addcol_dml_float" with relation "mpp21090_xchange_pttab_dropcol_addcol_dml_float_candidate"
ALTER TABLE
SELECT * FROM mpp21090_xchange_pttab_dropcol_addcol_dml_float ORDER BY 1,2,3;
 col2 | col3 | col4 | col5 | col1 
------+------+------+------+------
    2 | z    |    1 |    2 |    2
(1 row)

SELECT * FROM mpp21090_xchange_pttab_dropcol_addcol_dml_float_candidate ORDER BY 1,2,3;
 col2 | col3 | col4 | col5 | col1 
------+------+------+------+------
    2 | a    |    0 |    2 |    2
(1 row)

-- DML on partition table
INSERT INTO mpp21090_xchange_pttab_dropcol_addcol_dml_float SELECT  1.00,'b', 1, 1.00, 1.00;
INSERT 0 1
SELECT * FROM mpp21090_xchange_pttab_dropcol_addcol_dml_float ORDER BY 1,2,3;
 col2 | col3 | col4 | col5 | col1 
------+------+------+------+------
    1 | b    |    1 |    1 |    1
    2 | z    |    1 |    2 |    2
(2 rows)

UPDATE mpp21090_xchange_pttab_dropcol_addcol_dml_float SET col5 = 35.00 WHERE col2 = 1.00 AND col5 = 1.00;
UPDATE 1
SELECT * FROM mpp21090_xchange_pttab_dropcol_addcol_dml_float ORDER BY 1,2,3;
 col2 | col3 | col4 | col5 | col1 
------+------+------+------+------
    1 | b    |    1 |   35 |    1
    2 | z    |    1 |    2 |    2
(2 rows)

UPDATE mpp21090_xchange_pttab_dropcol_addcol_dml_float SET col2 =2.00 WHERE col3='b';
UPDATE 1
SELECT * FROM mpp21090_xchange_pttab_dropcol_addcol_dml_float ORDER BY 1,2,3;
 col2 | col3 | col4 | col5 | col1 
------+------+------+------+------
    2 | b    |    1 |   35 |    1
    2 | z    |    1 |    2 |    2
(2 rows)

DELETE FROM mpp21090_xchange_pttab_dropcol_addcol_dml_float WHERE col3='b';
DELETE 1
SELECT * FROM mpp21090_xchange_pttab_dropcol_addcol_dml_float ORDER BY 1,2,3;
 col2 | col3 | col4 | col5 | col1 
------+------+------+------+------
    2 | z    |    1 |    2 |    2
(1 row)

-- DML on candidate table
INSERT INTO mpp21090_xchange_pttab_dropcol_addcol_dml_float_candidate SELECT 1.00,'b', 1, 1.00, 1.00;
INSERT 0 1
SELECT * FROM mpp21090_xchange_pttab_dropcol_addcol_dml_float_candidate ORDER BY 1,2,3;
 col2 | col3 | col4 | col5 | col1 
------+------+------+------+------
    1 | b    |    1 |    1 |    1
    2 | a    |    0 |    2 |    2
(2 rows)

UPDATE mpp21090_xchange_pttab_dropcol_addcol_dml_float_candidate SET col2=2.00 WHERE col3='a';
UPDATE 1
SELECT * FROM mpp21090_xchange_pttab_dropcol_addcol_dml_float_candidate ORDER BY 1,2,3;
 col2 | col3 | col4 | col5 | col1 
------+------+------+------+------
    1 | b    |    1 |    1 |    1
    2 | a    |    0 |    2 |    2
(2 rows)

DELETE FROM mpp21090_xchange_pttab_dropcol_addcol_dml_float_candidate WHERE col3='a';
DELETE 1
SELECT * FROM mpp21090_xchange_pttab_dropcol_addcol_dml_float_candidate ORDER BY 1,2,3;
 col2 | col3 | col4 | col5 | col1 
------+------+------+------+------
    1 | b    |    1 |    1 |    1
(1 row)

