DROP TABLE IF EXISTS mpp21090_drop_firstcol_dml_int8;
psql:/data/prabhd/test/tincrepo/main/dml/functional/output/mpp21090_drop_firstcol_dml_int8_ao_opt.sql:14: NOTICE:  table "mpp21090_drop_firstcol_dml_int8" does not exist, skipping
DROP TABLE
CREATE TABLE mpp21090_drop_firstcol_dml_int8(
col1 int8,
col2 decimal,
col3 char,
col4 date,
col5 int
)  with (appendonly= true)  DISTRIBUTED by(col3);
CREATE TABLE
INSERT INTO mpp21090_drop_firstcol_dml_int8 VALUES(2000000000000000000,0.00,'a','2014-01-01',0);
INSERT 0 1
SELECT * FROM mpp21090_drop_firstcol_dml_int8 ORDER BY 1,2,3,4;
        col1         | col2 | col3 |    col4    | col5 
---------------------+------+------+------------+------
 2000000000000000000 | 0.00 | a    | 2014-01-01 |    0
(1 row)

ALTER TABLE mpp21090_drop_firstcol_dml_int8 DROP COLUMN col1;
ALTER TABLE
INSERT INTO mpp21090_drop_firstcol_dml_int8 SELECT 1.00,'b','2014-01-02',1;
INSERT 0 1
SELECT * FROM mpp21090_drop_firstcol_dml_int8 ORDER BY 1,2,3,4;
 col2 | col3 |    col4    | col5 
------+------+------------+------
 0.00 | a    | 2014-01-01 |    0
 1.00 | b    | 2014-01-02 |    1
(2 rows)

UPDATE mpp21090_drop_firstcol_dml_int8 SET col3='c' WHERE col3 = 'b' AND col5 = 1;
UPDATE 1
SELECT * FROM mpp21090_drop_firstcol_dml_int8 ORDER BY 1,2,3,4;
 col2 | col3 |    col4    | col5 
------+------+------------+------
 0.00 | a    | 2014-01-01 |    0
 1.00 | c    | 2014-01-02 |    1
(2 rows)

DELETE FROM mpp21090_drop_firstcol_dml_int8 WHERE col3='c';
DELETE 1
SELECT * FROM mpp21090_drop_firstcol_dml_int8 ORDER BY 1,2,3,4;
 col2 | col3 |    col4    | col5 
------+------+------------+------
 0.00 | a    | 2014-01-01 |    0
(1 row)

