DROP TABLE IF EXISTS mpp21090_pttab_addpt_dropcol_addcol_dml_char;
psql:/data/prabhd/test/tincrepo/main/dml/functional/output/mpp21090_pttab_addpt_dropcol_addcol_dml_char_opt.sql:14: NOTICE:  table "mpp21090_pttab_addpt_dropcol_addcol_dml_char" does not exist, skipping
DROP TABLE
CREATE TABLE mpp21090_pttab_addpt_dropcol_addcol_dml_char
(
    col1 char,
    col2 char,
    col3 char,
    col4 int
) 
DISTRIBUTED by (col1)
PARTITION BY LIST(col2)(partition partone VALUES('a','b','c','d','e','f','g','h') WITH (APPENDONLY=true, COMPRESSLEVEL=5, ORIENTATION=column),partition parttwo VALUES('i','j','k','l','m','n','o','p') WITH (APPENDONLY=true, COMPRESSLEVEL=5, ORIENTATION=row),partition partthree VALUES('q','r','s','t','u','v','w','x'));
psql:/data/prabhd/test/tincrepo/main/dml/functional/output/mpp21090_pttab_addpt_dropcol_addcol_dml_char_opt.sql:23: NOTICE:  CREATE TABLE will create partition "mpp21090_pttab_addpt_dropcol_addcol_dml_char_1_prt_partone" for table "mpp21090_pttab_addpt_dropcol_addcol_dml_char"
psql:/data/prabhd/test/tincrepo/main/dml/functional/output/mpp21090_pttab_addpt_dropcol_addcol_dml_char_opt.sql:23: NOTICE:  CREATE TABLE will create partition "mpp21090_pttab_addpt_dropcol_addcol_dml_char_1_prt_parttwo" for table "mpp21090_pttab_addpt_dropcol_addcol_dml_char"
psql:/data/prabhd/test/tincrepo/main/dml/functional/output/mpp21090_pttab_addpt_dropcol_addcol_dml_char_opt.sql:23: NOTICE:  CREATE TABLE will create partition "mpp21090_pttab_addpt_dropcol_addcol_dml_char_1_prt_partthree" for table "mpp21090_pttab_addpt_dropcol_addcol_dml_char"
CREATE TABLE
INSERT INTO mpp21090_pttab_addpt_dropcol_addcol_dml_char VALUES('x','x','a',0);
INSERT 0 1
ALTER TABLE mpp21090_pttab_addpt_dropcol_addcol_dml_char ADD PARTITION partfour VALUES('y','z','-');
psql:/data/prabhd/test/tincrepo/main/dml/functional/output/mpp21090_pttab_addpt_dropcol_addcol_dml_char_opt.sql:27: NOTICE:  CREATE TABLE will create partition "mpp21090_pttab_addpt_dropcol_addcol_dml_char_1_prt_partfour" for table "mpp21090_pttab_addpt_dropcol_addcol_dml_char"
ALTER TABLE
INSERT INTO mpp21090_pttab_addpt_dropcol_addcol_dml_char SELECT 'z','z','b',1;
INSERT 0 1
SELECT * FROM mpp21090_pttab_addpt_dropcol_addcol_dml_char ORDER BY 1,2,3;
 col1 | col2 | col3 | col4 
------+------+------+------
 x    | x    | a    |    0
 z    | z    | b    |    1
(2 rows)

ALTER TABLE mpp21090_pttab_addpt_dropcol_addcol_dml_char DROP COLUMN col1;
psql:/data/prabhd/test/tincrepo/main/dml/functional/output/mpp21090_pttab_addpt_dropcol_addcol_dml_char_opt.sql:32: NOTICE:  Dropping a column that is part of the distribution policy forces a NULL distribution policy
psql:/data/prabhd/test/tincrepo/main/dml/functional/output/mpp21090_pttab_addpt_dropcol_addcol_dml_char_opt.sql:32: NOTICE:  Dropping a column that is part of the distribution policy forces a NULL distribution policy
psql:/data/prabhd/test/tincrepo/main/dml/functional/output/mpp21090_pttab_addpt_dropcol_addcol_dml_char_opt.sql:32: NOTICE:  Dropping a column that is part of the distribution policy forces a NULL distribution policy
psql:/data/prabhd/test/tincrepo/main/dml/functional/output/mpp21090_pttab_addpt_dropcol_addcol_dml_char_opt.sql:32: NOTICE:  Dropping a column that is part of the distribution policy forces a NULL distribution policy
psql:/data/prabhd/test/tincrepo/main/dml/functional/output/mpp21090_pttab_addpt_dropcol_addcol_dml_char_opt.sql:32: NOTICE:  Dropping a column that is part of the distribution policy forces a NULL distribution policy
ALTER TABLE
INSERT INTO mpp21090_pttab_addpt_dropcol_addcol_dml_char SELECT 'z','c',1;
INSERT 0 1
SELECT * FROM mpp21090_pttab_addpt_dropcol_addcol_dml_char ORDER BY 1,2,3;
 col2 | col3 | col4 
------+------+------
 x    | a    |    0
 z    | b    |    1
 z    | c    |    1
(3 rows)

ALTER TABLE mpp21090_pttab_addpt_dropcol_addcol_dml_char ADD COLUMN col5 char DEFAULT 'x';
ALTER TABLE
INSERT INTO mpp21090_pttab_addpt_dropcol_addcol_dml_char SELECT 'z','d',1,'z';
INSERT 0 1
SELECT * FROM mpp21090_pttab_addpt_dropcol_addcol_dml_char ORDER BY 1,2,3;
 col2 | col3 | col4 | col5 
------+------+------+------
 x    | a    |    0 | x
 z    | b    |    1 | x
 z    | c    |    1 | x
 z    | d    |    1 | z
(4 rows)

UPDATE mpp21090_pttab_addpt_dropcol_addcol_dml_char SET col4 = 10 WHERE col2 = 'z';
UPDATE 3
SELECT * FROM mpp21090_pttab_addpt_dropcol_addcol_dml_char ORDER BY 1,2,3;
 col2 | col3 | col4 | col5 
------+------+------+------
 x    | a    |    0 | x
 z    | b    |   10 | x
 z    | c    |   10 | x
 z    | d    |   10 | z
(4 rows)

-- Update partition key
UPDATE mpp21090_pttab_addpt_dropcol_addcol_dml_char SET col2 = '-' WHERE col2 = 'z';
UPDATE 3
SELECT * FROM mpp21090_pttab_addpt_dropcol_addcol_dml_char ORDER BY 1,2,3;
 col2 | col3 | col4 | col5 
------+------+------+------
 -    | b    |   10 | x
 -    | c    |   10 | x
 -    | d    |   10 | z
 x    | a    |    0 | x
(4 rows)

DELETE FROM mpp21090_pttab_addpt_dropcol_addcol_dml_char WHERE col2 = '-';
DELETE 3
SELECT * FROM mpp21090_pttab_addpt_dropcol_addcol_dml_char ORDER BY 1,2,3;
 col2 | col3 | col4 | col5 
------+------+------+------
 x    | a    |    0 | x
(1 row)

