DROP TABLE IF EXISTS mpp21090_dropcol_addcol_splitpt_dml_date;
psql:/data/prabhd/test/tincrepo/main/dml/functional/output/mpp21090_dropcol_addcol_splitpt_dml_date_opt.sql:14: NOTICE:  table "mpp21090_dropcol_addcol_splitpt_dml_date" does not exist, skipping
DROP TABLE
CREATE TABLE mpp21090_dropcol_addcol_splitpt_dml_date
(
    col1 date,
    col2 date,
    col3 char,
    col4 date
) 
DISTRIBUTED by (col1)
PARTITION BY RANGE(col2)(partition partone start('2013-12-01') end('2013-12-31') WITH(APPENDONLY=true, COMPRESSLEVEL=5, ORIENTATION=column),partition parttwo start('2013-12-31') end('2014-01-01') WITH (APPENDONLY=true, COMPRESSLEVEL=5, ORIENTATION=row),partition partthree start('2014-01-01') end('2014-02-01'));
psql:/data/prabhd/test/tincrepo/main/dml/functional/output/mpp21090_dropcol_addcol_splitpt_dml_date_opt.sql:23: NOTICE:  CREATE TABLE will create partition "mpp21090_dropcol_addcol_splitpt_dml_date_1_prt_partone" for table "mpp21090_dropcol_addcol_splitpt_dml_date"
psql:/data/prabhd/test/tincrepo/main/dml/functional/output/mpp21090_dropcol_addcol_splitpt_dml_date_opt.sql:23: NOTICE:  CREATE TABLE will create partition "mpp21090_dropcol_addcol_splitpt_dml_date_1_prt_parttwo" for table "mpp21090_dropcol_addcol_splitpt_dml_date"
psql:/data/prabhd/test/tincrepo/main/dml/functional/output/mpp21090_dropcol_addcol_splitpt_dml_date_opt.sql:23: NOTICE:  CREATE TABLE will create partition "mpp21090_dropcol_addcol_splitpt_dml_date_1_prt_partthree" for table "mpp21090_dropcol_addcol_splitpt_dml_date"
CREATE TABLE
INSERT INTO mpp21090_dropcol_addcol_splitpt_dml_date VALUES('2013-12-31','2013-12-31','a','2013-12-31');
INSERT 0 1
SELECT * FROM mpp21090_dropcol_addcol_splitpt_dml_date ORDER BY 1,2,3,4;
    col1    |    col2    | col3 |    col4    
------------+------------+------+------------
 2013-12-31 | 2013-12-31 | a    | 2013-12-31
(1 row)

ALTER TABLE mpp21090_dropcol_addcol_splitpt_dml_date ADD COLUMN col5 int DEFAULT 10;
ALTER TABLE
INSERT INTO mpp21090_dropcol_addcol_splitpt_dml_date VALUES('2013-12-31','2013-12-31','b','2013-12-31',0);
INSERT 0 1
SELECT * FROM mpp21090_dropcol_addcol_splitpt_dml_date ORDER BY 1,2,3,4;
    col1    |    col2    | col3 |    col4    | col5 
------------+------------+------+------------+------
 2013-12-31 | 2013-12-31 | a    | 2013-12-31 |   10
 2013-12-31 | 2013-12-31 | b    | 2013-12-31 |    0
(2 rows)

ALTER TABLE mpp21090_dropcol_addcol_splitpt_dml_date DROP COLUMN col4;
ALTER TABLE
INSERT INTO mpp21090_dropcol_addcol_splitpt_dml_date VALUES('2013-12-31','2013-12-31','c',1);
INSERT 0 1
SELECT * FROM mpp21090_dropcol_addcol_splitpt_dml_date ORDER BY 1,2,3,4;
    col1    |    col2    | col3 | col5 
------------+------------+------+------
 2013-12-31 | 2013-12-31 | a    |   10
 2013-12-31 | 2013-12-31 | b    |    0
 2013-12-31 | 2013-12-31 | c    |    1
(3 rows)

ALTER TABLE mpp21090_dropcol_addcol_splitpt_dml_date SPLIT PARTITION partone at ('2013-12-15') into (partition partsplitone,partition partsplitwo);
psql:/data/prabhd/test/tincrepo/main/dml/functional/output/mpp21090_dropcol_addcol_splitpt_dml_date_opt.sql:38: NOTICE:  exchanged partition "partone" of relation "mpp21090_dropcol_addcol_splitpt_dml_date" with relation "pg_temp_51144"
psql:/data/prabhd/test/tincrepo/main/dml/functional/output/mpp21090_dropcol_addcol_splitpt_dml_date_opt.sql:38: NOTICE:  dropped partition "partone" for relation "mpp21090_dropcol_addcol_splitpt_dml_date"
psql:/data/prabhd/test/tincrepo/main/dml/functional/output/mpp21090_dropcol_addcol_splitpt_dml_date_opt.sql:38: NOTICE:  CREATE TABLE will create partition "mpp21090_dropcol_addcol_splitpt_dml_date_1_prt_partsplitone" for table "mpp21090_dropcol_addcol_splitpt_dml_date"
psql:/data/prabhd/test/tincrepo/main/dml/functional/output/mpp21090_dropcol_addcol_splitpt_dml_date_opt.sql:38: NOTICE:  CREATE TABLE will create partition "mpp21090_dropcol_addcol_splitpt_dml_date_1_prt_partsplitwo" for table "mpp21090_dropcol_addcol_splitpt_dml_date"
ALTER TABLE
INSERT INTO mpp21090_dropcol_addcol_splitpt_dml_date SELECT '2013-12-01', '2013-12-01','d', 1;
INSERT 0 1
SELECT * FROM mpp21090_dropcol_addcol_splitpt_dml_date ORDER BY 1,2,3;
    col1    |    col2    | col3 | col5 
------------+------------+------+------
 2013-12-01 | 2013-12-01 | d    |    1
 2013-12-31 | 2013-12-31 | a    |   10
 2013-12-31 | 2013-12-31 | b    |    0
 2013-12-31 | 2013-12-31 | c    |    1
(4 rows)

-- Update distribution key
UPDATE mpp21090_dropcol_addcol_splitpt_dml_date SET col1 = '2014-02-10' WHERE col2 = '2013-12-01' AND col1 = '2013-12-01';
UPDATE 1
SELECT * FROM mpp21090_dropcol_addcol_splitpt_dml_date ORDER BY 1,2,3;
    col1    |    col2    | col3 | col5 
------------+------------+------+------
 2013-12-31 | 2013-12-31 | a    |   10
 2013-12-31 | 2013-12-31 | b    |    0
 2013-12-31 | 2013-12-31 | c    |    1
 2014-02-10 | 2013-12-01 | d    |    1
(4 rows)

-- Update partition key
UPDATE mpp21090_dropcol_addcol_splitpt_dml_date SET col2 ='2013-12-31'  WHERE col2 = '2013-12-01' AND col1 = '2014-02-10';
UPDATE 1
SELECT * FROM mpp21090_dropcol_addcol_splitpt_dml_date ORDER BY 1,2,3;
    col1    |    col2    | col3 | col5 
------------+------------+------+------
 2013-12-31 | 2013-12-31 | a    |   10
 2013-12-31 | 2013-12-31 | b    |    0
 2013-12-31 | 2013-12-31 | c    |    1
 2014-02-10 | 2013-12-31 | d    |    1
(4 rows)

DELETE FROM mpp21090_dropcol_addcol_splitpt_dml_date WHERE col3='b';
DELETE 1
SELECT * FROM mpp21090_dropcol_addcol_splitpt_dml_date ORDER BY 1,2,3;
    col1    |    col2    | col3 | col5 
------------+------------+------+------
 2013-12-31 | 2013-12-31 | a    |   10
 2013-12-31 | 2013-12-31 | c    |    1
 2014-02-10 | 2013-12-31 | d    |    1
(3 rows)

