DROP TABLE IF EXISTS mpp21090_dropcol_splitdefpt_addcol_dml_float;
psql:/data/prabhd/test/tincrepo/main/dml/functional/output/mpp21090_dropcol_splitdefpt_addcol_dml_float_opt.sql:14: NOTICE:  table "mpp21090_dropcol_splitdefpt_addcol_dml_float" does not exist, skipping
DROP TABLE
CREATE TABLE mpp21090_dropcol_splitdefpt_addcol_dml_float
(
    col1 float,
    col2 float,
    col3 char,
    col4 float
) 
DISTRIBUTED by (col1)
PARTITION BY LIST(col2)
(
default partition def
);
psql:/data/prabhd/test/tincrepo/main/dml/functional/output/mpp21090_dropcol_splitdefpt_addcol_dml_float_opt.sql:26: NOTICE:  CREATE TABLE will create partition "mpp21090_dropcol_splitdefpt_addcol_dml_float_1_prt_def" for table "mpp21090_dropcol_splitdefpt_addcol_dml_float"
CREATE TABLE
INSERT INTO mpp21090_dropcol_splitdefpt_addcol_dml_float VALUES(2.00,2.00,'a',2.00);
INSERT 0 1
SELECT * FROM mpp21090_dropcol_splitdefpt_addcol_dml_float ORDER BY 1,2,3,4;
 col1 | col2 | col3 | col4 
------+------+------+------
    2 |    2 | a    |    2
(1 row)

ALTER TABLE mpp21090_dropcol_splitdefpt_addcol_dml_float DROP COLUMN col4;
ALTER TABLE
INSERT INTO mpp21090_dropcol_splitdefpt_addcol_dml_float VALUES(2.00,2.00,'b');
INSERT 0 1
SELECT * FROM mpp21090_dropcol_splitdefpt_addcol_dml_float ORDER BY 1,2,3;
 col1 | col2 | col3 
------+------+------
    2 |    2 | a
    2 |    2 | b
(2 rows)

ALTER TABLE mpp21090_dropcol_splitdefpt_addcol_dml_float SPLIT DEFAULT PARTITION at (5.00) into (partition partsplitone,partition def);
psql:/data/prabhd/test/tincrepo/main/dml/functional/output/mpp21090_dropcol_splitdefpt_addcol_dml_float_opt.sql:36: NOTICE:  exchanged partition "def" of relation "mpp21090_dropcol_splitdefpt_addcol_dml_float" with relation "pg_temp_60957"
psql:/data/prabhd/test/tincrepo/main/dml/functional/output/mpp21090_dropcol_splitdefpt_addcol_dml_float_opt.sql:36: NOTICE:  dropped partition "def" for relation "mpp21090_dropcol_splitdefpt_addcol_dml_float"
psql:/data/prabhd/test/tincrepo/main/dml/functional/output/mpp21090_dropcol_splitdefpt_addcol_dml_float_opt.sql:36: NOTICE:  CREATE TABLE will create partition "mpp21090_dropcol_splitdefpt_addcol_dml_float_1_prt_partsplitone" for table "mpp21090_dropcol_splitdefpt_addcol_dml_float"
psql:/data/prabhd/test/tincrepo/main/dml/functional/output/mpp21090_dropcol_splitdefpt_addcol_dml_float_opt.sql:36: NOTICE:  CREATE TABLE will create partition "mpp21090_dropcol_splitdefpt_addcol_dml_float_1_prt_def" for table "mpp21090_dropcol_splitdefpt_addcol_dml_float"
ALTER TABLE
INSERT INTO mpp21090_dropcol_splitdefpt_addcol_dml_float SELECT 1.00, 1.00,'e';
INSERT 0 1
SELECT * FROM mpp21090_dropcol_splitdefpt_addcol_dml_float ORDER BY 1,2,3;
 col1 | col2 | col3 
------+------+------
    1 |    1 | e
    2 |    2 | a
    2 |    2 | b
(3 rows)

ALTER TABLE mpp21090_dropcol_splitdefpt_addcol_dml_float ADD COLUMN col5 float DEFAULT 2.00;
ALTER TABLE
INSERT INTO mpp21090_dropcol_splitdefpt_addcol_dml_float VALUES(2.00,2.00,'c',2.00);
INSERT 0 1
SELECT * FROM mpp21090_dropcol_splitdefpt_addcol_dml_float ORDER BY 1,2,3,4;
 col1 | col2 | col3 | col5 
------+------+------+------
    1 |    1 | e    |    2
    2 |    2 | a    |    2
    2 |    2 | b    |    2
    2 |    2 | c    |    2
(4 rows)

-- Update distribution key
UPDATE mpp21090_dropcol_splitdefpt_addcol_dml_float SET col1 = 35.00 WHERE col2 = 1.00 AND col1 = 1.00;
UPDATE 1
SELECT * FROM mpp21090_dropcol_splitdefpt_addcol_dml_float ORDER BY 1,2,3;
 col1 | col2 | col3 | col5 
------+------+------+------
    2 |    2 | a    |    2
    2 |    2 | b    |    2
    2 |    2 | c    |    2
   35 |    1 | e    |    2
(4 rows)

-- Update partition key
UPDATE mpp21090_dropcol_splitdefpt_addcol_dml_float SET col2 = 35.00 WHERE col2 = 1.00 AND col1 = 35.00;
UPDATE 1
SELECT * FROM mpp21090_dropcol_splitdefpt_addcol_dml_float ORDER BY 1,2,3;
 col1 | col2 | col3 | col5 
------+------+------+------
    2 |    2 | a    |    2
    2 |    2 | b    |    2
    2 |    2 | c    |    2
   35 |   35 | e    |    2
(4 rows)

DELETE FROM mpp21090_dropcol_splitdefpt_addcol_dml_float WHERE col3='b';
DELETE 1
SELECT * FROM mpp21090_dropcol_splitdefpt_addcol_dml_float ORDER BY 1,2,3;
 col1 | col2 | col3 | col5 
------+------+------+------
    2 |    2 | a    |    2
    2 |    2 | c    |    2
   35 |   35 | e    |    2
(3 rows)

