DROP TABLE IF EXISTS mpp21090_xchange_pttab_dropcol_idx_dml_numeric;
psql:/data/prabhd/test/tincrepo/main/dml/functional/output/mpp21090_xchange_pttab_dropcol_idx_dml_numeric_opt.sql:14: NOTICE:  table "mpp21090_xchange_pttab_dropcol_idx_dml_numeric" does not exist, skipping
DROP TABLE
CREATE TABLE mpp21090_xchange_pttab_dropcol_idx_dml_numeric
(
    col1 numeric,
    col2 numeric,
    col3 char,
    col4 int,
    col5 numeric
) 
DISTRIBUTED by (col1)
PARTITION BY RANGE(col2)(partition partone start(1.000000) end(10.000000)  WITH (APPENDONLY=true, COMPRESSLEVEL=5, ORIENTATION=column),partition parttwo start(10.000000) end(20.000000) WITH (APPENDONLY=true, COMPRESSLEVEL=5, ORIENTATION=row),partition partthree start(20.000000) end(30.000000));
psql:/data/prabhd/test/tincrepo/main/dml/functional/output/mpp21090_xchange_pttab_dropcol_idx_dml_numeric_opt.sql:24: NOTICE:  CREATE TABLE will create partition "mpp21090_xchange_pttab_dropcol_idx_dml_numeric_1_prt_partone" for table "mpp21090_xchange_pttab_dropcol_idx_dml_numeric"
psql:/data/prabhd/test/tincrepo/main/dml/functional/output/mpp21090_xchange_pttab_dropcol_idx_dml_numeric_opt.sql:24: NOTICE:  CREATE TABLE will create partition "mpp21090_xchange_pttab_dropcol_idx_dml_numeric_1_prt_parttwo" for table "mpp21090_xchange_pttab_dropcol_idx_dml_numeric"
psql:/data/prabhd/test/tincrepo/main/dml/functional/output/mpp21090_xchange_pttab_dropcol_idx_dml_numeric_opt.sql:24: NOTICE:  CREATE TABLE will create partition "mpp21090_xchange_pttab_dropcol_idx_dml_numeric_1_prt_partthree" for table "mpp21090_xchange_pttab_dropcol_idx_dml_numeric"
CREATE TABLE
INSERT INTO mpp21090_xchange_pttab_dropcol_idx_dml_numeric VALUES(2.000000,2.000000,'a',0, 2.000000);
INSERT 0 1
SELECT * FROM mpp21090_xchange_pttab_dropcol_idx_dml_numeric ORDER BY 1,2,3,4;
   col1   |   col2   | col3 | col4 |   col5   
----------+----------+------+------+----------
 2.000000 | 2.000000 | a    |    0 | 2.000000
(1 row)

DROP INDEX IF EXISTS mpp21090_xchange_pttab_dropcol_idx_dml_idx_numeric;
psql:/data/prabhd/test/tincrepo/main/dml/functional/output/mpp21090_xchange_pttab_dropcol_idx_dml_numeric_opt.sql:29: NOTICE:  index "mpp21090_xchange_pttab_dropcol_idx_dml_idx_numeric" does not exist, skipping
DROP INDEX
CREATE INDEX mpp21090_xchange_pttab_dropcol_idx_dml_idx_numeric on mpp21090_xchange_pttab_dropcol_idx_dml_numeric(col2);
psql:/data/prabhd/test/tincrepo/main/dml/functional/output/mpp21090_xchange_pttab_dropcol_idx_dml_numeric_opt.sql:30: NOTICE:  building index for child partition "mpp21090_xchange_pttab_dropcol_idx_dml_numeric_1_prt_partone"
psql:/data/prabhd/test/tincrepo/main/dml/functional/output/mpp21090_xchange_pttab_dropcol_idx_dml_numeric_opt.sql:30: NOTICE:  building index for child partition "mpp21090_xchange_pttab_dropcol_idx_dml_numeric_1_prt_parttwo"
psql:/data/prabhd/test/tincrepo/main/dml/functional/output/mpp21090_xchange_pttab_dropcol_idx_dml_numeric_opt.sql:30: NOTICE:  building index for child partition "mpp21090_xchange_pttab_dropcol_idx_dml_numeric_1_prt_partthree"
CREATE INDEX
ALTER TABLE mpp21090_xchange_pttab_dropcol_idx_dml_numeric DROP COLUMN col1;
psql:/data/prabhd/test/tincrepo/main/dml/functional/output/mpp21090_xchange_pttab_dropcol_idx_dml_numeric_opt.sql:32: NOTICE:  Dropping a column that is part of the distribution policy forces a NULL distribution policy
psql:/data/prabhd/test/tincrepo/main/dml/functional/output/mpp21090_xchange_pttab_dropcol_idx_dml_numeric_opt.sql:32: NOTICE:  Dropping a column that is part of the distribution policy forces a NULL distribution policy
psql:/data/prabhd/test/tincrepo/main/dml/functional/output/mpp21090_xchange_pttab_dropcol_idx_dml_numeric_opt.sql:32: NOTICE:  Dropping a column that is part of the distribution policy forces a NULL distribution policy
psql:/data/prabhd/test/tincrepo/main/dml/functional/output/mpp21090_xchange_pttab_dropcol_idx_dml_numeric_opt.sql:32: NOTICE:  Dropping a column that is part of the distribution policy forces a NULL distribution policy
ALTER TABLE
-- Create Candidate table for Exchange
DROP TABLE IF EXISTS mpp21090_xchange_pttab_dropcol_idx_dml_numeric_candidate;
psql:/data/prabhd/test/tincrepo/main/dml/functional/output/mpp21090_xchange_pttab_dropcol_idx_dml_numeric_opt.sql:35: NOTICE:  table "mpp21090_xchange_pttab_dropcol_idx_dml_numeric_candidate" does not exist, skipping
DROP TABLE
CREATE TABLE mpp21090_xchange_pttab_dropcol_idx_dml_numeric_candidate( like mpp21090_xchange_pttab_dropcol_idx_dml_numeric) distributed randomly;
CREATE TABLE
INSERT INTO mpp21090_xchange_pttab_dropcol_idx_dml_numeric_candidate VALUES(2.000000,'z',1,2.000000);
INSERT 0 1
-- Exchange 
ALTER TABLE mpp21090_xchange_pttab_dropcol_idx_dml_numeric EXCHANGE PARTITION FOR(5.000000) WITH TABLE mpp21090_xchange_pttab_dropcol_idx_dml_numeric_candidate;
psql:/data/prabhd/test/tincrepo/main/dml/functional/output/mpp21090_xchange_pttab_dropcol_idx_dml_numeric_opt.sql:40: NOTICE:  exchanged partition "partone" of relation "mpp21090_xchange_pttab_dropcol_idx_dml_numeric" with relation "mpp21090_xchange_pttab_dropcol_idx_dml_numeric_candidate"
ALTER TABLE
SELECT * FROM mpp21090_xchange_pttab_dropcol_idx_dml_numeric ORDER BY 1,2,3;
   col2   | col3 | col4 |   col5   
----------+------+------+----------
 2.000000 | z    |    1 | 2.000000
(1 row)

SELECT * FROM mpp21090_xchange_pttab_dropcol_idx_dml_numeric_candidate ORDER BY 1,2,3;
   col2   | col3 | col4 |   col5   
----------+------+------+----------
 2.000000 | a    |    0 | 2.000000
(1 row)

-- DML on partition table
INSERT INTO mpp21090_xchange_pttab_dropcol_idx_dml_numeric SELECT  1.000000,'b', 1, 1.000000;
INSERT 0 1
SELECT * FROM mpp21090_xchange_pttab_dropcol_idx_dml_numeric ORDER BY 1,2,3;
   col2   | col3 | col4 |   col5   
----------+------+------+----------
 1.000000 | b    |    1 | 1.000000
 2.000000 | z    |    1 | 2.000000
(2 rows)

UPDATE mpp21090_xchange_pttab_dropcol_idx_dml_numeric SET col5 = 35.000000 WHERE col2 = 1.000000 AND col5 = 1.000000;
UPDATE 1
SELECT * FROM mpp21090_xchange_pttab_dropcol_idx_dml_numeric ORDER BY 1,2,3;
   col2   | col3 | col4 |   col5    
----------+------+------+-----------
 1.000000 | b    |    1 | 35.000000
 2.000000 | z    |    1 |  2.000000
(2 rows)

UPDATE mpp21090_xchange_pttab_dropcol_idx_dml_numeric SET col2 =2.000000 WHERE col3='b';
UPDATE 1
SELECT * FROM mpp21090_xchange_pttab_dropcol_idx_dml_numeric ORDER BY 1,2,3;
   col2   | col3 | col4 |   col5    
----------+------+------+-----------
 2.000000 | b    |    1 | 35.000000
 2.000000 | z    |    1 |  2.000000
(2 rows)

DELETE FROM mpp21090_xchange_pttab_dropcol_idx_dml_numeric WHERE col3='b';
DELETE 1
SELECT * FROM mpp21090_xchange_pttab_dropcol_idx_dml_numeric ORDER BY 1,2,3;
   col2   | col3 | col4 |   col5   
----------+------+------+----------
 2.000000 | z    |    1 | 2.000000
(1 row)

-- DML on candidate table
INSERT INTO mpp21090_xchange_pttab_dropcol_idx_dml_numeric_candidate SELECT 1.000000,'b', 1, 1.000000;
INSERT 0 1
SELECT * FROM mpp21090_xchange_pttab_dropcol_idx_dml_numeric_candidate ORDER BY 1,2,3;
   col2   | col3 | col4 |   col5   
----------+------+------+----------
 1.000000 | b    |    1 | 1.000000
 2.000000 | a    |    0 | 2.000000
(2 rows)

UPDATE mpp21090_xchange_pttab_dropcol_idx_dml_numeric_candidate SET col2=2.000000 WHERE col3='a';
UPDATE 1
SELECT * FROM mpp21090_xchange_pttab_dropcol_idx_dml_numeric_candidate ORDER BY 1,2,3;
   col2   | col3 | col4 |   col5   
----------+------+------+----------
 1.000000 | b    |    1 | 1.000000
 2.000000 | a    |    0 | 2.000000
(2 rows)

DELETE FROM mpp21090_xchange_pttab_dropcol_idx_dml_numeric_candidate WHERE col3='a';
DELETE 1
SELECT * FROM mpp21090_xchange_pttab_dropcol_idx_dml_numeric_candidate ORDER BY 1,2,3;
   col2   | col3 | col4 |   col5   
----------+------+------+----------
 1.000000 | b    |    1 | 1.000000
(1 row)

