DROP TABLE IF EXISTS mpp21090_changedistpolicy_dml_pttab_int;
psql:/data/prabhd/test/tincrepo/main/dml/functional/output/mpp21090_changedistpolicy_dml_pttab_int_opt.sql:14: NOTICE:  table "mpp21090_changedistpolicy_dml_pttab_int" does not exist, skipping
DROP TABLE
CREATE TABLE mpp21090_changedistpolicy_dml_pttab_int
(
    col1 int,
    col2 int,
    col3 char,
    col4 int,
    col5 int
) DISTRIBUTED BY (col1) PARTITION BY RANGE(col2)(partition partone start(1) end(10001) WITH (APPENDONLY=true, COMPRESSLEVEL=5, ORIENTATION=column),partition parttwo start(10001) end(20001) WITH (APPENDONLY=true, COMPRESSLEVEL=5, ORIENTATION=row),partition partthree start(20001) end(30001));
psql:/data/prabhd/test/tincrepo/main/dml/functional/output/mpp21090_changedistpolicy_dml_pttab_int_opt.sql:22: NOTICE:  Table doesn't have 'DISTRIBUTED BY' clause -- Using column named 'col1' as the Greenplum Database data distribution key for this table.
HINT:  The 'DISTRIBUTED BY' clause determines the distribution of data. Make sure column(s) chosen are the optimal data distribution key to minimize skew.
psql:/data/prabhd/test/tincrepo/main/dml/functional/output/mpp21090_changedistpolicy_dml_pttab_int_opt.sql:22: NOTICE:  CREATE TABLE will create partition "mpp21090_changedistpolicy_dml_pttab_int_1_prt_partone" for table "mpp21090_changedistpolicy_dml_pttab_int"
psql:/data/prabhd/test/tincrepo/main/dml/functional/output/mpp21090_changedistpolicy_dml_pttab_int_opt.sql:22: NOTICE:  CREATE TABLE will create partition "mpp21090_changedistpolicy_dml_pttab_int_1_prt_parttwo" for table "mpp21090_changedistpolicy_dml_pttab_int"
psql:/data/prabhd/test/tincrepo/main/dml/functional/output/mpp21090_changedistpolicy_dml_pttab_int_opt.sql:22: NOTICE:  CREATE TABLE will create partition "mpp21090_changedistpolicy_dml_pttab_int_1_prt_partthree" for table "mpp21090_changedistpolicy_dml_pttab_int"
CREATE TABLE
INSERT INTO mpp21090_changedistpolicy_dml_pttab_int VALUES(10000,10000,'a',10000,0);
INSERT 0 1
SELECT * FROM mpp21090_changedistpolicy_dml_pttab_int ORDER BY 1,2,3,4;
 col1  | col2  | col3 | col4  | col5 
-------+-------+------+-------+------
 10000 | 10000 | a    | 10000 |    0
(1 row)

ALTER TABLE mpp21090_changedistpolicy_dml_pttab_int DROP COLUMN col4;
ALTER TABLE
INSERT INTO mpp21090_changedistpolicy_dml_pttab_int VALUES(10000,10000,'b',1);
INSERT 0 1
SELECT * FROM mpp21090_changedistpolicy_dml_pttab_int ORDER BY 1,2,3,4;
 col1  | col2  | col3 | col5 
-------+-------+------+------
 10000 | 10000 | a    |    0
 10000 | 10000 | b    |    1
(2 rows)

ALTER TABLE mpp21090_changedistpolicy_dml_pttab_int SET DISTRIBUTED BY (col3);
ALTER TABLE
INSERT INTO mpp21090_changedistpolicy_dml_pttab_int SELECT 20000, 20000,'c', 2;
INSERT 0 1
SELECT * FROM mpp21090_changedistpolicy_dml_pttab_int ORDER BY 1,2,3;
 col1  | col2  | col3 | col5 
-------+-------+------+------
 10000 | 10000 | a    |    0
 10000 | 10000 | b    |    1
 20000 | 20000 | c    |    2
(3 rows)

UPDATE mpp21090_changedistpolicy_dml_pttab_int SET col3 ='c' WHERE col3 ='b';
UPDATE 1
SELECT * FROM mpp21090_changedistpolicy_dml_pttab_int ORDER BY 1,2,3;
 col1  | col2  | col3 | col5 
-------+-------+------+------
 10000 | 10000 | a    |    0
 10000 | 10000 | c    |    1
 20000 | 20000 | c    |    2
(3 rows)

DELETE FROM mpp21090_changedistpolicy_dml_pttab_int WHERE col3 ='c';
DELETE 2
SELECT * FROM mpp21090_changedistpolicy_dml_pttab_int ORDER BY 1,2,3;
 col1  | col2  | col3 | col5 
-------+-------+------+------
 10000 | 10000 | a    |    0
(1 row)

