DROP TABLE IF EXISTS mpp21090_xchange_pttab_dropcol_addcol_dml_int4;
psql:/data/prabhd/test/tincrepo/main/dml/functional/output/mpp21090_xchange_pttab_dropcol_addcol_dml_int4_opt.sql:14: NOTICE:  table "mpp21090_xchange_pttab_dropcol_addcol_dml_int4" does not exist, skipping
DROP TABLE
CREATE TABLE mpp21090_xchange_pttab_dropcol_addcol_dml_int4
(
    col1 int4,
    col2 int4,
    col3 char,
    col4 int,
    col5 int4
) 
DISTRIBUTED by (col1)
PARTITION BY RANGE(col2)(partition partone start(1) end(100000001)  WITH (APPENDONLY=true, COMPRESSLEVEL=5, ORIENTATION=column),partition parttwo start(100000001) end(200000001) WITH (APPENDONLY=true, COMPRESSLEVEL=5, ORIENTATION=row),partition partthree start(200000001) end(300000001));
psql:/data/prabhd/test/tincrepo/main/dml/functional/output/mpp21090_xchange_pttab_dropcol_addcol_dml_int4_opt.sql:24: NOTICE:  CREATE TABLE will create partition "mpp21090_xchange_pttab_dropcol_addcol_dml_int4_1_prt_partone" for table "mpp21090_xchange_pttab_dropcol_addcol_dml_int4"
psql:/data/prabhd/test/tincrepo/main/dml/functional/output/mpp21090_xchange_pttab_dropcol_addcol_dml_int4_opt.sql:24: NOTICE:  CREATE TABLE will create partition "mpp21090_xchange_pttab_dropcol_addcol_dml_int4_1_prt_parttwo" for table "mpp21090_xchange_pttab_dropcol_addcol_dml_int4"
psql:/data/prabhd/test/tincrepo/main/dml/functional/output/mpp21090_xchange_pttab_dropcol_addcol_dml_int4_opt.sql:24: NOTICE:  CREATE TABLE will create partition "mpp21090_xchange_pttab_dropcol_addcol_dml_int4_1_prt_partthree" for table "mpp21090_xchange_pttab_dropcol_addcol_dml_int4"
CREATE TABLE
INSERT INTO mpp21090_xchange_pttab_dropcol_addcol_dml_int4 VALUES(20000000,20000000,'a',0, 20000000);
INSERT 0 1
SELECT * FROM mpp21090_xchange_pttab_dropcol_addcol_dml_int4 ORDER BY 1,2,3,4;
   col1   |   col2   | col3 | col4 |   col5   
----------+----------+------+------+----------
 20000000 | 20000000 | a    |    0 | 20000000
(1 row)

ALTER TABLE mpp21090_xchange_pttab_dropcol_addcol_dml_int4 DROP COLUMN col1;
psql:/data/prabhd/test/tincrepo/main/dml/functional/output/mpp21090_xchange_pttab_dropcol_addcol_dml_int4_opt.sql:29: NOTICE:  Dropping a column that is part of the distribution policy forces a NULL distribution policy
psql:/data/prabhd/test/tincrepo/main/dml/functional/output/mpp21090_xchange_pttab_dropcol_addcol_dml_int4_opt.sql:29: NOTICE:  Dropping a column that is part of the distribution policy forces a NULL distribution policy
psql:/data/prabhd/test/tincrepo/main/dml/functional/output/mpp21090_xchange_pttab_dropcol_addcol_dml_int4_opt.sql:29: NOTICE:  Dropping a column that is part of the distribution policy forces a NULL distribution policy
psql:/data/prabhd/test/tincrepo/main/dml/functional/output/mpp21090_xchange_pttab_dropcol_addcol_dml_int4_opt.sql:29: NOTICE:  Dropping a column that is part of the distribution policy forces a NULL distribution policy
ALTER TABLE
ALTER TABLE mpp21090_xchange_pttab_dropcol_addcol_dml_int4 ADD COLUMN col1 int4 DEFAULT 20000000;
ALTER TABLE
-- Create Candidate table for Exchange
DROP TABLE IF EXISTS mpp21090_xchange_pttab_dropcol_addcol_dml_int4_candidate;
psql:/data/prabhd/test/tincrepo/main/dml/functional/output/mpp21090_xchange_pttab_dropcol_addcol_dml_int4_opt.sql:33: NOTICE:  table "mpp21090_xchange_pttab_dropcol_addcol_dml_int4_candidate" does not exist, skipping
DROP TABLE
CREATE TABLE mpp21090_xchange_pttab_dropcol_addcol_dml_int4_candidate( like mpp21090_xchange_pttab_dropcol_addcol_dml_int4) distributed randomly;
CREATE TABLE
INSERT INTO mpp21090_xchange_pttab_dropcol_addcol_dml_int4_candidate VALUES(20000000,'z',1,20000000,20000000);
INSERT 0 1
-- Exchange 
ALTER TABLE mpp21090_xchange_pttab_dropcol_addcol_dml_int4 EXCHANGE PARTITION FOR(50000000) WITH TABLE mpp21090_xchange_pttab_dropcol_addcol_dml_int4_candidate;
psql:/data/prabhd/test/tincrepo/main/dml/functional/output/mpp21090_xchange_pttab_dropcol_addcol_dml_int4_opt.sql:38: NOTICE:  exchanged partition "partone" of relation "mpp21090_xchange_pttab_dropcol_addcol_dml_int4" with relation "mpp21090_xchange_pttab_dropcol_addcol_dml_int4_candidate"
ALTER TABLE
SELECT * FROM mpp21090_xchange_pttab_dropcol_addcol_dml_int4 ORDER BY 1,2,3;
   col2   | col3 | col4 |   col5   |   col1   
----------+------+------+----------+----------
 20000000 | z    |    1 | 20000000 | 20000000
(1 row)

SELECT * FROM mpp21090_xchange_pttab_dropcol_addcol_dml_int4_candidate ORDER BY 1,2,3;
   col2   | col3 | col4 |   col5   |   col1   
----------+------+------+----------+----------
 20000000 | a    |    0 | 20000000 | 20000000
(1 row)

-- DML on partition table
INSERT INTO mpp21090_xchange_pttab_dropcol_addcol_dml_int4 SELECT  10000000,'b', 1, 10000000, 10000000;
INSERT 0 1
SELECT * FROM mpp21090_xchange_pttab_dropcol_addcol_dml_int4 ORDER BY 1,2,3;
   col2   | col3 | col4 |   col5   |   col1   
----------+------+------+----------+----------
 10000000 | b    |    1 | 10000000 | 10000000
 20000000 | z    |    1 | 20000000 | 20000000
(2 rows)

UPDATE mpp21090_xchange_pttab_dropcol_addcol_dml_int4 SET col5 = 350000000 WHERE col2 = 10000000 AND col5 = 10000000;
UPDATE 1
SELECT * FROM mpp21090_xchange_pttab_dropcol_addcol_dml_int4 ORDER BY 1,2,3;
   col2   | col3 | col4 |   col5    |   col1   
----------+------+------+-----------+----------
 10000000 | b    |    1 | 350000000 | 10000000
 20000000 | z    |    1 |  20000000 | 20000000
(2 rows)

UPDATE mpp21090_xchange_pttab_dropcol_addcol_dml_int4 SET col2 =20000000 WHERE col3='b';
UPDATE 1
SELECT * FROM mpp21090_xchange_pttab_dropcol_addcol_dml_int4 ORDER BY 1,2,3;
   col2   | col3 | col4 |   col5    |   col1   
----------+------+------+-----------+----------
 20000000 | b    |    1 | 350000000 | 10000000
 20000000 | z    |    1 |  20000000 | 20000000
(2 rows)

DELETE FROM mpp21090_xchange_pttab_dropcol_addcol_dml_int4 WHERE col3='b';
DELETE 1
SELECT * FROM mpp21090_xchange_pttab_dropcol_addcol_dml_int4 ORDER BY 1,2,3;
   col2   | col3 | col4 |   col5   |   col1   
----------+------+------+----------+----------
 20000000 | z    |    1 | 20000000 | 20000000
(1 row)

-- DML on candidate table
INSERT INTO mpp21090_xchange_pttab_dropcol_addcol_dml_int4_candidate SELECT 10000000,'b', 1, 10000000, 10000000;
INSERT 0 1
SELECT * FROM mpp21090_xchange_pttab_dropcol_addcol_dml_int4_candidate ORDER BY 1,2,3;
   col2   | col3 | col4 |   col5   |   col1   
----------+------+------+----------+----------
 10000000 | b    |    1 | 10000000 | 10000000
 20000000 | a    |    0 | 20000000 | 20000000
(2 rows)

UPDATE mpp21090_xchange_pttab_dropcol_addcol_dml_int4_candidate SET col2=20000000 WHERE col3='a';
UPDATE 1
SELECT * FROM mpp21090_xchange_pttab_dropcol_addcol_dml_int4_candidate ORDER BY 1,2,3;
   col2   | col3 | col4 |   col5   |   col1   
----------+------+------+----------+----------
 10000000 | b    |    1 | 10000000 | 10000000
 20000000 | a    |    0 | 20000000 | 20000000
(2 rows)

DELETE FROM mpp21090_xchange_pttab_dropcol_addcol_dml_int4_candidate WHERE col3='a';
DELETE 1
SELECT * FROM mpp21090_xchange_pttab_dropcol_addcol_dml_int4_candidate ORDER BY 1,2,3;
   col2   | col3 | col4 |   col5   |   col1   
----------+------+------+----------+----------
 10000000 | b    |    1 | 10000000 | 10000000
(1 row)

