DROP TABLE IF EXISTS mpp21090_pttab_dropfirstcol_addpt_index_float;
psql:/data/prabhd/test/tincrepo/main/dml/functional/output/mpp21090_pttab_dropfirstcol_addpt_index_float_opt.sql:14: NOTICE:  table "mpp21090_pttab_dropfirstcol_addpt_index_float" does not exist, skipping
DROP TABLE
CREATE TABLE mpp21090_pttab_dropfirstcol_addpt_index_float
(
    col1 float,
    col2 float,
    col3 char,
    col4 float,
    col5 int
) 
DISTRIBUTED by (col1)
PARTITION BY RANGE(col2)(partition partone start(1.00) end(10.00)  WITH (APPENDONLY=true, COMPRESSLEVEL=5, ORIENTATION=column),partition parttwo start(10.00) end(20.00) WITH (APPENDONLY=true, COMPRESSLEVEL=5, ORIENTATION=row),partition partthree start(20.00) end(30.00));
psql:/data/prabhd/test/tincrepo/main/dml/functional/output/mpp21090_pttab_dropfirstcol_addpt_index_float_opt.sql:24: NOTICE:  CREATE TABLE will create partition "mpp21090_pttab_dropfirstcol_addpt_index_float_1_prt_partone" for table "mpp21090_pttab_dropfirstcol_addpt_index_float"
psql:/data/prabhd/test/tincrepo/main/dml/functional/output/mpp21090_pttab_dropfirstcol_addpt_index_float_opt.sql:24: NOTICE:  CREATE TABLE will create partition "mpp21090_pttab_dropfirstcol_addpt_index_float_1_prt_parttwo" for table "mpp21090_pttab_dropfirstcol_addpt_index_float"
psql:/data/prabhd/test/tincrepo/main/dml/functional/output/mpp21090_pttab_dropfirstcol_addpt_index_float_opt.sql:24: NOTICE:  CREATE TABLE will create partition "mpp21090_pttab_dropfirstcol_addpt_index_float_1_prt_partthree" for table "mpp21090_pttab_dropfirstcol_addpt_index_float"
CREATE TABLE
INSERT INTO mpp21090_pttab_dropfirstcol_addpt_index_float VALUES(2.00,2.00,'a',2.00,0);
INSERT 0 1
DROP INDEX IF EXISTS mpp21090_pttab_dropfirstcol_addpt_index_idx_float;
psql:/data/prabhd/test/tincrepo/main/dml/functional/output/mpp21090_pttab_dropfirstcol_addpt_index_float_opt.sql:28: NOTICE:  index "mpp21090_pttab_dropfirstcol_addpt_index_idx_float" does not exist, skipping
DROP INDEX
CREATE INDEX mpp21090_pttab_dropfirstcol_addpt_index_idx_float on mpp21090_pttab_dropfirstcol_addpt_index_float(col2);
psql:/data/prabhd/test/tincrepo/main/dml/functional/output/mpp21090_pttab_dropfirstcol_addpt_index_float_opt.sql:29: NOTICE:  building index for child partition "mpp21090_pttab_dropfirstcol_addpt_index_float_1_prt_partone"
psql:/data/prabhd/test/tincrepo/main/dml/functional/output/mpp21090_pttab_dropfirstcol_addpt_index_float_opt.sql:29: NOTICE:  building index for child partition "mpp21090_pttab_dropfirstcol_addpt_index_float_1_prt_parttwo"
psql:/data/prabhd/test/tincrepo/main/dml/functional/output/mpp21090_pttab_dropfirstcol_addpt_index_float_opt.sql:29: NOTICE:  building index for child partition "mpp21090_pttab_dropfirstcol_addpt_index_float_1_prt_partthree"
CREATE INDEX
ALTER TABLE mpp21090_pttab_dropfirstcol_addpt_index_float DROP COLUMN col1;
psql:/data/prabhd/test/tincrepo/main/dml/functional/output/mpp21090_pttab_dropfirstcol_addpt_index_float_opt.sql:31: NOTICE:  Dropping a column that is part of the distribution policy forces a NULL distribution policy
psql:/data/prabhd/test/tincrepo/main/dml/functional/output/mpp21090_pttab_dropfirstcol_addpt_index_float_opt.sql:31: NOTICE:  Dropping a column that is part of the distribution policy forces a NULL distribution policy
psql:/data/prabhd/test/tincrepo/main/dml/functional/output/mpp21090_pttab_dropfirstcol_addpt_index_float_opt.sql:31: NOTICE:  Dropping a column that is part of the distribution policy forces a NULL distribution policy
psql:/data/prabhd/test/tincrepo/main/dml/functional/output/mpp21090_pttab_dropfirstcol_addpt_index_float_opt.sql:31: NOTICE:  Dropping a column that is part of the distribution policy forces a NULL distribution policy
ALTER TABLE
ALTER TABLE mpp21090_pttab_dropfirstcol_addpt_index_float ADD PARTITION partfour start(30.00) end(40.00);
psql:/data/prabhd/test/tincrepo/main/dml/functional/output/mpp21090_pttab_dropfirstcol_addpt_index_float_opt.sql:32: NOTICE:  CREATE TABLE will create partition "mpp21090_pttab_dropfirstcol_addpt_index_float_1_prt_partfour" for table "mpp21090_pttab_dropfirstcol_addpt_index_float"
ALTER TABLE
INSERT INTO mpp21090_pttab_dropfirstcol_addpt_index_float SELECT 35.00,'b',35.00, 1;
INSERT 0 1
SELECT * FROM mpp21090_pttab_dropfirstcol_addpt_index_float ORDER BY 1,2,3;
 col2 | col3 | col4 | col5 
------+------+------+------
    2 | a    |    2 |    0
   35 | b    |   35 |    1
(2 rows)

UPDATE mpp21090_pttab_dropfirstcol_addpt_index_float SET col4 = 1.00 WHERE col2 = 35.00 AND col4 = 35.00;
UPDATE 1
SELECT * FROM mpp21090_pttab_dropfirstcol_addpt_index_float ORDER BY 1,2,3;
 col2 | col3 | col4 | col5 
------+------+------+------
    2 | a    |    2 |    0
   35 | b    |    1 |    1
(2 rows)

-- Update partition key
UPDATE mpp21090_pttab_dropfirstcol_addpt_index_float SET col2 = 1.00 WHERE col2 = 35.00 AND col4 = 1.00;
UPDATE 1
SELECT * FROM mpp21090_pttab_dropfirstcol_addpt_index_float ORDER BY 1,2,3;
 col2 | col3 | col4 | col5 
------+------+------+------
    1 | b    |    1 |    1
    2 | a    |    2 |    0
(2 rows)

DELETE FROM mpp21090_pttab_dropfirstcol_addpt_index_float WHERE col2 = 1.00;
DELETE 1
SELECT * FROM mpp21090_pttab_dropfirstcol_addpt_index_float ORDER BY 1,2,3;
 col2 | col3 | col4 | col5 
------+------+------+------
    2 | a    |    2 |    0
(1 row)

