DROP TABLE IF EXISTS mpp21090_dropcol_splitdefpt_addcol_dml_char;
psql:/data/prabhd/test/tincrepo/main/dml/functional/output/mpp21090_dropcol_splitdefpt_addcol_dml_char_opt.sql:14: NOTICE:  table "mpp21090_dropcol_splitdefpt_addcol_dml_char" does not exist, skipping
DROP TABLE
CREATE TABLE mpp21090_dropcol_splitdefpt_addcol_dml_char
(
    col1 char,
    col2 char,
    col3 char,
    col4 char
) 
DISTRIBUTED by (col1)
PARTITION BY LIST(col2)
(
default partition def
);
psql:/data/prabhd/test/tincrepo/main/dml/functional/output/mpp21090_dropcol_splitdefpt_addcol_dml_char_opt.sql:26: NOTICE:  CREATE TABLE will create partition "mpp21090_dropcol_splitdefpt_addcol_dml_char_1_prt_def" for table "mpp21090_dropcol_splitdefpt_addcol_dml_char"
CREATE TABLE
INSERT INTO mpp21090_dropcol_splitdefpt_addcol_dml_char VALUES('x','x','a','x');
INSERT 0 1
SELECT * FROM mpp21090_dropcol_splitdefpt_addcol_dml_char ORDER BY 1,2,3,4;
 col1 | col2 | col3 | col4 
------+------+------+------
 x    | x    | a    | x
(1 row)

ALTER TABLE mpp21090_dropcol_splitdefpt_addcol_dml_char DROP COLUMN col4;
ALTER TABLE
INSERT INTO mpp21090_dropcol_splitdefpt_addcol_dml_char VALUES('x','x','b');
INSERT 0 1
SELECT * FROM mpp21090_dropcol_splitdefpt_addcol_dml_char ORDER BY 1,2,3;
 col1 | col2 | col3 
------+------+------
 x    | x    | a
 x    | x    | b
(2 rows)

ALTER TABLE mpp21090_dropcol_splitdefpt_addcol_dml_char SPLIT DEFAULT PARTITION at ('d') into (partition partsplitone,partition def);
psql:/data/prabhd/test/tincrepo/main/dml/functional/output/mpp21090_dropcol_splitdefpt_addcol_dml_char_opt.sql:36: NOTICE:  exchanged partition "def" of relation "mpp21090_dropcol_splitdefpt_addcol_dml_char" with relation "pg_temp_59648"
psql:/data/prabhd/test/tincrepo/main/dml/functional/output/mpp21090_dropcol_splitdefpt_addcol_dml_char_opt.sql:36: NOTICE:  dropped partition "def" for relation "mpp21090_dropcol_splitdefpt_addcol_dml_char"
psql:/data/prabhd/test/tincrepo/main/dml/functional/output/mpp21090_dropcol_splitdefpt_addcol_dml_char_opt.sql:36: NOTICE:  CREATE TABLE will create partition "mpp21090_dropcol_splitdefpt_addcol_dml_char_1_prt_partsplitone" for table "mpp21090_dropcol_splitdefpt_addcol_dml_char"
psql:/data/prabhd/test/tincrepo/main/dml/functional/output/mpp21090_dropcol_splitdefpt_addcol_dml_char_opt.sql:36: NOTICE:  CREATE TABLE will create partition "mpp21090_dropcol_splitdefpt_addcol_dml_char_1_prt_def" for table "mpp21090_dropcol_splitdefpt_addcol_dml_char"
ALTER TABLE
INSERT INTO mpp21090_dropcol_splitdefpt_addcol_dml_char SELECT 'a', 'a','e';
INSERT 0 1
SELECT * FROM mpp21090_dropcol_splitdefpt_addcol_dml_char ORDER BY 1,2,3;
 col1 | col2 | col3 
------+------+------
 a    | a    | e
 x    | x    | a
 x    | x    | b
(3 rows)

ALTER TABLE mpp21090_dropcol_splitdefpt_addcol_dml_char ADD COLUMN col5 char DEFAULT 'x';
ALTER TABLE
INSERT INTO mpp21090_dropcol_splitdefpt_addcol_dml_char VALUES('x','x','c','x');
INSERT 0 1
SELECT * FROM mpp21090_dropcol_splitdefpt_addcol_dml_char ORDER BY 1,2,3,4;
 col1 | col2 | col3 | col5 
------+------+------+------
 a    | a    | e    | x
 x    | x    | a    | x
 x    | x    | b    | x
 x    | x    | c    | x
(4 rows)

-- Update distribution key
UPDATE mpp21090_dropcol_splitdefpt_addcol_dml_char SET col1 = 'z' WHERE col2 = 'a' AND col1 = 'a';
UPDATE 1
SELECT * FROM mpp21090_dropcol_splitdefpt_addcol_dml_char ORDER BY 1,2,3;
 col1 | col2 | col3 | col5 
------+------+------+------
 x    | x    | a    | x
 x    | x    | b    | x
 x    | x    | c    | x
 z    | a    | e    | x
(4 rows)

-- Update partition key
UPDATE mpp21090_dropcol_splitdefpt_addcol_dml_char SET col2 = 'z' WHERE col2 = 'a' AND col1 = 'z';
UPDATE 1
SELECT * FROM mpp21090_dropcol_splitdefpt_addcol_dml_char ORDER BY 1,2,3;
 col1 | col2 | col3 | col5 
------+------+------+------
 x    | x    | a    | x
 x    | x    | b    | x
 x    | x    | c    | x
 z    | z    | e    | x
(4 rows)

DELETE FROM mpp21090_dropcol_splitdefpt_addcol_dml_char WHERE col3='b';
DELETE 1
SELECT * FROM mpp21090_dropcol_splitdefpt_addcol_dml_char ORDER BY 1,2,3;
 col1 | col2 | col3 | col5 
------+------+------+------
 x    | x    | a    | x
 x    | x    | c    | x
 z    | z    | e    | x
(3 rows)

