DROP TABLE IF EXISTS mpp21090_reordered_col_dml_int4;
psql:/data/prabhd/test/tincrepo/main/dml/functional/output/mpp21090_reordered_col_dml_int4_opt.sql:14: NOTICE:  table "mpp21090_reordered_col_dml_int4" does not exist, skipping
DROP TABLE
CREATE TABLE mpp21090_reordered_col_dml_int4
(
    col1 int4 DEFAULT 10000000,
    col2 int4,
    col3 char,
    col4 int4,
    col5 int
) 
DISTRIBUTED by (col1)
PARTITION BY RANGE(col2)(partition partone start(1) end(100000001)  WITH (APPENDONLY=true, COMPRESSLEVEL=5, ORIENTATION=column),partition parttwo start(100000001) end(200000001) WITH (APPENDONLY=true, COMPRESSLEVEL=5, ORIENTATION=row),partition partthree start(200000001) end(300000001));
psql:/data/prabhd/test/tincrepo/main/dml/functional/output/mpp21090_reordered_col_dml_int4_opt.sql:24: NOTICE:  CREATE TABLE will create partition "mpp21090_reordered_col_dml_int4_1_prt_partone" for table "mpp21090_reordered_col_dml_int4"
psql:/data/prabhd/test/tincrepo/main/dml/functional/output/mpp21090_reordered_col_dml_int4_opt.sql:24: NOTICE:  CREATE TABLE will create partition "mpp21090_reordered_col_dml_int4_1_prt_parttwo" for table "mpp21090_reordered_col_dml_int4"
psql:/data/prabhd/test/tincrepo/main/dml/functional/output/mpp21090_reordered_col_dml_int4_opt.sql:24: NOTICE:  CREATE TABLE will create partition "mpp21090_reordered_col_dml_int4_1_prt_partthree" for table "mpp21090_reordered_col_dml_int4"
CREATE TABLE
INSERT INTO mpp21090_reordered_col_dml_int4(col2,col1,col3,col5,col4) SELECT 20000000, 20000000,'a', 1,20000000;
INSERT 0 1
INSERT INTO mpp21090_reordered_col_dml_int4(col2,col3,col5,col4) SELECT 20000000,'b', 2, 20000000; 
INSERT 0 1
SELECT * FROM mpp21090_reordered_col_dml_int4 ORDER BY 1,2,3,4;
   col1   |   col2   | col3 |   col4   | col5 
----------+----------+------+----------+------
 10000000 | 20000000 | b    | 20000000 |    2
 20000000 | 20000000 | a    | 20000000 |    1
(2 rows)

ALTER TABLE mpp21090_reordered_col_dml_int4 DROP COLUMN col4;
ALTER TABLE
ALTER TABLE mpp21090_reordered_col_dml_int4 ADD COLUMN col4 int DEFAULT 10;
ALTER TABLE
INSERT INTO mpp21090_reordered_col_dml_int4(col2,col3,col5,col4) SELECT 20000000,'c', 2, 10; 
INSERT 0 1
SELECT * FROM mpp21090_reordered_col_dml_int4 ORDER BY 1,2,3,4;
   col1   |   col2   | col3 | col5 | col4 
----------+----------+------+------+------
 10000000 | 20000000 | b    |    2 |   10
 10000000 | 20000000 | c    |    2 |   10
 20000000 | 20000000 | a    |    1 |   10
(3 rows)

UPDATE mpp21090_reordered_col_dml_int4 SET col4 = 20;
UPDATE 3
SELECT * FROM mpp21090_reordered_col_dml_int4 ORDER BY 1,2,3,4;
   col1   |   col2   | col3 | col5 | col4 
----------+----------+------+------+------
 10000000 | 20000000 | b    |    2 |   20
 10000000 | 20000000 | c    |    2 |   20
 20000000 | 20000000 | a    |    1 |   20
(3 rows)

DELETE FROM mpp21090_reordered_col_dml_int4 WHERE col4=20;
DELETE 3
SELECT * FROM mpp21090_reordered_col_dml_int4 ORDER BY 1,2,3,4;
 col1 | col2 | col3 | col5 | col4 
------+------+------+------+------
(0 rows)

