DROP TABLE IF EXISTS mpp21090_dropcol_splitpt_idx_dml_interval;
psql:/data/prabhd/test/tincrepo/main/dml/functional/output/mpp21090_dropcol_splitpt_idx_dml_interval_opt.sql:14: NOTICE:  table "mpp21090_dropcol_splitpt_idx_dml_interval" does not exist, skipping
DROP TABLE
CREATE TABLE mpp21090_dropcol_splitpt_idx_dml_interval
(
    col1 interval,
    col2 interval,
    col3 char,
    col4 interval,
    col5 int
) 
DISTRIBUTED by (col1)
PARTITION BY RANGE(col2)(partition partone start('1 sec') end('1 min')  WITH (APPENDONLY=true, COMPRESSLEVEL=5, ORIENTATION=column),partition parttwo start('1 min') end('1 hour') WITH (APPENDONLY=true, COMPRESSLEVEL=5, ORIENTATION=row),partition partthree start('1 hour') end('12 hours'));
psql:/data/prabhd/test/tincrepo/main/dml/functional/output/mpp21090_dropcol_splitpt_idx_dml_interval_opt.sql:24: NOTICE:  CREATE TABLE will create partition "mpp21090_dropcol_splitpt_idx_dml_interval_1_prt_partone" for table "mpp21090_dropcol_splitpt_idx_dml_interval"
psql:/data/prabhd/test/tincrepo/main/dml/functional/output/mpp21090_dropcol_splitpt_idx_dml_interval_opt.sql:24: NOTICE:  CREATE TABLE will create partition "mpp21090_dropcol_splitpt_idx_dml_interval_1_prt_parttwo" for table "mpp21090_dropcol_splitpt_idx_dml_interval"
psql:/data/prabhd/test/tincrepo/main/dml/functional/output/mpp21090_dropcol_splitpt_idx_dml_interval_opt.sql:24: NOTICE:  CREATE TABLE will create partition "mpp21090_dropcol_splitpt_idx_dml_interval_1_prt_partthree" for table "mpp21090_dropcol_splitpt_idx_dml_interval"
CREATE TABLE
DROP INDEX IF EXISTS mpp21090_dropcol_splitpt_idx_dml_idx_interval;
psql:/data/prabhd/test/tincrepo/main/dml/functional/output/mpp21090_dropcol_splitpt_idx_dml_interval_opt.sql:26: NOTICE:  index "mpp21090_dropcol_splitpt_idx_dml_idx_interval" does not exist, skipping
DROP INDEX
CREATE INDEX mpp21090_dropcol_splitpt_idx_dml_idx_interval on mpp21090_dropcol_splitpt_idx_dml_interval(col2);
psql:/data/prabhd/test/tincrepo/main/dml/functional/output/mpp21090_dropcol_splitpt_idx_dml_interval_opt.sql:27: NOTICE:  building index for child partition "mpp21090_dropcol_splitpt_idx_dml_interval_1_prt_partone"
psql:/data/prabhd/test/tincrepo/main/dml/functional/output/mpp21090_dropcol_splitpt_idx_dml_interval_opt.sql:27: NOTICE:  building index for child partition "mpp21090_dropcol_splitpt_idx_dml_interval_1_prt_parttwo"
psql:/data/prabhd/test/tincrepo/main/dml/functional/output/mpp21090_dropcol_splitpt_idx_dml_interval_opt.sql:27: NOTICE:  building index for child partition "mpp21090_dropcol_splitpt_idx_dml_interval_1_prt_partthree"
CREATE INDEX
INSERT INTO mpp21090_dropcol_splitpt_idx_dml_interval VALUES('10 secs','10 secs','a','10 secs',0);
INSERT 0 1
SELECT * FROM mpp21090_dropcol_splitpt_idx_dml_interval ORDER BY 1,2,3,4;
   col1   |   col2   | col3 |   col4   | col5 
----------+----------+------+----------+------
 00:00:10 | 00:00:10 | a    | 00:00:10 |    0
(1 row)

ALTER TABLE mpp21090_dropcol_splitpt_idx_dml_interval DROP COLUMN col4;
ALTER TABLE
ALTER TABLE mpp21090_dropcol_splitpt_idx_dml_interval SPLIT PARTITION partone at ('30 secs') into (partition partsplitone,partition partsplitwo);
psql:/data/prabhd/test/tincrepo/main/dml/functional/output/mpp21090_dropcol_splitpt_idx_dml_interval_opt.sql:34: NOTICE:  exchanged partition "partone" of relation "mpp21090_dropcol_splitpt_idx_dml_interval" with relation "pg_temp_76392"
psql:/data/prabhd/test/tincrepo/main/dml/functional/output/mpp21090_dropcol_splitpt_idx_dml_interval_opt.sql:34: NOTICE:  dropped partition "partone" for relation "mpp21090_dropcol_splitpt_idx_dml_interval"
psql:/data/prabhd/test/tincrepo/main/dml/functional/output/mpp21090_dropcol_splitpt_idx_dml_interval_opt.sql:34: NOTICE:  CREATE TABLE will create partition "mpp21090_dropcol_splitpt_idx_dml_interval_1_prt_partsplitone" for table "mpp21090_dropcol_splitpt_idx_dml_interval"
psql:/data/prabhd/test/tincrepo/main/dml/functional/output/mpp21090_dropcol_splitpt_idx_dml_interval_opt.sql:34: NOTICE:  CREATE TABLE will create partition "mpp21090_dropcol_splitpt_idx_dml_interval_1_prt_partsplitwo" for table "mpp21090_dropcol_splitpt_idx_dml_interval"
ALTER TABLE
INSERT INTO mpp21090_dropcol_splitpt_idx_dml_interval SELECT '1 sec', '1 sec','b', 1;
INSERT 0 1
SELECT * FROM mpp21090_dropcol_splitpt_idx_dml_interval ORDER BY 1,2,3;
   col1   |   col2   | col3 | col5 
----------+----------+------+------
 00:00:01 | 00:00:01 | b    |    1
 00:00:10 | 00:00:10 | a    |    0
(2 rows)

-- Update distribution key
UPDATE mpp21090_dropcol_splitpt_idx_dml_interval SET col1 = '14 hours' WHERE col2 = '1 sec' AND col1 = '1 sec';
UPDATE 1
SELECT * FROM mpp21090_dropcol_splitpt_idx_dml_interval ORDER BY 1,2,3;
   col1   |   col2   | col3 | col5 
----------+----------+------+------
 00:00:10 | 00:00:10 | a    |    0
 14:00:00 | 00:00:01 | b    |    1
(2 rows)

-- Update partition key
UPDATE mpp21090_dropcol_splitpt_idx_dml_interval SET col2 ='10 secs'  WHERE col2 = '1 sec' AND col1 = '14 hours';
UPDATE 1
SELECT * FROM mpp21090_dropcol_splitpt_idx_dml_interval ORDER BY 1,2,3;
   col1   |   col2   | col3 | col5 
----------+----------+------+------
 00:00:10 | 00:00:10 | a    |    0
 14:00:00 | 00:00:10 | b    |    1
(2 rows)

DELETE FROM mpp21090_dropcol_splitpt_idx_dml_interval WHERE col3='b';
DELETE 1
SELECT * FROM mpp21090_dropcol_splitpt_idx_dml_interval ORDER BY 1,2,3;
   col1   |   col2   | col3 | col5 
----------+----------+------+------
 00:00:10 | 00:00:10 | a    |    0
(1 row)

