DROP TABLE IF EXISTS mpp21090_dropcol_addcol_splitpt_dml_numeric;
psql:/data/prabhd/test/tincrepo/main/dml/functional/output/mpp21090_dropcol_addcol_splitpt_dml_numeric_opt.sql:14: NOTICE:  table "mpp21090_dropcol_addcol_splitpt_dml_numeric" does not exist, skipping
DROP TABLE
CREATE TABLE mpp21090_dropcol_addcol_splitpt_dml_numeric
(
    col1 numeric,
    col2 numeric,
    col3 char,
    col4 numeric
) 
DISTRIBUTED by (col1)
PARTITION BY RANGE(col2)(partition partone start(1.000000) end(10.000000)  WITH (APPENDONLY=true, COMPRESSLEVEL=5, ORIENTATION=column),partition parttwo start(10.000000) end(20.000000) WITH (APPENDONLY=true, COMPRESSLEVEL=5, ORIENTATION=row),partition partthree start(20.000000) end(30.000000));
psql:/data/prabhd/test/tincrepo/main/dml/functional/output/mpp21090_dropcol_addcol_splitpt_dml_numeric_opt.sql:23: NOTICE:  CREATE TABLE will create partition "mpp21090_dropcol_addcol_splitpt_dml_numeric_1_prt_partone" for table "mpp21090_dropcol_addcol_splitpt_dml_numeric"
psql:/data/prabhd/test/tincrepo/main/dml/functional/output/mpp21090_dropcol_addcol_splitpt_dml_numeric_opt.sql:23: NOTICE:  CREATE TABLE will create partition "mpp21090_dropcol_addcol_splitpt_dml_numeric_1_prt_parttwo" for table "mpp21090_dropcol_addcol_splitpt_dml_numeric"
psql:/data/prabhd/test/tincrepo/main/dml/functional/output/mpp21090_dropcol_addcol_splitpt_dml_numeric_opt.sql:23: NOTICE:  CREATE TABLE will create partition "mpp21090_dropcol_addcol_splitpt_dml_numeric_1_prt_partthree" for table "mpp21090_dropcol_addcol_splitpt_dml_numeric"
CREATE TABLE
INSERT INTO mpp21090_dropcol_addcol_splitpt_dml_numeric VALUES(2.000000,2.000000,'a',2.000000);
INSERT 0 1
SELECT * FROM mpp21090_dropcol_addcol_splitpt_dml_numeric ORDER BY 1,2,3,4;
   col1   |   col2   | col3 |   col4   
----------+----------+------+----------
 2.000000 | 2.000000 | a    | 2.000000
(1 row)

ALTER TABLE mpp21090_dropcol_addcol_splitpt_dml_numeric ADD COLUMN col5 int DEFAULT 10;
ALTER TABLE
INSERT INTO mpp21090_dropcol_addcol_splitpt_dml_numeric VALUES(2.000000,2.000000,'b',2.000000,0);
INSERT 0 1
SELECT * FROM mpp21090_dropcol_addcol_splitpt_dml_numeric ORDER BY 1,2,3,4;
   col1   |   col2   | col3 |   col4   | col5 
----------+----------+------+----------+------
 2.000000 | 2.000000 | a    | 2.000000 |   10
 2.000000 | 2.000000 | b    | 2.000000 |    0
(2 rows)

ALTER TABLE mpp21090_dropcol_addcol_splitpt_dml_numeric DROP COLUMN col4;
ALTER TABLE
INSERT INTO mpp21090_dropcol_addcol_splitpt_dml_numeric VALUES(2.000000,2.000000,'c',1);
INSERT 0 1
SELECT * FROM mpp21090_dropcol_addcol_splitpt_dml_numeric ORDER BY 1,2,3,4;
   col1   |   col2   | col3 | col5 
----------+----------+------+------
 2.000000 | 2.000000 | a    |   10
 2.000000 | 2.000000 | b    |    0
 2.000000 | 2.000000 | c    |    1
(3 rows)

ALTER TABLE mpp21090_dropcol_addcol_splitpt_dml_numeric SPLIT PARTITION partone at (5.000000) into (partition partsplitone,partition partsplitwo);
psql:/data/prabhd/test/tincrepo/main/dml/functional/output/mpp21090_dropcol_addcol_splitpt_dml_numeric_opt.sql:38: NOTICE:  exchanged partition "partone" of relation "mpp21090_dropcol_addcol_splitpt_dml_numeric" with relation "pg_temp_55366"
psql:/data/prabhd/test/tincrepo/main/dml/functional/output/mpp21090_dropcol_addcol_splitpt_dml_numeric_opt.sql:38: NOTICE:  dropped partition "partone" for relation "mpp21090_dropcol_addcol_splitpt_dml_numeric"
psql:/data/prabhd/test/tincrepo/main/dml/functional/output/mpp21090_dropcol_addcol_splitpt_dml_numeric_opt.sql:38: NOTICE:  CREATE TABLE will create partition "mpp21090_dropcol_addcol_splitpt_dml_numeric_1_prt_partsplitone" for table "mpp21090_dropcol_addcol_splitpt_dml_numeric"
psql:/data/prabhd/test/tincrepo/main/dml/functional/output/mpp21090_dropcol_addcol_splitpt_dml_numeric_opt.sql:38: NOTICE:  CREATE TABLE will create partition "mpp21090_dropcol_addcol_splitpt_dml_numeric_1_prt_partsplitwo" for table "mpp21090_dropcol_addcol_splitpt_dml_numeric"
ALTER TABLE
INSERT INTO mpp21090_dropcol_addcol_splitpt_dml_numeric SELECT 1.000000, 1.000000,'d', 1;
INSERT 0 1
SELECT * FROM mpp21090_dropcol_addcol_splitpt_dml_numeric ORDER BY 1,2,3;
   col1   |   col2   | col3 | col5 
----------+----------+------+------
 1.000000 | 1.000000 | d    |    1
 2.000000 | 2.000000 | a    |   10
 2.000000 | 2.000000 | b    |    0
 2.000000 | 2.000000 | c    |    1
(4 rows)

-- Update distribution key
UPDATE mpp21090_dropcol_addcol_splitpt_dml_numeric SET col1 = 35.000000 WHERE col2 = 1.000000 AND col1 = 1.000000;
UPDATE 1
SELECT * FROM mpp21090_dropcol_addcol_splitpt_dml_numeric ORDER BY 1,2,3;
   col1    |   col2   | col3 | col5 
-----------+----------+------+------
  2.000000 | 2.000000 | a    |   10
  2.000000 | 2.000000 | b    |    0
  2.000000 | 2.000000 | c    |    1
 35.000000 | 1.000000 | d    |    1
(4 rows)

-- Update partition key
UPDATE mpp21090_dropcol_addcol_splitpt_dml_numeric SET col2 =2.000000  WHERE col2 = 1.000000 AND col1 = 35.000000;
UPDATE 1
SELECT * FROM mpp21090_dropcol_addcol_splitpt_dml_numeric ORDER BY 1,2,3;
   col1    |   col2   | col3 | col5 
-----------+----------+------+------
  2.000000 | 2.000000 | a    |   10
  2.000000 | 2.000000 | b    |    0
  2.000000 | 2.000000 | c    |    1
 35.000000 | 2.000000 | d    |    1
(4 rows)

DELETE FROM mpp21090_dropcol_addcol_splitpt_dml_numeric WHERE col3='b';
DELETE 1
SELECT * FROM mpp21090_dropcol_addcol_splitpt_dml_numeric ORDER BY 1,2,3;
   col1    |   col2   | col3 | col5 
-----------+----------+------+------
  2.000000 | 2.000000 | a    |   10
  2.000000 | 2.000000 | c    |    1
 35.000000 | 2.000000 | d    |    1
(3 rows)

