DROP TABLE IF EXISTS mpp21090_pttab_addcol_addpt_dropcol_timestamp;
psql:/data/prabhd/test/tincrepo/main/dml/functional/output/mpp21090_pttab_addcol_addpt_dropcol_timestamp_opt.sql:14: NOTICE:  table "mpp21090_pttab_addcol_addpt_dropcol_timestamp" does not exist, skipping
DROP TABLE
CREATE TABLE mpp21090_pttab_addcol_addpt_dropcol_timestamp
(
    col1 timestamp,
    col2 timestamp,
    col3 char,
    col4 int
) 
DISTRIBUTED by (col1)
PARTITION BY RANGE(col2)(partition partone start('2013-12-01 12:00:00') end('2013-12-31 12:00:00') WITH(APPENDONLY=true, COMPRESSLEVEL=5, ORIENTATION=column),partition parttwo start('2013-12-31 12:00:00') end('2014-01-01 12:00:00') inclusive WITH (APPENDONLY=true, COMPRESSLEVEL=5, ORIENTATION=row),partition partthree start('2014-01-02 12:00:00') end('2014-02-01 12:00:00'));
psql:/data/prabhd/test/tincrepo/main/dml/functional/output/mpp21090_pttab_addcol_addpt_dropcol_timestamp_opt.sql:23: NOTICE:  CREATE TABLE will create partition "mpp21090_pttab_addcol_addpt_dropcol_timestamp_1_prt_partone" for table "mpp21090_pttab_addcol_addpt_dropcol_timestamp"
psql:/data/prabhd/test/tincrepo/main/dml/functional/output/mpp21090_pttab_addcol_addpt_dropcol_timestamp_opt.sql:23: NOTICE:  CREATE TABLE will create partition "mpp21090_pttab_addcol_addpt_dropcol_timestamp_1_prt_parttwo" for table "mpp21090_pttab_addcol_addpt_dropcol_timestamp"
psql:/data/prabhd/test/tincrepo/main/dml/functional/output/mpp21090_pttab_addcol_addpt_dropcol_timestamp_opt.sql:23: NOTICE:  CREATE TABLE will create partition "mpp21090_pttab_addcol_addpt_dropcol_timestamp_1_prt_partthree" for table "mpp21090_pttab_addcol_addpt_dropcol_timestamp"
CREATE TABLE
INSERT INTO mpp21090_pttab_addcol_addpt_dropcol_timestamp VALUES('2013-12-31 12:00:00','2013-12-31 12:00:00','a',0);
INSERT 0 1
ALTER TABLE mpp21090_pttab_addcol_addpt_dropcol_timestamp ADD COLUMN col5 timestamp DEFAULT '2013-12-31 12:00:00';
ALTER TABLE
ALTER TABLE mpp21090_pttab_addcol_addpt_dropcol_timestamp ADD PARTITION partfour start('2014-02-01 12:00:00') end('2014-03-01 12:00:00') inclusive;
psql:/data/prabhd/test/tincrepo/main/dml/functional/output/mpp21090_pttab_addcol_addpt_dropcol_timestamp_opt.sql:28: NOTICE:  CREATE TABLE will create partition "mpp21090_pttab_addcol_addpt_dropcol_timestamp_1_prt_partfour" for table "mpp21090_pttab_addcol_addpt_dropcol_timestamp"
ALTER TABLE
INSERT INTO mpp21090_pttab_addcol_addpt_dropcol_timestamp SELECT '2014-02-10 12:00:00','2014-02-10 12:00:00','b',1, '2014-02-10 12:00:00';
INSERT 0 1
SELECT * FROM mpp21090_pttab_addcol_addpt_dropcol_timestamp ORDER BY 1,2,3;
        col1         |        col2         | col3 | col4 |        col5         
---------------------+---------------------+------+------+---------------------
 2013-12-31 12:00:00 | 2013-12-31 12:00:00 | a    |    0 | 2013-12-31 12:00:00
 2014-02-10 12:00:00 | 2014-02-10 12:00:00 | b    |    1 | 2014-02-10 12:00:00
(2 rows)

ALTER TABLE mpp21090_pttab_addcol_addpt_dropcol_timestamp DROP COLUMN col1;
psql:/data/prabhd/test/tincrepo/main/dml/functional/output/mpp21090_pttab_addcol_addpt_dropcol_timestamp_opt.sql:33: NOTICE:  Dropping a column that is part of the distribution policy forces a NULL distribution policy
psql:/data/prabhd/test/tincrepo/main/dml/functional/output/mpp21090_pttab_addcol_addpt_dropcol_timestamp_opt.sql:33: NOTICE:  Dropping a column that is part of the distribution policy forces a NULL distribution policy
psql:/data/prabhd/test/tincrepo/main/dml/functional/output/mpp21090_pttab_addcol_addpt_dropcol_timestamp_opt.sql:33: NOTICE:  Dropping a column that is part of the distribution policy forces a NULL distribution policy
psql:/data/prabhd/test/tincrepo/main/dml/functional/output/mpp21090_pttab_addcol_addpt_dropcol_timestamp_opt.sql:33: NOTICE:  Dropping a column that is part of the distribution policy forces a NULL distribution policy
psql:/data/prabhd/test/tincrepo/main/dml/functional/output/mpp21090_pttab_addcol_addpt_dropcol_timestamp_opt.sql:33: NOTICE:  Dropping a column that is part of the distribution policy forces a NULL distribution policy
ALTER TABLE
INSERT INTO mpp21090_pttab_addcol_addpt_dropcol_timestamp SELECT '2014-02-10 12:00:00','c',1, '2014-02-10 12:00:00';
INSERT 0 1
SELECT * FROM mpp21090_pttab_addcol_addpt_dropcol_timestamp ORDER BY 1,2,3;
        col2         | col3 | col4 |        col5         
---------------------+------+------+---------------------
 2013-12-31 12:00:00 | a    |    0 | 2013-12-31 12:00:00
 2014-02-10 12:00:00 | b    |    1 | 2014-02-10 12:00:00
 2014-02-10 12:00:00 | c    |    1 | 2014-02-10 12:00:00
(3 rows)

UPDATE mpp21090_pttab_addcol_addpt_dropcol_timestamp SET col5 = '2014-01-01 12:00:00' WHERE col2 = '2014-02-10 12:00:00' and col3='c';
UPDATE 1
SELECT * FROM mpp21090_pttab_addcol_addpt_dropcol_timestamp ORDER BY 1,2,3;
        col2         | col3 | col4 |        col5         
---------------------+------+------+---------------------
 2013-12-31 12:00:00 | a    |    0 | 2013-12-31 12:00:00
 2014-02-10 12:00:00 | b    |    1 | 2014-02-10 12:00:00
 2014-02-10 12:00:00 | c    |    1 | 2014-01-01 12:00:00
(3 rows)

-- Update partition key
UPDATE mpp21090_pttab_addcol_addpt_dropcol_timestamp SET col2 = '2014-01-01 12:00:00' WHERE col2 = '2014-02-10 12:00:00' and col3='c';
UPDATE 1
SELECT * FROM mpp21090_pttab_addcol_addpt_dropcol_timestamp ORDER BY 1,2,3;
        col2         | col3 | col4 |        col5         
---------------------+------+------+---------------------
 2013-12-31 12:00:00 | a    |    0 | 2013-12-31 12:00:00
 2014-01-01 12:00:00 | c    |    1 | 2014-01-01 12:00:00
 2014-02-10 12:00:00 | b    |    1 | 2014-02-10 12:00:00
(3 rows)

DELETE FROM mpp21090_pttab_addcol_addpt_dropcol_timestamp WHERE col2 = '2014-01-01 12:00:00';
DELETE 1
SELECT * FROM mpp21090_pttab_addcol_addpt_dropcol_timestamp ORDER BY 1,2,3;
        col2         | col3 | col4 |        col5         
---------------------+------+------+---------------------
 2013-12-31 12:00:00 | a    |    0 | 2013-12-31 12:00:00
 2014-02-10 12:00:00 | b    |    1 | 2014-02-10 12:00:00
(2 rows)

