DROP TABLE IF EXISTS mpp21090_pttab_dropfirstcol_addpt_char;
psql:/data/prabhd/test/tincrepo/main/dml/functional/output/mpp21090_pttab_dropfirstcol_addpt_char_opt.sql:14: NOTICE:  table "mpp21090_pttab_dropfirstcol_addpt_char" does not exist, skipping
DROP TABLE
CREATE TABLE mpp21090_pttab_dropfirstcol_addpt_char
(
    col1 char,
    col2 char,
    col3 char,
    col4 char,
    col5 int
) 
DISTRIBUTED by (col1)
PARTITION BY LIST(col2)(partition partone VALUES('a','b','c','d','e','f','g','h') WITH (APPENDONLY=true, COMPRESSLEVEL=5, ORIENTATION=column),partition parttwo VALUES('i','j','k','l','m','n','o','p') WITH (APPENDONLY=true, COMPRESSLEVEL=5, ORIENTATION=row),partition partthree VALUES('q','r','s','t','u','v','w','x'));
psql:/data/prabhd/test/tincrepo/main/dml/functional/output/mpp21090_pttab_dropfirstcol_addpt_char_opt.sql:24: NOTICE:  CREATE TABLE will create partition "mpp21090_pttab_dropfirstcol_addpt_char_1_prt_partone" for table "mpp21090_pttab_dropfirstcol_addpt_char"
psql:/data/prabhd/test/tincrepo/main/dml/functional/output/mpp21090_pttab_dropfirstcol_addpt_char_opt.sql:24: NOTICE:  CREATE TABLE will create partition "mpp21090_pttab_dropfirstcol_addpt_char_1_prt_parttwo" for table "mpp21090_pttab_dropfirstcol_addpt_char"
psql:/data/prabhd/test/tincrepo/main/dml/functional/output/mpp21090_pttab_dropfirstcol_addpt_char_opt.sql:24: NOTICE:  CREATE TABLE will create partition "mpp21090_pttab_dropfirstcol_addpt_char_1_prt_partthree" for table "mpp21090_pttab_dropfirstcol_addpt_char"
CREATE TABLE
INSERT INTO mpp21090_pttab_dropfirstcol_addpt_char VALUES('x','x','a','x',0);
INSERT 0 1
ALTER TABLE mpp21090_pttab_dropfirstcol_addpt_char DROP COLUMN col1;
psql:/data/prabhd/test/tincrepo/main/dml/functional/output/mpp21090_pttab_dropfirstcol_addpt_char_opt.sql:28: NOTICE:  Dropping a column that is part of the distribution policy forces a NULL distribution policy
psql:/data/prabhd/test/tincrepo/main/dml/functional/output/mpp21090_pttab_dropfirstcol_addpt_char_opt.sql:28: NOTICE:  Dropping a column that is part of the distribution policy forces a NULL distribution policy
psql:/data/prabhd/test/tincrepo/main/dml/functional/output/mpp21090_pttab_dropfirstcol_addpt_char_opt.sql:28: NOTICE:  Dropping a column that is part of the distribution policy forces a NULL distribution policy
psql:/data/prabhd/test/tincrepo/main/dml/functional/output/mpp21090_pttab_dropfirstcol_addpt_char_opt.sql:28: NOTICE:  Dropping a column that is part of the distribution policy forces a NULL distribution policy
ALTER TABLE
ALTER TABLE mpp21090_pttab_dropfirstcol_addpt_char ADD PARTITION partfour VALUES('y','z','-');
psql:/data/prabhd/test/tincrepo/main/dml/functional/output/mpp21090_pttab_dropfirstcol_addpt_char_opt.sql:29: NOTICE:  CREATE TABLE will create partition "mpp21090_pttab_dropfirstcol_addpt_char_1_prt_partfour" for table "mpp21090_pttab_dropfirstcol_addpt_char"
ALTER TABLE
INSERT INTO mpp21090_pttab_dropfirstcol_addpt_char SELECT 'z','b','z', 1;
INSERT 0 1
SELECT * FROM mpp21090_pttab_dropfirstcol_addpt_char ORDER BY 1,2,3;
 col2 | col3 | col4 | col5 
------+------+------+------
 x    | a    | x    |    0
 z    | b    | z    |    1
(2 rows)

UPDATE mpp21090_pttab_dropfirstcol_addpt_char SET col4 = '-' WHERE col2 = 'z' AND col4 = 'z';
UPDATE 1
SELECT * FROM mpp21090_pttab_dropfirstcol_addpt_char ORDER BY 1,2,3;
 col2 | col3 | col4 | col5 
------+------+------+------
 x    | a    | x    |    0
 z    | b    | -    |    1
(2 rows)

-- Update partition key
UPDATE mpp21090_pttab_dropfirstcol_addpt_char SET col2 = '-' WHERE col2 = 'z' AND col4 = '-';
UPDATE 1
SELECT * FROM mpp21090_pttab_dropfirstcol_addpt_char ORDER BY 1,2,3;
 col2 | col3 | col4 | col5 
------+------+------+------
 -    | b    | -    |    1
 x    | a    | x    |    0
(2 rows)

DELETE FROM mpp21090_pttab_dropfirstcol_addpt_char WHERE col2 = '-';
DELETE 1
SELECT * FROM mpp21090_pttab_dropfirstcol_addpt_char ORDER BY 1,2,3;
 col2 | col3 | col4 | col5 
------+------+------+------
 x    | a    | x    |    0
(1 row)

