DROP TABLE IF EXISTS mpp21090_dropcol_addcol_splitpt_dml_float;
psql:/data/prabhd/test/tincrepo/main/dml/functional/output/mpp21090_dropcol_addcol_splitpt_dml_float_opt.sql:14: NOTICE:  table "mpp21090_dropcol_addcol_splitpt_dml_float" does not exist, skipping
DROP TABLE
CREATE TABLE mpp21090_dropcol_addcol_splitpt_dml_float
(
    col1 float,
    col2 float,
    col3 char,
    col4 float
) 
DISTRIBUTED by (col1)
PARTITION BY RANGE(col2)(partition partone start(1.00) end(10.00)  WITH (APPENDONLY=true, COMPRESSLEVEL=5, ORIENTATION=column),partition parttwo start(10.00) end(20.00) WITH (APPENDONLY=true, COMPRESSLEVEL=5, ORIENTATION=row),partition partthree start(20.00) end(30.00));
psql:/data/prabhd/test/tincrepo/main/dml/functional/output/mpp21090_dropcol_addcol_splitpt_dml_float_opt.sql:23: NOTICE:  CREATE TABLE will create partition "mpp21090_dropcol_addcol_splitpt_dml_float_1_prt_partone" for table "mpp21090_dropcol_addcol_splitpt_dml_float"
psql:/data/prabhd/test/tincrepo/main/dml/functional/output/mpp21090_dropcol_addcol_splitpt_dml_float_opt.sql:23: NOTICE:  CREATE TABLE will create partition "mpp21090_dropcol_addcol_splitpt_dml_float_1_prt_parttwo" for table "mpp21090_dropcol_addcol_splitpt_dml_float"
psql:/data/prabhd/test/tincrepo/main/dml/functional/output/mpp21090_dropcol_addcol_splitpt_dml_float_opt.sql:23: NOTICE:  CREATE TABLE will create partition "mpp21090_dropcol_addcol_splitpt_dml_float_1_prt_partthree" for table "mpp21090_dropcol_addcol_splitpt_dml_float"
CREATE TABLE
INSERT INTO mpp21090_dropcol_addcol_splitpt_dml_float VALUES(2.00,2.00,'a',2.00);
INSERT 0 1
SELECT * FROM mpp21090_dropcol_addcol_splitpt_dml_float ORDER BY 1,2,3,4;
 col1 | col2 | col3 | col4 
------+------+------+------
    2 |    2 | a    |    2
(1 row)

ALTER TABLE mpp21090_dropcol_addcol_splitpt_dml_float ADD COLUMN col5 int DEFAULT 10;
ALTER TABLE
INSERT INTO mpp21090_dropcol_addcol_splitpt_dml_float VALUES(2.00,2.00,'b',2.00,0);
INSERT 0 1
SELECT * FROM mpp21090_dropcol_addcol_splitpt_dml_float ORDER BY 1,2,3,4;
 col1 | col2 | col3 | col4 | col5 
------+------+------+------+------
    2 |    2 | a    |    2 |   10
    2 |    2 | b    |    2 |    0
(2 rows)

ALTER TABLE mpp21090_dropcol_addcol_splitpt_dml_float DROP COLUMN col4;
ALTER TABLE
INSERT INTO mpp21090_dropcol_addcol_splitpt_dml_float VALUES(2.00,2.00,'c',1);
INSERT 0 1
SELECT * FROM mpp21090_dropcol_addcol_splitpt_dml_float ORDER BY 1,2,3,4;
 col1 | col2 | col3 | col5 
------+------+------+------
    2 |    2 | a    |   10
    2 |    2 | b    |    0
    2 |    2 | c    |    1
(3 rows)

ALTER TABLE mpp21090_dropcol_addcol_splitpt_dml_float SPLIT PARTITION partone at (5.00) into (partition partsplitone,partition partsplitwo);
psql:/data/prabhd/test/tincrepo/main/dml/functional/output/mpp21090_dropcol_addcol_splitpt_dml_float_opt.sql:38: NOTICE:  exchanged partition "partone" of relation "mpp21090_dropcol_addcol_splitpt_dml_float" with relation "pg_temp_52366"
psql:/data/prabhd/test/tincrepo/main/dml/functional/output/mpp21090_dropcol_addcol_splitpt_dml_float_opt.sql:38: NOTICE:  dropped partition "partone" for relation "mpp21090_dropcol_addcol_splitpt_dml_float"
psql:/data/prabhd/test/tincrepo/main/dml/functional/output/mpp21090_dropcol_addcol_splitpt_dml_float_opt.sql:38: NOTICE:  CREATE TABLE will create partition "mpp21090_dropcol_addcol_splitpt_dml_float_1_prt_partsplitone" for table "mpp21090_dropcol_addcol_splitpt_dml_float"
psql:/data/prabhd/test/tincrepo/main/dml/functional/output/mpp21090_dropcol_addcol_splitpt_dml_float_opt.sql:38: NOTICE:  CREATE TABLE will create partition "mpp21090_dropcol_addcol_splitpt_dml_float_1_prt_partsplitwo" for table "mpp21090_dropcol_addcol_splitpt_dml_float"
ALTER TABLE
INSERT INTO mpp21090_dropcol_addcol_splitpt_dml_float SELECT 1.00, 1.00,'d', 1;
INSERT 0 1
SELECT * FROM mpp21090_dropcol_addcol_splitpt_dml_float ORDER BY 1,2,3;
 col1 | col2 | col3 | col5 
------+------+------+------
    1 |    1 | d    |    1
    2 |    2 | a    |   10
    2 |    2 | b    |    0
    2 |    2 | c    |    1
(4 rows)

-- Update distribution key
UPDATE mpp21090_dropcol_addcol_splitpt_dml_float SET col1 = 35.00 WHERE col2 = 1.00 AND col1 = 1.00;
UPDATE 1
SELECT * FROM mpp21090_dropcol_addcol_splitpt_dml_float ORDER BY 1,2,3;
 col1 | col2 | col3 | col5 
------+------+------+------
    2 |    2 | a    |   10
    2 |    2 | b    |    0
    2 |    2 | c    |    1
   35 |    1 | d    |    1
(4 rows)

-- Update partition key
UPDATE mpp21090_dropcol_addcol_splitpt_dml_float SET col2 =2.00  WHERE col2 = 1.00 AND col1 = 35.00;
UPDATE 1
SELECT * FROM mpp21090_dropcol_addcol_splitpt_dml_float ORDER BY 1,2,3;
 col1 | col2 | col3 | col5 
------+------+------+------
    2 |    2 | a    |   10
    2 |    2 | b    |    0
    2 |    2 | c    |    1
   35 |    2 | d    |    1
(4 rows)

DELETE FROM mpp21090_dropcol_addcol_splitpt_dml_float WHERE col3='b';
DELETE 1
SELECT * FROM mpp21090_dropcol_addcol_splitpt_dml_float ORDER BY 1,2,3;
 col1 | col2 | col3 | col5 
------+------+------+------
    2 |    2 | a    |   10
    2 |    2 | c    |    1
   35 |    2 | d    |    1
(3 rows)

