DROP TABLE IF EXISTS mpp21090_reordered_col_dml_int8;
psql:/data/prabhd/test/tincrepo/main/dml/functional/output/mpp21090_reordered_col_dml_int8_opt.sql:14: NOTICE:  table "mpp21090_reordered_col_dml_int8" does not exist, skipping
DROP TABLE
CREATE TABLE mpp21090_reordered_col_dml_int8
(
    col1 int8 DEFAULT 1000000000000000000,
    col2 int8,
    col3 char,
    col4 int8,
    col5 int
) 
DISTRIBUTED by (col1)
PARTITION BY RANGE(col2)(partition partone start(1) end(1000000000000000001)  WITH (APPENDONLY=true, COMPRESSLEVEL=5, ORIENTATION=column),partition parttwo start(1000000000000000001) end(2000000000000000001) WITH (APPENDONLY=true, COMPRESSLEVEL=5, ORIENTATION=row),partition partthree start(2000000000000000001) end(3000000000000000001));
psql:/data/prabhd/test/tincrepo/main/dml/functional/output/mpp21090_reordered_col_dml_int8_opt.sql:24: NOTICE:  CREATE TABLE will create partition "mpp21090_reordered_col_dml_int8_1_prt_partone" for table "mpp21090_reordered_col_dml_int8"
psql:/data/prabhd/test/tincrepo/main/dml/functional/output/mpp21090_reordered_col_dml_int8_opt.sql:24: NOTICE:  CREATE TABLE will create partition "mpp21090_reordered_col_dml_int8_1_prt_parttwo" for table "mpp21090_reordered_col_dml_int8"
psql:/data/prabhd/test/tincrepo/main/dml/functional/output/mpp21090_reordered_col_dml_int8_opt.sql:24: NOTICE:  CREATE TABLE will create partition "mpp21090_reordered_col_dml_int8_1_prt_partthree" for table "mpp21090_reordered_col_dml_int8"
CREATE TABLE
INSERT INTO mpp21090_reordered_col_dml_int8(col2,col1,col3,col5,col4) SELECT 200000000000000000, 200000000000000000,'a', 1,200000000000000000;
INSERT 0 1
INSERT INTO mpp21090_reordered_col_dml_int8(col2,col3,col5,col4) SELECT 200000000000000000,'b', 2, 200000000000000000; 
INSERT 0 1
SELECT * FROM mpp21090_reordered_col_dml_int8 ORDER BY 1,2,3,4;
        col1         |        col2        | col3 |        col4        | col5 
---------------------+--------------------+------+--------------------+------
  200000000000000000 | 200000000000000000 | a    | 200000000000000000 |    1
 1000000000000000000 | 200000000000000000 | b    | 200000000000000000 |    2
(2 rows)

ALTER TABLE mpp21090_reordered_col_dml_int8 DROP COLUMN col4;
ALTER TABLE
ALTER TABLE mpp21090_reordered_col_dml_int8 ADD COLUMN col4 int DEFAULT 10;
ALTER TABLE
INSERT INTO mpp21090_reordered_col_dml_int8(col2,col3,col5,col4) SELECT 200000000000000000,'c', 2, 10; 
INSERT 0 1
SELECT * FROM mpp21090_reordered_col_dml_int8 ORDER BY 1,2,3,4;
        col1         |        col2        | col3 | col5 | col4 
---------------------+--------------------+------+------+------
  200000000000000000 | 200000000000000000 | a    |    1 |   10
 1000000000000000000 | 200000000000000000 | b    |    2 |   10
 1000000000000000000 | 200000000000000000 | c    |    2 |   10
(3 rows)

UPDATE mpp21090_reordered_col_dml_int8 SET col4 = 20;
UPDATE 3
SELECT * FROM mpp21090_reordered_col_dml_int8 ORDER BY 1,2,3,4;
        col1         |        col2        | col3 | col5 | col4 
---------------------+--------------------+------+------+------
  200000000000000000 | 200000000000000000 | a    |    1 |   20
 1000000000000000000 | 200000000000000000 | b    |    2 |   20
 1000000000000000000 | 200000000000000000 | c    |    2 |   20
(3 rows)

DELETE FROM mpp21090_reordered_col_dml_int8 WHERE col4=20;
DELETE 3
SELECT * FROM mpp21090_reordered_col_dml_int8 ORDER BY 1,2,3,4;
 col1 | col2 | col3 | col5 | col4 
------+------+------+------+------
(0 rows)

