DROP TABLE IF EXISTS mpp21090_drop_lastcol_index_dml_interval;
DROP TABLE
CREATE TABLE mpp21090_drop_lastcol_index_dml_interval(
col1 int,
col2 decimal,
col3 char,
col4 date,
col5 interval
) with (appendonly= true, orientation= column)  DISTRIBUTED by(col3);
CREATE TABLE
DROP INDEX IF EXISTS mpp21090_drop_lastcol_index_dml_idx_interval;
psql:/data/prabhd/test/tincrepo/main/dml/functional/output/mpp21090_drop_lastcol_index_dml_interval_co_opt.sql:23: NOTICE:  index "mpp21090_drop_lastcol_index_dml_idx_interval" does not exist, skipping
DROP INDEX
CREATE INDEX mpp21090_drop_lastcol_index_dml_idx_interval on mpp21090_drop_lastcol_index_dml_interval(col3);
CREATE INDEX
INSERT INTO mpp21090_drop_lastcol_index_dml_interval VALUES(0,0.00,'a','2014-01-01','10 secs');
INSERT 0 1
SELECT * FROM mpp21090_drop_lastcol_index_dml_interval ORDER BY 1,2,3,4;
 col1 | col2 | col3 |    col4    |   col5   
------+------+------+------------+----------
    0 | 0.00 | a    | 2014-01-01 | 00:00:10
(1 row)

ALTER TABLE mpp21090_drop_lastcol_index_dml_interval DROP COLUMN col5;
ALTER TABLE
INSERT INTO mpp21090_drop_lastcol_index_dml_interval SELECT 1,1.00,'b','2014-01-02';
INSERT 0 1
SELECT * FROM mpp21090_drop_lastcol_index_dml_interval ORDER BY 1,2,3,4;
 col1 | col2 | col3 |    col4    
------+------+------+------------
    0 | 0.00 | a    | 2014-01-01
    1 | 1.00 | b    | 2014-01-02
(2 rows)

UPDATE mpp21090_drop_lastcol_index_dml_interval SET col3='c' WHERE col3 = 'b' AND col1 = 1;
UPDATE 1
SELECT * FROM mpp21090_drop_lastcol_index_dml_interval ORDER BY 1,2,3,4;
 col1 | col2 | col3 |    col4    
------+------+------+------------
    0 | 0.00 | a    | 2014-01-01
    1 | 1.00 | c    | 2014-01-02
(2 rows)

DELETE FROM mpp21090_drop_lastcol_index_dml_interval WHERE col3='c';
DELETE 1
SELECT * FROM mpp21090_drop_lastcol_index_dml_interval ORDER BY 1,2,3,4;
 col1 | col2 | col3 |    col4    
------+------+------+------------
    0 | 0.00 | a    | 2014-01-01
(1 row)

