DROP TABLE IF EXISTS mpp21090_pttab_addpt_dropcol_dml_int8;
psql:/data/prabhd/test/tincrepo/main/dml/functional/output/mpp21090_pttab_addpt_dropcol_dml_int8_opt.sql:14: NOTICE:  table "mpp21090_pttab_addpt_dropcol_dml_int8" does not exist, skipping
DROP TABLE
CREATE TABLE mpp21090_pttab_addpt_dropcol_dml_int8
(
    col1 int8,
    col2 int8,
    col3 char,
    col4 int
) 
DISTRIBUTED by (col1)
PARTITION BY RANGE(col2)(partition partone start(1) end(1000000000000000001)  WITH (APPENDONLY=true, COMPRESSLEVEL=5, ORIENTATION=column),partition parttwo start(1000000000000000001) end(2000000000000000001) WITH (APPENDONLY=true, COMPRESSLEVEL=5, ORIENTATION=row),partition partthree start(2000000000000000001) end(3000000000000000001));
psql:/data/prabhd/test/tincrepo/main/dml/functional/output/mpp21090_pttab_addpt_dropcol_dml_int8_opt.sql:23: NOTICE:  CREATE TABLE will create partition "mpp21090_pttab_addpt_dropcol_dml_int8_1_prt_partone" for table "mpp21090_pttab_addpt_dropcol_dml_int8"
psql:/data/prabhd/test/tincrepo/main/dml/functional/output/mpp21090_pttab_addpt_dropcol_dml_int8_opt.sql:23: NOTICE:  CREATE TABLE will create partition "mpp21090_pttab_addpt_dropcol_dml_int8_1_prt_parttwo" for table "mpp21090_pttab_addpt_dropcol_dml_int8"
psql:/data/prabhd/test/tincrepo/main/dml/functional/output/mpp21090_pttab_addpt_dropcol_dml_int8_opt.sql:23: NOTICE:  CREATE TABLE will create partition "mpp21090_pttab_addpt_dropcol_dml_int8_1_prt_partthree" for table "mpp21090_pttab_addpt_dropcol_dml_int8"
CREATE TABLE
INSERT INTO mpp21090_pttab_addpt_dropcol_dml_int8 VALUES(2000000000000000000,2000000000000000000,'a',0);
INSERT 0 1
ALTER TABLE mpp21090_pttab_addpt_dropcol_dml_int8 ADD PARTITION partfour start(3000000000000000001) end(4000000000000000001);
psql:/data/prabhd/test/tincrepo/main/dml/functional/output/mpp21090_pttab_addpt_dropcol_dml_int8_opt.sql:27: NOTICE:  CREATE TABLE will create partition "mpp21090_pttab_addpt_dropcol_dml_int8_1_prt_partfour" for table "mpp21090_pttab_addpt_dropcol_dml_int8"
ALTER TABLE
INSERT INTO mpp21090_pttab_addpt_dropcol_dml_int8 SELECT 3500000000000000000,3500000000000000000,'b',1;
INSERT 0 1
SELECT * FROM mpp21090_pttab_addpt_dropcol_dml_int8 ORDER BY 1,2,3;
        col1         |        col2         | col3 | col4 
---------------------+---------------------+------+------
 2000000000000000000 | 2000000000000000000 | a    |    0
 3500000000000000000 | 3500000000000000000 | b    |    1
(2 rows)

ALTER TABLE mpp21090_pttab_addpt_dropcol_dml_int8 DROP COLUMN col1;
psql:/data/prabhd/test/tincrepo/main/dml/functional/output/mpp21090_pttab_addpt_dropcol_dml_int8_opt.sql:32: NOTICE:  Dropping a column that is part of the distribution policy forces a NULL distribution policy
psql:/data/prabhd/test/tincrepo/main/dml/functional/output/mpp21090_pttab_addpt_dropcol_dml_int8_opt.sql:32: NOTICE:  Dropping a column that is part of the distribution policy forces a NULL distribution policy
psql:/data/prabhd/test/tincrepo/main/dml/functional/output/mpp21090_pttab_addpt_dropcol_dml_int8_opt.sql:32: NOTICE:  Dropping a column that is part of the distribution policy forces a NULL distribution policy
psql:/data/prabhd/test/tincrepo/main/dml/functional/output/mpp21090_pttab_addpt_dropcol_dml_int8_opt.sql:32: NOTICE:  Dropping a column that is part of the distribution policy forces a NULL distribution policy
psql:/data/prabhd/test/tincrepo/main/dml/functional/output/mpp21090_pttab_addpt_dropcol_dml_int8_opt.sql:32: NOTICE:  Dropping a column that is part of the distribution policy forces a NULL distribution policy
ALTER TABLE
INSERT INTO mpp21090_pttab_addpt_dropcol_dml_int8 SELECT 3500000000000000000,'b',1;
INSERT 0 1
SELECT * FROM mpp21090_pttab_addpt_dropcol_dml_int8 ORDER BY 1,2,3;
        col2         | col3 | col4 
---------------------+------+------
 2000000000000000000 | a    |    0
 3500000000000000000 | b    |    1
 3500000000000000000 | b    |    1
(3 rows)

UPDATE mpp21090_pttab_addpt_dropcol_dml_int8 SET col4 = 10 WHERE col2 = 3500000000000000000;
UPDATE 2
SELECT * FROM mpp21090_pttab_addpt_dropcol_dml_int8 ORDER BY 1,2,3;
        col2         | col3 | col4 
---------------------+------+------
 2000000000000000000 | a    |    0
 3500000000000000000 | b    |   10
 3500000000000000000 | b    |   10
(3 rows)

-- Update partition key
UPDATE mpp21090_pttab_addpt_dropcol_dml_int8 SET col2 = 1000000000000000000 WHERE col2 = 3500000000000000000;
UPDATE 2
SELECT * FROM mpp21090_pttab_addpt_dropcol_dml_int8 ORDER BY 1,2,3;
        col2         | col3 | col4 
---------------------+------+------
 1000000000000000000 | b    |   10
 1000000000000000000 | b    |   10
 2000000000000000000 | a    |    0
(3 rows)

DELETE FROM mpp21090_pttab_addpt_dropcol_dml_int8 WHERE col2 = 1000000000000000000;
DELETE 2
SELECT * FROM mpp21090_pttab_addpt_dropcol_dml_int8 ORDER BY 1,2,3;
        col2         | col3 | col4 
---------------------+------+------
 2000000000000000000 | a    |    0
(1 row)

