DROP TABLE IF EXISTS mpp21090_changedistpolicy_dml_pttab_char;
psql:/data/prabhd/test/tincrepo/main/dml/functional/output/mpp21090_changedistpolicy_dml_pttab_char_opt.sql:14: NOTICE:  table "mpp21090_changedistpolicy_dml_pttab_char" does not exist, skipping
DROP TABLE
CREATE TABLE mpp21090_changedistpolicy_dml_pttab_char
(
    col1 char,
    col2 char,
    col3 char,
    col4 char,
    col5 int
) DISTRIBUTED BY (col1) PARTITION BY LIST(col2)(partition partone VALUES('a','b','c','d','e','f','g','h') WITH (APPENDONLY=true, COMPRESSLEVEL=5, ORIENTATION=column),partition parttwo VALUES('i','j','k','l','m','n','o','p') WITH (APPENDONLY=true, COMPRESSLEVEL=5, ORIENTATION=row),partition partthree VALUES('q','r','s','t','u','v','w','x'));
psql:/data/prabhd/test/tincrepo/main/dml/functional/output/mpp21090_changedistpolicy_dml_pttab_char_opt.sql:22: NOTICE:  Table doesn't have 'DISTRIBUTED BY' clause -- Using column named 'col1' as the Greenplum Database data distribution key for this table.
HINT:  The 'DISTRIBUTED BY' clause determines the distribution of data. Make sure column(s) chosen are the optimal data distribution key to minimize skew.
psql:/data/prabhd/test/tincrepo/main/dml/functional/output/mpp21090_changedistpolicy_dml_pttab_char_opt.sql:22: NOTICE:  CREATE TABLE will create partition "mpp21090_changedistpolicy_dml_pttab_char_1_prt_partone" for table "mpp21090_changedistpolicy_dml_pttab_char"
psql:/data/prabhd/test/tincrepo/main/dml/functional/output/mpp21090_changedistpolicy_dml_pttab_char_opt.sql:22: NOTICE:  CREATE TABLE will create partition "mpp21090_changedistpolicy_dml_pttab_char_1_prt_parttwo" for table "mpp21090_changedistpolicy_dml_pttab_char"
psql:/data/prabhd/test/tincrepo/main/dml/functional/output/mpp21090_changedistpolicy_dml_pttab_char_opt.sql:22: NOTICE:  CREATE TABLE will create partition "mpp21090_changedistpolicy_dml_pttab_char_1_prt_partthree" for table "mpp21090_changedistpolicy_dml_pttab_char"
CREATE TABLE
INSERT INTO mpp21090_changedistpolicy_dml_pttab_char VALUES('g','g','a','g',0);
INSERT 0 1
SELECT * FROM mpp21090_changedistpolicy_dml_pttab_char ORDER BY 1,2,3,4;
 col1 | col2 | col3 | col4 | col5 
------+------+------+------+------
 g    | g    | a    | g    |    0
(1 row)

ALTER TABLE mpp21090_changedistpolicy_dml_pttab_char DROP COLUMN col4;
ALTER TABLE
INSERT INTO mpp21090_changedistpolicy_dml_pttab_char VALUES('g','g','b',1);
INSERT 0 1
SELECT * FROM mpp21090_changedistpolicy_dml_pttab_char ORDER BY 1,2,3,4;
 col1 | col2 | col3 | col5 
------+------+------+------
 g    | g    | a    |    0
 g    | g    | b    |    1
(2 rows)

ALTER TABLE mpp21090_changedistpolicy_dml_pttab_char SET DISTRIBUTED BY (col3);
ALTER TABLE
INSERT INTO mpp21090_changedistpolicy_dml_pttab_char SELECT 'a', 'a','c', 2;
INSERT 0 1
SELECT * FROM mpp21090_changedistpolicy_dml_pttab_char ORDER BY 1,2,3;
 col1 | col2 | col3 | col5 
------+------+------+------
 a    | a    | c    |    2
 g    | g    | a    |    0
 g    | g    | b    |    1
(3 rows)

UPDATE mpp21090_changedistpolicy_dml_pttab_char SET col3 ='c' WHERE col3 ='b';
UPDATE 1
SELECT * FROM mpp21090_changedistpolicy_dml_pttab_char ORDER BY 1,2,3;
 col1 | col2 | col3 | col5 
------+------+------+------
 a    | a    | c    |    2
 g    | g    | a    |    0
 g    | g    | c    |    1
(3 rows)

DELETE FROM mpp21090_changedistpolicy_dml_pttab_char WHERE col3 ='c';
DELETE 2
SELECT * FROM mpp21090_changedistpolicy_dml_pttab_char ORDER BY 1,2,3;
 col1 | col2 | col3 | col5 
------+------+------+------
 g    | g    | a    |    0
(1 row)

