DROP TABLE IF EXISTS mpp21090_pttab_dropcol_addcol_addpt_idx_dml_numeric;
psql:/data/prabhd/test/tincrepo/main/dml/functional/output/mpp21090_pttab_dropcol_addcol_addpt_idx_dml_numeric_opt.sql:14: NOTICE:  table "mpp21090_pttab_dropcol_addcol_addpt_idx_dml_numeric" does not exist, skipping
DROP TABLE
CREATE TABLE mpp21090_pttab_dropcol_addcol_addpt_idx_dml_numeric
(
    col1 numeric,
    col2 numeric,
    col3 char,
    col4 int
) 
DISTRIBUTED by (col1)
PARTITION BY RANGE(col2)(partition partone start(1.000000) end(10.000000)  WITH (APPENDONLY=true, COMPRESSLEVEL=5, ORIENTATION=column),partition parttwo start(10.000000) end(20.000000) WITH (APPENDONLY=true, COMPRESSLEVEL=5, ORIENTATION=row),partition partthree start(20.000000) end(30.000000));
psql:/data/prabhd/test/tincrepo/main/dml/functional/output/mpp21090_pttab_dropcol_addcol_addpt_idx_dml_numeric_opt.sql:23: NOTICE:  CREATE TABLE will create partition "mpp21090_pttab_dropcol_addcol_addpt_idx_dml_numer_1_prt_partone" for table "mpp21090_pttab_dropcol_addcol_addpt_idx_dml_numeric"
psql:/data/prabhd/test/tincrepo/main/dml/functional/output/mpp21090_pttab_dropcol_addcol_addpt_idx_dml_numeric_opt.sql:23: NOTICE:  CREATE TABLE will create partition "mpp21090_pttab_dropcol_addcol_addpt_idx_dml_numer_1_prt_parttwo" for table "mpp21090_pttab_dropcol_addcol_addpt_idx_dml_numeric"
psql:/data/prabhd/test/tincrepo/main/dml/functional/output/mpp21090_pttab_dropcol_addcol_addpt_idx_dml_numeric_opt.sql:23: NOTICE:  CREATE TABLE will create partition "mpp21090_pttab_dropcol_addcol_addpt_idx_dml_num_1_prt_partthree" for table "mpp21090_pttab_dropcol_addcol_addpt_idx_dml_numeric"
CREATE TABLE
INSERT INTO mpp21090_pttab_dropcol_addcol_addpt_idx_dml_numeric VALUES(2.000000,2.000000,'a',0);
INSERT 0 1
ALTER TABLE mpp21090_pttab_dropcol_addcol_addpt_idx_dml_numeric DROP COLUMN col4;
ALTER TABLE
INSERT INTO mpp21090_pttab_dropcol_addcol_addpt_idx_dml_numeric VALUES(2.000000,2.000000,'b');
INSERT 0 1
ALTER TABLE mpp21090_pttab_dropcol_addcol_addpt_idx_dml_numeric ADD COLUMN col5 numeric DEFAULT 2.000000;
ALTER TABLE
DROP INDEX IF EXISTS mpp21090_pttab_dropcol_addcol_addpt_idx_dml_idx_numeric;
psql:/data/prabhd/test/tincrepo/main/dml/functional/output/mpp21090_pttab_dropcol_addcol_addpt_idx_dml_numeric_opt.sql:32: NOTICE:  index "mpp21090_pttab_dropcol_addcol_addpt_idx_dml_idx_numeric" does not exist, skipping
DROP INDEX
CREATE INDEX mpp21090_pttab_dropcol_addcol_addpt_idx_dml_idx_numeric on mpp21090_pttab_dropcol_addcol_addpt_idx_dml_numeric(col5);
psql:/data/prabhd/test/tincrepo/main/dml/functional/output/mpp21090_pttab_dropcol_addcol_addpt_idx_dml_numeric_opt.sql:33: NOTICE:  building index for child partition "mpp21090_pttab_dropcol_addcol_addpt_idx_dml_numer_1_prt_partone"
psql:/data/prabhd/test/tincrepo/main/dml/functional/output/mpp21090_pttab_dropcol_addcol_addpt_idx_dml_numeric_opt.sql:33: NOTICE:  building index for child partition "mpp21090_pttab_dropcol_addcol_addpt_idx_dml_numer_1_prt_parttwo"
psql:/data/prabhd/test/tincrepo/main/dml/functional/output/mpp21090_pttab_dropcol_addcol_addpt_idx_dml_numeric_opt.sql:33: NOTICE:  building index for child partition "mpp21090_pttab_dropcol_addcol_addpt_idx_dml_num_1_prt_partthree"
CREATE INDEX
INSERT INTO mpp21090_pttab_dropcol_addcol_addpt_idx_dml_numeric SELECT 2.000000,2.000000,'c',2.000000;
INSERT 0 1
SELECT * FROM mpp21090_pttab_dropcol_addcol_addpt_idx_dml_numeric ORDER BY 1,2,3;
   col1   |   col2   | col3 |   col5   
----------+----------+------+----------
 2.000000 | 2.000000 | a    | 2.000000
 2.000000 | 2.000000 | b    | 2.000000
 2.000000 | 2.000000 | c    | 2.000000
(3 rows)

UPDATE mpp21090_pttab_dropcol_addcol_addpt_idx_dml_numeric SET col5 = 1.000000 WHERE col2 = 2.000000 AND col1 = 2.000000;
UPDATE 3
SELECT * FROM mpp21090_pttab_dropcol_addcol_addpt_idx_dml_numeric ORDER BY 1,2,3;
   col1   |   col2   | col3 |   col5   
----------+----------+------+----------
 2.000000 | 2.000000 | a    | 1.000000
 2.000000 | 2.000000 | b    | 1.000000
 2.000000 | 2.000000 | c    | 1.000000
(3 rows)

DELETE FROM mpp21090_pttab_dropcol_addcol_addpt_idx_dml_numeric WHERE col5 = 1.000000;
DELETE 3
SELECT * FROM mpp21090_pttab_dropcol_addcol_addpt_idx_dml_numeric ORDER BY 1,2,3;
 col1 | col2 | col3 | col5 
------+------+------+------
(0 rows)

ALTER TABLE mpp21090_pttab_dropcol_addcol_addpt_idx_dml_numeric ADD PARTITION partfour start(30.000000) end(40.000000) inclusive;
psql:/data/prabhd/test/tincrepo/main/dml/functional/output/mpp21090_pttab_dropcol_addcol_addpt_idx_dml_numeric_opt.sql:44: NOTICE:  CREATE TABLE will create partition "mpp21090_pttab_dropcol_addcol_addpt_idx_dml_nume_1_prt_partfour" for table "mpp21090_pttab_dropcol_addcol_addpt_idx_dml_numeric"
ALTER TABLE
ALTER TABLE mpp21090_pttab_dropcol_addcol_addpt_idx_dml_numeric ADD DEFAULT partition def;
psql:/data/prabhd/test/tincrepo/main/dml/functional/output/mpp21090_pttab_dropcol_addcol_addpt_idx_dml_numeric_opt.sql:45: NOTICE:  CREATE TABLE will create partition "mpp21090_pttab_dropcol_addcol_addpt_idx_dml_numeric_1_prt_def" for table "mpp21090_pttab_dropcol_addcol_addpt_idx_dml_numeric"
ALTER TABLE
INSERT INTO mpp21090_pttab_dropcol_addcol_addpt_idx_dml_numeric SELECT 35.000000,35.000000,'d',35.000000;
INSERT 0 1
SELECT * FROM mpp21090_pttab_dropcol_addcol_addpt_idx_dml_numeric ORDER BY 1,2,3;
   col1    |   col2    | col3 |   col5    
-----------+-----------+------+-----------
 35.000000 | 35.000000 | d    | 35.000000
(1 row)

UPDATE mpp21090_pttab_dropcol_addcol_addpt_idx_dml_numeric SET col5 = 1.000000 WHERE col2 = 35.000000 AND col3 ='d';
UPDATE 1
SELECT * FROM mpp21090_pttab_dropcol_addcol_addpt_idx_dml_numeric ORDER BY 1,2,3;
   col1    |   col2    | col3 |   col5   
-----------+-----------+------+----------
 35.000000 | 35.000000 | d    | 1.000000
(1 row)

-- Update partition key
UPDATE mpp21090_pttab_dropcol_addcol_addpt_idx_dml_numeric SET col2 = 1.000000 WHERE col2 = 35.000000 AND col3 ='d';
UPDATE 1
SELECT * FROM mpp21090_pttab_dropcol_addcol_addpt_idx_dml_numeric ORDER BY 1,2,3;
   col1    |   col2   | col3 |   col5   
-----------+----------+------+----------
 35.000000 | 1.000000 | d    | 1.000000
(1 row)

DELETE FROM mpp21090_pttab_dropcol_addcol_addpt_idx_dml_numeric WHERE col5 = 1.000000;
DELETE 1
SELECT * FROM mpp21090_pttab_dropcol_addcol_addpt_idx_dml_numeric ORDER BY 1,2,3;
 col1 | col2 | col3 | col5 
------+------+------+------
(0 rows)

