DROP TABLE IF EXISTS mpp21090_dropcol_splitdefpt_addcol_dml_decimal;
psql:/data/prabhd/test/tincrepo/main/dml/functional/output/mpp21090_dropcol_splitdefpt_addcol_dml_decimal_opt.sql:14: NOTICE:  table "mpp21090_dropcol_splitdefpt_addcol_dml_decimal" does not exist, skipping
DROP TABLE
CREATE TABLE mpp21090_dropcol_splitdefpt_addcol_dml_decimal
(
    col1 decimal,
    col2 decimal,
    col3 char,
    col4 decimal
) 
DISTRIBUTED by (col1)
PARTITION BY LIST(col2)
(
default partition def
);
psql:/data/prabhd/test/tincrepo/main/dml/functional/output/mpp21090_dropcol_splitdefpt_addcol_dml_decimal_opt.sql:26: NOTICE:  CREATE TABLE will create partition "mpp21090_dropcol_splitdefpt_addcol_dml_decimal_1_prt_def" for table "mpp21090_dropcol_splitdefpt_addcol_dml_decimal"
CREATE TABLE
INSERT INTO mpp21090_dropcol_splitdefpt_addcol_dml_decimal VALUES(2.00,2.00,'a',2.00);
INSERT 0 1
SELECT * FROM mpp21090_dropcol_splitdefpt_addcol_dml_decimal ORDER BY 1,2,3,4;
 col1 | col2 | col3 | col4 
------+------+------+------
 2.00 | 2.00 | a    | 2.00
(1 row)

ALTER TABLE mpp21090_dropcol_splitdefpt_addcol_dml_decimal DROP COLUMN col4;
ALTER TABLE
INSERT INTO mpp21090_dropcol_splitdefpt_addcol_dml_decimal VALUES(2.00,2.00,'b');
INSERT 0 1
SELECT * FROM mpp21090_dropcol_splitdefpt_addcol_dml_decimal ORDER BY 1,2,3;
 col1 | col2 | col3 
------+------+------
 2.00 | 2.00 | a
 2.00 | 2.00 | b
(2 rows)

ALTER TABLE mpp21090_dropcol_splitdefpt_addcol_dml_decimal SPLIT DEFAULT PARTITION at (5.00) into (partition partsplitone,partition def);
psql:/data/prabhd/test/tincrepo/main/dml/functional/output/mpp21090_dropcol_splitdefpt_addcol_dml_decimal_opt.sql:36: NOTICE:  exchanged partition "def" of relation "mpp21090_dropcol_splitdefpt_addcol_dml_decimal" with relation "pg_temp_60510"
psql:/data/prabhd/test/tincrepo/main/dml/functional/output/mpp21090_dropcol_splitdefpt_addcol_dml_decimal_opt.sql:36: NOTICE:  dropped partition "def" for relation "mpp21090_dropcol_splitdefpt_addcol_dml_decimal"
psql:/data/prabhd/test/tincrepo/main/dml/functional/output/mpp21090_dropcol_splitdefpt_addcol_dml_decimal_opt.sql:36: NOTICE:  CREATE TABLE will create partition "mpp21090_dropcol_splitdefpt_addcol_dml_decim_1_prt_partsplitone" for table "mpp21090_dropcol_splitdefpt_addcol_dml_decimal"
psql:/data/prabhd/test/tincrepo/main/dml/functional/output/mpp21090_dropcol_splitdefpt_addcol_dml_decimal_opt.sql:36: NOTICE:  CREATE TABLE will create partition "mpp21090_dropcol_splitdefpt_addcol_dml_decimal_1_prt_def" for table "mpp21090_dropcol_splitdefpt_addcol_dml_decimal"
ALTER TABLE
INSERT INTO mpp21090_dropcol_splitdefpt_addcol_dml_decimal SELECT 1.00, 1.00,'e';
INSERT 0 1
SELECT * FROM mpp21090_dropcol_splitdefpt_addcol_dml_decimal ORDER BY 1,2,3;
 col1 | col2 | col3 
------+------+------
 1.00 | 1.00 | e
 2.00 | 2.00 | a
 2.00 | 2.00 | b
(3 rows)

ALTER TABLE mpp21090_dropcol_splitdefpt_addcol_dml_decimal ADD COLUMN col5 decimal DEFAULT 2.00;
ALTER TABLE
INSERT INTO mpp21090_dropcol_splitdefpt_addcol_dml_decimal VALUES(2.00,2.00,'c',2.00);
INSERT 0 1
SELECT * FROM mpp21090_dropcol_splitdefpt_addcol_dml_decimal ORDER BY 1,2,3,4;
 col1 | col2 | col3 | col5 
------+------+------+------
 1.00 | 1.00 | e    | 2.00
 2.00 | 2.00 | a    | 2.00
 2.00 | 2.00 | b    | 2.00
 2.00 | 2.00 | c    | 2.00
(4 rows)

-- Update distribution key
UPDATE mpp21090_dropcol_splitdefpt_addcol_dml_decimal SET col1 = 35.00 WHERE col2 = 1.00 AND col1 = 1.00;
UPDATE 1
SELECT * FROM mpp21090_dropcol_splitdefpt_addcol_dml_decimal ORDER BY 1,2,3;
 col1  | col2 | col3 | col5 
-------+------+------+------
  2.00 | 2.00 | a    | 2.00
  2.00 | 2.00 | b    | 2.00
  2.00 | 2.00 | c    | 2.00
 35.00 | 1.00 | e    | 2.00
(4 rows)

-- Update partition key
UPDATE mpp21090_dropcol_splitdefpt_addcol_dml_decimal SET col2 = 35.00 WHERE col2 = 1.00 AND col1 = 35.00;
UPDATE 1
SELECT * FROM mpp21090_dropcol_splitdefpt_addcol_dml_decimal ORDER BY 1,2,3;
 col1  | col2  | col3 | col5 
-------+-------+------+------
  2.00 |  2.00 | a    | 2.00
  2.00 |  2.00 | b    | 2.00
  2.00 |  2.00 | c    | 2.00
 35.00 | 35.00 | e    | 2.00
(4 rows)

DELETE FROM mpp21090_dropcol_splitdefpt_addcol_dml_decimal WHERE col3='b';
DELETE 1
SELECT * FROM mpp21090_dropcol_splitdefpt_addcol_dml_decimal ORDER BY 1,2,3;
 col1  | col2  | col3 | col5 
-------+-------+------+------
  2.00 |  2.00 | a    | 2.00
  2.00 |  2.00 | c    | 2.00
 35.00 | 35.00 | e    | 2.00
(3 rows)

