DROP TABLE IF EXISTS mpp21090_reordered_col_dml_decimal;
psql:/data/prabhd/test/tincrepo/main/dml/functional/output/mpp21090_reordered_col_dml_decimal_opt.sql:14: NOTICE:  table "mpp21090_reordered_col_dml_decimal" does not exist, skipping
DROP TABLE
CREATE TABLE mpp21090_reordered_col_dml_decimal
(
    col1 decimal DEFAULT 1.00,
    col2 decimal,
    col3 char,
    col4 decimal,
    col5 int
) 
DISTRIBUTED by (col1)
PARTITION BY RANGE(col2)(partition partone start(1.00) end(10.00)  WITH (APPENDONLY=true, COMPRESSLEVEL=5, ORIENTATION=column),partition parttwo start(10.00) end(20.00) WITH (APPENDONLY=true, COMPRESSLEVEL=5, ORIENTATION=row),partition partthree start(20.00) end(30.00));
psql:/data/prabhd/test/tincrepo/main/dml/functional/output/mpp21090_reordered_col_dml_decimal_opt.sql:24: NOTICE:  CREATE TABLE will create partition "mpp21090_reordered_col_dml_decimal_1_prt_partone" for table "mpp21090_reordered_col_dml_decimal"
psql:/data/prabhd/test/tincrepo/main/dml/functional/output/mpp21090_reordered_col_dml_decimal_opt.sql:24: NOTICE:  CREATE TABLE will create partition "mpp21090_reordered_col_dml_decimal_1_prt_parttwo" for table "mpp21090_reordered_col_dml_decimal"
psql:/data/prabhd/test/tincrepo/main/dml/functional/output/mpp21090_reordered_col_dml_decimal_opt.sql:24: NOTICE:  CREATE TABLE will create partition "mpp21090_reordered_col_dml_decimal_1_prt_partthree" for table "mpp21090_reordered_col_dml_decimal"
CREATE TABLE
INSERT INTO mpp21090_reordered_col_dml_decimal(col2,col1,col3,col5,col4) SELECT 2.00, 2.00,'a', 1,2.00;
INSERT 0 1
INSERT INTO mpp21090_reordered_col_dml_decimal(col2,col3,col5,col4) SELECT 2.00,'b', 2, 2.00; 
INSERT 0 1
SELECT * FROM mpp21090_reordered_col_dml_decimal ORDER BY 1,2,3,4;
 col1 | col2 | col3 | col4 | col5 
------+------+------+------+------
 1.00 | 2.00 | b    | 2.00 |    2
 2.00 | 2.00 | a    | 2.00 |    1
(2 rows)

ALTER TABLE mpp21090_reordered_col_dml_decimal DROP COLUMN col4;
ALTER TABLE
ALTER TABLE mpp21090_reordered_col_dml_decimal ADD COLUMN col4 int DEFAULT 10;
ALTER TABLE
INSERT INTO mpp21090_reordered_col_dml_decimal(col2,col3,col5,col4) SELECT 2.00,'c', 2, 10; 
INSERT 0 1
SELECT * FROM mpp21090_reordered_col_dml_decimal ORDER BY 1,2,3,4;
 col1 | col2 | col3 | col5 | col4 
------+------+------+------+------
 1.00 | 2.00 | b    |    2 |   10
 1.00 | 2.00 | c    |    2 |   10
 2.00 | 2.00 | a    |    1 |   10
(3 rows)

UPDATE mpp21090_reordered_col_dml_decimal SET col4 = 20;
UPDATE 3
SELECT * FROM mpp21090_reordered_col_dml_decimal ORDER BY 1,2,3,4;
 col1 | col2 | col3 | col5 | col4 
------+------+------+------+------
 1.00 | 2.00 | b    |    2 |   20
 1.00 | 2.00 | c    |    2 |   20
 2.00 | 2.00 | a    |    1 |   20
(3 rows)

DELETE FROM mpp21090_reordered_col_dml_decimal WHERE col4=20;
DELETE 3
SELECT * FROM mpp21090_reordered_col_dml_decimal ORDER BY 1,2,3,4;
 col1 | col2 | col3 | col5 | col4 
------+------+------+------+------
(0 rows)

