DROP TABLE IF EXISTS mpp21090_defpt_dropcol_addcol_dml_int4;
psql:/data/prabhd/test/tincrepo/main/dml/functional/output/mpp21090_defpt_dropcol_addcol_dml_int4_opt.sql:14: NOTICE:  table "mpp21090_defpt_dropcol_addcol_dml_int4" does not exist, skipping
DROP TABLE
CREATE TABLE mpp21090_defpt_dropcol_addcol_dml_int4
(
    col1 int4,
    col2 int4,
    col3 char,
    col4 int
) 
DISTRIBUTED by (col1)
PARTITION BY LIST(col2)
(
default partition def
);
psql:/data/prabhd/test/tincrepo/main/dml/functional/output/mpp21090_defpt_dropcol_addcol_dml_int4_opt.sql:26: NOTICE:  CREATE TABLE will create partition "mpp21090_defpt_dropcol_addcol_dml_int4_1_prt_def" for table "mpp21090_defpt_dropcol_addcol_dml_int4"
CREATE TABLE
INSERT INTO mpp21090_defpt_dropcol_addcol_dml_int4 VALUES(20000000,20000000,'a',0);
INSERT 0 1
ALTER TABLE mpp21090_defpt_dropcol_addcol_dml_int4 DROP COLUMN col4;
ALTER TABLE
INSERT INTO mpp21090_defpt_dropcol_addcol_dml_int4 SELECT 35000000,35000000,'b';
INSERT 0 1
SELECT * FROM mpp21090_defpt_dropcol_addcol_dml_int4 ORDER BY 1,2,3;
   col1   |   col2   | col3 
----------+----------+------
 20000000 | 20000000 | a
 35000000 | 35000000 | b
(2 rows)

ALTER TABLE mpp21090_defpt_dropcol_addcol_dml_int4 ADD COLUMN col5 int4;
ALTER TABLE
INSERT INTO mpp21090_defpt_dropcol_addcol_dml_int4 SELECT 20000000,20000000,'c',20000000;
INSERT 0 1
SELECT * FROM mpp21090_defpt_dropcol_addcol_dml_int4 ORDER BY 1,2,3;
   col1   |   col2   | col3 |   col5   
----------+----------+------+----------
 20000000 | 20000000 | a    |         
 20000000 | 20000000 | c    | 20000000
 35000000 | 35000000 | b    |         
(3 rows)

UPDATE mpp21090_defpt_dropcol_addcol_dml_int4 SET col1 = 10000000 WHERE col2 = 35000000 AND col1 = 35000000;
UPDATE 1
SELECT * FROM mpp21090_defpt_dropcol_addcol_dml_int4 ORDER BY 1,2,3;
   col1   |   col2   | col3 |   col5   
----------+----------+------+----------
 10000000 | 35000000 | b    |         
 20000000 | 20000000 | a    |         
 20000000 | 20000000 | c    | 20000000
(3 rows)

-- Update partition key
UPDATE mpp21090_defpt_dropcol_addcol_dml_int4 SET col2 = 10000000 WHERE col2 = 35000000 AND col1 = 10000000;
UPDATE 1
SELECT * FROM mpp21090_defpt_dropcol_addcol_dml_int4 ORDER BY 1,2,3;
   col1   |   col2   | col3 |   col5   
----------+----------+------+----------
 10000000 | 10000000 | b    |         
 20000000 | 20000000 | a    |         
 20000000 | 20000000 | c    | 20000000
(3 rows)

DELETE FROM mpp21090_defpt_dropcol_addcol_dml_int4 WHERE col2 = 10000000;
DELETE 1
SELECT * FROM mpp21090_defpt_dropcol_addcol_dml_int4 ORDER BY 1,2,3;
   col1   |   col2   | col3 |   col5   
----------+----------+------+----------
 20000000 | 20000000 | a    |         
 20000000 | 20000000 | c    | 20000000
(2 rows)

