DROP TABLE IF EXISTS mpp21090_defpt_dropcol_addcol_dml_interval;
psql:/data/prabhd/test/tincrepo/main/dml/functional/output/mpp21090_defpt_dropcol_addcol_dml_interval_opt.sql:14: NOTICE:  table "mpp21090_defpt_dropcol_addcol_dml_interval" does not exist, skipping
DROP TABLE
CREATE TABLE mpp21090_defpt_dropcol_addcol_dml_interval
(
    col1 interval,
    col2 interval,
    col3 char,
    col4 int
) 
DISTRIBUTED by (col1)
PARTITION BY LIST(col2)
(
default partition def
);
psql:/data/prabhd/test/tincrepo/main/dml/functional/output/mpp21090_defpt_dropcol_addcol_dml_interval_opt.sql:26: NOTICE:  CREATE TABLE will create partition "mpp21090_defpt_dropcol_addcol_dml_interval_1_prt_def" for table "mpp21090_defpt_dropcol_addcol_dml_interval"
CREATE TABLE
INSERT INTO mpp21090_defpt_dropcol_addcol_dml_interval VALUES('1 hour','1 hour','a',0);
INSERT 0 1
ALTER TABLE mpp21090_defpt_dropcol_addcol_dml_interval DROP COLUMN col4;
ALTER TABLE
INSERT INTO mpp21090_defpt_dropcol_addcol_dml_interval SELECT '14 hours','14 hours','b';
INSERT 0 1
SELECT * FROM mpp21090_defpt_dropcol_addcol_dml_interval ORDER BY 1,2,3;
   col1   |   col2   | col3 
----------+----------+------
 01:00:00 | 01:00:00 | a
 14:00:00 | 14:00:00 | b
(2 rows)

ALTER TABLE mpp21090_defpt_dropcol_addcol_dml_interval ADD COLUMN col5 interval;
ALTER TABLE
INSERT INTO mpp21090_defpt_dropcol_addcol_dml_interval SELECT '1 hour','1 hour','c','1 hour';
INSERT 0 1
SELECT * FROM mpp21090_defpt_dropcol_addcol_dml_interval ORDER BY 1,2,3;
   col1   |   col2   | col3 |   col5   
----------+----------+------+----------
 01:00:00 | 01:00:00 | a    | 
 01:00:00 | 01:00:00 | c    | 01:00:00
 14:00:00 | 14:00:00 | b    | 
(3 rows)

UPDATE mpp21090_defpt_dropcol_addcol_dml_interval SET col1 = '12 hours' WHERE col2 = '14 hours' AND col1 = '14 hours';
UPDATE 1
SELECT * FROM mpp21090_defpt_dropcol_addcol_dml_interval ORDER BY 1,2,3;
   col1   |   col2   | col3 |   col5   
----------+----------+------+----------
 01:00:00 | 01:00:00 | a    | 
 01:00:00 | 01:00:00 | c    | 01:00:00
 12:00:00 | 14:00:00 | b    | 
(3 rows)

-- Update partition key
UPDATE mpp21090_defpt_dropcol_addcol_dml_interval SET col2 = '12 hours' WHERE col2 = '14 hours' AND col1 = '12 hours';
UPDATE 1
SELECT * FROM mpp21090_defpt_dropcol_addcol_dml_interval ORDER BY 1,2,3;
   col1   |   col2   | col3 |   col5   
----------+----------+------+----------
 01:00:00 | 01:00:00 | a    | 
 01:00:00 | 01:00:00 | c    | 01:00:00
 12:00:00 | 12:00:00 | b    | 
(3 rows)

DELETE FROM mpp21090_defpt_dropcol_addcol_dml_interval WHERE col2 = '12 hours';
DELETE 1
SELECT * FROM mpp21090_defpt_dropcol_addcol_dml_interval ORDER BY 1,2,3;
   col1   |   col2   | col3 |   col5   
----------+----------+------+----------
 01:00:00 | 01:00:00 | a    | 
 01:00:00 | 01:00:00 | c    | 01:00:00
(2 rows)

