DROP TABLE IF EXISTS mpp21090_xchange_pttab_dropcol_dml_timestamptz;
psql:/data/prabhd/test/tincrepo/main/dml/functional/output/mpp21090_xchange_pttab_dropcol_dml_timestamptz_opt.sql:14: NOTICE:  table "mpp21090_xchange_pttab_dropcol_dml_timestamptz" does not exist, skipping
DROP TABLE
CREATE TABLE mpp21090_xchange_pttab_dropcol_dml_timestamptz
(
    col1 timestamptz,
    col2 timestamptz,
    col3 char,
    col4 int,
    col5 timestamptz
) 
DISTRIBUTED by (col1)
PARTITION BY RANGE(col2)(partition partone start('2013-12-01 12:00:00 PST') end('2013-12-31 12:00:00 PST') WITH(APPENDONLY=true, COMPRESSLEVEL=5, ORIENTATION=column),partition parttwo start('2013-12-31 12:00:00 PST') end('2014-01-01 12:00:00 PST') WITH (APPENDONLY=true, COMPRESSLEVEL=5, ORIENTATION=row),partition partthree start('2014-01-01 12:00:00 PST') end('2014-02-01 12:00:00 PST'));
psql:/data/prabhd/test/tincrepo/main/dml/functional/output/mpp21090_xchange_pttab_dropcol_dml_timestamptz_opt.sql:24: NOTICE:  CREATE TABLE will create partition "mpp21090_xchange_pttab_dropcol_dml_timestamptz_1_prt_partone" for table "mpp21090_xchange_pttab_dropcol_dml_timestamptz"
psql:/data/prabhd/test/tincrepo/main/dml/functional/output/mpp21090_xchange_pttab_dropcol_dml_timestamptz_opt.sql:24: NOTICE:  CREATE TABLE will create partition "mpp21090_xchange_pttab_dropcol_dml_timestamptz_1_prt_parttwo" for table "mpp21090_xchange_pttab_dropcol_dml_timestamptz"
psql:/data/prabhd/test/tincrepo/main/dml/functional/output/mpp21090_xchange_pttab_dropcol_dml_timestamptz_opt.sql:24: NOTICE:  CREATE TABLE will create partition "mpp21090_xchange_pttab_dropcol_dml_timestamptz_1_prt_partthree" for table "mpp21090_xchange_pttab_dropcol_dml_timestamptz"
CREATE TABLE
INSERT INTO mpp21090_xchange_pttab_dropcol_dml_timestamptz VALUES('2013-12-30 12:00:00 PST','2013-12-30 12:00:00 PST','a',0, '2013-12-30 12:00:00 PST');
INSERT 0 1
SELECT * FROM mpp21090_xchange_pttab_dropcol_dml_timestamptz ORDER BY 1,2,3,4;
          col1          |          col2          | col3 | col4 |          col5          
------------------------+------------------------+------+------+------------------------
 2013-12-30 12:00:00-08 | 2013-12-30 12:00:00-08 | a    |    0 | 2013-12-30 12:00:00-08
(1 row)

ALTER TABLE mpp21090_xchange_pttab_dropcol_dml_timestamptz DROP COLUMN col1;
psql:/data/prabhd/test/tincrepo/main/dml/functional/output/mpp21090_xchange_pttab_dropcol_dml_timestamptz_opt.sql:29: NOTICE:  Dropping a column that is part of the distribution policy forces a NULL distribution policy
psql:/data/prabhd/test/tincrepo/main/dml/functional/output/mpp21090_xchange_pttab_dropcol_dml_timestamptz_opt.sql:29: NOTICE:  Dropping a column that is part of the distribution policy forces a NULL distribution policy
psql:/data/prabhd/test/tincrepo/main/dml/functional/output/mpp21090_xchange_pttab_dropcol_dml_timestamptz_opt.sql:29: NOTICE:  Dropping a column that is part of the distribution policy forces a NULL distribution policy
psql:/data/prabhd/test/tincrepo/main/dml/functional/output/mpp21090_xchange_pttab_dropcol_dml_timestamptz_opt.sql:29: NOTICE:  Dropping a column that is part of the distribution policy forces a NULL distribution policy
ALTER TABLE
-- Create Candidate table for Exchange
DROP TABLE IF EXISTS mpp21090_xchange_pttab_dropcol_dml_timestamptz_candidate;
psql:/data/prabhd/test/tincrepo/main/dml/functional/output/mpp21090_xchange_pttab_dropcol_dml_timestamptz_opt.sql:32: NOTICE:  table "mpp21090_xchange_pttab_dropcol_dml_timestamptz_candidate" does not exist, skipping
DROP TABLE
CREATE TABLE mpp21090_xchange_pttab_dropcol_dml_timestamptz_candidate( like mpp21090_xchange_pttab_dropcol_dml_timestamptz) distributed randomly;
CREATE TABLE
INSERT INTO mpp21090_xchange_pttab_dropcol_dml_timestamptz_candidate VALUES('2013-12-30 12:00:00 PST','z',1,'2013-12-30 12:00:00 PST');
INSERT 0 1
-- Exchange 
ALTER TABLE mpp21090_xchange_pttab_dropcol_dml_timestamptz EXCHANGE PARTITION FOR('2013-12-15 12:00:00 PST') WITH TABLE mpp21090_xchange_pttab_dropcol_dml_timestamptz_candidate;
psql:/data/prabhd/test/tincrepo/main/dml/functional/output/mpp21090_xchange_pttab_dropcol_dml_timestamptz_opt.sql:37: NOTICE:  exchanged partition "partone" of relation "mpp21090_xchange_pttab_dropcol_dml_timestamptz" with relation "mpp21090_xchange_pttab_dropcol_dml_timestamptz_candidate"
ALTER TABLE
SELECT * FROM mpp21090_xchange_pttab_dropcol_dml_timestamptz ORDER BY 1,2,3;
          col2          | col3 | col4 |          col5          
------------------------+------+------+------------------------
 2013-12-30 12:00:00-08 | z    |    1 | 2013-12-30 12:00:00-08
(1 row)

SELECT * FROM mpp21090_xchange_pttab_dropcol_dml_timestamptz_candidate ORDER BY 1,2,3;
          col2          | col3 | col4 |          col5          
------------------------+------+------+------------------------
 2013-12-30 12:00:00-08 | a    |    0 | 2013-12-30 12:00:00-08
(1 row)

-- DML on partition table
INSERT INTO mpp21090_xchange_pttab_dropcol_dml_timestamptz SELECT  '2013-12-01 12:00:00 PST','b', 1, '2013-12-01 12:00:00 PST';
INSERT 0 1
SELECT * FROM mpp21090_xchange_pttab_dropcol_dml_timestamptz ORDER BY 1,2,3;
          col2          | col3 | col4 |          col5          
------------------------+------+------+------------------------
 2013-12-01 12:00:00-08 | b    |    1 | 2013-12-01 12:00:00-08
 2013-12-30 12:00:00-08 | z    |    1 | 2013-12-30 12:00:00-08
(2 rows)

UPDATE mpp21090_xchange_pttab_dropcol_dml_timestamptz SET col5 = '2014-02-10 12:00:00 PST' WHERE col2 = '2013-12-01 12:00:00 PST' AND col5 = '2013-12-01 12:00:00 PST';
UPDATE 1
SELECT * FROM mpp21090_xchange_pttab_dropcol_dml_timestamptz ORDER BY 1,2,3;
          col2          | col3 | col4 |          col5          
------------------------+------+------+------------------------
 2013-12-01 12:00:00-08 | b    |    1 | 2014-02-10 12:00:00-08
 2013-12-30 12:00:00-08 | z    |    1 | 2013-12-30 12:00:00-08
(2 rows)

UPDATE mpp21090_xchange_pttab_dropcol_dml_timestamptz SET col2 ='2013-12-30 12:00:00 PST' WHERE col3='b';
UPDATE 1
SELECT * FROM mpp21090_xchange_pttab_dropcol_dml_timestamptz ORDER BY 1,2,3;
          col2          | col3 | col4 |          col5          
------------------------+------+------+------------------------
 2013-12-30 12:00:00-08 | b    |    1 | 2014-02-10 12:00:00-08
 2013-12-30 12:00:00-08 | z    |    1 | 2013-12-30 12:00:00-08
(2 rows)

DELETE FROM mpp21090_xchange_pttab_dropcol_dml_timestamptz WHERE col3='b';
DELETE 1
SELECT * FROM mpp21090_xchange_pttab_dropcol_dml_timestamptz ORDER BY 1,2,3;
          col2          | col3 | col4 |          col5          
------------------------+------+------+------------------------
 2013-12-30 12:00:00-08 | z    |    1 | 2013-12-30 12:00:00-08
(1 row)

-- DML on candidate table
INSERT INTO mpp21090_xchange_pttab_dropcol_dml_timestamptz_candidate SELECT '2013-12-01 12:00:00 PST','b', 1, '2013-12-01 12:00:00 PST';
INSERT 0 1
SELECT * FROM mpp21090_xchange_pttab_dropcol_dml_timestamptz_candidate ORDER BY 1,2,3;
          col2          | col3 | col4 |          col5          
------------------------+------+------+------------------------
 2013-12-01 12:00:00-08 | b    |    1 | 2013-12-01 12:00:00-08
 2013-12-30 12:00:00-08 | a    |    0 | 2013-12-30 12:00:00-08
(2 rows)

UPDATE mpp21090_xchange_pttab_dropcol_dml_timestamptz_candidate SET col2='2013-12-30 12:00:00 PST' WHERE col3='a';
UPDATE 1
SELECT * FROM mpp21090_xchange_pttab_dropcol_dml_timestamptz_candidate ORDER BY 1,2,3;
          col2          | col3 | col4 |          col5          
------------------------+------+------+------------------------
 2013-12-01 12:00:00-08 | b    |    1 | 2013-12-01 12:00:00-08
 2013-12-30 12:00:00-08 | a    |    0 | 2013-12-30 12:00:00-08
(2 rows)

DELETE FROM mpp21090_xchange_pttab_dropcol_dml_timestamptz_candidate WHERE col3='a';
DELETE 1
SELECT * FROM mpp21090_xchange_pttab_dropcol_dml_timestamptz_candidate ORDER BY 1,2,3;
          col2          | col3 | col4 |          col5          
------------------------+------+------+------------------------
 2013-12-01 12:00:00-08 | b    |    1 | 2013-12-01 12:00:00-08
(1 row)

