set vector.enable_vectorization = on;
-- set the number of tuples in a group to 5,
-- so we can test multiple group with visimap,
-- at the beginning, in the middle, or at the end
-- of a group.
set pax_max_tuples_per_group = 5;
-- column types contain:
-- 1. normal fix-length column, like int
-- 2. normal variable-length column, like text
-- 3. numeric type
-- 4. bool type, uses one bit instead of one byte
-- 5. char(n), bpchar type
create table pt1(a int, i int, t text, n numeric(15,2), b bool, bp char(16))
using pax
with(storage_format=porc_vec);
explain (costs off) select ctid, * from pt1;
                  QUERY PLAN                  
----------------------------------------------
 Vec Gather Motion 3:1  (slice1; segments: 3)
   ->  Vec Seq Scan on pt1
 Optimizer: Pivotal Optimizer (GPORCA)
(3 rows)

select ctid, * from pt1;
 ctid | a | i | t | n | b | bp 
------+---+---+---+---+---+----
(0 rows)

insert into pt1 select 1,
--case when i % 3 = 0 and i % 2 = 0 then null else i end case,
i,
case when i % 2 = 0 or i % 5 = 0 then null else 'text_' || i end case,
case when i % 3 = 0 or i % 2 = 0 then null else 10000 + i end case,
case when i % 3 = 0 and i % 2 = 0 then 't'::bool when i % 3 != 0 then 'f'::bool else null end case,
case when i % 2 = 0 or i % 5 = 0 then null else 'bpchar_' || i end case
from generate_series(1,15)i;
select ctid, * from pt1;
  ctid  | a | i  |    t    |    n     | b |        bp        
--------+---+----+---------+----------+---+------------------
 (0,1)  | 1 |  1 | text_1  | 10001.00 | f | bpchar_1        
 (0,2)  | 1 |  2 |         |          | f | 
 (0,3)  | 1 |  3 | text_3  |          |   | bpchar_3        
 (0,4)  | 1 |  4 |         |          | f | 
 (0,5)  | 1 |  5 |         | 10005.00 | f | 
 (0,6)  | 1 |  6 |         |          | t | 
 (0,7)  | 1 |  7 | text_7  | 10007.00 | f | bpchar_7        
 (0,8)  | 1 |  8 |         |          | f | 
 (0,9)  | 1 |  9 | text_9  |          |   | bpchar_9        
 (0,10) | 1 | 10 |         |          | f | 
 (0,11) | 1 | 11 | text_11 | 10011.00 | f | bpchar_11       
 (0,12) | 1 | 12 |         |          | t | 
 (0,13) | 1 | 13 | text_13 | 10013.00 | f | bpchar_13       
 (0,14) | 1 | 14 |         |          | f | 
 (0,15) | 1 | 15 |         |          |   | 
(15 rows)

begin;
delete from pt1 where i < 2;
select ctid, * from pt1;
  ctid  | a | i  |    t    |    n     | b |        bp        
--------+---+----+---------+----------+---+------------------
 (0,2)  | 1 |  2 |         |          | f | 
 (0,3)  | 1 |  3 | text_3  |          |   | bpchar_3        
 (0,4)  | 1 |  4 |         |          | f | 
 (0,5)  | 1 |  5 |         | 10005.00 | f | 
 (0,6)  | 1 |  6 |         |          | t | 
 (0,7)  | 1 |  7 | text_7  | 10007.00 | f | bpchar_7        
 (0,8)  | 1 |  8 |         |          | f | 
 (0,9)  | 1 |  9 | text_9  |          |   | bpchar_9        
 (0,10) | 1 | 10 |         |          | f | 
 (0,11) | 1 | 11 | text_11 | 10011.00 | f | bpchar_11       
 (0,12) | 1 | 12 |         |          | t | 
 (0,13) | 1 | 13 | text_13 | 10013.00 | f | bpchar_13       
 (0,14) | 1 | 14 |         |          | f | 
 (0,15) | 1 | 15 |         |          |   | 
(14 rows)

rollback;
begin;
delete from pt1 where i = 5;
select ctid, * from pt1;
  ctid  | a | i  |    t    |    n     | b |        bp        
--------+---+----+---------+----------+---+------------------
 (0,1)  | 1 |  1 | text_1  | 10001.00 | f | bpchar_1        
 (0,2)  | 1 |  2 |         |          | f | 
 (0,3)  | 1 |  3 | text_3  |          |   | bpchar_3        
 (0,4)  | 1 |  4 |         |          | f | 
 (0,6)  | 1 |  6 |         |          | t | 
 (0,7)  | 1 |  7 | text_7  | 10007.00 | f | bpchar_7        
 (0,8)  | 1 |  8 |         |          | f | 
 (0,9)  | 1 |  9 | text_9  |          |   | bpchar_9        
 (0,10) | 1 | 10 |         |          | f | 
 (0,11) | 1 | 11 | text_11 | 10011.00 | f | bpchar_11       
 (0,12) | 1 | 12 |         |          | t | 
 (0,13) | 1 | 13 | text_13 | 10013.00 | f | bpchar_13       
 (0,14) | 1 | 14 |         |          | f | 
 (0,15) | 1 | 15 |         |          |   | 
(14 rows)

rollback;
begin;
delete from pt1 where i >= 6 and i <= 7;
select ctid, * from pt1;
  ctid  | a | i  |    t    |    n     | b |        bp        
--------+---+----+---------+----------+---+------------------
 (0,1)  | 1 |  1 | text_1  | 10001.00 | f | bpchar_1        
 (0,2)  | 1 |  2 |         |          | f | 
 (0,3)  | 1 |  3 | text_3  |          |   | bpchar_3        
 (0,4)  | 1 |  4 |         |          | f | 
 (0,5)  | 1 |  5 |         | 10005.00 | f | 
 (0,8)  | 1 |  8 |         |          | f | 
 (0,9)  | 1 |  9 | text_9  |          |   | bpchar_9        
 (0,10) | 1 | 10 |         |          | f | 
 (0,11) | 1 | 11 | text_11 | 10011.00 | f | bpchar_11       
 (0,12) | 1 | 12 |         |          | t | 
 (0,13) | 1 | 13 | text_13 | 10013.00 | f | bpchar_13       
 (0,14) | 1 | 14 |         |          | f | 
 (0,15) | 1 | 15 |         |          |   | 
(13 rows)

rollback;
begin;
delete from pt1 where i = 8;
select ctid, * from pt1;
  ctid  | a | i  |    t    |    n     | b |        bp        
--------+---+----+---------+----------+---+------------------
 (0,1)  | 1 |  1 | text_1  | 10001.00 | f | bpchar_1        
 (0,2)  | 1 |  2 |         |          | f | 
 (0,3)  | 1 |  3 | text_3  |          |   | bpchar_3        
 (0,4)  | 1 |  4 |         |          | f | 
 (0,5)  | 1 |  5 |         | 10005.00 | f | 
 (0,6)  | 1 |  6 |         |          | t | 
 (0,7)  | 1 |  7 | text_7  | 10007.00 | f | bpchar_7        
 (0,9)  | 1 |  9 | text_9  |          |   | bpchar_9        
 (0,10) | 1 | 10 |         |          | f | 
 (0,11) | 1 | 11 | text_11 | 10011.00 | f | bpchar_11       
 (0,12) | 1 | 12 |         |          | t | 
 (0,13) | 1 | 13 | text_13 | 10013.00 | f | bpchar_13       
 (0,14) | 1 | 14 |         |          | f | 
 (0,15) | 1 | 15 |         |          |   | 
(14 rows)

rollback;
begin;
delete from pt1 where i > 7 and i <= 10;
select ctid, * from pt1;
  ctid  | a | i  |    t    |    n     | b |        bp        
--------+---+----+---------+----------+---+------------------
 (0,1)  | 1 |  1 | text_1  | 10001.00 | f | bpchar_1        
 (0,2)  | 1 |  2 |         |          | f | 
 (0,3)  | 1 |  3 | text_3  |          |   | bpchar_3        
 (0,4)  | 1 |  4 |         |          | f | 
 (0,5)  | 1 |  5 |         | 10005.00 | f | 
 (0,6)  | 1 |  6 |         |          | t | 
 (0,7)  | 1 |  7 | text_7  | 10007.00 | f | bpchar_7        
 (0,11) | 1 | 11 | text_11 | 10011.00 | f | bpchar_11       
 (0,12) | 1 | 12 |         |          | t | 
 (0,13) | 1 | 13 | text_13 | 10013.00 | f | bpchar_13       
 (0,14) | 1 | 14 |         |          | f | 
 (0,15) | 1 | 15 |         |          |   | 
(12 rows)

rollback;
-- Test: all values are invisible
begin;
delete from pt1;
select ctid, * from pt1;
 ctid | a | i | t | n | b | bp 
------+---+---+---+---+---+----
(0 rows)

rollback;
-- Test: all columns are nulls
begin;
update pt1 set a = null, i = null, t = null, n = null, b = null, bp = null;
select ctid, * from pt1;
  ctid  | a | i | t | n | b | bp 
--------+---+---+---+---+---+----
 (0,1)  |   |   |   |   |   | 
 (0,2)  |   |   |   |   |   | 
 (0,3)  |   |   |   |   |   | 
 (0,4)  |   |   |   |   |   | 
 (0,5)  |   |   |   |   |   | 
 (0,6)  |   |   |   |   |   | 
 (0,7)  |   |   |   |   |   | 
 (0,8)  |   |   |   |   |   | 
 (0,9)  |   |   |   |   |   | 
 (0,10) |   |   |   |   |   | 
 (0,11) |   |   |   |   |   | 
 (0,12) |   |   |   |   |   | 
 (0,13) |   |   |   |   |   | 
 (0,14) |   |   |   |   |   | 
 (0,15) |   |   |   |   |   | 
(15 rows)

rollback;
-- Test if visimap works well with btree index
create unique index on pt1(a, i);
begin;
delete from pt1 where i >= 4 and i < 8;
select ctid, * from pt1;
  ctid  | a | i  |    t    |    n     | b |        bp        
--------+---+----+---------+----------+---+------------------
 (0,1)  | 1 |  1 | text_1  | 10001.00 | f | bpchar_1        
 (0,2)  | 1 |  2 |         |          | f | 
 (0,3)  | 1 |  3 | text_3  |          |   | bpchar_3        
 (0,8)  | 1 |  8 |         |          | f | 
 (0,9)  | 1 |  9 | text_9  |          |   | bpchar_9        
 (0,10) | 1 | 10 |         |          | f | 
 (0,11) | 1 | 11 | text_11 | 10011.00 | f | bpchar_11       
 (0,12) | 1 | 12 |         |          | t | 
 (0,13) | 1 | 13 | text_13 | 10013.00 | f | bpchar_13       
 (0,14) | 1 | 14 |         |          | f | 
 (0,15) | 1 | 15 |         |          |   | 
(11 rows)

explain (costs off) select * from pt1 where a = 1 and i >= 2 and i < 10;
                     QUERY PLAN                      
-----------------------------------------------------
 Vec Gather Motion 1:1  (slice1; segments: 1)
   ->  Vec Seq Scan on pt1
         Filter: ((a = 1) AND (i >= 2) AND (i < 10))
 Optimizer: Pivotal Optimizer (GPORCA)
(4 rows)

select * from pt1 where a = 1 and i >= 2 and i < 10;
 a | i |   t    | n | b |        bp        
---+---+--------+---+---+------------------
 1 | 2 |        |   | f | 
 1 | 3 | text_3 |   |   | bpchar_3        
 1 | 8 |        |   | f | 
 1 | 9 | text_9 |   |   | bpchar_9        
(4 rows)

rollback;
drop table pt1;
reset pax_max_tuples_per_group;
reset vector.enable_vectorization;
