-- Test concurrent update a table with a varying length type
CREATE TABLE t_concurrent_update(a int, b int, c char(84));
CREATE
INSERT INTO t_concurrent_update VALUES(1,1,'test');
INSERT 1

1: BEGIN;
BEGIN
1: SET optimizer=off;
SET
1: UPDATE t_concurrent_update SET b=b+10 WHERE a=1;
UPDATE 1
2: SET optimizer=off;
SET
2&: UPDATE t_concurrent_update SET b=b+10 WHERE a=1;  <waiting ...>
1: END;
END
2<:  <... completed>
UPDATE 1
1: SELECT * FROM t_concurrent_update;
 a | b  | c                                                                                    
---+----+--------------------------------------------------------------------------------------
 1 | 21 | test                                                                                 
(1 row)
1q: ... <quitting>
2q: ... <quitting>

DROP TABLE t_concurrent_update;
DROP


--start_ignore
! gpconfig -c gp_enable_global_deadlock_detector -v on;
20200305:08:04:41:016395 gpconfig:09c5497cf854:gpadmin-[INFO]:-completed successfully with parameters '-c gp_enable_global_deadlock_detector -v on'

! gpstop -rai;
20200305:08:04:41:016472 gpstop:09c5497cf854:gpadmin-[INFO]:-Starting gpstop with args: -rai
20200305:08:04:41:016472 gpstop:09c5497cf854:gpadmin-[INFO]:-Gathering information and validating the environment...
20200305:08:04:41:016472 gpstop:09c5497cf854:gpadmin-[INFO]:-Obtaining Greenplum Master catalog information
20200305:08:04:41:016472 gpstop:09c5497cf854:gpadmin-[INFO]:-Obtaining Segment details from master...
20200305:08:04:41:016472 gpstop:09c5497cf854:gpadmin-[INFO]:-Greenplum Version: 'postgres (Greenplum Database) 7.0.0-alpha.0+dev.5622.g0cc5452d2bc build dev'
20200305:08:04:41:016472 gpstop:09c5497cf854:gpadmin-[INFO]:-Commencing Master instance shutdown with mode='immediate'
20200305:08:04:41:016472 gpstop:09c5497cf854:gpadmin-[INFO]:-Master segment instance directory=/home/gpadmin/workspace/gpdb5/gpAux/gpdemo/datadirs/qddir/demoDataDir-1
20200305:08:04:41:016472 gpstop:09c5497cf854:gpadmin-[INFO]:-Attempting forceful termination of any leftover master process
20200305:08:04:41:016472 gpstop:09c5497cf854:gpadmin-[INFO]:-Terminating processes for segment /home/gpadmin/workspace/gpdb5/gpAux/gpdemo/datadirs/qddir/demoDataDir-1
20200305:08:04:41:016472 gpstop:09c5497cf854:gpadmin-[INFO]:-Stopping master standby host 09c5497cf854 mode=immediate
20200305:08:04:41:016472 gpstop:09c5497cf854:gpadmin-[INFO]:-Successfully shutdown standby process on 09c5497cf854
20200305:08:04:41:016472 gpstop:09c5497cf854:gpadmin-[INFO]:-Targeting dbid [2, 5, 3, 6, 4, 7] for shutdown
20200305:08:04:41:016472 gpstop:09c5497cf854:gpadmin-[INFO]:-Commencing parallel primary segment instance shutdown, please wait...
20200305:08:04:41:016472 gpstop:09c5497cf854:gpadmin-[INFO]:-0.00% of jobs completed
20200305:08:04:41:016472 gpstop:09c5497cf854:gpadmin-[INFO]:-100.00% of jobs completed
20200305:08:04:41:016472 gpstop:09c5497cf854:gpadmin-[INFO]:-Commencing parallel mirror segment instance shutdown, please wait...
20200305:08:04:41:016472 gpstop:09c5497cf854:gpadmin-[INFO]:-0.00% of jobs completed
20200305:08:04:42:016472 gpstop:09c5497cf854:gpadmin-[INFO]:-100.00% of jobs completed
20200305:08:04:42:016472 gpstop:09c5497cf854:gpadmin-[INFO]:-----------------------------------------------------
20200305:08:04:42:016472 gpstop:09c5497cf854:gpadmin-[INFO]:-   Segments stopped successfully      = 6
20200305:08:04:42:016472 gpstop:09c5497cf854:gpadmin-[INFO]:-   Segments with errors during stop   = 0
20200305:08:04:42:016472 gpstop:09c5497cf854:gpadmin-[INFO]:-----------------------------------------------------
20200305:08:04:42:016472 gpstop:09c5497cf854:gpadmin-[INFO]:-Successfully shutdown 6 of 6 segment instances 
20200305:08:04:42:016472 gpstop:09c5497cf854:gpadmin-[INFO]:-Database successfully shutdown with no errors reported
20200305:08:04:42:016472 gpstop:09c5497cf854:gpadmin-[INFO]:-Cleaning up leftover shared memory
20200305:08:04:42:016472 gpstop:09c5497cf854:gpadmin-[INFO]:-Restarting System...

--end_ignore

-- Test the concurrent update transaction order on the segment is reflected on master
-- enable gdd
1: SHOW gp_enable_global_deadlock_detector;
 gp_enable_global_deadlock_detector 
------------------------------------
 on                                 
(1 row)
1: CREATE TABLE t_concurrent_update(a int, b int);
CREATE
1: INSERT INTO t_concurrent_update VALUES(1,1);
INSERT 1

2: BEGIN;
BEGIN
2: SET optimizer=off;
SET
2: UPDATE t_concurrent_update SET b=b+10 WHERE a=1;
UPDATE 1
3: BEGIN;
BEGIN
3: SET optimizer=off;
SET
-- transaction 3 will wait transaction 1 on the segment
3&: UPDATE t_concurrent_update SET b=b+10 WHERE a=1;  <waiting ...>

-- transaction 2 suspend before commit, but it will wake up transaction 3 on segment
2: select gp_inject_fault('before_xact_end_procarray', 'suspend', dbid) FROM gp_segment_configuration WHERE role='p' AND content=-1;
 gp_inject_fault 
-----------------
 Success:        
(1 row)
2&: END;  <waiting ...>
1: select gp_wait_until_triggered_fault('before_xact_end_procarray', 1, dbid) FROM gp_segment_configuration WHERE role='p' AND content=-1;
 gp_wait_until_triggered_fault 
-------------------------------
 Success:                      
(1 row)
-- transaction 3 should wait transaction 2 commit on master
3<:  <... completed>
UPDATE 1
3&: END;  <waiting ...>
1: select gp_inject_fault('before_xact_end_procarray', 'reset', dbid) FROM gp_segment_configuration WHERE role='p' AND content=-1;
 gp_inject_fault 
-----------------
 Success:        
(1 row)
-- the query should not get the incorrect distributed snapshot: transaction 1 in-progress
-- and transaction 2 finished
1: SELECT * FROM t_concurrent_update;
 a | b 
---+---
 1 | 1 
(1 row)
2<:  <... completed>
END
3<:  <... completed>
END
2q: ... <quitting>
3q: ... <quitting>

1: SELECT * FROM t_concurrent_update;
 a | b  
---+----
 1 | 21 
(1 row)
1q: ... <quitting>

-- Same test as the above, except the first transaction commits before the
-- second transaction check the wait gxid, it should get the gxid from
-- pg_distributedlog instead of the procarray.
4: BEGIN;
BEGIN
4: SET optimizer=off;
SET
4: UPDATE t_concurrent_update SET b=b+10 WHERE a=1;
UPDATE 1

5: BEGIN;
BEGIN
5: SET optimizer=off;
SET
-- suspend before get 'wait gxid'
5: SELECT gp_inject_fault('before_get_distributed_xid', 'suspend', dbid) FROM gp_segment_configuration WHERE role='p' AND content=1;
 gp_inject_fault 
-----------------
 Success:        
(1 row)
5&: UPDATE t_concurrent_update SET b=b+10 WHERE a=1;  <waiting ...>

6: SELECT gp_wait_until_triggered_fault('before_get_distributed_xid', 1, dbid) FROM gp_segment_configuration WHERE role='p' AND content=1;
 gp_wait_until_triggered_fault 
-------------------------------
 Success:                      
(1 row)
4: END;
END
4: SELECT gp_inject_fault('before_get_distributed_xid', 'reset', dbid) FROM gp_segment_configuration WHERE role='p' AND content=1;
 gp_inject_fault 
-----------------
 Success:        
(1 row)

5<:  <... completed>
UPDATE 1
5: END;
END
6: SELECT * FROM t_concurrent_update;
 a | b  
---+----
 1 | 41 
(1 row)
6: DROP TABLE t_concurrent_update;
DROP
4q: ... <quitting>
5q: ... <quitting>
6q: ... <quitting>

--start_ignore
! gpconfig -r gp_enable_global_deadlock_detector;
20200305:08:04:46:016977 gpconfig:09c5497cf854:gpadmin-[INFO]:-completed successfully with parameters '-r gp_enable_global_deadlock_detector'

! gpstop -rai;
20200305:08:04:47:017053 gpstop:09c5497cf854:gpadmin-[INFO]:-Starting gpstop with args: -rai
20200305:08:04:47:017053 gpstop:09c5497cf854:gpadmin-[INFO]:-Gathering information and validating the environment...
20200305:08:04:47:017053 gpstop:09c5497cf854:gpadmin-[INFO]:-Obtaining Greenplum Master catalog information
20200305:08:04:47:017053 gpstop:09c5497cf854:gpadmin-[INFO]:-Obtaining Segment details from master...
20200305:08:04:47:017053 gpstop:09c5497cf854:gpadmin-[INFO]:-Greenplum Version: 'postgres (Greenplum Database) 7.0.0-alpha.0+dev.5622.g0cc5452d2bc build dev'
20200305:08:04:47:017053 gpstop:09c5497cf854:gpadmin-[INFO]:-Commencing Master instance shutdown with mode='immediate'
20200305:08:04:47:017053 gpstop:09c5497cf854:gpadmin-[INFO]:-Master segment instance directory=/home/gpadmin/workspace/gpdb5/gpAux/gpdemo/datadirs/qddir/demoDataDir-1
20200305:08:04:47:017053 gpstop:09c5497cf854:gpadmin-[INFO]:-Attempting forceful termination of any leftover master process
20200305:08:04:47:017053 gpstop:09c5497cf854:gpadmin-[INFO]:-Terminating processes for segment /home/gpadmin/workspace/gpdb5/gpAux/gpdemo/datadirs/qddir/demoDataDir-1
20200305:08:04:47:017053 gpstop:09c5497cf854:gpadmin-[INFO]:-Stopping master standby host 09c5497cf854 mode=immediate
20200305:08:04:47:017053 gpstop:09c5497cf854:gpadmin-[INFO]:-Successfully shutdown standby process on 09c5497cf854
20200305:08:04:47:017053 gpstop:09c5497cf854:gpadmin-[INFO]:-Targeting dbid [2, 5, 3, 6, 4, 7] for shutdown
20200305:08:04:47:017053 gpstop:09c5497cf854:gpadmin-[INFO]:-Commencing parallel primary segment instance shutdown, please wait...
20200305:08:04:47:017053 gpstop:09c5497cf854:gpadmin-[INFO]:-0.00% of jobs completed
20200305:08:04:47:017053 gpstop:09c5497cf854:gpadmin-[INFO]:-100.00% of jobs completed
20200305:08:04:47:017053 gpstop:09c5497cf854:gpadmin-[INFO]:-Commencing parallel mirror segment instance shutdown, please wait...
20200305:08:04:47:017053 gpstop:09c5497cf854:gpadmin-[INFO]:-0.00% of jobs completed
20200305:08:04:48:017053 gpstop:09c5497cf854:gpadmin-[INFO]:-100.00% of jobs completed
20200305:08:04:48:017053 gpstop:09c5497cf854:gpadmin-[INFO]:-----------------------------------------------------
20200305:08:04:48:017053 gpstop:09c5497cf854:gpadmin-[INFO]:-   Segments stopped successfully      = 6
20200305:08:04:48:017053 gpstop:09c5497cf854:gpadmin-[INFO]:-   Segments with errors during stop   = 0
20200305:08:04:48:017053 gpstop:09c5497cf854:gpadmin-[INFO]:-----------------------------------------------------
20200305:08:04:48:017053 gpstop:09c5497cf854:gpadmin-[INFO]:-Successfully shutdown 6 of 6 segment instances 
20200305:08:04:48:017053 gpstop:09c5497cf854:gpadmin-[INFO]:-Database successfully shutdown with no errors reported
20200305:08:04:48:017053 gpstop:09c5497cf854:gpadmin-[INFO]:-Cleaning up leftover shared memory
20200305:08:04:48:017053 gpstop:09c5497cf854:gpadmin-[INFO]:-Restarting System...

--end_ignore
