-- start_matchsubs
-- m/nodeModifyTable.c:\d+/
-- s/nodeModifyTable.c:\d+/nodeModifyTable.c:XXX/
-- end_matchsubs

-- start_ignore
drop table tab1;
DROP
drop table tab2;
DROP
drop table tab3;
DROP
-- end_ignore

-- We do some check to verify the tuple to delete|update
-- is from the segment it scans out. This case is to test
-- such check.
-- We build a plan that will add motion above result relation,
-- however, does not contain explicit motion to send tuples back,
-- and then login in segment using utility mode to insert some
-- bad data.
-- Then we carefully build some plans for orca and planner,
-- when reading these test cases, pay attention to the bad tuple
-- and see if it is motioned to other segments.

create table tab1(a int, b int) distributed by (b);
CREATE
create table tab2(a int, b int) distributed by (a);
CREATE
create table tab3 (a int, b int) distributed by (b);
CREATE

insert into tab1 values (1, 1);
INSERT 1
insert into tab2 values (1, 1);
INSERT 1
insert into tab3 values (1, 1);
INSERT 1

set allow_system_table_mods=true;
SET
update pg_class set relpages = 10000 where relname='tab2';
UPDATE 1
update pg_class set reltuples = 100000000 where relname='tab2';
UPDATE 1
update pg_class set relpages = 100000000 where relname='tab3';
UPDATE 1
update pg_class set reltuples = 100000 where relname='tab3';
UPDATE 1

0U: insert into tab1 values (1, 1);
INSERT 1

select gp_segment_id, * from tab1;
 gp_segment_id | a | b 
---------------+---+---
 1             | 1 | 1 
 0             | 1 | 1 
(2 rows)

-- For planner, this will error out
explain (costs off) delete from tab1 using tab2, tab3 where tab1.a = tab2.a and tab1.b = tab3.b;
 QUERY PLAN                                                                         
------------------------------------------------------------------------------------
 Delete on tab1                                                                     
   ->  Hash Join                                                                    
         Hash Cond: (tab3.b = tab1.b)                                               
         ->  Seq Scan on tab3                                                       
         ->  Hash                                                                   
               ->  Redistribute Motion 3:3  (slice1; segments: 3)                   
                     Hash Key: tab1.b                                               
                     ->  Hash Join                                                  
                           Hash Cond: (tab2.a = tab1.a)                             
                           ->  Seq Scan on tab2                                     
                           ->  Hash                                                 
                                 ->  Redistribute Motion 3:3  (slice2; segments: 3) 
                                       Hash Key: tab1.a                             
                                       ->  Seq Scan on tab1                         
 Optimizer: Postgres query optimizer                                                
(15 rows)
begin;
BEGIN
delete from tab1 using tab2, tab3 where tab1.a = tab2.a and tab1.b = tab3.b;
ERROR:  distribution key of the tuple (0, 1) doesn't belong to current segment (actually from seg0) (nodeModifyTable.c:735)  (seg1 127.0.1.1:7003 pid=89508) (nodeModifyTable.c:735)
abort;
ABORT

-- For planner, this will error out
explain (costs off) update tab1 set a = 999 from tab2, tab3 where tab1.a = tab2.a and tab1.b = tab3.b;
 QUERY PLAN                                                                         
------------------------------------------------------------------------------------
 Update on tab1                                                                     
   ->  Hash Join                                                                    
         Hash Cond: (tab3.b = tab1.b)                                               
         ->  Seq Scan on tab3                                                       
         ->  Hash                                                                   
               ->  Redistribute Motion 3:3  (slice1; segments: 3)                   
                     Hash Key: tab1.b                                               
                     ->  Hash Join                                                  
                           Hash Cond: (tab2.a = tab1.a)                             
                           ->  Seq Scan on tab2                                     
                           ->  Hash                                                 
                                 ->  Redistribute Motion 3:3  (slice2; segments: 3) 
                                       Hash Key: tab1.a                             
                                       ->  Seq Scan on tab1                         
 Optimizer: Postgres query optimizer                                                
(15 rows)
begin;
BEGIN
update tab1 set a = 999 from tab2, tab3 where tab1.a = tab2.a and tab1.b = tab3.b;
ERROR:  distribution key of the tuple (0, 1) doesn't belong to current segment (actually from seg0) (nodeModifyTable.c:1276)  (seg1 127.0.1.1:7003 pid=89508) (nodeModifyTable.c:1276)
abort;
ABORT

-- For orca, this will error out
explain (costs off) delete from tab1 using tab2, tab3 where tab1.a = tab2.a and tab1.b = tab3.a;
 QUERY PLAN                                                                               
------------------------------------------------------------------------------------------
 Delete on tab1                                                                           
   ->  Explicit Redistribute Motion 3:3  (slice1; segments: 3)                            
         ->  Hash Join                                                                    
               Hash Cond: (tab3.a = tab1.b)                                               
               ->  Seq Scan on tab3                                                       
               ->  Hash                                                                   
                     ->  Broadcast Motion 3:3  (slice2; segments: 3)                      
                           ->  Hash Join                                                  
                                 Hash Cond: (tab2.a = tab1.a)                             
                                 ->  Seq Scan on tab2                                     
                                 ->  Hash                                                 
                                       ->  Redistribute Motion 3:3  (slice3; segments: 3) 
                                             Hash Key: tab1.a                             
                                             ->  Seq Scan on tab1                         
 Optimizer: Postgres query optimizer                                                      
(15 rows)
begin;
BEGIN
delete from tab1 using tab2, tab3 where tab1.a = tab2.a and tab1.b = tab3.a;
DELETE 2
abort;
ABORT

-- For orca, this will error out
explain (costs off) update tab1 set a = 999 from tab2, tab3 where tab1.a = tab2.a and tab1.b = tab3.a;
 QUERY PLAN                                                                               
------------------------------------------------------------------------------------------
 Update on tab1                                                                           
   ->  Explicit Redistribute Motion 3:3  (slice1; segments: 3)                            
         ->  Hash Join                                                                    
               Hash Cond: (tab3.a = tab1.b)                                               
               ->  Seq Scan on tab3                                                       
               ->  Hash                                                                   
                     ->  Broadcast Motion 3:3  (slice2; segments: 3)                      
                           ->  Hash Join                                                  
                                 Hash Cond: (tab2.a = tab1.a)                             
                                 ->  Seq Scan on tab2                                     
                                 ->  Hash                                                 
                                       ->  Redistribute Motion 3:3  (slice3; segments: 3) 
                                             Hash Key: tab1.a                             
                                             ->  Seq Scan on tab1                         
 Optimizer: Postgres query optimizer                                                      
(15 rows)
begin;
BEGIN
update tab1 set a = 999 from tab2, tab3 where tab1.a = tab2.a and tab1.b = tab3.a;
UPDATE 2
abort;
ABORT

-- test splitupdate.
-- For orca, the plan contains a redistribute motion, so that
-- this following statement will error out.
-- For planner, the plan is using explicit redistribute motion,
-- the to-delete tuple is set to send back where it is from, so
-- it will not error out.
explain (costs off) update tab1 set b = b + 1;
 QUERY PLAN                                                    
---------------------------------------------------------------
 Update on tab1                                                
   ->  Explicit Redistribute Motion 3:3  (slice1; segments: 3) 
         ->  Split                                             
               ->  Seq Scan on tab1                            
 Optimizer: Postgres query optimizer                           
(5 rows)
begin;
BEGIN
update tab1 set b = b + 1;
UPDATE 2
abort;
ABORT

drop table tab1;
DROP
drop table tab2;
DROP
drop table tab3;
DROP
