-- start_matchsubs
--
-- # create a match/subs expression
--
-- m/ERROR:.*server closed the connection unexpectedly/
-- s/ERROR:.*server closed the connection unexpectedly/ERROR: server closed the connection unexpectedly/gm
-- end_matchsubs
3:CREATE extension if NOT EXISTS gp_inject_fault;
CREATE
--
-- Test to validate crash at different points in AO/CO vacuum.
--
-- Setup tables to test crash at different points
-- for crash_before_cleanup_phase
3:set gp_default_storage_options="appendonly=true,orientation=row";
SET
3:show gp_default_storage_options;
gp_default_storage_options                                                     
-------------------------------------------------------------------------------
appendonly=true,blocksize=32768,compresstype=none,checksum=true,orientation=row
(1 row)
3:DROP TABLE IF EXISTS crash_before_cleanup_phase CASCADE;
DROP
3:CREATE TABLE crash_before_cleanup_phase (a INT, b INT, c CHAR(20));
CREATE
3:CREATE INDEX crash_before_cleanup_phase_index ON crash_before_cleanup_phase(b);
CREATE
3:INSERT INTO crash_before_cleanup_phase SELECT i AS a, 1 AS b, 'hello world' AS c FROM generate_series(1, 10) AS i;
INSERT 10
3:DELETE FROM crash_before_cleanup_phase WHERE a < 4;
DELETE 3
-- for crash_before_segmentfile_drop
3:DROP TABLE IF	EXISTS crash_before_segmentfile_drop CASCADE;
DROP
3:CREATE TABLE crash_before_segmentfile_drop (a INT, b INT, c CHAR(20));
CREATE
3:CREATE INDEX crash_before_segmentfile_drop_index ON crash_before_segmentfile_drop(b);
CREATE
3:INSERT INTO crash_before_segmentfile_drop SELECT i AS a, 1 AS b, 'hello world' AS c FROM generate_series(1, 10) AS i;
INSERT 10
3:DELETE FROM crash_before_segmentfile_drop WHERE a < 4;
DELETE 3
-- for crash_vacuum_in_appendonly_insert
3:DROP TABLE IF EXISTS crash_vacuum_in_appendonly_insert CASCADE;
DROP
3:CREATE TABLE crash_vacuum_in_appendonly_insert (a INT, b INT, c CHAR(20));
CREATE
3:CREATE INDEX crash_vacuum_in_appendonly_insert_index ON crash_vacuum_in_appendonly_insert(b);
CREATE
3:INSERT INTO crash_vacuum_in_appendonly_insert SELECT i AS a, 1 AS b, 'hello world' AS c FROM generate_series(1, 10) AS i;
INSERT 10
3:UPDATE crash_vacuum_in_appendonly_insert SET b = 2;
UPDATE 10

-- suspend at intended points
3:SELECT gp_inject_fault('compaction_before_cleanup_phase', 'suspend', '', '', 'crash_before_cleanup_phase', 0, 0, 2);
gp_inject_fault
---------------
t              
(1 row)
1&:VACUUM crash_before_cleanup_phase;  <waiting ...>
3:SELECT gp_inject_fault('compaction_before_segmentfile_drop', 'suspend', '', '', 'crash_before_segmentfile_drop', 0, 0, 2);
gp_inject_fault
---------------
t              
(1 row)
2&:VACUUM crash_before_segmentfile_drop;  <waiting ...>
3:SELECT gp_inject_fault('appendonly_insert', 'panic', '', '', 'crash_vacuum_in_appendonly_insert', 0, 0, 2);
gp_inject_fault
---------------
t              
(1 row)

-- wait for suspend faults to trigger and then proceed to run next
-- command which would trigger panic fault and help test
-- crash_recovery
3:SELECT gp_inject_fault('compaction_before_cleanup_phase', 'wait_until_triggered', '', '', 'crash_before_cleanup_phase', 0, 0, 2);
gp_inject_fault
---------------
t              
(1 row)
3:SELECT gp_inject_fault('compaction_before_segmentfile_drop', 'wait_until_triggered', '', '', 'crash_before_segmentfile_drop', 0, 0, 2);
gp_inject_fault
---------------
t              
(1 row)
3:VACUUM crash_vacuum_in_appendonly_insert;
ERROR:  fault triggered, fault name:'appendonly_insert' fault type:'panic'  (seg0 127.0.1.1:25432 pid=9756)
ERROR:  could not connect to segment: initialization of segworker group failed
1<:  <... completed>
ERROR:  Error on receive from seg0 127.0.1.1:25432 pid=9768: server closed the connection unexpectedly
DETAIL:  
	This probably means the server terminated abnormally
	before or while processing the request.
ERROR:  could not connect to segment: initialization of segworker group failed
2<:  <... completed>
ERROR:  Error on receive from seg0 127.0.1.1:25432 pid=9779: server closed the connection unexpectedly
DETAIL:  
	This probably means the server terminated abnormally
	before or while processing the request.
ERROR:  could not connect to segment: initialization of segworker group failed

-- wait for segment to complete recovering
0U: SELECT 1;
?column?
--------
1       
(1 row)

-- reset faults as protection incase tests failed and panic didn't happen
1:SELECT gp_inject_fault('compaction_before_cleanup_phase', 'reset', '', '', '', 0, 0, 2);
gp_inject_fault
---------------
t              
(1 row)
1:SELECT gp_inject_fault('compaction_before_segmentfile_drop', 'reset', '', '', '', 0, 0, 2);
gp_inject_fault
---------------
t              
(1 row)
1:SELECT gp_inject_fault('appendonly_insert', 'reset', '', '', '', 0, 0, 2);
gp_inject_fault
---------------
t              
(1 row)

-- perform post crash validation checks
-- for crash_before_cleanup_phase
1:INSERT INTO crash_before_cleanup_phase VALUES(1, 1, 'c'), (25, 6, 'c');
INSERT 2
1:UPDATE crash_before_cleanup_phase SET b = b+10 WHERE a=25;
UPDATE 1
1:SELECT * FROM crash_before_cleanup_phase ORDER BY a,b;
a |b |c                   
--+--+--------------------
1 |1 |c                   
4 |1 |hello world         
5 |1 |hello world         
6 |1 |hello world         
7 |1 |hello world         
8 |1 |hello world         
9 |1 |hello world         
10|1 |hello world         
25|16|c                   
(9 rows)
1:SELECT * FROM gp_toolkit.__gp_aoseg_name('crash_before_cleanup_phase');
segno|eof|tupcount|varblockcount|eof_uncompressed|modcount|formatversion|state
-----+---+--------+-------------+----------------+--------+-------------+-----
1    |0  |6       |0            |0               |4       |3            |1    
2    |0  |4       |0            |0               |0       |3            |1    
(2 rows)
1:VACUUM crash_before_cleanup_phase;
VACUUM
1:SELECT * FROM gp_toolkit.__gp_aoseg_name('crash_before_cleanup_phase');
segno|eof|tupcount|varblockcount|eof_uncompressed|modcount|formatversion|state
-----+---+--------+-------------+----------------+--------+-------------+-----
1    |0  |1       |0            |0               |4       |3            |1    
2    |0  |4       |0            |0               |0       |3            |1    
3    |0  |4       |0            |0               |0       |3            |1    
(3 rows)
1:INSERT INTO crash_before_cleanup_phase VALUES(21, 1, 'c'), (26, 1, 'c');
INSERT 2
1:UPDATE crash_before_cleanup_phase SET b = b+10 WHERE a=26;
UPDATE 1
1:SELECT * FROM crash_before_cleanup_phase ORDER BY a,b;
a |b |c                   
--+--+--------------------
1 |1 |c                   
4 |1 |hello world         
5 |1 |hello world         
6 |1 |hello world         
7 |1 |hello world         
8 |1 |hello world         
9 |1 |hello world         
10|1 |hello world         
21|1 |c                   
25|16|c                   
26|11|c                   
(11 rows)
-- for crash_before_segmentfile_drop
1:INSERT INTO crash_before_segmentfile_drop VALUES(1, 1, 'c'), (25, 6, 'c');
INSERT 2
1:UPDATE crash_before_segmentfile_drop SET b = b+10 WHERE a=25;
UPDATE 1
1:SELECT * FROM crash_before_segmentfile_drop ORDER BY a,b;
a |b |c                   
--+--+--------------------
1 |1 |c                   
4 |1 |hello world         
5 |1 |hello world         
6 |1 |hello world         
7 |1 |hello world         
8 |1 |hello world         
9 |1 |hello world         
10|1 |hello world         
25|16|c                   
(9 rows)
1:SELECT * FROM gp_toolkit.__gp_aoseg_name('crash_before_segmentfile_drop');
segno|eof|tupcount|varblockcount|eof_uncompressed|modcount|formatversion|state
-----+---+--------+-------------+----------------+--------+-------------+-----
1    |0  |10      |0            |0               |2       |3            |1    
2    |0  |7       |0            |0               |2       |3            |1    
(2 rows)
1:VACUUM crash_before_segmentfile_drop;
VACUUM
1:SELECT * FROM gp_toolkit.__gp_aoseg_name('crash_before_segmentfile_drop');
segno|eof|tupcount|varblockcount|eof_uncompressed|modcount|formatversion|state
-----+---+--------+-------------+----------------+--------+-------------+-----
1    |0  |3       |0            |0               |2       |3            |1    
2    |0  |5       |0            |0               |2       |3            |1    
3    |0  |1       |0            |0               |0       |3            |1    
(3 rows)
1:INSERT INTO crash_before_segmentfile_drop VALUES(21, 1, 'c'), (26, 1, 'c');
INSERT 2
1:UPDATE crash_before_segmentfile_drop SET b = b+10 WHERE a=26;
UPDATE 1
1:SELECT * FROM crash_before_segmentfile_drop ORDER BY a,b;
a |b |c                   
--+--+--------------------
1 |1 |c                   
4 |1 |hello world         
5 |1 |hello world         
6 |1 |hello world         
7 |1 |hello world         
8 |1 |hello world         
9 |1 |hello world         
10|1 |hello world         
21|1 |c                   
25|16|c                   
26|11|c                   
(11 rows)
-- crash_vacuum_in_appendonly_insert
1:SELECT * FROM gp_toolkit.__gp_aoseg_name('crash_vacuum_in_appendonly_insert');
segno|eof|tupcount|varblockcount|eof_uncompressed|modcount|formatversion|state
-----+---+--------+-------------+----------------+--------+-------------+-----
1    |0  |20      |0            |0               |2       |3            |1    
(1 row)
1:VACUUM crash_vacuum_in_appendonly_insert;
VACUUM
1:SELECT * FROM gp_toolkit.__gp_aoseg_name('crash_vacuum_in_appendonly_insert');
segno|eof|tupcount|varblockcount|eof_uncompressed|modcount|formatversion|state
-----+---+--------+-------------+----------------+--------+-------------+-----
1    |0  |0       |0            |0               |2       |3            |1    
2    |0  |10      |0            |0               |0       |3            |1    
(2 rows)
1:INSERT INTO crash_vacuum_in_appendonly_insert VALUES(21, 1, 'c'), (26, 1, 'c');
INSERT 2
1:UPDATE crash_vacuum_in_appendonly_insert SET b = b+10 WHERE a=26;
UPDATE 1
1:SELECT * FROM crash_vacuum_in_appendonly_insert ORDER BY a,b;
a |b |c                   
--+--+--------------------
1 |2 |hello world         
2 |2 |hello world         
3 |2 |hello world         
4 |2 |hello world         
5 |2 |hello world         
6 |2 |hello world         
7 |2 |hello world         
8 |2 |hello world         
9 |2 |hello world         
10|2 |hello world         
21|1 |c                   
26|11|c                   
(12 rows)

--
-- Setup tables to test crash at different points on master now
--
-- for crash_master_before_cleanup_phase
2:set gp_default_storage_options="appendonly=true,orientation=row";
SET
2:show gp_default_storage_options;
gp_default_storage_options                                                     
-------------------------------------------------------------------------------
appendonly=true,blocksize=32768,compresstype=none,checksum=true,orientation=row
(1 row)
2:DROP TABLE IF EXISTS crash_master_before_cleanup_phase CASCADE;
DROP
2:CREATE TABLE crash_master_before_cleanup_phase (a INT, b INT, c CHAR(20));
CREATE
2:CREATE INDEX crash_master_before_cleanup_phase_index ON crash_master_before_cleanup_phase(b);
CREATE
2:INSERT INTO crash_master_before_cleanup_phase SELECT i AS a, 1 AS b, 'hello world' AS c FROM generate_series(1, 10) AS i;
INSERT 10
2:DELETE FROM crash_master_before_cleanup_phase WHERE a < 4;
DELETE 3
-- for crash_master_before_segmentfile_drop
2:DROP TABLE IF EXISTS crash_master_before_segmentfile_drop CASCADE;
DROP
2:CREATE TABLE crash_master_before_segmentfile_drop (a INT, b INT, c CHAR(20));
CREATE
2:CREATE INDEX crash_master_before_segmentfile_drop_index ON crash_master_before_segmentfile_drop(b);
CREATE
2:INSERT INTO crash_master_before_segmentfile_drop SELECT i AS a, 1 AS b, 'hello world' AS c FROM generate_series(1, 10) AS i;
INSERT 10
2:DELETE FROM crash_master_before_segmentfile_drop WHERE a < 4;
DELETE 3

-- suspend at intended points
2:SELECT gp_inject_fault('compaction_before_cleanup_phase', 'suspend', '', '', 'crash_master_before_cleanup_phase', 0, 0, 1);
gp_inject_fault
---------------
t              
(1 row)
1&:VACUUM crash_master_before_cleanup_phase;  <waiting ...>
2:SELECT gp_inject_fault('compaction_before_segmentfile_drop', 'panic', '', '', 'crash_master_before_segmentfile_drop', 0, 0, 1);
gp_inject_fault
---------------
t              
(1 row)

-- wait for suspend faults to trigger and then proceed to run next
-- command which would trigger panic fault and help test
-- crash_recovery
SELECT gp_inject_fault('compaction_before_cleanup_phase', 'wait_until_triggered', '', '', 'crash_master_before_cleanup_phase', 0, 0, 1);
gp_inject_fault
---------------
t              
(1 row)
2:VACUUM crash_master_before_segmentfile_drop;
PANIC:  fault triggered, fault name:'compaction_before_segmentfile_drop' fault type:'panic'
server closed the connection unexpectedly
	This probably means the server terminated abnormally
	before or while processing the request.
1<:  <... completed>
server closed the connection unexpectedly
	This probably means the server terminated abnormally
	before or while processing the request.

-- reset faults as protection incase tests failed and panic didn't happen
4:SELECT gp_inject_fault('compaction_before_cleanup_phase', 'reset', '', '', '', 0, 0, 1);
gp_inject_fault
---------------
t              
(1 row)
4:SELECT gp_inject_fault('compaction_before_segmentfile_drop', 'reset', '', '', '', 0, 0, 1);
gp_inject_fault
---------------
t              
(1 row)

-- perform post crash validation checks
-- for crash_master_before_cleanup_phase
4:INSERT INTO crash_master_before_cleanup_phase VALUES(1, 1, 'c'), (25, 6, 'c');
INSERT 2
4:UPDATE crash_master_before_cleanup_phase SET b = b+10 WHERE a=25;
UPDATE 1
4:SELECT * FROM crash_master_before_cleanup_phase ORDER BY a,b;
a |b |c                   
--+--+--------------------
1 |1 |c                   
4 |1 |hello world         
5 |1 |hello world         
6 |1 |hello world         
7 |1 |hello world         
8 |1 |hello world         
9 |1 |hello world         
10|1 |hello world         
25|16|c                   
(9 rows)
4:SELECT * FROM gp_toolkit.__gp_aoseg_name('crash_master_before_cleanup_phase');
segno|eof|tupcount|varblockcount|eof_uncompressed|modcount|formatversion|state
-----+---+--------+-------------+----------------+--------+-------------+-----
1    |0  |6       |0            |0               |4       |3            |1    
2    |0  |4       |0            |0               |0       |3            |1    
(2 rows)
4:VACUUM crash_master_before_cleanup_phase;
VACUUM
4:SELECT * FROM gp_toolkit.__gp_aoseg_name('crash_master_before_cleanup_phase');
segno|eof|tupcount|varblockcount|eof_uncompressed|modcount|formatversion|state
-----+---+--------+-------------+----------------+--------+-------------+-----
1    |0  |1       |0            |0               |4       |3            |1    
2    |0  |4       |0            |0               |0       |3            |1    
3    |0  |4       |0            |0               |0       |3            |1    
(3 rows)
4:INSERT INTO crash_master_before_cleanup_phase VALUES(21, 1, 'c'), (26, 1, 'c');
INSERT 2
4:UPDATE crash_master_before_cleanup_phase SET b = b+10 WHERE a=26;
UPDATE 1
4:SELECT * FROM crash_master_before_cleanup_phase ORDER BY a,b;
a |b |c                   
--+--+--------------------
1 |1 |c                   
4 |1 |hello world         
5 |1 |hello world         
6 |1 |hello world         
7 |1 |hello world         
8 |1 |hello world         
9 |1 |hello world         
10|1 |hello world         
21|1 |c                   
25|16|c                   
26|11|c                   
(11 rows)
-- for crash_master_before_segmentfile_drop
4:INSERT INTO crash_master_before_segmentfile_drop VALUES(1, 1, 'c'), (25, 6, 'c');
INSERT 2
4:UPDATE crash_master_before_segmentfile_drop SET b = b+10 WHERE a=25;
UPDATE 1
4:SELECT * FROM crash_master_before_segmentfile_drop ORDER BY a,b;
a |b |c                   
--+--+--------------------
1 |1 |c                   
4 |1 |hello world         
5 |1 |hello world         
6 |1 |hello world         
7 |1 |hello world         
8 |1 |hello world         
9 |1 |hello world         
10|1 |hello world         
25|16|c                   
(9 rows)
4:SELECT * FROM gp_toolkit.__gp_aoseg_name('crash_master_before_segmentfile_drop');
segno|eof|tupcount|varblockcount|eof_uncompressed|modcount|formatversion|state
-----+---+--------+-------------+----------------+--------+-------------+-----
1    |0  |10      |0            |0               |2       |3            |1    
2    |0  |7       |0            |0               |2       |3            |1    
(2 rows)
4:VACUUM crash_master_before_segmentfile_drop;
VACUUM
4:SELECT * FROM gp_toolkit.__gp_aoseg_name('crash_master_before_segmentfile_drop');
segno|eof|tupcount|varblockcount|eof_uncompressed|modcount|formatversion|state
-----+---+--------+-------------+----------------+--------+-------------+-----
1    |0  |3       |0            |0               |2       |3            |1    
2    |0  |5       |0            |0               |2       |3            |1    
3    |0  |1       |0            |0               |0       |3            |1    
(3 rows)
4:INSERT INTO crash_master_before_segmentfile_drop VALUES(21, 1, 'c'), (26, 1, 'c');
INSERT 2
4:UPDATE crash_master_before_segmentfile_drop SET b = b+10 WHERE a=26;
UPDATE 1
4:SELECT * FROM crash_master_before_segmentfile_drop ORDER BY a,b;
a |b |c                   
--+--+--------------------
1 |1 |c                   
4 |1 |hello world         
5 |1 |hello world         
6 |1 |hello world         
7 |1 |hello world         
8 |1 |hello world         
9 |1 |hello world         
10|1 |hello world         
21|1 |c                   
25|16|c                   
26|11|c                   
(11 rows)
