-- start_matchsubs
--
-- # create a match/subs expression
--
-- m/ERROR:.*server closed the connection unexpectedly/
-- s/ERROR:.*server closed the connection unexpectedly/ERROR: server closed the connection unexpectedly/gm
-- end_matchsubs
3:SELECT role, preferred_role, content, mode, status FROM gp_segment_configuration;
 role | preferred_role | content | mode | status 
------+----------------+---------+------+--------
 m    | m              | -1      | s    | u      
 m    | m              | 0       | s    | u      
 m    | m              | 1       | s    | u      
 m    | m              | 2       | s    | u      
 p    | p              | -1      | n    | u      
 p    | p              | 0       | s    | u      
 p    | p              | 1       | s    | u      
 p    | p              | 2       | s    | u      
(8 rows)
--
-- Test to validate crash at different points in AO/CO vacuum.
--
-- Setup tables to test crash at different points
-- for crash_before_cleanup_phase
3:set default_table_access_method = ao_row;
SET
3:show default_table_access_method;
 default_table_access_method 
-----------------------------
 ao_row                      
(1 row)
3:DROP TABLE IF EXISTS crash_before_cleanup_phase CASCADE;
DROP
3:CREATE TABLE crash_before_cleanup_phase (a INT, b INT, c CHAR(20));
CREATE
3:CREATE INDEX crash_before_cleanup_phase_index ON crash_before_cleanup_phase(b);
CREATE
3:INSERT INTO crash_before_cleanup_phase SELECT i AS a, 1 AS b, 'hello world' AS c FROM generate_series(1, 10) AS i;
INSERT 10
3:DELETE FROM crash_before_cleanup_phase WHERE a < 4;
DELETE 3
-- for crash_vacuum_in_appendonly_insert
3:DROP TABLE IF EXISTS crash_vacuum_in_appendonly_insert CASCADE;
DROP
3:CREATE TABLE crash_vacuum_in_appendonly_insert (a INT, b INT, c CHAR(20));
CREATE
3:CREATE INDEX crash_vacuum_in_appendonly_insert_index ON crash_vacuum_in_appendonly_insert(b);
CREATE
3:INSERT INTO crash_vacuum_in_appendonly_insert SELECT i AS a, 1 AS b, 'hello world' AS c FROM generate_series(1, 10) AS i;
INSERT 10
3:UPDATE crash_vacuum_in_appendonly_insert SET b = 2;
UPDATE 10

-- suspend at intended points.
3:SELECT gp_inject_fault('compaction_before_cleanup_phase', 'suspend', '', '', 'crash_before_cleanup_phase', 1, -1, 0, 2);
 gp_inject_fault 
-----------------
 Success:        
(1 row)
1&:VACUUM crash_before_cleanup_phase;  <waiting ...>
3:SELECT gp_wait_until_triggered_fault('compaction_before_cleanup_phase', 1, 2);
 gp_wait_until_triggered_fault 
-------------------------------
 Success:                      
(1 row)

-- we already waited for suspend faults to trigger and hence we can proceed to
-- run next command which would trigger panic fault and help test
-- crash_recovery
3:SELECT gp_inject_fault('appendonly_insert', 'panic', '', '', 'crash_vacuum_in_appendonly_insert', 1, -1, 0, 2);
 gp_inject_fault 
-----------------
 Success:        
(1 row)
3:VACUUM crash_vacuum_in_appendonly_insert;
ERROR:  fault triggered, fault name:'appendonly_insert' fault type:'panic'  (seg0 127.0.0.1:25432 pid=21369)
1<:  <... completed>
ERROR:  Error on receive from seg0 127.0.0.1:7002 pid=15584: server closed the connection unexpectedly
	This probably means the server terminated abnormally
	before or while processing the request.

-- wait for segment to complete recovering
0U: SELECT 1;
 ?column? 
----------
 1        
(1 row)

-- reset faults as protection incase tests failed and panic didn't happen
1:SELECT gp_inject_fault('compaction_before_cleanup_phase', 'reset', 2);
 gp_inject_fault 
-----------------
 Success:        
(1 row)
1:SELECT gp_inject_fault('appendonly_insert', 'reset', 2);
 gp_inject_fault 
-----------------
 Success:        
(1 row)

-- perform post crash validation checks
-- for crash_before_cleanup_phase
-- the compaction should be done, but the post-cleanup should not be performed,
-- so awaiting-dropping segment file should exists in the pg_aoseg* catalog on
-- seg0, however, the status on the seg1 is undetermined, any concurrent trans
-- will delay the dropping of dead segment files.
1:SELECT * FROM gp_toolkit.__gp_aoseg('crash_before_cleanup_phase') where segment_id = 0;
 segment_id | segno | eof | tupcount | varblockcount | eof_uncompressed | modcount | formatversion | state 
------------+-------+-----+----------+---------------+------------------+----------+---------------+-------
 0          | 1     | 248 | 5        | 1             | 248              | 2        | 3             | 2     
 0          | 2     | 160 | 3        | 1             | 160              | 0        | 3             | 1     
(2 rows)
-- do vacuum again, there should be no await-dropping segment files, no concurrent
-- transactions exist this time when the VACUUM is performed.
1:VACUUM crash_before_cleanup_phase;
VACUUM
1:SELECT * FROM gp_toolkit.__gp_aoseg('crash_before_cleanup_phase');
 segment_id | segno | eof | tupcount | varblockcount | eof_uncompressed | modcount | formatversion | state 
------------+-------+-----+----------+---------------+------------------+----------+---------------+-------
 0          | 1     | 0   | 0        | 0             | 0                | 2        | 3             | 1     
 0          | 2     | 160 | 3        | 1             | 160              | 0        | 3             | 1     
 1          | 1     | 0   | 0        | 0             | 0                | 2        | 3             | 1     
 1          | 2     | 0   | 0        | 0             | 0                | 0        | 3             | 1     
 2          | 1     | 200 | 4        | 1             | 200              | 1        | 3             | 1     
(5 rows)
1:INSERT INTO crash_before_cleanup_phase VALUES(1, 1, 'c'), (25, 6, 'c');
INSERT 2
1:UPDATE crash_before_cleanup_phase SET b = b+10 WHERE a=25;
UPDATE 1
1:SELECT * FROM crash_before_cleanup_phase ORDER BY a,b;
 a  | b  | c                    
----+----+----------------------
 1  | 1  | c                    
 4  | 1  | hello world          
 5  | 1  | hello world          
 6  | 1  | hello world          
 7  | 1  | hello world          
 8  | 1  | hello world          
 9  | 1  | hello world          
 10 | 1  | hello world          
 25 | 16 | c                    
(9 rows)
1:SELECT * FROM gp_toolkit.__gp_aoseg('crash_before_cleanup_phase');
 segment_id | segno | eof | tupcount | varblockcount | eof_uncompressed | modcount | formatversion | state 
------------+-------+-----+----------+---------------+------------------+----------+---------------+-------
 0          | 1     | 0   | 0        | 0             | 0                | 2        | 3             | 1     
 0          | 2     | 160 | 3        | 1             | 160              | 0        | 3             | 1     
 1          | 1     | 64  | 1        | 1             | 64               | 3        | 3             | 1     
 1          | 2     | 0   | 0        | 0             | 0                | 0        | 3             | 1     
 2          | 1     | 328 | 6        | 3             | 328              | 3        | 3             | 1     
(5 rows)
1:VACUUM crash_before_cleanup_phase;
VACUUM
1:SELECT * FROM gp_toolkit.__gp_aoseg('crash_before_cleanup_phase');
 segment_id | segno | eof | tupcount | varblockcount | eof_uncompressed | modcount | formatversion | state 
------------+-------+-----+----------+---------------+------------------+----------+---------------+-------
 0          | 1     | 0   | 0        | 0             | 0                | 2        | 3             | 1     
 0          | 2     | 160 | 3        | 1             | 160              | 0        | 3             | 1     
 1          | 1     | 64  | 1        | 1             | 64               | 3        | 3             | 1     
 1          | 2     | 0   | 0        | 0             | 0                | 0        | 3             | 1     
 2          | 1     | 0   | 0        | 0             | 0                | 3        | 3             | 1     
 2          | 2     | 248 | 5        | 1             | 248              | 0        | 3             | 1     
(6 rows)
1:INSERT INTO crash_before_cleanup_phase VALUES(21, 1, 'c'), (26, 1, 'c');
INSERT 2
1:UPDATE crash_before_cleanup_phase SET b = b+10 WHERE a=26;
UPDATE 1
1:SELECT * FROM crash_before_cleanup_phase ORDER BY a,b;
 a  | b  | c                    
----+----+----------------------
 1  | 1  | c                    
 4  | 1  | hello world          
 5  | 1  | hello world          
 6  | 1  | hello world          
 7  | 1  | hello world          
 8  | 1  | hello world          
 9  | 1  | hello world          
 10 | 1  | hello world          
 21 | 1  | c                    
 25 | 16 | c                    
 26 | 11 | c                    
(11 rows)
-- crash_vacuum_in_appendonly_insert
-- verify the old segment files are still visible after the vacuum is aborted.
1:SELECT * FROM gp_toolkit.__gp_aoseg('crash_vacuum_in_appendonly_insert') where segno = 1;
 segment_id | segno | eof | tupcount | varblockcount | eof_uncompressed | modcount | formatversion | state 
------------+-------+-----+----------+---------------+------------------+----------+---------------+-------
 0          | 1     | 496 | 10       | 2             | 496              | 2        | 3             | 1     
 1          | 1     | 128 | 2        | 2             | 128              | 2        | 3             | 1     
 2          | 1     | 400 | 8        | 2             | 400              | 2        | 3             | 1     
(3 rows)
-- verify the new segment files contain no tuples.
1:SELECT sum(tupcount) FROM gp_toolkit.__gp_aoseg('crash_vacuum_in_appendonly_insert') where segno = 2;
 sum 
-----
 0   
(1 row)
1:VACUUM crash_vacuum_in_appendonly_insert;
VACUUM
1:SELECT * FROM gp_toolkit.__gp_aoseg('crash_vacuum_in_appendonly_insert');
 segment_id | segno | eof | tupcount | varblockcount | eof_uncompressed | modcount | formatversion | state 
------------+-------+-----+----------+---------------+------------------+----------+---------------+-------
 0          | 1     | 0   | 0        | 0             | 0                | 2        | 3             | 1     
 0          | 2     | 248 | 5        | 1             | 248              | 0        | 3             | 1     
 1          | 1     | 0   | 0        | 0             | 0                | 2        | 3             | 1     
 1          | 2     | 64  | 1        | 1             | 64               | 0        | 3             | 1     
 2          | 1     | 0   | 0        | 0             | 0                | 2        | 3             | 1     
 2          | 2     | 200 | 4        | 1             | 200              | 0        | 3             | 1     
(6 rows)
1:INSERT INTO crash_vacuum_in_appendonly_insert VALUES(21, 1, 'c'), (26, 1, 'c');
INSERT 2
1:UPDATE crash_vacuum_in_appendonly_insert SET b = b+10 WHERE a=26;
UPDATE 1
1:SELECT * FROM crash_vacuum_in_appendonly_insert ORDER BY a,b;
 a  | b  | c                    
----+----+----------------------
 1  | 2  | hello world          
 2  | 2  | hello world          
 3  | 2  | hello world          
 4  | 2  | hello world          
 5  | 2  | hello world          
 6  | 2  | hello world          
 7  | 2  | hello world          
 8  | 2  | hello world          
 9  | 2  | hello world          
 10 | 2  | hello world          
 21 | 1  | c                    
 26 | 11 | c                    
(12 rows)

--
-- Setup tables to test crash at different points on master now
--
-- for crash_master_before_cleanup_phase
2:set default_table_access_method = ao_row;
SET
2:show default_table_access_method;
 default_table_access_method 
-----------------------------
 ao_row                      
(1 row)
2:DROP TABLE IF EXISTS crash_master_before_cleanup_phase CASCADE;
DROP
2:CREATE TABLE crash_master_before_cleanup_phase (a INT, b INT, c CHAR(20));
CREATE
2:CREATE INDEX crash_master_before_cleanup_phase_index ON crash_master_before_cleanup_phase(b);
CREATE
2:INSERT INTO crash_master_before_cleanup_phase SELECT i AS a, 1 AS b, 'hello world' AS c FROM generate_series(1, 10) AS i;
INSERT 10
2:DELETE FROM crash_master_before_cleanup_phase WHERE a < 4;
DELETE 3

-- suspend at intended points
2:SELECT gp_inject_fault('compaction_before_cleanup_phase', 'panic', '', '', 'crash_master_before_cleanup_phase', 1, -1, 0, 1);
 gp_inject_fault 
-----------------
 Success:        
(1 row)
2:VACUUM crash_master_before_cleanup_phase;
PANIC:  fault triggered, fault name:'compaction_before_cleanup_phase' fault type:'panic'
server closed the connection unexpectedly
	This probably means the server terminated abnormally
	before or while processing the request.

-- reset faults as protection incase tests failed and panic didn't happen
4:SELECT gp_inject_fault('compaction_before_cleanup_phase', 'reset', 1);
 gp_inject_fault 
-----------------
 Success:        
(1 row)

-- perform post crash validation checks
-- for crash_master_before_cleanup_phase
4:SELECT * FROM gp_toolkit.__gp_aoseg('crash_master_before_cleanup_phase');
 segment_id | segno | eof | tupcount | varblockcount | eof_uncompressed | modcount | formatversion | state 
------------+-------+-----+----------+---------------+------------------+----------+---------------+-------
 0          | 1     | 248 | 5        | 1             | 248              | 2        | 3             | 2     
 0          | 2     | 160 | 3        | 1             | 160              | 0        | 3             | 1     
 1          | 1     | 64  | 1        | 1             | 64               | 2        | 3             | 2     
 1          | 2     | 0   | 0        | 0             | 0                | 0        | 3             | 1     
 2          | 1     | 200 | 4        | 1             | 200              | 1        | 3             | 1     
(5 rows)
4:INSERT INTO crash_master_before_cleanup_phase VALUES(1, 1, 'c'), (25, 6, 'c');
INSERT 2
4:UPDATE crash_master_before_cleanup_phase SET b = b+10 WHERE a=25;
UPDATE 1
4:SELECT * FROM crash_master_before_cleanup_phase ORDER BY a,b;
 a  | b  | c                    
----+----+----------------------
 1  | 1  | c                    
 4  | 1  | hello world          
 5  | 1  | hello world          
 6  | 1  | hello world          
 7  | 1  | hello world          
 8  | 1  | hello world          
 9  | 1  | hello world          
 10 | 1  | hello world          
 25 | 16 | c                    
(9 rows)
4:SELECT * FROM gp_toolkit.__gp_aoseg('crash_master_before_cleanup_phase');
 segment_id | segno | eof | tupcount | varblockcount | eof_uncompressed | modcount | formatversion | state 
------------+-------+-----+----------+---------------+------------------+----------+---------------+-------
 0          | 1     | 248 | 5        | 1             | 248              | 2        | 3             | 2     
 0          | 2     | 160 | 3        | 1             | 160              | 0        | 3             | 1     
 1          | 1     | 64  | 1        | 1             | 64               | 2        | 3             | 2     
 1          | 2     | 64  | 1        | 1             | 64               | 1        | 3             | 1     
 2          | 1     | 328 | 6        | 3             | 328              | 3        | 3             | 1     
(5 rows)
4:VACUUM crash_master_before_cleanup_phase;
VACUUM
4:SELECT * FROM gp_toolkit.__gp_aoseg('crash_master_before_cleanup_phase');
 segment_id | segno | eof | tupcount | varblockcount | eof_uncompressed | modcount | formatversion | state 
------------+-------+-----+----------+---------------+------------------+----------+---------------+-------
 0          | 1     | 0   | 0        | 0             | 0                | 2        | 3             | 1     
 0          | 2     | 160 | 3        | 1             | 160              | 0        | 3             | 1     
 1          | 1     | 0   | 0        | 0             | 0                | 2        | 3             | 1     
 1          | 2     | 64  | 1        | 1             | 64               | 1        | 3             | 1     
 2          | 1     | 0   | 0        | 0             | 0                | 3        | 3             | 1     
 2          | 2     | 248 | 5        | 1             | 248              | 0        | 3             | 1     
(6 rows)
4:INSERT INTO crash_master_before_cleanup_phase VALUES(21, 1, 'c'), (26, 1, 'c');
INSERT 2
4:UPDATE crash_master_before_cleanup_phase SET b = b+10 WHERE a=26;
UPDATE 1
4:SELECT * FROM crash_master_before_cleanup_phase ORDER BY a,b;
 a  | b  | c                    
----+----+----------------------
 1  | 1  | c                    
 4  | 1  | hello world          
 5  | 1  | hello world          
 6  | 1  | hello world          
 7  | 1  | hello world          
 8  | 1  | hello world          
 9  | 1  | hello world          
 10 | 1  | hello world          
 21 | 1  | c                    
 25 | 16 | c                    
 26 | 11 | c                    
(11 rows)
