drop table if exists vfheap;
DROP TABLE
create table vfheap (a, b, c) as
select 1, i, repeat('x', 1000) from generate_series(1, 100)i distributed by (a);
SELECT 100
create index ivfheap on vfheap(b, c);
CREATE INDEX
-- delete half of table
delete from vfheap where b between 0 and (select count(*) / 2 from vfheap);
DELETE 50
select pg_relation_size('vfheap') from gp_dist_random('gp_id') where gp_segment_id = 0;
 pg_relation_size 
------------------
           131072
(1 row)

select pg_relation_size('ivfheap') from gp_dist_random('gp_id') where gp_segment_id = 0;
 pg_relation_size 
------------------
           196608
(1 row)

-- show pages are truncated
vacuum full vfheap;
VACUUM
select pg_relation_size('vfheap') from gp_dist_random('gp_id') where gp_segment_id = 0;
 pg_relation_size 
------------------
            65536
(1 row)

select pg_relation_size('ivfheap') from gp_dist_random('gp_id') where gp_segment_id = 0;
 pg_relation_size 
------------------
           262144
(1 row)

select max(b), min(length(c)) from vfheap;
 max | min  
-----+------
 100 | 1000
(1 row)

-- check relpages and reltuples
select relname, relpages, reltuples from gp_dist_random('pg_class') where (oid = 'vfheap'::regclass or oid = 'ivfheap'::regclass) and gp_segment_id = 0;
 relname | relpages | reltuples 
---------+----------+-----------
 vfheap  |        2 |        50
 ivfheap |        8 |        50
(2 rows)

-- just for the sake of code coverage, one more shot of vacuum full
vacuum full vfheap;
VACUUM
-- delete completely, size becomes 0, reducing index too
delete from vfheap;
DELETE 50
vacuum full vfheap;
VACUUM
select pg_relation_size('vfheap') from gp_dist_random('gp_id') where gp_segment_id = 0;
 pg_relation_size 
------------------
                0
(1 row)

select pg_relation_size('ivfheap') from gp_dist_random('gp_id') where gp_segment_id = 0;
 pg_relation_size 
------------------
           196608
(1 row)

-- check relpages and reltuples (relpages is 1 though empty, intentionally)
select relname, relpages, reltuples from gp_dist_random('pg_class') where (oid = 'vfheap'::regclass or oid = 'ivfheap'::regclass) and gp_segment_id = 0;
 relname | relpages | reltuples 
---------+----------+-----------
 vfheap  |        1 |         0
 ivfheap |        6 |         0
(2 rows)

-- again, but delete second half
insert into vfheap select 1, i, repeat('x', 1000) from generate_series(1, 100)i;
INSERT 0 100
delete from vfheap where b between (select count(*) / 2 from vfheap) and (select count(*) from vfheap);
DELETE 51
select pg_relation_size('vfheap') from gp_dist_random('gp_id') where gp_segment_id = 0;
 pg_relation_size 
------------------
           131072
(1 row)

select pg_relation_size('ivfheap') from gp_dist_random('gp_id') where gp_segment_id = 0;
 pg_relation_size 
------------------
           196608
(1 row)

-- show pages are truncated
vacuum full vfheap;
VACUUM
select pg_relation_size('vfheap') from gp_dist_random('gp_id') where gp_segment_id = 0;
 pg_relation_size 
------------------
            65536
(1 row)

select pg_relation_size('ivfheap') from gp_dist_random('gp_id') where gp_segment_id = 0;
 pg_relation_size 
------------------
           196608
(1 row)

select max(b), min(length(c)) from vfheap;
 max | min  
-----+------
  49 | 1000
(1 row)

-- also make sure toast is truncated
drop table if exists vfheaptoast;
DROP TABLE
create table vfheaptoast (a, b, c) as
select 1, i, array(select generate_series(1, 10000)) from generate_series(1, 100)i;
SELECT 100
select pg_relation_size((select reltoastrelid from pg_class where oid = 'vfheaptoast'::regclass)) from gp_dist_random('gp_id') where gp_segment_id = 0;
 pg_relation_size 
------------------
          4096000
(1 row)

delete from vfheaptoast where b between 0 and (select count(*) / 2 from vfheaptoast);
DELETE 50
vacuum full vfheaptoast;
VACUUM
select pg_relation_size((select reltoastrelid from pg_class where oid = 'vfheaptoast'::regclass)) from gp_dist_random('gp_id') where gp_segment_id = 0;
 pg_relation_size 
------------------
          2064384
(1 row)

select max(b), min(length(array_to_string(c, ','))) from vfheaptoast;
 max |  min  
-----+-------
 100 | 48893
(1 row)

select relpages, reltuples from gp_dist_random('pg_class')
  where oid = (select reltoastrelid from pg_class where oid = 'vfheaptoast'::regclass) and gp_segment_id = 0;
 relpages | reltuples 
----------+-----------
       63 |       250
(1 row)

delete from vfheaptoast;
DELETE 50
vacuum full vfheaptoast;
VACUUM
select pg_relation_size((select reltoastrelid from pg_class where oid = 'vfheaptoast'::regclass)) from gp_dist_random('gp_id') where gp_segment_id = 0;
 pg_relation_size 
------------------
                0
(1 row)

-- check relpages and reltuples (relpages is 1 though empty, intentionally)
select relpages, reltuples from gp_dist_random('pg_class')
  where oid = (select reltoastrelid from pg_class where oid = 'vfheaptoast'::regclass) and gp_segment_id = 0;
 relpages | reltuples 
----------+-----------
        1 |         0
(1 row)

