--
-- CONSTRAINTS
-- Constraints can be specified with:
--  - DEFAULT clause
--  - CHECK clauses
--  - PRIMARY KEY clauses
--  - UNIQUE clauses
--  - EXCLUDE clauses
--
--
-- DEFAULT syntax
--
CREATE TABLE DEFAULT_TBL (i int DEFAULT 100,
	x text DEFAULT 'vadim', f float8 DEFAULT 123.456);
INSERT INTO DEFAULT_TBL VALUES (1, 'thomas', 57.0613);
INSERT INTO DEFAULT_TBL VALUES (1, 'bruce');
INSERT INTO DEFAULT_TBL (i, f) VALUES (2, 987.654);
INSERT INTO DEFAULT_TBL (x) VALUES ('marc');
INSERT INTO DEFAULT_TBL VALUES (3, null, 1.0);
SELECT '' AS five, * FROM DEFAULT_TBL;
 five |  i  |   x    |    f    
------+-----+--------+---------
      |   1 | thomas | 57.0613
      |   1 | bruce  | 123.456
      |   2 | vadim  | 987.654
      | 100 | marc   | 123.456
      |   3 |        |       1
(5 rows)

CREATE SEQUENCE DEFAULT_SEQ;
CREATE TABLE DEFAULTEXPR_TBL (i1 int DEFAULT 100 + (200-199) * 2,
	i2 int DEFAULT nextval('default_seq'));
INSERT INTO DEFAULTEXPR_TBL VALUES (-1, -2);
INSERT INTO DEFAULTEXPR_TBL (i1) VALUES (-3);
INSERT INTO DEFAULTEXPR_TBL (i2) VALUES (-4);
INSERT INTO DEFAULTEXPR_TBL (i2) VALUES (NULL);
SELECT '' AS four, * FROM DEFAULTEXPR_TBL;
 four | i1  | i2 
------+-----+----
      |  -1 | -2
      |  -3 |  1
      | 102 | -4
      | 102 |   
(4 rows)

-- syntax errors
--  test for extraneous comma
CREATE TABLE error_tbl (i int DEFAULT (100, ));
ERROR:  syntax error at or near ")"
LINE 1: CREATE TABLE error_tbl (i int DEFAULT (100, ));
                                                    ^
--  this will fail because gram.y uses b_expr not a_expr for defaults,
--  to avoid a shift/reduce conflict that arises from NOT NULL being
--  part of the column definition syntax:
CREATE TABLE error_tbl (b1 bool DEFAULT 1 IN (1, 2));
ERROR:  syntax error at or near "IN"
LINE 1: CREATE TABLE error_tbl (b1 bool DEFAULT 1 IN (1, 2));
                                                  ^
--  this should work, however:
CREATE TABLE error_tbl (b1 bool DEFAULT (1 IN (1, 2)));
DROP TABLE error_tbl;
--
-- CHECK syntax
--
CREATE TABLE CHECK_TBL (x int,
	CONSTRAINT CHECK_CON CHECK (x > 3));
INSERT INTO CHECK_TBL VALUES (5);
INSERT INTO CHECK_TBL VALUES (4);
INSERT INTO CHECK_TBL VALUES (3);
ERROR:  new row for relation "check_tbl" violates check constraint "check_con"
INSERT INTO CHECK_TBL VALUES (2);
ERROR:  new row for relation "check_tbl" violates check constraint "check_con"
INSERT INTO CHECK_TBL VALUES (6);
INSERT INTO CHECK_TBL VALUES (1);
ERROR:  new row for relation "check_tbl" violates check constraint "check_con"
SELECT '' AS three, * FROM CHECK_TBL;
 three | x 
-------+---
       | 5
       | 4
       | 6
(3 rows)

CREATE SEQUENCE CHECK_SEQ;
CREATE TABLE CHECK2_TBL (x int, y text, z int,
	CONSTRAINT SEQUENCE_CON
	CHECK (x > 3 and y <> 'check failed' and z < 8));
INSERT INTO CHECK2_TBL VALUES (4, 'check ok', -2);
INSERT INTO CHECK2_TBL VALUES (1, 'x check failed', -2);
ERROR:  new row for relation "check2_tbl" violates check constraint "sequence_con"
INSERT INTO CHECK2_TBL VALUES (5, 'z check failed', 10);
ERROR:  new row for relation "check2_tbl" violates check constraint "sequence_con"
INSERT INTO CHECK2_TBL VALUES (0, 'check failed', -2);
ERROR:  new row for relation "check2_tbl" violates check constraint "sequence_con"
INSERT INTO CHECK2_TBL VALUES (6, 'check failed', 11);
ERROR:  new row for relation "check2_tbl" violates check constraint "sequence_con"
INSERT INTO CHECK2_TBL VALUES (7, 'check ok', 7);
SELECT '' AS two, * from CHECK2_TBL;
 two | x |    y     | z  
-----+---+----------+----
     | 4 | check ok | -2
     | 7 | check ok |  7
(2 rows)

--
-- Check constraints on INSERT
--
CREATE SEQUENCE INSERT_SEQ;
CREATE TABLE INSERT_TBL (x INT DEFAULT nextval('insert_seq'),
	y TEXT DEFAULT '-NULL-',
	z INT DEFAULT -1 * (nextval('insert_seq')-1),
	CONSTRAINT INSERT_CON CHECK (x >= 3 AND y <> 'check failed' AND x < 8),
	CHECK (x + z = 0));
INSERT INTO INSERT_TBL(x,z) VALUES (2, -2);
ERROR:  new row for relation "insert_tbl" violates check constraint "insert_con"
SELECT '' AS zero, * FROM INSERT_TBL;
 zero | x | y | z 
------+---+---+---
(0 rows)

SELECT 'one' AS one, nextval('insert_seq');
 one | nextval 
-----+---------
 one |       1
(1 row)

INSERT INTO INSERT_TBL(y) VALUES ('Y');
ERROR:  new row for relation "insert_tbl" violates check constraint "insert_con"
INSERT INTO INSERT_TBL(y) VALUES ('Y');
INSERT INTO INSERT_TBL(x,z) VALUES (1, -2);
ERROR:  new row for relation "insert_tbl" violates check constraint "insert_tbl_check"
INSERT INTO INSERT_TBL(z,x) VALUES (-7,  7);
INSERT INTO INSERT_TBL VALUES (5, 'check failed', -5);
ERROR:  new row for relation "insert_tbl" violates check constraint "insert_con"
INSERT INTO INSERT_TBL VALUES (7, '!check failed', -7);
INSERT INTO INSERT_TBL(y) VALUES ('-!NULL-');
SELECT '' AS four, * FROM INSERT_TBL;
 four | x |       y       | z  
------+---+---------------+----
      | 4 | Y             | -4
      | 7 | -NULL-        | -7
      | 7 | !check failed | -7
      | 6 | -!NULL-       | -6
(4 rows)

-- GPDB: reset the table contents to match upstream.
delete from insert_tbl;
insert into insert_tbl values
  (3, 'Y', -3),
  (7, '-NULL-', -7),
  (7, '!check failed', -7),
  (4, '-!NULL-', -4);
INSERT INTO INSERT_TBL(y,z) VALUES ('check failed', 4);
ERROR:  new row for relation "insert_tbl" violates check constraint "insert_tbl_check"
INSERT INTO INSERT_TBL(x,y) VALUES (5, 'check failed');
ERROR:  new row for relation "insert_tbl" violates check constraint "insert_tbl_check"
-- these fail on GPDB, because we cannot use currval in the z columns' DEFAULT like in upstream.
INSERT INTO INSERT_TBL(x,y) VALUES (5, '!check failed');
ERROR:  new row for relation "insert_tbl" violates check constraint "insert_tbl_check"
INSERT INTO INSERT_TBL(y) VALUES ('-!NULL-');
ERROR:  new row for relation "insert_tbl" violates check constraint "insert_con"
-- GPDB: fix the table contents to match upstream again, so that the subsequent
-- tests start with the same state as in upstream.
insert into insert_tbl values
  (5, '!check failed', -5),
  (6, '-!NULL-', -6);
SELECT '' AS six, * FROM INSERT_TBL;
 six | x |       y       | z  
-----+---+---------------+----
     | 3 | Y             | -3
     | 7 | -NULL-        | -7
     | 7 | !check failed | -7
     | 4 | -!NULL-       | -4
     | 5 | !check failed | -5
     | 6 | -!NULL-       | -6
(6 rows)

SELECT 'seven' AS one, nextval('insert_seq');
  one  | nextval 
-------+---------
 seven |      13
(1 row)

INSERT INTO INSERT_TBL(y) VALUES ('Y');
ERROR:  new row for relation "insert_tbl" violates check constraint "insert_con"
SELECT 'eight' AS one, nextval('insert_seq');
  one  | nextval 
-------+---------
 eight |      16
(1 row)

-- According to SQL92, it is OK to insert a record that gives rise to NULL
-- constraint-condition results.  Postgres used to reject this, but it
-- was wrong:
INSERT INTO INSERT_TBL VALUES (null, null, null);
SELECT '' AS nine, * FROM INSERT_TBL;
 nine | x |       y       | z  
------+---+---------------+----
      | 3 | Y             | -3
      | 7 | -NULL-        | -7
      | 7 | !check failed | -7
      | 4 | -!NULL-       | -4
      | 5 | !check failed | -5
      | 6 | -!NULL-       | -6
      |   |               |   
(7 rows)

--
-- Check inheritance of defaults and constraints
--
CREATE TABLE INSERT_CHILD (cx INT default 42,
	cy INT CHECK (cy > x))
	INHERITS (INSERT_TBL);
INSERT INTO INSERT_CHILD(x,z,cy) VALUES (7,-7,11);
INSERT INTO INSERT_CHILD(x,z,cy) VALUES (7,-7,6);
ERROR:  new row for relation "insert_child" violates check constraint "insert_child_check"
INSERT INTO INSERT_CHILD(x,z,cy) VALUES (6,-7,7);
ERROR:  new row for relation "insert_child" violates check constraint "insert_tbl_check"
INSERT INTO INSERT_CHILD(x,y,z,cy) VALUES (6,'check failed',-6,7);
ERROR:  new row for relation "insert_child" violates check constraint "insert_con"
SELECT * FROM INSERT_CHILD;
 x |   y    | z  | cx | cy 
---+--------+----+----+----
 7 | -NULL- | -7 | 42 | 11
(1 row)

DROP TABLE INSERT_CHILD;
--
-- Check constraints on INSERT INTO
--
DELETE FROM INSERT_TBL;
ALTER SEQUENCE INSERT_SEQ RESTART WITH 4;
CREATE TABLE tmp (xd INT, yd TEXT, zd INT) distributed by (xd);
INSERT INTO tmp VALUES (null, 'Y', null);
INSERT INTO tmp VALUES (5, '!check failed', null);
INSERT INTO tmp VALUES (null, 'try again', null);
-- GPDB: This INSERT  doesn't work in GPDB, because the default is
-- different. Fix the table contents again for the next test.
--
--INSERT INTO INSERT_TBL(y) select yd from tmp;
INSERT INTO INSERT_TBL VALUES
  (4, 'Y', -4),
  (5, '!check failed', -5),
  (6, 'try again', -6);
SELECT '' AS three, * FROM INSERT_TBL;
 three | x |       y       | z  
-------+---+---------------+----
       | 4 | Y             | -4
       | 5 | !check failed | -5
       | 6 | try again     | -6
(3 rows)

INSERT INTO INSERT_TBL SELECT * FROM tmp WHERE yd = 'try again';
INSERT INTO INSERT_TBL(y,z) SELECT yd, -7 FROM tmp WHERE yd = 'try again';
ERROR:  new row for relation "insert_tbl" violates check constraint "insert_tbl_check"
INSERT INTO INSERT_TBL(y,z) SELECT yd, -8 FROM tmp WHERE yd = 'try again';
ERROR:  new row for relation "insert_tbl" violates check constraint "insert_tbl_check"
-- GPDB: Fixup
INSERT INTO INSERT_TBL VALUES (7, 'try again', -7);
SELECT '' AS four, * FROM INSERT_TBL;
 four | x |       y       | z  
------+---+---------------+----
      | 4 | Y             | -4
      | 5 | !check failed | -5
      | 6 | try again     | -6
      |   | try again     |   
      | 7 | try again     | -7
(5 rows)

DROP TABLE tmp;
--
-- Check constraints on UPDATE
--
ALTER TABLE insert_tbl SET DISTRIBUTED BY (y);
UPDATE INSERT_TBL SET x = NULL WHERE x = 5;
UPDATE INSERT_TBL SET x = 6 WHERE x = 6;
UPDATE INSERT_TBL SET x = -z, z = -x;
UPDATE INSERT_TBL SET x = z, z = x;
ERROR:  new row for relation "insert_tbl" violates check constraint "insert_con"
SELECT * FROM INSERT_TBL;
 x |       y       | z  
---+---------------+----
 4 | Y             | -4
   | try again     |   
 7 | try again     | -7
 5 | !check failed |   
 6 | try again     | -6
(5 rows)

-- DROP TABLE INSERT_TBL;
--
-- Check constraints on COPY FROM
--
CREATE TABLE COPY_TBL (x INT, y TEXT, z INT,
	CONSTRAINT COPY_CON
	CHECK (x > 3 AND y <> 'check failed' AND x < 7 ));
COPY COPY_TBL FROM '@abs_srcdir@/data/constro.data';
SELECT '' AS two, * FROM COPY_TBL;
 two | x |       y       | z 
-----+---+---------------+---
     | 4 | !check failed | 5
     | 6 | OK            | 4
(2 rows)

COPY COPY_TBL FROM '@abs_srcdir@/data/constrf.data';
ERROR:  new row for relation "copy_tbl" violates check constraint "copy_con"
CONTEXT:  COPY copy_tbl, line 2: "7	check failed	6"
SELECT * FROM COPY_TBL;
 x |       y       | z 
---+---------------+---
 4 | !check failed | 5
 6 | OK            | 4
(2 rows)

--
-- Primary keys
--
CREATE TABLE PRIMARY_TBL (i int PRIMARY KEY, t text) DISTRIBUTED BY (i);
NOTICE:  CREATE TABLE / PRIMARY KEY will create implicit index "primary_tbl_pkey" for table "primary_tbl"
INSERT INTO PRIMARY_TBL VALUES (1, 'one');
INSERT INTO PRIMARY_TBL VALUES (2, 'two');
INSERT INTO PRIMARY_TBL VALUES (1, 'three');
ERROR:  duplicate key value violates unique constraint "primary_tbl_pkey"
DETAIL:  Key (i)=(1) already exists.
INSERT INTO PRIMARY_TBL VALUES (4, 'three');
INSERT INTO PRIMARY_TBL VALUES (5, 'one');
INSERT INTO PRIMARY_TBL (t) VALUES ('six');
ERROR:  null value in column "i" violates not-null constraint
SELECT '' AS four, * FROM PRIMARY_TBL;
 four | i |   t   
------+---+-------
      | 1 | one
      | 2 | two
      | 4 | three
      | 5 | one
(4 rows)

DROP TABLE PRIMARY_TBL;
CREATE TABLE PRIMARY_TBL (i int, t text,
	PRIMARY KEY(i,t)) DISTRIBUTED BY (i);
NOTICE:  CREATE TABLE / PRIMARY KEY will create implicit index "primary_tbl_pkey" for table "primary_tbl"
INSERT INTO PRIMARY_TBL VALUES (1, 'one');
INSERT INTO PRIMARY_TBL VALUES (2, 'two');
INSERT INTO PRIMARY_TBL VALUES (1, 'three');
INSERT INTO PRIMARY_TBL VALUES (4, 'three');
INSERT INTO PRIMARY_TBL VALUES (5, 'one');
INSERT INTO PRIMARY_TBL (t) VALUES ('six');
ERROR:  null value in column "i" violates not-null constraint
SELECT '' AS three, * FROM PRIMARY_TBL;
 three | i |   t   
-------+---+-------
       | 1 | one
       | 2 | two
       | 1 | three
       | 4 | three
       | 5 | one
(5 rows)

DROP TABLE PRIMARY_TBL;
--
-- Unique keys
--
CREATE TABLE UNIQUE_TBL (i int UNIQUE, t text) DISTRIBUTED BY (i);
NOTICE:  CREATE TABLE / UNIQUE will create implicit index "unique_tbl_i_key" for table "unique_tbl"
INSERT INTO UNIQUE_TBL VALUES (1, 'one');
INSERT INTO UNIQUE_TBL VALUES (2, 'two');
INSERT INTO UNIQUE_TBL VALUES (1, 'three');
ERROR:  duplicate key value violates unique constraint "unique_tbl_i_key"
DETAIL:  Key (i)=(1) already exists.
INSERT INTO UNIQUE_TBL VALUES (4, 'four');
INSERT INTO UNIQUE_TBL VALUES (5, 'one');
INSERT INTO UNIQUE_TBL (t) VALUES ('six');
INSERT INTO UNIQUE_TBL (t) VALUES ('seven');
SELECT '' AS five, * FROM UNIQUE_TBL;
 five | i |   t   
------+---+-------
      | 1 | one
      | 2 | two
      | 4 | four
      | 5 | one
      |   | six
      |   | seven
(6 rows)

DROP TABLE UNIQUE_TBL;
CREATE TABLE UNIQUE_TBL (i int, t text,
	UNIQUE(i,t)) DISTRIBUTED BY (i);
NOTICE:  CREATE TABLE / UNIQUE will create implicit index "unique_tbl_i_t_key" for table "unique_tbl"
INSERT INTO UNIQUE_TBL VALUES (1, 'one');
INSERT INTO UNIQUE_TBL VALUES (2, 'two');
INSERT INTO UNIQUE_TBL VALUES (1, 'three');
INSERT INTO UNIQUE_TBL VALUES (1, 'one');
ERROR:  duplicate key value violates unique constraint "unique_tbl_i_t_key"
DETAIL:  Key (i, t)=(1, one) already exists.
INSERT INTO UNIQUE_TBL VALUES (5, 'one');
INSERT INTO UNIQUE_TBL (t) VALUES ('six');
SELECT '' AS five, * FROM UNIQUE_TBL;
 five | i |   t   
------+---+-------
      | 1 | one
      | 2 | two
      | 1 | three
      | 5 | one
      |   | six
(5 rows)

DROP TABLE UNIQUE_TBL;
--
-- Deferrable unique constraints
--
CREATE TABLE unique_tbl (i int UNIQUE DEFERRABLE, t text);
NOTICE:  CREATE TABLE / UNIQUE will create implicit index "unique_tbl_i_key" for table "unique_tbl"
INSERT INTO unique_tbl VALUES (0, 'one');
INSERT INTO unique_tbl VALUES (1, 'two');
INSERT INTO unique_tbl VALUES (2, 'tree');
INSERT INTO unique_tbl VALUES (3, 'four');
INSERT INTO unique_tbl VALUES (4, 'five');
BEGIN;
-- default is immediate so this should fail right away
UPDATE unique_tbl SET i = 1 WHERE i = 0;
ERROR:  Cannot parallelize an UPDATE statement that updates the distribution columns
ROLLBACK;
-- check is done at end of statement, so this should succeed
UPDATE unique_tbl SET i = i+1;
ERROR:  Cannot parallelize an UPDATE statement that updates the distribution columns
SELECT * FROM unique_tbl;
 i |  t   
---+------
 0 | one
 1 | two
 2 | tree
 3 | four
 4 | five
(5 rows)

-- GPDB: the above fails, because distribution columns cannot be UPDATEd (without ORCA).
-- Reset the table to the state the rest of the test expects
TRUNCATE unique_tbl;
INSERT INTO unique_tbl VALUES (1, 'one'), (2, 'two'), (3, 'tree'), (4, 'four'), (5, 'five');
-- explicitly defer the constraint
BEGIN;
SET CONSTRAINTS unique_tbl_i_key DEFERRED;
INSERT INTO unique_tbl VALUES (3, 'three');
DELETE FROM unique_tbl WHERE t = 'tree'; -- makes constraint valid again
COMMIT; -- should succeed
SELECT * FROM unique_tbl;
 i |   t   
---+-------
 1 | one
 2 | two
 4 | four
 5 | five
 3 | three
(5 rows)

-- try adding an initially deferred constraint
ALTER TABLE unique_tbl DROP CONSTRAINT unique_tbl_i_key;
ALTER TABLE unique_tbl ADD CONSTRAINT unique_tbl_i_key
	UNIQUE (i) DEFERRABLE INITIALLY DEFERRED;
NOTICE:  ALTER TABLE / ADD UNIQUE will create implicit index "unique_tbl_i_key" for table "unique_tbl"
BEGIN;
INSERT INTO unique_tbl VALUES (1, 'five');
INSERT INTO unique_tbl VALUES (5, 'one');
UPDATE unique_tbl SET i = 4 WHERE i = 2;
ERROR:  Cannot parallelize an UPDATE statement that updates the distribution columns
UPDATE unique_tbl SET i = 2 WHERE i = 4 AND t = 'four';
ERROR:  current transaction is aborted, commands ignored until end of transaction block
DELETE FROM unique_tbl WHERE i = 1 AND t = 'one';
ERROR:  current transaction is aborted, commands ignored until end of transaction block
DELETE FROM unique_tbl WHERE i = 5 AND t = 'five';
ERROR:  current transaction is aborted, commands ignored until end of transaction block
COMMIT;
SELECT * FROM unique_tbl;
 i |   t   
---+-------
 1 | one
 2 | two
 4 | four
 5 | five
 3 | three
(5 rows)

-- GPDB: Reset the table to the state the rest of the test expects, again.
TRUNCATE unique_tbl;
INSERT INTO unique_tbl VALUES (3, 'three'), (1, 'five'), (5, 'one'), (4, 'two'), (2, 'four');
-- should fail at commit-time
BEGIN;
INSERT INTO unique_tbl VALUES (3, 'Three'); -- should succeed for now
COMMIT; -- should fail
ERROR:  duplicate key value violates unique constraint "unique_tbl_i_key"
DETAIL:  Key (i)=(3) already exists.
-- make constraint check immediate
BEGIN;
SET CONSTRAINTS ALL IMMEDIATE;
INSERT INTO unique_tbl VALUES (3, 'Three'); -- should fail
ERROR:  duplicate key value violates unique constraint "unique_tbl_i_key"
DETAIL:  Key (i)=(3) already exists.
COMMIT;
-- forced check when SET CONSTRAINTS is called
BEGIN;
SET CONSTRAINTS ALL DEFERRED;
INSERT INTO unique_tbl VALUES (3, 'Three'); -- should succeed for now
SET CONSTRAINTS ALL IMMEDIATE; -- should fail
ERROR:  duplicate key value violates unique constraint "unique_tbl_i_key"
DETAIL:  Key (i)=(3) already exists.
COMMIT;
-- test a HOT update that invalidates the conflicting tuple.
-- the trigger should still fire and catch the violation
BEGIN;
INSERT INTO unique_tbl VALUES (3, 'Three'); -- should succeed for now
UPDATE unique_tbl SET t = 'THREE' WHERE i = 3 AND t = 'Three';
COMMIT; -- should fail
ERROR:  duplicate key value violates unique constraint "unique_tbl_i_key"
DETAIL:  Key (i)=(3) already exists.
SELECT * FROM unique_tbl;
 i |   t   
---+-------
 3 | three
 1 | five
 5 | one
 4 | two
 2 | four
(5 rows)

-- test a HOT update that modifies the newly inserted tuple,
-- but should succeed because we then remove the other conflicting tuple.
BEGIN;
INSERT INTO unique_tbl VALUES(3, 'tree'); -- should succeed for now
UPDATE unique_tbl SET t = 'threex' WHERE t = 'tree';
DELETE FROM unique_tbl WHERE t = 'three';
SELECT * FROM unique_tbl;
 i |   t    
---+--------
 1 | five
 5 | one
 4 | two
 2 | four
 3 | threex
(5 rows)

COMMIT;
SELECT * FROM unique_tbl;
 i |   t    
---+--------
 1 | five
 5 | one
 4 | two
 2 | four
 3 | threex
(5 rows)

DROP TABLE unique_tbl;
--
-- EXCLUDE constraints
--
CREATE TABLE circles (
  c1 CIRCLE,
  c2 TEXT,
  EXCLUDE USING gist
    (c1 WITH &&, (c2::circle) WITH &&)
    WHERE (circle_center(c1) <> '(0,0)')
);
NOTICE:  CREATE TABLE / EXCLUDE will create implicit index "circles_c1_c2_excl" for table "circles"
-- these should succeed because they don't match the index predicate
INSERT INTO circles VALUES('<(0,0), 5>', '<(0,0), 5>');
-- In the original version of the postgres test, they create a different set of
-- tuples for this. In Greenplum, we cannot support unique constraints on
-- non-distribution keys, and the version of the tuples from postgres end up on a
-- different segment, so we have to modify the original query here in order to
-- test these constraints. Alternatively, we could have set the distribution key
-- to be (c1, c2), but we don't support using CIRCLE type as a distribution key. 
INSERT INTO circles VALUES('<(0,0), 5>', '<(0,0), 5>');
-- succeed
INSERT INTO circles VALUES('<(10,10), 10>', '<(0,0), 5>');
-- fail, overlaps
INSERT INTO circles VALUES('<(20,20), 10>', '<(0,0), 5>');
ERROR:  conflicting key value violates exclusion constraint "circles_c1_c2_excl"
DETAIL:  Key (c1, (c2::circle))=(<(20,20),10>, <(0,0),5>) conflicts with existing key (c1, (c2::circle))=(<(10,10),10>, <(0,0),5>).
-- succeed because c1 doesn't overlap
INSERT INTO circles VALUES('<(20,20), 1>', '<(0,0), 5>');
-- succeed because c2 is not the same
INSERT INTO circles VALUES('<(20,20), 10>', '<(1,1), 5>');
-- should fail on existing data without the WHERE clause
ALTER TABLE circles ADD EXCLUDE USING gist
  (c1 WITH &&, (c2::circle) WITH ~=);
NOTICE:  ALTER TABLE / ADD EXCLUDE will create implicit index "circles_c1_c2_excl1" for table "circles"
ERROR:  could not create exclusion constraint "circles_c1_c2_excl1"
DETAIL:  Key (c1, (c2::circle))=(<(0,0),5>, <(0,0),5>) conflicts with key (c1, (c2::circle))=(<(0,0),5>, <(0,0),5>).
DROP TABLE circles;
-- Check deferred exclusion constraint
CREATE TABLE deferred_excl (
  f1 int,
  CONSTRAINT deferred_excl_con EXCLUDE (f1 WITH =) INITIALLY DEFERRED
);
NOTICE:  CREATE TABLE / EXCLUDE will create implicit index "deferred_excl_f1_excl" for table "deferred_excl"
INSERT INTO deferred_excl VALUES(1);
INSERT INTO deferred_excl VALUES(2);
INSERT INTO deferred_excl VALUES(1); -- fail
ERROR:  conflicting key value violates exclusion constraint "deferred_excl_f1_excl"
DETAIL:  Key (f1)=(1) conflicts with existing key (f1)=(1).
BEGIN;
INSERT INTO deferred_excl VALUES(2); -- no fail here
COMMIT; -- should fail here
ERROR:  conflicting key value violates exclusion constraint "deferred_excl_f1_excl"
DETAIL:  Key (f1)=(2) conflicts with existing key (f1)=(2).
BEGIN;
INSERT INTO deferred_excl VALUES(3);
INSERT INTO deferred_excl VALUES(3); -- no fail here
COMMIT; -- should fail here
ERROR:  conflicting key value violates exclusion constraint "deferred_excl_f1_excl"
DETAIL:  Key (f1)=(3) conflicts with existing key (f1)=(3).
ALTER TABLE deferred_excl DROP CONSTRAINT deferred_excl_con;
-- This should fail, but worth testing because of HOT updates
UPDATE deferred_excl SET f1 = 3;
-- In the original postgres test, both the tuples in this table will be updated
-- (probably by HOT update) in the previous statement, and would now be equal. In
-- greenplum, the planner does not support updating distribution keys, so we need
-- to add in these tuples manually to make the next queries in this test valid.
-- ORCA actually DOES support updating the distribution key of tables, so if using
-- the optimizer, this is technically not necessary.  
INSERT INTO deferred_excl VALUES(3);
INSERT INTO deferred_excl VALUES(3);
ALTER TABLE deferred_excl ADD EXCLUDE (f1 WITH =);
NOTICE:  ALTER TABLE / ADD EXCLUDE will create implicit index "deferred_excl_f1_excl" for table "deferred_excl"
ERROR:  could not create exclusion constraint "deferred_excl_f1_excl"
DETAIL:  Key (f1)=(3) conflicts with key (f1)=(3).
DROP TABLE deferred_excl;
--
-- Test foreign key constraints
--
BEGIN;
-- Test with two heap tables
CREATE TABLE fkc_primary_table1(a int PRIMARY KEY, b text) DISTRIBUTED BY (a);
NOTICE:  CREATE TABLE / PRIMARY KEY will create implicit index "fkc_primary_table1_pkey" for table "fkc_primary_table1"
CREATE TABLE fkc_foreign_table1(a int REFERENCES fkc_primary_table1 ON DELETE RESTRICT ON UPDATE RESTRICT, b text) DISTRIBUTED BY (a);
-- the following should succeed
INSERT INTO fkc_primary_table1 VALUES (1, 'bar');
INSERT INTO fkc_primary_table1 VALUES (2, 'bar');
INSERT INTO fkc_foreign_table1 VALUES (1, 'bar');
INSERT INTO fkc_foreign_table1 VALUES (2, 'bar');
UPDATE fkc_foreign_table1 SET b = 'foo';
DELETE FROM fkc_primary_table1 WHERE a = 1;
COMMIT;
BEGIN;
-- Test with an ao table and heap table
CREATE TABLE fkc_primary_table2(a int PRIMARY KEY, b text) DISTRIBUTED BY (a);
NOTICE:  CREATE TABLE / PRIMARY KEY will create implicit index "fkc_primary_table2_pkey" for table "fkc_primary_table2"
CREATE TABLE fkc_foreign_table2(a int REFERENCES fkc_primary_table2 ON DELETE RESTRICT ON UPDATE RESTRICT,
                                b text) WITH (APPENDONLY=TRUE) DISTRIBUTED BY (a);
-- the following should succeed
INSERT INTO fkc_primary_table2 VALUES (1, 'bar');
INSERT INTO fkc_primary_table2 VALUES (2, 'bar');
INSERT INTO fkc_foreign_table2 VALUES (1, 'bar');
INSERT INTO fkc_foreign_table2 VALUES (2, 'bar');
UPDATE fkc_foreign_table2 SET b = 'foo';
DELETE FROM fkc_primary_table2 WHERE a = 1;
COMMIT;
