-- @Description Tests the basic behavior of (lazy) vacuum w.r.t. to the threshold guc.
CREATE TABLE uao_threshold (a INT, b INT, c CHAR(128)) WITH (appendonly=true) distributed by (b);
CREATE INDEX uao_threshold_index ON uao_threshold(a);
INSERT INTO uao_threshold SELECT i as a, 1 as b, 'hello world' as c FROM generate_series(1, 100) AS i;
ANALYZE uao_threshold;
\set QUIET off
VACUUM uao_threshold;
VACUUM
DELETE FROM uao_threshold WHERE a < 4;
DELETE 3
SELECT COUNT(*) FROM uao_threshold;
 count 
-------
    97
(1 row)

SELECT segment_id, segno, tupcount, state FROM gp_toolkit.__gp_aoseg('uao_threshold');
 segment_id | segno | tupcount | state 
------------+-------+----------+-------
          1 |     1 |      100 |     1
(1 row)

-- 97 visible tuples, no vacuum
VACUUM uao_threshold;
VACUUM
SELECT segment_id, segno, tupcount, state FROM gp_toolkit.__gp_aoseg('uao_threshold');
 segment_id | segno | tupcount | state 
------------+-------+----------+-------
          1 |     1 |      100 |     1
(1 row)

DELETE FROM uao_threshold WHERE a < 12;
DELETE 8
SELECT segment_id, segno, tupcount, state FROM gp_toolkit.__gp_aoseg('uao_threshold');
 segment_id | segno | tupcount | state 
------------+-------+----------+-------
          1 |     1 |      100 |     1
(1 row)

-- 89 visible tuples, do vacuum
VACUUM uao_threshold;
VACUUM
SELECT segment_id, segno, tupcount, state FROM gp_toolkit.__gp_aoseg('uao_threshold');
 segment_id | segno | tupcount | state 
------------+-------+----------+-------
          1 |     1 |        0 |     1
          1 |     2 |       89 |     1
(2 rows)

-- no invisible tuples, no vacuum
VACUUM uao_threshold;
VACUUM
SELECT segment_id, segno, tupcount, state FROM gp_toolkit.__gp_aoseg('uao_threshold');
 segment_id | segno | tupcount | state 
------------+-------+----------+-------
          1 |     1 |        0 |     1
          1 |     2 |       89 |     1
(2 rows)

DELETE FROM uao_threshold WHERE a < 15;
DELETE 3
SELECT segment_id, segno, tupcount, state FROM gp_toolkit.__gp_aoseg('uao_threshold');
 segment_id | segno | tupcount | state 
------------+-------+----------+-------
          1 |     1 |        0 |     1
          1 |     2 |       89 |     1
(2 rows)

-- 3 invisible tuples, no vacuum
VACUUM uao_threshold;
VACUUM
SELECT segment_id, segno, tupcount, state FROM gp_toolkit.__gp_aoseg('uao_threshold');
 segment_id | segno | tupcount | state 
------------+-------+----------+-------
          1 |     1 |        0 |     1
          1 |     2 |       89 |     1
(2 rows)

-- set guc to 2%, so vacuum should trigger
SET gp_appendonly_compaction_threshold=2;
SET
-- 3 invisible tuples, do vacuum
VACUUM uao_threshold;
VACUUM
SELECT segment_id, segno, tupcount, state FROM gp_toolkit.__gp_aoseg('uao_threshold');
 segment_id | segno | tupcount | state 
------------+-------+----------+-------
          1 |     1 |       86 |     1
          1 |     2 |        0 |     1
(2 rows)

INSERT INTO uao_threshold SELECT i as a, i as b, 'hello world' as c FROM generate_series(100, 200) AS i;
INSERT 0 101
DELETE FROM uao_threshold WHERE a > 100 and a < 175;
DELETE 74
SELECT segment_id, segno, tupcount as tupcount, state FROM gp_toolkit.__gp_aoseg('uao_threshold');
 segment_id | segno | tupcount | state 
------------+-------+----------+-------
          0 |     1 |       32 |     1
          1 |     1 |       86 |     1
          1 |     2 |       29 |     1
          2 |     1 |       40 |     1
(4 rows)

VACUUM uao_threshold;
VACUUM
SELECT segment_id, segno, tupcount as tupcount, state FROM gp_toolkit.__gp_aoseg('uao_threshold');
 segment_id | segno | tupcount | state 
------------+-------+----------+-------
          0 |     1 |        0 |     1
          0 |     2 |        9 |     1
          1 |     1 |       86 |     1
          1 |     2 |        0 |     1
          1 |     3 |        7 |     1
          2 |     1 |        0 |     1
          2 |     2 |       11 |     1
(7 rows)

-- The percentage of hidden tuples should be 10.1%
-- The threshold guc is set to 10%
SET gp_appendonly_compaction_threshold=10;
SET
CREATE TABLE uao_threshold_boundary(a int, b int) WITH(appendonly=TRUE) distributed by(a);
CREATE TABLE
INSERT INTO uao_threshold_boundary SELECT 1, i from generate_series(1, 1000) i;
INSERT 0 1000
DELETE FROM uao_threshold_boundary WHERE b < 102;
DELETE 101
VACUUM uao_threshold_boundary;
VACUUM
SELECT * FROM gp_toolkit.__gp_aovisimap_compaction_info('uao_threshold_boundary'::regclass);
NOTICE:  gp_appendonly_compaction_threshold = 10
 content | datafile | compaction_possible | hidden_tupcount | total_tupcount | percent_hidden 
---------+----------+---------------------+-----------------+----------------+----------------
       1 |        1 | f                   |               0 |              0 |           0.00
       1 |        2 | f                   |               0 |            899 |           0.00
(2 rows)

