-- @author prabhd
-- @created 2012-12-05 12:00:00
-- @modified 2012-12-05 12:00:00
-- @tags dml
-- @db_name dmldb
-- @description test: Alter table alter column
-- start_ignore
SET gp_optimizer=on;SET gp_log_optimizer=on;
SET
SET
-- end_ignore
-- CREATE INDEX
SELECT COUNT(*) FROM dml_tab;
 count 
-------
    10
(1 row)

CREATE INDEX dml_tab_idx1 on dml_tab (i);
CREATE INDEX
INSERT INTO dml_tab VALUES(generate_series(12,22),'dml_tab','j','alter operations','01-01-2013',1,'01-01-2013 10:10:00', '01-01-2013 10:10:54+02');
INSERT 0 11
SELECT COUNT(*) FROM dml_tab;
 count 
-------
    21
(1 row)

CREATE INDEX dml_tab_idx2 on dml_tab using bitmap (n);
CREATE INDEX
INSERT INTO dml_tab VALUES(generate_series(12,22),'dml_tab','k','alter operations','01-01-2013',1,'01-01-2013 10:10:00', '01-01-2013 10:10:54+02');
INSERT 0 11
SELECT COUNT(*) FROM dml_tab;
 count 
-------
    32
(1 row)

UPDATE dml_tab SET i = 1 WHERE c ='k';
UPDATE 11
SELECT COUNT(DISTINCT(i)) FROM dml_tab WHERE c='k';
 count 
-------
     1
(1 row)

-- ALTER INDEX
DELETE FROM dml_tab;
DELETE 32
SELECT COUNT(*) FROM dml_tab;
 count 
-------
     0
(1 row)

ALTER INDEX dml_tab_idx1 RENAME TO dml_tab_idx1_new;
ALTER INDEX
ALTER INDEX dml_tab_idx2 RENAME TO dml_tab_idx2_new;
ALTER INDEX
INSERT INTO dml_tab VALUES(generate_series(12,22),'dml_tab','m','alter operations','01-01-2013',1,'01-01-2013 10:10:00', '01-01-2013 10:10:54+02');
INSERT 0 11
SELECT COUNT(*) FROM dml_tab;
 count 
-------
    11
(1 row)

DELETE FROM dml_tab;
DELETE 11
SELECT COUNT(*) FROM dml_tab;
 count 
-------
     0
(1 row)

