DROP TABLE IF EXISTS changedistpolicy_dml_regtab_numeric;
psql:/data/prabhd/test/tincrepo/main/dml/functional/output/changedistpolicy_dml_regtab_numeric_opt.sql:14: NOTICE:  table "changedistpolicy_dml_regtab_numeric" does not exist, skipping
DROP TABLE
CREATE TABLE changedistpolicy_dml_regtab_numeric
(
    col1 numeric,
    col2 numeric,
    col3 char,
    col4 numeric,
    col5 int
) DISTRIBUTED by (col1);
CREATE TABLE
INSERT INTO changedistpolicy_dml_regtab_numeric VALUES(2.000000,2.000000,'a',2.000000,0);
INSERT 0 1
SELECT * FROM changedistpolicy_dml_regtab_numeric ORDER BY 1,2,3,4;
   col1   |   col2   | col3 |   col4   | col5 
----------+----------+------+----------+------
 2.000000 | 2.000000 | a    | 2.000000 |    0
(1 row)

ALTER TABLE changedistpolicy_dml_regtab_numeric SET DISTRIBUTED BY (col3);
ALTER TABLE
INSERT INTO changedistpolicy_dml_regtab_numeric SELECT 1.000000, 1.000000,'b', 1.000000, 1;
INSERT 0 1
SELECT * FROM changedistpolicy_dml_regtab_numeric ORDER BY 1,2,3;
   col1   |   col2   | col3 |   col4   | col5 
----------+----------+------+----------+------
 1.000000 | 1.000000 | b    | 1.000000 |    1
 2.000000 | 2.000000 | a    | 2.000000 |    0
(2 rows)

-- Update distribution key
UPDATE changedistpolicy_dml_regtab_numeric SET col3 ='c' WHERE col3 ='b' AND col5 = 1;
UPDATE 1
SELECT * FROM changedistpolicy_dml_regtab_numeric ORDER BY 1,2,3;
   col1   |   col2   | col3 |   col4   | col5 
----------+----------+------+----------+------
 1.000000 | 1.000000 | c    | 1.000000 |    1
 2.000000 | 2.000000 | a    | 2.000000 |    0
(2 rows)

DELETE FROM changedistpolicy_dml_regtab_numeric WHERE col3 ='c';
DELETE 1
SELECT * FROM changedistpolicy_dml_regtab_numeric ORDER BY 1,2,3;
   col1   |   col2   | col3 |   col4   | col5 
----------+----------+------+----------+------
 2.000000 | 2.000000 | a    | 2.000000 |    0
(1 row)

