DROP TABLE IF EXISTS changedistpolicy_dml_pttab_int;
psql:/data/prabhd/test/tincrepo/main/dml/functional/output/changedistpolicy_dml_pttab_int_opt.sql:14: NOTICE:  table "changedistpolicy_dml_pttab_int" does not exist, skipping
DROP TABLE
CREATE TABLE changedistpolicy_dml_pttab_int
(
    col1 int,
    col2 int,
    col3 char,
    col4 int,
    col5 int
) DISTRIBUTED BY (col1) PARTITION BY RANGE(col2)(partition partone start(1) end(10001) WITH (APPENDONLY=true, COMPRESSLEVEL=5, ORIENTATION=column),partition parttwo start(10001) end(20001) WITH (APPENDONLY=true, COMPRESSLEVEL=5, ORIENTATION=row),partition partthree start(20001) end(30001));
psql:/data/prabhd/test/tincrepo/main/dml/functional/output/changedistpolicy_dml_pttab_int_opt.sql:22: NOTICE:  CREATE TABLE will create partition "changedistpolicy_dml_pttab_int_1_prt_partone" for table "changedistpolicy_dml_pttab_int"
psql:/data/prabhd/test/tincrepo/main/dml/functional/output/changedistpolicy_dml_pttab_int_opt.sql:22: NOTICE:  CREATE TABLE will create partition "changedistpolicy_dml_pttab_int_1_prt_parttwo" for table "changedistpolicy_dml_pttab_int"
psql:/data/prabhd/test/tincrepo/main/dml/functional/output/changedistpolicy_dml_pttab_int_opt.sql:22: NOTICE:  CREATE TABLE will create partition "changedistpolicy_dml_pttab_int_1_prt_partthree" for table "changedistpolicy_dml_pttab_int"
CREATE TABLE
INSERT INTO changedistpolicy_dml_pttab_int VALUES(10000,10000,'a',10000,0);
INSERT 0 1
SELECT * FROM changedistpolicy_dml_pttab_int ORDER BY 1,2,3,4;
 col1  | col2  | col3 | col4  | col5 
-------+-------+------+-------+------
 10000 | 10000 | a    | 10000 |    0
(1 row)

ALTER TABLE changedistpolicy_dml_pttab_int SET DISTRIBUTED BY (col3);
ALTER TABLE
INSERT INTO changedistpolicy_dml_pttab_int SELECT 20000, 20000,'b', 20000, 1;
INSERT 0 1
SELECT * FROM changedistpolicy_dml_pttab_int ORDER BY 1,2,3;
 col1  | col2  | col3 | col4  | col5 
-------+-------+------+-------+------
 10000 | 10000 | a    | 10000 |    0
 20000 | 20000 | b    | 20000 |    1
(2 rows)

-- Update distribution key
UPDATE changedistpolicy_dml_pttab_int SET col3 ='c' WHERE col3 ='b' AND col5 = 1;
UPDATE 1
SELECT * FROM changedistpolicy_dml_pttab_int ORDER BY 1,2,3;
 col1  | col2  | col3 | col4  | col5 
-------+-------+------+-------+------
 10000 | 10000 | a    | 10000 |    0
 20000 | 20000 | c    | 20000 |    1
(2 rows)

DELETE FROM changedistpolicy_dml_pttab_int WHERE col3 ='c';
DELETE 1
SELECT * FROM changedistpolicy_dml_pttab_int ORDER BY 1,2,3;
 col1  | col2  | col3 | col4  | col5 
-------+-------+------+-------+------
 10000 | 10000 | a    | 10000 |    0
(1 row)

