DROP TABLE IF EXISTS changedistpolicy_dml_regtab_random_float;
psql:/data/prabhd/test/tincrepo/main/dml/functional/output/changedistpolicy_dml_regtab_random_float_opt.sql:14: NOTICE:  table "changedistpolicy_dml_regtab_random_float" does not exist, skipping
DROP TABLE
CREATE TABLE changedistpolicy_dml_regtab_random_float
(
    col1 float,
    col2 float,
    col3 char,
    col4 float,
    col5 int
) DISTRIBUTED by (col1);
CREATE TABLE
INSERT INTO changedistpolicy_dml_regtab_random_float VALUES(2.00,2.00,'a',2.00,0);
INSERT 0 1
SELECT * FROM changedistpolicy_dml_regtab_random_float ORDER BY 1,2,3,4;
 col1 | col2 | col3 | col4 | col5 
------+------+------+------+------
    2 |    2 | a    |    2 |    0
(1 row)

ALTER TABLE changedistpolicy_dml_regtab_random_float SET DISTRIBUTED randomly;
ALTER TABLE
INSERT INTO changedistpolicy_dml_regtab_random_float SELECT 1.00, 1.00,'b', 1.00, 1;
INSERT 0 1
SELECT * FROM changedistpolicy_dml_regtab_random_float ORDER BY 1,2,3;
 col1 | col2 | col3 | col4 | col5 
------+------+------+------+------
    1 |    1 | b    |    1 |    1
    2 |    2 | a    |    2 |    0
(2 rows)

-- Update distribution key
UPDATE changedistpolicy_dml_regtab_random_float SET col3 ='c' WHERE col3 ='b' AND col5 = 1;
UPDATE 1
SELECT * FROM changedistpolicy_dml_regtab_random_float ORDER BY 1,2,3;
 col1 | col2 | col3 | col4 | col5 
------+------+------+------+------
    1 |    1 | c    |    1 |    1
    2 |    2 | a    |    2 |    0
(2 rows)

DELETE FROM changedistpolicy_dml_regtab_random_float WHERE col3 ='c';
DELETE 1
SELECT * FROM changedistpolicy_dml_regtab_random_float ORDER BY 1,2,3;
 col1 | col2 | col3 | col4 | col5 
------+------+------+------+------
    2 |    2 | a    |    2 |    0
(1 row)

