DROP TABLE IF EXISTS changedistpolicy_dml_regtab_date;
psql:/data/prabhd/test/tincrepo/main/dml/functional/output/changedistpolicy_dml_regtab_date_opt.sql:14: NOTICE:  table "changedistpolicy_dml_regtab_date" does not exist, skipping
DROP TABLE
CREATE TABLE changedistpolicy_dml_regtab_date
(
    col1 date,
    col2 date,
    col3 char,
    col4 date,
    col5 int
) DISTRIBUTED by (col1);
CREATE TABLE
INSERT INTO changedistpolicy_dml_regtab_date VALUES('2013-12-30','2013-12-30','a','2013-12-30',0);
INSERT 0 1
SELECT * FROM changedistpolicy_dml_regtab_date ORDER BY 1,2,3,4;
    col1    |    col2    | col3 |    col4    | col5 
------------+------------+------+------------+------
 2013-12-30 | 2013-12-30 | a    | 2013-12-30 |    0
(1 row)

ALTER TABLE changedistpolicy_dml_regtab_date SET DISTRIBUTED BY (col3);
ALTER TABLE
INSERT INTO changedistpolicy_dml_regtab_date SELECT '2014-01-01', '2014-01-01','b', '2014-01-01', 1;
INSERT 0 1
SELECT * FROM changedistpolicy_dml_regtab_date ORDER BY 1,2,3;
    col1    |    col2    | col3 |    col4    | col5 
------------+------------+------+------------+------
 2013-12-30 | 2013-12-30 | a    | 2013-12-30 |    0
 2014-01-01 | 2014-01-01 | b    | 2014-01-01 |    1
(2 rows)

-- Update distribution key
UPDATE changedistpolicy_dml_regtab_date SET col3 ='c' WHERE col3 ='b' AND col5 = 1;
UPDATE 1
SELECT * FROM changedistpolicy_dml_regtab_date ORDER BY 1,2,3;
    col1    |    col2    | col3 |    col4    | col5 
------------+------------+------+------------+------
 2013-12-30 | 2013-12-30 | a    | 2013-12-30 |    0
 2014-01-01 | 2014-01-01 | c    | 2014-01-01 |    1
(2 rows)

DELETE FROM changedistpolicy_dml_regtab_date WHERE col3 ='c';
DELETE 1
SELECT * FROM changedistpolicy_dml_regtab_date ORDER BY 1,2,3;
    col1    |    col2    | col3 |    col4    | col5 
------------+------------+------+------------+------
 2013-12-30 | 2013-12-30 | a    | 2013-12-30 |    0
(1 row)

