DROP TABLE IF EXISTS changedistpolicy_dml_regtab_char;
psql:/data/prabhd/test/tincrepo/main/dml/functional/output/changedistpolicy_dml_regtab_char_opt.sql:14: NOTICE:  table "changedistpolicy_dml_regtab_char" does not exist, skipping
DROP TABLE
CREATE TABLE changedistpolicy_dml_regtab_char
(
    col1 char,
    col2 char,
    col3 char,
    col4 char,
    col5 int
) DISTRIBUTED by (col1);
CREATE TABLE
INSERT INTO changedistpolicy_dml_regtab_char VALUES('g','g','a','g',0);
INSERT 0 1
SELECT * FROM changedistpolicy_dml_regtab_char ORDER BY 1,2,3,4;
 col1 | col2 | col3 | col4 | col5 
------+------+------+------+------
 g    | g    | a    | g    |    0
(1 row)

ALTER TABLE changedistpolicy_dml_regtab_char SET DISTRIBUTED BY (col3);
ALTER TABLE
INSERT INTO changedistpolicy_dml_regtab_char SELECT 'a', 'a','b', 'a', 1;
INSERT 0 1
SELECT * FROM changedistpolicy_dml_regtab_char ORDER BY 1,2,3;
 col1 | col2 | col3 | col4 | col5 
------+------+------+------+------
 a    | a    | b    | a    |    1
 g    | g    | a    | g    |    0
(2 rows)

-- Update distribution key
UPDATE changedistpolicy_dml_regtab_char SET col3 ='c' WHERE col3 ='b' AND col5 = 1;
UPDATE 1
SELECT * FROM changedistpolicy_dml_regtab_char ORDER BY 1,2,3;
 col1 | col2 | col3 | col4 | col5 
------+------+------+------+------
 a    | a    | c    | a    |    1
 g    | g    | a    | g    |    0
(2 rows)

DELETE FROM changedistpolicy_dml_regtab_char WHERE col3 ='c';
DELETE 1
SELECT * FROM changedistpolicy_dml_regtab_char ORDER BY 1,2,3;
 col1 | col2 | col3 | col4 | col5 
------+------+------+------+------
 g    | g    | a    | g    |    0
(1 row)

