DROP TABLE IF EXISTS changedistpolicy_dml_regtab_random_int8;
psql:/data/prabhd/test/tincrepo/main/dml/functional/output/changedistpolicy_dml_regtab_random_int8_opt.sql:14: NOTICE:  table "changedistpolicy_dml_regtab_random_int8" does not exist, skipping
DROP TABLE
CREATE TABLE changedistpolicy_dml_regtab_random_int8
(
    col1 int8,
    col2 int8,
    col3 char,
    col4 int8,
    col5 int
) DISTRIBUTED by (col1);
CREATE TABLE
INSERT INTO changedistpolicy_dml_regtab_random_int8 VALUES(200000000000000000,200000000000000000,'a',200000000000000000,0);
INSERT 0 1
SELECT * FROM changedistpolicy_dml_regtab_random_int8 ORDER BY 1,2,3,4;
        col1        |        col2        | col3 |        col4        | col5 
--------------------+--------------------+------+--------------------+------
 200000000000000000 | 200000000000000000 | a    | 200000000000000000 |    0
(1 row)

ALTER TABLE changedistpolicy_dml_regtab_random_int8 SET DISTRIBUTED randomly;
ALTER TABLE
INSERT INTO changedistpolicy_dml_regtab_random_int8 SELECT 1000000000000000000, 1000000000000000000,'b', 1000000000000000000, 1;
INSERT 0 1
SELECT * FROM changedistpolicy_dml_regtab_random_int8 ORDER BY 1,2,3;
        col1         |        col2         | col3 |        col4         | col5 
---------------------+---------------------+------+---------------------+------
  200000000000000000 |  200000000000000000 | a    |  200000000000000000 |    0
 1000000000000000000 | 1000000000000000000 | b    | 1000000000000000000 |    1
(2 rows)

-- Update distribution key
UPDATE changedistpolicy_dml_regtab_random_int8 SET col3 ='c' WHERE col3 ='b' AND col5 = 1;
UPDATE 1
SELECT * FROM changedistpolicy_dml_regtab_random_int8 ORDER BY 1,2,3;
        col1         |        col2         | col3 |        col4         | col5 
---------------------+---------------------+------+---------------------+------
  200000000000000000 |  200000000000000000 | a    |  200000000000000000 |    0
 1000000000000000000 | 1000000000000000000 | c    | 1000000000000000000 |    1
(2 rows)

DELETE FROM changedistpolicy_dml_regtab_random_int8 WHERE col3 ='c';
DELETE 1
SELECT * FROM changedistpolicy_dml_regtab_random_int8 ORDER BY 1,2,3;
        col1        |        col2        | col3 |        col4        | col5 
--------------------+--------------------+------+--------------------+------
 200000000000000000 | 200000000000000000 | a    | 200000000000000000 |    0
(1 row)

