DROP TABLE IF EXISTS changedistpolicy_dml_regtab_int;
psql:/data/prabhd/test/tincrepo/main/dml/functional/output/changedistpolicy_dml_regtab_int_opt.sql:14: NOTICE:  table "changedistpolicy_dml_regtab_int" does not exist, skipping
DROP TABLE
CREATE TABLE changedistpolicy_dml_regtab_int
(
    col1 int,
    col2 int,
    col3 char,
    col4 int,
    col5 int
) DISTRIBUTED by (col1);
CREATE TABLE
INSERT INTO changedistpolicy_dml_regtab_int VALUES(10000,10000,'a',10000,0);
INSERT 0 1
SELECT * FROM changedistpolicy_dml_regtab_int ORDER BY 1,2,3,4;
 col1  | col2  | col3 | col4  | col5 
-------+-------+------+-------+------
 10000 | 10000 | a    | 10000 |    0
(1 row)

ALTER TABLE changedistpolicy_dml_regtab_int SET DISTRIBUTED BY (col3);
ALTER TABLE
INSERT INTO changedistpolicy_dml_regtab_int SELECT 20000, 20000,'b', 20000, 1;
INSERT 0 1
SELECT * FROM changedistpolicy_dml_regtab_int ORDER BY 1,2,3;
 col1  | col2  | col3 | col4  | col5 
-------+-------+------+-------+------
 10000 | 10000 | a    | 10000 |    0
 20000 | 20000 | b    | 20000 |    1
(2 rows)

-- Update distribution key
UPDATE changedistpolicy_dml_regtab_int SET col3 ='c' WHERE col3 ='b' AND col5 = 1;
UPDATE 1
SELECT * FROM changedistpolicy_dml_regtab_int ORDER BY 1,2,3;
 col1  | col2  | col3 | col4  | col5 
-------+-------+------+-------+------
 10000 | 10000 | a    | 10000 |    0
 20000 | 20000 | c    | 20000 |    1
(2 rows)

DELETE FROM changedistpolicy_dml_regtab_int WHERE col3 ='c';
DELETE 1
SELECT * FROM changedistpolicy_dml_regtab_int ORDER BY 1,2,3;
 col1  | col2  | col3 | col4  | col5 
-------+-------+------+-------+------
 10000 | 10000 | a    | 10000 |    0
(1 row)

