DROP TABLE IF EXISTS changedistpolicy_dml_regtab_int4;
psql:/data/prabhd/test/tincrepo/main/dml/functional/output/changedistpolicy_dml_regtab_int4_opt.sql:14: NOTICE:  table "changedistpolicy_dml_regtab_int4" does not exist, skipping
DROP TABLE
CREATE TABLE changedistpolicy_dml_regtab_int4
(
    col1 int4,
    col2 int4,
    col3 char,
    col4 int4,
    col5 int
) DISTRIBUTED by (col1);
CREATE TABLE
INSERT INTO changedistpolicy_dml_regtab_int4 VALUES(20000000,20000000,'a',20000000,0);
INSERT 0 1
SELECT * FROM changedistpolicy_dml_regtab_int4 ORDER BY 1,2,3,4;
   col1   |   col2   | col3 |   col4   | col5 
----------+----------+------+----------+------
 20000000 | 20000000 | a    | 20000000 |    0
(1 row)

ALTER TABLE changedistpolicy_dml_regtab_int4 SET DISTRIBUTED BY (col3);
ALTER TABLE
INSERT INTO changedistpolicy_dml_regtab_int4 SELECT 10000000, 10000000,'b', 10000000, 1;
INSERT 0 1
SELECT * FROM changedistpolicy_dml_regtab_int4 ORDER BY 1,2,3;
   col1   |   col2   | col3 |   col4   | col5 
----------+----------+------+----------+------
 10000000 | 10000000 | b    | 10000000 |    1
 20000000 | 20000000 | a    | 20000000 |    0
(2 rows)

-- Update distribution key
UPDATE changedistpolicy_dml_regtab_int4 SET col3 ='c' WHERE col3 ='b' AND col5 = 1;
UPDATE 1
SELECT * FROM changedistpolicy_dml_regtab_int4 ORDER BY 1,2,3;
   col1   |   col2   | col3 |   col4   | col5 
----------+----------+------+----------+------
 10000000 | 10000000 | c    | 10000000 |    1
 20000000 | 20000000 | a    | 20000000 |    0
(2 rows)

DELETE FROM changedistpolicy_dml_regtab_int4 WHERE col3 ='c';
DELETE 1
SELECT * FROM changedistpolicy_dml_regtab_int4 ORDER BY 1,2,3;
   col1   |   col2   | col3 |   col4   | col5 
----------+----------+------+----------+------
 20000000 | 20000000 | a    | 20000000 |    0
(1 row)

