DROP TABLE IF EXISTS changedistpolicy_dml_regtab_decimal;
psql:/data/prabhd/test/tincrepo/main/dml/functional/output/changedistpolicy_dml_regtab_decimal_opt.sql:14: NOTICE:  table "changedistpolicy_dml_regtab_decimal" does not exist, skipping
DROP TABLE
CREATE TABLE changedistpolicy_dml_regtab_decimal
(
    col1 decimal,
    col2 decimal,
    col3 char,
    col4 decimal,
    col5 int
) DISTRIBUTED by (col1);
CREATE TABLE
INSERT INTO changedistpolicy_dml_regtab_decimal VALUES(2.00,2.00,'a',2.00,0);
INSERT 0 1
SELECT * FROM changedistpolicy_dml_regtab_decimal ORDER BY 1,2,3,4;
 col1 | col2 | col3 | col4 | col5 
------+------+------+------+------
 2.00 | 2.00 | a    | 2.00 |    0
(1 row)

ALTER TABLE changedistpolicy_dml_regtab_decimal SET DISTRIBUTED BY (col3);
ALTER TABLE
INSERT INTO changedistpolicy_dml_regtab_decimal SELECT 1.00, 1.00,'b', 1.00, 1;
INSERT 0 1
SELECT * FROM changedistpolicy_dml_regtab_decimal ORDER BY 1,2,3;
 col1 | col2 | col3 | col4 | col5 
------+------+------+------+------
 1.00 | 1.00 | b    | 1.00 |    1
 2.00 | 2.00 | a    | 2.00 |    0
(2 rows)

-- Update distribution key
UPDATE changedistpolicy_dml_regtab_decimal SET col3 ='c' WHERE col3 ='b' AND col5 = 1;
UPDATE 1
SELECT * FROM changedistpolicy_dml_regtab_decimal ORDER BY 1,2,3;
 col1 | col2 | col3 | col4 | col5 
------+------+------+------+------
 1.00 | 1.00 | c    | 1.00 |    1
 2.00 | 2.00 | a    | 2.00 |    0
(2 rows)

DELETE FROM changedistpolicy_dml_regtab_decimal WHERE col3 ='c';
DELETE 1
SELECT * FROM changedistpolicy_dml_regtab_decimal ORDER BY 1,2,3;
 col1 | col2 | col3 | col4 | col5 
------+------+------+------+------
 2.00 | 2.00 | a    | 2.00 |    0
(1 row)

