DROP TABLE IF EXISTS changedistpolicy_dml_pttab_numeric;
psql:/data/prabhd/test/tincrepo/main/dml/functional/output/changedistpolicy_dml_pttab_numeric_opt.sql:14: NOTICE:  table "changedistpolicy_dml_pttab_numeric" does not exist, skipping
DROP TABLE
CREATE TABLE changedistpolicy_dml_pttab_numeric
(
    col1 numeric,
    col2 numeric,
    col3 char,
    col4 numeric,
    col5 int
) DISTRIBUTED BY (col1) PARTITION BY RANGE(col2)(partition partone start(1.000000) end(10.000000)  WITH (APPENDONLY=true, COMPRESSLEVEL=5, ORIENTATION=column),partition parttwo start(10.000000) end(20.000000) WITH (APPENDONLY=true, COMPRESSLEVEL=5, ORIENTATION=row),partition partthree start(20.000000) end(30.000000));
psql:/data/prabhd/test/tincrepo/main/dml/functional/output/changedistpolicy_dml_pttab_numeric_opt.sql:22: NOTICE:  CREATE TABLE will create partition "changedistpolicy_dml_pttab_numeric_1_prt_partone" for table "changedistpolicy_dml_pttab_numeric"
psql:/data/prabhd/test/tincrepo/main/dml/functional/output/changedistpolicy_dml_pttab_numeric_opt.sql:22: NOTICE:  CREATE TABLE will create partition "changedistpolicy_dml_pttab_numeric_1_prt_parttwo" for table "changedistpolicy_dml_pttab_numeric"
psql:/data/prabhd/test/tincrepo/main/dml/functional/output/changedistpolicy_dml_pttab_numeric_opt.sql:22: NOTICE:  CREATE TABLE will create partition "changedistpolicy_dml_pttab_numeric_1_prt_partthree" for table "changedistpolicy_dml_pttab_numeric"
CREATE TABLE
INSERT INTO changedistpolicy_dml_pttab_numeric VALUES(2.000000,2.000000,'a',2.000000,0);
INSERT 0 1
SELECT * FROM changedistpolicy_dml_pttab_numeric ORDER BY 1,2,3,4;
   col1   |   col2   | col3 |   col4   | col5 
----------+----------+------+----------+------
 2.000000 | 2.000000 | a    | 2.000000 |    0
(1 row)

ALTER TABLE changedistpolicy_dml_pttab_numeric SET DISTRIBUTED BY (col3);
ALTER TABLE
INSERT INTO changedistpolicy_dml_pttab_numeric SELECT 1.000000, 1.000000,'b', 1.000000, 1;
INSERT 0 1
SELECT * FROM changedistpolicy_dml_pttab_numeric ORDER BY 1,2,3;
   col1   |   col2   | col3 |   col4   | col5 
----------+----------+------+----------+------
 1.000000 | 1.000000 | b    | 1.000000 |    1
 2.000000 | 2.000000 | a    | 2.000000 |    0
(2 rows)

-- Update distribution key
UPDATE changedistpolicy_dml_pttab_numeric SET col3 ='c' WHERE col3 ='b' AND col5 = 1;
UPDATE 1
SELECT * FROM changedistpolicy_dml_pttab_numeric ORDER BY 1,2,3;
   col1   |   col2   | col3 |   col4   | col5 
----------+----------+------+----------+------
 1.000000 | 1.000000 | c    | 1.000000 |    1
 2.000000 | 2.000000 | a    | 2.000000 |    0
(2 rows)

DELETE FROM changedistpolicy_dml_pttab_numeric WHERE col3 ='c';
DELETE 1
SELECT * FROM changedistpolicy_dml_pttab_numeric ORDER BY 1,2,3;
   col1   |   col2   | col3 |   col4   | col5 
----------+----------+------+----------+------
 2.000000 | 2.000000 | a    | 2.000000 |    0
(1 row)

