DROP TABLE IF EXISTS changedistpolicy_dml_pttab_char;
psql:/data/prabhd/test/tincrepo/main/dml/functional/output/changedistpolicy_dml_pttab_char_opt.sql:14: NOTICE:  table "changedistpolicy_dml_pttab_char" does not exist, skipping
DROP TABLE
CREATE TABLE changedistpolicy_dml_pttab_char
(
    col1 char,
    col2 char,
    col3 char,
    col4 char,
    col5 int
) DISTRIBUTED BY (col1) PARTITION BY LIST(col2)(partition partone VALUES('a','b','c','d','e','f','g','h') WITH (APPENDONLY=true, COMPRESSLEVEL=5, ORIENTATION=column),partition parttwo VALUES('i','j','k','l','m','n','o','p') WITH (APPENDONLY=true, COMPRESSLEVEL=5, ORIENTATION=row),partition partthree VALUES('q','r','s','t','u','v','w','x'));
psql:/data/prabhd/test/tincrepo/main/dml/functional/output/changedistpolicy_dml_pttab_char_opt.sql:22: NOTICE:  CREATE TABLE will create partition "changedistpolicy_dml_pttab_char_1_prt_partone" for table "changedistpolicy_dml_pttab_char"
psql:/data/prabhd/test/tincrepo/main/dml/functional/output/changedistpolicy_dml_pttab_char_opt.sql:22: NOTICE:  CREATE TABLE will create partition "changedistpolicy_dml_pttab_char_1_prt_parttwo" for table "changedistpolicy_dml_pttab_char"
psql:/data/prabhd/test/tincrepo/main/dml/functional/output/changedistpolicy_dml_pttab_char_opt.sql:22: NOTICE:  CREATE TABLE will create partition "changedistpolicy_dml_pttab_char_1_prt_partthree" for table "changedistpolicy_dml_pttab_char"
CREATE TABLE
INSERT INTO changedistpolicy_dml_pttab_char VALUES('g','g','a','g',0);
INSERT 0 1
SELECT * FROM changedistpolicy_dml_pttab_char ORDER BY 1,2,3,4;
 col1 | col2 | col3 | col4 | col5 
------+------+------+------+------
 g    | g    | a    | g    |    0
(1 row)

ALTER TABLE changedistpolicy_dml_pttab_char SET DISTRIBUTED BY (col3);
ALTER TABLE
INSERT INTO changedistpolicy_dml_pttab_char SELECT 'a', 'a','b', 'a', 1;
INSERT 0 1
SELECT * FROM changedistpolicy_dml_pttab_char ORDER BY 1,2,3;
 col1 | col2 | col3 | col4 | col5 
------+------+------+------+------
 a    | a    | b    | a    |    1
 g    | g    | a    | g    |    0
(2 rows)

-- Update distribution key
UPDATE changedistpolicy_dml_pttab_char SET col3 ='c' WHERE col3 ='b' AND col5 = 1;
UPDATE 1
SELECT * FROM changedistpolicy_dml_pttab_char ORDER BY 1,2,3;
 col1 | col2 | col3 | col4 | col5 
------+------+------+------+------
 a    | a    | c    | a    |    1
 g    | g    | a    | g    |    0
(2 rows)

DELETE FROM changedistpolicy_dml_pttab_char WHERE col3 ='c';
DELETE 1
SELECT * FROM changedistpolicy_dml_pttab_char ORDER BY 1,2,3;
 col1 | col2 | col3 | col4 | col5 
------+------+------+------+------
 g    | g    | a    | g    |    0
(1 row)

