DROP TABLE IF EXISTS changedistpolicy_dml_regtab_timestamp;
psql:/data/prabhd/test/tincrepo/main/dml/functional/output/changedistpolicy_dml_regtab_timestamp_opt.sql:14: NOTICE:  table "changedistpolicy_dml_regtab_timestamp" does not exist, skipping
DROP TABLE
CREATE TABLE changedistpolicy_dml_regtab_timestamp
(
    col1 timestamp,
    col2 timestamp,
    col3 char,
    col4 timestamp,
    col5 int
) DISTRIBUTED by (col1);
CREATE TABLE
INSERT INTO changedistpolicy_dml_regtab_timestamp VALUES('2013-12-30 12:00:00','2013-12-30 12:00:00','a','2013-12-30 12:00:00',0);
INSERT 0 1
SELECT * FROM changedistpolicy_dml_regtab_timestamp ORDER BY 1,2,3,4;
        col1         |        col2         | col3 |        col4         | col5 
---------------------+---------------------+------+---------------------+------
 2013-12-30 12:00:00 | 2013-12-30 12:00:00 | a    | 2013-12-30 12:00:00 |    0
(1 row)

ALTER TABLE changedistpolicy_dml_regtab_timestamp SET DISTRIBUTED BY (col3);
ALTER TABLE
INSERT INTO changedistpolicy_dml_regtab_timestamp SELECT '2014-01-01 12:00:00', '2014-01-01 12:00:00','b', '2014-01-01 12:00:00', 1;
INSERT 0 1
SELECT * FROM changedistpolicy_dml_regtab_timestamp ORDER BY 1,2,3;
        col1         |        col2         | col3 |        col4         | col5 
---------------------+---------------------+------+---------------------+------
 2013-12-30 12:00:00 | 2013-12-30 12:00:00 | a    | 2013-12-30 12:00:00 |    0
 2014-01-01 12:00:00 | 2014-01-01 12:00:00 | b    | 2014-01-01 12:00:00 |    1
(2 rows)

-- Update distribution key
UPDATE changedistpolicy_dml_regtab_timestamp SET col3 ='c' WHERE col3 ='b' AND col5 = 1;
UPDATE 1
SELECT * FROM changedistpolicy_dml_regtab_timestamp ORDER BY 1,2,3;
        col1         |        col2         | col3 |        col4         | col5 
---------------------+---------------------+------+---------------------+------
 2013-12-30 12:00:00 | 2013-12-30 12:00:00 | a    | 2013-12-30 12:00:00 |    0
 2014-01-01 12:00:00 | 2014-01-01 12:00:00 | c    | 2014-01-01 12:00:00 |    1
(2 rows)

DELETE FROM changedistpolicy_dml_regtab_timestamp WHERE col3 ='c';
DELETE 1
SELECT * FROM changedistpolicy_dml_regtab_timestamp ORDER BY 1,2,3;
        col1         |        col2         | col3 |        col4         | col5 
---------------------+---------------------+------+---------------------+------
 2013-12-30 12:00:00 | 2013-12-30 12:00:00 | a    | 2013-12-30 12:00:00 |    0
(1 row)

