DROP TABLE IF EXISTS changedistpolicy_dml_pttab_time;
psql:/data/prabhd/test/tincrepo/main/dml/functional/output/changedistpolicy_dml_pttab_time_opt.sql:14: NOTICE:  table "changedistpolicy_dml_pttab_time" does not exist, skipping
DROP TABLE
CREATE TABLE changedistpolicy_dml_pttab_time
(
    col1 time,
    col2 time,
    col3 char,
    col4 time,
    col5 int
) DISTRIBUTED BY (col1) PARTITION BY RANGE(col2)(partition partone start('12:00:00') end('18:00:00')  WITH (APPENDONLY=true, COMPRESSLEVEL=5, ORIENTATION=column),partition parttwo start('18:00:00') end('24:00:00') WITH (APPENDONLY=true, COMPRESSLEVEL=5, ORIENTATION=row),partition partthree start('0:00:00') end('11:00:00'));
psql:/data/prabhd/test/tincrepo/main/dml/functional/output/changedistpolicy_dml_pttab_time_opt.sql:22: NOTICE:  CREATE TABLE will create partition "changedistpolicy_dml_pttab_time_1_prt_partthree" for table "changedistpolicy_dml_pttab_time"
psql:/data/prabhd/test/tincrepo/main/dml/functional/output/changedistpolicy_dml_pttab_time_opt.sql:22: NOTICE:  CREATE TABLE will create partition "changedistpolicy_dml_pttab_time_1_prt_partone" for table "changedistpolicy_dml_pttab_time"
psql:/data/prabhd/test/tincrepo/main/dml/functional/output/changedistpolicy_dml_pttab_time_opt.sql:22: NOTICE:  CREATE TABLE will create partition "changedistpolicy_dml_pttab_time_1_prt_parttwo" for table "changedistpolicy_dml_pttab_time"
CREATE TABLE
INSERT INTO changedistpolicy_dml_pttab_time VALUES('12:00:00','12:00:00','a','12:00:00',0);
INSERT 0 1
SELECT * FROM changedistpolicy_dml_pttab_time ORDER BY 1,2,3,4;
   col1   |   col2   | col3 |   col4   | col5 
----------+----------+------+----------+------
 12:00:00 | 12:00:00 | a    | 12:00:00 |    0
(1 row)

ALTER TABLE changedistpolicy_dml_pttab_time SET DISTRIBUTED BY (col3);
ALTER TABLE
INSERT INTO changedistpolicy_dml_pttab_time SELECT '1:00:00', '1:00:00','b', '1:00:00', 1;
INSERT 0 1
SELECT * FROM changedistpolicy_dml_pttab_time ORDER BY 1,2,3;
   col1   |   col2   | col3 |   col4   | col5 
----------+----------+------+----------+------
 01:00:00 | 01:00:00 | b    | 01:00:00 |    1
 12:00:00 | 12:00:00 | a    | 12:00:00 |    0
(2 rows)

-- Update distribution key
UPDATE changedistpolicy_dml_pttab_time SET col3 ='c' WHERE col3 ='b' AND col5 = 1;
UPDATE 1
SELECT * FROM changedistpolicy_dml_pttab_time ORDER BY 1,2,3;
   col1   |   col2   | col3 |   col4   | col5 
----------+----------+------+----------+------
 01:00:00 | 01:00:00 | c    | 01:00:00 |    1
 12:00:00 | 12:00:00 | a    | 12:00:00 |    0
(2 rows)

DELETE FROM changedistpolicy_dml_pttab_time WHERE col3 ='c';
DELETE 1
SELECT * FROM changedistpolicy_dml_pttab_time ORDER BY 1,2,3;
   col1   |   col2   | col3 |   col4   | col5 
----------+----------+------+----------+------
 12:00:00 | 12:00:00 | a    | 12:00:00 |    0
(1 row)

