DROP TABLE IF EXISTS changedistpolicy_dml_pttab_timestamp;
psql:/data/prabhd/test/tincrepo/main/dml/functional/output/changedistpolicy_dml_pttab_timestamp_opt.sql:14: NOTICE:  table "changedistpolicy_dml_pttab_timestamp" does not exist, skipping
DROP TABLE
CREATE TABLE changedistpolicy_dml_pttab_timestamp
(
    col1 timestamp,
    col2 timestamp,
    col3 char,
    col4 timestamp,
    col5 int
) DISTRIBUTED BY (col1) PARTITION BY RANGE(col2)(partition partone start('2013-12-01 12:00:00') end('2013-12-31 12:00:00') WITH(APPENDONLY=true, COMPRESSLEVEL=5, ORIENTATION=column),partition parttwo start('2013-12-31 12:00:00') end('2014-01-01 12:00:00') inclusive WITH (APPENDONLY=true, COMPRESSLEVEL=5, ORIENTATION=row),partition partthree start('2014-01-02 12:00:00') end('2014-02-01 12:00:00'));
psql:/data/prabhd/test/tincrepo/main/dml/functional/output/changedistpolicy_dml_pttab_timestamp_opt.sql:22: NOTICE:  CREATE TABLE will create partition "changedistpolicy_dml_pttab_timestamp_1_prt_partone" for table "changedistpolicy_dml_pttab_timestamp"
psql:/data/prabhd/test/tincrepo/main/dml/functional/output/changedistpolicy_dml_pttab_timestamp_opt.sql:22: NOTICE:  CREATE TABLE will create partition "changedistpolicy_dml_pttab_timestamp_1_prt_parttwo" for table "changedistpolicy_dml_pttab_timestamp"
psql:/data/prabhd/test/tincrepo/main/dml/functional/output/changedistpolicy_dml_pttab_timestamp_opt.sql:22: NOTICE:  CREATE TABLE will create partition "changedistpolicy_dml_pttab_timestamp_1_prt_partthree" for table "changedistpolicy_dml_pttab_timestamp"
CREATE TABLE
INSERT INTO changedistpolicy_dml_pttab_timestamp VALUES('2013-12-30 12:00:00','2013-12-30 12:00:00','a','2013-12-30 12:00:00',0);
INSERT 0 1
SELECT * FROM changedistpolicy_dml_pttab_timestamp ORDER BY 1,2,3,4;
        col1         |        col2         | col3 |        col4         | col5 
---------------------+---------------------+------+---------------------+------
 2013-12-30 12:00:00 | 2013-12-30 12:00:00 | a    | 2013-12-30 12:00:00 |    0
(1 row)

ALTER TABLE changedistpolicy_dml_pttab_timestamp SET DISTRIBUTED BY (col3);
ALTER TABLE
INSERT INTO changedistpolicy_dml_pttab_timestamp SELECT '2014-01-01 12:00:00', '2014-01-01 12:00:00','b', '2014-01-01 12:00:00', 1;
INSERT 0 1
SELECT * FROM changedistpolicy_dml_pttab_timestamp ORDER BY 1,2,3;
        col1         |        col2         | col3 |        col4         | col5 
---------------------+---------------------+------+---------------------+------
 2013-12-30 12:00:00 | 2013-12-30 12:00:00 | a    | 2013-12-30 12:00:00 |    0
 2014-01-01 12:00:00 | 2014-01-01 12:00:00 | b    | 2014-01-01 12:00:00 |    1
(2 rows)

-- Update distribution key
UPDATE changedistpolicy_dml_pttab_timestamp SET col3 ='c' WHERE col3 ='b' AND col5 = 1;
UPDATE 1
SELECT * FROM changedistpolicy_dml_pttab_timestamp ORDER BY 1,2,3;
        col1         |        col2         | col3 |        col4         | col5 
---------------------+---------------------+------+---------------------+------
 2013-12-30 12:00:00 | 2013-12-30 12:00:00 | a    | 2013-12-30 12:00:00 |    0
 2014-01-01 12:00:00 | 2014-01-01 12:00:00 | c    | 2014-01-01 12:00:00 |    1
(2 rows)

DELETE FROM changedistpolicy_dml_pttab_timestamp WHERE col3 ='c';
DELETE 1
SELECT * FROM changedistpolicy_dml_pttab_timestamp ORDER BY 1,2,3;
        col1         |        col2         | col3 |        col4         | col5 
---------------------+---------------------+------+---------------------+------
 2013-12-30 12:00:00 | 2013-12-30 12:00:00 | a    | 2013-12-30 12:00:00 |    0
(1 row)

