DROP TABLE IF EXISTS colalias_dml_char;
psql:/data/prabhd/test/tincrepo/main/dml/functional/output/colalias_dml_char_opt.sql:14: NOTICE:  table "colalias_dml_char" does not exist, skipping
DROP TABLE
CREATE TABLE colalias_dml_char
(
    col1 char DEFAULT 'a',
    col2 char,
    col3 char,
    col4 char,
    col5 char
) 
DISTRIBUTED by (col1)
PARTITION BY LIST(col2)
(
default partition def 
);
psql:/data/prabhd/test/tincrepo/main/dml/functional/output/colalias_dml_char_opt.sql:27: NOTICE:  CREATE TABLE will create partition "colalias_dml_char_1_prt_def" for table "colalias_dml_char"
CREATE TABLE
DROP TABLE IF EXISTS colalias_dml_char_candidate;
psql:/data/prabhd/test/tincrepo/main/dml/functional/output/colalias_dml_char_opt.sql:29: NOTICE:  table "colalias_dml_char_candidate" does not exist, skipping
DROP TABLE
CREATE TABLE colalias_dml_char_candidate
(
    col1 char DEFAULT 'a',
    col2 char,
    col3 char,
    col4 char,
    col5 char
) DISTRIBUTED by (col2);
CREATE TABLE
INSERT INTO colalias_dml_char_candidate VALUES('g','a','a','g','a');
INSERT 0 1
INSERT INTO colalias_dml_char(col2,col1,col3,col5,col4) SELECT col1,col2,col3,col5,col4 FROM (SELECT col1,col1 as col2,col3,col5 as col4,col5  FROM colalias_dml_char_candidate)foo;
INSERT 0 1
SELECT * FROM colalias_dml_char ORDER BY 1,2,3,4;
 col1 | col2 | col3 | col4 | col5 
------+------+------+------+------
 g    | g    | a    | a    | a
(1 row)

UPDATE colalias_dml_char SET col1 = (select col2 as col1 FROM colalias_dml_char_candidate);
UPDATE 1
SELECT * FROM colalias_dml_char ORDER BY 1,2,3,4;
 col1 | col2 | col3 | col4 | col5 
------+------+------+------+------
 a    | g    | a    | a    | a
(1 row)

UPDATE colalias_dml_char SET col1 =colalias_dml_char_candidate.col2 FROM colalias_dml_char_candidate;
UPDATE 1
SELECT * FROM colalias_dml_char ORDER BY 1,2,3,4;
 col1 | col2 | col3 | col4 | col5 
------+------+------+------+------
 a    | g    | a    | a    | a
(1 row)

