DROP TABLE IF EXISTS colalias_dml_time;
psql:/data/prabhd/test/tincrepo/main/dml/functional/output/colalias_dml_time_opt.sql:14: NOTICE:  table "colalias_dml_time" does not exist, skipping
DROP TABLE
CREATE TABLE colalias_dml_time
(
    col1 time DEFAULT '1:00:00',
    col2 time,
    col3 char,
    col4 time,
    col5 time
) 
DISTRIBUTED by (col1)
PARTITION BY LIST(col2)
(
default partition def 
);
psql:/data/prabhd/test/tincrepo/main/dml/functional/output/colalias_dml_time_opt.sql:27: NOTICE:  CREATE TABLE will create partition "colalias_dml_time_1_prt_def" for table "colalias_dml_time"
CREATE TABLE
DROP TABLE IF EXISTS colalias_dml_time_candidate;
psql:/data/prabhd/test/tincrepo/main/dml/functional/output/colalias_dml_time_opt.sql:29: NOTICE:  table "colalias_dml_time_candidate" does not exist, skipping
DROP TABLE
CREATE TABLE colalias_dml_time_candidate
(
    col1 time DEFAULT '1:00:00',
    col2 time,
    col3 char,
    col4 time,
    col5 time
) DISTRIBUTED by (col2);
CREATE TABLE
INSERT INTO colalias_dml_time_candidate VALUES('12:00:00','1:00:00','a','12:00:00','1:00:00');
INSERT 0 1
INSERT INTO colalias_dml_time(col2,col1,col3,col5,col4) SELECT col1,col2,col3,col5,col4 FROM (SELECT col1,col1 as col2,col3,col5 as col4,col5  FROM colalias_dml_time_candidate)foo;
INSERT 0 1
SELECT * FROM colalias_dml_time ORDER BY 1,2,3,4;
   col1   |   col2   | col3 |   col4   |   col5   
----------+----------+------+----------+----------
 12:00:00 | 12:00:00 | a    | 01:00:00 | 01:00:00
(1 row)

UPDATE colalias_dml_time SET col1 = (select col2 as col1 FROM colalias_dml_time_candidate);
UPDATE 1
SELECT * FROM colalias_dml_time ORDER BY 1,2,3,4;
   col1   |   col2   | col3 |   col4   |   col5   
----------+----------+------+----------+----------
 01:00:00 | 12:00:00 | a    | 01:00:00 | 01:00:00
(1 row)

UPDATE colalias_dml_time SET col1 =colalias_dml_time_candidate.col2 FROM colalias_dml_time_candidate;
UPDATE 1
SELECT * FROM colalias_dml_time ORDER BY 1,2,3,4;
   col1   |   col2   | col3 |   col4   |   col5   
----------+----------+------+----------+----------
 01:00:00 | 12:00:00 | a    | 01:00:00 | 01:00:00
(1 row)

