DROP TABLE IF EXISTS colalias_dml_int;
psql:/data/prabhd/test/tincrepo/main/dml/functional/output/colalias_dml_int_opt.sql:14: NOTICE:  table "colalias_dml_int" does not exist, skipping
DROP TABLE
CREATE TABLE colalias_dml_int
(
    col1 int DEFAULT 20000,
    col2 int,
    col3 char,
    col4 int,
    col5 int
) 
DISTRIBUTED by (col1)
PARTITION BY LIST(col2)
(
default partition def 
);
psql:/data/prabhd/test/tincrepo/main/dml/functional/output/colalias_dml_int_opt.sql:27: NOTICE:  CREATE TABLE will create partition "colalias_dml_int_1_prt_def" for table "colalias_dml_int"
CREATE TABLE
DROP TABLE IF EXISTS colalias_dml_int_candidate;
psql:/data/prabhd/test/tincrepo/main/dml/functional/output/colalias_dml_int_opt.sql:29: NOTICE:  table "colalias_dml_int_candidate" does not exist, skipping
DROP TABLE
CREATE TABLE colalias_dml_int_candidate
(
    col1 int DEFAULT 20000,
    col2 int,
    col3 char,
    col4 int,
    col5 int
) DISTRIBUTED by (col2);
CREATE TABLE
INSERT INTO colalias_dml_int_candidate VALUES(10000,20000,'a',10000,20000);
INSERT 0 1
INSERT INTO colalias_dml_int(col2,col1,col3,col5,col4) SELECT col1,col2,col3,col5,col4 FROM (SELECT col1,col1 as col2,col3,col5 as col4,col5  FROM colalias_dml_int_candidate)foo;
INSERT 0 1
SELECT * FROM colalias_dml_int ORDER BY 1,2,3,4;
 col1  | col2  | col3 | col4  | col5  
-------+-------+------+-------+-------
 10000 | 10000 | a    | 20000 | 20000
(1 row)

UPDATE colalias_dml_int SET col1 = (select col2 as col1 FROM colalias_dml_int_candidate);
UPDATE 1
SELECT * FROM colalias_dml_int ORDER BY 1,2,3,4;
 col1  | col2  | col3 | col4  | col5  
-------+-------+------+-------+-------
 20000 | 10000 | a    | 20000 | 20000
(1 row)

UPDATE colalias_dml_int SET col1 =colalias_dml_int_candidate.col2 FROM colalias_dml_int_candidate;
UPDATE 1
SELECT * FROM colalias_dml_int ORDER BY 1,2,3,4;
 col1  | col2  | col3 | col4  | col5  
-------+-------+------+-------+-------
 20000 | 10000 | a    | 20000 | 20000
(1 row)

