DROP TABLE IF EXISTS colalias_dml_int4;
psql:/data/prabhd/test/tincrepo/main/dml/functional/output/colalias_dml_int4_opt.sql:14: NOTICE:  table "colalias_dml_int4" does not exist, skipping
DROP TABLE
CREATE TABLE colalias_dml_int4
(
    col1 int4 DEFAULT 10000000,
    col2 int4,
    col3 char,
    col4 int4,
    col5 int4
) 
DISTRIBUTED by (col1)
PARTITION BY LIST(col2)
(
default partition def 
);
psql:/data/prabhd/test/tincrepo/main/dml/functional/output/colalias_dml_int4_opt.sql:27: NOTICE:  CREATE TABLE will create partition "colalias_dml_int4_1_prt_def" for table "colalias_dml_int4"
CREATE TABLE
DROP TABLE IF EXISTS colalias_dml_int4_candidate;
psql:/data/prabhd/test/tincrepo/main/dml/functional/output/colalias_dml_int4_opt.sql:29: NOTICE:  table "colalias_dml_int4_candidate" does not exist, skipping
DROP TABLE
CREATE TABLE colalias_dml_int4_candidate
(
    col1 int4 DEFAULT 10000000,
    col2 int4,
    col3 char,
    col4 int4,
    col5 int4
) DISTRIBUTED by (col2);
CREATE TABLE
INSERT INTO colalias_dml_int4_candidate VALUES(20000000,10000000,'a',20000000,10000000);
INSERT 0 1
INSERT INTO colalias_dml_int4(col2,col1,col3,col5,col4) SELECT col1,col2,col3,col5,col4 FROM (SELECT col1,col1 as col2,col3,col5 as col4,col5  FROM colalias_dml_int4_candidate)foo;
INSERT 0 1
SELECT * FROM colalias_dml_int4 ORDER BY 1,2,3,4;
   col1   |   col2   | col3 |   col4   |   col5   
----------+----------+------+----------+----------
 20000000 | 20000000 | a    | 10000000 | 10000000
(1 row)

UPDATE colalias_dml_int4 SET col1 = (select col2 as col1 FROM colalias_dml_int4_candidate);
UPDATE 1
SELECT * FROM colalias_dml_int4 ORDER BY 1,2,3,4;
   col1   |   col2   | col3 |   col4   |   col5   
----------+----------+------+----------+----------
 10000000 | 20000000 | a    | 10000000 | 10000000
(1 row)

UPDATE colalias_dml_int4 SET col1 =colalias_dml_int4_candidate.col2 FROM colalias_dml_int4_candidate;
UPDATE 1
SELECT * FROM colalias_dml_int4 ORDER BY 1,2,3,4;
   col1   |   col2   | col3 |   col4   |   col5   
----------+----------+------+----------+----------
 10000000 | 20000000 | a    | 10000000 | 10000000
(1 row)

