DROP TABLE IF EXISTS colalias_dml_float;
psql:/data/prabhd/test/tincrepo/main/dml/functional/output/colalias_dml_float_opt.sql:14: NOTICE:  table "colalias_dml_float" does not exist, skipping
DROP TABLE
CREATE TABLE colalias_dml_float
(
    col1 float DEFAULT 1.00,
    col2 float,
    col3 char,
    col4 float,
    col5 float
) 
DISTRIBUTED by (col1)
PARTITION BY LIST(col2)
(
default partition def 
);
psql:/data/prabhd/test/tincrepo/main/dml/functional/output/colalias_dml_float_opt.sql:27: NOTICE:  CREATE TABLE will create partition "colalias_dml_float_1_prt_def" for table "colalias_dml_float"
CREATE TABLE
DROP TABLE IF EXISTS colalias_dml_float_candidate;
psql:/data/prabhd/test/tincrepo/main/dml/functional/output/colalias_dml_float_opt.sql:29: NOTICE:  table "colalias_dml_float_candidate" does not exist, skipping
DROP TABLE
CREATE TABLE colalias_dml_float_candidate
(
    col1 float DEFAULT 1.00,
    col2 float,
    col3 char,
    col4 float,
    col5 float
) DISTRIBUTED by (col2);
CREATE TABLE
INSERT INTO colalias_dml_float_candidate VALUES(2.00,1.00,'a',2.00,1.00);
INSERT 0 1
INSERT INTO colalias_dml_float(col2,col1,col3,col5,col4) SELECT col1,col2,col3,col5,col4 FROM (SELECT col1,col1 as col2,col3,col5 as col4,col5  FROM colalias_dml_float_candidate)foo;
INSERT 0 1
SELECT * FROM colalias_dml_float ORDER BY 1,2,3,4;
 col1 | col2 | col3 | col4 | col5 
------+------+------+------+------
    2 |    2 | a    |    1 |    1
(1 row)

UPDATE colalias_dml_float SET col1 = (select col2 as col1 FROM colalias_dml_float_candidate);
UPDATE 1
SELECT * FROM colalias_dml_float ORDER BY 1,2,3,4;
 col1 | col2 | col3 | col4 | col5 
------+------+------+------+------
    1 |    2 | a    |    1 |    1
(1 row)

UPDATE colalias_dml_float SET col1 =colalias_dml_float_candidate.col2 FROM colalias_dml_float_candidate;
UPDATE 1
SELECT * FROM colalias_dml_float ORDER BY 1,2,3,4;
 col1 | col2 | col3 | col4 | col5 
------+------+------+------+------
    1 |    2 | a    |    1 |    1
(1 row)

