DROP TABLE IF EXISTS colalias_dml_int8;
psql:/data/prabhd/test/tincrepo/main/dml/functional/output/colalias_dml_int8_opt.sql:14: NOTICE:  table "colalias_dml_int8" does not exist, skipping
DROP TABLE
CREATE TABLE colalias_dml_int8
(
    col1 int8 DEFAULT 1000000000000000000,
    col2 int8,
    col3 char,
    col4 int8,
    col5 int8
) 
DISTRIBUTED by (col1)
PARTITION BY LIST(col2)
(
default partition def 
);
psql:/data/prabhd/test/tincrepo/main/dml/functional/output/colalias_dml_int8_opt.sql:27: NOTICE:  CREATE TABLE will create partition "colalias_dml_int8_1_prt_def" for table "colalias_dml_int8"
CREATE TABLE
DROP TABLE IF EXISTS colalias_dml_int8_candidate;
psql:/data/prabhd/test/tincrepo/main/dml/functional/output/colalias_dml_int8_opt.sql:29: NOTICE:  table "colalias_dml_int8_candidate" does not exist, skipping
DROP TABLE
CREATE TABLE colalias_dml_int8_candidate
(
    col1 int8 DEFAULT 1000000000000000000,
    col2 int8,
    col3 char,
    col4 int8,
    col5 int8
) DISTRIBUTED by (col2);
CREATE TABLE
INSERT INTO colalias_dml_int8_candidate VALUES(200000000000000000,1000000000000000000,'a',200000000000000000,1000000000000000000);
INSERT 0 1
INSERT INTO colalias_dml_int8(col2,col1,col3,col5,col4) SELECT col1,col2,col3,col5,col4 FROM (SELECT col1,col1 as col2,col3,col5 as col4,col5  FROM colalias_dml_int8_candidate)foo;
INSERT 0 1
SELECT * FROM colalias_dml_int8 ORDER BY 1,2,3,4;
        col1        |        col2        | col3 |        col4         |        col5         
--------------------+--------------------+------+---------------------+---------------------
 200000000000000000 | 200000000000000000 | a    | 1000000000000000000 | 1000000000000000000
(1 row)

UPDATE colalias_dml_int8 SET col1 = (select col2 as col1 FROM colalias_dml_int8_candidate);
UPDATE 1
SELECT * FROM colalias_dml_int8 ORDER BY 1,2,3,4;
        col1         |        col2        | col3 |        col4         |        col5         
---------------------+--------------------+------+---------------------+---------------------
 1000000000000000000 | 200000000000000000 | a    | 1000000000000000000 | 1000000000000000000
(1 row)

UPDATE colalias_dml_int8 SET col1 =colalias_dml_int8_candidate.col2 FROM colalias_dml_int8_candidate;
UPDATE 1
SELECT * FROM colalias_dml_int8 ORDER BY 1,2,3,4;
        col1         |        col2        | col3 |        col4         |        col5         
---------------------+--------------------+------+---------------------+---------------------
 1000000000000000000 | 200000000000000000 | a    | 1000000000000000000 | 1000000000000000000
(1 row)

