DROP TABLE IF EXISTS computedcol_dml_float;
psql:/data/prabhd/test/tincrepo/main/dml/functional/output/computedcol_dml_float_opt.sql:14: NOTICE:  table "computedcol_dml_float" does not exist, skipping
DROP TABLE
CREATE TABLE computedcol_dml_float
(
    col1 float DEFAULT 1.00,
    col2 float,
    col3 char,
    col4 float,
    col5 int
) 
DISTRIBUTED by (col1)
PARTITION BY RANGE(col2)(partition partone start(1.00) end(10.00)  WITH (APPENDONLY=true, COMPRESSLEVEL=5, ORIENTATION=column),partition parttwo start(10.00) end(20.00) WITH (APPENDONLY=true, COMPRESSLEVEL=5, ORIENTATION=row),partition partthree start(20.00) end(30.00), default partition def);
psql:/data/prabhd/test/tincrepo/main/dml/functional/output/computedcol_dml_float_opt.sql:24: NOTICE:  CREATE TABLE will create partition "computedcol_dml_float_1_prt_def" for table "computedcol_dml_float"
psql:/data/prabhd/test/tincrepo/main/dml/functional/output/computedcol_dml_float_opt.sql:24: NOTICE:  CREATE TABLE will create partition "computedcol_dml_float_1_prt_partone" for table "computedcol_dml_float"
psql:/data/prabhd/test/tincrepo/main/dml/functional/output/computedcol_dml_float_opt.sql:24: NOTICE:  CREATE TABLE will create partition "computedcol_dml_float_1_prt_parttwo" for table "computedcol_dml_float"
psql:/data/prabhd/test/tincrepo/main/dml/functional/output/computedcol_dml_float_opt.sql:24: NOTICE:  CREATE TABLE will create partition "computedcol_dml_float_1_prt_partthree" for table "computedcol_dml_float"
CREATE TABLE
INSERT INTO computedcol_dml_float(col2,col1,col3,col5,col4) SELECT 2.00::float+1.00::float, 2.00::float+1.00::float, 'a', 1,2.00::float+1.00::float;
INSERT 0 1
INSERT INTO computedcol_dml_float(col2,col3,col5,col4) SELECT 2.00::float+1.00::float,'a', 1,2.00::float+1.00::float; 
INSERT 0 1
SELECT * FROM computedcol_dml_float ORDER BY 1,2,3,4;
 col1 | col2 | col3 | col4 | col5 
------+------+------+------+------
    1 |    3 | a    |    3 |    1
    3 |    3 | a    |    3 |    1
(2 rows)

UPDATE computedcol_dml_float SET col1=2.00::float+1.00::float;
UPDATE 2
SELECT * FROM computedcol_dml_float ORDER BY 1,2,3,4;
 col1 | col2 | col3 | col4 | col5 
------+------+------+------+------
    3 |    3 | a    |    3 |    1
    3 |    3 | a    |    3 |    1
(2 rows)

DELETE FROM computedcol_dml_float WHERE col1=1.00::float + 2.00::float;
DELETE 2
SELECT * FROM computedcol_dml_float ORDER BY 1,2,3,4;
 col1 | col2 | col3 | col4 | col5 
------+------+------+------+------
(0 rows)

