DROP TABLE IF EXISTS computedcol_dml_interval;
psql:/data/prabhd/test/tincrepo/main/dml/functional/output/computedcol_dml_interval_opt.sql:14: NOTICE:  table "computedcol_dml_interval" does not exist, skipping
DROP TABLE
CREATE TABLE computedcol_dml_interval
(
    col1 interval DEFAULT '11 hours',
    col2 interval,
    col3 char,
    col4 interval,
    col5 int
) 
DISTRIBUTED by (col1)
PARTITION BY RANGE(col2)(partition partone start('1 sec') end('1 min')  WITH (APPENDONLY=true, COMPRESSLEVEL=5, ORIENTATION=column),partition parttwo start('1 min') end('1 hour') WITH (APPENDONLY=true, COMPRESSLEVEL=5, ORIENTATION=row),partition partthree start('1 hour') end('12 hours'), default partition def);
psql:/data/prabhd/test/tincrepo/main/dml/functional/output/computedcol_dml_interval_opt.sql:24: NOTICE:  CREATE TABLE will create partition "computedcol_dml_interval_1_prt_def" for table "computedcol_dml_interval"
psql:/data/prabhd/test/tincrepo/main/dml/functional/output/computedcol_dml_interval_opt.sql:24: NOTICE:  CREATE TABLE will create partition "computedcol_dml_interval_1_prt_partone" for table "computedcol_dml_interval"
psql:/data/prabhd/test/tincrepo/main/dml/functional/output/computedcol_dml_interval_opt.sql:24: NOTICE:  CREATE TABLE will create partition "computedcol_dml_interval_1_prt_parttwo" for table "computedcol_dml_interval"
psql:/data/prabhd/test/tincrepo/main/dml/functional/output/computedcol_dml_interval_opt.sql:24: NOTICE:  CREATE TABLE will create partition "computedcol_dml_interval_1_prt_partthree" for table "computedcol_dml_interval"
CREATE TABLE
INSERT INTO computedcol_dml_interval(col2,col1,col3,col5,col4) SELECT '10 secs'::interval+'11 hours'::interval, '10 secs'::interval+'11 hours'::interval, 'a', 1,'10 secs'::interval+'11 hours'::interval;
INSERT 0 1
INSERT INTO computedcol_dml_interval(col2,col3,col5,col4) SELECT '10 secs'::interval+'11 hours'::interval,'a', 1,'10 secs'::interval+'11 hours'::interval; 
INSERT 0 1
SELECT * FROM computedcol_dml_interval ORDER BY 1,2,3,4;
   col1   |   col2   | col3 |   col4   | col5 
----------+----------+------+----------+------
 11:00:00 | 11:00:10 | a    | 11:00:10 |    1
 11:00:10 | 11:00:10 | a    | 11:00:10 |    1
(2 rows)

UPDATE computedcol_dml_interval SET col1='10 secs'::interval+'11 hours'::interval;
UPDATE 2
SELECT * FROM computedcol_dml_interval ORDER BY 1,2,3,4;
   col1   |   col2   | col3 |   col4   | col5 
----------+----------+------+----------+------
 11:00:10 | 11:00:10 | a    | 11:00:10 |    1
 11:00:10 | 11:00:10 | a    | 11:00:10 |    1
(2 rows)

DELETE FROM computedcol_dml_interval WHERE col1='11 hours'::interval + '10 secs'::interval;
DELETE 2
SELECT * FROM computedcol_dml_interval ORDER BY 1,2,3,4;
 col1 | col2 | col3 | col4 | col5 
------+------+------+------+------
(0 rows)

