DROP TABLE IF EXISTS computedcol_dml_numeric;
psql:/data/prabhd/test/tincrepo/main/dml/functional/output/computedcol_dml_numeric_opt.sql:14: NOTICE:  table "computedcol_dml_numeric" does not exist, skipping
DROP TABLE
CREATE TABLE computedcol_dml_numeric
(
    col1 numeric DEFAULT 1.000000,
    col2 numeric,
    col3 char,
    col4 numeric,
    col5 int
) 
DISTRIBUTED by (col1)
PARTITION BY RANGE(col2)(partition partone start(1.000000) end(10.000000)  WITH (APPENDONLY=true, COMPRESSLEVEL=5, ORIENTATION=column),partition parttwo start(10.000000) end(20.000000) WITH (APPENDONLY=true, COMPRESSLEVEL=5, ORIENTATION=row),partition partthree start(20.000000) end(30.000000), default partition def);
psql:/data/prabhd/test/tincrepo/main/dml/functional/output/computedcol_dml_numeric_opt.sql:24: NOTICE:  CREATE TABLE will create partition "computedcol_dml_numeric_1_prt_def" for table "computedcol_dml_numeric"
psql:/data/prabhd/test/tincrepo/main/dml/functional/output/computedcol_dml_numeric_opt.sql:24: NOTICE:  CREATE TABLE will create partition "computedcol_dml_numeric_1_prt_partone" for table "computedcol_dml_numeric"
psql:/data/prabhd/test/tincrepo/main/dml/functional/output/computedcol_dml_numeric_opt.sql:24: NOTICE:  CREATE TABLE will create partition "computedcol_dml_numeric_1_prt_parttwo" for table "computedcol_dml_numeric"
psql:/data/prabhd/test/tincrepo/main/dml/functional/output/computedcol_dml_numeric_opt.sql:24: NOTICE:  CREATE TABLE will create partition "computedcol_dml_numeric_1_prt_partthree" for table "computedcol_dml_numeric"
CREATE TABLE
INSERT INTO computedcol_dml_numeric(col2,col1,col3,col5,col4) SELECT 2.000000::numeric+1.000000::numeric, 2.000000::numeric+1.000000::numeric, 'a', 1,2.000000::numeric+1.000000::numeric;
INSERT 0 1
INSERT INTO computedcol_dml_numeric(col2,col3,col5,col4) SELECT 2.000000::numeric+1.000000::numeric,'a', 1,2.000000::numeric+1.000000::numeric; 
INSERT 0 1
SELECT * FROM computedcol_dml_numeric ORDER BY 1,2,3,4;
   col1   |   col2   | col3 |   col4   | col5 
----------+----------+------+----------+------
 1.000000 | 3.000000 | a    | 3.000000 |    1
 3.000000 | 3.000000 | a    | 3.000000 |    1
(2 rows)

UPDATE computedcol_dml_numeric SET col1=2.000000::numeric+1.000000::numeric;
UPDATE 2
SELECT * FROM computedcol_dml_numeric ORDER BY 1,2,3,4;
   col1   |   col2   | col3 |   col4   | col5 
----------+----------+------+----------+------
 3.000000 | 3.000000 | a    | 3.000000 |    1
 3.000000 | 3.000000 | a    | 3.000000 |    1
(2 rows)

DELETE FROM computedcol_dml_numeric WHERE col1=1.000000::numeric + 2.000000::numeric;
DELETE 2
SELECT * FROM computedcol_dml_numeric ORDER BY 1,2,3,4;
 col1 | col2 | col3 | col4 | col5 
------+------+------+------+------
(0 rows)

