DROP TABLE IF EXISTS computedcol_dml_int8;
psql:/data/prabhd/test/tincrepo/main/dml/functional/output/computedcol_dml_int8_opt.sql:14: NOTICE:  table "computedcol_dml_int8" does not exist, skipping
DROP TABLE
CREATE TABLE computedcol_dml_int8
(
    col1 int8 DEFAULT 1000000000000000000,
    col2 int8,
    col3 char,
    col4 int8,
    col5 int
) 
DISTRIBUTED by (col1)
PARTITION BY RANGE(col2)(partition partone start(1) end(1000000000000000001)  WITH (APPENDONLY=true, COMPRESSLEVEL=5, ORIENTATION=column),partition parttwo start(1000000000000000001) end(2000000000000000001) WITH (APPENDONLY=true, COMPRESSLEVEL=5, ORIENTATION=row),partition partthree start(2000000000000000001) end(3000000000000000001), default partition def);
psql:/data/prabhd/test/tincrepo/main/dml/functional/output/computedcol_dml_int8_opt.sql:24: NOTICE:  CREATE TABLE will create partition "computedcol_dml_int8_1_prt_def" for table "computedcol_dml_int8"
psql:/data/prabhd/test/tincrepo/main/dml/functional/output/computedcol_dml_int8_opt.sql:24: NOTICE:  CREATE TABLE will create partition "computedcol_dml_int8_1_prt_partone" for table "computedcol_dml_int8"
psql:/data/prabhd/test/tincrepo/main/dml/functional/output/computedcol_dml_int8_opt.sql:24: NOTICE:  CREATE TABLE will create partition "computedcol_dml_int8_1_prt_parttwo" for table "computedcol_dml_int8"
psql:/data/prabhd/test/tincrepo/main/dml/functional/output/computedcol_dml_int8_opt.sql:24: NOTICE:  CREATE TABLE will create partition "computedcol_dml_int8_1_prt_partthree" for table "computedcol_dml_int8"
CREATE TABLE
INSERT INTO computedcol_dml_int8(col2,col1,col3,col5,col4) SELECT 200000000000000000::int8+1000000000000000000::int8, 200000000000000000::int8+1000000000000000000::int8, 'a', 1,200000000000000000::int8+1000000000000000000::int8;
INSERT 0 1
INSERT INTO computedcol_dml_int8(col2,col3,col5,col4) SELECT 200000000000000000::int8+1000000000000000000::int8,'a', 1,200000000000000000::int8+1000000000000000000::int8; 
INSERT 0 1
SELECT * FROM computedcol_dml_int8 ORDER BY 1,2,3,4;
        col1         |        col2         | col3 |        col4         | col5 
---------------------+---------------------+------+---------------------+------
 1000000000000000000 | 1200000000000000000 | a    | 1200000000000000000 |    1
 1200000000000000000 | 1200000000000000000 | a    | 1200000000000000000 |    1
(2 rows)

UPDATE computedcol_dml_int8 SET col1=200000000000000000::int8+1000000000000000000::int8;
UPDATE 2
SELECT * FROM computedcol_dml_int8 ORDER BY 1,2,3,4;
        col1         |        col2         | col3 |        col4         | col5 
---------------------+---------------------+------+---------------------+------
 1200000000000000000 | 1200000000000000000 | a    | 1200000000000000000 |    1
 1200000000000000000 | 1200000000000000000 | a    | 1200000000000000000 |    1
(2 rows)

DELETE FROM computedcol_dml_int8 WHERE col1=1000000000000000000::int8 + 200000000000000000::int8;
DELETE 2
SELECT * FROM computedcol_dml_int8 ORDER BY 1,2,3,4;
 col1 | col2 | col3 | col4 | col5 
------+------+------+------+------
(0 rows)

