-- @author prabhd 
-- @created 2012-12-05 12:00:00 
-- @modified 2012-12-05 12:00:00 
-- @tags dml 
-- @db_name dmldb
-- @description test: Boundary test for timestamp
DROP TABLE IF EXISTS dml_timestamp;
DROP TABLE
CREATE TABLE dml_timestamp( a timestamp) distributed by (a);
CREATE TABLE
-- Simple DML
INSERT INTO dml_timestamp VALUES (to_date('2012-02-31', 'YYYY-MM-DD BC'));
INSERT 0 1
SELECT * FROM dml_timestamp ORDER BY 1;
          a          
---------------------
 2012-03-02 00:00:00
(1 row)

INSERT INTO dml_timestamp VALUES (to_date('4714-01-27 AD', 'YYYY-MM-DD BC'));
INSERT 0 1
SELECT * FROM dml_timestamp ORDER BY 1;
          a          
---------------------
 2012-03-02 00:00:00
 4714-01-27 00:00:00
(2 rows)

UPDATE dml_timestamp SET a = to_date('2012-02-31', 'YYYY-MM-DD BC');
UPDATE 2
SELECT * FROM dml_timestamp ORDER BY 1;
          a          
---------------------
 2012-03-02 00:00:00
 2012-03-02 00:00:00
(2 rows)

-- OUT OF RANGE VALUES
INSERT INTO dml_timestamp VALUES ('294277-01-27 AD'::timestamp);
psql:dml_boundary_timestamp.sql:20: ERROR:  timestamp out of range: "294277-01-27 AD"
LINE 1: INSERT INTO dml_timestamp VALUES ('294277-01-27 AD'::timesta...
                                          ^
SELECT * FROM dml_timestamp ORDER BY 1;
          a          
---------------------
 2012-03-02 00:00:00
 2012-03-02 00:00:00
(2 rows)

UPDATE dml_timestamp SET a = '294277-01-27 AD'::timestamp;
psql:dml_boundary_timestamp.sql:22: ERROR:  timestamp out of range: "294277-01-27 AD"
LINE 1: UPDATE dml_timestamp SET a = '294277-01-27 AD'::timestamp;
                                     ^
SELECT * FROM dml_timestamp ORDER BY 1;
          a          
---------------------
 2012-03-02 00:00:00
 2012-03-02 00:00:00
(2 rows)

