-- @author prabhd 
-- @created 2012-12-05 12:00:00 
-- @modified 2012-12-05 12:00:00 
-- @tags dml 
-- @db_name dmldb
-- @description test: Boundary test for interval
DROP TABLE IF EXISTS dml_interval;
DROP TABLE
CREATE TABLE dml_interval( a interval) distributed by (a);
CREATE TABLE
-- SIMPLE INSERTS
INSERT INTO dml_interval VALUES('178000000 years');
INSERT 0 1
SELECT * FROM dml_interval ORDER BY 1;
        a        
-----------------
 178000000 years
(1 row)

INSERT INTO dml_interval VALUES('-178000000 years');
INSERT 0 1
SELECT * FROM dml_interval ORDER BY 1;
        a         
------------------
 -178000000 years
 178000000 years
(2 rows)

UPDATE dml_interval SET a = '-178000000 years';
UPDATE 2
SELECT * FROM dml_interval ORDER BY 1;
        a         
------------------
 -178000000 years
 -178000000 years
(2 rows)

--OUT OF RANGE VALUES
INSERT INTO dml_interval VALUES('178000000 years 1 month');
INSERT 0 1
SELECT * FROM dml_interval ORDER BY 1;
           a           
-----------------------
 -178000000 years
 -178000000 years
 178000000 years 1 mon
(3 rows)

INSERT INTO dml_interval VALUES('-178000000 years 1 month');
INSERT 0 1
SELECT * FROM dml_interval ORDER BY 1;
             a             
---------------------------
 -178000000 years
 -178000000 years
 -177999999 years -11 mons
 178000000 years 1 mon
(4 rows)

UPDATE dml_interval SET a = '-178000000 years 1 month';
UPDATE 4
SELECT * FROM dml_interval ORDER BY 1;
             a             
---------------------------
 -177999999 years -11 mons
 -177999999 years -11 mons
 -177999999 years -11 mons
 -177999999 years -11 mons
(4 rows)

