-- @author prabhd
-- @created 2012-12-05 12:00:00
-- @modified 2012-12-05 12:00:00
-- @tags dml
-- @db_name dmldb
-- @description test: Boundary test for serial
DROP SEQUENCE IF EXISTS serial;
DROP SEQUENCE
CREATE SEQUENCE serial START 101;
CREATE SEQUENCE
DROP TABLE IF EXISTS dml_serial;
DROP TABLE
CREATE TABLE dml_serial(a serial) distributed by (a);
psql:dml_serial.sql:5: NOTICE:  CREATE TABLE will create implicit sequence "dml_serial_a_seq" for serial column "dml_serial.a"
CREATE TABLE
INSERT INTO dml_serial VALUES (nextval('serial'));
INSERT 0 1
INSERT INTO dml_serial VALUES (nextval('serial'));
INSERT 0 1
SELECT * FROM dml_serial ORDER BY 1;
  a  
-----
 101
 102
(2 rows)

UPDATE dml_serial set a = nextval('serial');
UPDATE 2
SELECT * FROM dml_serial ORDER BY 1;
  a  
-----
 103
 104
(2 rows)

UPDATE dml_serial set a = nextval('serial');
UPDATE 2
SELECT * FROM dml_serial ORDER BY 1;
  a  
-----
 105
 106
(2 rows)

