-- @author prabhd 
-- @created 2012-12-05 12:00:00 
-- @modified 2012-12-05 12:00:00 
-- @tags dml 
-- @db_name dmldb
-- @description test: Boundary test for bit
DROP TABLE IF EXISTS dml_bit;
DROP TABLE
CREATE TABLE dml_bit( a bit ) distributed by (a);
CREATE TABLE
-- Simple DML
INSERT INTO dml_bit VALUES('1');
INSERT 0 1
SELECT * FROM dml_bit ORDER BY 1;
 a 
---
 1
(1 row)

UPDATE dml_bit SET a = '0';
UPDATE 1
SELECT * FROM dml_bit ORDER BY 1;
 a 
---
 0
(1 row)

-- OUT OF RANGE VALUES
INSERT INTO dml_bit VALUES('True');
psql:dml_boundary_bit.sql:18: ERROR:  "T" is not a valid binary digit
SELECT * FROM dml_bit ORDER BY 1;
 a 
---
 0
(1 row)

INSERT INTO dml_bit VALUES('11');
psql:dml_boundary_bit.sql:20: ERROR:  bit string length 2 does not match type bit(1)
SELECT * FROM dml_bit ORDER BY 1;
 a 
---
 0
(1 row)

UPDATE dml_bit SET a = '00';
psql:dml_boundary_bit.sql:22: ERROR:  bit string length 2 does not match type bit(1)
SELECT * FROM dml_bit ORDER BY 1;
 a 
---
 0
(1 row)

