-- @author prabhd 
-- @created 2012-12-05 12:00:00 
-- @modified 2012-12-05 12:00:00 
-- @tags dml 
-- @db_name dmldb
-- @description test: Boundary test for numeric
DROP TABLE IF EXISTS dml_numeric2;
DROP TABLE
CREATE TABLE dml_numeric2(a numeric(5,2)) distributed by (a);
psql:dml_boundary_numeric2.sql:9: NOTICE:  Table doesn't have 'DISTRIBUTED BY' clause -- Using column named 'a' as the Greenplum Database data distribution key for this table.
HINT:  The 'DISTRIBUTED BY' clause determines the distribution of data. Make sure column(s) chosen are the optimal data distribution key to minimize skew.
CREATE TABLE
-- Simple DML
INSERT  INTO  dml_numeric2 VALUES (1.00e+2);
INSERT 0 1
SELECT * FROM dml_numeric2 ORDER BY 1;
   a    
--------
 100.00
(1 row)

UPDATE dml_numeric2 SET a = 1.00e+1;
UPDATE 1
SELECT * FROM dml_numeric2 ORDER BY 1;
   a   
-------
 10.00
(1 row)

--OUT OF RANGE
INSERT  INTO  dml_numeric2 VALUES (1.00e+3);
psql:dml_boundary_numeric2.sql:18: ERROR:  numeric field overflow
DETAIL:  A field with precision 5, scale 2 must round to an absolute value less than 10^3. Rounded overflowing value: 1000.00
SELECT * FROM dml_numeric2 ORDER BY 1;
   a   
-------
 10.00
(1 row)

UPDATE dml_numeric2 SET a = 1.00e+3;
psql:dml_boundary_numeric2.sql:20: ERROR:  numeric field overflow
DETAIL:  A field with precision 5, scale 2 must round to an absolute value less than 10^3. Rounded overflowing value: 1000.00
SELECT * FROM dml_numeric2 ORDER BY 1;
   a   
-------
 10.00
(1 row)

