-- @author prabhd 
-- @created 2012-12-05 12:00:00 
-- @modified 2012-12-05 12:00:00 
-- @tags dml 
-- @db_name dmldb
-- @description test1: Boundary test for integer array
DROP TABLE IF EXISTS dml_intarr;
psql:dml_boundary_intarray.sql:8: NOTICE:  table "dml_intarr" does not exist, skipping
DROP TABLE
CREATE TABLE dml_intarr (a integer[] DEFAULT '{5,4,3,2,1}') distributed by (a);
CREATE TABLE
-- Simple DML
INSERT INTO dml_intarr VALUES('{6,7,8,9,10}');
INSERT 0 1
SELECT * FROM dml_intarr ORDER BY 1;
      a       
--------------
 {6,7,8,9,10}
(1 row)

INSERT INTO dml_intarr DEFAULT VALUES;
INSERT 0 1
SELECT * FROM dml_intarr ORDER BY 1;
      a       
--------------
 {5,4,3,2,1}
 {6,7,8,9,10}
(2 rows)

SELECT a[1] FROM dml_intarr ORDER BY 1;
 a 
---
 5
 6
(2 rows)

UPDATE dml_intarr SET a = '{11,12}';
UPDATE 2
SELECT * FROM dml_intarr ORDER BY 1;
    a    
---------
 {11,12}
 {11,12}
(2 rows)

UPDATE dml_intarr SET a[1] = 111;
UPDATE 2
SELECT a[1] FROM dml_intarr ORDER BY 1;
  a  
-----
 111
 111
(2 rows)

