-- @author prabhd 
-- @created 2012-12-05 12:00:00 
-- @modified 2012-12-05 12:00:00 
-- @tags dml 
-- @db_name dmldb
-- @description test: Boundary test for inet
DROP TABLE IF EXISTS dml_inet;
DROP TABLE
CREATE TABLE dml_inet(a inet) distributed by (a);
CREATE TABLE
-- Simple DML
INSERT INTO dml_inet VALUES ('192.168.1.6');
INSERT 0 1
SELECT * FROM dml_inet ORDER BY 1;
      a      
-------------
 192.168.1.6
(1 row)

INSERT INTO dml_inet VALUES ('204.248.199.199/30');
INSERT 0 1
SELECT * FROM dml_inet ORDER BY 1;
         a          
--------------------
 192.168.1.6
 204.248.199.199/30
(2 rows)

INSERT INTO dml_inet VALUES('::1');
INSERT 0 1
SELECT * FROM dml_inet ORDER BY 1;
         a          
--------------------
 192.168.1.6
 204.248.199.199/30
 ::1
(3 rows)

UPDATE dml_inet SET a = '::1';
UPDATE 3
SELECT * FROM dml_inet ORDER BY 1;
  a  
-----
 ::1
 ::1
 ::1
(3 rows)

-- OUT OF RANGE VALUES
INSERT INTO dml_inet VALUES ('192.168.23.20/33');
psql:dml_boundary_inet.sql:22: ERROR:  invalid input syntax for type inet: "192.168.23.20/33"
SELECT * FROM dml_inet ORDER BY 1;
  a  
-----
 ::1
 ::1
 ::1
(3 rows)

INSERT INTO dml_inet VALUES('');
psql:dml_boundary_inet.sql:24: ERROR:  invalid input syntax for type inet: ""
SELECT * FROM dml_inet ORDER BY 1;
  a  
-----
 ::1
 ::1
 ::1
(3 rows)

UPDATE dml_inet SET a = '192.168.23.20/33';
psql:dml_boundary_inet.sql:26: ERROR:  invalid input syntax for type inet: "192.168.23.20/33"
LINE 1: UPDATE dml_inet SET a = '192.168.23.20/33';
                            ^
SELECT * FROM dml_inet ORDER BY 1;
  a  
-----
 ::1
 ::1
 ::1
(3 rows)

