-- @author prabhd 
-- @created 2012-12-05 12:00:00 
-- @modified 2012-12-05 12:00:00 
-- @tags dml 
-- @db_name dmldb
-- @description test: Boundary test for timestamptz
DROP TABLE IF EXISTS dml_timestamptz;
DROP TABLE
CREATE TABLE dml_timestamptz( a timestamptz) distributed by (a);
CREATE TABLE
-- Simple DML
INSERT INTO dml_timestamptz VALUES (to_date('4714-01-27 AD', 'YYYY-MM-DD BC'));
INSERT 0 1
SELECT * FROM dml_timestamptz ORDER BY 1;
           a            
------------------------
 4714-01-27 00:00:00-08
(1 row)

UPDATE dml_timestamptz SET a = to_date('4714-01-27 AD', 'YYYY-MM-DD BC');
UPDATE 1
SELECT * FROM dml_timestamptz ORDER BY 1;
           a            
------------------------
 4714-01-27 00:00:00-08
(1 row)

-- OUT OF RANGE VALUES
INSERT INTO dml_timestamptz VALUES ('294277-01-27 AD'::timestamptz);
psql:dml_boundary_timestamptz.sql:18: ERROR:  timestamp out of range: "294277-01-27 AD"
LINE 1: INSERT INTO dml_timestamptz VALUES ('294277-01-27 AD'::times...
                                            ^
SELECT * FROM dml_timestamptz ORDER BY 1;
           a            
------------------------
 4714-01-27 00:00:00-08
(1 row)

INSERT INTO dml_timestamptz VALUES ('4714-01-27 BC'::timestamptz);
psql:dml_boundary_timestamptz.sql:20: ERROR:  timestamp out of range: "4714-01-27 BC"
LINE 1: INSERT INTO dml_timestamptz VALUES ('4714-01-27 BC'::timesta...
                                            ^
SELECT * FROM dml_timestamptz ORDER BY 1;
           a            
------------------------
 4714-01-27 00:00:00-08
(1 row)

UPDATE dml_timestamptz SET a = '4714-01-27 BC'::timestamptz;
psql:dml_boundary_timestamptz.sql:22: ERROR:  timestamp out of range: "4714-01-27 BC"
LINE 1: UPDATE dml_timestamptz SET a = '4714-01-27 BC'::timestamptz;
                                       ^
SELECT * FROM dml_timestamptz ORDER BY 1;
           a            
------------------------
 4714-01-27 00:00:00-08
(1 row)

