-- @author prabhd 
-- @created 2012-12-05 12:00:00 
-- @modified 2012-12-05 12:00:00 
-- @tags dml 
-- @db_name dmldb
-- @description test: Boundary test for char
DROP TABLE IF EXISTS dml_char;
DROP TABLE
CREATE TABLE dml_char( a char) distributed by (a);
CREATE TABLE
-- Simple DML
INSERT INTO dml_char VALUES('1');
INSERT 0 1
SELECT * FROM dml_char ORDER BY 1;
 a 
---
 1
(1 row)

UPDATE dml_char SET a = 'b';
UPDATE 1
SELECT * FROM dml_char ORDER BY 1;
 a 
---
 b
(1 row)

-- OUT OF RANGE VALUES
INSERT INTO dml_char VALUES('ab');
psql:dml_boundary_char.sql:18: ERROR:  value too long for type character(1)
SELECT * FROM dml_char ORDER BY 1;
 a 
---
 b
(1 row)

INSERT INTO dml_char VALUES('-a');
psql:dml_boundary_char.sql:20: ERROR:  value too long for type character(1)
SELECT * FROM dml_char ORDER BY 1;
 a 
---
 b
(1 row)

UPDATE dml_char SET a ='-1';
psql:dml_boundary_char.sql:22: ERROR:  value too long for type character(1)
SELECT * FROM dml_char ORDER BY 1;
 a 
---
 b
(1 row)

