-- start_ignore
SET optimizer=on;
SET
SET optimizer_log=on;
SET
-- end_ignore
-- @author prabhd 
-- @created 2012-12-05 12:00:00 
-- @modified 2012-12-05 12:00:00 
-- @tags dml 
-- @db_name dmldb
-- @description test: Boundary test for double precision
DROP TABLE IF EXISTS dml_dp;
DROP TABLE
CREATE TABLE dml_dp ( a double precision) distributed by (a);
CREATE TABLE
-- Simple DML
INSERT INTO dml_dp VALUES('5.7107617381473e+45');
INSERT 0 1
SELECT * FROM dml_dp ORDER BY 1;
          a          
---------------------
 5.7107617381473e+45
(1 row)

INSERT INTO dml_dp VALUES('5.7107617381473e-10');
INSERT 0 1
SELECT * FROM dml_dp ORDER BY 1;
          a          
---------------------
 5.7107617381473e-10
 5.7107617381473e+45
(2 rows)

UPDATE dml_dp SET a = 5.7107617381473e+45;
UPDATE 2
SELECT * FROM dml_dp ORDER BY 1;
          a          
---------------------
 5.7107617381473e+45
 5.7107617381473e+45
(2 rows)

-- OUT OF RANGE
INSERT INTO dml_dp VALUES('5.7107617381473e+1000');
psql:/data/soedoj/tincrepo/main/dml/functional/output/dml_boundary_doubleprecision_orca.sql:27: ERROR:  value out of range: overflow
SELECT * FROM dml_dp ORDER BY 1;
          a          
---------------------
 5.7107617381473e+45
 5.7107617381473e+45
(2 rows)

INSERT INTO dml_dp VALUES('5.7107617381473e-1000');
psql:/data/soedoj/tincrepo/main/dml/functional/output/dml_boundary_doubleprecision_orca.sql:29: ERROR:  value out of range: underflow
SELECT * FROM dml_dp ORDER BY 1;
          a          
---------------------
 5.7107617381473e+45
 5.7107617381473e+45
(2 rows)

UPDATE dml_dp SET a = 5.7107617381473e+1000;
psql:/data/soedoj/tincrepo/main/dml/functional/output/dml_boundary_doubleprecision_orca.sql:31: ERROR:  value out of range: overflow
SELECT * FROM dml_dp ORDER BY 1;
          a          
---------------------
 5.7107617381473e+45
 5.7107617381473e+45
(2 rows)

