-- @author prabhd 
-- @created 2012-12-05 12:00:00 
-- @modified 2012-12-05 12:00:00 
-- @tags dml 
-- @db_name dmldb
-- @description test: Boundary test for real
DROP TABLE IF EXISTS dml_real;
DROP TABLE
CREATE TABLE dml_real ( a real) distributed by (a);
CREATE TABLE
-- Simple DML
INSERT INTO dml_real VALUES(0);
INSERT 0 1
SELECT * FROM dml_real ORDER BY 1;
 a 
---
 0
(1 row)

INSERT INTO dml_real VALUES('-1.18e-38');
INSERT 0 1
SELECT * FROM dml_real ORDER BY 1;
     a     
-----------
 -1.18e-38
         0
(2 rows)

UPDATE dml_real SET a = 0;
UPDATE 2
SELECT * FROM dml_real ORDER BY 1;
 a 
---
 0
 0
(2 rows)

-- OUT OF RANGE VALUES
INSERT INTO dml_real VALUES('-3.40e+39');
psql:dml_boundary_real.sql:21: ERROR:  value out of range: overflow
SELECT * FROM dml_real ORDER BY 1;
 a 
---
 0
 0
(2 rows)

INSERT INTO dml_real VALUES('-1.00e-46');
psql:dml_boundary_real.sql:23: ERROR:  value out of range: underflow
SELECT * FROM dml_real ORDER BY 1;
 a 
---
 0
 0
(2 rows)

UPDATE dml_real SET a = '-1.00e-46';
psql:dml_boundary_real.sql:25: ERROR:  value out of range: underflow
LINE 1: UPDATE dml_real SET a = '-1.00e-46';
                            ^
SELECT * FROM dml_real ORDER BY 1;
 a 
---
 0
 0
(2 rows)

