-- @author prabhd 
-- @created 2012-12-05 12:00:00 
-- @modified 2012-12-05 12:00:00 
-- @tags dml 
-- @db_name dmldb
-- @description test: Boundary test for smallint
DROP TABLE IF EXISTS dml_tab_smallint;
DROP TABLE
CREATE TABLE dml_tab_smallint (a smallint) distributed by (a);
CREATE TABLE
-- Simple DML
INSERT INTO dml_tab_smallint values(-32768);
INSERT 0 1
SELECT * FROM dml_tab_smallint ORDER BY 1;
   a    
--------
 -32768
(1 row)

INSERT INTO dml_tab_smallint values(32767);
INSERT 0 1
SELECT * FROM dml_tab_smallint ORDER BY 1;
   a    
--------
 -32768
  32767
(2 rows)

UPDATE dml_tab_smallint SET a = 32767;
UPDATE 2
SELECT * FROM dml_tab_smallint ORDER BY 1;
   a   
-------
 32767
 32767
(2 rows)

UPDATE dml_tab_smallint SET a = -32768;
UPDATE 2
SELECT * FROM dml_tab_smallint ORDER BY 1;
   a    
--------
 -32768
 -32768
(2 rows)

-- OUT OF RANGE
INSERT INTO dml_tab_smallint values(-32769);
psql:dml_boundary_smallint.sql:22: ERROR:  smallint out of range
SELECT * FROM dml_tab_smallint ORDER BY 1;
   a    
--------
 -32768
 -32768
(2 rows)

INSERT INTO dml_tab_smallint values(32768);
psql:dml_boundary_smallint.sql:24: ERROR:  smallint out of range
SELECT * FROM dml_tab_smallint ORDER BY 1;
   a    
--------
 -32768
 -32768
(2 rows)

UPDATE dml_tab_smallint SET a = 32768;
psql:dml_boundary_smallint.sql:26: ERROR:  smallint out of range
SELECT * FROM dml_tab_smallint ORDER BY 1;
   a    
--------
 -32768
 -32768
(2 rows)

UPDATE dml_tab_smallint SET a = -32769;
psql:dml_boundary_smallint.sql:28: ERROR:  smallint out of range
SELECT * FROM dml_tab_smallint ORDER BY 1;
   a    
--------
 -32768
 -32768
(2 rows)

