-- @author prabhd 
-- @created 2012-12-05 12:00:00 
-- @modified 2012-12-05 12:00:00 
-- @tags dml 
-- @db_name dmldb
-- @description test: Boundary test for date
DROP TABLE IF EXISTS dml_date;
DROP TABLE
CREATE TABLE dml_date ( a date) distributed by (a);
psql:dml_boundary_date.sql:9: NOTICE:  Table doesn't have 'DISTRIBUTED BY' clause -- Using column named 'a' as the Greenplum Database data distribution key for this table.
HINT:  The 'DISTRIBUTED BY' clause determines the distribution of data. Make sure column(s) chosen are the optimal data distribution key to minimize skew.
CREATE TABLE
-- Simple DML
INSERT INTO dml_date VALUES ('2013-01-01 08:00:00.000000'::date);
INSERT 0 1
SELECT * FROM dml_date ORDER BY 1;
     a      
------------
 2013-01-01
(1 row)

INSERT INTO dml_date VALUES ('4713-01-01 BC');
INSERT 0 1
SELECT * FROM dml_date ORDER BY 1;
       a       
---------------
 4713-01-01 BC
 2013-01-01
(2 rows)

INSERT INTO dml_date select to_date('3232098', 'MM/DD/YYYY');
INSERT 0 1
SELECT * FROM dml_date ORDER BY 1;
       a       
---------------
 4568-06-26 BC
 4713-01-01 BC
 2013-01-01
(3 rows)

UPDATE dml_date SET a = '4713-01-01 BC';
UPDATE 3
SELECT * FROM dml_date ORDER BY 1;
       a       
---------------
 4713-01-01 BC
 4713-01-01 BC
 4713-01-01 BC
(3 rows)

-- OUT OF RANGE VALUES
INSERT INTO dml_date VALUES ('0000-01-01 08:00:00.000000'::date);
psql:dml_boundary_date.sql:22: ERROR:  date/time field value out of range: "0000-01-01 08:00:00.000000"
LINE 1: INSERT INTO dml_date VALUES ('0000-01-01 08:00:00.000000'::d...
                                     ^
SELECT * FROM dml_date ORDER BY 1;
       a       
---------------
 4713-01-01 BC
 4713-01-01 BC
 4713-01-01 BC
(3 rows)

INSERT INTO dml_date VALUES ('4714-01-01 BC');
psql:dml_boundary_date.sql:24: ERROR:  date out of range: "4714-01-01 BC"
SELECT * FROM dml_date ORDER BY 1;
       a       
---------------
 4713-01-01 BC
 4713-01-01 BC
 4713-01-01 BC
(3 rows)

UPDATE dml_date SET a = '4714-01-01 BC';
psql:dml_boundary_date.sql:26: ERROR:  date out of range: "4714-01-01 BC"
LINE 1: UPDATE dml_date SET a = '4714-01-01 BC';
                            ^
SELECT * FROM dml_date ORDER BY 1;
       a       
---------------
 4713-01-01 BC
 4713-01-01 BC
 4713-01-01 BC
(3 rows)

