-- @author prabhd 
-- @created 2012-12-05 12:00:00 
-- @modified 2012-12-05 12:00:00 
-- @tags dml 
-- @db_name dmldb
-- @description test: Boundary test for money
DROP TABLE IF EXISTS dml_money;
psql:dml_boundary_money.sql:8: NOTICE:  table "dml_money" does not exist, skipping
DROP TABLE
CREATE TABLE dml_money (a money) distributed by (a);
CREATE TABLE
-- SIMPLE INSERTS
INSERT INTO dml_money VALUES('-2147483648'::money);
INSERT 0 1
SELECT * FROM dml_money ORDER BY 1;
   a   
-------
 $0.00
(1 row)

INSERT INTO dml_money VALUES('2147483647'::money);
INSERT 0 1
SELECT * FROM dml_money ORDER BY 1;
   a    
--------
 -$1.00
  $0.00
(2 rows)

UPDATE dml_money SET a = '2147483647'::money;
UPDATE 2
SELECT * FROM dml_money ORDER BY 1;
   a    
--------
 -$1.00
 -$1.00
(2 rows)

UPDATE dml_money SET a = '-2147483648'::money;
UPDATE 2
SELECT * FROM dml_money ORDER BY 1;
   a   
-------
 $0.00
 $0.00
(2 rows)

-- OUT OF RANGE (no error observed)
INSERT INTO dml_money VALUES('-2147483649'::money);
INSERT 0 1
SELECT * FROM dml_money ORDER BY 1;
   a    
--------
 -$1.00
  $0.00
  $0.00
(3 rows)

INSERT INTO dml_money VALUES('2147483648'::money);
INSERT 0 1
SELECT * FROM dml_money ORDER BY 1;
   a    
--------
 -$1.00
  $0.00
  $0.00
  $0.00
(4 rows)

UPDATE dml_money SET a = '2147483648'::money;
UPDATE 4
SELECT * FROM dml_money ORDER BY 1;
   a   
-------
 $0.00
 $0.00
 $0.00
 $0.00
(4 rows)

UPDATE dml_money SET a = '-2147483649'::money;
UPDATE 4
SELECT * FROM dml_money ORDER BY 1;
   a    
--------
 -$1.00
 -$1.00
 -$1.00
 -$1.00
(4 rows)

