-- @author prabhd 
-- @created 2012-12-05 12:00:00 
-- @modified 2012-12-05 12:00:00 
-- @tags dml 
-- @db_name dmldb
-- @description test: Boundary test for bit varying
DROP TABLE IF EXISTS dml_bitvarying;
DROP TABLE
CREATE TABLE dml_bitvarying( a bit varying(2)) distributed by (a);
CREATE TABLE
-- Simple DML
INSERT INTO dml_bitvarying VALUES('11');
INSERT 0 1
SELECT * FROM dml_bitvarying ORDER BY 1;
 a  
----
 11
(1 row)

UPDATE dml_bitvarying SET a = '00';
UPDATE 1
SELECT * FROM dml_bitvarying ORDER BY 1;
 a  
----
 00
(1 row)

-- OUT OF RANGE VALUES
INSERT INTO dml_bitvarying VALUES('111');
psql:dml_boundary_bitvarying.sql:18: ERROR:  bit string too long for type bit varying(2)
SELECT * FROM dml_bitvarying ORDER BY 1;
 a  
----
 00
(1 row)

UPDATE dml_bitvarying SET a = '000';
psql:dml_boundary_bitvarying.sql:20: ERROR:  bit string too long for type bit varying(2)
SELECT * FROM dml_bitvarying ORDER BY 1;
 a  
----
 00
(1 row)

