-- @author prabhd 
-- @created 2012-12-05 12:00:00 
-- @modified 2012-12-05 12:00:00 
-- @tags dml 
-- @db_name dmldb
-- @description test: Boundary test for macaddr
DROP TABLE IF EXISTS dml_macaddr;
DROP TABLE
CREATE TABLE dml_macaddr( a macaddr) distributed by (a);
CREATE TABLE
-- SIMPLE INSERTS
INSERT INTO dml_macaddr VALUES('08002b:010203');
INSERT 0 1
SELECT * FROM dml_macaddr ORDER BY 1;
         a         
-------------------
 08:00:2b:01:02:03
(1 row)

UPDATE dml_macaddr SET a = 'FF:FF:FF:FF:FF:FF';
UPDATE 1
SELECT * FROM dml_macaddr ORDER BY 1;
         a         
-------------------
 ff:ff:ff:ff:ff:ff
(1 row)

--INVALID VALUES
INSERT INTO dml_macaddr VALUES('FF:FF:FF:FF:FF:FF0');
psql:dml_boundary_macaddr.sql:17: ERROR:  invalid octet value in "macaddr" value: "FF:FF:FF:FF:FF:FF0"
SELECT * FROM dml_macaddr ORDER BY 1;
         a         
-------------------
 ff:ff:ff:ff:ff:ff
(1 row)

UPDATE dml_macaddr SET a = 'FF:FF:FF:FF:FF:FF0';
psql:dml_boundary_macaddr.sql:19: ERROR:  invalid octet value in "macaddr" value: "FF:FF:FF:FF:FF:FF0"
LINE 1: UPDATE dml_macaddr SET a = 'FF:FF:FF:FF:FF:FF0';
                               ^
SELECT * FROM dml_macaddr ORDER BY 1;
         a         
-------------------
 ff:ff:ff:ff:ff:ff
(1 row)

