-- @author prabhd 
-- @created 2012-12-05 12:00:00 
-- @modified 2012-12-05 12:00:00 
-- @tags dml 
-- @db_name dmldb
-- @description test: Boundary test for cidr
DROP TABLE IF EXISTS dml_cidr;
DROP TABLE
CREATE TABLE dml_cidr (a cidr) distributed by (a);
CREATE TABLE
-- Simple DML
INSERT INTO dml_cidr VALUES('192.168.100.128/25');
INSERT 0 1
SELECT * FROM dml_cidr ORDER BY 1;
         a          
--------------------
 192.168.100.128/25
(1 row)

INSERT INTO dml_cidr VALUES('128');
INSERT 0 1
SELECT * FROM dml_cidr ORDER BY 1;
         a          
--------------------
 128.0.0.0/16
 192.168.100.128/25
(2 rows)

INSERT INTO dml_cidr VALUES('2001:4f8:3:ba:2e0:81ff:fe22:d1f1/128');
INSERT 0 1
SELECT * FROM dml_cidr ORDER BY 1;
                  a                   
--------------------------------------
 128.0.0.0/16
 192.168.100.128/25
 2001:4f8:3:ba:2e0:81ff:fe22:d1f1/128
(3 rows)

UPDATE dml_cidr SET a = '192.168.100.128/25';
UPDATE 3
SELECT * FROM dml_cidr ORDER BY 1;
         a          
--------------------
 192.168.100.128/25
 192.168.100.128/25
 192.168.100.128/25
(3 rows)

-- OUT OF RANGE
INSERT INTO dml_cidr VALUES('204.248.199.199/30');
psql:dml_boundary_cidr.sql:22: ERROR:  invalid cidr value: "204.248.199.199/30"
DETAIL:  Value has bits set to right of mask.
SELECT * FROM dml_cidr ORDER BY 1;
         a          
--------------------
 192.168.100.128/25
 192.168.100.128/25
 192.168.100.128/25
(3 rows)

INSERT INTO dml_cidr VALUES('2001:4f8:3:ba:2e0:81ff:fe22:d1f1/120');
psql:dml_boundary_cidr.sql:24: ERROR:  invalid cidr value: "2001:4f8:3:ba:2e0:81ff:fe22:d1f1/120"
DETAIL:  Value has bits set to right of mask.
SELECT * FROM dml_cidr ORDER BY 1;
         a          
--------------------
 192.168.100.128/25
 192.168.100.128/25
 192.168.100.128/25
(3 rows)

UPDATE dml_cidr SET a = '204.248.199.199/30';
psql:dml_boundary_cidr.sql:26: ERROR:  invalid cidr value: "204.248.199.199/30"
LINE 1: UPDATE dml_cidr SET a = '204.248.199.199/30';
                            ^
DETAIL:  Value has bits set to right of mask.
SELECT * FROM dml_cidr ORDER BY 1;
         a          
--------------------
 192.168.100.128/25
 192.168.100.128/25
 192.168.100.128/25
(3 rows)

