-- @author prabhd 
-- @CREATEd 2012-12-05 12:00:00 
-- @modified 2012-12-05 12:00:00 
-- @tags dml 
-- @db_name dmldb
-- @description test: Boundary test for integer
DROP TABLE IF EXISTS dml_integer;
DROP TABLE
CREATE TABLE dml_integer (a integer) distributed by (a);
CREATE TABLE
-- Simple DML
INSERT INTO dml_integer VALUES(-2147483648);
INSERT 0 1
SELECT * FROM dml_integer ORDER BY 1;
      a      
-------------
 -2147483648
(1 row)

INSERT INTO dml_integer VALUES(2147483647);
INSERT 0 1
SELECT * FROM dml_integer ORDER BY 1;
      a      
-------------
 -2147483648
  2147483647
(2 rows)

UPDATE dml_integer SET a = 2147483647;
UPDATE 2
SELECT * FROM dml_integer ORDER BY 1;
     a      
------------
 2147483647
 2147483647
(2 rows)

UPDATE dml_integer SET a = -2147483648;
UPDATE 2
SELECT * FROM dml_integer ORDER BY 1;
      a      
-------------
 -2147483648
 -2147483648
(2 rows)

-- OUT OF RANGE VALUES
INSERT INTO dml_integer VALUES(-2147483649);
psql:dml_boundary_integer.sql:22: ERROR:  integer out of range
SELECT * FROM dml_integer ORDER BY 1;
      a      
-------------
 -2147483648
 -2147483648
(2 rows)

INSERT INTO dml_integer VALUES(2147483648);
psql:dml_boundary_integer.sql:24: ERROR:  integer out of range
SELECT * FROM dml_integer ORDER BY 1;
      a      
-------------
 -2147483648
 -2147483648
(2 rows)

UPDATE dml_integer SET a = 2147483648;
psql:dml_boundary_integer.sql:26: ERROR:  integer out of range
SELECT * FROM dml_integer ORDER BY 1;
      a      
-------------
 -2147483648
 -2147483648
(2 rows)

UPDATE dml_integer SET a = -2147483649;
psql:dml_boundary_integer.sql:28: ERROR:  integer out of range
SELECT * FROM dml_integer ORDER BY 1;
      a      
-------------
 -2147483648
 -2147483648
(2 rows)

