-- @author prabhd 
-- @created 2012-12-05 12:00:00 
-- @modified 2012-12-05 12:00:00 
-- @tags dml 
-- @db_name dmldb
-- @description test: Boundary test for bigint
DROP TABLE IF EXISTS dml_tab_bigint;
DROP TABLE
CREATE TABLE dml_tab_bigint (a bigint DEFAULT 1234567891011) distributed by (a);
CREATE TABLE
-- Simple DML
INSERT INTO dml_tab_bigint values(-9223372036854775808);
INSERT 0 1
INSERT INTO dml_tab_bigint values(9223372036854775807);
INSERT 0 1
SELECT * FROM dml_tab_bigint ORDER BY 1;
          a           
----------------------
 -9223372036854775808
  9223372036854775807
(2 rows)

INSERT INTO dml_tab_bigint DEFAULT VALUES;
INSERT 0 1
SELECT * FROM dml_tab_bigint ORDER BY 1;
          a           
----------------------
 -9223372036854775808
        1234567891011
  9223372036854775807
(3 rows)

UPDATE dml_tab_bigint SET a = 9223372036854775807;
UPDATE 3
SELECT * FROM dml_tab_bigint ORDER BY 1;
          a          
---------------------
 9223372036854775807
 9223372036854775807
 9223372036854775807
(3 rows)

UPDATE dml_tab_bigint SET a = -9223372036854775808;
UPDATE 3
SELECT * FROM dml_tab_bigint ORDER BY 1;
          a           
----------------------
 -9223372036854775808
 -9223372036854775808
 -9223372036854775808
(3 rows)

-- OUT OF RANGE
SELECT * FROM dml_tab_bigint ORDER BY 1;
          a           
----------------------
 -9223372036854775808
 -9223372036854775808
 -9223372036854775808
(3 rows)

INSERT INTO dml_tab_bigint values(-9223372036854775809);
psql:dml_boundary_bigint.sql:24: ERROR:  bigint out of range
SELECT * FROM dml_tab_bigint ORDER BY 1;
          a           
----------------------
 -9223372036854775808
 -9223372036854775808
 -9223372036854775808
(3 rows)

INSERT INTO dml_tab_bigint values(9223372036854775808);
psql:dml_boundary_bigint.sql:26: ERROR:  bigint out of range
SELECT * FROM dml_tab_bigint ORDER BY 1;
          a           
----------------------
 -9223372036854775808
 -9223372036854775808
 -9223372036854775808
(3 rows)

UPDATE dml_tab_bigint SET a = -9223372036854775809;
psql:dml_boundary_bigint.sql:28: ERROR:  bigint out of range
SELECT * FROM dml_tab_bigint ORDER BY 1;
          a           
----------------------
 -9223372036854775808
 -9223372036854775808
 -9223372036854775808
(3 rows)

UPDATE dml_tab_bigint SET a = 9223372036854775808;
psql:dml_boundary_bigint.sql:30: ERROR:  bigint out of range
SELECT * FROM dml_tab_bigint ORDER BY 1;
          a           
----------------------
 -9223372036854775808
 -9223372036854775808
 -9223372036854775808
(3 rows)

