-- @author prabhd 
-- @created 2012-12-05 12:00:00 
-- @modified 2012-12-05 12:00:00 
-- @tags dml 
-- @db_name dmldb
-- @description Mpp-20207
-- start_ignore
SET optimizer_log=on;SET optimizer=on;
SET
SET
-- end_ignore
ALTER TABLE altable DROP COLUMN b;
ALTER TABLE
ALTER TABLE altable ADD CONSTRAINT c_check CHECK (c > 0);
ALTER TABLE
INSERT INTO altable(a, c) VALUES(0, 10);
INSERT 0 1
SELECT * FROM altable ORDER BY 1;
 a | c  
---+----
 0 | 10
(1 row)

DELETE FROM altable WHERE c = -10;
DELETE 0
SELECT * FROM altable ORDER BY 1;
 a | c  
---+----
 0 | 10
(1 row)

DELETE FROM altable WHERE c = 10;
DELETE 1
SELECT * FROM altable ORDER BY 1;
 a | c 
---+---
(0 rows)

DELETE FROM altable WHERE c = 10;
DELETE 0
SELECT * FROM altable ORDER BY 1;
 a | c 
---+---
(0 rows)

