-- @author prabhd 
-- @created 2014-04-01 12:00:00
-- @modified 2012-04-01 12:00:00
-- @tags dml MPP-21090 ORCA
-- @product_version gpdb: [4.3-]
-- @optimizer_mode on	
-- @description Tests for MPP-21090
DROP TABLE IF EXISTS volatilefn_dml_date;
psql:volatilefn_dml_date.sql:8: NOTICE:  table "volatilefn_dml_date" does not exist, skipping
DROP TABLE
CREATE TABLE volatilefn_dml_date
(
    col1 date DEFAULT '2014-01-01',
    col2 date DEFAULT '2014-01-01',
    col3 int,
    col4 date DEFAULT '2014-01-01'
) 
DISTRIBUTED by (col1)
PARTITION BY LIST(col2)
(
default partition def 
);
psql:volatilefn_dml_date.sql:20: NOTICE:  CREATE TABLE will create partition "volatilefn_dml_date_1_prt_def" for table "volatilefn_dml_date"
CREATE TABLE
DROP TABLE IF EXISTS volatilefn_dml_date_candidate;
psql:volatilefn_dml_date.sql:21: NOTICE:  table "volatilefn_dml_date_candidate" does not exist, skipping
DROP TABLE
CREATE TABLE volatilefn_dml_date_candidate
(
    col1 date DEFAULT '2014-01-01',
    col2 date DEFAULT '2014-01-01',
    col3 int,
    col4 date 
) 
DISTRIBUTED by (col2);
CREATE TABLE
INSERT INTO volatilefn_dml_date_candidate(col3,col4) VALUES(10,'2013-12-30');
INSERT 0 1
-- Create volatile UDF
CREATE OR REPLACE FUNCTION func(x int) RETURNS int AS $$
BEGIN

DROP TABLE IF EXISTS foo;
CREATE TABLE foo (a int, b int) distributed by (a);
INSERT INTO foo select i, i+1 from generate_series(1,10) i;

DROP TABLE IF EXISTS bar;
CREATE TABLE bar (c int, d int) distributed by (c);
INSERT INTO bar select i, i+1 from generate_series(1,10) i;

UPDATE bar SET d = d+1 WHERE c = $1;
RETURN $1 + 1;
END
$$ LANGUAGE plpgsql VOLATILE MODIFIES SQL DATA;
CREATE FUNCTION
INSERT INTO volatilefn_dml_date(col1,col3) SELECT col2,func(14) FROM volatilefn_dml_date_candidate;
psql:volatilefn_dml_date.sql:49: ERROR:  function cannot execute on segment because it issues a non-SELECT statement (functions.c:135)  (seg0 rh55-qavm52:34533 pid=31159) (cdbdisp.c:1525)
DETAIL:  
	 SQL statement "DROP TABLE IF EXISTS foo"
PL/pgSQL function "func" line 3 at SQL statement
SELECT * FROM volatilefn_dml_date ORDER BY 1,2,3;
 col1 | col2 | col3 | col4 
------+------+------+------
(0 rows)

UPDATE volatilefn_dml_date SET col3 = (SELECT func(1));
UPDATE 0
SELECT * FROM volatilefn_dml_date ORDER BY 1,2,3;
 col1 | col2 | col3 | col4 
------+------+------+------
(0 rows)

DELETE FROM volatilefn_dml_date WHERE col3 = (SELECT func(1));
DELETE 0
SELECT * FROM volatilefn_dml_date ORDER BY 1,2,3;
 col1 | col2 | col3 | col4 
------+------+------+------
(0 rows)

