-- @product_version gpdb: [4.3.0.0- 4.3.99.99]
--
-- CT UAOCS Part Table 1
--
create table ct_uaocs_alter_part_drop_part1 (aa date, bb date)   with ( appendonly='true', orientation='column') partition by range (bb) (partition foo start('2008-01-01'));
psql:/path/sql_file:1: NOTICE:  Table doesn't have 'DISTRIBUTED BY' clause -- Using column named 'aa' as the Greenplum Database data distribution key for this table.
HINT:  The 'DISTRIBUTED BY' clause determines the distribution of data. Make sure column(s) chosen are the optimal data distribution key to minimize skew.
psql:/path/sql_file:1: NOTICE:  CREATE TABLE will create partition "ct_uaocs_alter_part_drop_part1_1_prt_foo" for table "ct_uaocs_alter_part_drop_part1"
CREATE TABLE
--
-- Insert few records into the table
--
 insert into ct_uaocs_alter_part_drop_part1 values ('2007-01-01','2008-01-01');
INSERT 0 1
 insert into ct_uaocs_alter_part_drop_part1 values ('2008-01-01','2009-01-01');
INSERT 0 1
 insert into ct_uaocs_alter_part_drop_part1 values ('2009-01-01','2010-01-01');
INSERT 0 1
select count(*) FROM pg_appendonly WHERE visimaprelid is not NULL AND visimapidxid is not NULL AND relid in (SELECT oid FROM pg_class WHERE relname ='ct_uaocs_alter_part_drop_part1');
 count 
-------
     1
(1 row)

select count(*) AS only_visi_tups_ins  from ct_uaocs_alter_part_drop_part1;
 only_visi_tups_ins 
--------------------
                  3
(1 row)

set gp_select_invisible = true;
SET
select count(*) AS invisi_and_visi_tups_ins  from ct_uaocs_alter_part_drop_part1;
 invisi_and_visi_tups_ins 
--------------------------
                        3
(1 row)

set gp_select_invisible = false;
SET
update ct_uaocs_alter_part_drop_part1 set bb  = '2013-02-02'  where aa = '2009-01-01';
UPDATE 1
select count(*) AS only_visi_tups_upd  from ct_uaocs_alter_part_drop_part1;
 only_visi_tups_upd 
--------------------
                  3
(1 row)

set gp_select_invisible = true;
SET
select count(*) AS invisi_and_visi_tups  from ct_uaocs_alter_part_drop_part1;
 invisi_and_visi_tups 
----------------------
                    4
(1 row)

set gp_select_invisible = false;
SET
delete from ct_uaocs_alter_part_drop_part1  where aa = '2008-01-01' ;
DELETE 1
select count(*) AS only_visi_tups  from ct_uaocs_alter_part_drop_part1;
 only_visi_tups 
----------------
              2
(1 row)

set gp_select_invisible = true;
SET
select count(*) AS invisi_and_visi_tups  from ct_uaocs_alter_part_drop_part1;
 invisi_and_visi_tups 
----------------------
                    4
(1 row)

set gp_select_invisible = false;
SET
--
-- CT UAOCS Part Table 2
--
create table ct_uaocs_alter_part_drop_part2 (aa date, bb date)   with ( appendonly='true', orientation='column') partition by range (bb) (partition foo start('2008-01-01'));
psql:/path/sql_file:1: NOTICE:  Table doesn't have 'DISTRIBUTED BY' clause -- Using column named 'aa' as the Greenplum Database data distribution key for this table.
HINT:  The 'DISTRIBUTED BY' clause determines the distribution of data. Make sure column(s) chosen are the optimal data distribution key to minimize skew.
psql:/path/sql_file:1: NOTICE:  CREATE TABLE will create partition "ct_uaocs_alter_part_drop_part2_1_prt_foo" for table "ct_uaocs_alter_part_drop_part2"
CREATE TABLE
--
-- Insert few records into the table
--
 insert into ct_uaocs_alter_part_drop_part2 values ('2007-01-01','2008-01-01');
INSERT 0 1
 insert into ct_uaocs_alter_part_drop_part2 values ('2008-01-01','2009-01-01');
INSERT 0 1
 insert into ct_uaocs_alter_part_drop_part2 values ('2009-01-01','2010-01-01');
INSERT 0 1
--
-- CT UAOCS Part Table 3
--
create table ct_uaocs_alter_part_drop_part3 (aa date, bb date)   with ( appendonly='true', orientation='column') partition by range (bb) (partition foo start('2008-01-01'));
psql:/path/sql_file:1: NOTICE:  Table doesn't have 'DISTRIBUTED BY' clause -- Using column named 'aa' as the Greenplum Database data distribution key for this table.
HINT:  The 'DISTRIBUTED BY' clause determines the distribution of data. Make sure column(s) chosen are the optimal data distribution key to minimize skew.
psql:/path/sql_file:1: NOTICE:  CREATE TABLE will create partition "ct_uaocs_alter_part_drop_part3_1_prt_foo" for table "ct_uaocs_alter_part_drop_part3"
CREATE TABLE
--
-- Insert few records into the table
--
 insert into ct_uaocs_alter_part_drop_part3 values ('2007-01-01','2008-01-01');
INSERT 0 1
 insert into ct_uaocs_alter_part_drop_part3 values ('2008-01-01','2009-01-01');
INSERT 0 1
 insert into ct_uaocs_alter_part_drop_part3 values ('2009-01-01','2010-01-01');
INSERT 0 1
--
-- CT UAOCS Part Table 4
--
create table ct_uaocs_alter_part_drop_part4 (aa date, bb date)   with ( appendonly='true', orientation='column') partition by range (bb) (partition foo start('2008-01-01'));
psql:/path/sql_file:1: NOTICE:  Table doesn't have 'DISTRIBUTED BY' clause -- Using column named 'aa' as the Greenplum Database data distribution key for this table.
HINT:  The 'DISTRIBUTED BY' clause determines the distribution of data. Make sure column(s) chosen are the optimal data distribution key to minimize skew.
psql:/path/sql_file:1: NOTICE:  CREATE TABLE will create partition "ct_uaocs_alter_part_drop_part4_1_prt_foo" for table "ct_uaocs_alter_part_drop_part4"
CREATE TABLE
--
-- Insert few records into the table
--
 insert into ct_uaocs_alter_part_drop_part4 values ('2007-01-01','2008-01-01');
INSERT 0 1
 insert into ct_uaocs_alter_part_drop_part4 values ('2008-01-01','2009-01-01');
INSERT 0 1
 insert into ct_uaocs_alter_part_drop_part4 values ('2009-01-01','2010-01-01');
INSERT 0 1
--
-- CT UAOCS Part Table 5
--
create table ct_uaocs_alter_part_drop_part5 (aa date, bb date)   with ( appendonly='true', orientation='column') partition by range (bb) (partition foo start('2008-01-01'));
psql:/path/sql_file:1: NOTICE:  Table doesn't have 'DISTRIBUTED BY' clause -- Using column named 'aa' as the Greenplum Database data distribution key for this table.
HINT:  The 'DISTRIBUTED BY' clause determines the distribution of data. Make sure column(s) chosen are the optimal data distribution key to minimize skew.
psql:/path/sql_file:1: NOTICE:  CREATE TABLE will create partition "ct_uaocs_alter_part_drop_part5_1_prt_foo" for table "ct_uaocs_alter_part_drop_part5"
CREATE TABLE
--
-- Insert few records into the table
--
 insert into ct_uaocs_alter_part_drop_part5 values ('2007-01-01','2008-01-01');
INSERT 0 1
 insert into ct_uaocs_alter_part_drop_part5 values ('2008-01-01','2009-01-01');
INSERT 0 1
 insert into ct_uaocs_alter_part_drop_part5 values ('2009-01-01','2010-01-01');
INSERT 0 1
--
--
--ALTER TABLE TO DROP PARTITION
--
--
--
-- ALTER SYNC1 UAOCS Table DROP PARTITION
--
-- Add partition 
--
alter table sync1_uaocs_alter_part_drop_part4 add partition a2 start ('2007-02-01') end ('2007-03-01');
psql:/path/sql_file:1: NOTICE:  CREATE TABLE will create partition "sync1_uaocs_alter_part_drop_part4_1_prt_a2" for table "sync1_uaocs_alter_part_drop_part4"
ALTER TABLE
insert into sync1_uaocs_alter_part_drop_part4  values ('2007-02-10','2011-01-01');
INSERT 0 1
select count(*) AS only_visi_tups_ins  from sync1_uaocs_alter_part_drop_part4 ;
 only_visi_tups_ins 
--------------------
                  4
(1 row)

set gp_select_invisible = true;
SET
select count(*) AS invisi_and_visi_tups_ins  from sync1_uaocs_alter_part_drop_part4 ;
 invisi_and_visi_tups_ins 
--------------------------
                        4
(1 row)

set gp_select_invisible = false;
SET
update sync1_uaocs_alter_part_drop_part4  set bb  = '2013-02-02'  where aa = '2007-02-10';
UPDATE 1
select count(*) AS only_visi_tups_upd  from sync1_uaocs_alter_part_drop_part4 ;
 only_visi_tups_upd 
--------------------
                  4
(1 row)

set gp_select_invisible = true;
SET
select count(*) AS invisi_and_visi_tups  from sync1_uaocs_alter_part_drop_part4 ;
 invisi_and_visi_tups 
----------------------
                    5
(1 row)

set gp_select_invisible = false;
SET
delete from sync1_uaocs_alter_part_drop_part4   where aa = '2007-02-10' ;
DELETE 1
select count(*) AS only_visi_tups  from sync1_uaocs_alter_part_drop_part4 ;
 only_visi_tups 
----------------
              3
(1 row)

set gp_select_invisible = true;
SET
select count(*) AS invisi_and_visi_tups  from sync1_uaocs_alter_part_drop_part4 ;
 invisi_and_visi_tups 
----------------------
                    5
(1 row)

set gp_select_invisible = false;
SET
--
-- Drop partition
--
alter table sync1_uaocs_alter_part_drop_part4 DROP partition a2;
ALTER TABLE
--
-- Drop Partition if exists
--
alter table sync1_uaocs_alter_part_drop_part4 DROP partition if exists a2;
psql:/path/sql_file:1: NOTICE:  partition "a2" of relation "sync1_uaocs_alter_part_drop_part4" does not exist, skipping
ALTER TABLE
--
-- Add default partition
--
alter table sync1_uaocs_alter_part_drop_part4 add default partition default_part;
psql:/path/sql_file:1: NOTICE:  CREATE TABLE will create partition "sync1_uaocs_alter_part_drop_part4_1_prt_default_part" for table "sync1_uaocs_alter_part_drop_part4"
ALTER TABLE
--
-- Drop Default Partition
--
alter table sync1_uaocs_alter_part_drop_part4 DROP default partition if exists;
psql:/path/sql_file:1: NOTICE:  dropped partition "default_part" for relation "sync1_uaocs_alter_part_drop_part4"
ALTER TABLE
--
-- Insert few records into the table
--
 insert into sync1_uaocs_alter_part_drop_part4 values ('2007-01-01','2008-01-01');
INSERT 0 1
 insert into sync1_uaocs_alter_part_drop_part4 values ('2008-01-01','2009-01-01');
INSERT 0 1
 insert into sync1_uaocs_alter_part_drop_part4 values ('2009-01-01','2010-01-01');
INSERT 0 1
--
-- select from the Table
--
select count(*) from sync1_uaocs_alter_part_drop_part4;
 count 
-------
     6
(1 row)

--
-- ALTER CK_SYNC1 UAOCS Table DROP PARTITION
--
-- Add partition 
--
alter table ck_sync1_uaocs_alter_part_drop_part3 add partition a2 start ('2007-02-01') end ('2007-03-01');
psql:/path/sql_file:1: NOTICE:  CREATE TABLE will create partition "ck_sync1_uaocs_alter_part_drop_part3_1_prt_a2" for table "ck_sync1_uaocs_alter_part_drop_part3"
ALTER TABLE
--
-- Drop partition
--
alter table ck_sync1_uaocs_alter_part_drop_part3 DROP partition a2;
ALTER TABLE
--
-- Drop Partition if exists
--
alter table ck_sync1_uaocs_alter_part_drop_part3 DROP partition if exists a2;
psql:/path/sql_file:1: NOTICE:  partition "a2" of relation "ck_sync1_uaocs_alter_part_drop_part3" does not exist, skipping
ALTER TABLE
--
-- Add default partition
--
alter table ck_sync1_uaocs_alter_part_drop_part3 add default partition default_part;
psql:/path/sql_file:1: NOTICE:  CREATE TABLE will create partition "ck_sync1_uaocs_alter_part_drop_part3_1_prt_default_part" for table "ck_sync1_uaocs_alter_part_drop_part3"
ALTER TABLE
--
-- Drop Default Partition
--
alter table ck_sync1_uaocs_alter_part_drop_part3 DROP default partition if exists;
psql:/path/sql_file:1: NOTICE:  dropped partition "default_part" for relation "ck_sync1_uaocs_alter_part_drop_part3"
ALTER TABLE
--
-- Insert few records into the table
--
 insert into ck_sync1_uaocs_alter_part_drop_part3 values ('2007-01-01','2008-01-01');
INSERT 0 1
 insert into ck_sync1_uaocs_alter_part_drop_part3 values ('2008-01-01','2009-01-01');
INSERT 0 1
 insert into ck_sync1_uaocs_alter_part_drop_part3 values ('2009-01-01','2010-01-01');
INSERT 0 1
--
-- select from the Table
--
select count(*) from ck_sync1_uaocs_alter_part_drop_part3;
 count 
-------
     6
(1 row)

--
-- ALTER CT UAOCS Table DROP PARTITION
--
-- Add partition 
--
alter table ct_uaocs_alter_part_drop_part1 add partition a2 start ('2007-02-01') end ('2007-03-01');
psql:/path/sql_file:1: NOTICE:  CREATE TABLE will create partition "ct_uaocs_alter_part_drop_part1_1_prt_a2" for table "ct_uaocs_alter_part_drop_part1"
ALTER TABLE
--
-- Drop partition
--
alter table ct_uaocs_alter_part_drop_part1 DROP partition a2;
ALTER TABLE
--
-- Drop Partition if exists
--
alter table ct_uaocs_alter_part_drop_part1 DROP partition if exists a2;
psql:/path/sql_file:1: NOTICE:  partition "a2" of relation "ct_uaocs_alter_part_drop_part1" does not exist, skipping
ALTER TABLE
--
-- Add default partition
--
alter table ct_uaocs_alter_part_drop_part1 add default partition default_part;
psql:/path/sql_file:1: NOTICE:  CREATE TABLE will create partition "ct_uaocs_alter_part_drop_part1_1_prt_default_part" for table "ct_uaocs_alter_part_drop_part1"
ALTER TABLE
--
-- Drop Default Partition
--
alter table ct_uaocs_alter_part_drop_part1 DROP default partition if exists;
psql:/path/sql_file:1: NOTICE:  dropped partition "default_part" for relation "ct_uaocs_alter_part_drop_part1"
ALTER TABLE
--
-- Insert few records into the table
--
 insert into ct_uaocs_alter_part_drop_part1 values ('2007-01-01','2008-01-01');
INSERT 0 1
 insert into ct_uaocs_alter_part_drop_part1 values ('2008-01-01','2009-01-01');
INSERT 0 1
 insert into ct_uaocs_alter_part_drop_part1 values ('2009-01-01','2010-01-01');
INSERT 0 1
--
-- select from the Table
--
select count(*) from ct_uaocs_alter_part_drop_part1;
 count 
-------
     5
(1 row)

