-- ALTER TABLE ... RENAME on corrupted relations
SET allow_system_table_mods = true;
SET gp_allow_rename_relation_without_lock = ON;
-- missing entry
CREATE TABLE cor (a int, b float);
NOTICE:  Table doesn't have 'DISTRIBUTED BY' clause -- Using column named 'a' as the Greenplum Database data distribution key for this table.
HINT:  The 'DISTRIBUTED BY' clause determines the distribution of data. Make sure column(s) chosen are the optimal data distribution key to minimize skew.
INSERT INTO cor SELECT i, i+1 FROM generate_series(1,100)i;
DELETE FROM pg_attribute WHERE attname='a' AND attrelid='cor'::regclass;
ALTER TABLE cor RENAME TO oldcor;
INSERT INTO pg_attribute SELECT distinct on(attrelid, attnum) * FROM gp_dist_random('pg_attribute') WHERE attname='a' AND attrelid='oldcor'::regclass;
DROP TABLE oldcor;
-- typname is out of sync
CREATE TABLE cor (a int, b float, c text);
NOTICE:  Table doesn't have 'DISTRIBUTED BY' clause -- Using column named 'a' as the Greenplum Database data distribution key for this table.
HINT:  The 'DISTRIBUTED BY' clause determines the distribution of data. Make sure column(s) chosen are the optimal data distribution key to minimize skew.
UPDATE pg_type SET typname='newcor' WHERE typrelid='cor'::regclass;
ALTER TABLE cor RENAME TO newcor2;
ALTER TABLE newcor2 RENAME TO cor;
DROP TABLE cor;
RESET allow_system_table_mods;
RESET gp_allow_rename_relation_without_lock;
-- MPP-20466 Dis-allow duplicate constraint names for same table
create table dupconstr (
						i int,
						j int constraint dup_constraint CHECK (j > 10))
						distributed by (i);
-- should fail because of duplicate constraint name
alter table dupconstr add constraint dup_constraint unique (i);
ERROR:  constraint "dup_constraint" for relation "dupconstr" already exists
alter table dupconstr add constraint dup_constraint primary key (i);
ERROR:  constraint "dup_constraint" for relation "dupconstr" already exists
-- cleanup
drop table dupconstr;
--
-- Test ALTER COLUMN TYPE after dropped column with text datatype (see MPP-19146)
--
create domain mytype as text;
create temp table at_foo (f1 text, f2 mytype, f3 text);
NOTICE:  Table doesn't have 'DISTRIBUTED BY' clause -- Using column named 'f1' as the Greenplum Database data distribution key for this table.
HINT:  The 'DISTRIBUTED BY' clause determines the distribution of data. Make sure column(s) chosen are the optimal data distribution key to minimize skew.
insert into at_foo values('aa','bb','cc');
drop domain mytype cascade;
NOTICE:  drop cascades to table at_foo column f2
alter table at_foo alter f1 TYPE varchar(10);
drop table at_foo;
create domain mytype as int;
create temp table at_foo (f1 text, f2 mytype, f3 text);
NOTICE:  Table doesn't have 'DISTRIBUTED BY' clause -- Using column named 'f1' as the Greenplum Database data distribution key for this table.
HINT:  The 'DISTRIBUTED BY' clause determines the distribution of data. Make sure column(s) chosen are the optimal data distribution key to minimize skew.
insert into at_foo values('aa',0,'cc');
drop domain mytype cascade;
NOTICE:  drop cascades to table at_foo column f2
alter table at_foo alter f1 TYPE varchar(10);
-- Verify that INSERT, UPDATE and DELETE work after dropping a column and
-- adding a constraint. There was a bug on that in ORCA, once upon a time
-- (MPP-20207)
CREATE TABLE altable(a int, b text, c int);
NOTICE:  Table doesn't have 'DISTRIBUTED BY' clause -- Using column named 'a' as the Greenplum Database data distribution key for this table.
HINT:  The 'DISTRIBUTED BY' clause determines the distribution of data. Make sure column(s) chosen are the optimal data distribution key to minimize skew.
ALTER TABLE altable DROP COLUMN b;
ALTER TABLE altable ADD CONSTRAINT c_check CHECK (c > 0);
INSERT INTO altable(a, c) VALUES(0, -10);
ERROR:  new row for relation "altable" violates check constraint "c_check"  (seg0 127.0.0.1:25432 pid=21869)
DETAIL:  Failing row contains (0, -10).
SELECT * FROM altable ORDER BY 1;
 a | c 
---+---
(0 rows)

INSERT INTO altable(a, c) VALUES(0, 10);
SELECT * FROM altable ORDER BY 1;
 a | c  
---+----
 0 | 10
(1 row)

DELETE FROM altable WHERE c = -10;
SELECT * FROM altable ORDER BY 1;
 a | c  
---+----
 0 | 10
(1 row)

DELETE FROM altable WHERE c = 10;
SELECT * FROM altable ORDER BY 1;
 a | c 
---+---
(0 rows)

DELETE FROM altable WHERE c = 10;
SELECT * FROM altable ORDER BY 1;
 a | c 
---+---
(0 rows)

INSERT INTO altable(a, c) VALUES(0, 10);
SELECT * FROM altable ORDER BY 1;
 a | c  
---+----
 0 | 10
(1 row)

UPDATE altable SET c = -10;
ERROR:  new row for relation "altable" violates check constraint "c_check"  (seg0 127.0.0.1:25432 pid=21869)
DETAIL:  Failing row contains (0, -10).
SELECT * FROM altable ORDER BY 1;
 a | c  
---+----
 0 | 10
(1 row)

UPDATE altable SET c = 1;
SELECT * FROM altable ORDER BY 1;
 a | c 
---+---
 0 | 1
(1 row)

-- Verify that changing the datatype of a funnily-named column works.
-- (There used to be a quoting bug in the internal query this issues.)
create table "foo'bar" (id int4, t text);
alter table "foo'bar" alter column t type integer using length(t);
--
-- ADD/DROP/ALTER COLUMN on root partition is approved.
--
-- Heap table
DROP TABLE IF EXISTS test_part_col;
NOTICE:  table "test_part_col" does not exist, skipping
CREATE TABLE test_part_col(a int, b int, c int, d int, e int)
DISTRIBUTED BY(a)
PARTITION BY RANGE (b)
( START (1) END (2) EVERY (1),
    DEFAULT PARTITION other_b);
NOTICE:  CREATE TABLE will create partition "test_part_col_1_prt_other_b" for table "test_part_col"
NOTICE:  CREATE TABLE will create partition "test_part_col_1_prt_2" for table "test_part_col"
ALTER TABLE ONLY test_part_col ADD COLUMN f int; --error
ERROR:  can't add a column to "test_part_col"; it is a partitioned table or part thereof
ALTER TABLE test_part_col ADD COLUMN f int;
ALTER TABLE ONLY test_part_col ALTER COLUMN f TYPE TEXT; --error
ERROR:  can't alter a column datatype of "test_part_col"; it is a partitioned table or part thereof
ALTER TABLE test_part_col ALTER COLUMN f TYPE TEXT;
ALTER TABLE ONLY test_part_col DROP COLUMN f; --error
ERROR:  can't drop a column from "test_part_col"; it is a partitioned table or part thereof
ALTER TABLE test_part_col DROP COLUMN f;
ALTER TABLE ONLY test_part_col_1_prt_other_b ADD COLUMN f int;
ERROR:  can't add a column to "test_part_col_1_prt_other_b"; it is a partitioned table or part thereof
ALTER TABLE test_part_col_1_prt_other_b ADD COLUMN f int;
ERROR:  can't add a column to "test_part_col_1_prt_other_b"; it is part of a partitioned table
HINT:  You may be able to perform the operation on the partitioned table as a whole.
ALTER TABLE ONLY test_part_col_1_prt_other_b ALTER COLUMN e TYPE TEXT; --error
ERROR:  can't alter a column datatype of "test_part_col_1_prt_other_b"; it is a partitioned table or part thereof
ALTER TABLE test_part_col_1_prt_other_b ALTER COLUMN e TYPE TEXT;
ERROR:  can't alter a column datatype of "test_part_col_1_prt_other_b"; it is part of a partitioned table
HINT:  You may be able to perform the operation on the partitioned table as a whole.
ALTER TABLE ONLY test_part_col_1_prt_other_b DROP COLUMN e; --error
ERROR:  can't drop a column from "test_part_col_1_prt_other_b"; it is a partitioned table or part thereof
ALTER TABLE test_part_col_1_prt_other_b DROP COLUMN e;
ERROR:  can't drop a column from "test_part_col_1_prt_other_b"; it is part of a partitioned table
HINT:  You may be able to perform the operation on the partitioned table as a whole.
DROP TABLE test_part_col;
-- Non-partition heap table
CREATE TABLE test_part_col(a int, b int, c int, d int, e int) DISTRIBUTED BY(a);
ALTER TABLE ONLY test_part_col ADD COLUMN f int;
ALTER TABLE ONLY test_part_col ALTER COLUMN f TYPE TEXT;
ALTER TABLE ONLY test_part_col DROP COLUMN f;
ALTER TABLE test_part_col ADD COLUMN f int;
ALTER TABLE test_part_col ALTER COLUMN f TYPE TEXT;
ALTER TABLE test_part_col DROP COLUMN f;
DROP TABLE test_part_col;
-- AO table
CREATE TABLE test_part_col(a int, b int, c int, d int, e int)
WITH (appendonly=true)
DISTRIBUTED BY(a)
PARTITION BY RANGE (b)
( START (1) END (2) EVERY (1),
    DEFAULT PARTITION other_b);
NOTICE:  CREATE TABLE will create partition "test_part_col_1_prt_other_b" for table "test_part_col"
NOTICE:  CREATE TABLE will create partition "test_part_col_1_prt_2" for table "test_part_col"
ALTER TABLE ONLY test_part_col ADD COLUMN f int; --error
ERROR:  can't add a column to "test_part_col"; it is a partitioned table or part thereof
ALTER TABLE test_part_col ADD COLUMN f int;
ALTER TABLE ONLY test_part_col ALTER COLUMN f TYPE TEXT; --error
ERROR:  can't alter a column datatype of "test_part_col"; it is a partitioned table or part thereof
ALTER TABLE test_part_col ALTER COLUMN f TYPE TEXT;
ALTER TABLE ONLY test_part_col DROP COLUMN f; --error
ERROR:  can't drop a column from "test_part_col"; it is a partitioned table or part thereof
ALTER TABLE test_part_col DROP COLUMN f;
ALTER TABLE ONLY test_part_col_1_prt_other_b ADD COLUMN f int;
ERROR:  can't add a column to "test_part_col_1_prt_other_b"; it is a partitioned table or part thereof
ALTER TABLE test_part_col_1_prt_other_b ADD COLUMN f int;
ERROR:  can't add a column to "test_part_col_1_prt_other_b"; it is part of a partitioned table
HINT:  You may be able to perform the operation on the partitioned table as a whole.
ALTER TABLE ONLY test_part_col_1_prt_other_b ALTER COLUMN e TYPE TEXT; --error
ERROR:  can't alter a column datatype of "test_part_col_1_prt_other_b"; it is a partitioned table or part thereof
ALTER TABLE test_part_col_1_prt_other_b ALTER COLUMN e TYPE TEXT;
ERROR:  can't alter a column datatype of "test_part_col_1_prt_other_b"; it is part of a partitioned table
HINT:  You may be able to perform the operation on the partitioned table as a whole.
ALTER TABLE ONLY test_part_col_1_prt_other_b DROP COLUMN e; --error
ERROR:  can't drop a column from "test_part_col_1_prt_other_b"; it is a partitioned table or part thereof
ALTER TABLE test_part_col_1_prt_other_b DROP COLUMN e;
ERROR:  can't drop a column from "test_part_col_1_prt_other_b"; it is part of a partitioned table
HINT:  You may be able to perform the operation on the partitioned table as a whole.
DROP TABLE test_part_col;
-- Non-partition AO table
CREATE TABLE test_part_col(a int, b int, c int, d int, e int)
WITH (appendonly=true) DISTRIBUTED BY(a);
ALTER TABLE ONLY test_part_col ADD COLUMN f int;
ALTER TABLE ONLY test_part_col ALTER COLUMN f TYPE TEXT;
ALTER TABLE ONLY test_part_col DROP COLUMN f;
ALTER TABLE test_part_col ADD COLUMN f int;
ALTER TABLE test_part_col ALTER COLUMN f TYPE TEXT;
ALTER TABLE test_part_col DROP COLUMN f;
DROP TABLE test_part_col;
-- AOCS table
CREATE TABLE test_part_col(a int, b int, c int, d int, e int)
WITH (appendonly=true, orientation=column)
DISTRIBUTED BY(a)
PARTITION BY RANGE (b)
( START (1) END (2) EVERY (1),
    DEFAULT PARTITION other_b);
NOTICE:  CREATE TABLE will create partition "test_part_col_1_prt_other_b" for table "test_part_col"
NOTICE:  CREATE TABLE will create partition "test_part_col_1_prt_2" for table "test_part_col"
ALTER TABLE ONLY test_part_col ADD COLUMN f int; --error
ERROR:  can't add a column to "test_part_col"; it is a partitioned table or part thereof
ALTER TABLE test_part_col ADD COLUMN f int;
ALTER TABLE ONLY test_part_col ALTER COLUMN f TYPE TEXT; --error
ERROR:  can't alter a column datatype of "test_part_col"; it is a partitioned table or part thereof
ALTER TABLE test_part_col ALTER COLUMN f TYPE TEXT;
ALTER TABLE ONLY test_part_col DROP COLUMN f; --error
ERROR:  can't drop a column from "test_part_col"; it is a partitioned table or part thereof
ALTER TABLE test_part_col DROP COLUMN f;
ALTER TABLE ONLY test_part_col_1_prt_other_b ADD COLUMN f int;
ERROR:  can't add a column to "test_part_col_1_prt_other_b"; it is a partitioned table or part thereof
ALTER TABLE test_part_col_1_prt_other_b ADD COLUMN f int;
ERROR:  can't add a column to "test_part_col_1_prt_other_b"; it is part of a partitioned table
HINT:  You may be able to perform the operation on the partitioned table as a whole.
ALTER TABLE ONLY test_part_col_1_prt_other_b ALTER COLUMN e TYPE TEXT; --error
ERROR:  can't alter a column datatype of "test_part_col_1_prt_other_b"; it is a partitioned table or part thereof
ALTER TABLE test_part_col_1_prt_other_b ALTER COLUMN e TYPE TEXT;
ERROR:  can't alter a column datatype of "test_part_col_1_prt_other_b"; it is part of a partitioned table
HINT:  You may be able to perform the operation on the partitioned table as a whole.
ALTER TABLE ONLY test_part_col_1_prt_other_b DROP COLUMN e; --error
ERROR:  can't drop a column from "test_part_col_1_prt_other_b"; it is a partitioned table or part thereof
ALTER TABLE test_part_col_1_prt_other_b DROP COLUMN e;
ERROR:  can't drop a column from "test_part_col_1_prt_other_b"; it is part of a partitioned table
HINT:  You may be able to perform the operation on the partitioned table as a whole.
DROP TABLE test_part_col;
-- Non-partition AOCS table
CREATE TABLE test_part_col(a int, b int, c int, d int, e int)
WITH (appendonly=true, orientation=column) DISTRIBUTED BY(a);
ALTER TABLE ONLY test_part_col ADD COLUMN f int;
ALTER TABLE ONLY test_part_col ALTER COLUMN f TYPE TEXT;
ALTER TABLE ONLY test_part_col DROP COLUMN f;
ALTER TABLE test_part_col ADD COLUMN f int;
ALTER TABLE test_part_col ALTER COLUMN f TYPE TEXT;
ALTER TABLE test_part_col DROP COLUMN f;
DROP TABLE test_part_col;
