create table xyz ("B B" int, "C" int, "D+1" int) DISTRIBUTED RANDOMLY;
create table xyz_ctas1 as (select "B B" AS "B+1", "C" AS "_%A", "D+1" AS "D" from xyz) DISTRIBUTED RANDOMLY;
create table xyz_ctas2 as (select "B B" "B+1", "C" "_%A", "D+1" "D" from xyz) DISTRIBUTED RANDOMLY;
CREATE TEMP TABLE disttable (f1 integer) DISTRIBUTED RANDOMLY;
INSERT INTO DISTTABLE VALUES (1), (2), (3), (NULL);
SELECT f1, f1 IS DISTINCT FROM 2 AS "not 2" FROM disttable ORDER BY 1;
 f1 | not 2 
----+-------
  1 | t
  2 | f
  3 | t
    | t
(4 rows)

SELECT f1, f1 IS DISTINCT FROM 2 "not 2" FROM disttable ORDER BY 1;
 f1 | not 2 
----+-------
  1 | t
  2 | f
  3 | t
    | t
(4 rows)

SELECT f1, f1 IS DISTINCT FROM NULL AS "not null" FROM disttable ORDER BY 1;
 f1 | not null 
----+----------
  1 | t
  2 | t
  3 | t
    | f
(4 rows)

SELECT f1, f1 IS DISTINCT FROM NULL "not null" FROM disttable ORDER BY 1;
 f1 | not null 
----+----------
  1 | t
  2 | t
  3 | t
    | f
(4 rows)

SELECT f1, f1 IS DISTINCT FROM f1 AS "false" FROM disttable ORDER BY 1;
 f1 | false 
----+-------
  1 | f
  2 | f
  3 | f
    | f
(4 rows)

SELECT f1, f1 IS DISTINCT FROM f1 "false" FROM disttable ORDER BY 1;
 f1 | false 
----+-------
  1 | f
  2 | f
  3 | f
    | f
(4 rows)

SELECT f1, f1 IS DISTINCT FROM f1+1 AS "not null" FROM disttable ORDER BY 1;
 f1 | not null 
----+----------
  1 | t
  2 | t
  3 | t
    | f
(4 rows)

SELECT f1, f1 IS DISTINCT FROM f1+1 "not null" FROM disttable ORDER BY 1;
 f1 | not null 
----+----------
  1 | t
  2 | t
  3 | t
    | f
(4 rows)

SELECT 1 IS DISTINCT FROM 2 AS "yes";
 yes 
-----
 t
(1 row)

SELECT 1 IS DISTINCT FROM 2 "yes";
 yes 
-----
 t
(1 row)

SELECT 2 IS DISTINCT FROM 2 AS "no";
 no 
----
 f
(1 row)

SELECT 2 IS DISTINCT FROM 2 "no";
 no 
----
 f
(1 row)

SELECT 2 IS DISTINCT FROM null AS "yes";
 yes 
-----
 t
(1 row)

SELECT 2 IS DISTINCT FROM null "yes";
 yes 
-----
 t
(1 row)

SELECT null IS DISTINCT FROM null AS "no";
 no 
----
 f
(1 row)

SELECT null IS DISTINCT FROM null "no";
 no 
----
 f
(1 row)

CREATE TABLE test_having (a int, b int, c char(8), d char) DISTRIBUTED RANDOMLY;
INSERT INTO test_having VALUES
  (0, 1, 'XXXX', 'A'),
  (1, 2, 'AAAA', 'b'),
  (2, 2, 'AAAA', 'c'),
  (3, 3, 'BBBB', 'D'),
  (4, 3, 'BBBB', 'e'),
  (5, 3, 'bbbb', 'F'),
  (6, 4, 'cccc', 'g'),
  (7, 4, 'cccc', 'h'),
  (8, 4, 'CCCC', 'I'),
  (9, 4, 'CCCC', 'j');
SELECT 1 AS one FROM test_having WHERE 1/a = 1 HAVING 1 < 2;
 one 
-----
   1
(1 row)

SELECT 1 one FROM test_having WHERE 1/a = 1 HAVING 1 < 2;
 one 
-----
   1
(1 row)

SELECT 1 AS "one_%^" FROM test_having WHERE 1/a = 1 HAVING 1 < 2;
 one_%^ 
--------
      1
(1 row)

SELECT 1 "one_%^" FROM test_having WHERE 1/a = 1 HAVING 1 < 2;
 one_%^ 
--------
      1
(1 row)

SELECT c AS "C+1", max(a) AS MAX FROM test_having GROUP BY c HAVING count(*) > 2 OR min(a) = max(a)  ORDER BY c;
   C+1    | max 
----------+-----
 bbbb     |   5
 XXXX     |   0
(2 rows)

SELECT c "C+1", max(a) AS MAX FROM test_having GROUP BY c HAVING count(*) > 2 OR min(a) = max(a)  ORDER BY c;
   C+1    | max 
----------+-----
 bbbb     |   5
 XXXX     |   0
(2 rows)

SELECT 1 AS one WHERE 1 IN (SELECT 1);
 one 
-----
   1
(1 row)

SELECT 1 one WHERE 1 IN (SELECT 1);
 one 
-----
   1
(1 row)

SELECT 1 AS zero WHERE 1 NOT IN (SELECT 1);
 zero 
------
(0 rows)

SELECT 1 zero WHERE 1 NOT IN (SELECT 1);
 zero 
------
(0 rows)

SELECT 1 AS zero WHERE 1 IN (SELECT 2);
 zero 
------
(0 rows)

SELECT 1 zero WHERE 1 IN (SELECT 2);
 zero 
------
(0 rows)

CREATE TABLE SUBSELECT_TBL_AS_TEST (
   f1 integer,
   f2 integer,
   f3 float
 ) DISTRIBUTED RANDOMLY;
INSERT INTO SUBSELECT_TBL_AS_TEST VALUES
  (1, 2, 3),
  (2, 3, 4),
  (3, 4, 5),
  (1, 1, 1),
  (2, 2, 2),
  (3, 3, 3),
  (6, 7, 8),
  (8, 9, NULL);
SELECT '' AS eight, * FROM SUBSELECT_TBL_AS_TEST ORDER BY 2,3,4;
 eight | f1 | f2 | f3 
-------+----+----+----
       |  1 |  1 |  1
       |  1 |  2 |  3
       |  2 |  2 |  2
       |  2 |  3 |  4
       |  3 |  3 |  3
       |  3 |  4 |  5
       |  6 |  7 |  8
       |  8 |  9 |   
(8 rows)

SELECT '' eight, * FROM SUBSELECT_TBL_AS_TEST ORDER BY 2,3,4;
 eight | f1 | f2 | f3 
-------+----+----+----
       |  1 |  1 |  1
       |  1 |  2 |  3
       |  2 |  2 |  2
       |  2 |  3 |  4
       |  3 |  3 |  3
       |  3 |  4 |  5
       |  6 |  7 |  8
       |  8 |  9 |   
(8 rows)

SELECT '' AS six, f1 AS "Uncorrelated Field" FROM SUBSELECT_TBL_AS_TEST  WHERE f1 IN (SELECT f2 FROM SUBSELECT_TBL_AS_TEST) ORDER BY 2;
 six | Uncorrelated Field 
-----+--------------------
     |                  1
     |                  1
     |                  2
     |                  2
     |                  3
     |                  3
(6 rows)

SELECT '' six, f1 "Uncorrelated Field" FROM SUBSELECT_TBL_AS_TEST  WHERE f1 IN (SELECT f2 FROM SUBSELECT_TBL_AS_TEST) ORDER BY 2;
 six | Uncorrelated Field 
-----+--------------------
     |                  1
     |                  1
     |                  2
     |                  2
     |                  3
     |                  3
(6 rows)

SELECT '' AS six, f1 AS "Uncorrelated Field" FROM SUBSELECT_TBL_AS_TEST  WHERE f1 IN (SELECT f2 FROM SUBSELECT_TBL_AS_TEST WHERE f2 IN (SELECT f1 FROM SUBSELECT_TBL_AS_TEST)) ORDER BY 2;
 six | Uncorrelated Field 
-----+--------------------
     |                  1
     |                  1
     |                  2
     |                  2
     |                  3
     |                  3
(6 rows)

SELECT '' six, f1 "Uncorrelated Field" FROM SUBSELECT_TBL_AS_TEST  WHERE f1 IN (SELECT f2 FROM SUBSELECT_TBL_AS_TEST WHERE f2 IN (SELECT f1 FROM SUBSELECT_TBL_AS_TEST)) ORDER BY 2;
 six | Uncorrelated Field 
-----+--------------------
     |                  1
     |                  1
     |                  2
     |                  2
     |                  3
     |                  3
(6 rows)

SELECT '' AS six, f1 AS "Correlated Field", f2 AS "Second Field"  FROM SUBSELECT_TBL_AS_TEST upper  WHERE f1 IN (SELECT f2 FROM SUBSELECT_TBL_AS_TEST WHERE f1 = upper.f1) ORDER BY 2,3;
 six | Correlated Field | Second Field 
-----+------------------+--------------
     |                1 |            1
     |                1 |            2
     |                2 |            2
     |                2 |            3
     |                3 |            3
     |                3 |            4
(6 rows)

SELECT '' six, f1 "Correlated Field", f2 "Second Field"  FROM SUBSELECT_TBL_AS_TEST upper  WHERE f1 IN (SELECT f2 FROM SUBSELECT_TBL_AS_TEST WHERE f1 = upper.f1) ORDER
 BY 2,3;
 six | Correlated Field | Second Field 
-----+------------------+--------------
     |                1 |            1
     |                1 |            2
     |                2 |            2
     |                2 |            3
     |                3 |            3
     |                3 |            4
(6 rows)

 
CREATE TEMP TABLE foo (id integer) DISTRIBUTED RANDOMLY;
CREATE TEMP TABLE bar (id1 integer, id2 integer) DISTRIBUTED RANDOMLY;
INSERT INTO foo VALUES (1);
INSERT INTO bar VALUES (1, 1), (2, 2), (3, 1);
SELECT * FROM foo WHERE id IN (SELECT id2 FROM (SELECT DISTINCT id1, id2 FROM bar) AS s) ORDER BY 1;
 id 
----
  1
(1 row)

SELECT * FROM foo WHERE id IN (SELECT id2 FROM (SELECT DISTINCT id1, id2 FROM bar) s) ORDER BY 1;
 id 
----
  1
(1 row)

SELECT * FROM foo WHERE id IN (SELECT id2 FROM (SELECT id1, id2 FROM bar UNION SELECT id1, id2 FROM bar) AS s) ORDER BY 1;
 id 
----
  1
(1 row)

SELECT * FROM foo WHERE id IN (SELECT id2 FROM (SELECT id1, id2 FROM bar UNION SELECT id1, id2 FROM bar) s) ORDER BY 1;
 id 
----
  1
(1 row)

SELECT * FROM foo WHERE id IN  (SELECT id2 FROM (SELECT id2 FROM bar GROUP BY id2) AS s) ORDER BY 1;
 id 
----
  1
(1 row)

SELECT * FROM foo WHERE id IN  (SELECT id2 FROM (SELECT id2 FROM bar GROUP BY id2) s) ORDER BY 1;
 id 
----
  1
(1 row)

SELECT * FROM foo WHERE id IN (SELECT id2 FROM (SELECT id2 FROM bar UNION SELECT id2 FROM bar) AS s) ORDER BY 1;
 id 
----
  1
(1 row)

SELECT * FROM foo WHERE id IN (SELECT id2 FROM (SELECT id2 FROM bar UNION SELECT id2 FROM bar) s) ORDER BY 1;
 id 
----
  1
(1 row)

create table xyz2 ("B B" int, "C" int, "D+1" int) DISTRIBUTED RANDOMLY;
insert into xyz2 values (generate_series(1,3),generate_series(4,6),generate_series(7,9));
select "B B" AS "%_B B","C" AS _c, "D+1" AS "D" from xyz2;
 %_B B | _c | D 
-------+----+---
     2 |  5 | 8
     1 |  4 | 7
     3 |  6 | 9
(3 rows)

select "B B" "%_B B","C" _c, "D+1" "D" from xyz2;
 %_B B | _c | D 
-------+----+---
     2 |  5 | 8
     1 |  4 | 7
     3 |  6 | 9
(3 rows)

select "B B" AS "%_B()","C" AS "_c&--", "D+1" AS "D+1" from xyz2;
 %_B() | _c&-- | D+1 
-------+-------+-----
     1 |     4 |   7
     3 |     6 |   9
     2 |     5 |   8
(3 rows)

select "B B" "%_B()","C" "_c&--", "D+1" "D+1" from xyz2;
 %_B() | _c&-- | D+1 
-------+-------+-----
     2 |     5 |   8
     1 |     4 |   7
     3 |     6 |   9
(3 rows)

select "B B" AS "## B B ##","C" AS "##_C_##", "D+1" AS "## D+1 ##" from xyz2;
 ## B B ## | ##_C_## | ## D+1 ## 
-----------+---------+-----------
         2 |       5 |         8
         1 |       4 |         7
         3 |       6 |         9
(3 rows)

select "B B" "## B B ##","C" "##_C_##", "D+1" "## D+1 ##" from xyz2;
 ## B B ## | ##_C_## | ## D+1 ## 
-----------+---------+-----------
         2 |       5 |         8
         1 |       4 |         7
         3 |       6 |         9
(3 rows)

select "B B" AS "!@ B @!","C" AS "&* C *&", "D+1" AS "^~ D ~^" from xyz2;
 !@ B @! | &* C *& | ^~ D ~^ 
---------+---------+---------
       1 |       4 |       7
       3 |       6 |       9
       2 |       5 |       8
(3 rows)

select "B B" "!@ B @!","C" "&* C *&", "D+1" "^~ D ~^" from xyz2;
 !@ B @! | &* C *& | ^~ D ~^ 
---------+---------+---------
       2 |       5 |       8
       1 |       4 |       7
       3 |       6 |       9
(3 rows)

select "B B"+1 "(B B)","C" "[C]", "D+1" "{D+1}" from xyz2;
 (B B) | [C] | {D+1} 
-------+-----+-------
     3 |   5 |     8
     2 |   4 |     7
     4 |   6 |     9
(3 rows)

select "B B"+1 "(B B)","C" "[C]", "D+1" "{D+1}" from xyz2;
 (B B) | [C] | {D+1} 
-------+-----+-------
     2 |   4 |     7
     4 |   6 |     9
     3 |   5 |     8
(3 rows)

CREATE TABLE TIMESTAMP_TBL_AS_TEST (d1 timestamp(2) without time zone) DISTRIBUTED RANDOMLY;
INSERT INTO TIMESTAMP_TBL_AS_TEST VALUES
  ('now'),
  ('now'),
  ('today'),
  ('yesterday'),
  ('tomorrow'),
  ('tomorrow EST'),
  ('tomorrow zulu');
SELECT count(*) AS One FROM TIMESTAMP_TBL_AS_TEST WHERE d1 = timestamp without time zone 'today';
 one 
-----
   1
(1 row)

SELECT count(*) One FROM TIMESTAMP_TBL_AS_TEST WHERE d1 = timestamp without time zone 'today';
 one 
-----
   1
(1 row)

SELECT count(*) AS Three FROM TIMESTAMP_TBL_AS_TEST WHERE d1 = timestamp without time zone 'tomorrow';
 three 
-------
     3
(1 row)

SELECT count(*) Three FROM TIMESTAMP_TBL_AS_TEST WHERE d1 = timestamp without time zone 'tomorrow';
 three 
-------
     3
(1 row)

SELECT count(*) AS One FROM TIMESTAMP_TBL_AS_TEST WHERE d1 = timestamp without time zone 'yesterday';
 one 
-----
   1
(1 row)

SELECT count(*) One FROM TIMESTAMP_TBL_AS_TEST WHERE d1 = timestamp without time zone 'yesterday';
 one 
-----
   1
(1 row)

SELECT count(*) AS One FROM TIMESTAMP_TBL_AS_TEST WHERE d1 = timestamp(2) without time zone 'now' + '2 seconds';
 one 
-----
   0
(1 row)

SELECT count(*) One FROM TIMESTAMP_TBL_AS_TEST WHERE d1 = timestamp(2) without time zone 'now' + '2 seconds';
 one 
-----
   0
(1 row)

DELETE FROM TIMESTAMP_TBL_AS_TEST;
INSERT INTO TIMESTAMP_TBL_AS_TEST VALUES
  ('2009-09-09 00:16:07'),
  ('2009-03-28 01:09:00'),
  ('2009-03-27 15:31:50.06'),
  ('2010-05-15'),
  ('Mon Feb 10 17:32:01 1997 PST');
SELECT '' AS "day", date_trunc('day',d1) AS date_trunc  FROM TIMESTAMP_TBL_AS_TEST WHERE d1 > timestamp without time zone '2009-03-27';
 day |        date_trunc        
-----+--------------------------
     | Fri Mar 27 00:00:00 2009
     | Wed Sep 09 00:00:00 2009
     | Sat Mar 28 00:00:00 2009
     | Sat May 15 00:00:00 2010
(4 rows)

SELECT '' "day", date_trunc('day',d1) date_trunc  FROM TIMESTAMP_TBL_AS_TEST WHERE d1 > timestamp without time zone '2009-03-27';
 day |        date_trunc        
-----+--------------------------
     | Wed Sep 09 00:00:00 2009
     | Sat Mar 28 00:00:00 2009
     | Sat May 15 00:00:00 2010
     | Fri Mar 27 00:00:00 2009
(4 rows)

SELECT '' AS "5", d1 FROM TIMESTAMP_TBL_AS_TEST  WHERE d1 <= timestamp without time zone '2010-05-15';
 5 |             d1              
---+-----------------------------
   | Fri Mar 27 15:31:50.06 2009
   | Wed Sep 09 00:16:07 2009
   | Sat Mar 28 01:09:00 2009
   | Sat May 15 00:00:00 2010
   | Mon Feb 10 17:32:01 1997
(5 rows)

SELECT '' "5", d1 FROM TIMESTAMP_TBL_AS_TEST  WHERE d1 <= timestamp without time zone '2010-05-15';
 5 |             d1              
---+-----------------------------
   | Fri Mar 27 15:31:50.06 2009
   | Wed Sep 09 00:16:07 2009
   | Sat Mar 28 01:09:00 2009
   | Sat May 15 00:00:00 2010
   | Mon Feb 10 17:32:01 1997
(5 rows)

SELECT '' AS date_trunc_week, date_trunc( 'week', timestamp '2004-02-29 15:44:17.71393' ) AS week_trunc;
 date_trunc_week |        week_trunc        
-----------------+--------------------------
                 | Mon Feb 23 00:00:00 2004
(1 row)

SELECT '' date_trunc_week, date_trunc( 'week', timestamp '2004-02-29 15:44:17.71393' )  week_trunc;
 date_trunc_week |        week_trunc        
-----------------+--------------------------
                 | Mon Feb 23 00:00:00 2004
(1 row)

SELECT '' AS to_char_1, to_char(d1, 'DAY Day day DY Dy dy MONTH Month month RM MON Mon mon')  FROM TIMESTAMP_TBL_AS_TEST;
 to_char_1 |                                         to_char                                          
-----------+------------------------------------------------------------------------------------------
           | FRIDAY    Friday    friday    FRI Fri fri MARCH     March     march     III  MAR Mar mar
           | WEDNESDAY Wednesday wednesday WED Wed wed SEPTEMBER September september IX   SEP Sep sep
           | SATURDAY  Saturday  saturday  SAT Sat sat MARCH     March     march     III  MAR Mar mar
           | SATURDAY  Saturday  saturday  SAT Sat sat MAY       May       may       V    MAY May may
           | MONDAY    Monday    monday    MON Mon mon FEBRUARY  February  february  II   FEB Feb feb
(5 rows)

SELECT '' to_char_1, to_char(d1, 'DAY Day day DY Dy dy MONTH Month month RM MON Mon mon')  FROM TIMESTAMP_TBL_AS_TEST;
 to_char_1 |                                         to_char                                          
-----------+------------------------------------------------------------------------------------------
           | FRIDAY    Friday    friday    FRI Fri fri MARCH     March     march     III  MAR Mar mar
           | WEDNESDAY Wednesday wednesday WED Wed wed SEPTEMBER September september IX   SEP Sep sep
           | SATURDAY  Saturday  saturday  SAT Sat sat MARCH     March     march     III  MAR Mar mar
           | SATURDAY  Saturday  saturday  SAT Sat sat MAY       May       may       V    MAY May may
           | MONDAY    Monday    monday    MON Mon mon FEBRUARY  February  february  II   FEB Feb feb
(5 rows)

create table xyz1 ("B B" text, "C" text, "D+1" text) DISTRIBUTED RANDOMLY;
insert into xyz1 values
  ('0_zero','1_one','2_two'),
  ('3_three','4_four','5_five'),
  ('6_six','7_seven','8_eight');
select upper("B B") AS "B_B", upper ("C") AS C, substr("D+1",1,1) AS "D" from xyz1;
   B_B   |    c    | D 
---------+---------+---
 0_ZERO  | 1_ONE   | 2
 3_THREE | 4_FOUR  | 5
 6_SIX   | 7_SEVEN | 8
(3 rows)

select upper("B B") "B_B", upper ("C") C, substr("D+1",1,1) "D" from xyz1;
   B_B   |    c    | D 
---------+---------+---
 6_SIX   | 7_SEVEN | 8
 0_ZERO  | 1_ONE   | 2
 3_THREE | 4_FOUR  | 5
(3 rows)

select lower("B B") AS "B_B", lower ("C") AS C, substr("D+1",1,1) AS "D+1" from xyz1;
   B_B   |    c    | D+1 
---------+---------+-----
 6_six   | 7_seven | 8
 0_zero  | 1_one   | 2
 3_three | 4_four  | 5
(3 rows)

select lower("B B") "B_B", lower ("C") C, substr("D+1",1,1) "D+1" from xyz1;
   B_B   |    c    | D+1 
---------+---------+-----
 6_six   | 7_seven | 8
 0_zero  | 1_one   | 2
 3_three | 4_four  | 5
(3 rows)

select upper("B B") AS "B_B", lower ("C") AS C, substr("D+1",1,1) AS "D+1%" from xyz1;
   B_B   |    c    | D+1% 
---------+---------+------
 0_ZERO  | 1_one   | 2
 3_THREE | 4_four  | 5
 6_SIX   | 7_seven | 8
(3 rows)

select upper("B B") "B_B", lower ("C") C, substr("D+1",1,1) "D+1%" from xyz1;
   B_B   |    c    | D+1% 
---------+---------+------
 6_SIX   | 7_seven | 8
 0_ZERO  | 1_one   | 2
 3_THREE | 4_four  | 5
(3 rows)

select lower("B B") AS "B_B", upper ("C") AS C, ("D+1") AS "D+1" from xyz1;
   B_B   |    c    |   D+1   
---------+---------+---------
 6_six   | 7_SEVEN | 8_eight
 0_zero  | 1_ONE   | 2_two
 3_three | 4_FOUR  | 5_five
(3 rows)

select lower("B B") "B_B", upper ("C") C, ("D+1") "D+1" from xyz1;
   B_B   |    c    |   D+1   
---------+---------+---------
 6_six   | 7_SEVEN | 8_eight
 0_zero  | 1_ONE   | 2_two
 3_three | 4_FOUR  | 5_five
(3 rows)

select upper("C") AS "C", lower ("B B") AS "%B_B%", "D+1" AS "D+1" from xyz1;
    C    |  %B_B%  |   D+1   
---------+---------+---------
 1_ONE   | 0_zero  | 2_two
 4_FOUR  | 3_three | 5_five
 7_SEVEN | 6_six   | 8_eight
(3 rows)

select upper("C") "C", lower ("B B") "%B_B%", "D+1" "D+1" from xyz1;
    C    |  %B_B%  |   D+1   
---------+---------+---------
 7_SEVEN | 6_six   | 8_eight
 1_ONE   | 0_zero  | 2_two
 4_FOUR  | 3_three | 5_five
(3 rows)

select lower("C") AS "%C%", upper ("B B") AS "BB", "D+1"||'9_nine' AS "D+1" from xyz1;
   %C%   |   BB    |      D+1      
---------+---------+---------------
 7_seven | 6_SIX   | 8_eight9_nine
 1_one   | 0_ZERO  | 2_two9_nine
 4_four  | 3_THREE | 5_five9_nine
(3 rows)

select lower("C") "%C%", upper ("B B") "BB", "D+1"||'9_nine' "D+1" from xyz1;
   %C%   |   BB    |      D+1      
---------+---------+---------------
 7_seven | 6_SIX   | 8_eight9_nine
 1_one   | 0_ZERO  | 2_two9_nine
 4_four  | 3_THREE | 5_five9_nine
(3 rows)

select upper("B B") AS "B_B", lower ("C") AS C, ("D+1"||'9_nine') AS "D+1" from xyz1;
   B_B   |    c    |      D+1      
---------+---------+---------------
 0_ZERO  | 1_one   | 2_two9_nine
 3_THREE | 4_four  | 5_five9_nine
 6_SIX   | 7_seven | 8_eight9_nine
(3 rows)

select upper("B B") "B_B", lower ("C") C, ("D+1"||'9_nine') "D+1" from xyz1;
   B_B   |    c    |      D+1      
---------+---------+---------------
 6_SIX   | 7_seven | 8_eight9_nine
 0_ZERO  | 1_one   | 2_two9_nine
 3_THREE | 4_four  | 5_five9_nine
(3 rows)

CREATE TABLE test_as_alias (a integer, b integer) DISTRIBUTED RANDOMLY;
CREATE OR REPLACE FUNCTION one() returns integer as $$ select 1 AS result; $$ language sql;
CREATE OR REPLACE FUNCTION one() returns integer as $$ select 1 result; $$ language sql;
CREATE OR REPLACE FUNCTION add_em(integer, integer) RETURNS integer as $$ SELECT $1 + $2 AS sum; $$ LANGUAGE SQL CONTAINS SQL;
CREATE OR REPLACE FUNCTION add_em(integer, integer) RETURNS integer as $$ SELECT $1 + $2 sum; $$ LANGUAGE SQL CONTAINS SQL;
INSERT INTO test_as_alias select a, a%5 from generate_series(1, 20) AS a;
INSERT INTO test_as_alias select a, a%5 from generate_series(1, 20) a;
-- Test using column aliases that are the same as a different column's real name.
CREATE TABLE colalias_dml_decimal
(
    col1 decimal DEFAULT 1.00,
    col2 decimal,
    col3 char,
    col4 decimal,
    col5 decimal
)
DISTRIBUTED by (col4)
PARTITION BY LIST(col2)
(
    default partition def
);
CREATE TABLE colalias_dml_decimal_candidate
(
    col1 decimal DEFAULT 1.00,
    col2 decimal,
    col3 char,
    col4 decimal,
    col5 decimal
) DISTRIBUTED by (col2);
INSERT INTO colalias_dml_decimal_candidate VALUES(2.00,1.00,'a',2.00,1.00);
INSERT INTO colalias_dml_decimal(col2,col1,col3,col5,col4) SELECT col1,col2,col3,col5,col4 FROM (SELECT col1,col1 as col2,col3,col5 as col4,col5  FROM colalias_dml_decimal_candidate)foo;
SELECT * FROM colalias_dml_decimal ORDER BY 1,2,3,4;
 col1 | col2 | col3 | col4 | col5 
------+------+------+------+------
 2.00 | 2.00 | a    | 1.00 | 1.00
(1 row)

UPDATE colalias_dml_decimal SET col1 = (select col2 as col1 FROM colalias_dml_decimal_candidate);
SELECT * FROM colalias_dml_decimal ORDER BY 1,2,3,4;
 col1 | col2 | col3 | col4 | col5 
------+------+------+------+------
 1.00 | 2.00 | a    | 1.00 | 1.00
(1 row)

UPDATE colalias_dml_decimal SET col1 =colalias_dml_decimal_candidate.col2 FROM colalias_dml_decimal_candidate;
SELECT * FROM colalias_dml_decimal ORDER BY 1,2,3,4;
 col1 | col2 | col3 | col4 | col5 
------+------+------+------+------
 1.00 | 2.00 | a    | 1.00 | 1.00
(1 row)

