--start_ignore
drop table if exists testbadsql;
NOTICE:  table "testbadsql" does not exist, skipping
drop table if exists bfv_planner_x;
NOTICE:  table "bfv_planner_x" does not exist, skipping
drop table if exists bfv_planner_foo;
NOTICE:  table "bfv_planner_foo" does not exist, skipping
--end_ignore
CREATE TABLE testbadsql(id int);
NOTICE:  Table doesn't have 'DISTRIBUTED BY' clause -- Using column named 'id' as the Greenplum Database data distribution key for this table.
HINT:  The 'DISTRIBUTED BY' clause determines the distribution of data. Make sure column(s) chosen are the optimal data distribution key to minimize skew.
CREATE TABLE bfv_planner_x(i integer);
NOTICE:  Table doesn't have 'DISTRIBUTED BY' clause -- Using column named 'i' as the Greenplum Database data distribution key for this table.
HINT:  The 'DISTRIBUTED BY' clause determines the distribution of data. Make sure column(s) chosen are the optimal data distribution key to minimize skew.
CREATE TABLE bfv_planner_foo AS SELECT i as a, i+1 as b from generate_series(1,10)i;
NOTICE:  Table doesn't have 'DISTRIBUTED BY' clause. Creating a NULL policy entry.
--
-- Test unexpected internal error (execQual.c:4413) when using subquery+window function+union in 4.2.6.x
--
-- Q1
select * from
(SELECT  MIN(id) OVER () minid FROM testbadsql
UNION
SELECT  MIN(id) OVER () minid FROM testbadsql
) tmp
where tmp.minid=123;
 minid 
-------
(0 rows)

-- Q2
select * from
(SELECT  MIN(id) OVER () minid FROM testbadsql
UNION
SELECT 1
) tmp
where tmp.minid=123;
 minid 
-------
(0 rows)

-- Q3
select * from
(SELECT  MIN(id) OVER () minid FROM testbadsql) tmp
where tmp.minid=123;
 minid 
-------
(0 rows)

-- Q4
SELECT * from (
  SELECT max(i) over () as w from bfv_planner_x Union Select 1 as w)
as bfv_planner_foo where w > 0;
 w 
---
 1
(1 row)

--
-- Test query when using median function with count(*)
--
--start_ignore
drop table if exists testmedian;
NOTICE:  table "testmedian" does not exist, skipping
--end_ignore
CREATE TABLE testmedian
(
  a character(2) NOT NULL,
  b character varying(8) NOT NULL,
  c character varying(8) NOT NULL,
  value1 double precision,
  value2 double precision
)
WITH (
  OIDS=FALSE
)
DISTRIBUTED BY (b,c);
insert into testmedian
select i, i, i, i, i
from  (select * from generate_series(1, 99) i ) a ;
-- Test with count()
select median(value1), count(*)
from  testmedian
where c ='55'
group by b, c, value2;
 median | count 
--------+-------
     55 |     1
(1 row)

-- Test with varying ORDER-BY clause
select median(value1), count(*)
from  testmedian
where c ='25'
group by a, b, c, value2
order by c,b;
 median | count 
--------+-------
     25 |     1
(1 row)

-- Test with varying ORDER-BY clause
select median(value1), count(*)
from  testmedian
where c ='55'
group by b,c,value1
order by b, c, value1;
 median | count 
--------+-------
     55 |     1
(1 row)

-- Test with sum()
select median(value1), sum(value2)
from  testmedian
where c ='55'
group by b, c, value2;
 median | sum 
--------+-----
     55 |  55
(1 row)

-- Test with min()
select median(value1), min(c)
from  testmedian
where c ='55'
group by b, c, value2;
 median | min 
--------+-----
     55 | 55
(1 row)

-- Test with varying GROUP-BY clause
select median(value1), count(*)
from  testmedian
where c ='55'
group by b;
 median | count 
--------+-------
     55 |     1
(1 row)

-- Test with varying GROUP-BY clause
select median(value1), count(*)
from  testmedian
where c ='55'
group by b,c;
 median | count 
--------+-------
     55 |     1
(1 row)

-- Test with varying GROUP-BY clause
select median(value1), count(*)
from  testmedian
where c ='55'
group by c,b;
 median | count 
--------+-------
     55 |     1
(1 row)

-- Test with varying GROUP-BY clause
select median(value1), count(*)
from  testmedian
where c ='55'
group by b,c,value1;
 median | count 
--------+-------
     55 |     1
(1 row)

-- Test with varying ORDER-BY clause
select median(value1), count(*)
from  testmedian
where c ='25'
group by b, value1
order by b;
 median | count 
--------+-------
     25 |     1
(1 row)

-- Test with varying ORDER-BY clause
select median(value1), count(*)
from  testmedian
where c ='25'
group by b, c, value2
order by b,c;
 median | count 
--------+-------
     25 |     1
(1 row)

-- Test inheritance planning, when a SubPlan is duplicated for different
-- child tables.
create table r (a int) distributed by (a);
create table p (a int, b int) distributed by (a);
create table p2 (a int, b int) inherits (p) distributed by (b);
NOTICE:  merging column "a" with inherited definition
NOTICE:  merging column "b" with inherited definition
insert into r values (3);
insert into p select a, b from generate_series(1,3) a, generate_series(1,3) b;
delete from p where b = 1 or (b=2 and a in (select r.a from r));
select * from p;
 a | b 
---+---
 3 | 3
 1 | 2
 1 | 3
 2 | 2
 2 | 3
(5 rows)

delete from p where b = 1 or (b=2 and a in (select b from r));
select * from p;
 a | b 
---+---
 1 | 2
 1 | 3
 2 | 3
 3 | 3
(4 rows)

-- Test planning of IS NOT FALSE. We used treat "(a = b) IS NOT FALSE" as
-- hash joinable, and create a plan with a hash join on "(a = b)". That
-- was wrong, because NULLs are treated differently.
create table booltest (b bool);
NOTICE:  Table doesn't have 'DISTRIBUTED BY' clause -- Using column named 'b' as the Greenplum Database data distribution key for this table.
HINT:  The 'DISTRIBUTED BY' clause determines the distribution of data. Make sure column(s) chosen are the optimal data distribution key to minimize skew.
insert into booltest values ('t');
insert into booltest values (null);
select * from booltest a, booltest b where (a.b = b.b) is not false;
 b | b 
---+---
   | 
   | t
 t | 
 t | t
(4 rows)

-- start_ignore
drop table if exists bfv_planner_x;
drop table if exists testbadsql;
drop table if exists bfv_planner_foo;
drop table if exists testmedian;
-- end_ignore
