create schema bfv_statistic;
set search_path=bfv_statistic;
create table bfv_statistics_foo (a int, b int) distributed by (a);
insert into bfv_statistics_foo values (1,1);
insert into bfv_statistics_foo values (0,1);
insert into bfv_statistics_foo values (2,1);
insert into bfv_statistics_foo values (null,1);
analyze bfv_statistics_foo;
-- current statistics
select stanullfrac, stadistinct, stanumbers1 from pg_statistic where starelid='bfv_statistics_foo'::regclass and staattnum=1;
 stanullfrac | stadistinct | stanumbers1 
-------------+-------------+-------------
        0.25 |          -1 | 
(1 row)

-- exercise GPORCA translator
explain select * from bfv_statistics_foo where a is not null and b >= 1;
                                 QUERY PLAN                                 
----------------------------------------------------------------------------
 Gather Motion 3:1  (slice1; segments: 3)  (cost=0.00..2.05 rows=3 width=8)
   ->  Seq Scan on bfv_statistics_foo  (cost=0.00..2.05 rows=1 width=8)
         Filter: a IS NOT NULL AND b >= 1
 Settings:  optimizer=off
 Optimizer status: legacy query optimizer
(5 rows)

create table bfv_statistics_foo2(a int) distributed by (a);
insert into bfv_statistics_foo2 select generate_series(1,5);
insert into bfv_statistics_foo2 select 1 from generate_series(1,5);
insert into bfv_statistics_foo2 select 2 from generate_series(1,4);
insert into bfv_statistics_foo2 select 3 from generate_series(1,3);
insert into bfv_statistics_foo2 select 4 from generate_series(1,2);
insert into bfv_statistics_foo2 select 5 from generate_series(1,1);
analyze bfv_statistics_foo2;
-- current stats
select stanumbers1, stavalues1 from pg_statistic where starelid='bfv_statistics_foo2'::regclass;
       stanumbers1       | stavalues1  
-------------------------+-------------
 {0.3,0.25,0.2,0.15,0.1} | {1,2,3,4,5}
(1 row)

explain select a from bfv_statistics_foo2 where a > 1 order by a;
                                 QUERY PLAN                                  
-----------------------------------------------------------------------------
 Gather Motion 3:1  (slice1; segments: 3)  (cost=2.52..2.55 rows=14 width=4)
   Merge Key: a
   ->  Sort  (cost=2.52..2.55 rows=5 width=4)
         Sort Key: a
         ->  Seq Scan on bfv_statistics_foo2  (cost=0.00..2.25 rows=5 width=4)
               Filter: a > 1
 Settings:  optimizer=off
 Optimizer status: legacy query optimizer
(8 rows)

-- change stats manually so that MCV and MCF numbers do not match
set allow_system_table_mods=DML;
update pg_statistic set stavalues1='{6,3,1,5,4,2}'::int[] where starelid='bfv_statistics_foo2'::regclass;
-- excercise the translator
explain select a from bfv_statistics_foo2 where a > 1 order by a;
                                 QUERY PLAN                                  
-----------------------------------------------------------------------------
 Gather Motion 3:1  (slice1; segments: 3)  (cost=2.57..2.61 rows=17 width=4)
   Merge Key: a
   ->  Sort  (cost=2.57..2.61 rows=6 width=4)
         Sort Key: a
         ->  Seq Scan on bfv_statistics_foo2  (cost=0.00..2.25 rows=6 width=4)
               Filter: a > 1
 Settings:  optimizer=off
 Optimizer status: legacy query optimizer
(8 rows)

--
-- test missing statistics
--
set gp_create_table_random_default_distribution=off;
create table bfv_statistics_foo3(a int);
NOTICE:  Table doesn't have 'DISTRIBUTED BY' clause -- Using column named 'a' as the Greenplum Database data distribution key for this table.
HINT:  The 'DISTRIBUTED BY' clause determines the distribution of data. Make sure column(s) chosen are the optimal data distribution key to minimize skew.
select * from gp_toolkit.gp_stats_missing where smischema = 'bfv_statistic' AND  smitable = 'bfv_statistics_foo3';
   smischema   |      smitable       | smisize | smicols | smirecs 
---------------+---------------------+---------+---------+---------
 bfv_statistic | bfv_statistics_foo3 | f       |       1 |       0
(1 row)

--
-- for Orca's Split Operator ensure that the columns needed for stats derivation is correct
--
set gp_create_table_random_default_distribution=off;
CREATE TABLE bar_dml (
    vtrg character varying(6) NOT NULL,
    tec_schuld_whg character varying(3) NOT NULL,
    inv character varying(11) NOT NULL,
    zed_id character varying(6) NOT NULL,
    mkl_id character varying(6) NOT NULL,
    zj integer NOT NULL,
    folio integer NOT NULL,
    zhlg_typ character varying(1) NOT NULL,
    zhlg character varying(8) NOT NULL,
    ant_zhlg double precision,
    zuordn_sys_dat character varying(11),
    zhlg_whg_bilkurs numeric(15,8),
    tec_whg_bilkurs numeric(15,8),
    zhlg_ziel_id character varying(1) NOT NULL,
    btg_tec_whg_gesh numeric(13,2),
    btg_tec_whg_makl numeric(13,2),
    btg_zhlg_whg numeric(13,2),
    zhlg_typ_org character varying(1),
    zhlg_org character varying(8),
    upd_dat date
)
WITH (appendonly=true) DISTRIBUTED RANDOMLY;
update bar_dml set (zhlg_org, zhlg_typ_org) = (zhlg, zhlg_typ);
--
-- Cardinality estimation when there is no histogram and MCV
--
create table bfv_statistics_foo4 (a int);
NOTICE:  Table doesn't have 'DISTRIBUTED BY' clause -- Using column named 'a' as the Greenplum Database data distribution key for this table.
HINT:  The 'DISTRIBUTED BY' clause determines the distribution of data. Make sure column(s) chosen are the optimal data distribution key to minimize skew.
insert into bfv_statistics_foo4 select i from generate_series(1,99) i;
insert into bfv_statistics_foo4 values (NULL);
analyze bfv_statistics_foo4;
select stanullfrac, stadistinct, stanumbers1 from pg_statistic where starelid='bfv_statistics_foo4'::regclass and staattnum=1;
 stanullfrac | stadistinct | stanumbers1 
-------------+-------------+-------------
        0.01 |          -1 | 
(1 row)

explain select a from bfv_statistics_foo4 where a > 888;
                                 QUERY PLAN                                 
----------------------------------------------------------------------------
 Gather Motion 3:1  (slice1; segments: 3)  (cost=0.00..4.25 rows=1 width=4)
   ->  Seq Scan on bfv_statistics_foo4  (cost=0.00..4.25 rows=1 width=4)
         Filter: a > 888
 Settings:  optimizer=off
 Optimizer status: legacy query optimizer
(5 rows)

--
-- Testing that the merging of memo groups inside Orca does not crash cardinality estimation inside Orca
--
create table t1(c1 int);
NOTICE:  Table doesn't have 'DISTRIBUTED BY' clause -- Using column named 'c1' as the Greenplum Database data distribution key for this table.
HINT:  The 'DISTRIBUTED BY' clause determines the distribution of data. Make sure column(s) chosen are the optimal data distribution key to minimize skew.
insert into t1 values(1);
select v from (select max(c1) as v, 1 as r from t1 union select 1 as v, 2 as r ) as bfv_statistics_foo group by v;
 v 
---
 1
(1 row)

select v from (select max(c1) as v, 1 as r from t1 union all select 1 as v, 2 as r ) as bfv_statistics_foo group by v;
 v 
---
 1
(1 row)

select v from (select max(c1) as v, 1 as r from t1 union select 1 as v, 2 as r ) as bfv_statistics_foo;
 v 
---
 1
 1
(2 rows)

--
-- test the generation of histogram boundaries for numeric and real data types
--
create table bfv_statistics_foo_real (a int4, b real) distributed randomly;
insert into bfv_statistics_foo_real values (0, 'Infinity');
insert into bfv_statistics_foo_real values (0, '-Infinity');
insert into bfv_statistics_foo_real values (0, 'NaN');
insert into bfv_statistics_foo_real values (0, 'Infinity');
insert into bfv_statistics_foo_real values (0, '-Infinity');
insert into bfv_statistics_foo_real values (0, 'NaN');
insert into bfv_statistics_foo_real values (0, 'Infinity');
insert into bfv_statistics_foo_real values (0, '-Infinity');
insert into bfv_statistics_foo_real values (0, 'NaN');
insert into bfv_statistics_foo_real values (0, 'Infinity');
insert into bfv_statistics_foo_real values (0, '-Infinity');
insert into bfv_statistics_foo_real values (0, 'NaN');
INSERT INTO bfv_statistics_foo_real VALUES (0, '0');
INSERT INTO bfv_statistics_foo_real VALUES (1, '0');
INSERT INTO bfv_statistics_foo_real VALUES (2, '-34338492.215397047');
INSERT INTO bfv_statistics_foo_real VALUES (3, '4.31');
INSERT INTO bfv_statistics_foo_real VALUES (4, '7799461.4119');
INSERT INTO bfv_statistics_foo_real VALUES (5, '16397.038491');
INSERT INTO bfv_statistics_foo_real VALUES (6, '93901.57763026');
INSERT INTO bfv_statistics_foo_real VALUES (7, '-83028485');
INSERT INTO bfv_statistics_foo_real VALUES (8, '74881');
INSERT INTO bfv_statistics_foo_real VALUES (9, '-24926804.045047420');
INSERT INTO bfv_statistics_foo_real VALUES (0, '0');
INSERT INTO bfv_statistics_foo_real VALUES (1, '0');
INSERT INTO bfv_statistics_foo_real VALUES (2, '-34338492.215397047');
INSERT INTO bfv_statistics_foo_real VALUES (3, '4.31');
INSERT INTO bfv_statistics_foo_real VALUES (4, '7799461.4119');
INSERT INTO bfv_statistics_foo_real VALUES (5, '16397.038491');
INSERT INTO bfv_statistics_foo_real VALUES (6, '93901.57763026');
INSERT INTO bfv_statistics_foo_real VALUES (7, '-83028485');
INSERT INTO bfv_statistics_foo_real VALUES (8, '74881');
INSERT INTO bfv_statistics_foo_real VALUES (9, '-24926804.045047420');
INSERT INTO bfv_statistics_foo_real VALUES (10, NULL);
INSERT INTO bfv_statistics_foo_real VALUES (10, NULL);
INSERT INTO bfv_statistics_foo_real VALUES (10, NULL);
INSERT INTO bfv_statistics_foo_real VALUES (10, NULL);
INSERT INTO bfv_statistics_foo_real VALUES (10, NULL);
INSERT INTO bfv_statistics_foo_real VALUES (10, NULL);
INSERT INTO bfv_statistics_foo_real VALUES (10, NULL);
INSERT INTO bfv_statistics_foo_real VALUES (10, NULL);
INSERT INTO bfv_statistics_foo_real VALUES (10, NULL);
INSERT INTO bfv_statistics_foo_real VALUES (9, '-24926804.045047420');
INSERT INTO bfv_statistics_foo_real VALUES (0, '0');
INSERT INTO bfv_statistics_foo_real VALUES (1, '0');
INSERT INTO bfv_statistics_foo_real VALUES (2, '-34338492.215397047');
INSERT INTO bfv_statistics_foo_real VALUES (3, '4.31');
INSERT INTO bfv_statistics_foo_real VALUES (4, '7799461.4119');
INSERT INTO bfv_statistics_foo_real VALUES (5, '16397.038491');
INSERT INTO bfv_statistics_foo_real VALUES (6, '93901.57763026');
INSERT INTO bfv_statistics_foo_real VALUES (7, '-83028485');
INSERT INTO bfv_statistics_foo_real VALUES (8, '74881');
INSERT INTO bfv_statistics_foo_real VALUES (9, '-24926804.045047420');
ANALYZE bfv_statistics_foo_real;
select histogram_bounds from pg_stats where tablename = 'bfv_statistics_foo_real' and attname = 'b';
 histogram_bounds 
------------------
 
(1 row)

select most_common_vals from pg_stats where tablename = 'bfv_statistics_foo_real' and attname = 'b';
                                            most_common_vals                                            
--------------------------------------------------------------------------------------------------------
 {0,-Infinity,-2.49268e+07,Infinity,NaN,-8.30285e+07,-3.43385e+07,4.31,16397,74881,93901.6,7.79946e+06}
(1 row)

create table bfv_statistics_foo_numeric (a int4, b numeric) distributed randomly;
insert into bfv_statistics_foo_numeric values (0, 'NaN');
insert into bfv_statistics_foo_numeric values (0, 'NaN');
insert into bfv_statistics_foo_numeric values (0, 'NaN');
insert into bfv_statistics_foo_numeric values (0, 'NaN');
insert into bfv_statistics_foo_numeric values (0, 'NaN');
insert into bfv_statistics_foo_numeric values (0, 'NaN');
insert into bfv_statistics_foo_numeric values (0, 'NaN');
insert into bfv_statistics_foo_numeric values (0, 'NaN');
INSERT INTO bfv_statistics_foo_numeric VALUES (0, '0');
INSERT INTO bfv_statistics_foo_numeric VALUES (1, '0');
INSERT INTO bfv_statistics_foo_numeric VALUES (2, '-34338492.215397047');
INSERT INTO bfv_statistics_foo_numeric VALUES (3, '4.31');
INSERT INTO bfv_statistics_foo_numeric VALUES (4, '7799461.4119');
INSERT INTO bfv_statistics_foo_numeric VALUES (5, '16397.038491');
INSERT INTO bfv_statistics_foo_numeric VALUES (6, '93901.57763026');
INSERT INTO bfv_statistics_foo_numeric VALUES (7, '-83028485');
INSERT INTO bfv_statistics_foo_numeric VALUES (8, '74881');
INSERT INTO bfv_statistics_foo_numeric VALUES (9, '-24926804.045047420');
INSERT INTO bfv_statistics_foo_numeric VALUES (0, '0');
INSERT INTO bfv_statistics_foo_numeric VALUES (1, '0');
INSERT INTO bfv_statistics_foo_numeric VALUES (2, '-34338492.215397047');
INSERT INTO bfv_statistics_foo_numeric VALUES (3, '4.31');
INSERT INTO bfv_statistics_foo_numeric VALUES (4, '7799461.4119');
INSERT INTO bfv_statistics_foo_numeric VALUES (5, '16397.038491');
INSERT INTO bfv_statistics_foo_numeric VALUES (6, '93901.57763026');
INSERT INTO bfv_statistics_foo_numeric VALUES (7, '-83028485');
INSERT INTO bfv_statistics_foo_numeric VALUES (8, '74881');
INSERT INTO bfv_statistics_foo_numeric VALUES (9, '-24926804.045047420');
INSERT INTO bfv_statistics_foo_numeric VALUES (10, NULL);
INSERT INTO bfv_statistics_foo_numeric VALUES (10, NULL);
INSERT INTO bfv_statistics_foo_numeric VALUES (10, NULL);
INSERT INTO bfv_statistics_foo_numeric VALUES (10, NULL);
INSERT INTO bfv_statistics_foo_numeric VALUES (10, NULL);
INSERT INTO bfv_statistics_foo_numeric VALUES (10, NULL);
INSERT INTO bfv_statistics_foo_numeric VALUES (10, NULL);
INSERT INTO bfv_statistics_foo_numeric VALUES (10, NULL);
INSERT INTO bfv_statistics_foo_numeric VALUES (10, NULL);
INSERT INTO bfv_statistics_foo_numeric VALUES (9, '-24926804.045047420');
INSERT INTO bfv_statistics_foo_numeric VALUES (0, '0');
INSERT INTO bfv_statistics_foo_numeric VALUES (1, '0');
INSERT INTO bfv_statistics_foo_numeric VALUES (2, '-34338492.215397047');
INSERT INTO bfv_statistics_foo_numeric VALUES (3, '4.31');
INSERT INTO bfv_statistics_foo_numeric VALUES (4, '7799461.4119');
INSERT INTO bfv_statistics_foo_numeric VALUES (5, '16397.038491');
INSERT INTO bfv_statistics_foo_numeric VALUES (6, '93901.57763026');
INSERT INTO bfv_statistics_foo_numeric VALUES (7, '-83028485');
INSERT INTO bfv_statistics_foo_numeric VALUES (8, '74881');
INSERT INTO bfv_statistics_foo_numeric VALUES (9, '-24926804.045047420');
INSERT INTO bfv_statistics_foo_numeric SELECT i,i FROM generate_series(1,30) i;
ANALYZE bfv_statistics_foo_numeric;
select histogram_bounds from pg_stats where tablename = 'bfv_statistics_foo_numeric' and attname = 'b';
                            histogram_bounds                             
------------------------------------------------------------------------------------
 {1,2,3,4,5,6,7,8,9,10,11,12,13,14,15,16,17,18,19,20,21,22,23,24,25,26,27,28,29,30}
(1 row)

select most_common_vals from pg_stats where tablename = 'bfv_statistics_foo_numeric' and attname = 'b';
                                               most_common_vals                                                
---------------------------------------------------------------------------------------------------------------
 {NaN,0,-24926804.045047420,-83028485,-34338492.215397047,4.31,16397.038491,74881,93901.57763026,7799461.4119}
(1 row)

reset gp_create_table_random_default_distribution;
--
-- Ensure that VACUUM ANALYZE does not result in incorrect statistics
--
CREATE TABLE T25289_T1 (c int);
NOTICE:  Table doesn't have 'DISTRIBUTED BY' clause -- Using column named 'c' as the Greenplum Database data distribution key for this table.
HINT:  The 'DISTRIBUTED BY' clause determines the distribution of data. Make sure column(s) chosen are the optimal data distribution key to minimize skew.
INSERT INTO T25289_T1 VALUES (1);
DELETE FROM T25289_T1;
ANALYZE T25289_T1;
--
-- expect NO more notice after customer run VACUUM FULL
-- 
CREATE TABLE T25289_T2 (c int);
NOTICE:  Table doesn't have 'DISTRIBUTED BY' clause -- Using column named 'c' as the Greenplum Database data distribution key for this table.
HINT:  The 'DISTRIBUTED BY' clause determines the distribution of data. Make sure column(s) chosen are the optimal data distribution key to minimize skew.
INSERT INTO T25289_T2 VALUES (1);
DELETE FROM T25289_T2;
VACUUM FULL T25289_T2;
ANALYZE T25289_T2;
--
-- expect NO notice during analyze if table doesn't have empty pages
--
CREATE TABLE T25289_T3 (c int);
NOTICE:  Table doesn't have 'DISTRIBUTED BY' clause -- Using column named 'c' as the Greenplum Database data distribution key for this table.
HINT:  The 'DISTRIBUTED BY' clause determines the distribution of data. Make sure column(s) chosen are the optimal data distribution key to minimize skew.
INSERT INTO T25289_T3 VALUES (1);
ANALYZE T25289_T3;
--
-- expect NO notice when analyzing append only tables
-- 
CREATE TABLE T25289_T4 (c int, d int)
WITH (APPENDONLY=ON) DISTRIBUTED BY (c)
PARTITION BY RANGE(d) (START(1) END (100) EVERY(1));
NOTICE:  CREATE TABLE will create partition "t25289_t4_1_prt_1" for table "t25289_t4"
NOTICE:  CREATE TABLE will create partition "t25289_t4_1_prt_2" for table "t25289_t4"
NOTICE:  CREATE TABLE will create partition "t25289_t4_1_prt_3" for table "t25289_t4"
NOTICE:  CREATE TABLE will create partition "t25289_t4_1_prt_4" for table "t25289_t4"
NOTICE:  CREATE TABLE will create partition "t25289_t4_1_prt_5" for table "t25289_t4"
NOTICE:  CREATE TABLE will create partition "t25289_t4_1_prt_6" for table "t25289_t4"
NOTICE:  CREATE TABLE will create partition "t25289_t4_1_prt_7" for table "t25289_t4"
NOTICE:  CREATE TABLE will create partition "t25289_t4_1_prt_8" for table "t25289_t4"
NOTICE:  CREATE TABLE will create partition "t25289_t4_1_prt_9" for table "t25289_t4"
NOTICE:  CREATE TABLE will create partition "t25289_t4_1_prt_10" for table "t25289_t4"
NOTICE:  CREATE TABLE will create partition "t25289_t4_1_prt_11" for table "t25289_t4"
NOTICE:  CREATE TABLE will create partition "t25289_t4_1_prt_12" for table "t25289_t4"
NOTICE:  CREATE TABLE will create partition "t25289_t4_1_prt_13" for table "t25289_t4"
NOTICE:  CREATE TABLE will create partition "t25289_t4_1_prt_14" for table "t25289_t4"
NOTICE:  CREATE TABLE will create partition "t25289_t4_1_prt_15" for table "t25289_t4"
NOTICE:  CREATE TABLE will create partition "t25289_t4_1_prt_16" for table "t25289_t4"
NOTICE:  CREATE TABLE will create partition "t25289_t4_1_prt_17" for table "t25289_t4"
NOTICE:  CREATE TABLE will create partition "t25289_t4_1_prt_18" for table "t25289_t4"
NOTICE:  CREATE TABLE will create partition "t25289_t4_1_prt_19" for table "t25289_t4"
NOTICE:  CREATE TABLE will create partition "t25289_t4_1_prt_20" for table "t25289_t4"
NOTICE:  CREATE TABLE will create partition "t25289_t4_1_prt_21" for table "t25289_t4"
NOTICE:  CREATE TABLE will create partition "t25289_t4_1_prt_22" for table "t25289_t4"
NOTICE:  CREATE TABLE will create partition "t25289_t4_1_prt_23" for table "t25289_t4"
NOTICE:  CREATE TABLE will create partition "t25289_t4_1_prt_24" for table "t25289_t4"
NOTICE:  CREATE TABLE will create partition "t25289_t4_1_prt_25" for table "t25289_t4"
NOTICE:  CREATE TABLE will create partition "t25289_t4_1_prt_26" for table "t25289_t4"
NOTICE:  CREATE TABLE will create partition "t25289_t4_1_prt_27" for table "t25289_t4"
NOTICE:  CREATE TABLE will create partition "t25289_t4_1_prt_28" for table "t25289_t4"
NOTICE:  CREATE TABLE will create partition "t25289_t4_1_prt_29" for table "t25289_t4"
NOTICE:  CREATE TABLE will create partition "t25289_t4_1_prt_30" for table "t25289_t4"
NOTICE:  CREATE TABLE will create partition "t25289_t4_1_prt_31" for table "t25289_t4"
NOTICE:  CREATE TABLE will create partition "t25289_t4_1_prt_32" for table "t25289_t4"
NOTICE:  CREATE TABLE will create partition "t25289_t4_1_prt_33" for table "t25289_t4"
NOTICE:  CREATE TABLE will create partition "t25289_t4_1_prt_34" for table "t25289_t4"
NOTICE:  CREATE TABLE will create partition "t25289_t4_1_prt_35" for table "t25289_t4"
NOTICE:  CREATE TABLE will create partition "t25289_t4_1_prt_36" for table "t25289_t4"
NOTICE:  CREATE TABLE will create partition "t25289_t4_1_prt_37" for table "t25289_t4"
NOTICE:  CREATE TABLE will create partition "t25289_t4_1_prt_38" for table "t25289_t4"
NOTICE:  CREATE TABLE will create partition "t25289_t4_1_prt_39" for table "t25289_t4"
NOTICE:  CREATE TABLE will create partition "t25289_t4_1_prt_40" for table "t25289_t4"
NOTICE:  CREATE TABLE will create partition "t25289_t4_1_prt_41" for table "t25289_t4"
NOTICE:  CREATE TABLE will create partition "t25289_t4_1_prt_42" for table "t25289_t4"
NOTICE:  CREATE TABLE will create partition "t25289_t4_1_prt_43" for table "t25289_t4"
NOTICE:  CREATE TABLE will create partition "t25289_t4_1_prt_44" for table "t25289_t4"
NOTICE:  CREATE TABLE will create partition "t25289_t4_1_prt_45" for table "t25289_t4"
NOTICE:  CREATE TABLE will create partition "t25289_t4_1_prt_46" for table "t25289_t4"
NOTICE:  CREATE TABLE will create partition "t25289_t4_1_prt_47" for table "t25289_t4"
NOTICE:  CREATE TABLE will create partition "t25289_t4_1_prt_48" for table "t25289_t4"
NOTICE:  CREATE TABLE will create partition "t25289_t4_1_prt_49" for table "t25289_t4"
NOTICE:  CREATE TABLE will create partition "t25289_t4_1_prt_50" for table "t25289_t4"
NOTICE:  CREATE TABLE will create partition "t25289_t4_1_prt_51" for table "t25289_t4"
NOTICE:  CREATE TABLE will create partition "t25289_t4_1_prt_52" for table "t25289_t4"
NOTICE:  CREATE TABLE will create partition "t25289_t4_1_prt_53" for table "t25289_t4"
NOTICE:  CREATE TABLE will create partition "t25289_t4_1_prt_54" for table "t25289_t4"
NOTICE:  CREATE TABLE will create partition "t25289_t4_1_prt_55" for table "t25289_t4"
NOTICE:  CREATE TABLE will create partition "t25289_t4_1_prt_56" for table "t25289_t4"
NOTICE:  CREATE TABLE will create partition "t25289_t4_1_prt_57" for table "t25289_t4"
NOTICE:  CREATE TABLE will create partition "t25289_t4_1_prt_58" for table "t25289_t4"
NOTICE:  CREATE TABLE will create partition "t25289_t4_1_prt_59" for table "t25289_t4"
NOTICE:  CREATE TABLE will create partition "t25289_t4_1_prt_60" for table "t25289_t4"
NOTICE:  CREATE TABLE will create partition "t25289_t4_1_prt_61" for table "t25289_t4"
NOTICE:  CREATE TABLE will create partition "t25289_t4_1_prt_62" for table "t25289_t4"
NOTICE:  CREATE TABLE will create partition "t25289_t4_1_prt_63" for table "t25289_t4"
NOTICE:  CREATE TABLE will create partition "t25289_t4_1_prt_64" for table "t25289_t4"
NOTICE:  CREATE TABLE will create partition "t25289_t4_1_prt_65" for table "t25289_t4"
NOTICE:  CREATE TABLE will create partition "t25289_t4_1_prt_66" for table "t25289_t4"
NOTICE:  CREATE TABLE will create partition "t25289_t4_1_prt_67" for table "t25289_t4"
NOTICE:  CREATE TABLE will create partition "t25289_t4_1_prt_68" for table "t25289_t4"
NOTICE:  CREATE TABLE will create partition "t25289_t4_1_prt_69" for table "t25289_t4"
NOTICE:  CREATE TABLE will create partition "t25289_t4_1_prt_70" for table "t25289_t4"
NOTICE:  CREATE TABLE will create partition "t25289_t4_1_prt_71" for table "t25289_t4"
NOTICE:  CREATE TABLE will create partition "t25289_t4_1_prt_72" for table "t25289_t4"
NOTICE:  CREATE TABLE will create partition "t25289_t4_1_prt_73" for table "t25289_t4"
NOTICE:  CREATE TABLE will create partition "t25289_t4_1_prt_74" for table "t25289_t4"
NOTICE:  CREATE TABLE will create partition "t25289_t4_1_prt_75" for table "t25289_t4"
NOTICE:  CREATE TABLE will create partition "t25289_t4_1_prt_76" for table "t25289_t4"
NOTICE:  CREATE TABLE will create partition "t25289_t4_1_prt_77" for table "t25289_t4"
NOTICE:  CREATE TABLE will create partition "t25289_t4_1_prt_78" for table "t25289_t4"
NOTICE:  CREATE TABLE will create partition "t25289_t4_1_prt_79" for table "t25289_t4"
NOTICE:  CREATE TABLE will create partition "t25289_t4_1_prt_80" for table "t25289_t4"
NOTICE:  CREATE TABLE will create partition "t25289_t4_1_prt_81" for table "t25289_t4"
NOTICE:  CREATE TABLE will create partition "t25289_t4_1_prt_82" for table "t25289_t4"
NOTICE:  CREATE TABLE will create partition "t25289_t4_1_prt_83" for table "t25289_t4"
NOTICE:  CREATE TABLE will create partition "t25289_t4_1_prt_84" for table "t25289_t4"
NOTICE:  CREATE TABLE will create partition "t25289_t4_1_prt_85" for table "t25289_t4"
NOTICE:  CREATE TABLE will create partition "t25289_t4_1_prt_86" for table "t25289_t4"
NOTICE:  CREATE TABLE will create partition "t25289_t4_1_prt_87" for table "t25289_t4"
NOTICE:  CREATE TABLE will create partition "t25289_t4_1_prt_88" for table "t25289_t4"
NOTICE:  CREATE TABLE will create partition "t25289_t4_1_prt_89" for table "t25289_t4"
NOTICE:  CREATE TABLE will create partition "t25289_t4_1_prt_90" for table "t25289_t4"
NOTICE:  CREATE TABLE will create partition "t25289_t4_1_prt_91" for table "t25289_t4"
NOTICE:  CREATE TABLE will create partition "t25289_t4_1_prt_92" for table "t25289_t4"
NOTICE:  CREATE TABLE will create partition "t25289_t4_1_prt_93" for table "t25289_t4"
NOTICE:  CREATE TABLE will create partition "t25289_t4_1_prt_94" for table "t25289_t4"
NOTICE:  CREATE TABLE will create partition "t25289_t4_1_prt_95" for table "t25289_t4"
NOTICE:  CREATE TABLE will create partition "t25289_t4_1_prt_96" for table "t25289_t4"
NOTICE:  CREATE TABLE will create partition "t25289_t4_1_prt_97" for table "t25289_t4"
NOTICE:  CREATE TABLE will create partition "t25289_t4_1_prt_98" for table "t25289_t4"
NOTICE:  CREATE TABLE will create partition "t25289_t4_1_prt_99" for table "t25289_t4"
ANALYZE T25289_T4;
