-- turn off autostats so we don't have to worry about the logging of the autostat queries
set gp_autostats_mode = None;
-- create needed tables (in a transaction, for speed)
begin;
create table direct_test
(
  key int NULL,
  value varchar(50) NULL
)
distributed by (key); 
create table direct_test_two_column
(
  key1 int NULL,
  key2 int NULL,
  value varchar(50) NULL
)
distributed by (key1, key2);
create table direct_test_bitmap  as select '2008-02-01'::DATE AS DT,
        case when j <= 996
                then 0
        when j<= 998 then 2
        when j<=999 then 3
        when i%10000 < 9000 then 4
        when i%10000 < 9800 then 5
        when i % 10000 <= 9998 then 5 else 6
        end as ind,
        (i*1017-j)::bigint as s from generate_series(1,10) i, generate_series(1,10) j distributed by (dt);
create index direct_test_bitmap_idx on direct_test_bitmap using bitmap (ind, dt);
CREATE TABLE direct_test_partition (trans_id int, date date, amount decimal(9,2), region text) DISTRIBUTED BY (trans_id) PARTITION BY RANGE (date) (START (date '2008-01-01') INCLUSIVE END (date '2009-01-01') EXCLUSIVE EVERY (INTERVAL '1month') );
create unique index direct_test_uk on direct_test_partition(trans_id,date);
create table direct_test_range_partition (a int, b int, c int, d int) distributed by (a) partition by range(d) (start(1) end(10) every(1));
insert into direct_test_range_partition select i, i+1, i+2, i+3 from generate_series(1, 2) i;
commit;
-- enable printing of printing info
set test_print_direct_dispatch_info=on;
-- Constant single-row insert, one column in distribution
-- DO direct dispatch
insert into direct_test values (100, 'cow');
INFO:  (slice 0) Dispatch command to SINGLE content
INFO:  Distributed transaction command 'Distributed Commit (one-phase)' to SINGLE content
-- verify
select * from direct_test order by key, value;
INFO:  (slice 1) Dispatch command to ALL contents: 0 1 2
 key | value 
-----+-------
 100 | cow
(1 row)

-- Constant single-row update, one column in distribution
-- DO direct dispatch
-- Known_opt_diff: MPP-21346
update direct_test set value = 'horse' where key = 100;
INFO:  (slice 0) Dispatch command to SINGLE content
INFO:  Distributed transaction command 'Distributed Commit (one-phase)' to SINGLE content
-- verify
select * from direct_test order by key, value;
INFO:  (slice 1) Dispatch command to ALL contents: 0 1 2
 key | value 
-----+-------
 100 | horse
(1 row)

-- Constant single-row delete, one column in distribution
-- DO direct dispatch
-- Known_opt_diff: MPP-21346
delete from direct_test where key = 100;
INFO:  (slice 0) Dispatch command to SINGLE content
INFO:  Distributed transaction command 'Distributed Commit (one-phase)' to SINGLE content
-- verify
select * from direct_test order by key, value;
INFO:  (slice 1) Dispatch command to ALL contents: 0 1 2
 key | value 
-----+-------
(0 rows)

-- Constant single-row insert, one column in distribution
-- DO direct dispatch
insert into direct_test values (NULL, 'cow');
INFO:  (slice 0) Dispatch command to SINGLE content
INFO:  Distributed transaction command 'Distributed Commit (one-phase)' to SINGLE content
-- verify
select * from direct_test order by key, value;
INFO:  (slice 1) Dispatch command to ALL contents: 0 1 2
 key | value 
-----+-------
     | cow
(1 row)

-- DELETE with an IS NULL predicate
-- DO direct dispatch
delete from direct_test where key is null;
INFO:  (slice 0) Dispatch command to SINGLE content
INFO:  Distributed transaction command 'Distributed Commit (one-phase)' to SINGLE content
-- Same single-row insert as above, but with DEFAULT instead of an explicit values.
-- DO direct dispatch
insert into direct_test values (default, 'cow');
INFO:  (slice 0) Dispatch command to SINGLE content
INFO:  Distributed transaction command 'Distributed Commit (one-phase)' to SINGLE content
-- verify
select * from direct_test order by key, value;
INFO:  (slice 1) Dispatch command to ALL contents: 0 1 2
 key | value 
-----+-------
     | cow
(1 row)

-- Constant single-row insert, two columns in distribution
-- DO direct dispatch
-- Known_opt_diff: MPP-21346
insert into direct_test_two_column values (100, 101, 'cow');
INFO:  (slice 0) Dispatch command to SINGLE content
INFO:  Distributed transaction command 'Distributed Commit (one-phase)' to SINGLE content
-- verify
select * from direct_test_two_column order by key1, key2, value;
INFO:  (slice 1) Dispatch command to ALL contents: 0 1 2
 key1 | key2 | value 
------+------+-------
  100 |  101 | cow
(1 row)

-- Constant single-row update, two columns in distribution
-- DO direct dispatch
-- Known_opt_diff: MPP-21346
update direct_test_two_column set value = 'horse' where key1 = 100 and key2 = 101;
INFO:  (slice 0) Dispatch command to SINGLE content
INFO:  Distributed transaction command 'Distributed Commit (one-phase)' to SINGLE content
-- verify
select * from direct_test_two_column order by key1, key2, value;
INFO:  (slice 1) Dispatch command to ALL contents: 0 1 2
 key1 | key2 | value 
------+------+-------
  100 |  101 | horse
(1 row)

-- Constant single-row delete, two columns in distribution
-- DO direct dispatch
delete from direct_test_two_column where key1 = 100 and key2 = 101;
INFO:  (slice 0) Dispatch command to SINGLE content
INFO:  Distributed transaction command 'Distributed Commit (one-phase)' to SINGLE content
-- verify
select * from direct_test_two_column order by key1, key2, value;
INFO:  (slice 1) Dispatch command to ALL contents: 0 1 2
 key1 | key2 | value 
------+------+-------
(0 rows)

-- expression single-row insert
-- DO direct dispatch
insert into direct_test (key, value) values ('123',123123);
INFO:  (slice 0) Dispatch command to SINGLE content
INFO:  Distributed transaction command 'Distributed Commit (one-phase)' to SINGLE content
insert into direct_test (key, value) values (sqrt(100*10*10),123123);
INFO:  (slice 0) Dispatch command to SINGLE content
INFO:  Distributed transaction command 'Distributed Commit (one-phase)' to SINGLE content
--
-- should get 100 and 123 as the values
--
select * from direct_test where value = '123123' order by key;
INFO:  (slice 1) Dispatch command to ALL contents: 0 1 2
 key | value  
-----+--------
 100 | 123123
 123 | 123123
(2 rows)

delete from direct_test where value = '123123';
INFO:  (slice 0) Dispatch command to ALL contents: 0 1 2
INFO:  Distributed transaction command 'Distributed Prepare' to ALL contents: 0 1 2
INFO:  Distributed transaction command 'Distributed Commit Prepared' to ALL contents: 0 1 2
--------------------------------------------------------------------------------
-- Multiple row update, where clause lists multiple values which hash differently so no direct dispatch
--
-- note that if the hash function for values changes then certain segment configurations may actually 
--                hash all these values to the same content! (and so test would change)
--
update direct_test set value = 'pig' where key in (1,2,3,4,5);
INFO:  (slice 0) Dispatch command to ALL contents: 1 0 2
INFO:  Distributed transaction command 'Distributed Commit (one-phase)' to ALL contents: 1 0 2
update direct_test_two_column set value = 'pig' where key1 = 100 and key2 in (1,2,3,4);
INFO:  (slice 0) Dispatch command to PARTIAL contents: 1 2
INFO:  Distributed transaction command 'Distributed Commit (one-phase)' to PARTIAL contents: 1 2
update direct_test_two_column set value = 'pig' where key1 in (100,101,102,103,104) and key2 in (1);
INFO:  (slice 0) Dispatch command to ALL contents: 1 0 2
INFO:  Distributed transaction command 'Distributed Commit (one-phase)' to ALL contents: 1 0 2
update direct_test_two_column set value = 'pig' where key1 in (100,101) and key2 in (1,2);
INFO:  (slice 0) Dispatch command to PARTIAL contents: 1 2
INFO:  Distributed transaction command 'Distributed Commit (one-phase)' to PARTIAL contents: 1 2
-- Multiple row update, where clause lists values which all hash to same segment
-- DO direct dispatch
-- CAN'T IMPLEMENT THIS TEST BECAUSE THE # of segments changes again (unless we use a # of segments function, and exploit the simple nature of int4 hashing -- can we do that?)
------------------------------
-- Transaction cases
--
-- note that single-row insert can happen BUT DTM will always go to all contents
--
begin;
insert into direct_test values (1,100);
INFO:  (slice 0) Dispatch command to SINGLE content
rollback;
INFO:  Distributed transaction command 'Distributed Abort (No Prepared)' to SINGLE content
begin;
insert into direct_test values (1,100);
INFO:  (slice 0) Dispatch command to SINGLE content
insert into direct_test values (2,100);
INFO:  (slice 0) Dispatch command to SINGLE content
insert into direct_test values (3,100);
INFO:  (slice 0) Dispatch command to SINGLE content
rollback;
INFO:  Distributed transaction command 'Distributed Abort (No Prepared)' to PARTIAL contents: 1 0
-------------------
-- MPP-7634: bitmap index scan
--
-- Known_opt_diff: MPP-21346
select count(*) from direct_test_bitmap where dt='2008-02-05';
INFO:  (slice 1) Dispatch command to SINGLE content
 count 
-------
     0
(1 row)

-- Known_opt_diff: MPP-21346
select count(*) from direct_test_bitmap where dt='2008-02-01';
INFO:  (slice 1) Dispatch command to SINGLE content
 count 
-------
   100
(1 row)

----------------------------------------------------------------------------------
-- MPP-7637: partitioned table
--
insert into direct_test_partition values (1,'2008-01-02',1,'usa');
INFO:  (slice 0) Dispatch command to SINGLE content
INFO:  Distributed transaction command 'Distributed Commit (one-phase)' to SINGLE content
select * from direct_test_partition where trans_id =1;
INFO:  (slice 1) Dispatch command to SINGLE content
 trans_id |    date    | amount | region 
----------+------------+--------+--------
        1 | 01-02-2008 |   1.00 | usa
(1 row)

----------------------------------------------------------------------------------
-- MPP-7638: range table partition
--
-- Known_opt_diff: MPP-21346
select count(*) from direct_test_range_partition where a =1;
INFO:  (slice 1) Dispatch command to SINGLE content
 count 
-------
     1
(1 row)

----------------------------------------------------------------------------------
-- Prepared statements
--  do same as above ones but using prepared statements, verify data goes to the right spot
prepare test_insert (int) as insert into direct_test values ($1,100);
execute test_insert(1);
INFO:  (slice 0) Dispatch command to SINGLE content
INFO:  Distributed transaction command 'Distributed Commit (one-phase)' to SINGLE content
execute test_insert(2);
INFO:  (slice 0) Dispatch command to SINGLE content
INFO:  Distributed transaction command 'Distributed Commit (one-phase)' to SINGLE content
select * from direct_test;
INFO:  (slice 1) Dispatch command to ALL contents: 0 1 2
 key | value 
-----+-------
     | cow
   1 | 100
   2 | 100
(3 rows)

prepare test_update (int) as update direct_test set value = 'boo' where key = $1;
-- Known_opt_diff: MPP-21346
execute test_update(2);
INFO:  (slice 0) Dispatch command to SINGLE content
INFO:  Distributed transaction command 'Distributed Commit (one-phase)' to SINGLE content
select * from direct_test;
INFO:  (slice 1) Dispatch command to ALL contents: 0 1 2
 key | value 
-----+-------
   1 | 100
   2 | boo
     | cow
(3 rows)

------------------------
-- A subquery
--
set test_print_direct_dispatch_info=off;
CREATE TEMP TABLE direct_dispatch_foo (id integer) DISTRIBUTED BY (id);
CREATE TEMP TABLE direct_dispatch_bar (id1 integer, id2 integer) DISTRIBUTED by (id1);
INSERT INTO direct_dispatch_foo VALUES (1);
INSERT INTO direct_dispatch_bar VALUES (1, 1);
INSERT INTO direct_dispatch_bar VALUES (2, 2);
INSERT INTO direct_dispatch_bar VALUES (3, 1);
set test_print_direct_dispatch_info=on;
-- Known_opt_diff: MPP-21346
SELECT * FROM direct_dispatch_foo WHERE id IN
    (SELECT id2 FROM (SELECT DISTINCT id1, id2 FROM direct_dispatch_bar WHERE direct_dispatch_bar.id1 = 1) AS s) ORDER BY 1;
INFO:  (slice 1) Dispatch command to ALL contents: 0 1 2
INFO:  (slice 2) Dispatch command to SINGLE content
 id 
----
  1
(1 row)

--
-- this one will NOT do direct dispatch because it is a many slice query and those are disabled right now
SELECT * FROM direct_dispatch_foo WHERE id IN
    (SELECT id2 FROM (SELECT id1, id2 FROM direct_dispatch_bar WHERE direct_dispatch_bar.id1 = 1 UNION
                      SELECT id1, id2 FROM direct_dispatch_bar WHERE direct_dispatch_bar.id1 = 2) AS s) ORDER BY 1;
INFO:  (slice 2) Dispatch command to ALL contents: 0 1 2
INFO:  (slice 1) Dispatch command to ALL contents: 0 1 2
INFO:  (slice 3) Dispatch command to PARTIAL contents: 1 0
 id 
----
  1
(1 row)

-- simple one using an expression on the variable
SELECT * from direct_dispatch_foo WHERE id * id = 1;
INFO:  (slice 1) Dispatch command to ALL contents: 0 1 2
 id 
----
  1
(1 row)

SELECT * from direct_dispatch_foo WHERE id * id = 1 OR id = 1;
INFO:  (slice 1) Dispatch command to ALL contents: 0 1 2
 id 
----
  1
(1 row)

SELECT * from direct_dispatch_foo where id * id = 1 AND id = 1;
INFO:  (slice 1) Dispatch command to SINGLE content
 id 
----
  1
(1 row)

-- main plan is direct dispatch and also has init plans
update direct_dispatch_bar set id2 = 1 where id1 = 1 and exists (select * from direct_dispatch_foo where id = 2);
INFO:  (slice 2) Dispatch command to SINGLE content
INFO:  (slice 0) Dispatch command to SINGLE content
INFO:  Distributed transaction command 'Distributed Commit (one-phase)' to PARTIAL contents: 0 1
-- init plan to see how transaction escalation happens
-- Known_opt_diff: MPP-21346
delete from direct_dispatch_foo where id = (select max(id2) from direct_dispatch_bar where id1 = 5);
INFO:  (slice 2) Dispatch command to SINGLE content
INFO:  (slice 0) Dispatch command to ALL contents: 0 1 2
INFO:  Distributed transaction command 'Distributed Commit (one-phase)' to ALL contents: 2 0 1
-- Known_opt_diff: MPP-21346
delete from direct_dispatch_foo where id * id = (select max(id2) from direct_dispatch_bar where id1 = 5) AND id = 3;
INFO:  (slice 2) Dispatch command to SINGLE content
INFO:  (slice 0) Dispatch command to SINGLE content
INFO:  Distributed transaction command 'Distributed Commit (one-phase)' to PARTIAL contents: 2 0
-- Known_opt_diff: MPP-21346
delete from direct_dispatch_foo where id * id = (select max(id2) from direct_dispatch_bar) AND id = 3;
INFO:  (slice 2) Dispatch command to ALL contents: 0 1 2
INFO:  (slice 0) Dispatch command to SINGLE content
INFO:  Distributed transaction command 'Distributed Commit (one-phase)' to ALL contents: 0 1 2
-- tests with subplans (MPP-22019)
CREATE TABLE MPP_22019_a ( i INT, j INT) DISTRIBUTED BY (i);
INFO:  Distributed transaction command 'Distributed Prepare' to ALL contents: 0 1 2
INFO:  Distributed transaction command 'Distributed Commit Prepared' to ALL contents: 0 1 2
INSERT INTO MPP_22019_a (
 SELECT i, i * i FROM generate_series(1, 10) AS i);
INFO:  (slice 0) Dispatch command to ALL contents: 0 1 2
INFO:  (slice 1) Dispatch command to SINGLE content
INFO:  Distributed transaction command 'Distributed Prepare' to ALL contents: 0 1 2
INFO:  Distributed transaction command 'Distributed Commit Prepared' to ALL contents: 0 1 2
CREATE TABLE MPP_22019_b (i INT, j INT) DISTRIBUTED BY (i);
INFO:  Distributed transaction command 'Distributed Prepare' to ALL contents: 0 1 2
INFO:  Distributed transaction command 'Distributed Commit Prepared' to ALL contents: 0 1 2
INSERT INTO MPP_22019_b (SELECT i, i * i FROM generate_series(1, 10) AS i);
INFO:  (slice 0) Dispatch command to ALL contents: 0 1 2
INFO:  (slice 1) Dispatch command to SINGLE content
INFO:  Distributed transaction command 'Distributed Prepare' to ALL contents: 0 1 2
INFO:  Distributed transaction command 'Distributed Commit Prepared' to ALL contents: 0 1 2
EXPLAIN SELECT a.* FROM MPP_22019_a a INNER JOIN MPP_22019_b b ON a.i = b.i WHERE a.j NOT IN (SELECT j FROM MPP_22019_a a2 where a2.j = b.j) and a.i = 1;
                                                   QUERY PLAN                                                   
----------------------------------------------------------------------------------------------------------------
 Gather Motion 1:1  (slice1; segments: 1)  (cost=10000000000.00..10000002519.51 rows=3707 width=8)
   ->  Nested Loop  (cost=10000000000.00..10000002445.38 rows=1236 width=8)
         Join Filter: (SubPlan 1)
         ->  Seq Scan on mpp_22019_a a  (cost=0.00..1176.25 rows=29 width=8)
               Filter: (i = 1)
         ->  Materialize  (cost=0.00..1176.68 rows=29 width=8)
               ->  Seq Scan on mpp_22019_b b  (cost=0.00..1176.25 rows=29 width=8)
                     Filter: (i = 1)
         SubPlan 1
           ->  Result  (cost=0.00..3974.50 rows=86100 width=4)
                 Filter: (a2.j = b.j)
                 ->  Materialize  (cost=0.00..3113.50 rows=86100 width=4)
                       ->  Broadcast Motion 3:1  (slice2; segments: 3)  (cost=0.00..2683.00 rows=28700 width=4)
                             ->  Seq Scan on mpp_22019_a a2  (cost=0.00..961.00 rows=28700 width=4)
 Optimizer: Postgres query optimizer
(15 rows)

SELECT a.* FROM MPP_22019_a a INNER JOIN MPP_22019_b b ON a.i = b.i WHERE a.j NOT IN (SELECT j FROM MPP_22019_a a2 where a2.j = b.j) and a.i = 1;
INFO:  (slice 2) Dispatch command to ALL contents: 0 1 2
INFO:  (slice 1) Dispatch command to SINGLE content
 i | j 
---+---
(0 rows)

SELECT a.* FROM MPP_22019_a a  WHERE a.j NOT IN (SELECT j FROM MPP_22019_a a2 where a2.j = a.j) and a.i = 1;
INFO:  (slice 2) Dispatch command to ALL contents: 0 1 2
INFO:  (slice 1) Dispatch command to SINGLE content
 i | j 
---+---
(0 rows)

--
-- Test direct dispatch with volatile functions, and nextval().
--
-- Simple table.
create table ddtesttab (i int, j int, k int8) distributed by (k);
INFO:  Distributed transaction command 'Distributed Prepare' to ALL contents: 0 1 2
INFO:  Distributed transaction command 'Distributed Commit Prepared' to ALL contents: 0 1 2
create sequence ddtestseq cache 1;
INFO:  Distributed transaction command 'Distributed Prepare' to ALL contents: 0 1 2
INFO:  Distributed transaction command 'Distributed Commit Prepared' to ALL contents: 0 1 2
insert into ddtesttab values (1, 1, 5);
INFO:  (slice 0) Dispatch command to SINGLE content
INFO:  Distributed transaction command 'Distributed Commit (one-phase)' to SINGLE content
insert into ddtesttab values (1, 1, 5 + random()); -- volatile expression as distribution key
INFO:  (slice 0) Dispatch command to ALL contents: 0 1 2
INFO:  Distributed transaction command 'Distributed Prepare' to ALL contents: 0 1 2
INFO:  Distributed transaction command 'Distributed Commit Prepared' to ALL contents: 0 1 2
insert into ddtesttab values (1, 1, nextval('ddtestseq'));
INFO:  (slice 0) Dispatch command to ALL contents: 0 1 2
INFO:  (slice 1) Dispatch command to SINGLE content
INFO:  Distributed transaction command 'Distributed Prepare' to ALL contents: 0 1 2
INFO:  Distributed transaction command 'Distributed Commit Prepared' to ALL contents: 0 1 2
insert into ddtesttab values (1, 1, 5 + nextval('ddtestseq'));
INFO:  (slice 0) Dispatch command to ALL contents: 0 1 2
INFO:  (slice 1) Dispatch command to SINGLE content
INFO:  Distributed transaction command 'Distributed Prepare' to ALL contents: 0 1 2
INFO:  Distributed transaction command 'Distributed Commit Prepared' to ALL contents: 0 1 2
drop table ddtesttab;
INFO:  Distributed transaction command 'Distributed Prepare' to ALL contents: 0 1 2
INFO:  Distributed transaction command 'Distributed Commit Prepared' to ALL contents: 0 1 2
-- Partitioned table, with mixed distribution keys.
create table ddtesttab (i int, j int, k int8) distributed by (i) partition by
range(k)
(start(1) end(20) every(10));
INFO:  Distributed transaction command 'Distributed Prepare' to ALL contents: 0 1 2
INFO:  Distributed transaction command 'Distributed Commit Prepared' to ALL contents: 0 1 2
insert into ddtesttab values (1, 1, 5);
INFO:  (slice 0) Dispatch command to SINGLE content
INFO:  Distributed transaction command 'Distributed Commit (one-phase)' to SINGLE content
insert into ddtesttab values (1, 1, 5 + random()); -- volatile expression as distribution key
INFO:  (slice 0) Dispatch command to SINGLE content
INFO:  Distributed transaction command 'Distributed Commit (one-phase)' to SINGLE content
insert into ddtesttab values (1, 1, nextval('ddtestseq'));
INFO:  (slice 0) Dispatch command to ALL contents: 0 1 2
INFO:  (slice 1) Dispatch command to SINGLE content
INFO:  Distributed transaction command 'Distributed Prepare' to ALL contents: 0 1 2
INFO:  Distributed transaction command 'Distributed Commit Prepared' to ALL contents: 0 1 2
insert into ddtesttab values (1, 1, 5 + nextval('ddtestseq'));
INFO:  (slice 0) Dispatch command to ALL contents: 0 1 2
INFO:  (slice 1) Dispatch command to SINGLE content
INFO:  Distributed transaction command 'Distributed Prepare' to ALL contents: 0 1 2
INFO:  Distributed transaction command 'Distributed Commit Prepared' to ALL contents: 0 1 2
-- One partition is randomly distributed, while others are distributed by key.
alter table ddtesttab_1_prt_2 set distributed randomly;
ERROR:  can't set the distribution policy of "ddtesttab_1_prt_2"
HINT:  Distribution policy can be set for an entire partitioned table, not for one of its leaf parts or an interior branch.
insert into ddtesttab values (1, 1, 5);
INFO:  (slice 0) Dispatch command to SINGLE content
INFO:  Distributed transaction command 'Distributed Commit (one-phase)' to SINGLE content
insert into ddtesttab values (1, 1, 5 + random()); -- volatile expression as distribution key
INFO:  (slice 0) Dispatch command to SINGLE content
INFO:  Distributed transaction command 'Distributed Commit (one-phase)' to SINGLE content
insert into ddtesttab values (1, 1, nextval('ddtestseq'));
INFO:  (slice 0) Dispatch command to ALL contents: 0 1 2
INFO:  (slice 1) Dispatch command to SINGLE content
INFO:  Distributed transaction command 'Distributed Prepare' to ALL contents: 0 1 2
INFO:  Distributed transaction command 'Distributed Commit Prepared' to ALL contents: 0 1 2
insert into ddtesttab values (1, 1, 5 + nextval('ddtestseq'));
INFO:  (slice 0) Dispatch command to ALL contents: 0 1 2
INFO:  (slice 1) Dispatch command to SINGLE content
INFO:  Distributed transaction command 'Distributed Prepare' to ALL contents: 0 1 2
INFO:  Distributed transaction command 'Distributed Commit Prepared' to ALL contents: 0 1 2
drop table ddtesttab;
INFO:  Distributed transaction command 'Distributed Prepare' to ALL contents: 0 1 2
INFO:  Distributed transaction command 'Distributed Commit Prepared' to ALL contents: 0 1 2
drop sequence ddtestseq;
INFO:  Distributed transaction command 'Distributed Prepare' to ALL contents: 0 1 2
INFO:  Distributed transaction command 'Distributed Commit Prepared' to ALL contents: 0 1 2
-- Test prepare statement will choose custom plan instead of generic plan when
-- considering no direct dispatch cost.
create table test_prepare(i int, j int);
NOTICE:  Table doesn't have 'DISTRIBUTED BY' clause -- Using column named 'i' as the Greenplum Database data distribution key for this table.
HINT:  The 'DISTRIBUTED BY' clause determines the distribution of data. Make sure column(s) chosen are the optimal data distribution key to minimize skew.
INFO:  Distributed transaction command 'Distributed Prepare' to ALL contents: 0 1 2
INFO:  Distributed transaction command 'Distributed Commit Prepared' to ALL contents: 0 1 2
-- insert case
prepare p1 as insert into test_prepare values($1, 1);
execute p1(1);
INFO:  (slice 0) Dispatch command to SINGLE content
INFO:  Distributed transaction command 'Distributed Commit (one-phase)' to SINGLE content
execute p1(1);
INFO:  (slice 0) Dispatch command to SINGLE content
INFO:  Distributed transaction command 'Distributed Commit (one-phase)' to SINGLE content
execute p1(1);
INFO:  (slice 0) Dispatch command to SINGLE content
INFO:  Distributed transaction command 'Distributed Commit (one-phase)' to SINGLE content
execute p1(1);
INFO:  (slice 0) Dispatch command to SINGLE content
INFO:  Distributed transaction command 'Distributed Commit (one-phase)' to SINGLE content
execute p1(1);
INFO:  (slice 0) Dispatch command to SINGLE content
INFO:  Distributed transaction command 'Distributed Commit (one-phase)' to SINGLE content
-- the first 5 execute will always use custom plan, focus on the 6th one.
execute p1(1);
INFO:  (slice 0) Dispatch command to SINGLE content
INFO:  Distributed transaction command 'Distributed Commit (one-phase)' to SINGLE content
-- update case
prepare p2 as update test_prepare set j =2 where i =$1;
execute p2(1);
INFO:  (slice 0) Dispatch command to SINGLE content
INFO:  Distributed transaction command 'Distributed Commit (one-phase)' to SINGLE content
execute p2(1);
INFO:  (slice 0) Dispatch command to SINGLE content
INFO:  Distributed transaction command 'Distributed Commit (one-phase)' to SINGLE content
execute p2(1);
INFO:  (slice 0) Dispatch command to SINGLE content
INFO:  Distributed transaction command 'Distributed Commit (one-phase)' to SINGLE content
execute p2(1);
INFO:  (slice 0) Dispatch command to SINGLE content
INFO:  Distributed transaction command 'Distributed Commit (one-phase)' to SINGLE content
execute p2(1);
INFO:  (slice 0) Dispatch command to SINGLE content
INFO:  Distributed transaction command 'Distributed Commit (one-phase)' to SINGLE content
execute p2(1);
INFO:  (slice 0) Dispatch command to SINGLE content
INFO:  Distributed transaction command 'Distributed Commit (one-phase)' to SINGLE content
-- select case
prepare p3 as select * from test_prepare where i =$1;
execute p3(1);
INFO:  (slice 1) Dispatch command to SINGLE content
 i | j 
---+---
 1 | 2
 1 | 2
 1 | 2
 1 | 2
 1 | 2
 1 | 2
(6 rows)

execute p3(1);
INFO:  (slice 1) Dispatch command to SINGLE content
 i | j 
---+---
 1 | 2
 1 | 2
 1 | 2
 1 | 2
 1 | 2
 1 | 2
(6 rows)

execute p3(1);
INFO:  (slice 1) Dispatch command to SINGLE content
 i | j 
---+---
 1 | 2
 1 | 2
 1 | 2
 1 | 2
 1 | 2
 1 | 2
(6 rows)

execute p3(1);
INFO:  (slice 1) Dispatch command to SINGLE content
 i | j 
---+---
 1 | 2
 1 | 2
 1 | 2
 1 | 2
 1 | 2
 1 | 2
(6 rows)

execute p3(1);
INFO:  (slice 1) Dispatch command to SINGLE content
 i | j 
---+---
 1 | 2
 1 | 2
 1 | 2
 1 | 2
 1 | 2
 1 | 2
(6 rows)

execute p3(1);
INFO:  (slice 1) Dispatch command to SINGLE content
 i | j 
---+---
 1 | 2
 1 | 2
 1 | 2
 1 | 2
 1 | 2
 1 | 2
(6 rows)

drop table test_prepare;
INFO:  Distributed transaction command 'Distributed Prepare' to ALL contents: 0 1 2
INFO:  Distributed transaction command 'Distributed Commit Prepared' to ALL contents: 0 1 2
-- test direct dispatch via gp_segment_id qual
create table t_test_dd_via_segid(id int);
NOTICE:  Table doesn't have 'DISTRIBUTED BY' clause -- Using column named 'id' as the Greenplum Database data distribution key for this table.
HINT:  The 'DISTRIBUTED BY' clause determines the distribution of data. Make sure column(s) chosen are the optimal data distribution key to minimize skew.
INFO:  Distributed transaction command 'Distributed Prepare' to ALL contents: 0 1 2
INFO:  Distributed transaction command 'Distributed Commit Prepared' to ALL contents: 0 1 2
insert into t_test_dd_via_segid select * from generate_series(1, 6);
INFO:  (slice 0) Dispatch command to ALL contents: 0 1 2
INFO:  (slice 1) Dispatch command to SINGLE content
INFO:  Distributed transaction command 'Distributed Prepare' to ALL contents: 0 1 2
INFO:  Distributed transaction command 'Distributed Commit Prepared' to ALL contents: 0 1 2
explain (costs off) select gp_segment_id, id from t_test_dd_via_segid where gp_segment_id=0;
                QUERY PLAN                
------------------------------------------
 Gather Motion 1:1  (slice1; segments: 1)
   ->  Seq Scan on t_test_dd_via_segid
         Filter: (gp_segment_id = 0)
 Optimizer: Postgres query optimizer
(4 rows)

select gp_segment_id, id from t_test_dd_via_segid where gp_segment_id=0;
INFO:  (slice 1) Dispatch command to SINGLE content
 gp_segment_id | id 
---------------+----
             0 |  2
             0 |  3
             0 |  4
(3 rows)

explain (costs off) select gp_segment_id, id from t_test_dd_via_segid where gp_segment_id=1;
                QUERY PLAN                
------------------------------------------
 Gather Motion 1:1  (slice1; segments: 1)
   ->  Seq Scan on t_test_dd_via_segid
         Filter: (gp_segment_id = 1)
 Optimizer: Postgres query optimizer
(4 rows)

select gp_segment_id, id from t_test_dd_via_segid where gp_segment_id=1;
INFO:  (slice 1) Dispatch command to SINGLE content
 gp_segment_id | id 
---------------+----
             1 |  1
(1 row)

explain (costs off) select gp_segment_id, id from t_test_dd_via_segid where gp_segment_id=2;
                QUERY PLAN                
------------------------------------------
 Gather Motion 1:1  (slice1; segments: 1)
   ->  Seq Scan on t_test_dd_via_segid
         Filter: (gp_segment_id = 2)
 Optimizer: Postgres query optimizer
(4 rows)

select gp_segment_id, id from t_test_dd_via_segid where gp_segment_id=2;
INFO:  (slice 1) Dispatch command to SINGLE content
 gp_segment_id | id 
---------------+----
             2 |  5
             2 |  6
(2 rows)

explain (costs off) select gp_segment_id, id from t_test_dd_via_segid where gp_segment_id=1 or gp_segment_id=2;
                          QUERY PLAN                          
--------------------------------------------------------------
 Gather Motion 2:1  (slice1; segments: 2)
   ->  Seq Scan on t_test_dd_via_segid
         Filter: ((gp_segment_id = 1) OR (gp_segment_id = 2))
 Optimizer: Postgres query optimizer
(4 rows)

select gp_segment_id, id from t_test_dd_via_segid where gp_segment_id=1 or gp_segment_id=2;
INFO:  (slice 1) Dispatch command to PARTIAL contents: 1 2
 gp_segment_id | id 
---------------+----
             1 |  1
             2 |  5
             2 |  6
(3 rows)

explain (costs off) select gp_segment_id, id from t_test_dd_via_segid where gp_segment_id=1 or gp_segment_id=2 or gp_segment_id=3;
                                     QUERY PLAN                                      
-------------------------------------------------------------------------------------
 Gather Motion 3:1  (slice1; segments: 3)
   ->  Seq Scan on t_test_dd_via_segid
         Filter: ((gp_segment_id = 1) OR (gp_segment_id = 2) OR (gp_segment_id = 3))
 Optimizer: Postgres query optimizer
(4 rows)

select gp_segment_id, id from t_test_dd_via_segid where gp_segment_id=1 or gp_segment_id=2 or gp_segment_id=3;
INFO:  (slice 1) Dispatch command to ALL contents: 0 1 2
 gp_segment_id | id 
---------------+----
             1 |  1
             2 |  5
             2 |  6
(3 rows)

explain (costs off) select t1.gp_segment_id, t2.gp_segment_id, * from t_test_dd_via_segid t1, t_test_dd_via_segid t2 where t1.gp_segment_id=t2.id;
                            QUERY PLAN                            
------------------------------------------------------------------
 Gather Motion 3:1  (slice1; segments: 3)
   ->  Hash Join
         Hash Cond: (t2.id = t1.gp_segment_id)
         ->  Seq Scan on t_test_dd_via_segid t2
         ->  Hash
               ->  Redistribute Motion 3:3  (slice2; segments: 3)
                     Hash Key: t1.gp_segment_id
                     ->  Seq Scan on t_test_dd_via_segid t1
 Optimizer: Postgres query optimizer
(9 rows)

select t1.gp_segment_id, t2.gp_segment_id, * from t_test_dd_via_segid t1, t_test_dd_via_segid t2 where t1.gp_segment_id=t2.id;
INFO:  (slice 2) Dispatch command to ALL contents: 0 1 2
INFO:  (slice 1) Dispatch command to ALL contents: 0 1 2
 gp_segment_id | gp_segment_id | id | id 
---------------+---------------+----+----
             1 |             1 |  1 |  1
             2 |             0 |  5 |  2
             2 |             0 |  6 |  2
(3 rows)

explain (costs off) select gp_segment_id, count(*) from t_test_dd_via_segid group by gp_segment_id;
                         QUERY PLAN                         
------------------------------------------------------------
 Gather Motion 3:1  (slice1; segments: 3)
   ->  Finalize HashAggregate
         Group Key: gp_segment_id
         ->  Redistribute Motion 3:3  (slice2; segments: 3)
               Hash Key: gp_segment_id
               ->  Partial HashAggregate
                     Group Key: gp_segment_id
                     ->  Seq Scan on t_test_dd_via_segid
 Optimizer: Postgres query optimizer
(10 rows)

select gp_segment_id, count(*) from t_test_dd_via_segid group by gp_segment_id;
INFO:  (slice 2) Dispatch command to ALL contents: 0 1 2
INFO:  (slice 1) Dispatch command to ALL contents: 0 1 2
 gp_segment_id | count 
---------------+-------
             0 |     3
             1 |     1
             2 |     2
(3 rows)

-- test direct dispatch via SQLValueFunction and FuncExpr for single row insertion.
create table t_sql_value_function1 (a int, b date);
NOTICE:  Table doesn't have 'DISTRIBUTED BY' clause -- Using column named 'a' as the Greenplum Database data distribution key for this table.
HINT:  The 'DISTRIBUTED BY' clause determines the distribution of data. Make sure column(s) chosen are the optimal data distribution key to minimize skew.
INFO:  Distributed transaction command 'Distributed Prepare' to ALL contents: 0 1 2
INFO:  Distributed transaction command 'Distributed Commit Prepared' to ALL contents: 0 1 2
create table t_sql_value_function2 (a date);
NOTICE:  Table doesn't have 'DISTRIBUTED BY' clause -- Using column named 'a' as the Greenplum Database data distribution key for this table.
HINT:  The 'DISTRIBUTED BY' clause determines the distribution of data. Make sure column(s) chosen are the optimal data distribution key to minimize skew.
INFO:  Distributed transaction command 'Distributed Prepare' to ALL contents: 0 1 2
INFO:  Distributed transaction command 'Distributed Commit Prepared' to ALL contents: 0 1 2
explain (costs off) insert into t_sql_value_function1 values(1, current_timestamp);
             QUERY PLAN              
-------------------------------------
 Insert on t_sql_value_function1
   ->  Result
 Optimizer: Postgres query optimizer
(3 rows)

insert into t_sql_value_function1 values(1, current_timestamp);
INFO:  (slice 0) Dispatch command to SINGLE content
INFO:  Distributed transaction command 'Distributed Commit (one-phase)' to SINGLE content
explain (costs off) insert into t_sql_value_function2 values(current_timestamp);
             QUERY PLAN              
-------------------------------------
 Insert on t_sql_value_function2
   ->  Result
 Optimizer: Postgres query optimizer
(3 rows)

insert into t_sql_value_function2 values(current_timestamp);
INFO:  (slice 0) Dispatch command to SINGLE content
INFO:  Distributed transaction command 'Distributed Commit (one-phase)' to SINGLE content
explain (costs off) insert into t_sql_value_function1 values(2, now());
             QUERY PLAN              
-------------------------------------
 Insert on t_sql_value_function1
   ->  Result
 Optimizer: Postgres query optimizer
(3 rows)

insert into t_sql_value_function1 values(2, now());
INFO:  (slice 0) Dispatch command to SINGLE content
INFO:  Distributed transaction command 'Distributed Commit (one-phase)' to SINGLE content
explain (costs off) insert into t_sql_value_function2 values(now());
             QUERY PLAN              
-------------------------------------
 Insert on t_sql_value_function2
   ->  Result
 Optimizer: Postgres query optimizer
(3 rows)

insert into t_sql_value_function2 values(now());
INFO:  (slice 0) Dispatch command to SINGLE content
INFO:  Distributed transaction command 'Distributed Commit (one-phase)' to SINGLE content
-- Convert policy of root to random when one of its children has a different distribution policy.
-- The only allowed difference between parent and children is for the parent to be hash distributed,
-- and its child part to be randomly distributed.
create table t_hash_partition
(
    r_regionkey integer not null,
    r_name char(25)
)
partition by range (r_regionkey)
(
    partition region1 start (0),
    partition region2 start (3),
    partition region3 start (5) end (8)
);
NOTICE:  Table doesn't have 'DISTRIBUTED BY' clause -- Using column named 'r_regionkey' as the Greenplum Database data distribution key for this table.
HINT:  The 'DISTRIBUTED BY' clause determines the distribution of data. Make sure column(s) chosen are the optimal data distribution key to minimize skew.
INFO:  Distributed transaction command 'Distributed Prepare' to ALL contents: 0 1 2
INFO:  Distributed transaction command 'Distributed Commit Prepared' to ALL contents: 0 1 2
set allow_system_table_mods=true;
-- select: root & leaf are all the same hash dist, will direct dispatch
begin;
select * from t_hash_partition where r_regionkey=1;
INFO:  (slice 1) Dispatch command to SINGLE content
 r_regionkey | r_name 
-------------+--------
(0 rows)

select * from t_hash_partition_1_prt_region1 where r_regionkey=1;
INFO:  (slice 1) Dispatch command to SINGLE content
 r_regionkey | r_name 
-------------+--------
(0 rows)

abort;
INFO:  Distributed transaction command 'Distributed Abort (No Prepared)' to SINGLE content
-- delete: root & leaf are all the same hash dist, will direct dispatch
begin;
-- orca does not handle direct dispatch for DELETE or UPDATE now
-- also orca does not handle DELETE/UPDATE for partitioned tables now.
explain (costs off) delete from t_hash_partition where r_regionkey=1;
                    QUERY PLAN                    
--------------------------------------------------
 Delete on t_hash_partition
   Delete on t_hash_partition_1_prt_region1
   ->  Seq Scan on t_hash_partition_1_prt_region1
         Filter: (r_regionkey = 1)
 Optimizer: Postgres query optimizer
(5 rows)

delete from t_hash_partition where r_regionkey=1;
INFO:  (slice 0) Dispatch command to SINGLE content
abort;
INFO:  Distributed transaction command 'Distributed Abort (No Prepared)' to SINGLE content
begin;
-- orca does not handle direct dispatch for DELETE or UPDATE now
delete from t_hash_partition_1_prt_region1 where r_regionkey=1;
INFO:  (slice 0) Dispatch command to SINGLE content
abort;
INFO:  Distributed transaction command 'Distributed Abort (No Prepared)' to SINGLE content
-- update: root & leaf are all the same hash dist, will direct dispatch
begin;
-- orca does not handle direct dispatch for DELETE or UPDATE now
-- also orca does not handle DELETE/UPDATE for partitioned tables now.
explain (costs off) update t_hash_partition set r_name = 'CHINA' where r_regionkey=1;
                    QUERY PLAN                    
--------------------------------------------------
 Update on t_hash_partition
   Update on t_hash_partition_1_prt_region1
   ->  Seq Scan on t_hash_partition_1_prt_region1
         Filter: (r_regionkey = 1)
 Optimizer: Postgres query optimizer
(5 rows)

update t_hash_partition set r_name = 'CHINA' where r_regionkey=1;
INFO:  (slice 0) Dispatch command to SINGLE content
abort;
INFO:  Distributed transaction command 'Distributed Abort (No Prepared)' to SINGLE content
begin;
-- orca does not handle direct dispatch for DELETE or UPDATE now
update t_hash_partition_1_prt_region1 set r_name = 'CHINA' where r_regionkey=1;
INFO:  (slice 0) Dispatch command to SINGLE content
abort;
INFO:  Distributed transaction command 'Distributed Abort (No Prepared)' to SINGLE content
-- insert
begin;
-- only consider target's policy, will direct dispatch
insert into t_hash_partition values(1,'CHINA');
INFO:  (slice 0) Dispatch command to SINGLE content
-- leaf is also hash dist, will direct dispatch
insert into t_hash_partition_1_prt_region1 values(1,'CHINA');
INFO:  (slice 0) Dispatch command to SINGLE content
abort;
INFO:  Distributed transaction command 'Distributed Abort (No Prepared)' to SINGLE content
-- can not alter distributed of child partition, we change one child policy to random
update gp_distribution_policy set distkey='',distclass='' where localoid::regclass::text = 't_hash_partition_1_prt_region1';
-- select
begin;
-- root & leaf policy mismatch, will not direct dispatch
select * from t_hash_partition where r_regionkey=1;
INFO:  (slice 1) Dispatch command to ALL contents: 0 1 2
 r_regionkey | r_name 
-------------+--------
(0 rows)

-- the leaf is randomly dist now, will not direct dispatch
select * from t_hash_partition_1_prt_region1 where r_regionkey=1;
INFO:  (slice 1) Dispatch command to ALL contents: 0 1 2
 r_regionkey | r_name 
-------------+--------
(0 rows)

abort;
INFO:  Distributed transaction command 'Distributed Abort (No Prepared)' to ALL contents: 0 1 2
-- delete
begin;
-- root & leaf policy mismatch, will not direct dispatch
delete from t_hash_partition where r_regionkey=1;
INFO:  (slice 0) Dispatch command to ALL contents: 0 1 2
abort;
INFO:  Distributed transaction command 'Distributed Abort (No Prepared)' to ALL contents: 0 1 2
begin;
-- this leaf is randomly dist, will not direct dispatch
delete from t_hash_partition_1_prt_region1 where r_regionkey=1;
INFO:  (slice 0) Dispatch command to ALL contents: 0 1 2
abort;
INFO:  Distributed transaction command 'Distributed Abort (No Prepared)' to ALL contents: 0 1 2
-- update
begin;
-- root & leaf policy mismatch, will not direct dispatch
update t_hash_partition set r_name = 'CHINA' where r_regionkey=1;
INFO:  (slice 0) Dispatch command to ALL contents: 0 1 2
abort;
INFO:  Distributed transaction command 'Distributed Abort (No Prepared)' to ALL contents: 0 1 2
begin;
-- this leaf is randomly dist, will not direct dispatch
update t_hash_partition_1_prt_region1 set r_name = 'CHINA' where r_regionkey=1;
INFO:  (slice 0) Dispatch command to ALL contents: 0 1 2
abort;
INFO:  Distributed transaction command 'Distributed Abort (No Prepared)' to ALL contents: 0 1 2
-- insert
begin;
-- only consider target's policy, will direct dispatch
insert into t_hash_partition values(1,'CHINA');
INFO:  (slice 0) Dispatch command to SINGLE content
abort;
INFO:  Distributed transaction command 'Distributed Abort (No Prepared)' to SINGLE content
begin;
-- this leaf is randomly dist, will not direct dispatch
insert into t_hash_partition_1_prt_region1 values(1,'CHINA');
INFO:  (slice 0) Dispatch command to ALL contents: 0 1 2
INFO:  (slice 1) Dispatch command to SINGLE content
abort;
INFO:  Distributed transaction command 'Distributed Abort (No Prepared)' to ALL contents: 0 1 2
-- cleanup
set test_print_direct_dispatch_info=off;
set allow_system_table_mods=off;
begin;
drop table if exists direct_test;
drop table if exists direct_test_two_column;
drop table if exists direct_test_bitmap;
drop table if exists direct_test_partition;
drop table if exists direct_test_range_partition;
drop table if exists direct_dispatch_foo;
drop table if exists direct_dispatch_bar;
drop table if exists MPP_22019_a;
drop table if exists MPP_22019_b;
drop table if exists t_sql_value_function1;
drop table if exists t_sql_value_function2;
drop table if exists t_hash_partition;
commit;
