--
-- FLOAT8
--
CREATE TABLE FLOAT8_TBL(i INT DEFAULT 1, f1 float8);
INSERT INTO FLOAT8_TBL(f1) VALUES ('    0.0   ');
INSERT INTO FLOAT8_TBL(f1) VALUES ('1004.30  ');
INSERT INTO FLOAT8_TBL(f1) VALUES ('   -34.84');
INSERT INTO FLOAT8_TBL(f1) VALUES ('1.2345678901234e+200');
INSERT INTO FLOAT8_TBL(f1) VALUES ('1.2345678901234e-200');
-- test for underflow and overflow handling
SELECT '10e400'::float8;
ERROR:  value out of range: overflow
LINE 1: SELECT '10e400'::float8;
               ^
SELECT '-10e400'::float8;
ERROR:  value out of range: overflow
LINE 1: SELECT '-10e400'::float8;
               ^
SELECT '1e309'::float8;
ERROR:  value out of range: overflow
LINE 1: SELECT '1e309'::float8;
               ^
SELECT '10e-400'::float8;
ERROR:  value out of range: underflow
LINE 1: SELECT '10e-400'::float8;
               ^
SELECT '-10e-400'::float8;
ERROR:  value out of range: underflow
LINE 1: SELECT '-10e-400'::float8;
               ^
SELECT '1e-324'::float8;
ERROR:  value out of range: underflow
LINE 1: SELECT '1e-324'::float8;
               ^
SELECT '1e308'::float8;
 float8 
--------
 1e+308
(1 row)

SELECT '1e-323'::float8;
        float8         
-----------------------
 9.88131291682493e-324
(1 row)

SELECT '0.0'::float8;
 float8 
--------
      0
(1 row)

-- bad input
INSERT INTO FLOAT8_TBL(f1) VALUES ('');
ERROR:  invalid input syntax for type double precision: ""
LINE 1: INSERT INTO FLOAT8_TBL(f1) VALUES ('');
                                           ^
INSERT INTO FLOAT8_TBL(f1) VALUES ('     ');
ERROR:  invalid input syntax for type double precision: "     "
LINE 1: INSERT INTO FLOAT8_TBL(f1) VALUES ('     ');
                                           ^
INSERT INTO FLOAT8_TBL(f1) VALUES ('xyz');
ERROR:  invalid input syntax for type double precision: "xyz"
LINE 1: INSERT INTO FLOAT8_TBL(f1) VALUES ('xyz');
                                           ^
INSERT INTO FLOAT8_TBL(f1) VALUES ('5.0.0');
ERROR:  invalid input syntax for type double precision: "5.0.0"
LINE 1: INSERT INTO FLOAT8_TBL(f1) VALUES ('5.0.0');
                                           ^
INSERT INTO FLOAT8_TBL(f1) VALUES ('5 . 0');
ERROR:  invalid input syntax for type double precision: "5 . 0"
LINE 1: INSERT INTO FLOAT8_TBL(f1) VALUES ('5 . 0');
                                           ^
INSERT INTO FLOAT8_TBL(f1) VALUES ('5.   0');
ERROR:  invalid input syntax for type double precision: "5.   0"
LINE 1: INSERT INTO FLOAT8_TBL(f1) VALUES ('5.   0');
                                           ^
INSERT INTO FLOAT8_TBL(f1) VALUES ('    - 3');
ERROR:  invalid input syntax for type double precision: "    - 3"
LINE 1: INSERT INTO FLOAT8_TBL(f1) VALUES ('    - 3');
                                           ^
INSERT INTO FLOAT8_TBL(f1) VALUES ('123           5');
ERROR:  invalid input syntax for type double precision: "123           5"
LINE 1: INSERT INTO FLOAT8_TBL(f1) VALUES ('123           5');
                                           ^
-- special inputs
SELECT 'NaN'::float8;
 float8 
--------
    NaN
(1 row)

SELECT 'nan'::float8;
 float8 
--------
    NaN
(1 row)

SELECT '   NAN  '::float8;
 float8 
--------
    NaN
(1 row)

SELECT 'infinity'::float8;
  float8  
----------
 Infinity
(1 row)

SELECT 'inf'::float8;
  float8  
----------
 Infinity
(1 row)

SELECT '          -INFINiTY   '::float8;
  float8   
-----------
 -Infinity
(1 row)

SELECT '+Infinity'::float8;
  float8  
----------
   Infinity
(1 row)

SELECT '+INF'::float8;
  float8  
----------
   Infinity
(1 row)

SELECT '+inf'::float8;
  float8  
----------
   Infinity
(1 row)

SELECT '+INFINITY'::float8;
  float8  
----------
   Infinity
(1 row)

-- bad special inputs
SELECT 'N A N'::float8;
ERROR:  invalid input syntax for type double precision: "N A N"
LINE 1: SELECT 'N A N'::float8;
               ^
SELECT 'NaN x'::float8;
ERROR:  invalid input syntax for type double precision: "NaN x"
LINE 1: SELECT 'NaN x'::float8;
               ^
SELECT ' INFINITY    x'::float8;
ERROR:  invalid input syntax for type double precision: " INFINITY    x"
LINE 1: SELECT ' INFINITY    x'::float8;
               ^
SELECT 'Infinity'::float8 + 100.0;
 ?column? 
----------
 Infinity
(1 row)

SELECT 'Infinity'::float8 / 'Infinity'::float8;
 ?column? 
----------
      NaN
(1 row)

SELECT 'nan'::float8 / 'nan'::float8;
 ?column? 
----------
      NaN
(1 row)

SELECT '' AS five, f1 FROM FLOAT8_TBL ORDER BY 2;
 five |          f1          
------+----------------------
      |               -34.84
      |                    0
      | 1.2345678901234e-200
      |               1004.3
      | 1.2345678901234e+200
(5 rows)

SELECT '' AS four, f.f1 FROM FLOAT8_TBL f WHERE f.f1 <> '1004.3' ORDER BY 2;
 four |          f1          
------+----------------------
      |               -34.84
      |                    0
      | 1.2345678901234e-200
      | 1.2345678901234e+200
(4 rows)

SELECT '' AS one, f.f1 FROM FLOAT8_TBL f WHERE f.f1 = '1004.3' ORDER BY 2;
 one |   f1   
-----+--------
     | 1004.3
(1 row)

SELECT '' AS three, f.f1 FROM FLOAT8_TBL f WHERE '1004.3' > f.f1 ORDER BY 2;
 three |          f1          
-------+----------------------
       |               -34.84
       |                    0
       | 1.2345678901234e-200
(3 rows)

SELECT '' AS three, f.f1 FROM FLOAT8_TBL f WHERE  f.f1 < '1004.3' ORDER BY 2;
 three |          f1          
-------+----------------------
       |               -34.84
       |                    0
       | 1.2345678901234e-200
(3 rows)

SELECT '' AS four, f.f1 FROM FLOAT8_TBL f WHERE '1004.3' >= f.f1 ORDER BY 2;
 four |          f1          
------+----------------------
      |               -34.84
      |                    0
      | 1.2345678901234e-200
      |               1004.3
(4 rows)

SELECT '' AS four, f.f1 FROM FLOAT8_TBL f WHERE  f.f1 <= '1004.3' ORDER BY 2;
 four |          f1          
------+----------------------
      |               -34.84
      |                    0
      | 1.2345678901234e-200
      |               1004.3
(4 rows)

SELECT '' AS three, f.f1, f.f1 * '-10' AS x 
   FROM FLOAT8_TBL f
   WHERE f.f1 > '0.0' ORDER BY 2;
 three |          f1          |           x           
-------+----------------------+-----------------------
       | 1.2345678901234e-200 | -1.2345678901234e-199
       |               1004.3 |                -10043
       | 1.2345678901234e+200 | -1.2345678901234e+201
(3 rows)

SELECT '' AS three, f.f1, f.f1 + '-10' AS x
   FROM FLOAT8_TBL f
   WHERE f.f1 > '0.0' ORDER BY 2;
 three |          f1          |          x           
-------+----------------------+----------------------
       | 1.2345678901234e-200 |                  -10
       |               1004.3 |                994.3
       | 1.2345678901234e+200 | 1.2345678901234e+200
(3 rows)

SELECT '' AS three, f.f1, f.f1 / '-10' AS x
   FROM FLOAT8_TBL f
   WHERE f.f1 > '0.0' ORDER BY 2;
 three |          f1          |           x           
-------+----------------------+-----------------------
       | 1.2345678901234e-200 | -1.2345678901234e-201
       |               1004.3 |               -100.43
       | 1.2345678901234e+200 | -1.2345678901234e+199
(3 rows)

SELECT '' AS three, f.f1, f.f1 - '-10' AS x
   FROM FLOAT8_TBL f
   WHERE f.f1 > '0.0' ORDER BY 2;
 three |          f1          |          x           
-------+----------------------+----------------------
       | 1.2345678901234e-200 |                   10
       |               1004.3 |               1014.3
       | 1.2345678901234e+200 | 1.2345678901234e+200
(3 rows)

SELECT '' AS one, f.f1 ^ '2.0' AS square_f1
   FROM FLOAT8_TBL f where f.f1 = '1004.3';
 one | square_f1  
-----+------------
     | 1008618.49
(1 row)

-- absolute value 
SELECT '' AS five, f.f1, @f.f1 AS abs_f1 
   FROM FLOAT8_TBL f ORDER BY 2;
 five |          f1          |        abs_f1        
------+----------------------+----------------------
      |               -34.84 |                34.84
      |                    0 |                    0
      | 1.2345678901234e-200 | 1.2345678901234e-200
      |               1004.3 |               1004.3
      | 1.2345678901234e+200 | 1.2345678901234e+200
(5 rows)

-- truncate 
SELECT '' AS five, f.f1, trunc(f.f1) AS trunc_f1
   FROM FLOAT8_TBL f ORDER BY 2;
 five |          f1          |       trunc_f1       
------+----------------------+----------------------
      |               -34.84 |                  -34
      |                    0 |                    0
      | 1.2345678901234e-200 |                    0
      |               1004.3 |                 1004
      | 1.2345678901234e+200 | 1.2345678901234e+200
(5 rows)

-- round 
SELECT '' AS five, f.f1, round(f.f1) AS round_f1
   FROM FLOAT8_TBL f ORDER BY 2;
 five |          f1          |       round_f1       
------+----------------------+----------------------
      |               -34.84 |                  -35
      |                    0 |                    0
      | 1.2345678901234e-200 |                    0
      |               1004.3 |                 1004
      | 1.2345678901234e+200 | 1.2345678901234e+200
(5 rows)

-- ceil / ceiling
select ceil(f1) as ceil_f1 from float8_tbl f ORDER BY 1;
       ceil_f1        
----------------------
                  -34
                    0
                    1
                 1005
 1.2345678901234e+200
(5 rows)

select ceiling(f1) as ceiling_f1 from float8_tbl f ORDER BY 1;
      ceiling_f1      
----------------------
                  -34
                    0
                    1
                 1005
 1.2345678901234e+200
(5 rows)

-- floor
select floor(f1) as floor_f1 from float8_tbl f ORDER BY 1;
       floor_f1       
----------------------
                  -35
                    0
                    0
                 1004
 1.2345678901234e+200
(5 rows)

-- sign
select sign(f1) as sign_f1 from float8_tbl f ORDER BY 1;
 sign_f1 
---------
      -1
       0
       1
       1
       1
(5 rows)

-- square root 
SELECT sqrt(float8 '64') AS eight;
 eight 
-------
     8
(1 row)

SELECT |/ float8 '64' AS eight;
 eight 
-------
     8
(1 row)

SELECT '' AS three, f.f1, |/f.f1 AS sqrt_f1
   FROM FLOAT8_TBL f
   WHERE f.f1 > '0.0' ORDER BY 2;
 three |          f1          |        sqrt_f1        
-------+----------------------+-----------------------
       | 1.2345678901234e-200 | 1.11111110611109e-100
       |               1004.3 |      31.6906926399535
       | 1.2345678901234e+200 | 1.11111110611109e+100
(3 rows)

-- power
SELECT power(float8 '144', float8 '0.5');
 power 
-------
    12
(1 row)

-- take exp of ln(f.f1) 
SELECT '' AS three, f.f1, exp(ln(f.f1)) AS exp_ln_f1
   FROM FLOAT8_TBL f
   WHERE f.f1 > '0.0' ORDER BY 2;
 three |          f1          |       exp_ln_f1       
-------+----------------------+-----------------------
       | 1.2345678901234e-200 | 1.23456789012339e-200
       |               1004.3 |                1004.3
       | 1.2345678901234e+200 | 1.23456789012338e+200
(3 rows)

-- cube root 
SELECT ||/ float8 '27' AS three;
 three 
-------
     3
(1 row)

SELECT '' AS five, f.f1, ||/f.f1 AS cbrt_f1 FROM FLOAT8_TBL f ORDER BY 2;
 five |          f1          |       cbrt_f1        
------+----------------------+----------------------
      |               -34.84 |    -3.26607421344208
      |                    0 |                    0
      | 1.2345678901234e-200 |  2.3112042409018e-67
      |               1004.3 |      10.014312837827
      | 1.2345678901234e+200 | 4.97933859234765e+66
(5 rows)

SELECT '' AS five, f1 FROM FLOAT8_TBL ORDER BY 2;
 five |          f1          
------+----------------------
      |               -34.84
      |                    0
      | 1.2345678901234e-200
      |               1004.3
      | 1.2345678901234e+200
(5 rows)

UPDATE FLOAT8_TBL
   SET f1 = FLOAT8_TBL.f1 * '-1'
   WHERE FLOAT8_TBL.f1 > '0.0';
SELECT '' AS bad, f.f1 * '1e200' from FLOAT8_TBL f;
ERROR:  value out of range: overflow
SELECT '' AS bad, f.f1 ^ '1e200' from FLOAT8_TBL f;
ERROR:  value out of range: overflow
SELECT 0 ^ 0 + 0 ^ 1 + 0 ^ 0.0 + 0 ^ 0.5;
 ?column? 
----------
        2
(1 row)

SELECT '' AS bad, ln(f.f1) from FLOAT8_TBL f where f.f1 = '0.0' ;
ERROR:  cannot take logarithm of zero  (seg0 slice1 localhost:50001 pid=1946)
SELECT '' AS bad, ln(f.f1) from FLOAT8_TBL f where f.f1 < '0.0' ;
ERROR:  cannot take logarithm of a negative number  (seg0 slice1 localhost:50001 pid=1946)
SELECT '' AS bad, exp(f.f1) from FLOAT8_TBL f;
ERROR:  value out of range: underflow
SELECT '' AS bad, f.f1 / '0.0' from FLOAT8_TBL f;
ERROR:  division by zero  (seg0 slice1 localhost:50001 pid=1946)
SELECT '' AS five, f1 FROM FLOAT8_TBL ORDER BY 2;
 five |          f1           
------+-----------------------
      | -1.2345678901234e+200
      |               -1004.3
      |                -34.84
      | -1.2345678901234e-200
      |                     0
(5 rows)

-- test for over- and underflow 
INSERT INTO FLOAT8_TBL(f1) VALUES ('10e400');
ERROR:  value out of range: overflow
LINE 1: INSERT INTO FLOAT8_TBL(f1) VALUES ('10e400');
                                           ^
INSERT INTO FLOAT8_TBL(f1) VALUES ('-10e400');
ERROR:  value out of range: overflow
LINE 1: INSERT INTO FLOAT8_TBL(f1) VALUES ('-10e400');
                                           ^
INSERT INTO FLOAT8_TBL(f1) VALUES ('1e309');
ERROR:  value out of range: overflow
LINE 1: INSERT INTO FLOAT8_TBL(f1) VALUES ('1e309');
                                           ^
INSERT INTO FLOAT8_TBL(f1) VALUES ('10e-400');
ERROR:  value out of range: underflow
LINE 1: INSERT INTO FLOAT8_TBL(f1) VALUES ('10e-400');
                                           ^
INSERT INTO FLOAT8_TBL(f1) VALUES ('-10e-400');
ERROR:  value out of range: underflow
LINE 1: INSERT INTO FLOAT8_TBL(f1) VALUES ('-10e-400');
                                           ^
INSERT INTO FLOAT8_TBL(f1) VALUES ('1e-324');
ERROR:  value out of range: underflow
LINE 1: INSERT INTO FLOAT8_TBL(f1) VALUES ('1e-324');
                                           ^
INSERT INTO FLOAT8_TBL(f1) VALUES ('1e308');
INSERT INTO FLOAT8_TBL(f1) VALUES ('1e-323');
INSERT INTO FLOAT8_TBL(f1) VALUES ('+INFINITY'::float8);
INSERT INTO FLOAT8_TBL(f1) VALUES ('+InFiNiTY'::float8);
INSERT INTO FLOAT8_TBL(f1) VALUES ('+Inf'::float8);
INSERT INTO FLOAT8_TBL(f1) VALUES ('-INFINITY'::float8);
INSERT INTO FLOAT8_TBL(f1) VALUES ('-InFiNiTY'::float8);
INSERT INTO FLOAT8_TBL(f1) VALUES ('-Inf'::float8);
INSERT INTO FLOAT8_TBL(f1) VALUES ('NaN'::float8);
INSERT INTO FLOAT8_TBL(f1) VALUES ('+naN'::float8);
INSERT INTO FLOAT8_TBL(f1) VALUES ('-naN'::float8);
-- test for over- and underflow with update statement
UPDATE FLOAT8_TBL SET f1='0.0'::float8 WHERE f1='1e-324'::float8;
ERROR:  value out of range: underflow
LINE 1: UPDATE FLOAT8_TBL SET f1='0.0'::float8 WHERE f1='1e-324'::fl...
                                                        ^
UPDATE FLOAT8_TBL SET f1='0.0'::float8 WHERE f1='1e309'::float8;
ERROR:  value out of range: overflow
LINE 1: UPDATE FLOAT8_TBL SET f1='0.0'::float8 WHERE f1='1e309'::flo...
                                                        ^
UPDATE FLOAT8_TBL SET f1='0.0'::float8 WHERE f1='1e-400'::float8;
ERROR:  value out of range: underflow
LINE 1: UPDATE FLOAT8_TBL SET f1='0.0'::float8 WHERE f1='1e-400'::fl...
                                                        ^
UPDATE FLOAT8_TBL SET f1='0.0'::float8 WHERE f1='1e400'::float8;
ERROR:  value out of range: overflow
LINE 1: UPDATE FLOAT8_TBL SET f1='0.0'::float8 WHERE f1='1e400'::flo...
                                                        ^
UPDATE FLOAT8_TBL SET f1='0.0'::float8 WHERE f1='0.0'::float8;
UPDATE FLOAT8_TBL SET f1='0.0'::float8 WHERE f1='+INFINITY'::float8;
UPDATE FLOAT8_TBL SET f1='0.0'::float8 WHERE f1='+InFiNiTY'::float8;
UPDATE FLOAT8_TBL SET f1='0.0'::float8 WHERE f1='+Inf'::float8;
UPDATE FLOAT8_TBL SET f1='0.0'::float8 WHERE f1='-INFINITY'::float8;
UPDATE FLOAT8_TBL SET f1='0.0'::float8 WHERE f1='-Inf'::float8;
UPDATE FLOAT8_TBL SET f1='0.0'::float8 WHERE f1='NaN'::float8;
UPDATE FLOAT8_TBL SET f1='0.0'::float8 WHERE f1='+naN'::float8;
UPDATE FLOAT8_TBL SET f1='0.0'::float8 WHERE f1='-naN'::float8;
-- test for over- and underflow with delete statement
DELETE FROM FLOAT8_TBL WHERE f1='1e-324'::float8;
ERROR:  value out of range: underflow
LINE 1: DELETE FROM FLOAT8_TBL WHERE f1='1e-324'::float8;
                                        ^
DELETE FROM FLOAT8_TBL WHERE f1='1e309'::float8;
ERROR:  value out of range: overflow
LINE 1: DELETE FROM FLOAT8_TBL WHERE f1='1e309'::float8;
                                        ^
DELETE FROM FLOAT8_TBL WHERE f1='1e400'::float8;
ERROR:  value out of range: overflow
LINE 1: DELETE FROM FLOAT8_TBL WHERE f1='1e400'::float8;
                                        ^
DELETE FROM FLOAT8_TBL WHERE f1='1e-400'::float8;
ERROR:  value out of range: underflow
LINE 1: DELETE FROM FLOAT8_TBL WHERE f1='1e-400'::float8;
                                        ^
DELETE FROM FLOAT8_TBL WHERE f1='0.0'::float8;
DELETE FROM FLOAT8_TBL WHERE f1='+INFINITY'::float8;
DELETE FROM FLOAT8_TBL WHERE f1='+InFiNiTY'::float8;
DELETE FROM FLOAT8_TBL WHERE f1='+Inf'::float8;
DELETE FROM FLOAT8_TBL WHERE f1='-INFINITY'::float8;
DELETE FROM FLOAT8_TBL WHERE f1='-Inf'::float8;
DELETE FROM FLOAT8_TBL WHERE f1='-naN'::float8;
DELETE FROM FLOAT8_TBL WHERE f1='+naN'::float8;
DELETE FROM FLOAT8_TBL WHERE f1='NaN'::float8;
-- maintain external table consistency across platforms
-- delete all values and reinsert well-behaved ones
DELETE FROM FLOAT8_TBL;
INSERT INTO FLOAT8_TBL(f1) VALUES ('0.0');
INSERT INTO FLOAT8_TBL(f1) VALUES ('-34.84');
INSERT INTO FLOAT8_TBL(f1) VALUES ('-1004.30');
INSERT INTO FLOAT8_TBL(f1) VALUES ('-1.2345678901234e+200');
INSERT INTO FLOAT8_TBL(f1) VALUES ('-1.2345678901234e-200');
SELECT '' AS five, f1 FROM FLOAT8_TBL ORDER BY 2;
 five |          f1           
------+-----------------------
      | -1.2345678901234e+200
      |               -1004.3
      |                -34.84
      | -1.2345678901234e-200
      |                     0
(5 rows)

-- test if you can dump/restore subnormal (1e-323) values
-- using COPY
CREATE TABLE FLOATS(a float8);
INSERT INTO FLOATS select 1e-307::float8 / 10^i FROM generate_series(1,16) i;
SELECT * FROM FLOATS ORDER BY a;
           a           
-----------------------
 9.88131291682493e-324
 9.88131291682493e-323
 9.98012604599318e-322
 9.99988867182683e-321
 9.99988867182683e-320
   9.999987484956e-319
 1.00000023069254e-317
 9.99999983659714e-317
 9.99999998481684e-316
 9.99999999963881e-315
 1.00000000001329e-313
 9.99999999998465e-313
 9.99999999999948e-312
 9.99999999999997e-311
                1e-309
                1e-308
(16 rows)

SELECT float8in(float8out(a)) FROM FLOATS ORDER BY a;
       float8in        
-----------------------
 9.88131291682493e-324
 9.88131291682493e-323
 9.98012604599318e-322
 9.99988867182683e-321
 9.99988867182683e-320
   9.999987484956e-319
 1.00000023069254e-317
 9.99999983659714e-317
 9.99999998481684e-316
 9.99999999963881e-315
 1.00000000001329e-313
 9.99999999998465e-313
 9.99999999999948e-312
 9.99999999999997e-311
                1e-309
                1e-308
(16 rows)

COPY FLOATS TO '/tmp/floats';
TRUNCATE FLOATS;
COPY FLOATS FROM '/tmp/floats';
SELECT * FROM FLOATS ORDER BY a;
           a           
-----------------------
 9.88131291682493e-324
 9.88131291682493e-323
 9.98012604599318e-322
 9.99988867182683e-321
 9.99988867182683e-320
   9.999987484956e-319
 1.00000023069254e-317
 9.99999983659714e-317
 9.99999998481684e-316
 9.99999999963881e-315
 1.00000000001329e-313
 9.99999999998465e-313
 9.99999999999948e-312
 9.99999999999997e-311
                1e-309
                1e-308
(16 rows)

