-- Tests for MPP-21090
set intervalstyle='postgres';
set datestyle='ISO, MDY';
create schema qp_dropped_cols;
set search_path='qp_dropped_cols';
-- TEST
CREATE TABLE mpp21090_changedistpolicy_dml_pttab_char
(
    col1 char,
    col2 char,
    col3 char,
    col4 char,
    col5 int
) DISTRIBUTED BY (col1) PARTITION BY LIST(col2)(partition partone VALUES('a','b','c','d','e','f','g','h') WITH (APPENDONLY=true, COMPRESSLEVEL=5, ORIENTATION=column),partition parttwo VALUES('i','j','k','l','m','n','o','p') WITH (APPENDONLY=true, COMPRESSLEVEL=5, ORIENTATION=row),partition partthree VALUES('q','r','s','t','u','v','w','x'));
NOTICE:  CREATE TABLE will create partition "mpp21090_changedistpolicy_dml_pttab_char_1_prt_partone" for table "mpp21090_changedistpolicy_dml_pttab_char"
NOTICE:  CREATE TABLE will create partition "mpp21090_changedistpolicy_dml_pttab_char_1_prt_parttwo" for table "mpp21090_changedistpolicy_dml_pttab_char"
NOTICE:  CREATE TABLE will create partition "mpp21090_changedistpolicy_dml_pttab_char_1_prt_partthree" for table "mpp21090_changedistpolicy_dml_pttab_char"
INSERT INTO mpp21090_changedistpolicy_dml_pttab_char VALUES('g','g','a','g',0);
SELECT * FROM mpp21090_changedistpolicy_dml_pttab_char ORDER BY 1,2,3,4;
 col1 | col2 | col3 | col4 | col5 
------+------+------+------+------
 g    | g    | a    | g    |    0
(1 row)

ALTER TABLE mpp21090_changedistpolicy_dml_pttab_char DROP COLUMN col4;
INSERT INTO mpp21090_changedistpolicy_dml_pttab_char VALUES('g','g','b',1);
SELECT * FROM mpp21090_changedistpolicy_dml_pttab_char ORDER BY 1,2,3,4;
 col1 | col2 | col3 | col5 
------+------+------+------
 g    | g    | a    |    0
 g    | g    | b    |    1
(2 rows)

ALTER TABLE mpp21090_changedistpolicy_dml_pttab_char SET DISTRIBUTED BY (col3);
INSERT INTO mpp21090_changedistpolicy_dml_pttab_char SELECT 'a', 'a','c', 2;
SELECT * FROM mpp21090_changedistpolicy_dml_pttab_char ORDER BY 1,2,3;
 col1 | col2 | col3 | col5 
------+------+------+------
 a    | a    | c    |    2
 g    | g    | a    |    0
 g    | g    | b    |    1
(3 rows)

UPDATE mpp21090_changedistpolicy_dml_pttab_char SET col3 ='c' WHERE col3 ='b';
ERROR:  Cannot parallelize an UPDATE statement that updates the distribution columns
SELECT * FROM mpp21090_changedistpolicy_dml_pttab_char ORDER BY 1,2,3;
 col1 | col2 | col3 | col5 
------+------+------+------
 a    | a    | c    |    2
 g    | g    | a    |    0
 g    | g    | b    |    1
(3 rows)

DELETE FROM mpp21090_changedistpolicy_dml_pttab_char WHERE col3 ='c';
SELECT * FROM mpp21090_changedistpolicy_dml_pttab_char ORDER BY 1,2,3;
 col1 | col2 | col3 | col5 
------+------+------+------
 g    | g    | a    |    0
 g    | g    | b    |    1
(2 rows)

-- TEST
DROP TABLE IF EXISTS mpp21090_changedistpolicy_dml_pttab_decimal;
NOTICE:  table "mpp21090_changedistpolicy_dml_pttab_decimal" does not exist, skipping
CREATE TABLE mpp21090_changedistpolicy_dml_pttab_decimal
(
    col1 decimal,
    col2 decimal,
    col3 char,
    col4 decimal,
    col5 int
) DISTRIBUTED BY (col1) PARTITION BY RANGE(col2)(partition partone start(1.00) end(10.00)  WITH (APPENDONLY=true, COMPRESSLEVEL=5, ORIENTATION=column),partition parttwo start(10.00) end(20.00) WITH (APPENDONLY=true, COMPRESSLEVEL=5, ORIENTATION=row),partition partthree start(20.00) end(30.00));
NOTICE:  CREATE TABLE will create partition "mpp21090_changedistpolicy_dml_pttab_decimal_1_prt_partone" for table "mpp21090_changedistpolicy_dml_pttab_decimal"
NOTICE:  CREATE TABLE will create partition "mpp21090_changedistpolicy_dml_pttab_decimal_1_prt_parttwo" for table "mpp21090_changedistpolicy_dml_pttab_decimal"
NOTICE:  CREATE TABLE will create partition "mpp21090_changedistpolicy_dml_pttab_decimal_1_prt_partthree" for table "mpp21090_changedistpolicy_dml_pttab_decimal"
INSERT INTO mpp21090_changedistpolicy_dml_pttab_decimal VALUES(2.00,2.00,'a',2.00,0);
SELECT * FROM mpp21090_changedistpolicy_dml_pttab_decimal ORDER BY 1,2,3,4;
 col1 | col2 | col3 | col4 | col5 
------+------+------+------+------
 2.00 | 2.00 | a    | 2.00 |    0
(1 row)

ALTER TABLE mpp21090_changedistpolicy_dml_pttab_decimal DROP COLUMN col4;
INSERT INTO mpp21090_changedistpolicy_dml_pttab_decimal VALUES(2.00,2.00,'b',1);
SELECT * FROM mpp21090_changedistpolicy_dml_pttab_decimal ORDER BY 1,2,3,4;
 col1 | col2 | col3 | col5 
------+------+------+------
 2.00 | 2.00 | a    |    0
 2.00 | 2.00 | b    |    1
(2 rows)

ALTER TABLE mpp21090_changedistpolicy_dml_pttab_decimal SET DISTRIBUTED BY (col3);
INSERT INTO mpp21090_changedistpolicy_dml_pttab_decimal SELECT 1.00, 1.00,'c', 2;
SELECT * FROM mpp21090_changedistpolicy_dml_pttab_decimal ORDER BY 1,2,3;
 col1 | col2 | col3 | col5 
------+------+------+------
 1.00 | 1.00 | c    |    2
 2.00 | 2.00 | a    |    0
 2.00 | 2.00 | b    |    1
(3 rows)

UPDATE mpp21090_changedistpolicy_dml_pttab_decimal SET col3 ='c' WHERE col3 ='b';
ERROR:  Cannot parallelize an UPDATE statement that updates the distribution columns
SELECT * FROM mpp21090_changedistpolicy_dml_pttab_decimal ORDER BY 1,2,3;
 col1 | col2 | col3 | col5 
------+------+------+------
 1.00 | 1.00 | c    |    2
 2.00 | 2.00 | a    |    0
 2.00 | 2.00 | b    |    1
(3 rows)

DELETE FROM mpp21090_changedistpolicy_dml_pttab_decimal WHERE col3 ='c';
SELECT * FROM mpp21090_changedistpolicy_dml_pttab_decimal ORDER BY 1,2,3;
 col1 | col2 | col3 | col5 
------+------+------+------
 2.00 | 2.00 | a    |    0
 2.00 | 2.00 | b    |    1
(2 rows)

-- TEST
DROP TABLE IF EXISTS mpp21090_changedistpolicy_dml_pttab_int4;
NOTICE:  table "mpp21090_changedistpolicy_dml_pttab_int4" does not exist, skipping
CREATE TABLE mpp21090_changedistpolicy_dml_pttab_int4
(
    col1 int4,
    col2 int4,
    col3 char,
    col4 int4,
    col5 int
) DISTRIBUTED BY (col1) PARTITION BY RANGE(col2)(partition partone start(1) end(100000001)  WITH (APPENDONLY=true, COMPRESSLEVEL=5, ORIENTATION=column),partition parttwo start(100000001) end(200000001) WITH (APPENDONLY=true, COMPRESSLEVEL=5, ORIENTATION=row),partition partthree start(200000001) end(300000001));
NOTICE:  CREATE TABLE will create partition "mpp21090_changedistpolicy_dml_pttab_int4_1_prt_partone" for table "mpp21090_changedistpolicy_dml_pttab_int4"
NOTICE:  CREATE TABLE will create partition "mpp21090_changedistpolicy_dml_pttab_int4_1_prt_parttwo" for table "mpp21090_changedistpolicy_dml_pttab_int4"
NOTICE:  CREATE TABLE will create partition "mpp21090_changedistpolicy_dml_pttab_int4_1_prt_partthree" for table "mpp21090_changedistpolicy_dml_pttab_int4"
INSERT INTO mpp21090_changedistpolicy_dml_pttab_int4 VALUES(20000000,20000000,'a',20000000,0);
SELECT * FROM mpp21090_changedistpolicy_dml_pttab_int4 ORDER BY 1,2,3,4;
   col1   |   col2   | col3 |   col4   | col5 
----------+----------+------+----------+------
 20000000 | 20000000 | a    | 20000000 |    0
(1 row)

ALTER TABLE mpp21090_changedistpolicy_dml_pttab_int4 DROP COLUMN col4;
INSERT INTO mpp21090_changedistpolicy_dml_pttab_int4 VALUES(20000000,20000000,'b',1);
SELECT * FROM mpp21090_changedistpolicy_dml_pttab_int4 ORDER BY 1,2,3,4;
   col1   |   col2   | col3 | col5 
----------+----------+------+------
 20000000 | 20000000 | a    |    0
 20000000 | 20000000 | b    |    1
(2 rows)

ALTER TABLE mpp21090_changedistpolicy_dml_pttab_int4 SET DISTRIBUTED BY (col3);
INSERT INTO mpp21090_changedistpolicy_dml_pttab_int4 SELECT 10000000, 10000000,'c', 2;
SELECT * FROM mpp21090_changedistpolicy_dml_pttab_int4 ORDER BY 1,2,3;
   col1   |   col2   | col3 | col5 
----------+----------+------+------
 10000000 | 10000000 | c    |    2
 20000000 | 20000000 | a    |    0
 20000000 | 20000000 | b    |    1
(3 rows)

UPDATE mpp21090_changedistpolicy_dml_pttab_int4 SET col3 ='c' WHERE col3 ='b';
ERROR:  Cannot parallelize an UPDATE statement that updates the distribution columns
SELECT * FROM mpp21090_changedistpolicy_dml_pttab_int4 ORDER BY 1,2,3;
   col1   |   col2   | col3 | col5 
----------+----------+------+------
 10000000 | 10000000 | c    |    2
 20000000 | 20000000 | a    |    0
 20000000 | 20000000 | b    |    1
(3 rows)

DELETE FROM mpp21090_changedistpolicy_dml_pttab_int4 WHERE col3 ='c';
SELECT * FROM mpp21090_changedistpolicy_dml_pttab_int4 ORDER BY 1,2,3;
   col1   |   col2   | col3 | col5 
----------+----------+------+------
 20000000 | 20000000 | a    |    0
 20000000 | 20000000 | b    |    1
(2 rows)

-- TEST
DROP TABLE IF EXISTS mpp21090_changedistpolicy_dml_pttab_int8;
NOTICE:  table "mpp21090_changedistpolicy_dml_pttab_int8" does not exist, skipping
CREATE TABLE mpp21090_changedistpolicy_dml_pttab_int8
(
    col1 int8,
    col2 int8,
    col3 char,
    col4 int8,
    col5 int
) DISTRIBUTED BY (col1) PARTITION BY RANGE(col2)(partition partone start(1) end(1000000000000000001)  WITH (APPENDONLY=true, COMPRESSLEVEL=5, ORIENTATION=column),partition parttwo start(1000000000000000001) end(2000000000000000001) WITH (APPENDONLY=true, COMPRESSLEVEL=5, ORIENTATION=row),partition partthree start(2000000000000000001) end(3000000000000000001));
NOTICE:  CREATE TABLE will create partition "mpp21090_changedistpolicy_dml_pttab_int8_1_prt_partone" for table "mpp21090_changedistpolicy_dml_pttab_int8"
NOTICE:  CREATE TABLE will create partition "mpp21090_changedistpolicy_dml_pttab_int8_1_prt_parttwo" for table "mpp21090_changedistpolicy_dml_pttab_int8"
NOTICE:  CREATE TABLE will create partition "mpp21090_changedistpolicy_dml_pttab_int8_1_prt_partthree" for table "mpp21090_changedistpolicy_dml_pttab_int8"
INSERT INTO mpp21090_changedistpolicy_dml_pttab_int8 VALUES(200000000000000000,200000000000000000,'a',200000000000000000,0);
SELECT * FROM mpp21090_changedistpolicy_dml_pttab_int8 ORDER BY 1,2,3,4;
        col1        |        col2        | col3 |        col4        | col5 
--------------------+--------------------+------+--------------------+------
 200000000000000000 | 200000000000000000 | a    | 200000000000000000 |    0
(1 row)

ALTER TABLE mpp21090_changedistpolicy_dml_pttab_int8 DROP COLUMN col4;
INSERT INTO mpp21090_changedistpolicy_dml_pttab_int8 VALUES(200000000000000000,200000000000000000,'b',1);
SELECT * FROM mpp21090_changedistpolicy_dml_pttab_int8 ORDER BY 1,2,3,4;
        col1        |        col2        | col3 | col5 
--------------------+--------------------+------+------
 200000000000000000 | 200000000000000000 | a    |    0
 200000000000000000 | 200000000000000000 | b    |    1
(2 rows)

ALTER TABLE mpp21090_changedistpolicy_dml_pttab_int8 SET DISTRIBUTED BY (col3);
INSERT INTO mpp21090_changedistpolicy_dml_pttab_int8 SELECT 1000000000000000000, 1000000000000000000,'c', 2;
SELECT * FROM mpp21090_changedistpolicy_dml_pttab_int8 ORDER BY 1,2,3;
        col1         |        col2         | col3 | col5 
---------------------+---------------------+------+------
  200000000000000000 |  200000000000000000 | a    |    0
  200000000000000000 |  200000000000000000 | b    |    1
 1000000000000000000 | 1000000000000000000 | c    |    2
(3 rows)

UPDATE mpp21090_changedistpolicy_dml_pttab_int8 SET col3 ='c' WHERE col3 ='b';
ERROR:  Cannot parallelize an UPDATE statement that updates the distribution columns
SELECT * FROM mpp21090_changedistpolicy_dml_pttab_int8 ORDER BY 1,2,3;
        col1         |        col2         | col3 | col5 
---------------------+---------------------+------+------
  200000000000000000 |  200000000000000000 | a    |    0
  200000000000000000 |  200000000000000000 | b    |    1
 1000000000000000000 | 1000000000000000000 | c    |    2
(3 rows)

DELETE FROM mpp21090_changedistpolicy_dml_pttab_int8 WHERE col3 ='c';
SELECT * FROM mpp21090_changedistpolicy_dml_pttab_int8 ORDER BY 1,2,3;
        col1        |        col2        | col3 | col5 
--------------------+--------------------+------+------
 200000000000000000 | 200000000000000000 | a    |    0
 200000000000000000 | 200000000000000000 | b    |    1
(2 rows)

-- TEST
DROP TABLE IF EXISTS mpp21090_changedistpolicy_dml_pttab_interval;
NOTICE:  table "mpp21090_changedistpolicy_dml_pttab_interval" does not exist, skipping
CREATE TABLE mpp21090_changedistpolicy_dml_pttab_interval
(
    col1 interval,
    col2 interval,
    col3 char,
    col4 interval,
    col5 int
) DISTRIBUTED BY (col1) PARTITION BY RANGE(col2)(partition partone start('1 sec') end('1 min')  WITH (APPENDONLY=true, COMPRESSLEVEL=5, ORIENTATION=column),partition parttwo start('1 min') end('1 hour') WITH (APPENDONLY=true, COMPRESSLEVEL=5, ORIENTATION=row),partition partthree start('1 hour') end('12 hours'));
NOTICE:  CREATE TABLE will create partition "mpp21090_changedistpolicy_dml_pttab_interval_1_prt_partone" for table "mpp21090_changedistpolicy_dml_pttab_interval"
NOTICE:  CREATE TABLE will create partition "mpp21090_changedistpolicy_dml_pttab_interval_1_prt_parttwo" for table "mpp21090_changedistpolicy_dml_pttab_interval"
NOTICE:  CREATE TABLE will create partition "mpp21090_changedistpolicy_dml_pttab_interval_1_prt_partthree" for table "mpp21090_changedistpolicy_dml_pttab_interval"
INSERT INTO mpp21090_changedistpolicy_dml_pttab_interval VALUES('10 secs','10 secs','a','10 secs',0);
SELECT * FROM mpp21090_changedistpolicy_dml_pttab_interval ORDER BY 1,2,3,4;
   col1   |   col2   | col3 |   col4   | col5 
----------+----------+------+----------+------
 00:00:10 | 00:00:10 | a    | 00:00:10 |    0
(1 row)

ALTER TABLE mpp21090_changedistpolicy_dml_pttab_interval DROP COLUMN col4;
INSERT INTO mpp21090_changedistpolicy_dml_pttab_interval VALUES('10 secs','10 secs','b',1);
SELECT * FROM mpp21090_changedistpolicy_dml_pttab_interval ORDER BY 1,2,3,4;
   col1   |   col2   | col3 | col5 
----------+----------+------+------
 00:00:10 | 00:00:10 | a    |    0
 00:00:10 | 00:00:10 | b    |    1
(2 rows)

ALTER TABLE mpp21090_changedistpolicy_dml_pttab_interval SET DISTRIBUTED BY (col3);
INSERT INTO mpp21090_changedistpolicy_dml_pttab_interval SELECT '11 hours', '11 hours','c', 2;
SELECT * FROM mpp21090_changedistpolicy_dml_pttab_interval ORDER BY 1,2,3;
   col1   |   col2   | col3 | col5 
----------+----------+------+------
 00:00:10 | 00:00:10 | a    |    0
 00:00:10 | 00:00:10 | b    |    1
 11:00:00 | 11:00:00 | c    |    2
(3 rows)

UPDATE mpp21090_changedistpolicy_dml_pttab_interval SET col3 ='c' WHERE col3 ='b';
ERROR:  Cannot parallelize an UPDATE statement that updates the distribution columns
SELECT * FROM mpp21090_changedistpolicy_dml_pttab_interval ORDER BY 1,2,3;
   col1   |   col2   | col3 | col5 
----------+----------+------+------
 00:00:10 | 00:00:10 | a    |    0
 00:00:10 | 00:00:10 | b    |    1
 11:00:00 | 11:00:00 | c    |    2
(3 rows)

DELETE FROM mpp21090_changedistpolicy_dml_pttab_interval WHERE col3 ='c';
SELECT * FROM mpp21090_changedistpolicy_dml_pttab_interval ORDER BY 1,2,3;
   col1   |   col2   | col3 | col5 
----------+----------+------+------
 00:00:10 | 00:00:10 | a    |    0
 00:00:10 | 00:00:10 | b    |    1
(2 rows)

-- TEST
DROP TABLE IF EXISTS mpp21090_changedistpolicy_dml_pttab_numeric;
NOTICE:  table "mpp21090_changedistpolicy_dml_pttab_numeric" does not exist, skipping
CREATE TABLE mpp21090_changedistpolicy_dml_pttab_numeric
(
    col1 numeric,
    col2 numeric,
    col3 char,
    col4 numeric,
    col5 int
) DISTRIBUTED BY (col1) PARTITION BY RANGE(col2)(partition partone start(1.000000) end(10.000000)  WITH (APPENDONLY=true, COMPRESSLEVEL=5, ORIENTATION=column),partition parttwo start(10.000000) end(20.000000) WITH (APPENDONLY=true, COMPRESSLEVEL=5, ORIENTATION=row),partition partthree start(20.000000) end(30.000000));
NOTICE:  CREATE TABLE will create partition "mpp21090_changedistpolicy_dml_pttab_numeric_1_prt_partone" for table "mpp21090_changedistpolicy_dml_pttab_numeric"
NOTICE:  CREATE TABLE will create partition "mpp21090_changedistpolicy_dml_pttab_numeric_1_prt_parttwo" for table "mpp21090_changedistpolicy_dml_pttab_numeric"
NOTICE:  CREATE TABLE will create partition "mpp21090_changedistpolicy_dml_pttab_numeric_1_prt_partthree" for table "mpp21090_changedistpolicy_dml_pttab_numeric"
INSERT INTO mpp21090_changedistpolicy_dml_pttab_numeric VALUES(2.000000,2.000000,'a',2.000000,0);
SELECT * FROM mpp21090_changedistpolicy_dml_pttab_numeric ORDER BY 1,2,3,4;
   col1   |   col2   | col3 |   col4   | col5 
----------+----------+------+----------+------
 2.000000 | 2.000000 | a    | 2.000000 |    0
(1 row)

ALTER TABLE mpp21090_changedistpolicy_dml_pttab_numeric DROP COLUMN col4;
INSERT INTO mpp21090_changedistpolicy_dml_pttab_numeric VALUES(2.000000,2.000000,'b',1);
SELECT * FROM mpp21090_changedistpolicy_dml_pttab_numeric ORDER BY 1,2,3,4;
   col1   |   col2   | col3 | col5 
----------+----------+------+------
 2.000000 | 2.000000 | a    |    0
 2.000000 | 2.000000 | b    |    1
(2 rows)

ALTER TABLE mpp21090_changedistpolicy_dml_pttab_numeric SET DISTRIBUTED BY (col3);
INSERT INTO mpp21090_changedistpolicy_dml_pttab_numeric SELECT 1.000000, 1.000000,'c', 2;
SELECT * FROM mpp21090_changedistpolicy_dml_pttab_numeric ORDER BY 1,2,3;
   col1   |   col2   | col3 | col5 
----------+----------+------+------
 1.000000 | 1.000000 | c    |    2
 2.000000 | 2.000000 | a    |    0
 2.000000 | 2.000000 | b    |    1
(3 rows)

UPDATE mpp21090_changedistpolicy_dml_pttab_numeric SET col3 ='c' WHERE col3 ='b';
ERROR:  Cannot parallelize an UPDATE statement that updates the distribution columns
SELECT * FROM mpp21090_changedistpolicy_dml_pttab_numeric ORDER BY 1,2,3;
   col1   |   col2   | col3 | col5 
----------+----------+------+------
 1.000000 | 1.000000 | c    |    2
 2.000000 | 2.000000 | a    |    0
 2.000000 | 2.000000 | b    |    1
(3 rows)

DELETE FROM mpp21090_changedistpolicy_dml_pttab_numeric WHERE col3 ='c';
SELECT * FROM mpp21090_changedistpolicy_dml_pttab_numeric ORDER BY 1,2,3;
   col1   |   col2   | col3 | col5 
----------+----------+------+------
 2.000000 | 2.000000 | a    |    0
 2.000000 | 2.000000 | b    |    1
(2 rows)

-- TEST
DROP TABLE IF EXISTS mpp21090_defpt_dropcol_addcol_dml_char;
NOTICE:  table "mpp21090_defpt_dropcol_addcol_dml_char" does not exist, skipping
CREATE TABLE mpp21090_defpt_dropcol_addcol_dml_char
(
    col1 char,
    col2 char,
    col3 char,
    col4 int
) 
DISTRIBUTED by (col1)
PARTITION BY LIST(col2)
(
default partition def
);
NOTICE:  CREATE TABLE will create partition "mpp21090_defpt_dropcol_addcol_dml_char_1_prt_def" for table "mpp21090_defpt_dropcol_addcol_dml_char"
INSERT INTO mpp21090_defpt_dropcol_addcol_dml_char VALUES('x','x','a',0);
ALTER TABLE mpp21090_defpt_dropcol_addcol_dml_char DROP COLUMN col4;
INSERT INTO mpp21090_defpt_dropcol_addcol_dml_char SELECT 'z','z','b';
SELECT * FROM mpp21090_defpt_dropcol_addcol_dml_char ORDER BY 1,2,3;
 col1 | col2 | col3 
------+------+------
 x    | x    | a
 z    | z    | b
(2 rows)

ALTER TABLE mpp21090_defpt_dropcol_addcol_dml_char ADD COLUMN col5 char;
INSERT INTO mpp21090_defpt_dropcol_addcol_dml_char SELECT 'x','x','c','x';
SELECT * FROM mpp21090_defpt_dropcol_addcol_dml_char ORDER BY 1,2,3;
 col1 | col2 | col3 | col5 
------+------+------+------
 x    | x    | a    | 
 x    | x    | c    | x
 z    | z    | b    | 
(3 rows)

UPDATE mpp21090_defpt_dropcol_addcol_dml_char SET col1 = '-' WHERE col2 = 'z' AND col1 = 'z';
ERROR:  Cannot parallelize an UPDATE statement that updates the distribution columns
SELECT * FROM mpp21090_defpt_dropcol_addcol_dml_char ORDER BY 1,2,3;
 col1 | col2 | col3 | col5 
------+------+------+------
 x    | x    | a    | 
 x    | x    | c    | x
 z    | z    | b    | 
(3 rows)

-- Update partition key
UPDATE mpp21090_defpt_dropcol_addcol_dml_char SET col2 = '-' WHERE col2 = 'z' AND col1 = '-';
SELECT * FROM mpp21090_defpt_dropcol_addcol_dml_char ORDER BY 1,2,3;
 col1 | col2 | col3 | col5 
------+------+------+------
 x    | x    | a    | 
 x    | x    | c    | x
 z    | z    | b    | 
(3 rows)

DELETE FROM mpp21090_defpt_dropcol_addcol_dml_char WHERE col2 = '-';
SELECT * FROM mpp21090_defpt_dropcol_addcol_dml_char ORDER BY 1,2,3;
 col1 | col2 | col3 | col5 
------+------+------+------
 x    | x    | a    | 
 x    | x    | c    | x
 z    | z    | b    | 
(3 rows)

-- TEST
DROP TABLE IF EXISTS mpp21090_defpt_dropcol_addcol_dml_decimal;
NOTICE:  table "mpp21090_defpt_dropcol_addcol_dml_decimal" does not exist, skipping
CREATE TABLE mpp21090_defpt_dropcol_addcol_dml_decimal
(
    col1 decimal,
    col2 decimal,
    col3 char,
    col4 int
) 
DISTRIBUTED by (col1)
PARTITION BY LIST(col2)
(
default partition def
);
NOTICE:  CREATE TABLE will create partition "mpp21090_defpt_dropcol_addcol_dml_decimal_1_prt_def" for table "mpp21090_defpt_dropcol_addcol_dml_decimal"
INSERT INTO mpp21090_defpt_dropcol_addcol_dml_decimal VALUES(2.00,2.00,'a',0);
ALTER TABLE mpp21090_defpt_dropcol_addcol_dml_decimal DROP COLUMN col4;
INSERT INTO mpp21090_defpt_dropcol_addcol_dml_decimal SELECT 35.00,35.00,'b';
SELECT * FROM mpp21090_defpt_dropcol_addcol_dml_decimal ORDER BY 1,2,3;
 col1  | col2  | col3 
-------+-------+------
  2.00 |  2.00 | a
 35.00 | 35.00 | b
(2 rows)

ALTER TABLE mpp21090_defpt_dropcol_addcol_dml_decimal ADD COLUMN col5 decimal;
INSERT INTO mpp21090_defpt_dropcol_addcol_dml_decimal SELECT 2.00,2.00,'c',2.00;
SELECT * FROM mpp21090_defpt_dropcol_addcol_dml_decimal ORDER BY 1,2,3;
 col1  | col2  | col3 | col5 
-------+-------+------+------
  2.00 |  2.00 | a    |     
  2.00 |  2.00 | c    | 2.00
 35.00 | 35.00 | b    |     
(3 rows)

UPDATE mpp21090_defpt_dropcol_addcol_dml_decimal SET col1 = 1.00 WHERE col2 = 35.00 AND col1 = 35.00;
ERROR:  Cannot parallelize an UPDATE statement that updates the distribution columns
SELECT * FROM mpp21090_defpt_dropcol_addcol_dml_decimal ORDER BY 1,2,3;
 col1  | col2  | col3 | col5 
-------+-------+------+------
  2.00 |  2.00 | a    |     
  2.00 |  2.00 | c    | 2.00
 35.00 | 35.00 | b    |     
(3 rows)

-- Update partition key
UPDATE mpp21090_defpt_dropcol_addcol_dml_decimal SET col2 = 1.00 WHERE col2 = 35.00 AND col1 = 1.00;
SELECT * FROM mpp21090_defpt_dropcol_addcol_dml_decimal ORDER BY 1,2,3;
 col1  | col2  | col3 | col5 
-------+-------+------+------
  2.00 |  2.00 | a    |     
  2.00 |  2.00 | c    | 2.00
 35.00 | 35.00 | b    |     
(3 rows)

DELETE FROM mpp21090_defpt_dropcol_addcol_dml_decimal WHERE col2 = 1.00;
SELECT * FROM mpp21090_defpt_dropcol_addcol_dml_decimal ORDER BY 1,2,3;
 col1  | col2  | col3 | col5 
-------+-------+------+------
  2.00 |  2.00 | a    |     
  2.00 |  2.00 | c    | 2.00
 35.00 | 35.00 | b    |     
(3 rows)

-- TEST
DROP TABLE IF EXISTS mpp21090_defpt_dropcol_addcol_dml_int4;
NOTICE:  table "mpp21090_defpt_dropcol_addcol_dml_int4" does not exist, skipping
CREATE TABLE mpp21090_defpt_dropcol_addcol_dml_int4
(
    col1 int4,
    col2 int4,
    col3 char,
    col4 int
) 
DISTRIBUTED by (col1)
PARTITION BY LIST(col2)
(
default partition def
);
NOTICE:  CREATE TABLE will create partition "mpp21090_defpt_dropcol_addcol_dml_int4_1_prt_def" for table "mpp21090_defpt_dropcol_addcol_dml_int4"
INSERT INTO mpp21090_defpt_dropcol_addcol_dml_int4 VALUES(20000000,20000000,'a',0);
ALTER TABLE mpp21090_defpt_dropcol_addcol_dml_int4 DROP COLUMN col4;
INSERT INTO mpp21090_defpt_dropcol_addcol_dml_int4 SELECT 35000000,35000000,'b';
SELECT * FROM mpp21090_defpt_dropcol_addcol_dml_int4 ORDER BY 1,2,3;
   col1   |   col2   | col3 
----------+----------+------
 20000000 | 20000000 | a
 35000000 | 35000000 | b
(2 rows)

ALTER TABLE mpp21090_defpt_dropcol_addcol_dml_int4 ADD COLUMN col5 int4;
INSERT INTO mpp21090_defpt_dropcol_addcol_dml_int4 SELECT 20000000,20000000,'c',20000000;
SELECT * FROM mpp21090_defpt_dropcol_addcol_dml_int4 ORDER BY 1,2,3;
   col1   |   col2   | col3 |   col5   
----------+----------+------+----------
 20000000 | 20000000 | a    |         
 20000000 | 20000000 | c    | 20000000
 35000000 | 35000000 | b    |         
(3 rows)

UPDATE mpp21090_defpt_dropcol_addcol_dml_int4 SET col1 = 10000000 WHERE col2 = 35000000 AND col1 = 35000000;
ERROR:  Cannot parallelize an UPDATE statement that updates the distribution columns
SELECT * FROM mpp21090_defpt_dropcol_addcol_dml_int4 ORDER BY 1,2,3;
   col1   |   col2   | col3 |   col5   
----------+----------+------+----------
 20000000 | 20000000 | a    |         
 20000000 | 20000000 | c    | 20000000
 35000000 | 35000000 | b    |         
(3 rows)

-- Update partition key
UPDATE mpp21090_defpt_dropcol_addcol_dml_int4 SET col2 = 10000000 WHERE col2 = 35000000 AND col1 = 10000000;
SELECT * FROM mpp21090_defpt_dropcol_addcol_dml_int4 ORDER BY 1,2,3;
   col1   |   col2   | col3 |   col5   
----------+----------+------+----------
 20000000 | 20000000 | a    |         
 20000000 | 20000000 | c    | 20000000
 35000000 | 35000000 | b    |         
(3 rows)

DELETE FROM mpp21090_defpt_dropcol_addcol_dml_int4 WHERE col2 = 10000000;
SELECT * FROM mpp21090_defpt_dropcol_addcol_dml_int4 ORDER BY 1,2,3;
   col1   |   col2   | col3 |   col5   
----------+----------+------+----------
 20000000 | 20000000 | a    |         
 20000000 | 20000000 | c    | 20000000
 35000000 | 35000000 | b    |         
(3 rows)

-- TEST
DROP TABLE IF EXISTS mpp21090_defpt_dropcol_addcol_dml_int8;
NOTICE:  table "mpp21090_defpt_dropcol_addcol_dml_int8" does not exist, skipping
CREATE TABLE mpp21090_defpt_dropcol_addcol_dml_int8
(
    col1 int8,
    col2 int8,
    col3 char,
    col4 int
) 
DISTRIBUTED by (col1)
PARTITION BY LIST(col2)
(
default partition def
);
NOTICE:  CREATE TABLE will create partition "mpp21090_defpt_dropcol_addcol_dml_int8_1_prt_def" for table "mpp21090_defpt_dropcol_addcol_dml_int8"
INSERT INTO mpp21090_defpt_dropcol_addcol_dml_int8 VALUES(2000000000000000000,2000000000000000000,'a',0);
ALTER TABLE mpp21090_defpt_dropcol_addcol_dml_int8 DROP COLUMN col4;
INSERT INTO mpp21090_defpt_dropcol_addcol_dml_int8 SELECT 3500000000000000000,3500000000000000000,'b';
SELECT * FROM mpp21090_defpt_dropcol_addcol_dml_int8 ORDER BY 1,2,3;
        col1         |        col2         | col3 
---------------------+---------------------+------
 2000000000000000000 | 2000000000000000000 | a
 3500000000000000000 | 3500000000000000000 | b
(2 rows)

ALTER TABLE mpp21090_defpt_dropcol_addcol_dml_int8 ADD COLUMN col5 int8;
INSERT INTO mpp21090_defpt_dropcol_addcol_dml_int8 SELECT 2000000000000000000,2000000000000000000,'c',2000000000000000000;
SELECT * FROM mpp21090_defpt_dropcol_addcol_dml_int8 ORDER BY 1,2,3;
        col1         |        col2         | col3 |        col5         
---------------------+---------------------+------+---------------------
 2000000000000000000 | 2000000000000000000 | a    |                    
 2000000000000000000 | 2000000000000000000 | c    | 2000000000000000000
 3500000000000000000 | 3500000000000000000 | b    |                    
(3 rows)

UPDATE mpp21090_defpt_dropcol_addcol_dml_int8 SET col1 = 1000000000000000000 WHERE col2 = 3500000000000000000 AND col1 = 3500000000000000000;
ERROR:  Cannot parallelize an UPDATE statement that updates the distribution columns
SELECT * FROM mpp21090_defpt_dropcol_addcol_dml_int8 ORDER BY 1,2,3;
        col1         |        col2         | col3 |        col5         
---------------------+---------------------+------+---------------------
 2000000000000000000 | 2000000000000000000 | a    |                    
 2000000000000000000 | 2000000000000000000 | c    | 2000000000000000000
 3500000000000000000 | 3500000000000000000 | b    |                    
(3 rows)

-- Update partition key
UPDATE mpp21090_defpt_dropcol_addcol_dml_int8 SET col2 = 1000000000000000000 WHERE col2 = 3500000000000000000 AND col1 = 1000000000000000000;
SELECT * FROM mpp21090_defpt_dropcol_addcol_dml_int8 ORDER BY 1,2,3;
        col1         |        col2         | col3 |        col5         
---------------------+---------------------+------+---------------------
 2000000000000000000 | 2000000000000000000 | a    |                    
 2000000000000000000 | 2000000000000000000 | c    | 2000000000000000000
 3500000000000000000 | 3500000000000000000 | b    |                    
(3 rows)

DELETE FROM mpp21090_defpt_dropcol_addcol_dml_int8 WHERE col2 = 1000000000000000000;
SELECT * FROM mpp21090_defpt_dropcol_addcol_dml_int8 ORDER BY 1,2,3;
        col1         |        col2         | col3 |        col5         
---------------------+---------------------+------+---------------------
 2000000000000000000 | 2000000000000000000 | a    |                    
 2000000000000000000 | 2000000000000000000 | c    | 2000000000000000000
 3500000000000000000 | 3500000000000000000 | b    |                    
(3 rows)

-- TEST
DROP TABLE IF EXISTS mpp21090_defpt_dropcol_addcol_dml_interval;
NOTICE:  table "mpp21090_defpt_dropcol_addcol_dml_interval" does not exist, skipping
CREATE TABLE mpp21090_defpt_dropcol_addcol_dml_interval
(
    col1 interval,
    col2 interval,
    col3 char,
    col4 int
) 
DISTRIBUTED by (col1)
PARTITION BY LIST(col2)
(
default partition def
);
NOTICE:  CREATE TABLE will create partition "mpp21090_defpt_dropcol_addcol_dml_interval_1_prt_def" for table "mpp21090_defpt_dropcol_addcol_dml_interval"
INSERT INTO mpp21090_defpt_dropcol_addcol_dml_interval VALUES('1 hour','1 hour','a',0);
ALTER TABLE mpp21090_defpt_dropcol_addcol_dml_interval DROP COLUMN col4;
INSERT INTO mpp21090_defpt_dropcol_addcol_dml_interval SELECT '14 hours','14 hours','b';
SELECT * FROM mpp21090_defpt_dropcol_addcol_dml_interval ORDER BY 1,2,3;
   col1   |   col2   | col3 
----------+----------+------
 01:00:00 | 01:00:00 | a
 14:00:00 | 14:00:00 | b
(2 rows)

ALTER TABLE mpp21090_defpt_dropcol_addcol_dml_interval ADD COLUMN col5 interval;
INSERT INTO mpp21090_defpt_dropcol_addcol_dml_interval SELECT '1 hour','1 hour','c','1 hour';
SELECT * FROM mpp21090_defpt_dropcol_addcol_dml_interval ORDER BY 1,2,3;
   col1   |   col2   | col3 |   col5   
----------+----------+------+----------
 01:00:00 | 01:00:00 | a    | 
 01:00:00 | 01:00:00 | c    | 01:00:00
 14:00:00 | 14:00:00 | b    | 
(3 rows)

UPDATE mpp21090_defpt_dropcol_addcol_dml_interval SET col1 = '12 hours' WHERE col2 = '14 hours' AND col1 = '14 hours';
ERROR:  Cannot parallelize an UPDATE statement that updates the distribution columns
SELECT * FROM mpp21090_defpt_dropcol_addcol_dml_interval ORDER BY 1,2,3;
   col1   |   col2   | col3 |   col5   
----------+----------+------+----------
 01:00:00 | 01:00:00 | a    | 
 01:00:00 | 01:00:00 | c    | 01:00:00
 14:00:00 | 14:00:00 | b    | 
(3 rows)

-- Update partition key
UPDATE mpp21090_defpt_dropcol_addcol_dml_interval SET col2 = '12 hours' WHERE col2 = '14 hours' AND col1 = '12 hours';
SELECT * FROM mpp21090_defpt_dropcol_addcol_dml_interval ORDER BY 1,2,3;
   col1   |   col2   | col3 |   col5   
----------+----------+------+----------
 01:00:00 | 01:00:00 | a    | 
 01:00:00 | 01:00:00 | c    | 01:00:00
 14:00:00 | 14:00:00 | b    | 
(3 rows)

DELETE FROM mpp21090_defpt_dropcol_addcol_dml_interval WHERE col2 = '12 hours';
SELECT * FROM mpp21090_defpt_dropcol_addcol_dml_interval ORDER BY 1,2,3;
   col1   |   col2   | col3 |   col5   
----------+----------+------+----------
 01:00:00 | 01:00:00 | a    | 
 01:00:00 | 01:00:00 | c    | 01:00:00
 14:00:00 | 14:00:00 | b    | 
(3 rows)

-- TEST
DROP TABLE IF EXISTS mpp21090_defpt_dropcol_addcol_dml_numeric;
NOTICE:  table "mpp21090_defpt_dropcol_addcol_dml_numeric" does not exist, skipping
CREATE TABLE mpp21090_defpt_dropcol_addcol_dml_numeric
(
    col1 numeric,
    col2 numeric,
    col3 char,
    col4 int
) 
DISTRIBUTED by (col1)
PARTITION BY LIST(col2)
(
default partition def
);
NOTICE:  CREATE TABLE will create partition "mpp21090_defpt_dropcol_addcol_dml_numeric_1_prt_def" for table "mpp21090_defpt_dropcol_addcol_dml_numeric"
INSERT INTO mpp21090_defpt_dropcol_addcol_dml_numeric VALUES(2.000000,2.000000,'a',0);
ALTER TABLE mpp21090_defpt_dropcol_addcol_dml_numeric DROP COLUMN col4;
INSERT INTO mpp21090_defpt_dropcol_addcol_dml_numeric SELECT 35.000000,35.000000,'b';
SELECT * FROM mpp21090_defpt_dropcol_addcol_dml_numeric ORDER BY 1,2,3;
   col1    |   col2    | col3 
-----------+-----------+------
  2.000000 |  2.000000 | a
 35.000000 | 35.000000 | b
(2 rows)

ALTER TABLE mpp21090_defpt_dropcol_addcol_dml_numeric ADD COLUMN col5 numeric;
INSERT INTO mpp21090_defpt_dropcol_addcol_dml_numeric SELECT 2.000000,2.000000,'c',2.000000;
SELECT * FROM mpp21090_defpt_dropcol_addcol_dml_numeric ORDER BY 1,2,3;
   col1    |   col2    | col3 |   col5   
-----------+-----------+------+----------
  2.000000 |  2.000000 | a    |         
  2.000000 |  2.000000 | c    | 2.000000
 35.000000 | 35.000000 | b    |         
(3 rows)

UPDATE mpp21090_defpt_dropcol_addcol_dml_numeric SET col1 = 1.000000 WHERE col2 = 35.000000 AND col1 = 35.000000;
ERROR:  Cannot parallelize an UPDATE statement that updates the distribution columns
SELECT * FROM mpp21090_defpt_dropcol_addcol_dml_numeric ORDER BY 1,2,3;
   col1    |   col2    | col3 |   col5   
-----------+-----------+------+----------
  2.000000 |  2.000000 | a    |         
  2.000000 |  2.000000 | c    | 2.000000
 35.000000 | 35.000000 | b    |         
(3 rows)

-- Update partition key
UPDATE mpp21090_defpt_dropcol_addcol_dml_numeric SET col2 = 1.000000 WHERE col2 = 35.000000 AND col1 = 1.000000;
SELECT * FROM mpp21090_defpt_dropcol_addcol_dml_numeric ORDER BY 1,2,3;
   col1    |   col2    | col3 |   col5   
-----------+-----------+------+----------
  2.000000 |  2.000000 | a    |         
  2.000000 |  2.000000 | c    | 2.000000
 35.000000 | 35.000000 | b    |         
(3 rows)

DELETE FROM mpp21090_defpt_dropcol_addcol_dml_numeric WHERE col2 = 1.000000;
SELECT * FROM mpp21090_defpt_dropcol_addcol_dml_numeric ORDER BY 1,2,3;
   col1    |   col2    | col3 |   col5   
-----------+-----------+------+----------
  2.000000 |  2.000000 | a    |         
  2.000000 |  2.000000 | c    | 2.000000
 35.000000 | 35.000000 | b    |         
(3 rows)

-- TEST
DROP TABLE IF EXISTS mpp21090_defpt_dropcol_addcol_dml_text;
NOTICE:  table "mpp21090_defpt_dropcol_addcol_dml_text" does not exist, skipping
CREATE TABLE mpp21090_defpt_dropcol_addcol_dml_text
(
    col1 text,
    col2 text,
    col3 char,
    col4 int
) 
DISTRIBUTED by (col1)
PARTITION BY LIST(col2)
(
default partition def
);
NOTICE:  CREATE TABLE will create partition "mpp21090_defpt_dropcol_addcol_dml_text_1_prt_def" for table "mpp21090_defpt_dropcol_addcol_dml_text"
INSERT INTO mpp21090_defpt_dropcol_addcol_dml_text VALUES('abcdefghijklmnop','abcdefghijklmnop','a',0);
ALTER TABLE mpp21090_defpt_dropcol_addcol_dml_text DROP COLUMN col4;
INSERT INTO mpp21090_defpt_dropcol_addcol_dml_text SELECT 'xyz','xyz','b';
SELECT * FROM mpp21090_defpt_dropcol_addcol_dml_text ORDER BY 1,2,3;
       col1       |       col2       | col3 
------------------+------------------+------
 abcdefghijklmnop | abcdefghijklmnop | a
 xyz              | xyz              | b
(2 rows)

ALTER TABLE mpp21090_defpt_dropcol_addcol_dml_text ADD COLUMN col5 text;
INSERT INTO mpp21090_defpt_dropcol_addcol_dml_text SELECT 'abcdefghijklmnop','abcdefghijklmnop','c','abcdefghijklmnop';
SELECT * FROM mpp21090_defpt_dropcol_addcol_dml_text ORDER BY 1,2,3;
       col1       |       col2       | col3 |       col5       
------------------+------------------+------+------------------
 abcdefghijklmnop | abcdefghijklmnop | a    | 
 abcdefghijklmnop | abcdefghijklmnop | c    | abcdefghijklmnop
 xyz              | xyz              | b    | 
(3 rows)

UPDATE mpp21090_defpt_dropcol_addcol_dml_text SET col1 = 'qrstuvwxyz' WHERE col2 = 'xyz' AND col1 = 'xyz';
ERROR:  Cannot parallelize an UPDATE statement that updates the distribution columns
SELECT * FROM mpp21090_defpt_dropcol_addcol_dml_text ORDER BY 1,2,3;
       col1       |       col2       | col3 |       col5       
------------------+------------------+------+------------------
 abcdefghijklmnop | abcdefghijklmnop | a    | 
 abcdefghijklmnop | abcdefghijklmnop | c    | abcdefghijklmnop
 xyz              | xyz              | b    | 
(3 rows)

-- Update partition key
UPDATE mpp21090_defpt_dropcol_addcol_dml_text SET col2 = 'qrstuvwxyz' WHERE col2 = 'xyz' AND col1 = 'qrstuvwxyz';
SELECT * FROM mpp21090_defpt_dropcol_addcol_dml_text ORDER BY 1,2,3;
       col1       |       col2       | col3 |       col5       
------------------+------------------+------+------------------
 abcdefghijklmnop | abcdefghijklmnop | a    | 
 abcdefghijklmnop | abcdefghijklmnop | c    | abcdefghijklmnop
 xyz              | xyz              | b    | 
(3 rows)

DELETE FROM mpp21090_defpt_dropcol_addcol_dml_text WHERE col2 = 'qrstuvwxyz';
SELECT * FROM mpp21090_defpt_dropcol_addcol_dml_text ORDER BY 1,2,3;
       col1       |       col2       | col3 |       col5       
------------------+------------------+------+------------------
 abcdefghijklmnop | abcdefghijklmnop | a    | 
 abcdefghijklmnop | abcdefghijklmnop | c    | abcdefghijklmnop
 xyz              | xyz              | b    | 
(3 rows)

-- TEST
DROP TABLE IF EXISTS dropped_col_tab;
NOTICE:  table "dropped_col_tab" does not exist, skipping
CREATE TABLE dropped_col_tab(
col1 int,
col2 decimal,
col3 char,
col4 date,
col5 int
) distributed by (col1);
INSERT INTO dropped_col_tab VALUES(0,0.00,'a','2014-01-01',0);
SELECT * FROM dropped_col_tab ORDER BY 1,2,3;
 col1 | col2 | col3 |    col4    | col5 
------+------+------+------------+------
    0 | 0.00 | a    | 2014-01-01 |    0
(1 row)

ALTER TABLE dropped_col_tab DROP COLUMN col1;
NOTICE:  Dropping a column that is part of the distribution policy forces a NULL distribution policy
ALTER TABLE dropped_col_tab DROP COLUMN col2;
ALTER TABLE dropped_col_tab DROP COLUMN col3;
ALTER TABLE dropped_col_tab DROP COLUMN col4;
ALTER TABLE dropped_col_tab DROP COLUMN col5;
INSERT INTO dropped_col_tab SELECT 1;
ERROR:  INSERT has more expressions than target columns
SELECT * FROM dropped_col_tab;
--
(1 row)

-- TEST
DROP TABLE IF EXISTS mpp21090_dropcol_addcol_splitdefpt_dml_char;
NOTICE:  table "mpp21090_dropcol_addcol_splitdefpt_dml_char" does not exist, skipping
CREATE TABLE mpp21090_dropcol_addcol_splitdefpt_dml_char
(
    col1 char,
    col2 char,
    col3 char,
    col4 char
) 
DISTRIBUTED by (col1)
PARTITION BY LIST(col2)
(
default partition def
);
NOTICE:  CREATE TABLE will create partition "mpp21090_dropcol_addcol_splitdefpt_dml_char_1_prt_def" for table "mpp21090_dropcol_addcol_splitdefpt_dml_char"
INSERT INTO mpp21090_dropcol_addcol_splitdefpt_dml_char VALUES('x','x','a','x');
SELECT * FROM mpp21090_dropcol_addcol_splitdefpt_dml_char ORDER BY 1,2,3,4;
 col1 | col2 | col3 | col4 
------+------+------+------
 x    | x    | a    | x
(1 row)

ALTER TABLE mpp21090_dropcol_addcol_splitdefpt_dml_char DROP COLUMN col4;
INSERT INTO mpp21090_dropcol_addcol_splitdefpt_dml_char VALUES('x','x','b');
SELECT * FROM mpp21090_dropcol_addcol_splitdefpt_dml_char ORDER BY 1,2,3;
 col1 | col2 | col3 
------+------+------
 x    | x    | a
 x    | x    | b
(2 rows)

ALTER TABLE mpp21090_dropcol_addcol_splitdefpt_dml_char ADD COLUMN col5 int DEFAULT 10;
INSERT INTO mpp21090_dropcol_addcol_splitdefpt_dml_char VALUES('x','x','c',1);
SELECT * FROM mpp21090_dropcol_addcol_splitdefpt_dml_char ORDER BY 1,2,3,4;
 col1 | col2 | col3 | col5 
------+------+------+------
 x    | x    | a    |   10
 x    | x    | b    |   10
 x    | x    | c    |    1
(3 rows)

ALTER TABLE mpp21090_dropcol_addcol_splitdefpt_dml_char SPLIT DEFAULT PARTITION at ('d') into (partition partsplitone,partition def);
NOTICE:  exchanged partition "def" of relation "mpp21090_dropcol_addcol_splitdefpt_dml_char" with relation "pg_temp_205734"
NOTICE:  dropped partition "def" for relation "mpp21090_dropcol_addcol_splitdefpt_dml_char"
NOTICE:  CREATE TABLE will create partition "mpp21090_dropcol_addcol_splitdefpt_dml_char_1_prt_partsplitone" for table "mpp21090_dropcol_addcol_splitdefpt_dml_char"
NOTICE:  CREATE TABLE will create partition "mpp21090_dropcol_addcol_splitdefpt_dml_char_1_prt_def" for table "mpp21090_dropcol_addcol_splitdefpt_dml_char"
INSERT INTO mpp21090_dropcol_addcol_splitdefpt_dml_char SELECT 'a', 'a','e', 1;
SELECT * FROM mpp21090_dropcol_addcol_splitdefpt_dml_char ORDER BY 1,2,3;
 col1 | col2 | col3 | col5 
------+------+------+------
 a    | a    | e    |    1
 x    | x    | a    |   10
 x    | x    | b    |   10
 x    | x    | c    |    1
(4 rows)

-- Update distribution key
UPDATE mpp21090_dropcol_addcol_splitdefpt_dml_char SET col1 = 'z' WHERE col2 = 'a' AND col1 = 'a';
ERROR:  Cannot parallelize an UPDATE statement that updates the distribution columns
SELECT * FROM mpp21090_dropcol_addcol_splitdefpt_dml_char ORDER BY 1,2,3;
 col1 | col2 | col3 | col5 
------+------+------+------
 a    | a    | e    |    1
 x    | x    | a    |   10
 x    | x    | b    |   10
 x    | x    | c    |    1
(4 rows)

-- Update partition key
UPDATE mpp21090_dropcol_addcol_splitdefpt_dml_char SET col2 = 'z' WHERE col2 = 'a' AND col1 = 'z';
SELECT * FROM mpp21090_dropcol_addcol_splitdefpt_dml_char ORDER BY 1,2,3;
 col1 | col2 | col3 | col5 
------+------+------+------
 a    | a    | e    |    1
 x    | x    | a    |   10
 x    | x    | b    |   10
 x    | x    | c    |    1
(4 rows)

DELETE FROM mpp21090_dropcol_addcol_splitdefpt_dml_char WHERE col3='b';
SELECT * FROM mpp21090_dropcol_addcol_splitdefpt_dml_char ORDER BY 1,2,3;
 col1 | col2 | col3 | col5 
------+------+------+------
 a    | a    | e    |    1
 x    | x    | a    |   10
 x    | x    | c    |    1
(3 rows)

-- TEST
DROP TABLE IF EXISTS mpp21090_dropcol_addcol_splitdefpt_dml_decimal;
NOTICE:  table "mpp21090_dropcol_addcol_splitdefpt_dml_decimal" does not exist, skipping
CREATE TABLE mpp21090_dropcol_addcol_splitdefpt_dml_decimal
(
    col1 decimal,
    col2 decimal,
    col3 char,
    col4 decimal
) 
DISTRIBUTED by (col1)
PARTITION BY LIST(col2)
(
default partition def
);
NOTICE:  CREATE TABLE will create partition "mpp21090_dropcol_addcol_splitdefpt_dml_decimal_1_prt_def" for table "mpp21090_dropcol_addcol_splitdefpt_dml_decimal"
INSERT INTO mpp21090_dropcol_addcol_splitdefpt_dml_decimal VALUES(2.00,2.00,'a',2.00);
SELECT * FROM mpp21090_dropcol_addcol_splitdefpt_dml_decimal ORDER BY 1,2,3,4;
 col1 | col2 | col3 | col4 
------+------+------+------
 2.00 | 2.00 | a    | 2.00
(1 row)

ALTER TABLE mpp21090_dropcol_addcol_splitdefpt_dml_decimal DROP COLUMN col4;
INSERT INTO mpp21090_dropcol_addcol_splitdefpt_dml_decimal VALUES(2.00,2.00,'b');
SELECT * FROM mpp21090_dropcol_addcol_splitdefpt_dml_decimal ORDER BY 1,2,3;
 col1 | col2 | col3 
------+------+------
 2.00 | 2.00 | a
 2.00 | 2.00 | b
(2 rows)

ALTER TABLE mpp21090_dropcol_addcol_splitdefpt_dml_decimal ADD COLUMN col5 int DEFAULT 10;
INSERT INTO mpp21090_dropcol_addcol_splitdefpt_dml_decimal VALUES(2.00,2.00,'c',1);
SELECT * FROM mpp21090_dropcol_addcol_splitdefpt_dml_decimal ORDER BY 1,2,3,4;
 col1 | col2 | col3 | col5 
------+------+------+------
 2.00 | 2.00 | a    |   10
 2.00 | 2.00 | b    |   10
 2.00 | 2.00 | c    |    1
(3 rows)

ALTER TABLE mpp21090_dropcol_addcol_splitdefpt_dml_decimal SPLIT DEFAULT PARTITION at (5.00) into (partition partsplitone,partition def);
NOTICE:  exchanged partition "def" of relation "mpp21090_dropcol_addcol_splitdefpt_dml_decimal" with relation "pg_temp_205886"
NOTICE:  dropped partition "def" for relation "mpp21090_dropcol_addcol_splitdefpt_dml_decimal"
NOTICE:  CREATE TABLE will create partition "mpp21090_dropcol_addcol_splitdefpt_dml_decim_1_prt_partsplitone" for table "mpp21090_dropcol_addcol_splitdefpt_dml_decimal"
NOTICE:  CREATE TABLE will create partition "mpp21090_dropcol_addcol_splitdefpt_dml_decimal_1_prt_def" for table "mpp21090_dropcol_addcol_splitdefpt_dml_decimal"
INSERT INTO mpp21090_dropcol_addcol_splitdefpt_dml_decimal SELECT 1.00, 1.00,'e', 1;
SELECT * FROM mpp21090_dropcol_addcol_splitdefpt_dml_decimal ORDER BY 1,2,3;
 col1 | col2 | col3 | col5 
------+------+------+------
 1.00 | 1.00 | e    |    1
 2.00 | 2.00 | a    |   10
 2.00 | 2.00 | b    |   10
 2.00 | 2.00 | c    |    1
(4 rows)

-- Update distribution key
UPDATE mpp21090_dropcol_addcol_splitdefpt_dml_decimal SET col1 = 35.00 WHERE col2 = 1.00 AND col1 = 1.00;
ERROR:  Cannot parallelize an UPDATE statement that updates the distribution columns
SELECT * FROM mpp21090_dropcol_addcol_splitdefpt_dml_decimal ORDER BY 1,2,3;
 col1 | col2 | col3 | col5 
------+------+------+------
 1.00 | 1.00 | e    |    1
 2.00 | 2.00 | a    |   10
 2.00 | 2.00 | b    |   10
 2.00 | 2.00 | c    |    1
(4 rows)

-- Update partition key
UPDATE mpp21090_dropcol_addcol_splitdefpt_dml_decimal SET col2 = 35.00 WHERE col2 = 1.00 AND col1 = 35.00;
SELECT * FROM mpp21090_dropcol_addcol_splitdefpt_dml_decimal ORDER BY 1,2,3;
 col1 | col2 | col3 | col5 
------+------+------+------
 1.00 | 1.00 | e    |    1
 2.00 | 2.00 | a    |   10
 2.00 | 2.00 | b    |   10
 2.00 | 2.00 | c    |    1
(4 rows)

DELETE FROM mpp21090_dropcol_addcol_splitdefpt_dml_decimal WHERE col3='b';
SELECT * FROM mpp21090_dropcol_addcol_splitdefpt_dml_decimal ORDER BY 1,2,3;
 col1 | col2 | col3 | col5 
------+------+------+------
 1.00 | 1.00 | e    |    1
 2.00 | 2.00 | a    |   10
 2.00 | 2.00 | c    |    1
(3 rows)

-- TEST
DROP TABLE IF EXISTS mpp21090_dropcol_addcol_splitdefpt_dml_int4;
NOTICE:  table "mpp21090_dropcol_addcol_splitdefpt_dml_int4" does not exist, skipping
CREATE TABLE mpp21090_dropcol_addcol_splitdefpt_dml_int4
(
    col1 int4,
    col2 int4,
    col3 char,
    col4 int4
) 
DISTRIBUTED by (col1)
PARTITION BY LIST(col2)
(
default partition def
);
NOTICE:  CREATE TABLE will create partition "mpp21090_dropcol_addcol_splitdefpt_dml_int4_1_prt_def" for table "mpp21090_dropcol_addcol_splitdefpt_dml_int4"
INSERT INTO mpp21090_dropcol_addcol_splitdefpt_dml_int4 VALUES(20000000,20000000,'a',20000000);
SELECT * FROM mpp21090_dropcol_addcol_splitdefpt_dml_int4 ORDER BY 1,2,3,4;
   col1   |   col2   | col3 |   col4   
----------+----------+------+----------
 20000000 | 20000000 | a    | 20000000
(1 row)

ALTER TABLE mpp21090_dropcol_addcol_splitdefpt_dml_int4 DROP COLUMN col4;
INSERT INTO mpp21090_dropcol_addcol_splitdefpt_dml_int4 VALUES(20000000,20000000,'b');
SELECT * FROM mpp21090_dropcol_addcol_splitdefpt_dml_int4 ORDER BY 1,2,3;
   col1   |   col2   | col3 
----------+----------+------
 20000000 | 20000000 | a
 20000000 | 20000000 | b
(2 rows)

ALTER TABLE mpp21090_dropcol_addcol_splitdefpt_dml_int4 ADD COLUMN col5 int DEFAULT 10;
INSERT INTO mpp21090_dropcol_addcol_splitdefpt_dml_int4 VALUES(20000000,20000000,'c',1);
SELECT * FROM mpp21090_dropcol_addcol_splitdefpt_dml_int4 ORDER BY 1,2,3,4;
   col1   |   col2   | col3 | col5 
----------+----------+------+------
 20000000 | 20000000 | a    |   10
 20000000 | 20000000 | b    |   10
 20000000 | 20000000 | c    |    1
(3 rows)

ALTER TABLE mpp21090_dropcol_addcol_splitdefpt_dml_int4 SPLIT DEFAULT PARTITION at (50000000) into (partition partsplitone,partition def);
NOTICE:  exchanged partition "def" of relation "mpp21090_dropcol_addcol_splitdefpt_dml_int4" with relation "pg_temp_206069"
NOTICE:  dropped partition "def" for relation "mpp21090_dropcol_addcol_splitdefpt_dml_int4"
NOTICE:  CREATE TABLE will create partition "mpp21090_dropcol_addcol_splitdefpt_dml_int4_1_prt_partsplitone" for table "mpp21090_dropcol_addcol_splitdefpt_dml_int4"
NOTICE:  CREATE TABLE will create partition "mpp21090_dropcol_addcol_splitdefpt_dml_int4_1_prt_def" for table "mpp21090_dropcol_addcol_splitdefpt_dml_int4"
INSERT INTO mpp21090_dropcol_addcol_splitdefpt_dml_int4 SELECT 10000000, 10000000,'e', 1;
SELECT * FROM mpp21090_dropcol_addcol_splitdefpt_dml_int4 ORDER BY 1,2,3;
   col1   |   col2   | col3 | col5 
----------+----------+------+------
 10000000 | 10000000 | e    |    1
 20000000 | 20000000 | a    |   10
 20000000 | 20000000 | b    |   10
 20000000 | 20000000 | c    |    1
(4 rows)

-- Update distribution key
UPDATE mpp21090_dropcol_addcol_splitdefpt_dml_int4 SET col1 = 35000000 WHERE col2 = 10000000 AND col1 = 10000000;
ERROR:  Cannot parallelize an UPDATE statement that updates the distribution columns
SELECT * FROM mpp21090_dropcol_addcol_splitdefpt_dml_int4 ORDER BY 1,2,3;
   col1   |   col2   | col3 | col5 
----------+----------+------+------
 10000000 | 10000000 | e    |    1
 20000000 | 20000000 | a    |   10
 20000000 | 20000000 | b    |   10
 20000000 | 20000000 | c    |    1
(4 rows)

-- Update partition key
UPDATE mpp21090_dropcol_addcol_splitdefpt_dml_int4 SET col2 = 35000000 WHERE col2 = 10000000 AND col1 = 35000000;
SELECT * FROM mpp21090_dropcol_addcol_splitdefpt_dml_int4 ORDER BY 1,2,3;
   col1   |   col2   | col3 | col5 
----------+----------+------+------
 10000000 | 10000000 | e    |    1
 20000000 | 20000000 | a    |   10
 20000000 | 20000000 | b    |   10
 20000000 | 20000000 | c    |    1
(4 rows)

DELETE FROM mpp21090_dropcol_addcol_splitdefpt_dml_int4 WHERE col3='b';
SELECT * FROM mpp21090_dropcol_addcol_splitdefpt_dml_int4 ORDER BY 1,2,3;
   col1   |   col2   | col3 | col5 
----------+----------+------+------
 10000000 | 10000000 | e    |    1
 20000000 | 20000000 | a    |   10
 20000000 | 20000000 | c    |    1
(3 rows)

-- TEST
DROP TABLE IF EXISTS mpp21090_dropcol_addcol_splitdefpt_dml_int8;
NOTICE:  table "mpp21090_dropcol_addcol_splitdefpt_dml_int8" does not exist, skipping
CREATE TABLE mpp21090_dropcol_addcol_splitdefpt_dml_int8
(
    col1 int8,
    col2 int8,
    col3 char,
    col4 int8
) 
DISTRIBUTED by (col1)
PARTITION BY LIST(col2)
(
default partition def
);
NOTICE:  CREATE TABLE will create partition "mpp21090_dropcol_addcol_splitdefpt_dml_int8_1_prt_def" for table "mpp21090_dropcol_addcol_splitdefpt_dml_int8"
INSERT INTO mpp21090_dropcol_addcol_splitdefpt_dml_int8 VALUES(2000000000000000000,2000000000000000000,'a',2000000000000000000);
SELECT * FROM mpp21090_dropcol_addcol_splitdefpt_dml_int8 ORDER BY 1,2,3,4;
        col1         |        col2         | col3 |        col4         
---------------------+---------------------+------+---------------------
 2000000000000000000 | 2000000000000000000 | a    | 2000000000000000000
(1 row)

ALTER TABLE mpp21090_dropcol_addcol_splitdefpt_dml_int8 DROP COLUMN col4;
INSERT INTO mpp21090_dropcol_addcol_splitdefpt_dml_int8 VALUES(2000000000000000000,2000000000000000000,'b');
SELECT * FROM mpp21090_dropcol_addcol_splitdefpt_dml_int8 ORDER BY 1,2,3;
        col1         |        col2         | col3 
---------------------+---------------------+------
 2000000000000000000 | 2000000000000000000 | a
 2000000000000000000 | 2000000000000000000 | b
(2 rows)

ALTER TABLE mpp21090_dropcol_addcol_splitdefpt_dml_int8 ADD COLUMN col5 int DEFAULT 10;
INSERT INTO mpp21090_dropcol_addcol_splitdefpt_dml_int8 VALUES(2000000000000000000,2000000000000000000,'c',1);
SELECT * FROM mpp21090_dropcol_addcol_splitdefpt_dml_int8 ORDER BY 1,2,3,4;
        col1         |        col2         | col3 | col5 
---------------------+---------------------+------+------
 2000000000000000000 | 2000000000000000000 | a    |   10
 2000000000000000000 | 2000000000000000000 | b    |   10
 2000000000000000000 | 2000000000000000000 | c    |    1
(3 rows)

ALTER TABLE mpp21090_dropcol_addcol_splitdefpt_dml_int8 SPLIT DEFAULT PARTITION at (500000000000000000) into (partition partsplitone,partition def);
NOTICE:  exchanged partition "def" of relation "mpp21090_dropcol_addcol_splitdefpt_dml_int8" with relation "pg_temp_206221"
NOTICE:  dropped partition "def" for relation "mpp21090_dropcol_addcol_splitdefpt_dml_int8"
NOTICE:  CREATE TABLE will create partition "mpp21090_dropcol_addcol_splitdefpt_dml_int8_1_prt_partsplitone" for table "mpp21090_dropcol_addcol_splitdefpt_dml_int8"
NOTICE:  CREATE TABLE will create partition "mpp21090_dropcol_addcol_splitdefpt_dml_int8_1_prt_def" for table "mpp21090_dropcol_addcol_splitdefpt_dml_int8"
INSERT INTO mpp21090_dropcol_addcol_splitdefpt_dml_int8 SELECT 100000000000000000, 100000000000000000,'e', 1;
SELECT * FROM mpp21090_dropcol_addcol_splitdefpt_dml_int8 ORDER BY 1,2,3;
        col1         |        col2         | col3 | col5 
---------------------+---------------------+------+------
  100000000000000000 |  100000000000000000 | e    |    1
 2000000000000000000 | 2000000000000000000 | a    |   10
 2000000000000000000 | 2000000000000000000 | b    |   10
 2000000000000000000 | 2000000000000000000 | c    |    1
(4 rows)

-- Update distribution key
UPDATE mpp21090_dropcol_addcol_splitdefpt_dml_int8 SET col1 = 3500000000000000000 WHERE col2 = 100000000000000000 AND col1 = 100000000000000000;
ERROR:  Cannot parallelize an UPDATE statement that updates the distribution columns
SELECT * FROM mpp21090_dropcol_addcol_splitdefpt_dml_int8 ORDER BY 1,2,3;
        col1         |        col2         | col3 | col5 
---------------------+---------------------+------+------
  100000000000000000 |  100000000000000000 | e    |    1
 2000000000000000000 | 2000000000000000000 | a    |   10
 2000000000000000000 | 2000000000000000000 | b    |   10
 2000000000000000000 | 2000000000000000000 | c    |    1
(4 rows)

-- Update partition key
UPDATE mpp21090_dropcol_addcol_splitdefpt_dml_int8 SET col2 = 3500000000000000000 WHERE col2 = 100000000000000000 AND col1 = 3500000000000000000;
SELECT * FROM mpp21090_dropcol_addcol_splitdefpt_dml_int8 ORDER BY 1,2,3;
        col1         |        col2         | col3 | col5 
---------------------+---------------------+------+------
  100000000000000000 |  100000000000000000 | e    |    1
 2000000000000000000 | 2000000000000000000 | a    |   10
 2000000000000000000 | 2000000000000000000 | b    |   10
 2000000000000000000 | 2000000000000000000 | c    |    1
(4 rows)

DELETE FROM mpp21090_dropcol_addcol_splitdefpt_dml_int8 WHERE col3='b';
SELECT * FROM mpp21090_dropcol_addcol_splitdefpt_dml_int8 ORDER BY 1,2,3;
        col1         |        col2         | col3 | col5 
---------------------+---------------------+------+------
  100000000000000000 |  100000000000000000 | e    |    1
 2000000000000000000 | 2000000000000000000 | a    |   10
 2000000000000000000 | 2000000000000000000 | c    |    1
(3 rows)

-- TEST
DROP TABLE IF EXISTS mpp21090_dropcol_addcol_splitdefpt_dml_interval;
NOTICE:  table "mpp21090_dropcol_addcol_splitdefpt_dml_interval" does not exist, skipping
CREATE TABLE mpp21090_dropcol_addcol_splitdefpt_dml_interval
(
    col1 interval,
    col2 interval,
    col3 char,
    col4 interval
) 
DISTRIBUTED by (col1)
PARTITION BY LIST(col2)
(
default partition def
);
NOTICE:  CREATE TABLE will create partition "mpp21090_dropcol_addcol_splitdefpt_dml_interval_1_prt_def" for table "mpp21090_dropcol_addcol_splitdefpt_dml_interval"
INSERT INTO mpp21090_dropcol_addcol_splitdefpt_dml_interval VALUES('1 hour','1 hour','a','1 hour');
SELECT * FROM mpp21090_dropcol_addcol_splitdefpt_dml_interval ORDER BY 1,2,3,4;
   col1   |   col2   | col3 |   col4   
----------+----------+------+----------
 01:00:00 | 01:00:00 | a    | 01:00:00
(1 row)

ALTER TABLE mpp21090_dropcol_addcol_splitdefpt_dml_interval DROP COLUMN col4;
INSERT INTO mpp21090_dropcol_addcol_splitdefpt_dml_interval VALUES('1 hour','1 hour','b');
SELECT * FROM mpp21090_dropcol_addcol_splitdefpt_dml_interval ORDER BY 1,2,3;
   col1   |   col2   | col3 
----------+----------+------
 01:00:00 | 01:00:00 | a
 01:00:00 | 01:00:00 | b
(2 rows)

ALTER TABLE mpp21090_dropcol_addcol_splitdefpt_dml_interval ADD COLUMN col5 int DEFAULT 10;
INSERT INTO mpp21090_dropcol_addcol_splitdefpt_dml_interval VALUES('1 hour','1 hour','c',1);
SELECT * FROM mpp21090_dropcol_addcol_splitdefpt_dml_interval ORDER BY 1,2,3,4;
   col1   |   col2   | col3 | col5 
----------+----------+------+------
 01:00:00 | 01:00:00 | a    |   10
 01:00:00 | 01:00:00 | b    |   10
 01:00:00 | 01:00:00 | c    |    1
(3 rows)

ALTER TABLE mpp21090_dropcol_addcol_splitdefpt_dml_interval SPLIT DEFAULT PARTITION at ('30 secs') into (partition partsplitone,partition def);
NOTICE:  exchanged partition "def" of relation "mpp21090_dropcol_addcol_splitdefpt_dml_interval" with relation "pg_temp_206373"
NOTICE:  dropped partition "def" for relation "mpp21090_dropcol_addcol_splitdefpt_dml_interval"
NOTICE:  CREATE TABLE will create partition "mpp21090_dropcol_addcol_splitdefpt_dml_inter_1_prt_partsplitone" for table "mpp21090_dropcol_addcol_splitdefpt_dml_interval"
NOTICE:  CREATE TABLE will create partition "mpp21090_dropcol_addcol_splitdefpt_dml_interval_1_prt_def" for table "mpp21090_dropcol_addcol_splitdefpt_dml_interval"
INSERT INTO mpp21090_dropcol_addcol_splitdefpt_dml_interval SELECT '1 sec', '1 sec','e', 1;
SELECT * FROM mpp21090_dropcol_addcol_splitdefpt_dml_interval ORDER BY 1,2,3;
   col1   |   col2   | col3 | col5 
----------+----------+------+------
 00:00:01 | 00:00:01 | e    |    1
 01:00:00 | 01:00:00 | a    |   10
 01:00:00 | 01:00:00 | b    |   10
 01:00:00 | 01:00:00 | c    |    1
(4 rows)

-- Update distribution key
UPDATE mpp21090_dropcol_addcol_splitdefpt_dml_interval SET col1 = '14 hours' WHERE col2 = '1 sec' AND col1 = '1 sec';
ERROR:  Cannot parallelize an UPDATE statement that updates the distribution columns
SELECT * FROM mpp21090_dropcol_addcol_splitdefpt_dml_interval ORDER BY 1,2,3;
   col1   |   col2   | col3 | col5 
----------+----------+------+------
 00:00:01 | 00:00:01 | e    |    1
 01:00:00 | 01:00:00 | a    |   10
 01:00:00 | 01:00:00 | b    |   10
 01:00:00 | 01:00:00 | c    |    1
(4 rows)

-- Update partition key
UPDATE mpp21090_dropcol_addcol_splitdefpt_dml_interval SET col2 = '14 hours' WHERE col2 = '1 sec' AND col1 = '14 hours';
SELECT * FROM mpp21090_dropcol_addcol_splitdefpt_dml_interval ORDER BY 1,2,3;
   col1   |   col2   | col3 | col5 
----------+----------+------+------
 00:00:01 | 00:00:01 | e    |    1
 01:00:00 | 01:00:00 | a    |   10
 01:00:00 | 01:00:00 | b    |   10
 01:00:00 | 01:00:00 | c    |    1
(4 rows)

DELETE FROM mpp21090_dropcol_addcol_splitdefpt_dml_interval WHERE col3='b';
SELECT * FROM mpp21090_dropcol_addcol_splitdefpt_dml_interval ORDER BY 1,2,3;
   col1   |   col2   | col3 | col5 
----------+----------+------+------
 00:00:01 | 00:00:01 | e    |    1
 01:00:00 | 01:00:00 | a    |   10
 01:00:00 | 01:00:00 | c    |    1
(3 rows)

-- TEST
DROP TABLE IF EXISTS mpp21090_dropcol_addcol_splitdefpt_dml_numeric;
NOTICE:  table "mpp21090_dropcol_addcol_splitdefpt_dml_numeric" does not exist, skipping
CREATE TABLE mpp21090_dropcol_addcol_splitdefpt_dml_numeric
(
    col1 numeric,
    col2 numeric,
    col3 char,
    col4 numeric
) 
DISTRIBUTED by (col1)
PARTITION BY LIST(col2)
(
default partition def
);
NOTICE:  CREATE TABLE will create partition "mpp21090_dropcol_addcol_splitdefpt_dml_numeric_1_prt_def" for table "mpp21090_dropcol_addcol_splitdefpt_dml_numeric"
INSERT INTO mpp21090_dropcol_addcol_splitdefpt_dml_numeric VALUES(2.000000,2.000000,'a',2.000000);
SELECT * FROM mpp21090_dropcol_addcol_splitdefpt_dml_numeric ORDER BY 1,2,3,4;
   col1   |   col2   | col3 |   col4   
----------+----------+------+----------
 2.000000 | 2.000000 | a    | 2.000000
(1 row)

ALTER TABLE mpp21090_dropcol_addcol_splitdefpt_dml_numeric DROP COLUMN col4;
INSERT INTO mpp21090_dropcol_addcol_splitdefpt_dml_numeric VALUES(2.000000,2.000000,'b');
SELECT * FROM mpp21090_dropcol_addcol_splitdefpt_dml_numeric ORDER BY 1,2,3;
   col1   |   col2   | col3 
----------+----------+------
 2.000000 | 2.000000 | a
 2.000000 | 2.000000 | b
(2 rows)

ALTER TABLE mpp21090_dropcol_addcol_splitdefpt_dml_numeric ADD COLUMN col5 int DEFAULT 10;
INSERT INTO mpp21090_dropcol_addcol_splitdefpt_dml_numeric VALUES(2.000000,2.000000,'c',1);
SELECT * FROM mpp21090_dropcol_addcol_splitdefpt_dml_numeric ORDER BY 1,2,3,4;
   col1   |   col2   | col3 | col5 
----------+----------+------+------
 2.000000 | 2.000000 | a    |   10
 2.000000 | 2.000000 | b    |   10
 2.000000 | 2.000000 | c    |    1
(3 rows)

ALTER TABLE mpp21090_dropcol_addcol_splitdefpt_dml_numeric SPLIT DEFAULT PARTITION at (5.000000) into (partition partsplitone,partition def);
NOTICE:  exchanged partition "def" of relation "mpp21090_dropcol_addcol_splitdefpt_dml_numeric" with relation "pg_temp_206525"
NOTICE:  dropped partition "def" for relation "mpp21090_dropcol_addcol_splitdefpt_dml_numeric"
NOTICE:  CREATE TABLE will create partition "mpp21090_dropcol_addcol_splitdefpt_dml_numer_1_prt_partsplitone" for table "mpp21090_dropcol_addcol_splitdefpt_dml_numeric"
NOTICE:  CREATE TABLE will create partition "mpp21090_dropcol_addcol_splitdefpt_dml_numeric_1_prt_def" for table "mpp21090_dropcol_addcol_splitdefpt_dml_numeric"
INSERT INTO mpp21090_dropcol_addcol_splitdefpt_dml_numeric SELECT 1.000000, 1.000000,'e', 1;
SELECT * FROM mpp21090_dropcol_addcol_splitdefpt_dml_numeric ORDER BY 1,2,3;
   col1   |   col2   | col3 | col5 
----------+----------+------+------
 1.000000 | 1.000000 | e    |    1
 2.000000 | 2.000000 | a    |   10
 2.000000 | 2.000000 | b    |   10
 2.000000 | 2.000000 | c    |    1
(4 rows)

-- Update distribution key
UPDATE mpp21090_dropcol_addcol_splitdefpt_dml_numeric SET col1 = 35.000000 WHERE col2 = 1.000000 AND col1 = 1.000000;
ERROR:  Cannot parallelize an UPDATE statement that updates the distribution columns
SELECT * FROM mpp21090_dropcol_addcol_splitdefpt_dml_numeric ORDER BY 1,2,3;
   col1   |   col2   | col3 | col5 
----------+----------+------+------
 1.000000 | 1.000000 | e    |    1
 2.000000 | 2.000000 | a    |   10
 2.000000 | 2.000000 | b    |   10
 2.000000 | 2.000000 | c    |    1
(4 rows)

-- Update partition key
UPDATE mpp21090_dropcol_addcol_splitdefpt_dml_numeric SET col2 = 35.000000 WHERE col2 = 1.000000 AND col1 = 35.000000;
SELECT * FROM mpp21090_dropcol_addcol_splitdefpt_dml_numeric ORDER BY 1,2,3;
   col1   |   col2   | col3 | col5 
----------+----------+------+------
 1.000000 | 1.000000 | e    |    1
 2.000000 | 2.000000 | a    |   10
 2.000000 | 2.000000 | b    |   10
 2.000000 | 2.000000 | c    |    1
(4 rows)

DELETE FROM mpp21090_dropcol_addcol_splitdefpt_dml_numeric WHERE col3='b';
SELECT * FROM mpp21090_dropcol_addcol_splitdefpt_dml_numeric ORDER BY 1,2,3;
   col1   |   col2   | col3 | col5 
----------+----------+------+------
 1.000000 | 1.000000 | e    |    1
 2.000000 | 2.000000 | a    |   10
 2.000000 | 2.000000 | c    |    1
(3 rows)

-- TEST
DROP TABLE IF EXISTS mpp21090_dropcol_addcol_splitpt_dml_char;
NOTICE:  table "mpp21090_dropcol_addcol_splitpt_dml_char" does not exist, skipping
CREATE TABLE mpp21090_dropcol_addcol_splitpt_dml_char
(
    col1 char,
    col2 char,
    col3 char,
    col4 char
) 
DISTRIBUTED by (col1)
PARTITION BY LIST(col2)(partition partone VALUES('a','b','c','d','e','f','g','h') WITH (APPENDONLY=true, COMPRESSLEVEL=5, ORIENTATION=column),partition parttwo VALUES('i','j','k','l','m','n','o','p') WITH (APPENDONLY=true, COMPRESSLEVEL=5, ORIENTATION=row),partition partthree VALUES('q','r','s','t','u','v','w','x'));
NOTICE:  CREATE TABLE will create partition "mpp21090_dropcol_addcol_splitpt_dml_char_1_prt_partone" for table "mpp21090_dropcol_addcol_splitpt_dml_char"
NOTICE:  CREATE TABLE will create partition "mpp21090_dropcol_addcol_splitpt_dml_char_1_prt_parttwo" for table "mpp21090_dropcol_addcol_splitpt_dml_char"
NOTICE:  CREATE TABLE will create partition "mpp21090_dropcol_addcol_splitpt_dml_char_1_prt_partthree" for table "mpp21090_dropcol_addcol_splitpt_dml_char"
INSERT INTO mpp21090_dropcol_addcol_splitpt_dml_char VALUES('x','x','a','x');
SELECT * FROM mpp21090_dropcol_addcol_splitpt_dml_char ORDER BY 1,2,3,4;
 col1 | col2 | col3 | col4 
------+------+------+------
 x    | x    | a    | x
(1 row)

ALTER TABLE mpp21090_dropcol_addcol_splitpt_dml_char ADD COLUMN col5 int DEFAULT 10;
INSERT INTO mpp21090_dropcol_addcol_splitpt_dml_char VALUES('x','x','b','x',0);
SELECT * FROM mpp21090_dropcol_addcol_splitpt_dml_char ORDER BY 1,2,3,4;
 col1 | col2 | col3 | col4 | col5 
------+------+------+------+------
 x    | x    | a    | x    |   10
 x    | x    | b    | x    |    0
(2 rows)

ALTER TABLE mpp21090_dropcol_addcol_splitpt_dml_char DROP COLUMN col4;
INSERT INTO mpp21090_dropcol_addcol_splitpt_dml_char VALUES('x','x','c',1);
SELECT * FROM mpp21090_dropcol_addcol_splitpt_dml_char ORDER BY 1,2,3,4;
 col1 | col2 | col3 | col5 
------+------+------+------
 x    | x    | a    |   10
 x    | x    | b    |    0
 x    | x    | c    |    1
(3 rows)

ALTER TABLE mpp21090_dropcol_addcol_splitpt_dml_char SPLIT PARTITION partone at ('d') into (partition partsplitone,partition partsplitwo);
NOTICE:  exchanged partition "partone" of relation "mpp21090_dropcol_addcol_splitpt_dml_char" with relation "pg_temp_206708"
NOTICE:  dropped partition "partone" for relation "mpp21090_dropcol_addcol_splitpt_dml_char"
NOTICE:  CREATE TABLE will create partition "mpp21090_dropcol_addcol_splitpt_dml_char_1_prt_partsplitone" for table "mpp21090_dropcol_addcol_splitpt_dml_char"
NOTICE:  CREATE TABLE will create partition "mpp21090_dropcol_addcol_splitpt_dml_char_1_prt_partsplitwo" for table "mpp21090_dropcol_addcol_splitpt_dml_char"
INSERT INTO mpp21090_dropcol_addcol_splitpt_dml_char SELECT 'a', 'a','d', 1;
SELECT * FROM mpp21090_dropcol_addcol_splitpt_dml_char ORDER BY 1,2,3;
 col1 | col2 | col3 | col5 
------+------+------+------
 a    | a    | d    |    1
 x    | x    | a    |   10
 x    | x    | b    |    0
 x    | x    | c    |    1
(4 rows)

-- Update distribution key
UPDATE mpp21090_dropcol_addcol_splitpt_dml_char SET col1 = 'z' WHERE col2 = 'a' AND col1 = 'a';
ERROR:  Cannot parallelize an UPDATE statement that updates the distribution columns
SELECT * FROM mpp21090_dropcol_addcol_splitpt_dml_char ORDER BY 1,2,3;
 col1 | col2 | col3 | col5 
------+------+------+------
 a    | a    | d    |    1
 x    | x    | a    |   10
 x    | x    | b    |    0
 x    | x    | c    |    1
(4 rows)

-- Update partition key
UPDATE mpp21090_dropcol_addcol_splitpt_dml_char SET col2 ='x'  WHERE col2 = 'a' AND col1 = 'z';
SELECT * FROM mpp21090_dropcol_addcol_splitpt_dml_char ORDER BY 1,2,3;
 col1 | col2 | col3 | col5 
------+------+------+------
 a    | a    | d    |    1
 x    | x    | a    |   10
 x    | x    | b    |    0
 x    | x    | c    |    1
(4 rows)

DELETE FROM mpp21090_dropcol_addcol_splitpt_dml_char WHERE col3='b';
SELECT * FROM mpp21090_dropcol_addcol_splitpt_dml_char ORDER BY 1,2,3;
 col1 | col2 | col3 | col5 
------+------+------+------
 a    | a    | d    |    1
 x    | x    | a    |   10
 x    | x    | c    |    1
(3 rows)

-- TEST
DROP TABLE IF EXISTS mpp21090_dropcol_addcol_splitpt_dml_decimal;
NOTICE:  table "mpp21090_dropcol_addcol_splitpt_dml_decimal" does not exist, skipping
CREATE TABLE mpp21090_dropcol_addcol_splitpt_dml_decimal
(
    col1 decimal,
    col2 decimal,
    col3 char,
    col4 decimal
) 
DISTRIBUTED by (col1)
PARTITION BY RANGE(col2)(partition partone start(1.00) end(10.00)  WITH (APPENDONLY=true, COMPRESSLEVEL=5, ORIENTATION=column),partition parttwo start(10.00) end(20.00) WITH (APPENDONLY=true, COMPRESSLEVEL=5, ORIENTATION=row),partition partthree start(20.00) end(30.00));
NOTICE:  CREATE TABLE will create partition "mpp21090_dropcol_addcol_splitpt_dml_decimal_1_prt_partone" for table "mpp21090_dropcol_addcol_splitpt_dml_decimal"
NOTICE:  CREATE TABLE will create partition "mpp21090_dropcol_addcol_splitpt_dml_decimal_1_prt_parttwo" for table "mpp21090_dropcol_addcol_splitpt_dml_decimal"
NOTICE:  CREATE TABLE will create partition "mpp21090_dropcol_addcol_splitpt_dml_decimal_1_prt_partthree" for table "mpp21090_dropcol_addcol_splitpt_dml_decimal"
INSERT INTO mpp21090_dropcol_addcol_splitpt_dml_decimal VALUES(2.00,2.00,'a',2.00);
SELECT * FROM mpp21090_dropcol_addcol_splitpt_dml_decimal ORDER BY 1,2,3,4;
 col1 | col2 | col3 | col4 
------+------+------+------
 2.00 | 2.00 | a    | 2.00
(1 row)

ALTER TABLE mpp21090_dropcol_addcol_splitpt_dml_decimal ADD COLUMN col5 int DEFAULT 10;
INSERT INTO mpp21090_dropcol_addcol_splitpt_dml_decimal VALUES(2.00,2.00,'b',2.00,0);
SELECT * FROM mpp21090_dropcol_addcol_splitpt_dml_decimal ORDER BY 1,2,3,4;
 col1 | col2 | col3 | col4 | col5 
------+------+------+------+------
 2.00 | 2.00 | a    | 2.00 |   10
 2.00 | 2.00 | b    | 2.00 |    0
(2 rows)

ALTER TABLE mpp21090_dropcol_addcol_splitpt_dml_decimal DROP COLUMN col4;
INSERT INTO mpp21090_dropcol_addcol_splitpt_dml_decimal VALUES(2.00,2.00,'c',1);
SELECT * FROM mpp21090_dropcol_addcol_splitpt_dml_decimal ORDER BY 1,2,3,4;
 col1 | col2 | col3 | col5 
------+------+------+------
 2.00 | 2.00 | a    |   10
 2.00 | 2.00 | b    |    0
 2.00 | 2.00 | c    |    1
(3 rows)

ALTER TABLE mpp21090_dropcol_addcol_splitpt_dml_decimal SPLIT PARTITION partone at (5.00) into (partition partsplitone,partition partsplitwo);
NOTICE:  exchanged partition "partone" of relation "mpp21090_dropcol_addcol_splitpt_dml_decimal" with relation "pg_temp_206952"
NOTICE:  dropped partition "partone" for relation "mpp21090_dropcol_addcol_splitpt_dml_decimal"
NOTICE:  CREATE TABLE will create partition "mpp21090_dropcol_addcol_splitpt_dml_decimal_1_prt_partsplitone" for table "mpp21090_dropcol_addcol_splitpt_dml_decimal"
NOTICE:  CREATE TABLE will create partition "mpp21090_dropcol_addcol_splitpt_dml_decimal_1_prt_partsplitwo" for table "mpp21090_dropcol_addcol_splitpt_dml_decimal"
INSERT INTO mpp21090_dropcol_addcol_splitpt_dml_decimal SELECT 1.00, 1.00,'d', 1;
SELECT * FROM mpp21090_dropcol_addcol_splitpt_dml_decimal ORDER BY 1,2,3;
 col1 | col2 | col3 | col5 
------+------+------+------
 1.00 | 1.00 | d    |    1
 2.00 | 2.00 | a    |   10
 2.00 | 2.00 | b    |    0
 2.00 | 2.00 | c    |    1
(4 rows)

-- Update distribution key
UPDATE mpp21090_dropcol_addcol_splitpt_dml_decimal SET col1 = 35.00 WHERE col2 = 1.00 AND col1 = 1.00;
ERROR:  Cannot parallelize an UPDATE statement that updates the distribution columns
SELECT * FROM mpp21090_dropcol_addcol_splitpt_dml_decimal ORDER BY 1,2,3;
 col1 | col2 | col3 | col5 
------+------+------+------
 1.00 | 1.00 | d    |    1
 2.00 | 2.00 | a    |   10
 2.00 | 2.00 | b    |    0
 2.00 | 2.00 | c    |    1
(4 rows)

-- Update partition key
UPDATE mpp21090_dropcol_addcol_splitpt_dml_decimal SET col2 =2.00  WHERE col2 = 1.00 AND col1 = 35.00;
SELECT * FROM mpp21090_dropcol_addcol_splitpt_dml_decimal ORDER BY 1,2,3;
 col1 | col2 | col3 | col5 
------+------+------+------
 1.00 | 1.00 | d    |    1
 2.00 | 2.00 | a    |   10
 2.00 | 2.00 | b    |    0
 2.00 | 2.00 | c    |    1
(4 rows)

DELETE FROM mpp21090_dropcol_addcol_splitpt_dml_decimal WHERE col3='b';
SELECT * FROM mpp21090_dropcol_addcol_splitpt_dml_decimal ORDER BY 1,2,3;
 col1 | col2 | col3 | col5 
------+------+------+------
 1.00 | 1.00 | d    |    1
 2.00 | 2.00 | a    |   10
 2.00 | 2.00 | c    |    1
(3 rows)

-- TEST
DROP TABLE IF EXISTS mpp21090_dropcol_addcol_splitpt_dml_int4;
NOTICE:  table "mpp21090_dropcol_addcol_splitpt_dml_int4" does not exist, skipping
CREATE TABLE mpp21090_dropcol_addcol_splitpt_dml_int4
(
    col1 int4,
    col2 int4,
    col3 char,
    col4 int4
) 
DISTRIBUTED by (col1)
PARTITION BY RANGE(col2)(partition partone start(1) end(100000001)  WITH (APPENDONLY=true, COMPRESSLEVEL=5, ORIENTATION=column),partition parttwo start(100000001) end(200000001) WITH (APPENDONLY=true, COMPRESSLEVEL=5, ORIENTATION=row),partition partthree start(200000001) end(300000001));
NOTICE:  CREATE TABLE will create partition "mpp21090_dropcol_addcol_splitpt_dml_int4_1_prt_partone" for table "mpp21090_dropcol_addcol_splitpt_dml_int4"
NOTICE:  CREATE TABLE will create partition "mpp21090_dropcol_addcol_splitpt_dml_int4_1_prt_parttwo" for table "mpp21090_dropcol_addcol_splitpt_dml_int4"
NOTICE:  CREATE TABLE will create partition "mpp21090_dropcol_addcol_splitpt_dml_int4_1_prt_partthree" for table "mpp21090_dropcol_addcol_splitpt_dml_int4"
INSERT INTO mpp21090_dropcol_addcol_splitpt_dml_int4 VALUES(20000000,20000000,'a',20000000);
SELECT * FROM mpp21090_dropcol_addcol_splitpt_dml_int4 ORDER BY 1,2,3,4;
   col1   |   col2   | col3 |   col4   
----------+----------+------+----------
 20000000 | 20000000 | a    | 20000000
(1 row)

ALTER TABLE mpp21090_dropcol_addcol_splitpt_dml_int4 ADD COLUMN col5 int DEFAULT 10;
INSERT INTO mpp21090_dropcol_addcol_splitpt_dml_int4 VALUES(20000000,20000000,'b',20000000,0);
SELECT * FROM mpp21090_dropcol_addcol_splitpt_dml_int4 ORDER BY 1,2,3,4;
   col1   |   col2   | col3 |   col4   | col5 
----------+----------+------+----------+------
 20000000 | 20000000 | a    | 20000000 |   10
 20000000 | 20000000 | b    | 20000000 |    0
(2 rows)

ALTER TABLE mpp21090_dropcol_addcol_splitpt_dml_int4 DROP COLUMN col4;
INSERT INTO mpp21090_dropcol_addcol_splitpt_dml_int4 VALUES(20000000,20000000,'c',1);
SELECT * FROM mpp21090_dropcol_addcol_splitpt_dml_int4 ORDER BY 1,2,3,4;
   col1   |   col2   | col3 | col5 
----------+----------+------+------
 20000000 | 20000000 | a    |   10
 20000000 | 20000000 | b    |    0
 20000000 | 20000000 | c    |    1
(3 rows)

ALTER TABLE mpp21090_dropcol_addcol_splitpt_dml_int4 SPLIT PARTITION partone at (50000000) into (partition partsplitone,partition partsplitwo);
NOTICE:  exchanged partition "partone" of relation "mpp21090_dropcol_addcol_splitpt_dml_int4" with relation "pg_temp_207232"
NOTICE:  dropped partition "partone" for relation "mpp21090_dropcol_addcol_splitpt_dml_int4"
NOTICE:  CREATE TABLE will create partition "mpp21090_dropcol_addcol_splitpt_dml_int4_1_prt_partsplitone" for table "mpp21090_dropcol_addcol_splitpt_dml_int4"
NOTICE:  CREATE TABLE will create partition "mpp21090_dropcol_addcol_splitpt_dml_int4_1_prt_partsplitwo" for table "mpp21090_dropcol_addcol_splitpt_dml_int4"
INSERT INTO mpp21090_dropcol_addcol_splitpt_dml_int4 SELECT 10000000, 10000000,'d', 1;
SELECT * FROM mpp21090_dropcol_addcol_splitpt_dml_int4 ORDER BY 1,2,3;
   col1   |   col2   | col3 | col5 
----------+----------+------+------
 10000000 | 10000000 | d    |    1
 20000000 | 20000000 | a    |   10
 20000000 | 20000000 | b    |    0
 20000000 | 20000000 | c    |    1
(4 rows)

-- Update distribution key
UPDATE mpp21090_dropcol_addcol_splitpt_dml_int4 SET col1 = 35000000 WHERE col2 = 10000000 AND col1 = 10000000;
ERROR:  Cannot parallelize an UPDATE statement that updates the distribution columns
SELECT * FROM mpp21090_dropcol_addcol_splitpt_dml_int4 ORDER BY 1,2,3;
   col1   |   col2   | col3 | col5 
----------+----------+------+------
 10000000 | 10000000 | d    |    1
 20000000 | 20000000 | a    |   10
 20000000 | 20000000 | b    |    0
 20000000 | 20000000 | c    |    1
(4 rows)

-- Update partition key
UPDATE mpp21090_dropcol_addcol_splitpt_dml_int4 SET col2 =20000000  WHERE col2 = 10000000 AND col1 = 35000000;
SELECT * FROM mpp21090_dropcol_addcol_splitpt_dml_int4 ORDER BY 1,2,3;
   col1   |   col2   | col3 | col5 
----------+----------+------+------
 10000000 | 10000000 | d    |    1
 20000000 | 20000000 | a    |   10
 20000000 | 20000000 | b    |    0
 20000000 | 20000000 | c    |    1
(4 rows)

DELETE FROM mpp21090_dropcol_addcol_splitpt_dml_int4 WHERE col3='b';
SELECT * FROM mpp21090_dropcol_addcol_splitpt_dml_int4 ORDER BY 1,2,3;
   col1   |   col2   | col3 | col5 
----------+----------+------+------
 10000000 | 10000000 | d    |    1
 20000000 | 20000000 | a    |   10
 20000000 | 20000000 | c    |    1
(3 rows)

-- TEST
DROP TABLE IF EXISTS mpp21090_dropcol_addcol_splitpt_dml_int8;
NOTICE:  table "mpp21090_dropcol_addcol_splitpt_dml_int8" does not exist, skipping
CREATE TABLE mpp21090_dropcol_addcol_splitpt_dml_int8
(
    col1 int8,
    col2 int8,
    col3 char,
    col4 int8
) 
DISTRIBUTED by (col1)
PARTITION BY RANGE(col2)(partition partone start(1) end(1000000000000000001)  WITH (APPENDONLY=true, COMPRESSLEVEL=5, ORIENTATION=column),partition parttwo start(1000000000000000001) end(2000000000000000001) WITH (APPENDONLY=true, COMPRESSLEVEL=5, ORIENTATION=row),partition partthree start(2000000000000000001) end(3000000000000000001));
NOTICE:  CREATE TABLE will create partition "mpp21090_dropcol_addcol_splitpt_dml_int8_1_prt_partone" for table "mpp21090_dropcol_addcol_splitpt_dml_int8"
NOTICE:  CREATE TABLE will create partition "mpp21090_dropcol_addcol_splitpt_dml_int8_1_prt_parttwo" for table "mpp21090_dropcol_addcol_splitpt_dml_int8"
NOTICE:  CREATE TABLE will create partition "mpp21090_dropcol_addcol_splitpt_dml_int8_1_prt_partthree" for table "mpp21090_dropcol_addcol_splitpt_dml_int8"
INSERT INTO mpp21090_dropcol_addcol_splitpt_dml_int8 VALUES(2000000000000000000,2000000000000000000,'a',2000000000000000000);
SELECT * FROM mpp21090_dropcol_addcol_splitpt_dml_int8 ORDER BY 1,2,3,4;
        col1         |        col2         | col3 |        col4         
---------------------+---------------------+------+---------------------
 2000000000000000000 | 2000000000000000000 | a    | 2000000000000000000
(1 row)

ALTER TABLE mpp21090_dropcol_addcol_splitpt_dml_int8 ADD COLUMN col5 int DEFAULT 10;
INSERT INTO mpp21090_dropcol_addcol_splitpt_dml_int8 VALUES(2000000000000000000,2000000000000000000,'b',2000000000000000000,0);
SELECT * FROM mpp21090_dropcol_addcol_splitpt_dml_int8 ORDER BY 1,2,3,4;
        col1         |        col2         | col3 |        col4         | col5 
---------------------+---------------------+------+---------------------+------
 2000000000000000000 | 2000000000000000000 | a    | 2000000000000000000 |   10
 2000000000000000000 | 2000000000000000000 | b    | 2000000000000000000 |    0
(2 rows)

ALTER TABLE mpp21090_dropcol_addcol_splitpt_dml_int8 DROP COLUMN col4;
INSERT INTO mpp21090_dropcol_addcol_splitpt_dml_int8 VALUES(2000000000000000000,2000000000000000000,'c',1);
SELECT * FROM mpp21090_dropcol_addcol_splitpt_dml_int8 ORDER BY 1,2,3,4;
        col1         |        col2         | col3 | col5 
---------------------+---------------------+------+------
 2000000000000000000 | 2000000000000000000 | a    |   10
 2000000000000000000 | 2000000000000000000 | b    |    0
 2000000000000000000 | 2000000000000000000 | c    |    1
(3 rows)

ALTER TABLE mpp21090_dropcol_addcol_splitpt_dml_int8 SPLIT PARTITION partone at (500000000000000000) into (partition partsplitone,partition partsplitwo);
NOTICE:  exchanged partition "partone" of relation "mpp21090_dropcol_addcol_splitpt_dml_int8" with relation "pg_temp_207476"
NOTICE:  dropped partition "partone" for relation "mpp21090_dropcol_addcol_splitpt_dml_int8"
NOTICE:  CREATE TABLE will create partition "mpp21090_dropcol_addcol_splitpt_dml_int8_1_prt_partsplitone" for table "mpp21090_dropcol_addcol_splitpt_dml_int8"
NOTICE:  CREATE TABLE will create partition "mpp21090_dropcol_addcol_splitpt_dml_int8_1_prt_partsplitwo" for table "mpp21090_dropcol_addcol_splitpt_dml_int8"
INSERT INTO mpp21090_dropcol_addcol_splitpt_dml_int8 SELECT 100000000000000000, 100000000000000000,'d', 1;
SELECT * FROM mpp21090_dropcol_addcol_splitpt_dml_int8 ORDER BY 1,2,3;
        col1         |        col2         | col3 | col5 
---------------------+---------------------+------+------
  100000000000000000 |  100000000000000000 | d    |    1
 2000000000000000000 | 2000000000000000000 | a    |   10
 2000000000000000000 | 2000000000000000000 | b    |    0
 2000000000000000000 | 2000000000000000000 | c    |    1
(4 rows)

-- Update distribution key
UPDATE mpp21090_dropcol_addcol_splitpt_dml_int8 SET col1 = 3500000000000000000 WHERE col2 = 100000000000000000 AND col1 = 100000000000000000;
ERROR:  Cannot parallelize an UPDATE statement that updates the distribution columns
SELECT * FROM mpp21090_dropcol_addcol_splitpt_dml_int8 ORDER BY 1,2,3;
        col1         |        col2         | col3 | col5 
---------------------+---------------------+------+------
  100000000000000000 |  100000000000000000 | d    |    1
 2000000000000000000 | 2000000000000000000 | a    |   10
 2000000000000000000 | 2000000000000000000 | b    |    0
 2000000000000000000 | 2000000000000000000 | c    |    1
(4 rows)

-- Update partition key
UPDATE mpp21090_dropcol_addcol_splitpt_dml_int8 SET col2 =2000000000000000000  WHERE col2 = 100000000000000000 AND col1 = 3500000000000000000;
SELECT * FROM mpp21090_dropcol_addcol_splitpt_dml_int8 ORDER BY 1,2,3;
        col1         |        col2         | col3 | col5 
---------------------+---------------------+------+------
  100000000000000000 |  100000000000000000 | d    |    1
 2000000000000000000 | 2000000000000000000 | a    |   10
 2000000000000000000 | 2000000000000000000 | b    |    0
 2000000000000000000 | 2000000000000000000 | c    |    1
(4 rows)

DELETE FROM mpp21090_dropcol_addcol_splitpt_dml_int8 WHERE col3='b';
SELECT * FROM mpp21090_dropcol_addcol_splitpt_dml_int8 ORDER BY 1,2,3;
        col1         |        col2         | col3 | col5 
---------------------+---------------------+------+------
  100000000000000000 |  100000000000000000 | d    |    1
 2000000000000000000 | 2000000000000000000 | a    |   10
 2000000000000000000 | 2000000000000000000 | c    |    1
(3 rows)

-- TEST
DROP TABLE IF EXISTS mpp21090_dropcol_addcol_splitpt_dml_interval;
NOTICE:  table "mpp21090_dropcol_addcol_splitpt_dml_interval" does not exist, skipping
CREATE TABLE mpp21090_dropcol_addcol_splitpt_dml_interval
(
    col1 interval,
    col2 interval,
    col3 char,
    col4 interval
) 
DISTRIBUTED by (col1)
PARTITION BY RANGE(col2)(partition partone start('1 sec') end('1 min')  WITH (APPENDONLY=true, COMPRESSLEVEL=5, ORIENTATION=column),partition parttwo start('1 min') end('1 hour') WITH (APPENDONLY=true, COMPRESSLEVEL=5, ORIENTATION=row),partition partthree start('1 hour') end('12 hours'));
NOTICE:  CREATE TABLE will create partition "mpp21090_dropcol_addcol_splitpt_dml_interval_1_prt_partone" for table "mpp21090_dropcol_addcol_splitpt_dml_interval"
NOTICE:  CREATE TABLE will create partition "mpp21090_dropcol_addcol_splitpt_dml_interval_1_prt_parttwo" for table "mpp21090_dropcol_addcol_splitpt_dml_interval"
NOTICE:  CREATE TABLE will create partition "mpp21090_dropcol_addcol_splitpt_dml_interval_1_prt_partthree" for table "mpp21090_dropcol_addcol_splitpt_dml_interval"
INSERT INTO mpp21090_dropcol_addcol_splitpt_dml_interval VALUES('1 hour','1 hour','a','1 hour');
SELECT * FROM mpp21090_dropcol_addcol_splitpt_dml_interval ORDER BY 1,2,3,4;
   col1   |   col2   | col3 |   col4   
----------+----------+------+----------
 01:00:00 | 01:00:00 | a    | 01:00:00
(1 row)

ALTER TABLE mpp21090_dropcol_addcol_splitpt_dml_interval ADD COLUMN col5 int DEFAULT 10;
INSERT INTO mpp21090_dropcol_addcol_splitpt_dml_interval VALUES('1 hour','1 hour','b','1 hour',0);
SELECT * FROM mpp21090_dropcol_addcol_splitpt_dml_interval ORDER BY 1,2,3,4;
   col1   |   col2   | col3 |   col4   | col5 
----------+----------+------+----------+------
 01:00:00 | 01:00:00 | a    | 01:00:00 |   10
 01:00:00 | 01:00:00 | b    | 01:00:00 |    0
(2 rows)

ALTER TABLE mpp21090_dropcol_addcol_splitpt_dml_interval DROP COLUMN col4;
INSERT INTO mpp21090_dropcol_addcol_splitpt_dml_interval VALUES('1 hour','1 hour','c',1);
SELECT * FROM mpp21090_dropcol_addcol_splitpt_dml_interval ORDER BY 1,2,3,4;
   col1   |   col2   | col3 | col5 
----------+----------+------+------
 01:00:00 | 01:00:00 | a    |   10
 01:00:00 | 01:00:00 | b    |    0
 01:00:00 | 01:00:00 | c    |    1
(3 rows)

ALTER TABLE mpp21090_dropcol_addcol_splitpt_dml_interval SPLIT PARTITION partone at ('30 secs') into (partition partsplitone,partition partsplitwo);
NOTICE:  exchanged partition "partone" of relation "mpp21090_dropcol_addcol_splitpt_dml_interval" with relation "pg_temp_207720"
NOTICE:  dropped partition "partone" for relation "mpp21090_dropcol_addcol_splitpt_dml_interval"
NOTICE:  CREATE TABLE will create partition "mpp21090_dropcol_addcol_splitpt_dml_interval_1_prt_partsplitone" for table "mpp21090_dropcol_addcol_splitpt_dml_interval"
NOTICE:  CREATE TABLE will create partition "mpp21090_dropcol_addcol_splitpt_dml_interval_1_prt_partsplitwo" for table "mpp21090_dropcol_addcol_splitpt_dml_interval"
INSERT INTO mpp21090_dropcol_addcol_splitpt_dml_interval SELECT '1 sec', '1 sec','d', 1;
SELECT * FROM mpp21090_dropcol_addcol_splitpt_dml_interval ORDER BY 1,2,3;
   col1   |   col2   | col3 | col5 
----------+----------+------+------
 00:00:01 | 00:00:01 | d    |    1
 01:00:00 | 01:00:00 | a    |   10
 01:00:00 | 01:00:00 | b    |    0
 01:00:00 | 01:00:00 | c    |    1
(4 rows)

-- Update distribution key
UPDATE mpp21090_dropcol_addcol_splitpt_dml_interval SET col1 = '14 hours' WHERE col2 = '1 sec' AND col1 = '1 sec';
ERROR:  Cannot parallelize an UPDATE statement that updates the distribution columns
SELECT * FROM mpp21090_dropcol_addcol_splitpt_dml_interval ORDER BY 1,2,3;
   col1   |   col2   | col3 | col5 
----------+----------+------+------
 00:00:01 | 00:00:01 | d    |    1
 01:00:00 | 01:00:00 | a    |   10
 01:00:00 | 01:00:00 | b    |    0
 01:00:00 | 01:00:00 | c    |    1
(4 rows)

-- Update partition key
UPDATE mpp21090_dropcol_addcol_splitpt_dml_interval SET col2 ='1 hour'  WHERE col2 = '1 sec' AND col1 = '14 hours';
SELECT * FROM mpp21090_dropcol_addcol_splitpt_dml_interval ORDER BY 1,2,3;
   col1   |   col2   | col3 | col5 
----------+----------+------+------
 00:00:01 | 00:00:01 | d    |    1
 01:00:00 | 01:00:00 | a    |   10
 01:00:00 | 01:00:00 | b    |    0
 01:00:00 | 01:00:00 | c    |    1
(4 rows)

DELETE FROM mpp21090_dropcol_addcol_splitpt_dml_interval WHERE col3='b';
SELECT * FROM mpp21090_dropcol_addcol_splitpt_dml_interval ORDER BY 1,2,3;
   col1   |   col2   | col3 | col5 
----------+----------+------+------
 00:00:01 | 00:00:01 | d    |    1
 01:00:00 | 01:00:00 | a    |   10
 01:00:00 | 01:00:00 | c    |    1
(3 rows)

-- TEST
DROP TABLE IF EXISTS mpp21090_dropcol_addcol_splitpt_dml_numeric;
NOTICE:  table "mpp21090_dropcol_addcol_splitpt_dml_numeric" does not exist, skipping
CREATE TABLE mpp21090_dropcol_addcol_splitpt_dml_numeric
(
    col1 numeric,
    col2 numeric,
    col3 char,
    col4 numeric
) 
DISTRIBUTED by (col1)
PARTITION BY RANGE(col2)(partition partone start(1.000000) end(10.000000)  WITH (APPENDONLY=true, COMPRESSLEVEL=5, ORIENTATION=column),partition parttwo start(10.000000) end(20.000000) WITH (APPENDONLY=true, COMPRESSLEVEL=5, ORIENTATION=row),partition partthree start(20.000000) end(30.000000));
NOTICE:  CREATE TABLE will create partition "mpp21090_dropcol_addcol_splitpt_dml_numeric_1_prt_partone" for table "mpp21090_dropcol_addcol_splitpt_dml_numeric"
NOTICE:  CREATE TABLE will create partition "mpp21090_dropcol_addcol_splitpt_dml_numeric_1_prt_parttwo" for table "mpp21090_dropcol_addcol_splitpt_dml_numeric"
NOTICE:  CREATE TABLE will create partition "mpp21090_dropcol_addcol_splitpt_dml_numeric_1_prt_partthree" for table "mpp21090_dropcol_addcol_splitpt_dml_numeric"
INSERT INTO mpp21090_dropcol_addcol_splitpt_dml_numeric VALUES(2.000000,2.000000,'a',2.000000);
SELECT * FROM mpp21090_dropcol_addcol_splitpt_dml_numeric ORDER BY 1,2,3,4;
   col1   |   col2   | col3 |   col4   
----------+----------+------+----------
 2.000000 | 2.000000 | a    | 2.000000
(1 row)

ALTER TABLE mpp21090_dropcol_addcol_splitpt_dml_numeric ADD COLUMN col5 int DEFAULT 10;
INSERT INTO mpp21090_dropcol_addcol_splitpt_dml_numeric VALUES(2.000000,2.000000,'b',2.000000,0);
SELECT * FROM mpp21090_dropcol_addcol_splitpt_dml_numeric ORDER BY 1,2,3,4;
   col1   |   col2   | col3 |   col4   | col5 
----------+----------+------+----------+------
 2.000000 | 2.000000 | a    | 2.000000 |   10
 2.000000 | 2.000000 | b    | 2.000000 |    0
(2 rows)

ALTER TABLE mpp21090_dropcol_addcol_splitpt_dml_numeric DROP COLUMN col4;
INSERT INTO mpp21090_dropcol_addcol_splitpt_dml_numeric VALUES(2.000000,2.000000,'c',1);
SELECT * FROM mpp21090_dropcol_addcol_splitpt_dml_numeric ORDER BY 1,2,3,4;
   col1   |   col2   | col3 | col5 
----------+----------+------+------
 2.000000 | 2.000000 | a    |   10
 2.000000 | 2.000000 | b    |    0
 2.000000 | 2.000000 | c    |    1
(3 rows)

ALTER TABLE mpp21090_dropcol_addcol_splitpt_dml_numeric SPLIT PARTITION partone at (5.000000) into (partition partsplitone,partition partsplitwo);
NOTICE:  exchanged partition "partone" of relation "mpp21090_dropcol_addcol_splitpt_dml_numeric" with relation "pg_temp_207964"
NOTICE:  dropped partition "partone" for relation "mpp21090_dropcol_addcol_splitpt_dml_numeric"
NOTICE:  CREATE TABLE will create partition "mpp21090_dropcol_addcol_splitpt_dml_numeric_1_prt_partsplitone" for table "mpp21090_dropcol_addcol_splitpt_dml_numeric"
NOTICE:  CREATE TABLE will create partition "mpp21090_dropcol_addcol_splitpt_dml_numeric_1_prt_partsplitwo" for table "mpp21090_dropcol_addcol_splitpt_dml_numeric"
INSERT INTO mpp21090_dropcol_addcol_splitpt_dml_numeric SELECT 1.000000, 1.000000,'d', 1;
SELECT * FROM mpp21090_dropcol_addcol_splitpt_dml_numeric ORDER BY 1,2,3;
   col1   |   col2   | col3 | col5 
----------+----------+------+------
 1.000000 | 1.000000 | d    |    1
 2.000000 | 2.000000 | a    |   10
 2.000000 | 2.000000 | b    |    0
 2.000000 | 2.000000 | c    |    1
(4 rows)

-- Update distribution key
UPDATE mpp21090_dropcol_addcol_splitpt_dml_numeric SET col1 = 35.000000 WHERE col2 = 1.000000 AND col1 = 1.000000;
ERROR:  Cannot parallelize an UPDATE statement that updates the distribution columns
SELECT * FROM mpp21090_dropcol_addcol_splitpt_dml_numeric ORDER BY 1,2,3;
   col1   |   col2   | col3 | col5 
----------+----------+------+------
 1.000000 | 1.000000 | d    |    1
 2.000000 | 2.000000 | a    |   10
 2.000000 | 2.000000 | b    |    0
 2.000000 | 2.000000 | c    |    1
(4 rows)

-- Update partition key
UPDATE mpp21090_dropcol_addcol_splitpt_dml_numeric SET col2 =2.000000  WHERE col2 = 1.000000 AND col1 = 35.000000;
SELECT * FROM mpp21090_dropcol_addcol_splitpt_dml_numeric ORDER BY 1,2,3;
   col1   |   col2   | col3 | col5 
----------+----------+------+------
 1.000000 | 1.000000 | d    |    1
 2.000000 | 2.000000 | a    |   10
 2.000000 | 2.000000 | b    |    0
 2.000000 | 2.000000 | c    |    1
(4 rows)

DELETE FROM mpp21090_dropcol_addcol_splitpt_dml_numeric WHERE col3='b';
SELECT * FROM mpp21090_dropcol_addcol_splitpt_dml_numeric ORDER BY 1,2,3;
   col1   |   col2   | col3 | col5 
----------+----------+------+------
 1.000000 | 1.000000 | d    |    1
 2.000000 | 2.000000 | a    |   10
 2.000000 | 2.000000 | c    |    1
(3 rows)

-- TEST
DROP TABLE IF EXISTS oidtab;
NOTICE:  table "oidtab" does not exist, skipping
CREATE TABLE oidtab(
col1 serial,
col2 decimal,
col3 char,
col4 boolean,
col5 int
) WITH OIDS DISTRIBUTED by(col4);
NOTICE:  CREATE TABLE will create implicit sequence "oidtab_col1_seq" for serial column "oidtab.col1"
NOTICE:  OIDS=TRUE is not recommended for user-created tables. Use OIDS=FALSE to prevent wrap-around of the OID counter
ALTER TABLE oidtab DROP COLUMN col2;
INSERT INTO oidtab(col3,col4,col5) SELECT 'a',True,1;
SELECT * FROM oidtab ORDER BY 1,2,3,4;
 col1 | col3 | col4 | col5 
------+------+------+------
    1 | a    | t    |    1
(1 row)

DROP TABLE IF EXISTS tempoid;
NOTICE:  table "tempoid" does not exist, skipping
CREATE TABLE tempoid as SELECT oid,col1,col3,col4,col5 FROM oidtab ORDER BY 1;
NOTICE:  Table doesn't have 'DISTRIBUTED BY' clause -- Using column(s) named 'oid' as the Greenplum Database data distribution key for this table.
HINT:  The 'DISTRIBUTED BY' clause determines the distribution of data. Make sure column(s) chosen are the optimal data distribution key to minimize skew.
UPDATE oidtab SET col4=False WHERE col3 = 'a' AND col5 = 1;
ERROR:  Cannot parallelize an UPDATE statement that updates the distribution columns
SELECT * FROM oidtab ORDER BY 1,2,3,4;
 col1 | col3 | col4 | col5 
------+------+------+------
    1 | a    | t    |    1
(1 row)

SELECT * FROM ((SELECT COUNT(*) FROM oidtab) UNION (SELECT COUNT(*) FROM tempoid, oidtab WHERE tempoid.oid = oidtab.oid AND tempoid.col5 = oidtab.col5))foo;
 count 
-------
     1
(1 row)

-- TEST
DROP TABLE IF EXISTS oidtab;
CREATE TABLE oidtab(
col1 serial,
col2 decimal,
col3 char,
col4 char,
col5 int
) WITH OIDS DISTRIBUTED by(col4);
NOTICE:  CREATE TABLE will create implicit sequence "oidtab_col1_seq" for serial column "oidtab.col1"
NOTICE:  OIDS=TRUE is not recommended for user-created tables. Use OIDS=FALSE to prevent wrap-around of the OID counter
ALTER TABLE oidtab DROP COLUMN col2;
INSERT INTO oidtab(col3,col4,col5) SELECT 'a','z',1;
SELECT * FROM oidtab ORDER BY 1,2,3,4;
 col1 | col3 | col4 | col5 
------+------+------+------
    1 | a    | z    |    1
(1 row)

DROP TABLE IF EXISTS tempoid;
CREATE TABLE tempoid as SELECT oid,col1,col3,col4,col5 FROM oidtab ORDER BY 1;
NOTICE:  Table doesn't have 'DISTRIBUTED BY' clause -- Using column(s) named 'oid' as the Greenplum Database data distribution key for this table.
HINT:  The 'DISTRIBUTED BY' clause determines the distribution of data. Make sure column(s) chosen are the optimal data distribution key to minimize skew.
UPDATE oidtab SET col4='-' WHERE col3 = 'a' AND col5 = 1;
ERROR:  Cannot parallelize an UPDATE statement that updates the distribution columns
SELECT * FROM oidtab ORDER BY 1,2,3,4;
 col1 | col3 | col4 | col5 
------+------+------+------
    1 | a    | z    |    1
(1 row)

SELECT * FROM ((SELECT COUNT(*) FROM oidtab) UNION (SELECT COUNT(*) FROM tempoid, oidtab WHERE tempoid.oid = oidtab.oid AND tempoid.col5 = oidtab.col5))foo;
 count 
-------
     1
(1 row)

-- TEST
DROP TABLE IF EXISTS oidtab;
CREATE TABLE oidtab(
col1 serial,
col2 decimal,
col3 char,
col4 decimal,
col5 int
) WITH OIDS DISTRIBUTED by(col4);
NOTICE:  CREATE TABLE will create implicit sequence "oidtab_col1_seq" for serial column "oidtab.col1"
NOTICE:  OIDS=TRUE is not recommended for user-created tables. Use OIDS=FALSE to prevent wrap-around of the OID counter
ALTER TABLE oidtab DROP COLUMN col2;
INSERT INTO oidtab(col3,col4,col5) SELECT 'a',2.00,1;
SELECT * FROM oidtab ORDER BY 1,2,3,4;
 col1 | col3 | col4 | col5 
------+------+------+------
    1 | a    | 2.00 |    1
(1 row)

DROP TABLE IF EXISTS tempoid;
CREATE TABLE tempoid as SELECT oid,col1,col3,col4,col5 FROM oidtab ORDER BY 1;
NOTICE:  Table doesn't have 'DISTRIBUTED BY' clause -- Using column(s) named 'oid' as the Greenplum Database data distribution key for this table.
HINT:  The 'DISTRIBUTED BY' clause determines the distribution of data. Make sure column(s) chosen are the optimal data distribution key to minimize skew.
UPDATE oidtab SET col4=1.00 WHERE col3 = 'a' AND col5 = 1;
ERROR:  Cannot parallelize an UPDATE statement that updates the distribution columns
SELECT * FROM oidtab ORDER BY 1,2,3,4;
 col1 | col3 | col4 | col5 
------+------+------+------
    1 | a    | 2.00 |    1
(1 row)

SELECT * FROM ((SELECT COUNT(*) FROM oidtab) UNION (SELECT COUNT(*) FROM tempoid, oidtab WHERE tempoid.oid = oidtab.oid AND tempoid.col5 = oidtab.col5))foo;
 count 
-------
     1
(1 row)

-- TEST
DROP TABLE IF EXISTS oidtab;
CREATE TABLE oidtab(
col1 serial,
col2 decimal,
col3 char,
col4 int4,
col5 int
) WITH OIDS DISTRIBUTED by(col4);
NOTICE:  CREATE TABLE will create implicit sequence "oidtab_col1_seq" for serial column "oidtab.col1"
NOTICE:  OIDS=TRUE is not recommended for user-created tables. Use OIDS=FALSE to prevent wrap-around of the OID counter
ALTER TABLE oidtab DROP COLUMN col2;
INSERT INTO oidtab(col3,col4,col5) SELECT 'a',2000000000,1;
SELECT * FROM oidtab ORDER BY 1,2,3,4;
 col1 | col3 |    col4    | col5 
------+------+------------+------
    1 | a    | 2000000000 |    1
(1 row)

DROP TABLE IF EXISTS tempoid;
CREATE TABLE tempoid as SELECT oid,col1,col3,col4,col5 FROM oidtab ORDER BY 1;
NOTICE:  Table doesn't have 'DISTRIBUTED BY' clause -- Using column(s) named 'oid' as the Greenplum Database data distribution key for this table.
HINT:  The 'DISTRIBUTED BY' clause determines the distribution of data. Make sure column(s) chosen are the optimal data distribution key to minimize skew.
UPDATE oidtab SET col4=1000000000 WHERE col3 = 'a' AND col5 = 1;
ERROR:  Cannot parallelize an UPDATE statement that updates the distribution columns
SELECT * FROM oidtab ORDER BY 1,2,3,4;
 col1 | col3 |    col4    | col5 
------+------+------------+------
    1 | a    | 2000000000 |    1
(1 row)

SELECT * FROM ((SELECT COUNT(*) FROM oidtab) UNION (SELECT COUNT(*) FROM tempoid, oidtab WHERE tempoid.oid = oidtab.oid AND tempoid.col5 = oidtab.col5))foo;
 count 
-------
     1
(1 row)

-- TEST
DROP TABLE IF EXISTS oidtab;
CREATE TABLE oidtab(
col1 serial,
col2 decimal,
col3 char,
col4 int8,
col5 int
) WITH OIDS DISTRIBUTED by(col4);
NOTICE:  CREATE TABLE will create implicit sequence "oidtab_col1_seq" for serial column "oidtab.col1"
NOTICE:  OIDS=TRUE is not recommended for user-created tables. Use OIDS=FALSE to prevent wrap-around of the OID counter
ALTER TABLE oidtab DROP COLUMN col2;
INSERT INTO oidtab(col3,col4,col5) SELECT 'a',2000000000000000000,1;
SELECT * FROM oidtab ORDER BY 1,2,3,4;
 col1 | col3 |        col4         | col5 
------+------+---------------------+------
    1 | a    | 2000000000000000000 |    1
(1 row)

DROP TABLE IF EXISTS tempoid;
CREATE TABLE tempoid as SELECT oid,col1,col3,col4,col5 FROM oidtab ORDER BY 1;
NOTICE:  Table doesn't have 'DISTRIBUTED BY' clause -- Using column(s) named 'oid' as the Greenplum Database data distribution key for this table.
HINT:  The 'DISTRIBUTED BY' clause determines the distribution of data. Make sure column(s) chosen are the optimal data distribution key to minimize skew.
UPDATE oidtab SET col4=1000000000000000000 WHERE col3 = 'a' AND col5 = 1;
ERROR:  Cannot parallelize an UPDATE statement that updates the distribution columns
SELECT * FROM oidtab ORDER BY 1,2,3,4;
 col1 | col3 |        col4         | col5 
------+------+---------------------+------
    1 | a    | 2000000000000000000 |    1
(1 row)

SELECT * FROM ((SELECT COUNT(*) FROM oidtab) UNION (SELECT COUNT(*) FROM tempoid, oidtab WHERE tempoid.oid = oidtab.oid AND tempoid.col5 = oidtab.col5))foo;
 count 
-------
     1
(1 row)

-- TEST
DROP TABLE IF EXISTS oidtab;
CREATE TABLE oidtab(
col1 serial,
col2 decimal,
col3 char,
col4 interval,
col5 int
) WITH OIDS DISTRIBUTED by(col4);
NOTICE:  CREATE TABLE will create implicit sequence "oidtab_col1_seq" for serial column "oidtab.col1"
NOTICE:  OIDS=TRUE is not recommended for user-created tables. Use OIDS=FALSE to prevent wrap-around of the OID counter
ALTER TABLE oidtab DROP COLUMN col2;
INSERT INTO oidtab(col3,col4,col5) SELECT 'a','1 day',1;
SELECT * FROM oidtab ORDER BY 1,2,3,4;
 col1 | col3 | col4  | col5 
------+------+-------+------
    1 | a    | 1 day |    1
(1 row)

DROP TABLE IF EXISTS tempoid;
CREATE TABLE tempoid as SELECT oid,col1,col3,col4,col5 FROM oidtab ORDER BY 1;
NOTICE:  Table doesn't have 'DISTRIBUTED BY' clause -- Using column(s) named 'oid' as the Greenplum Database data distribution key for this table.
HINT:  The 'DISTRIBUTED BY' clause determines the distribution of data. Make sure column(s) chosen are the optimal data distribution key to minimize skew.
UPDATE oidtab SET col4='1 hour' WHERE col3 = 'a' AND col5 = 1;
ERROR:  Cannot parallelize an UPDATE statement that updates the distribution columns
SELECT * FROM oidtab ORDER BY 1,2,3,4;
 col1 | col3 | col4  | col5 
------+------+-------+------
    1 | a    | 1 day |    1
(1 row)

SELECT * FROM ((SELECT COUNT(*) FROM oidtab) UNION (SELECT COUNT(*) FROM tempoid, oidtab WHERE tempoid.oid = oidtab.oid AND tempoid.col5 = oidtab.col5))foo;
 count 
-------
     1
(1 row)

-- TEST
DROP TABLE IF EXISTS oidtab;
CREATE TABLE oidtab(
col1 serial,
col2 decimal,
col3 char,
col4 numeric,
col5 int
) WITH OIDS DISTRIBUTED by(col4);
NOTICE:  CREATE TABLE will create implicit sequence "oidtab_col1_seq" for serial column "oidtab.col1"
NOTICE:  OIDS=TRUE is not recommended for user-created tables. Use OIDS=FALSE to prevent wrap-around of the OID counter
ALTER TABLE oidtab DROP COLUMN col2;
INSERT INTO oidtab(col3,col4,col5) SELECT 'a',2.000000,1;
SELECT * FROM oidtab ORDER BY 1,2,3,4;
 col1 | col3 |   col4   | col5 
------+------+----------+------
    1 | a    | 2.000000 |    1
(1 row)

DROP TABLE IF EXISTS tempoid;
CREATE TABLE tempoid as SELECT oid,col1,col3,col4,col5 FROM oidtab ORDER BY 1;
NOTICE:  Table doesn't have 'DISTRIBUTED BY' clause -- Using column(s) named 'oid' as the Greenplum Database data distribution key for this table.
HINT:  The 'DISTRIBUTED BY' clause determines the distribution of data. Make sure column(s) chosen are the optimal data distribution key to minimize skew.
UPDATE oidtab SET col4=1.000000 WHERE col3 = 'a' AND col5 = 1;
ERROR:  Cannot parallelize an UPDATE statement that updates the distribution columns
SELECT * FROM oidtab ORDER BY 1,2,3,4;
 col1 | col3 |   col4   | col5 
------+------+----------+------
    1 | a    | 2.000000 |    1
(1 row)

SELECT * FROM ((SELECT COUNT(*) FROM oidtab) UNION (SELECT COUNT(*) FROM tempoid, oidtab WHERE tempoid.oid = oidtab.oid AND tempoid.col5 = oidtab.col5))foo;
 count 
-------
     1
(1 row)

-- TEST
DROP TABLE IF EXISTS oidtab;
CREATE TABLE oidtab(
col1 serial,
col2 decimal,
col3 char,
col4 text,
col5 int
) WITH OIDS DISTRIBUTED by(col4);
NOTICE:  CREATE TABLE will create implicit sequence "oidtab_col1_seq" for serial column "oidtab.col1"
NOTICE:  OIDS=TRUE is not recommended for user-created tables. Use OIDS=FALSE to prevent wrap-around of the OID counter
ALTER TABLE oidtab DROP COLUMN col2;
INSERT INTO oidtab(col3,col4,col5) SELECT 'a','abcdefghijklmnop',1;
SELECT * FROM oidtab ORDER BY 1,2,3,4;
 col1 | col3 |       col4       | col5 
------+------+------------------+------
    1 | a    | abcdefghijklmnop |    1
(1 row)

DROP TABLE IF EXISTS tempoid;
CREATE TABLE tempoid as SELECT oid,col1,col3,col4,col5 FROM oidtab ORDER BY 1;
NOTICE:  Table doesn't have 'DISTRIBUTED BY' clause -- Using column(s) named 'oid' as the Greenplum Database data distribution key for this table.
HINT:  The 'DISTRIBUTED BY' clause determines the distribution of data. Make sure column(s) chosen are the optimal data distribution key to minimize skew.
UPDATE oidtab SET col4='qrstuvwxyz' WHERE col3 = 'a' AND col5 = 1;
ERROR:  Cannot parallelize an UPDATE statement that updates the distribution columns
SELECT * FROM oidtab ORDER BY 1,2,3,4;
 col1 | col3 |       col4       | col5 
------+------+------------------+------
    1 | a    | abcdefghijklmnop |    1
(1 row)

SELECT * FROM ((SELECT COUNT(*) FROM oidtab) UNION (SELECT COUNT(*) FROM tempoid, oidtab WHERE tempoid.oid = oidtab.oid AND tempoid.col5 = oidtab.col5))foo;
 count 
-------
     1
(1 row)

-- TEST
DROP TABLE IF EXISTS mpp21090_dropcol_splitdefpt_addcol_dml_char;
NOTICE:  table "mpp21090_dropcol_splitdefpt_addcol_dml_char" does not exist, skipping
CREATE TABLE mpp21090_dropcol_splitdefpt_addcol_dml_char
(
    col1 char,
    col2 char,
    col3 char,
    col4 char
) 
DISTRIBUTED by (col1)
PARTITION BY LIST(col2)
(
default partition def
);
NOTICE:  CREATE TABLE will create partition "mpp21090_dropcol_splitdefpt_addcol_dml_char_1_prt_def" for table "mpp21090_dropcol_splitdefpt_addcol_dml_char"
INSERT INTO mpp21090_dropcol_splitdefpt_addcol_dml_char VALUES('x','x','a','x');
SELECT * FROM mpp21090_dropcol_splitdefpt_addcol_dml_char ORDER BY 1,2,3,4;
 col1 | col2 | col3 | col4 
------+------+------+------
 x    | x    | a    | x
(1 row)

ALTER TABLE mpp21090_dropcol_splitdefpt_addcol_dml_char DROP COLUMN col4;
INSERT INTO mpp21090_dropcol_splitdefpt_addcol_dml_char VALUES('x','x','b');
SELECT * FROM mpp21090_dropcol_splitdefpt_addcol_dml_char ORDER BY 1,2,3;
 col1 | col2 | col3 
------+------+------
 x    | x    | a
 x    | x    | b
(2 rows)

ALTER TABLE mpp21090_dropcol_splitdefpt_addcol_dml_char SPLIT DEFAULT PARTITION at ('d') into (partition partsplitone,partition def);
NOTICE:  exchanged partition "def" of relation "mpp21090_dropcol_splitdefpt_addcol_dml_char" with relation "pg_temp_208541"
NOTICE:  dropped partition "def" for relation "mpp21090_dropcol_splitdefpt_addcol_dml_char"
NOTICE:  CREATE TABLE will create partition "mpp21090_dropcol_splitdefpt_addcol_dml_char_1_prt_partsplitone" for table "mpp21090_dropcol_splitdefpt_addcol_dml_char"
NOTICE:  CREATE TABLE will create partition "mpp21090_dropcol_splitdefpt_addcol_dml_char_1_prt_def" for table "mpp21090_dropcol_splitdefpt_addcol_dml_char"
INSERT INTO mpp21090_dropcol_splitdefpt_addcol_dml_char SELECT 'a', 'a','e';
SELECT * FROM mpp21090_dropcol_splitdefpt_addcol_dml_char ORDER BY 1,2,3;
 col1 | col2 | col3 
------+------+------
 a    | a    | e
 x    | x    | a
 x    | x    | b
(3 rows)

ALTER TABLE mpp21090_dropcol_splitdefpt_addcol_dml_char ADD COLUMN col5 char DEFAULT 'x';
INSERT INTO mpp21090_dropcol_splitdefpt_addcol_dml_char VALUES('x','x','c','x');
SELECT * FROM mpp21090_dropcol_splitdefpt_addcol_dml_char ORDER BY 1,2,3,4;
 col1 | col2 | col3 | col5 
------+------+------+------
 a    | a    | e    | x
 x    | x    | a    | x
 x    | x    | b    | x
 x    | x    | c    | x
(4 rows)

-- Update distribution key
UPDATE mpp21090_dropcol_splitdefpt_addcol_dml_char SET col1 = 'z' WHERE col2 = 'a' AND col1 = 'a';
ERROR:  Cannot parallelize an UPDATE statement that updates the distribution columns
SELECT * FROM mpp21090_dropcol_splitdefpt_addcol_dml_char ORDER BY 1,2,3;
 col1 | col2 | col3 | col5 
------+------+------+------
 a    | a    | e    | x
 x    | x    | a    | x
 x    | x    | b    | x
 x    | x    | c    | x
(4 rows)

-- Update partition key
UPDATE mpp21090_dropcol_splitdefpt_addcol_dml_char SET col2 = 'z' WHERE col2 = 'a' AND col1 = 'z';
SELECT * FROM mpp21090_dropcol_splitdefpt_addcol_dml_char ORDER BY 1,2,3;
 col1 | col2 | col3 | col5 
------+------+------+------
 a    | a    | e    | x
 x    | x    | a    | x
 x    | x    | b    | x
 x    | x    | c    | x
(4 rows)

DELETE FROM mpp21090_dropcol_splitdefpt_addcol_dml_char WHERE col3='b';
SELECT * FROM mpp21090_dropcol_splitdefpt_addcol_dml_char ORDER BY 1,2,3;
 col1 | col2 | col3 | col5 
------+------+------+------
 a    | a    | e    | x
 x    | x    | a    | x
 x    | x    | c    | x
(3 rows)

-- TEST
DROP TABLE IF EXISTS mpp21090_dropcol_splitdefpt_addcol_dml_decimal;
NOTICE:  table "mpp21090_dropcol_splitdefpt_addcol_dml_decimal" does not exist, skipping
CREATE TABLE mpp21090_dropcol_splitdefpt_addcol_dml_decimal
(
    col1 decimal,
    col2 decimal,
    col3 char,
    col4 decimal
) 
DISTRIBUTED by (col1)
PARTITION BY LIST(col2)
(
default partition def
);
NOTICE:  CREATE TABLE will create partition "mpp21090_dropcol_splitdefpt_addcol_dml_decimal_1_prt_def" for table "mpp21090_dropcol_splitdefpt_addcol_dml_decimal"
INSERT INTO mpp21090_dropcol_splitdefpt_addcol_dml_decimal VALUES(2.00,2.00,'a',2.00);
SELECT * FROM mpp21090_dropcol_splitdefpt_addcol_dml_decimal ORDER BY 1,2,3,4;
 col1 | col2 | col3 | col4 
------+------+------+------
 2.00 | 2.00 | a    | 2.00
(1 row)

ALTER TABLE mpp21090_dropcol_splitdefpt_addcol_dml_decimal DROP COLUMN col4;
INSERT INTO mpp21090_dropcol_splitdefpt_addcol_dml_decimal VALUES(2.00,2.00,'b');
SELECT * FROM mpp21090_dropcol_splitdefpt_addcol_dml_decimal ORDER BY 1,2,3;
 col1 | col2 | col3 
------+------+------
 2.00 | 2.00 | a
 2.00 | 2.00 | b
(2 rows)

ALTER TABLE mpp21090_dropcol_splitdefpt_addcol_dml_decimal SPLIT DEFAULT PARTITION at (5.00) into (partition partsplitone,partition def);
NOTICE:  exchanged partition "def" of relation "mpp21090_dropcol_splitdefpt_addcol_dml_decimal" with relation "pg_temp_208705"
NOTICE:  dropped partition "def" for relation "mpp21090_dropcol_splitdefpt_addcol_dml_decimal"
NOTICE:  CREATE TABLE will create partition "mpp21090_dropcol_splitdefpt_addcol_dml_decim_1_prt_partsplitone" for table "mpp21090_dropcol_splitdefpt_addcol_dml_decimal"
NOTICE:  CREATE TABLE will create partition "mpp21090_dropcol_splitdefpt_addcol_dml_decimal_1_prt_def" for table "mpp21090_dropcol_splitdefpt_addcol_dml_decimal"
INSERT INTO mpp21090_dropcol_splitdefpt_addcol_dml_decimal SELECT 1.00, 1.00,'e';
SELECT * FROM mpp21090_dropcol_splitdefpt_addcol_dml_decimal ORDER BY 1,2,3;
 col1 | col2 | col3 
------+------+------
 1.00 | 1.00 | e
 2.00 | 2.00 | a
 2.00 | 2.00 | b
(3 rows)

ALTER TABLE mpp21090_dropcol_splitdefpt_addcol_dml_decimal ADD COLUMN col5 decimal DEFAULT 2.00;
INSERT INTO mpp21090_dropcol_splitdefpt_addcol_dml_decimal VALUES(2.00,2.00,'c',2.00);
SELECT * FROM mpp21090_dropcol_splitdefpt_addcol_dml_decimal ORDER BY 1,2,3,4;
 col1 | col2 | col3 | col5 
------+------+------+------
 1.00 | 1.00 | e    | 2.00
 2.00 | 2.00 | a    | 2.00
 2.00 | 2.00 | b    | 2.00
 2.00 | 2.00 | c    | 2.00
(4 rows)

-- Update distribution key
UPDATE mpp21090_dropcol_splitdefpt_addcol_dml_decimal SET col1 = 35.00 WHERE col2 = 1.00 AND col1 = 1.00;
ERROR:  Cannot parallelize an UPDATE statement that updates the distribution columns
SELECT * FROM mpp21090_dropcol_splitdefpt_addcol_dml_decimal ORDER BY 1,2,3;
 col1 | col2 | col3 | col5 
------+------+------+------
 1.00 | 1.00 | e    | 2.00
 2.00 | 2.00 | a    | 2.00
 2.00 | 2.00 | b    | 2.00
 2.00 | 2.00 | c    | 2.00
(4 rows)

-- Update partition key
UPDATE mpp21090_dropcol_splitdefpt_addcol_dml_decimal SET col2 = 35.00 WHERE col2 = 1.00 AND col1 = 35.00;
SELECT * FROM mpp21090_dropcol_splitdefpt_addcol_dml_decimal ORDER BY 1,2,3;
 col1 | col2 | col3 | col5 
------+------+------+------
 1.00 | 1.00 | e    | 2.00
 2.00 | 2.00 | a    | 2.00
 2.00 | 2.00 | b    | 2.00
 2.00 | 2.00 | c    | 2.00
(4 rows)

DELETE FROM mpp21090_dropcol_splitdefpt_addcol_dml_decimal WHERE col3='b';
SELECT * FROM mpp21090_dropcol_splitdefpt_addcol_dml_decimal ORDER BY 1,2,3;
 col1 | col2 | col3 | col5 
------+------+------+------
 1.00 | 1.00 | e    | 2.00
 2.00 | 2.00 | a    | 2.00
 2.00 | 2.00 | c    | 2.00
(3 rows)

-- TEST
DROP TABLE IF EXISTS mpp21090_dropcol_splitdefpt_addcol_dml_int4;
NOTICE:  table "mpp21090_dropcol_splitdefpt_addcol_dml_int4" does not exist, skipping
CREATE TABLE mpp21090_dropcol_splitdefpt_addcol_dml_int4
(
    col1 int4,
    col2 int4,
    col3 char,
    col4 int4
) 
DISTRIBUTED by (col1)
PARTITION BY LIST(col2)
(
default partition def
);
NOTICE:  CREATE TABLE will create partition "mpp21090_dropcol_splitdefpt_addcol_dml_int4_1_prt_def" for table "mpp21090_dropcol_splitdefpt_addcol_dml_int4"
INSERT INTO mpp21090_dropcol_splitdefpt_addcol_dml_int4 VALUES(20000000,20000000,'a',20000000);
SELECT * FROM mpp21090_dropcol_splitdefpt_addcol_dml_int4 ORDER BY 1,2,3,4;
   col1   |   col2   | col3 |   col4   
----------+----------+------+----------
 20000000 | 20000000 | a    | 20000000
(1 row)

ALTER TABLE mpp21090_dropcol_splitdefpt_addcol_dml_int4 DROP COLUMN col4;
INSERT INTO mpp21090_dropcol_splitdefpt_addcol_dml_int4 VALUES(20000000,20000000,'b');
SELECT * FROM mpp21090_dropcol_splitdefpt_addcol_dml_int4 ORDER BY 1,2,3;
   col1   |   col2   | col3 
----------+----------+------
 20000000 | 20000000 | a
 20000000 | 20000000 | b
(2 rows)

ALTER TABLE mpp21090_dropcol_splitdefpt_addcol_dml_int4 SPLIT DEFAULT PARTITION at (50000000) into (partition partsplitone,partition def);
NOTICE:  exchanged partition "def" of relation "mpp21090_dropcol_splitdefpt_addcol_dml_int4" with relation "pg_temp_208903"
NOTICE:  dropped partition "def" for relation "mpp21090_dropcol_splitdefpt_addcol_dml_int4"
NOTICE:  CREATE TABLE will create partition "mpp21090_dropcol_splitdefpt_addcol_dml_int4_1_prt_partsplitone" for table "mpp21090_dropcol_splitdefpt_addcol_dml_int4"
NOTICE:  CREATE TABLE will create partition "mpp21090_dropcol_splitdefpt_addcol_dml_int4_1_prt_def" for table "mpp21090_dropcol_splitdefpt_addcol_dml_int4"
INSERT INTO mpp21090_dropcol_splitdefpt_addcol_dml_int4 SELECT 10000000, 10000000,'e';
SELECT * FROM mpp21090_dropcol_splitdefpt_addcol_dml_int4 ORDER BY 1,2,3;
   col1   |   col2   | col3 
----------+----------+------
 10000000 | 10000000 | e
 20000000 | 20000000 | a
 20000000 | 20000000 | b
(3 rows)

ALTER TABLE mpp21090_dropcol_splitdefpt_addcol_dml_int4 ADD COLUMN col5 int4 DEFAULT 20000000;
INSERT INTO mpp21090_dropcol_splitdefpt_addcol_dml_int4 VALUES(20000000,20000000,'c',20000000);
SELECT * FROM mpp21090_dropcol_splitdefpt_addcol_dml_int4 ORDER BY 1,2,3,4;
   col1   |   col2   | col3 |   col5   
----------+----------+------+----------
 10000000 | 10000000 | e    | 20000000
 20000000 | 20000000 | a    | 20000000
 20000000 | 20000000 | b    | 20000000
 20000000 | 20000000 | c    | 20000000
(4 rows)

-- Update distribution key
UPDATE mpp21090_dropcol_splitdefpt_addcol_dml_int4 SET col1 = 35000000 WHERE col2 = 10000000 AND col1 = 10000000;
ERROR:  Cannot parallelize an UPDATE statement that updates the distribution columns
SELECT * FROM mpp21090_dropcol_splitdefpt_addcol_dml_int4 ORDER BY 1,2,3;
   col1   |   col2   | col3 |   col5   
----------+----------+------+----------
 10000000 | 10000000 | e    | 20000000
 20000000 | 20000000 | a    | 20000000
 20000000 | 20000000 | b    | 20000000
 20000000 | 20000000 | c    | 20000000
(4 rows)

-- Update partition key
UPDATE mpp21090_dropcol_splitdefpt_addcol_dml_int4 SET col2 = 35000000 WHERE col2 = 10000000 AND col1 = 35000000;
SELECT * FROM mpp21090_dropcol_splitdefpt_addcol_dml_int4 ORDER BY 1,2,3;
   col1   |   col2   | col3 |   col5   
----------+----------+------+----------
 10000000 | 10000000 | e    | 20000000
 20000000 | 20000000 | a    | 20000000
 20000000 | 20000000 | b    | 20000000
 20000000 | 20000000 | c    | 20000000
(4 rows)

DELETE FROM mpp21090_dropcol_splitdefpt_addcol_dml_int4 WHERE col3='b';
SELECT * FROM mpp21090_dropcol_splitdefpt_addcol_dml_int4 ORDER BY 1,2,3;
   col1   |   col2   | col3 |   col5   
----------+----------+------+----------
 10000000 | 10000000 | e    | 20000000
 20000000 | 20000000 | a    | 20000000
 20000000 | 20000000 | c    | 20000000
(3 rows)

-- TEST
DROP TABLE IF EXISTS mpp21090_dropcol_splitdefpt_addcol_dml_int8;
NOTICE:  table "mpp21090_dropcol_splitdefpt_addcol_dml_int8" does not exist, skipping
CREATE TABLE mpp21090_dropcol_splitdefpt_addcol_dml_int8
(
    col1 int8,
    col2 int8,
    col3 char,
    col4 int8
) 
DISTRIBUTED by (col1)
PARTITION BY LIST(col2)
(
default partition def
);
NOTICE:  CREATE TABLE will create partition "mpp21090_dropcol_splitdefpt_addcol_dml_int8_1_prt_def" for table "mpp21090_dropcol_splitdefpt_addcol_dml_int8"
INSERT INTO mpp21090_dropcol_splitdefpt_addcol_dml_int8 VALUES(2000000000000000000,2000000000000000000,'a',2000000000000000000);
SELECT * FROM mpp21090_dropcol_splitdefpt_addcol_dml_int8 ORDER BY 1,2,3,4;
        col1         |        col2         | col3 |        col4         
---------------------+---------------------+------+---------------------
 2000000000000000000 | 2000000000000000000 | a    | 2000000000000000000
(1 row)

ALTER TABLE mpp21090_dropcol_splitdefpt_addcol_dml_int8 DROP COLUMN col4;
INSERT INTO mpp21090_dropcol_splitdefpt_addcol_dml_int8 VALUES(2000000000000000000,2000000000000000000,'b');
SELECT * FROM mpp21090_dropcol_splitdefpt_addcol_dml_int8 ORDER BY 1,2,3;
        col1         |        col2         | col3 
---------------------+---------------------+------
 2000000000000000000 | 2000000000000000000 | a
 2000000000000000000 | 2000000000000000000 | b
(2 rows)

ALTER TABLE mpp21090_dropcol_splitdefpt_addcol_dml_int8 SPLIT DEFAULT PARTITION at (500000000000000000) into (partition partsplitone,partition def);
NOTICE:  exchanged partition "def" of relation "mpp21090_dropcol_splitdefpt_addcol_dml_int8" with relation "pg_temp_209067"
NOTICE:  dropped partition "def" for relation "mpp21090_dropcol_splitdefpt_addcol_dml_int8"
NOTICE:  CREATE TABLE will create partition "mpp21090_dropcol_splitdefpt_addcol_dml_int8_1_prt_partsplitone" for table "mpp21090_dropcol_splitdefpt_addcol_dml_int8"
NOTICE:  CREATE TABLE will create partition "mpp21090_dropcol_splitdefpt_addcol_dml_int8_1_prt_def" for table "mpp21090_dropcol_splitdefpt_addcol_dml_int8"
INSERT INTO mpp21090_dropcol_splitdefpt_addcol_dml_int8 SELECT 100000000000000000, 100000000000000000,'e';
SELECT * FROM mpp21090_dropcol_splitdefpt_addcol_dml_int8 ORDER BY 1,2,3;
        col1         |        col2         | col3 
---------------------+---------------------+------
  100000000000000000 |  100000000000000000 | e
 2000000000000000000 | 2000000000000000000 | a
 2000000000000000000 | 2000000000000000000 | b
(3 rows)

ALTER TABLE mpp21090_dropcol_splitdefpt_addcol_dml_int8 ADD COLUMN col5 int8 DEFAULT 2000000000000000000;
INSERT INTO mpp21090_dropcol_splitdefpt_addcol_dml_int8 VALUES(2000000000000000000,2000000000000000000,'c',2000000000000000000);
SELECT * FROM mpp21090_dropcol_splitdefpt_addcol_dml_int8 ORDER BY 1,2,3,4;
        col1         |        col2         | col3 |        col5         
---------------------+---------------------+------+---------------------
  100000000000000000 |  100000000000000000 | e    | 2000000000000000000
 2000000000000000000 | 2000000000000000000 | a    | 2000000000000000000
 2000000000000000000 | 2000000000000000000 | b    | 2000000000000000000
 2000000000000000000 | 2000000000000000000 | c    | 2000000000000000000
(4 rows)

-- Update distribution key
UPDATE mpp21090_dropcol_splitdefpt_addcol_dml_int8 SET col1 = 3500000000000000000 WHERE col2 = 100000000000000000 AND col1 = 100000000000000000;
ERROR:  Cannot parallelize an UPDATE statement that updates the distribution columns
SELECT * FROM mpp21090_dropcol_splitdefpt_addcol_dml_int8 ORDER BY 1,2,3;
        col1         |        col2         | col3 |        col5         
---------------------+---------------------+------+---------------------
  100000000000000000 |  100000000000000000 | e    | 2000000000000000000
 2000000000000000000 | 2000000000000000000 | a    | 2000000000000000000
 2000000000000000000 | 2000000000000000000 | b    | 2000000000000000000
 2000000000000000000 | 2000000000000000000 | c    | 2000000000000000000
(4 rows)

-- Update partition key
UPDATE mpp21090_dropcol_splitdefpt_addcol_dml_int8 SET col2 = 3500000000000000000 WHERE col2 = 100000000000000000 AND col1 = 3500000000000000000;
SELECT * FROM mpp21090_dropcol_splitdefpt_addcol_dml_int8 ORDER BY 1,2,3;
        col1         |        col2         | col3 |        col5         
---------------------+---------------------+------+---------------------
  100000000000000000 |  100000000000000000 | e    | 2000000000000000000
 2000000000000000000 | 2000000000000000000 | a    | 2000000000000000000
 2000000000000000000 | 2000000000000000000 | b    | 2000000000000000000
 2000000000000000000 | 2000000000000000000 | c    | 2000000000000000000
(4 rows)

DELETE FROM mpp21090_dropcol_splitdefpt_addcol_dml_int8 WHERE col3='b';
SELECT * FROM mpp21090_dropcol_splitdefpt_addcol_dml_int8 ORDER BY 1,2,3;
        col1         |        col2         | col3 |        col5         
---------------------+---------------------+------+---------------------
  100000000000000000 |  100000000000000000 | e    | 2000000000000000000
 2000000000000000000 | 2000000000000000000 | a    | 2000000000000000000
 2000000000000000000 | 2000000000000000000 | c    | 2000000000000000000
(3 rows)

-- TEST
DROP TABLE IF EXISTS mpp21090_dropcol_splitdefpt_addcol_dml_interval;
NOTICE:  table "mpp21090_dropcol_splitdefpt_addcol_dml_interval" does not exist, skipping
CREATE TABLE mpp21090_dropcol_splitdefpt_addcol_dml_interval
(
    col1 interval,
    col2 interval,
    col3 char,
    col4 interval
) 
DISTRIBUTED by (col1)
PARTITION BY LIST(col2)
(
default partition def
);
NOTICE:  CREATE TABLE will create partition "mpp21090_dropcol_splitdefpt_addcol_dml_interval_1_prt_def" for table "mpp21090_dropcol_splitdefpt_addcol_dml_interval"
INSERT INTO mpp21090_dropcol_splitdefpt_addcol_dml_interval VALUES('1 hour','1 hour','a','1 hour');
SELECT * FROM mpp21090_dropcol_splitdefpt_addcol_dml_interval ORDER BY 1,2,3,4;
   col1   |   col2   | col3 |   col4   
----------+----------+------+----------
 01:00:00 | 01:00:00 | a    | 01:00:00
(1 row)

ALTER TABLE mpp21090_dropcol_splitdefpt_addcol_dml_interval DROP COLUMN col4;
INSERT INTO mpp21090_dropcol_splitdefpt_addcol_dml_interval VALUES('1 hour','1 hour','b');
SELECT * FROM mpp21090_dropcol_splitdefpt_addcol_dml_interval ORDER BY 1,2,3;
   col1   |   col2   | col3 
----------+----------+------
 01:00:00 | 01:00:00 | a
 01:00:00 | 01:00:00 | b
(2 rows)

ALTER TABLE mpp21090_dropcol_splitdefpt_addcol_dml_interval SPLIT DEFAULT PARTITION at ('30 secs') into (partition partsplitone,partition def);
NOTICE:  exchanged partition "def" of relation "mpp21090_dropcol_splitdefpt_addcol_dml_interval" with relation "pg_temp_209231"
NOTICE:  dropped partition "def" for relation "mpp21090_dropcol_splitdefpt_addcol_dml_interval"
NOTICE:  CREATE TABLE will create partition "mpp21090_dropcol_splitdefpt_addcol_dml_inter_1_prt_partsplitone" for table "mpp21090_dropcol_splitdefpt_addcol_dml_interval"
NOTICE:  CREATE TABLE will create partition "mpp21090_dropcol_splitdefpt_addcol_dml_interval_1_prt_def" for table "mpp21090_dropcol_splitdefpt_addcol_dml_interval"
INSERT INTO mpp21090_dropcol_splitdefpt_addcol_dml_interval SELECT '1 sec', '1 sec','e';
SELECT * FROM mpp21090_dropcol_splitdefpt_addcol_dml_interval ORDER BY 1,2,3;
   col1   |   col2   | col3 
----------+----------+------
 00:00:01 | 00:00:01 | e
 01:00:00 | 01:00:00 | a
 01:00:00 | 01:00:00 | b
(3 rows)

ALTER TABLE mpp21090_dropcol_splitdefpt_addcol_dml_interval ADD COLUMN col5 interval DEFAULT '1 hour';
INSERT INTO mpp21090_dropcol_splitdefpt_addcol_dml_interval VALUES('1 hour','1 hour','c','1 hour');
SELECT * FROM mpp21090_dropcol_splitdefpt_addcol_dml_interval ORDER BY 1,2,3,4;
   col1   |   col2   | col3 |   col5   
----------+----------+------+----------
 00:00:01 | 00:00:01 | e    | 01:00:00
 01:00:00 | 01:00:00 | a    | 01:00:00
 01:00:00 | 01:00:00 | b    | 01:00:00
 01:00:00 | 01:00:00 | c    | 01:00:00
(4 rows)

-- Update distribution key
UPDATE mpp21090_dropcol_splitdefpt_addcol_dml_interval SET col1 = '14 hours' WHERE col2 = '1 sec' AND col1 = '1 sec';
ERROR:  Cannot parallelize an UPDATE statement that updates the distribution columns
SELECT * FROM mpp21090_dropcol_splitdefpt_addcol_dml_interval ORDER BY 1,2,3;
   col1   |   col2   | col3 |   col5   
----------+----------+------+----------
 00:00:01 | 00:00:01 | e    | 01:00:00
 01:00:00 | 01:00:00 | a    | 01:00:00
 01:00:00 | 01:00:00 | b    | 01:00:00
 01:00:00 | 01:00:00 | c    | 01:00:00
(4 rows)

-- Update partition key
UPDATE mpp21090_dropcol_splitdefpt_addcol_dml_interval SET col2 = '14 hours' WHERE col2 = '1 sec' AND col1 = '14 hours';
SELECT * FROM mpp21090_dropcol_splitdefpt_addcol_dml_interval ORDER BY 1,2,3;
   col1   |   col2   | col3 |   col5   
----------+----------+------+----------
 00:00:01 | 00:00:01 | e    | 01:00:00
 01:00:00 | 01:00:00 | a    | 01:00:00
 01:00:00 | 01:00:00 | b    | 01:00:00
 01:00:00 | 01:00:00 | c    | 01:00:00
(4 rows)

DELETE FROM mpp21090_dropcol_splitdefpt_addcol_dml_interval WHERE col3='b';
SELECT * FROM mpp21090_dropcol_splitdefpt_addcol_dml_interval ORDER BY 1,2,3;
   col1   |   col2   | col3 |   col5   
----------+----------+------+----------
 00:00:01 | 00:00:01 | e    | 01:00:00
 01:00:00 | 01:00:00 | a    | 01:00:00
 01:00:00 | 01:00:00 | c    | 01:00:00
(3 rows)

-- TEST
DROP TABLE IF EXISTS mpp21090_dropcol_splitdefpt_addcol_dml_numeric;
NOTICE:  table "mpp21090_dropcol_splitdefpt_addcol_dml_numeric" does not exist, skipping
CREATE TABLE mpp21090_dropcol_splitdefpt_addcol_dml_numeric
(
    col1 numeric,
    col2 numeric,
    col3 char,
    col4 numeric
) 
DISTRIBUTED by (col1)
PARTITION BY LIST(col2)
(
default partition def
);
NOTICE:  CREATE TABLE will create partition "mpp21090_dropcol_splitdefpt_addcol_dml_numeric_1_prt_def" for table "mpp21090_dropcol_splitdefpt_addcol_dml_numeric"
INSERT INTO mpp21090_dropcol_splitdefpt_addcol_dml_numeric VALUES(2.000000,2.000000,'a',2.000000);
SELECT * FROM mpp21090_dropcol_splitdefpt_addcol_dml_numeric ORDER BY 1,2,3,4;
   col1   |   col2   | col3 |   col4   
----------+----------+------+----------
 2.000000 | 2.000000 | a    | 2.000000
(1 row)

ALTER TABLE mpp21090_dropcol_splitdefpt_addcol_dml_numeric DROP COLUMN col4;
INSERT INTO mpp21090_dropcol_splitdefpt_addcol_dml_numeric VALUES(2.000000,2.000000,'b');
SELECT * FROM mpp21090_dropcol_splitdefpt_addcol_dml_numeric ORDER BY 1,2,3;
   col1   |   col2   | col3 
----------+----------+------
 2.000000 | 2.000000 | a
 2.000000 | 2.000000 | b
(2 rows)

ALTER TABLE mpp21090_dropcol_splitdefpt_addcol_dml_numeric SPLIT DEFAULT PARTITION at (5.000000) into (partition partsplitone,partition def);
NOTICE:  exchanged partition "def" of relation "mpp21090_dropcol_splitdefpt_addcol_dml_numeric" with relation "pg_temp_209395"
NOTICE:  dropped partition "def" for relation "mpp21090_dropcol_splitdefpt_addcol_dml_numeric"
NOTICE:  CREATE TABLE will create partition "mpp21090_dropcol_splitdefpt_addcol_dml_numer_1_prt_partsplitone" for table "mpp21090_dropcol_splitdefpt_addcol_dml_numeric"
NOTICE:  CREATE TABLE will create partition "mpp21090_dropcol_splitdefpt_addcol_dml_numeric_1_prt_def" for table "mpp21090_dropcol_splitdefpt_addcol_dml_numeric"
INSERT INTO mpp21090_dropcol_splitdefpt_addcol_dml_numeric SELECT 1.000000, 1.000000,'e';
SELECT * FROM mpp21090_dropcol_splitdefpt_addcol_dml_numeric ORDER BY 1,2,3;
   col1   |   col2   | col3 
----------+----------+------
 1.000000 | 1.000000 | e
 2.000000 | 2.000000 | a
 2.000000 | 2.000000 | b
(3 rows)

ALTER TABLE mpp21090_dropcol_splitdefpt_addcol_dml_numeric ADD COLUMN col5 numeric DEFAULT 2.000000;
INSERT INTO mpp21090_dropcol_splitdefpt_addcol_dml_numeric VALUES(2.000000,2.000000,'c',2.000000);
SELECT * FROM mpp21090_dropcol_splitdefpt_addcol_dml_numeric ORDER BY 1,2,3,4;
   col1   |   col2   | col3 |   col5   
----------+----------+------+----------
 1.000000 | 1.000000 | e    | 2.000000
 2.000000 | 2.000000 | a    | 2.000000
 2.000000 | 2.000000 | b    | 2.000000
 2.000000 | 2.000000 | c    | 2.000000
(4 rows)

-- Update distribution key
UPDATE mpp21090_dropcol_splitdefpt_addcol_dml_numeric SET col1 = 35.000000 WHERE col2 = 1.000000 AND col1 = 1.000000;
ERROR:  Cannot parallelize an UPDATE statement that updates the distribution columns
SELECT * FROM mpp21090_dropcol_splitdefpt_addcol_dml_numeric ORDER BY 1,2,3;
   col1   |   col2   | col3 |   col5   
----------+----------+------+----------
 1.000000 | 1.000000 | e    | 2.000000
 2.000000 | 2.000000 | a    | 2.000000
 2.000000 | 2.000000 | b    | 2.000000
 2.000000 | 2.000000 | c    | 2.000000
(4 rows)

-- Update partition key
UPDATE mpp21090_dropcol_splitdefpt_addcol_dml_numeric SET col2 = 35.000000 WHERE col2 = 1.000000 AND col1 = 35.000000;
SELECT * FROM mpp21090_dropcol_splitdefpt_addcol_dml_numeric ORDER BY 1,2,3;
   col1   |   col2   | col3 |   col5   
----------+----------+------+----------
 1.000000 | 1.000000 | e    | 2.000000
 2.000000 | 2.000000 | a    | 2.000000
 2.000000 | 2.000000 | b    | 2.000000
 2.000000 | 2.000000 | c    | 2.000000
(4 rows)

DELETE FROM mpp21090_dropcol_splitdefpt_addcol_dml_numeric WHERE col3='b';
SELECT * FROM mpp21090_dropcol_splitdefpt_addcol_dml_numeric ORDER BY 1,2,3;
   col1   |   col2   | col3 |   col5   
----------+----------+------+----------
 1.000000 | 1.000000 | e    | 2.000000
 2.000000 | 2.000000 | a    | 2.000000
 2.000000 | 2.000000 | c    | 2.000000
(3 rows)

-- TEST
DROP TABLE IF EXISTS mpp21090_dropcol_splitdfpt_dml_char;
NOTICE:  table "mpp21090_dropcol_splitdfpt_dml_char" does not exist, skipping
CREATE TABLE mpp21090_dropcol_splitdfpt_dml_char
(
    col1 char,
    col2 char,
    col3 char,
    col4 char,
    col5 int
) 
DISTRIBUTED by (col1)
PARTITION BY LIST(col2)
(
default partition def
);
NOTICE:  CREATE TABLE will create partition "mpp21090_dropcol_splitdfpt_dml_char_1_prt_def" for table "mpp21090_dropcol_splitdfpt_dml_char"
INSERT INTO mpp21090_dropcol_splitdfpt_dml_char VALUES('x','x','a','x',0);
SELECT * FROM mpp21090_dropcol_splitdfpt_dml_char ORDER BY 1,2,3,4;
 col1 | col2 | col3 | col4 | col5 
------+------+------+------+------
 x    | x    | a    | x    |    0
(1 row)

ALTER TABLE mpp21090_dropcol_splitdfpt_dml_char DROP COLUMN col4;
ALTER TABLE mpp21090_dropcol_splitdfpt_dml_char SPLIT DEFAULT PARTITION at ('d') into (partition partsplitone,partition def);
NOTICE:  exchanged partition "def" of relation "mpp21090_dropcol_splitdfpt_dml_char" with relation "pg_temp_209593"
NOTICE:  dropped partition "def" for relation "mpp21090_dropcol_splitdfpt_dml_char"
NOTICE:  CREATE TABLE will create partition "mpp21090_dropcol_splitdfpt_dml_char_1_prt_partsplitone" for table "mpp21090_dropcol_splitdfpt_dml_char"
NOTICE:  CREATE TABLE will create partition "mpp21090_dropcol_splitdfpt_dml_char_1_prt_def" for table "mpp21090_dropcol_splitdfpt_dml_char"
INSERT INTO mpp21090_dropcol_splitdfpt_dml_char SELECT 'a', 'a','b', 1;
SELECT * FROM mpp21090_dropcol_splitdfpt_dml_char ORDER BY 1,2,3;
 col1 | col2 | col3 | col5 
------+------+------+------
 a    | a    | b    |    1
 x    | x    | a    |    0
(2 rows)

-- Update distribution key
UPDATE mpp21090_dropcol_splitdfpt_dml_char SET col1 = 'z' WHERE col2 = 'a' AND col1 = 'a';
ERROR:  Cannot parallelize an UPDATE statement that updates the distribution columns
SELECT * FROM mpp21090_dropcol_splitdfpt_dml_char ORDER BY 1,2,3;
 col1 | col2 | col3 | col5 
------+------+------+------
 a    | a    | b    |    1
 x    | x    | a    |    0
(2 rows)

-- Update partition key
UPDATE mpp21090_dropcol_splitdfpt_dml_char SET col2 = 'z' WHERE col2 = 'a' AND col1 = 'z';
SELECT * FROM mpp21090_dropcol_splitdfpt_dml_char ORDER BY 1,2,3;
 col1 | col2 | col3 | col5 
------+------+------+------
 a    | a    | b    |    1
 x    | x    | a    |    0
(2 rows)

DELETE FROM mpp21090_dropcol_splitdfpt_dml_char WHERE col3='b';
SELECT * FROM mpp21090_dropcol_splitdfpt_dml_char ORDER BY 1,2,3;
 col1 | col2 | col3 | col5 
------+------+------+------
 x    | x    | a    |    0
(1 row)

-- TEST
DROP TABLE IF EXISTS mpp21090_dropcol_splitdfpt_dml_decimal;
NOTICE:  table "mpp21090_dropcol_splitdfpt_dml_decimal" does not exist, skipping
CREATE TABLE mpp21090_dropcol_splitdfpt_dml_decimal
(
    col1 decimal,
    col2 decimal,
    col3 char,
    col4 decimal,
    col5 int
) 
DISTRIBUTED by (col1)
PARTITION BY LIST(col2)
(
default partition def
);
NOTICE:  CREATE TABLE will create partition "mpp21090_dropcol_splitdfpt_dml_decimal_1_prt_def" for table "mpp21090_dropcol_splitdfpt_dml_decimal"
INSERT INTO mpp21090_dropcol_splitdfpt_dml_decimal VALUES(2.00,2.00,'a',2.00,0);
SELECT * FROM mpp21090_dropcol_splitdfpt_dml_decimal ORDER BY 1,2,3,4;
 col1 | col2 | col3 | col4 | col5 
------+------+------+------+------
 2.00 | 2.00 | a    | 2.00 |    0
(1 row)

ALTER TABLE mpp21090_dropcol_splitdfpt_dml_decimal DROP COLUMN col4;
ALTER TABLE mpp21090_dropcol_splitdfpt_dml_decimal SPLIT DEFAULT PARTITION at (5.00) into (partition partsplitone,partition def);
NOTICE:  exchanged partition "def" of relation "mpp21090_dropcol_splitdfpt_dml_decimal" with relation "pg_temp_209712"
NOTICE:  dropped partition "def" for relation "mpp21090_dropcol_splitdfpt_dml_decimal"
NOTICE:  CREATE TABLE will create partition "mpp21090_dropcol_splitdfpt_dml_decimal_1_prt_partsplitone" for table "mpp21090_dropcol_splitdfpt_dml_decimal"
NOTICE:  CREATE TABLE will create partition "mpp21090_dropcol_splitdfpt_dml_decimal_1_prt_def" for table "mpp21090_dropcol_splitdfpt_dml_decimal"
INSERT INTO mpp21090_dropcol_splitdfpt_dml_decimal SELECT 1.00, 1.00,'b', 1;
SELECT * FROM mpp21090_dropcol_splitdfpt_dml_decimal ORDER BY 1,2,3;
 col1 | col2 | col3 | col5 
------+------+------+------
 1.00 | 1.00 | b    |    1
 2.00 | 2.00 | a    |    0
(2 rows)

-- Update distribution key
UPDATE mpp21090_dropcol_splitdfpt_dml_decimal SET col1 = 35.00 WHERE col2 = 1.00 AND col1 = 1.00;
ERROR:  Cannot parallelize an UPDATE statement that updates the distribution columns
SELECT * FROM mpp21090_dropcol_splitdfpt_dml_decimal ORDER BY 1,2,3;
 col1 | col2 | col3 | col5 
------+------+------+------
 1.00 | 1.00 | b    |    1
 2.00 | 2.00 | a    |    0
(2 rows)

-- Update partition key
UPDATE mpp21090_dropcol_splitdfpt_dml_decimal SET col2 = 35.00 WHERE col2 = 1.00 AND col1 = 35.00;
SELECT * FROM mpp21090_dropcol_splitdfpt_dml_decimal ORDER BY 1,2,3;
 col1 | col2 | col3 | col5 
------+------+------+------
 1.00 | 1.00 | b    |    1
 2.00 | 2.00 | a    |    0
(2 rows)

DELETE FROM mpp21090_dropcol_splitdfpt_dml_decimal WHERE col3='b';
SELECT * FROM mpp21090_dropcol_splitdfpt_dml_decimal ORDER BY 1,2,3;
 col1 | col2 | col3 | col5 
------+------+------+------
 2.00 | 2.00 | a    |    0
(1 row)

-- TEST
DROP TABLE IF EXISTS mpp21090_dropcol_splitdfpt_dml_int4;
NOTICE:  table "mpp21090_dropcol_splitdfpt_dml_int4" does not exist, skipping
CREATE TABLE mpp21090_dropcol_splitdfpt_dml_int4
(
    col1 int4,
    col2 int4,
    col3 char,
    col4 int4,
    col5 int
) 
DISTRIBUTED by (col1)
PARTITION BY LIST(col2)
(
default partition def
);
NOTICE:  CREATE TABLE will create partition "mpp21090_dropcol_splitdfpt_dml_int4_1_prt_def" for table "mpp21090_dropcol_splitdfpt_dml_int4"
INSERT INTO mpp21090_dropcol_splitdfpt_dml_int4 VALUES(20000000,20000000,'a',20000000,0);
SELECT * FROM mpp21090_dropcol_splitdfpt_dml_int4 ORDER BY 1,2,3,4;
   col1   |   col2   | col3 |   col4   | col5 
----------+----------+------+----------+------
 20000000 | 20000000 | a    | 20000000 |    0
(1 row)

ALTER TABLE mpp21090_dropcol_splitdfpt_dml_int4 DROP COLUMN col4;
ALTER TABLE mpp21090_dropcol_splitdfpt_dml_int4 SPLIT DEFAULT PARTITION at (50000000) into (partition partsplitone,partition def);
NOTICE:  exchanged partition "def" of relation "mpp21090_dropcol_splitdfpt_dml_int4" with relation "pg_temp_209854"
NOTICE:  dropped partition "def" for relation "mpp21090_dropcol_splitdfpt_dml_int4"
NOTICE:  CREATE TABLE will create partition "mpp21090_dropcol_splitdfpt_dml_int4_1_prt_partsplitone" for table "mpp21090_dropcol_splitdfpt_dml_int4"
NOTICE:  CREATE TABLE will create partition "mpp21090_dropcol_splitdfpt_dml_int4_1_prt_def" for table "mpp21090_dropcol_splitdfpt_dml_int4"
INSERT INTO mpp21090_dropcol_splitdfpt_dml_int4 SELECT 10000000, 10000000,'b', 1;
SELECT * FROM mpp21090_dropcol_splitdfpt_dml_int4 ORDER BY 1,2,3;
   col1   |   col2   | col3 | col5 
----------+----------+------+------
 10000000 | 10000000 | b    |    1
 20000000 | 20000000 | a    |    0
(2 rows)

-- Update distribution key
UPDATE mpp21090_dropcol_splitdfpt_dml_int4 SET col1 = 35000000 WHERE col2 = 10000000 AND col1 = 10000000;
ERROR:  Cannot parallelize an UPDATE statement that updates the distribution columns
SELECT * FROM mpp21090_dropcol_splitdfpt_dml_int4 ORDER BY 1,2,3;
   col1   |   col2   | col3 | col5 
----------+----------+------+------
 10000000 | 10000000 | b    |    1
 20000000 | 20000000 | a    |    0
(2 rows)

-- Update partition key
UPDATE mpp21090_dropcol_splitdfpt_dml_int4 SET col2 = 35000000 WHERE col2 = 10000000 AND col1 = 35000000;
SELECT * FROM mpp21090_dropcol_splitdfpt_dml_int4 ORDER BY 1,2,3;
   col1   |   col2   | col3 | col5 
----------+----------+------+------
 10000000 | 10000000 | b    |    1
 20000000 | 20000000 | a    |    0
(2 rows)

DELETE FROM mpp21090_dropcol_splitdfpt_dml_int4 WHERE col3='b';
SELECT * FROM mpp21090_dropcol_splitdfpt_dml_int4 ORDER BY 1,2,3;
   col1   |   col2   | col3 | col5 
----------+----------+------+------
 20000000 | 20000000 | a    |    0
(1 row)

-- TEST
DROP TABLE IF EXISTS mpp21090_dropcol_splitdfpt_dml_int8;
NOTICE:  table "mpp21090_dropcol_splitdfpt_dml_int8" does not exist, skipping
CREATE TABLE mpp21090_dropcol_splitdfpt_dml_int8
(
    col1 int8,
    col2 int8,
    col3 char,
    col4 int8,
    col5 int
) 
DISTRIBUTED by (col1)
PARTITION BY LIST(col2)
(
default partition def
);
NOTICE:  CREATE TABLE will create partition "mpp21090_dropcol_splitdfpt_dml_int8_1_prt_def" for table "mpp21090_dropcol_splitdfpt_dml_int8"
INSERT INTO mpp21090_dropcol_splitdfpt_dml_int8 VALUES(2000000000000000000,2000000000000000000,'a',2000000000000000000,0);
SELECT * FROM mpp21090_dropcol_splitdfpt_dml_int8 ORDER BY 1,2,3,4;
        col1         |        col2         | col3 |        col4         | col5 
---------------------+---------------------+------+---------------------+------
 2000000000000000000 | 2000000000000000000 | a    | 2000000000000000000 |    0
(1 row)

ALTER TABLE mpp21090_dropcol_splitdfpt_dml_int8 DROP COLUMN col4;
ALTER TABLE mpp21090_dropcol_splitdfpt_dml_int8 SPLIT DEFAULT PARTITION at (500000000000000000) into (partition partsplitone,partition def);
NOTICE:  exchanged partition "def" of relation "mpp21090_dropcol_splitdfpt_dml_int8" with relation "pg_temp_209973"
NOTICE:  dropped partition "def" for relation "mpp21090_dropcol_splitdfpt_dml_int8"
NOTICE:  CREATE TABLE will create partition "mpp21090_dropcol_splitdfpt_dml_int8_1_prt_partsplitone" for table "mpp21090_dropcol_splitdfpt_dml_int8"
NOTICE:  CREATE TABLE will create partition "mpp21090_dropcol_splitdfpt_dml_int8_1_prt_def" for table "mpp21090_dropcol_splitdfpt_dml_int8"
INSERT INTO mpp21090_dropcol_splitdfpt_dml_int8 SELECT 100000000000000000, 100000000000000000,'b', 1;
SELECT * FROM mpp21090_dropcol_splitdfpt_dml_int8 ORDER BY 1,2,3;
        col1         |        col2         | col3 | col5 
---------------------+---------------------+------+------
  100000000000000000 |  100000000000000000 | b    |    1
 2000000000000000000 | 2000000000000000000 | a    |    0
(2 rows)

-- Update distribution key
UPDATE mpp21090_dropcol_splitdfpt_dml_int8 SET col1 = 3500000000000000000 WHERE col2 = 100000000000000000 AND col1 = 100000000000000000;
ERROR:  Cannot parallelize an UPDATE statement that updates the distribution columns
SELECT * FROM mpp21090_dropcol_splitdfpt_dml_int8 ORDER BY 1,2,3;
        col1         |        col2         | col3 | col5 
---------------------+---------------------+------+------
  100000000000000000 |  100000000000000000 | b    |    1
 2000000000000000000 | 2000000000000000000 | a    |    0
(2 rows)

-- Update partition key
UPDATE mpp21090_dropcol_splitdfpt_dml_int8 SET col2 = 3500000000000000000 WHERE col2 = 100000000000000000 AND col1 = 3500000000000000000;
SELECT * FROM mpp21090_dropcol_splitdfpt_dml_int8 ORDER BY 1,2,3;
        col1         |        col2         | col3 | col5 
---------------------+---------------------+------+------
  100000000000000000 |  100000000000000000 | b    |    1
 2000000000000000000 | 2000000000000000000 | a    |    0
(2 rows)

DELETE FROM mpp21090_dropcol_splitdfpt_dml_int8 WHERE col3='b';
SELECT * FROM mpp21090_dropcol_splitdfpt_dml_int8 ORDER BY 1,2,3;
        col1         |        col2         | col3 | col5 
---------------------+---------------------+------+------
 2000000000000000000 | 2000000000000000000 | a    |    0
(1 row)

-- TEST
DROP TABLE IF EXISTS mpp21090_dropcol_splitdfpt_dml_interval;
NOTICE:  table "mpp21090_dropcol_splitdfpt_dml_interval" does not exist, skipping
CREATE TABLE mpp21090_dropcol_splitdfpt_dml_interval
(
    col1 interval,
    col2 interval,
    col3 char,
    col4 interval,
    col5 int
) 
DISTRIBUTED by (col1)
PARTITION BY LIST(col2)
(
default partition def
);
NOTICE:  CREATE TABLE will create partition "mpp21090_dropcol_splitdfpt_dml_interval_1_prt_def" for table "mpp21090_dropcol_splitdfpt_dml_interval"
INSERT INTO mpp21090_dropcol_splitdfpt_dml_interval VALUES('1 hour','1 hour','a','1 hour',0);
SELECT * FROM mpp21090_dropcol_splitdfpt_dml_interval ORDER BY 1,2,3,4;
   col1   |   col2   | col3 |   col4   | col5 
----------+----------+------+----------+------
 01:00:00 | 01:00:00 | a    | 01:00:00 |    0
(1 row)

ALTER TABLE mpp21090_dropcol_splitdfpt_dml_interval DROP COLUMN col4;
ALTER TABLE mpp21090_dropcol_splitdfpt_dml_interval SPLIT DEFAULT PARTITION at ('30 secs') into (partition partsplitone,partition def);
NOTICE:  exchanged partition "def" of relation "mpp21090_dropcol_splitdfpt_dml_interval" with relation "pg_temp_210092"
NOTICE:  dropped partition "def" for relation "mpp21090_dropcol_splitdfpt_dml_interval"
NOTICE:  CREATE TABLE will create partition "mpp21090_dropcol_splitdfpt_dml_interval_1_prt_partsplitone" for table "mpp21090_dropcol_splitdfpt_dml_interval"
NOTICE:  CREATE TABLE will create partition "mpp21090_dropcol_splitdfpt_dml_interval_1_prt_def" for table "mpp21090_dropcol_splitdfpt_dml_interval"
INSERT INTO mpp21090_dropcol_splitdfpt_dml_interval SELECT '1 sec', '1 sec','b', 1;
SELECT * FROM mpp21090_dropcol_splitdfpt_dml_interval ORDER BY 1,2,3;
   col1   |   col2   | col3 | col5 
----------+----------+------+------
 00:00:01 | 00:00:01 | b    |    1
 01:00:00 | 01:00:00 | a    |    0
(2 rows)

-- Update distribution key
UPDATE mpp21090_dropcol_splitdfpt_dml_interval SET col1 = '14 hours' WHERE col2 = '1 sec' AND col1 = '1 sec';
ERROR:  Cannot parallelize an UPDATE statement that updates the distribution columns
SELECT * FROM mpp21090_dropcol_splitdfpt_dml_interval ORDER BY 1,2,3;
   col1   |   col2   | col3 | col5 
----------+----------+------+------
 00:00:01 | 00:00:01 | b    |    1
 01:00:00 | 01:00:00 | a    |    0
(2 rows)

-- Update partition key
UPDATE mpp21090_dropcol_splitdfpt_dml_interval SET col2 = '14 hours' WHERE col2 = '1 sec' AND col1 = '14 hours';
SELECT * FROM mpp21090_dropcol_splitdfpt_dml_interval ORDER BY 1,2,3;
   col1   |   col2   | col3 | col5 
----------+----------+------+------
 00:00:01 | 00:00:01 | b    |    1
 01:00:00 | 01:00:00 | a    |    0
(2 rows)

DELETE FROM mpp21090_dropcol_splitdfpt_dml_interval WHERE col3='b';
SELECT * FROM mpp21090_dropcol_splitdfpt_dml_interval ORDER BY 1,2,3;
   col1   |   col2   | col3 | col5 
----------+----------+------+------
 01:00:00 | 01:00:00 | a    |    0
(1 row)

-- TEST
DROP TABLE IF EXISTS mpp21090_dropcol_splitdfpt_dml_numeric;
NOTICE:  table "mpp21090_dropcol_splitdfpt_dml_numeric" does not exist, skipping
CREATE TABLE mpp21090_dropcol_splitdfpt_dml_numeric
(
    col1 numeric,
    col2 numeric,
    col3 char,
    col4 numeric,
    col5 int
) 
DISTRIBUTED by (col1)
PARTITION BY LIST(col2)
(
default partition def
);
NOTICE:  CREATE TABLE will create partition "mpp21090_dropcol_splitdfpt_dml_numeric_1_prt_def" for table "mpp21090_dropcol_splitdfpt_dml_numeric"
INSERT INTO mpp21090_dropcol_splitdfpt_dml_numeric VALUES(2.000000,2.000000,'a',2.000000,0);
SELECT * FROM mpp21090_dropcol_splitdfpt_dml_numeric ORDER BY 1,2,3,4;
   col1   |   col2   | col3 |   col4   | col5 
----------+----------+------+----------+------
 2.000000 | 2.000000 | a    | 2.000000 |    0
(1 row)

ALTER TABLE mpp21090_dropcol_splitdfpt_dml_numeric DROP COLUMN col4;
ALTER TABLE mpp21090_dropcol_splitdfpt_dml_numeric SPLIT DEFAULT PARTITION at (5.000000) into (partition partsplitone,partition def);
NOTICE:  exchanged partition "def" of relation "mpp21090_dropcol_splitdfpt_dml_numeric" with relation "pg_temp_210211"
NOTICE:  dropped partition "def" for relation "mpp21090_dropcol_splitdfpt_dml_numeric"
NOTICE:  CREATE TABLE will create partition "mpp21090_dropcol_splitdfpt_dml_numeric_1_prt_partsplitone" for table "mpp21090_dropcol_splitdfpt_dml_numeric"
NOTICE:  CREATE TABLE will create partition "mpp21090_dropcol_splitdfpt_dml_numeric_1_prt_def" for table "mpp21090_dropcol_splitdfpt_dml_numeric"
INSERT INTO mpp21090_dropcol_splitdfpt_dml_numeric SELECT 1.000000, 1.000000,'b', 1;
SELECT * FROM mpp21090_dropcol_splitdfpt_dml_numeric ORDER BY 1,2,3;
   col1   |   col2   | col3 | col5 
----------+----------+------+------
 1.000000 | 1.000000 | b    |    1
 2.000000 | 2.000000 | a    |    0
(2 rows)

-- Update distribution key
UPDATE mpp21090_dropcol_splitdfpt_dml_numeric SET col1 = 35.000000 WHERE col2 = 1.000000 AND col1 = 1.000000;
ERROR:  Cannot parallelize an UPDATE statement that updates the distribution columns
SELECT * FROM mpp21090_dropcol_splitdfpt_dml_numeric ORDER BY 1,2,3;
   col1   |   col2   | col3 | col5 
----------+----------+------+------
 1.000000 | 1.000000 | b    |    1
 2.000000 | 2.000000 | a    |    0
(2 rows)

-- Update partition key
UPDATE mpp21090_dropcol_splitdfpt_dml_numeric SET col2 = 35.000000 WHERE col2 = 1.000000 AND col1 = 35.000000;
SELECT * FROM mpp21090_dropcol_splitdfpt_dml_numeric ORDER BY 1,2,3;
   col1   |   col2   | col3 | col5 
----------+----------+------+------
 1.000000 | 1.000000 | b    |    1
 2.000000 | 2.000000 | a    |    0
(2 rows)

DELETE FROM mpp21090_dropcol_splitdfpt_dml_numeric WHERE col3='b';
SELECT * FROM mpp21090_dropcol_splitdfpt_dml_numeric ORDER BY 1,2,3;
   col1   |   col2   | col3 | col5 
----------+----------+------+------
 2.000000 | 2.000000 | a    |    0
(1 row)

-- TEST
DROP TABLE IF EXISTS mpp21090_dropcol_splitpt_dml_char;
NOTICE:  table "mpp21090_dropcol_splitpt_dml_char" does not exist, skipping
CREATE TABLE mpp21090_dropcol_splitpt_dml_char
(
    col1 char,
    col2 char,
    col3 char,
    col4 char,
    col5 int
) 
DISTRIBUTED by (col1)
PARTITION BY LIST(col2)(partition partone VALUES('a','b','c','d','e','f','g','h') WITH (APPENDONLY=true, COMPRESSLEVEL=5, ORIENTATION=column),partition parttwo VALUES('i','j','k','l','m','n','o','p') WITH (APPENDONLY=true, COMPRESSLEVEL=5, ORIENTATION=row),partition partthree VALUES('q','r','s','t','u','v','w','x'));
NOTICE:  CREATE TABLE will create partition "mpp21090_dropcol_splitpt_dml_char_1_prt_partone" for table "mpp21090_dropcol_splitpt_dml_char"
NOTICE:  CREATE TABLE will create partition "mpp21090_dropcol_splitpt_dml_char_1_prt_parttwo" for table "mpp21090_dropcol_splitpt_dml_char"
NOTICE:  CREATE TABLE will create partition "mpp21090_dropcol_splitpt_dml_char_1_prt_partthree" for table "mpp21090_dropcol_splitpt_dml_char"
INSERT INTO mpp21090_dropcol_splitpt_dml_char VALUES('x','x','a','x',0);
SELECT * FROM mpp21090_dropcol_splitpt_dml_char ORDER BY 1,2,3,4;
 col1 | col2 | col3 | col4 | col5 
------+------+------+------+------
 x    | x    | a    | x    |    0
(1 row)

ALTER TABLE mpp21090_dropcol_splitpt_dml_char DROP COLUMN col4;
ALTER TABLE mpp21090_dropcol_splitpt_dml_char SPLIT PARTITION partone at ('d') into (partition partsplitone,partition partsplitwo);
NOTICE:  exchanged partition "partone" of relation "mpp21090_dropcol_splitpt_dml_char" with relation "pg_temp_210353"
NOTICE:  dropped partition "partone" for relation "mpp21090_dropcol_splitpt_dml_char"
NOTICE:  CREATE TABLE will create partition "mpp21090_dropcol_splitpt_dml_char_1_prt_partsplitone" for table "mpp21090_dropcol_splitpt_dml_char"
NOTICE:  CREATE TABLE will create partition "mpp21090_dropcol_splitpt_dml_char_1_prt_partsplitwo" for table "mpp21090_dropcol_splitpt_dml_char"
INSERT INTO mpp21090_dropcol_splitpt_dml_char SELECT 'a', 'a','b', 1;
SELECT * FROM mpp21090_dropcol_splitpt_dml_char ORDER BY 1,2,3;
 col1 | col2 | col3 | col5 
------+------+------+------
 a    | a    | b    |    1
 x    | x    | a    |    0
(2 rows)

-- Update distribution key
UPDATE mpp21090_dropcol_splitpt_dml_char SET col1 = 'z' WHERE col2 = 'a' AND col1 = 'a';
ERROR:  Cannot parallelize an UPDATE statement that updates the distribution columns
SELECT * FROM mpp21090_dropcol_splitpt_dml_char ORDER BY 1,2,3;
 col1 | col2 | col3 | col5 
------+------+------+------
 a    | a    | b    |    1
 x    | x    | a    |    0
(2 rows)

-- Update partition key
UPDATE mpp21090_dropcol_splitpt_dml_char SET col2 ='x'  WHERE col2 = 'a' AND col1 = 'z';
SELECT * FROM mpp21090_dropcol_splitpt_dml_char ORDER BY 1,2,3;
 col1 | col2 | col3 | col5 
------+------+------+------
 a    | a    | b    |    1
 x    | x    | a    |    0
(2 rows)

DELETE FROM mpp21090_dropcol_splitpt_dml_char WHERE col3='b';
SELECT * FROM mpp21090_dropcol_splitpt_dml_char ORDER BY 1,2,3;
 col1 | col2 | col3 | col5 
------+------+------+------
 x    | x    | a    |    0
(1 row)

-- TEST
DROP TABLE IF EXISTS mpp21090_dropcol_splitpt_dml_decimal;
NOTICE:  table "mpp21090_dropcol_splitpt_dml_decimal" does not exist, skipping
CREATE TABLE mpp21090_dropcol_splitpt_dml_decimal
(
    col1 decimal,
    col2 decimal,
    col3 char,
    col4 decimal,
    col5 int
) 
DISTRIBUTED by (col1)
PARTITION BY RANGE(col2)(partition partone start(1.00) end(10.00)  WITH (APPENDONLY=true, COMPRESSLEVEL=5, ORIENTATION=column),partition parttwo start(10.00) end(20.00) WITH (APPENDONLY=true, COMPRESSLEVEL=5, ORIENTATION=row),partition partthree start(20.00) end(30.00));
NOTICE:  CREATE TABLE will create partition "mpp21090_dropcol_splitpt_dml_decimal_1_prt_partone" for table "mpp21090_dropcol_splitpt_dml_decimal"
NOTICE:  CREATE TABLE will create partition "mpp21090_dropcol_splitpt_dml_decimal_1_prt_parttwo" for table "mpp21090_dropcol_splitpt_dml_decimal"
NOTICE:  CREATE TABLE will create partition "mpp21090_dropcol_splitpt_dml_decimal_1_prt_partthree" for table "mpp21090_dropcol_splitpt_dml_decimal"
INSERT INTO mpp21090_dropcol_splitpt_dml_decimal VALUES(2.00,2.00,'a',2.00,0);
SELECT * FROM mpp21090_dropcol_splitpt_dml_decimal ORDER BY 1,2,3,4;
 col1 | col2 | col3 | col4 | col5 
------+------+------+------+------
 2.00 | 2.00 | a    | 2.00 |    0
(1 row)

ALTER TABLE mpp21090_dropcol_splitpt_dml_decimal DROP COLUMN col4;
ALTER TABLE mpp21090_dropcol_splitpt_dml_decimal SPLIT PARTITION partone at (5.00) into (partition partsplitone,partition partsplitwo);
NOTICE:  exchanged partition "partone" of relation "mpp21090_dropcol_splitpt_dml_decimal" with relation "pg_temp_210531"
NOTICE:  dropped partition "partone" for relation "mpp21090_dropcol_splitpt_dml_decimal"
NOTICE:  CREATE TABLE will create partition "mpp21090_dropcol_splitpt_dml_decimal_1_prt_partsplitone" for table "mpp21090_dropcol_splitpt_dml_decimal"
NOTICE:  CREATE TABLE will create partition "mpp21090_dropcol_splitpt_dml_decimal_1_prt_partsplitwo" for table "mpp21090_dropcol_splitpt_dml_decimal"
INSERT INTO mpp21090_dropcol_splitpt_dml_decimal SELECT 1.00, 1.00,'b', 1;
SELECT * FROM mpp21090_dropcol_splitpt_dml_decimal ORDER BY 1,2,3;
 col1 | col2 | col3 | col5 
------+------+------+------
 1.00 | 1.00 | b    |    1
 2.00 | 2.00 | a    |    0
(2 rows)

-- Update distribution key
UPDATE mpp21090_dropcol_splitpt_dml_decimal SET col1 = 35.00 WHERE col2 = 1.00 AND col1 = 1.00;
ERROR:  Cannot parallelize an UPDATE statement that updates the distribution columns
SELECT * FROM mpp21090_dropcol_splitpt_dml_decimal ORDER BY 1,2,3;
 col1 | col2 | col3 | col5 
------+------+------+------
 1.00 | 1.00 | b    |    1
 2.00 | 2.00 | a    |    0
(2 rows)

-- Update partition key
UPDATE mpp21090_dropcol_splitpt_dml_decimal SET col2 =2.00  WHERE col2 = 1.00 AND col1 = 35.00;
SELECT * FROM mpp21090_dropcol_splitpt_dml_decimal ORDER BY 1,2,3;
 col1 | col2 | col3 | col5 
------+------+------+------
 1.00 | 1.00 | b    |    1
 2.00 | 2.00 | a    |    0
(2 rows)

DELETE FROM mpp21090_dropcol_splitpt_dml_decimal WHERE col3='b';
SELECT * FROM mpp21090_dropcol_splitpt_dml_decimal ORDER BY 1,2,3;
 col1 | col2 | col3 | col5 
------+------+------+------
 2.00 | 2.00 | a    |    0
(1 row)

-- TEST
DROP TABLE IF EXISTS mpp21090_dropcol_splitpt_dml_int4;
NOTICE:  table "mpp21090_dropcol_splitpt_dml_int4" does not exist, skipping
CREATE TABLE mpp21090_dropcol_splitpt_dml_int4
(
    col1 int4,
    col2 int4,
    col3 char,
    col4 int4,
    col5 int
) 
DISTRIBUTED by (col1)
PARTITION BY RANGE(col2)(partition partone start(1) end(100000001)  WITH (APPENDONLY=true, COMPRESSLEVEL=5, ORIENTATION=column),partition parttwo start(100000001) end(200000001) WITH (APPENDONLY=true, COMPRESSLEVEL=5, ORIENTATION=row),partition partthree start(200000001) end(300000001));
NOTICE:  CREATE TABLE will create partition "mpp21090_dropcol_splitpt_dml_int4_1_prt_partone" for table "mpp21090_dropcol_splitpt_dml_int4"
NOTICE:  CREATE TABLE will create partition "mpp21090_dropcol_splitpt_dml_int4_1_prt_parttwo" for table "mpp21090_dropcol_splitpt_dml_int4"
NOTICE:  CREATE TABLE will create partition "mpp21090_dropcol_splitpt_dml_int4_1_prt_partthree" for table "mpp21090_dropcol_splitpt_dml_int4"
INSERT INTO mpp21090_dropcol_splitpt_dml_int4 VALUES(20000000,20000000,'a',20000000,0);
SELECT * FROM mpp21090_dropcol_splitpt_dml_int4 ORDER BY 1,2,3,4;
   col1   |   col2   | col3 |   col4   | col5 
----------+----------+------+----------+------
 20000000 | 20000000 | a    | 20000000 |    0
(1 row)

ALTER TABLE mpp21090_dropcol_splitpt_dml_int4 DROP COLUMN col4;
ALTER TABLE mpp21090_dropcol_splitpt_dml_int4 SPLIT PARTITION partone at (50000000) into (partition partsplitone,partition partsplitwo);
NOTICE:  exchanged partition "partone" of relation "mpp21090_dropcol_splitpt_dml_int4" with relation "pg_temp_210734"
NOTICE:  dropped partition "partone" for relation "mpp21090_dropcol_splitpt_dml_int4"
NOTICE:  CREATE TABLE will create partition "mpp21090_dropcol_splitpt_dml_int4_1_prt_partsplitone" for table "mpp21090_dropcol_splitpt_dml_int4"
NOTICE:  CREATE TABLE will create partition "mpp21090_dropcol_splitpt_dml_int4_1_prt_partsplitwo" for table "mpp21090_dropcol_splitpt_dml_int4"
INSERT INTO mpp21090_dropcol_splitpt_dml_int4 SELECT 10000000, 10000000,'b', 1;
SELECT * FROM mpp21090_dropcol_splitpt_dml_int4 ORDER BY 1,2,3;
   col1   |   col2   | col3 | col5 
----------+----------+------+------
 10000000 | 10000000 | b    |    1
 20000000 | 20000000 | a    |    0
(2 rows)

-- Update distribution key
UPDATE mpp21090_dropcol_splitpt_dml_int4 SET col1 = 35000000 WHERE col2 = 10000000 AND col1 = 10000000;
ERROR:  Cannot parallelize an UPDATE statement that updates the distribution columns
SELECT * FROM mpp21090_dropcol_splitpt_dml_int4 ORDER BY 1,2,3;
   col1   |   col2   | col3 | col5 
----------+----------+------+------
 10000000 | 10000000 | b    |    1
 20000000 | 20000000 | a    |    0
(2 rows)

-- Update partition key
UPDATE mpp21090_dropcol_splitpt_dml_int4 SET col2 =20000000  WHERE col2 = 10000000 AND col1 = 35000000;
SELECT * FROM mpp21090_dropcol_splitpt_dml_int4 ORDER BY 1,2,3;
   col1   |   col2   | col3 | col5 
----------+----------+------+------
 10000000 | 10000000 | b    |    1
 20000000 | 20000000 | a    |    0
(2 rows)

DELETE FROM mpp21090_dropcol_splitpt_dml_int4 WHERE col3='b';
SELECT * FROM mpp21090_dropcol_splitpt_dml_int4 ORDER BY 1,2,3;
   col1   |   col2   | col3 | col5 
----------+----------+------+------
 20000000 | 20000000 | a    |    0
(1 row)

-- TEST
DROP TABLE IF EXISTS mpp21090_dropcol_splitpt_dml_int8;
NOTICE:  table "mpp21090_dropcol_splitpt_dml_int8" does not exist, skipping
CREATE TABLE mpp21090_dropcol_splitpt_dml_int8
(
    col1 int8,
    col2 int8,
    col3 char,
    col4 int8,
    col5 int
) 
DISTRIBUTED by (col1)
PARTITION BY RANGE(col2)(partition partone start(1) end(1000000000000000001)  WITH (APPENDONLY=true, COMPRESSLEVEL=5, ORIENTATION=column),partition parttwo start(1000000000000000001) end(2000000000000000001) WITH (APPENDONLY=true, COMPRESSLEVEL=5, ORIENTATION=row),partition partthree start(2000000000000000001) end(3000000000000000001));
NOTICE:  CREATE TABLE will create partition "mpp21090_dropcol_splitpt_dml_int8_1_prt_partone" for table "mpp21090_dropcol_splitpt_dml_int8"
NOTICE:  CREATE TABLE will create partition "mpp21090_dropcol_splitpt_dml_int8_1_prt_parttwo" for table "mpp21090_dropcol_splitpt_dml_int8"
NOTICE:  CREATE TABLE will create partition "mpp21090_dropcol_splitpt_dml_int8_1_prt_partthree" for table "mpp21090_dropcol_splitpt_dml_int8"
INSERT INTO mpp21090_dropcol_splitpt_dml_int8 VALUES(2000000000000000000,2000000000000000000,'a',2000000000000000000,0);
SELECT * FROM mpp21090_dropcol_splitpt_dml_int8 ORDER BY 1,2,3,4;
        col1         |        col2         | col3 |        col4         | col5 
---------------------+---------------------+------+---------------------+------
 2000000000000000000 | 2000000000000000000 | a    | 2000000000000000000 |    0
(1 row)

ALTER TABLE mpp21090_dropcol_splitpt_dml_int8 DROP COLUMN col4;
ALTER TABLE mpp21090_dropcol_splitpt_dml_int8 SPLIT PARTITION partone at (500000000000000000) into (partition partsplitone,partition partsplitwo);
NOTICE:  exchanged partition "partone" of relation "mpp21090_dropcol_splitpt_dml_int8" with relation "pg_temp_210912"
NOTICE:  dropped partition "partone" for relation "mpp21090_dropcol_splitpt_dml_int8"
NOTICE:  CREATE TABLE will create partition "mpp21090_dropcol_splitpt_dml_int8_1_prt_partsplitone" for table "mpp21090_dropcol_splitpt_dml_int8"
NOTICE:  CREATE TABLE will create partition "mpp21090_dropcol_splitpt_dml_int8_1_prt_partsplitwo" for table "mpp21090_dropcol_splitpt_dml_int8"
INSERT INTO mpp21090_dropcol_splitpt_dml_int8 SELECT 100000000000000000, 100000000000000000,'b', 1;
SELECT * FROM mpp21090_dropcol_splitpt_dml_int8 ORDER BY 1,2,3;
        col1         |        col2         | col3 | col5 
---------------------+---------------------+------+------
  100000000000000000 |  100000000000000000 | b    |    1
 2000000000000000000 | 2000000000000000000 | a    |    0
(2 rows)

-- Update distribution key
UPDATE mpp21090_dropcol_splitpt_dml_int8 SET col1 = 3500000000000000000 WHERE col2 = 100000000000000000 AND col1 = 100000000000000000;
ERROR:  Cannot parallelize an UPDATE statement that updates the distribution columns
SELECT * FROM mpp21090_dropcol_splitpt_dml_int8 ORDER BY 1,2,3;
        col1         |        col2         | col3 | col5 
---------------------+---------------------+------+------
  100000000000000000 |  100000000000000000 | b    |    1
 2000000000000000000 | 2000000000000000000 | a    |    0
(2 rows)

-- Update partition key
UPDATE mpp21090_dropcol_splitpt_dml_int8 SET col2 =2000000000000000000  WHERE col2 = 100000000000000000 AND col1 = 3500000000000000000;
SELECT * FROM mpp21090_dropcol_splitpt_dml_int8 ORDER BY 1,2,3;
        col1         |        col2         | col3 | col5 
---------------------+---------------------+------+------
  100000000000000000 |  100000000000000000 | b    |    1
 2000000000000000000 | 2000000000000000000 | a    |    0
(2 rows)

DELETE FROM mpp21090_dropcol_splitpt_dml_int8 WHERE col3='b';
SELECT * FROM mpp21090_dropcol_splitpt_dml_int8 ORDER BY 1,2,3;
        col1         |        col2         | col3 | col5 
---------------------+---------------------+------+------
 2000000000000000000 | 2000000000000000000 | a    |    0
(1 row)

-- TEST
DROP TABLE IF EXISTS mpp21090_dropcol_splitpt_dml_interval;
NOTICE:  table "mpp21090_dropcol_splitpt_dml_interval" does not exist, skipping
CREATE TABLE mpp21090_dropcol_splitpt_dml_interval
(
    col1 interval,
    col2 interval,
    col3 char,
    col4 interval,
    col5 int
) 
DISTRIBUTED by (col1)
PARTITION BY RANGE(col2)(partition partone start('1 sec') end('1 min')  WITH (APPENDONLY=true, COMPRESSLEVEL=5, ORIENTATION=column),partition parttwo start('1 min') end('1 hour') WITH (APPENDONLY=true, COMPRESSLEVEL=5, ORIENTATION=row),partition partthree start('1 hour') end('12 hours'));
NOTICE:  CREATE TABLE will create partition "mpp21090_dropcol_splitpt_dml_interval_1_prt_partone" for table "mpp21090_dropcol_splitpt_dml_interval"
NOTICE:  CREATE TABLE will create partition "mpp21090_dropcol_splitpt_dml_interval_1_prt_parttwo" for table "mpp21090_dropcol_splitpt_dml_interval"
NOTICE:  CREATE TABLE will create partition "mpp21090_dropcol_splitpt_dml_interval_1_prt_partthree" for table "mpp21090_dropcol_splitpt_dml_interval"
INSERT INTO mpp21090_dropcol_splitpt_dml_interval VALUES('1 hour','1 hour','a','1 hour',0);
SELECT * FROM mpp21090_dropcol_splitpt_dml_interval ORDER BY 1,2,3,4;
   col1   |   col2   | col3 |   col4   | col5 
----------+----------+------+----------+------
 01:00:00 | 01:00:00 | a    | 01:00:00 |    0
(1 row)

ALTER TABLE mpp21090_dropcol_splitpt_dml_interval DROP COLUMN col4;
ALTER TABLE mpp21090_dropcol_splitpt_dml_interval SPLIT PARTITION partone at ('30 secs') into (partition partsplitone,partition partsplitwo);
NOTICE:  exchanged partition "partone" of relation "mpp21090_dropcol_splitpt_dml_interval" with relation "pg_temp_211090"
NOTICE:  dropped partition "partone" for relation "mpp21090_dropcol_splitpt_dml_interval"
NOTICE:  CREATE TABLE will create partition "mpp21090_dropcol_splitpt_dml_interval_1_prt_partsplitone" for table "mpp21090_dropcol_splitpt_dml_interval"
NOTICE:  CREATE TABLE will create partition "mpp21090_dropcol_splitpt_dml_interval_1_prt_partsplitwo" for table "mpp21090_dropcol_splitpt_dml_interval"
INSERT INTO mpp21090_dropcol_splitpt_dml_interval SELECT '1 sec', '1 sec','b', 1;
SELECT * FROM mpp21090_dropcol_splitpt_dml_interval ORDER BY 1,2,3;
   col1   |   col2   | col3 | col5 
----------+----------+------+------
 00:00:01 | 00:00:01 | b    |    1
 01:00:00 | 01:00:00 | a    |    0
(2 rows)

-- Update distribution key
UPDATE mpp21090_dropcol_splitpt_dml_interval SET col1 = '14 hours' WHERE col2 = '1 sec' AND col1 = '1 sec';
ERROR:  Cannot parallelize an UPDATE statement that updates the distribution columns
SELECT * FROM mpp21090_dropcol_splitpt_dml_interval ORDER BY 1,2,3;
   col1   |   col2   | col3 | col5 
----------+----------+------+------
 00:00:01 | 00:00:01 | b    |    1
 01:00:00 | 01:00:00 | a    |    0
(2 rows)

-- Update partition key
UPDATE mpp21090_dropcol_splitpt_dml_interval SET col2 ='1 hour'  WHERE col2 = '1 sec' AND col1 = '14 hours';
SELECT * FROM mpp21090_dropcol_splitpt_dml_interval ORDER BY 1,2,3;
   col1   |   col2   | col3 | col5 
----------+----------+------+------
 00:00:01 | 00:00:01 | b    |    1
 01:00:00 | 01:00:00 | a    |    0
(2 rows)

DELETE FROM mpp21090_dropcol_splitpt_dml_interval WHERE col3='b';
SELECT * FROM mpp21090_dropcol_splitpt_dml_interval ORDER BY 1,2,3;
   col1   |   col2   | col3 | col5 
----------+----------+------+------
 01:00:00 | 01:00:00 | a    |    0
(1 row)

-- TEST
DROP TABLE IF EXISTS mpp21090_dropcol_splitpt_dml_numeric;
NOTICE:  table "mpp21090_dropcol_splitpt_dml_numeric" does not exist, skipping
CREATE TABLE mpp21090_dropcol_splitpt_dml_numeric
(
    col1 numeric,
    col2 numeric,
    col3 char,
    col4 numeric,
    col5 int
) 
DISTRIBUTED by (col1)
PARTITION BY RANGE(col2)(partition partone start(1.000000) end(10.000000)  WITH (APPENDONLY=true, COMPRESSLEVEL=5, ORIENTATION=column),partition parttwo start(10.000000) end(20.000000) WITH (APPENDONLY=true, COMPRESSLEVEL=5, ORIENTATION=row),partition partthree start(20.000000) end(30.000000));
NOTICE:  CREATE TABLE will create partition "mpp21090_dropcol_splitpt_dml_numeric_1_prt_partone" for table "mpp21090_dropcol_splitpt_dml_numeric"
NOTICE:  CREATE TABLE will create partition "mpp21090_dropcol_splitpt_dml_numeric_1_prt_parttwo" for table "mpp21090_dropcol_splitpt_dml_numeric"
NOTICE:  CREATE TABLE will create partition "mpp21090_dropcol_splitpt_dml_numeric_1_prt_partthree" for table "mpp21090_dropcol_splitpt_dml_numeric"
INSERT INTO mpp21090_dropcol_splitpt_dml_numeric VALUES(2.000000,2.000000,'a',2.000000,0);
SELECT * FROM mpp21090_dropcol_splitpt_dml_numeric ORDER BY 1,2,3,4;
   col1   |   col2   | col3 |   col4   | col5 
----------+----------+------+----------+------
 2.000000 | 2.000000 | a    | 2.000000 |    0
(1 row)

ALTER TABLE mpp21090_dropcol_splitpt_dml_numeric DROP COLUMN col4;
ALTER TABLE mpp21090_dropcol_splitpt_dml_numeric SPLIT PARTITION partone at (5.000000) into (partition partsplitone,partition partsplitwo);
NOTICE:  exchanged partition "partone" of relation "mpp21090_dropcol_splitpt_dml_numeric" with relation "pg_temp_211268"
NOTICE:  dropped partition "partone" for relation "mpp21090_dropcol_splitpt_dml_numeric"
NOTICE:  CREATE TABLE will create partition "mpp21090_dropcol_splitpt_dml_numeric_1_prt_partsplitone" for table "mpp21090_dropcol_splitpt_dml_numeric"
NOTICE:  CREATE TABLE will create partition "mpp21090_dropcol_splitpt_dml_numeric_1_prt_partsplitwo" for table "mpp21090_dropcol_splitpt_dml_numeric"
INSERT INTO mpp21090_dropcol_splitpt_dml_numeric SELECT 1.000000, 1.000000,'b', 1;
SELECT * FROM mpp21090_dropcol_splitpt_dml_numeric ORDER BY 1,2,3;
   col1   |   col2   | col3 | col5 
----------+----------+------+------
 1.000000 | 1.000000 | b    |    1
 2.000000 | 2.000000 | a    |    0
(2 rows)

-- Update distribution key
UPDATE mpp21090_dropcol_splitpt_dml_numeric SET col1 = 35.000000 WHERE col2 = 1.000000 AND col1 = 1.000000;
ERROR:  Cannot parallelize an UPDATE statement that updates the distribution columns
SELECT * FROM mpp21090_dropcol_splitpt_dml_numeric ORDER BY 1,2,3;
   col1   |   col2   | col3 | col5 
----------+----------+------+------
 1.000000 | 1.000000 | b    |    1
 2.000000 | 2.000000 | a    |    0
(2 rows)

-- Update partition key
UPDATE mpp21090_dropcol_splitpt_dml_numeric SET col2 =2.000000  WHERE col2 = 1.000000 AND col1 = 35.000000;
SELECT * FROM mpp21090_dropcol_splitpt_dml_numeric ORDER BY 1,2,3;
   col1   |   col2   | col3 | col5 
----------+----------+------+------
 1.000000 | 1.000000 | b    |    1
 2.000000 | 2.000000 | a    |    0
(2 rows)

DELETE FROM mpp21090_dropcol_splitpt_dml_numeric WHERE col3='b';
SELECT * FROM mpp21090_dropcol_splitpt_dml_numeric ORDER BY 1,2,3;
   col1   |   col2   | col3 | col5 
----------+----------+------+------
 2.000000 | 2.000000 | a    |    0
(1 row)

-- TEST
DROP TABLE IF EXISTS mpp21090_dropcol_splitpt_idx_dml_char;
NOTICE:  table "mpp21090_dropcol_splitpt_idx_dml_char" does not exist, skipping
CREATE TABLE mpp21090_dropcol_splitpt_idx_dml_char
(
    col1 char,
    col2 char,
    col3 char,
    col4 char,
    col5 int
) 
DISTRIBUTED by (col1)
PARTITION BY LIST(col2)(partition partone VALUES('a','b','c','d','e','f','g','h') WITH (APPENDONLY=true, COMPRESSLEVEL=5, ORIENTATION=column),partition parttwo VALUES('i','j','k','l','m','n','o','p') WITH (APPENDONLY=true, COMPRESSLEVEL=5, ORIENTATION=row),partition partthree VALUES('q','r','s','t','u','v','w','x'));
NOTICE:  CREATE TABLE will create partition "mpp21090_dropcol_splitpt_idx_dml_char_1_prt_partone" for table "mpp21090_dropcol_splitpt_idx_dml_char"
NOTICE:  CREATE TABLE will create partition "mpp21090_dropcol_splitpt_idx_dml_char_1_prt_parttwo" for table "mpp21090_dropcol_splitpt_idx_dml_char"
NOTICE:  CREATE TABLE will create partition "mpp21090_dropcol_splitpt_idx_dml_char_1_prt_partthree" for table "mpp21090_dropcol_splitpt_idx_dml_char"
DROP INDEX IF EXISTS mpp21090_dropcol_splitpt_idx_dml_idx_char;
NOTICE:  index "mpp21090_dropcol_splitpt_idx_dml_idx_char" does not exist, skipping
CREATE INDEX mpp21090_dropcol_splitpt_idx_dml_idx_char on mpp21090_dropcol_splitpt_idx_dml_char(col2);
NOTICE:  building index for child partition "mpp21090_dropcol_splitpt_idx_dml_char_1_prt_partone"
NOTICE:  building index for child partition "mpp21090_dropcol_splitpt_idx_dml_char_1_prt_parttwo"
NOTICE:  building index for child partition "mpp21090_dropcol_splitpt_idx_dml_char_1_prt_partthree"
INSERT INTO mpp21090_dropcol_splitpt_idx_dml_char VALUES('g','g','a','g',0);
SELECT * FROM mpp21090_dropcol_splitpt_idx_dml_char ORDER BY 1,2,3,4;
 col1 | col2 | col3 | col4 | col5 
------+------+------+------+------
 g    | g    | a    | g    |    0
(1 row)

ALTER TABLE mpp21090_dropcol_splitpt_idx_dml_char DROP COLUMN col4;
ALTER TABLE mpp21090_dropcol_splitpt_idx_dml_char SPLIT PARTITION partone at ('d') into (partition partsplitone,partition partsplitwo);
NOTICE:  exchanged partition "partone" of relation "mpp21090_dropcol_splitpt_idx_dml_char" with relation "pg_temp_211471"
NOTICE:  dropped partition "partone" for relation "mpp21090_dropcol_splitpt_idx_dml_char"
NOTICE:  CREATE TABLE will create partition "mpp21090_dropcol_splitpt_idx_dml_char_1_prt_partsplitone" for table "mpp21090_dropcol_splitpt_idx_dml_char"
NOTICE:  CREATE TABLE will create partition "mpp21090_dropcol_splitpt_idx_dml_char_1_prt_partsplitwo" for table "mpp21090_dropcol_splitpt_idx_dml_char"
INSERT INTO mpp21090_dropcol_splitpt_idx_dml_char SELECT 'a', 'a','b', 1;
SELECT * FROM mpp21090_dropcol_splitpt_idx_dml_char ORDER BY 1,2,3;
 col1 | col2 | col3 | col5 
------+------+------+------
 a    | a    | b    |    1
 g    | g    | a    |    0
(2 rows)

-- Update distribution key
UPDATE mpp21090_dropcol_splitpt_idx_dml_char SET col1 = 'z' WHERE col2 = 'a' AND col1 = 'a';
ERROR:  Cannot parallelize an UPDATE statement that updates the distribution columns
SELECT * FROM mpp21090_dropcol_splitpt_idx_dml_char ORDER BY 1,2,3;
 col1 | col2 | col3 | col5 
------+------+------+------
 a    | a    | b    |    1
 g    | g    | a    |    0
(2 rows)

-- Update partition key
UPDATE mpp21090_dropcol_splitpt_idx_dml_char SET col2 ='g'  WHERE col2 = 'a' AND col1 = 'z';
SELECT * FROM mpp21090_dropcol_splitpt_idx_dml_char ORDER BY 1,2,3;
 col1 | col2 | col3 | col5 
------+------+------+------
 a    | a    | b    |    1
 g    | g    | a    |    0
(2 rows)

DELETE FROM mpp21090_dropcol_splitpt_idx_dml_char WHERE col3='b';
SELECT * FROM mpp21090_dropcol_splitpt_idx_dml_char ORDER BY 1,2,3;
 col1 | col2 | col3 | col5 
------+------+------+------
 g    | g    | a    |    0
(1 row)

-- TEST
DROP TABLE IF EXISTS mpp21090_dropcol_splitpt_idx_dml_decimal;
NOTICE:  table "mpp21090_dropcol_splitpt_idx_dml_decimal" does not exist, skipping
CREATE TABLE mpp21090_dropcol_splitpt_idx_dml_decimal
(
    col1 decimal,
    col2 decimal,
    col3 char,
    col4 decimal,
    col5 int
) 
DISTRIBUTED by (col1)
PARTITION BY RANGE(col2)(partition partone start(1.00) end(10.00)  WITH (APPENDONLY=true, COMPRESSLEVEL=5, ORIENTATION=column),partition parttwo start(10.00) end(20.00) WITH (APPENDONLY=true, COMPRESSLEVEL=5, ORIENTATION=row),partition partthree start(20.00) end(30.00));
NOTICE:  CREATE TABLE will create partition "mpp21090_dropcol_splitpt_idx_dml_decimal_1_prt_partone" for table "mpp21090_dropcol_splitpt_idx_dml_decimal"
NOTICE:  CREATE TABLE will create partition "mpp21090_dropcol_splitpt_idx_dml_decimal_1_prt_parttwo" for table "mpp21090_dropcol_splitpt_idx_dml_decimal"
NOTICE:  CREATE TABLE will create partition "mpp21090_dropcol_splitpt_idx_dml_decimal_1_prt_partthree" for table "mpp21090_dropcol_splitpt_idx_dml_decimal"
DROP INDEX IF EXISTS mpp21090_dropcol_splitpt_idx_dml_idx_decimal;
NOTICE:  index "mpp21090_dropcol_splitpt_idx_dml_idx_decimal" does not exist, skipping
CREATE INDEX mpp21090_dropcol_splitpt_idx_dml_idx_decimal on mpp21090_dropcol_splitpt_idx_dml_decimal(col2);
NOTICE:  building index for child partition "mpp21090_dropcol_splitpt_idx_dml_decimal_1_prt_partone"
NOTICE:  building index for child partition "mpp21090_dropcol_splitpt_idx_dml_decimal_1_prt_parttwo"
NOTICE:  building index for child partition "mpp21090_dropcol_splitpt_idx_dml_decimal_1_prt_partthree"
INSERT INTO mpp21090_dropcol_splitpt_idx_dml_decimal VALUES(2.00,2.00,'a',2.00,0);
SELECT * FROM mpp21090_dropcol_splitpt_idx_dml_decimal ORDER BY 1,2,3,4;
 col1 | col2 | col3 | col4 | col5 
------+------+------+------+------
 2.00 | 2.00 | a    | 2.00 |    0
(1 row)

ALTER TABLE mpp21090_dropcol_splitpt_idx_dml_decimal DROP COLUMN col4;
ALTER TABLE mpp21090_dropcol_splitpt_idx_dml_decimal SPLIT PARTITION partone at (5.00) into (partition partsplitone,partition partsplitwo);
NOTICE:  exchanged partition "partone" of relation "mpp21090_dropcol_splitpt_idx_dml_decimal" with relation "pg_temp_211757"
NOTICE:  dropped partition "partone" for relation "mpp21090_dropcol_splitpt_idx_dml_decimal"
NOTICE:  CREATE TABLE will create partition "mpp21090_dropcol_splitpt_idx_dml_decimal_1_prt_partsplitone" for table "mpp21090_dropcol_splitpt_idx_dml_decimal"
NOTICE:  CREATE TABLE will create partition "mpp21090_dropcol_splitpt_idx_dml_decimal_1_prt_partsplitwo" for table "mpp21090_dropcol_splitpt_idx_dml_decimal"
INSERT INTO mpp21090_dropcol_splitpt_idx_dml_decimal SELECT 1.00, 1.00,'b', 1;
SELECT * FROM mpp21090_dropcol_splitpt_idx_dml_decimal ORDER BY 1,2,3;
 col1 | col2 | col3 | col5 
------+------+------+------
 1.00 | 1.00 | b    |    1
 2.00 | 2.00 | a    |    0
(2 rows)

-- Update distribution key
UPDATE mpp21090_dropcol_splitpt_idx_dml_decimal SET col1 = 35.00 WHERE col2 = 1.00 AND col1 = 1.00;
ERROR:  Cannot parallelize an UPDATE statement that updates the distribution columns
SELECT * FROM mpp21090_dropcol_splitpt_idx_dml_decimal ORDER BY 1,2,3;
 col1 | col2 | col3 | col5 
------+------+------+------
 1.00 | 1.00 | b    |    1
 2.00 | 2.00 | a    |    0
(2 rows)

-- Update partition key
UPDATE mpp21090_dropcol_splitpt_idx_dml_decimal SET col2 =2.00  WHERE col2 = 1.00 AND col1 = 35.00;
SELECT * FROM mpp21090_dropcol_splitpt_idx_dml_decimal ORDER BY 1,2,3;
 col1 | col2 | col3 | col5 
------+------+------+------
 1.00 | 1.00 | b    |    1
 2.00 | 2.00 | a    |    0
(2 rows)

DELETE FROM mpp21090_dropcol_splitpt_idx_dml_decimal WHERE col3='b';
SELECT * FROM mpp21090_dropcol_splitpt_idx_dml_decimal ORDER BY 1,2,3;
 col1 | col2 | col3 | col5 
------+------+------+------
 2.00 | 2.00 | a    |    0
(1 row)

-- TEST
DROP TABLE IF EXISTS mpp21090_dropcol_splitpt_idx_dml_int4;
NOTICE:  table "mpp21090_dropcol_splitpt_idx_dml_int4" does not exist, skipping
CREATE TABLE mpp21090_dropcol_splitpt_idx_dml_int4
(
    col1 int4,
    col2 int4,
    col3 char,
    col4 int4,
    col5 int
) 
DISTRIBUTED by (col1)
PARTITION BY RANGE(col2)(partition partone start(1) end(100000001)  WITH (APPENDONLY=true, COMPRESSLEVEL=5, ORIENTATION=column),partition parttwo start(100000001) end(200000001) WITH (APPENDONLY=true, COMPRESSLEVEL=5, ORIENTATION=row),partition partthree start(200000001) end(300000001));
NOTICE:  CREATE TABLE will create partition "mpp21090_dropcol_splitpt_idx_dml_int4_1_prt_partone" for table "mpp21090_dropcol_splitpt_idx_dml_int4"
NOTICE:  CREATE TABLE will create partition "mpp21090_dropcol_splitpt_idx_dml_int4_1_prt_parttwo" for table "mpp21090_dropcol_splitpt_idx_dml_int4"
NOTICE:  CREATE TABLE will create partition "mpp21090_dropcol_splitpt_idx_dml_int4_1_prt_partthree" for table "mpp21090_dropcol_splitpt_idx_dml_int4"
DROP INDEX IF EXISTS mpp21090_dropcol_splitpt_idx_dml_idx_int4;
NOTICE:  index "mpp21090_dropcol_splitpt_idx_dml_idx_int4" does not exist, skipping
CREATE INDEX mpp21090_dropcol_splitpt_idx_dml_idx_int4 on mpp21090_dropcol_splitpt_idx_dml_int4(col2);
NOTICE:  building index for child partition "mpp21090_dropcol_splitpt_idx_dml_int4_1_prt_partone"
NOTICE:  building index for child partition "mpp21090_dropcol_splitpt_idx_dml_int4_1_prt_parttwo"
NOTICE:  building index for child partition "mpp21090_dropcol_splitpt_idx_dml_int4_1_prt_partthree"
INSERT INTO mpp21090_dropcol_splitpt_idx_dml_int4 VALUES(20000000,20000000,'a',20000000,0);
SELECT * FROM mpp21090_dropcol_splitpt_idx_dml_int4 ORDER BY 1,2,3,4;
   col1   |   col2   | col3 |   col4   | col5 
----------+----------+------+----------+------
 20000000 | 20000000 | a    | 20000000 |    0
(1 row)

ALTER TABLE mpp21090_dropcol_splitpt_idx_dml_int4 DROP COLUMN col4;
ALTER TABLE mpp21090_dropcol_splitpt_idx_dml_int4 SPLIT PARTITION partone at (50000000) into (partition partsplitone,partition partsplitwo);
NOTICE:  exchanged partition "partone" of relation "mpp21090_dropcol_splitpt_idx_dml_int4" with relation "pg_temp_212068"
NOTICE:  dropped partition "partone" for relation "mpp21090_dropcol_splitpt_idx_dml_int4"
NOTICE:  CREATE TABLE will create partition "mpp21090_dropcol_splitpt_idx_dml_int4_1_prt_partsplitone" for table "mpp21090_dropcol_splitpt_idx_dml_int4"
NOTICE:  CREATE TABLE will create partition "mpp21090_dropcol_splitpt_idx_dml_int4_1_prt_partsplitwo" for table "mpp21090_dropcol_splitpt_idx_dml_int4"
INSERT INTO mpp21090_dropcol_splitpt_idx_dml_int4 SELECT 10000000, 10000000,'b', 1;
SELECT * FROM mpp21090_dropcol_splitpt_idx_dml_int4 ORDER BY 1,2,3;
   col1   |   col2   | col3 | col5 
----------+----------+------+------
 10000000 | 10000000 | b    |    1
 20000000 | 20000000 | a    |    0
(2 rows)

-- Update distribution key
UPDATE mpp21090_dropcol_splitpt_idx_dml_int4 SET col1 = 350000000 WHERE col2 = 10000000 AND col1 = 10000000;
ERROR:  Cannot parallelize an UPDATE statement that updates the distribution columns
SELECT * FROM mpp21090_dropcol_splitpt_idx_dml_int4 ORDER BY 1,2,3;
   col1   |   col2   | col3 | col5 
----------+----------+------+------
 10000000 | 10000000 | b    |    1
 20000000 | 20000000 | a    |    0
(2 rows)

-- Update partition key
UPDATE mpp21090_dropcol_splitpt_idx_dml_int4 SET col2 =20000000  WHERE col2 = 10000000 AND col1 = 350000000;
SELECT * FROM mpp21090_dropcol_splitpt_idx_dml_int4 ORDER BY 1,2,3;
   col1   |   col2   | col3 | col5 
----------+----------+------+------
 10000000 | 10000000 | b    |    1
 20000000 | 20000000 | a    |    0
(2 rows)

DELETE FROM mpp21090_dropcol_splitpt_idx_dml_int4 WHERE col3='b';
SELECT * FROM mpp21090_dropcol_splitpt_idx_dml_int4 ORDER BY 1,2,3;
   col1   |   col2   | col3 | col5 
----------+----------+------+------
 20000000 | 20000000 | a    |    0
(1 row)

-- TEST
DROP TABLE IF EXISTS mpp21090_dropcol_splitpt_idx_dml_int8;
NOTICE:  table "mpp21090_dropcol_splitpt_idx_dml_int8" does not exist, skipping
CREATE TABLE mpp21090_dropcol_splitpt_idx_dml_int8
(
    col1 int8,
    col2 int8,
    col3 char,
    col4 int8,
    col5 int
) 
DISTRIBUTED by (col1)
PARTITION BY RANGE(col2)(partition partone start(1) end(1000000000000000001)  WITH (APPENDONLY=true, COMPRESSLEVEL=5, ORIENTATION=column),partition parttwo start(1000000000000000001) end(2000000000000000001) WITH (APPENDONLY=true, COMPRESSLEVEL=5, ORIENTATION=row),partition partthree start(2000000000000000001) end(3000000000000000001));
NOTICE:  CREATE TABLE will create partition "mpp21090_dropcol_splitpt_idx_dml_int8_1_prt_partone" for table "mpp21090_dropcol_splitpt_idx_dml_int8"
NOTICE:  CREATE TABLE will create partition "mpp21090_dropcol_splitpt_idx_dml_int8_1_prt_parttwo" for table "mpp21090_dropcol_splitpt_idx_dml_int8"
NOTICE:  CREATE TABLE will create partition "mpp21090_dropcol_splitpt_idx_dml_int8_1_prt_partthree" for table "mpp21090_dropcol_splitpt_idx_dml_int8"
DROP INDEX IF EXISTS mpp21090_dropcol_splitpt_idx_dml_idx_int8;
NOTICE:  index "mpp21090_dropcol_splitpt_idx_dml_idx_int8" does not exist, skipping
CREATE INDEX mpp21090_dropcol_splitpt_idx_dml_idx_int8 on mpp21090_dropcol_splitpt_idx_dml_int8(col2);
NOTICE:  building index for child partition "mpp21090_dropcol_splitpt_idx_dml_int8_1_prt_partone"
NOTICE:  building index for child partition "mpp21090_dropcol_splitpt_idx_dml_int8_1_prt_parttwo"
NOTICE:  building index for child partition "mpp21090_dropcol_splitpt_idx_dml_int8_1_prt_partthree"
INSERT INTO mpp21090_dropcol_splitpt_idx_dml_int8 VALUES(200000000000000000,200000000000000000,'a',200000000000000000,0);
SELECT * FROM mpp21090_dropcol_splitpt_idx_dml_int8 ORDER BY 1,2,3,4;
        col1        |        col2        | col3 |        col4        | col5 
--------------------+--------------------+------+--------------------+------
 200000000000000000 | 200000000000000000 | a    | 200000000000000000 |    0
(1 row)

ALTER TABLE mpp21090_dropcol_splitpt_idx_dml_int8 DROP COLUMN col4;
ALTER TABLE mpp21090_dropcol_splitpt_idx_dml_int8 SPLIT PARTITION partone at (500000000000000000) into (partition partsplitone,partition partsplitwo);
NOTICE:  exchanged partition "partone" of relation "mpp21090_dropcol_splitpt_idx_dml_int8" with relation "pg_temp_212354"
NOTICE:  dropped partition "partone" for relation "mpp21090_dropcol_splitpt_idx_dml_int8"
NOTICE:  CREATE TABLE will create partition "mpp21090_dropcol_splitpt_idx_dml_int8_1_prt_partsplitone" for table "mpp21090_dropcol_splitpt_idx_dml_int8"
NOTICE:  CREATE TABLE will create partition "mpp21090_dropcol_splitpt_idx_dml_int8_1_prt_partsplitwo" for table "mpp21090_dropcol_splitpt_idx_dml_int8"
INSERT INTO mpp21090_dropcol_splitpt_idx_dml_int8 SELECT 100000000000000000, 100000000000000000,'b', 1;
SELECT * FROM mpp21090_dropcol_splitpt_idx_dml_int8 ORDER BY 1,2,3;
        col1        |        col2        | col3 | col5 
--------------------+--------------------+------+------
 100000000000000000 | 100000000000000000 | b    |    1
 200000000000000000 | 200000000000000000 | a    |    0
(2 rows)

-- Update distribution key
UPDATE mpp21090_dropcol_splitpt_idx_dml_int8 SET col1 = 3500000000000000000 WHERE col2 = 100000000000000000 AND col1 = 100000000000000000;
ERROR:  Cannot parallelize an UPDATE statement that updates the distribution columns
SELECT * FROM mpp21090_dropcol_splitpt_idx_dml_int8 ORDER BY 1,2,3;
        col1        |        col2        | col3 | col5 
--------------------+--------------------+------+------
 100000000000000000 | 100000000000000000 | b    |    1
 200000000000000000 | 200000000000000000 | a    |    0
(2 rows)

-- Update partition key
UPDATE mpp21090_dropcol_splitpt_idx_dml_int8 SET col2 =200000000000000000  WHERE col2 = 100000000000000000 AND col1 = 3500000000000000000;
SELECT * FROM mpp21090_dropcol_splitpt_idx_dml_int8 ORDER BY 1,2,3;
        col1        |        col2        | col3 | col5 
--------------------+--------------------+------+------
 100000000000000000 | 100000000000000000 | b    |    1
 200000000000000000 | 200000000000000000 | a    |    0
(2 rows)

DELETE FROM mpp21090_dropcol_splitpt_idx_dml_int8 WHERE col3='b';
SELECT * FROM mpp21090_dropcol_splitpt_idx_dml_int8 ORDER BY 1,2,3;
        col1        |        col2        | col3 | col5 
--------------------+--------------------+------+------
 200000000000000000 | 200000000000000000 | a    |    0
(1 row)

-- TEST
DROP TABLE IF EXISTS mpp21090_dropcol_splitpt_idx_dml_interval;
NOTICE:  table "mpp21090_dropcol_splitpt_idx_dml_interval" does not exist, skipping
CREATE TABLE mpp21090_dropcol_splitpt_idx_dml_interval
(
    col1 interval,
    col2 interval,
    col3 char,
    col4 interval,
    col5 int
) 
DISTRIBUTED by (col1)
PARTITION BY RANGE(col2)(partition partone start('1 sec') end('1 min')  WITH (APPENDONLY=true, COMPRESSLEVEL=5, ORIENTATION=column),partition parttwo start('1 min') end('1 hour') WITH (APPENDONLY=true, COMPRESSLEVEL=5, ORIENTATION=row),partition partthree start('1 hour') end('12 hours'));
NOTICE:  CREATE TABLE will create partition "mpp21090_dropcol_splitpt_idx_dml_interval_1_prt_partone" for table "mpp21090_dropcol_splitpt_idx_dml_interval"
NOTICE:  CREATE TABLE will create partition "mpp21090_dropcol_splitpt_idx_dml_interval_1_prt_parttwo" for table "mpp21090_dropcol_splitpt_idx_dml_interval"
NOTICE:  CREATE TABLE will create partition "mpp21090_dropcol_splitpt_idx_dml_interval_1_prt_partthree" for table "mpp21090_dropcol_splitpt_idx_dml_interval"
DROP INDEX IF EXISTS mpp21090_dropcol_splitpt_idx_dml_idx_interval;
NOTICE:  index "mpp21090_dropcol_splitpt_idx_dml_idx_interval" does not exist, skipping
CREATE INDEX mpp21090_dropcol_splitpt_idx_dml_idx_interval on mpp21090_dropcol_splitpt_idx_dml_interval(col2);
NOTICE:  building index for child partition "mpp21090_dropcol_splitpt_idx_dml_interval_1_prt_partone"
NOTICE:  building index for child partition "mpp21090_dropcol_splitpt_idx_dml_interval_1_prt_parttwo"
NOTICE:  building index for child partition "mpp21090_dropcol_splitpt_idx_dml_interval_1_prt_partthree"
INSERT INTO mpp21090_dropcol_splitpt_idx_dml_interval VALUES('10 secs','10 secs','a','10 secs',0);
SELECT * FROM mpp21090_dropcol_splitpt_idx_dml_interval ORDER BY 1,2,3,4;
   col1   |   col2   | col3 |   col4   | col5 
----------+----------+------+----------+------
 00:00:10 | 00:00:10 | a    | 00:00:10 |    0
(1 row)

ALTER TABLE mpp21090_dropcol_splitpt_idx_dml_interval DROP COLUMN col4;
ALTER TABLE mpp21090_dropcol_splitpt_idx_dml_interval SPLIT PARTITION partone at ('30 secs') into (partition partsplitone,partition partsplitwo);
NOTICE:  exchanged partition "partone" of relation "mpp21090_dropcol_splitpt_idx_dml_interval" with relation "pg_temp_212640"
NOTICE:  dropped partition "partone" for relation "mpp21090_dropcol_splitpt_idx_dml_interval"
NOTICE:  CREATE TABLE will create partition "mpp21090_dropcol_splitpt_idx_dml_interval_1_prt_partsplitone" for table "mpp21090_dropcol_splitpt_idx_dml_interval"
NOTICE:  CREATE TABLE will create partition "mpp21090_dropcol_splitpt_idx_dml_interval_1_prt_partsplitwo" for table "mpp21090_dropcol_splitpt_idx_dml_interval"
INSERT INTO mpp21090_dropcol_splitpt_idx_dml_interval SELECT '1 sec', '1 sec','b', 1;
SELECT * FROM mpp21090_dropcol_splitpt_idx_dml_interval ORDER BY 1,2,3;
   col1   |   col2   | col3 | col5 
----------+----------+------+------
 00:00:01 | 00:00:01 | b    |    1
 00:00:10 | 00:00:10 | a    |    0
(2 rows)

-- Update distribution key
UPDATE mpp21090_dropcol_splitpt_idx_dml_interval SET col1 = '14 hours' WHERE col2 = '1 sec' AND col1 = '1 sec';
ERROR:  Cannot parallelize an UPDATE statement that updates the distribution columns
SELECT * FROM mpp21090_dropcol_splitpt_idx_dml_interval ORDER BY 1,2,3;
   col1   |   col2   | col3 | col5 
----------+----------+------+------
 00:00:01 | 00:00:01 | b    |    1
 00:00:10 | 00:00:10 | a    |    0
(2 rows)

-- Update partition key
UPDATE mpp21090_dropcol_splitpt_idx_dml_interval SET col2 ='10 secs'  WHERE col2 = '1 sec' AND col1 = '14 hours';
SELECT * FROM mpp21090_dropcol_splitpt_idx_dml_interval ORDER BY 1,2,3;
   col1   |   col2   | col3 | col5 
----------+----------+------+------
 00:00:01 | 00:00:01 | b    |    1
 00:00:10 | 00:00:10 | a    |    0
(2 rows)

DELETE FROM mpp21090_dropcol_splitpt_idx_dml_interval WHERE col3='b';
SELECT * FROM mpp21090_dropcol_splitpt_idx_dml_interval ORDER BY 1,2,3;
   col1   |   col2   | col3 | col5 
----------+----------+------+------
 00:00:10 | 00:00:10 | a    |    0
(1 row)

-- TEST
DROP TABLE IF EXISTS mpp21090_dropcol_splitpt_idx_dml_numeric;
NOTICE:  table "mpp21090_dropcol_splitpt_idx_dml_numeric" does not exist, skipping
CREATE TABLE mpp21090_dropcol_splitpt_idx_dml_numeric
(
    col1 numeric,
    col2 numeric,
    col3 char,
    col4 numeric,
    col5 int
) 
DISTRIBUTED by (col1)
PARTITION BY RANGE(col2)(partition partone start(1.000000) end(10.000000)  WITH (APPENDONLY=true, COMPRESSLEVEL=5, ORIENTATION=column),partition parttwo start(10.000000) end(20.000000) WITH (APPENDONLY=true, COMPRESSLEVEL=5, ORIENTATION=row),partition partthree start(20.000000) end(30.000000));
NOTICE:  CREATE TABLE will create partition "mpp21090_dropcol_splitpt_idx_dml_numeric_1_prt_partone" for table "mpp21090_dropcol_splitpt_idx_dml_numeric"
NOTICE:  CREATE TABLE will create partition "mpp21090_dropcol_splitpt_idx_dml_numeric_1_prt_parttwo" for table "mpp21090_dropcol_splitpt_idx_dml_numeric"
NOTICE:  CREATE TABLE will create partition "mpp21090_dropcol_splitpt_idx_dml_numeric_1_prt_partthree" for table "mpp21090_dropcol_splitpt_idx_dml_numeric"
DROP INDEX IF EXISTS mpp21090_dropcol_splitpt_idx_dml_idx_numeric;
NOTICE:  index "mpp21090_dropcol_splitpt_idx_dml_idx_numeric" does not exist, skipping
CREATE INDEX mpp21090_dropcol_splitpt_idx_dml_idx_numeric on mpp21090_dropcol_splitpt_idx_dml_numeric(col2);
NOTICE:  building index for child partition "mpp21090_dropcol_splitpt_idx_dml_numeric_1_prt_partone"
NOTICE:  building index for child partition "mpp21090_dropcol_splitpt_idx_dml_numeric_1_prt_parttwo"
NOTICE:  building index for child partition "mpp21090_dropcol_splitpt_idx_dml_numeric_1_prt_partthree"
INSERT INTO mpp21090_dropcol_splitpt_idx_dml_numeric VALUES(2.000000,2.000000,'a',2.000000,0);
SELECT * FROM mpp21090_dropcol_splitpt_idx_dml_numeric ORDER BY 1,2,3,4;
   col1   |   col2   | col3 |   col4   | col5 
----------+----------+------+----------+------
 2.000000 | 2.000000 | a    | 2.000000 |    0
(1 row)

ALTER TABLE mpp21090_dropcol_splitpt_idx_dml_numeric DROP COLUMN col4;
ALTER TABLE mpp21090_dropcol_splitpt_idx_dml_numeric SPLIT PARTITION partone at (5.000000) into (partition partsplitone,partition partsplitwo);
NOTICE:  exchanged partition "partone" of relation "mpp21090_dropcol_splitpt_idx_dml_numeric" with relation "pg_temp_212926"
NOTICE:  dropped partition "partone" for relation "mpp21090_dropcol_splitpt_idx_dml_numeric"
NOTICE:  CREATE TABLE will create partition "mpp21090_dropcol_splitpt_idx_dml_numeric_1_prt_partsplitone" for table "mpp21090_dropcol_splitpt_idx_dml_numeric"
NOTICE:  CREATE TABLE will create partition "mpp21090_dropcol_splitpt_idx_dml_numeric_1_prt_partsplitwo" for table "mpp21090_dropcol_splitpt_idx_dml_numeric"
INSERT INTO mpp21090_dropcol_splitpt_idx_dml_numeric SELECT 1.000000, 1.000000,'b', 1;
SELECT * FROM mpp21090_dropcol_splitpt_idx_dml_numeric ORDER BY 1,2,3;
   col1   |   col2   | col3 | col5 
----------+----------+------+------
 1.000000 | 1.000000 | b    |    1
 2.000000 | 2.000000 | a    |    0
(2 rows)

-- Update distribution key
UPDATE mpp21090_dropcol_splitpt_idx_dml_numeric SET col1 = 35.000000 WHERE col2 = 1.000000 AND col1 = 1.000000;
ERROR:  Cannot parallelize an UPDATE statement that updates the distribution columns
SELECT * FROM mpp21090_dropcol_splitpt_idx_dml_numeric ORDER BY 1,2,3;
   col1   |   col2   | col3 | col5 
----------+----------+------+------
 1.000000 | 1.000000 | b    |    1
 2.000000 | 2.000000 | a    |    0
(2 rows)

-- Update partition key
UPDATE mpp21090_dropcol_splitpt_idx_dml_numeric SET col2 =2.000000  WHERE col2 = 1.000000 AND col1 = 35.000000;
SELECT * FROM mpp21090_dropcol_splitpt_idx_dml_numeric ORDER BY 1,2,3;
   col1   |   col2   | col3 | col5 
----------+----------+------+------
 1.000000 | 1.000000 | b    |    1
 2.000000 | 2.000000 | a    |    0
(2 rows)

DELETE FROM mpp21090_dropcol_splitpt_idx_dml_numeric WHERE col3='b';
SELECT * FROM mpp21090_dropcol_splitpt_idx_dml_numeric ORDER BY 1,2,3;
   col1   |   col2   | col3 | col5 
----------+----------+------+------
 2.000000 | 2.000000 | a    |    0
(1 row)

-- TEST
DROP TABLE IF EXISTS mpp21090_drop_distcol_dml_boolean;
NOTICE:  table "mpp21090_drop_distcol_dml_boolean" does not exist, skipping
CREATE TABLE mpp21090_drop_distcol_dml_boolean(
col1 boolean,
col2 decimal,
col3 char,
col4 date,
col5 int
)  with (appendonly= true) distributed by (col1);
INSERT INTO mpp21090_drop_distcol_dml_boolean VALUES(True,0.00,'a','2014-01-01',0);
SELECT * FROM mpp21090_drop_distcol_dml_boolean ORDER BY 1,2,3,4;
 col1 | col2 | col3 |    col4    | col5 
------+------+------+------------+------
 t    | 0.00 | a    | 2014-01-01 |    0
(1 row)

ALTER TABLE mpp21090_drop_distcol_dml_boolean DROP COLUMN col1;
NOTICE:  Dropping a column that is part of the distribution policy forces a NULL distribution policy
INSERT INTO mpp21090_drop_distcol_dml_boolean SELECT 1.00,'b','2014-01-02',1;
SELECT * FROM mpp21090_drop_distcol_dml_boolean ORDER BY 1,2,3;
 col2 | col3 |    col4    | col5 
------+------+------------+------
 0.00 | a    | 2014-01-01 |    0
 1.00 | b    | 2014-01-02 |    1
(2 rows)

UPDATE mpp21090_drop_distcol_dml_boolean SET col3='c' WHERE col3 = 'b' AND col5 = 1;
SELECT * FROM mpp21090_drop_distcol_dml_boolean ORDER BY 1,2,3;
 col2 | col3 |    col4    | col5 
------+------+------------+------
 0.00 | a    | 2014-01-01 |    0
 1.00 | c    | 2014-01-02 |    1
(2 rows)

DELETE FROM mpp21090_drop_distcol_dml_boolean WHERE col3='c';
SELECT * FROM mpp21090_drop_distcol_dml_boolean ORDER BY 1,2,3,4;
 col2 | col3 |    col4    | col5 
------+------+------------+------
 0.00 | a    | 2014-01-01 |    0
(1 row)

-- TEST
DROP TABLE IF EXISTS mpp21090_drop_distcol_dml_boolean;
CREATE TABLE mpp21090_drop_distcol_dml_boolean(
col1 boolean,
col2 decimal,
col3 char,
col4 date,
col5 int
)  with (appendonly= true, orientation= column) distributed by (col1);
INSERT INTO mpp21090_drop_distcol_dml_boolean VALUES(True,0.00,'a','2014-01-01',0);
SELECT * FROM mpp21090_drop_distcol_dml_boolean ORDER BY 1,2,3,4;
 col1 | col2 | col3 |    col4    | col5 
------+------+------+------------+------
 t    | 0.00 | a    | 2014-01-01 |    0
(1 row)

ALTER TABLE mpp21090_drop_distcol_dml_boolean DROP COLUMN col1;
NOTICE:  Dropping a column that is part of the distribution policy forces a NULL distribution policy
INSERT INTO mpp21090_drop_distcol_dml_boolean SELECT 1.00,'b','2014-01-02',1;
SELECT * FROM mpp21090_drop_distcol_dml_boolean ORDER BY 1,2,3;
 col2 | col3 |    col4    | col5 
------+------+------------+------
 0.00 | a    | 2014-01-01 |    0
 1.00 | b    | 2014-01-02 |    1
(2 rows)

UPDATE mpp21090_drop_distcol_dml_boolean SET col3='c' WHERE col3 = 'b' AND col5 = 1;
SELECT * FROM mpp21090_drop_distcol_dml_boolean ORDER BY 1,2,3;
 col2 | col3 |    col4    | col5 
------+------+------------+------
 0.00 | a    | 2014-01-01 |    0
 1.00 | c    | 2014-01-02 |    1
(2 rows)

DELETE FROM mpp21090_drop_distcol_dml_boolean WHERE col3='c';
SELECT * FROM mpp21090_drop_distcol_dml_boolean ORDER BY 1,2,3,4;
 col2 | col3 |    col4    | col5 
------+------+------------+------
 0.00 | a    | 2014-01-01 |    0
(1 row)

-- TEST
DROP TABLE IF EXISTS mpp21090_drop_distcol_dml_boolean;
CREATE TABLE mpp21090_drop_distcol_dml_boolean(
col1 boolean,
col2 decimal,
col3 char,
col4 date,
col5 int
) distributed by (col1);
INSERT INTO mpp21090_drop_distcol_dml_boolean VALUES(True,0.00,'a','2014-01-01',0);
SELECT * FROM mpp21090_drop_distcol_dml_boolean ORDER BY 1,2,3,4;
 col1 | col2 | col3 |    col4    | col5 
------+------+------+------------+------
 t    | 0.00 | a    | 2014-01-01 |    0
(1 row)

ALTER TABLE mpp21090_drop_distcol_dml_boolean DROP COLUMN col1;
NOTICE:  Dropping a column that is part of the distribution policy forces a NULL distribution policy
INSERT INTO mpp21090_drop_distcol_dml_boolean SELECT 1.00,'b','2014-01-02',1;
SELECT * FROM mpp21090_drop_distcol_dml_boolean ORDER BY 1,2,3;
 col2 | col3 |    col4    | col5 
------+------+------------+------
 0.00 | a    | 2014-01-01 |    0
 1.00 | b    | 2014-01-02 |    1
(2 rows)

UPDATE mpp21090_drop_distcol_dml_boolean SET col3='c' WHERE col3 = 'b' AND col5 = 1;
SELECT * FROM mpp21090_drop_distcol_dml_boolean ORDER BY 1,2,3;
 col2 | col3 |    col4    | col5 
------+------+------------+------
 0.00 | a    | 2014-01-01 |    0
 1.00 | c    | 2014-01-02 |    1
(2 rows)

DELETE FROM mpp21090_drop_distcol_dml_boolean WHERE col3='c';
SELECT * FROM mpp21090_drop_distcol_dml_boolean ORDER BY 1,2,3,4;
 col2 | col3 |    col4    | col5 
------+------+------------+------
 0.00 | a    | 2014-01-01 |    0
(1 row)

-- TEST
DROP TABLE IF EXISTS mpp21090_drop_distcol_dml_char;
NOTICE:  table "mpp21090_drop_distcol_dml_char" does not exist, skipping
CREATE TABLE mpp21090_drop_distcol_dml_char(
col1 char,
col2 decimal,
col3 char,
col4 date,
col5 int
)  with (appendonly= true) distributed by (col1);
INSERT INTO mpp21090_drop_distcol_dml_char VALUES('z',0.00,'a','2014-01-01',0);
SELECT * FROM mpp21090_drop_distcol_dml_char ORDER BY 1,2,3,4;
 col1 | col2 | col3 |    col4    | col5 
------+------+------+------------+------
 z    | 0.00 | a    | 2014-01-01 |    0
(1 row)

ALTER TABLE mpp21090_drop_distcol_dml_char DROP COLUMN col1;
NOTICE:  Dropping a column that is part of the distribution policy forces a NULL distribution policy
INSERT INTO mpp21090_drop_distcol_dml_char SELECT 1.00,'b','2014-01-02',1;
SELECT * FROM mpp21090_drop_distcol_dml_char ORDER BY 1,2,3;
 col2 | col3 |    col4    | col5 
------+------+------------+------
 0.00 | a    | 2014-01-01 |    0
 1.00 | b    | 2014-01-02 |    1
(2 rows)

UPDATE mpp21090_drop_distcol_dml_char SET col3='c' WHERE col3 = 'b' AND col5 = 1;
SELECT * FROM mpp21090_drop_distcol_dml_char ORDER BY 1,2,3;
 col2 | col3 |    col4    | col5 
------+------+------------+------
 0.00 | a    | 2014-01-01 |    0
 1.00 | c    | 2014-01-02 |    1
(2 rows)

DELETE FROM mpp21090_drop_distcol_dml_char WHERE col3='c';
SELECT * FROM mpp21090_drop_distcol_dml_char ORDER BY 1,2,3,4;
 col2 | col3 |    col4    | col5 
------+------+------------+------
 0.00 | a    | 2014-01-01 |    0
(1 row)

-- TEST
DROP TABLE IF EXISTS mpp21090_drop_distcol_dml_char;
CREATE TABLE mpp21090_drop_distcol_dml_char(
col1 char,
col2 decimal,
col3 char,
col4 date,
col5 int
)  with (appendonly= true, orientation= column) distributed by (col1);
INSERT INTO mpp21090_drop_distcol_dml_char VALUES('z',0.00,'a','2014-01-01',0);
SELECT * FROM mpp21090_drop_distcol_dml_char ORDER BY 1,2,3,4;
 col1 | col2 | col3 |    col4    | col5 
------+------+------+------------+------
 z    | 0.00 | a    | 2014-01-01 |    0
(1 row)

ALTER TABLE mpp21090_drop_distcol_dml_char DROP COLUMN col1;
NOTICE:  Dropping a column that is part of the distribution policy forces a NULL distribution policy
INSERT INTO mpp21090_drop_distcol_dml_char SELECT 1.00,'b','2014-01-02',1;
SELECT * FROM mpp21090_drop_distcol_dml_char ORDER BY 1,2,3;
 col2 | col3 |    col4    | col5 
------+------+------------+------
 0.00 | a    | 2014-01-01 |    0
 1.00 | b    | 2014-01-02 |    1
(2 rows)

UPDATE mpp21090_drop_distcol_dml_char SET col3='c' WHERE col3 = 'b' AND col5 = 1;
SELECT * FROM mpp21090_drop_distcol_dml_char ORDER BY 1,2,3;
 col2 | col3 |    col4    | col5 
------+------+------------+------
 0.00 | a    | 2014-01-01 |    0
 1.00 | c    | 2014-01-02 |    1
(2 rows)

DELETE FROM mpp21090_drop_distcol_dml_char WHERE col3='c';
SELECT * FROM mpp21090_drop_distcol_dml_char ORDER BY 1,2,3,4;
 col2 | col3 |    col4    | col5 
------+------+------------+------
 0.00 | a    | 2014-01-01 |    0
(1 row)

-- TEST
DROP TABLE IF EXISTS mpp21090_drop_distcol_dml_char;
CREATE TABLE mpp21090_drop_distcol_dml_char(
col1 char,
col2 decimal,
col3 char,
col4 date,
col5 int
) distributed by (col1);
INSERT INTO mpp21090_drop_distcol_dml_char VALUES('z',0.00,'a','2014-01-01',0);
SELECT * FROM mpp21090_drop_distcol_dml_char ORDER BY 1,2,3,4;
 col1 | col2 | col3 |    col4    | col5 
------+------+------+------------+------
 z    | 0.00 | a    | 2014-01-01 |    0
(1 row)

ALTER TABLE mpp21090_drop_distcol_dml_char DROP COLUMN col1;
NOTICE:  Dropping a column that is part of the distribution policy forces a NULL distribution policy
INSERT INTO mpp21090_drop_distcol_dml_char SELECT 1.00,'b','2014-01-02',1;
SELECT * FROM mpp21090_drop_distcol_dml_char ORDER BY 1,2,3;
 col2 | col3 |    col4    | col5 
------+------+------------+------
 0.00 | a    | 2014-01-01 |    0
 1.00 | b    | 2014-01-02 |    1
(2 rows)

UPDATE mpp21090_drop_distcol_dml_char SET col3='c' WHERE col3 = 'b' AND col5 = 1;
SELECT * FROM mpp21090_drop_distcol_dml_char ORDER BY 1,2,3;
 col2 | col3 |    col4    | col5 
------+------+------------+------
 0.00 | a    | 2014-01-01 |    0
 1.00 | c    | 2014-01-02 |    1
(2 rows)

DELETE FROM mpp21090_drop_distcol_dml_char WHERE col3='c';
SELECT * FROM mpp21090_drop_distcol_dml_char ORDER BY 1,2,3,4;
 col2 | col3 |    col4    | col5 
------+------+------------+------
 0.00 | a    | 2014-01-01 |    0
(1 row)

-- TEST
DROP TABLE IF EXISTS mpp21090_drop_distcol_dml_decimal;
NOTICE:  table "mpp21090_drop_distcol_dml_decimal" does not exist, skipping
CREATE TABLE mpp21090_drop_distcol_dml_decimal(
col1 decimal,
col2 decimal,
col3 char,
col4 date,
col5 int
)  with (appendonly= true) distributed by (col1);
INSERT INTO mpp21090_drop_distcol_dml_decimal VALUES(2.00,0.00,'a','2014-01-01',0);
SELECT * FROM mpp21090_drop_distcol_dml_decimal ORDER BY 1,2,3,4;
 col1 | col2 | col3 |    col4    | col5 
------+------+------+------------+------
 2.00 | 0.00 | a    | 2014-01-01 |    0
(1 row)

ALTER TABLE mpp21090_drop_distcol_dml_decimal DROP COLUMN col1;
NOTICE:  Dropping a column that is part of the distribution policy forces a NULL distribution policy
INSERT INTO mpp21090_drop_distcol_dml_decimal SELECT 1.00,'b','2014-01-02',1;
SELECT * FROM mpp21090_drop_distcol_dml_decimal ORDER BY 1,2,3;
 col2 | col3 |    col4    | col5 
------+------+------------+------
 0.00 | a    | 2014-01-01 |    0
 1.00 | b    | 2014-01-02 |    1
(2 rows)

UPDATE mpp21090_drop_distcol_dml_decimal SET col3='c' WHERE col3 = 'b' AND col5 = 1;
SELECT * FROM mpp21090_drop_distcol_dml_decimal ORDER BY 1,2,3;
 col2 | col3 |    col4    | col5 
------+------+------------+------
 0.00 | a    | 2014-01-01 |    0
 1.00 | c    | 2014-01-02 |    1
(2 rows)

DELETE FROM mpp21090_drop_distcol_dml_decimal WHERE col3='c';
SELECT * FROM mpp21090_drop_distcol_dml_decimal ORDER BY 1,2,3,4;
 col2 | col3 |    col4    | col5 
------+------+------------+------
 0.00 | a    | 2014-01-01 |    0
(1 row)

-- TEST
DROP TABLE IF EXISTS mpp21090_drop_distcol_dml_decimal;
CREATE TABLE mpp21090_drop_distcol_dml_decimal(
col1 decimal,
col2 decimal,
col3 char,
col4 date,
col5 int
)  with (appendonly= true, orientation= column) distributed by (col1);
INSERT INTO mpp21090_drop_distcol_dml_decimal VALUES(2.00,0.00,'a','2014-01-01',0);
SELECT * FROM mpp21090_drop_distcol_dml_decimal ORDER BY 1,2,3,4;
 col1 | col2 | col3 |    col4    | col5 
------+------+------+------------+------
 2.00 | 0.00 | a    | 2014-01-01 |    0
(1 row)

ALTER TABLE mpp21090_drop_distcol_dml_decimal DROP COLUMN col1;
NOTICE:  Dropping a column that is part of the distribution policy forces a NULL distribution policy
INSERT INTO mpp21090_drop_distcol_dml_decimal SELECT 1.00,'b','2014-01-02',1;
SELECT * FROM mpp21090_drop_distcol_dml_decimal ORDER BY 1,2,3;
 col2 | col3 |    col4    | col5 
------+------+------------+------
 0.00 | a    | 2014-01-01 |    0
 1.00 | b    | 2014-01-02 |    1
(2 rows)

UPDATE mpp21090_drop_distcol_dml_decimal SET col3='c' WHERE col3 = 'b' AND col5 = 1;
SELECT * FROM mpp21090_drop_distcol_dml_decimal ORDER BY 1,2,3;
 col2 | col3 |    col4    | col5 
------+------+------------+------
 0.00 | a    | 2014-01-01 |    0
 1.00 | c    | 2014-01-02 |    1
(2 rows)

DELETE FROM mpp21090_drop_distcol_dml_decimal WHERE col3='c';
SELECT * FROM mpp21090_drop_distcol_dml_decimal ORDER BY 1,2,3,4;
 col2 | col3 |    col4    | col5 
------+------+------------+------
 0.00 | a    | 2014-01-01 |    0
(1 row)

-- TEST
DROP TABLE IF EXISTS mpp21090_drop_distcol_dml_decimal;
CREATE TABLE mpp21090_drop_distcol_dml_decimal(
col1 decimal,
col2 decimal,
col3 char,
col4 date,
col5 int
) distributed by (col1);
INSERT INTO mpp21090_drop_distcol_dml_decimal VALUES(2.00,0.00,'a','2014-01-01',0);
SELECT * FROM mpp21090_drop_distcol_dml_decimal ORDER BY 1,2,3,4;
 col1 | col2 | col3 |    col4    | col5 
------+------+------+------------+------
 2.00 | 0.00 | a    | 2014-01-01 |    0
(1 row)

ALTER TABLE mpp21090_drop_distcol_dml_decimal DROP COLUMN col1;
NOTICE:  Dropping a column that is part of the distribution policy forces a NULL distribution policy
INSERT INTO mpp21090_drop_distcol_dml_decimal SELECT 1.00,'b','2014-01-02',1;
SELECT * FROM mpp21090_drop_distcol_dml_decimal ORDER BY 1,2,3;
 col2 | col3 |    col4    | col5 
------+------+------------+------
 0.00 | a    | 2014-01-01 |    0
 1.00 | b    | 2014-01-02 |    1
(2 rows)

UPDATE mpp21090_drop_distcol_dml_decimal SET col3='c' WHERE col3 = 'b' AND col5 = 1;
SELECT * FROM mpp21090_drop_distcol_dml_decimal ORDER BY 1,2,3;
 col2 | col3 |    col4    | col5 
------+------+------------+------
 0.00 | a    | 2014-01-01 |    0
 1.00 | c    | 2014-01-02 |    1
(2 rows)

DELETE FROM mpp21090_drop_distcol_dml_decimal WHERE col3='c';
SELECT * FROM mpp21090_drop_distcol_dml_decimal ORDER BY 1,2,3,4;
 col2 | col3 |    col4    | col5 
------+------+------------+------
 0.00 | a    | 2014-01-01 |    0
(1 row)

-- TEST
DROP TABLE IF EXISTS mpp21090_drop_distcol_dml_int4;
NOTICE:  table "mpp21090_drop_distcol_dml_int4" does not exist, skipping
CREATE TABLE mpp21090_drop_distcol_dml_int4(
col1 int4,
col2 decimal,
col3 char,
col4 date,
col5 int
)  with (appendonly= true) distributed by (col1);
INSERT INTO mpp21090_drop_distcol_dml_int4 VALUES(2000000000,0.00,'a','2014-01-01',0);
SELECT * FROM mpp21090_drop_distcol_dml_int4 ORDER BY 1,2,3,4;
    col1    | col2 | col3 |    col4    | col5 
------------+------+------+------------+------
 2000000000 | 0.00 | a    | 2014-01-01 |    0
(1 row)

ALTER TABLE mpp21090_drop_distcol_dml_int4 DROP COLUMN col1;
NOTICE:  Dropping a column that is part of the distribution policy forces a NULL distribution policy
INSERT INTO mpp21090_drop_distcol_dml_int4 SELECT 1.00,'b','2014-01-02',1;
SELECT * FROM mpp21090_drop_distcol_dml_int4 ORDER BY 1,2,3;
 col2 | col3 |    col4    | col5 
------+------+------------+------
 0.00 | a    | 2014-01-01 |    0
 1.00 | b    | 2014-01-02 |    1
(2 rows)

UPDATE mpp21090_drop_distcol_dml_int4 SET col3='c' WHERE col3 = 'b' AND col5 = 1;
SELECT * FROM mpp21090_drop_distcol_dml_int4 ORDER BY 1,2,3;
 col2 | col3 |    col4    | col5 
------+------+------------+------
 0.00 | a    | 2014-01-01 |    0
 1.00 | c    | 2014-01-02 |    1
(2 rows)

DELETE FROM mpp21090_drop_distcol_dml_int4 WHERE col3='c';
SELECT * FROM mpp21090_drop_distcol_dml_int4 ORDER BY 1,2,3,4;
 col2 | col3 |    col4    | col5 
------+------+------------+------
 0.00 | a    | 2014-01-01 |    0
(1 row)

-- TEST
DROP TABLE IF EXISTS mpp21090_drop_distcol_dml_int4;
CREATE TABLE mpp21090_drop_distcol_dml_int4(
col1 int4,
col2 decimal,
col3 char,
col4 date,
col5 int
)  with (appendonly= true, orientation= column) distributed by (col1);
INSERT INTO mpp21090_drop_distcol_dml_int4 VALUES(2000000000,0.00,'a','2014-01-01',0);
SELECT * FROM mpp21090_drop_distcol_dml_int4 ORDER BY 1,2,3,4;
    col1    | col2 | col3 |    col4    | col5 
------------+------+------+------------+------
 2000000000 | 0.00 | a    | 2014-01-01 |    0
(1 row)

ALTER TABLE mpp21090_drop_distcol_dml_int4 DROP COLUMN col1;
NOTICE:  Dropping a column that is part of the distribution policy forces a NULL distribution policy
INSERT INTO mpp21090_drop_distcol_dml_int4 SELECT 1.00,'b','2014-01-02',1;
SELECT * FROM mpp21090_drop_distcol_dml_int4 ORDER BY 1,2,3;
 col2 | col3 |    col4    | col5 
------+------+------------+------
 0.00 | a    | 2014-01-01 |    0
 1.00 | b    | 2014-01-02 |    1
(2 rows)

UPDATE mpp21090_drop_distcol_dml_int4 SET col3='c' WHERE col3 = 'b' AND col5 = 1;
SELECT * FROM mpp21090_drop_distcol_dml_int4 ORDER BY 1,2,3;
 col2 | col3 |    col4    | col5 
------+------+------------+------
 0.00 | a    | 2014-01-01 |    0
 1.00 | c    | 2014-01-02 |    1
(2 rows)

DELETE FROM mpp21090_drop_distcol_dml_int4 WHERE col3='c';
SELECT * FROM mpp21090_drop_distcol_dml_int4 ORDER BY 1,2,3,4;
 col2 | col3 |    col4    | col5 
------+------+------------+------
 0.00 | a    | 2014-01-01 |    0
(1 row)

-- TEST
DROP TABLE IF EXISTS mpp21090_drop_distcol_dml_int4;
CREATE TABLE mpp21090_drop_distcol_dml_int4(
col1 int4,
col2 decimal,
col3 char,
col4 date,
col5 int
) distributed by (col1);
INSERT INTO mpp21090_drop_distcol_dml_int4 VALUES(2000000000,0.00,'a','2014-01-01',0);
SELECT * FROM mpp21090_drop_distcol_dml_int4 ORDER BY 1,2,3,4;
    col1    | col2 | col3 |    col4    | col5 
------------+------+------+------------+------
 2000000000 | 0.00 | a    | 2014-01-01 |    0
(1 row)

ALTER TABLE mpp21090_drop_distcol_dml_int4 DROP COLUMN col1;
NOTICE:  Dropping a column that is part of the distribution policy forces a NULL distribution policy
INSERT INTO mpp21090_drop_distcol_dml_int4 SELECT 1.00,'b','2014-01-02',1;
SELECT * FROM mpp21090_drop_distcol_dml_int4 ORDER BY 1,2,3;
 col2 | col3 |    col4    | col5 
------+------+------------+------
 0.00 | a    | 2014-01-01 |    0
 1.00 | b    | 2014-01-02 |    1
(2 rows)

UPDATE mpp21090_drop_distcol_dml_int4 SET col3='c' WHERE col3 = 'b' AND col5 = 1;
SELECT * FROM mpp21090_drop_distcol_dml_int4 ORDER BY 1,2,3;
 col2 | col3 |    col4    | col5 
------+------+------------+------
 0.00 | a    | 2014-01-01 |    0
 1.00 | c    | 2014-01-02 |    1
(2 rows)

DELETE FROM mpp21090_drop_distcol_dml_int4 WHERE col3='c';
SELECT * FROM mpp21090_drop_distcol_dml_int4 ORDER BY 1,2,3,4;
 col2 | col3 |    col4    | col5 
------+------+------------+------
 0.00 | a    | 2014-01-01 |    0
(1 row)

-- TEST
DROP TABLE IF EXISTS mpp21090_drop_distcol_dml_int8;
NOTICE:  table "mpp21090_drop_distcol_dml_int8" does not exist, skipping
CREATE TABLE mpp21090_drop_distcol_dml_int8(
col1 int8,
col2 decimal,
col3 char,
col4 date,
col5 int
)  with (appendonly= true) distributed by (col1);
INSERT INTO mpp21090_drop_distcol_dml_int8 VALUES(2000000000000000000,0.00,'a','2014-01-01',0);
SELECT * FROM mpp21090_drop_distcol_dml_int8 ORDER BY 1,2,3,4;
        col1         | col2 | col3 |    col4    | col5 
---------------------+------+------+------------+------
 2000000000000000000 | 0.00 | a    | 2014-01-01 |    0
(1 row)

ALTER TABLE mpp21090_drop_distcol_dml_int8 DROP COLUMN col1;
NOTICE:  Dropping a column that is part of the distribution policy forces a NULL distribution policy
INSERT INTO mpp21090_drop_distcol_dml_int8 SELECT 1.00,'b','2014-01-02',1;
SELECT * FROM mpp21090_drop_distcol_dml_int8 ORDER BY 1,2,3;
 col2 | col3 |    col4    | col5 
------+------+------------+------
 0.00 | a    | 2014-01-01 |    0
 1.00 | b    | 2014-01-02 |    1
(2 rows)

UPDATE mpp21090_drop_distcol_dml_int8 SET col3='c' WHERE col3 = 'b' AND col5 = 1;
SELECT * FROM mpp21090_drop_distcol_dml_int8 ORDER BY 1,2,3;
 col2 | col3 |    col4    | col5 
------+------+------------+------
 0.00 | a    | 2014-01-01 |    0
 1.00 | c    | 2014-01-02 |    1
(2 rows)

DELETE FROM mpp21090_drop_distcol_dml_int8 WHERE col3='c';
SELECT * FROM mpp21090_drop_distcol_dml_int8 ORDER BY 1,2,3,4;
 col2 | col3 |    col4    | col5 
------+------+------------+------
 0.00 | a    | 2014-01-01 |    0
(1 row)

-- TEST
DROP TABLE IF EXISTS mpp21090_drop_distcol_dml_int8;
CREATE TABLE mpp21090_drop_distcol_dml_int8(
col1 int8,
col2 decimal,
col3 char,
col4 date,
col5 int
)  with (appendonly= true, orientation= column) distributed by (col1);
INSERT INTO mpp21090_drop_distcol_dml_int8 VALUES(2000000000000000000,0.00,'a','2014-01-01',0);
SELECT * FROM mpp21090_drop_distcol_dml_int8 ORDER BY 1,2,3,4;
        col1         | col2 | col3 |    col4    | col5 
---------------------+------+------+------------+------
 2000000000000000000 | 0.00 | a    | 2014-01-01 |    0
(1 row)

ALTER TABLE mpp21090_drop_distcol_dml_int8 DROP COLUMN col1;
NOTICE:  Dropping a column that is part of the distribution policy forces a NULL distribution policy
INSERT INTO mpp21090_drop_distcol_dml_int8 SELECT 1.00,'b','2014-01-02',1;
SELECT * FROM mpp21090_drop_distcol_dml_int8 ORDER BY 1,2,3;
 col2 | col3 |    col4    | col5 
------+------+------------+------
 0.00 | a    | 2014-01-01 |    0
 1.00 | b    | 2014-01-02 |    1
(2 rows)

UPDATE mpp21090_drop_distcol_dml_int8 SET col3='c' WHERE col3 = 'b' AND col5 = 1;
SELECT * FROM mpp21090_drop_distcol_dml_int8 ORDER BY 1,2,3;
 col2 | col3 |    col4    | col5 
------+------+------------+------
 0.00 | a    | 2014-01-01 |    0
 1.00 | c    | 2014-01-02 |    1
(2 rows)

DELETE FROM mpp21090_drop_distcol_dml_int8 WHERE col3='c';
SELECT * FROM mpp21090_drop_distcol_dml_int8 ORDER BY 1,2,3,4;
 col2 | col3 |    col4    | col5 
------+------+------------+------
 0.00 | a    | 2014-01-01 |    0
(1 row)

-- TEST
DROP TABLE IF EXISTS mpp21090_drop_distcol_dml_int8;
CREATE TABLE mpp21090_drop_distcol_dml_int8(
col1 int8,
col2 decimal,
col3 char,
col4 date,
col5 int
) distributed by (col1);
INSERT INTO mpp21090_drop_distcol_dml_int8 VALUES(2000000000000000000,0.00,'a','2014-01-01',0);
SELECT * FROM mpp21090_drop_distcol_dml_int8 ORDER BY 1,2,3,4;
        col1         | col2 | col3 |    col4    | col5 
---------------------+------+------+------------+------
 2000000000000000000 | 0.00 | a    | 2014-01-01 |    0
(1 row)

ALTER TABLE mpp21090_drop_distcol_dml_int8 DROP COLUMN col1;
NOTICE:  Dropping a column that is part of the distribution policy forces a NULL distribution policy
INSERT INTO mpp21090_drop_distcol_dml_int8 SELECT 1.00,'b','2014-01-02',1;
SELECT * FROM mpp21090_drop_distcol_dml_int8 ORDER BY 1,2,3;
 col2 | col3 |    col4    | col5 
------+------+------------+------
 0.00 | a    | 2014-01-01 |    0
 1.00 | b    | 2014-01-02 |    1
(2 rows)

UPDATE mpp21090_drop_distcol_dml_int8 SET col3='c' WHERE col3 = 'b' AND col5 = 1;
SELECT * FROM mpp21090_drop_distcol_dml_int8 ORDER BY 1,2,3;
 col2 | col3 |    col4    | col5 
------+------+------------+------
 0.00 | a    | 2014-01-01 |    0
 1.00 | c    | 2014-01-02 |    1
(2 rows)

DELETE FROM mpp21090_drop_distcol_dml_int8 WHERE col3='c';
SELECT * FROM mpp21090_drop_distcol_dml_int8 ORDER BY 1,2,3,4;
 col2 | col3 |    col4    | col5 
------+------+------------+------
 0.00 | a    | 2014-01-01 |    0
(1 row)

-- TEST
DROP TABLE IF EXISTS mpp21090_drop_distcol_dml_interval;
NOTICE:  table "mpp21090_drop_distcol_dml_interval" does not exist, skipping
CREATE TABLE mpp21090_drop_distcol_dml_interval(
col1 interval,
col2 decimal,
col3 char,
col4 date,
col5 int
)  with (appendonly= true) distributed by (col1);
INSERT INTO mpp21090_drop_distcol_dml_interval VALUES('1 day',0.00,'a','2014-01-01',0);
SELECT * FROM mpp21090_drop_distcol_dml_interval ORDER BY 1,2,3,4;
 col1  | col2 | col3 |    col4    | col5 
-------+------+------+------------+------
 1 day | 0.00 | a    | 2014-01-01 |    0
(1 row)

ALTER TABLE mpp21090_drop_distcol_dml_interval DROP COLUMN col1;
NOTICE:  Dropping a column that is part of the distribution policy forces a NULL distribution policy
INSERT INTO mpp21090_drop_distcol_dml_interval SELECT 1.00,'b','2014-01-02',1;
SELECT * FROM mpp21090_drop_distcol_dml_interval ORDER BY 1,2,3;
 col2 | col3 |    col4    | col5 
------+------+------------+------
 0.00 | a    | 2014-01-01 |    0
 1.00 | b    | 2014-01-02 |    1
(2 rows)

UPDATE mpp21090_drop_distcol_dml_interval SET col3='c' WHERE col3 = 'b' AND col5 = 1;
SELECT * FROM mpp21090_drop_distcol_dml_interval ORDER BY 1,2,3;
 col2 | col3 |    col4    | col5 
------+------+------------+------
 0.00 | a    | 2014-01-01 |    0
 1.00 | c    | 2014-01-02 |    1
(2 rows)

DELETE FROM mpp21090_drop_distcol_dml_interval WHERE col3='c';
SELECT * FROM mpp21090_drop_distcol_dml_interval ORDER BY 1,2,3,4;
 col2 | col3 |    col4    | col5 
------+------+------------+------
 0.00 | a    | 2014-01-01 |    0
(1 row)

-- TEST
DROP TABLE IF EXISTS mpp21090_drop_distcol_dml_interval;
CREATE TABLE mpp21090_drop_distcol_dml_interval(
col1 interval,
col2 decimal,
col3 char,
col4 date,
col5 int
)  with (appendonly= true, orientation= column) distributed by (col1);
INSERT INTO mpp21090_drop_distcol_dml_interval VALUES('1 day',0.00,'a','2014-01-01',0);
SELECT * FROM mpp21090_drop_distcol_dml_interval ORDER BY 1,2,3,4;
 col1  | col2 | col3 |    col4    | col5 
-------+------+------+------------+------
 1 day | 0.00 | a    | 2014-01-01 |    0
(1 row)

ALTER TABLE mpp21090_drop_distcol_dml_interval DROP COLUMN col1;
NOTICE:  Dropping a column that is part of the distribution policy forces a NULL distribution policy
INSERT INTO mpp21090_drop_distcol_dml_interval SELECT 1.00,'b','2014-01-02',1;
SELECT * FROM mpp21090_drop_distcol_dml_interval ORDER BY 1,2,3;
 col2 | col3 |    col4    | col5 
------+------+------------+------
 0.00 | a    | 2014-01-01 |    0
 1.00 | b    | 2014-01-02 |    1
(2 rows)

UPDATE mpp21090_drop_distcol_dml_interval SET col3='c' WHERE col3 = 'b' AND col5 = 1;
SELECT * FROM mpp21090_drop_distcol_dml_interval ORDER BY 1,2,3;
 col2 | col3 |    col4    | col5 
------+------+------------+------
 0.00 | a    | 2014-01-01 |    0
 1.00 | c    | 2014-01-02 |    1
(2 rows)

DELETE FROM mpp21090_drop_distcol_dml_interval WHERE col3='c';
SELECT * FROM mpp21090_drop_distcol_dml_interval ORDER BY 1,2,3,4;
 col2 | col3 |    col4    | col5 
------+------+------------+------
 0.00 | a    | 2014-01-01 |    0
(1 row)

-- TEST
DROP TABLE IF EXISTS mpp21090_drop_distcol_dml_interval;
CREATE TABLE mpp21090_drop_distcol_dml_interval(
col1 interval,
col2 decimal,
col3 char,
col4 date,
col5 int
) distributed by (col1);
INSERT INTO mpp21090_drop_distcol_dml_interval VALUES('1 day',0.00,'a','2014-01-01',0);
SELECT * FROM mpp21090_drop_distcol_dml_interval ORDER BY 1,2,3,4;
 col1  | col2 | col3 |    col4    | col5 
-------+------+------+------------+------
 1 day | 0.00 | a    | 2014-01-01 |    0
(1 row)

ALTER TABLE mpp21090_drop_distcol_dml_interval DROP COLUMN col1;
NOTICE:  Dropping a column that is part of the distribution policy forces a NULL distribution policy
INSERT INTO mpp21090_drop_distcol_dml_interval SELECT 1.00,'b','2014-01-02',1;
SELECT * FROM mpp21090_drop_distcol_dml_interval ORDER BY 1,2,3;
 col2 | col3 |    col4    | col5 
------+------+------------+------
 0.00 | a    | 2014-01-01 |    0
 1.00 | b    | 2014-01-02 |    1
(2 rows)

UPDATE mpp21090_drop_distcol_dml_interval SET col3='c' WHERE col3 = 'b' AND col5 = 1;
SELECT * FROM mpp21090_drop_distcol_dml_interval ORDER BY 1,2,3;
 col2 | col3 |    col4    | col5 
------+------+------------+------
 0.00 | a    | 2014-01-01 |    0
 1.00 | c    | 2014-01-02 |    1
(2 rows)

DELETE FROM mpp21090_drop_distcol_dml_interval WHERE col3='c';
SELECT * FROM mpp21090_drop_distcol_dml_interval ORDER BY 1,2,3,4;
 col2 | col3 |    col4    | col5 
------+------+------------+------
 0.00 | a    | 2014-01-01 |    0
(1 row)

-- TEST
DROP TABLE IF EXISTS mpp21090_drop_distcol_dml_numeric;
NOTICE:  table "mpp21090_drop_distcol_dml_numeric" does not exist, skipping
CREATE TABLE mpp21090_drop_distcol_dml_numeric(
col1 numeric,
col2 decimal,
col3 char,
col4 date,
col5 int
)  with (appendonly= true) distributed by (col1);
INSERT INTO mpp21090_drop_distcol_dml_numeric VALUES(2.000000,0.00,'a','2014-01-01',0);
SELECT * FROM mpp21090_drop_distcol_dml_numeric ORDER BY 1,2,3,4;
   col1   | col2 | col3 |    col4    | col5 
----------+------+------+------------+------
 2.000000 | 0.00 | a    | 2014-01-01 |    0
(1 row)

ALTER TABLE mpp21090_drop_distcol_dml_numeric DROP COLUMN col1;
NOTICE:  Dropping a column that is part of the distribution policy forces a NULL distribution policy
INSERT INTO mpp21090_drop_distcol_dml_numeric SELECT 1.00,'b','2014-01-02',1;
SELECT * FROM mpp21090_drop_distcol_dml_numeric ORDER BY 1,2,3;
 col2 | col3 |    col4    | col5 
------+------+------------+------
 0.00 | a    | 2014-01-01 |    0
 1.00 | b    | 2014-01-02 |    1
(2 rows)

UPDATE mpp21090_drop_distcol_dml_numeric SET col3='c' WHERE col3 = 'b' AND col5 = 1;
SELECT * FROM mpp21090_drop_distcol_dml_numeric ORDER BY 1,2,3;
 col2 | col3 |    col4    | col5 
------+------+------------+------
 0.00 | a    | 2014-01-01 |    0
 1.00 | c    | 2014-01-02 |    1
(2 rows)

DELETE FROM mpp21090_drop_distcol_dml_numeric WHERE col3='c';
SELECT * FROM mpp21090_drop_distcol_dml_numeric ORDER BY 1,2,3,4;
 col2 | col3 |    col4    | col5 
------+------+------------+------
 0.00 | a    | 2014-01-01 |    0
(1 row)

-- TEST
DROP TABLE IF EXISTS mpp21090_drop_distcol_dml_numeric;
CREATE TABLE mpp21090_drop_distcol_dml_numeric(
col1 numeric,
col2 decimal,
col3 char,
col4 date,
col5 int
)  with (appendonly= true, orientation= column) distributed by (col1);
INSERT INTO mpp21090_drop_distcol_dml_numeric VALUES(2.000000,0.00,'a','2014-01-01',0);
SELECT * FROM mpp21090_drop_distcol_dml_numeric ORDER BY 1,2,3,4;
   col1   | col2 | col3 |    col4    | col5 
----------+------+------+------------+------
 2.000000 | 0.00 | a    | 2014-01-01 |    0
(1 row)

ALTER TABLE mpp21090_drop_distcol_dml_numeric DROP COLUMN col1;
NOTICE:  Dropping a column that is part of the distribution policy forces a NULL distribution policy
INSERT INTO mpp21090_drop_distcol_dml_numeric SELECT 1.00,'b','2014-01-02',1;
SELECT * FROM mpp21090_drop_distcol_dml_numeric ORDER BY 1,2,3;
 col2 | col3 |    col4    | col5 
------+------+------------+------
 0.00 | a    | 2014-01-01 |    0
 1.00 | b    | 2014-01-02 |    1
(2 rows)

UPDATE mpp21090_drop_distcol_dml_numeric SET col3='c' WHERE col3 = 'b' AND col5 = 1;
SELECT * FROM mpp21090_drop_distcol_dml_numeric ORDER BY 1,2,3;
 col2 | col3 |    col4    | col5 
------+------+------------+------
 0.00 | a    | 2014-01-01 |    0
 1.00 | c    | 2014-01-02 |    1
(2 rows)

DELETE FROM mpp21090_drop_distcol_dml_numeric WHERE col3='c';
SELECT * FROM mpp21090_drop_distcol_dml_numeric ORDER BY 1,2,3,4;
 col2 | col3 |    col4    | col5 
------+------+------------+------
 0.00 | a    | 2014-01-01 |    0
(1 row)

-- TEST
DROP TABLE IF EXISTS mpp21090_drop_distcol_dml_numeric;
CREATE TABLE mpp21090_drop_distcol_dml_numeric(
col1 numeric,
col2 decimal,
col3 char,
col4 date,
col5 int
) distributed by (col1);
INSERT INTO mpp21090_drop_distcol_dml_numeric VALUES(2.000000,0.00,'a','2014-01-01',0);
SELECT * FROM mpp21090_drop_distcol_dml_numeric ORDER BY 1,2,3,4;
   col1   | col2 | col3 |    col4    | col5 
----------+------+------+------------+------
 2.000000 | 0.00 | a    | 2014-01-01 |    0
(1 row)

ALTER TABLE mpp21090_drop_distcol_dml_numeric DROP COLUMN col1;
NOTICE:  Dropping a column that is part of the distribution policy forces a NULL distribution policy
INSERT INTO mpp21090_drop_distcol_dml_numeric SELECT 1.00,'b','2014-01-02',1;
SELECT * FROM mpp21090_drop_distcol_dml_numeric ORDER BY 1,2,3;
 col2 | col3 |    col4    | col5 
------+------+------------+------
 0.00 | a    | 2014-01-01 |    0
 1.00 | b    | 2014-01-02 |    1
(2 rows)

UPDATE mpp21090_drop_distcol_dml_numeric SET col3='c' WHERE col3 = 'b' AND col5 = 1;
SELECT * FROM mpp21090_drop_distcol_dml_numeric ORDER BY 1,2,3;
 col2 | col3 |    col4    | col5 
------+------+------------+------
 0.00 | a    | 2014-01-01 |    0
 1.00 | c    | 2014-01-02 |    1
(2 rows)

DELETE FROM mpp21090_drop_distcol_dml_numeric WHERE col3='c';
SELECT * FROM mpp21090_drop_distcol_dml_numeric ORDER BY 1,2,3,4;
 col2 | col3 |    col4    | col5 
------+------+------------+------
 0.00 | a    | 2014-01-01 |    0
(1 row)

-- TEST
DROP TABLE IF EXISTS mpp21090_drop_distcol_dml_text;
NOTICE:  table "mpp21090_drop_distcol_dml_text" does not exist, skipping
CREATE TABLE mpp21090_drop_distcol_dml_text(
col1 text,
col2 decimal,
col3 char,
col4 date,
col5 int
)  with (appendonly= true) distributed by (col1);
INSERT INTO mpp21090_drop_distcol_dml_text VALUES('abcdefghijklmnop',0.00,'a','2014-01-01',0);
SELECT * FROM mpp21090_drop_distcol_dml_text ORDER BY 1,2,3,4;
       col1       | col2 | col3 |    col4    | col5 
------------------+------+------+------------+------
 abcdefghijklmnop | 0.00 | a    | 2014-01-01 |    0
(1 row)

ALTER TABLE mpp21090_drop_distcol_dml_text DROP COLUMN col1;
NOTICE:  Dropping a column that is part of the distribution policy forces a NULL distribution policy
INSERT INTO mpp21090_drop_distcol_dml_text SELECT 1.00,'b','2014-01-02',1;
SELECT * FROM mpp21090_drop_distcol_dml_text ORDER BY 1,2,3;
 col2 | col3 |    col4    | col5 
------+------+------------+------
 0.00 | a    | 2014-01-01 |    0
 1.00 | b    | 2014-01-02 |    1
(2 rows)

UPDATE mpp21090_drop_distcol_dml_text SET col3='c' WHERE col3 = 'b' AND col5 = 1;
SELECT * FROM mpp21090_drop_distcol_dml_text ORDER BY 1,2,3;
 col2 | col3 |    col4    | col5 
------+------+------------+------
 0.00 | a    | 2014-01-01 |    0
 1.00 | c    | 2014-01-02 |    1
(2 rows)

DELETE FROM mpp21090_drop_distcol_dml_text WHERE col3='c';
SELECT * FROM mpp21090_drop_distcol_dml_text ORDER BY 1,2,3,4;
 col2 | col3 |    col4    | col5 
------+------+------------+------
 0.00 | a    | 2014-01-01 |    0
(1 row)

-- TEST
DROP TABLE IF EXISTS mpp21090_drop_distcol_dml_text;
CREATE TABLE mpp21090_drop_distcol_dml_text(
col1 text,
col2 decimal,
col3 char,
col4 date,
col5 int
)  with (appendonly= true, orientation= column) distributed by (col1);
INSERT INTO mpp21090_drop_distcol_dml_text VALUES('abcdefghijklmnop',0.00,'a','2014-01-01',0);
SELECT * FROM mpp21090_drop_distcol_dml_text ORDER BY 1,2,3,4;
       col1       | col2 | col3 |    col4    | col5 
------------------+------+------+------------+------
 abcdefghijklmnop | 0.00 | a    | 2014-01-01 |    0
(1 row)

ALTER TABLE mpp21090_drop_distcol_dml_text DROP COLUMN col1;
NOTICE:  Dropping a column that is part of the distribution policy forces a NULL distribution policy
INSERT INTO mpp21090_drop_distcol_dml_text SELECT 1.00,'b','2014-01-02',1;
SELECT * FROM mpp21090_drop_distcol_dml_text ORDER BY 1,2,3;
 col2 | col3 |    col4    | col5 
------+------+------------+------
 0.00 | a    | 2014-01-01 |    0
 1.00 | b    | 2014-01-02 |    1
(2 rows)

UPDATE mpp21090_drop_distcol_dml_text SET col3='c' WHERE col3 = 'b' AND col5 = 1;
SELECT * FROM mpp21090_drop_distcol_dml_text ORDER BY 1,2,3;
 col2 | col3 |    col4    | col5 
------+------+------------+------
 0.00 | a    | 2014-01-01 |    0
 1.00 | c    | 2014-01-02 |    1
(2 rows)

DELETE FROM mpp21090_drop_distcol_dml_text WHERE col3='c';
SELECT * FROM mpp21090_drop_distcol_dml_text ORDER BY 1,2,3,4;
 col2 | col3 |    col4    | col5 
------+------+------------+------
 0.00 | a    | 2014-01-01 |    0
(1 row)

-- TEST
DROP TABLE IF EXISTS mpp21090_drop_distcol_dml_text;
CREATE TABLE mpp21090_drop_distcol_dml_text(
col1 text,
col2 decimal,
col3 char,
col4 date,
col5 int
) distributed by (col1);
INSERT INTO mpp21090_drop_distcol_dml_text VALUES('abcdefghijklmnop',0.00,'a','2014-01-01',0);
SELECT * FROM mpp21090_drop_distcol_dml_text ORDER BY 1,2,3,4;
       col1       | col2 | col3 |    col4    | col5 
------------------+------+------+------------+------
 abcdefghijklmnop | 0.00 | a    | 2014-01-01 |    0
(1 row)

ALTER TABLE mpp21090_drop_distcol_dml_text DROP COLUMN col1;
NOTICE:  Dropping a column that is part of the distribution policy forces a NULL distribution policy
INSERT INTO mpp21090_drop_distcol_dml_text SELECT 1.00,'b','2014-01-02',1;
SELECT * FROM mpp21090_drop_distcol_dml_text ORDER BY 1,2,3;
 col2 | col3 |    col4    | col5 
------+------+------------+------
 0.00 | a    | 2014-01-01 |    0
 1.00 | b    | 2014-01-02 |    1
(2 rows)

UPDATE mpp21090_drop_distcol_dml_text SET col3='c' WHERE col3 = 'b' AND col5 = 1;
SELECT * FROM mpp21090_drop_distcol_dml_text ORDER BY 1,2,3;
 col2 | col3 |    col4    | col5 
------+------+------------+------
 0.00 | a    | 2014-01-01 |    0
 1.00 | c    | 2014-01-02 |    1
(2 rows)

DELETE FROM mpp21090_drop_distcol_dml_text WHERE col3='c';
SELECT * FROM mpp21090_drop_distcol_dml_text ORDER BY 1,2,3,4;
 col2 | col3 |    col4    | col5 
------+------+------------+------
 0.00 | a    | 2014-01-01 |    0
(1 row)

-- TEST
DROP TABLE IF EXISTS mpp21090_drop_firstcol_dml_boolean;
NOTICE:  table "mpp21090_drop_firstcol_dml_boolean" does not exist, skipping
CREATE TABLE mpp21090_drop_firstcol_dml_boolean(
col1 boolean,
col2 decimal,
col3 char,
col4 date,
col5 int
)  with (appendonly= true)  DISTRIBUTED by(col3);
INSERT INTO mpp21090_drop_firstcol_dml_boolean VALUES(True,0.00,'a','2014-01-01',0);
SELECT * FROM mpp21090_drop_firstcol_dml_boolean ORDER BY 1,2,3,4;
 col1 | col2 | col3 |    col4    | col5 
------+------+------+------------+------
 t    | 0.00 | a    | 2014-01-01 |    0
(1 row)

ALTER TABLE mpp21090_drop_firstcol_dml_boolean DROP COLUMN col1;
INSERT INTO mpp21090_drop_firstcol_dml_boolean SELECT 1.00,'b','2014-01-02',1;
SELECT * FROM mpp21090_drop_firstcol_dml_boolean ORDER BY 1,2,3,4;
 col2 | col3 |    col4    | col5 
------+------+------------+------
 0.00 | a    | 2014-01-01 |    0
 1.00 | b    | 2014-01-02 |    1
(2 rows)

UPDATE mpp21090_drop_firstcol_dml_boolean SET col3='c' WHERE col3 = 'b' AND col5 = 1;
ERROR:  Cannot parallelize an UPDATE statement that updates the distribution columns
SELECT * FROM mpp21090_drop_firstcol_dml_boolean ORDER BY 1,2,3,4;
 col2 | col3 |    col4    | col5 
------+------+------------+------
 0.00 | a    | 2014-01-01 |    0
 1.00 | b    | 2014-01-02 |    1
(2 rows)

DELETE FROM mpp21090_drop_firstcol_dml_boolean WHERE col3='c';
SELECT * FROM mpp21090_drop_firstcol_dml_boolean ORDER BY 1,2,3,4;
 col2 | col3 |    col4    | col5 
------+------+------------+------
 0.00 | a    | 2014-01-01 |    0
 1.00 | b    | 2014-01-02 |    1
(2 rows)

-- TEST
DROP TABLE IF EXISTS mpp21090_drop_firstcol_dml_boolean;
CREATE TABLE mpp21090_drop_firstcol_dml_boolean(
col1 boolean,
col2 decimal,
col3 char,
col4 date,
col5 int
)  with (appendonly= true, orientation= column)  DISTRIBUTED by(col3);
INSERT INTO mpp21090_drop_firstcol_dml_boolean VALUES(True,0.00,'a','2014-01-01',0);
SELECT * FROM mpp21090_drop_firstcol_dml_boolean ORDER BY 1,2,3,4;
 col1 | col2 | col3 |    col4    | col5 
------+------+------+------------+------
 t    | 0.00 | a    | 2014-01-01 |    0
(1 row)

ALTER TABLE mpp21090_drop_firstcol_dml_boolean DROP COLUMN col1;
INSERT INTO mpp21090_drop_firstcol_dml_boolean SELECT 1.00,'b','2014-01-02',1;
SELECT * FROM mpp21090_drop_firstcol_dml_boolean ORDER BY 1,2,3,4;
 col2 | col3 |    col4    | col5 
------+------+------------+------
 0.00 | a    | 2014-01-01 |    0
 1.00 | b    | 2014-01-02 |    1
(2 rows)

UPDATE mpp21090_drop_firstcol_dml_boolean SET col3='c' WHERE col3 = 'b' AND col5 = 1;
ERROR:  Cannot parallelize an UPDATE statement that updates the distribution columns
SELECT * FROM mpp21090_drop_firstcol_dml_boolean ORDER BY 1,2,3,4;
 col2 | col3 |    col4    | col5 
------+------+------------+------
 0.00 | a    | 2014-01-01 |    0
 1.00 | b    | 2014-01-02 |    1
(2 rows)

DELETE FROM mpp21090_drop_firstcol_dml_boolean WHERE col3='c';
SELECT * FROM mpp21090_drop_firstcol_dml_boolean ORDER BY 1,2,3,4;
 col2 | col3 |    col4    | col5 
------+------+------------+------
 0.00 | a    | 2014-01-01 |    0
 1.00 | b    | 2014-01-02 |    1
(2 rows)

-- TEST
DROP TABLE IF EXISTS mpp21090_drop_firstcol_dml_boolean;
CREATE TABLE mpp21090_drop_firstcol_dml_boolean(
col1 boolean,
col2 decimal,
col3 char,
col4 date,
col5 int
)  DISTRIBUTED by(col3);
INSERT INTO mpp21090_drop_firstcol_dml_boolean VALUES(True,0.00,'a','2014-01-01',0);
SELECT * FROM mpp21090_drop_firstcol_dml_boolean ORDER BY 1,2,3,4;
 col1 | col2 | col3 |    col4    | col5 
------+------+------+------------+------
 t    | 0.00 | a    | 2014-01-01 |    0
(1 row)

ALTER TABLE mpp21090_drop_firstcol_dml_boolean DROP COLUMN col1;
INSERT INTO mpp21090_drop_firstcol_dml_boolean SELECT 1.00,'b','2014-01-02',1;
SELECT * FROM mpp21090_drop_firstcol_dml_boolean ORDER BY 1,2,3,4;
 col2 | col3 |    col4    | col5 
------+------+------------+------
 0.00 | a    | 2014-01-01 |    0
 1.00 | b    | 2014-01-02 |    1
(2 rows)

UPDATE mpp21090_drop_firstcol_dml_boolean SET col3='c' WHERE col3 = 'b' AND col5 = 1;
ERROR:  Cannot parallelize an UPDATE statement that updates the distribution columns
SELECT * FROM mpp21090_drop_firstcol_dml_boolean ORDER BY 1,2,3,4;
 col2 | col3 |    col4    | col5 
------+------+------------+------
 0.00 | a    | 2014-01-01 |    0
 1.00 | b    | 2014-01-02 |    1
(2 rows)

DELETE FROM mpp21090_drop_firstcol_dml_boolean WHERE col3='c';
SELECT * FROM mpp21090_drop_firstcol_dml_boolean ORDER BY 1,2,3,4;
 col2 | col3 |    col4    | col5 
------+------+------------+------
 0.00 | a    | 2014-01-01 |    0
 1.00 | b    | 2014-01-02 |    1
(2 rows)

-- TEST
DROP TABLE IF EXISTS mpp21090_drop_firstcol_dml_char;
NOTICE:  table "mpp21090_drop_firstcol_dml_char" does not exist, skipping
CREATE TABLE mpp21090_drop_firstcol_dml_char(
col1 char,
col2 decimal,
col3 char,
col4 date,
col5 int
)  with (appendonly= true)  DISTRIBUTED by(col3);
INSERT INTO mpp21090_drop_firstcol_dml_char VALUES('z',0.00,'a','2014-01-01',0);
SELECT * FROM mpp21090_drop_firstcol_dml_char ORDER BY 1,2,3,4;
 col1 | col2 | col3 |    col4    | col5 
------+------+------+------------+------
 z    | 0.00 | a    | 2014-01-01 |    0
(1 row)

ALTER TABLE mpp21090_drop_firstcol_dml_char DROP COLUMN col1;
INSERT INTO mpp21090_drop_firstcol_dml_char SELECT 1.00,'b','2014-01-02',1;
SELECT * FROM mpp21090_drop_firstcol_dml_char ORDER BY 1,2,3,4;
 col2 | col3 |    col4    | col5 
------+------+------------+------
 0.00 | a    | 2014-01-01 |    0
 1.00 | b    | 2014-01-02 |    1
(2 rows)

UPDATE mpp21090_drop_firstcol_dml_char SET col3='c' WHERE col3 = 'b' AND col5 = 1;
ERROR:  Cannot parallelize an UPDATE statement that updates the distribution columns
SELECT * FROM mpp21090_drop_firstcol_dml_char ORDER BY 1,2,3,4;
 col2 | col3 |    col4    | col5 
------+------+------------+------
 0.00 | a    | 2014-01-01 |    0
 1.00 | b    | 2014-01-02 |    1
(2 rows)

DELETE FROM mpp21090_drop_firstcol_dml_char WHERE col3='c';
SELECT * FROM mpp21090_drop_firstcol_dml_char ORDER BY 1,2,3,4;
 col2 | col3 |    col4    | col5 
------+------+------------+------
 0.00 | a    | 2014-01-01 |    0
 1.00 | b    | 2014-01-02 |    1
(2 rows)

-- TEST
DROP TABLE IF EXISTS mpp21090_drop_firstcol_dml_char;
CREATE TABLE mpp21090_drop_firstcol_dml_char(
col1 char,
col2 decimal,
col3 char,
col4 date,
col5 int
)  with (appendonly= true, orientation= column)  DISTRIBUTED by(col3);
INSERT INTO mpp21090_drop_firstcol_dml_char VALUES('z',0.00,'a','2014-01-01',0);
SELECT * FROM mpp21090_drop_firstcol_dml_char ORDER BY 1,2,3,4;
 col1 | col2 | col3 |    col4    | col5 
------+------+------+------------+------
 z    | 0.00 | a    | 2014-01-01 |    0
(1 row)

ALTER TABLE mpp21090_drop_firstcol_dml_char DROP COLUMN col1;
INSERT INTO mpp21090_drop_firstcol_dml_char SELECT 1.00,'b','2014-01-02',1;
SELECT * FROM mpp21090_drop_firstcol_dml_char ORDER BY 1,2,3,4;
 col2 | col3 |    col4    | col5 
------+------+------------+------
 0.00 | a    | 2014-01-01 |    0
 1.00 | b    | 2014-01-02 |    1
(2 rows)

UPDATE mpp21090_drop_firstcol_dml_char SET col3='c' WHERE col3 = 'b' AND col5 = 1;
ERROR:  Cannot parallelize an UPDATE statement that updates the distribution columns
SELECT * FROM mpp21090_drop_firstcol_dml_char ORDER BY 1,2,3,4;
 col2 | col3 |    col4    | col5 
------+------+------------+------
 0.00 | a    | 2014-01-01 |    0
 1.00 | b    | 2014-01-02 |    1
(2 rows)

DELETE FROM mpp21090_drop_firstcol_dml_char WHERE col3='c';
SELECT * FROM mpp21090_drop_firstcol_dml_char ORDER BY 1,2,3,4;
 col2 | col3 |    col4    | col5 
------+------+------------+------
 0.00 | a    | 2014-01-01 |    0
 1.00 | b    | 2014-01-02 |    1
(2 rows)

-- TEST
DROP TABLE IF EXISTS mpp21090_drop_firstcol_dml_char;
CREATE TABLE mpp21090_drop_firstcol_dml_char(
col1 char,
col2 decimal,
col3 char,
col4 date,
col5 int
)  DISTRIBUTED by(col3);
INSERT INTO mpp21090_drop_firstcol_dml_char VALUES('z',0.00,'a','2014-01-01',0);
SELECT * FROM mpp21090_drop_firstcol_dml_char ORDER BY 1,2,3,4;
 col1 | col2 | col3 |    col4    | col5 
------+------+------+------------+------
 z    | 0.00 | a    | 2014-01-01 |    0
(1 row)

ALTER TABLE mpp21090_drop_firstcol_dml_char DROP COLUMN col1;
INSERT INTO mpp21090_drop_firstcol_dml_char SELECT 1.00,'b','2014-01-02',1;
SELECT * FROM mpp21090_drop_firstcol_dml_char ORDER BY 1,2,3,4;
 col2 | col3 |    col4    | col5 
------+------+------------+------
 0.00 | a    | 2014-01-01 |    0
 1.00 | b    | 2014-01-02 |    1
(2 rows)

UPDATE mpp21090_drop_firstcol_dml_char SET col3='c' WHERE col3 = 'b' AND col5 = 1;
ERROR:  Cannot parallelize an UPDATE statement that updates the distribution columns
SELECT * FROM mpp21090_drop_firstcol_dml_char ORDER BY 1,2,3,4;
 col2 | col3 |    col4    | col5 
------+------+------------+------
 0.00 | a    | 2014-01-01 |    0
 1.00 | b    | 2014-01-02 |    1
(2 rows)

DELETE FROM mpp21090_drop_firstcol_dml_char WHERE col3='c';
SELECT * FROM mpp21090_drop_firstcol_dml_char ORDER BY 1,2,3,4;
 col2 | col3 |    col4    | col5 
------+------+------------+------
 0.00 | a    | 2014-01-01 |    0
 1.00 | b    | 2014-01-02 |    1
(2 rows)

-- TEST
DROP TABLE IF EXISTS mpp21090_drop_firstcol_dml_decimal;
NOTICE:  table "mpp21090_drop_firstcol_dml_decimal" does not exist, skipping
CREATE TABLE mpp21090_drop_firstcol_dml_decimal(
col1 decimal,
col2 decimal,
col3 char,
col4 date,
col5 int
)  with (appendonly= true)  DISTRIBUTED by(col3);
INSERT INTO mpp21090_drop_firstcol_dml_decimal VALUES(2.00,0.00,'a','2014-01-01',0);
SELECT * FROM mpp21090_drop_firstcol_dml_decimal ORDER BY 1,2,3,4;
 col1 | col2 | col3 |    col4    | col5 
------+------+------+------------+------
 2.00 | 0.00 | a    | 2014-01-01 |    0
(1 row)

ALTER TABLE mpp21090_drop_firstcol_dml_decimal DROP COLUMN col1;
INSERT INTO mpp21090_drop_firstcol_dml_decimal SELECT 1.00,'b','2014-01-02',1;
SELECT * FROM mpp21090_drop_firstcol_dml_decimal ORDER BY 1,2,3,4;
 col2 | col3 |    col4    | col5 
------+------+------------+------
 0.00 | a    | 2014-01-01 |    0
 1.00 | b    | 2014-01-02 |    1
(2 rows)

UPDATE mpp21090_drop_firstcol_dml_decimal SET col3='c' WHERE col3 = 'b' AND col5 = 1;
ERROR:  Cannot parallelize an UPDATE statement that updates the distribution columns
SELECT * FROM mpp21090_drop_firstcol_dml_decimal ORDER BY 1,2,3,4;
 col2 | col3 |    col4    | col5 
------+------+------------+------
 0.00 | a    | 2014-01-01 |    0
 1.00 | b    | 2014-01-02 |    1
(2 rows)

DELETE FROM mpp21090_drop_firstcol_dml_decimal WHERE col3='c';
SELECT * FROM mpp21090_drop_firstcol_dml_decimal ORDER BY 1,2,3,4;
 col2 | col3 |    col4    | col5 
------+------+------------+------
 0.00 | a    | 2014-01-01 |    0
 1.00 | b    | 2014-01-02 |    1
(2 rows)

-- TEST
DROP TABLE IF EXISTS mpp21090_drop_firstcol_dml_decimal;
CREATE TABLE mpp21090_drop_firstcol_dml_decimal(
col1 decimal,
col2 decimal,
col3 char,
col4 date,
col5 int
)  with (appendonly= true, orientation= column)  DISTRIBUTED by(col3);
INSERT INTO mpp21090_drop_firstcol_dml_decimal VALUES(2.00,0.00,'a','2014-01-01',0);
SELECT * FROM mpp21090_drop_firstcol_dml_decimal ORDER BY 1,2,3,4;
 col1 | col2 | col3 |    col4    | col5 
------+------+------+------------+------
 2.00 | 0.00 | a    | 2014-01-01 |    0
(1 row)

ALTER TABLE mpp21090_drop_firstcol_dml_decimal DROP COLUMN col1;
INSERT INTO mpp21090_drop_firstcol_dml_decimal SELECT 1.00,'b','2014-01-02',1;
SELECT * FROM mpp21090_drop_firstcol_dml_decimal ORDER BY 1,2,3,4;
 col2 | col3 |    col4    | col5 
------+------+------------+------
 0.00 | a    | 2014-01-01 |    0
 1.00 | b    | 2014-01-02 |    1
(2 rows)

UPDATE mpp21090_drop_firstcol_dml_decimal SET col3='c' WHERE col3 = 'b' AND col5 = 1;
ERROR:  Cannot parallelize an UPDATE statement that updates the distribution columns
SELECT * FROM mpp21090_drop_firstcol_dml_decimal ORDER BY 1,2,3,4;
 col2 | col3 |    col4    | col5 
------+------+------------+------
 0.00 | a    | 2014-01-01 |    0
 1.00 | b    | 2014-01-02 |    1
(2 rows)

DELETE FROM mpp21090_drop_firstcol_dml_decimal WHERE col3='c';
SELECT * FROM mpp21090_drop_firstcol_dml_decimal ORDER BY 1,2,3,4;
 col2 | col3 |    col4    | col5 
------+------+------------+------
 0.00 | a    | 2014-01-01 |    0
 1.00 | b    | 2014-01-02 |    1
(2 rows)

-- TEST
DROP TABLE IF EXISTS mpp21090_drop_firstcol_dml_decimal;
CREATE TABLE mpp21090_drop_firstcol_dml_decimal(
col1 decimal,
col2 decimal,
col3 char,
col4 date,
col5 int
)  DISTRIBUTED by(col3);
INSERT INTO mpp21090_drop_firstcol_dml_decimal VALUES(2.00,0.00,'a','2014-01-01',0);
SELECT * FROM mpp21090_drop_firstcol_dml_decimal ORDER BY 1,2,3,4;
 col1 | col2 | col3 |    col4    | col5 
------+------+------+------------+------
 2.00 | 0.00 | a    | 2014-01-01 |    0
(1 row)

ALTER TABLE mpp21090_drop_firstcol_dml_decimal DROP COLUMN col1;
INSERT INTO mpp21090_drop_firstcol_dml_decimal SELECT 1.00,'b','2014-01-02',1;
SELECT * FROM mpp21090_drop_firstcol_dml_decimal ORDER BY 1,2,3,4;
 col2 | col3 |    col4    | col5 
------+------+------------+------
 0.00 | a    | 2014-01-01 |    0
 1.00 | b    | 2014-01-02 |    1
(2 rows)

UPDATE mpp21090_drop_firstcol_dml_decimal SET col3='c' WHERE col3 = 'b' AND col5 = 1;
ERROR:  Cannot parallelize an UPDATE statement that updates the distribution columns
SELECT * FROM mpp21090_drop_firstcol_dml_decimal ORDER BY 1,2,3,4;
 col2 | col3 |    col4    | col5 
------+------+------------+------
 0.00 | a    | 2014-01-01 |    0
 1.00 | b    | 2014-01-02 |    1
(2 rows)

DELETE FROM mpp21090_drop_firstcol_dml_decimal WHERE col3='c';
SELECT * FROM mpp21090_drop_firstcol_dml_decimal ORDER BY 1,2,3,4;
 col2 | col3 |    col4    | col5 
------+------+------------+------
 0.00 | a    | 2014-01-01 |    0
 1.00 | b    | 2014-01-02 |    1
(2 rows)

-- TEST
DROP TABLE IF EXISTS mpp21090_drop_firstcol_dml_int4;
NOTICE:  table "mpp21090_drop_firstcol_dml_int4" does not exist, skipping
CREATE TABLE mpp21090_drop_firstcol_dml_int4(
col1 int4,
col2 decimal,
col3 char,
col4 date,
col5 int
)  with (appendonly= true)  DISTRIBUTED by(col3);
INSERT INTO mpp21090_drop_firstcol_dml_int4 VALUES(2000000000,0.00,'a','2014-01-01',0);
SELECT * FROM mpp21090_drop_firstcol_dml_int4 ORDER BY 1,2,3,4;
    col1    | col2 | col3 |    col4    | col5 
------------+------+------+------------+------
 2000000000 | 0.00 | a    | 2014-01-01 |    0
(1 row)

ALTER TABLE mpp21090_drop_firstcol_dml_int4 DROP COLUMN col1;
INSERT INTO mpp21090_drop_firstcol_dml_int4 SELECT 1.00,'b','2014-01-02',1;
SELECT * FROM mpp21090_drop_firstcol_dml_int4 ORDER BY 1,2,3,4;
 col2 | col3 |    col4    | col5 
------+------+------------+------
 0.00 | a    | 2014-01-01 |    0
 1.00 | b    | 2014-01-02 |    1
(2 rows)

UPDATE mpp21090_drop_firstcol_dml_int4 SET col3='c' WHERE col3 = 'b' AND col5 = 1;
ERROR:  Cannot parallelize an UPDATE statement that updates the distribution columns
SELECT * FROM mpp21090_drop_firstcol_dml_int4 ORDER BY 1,2,3,4;
 col2 | col3 |    col4    | col5 
------+------+------------+------
 0.00 | a    | 2014-01-01 |    0
 1.00 | b    | 2014-01-02 |    1
(2 rows)

DELETE FROM mpp21090_drop_firstcol_dml_int4 WHERE col3='c';
SELECT * FROM mpp21090_drop_firstcol_dml_int4 ORDER BY 1,2,3,4;
 col2 | col3 |    col4    | col5 
------+------+------------+------
 0.00 | a    | 2014-01-01 |    0
 1.00 | b    | 2014-01-02 |    1
(2 rows)

-- TEST
DROP TABLE IF EXISTS mpp21090_drop_firstcol_dml_int4;
CREATE TABLE mpp21090_drop_firstcol_dml_int4(
col1 int4,
col2 decimal,
col3 char,
col4 date,
col5 int
)  with (appendonly= true, orientation= column)  DISTRIBUTED by(col3);
INSERT INTO mpp21090_drop_firstcol_dml_int4 VALUES(2000000000,0.00,'a','2014-01-01',0);
SELECT * FROM mpp21090_drop_firstcol_dml_int4 ORDER BY 1,2,3,4;
    col1    | col2 | col3 |    col4    | col5 
------------+------+------+------------+------
 2000000000 | 0.00 | a    | 2014-01-01 |    0
(1 row)

ALTER TABLE mpp21090_drop_firstcol_dml_int4 DROP COLUMN col1;
INSERT INTO mpp21090_drop_firstcol_dml_int4 SELECT 1.00,'b','2014-01-02',1;
SELECT * FROM mpp21090_drop_firstcol_dml_int4 ORDER BY 1,2,3,4;
 col2 | col3 |    col4    | col5 
------+------+------------+------
 0.00 | a    | 2014-01-01 |    0
 1.00 | b    | 2014-01-02 |    1
(2 rows)

UPDATE mpp21090_drop_firstcol_dml_int4 SET col3='c' WHERE col3 = 'b' AND col5 = 1;
ERROR:  Cannot parallelize an UPDATE statement that updates the distribution columns
SELECT * FROM mpp21090_drop_firstcol_dml_int4 ORDER BY 1,2,3,4;
 col2 | col3 |    col4    | col5 
------+------+------------+------
 0.00 | a    | 2014-01-01 |    0
 1.00 | b    | 2014-01-02 |    1
(2 rows)

DELETE FROM mpp21090_drop_firstcol_dml_int4 WHERE col3='c';
SELECT * FROM mpp21090_drop_firstcol_dml_int4 ORDER BY 1,2,3,4;
 col2 | col3 |    col4    | col5 
------+------+------------+------
 0.00 | a    | 2014-01-01 |    0
 1.00 | b    | 2014-01-02 |    1
(2 rows)

-- TEST
DROP TABLE IF EXISTS mpp21090_drop_firstcol_dml_int4;
CREATE TABLE mpp21090_drop_firstcol_dml_int4(
col1 int4,
col2 decimal,
col3 char,
col4 date,
col5 int
)  DISTRIBUTED by(col3);
INSERT INTO mpp21090_drop_firstcol_dml_int4 VALUES(2000000000,0.00,'a','2014-01-01',0);
SELECT * FROM mpp21090_drop_firstcol_dml_int4 ORDER BY 1,2,3,4;
    col1    | col2 | col3 |    col4    | col5 
------------+------+------+------------+------
 2000000000 | 0.00 | a    | 2014-01-01 |    0
(1 row)

ALTER TABLE mpp21090_drop_firstcol_dml_int4 DROP COLUMN col1;
INSERT INTO mpp21090_drop_firstcol_dml_int4 SELECT 1.00,'b','2014-01-02',1;
SELECT * FROM mpp21090_drop_firstcol_dml_int4 ORDER BY 1,2,3,4;
 col2 | col3 |    col4    | col5 
------+------+------------+------
 0.00 | a    | 2014-01-01 |    0
 1.00 | b    | 2014-01-02 |    1
(2 rows)

UPDATE mpp21090_drop_firstcol_dml_int4 SET col3='c' WHERE col3 = 'b' AND col5 = 1;
ERROR:  Cannot parallelize an UPDATE statement that updates the distribution columns
SELECT * FROM mpp21090_drop_firstcol_dml_int4 ORDER BY 1,2,3,4;
 col2 | col3 |    col4    | col5 
------+------+------------+------
 0.00 | a    | 2014-01-01 |    0
 1.00 | b    | 2014-01-02 |    1
(2 rows)

DELETE FROM mpp21090_drop_firstcol_dml_int4 WHERE col3='c';
SELECT * FROM mpp21090_drop_firstcol_dml_int4 ORDER BY 1,2,3,4;
 col2 | col3 |    col4    | col5 
------+------+------------+------
 0.00 | a    | 2014-01-01 |    0
 1.00 | b    | 2014-01-02 |    1
(2 rows)

-- TEST
DROP TABLE IF EXISTS mpp21090_drop_firstcol_dml_int8;
NOTICE:  table "mpp21090_drop_firstcol_dml_int8" does not exist, skipping
CREATE TABLE mpp21090_drop_firstcol_dml_int8(
col1 int8,
col2 decimal,
col3 char,
col4 date,
col5 int
)  with (appendonly= true)  DISTRIBUTED by(col3);
INSERT INTO mpp21090_drop_firstcol_dml_int8 VALUES(2000000000000000000,0.00,'a','2014-01-01',0);
SELECT * FROM mpp21090_drop_firstcol_dml_int8 ORDER BY 1,2,3,4;
        col1         | col2 | col3 |    col4    | col5 
---------------------+------+------+------------+------
 2000000000000000000 | 0.00 | a    | 2014-01-01 |    0
(1 row)

ALTER TABLE mpp21090_drop_firstcol_dml_int8 DROP COLUMN col1;
INSERT INTO mpp21090_drop_firstcol_dml_int8 SELECT 1.00,'b','2014-01-02',1;
SELECT * FROM mpp21090_drop_firstcol_dml_int8 ORDER BY 1,2,3,4;
 col2 | col3 |    col4    | col5 
------+------+------------+------
 0.00 | a    | 2014-01-01 |    0
 1.00 | b    | 2014-01-02 |    1
(2 rows)

UPDATE mpp21090_drop_firstcol_dml_int8 SET col3='c' WHERE col3 = 'b' AND col5 = 1;
ERROR:  Cannot parallelize an UPDATE statement that updates the distribution columns
SELECT * FROM mpp21090_drop_firstcol_dml_int8 ORDER BY 1,2,3,4;
 col2 | col3 |    col4    | col5 
------+------+------------+------
 0.00 | a    | 2014-01-01 |    0
 1.00 | b    | 2014-01-02 |    1
(2 rows)

DELETE FROM mpp21090_drop_firstcol_dml_int8 WHERE col3='c';
SELECT * FROM mpp21090_drop_firstcol_dml_int8 ORDER BY 1,2,3,4;
 col2 | col3 |    col4    | col5 
------+------+------------+------
 0.00 | a    | 2014-01-01 |    0
 1.00 | b    | 2014-01-02 |    1
(2 rows)

-- TEST
DROP TABLE IF EXISTS mpp21090_drop_firstcol_dml_int8;
CREATE TABLE mpp21090_drop_firstcol_dml_int8(
col1 int8,
col2 decimal,
col3 char,
col4 date,
col5 int
)  with (appendonly= true, orientation= column)  DISTRIBUTED by(col3);
INSERT INTO mpp21090_drop_firstcol_dml_int8 VALUES(2000000000000000000,0.00,'a','2014-01-01',0);
SELECT * FROM mpp21090_drop_firstcol_dml_int8 ORDER BY 1,2,3,4;
        col1         | col2 | col3 |    col4    | col5 
---------------------+------+------+------------+------
 2000000000000000000 | 0.00 | a    | 2014-01-01 |    0
(1 row)

ALTER TABLE mpp21090_drop_firstcol_dml_int8 DROP COLUMN col1;
INSERT INTO mpp21090_drop_firstcol_dml_int8 SELECT 1.00,'b','2014-01-02',1;
SELECT * FROM mpp21090_drop_firstcol_dml_int8 ORDER BY 1,2,3,4;
 col2 | col3 |    col4    | col5 
------+------+------------+------
 0.00 | a    | 2014-01-01 |    0
 1.00 | b    | 2014-01-02 |    1
(2 rows)

UPDATE mpp21090_drop_firstcol_dml_int8 SET col3='c' WHERE col3 = 'b' AND col5 = 1;
ERROR:  Cannot parallelize an UPDATE statement that updates the distribution columns
SELECT * FROM mpp21090_drop_firstcol_dml_int8 ORDER BY 1,2,3,4;
 col2 | col3 |    col4    | col5 
------+------+------------+------
 0.00 | a    | 2014-01-01 |    0
 1.00 | b    | 2014-01-02 |    1
(2 rows)

DELETE FROM mpp21090_drop_firstcol_dml_int8 WHERE col3='c';
SELECT * FROM mpp21090_drop_firstcol_dml_int8 ORDER BY 1,2,3,4;
 col2 | col3 |    col4    | col5 
------+------+------------+------
 0.00 | a    | 2014-01-01 |    0
 1.00 | b    | 2014-01-02 |    1
(2 rows)

-- TEST
DROP TABLE IF EXISTS mpp21090_drop_firstcol_dml_int8;
CREATE TABLE mpp21090_drop_firstcol_dml_int8(
col1 int8,
col2 decimal,
col3 char,
col4 date,
col5 int
)  DISTRIBUTED by(col3);
INSERT INTO mpp21090_drop_firstcol_dml_int8 VALUES(2000000000000000000,0.00,'a','2014-01-01',0);
SELECT * FROM mpp21090_drop_firstcol_dml_int8 ORDER BY 1,2,3,4;
        col1         | col2 | col3 |    col4    | col5 
---------------------+------+------+------------+------
 2000000000000000000 | 0.00 | a    | 2014-01-01 |    0
(1 row)

ALTER TABLE mpp21090_drop_firstcol_dml_int8 DROP COLUMN col1;
INSERT INTO mpp21090_drop_firstcol_dml_int8 SELECT 1.00,'b','2014-01-02',1;
SELECT * FROM mpp21090_drop_firstcol_dml_int8 ORDER BY 1,2,3,4;
 col2 | col3 |    col4    | col5 
------+------+------------+------
 0.00 | a    | 2014-01-01 |    0
 1.00 | b    | 2014-01-02 |    1
(2 rows)

UPDATE mpp21090_drop_firstcol_dml_int8 SET col3='c' WHERE col3 = 'b' AND col5 = 1;
ERROR:  Cannot parallelize an UPDATE statement that updates the distribution columns
SELECT * FROM mpp21090_drop_firstcol_dml_int8 ORDER BY 1,2,3,4;
 col2 | col3 |    col4    | col5 
------+------+------------+------
 0.00 | a    | 2014-01-01 |    0
 1.00 | b    | 2014-01-02 |    1
(2 rows)

DELETE FROM mpp21090_drop_firstcol_dml_int8 WHERE col3='c';
SELECT * FROM mpp21090_drop_firstcol_dml_int8 ORDER BY 1,2,3,4;
 col2 | col3 |    col4    | col5 
------+------+------------+------
 0.00 | a    | 2014-01-01 |    0
 1.00 | b    | 2014-01-02 |    1
(2 rows)

-- TEST
DROP TABLE IF EXISTS mpp21090_drop_firstcol_dml_interval;
NOTICE:  table "mpp21090_drop_firstcol_dml_interval" does not exist, skipping
CREATE TABLE mpp21090_drop_firstcol_dml_interval(
col1 interval,
col2 decimal,
col3 char,
col4 date,
col5 int
)  with (appendonly= true)  DISTRIBUTED by(col3);
INSERT INTO mpp21090_drop_firstcol_dml_interval VALUES('1 day',0.00,'a','2014-01-01',0);
SELECT * FROM mpp21090_drop_firstcol_dml_interval ORDER BY 1,2,3,4;
 col1  | col2 | col3 |    col4    | col5 
-------+------+------+------------+------
 1 day | 0.00 | a    | 2014-01-01 |    0
(1 row)

ALTER TABLE mpp21090_drop_firstcol_dml_interval DROP COLUMN col1;
INSERT INTO mpp21090_drop_firstcol_dml_interval SELECT 1.00,'b','2014-01-02',1;
SELECT * FROM mpp21090_drop_firstcol_dml_interval ORDER BY 1,2,3,4;
 col2 | col3 |    col4    | col5 
------+------+------------+------
 0.00 | a    | 2014-01-01 |    0
 1.00 | b    | 2014-01-02 |    1
(2 rows)

UPDATE mpp21090_drop_firstcol_dml_interval SET col3='c' WHERE col3 = 'b' AND col5 = 1;
ERROR:  Cannot parallelize an UPDATE statement that updates the distribution columns
SELECT * FROM mpp21090_drop_firstcol_dml_interval ORDER BY 1,2,3,4;
 col2 | col3 |    col4    | col5 
------+------+------------+------
 0.00 | a    | 2014-01-01 |    0
 1.00 | b    | 2014-01-02 |    1
(2 rows)

DELETE FROM mpp21090_drop_firstcol_dml_interval WHERE col3='c';
SELECT * FROM mpp21090_drop_firstcol_dml_interval ORDER BY 1,2,3,4;
 col2 | col3 |    col4    | col5 
------+------+------------+------
 0.00 | a    | 2014-01-01 |    0
 1.00 | b    | 2014-01-02 |    1
(2 rows)

-- TEST
DROP TABLE IF EXISTS mpp21090_drop_firstcol_dml_interval;
CREATE TABLE mpp21090_drop_firstcol_dml_interval(
col1 interval,
col2 decimal,
col3 char,
col4 date,
col5 int
)  with (appendonly= true, orientation= column)  DISTRIBUTED by(col3);
INSERT INTO mpp21090_drop_firstcol_dml_interval VALUES('1 day',0.00,'a','2014-01-01',0);
SELECT * FROM mpp21090_drop_firstcol_dml_interval ORDER BY 1,2,3,4;
 col1  | col2 | col3 |    col4    | col5 
-------+------+------+------------+------
 1 day | 0.00 | a    | 2014-01-01 |    0
(1 row)

ALTER TABLE mpp21090_drop_firstcol_dml_interval DROP COLUMN col1;
INSERT INTO mpp21090_drop_firstcol_dml_interval SELECT 1.00,'b','2014-01-02',1;
SELECT * FROM mpp21090_drop_firstcol_dml_interval ORDER BY 1,2,3,4;
 col2 | col3 |    col4    | col5 
------+------+------------+------
 0.00 | a    | 2014-01-01 |    0
 1.00 | b    | 2014-01-02 |    1
(2 rows)

UPDATE mpp21090_drop_firstcol_dml_interval SET col3='c' WHERE col3 = 'b' AND col5 = 1;
ERROR:  Cannot parallelize an UPDATE statement that updates the distribution columns
SELECT * FROM mpp21090_drop_firstcol_dml_interval ORDER BY 1,2,3,4;
 col2 | col3 |    col4    | col5 
------+------+------------+------
 0.00 | a    | 2014-01-01 |    0
 1.00 | b    | 2014-01-02 |    1
(2 rows)

DELETE FROM mpp21090_drop_firstcol_dml_interval WHERE col3='c';
SELECT * FROM mpp21090_drop_firstcol_dml_interval ORDER BY 1,2,3,4;
 col2 | col3 |    col4    | col5 
------+------+------------+------
 0.00 | a    | 2014-01-01 |    0
 1.00 | b    | 2014-01-02 |    1
(2 rows)

-- TEST
DROP TABLE IF EXISTS mpp21090_drop_firstcol_dml_interval;
CREATE TABLE mpp21090_drop_firstcol_dml_interval(
col1 interval,
col2 decimal,
col3 char,
col4 date,
col5 int
)  DISTRIBUTED by(col3);
INSERT INTO mpp21090_drop_firstcol_dml_interval VALUES('1 day',0.00,'a','2014-01-01',0);
SELECT * FROM mpp21090_drop_firstcol_dml_interval ORDER BY 1,2,3,4;
 col1  | col2 | col3 |    col4    | col5 
-------+------+------+------------+------
 1 day | 0.00 | a    | 2014-01-01 |    0
(1 row)

ALTER TABLE mpp21090_drop_firstcol_dml_interval DROP COLUMN col1;
INSERT INTO mpp21090_drop_firstcol_dml_interval SELECT 1.00,'b','2014-01-02',1;
SELECT * FROM mpp21090_drop_firstcol_dml_interval ORDER BY 1,2,3,4;
 col2 | col3 |    col4    | col5 
------+------+------------+------
 0.00 | a    | 2014-01-01 |    0
 1.00 | b    | 2014-01-02 |    1
(2 rows)

UPDATE mpp21090_drop_firstcol_dml_interval SET col3='c' WHERE col3 = 'b' AND col5 = 1;
ERROR:  Cannot parallelize an UPDATE statement that updates the distribution columns
SELECT * FROM mpp21090_drop_firstcol_dml_interval ORDER BY 1,2,3,4;
 col2 | col3 |    col4    | col5 
------+------+------------+------
 0.00 | a    | 2014-01-01 |    0
 1.00 | b    | 2014-01-02 |    1
(2 rows)

DELETE FROM mpp21090_drop_firstcol_dml_interval WHERE col3='c';
SELECT * FROM mpp21090_drop_firstcol_dml_interval ORDER BY 1,2,3,4;
 col2 | col3 |    col4    | col5 
------+------+------------+------
 0.00 | a    | 2014-01-01 |    0
 1.00 | b    | 2014-01-02 |    1
(2 rows)

-- TEST
DROP TABLE IF EXISTS mpp21090_drop_firstcol_dml_numeric;
NOTICE:  table "mpp21090_drop_firstcol_dml_numeric" does not exist, skipping
CREATE TABLE mpp21090_drop_firstcol_dml_numeric(
col1 numeric,
col2 decimal,
col3 char,
col4 date,
col5 int
)  with (appendonly= true)  DISTRIBUTED by(col3);
INSERT INTO mpp21090_drop_firstcol_dml_numeric VALUES(2.000000,0.00,'a','2014-01-01',0);
SELECT * FROM mpp21090_drop_firstcol_dml_numeric ORDER BY 1,2,3,4;
   col1   | col2 | col3 |    col4    | col5 
----------+------+------+------------+------
 2.000000 | 0.00 | a    | 2014-01-01 |    0
(1 row)

ALTER TABLE mpp21090_drop_firstcol_dml_numeric DROP COLUMN col1;
INSERT INTO mpp21090_drop_firstcol_dml_numeric SELECT 1.00,'b','2014-01-02',1;
SELECT * FROM mpp21090_drop_firstcol_dml_numeric ORDER BY 1,2,3,4;
 col2 | col3 |    col4    | col5 
------+------+------------+------
 0.00 | a    | 2014-01-01 |    0
 1.00 | b    | 2014-01-02 |    1
(2 rows)

UPDATE mpp21090_drop_firstcol_dml_numeric SET col3='c' WHERE col3 = 'b' AND col5 = 1;
ERROR:  Cannot parallelize an UPDATE statement that updates the distribution columns
SELECT * FROM mpp21090_drop_firstcol_dml_numeric ORDER BY 1,2,3,4;
 col2 | col3 |    col4    | col5 
------+------+------------+------
 0.00 | a    | 2014-01-01 |    0
 1.00 | b    | 2014-01-02 |    1
(2 rows)

DELETE FROM mpp21090_drop_firstcol_dml_numeric WHERE col3='c';
SELECT * FROM mpp21090_drop_firstcol_dml_numeric ORDER BY 1,2,3,4;
 col2 | col3 |    col4    | col5 
------+------+------------+------
 0.00 | a    | 2014-01-01 |    0
 1.00 | b    | 2014-01-02 |    1
(2 rows)

-- TEST
DROP TABLE IF EXISTS mpp21090_drop_firstcol_dml_numeric;
CREATE TABLE mpp21090_drop_firstcol_dml_numeric(
col1 numeric,
col2 decimal,
col3 char,
col4 date,
col5 int
)  with (appendonly= true, orientation= column)  DISTRIBUTED by(col3);
INSERT INTO mpp21090_drop_firstcol_dml_numeric VALUES(2.000000,0.00,'a','2014-01-01',0);
SELECT * FROM mpp21090_drop_firstcol_dml_numeric ORDER BY 1,2,3,4;
   col1   | col2 | col3 |    col4    | col5 
----------+------+------+------------+------
 2.000000 | 0.00 | a    | 2014-01-01 |    0
(1 row)

ALTER TABLE mpp21090_drop_firstcol_dml_numeric DROP COLUMN col1;
INSERT INTO mpp21090_drop_firstcol_dml_numeric SELECT 1.00,'b','2014-01-02',1;
SELECT * FROM mpp21090_drop_firstcol_dml_numeric ORDER BY 1,2,3,4;
 col2 | col3 |    col4    | col5 
------+------+------------+------
 0.00 | a    | 2014-01-01 |    0
 1.00 | b    | 2014-01-02 |    1
(2 rows)

UPDATE mpp21090_drop_firstcol_dml_numeric SET col3='c' WHERE col3 = 'b' AND col5 = 1;
ERROR:  Cannot parallelize an UPDATE statement that updates the distribution columns
SELECT * FROM mpp21090_drop_firstcol_dml_numeric ORDER BY 1,2,3,4;
 col2 | col3 |    col4    | col5 
------+------+------------+------
 0.00 | a    | 2014-01-01 |    0
 1.00 | b    | 2014-01-02 |    1
(2 rows)

DELETE FROM mpp21090_drop_firstcol_dml_numeric WHERE col3='c';
SELECT * FROM mpp21090_drop_firstcol_dml_numeric ORDER BY 1,2,3,4;
 col2 | col3 |    col4    | col5 
------+------+------------+------
 0.00 | a    | 2014-01-01 |    0
 1.00 | b    | 2014-01-02 |    1
(2 rows)

-- TEST
DROP TABLE IF EXISTS mpp21090_drop_firstcol_dml_numeric;
CREATE TABLE mpp21090_drop_firstcol_dml_numeric(
col1 numeric,
col2 decimal,
col3 char,
col4 date,
col5 int
)  DISTRIBUTED by(col3);
INSERT INTO mpp21090_drop_firstcol_dml_numeric VALUES(2.000000,0.00,'a','2014-01-01',0);
SELECT * FROM mpp21090_drop_firstcol_dml_numeric ORDER BY 1,2,3,4;
   col1   | col2 | col3 |    col4    | col5 
----------+------+------+------------+------
 2.000000 | 0.00 | a    | 2014-01-01 |    0
(1 row)

ALTER TABLE mpp21090_drop_firstcol_dml_numeric DROP COLUMN col1;
INSERT INTO mpp21090_drop_firstcol_dml_numeric SELECT 1.00,'b','2014-01-02',1;
SELECT * FROM mpp21090_drop_firstcol_dml_numeric ORDER BY 1,2,3,4;
 col2 | col3 |    col4    | col5 
------+------+------------+------
 0.00 | a    | 2014-01-01 |    0
 1.00 | b    | 2014-01-02 |    1
(2 rows)

UPDATE mpp21090_drop_firstcol_dml_numeric SET col3='c' WHERE col3 = 'b' AND col5 = 1;
ERROR:  Cannot parallelize an UPDATE statement that updates the distribution columns
SELECT * FROM mpp21090_drop_firstcol_dml_numeric ORDER BY 1,2,3,4;
 col2 | col3 |    col4    | col5 
------+------+------------+------
 0.00 | a    | 2014-01-01 |    0
 1.00 | b    | 2014-01-02 |    1
(2 rows)

DELETE FROM mpp21090_drop_firstcol_dml_numeric WHERE col3='c';
SELECT * FROM mpp21090_drop_firstcol_dml_numeric ORDER BY 1,2,3,4;
 col2 | col3 |    col4    | col5 
------+------+------------+------
 0.00 | a    | 2014-01-01 |    0
 1.00 | b    | 2014-01-02 |    1
(2 rows)

-- TEST
DROP TABLE IF EXISTS mpp21090_drop_firstcol_dml_text;
NOTICE:  table "mpp21090_drop_firstcol_dml_text" does not exist, skipping
CREATE TABLE mpp21090_drop_firstcol_dml_text(
col1 text,
col2 decimal,
col3 char,
col4 date,
col5 int
)  with (appendonly= true)  DISTRIBUTED by(col3);
INSERT INTO mpp21090_drop_firstcol_dml_text VALUES('abcdefghijklmnop',0.00,'a','2014-01-01',0);
SELECT * FROM mpp21090_drop_firstcol_dml_text ORDER BY 1,2,3,4;
       col1       | col2 | col3 |    col4    | col5 
------------------+------+------+------------+------
 abcdefghijklmnop | 0.00 | a    | 2014-01-01 |    0
(1 row)

ALTER TABLE mpp21090_drop_firstcol_dml_text DROP COLUMN col1;
INSERT INTO mpp21090_drop_firstcol_dml_text SELECT 1.00,'b','2014-01-02',1;
SELECT * FROM mpp21090_drop_firstcol_dml_text ORDER BY 1,2,3,4;
 col2 | col3 |    col4    | col5 
------+------+------------+------
 0.00 | a    | 2014-01-01 |    0
 1.00 | b    | 2014-01-02 |    1
(2 rows)

UPDATE mpp21090_drop_firstcol_dml_text SET col3='c' WHERE col3 = 'b' AND col5 = 1;
ERROR:  Cannot parallelize an UPDATE statement that updates the distribution columns
SELECT * FROM mpp21090_drop_firstcol_dml_text ORDER BY 1,2,3,4;
 col2 | col3 |    col4    | col5 
------+------+------------+------
 0.00 | a    | 2014-01-01 |    0
 1.00 | b    | 2014-01-02 |    1
(2 rows)

DELETE FROM mpp21090_drop_firstcol_dml_text WHERE col3='c';
SELECT * FROM mpp21090_drop_firstcol_dml_text ORDER BY 1,2,3,4;
 col2 | col3 |    col4    | col5 
------+------+------------+------
 0.00 | a    | 2014-01-01 |    0
 1.00 | b    | 2014-01-02 |    1
(2 rows)

-- TEST
DROP TABLE IF EXISTS mpp21090_drop_firstcol_dml_text;
CREATE TABLE mpp21090_drop_firstcol_dml_text(
col1 text,
col2 decimal,
col3 char,
col4 date,
col5 int
)  with (appendonly= true, orientation= column)  DISTRIBUTED by(col3);
INSERT INTO mpp21090_drop_firstcol_dml_text VALUES('abcdefghijklmnop',0.00,'a','2014-01-01',0);
SELECT * FROM mpp21090_drop_firstcol_dml_text ORDER BY 1,2,3,4;
       col1       | col2 | col3 |    col4    | col5 
------------------+------+------+------------+------
 abcdefghijklmnop | 0.00 | a    | 2014-01-01 |    0
(1 row)

ALTER TABLE mpp21090_drop_firstcol_dml_text DROP COLUMN col1;
INSERT INTO mpp21090_drop_firstcol_dml_text SELECT 1.00,'b','2014-01-02',1;
SELECT * FROM mpp21090_drop_firstcol_dml_text ORDER BY 1,2,3,4;
 col2 | col3 |    col4    | col5 
------+------+------------+------
 0.00 | a    | 2014-01-01 |    0
 1.00 | b    | 2014-01-02 |    1
(2 rows)

UPDATE mpp21090_drop_firstcol_dml_text SET col3='c' WHERE col3 = 'b' AND col5 = 1;
ERROR:  Cannot parallelize an UPDATE statement that updates the distribution columns
SELECT * FROM mpp21090_drop_firstcol_dml_text ORDER BY 1,2,3,4;
 col2 | col3 |    col4    | col5 
------+------+------------+------
 0.00 | a    | 2014-01-01 |    0
 1.00 | b    | 2014-01-02 |    1
(2 rows)

DELETE FROM mpp21090_drop_firstcol_dml_text WHERE col3='c';
SELECT * FROM mpp21090_drop_firstcol_dml_text ORDER BY 1,2,3,4;
 col2 | col3 |    col4    | col5 
------+------+------------+------
 0.00 | a    | 2014-01-01 |    0
 1.00 | b    | 2014-01-02 |    1
(2 rows)

-- TEST
DROP TABLE IF EXISTS mpp21090_drop_firstcol_dml_text;
CREATE TABLE mpp21090_drop_firstcol_dml_text(
col1 text,
col2 decimal,
col3 char,
col4 date,
col5 int
)  DISTRIBUTED by(col3);
INSERT INTO mpp21090_drop_firstcol_dml_text VALUES('abcdefghijklmnop',0.00,'a','2014-01-01',0);
SELECT * FROM mpp21090_drop_firstcol_dml_text ORDER BY 1,2,3,4;
       col1       | col2 | col3 |    col4    | col5 
------------------+------+------+------------+------
 abcdefghijklmnop | 0.00 | a    | 2014-01-01 |    0
(1 row)

ALTER TABLE mpp21090_drop_firstcol_dml_text DROP COLUMN col1;
INSERT INTO mpp21090_drop_firstcol_dml_text SELECT 1.00,'b','2014-01-02',1;
SELECT * FROM mpp21090_drop_firstcol_dml_text ORDER BY 1,2,3,4;
 col2 | col3 |    col4    | col5 
------+------+------------+------
 0.00 | a    | 2014-01-01 |    0
 1.00 | b    | 2014-01-02 |    1
(2 rows)

UPDATE mpp21090_drop_firstcol_dml_text SET col3='c' WHERE col3 = 'b' AND col5 = 1;
ERROR:  Cannot parallelize an UPDATE statement that updates the distribution columns
SELECT * FROM mpp21090_drop_firstcol_dml_text ORDER BY 1,2,3,4;
 col2 | col3 |    col4    | col5 
------+------+------------+------
 0.00 | a    | 2014-01-01 |    0
 1.00 | b    | 2014-01-02 |    1
(2 rows)

DELETE FROM mpp21090_drop_firstcol_dml_text WHERE col3='c';
SELECT * FROM mpp21090_drop_firstcol_dml_text ORDER BY 1,2,3,4;
 col2 | col3 |    col4    | col5 
------+------+------------+------
 0.00 | a    | 2014-01-01 |    0
 1.00 | b    | 2014-01-02 |    1
(2 rows)

-- TEST
DROP TABLE IF EXISTS mpp21090_drop_lastcol_dml_boolean;
NOTICE:  table "mpp21090_drop_lastcol_dml_boolean" does not exist, skipping
CREATE TABLE mpp21090_drop_lastcol_dml_boolean(
col1 int,
col2 decimal,
col3 char,
col4 date,
col5 boolean
) with (appendonly= true)  DISTRIBUTED by(col3);
INSERT INTO mpp21090_drop_lastcol_dml_boolean VALUES(0,0.00,'a','2014-01-01',True);
SELECT * FROM mpp21090_drop_lastcol_dml_boolean ORDER BY 1,2,3,4;
 col1 | col2 | col3 |    col4    | col5 
------+------+------+------------+------
    0 | 0.00 | a    | 2014-01-01 | t
(1 row)

ALTER TABLE mpp21090_drop_lastcol_dml_boolean DROP COLUMN col5;
INSERT INTO mpp21090_drop_lastcol_dml_boolean SELECT 1,1.00,'b','2014-01-02';
SELECT * FROM mpp21090_drop_lastcol_dml_boolean ORDER BY 1,2,3,4;
 col1 | col2 | col3 |    col4    
------+------+------+------------
    0 | 0.00 | a    | 2014-01-01
    1 | 1.00 | b    | 2014-01-02
(2 rows)

UPDATE mpp21090_drop_lastcol_dml_boolean SET col3='c' WHERE col3 = 'b' AND col1 = 1;
ERROR:  Cannot parallelize an UPDATE statement that updates the distribution columns
SELECT * FROM mpp21090_drop_lastcol_dml_boolean ORDER BY 1,2,3,4;
 col1 | col2 | col3 |    col4    
------+------+------+------------
    0 | 0.00 | a    | 2014-01-01
    1 | 1.00 | b    | 2014-01-02
(2 rows)

DELETE FROM mpp21090_drop_lastcol_dml_boolean WHERE col3='c';
SELECT * FROM mpp21090_drop_lastcol_dml_boolean ORDER BY 1,2,3,4;
 col1 | col2 | col3 |    col4    
------+------+------+------------
    0 | 0.00 | a    | 2014-01-01
    1 | 1.00 | b    | 2014-01-02
(2 rows)

-- TEST
DROP TABLE IF EXISTS mpp21090_drop_lastcol_dml_boolean;
CREATE TABLE mpp21090_drop_lastcol_dml_boolean(
col1 int,
col2 decimal,
col3 char,
col4 date,
col5 boolean
) with (appendonly= true, orientation= column)  DISTRIBUTED by(col3);
INSERT INTO mpp21090_drop_lastcol_dml_boolean VALUES(0,0.00,'a','2014-01-01',True);
SELECT * FROM mpp21090_drop_lastcol_dml_boolean ORDER BY 1,2,3,4;
 col1 | col2 | col3 |    col4    | col5 
------+------+------+------------+------
    0 | 0.00 | a    | 2014-01-01 | t
(1 row)

ALTER TABLE mpp21090_drop_lastcol_dml_boolean DROP COLUMN col5;
INSERT INTO mpp21090_drop_lastcol_dml_boolean SELECT 1,1.00,'b','2014-01-02';
SELECT * FROM mpp21090_drop_lastcol_dml_boolean ORDER BY 1,2,3,4;
 col1 | col2 | col3 |    col4    
------+------+------+------------
    0 | 0.00 | a    | 2014-01-01
    1 | 1.00 | b    | 2014-01-02
(2 rows)

UPDATE mpp21090_drop_lastcol_dml_boolean SET col3='c' WHERE col3 = 'b' AND col1 = 1;
ERROR:  Cannot parallelize an UPDATE statement that updates the distribution columns
SELECT * FROM mpp21090_drop_lastcol_dml_boolean ORDER BY 1,2,3,4;
 col1 | col2 | col3 |    col4    
------+------+------+------------
    0 | 0.00 | a    | 2014-01-01
    1 | 1.00 | b    | 2014-01-02
(2 rows)

DELETE FROM mpp21090_drop_lastcol_dml_boolean WHERE col3='c';
SELECT * FROM mpp21090_drop_lastcol_dml_boolean ORDER BY 1,2,3,4;
 col1 | col2 | col3 |    col4    
------+------+------+------------
    0 | 0.00 | a    | 2014-01-01
    1 | 1.00 | b    | 2014-01-02
(2 rows)

-- TEST
DROP TABLE IF EXISTS mpp21090_drop_lastcol_dml_boolean;
CREATE TABLE mpp21090_drop_lastcol_dml_boolean(
col1 int,
col2 decimal,
col3 char,
col4 date,
col5 boolean
) DISTRIBUTED by(col3);
INSERT INTO mpp21090_drop_lastcol_dml_boolean VALUES(0,0.00,'a','2014-01-01',True);
SELECT * FROM mpp21090_drop_lastcol_dml_boolean ORDER BY 1,2,3,4;
 col1 | col2 | col3 |    col4    | col5 
------+------+------+------------+------
    0 | 0.00 | a    | 2014-01-01 | t
(1 row)

ALTER TABLE mpp21090_drop_lastcol_dml_boolean DROP COLUMN col5;
INSERT INTO mpp21090_drop_lastcol_dml_boolean SELECT 1,1.00,'b','2014-01-02';
SELECT * FROM mpp21090_drop_lastcol_dml_boolean ORDER BY 1,2,3,4;
 col1 | col2 | col3 |    col4    
------+------+------+------------
    0 | 0.00 | a    | 2014-01-01
    1 | 1.00 | b    | 2014-01-02
(2 rows)

UPDATE mpp21090_drop_lastcol_dml_boolean SET col3='c' WHERE col3 = 'b' AND col1 = 1;
ERROR:  Cannot parallelize an UPDATE statement that updates the distribution columns
SELECT * FROM mpp21090_drop_lastcol_dml_boolean ORDER BY 1,2,3,4;
 col1 | col2 | col3 |    col4    
------+------+------+------------
    0 | 0.00 | a    | 2014-01-01
    1 | 1.00 | b    | 2014-01-02
(2 rows)

DELETE FROM mpp21090_drop_lastcol_dml_boolean WHERE col3='c';
SELECT * FROM mpp21090_drop_lastcol_dml_boolean ORDER BY 1,2,3,4;
 col1 | col2 | col3 |    col4    
------+------+------+------------
    0 | 0.00 | a    | 2014-01-01
    1 | 1.00 | b    | 2014-01-02
(2 rows)

-- TEST
DROP TABLE IF EXISTS mpp21090_drop_lastcol_dml_char;
NOTICE:  table "mpp21090_drop_lastcol_dml_char" does not exist, skipping
CREATE TABLE mpp21090_drop_lastcol_dml_char(
col1 int,
col2 decimal,
col3 char,
col4 date,
col5 char
) with (appendonly= true)  DISTRIBUTED by(col3);
INSERT INTO mpp21090_drop_lastcol_dml_char VALUES(0,0.00,'a','2014-01-01','z');
SELECT * FROM mpp21090_drop_lastcol_dml_char ORDER BY 1,2,3,4;
 col1 | col2 | col3 |    col4    | col5 
------+------+------+------------+------
    0 | 0.00 | a    | 2014-01-01 | z
(1 row)

ALTER TABLE mpp21090_drop_lastcol_dml_char DROP COLUMN col5;
INSERT INTO mpp21090_drop_lastcol_dml_char SELECT 1,1.00,'b','2014-01-02';
SELECT * FROM mpp21090_drop_lastcol_dml_char ORDER BY 1,2,3,4;
 col1 | col2 | col3 |    col4    
------+------+------+------------
    0 | 0.00 | a    | 2014-01-01
    1 | 1.00 | b    | 2014-01-02
(2 rows)

UPDATE mpp21090_drop_lastcol_dml_char SET col3='c' WHERE col3 = 'b' AND col1 = 1;
ERROR:  Cannot parallelize an UPDATE statement that updates the distribution columns
SELECT * FROM mpp21090_drop_lastcol_dml_char ORDER BY 1,2,3,4;
 col1 | col2 | col3 |    col4    
------+------+------+------------
    0 | 0.00 | a    | 2014-01-01
    1 | 1.00 | b    | 2014-01-02
(2 rows)

DELETE FROM mpp21090_drop_lastcol_dml_char WHERE col3='c';
SELECT * FROM mpp21090_drop_lastcol_dml_char ORDER BY 1,2,3,4;
 col1 | col2 | col3 |    col4    
------+------+------+------------
    0 | 0.00 | a    | 2014-01-01
    1 | 1.00 | b    | 2014-01-02
(2 rows)

-- TEST
DROP TABLE IF EXISTS mpp21090_drop_lastcol_dml_char;
CREATE TABLE mpp21090_drop_lastcol_dml_char(
col1 int,
col2 decimal,
col3 char,
col4 date,
col5 char
) with (appendonly= true, orientation= column)  DISTRIBUTED by(col3);
INSERT INTO mpp21090_drop_lastcol_dml_char VALUES(0,0.00,'a','2014-01-01','z');
SELECT * FROM mpp21090_drop_lastcol_dml_char ORDER BY 1,2,3,4;
 col1 | col2 | col3 |    col4    | col5 
------+------+------+------------+------
    0 | 0.00 | a    | 2014-01-01 | z
(1 row)

ALTER TABLE mpp21090_drop_lastcol_dml_char DROP COLUMN col5;
INSERT INTO mpp21090_drop_lastcol_dml_char SELECT 1,1.00,'b','2014-01-02';
SELECT * FROM mpp21090_drop_lastcol_dml_char ORDER BY 1,2,3,4;
 col1 | col2 | col3 |    col4    
------+------+------+------------
    0 | 0.00 | a    | 2014-01-01
    1 | 1.00 | b    | 2014-01-02
(2 rows)

UPDATE mpp21090_drop_lastcol_dml_char SET col3='c' WHERE col3 = 'b' AND col1 = 1;
ERROR:  Cannot parallelize an UPDATE statement that updates the distribution columns
SELECT * FROM mpp21090_drop_lastcol_dml_char ORDER BY 1,2,3,4;
 col1 | col2 | col3 |    col4    
------+------+------+------------
    0 | 0.00 | a    | 2014-01-01
    1 | 1.00 | b    | 2014-01-02
(2 rows)

DELETE FROM mpp21090_drop_lastcol_dml_char WHERE col3='c';
SELECT * FROM mpp21090_drop_lastcol_dml_char ORDER BY 1,2,3,4;
 col1 | col2 | col3 |    col4    
------+------+------+------------
    0 | 0.00 | a    | 2014-01-01
    1 | 1.00 | b    | 2014-01-02
(2 rows)

-- TEST
DROP TABLE IF EXISTS mpp21090_drop_lastcol_dml_char;
CREATE TABLE mpp21090_drop_lastcol_dml_char(
col1 int,
col2 decimal,
col3 char,
col4 date,
col5 char
) DISTRIBUTED by(col3);
INSERT INTO mpp21090_drop_lastcol_dml_char VALUES(0,0.00,'a','2014-01-01','z');
SELECT * FROM mpp21090_drop_lastcol_dml_char ORDER BY 1,2,3,4;
 col1 | col2 | col3 |    col4    | col5 
------+------+------+------------+------
    0 | 0.00 | a    | 2014-01-01 | z
(1 row)

ALTER TABLE mpp21090_drop_lastcol_dml_char DROP COLUMN col5;
INSERT INTO mpp21090_drop_lastcol_dml_char SELECT 1,1.00,'b','2014-01-02';
SELECT * FROM mpp21090_drop_lastcol_dml_char ORDER BY 1,2,3,4;
 col1 | col2 | col3 |    col4    
------+------+------+------------
    0 | 0.00 | a    | 2014-01-01
    1 | 1.00 | b    | 2014-01-02
(2 rows)

UPDATE mpp21090_drop_lastcol_dml_char SET col3='c' WHERE col3 = 'b' AND col1 = 1;
ERROR:  Cannot parallelize an UPDATE statement that updates the distribution columns
SELECT * FROM mpp21090_drop_lastcol_dml_char ORDER BY 1,2,3,4;
 col1 | col2 | col3 |    col4    
------+------+------+------------
    0 | 0.00 | a    | 2014-01-01
    1 | 1.00 | b    | 2014-01-02
(2 rows)

DELETE FROM mpp21090_drop_lastcol_dml_char WHERE col3='c';
SELECT * FROM mpp21090_drop_lastcol_dml_char ORDER BY 1,2,3,4;
 col1 | col2 | col3 |    col4    
------+------+------+------------
    0 | 0.00 | a    | 2014-01-01
    1 | 1.00 | b    | 2014-01-02
(2 rows)

-- TEST
DROP TABLE IF EXISTS mpp21090_drop_lastcol_dml_decimal;
NOTICE:  table "mpp21090_drop_lastcol_dml_decimal" does not exist, skipping
CREATE TABLE mpp21090_drop_lastcol_dml_decimal(
col1 int,
col2 decimal,
col3 char,
col4 date,
col5 decimal
) with (appendonly= true)  DISTRIBUTED by(col3);
INSERT INTO mpp21090_drop_lastcol_dml_decimal VALUES(0,0.00,'a','2014-01-01',2.00);
SELECT * FROM mpp21090_drop_lastcol_dml_decimal ORDER BY 1,2,3,4;
 col1 | col2 | col3 |    col4    | col5 
------+------+------+------------+------
    0 | 0.00 | a    | 2014-01-01 | 2.00
(1 row)

ALTER TABLE mpp21090_drop_lastcol_dml_decimal DROP COLUMN col5;
INSERT INTO mpp21090_drop_lastcol_dml_decimal SELECT 1,1.00,'b','2014-01-02';
SELECT * FROM mpp21090_drop_lastcol_dml_decimal ORDER BY 1,2,3,4;
 col1 | col2 | col3 |    col4    
------+------+------+------------
    0 | 0.00 | a    | 2014-01-01
    1 | 1.00 | b    | 2014-01-02
(2 rows)

UPDATE mpp21090_drop_lastcol_dml_decimal SET col3='c' WHERE col3 = 'b' AND col1 = 1;
ERROR:  Cannot parallelize an UPDATE statement that updates the distribution columns
SELECT * FROM mpp21090_drop_lastcol_dml_decimal ORDER BY 1,2,3,4;
 col1 | col2 | col3 |    col4    
------+------+------+------------
    0 | 0.00 | a    | 2014-01-01
    1 | 1.00 | b    | 2014-01-02
(2 rows)

DELETE FROM mpp21090_drop_lastcol_dml_decimal WHERE col3='c';
SELECT * FROM mpp21090_drop_lastcol_dml_decimal ORDER BY 1,2,3,4;
 col1 | col2 | col3 |    col4    
------+------+------+------------
    0 | 0.00 | a    | 2014-01-01
    1 | 1.00 | b    | 2014-01-02
(2 rows)

-- TEST
DROP TABLE IF EXISTS mpp21090_drop_lastcol_dml_decimal;
CREATE TABLE mpp21090_drop_lastcol_dml_decimal(
col1 int,
col2 decimal,
col3 char,
col4 date,
col5 decimal
) with (appendonly= true, orientation= column)  DISTRIBUTED by(col3);
INSERT INTO mpp21090_drop_lastcol_dml_decimal VALUES(0,0.00,'a','2014-01-01',2.00);
SELECT * FROM mpp21090_drop_lastcol_dml_decimal ORDER BY 1,2,3,4;
 col1 | col2 | col3 |    col4    | col5 
------+------+------+------------+------
    0 | 0.00 | a    | 2014-01-01 | 2.00
(1 row)

ALTER TABLE mpp21090_drop_lastcol_dml_decimal DROP COLUMN col5;
INSERT INTO mpp21090_drop_lastcol_dml_decimal SELECT 1,1.00,'b','2014-01-02';
SELECT * FROM mpp21090_drop_lastcol_dml_decimal ORDER BY 1,2,3,4;
 col1 | col2 | col3 |    col4    
------+------+------+------------
    0 | 0.00 | a    | 2014-01-01
    1 | 1.00 | b    | 2014-01-02
(2 rows)

UPDATE mpp21090_drop_lastcol_dml_decimal SET col3='c' WHERE col3 = 'b' AND col1 = 1;
ERROR:  Cannot parallelize an UPDATE statement that updates the distribution columns
SELECT * FROM mpp21090_drop_lastcol_dml_decimal ORDER BY 1,2,3,4;
 col1 | col2 | col3 |    col4    
------+------+------+------------
    0 | 0.00 | a    | 2014-01-01
    1 | 1.00 | b    | 2014-01-02
(2 rows)

DELETE FROM mpp21090_drop_lastcol_dml_decimal WHERE col3='c';
SELECT * FROM mpp21090_drop_lastcol_dml_decimal ORDER BY 1,2,3,4;
 col1 | col2 | col3 |    col4    
------+------+------+------------
    0 | 0.00 | a    | 2014-01-01
    1 | 1.00 | b    | 2014-01-02
(2 rows)

-- TEST
DROP TABLE IF EXISTS mpp21090_drop_lastcol_dml_decimal;
CREATE TABLE mpp21090_drop_lastcol_dml_decimal(
col1 int,
col2 decimal,
col3 char,
col4 date,
col5 decimal
) DISTRIBUTED by(col3);
INSERT INTO mpp21090_drop_lastcol_dml_decimal VALUES(0,0.00,'a','2014-01-01',2.00);
SELECT * FROM mpp21090_drop_lastcol_dml_decimal ORDER BY 1,2,3,4;
 col1 | col2 | col3 |    col4    | col5 
------+------+------+------------+------
    0 | 0.00 | a    | 2014-01-01 | 2.00
(1 row)

ALTER TABLE mpp21090_drop_lastcol_dml_decimal DROP COLUMN col5;
INSERT INTO mpp21090_drop_lastcol_dml_decimal SELECT 1,1.00,'b','2014-01-02';
SELECT * FROM mpp21090_drop_lastcol_dml_decimal ORDER BY 1,2,3,4;
 col1 | col2 | col3 |    col4    
------+------+------+------------
    0 | 0.00 | a    | 2014-01-01
    1 | 1.00 | b    | 2014-01-02
(2 rows)

UPDATE mpp21090_drop_lastcol_dml_decimal SET col3='c' WHERE col3 = 'b' AND col1 = 1;
ERROR:  Cannot parallelize an UPDATE statement that updates the distribution columns
SELECT * FROM mpp21090_drop_lastcol_dml_decimal ORDER BY 1,2,3,4;
 col1 | col2 | col3 |    col4    
------+------+------+------------
    0 | 0.00 | a    | 2014-01-01
    1 | 1.00 | b    | 2014-01-02
(2 rows)

DELETE FROM mpp21090_drop_lastcol_dml_decimal WHERE col3='c';
SELECT * FROM mpp21090_drop_lastcol_dml_decimal ORDER BY 1,2,3,4;
 col1 | col2 | col3 |    col4    
------+------+------+------------
    0 | 0.00 | a    | 2014-01-01
    1 | 1.00 | b    | 2014-01-02
(2 rows)

-- TEST
DROP TABLE IF EXISTS mpp21090_drop_lastcol_dml_int4;
NOTICE:  table "mpp21090_drop_lastcol_dml_int4" does not exist, skipping
CREATE TABLE mpp21090_drop_lastcol_dml_int4(
col1 int,
col2 decimal,
col3 char,
col4 date,
col5 int4
) with (appendonly= true)  DISTRIBUTED by(col3);
INSERT INTO mpp21090_drop_lastcol_dml_int4 VALUES(0,0.00,'a','2014-01-01',2000000000);
SELECT * FROM mpp21090_drop_lastcol_dml_int4 ORDER BY 1,2,3,4;
 col1 | col2 | col3 |    col4    |    col5    
------+------+------+------------+------------
    0 | 0.00 | a    | 2014-01-01 | 2000000000
(1 row)

ALTER TABLE mpp21090_drop_lastcol_dml_int4 DROP COLUMN col5;
INSERT INTO mpp21090_drop_lastcol_dml_int4 SELECT 1,1.00,'b','2014-01-02';
SELECT * FROM mpp21090_drop_lastcol_dml_int4 ORDER BY 1,2,3,4;
 col1 | col2 | col3 |    col4    
------+------+------+------------
    0 | 0.00 | a    | 2014-01-01
    1 | 1.00 | b    | 2014-01-02
(2 rows)

UPDATE mpp21090_drop_lastcol_dml_int4 SET col3='c' WHERE col3 = 'b' AND col1 = 1;
ERROR:  Cannot parallelize an UPDATE statement that updates the distribution columns
SELECT * FROM mpp21090_drop_lastcol_dml_int4 ORDER BY 1,2,3,4;
 col1 | col2 | col3 |    col4    
------+------+------+------------
    0 | 0.00 | a    | 2014-01-01
    1 | 1.00 | b    | 2014-01-02
(2 rows)

DELETE FROM mpp21090_drop_lastcol_dml_int4 WHERE col3='c';
SELECT * FROM mpp21090_drop_lastcol_dml_int4 ORDER BY 1,2,3,4;
 col1 | col2 | col3 |    col4    
------+------+------+------------
    0 | 0.00 | a    | 2014-01-01
    1 | 1.00 | b    | 2014-01-02
(2 rows)

-- TEST
DROP TABLE IF EXISTS mpp21090_drop_lastcol_dml_int4;
CREATE TABLE mpp21090_drop_lastcol_dml_int4(
col1 int,
col2 decimal,
col3 char,
col4 date,
col5 int4
) with (appendonly= true, orientation= column)  DISTRIBUTED by(col3);
INSERT INTO mpp21090_drop_lastcol_dml_int4 VALUES(0,0.00,'a','2014-01-01',2000000000);
SELECT * FROM mpp21090_drop_lastcol_dml_int4 ORDER BY 1,2,3,4;
 col1 | col2 | col3 |    col4    |    col5    
------+------+------+------------+------------
    0 | 0.00 | a    | 2014-01-01 | 2000000000
(1 row)

ALTER TABLE mpp21090_drop_lastcol_dml_int4 DROP COLUMN col5;
INSERT INTO mpp21090_drop_lastcol_dml_int4 SELECT 1,1.00,'b','2014-01-02';
SELECT * FROM mpp21090_drop_lastcol_dml_int4 ORDER BY 1,2,3,4;
 col1 | col2 | col3 |    col4    
------+------+------+------------
    0 | 0.00 | a    | 2014-01-01
    1 | 1.00 | b    | 2014-01-02
(2 rows)

UPDATE mpp21090_drop_lastcol_dml_int4 SET col3='c' WHERE col3 = 'b' AND col1 = 1;
ERROR:  Cannot parallelize an UPDATE statement that updates the distribution columns
SELECT * FROM mpp21090_drop_lastcol_dml_int4 ORDER BY 1,2,3,4;
 col1 | col2 | col3 |    col4    
------+------+------+------------
    0 | 0.00 | a    | 2014-01-01
    1 | 1.00 | b    | 2014-01-02
(2 rows)

DELETE FROM mpp21090_drop_lastcol_dml_int4 WHERE col3='c';
SELECT * FROM mpp21090_drop_lastcol_dml_int4 ORDER BY 1,2,3,4;
 col1 | col2 | col3 |    col4    
------+------+------+------------
    0 | 0.00 | a    | 2014-01-01
    1 | 1.00 | b    | 2014-01-02
(2 rows)

-- TEST
DROP TABLE IF EXISTS mpp21090_drop_lastcol_dml_int4;
CREATE TABLE mpp21090_drop_lastcol_dml_int4(
col1 int,
col2 decimal,
col3 char,
col4 date,
col5 int4
) DISTRIBUTED by(col3);
INSERT INTO mpp21090_drop_lastcol_dml_int4 VALUES(0,0.00,'a','2014-01-01',2000000000);
SELECT * FROM mpp21090_drop_lastcol_dml_int4 ORDER BY 1,2,3,4;
 col1 | col2 | col3 |    col4    |    col5    
------+------+------+------------+------------
    0 | 0.00 | a    | 2014-01-01 | 2000000000
(1 row)

ALTER TABLE mpp21090_drop_lastcol_dml_int4 DROP COLUMN col5;
INSERT INTO mpp21090_drop_lastcol_dml_int4 SELECT 1,1.00,'b','2014-01-02';
SELECT * FROM mpp21090_drop_lastcol_dml_int4 ORDER BY 1,2,3,4;
 col1 | col2 | col3 |    col4    
------+------+------+------------
    0 | 0.00 | a    | 2014-01-01
    1 | 1.00 | b    | 2014-01-02
(2 rows)

UPDATE mpp21090_drop_lastcol_dml_int4 SET col3='c' WHERE col3 = 'b' AND col1 = 1;
ERROR:  Cannot parallelize an UPDATE statement that updates the distribution columns
SELECT * FROM mpp21090_drop_lastcol_dml_int4 ORDER BY 1,2,3,4;
 col1 | col2 | col3 |    col4    
------+------+------+------------
    0 | 0.00 | a    | 2014-01-01
    1 | 1.00 | b    | 2014-01-02
(2 rows)

DELETE FROM mpp21090_drop_lastcol_dml_int4 WHERE col3='c';
SELECT * FROM mpp21090_drop_lastcol_dml_int4 ORDER BY 1,2,3,4;
 col1 | col2 | col3 |    col4    
------+------+------+------------
    0 | 0.00 | a    | 2014-01-01
    1 | 1.00 | b    | 2014-01-02
(2 rows)

-- TEST
DROP TABLE IF EXISTS mpp21090_drop_lastcol_dml_int8;
NOTICE:  table "mpp21090_drop_lastcol_dml_int8" does not exist, skipping
CREATE TABLE mpp21090_drop_lastcol_dml_int8(
col1 int,
col2 decimal,
col3 char,
col4 date,
col5 int8
) with (appendonly= true)  DISTRIBUTED by(col3);
INSERT INTO mpp21090_drop_lastcol_dml_int8 VALUES(0,0.00,'a','2014-01-01',2000000000000000000);
SELECT * FROM mpp21090_drop_lastcol_dml_int8 ORDER BY 1,2,3,4;
 col1 | col2 | col3 |    col4    |        col5         
------+------+------+------------+---------------------
    0 | 0.00 | a    | 2014-01-01 | 2000000000000000000
(1 row)

ALTER TABLE mpp21090_drop_lastcol_dml_int8 DROP COLUMN col5;
INSERT INTO mpp21090_drop_lastcol_dml_int8 SELECT 1,1.00,'b','2014-01-02';
SELECT * FROM mpp21090_drop_lastcol_dml_int8 ORDER BY 1,2,3,4;
 col1 | col2 | col3 |    col4    
------+------+------+------------
    0 | 0.00 | a    | 2014-01-01
    1 | 1.00 | b    | 2014-01-02
(2 rows)

UPDATE mpp21090_drop_lastcol_dml_int8 SET col3='c' WHERE col3 = 'b' AND col1 = 1;
ERROR:  Cannot parallelize an UPDATE statement that updates the distribution columns
SELECT * FROM mpp21090_drop_lastcol_dml_int8 ORDER BY 1,2,3,4;
 col1 | col2 | col3 |    col4    
------+------+------+------------
    0 | 0.00 | a    | 2014-01-01
    1 | 1.00 | b    | 2014-01-02
(2 rows)

DELETE FROM mpp21090_drop_lastcol_dml_int8 WHERE col3='c';
SELECT * FROM mpp21090_drop_lastcol_dml_int8 ORDER BY 1,2,3,4;
 col1 | col2 | col3 |    col4    
------+------+------+------------
    0 | 0.00 | a    | 2014-01-01
    1 | 1.00 | b    | 2014-01-02
(2 rows)

-- TEST
DROP TABLE IF EXISTS mpp21090_drop_lastcol_dml_int8;
CREATE TABLE mpp21090_drop_lastcol_dml_int8(
col1 int,
col2 decimal,
col3 char,
col4 date,
col5 int8
) with (appendonly= true, orientation= column)  DISTRIBUTED by(col3);
INSERT INTO mpp21090_drop_lastcol_dml_int8 VALUES(0,0.00,'a','2014-01-01',2000000000000000000);
SELECT * FROM mpp21090_drop_lastcol_dml_int8 ORDER BY 1,2,3,4;
 col1 | col2 | col3 |    col4    |        col5         
------+------+------+------------+---------------------
    0 | 0.00 | a    | 2014-01-01 | 2000000000000000000
(1 row)

ALTER TABLE mpp21090_drop_lastcol_dml_int8 DROP COLUMN col5;
INSERT INTO mpp21090_drop_lastcol_dml_int8 SELECT 1,1.00,'b','2014-01-02';
SELECT * FROM mpp21090_drop_lastcol_dml_int8 ORDER BY 1,2,3,4;
 col1 | col2 | col3 |    col4    
------+------+------+------------
    0 | 0.00 | a    | 2014-01-01
    1 | 1.00 | b    | 2014-01-02
(2 rows)

UPDATE mpp21090_drop_lastcol_dml_int8 SET col3='c' WHERE col3 = 'b' AND col1 = 1;
ERROR:  Cannot parallelize an UPDATE statement that updates the distribution columns
SELECT * FROM mpp21090_drop_lastcol_dml_int8 ORDER BY 1,2,3,4;
 col1 | col2 | col3 |    col4    
------+------+------+------------
    0 | 0.00 | a    | 2014-01-01
    1 | 1.00 | b    | 2014-01-02
(2 rows)

DELETE FROM mpp21090_drop_lastcol_dml_int8 WHERE col3='c';
SELECT * FROM mpp21090_drop_lastcol_dml_int8 ORDER BY 1,2,3,4;
 col1 | col2 | col3 |    col4    
------+------+------+------------
    0 | 0.00 | a    | 2014-01-01
    1 | 1.00 | b    | 2014-01-02
(2 rows)

-- TEST
DROP TABLE IF EXISTS mpp21090_drop_lastcol_dml_int8;
CREATE TABLE mpp21090_drop_lastcol_dml_int8(
col1 int,
col2 decimal,
col3 char,
col4 date,
col5 int8
) DISTRIBUTED by(col3);
INSERT INTO mpp21090_drop_lastcol_dml_int8 VALUES(0,0.00,'a','2014-01-01',2000000000000000000);
SELECT * FROM mpp21090_drop_lastcol_dml_int8 ORDER BY 1,2,3,4;
 col1 | col2 | col3 |    col4    |        col5         
------+------+------+------------+---------------------
    0 | 0.00 | a    | 2014-01-01 | 2000000000000000000
(1 row)

ALTER TABLE mpp21090_drop_lastcol_dml_int8 DROP COLUMN col5;
INSERT INTO mpp21090_drop_lastcol_dml_int8 SELECT 1,1.00,'b','2014-01-02';
SELECT * FROM mpp21090_drop_lastcol_dml_int8 ORDER BY 1,2,3,4;
 col1 | col2 | col3 |    col4    
------+------+------+------------
    0 | 0.00 | a    | 2014-01-01
    1 | 1.00 | b    | 2014-01-02
(2 rows)

UPDATE mpp21090_drop_lastcol_dml_int8 SET col3='c' WHERE col3 = 'b' AND col1 = 1;
ERROR:  Cannot parallelize an UPDATE statement that updates the distribution columns
SELECT * FROM mpp21090_drop_lastcol_dml_int8 ORDER BY 1,2,3,4;
 col1 | col2 | col3 |    col4    
------+------+------+------------
    0 | 0.00 | a    | 2014-01-01
    1 | 1.00 | b    | 2014-01-02
(2 rows)

DELETE FROM mpp21090_drop_lastcol_dml_int8 WHERE col3='c';
SELECT * FROM mpp21090_drop_lastcol_dml_int8 ORDER BY 1,2,3,4;
 col1 | col2 | col3 |    col4    
------+------+------+------------
    0 | 0.00 | a    | 2014-01-01
    1 | 1.00 | b    | 2014-01-02
(2 rows)

-- TEST
DROP TABLE IF EXISTS mpp21090_drop_lastcol_dml_interval;
NOTICE:  table "mpp21090_drop_lastcol_dml_interval" does not exist, skipping
CREATE TABLE mpp21090_drop_lastcol_dml_interval(
col1 int,
col2 decimal,
col3 char,
col4 date,
col5 interval
) with (appendonly= true)  DISTRIBUTED by(col3);
INSERT INTO mpp21090_drop_lastcol_dml_interval VALUES(0,0.00,'a','2014-01-01','1 day');
SELECT * FROM mpp21090_drop_lastcol_dml_interval ORDER BY 1,2,3,4;
 col1 | col2 | col3 |    col4    | col5  
------+------+------+------------+-------
    0 | 0.00 | a    | 2014-01-01 | 1 day
(1 row)

ALTER TABLE mpp21090_drop_lastcol_dml_interval DROP COLUMN col5;
INSERT INTO mpp21090_drop_lastcol_dml_interval SELECT 1,1.00,'b','2014-01-02';
SELECT * FROM mpp21090_drop_lastcol_dml_interval ORDER BY 1,2,3,4;
 col1 | col2 | col3 |    col4    
------+------+------+------------
    0 | 0.00 | a    | 2014-01-01
    1 | 1.00 | b    | 2014-01-02
(2 rows)

UPDATE mpp21090_drop_lastcol_dml_interval SET col3='c' WHERE col3 = 'b' AND col1 = 1;
ERROR:  Cannot parallelize an UPDATE statement that updates the distribution columns
SELECT * FROM mpp21090_drop_lastcol_dml_interval ORDER BY 1,2,3,4;
 col1 | col2 | col3 |    col4    
------+------+------+------------
    0 | 0.00 | a    | 2014-01-01
    1 | 1.00 | b    | 2014-01-02
(2 rows)

DELETE FROM mpp21090_drop_lastcol_dml_interval WHERE col3='c';
SELECT * FROM mpp21090_drop_lastcol_dml_interval ORDER BY 1,2,3,4;
 col1 | col2 | col3 |    col4    
------+------+------+------------
    0 | 0.00 | a    | 2014-01-01
    1 | 1.00 | b    | 2014-01-02
(2 rows)

-- TEST
DROP TABLE IF EXISTS mpp21090_drop_lastcol_dml_interval;
CREATE TABLE mpp21090_drop_lastcol_dml_interval(
col1 int,
col2 decimal,
col3 char,
col4 date,
col5 interval
) with (appendonly= true, orientation= column)  DISTRIBUTED by(col3);
INSERT INTO mpp21090_drop_lastcol_dml_interval VALUES(0,0.00,'a','2014-01-01','1 day');
SELECT * FROM mpp21090_drop_lastcol_dml_interval ORDER BY 1,2,3,4;
 col1 | col2 | col3 |    col4    | col5  
------+------+------+------------+-------
    0 | 0.00 | a    | 2014-01-01 | 1 day
(1 row)

ALTER TABLE mpp21090_drop_lastcol_dml_interval DROP COLUMN col5;
INSERT INTO mpp21090_drop_lastcol_dml_interval SELECT 1,1.00,'b','2014-01-02';
SELECT * FROM mpp21090_drop_lastcol_dml_interval ORDER BY 1,2,3,4;
 col1 | col2 | col3 |    col4    
------+------+------+------------
    0 | 0.00 | a    | 2014-01-01
    1 | 1.00 | b    | 2014-01-02
(2 rows)

UPDATE mpp21090_drop_lastcol_dml_interval SET col3='c' WHERE col3 = 'b' AND col1 = 1;
ERROR:  Cannot parallelize an UPDATE statement that updates the distribution columns
SELECT * FROM mpp21090_drop_lastcol_dml_interval ORDER BY 1,2,3,4;
 col1 | col2 | col3 |    col4    
------+------+------+------------
    0 | 0.00 | a    | 2014-01-01
    1 | 1.00 | b    | 2014-01-02
(2 rows)

DELETE FROM mpp21090_drop_lastcol_dml_interval WHERE col3='c';
SELECT * FROM mpp21090_drop_lastcol_dml_interval ORDER BY 1,2,3,4;
 col1 | col2 | col3 |    col4    
------+------+------+------------
    0 | 0.00 | a    | 2014-01-01
    1 | 1.00 | b    | 2014-01-02
(2 rows)

-- TEST
DROP TABLE IF EXISTS mpp21090_drop_lastcol_dml_interval;
CREATE TABLE mpp21090_drop_lastcol_dml_interval(
col1 int,
col2 decimal,
col3 char,
col4 date,
col5 interval
) DISTRIBUTED by(col3);
INSERT INTO mpp21090_drop_lastcol_dml_interval VALUES(0,0.00,'a','2014-01-01','1 day');
SELECT * FROM mpp21090_drop_lastcol_dml_interval ORDER BY 1,2,3,4;
 col1 | col2 | col3 |    col4    | col5  
------+------+------+------------+-------
    0 | 0.00 | a    | 2014-01-01 | 1 day
(1 row)

ALTER TABLE mpp21090_drop_lastcol_dml_interval DROP COLUMN col5;
INSERT INTO mpp21090_drop_lastcol_dml_interval SELECT 1,1.00,'b','2014-01-02';
SELECT * FROM mpp21090_drop_lastcol_dml_interval ORDER BY 1,2,3,4;
 col1 | col2 | col3 |    col4    
------+------+------+------------
    0 | 0.00 | a    | 2014-01-01
    1 | 1.00 | b    | 2014-01-02
(2 rows)

UPDATE mpp21090_drop_lastcol_dml_interval SET col3='c' WHERE col3 = 'b' AND col1 = 1;
ERROR:  Cannot parallelize an UPDATE statement that updates the distribution columns
SELECT * FROM mpp21090_drop_lastcol_dml_interval ORDER BY 1,2,3,4;
 col1 | col2 | col3 |    col4    
------+------+------+------------
    0 | 0.00 | a    | 2014-01-01
    1 | 1.00 | b    | 2014-01-02
(2 rows)

DELETE FROM mpp21090_drop_lastcol_dml_interval WHERE col3='c';
SELECT * FROM mpp21090_drop_lastcol_dml_interval ORDER BY 1,2,3,4;
 col1 | col2 | col3 |    col4    
------+------+------+------------
    0 | 0.00 | a    | 2014-01-01
    1 | 1.00 | b    | 2014-01-02
(2 rows)

-- TEST
DROP TABLE IF EXISTS mpp21090_drop_lastcol_dml_numeric;
NOTICE:  table "mpp21090_drop_lastcol_dml_numeric" does not exist, skipping
CREATE TABLE mpp21090_drop_lastcol_dml_numeric(
col1 int,
col2 decimal,
col3 char,
col4 date,
col5 numeric
) with (appendonly= true)  DISTRIBUTED by(col3);
INSERT INTO mpp21090_drop_lastcol_dml_numeric VALUES(0,0.00,'a','2014-01-01',2.000000);
SELECT * FROM mpp21090_drop_lastcol_dml_numeric ORDER BY 1,2,3,4;
 col1 | col2 | col3 |    col4    |   col5   
------+------+------+------------+----------
    0 | 0.00 | a    | 2014-01-01 | 2.000000
(1 row)

ALTER TABLE mpp21090_drop_lastcol_dml_numeric DROP COLUMN col5;
INSERT INTO mpp21090_drop_lastcol_dml_numeric SELECT 1,1.00,'b','2014-01-02';
SELECT * FROM mpp21090_drop_lastcol_dml_numeric ORDER BY 1,2,3,4;
 col1 | col2 | col3 |    col4    
------+------+------+------------
    0 | 0.00 | a    | 2014-01-01
    1 | 1.00 | b    | 2014-01-02
(2 rows)

UPDATE mpp21090_drop_lastcol_dml_numeric SET col3='c' WHERE col3 = 'b' AND col1 = 1;
ERROR:  Cannot parallelize an UPDATE statement that updates the distribution columns
SELECT * FROM mpp21090_drop_lastcol_dml_numeric ORDER BY 1,2,3,4;
 col1 | col2 | col3 |    col4    
------+------+------+------------
    0 | 0.00 | a    | 2014-01-01
    1 | 1.00 | b    | 2014-01-02
(2 rows)

DELETE FROM mpp21090_drop_lastcol_dml_numeric WHERE col3='c';
SELECT * FROM mpp21090_drop_lastcol_dml_numeric ORDER BY 1,2,3,4;
 col1 | col2 | col3 |    col4    
------+------+------+------------
    0 | 0.00 | a    | 2014-01-01
    1 | 1.00 | b    | 2014-01-02
(2 rows)

-- TEST
DROP TABLE IF EXISTS mpp21090_drop_lastcol_dml_numeric;
CREATE TABLE mpp21090_drop_lastcol_dml_numeric(
col1 int,
col2 decimal,
col3 char,
col4 date,
col5 numeric
) with (appendonly= true, orientation= column)  DISTRIBUTED by(col3);
INSERT INTO mpp21090_drop_lastcol_dml_numeric VALUES(0,0.00,'a','2014-01-01',2.000000);
SELECT * FROM mpp21090_drop_lastcol_dml_numeric ORDER BY 1,2,3,4;
 col1 | col2 | col3 |    col4    |   col5   
------+------+------+------------+----------
    0 | 0.00 | a    | 2014-01-01 | 2.000000
(1 row)

ALTER TABLE mpp21090_drop_lastcol_dml_numeric DROP COLUMN col5;
INSERT INTO mpp21090_drop_lastcol_dml_numeric SELECT 1,1.00,'b','2014-01-02';
SELECT * FROM mpp21090_drop_lastcol_dml_numeric ORDER BY 1,2,3,4;
 col1 | col2 | col3 |    col4    
------+------+------+------------
    0 | 0.00 | a    | 2014-01-01
    1 | 1.00 | b    | 2014-01-02
(2 rows)

UPDATE mpp21090_drop_lastcol_dml_numeric SET col3='c' WHERE col3 = 'b' AND col1 = 1;
ERROR:  Cannot parallelize an UPDATE statement that updates the distribution columns
SELECT * FROM mpp21090_drop_lastcol_dml_numeric ORDER BY 1,2,3,4;
 col1 | col2 | col3 |    col4    
------+------+------+------------
    0 | 0.00 | a    | 2014-01-01
    1 | 1.00 | b    | 2014-01-02
(2 rows)

DELETE FROM mpp21090_drop_lastcol_dml_numeric WHERE col3='c';
SELECT * FROM mpp21090_drop_lastcol_dml_numeric ORDER BY 1,2,3,4;
 col1 | col2 | col3 |    col4    
------+------+------+------------
    0 | 0.00 | a    | 2014-01-01
    1 | 1.00 | b    | 2014-01-02
(2 rows)

-- TEST
DROP TABLE IF EXISTS mpp21090_drop_lastcol_dml_numeric;
CREATE TABLE mpp21090_drop_lastcol_dml_numeric(
col1 int,
col2 decimal,
col3 char,
col4 date,
col5 numeric
) DISTRIBUTED by(col3);
INSERT INTO mpp21090_drop_lastcol_dml_numeric VALUES(0,0.00,'a','2014-01-01',2.000000);
SELECT * FROM mpp21090_drop_lastcol_dml_numeric ORDER BY 1,2,3,4;
 col1 | col2 | col3 |    col4    |   col5   
------+------+------+------------+----------
    0 | 0.00 | a    | 2014-01-01 | 2.000000
(1 row)

ALTER TABLE mpp21090_drop_lastcol_dml_numeric DROP COLUMN col5;
INSERT INTO mpp21090_drop_lastcol_dml_numeric SELECT 1,1.00,'b','2014-01-02';
SELECT * FROM mpp21090_drop_lastcol_dml_numeric ORDER BY 1,2,3,4;
 col1 | col2 | col3 |    col4    
------+------+------+------------
    0 | 0.00 | a    | 2014-01-01
    1 | 1.00 | b    | 2014-01-02
(2 rows)

UPDATE mpp21090_drop_lastcol_dml_numeric SET col3='c' WHERE col3 = 'b' AND col1 = 1;
ERROR:  Cannot parallelize an UPDATE statement that updates the distribution columns
SELECT * FROM mpp21090_drop_lastcol_dml_numeric ORDER BY 1,2,3,4;
 col1 | col2 | col3 |    col4    
------+------+------+------------
    0 | 0.00 | a    | 2014-01-01
    1 | 1.00 | b    | 2014-01-02
(2 rows)

DELETE FROM mpp21090_drop_lastcol_dml_numeric WHERE col3='c';
SELECT * FROM mpp21090_drop_lastcol_dml_numeric ORDER BY 1,2,3,4;
 col1 | col2 | col3 |    col4    
------+------+------+------------
    0 | 0.00 | a    | 2014-01-01
    1 | 1.00 | b    | 2014-01-02
(2 rows)

-- TEST
DROP TABLE IF EXISTS mpp21090_drop_lastcol_dml_text;
NOTICE:  table "mpp21090_drop_lastcol_dml_text" does not exist, skipping
CREATE TABLE mpp21090_drop_lastcol_dml_text(
col1 int,
col2 decimal,
col3 char,
col4 date,
col5 text
) with (appendonly= true)  DISTRIBUTED by(col3);
INSERT INTO mpp21090_drop_lastcol_dml_text VALUES(0,0.00,'a','2014-01-01','abcdefghijklmnop');
SELECT * FROM mpp21090_drop_lastcol_dml_text ORDER BY 1,2,3,4;
 col1 | col2 | col3 |    col4    |       col5       
------+------+------+------------+------------------
    0 | 0.00 | a    | 2014-01-01 | abcdefghijklmnop
(1 row)

ALTER TABLE mpp21090_drop_lastcol_dml_text DROP COLUMN col5;
INSERT INTO mpp21090_drop_lastcol_dml_text SELECT 1,1.00,'b','2014-01-02';
SELECT * FROM mpp21090_drop_lastcol_dml_text ORDER BY 1,2,3,4;
 col1 | col2 | col3 |    col4    
------+------+------+------------
    0 | 0.00 | a    | 2014-01-01
    1 | 1.00 | b    | 2014-01-02
(2 rows)

UPDATE mpp21090_drop_lastcol_dml_text SET col3='c' WHERE col3 = 'b' AND col1 = 1;
ERROR:  Cannot parallelize an UPDATE statement that updates the distribution columns
SELECT * FROM mpp21090_drop_lastcol_dml_text ORDER BY 1,2,3,4;
 col1 | col2 | col3 |    col4    
------+------+------+------------
    0 | 0.00 | a    | 2014-01-01
    1 | 1.00 | b    | 2014-01-02
(2 rows)

DELETE FROM mpp21090_drop_lastcol_dml_text WHERE col3='c';
SELECT * FROM mpp21090_drop_lastcol_dml_text ORDER BY 1,2,3,4;
 col1 | col2 | col3 |    col4    
------+------+------+------------
    0 | 0.00 | a    | 2014-01-01
    1 | 1.00 | b    | 2014-01-02
(2 rows)

-- TEST
DROP TABLE IF EXISTS mpp21090_drop_lastcol_dml_text;
CREATE TABLE mpp21090_drop_lastcol_dml_text(
col1 int,
col2 decimal,
col3 char,
col4 date,
col5 text
) with (appendonly= true, orientation= column)  DISTRIBUTED by(col3);
INSERT INTO mpp21090_drop_lastcol_dml_text VALUES(0,0.00,'a','2014-01-01','abcdefghijklmnop');
SELECT * FROM mpp21090_drop_lastcol_dml_text ORDER BY 1,2,3,4;
 col1 | col2 | col3 |    col4    |       col5       
------+------+------+------------+------------------
    0 | 0.00 | a    | 2014-01-01 | abcdefghijklmnop
(1 row)

ALTER TABLE mpp21090_drop_lastcol_dml_text DROP COLUMN col5;
INSERT INTO mpp21090_drop_lastcol_dml_text SELECT 1,1.00,'b','2014-01-02';
SELECT * FROM mpp21090_drop_lastcol_dml_text ORDER BY 1,2,3,4;
 col1 | col2 | col3 |    col4    
------+------+------+------------
    0 | 0.00 | a    | 2014-01-01
    1 | 1.00 | b    | 2014-01-02
(2 rows)

UPDATE mpp21090_drop_lastcol_dml_text SET col3='c' WHERE col3 = 'b' AND col1 = 1;
ERROR:  Cannot parallelize an UPDATE statement that updates the distribution columns
SELECT * FROM mpp21090_drop_lastcol_dml_text ORDER BY 1,2,3,4;
 col1 | col2 | col3 |    col4    
------+------+------+------------
    0 | 0.00 | a    | 2014-01-01
    1 | 1.00 | b    | 2014-01-02
(2 rows)

DELETE FROM mpp21090_drop_lastcol_dml_text WHERE col3='c';
SELECT * FROM mpp21090_drop_lastcol_dml_text ORDER BY 1,2,3,4;
 col1 | col2 | col3 |    col4    
------+------+------+------------
    0 | 0.00 | a    | 2014-01-01
    1 | 1.00 | b    | 2014-01-02
(2 rows)

-- TEST
DROP TABLE IF EXISTS mpp21090_drop_lastcol_dml_text;
CREATE TABLE mpp21090_drop_lastcol_dml_text(
col1 int,
col2 decimal,
col3 char,
col4 date,
col5 text
) DISTRIBUTED by(col3);
INSERT INTO mpp21090_drop_lastcol_dml_text VALUES(0,0.00,'a','2014-01-01','abcdefghijklmnop');
SELECT * FROM mpp21090_drop_lastcol_dml_text ORDER BY 1,2,3,4;
 col1 | col2 | col3 |    col4    |       col5       
------+------+------+------------+------------------
    0 | 0.00 | a    | 2014-01-01 | abcdefghijklmnop
(1 row)

ALTER TABLE mpp21090_drop_lastcol_dml_text DROP COLUMN col5;
INSERT INTO mpp21090_drop_lastcol_dml_text SELECT 1,1.00,'b','2014-01-02';
SELECT * FROM mpp21090_drop_lastcol_dml_text ORDER BY 1,2,3,4;
 col1 | col2 | col3 |    col4    
------+------+------+------------
    0 | 0.00 | a    | 2014-01-01
    1 | 1.00 | b    | 2014-01-02
(2 rows)

UPDATE mpp21090_drop_lastcol_dml_text SET col3='c' WHERE col3 = 'b' AND col1 = 1;
ERROR:  Cannot parallelize an UPDATE statement that updates the distribution columns
SELECT * FROM mpp21090_drop_lastcol_dml_text ORDER BY 1,2,3,4;
 col1 | col2 | col3 |    col4    
------+------+------+------------
    0 | 0.00 | a    | 2014-01-01
    1 | 1.00 | b    | 2014-01-02
(2 rows)

DELETE FROM mpp21090_drop_lastcol_dml_text WHERE col3='c';
SELECT * FROM mpp21090_drop_lastcol_dml_text ORDER BY 1,2,3,4;
 col1 | col2 | col3 |    col4    
------+------+------+------------
    0 | 0.00 | a    | 2014-01-01
    1 | 1.00 | b    | 2014-01-02
(2 rows)

-- TEST
DROP TABLE IF EXISTS mpp21090_drop_lastcol_index_dml_char;
NOTICE:  table "mpp21090_drop_lastcol_index_dml_char" does not exist, skipping
CREATE TABLE mpp21090_drop_lastcol_index_dml_char(
col1 int,
col2 decimal,
col3 char,
col4 date,
col5 char
) with (appendonly= true)  DISTRIBUTED by(col3);
DROP INDEX IF EXISTS mpp21090_drop_lastcol_index_dml_idx_char;
NOTICE:  index "mpp21090_drop_lastcol_index_dml_idx_char" does not exist, skipping
CREATE INDEX mpp21090_drop_lastcol_index_dml_idx_char on mpp21090_drop_lastcol_index_dml_char(col3);
INSERT INTO mpp21090_drop_lastcol_index_dml_char VALUES(0,0.00,'a','2014-01-01','g');
SELECT * FROM mpp21090_drop_lastcol_index_dml_char ORDER BY 1,2,3,4;
 col1 | col2 | col3 |    col4    | col5 
------+------+------+------------+------
    0 | 0.00 | a    | 2014-01-01 | g
(1 row)

ALTER TABLE mpp21090_drop_lastcol_index_dml_char DROP COLUMN col5;
INSERT INTO mpp21090_drop_lastcol_index_dml_char SELECT 1,1.00,'b','2014-01-02';
SELECT * FROM mpp21090_drop_lastcol_index_dml_char ORDER BY 1,2,3,4;
 col1 | col2 | col3 |    col4    
------+------+------+------------
    0 | 0.00 | a    | 2014-01-01
    1 | 1.00 | b    | 2014-01-02
(2 rows)

UPDATE mpp21090_drop_lastcol_index_dml_char SET col3='c' WHERE col3 = 'b' AND col1 = 1;
ERROR:  Cannot parallelize an UPDATE statement that updates the distribution columns
SELECT * FROM mpp21090_drop_lastcol_index_dml_char ORDER BY 1,2,3,4;
 col1 | col2 | col3 |    col4    
------+------+------+------------
    0 | 0.00 | a    | 2014-01-01
    1 | 1.00 | b    | 2014-01-02
(2 rows)

DELETE FROM mpp21090_drop_lastcol_index_dml_char WHERE col3='c';
SELECT * FROM mpp21090_drop_lastcol_index_dml_char ORDER BY 1,2,3,4;
 col1 | col2 | col3 |    col4    
------+------+------+------------
    0 | 0.00 | a    | 2014-01-01
    1 | 1.00 | b    | 2014-01-02
(2 rows)

-- TEST
DROP TABLE IF EXISTS mpp21090_drop_lastcol_index_dml_char;
CREATE TABLE mpp21090_drop_lastcol_index_dml_char(
col1 int,
col2 decimal,
col3 char,
col4 date,
col5 char
) with (appendonly= true, orientation= column)  DISTRIBUTED by(col3);
DROP INDEX IF EXISTS mpp21090_drop_lastcol_index_dml_idx_char;
NOTICE:  index "mpp21090_drop_lastcol_index_dml_idx_char" does not exist, skipping
CREATE INDEX mpp21090_drop_lastcol_index_dml_idx_char on mpp21090_drop_lastcol_index_dml_char(col3);
INSERT INTO mpp21090_drop_lastcol_index_dml_char VALUES(0,0.00,'a','2014-01-01','g');
SELECT * FROM mpp21090_drop_lastcol_index_dml_char ORDER BY 1,2,3,4;
 col1 | col2 | col3 |    col4    | col5 
------+------+------+------------+------
    0 | 0.00 | a    | 2014-01-01 | g
(1 row)

ALTER TABLE mpp21090_drop_lastcol_index_dml_char DROP COLUMN col5;
INSERT INTO mpp21090_drop_lastcol_index_dml_char SELECT 1,1.00,'b','2014-01-02';
SELECT * FROM mpp21090_drop_lastcol_index_dml_char ORDER BY 1,2,3,4;
 col1 | col2 | col3 |    col4    
------+------+------+------------
    0 | 0.00 | a    | 2014-01-01
    1 | 1.00 | b    | 2014-01-02
(2 rows)

UPDATE mpp21090_drop_lastcol_index_dml_char SET col3='c' WHERE col3 = 'b' AND col1 = 1;
ERROR:  Cannot parallelize an UPDATE statement that updates the distribution columns
SELECT * FROM mpp21090_drop_lastcol_index_dml_char ORDER BY 1,2,3,4;
 col1 | col2 | col3 |    col4    
------+------+------+------------
    0 | 0.00 | a    | 2014-01-01
    1 | 1.00 | b    | 2014-01-02
(2 rows)

DELETE FROM mpp21090_drop_lastcol_index_dml_char WHERE col3='c';
SELECT * FROM mpp21090_drop_lastcol_index_dml_char ORDER BY 1,2,3,4;
 col1 | col2 | col3 |    col4    
------+------+------+------------
    0 | 0.00 | a    | 2014-01-01
    1 | 1.00 | b    | 2014-01-02
(2 rows)

-- TEST
DROP TABLE IF EXISTS mpp21090_drop_lastcol_index_dml_char;
CREATE TABLE mpp21090_drop_lastcol_index_dml_char(
col1 int,
col2 decimal,
col3 char,
col4 date,
col5 char
) DISTRIBUTED by(col3);
DROP INDEX IF EXISTS mpp21090_drop_lastcol_index_dml_idx_char;
NOTICE:  index "mpp21090_drop_lastcol_index_dml_idx_char" does not exist, skipping
CREATE INDEX mpp21090_drop_lastcol_index_dml_idx_char on mpp21090_drop_lastcol_index_dml_char(col3);
INSERT INTO mpp21090_drop_lastcol_index_dml_char VALUES(0,0.00,'a','2014-01-01','g');
SELECT * FROM mpp21090_drop_lastcol_index_dml_char ORDER BY 1,2,3,4;
 col1 | col2 | col3 |    col4    | col5 
------+------+------+------------+------
    0 | 0.00 | a    | 2014-01-01 | g
(1 row)

ALTER TABLE mpp21090_drop_lastcol_index_dml_char DROP COLUMN col5;
INSERT INTO mpp21090_drop_lastcol_index_dml_char SELECT 1,1.00,'b','2014-01-02';
SELECT * FROM mpp21090_drop_lastcol_index_dml_char ORDER BY 1,2,3,4;
 col1 | col2 | col3 |    col4    
------+------+------+------------
    0 | 0.00 | a    | 2014-01-01
    1 | 1.00 | b    | 2014-01-02
(2 rows)

UPDATE mpp21090_drop_lastcol_index_dml_char SET col3='c' WHERE col3 = 'b' AND col1 = 1;
ERROR:  Cannot parallelize an UPDATE statement that updates the distribution columns
SELECT * FROM mpp21090_drop_lastcol_index_dml_char ORDER BY 1,2,3,4;
 col1 | col2 | col3 |    col4    
------+------+------+------------
    0 | 0.00 | a    | 2014-01-01
    1 | 1.00 | b    | 2014-01-02
(2 rows)

DELETE FROM mpp21090_drop_lastcol_index_dml_char WHERE col3='c';
SELECT * FROM mpp21090_drop_lastcol_index_dml_char ORDER BY 1,2,3,4;
 col1 | col2 | col3 |    col4    
------+------+------+------------
    0 | 0.00 | a    | 2014-01-01
    1 | 1.00 | b    | 2014-01-02
(2 rows)

-- TEST
DROP TABLE IF EXISTS mpp21090_drop_lastcol_index_dml_decimal;
NOTICE:  table "mpp21090_drop_lastcol_index_dml_decimal" does not exist, skipping
CREATE TABLE mpp21090_drop_lastcol_index_dml_decimal(
col1 int,
col2 decimal,
col3 char,
col4 date,
col5 decimal
) with (appendonly= true)  DISTRIBUTED by(col3);
DROP INDEX IF EXISTS mpp21090_drop_lastcol_index_dml_idx_decimal;
NOTICE:  index "mpp21090_drop_lastcol_index_dml_idx_decimal" does not exist, skipping
CREATE INDEX mpp21090_drop_lastcol_index_dml_idx_decimal on mpp21090_drop_lastcol_index_dml_decimal(col3);
INSERT INTO mpp21090_drop_lastcol_index_dml_decimal VALUES(0,0.00,'a','2014-01-01',2.00);
SELECT * FROM mpp21090_drop_lastcol_index_dml_decimal ORDER BY 1,2,3,4;
 col1 | col2 | col3 |    col4    | col5 
------+------+------+------------+------
    0 | 0.00 | a    | 2014-01-01 | 2.00
(1 row)

ALTER TABLE mpp21090_drop_lastcol_index_dml_decimal DROP COLUMN col5;
INSERT INTO mpp21090_drop_lastcol_index_dml_decimal SELECT 1,1.00,'b','2014-01-02';
SELECT * FROM mpp21090_drop_lastcol_index_dml_decimal ORDER BY 1,2,3,4;
 col1 | col2 | col3 |    col4    
------+------+------+------------
    0 | 0.00 | a    | 2014-01-01
    1 | 1.00 | b    | 2014-01-02
(2 rows)

UPDATE mpp21090_drop_lastcol_index_dml_decimal SET col3='c' WHERE col3 = 'b' AND col1 = 1;
ERROR:  Cannot parallelize an UPDATE statement that updates the distribution columns
SELECT * FROM mpp21090_drop_lastcol_index_dml_decimal ORDER BY 1,2,3,4;
 col1 | col2 | col3 |    col4    
------+------+------+------------
    0 | 0.00 | a    | 2014-01-01
    1 | 1.00 | b    | 2014-01-02
(2 rows)

DELETE FROM mpp21090_drop_lastcol_index_dml_decimal WHERE col3='c';
SELECT * FROM mpp21090_drop_lastcol_index_dml_decimal ORDER BY 1,2,3,4;
 col1 | col2 | col3 |    col4    
------+------+------+------------
    0 | 0.00 | a    | 2014-01-01
    1 | 1.00 | b    | 2014-01-02
(2 rows)

-- TEST
DROP TABLE IF EXISTS mpp21090_drop_lastcol_index_dml_decimal;
CREATE TABLE mpp21090_drop_lastcol_index_dml_decimal(
col1 int,
col2 decimal,
col3 char,
col4 date,
col5 decimal
) with (appendonly= true, orientation= column)  DISTRIBUTED by(col3);
DROP INDEX IF EXISTS mpp21090_drop_lastcol_index_dml_idx_decimal;
NOTICE:  index "mpp21090_drop_lastcol_index_dml_idx_decimal" does not exist, skipping
CREATE INDEX mpp21090_drop_lastcol_index_dml_idx_decimal on mpp21090_drop_lastcol_index_dml_decimal(col3);
INSERT INTO mpp21090_drop_lastcol_index_dml_decimal VALUES(0,0.00,'a','2014-01-01',2.00);
SELECT * FROM mpp21090_drop_lastcol_index_dml_decimal ORDER BY 1,2,3,4;
 col1 | col2 | col3 |    col4    | col5 
------+------+------+------------+------
    0 | 0.00 | a    | 2014-01-01 | 2.00
(1 row)

ALTER TABLE mpp21090_drop_lastcol_index_dml_decimal DROP COLUMN col5;
INSERT INTO mpp21090_drop_lastcol_index_dml_decimal SELECT 1,1.00,'b','2014-01-02';
SELECT * FROM mpp21090_drop_lastcol_index_dml_decimal ORDER BY 1,2,3,4;
 col1 | col2 | col3 |    col4    
------+------+------+------------
    0 | 0.00 | a    | 2014-01-01
    1 | 1.00 | b    | 2014-01-02
(2 rows)

UPDATE mpp21090_drop_lastcol_index_dml_decimal SET col3='c' WHERE col3 = 'b' AND col1 = 1;
ERROR:  Cannot parallelize an UPDATE statement that updates the distribution columns
SELECT * FROM mpp21090_drop_lastcol_index_dml_decimal ORDER BY 1,2,3,4;
 col1 | col2 | col3 |    col4    
------+------+------+------------
    0 | 0.00 | a    | 2014-01-01
    1 | 1.00 | b    | 2014-01-02
(2 rows)

DELETE FROM mpp21090_drop_lastcol_index_dml_decimal WHERE col3='c';
SELECT * FROM mpp21090_drop_lastcol_index_dml_decimal ORDER BY 1,2,3,4;
 col1 | col2 | col3 |    col4    
------+------+------+------------
    0 | 0.00 | a    | 2014-01-01
    1 | 1.00 | b    | 2014-01-02
(2 rows)

-- TEST
DROP TABLE IF EXISTS mpp21090_drop_lastcol_index_dml_decimal;
CREATE TABLE mpp21090_drop_lastcol_index_dml_decimal(
col1 int,
col2 decimal,
col3 char,
col4 date,
col5 decimal
) DISTRIBUTED by(col3);
DROP INDEX IF EXISTS mpp21090_drop_lastcol_index_dml_idx_decimal;
NOTICE:  index "mpp21090_drop_lastcol_index_dml_idx_decimal" does not exist, skipping
CREATE INDEX mpp21090_drop_lastcol_index_dml_idx_decimal on mpp21090_drop_lastcol_index_dml_decimal(col3);
INSERT INTO mpp21090_drop_lastcol_index_dml_decimal VALUES(0,0.00,'a','2014-01-01',2.00);
SELECT * FROM mpp21090_drop_lastcol_index_dml_decimal ORDER BY 1,2,3,4;
 col1 | col2 | col3 |    col4    | col5 
------+------+------+------------+------
    0 | 0.00 | a    | 2014-01-01 | 2.00
(1 row)

ALTER TABLE mpp21090_drop_lastcol_index_dml_decimal DROP COLUMN col5;
INSERT INTO mpp21090_drop_lastcol_index_dml_decimal SELECT 1,1.00,'b','2014-01-02';
SELECT * FROM mpp21090_drop_lastcol_index_dml_decimal ORDER BY 1,2,3,4;
 col1 | col2 | col3 |    col4    
------+------+------+------------
    0 | 0.00 | a    | 2014-01-01
    1 | 1.00 | b    | 2014-01-02
(2 rows)

UPDATE mpp21090_drop_lastcol_index_dml_decimal SET col3='c' WHERE col3 = 'b' AND col1 = 1;
ERROR:  Cannot parallelize an UPDATE statement that updates the distribution columns
SELECT * FROM mpp21090_drop_lastcol_index_dml_decimal ORDER BY 1,2,3,4;
 col1 | col2 | col3 |    col4    
------+------+------+------------
    0 | 0.00 | a    | 2014-01-01
    1 | 1.00 | b    | 2014-01-02
(2 rows)

DELETE FROM mpp21090_drop_lastcol_index_dml_decimal WHERE col3='c';
SELECT * FROM mpp21090_drop_lastcol_index_dml_decimal ORDER BY 1,2,3,4;
 col1 | col2 | col3 |    col4    
------+------+------+------------
    0 | 0.00 | a    | 2014-01-01
    1 | 1.00 | b    | 2014-01-02
(2 rows)

-- TEST
DROP TABLE IF EXISTS mpp21090_drop_lastcol_index_dml_int4;
NOTICE:  table "mpp21090_drop_lastcol_index_dml_int4" does not exist, skipping
CREATE TABLE mpp21090_drop_lastcol_index_dml_int4(
col1 int,
col2 decimal,
col3 char,
col4 date,
col5 int4
) with (appendonly= true)  DISTRIBUTED by(col3);
DROP INDEX IF EXISTS mpp21090_drop_lastcol_index_dml_idx_int4;
NOTICE:  index "mpp21090_drop_lastcol_index_dml_idx_int4" does not exist, skipping
CREATE INDEX mpp21090_drop_lastcol_index_dml_idx_int4 on mpp21090_drop_lastcol_index_dml_int4(col3);
INSERT INTO mpp21090_drop_lastcol_index_dml_int4 VALUES(0,0.00,'a','2014-01-01',20000000);
SELECT * FROM mpp21090_drop_lastcol_index_dml_int4 ORDER BY 1,2,3,4;
 col1 | col2 | col3 |    col4    |   col5   
------+------+------+------------+----------
    0 | 0.00 | a    | 2014-01-01 | 20000000
(1 row)

ALTER TABLE mpp21090_drop_lastcol_index_dml_int4 DROP COLUMN col5;
INSERT INTO mpp21090_drop_lastcol_index_dml_int4 SELECT 1,1.00,'b','2014-01-02';
SELECT * FROM mpp21090_drop_lastcol_index_dml_int4 ORDER BY 1,2,3,4;
 col1 | col2 | col3 |    col4    
------+------+------+------------
    0 | 0.00 | a    | 2014-01-01
    1 | 1.00 | b    | 2014-01-02
(2 rows)

UPDATE mpp21090_drop_lastcol_index_dml_int4 SET col3='c' WHERE col3 = 'b' AND col1 = 1;
ERROR:  Cannot parallelize an UPDATE statement that updates the distribution columns
SELECT * FROM mpp21090_drop_lastcol_index_dml_int4 ORDER BY 1,2,3,4;
 col1 | col2 | col3 |    col4    
------+------+------+------------
    0 | 0.00 | a    | 2014-01-01
    1 | 1.00 | b    | 2014-01-02
(2 rows)

DELETE FROM mpp21090_drop_lastcol_index_dml_int4 WHERE col3='c';
SELECT * FROM mpp21090_drop_lastcol_index_dml_int4 ORDER BY 1,2,3,4;
 col1 | col2 | col3 |    col4    
------+------+------+------------
    0 | 0.00 | a    | 2014-01-01
    1 | 1.00 | b    | 2014-01-02
(2 rows)

-- TEST
DROP TABLE IF EXISTS mpp21090_drop_lastcol_index_dml_int4;
CREATE TABLE mpp21090_drop_lastcol_index_dml_int4(
col1 int,
col2 decimal,
col3 char,
col4 date,
col5 int4
) with (appendonly= true, orientation= column)  DISTRIBUTED by(col3);
DROP INDEX IF EXISTS mpp21090_drop_lastcol_index_dml_idx_int4;
NOTICE:  index "mpp21090_drop_lastcol_index_dml_idx_int4" does not exist, skipping
CREATE INDEX mpp21090_drop_lastcol_index_dml_idx_int4 on mpp21090_drop_lastcol_index_dml_int4(col3);
INSERT INTO mpp21090_drop_lastcol_index_dml_int4 VALUES(0,0.00,'a','2014-01-01',20000000);
SELECT * FROM mpp21090_drop_lastcol_index_dml_int4 ORDER BY 1,2,3,4;
 col1 | col2 | col3 |    col4    |   col5   
------+------+------+------------+----------
    0 | 0.00 | a    | 2014-01-01 | 20000000
(1 row)

ALTER TABLE mpp21090_drop_lastcol_index_dml_int4 DROP COLUMN col5;
INSERT INTO mpp21090_drop_lastcol_index_dml_int4 SELECT 1,1.00,'b','2014-01-02';
SELECT * FROM mpp21090_drop_lastcol_index_dml_int4 ORDER BY 1,2,3,4;
 col1 | col2 | col3 |    col4    
------+------+------+------------
    0 | 0.00 | a    | 2014-01-01
    1 | 1.00 | b    | 2014-01-02
(2 rows)

UPDATE mpp21090_drop_lastcol_index_dml_int4 SET col3='c' WHERE col3 = 'b' AND col1 = 1;
ERROR:  Cannot parallelize an UPDATE statement that updates the distribution columns
SELECT * FROM mpp21090_drop_lastcol_index_dml_int4 ORDER BY 1,2,3,4;
 col1 | col2 | col3 |    col4    
------+------+------+------------
    0 | 0.00 | a    | 2014-01-01
    1 | 1.00 | b    | 2014-01-02
(2 rows)

DELETE FROM mpp21090_drop_lastcol_index_dml_int4 WHERE col3='c';
SELECT * FROM mpp21090_drop_lastcol_index_dml_int4 ORDER BY 1,2,3,4;
 col1 | col2 | col3 |    col4    
------+------+------+------------
    0 | 0.00 | a    | 2014-01-01
    1 | 1.00 | b    | 2014-01-02
(2 rows)

-- TEST
DROP TABLE IF EXISTS mpp21090_drop_lastcol_index_dml_int4;
CREATE TABLE mpp21090_drop_lastcol_index_dml_int4(
col1 int,
col2 decimal,
col3 char,
col4 date,
col5 int4
) DISTRIBUTED by(col3);
DROP INDEX IF EXISTS mpp21090_drop_lastcol_index_dml_idx_int4;
NOTICE:  index "mpp21090_drop_lastcol_index_dml_idx_int4" does not exist, skipping
CREATE INDEX mpp21090_drop_lastcol_index_dml_idx_int4 on mpp21090_drop_lastcol_index_dml_int4(col3);
INSERT INTO mpp21090_drop_lastcol_index_dml_int4 VALUES(0,0.00,'a','2014-01-01',20000000);
SELECT * FROM mpp21090_drop_lastcol_index_dml_int4 ORDER BY 1,2,3,4;
 col1 | col2 | col3 |    col4    |   col5   
------+------+------+------------+----------
    0 | 0.00 | a    | 2014-01-01 | 20000000
(1 row)

ALTER TABLE mpp21090_drop_lastcol_index_dml_int4 DROP COLUMN col5;
INSERT INTO mpp21090_drop_lastcol_index_dml_int4 SELECT 1,1.00,'b','2014-01-02';
SELECT * FROM mpp21090_drop_lastcol_index_dml_int4 ORDER BY 1,2,3,4;
 col1 | col2 | col3 |    col4    
------+------+------+------------
    0 | 0.00 | a    | 2014-01-01
    1 | 1.00 | b    | 2014-01-02
(2 rows)

UPDATE mpp21090_drop_lastcol_index_dml_int4 SET col3='c' WHERE col3 = 'b' AND col1 = 1;
ERROR:  Cannot parallelize an UPDATE statement that updates the distribution columns
SELECT * FROM mpp21090_drop_lastcol_index_dml_int4 ORDER BY 1,2,3,4;
 col1 | col2 | col3 |    col4    
------+------+------+------------
    0 | 0.00 | a    | 2014-01-01
    1 | 1.00 | b    | 2014-01-02
(2 rows)

DELETE FROM mpp21090_drop_lastcol_index_dml_int4 WHERE col3='c';
SELECT * FROM mpp21090_drop_lastcol_index_dml_int4 ORDER BY 1,2,3,4;
 col1 | col2 | col3 |    col4    
------+------+------+------------
    0 | 0.00 | a    | 2014-01-01
    1 | 1.00 | b    | 2014-01-02
(2 rows)

-- TEST
DROP TABLE IF EXISTS mpp21090_drop_lastcol_index_dml_int8;
NOTICE:  table "mpp21090_drop_lastcol_index_dml_int8" does not exist, skipping
CREATE TABLE mpp21090_drop_lastcol_index_dml_int8(
col1 int,
col2 decimal,
col3 char,
col4 date,
col5 int8
) with (appendonly= true)  DISTRIBUTED by(col3);
DROP INDEX IF EXISTS mpp21090_drop_lastcol_index_dml_idx_int8;
NOTICE:  index "mpp21090_drop_lastcol_index_dml_idx_int8" does not exist, skipping
CREATE INDEX mpp21090_drop_lastcol_index_dml_idx_int8 on mpp21090_drop_lastcol_index_dml_int8(col3);
INSERT INTO mpp21090_drop_lastcol_index_dml_int8 VALUES(0,0.00,'a','2014-01-01',200000000000000000);
SELECT * FROM mpp21090_drop_lastcol_index_dml_int8 ORDER BY 1,2,3,4;
 col1 | col2 | col3 |    col4    |        col5        
------+------+------+------------+--------------------
    0 | 0.00 | a    | 2014-01-01 | 200000000000000000
(1 row)

ALTER TABLE mpp21090_drop_lastcol_index_dml_int8 DROP COLUMN col5;
INSERT INTO mpp21090_drop_lastcol_index_dml_int8 SELECT 1,1.00,'b','2014-01-02';
SELECT * FROM mpp21090_drop_lastcol_index_dml_int8 ORDER BY 1,2,3,4;
 col1 | col2 | col3 |    col4    
------+------+------+------------
    0 | 0.00 | a    | 2014-01-01
    1 | 1.00 | b    | 2014-01-02
(2 rows)

UPDATE mpp21090_drop_lastcol_index_dml_int8 SET col3='c' WHERE col3 = 'b' AND col1 = 1;
ERROR:  Cannot parallelize an UPDATE statement that updates the distribution columns
SELECT * FROM mpp21090_drop_lastcol_index_dml_int8 ORDER BY 1,2,3,4;
 col1 | col2 | col3 |    col4    
------+------+------+------------
    0 | 0.00 | a    | 2014-01-01
    1 | 1.00 | b    | 2014-01-02
(2 rows)

DELETE FROM mpp21090_drop_lastcol_index_dml_int8 WHERE col3='c';
SELECT * FROM mpp21090_drop_lastcol_index_dml_int8 ORDER BY 1,2,3,4;
 col1 | col2 | col3 |    col4    
------+------+------+------------
    0 | 0.00 | a    | 2014-01-01
    1 | 1.00 | b    | 2014-01-02
(2 rows)

-- TEST
DROP TABLE IF EXISTS mpp21090_drop_lastcol_index_dml_int8;
CREATE TABLE mpp21090_drop_lastcol_index_dml_int8(
col1 int,
col2 decimal,
col3 char,
col4 date,
col5 int8
) with (appendonly= true, orientation= column)  DISTRIBUTED by(col3);
DROP INDEX IF EXISTS mpp21090_drop_lastcol_index_dml_idx_int8;
NOTICE:  index "mpp21090_drop_lastcol_index_dml_idx_int8" does not exist, skipping
CREATE INDEX mpp21090_drop_lastcol_index_dml_idx_int8 on mpp21090_drop_lastcol_index_dml_int8(col3);
INSERT INTO mpp21090_drop_lastcol_index_dml_int8 VALUES(0,0.00,'a','2014-01-01',200000000000000000);
SELECT * FROM mpp21090_drop_lastcol_index_dml_int8 ORDER BY 1,2,3,4;
 col1 | col2 | col3 |    col4    |        col5        
------+------+------+------------+--------------------
    0 | 0.00 | a    | 2014-01-01 | 200000000000000000
(1 row)

ALTER TABLE mpp21090_drop_lastcol_index_dml_int8 DROP COLUMN col5;
INSERT INTO mpp21090_drop_lastcol_index_dml_int8 SELECT 1,1.00,'b','2014-01-02';
SELECT * FROM mpp21090_drop_lastcol_index_dml_int8 ORDER BY 1,2,3,4;
 col1 | col2 | col3 |    col4    
------+------+------+------------
    0 | 0.00 | a    | 2014-01-01
    1 | 1.00 | b    | 2014-01-02
(2 rows)

UPDATE mpp21090_drop_lastcol_index_dml_int8 SET col3='c' WHERE col3 = 'b' AND col1 = 1;
ERROR:  Cannot parallelize an UPDATE statement that updates the distribution columns
SELECT * FROM mpp21090_drop_lastcol_index_dml_int8 ORDER BY 1,2,3,4;
 col1 | col2 | col3 |    col4    
------+------+------+------------
    0 | 0.00 | a    | 2014-01-01
    1 | 1.00 | b    | 2014-01-02
(2 rows)

DELETE FROM mpp21090_drop_lastcol_index_dml_int8 WHERE col3='c';
SELECT * FROM mpp21090_drop_lastcol_index_dml_int8 ORDER BY 1,2,3,4;
 col1 | col2 | col3 |    col4    
------+------+------+------------
    0 | 0.00 | a    | 2014-01-01
    1 | 1.00 | b    | 2014-01-02
(2 rows)

-- TEST
DROP TABLE IF EXISTS mpp21090_drop_lastcol_index_dml_int8;
CREATE TABLE mpp21090_drop_lastcol_index_dml_int8(
col1 int,
col2 decimal,
col3 char,
col4 date,
col5 int8
) DISTRIBUTED by(col3);
DROP INDEX IF EXISTS mpp21090_drop_lastcol_index_dml_idx_int8;
NOTICE:  index "mpp21090_drop_lastcol_index_dml_idx_int8" does not exist, skipping
CREATE INDEX mpp21090_drop_lastcol_index_dml_idx_int8 on mpp21090_drop_lastcol_index_dml_int8(col3);
INSERT INTO mpp21090_drop_lastcol_index_dml_int8 VALUES(0,0.00,'a','2014-01-01',200000000000000000);
SELECT * FROM mpp21090_drop_lastcol_index_dml_int8 ORDER BY 1,2,3,4;
 col1 | col2 | col3 |    col4    |        col5        
------+------+------+------------+--------------------
    0 | 0.00 | a    | 2014-01-01 | 200000000000000000
(1 row)

ALTER TABLE mpp21090_drop_lastcol_index_dml_int8 DROP COLUMN col5;
INSERT INTO mpp21090_drop_lastcol_index_dml_int8 SELECT 1,1.00,'b','2014-01-02';
SELECT * FROM mpp21090_drop_lastcol_index_dml_int8 ORDER BY 1,2,3,4;
 col1 | col2 | col3 |    col4    
------+------+------+------------
    0 | 0.00 | a    | 2014-01-01
    1 | 1.00 | b    | 2014-01-02
(2 rows)

UPDATE mpp21090_drop_lastcol_index_dml_int8 SET col3='c' WHERE col3 = 'b' AND col1 = 1;
ERROR:  Cannot parallelize an UPDATE statement that updates the distribution columns
SELECT * FROM mpp21090_drop_lastcol_index_dml_int8 ORDER BY 1,2,3,4;
 col1 | col2 | col3 |    col4    
------+------+------+------------
    0 | 0.00 | a    | 2014-01-01
    1 | 1.00 | b    | 2014-01-02
(2 rows)

DELETE FROM mpp21090_drop_lastcol_index_dml_int8 WHERE col3='c';
SELECT * FROM mpp21090_drop_lastcol_index_dml_int8 ORDER BY 1,2,3,4;
 col1 | col2 | col3 |    col4    
------+------+------+------------
    0 | 0.00 | a    | 2014-01-01
    1 | 1.00 | b    | 2014-01-02
(2 rows)

-- TEST
DROP TABLE IF EXISTS mpp21090_drop_lastcol_index_dml_interval;
NOTICE:  table "mpp21090_drop_lastcol_index_dml_interval" does not exist, skipping
CREATE TABLE mpp21090_drop_lastcol_index_dml_interval(
col1 int,
col2 decimal,
col3 char,
col4 date,
col5 interval
) with (appendonly= true)  DISTRIBUTED by(col3);
DROP INDEX IF EXISTS mpp21090_drop_lastcol_index_dml_idx_interval;
NOTICE:  index "mpp21090_drop_lastcol_index_dml_idx_interval" does not exist, skipping
CREATE INDEX mpp21090_drop_lastcol_index_dml_idx_interval on mpp21090_drop_lastcol_index_dml_interval(col3);
INSERT INTO mpp21090_drop_lastcol_index_dml_interval VALUES(0,0.00,'a','2014-01-01','10 secs');
SELECT * FROM mpp21090_drop_lastcol_index_dml_interval ORDER BY 1,2,3,4;
 col1 | col2 | col3 |    col4    |   col5   
------+------+------+------------+----------
    0 | 0.00 | a    | 2014-01-01 | 00:00:10
(1 row)

ALTER TABLE mpp21090_drop_lastcol_index_dml_interval DROP COLUMN col5;
INSERT INTO mpp21090_drop_lastcol_index_dml_interval SELECT 1,1.00,'b','2014-01-02';
SELECT * FROM mpp21090_drop_lastcol_index_dml_interval ORDER BY 1,2,3,4;
 col1 | col2 | col3 |    col4    
------+------+------+------------
    0 | 0.00 | a    | 2014-01-01
    1 | 1.00 | b    | 2014-01-02
(2 rows)

UPDATE mpp21090_drop_lastcol_index_dml_interval SET col3='c' WHERE col3 = 'b' AND col1 = 1;
ERROR:  Cannot parallelize an UPDATE statement that updates the distribution columns
SELECT * FROM mpp21090_drop_lastcol_index_dml_interval ORDER BY 1,2,3,4;
 col1 | col2 | col3 |    col4    
------+------+------+------------
    0 | 0.00 | a    | 2014-01-01
    1 | 1.00 | b    | 2014-01-02
(2 rows)

DELETE FROM mpp21090_drop_lastcol_index_dml_interval WHERE col3='c';
SELECT * FROM mpp21090_drop_lastcol_index_dml_interval ORDER BY 1,2,3,4;
 col1 | col2 | col3 |    col4    
------+------+------+------------
    0 | 0.00 | a    | 2014-01-01
    1 | 1.00 | b    | 2014-01-02
(2 rows)

-- TEST
DROP TABLE IF EXISTS mpp21090_drop_lastcol_index_dml_interval;
CREATE TABLE mpp21090_drop_lastcol_index_dml_interval(
col1 int,
col2 decimal,
col3 char,
col4 date,
col5 interval
) with (appendonly= true, orientation= column)  DISTRIBUTED by(col3);
DROP INDEX IF EXISTS mpp21090_drop_lastcol_index_dml_idx_interval;
NOTICE:  index "mpp21090_drop_lastcol_index_dml_idx_interval" does not exist, skipping
CREATE INDEX mpp21090_drop_lastcol_index_dml_idx_interval on mpp21090_drop_lastcol_index_dml_interval(col3);
INSERT INTO mpp21090_drop_lastcol_index_dml_interval VALUES(0,0.00,'a','2014-01-01','10 secs');
SELECT * FROM mpp21090_drop_lastcol_index_dml_interval ORDER BY 1,2,3,4;
 col1 | col2 | col3 |    col4    |   col5   
------+------+------+------------+----------
    0 | 0.00 | a    | 2014-01-01 | 00:00:10
(1 row)

ALTER TABLE mpp21090_drop_lastcol_index_dml_interval DROP COLUMN col5;
INSERT INTO mpp21090_drop_lastcol_index_dml_interval SELECT 1,1.00,'b','2014-01-02';
SELECT * FROM mpp21090_drop_lastcol_index_dml_interval ORDER BY 1,2,3,4;
 col1 | col2 | col3 |    col4    
------+------+------+------------
    0 | 0.00 | a    | 2014-01-01
    1 | 1.00 | b    | 2014-01-02
(2 rows)

UPDATE mpp21090_drop_lastcol_index_dml_interval SET col3='c' WHERE col3 = 'b' AND col1 = 1;
ERROR:  Cannot parallelize an UPDATE statement that updates the distribution columns
SELECT * FROM mpp21090_drop_lastcol_index_dml_interval ORDER BY 1,2,3,4;
 col1 | col2 | col3 |    col4    
------+------+------+------------
    0 | 0.00 | a    | 2014-01-01
    1 | 1.00 | b    | 2014-01-02
(2 rows)

DELETE FROM mpp21090_drop_lastcol_index_dml_interval WHERE col3='c';
SELECT * FROM mpp21090_drop_lastcol_index_dml_interval ORDER BY 1,2,3,4;
 col1 | col2 | col3 |    col4    
------+------+------+------------
    0 | 0.00 | a    | 2014-01-01
    1 | 1.00 | b    | 2014-01-02
(2 rows)

-- TEST
DROP TABLE IF EXISTS mpp21090_drop_lastcol_index_dml_interval;
CREATE TABLE mpp21090_drop_lastcol_index_dml_interval(
col1 int,
col2 decimal,
col3 char,
col4 date,
col5 interval
) DISTRIBUTED by(col3);
DROP INDEX IF EXISTS mpp21090_drop_lastcol_index_dml_idx_interval;
NOTICE:  index "mpp21090_drop_lastcol_index_dml_idx_interval" does not exist, skipping
CREATE INDEX mpp21090_drop_lastcol_index_dml_idx_interval on mpp21090_drop_lastcol_index_dml_interval(col3);
INSERT INTO mpp21090_drop_lastcol_index_dml_interval VALUES(0,0.00,'a','2014-01-01','10 secs');
SELECT * FROM mpp21090_drop_lastcol_index_dml_interval ORDER BY 1,2,3,4;
 col1 | col2 | col3 |    col4    |   col5   
------+------+------+------------+----------
    0 | 0.00 | a    | 2014-01-01 | 00:00:10
(1 row)

ALTER TABLE mpp21090_drop_lastcol_index_dml_interval DROP COLUMN col5;
INSERT INTO mpp21090_drop_lastcol_index_dml_interval SELECT 1,1.00,'b','2014-01-02';
SELECT * FROM mpp21090_drop_lastcol_index_dml_interval ORDER BY 1,2,3,4;
 col1 | col2 | col3 |    col4    
------+------+------+------------
    0 | 0.00 | a    | 2014-01-01
    1 | 1.00 | b    | 2014-01-02
(2 rows)

UPDATE mpp21090_drop_lastcol_index_dml_interval SET col3='c' WHERE col3 = 'b' AND col1 = 1;
ERROR:  Cannot parallelize an UPDATE statement that updates the distribution columns
SELECT * FROM mpp21090_drop_lastcol_index_dml_interval ORDER BY 1,2,3,4;
 col1 | col2 | col3 |    col4    
------+------+------+------------
    0 | 0.00 | a    | 2014-01-01
    1 | 1.00 | b    | 2014-01-02
(2 rows)

DELETE FROM mpp21090_drop_lastcol_index_dml_interval WHERE col3='c';
SELECT * FROM mpp21090_drop_lastcol_index_dml_interval ORDER BY 1,2,3,4;
 col1 | col2 | col3 |    col4    
------+------+------+------------
    0 | 0.00 | a    | 2014-01-01
    1 | 1.00 | b    | 2014-01-02
(2 rows)

-- TEST
DROP TABLE IF EXISTS mpp21090_drop_lastcol_index_dml_numeric;
NOTICE:  table "mpp21090_drop_lastcol_index_dml_numeric" does not exist, skipping
CREATE TABLE mpp21090_drop_lastcol_index_dml_numeric(
col1 int,
col2 decimal,
col3 char,
col4 date,
col5 numeric
) with (appendonly= true)  DISTRIBUTED by(col3);
DROP INDEX IF EXISTS mpp21090_drop_lastcol_index_dml_idx_numeric;
NOTICE:  index "mpp21090_drop_lastcol_index_dml_idx_numeric" does not exist, skipping
CREATE INDEX mpp21090_drop_lastcol_index_dml_idx_numeric on mpp21090_drop_lastcol_index_dml_numeric(col3);
INSERT INTO mpp21090_drop_lastcol_index_dml_numeric VALUES(0,0.00,'a','2014-01-01',2.000000);
SELECT * FROM mpp21090_drop_lastcol_index_dml_numeric ORDER BY 1,2,3,4;
 col1 | col2 | col3 |    col4    |   col5   
------+------+------+------------+----------
    0 | 0.00 | a    | 2014-01-01 | 2.000000
(1 row)

ALTER TABLE mpp21090_drop_lastcol_index_dml_numeric DROP COLUMN col5;
INSERT INTO mpp21090_drop_lastcol_index_dml_numeric SELECT 1,1.00,'b','2014-01-02';
SELECT * FROM mpp21090_drop_lastcol_index_dml_numeric ORDER BY 1,2,3,4;
 col1 | col2 | col3 |    col4    
------+------+------+------------
    0 | 0.00 | a    | 2014-01-01
    1 | 1.00 | b    | 2014-01-02
(2 rows)

UPDATE mpp21090_drop_lastcol_index_dml_numeric SET col3='c' WHERE col3 = 'b' AND col1 = 1;
ERROR:  Cannot parallelize an UPDATE statement that updates the distribution columns
SELECT * FROM mpp21090_drop_lastcol_index_dml_numeric ORDER BY 1,2,3,4;
 col1 | col2 | col3 |    col4    
------+------+------+------------
    0 | 0.00 | a    | 2014-01-01
    1 | 1.00 | b    | 2014-01-02
(2 rows)

DELETE FROM mpp21090_drop_lastcol_index_dml_numeric WHERE col3='c';
SELECT * FROM mpp21090_drop_lastcol_index_dml_numeric ORDER BY 1,2,3,4;
 col1 | col2 | col3 |    col4    
------+------+------+------------
    0 | 0.00 | a    | 2014-01-01
    1 | 1.00 | b    | 2014-01-02
(2 rows)

-- TEST
DROP TABLE IF EXISTS mpp21090_drop_lastcol_index_dml_numeric;
CREATE TABLE mpp21090_drop_lastcol_index_dml_numeric(
col1 int,
col2 decimal,
col3 char,
col4 date,
col5 numeric
) with (appendonly= true, orientation= column)  DISTRIBUTED by(col3);
DROP INDEX IF EXISTS mpp21090_drop_lastcol_index_dml_idx_numeric;
NOTICE:  index "mpp21090_drop_lastcol_index_dml_idx_numeric" does not exist, skipping
CREATE INDEX mpp21090_drop_lastcol_index_dml_idx_numeric on mpp21090_drop_lastcol_index_dml_numeric(col3);
INSERT INTO mpp21090_drop_lastcol_index_dml_numeric VALUES(0,0.00,'a','2014-01-01',2.000000);
SELECT * FROM mpp21090_drop_lastcol_index_dml_numeric ORDER BY 1,2,3,4;
 col1 | col2 | col3 |    col4    |   col5   
------+------+------+------------+----------
    0 | 0.00 | a    | 2014-01-01 | 2.000000
(1 row)

ALTER TABLE mpp21090_drop_lastcol_index_dml_numeric DROP COLUMN col5;
INSERT INTO mpp21090_drop_lastcol_index_dml_numeric SELECT 1,1.00,'b','2014-01-02';
SELECT * FROM mpp21090_drop_lastcol_index_dml_numeric ORDER BY 1,2,3,4;
 col1 | col2 | col3 |    col4    
------+------+------+------------
    0 | 0.00 | a    | 2014-01-01
    1 | 1.00 | b    | 2014-01-02
(2 rows)

UPDATE mpp21090_drop_lastcol_index_dml_numeric SET col3='c' WHERE col3 = 'b' AND col1 = 1;
ERROR:  Cannot parallelize an UPDATE statement that updates the distribution columns
SELECT * FROM mpp21090_drop_lastcol_index_dml_numeric ORDER BY 1,2,3,4;
 col1 | col2 | col3 |    col4    
------+------+------+------------
    0 | 0.00 | a    | 2014-01-01
    1 | 1.00 | b    | 2014-01-02
(2 rows)

DELETE FROM mpp21090_drop_lastcol_index_dml_numeric WHERE col3='c';
SELECT * FROM mpp21090_drop_lastcol_index_dml_numeric ORDER BY 1,2,3,4;
 col1 | col2 | col3 |    col4    
------+------+------+------------
    0 | 0.00 | a    | 2014-01-01
    1 | 1.00 | b    | 2014-01-02
(2 rows)

-- TEST
DROP TABLE IF EXISTS mpp21090_drop_lastcol_index_dml_numeric;
CREATE TABLE mpp21090_drop_lastcol_index_dml_numeric(
col1 int,
col2 decimal,
col3 char,
col4 date,
col5 numeric
) DISTRIBUTED by(col3);
DROP INDEX IF EXISTS mpp21090_drop_lastcol_index_dml_idx_numeric;
NOTICE:  index "mpp21090_drop_lastcol_index_dml_idx_numeric" does not exist, skipping
CREATE INDEX mpp21090_drop_lastcol_index_dml_idx_numeric on mpp21090_drop_lastcol_index_dml_numeric(col3);
INSERT INTO mpp21090_drop_lastcol_index_dml_numeric VALUES(0,0.00,'a','2014-01-01',2.000000);
SELECT * FROM mpp21090_drop_lastcol_index_dml_numeric ORDER BY 1,2,3,4;
 col1 | col2 | col3 |    col4    |   col5   
------+------+------+------------+----------
    0 | 0.00 | a    | 2014-01-01 | 2.000000
(1 row)

ALTER TABLE mpp21090_drop_lastcol_index_dml_numeric DROP COLUMN col5;
INSERT INTO mpp21090_drop_lastcol_index_dml_numeric SELECT 1,1.00,'b','2014-01-02';
SELECT * FROM mpp21090_drop_lastcol_index_dml_numeric ORDER BY 1,2,3,4;
 col1 | col2 | col3 |    col4    
------+------+------+------------
    0 | 0.00 | a    | 2014-01-01
    1 | 1.00 | b    | 2014-01-02
(2 rows)

UPDATE mpp21090_drop_lastcol_index_dml_numeric SET col3='c' WHERE col3 = 'b' AND col1 = 1;
ERROR:  Cannot parallelize an UPDATE statement that updates the distribution columns
SELECT * FROM mpp21090_drop_lastcol_index_dml_numeric ORDER BY 1,2,3,4;
 col1 | col2 | col3 |    col4    
------+------+------+------------
    0 | 0.00 | a    | 2014-01-01
    1 | 1.00 | b    | 2014-01-02
(2 rows)

DELETE FROM mpp21090_drop_lastcol_index_dml_numeric WHERE col3='c';
SELECT * FROM mpp21090_drop_lastcol_index_dml_numeric ORDER BY 1,2,3,4;
 col1 | col2 | col3 |    col4    
------+------+------+------------
    0 | 0.00 | a    | 2014-01-01
    1 | 1.00 | b    | 2014-01-02
(2 rows)

-- TEST
DROP TABLE IF EXISTS mpp21090_drop_midcol_dml_boolean;
NOTICE:  table "mpp21090_drop_midcol_dml_boolean" does not exist, skipping
CREATE TABLE mpp21090_drop_midcol_dml_boolean
(
col1 int,
col2 decimal,
col3 boolean,
col4 char,
col5 date
) with (appendonly= true)  DISTRIBUTED by(col4);
INSERT INTO mpp21090_drop_midcol_dml_boolean VALUES(0,0.00,True,'a','2014-01-01');
SELECT * FROM mpp21090_drop_midcol_dml_boolean ORDER BY 1,2,3,4;
 col1 | col2 | col3 | col4 |    col5    
------+------+------+------+------------
    0 | 0.00 | t    | a    | 2014-01-01
(1 row)

ALTER TABLE mpp21090_drop_midcol_dml_boolean DROP COLUMN col3;
INSERT INTO mpp21090_drop_midcol_dml_boolean SELECT 1,1.00,'b','2014-01-02';
SELECT * FROM mpp21090_drop_midcol_dml_boolean ORDER BY 1,2,3,4;
 col1 | col2 | col4 |    col5    
------+------+------+------------
    0 | 0.00 | a    | 2014-01-01
    1 | 1.00 | b    | 2014-01-02
(2 rows)

UPDATE mpp21090_drop_midcol_dml_boolean SET col4='c' WHERE col4 = 'b' AND col1 = 1;
ERROR:  Cannot parallelize an UPDATE statement that updates the distribution columns
SELECT * FROM mpp21090_drop_midcol_dml_boolean ORDER BY 1,2,3,4;
 col1 | col2 | col4 |    col5    
------+------+------+------------
    0 | 0.00 | a    | 2014-01-01
    1 | 1.00 | b    | 2014-01-02
(2 rows)

-- TEST
DROP TABLE IF EXISTS mpp21090_drop_midcol_dml_boolean;
CREATE TABLE mpp21090_drop_midcol_dml_boolean
(
col1 int,
col2 decimal,
col3 boolean,
col4 char,
col5 date
) with (appendonly= true, orientation= column)  DISTRIBUTED by(col4);
INSERT INTO mpp21090_drop_midcol_dml_boolean VALUES(0,0.00,True,'a','2014-01-01');
SELECT * FROM mpp21090_drop_midcol_dml_boolean ORDER BY 1,2,3,4;
 col1 | col2 | col3 | col4 |    col5    
------+------+------+------+------------
    0 | 0.00 | t    | a    | 2014-01-01
(1 row)

ALTER TABLE mpp21090_drop_midcol_dml_boolean DROP COLUMN col3;
INSERT INTO mpp21090_drop_midcol_dml_boolean SELECT 1,1.00,'b','2014-01-02';
SELECT * FROM mpp21090_drop_midcol_dml_boolean ORDER BY 1,2,3,4;
 col1 | col2 | col4 |    col5    
------+------+------+------------
    0 | 0.00 | a    | 2014-01-01
    1 | 1.00 | b    | 2014-01-02
(2 rows)

UPDATE mpp21090_drop_midcol_dml_boolean SET col4='c' WHERE col4 = 'b' AND col1 = 1;
ERROR:  Cannot parallelize an UPDATE statement that updates the distribution columns
SELECT * FROM mpp21090_drop_midcol_dml_boolean ORDER BY 1,2,3,4;
 col1 | col2 | col4 |    col5    
------+------+------+------------
    0 | 0.00 | a    | 2014-01-01
    1 | 1.00 | b    | 2014-01-02
(2 rows)

-- TEST
DROP TABLE IF EXISTS mpp21090_drop_midcol_dml_boolean;
CREATE TABLE mpp21090_drop_midcol_dml_boolean
(
col1 int,
col2 decimal,
col3 boolean,
col4 char,
col5 date
) DISTRIBUTED by(col4);
INSERT INTO mpp21090_drop_midcol_dml_boolean VALUES(0,0.00,True,'a','2014-01-01');
SELECT * FROM mpp21090_drop_midcol_dml_boolean ORDER BY 1,2,3,4;
 col1 | col2 | col3 | col4 |    col5    
------+------+------+------+------------
    0 | 0.00 | t    | a    | 2014-01-01
(1 row)

ALTER TABLE mpp21090_drop_midcol_dml_boolean DROP COLUMN col3;
INSERT INTO mpp21090_drop_midcol_dml_boolean SELECT 1,1.00,'b','2014-01-02';
SELECT * FROM mpp21090_drop_midcol_dml_boolean ORDER BY 1,2,3,4;
 col1 | col2 | col4 |    col5    
------+------+------+------------
    0 | 0.00 | a    | 2014-01-01
    1 | 1.00 | b    | 2014-01-02
(2 rows)

UPDATE mpp21090_drop_midcol_dml_boolean SET col4='c' WHERE col4 = 'b' AND col1 = 1;
ERROR:  Cannot parallelize an UPDATE statement that updates the distribution columns
SELECT * FROM mpp21090_drop_midcol_dml_boolean ORDER BY 1,2,3,4;
 col1 | col2 | col4 |    col5    
------+------+------+------------
    0 | 0.00 | a    | 2014-01-01
    1 | 1.00 | b    | 2014-01-02
(2 rows)

-- TEST
DROP TABLE IF EXISTS mpp21090_drop_midcol_dml_char;
NOTICE:  table "mpp21090_drop_midcol_dml_char" does not exist, skipping
CREATE TABLE mpp21090_drop_midcol_dml_char
(
col1 int,
col2 decimal,
col3 char,
col4 char,
col5 date
) with (appendonly= true)  DISTRIBUTED by(col4);
INSERT INTO mpp21090_drop_midcol_dml_char VALUES(0,0.00,'z','a','2014-01-01');
SELECT * FROM mpp21090_drop_midcol_dml_char ORDER BY 1,2,3,4;
 col1 | col2 | col3 | col4 |    col5    
------+------+------+------+------------
    0 | 0.00 | z    | a    | 2014-01-01
(1 row)

ALTER TABLE mpp21090_drop_midcol_dml_char DROP COLUMN col3;
INSERT INTO mpp21090_drop_midcol_dml_char SELECT 1,1.00,'b','2014-01-02';
SELECT * FROM mpp21090_drop_midcol_dml_char ORDER BY 1,2,3,4;
 col1 | col2 | col4 |    col5    
------+------+------+------------
    0 | 0.00 | a    | 2014-01-01
    1 | 1.00 | b    | 2014-01-02
(2 rows)

UPDATE mpp21090_drop_midcol_dml_char SET col4='c' WHERE col4 = 'b' AND col1 = 1;
ERROR:  Cannot parallelize an UPDATE statement that updates the distribution columns
SELECT * FROM mpp21090_drop_midcol_dml_char ORDER BY 1,2,3,4;
 col1 | col2 | col4 |    col5    
------+------+------+------------
    0 | 0.00 | a    | 2014-01-01
    1 | 1.00 | b    | 2014-01-02
(2 rows)

-- TEST
DROP TABLE IF EXISTS mpp21090_drop_midcol_dml_char;
CREATE TABLE mpp21090_drop_midcol_dml_char
(
col1 int,
col2 decimal,
col3 char,
col4 char,
col5 date
) with (appendonly= true, orientation= column)  DISTRIBUTED by(col4);
INSERT INTO mpp21090_drop_midcol_dml_char VALUES(0,0.00,'z','a','2014-01-01');
SELECT * FROM mpp21090_drop_midcol_dml_char ORDER BY 1,2,3,4;
 col1 | col2 | col3 | col4 |    col5    
------+------+------+------+------------
    0 | 0.00 | z    | a    | 2014-01-01
(1 row)

ALTER TABLE mpp21090_drop_midcol_dml_char DROP COLUMN col3;
INSERT INTO mpp21090_drop_midcol_dml_char SELECT 1,1.00,'b','2014-01-02';
SELECT * FROM mpp21090_drop_midcol_dml_char ORDER BY 1,2,3,4;
 col1 | col2 | col4 |    col5    
------+------+------+------------
    0 | 0.00 | a    | 2014-01-01
    1 | 1.00 | b    | 2014-01-02
(2 rows)

UPDATE mpp21090_drop_midcol_dml_char SET col4='c' WHERE col4 = 'b' AND col1 = 1;
ERROR:  Cannot parallelize an UPDATE statement that updates the distribution columns
SELECT * FROM mpp21090_drop_midcol_dml_char ORDER BY 1,2,3,4;
 col1 | col2 | col4 |    col5    
------+------+------+------------
    0 | 0.00 | a    | 2014-01-01
    1 | 1.00 | b    | 2014-01-02
(2 rows)

-- TEST
DROP TABLE IF EXISTS mpp21090_drop_midcol_dml_char;
CREATE TABLE mpp21090_drop_midcol_dml_char
(
col1 int,
col2 decimal,
col3 char,
col4 char,
col5 date
) DISTRIBUTED by(col4);
INSERT INTO mpp21090_drop_midcol_dml_char VALUES(0,0.00,'z','a','2014-01-01');
SELECT * FROM mpp21090_drop_midcol_dml_char ORDER BY 1,2,3,4;
 col1 | col2 | col3 | col4 |    col5    
------+------+------+------+------------
    0 | 0.00 | z    | a    | 2014-01-01
(1 row)

ALTER TABLE mpp21090_drop_midcol_dml_char DROP COLUMN col3;
INSERT INTO mpp21090_drop_midcol_dml_char SELECT 1,1.00,'b','2014-01-02';
SELECT * FROM mpp21090_drop_midcol_dml_char ORDER BY 1,2,3,4;
 col1 | col2 | col4 |    col5    
------+------+------+------------
    0 | 0.00 | a    | 2014-01-01
    1 | 1.00 | b    | 2014-01-02
(2 rows)

UPDATE mpp21090_drop_midcol_dml_char SET col4='c' WHERE col4 = 'b' AND col1 = 1;
ERROR:  Cannot parallelize an UPDATE statement that updates the distribution columns
SELECT * FROM mpp21090_drop_midcol_dml_char ORDER BY 1,2,3,4;
 col1 | col2 | col4 |    col5    
------+------+------+------------
    0 | 0.00 | a    | 2014-01-01
    1 | 1.00 | b    | 2014-01-02
(2 rows)

-- TEST
DROP TABLE IF EXISTS mpp21090_drop_midcol_dml_decimal;
NOTICE:  table "mpp21090_drop_midcol_dml_decimal" does not exist, skipping
CREATE TABLE mpp21090_drop_midcol_dml_decimal
(
col1 int,
col2 decimal,
col3 decimal,
col4 char,
col5 date
) with (appendonly= true)  DISTRIBUTED by(col4);
INSERT INTO mpp21090_drop_midcol_dml_decimal VALUES(0,0.00,2.00,'a','2014-01-01');
SELECT * FROM mpp21090_drop_midcol_dml_decimal ORDER BY 1,2,3,4;
 col1 | col2 | col3 | col4 |    col5    
------+------+------+------+------------
    0 | 0.00 | 2.00 | a    | 2014-01-01
(1 row)

ALTER TABLE mpp21090_drop_midcol_dml_decimal DROP COLUMN col3;
INSERT INTO mpp21090_drop_midcol_dml_decimal SELECT 1,1.00,'b','2014-01-02';
SELECT * FROM mpp21090_drop_midcol_dml_decimal ORDER BY 1,2,3,4;
 col1 | col2 | col4 |    col5    
------+------+------+------------
    0 | 0.00 | a    | 2014-01-01
    1 | 1.00 | b    | 2014-01-02
(2 rows)

UPDATE mpp21090_drop_midcol_dml_decimal SET col4='c' WHERE col4 = 'b' AND col1 = 1;
ERROR:  Cannot parallelize an UPDATE statement that updates the distribution columns
SELECT * FROM mpp21090_drop_midcol_dml_decimal ORDER BY 1,2,3,4;
 col1 | col2 | col4 |    col5    
------+------+------+------------
    0 | 0.00 | a    | 2014-01-01
    1 | 1.00 | b    | 2014-01-02
(2 rows)

-- TEST
DROP TABLE IF EXISTS mpp21090_drop_midcol_dml_decimal;
CREATE TABLE mpp21090_drop_midcol_dml_decimal
(
col1 int,
col2 decimal,
col3 decimal,
col4 char,
col5 date
) with (appendonly= true, orientation= column)  DISTRIBUTED by(col4);
INSERT INTO mpp21090_drop_midcol_dml_decimal VALUES(0,0.00,2.00,'a','2014-01-01');
SELECT * FROM mpp21090_drop_midcol_dml_decimal ORDER BY 1,2,3,4;
 col1 | col2 | col3 | col4 |    col5    
------+------+------+------+------------
    0 | 0.00 | 2.00 | a    | 2014-01-01
(1 row)

ALTER TABLE mpp21090_drop_midcol_dml_decimal DROP COLUMN col3;
INSERT INTO mpp21090_drop_midcol_dml_decimal SELECT 1,1.00,'b','2014-01-02';
SELECT * FROM mpp21090_drop_midcol_dml_decimal ORDER BY 1,2,3,4;
 col1 | col2 | col4 |    col5    
------+------+------+------------
    0 | 0.00 | a    | 2014-01-01
    1 | 1.00 | b    | 2014-01-02
(2 rows)

UPDATE mpp21090_drop_midcol_dml_decimal SET col4='c' WHERE col4 = 'b' AND col1 = 1;
ERROR:  Cannot parallelize an UPDATE statement that updates the distribution columns
SELECT * FROM mpp21090_drop_midcol_dml_decimal ORDER BY 1,2,3,4;
 col1 | col2 | col4 |    col5    
------+------+------+------------
    0 | 0.00 | a    | 2014-01-01
    1 | 1.00 | b    | 2014-01-02
(2 rows)

-- TEST
DROP TABLE IF EXISTS mpp21090_drop_midcol_dml_decimal;
CREATE TABLE mpp21090_drop_midcol_dml_decimal
(
col1 int,
col2 decimal,
col3 decimal,
col4 char,
col5 date
) DISTRIBUTED by(col4);
INSERT INTO mpp21090_drop_midcol_dml_decimal VALUES(0,0.00,2.00,'a','2014-01-01');
SELECT * FROM mpp21090_drop_midcol_dml_decimal ORDER BY 1,2,3,4;
 col1 | col2 | col3 | col4 |    col5    
------+------+------+------+------------
    0 | 0.00 | 2.00 | a    | 2014-01-01
(1 row)

ALTER TABLE mpp21090_drop_midcol_dml_decimal DROP COLUMN col3;
INSERT INTO mpp21090_drop_midcol_dml_decimal SELECT 1,1.00,'b','2014-01-02';
SELECT * FROM mpp21090_drop_midcol_dml_decimal ORDER BY 1,2,3,4;
 col1 | col2 | col4 |    col5    
------+------+------+------------
    0 | 0.00 | a    | 2014-01-01
    1 | 1.00 | b    | 2014-01-02
(2 rows)

UPDATE mpp21090_drop_midcol_dml_decimal SET col4='c' WHERE col4 = 'b' AND col1 = 1;
ERROR:  Cannot parallelize an UPDATE statement that updates the distribution columns
SELECT * FROM mpp21090_drop_midcol_dml_decimal ORDER BY 1,2,3,4;
 col1 | col2 | col4 |    col5    
------+------+------+------------
    0 | 0.00 | a    | 2014-01-01
    1 | 1.00 | b    | 2014-01-02
(2 rows)

-- TEST
DROP TABLE IF EXISTS mpp21090_drop_midcol_dml_int4;
NOTICE:  table "mpp21090_drop_midcol_dml_int4" does not exist, skipping
CREATE TABLE mpp21090_drop_midcol_dml_int4
(
col1 int,
col2 decimal,
col3 int4,
col4 char,
col5 date
) with (appendonly= true)  DISTRIBUTED by(col4);
INSERT INTO mpp21090_drop_midcol_dml_int4 VALUES(0,0.00,2000000000,'a','2014-01-01');
SELECT * FROM mpp21090_drop_midcol_dml_int4 ORDER BY 1,2,3,4;
 col1 | col2 |    col3    | col4 |    col5    
------+------+------------+------+------------
    0 | 0.00 | 2000000000 | a    | 2014-01-01
(1 row)

ALTER TABLE mpp21090_drop_midcol_dml_int4 DROP COLUMN col3;
INSERT INTO mpp21090_drop_midcol_dml_int4 SELECT 1,1.00,'b','2014-01-02';
SELECT * FROM mpp21090_drop_midcol_dml_int4 ORDER BY 1,2,3,4;
 col1 | col2 | col4 |    col5    
------+------+------+------------
    0 | 0.00 | a    | 2014-01-01
    1 | 1.00 | b    | 2014-01-02
(2 rows)

UPDATE mpp21090_drop_midcol_dml_int4 SET col4='c' WHERE col4 = 'b' AND col1 = 1;
ERROR:  Cannot parallelize an UPDATE statement that updates the distribution columns
SELECT * FROM mpp21090_drop_midcol_dml_int4 ORDER BY 1,2,3,4;
 col1 | col2 | col4 |    col5    
------+------+------+------------
    0 | 0.00 | a    | 2014-01-01
    1 | 1.00 | b    | 2014-01-02
(2 rows)

-- TEST
DROP TABLE IF EXISTS mpp21090_drop_midcol_dml_int4;
CREATE TABLE mpp21090_drop_midcol_dml_int4
(
col1 int,
col2 decimal,
col3 int4,
col4 char,
col5 date
) with (appendonly= true, orientation= column)  DISTRIBUTED by(col4);
INSERT INTO mpp21090_drop_midcol_dml_int4 VALUES(0,0.00,2000000000,'a','2014-01-01');
SELECT * FROM mpp21090_drop_midcol_dml_int4 ORDER BY 1,2,3,4;
 col1 | col2 |    col3    | col4 |    col5    
------+------+------------+------+------------
    0 | 0.00 | 2000000000 | a    | 2014-01-01
(1 row)

ALTER TABLE mpp21090_drop_midcol_dml_int4 DROP COLUMN col3;
INSERT INTO mpp21090_drop_midcol_dml_int4 SELECT 1,1.00,'b','2014-01-02';
SELECT * FROM mpp21090_drop_midcol_dml_int4 ORDER BY 1,2,3,4;
 col1 | col2 | col4 |    col5    
------+------+------+------------
    0 | 0.00 | a    | 2014-01-01
    1 | 1.00 | b    | 2014-01-02
(2 rows)

UPDATE mpp21090_drop_midcol_dml_int4 SET col4='c' WHERE col4 = 'b' AND col1 = 1;
ERROR:  Cannot parallelize an UPDATE statement that updates the distribution columns
SELECT * FROM mpp21090_drop_midcol_dml_int4 ORDER BY 1,2,3,4;
 col1 | col2 | col4 |    col5    
------+------+------+------------
    0 | 0.00 | a    | 2014-01-01
    1 | 1.00 | b    | 2014-01-02
(2 rows)

-- TEST
DROP TABLE IF EXISTS mpp21090_drop_midcol_dml_int4;
CREATE TABLE mpp21090_drop_midcol_dml_int4
(
col1 int,
col2 decimal,
col3 int4,
col4 char,
col5 date
) DISTRIBUTED by(col4);
INSERT INTO mpp21090_drop_midcol_dml_int4 VALUES(0,0.00,2000000000,'a','2014-01-01');
SELECT * FROM mpp21090_drop_midcol_dml_int4 ORDER BY 1,2,3,4;
 col1 | col2 |    col3    | col4 |    col5    
------+------+------------+------+------------
    0 | 0.00 | 2000000000 | a    | 2014-01-01
(1 row)

ALTER TABLE mpp21090_drop_midcol_dml_int4 DROP COLUMN col3;
INSERT INTO mpp21090_drop_midcol_dml_int4 SELECT 1,1.00,'b','2014-01-02';
SELECT * FROM mpp21090_drop_midcol_dml_int4 ORDER BY 1,2,3,4;
 col1 | col2 | col4 |    col5    
------+------+------+------------
    0 | 0.00 | a    | 2014-01-01
    1 | 1.00 | b    | 2014-01-02
(2 rows)

UPDATE mpp21090_drop_midcol_dml_int4 SET col4='c' WHERE col4 = 'b' AND col1 = 1;
ERROR:  Cannot parallelize an UPDATE statement that updates the distribution columns
SELECT * FROM mpp21090_drop_midcol_dml_int4 ORDER BY 1,2,3,4;
 col1 | col2 | col4 |    col5    
------+------+------+------------
    0 | 0.00 | a    | 2014-01-01
    1 | 1.00 | b    | 2014-01-02
(2 rows)

-- TEST
DROP TABLE IF EXISTS mpp21090_drop_midcol_dml_int8;
NOTICE:  table "mpp21090_drop_midcol_dml_int8" does not exist, skipping
CREATE TABLE mpp21090_drop_midcol_dml_int8
(
col1 int,
col2 decimal,
col3 int8,
col4 char,
col5 date
) with (appendonly= true)  DISTRIBUTED by(col4);
INSERT INTO mpp21090_drop_midcol_dml_int8 VALUES(0,0.00,2000000000000000000,'a','2014-01-01');
SELECT * FROM mpp21090_drop_midcol_dml_int8 ORDER BY 1,2,3,4;
 col1 | col2 |        col3         | col4 |    col5    
------+------+---------------------+------+------------
    0 | 0.00 | 2000000000000000000 | a    | 2014-01-01
(1 row)

ALTER TABLE mpp21090_drop_midcol_dml_int8 DROP COLUMN col3;
INSERT INTO mpp21090_drop_midcol_dml_int8 SELECT 1,1.00,'b','2014-01-02';
SELECT * FROM mpp21090_drop_midcol_dml_int8 ORDER BY 1,2,3,4;
 col1 | col2 | col4 |    col5    
------+------+------+------------
    0 | 0.00 | a    | 2014-01-01
    1 | 1.00 | b    | 2014-01-02
(2 rows)

UPDATE mpp21090_drop_midcol_dml_int8 SET col4='c' WHERE col4 = 'b' AND col1 = 1;
ERROR:  Cannot parallelize an UPDATE statement that updates the distribution columns
SELECT * FROM mpp21090_drop_midcol_dml_int8 ORDER BY 1,2,3,4;
 col1 | col2 | col4 |    col5    
------+------+------+------------
    0 | 0.00 | a    | 2014-01-01
    1 | 1.00 | b    | 2014-01-02
(2 rows)

-- TEST
DROP TABLE IF EXISTS mpp21090_drop_midcol_dml_int8;
CREATE TABLE mpp21090_drop_midcol_dml_int8
(
col1 int,
col2 decimal,
col3 int8,
col4 char,
col5 date
) with (appendonly= true, orientation= column)  DISTRIBUTED by(col4);
INSERT INTO mpp21090_drop_midcol_dml_int8 VALUES(0,0.00,2000000000000000000,'a','2014-01-01');
SELECT * FROM mpp21090_drop_midcol_dml_int8 ORDER BY 1,2,3,4;
 col1 | col2 |        col3         | col4 |    col5    
------+------+---------------------+------+------------
    0 | 0.00 | 2000000000000000000 | a    | 2014-01-01
(1 row)

ALTER TABLE mpp21090_drop_midcol_dml_int8 DROP COLUMN col3;
INSERT INTO mpp21090_drop_midcol_dml_int8 SELECT 1,1.00,'b','2014-01-02';
SELECT * FROM mpp21090_drop_midcol_dml_int8 ORDER BY 1,2,3,4;
 col1 | col2 | col4 |    col5    
------+------+------+------------
    0 | 0.00 | a    | 2014-01-01
    1 | 1.00 | b    | 2014-01-02
(2 rows)

UPDATE mpp21090_drop_midcol_dml_int8 SET col4='c' WHERE col4 = 'b' AND col1 = 1;
ERROR:  Cannot parallelize an UPDATE statement that updates the distribution columns
SELECT * FROM mpp21090_drop_midcol_dml_int8 ORDER BY 1,2,3,4;
 col1 | col2 | col4 |    col5    
------+------+------+------------
    0 | 0.00 | a    | 2014-01-01
    1 | 1.00 | b    | 2014-01-02
(2 rows)

-- TEST
DROP TABLE IF EXISTS mpp21090_drop_midcol_dml_int8;
CREATE TABLE mpp21090_drop_midcol_dml_int8
(
col1 int,
col2 decimal,
col3 int8,
col4 char,
col5 date
) DISTRIBUTED by(col4);
INSERT INTO mpp21090_drop_midcol_dml_int8 VALUES(0,0.00,2000000000000000000,'a','2014-01-01');
SELECT * FROM mpp21090_drop_midcol_dml_int8 ORDER BY 1,2,3,4;
 col1 | col2 |        col3         | col4 |    col5    
------+------+---------------------+------+------------
    0 | 0.00 | 2000000000000000000 | a    | 2014-01-01
(1 row)

ALTER TABLE mpp21090_drop_midcol_dml_int8 DROP COLUMN col3;
INSERT INTO mpp21090_drop_midcol_dml_int8 SELECT 1,1.00,'b','2014-01-02';
SELECT * FROM mpp21090_drop_midcol_dml_int8 ORDER BY 1,2,3,4;
 col1 | col2 | col4 |    col5    
------+------+------+------------
    0 | 0.00 | a    | 2014-01-01
    1 | 1.00 | b    | 2014-01-02
(2 rows)

UPDATE mpp21090_drop_midcol_dml_int8 SET col4='c' WHERE col4 = 'b' AND col1 = 1;
ERROR:  Cannot parallelize an UPDATE statement that updates the distribution columns
SELECT * FROM mpp21090_drop_midcol_dml_int8 ORDER BY 1,2,3,4;
 col1 | col2 | col4 |    col5    
------+------+------+------------
    0 | 0.00 | a    | 2014-01-01
    1 | 1.00 | b    | 2014-01-02
(2 rows)

-- TEST
DROP TABLE IF EXISTS mpp21090_drop_midcol_dml_interval;
NOTICE:  table "mpp21090_drop_midcol_dml_interval" does not exist, skipping
CREATE TABLE mpp21090_drop_midcol_dml_interval
(
col1 int,
col2 decimal,
col3 interval,
col4 char,
col5 date
) with (appendonly= true)  DISTRIBUTED by(col4);
INSERT INTO mpp21090_drop_midcol_dml_interval VALUES(0,0.00,'1 day','a','2014-01-01');
SELECT * FROM mpp21090_drop_midcol_dml_interval ORDER BY 1,2,3,4;
 col1 | col2 | col3  | col4 |    col5    
------+------+-------+------+------------
    0 | 0.00 | 1 day | a    | 2014-01-01
(1 row)

ALTER TABLE mpp21090_drop_midcol_dml_interval DROP COLUMN col3;
INSERT INTO mpp21090_drop_midcol_dml_interval SELECT 1,1.00,'b','2014-01-02';
SELECT * FROM mpp21090_drop_midcol_dml_interval ORDER BY 1,2,3,4;
 col1 | col2 | col4 |    col5    
------+------+------+------------
    0 | 0.00 | a    | 2014-01-01
    1 | 1.00 | b    | 2014-01-02
(2 rows)

UPDATE mpp21090_drop_midcol_dml_interval SET col4='c' WHERE col4 = 'b' AND col1 = 1;
ERROR:  Cannot parallelize an UPDATE statement that updates the distribution columns
SELECT * FROM mpp21090_drop_midcol_dml_interval ORDER BY 1,2,3,4;
 col1 | col2 | col4 |    col5    
------+------+------+------------
    0 | 0.00 | a    | 2014-01-01
    1 | 1.00 | b    | 2014-01-02
(2 rows)

-- TEST
DROP TABLE IF EXISTS mpp21090_drop_midcol_dml_interval;
CREATE TABLE mpp21090_drop_midcol_dml_interval
(
col1 int,
col2 decimal,
col3 interval,
col4 char,
col5 date
) with (appendonly= true, orientation= column)  DISTRIBUTED by(col4);
INSERT INTO mpp21090_drop_midcol_dml_interval VALUES(0,0.00,'1 day','a','2014-01-01');
SELECT * FROM mpp21090_drop_midcol_dml_interval ORDER BY 1,2,3,4;
 col1 | col2 | col3  | col4 |    col5    
------+------+-------+------+------------
    0 | 0.00 | 1 day | a    | 2014-01-01
(1 row)

ALTER TABLE mpp21090_drop_midcol_dml_interval DROP COLUMN col3;
INSERT INTO mpp21090_drop_midcol_dml_interval SELECT 1,1.00,'b','2014-01-02';
SELECT * FROM mpp21090_drop_midcol_dml_interval ORDER BY 1,2,3,4;
 col1 | col2 | col4 |    col5    
------+------+------+------------
    0 | 0.00 | a    | 2014-01-01
    1 | 1.00 | b    | 2014-01-02
(2 rows)

UPDATE mpp21090_drop_midcol_dml_interval SET col4='c' WHERE col4 = 'b' AND col1 = 1;
ERROR:  Cannot parallelize an UPDATE statement that updates the distribution columns
SELECT * FROM mpp21090_drop_midcol_dml_interval ORDER BY 1,2,3,4;
 col1 | col2 | col4 |    col5    
------+------+------+------------
    0 | 0.00 | a    | 2014-01-01
    1 | 1.00 | b    | 2014-01-02
(2 rows)

-- TEST
DROP TABLE IF EXISTS mpp21090_drop_midcol_dml_interval;
CREATE TABLE mpp21090_drop_midcol_dml_interval
(
col1 int,
col2 decimal,
col3 interval,
col4 char,
col5 date
) DISTRIBUTED by(col4);
INSERT INTO mpp21090_drop_midcol_dml_interval VALUES(0,0.00,'1 day','a','2014-01-01');
SELECT * FROM mpp21090_drop_midcol_dml_interval ORDER BY 1,2,3,4;
 col1 | col2 | col3  | col4 |    col5    
------+------+-------+------+------------
    0 | 0.00 | 1 day | a    | 2014-01-01
(1 row)

ALTER TABLE mpp21090_drop_midcol_dml_interval DROP COLUMN col3;
INSERT INTO mpp21090_drop_midcol_dml_interval SELECT 1,1.00,'b','2014-01-02';
SELECT * FROM mpp21090_drop_midcol_dml_interval ORDER BY 1,2,3,4;
 col1 | col2 | col4 |    col5    
------+------+------+------------
    0 | 0.00 | a    | 2014-01-01
    1 | 1.00 | b    | 2014-01-02
(2 rows)

UPDATE mpp21090_drop_midcol_dml_interval SET col4='c' WHERE col4 = 'b' AND col1 = 1;
ERROR:  Cannot parallelize an UPDATE statement that updates the distribution columns
SELECT * FROM mpp21090_drop_midcol_dml_interval ORDER BY 1,2,3,4;
 col1 | col2 | col4 |    col5    
------+------+------+------------
    0 | 0.00 | a    | 2014-01-01
    1 | 1.00 | b    | 2014-01-02
(2 rows)

-- TEST
DROP TABLE IF EXISTS mpp21090_drop_midcol_dml_numeric;
NOTICE:  table "mpp21090_drop_midcol_dml_numeric" does not exist, skipping
CREATE TABLE mpp21090_drop_midcol_dml_numeric
(
col1 int,
col2 decimal,
col3 numeric,
col4 char,
col5 date
) with (appendonly= true)  DISTRIBUTED by(col4);
INSERT INTO mpp21090_drop_midcol_dml_numeric VALUES(0,0.00,2.000000,'a','2014-01-01');
SELECT * FROM mpp21090_drop_midcol_dml_numeric ORDER BY 1,2,3,4;
 col1 | col2 |   col3   | col4 |    col5    
------+------+----------+------+------------
    0 | 0.00 | 2.000000 | a    | 2014-01-01
(1 row)

ALTER TABLE mpp21090_drop_midcol_dml_numeric DROP COLUMN col3;
INSERT INTO mpp21090_drop_midcol_dml_numeric SELECT 1,1.00,'b','2014-01-02';
SELECT * FROM mpp21090_drop_midcol_dml_numeric ORDER BY 1,2,3,4;
 col1 | col2 | col4 |    col5    
------+------+------+------------
    0 | 0.00 | a    | 2014-01-01
    1 | 1.00 | b    | 2014-01-02
(2 rows)

UPDATE mpp21090_drop_midcol_dml_numeric SET col4='c' WHERE col4 = 'b' AND col1 = 1;
ERROR:  Cannot parallelize an UPDATE statement that updates the distribution columns
SELECT * FROM mpp21090_drop_midcol_dml_numeric ORDER BY 1,2,3,4;
 col1 | col2 | col4 |    col5    
------+------+------+------------
    0 | 0.00 | a    | 2014-01-01
    1 | 1.00 | b    | 2014-01-02
(2 rows)

-- TEST
DROP TABLE IF EXISTS mpp21090_drop_midcol_dml_numeric;
CREATE TABLE mpp21090_drop_midcol_dml_numeric
(
col1 int,
col2 decimal,
col3 numeric,
col4 char,
col5 date
) with (appendonly= true, orientation= column)  DISTRIBUTED by(col4);
INSERT INTO mpp21090_drop_midcol_dml_numeric VALUES(0,0.00,2.000000,'a','2014-01-01');
SELECT * FROM mpp21090_drop_midcol_dml_numeric ORDER BY 1,2,3,4;
 col1 | col2 |   col3   | col4 |    col5    
------+------+----------+------+------------
    0 | 0.00 | 2.000000 | a    | 2014-01-01
(1 row)

ALTER TABLE mpp21090_drop_midcol_dml_numeric DROP COLUMN col3;
INSERT INTO mpp21090_drop_midcol_dml_numeric SELECT 1,1.00,'b','2014-01-02';
SELECT * FROM mpp21090_drop_midcol_dml_numeric ORDER BY 1,2,3,4;
 col1 | col2 | col4 |    col5    
------+------+------+------------
    0 | 0.00 | a    | 2014-01-01
    1 | 1.00 | b    | 2014-01-02
(2 rows)

UPDATE mpp21090_drop_midcol_dml_numeric SET col4='c' WHERE col4 = 'b' AND col1 = 1;
ERROR:  Cannot parallelize an UPDATE statement that updates the distribution columns
SELECT * FROM mpp21090_drop_midcol_dml_numeric ORDER BY 1,2,3,4;
 col1 | col2 | col4 |    col5    
------+------+------+------------
    0 | 0.00 | a    | 2014-01-01
    1 | 1.00 | b    | 2014-01-02
(2 rows)

-- TEST
DROP TABLE IF EXISTS mpp21090_drop_midcol_dml_numeric;
CREATE TABLE mpp21090_drop_midcol_dml_numeric
(
col1 int,
col2 decimal,
col3 numeric,
col4 char,
col5 date
) DISTRIBUTED by(col4);
INSERT INTO mpp21090_drop_midcol_dml_numeric VALUES(0,0.00,2.000000,'a','2014-01-01');
SELECT * FROM mpp21090_drop_midcol_dml_numeric ORDER BY 1,2,3,4;
 col1 | col2 |   col3   | col4 |    col5    
------+------+----------+------+------------
    0 | 0.00 | 2.000000 | a    | 2014-01-01
(1 row)

ALTER TABLE mpp21090_drop_midcol_dml_numeric DROP COLUMN col3;
INSERT INTO mpp21090_drop_midcol_dml_numeric SELECT 1,1.00,'b','2014-01-02';
SELECT * FROM mpp21090_drop_midcol_dml_numeric ORDER BY 1,2,3,4;
 col1 | col2 | col4 |    col5    
------+------+------+------------
    0 | 0.00 | a    | 2014-01-01
    1 | 1.00 | b    | 2014-01-02
(2 rows)

UPDATE mpp21090_drop_midcol_dml_numeric SET col4='c' WHERE col4 = 'b' AND col1 = 1;
ERROR:  Cannot parallelize an UPDATE statement that updates the distribution columns
SELECT * FROM mpp21090_drop_midcol_dml_numeric ORDER BY 1,2,3,4;
 col1 | col2 | col4 |    col5    
------+------+------+------------
    0 | 0.00 | a    | 2014-01-01
    1 | 1.00 | b    | 2014-01-02
(2 rows)

-- TEST
DROP TABLE IF EXISTS mpp21090_drop_midcol_dml_text;
NOTICE:  table "mpp21090_drop_midcol_dml_text" does not exist, skipping
CREATE TABLE mpp21090_drop_midcol_dml_text
(
col1 int,
col2 decimal,
col3 text,
col4 char,
col5 date
) with (appendonly= true)  DISTRIBUTED by(col4);
INSERT INTO mpp21090_drop_midcol_dml_text VALUES(0,0.00,'abcdefghijklmnop','a','2014-01-01');
SELECT * FROM mpp21090_drop_midcol_dml_text ORDER BY 1,2,3,4;
 col1 | col2 |       col3       | col4 |    col5    
------+------+------------------+------+------------
    0 | 0.00 | abcdefghijklmnop | a    | 2014-01-01
(1 row)

ALTER TABLE mpp21090_drop_midcol_dml_text DROP COLUMN col3;
INSERT INTO mpp21090_drop_midcol_dml_text SELECT 1,1.00,'b','2014-01-02';
SELECT * FROM mpp21090_drop_midcol_dml_text ORDER BY 1,2,3,4;
 col1 | col2 | col4 |    col5    
------+------+------+------------
    0 | 0.00 | a    | 2014-01-01
    1 | 1.00 | b    | 2014-01-02
(2 rows)

UPDATE mpp21090_drop_midcol_dml_text SET col4='c' WHERE col4 = 'b' AND col1 = 1;
ERROR:  Cannot parallelize an UPDATE statement that updates the distribution columns
SELECT * FROM mpp21090_drop_midcol_dml_text ORDER BY 1,2,3,4;
 col1 | col2 | col4 |    col5    
------+------+------+------------
    0 | 0.00 | a    | 2014-01-01
    1 | 1.00 | b    | 2014-01-02
(2 rows)

-- TEST
DROP TABLE IF EXISTS mpp21090_drop_midcol_dml_text;
CREATE TABLE mpp21090_drop_midcol_dml_text
(
col1 int,
col2 decimal,
col3 text,
col4 char,
col5 date
) with (appendonly= true, orientation= column)  DISTRIBUTED by(col4);
INSERT INTO mpp21090_drop_midcol_dml_text VALUES(0,0.00,'abcdefghijklmnop','a','2014-01-01');
SELECT * FROM mpp21090_drop_midcol_dml_text ORDER BY 1,2,3,4;
 col1 | col2 |       col3       | col4 |    col5    
------+------+------------------+------+------------
    0 | 0.00 | abcdefghijklmnop | a    | 2014-01-01
(1 row)

ALTER TABLE mpp21090_drop_midcol_dml_text DROP COLUMN col3;
INSERT INTO mpp21090_drop_midcol_dml_text SELECT 1,1.00,'b','2014-01-02';
SELECT * FROM mpp21090_drop_midcol_dml_text ORDER BY 1,2,3,4;
 col1 | col2 | col4 |    col5    
------+------+------+------------
    0 | 0.00 | a    | 2014-01-01
    1 | 1.00 | b    | 2014-01-02
(2 rows)

UPDATE mpp21090_drop_midcol_dml_text SET col4='c' WHERE col4 = 'b' AND col1 = 1;
ERROR:  Cannot parallelize an UPDATE statement that updates the distribution columns
SELECT * FROM mpp21090_drop_midcol_dml_text ORDER BY 1,2,3,4;
 col1 | col2 | col4 |    col5    
------+------+------+------------
    0 | 0.00 | a    | 2014-01-01
    1 | 1.00 | b    | 2014-01-02
(2 rows)

-- TEST
DROP TABLE IF EXISTS mpp21090_drop_midcol_dml_text;
CREATE TABLE mpp21090_drop_midcol_dml_text
(
col1 int,
col2 decimal,
col3 text,
col4 char,
col5 date
) DISTRIBUTED by(col4);
INSERT INTO mpp21090_drop_midcol_dml_text VALUES(0,0.00,'abcdefghijklmnop','a','2014-01-01');
SELECT * FROM mpp21090_drop_midcol_dml_text ORDER BY 1,2,3,4;
 col1 | col2 |       col3       | col4 |    col5    
------+------+------------------+------+------------
    0 | 0.00 | abcdefghijklmnop | a    | 2014-01-01
(1 row)

ALTER TABLE mpp21090_drop_midcol_dml_text DROP COLUMN col3;
INSERT INTO mpp21090_drop_midcol_dml_text SELECT 1,1.00,'b','2014-01-02';
SELECT * FROM mpp21090_drop_midcol_dml_text ORDER BY 1,2,3,4;
 col1 | col2 | col4 |    col5    
------+------+------+------------
    0 | 0.00 | a    | 2014-01-01
    1 | 1.00 | b    | 2014-01-02
(2 rows)

UPDATE mpp21090_drop_midcol_dml_text SET col4='c' WHERE col4 = 'b' AND col1 = 1;
ERROR:  Cannot parallelize an UPDATE statement that updates the distribution columns
SELECT * FROM mpp21090_drop_midcol_dml_text ORDER BY 1,2,3,4;
 col1 | col2 | col4 |    col5    
------+------+------+------------
    0 | 0.00 | a    | 2014-01-01
    1 | 1.00 | b    | 2014-01-02
(2 rows)

-- TEST
DROP TABLE IF EXISTS mpp21090_drop_multicol_dml_boolean;
NOTICE:  table "mpp21090_drop_multicol_dml_boolean" does not exist, skipping
CREATE TABLE mpp21090_drop_multicol_dml_boolean(
col1 boolean,
col2 decimal,
col3 char,
col4 date,
col5 int
)  with (appendonly= true)  DISTRIBUTED by (col3);
INSERT INTO mpp21090_drop_multicol_dml_boolean VALUES(True,0.00,'a','2014-01-01',0);
SELECT * FROM mpp21090_drop_multicol_dml_boolean ORDER BY 1,2,3,4;
 col1 | col2 | col3 |    col4    | col5 
------+------+------+------------+------
 t    | 0.00 | a    | 2014-01-01 |    0
(1 row)

ALTER TABLE mpp21090_drop_multicol_dml_boolean DROP COLUMN col1;
ALTER TABLE mpp21090_drop_multicol_dml_boolean DROP COLUMN col4;
INSERT INTO mpp21090_drop_multicol_dml_boolean SELECT 1.00,'b',1;
SELECT * FROM mpp21090_drop_multicol_dml_boolean ORDER BY 1,2,3;
 col2 | col3 | col5 
------+------+------
 0.00 | a    |    0
 1.00 | b    |    1
(2 rows)

UPDATE mpp21090_drop_multicol_dml_boolean SET col3='c' WHERE col3 = 'b' AND col5 = 1;
ERROR:  Cannot parallelize an UPDATE statement that updates the distribution columns
SELECT * FROM mpp21090_drop_multicol_dml_boolean ORDER BY 1,2,3;
 col2 | col3 | col5 
------+------+------
 0.00 | a    |    0
 1.00 | b    |    1
(2 rows)

DELETE FROM mpp21090_drop_multicol_dml_boolean WHERE col3='c';
SELECT * FROM mpp21090_drop_multicol_dml_boolean ORDER BY 1,2,3;
 col2 | col3 | col5 
------+------+------
 0.00 | a    |    0
 1.00 | b    |    1
(2 rows)

-- TEST
DROP TABLE IF EXISTS mpp21090_drop_multicol_dml_boolean;
CREATE TABLE mpp21090_drop_multicol_dml_boolean(
col1 boolean,
col2 decimal,
col3 char,
col4 date,
col5 int
)  with (appendonly= true, orientation= column)  DISTRIBUTED by (col3);
INSERT INTO mpp21090_drop_multicol_dml_boolean VALUES(True,0.00,'a','2014-01-01',0);
SELECT * FROM mpp21090_drop_multicol_dml_boolean ORDER BY 1,2,3,4;
 col1 | col2 | col3 |    col4    | col5 
------+------+------+------------+------
 t    | 0.00 | a    | 2014-01-01 |    0
(1 row)

ALTER TABLE mpp21090_drop_multicol_dml_boolean DROP COLUMN col1;
ALTER TABLE mpp21090_drop_multicol_dml_boolean DROP COLUMN col4;
INSERT INTO mpp21090_drop_multicol_dml_boolean SELECT 1.00,'b',1;
SELECT * FROM mpp21090_drop_multicol_dml_boolean ORDER BY 1,2,3;
 col2 | col3 | col5 
------+------+------
 0.00 | a    |    0
 1.00 | b    |    1
(2 rows)

UPDATE mpp21090_drop_multicol_dml_boolean SET col3='c' WHERE col3 = 'b' AND col5 = 1;
ERROR:  Cannot parallelize an UPDATE statement that updates the distribution columns
SELECT * FROM mpp21090_drop_multicol_dml_boolean ORDER BY 1,2,3;
 col2 | col3 | col5 
------+------+------
 0.00 | a    |    0
 1.00 | b    |    1
(2 rows)

DELETE FROM mpp21090_drop_multicol_dml_boolean WHERE col3='c';
SELECT * FROM mpp21090_drop_multicol_dml_boolean ORDER BY 1,2,3;
 col2 | col3 | col5 
------+------+------
 0.00 | a    |    0
 1.00 | b    |    1
(2 rows)

-- TEST
DROP TABLE IF EXISTS mpp21090_drop_multicol_dml_boolean;
CREATE TABLE mpp21090_drop_multicol_dml_boolean(
col1 boolean,
col2 decimal,
col3 char,
col4 date,
col5 int
)  DISTRIBUTED by (col3);
INSERT INTO mpp21090_drop_multicol_dml_boolean VALUES(True,0.00,'a','2014-01-01',0);
SELECT * FROM mpp21090_drop_multicol_dml_boolean ORDER BY 1,2,3,4;
 col1 | col2 | col3 |    col4    | col5 
------+------+------+------------+------
 t    | 0.00 | a    | 2014-01-01 |    0
(1 row)

ALTER TABLE mpp21090_drop_multicol_dml_boolean DROP COLUMN col1;
ALTER TABLE mpp21090_drop_multicol_dml_boolean DROP COLUMN col4;
INSERT INTO mpp21090_drop_multicol_dml_boolean SELECT 1.00,'b',1;
SELECT * FROM mpp21090_drop_multicol_dml_boolean ORDER BY 1,2,3;
 col2 | col3 | col5 
------+------+------
 0.00 | a    |    0
 1.00 | b    |    1
(2 rows)

UPDATE mpp21090_drop_multicol_dml_boolean SET col3='c' WHERE col3 = 'b' AND col5 = 1;
ERROR:  Cannot parallelize an UPDATE statement that updates the distribution columns
SELECT * FROM mpp21090_drop_multicol_dml_boolean ORDER BY 1,2,3;
 col2 | col3 | col5 
------+------+------
 0.00 | a    |    0
 1.00 | b    |    1
(2 rows)

DELETE FROM mpp21090_drop_multicol_dml_boolean WHERE col3='c';
SELECT * FROM mpp21090_drop_multicol_dml_boolean ORDER BY 1,2,3;
 col2 | col3 | col5 
------+------+------
 0.00 | a    |    0
 1.00 | b    |    1
(2 rows)

-- TEST
DROP TABLE IF EXISTS mpp21090_drop_multicol_dml_char;
NOTICE:  table "mpp21090_drop_multicol_dml_char" does not exist, skipping
CREATE TABLE mpp21090_drop_multicol_dml_char(
col1 char,
col2 decimal,
col3 char,
col4 date,
col5 int
)  with (appendonly= true)  DISTRIBUTED by (col3);
INSERT INTO mpp21090_drop_multicol_dml_char VALUES('z',0.00,'a','2014-01-01',0);
SELECT * FROM mpp21090_drop_multicol_dml_char ORDER BY 1,2,3,4;
 col1 | col2 | col3 |    col4    | col5 
------+------+------+------------+------
 z    | 0.00 | a    | 2014-01-01 |    0
(1 row)

ALTER TABLE mpp21090_drop_multicol_dml_char DROP COLUMN col1;
ALTER TABLE mpp21090_drop_multicol_dml_char DROP COLUMN col4;
INSERT INTO mpp21090_drop_multicol_dml_char SELECT 1.00,'b',1;
SELECT * FROM mpp21090_drop_multicol_dml_char ORDER BY 1,2,3;
 col2 | col3 | col5 
------+------+------
 0.00 | a    |    0
 1.00 | b    |    1
(2 rows)

UPDATE mpp21090_drop_multicol_dml_char SET col3='c' WHERE col3 = 'b' AND col5 = 1;
ERROR:  Cannot parallelize an UPDATE statement that updates the distribution columns
SELECT * FROM mpp21090_drop_multicol_dml_char ORDER BY 1,2,3;
 col2 | col3 | col5 
------+------+------
 0.00 | a    |    0
 1.00 | b    |    1
(2 rows)

DELETE FROM mpp21090_drop_multicol_dml_char WHERE col3='c';
SELECT * FROM mpp21090_drop_multicol_dml_char ORDER BY 1,2,3;
 col2 | col3 | col5 
------+------+------
 0.00 | a    |    0
 1.00 | b    |    1
(2 rows)

-- TEST
DROP TABLE IF EXISTS mpp21090_drop_multicol_dml_char;
CREATE TABLE mpp21090_drop_multicol_dml_char(
col1 char,
col2 decimal,
col3 char,
col4 date,
col5 int
)  with (appendonly= true, orientation= column)  DISTRIBUTED by (col3);
INSERT INTO mpp21090_drop_multicol_dml_char VALUES('z',0.00,'a','2014-01-01',0);
SELECT * FROM mpp21090_drop_multicol_dml_char ORDER BY 1,2,3,4;
 col1 | col2 | col3 |    col4    | col5 
------+------+------+------------+------
 z    | 0.00 | a    | 2014-01-01 |    0
(1 row)

ALTER TABLE mpp21090_drop_multicol_dml_char DROP COLUMN col1;
ALTER TABLE mpp21090_drop_multicol_dml_char DROP COLUMN col4;
INSERT INTO mpp21090_drop_multicol_dml_char SELECT 1.00,'b',1;
SELECT * FROM mpp21090_drop_multicol_dml_char ORDER BY 1,2,3;
 col2 | col3 | col5 
------+------+------
 0.00 | a    |    0
 1.00 | b    |    1
(2 rows)

UPDATE mpp21090_drop_multicol_dml_char SET col3='c' WHERE col3 = 'b' AND col5 = 1;
ERROR:  Cannot parallelize an UPDATE statement that updates the distribution columns
SELECT * FROM mpp21090_drop_multicol_dml_char ORDER BY 1,2,3;
 col2 | col3 | col5 
------+------+------
 0.00 | a    |    0
 1.00 | b    |    1
(2 rows)

DELETE FROM mpp21090_drop_multicol_dml_char WHERE col3='c';
SELECT * FROM mpp21090_drop_multicol_dml_char ORDER BY 1,2,3;
 col2 | col3 | col5 
------+------+------
 0.00 | a    |    0
 1.00 | b    |    1
(2 rows)

-- TEST
DROP TABLE IF EXISTS mpp21090_drop_multicol_dml_char;
CREATE TABLE mpp21090_drop_multicol_dml_char(
col1 char,
col2 decimal,
col3 char,
col4 date,
col5 int
)  DISTRIBUTED by (col3);
INSERT INTO mpp21090_drop_multicol_dml_char VALUES('z',0.00,'a','2014-01-01',0);
SELECT * FROM mpp21090_drop_multicol_dml_char ORDER BY 1,2,3,4;
 col1 | col2 | col3 |    col4    | col5 
------+------+------+------------+------
 z    | 0.00 | a    | 2014-01-01 |    0
(1 row)

ALTER TABLE mpp21090_drop_multicol_dml_char DROP COLUMN col1;
ALTER TABLE mpp21090_drop_multicol_dml_char DROP COLUMN col4;
INSERT INTO mpp21090_drop_multicol_dml_char SELECT 1.00,'b',1;
SELECT * FROM mpp21090_drop_multicol_dml_char ORDER BY 1,2,3;
 col2 | col3 | col5 
------+------+------
 0.00 | a    |    0
 1.00 | b    |    1
(2 rows)

UPDATE mpp21090_drop_multicol_dml_char SET col3='c' WHERE col3 = 'b' AND col5 = 1;
ERROR:  Cannot parallelize an UPDATE statement that updates the distribution columns
SELECT * FROM mpp21090_drop_multicol_dml_char ORDER BY 1,2,3;
 col2 | col3 | col5 
------+------+------
 0.00 | a    |    0
 1.00 | b    |    1
(2 rows)

DELETE FROM mpp21090_drop_multicol_dml_char WHERE col3='c';
SELECT * FROM mpp21090_drop_multicol_dml_char ORDER BY 1,2,3;
 col2 | col3 | col5 
------+------+------
 0.00 | a    |    0
 1.00 | b    |    1
(2 rows)

-- TEST
DROP TABLE IF EXISTS mpp21090_drop_multicol_dml_decimal;
NOTICE:  table "mpp21090_drop_multicol_dml_decimal" does not exist, skipping
CREATE TABLE mpp21090_drop_multicol_dml_decimal(
col1 decimal,
col2 decimal,
col3 char,
col4 date,
col5 int
)  with (appendonly= true)  DISTRIBUTED by (col3);
INSERT INTO mpp21090_drop_multicol_dml_decimal VALUES(2.00,0.00,'a','2014-01-01',0);
SELECT * FROM mpp21090_drop_multicol_dml_decimal ORDER BY 1,2,3,4;
 col1 | col2 | col3 |    col4    | col5 
------+------+------+------------+------
 2.00 | 0.00 | a    | 2014-01-01 |    0
(1 row)

ALTER TABLE mpp21090_drop_multicol_dml_decimal DROP COLUMN col1;
ALTER TABLE mpp21090_drop_multicol_dml_decimal DROP COLUMN col4;
INSERT INTO mpp21090_drop_multicol_dml_decimal SELECT 1.00,'b',1;
SELECT * FROM mpp21090_drop_multicol_dml_decimal ORDER BY 1,2,3;
 col2 | col3 | col5 
------+------+------
 0.00 | a    |    0
 1.00 | b    |    1
(2 rows)

UPDATE mpp21090_drop_multicol_dml_decimal SET col3='c' WHERE col3 = 'b' AND col5 = 1;
ERROR:  Cannot parallelize an UPDATE statement that updates the distribution columns
SELECT * FROM mpp21090_drop_multicol_dml_decimal ORDER BY 1,2,3;
 col2 | col3 | col5 
------+------+------
 0.00 | a    |    0
 1.00 | b    |    1
(2 rows)

DELETE FROM mpp21090_drop_multicol_dml_decimal WHERE col3='c';
SELECT * FROM mpp21090_drop_multicol_dml_decimal ORDER BY 1,2,3;
 col2 | col3 | col5 
------+------+------
 0.00 | a    |    0
 1.00 | b    |    1
(2 rows)

-- TEST
DROP TABLE IF EXISTS mpp21090_drop_multicol_dml_decimal;
CREATE TABLE mpp21090_drop_multicol_dml_decimal(
col1 decimal,
col2 decimal,
col3 char,
col4 date,
col5 int
)  with (appendonly= true, orientation= column)  DISTRIBUTED by (col3);
INSERT INTO mpp21090_drop_multicol_dml_decimal VALUES(2.00,0.00,'a','2014-01-01',0);
SELECT * FROM mpp21090_drop_multicol_dml_decimal ORDER BY 1,2,3,4;
 col1 | col2 | col3 |    col4    | col5 
------+------+------+------------+------
 2.00 | 0.00 | a    | 2014-01-01 |    0
(1 row)

ALTER TABLE mpp21090_drop_multicol_dml_decimal DROP COLUMN col1;
ALTER TABLE mpp21090_drop_multicol_dml_decimal DROP COLUMN col4;
INSERT INTO mpp21090_drop_multicol_dml_decimal SELECT 1.00,'b',1;
SELECT * FROM mpp21090_drop_multicol_dml_decimal ORDER BY 1,2,3;
 col2 | col3 | col5 
------+------+------
 0.00 | a    |    0
 1.00 | b    |    1
(2 rows)

UPDATE mpp21090_drop_multicol_dml_decimal SET col3='c' WHERE col3 = 'b' AND col5 = 1;
ERROR:  Cannot parallelize an UPDATE statement that updates the distribution columns
SELECT * FROM mpp21090_drop_multicol_dml_decimal ORDER BY 1,2,3;
 col2 | col3 | col5 
------+------+------
 0.00 | a    |    0
 1.00 | b    |    1
(2 rows)

DELETE FROM mpp21090_drop_multicol_dml_decimal WHERE col3='c';
SELECT * FROM mpp21090_drop_multicol_dml_decimal ORDER BY 1,2,3;
 col2 | col3 | col5 
------+------+------
 0.00 | a    |    0
 1.00 | b    |    1
(2 rows)

-- TEST
DROP TABLE IF EXISTS mpp21090_drop_multicol_dml_decimal;
CREATE TABLE mpp21090_drop_multicol_dml_decimal(
col1 decimal,
col2 decimal,
col3 char,
col4 date,
col5 int
)  DISTRIBUTED by (col3);
INSERT INTO mpp21090_drop_multicol_dml_decimal VALUES(2.00,0.00,'a','2014-01-01',0);
SELECT * FROM mpp21090_drop_multicol_dml_decimal ORDER BY 1,2,3,4;
 col1 | col2 | col3 |    col4    | col5 
------+------+------+------------+------
 2.00 | 0.00 | a    | 2014-01-01 |    0
(1 row)

ALTER TABLE mpp21090_drop_multicol_dml_decimal DROP COLUMN col1;
ALTER TABLE mpp21090_drop_multicol_dml_decimal DROP COLUMN col4;
INSERT INTO mpp21090_drop_multicol_dml_decimal SELECT 1.00,'b',1;
SELECT * FROM mpp21090_drop_multicol_dml_decimal ORDER BY 1,2,3;
 col2 | col3 | col5 
------+------+------
 0.00 | a    |    0
 1.00 | b    |    1
(2 rows)

UPDATE mpp21090_drop_multicol_dml_decimal SET col3='c' WHERE col3 = 'b' AND col5 = 1;
ERROR:  Cannot parallelize an UPDATE statement that updates the distribution columns
SELECT * FROM mpp21090_drop_multicol_dml_decimal ORDER BY 1,2,3;
 col2 | col3 | col5 
------+------+------
 0.00 | a    |    0
 1.00 | b    |    1
(2 rows)

DELETE FROM mpp21090_drop_multicol_dml_decimal WHERE col3='c';
SELECT * FROM mpp21090_drop_multicol_dml_decimal ORDER BY 1,2,3;
 col2 | col3 | col5 
------+------+------
 0.00 | a    |    0
 1.00 | b    |    1
(2 rows)

-- TEST
DROP TABLE IF EXISTS mpp21090_drop_multicol_dml_int4;
NOTICE:  table "mpp21090_drop_multicol_dml_int4" does not exist, skipping
CREATE TABLE mpp21090_drop_multicol_dml_int4(
col1 int4,
col2 decimal,
col3 char,
col4 date,
col5 int
)  with (appendonly= true)  DISTRIBUTED by (col3);
INSERT INTO mpp21090_drop_multicol_dml_int4 VALUES(2000000000,0.00,'a','2014-01-01',0);
SELECT * FROM mpp21090_drop_multicol_dml_int4 ORDER BY 1,2,3,4;
    col1    | col2 | col3 |    col4    | col5 
------------+------+------+------------+------
 2000000000 | 0.00 | a    | 2014-01-01 |    0
(1 row)

ALTER TABLE mpp21090_drop_multicol_dml_int4 DROP COLUMN col1;
ALTER TABLE mpp21090_drop_multicol_dml_int4 DROP COLUMN col4;
INSERT INTO mpp21090_drop_multicol_dml_int4 SELECT 1.00,'b',1;
SELECT * FROM mpp21090_drop_multicol_dml_int4 ORDER BY 1,2,3;
 col2 | col3 | col5 
------+------+------
 0.00 | a    |    0
 1.00 | b    |    1
(2 rows)

UPDATE mpp21090_drop_multicol_dml_int4 SET col3='c' WHERE col3 = 'b' AND col5 = 1;
ERROR:  Cannot parallelize an UPDATE statement that updates the distribution columns
SELECT * FROM mpp21090_drop_multicol_dml_int4 ORDER BY 1,2,3;
 col2 | col3 | col5 
------+------+------
 0.00 | a    |    0
 1.00 | b    |    1
(2 rows)

DELETE FROM mpp21090_drop_multicol_dml_int4 WHERE col3='c';
SELECT * FROM mpp21090_drop_multicol_dml_int4 ORDER BY 1,2,3;
 col2 | col3 | col5 
------+------+------
 0.00 | a    |    0
 1.00 | b    |    1
(2 rows)

-- TEST
DROP TABLE IF EXISTS mpp21090_drop_multicol_dml_int4;
CREATE TABLE mpp21090_drop_multicol_dml_int4(
col1 int4,
col2 decimal,
col3 char,
col4 date,
col5 int
)  with (appendonly= true, orientation= column)  DISTRIBUTED by (col3);
INSERT INTO mpp21090_drop_multicol_dml_int4 VALUES(2000000000,0.00,'a','2014-01-01',0);
SELECT * FROM mpp21090_drop_multicol_dml_int4 ORDER BY 1,2,3,4;
    col1    | col2 | col3 |    col4    | col5 
------------+------+------+------------+------
 2000000000 | 0.00 | a    | 2014-01-01 |    0
(1 row)

ALTER TABLE mpp21090_drop_multicol_dml_int4 DROP COLUMN col1;
ALTER TABLE mpp21090_drop_multicol_dml_int4 DROP COLUMN col4;
INSERT INTO mpp21090_drop_multicol_dml_int4 SELECT 1.00,'b',1;
SELECT * FROM mpp21090_drop_multicol_dml_int4 ORDER BY 1,2,3;
 col2 | col3 | col5 
------+------+------
 0.00 | a    |    0
 1.00 | b    |    1
(2 rows)

UPDATE mpp21090_drop_multicol_dml_int4 SET col3='c' WHERE col3 = 'b' AND col5 = 1;
ERROR:  Cannot parallelize an UPDATE statement that updates the distribution columns
SELECT * FROM mpp21090_drop_multicol_dml_int4 ORDER BY 1,2,3;
 col2 | col3 | col5 
------+------+------
 0.00 | a    |    0
 1.00 | b    |    1
(2 rows)

DELETE FROM mpp21090_drop_multicol_dml_int4 WHERE col3='c';
SELECT * FROM mpp21090_drop_multicol_dml_int4 ORDER BY 1,2,3;
 col2 | col3 | col5 
------+------+------
 0.00 | a    |    0
 1.00 | b    |    1
(2 rows)

-- TEST
DROP TABLE IF EXISTS mpp21090_drop_multicol_dml_int4;
CREATE TABLE mpp21090_drop_multicol_dml_int4(
col1 int4,
col2 decimal,
col3 char,
col4 date,
col5 int
)  DISTRIBUTED by (col3);
INSERT INTO mpp21090_drop_multicol_dml_int4 VALUES(2000000000,0.00,'a','2014-01-01',0);
SELECT * FROM mpp21090_drop_multicol_dml_int4 ORDER BY 1,2,3,4;
    col1    | col2 | col3 |    col4    | col5 
------------+------+------+------------+------
 2000000000 | 0.00 | a    | 2014-01-01 |    0
(1 row)

ALTER TABLE mpp21090_drop_multicol_dml_int4 DROP COLUMN col1;
ALTER TABLE mpp21090_drop_multicol_dml_int4 DROP COLUMN col4;
INSERT INTO mpp21090_drop_multicol_dml_int4 SELECT 1.00,'b',1;
SELECT * FROM mpp21090_drop_multicol_dml_int4 ORDER BY 1,2,3;
 col2 | col3 | col5 
------+------+------
 0.00 | a    |    0
 1.00 | b    |    1
(2 rows)

UPDATE mpp21090_drop_multicol_dml_int4 SET col3='c' WHERE col3 = 'b' AND col5 = 1;
ERROR:  Cannot parallelize an UPDATE statement that updates the distribution columns
SELECT * FROM mpp21090_drop_multicol_dml_int4 ORDER BY 1,2,3;
 col2 | col3 | col5 
------+------+------
 0.00 | a    |    0
 1.00 | b    |    1
(2 rows)

DELETE FROM mpp21090_drop_multicol_dml_int4 WHERE col3='c';
SELECT * FROM mpp21090_drop_multicol_dml_int4 ORDER BY 1,2,3;
 col2 | col3 | col5 
------+------+------
 0.00 | a    |    0
 1.00 | b    |    1
(2 rows)

-- TEST
DROP TABLE IF EXISTS mpp21090_drop_multicol_dml_int8;
NOTICE:  table "mpp21090_drop_multicol_dml_int8" does not exist, skipping
CREATE TABLE mpp21090_drop_multicol_dml_int8(
col1 int8,
col2 decimal,
col3 char,
col4 date,
col5 int
)  with (appendonly= true)  DISTRIBUTED by (col3);
INSERT INTO mpp21090_drop_multicol_dml_int8 VALUES(2000000000000000000,0.00,'a','2014-01-01',0);
SELECT * FROM mpp21090_drop_multicol_dml_int8 ORDER BY 1,2,3,4;
        col1         | col2 | col3 |    col4    | col5 
---------------------+------+------+------------+------
 2000000000000000000 | 0.00 | a    | 2014-01-01 |    0
(1 row)

ALTER TABLE mpp21090_drop_multicol_dml_int8 DROP COLUMN col1;
ALTER TABLE mpp21090_drop_multicol_dml_int8 DROP COLUMN col4;
INSERT INTO mpp21090_drop_multicol_dml_int8 SELECT 1.00,'b',1;
SELECT * FROM mpp21090_drop_multicol_dml_int8 ORDER BY 1,2,3;
 col2 | col3 | col5 
------+------+------
 0.00 | a    |    0
 1.00 | b    |    1
(2 rows)

UPDATE mpp21090_drop_multicol_dml_int8 SET col3='c' WHERE col3 = 'b' AND col5 = 1;
ERROR:  Cannot parallelize an UPDATE statement that updates the distribution columns
SELECT * FROM mpp21090_drop_multicol_dml_int8 ORDER BY 1,2,3;
 col2 | col3 | col5 
------+------+------
 0.00 | a    |    0
 1.00 | b    |    1
(2 rows)

DELETE FROM mpp21090_drop_multicol_dml_int8 WHERE col3='c';
SELECT * FROM mpp21090_drop_multicol_dml_int8 ORDER BY 1,2,3;
 col2 | col3 | col5 
------+------+------
 0.00 | a    |    0
 1.00 | b    |    1
(2 rows)

-- TEST
DROP TABLE IF EXISTS mpp21090_drop_multicol_dml_int8;
CREATE TABLE mpp21090_drop_multicol_dml_int8(
col1 int8,
col2 decimal,
col3 char,
col4 date,
col5 int
)  with (appendonly= true, orientation= column)  DISTRIBUTED by (col3);
INSERT INTO mpp21090_drop_multicol_dml_int8 VALUES(2000000000000000000,0.00,'a','2014-01-01',0);
SELECT * FROM mpp21090_drop_multicol_dml_int8 ORDER BY 1,2,3,4;
        col1         | col2 | col3 |    col4    | col5 
---------------------+------+------+------------+------
 2000000000000000000 | 0.00 | a    | 2014-01-01 |    0
(1 row)

ALTER TABLE mpp21090_drop_multicol_dml_int8 DROP COLUMN col1;
ALTER TABLE mpp21090_drop_multicol_dml_int8 DROP COLUMN col4;
INSERT INTO mpp21090_drop_multicol_dml_int8 SELECT 1.00,'b',1;
SELECT * FROM mpp21090_drop_multicol_dml_int8 ORDER BY 1,2,3;
 col2 | col3 | col5 
------+------+------
 0.00 | a    |    0
 1.00 | b    |    1
(2 rows)

UPDATE mpp21090_drop_multicol_dml_int8 SET col3='c' WHERE col3 = 'b' AND col5 = 1;
ERROR:  Cannot parallelize an UPDATE statement that updates the distribution columns
SELECT * FROM mpp21090_drop_multicol_dml_int8 ORDER BY 1,2,3;
 col2 | col3 | col5 
------+------+------
 0.00 | a    |    0
 1.00 | b    |    1
(2 rows)

DELETE FROM mpp21090_drop_multicol_dml_int8 WHERE col3='c';
SELECT * FROM mpp21090_drop_multicol_dml_int8 ORDER BY 1,2,3;
 col2 | col3 | col5 
------+------+------
 0.00 | a    |    0
 1.00 | b    |    1
(2 rows)

-- TEST
DROP TABLE IF EXISTS mpp21090_drop_multicol_dml_int8;
CREATE TABLE mpp21090_drop_multicol_dml_int8(
col1 int8,
col2 decimal,
col3 char,
col4 date,
col5 int
)  DISTRIBUTED by (col3);
INSERT INTO mpp21090_drop_multicol_dml_int8 VALUES(2000000000000000000,0.00,'a','2014-01-01',0);
SELECT * FROM mpp21090_drop_multicol_dml_int8 ORDER BY 1,2,3,4;
        col1         | col2 | col3 |    col4    | col5 
---------------------+------+------+------------+------
 2000000000000000000 | 0.00 | a    | 2014-01-01 |    0
(1 row)

ALTER TABLE mpp21090_drop_multicol_dml_int8 DROP COLUMN col1;
ALTER TABLE mpp21090_drop_multicol_dml_int8 DROP COLUMN col4;
INSERT INTO mpp21090_drop_multicol_dml_int8 SELECT 1.00,'b',1;
SELECT * FROM mpp21090_drop_multicol_dml_int8 ORDER BY 1,2,3;
 col2 | col3 | col5 
------+------+------
 0.00 | a    |    0
 1.00 | b    |    1
(2 rows)

UPDATE mpp21090_drop_multicol_dml_int8 SET col3='c' WHERE col3 = 'b' AND col5 = 1;
ERROR:  Cannot parallelize an UPDATE statement that updates the distribution columns
SELECT * FROM mpp21090_drop_multicol_dml_int8 ORDER BY 1,2,3;
 col2 | col3 | col5 
------+------+------
 0.00 | a    |    0
 1.00 | b    |    1
(2 rows)

DELETE FROM mpp21090_drop_multicol_dml_int8 WHERE col3='c';
SELECT * FROM mpp21090_drop_multicol_dml_int8 ORDER BY 1,2,3;
 col2 | col3 | col5 
------+------+------
 0.00 | a    |    0
 1.00 | b    |    1
(2 rows)

-- TEST
DROP TABLE IF EXISTS mpp21090_drop_multicol_dml_interval;
NOTICE:  table "mpp21090_drop_multicol_dml_interval" does not exist, skipping
CREATE TABLE mpp21090_drop_multicol_dml_interval(
col1 interval,
col2 decimal,
col3 char,
col4 date,
col5 int
)  with (appendonly= true)  DISTRIBUTED by (col3);
INSERT INTO mpp21090_drop_multicol_dml_interval VALUES('1 day',0.00,'a','2014-01-01',0);
SELECT * FROM mpp21090_drop_multicol_dml_interval ORDER BY 1,2,3,4;
 col1  | col2 | col3 |    col4    | col5 
-------+------+------+------------+------
 1 day | 0.00 | a    | 2014-01-01 |    0
(1 row)

ALTER TABLE mpp21090_drop_multicol_dml_interval DROP COLUMN col1;
ALTER TABLE mpp21090_drop_multicol_dml_interval DROP COLUMN col4;
INSERT INTO mpp21090_drop_multicol_dml_interval SELECT 1.00,'b',1;
SELECT * FROM mpp21090_drop_multicol_dml_interval ORDER BY 1,2,3;
 col2 | col3 | col5 
------+------+------
 0.00 | a    |    0
 1.00 | b    |    1
(2 rows)

UPDATE mpp21090_drop_multicol_dml_interval SET col3='c' WHERE col3 = 'b' AND col5 = 1;
ERROR:  Cannot parallelize an UPDATE statement that updates the distribution columns
SELECT * FROM mpp21090_drop_multicol_dml_interval ORDER BY 1,2,3;
 col2 | col3 | col5 
------+------+------
 0.00 | a    |    0
 1.00 | b    |    1
(2 rows)

DELETE FROM mpp21090_drop_multicol_dml_interval WHERE col3='c';
SELECT * FROM mpp21090_drop_multicol_dml_interval ORDER BY 1,2,3;
 col2 | col3 | col5 
------+------+------
 0.00 | a    |    0
 1.00 | b    |    1
(2 rows)

-- TEST
DROP TABLE IF EXISTS mpp21090_drop_multicol_dml_interval;
CREATE TABLE mpp21090_drop_multicol_dml_interval(
col1 interval,
col2 decimal,
col3 char,
col4 date,
col5 int
)  with (appendonly= true, orientation= column)  DISTRIBUTED by (col3);
INSERT INTO mpp21090_drop_multicol_dml_interval VALUES('1 day',0.00,'a','2014-01-01',0);
SELECT * FROM mpp21090_drop_multicol_dml_interval ORDER BY 1,2,3,4;
 col1  | col2 | col3 |    col4    | col5 
-------+------+------+------------+------
 1 day | 0.00 | a    | 2014-01-01 |    0
(1 row)

ALTER TABLE mpp21090_drop_multicol_dml_interval DROP COLUMN col1;
ALTER TABLE mpp21090_drop_multicol_dml_interval DROP COLUMN col4;
INSERT INTO mpp21090_drop_multicol_dml_interval SELECT 1.00,'b',1;
SELECT * FROM mpp21090_drop_multicol_dml_interval ORDER BY 1,2,3;
 col2 | col3 | col5 
------+------+------
 0.00 | a    |    0
 1.00 | b    |    1
(2 rows)

UPDATE mpp21090_drop_multicol_dml_interval SET col3='c' WHERE col3 = 'b' AND col5 = 1;
ERROR:  Cannot parallelize an UPDATE statement that updates the distribution columns
SELECT * FROM mpp21090_drop_multicol_dml_interval ORDER BY 1,2,3;
 col2 | col3 | col5 
------+------+------
 0.00 | a    |    0
 1.00 | b    |    1
(2 rows)

DELETE FROM mpp21090_drop_multicol_dml_interval WHERE col3='c';
SELECT * FROM mpp21090_drop_multicol_dml_interval ORDER BY 1,2,3;
 col2 | col3 | col5 
------+------+------
 0.00 | a    |    0
 1.00 | b    |    1
(2 rows)

-- TEST
DROP TABLE IF EXISTS mpp21090_drop_multicol_dml_interval;
CREATE TABLE mpp21090_drop_multicol_dml_interval(
col1 interval,
col2 decimal,
col3 char,
col4 date,
col5 int
)  DISTRIBUTED by (col3);
INSERT INTO mpp21090_drop_multicol_dml_interval VALUES('1 day',0.00,'a','2014-01-01',0);
SELECT * FROM mpp21090_drop_multicol_dml_interval ORDER BY 1,2,3,4;
 col1  | col2 | col3 |    col4    | col5 
-------+------+------+------------+------
 1 day | 0.00 | a    | 2014-01-01 |    0
(1 row)

ALTER TABLE mpp21090_drop_multicol_dml_interval DROP COLUMN col1;
ALTER TABLE mpp21090_drop_multicol_dml_interval DROP COLUMN col4;
INSERT INTO mpp21090_drop_multicol_dml_interval SELECT 1.00,'b',1;
SELECT * FROM mpp21090_drop_multicol_dml_interval ORDER BY 1,2,3;
 col2 | col3 | col5 
------+------+------
 0.00 | a    |    0
 1.00 | b    |    1
(2 rows)

UPDATE mpp21090_drop_multicol_dml_interval SET col3='c' WHERE col3 = 'b' AND col5 = 1;
ERROR:  Cannot parallelize an UPDATE statement that updates the distribution columns
SELECT * FROM mpp21090_drop_multicol_dml_interval ORDER BY 1,2,3;
 col2 | col3 | col5 
------+------+------
 0.00 | a    |    0
 1.00 | b    |    1
(2 rows)

DELETE FROM mpp21090_drop_multicol_dml_interval WHERE col3='c';
SELECT * FROM mpp21090_drop_multicol_dml_interval ORDER BY 1,2,3;
 col2 | col3 | col5 
------+------+------
 0.00 | a    |    0
 1.00 | b    |    1
(2 rows)

-- TEST
DROP TABLE IF EXISTS mpp21090_drop_multicol_dml_numeric;
NOTICE:  table "mpp21090_drop_multicol_dml_numeric" does not exist, skipping
CREATE TABLE mpp21090_drop_multicol_dml_numeric(
col1 numeric,
col2 decimal,
col3 char,
col4 date,
col5 int
)  with (appendonly= true)  DISTRIBUTED by (col3);
INSERT INTO mpp21090_drop_multicol_dml_numeric VALUES(2.000000,0.00,'a','2014-01-01',0);
SELECT * FROM mpp21090_drop_multicol_dml_numeric ORDER BY 1,2,3,4;
   col1   | col2 | col3 |    col4    | col5 
----------+------+------+------------+------
 2.000000 | 0.00 | a    | 2014-01-01 |    0
(1 row)

ALTER TABLE mpp21090_drop_multicol_dml_numeric DROP COLUMN col1;
ALTER TABLE mpp21090_drop_multicol_dml_numeric DROP COLUMN col4;
INSERT INTO mpp21090_drop_multicol_dml_numeric SELECT 1.00,'b',1;
SELECT * FROM mpp21090_drop_multicol_dml_numeric ORDER BY 1,2,3;
 col2 | col3 | col5 
------+------+------
 0.00 | a    |    0
 1.00 | b    |    1
(2 rows)

UPDATE mpp21090_drop_multicol_dml_numeric SET col3='c' WHERE col3 = 'b' AND col5 = 1;
ERROR:  Cannot parallelize an UPDATE statement that updates the distribution columns
SELECT * FROM mpp21090_drop_multicol_dml_numeric ORDER BY 1,2,3;
 col2 | col3 | col5 
------+------+------
 0.00 | a    |    0
 1.00 | b    |    1
(2 rows)

DELETE FROM mpp21090_drop_multicol_dml_numeric WHERE col3='c';
SELECT * FROM mpp21090_drop_multicol_dml_numeric ORDER BY 1,2,3;
 col2 | col3 | col5 
------+------+------
 0.00 | a    |    0
 1.00 | b    |    1
(2 rows)

-- TEST
DROP TABLE IF EXISTS mpp21090_drop_multicol_dml_numeric;
CREATE TABLE mpp21090_drop_multicol_dml_numeric(
col1 numeric,
col2 decimal,
col3 char,
col4 date,
col5 int
)  with (appendonly= true, orientation= column)  DISTRIBUTED by (col3);
INSERT INTO mpp21090_drop_multicol_dml_numeric VALUES(2.000000,0.00,'a','2014-01-01',0);
SELECT * FROM mpp21090_drop_multicol_dml_numeric ORDER BY 1,2,3,4;
   col1   | col2 | col3 |    col4    | col5 
----------+------+------+------------+------
 2.000000 | 0.00 | a    | 2014-01-01 |    0
(1 row)

ALTER TABLE mpp21090_drop_multicol_dml_numeric DROP COLUMN col1;
ALTER TABLE mpp21090_drop_multicol_dml_numeric DROP COLUMN col4;
INSERT INTO mpp21090_drop_multicol_dml_numeric SELECT 1.00,'b',1;
SELECT * FROM mpp21090_drop_multicol_dml_numeric ORDER BY 1,2,3;
 col2 | col3 | col5 
------+------+------
 0.00 | a    |    0
 1.00 | b    |    1
(2 rows)

UPDATE mpp21090_drop_multicol_dml_numeric SET col3='c' WHERE col3 = 'b' AND col5 = 1;
ERROR:  Cannot parallelize an UPDATE statement that updates the distribution columns
SELECT * FROM mpp21090_drop_multicol_dml_numeric ORDER BY 1,2,3;
 col2 | col3 | col5 
------+------+------
 0.00 | a    |    0
 1.00 | b    |    1
(2 rows)

DELETE FROM mpp21090_drop_multicol_dml_numeric WHERE col3='c';
SELECT * FROM mpp21090_drop_multicol_dml_numeric ORDER BY 1,2,3;
 col2 | col3 | col5 
------+------+------
 0.00 | a    |    0
 1.00 | b    |    1
(2 rows)

-- TEST
DROP TABLE IF EXISTS mpp21090_drop_multicol_dml_numeric;
CREATE TABLE mpp21090_drop_multicol_dml_numeric(
col1 numeric,
col2 decimal,
col3 char,
col4 date,
col5 int
)  DISTRIBUTED by (col3);
INSERT INTO mpp21090_drop_multicol_dml_numeric VALUES(2.000000,0.00,'a','2014-01-01',0);
SELECT * FROM mpp21090_drop_multicol_dml_numeric ORDER BY 1,2,3,4;
   col1   | col2 | col3 |    col4    | col5 
----------+------+------+------------+------
 2.000000 | 0.00 | a    | 2014-01-01 |    0
(1 row)

ALTER TABLE mpp21090_drop_multicol_dml_numeric DROP COLUMN col1;
ALTER TABLE mpp21090_drop_multicol_dml_numeric DROP COLUMN col4;
INSERT INTO mpp21090_drop_multicol_dml_numeric SELECT 1.00,'b',1;
SELECT * FROM mpp21090_drop_multicol_dml_numeric ORDER BY 1,2,3;
 col2 | col3 | col5 
------+------+------
 0.00 | a    |    0
 1.00 | b    |    1
(2 rows)

UPDATE mpp21090_drop_multicol_dml_numeric SET col3='c' WHERE col3 = 'b' AND col5 = 1;
ERROR:  Cannot parallelize an UPDATE statement that updates the distribution columns
SELECT * FROM mpp21090_drop_multicol_dml_numeric ORDER BY 1,2,3;
 col2 | col3 | col5 
------+------+------
 0.00 | a    |    0
 1.00 | b    |    1
(2 rows)

DELETE FROM mpp21090_drop_multicol_dml_numeric WHERE col3='c';
SELECT * FROM mpp21090_drop_multicol_dml_numeric ORDER BY 1,2,3;
 col2 | col3 | col5 
------+------+------
 0.00 | a    |    0
 1.00 | b    |    1
(2 rows)

-- TEST
DROP TABLE IF EXISTS mpp21090_drop_multicol_dml_text;
NOTICE:  table "mpp21090_drop_multicol_dml_text" does not exist, skipping
CREATE TABLE mpp21090_drop_multicol_dml_text(
col1 text,
col2 decimal,
col3 char,
col4 date,
col5 int
)  with (appendonly= true)  DISTRIBUTED by (col3);
INSERT INTO mpp21090_drop_multicol_dml_text VALUES('abcdefghijklmnop',0.00,'a','2014-01-01',0);
SELECT * FROM mpp21090_drop_multicol_dml_text ORDER BY 1,2,3,4;
       col1       | col2 | col3 |    col4    | col5 
------------------+------+------+------------+------
 abcdefghijklmnop | 0.00 | a    | 2014-01-01 |    0
(1 row)

ALTER TABLE mpp21090_drop_multicol_dml_text DROP COLUMN col1;
ALTER TABLE mpp21090_drop_multicol_dml_text DROP COLUMN col4;
INSERT INTO mpp21090_drop_multicol_dml_text SELECT 1.00,'b',1;
SELECT * FROM mpp21090_drop_multicol_dml_text ORDER BY 1,2,3;
 col2 | col3 | col5 
------+------+------
 0.00 | a    |    0
 1.00 | b    |    1
(2 rows)

UPDATE mpp21090_drop_multicol_dml_text SET col3='c' WHERE col3 = 'b' AND col5 = 1;
ERROR:  Cannot parallelize an UPDATE statement that updates the distribution columns
SELECT * FROM mpp21090_drop_multicol_dml_text ORDER BY 1,2,3;
 col2 | col3 | col5 
------+------+------
 0.00 | a    |    0
 1.00 | b    |    1
(2 rows)

DELETE FROM mpp21090_drop_multicol_dml_text WHERE col3='c';
SELECT * FROM mpp21090_drop_multicol_dml_text ORDER BY 1,2,3;
 col2 | col3 | col5 
------+------+------
 0.00 | a    |    0
 1.00 | b    |    1
(2 rows)

-- TEST
DROP TABLE IF EXISTS mpp21090_drop_multicol_dml_text;
CREATE TABLE mpp21090_drop_multicol_dml_text(
col1 text,
col2 decimal,
col3 char,
col4 date,
col5 int
)  with (appendonly= true, orientation= column)  DISTRIBUTED by (col3);
INSERT INTO mpp21090_drop_multicol_dml_text VALUES('abcdefghijklmnop',0.00,'a','2014-01-01',0);
SELECT * FROM mpp21090_drop_multicol_dml_text ORDER BY 1,2,3,4;
       col1       | col2 | col3 |    col4    | col5 
------------------+------+------+------------+------
 abcdefghijklmnop | 0.00 | a    | 2014-01-01 |    0
(1 row)

ALTER TABLE mpp21090_drop_multicol_dml_text DROP COLUMN col1;
ALTER TABLE mpp21090_drop_multicol_dml_text DROP COLUMN col4;
INSERT INTO mpp21090_drop_multicol_dml_text SELECT 1.00,'b',1;
SELECT * FROM mpp21090_drop_multicol_dml_text ORDER BY 1,2,3;
 col2 | col3 | col5 
------+------+------
 0.00 | a    |    0
 1.00 | b    |    1
(2 rows)

UPDATE mpp21090_drop_multicol_dml_text SET col3='c' WHERE col3 = 'b' AND col5 = 1;
ERROR:  Cannot parallelize an UPDATE statement that updates the distribution columns
SELECT * FROM mpp21090_drop_multicol_dml_text ORDER BY 1,2,3;
 col2 | col3 | col5 
------+------+------
 0.00 | a    |    0
 1.00 | b    |    1
(2 rows)

DELETE FROM mpp21090_drop_multicol_dml_text WHERE col3='c';
SELECT * FROM mpp21090_drop_multicol_dml_text ORDER BY 1,2,3;
 col2 | col3 | col5 
------+------+------
 0.00 | a    |    0
 1.00 | b    |    1
(2 rows)

-- TEST
DROP TABLE IF EXISTS mpp21090_drop_multicol_dml_text;
CREATE TABLE mpp21090_drop_multicol_dml_text(
col1 text,
col2 decimal,
col3 char,
col4 date,
col5 int
)  DISTRIBUTED by (col3);
INSERT INTO mpp21090_drop_multicol_dml_text VALUES('abcdefghijklmnop',0.00,'a','2014-01-01',0);
SELECT * FROM mpp21090_drop_multicol_dml_text ORDER BY 1,2,3,4;
       col1       | col2 | col3 |    col4    | col5 
------------------+------+------+------------+------
 abcdefghijklmnop | 0.00 | a    | 2014-01-01 |    0
(1 row)

ALTER TABLE mpp21090_drop_multicol_dml_text DROP COLUMN col1;
ALTER TABLE mpp21090_drop_multicol_dml_text DROP COLUMN col4;
INSERT INTO mpp21090_drop_multicol_dml_text SELECT 1.00,'b',1;
SELECT * FROM mpp21090_drop_multicol_dml_text ORDER BY 1,2,3;
 col2 | col3 | col5 
------+------+------
 0.00 | a    |    0
 1.00 | b    |    1
(2 rows)

UPDATE mpp21090_drop_multicol_dml_text SET col3='c' WHERE col3 = 'b' AND col5 = 1;
ERROR:  Cannot parallelize an UPDATE statement that updates the distribution columns
SELECT * FROM mpp21090_drop_multicol_dml_text ORDER BY 1,2,3;
 col2 | col3 | col5 
------+------+------
 0.00 | a    |    0
 1.00 | b    |    1
(2 rows)

DELETE FROM mpp21090_drop_multicol_dml_text WHERE col3='c';
SELECT * FROM mpp21090_drop_multicol_dml_text ORDER BY 1,2,3;
 col2 | col3 | col5 
------+------+------
 0.00 | a    |    0
 1.00 | b    |    1
(2 rows)

-- TEST
DROP TABLE IF EXISTS mpp21090_pttab_addcol_addpt_dropcol_char;
NOTICE:  table "mpp21090_pttab_addcol_addpt_dropcol_char" does not exist, skipping
CREATE TABLE mpp21090_pttab_addcol_addpt_dropcol_char
(
    col1 char,
    col2 char,
    col3 char,
    col4 int
) 
DISTRIBUTED by (col1)
PARTITION BY LIST(col2)(partition partone VALUES('a','b','c','d','e','f','g','h') WITH (APPENDONLY=true, COMPRESSLEVEL=5, ORIENTATION=column),partition parttwo VALUES('i','j','k','l','m','n','o','p') WITH (APPENDONLY=true, COMPRESSLEVEL=5, ORIENTATION=row),partition partthree VALUES('q','r','s','t','u','v','w','x'));
NOTICE:  CREATE TABLE will create partition "mpp21090_pttab_addcol_addpt_dropcol_char_1_prt_partone" for table "mpp21090_pttab_addcol_addpt_dropcol_char"
NOTICE:  CREATE TABLE will create partition "mpp21090_pttab_addcol_addpt_dropcol_char_1_prt_parttwo" for table "mpp21090_pttab_addcol_addpt_dropcol_char"
NOTICE:  CREATE TABLE will create partition "mpp21090_pttab_addcol_addpt_dropcol_char_1_prt_partthree" for table "mpp21090_pttab_addcol_addpt_dropcol_char"
INSERT INTO mpp21090_pttab_addcol_addpt_dropcol_char VALUES('x','x','a',0);
ALTER TABLE mpp21090_pttab_addcol_addpt_dropcol_char ADD COLUMN col5 char DEFAULT 'x';
ALTER TABLE mpp21090_pttab_addcol_addpt_dropcol_char ADD PARTITION partfour VALUES('y','z','-');
NOTICE:  CREATE TABLE will create partition "mpp21090_pttab_addcol_addpt_dropcol_char_1_prt_partfour" for table "mpp21090_pttab_addcol_addpt_dropcol_char"
INSERT INTO mpp21090_pttab_addcol_addpt_dropcol_char SELECT 'z','z','b',1, 'z';
SELECT * FROM mpp21090_pttab_addcol_addpt_dropcol_char ORDER BY 1,2,3;
 col1 | col2 | col3 | col4 | col5 
------+------+------+------+------
 x    | x    | a    |    0 | x
 z    | z    | b    |    1 | z
(2 rows)

ALTER TABLE mpp21090_pttab_addcol_addpt_dropcol_char DROP COLUMN col1;
NOTICE:  Dropping a column that is part of the distribution policy forces a NULL distribution policy
NOTICE:  Dropping a column that is part of the distribution policy forces a NULL distribution policy
NOTICE:  Dropping a column that is part of the distribution policy forces a NULL distribution policy
NOTICE:  Dropping a column that is part of the distribution policy forces a NULL distribution policy
NOTICE:  Dropping a column that is part of the distribution policy forces a NULL distribution policy
INSERT INTO mpp21090_pttab_addcol_addpt_dropcol_char SELECT 'z','c',1, 'z';
SELECT * FROM mpp21090_pttab_addcol_addpt_dropcol_char ORDER BY 1,2,3;
 col2 | col3 | col4 | col5 
------+------+------+------
 x    | a    |    0 | x
 z    | b    |    1 | z
 z    | c    |    1 | z
(3 rows)

UPDATE mpp21090_pttab_addcol_addpt_dropcol_char SET col5 = '-' WHERE col2 = 'z' and col3='c';
SELECT * FROM mpp21090_pttab_addcol_addpt_dropcol_char ORDER BY 1,2,3;
 col2 | col3 | col4 | col5 
------+------+------+------
 x    | a    |    0 | x
 z    | b    |    1 | z
 z    | c    |    1 | -
(3 rows)

-- Update partition key
UPDATE mpp21090_pttab_addcol_addpt_dropcol_char SET col2 = '-' WHERE col2 = 'z' and col3='c';
SELECT * FROM mpp21090_pttab_addcol_addpt_dropcol_char ORDER BY 1,2,3;
 col2 | col3 | col4 | col5 
------+------+------+------
 -    | c    |    1 | -
 x    | a    |    0 | x
 z    | b    |    1 | z
(3 rows)

DELETE FROM mpp21090_pttab_addcol_addpt_dropcol_char WHERE col2 = '-';
SELECT * FROM mpp21090_pttab_addcol_addpt_dropcol_char ORDER BY 1,2,3;
 col2 | col3 | col4 | col5 
------+------+------+------
 x    | a    |    0 | x
 z    | b    |    1 | z
(2 rows)

-- TEST
DROP TABLE IF EXISTS mpp21090_pttab_addcol_addpt_dropcol_decimal;
NOTICE:  table "mpp21090_pttab_addcol_addpt_dropcol_decimal" does not exist, skipping
CREATE TABLE mpp21090_pttab_addcol_addpt_dropcol_decimal
(
    col1 decimal,
    col2 decimal,
    col3 char,
    col4 int
) 
DISTRIBUTED by (col1)
PARTITION BY RANGE(col2)(partition partone start(1.00) end(10.00)  WITH (APPENDONLY=true, COMPRESSLEVEL=5, ORIENTATION=column),partition parttwo start(10.00) end(20.00) WITH (APPENDONLY=true, COMPRESSLEVEL=5, ORIENTATION=row),partition partthree start(20.00) end(30.00));
NOTICE:  CREATE TABLE will create partition "mpp21090_pttab_addcol_addpt_dropcol_decimal_1_prt_partone" for table "mpp21090_pttab_addcol_addpt_dropcol_decimal"
NOTICE:  CREATE TABLE will create partition "mpp21090_pttab_addcol_addpt_dropcol_decimal_1_prt_parttwo" for table "mpp21090_pttab_addcol_addpt_dropcol_decimal"
NOTICE:  CREATE TABLE will create partition "mpp21090_pttab_addcol_addpt_dropcol_decimal_1_prt_partthree" for table "mpp21090_pttab_addcol_addpt_dropcol_decimal"
INSERT INTO mpp21090_pttab_addcol_addpt_dropcol_decimal VALUES(2.00,2.00,'a',0);
ALTER TABLE mpp21090_pttab_addcol_addpt_dropcol_decimal ADD COLUMN col5 decimal DEFAULT 2.00;
ALTER TABLE mpp21090_pttab_addcol_addpt_dropcol_decimal ADD PARTITION partfour start(30.00) end(40.00) inclusive;
NOTICE:  CREATE TABLE will create partition "mpp21090_pttab_addcol_addpt_dropcol_decimal_1_prt_partfour" for table "mpp21090_pttab_addcol_addpt_dropcol_decimal"
INSERT INTO mpp21090_pttab_addcol_addpt_dropcol_decimal SELECT 35.00,35.00,'b',1, 35.00;
SELECT * FROM mpp21090_pttab_addcol_addpt_dropcol_decimal ORDER BY 1,2,3;
 col1  | col2  | col3 | col4 | col5  
-------+-------+------+------+-------
  2.00 |  2.00 | a    |    0 |  2.00
 35.00 | 35.00 | b    |    1 | 35.00
(2 rows)

ALTER TABLE mpp21090_pttab_addcol_addpt_dropcol_decimal DROP COLUMN col1;
NOTICE:  Dropping a column that is part of the distribution policy forces a NULL distribution policy
NOTICE:  Dropping a column that is part of the distribution policy forces a NULL distribution policy
NOTICE:  Dropping a column that is part of the distribution policy forces a NULL distribution policy
NOTICE:  Dropping a column that is part of the distribution policy forces a NULL distribution policy
NOTICE:  Dropping a column that is part of the distribution policy forces a NULL distribution policy
INSERT INTO mpp21090_pttab_addcol_addpt_dropcol_decimal SELECT 35.00,'c',1, 35.00;
SELECT * FROM mpp21090_pttab_addcol_addpt_dropcol_decimal ORDER BY 1,2,3;
 col2  | col3 | col4 | col5  
-------+------+------+-------
  2.00 | a    |    0 |  2.00
 35.00 | b    |    1 | 35.00
 35.00 | c    |    1 | 35.00
(3 rows)

UPDATE mpp21090_pttab_addcol_addpt_dropcol_decimal SET col5 = 1.00 WHERE col2 = 35.00 and col3='c';
SELECT * FROM mpp21090_pttab_addcol_addpt_dropcol_decimal ORDER BY 1,2,3;
 col2  | col3 | col4 | col5  
-------+------+------+-------
  2.00 | a    |    0 |  2.00
 35.00 | b    |    1 | 35.00
 35.00 | c    |    1 |  1.00
(3 rows)

-- Update partition key
UPDATE mpp21090_pttab_addcol_addpt_dropcol_decimal SET col2 = 1.00 WHERE col2 = 35.00 and col3='c';
ERROR:  moving tuple from partition "mpp21090_pttab_addcol_addpt_dropcol_decimal_1_prt_partfour" to partition "mpp21090_pttab_addcol_addpt_dropcol_decimal_1_prt_partone" not supported  (seg2 127.0.0.1:40002 pid=9831)
SELECT * FROM mpp21090_pttab_addcol_addpt_dropcol_decimal ORDER BY 1,2,3;
 col2  | col3 | col4 | col5  
-------+------+------+-------
  2.00 | a    |    0 |  2.00
 35.00 | b    |    1 | 35.00
 35.00 | c    |    1 |  1.00
(3 rows)

DELETE FROM mpp21090_pttab_addcol_addpt_dropcol_decimal WHERE col2 = 1.00;
SELECT * FROM mpp21090_pttab_addcol_addpt_dropcol_decimal ORDER BY 1,2,3;
 col2  | col3 | col4 | col5  
-------+------+------+-------
  2.00 | a    |    0 |  2.00
 35.00 | b    |    1 | 35.00
 35.00 | c    |    1 |  1.00
(3 rows)

-- TEST
DROP TABLE IF EXISTS mpp21090_pttab_addcol_addpt_dropcol_int4;
NOTICE:  table "mpp21090_pttab_addcol_addpt_dropcol_int4" does not exist, skipping
CREATE TABLE mpp21090_pttab_addcol_addpt_dropcol_int4
(
    col1 int4,
    col2 int4,
    col3 char,
    col4 int
) 
DISTRIBUTED by (col1)
PARTITION BY RANGE(col2)(partition partone start(1) end(100000001)  WITH (APPENDONLY=true, COMPRESSLEVEL=5, ORIENTATION=column),partition parttwo start(100000001) end(200000001) WITH (APPENDONLY=true, COMPRESSLEVEL=5, ORIENTATION=row),partition partthree start(200000001) end(300000001));
NOTICE:  CREATE TABLE will create partition "mpp21090_pttab_addcol_addpt_dropcol_int4_1_prt_partone" for table "mpp21090_pttab_addcol_addpt_dropcol_int4"
NOTICE:  CREATE TABLE will create partition "mpp21090_pttab_addcol_addpt_dropcol_int4_1_prt_parttwo" for table "mpp21090_pttab_addcol_addpt_dropcol_int4"
NOTICE:  CREATE TABLE will create partition "mpp21090_pttab_addcol_addpt_dropcol_int4_1_prt_partthree" for table "mpp21090_pttab_addcol_addpt_dropcol_int4"
INSERT INTO mpp21090_pttab_addcol_addpt_dropcol_int4 VALUES(20000000,20000000,'a',0);
ALTER TABLE mpp21090_pttab_addcol_addpt_dropcol_int4 ADD COLUMN col5 int4 DEFAULT 20000000;
ALTER TABLE mpp21090_pttab_addcol_addpt_dropcol_int4 ADD PARTITION partfour start(300000001) end(400000001);
NOTICE:  CREATE TABLE will create partition "mpp21090_pttab_addcol_addpt_dropcol_int4_1_prt_partfour" for table "mpp21090_pttab_addcol_addpt_dropcol_int4"
INSERT INTO mpp21090_pttab_addcol_addpt_dropcol_int4 SELECT 35000000,35000000,'b',1, 35000000;
SELECT * FROM mpp21090_pttab_addcol_addpt_dropcol_int4 ORDER BY 1,2,3;
   col1   |   col2   | col3 | col4 |   col5   
----------+----------+------+------+----------
 20000000 | 20000000 | a    |    0 | 20000000
 35000000 | 35000000 | b    |    1 | 35000000
(2 rows)

ALTER TABLE mpp21090_pttab_addcol_addpt_dropcol_int4 DROP COLUMN col1;
NOTICE:  Dropping a column that is part of the distribution policy forces a NULL distribution policy
NOTICE:  Dropping a column that is part of the distribution policy forces a NULL distribution policy
NOTICE:  Dropping a column that is part of the distribution policy forces a NULL distribution policy
NOTICE:  Dropping a column that is part of the distribution policy forces a NULL distribution policy
NOTICE:  Dropping a column that is part of the distribution policy forces a NULL distribution policy
INSERT INTO mpp21090_pttab_addcol_addpt_dropcol_int4 SELECT 35000000,'c',1, 35000000;
SELECT * FROM mpp21090_pttab_addcol_addpt_dropcol_int4 ORDER BY 1,2,3;
   col2   | col3 | col4 |   col5   
----------+------+------+----------
 20000000 | a    |    0 | 20000000
 35000000 | b    |    1 | 35000000
 35000000 | c    |    1 | 35000000
(3 rows)

UPDATE mpp21090_pttab_addcol_addpt_dropcol_int4 SET col5 = 10000000 WHERE col2 = 35000000 and col3='c';
SELECT * FROM mpp21090_pttab_addcol_addpt_dropcol_int4 ORDER BY 1,2,3;
   col2   | col3 | col4 |   col5   
----------+------+------+----------
 20000000 | a    |    0 | 20000000
 35000000 | b    |    1 | 35000000
 35000000 | c    |    1 | 10000000
(3 rows)

-- Update partition key
UPDATE mpp21090_pttab_addcol_addpt_dropcol_int4 SET col2 = 10000000 WHERE col2 = 35000000 and col3='c';
SELECT * FROM mpp21090_pttab_addcol_addpt_dropcol_int4 ORDER BY 1,2,3;
   col2   | col3 | col4 |   col5   
----------+------+------+----------
 10000000 | c    |    1 | 10000000
 20000000 | a    |    0 | 20000000
 35000000 | b    |    1 | 35000000
(3 rows)

DELETE FROM mpp21090_pttab_addcol_addpt_dropcol_int4 WHERE col2 = 10000000;
SELECT * FROM mpp21090_pttab_addcol_addpt_dropcol_int4 ORDER BY 1,2,3;
   col2   | col3 | col4 |   col5   
----------+------+------+----------
 20000000 | a    |    0 | 20000000
 35000000 | b    |    1 | 35000000
(2 rows)

-- TEST
DROP TABLE IF EXISTS mpp21090_pttab_addcol_addpt_dropcol_int8;
NOTICE:  table "mpp21090_pttab_addcol_addpt_dropcol_int8" does not exist, skipping
CREATE TABLE mpp21090_pttab_addcol_addpt_dropcol_int8
(
    col1 int8,
    col2 int8,
    col3 char,
    col4 int
) 
DISTRIBUTED by (col1)
PARTITION BY RANGE(col2)(partition partone start(1) end(1000000000000000001)  WITH (APPENDONLY=true, COMPRESSLEVEL=5, ORIENTATION=column),partition parttwo start(1000000000000000001) end(2000000000000000001) WITH (APPENDONLY=true, COMPRESSLEVEL=5, ORIENTATION=row),partition partthree start(2000000000000000001) end(3000000000000000001));
NOTICE:  CREATE TABLE will create partition "mpp21090_pttab_addcol_addpt_dropcol_int8_1_prt_partone" for table "mpp21090_pttab_addcol_addpt_dropcol_int8"
NOTICE:  CREATE TABLE will create partition "mpp21090_pttab_addcol_addpt_dropcol_int8_1_prt_parttwo" for table "mpp21090_pttab_addcol_addpt_dropcol_int8"
NOTICE:  CREATE TABLE will create partition "mpp21090_pttab_addcol_addpt_dropcol_int8_1_prt_partthree" for table "mpp21090_pttab_addcol_addpt_dropcol_int8"
INSERT INTO mpp21090_pttab_addcol_addpt_dropcol_int8 VALUES(2000000000000000000,2000000000000000000,'a',0);
ALTER TABLE mpp21090_pttab_addcol_addpt_dropcol_int8 ADD COLUMN col5 int8 DEFAULT 2000000000000000000;
ALTER TABLE mpp21090_pttab_addcol_addpt_dropcol_int8 ADD PARTITION partfour start(3000000000000000001) end(4000000000000000001);
NOTICE:  CREATE TABLE will create partition "mpp21090_pttab_addcol_addpt_dropcol_int8_1_prt_partfour" for table "mpp21090_pttab_addcol_addpt_dropcol_int8"
INSERT INTO mpp21090_pttab_addcol_addpt_dropcol_int8 SELECT 3500000000000000000,3500000000000000000,'b',1, 3500000000000000000;
SELECT * FROM mpp21090_pttab_addcol_addpt_dropcol_int8 ORDER BY 1,2,3;
        col1         |        col2         | col3 | col4 |        col5         
---------------------+---------------------+------+------+---------------------
 2000000000000000000 | 2000000000000000000 | a    |    0 | 2000000000000000000
 3500000000000000000 | 3500000000000000000 | b    |    1 | 3500000000000000000
(2 rows)

ALTER TABLE mpp21090_pttab_addcol_addpt_dropcol_int8 DROP COLUMN col1;
NOTICE:  Dropping a column that is part of the distribution policy forces a NULL distribution policy
NOTICE:  Dropping a column that is part of the distribution policy forces a NULL distribution policy
NOTICE:  Dropping a column that is part of the distribution policy forces a NULL distribution policy
NOTICE:  Dropping a column that is part of the distribution policy forces a NULL distribution policy
NOTICE:  Dropping a column that is part of the distribution policy forces a NULL distribution policy
INSERT INTO mpp21090_pttab_addcol_addpt_dropcol_int8 SELECT 3500000000000000000,'c',1, 3500000000000000000;
SELECT * FROM mpp21090_pttab_addcol_addpt_dropcol_int8 ORDER BY 1,2,3;
        col2         | col3 | col4 |        col5         
---------------------+------+------+---------------------
 2000000000000000000 | a    |    0 | 2000000000000000000
 3500000000000000000 | b    |    1 | 3500000000000000000
 3500000000000000000 | c    |    1 | 3500000000000000000
(3 rows)

UPDATE mpp21090_pttab_addcol_addpt_dropcol_int8 SET col5 = 1000000000000000000 WHERE col2 = 3500000000000000000 and col3='c';
SELECT * FROM mpp21090_pttab_addcol_addpt_dropcol_int8 ORDER BY 1,2,3;
        col2         | col3 | col4 |        col5         
---------------------+------+------+---------------------
 2000000000000000000 | a    |    0 | 2000000000000000000
 3500000000000000000 | b    |    1 | 3500000000000000000
 3500000000000000000 | c    |    1 | 1000000000000000000
(3 rows)

-- Update partition key
UPDATE mpp21090_pttab_addcol_addpt_dropcol_int8 SET col2 = 1000000000000000000 WHERE col2 = 3500000000000000000 and col3='c';
ERROR:  moving tuple from partition "mpp21090_pttab_addcol_addpt_dropcol_int8_1_prt_partfour" to partition "mpp21090_pttab_addcol_addpt_dropcol_int8_1_prt_partone" not supported  (seg1 127.0.0.1:40001 pid=9830)
SELECT * FROM mpp21090_pttab_addcol_addpt_dropcol_int8 ORDER BY 1,2,3;
        col2         | col3 | col4 |        col5         
---------------------+------+------+---------------------
 2000000000000000000 | a    |    0 | 2000000000000000000
 3500000000000000000 | b    |    1 | 3500000000000000000
 3500000000000000000 | c    |    1 | 1000000000000000000
(3 rows)

DELETE FROM mpp21090_pttab_addcol_addpt_dropcol_int8 WHERE col2 = 1000000000000000000;
SELECT * FROM mpp21090_pttab_addcol_addpt_dropcol_int8 ORDER BY 1,2,3;
        col2         | col3 | col4 |        col5         
---------------------+------+------+---------------------
 2000000000000000000 | a    |    0 | 2000000000000000000
 3500000000000000000 | b    |    1 | 3500000000000000000
 3500000000000000000 | c    |    1 | 1000000000000000000
(3 rows)

-- TEST
DROP TABLE IF EXISTS mpp21090_pttab_addcol_addpt_dropcol_interval;
NOTICE:  table "mpp21090_pttab_addcol_addpt_dropcol_interval" does not exist, skipping
CREATE TABLE mpp21090_pttab_addcol_addpt_dropcol_interval
(
    col1 interval,
    col2 interval,
    col3 char,
    col4 int
) 
DISTRIBUTED by (col1)
PARTITION BY RANGE(col2)(partition partone start('1 sec') end('1 min')  WITH (APPENDONLY=true, COMPRESSLEVEL=5, ORIENTATION=column),partition parttwo start('1 min') end('1 hour') WITH (APPENDONLY=true, COMPRESSLEVEL=5, ORIENTATION=row),partition partthree start('1 hour') end('12 hours'));
NOTICE:  CREATE TABLE will create partition "mpp21090_pttab_addcol_addpt_dropcol_interval_1_prt_partone" for table "mpp21090_pttab_addcol_addpt_dropcol_interval"
NOTICE:  CREATE TABLE will create partition "mpp21090_pttab_addcol_addpt_dropcol_interval_1_prt_parttwo" for table "mpp21090_pttab_addcol_addpt_dropcol_interval"
NOTICE:  CREATE TABLE will create partition "mpp21090_pttab_addcol_addpt_dropcol_interval_1_prt_partthree" for table "mpp21090_pttab_addcol_addpt_dropcol_interval"
INSERT INTO mpp21090_pttab_addcol_addpt_dropcol_interval VALUES('1 hour','1 hour','a',0);
ALTER TABLE mpp21090_pttab_addcol_addpt_dropcol_interval ADD COLUMN col5 interval DEFAULT '1 hour';
ALTER TABLE mpp21090_pttab_addcol_addpt_dropcol_interval ADD PARTITION partfour start('12 hours') end('1 day') inclusive;
NOTICE:  CREATE TABLE will create partition "mpp21090_pttab_addcol_addpt_dropcol_interval_1_prt_partfour" for table "mpp21090_pttab_addcol_addpt_dropcol_interval"
INSERT INTO mpp21090_pttab_addcol_addpt_dropcol_interval SELECT '14 hours','14 hours','b',1, '14 hours';
SELECT * FROM mpp21090_pttab_addcol_addpt_dropcol_interval ORDER BY 1,2,3;
   col1   |   col2   | col3 | col4 |   col5   
----------+----------+------+------+----------
 01:00:00 | 01:00:00 | a    |    0 | 01:00:00
 14:00:00 | 14:00:00 | b    |    1 | 14:00:00
(2 rows)

ALTER TABLE mpp21090_pttab_addcol_addpt_dropcol_interval DROP COLUMN col1;
NOTICE:  Dropping a column that is part of the distribution policy forces a NULL distribution policy
NOTICE:  Dropping a column that is part of the distribution policy forces a NULL distribution policy
NOTICE:  Dropping a column that is part of the distribution policy forces a NULL distribution policy
NOTICE:  Dropping a column that is part of the distribution policy forces a NULL distribution policy
NOTICE:  Dropping a column that is part of the distribution policy forces a NULL distribution policy
INSERT INTO mpp21090_pttab_addcol_addpt_dropcol_interval SELECT '14 hours','c',1, '14 hours';
SELECT * FROM mpp21090_pttab_addcol_addpt_dropcol_interval ORDER BY 1,2,3;
   col2   | col3 | col4 |   col5   
----------+------+------+----------
 01:00:00 | a    |    0 | 01:00:00
 14:00:00 | b    |    1 | 14:00:00
 14:00:00 | c    |    1 | 14:00:00
(3 rows)

UPDATE mpp21090_pttab_addcol_addpt_dropcol_interval SET col5 = '12 hours' WHERE col2 = '14 hours' and col3='c';
SELECT * FROM mpp21090_pttab_addcol_addpt_dropcol_interval ORDER BY 1,2,3;
   col2   | col3 | col4 |   col5   
----------+------+------+----------
 01:00:00 | a    |    0 | 01:00:00
 14:00:00 | b    |    1 | 14:00:00
 14:00:00 | c    |    1 | 12:00:00
(3 rows)

-- Update partition key
UPDATE mpp21090_pttab_addcol_addpt_dropcol_interval SET col2 = '12 hours' WHERE col2 = '14 hours' and col3='c';
SELECT * FROM mpp21090_pttab_addcol_addpt_dropcol_interval ORDER BY 1,2,3;
   col2   | col3 | col4 |   col5   
----------+------+------+----------
 01:00:00 | a    |    0 | 01:00:00
 12:00:00 | c    |    1 | 12:00:00
 14:00:00 | b    |    1 | 14:00:00
(3 rows)

DELETE FROM mpp21090_pttab_addcol_addpt_dropcol_interval WHERE col2 = '12 hours';
SELECT * FROM mpp21090_pttab_addcol_addpt_dropcol_interval ORDER BY 1,2,3;
   col2   | col3 | col4 |   col5   
----------+------+------+----------
 01:00:00 | a    |    0 | 01:00:00
 14:00:00 | b    |    1 | 14:00:00
(2 rows)

-- TEST
DROP TABLE IF EXISTS mpp21090_pttab_addcol_addpt_dropcol_numeric;
NOTICE:  table "mpp21090_pttab_addcol_addpt_dropcol_numeric" does not exist, skipping
CREATE TABLE mpp21090_pttab_addcol_addpt_dropcol_numeric
(
    col1 numeric,
    col2 numeric,
    col3 char,
    col4 int
) 
DISTRIBUTED by (col1)
PARTITION BY RANGE(col2)(partition partone start(1.000000) end(10.000000)  WITH (APPENDONLY=true, COMPRESSLEVEL=5, ORIENTATION=column),partition parttwo start(10.000000) end(20.000000) WITH (APPENDONLY=true, COMPRESSLEVEL=5, ORIENTATION=row),partition partthree start(20.000000) end(30.000000));
NOTICE:  CREATE TABLE will create partition "mpp21090_pttab_addcol_addpt_dropcol_numeric_1_prt_partone" for table "mpp21090_pttab_addcol_addpt_dropcol_numeric"
NOTICE:  CREATE TABLE will create partition "mpp21090_pttab_addcol_addpt_dropcol_numeric_1_prt_parttwo" for table "mpp21090_pttab_addcol_addpt_dropcol_numeric"
NOTICE:  CREATE TABLE will create partition "mpp21090_pttab_addcol_addpt_dropcol_numeric_1_prt_partthree" for table "mpp21090_pttab_addcol_addpt_dropcol_numeric"
INSERT INTO mpp21090_pttab_addcol_addpt_dropcol_numeric VALUES(2.000000,2.000000,'a',0);
ALTER TABLE mpp21090_pttab_addcol_addpt_dropcol_numeric ADD COLUMN col5 numeric DEFAULT 2.000000;
ALTER TABLE mpp21090_pttab_addcol_addpt_dropcol_numeric ADD PARTITION partfour start(30.000000) end(40.000000) inclusive;
NOTICE:  CREATE TABLE will create partition "mpp21090_pttab_addcol_addpt_dropcol_numeric_1_prt_partfour" for table "mpp21090_pttab_addcol_addpt_dropcol_numeric"
INSERT INTO mpp21090_pttab_addcol_addpt_dropcol_numeric SELECT 35.000000,35.000000,'b',1, 35.000000;
SELECT * FROM mpp21090_pttab_addcol_addpt_dropcol_numeric ORDER BY 1,2,3;
   col1    |   col2    | col3 | col4 |   col5    
-----------+-----------+------+------+-----------
  2.000000 |  2.000000 | a    |    0 |  2.000000
 35.000000 | 35.000000 | b    |    1 | 35.000000
(2 rows)

ALTER TABLE mpp21090_pttab_addcol_addpt_dropcol_numeric DROP COLUMN col1;
NOTICE:  Dropping a column that is part of the distribution policy forces a NULL distribution policy
NOTICE:  Dropping a column that is part of the distribution policy forces a NULL distribution policy
NOTICE:  Dropping a column that is part of the distribution policy forces a NULL distribution policy
NOTICE:  Dropping a column that is part of the distribution policy forces a NULL distribution policy
NOTICE:  Dropping a column that is part of the distribution policy forces a NULL distribution policy
INSERT INTO mpp21090_pttab_addcol_addpt_dropcol_numeric SELECT 35.000000,'c',1, 35.000000;
SELECT * FROM mpp21090_pttab_addcol_addpt_dropcol_numeric ORDER BY 1,2,3;
   col2    | col3 | col4 |   col5    
-----------+------+------+-----------
  2.000000 | a    |    0 |  2.000000
 35.000000 | b    |    1 | 35.000000
 35.000000 | c    |    1 | 35.000000
(3 rows)

UPDATE mpp21090_pttab_addcol_addpt_dropcol_numeric SET col5 = 1.000000 WHERE col2 = 35.000000 and col3='c';
SELECT * FROM mpp21090_pttab_addcol_addpt_dropcol_numeric ORDER BY 1,2,3;
   col2    | col3 | col4 |   col5    
-----------+------+------+-----------
  2.000000 | a    |    0 |  2.000000
 35.000000 | b    |    1 | 35.000000
 35.000000 | c    |    1 |  1.000000
(3 rows)

-- Update partition key
UPDATE mpp21090_pttab_addcol_addpt_dropcol_numeric SET col2 = 1.000000 WHERE col2 = 35.000000 and col3='c';
ERROR:  moving tuple from partition "mpp21090_pttab_addcol_addpt_dropcol_numeric_1_prt_partfour" to partition "mpp21090_pttab_addcol_addpt_dropcol_numeric_1_prt_partone" not supported  (seg1 127.0.0.1:40001 pid=9830)
SELECT * FROM mpp21090_pttab_addcol_addpt_dropcol_numeric ORDER BY 1,2,3;
   col2    | col3 | col4 |   col5    
-----------+------+------+-----------
  2.000000 | a    |    0 |  2.000000
 35.000000 | b    |    1 | 35.000000
 35.000000 | c    |    1 |  1.000000
(3 rows)

DELETE FROM mpp21090_pttab_addcol_addpt_dropcol_numeric WHERE col2 = 1.000000;
SELECT * FROM mpp21090_pttab_addcol_addpt_dropcol_numeric ORDER BY 1,2,3;
   col2    | col3 | col4 |   col5    
-----------+------+------+-----------
  2.000000 | a    |    0 |  2.000000
 35.000000 | b    |    1 | 35.000000
 35.000000 | c    |    1 |  1.000000
(3 rows)

-- TEST
DROP TABLE IF EXISTS mpp21090_pttab_addcol_addpt_dropcol_text;
NOTICE:  table "mpp21090_pttab_addcol_addpt_dropcol_text" does not exist, skipping
CREATE TABLE mpp21090_pttab_addcol_addpt_dropcol_text
(
    col1 text,
    col2 text,
    col3 char,
    col4 int
) 
DISTRIBUTED by (col1)
PARTITION BY LIST(col2)(partition partone VALUES('abcdefghijklmnop') WITH (APPENDONLY=true, COMPRESSLEVEL=5, ORIENTATION=column),partition parttwo VALUES('qrstuvwxyz') WITH (APPENDONLY=true, COMPRESSLEVEL=5, ORIENTATION=row),partition partthree VALUES('ghi'));
NOTICE:  CREATE TABLE will create partition "mpp21090_pttab_addcol_addpt_dropcol_text_1_prt_partone" for table "mpp21090_pttab_addcol_addpt_dropcol_text"
NOTICE:  CREATE TABLE will create partition "mpp21090_pttab_addcol_addpt_dropcol_text_1_prt_parttwo" for table "mpp21090_pttab_addcol_addpt_dropcol_text"
NOTICE:  CREATE TABLE will create partition "mpp21090_pttab_addcol_addpt_dropcol_text_1_prt_partthree" for table "mpp21090_pttab_addcol_addpt_dropcol_text"
INSERT INTO mpp21090_pttab_addcol_addpt_dropcol_text VALUES('abcdefghijklmnop','abcdefghijklmnop','a',0);
ALTER TABLE mpp21090_pttab_addcol_addpt_dropcol_text ADD COLUMN col5 text DEFAULT 'abcdefghijklmnop';
ALTER TABLE mpp21090_pttab_addcol_addpt_dropcol_text ADD PARTITION partfour VALUES('xyz');
NOTICE:  CREATE TABLE will create partition "mpp21090_pttab_addcol_addpt_dropcol_text_1_prt_partfour" for table "mpp21090_pttab_addcol_addpt_dropcol_text"
INSERT INTO mpp21090_pttab_addcol_addpt_dropcol_text SELECT 'xyz','xyz','b',1, 'xyz';
SELECT * FROM mpp21090_pttab_addcol_addpt_dropcol_text ORDER BY 1,2,3;
       col1       |       col2       | col3 | col4 |       col5       
------------------+------------------+------+------+------------------
 abcdefghijklmnop | abcdefghijklmnop | a    |    0 | abcdefghijklmnop
 xyz              | xyz              | b    |    1 | xyz
(2 rows)

ALTER TABLE mpp21090_pttab_addcol_addpt_dropcol_text DROP COLUMN col1;
NOTICE:  Dropping a column that is part of the distribution policy forces a NULL distribution policy
NOTICE:  Dropping a column that is part of the distribution policy forces a NULL distribution policy
NOTICE:  Dropping a column that is part of the distribution policy forces a NULL distribution policy
NOTICE:  Dropping a column that is part of the distribution policy forces a NULL distribution policy
NOTICE:  Dropping a column that is part of the distribution policy forces a NULL distribution policy
INSERT INTO mpp21090_pttab_addcol_addpt_dropcol_text SELECT 'xyz','c',1, 'xyz';
SELECT * FROM mpp21090_pttab_addcol_addpt_dropcol_text ORDER BY 1,2,3;
       col2       | col3 | col4 |       col5       
------------------+------+------+------------------
 abcdefghijklmnop | a    |    0 | abcdefghijklmnop
 xyz              | b    |    1 | xyz
 xyz              | c    |    1 | xyz
(3 rows)

UPDATE mpp21090_pttab_addcol_addpt_dropcol_text SET col5 = 'qrstuvwxyz' WHERE col2 = 'xyz' and col3='c';
SELECT * FROM mpp21090_pttab_addcol_addpt_dropcol_text ORDER BY 1,2,3;
       col2       | col3 | col4 |       col5       
------------------+------+------+------------------
 abcdefghijklmnop | a    |    0 | abcdefghijklmnop
 xyz              | b    |    1 | xyz
 xyz              | c    |    1 | qrstuvwxyz
(3 rows)

-- Update partition key
UPDATE mpp21090_pttab_addcol_addpt_dropcol_text SET col2 = 'qrstuvwxyz' WHERE col2 = 'xyz' and col3='c';
ERROR:  moving tuple from partition "mpp21090_pttab_addcol_addpt_dropcol_text_1_prt_partfour" to partition "mpp21090_pttab_addcol_addpt_dropcol_text_1_prt_parttwo" not supported  (seg0 127.0.0.1:40000 pid=9829)
SELECT * FROM mpp21090_pttab_addcol_addpt_dropcol_text ORDER BY 1,2,3;
       col2       | col3 | col4 |       col5       
------------------+------+------+------------------
 abcdefghijklmnop | a    |    0 | abcdefghijklmnop
 xyz              | b    |    1 | xyz
 xyz              | c    |    1 | qrstuvwxyz
(3 rows)

DELETE FROM mpp21090_pttab_addcol_addpt_dropcol_text WHERE col2 = 'qrstuvwxyz';
SELECT * FROM mpp21090_pttab_addcol_addpt_dropcol_text ORDER BY 1,2,3;
       col2       | col3 | col4 |       col5       
------------------+------+------+------------------
 abcdefghijklmnop | a    |    0 | abcdefghijklmnop
 xyz              | b    |    1 | xyz
 xyz              | c    |    1 | qrstuvwxyz
(3 rows)

-- TEST
DROP TABLE IF EXISTS mpp21090_pttab_addpt_dropcol_addcol_dml_char;
NOTICE:  table "mpp21090_pttab_addpt_dropcol_addcol_dml_char" does not exist, skipping
CREATE TABLE mpp21090_pttab_addpt_dropcol_addcol_dml_char
(
    col1 char,
    col2 char,
    col3 char,
    col4 int
) 
DISTRIBUTED by (col1)
PARTITION BY LIST(col2)(partition partone VALUES('a','b','c','d','e','f','g','h') WITH (APPENDONLY=true, COMPRESSLEVEL=5, ORIENTATION=column),partition parttwo VALUES('i','j','k','l','m','n','o','p') WITH (APPENDONLY=true, COMPRESSLEVEL=5, ORIENTATION=row),partition partthree VALUES('q','r','s','t','u','v','w','x'));
NOTICE:  CREATE TABLE will create partition "mpp21090_pttab_addpt_dropcol_addcol_dml_char_1_prt_partone" for table "mpp21090_pttab_addpt_dropcol_addcol_dml_char"
NOTICE:  CREATE TABLE will create partition "mpp21090_pttab_addpt_dropcol_addcol_dml_char_1_prt_parttwo" for table "mpp21090_pttab_addpt_dropcol_addcol_dml_char"
NOTICE:  CREATE TABLE will create partition "mpp21090_pttab_addpt_dropcol_addcol_dml_char_1_prt_partthree" for table "mpp21090_pttab_addpt_dropcol_addcol_dml_char"
INSERT INTO mpp21090_pttab_addpt_dropcol_addcol_dml_char VALUES('x','x','a',0);
ALTER TABLE mpp21090_pttab_addpt_dropcol_addcol_dml_char ADD PARTITION partfour VALUES('y','z','-');
NOTICE:  CREATE TABLE will create partition "mpp21090_pttab_addpt_dropcol_addcol_dml_char_1_prt_partfour" for table "mpp21090_pttab_addpt_dropcol_addcol_dml_char"
INSERT INTO mpp21090_pttab_addpt_dropcol_addcol_dml_char SELECT 'z','z','b',1;
SELECT * FROM mpp21090_pttab_addpt_dropcol_addcol_dml_char ORDER BY 1,2,3;
 col1 | col2 | col3 | col4 
------+------+------+------
 x    | x    | a    |    0
 z    | z    | b    |    1
(2 rows)

ALTER TABLE mpp21090_pttab_addpt_dropcol_addcol_dml_char DROP COLUMN col1;
NOTICE:  Dropping a column that is part of the distribution policy forces a NULL distribution policy
NOTICE:  Dropping a column that is part of the distribution policy forces a NULL distribution policy
NOTICE:  Dropping a column that is part of the distribution policy forces a NULL distribution policy
NOTICE:  Dropping a column that is part of the distribution policy forces a NULL distribution policy
NOTICE:  Dropping a column that is part of the distribution policy forces a NULL distribution policy
INSERT INTO mpp21090_pttab_addpt_dropcol_addcol_dml_char SELECT 'z','c',1;
SELECT * FROM mpp21090_pttab_addpt_dropcol_addcol_dml_char ORDER BY 1,2,3;
 col2 | col3 | col4 
------+------+------
 x    | a    |    0
 z    | b    |    1
 z    | c    |    1
(3 rows)

ALTER TABLE mpp21090_pttab_addpt_dropcol_addcol_dml_char ADD COLUMN col5 char DEFAULT 'x';
INSERT INTO mpp21090_pttab_addpt_dropcol_addcol_dml_char SELECT 'z','d',1,'z';
SELECT * FROM mpp21090_pttab_addpt_dropcol_addcol_dml_char ORDER BY 1,2,3;
 col2 | col3 | col4 | col5 
------+------+------+------
 x    | a    |    0 | x
 z    | b    |    1 | x
 z    | c    |    1 | x
 z    | d    |    1 | z
(4 rows)

UPDATE mpp21090_pttab_addpt_dropcol_addcol_dml_char SET col4 = 10 WHERE col2 = 'z';
SELECT * FROM mpp21090_pttab_addpt_dropcol_addcol_dml_char ORDER BY 1,2,3;
 col2 | col3 | col4 | col5 
------+------+------+------
 x    | a    |    0 | x
 z    | b    |   10 | x
 z    | c    |   10 | x
 z    | d    |   10 | z
(4 rows)

-- Update partition key
UPDATE mpp21090_pttab_addpt_dropcol_addcol_dml_char SET col2 = '-' WHERE col2 = 'z';
SELECT * FROM mpp21090_pttab_addpt_dropcol_addcol_dml_char ORDER BY 1,2,3;
 col2 | col3 | col4 | col5 
------+------+------+------
 -    | b    |   10 | x
 -    | c    |   10 | x
 -    | d    |   10 | z
 x    | a    |    0 | x
(4 rows)

DELETE FROM mpp21090_pttab_addpt_dropcol_addcol_dml_char WHERE col2 = '-';
SELECT * FROM mpp21090_pttab_addpt_dropcol_addcol_dml_char ORDER BY 1,2,3;
 col2 | col3 | col4 | col5 
------+------+------+------
 x    | a    |    0 | x
(1 row)

-- TEST
DROP TABLE IF EXISTS mpp21090_pttab_addpt_dropcol_addcol_dml_decimal;
NOTICE:  table "mpp21090_pttab_addpt_dropcol_addcol_dml_decimal" does not exist, skipping
CREATE TABLE mpp21090_pttab_addpt_dropcol_addcol_dml_decimal
(
    col1 decimal,
    col2 decimal,
    col3 char,
    col4 int
) 
DISTRIBUTED by (col1)
PARTITION BY RANGE(col2)(partition partone start(1.00) end(10.00)  WITH (APPENDONLY=true, COMPRESSLEVEL=5, ORIENTATION=column),partition parttwo start(10.00) end(20.00) WITH (APPENDONLY=true, COMPRESSLEVEL=5, ORIENTATION=row),partition partthree start(20.00) end(30.00));
NOTICE:  CREATE TABLE will create partition "mpp21090_pttab_addpt_dropcol_addcol_dml_decimal_1_prt_partone" for table "mpp21090_pttab_addpt_dropcol_addcol_dml_decimal"
NOTICE:  CREATE TABLE will create partition "mpp21090_pttab_addpt_dropcol_addcol_dml_decimal_1_prt_parttwo" for table "mpp21090_pttab_addpt_dropcol_addcol_dml_decimal"
NOTICE:  CREATE TABLE will create partition "mpp21090_pttab_addpt_dropcol_addcol_dml_decimal_1_prt_partthree" for table "mpp21090_pttab_addpt_dropcol_addcol_dml_decimal"
INSERT INTO mpp21090_pttab_addpt_dropcol_addcol_dml_decimal VALUES(2.00,2.00,'a',0);
ALTER TABLE mpp21090_pttab_addpt_dropcol_addcol_dml_decimal ADD PARTITION partfour start(30.00) end(40.00) inclusive;
NOTICE:  CREATE TABLE will create partition "mpp21090_pttab_addpt_dropcol_addcol_dml_decimal_1_prt_partfour" for table "mpp21090_pttab_addpt_dropcol_addcol_dml_decimal"
INSERT INTO mpp21090_pttab_addpt_dropcol_addcol_dml_decimal SELECT 35.00,35.00,'b',1;
SELECT * FROM mpp21090_pttab_addpt_dropcol_addcol_dml_decimal ORDER BY 1,2,3;
 col1  | col2  | col3 | col4 
-------+-------+------+------
  2.00 |  2.00 | a    |    0
 35.00 | 35.00 | b    |    1
(2 rows)

ALTER TABLE mpp21090_pttab_addpt_dropcol_addcol_dml_decimal DROP COLUMN col1;
NOTICE:  Dropping a column that is part of the distribution policy forces a NULL distribution policy
NOTICE:  Dropping a column that is part of the distribution policy forces a NULL distribution policy
NOTICE:  Dropping a column that is part of the distribution policy forces a NULL distribution policy
NOTICE:  Dropping a column that is part of the distribution policy forces a NULL distribution policy
NOTICE:  Dropping a column that is part of the distribution policy forces a NULL distribution policy
INSERT INTO mpp21090_pttab_addpt_dropcol_addcol_dml_decimal SELECT 35.00,'c',1;
SELECT * FROM mpp21090_pttab_addpt_dropcol_addcol_dml_decimal ORDER BY 1,2,3;
 col2  | col3 | col4 
-------+------+------
  2.00 | a    |    0
 35.00 | b    |    1
 35.00 | c    |    1
(3 rows)

ALTER TABLE mpp21090_pttab_addpt_dropcol_addcol_dml_decimal ADD COLUMN col5 decimal DEFAULT 2.00;
INSERT INTO mpp21090_pttab_addpt_dropcol_addcol_dml_decimal SELECT 35.00,'d',1,35.00;
SELECT * FROM mpp21090_pttab_addpt_dropcol_addcol_dml_decimal ORDER BY 1,2,3;
 col2  | col3 | col4 | col5  
-------+------+------+-------
  2.00 | a    |    0 |  2.00
 35.00 | b    |    1 |  2.00
 35.00 | c    |    1 |  2.00
 35.00 | d    |    1 | 35.00
(4 rows)

UPDATE mpp21090_pttab_addpt_dropcol_addcol_dml_decimal SET col4 = 10 WHERE col2 = 35.00;
SELECT * FROM mpp21090_pttab_addpt_dropcol_addcol_dml_decimal ORDER BY 1,2,3;
 col2  | col3 | col4 | col5  
-------+------+------+-------
  2.00 | a    |    0 |  2.00
 35.00 | b    |   10 |  2.00
 35.00 | c    |   10 |  2.00
 35.00 | d    |   10 | 35.00
(4 rows)

-- Update partition key
UPDATE mpp21090_pttab_addpt_dropcol_addcol_dml_decimal SET col2 = 1.00 WHERE col2 = 35.00;
ERROR:  moving tuple from partition "mpp21090_pttab_addpt_dropcol_addcol_dml_decimal_1_prt_partfour" to partition "mpp21090_pttab_addpt_dropcol_addcol_dml_decimal_1_prt_partone" not supported  (seg0 127.0.0.1:40000 pid=9829)
SELECT * FROM mpp21090_pttab_addpt_dropcol_addcol_dml_decimal ORDER BY 1,2,3;
 col2  | col3 | col4 | col5  
-------+------+------+-------
  2.00 | a    |    0 |  2.00
 35.00 | b    |   10 |  2.00
 35.00 | c    |   10 |  2.00
 35.00 | d    |   10 | 35.00
(4 rows)

DELETE FROM mpp21090_pttab_addpt_dropcol_addcol_dml_decimal WHERE col2 = 1.00;
SELECT * FROM mpp21090_pttab_addpt_dropcol_addcol_dml_decimal ORDER BY 1,2,3;
 col2  | col3 | col4 | col5  
-------+------+------+-------
  2.00 | a    |    0 |  2.00
 35.00 | b    |   10 |  2.00
 35.00 | c    |   10 |  2.00
 35.00 | d    |   10 | 35.00
(4 rows)

-- TEST
DROP TABLE IF EXISTS mpp21090_pttab_addpt_dropcol_addcol_dml_int4;
NOTICE:  table "mpp21090_pttab_addpt_dropcol_addcol_dml_int4" does not exist, skipping
CREATE TABLE mpp21090_pttab_addpt_dropcol_addcol_dml_int4
(
    col1 int4,
    col2 int4,
    col3 char,
    col4 int
) 
DISTRIBUTED by (col1)
PARTITION BY RANGE(col2)(partition partone start(1) end(100000001)  WITH (APPENDONLY=true, COMPRESSLEVEL=5, ORIENTATION=column),partition parttwo start(100000001) end(200000001) WITH (APPENDONLY=true, COMPRESSLEVEL=5, ORIENTATION=row),partition partthree start(200000001) end(300000001));
NOTICE:  CREATE TABLE will create partition "mpp21090_pttab_addpt_dropcol_addcol_dml_int4_1_prt_partone" for table "mpp21090_pttab_addpt_dropcol_addcol_dml_int4"
NOTICE:  CREATE TABLE will create partition "mpp21090_pttab_addpt_dropcol_addcol_dml_int4_1_prt_parttwo" for table "mpp21090_pttab_addpt_dropcol_addcol_dml_int4"
NOTICE:  CREATE TABLE will create partition "mpp21090_pttab_addpt_dropcol_addcol_dml_int4_1_prt_partthree" for table "mpp21090_pttab_addpt_dropcol_addcol_dml_int4"
INSERT INTO mpp21090_pttab_addpt_dropcol_addcol_dml_int4 VALUES(20000000,20000000,'a',0);
ALTER TABLE mpp21090_pttab_addpt_dropcol_addcol_dml_int4 ADD PARTITION partfour start(300000001) end(400000001);
NOTICE:  CREATE TABLE will create partition "mpp21090_pttab_addpt_dropcol_addcol_dml_int4_1_prt_partfour" for table "mpp21090_pttab_addpt_dropcol_addcol_dml_int4"
INSERT INTO mpp21090_pttab_addpt_dropcol_addcol_dml_int4 SELECT 35000000,35000000,'b',1;
SELECT * FROM mpp21090_pttab_addpt_dropcol_addcol_dml_int4 ORDER BY 1,2,3;
   col1   |   col2   | col3 | col4 
----------+----------+------+------
 20000000 | 20000000 | a    |    0
 35000000 | 35000000 | b    |    1
(2 rows)

ALTER TABLE mpp21090_pttab_addpt_dropcol_addcol_dml_int4 DROP COLUMN col1;
NOTICE:  Dropping a column that is part of the distribution policy forces a NULL distribution policy
NOTICE:  Dropping a column that is part of the distribution policy forces a NULL distribution policy
NOTICE:  Dropping a column that is part of the distribution policy forces a NULL distribution policy
NOTICE:  Dropping a column that is part of the distribution policy forces a NULL distribution policy
NOTICE:  Dropping a column that is part of the distribution policy forces a NULL distribution policy
INSERT INTO mpp21090_pttab_addpt_dropcol_addcol_dml_int4 SELECT 35000000,'c',1;
SELECT * FROM mpp21090_pttab_addpt_dropcol_addcol_dml_int4 ORDER BY 1,2,3;
   col2   | col3 | col4 
----------+------+------
 20000000 | a    |    0
 35000000 | b    |    1
 35000000 | c    |    1
(3 rows)

ALTER TABLE mpp21090_pttab_addpt_dropcol_addcol_dml_int4 ADD COLUMN col5 int4 DEFAULT 20000000;
INSERT INTO mpp21090_pttab_addpt_dropcol_addcol_dml_int4 SELECT 35000000,'d',1,35000000;
SELECT * FROM mpp21090_pttab_addpt_dropcol_addcol_dml_int4 ORDER BY 1,2,3;
   col2   | col3 | col4 |   col5   
----------+------+------+----------
 20000000 | a    |    0 | 20000000
 35000000 | b    |    1 | 20000000
 35000000 | c    |    1 | 20000000
 35000000 | d    |    1 | 35000000
(4 rows)

UPDATE mpp21090_pttab_addpt_dropcol_addcol_dml_int4 SET col4 = 10 WHERE col2 = 35000000;
SELECT * FROM mpp21090_pttab_addpt_dropcol_addcol_dml_int4 ORDER BY 1,2,3;
   col2   | col3 | col4 |   col5   
----------+------+------+----------
 20000000 | a    |    0 | 20000000
 35000000 | b    |   10 | 20000000
 35000000 | c    |   10 | 20000000
 35000000 | d    |   10 | 35000000
(4 rows)

-- Update partition key
UPDATE mpp21090_pttab_addpt_dropcol_addcol_dml_int4 SET col2 = 10000000 WHERE col2 = 35000000;
SELECT * FROM mpp21090_pttab_addpt_dropcol_addcol_dml_int4 ORDER BY 1,2,3;
   col2   | col3 | col4 |   col5   
----------+------+------+----------
 10000000 | b    |   10 | 20000000
 10000000 | c    |   10 | 20000000
 10000000 | d    |   10 | 35000000
 20000000 | a    |    0 | 20000000
(4 rows)

DELETE FROM mpp21090_pttab_addpt_dropcol_addcol_dml_int4 WHERE col2 = 10000000;
SELECT * FROM mpp21090_pttab_addpt_dropcol_addcol_dml_int4 ORDER BY 1,2,3;
   col2   | col3 | col4 |   col5   
----------+------+------+----------
 20000000 | a    |    0 | 20000000
(1 row)

-- TEST
DROP TABLE IF EXISTS mpp21090_pttab_addpt_dropcol_addcol_dml_int8;
NOTICE:  table "mpp21090_pttab_addpt_dropcol_addcol_dml_int8" does not exist, skipping
CREATE TABLE mpp21090_pttab_addpt_dropcol_addcol_dml_int8
(
    col1 int8,
    col2 int8,
    col3 char,
    col4 int
) 
DISTRIBUTED by (col1)
PARTITION BY RANGE(col2)(partition partone start(1) end(1000000000000000001)  WITH (APPENDONLY=true, COMPRESSLEVEL=5, ORIENTATION=column),partition parttwo start(1000000000000000001) end(2000000000000000001) WITH (APPENDONLY=true, COMPRESSLEVEL=5, ORIENTATION=row),partition partthree start(2000000000000000001) end(3000000000000000001));
NOTICE:  CREATE TABLE will create partition "mpp21090_pttab_addpt_dropcol_addcol_dml_int8_1_prt_partone" for table "mpp21090_pttab_addpt_dropcol_addcol_dml_int8"
NOTICE:  CREATE TABLE will create partition "mpp21090_pttab_addpt_dropcol_addcol_dml_int8_1_prt_parttwo" for table "mpp21090_pttab_addpt_dropcol_addcol_dml_int8"
NOTICE:  CREATE TABLE will create partition "mpp21090_pttab_addpt_dropcol_addcol_dml_int8_1_prt_partthree" for table "mpp21090_pttab_addpt_dropcol_addcol_dml_int8"
INSERT INTO mpp21090_pttab_addpt_dropcol_addcol_dml_int8 VALUES(2000000000000000000,2000000000000000000,'a',0);
ALTER TABLE mpp21090_pttab_addpt_dropcol_addcol_dml_int8 ADD PARTITION partfour start(3000000000000000001) end(4000000000000000001);
NOTICE:  CREATE TABLE will create partition "mpp21090_pttab_addpt_dropcol_addcol_dml_int8_1_prt_partfour" for table "mpp21090_pttab_addpt_dropcol_addcol_dml_int8"
INSERT INTO mpp21090_pttab_addpt_dropcol_addcol_dml_int8 SELECT 3500000000000000000,3500000000000000000,'b',1;
SELECT * FROM mpp21090_pttab_addpt_dropcol_addcol_dml_int8 ORDER BY 1,2,3;
        col1         |        col2         | col3 | col4 
---------------------+---------------------+------+------
 2000000000000000000 | 2000000000000000000 | a    |    0
 3500000000000000000 | 3500000000000000000 | b    |    1
(2 rows)

ALTER TABLE mpp21090_pttab_addpt_dropcol_addcol_dml_int8 DROP COLUMN col1;
NOTICE:  Dropping a column that is part of the distribution policy forces a NULL distribution policy
NOTICE:  Dropping a column that is part of the distribution policy forces a NULL distribution policy
NOTICE:  Dropping a column that is part of the distribution policy forces a NULL distribution policy
NOTICE:  Dropping a column that is part of the distribution policy forces a NULL distribution policy
NOTICE:  Dropping a column that is part of the distribution policy forces a NULL distribution policy
INSERT INTO mpp21090_pttab_addpt_dropcol_addcol_dml_int8 SELECT 3500000000000000000,'c',1;
SELECT * FROM mpp21090_pttab_addpt_dropcol_addcol_dml_int8 ORDER BY 1,2,3;
        col2         | col3 | col4 
---------------------+------+------
 2000000000000000000 | a    |    0
 3500000000000000000 | b    |    1
 3500000000000000000 | c    |    1
(3 rows)

ALTER TABLE mpp21090_pttab_addpt_dropcol_addcol_dml_int8 ADD COLUMN col5 int8 DEFAULT 2000000000000000000;
INSERT INTO mpp21090_pttab_addpt_dropcol_addcol_dml_int8 SELECT 3500000000000000000,'d',1,3500000000000000000;
SELECT * FROM mpp21090_pttab_addpt_dropcol_addcol_dml_int8 ORDER BY 1,2,3;
        col2         | col3 | col4 |        col5         
---------------------+------+------+---------------------
 2000000000000000000 | a    |    0 | 2000000000000000000
 3500000000000000000 | b    |    1 | 2000000000000000000
 3500000000000000000 | c    |    1 | 2000000000000000000
 3500000000000000000 | d    |    1 | 3500000000000000000
(4 rows)

UPDATE mpp21090_pttab_addpt_dropcol_addcol_dml_int8 SET col4 = 10 WHERE col2 = 3500000000000000000;
SELECT * FROM mpp21090_pttab_addpt_dropcol_addcol_dml_int8 ORDER BY 1,2,3;
        col2         | col3 | col4 |        col5         
---------------------+------+------+---------------------
 2000000000000000000 | a    |    0 | 2000000000000000000
 3500000000000000000 | b    |   10 | 2000000000000000000
 3500000000000000000 | c    |   10 | 2000000000000000000
 3500000000000000000 | d    |   10 | 3500000000000000000
(4 rows)

-- Update partition key
UPDATE mpp21090_pttab_addpt_dropcol_addcol_dml_int8 SET col2 = 1000000000000000000 WHERE col2 = 3500000000000000000;
ERROR:  moving tuple from partition "mpp21090_pttab_addpt_dropcol_addcol_dml_int8_1_prt_partfour" to partition "mpp21090_pttab_addpt_dropcol_addcol_dml_int8_1_prt_partone" not supported  (seg0 127.0.0.1:40000 pid=9829)
SELECT * FROM mpp21090_pttab_addpt_dropcol_addcol_dml_int8 ORDER BY 1,2,3;
        col2         | col3 | col4 |        col5         
---------------------+------+------+---------------------
 2000000000000000000 | a    |    0 | 2000000000000000000
 3500000000000000000 | b    |   10 | 2000000000000000000
 3500000000000000000 | c    |   10 | 2000000000000000000
 3500000000000000000 | d    |   10 | 3500000000000000000
(4 rows)

DELETE FROM mpp21090_pttab_addpt_dropcol_addcol_dml_int8 WHERE col2 = 1000000000000000000;
SELECT * FROM mpp21090_pttab_addpt_dropcol_addcol_dml_int8 ORDER BY 1,2,3;
        col2         | col3 | col4 |        col5         
---------------------+------+------+---------------------
 2000000000000000000 | a    |    0 | 2000000000000000000
 3500000000000000000 | b    |   10 | 2000000000000000000
 3500000000000000000 | c    |   10 | 2000000000000000000
 3500000000000000000 | d    |   10 | 3500000000000000000
(4 rows)

-- TEST
DROP TABLE IF EXISTS mpp21090_pttab_addpt_dropcol_addcol_dml_interval;
NOTICE:  table "mpp21090_pttab_addpt_dropcol_addcol_dml_interval" does not exist, skipping
CREATE TABLE mpp21090_pttab_addpt_dropcol_addcol_dml_interval
(
    col1 interval,
    col2 interval,
    col3 char,
    col4 int
) 
DISTRIBUTED by (col1)
PARTITION BY RANGE(col2)(partition partone start('1 sec') end('1 min')  WITH (APPENDONLY=true, COMPRESSLEVEL=5, ORIENTATION=column),partition parttwo start('1 min') end('1 hour') WITH (APPENDONLY=true, COMPRESSLEVEL=5, ORIENTATION=row),partition partthree start('1 hour') end('12 hours'));
NOTICE:  CREATE TABLE will create partition "mpp21090_pttab_addpt_dropcol_addcol_dml_interval_1_prt_partone" for table "mpp21090_pttab_addpt_dropcol_addcol_dml_interval"
NOTICE:  CREATE TABLE will create partition "mpp21090_pttab_addpt_dropcol_addcol_dml_interval_1_prt_parttwo" for table "mpp21090_pttab_addpt_dropcol_addcol_dml_interval"
NOTICE:  CREATE TABLE will create partition "mpp21090_pttab_addpt_dropcol_addcol_dml_interva_1_prt_partthree" for table "mpp21090_pttab_addpt_dropcol_addcol_dml_interval"
INSERT INTO mpp21090_pttab_addpt_dropcol_addcol_dml_interval VALUES('1 hour','1 hour','a',0);
ALTER TABLE mpp21090_pttab_addpt_dropcol_addcol_dml_interval ADD PARTITION partfour start('12 hours') end('1 day') inclusive;
NOTICE:  CREATE TABLE will create partition "mpp21090_pttab_addpt_dropcol_addcol_dml_interval_1_prt_partfour" for table "mpp21090_pttab_addpt_dropcol_addcol_dml_interval"
INSERT INTO mpp21090_pttab_addpt_dropcol_addcol_dml_interval SELECT '14 hours','14 hours','b',1;
SELECT * FROM mpp21090_pttab_addpt_dropcol_addcol_dml_interval ORDER BY 1,2,3;
   col1   |   col2   | col3 | col4 
----------+----------+------+------
 01:00:00 | 01:00:00 | a    |    0
 14:00:00 | 14:00:00 | b    |    1
(2 rows)

ALTER TABLE mpp21090_pttab_addpt_dropcol_addcol_dml_interval DROP COLUMN col1;
NOTICE:  Dropping a column that is part of the distribution policy forces a NULL distribution policy
NOTICE:  Dropping a column that is part of the distribution policy forces a NULL distribution policy
NOTICE:  Dropping a column that is part of the distribution policy forces a NULL distribution policy
NOTICE:  Dropping a column that is part of the distribution policy forces a NULL distribution policy
NOTICE:  Dropping a column that is part of the distribution policy forces a NULL distribution policy
INSERT INTO mpp21090_pttab_addpt_dropcol_addcol_dml_interval SELECT '14 hours','c',1;
SELECT * FROM mpp21090_pttab_addpt_dropcol_addcol_dml_interval ORDER BY 1,2,3;
   col2   | col3 | col4 
----------+------+------
 01:00:00 | a    |    0
 14:00:00 | b    |    1
 14:00:00 | c    |    1
(3 rows)

ALTER TABLE mpp21090_pttab_addpt_dropcol_addcol_dml_interval ADD COLUMN col5 interval DEFAULT '1 hour';
INSERT INTO mpp21090_pttab_addpt_dropcol_addcol_dml_interval SELECT '14 hours','d',1,'14 hours';
SELECT * FROM mpp21090_pttab_addpt_dropcol_addcol_dml_interval ORDER BY 1,2,3;
   col2   | col3 | col4 |   col5   
----------+------+------+----------
 01:00:00 | a    |    0 | 01:00:00
 14:00:00 | b    |    1 | 01:00:00
 14:00:00 | c    |    1 | 01:00:00
 14:00:00 | d    |    1 | 14:00:00
(4 rows)

UPDATE mpp21090_pttab_addpt_dropcol_addcol_dml_interval SET col4 = 10 WHERE col2 = '14 hours';
SELECT * FROM mpp21090_pttab_addpt_dropcol_addcol_dml_interval ORDER BY 1,2,3;
   col2   | col3 | col4 |   col5   
----------+------+------+----------
 01:00:00 | a    |    0 | 01:00:00
 14:00:00 | b    |   10 | 01:00:00
 14:00:00 | c    |   10 | 01:00:00
 14:00:00 | d    |   10 | 14:00:00
(4 rows)

-- Update partition key
UPDATE mpp21090_pttab_addpt_dropcol_addcol_dml_interval SET col2 = '12 hours' WHERE col2 = '14 hours';
SELECT * FROM mpp21090_pttab_addpt_dropcol_addcol_dml_interval ORDER BY 1,2,3;
   col2   | col3 | col4 |   col5   
----------+------+------+----------
 01:00:00 | a    |    0 | 01:00:00
 12:00:00 | b    |   10 | 01:00:00
 12:00:00 | c    |   10 | 01:00:00
 12:00:00 | d    |   10 | 14:00:00
(4 rows)

DELETE FROM mpp21090_pttab_addpt_dropcol_addcol_dml_interval WHERE col2 = '12 hours';
SELECT * FROM mpp21090_pttab_addpt_dropcol_addcol_dml_interval ORDER BY 1,2,3;
   col2   | col3 | col4 |   col5   
----------+------+------+----------
 01:00:00 | a    |    0 | 01:00:00
(1 row)

-- TEST
DROP TABLE IF EXISTS mpp21090_pttab_addpt_dropcol_addcol_dml_numeric;
NOTICE:  table "mpp21090_pttab_addpt_dropcol_addcol_dml_numeric" does not exist, skipping
CREATE TABLE mpp21090_pttab_addpt_dropcol_addcol_dml_numeric
(
    col1 numeric,
    col2 numeric,
    col3 char,
    col4 int
) 
DISTRIBUTED by (col1)
PARTITION BY RANGE(col2)(partition partone start(1.000000) end(10.000000)  WITH (APPENDONLY=true, COMPRESSLEVEL=5, ORIENTATION=column),partition parttwo start(10.000000) end(20.000000) WITH (APPENDONLY=true, COMPRESSLEVEL=5, ORIENTATION=row),partition partthree start(20.000000) end(30.000000));
NOTICE:  CREATE TABLE will create partition "mpp21090_pttab_addpt_dropcol_addcol_dml_numeric_1_prt_partone" for table "mpp21090_pttab_addpt_dropcol_addcol_dml_numeric"
NOTICE:  CREATE TABLE will create partition "mpp21090_pttab_addpt_dropcol_addcol_dml_numeric_1_prt_parttwo" for table "mpp21090_pttab_addpt_dropcol_addcol_dml_numeric"
NOTICE:  CREATE TABLE will create partition "mpp21090_pttab_addpt_dropcol_addcol_dml_numeric_1_prt_partthree" for table "mpp21090_pttab_addpt_dropcol_addcol_dml_numeric"
INSERT INTO mpp21090_pttab_addpt_dropcol_addcol_dml_numeric VALUES(2.000000,2.000000,'a',0);
ALTER TABLE mpp21090_pttab_addpt_dropcol_addcol_dml_numeric ADD PARTITION partfour start(30.000000) end(40.000000) inclusive;
NOTICE:  CREATE TABLE will create partition "mpp21090_pttab_addpt_dropcol_addcol_dml_numeric_1_prt_partfour" for table "mpp21090_pttab_addpt_dropcol_addcol_dml_numeric"
INSERT INTO mpp21090_pttab_addpt_dropcol_addcol_dml_numeric SELECT 35.000000,35.000000,'b',1;
SELECT * FROM mpp21090_pttab_addpt_dropcol_addcol_dml_numeric ORDER BY 1,2,3;
   col1    |   col2    | col3 | col4 
-----------+-----------+------+------
  2.000000 |  2.000000 | a    |    0
 35.000000 | 35.000000 | b    |    1
(2 rows)

ALTER TABLE mpp21090_pttab_addpt_dropcol_addcol_dml_numeric DROP COLUMN col1;
NOTICE:  Dropping a column that is part of the distribution policy forces a NULL distribution policy
NOTICE:  Dropping a column that is part of the distribution policy forces a NULL distribution policy
NOTICE:  Dropping a column that is part of the distribution policy forces a NULL distribution policy
NOTICE:  Dropping a column that is part of the distribution policy forces a NULL distribution policy
NOTICE:  Dropping a column that is part of the distribution policy forces a NULL distribution policy
INSERT INTO mpp21090_pttab_addpt_dropcol_addcol_dml_numeric SELECT 35.000000,'c',1;
SELECT * FROM mpp21090_pttab_addpt_dropcol_addcol_dml_numeric ORDER BY 1,2,3;
   col2    | col3 | col4 
-----------+------+------
  2.000000 | a    |    0
 35.000000 | b    |    1
 35.000000 | c    |    1
(3 rows)

ALTER TABLE mpp21090_pttab_addpt_dropcol_addcol_dml_numeric ADD COLUMN col5 numeric DEFAULT 2.000000;
INSERT INTO mpp21090_pttab_addpt_dropcol_addcol_dml_numeric SELECT 35.000000,'d',1,35.000000;
SELECT * FROM mpp21090_pttab_addpt_dropcol_addcol_dml_numeric ORDER BY 1,2,3;
   col2    | col3 | col4 |   col5    
-----------+------+------+-----------
  2.000000 | a    |    0 |  2.000000
 35.000000 | b    |    1 |  2.000000
 35.000000 | c    |    1 |  2.000000
 35.000000 | d    |    1 | 35.000000
(4 rows)

UPDATE mpp21090_pttab_addpt_dropcol_addcol_dml_numeric SET col4 = 10 WHERE col2 = 35.000000;
SELECT * FROM mpp21090_pttab_addpt_dropcol_addcol_dml_numeric ORDER BY 1,2,3;
   col2    | col3 | col4 |   col5    
-----------+------+------+-----------
  2.000000 | a    |    0 |  2.000000
 35.000000 | b    |   10 |  2.000000
 35.000000 | c    |   10 |  2.000000
 35.000000 | d    |   10 | 35.000000
(4 rows)

-- Update partition key
UPDATE mpp21090_pttab_addpt_dropcol_addcol_dml_numeric SET col2 = 1.000000 WHERE col2 = 35.000000;
ERROR:  moving tuple from partition "mpp21090_pttab_addpt_dropcol_addcol_dml_numeric_1_prt_partfour" to partition "mpp21090_pttab_addpt_dropcol_addcol_dml_numeric_1_prt_partone" not supported  (seg1 127.0.0.1:40001 pid=9830)
SELECT * FROM mpp21090_pttab_addpt_dropcol_addcol_dml_numeric ORDER BY 1,2,3;
   col2    | col3 | col4 |   col5    
-----------+------+------+-----------
  2.000000 | a    |    0 |  2.000000
 35.000000 | b    |   10 |  2.000000
 35.000000 | c    |   10 |  2.000000
 35.000000 | d    |   10 | 35.000000
(4 rows)

DELETE FROM mpp21090_pttab_addpt_dropcol_addcol_dml_numeric WHERE col2 = 1.000000;
SELECT * FROM mpp21090_pttab_addpt_dropcol_addcol_dml_numeric ORDER BY 1,2,3;
   col2    | col3 | col4 |   col5    
-----------+------+------+-----------
  2.000000 | a    |    0 |  2.000000
 35.000000 | b    |   10 |  2.000000
 35.000000 | c    |   10 |  2.000000
 35.000000 | d    |   10 | 35.000000
(4 rows)

-- TEST
DROP TABLE IF EXISTS mpp21090_pttab_addpt_dropcol_addcol_dml_text;
NOTICE:  table "mpp21090_pttab_addpt_dropcol_addcol_dml_text" does not exist, skipping
CREATE TABLE mpp21090_pttab_addpt_dropcol_addcol_dml_text
(
    col1 text,
    col2 text,
    col3 char,
    col4 int
) 
DISTRIBUTED by (col1)
PARTITION BY LIST(col2)(partition partone VALUES('abcdefghijklmnop') WITH (APPENDONLY=true, COMPRESSLEVEL=5, ORIENTATION=column),partition parttwo VALUES('qrstuvwxyz') WITH (APPENDONLY=true, COMPRESSLEVEL=5, ORIENTATION=row),partition partthree VALUES('ghi'));
NOTICE:  CREATE TABLE will create partition "mpp21090_pttab_addpt_dropcol_addcol_dml_text_1_prt_partone" for table "mpp21090_pttab_addpt_dropcol_addcol_dml_text"
NOTICE:  CREATE TABLE will create partition "mpp21090_pttab_addpt_dropcol_addcol_dml_text_1_prt_parttwo" for table "mpp21090_pttab_addpt_dropcol_addcol_dml_text"
NOTICE:  CREATE TABLE will create partition "mpp21090_pttab_addpt_dropcol_addcol_dml_text_1_prt_partthree" for table "mpp21090_pttab_addpt_dropcol_addcol_dml_text"
INSERT INTO mpp21090_pttab_addpt_dropcol_addcol_dml_text VALUES('abcdefghijklmnop','abcdefghijklmnop','a',0);
ALTER TABLE mpp21090_pttab_addpt_dropcol_addcol_dml_text ADD PARTITION partfour VALUES('xyz');
NOTICE:  CREATE TABLE will create partition "mpp21090_pttab_addpt_dropcol_addcol_dml_text_1_prt_partfour" for table "mpp21090_pttab_addpt_dropcol_addcol_dml_text"
INSERT INTO mpp21090_pttab_addpt_dropcol_addcol_dml_text SELECT 'xyz','xyz','b',1;
SELECT * FROM mpp21090_pttab_addpt_dropcol_addcol_dml_text ORDER BY 1,2,3;
       col1       |       col2       | col3 | col4 
------------------+------------------+------+------
 abcdefghijklmnop | abcdefghijklmnop | a    |    0
 xyz              | xyz              | b    |    1
(2 rows)

ALTER TABLE mpp21090_pttab_addpt_dropcol_addcol_dml_text DROP COLUMN col1;
NOTICE:  Dropping a column that is part of the distribution policy forces a NULL distribution policy
NOTICE:  Dropping a column that is part of the distribution policy forces a NULL distribution policy
NOTICE:  Dropping a column that is part of the distribution policy forces a NULL distribution policy
NOTICE:  Dropping a column that is part of the distribution policy forces a NULL distribution policy
NOTICE:  Dropping a column that is part of the distribution policy forces a NULL distribution policy
INSERT INTO mpp21090_pttab_addpt_dropcol_addcol_dml_text SELECT 'xyz','c',1;
SELECT * FROM mpp21090_pttab_addpt_dropcol_addcol_dml_text ORDER BY 1,2,3;
       col2       | col3 | col4 
------------------+------+------
 abcdefghijklmnop | a    |    0
 xyz              | b    |    1
 xyz              | c    |    1
(3 rows)

ALTER TABLE mpp21090_pttab_addpt_dropcol_addcol_dml_text ADD COLUMN col5 text DEFAULT 'abcdefghijklmnop';
INSERT INTO mpp21090_pttab_addpt_dropcol_addcol_dml_text SELECT 'xyz','d',1,'xyz';
SELECT * FROM mpp21090_pttab_addpt_dropcol_addcol_dml_text ORDER BY 1,2,3;
       col2       | col3 | col4 |       col5       
------------------+------+------+------------------
 abcdefghijklmnop | a    |    0 | abcdefghijklmnop
 xyz              | b    |    1 | abcdefghijklmnop
 xyz              | c    |    1 | abcdefghijklmnop
 xyz              | d    |    1 | xyz
(4 rows)

UPDATE mpp21090_pttab_addpt_dropcol_addcol_dml_text SET col4 = 10 WHERE col2 = 'xyz';
SELECT * FROM mpp21090_pttab_addpt_dropcol_addcol_dml_text ORDER BY 1,2,3;
       col2       | col3 | col4 |       col5       
------------------+------+------+------------------
 abcdefghijklmnop | a    |    0 | abcdefghijklmnop
 xyz              | b    |   10 | abcdefghijklmnop
 xyz              | c    |   10 | abcdefghijklmnop
 xyz              | d    |   10 | xyz
(4 rows)

-- Update partition key
UPDATE mpp21090_pttab_addpt_dropcol_addcol_dml_text SET col2 = 'qrstuvwxyz' WHERE col2 = 'xyz';
ERROR:  moving tuple from partition "mpp21090_pttab_addpt_dropcol_addcol_dml_text_1_prt_partfour" to partition "mpp21090_pttab_addpt_dropcol_addcol_dml_text_1_prt_parttwo" not supported  (seg0 127.0.0.1:40000 pid=9829)
SELECT * FROM mpp21090_pttab_addpt_dropcol_addcol_dml_text ORDER BY 1,2,3;
       col2       | col3 | col4 |       col5       
------------------+------+------+------------------
 abcdefghijklmnop | a    |    0 | abcdefghijklmnop
 xyz              | b    |   10 | abcdefghijklmnop
 xyz              | c    |   10 | abcdefghijklmnop
 xyz              | d    |   10 | xyz
(4 rows)

DELETE FROM mpp21090_pttab_addpt_dropcol_addcol_dml_text WHERE col2 = 'qrstuvwxyz';
SELECT * FROM mpp21090_pttab_addpt_dropcol_addcol_dml_text ORDER BY 1,2,3;
       col2       | col3 | col4 |       col5       
------------------+------+------+------------------
 abcdefghijklmnop | a    |    0 | abcdefghijklmnop
 xyz              | b    |   10 | abcdefghijklmnop
 xyz              | c    |   10 | abcdefghijklmnop
 xyz              | d    |   10 | xyz
(4 rows)

-- TEST
DROP TABLE IF EXISTS mpp21090_pttab_addpt_dropcol_dml_char;
NOTICE:  table "mpp21090_pttab_addpt_dropcol_dml_char" does not exist, skipping
CREATE TABLE mpp21090_pttab_addpt_dropcol_dml_char
(
    col1 char,
    col2 char,
    col3 char,
    col4 int
) 
DISTRIBUTED by (col1)
PARTITION BY LIST(col2)(partition partone VALUES('a','b','c','d','e','f','g','h') WITH (APPENDONLY=true, COMPRESSLEVEL=5, ORIENTATION=column),partition parttwo VALUES('i','j','k','l','m','n','o','p') WITH (APPENDONLY=true, COMPRESSLEVEL=5, ORIENTATION=row),partition partthree VALUES('q','r','s','t','u','v','w','x'));
NOTICE:  CREATE TABLE will create partition "mpp21090_pttab_addpt_dropcol_dml_char_1_prt_partone" for table "mpp21090_pttab_addpt_dropcol_dml_char"
NOTICE:  CREATE TABLE will create partition "mpp21090_pttab_addpt_dropcol_dml_char_1_prt_parttwo" for table "mpp21090_pttab_addpt_dropcol_dml_char"
NOTICE:  CREATE TABLE will create partition "mpp21090_pttab_addpt_dropcol_dml_char_1_prt_partthree" for table "mpp21090_pttab_addpt_dropcol_dml_char"
INSERT INTO mpp21090_pttab_addpt_dropcol_dml_char VALUES('x','x','a',0);
ALTER TABLE mpp21090_pttab_addpt_dropcol_dml_char ADD PARTITION partfour VALUES('y','z','-');
NOTICE:  CREATE TABLE will create partition "mpp21090_pttab_addpt_dropcol_dml_char_1_prt_partfour" for table "mpp21090_pttab_addpt_dropcol_dml_char"
INSERT INTO mpp21090_pttab_addpt_dropcol_dml_char SELECT 'z','z','b',1;
SELECT * FROM mpp21090_pttab_addpt_dropcol_dml_char ORDER BY 1,2,3;
 col1 | col2 | col3 | col4 
------+------+------+------
 x    | x    | a    |    0
 z    | z    | b    |    1
(2 rows)

ALTER TABLE mpp21090_pttab_addpt_dropcol_dml_char DROP COLUMN col1;
NOTICE:  Dropping a column that is part of the distribution policy forces a NULL distribution policy
NOTICE:  Dropping a column that is part of the distribution policy forces a NULL distribution policy
NOTICE:  Dropping a column that is part of the distribution policy forces a NULL distribution policy
NOTICE:  Dropping a column that is part of the distribution policy forces a NULL distribution policy
NOTICE:  Dropping a column that is part of the distribution policy forces a NULL distribution policy
INSERT INTO mpp21090_pttab_addpt_dropcol_dml_char SELECT 'z','b',1;
SELECT * FROM mpp21090_pttab_addpt_dropcol_dml_char ORDER BY 1,2,3;
 col2 | col3 | col4 
------+------+------
 x    | a    |    0
 z    | b    |    1
 z    | b    |    1
(3 rows)

UPDATE mpp21090_pttab_addpt_dropcol_dml_char SET col4 = 10 WHERE col2 = 'z';
SELECT * FROM mpp21090_pttab_addpt_dropcol_dml_char ORDER BY 1,2,3;
 col2 | col3 | col4 
------+------+------
 x    | a    |    0
 z    | b    |   10
 z    | b    |   10
(3 rows)

-- Update partition key
UPDATE mpp21090_pttab_addpt_dropcol_dml_char SET col2 = '-' WHERE col2 = 'z';
SELECT * FROM mpp21090_pttab_addpt_dropcol_dml_char ORDER BY 1,2,3;
 col2 | col3 | col4 
------+------+------
 -    | b    |   10
 -    | b    |   10
 x    | a    |    0
(3 rows)

DELETE FROM mpp21090_pttab_addpt_dropcol_dml_char WHERE col2 = '-';
SELECT * FROM mpp21090_pttab_addpt_dropcol_dml_char ORDER BY 1,2,3;
 col2 | col3 | col4 
------+------+------
 x    | a    |    0
(1 row)

-- TEST
DROP TABLE IF EXISTS mpp21090_pttab_addpt_dropcol_dml_decimal;
NOTICE:  table "mpp21090_pttab_addpt_dropcol_dml_decimal" does not exist, skipping
CREATE TABLE mpp21090_pttab_addpt_dropcol_dml_decimal
(
    col1 decimal,
    col2 decimal,
    col3 char,
    col4 int
) 
DISTRIBUTED by (col1)
PARTITION BY RANGE(col2)(partition partone start(1.00) end(10.00)  WITH (APPENDONLY=true, COMPRESSLEVEL=5, ORIENTATION=column),partition parttwo start(10.00) end(20.00) WITH (APPENDONLY=true, COMPRESSLEVEL=5, ORIENTATION=row),partition partthree start(20.00) end(30.00));
NOTICE:  CREATE TABLE will create partition "mpp21090_pttab_addpt_dropcol_dml_decimal_1_prt_partone" for table "mpp21090_pttab_addpt_dropcol_dml_decimal"
NOTICE:  CREATE TABLE will create partition "mpp21090_pttab_addpt_dropcol_dml_decimal_1_prt_parttwo" for table "mpp21090_pttab_addpt_dropcol_dml_decimal"
NOTICE:  CREATE TABLE will create partition "mpp21090_pttab_addpt_dropcol_dml_decimal_1_prt_partthree" for table "mpp21090_pttab_addpt_dropcol_dml_decimal"
INSERT INTO mpp21090_pttab_addpt_dropcol_dml_decimal VALUES(2.00,2.00,'a',0);
ALTER TABLE mpp21090_pttab_addpt_dropcol_dml_decimal ADD PARTITION partfour start(30.00) end(40.00) inclusive;
NOTICE:  CREATE TABLE will create partition "mpp21090_pttab_addpt_dropcol_dml_decimal_1_prt_partfour" for table "mpp21090_pttab_addpt_dropcol_dml_decimal"
INSERT INTO mpp21090_pttab_addpt_dropcol_dml_decimal SELECT 35.00,35.00,'b',1;
SELECT * FROM mpp21090_pttab_addpt_dropcol_dml_decimal ORDER BY 1,2,3;
 col1  | col2  | col3 | col4 
-------+-------+------+------
  2.00 |  2.00 | a    |    0
 35.00 | 35.00 | b    |    1
(2 rows)

ALTER TABLE mpp21090_pttab_addpt_dropcol_dml_decimal DROP COLUMN col1;
NOTICE:  Dropping a column that is part of the distribution policy forces a NULL distribution policy
NOTICE:  Dropping a column that is part of the distribution policy forces a NULL distribution policy
NOTICE:  Dropping a column that is part of the distribution policy forces a NULL distribution policy
NOTICE:  Dropping a column that is part of the distribution policy forces a NULL distribution policy
NOTICE:  Dropping a column that is part of the distribution policy forces a NULL distribution policy
INSERT INTO mpp21090_pttab_addpt_dropcol_dml_decimal SELECT 35.00,'b',1;
SELECT * FROM mpp21090_pttab_addpt_dropcol_dml_decimal ORDER BY 1,2,3;
 col2  | col3 | col4 
-------+------+------
  2.00 | a    |    0
 35.00 | b    |    1
 35.00 | b    |    1
(3 rows)

UPDATE mpp21090_pttab_addpt_dropcol_dml_decimal SET col4 = 10 WHERE col2 = 35.00;
SELECT * FROM mpp21090_pttab_addpt_dropcol_dml_decimal ORDER BY 1,2,3;
 col2  | col3 | col4 
-------+------+------
  2.00 | a    |    0
 35.00 | b    |   10
 35.00 | b    |   10
(3 rows)

-- Update partition key
UPDATE mpp21090_pttab_addpt_dropcol_dml_decimal SET col2 = 1.00 WHERE col2 = 35.00;
ERROR:  moving tuple from partition "mpp21090_pttab_addpt_dropcol_dml_decimal_1_prt_partfour" to partition "mpp21090_pttab_addpt_dropcol_dml_decimal_1_prt_partone" not supported  (seg0 127.0.0.1:40000 pid=9829)
SELECT * FROM mpp21090_pttab_addpt_dropcol_dml_decimal ORDER BY 1,2,3;
 col2  | col3 | col4 
-------+------+------
  2.00 | a    |    0
 35.00 | b    |   10
 35.00 | b    |   10
(3 rows)

DELETE FROM mpp21090_pttab_addpt_dropcol_dml_decimal WHERE col2 = 1.00;
SELECT * FROM mpp21090_pttab_addpt_dropcol_dml_decimal ORDER BY 1,2,3;
 col2  | col3 | col4 
-------+------+------
  2.00 | a    |    0
 35.00 | b    |   10
 35.00 | b    |   10
(3 rows)

-- TEST
DROP TABLE IF EXISTS mpp21090_pttab_addpt_dropcol_dml_int4;
NOTICE:  table "mpp21090_pttab_addpt_dropcol_dml_int4" does not exist, skipping
CREATE TABLE mpp21090_pttab_addpt_dropcol_dml_int4
(
    col1 int4,
    col2 int4,
    col3 char,
    col4 int
) 
DISTRIBUTED by (col1)
PARTITION BY RANGE(col2)(partition partone start(1) end(100000001)  WITH (APPENDONLY=true, COMPRESSLEVEL=5, ORIENTATION=column),partition parttwo start(100000001) end(200000001) WITH (APPENDONLY=true, COMPRESSLEVEL=5, ORIENTATION=row),partition partthree start(200000001) end(300000001));
NOTICE:  CREATE TABLE will create partition "mpp21090_pttab_addpt_dropcol_dml_int4_1_prt_partone" for table "mpp21090_pttab_addpt_dropcol_dml_int4"
NOTICE:  CREATE TABLE will create partition "mpp21090_pttab_addpt_dropcol_dml_int4_1_prt_parttwo" for table "mpp21090_pttab_addpt_dropcol_dml_int4"
NOTICE:  CREATE TABLE will create partition "mpp21090_pttab_addpt_dropcol_dml_int4_1_prt_partthree" for table "mpp21090_pttab_addpt_dropcol_dml_int4"
INSERT INTO mpp21090_pttab_addpt_dropcol_dml_int4 VALUES(20000000,20000000,'a',0);
ALTER TABLE mpp21090_pttab_addpt_dropcol_dml_int4 ADD PARTITION partfour start(300000001) end(400000001);
NOTICE:  CREATE TABLE will create partition "mpp21090_pttab_addpt_dropcol_dml_int4_1_prt_partfour" for table "mpp21090_pttab_addpt_dropcol_dml_int4"
INSERT INTO mpp21090_pttab_addpt_dropcol_dml_int4 SELECT 35000000,35000000,'b',1;
SELECT * FROM mpp21090_pttab_addpt_dropcol_dml_int4 ORDER BY 1,2,3;
   col1   |   col2   | col3 | col4 
----------+----------+------+------
 20000000 | 20000000 | a    |    0
 35000000 | 35000000 | b    |    1
(2 rows)

ALTER TABLE mpp21090_pttab_addpt_dropcol_dml_int4 DROP COLUMN col1;
NOTICE:  Dropping a column that is part of the distribution policy forces a NULL distribution policy
NOTICE:  Dropping a column that is part of the distribution policy forces a NULL distribution policy
NOTICE:  Dropping a column that is part of the distribution policy forces a NULL distribution policy
NOTICE:  Dropping a column that is part of the distribution policy forces a NULL distribution policy
NOTICE:  Dropping a column that is part of the distribution policy forces a NULL distribution policy
INSERT INTO mpp21090_pttab_addpt_dropcol_dml_int4 SELECT 35000000,'b',1;
SELECT * FROM mpp21090_pttab_addpt_dropcol_dml_int4 ORDER BY 1,2,3;
   col2   | col3 | col4 
----------+------+------
 20000000 | a    |    0
 35000000 | b    |    1
 35000000 | b    |    1
(3 rows)

UPDATE mpp21090_pttab_addpt_dropcol_dml_int4 SET col4 = 10 WHERE col2 = 35000000;
SELECT * FROM mpp21090_pttab_addpt_dropcol_dml_int4 ORDER BY 1,2,3;
   col2   | col3 | col4 
----------+------+------
 20000000 | a    |    0
 35000000 | b    |   10
 35000000 | b    |   10
(3 rows)

-- Update partition key
UPDATE mpp21090_pttab_addpt_dropcol_dml_int4 SET col2 = 10000000 WHERE col2 = 35000000;
SELECT * FROM mpp21090_pttab_addpt_dropcol_dml_int4 ORDER BY 1,2,3;
   col2   | col3 | col4 
----------+------+------
 10000000 | b    |   10
 10000000 | b    |   10
 20000000 | a    |    0
(3 rows)

DELETE FROM mpp21090_pttab_addpt_dropcol_dml_int4 WHERE col2 = 10000000;
SELECT * FROM mpp21090_pttab_addpt_dropcol_dml_int4 ORDER BY 1,2,3;
   col2   | col3 | col4 
----------+------+------
 20000000 | a    |    0
(1 row)

-- TEST
DROP TABLE IF EXISTS mpp21090_pttab_addpt_dropcol_dml_int8;
NOTICE:  table "mpp21090_pttab_addpt_dropcol_dml_int8" does not exist, skipping
CREATE TABLE mpp21090_pttab_addpt_dropcol_dml_int8
(
    col1 int8,
    col2 int8,
    col3 char,
    col4 int
) 
DISTRIBUTED by (col1)
PARTITION BY RANGE(col2)(partition partone start(1) end(1000000000000000001)  WITH (APPENDONLY=true, COMPRESSLEVEL=5, ORIENTATION=column),partition parttwo start(1000000000000000001) end(2000000000000000001) WITH (APPENDONLY=true, COMPRESSLEVEL=5, ORIENTATION=row),partition partthree start(2000000000000000001) end(3000000000000000001));
NOTICE:  CREATE TABLE will create partition "mpp21090_pttab_addpt_dropcol_dml_int8_1_prt_partone" for table "mpp21090_pttab_addpt_dropcol_dml_int8"
NOTICE:  CREATE TABLE will create partition "mpp21090_pttab_addpt_dropcol_dml_int8_1_prt_parttwo" for table "mpp21090_pttab_addpt_dropcol_dml_int8"
NOTICE:  CREATE TABLE will create partition "mpp21090_pttab_addpt_dropcol_dml_int8_1_prt_partthree" for table "mpp21090_pttab_addpt_dropcol_dml_int8"
INSERT INTO mpp21090_pttab_addpt_dropcol_dml_int8 VALUES(2000000000000000000,2000000000000000000,'a',0);
ALTER TABLE mpp21090_pttab_addpt_dropcol_dml_int8 ADD PARTITION partfour start(3000000000000000001) end(4000000000000000001);
NOTICE:  CREATE TABLE will create partition "mpp21090_pttab_addpt_dropcol_dml_int8_1_prt_partfour" for table "mpp21090_pttab_addpt_dropcol_dml_int8"
INSERT INTO mpp21090_pttab_addpt_dropcol_dml_int8 SELECT 3500000000000000000,3500000000000000000,'b',1;
SELECT * FROM mpp21090_pttab_addpt_dropcol_dml_int8 ORDER BY 1,2,3;
        col1         |        col2         | col3 | col4 
---------------------+---------------------+------+------
 2000000000000000000 | 2000000000000000000 | a    |    0
 3500000000000000000 | 3500000000000000000 | b    |    1
(2 rows)

ALTER TABLE mpp21090_pttab_addpt_dropcol_dml_int8 DROP COLUMN col1;
NOTICE:  Dropping a column that is part of the distribution policy forces a NULL distribution policy
NOTICE:  Dropping a column that is part of the distribution policy forces a NULL distribution policy
NOTICE:  Dropping a column that is part of the distribution policy forces a NULL distribution policy
NOTICE:  Dropping a column that is part of the distribution policy forces a NULL distribution policy
NOTICE:  Dropping a column that is part of the distribution policy forces a NULL distribution policy
INSERT INTO mpp21090_pttab_addpt_dropcol_dml_int8 SELECT 3500000000000000000,'b',1;
SELECT * FROM mpp21090_pttab_addpt_dropcol_dml_int8 ORDER BY 1,2,3;
        col2         | col3 | col4 
---------------------+------+------
 2000000000000000000 | a    |    0
 3500000000000000000 | b    |    1
 3500000000000000000 | b    |    1
(3 rows)

UPDATE mpp21090_pttab_addpt_dropcol_dml_int8 SET col4 = 10 WHERE col2 = 3500000000000000000;
SELECT * FROM mpp21090_pttab_addpt_dropcol_dml_int8 ORDER BY 1,2,3;
        col2         | col3 | col4 
---------------------+------+------
 2000000000000000000 | a    |    0
 3500000000000000000 | b    |   10
 3500000000000000000 | b    |   10
(3 rows)

-- Update partition key
UPDATE mpp21090_pttab_addpt_dropcol_dml_int8 SET col2 = 1000000000000000000 WHERE col2 = 3500000000000000000;
ERROR:  moving tuple from partition "mpp21090_pttab_addpt_dropcol_dml_int8_1_prt_partfour" to partition "mpp21090_pttab_addpt_dropcol_dml_int8_1_prt_partone" not supported  (seg1 127.0.0.1:40001 pid=9830)
SELECT * FROM mpp21090_pttab_addpt_dropcol_dml_int8 ORDER BY 1,2,3;
        col2         | col3 | col4 
---------------------+------+------
 2000000000000000000 | a    |    0
 3500000000000000000 | b    |   10
 3500000000000000000 | b    |   10
(3 rows)

DELETE FROM mpp21090_pttab_addpt_dropcol_dml_int8 WHERE col2 = 1000000000000000000;
SELECT * FROM mpp21090_pttab_addpt_dropcol_dml_int8 ORDER BY 1,2,3;
        col2         | col3 | col4 
---------------------+------+------
 2000000000000000000 | a    |    0
 3500000000000000000 | b    |   10
 3500000000000000000 | b    |   10
(3 rows)

-- TEST
DROP TABLE IF EXISTS mpp21090_pttab_addpt_dropcol_dml_interval;
NOTICE:  table "mpp21090_pttab_addpt_dropcol_dml_interval" does not exist, skipping
CREATE TABLE mpp21090_pttab_addpt_dropcol_dml_interval
(
    col1 interval,
    col2 interval,
    col3 char,
    col4 int
) 
DISTRIBUTED by (col1)
PARTITION BY RANGE(col2)(partition partone start('1 sec') end('1 min')  WITH (APPENDONLY=true, COMPRESSLEVEL=5, ORIENTATION=column),partition parttwo start('1 min') end('1 hour') WITH (APPENDONLY=true, COMPRESSLEVEL=5, ORIENTATION=row),partition partthree start('1 hour') end('12 hours'));
NOTICE:  CREATE TABLE will create partition "mpp21090_pttab_addpt_dropcol_dml_interval_1_prt_partone" for table "mpp21090_pttab_addpt_dropcol_dml_interval"
NOTICE:  CREATE TABLE will create partition "mpp21090_pttab_addpt_dropcol_dml_interval_1_prt_parttwo" for table "mpp21090_pttab_addpt_dropcol_dml_interval"
NOTICE:  CREATE TABLE will create partition "mpp21090_pttab_addpt_dropcol_dml_interval_1_prt_partthree" for table "mpp21090_pttab_addpt_dropcol_dml_interval"
INSERT INTO mpp21090_pttab_addpt_dropcol_dml_interval VALUES('1 hour','1 hour','a',0);
ALTER TABLE mpp21090_pttab_addpt_dropcol_dml_interval ADD PARTITION partfour start('12 hours') end('1 day') inclusive;
NOTICE:  CREATE TABLE will create partition "mpp21090_pttab_addpt_dropcol_dml_interval_1_prt_partfour" for table "mpp21090_pttab_addpt_dropcol_dml_interval"
INSERT INTO mpp21090_pttab_addpt_dropcol_dml_interval SELECT '14 hours','14 hours','b',1;
SELECT * FROM mpp21090_pttab_addpt_dropcol_dml_interval ORDER BY 1,2,3;
   col1   |   col2   | col3 | col4 
----------+----------+------+------
 01:00:00 | 01:00:00 | a    |    0
 14:00:00 | 14:00:00 | b    |    1
(2 rows)

ALTER TABLE mpp21090_pttab_addpt_dropcol_dml_interval DROP COLUMN col1;
NOTICE:  Dropping a column that is part of the distribution policy forces a NULL distribution policy
NOTICE:  Dropping a column that is part of the distribution policy forces a NULL distribution policy
NOTICE:  Dropping a column that is part of the distribution policy forces a NULL distribution policy
NOTICE:  Dropping a column that is part of the distribution policy forces a NULL distribution policy
NOTICE:  Dropping a column that is part of the distribution policy forces a NULL distribution policy
INSERT INTO mpp21090_pttab_addpt_dropcol_dml_interval SELECT '14 hours','b',1;
SELECT * FROM mpp21090_pttab_addpt_dropcol_dml_interval ORDER BY 1,2,3;
   col2   | col3 | col4 
----------+------+------
 01:00:00 | a    |    0
 14:00:00 | b    |    1
 14:00:00 | b    |    1
(3 rows)

UPDATE mpp21090_pttab_addpt_dropcol_dml_interval SET col4 = 10 WHERE col2 = '14 hours';
SELECT * FROM mpp21090_pttab_addpt_dropcol_dml_interval ORDER BY 1,2,3;
   col2   | col3 | col4 
----------+------+------
 01:00:00 | a    |    0
 14:00:00 | b    |   10
 14:00:00 | b    |   10
(3 rows)

-- Update partition key
UPDATE mpp21090_pttab_addpt_dropcol_dml_interval SET col2 = '12 hours' WHERE col2 = '14 hours';
SELECT * FROM mpp21090_pttab_addpt_dropcol_dml_interval ORDER BY 1,2,3;
   col2   | col3 | col4 
----------+------+------
 01:00:00 | a    |    0
 12:00:00 | b    |   10
 12:00:00 | b    |   10
(3 rows)

DELETE FROM mpp21090_pttab_addpt_dropcol_dml_interval WHERE col2 = '12 hours';
SELECT * FROM mpp21090_pttab_addpt_dropcol_dml_interval ORDER BY 1,2,3;
   col2   | col3 | col4 
----------+------+------
 01:00:00 | a    |    0
(1 row)

-- TEST
DROP TABLE IF EXISTS mpp21090_pttab_addpt_dropcol_dml_numeric;
NOTICE:  table "mpp21090_pttab_addpt_dropcol_dml_numeric" does not exist, skipping
CREATE TABLE mpp21090_pttab_addpt_dropcol_dml_numeric
(
    col1 numeric,
    col2 numeric,
    col3 char,
    col4 int
) 
DISTRIBUTED by (col1)
PARTITION BY RANGE(col2)(partition partone start(1.000000) end(10.000000)  WITH (APPENDONLY=true, COMPRESSLEVEL=5, ORIENTATION=column),partition parttwo start(10.000000) end(20.000000) WITH (APPENDONLY=true, COMPRESSLEVEL=5, ORIENTATION=row),partition partthree start(20.000000) end(30.000000));
NOTICE:  CREATE TABLE will create partition "mpp21090_pttab_addpt_dropcol_dml_numeric_1_prt_partone" for table "mpp21090_pttab_addpt_dropcol_dml_numeric"
NOTICE:  CREATE TABLE will create partition "mpp21090_pttab_addpt_dropcol_dml_numeric_1_prt_parttwo" for table "mpp21090_pttab_addpt_dropcol_dml_numeric"
NOTICE:  CREATE TABLE will create partition "mpp21090_pttab_addpt_dropcol_dml_numeric_1_prt_partthree" for table "mpp21090_pttab_addpt_dropcol_dml_numeric"
INSERT INTO mpp21090_pttab_addpt_dropcol_dml_numeric VALUES(2.000000,2.000000,'a',0);
ALTER TABLE mpp21090_pttab_addpt_dropcol_dml_numeric ADD PARTITION partfour start(30.000000) end(40.000000) inclusive;
NOTICE:  CREATE TABLE will create partition "mpp21090_pttab_addpt_dropcol_dml_numeric_1_prt_partfour" for table "mpp21090_pttab_addpt_dropcol_dml_numeric"
INSERT INTO mpp21090_pttab_addpt_dropcol_dml_numeric SELECT 35.000000,35.000000,'b',1;
SELECT * FROM mpp21090_pttab_addpt_dropcol_dml_numeric ORDER BY 1,2,3;
   col1    |   col2    | col3 | col4 
-----------+-----------+------+------
  2.000000 |  2.000000 | a    |    0
 35.000000 | 35.000000 | b    |    1
(2 rows)

ALTER TABLE mpp21090_pttab_addpt_dropcol_dml_numeric DROP COLUMN col1;
NOTICE:  Dropping a column that is part of the distribution policy forces a NULL distribution policy
NOTICE:  Dropping a column that is part of the distribution policy forces a NULL distribution policy
NOTICE:  Dropping a column that is part of the distribution policy forces a NULL distribution policy
NOTICE:  Dropping a column that is part of the distribution policy forces a NULL distribution policy
NOTICE:  Dropping a column that is part of the distribution policy forces a NULL distribution policy
INSERT INTO mpp21090_pttab_addpt_dropcol_dml_numeric SELECT 35.000000,'b',1;
SELECT * FROM mpp21090_pttab_addpt_dropcol_dml_numeric ORDER BY 1,2,3;
   col2    | col3 | col4 
-----------+------+------
  2.000000 | a    |    0
 35.000000 | b    |    1
 35.000000 | b    |    1
(3 rows)

UPDATE mpp21090_pttab_addpt_dropcol_dml_numeric SET col4 = 10 WHERE col2 = 35.000000;
SELECT * FROM mpp21090_pttab_addpt_dropcol_dml_numeric ORDER BY 1,2,3;
   col2    | col3 | col4 
-----------+------+------
  2.000000 | a    |    0
 35.000000 | b    |   10
 35.000000 | b    |   10
(3 rows)

-- Update partition key
UPDATE mpp21090_pttab_addpt_dropcol_dml_numeric SET col2 = 1.000000 WHERE col2 = 35.000000;
ERROR:  moving tuple from partition "mpp21090_pttab_addpt_dropcol_dml_numeric_1_prt_partfour" to partition "mpp21090_pttab_addpt_dropcol_dml_numeric_1_prt_partone" not supported  (seg0 127.0.0.1:40000 pid=9829)
SELECT * FROM mpp21090_pttab_addpt_dropcol_dml_numeric ORDER BY 1,2,3;
   col2    | col3 | col4 
-----------+------+------
  2.000000 | a    |    0
 35.000000 | b    |   10
 35.000000 | b    |   10
(3 rows)

DELETE FROM mpp21090_pttab_addpt_dropcol_dml_numeric WHERE col2 = 1.000000;
SELECT * FROM mpp21090_pttab_addpt_dropcol_dml_numeric ORDER BY 1,2,3;
   col2    | col3 | col4 
-----------+------+------
  2.000000 | a    |    0
 35.000000 | b    |   10
 35.000000 | b    |   10
(3 rows)

-- TEST
DROP TABLE IF EXISTS mpp21090_pttab_addpt_dropcol_dml_text;
NOTICE:  table "mpp21090_pttab_addpt_dropcol_dml_text" does not exist, skipping
CREATE TABLE mpp21090_pttab_addpt_dropcol_dml_text
(
    col1 text,
    col2 text,
    col3 char,
    col4 int
) 
DISTRIBUTED by (col1)
PARTITION BY LIST(col2)(partition partone VALUES('abcdefghijklmnop') WITH (APPENDONLY=true, COMPRESSLEVEL=5, ORIENTATION=column),partition parttwo VALUES('qrstuvwxyz') WITH (APPENDONLY=true, COMPRESSLEVEL=5, ORIENTATION=row),partition partthree VALUES('ghi'));
NOTICE:  CREATE TABLE will create partition "mpp21090_pttab_addpt_dropcol_dml_text_1_prt_partone" for table "mpp21090_pttab_addpt_dropcol_dml_text"
NOTICE:  CREATE TABLE will create partition "mpp21090_pttab_addpt_dropcol_dml_text_1_prt_parttwo" for table "mpp21090_pttab_addpt_dropcol_dml_text"
NOTICE:  CREATE TABLE will create partition "mpp21090_pttab_addpt_dropcol_dml_text_1_prt_partthree" for table "mpp21090_pttab_addpt_dropcol_dml_text"
INSERT INTO mpp21090_pttab_addpt_dropcol_dml_text VALUES('abcdefghijklmnop','abcdefghijklmnop','a',0);
ALTER TABLE mpp21090_pttab_addpt_dropcol_dml_text ADD PARTITION partfour VALUES('xyz');
NOTICE:  CREATE TABLE will create partition "mpp21090_pttab_addpt_dropcol_dml_text_1_prt_partfour" for table "mpp21090_pttab_addpt_dropcol_dml_text"
INSERT INTO mpp21090_pttab_addpt_dropcol_dml_text SELECT 'xyz','xyz','b',1;
SELECT * FROM mpp21090_pttab_addpt_dropcol_dml_text ORDER BY 1,2,3;
       col1       |       col2       | col3 | col4 
------------------+------------------+------+------
 abcdefghijklmnop | abcdefghijklmnop | a    |    0
 xyz              | xyz              | b    |    1
(2 rows)

ALTER TABLE mpp21090_pttab_addpt_dropcol_dml_text DROP COLUMN col1;
NOTICE:  Dropping a column that is part of the distribution policy forces a NULL distribution policy
NOTICE:  Dropping a column that is part of the distribution policy forces a NULL distribution policy
NOTICE:  Dropping a column that is part of the distribution policy forces a NULL distribution policy
NOTICE:  Dropping a column that is part of the distribution policy forces a NULL distribution policy
NOTICE:  Dropping a column that is part of the distribution policy forces a NULL distribution policy
INSERT INTO mpp21090_pttab_addpt_dropcol_dml_text SELECT 'xyz','b',1;
SELECT * FROM mpp21090_pttab_addpt_dropcol_dml_text ORDER BY 1,2,3;
       col2       | col3 | col4 
------------------+------+------
 abcdefghijklmnop | a    |    0
 xyz              | b    |    1
 xyz              | b    |    1
(3 rows)

UPDATE mpp21090_pttab_addpt_dropcol_dml_text SET col4 = 10 WHERE col2 = 'xyz';
SELECT * FROM mpp21090_pttab_addpt_dropcol_dml_text ORDER BY 1,2,3;
       col2       | col3 | col4 
------------------+------+------
 abcdefghijklmnop | a    |    0
 xyz              | b    |   10
 xyz              | b    |   10
(3 rows)

-- Update partition key
UPDATE mpp21090_pttab_addpt_dropcol_dml_text SET col2 = 'qrstuvwxyz' WHERE col2 = 'xyz';
ERROR:  moving tuple from partition "mpp21090_pttab_addpt_dropcol_dml_text_1_prt_partfour" to partition "mpp21090_pttab_addpt_dropcol_dml_text_1_prt_parttwo" not supported  (seg0 127.0.0.1:40000 pid=9829)
SELECT * FROM mpp21090_pttab_addpt_dropcol_dml_text ORDER BY 1,2,3;
       col2       | col3 | col4 
------------------+------+------
 abcdefghijklmnop | a    |    0
 xyz              | b    |   10
 xyz              | b    |   10
(3 rows)

DELETE FROM mpp21090_pttab_addpt_dropcol_dml_text WHERE col2 = 'qrstuvwxyz';
SELECT * FROM mpp21090_pttab_addpt_dropcol_dml_text ORDER BY 1,2,3;
       col2       | col3 | col4 
------------------+------+------
 abcdefghijklmnop | a    |    0
 xyz              | b    |   10
 xyz              | b    |   10
(3 rows)

-- TEST
DROP TABLE IF EXISTS mpp21090_pttab_dropcol_addcol_addpt_dml_char;
NOTICE:  table "mpp21090_pttab_dropcol_addcol_addpt_dml_char" does not exist, skipping
CREATE TABLE mpp21090_pttab_dropcol_addcol_addpt_dml_char
(
    col1 char,
    col2 char,
    col3 char,
    col4 int
) 
DISTRIBUTED by (col1)
PARTITION BY LIST(col2)(partition partone VALUES('a','b','c','d','e','f','g','h') WITH (APPENDONLY=true, COMPRESSLEVEL=5, ORIENTATION=column),partition parttwo VALUES('i','j','k','l','m','n','o','p') WITH (APPENDONLY=true, COMPRESSLEVEL=5, ORIENTATION=row),partition partthree VALUES('q','r','s','t','u','v','w','x'));
NOTICE:  CREATE TABLE will create partition "mpp21090_pttab_dropcol_addcol_addpt_dml_char_1_prt_partone" for table "mpp21090_pttab_dropcol_addcol_addpt_dml_char"
NOTICE:  CREATE TABLE will create partition "mpp21090_pttab_dropcol_addcol_addpt_dml_char_1_prt_parttwo" for table "mpp21090_pttab_dropcol_addcol_addpt_dml_char"
NOTICE:  CREATE TABLE will create partition "mpp21090_pttab_dropcol_addcol_addpt_dml_char_1_prt_partthree" for table "mpp21090_pttab_dropcol_addcol_addpt_dml_char"
INSERT INTO mpp21090_pttab_dropcol_addcol_addpt_dml_char VALUES('x','x','a',0);
ALTER TABLE mpp21090_pttab_dropcol_addcol_addpt_dml_char DROP COLUMN col4;
INSERT INTO mpp21090_pttab_dropcol_addcol_addpt_dml_char VALUES('x','x','b');
ALTER TABLE mpp21090_pttab_dropcol_addcol_addpt_dml_char ADD COLUMN col5 char DEFAULT 'x';
INSERT INTO mpp21090_pttab_dropcol_addcol_addpt_dml_char SELECT 'x','x','c','x';
SELECT * FROM mpp21090_pttab_dropcol_addcol_addpt_dml_char ORDER BY 1,2,3;
 col1 | col2 | col3 | col5 
------+------+------+------
 x    | x    | a    | x
 x    | x    | b    | x
 x    | x    | c    | x
(3 rows)

UPDATE mpp21090_pttab_dropcol_addcol_addpt_dml_char SET col5 = '-' WHERE col2 = 'x' AND col1 = 'x';
SELECT * FROM mpp21090_pttab_dropcol_addcol_addpt_dml_char ORDER BY 1,2,3;
 col1 | col2 | col3 | col5 
------+------+------+------
 x    | x    | a    | -
 x    | x    | b    | -
 x    | x    | c    | -
(3 rows)

DELETE FROM mpp21090_pttab_dropcol_addcol_addpt_dml_char WHERE col5 = '-';
SELECT * FROM mpp21090_pttab_dropcol_addcol_addpt_dml_char ORDER BY 1,2,3;
 col1 | col2 | col3 | col5 
------+------+------+------
(0 rows)

ALTER TABLE mpp21090_pttab_dropcol_addcol_addpt_dml_char ADD PARTITION partfour VALUES('y','z','-');
NOTICE:  CREATE TABLE will create partition "mpp21090_pttab_dropcol_addcol_addpt_dml_char_1_prt_partfour" for table "mpp21090_pttab_dropcol_addcol_addpt_dml_char"
ALTER TABLE mpp21090_pttab_dropcol_addcol_addpt_dml_char ADD DEFAULT partition def;
NOTICE:  CREATE TABLE will create partition "mpp21090_pttab_dropcol_addcol_addpt_dml_char_1_prt_def" for table "mpp21090_pttab_dropcol_addcol_addpt_dml_char"
INSERT INTO mpp21090_pttab_dropcol_addcol_addpt_dml_char SELECT 'z','z','d','z';
SELECT * FROM mpp21090_pttab_dropcol_addcol_addpt_dml_char ORDER BY 1,2,3;
 col1 | col2 | col3 | col5 
------+------+------+------
 z    | z    | d    | z
(1 row)

UPDATE mpp21090_pttab_dropcol_addcol_addpt_dml_char SET col5 = '-' WHERE col2 = 'z' AND col3 ='d';
SELECT * FROM mpp21090_pttab_dropcol_addcol_addpt_dml_char ORDER BY 1,2,3;
 col1 | col2 | col3 | col5 
------+------+------+------
 z    | z    | d    | -
(1 row)

-- Update partition key
UPDATE mpp21090_pttab_dropcol_addcol_addpt_dml_char SET col2 = '-' WHERE col2 = 'z' AND col3 ='d';
SELECT * FROM mpp21090_pttab_dropcol_addcol_addpt_dml_char ORDER BY 1,2,3;
 col1 | col2 | col3 | col5 
------+------+------+------
 z    | -    | d    | -
(1 row)

DELETE FROM mpp21090_pttab_dropcol_addcol_addpt_dml_char WHERE col5 = '-';
SELECT * FROM mpp21090_pttab_dropcol_addcol_addpt_dml_char ORDER BY 1,2,3;
 col1 | col2 | col3 | col5 
------+------+------+------
(0 rows)

-- TEST
DROP TABLE IF EXISTS mpp21090_pttab_dropcol_addcol_addpt_dml_decimal;
NOTICE:  table "mpp21090_pttab_dropcol_addcol_addpt_dml_decimal" does not exist, skipping
CREATE TABLE mpp21090_pttab_dropcol_addcol_addpt_dml_decimal
(
    col1 decimal,
    col2 decimal,
    col3 char,
    col4 int
) 
DISTRIBUTED by (col1)
PARTITION BY RANGE(col2)(partition partone start(1.00) end(10.00)  WITH (APPENDONLY=true, COMPRESSLEVEL=5, ORIENTATION=column),partition parttwo start(10.00) end(20.00) WITH (APPENDONLY=true, COMPRESSLEVEL=5, ORIENTATION=row),partition partthree start(20.00) end(30.00));
NOTICE:  CREATE TABLE will create partition "mpp21090_pttab_dropcol_addcol_addpt_dml_decimal_1_prt_partone" for table "mpp21090_pttab_dropcol_addcol_addpt_dml_decimal"
NOTICE:  CREATE TABLE will create partition "mpp21090_pttab_dropcol_addcol_addpt_dml_decimal_1_prt_parttwo" for table "mpp21090_pttab_dropcol_addcol_addpt_dml_decimal"
NOTICE:  CREATE TABLE will create partition "mpp21090_pttab_dropcol_addcol_addpt_dml_decimal_1_prt_partthree" for table "mpp21090_pttab_dropcol_addcol_addpt_dml_decimal"
INSERT INTO mpp21090_pttab_dropcol_addcol_addpt_dml_decimal VALUES(2.00,2.00,'a',0);
ALTER TABLE mpp21090_pttab_dropcol_addcol_addpt_dml_decimal DROP COLUMN col4;
INSERT INTO mpp21090_pttab_dropcol_addcol_addpt_dml_decimal VALUES(2.00,2.00,'b');
ALTER TABLE mpp21090_pttab_dropcol_addcol_addpt_dml_decimal ADD COLUMN col5 decimal DEFAULT 2.00;
INSERT INTO mpp21090_pttab_dropcol_addcol_addpt_dml_decimal SELECT 2.00,2.00,'c',2.00;
SELECT * FROM mpp21090_pttab_dropcol_addcol_addpt_dml_decimal ORDER BY 1,2,3;
 col1 | col2 | col3 | col5 
------+------+------+------
 2.00 | 2.00 | a    | 2.00
 2.00 | 2.00 | b    | 2.00
 2.00 | 2.00 | c    | 2.00
(3 rows)

UPDATE mpp21090_pttab_dropcol_addcol_addpt_dml_decimal SET col5 = 1.00 WHERE col2 = 2.00 AND col1 = 2.00;
SELECT * FROM mpp21090_pttab_dropcol_addcol_addpt_dml_decimal ORDER BY 1,2,3;
 col1 | col2 | col3 | col5 
------+------+------+------
 2.00 | 2.00 | a    | 1.00
 2.00 | 2.00 | b    | 1.00
 2.00 | 2.00 | c    | 1.00
(3 rows)

DELETE FROM mpp21090_pttab_dropcol_addcol_addpt_dml_decimal WHERE col5 = 1.00;
SELECT * FROM mpp21090_pttab_dropcol_addcol_addpt_dml_decimal ORDER BY 1,2,3;
 col1 | col2 | col3 | col5 
------+------+------+------
(0 rows)

ALTER TABLE mpp21090_pttab_dropcol_addcol_addpt_dml_decimal ADD PARTITION partfour start(30.00) end(40.00) inclusive;
NOTICE:  CREATE TABLE will create partition "mpp21090_pttab_dropcol_addcol_addpt_dml_decimal_1_prt_partfour" for table "mpp21090_pttab_dropcol_addcol_addpt_dml_decimal"
ALTER TABLE mpp21090_pttab_dropcol_addcol_addpt_dml_decimal ADD DEFAULT partition def;
NOTICE:  CREATE TABLE will create partition "mpp21090_pttab_dropcol_addcol_addpt_dml_decimal_1_prt_def" for table "mpp21090_pttab_dropcol_addcol_addpt_dml_decimal"
INSERT INTO mpp21090_pttab_dropcol_addcol_addpt_dml_decimal SELECT 35.00,35.00,'d',35.00;
SELECT * FROM mpp21090_pttab_dropcol_addcol_addpt_dml_decimal ORDER BY 1,2,3;
 col1  | col2  | col3 | col5  
-------+-------+------+-------
 35.00 | 35.00 | d    | 35.00
(1 row)

UPDATE mpp21090_pttab_dropcol_addcol_addpt_dml_decimal SET col5 = 1.00 WHERE col2 = 35.00 AND col3 ='d';
SELECT * FROM mpp21090_pttab_dropcol_addcol_addpt_dml_decimal ORDER BY 1,2,3;
 col1  | col2  | col3 | col5 
-------+-------+------+------
 35.00 | 35.00 | d    | 1.00
(1 row)

-- Update partition key
UPDATE mpp21090_pttab_dropcol_addcol_addpt_dml_decimal SET col2 = 1.00 WHERE col2 = 35.00 AND col3 ='d';
ERROR:  moving tuple from partition "mpp21090_pttab_dropcol_addcol_addpt_dml_decimal_1_prt_partfour" to partition "mpp21090_pttab_dropcol_addcol_addpt_dml_decimal_1_prt_partone" not supported  (seg0 127.0.0.1:40000 pid=9829)
SELECT * FROM mpp21090_pttab_dropcol_addcol_addpt_dml_decimal ORDER BY 1,2,3;
 col1  | col2  | col3 | col5 
-------+-------+------+------
 35.00 | 35.00 | d    | 1.00
(1 row)

DELETE FROM mpp21090_pttab_dropcol_addcol_addpt_dml_decimal WHERE col5 = 1.00;
SELECT * FROM mpp21090_pttab_dropcol_addcol_addpt_dml_decimal ORDER BY 1,2,3;
 col1 | col2 | col3 | col5 
------+------+------+------
(0 rows)

-- TEST
DROP TABLE IF EXISTS mpp21090_pttab_dropcol_addcol_addpt_dml_int4;
NOTICE:  table "mpp21090_pttab_dropcol_addcol_addpt_dml_int4" does not exist, skipping
CREATE TABLE mpp21090_pttab_dropcol_addcol_addpt_dml_int4
(
    col1 int4,
    col2 int4,
    col3 char,
    col4 int
) 
DISTRIBUTED by (col1)
PARTITION BY RANGE(col2)(partition partone start(1) end(100000001)  WITH (APPENDONLY=true, COMPRESSLEVEL=5, ORIENTATION=column),partition parttwo start(100000001) end(200000001) WITH (APPENDONLY=true, COMPRESSLEVEL=5, ORIENTATION=row),partition partthree start(200000001) end(300000001));
NOTICE:  CREATE TABLE will create partition "mpp21090_pttab_dropcol_addcol_addpt_dml_int4_1_prt_partone" for table "mpp21090_pttab_dropcol_addcol_addpt_dml_int4"
NOTICE:  CREATE TABLE will create partition "mpp21090_pttab_dropcol_addcol_addpt_dml_int4_1_prt_parttwo" for table "mpp21090_pttab_dropcol_addcol_addpt_dml_int4"
NOTICE:  CREATE TABLE will create partition "mpp21090_pttab_dropcol_addcol_addpt_dml_int4_1_prt_partthree" for table "mpp21090_pttab_dropcol_addcol_addpt_dml_int4"
INSERT INTO mpp21090_pttab_dropcol_addcol_addpt_dml_int4 VALUES(20000000,20000000,'a',0);
ALTER TABLE mpp21090_pttab_dropcol_addcol_addpt_dml_int4 DROP COLUMN col4;
INSERT INTO mpp21090_pttab_dropcol_addcol_addpt_dml_int4 VALUES(20000000,20000000,'b');
ALTER TABLE mpp21090_pttab_dropcol_addcol_addpt_dml_int4 ADD COLUMN col5 int4 DEFAULT 20000000;
INSERT INTO mpp21090_pttab_dropcol_addcol_addpt_dml_int4 SELECT 20000000,20000000,'c',20000000;
SELECT * FROM mpp21090_pttab_dropcol_addcol_addpt_dml_int4 ORDER BY 1,2,3;
   col1   |   col2   | col3 |   col5   
----------+----------+------+----------
 20000000 | 20000000 | a    | 20000000
 20000000 | 20000000 | b    | 20000000
 20000000 | 20000000 | c    | 20000000
(3 rows)

UPDATE mpp21090_pttab_dropcol_addcol_addpt_dml_int4 SET col5 = 10000000 WHERE col2 = 20000000 AND col1 = 20000000;
SELECT * FROM mpp21090_pttab_dropcol_addcol_addpt_dml_int4 ORDER BY 1,2,3;
   col1   |   col2   | col3 |   col5   
----------+----------+------+----------
 20000000 | 20000000 | a    | 10000000
 20000000 | 20000000 | b    | 10000000
 20000000 | 20000000 | c    | 10000000
(3 rows)

DELETE FROM mpp21090_pttab_dropcol_addcol_addpt_dml_int4 WHERE col5 = 10000000;
SELECT * FROM mpp21090_pttab_dropcol_addcol_addpt_dml_int4 ORDER BY 1,2,3;
 col1 | col2 | col3 | col5 
------+------+------+------
(0 rows)

ALTER TABLE mpp21090_pttab_dropcol_addcol_addpt_dml_int4 ADD PARTITION partfour start(300000001) end(400000001);
NOTICE:  CREATE TABLE will create partition "mpp21090_pttab_dropcol_addcol_addpt_dml_int4_1_prt_partfour" for table "mpp21090_pttab_dropcol_addcol_addpt_dml_int4"
ALTER TABLE mpp21090_pttab_dropcol_addcol_addpt_dml_int4 ADD DEFAULT partition def;
NOTICE:  CREATE TABLE will create partition "mpp21090_pttab_dropcol_addcol_addpt_dml_int4_1_prt_def" for table "mpp21090_pttab_dropcol_addcol_addpt_dml_int4"
INSERT INTO mpp21090_pttab_dropcol_addcol_addpt_dml_int4 SELECT 35000000,35000000,'d',35000000;
SELECT * FROM mpp21090_pttab_dropcol_addcol_addpt_dml_int4 ORDER BY 1,2,3;
   col1   |   col2   | col3 |   col5   
----------+----------+------+----------
 35000000 | 35000000 | d    | 35000000
(1 row)

UPDATE mpp21090_pttab_dropcol_addcol_addpt_dml_int4 SET col5 = 10000000 WHERE col2 = 35000000 AND col3 ='d';
SELECT * FROM mpp21090_pttab_dropcol_addcol_addpt_dml_int4 ORDER BY 1,2,3;
   col1   |   col2   | col3 |   col5   
----------+----------+------+----------
 35000000 | 35000000 | d    | 10000000
(1 row)

-- Update partition key
UPDATE mpp21090_pttab_dropcol_addcol_addpt_dml_int4 SET col2 = 10000000 WHERE col2 = 35000000 AND col3 ='d';
SELECT * FROM mpp21090_pttab_dropcol_addcol_addpt_dml_int4 ORDER BY 1,2,3;
   col1   |   col2   | col3 |   col5   
----------+----------+------+----------
 35000000 | 10000000 | d    | 10000000
(1 row)

DELETE FROM mpp21090_pttab_dropcol_addcol_addpt_dml_int4 WHERE col5 = 10000000;
SELECT * FROM mpp21090_pttab_dropcol_addcol_addpt_dml_int4 ORDER BY 1,2,3;
 col1 | col2 | col3 | col5 
------+------+------+------
(0 rows)

-- TEST
DROP TABLE IF EXISTS mpp21090_pttab_dropcol_addcol_addpt_dml_int8;
NOTICE:  table "mpp21090_pttab_dropcol_addcol_addpt_dml_int8" does not exist, skipping
CREATE TABLE mpp21090_pttab_dropcol_addcol_addpt_dml_int8
(
    col1 int8,
    col2 int8,
    col3 char,
    col4 int
) 
DISTRIBUTED by (col1)
PARTITION BY RANGE(col2)(partition partone start(1) end(1000000000000000001)  WITH (APPENDONLY=true, COMPRESSLEVEL=5, ORIENTATION=column),partition parttwo start(1000000000000000001) end(2000000000000000001) WITH (APPENDONLY=true, COMPRESSLEVEL=5, ORIENTATION=row),partition partthree start(2000000000000000001) end(3000000000000000001));
NOTICE:  CREATE TABLE will create partition "mpp21090_pttab_dropcol_addcol_addpt_dml_int8_1_prt_partone" for table "mpp21090_pttab_dropcol_addcol_addpt_dml_int8"
NOTICE:  CREATE TABLE will create partition "mpp21090_pttab_dropcol_addcol_addpt_dml_int8_1_prt_parttwo" for table "mpp21090_pttab_dropcol_addcol_addpt_dml_int8"
NOTICE:  CREATE TABLE will create partition "mpp21090_pttab_dropcol_addcol_addpt_dml_int8_1_prt_partthree" for table "mpp21090_pttab_dropcol_addcol_addpt_dml_int8"
INSERT INTO mpp21090_pttab_dropcol_addcol_addpt_dml_int8 VALUES(2000000000000000000,2000000000000000000,'a',0);
ALTER TABLE mpp21090_pttab_dropcol_addcol_addpt_dml_int8 DROP COLUMN col4;
INSERT INTO mpp21090_pttab_dropcol_addcol_addpt_dml_int8 VALUES(2000000000000000000,2000000000000000000,'b');
ALTER TABLE mpp21090_pttab_dropcol_addcol_addpt_dml_int8 ADD COLUMN col5 int8 DEFAULT 2000000000000000000;
INSERT INTO mpp21090_pttab_dropcol_addcol_addpt_dml_int8 SELECT 2000000000000000000,2000000000000000000,'c',2000000000000000000;
SELECT * FROM mpp21090_pttab_dropcol_addcol_addpt_dml_int8 ORDER BY 1,2,3;
        col1         |        col2         | col3 |        col5         
---------------------+---------------------+------+---------------------
 2000000000000000000 | 2000000000000000000 | a    | 2000000000000000000
 2000000000000000000 | 2000000000000000000 | b    | 2000000000000000000
 2000000000000000000 | 2000000000000000000 | c    | 2000000000000000000
(3 rows)

UPDATE mpp21090_pttab_dropcol_addcol_addpt_dml_int8 SET col5 = 1000000000000000000 WHERE col2 = 2000000000000000000 AND col1 = 2000000000000000000;
SELECT * FROM mpp21090_pttab_dropcol_addcol_addpt_dml_int8 ORDER BY 1,2,3;
        col1         |        col2         | col3 |        col5         
---------------------+---------------------+------+---------------------
 2000000000000000000 | 2000000000000000000 | a    | 1000000000000000000
 2000000000000000000 | 2000000000000000000 | b    | 1000000000000000000
 2000000000000000000 | 2000000000000000000 | c    | 1000000000000000000
(3 rows)

DELETE FROM mpp21090_pttab_dropcol_addcol_addpt_dml_int8 WHERE col5 = 1000000000000000000;
SELECT * FROM mpp21090_pttab_dropcol_addcol_addpt_dml_int8 ORDER BY 1,2,3;
 col1 | col2 | col3 | col5 
------+------+------+------
(0 rows)

ALTER TABLE mpp21090_pttab_dropcol_addcol_addpt_dml_int8 ADD PARTITION partfour start(3000000000000000001) end(4000000000000000001);
NOTICE:  CREATE TABLE will create partition "mpp21090_pttab_dropcol_addcol_addpt_dml_int8_1_prt_partfour" for table "mpp21090_pttab_dropcol_addcol_addpt_dml_int8"
ALTER TABLE mpp21090_pttab_dropcol_addcol_addpt_dml_int8 ADD DEFAULT partition def;
NOTICE:  CREATE TABLE will create partition "mpp21090_pttab_dropcol_addcol_addpt_dml_int8_1_prt_def" for table "mpp21090_pttab_dropcol_addcol_addpt_dml_int8"
INSERT INTO mpp21090_pttab_dropcol_addcol_addpt_dml_int8 SELECT 3500000000000000000,3500000000000000000,'d',3500000000000000000;
SELECT * FROM mpp21090_pttab_dropcol_addcol_addpt_dml_int8 ORDER BY 1,2,3;
        col1         |        col2         | col3 |        col5         
---------------------+---------------------+------+---------------------
 3500000000000000000 | 3500000000000000000 | d    | 3500000000000000000
(1 row)

UPDATE mpp21090_pttab_dropcol_addcol_addpt_dml_int8 SET col5 = 1000000000000000000 WHERE col2 = 3500000000000000000 AND col3 ='d';
SELECT * FROM mpp21090_pttab_dropcol_addcol_addpt_dml_int8 ORDER BY 1,2,3;
        col1         |        col2         | col3 |        col5         
---------------------+---------------------+------+---------------------
 3500000000000000000 | 3500000000000000000 | d    | 1000000000000000000
(1 row)

-- Update partition key
UPDATE mpp21090_pttab_dropcol_addcol_addpt_dml_int8 SET col2 = 1000000000000000000 WHERE col2 = 3500000000000000000 AND col3 ='d';
ERROR:  moving tuple from partition "mpp21090_pttab_dropcol_addcol_addpt_dml_int8_1_prt_partfour" to partition "mpp21090_pttab_dropcol_addcol_addpt_dml_int8_1_prt_partone" not supported  (seg1 127.0.0.1:40001 pid=9830)
SELECT * FROM mpp21090_pttab_dropcol_addcol_addpt_dml_int8 ORDER BY 1,2,3;
        col1         |        col2         | col3 |        col5         
---------------------+---------------------+------+---------------------
 3500000000000000000 | 3500000000000000000 | d    | 1000000000000000000
(1 row)

DELETE FROM mpp21090_pttab_dropcol_addcol_addpt_dml_int8 WHERE col5 = 1000000000000000000;
SELECT * FROM mpp21090_pttab_dropcol_addcol_addpt_dml_int8 ORDER BY 1,2,3;
 col1 | col2 | col3 | col5 
------+------+------+------
(0 rows)

-- TEST
DROP TABLE IF EXISTS mpp21090_pttab_dropcol_addcol_addpt_dml_interval;
NOTICE:  table "mpp21090_pttab_dropcol_addcol_addpt_dml_interval" does not exist, skipping
CREATE TABLE mpp21090_pttab_dropcol_addcol_addpt_dml_interval
(
    col1 interval,
    col2 interval,
    col3 char,
    col4 int
) 
DISTRIBUTED by (col1)
PARTITION BY RANGE(col2)(partition partone start('1 sec') end('1 min')  WITH (APPENDONLY=true, COMPRESSLEVEL=5, ORIENTATION=column),partition parttwo start('1 min') end('1 hour') WITH (APPENDONLY=true, COMPRESSLEVEL=5, ORIENTATION=row),partition partthree start('1 hour') end('12 hours'));
NOTICE:  CREATE TABLE will create partition "mpp21090_pttab_dropcol_addcol_addpt_dml_interval_1_prt_partone" for table "mpp21090_pttab_dropcol_addcol_addpt_dml_interval"
NOTICE:  CREATE TABLE will create partition "mpp21090_pttab_dropcol_addcol_addpt_dml_interval_1_prt_parttwo" for table "mpp21090_pttab_dropcol_addcol_addpt_dml_interval"
NOTICE:  CREATE TABLE will create partition "mpp21090_pttab_dropcol_addcol_addpt_dml_interva_1_prt_partthree" for table "mpp21090_pttab_dropcol_addcol_addpt_dml_interval"
INSERT INTO mpp21090_pttab_dropcol_addcol_addpt_dml_interval VALUES('1 hour','1 hour','a',0);
ALTER TABLE mpp21090_pttab_dropcol_addcol_addpt_dml_interval DROP COLUMN col4;
INSERT INTO mpp21090_pttab_dropcol_addcol_addpt_dml_interval VALUES('1 hour','1 hour','b');
ALTER TABLE mpp21090_pttab_dropcol_addcol_addpt_dml_interval ADD COLUMN col5 interval DEFAULT '1 hour';
INSERT INTO mpp21090_pttab_dropcol_addcol_addpt_dml_interval SELECT '1 hour','1 hour','c','1 hour';
SELECT * FROM mpp21090_pttab_dropcol_addcol_addpt_dml_interval ORDER BY 1,2,3;
   col1   |   col2   | col3 |   col5   
----------+----------+------+----------
 01:00:00 | 01:00:00 | a    | 01:00:00
 01:00:00 | 01:00:00 | b    | 01:00:00
 01:00:00 | 01:00:00 | c    | 01:00:00
(3 rows)

UPDATE mpp21090_pttab_dropcol_addcol_addpt_dml_interval SET col5 = '12 hours' WHERE col2 = '1 hour' AND col1 = '1 hour';
SELECT * FROM mpp21090_pttab_dropcol_addcol_addpt_dml_interval ORDER BY 1,2,3;
   col1   |   col2   | col3 |   col5   
----------+----------+------+----------
 01:00:00 | 01:00:00 | a    | 12:00:00
 01:00:00 | 01:00:00 | b    | 12:00:00
 01:00:00 | 01:00:00 | c    | 12:00:00
(3 rows)

DELETE FROM mpp21090_pttab_dropcol_addcol_addpt_dml_interval WHERE col5 = '12 hours';
SELECT * FROM mpp21090_pttab_dropcol_addcol_addpt_dml_interval ORDER BY 1,2,3;
 col1 | col2 | col3 | col5 
------+------+------+------
(0 rows)

ALTER TABLE mpp21090_pttab_dropcol_addcol_addpt_dml_interval ADD PARTITION partfour start('12 hours') end('1 day') inclusive;
NOTICE:  CREATE TABLE will create partition "mpp21090_pttab_dropcol_addcol_addpt_dml_interval_1_prt_partfour" for table "mpp21090_pttab_dropcol_addcol_addpt_dml_interval"
ALTER TABLE mpp21090_pttab_dropcol_addcol_addpt_dml_interval ADD DEFAULT partition def;
NOTICE:  CREATE TABLE will create partition "mpp21090_pttab_dropcol_addcol_addpt_dml_interval_1_prt_def" for table "mpp21090_pttab_dropcol_addcol_addpt_dml_interval"
INSERT INTO mpp21090_pttab_dropcol_addcol_addpt_dml_interval SELECT '14 hours','14 hours','d','14 hours';
SELECT * FROM mpp21090_pttab_dropcol_addcol_addpt_dml_interval ORDER BY 1,2,3;
   col1   |   col2   | col3 |   col5   
----------+----------+------+----------
 14:00:00 | 14:00:00 | d    | 14:00:00
(1 row)

UPDATE mpp21090_pttab_dropcol_addcol_addpt_dml_interval SET col5 = '12 hours' WHERE col2 = '14 hours' AND col3 ='d';
SELECT * FROM mpp21090_pttab_dropcol_addcol_addpt_dml_interval ORDER BY 1,2,3;
   col1   |   col2   | col3 |   col5   
----------+----------+------+----------
 14:00:00 | 14:00:00 | d    | 12:00:00
(1 row)

-- Update partition key
UPDATE mpp21090_pttab_dropcol_addcol_addpt_dml_interval SET col2 = '12 hours' WHERE col2 = '14 hours' AND col3 ='d';
SELECT * FROM mpp21090_pttab_dropcol_addcol_addpt_dml_interval ORDER BY 1,2,3;
   col1   |   col2   | col3 |   col5   
----------+----------+------+----------
 14:00:00 | 12:00:00 | d    | 12:00:00
(1 row)

DELETE FROM mpp21090_pttab_dropcol_addcol_addpt_dml_interval WHERE col5 = '12 hours';
SELECT * FROM mpp21090_pttab_dropcol_addcol_addpt_dml_interval ORDER BY 1,2,3;
 col1 | col2 | col3 | col5 
------+------+------+------
(0 rows)

-- TEST
DROP TABLE IF EXISTS mpp21090_pttab_dropcol_addcol_addpt_dml_numeric;
NOTICE:  table "mpp21090_pttab_dropcol_addcol_addpt_dml_numeric" does not exist, skipping
CREATE TABLE mpp21090_pttab_dropcol_addcol_addpt_dml_numeric
(
    col1 numeric,
    col2 numeric,
    col3 char,
    col4 int
) 
DISTRIBUTED by (col1)
PARTITION BY RANGE(col2)(partition partone start(1.000000) end(10.000000)  WITH (APPENDONLY=true, COMPRESSLEVEL=5, ORIENTATION=column),partition parttwo start(10.000000) end(20.000000) WITH (APPENDONLY=true, COMPRESSLEVEL=5, ORIENTATION=row),partition partthree start(20.000000) end(30.000000));
NOTICE:  CREATE TABLE will create partition "mpp21090_pttab_dropcol_addcol_addpt_dml_numeric_1_prt_partone" for table "mpp21090_pttab_dropcol_addcol_addpt_dml_numeric"
NOTICE:  CREATE TABLE will create partition "mpp21090_pttab_dropcol_addcol_addpt_dml_numeric_1_prt_parttwo" for table "mpp21090_pttab_dropcol_addcol_addpt_dml_numeric"
NOTICE:  CREATE TABLE will create partition "mpp21090_pttab_dropcol_addcol_addpt_dml_numeric_1_prt_partthree" for table "mpp21090_pttab_dropcol_addcol_addpt_dml_numeric"
INSERT INTO mpp21090_pttab_dropcol_addcol_addpt_dml_numeric VALUES(2.000000,2.000000,'a',0);
ALTER TABLE mpp21090_pttab_dropcol_addcol_addpt_dml_numeric DROP COLUMN col4;
INSERT INTO mpp21090_pttab_dropcol_addcol_addpt_dml_numeric VALUES(2.000000,2.000000,'b');
ALTER TABLE mpp21090_pttab_dropcol_addcol_addpt_dml_numeric ADD COLUMN col5 numeric DEFAULT 2.000000;
INSERT INTO mpp21090_pttab_dropcol_addcol_addpt_dml_numeric SELECT 2.000000,2.000000,'c',2.000000;
SELECT * FROM mpp21090_pttab_dropcol_addcol_addpt_dml_numeric ORDER BY 1,2,3;
   col1   |   col2   | col3 |   col5   
----------+----------+------+----------
 2.000000 | 2.000000 | a    | 2.000000
 2.000000 | 2.000000 | b    | 2.000000
 2.000000 | 2.000000 | c    | 2.000000
(3 rows)

UPDATE mpp21090_pttab_dropcol_addcol_addpt_dml_numeric SET col5 = 1.000000 WHERE col2 = 2.000000 AND col1 = 2.000000;
SELECT * FROM mpp21090_pttab_dropcol_addcol_addpt_dml_numeric ORDER BY 1,2,3;
   col1   |   col2   | col3 |   col5   
----------+----------+------+----------
 2.000000 | 2.000000 | a    | 1.000000
 2.000000 | 2.000000 | b    | 1.000000
 2.000000 | 2.000000 | c    | 1.000000
(3 rows)

DELETE FROM mpp21090_pttab_dropcol_addcol_addpt_dml_numeric WHERE col5 = 1.000000;
SELECT * FROM mpp21090_pttab_dropcol_addcol_addpt_dml_numeric ORDER BY 1,2,3;
 col1 | col2 | col3 | col5 
------+------+------+------
(0 rows)

ALTER TABLE mpp21090_pttab_dropcol_addcol_addpt_dml_numeric ADD PARTITION partfour start(30.000000) end(40.000000) inclusive;
NOTICE:  CREATE TABLE will create partition "mpp21090_pttab_dropcol_addcol_addpt_dml_numeric_1_prt_partfour" for table "mpp21090_pttab_dropcol_addcol_addpt_dml_numeric"
ALTER TABLE mpp21090_pttab_dropcol_addcol_addpt_dml_numeric ADD DEFAULT partition def;
NOTICE:  CREATE TABLE will create partition "mpp21090_pttab_dropcol_addcol_addpt_dml_numeric_1_prt_def" for table "mpp21090_pttab_dropcol_addcol_addpt_dml_numeric"
INSERT INTO mpp21090_pttab_dropcol_addcol_addpt_dml_numeric SELECT 35.000000,35.000000,'d',35.000000;
SELECT * FROM mpp21090_pttab_dropcol_addcol_addpt_dml_numeric ORDER BY 1,2,3;
   col1    |   col2    | col3 |   col5    
-----------+-----------+------+-----------
 35.000000 | 35.000000 | d    | 35.000000
(1 row)

UPDATE mpp21090_pttab_dropcol_addcol_addpt_dml_numeric SET col5 = 1.000000 WHERE col2 = 35.000000 AND col3 ='d';
SELECT * FROM mpp21090_pttab_dropcol_addcol_addpt_dml_numeric ORDER BY 1,2,3;
   col1    |   col2    | col3 |   col5   
-----------+-----------+------+----------
 35.000000 | 35.000000 | d    | 1.000000
(1 row)

-- Update partition key
UPDATE mpp21090_pttab_dropcol_addcol_addpt_dml_numeric SET col2 = 1.000000 WHERE col2 = 35.000000 AND col3 ='d';
ERROR:  moving tuple from partition "mpp21090_pttab_dropcol_addcol_addpt_dml_numeric_1_prt_partfour" to partition "mpp21090_pttab_dropcol_addcol_addpt_dml_numeric_1_prt_partone" not supported  (seg0 127.0.0.1:40000 pid=9829)
SELECT * FROM mpp21090_pttab_dropcol_addcol_addpt_dml_numeric ORDER BY 1,2,3;
   col1    |   col2    | col3 |   col5   
-----------+-----------+------+----------
 35.000000 | 35.000000 | d    | 1.000000
(1 row)

DELETE FROM mpp21090_pttab_dropcol_addcol_addpt_dml_numeric WHERE col5 = 1.000000;
SELECT * FROM mpp21090_pttab_dropcol_addcol_addpt_dml_numeric ORDER BY 1,2,3;
 col1 | col2 | col3 | col5 
------+------+------+------
(0 rows)

-- TEST
DROP TABLE IF EXISTS mpp21090_pttab_dropcol_addcol_addpt_dml_text;
NOTICE:  table "mpp21090_pttab_dropcol_addcol_addpt_dml_text" does not exist, skipping
CREATE TABLE mpp21090_pttab_dropcol_addcol_addpt_dml_text
(
    col1 text,
    col2 text,
    col3 char,
    col4 int
) 
DISTRIBUTED by (col1)
PARTITION BY LIST(col2)(partition partone VALUES('abcdefghijklmnop') WITH (APPENDONLY=true, COMPRESSLEVEL=5, ORIENTATION=column),partition parttwo VALUES('qrstuvwxyz') WITH (APPENDONLY=true, COMPRESSLEVEL=5, ORIENTATION=row),partition partthree VALUES('ghi'));
NOTICE:  CREATE TABLE will create partition "mpp21090_pttab_dropcol_addcol_addpt_dml_text_1_prt_partone" for table "mpp21090_pttab_dropcol_addcol_addpt_dml_text"
NOTICE:  CREATE TABLE will create partition "mpp21090_pttab_dropcol_addcol_addpt_dml_text_1_prt_parttwo" for table "mpp21090_pttab_dropcol_addcol_addpt_dml_text"
NOTICE:  CREATE TABLE will create partition "mpp21090_pttab_dropcol_addcol_addpt_dml_text_1_prt_partthree" for table "mpp21090_pttab_dropcol_addcol_addpt_dml_text"
INSERT INTO mpp21090_pttab_dropcol_addcol_addpt_dml_text VALUES('abcdefghijklmnop','abcdefghijklmnop','a',0);
ALTER TABLE mpp21090_pttab_dropcol_addcol_addpt_dml_text DROP COLUMN col4;
INSERT INTO mpp21090_pttab_dropcol_addcol_addpt_dml_text VALUES('abcdefghijklmnop','abcdefghijklmnop','b');
ALTER TABLE mpp21090_pttab_dropcol_addcol_addpt_dml_text ADD COLUMN col5 text DEFAULT 'abcdefghijklmnop';
INSERT INTO mpp21090_pttab_dropcol_addcol_addpt_dml_text SELECT 'abcdefghijklmnop','abcdefghijklmnop','c','abcdefghijklmnop';
SELECT * FROM mpp21090_pttab_dropcol_addcol_addpt_dml_text ORDER BY 1,2,3;
       col1       |       col2       | col3 |       col5       
------------------+------------------+------+------------------
 abcdefghijklmnop | abcdefghijklmnop | a    | abcdefghijklmnop
 abcdefghijklmnop | abcdefghijklmnop | b    | abcdefghijklmnop
 abcdefghijklmnop | abcdefghijklmnop | c    | abcdefghijklmnop
(3 rows)

UPDATE mpp21090_pttab_dropcol_addcol_addpt_dml_text SET col5 = 'qrstuvwxyz' WHERE col2 = 'abcdefghijklmnop' AND col1 = 'abcdefghijklmnop';
SELECT * FROM mpp21090_pttab_dropcol_addcol_addpt_dml_text ORDER BY 1,2,3;
       col1       |       col2       | col3 |    col5    
------------------+------------------+------+------------
 abcdefghijklmnop | abcdefghijklmnop | a    | qrstuvwxyz
 abcdefghijklmnop | abcdefghijklmnop | b    | qrstuvwxyz
 abcdefghijklmnop | abcdefghijklmnop | c    | qrstuvwxyz
(3 rows)

DELETE FROM mpp21090_pttab_dropcol_addcol_addpt_dml_text WHERE col5 = 'qrstuvwxyz';
SELECT * FROM mpp21090_pttab_dropcol_addcol_addpt_dml_text ORDER BY 1,2,3;
 col1 | col2 | col3 | col5 
------+------+------+------
(0 rows)

ALTER TABLE mpp21090_pttab_dropcol_addcol_addpt_dml_text ADD PARTITION partfour VALUES('xyz');
NOTICE:  CREATE TABLE will create partition "mpp21090_pttab_dropcol_addcol_addpt_dml_text_1_prt_partfour" for table "mpp21090_pttab_dropcol_addcol_addpt_dml_text"
ALTER TABLE mpp21090_pttab_dropcol_addcol_addpt_dml_text ADD DEFAULT partition def;
NOTICE:  CREATE TABLE will create partition "mpp21090_pttab_dropcol_addcol_addpt_dml_text_1_prt_def" for table "mpp21090_pttab_dropcol_addcol_addpt_dml_text"
INSERT INTO mpp21090_pttab_dropcol_addcol_addpt_dml_text SELECT 'xyz','xyz','d','xyz';
SELECT * FROM mpp21090_pttab_dropcol_addcol_addpt_dml_text ORDER BY 1,2,3;
 col1 | col2 | col3 | col5 
------+------+------+------
 xyz  | xyz  | d    | xyz
(1 row)

UPDATE mpp21090_pttab_dropcol_addcol_addpt_dml_text SET col5 = 'qrstuvwxyz' WHERE col2 = 'xyz' AND col3 ='d';
SELECT * FROM mpp21090_pttab_dropcol_addcol_addpt_dml_text ORDER BY 1,2,3;
 col1 | col2 | col3 |    col5    
------+------+------+------------
 xyz  | xyz  | d    | qrstuvwxyz
(1 row)

-- Update partition key
UPDATE mpp21090_pttab_dropcol_addcol_addpt_dml_text SET col2 = 'qrstuvwxyz' WHERE col2 = 'xyz' AND col3 ='d';
ERROR:  moving tuple from partition "mpp21090_pttab_dropcol_addcol_addpt_dml_text_1_prt_partfour" to partition "mpp21090_pttab_dropcol_addcol_addpt_dml_text_1_prt_parttwo" not supported  (seg0 127.0.0.1:40000 pid=9829)
SELECT * FROM mpp21090_pttab_dropcol_addcol_addpt_dml_text ORDER BY 1,2,3;
 col1 | col2 | col3 |    col5    
------+------+------+------------
 xyz  | xyz  | d    | qrstuvwxyz
(1 row)

DELETE FROM mpp21090_pttab_dropcol_addcol_addpt_dml_text WHERE col5 = 'qrstuvwxyz';
SELECT * FROM mpp21090_pttab_dropcol_addcol_addpt_dml_text ORDER BY 1,2,3;
 col1 | col2 | col3 | col5 
------+------+------+------
(0 rows)

-- TEST
DROP TABLE IF EXISTS mpp21090_pttab_dropcol_addcol_addpt_idx_dml_char;
NOTICE:  table "mpp21090_pttab_dropcol_addcol_addpt_idx_dml_char" does not exist, skipping
CREATE TABLE mpp21090_pttab_dropcol_addcol_addpt_idx_dml_char
(
    col1 char,
    col2 char,
    col3 char,
    col4 int
) 
DISTRIBUTED by (col1)
PARTITION BY LIST(col2)(partition partone VALUES('a','b','c','d','e','f','g','h') WITH (APPENDONLY=true, COMPRESSLEVEL=5, ORIENTATION=column),partition parttwo VALUES('i','j','k','l','m','n','o','p') WITH (APPENDONLY=true, COMPRESSLEVEL=5, ORIENTATION=row),partition partthree VALUES('q','r','s','t','u','v','w','x'));
NOTICE:  CREATE TABLE will create partition "mpp21090_pttab_dropcol_addcol_addpt_idx_dml_char_1_prt_partone" for table "mpp21090_pttab_dropcol_addcol_addpt_idx_dml_char"
NOTICE:  CREATE TABLE will create partition "mpp21090_pttab_dropcol_addcol_addpt_idx_dml_char_1_prt_parttwo" for table "mpp21090_pttab_dropcol_addcol_addpt_idx_dml_char"
NOTICE:  CREATE TABLE will create partition "mpp21090_pttab_dropcol_addcol_addpt_idx_dml_cha_1_prt_partthree" for table "mpp21090_pttab_dropcol_addcol_addpt_idx_dml_char"
INSERT INTO mpp21090_pttab_dropcol_addcol_addpt_idx_dml_char VALUES('g','g','a',0);
ALTER TABLE mpp21090_pttab_dropcol_addcol_addpt_idx_dml_char DROP COLUMN col4;
INSERT INTO mpp21090_pttab_dropcol_addcol_addpt_idx_dml_char VALUES('g','g','b');
ALTER TABLE mpp21090_pttab_dropcol_addcol_addpt_idx_dml_char ADD COLUMN col5 char DEFAULT 'g';
DROP INDEX IF EXISTS mpp21090_pttab_dropcol_addcol_addpt_idx_dml_idx_char;
NOTICE:  index "mpp21090_pttab_dropcol_addcol_addpt_idx_dml_idx_char" does not exist, skipping
CREATE INDEX mpp21090_pttab_dropcol_addcol_addpt_idx_dml_idx_char on mpp21090_pttab_dropcol_addcol_addpt_idx_dml_char(col5);
NOTICE:  building index for child partition "mpp21090_pttab_dropcol_addcol_addpt_idx_dml_char_1_prt_partone"
NOTICE:  building index for child partition "mpp21090_pttab_dropcol_addcol_addpt_idx_dml_char_1_prt_parttwo"
NOTICE:  building index for child partition "mpp21090_pttab_dropcol_addcol_addpt_idx_dml_cha_1_prt_partthree"
INSERT INTO mpp21090_pttab_dropcol_addcol_addpt_idx_dml_char SELECT 'g','g','c','g';
SELECT * FROM mpp21090_pttab_dropcol_addcol_addpt_idx_dml_char ORDER BY 1,2,3;
 col1 | col2 | col3 | col5 
------+------+------+------
 g    | g    | a    | g
 g    | g    | b    | g
 g    | g    | c    | g
(3 rows)

UPDATE mpp21090_pttab_dropcol_addcol_addpt_idx_dml_char SET col5 = 'a' WHERE col2 = 'g' AND col1 = 'g';
SELECT * FROM mpp21090_pttab_dropcol_addcol_addpt_idx_dml_char ORDER BY 1,2,3;
 col1 | col2 | col3 | col5 
------+------+------+------
 g    | g    | a    | a
 g    | g    | b    | a
 g    | g    | c    | a
(3 rows)

DELETE FROM mpp21090_pttab_dropcol_addcol_addpt_idx_dml_char WHERE col5 = 'a';
SELECT * FROM mpp21090_pttab_dropcol_addcol_addpt_idx_dml_char ORDER BY 1,2,3;
 col1 | col2 | col3 | col5 
------+------+------+------
(0 rows)

ALTER TABLE mpp21090_pttab_dropcol_addcol_addpt_idx_dml_char ADD PARTITION partfour VALUES('y','z','-');
NOTICE:  CREATE TABLE will create partition "mpp21090_pttab_dropcol_addcol_addpt_idx_dml_char_1_prt_partfour" for table "mpp21090_pttab_dropcol_addcol_addpt_idx_dml_char"
ALTER TABLE mpp21090_pttab_dropcol_addcol_addpt_idx_dml_char ADD DEFAULT partition def;
NOTICE:  CREATE TABLE will create partition "mpp21090_pttab_dropcol_addcol_addpt_idx_dml_char_1_prt_def" for table "mpp21090_pttab_dropcol_addcol_addpt_idx_dml_char"
INSERT INTO mpp21090_pttab_dropcol_addcol_addpt_idx_dml_char SELECT 'z','z','d','z';
SELECT * FROM mpp21090_pttab_dropcol_addcol_addpt_idx_dml_char ORDER BY 1,2,3;
 col1 | col2 | col3 | col5 
------+------+------+------
 z    | z    | d    | z
(1 row)

UPDATE mpp21090_pttab_dropcol_addcol_addpt_idx_dml_char SET col5 = 'a' WHERE col2 = 'z' AND col3 ='d';
SELECT * FROM mpp21090_pttab_dropcol_addcol_addpt_idx_dml_char ORDER BY 1,2,3;
 col1 | col2 | col3 | col5 
------+------+------+------
 z    | z    | d    | a
(1 row)

-- Update partition key
UPDATE mpp21090_pttab_dropcol_addcol_addpt_idx_dml_char SET col2 = 'a' WHERE col2 = 'z' AND col3 ='d';
ERROR:  moving tuple from partition "mpp21090_pttab_dropcol_addcol_addpt_idx_dml_char_1_prt_partfour" to partition "mpp21090_pttab_dropcol_addcol_addpt_idx_dml_char_1_prt_partone" not supported  (seg1 127.0.0.1:40001 pid=9830)
SELECT * FROM mpp21090_pttab_dropcol_addcol_addpt_idx_dml_char ORDER BY 1,2,3;
 col1 | col2 | col3 | col5 
------+------+------+------
 z    | z    | d    | a
(1 row)

DELETE FROM mpp21090_pttab_dropcol_addcol_addpt_idx_dml_char WHERE col5 = 'a';
SELECT * FROM mpp21090_pttab_dropcol_addcol_addpt_idx_dml_char ORDER BY 1,2,3;
 col1 | col2 | col3 | col5 
------+------+------+------
(0 rows)

-- TEST
DROP TABLE IF EXISTS mpp21090_pttab_dropcol_addcol_addpt_idx_dml_decimal;
NOTICE:  table "mpp21090_pttab_dropcol_addcol_addpt_idx_dml_decimal" does not exist, skipping
CREATE TABLE mpp21090_pttab_dropcol_addcol_addpt_idx_dml_decimal
(
    col1 decimal,
    col2 decimal,
    col3 char,
    col4 int
) 
DISTRIBUTED by (col1)
PARTITION BY RANGE(col2)(partition partone start(1.00) end(10.00)  WITH (APPENDONLY=true, COMPRESSLEVEL=5, ORIENTATION=column),partition parttwo start(10.00) end(20.00) WITH (APPENDONLY=true, COMPRESSLEVEL=5, ORIENTATION=row),partition partthree start(20.00) end(30.00));
NOTICE:  CREATE TABLE will create partition "mpp21090_pttab_dropcol_addcol_addpt_idx_dml_decim_1_prt_partone" for table "mpp21090_pttab_dropcol_addcol_addpt_idx_dml_decimal"
NOTICE:  CREATE TABLE will create partition "mpp21090_pttab_dropcol_addcol_addpt_idx_dml_decim_1_prt_parttwo" for table "mpp21090_pttab_dropcol_addcol_addpt_idx_dml_decimal"
NOTICE:  CREATE TABLE will create partition "mpp21090_pttab_dropcol_addcol_addpt_idx_dml_dec_1_prt_partthree" for table "mpp21090_pttab_dropcol_addcol_addpt_idx_dml_decimal"
INSERT INTO mpp21090_pttab_dropcol_addcol_addpt_idx_dml_decimal VALUES(2.00,2.00,'a',0);
ALTER TABLE mpp21090_pttab_dropcol_addcol_addpt_idx_dml_decimal DROP COLUMN col4;
INSERT INTO mpp21090_pttab_dropcol_addcol_addpt_idx_dml_decimal VALUES(2.00,2.00,'b');
ALTER TABLE mpp21090_pttab_dropcol_addcol_addpt_idx_dml_decimal ADD COLUMN col5 decimal DEFAULT 2.00;
DROP INDEX IF EXISTS mpp21090_pttab_dropcol_addcol_addpt_idx_dml_idx_decimal;
NOTICE:  index "mpp21090_pttab_dropcol_addcol_addpt_idx_dml_idx_decimal" does not exist, skipping
CREATE INDEX mpp21090_pttab_dropcol_addcol_addpt_idx_dml_idx_decimal on mpp21090_pttab_dropcol_addcol_addpt_idx_dml_decimal(col5);
NOTICE:  building index for child partition "mpp21090_pttab_dropcol_addcol_addpt_idx_dml_decim_1_prt_partone"
NOTICE:  building index for child partition "mpp21090_pttab_dropcol_addcol_addpt_idx_dml_decim_1_prt_parttwo"
NOTICE:  building index for child partition "mpp21090_pttab_dropcol_addcol_addpt_idx_dml_dec_1_prt_partthree"
INSERT INTO mpp21090_pttab_dropcol_addcol_addpt_idx_dml_decimal SELECT 2.00,2.00,'c',2.00;
SELECT * FROM mpp21090_pttab_dropcol_addcol_addpt_idx_dml_decimal ORDER BY 1,2,3;
 col1 | col2 | col3 | col5 
------+------+------+------
 2.00 | 2.00 | a    | 2.00
 2.00 | 2.00 | b    | 2.00
 2.00 | 2.00 | c    | 2.00
(3 rows)

UPDATE mpp21090_pttab_dropcol_addcol_addpt_idx_dml_decimal SET col5 = 1.00 WHERE col2 = 2.00 AND col1 = 2.00;
SELECT * FROM mpp21090_pttab_dropcol_addcol_addpt_idx_dml_decimal ORDER BY 1,2,3;
 col1 | col2 | col3 | col5 
------+------+------+------
 2.00 | 2.00 | a    | 1.00
 2.00 | 2.00 | b    | 1.00
 2.00 | 2.00 | c    | 1.00
(3 rows)

DELETE FROM mpp21090_pttab_dropcol_addcol_addpt_idx_dml_decimal WHERE col5 = 1.00;
SELECT * FROM mpp21090_pttab_dropcol_addcol_addpt_idx_dml_decimal ORDER BY 1,2,3;
 col1 | col2 | col3 | col5 
------+------+------+------
(0 rows)

ALTER TABLE mpp21090_pttab_dropcol_addcol_addpt_idx_dml_decimal ADD PARTITION partfour start(30.00) end(40.00) inclusive;
NOTICE:  CREATE TABLE will create partition "mpp21090_pttab_dropcol_addcol_addpt_idx_dml_deci_1_prt_partfour" for table "mpp21090_pttab_dropcol_addcol_addpt_idx_dml_decimal"
ALTER TABLE mpp21090_pttab_dropcol_addcol_addpt_idx_dml_decimal ADD DEFAULT partition def;
NOTICE:  CREATE TABLE will create partition "mpp21090_pttab_dropcol_addcol_addpt_idx_dml_decimal_1_prt_def" for table "mpp21090_pttab_dropcol_addcol_addpt_idx_dml_decimal"
INSERT INTO mpp21090_pttab_dropcol_addcol_addpt_idx_dml_decimal SELECT 35.00,35.00,'d',35.00;
SELECT * FROM mpp21090_pttab_dropcol_addcol_addpt_idx_dml_decimal ORDER BY 1,2,3;
 col1  | col2  | col3 | col5  
-------+-------+------+-------
 35.00 | 35.00 | d    | 35.00
(1 row)

UPDATE mpp21090_pttab_dropcol_addcol_addpt_idx_dml_decimal SET col5 = 1.00 WHERE col2 = 35.00 AND col3 ='d';
SELECT * FROM mpp21090_pttab_dropcol_addcol_addpt_idx_dml_decimal ORDER BY 1,2,3;
 col1  | col2  | col3 | col5 
-------+-------+------+------
 35.00 | 35.00 | d    | 1.00
(1 row)

-- Update partition key
UPDATE mpp21090_pttab_dropcol_addcol_addpt_idx_dml_decimal SET col2 = 1.00 WHERE col2 = 35.00 AND col3 ='d';
ERROR:  moving tuple from partition "mpp21090_pttab_dropcol_addcol_addpt_idx_dml_deci_1_prt_partfour" to partition "mpp21090_pttab_dropcol_addcol_addpt_idx_dml_decim_1_prt_partone" not supported  (seg0 127.0.0.1:40000 pid=9829)
SELECT * FROM mpp21090_pttab_dropcol_addcol_addpt_idx_dml_decimal ORDER BY 1,2,3;
 col1  | col2  | col3 | col5 
-------+-------+------+------
 35.00 | 35.00 | d    | 1.00
(1 row)

DELETE FROM mpp21090_pttab_dropcol_addcol_addpt_idx_dml_decimal WHERE col5 = 1.00;
SELECT * FROM mpp21090_pttab_dropcol_addcol_addpt_idx_dml_decimal ORDER BY 1,2,3;
 col1 | col2 | col3 | col5 
------+------+------+------
(0 rows)

-- TEST
DROP TABLE IF EXISTS mpp21090_pttab_dropcol_addcol_addpt_idx_dml_int4;
NOTICE:  table "mpp21090_pttab_dropcol_addcol_addpt_idx_dml_int4" does not exist, skipping
CREATE TABLE mpp21090_pttab_dropcol_addcol_addpt_idx_dml_int4
(
    col1 int4,
    col2 int4,
    col3 char,
    col4 int
) 
DISTRIBUTED by (col1)
PARTITION BY RANGE(col2)(partition partone start(1) end(100000001)  WITH (APPENDONLY=true, COMPRESSLEVEL=5, ORIENTATION=column),partition parttwo start(100000001) end(200000001) WITH (APPENDONLY=true, COMPRESSLEVEL=5, ORIENTATION=row),partition partthree start(200000001) end(300000001));
NOTICE:  CREATE TABLE will create partition "mpp21090_pttab_dropcol_addcol_addpt_idx_dml_int4_1_prt_partone" for table "mpp21090_pttab_dropcol_addcol_addpt_idx_dml_int4"
NOTICE:  CREATE TABLE will create partition "mpp21090_pttab_dropcol_addcol_addpt_idx_dml_int4_1_prt_parttwo" for table "mpp21090_pttab_dropcol_addcol_addpt_idx_dml_int4"
NOTICE:  CREATE TABLE will create partition "mpp21090_pttab_dropcol_addcol_addpt_idx_dml_int_1_prt_partthree" for table "mpp21090_pttab_dropcol_addcol_addpt_idx_dml_int4"
INSERT INTO mpp21090_pttab_dropcol_addcol_addpt_idx_dml_int4 VALUES(20000000,20000000,'a',0);
ALTER TABLE mpp21090_pttab_dropcol_addcol_addpt_idx_dml_int4 DROP COLUMN col4;
INSERT INTO mpp21090_pttab_dropcol_addcol_addpt_idx_dml_int4 VALUES(20000000,20000000,'b');
ALTER TABLE mpp21090_pttab_dropcol_addcol_addpt_idx_dml_int4 ADD COLUMN col5 int4 DEFAULT 20000000;
DROP INDEX IF EXISTS mpp21090_pttab_dropcol_addcol_addpt_idx_dml_idx_int4;
NOTICE:  index "mpp21090_pttab_dropcol_addcol_addpt_idx_dml_idx_int4" does not exist, skipping
CREATE INDEX mpp21090_pttab_dropcol_addcol_addpt_idx_dml_idx_int4 on mpp21090_pttab_dropcol_addcol_addpt_idx_dml_int4(col5);
NOTICE:  building index for child partition "mpp21090_pttab_dropcol_addcol_addpt_idx_dml_int4_1_prt_partone"
NOTICE:  building index for child partition "mpp21090_pttab_dropcol_addcol_addpt_idx_dml_int4_1_prt_parttwo"
NOTICE:  building index for child partition "mpp21090_pttab_dropcol_addcol_addpt_idx_dml_int_1_prt_partthree"
INSERT INTO mpp21090_pttab_dropcol_addcol_addpt_idx_dml_int4 SELECT 20000000,20000000,'c',20000000;
SELECT * FROM mpp21090_pttab_dropcol_addcol_addpt_idx_dml_int4 ORDER BY 1,2,3;
   col1   |   col2   | col3 |   col5   
----------+----------+------+----------
 20000000 | 20000000 | a    | 20000000
 20000000 | 20000000 | b    | 20000000
 20000000 | 20000000 | c    | 20000000
(3 rows)

UPDATE mpp21090_pttab_dropcol_addcol_addpt_idx_dml_int4 SET col5 = 10000000 WHERE col2 = 20000000 AND col1 = 20000000;
SELECT * FROM mpp21090_pttab_dropcol_addcol_addpt_idx_dml_int4 ORDER BY 1,2,3;
   col1   |   col2   | col3 |   col5   
----------+----------+------+----------
 20000000 | 20000000 | a    | 10000000
 20000000 | 20000000 | b    | 10000000
 20000000 | 20000000 | c    | 10000000
(3 rows)

DELETE FROM mpp21090_pttab_dropcol_addcol_addpt_idx_dml_int4 WHERE col5 = 10000000;
SELECT * FROM mpp21090_pttab_dropcol_addcol_addpt_idx_dml_int4 ORDER BY 1,2,3;
 col1 | col2 | col3 | col5 
------+------+------+------
(0 rows)

ALTER TABLE mpp21090_pttab_dropcol_addcol_addpt_idx_dml_int4 ADD PARTITION partfour start(300000001) end(400000001);
NOTICE:  CREATE TABLE will create partition "mpp21090_pttab_dropcol_addcol_addpt_idx_dml_int4_1_prt_partfour" for table "mpp21090_pttab_dropcol_addcol_addpt_idx_dml_int4"
ALTER TABLE mpp21090_pttab_dropcol_addcol_addpt_idx_dml_int4 ADD DEFAULT partition def;
NOTICE:  CREATE TABLE will create partition "mpp21090_pttab_dropcol_addcol_addpt_idx_dml_int4_1_prt_def" for table "mpp21090_pttab_dropcol_addcol_addpt_idx_dml_int4"
INSERT INTO mpp21090_pttab_dropcol_addcol_addpt_idx_dml_int4 SELECT 350000000,350000000,'d',350000000;
SELECT * FROM mpp21090_pttab_dropcol_addcol_addpt_idx_dml_int4 ORDER BY 1,2,3;
   col1    |   col2    | col3 |   col5    
-----------+-----------+------+-----------
 350000000 | 350000000 | d    | 350000000
(1 row)

UPDATE mpp21090_pttab_dropcol_addcol_addpt_idx_dml_int4 SET col5 = 10000000 WHERE col2 = 350000000 AND col3 ='d';
SELECT * FROM mpp21090_pttab_dropcol_addcol_addpt_idx_dml_int4 ORDER BY 1,2,3;
   col1    |   col2    | col3 |   col5   
-----------+-----------+------+----------
 350000000 | 350000000 | d    | 10000000
(1 row)

-- Update partition key
UPDATE mpp21090_pttab_dropcol_addcol_addpt_idx_dml_int4 SET col2 = 10000000 WHERE col2 = 350000000 AND col3 ='d';
ERROR:  moving tuple from partition "mpp21090_pttab_dropcol_addcol_addpt_idx_dml_int4_1_prt_partfour" to partition "mpp21090_pttab_dropcol_addcol_addpt_idx_dml_int4_1_prt_partone" not supported  (seg2 127.0.0.1:40002 pid=9831)
SELECT * FROM mpp21090_pttab_dropcol_addcol_addpt_idx_dml_int4 ORDER BY 1,2,3;
   col1    |   col2    | col3 |   col5   
-----------+-----------+------+----------
 350000000 | 350000000 | d    | 10000000
(1 row)

DELETE FROM mpp21090_pttab_dropcol_addcol_addpt_idx_dml_int4 WHERE col5 = 10000000;
SELECT * FROM mpp21090_pttab_dropcol_addcol_addpt_idx_dml_int4 ORDER BY 1,2,3;
 col1 | col2 | col3 | col5 
------+------+------+------
(0 rows)

-- TEST
DROP TABLE IF EXISTS mpp21090_pttab_dropcol_addcol_addpt_idx_dml_int8;
NOTICE:  table "mpp21090_pttab_dropcol_addcol_addpt_idx_dml_int8" does not exist, skipping
CREATE TABLE mpp21090_pttab_dropcol_addcol_addpt_idx_dml_int8
(
    col1 int8,
    col2 int8,
    col3 char,
    col4 int
) 
DISTRIBUTED by (col1)
PARTITION BY RANGE(col2)(partition partone start(1) end(1000000000000000001)  WITH (APPENDONLY=true, COMPRESSLEVEL=5, ORIENTATION=column),partition parttwo start(1000000000000000001) end(2000000000000000001) WITH (APPENDONLY=true, COMPRESSLEVEL=5, ORIENTATION=row),partition partthree start(2000000000000000001) end(3000000000000000001));
NOTICE:  CREATE TABLE will create partition "mpp21090_pttab_dropcol_addcol_addpt_idx_dml_int8_1_prt_partone" for table "mpp21090_pttab_dropcol_addcol_addpt_idx_dml_int8"
NOTICE:  CREATE TABLE will create partition "mpp21090_pttab_dropcol_addcol_addpt_idx_dml_int8_1_prt_parttwo" for table "mpp21090_pttab_dropcol_addcol_addpt_idx_dml_int8"
NOTICE:  CREATE TABLE will create partition "mpp21090_pttab_dropcol_addcol_addpt_idx_dml_in_1_prt_partthree1" for table "mpp21090_pttab_dropcol_addcol_addpt_idx_dml_int8"
INSERT INTO mpp21090_pttab_dropcol_addcol_addpt_idx_dml_int8 VALUES(200000000000000000,200000000000000000,'a',0);
ALTER TABLE mpp21090_pttab_dropcol_addcol_addpt_idx_dml_int8 DROP COLUMN col4;
INSERT INTO mpp21090_pttab_dropcol_addcol_addpt_idx_dml_int8 VALUES(200000000000000000,200000000000000000,'b');
ALTER TABLE mpp21090_pttab_dropcol_addcol_addpt_idx_dml_int8 ADD COLUMN col5 int8 DEFAULT 200000000000000000;
DROP INDEX IF EXISTS mpp21090_pttab_dropcol_addcol_addpt_idx_dml_idx_int8;
NOTICE:  index "mpp21090_pttab_dropcol_addcol_addpt_idx_dml_idx_int8" does not exist, skipping
CREATE INDEX mpp21090_pttab_dropcol_addcol_addpt_idx_dml_idx_int8 on mpp21090_pttab_dropcol_addcol_addpt_idx_dml_int8(col5);
NOTICE:  building index for child partition "mpp21090_pttab_dropcol_addcol_addpt_idx_dml_int8_1_prt_partone"
NOTICE:  building index for child partition "mpp21090_pttab_dropcol_addcol_addpt_idx_dml_int8_1_prt_parttwo"
NOTICE:  building index for child partition "mpp21090_pttab_dropcol_addcol_addpt_idx_dml_in_1_prt_partthree1"
INSERT INTO mpp21090_pttab_dropcol_addcol_addpt_idx_dml_int8 SELECT 200000000000000000,200000000000000000,'c',200000000000000000;
SELECT * FROM mpp21090_pttab_dropcol_addcol_addpt_idx_dml_int8 ORDER BY 1,2,3;
        col1        |        col2        | col3 |        col5        
--------------------+--------------------+------+--------------------
 200000000000000000 | 200000000000000000 | a    | 200000000000000000
 200000000000000000 | 200000000000000000 | b    | 200000000000000000
 200000000000000000 | 200000000000000000 | c    | 200000000000000000
(3 rows)

UPDATE mpp21090_pttab_dropcol_addcol_addpt_idx_dml_int8 SET col5 = 1000000000000000000 WHERE col2 = 200000000000000000 AND col1 = 200000000000000000;
SELECT * FROM mpp21090_pttab_dropcol_addcol_addpt_idx_dml_int8 ORDER BY 1,2,3;
        col1        |        col2        | col3 |        col5         
--------------------+--------------------+------+---------------------
 200000000000000000 | 200000000000000000 | a    | 1000000000000000000
 200000000000000000 | 200000000000000000 | b    | 1000000000000000000
 200000000000000000 | 200000000000000000 | c    | 1000000000000000000
(3 rows)

DELETE FROM mpp21090_pttab_dropcol_addcol_addpt_idx_dml_int8 WHERE col5 = 1000000000000000000;
SELECT * FROM mpp21090_pttab_dropcol_addcol_addpt_idx_dml_int8 ORDER BY 1,2,3;
 col1 | col2 | col3 | col5 
------+------+------+------
(0 rows)

ALTER TABLE mpp21090_pttab_dropcol_addcol_addpt_idx_dml_int8 ADD PARTITION partfour start(3000000000000000001) end(4000000000000000001);
NOTICE:  CREATE TABLE will create partition "mpp21090_pttab_dropcol_addcol_addpt_idx_dml_int8_1_prt_partfour" for table "mpp21090_pttab_dropcol_addcol_addpt_idx_dml_int8"
ALTER TABLE mpp21090_pttab_dropcol_addcol_addpt_idx_dml_int8 ADD DEFAULT partition def;
NOTICE:  CREATE TABLE will create partition "mpp21090_pttab_dropcol_addcol_addpt_idx_dml_int8_1_prt_def" for table "mpp21090_pttab_dropcol_addcol_addpt_idx_dml_int8"
INSERT INTO mpp21090_pttab_dropcol_addcol_addpt_idx_dml_int8 SELECT 3500000000000000000,3500000000000000000,'d',3500000000000000000;
SELECT * FROM mpp21090_pttab_dropcol_addcol_addpt_idx_dml_int8 ORDER BY 1,2,3;
        col1         |        col2         | col3 |        col5         
---------------------+---------------------+------+---------------------
 3500000000000000000 | 3500000000000000000 | d    | 3500000000000000000
(1 row)

UPDATE mpp21090_pttab_dropcol_addcol_addpt_idx_dml_int8 SET col5 = 1000000000000000000 WHERE col2 = 3500000000000000000 AND col3 ='d';
SELECT * FROM mpp21090_pttab_dropcol_addcol_addpt_idx_dml_int8 ORDER BY 1,2,3;
        col1         |        col2         | col3 |        col5         
---------------------+---------------------+------+---------------------
 3500000000000000000 | 3500000000000000000 | d    | 1000000000000000000
(1 row)

-- Update partition key
UPDATE mpp21090_pttab_dropcol_addcol_addpt_idx_dml_int8 SET col2 = 1000000000000000000 WHERE col2 = 3500000000000000000 AND col3 ='d';
ERROR:  moving tuple from partition "mpp21090_pttab_dropcol_addcol_addpt_idx_dml_int8_1_prt_partfour" to partition "mpp21090_pttab_dropcol_addcol_addpt_idx_dml_int8_1_prt_partone" not supported  (seg1 127.0.0.1:40001 pid=9830)
SELECT * FROM mpp21090_pttab_dropcol_addcol_addpt_idx_dml_int8 ORDER BY 1,2,3;
        col1         |        col2         | col3 |        col5         
---------------------+---------------------+------+---------------------
 3500000000000000000 | 3500000000000000000 | d    | 1000000000000000000
(1 row)

DELETE FROM mpp21090_pttab_dropcol_addcol_addpt_idx_dml_int8 WHERE col5 = 1000000000000000000;
SELECT * FROM mpp21090_pttab_dropcol_addcol_addpt_idx_dml_int8 ORDER BY 1,2,3;
 col1 | col2 | col3 | col5 
------+------+------+------
(0 rows)

-- TEST
DROP TABLE IF EXISTS mpp21090_pttab_dropcol_addcol_addpt_idx_dml_interval;
NOTICE:  table "mpp21090_pttab_dropcol_addcol_addpt_idx_dml_interval" does not exist, skipping
CREATE TABLE mpp21090_pttab_dropcol_addcol_addpt_idx_dml_interval
(
    col1 interval,
    col2 interval,
    col3 char,
    col4 int
) 
DISTRIBUTED by (col1)
PARTITION BY RANGE(col2)(partition partone start('1 sec') end('1 min')  WITH (APPENDONLY=true, COMPRESSLEVEL=5, ORIENTATION=column),partition parttwo start('1 min') end('1 hour') WITH (APPENDONLY=true, COMPRESSLEVEL=5, ORIENTATION=row),partition partthree start('1 hour') end('12 hours'));
NOTICE:  CREATE TABLE will create partition "mpp21090_pttab_dropcol_addcol_addpt_idx_dml_inter_1_prt_partone" for table "mpp21090_pttab_dropcol_addcol_addpt_idx_dml_interval"
NOTICE:  CREATE TABLE will create partition "mpp21090_pttab_dropcol_addcol_addpt_idx_dml_inter_1_prt_parttwo" for table "mpp21090_pttab_dropcol_addcol_addpt_idx_dml_interval"
NOTICE:  CREATE TABLE will create partition "mpp21090_pttab_dropcol_addcol_addpt_idx_dml_in_1_prt_partthree2" for table "mpp21090_pttab_dropcol_addcol_addpt_idx_dml_interval"
INSERT INTO mpp21090_pttab_dropcol_addcol_addpt_idx_dml_interval VALUES('10 secs','10 secs','a',0);
ALTER TABLE mpp21090_pttab_dropcol_addcol_addpt_idx_dml_interval DROP COLUMN col4;
INSERT INTO mpp21090_pttab_dropcol_addcol_addpt_idx_dml_interval VALUES('10 secs','10 secs','b');
ALTER TABLE mpp21090_pttab_dropcol_addcol_addpt_idx_dml_interval ADD COLUMN col5 interval DEFAULT '10 secs';
DROP INDEX IF EXISTS mpp21090_pttab_dropcol_addcol_addpt_idx_dml_idx_interval;
NOTICE:  index "mpp21090_pttab_dropcol_addcol_addpt_idx_dml_idx_interval" does not exist, skipping
CREATE INDEX mpp21090_pttab_dropcol_addcol_addpt_idx_dml_idx_interval on mpp21090_pttab_dropcol_addcol_addpt_idx_dml_interval(col5);
NOTICE:  building index for child partition "mpp21090_pttab_dropcol_addcol_addpt_idx_dml_inter_1_prt_partone"
NOTICE:  building index for child partition "mpp21090_pttab_dropcol_addcol_addpt_idx_dml_inter_1_prt_parttwo"
NOTICE:  building index for child partition "mpp21090_pttab_dropcol_addcol_addpt_idx_dml_in_1_prt_partthree2"
INSERT INTO mpp21090_pttab_dropcol_addcol_addpt_idx_dml_interval SELECT '10 secs','10 secs','c','10 secs';
SELECT * FROM mpp21090_pttab_dropcol_addcol_addpt_idx_dml_interval ORDER BY 1,2,3;
   col1   |   col2   | col3 |   col5   
----------+----------+------+----------
 00:00:10 | 00:00:10 | a    | 00:00:10
 00:00:10 | 00:00:10 | b    | 00:00:10
 00:00:10 | 00:00:10 | c    | 00:00:10
(3 rows)

UPDATE mpp21090_pttab_dropcol_addcol_addpt_idx_dml_interval SET col5 = '11 hours' WHERE col2 = '10 secs' AND col1 = '10 secs';
SELECT * FROM mpp21090_pttab_dropcol_addcol_addpt_idx_dml_interval ORDER BY 1,2,3;
   col1   |   col2   | col3 |   col5   
----------+----------+------+----------
 00:00:10 | 00:00:10 | a    | 11:00:00
 00:00:10 | 00:00:10 | b    | 11:00:00
 00:00:10 | 00:00:10 | c    | 11:00:00
(3 rows)

DELETE FROM mpp21090_pttab_dropcol_addcol_addpt_idx_dml_interval WHERE col5 = '11 hours';
SELECT * FROM mpp21090_pttab_dropcol_addcol_addpt_idx_dml_interval ORDER BY 1,2,3;
 col1 | col2 | col3 | col5 
------+------+------+------
(0 rows)

ALTER TABLE mpp21090_pttab_dropcol_addcol_addpt_idx_dml_interval ADD PARTITION partfour start('12 hours') end('1 day') inclusive;
NOTICE:  CREATE TABLE will create partition "mpp21090_pttab_dropcol_addcol_addpt_idx_dml_inte_1_prt_partfour" for table "mpp21090_pttab_dropcol_addcol_addpt_idx_dml_interval"
ALTER TABLE mpp21090_pttab_dropcol_addcol_addpt_idx_dml_interval ADD DEFAULT partition def;
NOTICE:  CREATE TABLE will create partition "mpp21090_pttab_dropcol_addcol_addpt_idx_dml_interval_1_prt_def" for table "mpp21090_pttab_dropcol_addcol_addpt_idx_dml_interval"
INSERT INTO mpp21090_pttab_dropcol_addcol_addpt_idx_dml_interval SELECT '14 hours','14 hours','d','14 hours';
SELECT * FROM mpp21090_pttab_dropcol_addcol_addpt_idx_dml_interval ORDER BY 1,2,3;
   col1   |   col2   | col3 |   col5   
----------+----------+------+----------
 14:00:00 | 14:00:00 | d    | 14:00:00
(1 row)

UPDATE mpp21090_pttab_dropcol_addcol_addpt_idx_dml_interval SET col5 = '11 hours' WHERE col2 = '14 hours' AND col3 ='d';
SELECT * FROM mpp21090_pttab_dropcol_addcol_addpt_idx_dml_interval ORDER BY 1,2,3;
   col1   |   col2   | col3 |   col5   
----------+----------+------+----------
 14:00:00 | 14:00:00 | d    | 11:00:00
(1 row)

-- Update partition key
UPDATE mpp21090_pttab_dropcol_addcol_addpt_idx_dml_interval SET col2 = '11 hours' WHERE col2 = '14 hours' AND col3 ='d';
ERROR:  moving tuple from partition "mpp21090_pttab_dropcol_addcol_addpt_idx_dml_inte_1_prt_partfour" to partition "mpp21090_pttab_dropcol_addcol_addpt_idx_dml_in_1_prt_partthree2" not supported  (seg0 127.0.0.1:40000 pid=9829)
SELECT * FROM mpp21090_pttab_dropcol_addcol_addpt_idx_dml_interval ORDER BY 1,2,3;
   col1   |   col2   | col3 |   col5   
----------+----------+------+----------
 14:00:00 | 14:00:00 | d    | 11:00:00
(1 row)

DELETE FROM mpp21090_pttab_dropcol_addcol_addpt_idx_dml_interval WHERE col5 = '11 hours';
SELECT * FROM mpp21090_pttab_dropcol_addcol_addpt_idx_dml_interval ORDER BY 1,2,3;
 col1 | col2 | col3 | col5 
------+------+------+------
(0 rows)

-- TEST
DROP TABLE IF EXISTS mpp21090_pttab_dropcol_addcol_addpt_idx_dml_numeric;
NOTICE:  table "mpp21090_pttab_dropcol_addcol_addpt_idx_dml_numeric" does not exist, skipping
CREATE TABLE mpp21090_pttab_dropcol_addcol_addpt_idx_dml_numeric
(
    col1 numeric,
    col2 numeric,
    col3 char,
    col4 int
) 
DISTRIBUTED by (col1)
PARTITION BY RANGE(col2)(partition partone start(1.000000) end(10.000000)  WITH (APPENDONLY=true, COMPRESSLEVEL=5, ORIENTATION=column),partition parttwo start(10.000000) end(20.000000) WITH (APPENDONLY=true, COMPRESSLEVEL=5, ORIENTATION=row),partition partthree start(20.000000) end(30.000000));
NOTICE:  CREATE TABLE will create partition "mpp21090_pttab_dropcol_addcol_addpt_idx_dml_numer_1_prt_partone" for table "mpp21090_pttab_dropcol_addcol_addpt_idx_dml_numeric"
NOTICE:  CREATE TABLE will create partition "mpp21090_pttab_dropcol_addcol_addpt_idx_dml_numer_1_prt_parttwo" for table "mpp21090_pttab_dropcol_addcol_addpt_idx_dml_numeric"
NOTICE:  CREATE TABLE will create partition "mpp21090_pttab_dropcol_addcol_addpt_idx_dml_num_1_prt_partthree" for table "mpp21090_pttab_dropcol_addcol_addpt_idx_dml_numeric"
INSERT INTO mpp21090_pttab_dropcol_addcol_addpt_idx_dml_numeric VALUES(2.000000,2.000000,'a',0);
ALTER TABLE mpp21090_pttab_dropcol_addcol_addpt_idx_dml_numeric DROP COLUMN col4;
INSERT INTO mpp21090_pttab_dropcol_addcol_addpt_idx_dml_numeric VALUES(2.000000,2.000000,'b');
ALTER TABLE mpp21090_pttab_dropcol_addcol_addpt_idx_dml_numeric ADD COLUMN col5 numeric DEFAULT 2.000000;
DROP INDEX IF EXISTS mpp21090_pttab_dropcol_addcol_addpt_idx_dml_idx_numeric;
NOTICE:  index "mpp21090_pttab_dropcol_addcol_addpt_idx_dml_idx_numeric" does not exist, skipping
CREATE INDEX mpp21090_pttab_dropcol_addcol_addpt_idx_dml_idx_numeric on mpp21090_pttab_dropcol_addcol_addpt_idx_dml_numeric(col5);
NOTICE:  building index for child partition "mpp21090_pttab_dropcol_addcol_addpt_idx_dml_numer_1_prt_partone"
NOTICE:  building index for child partition "mpp21090_pttab_dropcol_addcol_addpt_idx_dml_numer_1_prt_parttwo"
NOTICE:  building index for child partition "mpp21090_pttab_dropcol_addcol_addpt_idx_dml_num_1_prt_partthree"
INSERT INTO mpp21090_pttab_dropcol_addcol_addpt_idx_dml_numeric SELECT 2.000000,2.000000,'c',2.000000;
SELECT * FROM mpp21090_pttab_dropcol_addcol_addpt_idx_dml_numeric ORDER BY 1,2,3;
   col1   |   col2   | col3 |   col5   
----------+----------+------+----------
 2.000000 | 2.000000 | a    | 2.000000
 2.000000 | 2.000000 | b    | 2.000000
 2.000000 | 2.000000 | c    | 2.000000
(3 rows)

UPDATE mpp21090_pttab_dropcol_addcol_addpt_idx_dml_numeric SET col5 = 1.000000 WHERE col2 = 2.000000 AND col1 = 2.000000;
SELECT * FROM mpp21090_pttab_dropcol_addcol_addpt_idx_dml_numeric ORDER BY 1,2,3;
   col1   |   col2   | col3 |   col5   
----------+----------+------+----------
 2.000000 | 2.000000 | a    | 1.000000
 2.000000 | 2.000000 | b    | 1.000000
 2.000000 | 2.000000 | c    | 1.000000
(3 rows)

DELETE FROM mpp21090_pttab_dropcol_addcol_addpt_idx_dml_numeric WHERE col5 = 1.000000;
SELECT * FROM mpp21090_pttab_dropcol_addcol_addpt_idx_dml_numeric ORDER BY 1,2,3;
 col1 | col2 | col3 | col5 
------+------+------+------
(0 rows)

ALTER TABLE mpp21090_pttab_dropcol_addcol_addpt_idx_dml_numeric ADD PARTITION partfour start(30.000000) end(40.000000) inclusive;
NOTICE:  CREATE TABLE will create partition "mpp21090_pttab_dropcol_addcol_addpt_idx_dml_nume_1_prt_partfour" for table "mpp21090_pttab_dropcol_addcol_addpt_idx_dml_numeric"
ALTER TABLE mpp21090_pttab_dropcol_addcol_addpt_idx_dml_numeric ADD DEFAULT partition def;
NOTICE:  CREATE TABLE will create partition "mpp21090_pttab_dropcol_addcol_addpt_idx_dml_numeric_1_prt_def" for table "mpp21090_pttab_dropcol_addcol_addpt_idx_dml_numeric"
INSERT INTO mpp21090_pttab_dropcol_addcol_addpt_idx_dml_numeric SELECT 35.000000,35.000000,'d',35.000000;
SELECT * FROM mpp21090_pttab_dropcol_addcol_addpt_idx_dml_numeric ORDER BY 1,2,3;
   col1    |   col2    | col3 |   col5    
-----------+-----------+------+-----------
 35.000000 | 35.000000 | d    | 35.000000
(1 row)

UPDATE mpp21090_pttab_dropcol_addcol_addpt_idx_dml_numeric SET col5 = 1.000000 WHERE col2 = 35.000000 AND col3 ='d';
SELECT * FROM mpp21090_pttab_dropcol_addcol_addpt_idx_dml_numeric ORDER BY 1,2,3;
   col1    |   col2    | col3 |   col5   
-----------+-----------+------+----------
 35.000000 | 35.000000 | d    | 1.000000
(1 row)

-- Update partition key
UPDATE mpp21090_pttab_dropcol_addcol_addpt_idx_dml_numeric SET col2 = 1.000000 WHERE col2 = 35.000000 AND col3 ='d';
ERROR:  moving tuple from partition "mpp21090_pttab_dropcol_addcol_addpt_idx_dml_nume_1_prt_partfour" to partition "mpp21090_pttab_dropcol_addcol_addpt_idx_dml_numer_1_prt_partone" not supported  (seg0 127.0.0.1:40000 pid=9829)
SELECT * FROM mpp21090_pttab_dropcol_addcol_addpt_idx_dml_numeric ORDER BY 1,2,3;
   col1    |   col2    | col3 |   col5   
-----------+-----------+------+----------
 35.000000 | 35.000000 | d    | 1.000000
(1 row)

DELETE FROM mpp21090_pttab_dropcol_addcol_addpt_idx_dml_numeric WHERE col5 = 1.000000;
SELECT * FROM mpp21090_pttab_dropcol_addcol_addpt_idx_dml_numeric ORDER BY 1,2,3;
 col1 | col2 | col3 | col5 
------+------+------+------
(0 rows)

-- TEST
DROP TABLE IF EXISTS mpp21090_pttab_dropfirstcol_addpt_char;
NOTICE:  table "mpp21090_pttab_dropfirstcol_addpt_char" does not exist, skipping
CREATE TABLE mpp21090_pttab_dropfirstcol_addpt_char
(
    col1 char,
    col2 char,
    col3 char,
    col4 char,
    col5 int
) 
DISTRIBUTED by (col1)
PARTITION BY LIST(col2)(partition partone VALUES('a','b','c','d','e','f','g','h') WITH (APPENDONLY=true, COMPRESSLEVEL=5, ORIENTATION=column),partition parttwo VALUES('i','j','k','l','m','n','o','p') WITH (APPENDONLY=true, COMPRESSLEVEL=5, ORIENTATION=row),partition partthree VALUES('q','r','s','t','u','v','w','x'));
NOTICE:  CREATE TABLE will create partition "mpp21090_pttab_dropfirstcol_addpt_char_1_prt_partone" for table "mpp21090_pttab_dropfirstcol_addpt_char"
NOTICE:  CREATE TABLE will create partition "mpp21090_pttab_dropfirstcol_addpt_char_1_prt_parttwo" for table "mpp21090_pttab_dropfirstcol_addpt_char"
NOTICE:  CREATE TABLE will create partition "mpp21090_pttab_dropfirstcol_addpt_char_1_prt_partthree" for table "mpp21090_pttab_dropfirstcol_addpt_char"
INSERT INTO mpp21090_pttab_dropfirstcol_addpt_char VALUES('x','x','a','x',0);
ALTER TABLE mpp21090_pttab_dropfirstcol_addpt_char DROP COLUMN col1;
NOTICE:  Dropping a column that is part of the distribution policy forces a NULL distribution policy
NOTICE:  Dropping a column that is part of the distribution policy forces a NULL distribution policy
NOTICE:  Dropping a column that is part of the distribution policy forces a NULL distribution policy
NOTICE:  Dropping a column that is part of the distribution policy forces a NULL distribution policy
ALTER TABLE mpp21090_pttab_dropfirstcol_addpt_char ADD PARTITION partfour VALUES('y','z','-');
NOTICE:  CREATE TABLE will create partition "mpp21090_pttab_dropfirstcol_addpt_char_1_prt_partfour" for table "mpp21090_pttab_dropfirstcol_addpt_char"
INSERT INTO mpp21090_pttab_dropfirstcol_addpt_char SELECT 'z','b','z', 1;
SELECT * FROM mpp21090_pttab_dropfirstcol_addpt_char ORDER BY 1,2,3;
 col2 | col3 | col4 | col5 
------+------+------+------
 x    | a    | x    |    0
 z    | b    | z    |    1
(2 rows)

UPDATE mpp21090_pttab_dropfirstcol_addpt_char SET col4 = '-' WHERE col2 = 'z' AND col4 = 'z';
SELECT * FROM mpp21090_pttab_dropfirstcol_addpt_char ORDER BY 1,2,3;
 col2 | col3 | col4 | col5 
------+------+------+------
 x    | a    | x    |    0
 z    | b    | -    |    1
(2 rows)

-- Update partition key
UPDATE mpp21090_pttab_dropfirstcol_addpt_char SET col2 = '-' WHERE col2 = 'z' AND col4 = '-';
SELECT * FROM mpp21090_pttab_dropfirstcol_addpt_char ORDER BY 1,2,3;
 col2 | col3 | col4 | col5 
------+------+------+------
 -    | b    | -    |    1
 x    | a    | x    |    0
(2 rows)

DELETE FROM mpp21090_pttab_dropfirstcol_addpt_char WHERE col2 = '-';
SELECT * FROM mpp21090_pttab_dropfirstcol_addpt_char ORDER BY 1,2,3;
 col2 | col3 | col4 | col5 
------+------+------+------
 x    | a    | x    |    0
(1 row)

-- TEST
DROP TABLE IF EXISTS mpp21090_pttab_dropfirstcol_addpt_decimal;
NOTICE:  table "mpp21090_pttab_dropfirstcol_addpt_decimal" does not exist, skipping
CREATE TABLE mpp21090_pttab_dropfirstcol_addpt_decimal
(
    col1 decimal,
    col2 decimal,
    col3 char,
    col4 decimal,
    col5 int
) 
DISTRIBUTED by (col1)
PARTITION BY RANGE(col2)(partition partone start(1.00) end(10.00)  WITH (APPENDONLY=true, COMPRESSLEVEL=5, ORIENTATION=column),partition parttwo start(10.00) end(20.00) WITH (APPENDONLY=true, COMPRESSLEVEL=5, ORIENTATION=row),partition partthree start(20.00) end(30.00));
NOTICE:  CREATE TABLE will create partition "mpp21090_pttab_dropfirstcol_addpt_decimal_1_prt_partone" for table "mpp21090_pttab_dropfirstcol_addpt_decimal"
NOTICE:  CREATE TABLE will create partition "mpp21090_pttab_dropfirstcol_addpt_decimal_1_prt_parttwo" for table "mpp21090_pttab_dropfirstcol_addpt_decimal"
NOTICE:  CREATE TABLE will create partition "mpp21090_pttab_dropfirstcol_addpt_decimal_1_prt_partthree" for table "mpp21090_pttab_dropfirstcol_addpt_decimal"
INSERT INTO mpp21090_pttab_dropfirstcol_addpt_decimal VALUES(2.00,2.00,'a',2.00,0);
ALTER TABLE mpp21090_pttab_dropfirstcol_addpt_decimal DROP COLUMN col1;
NOTICE:  Dropping a column that is part of the distribution policy forces a NULL distribution policy
NOTICE:  Dropping a column that is part of the distribution policy forces a NULL distribution policy
NOTICE:  Dropping a column that is part of the distribution policy forces a NULL distribution policy
NOTICE:  Dropping a column that is part of the distribution policy forces a NULL distribution policy
ALTER TABLE mpp21090_pttab_dropfirstcol_addpt_decimal ADD PARTITION partfour start(30.00) end(40.00) inclusive;
NOTICE:  CREATE TABLE will create partition "mpp21090_pttab_dropfirstcol_addpt_decimal_1_prt_partfour" for table "mpp21090_pttab_dropfirstcol_addpt_decimal"
INSERT INTO mpp21090_pttab_dropfirstcol_addpt_decimal SELECT 35.00,'b',35.00, 1;
SELECT * FROM mpp21090_pttab_dropfirstcol_addpt_decimal ORDER BY 1,2,3;
 col2  | col3 | col4  | col5 
-------+------+-------+------
  2.00 | a    |  2.00 |    0
 35.00 | b    | 35.00 |    1
(2 rows)

UPDATE mpp21090_pttab_dropfirstcol_addpt_decimal SET col4 = 1.00 WHERE col2 = 35.00 AND col4 = 35.00;
SELECT * FROM mpp21090_pttab_dropfirstcol_addpt_decimal ORDER BY 1,2,3;
 col2  | col3 | col4 | col5 
-------+------+------+------
  2.00 | a    | 2.00 |    0
 35.00 | b    | 1.00 |    1
(2 rows)

-- Update partition key
UPDATE mpp21090_pttab_dropfirstcol_addpt_decimal SET col2 = 1.00 WHERE col2 = 35.00 AND col4 = 1.00;
ERROR:  moving tuple from partition "mpp21090_pttab_dropfirstcol_addpt_decimal_1_prt_partfour" to partition "mpp21090_pttab_dropfirstcol_addpt_decimal_1_prt_partone" not supported  (seg0 127.0.0.1:40000 pid=9829)
SELECT * FROM mpp21090_pttab_dropfirstcol_addpt_decimal ORDER BY 1,2,3;
 col2  | col3 | col4 | col5 
-------+------+------+------
  2.00 | a    | 2.00 |    0
 35.00 | b    | 1.00 |    1
(2 rows)

DELETE FROM mpp21090_pttab_dropfirstcol_addpt_decimal WHERE col2 = 1.00;
SELECT * FROM mpp21090_pttab_dropfirstcol_addpt_decimal ORDER BY 1,2,3;
 col2  | col3 | col4 | col5 
-------+------+------+------
  2.00 | a    | 2.00 |    0
 35.00 | b    | 1.00 |    1
(2 rows)

-- TEST
DROP TABLE IF EXISTS mpp21090_pttab_dropfirstcol_addpt_index_char;
NOTICE:  table "mpp21090_pttab_dropfirstcol_addpt_index_char" does not exist, skipping
CREATE TABLE mpp21090_pttab_dropfirstcol_addpt_index_char
(
    col1 char,
    col2 char,
    col3 char,
    col4 char,
    col5 int
) 
DISTRIBUTED by (col1)
PARTITION BY LIST(col2)(partition partone VALUES('a','b','c','d','e','f','g','h') WITH (APPENDONLY=true, COMPRESSLEVEL=5, ORIENTATION=column),partition parttwo VALUES('i','j','k','l','m','n','o','p') WITH (APPENDONLY=true, COMPRESSLEVEL=5, ORIENTATION=row),partition partthree VALUES('q','r','s','t','u','v','w','x'));
NOTICE:  CREATE TABLE will create partition "mpp21090_pttab_dropfirstcol_addpt_index_char_1_prt_partone" for table "mpp21090_pttab_dropfirstcol_addpt_index_char"
NOTICE:  CREATE TABLE will create partition "mpp21090_pttab_dropfirstcol_addpt_index_char_1_prt_parttwo" for table "mpp21090_pttab_dropfirstcol_addpt_index_char"
NOTICE:  CREATE TABLE will create partition "mpp21090_pttab_dropfirstcol_addpt_index_char_1_prt_partthree" for table "mpp21090_pttab_dropfirstcol_addpt_index_char"
INSERT INTO mpp21090_pttab_dropfirstcol_addpt_index_char VALUES('g','g','a','g',0);
DROP INDEX IF EXISTS mpp21090_pttab_dropfirstcol_addpt_index_idx_char;
NOTICE:  index "mpp21090_pttab_dropfirstcol_addpt_index_idx_char" does not exist, skipping
CREATE INDEX mpp21090_pttab_dropfirstcol_addpt_index_idx_char on mpp21090_pttab_dropfirstcol_addpt_index_char(col2);
NOTICE:  building index for child partition "mpp21090_pttab_dropfirstcol_addpt_index_char_1_prt_partone"
NOTICE:  building index for child partition "mpp21090_pttab_dropfirstcol_addpt_index_char_1_prt_parttwo"
NOTICE:  building index for child partition "mpp21090_pttab_dropfirstcol_addpt_index_char_1_prt_partthree"
ALTER TABLE mpp21090_pttab_dropfirstcol_addpt_index_char DROP COLUMN col1;
NOTICE:  Dropping a column that is part of the distribution policy forces a NULL distribution policy
NOTICE:  Dropping a column that is part of the distribution policy forces a NULL distribution policy
NOTICE:  Dropping a column that is part of the distribution policy forces a NULL distribution policy
NOTICE:  Dropping a column that is part of the distribution policy forces a NULL distribution policy
ALTER TABLE mpp21090_pttab_dropfirstcol_addpt_index_char ADD PARTITION partfour VALUES('y','z','-');
NOTICE:  CREATE TABLE will create partition "mpp21090_pttab_dropfirstcol_addpt_index_char_1_prt_partfour" for table "mpp21090_pttab_dropfirstcol_addpt_index_char"
INSERT INTO mpp21090_pttab_dropfirstcol_addpt_index_char SELECT 'z','b','z', 1;
SELECT * FROM mpp21090_pttab_dropfirstcol_addpt_index_char ORDER BY 1,2,3;
 col2 | col3 | col4 | col5 
------+------+------+------
 g    | a    | g    |    0
 z    | b    | z    |    1
(2 rows)

UPDATE mpp21090_pttab_dropfirstcol_addpt_index_char SET col4 = 'a' WHERE col2 = 'z' AND col4 = 'z';
SELECT * FROM mpp21090_pttab_dropfirstcol_addpt_index_char ORDER BY 1,2,3;
 col2 | col3 | col4 | col5 
------+------+------+------
 g    | a    | g    |    0
 z    | b    | a    |    1
(2 rows)

-- Update partition key
UPDATE mpp21090_pttab_dropfirstcol_addpt_index_char SET col2 = 'a' WHERE col2 = 'z' AND col4 = 'a';
ERROR:  moving tuple from partition "mpp21090_pttab_dropfirstcol_addpt_index_char_1_prt_partfour" to partition "mpp21090_pttab_dropfirstcol_addpt_index_char_1_prt_partone" not supported  (seg1 127.0.0.1:40001 pid=9830)
SELECT * FROM mpp21090_pttab_dropfirstcol_addpt_index_char ORDER BY 1,2,3;
 col2 | col3 | col4 | col5 
------+------+------+------
 g    | a    | g    |    0
 z    | b    | a    |    1
(2 rows)

DELETE FROM mpp21090_pttab_dropfirstcol_addpt_index_char WHERE col2 = 'a';
SELECT * FROM mpp21090_pttab_dropfirstcol_addpt_index_char ORDER BY 1,2,3;
 col2 | col3 | col4 | col5 
------+------+------+------
 g    | a    | g    |    0
 z    | b    | a    |    1
(2 rows)

-- TEST
DROP TABLE IF EXISTS mpp21090_pttab_dropfirstcol_addpt_index_decimal;
NOTICE:  table "mpp21090_pttab_dropfirstcol_addpt_index_decimal" does not exist, skipping
CREATE TABLE mpp21090_pttab_dropfirstcol_addpt_index_decimal
(
    col1 decimal,
    col2 decimal,
    col3 char,
    col4 decimal,
    col5 int
) 
DISTRIBUTED by (col1)
PARTITION BY RANGE(col2)(partition partone start(1.00) end(10.00)  WITH (APPENDONLY=true, COMPRESSLEVEL=5, ORIENTATION=column),partition parttwo start(10.00) end(20.00) WITH (APPENDONLY=true, COMPRESSLEVEL=5, ORIENTATION=row),partition partthree start(20.00) end(30.00));
NOTICE:  CREATE TABLE will create partition "mpp21090_pttab_dropfirstcol_addpt_index_decimal_1_prt_partone" for table "mpp21090_pttab_dropfirstcol_addpt_index_decimal"
NOTICE:  CREATE TABLE will create partition "mpp21090_pttab_dropfirstcol_addpt_index_decimal_1_prt_parttwo" for table "mpp21090_pttab_dropfirstcol_addpt_index_decimal"
NOTICE:  CREATE TABLE will create partition "mpp21090_pttab_dropfirstcol_addpt_index_decimal_1_prt_partthree" for table "mpp21090_pttab_dropfirstcol_addpt_index_decimal"
INSERT INTO mpp21090_pttab_dropfirstcol_addpt_index_decimal VALUES(2.00,2.00,'a',2.00,0);
DROP INDEX IF EXISTS mpp21090_pttab_dropfirstcol_addpt_index_idx_decimal;
NOTICE:  index "mpp21090_pttab_dropfirstcol_addpt_index_idx_decimal" does not exist, skipping
CREATE INDEX mpp21090_pttab_dropfirstcol_addpt_index_idx_decimal on mpp21090_pttab_dropfirstcol_addpt_index_decimal(col2);
NOTICE:  building index for child partition "mpp21090_pttab_dropfirstcol_addpt_index_decimal_1_prt_partone"
NOTICE:  building index for child partition "mpp21090_pttab_dropfirstcol_addpt_index_decimal_1_prt_parttwo"
NOTICE:  building index for child partition "mpp21090_pttab_dropfirstcol_addpt_index_decimal_1_prt_partthree"
ALTER TABLE mpp21090_pttab_dropfirstcol_addpt_index_decimal DROP COLUMN col1;
NOTICE:  Dropping a column that is part of the distribution policy forces a NULL distribution policy
NOTICE:  Dropping a column that is part of the distribution policy forces a NULL distribution policy
NOTICE:  Dropping a column that is part of the distribution policy forces a NULL distribution policy
NOTICE:  Dropping a column that is part of the distribution policy forces a NULL distribution policy
ALTER TABLE mpp21090_pttab_dropfirstcol_addpt_index_decimal ADD PARTITION partfour start(30.00) end(40.00) inclusive;
NOTICE:  CREATE TABLE will create partition "mpp21090_pttab_dropfirstcol_addpt_index_decimal_1_prt_partfour" for table "mpp21090_pttab_dropfirstcol_addpt_index_decimal"
INSERT INTO mpp21090_pttab_dropfirstcol_addpt_index_decimal SELECT 35.00,'b',35.00, 1;
SELECT * FROM mpp21090_pttab_dropfirstcol_addpt_index_decimal ORDER BY 1,2,3;
 col2  | col3 | col4  | col5 
-------+------+-------+------
  2.00 | a    |  2.00 |    0
 35.00 | b    | 35.00 |    1
(2 rows)

UPDATE mpp21090_pttab_dropfirstcol_addpt_index_decimal SET col4 = 1.00 WHERE col2 = 35.00 AND col4 = 35.00;
SELECT * FROM mpp21090_pttab_dropfirstcol_addpt_index_decimal ORDER BY 1,2,3;
 col2  | col3 | col4 | col5 
-------+------+------+------
  2.00 | a    | 2.00 |    0
 35.00 | b    | 1.00 |    1
(2 rows)

-- Update partition key
UPDATE mpp21090_pttab_dropfirstcol_addpt_index_decimal SET col2 = 1.00 WHERE col2 = 35.00 AND col4 = 1.00;
ERROR:  moving tuple from partition "mpp21090_pttab_dropfirstcol_addpt_index_decimal_1_prt_partfour" to partition "mpp21090_pttab_dropfirstcol_addpt_index_decimal_1_prt_partone" not supported  (seg2 127.0.0.1:40002 pid=9831)
SELECT * FROM mpp21090_pttab_dropfirstcol_addpt_index_decimal ORDER BY 1,2,3;
 col2  | col3 | col4 | col5 
-------+------+------+------
  2.00 | a    | 2.00 |    0
 35.00 | b    | 1.00 |    1
(2 rows)

DELETE FROM mpp21090_pttab_dropfirstcol_addpt_index_decimal WHERE col2 = 1.00;
SELECT * FROM mpp21090_pttab_dropfirstcol_addpt_index_decimal ORDER BY 1,2,3;
 col2  | col3 | col4 | col5 
-------+------+------+------
  2.00 | a    | 2.00 |    0
 35.00 | b    | 1.00 |    1
(2 rows)

-- TEST
DROP TABLE IF EXISTS mpp21090_pttab_dropfirstcol_addpt_index_int4;
NOTICE:  table "mpp21090_pttab_dropfirstcol_addpt_index_int4" does not exist, skipping
CREATE TABLE mpp21090_pttab_dropfirstcol_addpt_index_int4
(
    col1 int4,
    col2 int4,
    col3 char,
    col4 int4,
    col5 int
) 
DISTRIBUTED by (col1)
PARTITION BY RANGE(col2)(partition partone start(1) end(100000001)  WITH (APPENDONLY=true, COMPRESSLEVEL=5, ORIENTATION=column),partition parttwo start(100000001) end(200000001) WITH (APPENDONLY=true, COMPRESSLEVEL=5, ORIENTATION=row),partition partthree start(200000001) end(300000001));
NOTICE:  CREATE TABLE will create partition "mpp21090_pttab_dropfirstcol_addpt_index_int4_1_prt_partone" for table "mpp21090_pttab_dropfirstcol_addpt_index_int4"
NOTICE:  CREATE TABLE will create partition "mpp21090_pttab_dropfirstcol_addpt_index_int4_1_prt_parttwo" for table "mpp21090_pttab_dropfirstcol_addpt_index_int4"
NOTICE:  CREATE TABLE will create partition "mpp21090_pttab_dropfirstcol_addpt_index_int4_1_prt_partthree" for table "mpp21090_pttab_dropfirstcol_addpt_index_int4"
INSERT INTO mpp21090_pttab_dropfirstcol_addpt_index_int4 VALUES(20000000,20000000,'a',20000000,0);
DROP INDEX IF EXISTS mpp21090_pttab_dropfirstcol_addpt_index_idx_int4;
NOTICE:  index "mpp21090_pttab_dropfirstcol_addpt_index_idx_int4" does not exist, skipping
CREATE INDEX mpp21090_pttab_dropfirstcol_addpt_index_idx_int4 on mpp21090_pttab_dropfirstcol_addpt_index_int4(col2);
NOTICE:  building index for child partition "mpp21090_pttab_dropfirstcol_addpt_index_int4_1_prt_partone"
NOTICE:  building index for child partition "mpp21090_pttab_dropfirstcol_addpt_index_int4_1_prt_parttwo"
NOTICE:  building index for child partition "mpp21090_pttab_dropfirstcol_addpt_index_int4_1_prt_partthree"
ALTER TABLE mpp21090_pttab_dropfirstcol_addpt_index_int4 DROP COLUMN col1;
NOTICE:  Dropping a column that is part of the distribution policy forces a NULL distribution policy
NOTICE:  Dropping a column that is part of the distribution policy forces a NULL distribution policy
NOTICE:  Dropping a column that is part of the distribution policy forces a NULL distribution policy
NOTICE:  Dropping a column that is part of the distribution policy forces a NULL distribution policy
ALTER TABLE mpp21090_pttab_dropfirstcol_addpt_index_int4 ADD PARTITION partfour start(300000001) end(400000001);
NOTICE:  CREATE TABLE will create partition "mpp21090_pttab_dropfirstcol_addpt_index_int4_1_prt_partfour" for table "mpp21090_pttab_dropfirstcol_addpt_index_int4"
INSERT INTO mpp21090_pttab_dropfirstcol_addpt_index_int4 SELECT 350000000,'b',350000000, 1;
SELECT * FROM mpp21090_pttab_dropfirstcol_addpt_index_int4 ORDER BY 1,2,3;
   col2    | col3 |   col4    | col5 
-----------+------+-----------+------
  20000000 | a    |  20000000 |    0
 350000000 | b    | 350000000 |    1
(2 rows)

UPDATE mpp21090_pttab_dropfirstcol_addpt_index_int4 SET col4 = 10000000 WHERE col2 = 350000000 AND col4 = 350000000;
SELECT * FROM mpp21090_pttab_dropfirstcol_addpt_index_int4 ORDER BY 1,2,3;
   col2    | col3 |   col4   | col5 
-----------+------+----------+------
  20000000 | a    | 20000000 |    0
 350000000 | b    | 10000000 |    1
(2 rows)

-- Update partition key
UPDATE mpp21090_pttab_dropfirstcol_addpt_index_int4 SET col2 = 10000000 WHERE col2 = 350000000 AND col4 = 10000000;
ERROR:  moving tuple from partition "mpp21090_pttab_dropfirstcol_addpt_index_int4_1_prt_partfour" to partition "mpp21090_pttab_dropfirstcol_addpt_index_int4_1_prt_partone" not supported  (seg1 127.0.0.1:40001 pid=9830)
SELECT * FROM mpp21090_pttab_dropfirstcol_addpt_index_int4 ORDER BY 1,2,3;
   col2    | col3 |   col4   | col5 
-----------+------+----------+------
  20000000 | a    | 20000000 |    0
 350000000 | b    | 10000000 |    1
(2 rows)

DELETE FROM mpp21090_pttab_dropfirstcol_addpt_index_int4 WHERE col2 = 10000000;
SELECT * FROM mpp21090_pttab_dropfirstcol_addpt_index_int4 ORDER BY 1,2,3;
   col2    | col3 |   col4   | col5 
-----------+------+----------+------
  20000000 | a    | 20000000 |    0
 350000000 | b    | 10000000 |    1
(2 rows)

-- TEST
DROP TABLE IF EXISTS mpp21090_pttab_dropfirstcol_addpt_index_int8;
NOTICE:  table "mpp21090_pttab_dropfirstcol_addpt_index_int8" does not exist, skipping
CREATE TABLE mpp21090_pttab_dropfirstcol_addpt_index_int8
(
    col1 int8,
    col2 int8,
    col3 char,
    col4 int8,
    col5 int
) 
DISTRIBUTED by (col1)
PARTITION BY RANGE(col2)(partition partone start(1) end(1000000000000000001)  WITH (APPENDONLY=true, COMPRESSLEVEL=5, ORIENTATION=column),partition parttwo start(1000000000000000001) end(2000000000000000001) WITH (APPENDONLY=true, COMPRESSLEVEL=5, ORIENTATION=row),partition partthree start(2000000000000000001) end(3000000000000000001));
NOTICE:  CREATE TABLE will create partition "mpp21090_pttab_dropfirstcol_addpt_index_int8_1_prt_partone" for table "mpp21090_pttab_dropfirstcol_addpt_index_int8"
NOTICE:  CREATE TABLE will create partition "mpp21090_pttab_dropfirstcol_addpt_index_int8_1_prt_parttwo" for table "mpp21090_pttab_dropfirstcol_addpt_index_int8"
NOTICE:  CREATE TABLE will create partition "mpp21090_pttab_dropfirstcol_addpt_index_int8_1_prt_partthree" for table "mpp21090_pttab_dropfirstcol_addpt_index_int8"
INSERT INTO mpp21090_pttab_dropfirstcol_addpt_index_int8 VALUES(200000000000000000,200000000000000000,'a',200000000000000000,0);
DROP INDEX IF EXISTS mpp21090_pttab_dropfirstcol_addpt_index_idx_int8;
NOTICE:  index "mpp21090_pttab_dropfirstcol_addpt_index_idx_int8" does not exist, skipping
CREATE INDEX mpp21090_pttab_dropfirstcol_addpt_index_idx_int8 on mpp21090_pttab_dropfirstcol_addpt_index_int8(col2);
NOTICE:  building index for child partition "mpp21090_pttab_dropfirstcol_addpt_index_int8_1_prt_partone"
NOTICE:  building index for child partition "mpp21090_pttab_dropfirstcol_addpt_index_int8_1_prt_parttwo"
NOTICE:  building index for child partition "mpp21090_pttab_dropfirstcol_addpt_index_int8_1_prt_partthree"
ALTER TABLE mpp21090_pttab_dropfirstcol_addpt_index_int8 DROP COLUMN col1;
NOTICE:  Dropping a column that is part of the distribution policy forces a NULL distribution policy
NOTICE:  Dropping a column that is part of the distribution policy forces a NULL distribution policy
NOTICE:  Dropping a column that is part of the distribution policy forces a NULL distribution policy
NOTICE:  Dropping a column that is part of the distribution policy forces a NULL distribution policy
ALTER TABLE mpp21090_pttab_dropfirstcol_addpt_index_int8 ADD PARTITION partfour start(3000000000000000001) end(4000000000000000001);
NOTICE:  CREATE TABLE will create partition "mpp21090_pttab_dropfirstcol_addpt_index_int8_1_prt_partfour" for table "mpp21090_pttab_dropfirstcol_addpt_index_int8"
INSERT INTO mpp21090_pttab_dropfirstcol_addpt_index_int8 SELECT 3500000000000000000,'b',3500000000000000000, 1;
SELECT * FROM mpp21090_pttab_dropfirstcol_addpt_index_int8 ORDER BY 1,2,3;
        col2         | col3 |        col4         | col5 
---------------------+------+---------------------+------
  200000000000000000 | a    |  200000000000000000 |    0
 3500000000000000000 | b    | 3500000000000000000 |    1
(2 rows)

UPDATE mpp21090_pttab_dropfirstcol_addpt_index_int8 SET col4 = 1000000000000000000 WHERE col2 = 3500000000000000000 AND col4 = 3500000000000000000;
SELECT * FROM mpp21090_pttab_dropfirstcol_addpt_index_int8 ORDER BY 1,2,3;
        col2         | col3 |        col4         | col5 
---------------------+------+---------------------+------
  200000000000000000 | a    |  200000000000000000 |    0
 3500000000000000000 | b    | 1000000000000000000 |    1
(2 rows)

-- Update partition key
UPDATE mpp21090_pttab_dropfirstcol_addpt_index_int8 SET col2 = 1000000000000000000 WHERE col2 = 3500000000000000000 AND col4 = 1000000000000000000;
ERROR:  moving tuple from partition "mpp21090_pttab_dropfirstcol_addpt_index_int8_1_prt_partfour" to partition "mpp21090_pttab_dropfirstcol_addpt_index_int8_1_prt_partone" not supported  (seg2 127.0.0.1:40002 pid=9831)
SELECT * FROM mpp21090_pttab_dropfirstcol_addpt_index_int8 ORDER BY 1,2,3;
        col2         | col3 |        col4         | col5 
---------------------+------+---------------------+------
  200000000000000000 | a    |  200000000000000000 |    0
 3500000000000000000 | b    | 1000000000000000000 |    1
(2 rows)

DELETE FROM mpp21090_pttab_dropfirstcol_addpt_index_int8 WHERE col2 = 1000000000000000000;
SELECT * FROM mpp21090_pttab_dropfirstcol_addpt_index_int8 ORDER BY 1,2,3;
        col2         | col3 |        col4         | col5 
---------------------+------+---------------------+------
  200000000000000000 | a    |  200000000000000000 |    0
 3500000000000000000 | b    | 1000000000000000000 |    1
(2 rows)

-- TEST
DROP TABLE IF EXISTS mpp21090_pttab_dropfirstcol_addpt_index_interval;
NOTICE:  table "mpp21090_pttab_dropfirstcol_addpt_index_interval" does not exist, skipping
CREATE TABLE mpp21090_pttab_dropfirstcol_addpt_index_interval
(
    col1 interval,
    col2 interval,
    col3 char,
    col4 interval,
    col5 int
) 
DISTRIBUTED by (col1)
PARTITION BY RANGE(col2)(partition partone start('1 sec') end('1 min')  WITH (APPENDONLY=true, COMPRESSLEVEL=5, ORIENTATION=column),partition parttwo start('1 min') end('1 hour') WITH (APPENDONLY=true, COMPRESSLEVEL=5, ORIENTATION=row),partition partthree start('1 hour') end('12 hours'));
NOTICE:  CREATE TABLE will create partition "mpp21090_pttab_dropfirstcol_addpt_index_interval_1_prt_partone" for table "mpp21090_pttab_dropfirstcol_addpt_index_interval"
NOTICE:  CREATE TABLE will create partition "mpp21090_pttab_dropfirstcol_addpt_index_interval_1_prt_parttwo" for table "mpp21090_pttab_dropfirstcol_addpt_index_interval"
NOTICE:  CREATE TABLE will create partition "mpp21090_pttab_dropfirstcol_addpt_index_interva_1_prt_partthree" for table "mpp21090_pttab_dropfirstcol_addpt_index_interval"
INSERT INTO mpp21090_pttab_dropfirstcol_addpt_index_interval VALUES('10 secs','10 secs','a','10 secs',0);
DROP INDEX IF EXISTS mpp21090_pttab_dropfirstcol_addpt_index_idx_interval;
NOTICE:  index "mpp21090_pttab_dropfirstcol_addpt_index_idx_interval" does not exist, skipping
CREATE INDEX mpp21090_pttab_dropfirstcol_addpt_index_idx_interval on mpp21090_pttab_dropfirstcol_addpt_index_interval(col2);
NOTICE:  building index for child partition "mpp21090_pttab_dropfirstcol_addpt_index_interval_1_prt_partone"
NOTICE:  building index for child partition "mpp21090_pttab_dropfirstcol_addpt_index_interval_1_prt_parttwo"
NOTICE:  building index for child partition "mpp21090_pttab_dropfirstcol_addpt_index_interva_1_prt_partthree"
ALTER TABLE mpp21090_pttab_dropfirstcol_addpt_index_interval DROP COLUMN col1;
NOTICE:  Dropping a column that is part of the distribution policy forces a NULL distribution policy
NOTICE:  Dropping a column that is part of the distribution policy forces a NULL distribution policy
NOTICE:  Dropping a column that is part of the distribution policy forces a NULL distribution policy
NOTICE:  Dropping a column that is part of the distribution policy forces a NULL distribution policy
ALTER TABLE mpp21090_pttab_dropfirstcol_addpt_index_interval ADD PARTITION partfour start('12 hours') end('1 day') inclusive;
NOTICE:  CREATE TABLE will create partition "mpp21090_pttab_dropfirstcol_addpt_index_interval_1_prt_partfour" for table "mpp21090_pttab_dropfirstcol_addpt_index_interval"
INSERT INTO mpp21090_pttab_dropfirstcol_addpt_index_interval SELECT '14 hours','b','14 hours', 1;
SELECT * FROM mpp21090_pttab_dropfirstcol_addpt_index_interval ORDER BY 1,2,3;
   col2   | col3 |   col4   | col5 
----------+------+----------+------
 00:00:10 | a    | 00:00:10 |    0
 14:00:00 | b    | 14:00:00 |    1
(2 rows)

UPDATE mpp21090_pttab_dropfirstcol_addpt_index_interval SET col4 = '11 hours' WHERE col2 = '14 hours' AND col4 = '14 hours';
SELECT * FROM mpp21090_pttab_dropfirstcol_addpt_index_interval ORDER BY 1,2,3;
   col2   | col3 |   col4   | col5 
----------+------+----------+------
 00:00:10 | a    | 00:00:10 |    0
 14:00:00 | b    | 11:00:00 |    1
(2 rows)

-- Update partition key
UPDATE mpp21090_pttab_dropfirstcol_addpt_index_interval SET col2 = '11 hours' WHERE col2 = '14 hours' AND col4 = '11 hours';
ERROR:  moving tuple from partition "mpp21090_pttab_dropfirstcol_addpt_index_interval_1_prt_partfour" to partition "mpp21090_pttab_dropfirstcol_addpt_index_interva_1_prt_partthree" not supported  (seg0 127.0.0.1:40000 pid=9829)
SELECT * FROM mpp21090_pttab_dropfirstcol_addpt_index_interval ORDER BY 1,2,3;
   col2   | col3 |   col4   | col5 
----------+------+----------+------
 00:00:10 | a    | 00:00:10 |    0
 14:00:00 | b    | 11:00:00 |    1
(2 rows)

DELETE FROM mpp21090_pttab_dropfirstcol_addpt_index_interval WHERE col2 = '11 hours';
SELECT * FROM mpp21090_pttab_dropfirstcol_addpt_index_interval ORDER BY 1,2,3;
   col2   | col3 |   col4   | col5 
----------+------+----------+------
 00:00:10 | a    | 00:00:10 |    0
 14:00:00 | b    | 11:00:00 |    1
(2 rows)

-- TEST
DROP TABLE IF EXISTS mpp21090_pttab_dropfirstcol_addpt_index_numeric;
NOTICE:  table "mpp21090_pttab_dropfirstcol_addpt_index_numeric" does not exist, skipping
CREATE TABLE mpp21090_pttab_dropfirstcol_addpt_index_numeric
(
    col1 numeric,
    col2 numeric,
    col3 char,
    col4 numeric,
    col5 int
) 
DISTRIBUTED by (col1)
PARTITION BY RANGE(col2)(partition partone start(1.000000) end(10.000000)  WITH (APPENDONLY=true, COMPRESSLEVEL=5, ORIENTATION=column),partition parttwo start(10.000000) end(20.000000) WITH (APPENDONLY=true, COMPRESSLEVEL=5, ORIENTATION=row),partition partthree start(20.000000) end(30.000000));
NOTICE:  CREATE TABLE will create partition "mpp21090_pttab_dropfirstcol_addpt_index_numeric_1_prt_partone" for table "mpp21090_pttab_dropfirstcol_addpt_index_numeric"
NOTICE:  CREATE TABLE will create partition "mpp21090_pttab_dropfirstcol_addpt_index_numeric_1_prt_parttwo" for table "mpp21090_pttab_dropfirstcol_addpt_index_numeric"
NOTICE:  CREATE TABLE will create partition "mpp21090_pttab_dropfirstcol_addpt_index_numeric_1_prt_partthree" for table "mpp21090_pttab_dropfirstcol_addpt_index_numeric"
INSERT INTO mpp21090_pttab_dropfirstcol_addpt_index_numeric VALUES(2.000000,2.000000,'a',2.000000,0);
DROP INDEX IF EXISTS mpp21090_pttab_dropfirstcol_addpt_index_idx_numeric;
NOTICE:  index "mpp21090_pttab_dropfirstcol_addpt_index_idx_numeric" does not exist, skipping
CREATE INDEX mpp21090_pttab_dropfirstcol_addpt_index_idx_numeric on mpp21090_pttab_dropfirstcol_addpt_index_numeric(col2);
NOTICE:  building index for child partition "mpp21090_pttab_dropfirstcol_addpt_index_numeric_1_prt_partone"
NOTICE:  building index for child partition "mpp21090_pttab_dropfirstcol_addpt_index_numeric_1_prt_parttwo"
NOTICE:  building index for child partition "mpp21090_pttab_dropfirstcol_addpt_index_numeric_1_prt_partthree"
ALTER TABLE mpp21090_pttab_dropfirstcol_addpt_index_numeric DROP COLUMN col1;
NOTICE:  Dropping a column that is part of the distribution policy forces a NULL distribution policy
NOTICE:  Dropping a column that is part of the distribution policy forces a NULL distribution policy
NOTICE:  Dropping a column that is part of the distribution policy forces a NULL distribution policy
NOTICE:  Dropping a column that is part of the distribution policy forces a NULL distribution policy
ALTER TABLE mpp21090_pttab_dropfirstcol_addpt_index_numeric ADD PARTITION partfour start(30.000000) end(40.000000) inclusive;
NOTICE:  CREATE TABLE will create partition "mpp21090_pttab_dropfirstcol_addpt_index_numeric_1_prt_partfour" for table "mpp21090_pttab_dropfirstcol_addpt_index_numeric"
INSERT INTO mpp21090_pttab_dropfirstcol_addpt_index_numeric SELECT 35.000000,'b',35.000000, 1;
SELECT * FROM mpp21090_pttab_dropfirstcol_addpt_index_numeric ORDER BY 1,2,3;
   col2    | col3 |   col4    | col5 
-----------+------+-----------+------
  2.000000 | a    |  2.000000 |    0
 35.000000 | b    | 35.000000 |    1
(2 rows)

UPDATE mpp21090_pttab_dropfirstcol_addpt_index_numeric SET col4 = 1.000000 WHERE col2 = 35.000000 AND col4 = 35.000000;
SELECT * FROM mpp21090_pttab_dropfirstcol_addpt_index_numeric ORDER BY 1,2,3;
   col2    | col3 |   col4   | col5 
-----------+------+----------+------
  2.000000 | a    | 2.000000 |    0
 35.000000 | b    | 1.000000 |    1
(2 rows)

-- Update partition key
UPDATE mpp21090_pttab_dropfirstcol_addpt_index_numeric SET col2 = 1.000000 WHERE col2 = 35.000000 AND col4 = 1.000000;
ERROR:  moving tuple from partition "mpp21090_pttab_dropfirstcol_addpt_index_numeric_1_prt_partfour" to partition "mpp21090_pttab_dropfirstcol_addpt_index_numeric_1_prt_partone" not supported  (seg1 127.0.0.1:40001 pid=9830)
SELECT * FROM mpp21090_pttab_dropfirstcol_addpt_index_numeric ORDER BY 1,2,3;
   col2    | col3 |   col4   | col5 
-----------+------+----------+------
  2.000000 | a    | 2.000000 |    0
 35.000000 | b    | 1.000000 |    1
(2 rows)

DELETE FROM mpp21090_pttab_dropfirstcol_addpt_index_numeric WHERE col2 = 1.000000;
SELECT * FROM mpp21090_pttab_dropfirstcol_addpt_index_numeric ORDER BY 1,2,3;
   col2    | col3 |   col4   | col5 
-----------+------+----------+------
  2.000000 | a    | 2.000000 |    0
 35.000000 | b    | 1.000000 |    1
(2 rows)

-- TEST
DROP TABLE IF EXISTS mpp21090_pttab_dropfirstcol_addpt_int4;
NOTICE:  table "mpp21090_pttab_dropfirstcol_addpt_int4" does not exist, skipping
CREATE TABLE mpp21090_pttab_dropfirstcol_addpt_int4
(
    col1 int4,
    col2 int4,
    col3 char,
    col4 int4,
    col5 int
) 
DISTRIBUTED by (col1)
PARTITION BY RANGE(col2)(partition partone start(1) end(100000001)  WITH (APPENDONLY=true, COMPRESSLEVEL=5, ORIENTATION=column),partition parttwo start(100000001) end(200000001) WITH (APPENDONLY=true, COMPRESSLEVEL=5, ORIENTATION=row),partition partthree start(200000001) end(300000001));
NOTICE:  CREATE TABLE will create partition "mpp21090_pttab_dropfirstcol_addpt_int4_1_prt_partone" for table "mpp21090_pttab_dropfirstcol_addpt_int4"
NOTICE:  CREATE TABLE will create partition "mpp21090_pttab_dropfirstcol_addpt_int4_1_prt_parttwo" for table "mpp21090_pttab_dropfirstcol_addpt_int4"
NOTICE:  CREATE TABLE will create partition "mpp21090_pttab_dropfirstcol_addpt_int4_1_prt_partthree" for table "mpp21090_pttab_dropfirstcol_addpt_int4"
INSERT INTO mpp21090_pttab_dropfirstcol_addpt_int4 VALUES(20000000,20000000,'a',20000000,0);
ALTER TABLE mpp21090_pttab_dropfirstcol_addpt_int4 DROP COLUMN col1;
NOTICE:  Dropping a column that is part of the distribution policy forces a NULL distribution policy
NOTICE:  Dropping a column that is part of the distribution policy forces a NULL distribution policy
NOTICE:  Dropping a column that is part of the distribution policy forces a NULL distribution policy
NOTICE:  Dropping a column that is part of the distribution policy forces a NULL distribution policy
ALTER TABLE mpp21090_pttab_dropfirstcol_addpt_int4 ADD PARTITION partfour start(300000001) end(400000001);
NOTICE:  CREATE TABLE will create partition "mpp21090_pttab_dropfirstcol_addpt_int4_1_prt_partfour" for table "mpp21090_pttab_dropfirstcol_addpt_int4"
INSERT INTO mpp21090_pttab_dropfirstcol_addpt_int4 SELECT 35000000,'b',35000000, 1;
SELECT * FROM mpp21090_pttab_dropfirstcol_addpt_int4 ORDER BY 1,2,3;
   col2   | col3 |   col4   | col5 
----------+------+----------+------
 20000000 | a    | 20000000 |    0
 35000000 | b    | 35000000 |    1
(2 rows)

UPDATE mpp21090_pttab_dropfirstcol_addpt_int4 SET col4 = 10000000 WHERE col2 = 35000000 AND col4 = 35000000;
SELECT * FROM mpp21090_pttab_dropfirstcol_addpt_int4 ORDER BY 1,2,3;
   col2   | col3 |   col4   | col5 
----------+------+----------+------
 20000000 | a    | 20000000 |    0
 35000000 | b    | 10000000 |    1
(2 rows)

-- Update partition key
UPDATE mpp21090_pttab_dropfirstcol_addpt_int4 SET col2 = 10000000 WHERE col2 = 35000000 AND col4 = 10000000;
SELECT * FROM mpp21090_pttab_dropfirstcol_addpt_int4 ORDER BY 1,2,3;
   col2   | col3 |   col4   | col5 
----------+------+----------+------
 10000000 | b    | 10000000 |    1
 20000000 | a    | 20000000 |    0
(2 rows)

DELETE FROM mpp21090_pttab_dropfirstcol_addpt_int4 WHERE col2 = 10000000;
SELECT * FROM mpp21090_pttab_dropfirstcol_addpt_int4 ORDER BY 1,2,3;
   col2   | col3 |   col4   | col5 
----------+------+----------+------
 20000000 | a    | 20000000 |    0
(1 row)

-- TEST
DROP TABLE IF EXISTS mpp21090_pttab_dropfirstcol_addpt_int8;
NOTICE:  table "mpp21090_pttab_dropfirstcol_addpt_int8" does not exist, skipping
CREATE TABLE mpp21090_pttab_dropfirstcol_addpt_int8
(
    col1 int8,
    col2 int8,
    col3 char,
    col4 int8,
    col5 int
) 
DISTRIBUTED by (col1)
PARTITION BY RANGE(col2)(partition partone start(1) end(1000000000000000001)  WITH (APPENDONLY=true, COMPRESSLEVEL=5, ORIENTATION=column),partition parttwo start(1000000000000000001) end(2000000000000000001) WITH (APPENDONLY=true, COMPRESSLEVEL=5, ORIENTATION=row),partition partthree start(2000000000000000001) end(3000000000000000001));
NOTICE:  CREATE TABLE will create partition "mpp21090_pttab_dropfirstcol_addpt_int8_1_prt_partone" for table "mpp21090_pttab_dropfirstcol_addpt_int8"
NOTICE:  CREATE TABLE will create partition "mpp21090_pttab_dropfirstcol_addpt_int8_1_prt_parttwo" for table "mpp21090_pttab_dropfirstcol_addpt_int8"
NOTICE:  CREATE TABLE will create partition "mpp21090_pttab_dropfirstcol_addpt_int8_1_prt_partthree" for table "mpp21090_pttab_dropfirstcol_addpt_int8"
INSERT INTO mpp21090_pttab_dropfirstcol_addpt_int8 VALUES(2000000000000000000,2000000000000000000,'a',2000000000000000000,0);
ALTER TABLE mpp21090_pttab_dropfirstcol_addpt_int8 DROP COLUMN col1;
NOTICE:  Dropping a column that is part of the distribution policy forces a NULL distribution policy
NOTICE:  Dropping a column that is part of the distribution policy forces a NULL distribution policy
NOTICE:  Dropping a column that is part of the distribution policy forces a NULL distribution policy
NOTICE:  Dropping a column that is part of the distribution policy forces a NULL distribution policy
ALTER TABLE mpp21090_pttab_dropfirstcol_addpt_int8 ADD PARTITION partfour start(3000000000000000001) end(4000000000000000001);
NOTICE:  CREATE TABLE will create partition "mpp21090_pttab_dropfirstcol_addpt_int8_1_prt_partfour" for table "mpp21090_pttab_dropfirstcol_addpt_int8"
INSERT INTO mpp21090_pttab_dropfirstcol_addpt_int8 SELECT 3500000000000000000,'b',3500000000000000000, 1;
SELECT * FROM mpp21090_pttab_dropfirstcol_addpt_int8 ORDER BY 1,2,3;
        col2         | col3 |        col4         | col5 
---------------------+------+---------------------+------
 2000000000000000000 | a    | 2000000000000000000 |    0
 3500000000000000000 | b    | 3500000000000000000 |    1
(2 rows)

UPDATE mpp21090_pttab_dropfirstcol_addpt_int8 SET col4 = 1000000000000000000 WHERE col2 = 3500000000000000000 AND col4 = 3500000000000000000;
SELECT * FROM mpp21090_pttab_dropfirstcol_addpt_int8 ORDER BY 1,2,3;
        col2         | col3 |        col4         | col5 
---------------------+------+---------------------+------
 2000000000000000000 | a    | 2000000000000000000 |    0
 3500000000000000000 | b    | 1000000000000000000 |    1
(2 rows)

-- Update partition key
UPDATE mpp21090_pttab_dropfirstcol_addpt_int8 SET col2 = 1000000000000000000 WHERE col2 = 3500000000000000000 AND col4 = 1000000000000000000;
ERROR:  moving tuple from partition "mpp21090_pttab_dropfirstcol_addpt_int8_1_prt_partfour" to partition "mpp21090_pttab_dropfirstcol_addpt_int8_1_prt_partone" not supported  (seg1 127.0.0.1:40001 pid=9830)
SELECT * FROM mpp21090_pttab_dropfirstcol_addpt_int8 ORDER BY 1,2,3;
        col2         | col3 |        col4         | col5 
---------------------+------+---------------------+------
 2000000000000000000 | a    | 2000000000000000000 |    0
 3500000000000000000 | b    | 1000000000000000000 |    1
(2 rows)

DELETE FROM mpp21090_pttab_dropfirstcol_addpt_int8 WHERE col2 = 1000000000000000000;
SELECT * FROM mpp21090_pttab_dropfirstcol_addpt_int8 ORDER BY 1,2,3;
        col2         | col3 |        col4         | col5 
---------------------+------+---------------------+------
 2000000000000000000 | a    | 2000000000000000000 |    0
 3500000000000000000 | b    | 1000000000000000000 |    1
(2 rows)

-- TEST
DROP TABLE IF EXISTS mpp21090_pttab_dropfirstcol_addpt_interval;
NOTICE:  table "mpp21090_pttab_dropfirstcol_addpt_interval" does not exist, skipping
CREATE TABLE mpp21090_pttab_dropfirstcol_addpt_interval
(
    col1 interval,
    col2 interval,
    col3 char,
    col4 interval,
    col5 int
) 
DISTRIBUTED by (col1)
PARTITION BY RANGE(col2)(partition partone start('1 sec') end('1 min')  WITH (APPENDONLY=true, COMPRESSLEVEL=5, ORIENTATION=column),partition parttwo start('1 min') end('1 hour') WITH (APPENDONLY=true, COMPRESSLEVEL=5, ORIENTATION=row),partition partthree start('1 hour') end('12 hours'));
NOTICE:  CREATE TABLE will create partition "mpp21090_pttab_dropfirstcol_addpt_interval_1_prt_partone" for table "mpp21090_pttab_dropfirstcol_addpt_interval"
NOTICE:  CREATE TABLE will create partition "mpp21090_pttab_dropfirstcol_addpt_interval_1_prt_parttwo" for table "mpp21090_pttab_dropfirstcol_addpt_interval"
NOTICE:  CREATE TABLE will create partition "mpp21090_pttab_dropfirstcol_addpt_interval_1_prt_partthree" for table "mpp21090_pttab_dropfirstcol_addpt_interval"
INSERT INTO mpp21090_pttab_dropfirstcol_addpt_interval VALUES('1 hour','1 hour','a','1 hour',0);
ALTER TABLE mpp21090_pttab_dropfirstcol_addpt_interval DROP COLUMN col1;
NOTICE:  Dropping a column that is part of the distribution policy forces a NULL distribution policy
NOTICE:  Dropping a column that is part of the distribution policy forces a NULL distribution policy
NOTICE:  Dropping a column that is part of the distribution policy forces a NULL distribution policy
NOTICE:  Dropping a column that is part of the distribution policy forces a NULL distribution policy
ALTER TABLE mpp21090_pttab_dropfirstcol_addpt_interval ADD PARTITION partfour start('12 hours') end('1 day') inclusive;
NOTICE:  CREATE TABLE will create partition "mpp21090_pttab_dropfirstcol_addpt_interval_1_prt_partfour" for table "mpp21090_pttab_dropfirstcol_addpt_interval"
INSERT INTO mpp21090_pttab_dropfirstcol_addpt_interval SELECT '14 hours','b','14 hours', 1;
SELECT * FROM mpp21090_pttab_dropfirstcol_addpt_interval ORDER BY 1,2,3;
   col2   | col3 |   col4   | col5 
----------+------+----------+------
 01:00:00 | a    | 01:00:00 |    0
 14:00:00 | b    | 14:00:00 |    1
(2 rows)

UPDATE mpp21090_pttab_dropfirstcol_addpt_interval SET col4 = '12 hours' WHERE col2 = '14 hours' AND col4 = '14 hours';
SELECT * FROM mpp21090_pttab_dropfirstcol_addpt_interval ORDER BY 1,2,3;
   col2   | col3 |   col4   | col5 
----------+------+----------+------
 01:00:00 | a    | 01:00:00 |    0
 14:00:00 | b    | 12:00:00 |    1
(2 rows)

-- Update partition key
UPDATE mpp21090_pttab_dropfirstcol_addpt_interval SET col2 = '12 hours' WHERE col2 = '14 hours' AND col4 = '12 hours';
SELECT * FROM mpp21090_pttab_dropfirstcol_addpt_interval ORDER BY 1,2,3;
   col2   | col3 |   col4   | col5 
----------+------+----------+------
 01:00:00 | a    | 01:00:00 |    0
 12:00:00 | b    | 12:00:00 |    1
(2 rows)

DELETE FROM mpp21090_pttab_dropfirstcol_addpt_interval WHERE col2 = '12 hours';
SELECT * FROM mpp21090_pttab_dropfirstcol_addpt_interval ORDER BY 1,2,3;
   col2   | col3 |   col4   | col5 
----------+------+----------+------
 01:00:00 | a    | 01:00:00 |    0
(1 row)

-- TEST
DROP TABLE IF EXISTS mpp21090_pttab_dropfirstcol_addpt_numeric;
NOTICE:  table "mpp21090_pttab_dropfirstcol_addpt_numeric" does not exist, skipping
CREATE TABLE mpp21090_pttab_dropfirstcol_addpt_numeric
(
    col1 numeric,
    col2 numeric,
    col3 char,
    col4 numeric,
    col5 int
) 
DISTRIBUTED by (col1)
PARTITION BY RANGE(col2)(partition partone start(1.000000) end(10.000000)  WITH (APPENDONLY=true, COMPRESSLEVEL=5, ORIENTATION=column),partition parttwo start(10.000000) end(20.000000) WITH (APPENDONLY=true, COMPRESSLEVEL=5, ORIENTATION=row),partition partthree start(20.000000) end(30.000000));
NOTICE:  CREATE TABLE will create partition "mpp21090_pttab_dropfirstcol_addpt_numeric_1_prt_partone" for table "mpp21090_pttab_dropfirstcol_addpt_numeric"
NOTICE:  CREATE TABLE will create partition "mpp21090_pttab_dropfirstcol_addpt_numeric_1_prt_parttwo" for table "mpp21090_pttab_dropfirstcol_addpt_numeric"
NOTICE:  CREATE TABLE will create partition "mpp21090_pttab_dropfirstcol_addpt_numeric_1_prt_partthree" for table "mpp21090_pttab_dropfirstcol_addpt_numeric"
INSERT INTO mpp21090_pttab_dropfirstcol_addpt_numeric VALUES(2.000000,2.000000,'a',2.000000,0);
ALTER TABLE mpp21090_pttab_dropfirstcol_addpt_numeric DROP COLUMN col1;
NOTICE:  Dropping a column that is part of the distribution policy forces a NULL distribution policy
NOTICE:  Dropping a column that is part of the distribution policy forces a NULL distribution policy
NOTICE:  Dropping a column that is part of the distribution policy forces a NULL distribution policy
NOTICE:  Dropping a column that is part of the distribution policy forces a NULL distribution policy
ALTER TABLE mpp21090_pttab_dropfirstcol_addpt_numeric ADD PARTITION partfour start(30.000000) end(40.000000) inclusive;
NOTICE:  CREATE TABLE will create partition "mpp21090_pttab_dropfirstcol_addpt_numeric_1_prt_partfour" for table "mpp21090_pttab_dropfirstcol_addpt_numeric"
INSERT INTO mpp21090_pttab_dropfirstcol_addpt_numeric SELECT 35.000000,'b',35.000000, 1;
SELECT * FROM mpp21090_pttab_dropfirstcol_addpt_numeric ORDER BY 1,2,3;
   col2    | col3 |   col4    | col5 
-----------+------+-----------+------
  2.000000 | a    |  2.000000 |    0
 35.000000 | b    | 35.000000 |    1
(2 rows)

UPDATE mpp21090_pttab_dropfirstcol_addpt_numeric SET col4 = 1.000000 WHERE col2 = 35.000000 AND col4 = 35.000000;
SELECT * FROM mpp21090_pttab_dropfirstcol_addpt_numeric ORDER BY 1,2,3;
   col2    | col3 |   col4   | col5 
-----------+------+----------+------
  2.000000 | a    | 2.000000 |    0
 35.000000 | b    | 1.000000 |    1
(2 rows)

-- Update partition key
UPDATE mpp21090_pttab_dropfirstcol_addpt_numeric SET col2 = 1.000000 WHERE col2 = 35.000000 AND col4 = 1.000000;
ERROR:  moving tuple from partition "mpp21090_pttab_dropfirstcol_addpt_numeric_1_prt_partfour" to partition "mpp21090_pttab_dropfirstcol_addpt_numeric_1_prt_partone" not supported  (seg2 127.0.0.1:40002 pid=9831)
SELECT * FROM mpp21090_pttab_dropfirstcol_addpt_numeric ORDER BY 1,2,3;
   col2    | col3 |   col4   | col5 
-----------+------+----------+------
  2.000000 | a    | 2.000000 |    0
 35.000000 | b    | 1.000000 |    1
(2 rows)

DELETE FROM mpp21090_pttab_dropfirstcol_addpt_numeric WHERE col2 = 1.000000;
SELECT * FROM mpp21090_pttab_dropfirstcol_addpt_numeric ORDER BY 1,2,3;
   col2    | col3 |   col4   | col5 
-----------+------+----------+------
  2.000000 | a    | 2.000000 |    0
 35.000000 | b    | 1.000000 |    1
(2 rows)

-- TEST
DROP TABLE IF EXISTS mpp21090_pttab_dropfirstcol_addpt_text;
NOTICE:  table "mpp21090_pttab_dropfirstcol_addpt_text" does not exist, skipping
CREATE TABLE mpp21090_pttab_dropfirstcol_addpt_text
(
    col1 text,
    col2 text,
    col3 char,
    col4 text,
    col5 int
) 
DISTRIBUTED by (col1)
PARTITION BY LIST(col2)(partition partone VALUES('abcdefghijklmnop') WITH (APPENDONLY=true, COMPRESSLEVEL=5, ORIENTATION=column),partition parttwo VALUES('qrstuvwxyz') WITH (APPENDONLY=true, COMPRESSLEVEL=5, ORIENTATION=row),partition partthree VALUES('ghi'));
NOTICE:  CREATE TABLE will create partition "mpp21090_pttab_dropfirstcol_addpt_text_1_prt_partone" for table "mpp21090_pttab_dropfirstcol_addpt_text"
NOTICE:  CREATE TABLE will create partition "mpp21090_pttab_dropfirstcol_addpt_text_1_prt_parttwo" for table "mpp21090_pttab_dropfirstcol_addpt_text"
NOTICE:  CREATE TABLE will create partition "mpp21090_pttab_dropfirstcol_addpt_text_1_prt_partthree" for table "mpp21090_pttab_dropfirstcol_addpt_text"
INSERT INTO mpp21090_pttab_dropfirstcol_addpt_text VALUES('abcdefghijklmnop','abcdefghijklmnop','a','abcdefghijklmnop',0);
ALTER TABLE mpp21090_pttab_dropfirstcol_addpt_text DROP COLUMN col1;
NOTICE:  Dropping a column that is part of the distribution policy forces a NULL distribution policy
NOTICE:  Dropping a column that is part of the distribution policy forces a NULL distribution policy
NOTICE:  Dropping a column that is part of the distribution policy forces a NULL distribution policy
NOTICE:  Dropping a column that is part of the distribution policy forces a NULL distribution policy
ALTER TABLE mpp21090_pttab_dropfirstcol_addpt_text ADD PARTITION partfour VALUES('xyz');
NOTICE:  CREATE TABLE will create partition "mpp21090_pttab_dropfirstcol_addpt_text_1_prt_partfour" for table "mpp21090_pttab_dropfirstcol_addpt_text"
INSERT INTO mpp21090_pttab_dropfirstcol_addpt_text SELECT 'xyz','b','xyz', 1;
SELECT * FROM mpp21090_pttab_dropfirstcol_addpt_text ORDER BY 1,2,3;
       col2       | col3 |       col4       | col5 
------------------+------+------------------+------
 abcdefghijklmnop | a    | abcdefghijklmnop |    0
 xyz              | b    | xyz              |    1
(2 rows)

UPDATE mpp21090_pttab_dropfirstcol_addpt_text SET col4 = 'qrstuvwxyz' WHERE col2 = 'xyz' AND col4 = 'xyz';
SELECT * FROM mpp21090_pttab_dropfirstcol_addpt_text ORDER BY 1,2,3;
       col2       | col3 |       col4       | col5 
------------------+------+------------------+------
 abcdefghijklmnop | a    | abcdefghijklmnop |    0
 xyz              | b    | qrstuvwxyz       |    1
(2 rows)

-- Update partition key
UPDATE mpp21090_pttab_dropfirstcol_addpt_text SET col2 = 'qrstuvwxyz' WHERE col2 = 'xyz' AND col4 = 'qrstuvwxyz';
ERROR:  moving tuple from partition "mpp21090_pttab_dropfirstcol_addpt_text_1_prt_partfour" to partition "mpp21090_pttab_dropfirstcol_addpt_text_1_prt_parttwo" not supported  (seg2 127.0.0.1:40002 pid=9831)
SELECT * FROM mpp21090_pttab_dropfirstcol_addpt_text ORDER BY 1,2,3;
       col2       | col3 |       col4       | col5 
------------------+------+------------------+------
 abcdefghijklmnop | a    | abcdefghijklmnop |    0
 xyz              | b    | qrstuvwxyz       |    1
(2 rows)

DELETE FROM mpp21090_pttab_dropfirstcol_addpt_text WHERE col2 = 'qrstuvwxyz';
SELECT * FROM mpp21090_pttab_dropfirstcol_addpt_text ORDER BY 1,2,3;
       col2       | col3 |       col4       | col5 
------------------+------+------------------+------
 abcdefghijklmnop | a    | abcdefghijklmnop |    0
 xyz              | b    | qrstuvwxyz       |    1
(2 rows)

-- TEST
DROP TABLE IF EXISTS mpp21090_pttab_droplastcol_addpt_char;
NOTICE:  table "mpp21090_pttab_droplastcol_addpt_char" does not exist, skipping
CREATE TABLE mpp21090_pttab_droplastcol_addpt_char
(
    col1 char,
    col2 char,
    col3 char,
    col4 int,
    col5 char
    
) 
DISTRIBUTED by (col1)
PARTITION BY LIST(col2)(partition partone VALUES('a','b','c','d','e','f','g','h') WITH (APPENDONLY=true, COMPRESSLEVEL=5, ORIENTATION=column),partition parttwo VALUES('i','j','k','l','m','n','o','p') WITH (APPENDONLY=true, COMPRESSLEVEL=5, ORIENTATION=row),partition partthree VALUES('q','r','s','t','u','v','w','x'));
NOTICE:  CREATE TABLE will create partition "mpp21090_pttab_droplastcol_addpt_char_1_prt_partone" for table "mpp21090_pttab_droplastcol_addpt_char"
NOTICE:  CREATE TABLE will create partition "mpp21090_pttab_droplastcol_addpt_char_1_prt_parttwo" for table "mpp21090_pttab_droplastcol_addpt_char"
NOTICE:  CREATE TABLE will create partition "mpp21090_pttab_droplastcol_addpt_char_1_prt_partthree" for table "mpp21090_pttab_droplastcol_addpt_char"
INSERT INTO mpp21090_pttab_droplastcol_addpt_char VALUES('x','x','a',0,'x');
ALTER TABLE mpp21090_pttab_droplastcol_addpt_char DROP COLUMN col5;
ALTER TABLE mpp21090_pttab_droplastcol_addpt_char ADD PARTITION partfour VALUES('y','z','-');
NOTICE:  CREATE TABLE will create partition "mpp21090_pttab_droplastcol_addpt_char_1_prt_partfour" for table "mpp21090_pttab_droplastcol_addpt_char"
INSERT INTO mpp21090_pttab_droplastcol_addpt_char SELECT 'z','z','b',1;
SELECT * FROM mpp21090_pttab_droplastcol_addpt_char ORDER BY 1,2,3;
 col1 | col2 | col3 | col4 
------+------+------+------
 x    | x    | a    |    0
 z    | z    | b    |    1
(2 rows)

-- Update distribution key
UPDATE mpp21090_pttab_droplastcol_addpt_char SET col1 = '-' WHERE col2 = 'z' AND col1 = 'z';
ERROR:  Cannot parallelize an UPDATE statement that updates the distribution columns
SELECT * FROM mpp21090_pttab_droplastcol_addpt_char ORDER BY 1,2,3;
 col1 | col2 | col3 | col4 
------+------+------+------
 x    | x    | a    |    0
 z    | z    | b    |    1
(2 rows)

-- Update partition key
UPDATE mpp21090_pttab_droplastcol_addpt_char SET col2 = '-' WHERE col2 = 'z' AND col1 = '-';
SELECT * FROM mpp21090_pttab_droplastcol_addpt_char ORDER BY 1,2,3;
 col1 | col2 | col3 | col4 
------+------+------+------
 x    | x    | a    |    0
 z    | z    | b    |    1
(2 rows)

DELETE FROM mpp21090_pttab_droplastcol_addpt_char WHERE col2 = '-';
SELECT * FROM mpp21090_pttab_droplastcol_addpt_char ORDER BY 1,2,3;
 col1 | col2 | col3 | col4 
------+------+------+------
 x    | x    | a    |    0
 z    | z    | b    |    1
(2 rows)

-- TEST
DROP TABLE IF EXISTS mpp21090_pttab_droplastcol_addpt_decimal;
NOTICE:  table "mpp21090_pttab_droplastcol_addpt_decimal" does not exist, skipping
CREATE TABLE mpp21090_pttab_droplastcol_addpt_decimal
(
    col1 decimal,
    col2 decimal,
    col3 char,
    col4 int,
    col5 decimal
    
) 
DISTRIBUTED by (col1)
PARTITION BY RANGE(col2)(partition partone start(1.00) end(10.00)  WITH (APPENDONLY=true, COMPRESSLEVEL=5, ORIENTATION=column),partition parttwo start(10.00) end(20.00) WITH (APPENDONLY=true, COMPRESSLEVEL=5, ORIENTATION=row),partition partthree start(20.00) end(30.00));
NOTICE:  CREATE TABLE will create partition "mpp21090_pttab_droplastcol_addpt_decimal_1_prt_partone" for table "mpp21090_pttab_droplastcol_addpt_decimal"
NOTICE:  CREATE TABLE will create partition "mpp21090_pttab_droplastcol_addpt_decimal_1_prt_parttwo" for table "mpp21090_pttab_droplastcol_addpt_decimal"
NOTICE:  CREATE TABLE will create partition "mpp21090_pttab_droplastcol_addpt_decimal_1_prt_partthree" for table "mpp21090_pttab_droplastcol_addpt_decimal"
INSERT INTO mpp21090_pttab_droplastcol_addpt_decimal VALUES(2.00,2.00,'a',0,2.00);
ALTER TABLE mpp21090_pttab_droplastcol_addpt_decimal DROP COLUMN col5;
ALTER TABLE mpp21090_pttab_droplastcol_addpt_decimal ADD PARTITION partfour start(30.00) end(40.00) inclusive;
NOTICE:  CREATE TABLE will create partition "mpp21090_pttab_droplastcol_addpt_decimal_1_prt_partfour" for table "mpp21090_pttab_droplastcol_addpt_decimal"
INSERT INTO mpp21090_pttab_droplastcol_addpt_decimal SELECT 35.00,35.00,'b',1;
SELECT * FROM mpp21090_pttab_droplastcol_addpt_decimal ORDER BY 1,2,3;
 col1  | col2  | col3 | col4 
-------+-------+------+------
  2.00 |  2.00 | a    |    0
 35.00 | 35.00 | b    |    1
(2 rows)

-- Update distribution key
UPDATE mpp21090_pttab_droplastcol_addpt_decimal SET col1 = 1.00 WHERE col2 = 35.00 AND col1 = 35.00;
ERROR:  Cannot parallelize an UPDATE statement that updates the distribution columns
SELECT * FROM mpp21090_pttab_droplastcol_addpt_decimal ORDER BY 1,2,3;
 col1  | col2  | col3 | col4 
-------+-------+------+------
  2.00 |  2.00 | a    |    0
 35.00 | 35.00 | b    |    1
(2 rows)

-- Update partition key
UPDATE mpp21090_pttab_droplastcol_addpt_decimal SET col2 = 1.00 WHERE col2 = 35.00 AND col1 = 1.00;
SELECT * FROM mpp21090_pttab_droplastcol_addpt_decimal ORDER BY 1,2,3;
 col1  | col2  | col3 | col4 
-------+-------+------+------
  2.00 |  2.00 | a    |    0
 35.00 | 35.00 | b    |    1
(2 rows)

DELETE FROM mpp21090_pttab_droplastcol_addpt_decimal WHERE col2 = 1.00;
SELECT * FROM mpp21090_pttab_droplastcol_addpt_decimal ORDER BY 1,2,3;
 col1  | col2  | col3 | col4 
-------+-------+------+------
  2.00 |  2.00 | a    |    0
 35.00 | 35.00 | b    |    1
(2 rows)

-- TEST
DROP TABLE IF EXISTS mpp21090_pttab_droplastcol_addpt_int4;
NOTICE:  table "mpp21090_pttab_droplastcol_addpt_int4" does not exist, skipping
CREATE TABLE mpp21090_pttab_droplastcol_addpt_int4
(
    col1 int4,
    col2 int4,
    col3 char,
    col4 int,
    col5 int4
    
) 
DISTRIBUTED by (col1)
PARTITION BY RANGE(col2)(partition partone start(1) end(100000001)  WITH (APPENDONLY=true, COMPRESSLEVEL=5, ORIENTATION=column),partition parttwo start(100000001) end(200000001) WITH (APPENDONLY=true, COMPRESSLEVEL=5, ORIENTATION=row),partition partthree start(200000001) end(300000001));
NOTICE:  CREATE TABLE will create partition "mpp21090_pttab_droplastcol_addpt_int4_1_prt_partone" for table "mpp21090_pttab_droplastcol_addpt_int4"
NOTICE:  CREATE TABLE will create partition "mpp21090_pttab_droplastcol_addpt_int4_1_prt_parttwo" for table "mpp21090_pttab_droplastcol_addpt_int4"
NOTICE:  CREATE TABLE will create partition "mpp21090_pttab_droplastcol_addpt_int4_1_prt_partthree" for table "mpp21090_pttab_droplastcol_addpt_int4"
INSERT INTO mpp21090_pttab_droplastcol_addpt_int4 VALUES(20000000,20000000,'a',0,20000000);
ALTER TABLE mpp21090_pttab_droplastcol_addpt_int4 DROP COLUMN col5;
ALTER TABLE mpp21090_pttab_droplastcol_addpt_int4 ADD PARTITION partfour start(300000001) end(400000001);
NOTICE:  CREATE TABLE will create partition "mpp21090_pttab_droplastcol_addpt_int4_1_prt_partfour" for table "mpp21090_pttab_droplastcol_addpt_int4"
INSERT INTO mpp21090_pttab_droplastcol_addpt_int4 SELECT 35000000,35000000,'b',1;
SELECT * FROM mpp21090_pttab_droplastcol_addpt_int4 ORDER BY 1,2,3;
   col1   |   col2   | col3 | col4 
----------+----------+------+------
 20000000 | 20000000 | a    |    0
 35000000 | 35000000 | b    |    1
(2 rows)

-- Update distribution key
UPDATE mpp21090_pttab_droplastcol_addpt_int4 SET col1 = 10000000 WHERE col2 = 35000000 AND col1 = 35000000;
ERROR:  Cannot parallelize an UPDATE statement that updates the distribution columns
SELECT * FROM mpp21090_pttab_droplastcol_addpt_int4 ORDER BY 1,2,3;
   col1   |   col2   | col3 | col4 
----------+----------+------+------
 20000000 | 20000000 | a    |    0
 35000000 | 35000000 | b    |    1
(2 rows)

-- Update partition key
UPDATE mpp21090_pttab_droplastcol_addpt_int4 SET col2 = 10000000 WHERE col2 = 35000000 AND col1 = 10000000;
SELECT * FROM mpp21090_pttab_droplastcol_addpt_int4 ORDER BY 1,2,3;
   col1   |   col2   | col3 | col4 
----------+----------+------+------
 20000000 | 20000000 | a    |    0
 35000000 | 35000000 | b    |    1
(2 rows)

DELETE FROM mpp21090_pttab_droplastcol_addpt_int4 WHERE col2 = 10000000;
SELECT * FROM mpp21090_pttab_droplastcol_addpt_int4 ORDER BY 1,2,3;
   col1   |   col2   | col3 | col4 
----------+----------+------+------
 20000000 | 20000000 | a    |    0
 35000000 | 35000000 | b    |    1
(2 rows)

-- TEST
DROP TABLE IF EXISTS mpp21090_pttab_droplastcol_addpt_int8;
NOTICE:  table "mpp21090_pttab_droplastcol_addpt_int8" does not exist, skipping
CREATE TABLE mpp21090_pttab_droplastcol_addpt_int8
(
    col1 int8,
    col2 int8,
    col3 char,
    col4 int,
    col5 int8
    
) 
DISTRIBUTED by (col1)
PARTITION BY RANGE(col2)(partition partone start(1) end(1000000000000000001)  WITH (APPENDONLY=true, COMPRESSLEVEL=5, ORIENTATION=column),partition parttwo start(1000000000000000001) end(2000000000000000001) WITH (APPENDONLY=true, COMPRESSLEVEL=5, ORIENTATION=row),partition partthree start(2000000000000000001) end(3000000000000000001));
NOTICE:  CREATE TABLE will create partition "mpp21090_pttab_droplastcol_addpt_int8_1_prt_partone" for table "mpp21090_pttab_droplastcol_addpt_int8"
NOTICE:  CREATE TABLE will create partition "mpp21090_pttab_droplastcol_addpt_int8_1_prt_parttwo" for table "mpp21090_pttab_droplastcol_addpt_int8"
NOTICE:  CREATE TABLE will create partition "mpp21090_pttab_droplastcol_addpt_int8_1_prt_partthree" for table "mpp21090_pttab_droplastcol_addpt_int8"
INSERT INTO mpp21090_pttab_droplastcol_addpt_int8 VALUES(2000000000000000000,2000000000000000000,'a',0,2000000000000000000);
ALTER TABLE mpp21090_pttab_droplastcol_addpt_int8 DROP COLUMN col5;
ALTER TABLE mpp21090_pttab_droplastcol_addpt_int8 ADD PARTITION partfour start(3000000000000000001) end(4000000000000000001);
NOTICE:  CREATE TABLE will create partition "mpp21090_pttab_droplastcol_addpt_int8_1_prt_partfour" for table "mpp21090_pttab_droplastcol_addpt_int8"
INSERT INTO mpp21090_pttab_droplastcol_addpt_int8 SELECT 3500000000000000000,3500000000000000000,'b',1;
SELECT * FROM mpp21090_pttab_droplastcol_addpt_int8 ORDER BY 1,2,3;
        col1         |        col2         | col3 | col4 
---------------------+---------------------+------+------
 2000000000000000000 | 2000000000000000000 | a    |    0
 3500000000000000000 | 3500000000000000000 | b    |    1
(2 rows)

-- Update distribution key
UPDATE mpp21090_pttab_droplastcol_addpt_int8 SET col1 = 1000000000000000000 WHERE col2 = 3500000000000000000 AND col1 = 3500000000000000000;
ERROR:  Cannot parallelize an UPDATE statement that updates the distribution columns
SELECT * FROM mpp21090_pttab_droplastcol_addpt_int8 ORDER BY 1,2,3;
        col1         |        col2         | col3 | col4 
---------------------+---------------------+------+------
 2000000000000000000 | 2000000000000000000 | a    |    0
 3500000000000000000 | 3500000000000000000 | b    |    1
(2 rows)

-- Update partition key
UPDATE mpp21090_pttab_droplastcol_addpt_int8 SET col2 = 1000000000000000000 WHERE col2 = 3500000000000000000 AND col1 = 1000000000000000000;
SELECT * FROM mpp21090_pttab_droplastcol_addpt_int8 ORDER BY 1,2,3;
        col1         |        col2         | col3 | col4 
---------------------+---------------------+------+------
 2000000000000000000 | 2000000000000000000 | a    |    0
 3500000000000000000 | 3500000000000000000 | b    |    1
(2 rows)

DELETE FROM mpp21090_pttab_droplastcol_addpt_int8 WHERE col2 = 1000000000000000000;
SELECT * FROM mpp21090_pttab_droplastcol_addpt_int8 ORDER BY 1,2,3;
        col1         |        col2         | col3 | col4 
---------------------+---------------------+------+------
 2000000000000000000 | 2000000000000000000 | a    |    0
 3500000000000000000 | 3500000000000000000 | b    |    1
(2 rows)

-- TEST
DROP TABLE IF EXISTS mpp21090_pttab_droplastcol_addpt_interval;
NOTICE:  table "mpp21090_pttab_droplastcol_addpt_interval" does not exist, skipping
CREATE TABLE mpp21090_pttab_droplastcol_addpt_interval
(
    col1 interval,
    col2 interval,
    col3 char,
    col4 int,
    col5 interval
    
) 
DISTRIBUTED by (col1)
PARTITION BY RANGE(col2)(partition partone start('1 sec') end('1 min')  WITH (APPENDONLY=true, COMPRESSLEVEL=5, ORIENTATION=column),partition parttwo start('1 min') end('1 hour') WITH (APPENDONLY=true, COMPRESSLEVEL=5, ORIENTATION=row),partition partthree start('1 hour') end('12 hours'));
NOTICE:  CREATE TABLE will create partition "mpp21090_pttab_droplastcol_addpt_interval_1_prt_partone" for table "mpp21090_pttab_droplastcol_addpt_interval"
NOTICE:  CREATE TABLE will create partition "mpp21090_pttab_droplastcol_addpt_interval_1_prt_parttwo" for table "mpp21090_pttab_droplastcol_addpt_interval"
NOTICE:  CREATE TABLE will create partition "mpp21090_pttab_droplastcol_addpt_interval_1_prt_partthree" for table "mpp21090_pttab_droplastcol_addpt_interval"
INSERT INTO mpp21090_pttab_droplastcol_addpt_interval VALUES('1 hour','1 hour','a',0,'1 hour');
ALTER TABLE mpp21090_pttab_droplastcol_addpt_interval DROP COLUMN col5;
ALTER TABLE mpp21090_pttab_droplastcol_addpt_interval ADD PARTITION partfour start('12 hours') end('1 day') inclusive;
NOTICE:  CREATE TABLE will create partition "mpp21090_pttab_droplastcol_addpt_interval_1_prt_partfour" for table "mpp21090_pttab_droplastcol_addpt_interval"
INSERT INTO mpp21090_pttab_droplastcol_addpt_interval SELECT '14 hours','14 hours','b',1;
SELECT * FROM mpp21090_pttab_droplastcol_addpt_interval ORDER BY 1,2,3;
   col1   |   col2   | col3 | col4 
----------+----------+------+------
 01:00:00 | 01:00:00 | a    |    0
 14:00:00 | 14:00:00 | b    |    1
(2 rows)

-- Update distribution key
UPDATE mpp21090_pttab_droplastcol_addpt_interval SET col1 = '12 hours' WHERE col2 = '14 hours' AND col1 = '14 hours';
ERROR:  Cannot parallelize an UPDATE statement that updates the distribution columns
SELECT * FROM mpp21090_pttab_droplastcol_addpt_interval ORDER BY 1,2,3;
   col1   |   col2   | col3 | col4 
----------+----------+------+------
 01:00:00 | 01:00:00 | a    |    0
 14:00:00 | 14:00:00 | b    |    1
(2 rows)

-- Update partition key
UPDATE mpp21090_pttab_droplastcol_addpt_interval SET col2 = '12 hours' WHERE col2 = '14 hours' AND col1 = '12 hours';
SELECT * FROM mpp21090_pttab_droplastcol_addpt_interval ORDER BY 1,2,3;
   col1   |   col2   | col3 | col4 
----------+----------+------+------
 01:00:00 | 01:00:00 | a    |    0
 14:00:00 | 14:00:00 | b    |    1
(2 rows)

DELETE FROM mpp21090_pttab_droplastcol_addpt_interval WHERE col2 = '12 hours';
SELECT * FROM mpp21090_pttab_droplastcol_addpt_interval ORDER BY 1,2,3;
   col1   |   col2   | col3 | col4 
----------+----------+------+------
 01:00:00 | 01:00:00 | a    |    0
 14:00:00 | 14:00:00 | b    |    1
(2 rows)

-- TEST
DROP TABLE IF EXISTS mpp21090_pttab_droplastcol_addpt_numeric;
NOTICE:  table "mpp21090_pttab_droplastcol_addpt_numeric" does not exist, skipping
CREATE TABLE mpp21090_pttab_droplastcol_addpt_numeric
(
    col1 numeric,
    col2 numeric,
    col3 char,
    col4 int,
    col5 numeric
    
) 
DISTRIBUTED by (col1)
PARTITION BY RANGE(col2)(partition partone start(1.000000) end(10.000000)  WITH (APPENDONLY=true, COMPRESSLEVEL=5, ORIENTATION=column),partition parttwo start(10.000000) end(20.000000) WITH (APPENDONLY=true, COMPRESSLEVEL=5, ORIENTATION=row),partition partthree start(20.000000) end(30.000000));
NOTICE:  CREATE TABLE will create partition "mpp21090_pttab_droplastcol_addpt_numeric_1_prt_partone" for table "mpp21090_pttab_droplastcol_addpt_numeric"
NOTICE:  CREATE TABLE will create partition "mpp21090_pttab_droplastcol_addpt_numeric_1_prt_parttwo" for table "mpp21090_pttab_droplastcol_addpt_numeric"
NOTICE:  CREATE TABLE will create partition "mpp21090_pttab_droplastcol_addpt_numeric_1_prt_partthree" for table "mpp21090_pttab_droplastcol_addpt_numeric"
INSERT INTO mpp21090_pttab_droplastcol_addpt_numeric VALUES(2.000000,2.000000,'a',0,2.000000);
ALTER TABLE mpp21090_pttab_droplastcol_addpt_numeric DROP COLUMN col5;
ALTER TABLE mpp21090_pttab_droplastcol_addpt_numeric ADD PARTITION partfour start(30.000000) end(40.000000) inclusive;
NOTICE:  CREATE TABLE will create partition "mpp21090_pttab_droplastcol_addpt_numeric_1_prt_partfour" for table "mpp21090_pttab_droplastcol_addpt_numeric"
INSERT INTO mpp21090_pttab_droplastcol_addpt_numeric SELECT 35.000000,35.000000,'b',1;
SELECT * FROM mpp21090_pttab_droplastcol_addpt_numeric ORDER BY 1,2,3;
   col1    |   col2    | col3 | col4 
-----------+-----------+------+------
  2.000000 |  2.000000 | a    |    0
 35.000000 | 35.000000 | b    |    1
(2 rows)

-- Update distribution key
UPDATE mpp21090_pttab_droplastcol_addpt_numeric SET col1 = 1.000000 WHERE col2 = 35.000000 AND col1 = 35.000000;
ERROR:  Cannot parallelize an UPDATE statement that updates the distribution columns
SELECT * FROM mpp21090_pttab_droplastcol_addpt_numeric ORDER BY 1,2,3;
   col1    |   col2    | col3 | col4 
-----------+-----------+------+------
  2.000000 |  2.000000 | a    |    0
 35.000000 | 35.000000 | b    |    1
(2 rows)

-- Update partition key
UPDATE mpp21090_pttab_droplastcol_addpt_numeric SET col2 = 1.000000 WHERE col2 = 35.000000 AND col1 = 1.000000;
SELECT * FROM mpp21090_pttab_droplastcol_addpt_numeric ORDER BY 1,2,3;
   col1    |   col2    | col3 | col4 
-----------+-----------+------+------
  2.000000 |  2.000000 | a    |    0
 35.000000 | 35.000000 | b    |    1
(2 rows)

DELETE FROM mpp21090_pttab_droplastcol_addpt_numeric WHERE col2 = 1.000000;
SELECT * FROM mpp21090_pttab_droplastcol_addpt_numeric ORDER BY 1,2,3;
   col1    |   col2    | col3 | col4 
-----------+-----------+------+------
  2.000000 |  2.000000 | a    |    0
 35.000000 | 35.000000 | b    |    1
(2 rows)

-- TEST
DROP TABLE IF EXISTS mpp21090_pttab_droplastcol_addpt_text;
NOTICE:  table "mpp21090_pttab_droplastcol_addpt_text" does not exist, skipping
CREATE TABLE mpp21090_pttab_droplastcol_addpt_text
(
    col1 text,
    col2 text,
    col3 char,
    col4 int,
    col5 text
    
) 
DISTRIBUTED by (col1)
PARTITION BY LIST(col2)(partition partone VALUES('abcdefghijklmnop') WITH (APPENDONLY=true, COMPRESSLEVEL=5, ORIENTATION=column),partition parttwo VALUES('qrstuvwxyz') WITH (APPENDONLY=true, COMPRESSLEVEL=5, ORIENTATION=row),partition partthree VALUES('ghi'));
NOTICE:  CREATE TABLE will create partition "mpp21090_pttab_droplastcol_addpt_text_1_prt_partone" for table "mpp21090_pttab_droplastcol_addpt_text"
NOTICE:  CREATE TABLE will create partition "mpp21090_pttab_droplastcol_addpt_text_1_prt_parttwo" for table "mpp21090_pttab_droplastcol_addpt_text"
NOTICE:  CREATE TABLE will create partition "mpp21090_pttab_droplastcol_addpt_text_1_prt_partthree" for table "mpp21090_pttab_droplastcol_addpt_text"
INSERT INTO mpp21090_pttab_droplastcol_addpt_text VALUES('abcdefghijklmnop','abcdefghijklmnop','a',0,'abcdefghijklmnop');
ALTER TABLE mpp21090_pttab_droplastcol_addpt_text DROP COLUMN col5;
ALTER TABLE mpp21090_pttab_droplastcol_addpt_text ADD PARTITION partfour VALUES('xyz');
NOTICE:  CREATE TABLE will create partition "mpp21090_pttab_droplastcol_addpt_text_1_prt_partfour" for table "mpp21090_pttab_droplastcol_addpt_text"
INSERT INTO mpp21090_pttab_droplastcol_addpt_text SELECT 'xyz','xyz','b',1;
SELECT * FROM mpp21090_pttab_droplastcol_addpt_text ORDER BY 1,2,3;
       col1       |       col2       | col3 | col4 
------------------+------------------+------+------
 abcdefghijklmnop | abcdefghijklmnop | a    |    0
 xyz              | xyz              | b    |    1
(2 rows)

-- Update distribution key
UPDATE mpp21090_pttab_droplastcol_addpt_text SET col1 = 'qrstuvwxyz' WHERE col2 = 'xyz' AND col1 = 'xyz';
ERROR:  Cannot parallelize an UPDATE statement that updates the distribution columns
SELECT * FROM mpp21090_pttab_droplastcol_addpt_text ORDER BY 1,2,3;
       col1       |       col2       | col3 | col4 
------------------+------------------+------+------
 abcdefghijklmnop | abcdefghijklmnop | a    |    0
 xyz              | xyz              | b    |    1
(2 rows)

-- Update partition key
UPDATE mpp21090_pttab_droplastcol_addpt_text SET col2 = 'qrstuvwxyz' WHERE col2 = 'xyz' AND col1 = 'qrstuvwxyz';
SELECT * FROM mpp21090_pttab_droplastcol_addpt_text ORDER BY 1,2,3;
       col1       |       col2       | col3 | col4 
------------------+------------------+------+------
 abcdefghijklmnop | abcdefghijklmnop | a    |    0
 xyz              | xyz              | b    |    1
(2 rows)

DELETE FROM mpp21090_pttab_droplastcol_addpt_text WHERE col2 = 'qrstuvwxyz';
SELECT * FROM mpp21090_pttab_droplastcol_addpt_text ORDER BY 1,2,3;
       col1       |       col2       | col3 | col4 
------------------+------------------+------+------
 abcdefghijklmnop | abcdefghijklmnop | a    |    0
 xyz              | xyz              | b    |    1
(2 rows)

-- TEST
DROP TABLE IF EXISTS mpp21090_pttab_dropmidcol_addpt_char;
NOTICE:  table "mpp21090_pttab_dropmidcol_addpt_char" does not exist, skipping
CREATE TABLE mpp21090_pttab_dropmidcol_addpt_char
(
    col1 char,
    col2 char,
    col3 char,
    col4 char,
    col5 int
) 
DISTRIBUTED by (col1) 
PARTITION BY LIST(col2)(partition partone VALUES('a','b','c','d','e','f','g','h') WITH (APPENDONLY=true, COMPRESSLEVEL=5, ORIENTATION=column),partition parttwo VALUES('i','j','k','l','m','n','o','p') WITH (APPENDONLY=true, COMPRESSLEVEL=5, ORIENTATION=row),partition partthree VALUES('q','r','s','t','u','v','w','x'));
NOTICE:  CREATE TABLE will create partition "mpp21090_pttab_dropmidcol_addpt_char_1_prt_partone" for table "mpp21090_pttab_dropmidcol_addpt_char"
NOTICE:  CREATE TABLE will create partition "mpp21090_pttab_dropmidcol_addpt_char_1_prt_parttwo" for table "mpp21090_pttab_dropmidcol_addpt_char"
NOTICE:  CREATE TABLE will create partition "mpp21090_pttab_dropmidcol_addpt_char_1_prt_partthree" for table "mpp21090_pttab_dropmidcol_addpt_char"
INSERT INTO mpp21090_pttab_dropmidcol_addpt_char VALUES('x','x','a','x',0);
ALTER TABLE mpp21090_pttab_dropmidcol_addpt_char DROP COLUMN col4;
ALTER TABLE mpp21090_pttab_dropmidcol_addpt_char ADD PARTITION partfour VALUES('y','z','-');
NOTICE:  CREATE TABLE will create partition "mpp21090_pttab_dropmidcol_addpt_char_1_prt_partfour" for table "mpp21090_pttab_dropmidcol_addpt_char"
INSERT INTO mpp21090_pttab_dropmidcol_addpt_char SELECT 'z', 'z','b', 1;
SELECT * FROM mpp21090_pttab_dropmidcol_addpt_char ORDER BY 1,2,3;
 col1 | col2 | col3 | col5 
------+------+------+------
 x    | x    | a    |    0
 z    | z    | b    |    1
(2 rows)

-- Update distribution key
UPDATE mpp21090_pttab_dropmidcol_addpt_char SET col1 = '-' WHERE col2 = 'z' AND col1 = 'z';
ERROR:  Cannot parallelize an UPDATE statement that updates the distribution columns
SELECT * FROM mpp21090_pttab_dropmidcol_addpt_char ORDER BY 1,2,3;
 col1 | col2 | col3 | col5 
------+------+------+------
 x    | x    | a    |    0
 z    | z    | b    |    1
(2 rows)

-- Update partition key
UPDATE mpp21090_pttab_dropmidcol_addpt_char SET col2 = '-' WHERE col2 = 'z' AND col1 = '-';
SELECT * FROM mpp21090_pttab_dropmidcol_addpt_char ORDER BY 1,2,3;
 col1 | col2 | col3 | col5 
------+------+------+------
 x    | x    | a    |    0
 z    | z    | b    |    1
(2 rows)

DELETE FROM mpp21090_pttab_dropmidcol_addpt_char WHERE col2 = '-';
SELECT * FROM mpp21090_pttab_dropmidcol_addpt_char ORDER BY 1,2,3;
 col1 | col2 | col3 | col5 
------+------+------+------
 x    | x    | a    |    0
 z    | z    | b    |    1
(2 rows)

-- TEST
DROP TABLE IF EXISTS mpp21090_pttab_dropmidcol_addpt_decimal;
NOTICE:  table "mpp21090_pttab_dropmidcol_addpt_decimal" does not exist, skipping
CREATE TABLE mpp21090_pttab_dropmidcol_addpt_decimal
(
    col1 decimal,
    col2 decimal,
    col3 char,
    col4 decimal,
    col5 int
) 
DISTRIBUTED by (col1) 
PARTITION BY RANGE(col2)(partition partone start(1.00) end(10.00)  WITH (APPENDONLY=true, COMPRESSLEVEL=5, ORIENTATION=column),partition parttwo start(10.00) end(20.00) WITH (APPENDONLY=true, COMPRESSLEVEL=5, ORIENTATION=row),partition partthree start(20.00) end(30.00));
NOTICE:  CREATE TABLE will create partition "mpp21090_pttab_dropmidcol_addpt_decimal_1_prt_partone" for table "mpp21090_pttab_dropmidcol_addpt_decimal"
NOTICE:  CREATE TABLE will create partition "mpp21090_pttab_dropmidcol_addpt_decimal_1_prt_parttwo" for table "mpp21090_pttab_dropmidcol_addpt_decimal"
NOTICE:  CREATE TABLE will create partition "mpp21090_pttab_dropmidcol_addpt_decimal_1_prt_partthree" for table "mpp21090_pttab_dropmidcol_addpt_decimal"
INSERT INTO mpp21090_pttab_dropmidcol_addpt_decimal VALUES(2.00,2.00,'a',2.00,0);
ALTER TABLE mpp21090_pttab_dropmidcol_addpt_decimal DROP COLUMN col4;
ALTER TABLE mpp21090_pttab_dropmidcol_addpt_decimal ADD PARTITION partfour start(30.00) end(40.00) inclusive;
NOTICE:  CREATE TABLE will create partition "mpp21090_pttab_dropmidcol_addpt_decimal_1_prt_partfour" for table "mpp21090_pttab_dropmidcol_addpt_decimal"
INSERT INTO mpp21090_pttab_dropmidcol_addpt_decimal SELECT 35.00, 35.00,'b', 1;
SELECT * FROM mpp21090_pttab_dropmidcol_addpt_decimal ORDER BY 1,2,3;
 col1  | col2  | col3 | col5 
-------+-------+------+------
  2.00 |  2.00 | a    |    0
 35.00 | 35.00 | b    |    1
(2 rows)

-- Update distribution key
UPDATE mpp21090_pttab_dropmidcol_addpt_decimal SET col1 = 1.00 WHERE col2 = 35.00 AND col1 = 35.00;
ERROR:  Cannot parallelize an UPDATE statement that updates the distribution columns
SELECT * FROM mpp21090_pttab_dropmidcol_addpt_decimal ORDER BY 1,2,3;
 col1  | col2  | col3 | col5 
-------+-------+------+------
  2.00 |  2.00 | a    |    0
 35.00 | 35.00 | b    |    1
(2 rows)

-- Update partition key
UPDATE mpp21090_pttab_dropmidcol_addpt_decimal SET col2 = 1.00 WHERE col2 = 35.00 AND col1 = 1.00;
SELECT * FROM mpp21090_pttab_dropmidcol_addpt_decimal ORDER BY 1,2,3;
 col1  | col2  | col3 | col5 
-------+-------+------+------
  2.00 |  2.00 | a    |    0
 35.00 | 35.00 | b    |    1
(2 rows)

DELETE FROM mpp21090_pttab_dropmidcol_addpt_decimal WHERE col2 = 1.00;
SELECT * FROM mpp21090_pttab_dropmidcol_addpt_decimal ORDER BY 1,2,3;
 col1  | col2  | col3 | col5 
-------+-------+------+------
  2.00 |  2.00 | a    |    0
 35.00 | 35.00 | b    |    1
(2 rows)

-- TEST
DROP TABLE IF EXISTS mpp21090_pttab_dropmidcol_addpt_int4;
NOTICE:  table "mpp21090_pttab_dropmidcol_addpt_int4" does not exist, skipping
CREATE TABLE mpp21090_pttab_dropmidcol_addpt_int4
(
    col1 int4,
    col2 int4,
    col3 char,
    col4 int4,
    col5 int
) 
DISTRIBUTED by (col1) 
PARTITION BY RANGE(col2)(partition partone start(1) end(100000001)  WITH (APPENDONLY=true, COMPRESSLEVEL=5, ORIENTATION=column),partition parttwo start(100000001) end(200000001) WITH (APPENDONLY=true, COMPRESSLEVEL=5, ORIENTATION=row),partition partthree start(200000001) end(300000001));
NOTICE:  CREATE TABLE will create partition "mpp21090_pttab_dropmidcol_addpt_int4_1_prt_partone" for table "mpp21090_pttab_dropmidcol_addpt_int4"
NOTICE:  CREATE TABLE will create partition "mpp21090_pttab_dropmidcol_addpt_int4_1_prt_parttwo" for table "mpp21090_pttab_dropmidcol_addpt_int4"
NOTICE:  CREATE TABLE will create partition "mpp21090_pttab_dropmidcol_addpt_int4_1_prt_partthree" for table "mpp21090_pttab_dropmidcol_addpt_int4"
INSERT INTO mpp21090_pttab_dropmidcol_addpt_int4 VALUES(20000000,20000000,'a',20000000,0);
ALTER TABLE mpp21090_pttab_dropmidcol_addpt_int4 DROP COLUMN col4;
ALTER TABLE mpp21090_pttab_dropmidcol_addpt_int4 ADD PARTITION partfour start(300000001) end(400000001);
NOTICE:  CREATE TABLE will create partition "mpp21090_pttab_dropmidcol_addpt_int4_1_prt_partfour" for table "mpp21090_pttab_dropmidcol_addpt_int4"
INSERT INTO mpp21090_pttab_dropmidcol_addpt_int4 SELECT 35000000, 35000000,'b', 1;
SELECT * FROM mpp21090_pttab_dropmidcol_addpt_int4 ORDER BY 1,2,3;
   col1   |   col2   | col3 | col5 
----------+----------+------+------
 20000000 | 20000000 | a    |    0
 35000000 | 35000000 | b    |    1
(2 rows)

-- Update distribution key
UPDATE mpp21090_pttab_dropmidcol_addpt_int4 SET col1 = 10000000 WHERE col2 = 35000000 AND col1 = 35000000;
ERROR:  Cannot parallelize an UPDATE statement that updates the distribution columns
SELECT * FROM mpp21090_pttab_dropmidcol_addpt_int4 ORDER BY 1,2,3;
   col1   |   col2   | col3 | col5 
----------+----------+------+------
 20000000 | 20000000 | a    |    0
 35000000 | 35000000 | b    |    1
(2 rows)

-- Update partition key
UPDATE mpp21090_pttab_dropmidcol_addpt_int4 SET col2 = 10000000 WHERE col2 = 35000000 AND col1 = 10000000;
SELECT * FROM mpp21090_pttab_dropmidcol_addpt_int4 ORDER BY 1,2,3;
   col1   |   col2   | col3 | col5 
----------+----------+------+------
 20000000 | 20000000 | a    |    0
 35000000 | 35000000 | b    |    1
(2 rows)

DELETE FROM mpp21090_pttab_dropmidcol_addpt_int4 WHERE col2 = 10000000;
SELECT * FROM mpp21090_pttab_dropmidcol_addpt_int4 ORDER BY 1,2,3;
   col1   |   col2   | col3 | col5 
----------+----------+------+------
 20000000 | 20000000 | a    |    0
 35000000 | 35000000 | b    |    1
(2 rows)

-- TEST
DROP TABLE IF EXISTS mpp21090_pttab_dropmidcol_addpt_int8;
NOTICE:  table "mpp21090_pttab_dropmidcol_addpt_int8" does not exist, skipping
CREATE TABLE mpp21090_pttab_dropmidcol_addpt_int8
(
    col1 int8,
    col2 int8,
    col3 char,
    col4 int8,
    col5 int
) 
DISTRIBUTED by (col1) 
PARTITION BY RANGE(col2)(partition partone start(1) end(1000000000000000001)  WITH (APPENDONLY=true, COMPRESSLEVEL=5, ORIENTATION=column),partition parttwo start(1000000000000000001) end(2000000000000000001) WITH (APPENDONLY=true, COMPRESSLEVEL=5, ORIENTATION=row),partition partthree start(2000000000000000001) end(3000000000000000001));
NOTICE:  CREATE TABLE will create partition "mpp21090_pttab_dropmidcol_addpt_int8_1_prt_partone" for table "mpp21090_pttab_dropmidcol_addpt_int8"
NOTICE:  CREATE TABLE will create partition "mpp21090_pttab_dropmidcol_addpt_int8_1_prt_parttwo" for table "mpp21090_pttab_dropmidcol_addpt_int8"
NOTICE:  CREATE TABLE will create partition "mpp21090_pttab_dropmidcol_addpt_int8_1_prt_partthree" for table "mpp21090_pttab_dropmidcol_addpt_int8"
INSERT INTO mpp21090_pttab_dropmidcol_addpt_int8 VALUES(2000000000000000000,2000000000000000000,'a',2000000000000000000,0);
ALTER TABLE mpp21090_pttab_dropmidcol_addpt_int8 DROP COLUMN col4;
ALTER TABLE mpp21090_pttab_dropmidcol_addpt_int8 ADD PARTITION partfour start(3000000000000000001) end(4000000000000000001);
NOTICE:  CREATE TABLE will create partition "mpp21090_pttab_dropmidcol_addpt_int8_1_prt_partfour" for table "mpp21090_pttab_dropmidcol_addpt_int8"
INSERT INTO mpp21090_pttab_dropmidcol_addpt_int8 SELECT 3500000000000000000, 3500000000000000000,'b', 1;
SELECT * FROM mpp21090_pttab_dropmidcol_addpt_int8 ORDER BY 1,2,3;
        col1         |        col2         | col3 | col5 
---------------------+---------------------+------+------
 2000000000000000000 | 2000000000000000000 | a    |    0
 3500000000000000000 | 3500000000000000000 | b    |    1
(2 rows)

-- Update distribution key
UPDATE mpp21090_pttab_dropmidcol_addpt_int8 SET col1 = 1000000000000000000 WHERE col2 = 3500000000000000000 AND col1 = 3500000000000000000;
ERROR:  Cannot parallelize an UPDATE statement that updates the distribution columns
SELECT * FROM mpp21090_pttab_dropmidcol_addpt_int8 ORDER BY 1,2,3;
        col1         |        col2         | col3 | col5 
---------------------+---------------------+------+------
 2000000000000000000 | 2000000000000000000 | a    |    0
 3500000000000000000 | 3500000000000000000 | b    |    1
(2 rows)

-- Update partition key
UPDATE mpp21090_pttab_dropmidcol_addpt_int8 SET col2 = 1000000000000000000 WHERE col2 = 3500000000000000000 AND col1 = 1000000000000000000;
SELECT * FROM mpp21090_pttab_dropmidcol_addpt_int8 ORDER BY 1,2,3;
        col1         |        col2         | col3 | col5 
---------------------+---------------------+------+------
 2000000000000000000 | 2000000000000000000 | a    |    0
 3500000000000000000 | 3500000000000000000 | b    |    1
(2 rows)

DELETE FROM mpp21090_pttab_dropmidcol_addpt_int8 WHERE col2 = 1000000000000000000;
SELECT * FROM mpp21090_pttab_dropmidcol_addpt_int8 ORDER BY 1,2,3;
        col1         |        col2         | col3 | col5 
---------------------+---------------------+------+------
 2000000000000000000 | 2000000000000000000 | a    |    0
 3500000000000000000 | 3500000000000000000 | b    |    1
(2 rows)

-- TEST
DROP TABLE IF EXISTS mpp21090_pttab_dropmidcol_addpt_interval;
NOTICE:  table "mpp21090_pttab_dropmidcol_addpt_interval" does not exist, skipping
CREATE TABLE mpp21090_pttab_dropmidcol_addpt_interval
(
    col1 interval,
    col2 interval,
    col3 char,
    col4 interval,
    col5 int
) 
DISTRIBUTED by (col1) 
PARTITION BY RANGE(col2)(partition partone start('1 sec') end('1 min')  WITH (APPENDONLY=true, COMPRESSLEVEL=5, ORIENTATION=column),partition parttwo start('1 min') end('1 hour') WITH (APPENDONLY=true, COMPRESSLEVEL=5, ORIENTATION=row),partition partthree start('1 hour') end('12 hours'));
NOTICE:  CREATE TABLE will create partition "mpp21090_pttab_dropmidcol_addpt_interval_1_prt_partone" for table "mpp21090_pttab_dropmidcol_addpt_interval"
NOTICE:  CREATE TABLE will create partition "mpp21090_pttab_dropmidcol_addpt_interval_1_prt_parttwo" for table "mpp21090_pttab_dropmidcol_addpt_interval"
NOTICE:  CREATE TABLE will create partition "mpp21090_pttab_dropmidcol_addpt_interval_1_prt_partthree" for table "mpp21090_pttab_dropmidcol_addpt_interval"
INSERT INTO mpp21090_pttab_dropmidcol_addpt_interval VALUES('1 hour','1 hour','a','1 hour',0);
ALTER TABLE mpp21090_pttab_dropmidcol_addpt_interval DROP COLUMN col4;
ALTER TABLE mpp21090_pttab_dropmidcol_addpt_interval ADD PARTITION partfour start('12 hours') end('1 day') inclusive;
NOTICE:  CREATE TABLE will create partition "mpp21090_pttab_dropmidcol_addpt_interval_1_prt_partfour" for table "mpp21090_pttab_dropmidcol_addpt_interval"
INSERT INTO mpp21090_pttab_dropmidcol_addpt_interval SELECT '14 hours', '14 hours','b', 1;
SELECT * FROM mpp21090_pttab_dropmidcol_addpt_interval ORDER BY 1,2,3;
   col1   |   col2   | col3 | col5 
----------+----------+------+------
 01:00:00 | 01:00:00 | a    |    0
 14:00:00 | 14:00:00 | b    |    1
(2 rows)

-- Update distribution key
UPDATE mpp21090_pttab_dropmidcol_addpt_interval SET col1 = '12 hours' WHERE col2 = '14 hours' AND col1 = '14 hours';
ERROR:  Cannot parallelize an UPDATE statement that updates the distribution columns
SELECT * FROM mpp21090_pttab_dropmidcol_addpt_interval ORDER BY 1,2,3;
   col1   |   col2   | col3 | col5 
----------+----------+------+------
 01:00:00 | 01:00:00 | a    |    0
 14:00:00 | 14:00:00 | b    |    1
(2 rows)

-- Update partition key
UPDATE mpp21090_pttab_dropmidcol_addpt_interval SET col2 = '12 hours' WHERE col2 = '14 hours' AND col1 = '12 hours';
SELECT * FROM mpp21090_pttab_dropmidcol_addpt_interval ORDER BY 1,2,3;
   col1   |   col2   | col3 | col5 
----------+----------+------+------
 01:00:00 | 01:00:00 | a    |    0
 14:00:00 | 14:00:00 | b    |    1
(2 rows)

DELETE FROM mpp21090_pttab_dropmidcol_addpt_interval WHERE col2 = '12 hours';
SELECT * FROM mpp21090_pttab_dropmidcol_addpt_interval ORDER BY 1,2,3;
   col1   |   col2   | col3 | col5 
----------+----------+------+------
 01:00:00 | 01:00:00 | a    |    0
 14:00:00 | 14:00:00 | b    |    1
(2 rows)

-- TEST
DROP TABLE IF EXISTS mpp21090_pttab_dropmidcol_addpt_numeric;
NOTICE:  table "mpp21090_pttab_dropmidcol_addpt_numeric" does not exist, skipping
CREATE TABLE mpp21090_pttab_dropmidcol_addpt_numeric
(
    col1 numeric,
    col2 numeric,
    col3 char,
    col4 numeric,
    col5 int
) 
DISTRIBUTED by (col1) 
PARTITION BY RANGE(col2)(partition partone start(1.000000) end(10.000000)  WITH (APPENDONLY=true, COMPRESSLEVEL=5, ORIENTATION=column),partition parttwo start(10.000000) end(20.000000) WITH (APPENDONLY=true, COMPRESSLEVEL=5, ORIENTATION=row),partition partthree start(20.000000) end(30.000000));
NOTICE:  CREATE TABLE will create partition "mpp21090_pttab_dropmidcol_addpt_numeric_1_prt_partone" for table "mpp21090_pttab_dropmidcol_addpt_numeric"
NOTICE:  CREATE TABLE will create partition "mpp21090_pttab_dropmidcol_addpt_numeric_1_prt_parttwo" for table "mpp21090_pttab_dropmidcol_addpt_numeric"
NOTICE:  CREATE TABLE will create partition "mpp21090_pttab_dropmidcol_addpt_numeric_1_prt_partthree" for table "mpp21090_pttab_dropmidcol_addpt_numeric"
INSERT INTO mpp21090_pttab_dropmidcol_addpt_numeric VALUES(2.000000,2.000000,'a',2.000000,0);
ALTER TABLE mpp21090_pttab_dropmidcol_addpt_numeric DROP COLUMN col4;
ALTER TABLE mpp21090_pttab_dropmidcol_addpt_numeric ADD PARTITION partfour start(30.000000) end(40.000000) inclusive;
NOTICE:  CREATE TABLE will create partition "mpp21090_pttab_dropmidcol_addpt_numeric_1_prt_partfour" for table "mpp21090_pttab_dropmidcol_addpt_numeric"
INSERT INTO mpp21090_pttab_dropmidcol_addpt_numeric SELECT 35.000000, 35.000000,'b', 1;
SELECT * FROM mpp21090_pttab_dropmidcol_addpt_numeric ORDER BY 1,2,3;
   col1    |   col2    | col3 | col5 
-----------+-----------+------+------
  2.000000 |  2.000000 | a    |    0
 35.000000 | 35.000000 | b    |    1
(2 rows)

-- Update distribution key
UPDATE mpp21090_pttab_dropmidcol_addpt_numeric SET col1 = 1.000000 WHERE col2 = 35.000000 AND col1 = 35.000000;
ERROR:  Cannot parallelize an UPDATE statement that updates the distribution columns
SELECT * FROM mpp21090_pttab_dropmidcol_addpt_numeric ORDER BY 1,2,3;
   col1    |   col2    | col3 | col5 
-----------+-----------+------+------
  2.000000 |  2.000000 | a    |    0
 35.000000 | 35.000000 | b    |    1
(2 rows)

-- Update partition key
UPDATE mpp21090_pttab_dropmidcol_addpt_numeric SET col2 = 1.000000 WHERE col2 = 35.000000 AND col1 = 1.000000;
SELECT * FROM mpp21090_pttab_dropmidcol_addpt_numeric ORDER BY 1,2,3;
   col1    |   col2    | col3 | col5 
-----------+-----------+------+------
  2.000000 |  2.000000 | a    |    0
 35.000000 | 35.000000 | b    |    1
(2 rows)

DELETE FROM mpp21090_pttab_dropmidcol_addpt_numeric WHERE col2 = 1.000000;
SELECT * FROM mpp21090_pttab_dropmidcol_addpt_numeric ORDER BY 1,2,3;
   col1    |   col2    | col3 | col5 
-----------+-----------+------+------
  2.000000 |  2.000000 | a    |    0
 35.000000 | 35.000000 | b    |    1
(2 rows)

-- TEST
DROP TABLE IF EXISTS mpp21090_pttab_dropmidcol_addpt_text;
NOTICE:  table "mpp21090_pttab_dropmidcol_addpt_text" does not exist, skipping
CREATE TABLE mpp21090_pttab_dropmidcol_addpt_text
(
    col1 text,
    col2 text,
    col3 char,
    col4 text,
    col5 int
) 
DISTRIBUTED by (col1) 
PARTITION BY LIST(col2)(partition partone VALUES('abcdefghijklmnop') WITH (APPENDONLY=true, COMPRESSLEVEL=5, ORIENTATION=column),partition parttwo VALUES('qrstuvwxyz') WITH (APPENDONLY=true, COMPRESSLEVEL=5, ORIENTATION=row),partition partthree VALUES('ghi'));
NOTICE:  CREATE TABLE will create partition "mpp21090_pttab_dropmidcol_addpt_text_1_prt_partone" for table "mpp21090_pttab_dropmidcol_addpt_text"
NOTICE:  CREATE TABLE will create partition "mpp21090_pttab_dropmidcol_addpt_text_1_prt_parttwo" for table "mpp21090_pttab_dropmidcol_addpt_text"
NOTICE:  CREATE TABLE will create partition "mpp21090_pttab_dropmidcol_addpt_text_1_prt_partthree" for table "mpp21090_pttab_dropmidcol_addpt_text"
INSERT INTO mpp21090_pttab_dropmidcol_addpt_text VALUES('abcdefghijklmnop','abcdefghijklmnop','a','abcdefghijklmnop',0);
ALTER TABLE mpp21090_pttab_dropmidcol_addpt_text DROP COLUMN col4;
ALTER TABLE mpp21090_pttab_dropmidcol_addpt_text ADD PARTITION partfour VALUES('xyz');
NOTICE:  CREATE TABLE will create partition "mpp21090_pttab_dropmidcol_addpt_text_1_prt_partfour" for table "mpp21090_pttab_dropmidcol_addpt_text"
INSERT INTO mpp21090_pttab_dropmidcol_addpt_text SELECT 'xyz', 'xyz','b', 1;
SELECT * FROM mpp21090_pttab_dropmidcol_addpt_text ORDER BY 1,2,3;
       col1       |       col2       | col3 | col5 
------------------+------------------+------+------
 abcdefghijklmnop | abcdefghijklmnop | a    |    0
 xyz              | xyz              | b    |    1
(2 rows)

-- Update distribution key
UPDATE mpp21090_pttab_dropmidcol_addpt_text SET col1 = 'qrstuvwxyz' WHERE col2 = 'xyz' AND col1 = 'xyz';
ERROR:  Cannot parallelize an UPDATE statement that updates the distribution columns
SELECT * FROM mpp21090_pttab_dropmidcol_addpt_text ORDER BY 1,2,3;
       col1       |       col2       | col3 | col5 
------------------+------------------+------+------
 abcdefghijklmnop | abcdefghijklmnop | a    |    0
 xyz              | xyz              | b    |    1
(2 rows)

-- Update partition key
UPDATE mpp21090_pttab_dropmidcol_addpt_text SET col2 = 'qrstuvwxyz' WHERE col2 = 'xyz' AND col1 = 'qrstuvwxyz';
SELECT * FROM mpp21090_pttab_dropmidcol_addpt_text ORDER BY 1,2,3;
       col1       |       col2       | col3 | col5 
------------------+------------------+------+------
 abcdefghijklmnop | abcdefghijklmnop | a    |    0
 xyz              | xyz              | b    |    1
(2 rows)

DELETE FROM mpp21090_pttab_dropmidcol_addpt_text WHERE col2 = 'qrstuvwxyz';
SELECT * FROM mpp21090_pttab_dropmidcol_addpt_text ORDER BY 1,2,3;
       col1       |       col2       | col3 | col5 
------------------+------------------+------+------
 abcdefghijklmnop | abcdefghijklmnop | a    |    0
 xyz              | xyz              | b    |    1
(2 rows)

-- TEST
DROP TABLE IF EXISTS mpp21090_reordered_col_dml_char;
NOTICE:  table "mpp21090_reordered_col_dml_char" does not exist, skipping
CREATE TABLE mpp21090_reordered_col_dml_char
(
    col1 char DEFAULT 'a',
    col2 char,
    col3 char,
    col4 char,
    col5 int
) 
DISTRIBUTED by (col1)
PARTITION BY LIST(col2)(partition partone VALUES('a','b','c','d','e','f','g','h') WITH (APPENDONLY=true, COMPRESSLEVEL=5, ORIENTATION=column),partition parttwo VALUES('i','j','k','l','m','n','o','p') WITH (APPENDONLY=true, COMPRESSLEVEL=5, ORIENTATION=row),partition partthree VALUES('q','r','s','t','u','v','w','x'));
NOTICE:  CREATE TABLE will create partition "mpp21090_reordered_col_dml_char_1_prt_partone" for table "mpp21090_reordered_col_dml_char"
NOTICE:  CREATE TABLE will create partition "mpp21090_reordered_col_dml_char_1_prt_parttwo" for table "mpp21090_reordered_col_dml_char"
NOTICE:  CREATE TABLE will create partition "mpp21090_reordered_col_dml_char_1_prt_partthree" for table "mpp21090_reordered_col_dml_char"
INSERT INTO mpp21090_reordered_col_dml_char(col2,col1,col3,col5,col4) SELECT 'g', 'g','a', 1,'g';
INSERT INTO mpp21090_reordered_col_dml_char(col2,col3,col5,col4) SELECT 'g','b', 2, 'g'; 
SELECT * FROM mpp21090_reordered_col_dml_char ORDER BY 1,2,3,4;
 col1 | col2 | col3 | col4 | col5 
------+------+------+------+------
 a    | g    | b    | g    |    2
 g    | g    | a    | g    |    1
(2 rows)

ALTER TABLE mpp21090_reordered_col_dml_char DROP COLUMN col4;
ALTER TABLE mpp21090_reordered_col_dml_char ADD COLUMN col4 int DEFAULT 10;
INSERT INTO mpp21090_reordered_col_dml_char(col2,col3,col5,col4) SELECT 'g','c', 2, 10; 
SELECT * FROM mpp21090_reordered_col_dml_char ORDER BY 1,2,3,4;
 col1 | col2 | col3 | col5 | col4 
------+------+------+------+------
 a    | g    | b    |    2 |   10
 a    | g    | c    |    2 |   10
 g    | g    | a    |    1 |   10
(3 rows)

UPDATE mpp21090_reordered_col_dml_char SET col4 = 20;
SELECT * FROM mpp21090_reordered_col_dml_char ORDER BY 1,2,3,4;
 col1 | col2 | col3 | col5 | col4 
------+------+------+------+------
 a    | g    | b    |    2 |   20
 a    | g    | c    |    2 |   20
 g    | g    | a    |    1 |   20
(3 rows)

DELETE FROM mpp21090_reordered_col_dml_char WHERE col4=20;
SELECT * FROM mpp21090_reordered_col_dml_char ORDER BY 1,2,3,4;
 col1 | col2 | col3 | col5 | col4 
------+------+------+------+------
(0 rows)

-- TEST
DROP TABLE IF EXISTS mpp21090_reordered_col_dml_decimal;
NOTICE:  table "mpp21090_reordered_col_dml_decimal" does not exist, skipping
CREATE TABLE mpp21090_reordered_col_dml_decimal
(
    col1 decimal DEFAULT 1.00,
    col2 decimal,
    col3 char,
    col4 decimal,
    col5 int
) 
DISTRIBUTED by (col1)
PARTITION BY RANGE(col2)(partition partone start(1.00) end(10.00)  WITH (APPENDONLY=true, COMPRESSLEVEL=5, ORIENTATION=column),partition parttwo start(10.00) end(20.00) WITH (APPENDONLY=true, COMPRESSLEVEL=5, ORIENTATION=row),partition partthree start(20.00) end(30.00));
NOTICE:  CREATE TABLE will create partition "mpp21090_reordered_col_dml_decimal_1_prt_partone" for table "mpp21090_reordered_col_dml_decimal"
NOTICE:  CREATE TABLE will create partition "mpp21090_reordered_col_dml_decimal_1_prt_parttwo" for table "mpp21090_reordered_col_dml_decimal"
NOTICE:  CREATE TABLE will create partition "mpp21090_reordered_col_dml_decimal_1_prt_partthree" for table "mpp21090_reordered_col_dml_decimal"
INSERT INTO mpp21090_reordered_col_dml_decimal(col2,col1,col3,col5,col4) SELECT 2.00, 2.00,'a', 1,2.00;
INSERT INTO mpp21090_reordered_col_dml_decimal(col2,col3,col5,col4) SELECT 2.00,'b', 2, 2.00; 
SELECT * FROM mpp21090_reordered_col_dml_decimal ORDER BY 1,2,3,4;
 col1 | col2 | col3 | col4 | col5 
------+------+------+------+------
 1.00 | 2.00 | b    | 2.00 |    2
 2.00 | 2.00 | a    | 2.00 |    1
(2 rows)

ALTER TABLE mpp21090_reordered_col_dml_decimal DROP COLUMN col4;
ALTER TABLE mpp21090_reordered_col_dml_decimal ADD COLUMN col4 int DEFAULT 10;
INSERT INTO mpp21090_reordered_col_dml_decimal(col2,col3,col5,col4) SELECT 2.00,'c', 2, 10; 
SELECT * FROM mpp21090_reordered_col_dml_decimal ORDER BY 1,2,3,4;
 col1 | col2 | col3 | col5 | col4 
------+------+------+------+------
 1.00 | 2.00 | b    |    2 |   10
 1.00 | 2.00 | c    |    2 |   10
 2.00 | 2.00 | a    |    1 |   10
(3 rows)

UPDATE mpp21090_reordered_col_dml_decimal SET col4 = 20;
SELECT * FROM mpp21090_reordered_col_dml_decimal ORDER BY 1,2,3,4;
 col1 | col2 | col3 | col5 | col4 
------+------+------+------+------
 1.00 | 2.00 | b    |    2 |   20
 1.00 | 2.00 | c    |    2 |   20
 2.00 | 2.00 | a    |    1 |   20
(3 rows)

DELETE FROM mpp21090_reordered_col_dml_decimal WHERE col4=20;
SELECT * FROM mpp21090_reordered_col_dml_decimal ORDER BY 1,2,3,4;
 col1 | col2 | col3 | col5 | col4 
------+------+------+------+------
(0 rows)

-- TEST
DROP TABLE IF EXISTS mpp21090_reordered_col_dml_int4;
NOTICE:  table "mpp21090_reordered_col_dml_int4" does not exist, skipping
CREATE TABLE mpp21090_reordered_col_dml_int4
(
    col1 int4 DEFAULT 10000000,
    col2 int4,
    col3 char,
    col4 int4,
    col5 int
) 
DISTRIBUTED by (col1)
PARTITION BY RANGE(col2)(partition partone start(1) end(100000001)  WITH (APPENDONLY=true, COMPRESSLEVEL=5, ORIENTATION=column),partition parttwo start(100000001) end(200000001) WITH (APPENDONLY=true, COMPRESSLEVEL=5, ORIENTATION=row),partition partthree start(200000001) end(300000001));
NOTICE:  CREATE TABLE will create partition "mpp21090_reordered_col_dml_int4_1_prt_partone" for table "mpp21090_reordered_col_dml_int4"
NOTICE:  CREATE TABLE will create partition "mpp21090_reordered_col_dml_int4_1_prt_parttwo" for table "mpp21090_reordered_col_dml_int4"
NOTICE:  CREATE TABLE will create partition "mpp21090_reordered_col_dml_int4_1_prt_partthree" for table "mpp21090_reordered_col_dml_int4"
INSERT INTO mpp21090_reordered_col_dml_int4(col2,col1,col3,col5,col4) SELECT 20000000, 20000000,'a', 1,20000000;
INSERT INTO mpp21090_reordered_col_dml_int4(col2,col3,col5,col4) SELECT 20000000,'b', 2, 20000000; 
SELECT * FROM mpp21090_reordered_col_dml_int4 ORDER BY 1,2,3,4;
   col1   |   col2   | col3 |   col4   | col5 
----------+----------+------+----------+------
 10000000 | 20000000 | b    | 20000000 |    2
 20000000 | 20000000 | a    | 20000000 |    1
(2 rows)

ALTER TABLE mpp21090_reordered_col_dml_int4 DROP COLUMN col4;
ALTER TABLE mpp21090_reordered_col_dml_int4 ADD COLUMN col4 int DEFAULT 10;
INSERT INTO mpp21090_reordered_col_dml_int4(col2,col3,col5,col4) SELECT 20000000,'c', 2, 10; 
SELECT * FROM mpp21090_reordered_col_dml_int4 ORDER BY 1,2,3,4;
   col1   |   col2   | col3 | col5 | col4 
----------+----------+------+------+------
 10000000 | 20000000 | b    |    2 |   10
 10000000 | 20000000 | c    |    2 |   10
 20000000 | 20000000 | a    |    1 |   10
(3 rows)

UPDATE mpp21090_reordered_col_dml_int4 SET col4 = 20;
SELECT * FROM mpp21090_reordered_col_dml_int4 ORDER BY 1,2,3,4;
   col1   |   col2   | col3 | col5 | col4 
----------+----------+------+------+------
 10000000 | 20000000 | b    |    2 |   20
 10000000 | 20000000 | c    |    2 |   20
 20000000 | 20000000 | a    |    1 |   20
(3 rows)

DELETE FROM mpp21090_reordered_col_dml_int4 WHERE col4=20;
SELECT * FROM mpp21090_reordered_col_dml_int4 ORDER BY 1,2,3,4;
 col1 | col2 | col3 | col5 | col4 
------+------+------+------+------
(0 rows)

-- TEST
DROP TABLE IF EXISTS mpp21090_reordered_col_dml_int8;
NOTICE:  table "mpp21090_reordered_col_dml_int8" does not exist, skipping
CREATE TABLE mpp21090_reordered_col_dml_int8
(
    col1 int8 DEFAULT 1000000000000000000,
    col2 int8,
    col3 char,
    col4 int8,
    col5 int
) 
DISTRIBUTED by (col1)
PARTITION BY RANGE(col2)(partition partone start(1) end(1000000000000000001)  WITH (APPENDONLY=true, COMPRESSLEVEL=5, ORIENTATION=column),partition parttwo start(1000000000000000001) end(2000000000000000001) WITH (APPENDONLY=true, COMPRESSLEVEL=5, ORIENTATION=row),partition partthree start(2000000000000000001) end(3000000000000000001));
NOTICE:  CREATE TABLE will create partition "mpp21090_reordered_col_dml_int8_1_prt_partone" for table "mpp21090_reordered_col_dml_int8"
NOTICE:  CREATE TABLE will create partition "mpp21090_reordered_col_dml_int8_1_prt_parttwo" for table "mpp21090_reordered_col_dml_int8"
NOTICE:  CREATE TABLE will create partition "mpp21090_reordered_col_dml_int8_1_prt_partthree" for table "mpp21090_reordered_col_dml_int8"
INSERT INTO mpp21090_reordered_col_dml_int8(col2,col1,col3,col5,col4) SELECT 200000000000000000, 200000000000000000,'a', 1,200000000000000000;
INSERT INTO mpp21090_reordered_col_dml_int8(col2,col3,col5,col4) SELECT 200000000000000000,'b', 2, 200000000000000000; 
SELECT * FROM mpp21090_reordered_col_dml_int8 ORDER BY 1,2,3,4;
        col1         |        col2        | col3 |        col4        | col5 
---------------------+--------------------+------+--------------------+------
  200000000000000000 | 200000000000000000 | a    | 200000000000000000 |    1
 1000000000000000000 | 200000000000000000 | b    | 200000000000000000 |    2
(2 rows)

ALTER TABLE mpp21090_reordered_col_dml_int8 DROP COLUMN col4;
ALTER TABLE mpp21090_reordered_col_dml_int8 ADD COLUMN col4 int DEFAULT 10;
INSERT INTO mpp21090_reordered_col_dml_int8(col2,col3,col5,col4) SELECT 200000000000000000,'c', 2, 10; 
SELECT * FROM mpp21090_reordered_col_dml_int8 ORDER BY 1,2,3,4;
        col1         |        col2        | col3 | col5 | col4 
---------------------+--------------------+------+------+------
  200000000000000000 | 200000000000000000 | a    |    1 |   10
 1000000000000000000 | 200000000000000000 | b    |    2 |   10
 1000000000000000000 | 200000000000000000 | c    |    2 |   10
(3 rows)

UPDATE mpp21090_reordered_col_dml_int8 SET col4 = 20;
SELECT * FROM mpp21090_reordered_col_dml_int8 ORDER BY 1,2,3,4;
        col1         |        col2        | col3 | col5 | col4 
---------------------+--------------------+------+------+------
  200000000000000000 | 200000000000000000 | a    |    1 |   20
 1000000000000000000 | 200000000000000000 | b    |    2 |   20
 1000000000000000000 | 200000000000000000 | c    |    2 |   20
(3 rows)

DELETE FROM mpp21090_reordered_col_dml_int8 WHERE col4=20;
SELECT * FROM mpp21090_reordered_col_dml_int8 ORDER BY 1,2,3,4;
 col1 | col2 | col3 | col5 | col4 
------+------+------+------+------
(0 rows)

-- TEST
DROP TABLE IF EXISTS mpp21090_reordered_col_dml_interval;
NOTICE:  table "mpp21090_reordered_col_dml_interval" does not exist, skipping
CREATE TABLE mpp21090_reordered_col_dml_interval
(
    col1 interval DEFAULT '11 hours',
    col2 interval,
    col3 char,
    col4 interval,
    col5 int
) 
DISTRIBUTED by (col1)
PARTITION BY RANGE(col2)(partition partone start('1 sec') end('1 min')  WITH (APPENDONLY=true, COMPRESSLEVEL=5, ORIENTATION=column),partition parttwo start('1 min') end('1 hour') WITH (APPENDONLY=true, COMPRESSLEVEL=5, ORIENTATION=row),partition partthree start('1 hour') end('12 hours'));
NOTICE:  CREATE TABLE will create partition "mpp21090_reordered_col_dml_interval_1_prt_partone" for table "mpp21090_reordered_col_dml_interval"
NOTICE:  CREATE TABLE will create partition "mpp21090_reordered_col_dml_interval_1_prt_parttwo" for table "mpp21090_reordered_col_dml_interval"
NOTICE:  CREATE TABLE will create partition "mpp21090_reordered_col_dml_interval_1_prt_partthree" for table "mpp21090_reordered_col_dml_interval"
INSERT INTO mpp21090_reordered_col_dml_interval(col2,col1,col3,col5,col4) SELECT '10 secs', '10 secs','a', 1,'10 secs';
INSERT INTO mpp21090_reordered_col_dml_interval(col2,col3,col5,col4) SELECT '10 secs','b', 2, '10 secs'; 
SELECT * FROM mpp21090_reordered_col_dml_interval ORDER BY 1,2,3,4;
   col1   |   col2   | col3 |   col4   | col5 
----------+----------+------+----------+------
 00:00:10 | 00:00:10 | a    | 00:00:10 |    1
 11:00:00 | 00:00:10 | b    | 00:00:10 |    2
(2 rows)

ALTER TABLE mpp21090_reordered_col_dml_interval DROP COLUMN col4;
ALTER TABLE mpp21090_reordered_col_dml_interval ADD COLUMN col4 int DEFAULT 10;
INSERT INTO mpp21090_reordered_col_dml_interval(col2,col3,col5,col4) SELECT '10 secs','c', 2, 10; 
SELECT * FROM mpp21090_reordered_col_dml_interval ORDER BY 1,2,3,4;
   col1   |   col2   | col3 | col5 | col4 
----------+----------+------+------+------
 00:00:10 | 00:00:10 | a    |    1 |   10
 11:00:00 | 00:00:10 | b    |    2 |   10
 11:00:00 | 00:00:10 | c    |    2 |   10
(3 rows)

UPDATE mpp21090_reordered_col_dml_interval SET col4 = 20;
SELECT * FROM mpp21090_reordered_col_dml_interval ORDER BY 1,2,3,4;
   col1   |   col2   | col3 | col5 | col4 
----------+----------+------+------+------
 00:00:10 | 00:00:10 | a    |    1 |   20
 11:00:00 | 00:00:10 | b    |    2 |   20
 11:00:00 | 00:00:10 | c    |    2 |   20
(3 rows)

DELETE FROM mpp21090_reordered_col_dml_interval WHERE col4=20;
SELECT * FROM mpp21090_reordered_col_dml_interval ORDER BY 1,2,3,4;
 col1 | col2 | col3 | col5 | col4 
------+------+------+------+------
(0 rows)

-- TEST
DROP TABLE IF EXISTS mpp21090_reordered_col_dml_numeric;
NOTICE:  table "mpp21090_reordered_col_dml_numeric" does not exist, skipping
CREATE TABLE mpp21090_reordered_col_dml_numeric
(
    col1 numeric DEFAULT 1.000000,
    col2 numeric,
    col3 char,
    col4 numeric,
    col5 int
) 
DISTRIBUTED by (col1)
PARTITION BY RANGE(col2)(partition partone start(1.000000) end(10.000000)  WITH (APPENDONLY=true, COMPRESSLEVEL=5, ORIENTATION=column),partition parttwo start(10.000000) end(20.000000) WITH (APPENDONLY=true, COMPRESSLEVEL=5, ORIENTATION=row),partition partthree start(20.000000) end(30.000000));
NOTICE:  CREATE TABLE will create partition "mpp21090_reordered_col_dml_numeric_1_prt_partone" for table "mpp21090_reordered_col_dml_numeric"
NOTICE:  CREATE TABLE will create partition "mpp21090_reordered_col_dml_numeric_1_prt_parttwo" for table "mpp21090_reordered_col_dml_numeric"
NOTICE:  CREATE TABLE will create partition "mpp21090_reordered_col_dml_numeric_1_prt_partthree" for table "mpp21090_reordered_col_dml_numeric"
INSERT INTO mpp21090_reordered_col_dml_numeric(col2,col1,col3,col5,col4) SELECT 2.000000, 2.000000,'a', 1,2.000000;
INSERT INTO mpp21090_reordered_col_dml_numeric(col2,col3,col5,col4) SELECT 2.000000,'b', 2, 2.000000; 
SELECT * FROM mpp21090_reordered_col_dml_numeric ORDER BY 1,2,3,4;
   col1   |   col2   | col3 |   col4   | col5 
----------+----------+------+----------+------
 1.000000 | 2.000000 | b    | 2.000000 |    2
 2.000000 | 2.000000 | a    | 2.000000 |    1
(2 rows)

ALTER TABLE mpp21090_reordered_col_dml_numeric DROP COLUMN col4;
ALTER TABLE mpp21090_reordered_col_dml_numeric ADD COLUMN col4 int DEFAULT 10;
INSERT INTO mpp21090_reordered_col_dml_numeric(col2,col3,col5,col4) SELECT 2.000000,'c', 2, 10; 
SELECT * FROM mpp21090_reordered_col_dml_numeric ORDER BY 1,2,3,4;
   col1   |   col2   | col3 | col5 | col4 
----------+----------+------+------+------
 1.000000 | 2.000000 | b    |    2 |   10
 1.000000 | 2.000000 | c    |    2 |   10
 2.000000 | 2.000000 | a    |    1 |   10
(3 rows)

UPDATE mpp21090_reordered_col_dml_numeric SET col4 = 20;
SELECT * FROM mpp21090_reordered_col_dml_numeric ORDER BY 1,2,3,4;
   col1   |   col2   | col3 | col5 | col4 
----------+----------+------+------+------
 1.000000 | 2.000000 | b    |    2 |   20
 1.000000 | 2.000000 | c    |    2 |   20
 2.000000 | 2.000000 | a    |    1 |   20
(3 rows)

DELETE FROM mpp21090_reordered_col_dml_numeric WHERE col4=20;
SELECT * FROM mpp21090_reordered_col_dml_numeric ORDER BY 1,2,3,4;
 col1 | col2 | col3 | col5 | col4 
------+------+------+------+------
(0 rows)

-- TEST
DROP TABLE IF EXISTS mpp21090_xchange_pttab_dropcol_addcol_dml_char;
NOTICE:  table "mpp21090_xchange_pttab_dropcol_addcol_dml_char" does not exist, skipping
CREATE TABLE mpp21090_xchange_pttab_dropcol_addcol_dml_char
(
    col1 char,
    col2 char,
    col3 char,
    col4 int,
    col5 char
) 
DISTRIBUTED by (col1)
PARTITION BY LIST(col2)(partition partone VALUES('a','b','c','d','e','f','g','h') WITH (APPENDONLY=true, COMPRESSLEVEL=5, ORIENTATION=column),partition parttwo VALUES('i','j','k','l','m','n','o','p') WITH (APPENDONLY=true, COMPRESSLEVEL=5, ORIENTATION=row),partition partthree VALUES('q','r','s','t','u','v','w','x'));
NOTICE:  CREATE TABLE will create partition "mpp21090_xchange_pttab_dropcol_addcol_dml_char_1_prt_partone" for table "mpp21090_xchange_pttab_dropcol_addcol_dml_char"
NOTICE:  CREATE TABLE will create partition "mpp21090_xchange_pttab_dropcol_addcol_dml_char_1_prt_parttwo" for table "mpp21090_xchange_pttab_dropcol_addcol_dml_char"
NOTICE:  CREATE TABLE will create partition "mpp21090_xchange_pttab_dropcol_addcol_dml_char_1_prt_partthree" for table "mpp21090_xchange_pttab_dropcol_addcol_dml_char"
INSERT INTO mpp21090_xchange_pttab_dropcol_addcol_dml_char VALUES('g','g','a',0, 'g');
SELECT * FROM mpp21090_xchange_pttab_dropcol_addcol_dml_char ORDER BY 1,2,3,4;
 col1 | col2 | col3 | col4 | col5 
------+------+------+------+------
 g    | g    | a    |    0 | g
(1 row)

ALTER TABLE mpp21090_xchange_pttab_dropcol_addcol_dml_char DROP COLUMN col1;
NOTICE:  Dropping a column that is part of the distribution policy forces a NULL distribution policy
NOTICE:  Dropping a column that is part of the distribution policy forces a NULL distribution policy
NOTICE:  Dropping a column that is part of the distribution policy forces a NULL distribution policy
NOTICE:  Dropping a column that is part of the distribution policy forces a NULL distribution policy
ALTER TABLE mpp21090_xchange_pttab_dropcol_addcol_dml_char ADD COLUMN col1 char DEFAULT 'g';
-- Create Candidate table for Exchange
DROP TABLE IF EXISTS mpp21090_xchange_pttab_dropcol_addcol_dml_char_candidate;
NOTICE:  table "mpp21090_xchange_pttab_dropcol_addcol_dml_char_candidate" does not exist, skipping
CREATE TABLE mpp21090_xchange_pttab_dropcol_addcol_dml_char_candidate( like mpp21090_xchange_pttab_dropcol_addcol_dml_char) distributed randomly;
INSERT INTO mpp21090_xchange_pttab_dropcol_addcol_dml_char_candidate VALUES('g','z',1,'g','g');
-- Exchange 
ALTER TABLE mpp21090_xchange_pttab_dropcol_addcol_dml_char EXCHANGE PARTITION FOR('d') WITH TABLE mpp21090_xchange_pttab_dropcol_addcol_dml_char_candidate;
NOTICE:  exchanged partition "partone" of relation "mpp21090_xchange_pttab_dropcol_addcol_dml_char" with relation "mpp21090_xchange_pttab_dropcol_addcol_dml_char_candidate"
SELECT * FROM mpp21090_xchange_pttab_dropcol_addcol_dml_char ORDER BY 1,2,3;
 col2 | col3 | col4 | col5 | col1 
------+------+------+------+------
 g    | z    |    1 | g    | g
(1 row)

SELECT * FROM mpp21090_xchange_pttab_dropcol_addcol_dml_char_candidate ORDER BY 1,2,3;
 col2 | col3 | col4 | col5 | col1 
------+------+------+------+------
 g    | a    |    0 | g    | g
(1 row)

-- DML on partition table
INSERT INTO mpp21090_xchange_pttab_dropcol_addcol_dml_char SELECT  'a','b', 1, 'a', 'a';
SELECT * FROM mpp21090_xchange_pttab_dropcol_addcol_dml_char ORDER BY 1,2,3;
 col2 | col3 | col4 | col5 | col1 
------+------+------+------+------
 a    | b    |    1 | a    | a
 g    | z    |    1 | g    | g
(2 rows)

UPDATE mpp21090_xchange_pttab_dropcol_addcol_dml_char SET col5 = 'z' WHERE col2 = 'a' AND col5 = 'a';
SELECT * FROM mpp21090_xchange_pttab_dropcol_addcol_dml_char ORDER BY 1,2,3;
 col2 | col3 | col4 | col5 | col1 
------+------+------+------+------
 a    | b    |    1 | z    | a
 g    | z    |    1 | g    | g
(2 rows)

UPDATE mpp21090_xchange_pttab_dropcol_addcol_dml_char SET col2 ='g' WHERE col3='b';
SELECT * FROM mpp21090_xchange_pttab_dropcol_addcol_dml_char ORDER BY 1,2,3;
 col2 | col3 | col4 | col5 | col1 
------+------+------+------+------
 g    | b    |    1 | z    | a
 g    | z    |    1 | g    | g
(2 rows)

DELETE FROM mpp21090_xchange_pttab_dropcol_addcol_dml_char WHERE col3='b';
SELECT * FROM mpp21090_xchange_pttab_dropcol_addcol_dml_char ORDER BY 1,2,3;
 col2 | col3 | col4 | col5 | col1 
------+------+------+------+------
 g    | z    |    1 | g    | g
(1 row)

-- DML on candidate table
INSERT INTO mpp21090_xchange_pttab_dropcol_addcol_dml_char_candidate SELECT 'a','b', 1, 'a', 'a';
SELECT * FROM mpp21090_xchange_pttab_dropcol_addcol_dml_char_candidate ORDER BY 1,2,3;
 col2 | col3 | col4 | col5 | col1 
------+------+------+------+------
 a    | b    |    1 | a    | a
 g    | a    |    0 | g    | g
(2 rows)

UPDATE mpp21090_xchange_pttab_dropcol_addcol_dml_char_candidate SET col2='g' WHERE col3='a';
SELECT * FROM mpp21090_xchange_pttab_dropcol_addcol_dml_char_candidate ORDER BY 1,2,3;
 col2 | col3 | col4 | col5 | col1 
------+------+------+------+------
 a    | b    |    1 | a    | a
 g    | a    |    0 | g    | g
(2 rows)

DELETE FROM mpp21090_xchange_pttab_dropcol_addcol_dml_char_candidate WHERE col3='a';
SELECT * FROM mpp21090_xchange_pttab_dropcol_addcol_dml_char_candidate ORDER BY 1,2,3;
 col2 | col3 | col4 | col5 | col1 
------+------+------+------+------
 a    | b    |    1 | a    | a
(1 row)

-- TEST
DROP TABLE IF EXISTS mpp21090_xchange_pttab_dropcol_addcol_dml_decimal;
NOTICE:  table "mpp21090_xchange_pttab_dropcol_addcol_dml_decimal" does not exist, skipping
CREATE TABLE mpp21090_xchange_pttab_dropcol_addcol_dml_decimal
(
    col1 decimal,
    col2 decimal,
    col3 char,
    col4 int,
    col5 decimal
) 
DISTRIBUTED by (col1)
PARTITION BY RANGE(col2)(partition partone start(1.00) end(10.00)  WITH (APPENDONLY=true, COMPRESSLEVEL=5, ORIENTATION=column),partition parttwo start(10.00) end(20.00) WITH (APPENDONLY=true, COMPRESSLEVEL=5, ORIENTATION=row),partition partthree start(20.00) end(30.00));
NOTICE:  CREATE TABLE will create partition "mpp21090_xchange_pttab_dropcol_addcol_dml_decimal_1_prt_partone" for table "mpp21090_xchange_pttab_dropcol_addcol_dml_decimal"
NOTICE:  CREATE TABLE will create partition "mpp21090_xchange_pttab_dropcol_addcol_dml_decimal_1_prt_parttwo" for table "mpp21090_xchange_pttab_dropcol_addcol_dml_decimal"
NOTICE:  CREATE TABLE will create partition "mpp21090_xchange_pttab_dropcol_addcol_dml_decim_1_prt_partthree" for table "mpp21090_xchange_pttab_dropcol_addcol_dml_decimal"
INSERT INTO mpp21090_xchange_pttab_dropcol_addcol_dml_decimal VALUES(2.00,2.00,'a',0, 2.00);
SELECT * FROM mpp21090_xchange_pttab_dropcol_addcol_dml_decimal ORDER BY 1,2,3,4;
 col1 | col2 | col3 | col4 | col5 
------+------+------+------+------
 2.00 | 2.00 | a    |    0 | 2.00
(1 row)

ALTER TABLE mpp21090_xchange_pttab_dropcol_addcol_dml_decimal DROP COLUMN col1;
NOTICE:  Dropping a column that is part of the distribution policy forces a NULL distribution policy
NOTICE:  Dropping a column that is part of the distribution policy forces a NULL distribution policy
NOTICE:  Dropping a column that is part of the distribution policy forces a NULL distribution policy
NOTICE:  Dropping a column that is part of the distribution policy forces a NULL distribution policy
ALTER TABLE mpp21090_xchange_pttab_dropcol_addcol_dml_decimal ADD COLUMN col1 decimal DEFAULT 2.00;
-- Create Candidate table for Exchange
DROP TABLE IF EXISTS mpp21090_xchange_pttab_dropcol_addcol_dml_decimal_candidate;
NOTICE:  table "mpp21090_xchange_pttab_dropcol_addcol_dml_decimal_candidate" does not exist, skipping
CREATE TABLE mpp21090_xchange_pttab_dropcol_addcol_dml_decimal_candidate( like mpp21090_xchange_pttab_dropcol_addcol_dml_decimal) distributed randomly;
INSERT INTO mpp21090_xchange_pttab_dropcol_addcol_dml_decimal_candidate VALUES(2.00,'z',1,2.00,2.00);
-- Exchange 
ALTER TABLE mpp21090_xchange_pttab_dropcol_addcol_dml_decimal EXCHANGE PARTITION FOR(5.00) WITH TABLE mpp21090_xchange_pttab_dropcol_addcol_dml_decimal_candidate;
NOTICE:  exchanged partition "partone" of relation "mpp21090_xchange_pttab_dropcol_addcol_dml_decimal" with relation "mpp21090_xchange_pttab_dropcol_addcol_dml_decimal_candidate"
SELECT * FROM mpp21090_xchange_pttab_dropcol_addcol_dml_decimal ORDER BY 1,2,3;
 col2 | col3 | col4 | col5 | col1 
------+------+------+------+------
 2.00 | z    |    1 | 2.00 | 2.00
(1 row)

SELECT * FROM mpp21090_xchange_pttab_dropcol_addcol_dml_decimal_candidate ORDER BY 1,2,3;
 col2 | col3 | col4 | col5 | col1 
------+------+------+------+------
 2.00 | a    |    0 | 2.00 | 2.00
(1 row)

-- DML on partition table
INSERT INTO mpp21090_xchange_pttab_dropcol_addcol_dml_decimal SELECT  1.00,'b', 1, 1.00, 1.00;
SELECT * FROM mpp21090_xchange_pttab_dropcol_addcol_dml_decimal ORDER BY 1,2,3;
 col2 | col3 | col4 | col5 | col1 
------+------+------+------+------
 1.00 | b    |    1 | 1.00 | 1.00
 2.00 | z    |    1 | 2.00 | 2.00
(2 rows)

UPDATE mpp21090_xchange_pttab_dropcol_addcol_dml_decimal SET col5 = 35.00 WHERE col2 = 1.00 AND col5 = 1.00;
SELECT * FROM mpp21090_xchange_pttab_dropcol_addcol_dml_decimal ORDER BY 1,2,3;
 col2 | col3 | col4 | col5  | col1 
------+------+------+-------+------
 1.00 | b    |    1 | 35.00 | 1.00
 2.00 | z    |    1 |  2.00 | 2.00
(2 rows)

UPDATE mpp21090_xchange_pttab_dropcol_addcol_dml_decimal SET col2 =2.00 WHERE col3='b';
SELECT * FROM mpp21090_xchange_pttab_dropcol_addcol_dml_decimal ORDER BY 1,2,3;
 col2 | col3 | col4 | col5  | col1 
------+------+------+-------+------
 2.00 | b    |    1 | 35.00 | 1.00
 2.00 | z    |    1 |  2.00 | 2.00
(2 rows)

DELETE FROM mpp21090_xchange_pttab_dropcol_addcol_dml_decimal WHERE col3='b';
SELECT * FROM mpp21090_xchange_pttab_dropcol_addcol_dml_decimal ORDER BY 1,2,3;
 col2 | col3 | col4 | col5 | col1 
------+------+------+------+------
 2.00 | z    |    1 | 2.00 | 2.00
(1 row)

-- DML on candidate table
INSERT INTO mpp21090_xchange_pttab_dropcol_addcol_dml_decimal_candidate SELECT 1.00,'b', 1, 1.00, 1.00;
SELECT * FROM mpp21090_xchange_pttab_dropcol_addcol_dml_decimal_candidate ORDER BY 1,2,3;
 col2 | col3 | col4 | col5 | col1 
------+------+------+------+------
 1.00 | b    |    1 | 1.00 | 1.00
 2.00 | a    |    0 | 2.00 | 2.00
(2 rows)

UPDATE mpp21090_xchange_pttab_dropcol_addcol_dml_decimal_candidate SET col2=2.00 WHERE col3='a';
SELECT * FROM mpp21090_xchange_pttab_dropcol_addcol_dml_decimal_candidate ORDER BY 1,2,3;
 col2 | col3 | col4 | col5 | col1 
------+------+------+------+------
 1.00 | b    |    1 | 1.00 | 1.00
 2.00 | a    |    0 | 2.00 | 2.00
(2 rows)

DELETE FROM mpp21090_xchange_pttab_dropcol_addcol_dml_decimal_candidate WHERE col3='a';
SELECT * FROM mpp21090_xchange_pttab_dropcol_addcol_dml_decimal_candidate ORDER BY 1,2,3;
 col2 | col3 | col4 | col5 | col1 
------+------+------+------+------
 1.00 | b    |    1 | 1.00 | 1.00
(1 row)

-- TEST
DROP TABLE IF EXISTS mpp21090_xchange_pttab_dropcol_addcol_dml_int4;
NOTICE:  table "mpp21090_xchange_pttab_dropcol_addcol_dml_int4" does not exist, skipping
CREATE TABLE mpp21090_xchange_pttab_dropcol_addcol_dml_int4
(
    col1 int4,
    col2 int4,
    col3 char,
    col4 int,
    col5 int4
) 
DISTRIBUTED by (col1)
PARTITION BY RANGE(col2)(partition partone start(1) end(100000001)  WITH (APPENDONLY=true, COMPRESSLEVEL=5, ORIENTATION=column),partition parttwo start(100000001) end(200000001) WITH (APPENDONLY=true, COMPRESSLEVEL=5, ORIENTATION=row),partition partthree start(200000001) end(300000001));
NOTICE:  CREATE TABLE will create partition "mpp21090_xchange_pttab_dropcol_addcol_dml_int4_1_prt_partone" for table "mpp21090_xchange_pttab_dropcol_addcol_dml_int4"
NOTICE:  CREATE TABLE will create partition "mpp21090_xchange_pttab_dropcol_addcol_dml_int4_1_prt_parttwo" for table "mpp21090_xchange_pttab_dropcol_addcol_dml_int4"
NOTICE:  CREATE TABLE will create partition "mpp21090_xchange_pttab_dropcol_addcol_dml_int4_1_prt_partthree" for table "mpp21090_xchange_pttab_dropcol_addcol_dml_int4"
INSERT INTO mpp21090_xchange_pttab_dropcol_addcol_dml_int4 VALUES(20000000,20000000,'a',0, 20000000);
SELECT * FROM mpp21090_xchange_pttab_dropcol_addcol_dml_int4 ORDER BY 1,2,3,4;
   col1   |   col2   | col3 | col4 |   col5   
----------+----------+------+------+----------
 20000000 | 20000000 | a    |    0 | 20000000
(1 row)

ALTER TABLE mpp21090_xchange_pttab_dropcol_addcol_dml_int4 DROP COLUMN col1;
NOTICE:  Dropping a column that is part of the distribution policy forces a NULL distribution policy
NOTICE:  Dropping a column that is part of the distribution policy forces a NULL distribution policy
NOTICE:  Dropping a column that is part of the distribution policy forces a NULL distribution policy
NOTICE:  Dropping a column that is part of the distribution policy forces a NULL distribution policy
ALTER TABLE mpp21090_xchange_pttab_dropcol_addcol_dml_int4 ADD COLUMN col1 int4 DEFAULT 20000000;
-- Create Candidate table for Exchange
DROP TABLE IF EXISTS mpp21090_xchange_pttab_dropcol_addcol_dml_int4_candidate;
NOTICE:  table "mpp21090_xchange_pttab_dropcol_addcol_dml_int4_candidate" does not exist, skipping
CREATE TABLE mpp21090_xchange_pttab_dropcol_addcol_dml_int4_candidate( like mpp21090_xchange_pttab_dropcol_addcol_dml_int4) distributed randomly;
INSERT INTO mpp21090_xchange_pttab_dropcol_addcol_dml_int4_candidate VALUES(20000000,'z',1,20000000,20000000);
-- Exchange 
ALTER TABLE mpp21090_xchange_pttab_dropcol_addcol_dml_int4 EXCHANGE PARTITION FOR(50000000) WITH TABLE mpp21090_xchange_pttab_dropcol_addcol_dml_int4_candidate;
NOTICE:  exchanged partition "partone" of relation "mpp21090_xchange_pttab_dropcol_addcol_dml_int4" with relation "mpp21090_xchange_pttab_dropcol_addcol_dml_int4_candidate"
SELECT * FROM mpp21090_xchange_pttab_dropcol_addcol_dml_int4 ORDER BY 1,2,3;
   col2   | col3 | col4 |   col5   |   col1   
----------+------+------+----------+----------
 20000000 | z    |    1 | 20000000 | 20000000
(1 row)

SELECT * FROM mpp21090_xchange_pttab_dropcol_addcol_dml_int4_candidate ORDER BY 1,2,3;
   col2   | col3 | col4 |   col5   |   col1   
----------+------+------+----------+----------
 20000000 | a    |    0 | 20000000 | 20000000
(1 row)

-- DML on partition table
INSERT INTO mpp21090_xchange_pttab_dropcol_addcol_dml_int4 SELECT  10000000,'b', 1, 10000000, 10000000;
SELECT * FROM mpp21090_xchange_pttab_dropcol_addcol_dml_int4 ORDER BY 1,2,3;
   col2   | col3 | col4 |   col5   |   col1   
----------+------+------+----------+----------
 10000000 | b    |    1 | 10000000 | 10000000
 20000000 | z    |    1 | 20000000 | 20000000
(2 rows)

UPDATE mpp21090_xchange_pttab_dropcol_addcol_dml_int4 SET col5 = 350000000 WHERE col2 = 10000000 AND col5 = 10000000;
SELECT * FROM mpp21090_xchange_pttab_dropcol_addcol_dml_int4 ORDER BY 1,2,3;
   col2   | col3 | col4 |   col5    |   col1   
----------+------+------+-----------+----------
 10000000 | b    |    1 | 350000000 | 10000000
 20000000 | z    |    1 |  20000000 | 20000000
(2 rows)

UPDATE mpp21090_xchange_pttab_dropcol_addcol_dml_int4 SET col2 =20000000 WHERE col3='b';
SELECT * FROM mpp21090_xchange_pttab_dropcol_addcol_dml_int4 ORDER BY 1,2,3;
   col2   | col3 | col4 |   col5    |   col1   
----------+------+------+-----------+----------
 20000000 | b    |    1 | 350000000 | 10000000
 20000000 | z    |    1 |  20000000 | 20000000
(2 rows)

DELETE FROM mpp21090_xchange_pttab_dropcol_addcol_dml_int4 WHERE col3='b';
SELECT * FROM mpp21090_xchange_pttab_dropcol_addcol_dml_int4 ORDER BY 1,2,3;
   col2   | col3 | col4 |   col5   |   col1   
----------+------+------+----------+----------
 20000000 | z    |    1 | 20000000 | 20000000
(1 row)

-- DML on candidate table
INSERT INTO mpp21090_xchange_pttab_dropcol_addcol_dml_int4_candidate SELECT 10000000,'b', 1, 10000000, 10000000;
SELECT * FROM mpp21090_xchange_pttab_dropcol_addcol_dml_int4_candidate ORDER BY 1,2,3;
   col2   | col3 | col4 |   col5   |   col1   
----------+------+------+----------+----------
 10000000 | b    |    1 | 10000000 | 10000000
 20000000 | a    |    0 | 20000000 | 20000000
(2 rows)

UPDATE mpp21090_xchange_pttab_dropcol_addcol_dml_int4_candidate SET col2=20000000 WHERE col3='a';
SELECT * FROM mpp21090_xchange_pttab_dropcol_addcol_dml_int4_candidate ORDER BY 1,2,3;
   col2   | col3 | col4 |   col5   |   col1   
----------+------+------+----------+----------
 10000000 | b    |    1 | 10000000 | 10000000
 20000000 | a    |    0 | 20000000 | 20000000
(2 rows)

DELETE FROM mpp21090_xchange_pttab_dropcol_addcol_dml_int4_candidate WHERE col3='a';
SELECT * FROM mpp21090_xchange_pttab_dropcol_addcol_dml_int4_candidate ORDER BY 1,2,3;
   col2   | col3 | col4 |   col5   |   col1   
----------+------+------+----------+----------
 10000000 | b    |    1 | 10000000 | 10000000
(1 row)

-- TEST
DROP TABLE IF EXISTS mpp21090_xchange_pttab_dropcol_addcol_dml_int8;
NOTICE:  table "mpp21090_xchange_pttab_dropcol_addcol_dml_int8" does not exist, skipping
CREATE TABLE mpp21090_xchange_pttab_dropcol_addcol_dml_int8
(
    col1 int8,
    col2 int8,
    col3 char,
    col4 int,
    col5 int8
) 
DISTRIBUTED by (col1)
PARTITION BY RANGE(col2)(partition partone start(1) end(1000000000000000001)  WITH (APPENDONLY=true, COMPRESSLEVEL=5, ORIENTATION=column),partition parttwo start(1000000000000000001) end(2000000000000000001) WITH (APPENDONLY=true, COMPRESSLEVEL=5, ORIENTATION=row),partition partthree start(2000000000000000001) end(3000000000000000001));
NOTICE:  CREATE TABLE will create partition "mpp21090_xchange_pttab_dropcol_addcol_dml_int8_1_prt_partone" for table "mpp21090_xchange_pttab_dropcol_addcol_dml_int8"
NOTICE:  CREATE TABLE will create partition "mpp21090_xchange_pttab_dropcol_addcol_dml_int8_1_prt_parttwo" for table "mpp21090_xchange_pttab_dropcol_addcol_dml_int8"
NOTICE:  CREATE TABLE will create partition "mpp21090_xchange_pttab_dropcol_addcol_dml_int8_1_prt_partthree" for table "mpp21090_xchange_pttab_dropcol_addcol_dml_int8"
INSERT INTO mpp21090_xchange_pttab_dropcol_addcol_dml_int8 VALUES(200000000000000000,200000000000000000,'a',0, 200000000000000000);
SELECT * FROM mpp21090_xchange_pttab_dropcol_addcol_dml_int8 ORDER BY 1,2,3,4;
        col1        |        col2        | col3 | col4 |        col5        
--------------------+--------------------+------+------+--------------------
 200000000000000000 | 200000000000000000 | a    |    0 | 200000000000000000
(1 row)

ALTER TABLE mpp21090_xchange_pttab_dropcol_addcol_dml_int8 DROP COLUMN col1;
NOTICE:  Dropping a column that is part of the distribution policy forces a NULL distribution policy
NOTICE:  Dropping a column that is part of the distribution policy forces a NULL distribution policy
NOTICE:  Dropping a column that is part of the distribution policy forces a NULL distribution policy
NOTICE:  Dropping a column that is part of the distribution policy forces a NULL distribution policy
ALTER TABLE mpp21090_xchange_pttab_dropcol_addcol_dml_int8 ADD COLUMN col1 int8 DEFAULT 200000000000000000;
-- Create Candidate table for Exchange
DROP TABLE IF EXISTS mpp21090_xchange_pttab_dropcol_addcol_dml_int8_candidate;
NOTICE:  table "mpp21090_xchange_pttab_dropcol_addcol_dml_int8_candidate" does not exist, skipping
CREATE TABLE mpp21090_xchange_pttab_dropcol_addcol_dml_int8_candidate( like mpp21090_xchange_pttab_dropcol_addcol_dml_int8) distributed randomly;
INSERT INTO mpp21090_xchange_pttab_dropcol_addcol_dml_int8_candidate VALUES(200000000000000000,'z',1,200000000000000000,200000000000000000);
-- Exchange 
ALTER TABLE mpp21090_xchange_pttab_dropcol_addcol_dml_int8 EXCHANGE PARTITION FOR(500000000000000000) WITH TABLE mpp21090_xchange_pttab_dropcol_addcol_dml_int8_candidate;
NOTICE:  exchanged partition "partone" of relation "mpp21090_xchange_pttab_dropcol_addcol_dml_int8" with relation "mpp21090_xchange_pttab_dropcol_addcol_dml_int8_candidate"
SELECT * FROM mpp21090_xchange_pttab_dropcol_addcol_dml_int8 ORDER BY 1,2,3;
        col2        | col3 | col4 |        col5        |        col1        
--------------------+------+------+--------------------+--------------------
 200000000000000000 | z    |    1 | 200000000000000000 | 200000000000000000
(1 row)

SELECT * FROM mpp21090_xchange_pttab_dropcol_addcol_dml_int8_candidate ORDER BY 1,2,3;
        col2        | col3 | col4 |        col5        |        col1        
--------------------+------+------+--------------------+--------------------
 200000000000000000 | a    |    0 | 200000000000000000 | 200000000000000000
(1 row)

-- DML on partition table
INSERT INTO mpp21090_xchange_pttab_dropcol_addcol_dml_int8 SELECT  100000000000000000,'b', 1, 100000000000000000, 100000000000000000;
SELECT * FROM mpp21090_xchange_pttab_dropcol_addcol_dml_int8 ORDER BY 1,2,3;
        col2        | col3 | col4 |        col5        |        col1        
--------------------+------+------+--------------------+--------------------
 100000000000000000 | b    |    1 | 100000000000000000 | 100000000000000000
 200000000000000000 | z    |    1 | 200000000000000000 | 200000000000000000
(2 rows)

UPDATE mpp21090_xchange_pttab_dropcol_addcol_dml_int8 SET col5 = 3500000000000000000 WHERE col2 = 100000000000000000 AND col5 = 100000000000000000;
SELECT * FROM mpp21090_xchange_pttab_dropcol_addcol_dml_int8 ORDER BY 1,2,3;
        col2        | col3 | col4 |        col5         |        col1        
--------------------+------+------+---------------------+--------------------
 100000000000000000 | b    |    1 | 3500000000000000000 | 100000000000000000
 200000000000000000 | z    |    1 |  200000000000000000 | 200000000000000000
(2 rows)

UPDATE mpp21090_xchange_pttab_dropcol_addcol_dml_int8 SET col2 =200000000000000000 WHERE col3='b';
SELECT * FROM mpp21090_xchange_pttab_dropcol_addcol_dml_int8 ORDER BY 1,2,3;
        col2        | col3 | col4 |        col5         |        col1        
--------------------+------+------+---------------------+--------------------
 200000000000000000 | b    |    1 | 3500000000000000000 | 100000000000000000
 200000000000000000 | z    |    1 |  200000000000000000 | 200000000000000000
(2 rows)

DELETE FROM mpp21090_xchange_pttab_dropcol_addcol_dml_int8 WHERE col3='b';
SELECT * FROM mpp21090_xchange_pttab_dropcol_addcol_dml_int8 ORDER BY 1,2,3;
        col2        | col3 | col4 |        col5        |        col1        
--------------------+------+------+--------------------+--------------------
 200000000000000000 | z    |    1 | 200000000000000000 | 200000000000000000
(1 row)

-- DML on candidate table
INSERT INTO mpp21090_xchange_pttab_dropcol_addcol_dml_int8_candidate SELECT 100000000000000000,'b', 1, 100000000000000000, 100000000000000000;
SELECT * FROM mpp21090_xchange_pttab_dropcol_addcol_dml_int8_candidate ORDER BY 1,2,3;
        col2        | col3 | col4 |        col5        |        col1        
--------------------+------+------+--------------------+--------------------
 100000000000000000 | b    |    1 | 100000000000000000 | 100000000000000000
 200000000000000000 | a    |    0 | 200000000000000000 | 200000000000000000
(2 rows)

UPDATE mpp21090_xchange_pttab_dropcol_addcol_dml_int8_candidate SET col2=200000000000000000 WHERE col3='a';
SELECT * FROM mpp21090_xchange_pttab_dropcol_addcol_dml_int8_candidate ORDER BY 1,2,3;
        col2        | col3 | col4 |        col5        |        col1        
--------------------+------+------+--------------------+--------------------
 100000000000000000 | b    |    1 | 100000000000000000 | 100000000000000000
 200000000000000000 | a    |    0 | 200000000000000000 | 200000000000000000
(2 rows)

DELETE FROM mpp21090_xchange_pttab_dropcol_addcol_dml_int8_candidate WHERE col3='a';
SELECT * FROM mpp21090_xchange_pttab_dropcol_addcol_dml_int8_candidate ORDER BY 1,2,3;
        col2        | col3 | col4 |        col5        |        col1        
--------------------+------+------+--------------------+--------------------
 100000000000000000 | b    |    1 | 100000000000000000 | 100000000000000000
(1 row)

-- TEST
DROP TABLE IF EXISTS mpp21090_xchange_pttab_dropcol_addcol_dml_interval;
NOTICE:  table "mpp21090_xchange_pttab_dropcol_addcol_dml_interval" does not exist, skipping
CREATE TABLE mpp21090_xchange_pttab_dropcol_addcol_dml_interval
(
    col1 interval,
    col2 interval,
    col3 char,
    col4 int,
    col5 interval
) 
DISTRIBUTED by (col1)
PARTITION BY RANGE(col2)(partition partone start('1 sec') end('1 min')  WITH (APPENDONLY=true, COMPRESSLEVEL=5, ORIENTATION=column),partition parttwo start('1 min') end('1 hour') WITH (APPENDONLY=true, COMPRESSLEVEL=5, ORIENTATION=row),partition partthree start('1 hour') end('12 hours'));
NOTICE:  CREATE TABLE will create partition "mpp21090_xchange_pttab_dropcol_addcol_dml_interva_1_prt_partone" for table "mpp21090_xchange_pttab_dropcol_addcol_dml_interval"
NOTICE:  CREATE TABLE will create partition "mpp21090_xchange_pttab_dropcol_addcol_dml_interva_1_prt_parttwo" for table "mpp21090_xchange_pttab_dropcol_addcol_dml_interval"
NOTICE:  CREATE TABLE will create partition "mpp21090_xchange_pttab_dropcol_addcol_dml_inter_1_prt_partthree" for table "mpp21090_xchange_pttab_dropcol_addcol_dml_interval"
INSERT INTO mpp21090_xchange_pttab_dropcol_addcol_dml_interval VALUES('10 secs','10 secs','a',0, '10 secs');
SELECT * FROM mpp21090_xchange_pttab_dropcol_addcol_dml_interval ORDER BY 1,2,3,4;
   col1   |   col2   | col3 | col4 |   col5   
----------+----------+------+------+----------
 00:00:10 | 00:00:10 | a    |    0 | 00:00:10
(1 row)

ALTER TABLE mpp21090_xchange_pttab_dropcol_addcol_dml_interval DROP COLUMN col1;
NOTICE:  Dropping a column that is part of the distribution policy forces a NULL distribution policy
NOTICE:  Dropping a column that is part of the distribution policy forces a NULL distribution policy
NOTICE:  Dropping a column that is part of the distribution policy forces a NULL distribution policy
NOTICE:  Dropping a column that is part of the distribution policy forces a NULL distribution policy
ALTER TABLE mpp21090_xchange_pttab_dropcol_addcol_dml_interval ADD COLUMN col1 interval DEFAULT '10 secs';
-- Create Candidate table for Exchange
DROP TABLE IF EXISTS mpp21090_xchange_pttab_dropcol_addcol_dml_interval_candidate;
NOTICE:  table "mpp21090_xchange_pttab_dropcol_addcol_dml_interval_candidate" does not exist, skipping
CREATE TABLE mpp21090_xchange_pttab_dropcol_addcol_dml_interval_candidate( like mpp21090_xchange_pttab_dropcol_addcol_dml_interval) distributed randomly;
INSERT INTO mpp21090_xchange_pttab_dropcol_addcol_dml_interval_candidate VALUES('10 secs','z',1,'10 secs','10 secs');
-- Exchange 
ALTER TABLE mpp21090_xchange_pttab_dropcol_addcol_dml_interval EXCHANGE PARTITION FOR('30 secs') WITH TABLE mpp21090_xchange_pttab_dropcol_addcol_dml_interval_candidate;
NOTICE:  exchanged partition "partone" of relation "mpp21090_xchange_pttab_dropcol_addcol_dml_interval" with relation "mpp21090_xchange_pttab_dropcol_addcol_dml_interval_candidate"
SELECT * FROM mpp21090_xchange_pttab_dropcol_addcol_dml_interval ORDER BY 1,2,3;
   col2   | col3 | col4 |   col5   |   col1   
----------+------+------+----------+----------
 00:00:10 | z    |    1 | 00:00:10 | 00:00:10
(1 row)

SELECT * FROM mpp21090_xchange_pttab_dropcol_addcol_dml_interval_candidate ORDER BY 1,2,3;
   col2   | col3 | col4 |   col5   |   col1   
----------+------+------+----------+----------
 00:00:10 | a    |    0 | 00:00:10 | 00:00:10
(1 row)

-- DML on partition table
INSERT INTO mpp21090_xchange_pttab_dropcol_addcol_dml_interval SELECT  '1 sec','b', 1, '1 sec', '1 sec';
SELECT * FROM mpp21090_xchange_pttab_dropcol_addcol_dml_interval ORDER BY 1,2,3;
   col2   | col3 | col4 |   col5   |   col1   
----------+------+------+----------+----------
 00:00:01 | b    |    1 | 00:00:01 | 00:00:01
 00:00:10 | z    |    1 | 00:00:10 | 00:00:10
(2 rows)

UPDATE mpp21090_xchange_pttab_dropcol_addcol_dml_interval SET col5 = '14 hours' WHERE col2 = '1 sec' AND col5 = '1 sec';
SELECT * FROM mpp21090_xchange_pttab_dropcol_addcol_dml_interval ORDER BY 1,2,3;
   col2   | col3 | col4 |   col5   |   col1   
----------+------+------+----------+----------
 00:00:01 | b    |    1 | 14:00:00 | 00:00:01
 00:00:10 | z    |    1 | 00:00:10 | 00:00:10
(2 rows)

UPDATE mpp21090_xchange_pttab_dropcol_addcol_dml_interval SET col2 ='10 secs' WHERE col3='b';
SELECT * FROM mpp21090_xchange_pttab_dropcol_addcol_dml_interval ORDER BY 1,2,3;
   col2   | col3 | col4 |   col5   |   col1   
----------+------+------+----------+----------
 00:00:10 | b    |    1 | 14:00:00 | 00:00:01
 00:00:10 | z    |    1 | 00:00:10 | 00:00:10
(2 rows)

DELETE FROM mpp21090_xchange_pttab_dropcol_addcol_dml_interval WHERE col3='b';
SELECT * FROM mpp21090_xchange_pttab_dropcol_addcol_dml_interval ORDER BY 1,2,3;
   col2   | col3 | col4 |   col5   |   col1   
----------+------+------+----------+----------
 00:00:10 | z    |    1 | 00:00:10 | 00:00:10
(1 row)

-- DML on candidate table
INSERT INTO mpp21090_xchange_pttab_dropcol_addcol_dml_interval_candidate SELECT '1 sec','b', 1, '1 sec', '1 sec';
SELECT * FROM mpp21090_xchange_pttab_dropcol_addcol_dml_interval_candidate ORDER BY 1,2,3;
   col2   | col3 | col4 |   col5   |   col1   
----------+------+------+----------+----------
 00:00:01 | b    |    1 | 00:00:01 | 00:00:01
 00:00:10 | a    |    0 | 00:00:10 | 00:00:10
(2 rows)

UPDATE mpp21090_xchange_pttab_dropcol_addcol_dml_interval_candidate SET col2='10 secs' WHERE col3='a';
SELECT * FROM mpp21090_xchange_pttab_dropcol_addcol_dml_interval_candidate ORDER BY 1,2,3;
   col2   | col3 | col4 |   col5   |   col1   
----------+------+------+----------+----------
 00:00:01 | b    |    1 | 00:00:01 | 00:00:01
 00:00:10 | a    |    0 | 00:00:10 | 00:00:10
(2 rows)

DELETE FROM mpp21090_xchange_pttab_dropcol_addcol_dml_interval_candidate WHERE col3='a';
SELECT * FROM mpp21090_xchange_pttab_dropcol_addcol_dml_interval_candidate ORDER BY 1,2,3;
   col2   | col3 | col4 |   col5   |   col1   
----------+------+------+----------+----------
 00:00:01 | b    |    1 | 00:00:01 | 00:00:01
(1 row)

-- TEST
DROP TABLE IF EXISTS mpp21090_xchange_pttab_dropcol_addcol_dml_numeric;
NOTICE:  table "mpp21090_xchange_pttab_dropcol_addcol_dml_numeric" does not exist, skipping
CREATE TABLE mpp21090_xchange_pttab_dropcol_addcol_dml_numeric
(
    col1 numeric,
    col2 numeric,
    col3 char,
    col4 int,
    col5 numeric
) 
DISTRIBUTED by (col1)
PARTITION BY RANGE(col2)(partition partone start(1.000000) end(10.000000)  WITH (APPENDONLY=true, COMPRESSLEVEL=5, ORIENTATION=column),partition parttwo start(10.000000) end(20.000000) WITH (APPENDONLY=true, COMPRESSLEVEL=5, ORIENTATION=row),partition partthree start(20.000000) end(30.000000));
NOTICE:  CREATE TABLE will create partition "mpp21090_xchange_pttab_dropcol_addcol_dml_numeric_1_prt_partone" for table "mpp21090_xchange_pttab_dropcol_addcol_dml_numeric"
NOTICE:  CREATE TABLE will create partition "mpp21090_xchange_pttab_dropcol_addcol_dml_numeric_1_prt_parttwo" for table "mpp21090_xchange_pttab_dropcol_addcol_dml_numeric"
NOTICE:  CREATE TABLE will create partition "mpp21090_xchange_pttab_dropcol_addcol_dml_numer_1_prt_partthree" for table "mpp21090_xchange_pttab_dropcol_addcol_dml_numeric"
INSERT INTO mpp21090_xchange_pttab_dropcol_addcol_dml_numeric VALUES(2.000000,2.000000,'a',0, 2.000000);
SELECT * FROM mpp21090_xchange_pttab_dropcol_addcol_dml_numeric ORDER BY 1,2,3,4;
   col1   |   col2   | col3 | col4 |   col5   
----------+----------+------+------+----------
 2.000000 | 2.000000 | a    |    0 | 2.000000
(1 row)

ALTER TABLE mpp21090_xchange_pttab_dropcol_addcol_dml_numeric DROP COLUMN col1;
NOTICE:  Dropping a column that is part of the distribution policy forces a NULL distribution policy
NOTICE:  Dropping a column that is part of the distribution policy forces a NULL distribution policy
NOTICE:  Dropping a column that is part of the distribution policy forces a NULL distribution policy
NOTICE:  Dropping a column that is part of the distribution policy forces a NULL distribution policy
ALTER TABLE mpp21090_xchange_pttab_dropcol_addcol_dml_numeric ADD COLUMN col1 numeric DEFAULT 2.000000;
-- Create Candidate table for Exchange
DROP TABLE IF EXISTS mpp21090_xchange_pttab_dropcol_addcol_dml_numeric_candidate;
NOTICE:  table "mpp21090_xchange_pttab_dropcol_addcol_dml_numeric_candidate" does not exist, skipping
CREATE TABLE mpp21090_xchange_pttab_dropcol_addcol_dml_numeric_candidate( like mpp21090_xchange_pttab_dropcol_addcol_dml_numeric) distributed randomly;
INSERT INTO mpp21090_xchange_pttab_dropcol_addcol_dml_numeric_candidate VALUES(2.000000,'z',1,2.000000,2.000000);
-- Exchange 
ALTER TABLE mpp21090_xchange_pttab_dropcol_addcol_dml_numeric EXCHANGE PARTITION FOR(5.000000) WITH TABLE mpp21090_xchange_pttab_dropcol_addcol_dml_numeric_candidate;
NOTICE:  exchanged partition "partone" of relation "mpp21090_xchange_pttab_dropcol_addcol_dml_numeric" with relation "mpp21090_xchange_pttab_dropcol_addcol_dml_numeric_candidate"
SELECT * FROM mpp21090_xchange_pttab_dropcol_addcol_dml_numeric ORDER BY 1,2,3;
   col2   | col3 | col4 |   col5   |   col1   
----------+------+------+----------+----------
 2.000000 | z    |    1 | 2.000000 | 2.000000
(1 row)

SELECT * FROM mpp21090_xchange_pttab_dropcol_addcol_dml_numeric_candidate ORDER BY 1,2,3;
   col2   | col3 | col4 |   col5   |   col1   
----------+------+------+----------+----------
 2.000000 | a    |    0 | 2.000000 | 2.000000
(1 row)

-- DML on partition table
INSERT INTO mpp21090_xchange_pttab_dropcol_addcol_dml_numeric SELECT  1.000000,'b', 1, 1.000000, 1.000000;
SELECT * FROM mpp21090_xchange_pttab_dropcol_addcol_dml_numeric ORDER BY 1,2,3;
   col2   | col3 | col4 |   col5   |   col1   
----------+------+------+----------+----------
 1.000000 | b    |    1 | 1.000000 | 1.000000
 2.000000 | z    |    1 | 2.000000 | 2.000000
(2 rows)

UPDATE mpp21090_xchange_pttab_dropcol_addcol_dml_numeric SET col5 = 35.000000 WHERE col2 = 1.000000 AND col5 = 1.000000;
SELECT * FROM mpp21090_xchange_pttab_dropcol_addcol_dml_numeric ORDER BY 1,2,3;
   col2   | col3 | col4 |   col5    |   col1   
----------+------+------+-----------+----------
 1.000000 | b    |    1 | 35.000000 | 1.000000
 2.000000 | z    |    1 |  2.000000 | 2.000000
(2 rows)

UPDATE mpp21090_xchange_pttab_dropcol_addcol_dml_numeric SET col2 =2.000000 WHERE col3='b';
SELECT * FROM mpp21090_xchange_pttab_dropcol_addcol_dml_numeric ORDER BY 1,2,3;
   col2   | col3 | col4 |   col5    |   col1   
----------+------+------+-----------+----------
 2.000000 | b    |    1 | 35.000000 | 1.000000
 2.000000 | z    |    1 |  2.000000 | 2.000000
(2 rows)

DELETE FROM mpp21090_xchange_pttab_dropcol_addcol_dml_numeric WHERE col3='b';
SELECT * FROM mpp21090_xchange_pttab_dropcol_addcol_dml_numeric ORDER BY 1,2,3;
   col2   | col3 | col4 |   col5   |   col1   
----------+------+------+----------+----------
 2.000000 | z    |    1 | 2.000000 | 2.000000
(1 row)

-- DML on candidate table
INSERT INTO mpp21090_xchange_pttab_dropcol_addcol_dml_numeric_candidate SELECT 1.000000,'b', 1, 1.000000, 1.000000;
SELECT * FROM mpp21090_xchange_pttab_dropcol_addcol_dml_numeric_candidate ORDER BY 1,2,3;
   col2   | col3 | col4 |   col5   |   col1   
----------+------+------+----------+----------
 1.000000 | b    |    1 | 1.000000 | 1.000000
 2.000000 | a    |    0 | 2.000000 | 2.000000
(2 rows)

UPDATE mpp21090_xchange_pttab_dropcol_addcol_dml_numeric_candidate SET col2=2.000000 WHERE col3='a';
SELECT * FROM mpp21090_xchange_pttab_dropcol_addcol_dml_numeric_candidate ORDER BY 1,2,3;
   col2   | col3 | col4 |   col5   |   col1   
----------+------+------+----------+----------
 1.000000 | b    |    1 | 1.000000 | 1.000000
 2.000000 | a    |    0 | 2.000000 | 2.000000
(2 rows)

DELETE FROM mpp21090_xchange_pttab_dropcol_addcol_dml_numeric_candidate WHERE col3='a';
SELECT * FROM mpp21090_xchange_pttab_dropcol_addcol_dml_numeric_candidate ORDER BY 1,2,3;
   col2   | col3 | col4 |   col5   |   col1   
----------+------+------+----------+----------
 1.000000 | b    |    1 | 1.000000 | 1.000000
(1 row)

-- TEST
DROP TABLE IF EXISTS mpp21090_xchange_pttab_dropcol_dml_char;
NOTICE:  table "mpp21090_xchange_pttab_dropcol_dml_char" does not exist, skipping
CREATE TABLE mpp21090_xchange_pttab_dropcol_dml_char
(
    col1 char,
    col2 char,
    col3 char,
    col4 int,
    col5 char
) 
DISTRIBUTED by (col1)
PARTITION BY LIST(col2)(partition partone VALUES('a','b','c','d','e','f','g','h') WITH (APPENDONLY=true, COMPRESSLEVEL=5, ORIENTATION=column),partition parttwo VALUES('i','j','k','l','m','n','o','p') WITH (APPENDONLY=true, COMPRESSLEVEL=5, ORIENTATION=row),partition partthree VALUES('q','r','s','t','u','v','w','x'));
NOTICE:  CREATE TABLE will create partition "mpp21090_xchange_pttab_dropcol_dml_char_1_prt_partone" for table "mpp21090_xchange_pttab_dropcol_dml_char"
NOTICE:  CREATE TABLE will create partition "mpp21090_xchange_pttab_dropcol_dml_char_1_prt_parttwo" for table "mpp21090_xchange_pttab_dropcol_dml_char"
NOTICE:  CREATE TABLE will create partition "mpp21090_xchange_pttab_dropcol_dml_char_1_prt_partthree" for table "mpp21090_xchange_pttab_dropcol_dml_char"
INSERT INTO mpp21090_xchange_pttab_dropcol_dml_char VALUES('g','g','a',0, 'g');
SELECT * FROM mpp21090_xchange_pttab_dropcol_dml_char ORDER BY 1,2,3,4;
 col1 | col2 | col3 | col4 | col5 
------+------+------+------+------
 g    | g    | a    |    0 | g
(1 row)

ALTER TABLE mpp21090_xchange_pttab_dropcol_dml_char DROP COLUMN col1;
NOTICE:  Dropping a column that is part of the distribution policy forces a NULL distribution policy
NOTICE:  Dropping a column that is part of the distribution policy forces a NULL distribution policy
NOTICE:  Dropping a column that is part of the distribution policy forces a NULL distribution policy
NOTICE:  Dropping a column that is part of the distribution policy forces a NULL distribution policy
-- Create Candidate table for Exchange
DROP TABLE IF EXISTS mpp21090_xchange_pttab_dropcol_dml_char_candidate;
NOTICE:  table "mpp21090_xchange_pttab_dropcol_dml_char_candidate" does not exist, skipping
CREATE TABLE mpp21090_xchange_pttab_dropcol_dml_char_candidate( like mpp21090_xchange_pttab_dropcol_dml_char) distributed randomly;
INSERT INTO mpp21090_xchange_pttab_dropcol_dml_char_candidate VALUES('g','z',1,'g');
-- Exchange 
ALTER TABLE mpp21090_xchange_pttab_dropcol_dml_char EXCHANGE PARTITION FOR('d') WITH TABLE mpp21090_xchange_pttab_dropcol_dml_char_candidate;
NOTICE:  exchanged partition "partone" of relation "mpp21090_xchange_pttab_dropcol_dml_char" with relation "mpp21090_xchange_pttab_dropcol_dml_char_candidate"
SELECT * FROM mpp21090_xchange_pttab_dropcol_dml_char ORDER BY 1,2,3;
 col2 | col3 | col4 | col5 
------+------+------+------
 g    | z    |    1 | g
(1 row)

SELECT * FROM mpp21090_xchange_pttab_dropcol_dml_char_candidate ORDER BY 1,2,3;
 col2 | col3 | col4 | col5 
------+------+------+------
 g    | a    |    0 | g
(1 row)

-- DML on partition table
INSERT INTO mpp21090_xchange_pttab_dropcol_dml_char SELECT  'a','b', 1, 'a';
SELECT * FROM mpp21090_xchange_pttab_dropcol_dml_char ORDER BY 1,2,3;
 col2 | col3 | col4 | col5 
------+------+------+------
 a    | b    |    1 | a
 g    | z    |    1 | g
(2 rows)

UPDATE mpp21090_xchange_pttab_dropcol_dml_char SET col5 = 'z' WHERE col2 = 'a' AND col5 = 'a';
SELECT * FROM mpp21090_xchange_pttab_dropcol_dml_char ORDER BY 1,2,3;
 col2 | col3 | col4 | col5 
------+------+------+------
 a    | b    |    1 | z
 g    | z    |    1 | g
(2 rows)

UPDATE mpp21090_xchange_pttab_dropcol_dml_char SET col2 ='g' WHERE col3='b';
SELECT * FROM mpp21090_xchange_pttab_dropcol_dml_char ORDER BY 1,2,3;
 col2 | col3 | col4 | col5 
------+------+------+------
 g    | b    |    1 | z
 g    | z    |    1 | g
(2 rows)

DELETE FROM mpp21090_xchange_pttab_dropcol_dml_char WHERE col3='b';
SELECT * FROM mpp21090_xchange_pttab_dropcol_dml_char ORDER BY 1,2,3;
 col2 | col3 | col4 | col5 
------+------+------+------
 g    | z    |    1 | g
(1 row)

-- DML on candidate table
INSERT INTO mpp21090_xchange_pttab_dropcol_dml_char_candidate SELECT 'a','b', 1, 'a';
SELECT * FROM mpp21090_xchange_pttab_dropcol_dml_char_candidate ORDER BY 1,2,3;
 col2 | col3 | col4 | col5 
------+------+------+------
 a    | b    |    1 | a
 g    | a    |    0 | g
(2 rows)

UPDATE mpp21090_xchange_pttab_dropcol_dml_char_candidate SET col2='g' WHERE col3='a';
SELECT * FROM mpp21090_xchange_pttab_dropcol_dml_char_candidate ORDER BY 1,2,3;
 col2 | col3 | col4 | col5 
------+------+------+------
 a    | b    |    1 | a
 g    | a    |    0 | g
(2 rows)

DELETE FROM mpp21090_xchange_pttab_dropcol_dml_char_candidate WHERE col3='a';
SELECT * FROM mpp21090_xchange_pttab_dropcol_dml_char_candidate ORDER BY 1,2,3;
 col2 | col3 | col4 | col5 
------+------+------+------
 a    | b    |    1 | a
(1 row)

-- TEST
DROP TABLE IF EXISTS mpp21090_xchange_pttab_dropcol_dml_decimal;
NOTICE:  table "mpp21090_xchange_pttab_dropcol_dml_decimal" does not exist, skipping
CREATE TABLE mpp21090_xchange_pttab_dropcol_dml_decimal
(
    col1 decimal,
    col2 decimal,
    col3 char,
    col4 int,
    col5 decimal
) 
DISTRIBUTED by (col1)
PARTITION BY RANGE(col2)(partition partone start(1.00) end(10.00)  WITH (APPENDONLY=true, COMPRESSLEVEL=5, ORIENTATION=column),partition parttwo start(10.00) end(20.00) WITH (APPENDONLY=true, COMPRESSLEVEL=5, ORIENTATION=row),partition partthree start(20.00) end(30.00));
NOTICE:  CREATE TABLE will create partition "mpp21090_xchange_pttab_dropcol_dml_decimal_1_prt_partone" for table "mpp21090_xchange_pttab_dropcol_dml_decimal"
NOTICE:  CREATE TABLE will create partition "mpp21090_xchange_pttab_dropcol_dml_decimal_1_prt_parttwo" for table "mpp21090_xchange_pttab_dropcol_dml_decimal"
NOTICE:  CREATE TABLE will create partition "mpp21090_xchange_pttab_dropcol_dml_decimal_1_prt_partthree" for table "mpp21090_xchange_pttab_dropcol_dml_decimal"
INSERT INTO mpp21090_xchange_pttab_dropcol_dml_decimal VALUES(2.00,2.00,'a',0, 2.00);
SELECT * FROM mpp21090_xchange_pttab_dropcol_dml_decimal ORDER BY 1,2,3,4;
 col1 | col2 | col3 | col4 | col5 
------+------+------+------+------
 2.00 | 2.00 | a    |    0 | 2.00
(1 row)

ALTER TABLE mpp21090_xchange_pttab_dropcol_dml_decimal DROP COLUMN col1;
NOTICE:  Dropping a column that is part of the distribution policy forces a NULL distribution policy
NOTICE:  Dropping a column that is part of the distribution policy forces a NULL distribution policy
NOTICE:  Dropping a column that is part of the distribution policy forces a NULL distribution policy
NOTICE:  Dropping a column that is part of the distribution policy forces a NULL distribution policy
-- Create Candidate table for Exchange
DROP TABLE IF EXISTS mpp21090_xchange_pttab_dropcol_dml_decimal_candidate;
NOTICE:  table "mpp21090_xchange_pttab_dropcol_dml_decimal_candidate" does not exist, skipping
CREATE TABLE mpp21090_xchange_pttab_dropcol_dml_decimal_candidate( like mpp21090_xchange_pttab_dropcol_dml_decimal) distributed randomly;
INSERT INTO mpp21090_xchange_pttab_dropcol_dml_decimal_candidate VALUES(2.00,'z',1,2.00);
-- Exchange 
ALTER TABLE mpp21090_xchange_pttab_dropcol_dml_decimal EXCHANGE PARTITION FOR(5.00) WITH TABLE mpp21090_xchange_pttab_dropcol_dml_decimal_candidate;
NOTICE:  exchanged partition "partone" of relation "mpp21090_xchange_pttab_dropcol_dml_decimal" with relation "mpp21090_xchange_pttab_dropcol_dml_decimal_candidate"
SELECT * FROM mpp21090_xchange_pttab_dropcol_dml_decimal ORDER BY 1,2,3;
 col2 | col3 | col4 | col5 
------+------+------+------
 2.00 | z    |    1 | 2.00
(1 row)

SELECT * FROM mpp21090_xchange_pttab_dropcol_dml_decimal_candidate ORDER BY 1,2,3;
 col2 | col3 | col4 | col5 
------+------+------+------
 2.00 | a    |    0 | 2.00
(1 row)

-- DML on partition table
INSERT INTO mpp21090_xchange_pttab_dropcol_dml_decimal SELECT  1.00,'b', 1, 1.00;
SELECT * FROM mpp21090_xchange_pttab_dropcol_dml_decimal ORDER BY 1,2,3;
 col2 | col3 | col4 | col5 
------+------+------+------
 1.00 | b    |    1 | 1.00
 2.00 | z    |    1 | 2.00
(2 rows)

UPDATE mpp21090_xchange_pttab_dropcol_dml_decimal SET col5 = 35.00 WHERE col2 = 1.00 AND col5 = 1.00;
SELECT * FROM mpp21090_xchange_pttab_dropcol_dml_decimal ORDER BY 1,2,3;
 col2 | col3 | col4 | col5  
------+------+------+-------
 1.00 | b    |    1 | 35.00
 2.00 | z    |    1 |  2.00
(2 rows)

UPDATE mpp21090_xchange_pttab_dropcol_dml_decimal SET col2 =2.00 WHERE col3='b';
SELECT * FROM mpp21090_xchange_pttab_dropcol_dml_decimal ORDER BY 1,2,3;
 col2 | col3 | col4 | col5  
------+------+------+-------
 2.00 | b    |    1 | 35.00
 2.00 | z    |    1 |  2.00
(2 rows)

DELETE FROM mpp21090_xchange_pttab_dropcol_dml_decimal WHERE col3='b';
SELECT * FROM mpp21090_xchange_pttab_dropcol_dml_decimal ORDER BY 1,2,3;
 col2 | col3 | col4 | col5 
------+------+------+------
 2.00 | z    |    1 | 2.00
(1 row)

-- DML on candidate table
INSERT INTO mpp21090_xchange_pttab_dropcol_dml_decimal_candidate SELECT 1.00,'b', 1, 1.00;
SELECT * FROM mpp21090_xchange_pttab_dropcol_dml_decimal_candidate ORDER BY 1,2,3;
 col2 | col3 | col4 | col5 
------+------+------+------
 1.00 | b    |    1 | 1.00
 2.00 | a    |    0 | 2.00
(2 rows)

UPDATE mpp21090_xchange_pttab_dropcol_dml_decimal_candidate SET col2=2.00 WHERE col3='a';
SELECT * FROM mpp21090_xchange_pttab_dropcol_dml_decimal_candidate ORDER BY 1,2,3;
 col2 | col3 | col4 | col5 
------+------+------+------
 1.00 | b    |    1 | 1.00
 2.00 | a    |    0 | 2.00
(2 rows)

DELETE FROM mpp21090_xchange_pttab_dropcol_dml_decimal_candidate WHERE col3='a';
SELECT * FROM mpp21090_xchange_pttab_dropcol_dml_decimal_candidate ORDER BY 1,2,3;
 col2 | col3 | col4 | col5 
------+------+------+------
 1.00 | b    |    1 | 1.00
(1 row)

-- TEST
DROP TABLE IF EXISTS mpp21090_xchange_pttab_dropcol_dml_int4;
NOTICE:  table "mpp21090_xchange_pttab_dropcol_dml_int4" does not exist, skipping
CREATE TABLE mpp21090_xchange_pttab_dropcol_dml_int4
(
    col1 int4,
    col2 int4,
    col3 char,
    col4 int,
    col5 int4
) 
DISTRIBUTED by (col1)
PARTITION BY RANGE(col2)(partition partone start(1) end(100000001)  WITH (APPENDONLY=true, COMPRESSLEVEL=5, ORIENTATION=column),partition parttwo start(100000001) end(200000001) WITH (APPENDONLY=true, COMPRESSLEVEL=5, ORIENTATION=row),partition partthree start(200000001) end(300000001));
NOTICE:  CREATE TABLE will create partition "mpp21090_xchange_pttab_dropcol_dml_int4_1_prt_partone" for table "mpp21090_xchange_pttab_dropcol_dml_int4"
NOTICE:  CREATE TABLE will create partition "mpp21090_xchange_pttab_dropcol_dml_int4_1_prt_parttwo" for table "mpp21090_xchange_pttab_dropcol_dml_int4"
NOTICE:  CREATE TABLE will create partition "mpp21090_xchange_pttab_dropcol_dml_int4_1_prt_partthree" for table "mpp21090_xchange_pttab_dropcol_dml_int4"
INSERT INTO mpp21090_xchange_pttab_dropcol_dml_int4 VALUES(20000000,20000000,'a',0, 20000000);
SELECT * FROM mpp21090_xchange_pttab_dropcol_dml_int4 ORDER BY 1,2,3,4;
   col1   |   col2   | col3 | col4 |   col5   
----------+----------+------+------+----------
 20000000 | 20000000 | a    |    0 | 20000000
(1 row)

ALTER TABLE mpp21090_xchange_pttab_dropcol_dml_int4 DROP COLUMN col1;
NOTICE:  Dropping a column that is part of the distribution policy forces a NULL distribution policy
NOTICE:  Dropping a column that is part of the distribution policy forces a NULL distribution policy
NOTICE:  Dropping a column that is part of the distribution policy forces a NULL distribution policy
NOTICE:  Dropping a column that is part of the distribution policy forces a NULL distribution policy
-- Create Candidate table for Exchange
DROP TABLE IF EXISTS mpp21090_xchange_pttab_dropcol_dml_int4_candidate;
NOTICE:  table "mpp21090_xchange_pttab_dropcol_dml_int4_candidate" does not exist, skipping
CREATE TABLE mpp21090_xchange_pttab_dropcol_dml_int4_candidate( like mpp21090_xchange_pttab_dropcol_dml_int4) distributed randomly;
INSERT INTO mpp21090_xchange_pttab_dropcol_dml_int4_candidate VALUES(20000000,'z',1,20000000);
-- Exchange 
ALTER TABLE mpp21090_xchange_pttab_dropcol_dml_int4 EXCHANGE PARTITION FOR(50000000) WITH TABLE mpp21090_xchange_pttab_dropcol_dml_int4_candidate;
NOTICE:  exchanged partition "partone" of relation "mpp21090_xchange_pttab_dropcol_dml_int4" with relation "mpp21090_xchange_pttab_dropcol_dml_int4_candidate"
SELECT * FROM mpp21090_xchange_pttab_dropcol_dml_int4 ORDER BY 1,2,3;
   col2   | col3 | col4 |   col5   
----------+------+------+----------
 20000000 | z    |    1 | 20000000
(1 row)

SELECT * FROM mpp21090_xchange_pttab_dropcol_dml_int4_candidate ORDER BY 1,2,3;
   col2   | col3 | col4 |   col5   
----------+------+------+----------
 20000000 | a    |    0 | 20000000
(1 row)

-- DML on partition table
INSERT INTO mpp21090_xchange_pttab_dropcol_dml_int4 SELECT  10000000,'b', 1, 10000000;
SELECT * FROM mpp21090_xchange_pttab_dropcol_dml_int4 ORDER BY 1,2,3;
   col2   | col3 | col4 |   col5   
----------+------+------+----------
 10000000 | b    |    1 | 10000000
 20000000 | z    |    1 | 20000000
(2 rows)

UPDATE mpp21090_xchange_pttab_dropcol_dml_int4 SET col5 = 350000000 WHERE col2 = 10000000 AND col5 = 10000000;
SELECT * FROM mpp21090_xchange_pttab_dropcol_dml_int4 ORDER BY 1,2,3;
   col2   | col3 | col4 |   col5    
----------+------+------+-----------
 10000000 | b    |    1 | 350000000
 20000000 | z    |    1 |  20000000
(2 rows)

UPDATE mpp21090_xchange_pttab_dropcol_dml_int4 SET col2 =20000000 WHERE col3='b';
SELECT * FROM mpp21090_xchange_pttab_dropcol_dml_int4 ORDER BY 1,2,3;
   col2   | col3 | col4 |   col5    
----------+------+------+-----------
 20000000 | b    |    1 | 350000000
 20000000 | z    |    1 |  20000000
(2 rows)

DELETE FROM mpp21090_xchange_pttab_dropcol_dml_int4 WHERE col3='b';
SELECT * FROM mpp21090_xchange_pttab_dropcol_dml_int4 ORDER BY 1,2,3;
   col2   | col3 | col4 |   col5   
----------+------+------+----------
 20000000 | z    |    1 | 20000000
(1 row)

-- DML on candidate table
INSERT INTO mpp21090_xchange_pttab_dropcol_dml_int4_candidate SELECT 10000000,'b', 1, 10000000;
SELECT * FROM mpp21090_xchange_pttab_dropcol_dml_int4_candidate ORDER BY 1,2,3;
   col2   | col3 | col4 |   col5   
----------+------+------+----------
 10000000 | b    |    1 | 10000000
 20000000 | a    |    0 | 20000000
(2 rows)

UPDATE mpp21090_xchange_pttab_dropcol_dml_int4_candidate SET col2=20000000 WHERE col3='a';
SELECT * FROM mpp21090_xchange_pttab_dropcol_dml_int4_candidate ORDER BY 1,2,3;
   col2   | col3 | col4 |   col5   
----------+------+------+----------
 10000000 | b    |    1 | 10000000
 20000000 | a    |    0 | 20000000
(2 rows)

DELETE FROM mpp21090_xchange_pttab_dropcol_dml_int4_candidate WHERE col3='a';
SELECT * FROM mpp21090_xchange_pttab_dropcol_dml_int4_candidate ORDER BY 1,2,3;
   col2   | col3 | col4 |   col5   
----------+------+------+----------
 10000000 | b    |    1 | 10000000
(1 row)

-- TEST
DROP TABLE IF EXISTS mpp21090_xchange_pttab_dropcol_dml_int8;
NOTICE:  table "mpp21090_xchange_pttab_dropcol_dml_int8" does not exist, skipping
CREATE TABLE mpp21090_xchange_pttab_dropcol_dml_int8
(
    col1 int8,
    col2 int8,
    col3 char,
    col4 int,
    col5 int8
) 
DISTRIBUTED by (col1)
PARTITION BY RANGE(col2)(partition partone start(1) end(1000000000000000001)  WITH (APPENDONLY=true, COMPRESSLEVEL=5, ORIENTATION=column),partition parttwo start(1000000000000000001) end(2000000000000000001) WITH (APPENDONLY=true, COMPRESSLEVEL=5, ORIENTATION=row),partition partthree start(2000000000000000001) end(3000000000000000001));
NOTICE:  CREATE TABLE will create partition "mpp21090_xchange_pttab_dropcol_dml_int8_1_prt_partone" for table "mpp21090_xchange_pttab_dropcol_dml_int8"
NOTICE:  CREATE TABLE will create partition "mpp21090_xchange_pttab_dropcol_dml_int8_1_prt_parttwo" for table "mpp21090_xchange_pttab_dropcol_dml_int8"
NOTICE:  CREATE TABLE will create partition "mpp21090_xchange_pttab_dropcol_dml_int8_1_prt_partthree" for table "mpp21090_xchange_pttab_dropcol_dml_int8"
INSERT INTO mpp21090_xchange_pttab_dropcol_dml_int8 VALUES(200000000000000000,200000000000000000,'a',0, 200000000000000000);
SELECT * FROM mpp21090_xchange_pttab_dropcol_dml_int8 ORDER BY 1,2,3,4;
        col1        |        col2        | col3 | col4 |        col5        
--------------------+--------------------+------+------+--------------------
 200000000000000000 | 200000000000000000 | a    |    0 | 200000000000000000
(1 row)

ALTER TABLE mpp21090_xchange_pttab_dropcol_dml_int8 DROP COLUMN col1;
NOTICE:  Dropping a column that is part of the distribution policy forces a NULL distribution policy
NOTICE:  Dropping a column that is part of the distribution policy forces a NULL distribution policy
NOTICE:  Dropping a column that is part of the distribution policy forces a NULL distribution policy
NOTICE:  Dropping a column that is part of the distribution policy forces a NULL distribution policy
-- Create Candidate table for Exchange
DROP TABLE IF EXISTS mpp21090_xchange_pttab_dropcol_dml_int8_candidate;
NOTICE:  table "mpp21090_xchange_pttab_dropcol_dml_int8_candidate" does not exist, skipping
CREATE TABLE mpp21090_xchange_pttab_dropcol_dml_int8_candidate( like mpp21090_xchange_pttab_dropcol_dml_int8) distributed randomly;
INSERT INTO mpp21090_xchange_pttab_dropcol_dml_int8_candidate VALUES(200000000000000000,'z',1,200000000000000000);
-- Exchange 
ALTER TABLE mpp21090_xchange_pttab_dropcol_dml_int8 EXCHANGE PARTITION FOR(500000000000000000) WITH TABLE mpp21090_xchange_pttab_dropcol_dml_int8_candidate;
NOTICE:  exchanged partition "partone" of relation "mpp21090_xchange_pttab_dropcol_dml_int8" with relation "mpp21090_xchange_pttab_dropcol_dml_int8_candidate"
SELECT * FROM mpp21090_xchange_pttab_dropcol_dml_int8 ORDER BY 1,2,3;
        col2        | col3 | col4 |        col5        
--------------------+------+------+--------------------
 200000000000000000 | z    |    1 | 200000000000000000
(1 row)

SELECT * FROM mpp21090_xchange_pttab_dropcol_dml_int8_candidate ORDER BY 1,2,3;
        col2        | col3 | col4 |        col5        
--------------------+------+------+--------------------
 200000000000000000 | a    |    0 | 200000000000000000
(1 row)

-- DML on partition table
INSERT INTO mpp21090_xchange_pttab_dropcol_dml_int8 SELECT  100000000000000000,'b', 1, 100000000000000000;
SELECT * FROM mpp21090_xchange_pttab_dropcol_dml_int8 ORDER BY 1,2,3;
        col2        | col3 | col4 |        col5        
--------------------+------+------+--------------------
 100000000000000000 | b    |    1 | 100000000000000000
 200000000000000000 | z    |    1 | 200000000000000000
(2 rows)

UPDATE mpp21090_xchange_pttab_dropcol_dml_int8 SET col5 = 3500000000000000000 WHERE col2 = 100000000000000000 AND col5 = 100000000000000000;
SELECT * FROM mpp21090_xchange_pttab_dropcol_dml_int8 ORDER BY 1,2,3;
        col2        | col3 | col4 |        col5         
--------------------+------+------+---------------------
 100000000000000000 | b    |    1 | 3500000000000000000
 200000000000000000 | z    |    1 |  200000000000000000
(2 rows)

UPDATE mpp21090_xchange_pttab_dropcol_dml_int8 SET col2 =200000000000000000 WHERE col3='b';
SELECT * FROM mpp21090_xchange_pttab_dropcol_dml_int8 ORDER BY 1,2,3;
        col2        | col3 | col4 |        col5         
--------------------+------+------+---------------------
 200000000000000000 | b    |    1 | 3500000000000000000
 200000000000000000 | z    |    1 |  200000000000000000
(2 rows)

DELETE FROM mpp21090_xchange_pttab_dropcol_dml_int8 WHERE col3='b';
SELECT * FROM mpp21090_xchange_pttab_dropcol_dml_int8 ORDER BY 1,2,3;
        col2        | col3 | col4 |        col5        
--------------------+------+------+--------------------
 200000000000000000 | z    |    1 | 200000000000000000
(1 row)

-- DML on candidate table
INSERT INTO mpp21090_xchange_pttab_dropcol_dml_int8_candidate SELECT 100000000000000000,'b', 1, 100000000000000000;
SELECT * FROM mpp21090_xchange_pttab_dropcol_dml_int8_candidate ORDER BY 1,2,3;
        col2        | col3 | col4 |        col5        
--------------------+------+------+--------------------
 100000000000000000 | b    |    1 | 100000000000000000
 200000000000000000 | a    |    0 | 200000000000000000
(2 rows)

UPDATE mpp21090_xchange_pttab_dropcol_dml_int8_candidate SET col2=200000000000000000 WHERE col3='a';
SELECT * FROM mpp21090_xchange_pttab_dropcol_dml_int8_candidate ORDER BY 1,2,3;
        col2        | col3 | col4 |        col5        
--------------------+------+------+--------------------
 100000000000000000 | b    |    1 | 100000000000000000
 200000000000000000 | a    |    0 | 200000000000000000
(2 rows)

DELETE FROM mpp21090_xchange_pttab_dropcol_dml_int8_candidate WHERE col3='a';
SELECT * FROM mpp21090_xchange_pttab_dropcol_dml_int8_candidate ORDER BY 1,2,3;
        col2        | col3 | col4 |        col5        
--------------------+------+------+--------------------
 100000000000000000 | b    |    1 | 100000000000000000
(1 row)

-- TEST
DROP TABLE IF EXISTS mpp21090_xchange_pttab_dropcol_dml_interval;
NOTICE:  table "mpp21090_xchange_pttab_dropcol_dml_interval" does not exist, skipping
CREATE TABLE mpp21090_xchange_pttab_dropcol_dml_interval
(
    col1 interval,
    col2 interval,
    col3 char,
    col4 int,
    col5 interval
) 
DISTRIBUTED by (col1)
PARTITION BY RANGE(col2)(partition partone start('1 sec') end('1 min')  WITH (APPENDONLY=true, COMPRESSLEVEL=5, ORIENTATION=column),partition parttwo start('1 min') end('1 hour') WITH (APPENDONLY=true, COMPRESSLEVEL=5, ORIENTATION=row),partition partthree start('1 hour') end('12 hours'));
NOTICE:  CREATE TABLE will create partition "mpp21090_xchange_pttab_dropcol_dml_interval_1_prt_partone" for table "mpp21090_xchange_pttab_dropcol_dml_interval"
NOTICE:  CREATE TABLE will create partition "mpp21090_xchange_pttab_dropcol_dml_interval_1_prt_parttwo" for table "mpp21090_xchange_pttab_dropcol_dml_interval"
NOTICE:  CREATE TABLE will create partition "mpp21090_xchange_pttab_dropcol_dml_interval_1_prt_partthree" for table "mpp21090_xchange_pttab_dropcol_dml_interval"
INSERT INTO mpp21090_xchange_pttab_dropcol_dml_interval VALUES('10 secs','10 secs','a',0, '10 secs');
SELECT * FROM mpp21090_xchange_pttab_dropcol_dml_interval ORDER BY 1,2,3,4;
   col1   |   col2   | col3 | col4 |   col5   
----------+----------+------+------+----------
 00:00:10 | 00:00:10 | a    |    0 | 00:00:10
(1 row)

ALTER TABLE mpp21090_xchange_pttab_dropcol_dml_interval DROP COLUMN col1;
NOTICE:  Dropping a column that is part of the distribution policy forces a NULL distribution policy
NOTICE:  Dropping a column that is part of the distribution policy forces a NULL distribution policy
NOTICE:  Dropping a column that is part of the distribution policy forces a NULL distribution policy
NOTICE:  Dropping a column that is part of the distribution policy forces a NULL distribution policy
-- Create Candidate table for Exchange
DROP TABLE IF EXISTS mpp21090_xchange_pttab_dropcol_dml_interval_candidate;
NOTICE:  table "mpp21090_xchange_pttab_dropcol_dml_interval_candidate" does not exist, skipping
CREATE TABLE mpp21090_xchange_pttab_dropcol_dml_interval_candidate( like mpp21090_xchange_pttab_dropcol_dml_interval) distributed randomly;
INSERT INTO mpp21090_xchange_pttab_dropcol_dml_interval_candidate VALUES('10 secs','z',1,'10 secs');
-- Exchange 
ALTER TABLE mpp21090_xchange_pttab_dropcol_dml_interval EXCHANGE PARTITION FOR('30 secs') WITH TABLE mpp21090_xchange_pttab_dropcol_dml_interval_candidate;
NOTICE:  exchanged partition "partone" of relation "mpp21090_xchange_pttab_dropcol_dml_interval" with relation "mpp21090_xchange_pttab_dropcol_dml_interval_candidate"
SELECT * FROM mpp21090_xchange_pttab_dropcol_dml_interval ORDER BY 1,2,3;
   col2   | col3 | col4 |   col5   
----------+------+------+----------
 00:00:10 | z    |    1 | 00:00:10
(1 row)

SELECT * FROM mpp21090_xchange_pttab_dropcol_dml_interval_candidate ORDER BY 1,2,3;
   col2   | col3 | col4 |   col5   
----------+------+------+----------
 00:00:10 | a    |    0 | 00:00:10
(1 row)

-- DML on partition table
INSERT INTO mpp21090_xchange_pttab_dropcol_dml_interval SELECT  '1 sec','b', 1, '1 sec';
SELECT * FROM mpp21090_xchange_pttab_dropcol_dml_interval ORDER BY 1,2,3;
   col2   | col3 | col4 |   col5   
----------+------+------+----------
 00:00:01 | b    |    1 | 00:00:01
 00:00:10 | z    |    1 | 00:00:10
(2 rows)

UPDATE mpp21090_xchange_pttab_dropcol_dml_interval SET col5 = '14 hours' WHERE col2 = '1 sec' AND col5 = '1 sec';
SELECT * FROM mpp21090_xchange_pttab_dropcol_dml_interval ORDER BY 1,2,3;
   col2   | col3 | col4 |   col5   
----------+------+------+----------
 00:00:01 | b    |    1 | 14:00:00
 00:00:10 | z    |    1 | 00:00:10
(2 rows)

UPDATE mpp21090_xchange_pttab_dropcol_dml_interval SET col2 ='10 secs' WHERE col3='b';
SELECT * FROM mpp21090_xchange_pttab_dropcol_dml_interval ORDER BY 1,2,3;
   col2   | col3 | col4 |   col5   
----------+------+------+----------
 00:00:10 | b    |    1 | 14:00:00
 00:00:10 | z    |    1 | 00:00:10
(2 rows)

DELETE FROM mpp21090_xchange_pttab_dropcol_dml_interval WHERE col3='b';
SELECT * FROM mpp21090_xchange_pttab_dropcol_dml_interval ORDER BY 1,2,3;
   col2   | col3 | col4 |   col5   
----------+------+------+----------
 00:00:10 | z    |    1 | 00:00:10
(1 row)

-- DML on candidate table
INSERT INTO mpp21090_xchange_pttab_dropcol_dml_interval_candidate SELECT '1 sec','b', 1, '1 sec';
SELECT * FROM mpp21090_xchange_pttab_dropcol_dml_interval_candidate ORDER BY 1,2,3;
   col2   | col3 | col4 |   col5   
----------+------+------+----------
 00:00:01 | b    |    1 | 00:00:01
 00:00:10 | a    |    0 | 00:00:10
(2 rows)

UPDATE mpp21090_xchange_pttab_dropcol_dml_interval_candidate SET col2='10 secs' WHERE col3='a';
SELECT * FROM mpp21090_xchange_pttab_dropcol_dml_interval_candidate ORDER BY 1,2,3;
   col2   | col3 | col4 |   col5   
----------+------+------+----------
 00:00:01 | b    |    1 | 00:00:01
 00:00:10 | a    |    0 | 00:00:10
(2 rows)

DELETE FROM mpp21090_xchange_pttab_dropcol_dml_interval_candidate WHERE col3='a';
SELECT * FROM mpp21090_xchange_pttab_dropcol_dml_interval_candidate ORDER BY 1,2,3;
   col2   | col3 | col4 |   col5   
----------+------+------+----------
 00:00:01 | b    |    1 | 00:00:01
(1 row)

-- TEST
DROP TABLE IF EXISTS mpp21090_xchange_pttab_dropcol_dml_numeric;
NOTICE:  table "mpp21090_xchange_pttab_dropcol_dml_numeric" does not exist, skipping
CREATE TABLE mpp21090_xchange_pttab_dropcol_dml_numeric
(
    col1 numeric,
    col2 numeric,
    col3 char,
    col4 int,
    col5 numeric
) 
DISTRIBUTED by (col1)
PARTITION BY RANGE(col2)(partition partone start(1.000000) end(10.000000)  WITH (APPENDONLY=true, COMPRESSLEVEL=5, ORIENTATION=column),partition parttwo start(10.000000) end(20.000000) WITH (APPENDONLY=true, COMPRESSLEVEL=5, ORIENTATION=row),partition partthree start(20.000000) end(30.000000));
NOTICE:  CREATE TABLE will create partition "mpp21090_xchange_pttab_dropcol_dml_numeric_1_prt_partone" for table "mpp21090_xchange_pttab_dropcol_dml_numeric"
NOTICE:  CREATE TABLE will create partition "mpp21090_xchange_pttab_dropcol_dml_numeric_1_prt_parttwo" for table "mpp21090_xchange_pttab_dropcol_dml_numeric"
NOTICE:  CREATE TABLE will create partition "mpp21090_xchange_pttab_dropcol_dml_numeric_1_prt_partthree" for table "mpp21090_xchange_pttab_dropcol_dml_numeric"
INSERT INTO mpp21090_xchange_pttab_dropcol_dml_numeric VALUES(2.000000,2.000000,'a',0, 2.000000);
SELECT * FROM mpp21090_xchange_pttab_dropcol_dml_numeric ORDER BY 1,2,3,4;
   col1   |   col2   | col3 | col4 |   col5   
----------+----------+------+------+----------
 2.000000 | 2.000000 | a    |    0 | 2.000000
(1 row)

ALTER TABLE mpp21090_xchange_pttab_dropcol_dml_numeric DROP COLUMN col1;
NOTICE:  Dropping a column that is part of the distribution policy forces a NULL distribution policy
NOTICE:  Dropping a column that is part of the distribution policy forces a NULL distribution policy
NOTICE:  Dropping a column that is part of the distribution policy forces a NULL distribution policy
NOTICE:  Dropping a column that is part of the distribution policy forces a NULL distribution policy
-- Create Candidate table for Exchange
DROP TABLE IF EXISTS mpp21090_xchange_pttab_dropcol_dml_numeric_candidate;
NOTICE:  table "mpp21090_xchange_pttab_dropcol_dml_numeric_candidate" does not exist, skipping
CREATE TABLE mpp21090_xchange_pttab_dropcol_dml_numeric_candidate( like mpp21090_xchange_pttab_dropcol_dml_numeric) distributed randomly;
INSERT INTO mpp21090_xchange_pttab_dropcol_dml_numeric_candidate VALUES(2.000000,'z',1,2.000000);
-- Exchange 
ALTER TABLE mpp21090_xchange_pttab_dropcol_dml_numeric EXCHANGE PARTITION FOR(5.000000) WITH TABLE mpp21090_xchange_pttab_dropcol_dml_numeric_candidate;
NOTICE:  exchanged partition "partone" of relation "mpp21090_xchange_pttab_dropcol_dml_numeric" with relation "mpp21090_xchange_pttab_dropcol_dml_numeric_candidate"
SELECT * FROM mpp21090_xchange_pttab_dropcol_dml_numeric ORDER BY 1,2,3;
   col2   | col3 | col4 |   col5   
----------+------+------+----------
 2.000000 | z    |    1 | 2.000000
(1 row)

SELECT * FROM mpp21090_xchange_pttab_dropcol_dml_numeric_candidate ORDER BY 1,2,3;
   col2   | col3 | col4 |   col5   
----------+------+------+----------
 2.000000 | a    |    0 | 2.000000
(1 row)

-- DML on partition table
INSERT INTO mpp21090_xchange_pttab_dropcol_dml_numeric SELECT  1.000000,'b', 1, 1.000000;
SELECT * FROM mpp21090_xchange_pttab_dropcol_dml_numeric ORDER BY 1,2,3;
   col2   | col3 | col4 |   col5   
----------+------+------+----------
 1.000000 | b    |    1 | 1.000000
 2.000000 | z    |    1 | 2.000000
(2 rows)

UPDATE mpp21090_xchange_pttab_dropcol_dml_numeric SET col5 = 35.000000 WHERE col2 = 1.000000 AND col5 = 1.000000;
SELECT * FROM mpp21090_xchange_pttab_dropcol_dml_numeric ORDER BY 1,2,3;
   col2   | col3 | col4 |   col5    
----------+------+------+-----------
 1.000000 | b    |    1 | 35.000000
 2.000000 | z    |    1 |  2.000000
(2 rows)

UPDATE mpp21090_xchange_pttab_dropcol_dml_numeric SET col2 =2.000000 WHERE col3='b';
SELECT * FROM mpp21090_xchange_pttab_dropcol_dml_numeric ORDER BY 1,2,3;
   col2   | col3 | col4 |   col5    
----------+------+------+-----------
 2.000000 | b    |    1 | 35.000000
 2.000000 | z    |    1 |  2.000000
(2 rows)

DELETE FROM mpp21090_xchange_pttab_dropcol_dml_numeric WHERE col3='b';
SELECT * FROM mpp21090_xchange_pttab_dropcol_dml_numeric ORDER BY 1,2,3;
   col2   | col3 | col4 |   col5   
----------+------+------+----------
 2.000000 | z    |    1 | 2.000000
(1 row)

-- DML on candidate table
INSERT INTO mpp21090_xchange_pttab_dropcol_dml_numeric_candidate SELECT 1.000000,'b', 1, 1.000000;
SELECT * FROM mpp21090_xchange_pttab_dropcol_dml_numeric_candidate ORDER BY 1,2,3;
   col2   | col3 | col4 |   col5   
----------+------+------+----------
 1.000000 | b    |    1 | 1.000000
 2.000000 | a    |    0 | 2.000000
(2 rows)

UPDATE mpp21090_xchange_pttab_dropcol_dml_numeric_candidate SET col2=2.000000 WHERE col3='a';
SELECT * FROM mpp21090_xchange_pttab_dropcol_dml_numeric_candidate ORDER BY 1,2,3;
   col2   | col3 | col4 |   col5   
----------+------+------+----------
 1.000000 | b    |    1 | 1.000000
 2.000000 | a    |    0 | 2.000000
(2 rows)

DELETE FROM mpp21090_xchange_pttab_dropcol_dml_numeric_candidate WHERE col3='a';
SELECT * FROM mpp21090_xchange_pttab_dropcol_dml_numeric_candidate ORDER BY 1,2,3;
   col2   | col3 | col4 |   col5   
----------+------+------+----------
 1.000000 | b    |    1 | 1.000000
(1 row)

-- TEST
DROP TABLE IF EXISTS mpp21090_xchange_pttab_dropcol_idx_dml_char;
NOTICE:  table "mpp21090_xchange_pttab_dropcol_idx_dml_char" does not exist, skipping
CREATE TABLE mpp21090_xchange_pttab_dropcol_idx_dml_char
(
    col1 char,
    col2 char,
    col3 char,
    col4 int,
    col5 char
) 
DISTRIBUTED by (col1)
PARTITION BY LIST(col2)(partition partone VALUES('a','b','c','d','e','f','g','h') WITH (APPENDONLY=true, COMPRESSLEVEL=5, ORIENTATION=column),partition parttwo VALUES('i','j','k','l','m','n','o','p') WITH (APPENDONLY=true, COMPRESSLEVEL=5, ORIENTATION=row),partition partthree VALUES('q','r','s','t','u','v','w','x'));
NOTICE:  CREATE TABLE will create partition "mpp21090_xchange_pttab_dropcol_idx_dml_char_1_prt_partone" for table "mpp21090_xchange_pttab_dropcol_idx_dml_char"
NOTICE:  CREATE TABLE will create partition "mpp21090_xchange_pttab_dropcol_idx_dml_char_1_prt_parttwo" for table "mpp21090_xchange_pttab_dropcol_idx_dml_char"
NOTICE:  CREATE TABLE will create partition "mpp21090_xchange_pttab_dropcol_idx_dml_char_1_prt_partthree" for table "mpp21090_xchange_pttab_dropcol_idx_dml_char"
INSERT INTO mpp21090_xchange_pttab_dropcol_idx_dml_char VALUES('g','g','a',0, 'g');
SELECT * FROM mpp21090_xchange_pttab_dropcol_idx_dml_char ORDER BY 1,2,3,4;
 col1 | col2 | col3 | col4 | col5 
------+------+------+------+------
 g    | g    | a    |    0 | g
(1 row)

DROP INDEX IF EXISTS mpp21090_xchange_pttab_dropcol_idx_dml_idx_char;
NOTICE:  index "mpp21090_xchange_pttab_dropcol_idx_dml_idx_char" does not exist, skipping
CREATE INDEX mpp21090_xchange_pttab_dropcol_idx_dml_idx_char on mpp21090_xchange_pttab_dropcol_idx_dml_char(col2);
NOTICE:  building index for child partition "mpp21090_xchange_pttab_dropcol_idx_dml_char_1_prt_partone"
NOTICE:  building index for child partition "mpp21090_xchange_pttab_dropcol_idx_dml_char_1_prt_parttwo"
NOTICE:  building index for child partition "mpp21090_xchange_pttab_dropcol_idx_dml_char_1_prt_partthree"
ALTER TABLE mpp21090_xchange_pttab_dropcol_idx_dml_char DROP COLUMN col1;
NOTICE:  Dropping a column that is part of the distribution policy forces a NULL distribution policy
NOTICE:  Dropping a column that is part of the distribution policy forces a NULL distribution policy
NOTICE:  Dropping a column that is part of the distribution policy forces a NULL distribution policy
NOTICE:  Dropping a column that is part of the distribution policy forces a NULL distribution policy
-- Create Candidate table for Exchange
DROP TABLE IF EXISTS mpp21090_xchange_pttab_dropcol_idx_dml_char_candidate;
NOTICE:  table "mpp21090_xchange_pttab_dropcol_idx_dml_char_candidate" does not exist, skipping
CREATE TABLE mpp21090_xchange_pttab_dropcol_idx_dml_char_candidate( like mpp21090_xchange_pttab_dropcol_idx_dml_char) distributed randomly;
INSERT INTO mpp21090_xchange_pttab_dropcol_idx_dml_char_candidate VALUES('g','z',1,'g');
-- Exchange 
ALTER TABLE mpp21090_xchange_pttab_dropcol_idx_dml_char EXCHANGE PARTITION FOR('d') WITH TABLE mpp21090_xchange_pttab_dropcol_idx_dml_char_candidate;
NOTICE:  exchanged partition "partone" of relation "mpp21090_xchange_pttab_dropcol_idx_dml_char" with relation "mpp21090_xchange_pttab_dropcol_idx_dml_char_candidate"
SELECT * FROM mpp21090_xchange_pttab_dropcol_idx_dml_char ORDER BY 1,2,3;
 col2 | col3 | col4 | col5 
------+------+------+------
 g    | z    |    1 | g
(1 row)

SELECT * FROM mpp21090_xchange_pttab_dropcol_idx_dml_char_candidate ORDER BY 1,2,3;
 col2 | col3 | col4 | col5 
------+------+------+------
 g    | a    |    0 | g
(1 row)

-- DML on partition table
INSERT INTO mpp21090_xchange_pttab_dropcol_idx_dml_char SELECT  'a','b', 1, 'a';
SELECT * FROM mpp21090_xchange_pttab_dropcol_idx_dml_char ORDER BY 1,2,3;
 col2 | col3 | col4 | col5 
------+------+------+------
 a    | b    |    1 | a
 g    | z    |    1 | g
(2 rows)

UPDATE mpp21090_xchange_pttab_dropcol_idx_dml_char SET col5 = 'z' WHERE col2 = 'a' AND col5 = 'a';
SELECT * FROM mpp21090_xchange_pttab_dropcol_idx_dml_char ORDER BY 1,2,3;
 col2 | col3 | col4 | col5 
------+------+------+------
 a    | b    |    1 | z
 g    | z    |    1 | g
(2 rows)

UPDATE mpp21090_xchange_pttab_dropcol_idx_dml_char SET col2 ='g' WHERE col3='b';
SELECT * FROM mpp21090_xchange_pttab_dropcol_idx_dml_char ORDER BY 1,2,3;
 col2 | col3 | col4 | col5 
------+------+------+------
 g    | b    |    1 | z
 g    | z    |    1 | g
(2 rows)

DELETE FROM mpp21090_xchange_pttab_dropcol_idx_dml_char WHERE col3='b';
SELECT * FROM mpp21090_xchange_pttab_dropcol_idx_dml_char ORDER BY 1,2,3;
 col2 | col3 | col4 | col5 
------+------+------+------
 g    | z    |    1 | g
(1 row)

-- DML on candidate table
INSERT INTO mpp21090_xchange_pttab_dropcol_idx_dml_char_candidate SELECT 'a','b', 1, 'a';
SELECT * FROM mpp21090_xchange_pttab_dropcol_idx_dml_char_candidate ORDER BY 1,2,3;
 col2 | col3 | col4 | col5 
------+------+------+------
 a    | b    |    1 | a
 g    | a    |    0 | g
(2 rows)

UPDATE mpp21090_xchange_pttab_dropcol_idx_dml_char_candidate SET col2='g' WHERE col3='a';
SELECT * FROM mpp21090_xchange_pttab_dropcol_idx_dml_char_candidate ORDER BY 1,2,3;
 col2 | col3 | col4 | col5 
------+------+------+------
 a    | b    |    1 | a
 g    | a    |    0 | g
(2 rows)

DELETE FROM mpp21090_xchange_pttab_dropcol_idx_dml_char_candidate WHERE col3='a';
SELECT * FROM mpp21090_xchange_pttab_dropcol_idx_dml_char_candidate ORDER BY 1,2,3;
 col2 | col3 | col4 | col5 
------+------+------+------
 a    | b    |    1 | a
(1 row)

-- TEST
DROP TABLE IF EXISTS mpp21090_xchange_pttab_dropcol_idx_dml_decimal;
NOTICE:  table "mpp21090_xchange_pttab_dropcol_idx_dml_decimal" does not exist, skipping
CREATE TABLE mpp21090_xchange_pttab_dropcol_idx_dml_decimal
(
    col1 decimal,
    col2 decimal,
    col3 char,
    col4 int,
    col5 decimal
) 
DISTRIBUTED by (col1)
PARTITION BY RANGE(col2)(partition partone start(1.00) end(10.00)  WITH (APPENDONLY=true, COMPRESSLEVEL=5, ORIENTATION=column),partition parttwo start(10.00) end(20.00) WITH (APPENDONLY=true, COMPRESSLEVEL=5, ORIENTATION=row),partition partthree start(20.00) end(30.00));
NOTICE:  CREATE TABLE will create partition "mpp21090_xchange_pttab_dropcol_idx_dml_decimal_1_prt_partone" for table "mpp21090_xchange_pttab_dropcol_idx_dml_decimal"
NOTICE:  CREATE TABLE will create partition "mpp21090_xchange_pttab_dropcol_idx_dml_decimal_1_prt_parttwo" for table "mpp21090_xchange_pttab_dropcol_idx_dml_decimal"
NOTICE:  CREATE TABLE will create partition "mpp21090_xchange_pttab_dropcol_idx_dml_decimal_1_prt_partthree" for table "mpp21090_xchange_pttab_dropcol_idx_dml_decimal"
INSERT INTO mpp21090_xchange_pttab_dropcol_idx_dml_decimal VALUES(2.00,2.00,'a',0, 2.00);
SELECT * FROM mpp21090_xchange_pttab_dropcol_idx_dml_decimal ORDER BY 1,2,3,4;
 col1 | col2 | col3 | col4 | col5 
------+------+------+------+------
 2.00 | 2.00 | a    |    0 | 2.00
(1 row)

DROP INDEX IF EXISTS mpp21090_xchange_pttab_dropcol_idx_dml_idx_decimal;
NOTICE:  index "mpp21090_xchange_pttab_dropcol_idx_dml_idx_decimal" does not exist, skipping
CREATE INDEX mpp21090_xchange_pttab_dropcol_idx_dml_idx_decimal on mpp21090_xchange_pttab_dropcol_idx_dml_decimal(col2);
NOTICE:  building index for child partition "mpp21090_xchange_pttab_dropcol_idx_dml_decimal_1_prt_partone"
NOTICE:  building index for child partition "mpp21090_xchange_pttab_dropcol_idx_dml_decimal_1_prt_parttwo"
NOTICE:  building index for child partition "mpp21090_xchange_pttab_dropcol_idx_dml_decimal_1_prt_partthree"
ALTER TABLE mpp21090_xchange_pttab_dropcol_idx_dml_decimal DROP COLUMN col1;
NOTICE:  Dropping a column that is part of the distribution policy forces a NULL distribution policy
NOTICE:  Dropping a column that is part of the distribution policy forces a NULL distribution policy
NOTICE:  Dropping a column that is part of the distribution policy forces a NULL distribution policy
NOTICE:  Dropping a column that is part of the distribution policy forces a NULL distribution policy
-- Create Candidate table for Exchange
DROP TABLE IF EXISTS mpp21090_xchange_pttab_dropcol_idx_dml_decimal_candidate;
NOTICE:  table "mpp21090_xchange_pttab_dropcol_idx_dml_decimal_candidate" does not exist, skipping
CREATE TABLE mpp21090_xchange_pttab_dropcol_idx_dml_decimal_candidate( like mpp21090_xchange_pttab_dropcol_idx_dml_decimal) distributed randomly;
INSERT INTO mpp21090_xchange_pttab_dropcol_idx_dml_decimal_candidate VALUES(2.00,'z',1,2.00);
-- Exchange 
ALTER TABLE mpp21090_xchange_pttab_dropcol_idx_dml_decimal EXCHANGE PARTITION FOR(5.00) WITH TABLE mpp21090_xchange_pttab_dropcol_idx_dml_decimal_candidate;
NOTICE:  exchanged partition "partone" of relation "mpp21090_xchange_pttab_dropcol_idx_dml_decimal" with relation "mpp21090_xchange_pttab_dropcol_idx_dml_decimal_candidate"
SELECT * FROM mpp21090_xchange_pttab_dropcol_idx_dml_decimal ORDER BY 1,2,3;
 col2 | col3 | col4 | col5 
------+------+------+------
 2.00 | z    |    1 | 2.00
(1 row)

SELECT * FROM mpp21090_xchange_pttab_dropcol_idx_dml_decimal_candidate ORDER BY 1,2,3;
 col2 | col3 | col4 | col5 
------+------+------+------
 2.00 | a    |    0 | 2.00
(1 row)

-- DML on partition table
INSERT INTO mpp21090_xchange_pttab_dropcol_idx_dml_decimal SELECT  1.00,'b', 1, 1.00;
SELECT * FROM mpp21090_xchange_pttab_dropcol_idx_dml_decimal ORDER BY 1,2,3;
 col2 | col3 | col4 | col5 
------+------+------+------
 1.00 | b    |    1 | 1.00
 2.00 | z    |    1 | 2.00
(2 rows)

UPDATE mpp21090_xchange_pttab_dropcol_idx_dml_decimal SET col5 = 35.00 WHERE col2 = 1.00 AND col5 = 1.00;
SELECT * FROM mpp21090_xchange_pttab_dropcol_idx_dml_decimal ORDER BY 1,2,3;
 col2 | col3 | col4 | col5  
------+------+------+-------
 1.00 | b    |    1 | 35.00
 2.00 | z    |    1 |  2.00
(2 rows)

UPDATE mpp21090_xchange_pttab_dropcol_idx_dml_decimal SET col2 =2.00 WHERE col3='b';
SELECT * FROM mpp21090_xchange_pttab_dropcol_idx_dml_decimal ORDER BY 1,2,3;
 col2 | col3 | col4 | col5  
------+------+------+-------
 2.00 | b    |    1 | 35.00
 2.00 | z    |    1 |  2.00
(2 rows)

DELETE FROM mpp21090_xchange_pttab_dropcol_idx_dml_decimal WHERE col3='b';
SELECT * FROM mpp21090_xchange_pttab_dropcol_idx_dml_decimal ORDER BY 1,2,3;
 col2 | col3 | col4 | col5 
------+------+------+------
 2.00 | z    |    1 | 2.00
(1 row)

-- DML on candidate table
INSERT INTO mpp21090_xchange_pttab_dropcol_idx_dml_decimal_candidate SELECT 1.00,'b', 1, 1.00;
SELECT * FROM mpp21090_xchange_pttab_dropcol_idx_dml_decimal_candidate ORDER BY 1,2,3;
 col2 | col3 | col4 | col5 
------+------+------+------
 1.00 | b    |    1 | 1.00
 2.00 | a    |    0 | 2.00
(2 rows)

UPDATE mpp21090_xchange_pttab_dropcol_idx_dml_decimal_candidate SET col2=2.00 WHERE col3='a';
SELECT * FROM mpp21090_xchange_pttab_dropcol_idx_dml_decimal_candidate ORDER BY 1,2,3;
 col2 | col3 | col4 | col5 
------+------+------+------
 1.00 | b    |    1 | 1.00
 2.00 | a    |    0 | 2.00
(2 rows)

DELETE FROM mpp21090_xchange_pttab_dropcol_idx_dml_decimal_candidate WHERE col3='a';
SELECT * FROM mpp21090_xchange_pttab_dropcol_idx_dml_decimal_candidate ORDER BY 1,2,3;
 col2 | col3 | col4 | col5 
------+------+------+------
 1.00 | b    |    1 | 1.00
(1 row)

-- TEST
DROP TABLE IF EXISTS mpp21090_xchange_pttab_dropcol_idx_dml_int4;
NOTICE:  table "mpp21090_xchange_pttab_dropcol_idx_dml_int4" does not exist, skipping
CREATE TABLE mpp21090_xchange_pttab_dropcol_idx_dml_int4
(
    col1 int4,
    col2 int4,
    col3 char,
    col4 int,
    col5 int4
) 
DISTRIBUTED by (col1)
PARTITION BY RANGE(col2)(partition partone start(1) end(100000001)  WITH (APPENDONLY=true, COMPRESSLEVEL=5, ORIENTATION=column),partition parttwo start(100000001) end(200000001) WITH (APPENDONLY=true, COMPRESSLEVEL=5, ORIENTATION=row),partition partthree start(200000001) end(300000001));
NOTICE:  CREATE TABLE will create partition "mpp21090_xchange_pttab_dropcol_idx_dml_int4_1_prt_partone" for table "mpp21090_xchange_pttab_dropcol_idx_dml_int4"
NOTICE:  CREATE TABLE will create partition "mpp21090_xchange_pttab_dropcol_idx_dml_int4_1_prt_parttwo" for table "mpp21090_xchange_pttab_dropcol_idx_dml_int4"
NOTICE:  CREATE TABLE will create partition "mpp21090_xchange_pttab_dropcol_idx_dml_int4_1_prt_partthree" for table "mpp21090_xchange_pttab_dropcol_idx_dml_int4"
INSERT INTO mpp21090_xchange_pttab_dropcol_idx_dml_int4 VALUES(20000000,20000000,'a',0, 20000000);
SELECT * FROM mpp21090_xchange_pttab_dropcol_idx_dml_int4 ORDER BY 1,2,3,4;
   col1   |   col2   | col3 | col4 |   col5   
----------+----------+------+------+----------
 20000000 | 20000000 | a    |    0 | 20000000
(1 row)

DROP INDEX IF EXISTS mpp21090_xchange_pttab_dropcol_idx_dml_idx_int4;
NOTICE:  index "mpp21090_xchange_pttab_dropcol_idx_dml_idx_int4" does not exist, skipping
CREATE INDEX mpp21090_xchange_pttab_dropcol_idx_dml_idx_int4 on mpp21090_xchange_pttab_dropcol_idx_dml_int4(col2);
NOTICE:  building index for child partition "mpp21090_xchange_pttab_dropcol_idx_dml_int4_1_prt_partone"
NOTICE:  building index for child partition "mpp21090_xchange_pttab_dropcol_idx_dml_int4_1_prt_parttwo"
NOTICE:  building index for child partition "mpp21090_xchange_pttab_dropcol_idx_dml_int4_1_prt_partthree"
ALTER TABLE mpp21090_xchange_pttab_dropcol_idx_dml_int4 DROP COLUMN col1;
NOTICE:  Dropping a column that is part of the distribution policy forces a NULL distribution policy
NOTICE:  Dropping a column that is part of the distribution policy forces a NULL distribution policy
NOTICE:  Dropping a column that is part of the distribution policy forces a NULL distribution policy
NOTICE:  Dropping a column that is part of the distribution policy forces a NULL distribution policy
-- Create Candidate table for Exchange
DROP TABLE IF EXISTS mpp21090_xchange_pttab_dropcol_idx_dml_int4_candidate;
NOTICE:  table "mpp21090_xchange_pttab_dropcol_idx_dml_int4_candidate" does not exist, skipping
CREATE TABLE mpp21090_xchange_pttab_dropcol_idx_dml_int4_candidate( like mpp21090_xchange_pttab_dropcol_idx_dml_int4) distributed randomly;
INSERT INTO mpp21090_xchange_pttab_dropcol_idx_dml_int4_candidate VALUES(20000000,'z',1,20000000);
-- Exchange 
ALTER TABLE mpp21090_xchange_pttab_dropcol_idx_dml_int4 EXCHANGE PARTITION FOR(50000000) WITH TABLE mpp21090_xchange_pttab_dropcol_idx_dml_int4_candidate;
NOTICE:  exchanged partition "partone" of relation "mpp21090_xchange_pttab_dropcol_idx_dml_int4" with relation "mpp21090_xchange_pttab_dropcol_idx_dml_int4_candidate"
SELECT * FROM mpp21090_xchange_pttab_dropcol_idx_dml_int4 ORDER BY 1,2,3;
   col2   | col3 | col4 |   col5   
----------+------+------+----------
 20000000 | z    |    1 | 20000000
(1 row)

SELECT * FROM mpp21090_xchange_pttab_dropcol_idx_dml_int4_candidate ORDER BY 1,2,3;
   col2   | col3 | col4 |   col5   
----------+------+------+----------
 20000000 | a    |    0 | 20000000
(1 row)

-- DML on partition table
INSERT INTO mpp21090_xchange_pttab_dropcol_idx_dml_int4 SELECT  10000000,'b', 1, 10000000;
SELECT * FROM mpp21090_xchange_pttab_dropcol_idx_dml_int4 ORDER BY 1,2,3;
   col2   | col3 | col4 |   col5   
----------+------+------+----------
 10000000 | b    |    1 | 10000000
 20000000 | z    |    1 | 20000000
(2 rows)

UPDATE mpp21090_xchange_pttab_dropcol_idx_dml_int4 SET col5 = 350000000 WHERE col2 = 10000000 AND col5 = 10000000;
SELECT * FROM mpp21090_xchange_pttab_dropcol_idx_dml_int4 ORDER BY 1,2,3;
   col2   | col3 | col4 |   col5    
----------+------+------+-----------
 10000000 | b    |    1 | 350000000
 20000000 | z    |    1 |  20000000
(2 rows)

UPDATE mpp21090_xchange_pttab_dropcol_idx_dml_int4 SET col2 =20000000 WHERE col3='b';
SELECT * FROM mpp21090_xchange_pttab_dropcol_idx_dml_int4 ORDER BY 1,2,3;
   col2   | col3 | col4 |   col5    
----------+------+------+-----------
 20000000 | b    |    1 | 350000000
 20000000 | z    |    1 |  20000000
(2 rows)

DELETE FROM mpp21090_xchange_pttab_dropcol_idx_dml_int4 WHERE col3='b';
SELECT * FROM mpp21090_xchange_pttab_dropcol_idx_dml_int4 ORDER BY 1,2,3;
   col2   | col3 | col4 |   col5   
----------+------+------+----------
 20000000 | z    |    1 | 20000000
(1 row)

-- DML on candidate table
INSERT INTO mpp21090_xchange_pttab_dropcol_idx_dml_int4_candidate SELECT 10000000,'b', 1, 10000000;
SELECT * FROM mpp21090_xchange_pttab_dropcol_idx_dml_int4_candidate ORDER BY 1,2,3;
   col2   | col3 | col4 |   col5   
----------+------+------+----------
 10000000 | b    |    1 | 10000000
 20000000 | a    |    0 | 20000000
(2 rows)

UPDATE mpp21090_xchange_pttab_dropcol_idx_dml_int4_candidate SET col2=20000000 WHERE col3='a';
SELECT * FROM mpp21090_xchange_pttab_dropcol_idx_dml_int4_candidate ORDER BY 1,2,3;
   col2   | col3 | col4 |   col5   
----------+------+------+----------
 10000000 | b    |    1 | 10000000
 20000000 | a    |    0 | 20000000
(2 rows)

DELETE FROM mpp21090_xchange_pttab_dropcol_idx_dml_int4_candidate WHERE col3='a';
SELECT * FROM mpp21090_xchange_pttab_dropcol_idx_dml_int4_candidate ORDER BY 1,2,3;
   col2   | col3 | col4 |   col5   
----------+------+------+----------
 10000000 | b    |    1 | 10000000
(1 row)

-- TEST
DROP TABLE IF EXISTS mpp21090_xchange_pttab_dropcol_idx_dml_int8;
NOTICE:  table "mpp21090_xchange_pttab_dropcol_idx_dml_int8" does not exist, skipping
CREATE TABLE mpp21090_xchange_pttab_dropcol_idx_dml_int8
(
    col1 int8,
    col2 int8,
    col3 char,
    col4 int,
    col5 int8
) 
DISTRIBUTED by (col1)
PARTITION BY RANGE(col2)(partition partone start(1) end(1000000000000000001)  WITH (APPENDONLY=true, COMPRESSLEVEL=5, ORIENTATION=column),partition parttwo start(1000000000000000001) end(2000000000000000001) WITH (APPENDONLY=true, COMPRESSLEVEL=5, ORIENTATION=row),partition partthree start(2000000000000000001) end(3000000000000000001));
NOTICE:  CREATE TABLE will create partition "mpp21090_xchange_pttab_dropcol_idx_dml_int8_1_prt_partone" for table "mpp21090_xchange_pttab_dropcol_idx_dml_int8"
NOTICE:  CREATE TABLE will create partition "mpp21090_xchange_pttab_dropcol_idx_dml_int8_1_prt_parttwo" for table "mpp21090_xchange_pttab_dropcol_idx_dml_int8"
NOTICE:  CREATE TABLE will create partition "mpp21090_xchange_pttab_dropcol_idx_dml_int8_1_prt_partthree" for table "mpp21090_xchange_pttab_dropcol_idx_dml_int8"
INSERT INTO mpp21090_xchange_pttab_dropcol_idx_dml_int8 VALUES(200000000000000000,200000000000000000,'a',0, 200000000000000000);
SELECT * FROM mpp21090_xchange_pttab_dropcol_idx_dml_int8 ORDER BY 1,2,3,4;
        col1        |        col2        | col3 | col4 |        col5        
--------------------+--------------------+------+------+--------------------
 200000000000000000 | 200000000000000000 | a    |    0 | 200000000000000000
(1 row)

DROP INDEX IF EXISTS mpp21090_xchange_pttab_dropcol_idx_dml_idx_int8;
NOTICE:  index "mpp21090_xchange_pttab_dropcol_idx_dml_idx_int8" does not exist, skipping
CREATE INDEX mpp21090_xchange_pttab_dropcol_idx_dml_idx_int8 on mpp21090_xchange_pttab_dropcol_idx_dml_int8(col2);
NOTICE:  building index for child partition "mpp21090_xchange_pttab_dropcol_idx_dml_int8_1_prt_partone"
NOTICE:  building index for child partition "mpp21090_xchange_pttab_dropcol_idx_dml_int8_1_prt_parttwo"
NOTICE:  building index for child partition "mpp21090_xchange_pttab_dropcol_idx_dml_int8_1_prt_partthree"
ALTER TABLE mpp21090_xchange_pttab_dropcol_idx_dml_int8 DROP COLUMN col1;
NOTICE:  Dropping a column that is part of the distribution policy forces a NULL distribution policy
NOTICE:  Dropping a column that is part of the distribution policy forces a NULL distribution policy
NOTICE:  Dropping a column that is part of the distribution policy forces a NULL distribution policy
NOTICE:  Dropping a column that is part of the distribution policy forces a NULL distribution policy
-- Create Candidate table for Exchange
DROP TABLE IF EXISTS mpp21090_xchange_pttab_dropcol_idx_dml_int8_candidate;
NOTICE:  table "mpp21090_xchange_pttab_dropcol_idx_dml_int8_candidate" does not exist, skipping
CREATE TABLE mpp21090_xchange_pttab_dropcol_idx_dml_int8_candidate( like mpp21090_xchange_pttab_dropcol_idx_dml_int8) distributed randomly;
INSERT INTO mpp21090_xchange_pttab_dropcol_idx_dml_int8_candidate VALUES(200000000000000000,'z',1,200000000000000000);
-- Exchange 
ALTER TABLE mpp21090_xchange_pttab_dropcol_idx_dml_int8 EXCHANGE PARTITION FOR(500000000000000000) WITH TABLE mpp21090_xchange_pttab_dropcol_idx_dml_int8_candidate;
NOTICE:  exchanged partition "partone" of relation "mpp21090_xchange_pttab_dropcol_idx_dml_int8" with relation "mpp21090_xchange_pttab_dropcol_idx_dml_int8_candidate"
SELECT * FROM mpp21090_xchange_pttab_dropcol_idx_dml_int8 ORDER BY 1,2,3;
        col2        | col3 | col4 |        col5        
--------------------+------+------+--------------------
 200000000000000000 | z    |    1 | 200000000000000000
(1 row)

SELECT * FROM mpp21090_xchange_pttab_dropcol_idx_dml_int8_candidate ORDER BY 1,2,3;
        col2        | col3 | col4 |        col5        
--------------------+------+------+--------------------
 200000000000000000 | a    |    0 | 200000000000000000
(1 row)

-- DML on partition table
INSERT INTO mpp21090_xchange_pttab_dropcol_idx_dml_int8 SELECT  100000000000000000,'b', 1, 100000000000000000;
SELECT * FROM mpp21090_xchange_pttab_dropcol_idx_dml_int8 ORDER BY 1,2,3;
        col2        | col3 | col4 |        col5        
--------------------+------+------+--------------------
 100000000000000000 | b    |    1 | 100000000000000000
 200000000000000000 | z    |    1 | 200000000000000000
(2 rows)

UPDATE mpp21090_xchange_pttab_dropcol_idx_dml_int8 SET col5 = 3500000000000000000 WHERE col2 = 100000000000000000 AND col5 = 100000000000000000;
SELECT * FROM mpp21090_xchange_pttab_dropcol_idx_dml_int8 ORDER BY 1,2,3;
        col2        | col3 | col4 |        col5         
--------------------+------+------+---------------------
 100000000000000000 | b    |    1 | 3500000000000000000
 200000000000000000 | z    |    1 |  200000000000000000
(2 rows)

UPDATE mpp21090_xchange_pttab_dropcol_idx_dml_int8 SET col2 =200000000000000000 WHERE col3='b';
SELECT * FROM mpp21090_xchange_pttab_dropcol_idx_dml_int8 ORDER BY 1,2,3;
        col2        | col3 | col4 |        col5         
--------------------+------+------+---------------------
 200000000000000000 | b    |    1 | 3500000000000000000
 200000000000000000 | z    |    1 |  200000000000000000
(2 rows)

DELETE FROM mpp21090_xchange_pttab_dropcol_idx_dml_int8 WHERE col3='b';
SELECT * FROM mpp21090_xchange_pttab_dropcol_idx_dml_int8 ORDER BY 1,2,3;
        col2        | col3 | col4 |        col5        
--------------------+------+------+--------------------
 200000000000000000 | z    |    1 | 200000000000000000
(1 row)

-- DML on candidate table
INSERT INTO mpp21090_xchange_pttab_dropcol_idx_dml_int8_candidate SELECT 100000000000000000,'b', 1, 100000000000000000;
SELECT * FROM mpp21090_xchange_pttab_dropcol_idx_dml_int8_candidate ORDER BY 1,2,3;
        col2        | col3 | col4 |        col5        
--------------------+------+------+--------------------
 100000000000000000 | b    |    1 | 100000000000000000
 200000000000000000 | a    |    0 | 200000000000000000
(2 rows)

UPDATE mpp21090_xchange_pttab_dropcol_idx_dml_int8_candidate SET col2=200000000000000000 WHERE col3='a';
SELECT * FROM mpp21090_xchange_pttab_dropcol_idx_dml_int8_candidate ORDER BY 1,2,3;
        col2        | col3 | col4 |        col5        
--------------------+------+------+--------------------
 100000000000000000 | b    |    1 | 100000000000000000
 200000000000000000 | a    |    0 | 200000000000000000
(2 rows)

DELETE FROM mpp21090_xchange_pttab_dropcol_idx_dml_int8_candidate WHERE col3='a';
SELECT * FROM mpp21090_xchange_pttab_dropcol_idx_dml_int8_candidate ORDER BY 1,2,3;
        col2        | col3 | col4 |        col5        
--------------------+------+------+--------------------
 100000000000000000 | b    |    1 | 100000000000000000
(1 row)

-- TEST
DROP TABLE IF EXISTS mpp21090_xchange_pttab_dropcol_idx_dml_interval;
NOTICE:  table "mpp21090_xchange_pttab_dropcol_idx_dml_interval" does not exist, skipping
CREATE TABLE mpp21090_xchange_pttab_dropcol_idx_dml_interval
(
    col1 interval,
    col2 interval,
    col3 char,
    col4 int,
    col5 interval
) 
DISTRIBUTED by (col1)
PARTITION BY RANGE(col2)(partition partone start('1 sec') end('1 min')  WITH (APPENDONLY=true, COMPRESSLEVEL=5, ORIENTATION=column),partition parttwo start('1 min') end('1 hour') WITH (APPENDONLY=true, COMPRESSLEVEL=5, ORIENTATION=row),partition partthree start('1 hour') end('12 hours'));
NOTICE:  CREATE TABLE will create partition "mpp21090_xchange_pttab_dropcol_idx_dml_interval_1_prt_partone" for table "mpp21090_xchange_pttab_dropcol_idx_dml_interval"
NOTICE:  CREATE TABLE will create partition "mpp21090_xchange_pttab_dropcol_idx_dml_interval_1_prt_parttwo" for table "mpp21090_xchange_pttab_dropcol_idx_dml_interval"
NOTICE:  CREATE TABLE will create partition "mpp21090_xchange_pttab_dropcol_idx_dml_interval_1_prt_partthree" for table "mpp21090_xchange_pttab_dropcol_idx_dml_interval"
INSERT INTO mpp21090_xchange_pttab_dropcol_idx_dml_interval VALUES('10 secs','10 secs','a',0, '10 secs');
SELECT * FROM mpp21090_xchange_pttab_dropcol_idx_dml_interval ORDER BY 1,2,3,4;
   col1   |   col2   | col3 | col4 |   col5   
----------+----------+------+------+----------
 00:00:10 | 00:00:10 | a    |    0 | 00:00:10
(1 row)

DROP INDEX IF EXISTS mpp21090_xchange_pttab_dropcol_idx_dml_idx_interval;
NOTICE:  index "mpp21090_xchange_pttab_dropcol_idx_dml_idx_interval" does not exist, skipping
CREATE INDEX mpp21090_xchange_pttab_dropcol_idx_dml_idx_interval on mpp21090_xchange_pttab_dropcol_idx_dml_interval(col2);
NOTICE:  building index for child partition "mpp21090_xchange_pttab_dropcol_idx_dml_interval_1_prt_partone"
NOTICE:  building index for child partition "mpp21090_xchange_pttab_dropcol_idx_dml_interval_1_prt_parttwo"
NOTICE:  building index for child partition "mpp21090_xchange_pttab_dropcol_idx_dml_interval_1_prt_partthree"
ALTER TABLE mpp21090_xchange_pttab_dropcol_idx_dml_interval DROP COLUMN col1;
NOTICE:  Dropping a column that is part of the distribution policy forces a NULL distribution policy
NOTICE:  Dropping a column that is part of the distribution policy forces a NULL distribution policy
NOTICE:  Dropping a column that is part of the distribution policy forces a NULL distribution policy
NOTICE:  Dropping a column that is part of the distribution policy forces a NULL distribution policy
-- Create Candidate table for Exchange
DROP TABLE IF EXISTS mpp21090_xchange_pttab_dropcol_idx_dml_interval_candidate;
NOTICE:  table "mpp21090_xchange_pttab_dropcol_idx_dml_interval_candidate" does not exist, skipping
CREATE TABLE mpp21090_xchange_pttab_dropcol_idx_dml_interval_candidate( like mpp21090_xchange_pttab_dropcol_idx_dml_interval) distributed randomly;
INSERT INTO mpp21090_xchange_pttab_dropcol_idx_dml_interval_candidate VALUES('10 secs','z',1,'10 secs');
-- Exchange 
ALTER TABLE mpp21090_xchange_pttab_dropcol_idx_dml_interval EXCHANGE PARTITION FOR('30 secs') WITH TABLE mpp21090_xchange_pttab_dropcol_idx_dml_interval_candidate;
NOTICE:  exchanged partition "partone" of relation "mpp21090_xchange_pttab_dropcol_idx_dml_interval" with relation "mpp21090_xchange_pttab_dropcol_idx_dml_interval_candidate"
SELECT * FROM mpp21090_xchange_pttab_dropcol_idx_dml_interval ORDER BY 1,2,3;
   col2   | col3 | col4 |   col5   
----------+------+------+----------
 00:00:10 | z    |    1 | 00:00:10
(1 row)

SELECT * FROM mpp21090_xchange_pttab_dropcol_idx_dml_interval_candidate ORDER BY 1,2,3;
   col2   | col3 | col4 |   col5   
----------+------+------+----------
 00:00:10 | a    |    0 | 00:00:10
(1 row)

-- DML on partition table
INSERT INTO mpp21090_xchange_pttab_dropcol_idx_dml_interval SELECT  '1 sec','b', 1, '1 sec';
SELECT * FROM mpp21090_xchange_pttab_dropcol_idx_dml_interval ORDER BY 1,2,3;
   col2   | col3 | col4 |   col5   
----------+------+------+----------
 00:00:01 | b    |    1 | 00:00:01
 00:00:10 | z    |    1 | 00:00:10
(2 rows)

UPDATE mpp21090_xchange_pttab_dropcol_idx_dml_interval SET col5 = '14 hours' WHERE col2 = '1 sec' AND col5 = '1 sec';
SELECT * FROM mpp21090_xchange_pttab_dropcol_idx_dml_interval ORDER BY 1,2,3;
   col2   | col3 | col4 |   col5   
----------+------+------+----------
 00:00:01 | b    |    1 | 14:00:00
 00:00:10 | z    |    1 | 00:00:10
(2 rows)

UPDATE mpp21090_xchange_pttab_dropcol_idx_dml_interval SET col2 ='10 secs' WHERE col3='b';
SELECT * FROM mpp21090_xchange_pttab_dropcol_idx_dml_interval ORDER BY 1,2,3;
   col2   | col3 | col4 |   col5   
----------+------+------+----------
 00:00:10 | b    |    1 | 14:00:00
 00:00:10 | z    |    1 | 00:00:10
(2 rows)

DELETE FROM mpp21090_xchange_pttab_dropcol_idx_dml_interval WHERE col3='b';
SELECT * FROM mpp21090_xchange_pttab_dropcol_idx_dml_interval ORDER BY 1,2,3;
   col2   | col3 | col4 |   col5   
----------+------+------+----------
 00:00:10 | z    |    1 | 00:00:10
(1 row)

-- DML on candidate table
INSERT INTO mpp21090_xchange_pttab_dropcol_idx_dml_interval_candidate SELECT '1 sec','b', 1, '1 sec';
SELECT * FROM mpp21090_xchange_pttab_dropcol_idx_dml_interval_candidate ORDER BY 1,2,3;
   col2   | col3 | col4 |   col5   
----------+------+------+----------
 00:00:01 | b    |    1 | 00:00:01
 00:00:10 | a    |    0 | 00:00:10
(2 rows)

UPDATE mpp21090_xchange_pttab_dropcol_idx_dml_interval_candidate SET col2='10 secs' WHERE col3='a';
SELECT * FROM mpp21090_xchange_pttab_dropcol_idx_dml_interval_candidate ORDER BY 1,2,3;
   col2   | col3 | col4 |   col5   
----------+------+------+----------
 00:00:01 | b    |    1 | 00:00:01
 00:00:10 | a    |    0 | 00:00:10
(2 rows)

DELETE FROM mpp21090_xchange_pttab_dropcol_idx_dml_interval_candidate WHERE col3='a';
SELECT * FROM mpp21090_xchange_pttab_dropcol_idx_dml_interval_candidate ORDER BY 1,2,3;
   col2   | col3 | col4 |   col5   
----------+------+------+----------
 00:00:01 | b    |    1 | 00:00:01
(1 row)

-- TEST
DROP TABLE IF EXISTS mpp21090_xchange_pttab_dropcol_idx_dml_numeric;
NOTICE:  table "mpp21090_xchange_pttab_dropcol_idx_dml_numeric" does not exist, skipping
CREATE TABLE mpp21090_xchange_pttab_dropcol_idx_dml_numeric
(
    col1 numeric,
    col2 numeric,
    col3 char,
    col4 int,
    col5 numeric
) 
DISTRIBUTED by (col1)
PARTITION BY RANGE(col2)(partition partone start(1.000000) end(10.000000)  WITH (APPENDONLY=true, COMPRESSLEVEL=5, ORIENTATION=column),partition parttwo start(10.000000) end(20.000000) WITH (APPENDONLY=true, COMPRESSLEVEL=5, ORIENTATION=row),partition partthree start(20.000000) end(30.000000));
NOTICE:  CREATE TABLE will create partition "mpp21090_xchange_pttab_dropcol_idx_dml_numeric_1_prt_partone" for table "mpp21090_xchange_pttab_dropcol_idx_dml_numeric"
NOTICE:  CREATE TABLE will create partition "mpp21090_xchange_pttab_dropcol_idx_dml_numeric_1_prt_parttwo" for table "mpp21090_xchange_pttab_dropcol_idx_dml_numeric"
NOTICE:  CREATE TABLE will create partition "mpp21090_xchange_pttab_dropcol_idx_dml_numeric_1_prt_partthree" for table "mpp21090_xchange_pttab_dropcol_idx_dml_numeric"
INSERT INTO mpp21090_xchange_pttab_dropcol_idx_dml_numeric VALUES(2.000000,2.000000,'a',0, 2.000000);
SELECT * FROM mpp21090_xchange_pttab_dropcol_idx_dml_numeric ORDER BY 1,2,3,4;
   col1   |   col2   | col3 | col4 |   col5   
----------+----------+------+------+----------
 2.000000 | 2.000000 | a    |    0 | 2.000000
(1 row)

DROP INDEX IF EXISTS mpp21090_xchange_pttab_dropcol_idx_dml_idx_numeric;
NOTICE:  index "mpp21090_xchange_pttab_dropcol_idx_dml_idx_numeric" does not exist, skipping
CREATE INDEX mpp21090_xchange_pttab_dropcol_idx_dml_idx_numeric on mpp21090_xchange_pttab_dropcol_idx_dml_numeric(col2);
NOTICE:  building index for child partition "mpp21090_xchange_pttab_dropcol_idx_dml_numeric_1_prt_partone"
NOTICE:  building index for child partition "mpp21090_xchange_pttab_dropcol_idx_dml_numeric_1_prt_parttwo"
NOTICE:  building index for child partition "mpp21090_xchange_pttab_dropcol_idx_dml_numeric_1_prt_partthree"
ALTER TABLE mpp21090_xchange_pttab_dropcol_idx_dml_numeric DROP COLUMN col1;
NOTICE:  Dropping a column that is part of the distribution policy forces a NULL distribution policy
NOTICE:  Dropping a column that is part of the distribution policy forces a NULL distribution policy
NOTICE:  Dropping a column that is part of the distribution policy forces a NULL distribution policy
NOTICE:  Dropping a column that is part of the distribution policy forces a NULL distribution policy
-- Create Candidate table for Exchange
DROP TABLE IF EXISTS mpp21090_xchange_pttab_dropcol_idx_dml_numeric_candidate;
NOTICE:  table "mpp21090_xchange_pttab_dropcol_idx_dml_numeric_candidate" does not exist, skipping
CREATE TABLE mpp21090_xchange_pttab_dropcol_idx_dml_numeric_candidate( like mpp21090_xchange_pttab_dropcol_idx_dml_numeric) distributed randomly;
INSERT INTO mpp21090_xchange_pttab_dropcol_idx_dml_numeric_candidate VALUES(2.000000,'z',1,2.000000);
-- Exchange 
ALTER TABLE mpp21090_xchange_pttab_dropcol_idx_dml_numeric EXCHANGE PARTITION FOR(5.000000) WITH TABLE mpp21090_xchange_pttab_dropcol_idx_dml_numeric_candidate;
NOTICE:  exchanged partition "partone" of relation "mpp21090_xchange_pttab_dropcol_idx_dml_numeric" with relation "mpp21090_xchange_pttab_dropcol_idx_dml_numeric_candidate"
SELECT * FROM mpp21090_xchange_pttab_dropcol_idx_dml_numeric ORDER BY 1,2,3;
   col2   | col3 | col4 |   col5   
----------+------+------+----------
 2.000000 | z    |    1 | 2.000000
(1 row)

SELECT * FROM mpp21090_xchange_pttab_dropcol_idx_dml_numeric_candidate ORDER BY 1,2,3;
   col2   | col3 | col4 |   col5   
----------+------+------+----------
 2.000000 | a    |    0 | 2.000000
(1 row)

-- DML on partition table
INSERT INTO mpp21090_xchange_pttab_dropcol_idx_dml_numeric SELECT  1.000000,'b', 1, 1.000000;
SELECT * FROM mpp21090_xchange_pttab_dropcol_idx_dml_numeric ORDER BY 1,2,3;
   col2   | col3 | col4 |   col5   
----------+------+------+----------
 1.000000 | b    |    1 | 1.000000
 2.000000 | z    |    1 | 2.000000
(2 rows)

UPDATE mpp21090_xchange_pttab_dropcol_idx_dml_numeric SET col5 = 35.000000 WHERE col2 = 1.000000 AND col5 = 1.000000;
SELECT * FROM mpp21090_xchange_pttab_dropcol_idx_dml_numeric ORDER BY 1,2,3;
   col2   | col3 | col4 |   col5    
----------+------+------+-----------
 1.000000 | b    |    1 | 35.000000
 2.000000 | z    |    1 |  2.000000
(2 rows)

UPDATE mpp21090_xchange_pttab_dropcol_idx_dml_numeric SET col2 =2.000000 WHERE col3='b';
SELECT * FROM mpp21090_xchange_pttab_dropcol_idx_dml_numeric ORDER BY 1,2,3;
   col2   | col3 | col4 |   col5    
----------+------+------+-----------
 2.000000 | b    |    1 | 35.000000
 2.000000 | z    |    1 |  2.000000
(2 rows)

DELETE FROM mpp21090_xchange_pttab_dropcol_idx_dml_numeric WHERE col3='b';
SELECT * FROM mpp21090_xchange_pttab_dropcol_idx_dml_numeric ORDER BY 1,2,3;
   col2   | col3 | col4 |   col5   
----------+------+------+----------
 2.000000 | z    |    1 | 2.000000
(1 row)

-- DML on candidate table
INSERT INTO mpp21090_xchange_pttab_dropcol_idx_dml_numeric_candidate SELECT 1.000000,'b', 1, 1.000000;
SELECT * FROM mpp21090_xchange_pttab_dropcol_idx_dml_numeric_candidate ORDER BY 1,2,3;
   col2   | col3 | col4 |   col5   
----------+------+------+----------
 1.000000 | b    |    1 | 1.000000
 2.000000 | a    |    0 | 2.000000
(2 rows)

UPDATE mpp21090_xchange_pttab_dropcol_idx_dml_numeric_candidate SET col2=2.000000 WHERE col3='a';
SELECT * FROM mpp21090_xchange_pttab_dropcol_idx_dml_numeric_candidate ORDER BY 1,2,3;
   col2   | col3 | col4 |   col5   
----------+------+------+----------
 1.000000 | b    |    1 | 1.000000
 2.000000 | a    |    0 | 2.000000
(2 rows)

DELETE FROM mpp21090_xchange_pttab_dropcol_idx_dml_numeric_candidate WHERE col3='a';
SELECT * FROM mpp21090_xchange_pttab_dropcol_idx_dml_numeric_candidate ORDER BY 1,2,3;
   col2   | col3 | col4 |   col5   
----------+------+------+----------
 1.000000 | b    |    1 | 1.000000
(1 row)

-- As of this writing, pg_dump creates an invalid dump for some of the tables
-- here. See https://github.com/greenplum-db/gpdb/issues/3598. So we must drop
-- the tables, or the pg_upgrade test fails.
set client_min_messages='warning';
drop schema qp_dropped_cols cascade;
