-- First create a bunch of test tables
CREATE TABLE dml_ao_check_r (
	a int default 100 CHECK( a between 1 and 105),
	b float8 CONSTRAINT rcheck_b CHECK( b <> 0.00 and b IS NOT NULL),
	c text,
	d numeric NOT NULL)
DISTRIBUTED BY (a)
partition by list(b) (
	partition one values (1.0,2.0,3.0,4.0,5.0),
	partition two values(6.0,7.0,8.0,9.0,10.00),
	default partition def
);
CREATE TABLE dml_ao_check_s (
	a int CONSTRAINT scheck_a NOT NULL CHECK(a >= 0 and a < 110),
	b int CONSTRAINT scheck_b CHECK( b is not null),
	c text ,
	d numeric CHECK (d - 1 <> 17) )
DISTRIBUTED BY (b)
partition by range(a)
(
        start(1) end(102) every(10),
        default partition def
);
CREATE TABLE dml_ao_check_p (
	a int NOT NULL CONSTRAINT p_check_a CHECK( a <= 100) ,
	b text DEFAULT 'defval',
	c text ,
	d float8 CONSTRAINT p_check_d CHECK( d <= 100.00),
	CHECK ( b = c )
) DISTRIBUTED BY (a,b);
INSERT INTO dml_ao_check_r SELECT i, i * 3.33,'r', i % 6 FROM generate_series(1,100)i;
INSERT INTO dml_ao_check_r VALUES(DEFAULT,1.00,'rn',0),(NULL,2.00,'rn',0),(NULL,3.00,'rn',0),(NULL,4.00,'rn',0),(DEFAULT,5.00,'rn',0);
INSERT INTO dml_ao_check_s VALUES(1,1,'sn',NULL),(2,2,'sn',NULL),(3,3,'sn',NULL),(4,4,'sn',NULL),(5,5,'sn',NULL);
INSERT INTO dml_ao_check_s SELECT i, i * 3,'s', i / 6 FROM generate_series(1,100)i;
INSERT INTO dml_ao_check_p SELECT i, 'p','p', i FROM generate_series(1,100)i;
INSERT INTO dml_ao_check_p VALUES(1,'pn','pn',NULL),(2,'pn','pn',NULL),(3,'pn','pn',NULL),(4,'pn','pn',NULL),(5,'pn','pn',NULL);
CREATE TABLE dml_ao_pt_r (
	a int ,
	b int ,
	c text ,
	d numeric)
WITH (appendonly = true)
DISTRIBUTED BY (a)
partition by range(b) (
	start(1) end(301) every(10));
CREATE TABLE dml_ao_pt_s (
	a int ,
	b int,
	c text ,
	d numeric)
WITH (appendonly = true)
DISTRIBUTED BY (b)
partition by range(a) (
	start(1) end(101) every(100),
	default partition def);
CREATE TABLE dml_ao_pt_p (
	a int ,
	b int,
	c text ,
	d numeric)
WITH (appendonly = true)
DISTRIBUTED BY (a,b)
partition by list(a,d) (
	partition one VALUES ((1,1),(1,2),(1,3),(1,4),(1,5)),
	partition two VALUES((2,1),(2,2),(2,3),(2,4),(2,5)),
	default partition def);
INSERT INTO dml_ao_pt_r SELECT generate_series(1,100), generate_series(1,100) * 3,'r', generate_series(1,100) % 6;
INSERT INTO dml_ao_pt_p SELECT generate_series(1,100), generate_series(1,100) * 3,'p', generate_series(1,100) % 6;
INSERT INTO dml_ao_pt_p VALUES(generate_series(1,10),NULL,'pn',NULL);
INSERT INTO dml_ao_pt_p VALUES(NULL,1,'pn',NULL),(1,NULL,'pn',0),(NULL,NULL,'pn',0),(0,1,'pn',NULL),(NULL,NULL,'pn',NULL);
INSERT INTO dml_ao_pt_s SELECT generate_series(1,100), generate_series(1,100) * 3,'s', generate_series(1,100) % 6;
INSERT INTO dml_ao_pt_s VALUES(generate_series(1,10),NULL,'sn',NULL);
INSERT INTO dml_ao_pt_s VALUES(NULL,1,'sn',NULL),(1,NULL,'sn',0),(NULL,NULL,'sn',0),(0,1,'sn',NULL),(NULL,NULL,'sn',NULL);
CREATE TABLE dml_ao_r (a int , b int default -1, c text) WITH (appendonly = true) DISTRIBUTED BY (a);
CREATE TABLE dml_ao_p (a numeric, b decimal , c boolean , d text , e int) WITH (appendonly = true) DISTRIBUTED BY (a,b);
CREATE TABLE dml_ao_s as select dml_ao_r.b, dml_ao_r.a, dml_ao_r.c from dml_ao_r, dml_ao_p WHERE dml_ao_r.a = dml_ao_p.a;
ALTER TABLE dml_ao_s SET DISTRIBUTED BY (b);
INSERT INTO dml_ao_p SELECT id * 1.012, id * 1.1, true, 'new', id as d FROM (SELECT * FROM generate_series(1,100) as id) AS x;
INSERT INTO dml_ao_p VALUES(generate_series(1,10),NULL,false,'pn',NULL);
INSERT INTO dml_ao_p VALUES(NULL,1,false,'pn',NULL),(1,NULL,false,'pn',0),(NULL,NULL,false,'pn',0);
INSERT INTO dml_ao_s VALUES(generate_series(1,100),generate_series(1,100),'s');
INSERT INTO dml_ao_s VALUES(NULL,NULL,'sn'),(1,NULL,'sn'),(NULL,0,'sn');
INSERT INTO dml_ao_s VALUES(generate_series(1,10),NULL,'sn');
INSERT INTO dml_ao_r VALUES(generate_series(1,100),generate_series(1,100),'r');
INSERT INTO dml_ao_r VALUES(NULL,NULL,'rn'),(1,NULL,'rn'),(NULL,0,'rn');
INSERT INTO dml_ao_r VALUES(generate_series(1,10),NULL,'rn');
CREATE TABLE dml_co_check_r (
	a int default 100 CHECK( a between 1 and 105),
	b float8 CONSTRAINT rcheck_b CHECK( b <> 0.00 and b IS NOT NULL),
	c text,
	d numeric NOT NULL)
DISTRIBUTED BY (a)
partition by list(b) (
	partition one values (1.0,2.0,3.0,4.0,5.0),
	partition two values(6.0,7.0,8.0,9.0,10.00),
	default partition def
);
CREATE TABLE dml_co_check_s (
	a int CONSTRAINT scheck_a NOT NULL CHECK(a >= 0 and a < 110),
	b int CONSTRAINT scheck_b CHECK( b is not null),
	c text ,
	d numeric CHECK (d - 1 <> 17) )
DISTRIBUTED BY (b)
partition by range(a)
(
        start(1) end(102) every(10),
        default partition def
);
CREATE TABLE dml_co_check_p (
	a int NOT NULL CONSTRAINT p_check_a CHECK( a <= 100) ,
	b text DEFAULT 'defval',
	c text ,
	d float8 CONSTRAINT p_check_d CHECK( d <= 100.00),
	CHECK ( b = c )
) DISTRIBUTED BY (a,b);
INSERT INTO dml_co_check_r SELECT i, i * 3.33,'r', i % 6 FROM generate_series(1,100)i;
INSERT INTO dml_co_check_r VALUES(DEFAULT,1.00,'rn',0),(NULL,2.00,'rn',0),(NULL,3.00,'rn',0),(NULL,4.00,'rn',0),(DEFAULT,5.00,'rn',0);
INSERT INTO dml_co_check_s SELECT i, i * 3,'s', i / 6 FROM generate_series(1,100)i;
INSERT INTO dml_co_check_s VALUES(1,1,'sn',NULL),(2,2,'sn',NULL),(3,3,'sn',NULL),(4,4,'sn',NULL),(5,5,'sn',NULL);
INSERT INTO dml_co_check_p SELECT i, 'p','p', i FROM generate_series(1,100)i;
INSERT INTO dml_co_check_p VALUES(1,'pn','pn',NULL),(2,'pn','pn',NULL),(3,'pn','pn',NULL),(4,'pn','pn',NULL),(5,'pn','pn',NULL);
CREATE TABLE dml_co_pt_r (
	a int ,
	b int ,
	c text ,
	d numeric)
WITH (appendonly = true, orientation = column)
DISTRIBUTED BY (a)
partition by range(b) (
	start(1) end(301) every(10));
CREATE TABLE dml_co_pt_s (
	a int ,
	b int,
	c text ,
	d numeric)
WITH (appendonly = true, orientation = column)
DISTRIBUTED BY (b)
partition by range(a) (
	start(1) end(100) every(10),
	default partition def);
CREATE TABLE dml_co_pt_p (
	a int ,
	b int,
	c text ,
	d numeric)
WITH (appendonly = true, orientation = column)
DISTRIBUTED BY (a,b)
partition by list(a,d) (
	partition one VALUES ((1,1),(1,2),(1,3),(1,4),(1,5)),
	partition two VALUES((2,1),(2,2),(2,3),(2,4),(2,5)),
	default partition def);
INSERT INTO dml_co_pt_r SELECT generate_series(1,100), generate_series(1,100) * 3,'r', generate_series(1,100) % 6;
INSERT INTO dml_co_pt_p SELECT generate_series(1,100), generate_series(1,100) * 3,'p', generate_series(1,100) % 6;
INSERT INTO dml_co_pt_p VALUES(generate_series(1,10),NULL,'pn',NULL);
INSERT INTO dml_co_pt_p VALUES(NULL,1,'pn',NULL),(1,NULL,'pn',0),(NULL,NULL,'pn',0),(0,1,'pn',NULL),(NULL,NULL,'pn',NULL);
INSERT INTO dml_co_pt_s SELECT generate_series(1,100), generate_series(1,100) * 3,'s', generate_series(1,100) % 6;
INSERT INTO dml_co_pt_s VALUES(generate_series(1,10),NULL,'sn',NULL);
INSERT INTO dml_co_pt_s VALUES(NULL,1,'sn',NULL),(1,NULL,'sn',0),(NULL,NULL,'sn',0),(0,1,'sn',NULL),(NULL,NULL,'sn',NULL);
CREATE TABLE dml_co_r (a int , b int default -1, c text) WITH (appendonly = true, orientation = column) DISTRIBUTED BY (a);
CREATE TABLE dml_co_p (a numeric, b decimal , c boolean , d text , e int) WITH (appendonly = true, orientation = column) DISTRIBUTED BY (a,b);
CREATE TABLE dml_co_s as select dml_co_r.b, dml_co_r.a, dml_co_r.c from dml_co_r, dml_co_p WHERE dml_co_r.a = dml_co_p.a;
ALTER TABLE dml_co_s SET DISTRIBUTED BY (b);
INSERT INTO dml_co_p SELECT id * 1.012, id * 1.1, true, 'new', id as d FROM (SELECT * FROM generate_series(1,100) as id) AS x;
INSERT INTO dml_co_p VALUES(generate_series(1,10),NULL,false,'pn',NULL);
INSERT INTO dml_co_p VALUES(NULL,1,false,'pn',NULL),(1,NULL,false,'pn',0),(NULL,NULL,false,'pn',0);
INSERT INTO dml_co_s VALUES(generate_series(1,100),generate_series(1,100),'s');
INSERT INTO dml_co_s VALUES(NULL,NULL,'sn'),(1,NULL,'sn'),(NULL,0,'sn');
INSERT INTO dml_co_s VALUES(generate_series(1,10),NULL,'sn');
INSERT INTO dml_co_r VALUES(generate_series(1,100),generate_series(1,100),'r');
INSERT INTO dml_co_r VALUES(NULL,NULL,'rn'),(1,NULL,'rn'),(NULL,0,'rn');
INSERT INTO dml_co_r VALUES(generate_series(1,10),NULL,'rn');
DROP TABLE IF EXISTS dml_heap_check_p;
DROP TABLE IF EXISTS dml_heap_check_r;
DROP TABLE IF EXISTS dml_heap_check_s;
CREATE TABLE dml_heap_check_r (
	a int default 100 CHECK( a between 1 and 105),
	b float8 CONSTRAINT rcheck_b CHECK( b <> 0.00 and b IS NOT NULL),
	c text,
	d numeric NOT NULL)
DISTRIBUTED BY (a)
partition by list(b) (
	partition one values (1.0,2.0,3.0,4.0,5.0),
	partition two values(6.0,7.0,8.0,9.0,10.00),
	default partition def
);
CREATE TABLE dml_heap_check_s (
	a int CONSTRAINT scheck_a NOT NULL CHECK(a >= 0 and a < 110),
	b int CONSTRAINT scheck_b CHECK( b is not null),
	c text ,
	d numeric CHECK (d - 1 <> 17) )
DISTRIBUTED BY (b)
partition by range(a)
(
        start(1) end(102) every(10),
        default partition def
);
CREATE TABLE dml_heap_check_p (
	a int NOT NULL CONSTRAINT p_check_a CHECK( a <= 100) ,
	b text DEFAULT 'defval',
	c text ,
	d float8 CONSTRAINT p_check_d CHECK( d <= 100.00),
	CHECK ( b = c )
) DISTRIBUTED BY (a,b);
INSERT INTO dml_heap_check_r SELECT i, i * 3.33,'r', i % 6 FROM generate_series(1,100)i;
INSERT INTO dml_heap_check_r VALUES(DEFAULT,1.00,'rn',0),(NULL,2.00,'rn',0),(NULL,3.00,'rn',0),(NULL,4.00,'rn',0),(DEFAULT,5.00,'rn',0);
INSERT INTO dml_heap_check_s SELECT i, i * 3,'s', i / 6 FROM generate_series(1,100)i;
INSERT INTO dml_heap_check_s VALUES(1,1,'sn',NULL),(2,2,'sn',NULL),(3,3,'sn',NULL),(4,4,'sn',NULL),(5,5,'sn',NULL);
INSERT INTO dml_heap_check_p SELECT i, 'p','p', i FROM generate_series(1,100)i;
INSERT INTO dml_heap_check_p VALUES(1,'pn','pn',NULL),(2,'pn','pn',NULL),(3,'pn','pn',NULL),(4,'pn','pn',NULL),(5,'pn','pn',NULL);
CREATE TABLE dml_heap_r (a int , b int default -1, c text) DISTRIBUTED BY (a);
CREATE TABLE dml_heap_p (a numeric, b decimal , c boolean , d text , e int) DISTRIBUTED BY (a,b);
CREATE TABLE dml_heap_s as select dml_heap_r.b, dml_heap_r.a, dml_heap_r.c from dml_heap_r, dml_heap_p WHERE dml_heap_r.a = dml_heap_p.a;
ALTER TABLE dml_heap_s SET DISTRIBUTED BY (b);
INSERT INTO dml_heap_p SELECT id * 1.012, id * 1.1, true, 'new', id as d FROM (SELECT * FROM generate_series(1,100) as id) AS x;
INSERT INTO dml_heap_p VALUES(generate_series(1,10),NULL,false,'pn',NULL);
INSERT INTO dml_heap_p VALUES(NULL,1,false,'pn',NULL),(1,NULL,false,'pn',0),(NULL,NULL,false,'pn',0);
INSERT INTO dml_heap_s VALUES(generate_series(1,100),generate_series(1,100),'s');
INSERT INTO dml_heap_s VALUES(NULL,NULL,'sn'),(1,NULL,'sn'),(NULL,0,'sn');
INSERT INTO dml_heap_s VALUES(generate_series(1,10),NULL,'sn');
INSERT INTO dml_heap_r VALUES(generate_series(1,100),generate_series(1,100),'r');
INSERT INTO dml_heap_r VALUES(NULL,NULL,'rn'),(1,NULL,'rn'),(NULL,0,'rn');
INSERT INTO dml_heap_r VALUES(generate_series(1,10),NULL,'rn');
CREATE TABLE dml_heap_pt_r (
	a int ,
	b int ,
	c text ,
	d numeric)
DISTRIBUTED BY (a)
partition by range(b) (
	start(1) end(301) every(10));
CREATE TABLE dml_heap_pt_s (
	a int ,
	b int,
	c text ,
	d numeric)
DISTRIBUTED BY (b)
partition by range(a) (
	start(1) end(101) every(10),
	default partition def);
CREATE TABLE dml_heap_pt_p (
	a int ,
	b int,
	c text ,
	d numeric)
DISTRIBUTED BY (a,b)
partition by list(a,d) (
	partition one VALUES ((1,1),(1,2),(1,3),(1,4),(1,5)),
	partition two VALUES((2,1),(2,2),(2,3),(2,4),(2,5)),
	default partition def);
INSERT INTO dml_heap_pt_r SELECT generate_series(1,100), generate_series(1,100) * 3,'r', generate_series(1,100) % 6;
INSERT INTO dml_heap_pt_p SELECT generate_series(1,100), generate_series(1,100) * 3,'p', generate_series(1,100) % 6;
INSERT INTO dml_heap_pt_p VALUES(generate_series(1,10),NULL,'pn',NULL);
INSERT INTO dml_heap_pt_p VALUES(NULL,1,'pn',NULL),(1,NULL,'pn',0),(NULL,NULL,'pn',0),(0,1,'pn',NULL),(NULL,NULL,'pn',NULL);
INSERT INTO dml_heap_pt_s SELECT generate_series(1,100), generate_series(1,100) * 3,'s', generate_series(1,100) % 6;
INSERT INTO dml_heap_pt_s VALUES(generate_series(1,10),NULL,'sn',NULL);
INSERT INTO dml_heap_pt_s VALUES(NULL,1,'sn',NULL),(1,NULL,'sn',0),(NULL,NULL,'sn',0),(0,1,'sn',NULL),(NULL,NULL,'sn',NULL);
--Insert data that satisfy the check constraints
begin;
SELECT COUNT(*) FROM dml_ao_check_s;
 count 
-------
   105
(1 row)

SELECT COUNT(*) FROM (SELECT dml_ao_check_s.a, dml_ao_check_s.b, 'text', dml_ao_check_s.d FROM dml_ao_check_r, dml_ao_check_s WHERE dml_ao_check_r.a = dml_ao_check_s.b)foo;
 count 
-------
    38
(1 row)

INSERT INTO dml_ao_check_s SELECT dml_ao_check_s.a, dml_ao_check_s.b, 'text', dml_ao_check_s.d FROM dml_ao_check_r, dml_ao_check_s WHERE dml_ao_check_r.a = dml_ao_check_s.b ;
SELECT COUNT(*) FROM dml_ao_check_s;
 count 
-------
   143
(1 row)

rollback;
--Negative test - Insert default value violates check constraint
SELECT COUNT(*) FROM dml_ao_check_p;
 count 
-------
   105
(1 row)

INSERT INTO dml_ao_check_p select generate_series(1,100),'p', generate_series(1,100);
ERROR:  new row for relation "dml_ao_check_p" violates check constraint "dml_ao_check_p_check"
SELECT COUNT(*) FROM dml_ao_check_p;
 count 
-------
   105
(1 row)

--Negative test - Insert default value violates NOT NULL constraint
SELECT COUNT(*) FROM dml_ao_check_s;
 count 
-------
   105
(1 row)

INSERT INTO dml_ao_check_s values(default,1,'nn',1.0000);
ERROR:  null value in column "a" violates not-null constraint  (seg0 127.0.0.1:40000 pid=18972)
SELECT COUNT(*) FROM dml_ao_check_s;
 count 
-------
   105
(1 row)

--Insert with joins where the result tuples violate violates multiple check constraints
SELECT COUNT(*) FROM dml_ao_check_r;
 count 
-------
   105
(1 row)

SELECT COUNT(*) FROM (SELECT dml_ao_check_r.a + 110 , 0, dml_ao_check_r.c, NULL FROM dml_ao_check_r, dml_ao_check_s WHERE dml_ao_check_r.a = dml_ao_check_s.a)foo;
 count 
-------
   107
(1 row)

INSERT INTO dml_ao_check_r SELECT dml_ao_check_r.a + 110 , 0, dml_ao_check_r.c, NULL FROM dml_ao_check_r, dml_ao_check_s WHERE dml_ao_check_r.a = dml_ao_check_s.a;
ERROR:  null value in column "d" violates not-null constraint  (seg0 127.0.0.1:40000 pid=18972)
SELECT COUNT(*) FROM dml_ao_check_r;
 count 
-------
   105
(1 row)

--Insert with generate_series
begin;
SELECT COUNT(*) FROM dml_ao_pt_r;
 count 
-------
   100
(1 row)

INSERT INTO dml_ao_pt_r values(generate_series(1,10), generate_series(1,100), 'text');
SELECT COUNT(*) FROM dml_ao_pt_r WHERE c ='text';
 count 
-------
   100
(1 row)

SELECT COUNT(*) FROM dml_ao_pt_r;
 count 
-------
   200
(1 row)

rollback;
--Insert with generate_series and NULL
begin;
SELECT COUNT(*) FROM dml_ao_pt_r;
 count 
-------
   100
(1 row)

ALTER TABLE dml_ao_pt_r ADD DEFAULT partition def;
INSERT INTO dml_ao_pt_r values(generate_series(1,10),NULL,'text');
SELECT * FROM dml_ao_pt_r WHERE c ='text' ORDER BY 1;
 a  | b |  c   | d 
----+---+------+---
  1 |   | text |  
  2 |   | text |  
  3 |   | text |  
  4 |   | text |  
  5 |   | text |  
  6 |   | text |  
  7 |   | text |  
  8 |   | text |  
  9 |   | text |  
 10 |   | text |  
(10 rows)

ALTER TABLE dml_ao_pt_r DROP DEFAULT partition;
NOTICE:  dropped partition "def" for relation "dml_ao_pt_r"
SELECT COUNT(*) FROM dml_ao_pt_r;
 count 
-------
   100
(1 row)

rollback;
--Insert with generate_series
begin;
SELECT COUNT(*) FROM dml_ao_pt_r;
 count 
-------
   100
(1 row)

TRUNCATE TABLE dml_ao_pt_r;
INSERT INTO dml_ao_pt_r SELECT generate_series(1,10),1;
SELECT * FROM dml_ao_pt_r ORDER BY 1;
 a  | b | c | d 
----+---+---+---
  1 | 1 |   |  
  2 | 1 |   |  
  3 | 1 |   |  
  4 | 1 |   |  
  5 | 1 |   |  
  6 | 1 |   |  
  7 | 1 |   |  
  8 | 1 |   |  
  9 | 1 |   |  
 10 | 1 |   |  
(10 rows)

SELECT COUNT(*) FROM dml_ao_pt_r;
 count 
-------
    10
(1 row)

SELECT COUNT(*) FROM dml_ao_pt_r;
 count 
-------
    10
(1 row)

rollback;
--Insert with generate_series
begin;
SELECT COUNT(*) FROM dml_ao_pt_r;
 count 
-------
   100
(1 row)

INSERT INTO dml_ao_pt_r SELECT generate_series(1,10), generate_series(1,10),'text';
SELECT COUNT(*) FROM dml_ao_pt_r WHERE c ='text';
 count 
-------
    10
(1 row)

SELECT COUNT(*) FROM dml_ao_pt_r;
 count 
-------
   110
(1 row)

rollback;
--Insert with generate_series
begin;
SELECT COUNT(*) FROM dml_ao_pt_r;
 count 
-------
   100
(1 row)

INSERT INTO dml_ao_pt_r SELECT *,1 from generate_series(1,10);
SELECT COUNT(*) FROM dml_ao_pt_r;
 count 
-------
   110
(1 row)

rollback;
--Join on the non-distribution key of target table
begin;
SELECT COUNT(*) FROM dml_ao_pt_r;
 count 
-------
   100
(1 row)

SELECT COUNT(*) FROM (SELECT dml_ao_pt_r.* FROM dml_ao_pt_r,dml_ao_pt_s  WHERE dml_ao_pt_r.b = dml_ao_pt_s.a)foo;
 count 
-------
    36
(1 row)

INSERT INTO dml_ao_pt_r SELECT dml_ao_pt_r.* FROM dml_ao_pt_r,dml_ao_pt_s  WHERE dml_ao_pt_r.b = dml_ao_pt_s.a;
SELECT COUNT(*) FROM dml_ao_pt_r;
 count 
-------
   136
(1 row)

rollback;
--Join on the distribution key of target table
begin;
SELECT COUNT(*) FROM dml_ao_pt_s;
 count 
-------
   115
(1 row)

SELECT COUNT(*) FROM (SELECT dml_ao_pt_s.* FROM dml_ao_pt_r,dml_ao_pt_s WHERE dml_ao_pt_s.a = dml_ao_pt_r.a)foo;
 count 
-------
   111
(1 row)

INSERT INTO dml_ao_pt_s SELECT dml_ao_pt_s.* FROM dml_ao_pt_r,dml_ao_pt_s WHERE dml_ao_pt_s.a = dml_ao_pt_r.a;
SELECT COUNT(*) FROM dml_ao_pt_s;
 count 
-------
   226
(1 row)

rollback;
--Join on distribution key of target table
begin;
SELECT COUNT(*) FROM dml_ao_pt_r;
 count 
-------
   100
(1 row)

SELECT COUNT(*) FROM (SELECT dml_ao_pt_r.a,dml_ao_pt_r.b,dml_ao_pt_s.c FROM dml_ao_pt_s INNER JOIN dml_ao_pt_r on dml_ao_pt_r.a = dml_ao_pt_s.a)foo;
 count 
-------
   111
(1 row)

INSERT INTO dml_ao_pt_r SELECT dml_ao_pt_r.a,dml_ao_pt_r.b,dml_ao_pt_s.c FROM dml_ao_pt_s INNER JOIN dml_ao_pt_r on dml_ao_pt_r.a = dml_ao_pt_s.a ;
SELECT COUNT(*) FROM dml_ao_pt_r;
 count 
-------
   211
(1 row)

rollback;
--Join on the distribution key of target table. Insert Large number of rows
begin;
SELECT COUNT(*) FROM dml_ao_pt_s;
 count 
-------
   115
(1 row)

SELECT COUNT(*) FROM (SELECT dml_ao_pt_r.a,dml_ao_pt_r.b,dml_ao_pt_s.c FROM dml_ao_pt_s INNER JOIN dml_ao_pt_r on dml_ao_pt_r.b = dml_ao_pt_s.b)foo;
 count 
-------
   100
(1 row)

INSERT INTO dml_ao_pt_s SELECT dml_ao_pt_r.a,dml_ao_pt_r.b,dml_ao_pt_s.c FROM dml_ao_pt_s INNER JOIN dml_ao_pt_r on dml_ao_pt_r.b = dml_ao_pt_s.b ;
SELECT COUNT(*) FROM dml_ao_pt_s;
 count 
-------
   215
(1 row)

rollback;
--Join with different column order 
begin;
SELECT COUNT(*) FROM dml_ao_pt_r;
 count 
-------
   100
(1 row)

SELECT COUNT(*) FROM (SELECT dml_ao_pt_s.a,dml_ao_pt_r.b,'text' FROM dml_ao_pt_r,dml_ao_pt_s  WHERE dml_ao_pt_r.b = dml_ao_pt_s.b)foo;
 count 
-------
   100
(1 row)

INSERT INTO dml_ao_pt_r(b,a,c) SELECT dml_ao_pt_s.a,dml_ao_pt_r.b,'text' FROM dml_ao_pt_r,dml_ao_pt_s  WHERE dml_ao_pt_r.b = dml_ao_pt_s.b;
SELECT COUNT(*) FROM dml_ao_pt_r;
 count 
-------
   200
(1 row)

rollback;
--Join with Aggregate
begin;
SELECT COUNT(*) FROM dml_ao_pt_r;
 count 
-------
   100
(1 row)

ALTER TABLE dml_ao_pt_r ADD DEFAULT partition def;
SELECT COUNT(*) FROM (SELECT COUNT(*) + dml_ao_pt_s.a, dml_ao_pt_r.b + dml_ao_pt_r.a ,'text' FROM dml_ao_pt_r, dml_ao_pt_s WHERE dml_ao_pt_r.b = dml_ao_pt_s.b GROUP BY dml_ao_pt_s.a,dml_ao_pt_r.b,dml_ao_pt_r.a)foo;
 count 
-------
   100
(1 row)

INSERT INTO dml_ao_pt_r SELECT COUNT(*) + dml_ao_pt_s.a, dml_ao_pt_r.b + dml_ao_pt_r.a ,'text' FROM dml_ao_pt_r, dml_ao_pt_s WHERE dml_ao_pt_r.b = dml_ao_pt_s.b GROUP BY dml_ao_pt_s.a,dml_ao_pt_r.b,dml_ao_pt_r.a ;
SELECT COUNT(*) FROM dml_ao_pt_r;
 count 
-------
   200
(1 row)

rollback;
--Join with DISTINCT
begin;
SELECT COUNT(*) FROM dml_ao_pt_s;
 count 
-------
   115
(1 row)

SELECT COUNT(*) FROM (SELECT DISTINCT dml_ao_pt_r.a,dml_ao_pt_r.b,dml_ao_pt_s.c FROM dml_ao_pt_s INNER JOIN dml_ao_pt_r on dml_ao_pt_s.a = dml_ao_pt_r.a)foo;
 count 
-------
   110
(1 row)

INSERT INTO dml_ao_pt_s SELECT DISTINCT dml_ao_pt_r.a,dml_ao_pt_r.b,dml_ao_pt_s.c FROM dml_ao_pt_s INNER JOIN dml_ao_pt_r on dml_ao_pt_s.a = dml_ao_pt_r.a ;
SELECT COUNT(*) FROM dml_ao_pt_s;
 count 
-------
   225
(1 row)

rollback;
--Insert NULL with Joins
begin;
SELECT COUNT(*) FROM dml_ao_pt_r;
 count 
-------
   100
(1 row)

SELECT COUNT(*) FROM (SELECT NULL,dml_ao_pt_r.b,'text' FROM dml_ao_pt_r,dml_ao_pt_s WHERE dml_ao_pt_r.b = dml_ao_pt_s.b)foo;
 count 
-------
   100
(1 row)

INSERT INTO dml_ao_pt_r SELECT NULL,dml_ao_pt_r.b,'text' FROM dml_ao_pt_r,dml_ao_pt_s WHERE dml_ao_pt_r.b = dml_ao_pt_s.b;
SELECT COUNT(*) FROM dml_ao_pt_r;
 count 
-------
   200
(1 row)

rollback;
--Insert 0 rows
SELECT COUNT(*) FROM dml_ao_pt_r;
 count 
-------
   100
(1 row)

INSERT INTO dml_ao_pt_r SELECT dml_ao_pt_r.* FROM dml_ao_pt_r,dml_ao_pt_s WHERE dml_ao_pt_r.b = dml_ao_pt_s.a LIMIT 0;
SELECT COUNT(*) FROM dml_ao_pt_r;
 count 
-------
   100
(1 row)

--Insert 0 rows
SELECT COUNT(*) FROM dml_ao_pt_r;
 count 
-------
   100
(1 row)

INSERT INTO dml_ao_pt_r SELECT dml_ao_pt_r.* FROM dml_ao_pt_r,dml_ao_pt_s WHERE dml_ao_pt_r.b = dml_ao_pt_s.a and false;
SELECT COUNT(*) FROM dml_ao_pt_r;
 count 
-------
   100
(1 row)

--Negative tests Insert column of different data type
SELECT COUNT(*) FROM dml_ao_pt_r;
 count 
-------
   100
(1 row)

SELECT COUNT(*) FROM (SELECT ('a')::int, dml_ao_pt_r.b,10 FROM dml_ao_pt_s WHERE dml_ao_pt_r.b = dml_ao_pt_s.b)foo;
ERROR:  invalid input syntax for integer: "a"
LINE 1: SELECT COUNT(*) FROM (SELECT ('a')::int, dml_ao_pt_r.b,10 FR...
                                      ^
INSERT INTO dml_ao_pt_r SELECT ('a')::int, dml_ao_pt_r.b,10 FROM dml_ao_pt_s WHERE dml_ao_pt_r.b = dml_ao_pt_s.b;
ERROR:  invalid input syntax for integer: "a"
LINE 1: INSERT INTO dml_ao_pt_r SELECT ('a')::int, dml_ao_pt_r.b,10 ...
                                        ^
SELECT COUNT(*) FROM dml_ao_pt_r;
 count 
-------
   100
(1 row)

--Negative test case. INSERT has more expressions than target columns
begin;
SELECT COUNT(*) FROM dml_ao_pt_s;
 count 
-------
   115
(1 row)

SELECT COUNT(*) FROM (SELECT COUNT(*) as a, dml_ao_pt_r.b, dml_ao_pt_r.c, dml_ao_pt_r.d FROM dml_ao_pt_r, dml_ao_pt_s WHERE dml_ao_pt_s.a = dml_ao_pt_r.a GROUP BY dml_ao_pt_r.a, dml_ao_pt_r.b, dml_ao_pt_r.c, dml_ao_pt_r.d)foo;
 count 
-------
   100
(1 row)

INSERT INTO dml_ao_pt_s SELECT COUNT(*) as a, dml_ao_pt_r.b, dml_ao_pt_r.c, dml_ao_pt_r.d FROM dml_ao_pt_r, dml_ao_pt_s WHERE dml_ao_pt_s.a = dml_ao_pt_r.a GROUP BY dml_ao_pt_r.a, dml_ao_pt_r.b, dml_ao_pt_r.c, dml_ao_pt_r.d;
SELECT COUNT(*) FROM dml_ao_pt_s;
 count 
-------
   215
(1 row)

rollback;
--Insert with join on the partition key
begin;
SELECT COUNT(*) FROM dml_ao_pt_r;
 count 
-------
   100
(1 row)

SELECT COUNT(*) FROM (SELECT dml_ao_pt_r.* FROM dml_ao_pt_r, dml_ao_pt_s WHERE dml_ao_pt_r.b = dml_ao_pt_s.b)foo;
 count 
-------
   100
(1 row)

INSERT INTO dml_ao_pt_r SELECT dml_ao_pt_r.* FROM dml_ao_pt_r, dml_ao_pt_s WHERE dml_ao_pt_r.b = dml_ao_pt_s.b;
SELECT COUNT(*) FROM dml_ao_pt_r;
 count 
-------
   200
(1 row)

rollback;
--Negative test - Insert NULL value to a table without default partition
SELECT COUNT(*) FROM dml_ao_pt_r;
 count 
-------
   100
(1 row)

SELECT COUNT(*) FROM (SELECT dml_ao_pt_r.b, NULL, dml_ao_pt_r.c FROM dml_ao_pt_r, dml_ao_pt_s WHERE dml_ao_pt_r.b = dml_ao_pt_s.b)foo;
 count 
-------
   100
(1 row)

INSERT INTO dml_ao_pt_r SELECT dml_ao_pt_r.b, NULL, dml_ao_pt_r.c FROM dml_ao_pt_r, dml_ao_pt_s WHERE dml_ao_pt_r.b = dml_ao_pt_s.b;
ERROR:  no partition for partitioning key  (seg0 127.0.0.1:40000 pid=18972)
SELECT COUNT(*) FROM dml_ao_pt_r;
 count 
-------
   100
(1 row)

--Negative test - Insert out of partition range values for table without default partition
SELECT COUNT(*) FROM dml_ao_pt_r;
 count 
-------
   100
(1 row)

SELECT COUNT(*) FROM (SELECT dml_ao_pt_r.b ,dml_ao_pt_r.a + dml_ao_pt_s.a + 100, dml_ao_pt_r.c FROM dml_ao_pt_r, dml_ao_pt_s WHERE dml_ao_pt_r.a = dml_ao_pt_s.b)foo;
 count 
-------
    35
(1 row)

INSERT INTO dml_ao_pt_r SELECT dml_ao_pt_r.b ,dml_ao_pt_r.a + dml_ao_pt_s.a + 100, dml_ao_pt_r.c FROM dml_ao_pt_r, dml_ao_pt_s WHERE dml_ao_pt_r.a = dml_ao_pt_s.b;
ERROR:  no partition for partitioning key  (seg1 127.0.0.1:40001 pid=18973)
SELECT COUNT(*) FROM dml_ao_pt_r;
 count 
-------
   100
(1 row)

--Insert with generate_series
begin;
SELECT COUNT(*) FROM dml_ao_r;
 count 
-------
   113
(1 row)

INSERT INTO dml_ao_r values(generate_series(1,10), generate_series(1,100), 'text');
SELECT COUNT(*) FROM dml_ao_r WHERE c ='text';
 count 
-------
   100
(1 row)

SELECT COUNT(*) FROM dml_ao_r;
 count 
-------
   213
(1 row)

rollback;
--Insert with generate_series and NULL
begin;
SELECT COUNT(*) FROM dml_ao_r;
 count 
-------
   113
(1 row)

INSERT INTO dml_ao_r values(generate_series(1,10),NULL,'text');
SELECT * FROM dml_ao_r WHERE c ='text' ORDER BY 1;
 a  | b |  c   
----+---+------
  1 |   | text
  2 |   | text
  3 |   | text
  4 |   | text
  5 |   | text
  6 |   | text
  7 |   | text
  8 |   | text
  9 |   | text
 10 |   | text
(10 rows)

SELECT COUNT(*) FROM dml_ao_r;
 count 
-------
   123
(1 row)

rollback;
--Insert with generate_series
begin;
SELECT COUNT(*) FROM dml_ao_r;
 count 
-------
   113
(1 row)

TRUNCATE TABLE dml_ao_r;
INSERT INTO dml_ao_r SELECT generate_series(1,10);
SELECT * FROM dml_ao_r ORDER BY 1;
 a  | b  | c 
----+----+---
  1 | -1 | 
  2 | -1 | 
  3 | -1 | 
  4 | -1 | 
  5 | -1 | 
  6 | -1 | 
  7 | -1 | 
  8 | -1 | 
  9 | -1 | 
 10 | -1 | 
(10 rows)

SELECT COUNT(*) FROM dml_ao_r;
 count 
-------
    10
(1 row)

rollback;
--Insert with generate_series
begin;
SELECT COUNT(*) FROM dml_ao_r;
 count 
-------
   113
(1 row)

INSERT INTO dml_ao_r SELECT generate_series(1,10), generate_series(1,10),'text';
SELECT COUNT(*) FROM dml_ao_r WHERE c ='text';
 count 
-------
    10
(1 row)

SELECT COUNT(*) FROM dml_ao_r;
 count 
-------
   123
(1 row)

rollback;
--Insert with generate_series
begin;
SELECT COUNT(*) FROM dml_ao_r;
 count 
-------
   113
(1 row)

INSERT INTO dml_ao_r SELECT * from generate_series(1,10);
SELECT COUNT(*) FROM dml_ao_r;
 count 
-------
   123
(1 row)

rollback;
--Join on the non-distribution key of target table
begin;
SELECT COUNT(*) FROM dml_ao_r;
 count 
-------
   113
(1 row)

SELECT COUNT(*) FROM (SELECT dml_ao_r.* FROM dml_ao_r,dml_ao_s  WHERE dml_ao_r.b = dml_ao_s.b)foo;
 count 
-------
   111
(1 row)

INSERT INTO dml_ao_r SELECT dml_ao_r.* FROM dml_ao_r,dml_ao_s  WHERE dml_ao_r.b = dml_ao_s.b;
SELECT COUNT(*) FROM dml_ao_r;
 count 
-------
   224
(1 row)

rollback;
--Join on the distribution key of target table
begin;
SELECT COUNT(*) FROM dml_ao_s;
 count 
-------
   113
(1 row)

SELECT COUNT(*) FROM (SELECT dml_ao_s.* FROM dml_ao_r,dml_ao_s WHERE dml_ao_s.a = dml_ao_r.a)foo;
 count 
-------
   111
(1 row)

INSERT INTO dml_ao_s SELECT dml_ao_s.* FROM dml_ao_r,dml_ao_s WHERE dml_ao_s.a = dml_ao_r.a;
SELECT COUNT(*) FROM dml_ao_s;
 count 
-------
   224
(1 row)

rollback;
--Join on distribution key of target table
begin;
SELECT COUNT(*) FROM dml_ao_r;
 count 
-------
   113
(1 row)

SELECT COUNT(*) FROM (SELECT dml_ao_r.a,dml_ao_r.b,dml_ao_s.c FROM dml_ao_s INNER JOIN dml_ao_r on dml_ao_r.a = dml_ao_s.a)foo;
 count 
-------
   111
(1 row)

INSERT INTO dml_ao_r SELECT dml_ao_r.a,dml_ao_r.b,dml_ao_s.c FROM dml_ao_s INNER JOIN dml_ao_r on dml_ao_r.a = dml_ao_s.a ;
SELECT COUNT(*) FROM dml_ao_r;
 count 
-------
   224
(1 row)

rollback;
--Join on the distribution key of target table. Insert Large number of rows
begin;
SELECT COUNT(*) FROM dml_ao_s;
 count 
-------
   113
(1 row)

SELECT COUNT(*) FROM (SELECT dml_ao_r.a,dml_ao_r.b,dml_ao_s.c FROM dml_ao_s INNER JOIN dml_ao_r on dml_ao_r.b <> dml_ao_s.b )foo;
 count 
-------
 11100
(1 row)

INSERT INTO dml_ao_s SELECT dml_ao_r.a,dml_ao_r.b,dml_ao_s.c FROM dml_ao_s INNER JOIN dml_ao_r on dml_ao_r.b <> dml_ao_s.b ;
SELECT COUNT(*) FROM dml_ao_s;
 count 
-------
 11213
(1 row)

rollback;
--Join with different column order 
begin;
SELECT COUNT(*) FROM dml_ao_r;
 count 
-------
   113
(1 row)

SELECT COUNT(*) FROM (SELECT dml_ao_s.a,dml_ao_r.b,'text' FROM dml_ao_r,dml_ao_s  WHERE dml_ao_r.b = dml_ao_s.b)foo;
 count 
-------
   111
(1 row)

INSERT INTO dml_ao_r(b,a,c) SELECT dml_ao_s.a,dml_ao_r.b,'text' FROM dml_ao_r,dml_ao_s  WHERE dml_ao_r.b = dml_ao_s.b;
SELECT COUNT(*) FROM dml_ao_r;
 count 
-------
   224
(1 row)

rollback;
--Join with Aggregate
begin;
SELECT COUNT(*) FROM dml_ao_r;
 count 
-------
   113
(1 row)

SELECT COUNT(*) FROM (SELECT COUNT(*) + dml_ao_s.a, dml_ao_r.b + dml_ao_r.a ,'text' FROM dml_ao_r, dml_ao_s WHERE dml_ao_r.b = dml_ao_s.b GROUP BY dml_ao_s.a,dml_ao_r.b,dml_ao_r.a)foo;
 count 
-------
   110
(1 row)

INSERT INTO dml_ao_r SELECT COUNT(*) + dml_ao_s.a, dml_ao_r.b + dml_ao_r.a ,'text' FROM dml_ao_r, dml_ao_s WHERE dml_ao_r.b = dml_ao_s.b GROUP BY dml_ao_s.a,dml_ao_r.b,dml_ao_r.a ;
SELECT COUNT(*) FROM dml_ao_r;
 count 
-------
   223
(1 row)

rollback;
--Join with DISTINCT
begin;
SELECT COUNT(*) FROM dml_ao_s;
 count 
-------
   113
(1 row)

SELECT COUNT(*) FROM (SELECT DISTINCT dml_ao_r.a,dml_ao_r.b,dml_ao_s.c FROM dml_ao_s INNER JOIN dml_ao_r on dml_ao_s.a = dml_ao_r.a)foo;
 count 
-------
   110
(1 row)

INSERT INTO dml_ao_s SELECT DISTINCT dml_ao_r.a,dml_ao_r.b,dml_ao_s.c FROM dml_ao_s INNER JOIN dml_ao_r on dml_ao_s.a = dml_ao_r.a ;
SELECT COUNT(*) FROM dml_ao_s;
 count 
-------
   223
(1 row)

rollback;
--Insert NULL with Joins
begin;
SELECT COUNT(*) FROM dml_ao_r;
 count 
-------
   113
(1 row)

SELECT COUNT(*) FROM (SELECT NULL,dml_ao_r.b,'text' FROM dml_ao_r,dml_ao_s WHERE dml_ao_r.b = dml_ao_s.b)foo;
 count 
-------
   111
(1 row)

INSERT INTO dml_ao_r SELECT NULL,dml_ao_r.b,'text' FROM dml_ao_r,dml_ao_s WHERE dml_ao_r.b = dml_ao_s.b;
SELECT COUNT(*) FROM dml_ao_r;
 count 
-------
   224
(1 row)

rollback;
--Insert and CASE
begin;
SELECT COUNT(*) FROM dml_ao_r;
 count 
-------
   113
(1 row)

SELECT COUNT(*) FROM (SELECT A,B, case when c ='s' then C  else NULL end as C FROM (SELECT sum(dml_ao_p.a) as A, dml_ao_p.a as B, dml_ao_s.c as C FROM dml_ao_p, dml_ao_s WHERE dml_ao_p.a = dml_ao_s.a GROUP BY dml_ao_p.a,dml_ao_s.c)as x GROUP BY A,B,C)foo;
 count 
-------
    10
(1 row)

INSERT INTO dml_ao_r SELECT A,B, case when c ='s' then C  else NULL end as C FROM (SELECT sum(dml_ao_p.a) as A, dml_ao_p.a as B, dml_ao_s.c as C FROM dml_ao_p, dml_ao_s WHERE dml_ao_p.a = dml_ao_s.a GROUP BY dml_ao_p.a,dml_ao_s.c)as x GROUP BY A,B,C;
SELECT COUNT(*) FROM dml_ao_r;
 count 
-------
   123
(1 row)

rollback;
--Insert 0 rows
SELECT COUNT(*) FROM dml_ao_r;
 count 
-------
   113
(1 row)

INSERT INTO dml_ao_r SELECT dml_ao_r.* FROM dml_ao_r,dml_ao_s WHERE dml_ao_r.b = dml_ao_s.a LIMIT 0;
SELECT COUNT(*) FROM dml_ao_r;
 count 
-------
   113
(1 row)

--Insert 0 rows
SELECT COUNT(*) FROM dml_ao_r;
 count 
-------
   113
(1 row)

INSERT INTO dml_ao_r SELECT dml_ao_r.* FROM dml_ao_r,dml_ao_s WHERE dml_ao_r.b = dml_ao_s.a and false;
SELECT COUNT(*) FROM dml_ao_r;
 count 
-------
   113
(1 row)

--Negative test case. INSERT has more expressions than target columns
SELECT COUNT(*) FROM dml_ao_s;
 count 
-------
   113
(1 row)

SELECT COUNT(*) FROM (SELECT COUNT(*) as a, dml_ao_r.* FROM dml_ao_r, dml_ao_s WHERE dml_ao_s.a = dml_ao_r.a GROUP BY dml_ao_r.a, dml_ao_r.b, dml_ao_r.c)foo;
 count 
-------
   110
(1 row)

INSERT INTO dml_ao_s SELECT COUNT(*) as a, dml_ao_r.* FROM dml_ao_r, dml_ao_s WHERE dml_ao_s.a = dml_ao_r.a GROUP BY dml_ao_r.a, dml_ao_r.b, dml_ao_r.c;
ERROR:  INSERT has more expressions than target columns
SELECT COUNT(*) FROM dml_ao_s;
 count 
-------
   113
(1 row)

--Insert data that satisfy the check constraints 
begin;
SELECT COUNT(*) FROM dml_co_check_s;
 count 
-------
   105
(1 row)

SELECT COUNT(*) FROM (SELECT dml_co_check_s.a, dml_co_check_s.b, 'text', dml_co_check_s.d FROM dml_co_check_r, dml_co_check_s WHERE dml_co_check_r.a = dml_co_check_s.b)foo;
 count 
-------
    38
(1 row)

INSERT INTO dml_co_check_s SELECT dml_co_check_s.a, dml_co_check_s.b, 'text', dml_co_check_s.d FROM dml_co_check_r, dml_co_check_s WHERE dml_co_check_r.a = dml_co_check_s.b ;
SELECT COUNT(*) FROM dml_co_check_s;
 count 
-------
   143
(1 row)

rollback;
--Negative test - Insert default value violates check constraint
SELECT COUNT(*) FROM dml_co_check_p;
 count 
-------
   105
(1 row)

INSERT INTO dml_co_check_p select generate_series(1,100),'p', generate_series(1,100);
ERROR:  new row for relation "dml_co_check_p" violates check constraint "dml_co_check_p_check"  (seg0 127.0.0.1:40000 pid=18972)
SELECT COUNT(*) FROM dml_co_check_p;
 count 
-------
   105
(1 row)

--Negative test - Insert default value violates NOT NULL constraint
SELECT COUNT(*) FROM dml_co_check_s;
 count 
-------
   105
(1 row)

INSERT INTO dml_co_check_s values(default,1,'nn',1.0000);
ERROR:  null value in column "a" violates not-null constraint  (seg0 127.0.0.1:40000 pid=18972)
SELECT COUNT(*) FROM dml_co_check_s;
 count 
-------
   105
(1 row)

--Negative test - Insert with joins where the result tuples violate the user defined check constraint
SELECT COUNT(*) FROM dml_co_check_r;
 count 
-------
   105
(1 row)

SELECT COUNT(*) FROM (SELECT dml_co_check_r.a + 110 , dml_co_check_r.b, dml_co_check_r.c, dml_co_check_r.d FROM dml_co_check_r, dml_co_check_s WHERE dml_co_check_r.a = dml_co_check_s.a)foo;
 count 
-------
   107
(1 row)

INSERT INTO dml_co_check_r SELECT dml_co_check_r.a + 110 , dml_co_check_r.b, dml_co_check_r.c, dml_co_check_r.d FROM dml_co_check_r, dml_co_check_s WHERE dml_co_check_r.a = dml_co_check_s.a AND dml_co_check_r.b > 10;
ERROR:  new row for relation "dml_co_check_r_1_prt_def" violates check constraint "dml_co_check_r_a_check"  (seg0 127.0.0.1:40000 pid=18972)
SELECT COUNT(*) FROM dml_co_check_r;
 count 
-------
   105
(1 row)

--Insert with joins where the result tuples violate violates multiple check constraints
SELECT COUNT(*) FROM dml_co_check_r;
 count 
-------
   105
(1 row)

SELECT COUNT(*) FROM (SELECT dml_co_check_r.a + 110 , 0, dml_co_check_r.c, NULL FROM dml_co_check_r, dml_co_check_s WHERE dml_co_check_r.a = dml_co_check_s.a)foo;
 count 
-------
   107
(1 row)

INSERT INTO dml_co_check_r SELECT dml_co_check_r.a + 110 , 0, dml_co_check_r.c, NULL FROM dml_co_check_r, dml_co_check_s WHERE dml_co_check_r.a = dml_co_check_s.a;
ERROR:  null value in column "d" violates not-null constraint  (seg2 127.0.0.1:40002 pid=18974)
SELECT COUNT(*) FROM dml_co_check_r;
 count 
-------
   105
(1 row)

--Insert with generate_series
begin;
SELECT COUNT(*) FROM dml_co_pt_r;
 count 
-------
   100
(1 row)

INSERT INTO dml_co_pt_r values(generate_series(1,10), generate_series(1,100), 'text');
SELECT COUNT(*) FROM dml_co_pt_r WHERE c ='text';
 count 
-------
   100
(1 row)

SELECT COUNT(*) FROM dml_co_pt_r;
 count 
-------
   200
(1 row)

rollback;
--Insert with generate_series and NULL
begin;
SELECT COUNT(*) FROM dml_co_pt_r;
 count 
-------
   100
(1 row)

ALTER TABLE dml_co_pt_r ADD DEFAULT partition def;
INSERT INTO dml_co_pt_r values(generate_series(1,10),NULL,'text');
SELECT * FROM dml_co_pt_r WHERE c ='text' ORDER BY 1;
 a  | b |  c   | d 
----+---+------+---
  1 |   | text |  
  2 |   | text |  
  3 |   | text |  
  4 |   | text |  
  5 |   | text |  
  6 |   | text |  
  7 |   | text |  
  8 |   | text |  
  9 |   | text |  
 10 |   | text |  
(10 rows)

ALTER TABLE dml_co_pt_r DROP DEFAULT partition;
NOTICE:  dropped partition "def" for relation "dml_co_pt_r"
SELECT COUNT(*) FROM dml_co_pt_r;
 count 
-------
   100
(1 row)

rollback;
--Insert with generate_series
begin;
SELECT COUNT(*) FROM dml_co_pt_r;
 count 
-------
   100
(1 row)

TRUNCATE TABLE dml_co_pt_r;
INSERT INTO dml_co_pt_r SELECT generate_series(1,10),1;
SELECT * FROM dml_co_pt_r ORDER BY 1;
 a  | b | c | d 
----+---+---+---
  1 | 1 |   |  
  2 | 1 |   |  
  3 | 1 |   |  
  4 | 1 |   |  
  5 | 1 |   |  
  6 | 1 |   |  
  7 | 1 |   |  
  8 | 1 |   |  
  9 | 1 |   |  
 10 | 1 |   |  
(10 rows)

SELECT COUNT(*) FROM dml_co_pt_r;
 count 
-------
    10
(1 row)

SELECT COUNT(*) FROM dml_co_pt_r;
 count 
-------
    10
(1 row)

rollback;
--Insert with generate_series
begin;
SELECT COUNT(*) FROM dml_co_pt_r;
 count 
-------
   100
(1 row)

INSERT INTO dml_co_pt_r SELECT generate_series(1,10), generate_series(1,10),'text';
SELECT COUNT(*) FROM dml_co_pt_r WHERE c ='text';
 count 
-------
    10
(1 row)

SELECT COUNT(*) FROM dml_co_pt_r;
 count 
-------
   110
(1 row)

rollback;
--Insert with generate_series
begin;
SELECT COUNT(*) FROM dml_co_pt_r;
 count 
-------
   100
(1 row)

INSERT INTO dml_co_pt_r SELECT *,1 from generate_series(1,10);
SELECT COUNT(*) FROM dml_co_pt_r;
 count 
-------
   110
(1 row)

rollback;
--Join on the non-distribution key of target table
begin;
SELECT COUNT(*) FROM dml_co_pt_r;
 count 
-------
   100
(1 row)

SELECT COUNT(*) FROM (SELECT dml_co_pt_r.* FROM dml_co_pt_r,dml_co_pt_s  WHERE dml_co_pt_r.b = dml_co_pt_s.a)foo;
 count 
-------
    36
(1 row)

INSERT INTO dml_co_pt_r SELECT dml_co_pt_r.* FROM dml_co_pt_r,dml_co_pt_s  WHERE dml_co_pt_r.b = dml_co_pt_s.a;
SELECT COUNT(*) FROM dml_co_pt_r;
 count 
-------
   136
(1 row)

rollback;
--Join on the distribution key of target table
begin;
SELECT COUNT(*) FROM dml_co_pt_s;
 count 
-------
   115
(1 row)

SELECT COUNT(*) FROM (SELECT dml_co_pt_s.* FROM dml_co_pt_r,dml_co_pt_s WHERE dml_co_pt_s.a = dml_co_pt_r.a)foo;
 count 
-------
   111
(1 row)

INSERT INTO dml_co_pt_s SELECT dml_co_pt_s.* FROM dml_co_pt_r,dml_co_pt_s WHERE dml_co_pt_s.a = dml_co_pt_r.a;
SELECT COUNT(*) FROM dml_co_pt_s;
 count 
-------
   226
(1 row)

rollback;
--Join on distribution key of target table
begin;
SELECT COUNT(*) FROM dml_co_pt_r;
 count 
-------
   100
(1 row)

SELECT COUNT(*) FROM (SELECT dml_co_pt_r.a,dml_co_pt_r.b,dml_co_pt_s.c FROM dml_co_pt_s INNER JOIN dml_co_pt_r on dml_co_pt_r.a = dml_co_pt_s.a)foo;
 count 
-------
   111
(1 row)

INSERT INTO dml_co_pt_r SELECT dml_co_pt_r.a,dml_co_pt_r.b,dml_co_pt_s.c FROM dml_co_pt_s INNER JOIN dml_co_pt_r on dml_co_pt_r.a = dml_co_pt_s.a ;
SELECT COUNT(*) FROM dml_co_pt_r;
 count 
-------
   211
(1 row)

rollback;
--Join on the distribution key of target table. Insert Large number of rows
begin;
SELECT COUNT(*) FROM dml_co_pt_s;
 count 
-------
   115
(1 row)

SELECT COUNT(*) FROM (SELECT dml_co_pt_r.a,dml_co_pt_r.b,dml_co_pt_s.c FROM dml_co_pt_s INNER JOIN dml_co_pt_r on dml_co_pt_r.b = dml_co_pt_s.b)foo;
 count 
-------
   100
(1 row)

INSERT INTO dml_co_pt_s SELECT dml_co_pt_r.a,dml_co_pt_r.b,dml_co_pt_s.c FROM dml_co_pt_s INNER JOIN dml_co_pt_r on dml_co_pt_r.b = dml_co_pt_s.b ;
SELECT COUNT(*) FROM dml_co_pt_s;
 count 
-------
   215
(1 row)

rollback;
--Join with different column order 
begin;
SELECT COUNT(*) FROM dml_co_pt_r;
 count 
-------
   100
(1 row)

SELECT COUNT(*) FROM (SELECT dml_co_pt_s.a,dml_co_pt_r.b,'text' FROM dml_co_pt_r,dml_co_pt_s  WHERE dml_co_pt_r.b = dml_co_pt_s.b)foo;
 count 
-------
   100
(1 row)

INSERT INTO dml_co_pt_r(b,a,c) SELECT dml_co_pt_s.a,dml_co_pt_r.b,'text' FROM dml_co_pt_r,dml_co_pt_s  WHERE dml_co_pt_r.b = dml_co_pt_s.b;
SELECT COUNT(*) FROM dml_co_pt_r;
 count 
-------
   200
(1 row)

rollback;
--Join with Aggregate
begin;
SELECT COUNT(*) FROM dml_co_pt_r;
 count 
-------
   100
(1 row)

ALTER TABLE dml_co_pt_r ADD DEFAULT partition def;
SELECT COUNT(*) FROM (SELECT COUNT(*) + dml_co_pt_s.a, dml_co_pt_r.b + dml_co_pt_r.a ,'text' FROM dml_co_pt_r, dml_co_pt_s WHERE dml_co_pt_r.b = dml_co_pt_s.b GROUP BY dml_co_pt_s.a,dml_co_pt_r.b,dml_co_pt_r.a)foo;
 count 
-------
   100
(1 row)

INSERT INTO dml_co_pt_r SELECT COUNT(*) + dml_co_pt_s.a, dml_co_pt_r.b + dml_co_pt_r.a ,'text' FROM dml_co_pt_r, dml_co_pt_s WHERE dml_co_pt_r.b = dml_co_pt_s.b GROUP BY dml_co_pt_s.a,dml_co_pt_r.b,dml_co_pt_r.a ;
SELECT COUNT(*) FROM dml_co_pt_r;
 count 
-------
   200
(1 row)

rollback;
--Join with DISTINCT
begin;
SELECT COUNT(*) FROM dml_co_pt_s;
 count 
-------
   115
(1 row)

SELECT COUNT(*) FROM (SELECT DISTINCT dml_co_pt_r.a,dml_co_pt_r.b,dml_co_pt_s.c FROM dml_co_pt_s INNER JOIN dml_co_pt_r on dml_co_pt_s.a = dml_co_pt_r.a)foo;
 count 
-------
   110
(1 row)

INSERT INTO dml_co_pt_s SELECT DISTINCT dml_co_pt_r.a,dml_co_pt_r.b,dml_co_pt_s.c FROM dml_co_pt_s INNER JOIN dml_co_pt_r on dml_co_pt_s.a = dml_co_pt_r.a ;
SELECT COUNT(*) FROM dml_co_pt_s;
 count 
-------
   225
(1 row)

rollback;
--Insert NULL with Joins
begin;
SELECT COUNT(*) FROM dml_co_pt_r;
 count 
-------
   100
(1 row)

SELECT COUNT(*) FROM (SELECT NULL,dml_co_pt_r.b,'text' FROM dml_co_pt_r,dml_co_pt_s WHERE dml_co_pt_r.b = dml_co_pt_s.b)foo;
 count 
-------
   100
(1 row)

INSERT INTO dml_co_pt_r SELECT NULL,dml_co_pt_r.b,'text' FROM dml_co_pt_r,dml_co_pt_s WHERE dml_co_pt_r.b = dml_co_pt_s.b;
SELECT COUNT(*) FROM dml_co_pt_r;
 count 
-------
   200
(1 row)

rollback;
--Insert 0 rows
SELECT COUNT(*) FROM dml_co_pt_r;
 count 
-------
   100
(1 row)

INSERT INTO dml_co_pt_r SELECT dml_co_pt_r.* FROM dml_co_pt_r,dml_co_pt_s WHERE dml_co_pt_r.b = dml_co_pt_s.a LIMIT 0;
SELECT COUNT(*) FROM dml_co_pt_r;
 count 
-------
   100
(1 row)

--Insert 0 rows
SELECT COUNT(*) FROM dml_co_pt_r;
 count 
-------
   100
(1 row)

INSERT INTO dml_co_pt_r SELECT dml_co_pt_r.* FROM dml_co_pt_r,dml_co_pt_s WHERE dml_co_pt_r.b = dml_co_pt_s.a and false;
SELECT COUNT(*) FROM dml_co_pt_r;
 count 
-------
   100
(1 row)

--Negative test case. INSERT has more expressions than target columns
begin;
SELECT COUNT(*) FROM dml_co_pt_s;
 count 
-------
   115
(1 row)

SELECT COUNT(*) FROM (SELECT COUNT(*) as a, dml_co_pt_r.b, dml_co_pt_r.c, dml_co_pt_r.d FROM dml_co_pt_r, dml_co_pt_s WHERE dml_co_pt_s.a = dml_co_pt_r.a GROUP BY dml_co_pt_r.a, dml_co_pt_r.b, dml_co_pt_r.c, dml_co_pt_r.d)foo;
 count 
-------
   100
(1 row)

INSERT INTO dml_co_pt_s SELECT COUNT(*) as a, dml_co_pt_r.b, dml_co_pt_r.c, dml_co_pt_r.d FROM dml_co_pt_r, dml_co_pt_s WHERE dml_co_pt_s.a = dml_co_pt_r.a GROUP BY dml_co_pt_r.a, dml_co_pt_r.b, dml_co_pt_r.c, dml_co_pt_r.d;
SELECT COUNT(*) FROM dml_co_pt_s;
 count 
-------
   215
(1 row)

rollback;
--Insert with join on the partition key
begin;
SELECT COUNT(*) FROM dml_co_pt_r;
 count 
-------
   100
(1 row)

SELECT COUNT(*) FROM (SELECT dml_co_pt_r.* FROM dml_co_pt_r, dml_co_pt_s WHERE dml_co_pt_r.b = dml_co_pt_s.b)foo;
 count 
-------
   100
(1 row)

INSERT INTO dml_co_pt_r SELECT dml_co_pt_r.* FROM dml_co_pt_r, dml_co_pt_s WHERE dml_co_pt_r.b = dml_co_pt_s.b;
SELECT COUNT(*) FROM dml_co_pt_r;
 count 
-------
   200
(1 row)

rollback;
--Negative test - Insert NULL value to a table without default partition
SELECT COUNT(*) FROM dml_co_pt_r;
 count 
-------
   100
(1 row)

SELECT COUNT(*) FROM (SELECT dml_co_pt_r.b, NULL, dml_co_pt_r.c FROM dml_co_pt_r, dml_co_pt_s WHERE dml_co_pt_r.b = dml_co_pt_s.b)foo;
 count 
-------
   100
(1 row)

INSERT INTO dml_co_pt_r SELECT dml_co_pt_r.b, NULL, dml_co_pt_r.c FROM dml_co_pt_r, dml_co_pt_s WHERE dml_co_pt_r.b = dml_co_pt_s.b;
ERROR:  no partition for partitioning key  (seg1 127.0.0.1:40001 pid=18973)
SELECT COUNT(*) FROM dml_co_pt_r;
 count 
-------
   100
(1 row)

--Negative test - Insert out of partition range values for table without default partition
SELECT COUNT(*) FROM dml_co_pt_r;
 count 
-------
   100
(1 row)

INSERT INTO dml_co_pt_r SELECT dml_co_pt_r.b ,dml_co_pt_r.a + dml_co_pt_s.a + 100, dml_co_pt_r.c FROM dml_co_pt_r, dml_co_pt_s WHERE dml_co_pt_r.a = dml_co_pt_s.b;
ERROR:  no partition for partitioning key  (seg1 127.0.0.1:40001 pid=18973)
SELECT COUNT(*) FROM dml_co_pt_r;
 count 
-------
   100
(1 row)

--Insert with generate_series
begin;
SELECT COUNT(*) FROM dml_co_r;
 count 
-------
   113
(1 row)

INSERT INTO dml_co_r values(generate_series(1,10), generate_series(1,100), 'text');
SELECT COUNT(*) FROM dml_co_r WHERE c ='text';
 count 
-------
   100
(1 row)

SELECT COUNT(*) FROM dml_co_r;
 count 
-------
   213
(1 row)

rollback;
--Insert with generate_series and NULL
begin;
SELECT COUNT(*) FROM dml_co_r;
 count 
-------
   113
(1 row)

INSERT INTO dml_co_r values(generate_series(1,10),NULL,'text');
SELECT * FROM dml_co_r WHERE c ='text' ORDER BY 1;
 a  | b |  c   
----+---+------
  1 |   | text
  2 |   | text
  3 |   | text
  4 |   | text
  5 |   | text
  6 |   | text
  7 |   | text
  8 |   | text
  9 |   | text
 10 |   | text
(10 rows)

SELECT COUNT(*) FROM dml_co_r;
 count 
-------
   123
(1 row)

rollback;
--Insert with generate_series
begin;
SELECT COUNT(*) FROM dml_co_r;
 count 
-------
   113
(1 row)

TRUNCATE TABLE dml_co_r;
INSERT INTO dml_co_r SELECT generate_series(1,10);
SELECT * FROM dml_co_r ORDER BY 1;
 a  | b  | c 
----+----+---
  1 | -1 | 
  2 | -1 | 
  3 | -1 | 
  4 | -1 | 
  5 | -1 | 
  6 | -1 | 
  7 | -1 | 
  8 | -1 | 
  9 | -1 | 
 10 | -1 | 
(10 rows)

SELECT COUNT(*) FROM dml_co_r;
 count 
-------
    10
(1 row)

SELECT COUNT(*) FROM dml_co_r;
 count 
-------
    10
(1 row)

rollback;
--Insert with generate_series
begin;
SELECT COUNT(*) FROM dml_co_r;
 count 
-------
   113
(1 row)

INSERT INTO dml_co_r SELECT generate_series(1,10), generate_series(1,10),'text';
SELECT COUNT(*) FROM dml_co_r WHERE c ='text';
 count 
-------
    10
(1 row)

SELECT COUNT(*) FROM dml_co_r;
 count 
-------
   123
(1 row)

rollback;
--Insert with generate_series
begin;
SELECT COUNT(*) FROM dml_co_r;
 count 
-------
   113
(1 row)

INSERT INTO dml_co_r SELECT * from generate_series(1,10);
SELECT COUNT(*) FROM dml_co_r;
 count 
-------
   123
(1 row)

rollback;
--Join on the non-distribution key of target table
begin;
SELECT COUNT(*) FROM dml_co_r;
 count 
-------
   113
(1 row)

SELECT COUNT(*) FROM (SELECT dml_co_r.* FROM dml_co_r,dml_co_s  WHERE dml_co_r.b = dml_co_s.b)foo;
 count 
-------
   111
(1 row)

INSERT INTO dml_co_r SELECT dml_co_r.* FROM dml_co_r,dml_co_s  WHERE dml_co_r.b = dml_co_s.b;
SELECT COUNT(*) FROM dml_co_r;
 count 
-------
   224
(1 row)

rollback;
--Join on the distribution key of target table
begin;
SELECT COUNT(*) FROM dml_co_s;
 count 
-------
   113
(1 row)

SELECT COUNT(*) FROM (SELECT dml_co_s.* FROM dml_co_r,dml_co_s WHERE dml_co_s.a = dml_co_r.a)foo;
 count 
-------
   111
(1 row)

INSERT INTO dml_co_s SELECT dml_co_s.* FROM dml_co_r,dml_co_s WHERE dml_co_s.a = dml_co_r.a;
SELECT COUNT(*) FROM dml_co_s;
 count 
-------
   224
(1 row)

rollback;
--Join on distribution key of target table
begin;
SELECT COUNT(*) FROM dml_co_r;
 count 
-------
   113
(1 row)

SELECT COUNT(*) FROM (SELECT dml_co_r.a,dml_co_r.b,dml_co_s.c FROM dml_co_s INNER JOIN dml_co_r on dml_co_r.a = dml_co_s.a)foo;
 count 
-------
   111
(1 row)

INSERT INTO dml_co_r SELECT dml_co_r.a,dml_co_r.b,dml_co_s.c FROM dml_co_s INNER JOIN dml_co_r on dml_co_r.a = dml_co_s.a ;
SELECT COUNT(*) FROM dml_co_r;
 count 
-------
   224
(1 row)

rollback;
--Join on the distribution key of target table. Insert Large number of rows
begin;
SELECT COUNT(*) FROM dml_co_s;
 count 
-------
   113
(1 row)

SELECT COUNT(*) FROM (SELECT dml_co_r.a,dml_co_r.b,dml_co_s.c FROM dml_co_s INNER JOIN dml_co_r on dml_co_r.b <> dml_co_s.b )foo;
 count 
-------
 11100
(1 row)

INSERT INTO dml_co_s SELECT dml_co_r.a,dml_co_r.b,dml_co_s.c FROM dml_co_s INNER JOIN dml_co_r on dml_co_r.b <> dml_co_s.b ;
SELECT COUNT(*) FROM dml_co_s;
 count 
-------
 11213
(1 row)

rollback;
--Join with different column order 
begin;
SELECT COUNT(*) FROM dml_co_r;
 count 
-------
   113
(1 row)

SELECT COUNT(*) FROM (SELECT dml_co_s.a,dml_co_r.b,'text' FROM dml_co_r,dml_co_s  WHERE dml_co_r.b = dml_co_s.b)foo;
 count 
-------
   111
(1 row)

INSERT INTO dml_co_r(b,a,c) SELECT dml_co_s.a,dml_co_r.b,'text' FROM dml_co_r,dml_co_s  WHERE dml_co_r.b = dml_co_s.b;
SELECT COUNT(*) FROM dml_co_r;
 count 
-------
   224
(1 row)

rollback;
--Join with Aggregate
begin;
SELECT COUNT(*) FROM dml_co_r;
 count 
-------
   113
(1 row)

SELECT COUNT(*) FROM (SELECT COUNT(*) + dml_co_s.a, dml_co_r.b + dml_co_r.a ,'text' FROM dml_co_r, dml_co_s WHERE dml_co_r.b = dml_co_s.b GROUP BY dml_co_s.a,dml_co_r.b,dml_co_r.a)foo;
 count 
-------
   110
(1 row)

INSERT INTO dml_co_r SELECT COUNT(*) + dml_co_s.a, dml_co_r.b + dml_co_r.a ,'text' FROM dml_co_r, dml_co_s WHERE dml_co_r.b = dml_co_s.b GROUP BY dml_co_s.a,dml_co_r.b,dml_co_r.a ;
SELECT COUNT(*) FROM dml_co_r;
 count 
-------
   223
(1 row)

rollback;
--Join with DISTINCT
begin;
SELECT COUNT(*) FROM dml_co_s;
 count 
-------
   113
(1 row)

SELECT COUNT(*) FROM (SELECT DISTINCT dml_co_r.a,dml_co_r.b,dml_co_s.c FROM dml_co_s INNER JOIN dml_co_r on dml_co_s.a = dml_co_r.a)foo;
 count 
-------
   110
(1 row)

INSERT INTO dml_co_s SELECT DISTINCT dml_co_r.a,dml_co_r.b,dml_co_s.c FROM dml_co_s INNER JOIN dml_co_r on dml_co_s.a = dml_co_r.a ;
SELECT COUNT(*) FROM dml_co_s;
 count 
-------
   223
(1 row)

rollback;
--Insert NULL with Joins
begin;
SELECT COUNT(*) FROM dml_co_r;
 count 
-------
   113
(1 row)

SELECT COUNT(*) FROM (SELECT NULL,dml_co_r.b,'text' FROM dml_co_r,dml_co_s WHERE dml_co_r.b = dml_co_s.b)foo;
 count 
-------
   111
(1 row)

INSERT INTO dml_co_r SELECT NULL,dml_co_r.b,'text' FROM dml_co_r,dml_co_s WHERE dml_co_r.b = dml_co_s.b;
SELECT COUNT(*) FROM dml_co_r;
 count 
-------
   224
(1 row)

rollback;
--Insert and CASE
begin;
SELECT COUNT(*) FROM dml_co_r;
 count 
-------
   113
(1 row)

SELECT COUNT(*) FROM (SELECT A,B, case when c ='s' then C  else NULL end as C FROM (SELECT sum(dml_co_p.a) as A, dml_co_p.a as B, dml_co_s.c as C FROM dml_co_p, dml_co_s WHERE dml_co_p.a = dml_co_s.a GROUP BY dml_co_p.a,dml_co_s.c)as x GROUP BY A,B,C)foo;
 count 
-------
    10
(1 row)

INSERT INTO dml_co_r SELECT A,B, case when c ='s' then C  else NULL end as C FROM (SELECT sum(dml_co_p.a) as A, dml_co_p.a as B, dml_co_s.c as C FROM dml_co_p, dml_co_s WHERE dml_co_p.a = dml_co_s.a GROUP BY dml_co_p.a,dml_co_s.c)as x GROUP BY A,B,C;
SELECT COUNT(*) FROM dml_co_r;
 count 
-------
   123
(1 row)

rollback;
--Insert 0 rows
SELECT COUNT(*) FROM dml_co_r;
 count 
-------
   113
(1 row)

INSERT INTO dml_co_r SELECT dml_co_r.* FROM dml_co_r,dml_co_s WHERE dml_co_r.b = dml_co_s.a LIMIT 0;
SELECT COUNT(*) FROM dml_co_r;
 count 
-------
   113
(1 row)

--Insert 0 rows
SELECT COUNT(*) FROM dml_co_r;
 count 
-------
   113
(1 row)

INSERT INTO dml_co_r SELECT dml_co_r.* FROM dml_co_r,dml_co_s WHERE dml_co_r.b = dml_co_s.a and false;
SELECT COUNT(*) FROM dml_co_r;
 count 
-------
   113
(1 row)

--Negative tests Insert column of different data type
SELECT COUNT(*) FROM dml_co_r;
 count 
-------
   113
(1 row)

SELECT COUNT(*) FROM ( SELECT ('a')::int, dml_co_r.b,10 FROM dml_co_s WHERE dml_co_r.b = dml_co_s.b)foo;
ERROR:  invalid input syntax for integer: "a"
LINE 1: SELECT COUNT(*) FROM ( SELECT ('a')::int, dml_co_r.b,10 FROM...
                                       ^
INSERT INTO dml_co_r SELECT ('a')::int, dml_co_r.b,10 FROM dml_co_s WHERE dml_co_r.b = dml_co_s.b;
ERROR:  invalid input syntax for integer: "a"
LINE 1: INSERT INTO dml_co_r SELECT ('a')::int, dml_co_r.b,10 FROM d...
                                     ^
SELECT COUNT(*) FROM dml_co_r;
 count 
-------
   113
(1 row)

--Negative test case. INSERT has more expressions than target columns
SELECT COUNT(*) FROM dml_co_s;
 count 
-------
   113
(1 row)

SELECT COUNT(*) FROM (SELECT COUNT(*) as a, dml_co_r.* FROM dml_co_r, dml_co_s WHERE dml_co_s.a = dml_co_r.a GROUP BY dml_co_r.a, dml_co_r.b, dml_co_r.c)foo;
 count 
-------
   110
(1 row)

INSERT INTO dml_co_s SELECT COUNT(*) as a, dml_co_r.* FROM dml_co_r, dml_co_s WHERE dml_co_s.a = dml_co_r.a GROUP BY dml_co_r.a, dml_co_r.b, dml_co_r.c;
ERROR:  INSERT has more expressions than target columns
SELECT COUNT(*) FROM dml_co_s;
 count 
-------
   113
(1 row)

--Insert data that satisfy the check constraints 
begin;
SELECT COUNT(*) FROM dml_heap_check_s;
 count 
-------
   105
(1 row)

SELECT COUNT(*) FROM (SELECT dml_heap_check_s.a, dml_heap_check_s.b, 'text', dml_heap_check_s.d FROM dml_heap_check_r, dml_heap_check_s WHERE dml_heap_check_r.a = dml_heap_check_s.b )foo;
 count 
-------
    38
(1 row)

INSERT INTO dml_heap_check_s SELECT dml_heap_check_s.a, dml_heap_check_s.b, 'text', dml_heap_check_s.d FROM dml_heap_check_r, dml_heap_check_s WHERE dml_heap_check_r.a = dml_heap_check_s.b ;
SELECT COUNT(*) FROM dml_heap_check_s;
 count 
-------
   143
(1 row)

rollback;
--Negative test - Insert default value violates check constraint
SELECT COUNT(*) FROM dml_heap_check_p;
 count 
-------
   105
(1 row)

INSERT INTO dml_heap_check_p select generate_series(1,100),'p', generate_series(1,100);
ERROR:  new row for relation "dml_heap_check_p" violates check constraint "dml_heap_check_p_check"  (seg0 127.0.0.1:40000 pid=18972)
SELECT COUNT(*) FROM dml_heap_check_p;
 count 
-------
   105
(1 row)

--Negative test - Insert default value violates NOT NULL constraint
SELECT COUNT(*) FROM dml_heap_check_s;
 count 
-------
   105
(1 row)

INSERT INTO dml_heap_check_s values(default,1,'nn',1.0000);
ERROR:  null value in column "a" violates not-null constraint  (seg0 127.0.0.1:40000 pid=18972)
SELECT COUNT(*) FROM dml_heap_check_s;
 count 
-------
   105
(1 row)

--Negative test - Insert with joins where the result tuples violate the user defined check constraint
SELECT COUNT(*) FROM dml_heap_check_r;
 count 
-------
   105
(1 row)

SELECT COUNT(*) FROM (SELECT dml_heap_check_r.a + 110 , dml_heap_check_r.b, dml_heap_check_r.c, dml_heap_check_r.d FROM dml_heap_check_r, dml_heap_check_s WHERE dml_heap_check_r.a = dml_heap_check_s.a)foo;
 count 
-------
   107
(1 row)

INSERT INTO dml_heap_check_r SELECT dml_heap_check_r.a + 110 , dml_heap_check_r.b, dml_heap_check_r.c, dml_heap_check_r.d FROM dml_heap_check_r, dml_heap_check_s WHERE dml_heap_check_r.a = dml_heap_check_s.a AND dml_heap_check_r.b > 10;
ERROR:  new row for relation "dml_heap_check_r_1_prt_def" violates check constraint "dml_heap_check_r_a_check"  (seg1 127.0.0.1:40001 pid=18973)
SELECT COUNT(*) FROM dml_heap_check_r;
 count 
-------
   105
(1 row)

--Insert with joins where the result tuples violate violates multiple check constraints
SELECT COUNT(*) FROM dml_heap_check_r;
 count 
-------
   105
(1 row)

SELECT COUNT(*) FROM (SELECT dml_heap_check_r.a + 110 , 0, dml_heap_check_r.c, NULL FROM dml_heap_check_r, dml_heap_check_s WHERE dml_heap_check_r.a = dml_heap_check_s.a)foo;
 count 
-------
   107
(1 row)

INSERT INTO dml_heap_check_r SELECT dml_heap_check_r.a + 110 , 0, dml_heap_check_r.c, NULL FROM dml_heap_check_r, dml_heap_check_s WHERE dml_heap_check_r.a = dml_heap_check_s.a;
ERROR:  null value in column "d" violates not-null constraint  (seg0 127.0.0.1:40000 pid=18972)
SELECT COUNT(*) FROM dml_heap_check_r;
 count 
-------
   105
(1 row)

--Update data that satisfy the check constraints 
begin;
SELECT SUM(d) FROM dml_heap_check_s;
 sum 
-----
 800
(1 row)

UPDATE dml_heap_check_s SET d = dml_heap_check_s.d * 1 FROM dml_heap_check_r WHERE dml_heap_check_r.a = dml_heap_check_s.b;
SELECT SUM(d) FROM dml_heap_check_s;
 sum 
-----
 800
(1 row)

rollback;
--Negative test: Update data that does not satisfy the check constraints
UPDATE dml_heap_check_s SET a = 100 + dml_heap_check_s.a FROM dml_heap_check_r WHERE dml_heap_check_r.a = dml_heap_check_s.a AND dml_heap_check_s.a = 99;
ERROR:  moving tuple from partition "dml_heap_check_s_1_prt_11" to partition "dml_heap_check_s_1_prt_def" not supported  (seg0 127.0.0.1:40000 pid=18972)
--Negative test - Update violates check constraint(not NULL constraint)
UPDATE dml_heap_check_s SET b = NULL FROM dml_heap_check_r WHERE dml_heap_check_r.a = dml_heap_check_s.b and dml_heap_check_s.b = 99;
ERROR:  Cannot parallelize an UPDATE statement that updates the distribution columns
--Negative test - Update moving tuple across partition .also violates the check constraint
UPDATE dml_heap_check_s SET a = 110 + dml_heap_check_s.a FROM dml_heap_check_r WHERE dml_heap_check_r.a = dml_heap_check_s.a ; 
ERROR:  moving tuple from partition "dml_heap_check_s_1_prt_2" to partition "dml_heap_check_s_1_prt_def" not supported  (seg0 127.0.0.1:40000 pid=18972)
--Delete with generate_series
begin;
SELECT COUNT(*) FROM dml_heap_s;
 count 
-------
   113
(1 row)

DELETE FROM dml_heap_s USING generate_series(1,10);
SELECT COUNT(*) FROM dml_heap_s;
 count 
-------
     0
(1 row)

rollback;
--Delete with join on distcol
begin;
SELECT COUNT(*) FROM dml_heap_r;
 count 
-------
   113
(1 row)

DELETE FROM dml_heap_r USING dml_heap_s WHERE dml_heap_r.a = dml_heap_s.a;
SELECT COUNT(*) FROM dml_heap_r;
 count 
-------
     2
(1 row)

rollback;
--Delete with join on non-distribution column
begin;
SELECT COUNT(*) FROM dml_heap_r;
 count 
-------
   113
(1 row)

DELETE FROM dml_heap_r USING dml_heap_s WHERE dml_heap_r.b = dml_heap_s.b;
SELECT COUNT(*) FROM dml_heap_r;
 count 
-------
    13
(1 row)

rollback;
--Delete with join on non-distribution column
begin;
SELECT COUNT(*) FROM dml_heap_s;
 count 
-------
   113
(1 row)

DELETE FROM dml_heap_s USING dml_heap_r WHERE dml_heap_s.a = dml_heap_r.a;
SELECT COUNT(*) FROM dml_heap_s;
 count 
-------
    13
(1 row)

rollback;
--Delete and using  
begin;
SELECT COUNT(*) FROM dml_heap_r;
 count 
-------
   113
(1 row)

DELETE FROM dml_heap_r USING dml_heap_s; 
SELECT COUNT(*) FROM dml_heap_r;
 count 
-------
     0
(1 row)

rollback;
--Delete and using (with no rows)
begin;
TRUNCATE TABLE dml_heap_s;
SELECT COUNT(*) FROM dml_heap_r;
 count 
-------
   113
(1 row)

DELETE FROM dml_heap_r USING dml_heap_s; 
SELECT COUNT(*) FROM dml_heap_r;
 count 
-------
   113
(1 row)

rollback;
--Delete with join in using
begin;
SELECT COUNT(*) FROM dml_heap_r;
 count 
-------
   113
(1 row)

DELETE FROM dml_heap_r USING (SELECT dml_heap_r.a FROM dml_heap_r, dml_heap_s WHERE dml_heap_r.a = dml_heap_s.a)foo WHERE dml_heap_r.a = foo.a;
SELECT COUNT(*) FROM dml_heap_r;
 count 
-------
     2
(1 row)

rollback;
--Delete with join in USING (Delete all rows )
begin;
SELECT COUNT(*) FROM dml_heap_r;
 count 
-------
   113
(1 row)

DELETE FROM dml_heap_r USING (SELECT 1)foo; 
SELECT COUNT(*) FROM dml_heap_r;
 count 
-------
     0
(1 row)

rollback;
--Delete with join in using
begin;
SELECT COUNT(*) FROM dml_heap_r;
 count 
-------
   113
(1 row)

DELETE FROM dml_heap_r USING (SELECT 1 as t) foo WHERE foo.t = dml_heap_r.a; 
SELECT COUNT(*) FROM dml_heap_r;
 count 
-------
   110
(1 row)

rollback;
--Delete with multiple joins
begin;
SELECT COUNT(*) FROM dml_heap_r;
 count 
-------
   113
(1 row)

DELETE FROM dml_heap_r USING dml_heap_s,dml_heap_p WHERE dml_heap_r.a = dml_heap_s.b and dml_heap_r.b = dml_heap_p.a;
SELECT COUNT(*) FROM dml_heap_r;
 count 
-------
   103
(1 row)

rollback;
--Delete on table with composite distcol
begin;
SELECT COUNT(*) FROM dml_heap_p;
 count 
-------
   113
(1 row)

DELETE FROM dml_heap_p USING dml_heap_r WHERE dml_heap_p.b::int = dml_heap_r.b::int and dml_heap_p.a = dml_heap_r.a;
SELECT COUNT(*) FROM dml_heap_p;
 count 
-------
   113
(1 row)

rollback;
--Delete with PREPARE plan
begin;
SELECT COUNT(*) FROM (SELECT dml_heap_r.b FROM dml_heap_r,dml_heap_s WHERE dml_heap_r.b = dml_heap_s.b) foo;
 count 
-------
   111
(1 row)

SELECT COUNT(*) FROM dml_heap_r;
 count 
-------
   113
(1 row)

PREPARE plan_del as DELETE FROM dml_heap_r WHERE b in (SELECT dml_heap_r.b FROM dml_heap_r,dml_heap_s WHERE dml_heap_r.b = dml_heap_s.b);
EXECUTE plan_del;
SELECT COUNT(*) FROM dml_heap_r;
 count 
-------
    13
(1 row)

rollback;
--Delete with PREPARE plan
begin;
SELECT COUNT(*) FROM (SELECT dml_heap_r.b FROM dml_heap_r,dml_heap_s WHERE dml_heap_r.a = dml_heap_s.a)foo;
 count 
-------
   111
(1 row)

SELECT COUNT(*) FROM dml_heap_s;
 count 
-------
   113
(1 row)

PREPARE plan_del_2 as DELETE FROM dml_heap_s WHERE b in (SELECT dml_heap_r.b FROM dml_heap_r,dml_heap_s WHERE dml_heap_r.a = dml_heap_s.a);
EXECUTE plan_del_2;
SELECT COUNT(*) FROM dml_heap_s;
 count 
-------
     2
(1 row)

rollback;
--Delete with sub-query
SELECT COUNT(*) FROM dml_heap_s;
 count 
-------
   113
(1 row)

DELETE FROM dml_heap_s WHERE a = (SELECT dml_heap_r.a FROM dml_heap_r,dml_heap_s WHERE dml_heap_r.a = dml_heap_s.a);
ERROR:  more than one row returned by a subquery used as an expression
SELECT COUNT(*) FROM dml_heap_s;
 count 
-------
   113
(1 row)

--Delete from table
begin;
SELECT COUNT(*) FROM dml_heap_pt_s; 
 count 
-------
   115
(1 row)

DELETE FROM dml_heap_pt_s;
SELECT COUNT(*) FROM dml_heap_pt_s;
 count 
-------
     0
(1 row)

rollback;
--Delete with predicate
begin;
SELECT COUNT(*) FROM dml_heap_pt_s;
 count 
-------
   115
(1 row)

SELECT COUNT(*) FROM dml_heap_pt_s WHERE a > 100;
 count 
-------
     0
(1 row)

DELETE FROM dml_heap_pt_s WHERE a > 100;
SELECT COUNT(*) FROM dml_heap_pt_s;
 count 
-------
   115
(1 row)

SELECT COUNT(*) FROM dml_heap_pt_s WHERE a > 100;
 count 
-------
     0
(1 row)

rollback;
--Delete with predicate
begin;
SELECT COUNT(*) FROM dml_heap_pt_s;
 count 
-------
   115
(1 row)

SELECT COUNT(*) FROM dml_heap_pt_s WHERE a is NULL;
 count 
-------
     3
(1 row)

DELETE FROM dml_heap_pt_s WHERE a is NULL; 
SELECT COUNT(*) FROM dml_heap_pt_s;
 count 
-------
   112
(1 row)

rollback;
--Delete with generate_series
begin;
SELECT COUNT(*) FROM dml_heap_pt_s;
 count 
-------
   115
(1 row)

DELETE FROM dml_heap_pt_s USING generate_series(1,10);
SELECT COUNT(*) FROM dml_heap_pt_s;
 count 
-------
     0
(1 row)

rollback;
--Delete with join on distcol
begin;
SELECT COUNT(*) FROM dml_heap_pt_r;
 count 
-------
   100
(1 row)

DELETE FROM dml_heap_pt_r USING dml_heap_pt_s WHERE dml_heap_pt_r.a = dml_heap_pt_s.a;
SELECT COUNT(*) FROM dml_heap_pt_r;
 count 
-------
     0
(1 row)

rollback;
--Delete with join on non-distribution column
begin;
SELECT COUNT(*) FROM dml_heap_pt_r;
 count 
-------
   100
(1 row)

DELETE FROM dml_heap_pt_r USING dml_heap_pt_s WHERE dml_heap_pt_r.b = dml_heap_pt_s.b;
SELECT COUNT(*) FROM dml_heap_pt_r;
 count 
-------
     0
(1 row)

rollback;
--Delete with join on non-distribution column
begin;
SELECT COUNT(*) FROM dml_heap_pt_s;
 count 
-------
   115
(1 row)

DELETE FROM dml_heap_pt_s USING dml_heap_pt_r WHERE dml_heap_pt_s.a = dml_heap_pt_r.a;
SELECT COUNT(*) FROM dml_heap_pt_s;
 count 
-------
     4
(1 row)

rollback;
--Delete and using  
begin;
SELECT COUNT(*) FROM dml_heap_pt_r;
 count 
-------
   100
(1 row)

DELETE FROM dml_heap_pt_r USING dml_heap_pt_s; 
SELECT COUNT(*) FROM dml_heap_pt_r;
 count 
-------
     0
(1 row)

rollback;
--Delete and using (with no rows)
begin;
TRUNCATE TABLE dml_heap_pt_s;
SELECT COUNT(*) FROM dml_heap_pt_r;
 count 
-------
   100
(1 row)

DELETE FROM dml_heap_pt_r USING dml_heap_pt_s; 
SELECT COUNT(*) FROM dml_heap_pt_r;
 count 
-------
   100
(1 row)

rollback;
--Delete with join in using
begin;
SELECT COUNT(*) FROM dml_heap_pt_r;
 count 
-------
   100
(1 row)

DELETE FROM dml_heap_pt_r USING (SELECT dml_heap_pt_r.a FROM dml_heap_pt_r, dml_heap_pt_s WHERE dml_heap_pt_r.a = dml_heap_pt_s.a)foo WHERE dml_heap_pt_r.a = foo.a;
SELECT COUNT(*) FROM dml_heap_pt_r;
 count 
-------
     0
(1 row)

rollback;
--Delete with join in USING (Delete all rows )
begin;
SELECT COUNT(*) FROM dml_heap_pt_r;
 count 
-------
   100
(1 row)

DELETE FROM dml_heap_pt_r USING (SELECT 1)foo; 
SELECT COUNT(*) FROM dml_heap_pt_r;
 count 
-------
     0
(1 row)

rollback;
--Delete with join in using
begin;
SELECT COUNT(*) FROM dml_heap_pt_r;
 count 
-------
   100
(1 row)

DELETE FROM dml_heap_pt_r USING (SELECT 1 as t) foo WHERE foo.t = dml_heap_pt_r.a; 
SELECT COUNT(*) FROM dml_heap_pt_r;
 count 
-------
    99
(1 row)

rollback;
--Delete with multiple joins
begin;
SELECT COUNT(*) FROM dml_heap_pt_r;
 count 
-------
   100
(1 row)

DELETE FROM dml_heap_pt_r USING dml_heap_pt_s,dml_heap_pt_p WHERE dml_heap_pt_r.a = dml_heap_pt_s.b and dml_heap_pt_r.b = dml_heap_pt_p.a;
SELECT COUNT(*) FROM dml_heap_pt_r;
 count 
-------
    88
(1 row)

rollback;
--Delete on table with composite distcol
begin;
SELECT COUNT(*) FROM dml_heap_pt_p;
 count 
-------
   115
(1 row)

DELETE FROM dml_heap_pt_p USING dml_heap_pt_r WHERE dml_heap_pt_p.b::int = dml_heap_pt_r.b::int and dml_heap_pt_p.a = dml_heap_pt_r.a;
SELECT COUNT(*) FROM dml_heap_pt_p;
 count 
-------
    15
(1 row)

rollback;
--Delete with PREPARE plan
begin;
SELECT COUNT(*) FROM (SELECT dml_heap_pt_r.b FROM dml_heap_pt_r,dml_heap_pt_s WHERE dml_heap_pt_r.b = dml_heap_pt_s.b) foo;
 count 
-------
   100
(1 row)

SELECT COUNT(*) FROM dml_heap_pt_r;
 count 
-------
   100
(1 row)

PREPARE plan_del_3 as DELETE FROM dml_heap_pt_r WHERE b in (SELECT dml_heap_pt_r.b FROM dml_heap_pt_r,dml_heap_pt_s WHERE dml_heap_pt_r.b = dml_heap_pt_s.b);
EXECUTE plan_del_3;
SELECT COUNT(*) FROM dml_heap_pt_r;
 count 
-------
     0
(1 row)

rollback;
--Delete with PREPARE plan
begin;
SELECT COUNT(*) FROM (SELECT dml_heap_pt_r.b FROM dml_heap_pt_r,dml_heap_pt_s WHERE dml_heap_pt_r.a = dml_heap_pt_s.a)foo;
 count 
-------
   111
(1 row)

SELECT COUNT(*) FROM dml_heap_pt_s;
 count 
-------
   115
(1 row)

PREPARE plan_del_4 as DELETE FROM dml_heap_pt_s WHERE b in (SELECT dml_heap_pt_r.b FROM dml_heap_pt_r,dml_heap_pt_s WHERE dml_heap_pt_r.a = dml_heap_pt_s.a);
EXECUTE plan_del_4;
SELECT COUNT(*) FROM dml_heap_pt_s;
 count 
-------
    15
(1 row)

rollback;
--Delete with sub-query
SELECT COUNT(*) FROM dml_heap_pt_s;
 count 
-------
   115
(1 row)

DELETE FROM dml_heap_pt_s WHERE a = (SELECT dml_heap_pt_r.a FROM dml_heap_pt_r,dml_heap_pt_s WHERE dml_heap_pt_r.a = dml_heap_pt_s.a);
ERROR:  more than one row returned by a subquery used as an expression
SELECT COUNT(*) FROM dml_heap_pt_s;
 count 
-------
   115
(1 row)

--Insert with generate_series
begin;
SELECT COUNT(*) FROM dml_heap_pt_r;
 count 
-------
   100
(1 row)

INSERT INTO dml_heap_pt_r values(generate_series(1,10), generate_series(1,100), 'text');
SELECT COUNT(*) FROM dml_heap_pt_r WHERE c ='text';
 count 
-------
   100
(1 row)

SELECT COUNT(*) FROM dml_heap_pt_r;
 count 
-------
   200
(1 row)

rollback;
--Insert with generate_series and NULL
begin;
SELECT COUNT(*) FROM dml_heap_pt_r;
 count 
-------
   100
(1 row)

ALTER TABLE dml_heap_pt_r ADD DEFAULT partition def;
INSERT INTO dml_heap_pt_r values(generate_series(1,10),NULL,'text');
SELECT * FROM dml_heap_pt_r WHERE c ='text' ORDER BY 1;
 a  | b |  c   | d 
----+---+------+---
  1 |   | text |  
  2 |   | text |  
  3 |   | text |  
  4 |   | text |  
  5 |   | text |  
  6 |   | text |  
  7 |   | text |  
  8 |   | text |  
  9 |   | text |  
 10 |   | text |  
(10 rows)

ALTER TABLE dml_heap_pt_r DROP DEFAULT partition;
NOTICE:  dropped partition "def" for relation "dml_heap_pt_r"
SELECT COUNT(*) FROM dml_heap_pt_r;
 count 
-------
   100
(1 row)

rollback;
--Insert with generate_series
begin;
SELECT COUNT(*) FROM dml_heap_pt_r;
 count 
-------
   100
(1 row)

TRUNCATE TABLE dml_heap_pt_r;
INSERT INTO dml_heap_pt_r SELECT generate_series(1,10),1;
SELECT * FROM dml_heap_pt_r ORDER BY 1;
 a  | b | c | d 
----+---+---+---
  1 | 1 |   |  
  2 | 1 |   |  
  3 | 1 |   |  
  4 | 1 |   |  
  5 | 1 |   |  
  6 | 1 |   |  
  7 | 1 |   |  
  8 | 1 |   |  
  9 | 1 |   |  
 10 | 1 |   |  
(10 rows)

SELECT COUNT(*) FROM dml_heap_pt_r;
 count 
-------
    10
(1 row)

SELECT COUNT(*) FROM dml_heap_pt_r;
 count 
-------
    10
(1 row)

rollback;
--Insert with generate_series
begin;
SELECT COUNT(*) FROM dml_heap_pt_r;
 count 
-------
   100
(1 row)

INSERT INTO dml_heap_pt_r SELECT generate_series(1,10), generate_series(1,10),'text';
SELECT COUNT(*) FROM dml_heap_pt_r WHERE c ='text';
 count 
-------
    10
(1 row)

SELECT COUNT(*) FROM dml_heap_pt_r;
 count 
-------
   110
(1 row)

rollback;
--Insert with generate_series
begin;
SELECT COUNT(*) FROM dml_heap_pt_r;
 count 
-------
   100
(1 row)

INSERT INTO dml_heap_pt_r SELECT *,1 from generate_series(1,10);
SELECT COUNT(*) FROM dml_heap_pt_r;
 count 
-------
   110
(1 row)

rollback;
--Join on the non-distribution key of target table
begin;
SELECT COUNT(*) FROM dml_heap_pt_r;
 count 
-------
   100
(1 row)

SELECT COUNT(*) FROM (SELECT dml_heap_pt_r.* FROM dml_heap_pt_r,dml_heap_pt_s  WHERE dml_heap_pt_r.b = dml_heap_pt_s.a)foo;
 count 
-------
    36
(1 row)

INSERT INTO dml_heap_pt_r SELECT dml_heap_pt_r.* FROM dml_heap_pt_r,dml_heap_pt_s  WHERE dml_heap_pt_r.b = dml_heap_pt_s.a;
SELECT COUNT(*) FROM dml_heap_pt_r;
 count 
-------
   136
(1 row)

rollback;
--Join on the distribution key of target table
begin;
SELECT COUNT(*) FROM dml_heap_pt_s;
 count 
-------
   115
(1 row)

SELECT COUNT(*) FROM (SELECT dml_heap_pt_s.* FROM dml_heap_pt_r,dml_heap_pt_s WHERE dml_heap_pt_s.a = dml_heap_pt_r.a)foo;
 count 
-------
   111
(1 row)

INSERT INTO dml_heap_pt_s SELECT dml_heap_pt_s.* FROM dml_heap_pt_r,dml_heap_pt_s WHERE dml_heap_pt_s.a = dml_heap_pt_r.a;
SELECT COUNT(*) FROM dml_heap_pt_s;
 count 
-------
   226
(1 row)

rollback;
--Join on distribution key of target table
begin;
SELECT COUNT(*) FROM dml_heap_pt_r;
 count 
-------
   100
(1 row)

SELECT COUNT(*) FROM (SELECT dml_heap_pt_r.a,dml_heap_pt_r.b,dml_heap_pt_s.c FROM dml_heap_pt_s INNER JOIN dml_heap_pt_r on dml_heap_pt_r.a = dml_heap_pt_s.a)foo;
 count 
-------
   111
(1 row)

INSERT INTO dml_heap_pt_r SELECT dml_heap_pt_r.a,dml_heap_pt_r.b,dml_heap_pt_s.c FROM dml_heap_pt_s INNER JOIN dml_heap_pt_r on dml_heap_pt_r.a = dml_heap_pt_s.a ;
SELECT COUNT(*) FROM dml_heap_pt_r;
 count 
-------
   211
(1 row)

rollback;
--Join on the distribution key of target table. Insert Large number of rows
begin;
SELECT COUNT(*) FROM dml_heap_pt_s;
 count 
-------
   115
(1 row)

SELECT COUNT(*) FROM (SELECT dml_heap_pt_r.a,dml_heap_pt_r.b,dml_heap_pt_s.c FROM dml_heap_pt_s INNER JOIN dml_heap_pt_r on dml_heap_pt_r.b = dml_heap_pt_s.b)foo;
 count 
-------
   100
(1 row)

INSERT INTO dml_heap_pt_s SELECT dml_heap_pt_r.a,dml_heap_pt_r.b,dml_heap_pt_s.c FROM dml_heap_pt_s INNER JOIN dml_heap_pt_r on dml_heap_pt_r.b = dml_heap_pt_s.b ;
SELECT COUNT(*) FROM dml_heap_pt_s;
 count 
-------
   215
(1 row)

rollback;
--Join with different column order 
begin;
SELECT COUNT(*) FROM dml_heap_pt_r;
 count 
-------
   100
(1 row)

SELECT COUNT(*) FROM (SELECT dml_heap_pt_s.a,dml_heap_pt_r.b,'text' FROM dml_heap_pt_r,dml_heap_pt_s  WHERE dml_heap_pt_r.b = dml_heap_pt_s.b)foo;
 count 
-------
   100
(1 row)

INSERT INTO dml_heap_pt_r(b,a,c) SELECT dml_heap_pt_s.a,dml_heap_pt_r.b,'text' FROM dml_heap_pt_r,dml_heap_pt_s  WHERE dml_heap_pt_r.b = dml_heap_pt_s.b;
SELECT COUNT(*) FROM dml_heap_pt_r;
 count 
-------
   200
(1 row)

rollback;
--Join with Aggregate
begin;
SELECT COUNT(*) FROM dml_heap_pt_r;
 count 
-------
   100
(1 row)

ALTER TABLE dml_heap_pt_r ADD DEFAULT partition def;
SELECT COUNT(*) FROM (SELECT COUNT(*) + dml_heap_pt_s.a, dml_heap_pt_r.b + dml_heap_pt_r.a ,'text' FROM dml_heap_pt_r, dml_heap_pt_s WHERE dml_heap_pt_r.b = dml_heap_pt_s.b GROUP BY dml_heap_pt_s.a,dml_heap_pt_r.b,dml_heap_pt_r.a)foo;
 count 
-------
   100
(1 row)

INSERT INTO dml_heap_pt_r SELECT COUNT(*) + dml_heap_pt_s.a, dml_heap_pt_r.b + dml_heap_pt_r.a ,'text' FROM dml_heap_pt_r, dml_heap_pt_s WHERE dml_heap_pt_r.b = dml_heap_pt_s.b GROUP BY dml_heap_pt_s.a,dml_heap_pt_r.b,dml_heap_pt_r.a ;
SELECT COUNT(*) FROM dml_heap_pt_r;
 count 
-------
   200
(1 row)

ALTER TABLE dml_heap_pt_r DROP DEFAULT partition;
NOTICE:  dropped partition "def" for relation "dml_heap_pt_r"
rollback;
--Join with DISTINCT
begin;
SELECT COUNT(*) FROM dml_heap_pt_s;
 count 
-------
   115
(1 row)

SELECT COUNT(*) FROM (SELECT DISTINCT dml_heap_pt_r.a,dml_heap_pt_r.b,dml_heap_pt_s.c FROM dml_heap_pt_s INNER JOIN dml_heap_pt_r on dml_heap_pt_s.a = dml_heap_pt_r.a)foo;
 count 
-------
   110
(1 row)

INSERT INTO dml_heap_pt_s SELECT DISTINCT dml_heap_pt_r.a,dml_heap_pt_r.b,dml_heap_pt_s.c FROM dml_heap_pt_s INNER JOIN dml_heap_pt_r on dml_heap_pt_s.a = dml_heap_pt_r.a ;
SELECT COUNT(*) FROM dml_heap_pt_s;
 count 
-------
   225
(1 row)

rollback;
--Insert NULL with Joins
begin;
SELECT COUNT(*) FROM dml_heap_pt_r;
 count 
-------
   100
(1 row)

SELECT COUNT(*) FROM (SELECT NULL,dml_heap_pt_r.b,'text' FROM dml_heap_pt_r,dml_heap_pt_s WHERE dml_heap_pt_r.b = dml_heap_pt_s.b)foo;
 count 
-------
   100
(1 row)

INSERT INTO dml_heap_pt_r SELECT NULL,dml_heap_pt_r.b,'text' FROM dml_heap_pt_r,dml_heap_pt_s WHERE dml_heap_pt_r.b = dml_heap_pt_s.b;
SELECT COUNT(*) FROM dml_heap_pt_r;
 count 
-------
   200
(1 row)

rollback;
--Insert 0 rows
SELECT COUNT(*) FROM dml_heap_pt_r;
 count 
-------
   100
(1 row)

INSERT INTO dml_heap_pt_r SELECT dml_heap_pt_r.* FROM dml_heap_pt_r,dml_heap_pt_s WHERE dml_heap_pt_r.b = dml_heap_pt_s.a LIMIT 0;
SELECT COUNT(*) FROM dml_heap_pt_r;
 count 
-------
   100
(1 row)

--Insert 0 rows
SELECT COUNT(*) FROM dml_heap_pt_r;
 count 
-------
   100
(1 row)

INSERT INTO dml_heap_pt_r SELECT dml_heap_pt_r.* FROM dml_heap_pt_r,dml_heap_pt_s WHERE dml_heap_pt_r.b = dml_heap_pt_s.a and false;
SELECT COUNT(*) FROM dml_heap_pt_r;
 count 
-------
   100
(1 row)

--Negative tests Insert column of different data type
SELECT COUNT(*) FROM dml_heap_pt_r;
 count 
-------
   100
(1 row)

SELECT COUNT(*) FROM (SELECT ('a')::int, dml_heap_pt_r.b,10 FROM dml_heap_pt_s WHERE dml_heap_pt_r.b = dml_heap_pt_s.b)foo;
ERROR:  invalid input syntax for integer: "a"
LINE 1: SELECT COUNT(*) FROM (SELECT ('a')::int, dml_heap_pt_r.b,10 ...
                                      ^
INSERT INTO dml_heap_pt_r SELECT ('a')::int, dml_heap_pt_r.b,10 FROM dml_heap_pt_s WHERE dml_heap_pt_r.b = dml_heap_pt_s.b;
ERROR:  invalid input syntax for integer: "a"
LINE 1: INSERT INTO dml_heap_pt_r SELECT ('a')::int, dml_heap_pt_r.b...
                                          ^
SELECT COUNT(*) FROM dml_heap_pt_r;
 count 
-------
   100
(1 row)

--Negative test case. INSERT has more expressions than target columns
begin;
SELECT COUNT(*) FROM dml_heap_pt_s;
 count 
-------
   115
(1 row)

SELECT COUNT(*) FROM (SELECT COUNT(*) as a, dml_heap_pt_r.b, dml_heap_pt_r.c, dml_heap_pt_r.d FROM dml_heap_pt_r, dml_heap_pt_s WHERE dml_heap_pt_s.a = dml_heap_pt_r.a GROUP BY dml_heap_pt_r.a, dml_heap_pt_r.b, dml_heap_pt_r.c, dml_heap_pt_r.d)foo;
 count 
-------
   100
(1 row)

INSERT INTO dml_heap_pt_s SELECT COUNT(*) as a, dml_heap_pt_r.b, dml_heap_pt_r.c, dml_heap_pt_r.d FROM dml_heap_pt_r, dml_heap_pt_s WHERE dml_heap_pt_s.a = dml_heap_pt_r.a GROUP BY dml_heap_pt_r.a, dml_heap_pt_r.b, dml_heap_pt_r.c, dml_heap_pt_r.d;
SELECT COUNT(*) FROM dml_heap_pt_s;
 count 
-------
   215
(1 row)

rollback;
--Insert with join on the partition key
begin;
SELECT COUNT(*) FROM dml_heap_pt_r;
 count 
-------
   100
(1 row)

SELECT COUNT(*) FROM (SELECT dml_heap_pt_r.* FROM dml_heap_pt_r, dml_heap_pt_s WHERE dml_heap_pt_r.b = dml_heap_pt_s.b)foo;
 count 
-------
   100
(1 row)

INSERT INTO dml_heap_pt_r SELECT dml_heap_pt_r.* FROM dml_heap_pt_r, dml_heap_pt_s WHERE dml_heap_pt_r.b = dml_heap_pt_s.b;
SELECT COUNT(*) FROM dml_heap_pt_r;
 count 
-------
   200
(1 row)

rollback;
--Negative test - Insert NULL value to a table without default partition
SELECT COUNT(*) FROM dml_heap_pt_r;
 count 
-------
   100
(1 row)

INSERT INTO dml_heap_pt_r SELECT dml_heap_pt_r.b, NULL, dml_heap_pt_r.c FROM dml_heap_pt_r, dml_heap_pt_s WHERE dml_heap_pt_r.b = dml_heap_pt_s.b;
ERROR:  no partition for partitioning key  (seg0 127.0.0.1:40000 pid=18972)
SELECT COUNT(*) FROM dml_heap_pt_r;
 count 
-------
   100
(1 row)

--Negative test - Insert out of partition range values for table without default partition
SELECT COUNT(*) FROM dml_heap_pt_r;
 count 
-------
   100
(1 row)

INSERT INTO dml_heap_pt_r SELECT dml_heap_pt_r.b ,dml_heap_pt_r.a + dml_heap_pt_s.a + 100, dml_heap_pt_r.c FROM dml_heap_pt_r, dml_heap_pt_s WHERE dml_heap_pt_r.a = dml_heap_pt_s.b;
ERROR:  no partition for partitioning key  (seg1 127.0.0.1:40001 pid=18973)
SELECT COUNT(*) FROM dml_heap_pt_r;
 count 
-------
   100
(1 row)

--Update to constant value
begin;
SELECT COUNT(*) FROM dml_heap_pt_r WHERE c ='text';
 count 
-------
     0
(1 row)

UPDATE dml_heap_pt_r SET c = 'text';
SELECT COUNT(*) FROM dml_heap_pt_r WHERE c ='text';
 count 
-------
   100
(1 row)

rollback;
--Update and set distribution key to constant
begin;
SELECT COUNT(*) FROM (SELECT DISTINCT(b) FROM dml_heap_pt_s)foo;
 count 
-------
   102
(1 row)

UPDATE dml_heap_pt_s SET b = 10;
ERROR:  Cannot parallelize an UPDATE statement that updates the distribution columns
SELECT COUNT(*) FROM (SELECT DISTINCT(b) FROM dml_heap_pt_s)foo;
ERROR:  current transaction is aborted, commands ignored until end of transaction block
rollback;
--Update to default value
begin;
SELECT SUM(a) FROM dml_heap_pt_r;
 sum  
------
 5050
(1 row)

UPDATE dml_heap_pt_r SET a = DEFAULT;
ERROR:  Cannot parallelize an UPDATE statement that updates the distribution columns
SELECT SUM(a) FROM dml_heap_pt_r;
ERROR:  current transaction is aborted, commands ignored until end of transaction block
rollback;
--Update to default value
begin;
SELECT SUM(a) FROM dml_heap_pt_r;
 sum  
------
 5050
(1 row)

SELECT SUM(b) FROM dml_heap_pt_r;
  sum  
-------
 15150
(1 row)

ALTER TABLE dml_heap_pt_r ADD DEFAULT partition def;
UPDATE dml_heap_pt_r SET a = DEFAULT, b = DEFAULT;
ERROR:  Cannot parallelize an UPDATE statement that updates the distribution columns
SELECT SUM(a) FROM dml_heap_pt_r;
ERROR:  current transaction is aborted, commands ignored until end of transaction block
SELECT SUM(b) FROM dml_heap_pt_r;
ERROR:  current transaction is aborted, commands ignored until end of transaction block
rollback;
--Update and reset the value
begin;
SELECT COUNT(*) FROM (SELECT DISTINCT(a) FROM dml_heap_pt_r)foo;
 count 
-------
   100
(1 row)

UPDATE dml_heap_pt_r SET a = a;
SELECT COUNT(*) FROM (SELECT DISTINCT(a) FROM dml_heap_pt_r)foo;
 count 
-------
   100
(1 row)

rollback;
--Update and generate_series
begin;
SELECT COUNT(*) FROM dml_heap_pt_r WHERE a = 1;
 count 
-------
     1
(1 row)

SELECT COUNT(*) FROM dml_heap_pt_r WHERE c ='n';
 count 
-------
     0
(1 row)

UPDATE dml_heap_pt_r SET a = generate_series(1,10), c ='n';
ERROR:  Cannot parallelize an UPDATE statement that updates the distribution columns
SELECT COUNT(*) FROM dml_heap_pt_r WHERE c ='n';
ERROR:  current transaction is aborted, commands ignored until end of transaction block
SELECT COUNT(*) FROM dml_heap_pt_r WHERE a = 1;
ERROR:  current transaction is aborted, commands ignored until end of transaction block
rollback;
--Update distcol where join on target table non dist key
begin;
SELECT SUM(a) FROM dml_heap_pt_r;
 sum  
------
 5050
(1 row)

UPDATE dml_heap_pt_r SET a = dml_heap_pt_r.a + 1 FROM dml_heap_pt_s WHERE dml_heap_pt_r.a = dml_heap_pt_s.a;
ERROR:  Cannot parallelize an UPDATE statement that updates the distribution columns
SELECT SUM(a) FROM dml_heap_pt_r;
ERROR:  current transaction is aborted, commands ignored until end of transaction block
rollback;
--Update and from values
begin;
SELECT * FROM dml_heap_pt_r WHERE b = 20 ORDER BY 1;
 a | b | c | d 
---+---+---+---
(0 rows)

UPDATE dml_heap_pt_r SET a = v.i + 1 FROM (VALUES(100, 20)) as v(i, j) WHERE dml_heap_pt_r.b = v.j;
ERROR:  Cannot parallelize an UPDATE statement that updates the distribution columns
SELECT * FROM dml_heap_pt_r WHERE b = 20 ORDER BY 1;
ERROR:  current transaction is aborted, commands ignored until end of transaction block
rollback;
--Update with Joins and set to constant value
SELECT COUNT(*) FROM dml_heap_pt_s WHERE b = 10;
 count 
-------
     0
(1 row)

UPDATE dml_heap_pt_s SET b = 10 FROM dml_heap_pt_r WHERE dml_heap_pt_r.b = dml_heap_pt_s.a;
ERROR:  Cannot parallelize an UPDATE statement that updates the distribution columns
SELECT COUNT(*) FROM dml_heap_pt_s WHERE b = 10;
 count 
-------
     0
(1 row)

--Update distcol with predicate in subquery
begin;
UPDATE dml_heap_pt_r SET a = dml_heap_pt_r.a + 1 FROM dml_heap_pt_s WHERE dml_heap_pt_r.b = dml_heap_pt_s.a and dml_heap_pt_s.b in (SELECT dml_heap_pt_s.b + dml_heap_pt_r.a FROM dml_heap_pt_s,dml_heap_pt_r WHERE dml_heap_pt_r.a > 10);
ERROR:  Cannot parallelize an UPDATE statement that updates the distribution columns
rollback;
--Update with aggregate in subquery
begin;
SELECT COUNT(*) FROM dml_heap_pt_s WHERE b = (SELECT COUNT(*) FROM dml_heap_pt_s);
 count 
-------
     0
(1 row)

SELECT COUNT(*) FROM dml_heap_pt_s;
 count 
-------
   115
(1 row)

UPDATE dml_heap_pt_s SET b = (SELECT COUNT(*) FROM dml_heap_pt_s) FROM dml_heap_pt_r WHERE dml_heap_pt_r.a = dml_heap_pt_s.b;
ERROR:  Cannot parallelize an UPDATE statement that updates the distribution columns
SELECT COUNT(*) FROM dml_heap_pt_s WHERE b = (SELECT COUNT(*) FROM dml_heap_pt_s);
ERROR:  current transaction is aborted, commands ignored until end of transaction block
rollback;
--Update and limit in subquery
SELECT COUNT(*) FROM dml_heap_pt_r WHERE a = 1;
 count 
-------
     1
(1 row)

SELECT DISTINCT(b) FROM dml_heap_pt_s ORDER BY 1 LIMIT 1;
 b 
---
 1
(1 row)

UPDATE dml_heap_pt_r SET a = (SELECT DISTINCT(b) FROM dml_heap_pt_s ORDER BY 1 LIMIT 1) FROM dml_heap_pt_s WHERE dml_heap_pt_r.b = dml_heap_pt_s.a;
ERROR:  Cannot parallelize an UPDATE statement that updates the distribution columns
SELECT COUNT(*) FROM dml_heap_pt_r WHERE a = 1;
 count 
-------
     1
(1 row)

--Update multiple columns
begin;
SELECT COUNT(*) FROM dml_heap_pt_r WHERE b is NULL;
 count 
-------
     0
(1 row)

SELECT dml_heap_pt_s.a + 10 FROM dml_heap_pt_r,dml_heap_pt_s WHERE dml_heap_pt_r.a = dml_heap_pt_s.a ORDER BY 1 LIMIT 1;
 ?column? 
----------
       11
(1 row)

SELECT * FROM dml_heap_pt_r WHERE a = 1;
 a | b | c | d 
---+---+---+---
 1 | 3 | r | 1
(1 row)

ALTER TABLE dml_heap_pt_r ADD DEFAULT partition def;
UPDATE dml_heap_pt_r SET a = dml_heap_pt_s.a + 10 ,b = NULL FROM dml_heap_pt_s WHERE dml_heap_pt_r.a + 2= dml_heap_pt_s.b;
ERROR:  Cannot parallelize an UPDATE statement that updates the distribution columns
SELECT * FROM dml_heap_pt_r WHERE a = 11 ORDER BY 1,2;
ERROR:  current transaction is aborted, commands ignored until end of transaction block
SELECT COUNT(*) FROM dml_heap_pt_r WHERE b is NULL;
ERROR:  current transaction is aborted, commands ignored until end of transaction block
ALTER TABLE dml_heap_pt_r DROP DEFAULT partition;
ERROR:  current transaction is aborted, commands ignored until end of transaction block
rollback;
--Update multiple columns
SELECT COUNT(*) FROM dml_heap_pt_r WHERE c='z';
 count 
-------
     0
(1 row)

SELECT dml_heap_pt_s.a ,dml_heap_pt_s.b,'z' FROM dml_heap_pt_r,dml_heap_pt_s WHERE dml_heap_pt_r.a = dml_heap_pt_s.b ORDER BY 1,2 LIMIT 1;
 a | b | ?column? 
---+---+----------
 0 | 1 | z
(1 row)

ALTER TABLE dml_heap_pt_r ADD DEFAULT partition def;
UPDATE dml_heap_pt_r SET (a,b,c) = (dml_heap_pt_s.a ,dml_heap_pt_s.b,'z') FROM dml_heap_pt_s WHERE dml_heap_pt_r.a + 1= dml_heap_pt_s.b;
ERROR:  Cannot parallelize an UPDATE statement that updates the distribution columns
SELECT * FROM dml_heap_pt_r WHERE c='z' ORDER BY 1 LIMIT 1;
 a | b | c | d 
---+---+---+---
(0 rows)

SELECT COUNT(*) FROM dml_heap_pt_r WHERE c='z';
 count 
-------
     0
(1 row)

ALTER TABLE dml_heap_pt_r DROP DEFAULT partition;
NOTICE:  dropped partition "def" for relation "dml_heap_pt_r"
--Update with prepare plans
begin;
PREPARE plan_upd as UPDATE dml_heap_pt_r SET a = dml_heap_pt_s.a +1 FROM dml_heap_pt_s WHERE dml_heap_pt_r.a = dml_heap_pt_s.b ;
ERROR:  Cannot parallelize an UPDATE statement that updates the distribution columns
EXECUTE plan_upd;
ERROR:  current transaction is aborted, commands ignored until end of transaction block
rollback;
--Update and case
begin;
SELECT COUNT(*) FROM dml_heap_pt_r WHERE a = 20 ;
 count 
-------
     1
(1 row)

UPDATE dml_heap_pt_r SET a = (SELECT case when c = 'r' then MAX(b) else 100 end FROM dml_heap_pt_r GROUP BY c) ;
ERROR:  Cannot parallelize an UPDATE statement that updates the distribution columns
SELECT COUNT(*) FROM dml_heap_pt_r WHERE a = 20 ;
ERROR:  current transaction is aborted, commands ignored until end of transaction block
rollback;
--Negative test - Update with sub-query returning more than one row
SELECT SUM(a) FROM dml_heap_pt_r;
 sum  
------
 5050
(1 row)

UPDATE dml_heap_pt_r SET a = ( SELECT DISTINCT(b) FROM dml_heap_pt_s ) FROM dml_heap_pt_s WHERE dml_heap_pt_r.b = dml_heap_pt_s.a;
ERROR:  Cannot parallelize an UPDATE statement that updates the distribution columns
SELECT SUM(a) FROM dml_heap_pt_r;
 sum  
------
 5050
(1 row)

--Negative test - Update with sub-query returning more than one row
SELECT SUM(b) FROM dml_heap_pt_r;
  sum  
-------
 15150
(1 row)

UPDATE dml_heap_pt_r SET b = (SELECT dml_heap_pt_r.b FROM dml_heap_pt_r,dml_heap_pt_s WHERE dml_heap_pt_r.a = dml_heap_pt_s.a );
ERROR:  more than one row returned by a subquery used as an expression
SELECT SUM(b) FROM dml_heap_pt_r;
  sum  
-------
 15150
(1 row)

--Negative test - Update WHERE join returns more than one tuple with different values.
CREATE TABLE dml_heap_pt_u as SELECT i as a, i as b  FROM generate_series(1,10)i;
CREATE TABLE dml_heap_pt_v as SELECT i as a, i as b FROM generate_series(1,10)i;
SELECT SUM(a) FROM dml_heap_pt_v;
 sum 
-----
  55
(1 row)

UPDATE dml_heap_pt_v SET a = dml_heap_pt_u.a FROM dml_heap_pt_u WHERE dml_heap_pt_u.b = dml_heap_pt_v.b;
ERROR:  Cannot parallelize an UPDATE statement that updates the distribution columns
SELECT SUM(a) FROM dml_heap_pt_v;
 sum 
-----
  55
(1 row)

--Update with joins on multiple table
begin;
SELECT SUM(a) FROM dml_heap_pt_r;
 sum  
------
 5050
(1 row)

UPDATE dml_heap_pt_r SET a = dml_heap_pt_r.b+1 FROM dml_heap_pt_p,dml_heap_pt_s WHERE dml_heap_pt_r.b = dml_heap_pt_s.b and dml_heap_pt_r.a = dml_heap_pt_p.b+1;
ERROR:  Cannot parallelize an UPDATE statement that updates the distribution columns
SELECT SUM(a) FROM dml_heap_pt_r;
ERROR:  current transaction is aborted, commands ignored until end of transaction block
rollback;
--Update on table with composite distribution key
-- This currently falls back to planner, even if ORCA is enabled. And planner can't
-- produce plans that update distribution key columns.
SELECT SUM(a) FROM dml_heap_pt_r;
 sum  
------
 5050
(1 row)

UPDATE dml_heap_pt_p SET a = dml_heap_pt_p.b % 2 FROM dml_heap_pt_r WHERE dml_heap_pt_p.b::int = dml_heap_pt_r.b::int and dml_heap_pt_p.a = dml_heap_pt_r.a;
ERROR:  Cannot parallelize an UPDATE statement that updates the distribution columns
SELECT SUM(a) FROM dml_heap_pt_r;
 sum  
------
 5050
(1 row)

--Update on table with composite distribution key
begin;
SELECT SUM(b) FROM dml_heap_pt_p;
  sum  
-------
 15152
(1 row)

UPDATE dml_heap_pt_p SET b = (dml_heap_pt_p.b * 1.1)::int FROM dml_heap_pt_r WHERE dml_heap_pt_p.b = dml_heap_pt_r.a and dml_heap_pt_p.b = dml_heap_pt_r.b;
ERROR:  Cannot parallelize an UPDATE statement that updates the distribution columns
SELECT SUM(b) FROM dml_heap_pt_p;
ERROR:  current transaction is aborted, commands ignored until end of transaction block
rollback;
--Update the partition key and move tuples across partitions( moving tuple to default partition)
begin;
SELECT SUM(a) FROM dml_heap_pt_s;
 sum  
------
 5106
(1 row)

UPDATE dml_heap_pt_s SET a = dml_heap_pt_r.a + 30000 FROM dml_heap_pt_r WHERE dml_heap_pt_r.b = dml_heap_pt_s.b;
ERROR:  moving tuple from partition "dml_heap_pt_s_1_prt_2" to partition "dml_heap_pt_s_1_prt_def" not supported  (seg0 127.0.0.1:40000 pid=18972)
SELECT SUM(a) FROM dml_heap_pt_s;
ERROR:  current transaction is aborted, commands ignored until end of transaction block
rollback;
--Negative test update partition key (no default partition)
SELECT SUM(b) FROM dml_heap_pt_r;
  sum  
-------
 15150
(1 row)

UPDATE dml_heap_pt_r SET b = dml_heap_pt_r.a + 3000000 FROM dml_heap_pt_s WHERE dml_heap_pt_r.a = dml_heap_pt_s.a;
ERROR:  no partition for partitioning key  (seg1 127.0.0.1:40001 pid=18973)
SELECT SUM(b) FROM dml_heap_pt_r; 
  sum  
-------
 15150
(1 row)

--Insert with generate_series
begin;
SELECT COUNT(*) FROM dml_heap_r;
 count 
-------
   113
(1 row)

INSERT INTO dml_heap_r values(generate_series(1,10), generate_series(1,100), 'text');
SELECT COUNT(*) FROM dml_heap_r WHERE c ='text';
 count 
-------
   100
(1 row)

SELECT COUNT(*) FROM dml_heap_r;
 count 
-------
   213
(1 row)

rollback;
--Insert with generate_series and NULL
begin;
SELECT COUNT(*) FROM dml_heap_r;
 count 
-------
   113
(1 row)

INSERT INTO dml_heap_r values(generate_series(1,10),NULL,'text');
SELECT * FROM dml_heap_r WHERE c ='text' ORDER BY 1;
 a  | b |  c   
----+---+------
  1 |   | text
  2 |   | text
  3 |   | text
  4 |   | text
  5 |   | text
  6 |   | text
  7 |   | text
  8 |   | text
  9 |   | text
 10 |   | text
(10 rows)

SELECT COUNT(*) FROM dml_heap_r;
 count 
-------
   123
(1 row)

rollback;
--Insert with generate_series
begin;
SELECT COUNT(*) FROM dml_heap_r;
 count 
-------
   113
(1 row)

TRUNCATE TABLE dml_heap_r;
INSERT INTO dml_heap_r SELECT generate_series(1,10);
SELECT * FROM dml_heap_r ORDER BY 1;
 a  | b  | c 
----+----+---
  1 | -1 | 
  2 | -1 | 
  3 | -1 | 
  4 | -1 | 
  5 | -1 | 
  6 | -1 | 
  7 | -1 | 
  8 | -1 | 
  9 | -1 | 
 10 | -1 | 
(10 rows)

SELECT COUNT(*) FROM dml_heap_r;
 count 
-------
    10
(1 row)

SELECT COUNT(*) FROM dml_heap_r;
 count 
-------
    10
(1 row)

rollback;
--Insert with generate_series
begin;
SELECT COUNT(*) FROM dml_heap_r;
 count 
-------
   113
(1 row)

INSERT INTO dml_heap_r SELECT generate_series(1,10), generate_series(1,10),'text';
SELECT COUNT(*) FROM dml_heap_r WHERE c ='text';
 count 
-------
    10
(1 row)

SELECT COUNT(*) FROM dml_heap_r;
 count 
-------
   123
(1 row)

rollback;
--Insert with generate_series
begin;
SELECT COUNT(*) FROM dml_heap_r;
 count 
-------
   113
(1 row)

INSERT INTO dml_heap_r SELECT * from generate_series(1,10);
SELECT COUNT(*) FROM dml_heap_r;
 count 
-------
   123
(1 row)

rollback;
--Join on the non-distribution key of target table
begin;
SELECT COUNT(*) FROM dml_heap_r;
 count 
-------
   113
(1 row)

SELECT COUNT(*) FROM (SELECT dml_heap_r.* FROM dml_heap_r,dml_heap_s  WHERE dml_heap_r.b = dml_heap_s.b)foo;
 count 
-------
   111
(1 row)

INSERT INTO dml_heap_r SELECT dml_heap_r.* FROM dml_heap_r,dml_heap_s  WHERE dml_heap_r.b = dml_heap_s.b;
SELECT COUNT(*) FROM dml_heap_r;
 count 
-------
   224
(1 row)

rollback;
--Join on the distribution key of target table
begin;
SELECT COUNT(*) FROM dml_heap_s;
 count 
-------
   113
(1 row)

SELECT COUNT(*) FROM (SELECT dml_heap_s.* FROM dml_heap_r,dml_heap_s WHERE dml_heap_s.a = dml_heap_r.a)foo;
 count 
-------
   111
(1 row)

INSERT INTO dml_heap_s SELECT dml_heap_s.* FROM dml_heap_r,dml_heap_s WHERE dml_heap_s.a = dml_heap_r.a;
SELECT COUNT(*) FROM dml_heap_s;
 count 
-------
   224
(1 row)

rollback;
--Join on distribution key of target table
begin;
SELECT COUNT(*) FROM dml_heap_r;
 count 
-------
   113
(1 row)

SELECT COUNT(*) FROM (SELECT dml_heap_r.a,dml_heap_r.b,dml_heap_s.c FROM dml_heap_s INNER JOIN dml_heap_r on dml_heap_r.a = dml_heap_s.a)foo;
 count 
-------
   111
(1 row)

INSERT INTO dml_heap_r SELECT dml_heap_r.a,dml_heap_r.b,dml_heap_s.c FROM dml_heap_s INNER JOIN dml_heap_r on dml_heap_r.a = dml_heap_s.a ;
SELECT COUNT(*) FROM dml_heap_r;
 count 
-------
   224
(1 row)

rollback;
--Join on the distribution key of target table. Insert Large number of rows
begin;
SELECT COUNT(*) FROM dml_heap_s;
 count 
-------
   113
(1 row)

SELECT COUNT(*) FROM (SELECT dml_heap_r.a,dml_heap_r.b,dml_heap_s.c FROM dml_heap_s INNER JOIN dml_heap_r on dml_heap_r.b <> dml_heap_s.b )foo;
 count 
-------
 11100
(1 row)

INSERT INTO dml_heap_s SELECT dml_heap_r.a,dml_heap_r.b,dml_heap_s.c FROM dml_heap_s INNER JOIN dml_heap_r on dml_heap_r.b <> dml_heap_s.b ;
SELECT COUNT(*) FROM dml_heap_s;
 count 
-------
 11213
(1 row)

rollback;
--Join with different column order 
begin;
SELECT COUNT(*) FROM dml_heap_r;
 count 
-------
   113
(1 row)

SELECT COUNT(*) FROM (SELECT dml_heap_s.a,dml_heap_r.b,'text' FROM dml_heap_r,dml_heap_s  WHERE dml_heap_r.b = dml_heap_s.b)foo;
 count 
-------
   111
(1 row)

INSERT INTO dml_heap_r(b,a,c) SELECT dml_heap_s.a,dml_heap_r.b,'text' FROM dml_heap_r,dml_heap_s  WHERE dml_heap_r.b = dml_heap_s.b;
SELECT COUNT(*) FROM dml_heap_r;
 count 
-------
   224
(1 row)

rollback;
--Join with Aggregate
begin;
SELECT COUNT(*) FROM dml_heap_r;
 count 
-------
   113
(1 row)

SELECT COUNT(*) FROM (SELECT COUNT(*) + dml_heap_s.a, dml_heap_r.b + dml_heap_r.a ,'text' FROM dml_heap_r, dml_heap_s WHERE dml_heap_r.b = dml_heap_s.b GROUP BY dml_heap_s.a,dml_heap_r.b,dml_heap_r.a)foo;
 count 
-------
   110
(1 row)

INSERT INTO dml_heap_r SELECT COUNT(*) + dml_heap_s.a, dml_heap_r.b + dml_heap_r.a ,'text' FROM dml_heap_r, dml_heap_s WHERE dml_heap_r.b = dml_heap_s.b GROUP BY dml_heap_s.a,dml_heap_r.b,dml_heap_r.a ;
SELECT COUNT(*) FROM dml_heap_r;
 count 
-------
   223
(1 row)

rollback;
--Join with DISTINCT
begin;
SELECT COUNT(*) FROM dml_heap_s;
 count 
-------
   113
(1 row)

SELECT COUNT(*) FROM (SELECT DISTINCT dml_heap_r.a,dml_heap_r.b,dml_heap_s.c FROM dml_heap_s INNER JOIN dml_heap_r on dml_heap_s.a = dml_heap_r.a)foo;
 count 
-------
   110
(1 row)

INSERT INTO dml_heap_s SELECT DISTINCT dml_heap_r.a,dml_heap_r.b,dml_heap_s.c FROM dml_heap_s INNER JOIN dml_heap_r on dml_heap_s.a = dml_heap_r.a ;
SELECT COUNT(*) FROM dml_heap_s;
 count 
-------
   223
(1 row)

rollback;
--Insert NULL with Joins
begin;
SELECT COUNT(*) FROM dml_heap_r;
 count 
-------
   113
(1 row)

SELECT COUNT(*) FROM (SELECT NULL,dml_heap_r.b,'text' FROM dml_heap_r,dml_heap_s WHERE dml_heap_r.b = dml_heap_s.b)foo;
 count 
-------
   111
(1 row)

INSERT INTO dml_heap_r SELECT NULL,dml_heap_r.b,'text' FROM dml_heap_r,dml_heap_s WHERE dml_heap_r.b = dml_heap_s.b;
SELECT COUNT(*) FROM dml_heap_r;
 count 
-------
   224
(1 row)

rollback;
--Insert and CASE
begin;
SELECT COUNT(*) FROM dml_heap_r;
 count 
-------
   113
(1 row)

SELECT COUNT(*) FROM (SELECT A,B, case when c ='s' then C  else NULL end as C FROM (SELECT sum(dml_heap_p.a) as A, dml_heap_p.a as B, dml_heap_s.c as C FROM dml_heap_p, dml_heap_s WHERE dml_heap_p.a = dml_heap_s.a GROUP BY dml_heap_p.a,dml_heap_s.c)as x GROUP BY A,B,C)foo;
 count 
-------
    10
(1 row)

INSERT INTO dml_heap_r SELECT A,B, case when c ='s' then C  else NULL end as C FROM (SELECT sum(dml_heap_p.a) as A, dml_heap_p.a as B, dml_heap_s.c as C FROM dml_heap_p, dml_heap_s WHERE dml_heap_p.a = dml_heap_s.a GROUP BY dml_heap_p.a,dml_heap_s.c)as x GROUP BY A,B,C;
SELECT COUNT(*) FROM dml_heap_r;
 count 
-------
   123
(1 row)

rollback;
--Insert 0 rows
SELECT COUNT(*) FROM dml_heap_r;
 count 
-------
   113
(1 row)

INSERT INTO dml_heap_r SELECT dml_heap_r.* FROM dml_heap_r,dml_heap_s WHERE dml_heap_r.b = dml_heap_s.a LIMIT 0;
SELECT COUNT(*) FROM dml_heap_r;
 count 
-------
   113
(1 row)

--Insert 0 rows
SELECT COUNT(*) FROM dml_heap_r;
 count 
-------
   113
(1 row)

INSERT INTO dml_heap_r SELECT dml_heap_r.* FROM dml_heap_r,dml_heap_s WHERE dml_heap_r.b = dml_heap_s.a and false;
SELECT COUNT(*) FROM dml_heap_r;
 count 
-------
   113
(1 row)

--Negative tests Insert column of different data type
SELECT COUNT(*) FROM dml_heap_r;
 count 
-------
   113
(1 row)

SELECT COUNT(*) FROM ( SELECT ('a')::int, dml_heap_r.b,10 FROM dml_heap_s WHERE dml_heap_r.b = dml_heap_s.b)foo;
ERROR:  invalid input syntax for integer: "a"
LINE 1: SELECT COUNT(*) FROM ( SELECT ('a')::int, dml_heap_r.b,10 FR...
                                       ^
INSERT INTO dml_heap_r SELECT ('a')::int, dml_heap_r.b,10 FROM dml_heap_s WHERE dml_heap_r.b = dml_heap_s.b;
ERROR:  invalid input syntax for integer: "a"
LINE 1: INSERT INTO dml_heap_r SELECT ('a')::int, dml_heap_r.b,10 FR...
                                       ^
SELECT COUNT(*) FROM dml_heap_r;
 count 
-------
   113
(1 row)

--Negative test case. INSERT has more expressions than target columns
SELECT COUNT(*) FROM dml_heap_s;
 count 
-------
   113
(1 row)

SELECT COUNT(*) FROM (SELECT COUNT(*) as a, dml_heap_r.* FROM dml_heap_r, dml_heap_s WHERE dml_heap_s.a = dml_heap_r.a GROUP BY dml_heap_r.a, dml_heap_r.b, dml_heap_r.c)foo;
 count 
-------
   110
(1 row)

INSERT INTO dml_heap_s SELECT COUNT(*) as a, dml_heap_r.* FROM dml_heap_r, dml_heap_s WHERE dml_heap_s.a = dml_heap_r.a GROUP BY dml_heap_r.a, dml_heap_r.b, dml_heap_r.c;
ERROR:  INSERT has more expressions than target columns
SELECT COUNT(*) FROM dml_heap_s;
 count 
-------
   113
(1 row)

--Update and generate_series
begin;
SELECT SUM(a) FROM dml_heap_r WHERE a = 1;
 sum 
-----
   3
(1 row)

SELECT COUNT(*) FROM dml_heap_r WHERE c ='n';
 count 
-------
     0
(1 row)

UPDATE dml_heap_r SET a = generate_series(1,10), c ='n';
ERROR:  Cannot parallelize an UPDATE statement that updates the distribution columns
SELECT COUNT(*) FROM dml_heap_r WHERE c ='n';
ERROR:  current transaction is aborted, commands ignored until end of transaction block
SELECT SUM(a) FROM dml_heap_r WHERE a = 1;
ERROR:  current transaction is aborted, commands ignored until end of transaction block
rollback;
--Update distcol where join on target table non dist key
begin;
SELECT SUM(a) FROM dml_heap_r WHERE a = 1;
 sum 
-----
   3
(1 row)

UPDATE dml_heap_r SET a = dml_heap_r.a + 1 FROM dml_heap_s WHERE dml_heap_r.a = dml_heap_s.a;
ERROR:  Cannot parallelize an UPDATE statement that updates the distribution columns
SELECT SUM(a) FROM dml_heap_r WHERE a = 1;
ERROR:  current transaction is aborted, commands ignored until end of transaction block
rollback;
--Update and from values
begin;
SELECT SUM(b) FROM dml_heap_r WHERE b = 20;
 sum 
-----
  20
(1 row)

UPDATE dml_heap_r SET a = v.i + 1 FROM (VALUES(100, 20)) as v(i, j) WHERE dml_heap_r.b = v.j;
ERROR:  Cannot parallelize an UPDATE statement that updates the distribution columns
SELECT SUM(b) FROM dml_heap_r WHERE b = 20;
ERROR:  current transaction is aborted, commands ignored until end of transaction block
rollback;
--Update with Joins and set to constant value
begin;
SELECT COUNT(*) FROM dml_heap_s WHERE b = 10;
 count 
-------
     2
(1 row)

UPDATE dml_heap_s SET b = 10 FROM dml_heap_r WHERE dml_heap_r.b = dml_heap_s.a;
ERROR:  Cannot parallelize an UPDATE statement that updates the distribution columns
SELECT COUNT(*) FROM dml_heap_s WHERE b = 10;
ERROR:  current transaction is aborted, commands ignored until end of transaction block
rollback;
--Update distcol with predicate in subquery
begin;
UPDATE dml_heap_r SET a = dml_heap_r.a + 1 FROM dml_heap_s WHERE dml_heap_r.b = dml_heap_s.a and dml_heap_s.b in (SELECT dml_heap_s.b + dml_heap_r.a FROM dml_heap_s,dml_heap_r WHERE dml_heap_r.a > 10);
ERROR:  Cannot parallelize an UPDATE statement that updates the distribution columns
rollback;
--Update with aggregate in subquery
begin;
SELECT COUNT(*) FROM dml_heap_s WHERE b = (SELECT COUNT(*) FROM dml_heap_s);
 count 
-------
     0
(1 row)

UPDATE dml_heap_s SET b = (SELECT COUNT(*) FROM dml_heap_s) FROM dml_heap_r WHERE dml_heap_r.a = dml_heap_s.b;
ERROR:  Cannot parallelize an UPDATE statement that updates the distribution columns
SELECT COUNT(*) FROM dml_heap_s WHERE b = (SELECT COUNT(*) FROM dml_heap_s);
ERROR:  current transaction is aborted, commands ignored until end of transaction block
rollback;
--Update and limit in subquery
begin;
SELECT COUNT(*) FROM dml_heap_r WHERE a = 1;
 count 
-------
     3
(1 row)

UPDATE dml_heap_r SET a = (SELECT DISTINCT(b) FROM dml_heap_s ORDER BY 1 LIMIT 1) FROM dml_heap_s WHERE dml_heap_r.b = dml_heap_s.a;
ERROR:  Cannot parallelize an UPDATE statement that updates the distribution columns
SELECT COUNT(*) FROM dml_heap_r WHERE a = 1;
ERROR:  current transaction is aborted, commands ignored until end of transaction block
rollback;
--Update multiple columns
begin;
SELECT COUNT(*) FROM dml_heap_r WHERE b is NULL;
 count 
-------
    12
(1 row)

SELECT dml_heap_s.a + 10 FROM dml_heap_r,dml_heap_s WHERE dml_heap_r.a = dml_heap_s.a ORDER BY 1 LIMIT 1;
 ?column? 
----------
       11
(1 row)

SELECT SUM(a) FROM dml_heap_r WHERE a = 1;
 sum 
-----
   3
(1 row)

UPDATE dml_heap_r SET a = dml_heap_s.a + 10 ,b = NULL FROM dml_heap_s WHERE dml_heap_r.a = dml_heap_s.a;
ERROR:  Cannot parallelize an UPDATE statement that updates the distribution columns
SELECT SUM(a) FROM dml_heap_r WHERE a = 1;
ERROR:  current transaction is aborted, commands ignored until end of transaction block
SELECT COUNT(*) FROM dml_heap_r WHERE b is NULL;
ERROR:  current transaction is aborted, commands ignored until end of transaction block
rollback;
--Update multiple columns
begin;
SELECT COUNT(*) FROM dml_heap_r WHERE c='z';
 count 
-------
     0
(1 row)

SELECT dml_heap_s.a ,dml_heap_s.b,'z' FROM dml_heap_r,dml_heap_s WHERE dml_heap_r.a = dml_heap_s.b ORDER BY 1,2 LIMIT 1;
 a | b | ?column? 
---+---+----------
 1 | 1 | z
(1 row)

UPDATE dml_heap_r SET (a,b,c) = (dml_heap_s.a ,dml_heap_s.b,'z') FROM dml_heap_s WHERE dml_heap_r.a = dml_heap_s.b;
ERROR:  Cannot parallelize an UPDATE statement that updates the distribution columns
SELECT * FROM dml_heap_r WHERE c='z' ORDER BY 1 LIMIT 1;
ERROR:  current transaction is aborted, commands ignored until end of transaction block
SELECT COUNT(*) FROM dml_heap_r WHERE c='z';
ERROR:  current transaction is aborted, commands ignored until end of transaction block
rollback;
--Update with prepare plans
begin;
PREPARE plan_upd_2 as UPDATE dml_heap_r SET a = dml_heap_s.a +1 FROM dml_heap_s WHERE dml_heap_r.a = dml_heap_s.b ;
ERROR:  Cannot parallelize an UPDATE statement that updates the distribution columns
EXECUTE plan_upd_2;
ERROR:  current transaction is aborted, commands ignored until end of transaction block
rollback;
--Update and case
begin;
SELECT COUNT(*) FROM dml_heap_r WHERE a = 100 ;
 count 
-------
     1
(1 row)

UPDATE dml_heap_r SET a = (SELECT case when c = 'r' then MAX(b) else 100 end FROM dml_heap_r GROUP BY c ORDER BY 1 LIMIT 1) ;
ERROR:  Cannot parallelize an UPDATE statement that updates the distribution columns
SELECT COUNT(*) FROM dml_heap_r WHERE a = 100 ;
ERROR:  current transaction is aborted, commands ignored until end of transaction block
rollback;
--Negative test - Update with sub-query returning more than one row
SELECT SUM(a) FROM dml_heap_r;
 sum  
------
 5106
(1 row)

UPDATE dml_heap_r SET a = ( SELECT DISTINCT(b) FROM dml_heap_s ) FROM dml_heap_s WHERE dml_heap_r.b = dml_heap_s.a;
ERROR:  Cannot parallelize an UPDATE statement that updates the distribution columns
SELECT SUM(a) FROM dml_heap_r;
 sum  
------
 5106
(1 row)

--Negative test - Update with sub-query returning more than one row
SELECT SUM(b) FROM dml_heap_r;
 sum  
------
 5050
(1 row)

UPDATE dml_heap_r SET b = (SELECT dml_heap_r.b FROM dml_heap_r,dml_heap_s WHERE dml_heap_r.a = dml_heap_s.a );
ERROR:  more than one row returned by a subquery used as an expression
SELECT SUM(b) FROM dml_heap_r;
 sum  
------
 5050
(1 row)

--Negative test - Update with aggregates 
SELECT SUM(b) FROM dml_heap_r;
 sum  
------
 5050
(1 row)

UPDATE dml_heap_r SET b = MAX(dml_heap_s.b) FROM dml_heap_s WHERE dml_heap_r.b = dml_heap_s.a;
ERROR:  cannot use aggregate function in UPDATE
LINE 1: UPDATE dml_heap_r SET b = MAX(dml_heap_s.b) FROM dml_heap_s ...
                                  ^
SELECT SUM(b) FROM dml_heap_r;
 sum  
------
 5050
(1 row)

--Negative test - Update WHERE join returns more than one tuple with different values.
CREATE TABLE dml_heap_u as SELECT i as a, 1 as b  FROM generate_series(1,10)i;
CREATE TABLE dml_heap_v as SELECT i as a ,i as b FROM generate_series(1,10)i;
SELECT SUM(a) FROM dml_heap_v;
 sum 
-----
  55
(1 row)

UPDATE dml_heap_v SET a = dml_heap_u.a FROM dml_heap_u WHERE dml_heap_u.b = dml_heap_v.b;
ERROR:  Cannot parallelize an UPDATE statement that updates the distribution columns
SELECT SUM(a) FROM dml_heap_v;
 sum 
-----
  55
(1 row)

--Update with joins on multiple table
UPDATE dml_heap_r SET a = dml_heap_r.b+1 FROM dml_heap_p,dml_heap_s WHERE dml_heap_r.b = dml_heap_s.b and dml_heap_r.a = dml_heap_p.b+1;
ERROR:  Cannot parallelize an UPDATE statement that updates the distribution columns
--Update on table with composite distribution key
UPDATE dml_heap_p SET a = dml_heap_p.b % 2 FROM dml_heap_r WHERE dml_heap_p.b::int = dml_heap_r.b::int and dml_heap_p.a = dml_heap_r.a;
ERROR:  Cannot parallelize an UPDATE statement that updates the distribution columns
--Update on table with composite distribution key
UPDATE dml_heap_p SET b = (dml_heap_p.b * 1.1)::int FROM dml_heap_r WHERE dml_heap_p.b = dml_heap_r.a and dml_heap_p.b = dml_heap_r.b;
ERROR:  Cannot parallelize an UPDATE statement that updates the distribution columns
