create schema qp_dml_oids;
set search_path='qp_dml_oids';
DROP TABLE IF EXISTS dml_ao;
NOTICE:  table "dml_ao" does not exist, skipping
-- Create a table with OIDS, with a few rows
--
-- GPDB doesn't guarantee that OIDs on a user table are unique across nodes. So to
-- make sure that the OIDs are unique in this test, all the rows have the same
-- distribution key.
CREATE TABLE dml_ao (a int , b int default -1, c text) WITH (appendonly = true, oids = true) DISTRIBUTED BY (a);
NOTICE:  OIDS=TRUE is not recommended for user-created tables. Use OIDS=FALSE to prevent wrap-around of the OID counter
INSERT INTO dml_ao VALUES(1, 1, 'r');
INSERT INTO dml_ao VALUES(1, 2, 'r');
INSERT INTO dml_ao VALUES(1,NULL,NULL);
--
-- Check that UPDATE doesn't change the OIDs of existing rows.
--
DROP TABLE IF EXISTS tempoid;
NOTICE:  table "tempoid" does not exist, skipping
CREATE TABLE tempoid as SELECT oid,a FROM dml_ao ORDER BY 1;
NOTICE:  Table doesn't have 'DISTRIBUTED BY' clause. Creating a NULL policy entry.
UPDATE dml_ao SET a = 100;
select count(distinct oid) from (select oid from tempoid UNION ALL select oid from dml_ao) as x;
 count 
-------
     3
(1 row)

-- Repeat the test a few times, just to make sure that at least one of these
-- UPDATEs moved the tuples across segments. To make sure that that doesn't
-- change the OIDs either.
UPDATE dml_ao SET a = 101;
select count(distinct oid) from (select oid from tempoid UNION ALL select oid from dml_ao) as x;
 count 
-------
     3
(1 row)

UPDATE dml_ao SET a = 102;
select count(distinct oid) from (select oid from tempoid UNION ALL select oid from dml_ao) as x;
 count 
-------
     3
(1 row)

DROP TABLE IF EXISTS dml_heap_check_r;
NOTICE:  table "dml_heap_check_r" does not exist, skipping
CREATE TABLE dml_heap_check_r (
	a int default 100 CHECK( a between 1 and 105), 
	b float8 CONSTRAINT rcheck_b CHECK( b <> 0.00 and b IS NOT NULL),
	c text, 
	d numeric NOT NULL) 
WITH OIDS DISTRIBUTED BY (a);
NOTICE:  OIDS=TRUE is not recommended for user-created tables. Use OIDS=FALSE to prevent wrap-around of the OID counter
--
-- DML on table with constraints and OIDS(Negative Test)
--
INSERT INTO dml_heap_check_r SELECT i, i ,'r', i FROM generate_series(1,2)i;
SELECT SUM(a),SUM(b) FROM dml_heap_check_r;
 sum | sum 
-----+-----
   3 |   3
(1 row)

SELECT COUNT(*) FROM dml_heap_check_r;
 count 
-------
     2
(1 row)

INSERT INTO dml_heap_check_r VALUES(DEFAULT,DEFAULT,'rn',0);
ERROR:  new row for relation "dml_heap_check_r" violates check constraint "rcheck_b"
SELECT SUM(a),SUM(b) FROM dml_heap_check_r;
 sum | sum 
-----+-----
   3 |   3
(1 row)

SELECT COUNT(*) FROM dml_heap_check_r;
 count 
-------
     2
(1 row)

INSERT INTO dml_heap_check_r VALUES(110,NULL,'rn',0);
ERROR:  new row for relation "dml_heap_check_r" violates check constraint "rcheck_b"
SELECT SUM(a),SUM(b) FROM dml_heap_check_r;
 sum | sum 
-----+-----
   3 |   3
(1 row)

SELECT COUNT(*) FROM dml_heap_check_r;
 count 
-------
     2
(1 row)

SELECT SUM(a) FROM dml_heap_check_r;
 sum 
-----
   3
(1 row)

DROP TABLE IF EXISTS tempoid;
CREATE TABLE tempoid as SELECT oid,a FROM dml_heap_check_r DISTRIBUTED BY (a);
UPDATE dml_heap_check_r set a = 110;
ERROR:  new row for relation "dml_heap_check_r" violates check constraint "dml_heap_check_r_a_check"
SELECT SUM(a) FROM dml_heap_check_r;
 sum 
-----
   3
(1 row)

-- THIS SQL CONFIRMS THAT POST UPDATE THE OID OF THE TUPLE REMAINS THE SAME
SELECT * FROM ( (SELECT COUNT(*) FROM dml_heap_check_r) UNION (SELECT COUNT(*) FROM tempoid, dml_heap_check_r WHERE tempoid.oid = dml_heap_check_r.oid AND tempoid.gp_segment_id = dml_heap_check_r.gp_segment_id))foo;
 count 
-------
     2
(1 row)

DROP TABLE IF EXISTS dml_heap_r;
CREATE TABLE dml_heap_r (a int , b int default -1, c text) WITH OIDS DISTRIBUTED BY (a);
NOTICE:  OIDS=TRUE is not recommended for user-created tables. Use OIDS=FALSE to prevent wrap-around of the OID counter
INSERT INTO dml_heap_r VALUES(generate_series(1,2),generate_series(1,2),'r');
INSERT INTO dml_heap_r VALUES(NULL,NULL,NULL);
SELECT COUNT(*) FROM dml_heap_r;
 count 
-------
     3
(1 row)

--
-- DELETE on table with OIDS
--
SELECT SUM(a) FROM dml_heap_r;
 sum 
-----
   3
(1 row)

DROP TABLE IF EXISTS tempoid;
CREATE TABLE tempoid as SELECT oid,a FROM dml_heap_r DISTRIBUTED BY (a);
NOTICE:  Table doesn't have 'DISTRIBUTED BY' clause -- Using column(s) named 'a' as the Greenplum Database data distribution key for this table.
HINT:  The 'DISTRIBUTED BY' clause determines the distribution of data. Make sure column(s) chosen are the optimal data distribution key to minimize skew.
DELETE FROM dml_heap_r WHERE a is NULL;
SELECT SUM(a) FROM dml_heap_r;
 sum 
-----
   3
(1 row)

SELECT * FROM ( (SELECT COUNT(*) FROM dml_heap_r) UNION (SELECT COUNT(*) FROM tempoid, dml_heap_r WHERE tempoid.oid = dml_heap_r.oid AND tempoid.gp_segment_id = dml_heap_r.gp_segment_id AND tempoid.a is NOT NULL))foo;
 count 
-------
     2
(1 row)

DROP TABLE IF EXISTS dml_heap_r;
CREATE TABLE dml_heap_r (col1 serial, a int , b int default -1, c text) WITH OIDS DISTRIBUTED BY (a);
NOTICE:  CREATE TABLE will create implicit sequence "dml_heap_r_col1_seq" for serial column "dml_heap_r.col1"
NOTICE:  OIDS=TRUE is not recommended for user-created tables. Use OIDS=FALSE to prevent wrap-around of the OID counter
INSERT INTO dml_heap_r(a,b,c) VALUES(generate_series(1,2),generate_series(1,2),'r');
INSERT INTO dml_heap_r(a,b,c) VALUES(NULL,NULL,NULL);
SELECT COUNT(*) FROM dml_heap_r;
 count 
-------
     3
(1 row)

--
-- UPDATE to constant value on table with OIDS
--
SELECT SUM(a) FROM dml_heap_r;
 sum 
-----
   3
(1 row)

DROP TABLE IF EXISTS tempoid;
NOTICE:  table "tempoid" does not exist, skipping
CREATE TABLE tempoid as SELECT oid,col1,a FROM dml_heap_r ORDER BY 1;
NOTICE:  Table doesn't have 'DISTRIBUTED BY' clause -- Using column(s) named 'a' as the Greenplum Database data distribution key for this table.
HINT:  The 'DISTRIBUTED BY' clause determines the distribution of data. Make sure column(s) chosen are the optimal data distribution key to minimize skew.
UPDATE dml_heap_r SET a = 1;
SELECT SUM(a) FROM dml_heap_r;
 sum 
-----
   3
(1 row)

-- The query checks that the tuple oids remain the remain pre and post update .
-- SELECT COUNT(*) FROM tempoid, dml_heap_r WHERE tempoid.oid = dml_heap_r.oid AND tempoid.col1 = dml_heap_r.col1 is a join on the tuple oids before update and after update. If the oids remain the same the below query should return 1 row which is equivalent to the number of rows in the table
SELECT * FROM ( (SELECT COUNT(*) FROM dml_heap_r) UNION (SELECT COUNT(*) FROM tempoid, dml_heap_r WHERE tempoid.oid = dml_heap_r.oid AND tempoid.col1 = dml_heap_r.col1))foo;
 count 
-------
     3
(1 row)

DROP TABLE IF EXISTS dml_heap_r;
DROP TABLE IF EXISTS dml_heap_p;
CREATE TABLE dml_heap_r (a int , b int default -1, c text) WITH OIDS DISTRIBUTED BY (a);
NOTICE:  OIDS=TRUE is not recommended for user-created tables. Use OIDS=FALSE to prevent wrap-around of the OID counter
CREATE TABLE dml_heap_p (col1 serial, a numeric, b decimal) WITH OIDS DISTRIBUTED BY (a,b);
NOTICE:  CREATE TABLE will create implicit sequence "dml_heap_p_col1_seq" for serial column "dml_heap_p.col1"
NOTICE:  OIDS=TRUE is not recommended for user-created tables. Use OIDS=FALSE to prevent wrap-around of the OID counter
INSERT INTO dml_heap_p(a,b) SELECT id as a, id as b FROM (SELECT * FROM generate_series(1,2) as id) AS x;
INSERT INTO dml_heap_p(a,b) VALUES(NULL,NULL);
INSERT INTO dml_heap_r VALUES(generate_series(1,2),generate_series(1,2),'r');
INSERT INTO dml_heap_r VALUES(NULL,NULL,NULL);
SELECT COUNT(*) FROM dml_heap_r;
 count 
-------
     3
(1 row)

SELECT COUNT(*) FROM dml_heap_p;
 count 
-------
     3
(1 row)

--
-- UPDATE with SELECT on table with OIDS
--
SELECT SUM(a), SUM(b) FROM dml_heap_p;
 sum | sum 
-----+-----
   3 |   3
(1 row)

DROP TABLE IF EXISTS tempoid;
NOTICE:  table "tempoid" does not exist, skipping
CREATE TABLE tempoid as SELECT oid,col1,a,b FROM dml_heap_p ORDER BY 1;
NOTICE:  Table doesn't have 'DISTRIBUTED BY' clause -- Using column(s) named 'a, b' as the Greenplum Database data distribution key for this table.
HINT:  The 'DISTRIBUTED BY' clause determines the distribution of data. Make sure column(s) chosen are the optimal data distribution key to minimize skew.
UPDATE dml_heap_p SET a = (SELECT a FROM dml_heap_r ORDER BY 1 LIMIT 1), b = ((SELECT b FROM dml_heap_r ORDER BY 1 LIMIT 1));
-- The query checks that the tuple oids remain the remain pre and post update .
-- SELECT COUNT(*) FROM tempoid, dml_heap_r WHERE tempoid.oid = dml_heap_r.oid AND tempoid.col1 = dml_heap_r.col1 is a join on the tuple oids before update and after update. If the oids remain the same the below query should return 1 row which is equivalent to the number of rows in the table
SELECT * FROM ( (SELECT COUNT(*) FROM dml_heap_p) UNION (SELECT COUNT(*) FROM tempoid, dml_heap_p WHERE tempoid.oid = dml_heap_p.oid AND tempoid.col1 = dml_heap_p.col1))foo;
 count 
-------
     3
(1 row)

SELECT SUM(a), SUM(b) FROM dml_heap_p;
 sum | sum 
-----+-----
   3 |   3
(1 row)

DROP TABLE IF EXISTS dml_heap_r;
DROP TABLE IF EXISTS dml_heap_p;
CREATE TABLE dml_heap_r (col1 serial,a int , b int default -1, c text) WITH OIDS DISTRIBUTED BY (a);
NOTICE:  CREATE TABLE will create implicit sequence "dml_heap_r_col1_seq" for serial column "dml_heap_r.col1"
NOTICE:  OIDS=TRUE is not recommended for user-created tables. Use OIDS=FALSE to prevent wrap-around of the OID counter
CREATE TABLE dml_heap_p (col1 serial, a numeric, b decimal) WITH OIDS DISTRIBUTED BY (a,b);
NOTICE:  CREATE TABLE will create implicit sequence "dml_heap_p_col1_seq" for serial column "dml_heap_p.col1"
NOTICE:  OIDS=TRUE is not recommended for user-created tables. Use OIDS=FALSE to prevent wrap-around of the OID counter
INSERT INTO dml_heap_p(a,b) SELECT id as a, id as b FROM (SELECT * FROM generate_series(1,2) as id) AS x;
INSERT INTO dml_heap_p(a,b) VALUES(NULL,NULL);
INSERT INTO dml_heap_r(a,b,c) VALUES(generate_series(1,2),generate_series(1,2),'r');
INSERT INTO dml_heap_r(a,b,c) VALUES(NULL,NULL,NULL);
SELECT COUNT(*) FROM dml_heap_r;
 count 
-------
     3
(1 row)

SELECT COUNT(*) FROM dml_heap_p;
 count 
-------
     3
(1 row)

--
-- UPDATE with joins on table with OIDS
--
SELECT SUM(a) FROM dml_heap_r;
 sum 
-----
   3
(1 row)

DROP TABLE IF EXISTS tempoid;
NOTICE:  table "tempoid" does not exist, skipping
CREATE TABLE tempoid as SELECT oid,col1,a FROM dml_heap_r ORDER BY 1;
NOTICE:  Table doesn't have 'DISTRIBUTED BY' clause -- Using column(s) named 'a' as the Greenplum Database data distribution key for this table.
HINT:  The 'DISTRIBUTED BY' clause determines the distribution of data. Make sure column(s) chosen are the optimal data distribution key to minimize skew.
SELECT SUM(dml_heap_r.a) FROM dml_heap_p, dml_heap_r WHERE dml_heap_r.b = dml_heap_p.a;
 sum 
-----
   3
(1 row)

UPDATE dml_heap_r SET a = dml_heap_r.a FROM dml_heap_p WHERE dml_heap_r.b = dml_heap_p.a;
-- The query checks that the tuple oids remain the remain pre and post update .
-- SELECT COUNT(*) FROM tempoid, dml_heap_r WHERE tempoid.oid = dml_heap_r.oid AND tempoid.col1 = dml_heap_r.col1 is a join on the tuple oids before update and after update. If the oids remain the same the below query should return 1 row which is equivalent to the number of rows in the table
SELECT * FROM ( (SELECT COUNT(*) FROM dml_heap_r) UNION (SELECT COUNT(*) FROM tempoid, dml_heap_r WHERE tempoid.oid = dml_heap_r.oid AND tempoid.col1 = dml_heap_r.col1))foo;
 count 
-------
     3
(1 row)

SELECT SUM(a) FROM dml_heap_r;
 sum 
-----
   3
(1 row)

--
-- Check that a row gets a new OID, even when inserting an otherwise identical row
-- to it (see commit 3d02cae310).
--
-- Note: GPDB doesn't guarantee OIDS to be unique across segments! So if you change
-- this to DISTRIBUTED RANDOMLY, it can fail.
--
create table dml_heap_with_oids(id int4) with oids distributed by (id);
NOTICE:  OIDS=TRUE is not recommended for user-created tables. Use OIDS=FALSE to prevent wrap-around of the OID counter
insert into dml_heap_with_oids values (1);
insert into dml_heap_with_oids select * from dml_heap_with_oids;
insert into dml_heap_with_oids select * from dml_heap_with_oids;
select count(*), count(distinct oid) from dml_heap_with_oids;
 count | count 
-------+-------
     4 |     4
(1 row)

--
-- Check that a tuple gets an OID, even if it's toasted (there used to
-- be a bug, where toasting a tuple cleared its just-assigned OID)
--
INSERT INTO dml_ao (a, b, c) VALUES (10, 1, repeat('x', 50000));
INSERT INTO dml_ao (a, b, c) VALUES (10, 2, repeat('x', 50000));
SELECT COUNT(distinct oid) FROM dml_ao where a = 10;
 count 
-------
     2
(1 row)

--
-- Check that new OIDs are generated even if the tuple being inserted came from
-- the same relation and segment.
--
INSERT INTO dml_ao VALUES (11, 1, 'foo');
INSERT INTO dml_ao VALUES (11, 2, 'bar');
INSERT INTO dml_ao SELECT * FROM dml_ao WHERE a = 11 LIMIT 1;
SELECT COUNT(DISTINCT oid) FROM dml_ao WHERE a = 11; -- all three rows should have different OID
 count 
-------
     3
(1 row)

