-- Test the optimizer_enable_dml_constraints GUC, which forces GPORCA to fall back when there
-- are NULL or CHECK constraints on a table.
set optimizer_trace_fallback = on;
DROP TABLE IF EXISTS constr_tab;
NOTICE:  table "constr_tab" does not exist, skipping
CREATE TABLE constr_tab ( a int check (a>0) , b int, c int, d int, CHECK (a+b>5)) DISTRIBUTED BY (a);
set optimizer_enable_dml_constraints = off;
explain insert into constr_tab values (1,2,3);
INFO:  GPORCA failed to produce a plan, falling back to planner
DETAIL:  Feature not supported: INSERT with constraints
                       QUERY PLAN                       
--------------------------------------------------------
 Insert on constr_tab  (cost=0.00..0.01 rows=1 width=0)
   ->  Result  (cost=0.00..0.01 rows=1 width=0)
 Optimizer: Postgres query optimizer
(3 rows)

set optimizer_enable_dml_constraints=on;
explain insert into constr_tab values (1,2,3);
                         QUERY PLAN                         
------------------------------------------------------------
 Insert on constr_tab  (cost=0.00..0.03 rows=1 width=12)
   ->  Result  (cost=0.00..0.00 rows=1 width=20)
         ->  Result  (cost=0.00..0.00 rows=1 width=16)
               ->  Result  (cost=0.00..0.00 rows=1 width=1)
 Optimizer: Pivotal Optimizer (GPORCA) version 3.83.0
(5 rows)

-- The remaining tests require a row in the table.
INSERT INTO constr_tab VALUES(1,5,3,4);
set optimizer_enable_dml_constraints=off;
explain update constr_tab set a = 10;
INFO:  GPORCA failed to produce a plan, falling back to planner
DETAIL:  Feature not supported: UPDATE with constraints
                                            QUERY PLAN                                            
--------------------------------------------------------------------------------------------------
 Update on constr_tab  (cost=0.00..1.03 rows=1 width=22)
   ->  Explicit Redistribute Motion 3:3  (slice1; segments: 3)  (cost=0.00..1.03 rows=1 width=22)
         ->  Split  (cost=0.00..1.03 rows=1 width=22)
               ->  Seq Scan on constr_tab  (cost=0.00..1.01 rows=1 width=22)
 Optimizer: Postgres query optimizer
(5 rows)

explain update constr_tab set b = 10;
INFO:  GPORCA failed to produce a plan, falling back to planner
DETAIL:  Feature not supported: UPDATE with constraints
                           QUERY PLAN                            
-----------------------------------------------------------------
 Update on constr_tab  (cost=0.00..1.01 rows=1 width=22)
   ->  Seq Scan on constr_tab  (cost=0.00..1.01 rows=1 width=22)
 Optimizer: Postgres query optimizer
(3 rows)

set optimizer_enable_dml_constraints=on;
explain update constr_tab set b = 10;
                                         QUERY PLAN                                         
--------------------------------------------------------------------------------------------
 Update on constr_tab  (cost=0.00..431.09 rows=1 width=1)
   ->  Result  (cost=0.00..431.00 rows=1 width=34)
         ->  Split  (cost=0.00..431.00 rows=1 width=30)
               ->  Seq Scan on constr_tab constr_tab_1  (cost=0.00..431.00 rows=1 width=26)
 Optimizer: Pivotal Optimizer (GPORCA) version 3.83.0
(5 rows)

-- Same, with NOT NULL constraint.
DROP TABLE IF EXISTS constr_tab;
CREATE TABLE constr_tab ( a int NOT NULL, b int, c int, d int, CHECK (a+b>5)) DISTRIBUTED BY (a);
INSERT INTO constr_tab VALUES(1,5,3,4);
set optimizer_enable_dml_constraints=off;
explain update constr_tab set a = 10;
INFO:  GPORCA failed to produce a plan, falling back to planner
DETAIL:  Feature not supported: UPDATE with constraints
                                            QUERY PLAN                                            
--------------------------------------------------------------------------------------------------
 Update on constr_tab  (cost=0.00..1.03 rows=1 width=22)
   ->  Explicit Redistribute Motion 3:3  (slice1; segments: 3)  (cost=0.00..1.03 rows=1 width=22)
         ->  Split  (cost=0.00..1.03 rows=1 width=22)
               ->  Seq Scan on constr_tab  (cost=0.00..1.01 rows=1 width=22)
 Optimizer: Postgres query optimizer
(5 rows)

DROP TABLE IF EXISTS constr_tab;
CREATE TABLE constr_tab ( a int NOT NULL, b int NOT NULL, c int NOT NULL, d int NOT NULL) DISTRIBUTED BY (a,b);
INSERT INTO constr_tab VALUES(1,5,3,4);
INFO:  GPORCA failed to produce a plan, falling back to planner
DETAIL:  Feature not supported: INSERT with constraints
INSERT INTO constr_tab VALUES(1,5,3,4);
INFO:  GPORCA failed to produce a plan, falling back to planner
DETAIL:  Feature not supported: INSERT with constraints
set optimizer_enable_dml_constraints=off;
explain update constr_tab set b = 10;
INFO:  GPORCA failed to produce a plan, falling back to planner
DETAIL:  Feature not supported: UPDATE with constraints
                                            QUERY PLAN                                            
--------------------------------------------------------------------------------------------------
 Update on constr_tab  (cost=0.00..1.03 rows=1 width=22)
   ->  Explicit Redistribute Motion 3:3  (slice1; segments: 3)  (cost=0.00..1.03 rows=1 width=22)
         ->  Split  (cost=0.00..1.03 rows=1 width=22)
               ->  Seq Scan on constr_tab  (cost=0.00..1.01 rows=1 width=22)
 Optimizer: Postgres query optimizer
(5 rows)

DROP TABLE IF EXISTS constr_tab;
CREATE TABLE constr_tab ( a int, b int, c int, d int) DISTRIBUTED BY (a);
INSERT INTO constr_tab VALUES(1,5,3,4);
INSERT INTO constr_tab VALUES(1,5,3,4);
set optimizer_enable_dml_constraints=off;
explain update constr_tab set a = 10;
                                            QUERY PLAN                                            
--------------------------------------------------------------------------------------------------
 Update on constr_tab  (cost=0.00..431.09 rows=1 width=1)
   ->  Result  (cost=0.00..431.00 rows=1 width=34)
         ->  Redistribute Motion 3:3  (slice1; segments: 3)  (cost=0.00..431.00 rows=1 width=30)
               Hash Key: constr_tab_1.a
               ->  Split  (cost=0.00..431.00 rows=1 width=30)
                     ->  Seq Scan on constr_tab constr_tab_1  (cost=0.00..431.00 rows=1 width=26)
 Optimizer: Pivotal Optimizer (GPORCA) version 3.83.0
(7 rows)

-- Test ORCA fallback on "FROM ONLY"
CREATE TABLE homer (a int, b int, c int)
DISTRIBUTED BY (a)
PARTITION BY range(b)
    SUBPARTITION BY range(c)
        SUBPARTITION TEMPLATE (
            START(40) END(46) EVERY(3)
        )
(START(0) END(4) EVERY(2));
INSERT INTO homer VALUES (1,0,40),(2,1,43),(3,2,41),(4,3,44);
INFO:  GPORCA failed to produce a plan, falling back to planner
DETAIL:  DXL-to-PlStmt Translation: PartitionSelector not supported
SELECT * FROM ONLY homer;
INFO:  GPORCA failed to produce a plan, falling back to planner
DETAIL:  Feature not supported: ONLY in the FROM clause
 a | b | c 
---+---+---
(0 rows)

SELECT * FROM ONLY homer_1_prt_1;
INFO:  GPORCA failed to produce a plan, falling back to planner
DETAIL:  Feature not supported: ONLY in the FROM clause
 a | b | c 
---+---+---
(0 rows)

UPDATE ONLY homer SET c = c + 1;
INFO:  GPORCA failed to produce a plan, falling back to planner
DETAIL:  Feature not supported: ONLY in the FROM clause
SELECT * FROM homer;
INFO:  GPORCA failed to produce a plan, falling back to planner
DETAIL:  DXL-to-PlStmt Translation: multi-level partitioned tables not supported
 a | b | c  
---+---+----
 1 | 0 | 40
 2 | 1 | 43
 3 | 2 | 41
 4 | 3 | 44
(4 rows)

DELETE FROM ONLY homer WHERE a = 3;
INFO:  GPORCA failed to produce a plan, falling back to planner
DETAIL:  Feature not supported: ONLY in the FROM clause
SELECT * FROM homer;
INFO:  GPORCA failed to produce a plan, falling back to planner
DETAIL:  DXL-to-PlStmt Translation: multi-level partitioned tables not supported
 a | b | c  
---+---+----
 1 | 0 | 40
 2 | 1 | 43
 3 | 2 | 41
 4 | 3 | 44
(4 rows)

-- ORCA should not fallback just because external tables are in FROM clause
-- start_ignore
CREATE TABLE heap_t1 (a int, b int) DISTRIBUTED BY (b);
CREATE EXTERNAL TABLE ext_table_no_fallback (a int, b int) LOCATION ('gpfdist://myhost:8080/test.csv') FORMAT 'CSV';
-- end_ignore
EXPLAIN SELECT * FROM ext_table_no_fallback;
                                      QUERY PLAN                                      
--------------------------------------------------------------------------------------
 Gather Motion 3:1  (slice1; segments: 3)  (cost=0.00..467.24 rows=1000000 width=8)
   ->  Foreign Scan on ext_table_no_fallback  (cost=0.00..432.47 rows=333334 width=8)
 Optimizer: Pivotal Optimizer (GPORCA) version 3.88.0
(3 rows)

EXPLAIN SELECT * FROM ONLY ext_table_no_fallback;
INFO:  GPORCA failed to produce a plan, falling back to planner
DETAIL:  Feature not supported: ONLY in the FROM clause
                                       QUERY PLAN                                       
----------------------------------------------------------------------------------------
 Gather Motion 3:1  (slice1; segments: 3)  (cost=0.00..31000.00 rows=1000000 width=8)
   ->  Foreign Scan on ext_table_no_fallback  (cost=0.00..11000.00 rows=333334 width=8)
 Optimizer: Postgres query optimizer
(3 rows)

EXPLAIN INSERT INTO heap_t1 SELECT * FROM ONLY ext_table_no_fallback;
INFO:  GPORCA failed to produce a plan, falling back to planner
DETAIL:  Feature not supported: ONLY in the FROM clause
                                           QUERY PLAN                                            
-------------------------------------------------------------------------------------------------
 Insert on heap_t1  (cost=0.00..31000.00 rows=333334 width=8)
   ->  Redistribute Motion 3:3  (slice1; segments: 3)  (cost=0.00..31000.00 rows=333334 width=8)
         Hash Key: ext_table_no_fallback.b
         ->  Foreign Scan on ext_table_no_fallback  (cost=0.00..11000.00 rows=333334 width=8)
 Optimizer: Postgres query optimizer
(5 rows)

set optimizer_enable_dml=off;
EXPLAIN INSERT INTO homer VALUES (1,0,40),(2,1,43),(3,2,41),(4,3,44);
INFO:  GPORCA failed to produce a plan, falling back to planner
DETAIL:  Feature not supported: DML not enabled
                                       QUERY PLAN                                        
-----------------------------------------------------------------------------------------
 Insert on homer  (cost=0.00..0.05 rows=2 width=12)
   ->  Redistribute Motion 1:3  (slice1; segments: 1)  (cost=0.00..0.05 rows=4 width=12)
         Hash Key: "*VALUES*".column1
         ->  Values Scan on "*VALUES*"  (cost=0.00..0.05 rows=2 width=12)
 Optimizer: Postgres query optimizer
(5 rows)

EXPLAIN UPDATE ONLY homer SET c = c + 1;
INFO:  GPORCA failed to produce a plan, falling back to planner
DETAIL:  Feature not supported: DML not enabled
                    QUERY PLAN                     
---------------------------------------------------
 Update on homer  (cost=0.00..0.00 rows=0 width=0)
   ->  Result  (cost=0.00..0.00 rows=0 width=22)
         One-Time Filter: false
 Optimizer: Postgres query optimizer
(3 rows)

EXPLAIN DELETE FROM ONLY homer WHERE a = 3;
INFO:  GPORCA failed to produce a plan, falling back to planner
DETAIL:  Feature not supported: DML not enabled
                    QUERY PLAN                     
---------------------------------------------------
 Delete on homer  (cost=0.00..0.00 rows=0 width=0)
   ->  Result  (cost=0.00..0.00 rows=0 width=0)
         One-Time Filter: false
 Optimizer: Postgres query optimizer
(4 rows)

set optimizer_enable_dml=on;
create table foo(a int, b int);
NOTICE:  Table doesn't have 'DISTRIBUTED BY' clause -- Using column named 'a' as the Greenplum Database data distribution key for this table.
HINT:  The 'DISTRIBUTED BY' clause determines the distribution of data. Make sure column(s) chosen are the optimal data distribution key to minimize skew.
insert into foo select i%100, i%100 from generate_series(1,10000)i;
set optimizer_enable_hashagg = on;
set optimizer_enable_groupagg = on;
explain select count(*) from foo group by a;
                                   QUERY PLAN                                   
--------------------------------------------------------------------------------
 Gather Motion 3:1  (slice1; segments: 3)  (cost=0.00..431.50 rows=100 width=8)
   ->  HashAggregate  (cost=0.00..431.50 rows=34 width=8)
         Group Key: a
         ->  Seq Scan on foo  (cost=0.00..431.07 rows=3334 width=4)
 Optimizer: Pivotal Optimizer (GPORCA) version 3.83.0
(5 rows)

set optimizer_enable_hashagg = off;
set optimizer_enable_groupagg = on;
explain select count(*) from foo group by a;
                                   QUERY PLAN                                   
--------------------------------------------------------------------------------
 Gather Motion 3:1  (slice1; segments: 3)  (cost=0.00..432.00 rows=100 width=8)
   ->  GroupAggregate  (cost=0.00..431.99 rows=34 width=8)
         Group Key: a
         ->  Sort  (cost=0.00..431.98 rows=3334 width=4)
               Sort Key: a
               ->  Seq Scan on foo  (cost=0.00..431.07 rows=3334 width=4)
 Optimizer: Pivotal Optimizer (GPORCA) version 3.83.0
(7 rows)

set optimizer_enable_hashagg = off;
set optimizer_enable_groupagg = off;
explain select count(*) from foo group by a;
INFO:  GPORCA failed to produce a plan, falling back to planner
DETAIL:  No plan has been computed for required properties
                                    QUERY PLAN                                     
-----------------------------------------------------------------------------------
 Gather Motion 3:1  (slice1; segments: 3)  (cost=163.00..164.00 rows=100 width=12)
   ->  HashAggregate  (cost=163.00..164.00 rows=34 width=12)
         Group Key: a
         ->  Seq Scan on foo  (cost=0.00..113.00 rows=3334 width=4)
 Optimizer: Postgres query optimizer
(5 rows)

