-- start_ignore
create schema qp_subquery;
set search_path to qp_subquery;
CREATE TABLE SUBSELECT_TBL1 (
  							f1 integer,
							f2 integer,
  							f3 float
						);
NOTICE:  Table doesn't have 'DISTRIBUTED BY' clause -- Using column named 'f1' as the Greenplum Database data distribution key for this table.
HINT:  The 'DISTRIBUTED BY' clause determines the distribution of data. Make sure column(s) chosen are the optimal data distribution key to minimize skew.
		
INSERT INTO SUBSELECT_TBL1 VALUES (1, 2, 3); 
INSERT INTO SUBSELECT_TBL1 VALUES (2, 3, 4); 
INSERT INTO SUBSELECT_TBL1 VALUES (3, 4, 5); 
INSERT INTO SUBSELECT_TBL1 VALUES (1, 1, 1); 
INSERT INTO SUBSELECT_TBL1 VALUES (2, 2, 2); 
INSERT INTO SUBSELECT_TBL1 VALUES (3, 3, 3); 
INSERT INTO SUBSELECT_TBL1 VALUES (6, 7, 8); 
INSERT INTO SUBSELECT_TBL1 VALUES (8, 9, NULL); 
-- end_ignore
SELECT '' AS eight, * FROM SUBSELECT_TBL1 ORDER BY 2,3,4;
 eight | f1 | f2 | f3 
-------+----+----+----
       |  1 |  1 |  1
       |  1 |  2 |  3
       |  2 |  2 |  2
       |  2 |  3 |  4
       |  3 |  3 |  3
       |  3 |  4 |  5
       |  6 |  7 |  8
       |  8 |  9 |   
(8 rows)

                        
SELECT '' AS two, f1 AS "Constant Select" FROM SUBSELECT_TBL1
 					 WHERE f1 IN (SELECT 1) ORDER BY 2;
 two | Constant Select 
-----+-----------------
     |               1
     |               1
(2 rows)

                        
-- order 2
SELECT '' AS six, f1 AS "Uncorrelated Field" FROM SUBSELECT_TBL1
					  WHERE f1 IN (SELECT f2 FROM SUBSELECT_TBL1) ORDER BY 2;
 six | Uncorrelated Field 
-----+--------------------
     |                  1
     |                  1
     |                  2
     |                  2
     |                  3
     |                  3
(6 rows)

                        
-- order 2
SELECT '' AS six, f1 AS "Uncorrelated Field" FROM SUBSELECT_TBL1
				 WHERE f1 IN (SELECT f2 FROM SUBSELECT_TBL1 WHERE
				   f2 IN (SELECT f1 FROM SUBSELECT_TBL1)) ORDER BY 2;
 six | Uncorrelated Field 
-----+--------------------
     |                  1
     |                  1
     |                  2
     |                  2
     |                  3
     |                  3
(6 rows)

                        
-- order 2,3
SELECT '' AS three, f1, f2
  				FROM SUBSELECT_TBL1
  				WHERE (f1, f2) NOT IN (SELECT f2, CAST(f3 AS int4) FROM SUBSELECT_TBL1
                         	WHERE f3 IS NOT NULL) ORDER BY 2,3;
 three | f1 | f2 
-------+----+----
       |  1 |  2
       |  6 |  7
       |  8 |  9
(3 rows)

                        
SELECT 1 AS one WHERE 1 IN (SELECT 1);
 one 
-----
   1
(1 row)

                        
SELECT 1 AS zero WHERE 1 IN (SELECT 2);
 zero 
------
(0 rows)

			 
SELECT 1 AS zero WHERE 1 NOT IN (SELECT 1);
 zero 
------
(0 rows)

                         
SELECT '' AS six, f1 AS "Correlated Field", f2 AS "Second Field"
                                FROM SUBSELECT_TBL1 upper
                                WHERE f1 IN (SELECT f2 FROM SUBSELECT_TBL1 WHERE f1 = upper.f1);
 six | Correlated Field | Second Field 
-----+------------------+--------------
     |                3 |            4
     |                3 |            3
     |                1 |            2
     |                2 |            3
     |                1 |            1
     |                2 |            2
(6 rows)

                         
SELECT '' AS six, f1 AS "Correlated Field", f3 AS "Second Field"
                                FROM SUBSELECT_TBL1 upper
                                WHERE f1 IN
                                (SELECT f2 FROM SUBSELECT_TBL1 WHERE CAST(upper.f2 AS float) = f3);
 six | Correlated Field | Second Field 
-----+------------------+--------------
     |                3 |            5
     |                3 |            3
     |                2 |            4
     |                1 |            1
     |                2 |            2
(5 rows)

                         
SELECT '' AS six, f1 AS "Correlated Field", f3 AS "Second Field"
                                FROM SUBSELECT_TBL1 upper
                                WHERE f3 IN (SELECT upper.f1 + f2 FROM SUBSELECT_TBL1
                                WHERE f2 = CAST(f3 AS integer));
 six | Correlated Field | Second Field 
-----+------------------+--------------
     |                1 |            3
     |                2 |            4
     |                3 |            5
     |                6 |            8
(4 rows)

                         
SELECT '' AS five, f1 AS "Correlated Field"
                                FROM SUBSELECT_TBL1
                                WHERE (f1, f2) IN (SELECT f2, CAST(f3 AS int4) FROM SUBSELECT_TBL1
                                WHERE f3 IS NOT NULL);
 five | Correlated Field 
------+------------------
      |                3
      |                3
      |                2
      |                1
      |                2
(5 rows)

                         
-- start_ignore
create table join_tab1 ( i integer, j integer, t text);
NOTICE:  Table doesn't have 'DISTRIBUTED BY' clause -- Using column named 'i' as the Greenplum Database data distribution key for this table.
HINT:  The 'DISTRIBUTED BY' clause determines the distribution of data. Make sure column(s) chosen are the optimal data distribution key to minimize skew.
INSERT INTO join_tab1 VALUES (1, 4, 'one');
INSERT INTO join_tab1 VALUES (2, 3, 'two');
INSERT INTO join_tab1 VALUES (3, 2, 'three');
INSERT INTO join_tab1 VALUES (4, 1, 'four');
INSERT INTO join_tab1 VALUES (5, 0, 'five');
INSERT INTO join_tab1 VALUES (6, 6, 'six');
INSERT INTO join_tab1  VALUES (7, 7, 'seven');
INSERT INTO join_tab1 VALUES (8, 8, 'eight');
INSERT INTO join_tab1 VALUES (0, NULL, 'zero');
INSERT INTO join_tab1 VALUES (NULL, NULL, 'null');
INSERT INTO join_tab1 VALUES (NULL, 0, 'zero');
-- end_ignore
select * from join_tab1 order by i, t;				
 i | j |   t   
---+---+-------
 0 |   | zero
 1 | 4 | one
 2 | 3 | two
 3 | 2 | three
 4 | 1 | four
 5 | 0 | five
 6 | 6 | six
 7 | 7 | seven
 8 | 8 | eight
   |   | null
   | 0 | zero
(11 rows)

                         
-- start_ignore
create table join_tab2 ( i integer, k integer);
NOTICE:  Table doesn't have 'DISTRIBUTED BY' clause -- Using column named 'i' as the Greenplum Database data distribution key for this table.
HINT:  The 'DISTRIBUTED BY' clause determines the distribution of data. Make sure column(s) chosen are the optimal data distribution key to minimize skew.
INSERT INTO join_tab2 VALUES (1, -1);
INSERT INTO join_tab2 VALUES (2, 2);
INSERT INTO join_tab2 VALUES (3, -3);
INSERT INTO join_tab2 VALUES (2, 4);
INSERT INTO join_tab2 VALUES (5, -5);
INSERT INTO join_tab2 VALUES (5, -5);
INSERT INTO join_tab2 VALUES (0, NULL);
INSERT INTO join_tab2 VALUES (NULL, NULL);
INSERT INTO join_tab2 VALUES (NULL, 0);
-- end_ignore
select * from join_tab2; 
 i | k  
---+----
 3 | -3
 5 | -5
 5 | -5
   |   
   |  0
 1 | -1
 2 |  2
 2 |  4
 0 |   
(9 rows)

                         
select * from ( SELECT '' AS "col", * FROM join_tab1 AS tx)A;
 col | i | j |   t   
-----+---+---+-------
     | 8 | 8 | eight
     | 3 | 2 | three
     | 4 | 1 | four
     | 5 | 0 | five
     | 6 | 6 | six
     | 7 | 7 | seven
     |   |   | null
     |   | 0 | zero
     | 1 | 4 | one
     | 2 | 3 | two
     | 0 |   | zero
(11 rows)

                         
select * from ( SELECT '' AS "col", * FROM join_tab1 AS tx) AS A;
 col | i | j |   t   
-----+---+---+-------
     | 3 | 2 | three
     | 4 | 1 | four
     | 5 | 0 | five
     | 6 | 6 | six
     | 7 | 7 | seven
     |   |   | null
     |   | 0 | zero
     | 8 | 8 | eight
     | 1 | 4 | one
     | 2 | 3 | two
     | 0 |   | zero
(11 rows)

                         
select * from(SELECT '' AS "col", * FROM join_tab1 AS tx) as A(a,b,c);
 a | b | c |   t   
---+---+---+-------
   | 3 | 2 | three
   | 4 | 1 | four
   | 5 | 0 | five
   | 6 | 6 | six
   | 7 | 7 | seven
   |   |   | null
   |   | 0 | zero
   | 8 | 8 | eight
   | 1 | 4 | one
   | 2 | 3 | two
   | 0 |   | zero
(11 rows)

                         
select * from(SELECT '' AS "col", t1.a, t2.e FROM join_tab1 t1 (a, b, c), join_tab2 t2 (d, e) 
				WHERE t1.a = t2.d)as A;
 col | a | e  
-----+---+----
     | 1 | -1
     | 2 |  4
     | 2 |  2
     | 0 |   
     | 3 | -3
     | 5 | -5
     | 5 | -5
(7 rows)

                         
select * from join_tab1 where exists(select * from join_tab2 where join_tab1.i=join_tab2.i);
 i | j |   t   
---+---+-------
 3 | 2 | three
 5 | 0 | five
 1 | 4 | one
 2 | 3 | two
 0 |   | zero
(5 rows)

                         
select * from join_tab1 where not exists(select * from join_tab2 where join_tab1.i=join_tab2.i) order by i,j;
 i | j |   t   
---+---+-------
 4 | 1 | four
 6 | 6 | six
 7 | 7 | seven
 8 | 8 | eight
   | 0 | zero
   |   | null
(6 rows)

                         
select 25 = any ('{1,2,3,4}');
 ?column? 
----------
 f
(1 row)

                         
select 25 = any ('{1,2,25}');
 ?column? 
----------
 t
(1 row)

                         
select 'abc' = any('{abc,d,e}');
 ?column? 
----------
 t
(1 row)

                         
-- start_ignore
create table subq_abc(a int);
NOTICE:  Table doesn't have 'DISTRIBUTED BY' clause -- Using column named 'a' as the Greenplum Database data distribution key for this table.
HINT:  The 'DISTRIBUTED BY' clause determines the distribution of data. Make sure column(s) chosen are the optimal data distribution key to minimize skew.
insert into subq_abc values(1);
insert into subq_abc values(9);
insert into subq_abc values(3);
insert into subq_abc values(6);
-- end_ignore
select * from subq_abc;
 a 
---
 9
 1
 3
 6
(4 rows)

                         
SELECT 9 = any (select * from subq_abc);
 ?column? 
----------
 t
(1 row)

                         
select null::int >= any ('{}');
 ?column? 
----------
 f
(1 row)

                         
select 'abc' = any('{" "}');
 ?column? 
----------
 f
(1 row)

                         
select 33.4 = any (array[1,2,3]);
 ?column? 
----------
 f
(1 row)

                         
select 40 = all ('{3,4,40,10}');
 ?column? 
----------
 f
(1 row)

                         
select 55 >= all ('{1,2,55}');
 ?column? 
----------
 t
(1 row)

			 
select 25 = all ('{25,25,25}');
 ?column? 
----------
 t
(1 row)

		          
select 'abc' = all('{abc}');
 ?column? 
----------
 t
(1 row)

                         
select 'abc' = all('{abc,d,e}');
 ?column? 
----------
 f
(1 row)

                         
select 'abc' = all('{"abc"}');
 ?column? 
----------
 t
(1 row)

                         
select 'abc' = all('{" "}');
 ?column? 
----------
 f
(1 row)

                         
select null::int >= all ('{1,2,33}');
 ?column? 
----------
 
(1 row)

                         
select null::int >= all ('{}');
 ?column? 
----------
 t
(1 row)

                         
select 33.4 > all (array[1,2,3]);                       
 ?column? 
----------
 t
(1 row)

                         
-- start_ignore
create table emp_list(empid int,name char(20),sal float); 
NOTICE:  Table doesn't have 'DISTRIBUTED BY' clause -- Using column named 'empid' as the Greenplum Database data distribution key for this table.
HINT:  The 'DISTRIBUTED BY' clause determines the distribution of data. Make sure column(s) chosen are the optimal data distribution key to minimize skew.
insert into emp_list values(1,'empone',1000); 
insert into emp_list values(2,'emptwo',2000); 
insert into emp_list values(3,'empthree',3000); 
insert into emp_list values(4,'empfour',4000); 
insert into emp_list values(5,'empfive',4000); 
-- end_ignore
select * from emp_list;
 empid |         name         | sal  
-------+----------------------+------
     1 | empone               | 1000
     2 | emptwo               | 2000
     3 | empthree             | 3000
     4 | empfour              | 4000
     5 | empfive              | 4000
(5 rows)

                       
select name from emp_list where sal=(select max(sal) from emp_list);
         name         
----------------------
 empfour             
 empfive             
(2 rows)

                        
select name from emp_list where sal=(select min(sal) from emp_list);
         name         
----------------------
 empone              
(1 row)

                       
select name from emp_list where sal>(select avg(sal) from emp_list);
         name         
----------------------
 empthree            
 empfour             
 empfive             
(3 rows)

                       
select name from emp_list where sal<(select avg(sal) from emp_list);
         name         
----------------------
 empone              
 emptwo              
(2 rows)

                      
CREATE TABLE subq_test1 (s1 INT, s2 CHAR(5), s3 FLOAT);
NOTICE:  Table doesn't have 'DISTRIBUTED BY' clause -- Using column named 's1' as the Greenplum Database data distribution key for this table.
HINT:  The 'DISTRIBUTED BY' clause determines the distribution of data. Make sure column(s) chosen are the optimal data distribution key to minimize skew.
INSERT INTO subq_test1 VALUES (1,'1',1.0); 
INSERT INTO subq_test1 VALUES (2,'2',2.0);
INSERT INTO subq_test1 VALUES (3,'3',3.0);
INSERT INTO subq_test1 VALUES (4,'4',4.0);
SELECT sb1,sb2,sb3 FROM (SELECT s1 AS sb1, s2 AS sb2, s3*2 AS sb3 FROM subq_test1) AS sb WHERE sb1 > 1;
 sb1 |  sb2  | sb3 
-----+-------+-----
   3 | 3     |   6
   4 | 4     |   8
   2 | 2     |   4
(3 rows)

                      
select to_char(Avg(sum_col1),'9999999.9999999') from (select sum(s1) as sum_col1 from subq_test1 group by s1) as tab1;
     to_char      
------------------
        2.5000000
(1 row)

                      
select g2,count(*) from (select I, count(*) as g2 from join_tab1 group by I) as vtable group by g2;
 g2 | count 
----+-------
  2 |     1
  1 |     9
(2 rows)

                      
-- start_ignore
create table join_tab4 ( i integer, j integer, t text);
NOTICE:  Table doesn't have 'DISTRIBUTED BY' clause -- Using column named 'i' as the Greenplum Database data distribution key for this table.
HINT:  The 'DISTRIBUTED BY' clause determines the distribution of data. Make sure column(s) chosen are the optimal data distribution key to minimize skew.
insert into join_tab4 values (1,7,'sunday'); 
insert into join_tab4 values (2,6,'monday');
insert into join_tab4 values (3,5,'tueday');
insert into join_tab4 values (4,4,'wedday');
insert into join_tab4 values (5,3,'thuday');
insert into join_tab4 values (6,2,'friday');
insert into join_tab4 values (7,1,'satday');
-- end_ignore
select * from join_tab4;
 i | j |   t    
---+---+--------
 1 | 7 | sunday
 2 | 6 | monday
 3 | 5 | tueday
 4 | 4 | wedday
 5 | 3 | thuday
 6 | 2 | friday
 7 | 1 | satday
(7 rows)

                      
select i,j,t from (select * from (select i,j,t from join_tab1)as dtab1 
				UNION select * from(select i,j,t from join_tab4) as dtab2 )as mtab; 	
 i | j |   t    
---+---+--------
 1 | 4 | one
 2 | 6 | monday
 5 | 0 | five
 5 | 3 | thuday
 6 | 6 | six
 7 | 7 | seven
 8 | 8 | eight
   | 0 | zero
 0 |   | zero
 2 | 3 | two
 3 | 2 | three
 4 | 4 | wedday
 7 | 1 | satday
 1 | 7 | sunday
 3 | 5 | tueday
 4 | 1 | four
 6 | 2 | friday
   |   | null
(18 rows)

                      
select * from join_tab1 where i = (select i from join_tab4 where t='satday');
 i | j |   t   
---+---+-------
 7 | 7 | seven
(1 row)

                      
select * from join_tab1 where i = (select i from join_tab4);
ERROR:  more than one row returned by a subquery used as an expression
         
--
-- Testing NOT-IN Subquery
--              
-- start_ignore
create table Tbl8352_t1(a int, b int) distributed by (a);
create table Tbl8352_t2(a int, b int) distributed by (a);
insert into Tbl8352_t1 values(1,null),(null,1),(1,1),(null,null);
-- end_ignore
select * from Tbl8352_t1 order by 1,2;
 a | b 
---+---
 1 | 1
 1 |  
   | 1
   |  
(4 rows)

-- start_ignore
insert into Tbl8352_t2 values(1,1);
-- end_ignore
select * from Tbl8352_t2;
 a | b 
---+---
 1 | 1
(1 row)

select * from Tbl8352_t1 where (Tbl8352_t1.a,Tbl8352_t1.b) not in (select Tbl8352_t2.a,Tbl8352_t2.b from Tbl8352_t2);
 a | b 
---+---
(0 rows)

-- start_ignore
create table Tbl8352_t1a(a int, b int) distributed by (a);
create table Tbl8352_t2a(a int, b int) distributed by (a);
insert into Tbl8352_t1a values(1,2),(3,null),(null,4),(null,null);
-- end_ignore
select * from Tbl8352_t1a order by 1,2;
 a | b 
---+---
 1 | 2
 3 |  
   | 4
   |  
(4 rows)

-- start_ignore
insert into Tbl8352_t2a values(1,2);
-- end_ignore
select * from Tbl8352_t2a;
 a | b 
---+---
 1 | 2
(1 row)

select * from Tbl8352_t1a where (Tbl8352_t1a.a,Tbl8352_t1a.b) not in (select Tbl8352_t2a.a,Tbl8352_t2a.b from Tbl8352_t2a) order by 1,2;
 a | b 
---+---
 3 |  
   | 4
(2 rows)

select (1,null::int) not in (select 1,1);
 ?column? 
----------
 
(1 row)

select (3,null::int) not in (select 1,1);
 ?column? 
----------
 t
(1 row)

-- start_ignore
create table t1(a int, b int);
NOTICE:  Table doesn't have 'DISTRIBUTED BY' clause -- Using column named 'a' as the Greenplum Database data distribution key for this table.
HINT:  The 'DISTRIBUTED BY' clause determines the distribution of data. Make sure column(s) chosen are the optimal data distribution key to minimize skew.
create table t2(a int, b int);
NOTICE:  Table doesn't have 'DISTRIBUTED BY' clause -- Using column named 'a' as the Greenplum Database data distribution key for this table.
HINT:  The 'DISTRIBUTED BY' clause determines the distribution of data. Make sure column(s) chosen are the optimal data distribution key to minimize skew.
create table t3(a int, b int);
NOTICE:  Table doesn't have 'DISTRIBUTED BY' clause -- Using column named 'a' as the Greenplum Database data distribution key for this table.
HINT:  The 'DISTRIBUTED BY' clause determines the distribution of data. Make sure column(s) chosen are the optimal data distribution key to minimize skew.
create table t4(a int, b int);
NOTICE:  Table doesn't have 'DISTRIBUTED BY' clause -- Using column named 'a' as the Greenplum Database data distribution key for this table.
HINT:  The 'DISTRIBUTED BY' clause determines the distribution of data. Make sure column(s) chosen are the optimal data distribution key to minimize skew.
insert into t1 values(1,2);
insert into t1 values(3,4);
insert into t1 values(5,6);
insert into t2 values(1,2);
insert into t2 values(3,4);
insert into t2 values(7,8);
insert into t3 values(1,2);
insert into t3 values(3,4);
insert into t4 values(1,2);
create table i1(a int, b int);
NOTICE:  Table doesn't have 'DISTRIBUTED BY' clause -- Using column named 'a' as the Greenplum Database data distribution key for this table.
HINT:  The 'DISTRIBUTED BY' clause determines the distribution of data. Make sure column(s) chosen are the optimal data distribution key to minimize skew.
create table i2(a int, b int);
NOTICE:  Table doesn't have 'DISTRIBUTED BY' clause -- Using column named 'a' as the Greenplum Database data distribution key for this table.
HINT:  The 'DISTRIBUTED BY' clause determines the distribution of data. Make sure column(s) chosen are the optimal data distribution key to minimize skew.
insert into i1 values(1,2);
-- end_ignore
--
-- not in subquery involving vars from different rels with inner join
--
select t1.a, t2.b from t1, t2 where t1.a=t2.a and ((t1.a,t2.b) not in (select i1.a,i1.b from i1));
 a | b 
---+---
 3 | 4
(1 row)

select t1.a, t2.b from t1 inner join t2 on  (t1.a=t2.a and ((t1.a,t2.b) not in (select i1.a,i1.b from i1)));
 a | b 
---+---
 3 | 4
(1 row)

select t1.a, t2.b from t1 inner join t2 on  (t1.a=t2.a) where ((t1.a,t2.b) not in (select i1.a,i1.b from i1));
 a | b 
---+---
 3 | 4
(1 row)

-- unsupported case
explain select t1.a, t2.b from t1, t2 where t1.a=t2.a or ((t1.a,t2.b) not in (select i1.a,i1.b from i1));
                                            QUERY PLAN                                             
---------------------------------------------------------------------------------------------------
 Gather Motion 3:1  (slice3; segments: 3)  (cost=1.01..3.66 rows=4 width=8)
   ->  Nested Loop  (cost=1.01..3.66 rows=2 width=8)
         Join Filter: t1.a = t2.a OR (NOT ((subplan)))
         ->  Broadcast Motion 3:3  (slice1; segments: 3)  (cost=0.00..1.05 rows=1 width=4)
               ->  Seq Scan on t1  (cost=0.00..1.01 rows=1 width=4)
         ->  Materialize  (cost=1.01..1.02 rows=1 width=8)
               ->  Seq Scan on t2  (cost=0.00..1.01 rows=1 width=8)
         SubPlan 1
           ->  Materialize  (cost=1.01..1.02 rows=1 width=8)
                 ->  Broadcast Motion 3:3  (slice2; segments: 3)  (cost=0.00..1.01 rows=1 width=8)
                       ->  Seq Scan on i1  (cost=0.00..1.01 rows=1 width=8)
 Optimizer status: legacy query optimizer
(12 rows)

--
-- not in subquery involving vars from different rels with left join. 
--
select t1.a, t2.b from t1 left join t2 on  (t1.a=t2.a) where ((t1.a,t2.b) not in (select i1.a,i1.b from i1));
 a | b 
---+---
 3 | 4
 5 |  
(2 rows)

select t1.a, t2.b from t1 left join t2 on  (t1.a=t2.a and ((t1.a,t2.b) not in (select i1.a,i1.b from i1)));
 a | b 
---+---
 1 |  
 3 | 4
 5 |  
(3 rows)

--
-- not in subquery involving vars from different rels with outer join
--
select t1.a, t2.b from t1 full outer join t2 on  (t1.a=t2.a) where ((t1.a,t2.b) not in (select i1.a,i1.b from i1));
 a | b 
---+---
 3 | 4
 5 |  
   | 8
(3 rows)

-- unsupported case
select t1.a, t2.b from t1 full outer join t2 on  (t1.a=t2.a and ((t1.a,t2.b) not in (select i1.a,i1.b from i1))); 
ERROR:  FULL JOIN is only supported with merge-joinable join conditions
--
-- more complex case
--
select t1.a,t2.b from t1 left join (t2 inner join t3 on (t3.a not in (select t4.a from t4))) on (t1.a=t2.a);
 a | b 
---+---
 1 | 2
 3 | 4
 5 |  
(3 rows)
                      
-- start_ignore
create table Tbl01(a int, b int, c int);
NOTICE:  Table doesn't have 'DISTRIBUTED BY' clause -- Using column named 'a' as the Greenplum Database data distribution key for this table.
HINT:  The 'DISTRIBUTED BY' clause determines the distribution of data. Make sure column(s) chosen are the optimal data distribution key to minimize skew.
insert into Tbl01 values(1,2,3);
insert into Tbl01 values(4,5,6);
insert into Tbl01 values(7,8,9);
insert into Tbl01 values(null,11,12);
create table Tbl03(a int);
NOTICE:  Table doesn't have 'DISTRIBUTED BY' clause -- Using column named 'a' as the Greenplum Database data distribution key for this table.
HINT:  The 'DISTRIBUTED BY' clause determines the distribution of data. Make sure column(s) chosen are the optimal data distribution key to minimize skew.
insert into Tbl03 values(1),(4);
create or replace function foo(int) returns int as $$
	select case when $1 is null then 13::int
	       	    else null::int
	       end;
$$ language sql immutable;
-- end_ignore
select Tbl01.*,foo(Tbl01.a) as foo from Tbl01; -- showing foo values
 a | b  | c  | foo 
---+----+----+-----
 1 |  2 |  3 |    
 4 |  5 |  6 |    
 7 |  8 |  9 |    
   | 11 | 12 |  13
(4 rows)

select Tbl01.* from Tbl01 where foo(Tbl01.a) not in (select a from Tbl03);
 a | b  | c  
---+----+----
   | 11 | 12
(1 row)

-- start_ignore
create table Tbl02 as select Tbl01.*,foo(Tbl01.a) as foo from Tbl01;
NOTICE:  Table doesn't have 'DISTRIBUTED BY' clause -- Using column(s) named 'a' as the Greenplum Database data distribution key for this table.
HINT:  The 'DISTRIBUTED BY' clause determines the distribution of data. Make sure column(s) chosen are the optimal data distribution key to minimize skew.
-- end_ignore
select Tbl02.* from Tbl02 where foo not in (select a from Tbl03);
 a | b  | c  | foo 
---+----+----+-----
   | 11 | 12 |  13
(1 row)

-- start_ignore
create table Tbl04(a int, b int);
CREATE TABLE
insert into Tbl04 values(1,2),(3,4),(5,6);
INSERT 0 3
create table Tbl05(a int, b int);
CREATE TABLE
insert into Tbl05 values(1,2);
INSERT 0 1
create table Tbl06(a int, b int);
CREATE TABLE
insert into Tbl06 values(1,2),(3,4);
INSERT 0 2
create table i3(a int not null, b int not null);
CREATE TABLE
insert into i3 values(1,2);
INSERT 0 1
create table Tbl07(a int, b int);
CREATE TABLE
insert into Tbl07 values(1,2),(3,4),(null,null);
INSERT 0 3
create table Tbl08(a int, b int);
CREATE TABLE
insert into Tbl08 values(1,2),(3,4),(null,null);
INSERT 0 3
create table Tbl09(a int, b int);
CREATE TABLE
insert into Tbl09 values(1,2),(5,null),(null,8);
INSERT 0 3
-- end_ignore
--
-- Positive cases: We should be inferring non-nullability of the not-in subquery. This should result in HLASJ.
--
-- non-nullability due to inner join
select Tbl04.* from Tbl04 where (Tbl04.a,Tbl04.b) not in (select Tbl05.a,Tbl05.b from Tbl05,Tbl06 where Tbl05.a=Tbl06.a and Tbl05.b < 10); -- expected: (3,4),(5,6)
 a | b 
---+---
 3 | 4
 5 | 6
(2 rows)

select Tbl04.* from Tbl04 where (Tbl04.a,Tbl04.b) not in (select Tbl07.a,Tbl07.b from Tbl07 inner join Tbl08 on (Tbl07.a=Tbl08.a and Tbl07.b=Tbl08.b) inner join i3 on (i3.a=Tbl08.a and i3.b=Tbl08.b)); -- expected:(3,4), (5,6)
 a | b 
---+---
 3 | 4
 5 | 6
(2 rows)

-- non-nullability due to where clause condition
select Tbl04.* from Tbl04 where (Tbl04.a,Tbl04.b) not in (select Tbl05.a,Tbl05.b from Tbl05 where Tbl05.a < 2 and Tbl05.b < 10); -- expected: (3,4), (5,6)
 a | b 
---+---
 3 | 4
 5 | 6
(2 rows)

select Tbl04.* from Tbl04 where (Tbl04.a,Tbl04.b) not in (select Tbl07.a,Tbl07.b from Tbl07 left join Tbl08 on (Tbl07.a=Tbl08.a) where Tbl07.a = 1 and Tbl07.b = 2); -- expected: (3,4),(5,6)
 a | b 
---+---
 3 | 4
 5 | 6
(2 rows)

-- not null condition in the where clause
select Tbl04.* from Tbl04 where (Tbl04.a,Tbl04.b) not in (select Tbl07.a,Tbl07.b from Tbl07 full outer join Tbl08 on (Tbl07.a=Tbl08.a) where Tbl07.a is not null and Tbl07.b is not null); -- (5,6)
 a | b 
---+---
 5 | 6
(1 row)

select Tbl04.* from Tbl04 where (Tbl04.a,Tbl04.b) not in (select Tbl07.a,Tbl07.b from Tbl07 left join Tbl08 on (Tbl07.a=Tbl08.a) where Tbl07.a is not null and Tbl07.b is not null); -- (5,6)
 a | b 
---+---
 5 | 6
(1 row)

-- or clauses that should lead to non-nullability
select Tbl04.* from Tbl04 where (Tbl04.a,Tbl04.b) not in (select Tbl05.a,Tbl05.b from Tbl05 where (Tbl05.a < 2 or Tbl05.a > 100) AND (Tbl05.b < 4 or Tbl05.b > 100)); -- expected: (3,4), (5,6)
 a | b 
---+---
 3 | 4
 5 | 6
(2 rows)

-- base-table constraints
select Tbl04.* from Tbl04 where (Tbl04.a,Tbl04.b) not in (select i3.a,i3.b from i3); -- expected: (3,4),(5,6)
 a | b 
---+---
 3 | 4
 5 | 6
(2 rows)

select Tbl04.* from Tbl04 where (Tbl04.a,Tbl04.b) not in (select Tbl05.a,Tbl05.b from Tbl05,i3 where	Tbl05.a = i3.a and	Tbl05.b = i3.b);
 a | b 
---+---
 3 | 4
 5 | 6
(2 rows)

select Tbl04.* from Tbl04 where (Tbl04.a,Tbl04.b) not in (select Tbl05.a,Tbl05.b from Tbl05,i3 where Tbl05.a < i3.a and Tbl05.b > i3.b);
 a | b 
---+---
 3 | 4
 5 | 6
 1 | 2
(3 rows)

-- non-null constant values
select Tbl04.* from Tbl04 where (Tbl04.a,Tbl04.b) not in (select 1,2); -- (3,4),(5,6)
 a | b 
---+---
 3 | 4
 5 | 6
(2 rows)

select Tbl04.* from Tbl04 where (Tbl04.a,Tbl04.b) not in ((1,2));
 a | b 
---+---
 3 | 4
 5 | 6
(2 rows)

-- multiple NOT-IN expressions
select Tbl04.* from Tbl04 where (Tbl04.a,Tbl04.b) not in (select Tbl06.a,Tbl06.b from Tbl06) and (Tbl04.a,Tbl04.b) not in (select i3.a, i3.b from i3); -- expected: (5,6)
 a | b 
---+---
 5 | 6
(1 row)

select Tbl04.* from Tbl04 where not ((Tbl04.a,Tbl04.b) in (select Tbl06.a,Tbl06.b from Tbl06) or (Tbl04.a,Tbl04.b) in (select i3.a, i3.b from i3)); -- expected: (5,6)
 a | b 
---+---
 5 | 6
(1 row)

-- single column in the target list should always give a HLASJ
select Tbl04.* from Tbl04 where Tbl04.a NOT IN (select Tbl09.a from Tbl09 where Tbl09.b is null); -- (1,2) (3,4)
 a | b 
---+---
 3 | 4
 1 | 2
(2 rows)

select Tbl04.* from Tbl04 where Tbl04.a NOT IN (select i3.a from i3);
 a | b 
---+---
 3 | 4
 5 | 6
(2 rows)

select Tbl04.* from Tbl04 where Tbl04.a NOT IN (select Tbl05.a from	Tbl05 left	join i3	on (Tbl05.a=i3.a));
 a | b 
---+---
 3 | 4
 5 | 6
(2 rows)

--
-- Negative tests: we should not be inferring non-nullability in these cases. Therefore, we should see NLASJ.
--
-- No where clause
select Tbl04.* from Tbl04 where (Tbl04.a,Tbl04.b) not in (select Tbl05.a,Tbl05.b from Tbl05); -- expected: (3,4), (5,6)
 a | b 
---+---
 3 | 4
 5 | 6
(2 rows)

-- INDF in the where clause
select Tbl04.* from Tbl04 where (Tbl04.a,Tbl04.b) not in (select Tbl07.a,Tbl07.b from Tbl07,Tbl08 where Tbl07.a is not distinct from Tbl08.a and Tbl07.b is not distinct from Tbl08.b); -- no rows
 a | b 
---+---
(0 rows)

-- null conditions in the where clause
select Tbl04.* from Tbl04 where (Tbl04.a,Tbl04.b) not in (select Tbl07.a,Tbl07.b from Tbl07 left join Tbl08 on (Tbl07.a=Tbl08.a and Tbl07.b=Tbl08.b) where Tbl07.a is null and Tbl07.b is null); -- no rows
 a | b 
---+---
(0 rows)

select Tbl04.* from Tbl04 where (Tbl04.a,Tbl04.b) not in (select Tbl07.a,Tbl07.b from Tbl07 full outer join Tbl08 on (Tbl07.a=Tbl08.a and Tbl07.b=Tbl08.b) where Tbl07.a is null and Tbl07.b is null); -- no rows
 a | b 
---+---
(0 rows)

-- OR clauses that should not lead to non-nullability
select Tbl04.* from Tbl04 where (Tbl04.a,Tbl04.b) not in (select Tbl07.a,Tbl07.b from Tbl07,Tbl08 where Tbl07.a is not distinct from Tbl08.a or Tbl07.a=1); -- no rows
 a | b 
---+---
(0 rows)

-- values list: we don't support it yet. not worth the effort.
select Tbl04.* from Tbl04 where (Tbl04.a,Tbl04.b) not in (values(1,2),(3,4)); -- (3,4),(5,6)
 a | b 
---+---
 5 | 6
(1 row)

-- functions/ops in the target list of the subquery
select Tbl04.* from Tbl04 where (Tbl04.a,Tbl04.b) not in (select i3.a+2,i3.b+2 from i3); -- expected: (5,6)
 a | b 
---+---
 1 | 2
 5 | 6
(2 rows)

-- group by does not guarantee removal of nulls. 
select Tbl09.a, Tbl09.b from Tbl09;
 a | b 
---+---
 1 | 2
 5 |  
   | 8
(3 rows)

select Tbl04.* from Tbl04 where (Tbl04.a,Tbl04.b) not in (select Tbl09.a,Tbl09.b from Tbl09); -- expected: (3,4)
 a | b 
---+---
 3 | 4
(1 row)

select Tbl09.a, Tbl09.b from Tbl09 group by Tbl09.a, Tbl09.b;
 a | b 
---+---
 5 |  
   | 8
 1 | 2
(3 rows)

select Tbl04.* from Tbl04 where (Tbl04.a,Tbl04.b) not in (select Tbl09.a, Tbl09.b from Tbl09 group by Tbl09.a, Tbl09.b); -- expected: (3,4)
 a | b 
---+---
 3 | 4
(1 row)

select Tbl04.* from Tbl04 where (Tbl04.a,Tbl04.b) not in (select sum(i3.b),i3.a from i3 group by i3.a); -- (1,2),(3,4),(5,6)
 a | b 
---+---
 1 | 2
 3 | 4
 5 | 6
(3 rows)

-- infering not-nullability for only one of the columns
select Tbl04.* from Tbl04 where (Tbl04.a,Tbl04.b) not in (select i3.a,Tbl05.b from i3,Tbl05 where	i3.a=Tbl05.a); -- (3,4),(5,6)
 a | b 
---+---
 3 | 4
 5 | 6
(2 rows)

select Tbl04.* from Tbl04 where (Tbl04.a,Tbl04.b) NOT IN (select i3.a,i3.b from Tbl07 left join i3 on (i3.a=Tbl07.a and i3.b=Tbl07.b) where i3.a > 2);
 a | b 
---+---
 3 | 4
 5 | 6
 1 | 2
(3 rows)

--
-- Unsupported test: These tests are meant to illustrate NOT-IN subqueries we do not support
-- Started supporting since RIO
--
select Tbl04.* from Tbl04 where (Tbl04.a,Tbl04.b) not in (select i3.a,i3.b from i3 union select Tbl07.a, Tbl07.b from Tbl07); -- nulls in the inner side, should not return any rows
 a | b 
---+---
(0 rows)

select Tbl04.* from Tbl04 where (Tbl04.a,Tbl04.b) not in (select i3.a,i3.b from i3 union all select Tbl07.a, Tbl07.b from Tbl07); -- nulls in the innder side, should not return any rows
 a | b 
---+---
(0 rows)

select Tbl04.* from Tbl04 where (Tbl04.a,Tbl04.b) not in (select 1,2 union select 3,4); --(5,6)
 a | b 
---+---
 5 | 6
(1 row)

select Tbl04.* from Tbl04 where (Tbl04.a,Tbl04.b) not in (select i3.a,i3.b from i3) or (Tbl04.a,Tbl04.b) not in (select Tbl07.a, Tbl07.b from Tbl07);
 a | b 
---+---
 3 | 4
 5 | 6
(2 rows)

-- Cases where the planner "should have" determined not-nullabitlity
select Tbl04.* from Tbl04 where (Tbl04.a,Tbl04.b) not in (select i3.a,i3.b from i3 left join Tbl07 on (i3.a=Tbl07.a and i3.b=Tbl07.b));
 a | b 
---+---
 3 | 4
 5 | 6
(2 rows)

select Tbl04.* from Tbl04 where (Tbl04.a,Tbl04.b) not in (select Tbl05.a,Tbl05.b from Tbl05 where (Tbl05.a IN (select i3.a from i3)) AND (Tbl05.b IN (select i3.b from i3)));
 a | b 
---+---
 3 | 4
 5 | 6
(2 rows)

-- additional queries
-- start_ignore
drop table if exists Tbl04;
DROP TABLE
create table Tbl04(x int, y int);
CREATE TABLE
insert into Tbl04 values(1,2);
INSERT 0 1
insert into Tbl04 values(3,4);
INSERT 0 1
create table Tbl10(x int, y int);
CREATE TABLE
insert into Tbl10 values(1,null);
INSERT 0 1
-- end_ignore
select * from Tbl04 where (x,y) not in (select x,y from Tbl10);
 x | y 
---+---
 3 | 4
(1 row)

select * from Tbl04 where (x,y) not in (select 1,y from Tbl10);
 x | y 
---+---
 3 | 4
(1 row)

select * from tbl10 where y not in (select 1 where false);
 x | y 
---+---
 1 |  
(1 row)

-- start_ignore
alter table Tbl10 alter column x set not null;
ALTER TABLE
-- end_ignore
select * from Tbl04 where (x,y) not in (select x,y from Tbl10);
 x | y 
---+---
 3 | 4
(1 row)

-- start_ignore
create table TblText1(a text, b text);
NOTICE:  Table doesn't have 'DISTRIBUTED BY' clause -- Using column named 'a' as the Greenplum Database data distribution key for this table.
HINT:  The 'DISTRIBUTED BY' clause determines the distribution of data. Make sure column(s) chosen are the optimal data distribution key to minimize skew.
create table TblText2(a text, b text);
NOTICE:  Table doesn't have 'DISTRIBUTED BY' clause -- Using column named 'a' as the Greenplum Database data distribution key for this table.
HINT:  The 'DISTRIBUTED BY' clause determines the distribution of data. Make sure column(s) chosen are the optimal data distribution key to minimize skew.
create table TblText3(a text, b text);
NOTICE:  Table doesn't have 'DISTRIBUTED BY' clause -- Using column named 'a' as the Greenplum Database data distribution key for this table.
HINT:  The 'DISTRIBUTED BY' clause determines the distribution of data. Make sure column(s) chosen are the optimal data distribution key to minimize skew.
insert into TblText1 values('rob', 'klopp');
insert into TblText1 values('florian','waas');
insert into TblText1 values('oak','barrett');
insert into TblText1 values('tushar','pednekar');
insert into TblText2 select * from TblText1;
insert into TblText3 values('florian','waas');
insert into TblText3 values('oak','barrett');
-- end_ignore
SELECT TblText1.a, TblText2.b FROM TblText1 JOIN TblText2 ON TblText1.a = TblText2.a WHERE ((NOT (TblText1.a, TblText2.b) IN (SELECT TblText3.a, TblText3.b FROM TblText3)));
   a    |    b     
--------+----------
 tushar | pednekar
 rob    | klopp
(2 rows)

SELECT TblText1.a, TblText2.b FROM TblText1 JOIN TblText2 ON TblText1.a = TblText2.a WHERE (( (TblText1.a, TblText2.b) IN (SELECT TblText3.a, TblText3.b FROM TblText3)));
    a    |    b    
---------+---------
 florian | waas
 oak     | barrett
(2 rows)

--
-- Delete
--
-- start_ignore
create table TabDel1(a int, b int);
CREATE TABLE
insert into TabDel1 values(1,2),(3,4),(5,6);
INSERT 0 3
create table TabDel2 as select * from TabDel1;
SELECT 3
create table TabDel3(a int, b int);
CREATE TABLE
insert into TabDel3 values(1,2);
INSERT 0 1
create table TabDel4(a int not null, b int not null);
CREATE TABLE
insert into TabDel4 values(1,2);
INSERT 0 1
-- end_ignore
explain delete from TabDel1 where TabDel1.a not in (select a from TabDel3); -- do not support this because we produce NLASJ
                                              QUERY PLAN                                               
-------------------------------------------------------------------------------------------------------
 Delete (slice0; segments: 3)  (rows=2 width=10)
   ->  Explicit Redistribute Motion 3:3  (slice2; segments: 3)  (cost=1.09..3.17 rows=2 width=10)
         ->  Hash Left Anti Semi Join (Not-In)  (cost=1.09..3.17 rows=2 width=10)
               Hash Cond: tabdel1.a = tabdel3.a
               ->  Seq Scan on tabdel1  (cost=0.00..2.03 rows=1 width=14)
               ->  Hash  (cost=1.05..1.05 rows=1 width=4)
                     ->  Broadcast Motion 3:3  (slice1; segments: 3)  (cost=0.00..1.05 rows=1 width=4)
                           ->  Seq Scan on tabdel3  (cost=0.00..1.01 rows=1 width=4)
 Optimizer status: legacy query optimizer
(9 rows)

explain delete from TabDel2 where TabDel2.a not in (select a from TabDel4); -- support this
                                 QUERY PLAN                                 
----------------------------------------------------------------------------
 Delete (slice0; segments: 3)  (rows=2 width=10)
   ->  Hash Left Anti Semi Join (Not-In)  (cost=1.02..3.10 rows=2 width=10)
         Hash Cond: tabdel2.a = tabdel4.a
         ->  Seq Scan on tabdel2  (cost=0.00..2.03 rows=1 width=14)
         ->  Hash  (cost=1.01..1.01 rows=1 width=4)
               ->  Seq Scan on tabdel4  (cost=0.00..1.01 rows=1 width=4)
 Optimizer status: legacy query optimizer
(7 rows)

-- start_ignore
delete from TabDel2 where TabDel2.a not in (select a from TabDel4); 
DELETE 2
-- end_ignore
select * from TabDel2;
 a | b 
---+---
 1 | 2
(1 row)

--
-- Update
--
-- start_ignore
create table TblUp1(a int, b int);
NOTICE:  Table doesn't have 'DISTRIBUTED BY' clause -- Using column named 'a' as the Greenplum Database data distribution key for this table.
HINT:  The 'DISTRIBUTED BY' clause determines the distribution of data. Make sure column(s) chosen are the optimal data distribution key to minimize skew.
insert into TblUp1 values(1,2),(3,4),(5,6);
create table TblUp2 as select * from TblUp1;
NOTICE:  Table doesn't have 'DISTRIBUTED BY' clause -- Using column(s) named 'a' as the Greenplum Database data distribution key for this table.
HINT:  The 'DISTRIBUTED BY' clause determines the distribution of data. Make sure column(s) chosen are the optimal data distribution key to minimize skew.
create table TblUp3(a int, b int);
NOTICE:  Table doesn't have 'DISTRIBUTED BY' clause -- Using column named 'a' as the Greenplum Database data distribution key for this table.
HINT:  The 'DISTRIBUTED BY' clause determines the distribution of data. Make sure column(s) chosen are the optimal data distribution key to minimize skew.
insert into TblUp3 values(1,2);
create table TblUp4(a int not null, b int not null);
NOTICE:  Table doesn't have 'DISTRIBUTED BY' clause -- Using column named 'a' as the Greenplum Database data distribution key for this table.
HINT:  The 'DISTRIBUTED BY' clause determines the distribution of data. Make sure column(s) chosen are the optimal data distribution key to minimize skew.
insert into TblUp4 values(1,2);
-- end_ignore
-- planner does not support updates on distribution keys
update TblUp1 set a=100 where a not in (select a from TblUp3);
ERROR:  Cannot parallelize an UPDATE statement that updates the distribution columns
select * from TblUp1;
 a | b 
---+---
 1 | 2
 3 | 4
 5 | 6
(3 rows)

update TblUp2 set a=100 where a not in (select a from TblUp4);
ERROR:  Cannot parallelize an UPDATE statement that updates the distribution columns
select * from TblUp2;
 a | b 
---+---
 1 | 2
 3 | 4
 5 | 6
(3 rows)

-- start_ignore
drop schema qp_subquery cascade;
-- end_ignore
