set allow_system_table_mods=true;
-- Hash distributed tables
Create table t1_reshuffle_ao(a int, b int, c int) with (appendonly = true) distributed by (a);
update gp_distribution_policy  set numsegments=2 where localoid='t1_reshuffle_ao'::regclass;
insert into t1_reshuffle_ao select i,i,0 from generate_series(1,100) I;
Update t1_reshuffle_ao set c = gp_segment_id;
Select gp_segment_id, count(*) from t1_reshuffle_ao group by gp_segment_id;
 gp_segment_id | count 
---------------+-------
             1 |    51
             0 |    49
(2 rows)

begin;
Alter table t1_reshuffle_ao set with (reshuffle);
Select gp_segment_id, count(*) from t1_reshuffle_ao group by gp_segment_id;
 gp_segment_id | count 
---------------+-------
             0 |    32
             2 |    28
             1 |    40
(3 rows)

abort;
Select gp_segment_id, count(*) from t1_reshuffle_ao group by gp_segment_id;
 gp_segment_id | count 
---------------+-------
             1 |    51
             0 |    49
(2 rows)

Alter table t1_reshuffle_ao set with (reshuffle);
Select gp_segment_id, count(*) from t1_reshuffle_ao group by gp_segment_id;
 gp_segment_id | count 
---------------+-------
             0 |    32
             2 |    28
             1 |    40
(3 rows)

select numsegments from gp_distribution_policy where localoid='t1_reshuffle_ao'::regclass;
 numsegments 
-------------
           3
(1 row)

drop table t1_reshuffle_ao;
Create table t1_reshuffle_ao(a int, b int, c int) with (appendonly = true, OIDS = true) distributed by (a,b);
NOTICE:  OIDS=TRUE is not recommended for user-created tables. Use OIDS=FALSE to prevent wrap-around of the OID counter
update gp_distribution_policy  set numsegments=1 where localoid='t1_reshuffle_ao'::regclass;
insert into t1_reshuffle_ao select i,i,0 from generate_series(1,100) I;
Update t1_reshuffle_ao set c = gp_segment_id;
Select gp_segment_id, count(*) from t1_reshuffle_ao group by gp_segment_id;
 gp_segment_id | count 
---------------+-------
             0 |   100
(1 row)

begin;
Alter table t1_reshuffle_ao set with (reshuffle);
Select gp_segment_id, count(*) from t1_reshuffle_ao group by gp_segment_id;
 gp_segment_id | count 
---------------+-------
             0 |    31
             2 |    34
             1 |    35
(3 rows)

abort;
Select gp_segment_id, count(*) from t1_reshuffle_ao group by gp_segment_id;
 gp_segment_id | count 
---------------+-------
             0 |   100
(1 row)

Alter table t1_reshuffle_ao set with (reshuffle);
Select gp_segment_id, count(*) from t1_reshuffle_ao group by gp_segment_id;
 gp_segment_id | count 
---------------+-------
             0 |    31
             2 |    34
             1 |    35
(3 rows)

select numsegments from gp_distribution_policy where localoid='t1_reshuffle_ao'::regclass;
 numsegments 
-------------
           3
(1 row)

drop table t1_reshuffle_ao;
-- Test NULLs.
Create table t1_reshuffle_ao(a int, b int, c int) with (appendonly = true) distributed by (a,b,c);
update gp_distribution_policy  set numsegments=2 where localoid='t1_reshuffle_ao'::regclass;
insert into t1_reshuffle_ao values
  (1,    1,    1   ),
  (null, 2,    2   ),
  (3,    null, 3   ),
  (4,    4,    null),
  (null, null, 5   ),
  (null, 6,    null),
  (7,    null, null),
  (null, null, null);
Select gp_segment_id, count(*) from t1_reshuffle_ao group by gp_segment_id;
 gp_segment_id | count 
---------------+-------
             1 |     4
             0 |     4
(2 rows)

begin;
Alter table t1_reshuffle_ao set with (reshuffle);
Select gp_segment_id, count(*) from t1_reshuffle_ao group by gp_segment_id;
 gp_segment_id | count 
---------------+-------
             0 |     2
             2 |     3
             1 |     3
(3 rows)

abort;
Select gp_segment_id, count(*) from t1_reshuffle_ao group by gp_segment_id;
 gp_segment_id | count 
---------------+-------
             1 |     4
             0 |     4
(2 rows)

Alter table t1_reshuffle_ao set with (reshuffle);
Select gp_segment_id, count(*) from t1_reshuffle_ao group by gp_segment_id;
 gp_segment_id | count 
---------------+-------
             0 |     2
             1 |     3
             2 |     3
(3 rows)

select numsegments from gp_distribution_policy where localoid='t1_reshuffle_ao'::regclass;
 numsegments 
-------------
           3
(1 row)

drop table t1_reshuffle_ao;
Create table t1_reshuffle_ao(a int, b int, c int) with (appendonly = true) distributed by (a) partition by list(b) (partition t1_reshuffle_ao_1 values(1), partition t1_reshuffle_ao_2 values(2), default partition other);
NOTICE:  CREATE TABLE will create partition "t1_reshuffle_ao_1_prt_t1_reshuffle_ao_1" for table "t1_reshuffle_ao"
NOTICE:  CREATE TABLE will create partition "t1_reshuffle_ao_1_prt_t1_reshuffle_ao_2" for table "t1_reshuffle_ao"
NOTICE:  CREATE TABLE will create partition "t1_reshuffle_ao_1_prt_other" for table "t1_reshuffle_ao"
update gp_distribution_policy set numsegments = 1 where localoid='t1_reshuffle_ao_1_prt_t1_reshuffle_ao_1'::regclass;
update gp_distribution_policy set numsegments = 1 where localoid='t1_reshuffle_ao_1_prt_t1_reshuffle_ao_2'::regclass;
update gp_distribution_policy set numsegments = 1 where localoid='t1_reshuffle_ao_1_prt_other'::regclass;
update gp_distribution_policy set numsegments = 1 where localoid='t1_reshuffle_ao'::regclass;
insert into t1_reshuffle_ao select i,i,0 from generate_series(1,100) I;
Select gp_segment_id, count(*) from t1_reshuffle_ao group by gp_segment_id;
 gp_segment_id | count 
---------------+-------
             0 |   100
(1 row)

begin;
Alter table t1_reshuffle_ao set with (reshuffle);
Select gp_segment_id, count(*) from t1_reshuffle_ao group by gp_segment_id;
 gp_segment_id | count 
---------------+-------
             0 |    32
             1 |    40
             2 |    28
(3 rows)

abort;
Select gp_segment_id, count(*) from t1_reshuffle_ao group by gp_segment_id;
 gp_segment_id | count 
---------------+-------
             0 |   100
(1 row)

Alter table t1_reshuffle_ao set with (reshuffle);
Select gp_segment_id, count(*) from t1_reshuffle_ao group by gp_segment_id;
 gp_segment_id | count 
---------------+-------
             2 |    28
             1 |    40
             0 |    32
(3 rows)

select numsegments from gp_distribution_policy where localoid='t1_reshuffle_ao'::regclass;
 numsegments 
-------------
           3
(1 row)

drop table t1_reshuffle_ao;
-- Random distributed tables
Create table r1_reshuffle_ao(a int, b int, c int) with (appendonly = true) distributed randomly;
update gp_distribution_policy  set numsegments=2 where localoid='r1_reshuffle_ao'::regclass;
insert into r1_reshuffle_ao select i,i,0 from generate_series(1,100) I;
Update r1_reshuffle_ao set c = gp_segment_id;
Select count(*) from r1_reshuffle_ao;
 count 
-------
   100
(1 row)

Select count(*) > 0 from r1_reshuffle_ao where gp_segment_id=2;
 ?column? 
----------
 f
(1 row)

begin;
Alter table r1_reshuffle_ao set with (reshuffle);
Select count(*) from r1_reshuffle_ao;
 count 
-------
   100
(1 row)

Select count(*) > 0 from r1_reshuffle_ao where gp_segment_id=2;
 ?column? 
----------
 t
(1 row)

abort;
Select count(*) from r1_reshuffle_ao;
 count 
-------
   100
(1 row)

Select count(*) > 0 from r1_reshuffle_ao where gp_segment_id=2;
 ?column? 
----------
 f
(1 row)

Alter table r1_reshuffle_ao set with (reshuffle);
Select count(*) from r1_reshuffle_ao;
 count 
-------
   100
(1 row)

Select count(*) > 0 from r1_reshuffle_ao where gp_segment_id=2;
 ?column? 
----------
 t
(1 row)

select numsegments from gp_distribution_policy where localoid='r1_reshuffle_ao'::regclass;
 numsegments 
-------------
           3
(1 row)

drop table r1_reshuffle_ao;
Create table r1_reshuffle_ao(a int, b int, c int) with (appendonly = true, OIDS = true) distributed randomly;
NOTICE:  OIDS=TRUE is not recommended for user-created tables. Use OIDS=FALSE to prevent wrap-around of the OID counter
update gp_distribution_policy  set numsegments=2 where localoid='r1_reshuffle_ao'::regclass;
insert into r1_reshuffle_ao select i,i,0 from generate_series(1,100) I;
Update r1_reshuffle_ao set c = gp_segment_id;
Select count(*) from r1_reshuffle_ao;
 count 
-------
   100
(1 row)

Select count(*) > 0 from r1_reshuffle_ao where gp_segment_id=2;
 ?column? 
----------
 f
(1 row)

begin;
Alter table r1_reshuffle_ao set with (reshuffle);
Select count(*) from r1_reshuffle_ao;
 count 
-------
   100
(1 row)

Select count(*) > 0 from r1_reshuffle_ao where gp_segment_id=2;
 ?column? 
----------
 t
(1 row)

abort;
Select count(*) from r1_reshuffle_ao;
 count 
-------
   100
(1 row)

Select count(*) > 0 from r1_reshuffle_ao where gp_segment_id=2;
 ?column? 
----------
 f
(1 row)

Alter table r1_reshuffle_ao set with (reshuffle);
Select count(*) from r1_reshuffle_ao;
 count 
-------
   100
(1 row)

Select count(*) > 0 from r1_reshuffle_ao where gp_segment_id=2;
 ?column? 
----------
 t
(1 row)

select numsegments from gp_distribution_policy where localoid='r1_reshuffle_ao'::regclass;
 numsegments 
-------------
           3
(1 row)

drop table r1_reshuffle_ao;
Create table r1_reshuffle_ao(a int, b int, c int) with (appendonly = true) distributed randomly partition by list(b) (partition r1_reshuffle_ao_1 values(1), partition r1_reshuffle_ao_2 values(2), default partition other);
NOTICE:  CREATE TABLE will create partition "r1_reshuffle_ao_1_prt_r1_reshuffle_ao_1" for table "r1_reshuffle_ao"
NOTICE:  CREATE TABLE will create partition "r1_reshuffle_ao_1_prt_r1_reshuffle_ao_2" for table "r1_reshuffle_ao"
NOTICE:  CREATE TABLE will create partition "r1_reshuffle_ao_1_prt_other" for table "r1_reshuffle_ao"
update gp_distribution_policy set numsegments = 2 where localoid='r1_reshuffle_ao_1_prt_r1_reshuffle_ao_1'::regclass;
update gp_distribution_policy set numsegments = 2 where localoid='r1_reshuffle_ao_1_prt_r1_reshuffle_ao_2'::regclass;
update gp_distribution_policy set numsegments = 2 where localoid='r1_reshuffle_ao_1_prt_other'::regclass;
update gp_distribution_policy set numsegments = 2 where localoid='r1_reshuffle_ao'::regclass;
insert into r1_reshuffle_ao select i,i,0 from generate_series(1,100) I;
Select count(*) from r1_reshuffle_ao;
 count 
-------
   100
(1 row)

Select count(*) > 0 from r1_reshuffle_ao where gp_segment_id=2;
 ?column? 
----------
 f
(1 row)

begin;
Alter table r1_reshuffle_ao set with (reshuffle);
Select count(*) from r1_reshuffle_ao;
 count 
-------
   100
(1 row)

Select count(*) > 0 from r1_reshuffle_ao where gp_segment_id=2;
 ?column? 
----------
 t
(1 row)

abort;
Select count(*) from r1_reshuffle_ao;
 count 
-------
   100
(1 row)

Select count(*) > 0 from r1_reshuffle_ao where gp_segment_id=2;
 ?column? 
----------
 f
(1 row)

Alter table r1_reshuffle_ao set with (reshuffle);
Select count(*) from r1_reshuffle_ao;
 count 
-------
   100
(1 row)

Select count(*) > 0 from r1_reshuffle_ao where gp_segment_id=2;
 ?column? 
----------
 t
(1 row)

select numsegments from gp_distribution_policy where localoid='r1_reshuffle_ao'::regclass;
 numsegments 
-------------
           3
(1 row)

drop table r1_reshuffle_ao;
-- Replicated tables
-- We have to make sure replicated table successfully reshuffled.
Create table r1_reshuffle_ao(a int, b int, c int) with (appendonly = true) distributed replicated;
select update_numsegments_in_policy('r1_reshuffle_ao', 1);
 update_numsegments_in_policy 
------------------------------
 
(1 row)

insert into r1_reshuffle_ao select i,i,0 from generate_series(1,100) I;
Select count(*) from r1_reshuffle_ao;
 count 
-------
   100
(1 row)

Select gp_execute_on_server(1, 'Select count(*) from r1_reshuffle_ao;');
 gp_execute_on_server 
----------------------
 0
(1 row)

Select gp_execute_on_server(2, 'Select count(*) from r1_reshuffle_ao;');
 gp_execute_on_server 
----------------------
 0
(1 row)

begin;
Alter table r1_reshuffle_ao set with (reshuffle);
Select count(*) from r1_reshuffle_ao;
 count 
-------
   100
(1 row)

abort;
Select count(*) from r1_reshuffle_ao;
 count 
-------
   100
(1 row)

Select gp_execute_on_server(1, 'Select count(*) from r1_reshuffle_ao;');
 gp_execute_on_server 
----------------------
 0
(1 row)

Select gp_execute_on_server(2, 'Select count(*) from r1_reshuffle_ao;');
 gp_execute_on_server 
----------------------
 0
(1 row)

Alter table r1_reshuffle_ao set with (reshuffle);
Select count(*) from r1_reshuffle_ao;
 count 
-------
   100
(1 row)

Select gp_execute_on_server(1, 'Select count(*) from r1_reshuffle_ao;');
 gp_execute_on_server 
----------------------
 100
(1 row)

Select gp_execute_on_server(2, 'Select count(*) from r1_reshuffle_ao;');
 gp_execute_on_server 
----------------------
 100
(1 row)

select numsegments from gp_distribution_policy where localoid='r1_reshuffle_ao'::regclass;
 numsegments 
-------------
           3
(1 row)

drop table r1_reshuffle_ao;
Create table r1_reshuffle_ao(a int, b int, c int) with (appendonly = true, OIDS = true) distributed replicated;
NOTICE:  OIDS=TRUE is not recommended for user-created tables. Use OIDS=FALSE to prevent wrap-around of the OID counter
select update_numsegments_in_policy('r1_reshuffle_ao', 2);
 update_numsegments_in_policy 
------------------------------
 
(1 row)

insert into r1_reshuffle_ao select i,i,0 from generate_series(1,100) I;
Select count(*) from r1_reshuffle_ao;
 count 
-------
   100
(1 row)

Select gp_execute_on_server(1, 'Select count(*) from r1_reshuffle_ao;');
 gp_execute_on_server 
----------------------
 100
(1 row)

Select gp_execute_on_server(2, 'Select count(*) from r1_reshuffle_ao;');
 gp_execute_on_server 
----------------------
 0
(1 row)

begin;
Alter table r1_reshuffle_ao set with (reshuffle);
Select count(*) from r1_reshuffle_ao;
 count 
-------
   100
(1 row)

abort;
Select count(*) from r1_reshuffle_ao;
 count 
-------
   100
(1 row)

Select gp_execute_on_server(1, 'Select count(*) from r1_reshuffle_ao;');
 gp_execute_on_server 
----------------------
 100
(1 row)

Select gp_execute_on_server(2, 'Select count(*) from r1_reshuffle_ao;');
 gp_execute_on_server 
----------------------
 0
(1 row)

Alter table r1_reshuffle_ao set with (reshuffle);
Select count(*) from r1_reshuffle_ao;
 count 
-------
   100
(1 row)

Select gp_execute_on_server(1, 'Select count(*) from r1_reshuffle_ao;');
 gp_execute_on_server 
----------------------
 100
(1 row)

Select gp_execute_on_server(2, 'Select count(*) from r1_reshuffle_ao;');
 gp_execute_on_server 
----------------------
 100
(1 row)

select numsegments from gp_distribution_policy where localoid='r1_reshuffle_ao'::regclass;
 numsegments 
-------------
           3
(1 row)

drop table r1_reshuffle_ao;
