set allow_system_table_mods=true;
-- Hash distributed tables
Create table ao_t1_reshuffle(a int, b int, c int) with (appendonly=true) distributed by (a);
update gp_distribution_policy  set numsegments=2 where localoid='ao_t1_reshuffle'::regclass;
insert into ao_t1_reshuffle select i,i,0 from generate_series(1,100) I;
Update ao_t1_reshuffle set c = gp_segment_id;
Select gp_segment_id, count(*) from ao_t1_reshuffle group by gp_segment_id;
 gp_segment_id | count 
---------------+-------
             1 |    51
             0 |    49
(2 rows)

begin;
Alter table ao_t1_reshuffle set with (reshuffle);
Select gp_segment_id, count(*) from ao_t1_reshuffle group by gp_segment_id;
 gp_segment_id | count 
---------------+-------
             1 |    40
             0 |    32
             2 |    28
(3 rows)

abort;
Select gp_segment_id, count(*) from ao_t1_reshuffle group by gp_segment_id;
 gp_segment_id | count 
---------------+-------
             1 |    51
             0 |    49
(2 rows)

Alter table ao_t1_reshuffle set with (reshuffle);
Select gp_segment_id, count(*) from ao_t1_reshuffle group by gp_segment_id;
 gp_segment_id | count 
---------------+-------
             1 |    40
             0 |    32
             2 |    28
(3 rows)

select numsegments from gp_distribution_policy where localoid='ao_t1_reshuffle'::regclass;
 numsegments 
-------------
           3
(1 row)

drop table ao_t1_reshuffle;
Create table ao_t1_reshuffle(a int, b int, c int) with (appendonly=true, OIDS) distributed by (a,b);
NOTICE:  OIDS=TRUE is not recommended for user-created tables. Use OIDS=FALSE to prevent wrap-around of the OID counter
update gp_distribution_policy  set numsegments=1 where localoid='ao_t1_reshuffle'::regclass;
insert into ao_t1_reshuffle select i,i,0 from generate_series(1,100) I;
Update ao_t1_reshuffle set c = gp_segment_id;
Select gp_segment_id, count(*) from ao_t1_reshuffle group by gp_segment_id;
 gp_segment_id | count 
---------------+-------
             0 |   100
(1 row)

begin;
Alter table ao_t1_reshuffle set with (reshuffle);
Select gp_segment_id, count(*) from ao_t1_reshuffle group by gp_segment_id;
 gp_segment_id | count 
---------------+-------
             0 |    31
             2 |    34
             1 |    35
(3 rows)

abort;
Select gp_segment_id, count(*) from ao_t1_reshuffle group by gp_segment_id;
 gp_segment_id | count 
---------------+-------
             0 |   100
(1 row)

Alter table ao_t1_reshuffle set with (reshuffle);
Select gp_segment_id, count(*) from ao_t1_reshuffle group by gp_segment_id;
 gp_segment_id | count 
---------------+-------
             2 |    34
             0 |    31
             1 |    35
(3 rows)

select numsegments from gp_distribution_policy where localoid='ao_t1_reshuffle'::regclass;
 numsegments 
-------------
           3
(1 row)

drop table ao_t1_reshuffle;
-- Test NULLs.
Create table ao_t1_reshuffle(a int, b int, c int) with (appendonly=true) distributed by (a,b,c);
update gp_distribution_policy  set numsegments=2 where localoid='ao_t1_reshuffle'::regclass;
insert into ao_t1_reshuffle values
  (1,    1,    1   ),
  (null, 2,    2   ),
  (3,    null, 3   ),
  (4,    4,    null),
  (null, null, 5   ),
  (null, 6,    null),
  (7,    null, null),
  (null, null, null);
Select gp_segment_id, count(*) from ao_t1_reshuffle group by gp_segment_id;
 gp_segment_id | count 
---------------+-------
             1 |     4
             0 |     4
(2 rows)

begin;
Alter table ao_t1_reshuffle set with (reshuffle);
Select gp_segment_id, count(*) from ao_t1_reshuffle group by gp_segment_id;
 gp_segment_id | count 
---------------+-------
             2 |     3
             0 |     2
             1 |     3
(3 rows)

abort;
Select gp_segment_id, count(*) from ao_t1_reshuffle group by gp_segment_id;
 gp_segment_id | count 
---------------+-------
             1 |     4
             0 |     4
(2 rows)

Alter table ao_t1_reshuffle set with (reshuffle);
Select gp_segment_id, count(*) from ao_t1_reshuffle group by gp_segment_id;
 gp_segment_id | count 
---------------+-------
             0 |     2
             2 |     3
             1 |     3
(3 rows)

select numsegments from gp_distribution_policy where localoid='ao_t1_reshuffle'::regclass;
 numsegments 
-------------
           3
(1 row)

drop table ao_t1_reshuffle;
Create table ao_t1_reshuffle(a int, b int, c int) with (appendonly=true) distributed by (a) partition by list(b) (partition ao_t1_reshuffle_1 values(1), partition ao_t1_reshuffle_2 values(2), default partition other);
NOTICE:  CREATE TABLE will create partition "ao_t1_reshuffle_1_prt_ao_t1_reshuffle_1" for table "ao_t1_reshuffle"
NOTICE:  CREATE TABLE will create partition "ao_t1_reshuffle_1_prt_ao_t1_reshuffle_2" for table "ao_t1_reshuffle"
NOTICE:  CREATE TABLE will create partition "ao_t1_reshuffle_1_prt_other" for table "ao_t1_reshuffle"
update gp_distribution_policy set numsegments = 1 where localoid in (select oid from pg_class where relname like 'ao_t1_reshuffle%');
insert into ao_t1_reshuffle select i,i,0 from generate_series(1,100) I;
Select gp_segment_id, count(*) from ao_t1_reshuffle group by gp_segment_id;
 gp_segment_id | count 
---------------+-------
             0 |   100
(1 row)

begin;
Alter table ao_t1_reshuffle set with (reshuffle);
Select gp_segment_id, count(*) from ao_t1_reshuffle group by gp_segment_id;
 gp_segment_id | count 
---------------+-------
             2 |    28
             1 |    40
             0 |    32
(3 rows)

abort;
Select gp_segment_id, count(*) from ao_t1_reshuffle group by gp_segment_id;
 gp_segment_id | count 
---------------+-------
             0 |   100
(1 row)

Alter table ao_t1_reshuffle set with (reshuffle);
Select gp_segment_id, count(*) from ao_t1_reshuffle group by gp_segment_id;
 gp_segment_id | count 
---------------+-------
             2 |    28
             0 |    32
             1 |    40
(3 rows)

select numsegments from gp_distribution_policy where localoid='ao_t1_reshuffle'::regclass;
 numsegments 
-------------
           3
(1 row)

drop table ao_t1_reshuffle;
-- Random distributed tables
Create table ao_r1_reshuffle(a int, b int, c int) with (appendonly=true) distributed randomly;
update gp_distribution_policy  set numsegments=2 where localoid='ao_r1_reshuffle'::regclass;
insert into ao_r1_reshuffle select i,i,0 from generate_series(1,100) I;
Update ao_r1_reshuffle set c = gp_segment_id;
Select count(*) from ao_r1_reshuffle;
 count 
-------
   100
(1 row)

Select count(*) > 0 from ao_r1_reshuffle where gp_segment_id=2;
 ?column? 
----------
 f
(1 row)

begin;
Alter table ao_r1_reshuffle set with (reshuffle);
Select count(*) from ao_r1_reshuffle;
 count 
-------
   100
(1 row)

Select count(*) > 0 from ao_r1_reshuffle where gp_segment_id=2;
 ?column? 
----------
 t
(1 row)

abort;
Select count(*) from ao_r1_reshuffle;
 count 
-------
   100
(1 row)

Select count(*) > 0 from ao_r1_reshuffle where gp_segment_id=2;
 ?column? 
----------
 f
(1 row)

Alter table ao_r1_reshuffle set with (reshuffle);
Select count(*) from ao_r1_reshuffle;
 count 
-------
   100
(1 row)

Select count(*) > 0 from ao_r1_reshuffle where gp_segment_id=2;
 ?column? 
----------
 t
(1 row)

select numsegments from gp_distribution_policy where localoid='ao_r1_reshuffle'::regclass;
 numsegments 
-------------
           3
(1 row)

drop table ao_r1_reshuffle;
Create table ao_r1_reshuffle(a int, b int, c int) with (appendonly=true, OIDS) distributed randomly;
NOTICE:  OIDS=TRUE is not recommended for user-created tables. Use OIDS=FALSE to prevent wrap-around of the OID counter
update gp_distribution_policy  set numsegments=2 where localoid='ao_r1_reshuffle'::regclass;
insert into ao_r1_reshuffle select i,i,0 from generate_series(1,100) I;
Update ao_r1_reshuffle set c = gp_segment_id;
Select count(*) from ao_r1_reshuffle;
 count 
-------
   100
(1 row)

Select count(*) > 0 from ao_r1_reshuffle where gp_segment_id=2;
 ?column? 
----------
 f
(1 row)

begin;
Alter table ao_r1_reshuffle set with (reshuffle);
Select count(*) from ao_r1_reshuffle;
 count 
-------
   100
(1 row)

Select count(*) > 0 from ao_r1_reshuffle where gp_segment_id=2;
 ?column? 
----------
 t
(1 row)

abort;
Select count(*) from ao_r1_reshuffle;
 count 
-------
   100
(1 row)

Select count(*) > 0 from ao_r1_reshuffle where gp_segment_id=2;
 ?column? 
----------
 f
(1 row)

Alter table ao_r1_reshuffle set with (reshuffle);
Select count(*) from ao_r1_reshuffle;
 count 
-------
   100
(1 row)

Select count(*) > 0 from ao_r1_reshuffle where gp_segment_id=2;
 ?column? 
----------
 t
(1 row)

select numsegments from gp_distribution_policy where localoid='ao_r1_reshuffle'::regclass;
 numsegments 
-------------
           3
(1 row)

drop table ao_r1_reshuffle;
Create table ao_r1_reshuffle(a int, b int, c int) with (appendonly=true) distributed randomly partition by list(b) (partition ao_r1_reshuffle_1 values(1), partition ao_r1_reshuffle_2 values(2), default partition other);
NOTICE:  CREATE TABLE will create partition "ao_r1_reshuffle_1_prt_ao_r1_reshuffle_1" for table "ao_r1_reshuffle"
NOTICE:  CREATE TABLE will create partition "ao_r1_reshuffle_1_prt_ao_r1_reshuffle_2" for table "ao_r1_reshuffle"
NOTICE:  CREATE TABLE will create partition "ao_r1_reshuffle_1_prt_other" for table "ao_r1_reshuffle"
update gp_distribution_policy set numsegments = 2 where localoid in (select oid from pg_class where relname like 'ao_r1_reshuffle%');
insert into ao_r1_reshuffle select i,i,0 from generate_series(1,100) I;
Select count(*) from ao_r1_reshuffle;
 count 
-------
   100
(1 row)

Select count(*) > 0 from ao_r1_reshuffle where gp_segment_id=2;
 ?column? 
----------
 f
(1 row)

begin;
Alter table ao_r1_reshuffle set with (reshuffle);
Select count(*) from ao_r1_reshuffle;
 count 
-------
   100
(1 row)

Select count(*) > 0 from ao_r1_reshuffle where gp_segment_id=2;
 ?column? 
----------
 t
(1 row)

abort;
Select count(*) from ao_r1_reshuffle;
 count 
-------
   100
(1 row)

Select count(*) > 0 from ao_r1_reshuffle where gp_segment_id=2;
 ?column? 
----------
 f
(1 row)

Alter table ao_r1_reshuffle set with (reshuffle);
Select count(*) from ao_r1_reshuffle;
 count 
-------
   100
(1 row)

Select count(*) > 0 from ao_r1_reshuffle where gp_segment_id=2;
 ?column? 
----------
 t
(1 row)

select numsegments from gp_distribution_policy where localoid='ao_r1_reshuffle'::regclass;
 numsegments 
-------------
           3
(1 row)

drop table ao_r1_reshuffle;
-- Replicated tables
Create table ao_r1_reshuffle(a int, b int, c int) with (appendonly=true) distributed replicated;
select update_numsegments_in_policy('ao_r1_reshuffle'::regclass, 1);
 update_numsegments_in_policy 
------------------------------
 
(1 row)

insert into ao_r1_reshuffle select i,i,0 from generate_series(1,100) I;
Select gp_segment_id, count(*) from gp_dist_random('ao_r1_reshuffle') group by gp_segment_id;
 gp_segment_id | count 
---------------+-------
             0 |   100
(1 row)

begin;
Alter table ao_r1_reshuffle set with (reshuffle);
Select gp_segment_id, count(*) from gp_dist_random('ao_r1_reshuffle') group by gp_segment_id;
 gp_segment_id | count 
---------------+-------
             0 |   100
             2 |   100
             1 |   100
(3 rows)

abort;
Select gp_segment_id, count(*) from gp_dist_random('ao_r1_reshuffle') group by gp_segment_id;
 gp_segment_id | count 
---------------+-------
             0 |   100
(1 row)

Alter table ao_r1_reshuffle set with (reshuffle);
Select gp_segment_id, count(*) from gp_dist_random('ao_r1_reshuffle') group by gp_segment_id;
 gp_segment_id | count 
---------------+-------
             0 |   100
             2 |   100
             1 |   100
(3 rows)

select numsegments from gp_distribution_policy where localoid='ao_r1_reshuffle'::regclass;
 numsegments 
-------------
           3
(1 row)

drop table ao_r1_reshuffle;
--
Create table ao_r1_reshuffle(a int, b int, c int) with (appendonly=true, OIDS) distributed replicated;
NOTICE:  OIDS=TRUE is not recommended for user-created tables. Use OIDS=FALSE to prevent wrap-around of the OID counter
select update_numsegments_in_policy('ao_r1_reshuffle'::regclass, 1);
 update_numsegments_in_policy 
------------------------------
 
(1 row)

insert into ao_r1_reshuffle select i,i,0 from generate_series(1,100) I;
Select gp_segment_id, count(*) from gp_dist_random('ao_r1_reshuffle') group by gp_segment_id;
 gp_segment_id | count 
---------------+-------
             0 |   100
(1 row)

begin;
Alter table ao_r1_reshuffle set with (reshuffle);
Select gp_segment_id, count(*) from gp_dist_random('ao_r1_reshuffle') group by gp_segment_id;
 gp_segment_id | count 
---------------+-------
             0 |   100
             2 |   100
             1 |   100
(3 rows)

abort;
Select gp_segment_id, count(*) from gp_dist_random('ao_r1_reshuffle') group by gp_segment_id;
 gp_segment_id | count 
---------------+-------
             0 |   100
(1 row)

Alter table ao_r1_reshuffle set with (reshuffle);
Select gp_segment_id, count(*) from gp_dist_random('ao_r1_reshuffle') group by gp_segment_id;
 gp_segment_id | count 
---------------+-------
             0 |   100
             2 |   100
             1 |   100
(3 rows)

select numsegments from gp_distribution_policy where localoid='ao_r1_reshuffle'::regclass;
 numsegments 
-------------
           3
(1 row)

drop table ao_r1_reshuffle;
-- multi-level partition tables
CREATE TABLE part_ao_t1_reshuffle(a int, b int, c int, d int, e int) with (appendonly=true)
DISTRIBUTED BY(a)
PARTITION BY RANGE (b)
    SUBPARTITION BY RANGE (c)
        SUBPARTITION TEMPLATE (
            START(1) END (3) EVERY(1),
            DEFAULT SUBPARTITION others_c)
    SUBPARTITION BY LIST (d)
        SUBPARTITION TEMPLATE (
            SUBPARTITION one VALUES (1),
            SUBPARTITION two VALUES (2),
            SUBPARTITION three VALUES (3),
            DEFAULT SUBPARTITION others_d)
( START (1) END (2) EVERY (1),
    DEFAULT PARTITION other_b);
NOTICE:  CREATE TABLE will create partition "part_ao_t1_reshuffle_1_prt_other_b" for table "part_ao_t1_reshuffle"
NOTICE:  CREATE TABLE will create partition "part_ao_t1_reshuffle_1_prt_other_b_2_prt_others_c" for table "part_ao_t1_reshuffle_1_prt_other_b"
NOTICE:  CREATE TABLE will create partition "part_ao_t1_reshuffle_1_prt_other_b_2_prt_others_c_3_prt_one" for table "part_ao_t1_reshuffle_1_prt_other_b_2_prt_others_c"
NOTICE:  CREATE TABLE will create partition "part_ao_t1_reshuffle_1_prt_other_b_2_prt_others_c_3_prt_two" for table "part_ao_t1_reshuffle_1_prt_other_b_2_prt_others_c"
NOTICE:  CREATE TABLE will create partition "part_ao_t1_reshuffle_1_prt_other_b_2_prt_others_c_3_prt_three" for table "part_ao_t1_reshuffle_1_prt_other_b_2_prt_others_c"
NOTICE:  CREATE TABLE will create partition "part_ao_t1_reshuffle_1_prt_other_b_2_prt_others__3_prt_others_d" for table "part_ao_t1_reshuffle_1_prt_other_b_2_prt_others_c"
NOTICE:  CREATE TABLE will create partition "part_ao_t1_reshuffle_1_prt_other_b_2_prt_2" for table "part_ao_t1_reshuffle_1_prt_other_b"
NOTICE:  CREATE TABLE will create partition "part_ao_t1_reshuffle_1_prt_other_b_2_prt_2_3_prt_one" for table "part_ao_t1_reshuffle_1_prt_other_b_2_prt_2"
NOTICE:  CREATE TABLE will create partition "part_ao_t1_reshuffle_1_prt_other_b_2_prt_2_3_prt_two" for table "part_ao_t1_reshuffle_1_prt_other_b_2_prt_2"
NOTICE:  CREATE TABLE will create partition "part_ao_t1_reshuffle_1_prt_other_b_2_prt_2_3_prt_three" for table "part_ao_t1_reshuffle_1_prt_other_b_2_prt_2"
NOTICE:  CREATE TABLE will create partition "part_ao_t1_reshuffle_1_prt_other_b_2_prt_2_3_prt_others_d" for table "part_ao_t1_reshuffle_1_prt_other_b_2_prt_2"
NOTICE:  CREATE TABLE will create partition "part_ao_t1_reshuffle_1_prt_other_b_2_prt_3" for table "part_ao_t1_reshuffle_1_prt_other_b"
NOTICE:  CREATE TABLE will create partition "part_ao_t1_reshuffle_1_prt_other_b_2_prt_3_3_prt_one" for table "part_ao_t1_reshuffle_1_prt_other_b_2_prt_3"
NOTICE:  CREATE TABLE will create partition "part_ao_t1_reshuffle_1_prt_other_b_2_prt_3_3_prt_two" for table "part_ao_t1_reshuffle_1_prt_other_b_2_prt_3"
NOTICE:  CREATE TABLE will create partition "part_ao_t1_reshuffle_1_prt_other_b_2_prt_3_3_prt_three" for table "part_ao_t1_reshuffle_1_prt_other_b_2_prt_3"
NOTICE:  CREATE TABLE will create partition "part_ao_t1_reshuffle_1_prt_other_b_2_prt_3_3_prt_others_d" for table "part_ao_t1_reshuffle_1_prt_other_b_2_prt_3"
NOTICE:  CREATE TABLE will create partition "part_ao_t1_reshuffle_1_prt_2" for table "part_ao_t1_reshuffle"
NOTICE:  CREATE TABLE will create partition "part_ao_t1_reshuffle_1_prt_2_2_prt_others_c" for table "part_ao_t1_reshuffle_1_prt_2"
NOTICE:  CREATE TABLE will create partition "part_ao_t1_reshuffle_1_prt_2_2_prt_others_c_3_prt_one" for table "part_ao_t1_reshuffle_1_prt_2_2_prt_others_c"
NOTICE:  CREATE TABLE will create partition "part_ao_t1_reshuffle_1_prt_2_2_prt_others_c_3_prt_two" for table "part_ao_t1_reshuffle_1_prt_2_2_prt_others_c"
NOTICE:  CREATE TABLE will create partition "part_ao_t1_reshuffle_1_prt_2_2_prt_others_c_3_prt_three" for table "part_ao_t1_reshuffle_1_prt_2_2_prt_others_c"
NOTICE:  CREATE TABLE will create partition "part_ao_t1_reshuffle_1_prt_2_2_prt_others_c_3_prt_others_d" for table "part_ao_t1_reshuffle_1_prt_2_2_prt_others_c"
NOTICE:  CREATE TABLE will create partition "part_ao_t1_reshuffle_1_prt_2_2_prt_2" for table "part_ao_t1_reshuffle_1_prt_2"
NOTICE:  CREATE TABLE will create partition "part_ao_t1_reshuffle_1_prt_2_2_prt_2_3_prt_one" for table "part_ao_t1_reshuffle_1_prt_2_2_prt_2"
NOTICE:  CREATE TABLE will create partition "part_ao_t1_reshuffle_1_prt_2_2_prt_2_3_prt_two" for table "part_ao_t1_reshuffle_1_prt_2_2_prt_2"
NOTICE:  CREATE TABLE will create partition "part_ao_t1_reshuffle_1_prt_2_2_prt_2_3_prt_three" for table "part_ao_t1_reshuffle_1_prt_2_2_prt_2"
NOTICE:  CREATE TABLE will create partition "part_ao_t1_reshuffle_1_prt_2_2_prt_2_3_prt_others_d" for table "part_ao_t1_reshuffle_1_prt_2_2_prt_2"
NOTICE:  CREATE TABLE will create partition "part_ao_t1_reshuffle_1_prt_2_2_prt_3" for table "part_ao_t1_reshuffle_1_prt_2"
NOTICE:  CREATE TABLE will create partition "part_ao_t1_reshuffle_1_prt_2_2_prt_3_3_prt_one" for table "part_ao_t1_reshuffle_1_prt_2_2_prt_3"
NOTICE:  CREATE TABLE will create partition "part_ao_t1_reshuffle_1_prt_2_2_prt_3_3_prt_two" for table "part_ao_t1_reshuffle_1_prt_2_2_prt_3"
NOTICE:  CREATE TABLE will create partition "part_ao_t1_reshuffle_1_prt_2_2_prt_3_3_prt_three" for table "part_ao_t1_reshuffle_1_prt_2_2_prt_3"
NOTICE:  CREATE TABLE will create partition "part_ao_t1_reshuffle_1_prt_2_2_prt_3_3_prt_others_d" for table "part_ao_t1_reshuffle_1_prt_2_2_prt_3"
update gp_distribution_policy  set numsegments=2 where localoid in (select oid from pg_class where relname like 'part_ao_t1_reshuffle%');
insert into part_ao_t1_reshuffle select i,i%3,i%4,i%5,i from generate_series(1,100) I;
Update part_ao_t1_reshuffle set e = gp_segment_id;
Select gp_segment_id, count(*) from part_ao_t1_reshuffle group by gp_segment_id;
 gp_segment_id | count 
---------------+-------
             1 |    51
             0 |    49
(2 rows)

begin;
Alter table part_ao_t1_reshuffle set with (reshuffle);
Select gp_segment_id, count(*) from part_ao_t1_reshuffle group by gp_segment_id;
 gp_segment_id | count 
---------------+-------
             0 |    32
             2 |    28
             1 |    40
(3 rows)

abort;
Select gp_segment_id, count(*) from part_ao_t1_reshuffle group by gp_segment_id;
 gp_segment_id | count 
---------------+-------
             1 |    51
             0 |    49
(2 rows)

Alter table part_ao_t1_reshuffle set with (reshuffle);
Select gp_segment_id, count(*) from part_ao_t1_reshuffle group by gp_segment_id;
 gp_segment_id | count 
---------------+-------
             0 |    32
             2 |    28
             1 |    40
(3 rows)

select numsegments from gp_distribution_policy where localoid='part_ao_t1_reshuffle'::regclass;
 numsegments 
-------------
           3
(1 row)

drop table part_ao_t1_reshuffle;
--
CREATE TABLE part_ao_t1_reshuffle(a int, b int, c int, d int, e int) with (appendonly=true)
DISTRIBUTED RANDOMLY
PARTITION BY RANGE (b)
    SUBPARTITION BY RANGE (c)
        SUBPARTITION TEMPLATE (
            START(1) END (3) EVERY(1),
            DEFAULT SUBPARTITION others_c)
    SUBPARTITION BY LIST (d)
        SUBPARTITION TEMPLATE (
            SUBPARTITION one VALUES (1),
            SUBPARTITION two VALUES (2),
            SUBPARTITION three VALUES (3),
            DEFAULT SUBPARTITION others_d)
( START (1) END (2) EVERY (1),
    DEFAULT PARTITION other_b);
NOTICE:  CREATE TABLE will create partition "part_ao_t1_reshuffle_1_prt_other_b" for table "part_ao_t1_reshuffle"
NOTICE:  CREATE TABLE will create partition "part_ao_t1_reshuffle_1_prt_other_b_2_prt_others_c" for table "part_ao_t1_reshuffle_1_prt_other_b"
NOTICE:  CREATE TABLE will create partition "part_ao_t1_reshuffle_1_prt_other_b_2_prt_others_c_3_prt_one" for table "part_ao_t1_reshuffle_1_prt_other_b_2_prt_others_c"
NOTICE:  CREATE TABLE will create partition "part_ao_t1_reshuffle_1_prt_other_b_2_prt_others_c_3_prt_two" for table "part_ao_t1_reshuffle_1_prt_other_b_2_prt_others_c"
NOTICE:  CREATE TABLE will create partition "part_ao_t1_reshuffle_1_prt_other_b_2_prt_others_c_3_prt_three" for table "part_ao_t1_reshuffle_1_prt_other_b_2_prt_others_c"
NOTICE:  CREATE TABLE will create partition "part_ao_t1_reshuffle_1_prt_other_b_2_prt_others__3_prt_others_d" for table "part_ao_t1_reshuffle_1_prt_other_b_2_prt_others_c"
NOTICE:  CREATE TABLE will create partition "part_ao_t1_reshuffle_1_prt_other_b_2_prt_2" for table "part_ao_t1_reshuffle_1_prt_other_b"
NOTICE:  CREATE TABLE will create partition "part_ao_t1_reshuffle_1_prt_other_b_2_prt_2_3_prt_one" for table "part_ao_t1_reshuffle_1_prt_other_b_2_prt_2"
NOTICE:  CREATE TABLE will create partition "part_ao_t1_reshuffle_1_prt_other_b_2_prt_2_3_prt_two" for table "part_ao_t1_reshuffle_1_prt_other_b_2_prt_2"
NOTICE:  CREATE TABLE will create partition "part_ao_t1_reshuffle_1_prt_other_b_2_prt_2_3_prt_three" for table "part_ao_t1_reshuffle_1_prt_other_b_2_prt_2"
NOTICE:  CREATE TABLE will create partition "part_ao_t1_reshuffle_1_prt_other_b_2_prt_2_3_prt_others_d" for table "part_ao_t1_reshuffle_1_prt_other_b_2_prt_2"
NOTICE:  CREATE TABLE will create partition "part_ao_t1_reshuffle_1_prt_other_b_2_prt_3" for table "part_ao_t1_reshuffle_1_prt_other_b"
NOTICE:  CREATE TABLE will create partition "part_ao_t1_reshuffle_1_prt_other_b_2_prt_3_3_prt_one" for table "part_ao_t1_reshuffle_1_prt_other_b_2_prt_3"
NOTICE:  CREATE TABLE will create partition "part_ao_t1_reshuffle_1_prt_other_b_2_prt_3_3_prt_two" for table "part_ao_t1_reshuffle_1_prt_other_b_2_prt_3"
NOTICE:  CREATE TABLE will create partition "part_ao_t1_reshuffle_1_prt_other_b_2_prt_3_3_prt_three" for table "part_ao_t1_reshuffle_1_prt_other_b_2_prt_3"
NOTICE:  CREATE TABLE will create partition "part_ao_t1_reshuffle_1_prt_other_b_2_prt_3_3_prt_others_d" for table "part_ao_t1_reshuffle_1_prt_other_b_2_prt_3"
NOTICE:  CREATE TABLE will create partition "part_ao_t1_reshuffle_1_prt_2" for table "part_ao_t1_reshuffle"
NOTICE:  CREATE TABLE will create partition "part_ao_t1_reshuffle_1_prt_2_2_prt_others_c" for table "part_ao_t1_reshuffle_1_prt_2"
NOTICE:  CREATE TABLE will create partition "part_ao_t1_reshuffle_1_prt_2_2_prt_others_c_3_prt_one" for table "part_ao_t1_reshuffle_1_prt_2_2_prt_others_c"
NOTICE:  CREATE TABLE will create partition "part_ao_t1_reshuffle_1_prt_2_2_prt_others_c_3_prt_two" for table "part_ao_t1_reshuffle_1_prt_2_2_prt_others_c"
NOTICE:  CREATE TABLE will create partition "part_ao_t1_reshuffle_1_prt_2_2_prt_others_c_3_prt_three" for table "part_ao_t1_reshuffle_1_prt_2_2_prt_others_c"
NOTICE:  CREATE TABLE will create partition "part_ao_t1_reshuffle_1_prt_2_2_prt_others_c_3_prt_others_d" for table "part_ao_t1_reshuffle_1_prt_2_2_prt_others_c"
NOTICE:  CREATE TABLE will create partition "part_ao_t1_reshuffle_1_prt_2_2_prt_2" for table "part_ao_t1_reshuffle_1_prt_2"
NOTICE:  CREATE TABLE will create partition "part_ao_t1_reshuffle_1_prt_2_2_prt_2_3_prt_one" for table "part_ao_t1_reshuffle_1_prt_2_2_prt_2"
NOTICE:  CREATE TABLE will create partition "part_ao_t1_reshuffle_1_prt_2_2_prt_2_3_prt_two" for table "part_ao_t1_reshuffle_1_prt_2_2_prt_2"
NOTICE:  CREATE TABLE will create partition "part_ao_t1_reshuffle_1_prt_2_2_prt_2_3_prt_three" for table "part_ao_t1_reshuffle_1_prt_2_2_prt_2"
NOTICE:  CREATE TABLE will create partition "part_ao_t1_reshuffle_1_prt_2_2_prt_2_3_prt_others_d" for table "part_ao_t1_reshuffle_1_prt_2_2_prt_2"
NOTICE:  CREATE TABLE will create partition "part_ao_t1_reshuffle_1_prt_2_2_prt_3" for table "part_ao_t1_reshuffle_1_prt_2"
NOTICE:  CREATE TABLE will create partition "part_ao_t1_reshuffle_1_prt_2_2_prt_3_3_prt_one" for table "part_ao_t1_reshuffle_1_prt_2_2_prt_3"
NOTICE:  CREATE TABLE will create partition "part_ao_t1_reshuffle_1_prt_2_2_prt_3_3_prt_two" for table "part_ao_t1_reshuffle_1_prt_2_2_prt_3"
NOTICE:  CREATE TABLE will create partition "part_ao_t1_reshuffle_1_prt_2_2_prt_3_3_prt_three" for table "part_ao_t1_reshuffle_1_prt_2_2_prt_3"
NOTICE:  CREATE TABLE will create partition "part_ao_t1_reshuffle_1_prt_2_2_prt_3_3_prt_others_d" for table "part_ao_t1_reshuffle_1_prt_2_2_prt_3"
update gp_distribution_policy  set numsegments=2 where localoid in (select oid from pg_class where relname like 'part_ao_t1_reshuffle%');
insert into part_ao_t1_reshuffle select i,i%3,i%4,i%5,i from generate_series(1,100) I;
Update part_ao_t1_reshuffle set e = gp_segment_id;
Select count(*) from part_ao_t1_reshuffle;
 count 
-------
   100
(1 row)

Select count(*) > 0 from part_ao_t1_reshuffle where gp_segment_id=2;
 ?column? 
----------
 f
(1 row)

begin;
Alter table part_ao_t1_reshuffle set with (reshuffle);
Select count(*) from part_ao_t1_reshuffle;
 count 
-------
   100
(1 row)

Select count(*) > 0 from part_ao_t1_reshuffle where gp_segment_id=2;
 ?column? 
----------
 t
(1 row)

abort;
Select count(*) from part_ao_t1_reshuffle;
 count 
-------
   100
(1 row)

Select count(*) > 0 from part_ao_t1_reshuffle where gp_segment_id=2;
 ?column? 
----------
 f
(1 row)

Alter table part_ao_t1_reshuffle set with (reshuffle);
Select count(*) from part_ao_t1_reshuffle;
 count 
-------
   100
(1 row)

Select count(*) > 0 from part_ao_t1_reshuffle where gp_segment_id=2;
 ?column? 
----------
 t
(1 row)

select numsegments from gp_distribution_policy where localoid='part_ao_t1_reshuffle'::regclass;
 numsegments 
-------------
           3
(1 row)

drop table part_ao_t1_reshuffle;
-- only reshuffle leaf partition
CREATE TABLE part_ao_t1_reshuffle(a int, b int, c int, d int, e int) with (appendonly=true)
DISTRIBUTED BY(a)
PARTITION BY RANGE (b)
    SUBPARTITION BY RANGE (c)
        SUBPARTITION TEMPLATE (
            START(1) END (3) EVERY(1),
            DEFAULT SUBPARTITION others_c)
    SUBPARTITION BY LIST (d)
        SUBPARTITION TEMPLATE (
            SUBPARTITION one VALUES (1),
            SUBPARTITION two VALUES (2),
            SUBPARTITION three VALUES (3),
            DEFAULT SUBPARTITION others_d)
( START (1) END (2) EVERY (1),
    DEFAULT PARTITION other_b);
NOTICE:  CREATE TABLE will create partition "part_ao_t1_reshuffle_1_prt_other_b" for table "part_ao_t1_reshuffle"
NOTICE:  CREATE TABLE will create partition "part_ao_t1_reshuffle_1_prt_other_b_2_prt_others_c" for table "part_ao_t1_reshuffle_1_prt_other_b"
NOTICE:  CREATE TABLE will create partition "part_ao_t1_reshuffle_1_prt_other_b_2_prt_others_c_3_prt_one" for table "part_ao_t1_reshuffle_1_prt_other_b_2_prt_others_c"
NOTICE:  CREATE TABLE will create partition "part_ao_t1_reshuffle_1_prt_other_b_2_prt_others_c_3_prt_two" for table "part_ao_t1_reshuffle_1_prt_other_b_2_prt_others_c"
NOTICE:  CREATE TABLE will create partition "part_ao_t1_reshuffle_1_prt_other_b_2_prt_others_c_3_prt_three" for table "part_ao_t1_reshuffle_1_prt_other_b_2_prt_others_c"
NOTICE:  CREATE TABLE will create partition "part_ao_t1_reshuffle_1_prt_other_b_2_prt_others__3_prt_others_d" for table "part_ao_t1_reshuffle_1_prt_other_b_2_prt_others_c"
NOTICE:  CREATE TABLE will create partition "part_ao_t1_reshuffle_1_prt_other_b_2_prt_2" for table "part_ao_t1_reshuffle_1_prt_other_b"
NOTICE:  CREATE TABLE will create partition "part_ao_t1_reshuffle_1_prt_other_b_2_prt_2_3_prt_one" for table "part_ao_t1_reshuffle_1_prt_other_b_2_prt_2"
NOTICE:  CREATE TABLE will create partition "part_ao_t1_reshuffle_1_prt_other_b_2_prt_2_3_prt_two" for table "part_ao_t1_reshuffle_1_prt_other_b_2_prt_2"
NOTICE:  CREATE TABLE will create partition "part_ao_t1_reshuffle_1_prt_other_b_2_prt_2_3_prt_three" for table "part_ao_t1_reshuffle_1_prt_other_b_2_prt_2"
NOTICE:  CREATE TABLE will create partition "part_ao_t1_reshuffle_1_prt_other_b_2_prt_2_3_prt_others_d" for table "part_ao_t1_reshuffle_1_prt_other_b_2_prt_2"
NOTICE:  CREATE TABLE will create partition "part_ao_t1_reshuffle_1_prt_other_b_2_prt_3" for table "part_ao_t1_reshuffle_1_prt_other_b"
NOTICE:  CREATE TABLE will create partition "part_ao_t1_reshuffle_1_prt_other_b_2_prt_3_3_prt_one" for table "part_ao_t1_reshuffle_1_prt_other_b_2_prt_3"
NOTICE:  CREATE TABLE will create partition "part_ao_t1_reshuffle_1_prt_other_b_2_prt_3_3_prt_two" for table "part_ao_t1_reshuffle_1_prt_other_b_2_prt_3"
NOTICE:  CREATE TABLE will create partition "part_ao_t1_reshuffle_1_prt_other_b_2_prt_3_3_prt_three" for table "part_ao_t1_reshuffle_1_prt_other_b_2_prt_3"
NOTICE:  CREATE TABLE will create partition "part_ao_t1_reshuffle_1_prt_other_b_2_prt_3_3_prt_others_d" for table "part_ao_t1_reshuffle_1_prt_other_b_2_prt_3"
NOTICE:  CREATE TABLE will create partition "part_ao_t1_reshuffle_1_prt_2" for table "part_ao_t1_reshuffle"
NOTICE:  CREATE TABLE will create partition "part_ao_t1_reshuffle_1_prt_2_2_prt_others_c" for table "part_ao_t1_reshuffle_1_prt_2"
NOTICE:  CREATE TABLE will create partition "part_ao_t1_reshuffle_1_prt_2_2_prt_others_c_3_prt_one" for table "part_ao_t1_reshuffle_1_prt_2_2_prt_others_c"
NOTICE:  CREATE TABLE will create partition "part_ao_t1_reshuffle_1_prt_2_2_prt_others_c_3_prt_two" for table "part_ao_t1_reshuffle_1_prt_2_2_prt_others_c"
NOTICE:  CREATE TABLE will create partition "part_ao_t1_reshuffle_1_prt_2_2_prt_others_c_3_prt_three" for table "part_ao_t1_reshuffle_1_prt_2_2_prt_others_c"
NOTICE:  CREATE TABLE will create partition "part_ao_t1_reshuffle_1_prt_2_2_prt_others_c_3_prt_others_d" for table "part_ao_t1_reshuffle_1_prt_2_2_prt_others_c"
NOTICE:  CREATE TABLE will create partition "part_ao_t1_reshuffle_1_prt_2_2_prt_2" for table "part_ao_t1_reshuffle_1_prt_2"
NOTICE:  CREATE TABLE will create partition "part_ao_t1_reshuffle_1_prt_2_2_prt_2_3_prt_one" for table "part_ao_t1_reshuffle_1_prt_2_2_prt_2"
NOTICE:  CREATE TABLE will create partition "part_ao_t1_reshuffle_1_prt_2_2_prt_2_3_prt_two" for table "part_ao_t1_reshuffle_1_prt_2_2_prt_2"
NOTICE:  CREATE TABLE will create partition "part_ao_t1_reshuffle_1_prt_2_2_prt_2_3_prt_three" for table "part_ao_t1_reshuffle_1_prt_2_2_prt_2"
NOTICE:  CREATE TABLE will create partition "part_ao_t1_reshuffle_1_prt_2_2_prt_2_3_prt_others_d" for table "part_ao_t1_reshuffle_1_prt_2_2_prt_2"
NOTICE:  CREATE TABLE will create partition "part_ao_t1_reshuffle_1_prt_2_2_prt_3" for table "part_ao_t1_reshuffle_1_prt_2"
NOTICE:  CREATE TABLE will create partition "part_ao_t1_reshuffle_1_prt_2_2_prt_3_3_prt_one" for table "part_ao_t1_reshuffle_1_prt_2_2_prt_3"
NOTICE:  CREATE TABLE will create partition "part_ao_t1_reshuffle_1_prt_2_2_prt_3_3_prt_two" for table "part_ao_t1_reshuffle_1_prt_2_2_prt_3"
NOTICE:  CREATE TABLE will create partition "part_ao_t1_reshuffle_1_prt_2_2_prt_3_3_prt_three" for table "part_ao_t1_reshuffle_1_prt_2_2_prt_3"
NOTICE:  CREATE TABLE will create partition "part_ao_t1_reshuffle_1_prt_2_2_prt_3_3_prt_others_d" for table "part_ao_t1_reshuffle_1_prt_2_2_prt_3"
update gp_distribution_policy  set numsegments=2 where localoid in (select oid from pg_class where relname like 'part_ao_t1_reshuffle%');
insert into part_ao_t1_reshuffle select i,i%3,i%4,i%5,i from generate_series(1,100) I;
Update part_ao_t1_reshuffle set e = gp_segment_id;
select gp_segment_id, * from part_ao_t1_reshuffle_1_prt_other_b_2_prt_2_3_prt_others_d;
 gp_segment_id | a  | b | c | d | e 
---------------+----+---+---+---+---
             1 |  5 | 2 | 1 | 0 | 1
             1 |  9 | 0 | 1 | 4 | 1
             1 | 45 | 0 | 1 | 0 | 1
             0 | 29 | 2 | 1 | 4 | 0
             0 | 65 | 2 | 1 | 0 | 0
             0 | 69 | 0 | 1 | 4 | 0
             0 | 89 | 2 | 1 | 4 | 0
(7 rows)

begin;
Alter table part_ao_t1_reshuffle_1_prt_other_b_2_prt_2_3_prt_others_d set with (reshuffle);
Select gp_segment_id, * from part_ao_t1_reshuffle_1_prt_other_b_2_prt_2_3_prt_others_d;
 gp_segment_id | a  | b | c | d | e 
---------------+----+---+---+---+---
             1 |  5 | 2 | 1 | 0 | 1
             1 |  9 | 0 | 1 | 4 | 1
             1 | 45 | 0 | 1 | 0 | 1
             2 | 65 | 2 | 1 | 0 | 0
             2 | 69 | 0 | 1 | 4 | 0
             0 | 29 | 2 | 1 | 4 | 0
             0 | 89 | 2 | 1 | 4 | 0
(7 rows)

abort;
Select gp_segment_id, * from part_ao_t1_reshuffle_1_prt_other_b_2_prt_2_3_prt_others_d;
 gp_segment_id | a  | b | c | d | e 
---------------+----+---+---+---+---
             1 |  5 | 2 | 1 | 0 | 1
             1 |  9 | 0 | 1 | 4 | 1
             1 | 45 | 0 | 1 | 0 | 1
             0 | 29 | 2 | 1 | 4 | 0
             0 | 65 | 2 | 1 | 0 | 0
             0 | 69 | 0 | 1 | 4 | 0
             0 | 89 | 2 | 1 | 4 | 0
(7 rows)

Alter table part_ao_t1_reshuffle_1_prt_other_b_2_prt_2_3_prt_others_d set with (reshuffle);
Select gp_segment_id, * from part_ao_t1_reshuffle_1_prt_other_b_2_prt_2_3_prt_others_d;
 gp_segment_id | a  | b | c | d | e 
---------------+----+---+---+---+---
             2 | 65 | 2 | 1 | 0 | 0
             2 | 69 | 0 | 1 | 4 | 0
             1 |  5 | 2 | 1 | 0 | 1
             1 |  9 | 0 | 1 | 4 | 1
             1 | 45 | 0 | 1 | 0 | 1
             0 | 29 | 2 | 1 | 4 | 0
             0 | 89 | 2 | 1 | 4 | 0
(7 rows)

-- try to reshuffle root partition, it will raise a notice
Alter table part_ao_t1_reshuffle set with (reshuffle);
NOTICE:  Do not need to reshuffle public.part_ao_t1_reshuffle_1_prt_other_b_2_prt_2_3_prt_others_d
Select gp_segment_id, count(*) from part_ao_t1_reshuffle group by gp_segment_id;
 gp_segment_id | count 
---------------+-------
             2 |    28
             0 |    32
             1 |    40
(3 rows)

drop table part_ao_t1_reshuffle;
