set allow_system_table_mods=true;
-- Hash distributed tables
Create table t1_reshuffle_aoco(a int, b int, c int) with (appendonly = true, orientation = column) distributed by (a);
update gp_distribution_policy  set numsegments=2 where localoid='t1_reshuffle_aoco'::regclass;
insert into t1_reshuffle_aoco select i,i,0 from generate_series(1,100) I;
Update t1_reshuffle_aoco set c = gp_segment_id;
Select gp_segment_id, count(*) from t1_reshuffle_aoco group by gp_segment_id;
 gp_segment_id | count 
---------------+-------
             1 |    51
             0 |    49
(2 rows)

begin;
Alter table t1_reshuffle_aoco set with (reshuffle);
Select gp_segment_id, count(*) from t1_reshuffle_aoco group by gp_segment_id;
 gp_segment_id | count 
---------------+-------
             0 |    32
             1 |    40
             2 |    28
(3 rows)

abort;
Select gp_segment_id, count(*) from t1_reshuffle_aoco group by gp_segment_id;
 gp_segment_id | count 
---------------+-------
             1 |    51
             0 |    49
(2 rows)

Alter table t1_reshuffle_aoco set with (reshuffle);
Select gp_segment_id, count(*) from t1_reshuffle_aoco group by gp_segment_id;
 gp_segment_id | count 
---------------+-------
             0 |    32
             2 |    28
             1 |    40
(3 rows)

select numsegments from gp_distribution_policy where localoid='t1_reshuffle_aoco'::regclass;
 numsegments 
-------------
           3
(1 row)

drop table t1_reshuffle_aoco;
-- Test NULLs.
Create table t1_reshuffle_aoco(a int, b int, c int) with (appendonly = true, orientation = column) distributed by (a,b,c);
update gp_distribution_policy  set numsegments=2 where localoid='t1_reshuffle_aoco'::regclass;
insert into t1_reshuffle_aoco values
  (1,    1,    1   ),
  (null, 2,    2   ),
  (3,    null, 3   ),
  (4,    4,    null),
  (null, null, 5   ),
  (null, 6,    null),
  (7,    null, null),
  (null, null, null);
Select gp_segment_id, count(*) from t1_reshuffle_aoco group by gp_segment_id;
 gp_segment_id | count 
---------------+-------
             1 |     4
             0 |     4
(2 rows)

begin;
Alter table t1_reshuffle_aoco set with (reshuffle);
Select gp_segment_id, count(*) from t1_reshuffle_aoco group by gp_segment_id;
 gp_segment_id | count 
---------------+-------
             0 |     2
             2 |     3
             1 |     3
(3 rows)

abort;
Select gp_segment_id, count(*) from t1_reshuffle_aoco group by gp_segment_id;
 gp_segment_id | count 
---------------+-------
             1 |     4
             0 |     4
(2 rows)

Alter table t1_reshuffle_aoco set with (reshuffle);
Select gp_segment_id, count(*) from t1_reshuffle_aoco group by gp_segment_id;
 gp_segment_id | count 
---------------+-------
             1 |     3
             2 |     3
             0 |     2
(3 rows)

select numsegments from gp_distribution_policy where localoid='t1_reshuffle_aoco'::regclass;
 numsegments 
-------------
           3
(1 row)

drop table t1_reshuffle_aoco;
Create table t1_reshuffle_aoco(a int, b int, c int) with (appendonly = true, orientation = column) distributed by (a) partition by list(b) (partition t1_reshuffle_aoco_1 values(1), partition t1_reshuffle_aoco_2 values(2), default partition other);
NOTICE:  CREATE TABLE will create partition "t1_reshuffle_aoco_1_prt_t1_reshuffle_aoco_1" for table "t1_reshuffle_aoco"
NOTICE:  CREATE TABLE will create partition "t1_reshuffle_aoco_1_prt_t1_reshuffle_aoco_2" for table "t1_reshuffle_aoco"
NOTICE:  CREATE TABLE will create partition "t1_reshuffle_aoco_1_prt_other" for table "t1_reshuffle_aoco"
update gp_distribution_policy set numsegments = 1 where localoid='t1_reshuffle_aoco_1_prt_t1_reshuffle_aoco_1'::regclass;
update gp_distribution_policy set numsegments = 1 where localoid='t1_reshuffle_aoco_1_prt_t1_reshuffle_aoco_2'::regclass;
update gp_distribution_policy set numsegments = 1 where localoid='t1_reshuffle_aoco_1_prt_other'::regclass;
update gp_distribution_policy set numsegments = 1 where localoid='t1_reshuffle_aoco'::regclass;
insert into t1_reshuffle_aoco select i,i,0 from generate_series(1,100) I;
Select gp_segment_id, count(*) from t1_reshuffle_aoco group by gp_segment_id;
 gp_segment_id | count 
---------------+-------
             0 |   100
(1 row)

begin;
Alter table t1_reshuffle_aoco set with (reshuffle);
Select gp_segment_id, count(*) from t1_reshuffle_aoco group by gp_segment_id;
 gp_segment_id | count 
---------------+-------
             2 |    28
             0 |    32
             1 |    40
(3 rows)

abort;
Select gp_segment_id, count(*) from t1_reshuffle_aoco group by gp_segment_id;
 gp_segment_id | count 
---------------+-------
             0 |   100
(1 row)

Alter table t1_reshuffle_aoco set with (reshuffle);
Select gp_segment_id, count(*) from t1_reshuffle_aoco group by gp_segment_id;
 gp_segment_id | count 
---------------+-------
             0 |    32
             1 |    40
             2 |    28
(3 rows)

select numsegments from gp_distribution_policy where localoid='t1_reshuffle_aoco'::regclass;
 numsegments 
-------------
           3
(1 row)

drop table t1_reshuffle_aoco;
-- Random distributed tables
Create table r1_reshuffle_aoco(a int, b int, c int) with (appendonly = true, orientation = column) distributed randomly;
update gp_distribution_policy  set numsegments=2 where localoid='r1_reshuffle_aoco'::regclass;
insert into r1_reshuffle_aoco select i,i,0 from generate_series(1,100) I;
Update r1_reshuffle_aoco set c = gp_segment_id;
Select count(*) from r1_reshuffle_aoco;
 count 
-------
   100
(1 row)

Select count(*) > 0 from r1_reshuffle_aoco where gp_segment_id=2;
 ?column? 
----------
 f
(1 row)

begin;
Alter table r1_reshuffle_aoco set with (reshuffle);
Select count(*) from r1_reshuffle_aoco;
 count 
-------
   100
(1 row)

Select count(*) > 0 from r1_reshuffle_aoco where gp_segment_id=2;
 ?column? 
----------
 t
(1 row)

abort;
Select count(*) from r1_reshuffle_aoco;
 count 
-------
   100
(1 row)

Select count(*) > 0 from r1_reshuffle_aoco where gp_segment_id=2;
 ?column? 
----------
 f
(1 row)

Alter table r1_reshuffle_aoco set with (reshuffle);
Select count(*) from r1_reshuffle_aoco;
 count 
-------
   100
(1 row)

Select count(*) > 0 from r1_reshuffle_aoco where gp_segment_id=2;
 ?column? 
----------
 t
(1 row)

select numsegments from gp_distribution_policy where localoid='r1_reshuffle_aoco'::regclass;
 numsegments 
-------------
           3
(1 row)

drop table r1_reshuffle_aoco;
Create table r1_reshuffle_aoco(a int, b int, c int) with (appendonly = true, orientation = column) distributed randomly partition by list(b) (partition r1_reshuffle_aoco_1 values(1), partition r1_reshuffle_aoco_2 values(2), default partition other);
NOTICE:  CREATE TABLE will create partition "r1_reshuffle_aoco_1_prt_r1_reshuffle_aoco_1" for table "r1_reshuffle_aoco"
NOTICE:  CREATE TABLE will create partition "r1_reshuffle_aoco_1_prt_r1_reshuffle_aoco_2" for table "r1_reshuffle_aoco"
NOTICE:  CREATE TABLE will create partition "r1_reshuffle_aoco_1_prt_other" for table "r1_reshuffle_aoco"
update gp_distribution_policy set numsegments = 2 where localoid='r1_reshuffle_aoco_1_prt_r1_reshuffle_aoco_1'::regclass;
update gp_distribution_policy set numsegments = 2 where localoid='r1_reshuffle_aoco_1_prt_r1_reshuffle_aoco_2'::regclass;
update gp_distribution_policy set numsegments = 2 where localoid='r1_reshuffle_aoco_1_prt_other'::regclass;
update gp_distribution_policy set numsegments = 2 where localoid='r1_reshuffle_aoco'::regclass;
insert into r1_reshuffle_aoco select i,i,0 from generate_series(1,100) I;
Select count(*) from r1_reshuffle_aoco;
 count 
-------
   100
(1 row)

Select count(*) > 0 from r1_reshuffle_aoco where gp_segment_id=2;
 ?column? 
----------
 f
(1 row)

begin;
Alter table r1_reshuffle_aoco set with (reshuffle);
Select count(*) from r1_reshuffle_aoco;
 count 
-------
   100
(1 row)

Select count(*) > 0 from r1_reshuffle_aoco where gp_segment_id=2;
 ?column? 
----------
 t
(1 row)

abort;
Select count(*) from r1_reshuffle_aoco;
 count 
-------
   100
(1 row)

Select count(*) > 0 from r1_reshuffle_aoco where gp_segment_id=2;
 ?column? 
----------
 f
(1 row)

Alter table r1_reshuffle_aoco set with (reshuffle);
Select count(*) from r1_reshuffle_aoco;
 count 
-------
   100
(1 row)

Select count(*) > 0 from r1_reshuffle_aoco where gp_segment_id=2;
 ?column? 
----------
 t
(1 row)

select numsegments from gp_distribution_policy where localoid='r1_reshuffle_aoco'::regclass;
 numsegments 
-------------
           3
(1 row)

drop table r1_reshuffle_aoco;
-- Replicated tables
-- We have to make sure replicated table successfully reshuffled.
Create table r1_reshuffle_aoco(a int, b int, c int) with (appendonly = true, orientation = column) distributed replicated;
select update_numsegments_in_policy('r1_reshuffle_aoco', 1);
 update_numsegments_in_policy 
------------------------------
 
(1 row)

insert into r1_reshuffle_aoco select i,i,0 from generate_series(1,100) I;
Select count(*) from r1_reshuffle_aoco;
 count 
-------
   100
(1 row)

Select gp_execute_on_server(1, 'Select count(*) from r1_reshuffle_aoco;');
 gp_execute_on_server 
----------------------
 0
(1 row)

Select gp_execute_on_server(2, 'Select count(*) from r1_reshuffle_aoco;');
 gp_execute_on_server 
----------------------
 0
(1 row)

begin;
Alter table r1_reshuffle_aoco set with (reshuffle);
Select count(*) from r1_reshuffle_aoco;
 count 
-------
   100
(1 row)

abort;
Select count(*) from r1_reshuffle_aoco;
 count 
-------
   100
(1 row)

Select gp_execute_on_server(1, 'Select count(*) from r1_reshuffle_aoco;');
 gp_execute_on_server 
----------------------
 0
(1 row)

Select gp_execute_on_server(2, 'Select count(*) from r1_reshuffle_aoco;');
 gp_execute_on_server 
----------------------
 0
(1 row)

Alter table r1_reshuffle_aoco set with (reshuffle);
Select count(*) from r1_reshuffle_aoco;
 count 
-------
   100
(1 row)

Select gp_execute_on_server(1, 'Select count(*) from r1_reshuffle_aoco;');
 gp_execute_on_server 
----------------------
 100
(1 row)

Select gp_execute_on_server(2, 'Select count(*) from r1_reshuffle_aoco;');
 gp_execute_on_server 
----------------------
 100
(1 row)

select numsegments from gp_distribution_policy where localoid='r1_reshuffle_aoco'::regclass;
 numsegments 
-------------
           3
(1 row)

drop table r1_reshuffle_aoco;
