set allow_system_table_mods=true;
-- Hash distributed tables
Create table t1_reshuffle_aoco(a int, b int, c int) with (appendonly = true, orientation = column);
NOTICE:  Table doesn't have 'DISTRIBUTED BY' clause -- Using column named 'a' as the Greenplum Database data distribution key for this table.
HINT:  The 'DISTRIBUTED BY' clause determines the distribution of data. Make sure column(s) chosen are the optimal data distribution key to minimize skew.
update gp_distribution_policy  set numsegments=2 where localoid='t1_reshuffle_aoco'::regclass;
insert into t1_reshuffle_aoco select i,i,0 from generate_series(1,100) I;
Update t1_reshuffle_aoco set c = gp_segment_id;
Select count(*) from t1_reshuffle_aoco where gp_segment_id=0;
 count 
-------
    49
(1 row)

Select count(*) from t1_reshuffle_aoco where gp_segment_id=1;
 count 
-------
    51
(1 row)

Select count(*) from t1_reshuffle_aoco where gp_segment_id=2;
 count 
-------
     0
(1 row)

Alter table t1_reshuffle_aoco set with (reshuffle);
Select count(*) from t1_reshuffle_aoco where gp_segment_id=0;
 count 
-------
    32
(1 row)

Select count(*) from t1_reshuffle_aoco where gp_segment_id=1;
 count 
-------
    40
(1 row)

Select count(*) from t1_reshuffle_aoco where gp_segment_id=2;
 count 
-------
    28
(1 row)

select numsegments from gp_distribution_policy where localoid='t1_reshuffle_aoco'::regclass;
 numsegments 
-------------
           3
(1 row)

drop table t1_reshuffle_aoco;
Create table t1_reshuffle_aoco(a int, b int, c int) with (appendonly = true, orientation = column);
NOTICE:  Table doesn't have 'DISTRIBUTED BY' clause -- Using column named 'a' as the Greenplum Database data distribution key for this table.
HINT:  The 'DISTRIBUTED BY' clause determines the distribution of data. Make sure column(s) chosen are the optimal data distribution key to minimize skew.
update gp_distribution_policy  set numsegments=1 where localoid='t1_reshuffle_aoco'::regclass;
insert into t1_reshuffle_aoco select i,i,0 from generate_series(1,100) I;
Update t1_reshuffle_aoco set c = gp_segment_id;
Select count(*) from t1_reshuffle_aoco where gp_segment_id=0;
 count 
-------
   100
(1 row)

Select count(*) from t1_reshuffle_aoco where gp_segment_id=1;
 count 
-------
     0
(1 row)

Select count(*) from t1_reshuffle_aoco where gp_segment_id=2;
 count 
-------
     0
(1 row)

Alter table t1_reshuffle_aoco set with (reshuffle);
Select count(*) from t1_reshuffle_aoco where gp_segment_id=0;
 count 
-------
    32
(1 row)

Select count(*) from t1_reshuffle_aoco where gp_segment_id=1;
 count 
-------
    40
(1 row)

Select count(*) from t1_reshuffle_aoco where gp_segment_id=2;
 count 
-------
    28
(1 row)

select numsegments from gp_distribution_policy where localoid='t1_reshuffle_aoco'::regclass;
 numsegments 
-------------
           3
(1 row)

drop table t1_reshuffle_aoco;
Create table t1_reshuffle_aoco(a int, b int, c int) with (appendonly = true, orientation = column) distributed by (a,b);
update gp_distribution_policy  set numsegments=2 where localoid='t1_reshuffle_aoco'::regclass;
insert into t1_reshuffle_aoco select i,i,0 from generate_series(1,100) I;
Update t1_reshuffle_aoco set c = gp_segment_id;
Select count(*) from t1_reshuffle_aoco where gp_segment_id=0;
 count 
-------
    51
(1 row)

Select count(*) from t1_reshuffle_aoco where gp_segment_id=1;
 count 
-------
    49
(1 row)

Select count(*) from t1_reshuffle_aoco where gp_segment_id=2;
 count 
-------
     0
(1 row)

Alter table t1_reshuffle_aoco set with (reshuffle);
Select count(*) from t1_reshuffle_aoco where gp_segment_id=0;
 count 
-------
    31
(1 row)

Select count(*) from t1_reshuffle_aoco where gp_segment_id=1;
 count 
-------
    35
(1 row)

Select count(*) from t1_reshuffle_aoco where gp_segment_id=2;
 count 
-------
    34
(1 row)

select numsegments from gp_distribution_policy where localoid='t1_reshuffle_aoco'::regclass;
 numsegments 
-------------
           3
(1 row)

drop table t1_reshuffle_aoco;
Create table t1_reshuffle_aoco(a int, b int, c int) with (appendonly = true, orientation = column) distributed by (a,b);
update gp_distribution_policy  set numsegments=1 where localoid='t1_reshuffle_aoco'::regclass;
insert into t1_reshuffle_aoco select i,i,0 from generate_series(1,100) I;
Update t1_reshuffle_aoco set c = gp_segment_id;
Select count(*) from t1_reshuffle_aoco where gp_segment_id=0;
 count 
-------
   100
(1 row)

Select count(*) from t1_reshuffle_aoco where gp_segment_id=1;
 count 
-------
     0
(1 row)

Select count(*) from t1_reshuffle_aoco where gp_segment_id=2;
 count 
-------
     0
(1 row)

Alter table t1_reshuffle_aoco set with (reshuffle);
Select count(*) from t1_reshuffle_aoco where gp_segment_id=0;
 count 
-------
    31
(1 row)

Select count(*) from t1_reshuffle_aoco where gp_segment_id=1;
 count 
-------
    35
(1 row)

Select count(*) from t1_reshuffle_aoco where gp_segment_id=2;
 count 
-------
    34
(1 row)

select numsegments from gp_distribution_policy where localoid='t1_reshuffle_aoco'::regclass;
 numsegments 
-------------
           3
(1 row)

drop table t1_reshuffle_aoco;
Create table t1_reshuffle_aoco(a int, b int, c int) with (appendonly = true, orientation = column) distributed by (a) partition by list(b) (partition t1_reshuffle_aoco_1 values(1), partition t1_reshuffle_aoco_2 values(2), default partition other);
NOTICE:  CREATE TABLE will create partition "t1_reshuffle_aoco_1_prt_t1_reshuffle_aoco_1" for table "t1_reshuffle_aoco"
NOTICE:  CREATE TABLE will create partition "t1_reshuffle_aoco_1_prt_t1_reshuffle_aoco_2" for table "t1_reshuffle_aoco"
NOTICE:  CREATE TABLE will create partition "t1_reshuffle_aoco_1_prt_other" for table "t1_reshuffle_aoco"
update gp_distribution_policy set numsegments = 1 where localoid='t1_reshuffle_aoco_1_prt_t1_reshuffle_aoco_1'::regclass;
update gp_distribution_policy set numsegments = 1 where localoid='t1_reshuffle_aoco_1_prt_t1_reshuffle_aoco_2'::regclass;
update gp_distribution_policy set numsegments = 1 where localoid='t1_reshuffle_aoco_1_prt_other'::regclass;
update gp_distribution_policy set numsegments = 1 where localoid='t1_reshuffle_aoco'::regclass;
insert into t1_reshuffle_aoco select i,i,0 from generate_series(1,100) I;
Alter table t1_reshuffle_aoco set with (reshuffle);
Select count(*) from t1_reshuffle_aoco;
 count 
-------
   100
(1 row)

Select count(*) > 0 from t1_reshuffle_aoco where gp_segment_id=1;
 ?column? 
----------
 t
(1 row)

Select count(*) > 0 from t1_reshuffle_aoco where gp_segment_id=2;
 ?column? 
----------
 t
(1 row)

drop table t1_reshuffle_aoco;
Create table t1_reshuffle_aoco(a int, b int, c int) with (appendonly = true, orientation = column) distributed by (a) partition by list(b) (partition t1_reshuffle_aoco_1 values(1), partition t1_reshuffle_aoco_2 values(2), default partition other);
NOTICE:  CREATE TABLE will create partition "t1_reshuffle_aoco_1_prt_t1_reshuffle_aoco_1" for table "t1_reshuffle_aoco"
NOTICE:  CREATE TABLE will create partition "t1_reshuffle_aoco_1_prt_t1_reshuffle_aoco_2" for table "t1_reshuffle_aoco"
NOTICE:  CREATE TABLE will create partition "t1_reshuffle_aoco_1_prt_other" for table "t1_reshuffle_aoco"
update gp_distribution_policy set numsegments = 2 where localoid='t1_reshuffle_aoco_1_prt_t1_reshuffle_aoco_1'::regclass;
update gp_distribution_policy set numsegments = 2 where localoid='t1_reshuffle_aoco_1_prt_t1_reshuffle_aoco_2'::regclass;
update gp_distribution_policy set numsegments = 2 where localoid='t1_reshuffle_aoco_1_prt_other'::regclass;
update gp_distribution_policy set numsegments = 2 where localoid='t1_reshuffle_aoco'::regclass;
insert into t1_reshuffle_aoco select i,i,0 from generate_series(1,100) I;
Alter table t1_reshuffle_aoco set with (reshuffle);
Select count(*) from t1_reshuffle_aoco;
 count 
-------
   100
(1 row)

Select count(*) > 0 from t1_reshuffle_aoco where gp_segment_id=2;
 ?column? 
----------
 t
(1 row)

drop table t1_reshuffle_aoco;
Create table t1_reshuffle_aoco(a int, b int, c int) with (appendonly = true, orientation = column) distributed by (a,b) partition by list(b) (partition t1_reshuffle_aoco_1 values(1), partition t1_reshuffle_aoco_2 values(2), default partition other);
NOTICE:  CREATE TABLE will create partition "t1_reshuffle_aoco_1_prt_t1_reshuffle_aoco_1" for table "t1_reshuffle_aoco"
NOTICE:  CREATE TABLE will create partition "t1_reshuffle_aoco_1_prt_t1_reshuffle_aoco_2" for table "t1_reshuffle_aoco"
NOTICE:  CREATE TABLE will create partition "t1_reshuffle_aoco_1_prt_other" for table "t1_reshuffle_aoco"
update gp_distribution_policy set numsegments = 1 where localoid='t1_reshuffle_aoco_1_prt_t1_reshuffle_aoco_1'::regclass;
update gp_distribution_policy set numsegments = 1 where localoid='t1_reshuffle_aoco_1_prt_t1_reshuffle_aoco_2'::regclass;
update gp_distribution_policy set numsegments = 1 where localoid='t1_reshuffle_aoco_1_prt_other'::regclass;
update gp_distribution_policy set numsegments = 1 where localoid='t1_reshuffle_aoco'::regclass;
insert into t1_reshuffle_aoco select i,i,0 from generate_series(1,100) I;
Alter table t1_reshuffle_aoco set with (reshuffle);
Select count(*) from t1_reshuffle_aoco;
 count 
-------
   100
(1 row)

Select count(*) > 0 from t1_reshuffle_aoco where gp_segment_id=1;
 ?column? 
----------
 t
(1 row)

Select count(*) > 0 from t1_reshuffle_aoco where gp_segment_id=2;
 ?column? 
----------
 t
(1 row)

drop table t1_reshuffle_aoco;
Create table t1_reshuffle_aoco(a int, b int, c int) with (appendonly = true, orientation = column) distributed by (a,b) partition by list(b) (partition t1_reshuffle_aoco_1 values(1), partition t1_reshuffle_aoco_2 values(2), default partition other);
NOTICE:  CREATE TABLE will create partition "t1_reshuffle_aoco_1_prt_t1_reshuffle_aoco_1" for table "t1_reshuffle_aoco"
NOTICE:  CREATE TABLE will create partition "t1_reshuffle_aoco_1_prt_t1_reshuffle_aoco_2" for table "t1_reshuffle_aoco"
NOTICE:  CREATE TABLE will create partition "t1_reshuffle_aoco_1_prt_other" for table "t1_reshuffle_aoco"
update gp_distribution_policy set numsegments = 2 where localoid='t1_reshuffle_aoco_1_prt_t1_reshuffle_aoco_1'::regclass;
update gp_distribution_policy set numsegments = 2 where localoid='t1_reshuffle_aoco_1_prt_t1_reshuffle_aoco_2'::regclass;
update gp_distribution_policy set numsegments = 2 where localoid='t1_reshuffle_aoco_1_prt_other'::regclass;
update gp_distribution_policy set numsegments = 2 where localoid='t1_reshuffle_aoco'::regclass;
insert into t1_reshuffle_aoco select i,i,0 from generate_series(1,100) I;
Alter table t1_reshuffle_aoco set with (reshuffle);
Select count(*) from t1_reshuffle_aoco;
 count 
-------
   100
(1 row)

Select count(*) > 0 from t1_reshuffle_aoco where gp_segment_id=2;
 ?column? 
----------
 t
(1 row)

drop table t1_reshuffle_aoco;
-- Random distributed tables
Create table r1_reshuffle_aoco(a int, b int, c int) with (appendonly = true, orientation = column) distributed randomly;
update gp_distribution_policy  set numsegments=1 where localoid='r1_reshuffle_aoco'::regclass;
insert into r1_reshuffle_aoco select i,i,0 from generate_series(1,100) I;
Update r1_reshuffle_aoco set c = gp_segment_id;
Select count(*) from r1_reshuffle_aoco;
 count 
-------
   100
(1 row)

Alter table r1_reshuffle_aoco set with (reshuffle);
Select count(*) from r1_reshuffle_aoco;
 count 
-------
   100
(1 row)

Select count(*) > 0 from r1_reshuffle_aoco where gp_segment_id=2;
 ?column? 
----------
 t
(1 row)

drop table r1_reshuffle_aoco;
Create table r1_reshuffle_aoco(a int, b int, c int) with (appendonly = true, orientation = column) distributed randomly;
update gp_distribution_policy  set numsegments=2 where localoid='r1_reshuffle_aoco'::regclass;
insert into r1_reshuffle_aoco select i,i,0 from generate_series(1,100) I;
Update r1_reshuffle_aoco set c = gp_segment_id;
Select count(*) from r1_reshuffle_aoco;
 count 
-------
   100
(1 row)

Alter table r1_reshuffle_aoco set with (reshuffle);
Select count(*) from r1_reshuffle_aoco;
 count 
-------
   100
(1 row)

Select count(*) > 0 from r1_reshuffle_aoco where gp_segment_id=2;
 ?column? 
----------
 t
(1 row)

drop table r1_reshuffle_aoco;
Create table r1_reshuffle_aoco(a int, b int, c int) with (appendonly = true, orientation = column) distributed randomly partition by list(b) (partition r1_reshuffle_aoco_1 values(1), partition r1_reshuffle_aoco_2 values(2), default partition other);
NOTICE:  CREATE TABLE will create partition "r1_reshuffle_aoco_1_prt_r1_reshuffle_aoco_1" for table "r1_reshuffle_aoco"
NOTICE:  CREATE TABLE will create partition "r1_reshuffle_aoco_1_prt_r1_reshuffle_aoco_2" for table "r1_reshuffle_aoco"
NOTICE:  CREATE TABLE will create partition "r1_reshuffle_aoco_1_prt_other" for table "r1_reshuffle_aoco"
update gp_distribution_policy set numsegments = 1 where localoid='r1_reshuffle_aoco_1_prt_r1_reshuffle_aoco_1'::regclass;
update gp_distribution_policy set numsegments = 1 where localoid='r1_reshuffle_aoco_1_prt_r1_reshuffle_aoco_2'::regclass;
update gp_distribution_policy set numsegments = 1 where localoid='r1_reshuffle_aoco_1_prt_other'::regclass;
update gp_distribution_policy set numsegments = 1 where localoid='r1_reshuffle_aoco'::regclass;
insert into r1_reshuffle_aoco select i,i,0 from generate_series(1,100) I;
Alter table r1_reshuffle_aoco set with (reshuffle);
Select count(*) from r1_reshuffle_aoco;
 count 
-------
   100
(1 row)

Select count(*) > 0 from r1_reshuffle_aoco where gp_segment_id=1;
 ?column? 
----------
 t
(1 row)

Select count(*) > 0 from r1_reshuffle_aoco where gp_segment_id=2;
 ?column? 
----------
 t
(1 row)

drop table r1_reshuffle_aoco;
Create table r1_reshuffle_aoco(a int, b int, c int) with (appendonly = true, orientation = column) distributed randomly partition by list(b) (partition r1_reshuffle_aoco_1 values(1), partition r1_reshuffle_aoco_2 values(2), default partition other);
NOTICE:  CREATE TABLE will create partition "r1_reshuffle_aoco_1_prt_r1_reshuffle_aoco_1" for table "r1_reshuffle_aoco"
NOTICE:  CREATE TABLE will create partition "r1_reshuffle_aoco_1_prt_r1_reshuffle_aoco_2" for table "r1_reshuffle_aoco"
NOTICE:  CREATE TABLE will create partition "r1_reshuffle_aoco_1_prt_other" for table "r1_reshuffle_aoco"
update gp_distribution_policy set numsegments = 2 where localoid='r1_reshuffle_aoco_1_prt_r1_reshuffle_aoco_1'::regclass;
update gp_distribution_policy set numsegments = 2 where localoid='r1_reshuffle_aoco_1_prt_r1_reshuffle_aoco_2'::regclass;
update gp_distribution_policy set numsegments = 2 where localoid='r1_reshuffle_aoco_1_prt_other'::regclass;
update gp_distribution_policy set numsegments = 2 where localoid='r1_reshuffle_aoco'::regclass;
insert into r1_reshuffle_aoco select i,i,0 from generate_series(1,100) I;
Alter table r1_reshuffle_aoco set with (reshuffle);
Select count(*) from r1_reshuffle_aoco;
 count 
-------
   100
(1 row)

Select count(*) > 0 from r1_reshuffle_aoco where gp_segment_id=1;
 ?column? 
----------
 t
(1 row)

Select count(*) > 0 from r1_reshuffle_aoco where gp_segment_id=2;
 ?column? 
----------
 t
(1 row)

drop table r1_reshuffle_aoco;
-- Replicated tables
Create table r1_reshuffle_aoco(a int, b int, c int) with (appendonly = true, orientation = column) distributed replicated;
update gp_distribution_policy  set numsegments=1 where localoid='r1_reshuffle_aoco'::regclass;
insert into r1_reshuffle_aoco select i,i,0 from generate_series(1,100) I;
Select count(*) from r1_reshuffle_aoco;
 count 
-------
   100
(1 row)

Alter table r1_reshuffle_aoco set with (reshuffle);
Select count(*) from r1_reshuffle_aoco;
 count 
-------
   100
(1 row)

drop table r1_reshuffle_aoco;
Create table r1_reshuffle_aoco(a int, b int, c int) with (appendonly = true, orientation = column) distributed replicated;
update gp_distribution_policy  set numsegments=2 where localoid='r1_reshuffle_aoco'::regclass;
insert into r1_reshuffle_aoco select i,i,0 from generate_series(1,100) I;
Select count(*) from r1_reshuffle_aoco;
 count 
-------
   100
(1 row)

Alter table r1_reshuffle_aoco set with (reshuffle);
Select count(*) from r1_reshuffle_aoco;
 count 
-------
   100
(1 row)

drop table r1_reshuffle_aoco;
