--
-- Basic tests for replicated table
--
create schema rpt;
set search_path to rpt;
---------
-- INSERT
---------
create table foo (x int, y int) distributed replicated;
create table foo1(like foo) distributed replicated;
create table bar (like foo) distributed randomly;
create table bar1 (like foo) distributed by (x);
-- values --> replicated table 
-- random partitioned table --> replicated table
-- hash partitioned table --> replicated table
-- singleQE --> replicated table
-- replicated --> replicated table
insert into bar values (1, 1), (3, 1);
insert into bar1 values (1, 1), (3, 1);
insert into foo1 values (1, 1), (3, 1);
insert into foo select * from bar;
insert into foo select * from bar1;
insert into foo select * from bar order by x limit 1;
insert into foo select * from foo;
select * from foo order by x;
 x | y 
---+---
 1 | 1
 1 | 1
 1 | 1
 1 | 1
 1 | 1
 1 | 1
 3 | 1
 3 | 1
 3 | 1
 3 | 1
(10 rows)

select bar.x, bar.y from bar, (select * from foo) as t1 order by 1,2;
 x | y 
---+---
 1 | 1
 1 | 1
 1 | 1
 1 | 1
 1 | 1
 1 | 1
 1 | 1
 1 | 1
 1 | 1
 1 | 1
 3 | 1
 3 | 1
 3 | 1
 3 | 1
 3 | 1
 3 | 1
 3 | 1
 3 | 1
 3 | 1
 3 | 1
(20 rows)

select bar.x, bar.y from bar, (select * from foo order by x limit 1) as t1 order by 1,2;
 x | y 
---+---
 1 | 1
 3 | 1
(2 rows)

truncate foo;
truncate foo1;
truncate bar;
truncate bar1;
-- replicated table --> random partitioned table
-- replicated table --> hash partitioned table
insert into foo values (1, 1), (3, 1);
insert into bar select * from foo order by x limit 1;
insert into bar1 select * from foo order by x limit 1;
select * from foo order by x;
 x | y 
---+---
 1 | 1
 3 | 1
(2 rows)

select * from bar order by x;
 x | y 
---+---
 1 | 1
(1 row)

select * from bar1 order by x;
 x | y 
---+---
 1 | 1
(1 row)

drop table if exists foo;
drop table if exists foo1;
drop table if exists bar;
drop table if exists bar1;
--
-- CREATE UNIQUE INDEX
--
-- create unique index on non-distributed key.
create table foo (x int, y int) distributed replicated;
create table bar (x int, y int) distributed randomly;
-- success
create unique index foo_idx on foo (y);
-- should fail
create unique index bar_idx on foo (y);
drop table if exists foo;
drop table if exists bar;
--
-- CREATE TABLE with both PRIMARY KEY and UNIQUE constraints
--
create table foo (id int primary key, name text unique) distributed replicated;
NOTICE:  CREATE TABLE / PRIMARY KEY will create implicit index "foo_pkey" for table "foo"
NOTICE:  CREATE TABLE / UNIQUE will create implicit index "foo_name_key" for table "foo"
-- success
insert into foo values (1,'aaa');
insert into foo values (2,'bbb');
-- fail
insert into foo values (1,'ccc');
ERROR:  duplicate key value violates unique constraint "foo_pkey"  (seg0 192.168.99.102:25432 pid=22681)
DETAIL:  Key (id)=(1) already exists.
insert into foo values (3,'aaa');
ERROR:  duplicate key value violates unique constraint "foo_name_key"  (seg2 192.168.99.102:25434 pid=22683)
DETAIL:  Key (name)=(aaa) already exists.
drop table if exists foo;
--
-- CREATE TABLE
--
--
-- Like
CREATE TABLE parent (
        name            text,
        age                     int4,
        location        point
) distributed replicated;
CREATE TABLE child (like parent) distributed replicated;
CREATE TABLE child1 (like parent) DISTRIBUTED BY (name);
CREATE TABLE child2 (like parent);
NOTICE:  Table doesn't have 'DISTRIBUTED BY' clause, defaulting to distribution columns from LIKE table
-- should be replicated table
\d child
       Table "rpt.child"
  Column  |  Type   | Modifiers 
----------+---------+-----------
 name     | text    | 
 age      | integer | 
 location | point   | 
Distributed Replicated

-- should distributed by name
\d child1
       Table "rpt.child1"
  Column  |  Type   | Modifiers 
----------+---------+-----------
 name     | text    | 
 age      | integer | 
 location | point   | 
Distributed by: (name)

-- should be replicated table
\d child2
       Table "rpt.child2"
  Column  |  Type   | Modifiers 
----------+---------+-----------
 name     | text    | 
 age      | integer | 
 location | point   | 
Distributed Replicated

drop table if exists parent;
drop table if exists child;
drop table if exists child1;
drop table if exists child2;
-- Inherits
CREATE TABLE parent_rep (
        name            text,
        age                     int4,
        location        point
) distributed replicated;
CREATE TABLE parent_part (
        name            text,
        age                     int4,
        location        point
) distributed by (name);
-- inherits from a replicated table, should fail
CREATE TABLE child (
        salary          int4,
        manager         name
) INHERITS (parent_rep) WITH OIDS;
ERROR:  cannot inherit from replicated table "parent_rep" to create table "child".
DETAIL:  An inheritance hierarchy cannot contain a mixture of distributed and non-distributed tables.
-- replicated table can not have parents, should fail
CREATE TABLE child (
        salary          int4,
        manager         name
) INHERITS (parent_part) WITH OIDS DISTRIBUTED REPLICATED;
ERROR:  INHERITS clause cannot be used with DISTRIBUTED REPLICATED clause
drop table if exists parent_rep;
drop table if exists parent_part;
drop table if exists child;
NOTICE:  table "child" does not exist, skipping
--
-- CTAS
--
-- CTAS from generate_series
create table foo as select i as c1, i as c2
from generate_series(1,3) i distributed replicated;
-- CTAS from replicated table 
create table bar as select * from foo distributed replicated;
select * from bar;
 c1 | c2 
----+----
  1 |  1
  2 |  2
  3 |  3
(3 rows)

drop table if exists foo;
drop table if exists bar;
-- CTAS from partition table table
create table foo as select i as c1, i as c2
from generate_series(1,3) i;
NOTICE:  Table doesn't have 'DISTRIBUTED BY' clause -- Using column(s) named 'c1' as the Greenplum Database data distribution key for this table.
HINT:  The 'DISTRIBUTED BY' clause determines the distribution of data. Make sure column(s) chosen are the optimal data distribution key to minimize skew.
create table bar as select * from foo distributed replicated;
select * from bar;
 c1 | c2 
----+----
  1 |  1
  2 |  2
  3 |  3
(3 rows)

drop table if exists foo;
drop table if exists bar;
-- CTAS from singleQE 
create table foo as select i as c1, i as c2
from generate_series(1,3) i;
NOTICE:  Table doesn't have 'DISTRIBUTED BY' clause -- Using column(s) named 'c1' as the Greenplum Database data distribution key for this table.
HINT:  The 'DISTRIBUTED BY' clause determines the distribution of data. Make sure column(s) chosen are the optimal data distribution key to minimize skew.
select * from foo;
 c1 | c2 
----+----
  1 |  1
  2 |  2
  3 |  3
(3 rows)

create table bar as select * from foo order by c1 limit 1 distributed replicated;
select * from bar;
 c1 | c2 
----+----
  1 |  1
(1 row)

drop table if exists foo;
drop table if exists bar;
-- Create view can work
create table foo(x int, y int) distributed replicated;
insert into foo values(1,1);
create view v_foo as select * from foo;
select * from v_foo;
 x | y 
---+---
 1 | 1
(1 row)

drop view v_foo;
drop table if exists foo;
---------
-- Alter
--------
-- Drop distributed key column
create table foo(x int, y int) distributed replicated;
create table bar(like foo) distributed by (x);
insert into foo values(1,1);
insert into bar values(1,1);
-- success
alter table foo drop column x;
-- fail
alter table bar drop column x;
NOTICE:  Dropping a column that is part of the distribution policy forces a NULL distribution policy
drop table if exists foo;
drop table if exists foo1;
NOTICE:  table "foo1" does not exist, skipping
drop table if exists bar;
drop table if exists bar1;
NOTICE:  table "bar1" does not exist, skipping
-- Alter gp_distribution_policy
create table foo(x int, y int) distributed replicated;
create table foo1(x int, y int) distributed replicated;
create table bar(x int, y int) distributed by (x);
create table bar1(x int, y int) distributed randomly;
insert into foo select i,i from generate_series(1,10) i;
insert into foo1 select i,i from generate_series(1,10) i;
insert into bar select i,i from generate_series(1,10) i;
insert into bar1 select i,i from generate_series(1,10) i;
-- alter distribution policy of replicated table
alter table foo set distributed by (x);
alter table foo1 set distributed randomly;
-- alter a partitioned table to replicated table
alter table bar set distributed replicated;
alter table bar1 set distributed replicated;
-- verify the new policies
\d foo
       Table "rpt.foo"
 Column |  Type   | Modifiers 
--------+---------+-----------
 x      | integer | 
 y      | integer | 
Distributed by: (x)

\d foo1
       Table "rpt.foo1"
 Column |  Type   | Modifiers 
--------+---------+-----------
 x      | integer | 
 y      | integer | 
Distributed randomly

\d bar
       Table "rpt.bar"
 Column |  Type   | Modifiers 
--------+---------+-----------
 x      | integer | 
 y      | integer | 
Distributed Replicated

\d bar1
       Table "rpt.bar1"
 Column |  Type   | Modifiers 
--------+---------+-----------
 x      | integer | 
 y      | integer | 
Distributed Replicated

-- verify the reorganized data
select * from foo;
 x  | y  
----+----
  1 |  1
  2 |  2
  3 |  3
  4 |  4
  5 |  5
  6 |  6
  7 |  7
  8 |  8
  9 |  9
 10 | 10
(10 rows)

select * from foo1;
 x  | y  
----+----
  1 |  1
  2 |  2
  3 |  3
  4 |  4
  5 |  5
  6 |  6
  7 |  7
  8 |  8
  9 |  9
 10 | 10
(10 rows)

select * from bar;
 x  | y  
----+----
  1 |  1
  2 |  2
  3 |  3
  4 |  4
  5 |  5
  6 |  6
  7 |  7
  8 |  8
  9 |  9
 10 | 10
(10 rows)

select * from bar1;
 x  | y  
----+----
  1 |  1
  2 |  2
  3 |  3
  4 |  4
  5 |  5
  6 |  6
  7 |  7
  8 |  8
  9 |  9
 10 | 10
(10 rows)

-- alter back
alter table foo set distributed replicated;
alter table foo1 set distributed replicated;
alter table bar set distributed by (x);
alter table bar1 set distributed randomly;
-- verify the policies again
\d foo
       Table "rpt.foo"
 Column |  Type   | Modifiers 
--------+---------+-----------
 x      | integer | 
 y      | integer | 
Distributed Replicated

\d foo1
       Table "rpt.foo1"
 Column |  Type   | Modifiers 
--------+---------+-----------
 x      | integer | 
 y      | integer | 
Distributed Replicated

\d bar
       Table "rpt.bar"
 Column |  Type   | Modifiers 
--------+---------+-----------
 x      | integer | 
 y      | integer | 
Distributed by: (x)

\d bar1
       Table "rpt.bar1"
 Column |  Type   | Modifiers 
--------+---------+-----------
 x      | integer | 
 y      | integer | 
Distributed randomly

-- verify the reorganized data again
select * from foo;
 x  | y  
----+----
  1 |  1
  2 |  2
  3 |  3
  4 |  4
  5 |  5
  6 |  6
  7 |  7
  8 |  8
  9 |  9
 10 | 10
(10 rows)

select * from foo1;
 x  | y  
----+----
  1 |  1
  2 |  2
  3 |  3
  4 |  4
  5 |  5
  6 |  6
  7 |  7
  8 |  8
  9 |  9
 10 | 10
(10 rows)

select * from bar;
 x  | y  
----+----
  1 |  1
  2 |  2
  3 |  3
  4 |  4
  5 |  5
  6 |  6
  7 |  7
  8 |  8
  9 |  9
 10 | 10
(10 rows)

select * from bar1;
 x  | y  
----+----
  1 |  1
  2 |  2
  3 |  3
  4 |  4
  5 |  5
  6 |  6
  7 |  7
  8 |  8
  9 |  9
 10 | 10
(10 rows)

drop table if exists foo;
drop table if exists foo1;
drop table if exists bar;
drop table if exists bar1;
---------
-- UPDATE / DELETE
---------
create table foo(x int, y int) distributed replicated;
create table bar(x int, y int);
NOTICE:  Table doesn't have 'DISTRIBUTED BY' clause -- Using column named 'x' as the Greenplum Database data distribution key for this table.
HINT:  The 'DISTRIBUTED BY' clause determines the distribution of data. Make sure column(s) chosen are the optimal data distribution key to minimize skew.
insert into foo values (1, 1), (2, 1);
insert into bar values (1, 2), (2, 2);
update foo set y = 2 where y = 1;
select * from foo;
 x | y 
---+---
 1 | 2
 2 | 2
(2 rows)

update foo set y = 1 from bar where bar.y = foo.y;
select * from foo;
 x | y 
---+---
 1 | 1
 2 | 1
(2 rows)

delete from foo where y = 1;
select * from foo;
 x | y 
---+---
(0 rows)

drop schema rpt cascade;
NOTICE:  drop cascades to 2 other objects
DETAIL:  drop cascades to table foo
drop cascades to table bar
