-- create functions to query uaocs auxiliary tables through gp_dist_random instead of going through utility mode
CREATE OR REPLACE FUNCTION gp_aocsseg_dist_random(
  IN relation_name text) RETURNS setof record AS $$
DECLARE
  record_text text;
  result record;
BEGIN
  for record_text in
      EXECUTE 'select gp_toolkit.__gp_aocsseg(''' || relation_name || '''::regclass)::text from gp_dist_random(''gp_id'');'
  loop
      EXECUTE 'select a[3], a[4], a[5], a[6], a[7], a[8] from
              (select regexp_split_to_array(''' || record_text ||''', '','')) as dt(a);' into result;
      return next result;
  end loop;
  return;
END;
$$ LANGUAGE plpgsql;
CREATE TYPE pt_eof_typ AS (segment_file_num int, mirror_append_only_new_eof bigint);
CREATE OR REPLACE FUNCTION pt_eof(relname name) RETURNS setof pt_eof_typ AS
$$
  select pt.segment_file_num, pt.mirror_append_only_new_eof from
  pg_class c inner join gp_persistent_relation_node pt on
  c.relfilenode = pt.relfilenode_oid and c.relname = $1 and
  pt.mirror_append_only_new_eof != 0;
$$ language SQL;
-- Verify empty visimap for uaocs table
create table uaocs_table_check_empty_visimap (i int, j varchar(20), k int ) with (appendonly=true, orientation=column) DISTRIBUTED BY (i);
insert into uaocs_table_check_empty_visimap values(1,'test',2);
select 1 from pg_appendonly where visimapidxid is not null and visimapidxid is not NULL and relid='uaocs_table_check_empty_visimap'::regclass;
 ?column? 
----------
        1
(1 row)

-- Verify the hidden tup_count using UDF gp_aovisimap_hidden_info(oid) for uaocs relation after delete and vacuum
create table uaocs_table_check_hidden_tup_count_after_delete(i int, j varchar(20), k int ) with (appendonly=true, orientation=column) DISTRIBUTED BY (i);
insert into uaocs_table_check_hidden_tup_count_after_delete select i,'aa'||i,i+10 from generate_series(1,10) as i;
select gp_toolkit.__gp_aovisimap_hidden_info('uaocs_table_check_hidden_tup_count_after_delete'::regclass) from gp_dist_random('gp_id');
 __gp_aovisimap_hidden_info 
----------------------------
 (1,0,5)
 (1,0,3)
 (1,0,2)
(3 rows)

delete from uaocs_table_check_hidden_tup_count_after_delete where i = 1;
select gp_toolkit.__gp_aovisimap_hidden_info('uaocs_table_check_hidden_tup_count_after_delete'::regclass) from gp_dist_random('gp_id');
 __gp_aovisimap_hidden_info 
----------------------------
 (1,0,5)
 (1,0,3)
 (1,1,2)
(3 rows)

vacuum full uaocs_table_check_hidden_tup_count_after_delete;
select gp_toolkit.__gp_aovisimap_hidden_info('uaocs_table_check_hidden_tup_count_after_delete'::regclass) from gp_dist_random('gp_id');
 __gp_aovisimap_hidden_info 
----------------------------
 (1,0,3)
 (2,0,0)
 (1,0,0)
 (2,0,1)
 (1,0,5)
 (2,0,0)
(6 rows)

-- Verify the hidden tup_count using UDF gp_aovisimap_hidden_info(oid) for uaocs relation after update and vacuum
create table uaocs_table_check_hidden_tup_count_after_update(i int, j varchar(20), k int ) with (appendonly=true, orientation=column) DISTRIBUTED BY (i);
insert into uaocs_table_check_hidden_tup_count_after_update select i,'aa'||i,i+10 from generate_series(1,10) as i;
select gp_toolkit.__gp_aovisimap_hidden_info('uaocs_table_check_hidden_tup_count_after_update'::regclass) from gp_dist_random('gp_id');
 __gp_aovisimap_hidden_info 
----------------------------
 (1,0,3)
 (1,0,2)
 (1,0,5)
(3 rows)

update uaocs_table_check_hidden_tup_count_after_update set j = 'test_update';
select gp_toolkit.__gp_aovisimap_hidden_info('uaocs_table_check_hidden_tup_count_after_update'::regclass) from gp_dist_random('gp_id');
 __gp_aovisimap_hidden_info 
----------------------------
 (1,2,4)
 (1,3,6)
 (1,5,10)
(3 rows)

vacuum full uaocs_table_check_hidden_tup_count_after_update;
select gp_toolkit.__gp_aovisimap_hidden_info('uaocs_table_check_hidden_tup_count_after_update'::regclass) from gp_dist_random('gp_id');
 __gp_aovisimap_hidden_info 
----------------------------
 (1,0,0)
 (2,0,3)
 (1,0,0)
 (2,0,5)
 (1,0,0)
 (2,0,2)
(6 rows)

-- Verify the eof in pg_aocsseg and gp_persistent_relation_node are the same for uaocs relation after delete
create table uaocs_table_check_eof_after_delete(i int, j varchar(20), k int ) with (appendonly=true, orientation=column) DISTRIBUTED BY (i);
insert into uaocs_table_check_eof_after_delete select i,'aa'||i,i+10 from generate_series(1,20) as i;
select pt_eof('uaocs_table_check_eof_after_delete') from gp_dist_random('gp_id');
  pt_eof  
----------
 (1,64)
 (129,64)
 (257,64)
 (1,72)
 (129,80)
 (257,72)
 (1,72)
 (129,80)
 (257,72)
(9 rows)

select * from gp_aocsseg_dist_random('uaocs_table_check_eof_after_delete') as (segno text, column_num text, physical_segno text, tupcount text, eof text, eof_uncompressed text);
 segno | column_num | physical_segno | tupcount | eof | eof_uncompressed 
-------+------------+----------------+----------+-----+------------------
 1     | 0          | 1              | 8        | 72  | 72
 1     | 1          | 129            | 8        | 80  | 80
 1     | 2          | 257            | 8        | 72  | 72
 1     | 0          | 1              | 5        | 64  | 64
 1     | 1          | 129            | 5        | 64  | 64
 1     | 2          | 257            | 5        | 64  | 64
 1     | 0          | 1              | 7        | 72  | 72
 1     | 1          | 129            | 7        | 80  | 80
 1     | 2          | 257            | 7        | 72  | 72
(9 rows)

delete from uaocs_table_check_eof_after_delete where i in (1,5,13);
select pt_eof('uaocs_table_check_eof_after_delete') from gp_dist_random('gp_id');
  pt_eof  
----------
 (1,72)
 (129,80)
 (257,72)
 (1,72)
 (129,80)
 (257,72)
 (1,64)
 (129,64)
 (257,64)
(9 rows)

select * from gp_aocsseg_dist_random('uaocs_table_check_eof_after_delete') as (segno text, column_num text, physical_segno text, tupcount text, eof text, eof_uncompressed text);
 segno | column_num | physical_segno | tupcount | eof | eof_uncompressed 
-------+------------+----------------+----------+-----+------------------
 1     | 0          | 1              | 8        | 72  | 72
 1     | 1          | 129            | 8        | 80  | 80
 1     | 2          | 257            | 8        | 72  | 72
 1     | 0          | 1              | 7        | 72  | 72
 1     | 1          | 129            | 7        | 80  | 80
 1     | 2          | 257            | 7        | 72  | 72
 1     | 0          | 1              | 5        | 64  | 64
 1     | 1          | 129            | 5        | 64  | 64
 1     | 2          | 257            | 5        | 64  | 64
(9 rows)

vacuum full uaocs_table_check_eof_after_delete;
select pt_eof('uaocs_table_check_eof_after_delete') from gp_dist_random('gp_id');
  pt_eof  
----------
 (1,64)
 (129,64)
 (257,64)
 (2,72)
 (130,72)
 (258,72)
 (2,64)
 (130,64)
 (258,64)
(9 rows)

select * from gp_aocsseg_dist_random('uaocs_table_check_eof_after_delete') as (segno text, column_num text, physical_segno text, tupcount text, eof text, eof_uncompressed text);
 segno | column_num | physical_segno | tupcount | eof | eof_uncompressed 
-------+------------+----------------+----------+-----+------------------
 1     | 0          | 1              | 0        | 0   | 0
 1     | 1          | 129            | 0        | 0   | 0
 1     | 2          | 257            | 0        | 0   | 0
 2     | 0          | 2              | 7        | 72  | 72
 2     | 1          | 130            | 7        | 72  | 72
 2     | 2          | 258            | 7        | 72  | 72
 1     | 0          | 1              | 0        | 0   | 0
 1     | 1          | 129            | 0        | 0   | 0
 1     | 2          | 257            | 0        | 0   | 0
 2     | 0          | 2              | 5        | 64  | 64
 2     | 1          | 130            | 5        | 64  | 64
 2     | 2          | 258            | 5        | 64  | 64
 1     | 0          | 1              | 5        | 64  | 64
 1     | 1          | 129            | 5        | 64  | 64
 1     | 2          | 257            | 5        | 64  | 64
 2     | 0          | 2              | 0        | 0   | 0
 2     | 1          | 130            | 0        | 0   | 0
 2     | 2          | 258            | 0        | 0   | 0
(18 rows)

-- Verify the eof in pg_aocsseg and gp_persistent_relation_node are the same for uaocs relation after update
create table uaocs_table_check_eof_after_update(i int, j varchar(20), k int ) with (appendonly=true, orientation=column) DISTRIBUTED BY (i);
insert into uaocs_table_check_eof_after_update select i,'aa'||i,i+10 from generate_series(1,20) as i;
select pt_eof('uaocs_table_check_eof_after_update') from gp_dist_random('gp_id');
  pt_eof  
----------
 (1,72)
 (129,80)
 (257,72)
 (1,64)
 (129,64)
 (257,64)
 (1,72)
 (129,80)
 (257,72)
(9 rows)

select * from gp_aocsseg_dist_random('uaocs_table_check_eof_after_update') as (segno text, column_num text, physical_segno text, tupcount text, eof text, eof_uncompressed text);
 segno | column_num | physical_segno | tupcount | eof | eof_uncompressed 
-------+------------+----------------+----------+-----+------------------
 1     | 0          | 1              | 5        | 64  | 64
 1     | 1          | 129            | 5        | 64  | 64
 1     | 2          | 257            | 5        | 64  | 64
 1     | 0          | 1              | 7        | 72  | 72
 1     | 1          | 129            | 7        | 80  | 80
 1     | 2          | 257            | 7        | 72  | 72
 1     | 0          | 1              | 8        | 72  | 72
 1     | 1          | 129            | 8        | 80  | 80
 1     | 2          | 257            | 8        | 72  | 72
(9 rows)

update uaocs_table_check_eof_after_update set k = k + 100 where i in (1,5,13);
select pt_eof('uaocs_table_check_eof_after_update') from gp_dist_random('gp_id');
  pt_eof   
-----------
 (1,120)
 (129,128)
 (257,120)
 (1,64)
 (129,64)
 (257,64)
 (1,120)
 (129,136)
 (257,120)
(9 rows)

select * from gp_aocsseg_dist_random('uaocs_table_check_eof_after_update') as (segno text, column_num text, physical_segno text, tupcount text, eof text, eof_uncompressed text);
 segno | column_num | physical_segno | tupcount | eof | eof_uncompressed 
-------+------------+----------------+----------+-----+------------------
 1     | 0          | 1              | 9        | 120 | 120
 1     | 1          | 129            | 9        | 136 | 136
 1     | 2          | 257            | 9        | 120 | 120
 1     | 0          | 1              | 5        | 64  | 64
 1     | 1          | 129            | 5        | 64  | 64
 1     | 2          | 257            | 5        | 64  | 64
 1     | 0          | 1              | 9        | 120 | 120
 1     | 1          | 129            | 9        | 128 | 128
 1     | 2          | 257            | 9        | 120 | 120
(9 rows)

vacuum full uaocs_table_check_eof_after_update;
select pt_eof('uaocs_table_check_eof_after_update') from gp_dist_random('gp_id');
  pt_eof  
----------
 (1,64)
 (129,64)
 (257,64)
 (2,72)
 (130,80)
 (258,72)
 (2,72)
 (130,80)
 (258,72)
(9 rows)

select * from gp_aocsseg_dist_random('uaocs_table_check_eof_after_update') as (segno text, column_num text, physical_segno text, tupcount text, eof text, eof_uncompressed text);
 segno | column_num | physical_segno | tupcount | eof | eof_uncompressed 
-------+------------+----------------+----------+-----+------------------
 1     | 0          | 1              | 5        | 64  | 64
 1     | 1          | 129            | 5        | 64  | 64
 1     | 2          | 257            | 5        | 64  | 64
 2     | 0          | 2              | 0        | 0   | 0
 2     | 1          | 130            | 0        | 0   | 0
 2     | 2          | 258            | 0        | 0   | 0
 1     | 0          | 1              | 0        | 0   | 0
 1     | 1          | 129            | 0        | 0   | 0
 1     | 2          | 257            | 0        | 0   | 0
 2     | 0          | 2              | 8        | 72  | 72
 2     | 1          | 130            | 8        | 80  | 80
 2     | 2          | 258            | 8        | 72  | 72
 1     | 0          | 1              | 0        | 0   | 0
 1     | 1          | 129            | 0        | 0   | 0
 1     | 2          | 257            | 0        | 0   | 0
 2     | 0          | 2              | 7        | 72  | 72
 2     | 1          | 130            | 7        | 80  | 80
 2     | 2          | 258            | 7        | 72  | 72
(18 rows)

