--
-- VACUUM
--
CREATE TABLE vactst (j INT DEFAULT 1,i INT);
INSERT INTO vactst(i) VALUES (1);
INSERT INTO vactst SELECT * FROM vactst;
INSERT INTO vactst SELECT * FROM vactst;
INSERT INTO vactst SELECT * FROM vactst;
INSERT INTO vactst SELECT * FROM vactst;
INSERT INTO vactst SELECT * FROM vactst;
INSERT INTO vactst SELECT * FROM vactst;
INSERT INTO vactst SELECT * FROM vactst;
INSERT INTO vactst SELECT * FROM vactst;
INSERT INTO vactst SELECT * FROM vactst;
INSERT INTO vactst SELECT * FROM vactst;
INSERT INTO vactst SELECT * FROM vactst;
INSERT INTO vactst(i) VALUES (0);
SELECT count(*) FROM vactst;
 count 
-------
  2049
(1 row)

DELETE FROM vactst WHERE i != 0;
SELECT i FROM vactst ORDER BY 1;
 i 
---
 0
(1 row)

VACUUM FULL vactst;
UPDATE vactst SET i = i + 1;
INSERT INTO vactst SELECT * FROM vactst;
INSERT INTO vactst SELECT * FROM vactst;
INSERT INTO vactst SELECT * FROM vactst;
INSERT INTO vactst SELECT * FROM vactst;
INSERT INTO vactst SELECT * FROM vactst;
INSERT INTO vactst SELECT * FROM vactst;
INSERT INTO vactst SELECT * FROM vactst;
INSERT INTO vactst SELECT * FROM vactst;
INSERT INTO vactst SELECT * FROM vactst;
INSERT INTO vactst SELECT * FROM vactst;
INSERT INTO vactst SELECT * FROM vactst;
INSERT INTO vactst(i) VALUES (0);
SELECT count(*) FROM vactst;
 count 
-------
  2049
(1 row)

DELETE FROM vactst WHERE i != 0;
VACUUM (FULL) vactst;
DELETE FROM vactst;
SELECT i FROM vactst ORDER BY 1;
 i 
---
(0 rows)

VACUUM (FULL, FREEZE) vactst;
VACUUM (ANALYZE, FULL) vactst;
CREATE TABLE vaccluster (i INT PRIMARY KEY);
ALTER TABLE vaccluster CLUSTER ON vaccluster_pkey;
CLUSTER vaccluster;
CREATE FUNCTION do_analyze() RETURNS VOID VOLATILE LANGUAGE SQL
	AS 'ANALYZE pg_am';
CREATE FUNCTION wrap_do_analyze(c INT) RETURNS INT IMMUTABLE LANGUAGE SQL
	AS 'SELECT $1 FROM do_analyze()';
CREATE INDEX ON vaccluster(wrap_do_analyze(i));
-- GPDB_94_MERGE_FIXME: GPDB does not support this but I do not think we will
-- support that in short time. Note this causes "ANALYZE/VACUUM FULL vaccluster"
-- succeed (On PG it fails: "ERROR:  ANALYZE cannot be executed from VACUUM or ANALYZE")
INSERT INTO vaccluster VALUES (1), (2);
ERROR:  function cannot execute on a QE slice because it issues a non-SELECT statement  (seg1 127.0.0.1:25433 pid=15126)
CONTEXT:  SQL function "do_analyze" during startup
SQL function "wrap_do_analyze" statement 1
ANALYZE vaccluster;
VACUUM FULL pg_am;
VACUUM FULL pg_class;
VACUUM FULL pg_database;
VACUUM FULL vaccluster;
VACUUM FULL vactst;
-- check behavior with duplicate column mentions
VACUUM ANALYZE vaccluster(i,i);
ERROR:  column "i" of relation "vaccluster" appears more than once
ANALYZE vaccluster(i,i);
ERROR:  column "i" of relation "vaccluster" appears more than once
DROP TABLE vaccluster;
DROP TABLE vactst;
