--Exchange AO partition with a CO table
--start_ignore
Drop table if exists sto_ao_co;
DROP TABLE
--end_ignore
Create table sto_ao_co
 (
 col1 bigint, col2 date, col3 text, col4 int) with(appendonly=true)
 distributed randomly  partition by range(col2)
 subpartition by list (col3)
 subpartition template ( default subpartition subothers, subpartition sub1 values ('one'), subpartition sub2 values ('two'))
 (default partition others, start(date '2008-01-01') end(date '2008-04-30') every(interval '1 month'));
psql:/path/sql_file:1: NOTICE:  CREATE TABLE will create partition "sto_ao_co_1_prt_others" for table "sto_ao_co"
psql:/path/sql_file:1: NOTICE:  CREATE TABLE will create partition "sto_ao_co_1_prt_2" for table "sto_ao_co"
psql:/path/sql_file:1: NOTICE:  CREATE TABLE will create partition "sto_ao_co_1_prt_3" for table "sto_ao_co"
psql:/path/sql_file:1: NOTICE:  CREATE TABLE will create partition "sto_ao_co_1_prt_4" for table "sto_ao_co"
psql:/path/sql_file:1: NOTICE:  CREATE TABLE will create partition "sto_ao_co_1_prt_5" for table "sto_ao_co"
psql:/path/sql_file:1: NOTICE:  CREATE TABLE will create partition "sto_ao_co_1_prt_others_2_prt_subothers" for table "sto_ao_co_1_prt_others"
psql:/path/sql_file:1: NOTICE:  CREATE TABLE will create partition "sto_ao_co_1_prt_others_2_prt_sub1" for table "sto_ao_co_1_prt_others"
psql:/path/sql_file:1: NOTICE:  CREATE TABLE will create partition "sto_ao_co_1_prt_others_2_prt_sub2" for table "sto_ao_co_1_prt_others"
psql:/path/sql_file:1: NOTICE:  CREATE TABLE will create partition "sto_ao_co_1_prt_2_2_prt_subothers" for table "sto_ao_co_1_prt_2"
psql:/path/sql_file:1: NOTICE:  CREATE TABLE will create partition "sto_ao_co_1_prt_2_2_prt_sub1" for table "sto_ao_co_1_prt_2"
psql:/path/sql_file:1: NOTICE:  CREATE TABLE will create partition "sto_ao_co_1_prt_2_2_prt_sub2" for table "sto_ao_co_1_prt_2"
psql:/path/sql_file:1: NOTICE:  CREATE TABLE will create partition "sto_ao_co_1_prt_3_2_prt_subothers" for table "sto_ao_co_1_prt_3"
psql:/path/sql_file:1: NOTICE:  CREATE TABLE will create partition "sto_ao_co_1_prt_3_2_prt_sub1" for table "sto_ao_co_1_prt_3"
psql:/path/sql_file:1: NOTICE:  CREATE TABLE will create partition "sto_ao_co_1_prt_3_2_prt_sub2" for table "sto_ao_co_1_prt_3"
psql:/path/sql_file:1: NOTICE:  CREATE TABLE will create partition "sto_ao_co_1_prt_4_2_prt_subothers" for table "sto_ao_co_1_prt_4"
psql:/path/sql_file:1: NOTICE:  CREATE TABLE will create partition "sto_ao_co_1_prt_4_2_prt_sub1" for table "sto_ao_co_1_prt_4"
psql:/path/sql_file:1: NOTICE:  CREATE TABLE will create partition "sto_ao_co_1_prt_4_2_prt_sub2" for table "sto_ao_co_1_prt_4"
psql:/path/sql_file:1: NOTICE:  CREATE TABLE will create partition "sto_ao_co_1_prt_5_2_prt_subothers" for table "sto_ao_co_1_prt_5"
psql:/path/sql_file:1: NOTICE:  CREATE TABLE will create partition "sto_ao_co_1_prt_5_2_prt_sub1" for table "sto_ao_co_1_prt_5"
psql:/path/sql_file:1: NOTICE:  CREATE TABLE will create partition "sto_ao_co_1_prt_5_2_prt_sub2" for table "sto_ao_co_1_prt_5"
CREATE TABLE
insert into sto_ao_co(col1, col2, col3) values (1, '2008-01-02', 'one');
INSERT 0 1
insert into sto_ao_co(col1, col2, col3) values (1, '2008-02-03', 'two');
INSERT 0 1
insert into sto_ao_co(col1, col2, col3)  values(1, '2008-03-04', 'three');
INSERT 0 1
insert into sto_ao_co(col1, col2, col3) values (1, '2008-04-05', 'one');
INSERT 0 1
insert into sto_ao_co(col1, col2, col3) values (1, '2008-05-06', 'two');
INSERT 0 1
SELECT 1 AS VisimapPresent  FROM pg_appendonly WHERE visimapidxid is not NULL AND visimapidxid is not NULL AND relid=(SELECT oid FROM pg_class WHERE relname='sto_ao_co');
 visimappresent 
----------------
              1
(1 row)

select oid::regclass, relkind, relstorage from pg_class where relname like 'sto_ao_co_1_prt_5_2_prt_subothers%' order by oid;
                oid                | relkind | relstorage 
-----------------------------------+---------+------------
 sto_ao_co_1_prt_5_2_prt_subothers | r       | a
(1 row)

--start_ignore
Drop table if exists exh_ao_co;
DROP TABLE
--end_ignore
create table exh_ao_co (like sto_ao_co) with (appendonly=true, orientation=column);
psql:/path/sql_file:1: NOTICE:  Table doesn't have 'distributed by' clause, defaulting to distribution columns from LIKE table
CREATE TABLE
insert into exh_ao_co values (1, '2008-04-20', 'two'),  (2, '2008-04-21', 'two');
INSERT 0 2
Alter table sto_ao_co alter partition for (rank(4)) exchange partition for ('two') with table exh_ao_co;
psql:/path/sql_file:1: NOTICE:  exchanged partition "sub2" of partition for rank 4 of relation "sto_ao_co" with relation "exh_ao_co"
ALTER TABLE
select oid::regclass, relkind, relstorage from pg_class where relname like 'sto_ao_co_1_prt_5_2_prt_sub2%' order by oid;
                oid           | relkind | relstorage 
------------------------------+---------+------------
 sto_ao_co_1_prt_5_2_prt_sub2 | r       | c
(1 row)

select * from sto_ao_co order by col2;
 col1 |    col2    | col3  | col4 
------+------------+-------+------
    1 | 2008-01-02 | one   |     
    1 | 2008-02-03 | two   |     
    1 | 2008-03-04 | three |     
    1 | 2008-04-05 | one   |     
    1 | 2008-04-20 | two   |     
    2 | 2008-04-21 | two   |     
    1 | 2008-05-06 | two   |     
(7 rows)

Update sto_ao_co set col4=2 where col2='2008-04-20';
UPDATE 1
set gp_select_invisible = true;
SET
select * from sto_ao_co order by col2,col4;
 col1 |    col2    | col3  | col4 
------+------------+-------+------
    1 | 2008-01-02 | one   |     
    1 | 2008-02-03 | two   |     
    1 | 2008-03-04 | three |     
    1 | 2008-04-05 | one   |     
    1 | 2008-04-20 | two   |    2
    1 | 2008-04-20 | two   |     
    2 | 2008-04-21 | two   |     
    1 | 2008-05-06 | two   |     
(8 rows)

set gp_select_invisible = false;
SET
select * from sto_ao_co order by col2,col4;
 col1 |    col2    | col3  | col4 
------+------------+-------+------
    1 | 2008-01-02 | one   |     
    1 | 2008-02-03 | two   |     
    1 | 2008-03-04 | three |     
    1 | 2008-04-05 | one   |     
    1 | 2008-04-20 | two   |    2
    2 | 2008-04-21 | two   |     
    1 | 2008-05-06 | two   |     
(7 rows)

Delete from sto_ao_co where col2='2008-04-21';
DELETE 1
set gp_select_invisible = true;
SET
select * from sto_ao_co order by col2,col4;
 col1 |    col2    | col3  | col4 
------+------------+-------+------
    1 | 2008-01-02 | one   |     
    1 | 2008-02-03 | two   |     
    1 | 2008-03-04 | three |     
    1 | 2008-04-05 | one   |     
    1 | 2008-04-20 | two   |    2
    1 | 2008-04-20 | two   |     
    2 | 2008-04-21 | two   |     
    1 | 2008-05-06 | two   |     
(8 rows)

set gp_select_invisible = false;
SET
select * from sto_ao_co order by col2,col4;
 col1 |    col2    | col3  | col4 
------+------------+-------+------
    1 | 2008-01-02 | one   |     
    1 | 2008-02-03 | two   |     
    1 | 2008-03-04 | three |     
    1 | 2008-04-05 | one   |     
    1 | 2008-04-20 | two   |    2
    1 | 2008-05-06 | two   |     
(6 rows)

VACUUM sto_ao_co;
VACUUM
select count(*) AS only_visi_tups_vacuum  from sto_ao_co;
 only_visi_tups_vacuum 
-----------------------
                     6
(1 row)

set gp_select_invisible = true;
SET
select count(*) AS invisi_and_visi_tups_vacuum  from sto_ao_co;
 invisi_and_visi_tups_vacuum 
-----------------------------
                           6
(1 row)

set gp_select_invisible = false;
SET
