-- @description : : delete from Partitioned Updatable AO tables 
-- 
-- Create AO part tables
DROP TABLE if exists sto_uao_p1_del;
DROP TABLE
CREATE TABLE  sto_uao_p1_del
 (
 col1 bigint, col2 date, col3 text, col4 int) with(appendonly=true)
 distributed randomly  partition by range(col2)
 subpartition by list (col3)
 subpartition template ( default subpartition subothers, subpartition sub1 values ('one'), subpartition sub2 values ('two')) 
 (default partition others, start(date '2008-01-01') end(date '2008-04-30') every(interval '1 month'));
CREATE TABLE
SELECT 1  AS VisimapPresent FROM pg_appendonly WHERE visimapidxid is not NULL AND visimapidxid is not NULL AND relid=(SELECT oid  FROM pg_class WHERE relname='sto_uao_p1_del');
 visimappresent 
----------------
              1
(1 row)

\d+ sto_uao_p1_del;
       Append-Only Table "public.sto_uao_p1_del"
 Column |  Type   | Modifiers | Storage  | Description 
--------+---------+-----------+----------+-------------
 col1   | bigint  |           | plain    | 
 col2   | date    |           | plain    | 
 col3   | text    |           | extended | 
 col4   | integer |           | plain    | 
Compression Type: None
Compression Level: 0
Block Size: 32768
Checksum: f
Child tables: sto_uao_p1_del_1_prt_2,
              sto_uao_p1_del_1_prt_3,
              sto_uao_p1_del_1_prt_4,
              sto_uao_p1_del_1_prt_5,
              sto_uao_p1_del_1_prt_others
Has OIDs: no
Options: appendonly=true
Distributed randomly

insert into sto_uao_p1_del(col1, col2, col3) values (1, '2008-01-02', 'one'), (2, '2008-01-02', 'two'), (3, '2008-01-02', 'three');
INSERT 0 3
insert into sto_uao_p1_del(col1, col2, col3) values (2, '2008-02-03', 'two'), (2, '2008-02-03', 'one'), (3, '2008-02-03', 'three');
INSERT 0 3
insert into sto_uao_p1_del(col1, col2, col3)  values(3, '2008-03-04', 'three'),(1, '2008-04-04', 'one'), (2, '2008-03-04', 'two') ;
INSERT 0 3
insert into sto_uao_p1_del(col1, col2, col3) values (4, '2008-04-05', 'one'), (2, '2008-04-05', 'two'), (3, '2008-04-05', 'three');
INSERT 0 3
insert into sto_uao_p1_del(col1, col2, col3) values (5, '2008-05-06', 'one'), (2, '2008-05-06', 'two'), (3, '2008-05-06', 'three');
INSERT 0 3
select count(*) from sto_uao_p1_del ;
 count 
-------
    15
(1 row)

delete from sto_uao_p1_del  where col3='two' and col1=2;
DELETE 5
select count(*) AS only_visi_tups  from sto_uao_p1_del;
 only_visi_tups 
----------------
             10
(1 row)

set gp_select_invisible = true;
SET
select count(*) AS invisi_and_visi_tups  from sto_uao_p1_del;
 invisi_and_visi_tups 
----------------------
                   15
(1 row)

set gp_select_invisible = false;
SET
-- AO Mixed part tables
-- Mixed part tables
Drop table if exists sto_uao_mx_p1_del;
DROP TABLE
create table sto_uao_mx_p1_del
(
col1 bigint, col2 date, col3 text, col4 int) with(appendonly=true)
distributed randomly  partition by range(col2)
subpartition by list (col3)
subpartition template (
default subpartition subothers,
subpartition sub1 values ('one'),
subpartition sub2 values ('two') with(appendonly = false),
subpartition sub3 values ('three') with(appendonly=true))
(default partition others, start(date '2008-01-01') end(date '2008-04-30') every(interval '1 month'));
CREATE TABLE
SELECT 1  AS VisimapPresent FROM pg_appendonly WHERE visimapidxid is not NULL AND visimapidxid is not NULL AND relid=(SELECT oid  FROM pg_class WHERE relname='sto_uao_mx_p1_del');
 visimappresent 
----------------
              1
(1 row)

insert into sto_uao_mx_p1_del(col1, col2, col3) values (1, '2008-01-02', 'one'), (2, '2008-01-02', 'two'), (3, '2008-01-02', 'three'), (4, '2008-01-02' ,'four');
INSERT 0 4
insert into sto_uao_mx_p1_del(col1, col2, col3) values (1, '2008-02-03', 'two'), (2, '2008-02-03', 'one'), (3, '2008-02-03', 'three'), (4, '2008-02-03' ,'four');
INSERT 0 4
insert into sto_uao_mx_p1_del(col1, col2, col3)  values(1, '2008-03-04', 'three'),(1, '2008-04-04', 'one'), (2, '2008-03-04', 'two'), (4, '2008-03-04' ,'four') ;
INSERT 0 4
insert into sto_uao_mx_p1_del(col1, col2, col3) values (1, '2008-04-05', 'one'), (2, '2008-04-05', 'two'), (3, '2008-04-05', 'three'), (4, '2008-04-05', 'four');
INSERT 0 4
insert into sto_uao_mx_p1_del(col1, col2, col3) values (1, '2008-05-06', 'one'), (2, '2008-05-06', 'two'), (3, '2008-05-06', 'three'), (4, '2008-05-06', 'four');
INSERT 0 4
select count(*) from sto_uao_mx_p1_del;
 count 
-------
    20
(1 row)

delete from sto_uao_mx_p1_del  where col3='two' and col1=2;
DELETE 4
select count(*) AS only_visi_tups  from sto_uao_mx_p1_del;
 only_visi_tups 
----------------
             16
(1 row)

set gp_select_invisible = true;
SET
select count(*) AS invisi_and_visi_tups  from sto_uao_mx_p1_del;
 invisi_and_visi_tups 
----------------------
                   20
(1 row)

set gp_select_invisible = false;
SET
