DROP TABLE IF EXISTS part_tbl_upd_del;
DROP

-- check gdd is on
show gp_enable_global_deadlock_detector;
 gp_enable_global_deadlock_detector 
------------------------------------
 on                                 
(1 row)

CREATE TABLE part_tbl_upd_del (a int, b int, c int) PARTITION BY RANGE(b) (START(1) END(2) EVERY(1));
CREATE
INSERT INTO part_tbl_upd_del SELECT i, 1, i FROM generate_series(1,10)i;
INSERT 10

1: BEGIN;
BEGIN
1: DELETE FROM part_tbl_upd_del;
DELETE 10
-- since the delete operation is on root part and gdd is on, there will be no lock on leaf partition on QD
1: SELECT 1 FROM pg_locks WHERE relation='part_tbl_upd_del_1_prt_1'::regclass::oid AND gp_segment_id = -1;
 ?column? 
----------
(0 rows)
-- lock on qd will be there for root partition
1: SELECT 1 FROM pg_locks WHERE relation='part_tbl_upd_del'::regclass::oid AND gp_segment_id = -1;
 ?column? 
----------
 1        
(1 row)
1: ROLLBACK;
ROLLBACK


1: BEGIN;
BEGIN
1: UPDATE part_tbl_upd_del SET c = 1 WHERE c = 1;
UPDATE 1
-- since the update operation is on root part and gdd is on, there will be no lock on leaf partition on QD
1: SELECT 1 FROM pg_locks WHERE relation='part_tbl_upd_del_1_prt_1'::regclass::oid AND gp_segment_id = -1;
 ?column? 
----------
(0 rows)
-- lock on qd will be there for root partition
1: SELECT 1 FROM pg_locks WHERE relation='part_tbl_upd_del'::regclass::oid AND gp_segment_id = -1;
 ?column? 
----------
 1        
(1 row)
1: ROLLBACK;
ROLLBACK

1: BEGIN;
BEGIN
1: DELETE FROM part_tbl_upd_del_1_prt_1;
DELETE 10
-- since the delete operation is on leaf part, there will be a lock on QD
1: SELECT 1 FROM pg_locks WHERE relation='part_tbl_upd_del_1_prt_1'::regclass::oid AND gp_segment_id = -1 AND mode='RowExclusiveLock';
 ?column? 
----------
 1        
(1 row)
1: ROLLBACK;
ROLLBACK


1: BEGIN;
BEGIN
1: UPDATE part_tbl_upd_del_1_prt_1 SET c = 1 WHERE c = 1;
UPDATE 1
-- since the update operation is on leaf part, there will be a lock on QD
1: SELECT 1 FROM pg_locks WHERE relation='part_tbl_upd_del_1_prt_1'::regclass::oid AND gp_segment_id = -1 AND mode='RowExclusiveLock';
 ?column? 
----------
 1        
(1 row)
1: ROLLBACK;
ROLLBACK
