-- @Description Tests that deleting tuples twice is handled as expected.
-- 

SELECT COUNT(*) FROM foo;
 count 
-------
  1000
(1 row)

DELETE FROM foo WHERE a < 4;
DELETE 3
SELECT COUNT(*) FROM foo;
 count 
-------
   997
(1 row)

DELETE FROM foo WHERE a < 4;
DELETE 0
SELECT COUNT(*) FROM foo;
 count 
-------
   997
(1 row)

