-- @product_version gpdb: [4.3.1.0-4.3.99.99]
-- Bug verification for mpp-23510
drop table  if exists mpp23510 cascade;
psql:/path/sql_file:1: NOTICE:  table "mpp23510" does not exist, skipping
DROP TABLE
create table mpp23510 (a int, b int, c char(128)) with (appendonly=true);
psql:/path/sql_file:1: NOTICE:  Table doesn't have 'DISTRIBUTED BY' clause -- Using column named 'a' as the Greenplum Database data distribution key for this table.
HINT:  The 'DISTRIBUTED BY' clause determines the distribution of data. Make sure column(s) chosen are the optimal data distribution key to minimize skew.
CREATE TABLE
insert into mpp23510 select i, i-2 ,'Hello World'  from generate_series(-10,10) i;
INSERT 0 21
create index mpp23510_idx on mpp23510(a);
CREATE INDEX
-- force an index scan
set enable_seqscan=off;
SET
select count(*) from mpp23510 where a < 5;
 count 
-------
    15
(1 row)

delete from mpp23510 where a >= 0 and a < 3;
DELETE 3
select count(*) from mpp23510 where a < 5;
 count 
-------
    12
(1 row)

-- Restore scan back to sequential/index
set enable_seqscan=on;
SET
select count(*) from mpp23510 where a < 5;
 count 
-------
    12
(1 row)

insert into mpp23510 select i, i-2 ,'Hello World2'  from generate_series(-11,-15) i;
INSERT 0 0
select count(*) from mpp23510 where a < 7;
 count 
-------
    14
(1 row)

delete from mpp23510 where a >= 0 and a < 7;
DELETE 4
select count(*) from mpp23510 where a < 7;
 count 
-------
    10
(1 row)

set enable_seqscan=off;
SET
select count(*) from mpp23510 where a < 7;
 count 
-------
    10
(1 row)

