DROP TABLE IF EXISTS sto_uao_emp_forcursor cascade;
DROP TABLE
CREATE TABLE sto_uao_emp_forcursor (
   empno    INT  ,
   ename    VARCHAR(10),
   job      VARCHAR(9),
   mgr      INT NULL,
   hiredate DATE,
   sal      NUMERIC(7,2),
   comm     NUMERIC(7,2) NULL,
   dept     INT) with (appendonly=true) distributed by (empno);
CREATE TABLE
insert into sto_uao_emp_forcursor values
 (1,'JOHNSON','ADMIN',6,'12-17-1990',18000,10,4)
,(2,'HARDING','MANAGER',9,'02-02-1998',52000,15,3)
,(3,'TAFT','SALES I',2,'01-02-1996',25000,20,3)
,(4,'HOOVER','SALES I',2,'04-02-1990',27000,15,3)
,(5,'LINCOLN','TECH',6,'06-23-1994',22500,15,4)
,(6,'GARFIELD','MANAGER',9,'05-01-1993',54000,20,4)
,(7,'POLK','TECH',6,'09-22-1997',25000,15,4)
,(8,'GRANT','ENGINEER',10,'03-30-1997',32000,20,2)
,(9,'JACKSON','CEO',NULL,'01-01-1990',75000,30,4)
,(10,'FILLMORE','MANAGER',9,'08-09-1994',56000,20,2)
,(11,'ADAMS','ENGINEER',10,'03-15-1996',34000,20,2)
,(12,'WASHINGTON','ADMIN',6,'04-16-1998',18000,15,4)
,(13,'MONROE','ENGINEER',10,'12-03-2000',30000,20,2)
,(14,'ROOSEVELT','CPA',9,'10-12-1995',35000,30,1)
,(15,'More','ENGINEER',9,'10-12-1994',25000,20,2)
,(16,'ROSE','SALES I',10,'10-12-1999',18000,15,3)
,(17,'CLINT','CPA',2,'10-12-2001',24000,30,1);
INSERT 0 17
DROP TABLE IF EXISTS sto_uao_dept_forcursor cascade;
DROP TABLE
CREATE TABLE sto_uao_dept_forcursor (
   deptno INT NOT NULL,
   dname  VARCHAR(14),
   loc    VARCHAR(15)) with (appendonly=true) distributed by (deptno);
CREATE TABLE
insert into sto_uao_dept_forcursor values
 (1,'ACCOUNTING','ST LOUIS')
,(2,'RESEARCH','NEW YORK')
,(3,'SALES','ATLANTA')
,(4, 'OPERATIONS','SEATTLE');
INSERT 0 4
BEGIN;
BEGIN
DECLARE 
    all_emp_upd_rollback BINARY CURSOR FOR SELECT ename, loc FROM sto_uao_emp_forcursor  JOIN sto_uao_dept_forcursor
                               on dept = deptno order by ename ;
DECLARE CURSOR
    FETCH FIRST from all_emp_upd_rollback;
 ename |   loc    
-------+----------
 ADAMS | NEW YORK
(1 row)

    update sto_uao_dept_forcursor set loc = 'NEW YORK CITY' where loc = 'NEW YORK';
UPDATE 1
    MOVE 5 FROM all_emp_upd_rollback;
MOVE 5
    FETCH  1 from all_emp_upd_rollback ;
 ename  |   loc   
--------+---------
 HOOVER | ATLANTA
(1 row)

    CLOSE all_emp_upd_rollback;
CLOSE CURSOR
ROLLBACK;
ROLLBACK
BEGIN;
BEGIN
DECLARE all_dept BINARY CURSOR FOR SELECT dname,loc from sto_uao_dept_forcursor order by 1;
DECLARE CURSOR
fetch all from all_dept;
   dname    |   loc    
------------+----------
 ACCOUNTING | ST LOUIS
 OPERATIONS | SEATTLE
 RESEARCH   | NEW YORK
 SALES      | ATLANTA
(4 rows)

close all_dept;
CLOSE CURSOR
commit;
COMMIT
BEGIN;
BEGIN
DECLARE all_dept_del_rollback BINARY CURSOR FOR SELECT dname,loc from sto_uao_dept_forcursor order by 1;
DECLARE CURSOR
delete from sto_uao_dept_forcursor where loc = 'NEW YORK';
DELETE 1
fetch all from all_dept_del_rollback;
   dname    |   loc    
------------+----------
 ACCOUNTING | ST LOUIS
 OPERATIONS | SEATTLE
 RESEARCH   | NEW YORK
 SALES      | ATLANTA
(4 rows)

close all_dept_del_rollback;
CLOSE CURSOR
ROLLBACK;
ROLLBACK
BEGIN;
BEGIN
DECLARE all_dept_aft_del BINARY CURSOR FOR SELECT dname,loc from sto_uao_dept_forcursor order by 1;
DECLARE CURSOR
fetch all from all_dept_aft_del;
   dname    |   loc    
------------+----------
 ACCOUNTING | ST LOUIS
 OPERATIONS | SEATTLE
 RESEARCH   | NEW YORK
 SALES      | ATLANTA
(4 rows)

close all_dept_aft_del;
CLOSE CURSOR
commit;
COMMIT
BEGIN;
BEGIN
DECLARE 
    all_emp_del_commit BINARY CURSOR FOR SELECT ename FROM sto_uao_emp_forcursor order by ename desc ;
DECLARE CURSOR
    FETCH FIRST from all_emp_del_commit;
   ename    
------------
 WASHINGTON
(1 row)

    delete FROM sto_uao_emp_forcursor where empno > 10;
DELETE 7
    FETCH 2 from all_emp_del_commit;
 ename 
-------
 TAFT
 ROSE
(2 rows)

    MOVE 5 FROM all_emp_del_commit;
MOVE 5
    FETCH  1 from all_emp_del_commit ;
  ename  
---------
 JOHNSON
(1 row)

    FETCH NEXT from all_emp_del_commit;
  ename  
---------
 JACKSON
(1 row)

    FETCH all from all_emp_del_commit;
  ename   
----------
 HOOVER
 HARDING
 GRANT
 GARFIELD
 FILLMORE
 CLINT
 ADAMS
(7 rows)

    CLOSE all_emp_del_commit;
CLOSE CURSOR
COMMIT;
COMMIT
BEGIN;
BEGIN
DECLARE 
    all_emp_aft_del CURSOR FOR SELECT ename FROM sto_uao_emp_forcursor order by ename desc ;
DECLARE CURSOR
    FETCH all from all_emp_aft_del;
  ename   
----------
 TAFT
 POLK
 LINCOLN
 JOHNSON
 JACKSON
 HOOVER
 HARDING
 GRANT
 GARFIELD
 FILLMORE
(10 rows)

    CLOSE all_emp_aft_del;
CLOSE CURSOR
COMMIT;
COMMIT
BEGIN;
BEGIN
DECLARE 
    all_emp_upd_commit BINARY CURSOR FOR SELECT ename, loc FROM sto_uao_emp_forcursor  JOIN sto_uao_dept_forcursor
                               on dept = deptno order by ename ;
DECLARE CURSOR
    FETCH FIRST from all_emp_upd_commit;
  ename   |   loc    
----------+----------
 FILLMORE | NEW YORK
(1 row)

    FETCH 2 from all_emp_upd_commit;
  ename   |   loc    
----------+----------
 GARFIELD | SEATTLE
 GRANT    | NEW YORK
(2 rows)

    update sto_uao_dept_forcursor set loc = 'NEW YORK CITY' where loc = 'NEW YORK';
UPDATE 1
    MOVE 5 FROM all_emp_upd_commit;
MOVE 5
    FETCH  1 from all_emp_upd_commit ;
 ename |   loc   
-------+---------
 POLK  | SEATTLE
(1 row)

    FETCH NEXT from all_emp_upd_commit;
 ename |   loc   
-------+---------
 TAFT  | ATLANTA
(1 row)

    FETCH all from all_emp_upd_commit;
 ename | loc 
-------+-----
(0 rows)

    CLOSE all_emp_upd_commit;
CLOSE CURSOR
COMMIT;
COMMIT
BEGIN;
BEGIN
DECLARE all_dept2 BINARY CURSOR FOR SELECT dname,loc from sto_uao_dept_forcursor order by 1;
DECLARE CURSOR
fetch all from all_dept2;
   dname    |      loc      
------------+---------------
 ACCOUNTING | ST LOUIS
 OPERATIONS | SEATTLE
 RESEARCH   | NEW YORK CITY
 SALES      | ATLANTA
(4 rows)

close all_dept2;
CLOSE CURSOR
commit;
COMMIT
BEGIN;
BEGIN
DECLARE 
    all_emp_aft_upd BINARY CURSOR FOR SELECT ename, loc FROM sto_uao_emp_forcursor  JOIN sto_uao_dept_forcursor
                               on dept = deptno order by ename ;
DECLARE CURSOR
    FETCH FIRST from all_emp_aft_upd;
  ename   |      loc      
----------+---------------
 FILLMORE | NEW YORK CITY
(1 row)

    FETCH 2 from all_emp_aft_upd;
  ename   |      loc      
----------+---------------
 GARFIELD | SEATTLE
 GRANT    | NEW YORK CITY
(2 rows)

    MOVE 5 FROM all_emp_aft_upd;
MOVE 5
    FETCH  1 from all_emp_aft_upd ;
 ename |   loc   
-------+---------
 POLK  | SEATTLE
(1 row)

    FETCH NEXT from all_emp_aft_upd;
 ename |   loc   
-------+---------
 TAFT  | ATLANTA
(1 row)

    FETCH all from all_emp_aft_upd;
 ename | loc 
-------+-----
(0 rows)

    CLOSE all_emp_aft_upd;
CLOSE CURSOR
COMMIT;
COMMIT
