-- @Description Tests that update is supported in a subtransaction.
-- 

BEGIN;
BEGIN
SAVEPOINT my_savepoint;
SAVEPOINT
SELECT COUNT(*) FROM foo WHERE b = 1;
 count 
-------
     1
(1 row)

UPDATE foo SET b = 1 WHERE a < 4;
UPDATE 3
SAVEPOINT my_savepoint2;
SAVEPOINT
ROLLBACK To my_savepoint;
ROLLBACK
SELECT COUNT(*) FROM foo WHERE b = 1;
 count 
-------
     1
(1 row)

UPDATE foo SET b = 1 WHERE a < 4;
UPDATE 3
COMMIT;
COMMIT
BEGIN;
BEGIN
SAVEPOINT my_savepoint;
SAVEPOINT
SELECT COUNT(*) FROM foo WHERE b = 1;
 count 
-------
     3
(1 row)

UPDATE foo SET b = 1 WHERE a < 8;
UPDATE 7
SAVEPOINT my_savepoint2;
SAVEPOINT
UPDATE foo SET b = 2 WHERE a < 12;
UPDATE 11
SELECT COUNT(*) FROM foo WHERE b = 1;
 count 
-------
     0
(1 row)

ROLLBACK To my_savepoint2;
ROLLBACK
SELECT COUNT(*) FROM foo WHERE b = 1;
 count 
-------
     7
(1 row)

ROLLBACK To my_savepoint;
ROLLBACK
SELECT COUNT(*) FROM foo WHERE b = 1;
 count 
-------
     3
(1 row)

COMMIT;
COMMIT

