-- @Description UAOCS MVCC readcommit and 2 updates on same row
--  Transaction 2 of 2
-- 
select pg_sleep(2);
 pg_sleep 
----------
 
(1 row)

insert into sto_uaocs_mvcc_status (workload, script) values('readcommit_concurrentupdate_delete', 't2_update_delete_one_tuple');
INSERT 0 1
begin;
BEGIN
set transaction isolation level READ COMMITTED;
SET
delete from  sto_uaocs_emp_formvcc  where sal = 18002.00 ;
DELETE 1
select empno,ename from sto_uaocs_emp_formvcc  where sal = 18002.00 ;
 empno | ename 
-------+-------
(0 rows)

commit;
COMMIT
update sto_uaocs_mvcc_status set endtime = CURRENT_TIMESTAMP 
where workload='readcommit_concurrentupdate_delete' 
AND script='t2_update_delete_one_tuple';
UPDATE 1
select empno,ename from sto_uaocs_emp_formvcc  where sal = 18002.00 ;
 empno | ename 
-------+-------
(0 rows)

