create schema alter_ao_table_setstorage_@orientation@;
set search_path="$user",alter_ao_table_setstorage_@orientation@,public;
SET gp_default_storage_options='orientation=@orientation@';
BEGIN;
CREATE TABLE sto_alt_uao1_setstorage(
          text_col text default 'remove it',
          bigint_col bigint,
          char_vary_col character varying(30),
          numeric_col numeric,
          int_col int4 NOT NULL,
          float_col float4,
          int_array_col int[],
          before_rename_col int4,
          change_datatype_col numeric,
          date_column date,
          col_set_default numeric) with(appendonly=true) DISTRIBUTED BY (text_col);
insert into sto_alt_uao1_setstorage values ('0_zero', 0, '0_zero', 0, 0, 0, '{0}', 0, 0, '1-1-2000',0);
insert into sto_alt_uao1_setstorage values ('1_zero', 1, '1_zero', 1, 1, 1, '{1}', 1, 1, '1-1-2001',1);
insert into sto_alt_uao1_setstorage values ('2_zero', 2, '2_zero', 2, 2, 2, '{2}', 2, 2, '1-1-2002',2);
-- Alter table SET STORAGE
Alter Table sto_alt_uao1_setstorage ALTER char_vary_col SET STORAGE PLAIN;
SELECT 1 AS VisimapPresent FROM pg_appendonly WHERE visimapidxid is
not NULL AND visimapidxid is not NULL AND relid='sto_alt_uao1_setstorage'::regclass;
 visimappresent 
----------------
              1
(1 row)

insert into sto_alt_uao1_setstorage values ('2_zero', 2, '2_zero', 2, 2, 2, '{2}', 2, 2, '1-1-2002',2);
update sto_alt_uao1_setstorage set date_column = '2013-08-16' where text_col = '1_zero';
select * from sto_alt_uao1_setstorage order by bigint_col;
 text_col | bigint_col | char_vary_col | numeric_col | int_col | float_col | int_array_col | before_rename_col | change_datatype_col | date_column | col_set_default 
----------+------------+---------------+-------------+---------+-----------+---------------+-------------------+---------------------+-------------+-----------------
 0_zero   |          0 | 0_zero        |           0 |       0 |         0 | {0}           |                 0 |                   0 | 01-01-2000  |               0
 1_zero   |          1 | 1_zero        |           1 |       1 |         1 | {1}           |                 1 |                   1 | 08-16-2013  |               1
 2_zero   |          2 | 2_zero        |           2 |       2 |         2 | {2}           |                 2 |                   2 | 01-01-2002  |               2
 2_zero   |          2 | 2_zero        |           2 |       2 |         2 | {2}           |                 2 |                   2 | 01-01-2002  |               2
(4 rows)

set gp_select_invisible = true;
select count(*)  AS invisi_and_visi_tups from sto_alt_uao1_setstorage;
 invisi_and_visi_tups 
----------------------
                    5
(1 row)

set gp_select_invisible = false;
delete from  sto_alt_uao1_setstorage where text_col = '1_zero';
select * from sto_alt_uao1_setstorage order by bigint_col;
 text_col | bigint_col | char_vary_col | numeric_col | int_col | float_col | int_array_col | before_rename_col | change_datatype_col | date_column | col_set_default 
----------+------------+---------------+-------------+---------+-----------+---------------+-------------------+---------------------+-------------+-----------------
 0_zero   |          0 | 0_zero        |           0 |       0 |         0 | {0}           |                 0 |                   0 | 01-01-2000  |               0
 2_zero   |          2 | 2_zero        |           2 |       2 |         2 | {2}           |                 2 |                   2 | 01-01-2002  |               2
 2_zero   |          2 | 2_zero        |           2 |       2 |         2 | {2}           |                 2 |                   2 | 01-01-2002  |               2
(3 rows)

set gp_select_invisible = true;
select count(*)  AS invisi_and_visi_tups from sto_alt_uao1_setstorage;
 invisi_and_visi_tups 
----------------------
                    5
(1 row)

set gp_select_invisible = false;
-- Alter table set reorganize
Alter Table sto_alt_uao1_setstorage set with (reorganize='true')
 distributed by (bigint_col);
update sto_alt_uao1_setstorage set numeric_col = -bigint_col;
select * from sto_alt_uao1_setstorage;
 text_col | bigint_col | char_vary_col | numeric_col | int_col | float_col | int_array_col | before_rename_col | change_datatype_col | date_column | col_set_default 
----------+------------+---------------+-------------+---------+-----------+---------------+-------------------+---------------------+-------------+-----------------
 0_zero   |          0 | 0_zero        |           0 |       0 |         0 | {0}           |                 0 |                   0 | 01-01-2000  |               0
 2_zero   |          2 | 2_zero        |          -2 |       2 |         2 | {2}           |                 2 |                   2 | 01-01-2002  |               2
 2_zero   |          2 | 2_zero        |          -2 |       2 |         2 | {2}           |                 2 |                   2 | 01-01-2002  |               2
(3 rows)

SELECT 1 AS VisimapPresent FROM pg_appendonly WHERE visimapidxid is
not NULL AND visimapidxid is not NULL AND relid='sto_alt_uao1_setstorage'::regclass;
 visimappresent 
----------------
              1
(1 row)

-- Run another reorganize to confirm that the relcache has been invalidated
-- when we changed the value of this table's gp_distribution_policy. If the
-- relcache wasn't invalidated by the previous ALTER TABLE command, then the
-- table will revert to the original distribution policy.
ALTER TABLE sto_alt_uao1_setstorage SET WITH (reorganize='true');
SELECT gp_segment_id, distkey, policytype FROM gp_distribution_policy WHERE
localoid='alter_ao_table_setstorage_@orientation@.sto_alt_uao1_setstorage'::regclass
UNION
SELECT gp_segment_id, distkey, policytype
FROM gp_dist_random('gp_distribution_policy') WHERE
localoid='alter_ao_table_setstorage_@orientation@.sto_alt_uao1_setstorage'::regclass;
 gp_segment_id | distkey | policytype 
---------------+---------+------------
            -1 | 2       | p
             0 | 2       | p
             1 | 2       | p
             2 | 2       | p
(4 rows)

update sto_alt_uao1_setstorage set numeric_col = -numeric_col;
delete from sto_alt_uao1_setstorage where numeric_col = 0;
select * from sto_alt_uao1_setstorage;
 text_col | bigint_col | char_vary_col | numeric_col | int_col | float_col | int_array_col | before_rename_col | change_datatype_col | date_column | col_set_default 
----------+------------+---------------+-------------+---------+-----------+---------------+-------------------+---------------------+-------------+-----------------
 2_zero   |          2 | 2_zero        |           2 |       2 |         2 | {2}           |                 2 |                   2 | 01-01-2002  |               2
 2_zero   |          2 | 2_zero        |           2 |       2 |         2 | {2}           |                 2 |                   2 | 01-01-2002  |               2
(2 rows)

set gp_select_invisible=true;
select count(*) from sto_alt_uao1_setstorage;
 count 
-------
     6
(1 row)

set gp_select_invisible=false;
SELECT 1 AS VisimapPresent FROM pg_appendonly WHERE visimapidxid is
not NULL AND visimapidxid is not NULL AND relid='sto_alt_uao1_setstorage'::regclass;
 visimappresent 
----------------
              1
(1 row)

COMMIT;
