create schema create_ao_tables_@orientation@;
set search_path="$user",create_ao_tables_@orientation@,public;
SET gp_default_storage_options='orientation=@orientation@';
-- Create Updatable AO tables , with indexes, with and without compression
BEGIN;
CREATE TABLE sto_uao_1(
          col_int int,
          col_text text,
          col_numeric numeric,
          col_unq int
          ) with(appendonly=true) DISTRIBUTED RANDOMLY;
Create index sto_uao_1_int_idx1 on sto_uao_1(col_int);
Create index sto_uao_1_numeric_idx1 on sto_uao_1(col_numeric);
Create index sto_uao_1_idx2 on sto_uao_1 USING bitmap (col_text);
SELECT position('pg_ao' in relname) FROM pg_class where oid IN
(SELECT segrelid FROM pg_appendonly WHERE relid='sto_uao_1'::regclass);
 position 
----------
        1
(1 row)

SELECT position('pg_aoblkdir_' in relname) FROM pg_class where oid IN
(SELECT blkdirrelid FROM pg_appendonly WHERE relid='sto_uao_1'::regclass);
 position 
----------
        1
(1 row)

SELECT position('pg_aoblkdir_' in relname) FROM pg_class where oid IN
(SELECT blkdiridxid FROM pg_appendonly WHERE relid='sto_uao_1'::regclass);
 position 
----------
        1
(1 row)

SELECT position('pg_aovisimap_' in relname) FROM pg_class where oid IN
(SELECT visimaprelid FROM pg_appendonly WHERE relid='sto_uao_1'::regclass);
 position 
----------
        1
(1 row)

SELECT position('pg_aovisimap_' in relname) FROM pg_class where oid IN
(SELECT visimapidxid FROM pg_appendonly WHERE relid='sto_uao_1'::regclass);
 position 
----------
        1
(1 row)

insert into sto_uao_1 values
 (1,'aa',1001,101), (2,'bb',1002,102), (3,'aa',1003,103),
 (4,'bb',1004,104), (5,'aa',1005,105), (6,'bb',1006,106);
select * from sto_uao_1 order by col_numeric;
 col_int | col_text | col_numeric | col_unq 
---------+----------+-------------+---------
       1 | aa       |        1001 |     101
       2 | bb       |        1002 |     102
       3 | aa       |        1003 |     103
       4 | bb       |        1004 |     104
       5 | aa       |        1005 |     105
       6 | bb       |        1006 |     106
(6 rows)

update sto_uao_1 set col_text=' new value' where col_int = 1;
select * from sto_uao_1 order by col_numeric;
 col_int |  col_text  | col_numeric | col_unq 
---------+------------+-------------+---------
       1 |  new value |        1001 |     101
       2 | bb         |        1002 |     102
       3 | aa         |        1003 |     103
       4 | bb         |        1004 |     104
       5 | aa         |        1005 |     105
       6 | bb         |        1006 |     106
(6 rows)

-- Enforce index usage throughout the test
set enable_seqscan = off;
set enable_bitmapscan = on;
-- Create table with all data_types
Create table sto_uao_2 (id SERIAL, a1 int, a2 char(5), a3 numeric, a4
boolean DEFAULT false , a5 char DEFAULT 'd', a6 text, a7 timestamp, a8
character varying(705), a9 bigint, a10 date, a11 varchar(600), a12
text, a13 decimal, a14 real, a15 bigint, a16 int4 , a17 bytea, a18
timestamp with time zone, a19 timetz, a20 path, a21 box, a22 macaddr,
a23 interval, a24 character varying(800), a25 lseg, a26 point, a27
double precision, a28 circle, a29 int4, a30 numeric(8), a31 polygon,
a32 date, a33 real, a34 money, a35 cidr, a36 inet, a37 time, a38 text,
a39 bit, a40 bit varying(5), a41 smallint, a42 int)
with (appendonly=true) distributed by (a1);
NOTICE:  CREATE TABLE will create implicit sequence "sto_uao_2_id_seq" for serial column "sto_uao_2.id"
INSERT INTO sto_uao_2 (a1, a2, a3, a4, a5, a6, a7, a8, a9, a10, a11,
a12, a13, a14, a15, a16, a17, a18, a19, a20, a21, a22, a23, a24, a25,
a26, a27, a28, a29, a30, a31, a32, a33, a34, a35, a36, a37, a38, a39,
a40, a41, a42) values(generate_series(1,4), 'M', 2011, 't', 'a', 'This
is news of today: Deadlock between Republicans and Democrats over how
best to reduce the U.S. deficit, and over what period, has blocked an
agreement to allow the raising of the $14.3 trillion debt ceiling',
'2001-12-24 02:26:11', 'U.S. House of Representatives Speaker John
Boehner, the top Republican in Congress who has put forward a deficit
reduction plan to be voted on later on Thursday said he had no control
over whether his bill would avert a credit downgrade.',
generate_series(5, 7), '2011-10-11', 'The Republican-controlled House
is tentatively scheduled to vote on Boehner proposal this afternoon at
around 6 p.m. EDT (2200 GMT). The main Republican vote counter in the
House, Kevin McCarthy, would not say if there were enough votes to
pass the bill.', 'WASHINGTON:House Speaker John Boehner says his plan
mixing spending cuts in exchange for raising the nations $14.3
trillion debt limit is not perfect but is as large a step that a
divided government can take that is doable and signable by President
Barack Obama.The Ohio Republican says the measure is an honest and
sincere attempt at compromise and was negotiated with Democrats last
weekend and that passing it would end the ongoing debt crisis. The
plan blends $900 billion-plus in spending cuts with a companion
increase in the nations borrowing cap.', '1234.56', 323453,
generate_series(4, 6), 7845, '0011', '2005-07-16 01:51:15+1359',
'2001-12-13 01:51:15', '((1, 2),(0, 3),(2, 1))', '((2, 3)(4, 5))',
'08:00:2b:01:02:03', '1-2', 'Republicans had been working throughout
the day Thursday to lock down support for their plan to raise the
nations debt ceiling, even as Senate Democrats vowed to swiftly kill
it if passed.', '((2, 3)(4, 5))', '(6, 7)', 11.222, '((4, 5), 7)', 32,
3214, '(1, 0, 2, 3)', '2010-02-21', 43564, '$1,000.00', '192.168.1',
'126.1.3.4', '12:30:45', 'Johnson & Johnsons McNeil Consumer
Healthcare announced the voluntary dosage reduction today. Labels will
carry new dosing instructions this fall.The company says it will cut
the maximum dosage of Regular Strength Tylenol and other
acetaminophen-containing products in 2012.Acetaminophen is safe when
used as directed, says Edwin Kuffner, MD, McNeil vice president of
over-the-counter medical affairs. But, when too much is taken, it can
cause liver damage.The action is intended to cut the risk of such
accidental overdoses, the company says in a news release.', '1', '0',
12, 23);
select count(*) from sto_uao_2 order by 1;
 count 
-------
    12
(1 row)

-- Create table with constriants
CREATE TABLE sto_uao_3(
          col_text text DEFAULT 'text',
          col_numeric numeric
          CONSTRAINT tbl_chk_con1 CHECK (col_numeric < 250)
          ) with(appendonly=true) DISTRIBUTED by(col_text);
insert into sto_uao_3 values ('0_zero',30);
insert into sto_uao_3 values ('1_one',10);
insert into sto_uao_3 values ('2_two',25);
COMMIT;
-- should fail due to constraint violation
update sto_uao_3 set col_numeric = 20*col_numeric;
ERROR:  new row for relation "sto_uao_3" violates check constraint "tbl_chk_con1"  (seg0 127.0.0.1:25432 pid=15248)
BEGIN;
update sto_uao_3 set col_numeric = 20+col_numeric;
select count(*) from sto_uao_3;
 count 
-------
     3
(1 row)

delete from sto_uao_3;
insert into sto_uao_3 values ('2_two',25);
select count(*) from sto_uao_3;
 count 
-------
     1
(1 row)

--Create table in user created scehma
Create schema uao_schema1_@orientation@;
CREATE TABLE uao_schema1_@orientation@.sto_uao_5(
          stud_id int,
          stud_name varchar(20)
          ) with(appendonly=true) DISTRIBUTED by(stud_id);
Insert into uao_schema1_@orientation@.sto_uao_5
 values(generate_series(1,20), 'studentname1');
delete from uao_schema1_@orientation@.sto_uao_5;
Insert into uao_schema1_@orientation@.sto_uao_5
 values(generate_series(21, 25), 'studentname2');
select count(*) from uao_schema1_@orientation@.sto_uao_5;
 count 
-------
     5
(1 row)

-- Truncate, Drop table and index
CREATE TABLE sto_uao_6 (did integer,
    name varchar(40),
    CONSTRAINT con1 CHECK (did > 99 AND name <> '')
    ) with(appendonly=true) DISTRIBUTED RANDOMLY;
Create index heap6_idx on sto_uao_6(did);
insert into sto_uao_6 values (100, 'name_1');
insert into sto_uao_6 values (200, 'name_2');
update sto_uao_6 set name = 'new name';
insert into sto_uao_6 values (300, 'name_3');
select * from sto_uao_6 where did = 200;
 did |   name   
-----+----------
 200 | new name
(1 row)

Truncate sto_uao_6;
select count(*) from sto_uao_6;
 count 
-------
     0
(1 row)

insert into sto_uao_6 select i, 'name_'||i from generate_series(501,515)i;
delete from sto_uao_6 where did > 506;
select * from sto_uao_6 where did = 504;
 did |   name   
-----+----------
 504 | name_504
(1 row)

Drop index heap6_idx;
select * from sto_uao_6 where did = 502;
 did |   name   
-----+----------
 502 | name_502
(1 row)

-- Drop table cascade
CREATE TABLE sto_uao_7  (did integer,
    name varchar(40),
    CONSTRAINT con1 CHECK (did > 99 AND name <> '')
    ) with(appendonly=true) DISTRIBUTED RANDOMLY;
Create index heap6_idx on sto_uao_7(did);
create view v_sto_uao_7 as select * from sto_uao_7;
insert into sto_uao_7  values (100, 'name_1');
insert into sto_uao_7  values (200, 'name_2');
update sto_uao_7 set did = did + 20;
select * from v_sto_uao_7 order by did;
 did |  name  
-----+--------
 120 | name_1
 220 | name_2
(2 rows)

Drop table sto_uao_7 cascade;
NOTICE:  drop cascades to view v_sto_uao_7
-- Create table as select (CTAS)
create table sto_uao_8 with (appendonly=true) as select * from sto_uao_1
distributed by (col_int);
select count(*) from sto_uao_8;
 count 
-------
     6
(1 row)

update sto_uao_8 set col_text = col_text || ' new suffix';
select sum(length(col_text)) from sto_uao_8;
 sum 
-----
  86
(1 row)

-- Create table as select, with compression
create table sto_uao_9 with (appendonly=true, compresstype=zlib) as
 select * from sto_uao_8 distributed by (col_int);
select count(*) from sto_uao_9;
 count 
-------
     6
(1 row)

update sto_uao_9 set col_numeric = -col_numeric,
 col_text = col_text || ' new suffix';
select * from sto_uao_9;
 col_int |             col_text             | col_numeric | col_unq 
---------+----------------------------------+-------------+---------
       5 | aa new suffix new suffix         |       -1005 |     105
       6 | bb new suffix new suffix         |       -1006 |     106
       3 | aa new suffix new suffix         |       -1003 |     103
       4 | bb new suffix new suffix         |       -1004 |     104
       2 | bb new suffix new suffix         |       -1002 |     102
       1 |  new value new suffix new suffix |       -1001 |     101
(6 rows)

delete from sto_uao_9;
set gp_select_invisible=true;
select count(*) from sto_uao_9;
 count 
-------
    12
(1 row)

set gp_select_invisible=false;
SELECT 1 AS VisimapPresent FROM pg_appendonly WHERE visimaprelid is not NULL
 AND visimapidxid is not NULL AND relid='sto_uao_9'::regclass;
 visimappresent 
----------------
              1
(1 row)

-- Delete using join
delete from sto_uao_1 a using sto_uao_8 b
 where a.col_int = b.col_int;
select * from sto_uao_1;
 col_int | col_text | col_numeric | col_unq 
---------+----------+-------------+---------
(0 rows)

set gp_select_invisible=true;
select count(*) from sto_uao_1;
 count 
-------
     7
(1 row)

set gp_select_invisible=false;
-- Select into
select * into sto_heap_10 from sto_uao_8;
NOTICE:  Table doesn't have 'DISTRIBUTED BY' clause -- Using column(s) named 'col_int' as the Greenplum Database data distribution key for this table.
HINT:  The 'DISTRIBUTED BY' clause determines the distribution of data. Make sure column(s) chosen are the optimal data distribution key to minimize skew.
select count(*) from sto_heap_10;
 count 
-------
     6
(1 row)

COMMIT;
