-- @Description Tests that DML operatins change the modification count.
-- 

SELECT state, tupcount, modcount FROM gp_aoseg_name('ao');
state|tupcount|modcount
-----+--------+--------
1    |10      |1
(1 row)
INSERT INTO ao VALUES (11, 11);
INSERT 1
SELECT state, tupcount, modcount FROM gp_aoseg_name('ao');
state|tupcount|modcount
-----+--------+--------
1    |11      |2
(1 row)
DELETE FROM ao WHERE a = 11;
DELETE 1
SELECT state, tupcount, modcount FROM gp_aoseg_name('ao');
state|tupcount|modcount
-----+--------+--------
1    |11      |3
(1 row)
UPDATE AO SET b = 0 WHERE a = 10;
UPDATE 1
SELECT state, tupcount, modcount FROM gp_aoseg_name('ao');
state|tupcount|modcount
-----+--------+--------
1    |12      |4
(1 row)
