-- @Description The locks held after different operations
-- 

1: BEGIN;
BEGIN
1: INSERT INTO ao VALUES (200, 200);
INSERT 1
SELECT * FROM locktest;
coalesce                  |mode            |locktype
--------------------------+----------------+--------
ao                        |RowExclusiveLock|relation
ao                        |RowExclusiveLock|relation
locktest                  |AccessShareLock |relation
pg_class                  |AccessShareLock |relation
pg_class_oid_index        |AccessShareLock |relation
pg_class_relname_nsp_index|AccessShareLock |relation
pg_locks                  |AccessShareLock |relation
(7 rows)
2U: SELECT * FROM locktest;
coalesce                  |mode           |locktype
--------------------------+---------------+--------
locktest                  |AccessShareLock|relation
pg_class                  |AccessShareLock|relation
pg_class_oid_index        |AccessShareLock|relation
pg_class_relname_nsp_index|AccessShareLock|relation
pg_locks                  |AccessShareLock|relation
(5 rows)
1: COMMIT;
COMMIT
1: BEGIN;
BEGIN
1: DELETE FROM ao WHERE a = 1;
DELETE 1
SELECT * FROM locktest;
coalesce                  |mode            |locktype
--------------------------+----------------+--------
ao                        |ExclusiveLock   |relation
ao                        |RowExclusiveLock|relation
locktest                  |AccessShareLock |relation
pg_class                  |AccessShareLock |relation
pg_class_oid_index        |AccessShareLock |relation
pg_class_relname_nsp_index|AccessShareLock |relation
pg_locks                  |AccessShareLock |relation
(7 rows)
2U: SELECT * FROM locktest;
coalesce                  |mode            |locktype
--------------------------+----------------+--------
ao                        |RowExclusiveLock|relation
locktest                  |AccessShareLock |relation
pg_class                  |AccessShareLock |relation
pg_class_oid_index        |AccessShareLock |relation
pg_class_relname_nsp_index|AccessShareLock |relation
pg_locks                  |AccessShareLock |relation
(6 rows)
1: COMMIT;
COMMIT
1: BEGIN;
BEGIN
1: UPDATE ao SET b = -1 WHERE a = 2;
UPDATE 1
SELECT * FROM locktest;
coalesce                  |mode            |locktype
--------------------------+----------------+--------
ao                        |ExclusiveLock   |relation
ao                        |RowExclusiveLock|relation
locktest                  |AccessShareLock |relation
pg_class                  |AccessShareLock |relation
pg_class_oid_index        |AccessShareLock |relation
pg_class_relname_nsp_index|AccessShareLock |relation
pg_locks                  |AccessShareLock |relation
(7 rows)
2U: SELECT * FROM locktest;
coalesce                  |mode           |locktype
--------------------------+---------------+--------
locktest                  |AccessShareLock|relation
pg_class                  |AccessShareLock|relation
pg_class_oid_index        |AccessShareLock|relation
pg_class_relname_nsp_index|AccessShareLock|relation
pg_locks                  |AccessShareLock|relation
(5 rows)
1: COMMIT;
COMMIT

