-- @Description UAOCS MVCC readcommit and 2 updates on same row then rollback
--  Transaction 2 of 2
-- 
select pg_sleep(2);
 pg_sleep 
----------
 
(1 row)

insert into sto_uaocs_mvcc_status (workload, script) values('readcommit_concurrentupdate_rollback', 't2_update_one_tuple_rollback');
INSERT 0 1
begin;
BEGIN
set transaction isolation level READ COMMITTED;
SET
update sto_uaocs_emp_formvcc set sal = 11111.00 where sal = 18003.00 ;
UPDATE 1
select empno,ename from sto_uaocs_emp_formvcc where sal = 11111.00;
 empno | ename 
-------+-------
    16 | ROSE
(1 row)

commit;
COMMIT
update sto_uaocs_mvcc_status set endtime = CURRENT_TIMESTAMP 
where workload='readcommit_concurrentupdate_rollback' 
AND script='t2_update_one_tuple_rollback';
UPDATE 1
select empno,ename from sto_uaocs_emp_formvcc where sal = 11111.00;
 empno | ename 
-------+-------
    16 | ROSE
(1 row)

